src/kernels/gfx803_64.cd.pdb.txt
1-48-480-3x3-16-48-480-16-1x1-1x1-1x1-0-NCHW-FP32-F=ConvOclDirectFwd:8,16,16,32,2,1,8,1,2
16-48-480-3x3-1-48-480-16-1x1-1x1-1x1-0-NCHW-FP32-B=ConvOclDirectFwd:8,16,16,32,2,1,1,2,2
3-224-224-3x3-64-224-224-8-1x1-1x1-1x1-0-NCHW-FP32-F=ConvOclDirectFwd:8,16,16,32,2,1,8,1,2
64-224-224-3x3-3-224-224-8-1x1-1x1-1x1-0-NCHW-FP32-B=ConvOclDirectFwd:16,16,16,32,4,1,2,4,1
3-224-224-3x3-64-224-224-16-1x1-1x1-1x1-0-NCHW-FP32-F=ConvOclDirectFwd:8,16,16,32,2,1,8,1,2
64-224-224-3x3-3-224-224-16-1x1-1x1-1x1-0-NCHW-FP32-B=ConvOclDirectFwd:16,16,16,32,1,4,2,2,1
1-48-480-3x3-16-48-480-1-1x1-1x1-1x1-0-NCHW-FP32-F=ConvOclDirectFwd:8,16,16,32,1,2,8,1,1
16-48-480-3x3-1-48-480-1-1x1-1x1-1x1-0-NCHW-FP32-B=ConvOclDirectFwd:8,16,16,32,1,2,1,1,1
16-24-240-3x3-32-24-240-1-1x1-1x1-1x1-0-NCHW-FP32-F=ConvOclDirectFwd:8,16,32,32,1,4,4,2,1
3-224-224-3x3-64-224-224-1-1x1-1x1-1x1-0-NCHW-FP32-F=ConvOclDirectFwd:8,16,32,32,1,4,4,2,1
64-224-224-3x3-3-224-224-1-1x1-1x1-1x1-0-NCHW-FP32-B=ConvOclDirectFwd:8,16,32,32,4,1,2,2,1
3-224-224-3x3-64-224-224-2-1x1-1x1-1x1-0-NCHW-FP32-F=ConvOclDirectFwd:8,16,16,32,2,1,8,1,2
64-224-224-3x3-3-224-224-2-1x1-1x1-1x1-0-NCHW-FP32-B=ConvOclDirectFwd:16,16,16,16,2,1,2,4,1
32-149-149-3x3-3-299-299-32-0x0-2x2-1x1-0-NCHW-FP32-B=ConvOclDirectFwd:8,16,32,32,1,4,2,2,2
32-149-149-3x3-32-147-147-32-0x0-1x1-1x1-0-NCHW-FP32-F=ConvOclDirectFwd:8,16,16,32,1,2,8,2,1
32-147-147-3x3-32-149-149-32-0x0-1x1-1x1-0-NCHW-FP32-B=ConvOclDirectFwd:8,16,16,32,2,1,8,1,1
80-73-73-3x3-192-71-71-32-0x0-1x1-1x1-0-NCHW-FP32-F=ConvOclDirectFwd:16,16,16,16,4,2,4,4,1
192-71-71-3x3-80-73-73-32-0x0-1x1-1x1-0-NCHW-FP32-B=ConvOclDirectFwd:16,16,16,16,4,2,2,4,1
3-224-224-3x3-64-224-224-64-1x1-1x1-1x1-0-NCHW-FP32-F=ConvOclDirectFwd:8,16,16,32,2,1,8,1,2
64-224-224-3x3-3-224-224-64-1x1-1x1-1x1-0-NCHW-FP32-B=ConvOclDirectFwd:16,16,16,32,1,4,2,2,1
3-224-224-3x3-64-224-224-32-1x1-1x1-1x1-0-NCHW-FP32-F=ConvOclDirectFwd:8,16,16,32,2,1,8,1,2
64-224-224-3x3-3-224-224-32-1x1-1x1-1x1-0-NCHW-FP32-B=ConvOclDirectFwd:16,16,16,32,1,4,2,2,1
192-28-28-1x1-16-28-28-32-0x0-1x1-1x1-0-NCHW-FP32-F=ConvOclDirectFwd1x1:1,8,1,1,1,1,16,64,0
16-28-28-1x1-192-28-28-32-0x0-1x1-1x1-0-NCHW-FP32-B=ConvOclDirectFwd1x1:1,128,1,1,0,1,16,4,0
192-28-28-1x1-32-28-28-32-0x0-1x1-1x1-0-NCHW-FP32-F=ConvOclDirectFwd1x1:1,8,1,1,1,1,16,2048,0
32-28-28-1x1-192-28-28-32-0x0-1x1-1x1-0-NCHW-FP32-B=ConvOclDirectFwd1x1:1,128,1,1,0,2,16,4,0
192-28-28-1x1-64-28-28-32-0x0-1x1-1x1-0-NCHW-FP32-F=ConvOclDirectFwd1x1:1,8,1,1,1,1,16,2048,0
64-28-28-1x1-192-28-28-32-0x0-1x1-1x1-0-NCHW-FP32-B=ConvOclDirectFwd1x1:1,128,1,1,0,1,32,4,0
192-28-28-1x1-96-28-28-32-0x0-1x1-1x1-0-NCHW-FP32-F=ConvOclDirectFwd1x1:1,8,1,1,1,4,16,256,0
96-28-28-1x1-192-28-28-32-0x0-1x1-1x1-0-NCHW-FP32-B=ConvOclDirectFwd1x1:1,128,1,1,0,1,32,4,0
256-28-28-1x1-128-28-28-32-0x0-1x1-1x1-0-NCHW-FP32-F=ConvOclDirectFwd1x1:1,8,1,1,1,1,16,2048,0
128-28-28-1x1-256-28-28-32-0x0-1x1-1x1-0-NCHW-FP32-B=ConvOclDirectFwd1x1:1,128,1,1,0,1,32,4,0
256-28-28-1x1-32-28-28-32-0x0-1x1-1x1-0-NCHW-FP32-F=ConvOclDirectFwd1x1:1,8,1,1,1,1,16,2048,0
32-28-28-1x1-256-28-28-32-0x0-1x1-1x1-0-NCHW-FP32-B=ConvOclDirectFwd1x1:1,128,1,1,0,2,16,4,0
256-28-28-1x1-64-28-28-32-0x0-1x1-1x1-0-NCHW-FP32-F=ConvOclDirectFwd1x1:1,8,1,1,1,4,16,2048,0
64-28-28-1x1-256-28-28-32-0x0-1x1-1x1-0-NCHW-FP32-B=ConvOclDirectFwd1x1:1,64,1,1,0,1,32,4,0
64-112-112-7x7-3-225-225-32-2x2-2x2-1x1-0-NCHW-FP32-B=ConvOclDirectFwd:8,16,32,32,1,4,2,4,2
480-14-14-1x1-16-14-14-32-0x0-1x1-1x1-0-NCHW-FP32-F=ConvOclDirectFwd1x1:16,16,16,16,1,1,2,3,1
16-14-14-1x1-480-14-14-32-0x0-1x1-1x1-0-NCHW-FP32-B=ConvOclDirectFwd1x1:1,64,1,1,0,2,16,4,0
480-14-14-1x1-192-14-14-32-0x0-1x1-1x1-0-NCHW-FP32-F=ConvOclDirectFwd1x1:1,8,1,1,1,1,16,2048,0
192-14-14-1x1-480-14-14-32-0x0-1x1-1x1-0-NCHW-FP32-B=ConvOclDirectFwd1x1:1,64,1,1,0,2,16,4,0
480-14-14-1x1-64-14-14-32-0x0-1x1-1x1-0-NCHW-FP32-F=ConvOclDirectFwd1x1:1,8,1,1,1,1,16,256,0
64-14-14-1x1-480-14-14-32-0x0-1x1-1x1-0-NCHW-FP32-B=ConvOclDirectFwd1x1:1,64,1,1,0,4,16,4,0
480-14-14-1x1-96-14-14-32-0x0-1x1-1x1-0-NCHW-FP32-F=ConvOclDirectFwd1x1:1,8,1,1,1,1,16,256,0
96-14-14-1x1-480-14-14-32-0x0-1x1-1x1-0-NCHW-FP32-B=ConvOclDirectFwd1x1:1,64,1,1,0,2,16,4,0
512-14-14-1x1-112-14-14-32-0x0-1x1-1x1-0-NCHW-FP32-F=ConvOclDirectFwd1x1:1,8,1,1,1,1,16,2048,0
112-14-14-1x1-512-14-14-32-0x0-1x1-1x1-0-NCHW-FP32-B=ConvOclDirectFwd1x1:1,64,1,1,0,1,16,4,0
512-14-14-1x1-128-14-14-32-0x0-1x1-1x1-0-NCHW-FP32-F=ConvOclDirectFwd1x1:1,8,1,1,1,4,16,2048,0
128-14-14-1x1-512-14-14-32-0x0-1x1-1x1-0-NCHW-FP32-B=ConvOclDirectFwd1x1:1,64,1,1,0,1,16,4,0
512-14-14-1x1-144-14-14-32-0x0-1x1-1x1-0-NCHW-FP32-F=ConvOclDirectFwd1x1:1,8,1,1,1,1,32,2048,0
144-14-14-1x1-512-14-14-32-0x0-1x1-1x1-0-NCHW-FP32-B=ConvOclDirectFwd1x1:1,64,1,1,0,1,16,4,0
512-14-14-1x1-160-14-14-32-0x0-1x1-1x1-0-NCHW-FP32-F=ConvOclDirectFwd1x1:1,8,1,1,1,1,16,2048,0
160-14-14-1x1-512-14-14-32-0x0-1x1-1x1-0-NCHW-FP32-B=ConvOclDirectFwd1x1:1,64,1,1,0,1,16,4,0
512-14-14-1x1-24-14-14-32-0x0-1x1-1x1-0-NCHW-FP32-F=ConvOclDirectFwd1x1:1,128,1,1,0,1,16,8,0
24-14-14-1x1-512-14-14-32-0x0-1x1-1x1-0-NCHW-FP32-B=ConvOclDirectFwd1x1:1,128,1,1,0,1,16,4,0
512-14-14-1x1-32-14-14-32-0x0-1x1-1x1-0-NCHW-FP32-F=ConvOclDirectFwd1x1:1,8,1,1,1,0,16,128,0
32-14-14-1x1-512-14-14-32-0x0-1x1-1x1-0-NCHW-FP32-B=ConvOclDirectFwd1x1:1,128,1,1,0,2,16,4,0
512-14-14-1x1-64-14-14-32-0x0-1x1-1x1-0-NCHW-FP32-F=ConvOclDirectFwd1x1:1,8,1,1,1,4,16,256,0
64-14-14-1x1-512-14-14-32-0x0-1x1-1x1-0-NCHW-FP32-B=ConvOclDirectFwd1x1:1,128,1,1,0,1,16,4,0
528-14-14-1x1-128-14-14-32-0x0-1x1-1x1-0-NCHW-FP32-F=ConvOclDirectFwd1x1:1,8,1,1,1,0,16,256,0
128-14-14-1x1-528-14-14-32-0x0-1x1-1x1-0-NCHW-FP32-B=ConvOclDirectFwd1x1:1,64,1,1,0,1,16,4,0
528-14-14-1x1-160-14-14-32-0x0-1x1-1x1-0-NCHW-FP32-F=ConvOclDirectFwd1x1:1,8,1,1,1,1,16,2048,0
160-14-14-1x1-528-14-14-32-0x0-1x1-1x1-0-NCHW-FP32-B=ConvOclDirectFwd1x1:1,64,1,1,0,1,16,4,0
528-14-14-1x1-256-14-14-32-0x0-1x1-1x1-0-NCHW-FP32-F=ConvOclDirectFwd1x1:1,8,1,1,1,0,16,256,0
256-14-14-1x1-528-14-14-32-0x0-1x1-1x1-0-NCHW-FP32-B=ConvOclDirectFwd1x1:1,64,1,1,0,1,16,4,0
528-14-14-1x1-32-14-14-32-0x0-1x1-1x1-0-NCHW-FP32-F=ConvOclDirectFwd1x1:1,8,1,1,1,1,16,128,0
32-14-14-1x1-528-14-14-32-0x0-1x1-1x1-0-NCHW-FP32-B=ConvOclDirectFwd1x1:1,128,1,1,0,1,16,4,0
64-56-56-1x1-64-56-56-32-0x0-1x1-1x1-0-NCHW-FP32-F=ConvOclDirectFwd1x1:1,8,1,1,1,0,16,2048,0
64-56-56-1x1-64-56-56-32-0x0-1x1-1x1-0-NCHW-FP32-B=ConvOclDirectFwd1x1:1,64,1,1,0,1,32,4,0
832-7-7-1x1-128-7-7-32-0x0-1x1-1x1-0-NCHW-FP32-F=ConvOclDirectFwd1x1:1,8,1,1,1,0,16,128,0
128-7-7-1x1-832-7-7-32-0x0-1x1-1x1-0-NCHW-FP32-B=ConvOclDirectFwd1x1:1,64,1,1,0,1,16,4,0
832-7-7-1x1-160-7-7-32-0x0-1x1-1x1-0-NCHW-FP32-F=ConvOclDirectFwd1x1:1,8,1,1,1,4,16,256,0
160-7-7-1x1-832-7-7-32-0x0-1x1-1x1-0-NCHW-FP32-B=ConvOclDirectFwd1x1:1,64,1,1,0,1,16,4,0
832-7-7-1x1-192-7-7-32-0x0-1x1-1x1-0-NCHW-FP32-F=ConvOclDirectFwd1x1:1,8,1,1,1,4,16,256,0
192-7-7-1x1-832-7-7-32-0x0-1x1-1x1-0-NCHW-FP32-B=ConvOclDirectFwd1x1:1,64,1,1,0,1,16,4,0
832-7-7-1x1-256-7-7-32-0x0-1x1-1x1-0-NCHW-FP32-F=ConvOclDirectFwd1x1:1,8,1,1,1,0,16,256,0
256-7-7-1x1-832-7-7-32-0x0-1x1-1x1-0-NCHW-FP32-B=ConvOclDirectFwd1x1:1,64,1,1,0,1,16,4,0
832-7-7-1x1-32-7-7-32-0x0-1x1-1x1-0-NCHW-FP32-F=ConvOclDirectFwd1x1:1,8,1,1,1,4,16,64,0
32-7-7-1x1-832-7-7-32-0x0-1x1-1x1-0-NCHW-FP32-B=ConvOclDirectFwd1x1:1,64,1,1,0,1,16,4,0
832-7-7-1x1-384-7-7-32-0x0-1x1-1x1-0-NCHW-FP32-F=ConvOclDirectFwd1x1:1,8,1,1,1,0,16,256,0
384-7-7-1x1-832-7-7-32-0x0-1x1-1x1-0-NCHW-FP32-B=ConvOclDirectFwd1x1:1,64,1,1,0,1,16,4,0
832-7-7-1x1-48-7-7-32-0x0-1x1-1x1-0-NCHW-FP32-F=ConvOclDirectFwd1x1:1,8,1,1,1,1,16,128,0
48-7-7-1x1-832-7-7-32-0x0-1x1-1x1-0-NCHW-FP32-B=ConvOclDirectFwd1x1:1,64,1,1,0,1,16,4,0
1280-8-8-1x1-192-8-8-32-0x0-1x1-1x1-0-NCHW-FP32-F=ConvOclDirectFwd1x1:1,8,1,1,1,0,16,256,0
192-8-8-1x1-1280-8-8-32-0x0-1x1-1x1-0-NCHW-FP32-B=ConvOclDirectFwd1x1:1,64,1,1,0,1,16,4,0
1280-8-8-1x1-320-8-8-32-0x0-1x1-1x1-0-NCHW-FP32-F=ConvOclDirectFwd1x1:1,8,1,1,1,1,16,2048,0
320-8-8-1x1-1280-8-8-32-0x0-1x1-1x1-0-NCHW-FP32-B=ConvOclDirectFwd1x1:1,64,1,1,0,1,16,4,0
1280-8-8-1x1-384-8-8-32-0x0-1x1-1x1-0-NCHW-FP32-F=ConvOclDirectFwd1x1:1,8,1,1,1,1,16,2048,0
384-8-8-1x1-1280-8-8-32-0x0-1x1-1x1-0-NCHW-FP32-B=ConvOclDirectFwd1x1:1,64,1,1,0,1,16,4,0
1280-8-8-1x1-448-8-8-32-0x0-1x1-1x1-0-NCHW-FP32-F=ConvOclDirectFwd1x1:1,8,1,1,1,1,16,2048,0
448-8-8-1x1-1280-8-8-32-0x0-1x1-1x1-0-NCHW-FP32-B=ConvOclDirectFwd1x1:1,64,1,1,0,1,16,4,0
192-35-35-1x1-32-35-35-32-0x0-1x1-1x1-0-NCHW-FP32-F=ConvOclDirectFwd1x1:1,8,1,1,1,4,16,2048,0
32-35-35-1x1-192-35-35-32-0x0-1x1-1x1-0-NCHW-FP32-B=ConvOclDirectFwd1x1:1,64,1,1,0,1,32,4,0
192-35-35-1x1-48-35-35-32-0x0-1x1-1x1-0-NCHW-FP32-F=ConvOclDirectFwd1x1:1,8,1,1,1,1,16,2048,0
48-35-35-1x1-192-35-35-32-0x0-1x1-1x1-0-NCHW-FP32-B=ConvOclDirectFwd1x1:1,128,1,1,0,1,32,4,0
192-35-35-1x1-64-35-35-32-0x0-1x1-1x1-0-NCHW-FP32-F=ConvOclDirectFwd1x1:1,8,1,1,1,0,16,2048,0
64-35-35-1x1-192-35-35-32-0x0-1x1-1x1-0-NCHW-FP32-B=ConvOclDirectFwd1x1:1,64,1,1,0,1,32,4,0
2048-8-8-1x1-192-8-8-32-0x0-1x1-1x1-0-NCHW-FP32-F=ConvOclDirectFwd1x1:1,8,1,1,1,1,16,256,0
192-8-8-1x1-2048-8-8-32-0x0-1x1-1x1-0-NCHW-FP32-B=ConvOclDirectFwd1x1:1,64,1,1,0,1,16,4,0
2048-8-8-1x1-320-8-8-32-0x0-1x1-1x1-0-NCHW-FP32-F=ConvOclDirectFwd1x1:1,8,1,1,1,1,16,256,0
320-8-8-1x1-2048-8-8-32-0x0-1x1-1x1-0-NCHW-FP32-B=ConvOclDirectFwd1x1:1,64,1,1,0,1,16,4,0
2048-8-8-1x1-384-8-8-32-0x0-1x1-1x1-0-NCHW-FP32-F=ConvOclDirectFwd1x1:1,8,1,1,1,1,16,256,0
384-8-8-1x1-2048-8-8-32-0x0-1x1-1x1-0-NCHW-FP32-B=ConvOclDirectFwd1x1:1,64,1,1,0,1,16,4,0
2048-8-8-1x1-448-8-8-32-0x0-1x1-1x1-0-NCHW-FP32-F=ConvOclDirectFwd1x1:1,8,1,1,1,1,16,2048,0
448-8-8-1x1-2048-8-8-32-0x0-1x1-1x1-0-NCHW-FP32-B=ConvOclDirectFwd1x1:1,64,1,1,0,1,16,4,0
256-35-35-1x1-48-35-35-32-0x0-1x1-1x1-0-NCHW-FP32-F=ConvOclDirectFwd1x1:1,8,1,1,1,1,16,256,0
48-35-35-1x1-256-35-35-32-0x0-1x1-1x1-0-NCHW-FP32-B=ConvOclDirectFwd1x1:1,64,1,1,0,1,32,4,0
256-35-35-1x1-64-35-35-32-0x0-1x1-1x1-0-NCHW-FP32-F=ConvOclDirectFwd1x1:1,8,1,1,1,4,16,2048,0
64-35-35-1x1-256-35-35-32-0x0-1x1-1x1-0-NCHW-FP32-B=ConvOclDirectFwd1x1:1,64,1,1,0,1,32,4,0
288-35-35-1x1-48-35-35-32-0x0-1x1-1x1-0-NCHW-FP32-F=ConvOclDirectFwd1x1:1,8,1,1,1,1,32,2048,0
48-35-35-1x1-288-35-35-32-0x0-1x1-1x1-0-NCHW-FP32-B=ConvOclDirectFwd1x1:1,64,1,1,0,1,32,4,0
288-35-35-1x1-64-35-35-32-0x0-1x1-1x1-0-NCHW-FP32-F=ConvOclDirectFwd1x1:1,8,1,1,1,0,16,2048,0
64-35-35-1x1-288-35-35-32-0x0-1x1-1x1-0-NCHW-FP32-B=ConvOclDirectFwd1x1:1,64,1,1,0,1,32,4,0
48-35-35-5x5-64-35-35-32-2x2-1x1-1x1-0-NCHW-FP32-F=ConvOclDirectFwd:8,16,16,32,2,1,8,1,2
64-35-35-5x5-48-35-35-32-2x2-1x1-1x1-0-NCHW-FP32-B=ConvOclDirectFwd:16,16,16,16,4,2,2,4,1
64-73-73-1x1-80-73-73-32-0x0-1x1-1x1-0-NCHW-FP32-F=ConvOclDirectFwd1x1:1,8,1,1,1,0,32,2048,0
80-73-73-1x1-64-73-73-32-0x0-1x1-1x1-0-NCHW-FP32-B=ConvOclDirectFwd1x1:1,64,1,1,0,1,32,4,0
768-17-17-1x1-128-17-17-32-0x0-1x1-1x1-0-NCHW-FP32-F=ConvOclDirectFwd1x1:1,8,1,1,1,1,16,2048,0
128-17-17-1x1-768-17-17-32-0x0-1x1-1x1-0-NCHW-FP32-B=ConvOclDirectFwd1x1:1,64,1,1,0,1,16,4,0
768-17-17-1x1-160-17-17-32-0x0-1x1-1x1-0-NCHW-FP32-F=ConvOclDirectFwd1x1:1,8,1,1,1,1,16,2048,0
160-17-17-1x1-768-17-17-32-0x0-1x1-1x1-0-NCHW-FP32-B=ConvOclDirectFwd1x1:1,128,1,1,0,1,32,4,0
768-17-17-1x1-192-17-17-32-0x0-1x1-1x1-0-NCHW-FP32-F=ConvOclDirectFwd1x1:1,8,1,1,1,1,16,2048,0
192-17-17-1x1-768-17-17-32-0x0-1x1-1x1-0-NCHW-FP32-B=ConvOclDirectFwd1x1:1,128,1,1,0,1,32,4,0
1024-17-17-1x1-128-17-17-32-0x0-1x1-1x1-0-NCHW-FP32-F=ConvOclDirectFwd1x1:1,8,1,1,1,1,16,2048,0
128-17-17-1x1-1024-17-17-32-0x0-1x1-1x1-0-NCHW-FP32-B=ConvOclDirectFwd1x1:1,64,1,1,0,1,16,4,0
1024-17-17-1x1-192-17-17-32-0x0-1x1-1x1-0-NCHW-FP32-F=ConvOclDirectFwd1x1:1,8,1,1,1,1,16,2048,0
192-17-17-1x1-1024-17-17-32-0x0-1x1-1x1-0-NCHW-FP32-B=ConvOclDirectFwd1x1:1,128,1,1,0,1,32,4,0
1024-17-17-1x1-256-17-17-32-0x0-1x1-1x1-0-NCHW-FP32-F=ConvOclDirectFwd1x1:1,8,1,1,1,0,16,2048,0
256-17-17-1x1-1024-17-17-32-0x0-1x1-1x1-0-NCHW-FP32-B=ConvOclDirectFwd1x1:1,128,1,1,0,1,32,4,0
1024-17-17-1x1-384-17-17-32-0x0-1x1-1x1-0-NCHW-FP32-F=ConvOclDirectFwd1x1:1,8,1,1,1,1,32,2048,0
384-17-17-1x1-1024-17-17-32-0x0-1x1-1x1-0-NCHW-FP32-B=ConvOclDirectFwd1x1:1,128,1,1,0,1,32,4,0
1536-8-8-1x1-256-8-8-32-0x0-1x1-1x1-0-NCHW-FP32-F=ConvOclDirectFwd1x1:1,8,1,1,1,4,16,256,0
256-8-8-1x1-1536-8-8-32-0x0-1x1-1x1-0-NCHW-FP32-B=ConvOclDirectFwd1x1:1,128,1,1,0,4,16,8,0
1536-8-8-1x1-384-8-8-32-0x0-1x1-1x1-0-NCHW-FP32-F=ConvOclDirectFwd1x1:1,8,1,1,1,1,16,256,0
384-8-8-1x1-1536-8-8-32-0x0-1x1-1x1-0-NCHW-FP32-B=ConvOclDirectFwd1x1:1,64,1,1,0,1,16,4,0
160-73-73-1x1-64-73-73-32-0x0-1x1-1x1-0-NCHW-FP32-F=ConvOclDirectFwd1x1:1,8,1,1,1,0,16,2048,0
64-73-73-1x1-160-73-73-32-0x0-1x1-1x1-0-NCHW-FP32-B=ConvOclDirectFwd1x1:1,128,1,1,0,1,32,4,0
384-35-35-1x1-192-35-35-32-0x0-1x1-1x1-0-NCHW-FP32-F=ConvOclDirectFwd1x1:1,8,1,1,1,4,16,2048,0
192-35-35-1x1-384-35-35-32-0x0-1x1-1x1-0-NCHW-FP32-B=ConvOclDirectFwd1x1:1,128,1,1,0,1,32,4,0
384-35-35-1x1-64-35-35-32-0x0-1x1-1x1-0-NCHW-FP32-F=ConvOclDirectFwd1x1:1,8,1,1,1,4,16,2048,0
64-35-35-1x1-384-35-35-32-0x0-1x1-1x1-0-NCHW-FP32-B=ConvOclDirectFwd1x1:1,128,1,1,0,1,32,4,0
384-35-35-1x1-96-35-35-32-0x0-1x1-1x1-0-NCHW-FP32-F=ConvOclDirectFwd1x1:1,8,1,1,1,1,16,2048,0
96-35-35-1x1-384-35-35-32-0x0-1x1-1x1-0-NCHW-FP32-B=ConvOclDirectFwd1x1:1,128,1,1,0,1,32,4,0
64-73-73-3x3-96-71-71-32-0x0-1x1-1x1-0-NCHW-FP32-F=ConvOclDirectFwd:16,16,16,16,4,2,4,4,1
96-71-71-3x3-64-73-73-32-0x0-1x1-1x1-0-NCHW-FP32-B=ConvOclDirectFwd:16,16,16,16,4,4,2,4,1
1024-14-14-1x1-2048-7-7-64-0x0-2x2-1x1-0-NCHW-FP32-F=ConvOclDirectFwd1x1:1,256,1,1,0,1,32,4,0
2048-7-7-1x1-1024-14-14-64-0x0-2x2-1x1-0-NCHW-FP32-B=ConvOclDirectFwd1x1:1,256,1,1,0,1,32,4,0
1024-14-14-1x1-256-14-14-64-0x0-1x1-1x1-0-NCHW-FP32-F=ConvOclDirectFwd1x1:1,8,1,1,1,4,16,2048,0
256-14-14-1x1-1024-14-14-64-0x0-1x1-1x1-0-NCHW-FP32-B=ConvOclDirectFwd1x1:1,128,1,1,0,4,16,4,0
1024-14-14-1x1-512-7-7-64-0x0-2x2-1x1-0-NCHW-FP32-F=ConvOclDirectFwd1x1:1,256,1,1,0,1,32,4,0
512-7-7-1x1-1024-14-14-64-0x0-2x2-1x1-0-NCHW-FP32-B=ConvOclDirectFwd1x1:1,256,1,1,0,1,32,4,0
128-28-28-3x3-128-28-28-64-1x1-1x1-1x1-0-NCHW-FP32-W=ConvAsmBwdWrW3x3:8,0,8,2,4,1
128-28-28-1x1-512-28-28-64-0x0-1x1-1x1-0-NCHW-FP32-F=ConvOclDirectFwd1x1:1,8,1,1,1,4,16,256,0
512-28-28-1x1-128-28-28-64-0x0-1x1-1x1-0-NCHW-FP32-B=ConvOclDirectFwd1x1:1,128,1,1,0,1,32,4,0
2048-7-7-1x1-512-7-7-64-0x0-1x1-1x1-0-NCHW-FP32-F=ConvOclDirectFwd1x1:1,8,1,1,1,1,32,2048,0
512-7-7-1x1-2048-7-7-64-0x0-1x1-1x1-0-NCHW-FP32-B=ConvOclDirectFwd1x1:1,128,1,1,0,1,32,4,0
256-14-14-1x1-1024-14-14-64-0x0-1x1-1x1-0-NCHW-FP32-F=ConvOclDirectFwd1x1:1,8,1,1,1,0,16,2048,0
1024-14-14-1x1-256-14-14-64-0x0-1x1-1x1-0-NCHW-FP32-B=ConvOclDirectFwd1x1:1,128,1,1,0,4,16,4,0
256-14-14-3x3-256-14-14-64-1x1-1x1-1x1-0-NCHW-FP32-W=ConvAsmBwdWrW3x3:8,0,8,4,4,1
256-55-55-1x1-128-28-28-64-0x0-2x2-1x1-0-NCHW-FP32-F=ConvOclDirectFwd1x1:1,256,1,1,0,2,32,4,0
128-28-28-1x1-256-55-55-64-0x0-2x2-1x1-0-NCHW-FP32-B=ConvOclDirectFwd1x1:1,256,1,1,0,1,32,4,0
256-55-55-1x1-512-28-28-64-0x0-2x2-1x1-0-NCHW-FP32-F=ConvOclDirectFwd1x1:1,256,1,1,0,1,32,4,0
512-28-28-1x1-256-55-55-64-0x0-2x2-1x1-0-NCHW-FP32-B=ConvOclDirectFwd1x1:1,256,1,1,0,1,32,4,0
256-55-55-1x1-64-55-55-64-0x0-1x1-1x1-0-NCHW-FP32-F=ConvOclDirectFwd1x1:1,8,1,1,1,4,16,2048,0
64-55-55-1x1-256-55-55-64-0x0-1x1-1x1-0-NCHW-FP32-B=ConvOclDirectFwd1x1:1,256,1,1,0,1,32,4,0
64-112-112-7x7-3-230-230-64-0x0-2x2-1x1-0-NCHW-FP32-B=ConvOclDirectFwd:8,16,32,32,2,2,2,1,1
512-28-28-1x1-1024-14-14-64-0x0-2x2-1x1-0-NCHW-FP32-F=ConvOclDirectFwd1x1:1,256,1,1,0,2,32,4,0
1024-14-14-1x1-512-28-28-64-0x0-2x2-1x1-0-NCHW-FP32-B=ConvOclDirectFwd1x1:1,128,1,1,0,1,32,4,0
512-28-28-1x1-128-28-28-64-0x0-1x1-1x1-0-NCHW-FP32-F=ConvOclDirectFwd1x1:1,8,1,1,1,4,16,2048,0
128-28-28-1x1-512-28-28-64-0x0-1x1-1x1-0-NCHW-FP32-B=ConvOclDirectFwd1x1:1,256,1,1,0,1,32,4,0
512-28-28-1x1-256-14-14-64-0x0-2x2-1x1-0-NCHW-FP32-F=ConvOclDirectFwd1x1:1,256,1,1,0,2,32,4,0
256-14-14-1x1-512-28-28-64-0x0-2x2-1x1-0-NCHW-FP32-B=ConvOclDirectFwd1x1:1,256,1,1,0,1,32,4,0
512-7-7-1x1-2048-7-7-64-0x0-1x1-1x1-0-NCHW-FP32-F=ConvOclDirectFwd1x1:1,8,1,1,1,4,16,2048,0
2048-7-7-1x1-512-7-7-64-0x0-1x1-1x1-0-NCHW-FP32-B=ConvOclDirectFwd1x1:1,256,1,1,0,1,16,4,0
512-7-7-3x3-512-7-7-64-1x1-1x1-1x1-0-NCHW-FP32-W=ConvAsmBwdWrW3x3:7,1,8,2,7,1
64-55-55-1x1-256-55-55-64-0x0-1x1-1x1-0-NCHW-FP32-F=ConvOclDirectFwd1x1:1,8,1,1,1,1,32,128,0
256-55-55-1x1-64-55-55-64-0x0-1x1-1x1-0-NCHW-FP32-B=ConvOclDirectFwd1x1:1,256,1,1,0,1,32,4,0
64-55-55-1x1-64-55-55-64-0x0-1x1-1x1-0-NCHW-FP32-F=ConvOclDirectFwd1x1:1,8,1,1,1,0,32,2048,0
64-55-55-1x1-64-55-55-64-0x0-1x1-1x1-0-NCHW-FP32-B=ConvOclDirectFwd1x1:1,256,1,1,0,1,32,4,0
64-55-55-3x3-64-55-55-64-1x1-1x1-1x1-0-NCHW-FP32-W=ConvAsmBwdWrW3x3:7,1,16,4,3,4
16-48-480-3x3-1-48-480-16-1x1-1x1-1x1-0-NCHW-FP32-W=ConvAsmBwdWrW3x3:0,1,16,1,1,4
64-12-120-3x3-32-12-120-16-1x1-1x1-1x1-0-NCHW-FP32-W=ConvAsmBwdWrW3x3:6,0,16,2,2,2
128-6-60-3x3-64-6-60-16-1x1-1x1-1x1-0-NCHW-FP32-W=ConvAsmBwdWrW3x3:4,0,16,2,3,1
64-54-54-3x3-64-54-54-8-1x1-1x1-1x1-0-NCHW-FP32-W=ConvAsmBwdWrW3x3:9,0,16,2,2,2
128-27-27-3x3-128-27-27-8-1x1-1x1-1x1-0-NCHW-FP32-W=ConvAsmBwdWrW3x3:8,0,8,2,3,1
256-14-14-3x3-128-14-14-8-1x1-1x1-1x1-0-NCHW-FP32-W=ConvAsmBwdWrW3x3:0,0,8,2,3,1
512-7-7-3x3-256-7-7-8-1x1-1x1-1x1-0-NCHW-FP32-W=ConvAsmBwdWrW3x3:6,0,8,4,7,1
64-224-224-3x3-3-224-224-8-1x1-1x1-1x1-0-NCHW-FP32-W=ConvAsmBwdWrW3x3:6,1,16,1,2,4
128-112-112-3x3-64-112-112-8-1x1-1x1-1x1-0-NCHW-FP32-W=ConvAsmBwdWrW3x3:3,1,16,4,2,4
256-56-56-3x3-128-56-56-8-1x1-1x1-1x1-0-NCHW-FP32-W=ConvAsmBwdWrW3x3:3,0,16,4,2,1
512-28-28-3x3-256-28-28-8-1x1-1x1-1x1-0-NCHW-FP32-W=ConvAsmBwdWrW3x3:9,1,8,2,3,1
512-14-14-3x3-512-14-14-8-1x1-1x1-1x1-0-NCHW-FP32-W=ConvAsmBwdWrW3x3:9,1,8,4,3,1
512-7-7-3x3-512-7-7-8-1x1-1x1-1x1-0-NCHW-FP32-W=ConvAsmBwdWrW3x3:8,0,8,2,7,1
64-224-224-3x3-3-224-224-16-1x1-1x1-1x1-0-NCHW-FP32-W=ConvAsmBwdWrW3x3:5,1,16,1,2,4
128-112-112-3x3-64-112-112-16-1x1-1x1-1x1-0-NCHW-FP32-W=ConvAsmBwdWrW3x3:5,0,16,4,2,4
256-56-56-3x3-128-56-56-16-1x1-1x1-1x1-0-NCHW-FP32-W=ConvAsmBwdWrW3x3:9,0,16,4,2,1
512-28-28-3x3-256-28-28-16-1x1-1x1-1x1-0-NCHW-FP32-W=ConvAsmBwdWrW3x3:8,1,8,2,3,1
512-14-14-3x3-512-14-14-16-1x1-1x1-1x1-0-NCHW-FP32-W=ConvAsmBwdWrW3x3:8,1,8,4,4,1
512-7-7-3x3-512-7-7-16-1x1-1x1-1x1-0-NCHW-FP32-W=ConvAsmBwdWrW3x3:0,1,8,2,7,1
64-56-56-3x3-64-56-56-8-1x1-1x1-1x1-0-NCHW-FP32-W=ConvAsmBwdWrW3x3:8,0,16,2,4,2
128-28-28-3x3-128-28-28-8-1x1-1x1-1x1-0-NCHW-FP32-W=ConvAsmBwdWrW3x3:7,0,8,2,4,1
256-14-14-3x3-256-14-14-8-1x1-1x1-1x1-0-NCHW-FP32-W=ConvAsmBwdWrW3x3:6,0,8,4,3,1
64-56-56-3x3-64-56-56-16-1x1-1x1-1x1-0-NCHW-FP32-W=ConvAsmBwdWrW3x3:5,0,16,2,3,1
128-28-28-3x3-128-28-28-16-1x1-1x1-1x1-0-NCHW-FP32-W=ConvAsmBwdWrW3x3:6,0,8,2,4,1
256-14-14-3x3-256-14-14-16-1x1-1x1-1x1-0-NCHW-FP32-W=ConvAsmBwdWrW3x3:9,0,8,4,3,1
64-80-350-3x3-64-80-350-16-1x1-1x1-1x1-0-NCHW-FP32-W=ConvAsmBwdWrW3x3:8,0,16,2,2,1
128-40-175-3x3-128-40-175-16-1x1-1x1-1x1-0-NCHW-FP32-W=ConvAsmBwdWrW3x3:3,0,16,4,2,1
256-20-84-3x3-256-20-84-16-1x1-1x1-1x1-0-NCHW-FP32-W=ConvAsmBwdWrW3x3:9,0,16,4,2,1
512-10-42-3x3-512-10-42-16-1x1-1x1-1x1-0-NCHW-FP32-W=ConvAsmBwdWrW3x3:0,0,8,4,2,1
16-48-480-3x3-1-48-480-1-1x1-1x1-1x1-0-NCHW-FP32-W=ConvAsmBwdWrW3x3:1,1,16,1,2,1
32-24-240-3x3-16-24-240-1-1x1-1x1-1x1-0-NCHW-FP32-W=ConvAsmBwdWrW3x3:7,0,16,1,2,1
64-12-120-3x3-32-12-120-1-1x1-1x1-1x1-0-NCHW-FP32-W=ConvAsmBwdWrW3x3:0,0,16,1,3,1
128-6-60-3x3-64-6-60-1-1x1-1x1-1x1-0-NCHW-FP32-W=ConvAsmBwdWrW3x3:9,0,16,2,3,1
64-54-54-3x3-64-54-54-1-1x1-1x1-1x1-0-NCHW-FP32-W=ConvAsmBwdWrW3x3:5,0,16,2,2,1
128-27-27-3x3-128-27-27-1-1x1-1x1-1x1-0-NCHW-FP32-W=ConvAsmBwdWrW3x3:9,0,8,2,2,1
256-14-14-3x3-128-14-14-1-1x1-1x1-1x1-0-NCHW-FP32-W=ConvAsmBwdWrW3x3:8,0,8,2,2,1
512-7-7-3x3-256-7-7-1-1x1-1x1-1x1-0-NCHW-FP32-W=ConvAsmBwdWrW3x3:4,1,8,2,7,1
64-224-224-3x3-3-224-224-1-1x1-1x1-1x1-0-NCHW-FP32-W=ConvAsmBwdWrW3x3:4,1,16,1,2,1
128-112-112-3x3-64-112-112-1-1x1-1x1-1x1-0-NCHW-FP32-W=ConvAsmBwdWrW3x3:9,0,16,2,2,1
256-56-56-3x3-128-56-56-1-1x1-1x1-1x1-0-NCHW-FP32-W=ConvAsmBwdWrW3x3:4,0,8,2,2,1
512-28-28-3x3-256-28-28-1-1x1-1x1-1x1-0-NCHW-FP32-W=ConvAsmBwdWrW3x3:6,1,8,2,2,1
512-14-14-3x3-512-14-14-1-1x1-1x1-1x1-0-NCHW-FP32-W=ConvAsmBwdWrW3x3:8,0,8,2,7,1
512-7-7-3x3-512-7-7-1-1x1-1x1-1x1-0-NCHW-FP32-W=ConvAsmBwdWrW3x3:6,0,8,2,6,1
64-224-224-3x3-3-224-224-2-1x1-1x1-1x1-0-NCHW-FP32-W=ConvAsmBwdWrW3x3:2,1,16,1,3,2
128-112-112-3x3-64-112-112-2-1x1-1x1-1x1-0-NCHW-FP32-W=ConvAsmBwdWrW3x3:6,0,16,2,2,1
256-56-56-3x3-128-56-56-2-1x1-1x1-1x1-0-NCHW-FP32-W=ConvAsmBwdWrW3x3:3,1,8,2,2,1
512-28-28-3x3-256-28-28-2-1x1-1x1-1x1-0-NCHW-FP32-W=ConvAsmBwdWrW3x3:8,1,8,2,2,1
512-14-14-3x3-512-14-14-2-1x1-1x1-1x1-0-NCHW-FP32-W=ConvAsmBwdWrW3x3:6,1,8,4,3,1
512-7-7-3x3-512-7-7-2-1x1-1x1-1x1-0-NCHW-FP32-W=ConvAsmBwdWrW3x3:6,0,8,2,7,1
64-56-56-3x3-64-56-56-1-1x1-1x1-1x1-0-NCHW-FP32-W=ConvAsmBwdWrW3x3:5,0,16,1,4,1
128-28-28-3x3-128-28-28-1-1x1-1x1-1x1-0-NCHW-FP32-W=ConvAsmBwdWrW3x3:8,0,8,1,3,1
256-14-14-3x3-256-14-14-1-1x1-1x1-1x1-0-NCHW-FP32-W=ConvAsmBwdWrW3x3:9,0,8,2,3,1
64-56-56-3x3-64-56-56-2-1x1-1x1-1x1-0-NCHW-FP32-W=ConvAsmBwdWrW3x3:9,0,16,1,4,1
128-28-28-3x3-128-28-28-2-1x1-1x1-1x1-0-NCHW-FP32-W=ConvAsmBwdWrW3x3:6,0,8,2,3,1
256-14-14-3x3-256-14-14-2-1x1-1x1-1x1-0-NCHW-FP32-W=ConvAsmBwdWrW3x3:7,1,8,2,3,1
64-80-350-3x3-64-80-350-1-1x1-1x1-1x1-0-NCHW-FP32-W=ConvAsmBwdWrW3x3:4,0,16,2,1,1
128-40-175-3x3-128-40-175-1-1x1-1x1-1x1-0-NCHW-FP32-W=ConvAsmBwdWrW3x3:2,1,16,4,2,1
256-20-84-3x3-256-20-84-1-1x1-1x1-1x1-0-NCHW-FP32-W=ConvAsmBwdWrW3x3:9,1,16,2,2,1
512-10-42-3x3-512-10-42-1-1x1-1x1-1x1-0-NCHW-FP32-W=ConvAsmBwdWrW3x3:3,1,8,4,2,1
64-80-350-3x3-64-80-350-2-1x1-1x1-1x1-0-NCHW-FP32-W=ConvAsmBwdWrW3x3:3,0,16,2,1,1
128-40-175-3x3-128-40-175-2-1x1-1x1-1x1-0-NCHW-FP32-W=ConvAsmBwdWrW3x3:2,0,16,4,2,1
256-20-84-3x3-256-20-84-2-1x1-1x1-1x1-0-NCHW-FP32-W=ConvAsmBwdWrW3x3:8,0,16,4,2,1
512-10-42-3x3-512-10-42-2-1x1-1x1-1x1-0-NCHW-FP32-W=ConvAsmBwdWrW3x3:5,1,8,4,2,1
192-56-56-3x3-64-56-56-32-1x1-1x1-1x1-0-NCHW-FP32-W=ConvAsmBwdWrW3x3:9,0,16,4,3,2
64-28-28-3x3-64-28-28-32-1x1-1x1-1x1-0-NCHW-FP32-W=ConvAsmBwdWrW3x3:8,0,8,2,3,3
96-28-28-3x3-64-28-28-32-1x1-1x1-1x1-0-NCHW-FP32-W=ConvAsmBwdWrW3x3:3,0,8,2,4,2
96-28-28-3x3-96-28-28-32-1x1-1x1-1x1-0-NCHW-FP32-W=ConvAsmBwdWrW3x3:0,0,8,2,6,4
96-14-14-3x3-64-14-14-32-1x1-1x1-1x1-0-NCHW-FP32-W=ConvAsmBwdWrW3x3:3,0,8,2,4,2
128-14-14-3x3-96-14-14-32-1x1-1x1-1x1-0-NCHW-FP32-W=ConvAsmBwdWrW3x3:8,0,8,4,5,2
128-14-14-3x3-128-14-14-32-1x1-1x1-1x1-0-NCHW-FP32-W=ConvAsmBwdWrW3x3:4,0,8,2,4,1
160-14-14-3x3-128-14-14-32-1x1-1x1-1x1-0-NCHW-FP32-W=ConvAsmBwdWrW3x3:6,0,8,2,3,1
160-14-14-3x3-160-14-14-32-1x1-1x1-1x1-0-NCHW-FP32-W=ConvAsmBwdWrW3x3:5,0,8,2,14,2
192-14-14-3x3-128-14-14-32-1x1-1x1-1x1-0-NCHW-FP32-W=ConvAsmBwdWrW3x3:6,0,8,2,3,1
192-14-14-3x3-160-14-14-32-1x1-1x1-1x1-0-NCHW-FP32-W=ConvAsmBwdWrW3x3:3,0,8,4,3,2
192-14-14-3x3-192-14-14-32-1x1-1x1-1x1-0-NCHW-FP32-W=ConvAsmBwdWrW3x3:5,1,8,4,9,2
256-14-14-3x3-192-14-14-32-1x1-1x1-1x1-0-NCHW-FP32-W=ConvAsmBwdWrW3x3:9,0,8,4,4,1
320-7-7-3x3-192-7-7-32-1x1-1x1-1x1-0-NCHW-FP32-W=ConvAsmBwdWrW3x3:5,1,8,2,7,1
224-7-7-3x3-160-7-7-32-1x1-1x1-1x1-0-NCHW-FP32-W=ConvAsmBwdWrW3x3:5,1,8,2,7,1
224-7-7-3x3-224-7-7-32-1x1-1x1-1x1-0-NCHW-FP32-W=ConvAsmBwdWrW3x3:9,1,8,2,7,1
224-7-7-3x3-192-7-7-32-1x1-1x1-1x1-0-NCHW-FP32-W=ConvAsmBwdWrW3x3:0,1,8,2,7,1
64-147-147-3x3-32-147-147-32-1x1-1x1-1x1-0-NCHW-FP32-W=ConvAsmBwdWrW3x3:9,1,16,4,2,4
96-35-35-3x3-64-35-35-32-1x1-1x1-1x1-0-NCHW-FP32-W=ConvAsmBwdWrW3x3:3,0,8,2,3,2
96-35-35-3x3-96-35-35-32-1x1-1x1-1x1-0-NCHW-FP32-W=ConvAsmBwdWrW3x3:2,0,8,2,3,4
384-8-8-3x3-448-8-8-32-1x1-1x1-1x1-0-NCHW-FP32-W=ConvAsmBwdWrW3x3:8,1,8,4,4,1
208-64-128-3x3-96-64-128-1-1x1-1x1-1x1-0-NCHW-FP32-W=ConvAsmBwdWrW3x3:6,0,16,4,2,1
224-64-128-3x3-112-64-128-1-1x1-1x1-1x1-0-NCHW-FP32-W=ConvAsmBwdWrW3x3:2,1,16,4,2,1
256-64-128-3x3-128-64-128-1-1x1-1x1-1x1-0-NCHW-FP32-W=ConvAsmBwdWrW3x3:3,0,16,4,2,1
288-64-128-3x3-144-64-128-1-1x1-1x1-1x1-0-NCHW-FP32-W=ConvAsmBwdWrW3x3:5,0,16,4,2,1
320-64-128-3x3-160-64-128-1-1x1-1x1-1x1-0-NCHW-FP32-W=ConvAsmBwdWrW3x3:7,0,16,4,2,1
384-64-128-3x3-192-64-128-1-1x1-1x1-1x1-0-NCHW-FP32-W=ConvAsmBwdWrW3x3:0,1,16,4,2,1
256-14-14-3x3-256-14-14-32-1x1-1x1-1x1-0-NCHW-FP32-W=ConvAsmBwdWrW3x3:7,0,8,4,4,1
64-56-56-3x3-64-56-56-32-1x1-1x1-1x1-0-NCHW-FP32-W=ConvAsmBwdWrW3x3:0,1,16,4,2,4
128-28-28-3x3-128-28-28-32-1x1-1x1-1x1-0-NCHW-FP32-W=ConvAsmBwdWrW3x3:7,0,8,2,4,1
512-7-7-3x3-512-7-7-32-1x1-1x1-1x1-0-NCHW-FP32-W=ConvAsmBwdWrW3x3:6,1,8,2,7,1
64-56-56-3x3-64-56-56-64-1x1-1x1-1x1-0-NCHW-FP32-W=ConvAsmBwdWrW3x3:9,1,16,4,3,4
192-56-56-3x3-64-56-56-128-1x1-1x1-1x1-0-NCHW-FP32-W=ConvAsmBwdWrW3x3:5,1,16,4,3,2
128-28-28-3x3-96-28-28-128-1x1-1x1-1x1-0-NCHW-FP32-W=ConvAsmBwdWrW3x3:0,0,8,4,4,4
192-28-28-3x3-128-28-28-128-1x1-1x1-1x1-0-NCHW-FP32-W=ConvAsmBwdWrW3x3:8,0,8,2,3,1
208-14-14-3x3-96-14-14-128-1x1-1x1-1x1-0-NCHW-FP32-W=ConvAsmBwdWrW3x3:7,0,8,2,14,1
64-112-112-7x7-3-224-224-16-3x3-2x2-1x1-0-NCHW-FP32-B=ConvOclDirectFwd:16,16,16,32,1,4,1,2,2
64-28-28-3x3-64-56-56-16-1x1-2x2-1x1-0-NCHW-FP32-W=ConvAsmBwdWrW3x3:8,0,16,4,3,2
128-14-14-3x3-128-28-28-16-1x1-2x2-1x1-0-NCHW-FP32-W=ConvAsmBwdWrW3x3:6,0,8,4,5,1
256-7-7-3x3-256-14-14-16-1x1-2x2-1x1-0-NCHW-FP32-W=ConvAsmBwdWrW3x3:4,0,8,8,8,1
512-4-4-3x3-512-7-7-16-1x1-2x2-1x1-0-NCHW-FP32-W=ConvAsmBwdWrW3x3:0,0,8,4,7,1
64-56-56-1x1-256-56-56-16-0x0-1x1-1x1-0-NCHW-FP32-F=ConvOclDirectFwd1x1:1,8,1,1,1,1,32,2048,0
256-56-56-1x1-64-56-56-16-0x0-1x1-1x1-0-NCHW-FP32-B=ConvOclDirectFwd1x1:1,256,1,1,0,1,32,4,0
64-56-56-1x1-64-56-56-16-0x0-1x1-1x1-0-NCHW-FP32-F=ConvOclDirectFwd1x1:1,8,1,1,1,0,16,2048,0
64-56-56-1x1-64-56-56-16-0x0-1x1-1x1-0-NCHW-FP32-B=ConvOclDirectFwd1x1:1,128,1,1,0,1,32,4,0
256-56-56-1x1-64-56-56-16-0x0-1x1-1x1-0-NCHW-FP32-F=ConvOclDirectFwd1x1:1,8,1,1,1,4,16,2048,0
64-56-56-1x1-256-56-56-16-0x0-1x1-1x1-0-NCHW-FP32-B=ConvOclDirectFwd1x1:1,128,1,1,0,1,32,4,0
128-28-28-1x1-512-28-28-16-0x0-1x1-1x1-0-NCHW-FP32-F=ConvOclDirectFwd1x1:1,8,1,1,1,0,16,2048,0
512-28-28-1x1-128-28-28-16-0x0-1x1-1x1-0-NCHW-FP32-B=ConvOclDirectFwd1x1:1,128,1,1,0,1,16,4,0
512-28-28-1x1-128-28-28-16-0x0-1x1-1x1-0-NCHW-FP32-F=ConvOclDirectFwd1x1:1,8,1,1,1,0,16,256,0
128-28-28-1x1-512-28-28-16-0x0-1x1-1x1-0-NCHW-FP32-B=ConvOclDirectFwd1x1:1,64,1,1,0,2,16,4,0
256-14-14-1x1-1024-14-14-16-0x0-1x1-1x1-0-NCHW-FP32-F=ConvOclDirectFwd1x1:1,8,1,1,1,4,16,2048,0
1024-14-14-1x1-256-14-14-16-0x0-1x1-1x1-0-NCHW-FP32-B=ConvOclDirectFwd1x1:1,256,1,1,0,2,16,4,0
1024-14-14-1x1-256-14-14-16-0x0-1x1-1x1-0-NCHW-FP32-F=ConvOclDirectFwd1x1:1,8,1,1,1,4,16,2048,0
256-14-14-1x1-1024-14-14-16-0x0-1x1-1x1-0-NCHW-FP32-B=ConvOclDirectFwd1x1:1,256,1,1,0,1,16,4,0
512-7-7-1x1-2048-7-7-16-0x0-1x1-1x1-0-NCHW-FP32-F=ConvOclDirectFwd1x1:1,8,1,1,1,1,32,2048,0
2048-7-7-1x1-512-7-7-16-0x0-1x1-1x1-0-NCHW-FP32-B=ConvOclDirectFwd1x1:1,256,1,1,0,1,16,4,0
2048-7-7-1x1-512-7-7-16-0x0-1x1-1x1-0-NCHW-FP32-F=ConvOclDirectFwd1x1:1,8,1,1,1,4,16,256,0
512-7-7-1x1-2048-7-7-16-0x0-1x1-1x1-0-NCHW-FP32-B=ConvOclDirectFwd1x1:1,64,1,1,0,1,16,4,0
256-56-56-1x1-128-56-56-16-0x0-1x1-1x1-0-NCHW-FP32-F=ConvOclDirectFwd1x1:1,8,1,1,1,1,16,2048,0
128-56-56-1x1-256-56-56-16-0x0-1x1-1x1-0-NCHW-FP32-B=ConvOclDirectFwd1x1:1,128,1,1,0,1,32,4,0
1024-14-14-1x1-512-14-14-16-0x0-1x1-1x1-0-NCHW-FP32-F=ConvOclDirectFwd1x1:1,8,1,1,1,1,32,2048,0
512-14-14-1x1-1024-14-14-16-0x0-1x1-1x1-0-NCHW-FP32-B=ConvOclDirectFwd1x1:1,256,1,1,0,1,16,4,0
512-28-28-1x1-256-28-28-16-0x0-1x1-1x1-0-NCHW-FP32-F=ConvOclDirectFwd1x1:1,8,1,1,1,4,16,2048,0
256-28-28-1x1-512-28-28-16-0x0-1x1-1x1-0-NCHW-FP32-B=ConvOclDirectFwd1x1:1,128,1,1,0,2,16,4,0
256-56-56-1x1-512-28-28-16-0x0-2x2-1x1-0-NCHW-FP32-F=ConvOclDirectFwd1x1:1,64,1,1,0,2,32,4,0
512-28-28-1x1-256-56-56-16-0x0-2x2-1x1-0-NCHW-FP32-B=ConvOclDirectFwd1x1:1,64,1,1,0,1,32,4,0
256-56-56-1x1-128-28-28-16-0x0-2x2-1x1-0-NCHW-FP32-F=ConvOclDirectFwd1x1:1,128,1,1,0,2,32,4,0
128-28-28-1x1-256-56-56-16-0x0-2x2-1x1-0-NCHW-FP32-B=ConvOclDirectFwd1x1:1,128,1,1,0,1,32,4,0
512-28-28-1x1-1024-14-14-16-0x0-2x2-1x1-0-NCHW-FP32-F=ConvOclDirectFwd1x1:1,256,1,1,0,2,32,4,0
1024-14-14-1x1-512-28-28-16-0x0-2x2-1x1-0-NCHW-FP32-B=ConvOclDirectFwd1x1:1,256,1,1,0,1,16,4,0
512-28-28-1x1-256-14-14-16-0x0-2x2-1x1-0-NCHW-FP32-F=ConvOclDirectFwd1x1:1,256,1,1,0,1,32,4,0
256-14-14-1x1-512-28-28-16-0x0-2x2-1x1-0-NCHW-FP32-B=ConvOclDirectFwd1x1:1,256,1,1,0,1,16,4,0
1024-14-14-1x1-2048-7-7-16-0x0-2x2-1x1-0-NCHW-FP32-F=ConvOclDirectFwd1x1:1,256,1,1,0,1,32,4,0
2048-7-7-1x1-1024-14-14-16-0x0-2x2-1x1-0-NCHW-FP32-B=ConvOclDirectFwd1x1:1,256,1,1,0,1,16,8,0
1024-14-14-1x1-512-7-7-16-0x0-2x2-1x1-0-NCHW-FP32-F=ConvOclDirectFwd1x1:1,128,1,1,0,1,32,4,0
512-7-7-1x1-1024-14-14-16-0x0-2x2-1x1-0-NCHW-FP32-B=ConvOclDirectFwd1x1:1,256,1,1,0,1,16,8,0
224-14-14-3x3-112-14-14-128-1x1-1x1-1x1-0-NCHW-FP32-W=ConvAsmBwdWrW3x3:6,0,8,2,13,4
256-14-14-3x3-128-14-14-128-1x1-1x1-1x1-0-NCHW-FP32-W=ConvAsmBwdWrW3x3:9,0,8,2,14,1
288-14-14-3x3-144-14-14-128-1x1-1x1-1x1-0-NCHW-FP32-W=ConvAsmBwdWrW3x3:6,0,8,4,9,2
320-14-14-3x3-160-14-14-128-1x1-1x1-1x1-0-NCHW-FP32-W=ConvAsmBwdWrW3x3:3,0,8,4,6,2
320-7-7-3x3-160-7-7-128-1x1-1x1-1x1-0-NCHW-FP32-W=ConvAsmBwdWrW3x3:5,1,8,2,7,2
384-7-7-3x3-192-7-7-128-1x1-1x1-1x1-0-NCHW-FP32-W=ConvAsmBwdWrW3x3:5,1,8,2,7,1
128-28-28-3x3-96-28-28-32-1x1-1x1-1x1-0-NCHW-FP32-W=ConvAsmBwdWrW3x3:7,0,8,4,2,2
192-28-28-3x3-128-28-28-32-1x1-1x1-1x1-0-NCHW-FP32-W=ConvAsmBwdWrW3x3:0,0,8,2,4,1
208-14-14-3x3-96-14-14-32-1x1-1x1-1x1-0-NCHW-FP32-W=ConvAsmBwdWrW3x3:6,0,8,4,6,2
224-14-14-3x3-112-14-14-32-1x1-1x1-1x1-0-NCHW-FP32-W=ConvAsmBwdWrW3x3:7,1,8,2,14,2
256-14-14-3x3-128-14-14-32-1x1-1x1-1x1-0-NCHW-FP32-W=ConvAsmBwdWrW3x3:5,0,8,4,4,1
288-14-14-3x3-144-14-14-32-1x1-1x1-1x1-0-NCHW-FP32-W=ConvAsmBwdWrW3x3:5,1,8,4,4,2
320-14-14-3x3-160-14-14-32-1x1-1x1-1x1-0-NCHW-FP32-W=ConvAsmBwdWrW3x3:6,0,8,4,8,2
320-7-7-3x3-160-7-7-32-1x1-1x1-1x1-0-NCHW-FP32-W=ConvAsmBwdWrW3x3:5,1,8,2,7,1
384-7-7-3x3-192-7-7-32-1x1-1x1-1x1-0-NCHW-FP32-W=ConvAsmBwdWrW3x3:5,1,8,2,7,1
384-13-13-3x3-192-13-13-128-1x1-1x1-1x1-0-NCHW-FP32-W=ConvAsmBwdWrW3x3:6,1,16,4,10,1
256-13-13-3x3-384-13-13-128-1x1-1x1-1x1-0-NCHW-FP32-W=ConvAsmBwdWrW3x3:9,1,16,4,10,1
256-13-13-3x3-256-13-13-128-1x1-1x1-1x1-0-NCHW-FP32-W=ConvAsmBwdWrW3x3:0,1,16,4,9,1
384-13-13-3x3-192-13-13-64-1x1-1x1-1x1-0-NCHW-FP32-W=ConvAsmBwdWrW3x3:9,1,16,4,10,1
256-13-13-3x3-384-13-13-64-1x1-1x1-1x1-0-NCHW-FP32-W=ConvAsmBwdWrW3x3:6,1,16,4,9,1
256-13-13-3x3-256-13-13-64-1x1-1x1-1x1-0-NCHW-FP32-W=ConvAsmBwdWrW3x3:0,0,16,4,10,1
384-13-13-3x3-192-13-13-50-1x1-1x1-1x1-0-NCHW-FP32-W=ConvAsmBwdWrW3x3:9,0,16,4,9,1
256-13-13-3x3-384-13-13-50-1x1-1x1-1x1-0-NCHW-FP32-W=ConvAsmBwdWrW3x3:7,1,16,4,10,1
256-13-13-3x3-256-13-13-50-1x1-1x1-1x1-0-NCHW-FP32-W=ConvAsmBwdWrW3x3:9,1,16,4,10,1
384-13-13-3x3-192-13-13-256-1x1-1x1-1x1-0-NCHW-FP32-W=ConvAsmBwdWrW3x3:8,0,16,4,9,1
256-13-13-3x3-384-13-13-256-1x1-1x1-1x1-0-NCHW-FP32-W=ConvAsmBwdWrW3x3:5,1,16,4,10,1
256-13-13-3x3-256-13-13-256-1x1-1x1-1x1-0-NCHW-FP32-W=ConvAsmBwdWrW3x3:7,0,16,4,9,1
64-224-224-3x3-3-224-224-64-1x1-1x1-1x1-0-NCHW-FP32-W=ConvAsmBwdWrW3x3:0,1,16,1,2,4
128-112-112-3x3-64-112-112-64-1x1-1x1-1x1-0-NCHW-FP32-W=ConvAsmBwdWrW3x3:9,1,16,4,2,4
256-56-56-3x3-128-56-56-64-1x1-1x1-1x1-0-NCHW-FP32-W=ConvAsmBwdWrW3x3:7,0,16,4,3,1
256-56-56-3x3-256-56-56-64-1x1-1x1-1x1-0-NCHW-FP32-W=ConvAsmBwdWrW3x3:8,0,16,4,3,1
512-28-28-3x3-256-28-28-64-1x1-1x1-1x1-0-NCHW-FP32-W=ConvAsmBwdWrW3x3:8,0,8,4,4,1
512-28-28-3x3-512-28-28-64-1x1-1x1-1x1-0-NCHW-FP32-W=ConvAsmBwdWrW3x3:3,0,8,4,4,1
512-14-14-3x3-512-14-14-64-1x1-1x1-1x1-0-NCHW-FP32-W=ConvAsmBwdWrW3x3:9,0,8,4,4,1
64-224-224-3x3-3-224-224-32-1x1-1x1-1x1-0-NCHW-FP32-W=ConvAsmBwdWrW3x3:3,1,16,1,2,4
128-112-112-3x3-64-112-112-32-1x1-1x1-1x1-0-NCHW-FP32-W=ConvAsmBwdWrW3x3:6,0,16,4,2,4
256-56-56-3x3-128-56-56-32-1x1-1x1-1x1-0-NCHW-FP32-W=ConvAsmBwdWrW3x3:5,0,16,4,3,1
256-56-56-3x3-256-56-56-32-1x1-1x1-1x1-0-NCHW-FP32-W=ConvAsmBwdWrW3x3:4,1,16,4,3,1
512-28-28-3x3-256-28-28-32-1x1-1x1-1x1-0-NCHW-FP32-W=ConvAsmBwdWrW3x3:4,1,8,2,3,1
512-28-28-3x3-512-28-28-32-1x1-1x1-1x1-0-NCHW-FP32-W=ConvAsmBwdWrW3x3:5,0,8,4,3,1
512-14-14-3x3-512-14-14-32-1x1-1x1-1x1-0-NCHW-FP32-W=ConvAsmBwdWrW3x3:7,1,8,4,4,1
160-14-14-3x3-128-28-28-32-1x1-2x2-1x1-0-NCHW-FP32-W=ConvAsmBwdWrW3x3:6,0,8,4,3,1
96-14-14-3x3-96-28-28-32-1x1-2x2-1x1-0-NCHW-FP32-W=ConvAsmBwdWrW3x3:6,0,16,4,3,1
192-7-7-3x3-128-14-14-32-1x1-2x2-1x1-0-NCHW-FP32-W=ConvAsmBwdWrW3x3:4,0,8,4,5,1
256-7-7-3x3-256-14-14-32-1x1-2x2-1x1-0-NCHW-FP32-W=ConvAsmBwdWrW3x3:3,0,8,8,3,1
64-28-28-3x3-64-56-56-32-1x1-2x2-1x1-0-NCHW-FP32-W=ConvAsmBwdWrW3x3:1,0,8,4,4,2
128-14-14-3x3-128-28-28-32-1x1-2x2-1x1-0-NCHW-FP32-W=ConvAsmBwdWrW3x3:7,0,8,4,5,1
512-4-4-3x3-512-7-7-32-1x1-2x2-1x1-0-NCHW-FP32-W=ConvAsmBwdWrW3x3:4,0,8,4,7,1
64-28-28-3x3-64-56-56-64-1x1-2x2-1x1-0-NCHW-FP32-W=ConvAsmBwdWrW3x3:1,0,8,4,4,2
128-14-14-3x3-128-28-28-64-1x1-2x2-1x1-0-NCHW-FP32-W=ConvAsmBwdWrW3x3:7,0,8,4,3,1
256-7-7-3x3-256-14-14-64-1x1-2x2-1x1-0-NCHW-FP32-W=ConvAsmBwdWrW3x3:6,0,8,8,3,1
512-4-4-3x3-512-7-7-64-1x1-2x2-1x1-0-NCHW-FP32-W=ConvAsmBwdWrW3x3:4,0,8,4,7,1
32-79-341-5x20-1-161-700-4-0x0-2x2-1x1-0-NCHW-FP32-B=ConvOclDirectFwd:8,16,32,32,4,1,1,1,2
32-79-341-5x20-1-161-700-8-0x0-2x2-1x1-0-NCHW-FP32-B=ConvOclDirectFwd:8,16,32,32,1,4,1,1,2
32-79-341-5x20-1-161-700-16-0x0-2x2-1x1-0-NCHW-FP32-B=ConvOclDirectFwd:8,16,32,32,4,1,1,1,2
32-79-341-5x20-1-161-700-32-0x0-2x2-1x1-0-NCHW-FP32-B=ConvOclDirectFwd:8,16,32,32,4,1,1,1,2
16-24-240-3x3-32-24-240-16-1x1-1x1-1x1-0-NCHW-FP32-F=ConvOclDirectFwd:8,16,16,32,2,1,8,2,2
32-24-240-3x3-16-24-240-16-1x1-1x1-1x1-0-NCHW-FP32-W=ConvAsmBwdWrW3x3:4,1,16,2,2,8
64-54-54-3x3-3-108-108-8-1x1-2x2-1x1-0-NCHW-FP32-B=ConvOclDirectFwd:8,16,16,16,1,1,2,4,2
192-28-28-5x5-32-28-28-16-2x2-1x1-1x1-0-NCHW-FP32-F=ConvOclDirectFwd:16,16,16,16,4,4,1,4,1
32-28-28-5x5-192-28-28-16-2x2-1x1-1x1-0-NCHW-FP32-B=ConvOclDirectFwd:8,16,32,32,2,2,8,1,2
192-28-28-1x1-64-28-28-16-0x0-1x1-1x1-0-NCHW-FP32-F=ConvOclDirectFwd1x1:1,8,1,1,1,1,16,2048,0
64-28-28-1x1-192-28-28-16-0x0-1x1-1x1-0-NCHW-FP32-B=ConvOclDirectFwd1x1:1,256,1,1,0,2,16,4,0
512-14-14-5x5-48-14-14-16-2x2-1x1-1x1-0-NCHW-FP32-F=ConvOclDirectFwd:16,16,16,16,4,1,1,4,1
512-14-14-1x1-192-14-14-16-0x0-1x1-1x1-0-NCHW-FP32-F=ConvOclDirectFwd1x1:1,8,1,1,1,1,16,256,0
192-14-14-1x1-512-14-14-16-0x0-1x1-1x1-0-NCHW-FP32-B=ConvOclDirectFwd1x1:1,256,1,1,0,1,16,4,0
832-7-7-1x1-256-7-7-16-0x0-1x1-1x1-0-NCHW-FP32-F=ConvOclDirectFwd1x1:1,8,1,1,1,1,16,128,0
256-7-7-1x1-832-7-7-16-0x0-1x1-1x1-0-NCHW-FP32-B=ConvOclDirectFwd1x1:1,64,1,1,0,1,16,4,0
832-7-7-5x5-128-7-7-16-2x2-1x1-1x1-0-NCHW-FP32-F=ConvOclDirectFwd:16,16,8,8,2,2,1,4,2
64-56-56-1x1-256-28-28-8-0x0-2x2-1x1-0-NCHW-FP32-F=ConvOclDirectFwd1x1:1,256,1,1,0,1,32,4,0
256-28-28-1x1-64-56-56-8-0x0-2x2-1x1-0-NCHW-FP32-B=ConvOclDirectFwd1x1:1,128,1,1,0,1,8,4,0
128-28-28-1x1-512-14-14-8-0x0-2x2-1x1-0-NCHW-FP32-F=ConvOclDirectFwd1x1:1,256,1,1,0,1,32,4,0
512-14-14-1x1-128-28-28-8-0x0-2x2-1x1-0-NCHW-FP32-B=ConvOclDirectFwd1x1:1,256,1,1,0,1,8,4,0
256-14-14-1x1-256-14-14-8-0x0-1x1-1x1-0-NCHW-FP32-F=ConvOclDirectFwd1x1:1,8,1,1,1,4,16,128,0
256-14-14-1x1-256-14-14-8-0x0-1x1-1x1-0-NCHW-FP32-B=ConvOclDirectFwd1x1:1,64,1,1,0,1,16,4,0
256-14-14-1x1-1024-7-7-8-0x0-2x2-1x1-0-NCHW-FP32-F=ConvOclDirectFwd1x1:1,128,1,1,0,1,16,4,0
1024-7-7-1x1-256-14-14-8-0x0-2x2-1x1-0-NCHW-FP32-B=ConvOclDirectFwd1x1:1,128,1,1,0,1,4,4,0
512-7-7-1x1-512-7-7-8-0x0-1x1-1x1-0-NCHW-FP32-F=ConvOclDirectFwd1x1:1,8,1,1,1,1,16,128,0
512-7-7-1x1-512-7-7-8-0x0-1x1-1x1-0-NCHW-FP32-B=ConvOclDirectFwd1x1:1,256,1,1,0,1,8,8,0
64-56-56-1x1-256-28-28-16-0x0-2x2-1x1-0-NCHW-FP32-F=ConvOclDirectFwd1x1:1,256,1,1,0,1,32,4,0
256-28-28-1x1-64-56-56-16-0x0-2x2-1x1-0-NCHW-FP32-B=ConvOclDirectFwd1x1:1,64,1,1,0,1,16,4,0
128-28-28-1x1-512-14-14-16-0x0-2x2-1x1-0-NCHW-FP32-F=ConvOclDirectFwd1x1:1,256,1,1,0,2,32,4,0
512-14-14-1x1-128-28-28-16-0x0-2x2-1x1-0-NCHW-FP32-B=ConvOclDirectFwd1x1:1,256,1,1,0,1,8,4,0
256-14-14-1x1-256-14-14-16-0x0-1x1-1x1-0-NCHW-FP32-F=ConvOclDirectFwd1x1:1,8,1,1,1,1,16,2048,0
256-14-14-1x1-256-14-14-16-0x0-1x1-1x1-0-NCHW-FP32-B=ConvOclDirectFwd1x1:1,256,1,1,0,2,16,4,0
256-14-14-1x1-1024-7-7-16-0x0-2x2-1x1-0-NCHW-FP32-F=ConvOclDirectFwd1x1:1,256,1,1,0,1,32,4,0
1024-7-7-1x1-256-14-14-16-0x0-2x2-1x1-0-NCHW-FP32-B=ConvOclDirectFwd1x1:1,256,1,1,0,1,8,8,0
512-7-7-1x1-512-7-7-16-0x0-1x1-1x1-0-NCHW-FP32-F=ConvOclDirectFwd1x1:1,8,1,1,1,4,16,256,0
512-7-7-1x1-512-7-7-16-0x0-1x1-1x1-0-NCHW-FP32-B=ConvOclDirectFwd1x1:1,256,1,1,0,1,16,4,0
64-80-349-5x5-1-161-700-16-1x1-2x2-1x1-0-NCHW-FP32-B=ConvOclDirectFwd:16,16,16,32,1,4,1,2,2
64-112-112-1x1-64-112-112-8-0x0-1x1-1x1-0-NCHW-FP32-F=ConvOclDirectFwd1x1:1,8,1,1,1,1,16,64,0
64-112-112-1x1-64-112-112-8-0x0-1x1-1x1-0-NCHW-FP32-B=ConvOclDirectFwd1x1:1,64,1,1,0,1,32,4,0
64-56-56-1x1-256-56-56-8-0x0-1x1-1x1-0-NCHW-FP32-F=ConvOclDirectFwd1x1:1,8,1,1,1,1,32,2048,0
256-56-56-1x1-64-56-56-8-0x0-1x1-1x1-0-NCHW-FP32-B=ConvOclDirectFwd1x1:1,64,1,1,0,2,16,4,0
256-56-56-1x1-64-56-56-8-0x0-1x1-1x1-0-NCHW-FP32-F=ConvOclDirectFwd1x1:1,8,1,1,1,1,16,2048,0
64-56-56-1x1-256-56-56-8-0x0-1x1-1x1-0-NCHW-FP32-B=ConvOclDirectFwd1x1:1,128,1,1,0,1,32,4,0
256-56-56-1x1-128-28-28-8-0x0-2x2-1x1-0-NCHW-FP32-F=ConvOclDirectFwd1x1:1,256,1,1,0,1,32,4,0
128-28-28-1x1-256-56-56-8-0x0-2x2-1x1-0-NCHW-FP32-B=ConvOclDirectFwd1x1:1,256,1,1,0,1,16,4,0
128-28-28-1x1-512-28-28-8-0x0-1x1-1x1-0-NCHW-FP32-F=ConvOclDirectFwd1x1:1,8,1,1,1,4,16,2048,0
512-28-28-1x1-128-28-28-8-0x0-1x1-1x1-0-NCHW-FP32-B=ConvOclDirectFwd1x1:1,256,1,1,0,2,16,4,0
512-28-28-1x1-128-28-28-8-0x0-1x1-1x1-0-NCHW-FP32-F=ConvOclDirectFwd1x1:1,8,1,1,1,0,16,2048,0
128-28-28-1x1-512-28-28-8-0x0-1x1-1x1-0-NCHW-FP32-B=ConvOclDirectFwd1x1:1,256,1,1,0,1,16,4,0
512-28-28-1x1-256-14-14-8-0x0-2x2-1x1-0-NCHW-FP32-F=ConvOclDirectFwd1x1:1,256,1,1,0,1,16,4,0
256-14-14-1x1-512-28-28-8-0x0-2x2-1x1-0-NCHW-FP32-B=ConvOclDirectFwd1x1:1,64,1,1,0,1,16,8,0
256-14-14-1x1-1024-14-14-8-0x0-1x1-1x1-0-NCHW-FP32-F=ConvOclDirectFwd1x1:1,8,1,1,1,1,32,2048,0
1024-14-14-1x1-256-14-14-8-0x0-1x1-1x1-0-NCHW-FP32-B=ConvOclDirectFwd1x1:1,64,1,1,0,1,16,4,0
512-28-28-1x1-1024-14-14-8-0x0-2x2-1x1-0-NCHW-FP32-F=ConvOclDirectFwd1x1:1,256,1,1,0,2,32,4,0
1024-14-14-1x1-512-28-28-8-0x0-2x2-1x1-0-NCHW-FP32-B=ConvOclDirectFwd1x1:1,64,1,1,0,1,16,8,0
1024-14-14-1x1-256-14-14-8-0x0-1x1-1x1-0-NCHW-FP32-F=ConvOclDirectFwd1x1:1,8,1,1,1,4,16,128,0
256-14-14-1x1-1024-14-14-8-0x0-1x1-1x1-0-NCHW-FP32-B=ConvOclDirectFwd1x1:1,256,1,1,0,1,16,4,0
1024-14-14-1x1-512-7-7-8-0x0-2x2-1x1-0-NCHW-FP32-F=ConvOclDirectFwd1x1:1,256,1,1,0,1,16,4,0
512-7-7-1x1-1024-14-14-8-0x0-2x2-1x1-0-NCHW-FP32-B=ConvOclDirectFwd1x1:1,128,1,1,0,1,8,4,0
512-7-7-1x1-2048-7-7-8-0x0-1x1-1x1-0-NCHW-FP32-F=ConvOclDirectFwd1x1:1,8,1,1,1,0,16,2048,0
2048-7-7-1x1-512-7-7-8-0x0-1x1-1x1-0-NCHW-FP32-B=ConvOclDirectFwd1x1:1,256,1,1,0,1,8,8,0
1024-14-14-1x1-2048-7-7-8-0x0-2x2-1x1-0-NCHW-FP32-F=ConvOclDirectFwd1x1:1,256,1,1,0,1,32,4,0
2048-7-7-1x1-1024-14-14-8-0x0-2x2-1x1-0-NCHW-FP32-B=ConvOclDirectFwd1x1:1,256,1,1,0,1,8,4,0
2048-7-7-1x1-512-7-7-8-0x0-1x1-1x1-0-NCHW-FP32-F=ConvOclDirectFwd1x1:1,8,1,1,1,1,32,256,0
512-7-7-1x1-2048-7-7-8-0x0-1x1-1x1-0-NCHW-FP32-B=ConvOclDirectFwd1x1:1,256,1,1,0,1,16,4,0
64-112-112-1x1-64-112-112-16-0x0-1x1-1x1-0-NCHW-FP32-F=ConvOclDirectFwd1x1:1,8,1,1,1,0,16,256,0
64-112-112-1x1-64-112-112-16-0x0-1x1-1x1-0-NCHW-FP32-B=ConvOclDirectFwd1x1:1,128,1,1,0,1,32,4,0
192-28-28-1x1-64-28-28-1-0x0-1x1-1x1-0-NCHW-FP32-F=ConvOclDirectFwd1x1:16,16,16,16,1,1,2,3,1
64-28-28-1x1-192-28-28-1-0x0-1x1-1x1-0-NCHW-FP32-B=ConvOclDirectFwd1x1:1,256,1,1,0,1,4,8,0
512-14-14-1x1-192-14-14-1-0x0-1x1-1x1-0-NCHW-FP32-F=ConvOclDirectFwd1x1:1,8,1,1,1,4,16,64,0
192-14-14-1x1-512-14-14-1-0x0-1x1-1x1-0-NCHW-FP32-B=ConvOclDirectFwd1x1:1,128,1,1,0,1,4,8,0
832-7-7-1x1-256-7-7-1-0x0-1x1-1x1-0-NCHW-FP32-F=ConvOclDirectFwd1x1:16,16,16,16,1,1,2,3,1
256-7-7-1x1-832-7-7-1-0x0-1x1-1x1-0-NCHW-FP32-B=ConvOclDirectFwd1x1:1,64,1,1,0,1,4,8,0
192-28-28-1x1-64-28-28-2-0x0-1x1-1x1-0-NCHW-FP32-F=ConvOclDirectFwd1x1:1,8,1,1,1,4,16,64,0
64-28-28-1x1-192-28-28-2-0x0-1x1-1x1-0-NCHW-FP32-B=ConvOclDirectFwd1x1:1,256,1,1,0,1,8,8,0
512-14-14-1x1-192-14-14-2-0x0-1x1-1x1-0-NCHW-FP32-F=ConvOclDirectFwd1x1:1,8,1,1,1,4,16,64,0
192-14-14-1x1-512-14-14-2-0x0-1x1-1x1-0-NCHW-FP32-B=ConvOclDirectFwd1x1:1,256,1,1,0,1,8,8,0
832-7-7-1x1-256-7-7-2-0x0-1x1-1x1-0-NCHW-FP32-F=ConvOclDirectFwd1x1:1,8,1,1,1,4,16,64,0
256-7-7-1x1-832-7-7-2-0x0-1x1-1x1-0-NCHW-FP32-B=ConvOclDirectFwd1x1:1,128,1,1,0,1,4,8,0
256-14-14-1x1-256-14-14-1-0x0-1x1-1x1-0-NCHW-FP32-F=ConvOclDirectFwd1x1:1,8,1,1,1,4,16,64,0
256-14-14-1x1-256-14-14-1-0x0-1x1-1x1-0-NCHW-FP32-B=ConvOclDirectFwd1x1:1,128,1,1,0,1,4,8,0
512-7-7-1x1-512-7-7-1-0x0-1x1-1x1-0-NCHW-FP32-F=ConvOclDirectFwd1x1:16,16,16,16,1,1,2,3,1
512-7-7-1x1-512-7-7-1-0x0-1x1-1x1-0-NCHW-FP32-B=ConvOclDirectFwd1x1:1,128,1,1,0,1,4,8,0
256-14-14-1x1-256-14-14-2-0x0-1x1-1x1-0-NCHW-FP32-F=ConvOclDirectFwd1x1:1,8,1,1,1,4,16,64,0
256-14-14-1x1-256-14-14-2-0x0-1x1-1x1-0-NCHW-FP32-B=ConvOclDirectFwd1x1:1,128,1,1,0,1,4,8,0
512-7-7-1x1-512-7-7-2-0x0-1x1-1x1-0-NCHW-FP32-F=ConvOclDirectFwd1x1:1,8,1,1,1,4,16,64,0
512-7-7-1x1-512-7-7-2-0x0-1x1-1x1-0-NCHW-FP32-B=ConvOclDirectFwd1x1:1,128,1,1,0,1,4,8,0
64-112-112-1x1-64-112-112-1-0x0-1x1-1x1-0-NCHW-FP32-F=ConvOclDirectFwd1x1:1,8,1,1,1,4,16,256,0
64-112-112-1x1-64-112-112-1-0x0-1x1-1x1-0-NCHW-FP32-B=ConvOclDirectFwd1x1:1,64,1,1,0,2,16,4,0
64-56-56-1x1-256-56-56-1-0x0-1x1-1x1-0-NCHW-FP32-F=ConvOclDirectFwd1x1:1,8,1,1,1,0,16,128,0
256-56-56-1x1-64-56-56-1-0x0-1x1-1x1-0-NCHW-FP32-B=ConvOclDirectFwd1x1:1,256,1,1,0,1,8,8,0
256-56-56-1x1-64-56-56-1-0x0-1x1-1x1-0-NCHW-FP32-F=ConvOclDirectFwd1x1:16,16,16,16,1,1,2,3,1
64-56-56-1x1-256-56-56-1-0x0-1x1-1x1-0-NCHW-FP32-B=ConvOclDirectFwd1x1:1,256,1,1,0,1,16,4,0
128-28-28-1x1-512-28-28-1-0x0-1x1-1x1-0-NCHW-FP32-F=ConvOclDirectFwd1x1:1,8,1,1,1,4,16,64,0
512-28-28-1x1-128-28-28-1-0x0-1x1-1x1-0-NCHW-FP32-B=ConvOclDirectFwd1x1:1,256,1,1,0,1,4,8,0
512-28-28-1x1-128-28-28-1-0x0-1x1-1x1-0-NCHW-FP32-F=ConvOclDirectFwd1x1:1,8,1,1,1,4,16,64,0
128-28-28-1x1-512-28-28-1-0x0-1x1-1x1-0-NCHW-FP32-B=ConvOclDirectFwd1x1:1,256,1,1,0,1,16,4,0
256-14-14-1x1-1024-14-14-1-0x0-1x1-1x1-0-NCHW-FP32-F=ConvOclDirectFwd1x1:16,16,16,16,1,1,2,3,1
1024-14-14-1x1-256-14-14-1-0x0-1x1-1x1-0-NCHW-FP32-B=ConvOclDirectFwd1x1:1,64,1,1,0,1,4,8,0
1024-14-14-1x1-256-14-14-1-0x0-1x1-1x1-0-NCHW-FP32-F=ConvOclDirectFwd1x1:1,8,1,1,1,1,16,64,0
256-14-14-1x1-1024-14-14-1-0x0-1x1-1x1-0-NCHW-FP32-B=ConvOclDirectFwd1x1:1,128,1,1,0,1,8,8,0
512-7-7-1x1-2048-7-7-1-0x0-1x1-1x1-0-NCHW-FP32-F=ConvOclDirectFwd1x1:16,16,16,16,1,1,2,3,1
2048-7-7-1x1-512-7-7-1-0x0-1x1-1x1-0-NCHW-FP32-B=ConvOclDirectFwd1x1:1,128,1,1,0,1,4,8,0
2048-7-7-1x1-512-7-7-1-0x0-1x1-1x1-0-NCHW-FP32-F=ConvOclDirectFwd1x1:1,8,1,1,1,4,16,128,0
512-7-7-1x1-2048-7-7-1-0x0-1x1-1x1-0-NCHW-FP32-B=ConvOclDirectFwd1x1:1,128,1,1,0,1,4,8,0
64-112-112-1x1-64-112-112-2-0x0-1x1-1x1-0-NCHW-FP32-F=ConvOclDirectFwd1x1:1,8,1,1,1,0,16,2048,0
64-112-112-1x1-64-112-112-2-0x0-1x1-1x1-0-NCHW-FP32-B=ConvOclDirectFwd1x1:1,64,1,1,0,2,16,4,0
64-56-56-1x1-256-56-56-2-0x0-1x1-1x1-0-NCHW-FP32-F=ConvOclDirectFwd1x1:1,8,1,1,1,0,16,2048,0
256-56-56-1x1-64-56-56-2-0x0-1x1-1x1-0-NCHW-FP32-B=ConvOclDirectFwd1x1:1,128,1,1,0,1,16,4,0
256-56-56-1x1-64-56-56-2-0x0-1x1-1x1-0-NCHW-FP32-F=ConvOclDirectFwd1x1:1,8,1,1,1,4,16,128,0
64-56-56-1x1-256-56-56-2-0x0-1x1-1x1-0-NCHW-FP32-B=ConvOclDirectFwd1x1:1,128,1,1,0,1,16,4,0
128-28-28-1x1-512-28-28-2-0x0-1x1-1x1-0-NCHW-FP32-F=ConvOclDirectFwd1x1:1,8,1,1,1,0,16,256,0
512-28-28-1x1-128-28-28-2-0x0-1x1-1x1-0-NCHW-FP32-B=ConvOclDirectFwd1x1:1,256,1,1,0,1,8,8,0
512-28-28-1x1-128-28-28-2-0x0-1x1-1x1-0-NCHW-FP32-F=ConvOclDirectFwd1x1:1,8,1,1,1,4,16,128,0
128-28-28-1x1-512-28-28-2-0x0-1x1-1x1-0-NCHW-FP32-B=ConvOclDirectFwd1x1:1,64,1,1,0,1,16,4,0
256-14-14-1x1-1024-14-14-2-0x0-1x1-1x1-0-NCHW-FP32-F=ConvOclDirectFwd1x1:1,8,1,1,1,4,16,128,0
1024-14-14-1x1-256-14-14-2-0x0-1x1-1x1-0-NCHW-FP32-B=ConvOclDirectFwd1x1:1,128,1,1,0,1,4,8,0
1024-14-14-1x1-256-14-14-2-0x0-1x1-1x1-0-NCHW-FP32-F=ConvOclDirectFwd1x1:1,8,1,1,1,0,16,128,0
256-14-14-1x1-1024-14-14-2-0x0-1x1-1x1-0-NCHW-FP32-B=ConvOclDirectFwd1x1:1,256,1,1,0,1,16,4,0
512-7-7-1x1-2048-7-7-2-0x0-1x1-1x1-0-NCHW-FP32-F=ConvOclDirectFwd1x1:1,8,1,1,1,4,16,128,0
2048-7-7-1x1-512-7-7-2-0x0-1x1-1x1-0-NCHW-FP32-B=ConvOclDirectFwd1x1:1,128,1,1,0,1,4,8,0
2048-7-7-1x1-512-7-7-2-0x0-1x1-1x1-0-NCHW-FP32-F=ConvOclDirectFwd1x1:1,8,1,1,1,4,16,128,0
512-7-7-1x1-2048-7-7-2-0x0-1x1-1x1-0-NCHW-FP32-B=ConvOclDirectFwd1x1:1,256,1,1,0,1,8,8,0
320-28-28-1x1-128-28-28-32-0x0-1x1-1x1-0-NCHW-FP32-F=ConvOclDirectFwd1x1:1,8,1,1,1,1,16,2048,0
128-28-28-1x1-320-28-28-32-0x0-1x1-1x1-0-NCHW-FP32-B=ConvOclDirectFwd1x1:1,128,1,1,0,2,32,4,0
320-28-28-1x1-64-28-28-32-0x0-1x1-1x1-0-NCHW-FP32-F=ConvOclDirectFwd1x1:1,8,1,1,1,1,16,2048,0
64-28-28-1x1-320-28-28-32-0x0-1x1-1x1-0-NCHW-FP32-B=ConvOclDirectFwd1x1:1,128,1,1,0,2,32,4,0
576-14-14-1x1-224-14-14-32-0x0-1x1-1x1-0-NCHW-FP32-F=ConvOclDirectFwd1x1:1,8,1,1,1,4,16,256,0
224-14-14-1x1-576-14-14-32-0x0-1x1-1x1-0-NCHW-FP32-B=ConvOclDirectFwd1x1:1,64,1,1,0,4,16,4,0
576-14-14-1x1-64-14-14-32-0x0-1x1-1x1-0-NCHW-FP32-F=ConvOclDirectFwd1x1:1,8,1,1,1,0,16,128,0
64-14-14-1x1-576-14-14-32-0x0-1x1-1x1-0-NCHW-FP32-B=ConvOclDirectFwd1x1:1,64,1,1,0,1,16,4,0
576-14-14-1x1-96-14-14-32-0x0-1x1-1x1-0-NCHW-FP32-F=ConvOclDirectFwd1x1:1,8,1,1,1,1,16,128,0
96-14-14-1x1-576-14-14-32-0x0-1x1-1x1-0-NCHW-FP32-B=ConvOclDirectFwd1x1:1,128,1,1,0,1,16,4,0
576-4-4-1x1-128-4-4-32-0x0-1x1-1x1-0-NCHW-FP32-F=ConvOclDirectFwd1x1:16,16,16,16,1,1,2,3,1
128-4-4-1x1-576-4-4-32-0x0-1x1-1x1-0-NCHW-FP32-B=ConvOclDirectFwd1x1:1,128,1,1,0,1,4,8,0
576-14-14-1x1-192-14-14-32-0x0-1x1-1x1-0-NCHW-FP32-F=ConvOclDirectFwd1x1:1,8,1,1,1,1,16,2048,0
192-14-14-1x1-576-14-14-32-0x0-1x1-1x1-0-NCHW-FP32-B=ConvOclDirectFwd1x1:1,64,1,1,0,4,16,4,0
576-14-14-1x1-160-14-14-32-0x0-1x1-1x1-0-NCHW-FP32-F=ConvOclDirectFwd1x1:1,8,1,1,1,1,16,2048,0
160-14-14-1x1-576-14-14-32-0x0-1x1-1x1-0-NCHW-FP32-B=ConvOclDirectFwd1x1:1,64,1,1,0,4,16,4,0
608-14-14-1x1-96-14-14-32-0x0-1x1-1x1-0-NCHW-FP32-F=ConvOclDirectFwd1x1:1,8,1,1,1,1,16,128,0
96-14-14-1x1-608-14-14-32-0x0-1x1-1x1-0-NCHW-FP32-B=ConvOclDirectFwd1x1:1,64,1,1,0,1,16,4,0
608-14-14-1x1-128-14-14-32-0x0-1x1-1x1-0-NCHW-FP32-F=ConvOclDirectFwd1x1:1,8,1,1,1,0,16,256,0
128-14-14-1x1-608-14-14-32-0x0-1x1-1x1-0-NCHW-FP32-B=ConvOclDirectFwd1x1:1,64,1,1,0,1,16,4,0
608-14-14-1x1-160-14-14-32-0x0-1x1-1x1-0-NCHW-FP32-F=ConvOclDirectFwd1x1:1,8,1,1,1,1,16,2048,0
160-14-14-1x1-608-14-14-32-0x0-1x1-1x1-0-NCHW-FP32-B=ConvOclDirectFwd1x1:1,64,1,1,0,1,16,4,0
608-4-4-1x1-128-4-4-32-0x0-1x1-1x1-0-NCHW-FP32-F=ConvOclDirectFwd1x1:1,8,1,1,1,4,16,64,0
128-4-4-1x1-608-4-4-32-0x0-1x1-1x1-0-NCHW-FP32-B=ConvOclDirectFwd1x1:1,128,1,1,0,1,4,8,0
608-14-14-1x1-192-14-14-32-0x0-1x1-1x1-0-NCHW-FP32-F=ConvOclDirectFwd1x1:1,8,1,1,1,0,16,2048,0
192-14-14-1x1-608-14-14-32-0x0-1x1-1x1-0-NCHW-FP32-B=ConvOclDirectFwd1x1:1,64,1,1,0,4,16,4,0
1056-7-7-1x1-352-7-7-32-0x0-1x1-1x1-0-NCHW-FP32-F=ConvOclDirectFwd1x1:1,8,1,1,1,1,16,256,0
352-7-7-1x1-1056-7-7-32-0x0-1x1-1x1-0-NCHW-FP32-B=ConvOclDirectFwd1x1:1,64,1,1,0,1,16,4,0
1056-7-7-1x1-192-7-7-32-0x0-1x1-1x1-0-NCHW-FP32-F=ConvOclDirectFwd1x1:1,8,1,1,1,0,16,256,0
192-7-7-1x1-1056-7-7-32-0x0-1x1-1x1-0-NCHW-FP32-B=ConvOclDirectFwd1x1:1,64,1,1,0,1,16,4,0
1056-7-7-1x1-160-7-7-32-0x0-1x1-1x1-0-NCHW-FP32-F=ConvOclDirectFwd1x1:1,8,1,1,1,4,16,256,0
160-7-7-1x1-1056-7-7-32-0x0-1x1-1x1-0-NCHW-FP32-B=ConvOclDirectFwd1x1:1,64,1,1,0,1,16,4,0
1056-7-7-1x1-128-7-7-32-0x0-1x1-1x1-0-NCHW-FP32-F=ConvOclDirectFwd1x1:1,8,1,1,1,0,16,256,0
128-7-7-1x1-1056-7-7-32-0x0-1x1-1x1-0-NCHW-FP32-B=ConvOclDirectFwd1x1:1,64,1,1,0,1,16,4,0
1024-7-7-1x1-352-7-7-32-0x0-1x1-1x1-0-NCHW-FP32-F=ConvOclDirectFwd1x1:1,8,1,1,1,1,16,256,0
352-7-7-1x1-1024-7-7-32-0x0-1x1-1x1-0-NCHW-FP32-B=ConvOclDirectFwd1x1:1,256,1,1,0,1,16,4,0
1024-7-7-1x1-192-7-7-32-0x0-1x1-1x1-0-NCHW-FP32-F=ConvOclDirectFwd1x1:1,8,1,1,1,1,16,256,0
192-7-7-1x1-1024-7-7-32-0x0-1x1-1x1-0-NCHW-FP32-B=ConvOclDirectFwd1x1:1,64,1,1,0,1,16,4,0
1024-7-7-1x1-128-7-7-32-0x0-1x1-1x1-0-NCHW-FP32-F=ConvOclDirectFwd1x1:1,8,1,1,1,4,16,256,0
128-7-7-1x1-1024-7-7-32-0x0-1x1-1x1-0-NCHW-FP32-B=ConvOclDirectFwd1x1:1,256,1,1,0,1,16,4,0
64-56-56-1x1-64-56-56-64-0x0-1x1-1x1-0-NCHW-FP32-F=ConvOclDirectFwd1x1:1,8,1,1,1,4,16,256,0
64-56-56-1x1-64-56-56-64-0x0-1x1-1x1-0-NCHW-FP32-B=ConvOclDirectFwd1x1:1,64,1,1,0,1,32,4,0
192-28-28-1x1-64-28-28-64-0x0-1x1-1x1-0-NCHW-FP32-F=ConvOclDirectFwd1x1:1,8,1,1,1,4,16,2048,0
64-28-28-1x1-192-28-28-64-0x0-1x1-1x1-0-NCHW-FP32-B=ConvOclDirectFwd1x1:1,128,1,1,0,2,32,4,0
192-28-28-1x1-32-28-28-64-0x0-1x1-1x1-0-NCHW-FP32-F=ConvOclDirectFwd1x1:1,8,1,1,1,4,16,2048,0
32-28-28-1x1-192-28-28-64-0x0-1x1-1x1-0-NCHW-FP32-B=ConvOclDirectFwd1x1:1,256,1,1,0,2,32,4,0
256-28-28-1x1-64-28-28-64-0x0-1x1-1x1-0-NCHW-FP32-F=ConvOclDirectFwd1x1:1,8,1,1,1,1,16,2048,0
64-28-28-1x1-256-28-28-64-0x0-1x1-1x1-0-NCHW-FP32-B=ConvOclDirectFwd1x1:1,256,1,1,0,2,32,4,0
320-28-28-1x1-128-28-28-64-0x0-1x1-1x1-0-NCHW-FP32-F=ConvOclDirectFwd1x1:1,8,1,1,1,1,16,2048,0
128-28-28-1x1-320-28-28-64-0x0-1x1-1x1-0-NCHW-FP32-B=ConvOclDirectFwd1x1:1,128,1,1,0,2,32,4,0
320-28-28-1x1-64-28-28-64-0x0-1x1-1x1-0-NCHW-FP32-F=ConvOclDirectFwd1x1:1,8,1,1,1,1,16,2048,0
64-28-28-1x1-320-28-28-64-0x0-1x1-1x1-0-NCHW-FP32-B=ConvOclDirectFwd1x1:1,128,1,1,0,2,32,4,0
576-14-14-1x1-224-14-14-64-0x0-1x1-1x1-0-NCHW-FP32-F=ConvOclDirectFwd1x1:1,8,1,1,1,1,16,2048,0
224-14-14-1x1-576-14-14-64-0x0-1x1-1x1-0-NCHW-FP32-B=ConvOclDirectFwd1x1:1,256,1,1,0,2,32,4,0
576-14-14-1x1-64-14-14-64-0x0-1x1-1x1-0-NCHW-FP32-F=ConvOclDirectFwd1x1:1,8,1,1,1,0,16,128,0
64-14-14-1x1-576-14-14-64-0x0-1x1-1x1-0-NCHW-FP32-B=ConvOclDirectFwd1x1:1,256,1,1,0,1,16,4,0
576-14-14-1x1-96-14-14-64-0x0-1x1-1x1-0-NCHW-FP32-F=ConvOclDirectFwd1x1:1,8,1,1,1,4,16,2048,0
96-14-14-1x1-576-14-14-64-0x0-1x1-1x1-0-NCHW-FP32-B=ConvOclDirectFwd1x1:1,64,1,1,0,2,32,4,0
576-4-4-1x1-128-4-4-64-0x0-1x1-1x1-0-NCHW-FP32-F=ConvOclDirectFwd1x1:1,8,1,1,1,4,16,128,0
128-4-4-1x1-576-4-4-64-0x0-1x1-1x1-0-NCHW-FP32-B=ConvOclDirectFwd1x1:1,128,1,1,0,1,8,8,0
576-14-14-1x1-192-14-14-64-0x0-1x1-1x1-0-NCHW-FP32-F=ConvOclDirectFwd1x1:1,8,1,1,1,1,16,2048,0
192-14-14-1x1-576-14-14-64-0x0-1x1-1x1-0-NCHW-FP32-B=ConvOclDirectFwd1x1:1,64,1,1,0,2,32,4,0
576-14-14-1x1-160-14-14-64-0x0-1x1-1x1-0-NCHW-FP32-F=ConvOclDirectFwd1x1:1,8,1,1,1,1,16,2048,0
160-14-14-1x1-576-14-14-64-0x0-1x1-1x1-0-NCHW-FP32-B=ConvOclDirectFwd1x1:1,64,1,1,0,2,32,4,0
608-14-14-1x1-96-14-14-64-0x0-1x1-1x1-0-NCHW-FP32-F=ConvOclDirectFwd1x1:1,8,1,1,1,4,16,2048,0
96-14-14-1x1-608-14-14-64-0x0-1x1-1x1-0-NCHW-FP32-B=ConvOclDirectFwd1x1:1,64,1,1,0,2,32,4,0
608-14-14-1x1-128-14-14-64-0x0-1x1-1x1-0-NCHW-FP32-F=ConvOclDirectFwd1x1:1,8,1,1,1,4,16,256,0
128-14-14-1x1-608-14-14-64-0x0-1x1-1x1-0-NCHW-FP32-B=ConvOclDirectFwd1x1:1,256,1,1,0,2,32,4,0
608-14-14-1x1-160-14-14-64-0x0-1x1-1x1-0-NCHW-FP32-F=ConvOclDirectFwd1x1:1,8,1,1,1,1,16,2048,0
160-14-14-1x1-608-14-14-64-0x0-1x1-1x1-0-NCHW-FP32-B=ConvOclDirectFwd1x1:1,64,1,1,0,2,32,4,0
608-4-4-1x1-128-4-4-64-0x0-1x1-1x1-0-NCHW-FP32-F=ConvOclDirectFwd1x1:1,8,1,1,1,1,16,128,0
128-4-4-1x1-608-4-4-64-0x0-1x1-1x1-0-NCHW-FP32-B=ConvOclDirectFwd1x1:1,64,1,1,0,1,8,8,0
608-14-14-1x1-192-14-14-64-0x0-1x1-1x1-0-NCHW-FP32-F=ConvOclDirectFwd1x1:1,8,1,1,1,1,16,2048,0
192-14-14-1x1-608-14-14-64-0x0-1x1-1x1-0-NCHW-FP32-B=ConvOclDirectFwd1x1:1,64,1,1,0,2,32,4,0
1056-7-7-1x1-352-7-7-64-0x0-1x1-1x1-0-NCHW-FP32-F=ConvOclDirectFwd1x1:1,8,1,1,1,1,16,2048,0
352-7-7-1x1-1056-7-7-64-0x0-1x1-1x1-0-NCHW-FP32-B=ConvOclDirectFwd1x1:1,64,1,1,0,1,16,4,0
1056-7-7-1x1-192-7-7-64-0x0-1x1-1x1-0-NCHW-FP32-F=ConvOclDirectFwd1x1:1,8,1,1,1,4,16,256,0
192-7-7-1x1-1056-7-7-64-0x0-1x1-1x1-0-NCHW-FP32-B=ConvOclDirectFwd1x1:1,128,1,1,0,1,16,4,0
1056-7-7-1x1-160-7-7-64-0x0-1x1-1x1-0-NCHW-FP32-F=ConvOclDirectFwd1x1:1,8,1,1,1,0,16,256,0
160-7-7-1x1-1056-7-7-64-0x0-1x1-1x1-0-NCHW-FP32-B=ConvOclDirectFwd1x1:1,64,1,1,0,1,16,4,0
1056-7-7-1x1-128-7-7-64-0x0-1x1-1x1-0-NCHW-FP32-F=ConvOclDirectFwd1x1:1,8,1,1,1,4,16,256,0
128-7-7-1x1-1056-7-7-64-0x0-1x1-1x1-0-NCHW-FP32-B=ConvOclDirectFwd1x1:1,64,1,1,0,1,16,4,0
1024-7-7-1x1-352-7-7-64-0x0-1x1-1x1-0-NCHW-FP32-F=ConvOclDirectFwd1x1:1,8,1,1,1,1,16,256,0
352-7-7-1x1-1024-7-7-64-0x0-1x1-1x1-0-NCHW-FP32-B=ConvOclDirectFwd1x1:1,256,1,1,0,1,16,4,0
1024-7-7-1x1-192-7-7-64-0x0-1x1-1x1-0-NCHW-FP32-F=ConvOclDirectFwd1x1:1,8,1,1,1,4,16,256,0
192-7-7-1x1-1024-7-7-64-0x0-1x1-1x1-0-NCHW-FP32-B=ConvOclDirectFwd1x1:1,256,1,1,0,1,16,4,0
1024-7-7-1x1-128-7-7-64-0x0-1x1-1x1-0-NCHW-FP32-F=ConvOclDirectFwd1x1:1,8,1,1,1,4,16,128,0
128-7-7-1x1-1024-7-7-64-0x0-1x1-1x1-0-NCHW-FP32-B=ConvOclDirectFwd1x1:1,256,1,1,0,1,16,4,0
64-256-512-1x1-64-256-512-1-0x0-1x1-1x1-0-NCHW-FP32-F=ConvOclDirectFwd1x1:1,8,1,1,1,0,32,2048,0
64-256-512-1x1-64-256-512-1-0x0-1x1-1x1-0-NCHW-FP32-B=ConvOclDirectFwd1x1:1,256,1,1,0,2,32,4,0
192-128-256-1x1-64-128-256-1-0x0-1x1-1x1-0-NCHW-FP32-F=ConvOclDirectFwd1x1:1,8,1,1,1,4,16,2048,0
64-128-256-1x1-192-128-256-1-0x0-1x1-1x1-0-NCHW-FP32-B=ConvOclDirectFwd1x1:1,256,1,1,0,1,32,4,0
192-128-256-1x1-96-128-256-1-0x0-1x1-1x1-0-NCHW-FP32-F=ConvOclDirectFwd1x1:1,8,1,1,1,4,16,2048,0
96-128-256-1x1-192-128-256-1-0x0-1x1-1x1-0-NCHW-FP32-B=ConvOclDirectFwd1x1:1,256,1,1,0,2,32,4,0
192-128-256-1x1-32-128-256-1-0x0-1x1-1x1-0-NCHW-FP32-F=ConvOclDirectFwd1x1:1,8,1,1,1,4,16,2048,0
32-128-256-1x1-192-128-256-1-0x0-1x1-1x1-0-NCHW-FP32-B=ConvOclDirectFwd1x1:1,256,1,1,0,1,32,4,0
256-128-256-1x1-128-128-256-1-0x0-1x1-1x1-0-NCHW-FP32-F=ConvOclDirectFwd1x1:1,8,1,1,1,1,16,2048,0
128-128-256-1x1-256-128-256-1-0x0-1x1-1x1-0-NCHW-FP32-B=ConvOclDirectFwd1x1:1,64,1,1,0,1,32,4,0
256-128-256-1x1-32-128-256-1-0x0-1x1-1x1-0-NCHW-FP32-F=ConvOclDirectFwd1x1:1,8,1,1,1,0,16,2048,0
32-128-256-1x1-256-128-256-1-0x0-1x1-1x1-0-NCHW-FP32-B=ConvOclDirectFwd1x1:1,256,1,1,0,1,32,4,0
256-128-256-1x1-64-128-256-1-0x0-1x1-1x1-0-NCHW-FP32-F=ConvOclDirectFwd1x1:1,8,1,1,1,1,16,2048,0
64-128-256-1x1-256-128-256-1-0x0-1x1-1x1-0-NCHW-FP32-B=ConvOclDirectFwd1x1:1,128,1,1,0,2,32,4,0
480-64-128-1x1-192-64-128-1-0x0-1x1-1x1-0-NCHW-FP32-F=ConvOclDirectFwd1x1:1,8,1,1,1,4,16,256,0
192-64-128-1x1-480-64-128-1-0x0-1x1-1x1-0-NCHW-FP32-B=ConvOclDirectFwd1x1:1,64,1,1,0,2,16,4,0
480-64-128-1x1-96-64-128-1-0x0-1x1-1x1-0-NCHW-FP32-F=ConvOclDirectFwd1x1:1,8,1,1,1,1,16,2048,0
96-64-128-1x1-480-64-128-1-0x0-1x1-1x1-0-NCHW-FP32-B=ConvOclDirectFwd1x1:1,256,1,1,0,1,16,4,0
480-64-128-1x1-16-64-128-1-0x0-1x1-1x1-0-NCHW-FP32-F=ConvOclDirectFwd1x1:1,8,1,1,1,4,32,64,0
16-64-128-1x1-480-64-128-1-0x0-1x1-1x1-0-NCHW-FP32-B=ConvOclDirectFwd1x1:1,256,1,1,0,1,16,4,0
480-64-128-1x1-64-64-128-1-0x0-1x1-1x1-0-NCHW-FP32-F=ConvOclDirectFwd1x1:1,8,1,1,1,1,16,256,0
64-64-128-1x1-480-64-128-1-0x0-1x1-1x1-0-NCHW-FP32-B=ConvOclDirectFwd1x1:1,256,1,1,0,1,16,4,0
512-64-128-1x1-160-64-128-1-0x0-1x1-1x1-0-NCHW-FP32-F=ConvOclDirectFwd1x1:1,8,1,1,1,1,16,2048,0
160-64-128-1x1-512-64-128-1-0x0-1x1-1x1-0-NCHW-FP32-B=ConvOclDirectFwd1x1:1,256,1,1,0,2,16,4,0
512-64-128-1x1-112-64-128-1-0x0-1x1-1x1-0-NCHW-FP32-F=ConvOclDirectFwd1x1:1,8,1,1,1,1,32,2048,0
112-64-128-1x1-512-64-128-1-0x0-1x1-1x1-0-NCHW-FP32-B=ConvOclDirectFwd1x1:1,256,1,1,0,1,16,4,0
512-128-128-1x1-24-128-128-1-0x0-1x1-1x1-0-NCHW-FP32-F=ConvOclDirectFwd1x1:1,64,1,1,0,4,8,4,0
24-128-128-1x1-512-128-128-1-0x0-1x1-1x1-0-NCHW-FP32-B=ConvOclDirectFwd1x1:1,256,1,1,0,1,16,4,0
512-64-128-1x1-64-64-128-1-0x0-1x1-1x1-0-NCHW-FP32-F=ConvOclDirectFwd1x1:1,8,1,1,1,4,16,256,0
64-64-128-1x1-512-64-128-1-0x0-1x1-1x1-0-NCHW-FP32-B=ConvOclDirectFwd1x1:1,256,1,1,0,2,16,4,0
512-64-128-1x1-128-64-128-1-0x0-1x1-1x1-0-NCHW-FP32-F=ConvOclDirectFwd1x1:1,8,1,1,1,1,16,2048,0
128-64-128-1x1-512-64-128-1-0x0-1x1-1x1-0-NCHW-FP32-B=ConvOclDirectFwd1x1:1,256,1,1,0,2,16,4,0
512-64-128-1x1-24-64-128-1-0x0-1x1-1x1-0-NCHW-FP32-F=ConvOclDirectFwd1x1:1,64,1,1,0,2,4,8,0
24-64-128-1x1-512-64-128-1-0x0-1x1-1x1-0-NCHW-FP32-B=ConvOclDirectFwd1x1:1,256,1,1,0,1,16,4,0
512-64-128-1x1-144-64-128-1-0x0-1x1-1x1-0-NCHW-FP32-F=ConvOclDirectFwd1x1:1,8,1,1,1,1,64,2048,0
144-64-128-1x1-512-64-128-1-0x0-1x1-1x1-0-NCHW-FP32-B=ConvOclDirectFwd1x1:1,256,1,1,0,2,16,4,0
512-64-128-1x1-32-64-128-1-0x0-1x1-1x1-0-NCHW-FP32-F=ConvOclDirectFwd1x1:1,8,1,1,1,4,16,128,0
32-64-128-1x1-512-64-128-1-0x0-1x1-1x1-0-NCHW-FP32-B=ConvOclDirectFwd1x1:1,256,1,1,0,1,16,4,0
528-64-128-1x1-256-64-128-1-0x0-1x1-1x1-0-NCHW-FP32-F=ConvOclDirectFwd1x1:1,8,1,1,1,0,16,2048,0
256-64-128-1x1-528-64-128-1-0x0-1x1-1x1-0-NCHW-FP32-B=ConvOclDirectFwd1x1:1,256,1,1,0,2,16,4,0
528-64-128-1x1-160-64-128-1-0x0-1x1-1x1-0-NCHW-FP32-F=ConvOclDirectFwd1x1:1,8,1,1,1,1,16,2048,0
160-64-128-1x1-528-64-128-1-0x0-1x1-1x1-0-NCHW-FP32-B=ConvOclDirectFwd1x1:1,64,1,1,0,2,16,4,0
528-64-128-1x1-32-64-128-1-0x0-1x1-1x1-0-NCHW-FP32-F=ConvOclDirectFwd1x1:1,8,1,1,1,1,16,128,0
32-64-128-1x1-528-64-128-1-0x0-1x1-1x1-0-NCHW-FP32-B=ConvOclDirectFwd1x1:1,128,1,1,0,1,16,4,0
528-64-128-1x1-128-64-128-1-0x0-1x1-1x1-0-NCHW-FP32-F=ConvOclDirectFwd1x1:1,8,1,1,1,1,16,2048,0
128-64-128-1x1-528-64-128-1-0x0-1x1-1x1-0-NCHW-FP32-B=ConvOclDirectFwd1x1:1,64,1,1,0,2,16,4,0
832-64-128-1x1-256-64-128-1-0x0-1x1-1x1-0-NCHW-FP32-F=ConvOclDirectFwd1x1:1,8,1,1,1,1,16,2048,0
256-64-128-1x1-832-64-128-1-0x0-1x1-1x1-0-NCHW-FP32-B=ConvOclDirectFwd1x1:1,256,1,1,0,2,16,4,0
832-64-128-1x1-160-64-128-1-0x0-1x1-1x1-0-NCHW-FP32-F=ConvOclDirectFwd1x1:1,8,1,1,1,1,16,2048,0
160-64-128-1x1-832-64-128-1-0x0-1x1-1x1-0-NCHW-FP32-B=ConvOclDirectFwd1x1:1,256,1,1,0,2,16,4,0
832-64-128-1x1-32-64-128-1-0x0-1x1-1x1-0-NCHW-FP32-F=ConvOclDirectFwd1x1:1,8,1,1,1,1,16,256,0
32-64-128-1x1-832-64-128-1-0x0-1x1-1x1-0-NCHW-FP32-B=ConvOclDirectFwd1x1:1,256,1,1,0,1,16,4,0
832-64-128-1x1-128-64-128-1-0x0-1x1-1x1-0-NCHW-FP32-F=ConvOclDirectFwd1x1:1,8,1,1,1,1,16,2048,0
128-64-128-1x1-832-64-128-1-0x0-1x1-1x1-0-NCHW-FP32-B=ConvOclDirectFwd1x1:1,256,1,1,0,2,16,4,0
832-64-128-1x1-384-64-128-1-0x0-1x1-1x1-0-NCHW-FP32-F=ConvOclDirectFwd1x1:1,8,1,1,1,1,16,2048,0
384-64-128-1x1-832-64-128-1-0x0-1x1-1x1-0-NCHW-FP32-B=ConvOclDirectFwd1x1:1,256,1,1,0,2,16,4,0
832-64-128-1x1-192-64-128-1-0x0-1x1-1x1-0-NCHW-FP32-F=ConvOclDirectFwd1x1:1,8,1,1,1,1,16,2048,0
192-64-128-1x1-832-64-128-1-0x0-1x1-1x1-0-NCHW-FP32-B=ConvOclDirectFwd1x1:1,256,1,1,0,2,16,4,0
832-64-128-1x1-48-64-128-1-0x0-1x1-1x1-0-NCHW-FP32-F=ConvOclDirectFwd1x1:1,8,1,1,1,1,32,128,0
48-64-128-1x1-832-64-128-1-0x0-1x1-1x1-0-NCHW-FP32-B=ConvOclDirectFwd1x1:1,256,1,1,0,1,16,4,0
1024-64-128-1x1-19-64-128-1-0x0-1x1-1x1-0-NCHW-FP32-F=ConvOclDirectFwd1x1:1,64,1,1,0,4,8,4,0
19-64-128-1x1-1024-64-128-1-0x0-1x1-1x1-0-NCHW-FP32-B=ConvOclDirectFwd1x1:1,256,1,1,0,2,16,4,0
64-56-56-1x1-256-56-56-64-0x0-1x1-1x1-0-NCHW-FP32-F=ConvOclDirectFwd1x1:1,8,1,1,1,1,32,256,0
256-56-56-1x1-64-56-56-64-0x0-1x1-1x1-0-NCHW-FP32-B=ConvOclDirectFwd1x1:1,64,1,1,0,2,32,4,0
256-56-56-1x1-128-56-56-64-0x0-1x1-1x1-0-NCHW-FP32-F=ConvOclDirectFwd1x1:1,8,1,1,1,0,16,2048,0
128-56-56-1x1-256-56-56-64-0x0-1x1-1x1-0-NCHW-FP32-B=ConvOclDirectFwd1x1:1,256,1,1,0,1,32,4,0
256-56-56-1x1-64-56-56-64-0x0-1x1-1x1-0-NCHW-FP32-F=ConvOclDirectFwd1x1:1,8,1,1,1,4,16,2048,0
64-56-56-1x1-256-56-56-64-0x0-1x1-1x1-0-NCHW-FP32-B=ConvOclDirectFwd1x1:1,128,1,1,0,2,32,4,0
1024-14-14-1x1-512-14-14-64-0x0-1x1-1x1-0-NCHW-FP32-F=ConvOclDirectFwd1x1:1,8,1,1,1,0,16,2048,0
512-14-14-1x1-1024-14-14-64-0x0-1x1-1x1-0-NCHW-FP32-B=ConvOclDirectFwd1x1:1,64,1,1,0,2,32,4,0
512-28-28-1x1-256-28-28-64-0x0-1x1-1x1-0-NCHW-FP32-F=ConvOclDirectFwd1x1:1,8,1,1,1,1,16,2048,0
256-28-28-1x1-512-28-28-64-0x0-1x1-1x1-0-NCHW-FP32-B=ConvOclDirectFwd1x1:1,64,1,1,0,2,32,4,0
256-14-14-1x1-1024-14-14-32-0x0-1x1-1x1-0-NCHW-FP32-F=ConvOclDirectFwd1x1:1,8,1,1,1,0,16,2048,0
1024-14-14-1x1-256-14-14-32-0x0-1x1-1x1-0-NCHW-FP32-B=ConvOclDirectFwd1x1:1,64,1,1,0,4,16,4,0
1024-14-14-1x1-256-14-14-32-0x0-1x1-1x1-0-NCHW-FP32-F=ConvOclDirectFwd1x1:1,8,1,1,1,0,16,256,0
256-14-14-1x1-1024-14-14-32-0x0-1x1-1x1-0-NCHW-FP32-B=ConvOclDirectFwd1x1:1,64,1,1,0,2,16,4,0
128-28-28-1x1-512-28-28-32-0x0-1x1-1x1-0-NCHW-FP32-F=ConvOclDirectFwd1x1:1,8,1,1,1,1,16,2048,0
512-28-28-1x1-128-28-28-32-0x0-1x1-1x1-0-NCHW-FP32-B=ConvOclDirectFwd1x1:1,128,1,1,0,1,32,4,0
512-7-7-1x1-2048-7-7-32-0x0-1x1-1x1-0-NCHW-FP32-F=ConvOclDirectFwd1x1:1,8,1,1,1,0,16,2048,0
2048-7-7-1x1-512-7-7-32-0x0-1x1-1x1-0-NCHW-FP32-B=ConvOclDirectFwd1x1:1,64,1,1,0,1,16,4,0
64-56-56-1x1-256-56-56-32-0x0-1x1-1x1-0-NCHW-FP32-F=ConvOclDirectFwd1x1:1,8,1,1,1,1,32,256,0
256-56-56-1x1-64-56-56-32-0x0-1x1-1x1-0-NCHW-FP32-B=ConvOclDirectFwd1x1:1,128,1,1,0,2,32,4,0
2048-7-7-1x1-512-7-7-32-0x0-1x1-1x1-0-NCHW-FP32-F=ConvOclDirectFwd1x1:1,8,1,1,1,4,16,2048,0
512-7-7-1x1-2048-7-7-32-0x0-1x1-1x1-0-NCHW-FP32-B=ConvOclDirectFwd1x1:1,64,1,1,0,1,16,4,0
512-28-28-1x1-128-28-28-32-0x0-1x1-1x1-0-NCHW-FP32-F=ConvOclDirectFwd1x1:1,8,1,1,1,1,16,2048,0
128-28-28-1x1-512-28-28-32-0x0-1x1-1x1-0-NCHW-FP32-B=ConvOclDirectFwd1x1:1,64,1,1,0,2,32,4,0
256-56-56-1x1-128-56-56-32-0x0-1x1-1x1-0-NCHW-FP32-F=ConvOclDirectFwd1x1:1,8,1,1,1,0,16,2048,0
128-56-56-1x1-256-56-56-32-0x0-1x1-1x1-0-NCHW-FP32-B=ConvOclDirectFwd1x1:1,64,1,1,0,1,32,4,0
256-56-56-1x1-64-56-56-32-0x0-1x1-1x1-0-NCHW-FP32-F=ConvOclDirectFwd1x1:1,8,1,1,1,1,16,2048,0
64-56-56-1x1-256-56-56-32-0x0-1x1-1x1-0-NCHW-FP32-B=ConvOclDirectFwd1x1:1,256,1,1,0,1,32,4,0
1024-14-14-1x1-512-14-14-32-0x0-1x1-1x1-0-NCHW-FP32-F=ConvOclDirectFwd1x1:1,8,1,1,1,0,16,2048,0
512-14-14-1x1-1024-14-14-32-0x0-1x1-1x1-0-NCHW-FP32-B=ConvOclDirectFwd1x1:1,64,1,1,0,2,16,4,0
512-28-28-1x1-256-28-28-32-0x0-1x1-1x1-0-NCHW-FP32-F=ConvOclDirectFwd1x1:1,8,1,1,1,1,16,2048,0
256-28-28-1x1-512-28-28-32-0x0-1x1-1x1-0-NCHW-FP32-B=ConvOclDirectFwd1x1:1,128,1,1,0,2,32,4,0
64-56-56-1x1-64-56-56-128-0x0-1x1-1x1-0-NCHW-FP32-F=ConvOclDirectFwd1x1:1,8,1,1,1,4,16,2048,0
64-56-56-1x1-64-56-56-128-0x0-1x1-1x1-0-NCHW-FP32-B=ConvOclDirectFwd1x1:1,128,1,1,0,2,32,4,0
192-28-28-1x1-64-28-28-128-0x0-1x1-1x1-0-NCHW-FP32-F=ConvOclDirectFwd1x1:1,8,1,1,1,1,16,2048,0
64-28-28-1x1-192-28-28-128-0x0-1x1-1x1-0-NCHW-FP32-B=ConvOclDirectFwd1x1:1,256,1,1,0,2,32,4,0
192-28-28-1x1-96-28-28-128-0x0-1x1-1x1-0-NCHW-FP32-F=ConvOclDirectFwd1x1:1,8,1,1,1,0,16,2048,0
96-28-28-1x1-192-28-28-128-0x0-1x1-1x1-0-NCHW-FP32-B=ConvOclDirectFwd1x1:1,256,1,1,0,2,32,4,0
192-28-28-1x1-16-28-28-128-0x0-1x1-1x1-0-NCHW-FP32-F=ConvOclDirectFwd1x1:1,8,1,1,1,1,16,2048,0
16-28-28-1x1-192-28-28-128-0x0-1x1-1x1-0-NCHW-FP32-B=ConvOclDirectFwd1x1:1,128,1,1,0,2,32,4,0
192-28-28-1x1-32-28-28-128-0x0-1x1-1x1-0-NCHW-FP32-F=ConvOclDirectFwd1x1:1,8,1,1,1,1,16,2048,0
32-28-28-1x1-192-28-28-128-0x0-1x1-1x1-0-NCHW-FP32-B=ConvOclDirectFwd1x1:1,128,1,1,0,1,32,4,0
256-28-28-1x1-128-28-28-128-0x0-1x1-1x1-0-NCHW-FP32-F=ConvOclDirectFwd1x1:1,8,1,1,1,1,16,2048,0
128-28-28-1x1-256-28-28-128-0x0-1x1-1x1-0-NCHW-FP32-B=ConvOclDirectFwd1x1:1,256,1,1,0,2,32,4,0
256-28-28-1x1-32-28-28-128-0x0-1x1-1x1-0-NCHW-FP32-F=ConvOclDirectFwd1x1:1,8,1,1,1,1,16,256,0
32-28-28-1x1-256-28-28-128-0x0-1x1-1x1-0-NCHW-FP32-B=ConvOclDirectFwd1x1:1,128,1,1,0,1,32,4,0
256-28-28-1x1-64-28-28-128-0x0-1x1-1x1-0-NCHW-FP32-F=ConvOclDirectFwd1x1:1,8,1,1,1,4,16,2048,0
64-28-28-1x1-256-28-28-128-0x0-1x1-1x1-0-NCHW-FP32-B=ConvOclDirectFwd1x1:1,256,1,1,0,2,32,4,0
480-14-14-1x1-192-14-14-128-0x0-1x1-1x1-0-NCHW-FP32-F=ConvOclDirectFwd1x1:1,8,1,1,1,1,16,2048,0
192-14-14-1x1-480-14-14-128-0x0-1x1-1x1-0-NCHW-FP32-B=ConvOclDirectFwd1x1:1,64,1,1,0,2,32,4,0
480-14-14-1x1-96-14-14-128-0x0-1x1-1x1-0-NCHW-FP32-F=ConvOclDirectFwd1x1:1,8,1,1,1,4,16,2048,0
96-14-14-1x1-480-14-14-128-0x0-1x1-1x1-0-NCHW-FP32-B=ConvOclDirectFwd1x1:1,128,1,1,0,2,32,4,0
480-14-14-1x1-16-14-14-128-0x0-1x1-1x1-0-NCHW-FP32-F=ConvOclDirectFwd1x1:1,8,1,1,1,0,32,256,0
16-14-14-1x1-480-14-14-128-0x0-1x1-1x1-0-NCHW-FP32-B=ConvOclDirectFwd1x1:1,128,1,1,0,1,8,8,0
480-14-14-1x1-64-14-14-128-0x0-1x1-1x1-0-NCHW-FP32-F=ConvOclDirectFwd1x1:1,8,1,1,1,1,16,128,0
64-14-14-1x1-480-14-14-128-0x0-1x1-1x1-0-NCHW-FP32-B=ConvOclDirectFwd1x1:1,256,1,1,0,2,32,4,0
512-14-14-1x1-160-14-14-128-0x0-1x1-1x1-0-NCHW-FP32-F=ConvOclDirectFwd1x1:1,8,1,1,1,1,16,2048,0
160-14-14-1x1-512-14-14-128-0x0-1x1-1x1-0-NCHW-FP32-B=ConvOclDirectFwd1x1:1,256,1,1,0,2,32,4,0
512-14-14-1x1-112-14-14-128-0x0-1x1-1x1-0-NCHW-FP32-F=ConvOclDirectFwd1x1:1,8,1,1,1,1,32,2048,0
112-14-14-1x1-512-14-14-128-0x0-1x1-1x1-0-NCHW-FP32-B=ConvOclDirectFwd1x1:1,256,1,1,0,2,32,4,0
512-14-14-1x1-24-14-14-128-0x0-1x1-1x1-0-NCHW-FP32-F=ConvOclDirectFwd1x1:1,64,1,1,0,2,8,4,0
24-14-14-1x1-512-14-14-128-0x0-1x1-1x1-0-NCHW-FP32-B=ConvOclDirectFwd1x1:1,256,1,1,0,4,16,8,0
512-14-14-1x1-64-14-14-128-0x0-1x1-1x1-0-NCHW-FP32-F=ConvOclDirectFwd1x1:1,8,1,1,1,4,16,128,0
64-14-14-1x1-512-14-14-128-0x0-1x1-1x1-0-NCHW-FP32-B=ConvOclDirectFwd1x1:1,64,1,1,0,2,32,4,0
512-14-14-1x1-128-14-14-128-0x0-1x1-1x1-0-NCHW-FP32-F=ConvOclDirectFwd1x1:1,8,1,1,1,4,16,2048,0
128-14-14-1x1-512-14-14-128-0x0-1x1-1x1-0-NCHW-FP32-B=ConvOclDirectFwd1x1:1,256,1,1,0,2,32,4,0
512-14-14-1x1-144-14-14-128-0x0-1x1-1x1-0-NCHW-FP32-F=ConvOclDirectFwd1x1:1,8,1,1,1,0,16,2048,0
144-14-14-1x1-512-14-14-128-0x0-1x1-1x1-0-NCHW-FP32-B=ConvOclDirectFwd1x1:1,256,1,1,0,2,32,4,0
512-14-14-1x1-32-14-14-128-0x0-1x1-1x1-0-NCHW-FP32-F=ConvOclDirectFwd1x1:1,8,1,1,1,1,16,128,0
32-14-14-1x1-512-14-14-128-0x0-1x1-1x1-0-NCHW-FP32-B=ConvOclDirectFwd1x1:1,256,1,1,0,2,32,4,0
528-14-14-1x1-256-14-14-128-0x0-1x1-1x1-0-NCHW-FP32-F=ConvOclDirectFwd1x1:1,8,1,1,1,1,16,2048,0
256-14-14-1x1-528-14-14-128-0x0-1x1-1x1-0-NCHW-FP32-B=ConvOclDirectFwd1x1:1,128,1,1,0,2,16,4,0
528-14-14-1x1-160-14-14-128-0x0-1x1-1x1-0-NCHW-FP32-F=ConvOclDirectFwd1x1:1,8,1,1,1,1,16,2048,0
160-14-14-1x1-528-14-14-128-0x0-1x1-1x1-0-NCHW-FP32-B=ConvOclDirectFwd1x1:1,128,1,1,0,2,16,4,0
528-14-14-1x1-32-14-14-128-0x0-1x1-1x1-0-NCHW-FP32-F=ConvOclDirectFwd1x1:1,8,1,1,1,4,16,128,0
32-14-14-1x1-528-14-14-128-0x0-1x1-1x1-0-NCHW-FP32-B=ConvOclDirectFwd1x1:1,256,1,1,0,2,16,4,0
528-14-14-1x1-128-14-14-128-0x0-1x1-1x1-0-NCHW-FP32-F=ConvOclDirectFwd1x1:1,8,1,1,1,4,16,2048,0
128-14-14-1x1-528-14-14-128-0x0-1x1-1x1-0-NCHW-FP32-B=ConvOclDirectFwd1x1:1,128,1,1,0,4,16,4,0
832-7-7-1x1-256-7-7-128-0x0-1x1-1x1-0-NCHW-FP32-F=ConvOclDirectFwd1x1:1,8,1,1,1,0,16,256,0
256-7-7-1x1-832-7-7-128-0x0-1x1-1x1-0-NCHW-FP32-B=ConvOclDirectFwd1x1:1,128,1,1,0,1,32,4,0
832-7-7-1x1-160-7-7-128-0x0-1x1-1x1-0-NCHW-FP32-F=ConvOclDirectFwd1x1:1,8,1,1,1,1,16,2048,0
160-7-7-1x1-832-7-7-128-0x0-1x1-1x1-0-NCHW-FP32-B=ConvOclDirectFwd1x1:1,64,1,1,0,1,16,4,0
832-7-7-1x1-32-7-7-128-0x0-1x1-1x1-0-NCHW-FP32-F=ConvOclDirectFwd1x1:1,8,1,1,1,0,16,128,0
32-7-7-1x1-832-7-7-128-0x0-1x1-1x1-0-NCHW-FP32-B=ConvOclDirectFwd1x1:1,256,1,1,0,1,16,4,0
832-7-7-1x1-128-7-7-128-0x0-1x1-1x1-0-NCHW-FP32-F=ConvOclDirectFwd1x1:1,8,1,1,1,4,16,256,0
128-7-7-1x1-832-7-7-128-0x0-1x1-1x1-0-NCHW-FP32-B=ConvOclDirectFwd1x1:1,64,1,1,0,1,16,4,0
832-7-7-1x1-384-7-7-128-0x0-1x1-1x1-0-NCHW-FP32-F=ConvOclDirectFwd1x1:1,8,1,1,1,4,16,2048,0
384-7-7-1x1-832-7-7-128-0x0-1x1-1x1-0-NCHW-FP32-B=ConvOclDirectFwd1x1:1,64,1,1,0,1,32,4,0
832-7-7-1x1-192-7-7-128-0x0-1x1-1x1-0-NCHW-FP32-F=ConvOclDirectFwd1x1:1,8,1,1,1,1,16,2048,0
192-7-7-1x1-832-7-7-128-0x0-1x1-1x1-0-NCHW-FP32-B=ConvOclDirectFwd1x1:1,64,1,1,0,1,16,4,0
832-7-7-1x1-48-7-7-128-0x0-1x1-1x1-0-NCHW-FP32-F=ConvOclDirectFwd1x1:1,8,1,1,1,1,16,256,0
48-7-7-1x1-832-7-7-128-0x0-1x1-1x1-0-NCHW-FP32-B=ConvOclDirectFwd1x1:1,64,1,1,0,1,16,4,0
256-56-56-1x1-512-28-28-64-0x0-2x2-1x1-0-NCHW-FP32-F=ConvOclDirectFwd1x1:1,8,1,1,1,4,16,2048,0
512-28-28-1x1-256-56-56-64-0x0-2x2-1x1-0-NCHW-FP32-B=ConvOclDirectFwd1x1:1,256,1,1,0,1,32,4,0
256-56-56-1x1-128-28-28-64-0x0-2x2-1x1-0-NCHW-FP32-F=ConvOclDirectFwd1x1:1,8,1,1,1,4,16,128,0
128-28-28-1x1-256-56-56-64-0x0-2x2-1x1-0-NCHW-FP32-B=ConvOclDirectFwd1x1:1,256,1,1,0,2,32,4,0
256-56-56-1x1-512-28-28-32-0x0-2x2-1x1-0-NCHW-FP32-F=ConvOclDirectFwd1x1:1,8,1,1,1,0,16,256,0
512-28-28-1x1-256-56-56-32-0x0-2x2-1x1-0-NCHW-FP32-B=ConvOclDirectFwd1x1:1,256,1,1,0,1,32,4,0
256-56-56-1x1-128-28-28-32-0x0-2x2-1x1-0-NCHW-FP32-F=ConvOclDirectFwd1x1:1,8,1,1,1,1,16,256,0
128-28-28-1x1-256-56-56-32-0x0-2x2-1x1-0-NCHW-FP32-B=ConvOclDirectFwd1x1:1,256,1,1,0,1,32,4,0
512-28-28-1x1-1024-14-14-32-0x0-2x2-1x1-0-NCHW-FP32-F=ConvOclDirectFwd1x1:1,8,1,1,1,4,32,2048,0
1024-14-14-1x1-512-28-28-32-0x0-2x2-1x1-0-NCHW-FP32-B=ConvOclDirectFwd1x1:1,64,1,1,0,2,16,4,0
512-28-28-1x1-256-14-14-32-0x0-2x2-1x1-0-NCHW-FP32-F=ConvOclDirectFwd1x1:1,8,1,1,1,1,32,2048,0
256-14-14-1x1-512-28-28-32-0x0-2x2-1x1-0-NCHW-FP32-B=ConvOclDirectFwd1x1:1,256,1,1,0,2,16,4,0
1024-14-14-1x1-2048-7-7-32-0x0-2x2-1x1-0-NCHW-FP32-F=ConvOclDirectFwd1x1:1,8,1,1,1,0,32,2048,0
2048-7-7-1x1-1024-14-14-32-0x0-2x2-1x1-0-NCHW-FP32-B=ConvOclDirectFwd1x1:1,256,1,1,0,1,16,4,0
1024-14-14-1x1-512-7-7-32-0x0-2x2-1x1-0-NCHW-FP32-F=ConvOclDirectFwd1x1:1,8,1,1,1,4,32,256,0
512-7-7-1x1-1024-14-14-32-0x0-2x2-1x1-0-NCHW-FP32-B=ConvOclDirectFwd1x1:1,256,1,1,0,1,16,4,0
64-56-56-1x1-256-28-28-1-0x0-2x2-1x1-0-NCHW-FP32-F=ConvOclDirectFwd1x1:1,8,1,1,1,1,16,256,0
256-28-28-1x1-64-56-56-1-0x0-2x2-1x1-0-NCHW-FP32-B=ConvOclDirectFwd1x1:1,128,1,1,0,1,4,4,0
128-28-28-1x1-512-14-14-1-0x0-2x2-1x1-0-NCHW-FP32-F=ConvOclDirectFwd1x1:1,8,1,1,1,1,16,64,0
512-14-14-1x1-128-28-28-1-0x0-2x2-1x1-0-NCHW-FP32-B=ConvOclDirectFwd1x1:1,256,1,1,0,1,4,8,0
256-14-14-1x1-1024-7-7-1-0x0-2x2-1x1-0-NCHW-FP32-F=ConvOclDirectFwd1x1:1,8,1,1,1,1,16,64,0
1024-7-7-1x1-256-14-14-1-0x0-2x2-1x1-0-NCHW-FP32-B=ConvOclDirectFwd1x1:1,128,1,1,0,1,4,8,0
64-56-56-1x1-256-28-28-2-0x0-2x2-1x1-0-NCHW-FP32-F=ConvOclDirectFwd1x1:1,8,1,1,1,0,16,128,0
256-28-28-1x1-64-56-56-2-0x0-2x2-1x1-0-NCHW-FP32-B=ConvOclDirectFwd1x1:16,16,16,16,1,1,2,3,1
128-28-28-1x1-512-14-14-2-0x0-2x2-1x1-0-NCHW-FP32-F=ConvOclDirectFwd1x1:1,8,1,1,1,4,16,64,0
512-14-14-1x1-128-28-28-2-0x0-2x2-1x1-0-NCHW-FP32-B=ConvOclDirectFwd1x1:1,256,1,1,0,1,4,8,0
256-14-14-1x1-1024-7-7-2-0x0-2x2-1x1-0-NCHW-FP32-F=ConvOclDirectFwd1x1:1,8,1,1,1,4,16,64,0
1024-7-7-1x1-256-14-14-2-0x0-2x2-1x1-0-NCHW-FP32-B=ConvOclDirectFwd1x1:1,256,1,1,0,1,4,8,0
256-56-56-1x1-128-28-28-1-0x0-2x2-1x1-0-NCHW-FP32-F=ConvOclDirectFwd1x1:1,8,1,1,1,4,16,64,0
128-28-28-1x1-256-56-56-1-0x0-2x2-1x1-0-NCHW-FP32-B=ConvOclDirectFwd1x1:1,256,1,1,0,1,4,4,0
512-28-28-1x1-256-14-14-1-0x0-2x2-1x1-0-NCHW-FP32-F=ConvOclDirectFwd1x1:16,16,16,16,1,1,2,3,1
256-14-14-1x1-512-28-28-1-0x0-2x2-1x1-0-NCHW-FP32-B=ConvOclDirectFwd1x1:1,256,1,1,0,1,4,8,0
512-28-28-1x1-1024-14-14-1-0x0-2x2-1x1-0-NCHW-FP32-F=ConvOclDirectFwd1x1:1,8,1,1,1,4,16,128,0
1024-14-14-1x1-512-28-28-1-0x0-2x2-1x1-0-NCHW-FP32-B=ConvOclDirectFwd1x1:1,128,1,1,0,1,4,4,0
1024-14-14-1x1-512-7-7-1-0x0-2x2-1x1-0-NCHW-FP32-F=ConvOclDirectFwd1x1:1,8,1,1,1,4,16,64,0
512-7-7-1x1-1024-14-14-1-0x0-2x2-1x1-0-NCHW-FP32-B=ConvOclDirectFwd1x1:1,256,1,1,0,1,4,4,0
1024-14-14-1x1-2048-7-7-1-0x0-2x2-1x1-0-NCHW-FP32-F=ConvOclDirectFwd1x1:1,8,1,1,1,0,32,64,0
2048-7-7-1x1-1024-14-14-1-0x0-2x2-1x1-0-NCHW-FP32-B=ConvOclDirectFwd1x1:1,64,1,1,0,1,4,8,0
256-56-56-1x1-128-28-28-2-0x0-2x2-1x1-0-NCHW-FP32-F=ConvOclDirectFwd1x1:16,16,16,16,1,1,2,3,1
128-28-28-1x1-256-56-56-2-0x0-2x2-1x1-0-NCHW-FP32-B=ConvOclDirectFwd1x1:1,256,1,1,0,1,8,4,0
512-28-28-1x1-256-14-14-2-0x0-2x2-1x1-0-NCHW-FP32-F=ConvOclDirectFwd1x1:1,8,1,1,1,4,16,64,0
256-14-14-1x1-512-28-28-2-0x0-2x2-1x1-0-NCHW-FP32-B=ConvOclDirectFwd1x1:1,128,1,1,0,1,4,4,0
512-28-28-1x1-1024-14-14-2-0x0-2x2-1x1-0-NCHW-FP32-F=ConvOclDirectFwd1x1:1,8,1,1,1,4,16,256,0
1024-14-14-1x1-512-28-28-2-0x0-2x2-1x1-0-NCHW-FP32-B=ConvOclDirectFwd1x1:1,128,1,1,0,1,4,4,0
1024-14-14-1x1-512-7-7-2-0x0-2x2-1x1-0-NCHW-FP32-F=ConvOclDirectFwd1x1:16,16,16,16,1,1,2,3,1
512-7-7-1x1-1024-14-14-2-0x0-2x2-1x1-0-NCHW-FP32-B=ConvOclDirectFwd1x1:1,128,1,1,0,1,4,8,0
1024-14-14-1x1-2048-7-7-2-0x0-2x2-1x1-0-NCHW-FP32-F=ConvOclDirectFwd1x1:1,8,1,1,1,0,16,256,0
2048-7-7-1x1-1024-14-14-2-0x0-2x2-1x1-0-NCHW-FP32-B=ConvOclDirectFwd1x1:1,128,1,1,0,1,4,4,0
256-55-55-1x1-128-28-28-32-0x0-2x2-1x1-0-NCHW-FP32-F=ConvOclDirectFwd1x1:1,8,1,1,1,1,16,2048,0
128-28-28-1x1-256-55-55-32-0x0-2x2-1x1-0-NCHW-FP32-B=ConvOclDirectFwd1x1:1,256,1,1,0,1,32,4,0
256-55-55-1x1-512-28-28-32-0x0-2x2-1x1-0-NCHW-FP32-F=ConvOclDirectFwd1x1:1,8,1,1,1,0,32,2048,0
512-28-28-1x1-256-55-55-32-0x0-2x2-1x1-0-NCHW-FP32-B=ConvOclDirectFwd1x1:1,256,1,1,0,1,32,4,0
256-55-55-1x1-64-55-55-32-0x0-1x1-1x1-0-NCHW-FP32-F=ConvOclDirectFwd1x1:1,8,1,1,1,4,16,2048,0
64-55-55-1x1-256-55-55-32-0x0-1x1-1x1-0-NCHW-FP32-B=ConvOclDirectFwd1x1:1,256,1,1,0,1,32,4,0
64-112-112-7x7-3-230-230-32-0x0-2x2-1x1-0-NCHW-FP32-B=ConvOclDirectFwd:8,16,16,16,1,4,1,2,2
64-55-55-1x1-256-55-55-32-0x0-1x1-1x1-0-NCHW-FP32-F=ConvOclDirectFwd1x1:1,8,1,1,1,1,32,2048,0
256-55-55-1x1-64-55-55-32-0x0-1x1-1x1-0-NCHW-FP32-B=ConvOclDirectFwd1x1:1,256,1,1,0,1,32,4,0
64-55-55-1x1-64-55-55-32-0x0-1x1-1x1-0-NCHW-FP32-F=ConvOclDirectFwd1x1:1,8,1,1,1,0,16,2048,0
64-55-55-1x1-64-55-55-32-0x0-1x1-1x1-0-NCHW-FP32-B=ConvOclDirectFwd1x1:1,256,1,1,0,1,32,4,0
64-55-55-3x3-64-55-55-32-1x1-1x1-1x1-0-NCHW-FP32-W=ConvAsmBwdWrW3x3:4,0,8,4,2,4
96-55-55-11x11-3-227-227-64-0x0-4x4-1x1-0-NCHW-FP32-B=ConvOclDirectFwd:8,16,32,32,1,4,2,4,2
96-27-27-5x5-256-27-27-64-2x2-1x1-1x1-0-NCHW-FP32-F=ConvOclDirectFwd:8,16,32,32,2,2,8,1,1
256-27-27-5x5-96-27-27-64-2x2-1x1-1x1-0-NCHW-FP32-B=ConvOclDirectFwd:8,16,32,32,2,2,8,1,1
384-13-13-3x3-256-13-13-64-1x1-1x1-1x1-0-NCHW-FP32-W=ConvAsmBwdWrW3x3:4,1,16,4,10,1
384-13-13-3x3-384-13-13-64-1x1-1x1-1x1-0-NCHW-FP32-W=ConvAsmBwdWrW3x3:0,1,16,4,10,1
96-55-55-11x11-3-227-227-50-0x0-4x4-1x1-0-NCHW-FP32-B=ConvOclDirectFwd:8,16,32,32,1,4,2,4,2
96-27-27-5x5-256-27-27-50-2x2-1x1-1x1-0-NCHW-FP32-F=ConvOclDirectFwd:8,16,32,32,2,2,8,1,2
256-27-27-5x5-96-27-27-50-2x2-1x1-1x1-0-NCHW-FP32-B=ConvOclDirectFwd:8,16,32,32,4,1,8,1,2
384-13-13-3x3-256-13-13-50-1x1-1x1-1x1-0-NCHW-FP32-W=ConvAsmBwdWrW3x3:9,1,16,4,10,1
384-13-13-3x3-384-13-13-50-1x1-1x1-1x1-0-NCHW-FP32-W=ConvAsmBwdWrW3x3:9,1,16,4,10,1
16-14-14-5x5-48-14-14-128-2x2-1x1-1x1-0-NCHW-FP32-F=ConvOclDirectFwd:8,8,16,16,1,1,8,2,2
48-14-14-5x5-16-14-14-128-2x2-1x1-1x1-0-NCHW-FP32-B=ConvOclDirectFwd:16,16,16,16,2,2,2,4,2
16-28-28-5x5-32-28-28-128-2x2-1x1-1x1-0-NCHW-FP32-F=ConvOclDirectFwd:8,16,32,32,2,2,4,1,2
32-28-28-5x5-16-28-28-128-2x2-1x1-1x1-0-NCHW-FP32-B=ConvOclDirectFwd:8,16,32,32,2,2,4,1,2
24-14-14-5x5-64-14-14-128-2x2-1x1-1x1-0-NCHW-FP32-F=ConvOclDirectFwd:8,8,16,16,1,1,8,1,2
64-14-14-5x5-24-14-14-128-2x2-1x1-1x1-0-NCHW-FP32-B=ConvOclDirectFwd:16,16,16,16,4,4,1,1,2
64-112-112-7x7-3-225-225-128-2x2-2x2-1x1-0-NCHW-FP32-B=ConvOclDirectFwd:8,16,32,32,1,4,2,2,1
32-14-14-5x5-128-14-14-128-2x2-1x1-1x1-0-NCHW-FP32-F=ConvOclDirectFwd:8,8,16,16,1,1,8,1,2
128-14-14-5x5-32-14-14-128-2x2-1x1-1x1-0-NCHW-FP32-B=ConvOclDirectFwd:8,8,16,16,1,1,4,2,2
32-14-14-5x5-64-14-14-128-2x2-1x1-1x1-0-NCHW-FP32-F=ConvOclDirectFwd:8,8,16,16,1,1,8,1,2
64-14-14-5x5-32-14-14-128-2x2-1x1-1x1-0-NCHW-FP32-B=ConvOclDirectFwd:8,8,16,16,1,1,4,2,2
32-28-28-5x5-96-28-28-128-2x2-1x1-1x1-0-NCHW-FP32-F=ConvOclDirectFwd:8,16,32,32,1,4,8,1,2
96-28-28-5x5-32-28-28-128-2x2-1x1-1x1-0-NCHW-FP32-B=ConvOclDirectFwd:8,16,32,32,4,1,4,1,2
32-7-7-5x5-128-7-7-128-2x2-1x1-1x1-0-NCHW-FP32-F=ConvOclDirectFwd:16,16,8,8,2,4,1,4,2
128-7-7-5x5-32-7-7-128-2x2-1x1-1x1-0-NCHW-FP32-B=ConvOclDirectFwd:16,16,8,8,2,2,1,4,2
48-7-7-5x5-128-7-7-128-2x2-1x1-1x1-0-NCHW-FP32-F=ConvOclDirectFwd:16,16,8,8,2,4,1,4,2
128-7-7-5x5-48-7-7-128-2x2-1x1-1x1-0-NCHW-FP32-B=ConvOclDirectFwd:16,16,8,8,2,2,1,1,2
16-14-14-5x5-48-14-14-32-2x2-1x1-1x1-0-NCHW-FP32-F=ConvOclDirectFwd:16,16,8,16,4,2,1,4,2
48-14-14-5x5-16-14-14-32-2x2-1x1-1x1-0-NCHW-FP32-B=ConvOclDirectFwd:16,16,16,16,4,1,1,4,2
16-28-28-5x5-32-28-28-32-2x2-1x1-1x1-0-NCHW-FP32-F=ConvOclDirectFwd:8,16,32,32,4,1,4,1,2
32-28-28-5x5-16-28-28-32-2x2-1x1-1x1-0-NCHW-FP32-B=ConvOclDirectFwd:16,16,16,16,4,1,2,1,1
24-14-14-5x5-64-14-14-32-2x2-1x1-1x1-0-NCHW-FP32-F=ConvOclDirectFwd:16,16,8,16,4,2,1,4,2
64-14-14-5x5-24-14-14-32-2x2-1x1-1x1-0-NCHW-FP32-B=ConvOclDirectFwd:16,16,16,16,4,1,1,4,2
32-14-14-5x5-128-14-14-32-2x2-1x1-1x1-0-NCHW-FP32-F=ConvOclDirectFwd:8,8,16,16,1,1,4,1,2
128-14-14-5x5-32-14-14-32-2x2-1x1-1x1-0-NCHW-FP32-B=ConvOclDirectFwd:16,16,16,16,4,1,1,4,2
32-14-14-5x5-64-14-14-32-2x2-1x1-1x1-0-NCHW-FP32-F=ConvOclDirectFwd:16,16,8,16,4,2,1,4,2
64-14-14-5x5-32-14-14-32-2x2-1x1-1x1-0-NCHW-FP32-B=ConvOclDirectFwd:16,16,16,16,4,1,1,4,2
32-28-28-5x5-96-28-28-32-2x2-1x1-1x1-0-NCHW-FP32-F=ConvOclDirectFwd:8,16,32,32,2,2,8,1,2
96-28-28-5x5-32-28-28-32-2x2-1x1-1x1-0-NCHW-FP32-B=ConvOclDirectFwd:8,16,32,32,2,2,4,1,2
32-7-7-5x5-128-7-7-32-2x2-1x1-1x1-0-NCHW-FP32-F=ConvOclDirectFwd:16,16,8,8,2,2,1,4,2
128-7-7-5x5-32-7-7-32-2x2-1x1-1x1-0-NCHW-FP32-B=ConvOclDirectFwd:8,8,8,8,2,1,1,4,2
48-7-7-5x5-128-7-7-32-2x2-1x1-1x1-0-NCHW-FP32-F=ConvOclDirectFwd:16,16,8,8,2,2,1,4,2
128-7-7-5x5-48-7-7-32-2x2-1x1-1x1-0-NCHW-FP32-B=ConvOclDirectFwd:8,8,8,8,2,1,1,2,2
224-35-35-3x3-192-35-35-32-1x1-1x1-1x1-0-NCHW-FP32-W=ConvAsmBwdWrW3x3:2,1,8,4,3,4
64-73-73-1x1-80-73-73-64-0x0-1x1-1x1-0-NCHW-FP32-F=ConvOclDirectFwd1x1:1,8,1,1,1,1,32,128,0
80-73-73-1x1-64-73-73-64-0x0-1x1-1x1-0-NCHW-FP32-B=ConvOclDirectFwd1x1:1,256,1,1,0,1,32,4,0
192-35-35-1x1-64-35-35-64-0x0-1x1-1x1-0-NCHW-FP32-F=ConvOclDirectFwd1x1:1,8,1,1,1,0,16,2048,0
64-35-35-1x1-192-35-35-64-0x0-1x1-1x1-0-NCHW-FP32-B=ConvOclDirectFwd1x1:1,256,1,1,0,1,32,4,0
192-35-35-1x1-48-35-35-64-0x0-1x1-1x1-0-NCHW-FP32-F=ConvOclDirectFwd1x1:1,8,1,1,1,0,16,2048,0
48-35-35-1x1-192-35-35-64-0x0-1x1-1x1-0-NCHW-FP32-B=ConvOclDirectFwd1x1:1,256,1,1,0,1,32,4,0
192-35-35-1x1-32-35-35-64-0x0-1x1-1x1-0-NCHW-FP32-F=ConvOclDirectFwd1x1:1,8,1,1,1,1,16,2048,0
32-35-35-1x1-192-35-35-64-0x0-1x1-1x1-0-NCHW-FP32-B=ConvOclDirectFwd1x1:1,256,1,1,0,1,32,4,0
256-35-35-1x1-64-35-35-64-0x0-1x1-1x1-0-NCHW-FP32-F=ConvOclDirectFwd1x1:1,8,1,1,1,4,16,2048,0
64-35-35-1x1-256-35-35-64-0x0-1x1-1x1-0-NCHW-FP32-B=ConvOclDirectFwd1x1:1,256,1,1,0,1,32,4,0
256-35-35-1x1-48-35-35-64-0x0-1x1-1x1-0-NCHW-FP32-F=ConvOclDirectFwd1x1:1,8,1,1,1,1,16,2048,0
48-35-35-1x1-256-35-35-64-0x0-1x1-1x1-0-NCHW-FP32-B=ConvOclDirectFwd1x1:1,256,1,1,0,1,32,4,0
288-35-35-1x1-64-35-35-64-0x0-1x1-1x1-0-NCHW-FP32-F=ConvOclDirectFwd1x1:1,8,1,1,1,0,16,2048,0
64-35-35-1x1-288-35-35-64-0x0-1x1-1x1-0-NCHW-FP32-B=ConvOclDirectFwd1x1:1,256,1,1,0,1,32,4,0
288-35-35-1x1-48-35-35-64-0x0-1x1-1x1-0-NCHW-FP32-F=ConvOclDirectFwd1x1:1,8,1,1,1,1,32,2048,0
48-35-35-1x1-288-35-35-64-0x0-1x1-1x1-0-NCHW-FP32-B=ConvOclDirectFwd1x1:1,256,1,1,0,1,32,4,0
768-17-17-1x1-192-17-17-64-0x0-1x1-1x1-0-NCHW-FP32-F=ConvOclDirectFwd1x1:1,8,1,1,1,0,16,2048,0
192-17-17-1x1-768-17-17-64-0x0-1x1-1x1-0-NCHW-FP32-B=ConvOclDirectFwd1x1:1,256,1,1,0,1,32,4,0
768-17-17-1x1-128-17-17-64-0x0-1x1-1x1-0-NCHW-FP32-F=ConvOclDirectFwd1x1:1,8,1,1,1,0,16,2048,0
128-17-17-1x1-768-17-17-64-0x0-1x1-1x1-0-NCHW-FP32-B=ConvOclDirectFwd1x1:1,256,1,1,0,1,32,4,0
768-17-17-1x1-160-17-17-64-0x0-1x1-1x1-0-NCHW-FP32-F=ConvOclDirectFwd1x1:1,8,1,1,1,1,16,2048,0
160-17-17-1x1-768-17-17-64-0x0-1x1-1x1-0-NCHW-FP32-B=ConvOclDirectFwd1x1:1,256,1,1,0,1,32,4,0
1280-8-8-1x1-320-8-8-64-0x0-1x1-1x1-0-NCHW-FP32-F=ConvOclDirectFwd1x1:1,8,1,1,1,1,16,2048,0
320-8-8-1x1-1280-8-8-64-0x0-1x1-1x1-0-NCHW-FP32-B=ConvOclDirectFwd1x1:1,128,1,1,0,2,16,4,0
1280-8-8-1x1-384-8-8-64-0x0-1x1-1x1-0-NCHW-FP32-F=ConvOclDirectFwd1x1:1,8,1,1,1,1,16,2048,0
384-8-8-1x1-1280-8-8-64-0x0-1x1-1x1-0-NCHW-FP32-B=ConvOclDirectFwd1x1:1,256,1,1,0,2,16,4,0
1280-8-8-1x1-448-8-8-64-0x0-1x1-1x1-0-NCHW-FP32-F=ConvOclDirectFwd1x1:1,8,1,1,1,1,16,2048,0
448-8-8-1x1-1280-8-8-64-0x0-1x1-1x1-0-NCHW-FP32-B=ConvOclDirectFwd1x1:1,256,1,1,0,2,16,4,0
1280-8-8-1x1-192-8-8-64-0x0-1x1-1x1-0-NCHW-FP32-F=ConvOclDirectFwd1x1:1,8,1,1,1,1,16,256,0
192-8-8-1x1-1280-8-8-64-0x0-1x1-1x1-0-NCHW-FP32-B=ConvOclDirectFwd1x1:1,256,1,1,0,1,16,4,0
2048-8-8-1x1-320-8-8-64-0x0-1x1-1x1-0-NCHW-FP32-F=ConvOclDirectFwd1x1:1,8,1,1,1,0,16,2048,0
320-8-8-1x1-2048-8-8-64-0x0-1x1-1x1-0-NCHW-FP32-B=ConvOclDirectFwd1x1:1,256,1,1,0,2,16,4,0
2048-8-8-1x1-384-8-8-64-0x0-1x1-1x1-0-NCHW-FP32-F=ConvOclDirectFwd1x1:1,8,1,1,1,1,16,2048,0
384-8-8-1x1-2048-8-8-64-0x0-1x1-1x1-0-NCHW-FP32-B=ConvOclDirectFwd1x1:1,256,1,1,0,2,16,4,0
2048-8-8-1x1-448-8-8-64-0x0-1x1-1x1-0-NCHW-FP32-F=ConvOclDirectFwd1x1:1,8,1,1,1,1,32,2048,0
448-8-8-1x1-2048-8-8-64-0x0-1x1-1x1-0-NCHW-FP32-B=ConvOclDirectFwd1x1:1,256,1,1,0,2,16,4,0
2048-8-8-1x1-192-8-8-64-0x0-1x1-1x1-0-NCHW-FP32-F=ConvOclDirectFwd1x1:1,8,1,1,1,1,16,256,0
192-8-8-1x1-2048-8-8-64-0x0-1x1-1x1-0-NCHW-FP32-B=ConvOclDirectFwd1x1:1,256,1,1,0,1,16,4,0
