src/kernels/gfx803_64.cd.pdb.txt
64-147-147-3x3-32-147-147-32-1x1-1x1-1x1-0-NCHW-FP16-B=ConvOclDirectFwd:16,16,32,32,2,2,8,2,1
32-14-14-1x1-528-14-14-64-0x0-1x1-1x1-0-NCHW-FP32-B=ConvAsm1x1U:1,16,1,64,2,2,1,1;ConvOclDirectFwd1x1:1,256,1,1,0,2,16,4,0
384-17-17-1x1-1024-17-17-1-0x0-1x1-1x1-0-NCHW-FP32-B=ConvAsm1x1U:3,8,3,64,1,2,2,4;ConvOclDirectFwd1x1:1,256,1,1,0,1,8,4,0
512-14-14-1x1-32-14-14-1-0x0-1x1-1x1-0-NCHW-FP16-F=ConvAsm1x1U:1,8,2,16,1,4,4,1;ConvOclDirectFwd1x1:1,64,1,1,0,4,4,8,0
32-14-14-1x1-528-14-14-16-0x0-1x1-1x1-0-NCHW-FP16-B=ConvAsm1x1U:1,16,2,16,1,2,1,1;ConvOclDirectFwd1x1:1,64,1,1,0,4,16,4,0
32-7-7-1x1-832-7-7-512-0x0-1x1-1x1-0-NCHW-FP16-W=ConvAsmBwdWrW1x1:2,8,4,8,2,2,4,2,0,2
512-28-28-1x1-256-14-14-1-0x0-2x2-1x1-0-NCHW-FP16-F=ConvAsm1x1U:1,8,2,32,1,4,4,1;ConvOclDirectFwd1x1:1,64,1,1,0,1,4,8,0
320-14-14-3x3-160-14-14-128-1x1-1x1-1x1-0-NCHW-FP16-W=ConvAsmBwdWrW3x3:0,1,8,2,5,4
768-17-17-1x1-192-17-17-64-0x0-1x1-1x1-0-NCHW-FP32-F=ConvAsm1x1U:4,16,5,64,1,2,1,1;ConvActivAsm1x1U:3,16,5,64,1,1;ConvOclDirectFwd1x1:1,64,1,1,1,4,16,2048,0
3-224-224-3x3-64-224-224-4-1x1-1x1-1x1-0-NCHW-FP16-F=ConvOclDirectFwd:16,16,16,32,1,2,8,1,2;ConvOclDirectFwdFused:16,16,16,32,1,2,8,1,2
128-7-7-1x1-832-7-7-4-0x0-1x1-1x1-0-NCHW-FP32-B=ConvAsm1x1U:1,8,1,64,1,4,2,4;ConvOclDirectFwd1x1:1,128,1,1,0,1,4,8,0
512-28-28-1x1-1024-14-14-256-0x0-2x2-1x1-0-NCHW-FP16-F=ConvAsm1x1U:2,8,4,64,1,4,1,2;ConvOclDirectFwd1x1:1,256,1,1,0,2,32,4,0
128-17-17-1x1-1024-17-17-256-0x0-1x1-1x1-0-NCHW-FP16-B=ConvAsm1x1U:1,16,2,32,1,2,1,2;ConvOclDirectFwd1x1:1,64,1,1,0,1,16,4,0
256-28-28-1x1-64-28-28-16-0x0-1x1-1x1-0-NCHW-FP32-F=ConvAsm1x1U:2,16,2,32,1,2,2,1;ConvActivAsm1x1U:3,16,3,16,1,3;ConvOclDirectFwd1x1:1,64,1,1,1,4,16,2048,0
256-14-14-1x1-528-14-14-256-0x0-1x1-1x1-0-NCHW-FP32-W=ConvAsmBwdWrW1x1:1,16,2,8,8,2,2,4,0,1
96-35-35-3x3-96-17-17-256-0x0-2x2-1x1-0-NCHW-FP32-F=ConvOclDirectFwd:32,8,32,32,1,4,8,1,1
1680-14-14-1x1-192-14-14-16-0x0-1x1-1x1-0-NCHW-FP32-F=ConvAsm1x1U:2,16,3,16,1,2,2,1;ConvActivAsm1x1U:1,16,3,16,4,4;ConvOclDirectFwd1x1:1,64,1,1,1,0,32,256,0
256-7-7-1x1-832-7-7-1-0x0-1x1-1x1-0-NCHW-FP32-B=ConvAsm1x1U:1,8,1,64,1,4,4,1;ConvOclDirectFwd1x1:1,128,1,1,0,1,4,8,0
320-28-28-1x1-64-28-28-64-0x0-1x1-1x1-0-NCHW-FP16-F=ConvAsm1x1U:1,8,2,16,1,4,1,4;ConvOclDirectFwd1x1:1,64,1,1,0,4,16,4,0
64-28-28-1x1-192-28-28-128-0x0-1x1-1x1-0-NCHW-FP32-W=ConvAsmBwdWrW1x1:4,4,4,4,4,1,4,4,0,1
1024-7-7-1x1-256-14-14-2-0x0-2x2-1x1-0-NCHW-FP32-W=ConvAsmBwdWrW1x1:1,16,2,4,4,1,1,4,0,0
96-73-73-3x3-64-147-147-1-0x0-2x2-1x1-0-NCHW-FP16-B=ConvOclDirectFwd:16,16,32,32,2,2,8,2,1
288-64-128-3x3-144-64-128-1-1x1-1x1-1x1-0-NCHW-FP32-W=ConvAsmBwdWrW3x3:0,0,16,4,3,1
256-17-17-1x1-1024-17-17-8-0x0-1x1-1x1-0-NCHW-FP32-B=ConvAsm1x1U:1,16,1,64,4,2,2,2;ConvOclDirectFwd1x1:16,64,32,32,0,1,16,4,1
128-112-112-3x3-64-112-112-256-1x1-1x1-1x1-0-NCHW-FP16-B=ConvOclDirectFwd:16,8,16,32,1,4,8,1,2
160-64-128-1x1-512-64-128-1-0x0-1x1-1x1-0-NCHW-FP16-B=ConvOclDirectFwd1x1:1,128,1,1,0,4,16,4,0
160-14-14-1x1-608-14-14-32-0x0-1x1-1x1-0-NCHW-FP32-B=ConvAsm1x1U:1,16,1,64,2,2,2,2;ConvOclDirectFwd1x1:1,64,1,1,0,4,16,4,0
480-14-14-1x1-64-14-14-16-0x0-1x1-1x1-0-NCHW-FP16-F=ConvAsm1x1U:1,8,2,64,1,4,4,4;ConvOclDirectFwd1x1:1,256,1,1,0,4,4,4,0
1680-7-7-1x1-192-7-7-16-0x0-1x1-1x1-0-NCHW-FP16-F=ConvAsm1x1U:1,8,2,32,1,4,4,1;ConvOclDirectFwd1x1:1,64,1,1,0,1,4,8,0
256-56-56-3x3-256-56-56-1-1x1-1x1-1x1-0-NCHW-FP32-W=ConvAsmBwdWrW3x3:0,1,8,2,2,1
128-17-17-1x1-1024-17-17-1-0x0-1x1-1x1-0-NCHW-FP16-W=ConvAsmBwdWrW1x1:2,8,2,4,2,1,1,4,0,0
192-14-14-1x1-1536-14-14-16-0x0-1x1-1x1-0-NCHW-FP16-B=ConvAsm1x1U:1,16,2,16,1,2,2,2;ConvOclDirectFwd1x1:1,64,1,1,0,4,16,4,0
48-7-7-5x5-128-7-7-128-2x2-1x1-1x1-0-NCHW-FP16-F=ConvOclDirectFwd:8,8,8,8,1,1,8,2,1;ConvOclDirectFwdFused:8,8,8,8,1,1,8,2,2
24-14-14-1x1-512-14-14-8-0x0-1x1-1x1-0-NCHW-FP32-W=ConvAsmBwdWrW1x1:4,4,2,4,2,1,1,4,0,2
192-7-7-1x1-1728-7-7-16-0x0-1x1-1x1-0-NCHW-FP16-B=ConvAsm1x1U:1,8,2,32,1,2,2,4;ConvOclDirectFwd1x1:1,64,1,1,0,1,8,4,0
192-14-14-1x1-576-14-14-64-0x0-1x1-1x1-0-NCHW-FP16-B=ConvAsm1x1U:1,16,2,16,1,2,2,2;ConvOclDirectFwd1x1:1,64,1,1,0,4,16,4,0
832-7-7-1x1-256-7-7-16-0x0-1x1-1x1-0-NCHW-FP32-F=ConvAsm1x1U:2,8,2,32,1,4,2,4;ConvOclDirectFwd1x1:1,64,1,1,1,0,16,128,0
128-14-14-1x1-512-14-14-64-0x0-1x1-1x1-0-NCHW-FP16-B=ConvAsm1x1U:1,16,2,32,1,2,1,8;ConvOclDirectFwd1x1:1,256,1,1,0,4,8,4,0
320-8-8-3x3-192-17-17-1-0x0-2x2-1x1-0-NCHW-FP16-B=ConvOclDirectFwd:8,16,32,32,4,2,1,2,1
384-7-7-1x1-832-7-7-1-0x0-1x1-1x1-0-NCHW-FP16-W=ConvAsmBwdWrW1x1:1,16,2,4,2,1,1,4,0,0
512-14-14-1x1-24-14-14-512-0x0-1x1-1x1-0-NCHW-FP32-F=ConvAsm1x1U:4,8,4,64,2,4,2,1;ConvActivAsm1x1U:3,16,4,64,1,4;ConvOclDirectFwd1x1:1,256,1,1,0,2,16,4,0
480-14-14-1x1-96-14-14-32-0x0-1x1-1x1-0-NCHW-FP16-F=ConvAsm1x1U:1,8,2,64,1,4,2,4;ConvOclDirectFwd1x1:1,64,1,1,0,4,8,4,0
96-14-14-1x1-480-14-14-16-0x0-1x1-1x1-0-NCHW-FP32-B=ConvAsm1x1U:1,16,1,32,1,2,2,2;ConvOclDirectFwd1x1:8,64,16,16,0,2,16,4,1
192-35-35-3x3-192-71-71-32-0x0-2x2-1x1-0-NCHW-FP32-B=ConvOclDirectFwd:16,16,16,16,1,1,4,1,1
1056-7-7-1x1-192-7-7-64-0x0-1x1-1x1-0-NCHW-FP32-F=ConvAsm1x1U:2,16,4,16,1,2,4,1;ConvActivAsm1x1U:4,16,4,16,1,2;ConvOclDirectFwd1x1:1,64,1,1,1,4,16,256,0
512-28-28-1x1-256-14-14-1-0x0-2x2-1x1-0-NCHW-FP32-F=ConvAsm1x1U:2,8,2,64,1,4,4,1;ConvOclDirectFwd1x1:1,64,1,1,1,1,16,64,0
128-14-14-5x5-32-14-14-64-2x2-1x1-1x1-0-NCHW-FP32-B=ConvOclDirectFwd:8,8,16,16,2,2,2,1,2
128-14-14-5x5-32-14-14-1-2x2-1x1-1x1-0-NCHW-FP32-B=ConvOclDirectFwd:16,16,16,16,1,1,1,4,1
96-28-28-1x1-192-28-28-512-0x0-1x1-1x1-0-NCHW-FP32-B=ConvAsm1x1U:1,32,1,16,1,1,1,2;ConvOclDirectFwd1x1:1,64,1,1,0,2,32,4,0
128-28-28-3x3-128-28-28-64-1x1-1x1-1x1-0-NCHW-FP16-W=ConvAsmBwdWrW3x3:0,0,8,2,2,4
448-8-8-1x1-2048-8-8-4-0x0-1x1-1x1-0-NCHW-FP16-B=ConvAsm1x1U:1,16,2,16,1,2,4,4;ConvOclDirectFwd1x1:1,64,1,1,0,2,4,4,0
512-28-28-1x1-256-56-56-32-0x0-2x2-1x1-0-NCHW-FP32-B=ConvAsm1x1U:2,16,2,32,2,2,2,2;ConvOclDirectFwd1x1:1,256,1,1,0,1,32,4,0
384-8-8-1x1-1536-8-8-16-0x0-1x1-1x1-0-NCHW-FP16-B=ConvAsm1x1U:1,16,2,32,1,2,2,4;ConvOclDirectFwd1x1:1,128,1,1,0,4,16,4,0
1024-14-14-1x1-512-7-7-256-0x0-2x2-1x1-0-NCHW-FP16-F=ConvAsm1x1U:2,8,4,16,1,4,2,2;ConvOclDirectFwd1x1:8,64,16,16,0,1,16,4,1
384-8-8-1x1-1536-8-8-32-0x0-1x1-1x1-0-NCHW-FP32-W=ConvAsmBwdWrW1x1:2,8,4,4,4,1,1,4,0,0
96-35-35-1x1-384-35-35-64-0x0-1x1-1x1-0-NCHW-FP32-W=ConvAsmBwdWrW1x1:4,4,8,4,4,1,2,4,0,1
320-8-8-1x1-1280-8-8-64-0x0-1x1-1x1-0-NCHW-FP16-W=ConvAsmBwdWrW1x1:4,4,4,4,4,2,1,2,0,2
2048-7-7-1x1-1024-14-14-1-0x0-2x2-1x1-0-NCHW-FP16-B=ConvAsm1x1U:1,8,2,32,1,4,4,1;ConvOclDirectFwd1x1:1,256,1,1,0,1,4,8,0
384-35-35-1x1-96-35-35-256-0x0-1x1-1x1-0-NCHW-FP16-F=ConvAsm1x1U:2,16,4,64,1,2,1,2;ConvOclDirectFwd1x1:1,64,1,1,0,1,16,4,0
96-71-71-3x3-64-73-73-8-0x0-1x1-1x1-0-NCHW-FP32-B=ConvOclDirectFwd:16,16,16,32,1,2,8,4,2
512-7-7-3x3-512-7-7-32-1x1-1x1-1x1-0-NCHW-FP32-W=ConvAsmBwdWrW3x3:0,1,8,4,7,1
256-56-56-1x1-128-56-56-256-0x0-1x1-1x1-0-NCHW-FP32-F=ConvAsm1x1U:3,16,3,64,2,2,1,4;ConvActivAsm1x1U:2,32,2,64,2,1;ConvOclDirectFwd1x1:1,64,1,1,1,4,32,256,0
64-14-14-1x1-512-14-14-512-0x0-1x1-1x1-0-NCHW-FP32-B=ConvAsm1x1U:1,16,1,32,2,2,1,8;ConvOclDirectFwd1x1:1,128,1,1,0,2,32,4,0
48-7-7-5x5-128-7-7-64-2x2-1x1-1x1-0-NCHW-FP32-F=ConvOclDirectFwd:8,8,8,8,1,1,8,2,1;ConvOclDirectFwdFused:8,8,8,8,1,1,8,2,2
224-14-14-3x3-112-14-14-128-1x1-1x1-1x1-0-NCHW-FP16-W=ConvAsmBwdWrW3x3:0,0,8,2,8,4
480-14-14-1x1-192-14-14-256-0x0-1x1-1x1-0-NCHW-FP16-W=ConvAsmBwdWrW1x1:2,8,2,4,4,1,4,4,0,2
512-7-7-1x1-2048-7-7-128-0x0-1x1-1x1-0-NCHW-FP16-F=ConvAsm1x1U:2,8,4,16,1,4,1,1;ConvOclDirectFwd1x1:1,128,1,1,0,1,16,4,0
16-28-28-5x5-32-28-28-1-2x2-1x1-1x1-0-NCHW-FP16-F=ConvOclDirectFwd:16,16,16,16,1,1,1,1,1;ConvOclDirectFwdFused:16,16,16,16,1,1,1,2,1
96-14-14-1x1-480-14-14-512-0x0-1x1-1x1-0-NCHW-FP32-W=ConvAsmBwdWrW1x1:1,16,2,8,4,1,4,4,0,1
512-14-14-1x1-192-14-14-16-0x0-1x1-1x1-0-NCHW-FP16-F=ConvAsm1x1U:2,8,4,64,1,4,4,2;ConvOclDirectFwd1x1:1,64,1,1,0,4,8,4,0
128-28-28-1x1-512-14-14-16-0x0-2x2-1x1-0-NCHW-FP32-F=ConvAsm1x1U:1,16,1,32,4,2,1,8;ConvOclDirectFwd1x1:1,64,1,1,1,4,32,2048,0
1024-14-14-1x1-256-14-14-16-0x0-1x1-1x1-0-NCHW-FP32-W=ConvAsmBwdWrW1x1:1,16,2,8,4,1,1,4,0,1
96-28-28-3x3-96-28-28-32-1x1-1x1-1x1-0-NCHW-FP16-W=ConvAsmBwdWrW3x3:0,1,8,2,2,8
128-28-28-1x1-512-28-28-1-0x0-1x1-1x1-0-NCHW-FP16-F=ConvAsm1x1U:1,8,2,64,1,4,2,4;ConvOclDirectFwd1x1:1,64,1,1,0,2,8,4,0
64-28-28-1x1-192-28-28-16-0x0-1x1-1x1-0-NCHW-FP32-W=ConvAsmBwdWrW1x1:2,8,2,8,2,1,4,4,0,1
512-28-28-1x1-256-56-56-32-0x0-2x2-1x1-0-NCHW-FP32-W=ConvAsmBwdWrW1x1:1,16,2,4,8,1,2,4,0,2
768-17-17-1x1-192-17-17-128-0x0-1x1-1x1-0-NCHW-FP16-F=ConvAsm1x1U:2,16,4,16,1,2,2,2;ConvOclDirectFwd1x1:1,64,1,1,0,1,16,4,0
1056-7-7-1x1-160-7-7-32-0x0-1x1-1x1-0-NCHW-FP16-F=ConvAsm1x1U:1,8,2,32,1,4,4,1;ConvOclDirectFwd1x1:1,64,1,1,0,1,8,8,0
64-128-256-1x1-256-128-256-1-0x0-1x1-1x1-0-NCHW-FP32-W=ConvAsmBwdWrW1x1:4,4,2,2,4,1,1,4,0,1
192-35-35-1x1-32-35-35-256-0x0-1x1-1x1-0-NCHW-FP32-F=ConvAsm1x1U:2,16,2,64,4,2,1,2;ConvActivAsm1x1U:3,16,3,64,2,1;ConvOclDirectFwd1x1:1,64,1,1,1,0,64,2048,0
480-14-14-1x1-96-14-14-8-0x0-1x1-1x1-0-NCHW-FP16-F=ConvAsm1x1U:1,8,2,64,1,4,4,2;ConvOclDirectFwd1x1:1,128,1,1,0,4,4,4,0
192-64-128-1x1-480-64-128-1-0x0-1x1-1x1-0-NCHW-FP16-W=ConvAsmBwdWrW1x1:4,4,4,4,2,1,1,4,0,3
256-14-14-1x1-512-28-28-8-0x0-2x2-1x1-0-NCHW-FP32-W=ConvAsmBwdWrW1x1:1,16,2,4,4,1,1,4,0,1
160-7-7-1x1-832-7-7-8-0x0-1x1-1x1-0-NCHW-FP32-W=ConvAsmBwdWrW1x1:1,16,2,8,2,1,1,4,0,1
192-7-7-1x1-1632-7-7-16-0x0-1x1-1x1-0-NCHW-FP32-W=ConvAsmBwdWrW1x1:1,16,2,4,4,1,1,4,0,3
128-27-27-3x3-128-27-27-8-1x1-1x1-1x1-0-NCHW-FP16-B=ConvOclDirectFwd:16,16,32,32,2,2,4,4,2
832-7-7-1x1-48-7-7-16-0x0-1x1-1x1-0-NCHW-FP32-F=ConvAsm1x1U:1,8,1,64,1,4,4,1;ConvActivAsm1x1U:1,16,1,16,1,4;ConvOclDirectFwd1x1:8,8,8,8,1,0,32,128,1
64-56-56-1x1-64-56-56-8-0x0-1x1-1x1-0-NCHW-FP16-B=ConvAsm1x1U:1,8,2,64,1,4,2,4;ConvOclDirectFwd1x1:1,256,1,1,0,2,16,8,0
128-28-28-1x1-256-56-56-1-0x0-2x2-1x1-0-NCHW-FP16-B=ConvAsm1x1U:1,8,2,64,1,4,4,2;ConvOclDirectFwd1x1:1,64,1,1,0,1,4,8,0
256-56-56-3x3-128-56-56-4-1x1-1x1-1x1-0-NCHW-FP32-W=ConvAsmBwdWrW3x3:0,1,16,4,2,1
32-149-149-3x3-32-147-147-32-0x0-1x1-1x1-0-NCHW-FP16-F=ConvOclDirectFwd:16,16,32,32,2,2,8,4,2;ConvOclDirectFwdFused:16,16,32,32,2,2,8,4,2
80-73-73-1x1-64-73-73-64-0x0-1x1-1x1-0-NCHW-FP16-B=ConvAsm1x1U:1,16,2,64,1,2,1,4;ConvOclDirectFwd1x1:1,256,1,1,0,1,32,4,0
192-7-7-1x1-832-7-7-32-0x0-1x1-1x1-0-NCHW-FP32-W=ConvAsmBwdWrW1x1:1,16,2,8,4,1,2,4,0,1
48-35-35-1x1-256-35-35-8-0x0-1x1-1x1-0-NCHW-FP16-W=ConvAsmBwdWrW1x1:4,4,2,4,2,1,2,4,0,1
192-7-7-1x1-1872-7-7-16-0x0-1x1-1x1-0-NCHW-FP16-B=ConvAsm1x1U:1,16,2,32,1,2,2,2;ConvOclDirectFwd1x1:1,64,1,1,0,1,8,4,0
48-7-7-1x1-832-7-7-512-0x0-1x1-1x1-0-NCHW-FP32-W=ConvAsmBwdWrW1x1:2,8,4,8,2,2,2,4,0,2
64-147-147-3x3-32-147-147-64-1x1-1x1-1x1-0-NCHW-FP16-W=ConvAsmBwdWrW3x3:0,0,16,4,2,4
192-13-13-3x3-384-13-13-64-1x1-1x1-1x1-0-NCHW-FP16-F=ConvOclDirectFwd:8,8,16,16,2,2,8,1,2;ConvOclDirectFwdFused:8,8,16,16,2,2,8,1,2
528-14-14-1x1-32-14-14-1-0x0-1x1-1x1-0-NCHW-FP32-F=ConvAsm1x1U:1,8,1,16,1,4,4,1;ConvActivAsm1x1U:1,16,1,16,1,3;ConvOclDirectFwd1x1:1,64,1,1,1,4,16,64,0
96-28-28-1x1-192-28-28-16-0x0-1x1-1x1-0-NCHW-FP32-W=ConvAsmBwdWrW1x1:4,4,4,4,4,1,2,4,0,1
256-14-14-1x1-512-28-28-64-0x0-2x2-1x1-0-NCHW-FP16-B=ConvAsm1x1U:1,16,2,16,1,2,1,8;ConvOclDirectFwd1x1:1,256,1,1,0,1,32,4,0
128-17-17-1x1-1024-17-17-16-0x0-1x1-1x1-0-NCHW-FP16-W=ConvAsmBwdWrW1x1:2,8,4,8,2,1,2,2,0,1
64-14-14-1x1-480-14-14-256-0x0-1x1-1x1-0-NCHW-FP32-B=ConvAsm1x1U:1,16,1,64,2,2,1,2;ConvOclDirectFwd1x1:1,256,1,1,0,2,32,4,0
192-17-17-1x1-768-17-17-256-0x0-1x1-1x1-0-NCHW-FP32-F=ConvAsm1x1U:1,16,1,64,4,2,1,8;ConvOclDirectFwd1x1:1,64,1,1,1,1,32,2048,0
128-7-7-1x1-1056-7-7-64-0x0-1x1-1x1-0-NCHW-FP16-W=ConvAsmBwdWrW1x1:1,16,2,8,2,1,4,2,0,2
256-14-14-1x1-1024-14-14-256-0x0-1x1-1x1-0-NCHW-FP16-F=ConvAsm1x1U:1,16,2,16,2,2,1,4;ConvOclDirectFwd1x1:1,256,1,1,0,2,32,4,0
3-224-224-3x3-64-224-224-1-1x1-1x1-1x1-0-NCHW-FP32-F=ConvOclDirectFwd:8,32,32,32,4,1,4,1,1;ConvOclDirectFwdFused:8,32,32,32,4,1,4,1,1
80-73-73-3x3-192-71-71-1-0x0-1x1-1x1-0-NCHW-FP32-F=ConvOclDirectFwd:16,8,16,16,1,2,8,1,1
96-28-28-3x3-128-28-28-64-1x1-1x1-1x1-0-NCHW-FP16-F=ConvOclDirectFwd:16,16,32,32,2,2,8,1,2;ConvOclDirectFwdFused:16,16,32,32,2,2,8,1,1
16-14-14-1x1-480-14-14-32-0x0-1x1-1x1-0-NCHW-FP32-B=ConvAsm1x1U:1,8,1,64,1,4,1,1;ConvOclDirectFwd1x1:1,256,1,1,0,1,16,4,0
2048-7-7-1x1-512-7-7-8-0x0-1x1-1x1-0-NCHW-FP32-B=ConvAsm1x1U:2,16,2,32,1,2,4,1;ConvOclDirectFwd1x1:1,128,1,1,0,1,4,8,0
32-28-28-1x1-192-28-28-8-0x0-1x1-1x1-0-NCHW-FP32-B=ConvAsm1x1U:1,16,1,16,1,2,1,1;ConvOclDirectFwd1x1:1,256,1,1,0,1,8,4,0
256-13-13-3x3-256-13-13-50-1x1-1x1-1x1-0-NCHW-FP16-F=ConvOclDirectFwd:8,16,16,16,2,1,8,4,2
96-35-35-3x3-64-35-35-8-1x1-1x1-1x1-0-NCHW-FP32-W=ConvAsmBwdWrW3x3:0,0,8,2,4,2
128-112-112-3x3-64-112-112-8-1x1-1x1-1x1-0-NCHW-FP16-B=ConvOclDirectFwd:16,8,16,32,1,4,8,1,1
64-56-56-1x1-256-56-56-32-0x0-1x1-1x1-0-NCHW-FP32-F=ConvAsm1x1U:1,8,1,64,3,4,1,8;ConvActivAsm1x1U:1,32,1,64,3,1;ConvOclDirectFwd1x1:1,64,1,1,1,0,32,2048,0
320-8-8-1x1-2048-8-8-4-0x0-1x1-1x1-0-NCHW-FP32-B=ConvAsm1x1U:2,16,2,32,1,2,2,2;ConvOclDirectFwd1x1:1,128,1,1,0,4,8,8,0
192-64-128-1x1-480-64-128-1-0x0-1x1-1x1-0-NCHW-FP32-B=ConvAsm1x1U:4,16,4,64,1,2,1,1;ConvOclDirectFwd1x1:1,128,1,1,0,2,16,4,0
256-14-14-1x1-528-14-14-1-0x0-1x1-1x1-0-NCHW-FP32-W=ConvAsmBwdWrW1x1:1,16,2,8,2,1,1,2,0,1
384-13-13-3x3-384-13-13-32-1x1-1x1-1x1-0-NCHW-FP32-W=ConvAsmBwdWrW3x3:0,1,16,4,10,1
608-14-14-1x1-96-14-14-32-0x0-1x1-1x1-0-NCHW-FP32-F=ConvAsm1x1U:3,16,3,16,2,2,2,2;ConvActivAsm1x1U:3,16,3,16,4,4;ConvOclDirectFwd1x1:1,64,1,1,1,4,64,256,0
160-14-14-1x1-512-14-14-8-0x0-1x1-1x1-0-NCHW-FP32-W=ConvAsmBwdWrW1x1:1,16,2,8,2,1,2,4,0,1
192-8-8-1x1-1280-8-8-64-0x0-1x1-1x1-0-NCHW-FP16-W=ConvAsmBwdWrW1x1:1,16,4,8,2,1,2,4,0,1
256-8-8-1x1-1536-8-8-128-0x0-1x1-1x1-0-NCHW-FP32-W=ConvAsmBwdWrW1x1:2,8,4,4,8,1,2,4,0,1
192-56-56-3x3-64-56-56-128-1x1-1x1-1x1-0-NCHW-FP32-W=ConvAsmBwdWrW3x3:0,1,16,4,2,1
1056-7-7-1x1-352-7-7-32-0x0-1x1-1x1-0-NCHW-FP16-F=ConvAsm1x1U:2,8,4,16,1,4,4,1;ConvOclDirectFwd1x1:1,128,1,1,0,1,8,8,0
64-73-73-3x3-96-71-71-16-0x0-1x1-1x1-0-NCHW-FP32-F=ConvOclDirectFwd:16,8,16,16,1,2,8,2,1
64-112-112-7x7-3-225-225-512-2x2-2x2-1x1-0-NCHW-FP32-B=ConvOclDirectFwd:16,16,32,32,2,2,8,2,1
32-28-28-1x1-256-28-28-32-0x0-1x1-1x1-0-NCHW-FP16-W=ConvAsmBwdWrW1x1:2,8,2,4,2,1,4,4,0,1
144-14-14-1x1-512-14-14-256-0x0-1x1-1x1-0-NCHW-FP32-B=ConvAsm1x1U:1,16,1,32,3,2,1,4;ConvOclDirectFwd1x1:1,256,1,1,0,1,32,4,0
128-14-14-1x1-608-14-14-32-0x0-1x1-1x1-0-NCHW-FP32-B=ConvAsm1x1U:1,16,1,32,2,2,1,2;ConvOclDirectFwd1x1:1,256,1,1,0,4,16,4,0
64-35-35-1x1-256-35-35-128-0x0-1x1-1x1-0-NCHW-FP16-W=ConvAsmBwdWrW1x1:4,4,4,4,4,2,4,4,0,1
384-17-17-1x1-1024-17-17-256-0x0-1x1-1x1-0-NCHW-FP16-W=ConvAsmBwdWrW1x1:2,8,4,8,2,1,1,4,0,1
64-224-224-3x3-64-224-224-16-1x1-1x1-1x1-0-NCHW-FP16-B=ConvOclDirectFwd:16,16,32,32,2,2,8,2,1
256-64-128-1x1-528-64-128-1-0x0-1x1-1x1-0-NCHW-FP32-W=ConvAsmBwdWrW1x1:2,8,4,8,4,1,1,4,0,2
256-17-17-1x1-1024-17-17-32-0x0-1x1-1x1-0-NCHW-FP16-B=ConvAsm1x1U:1,16,2,32,1,2,1,2;ConvOclDirectFwd1x1:1,64,1,1,0,1,16,4,0
768-17-17-1x1-128-17-17-256-0x0-1x1-1x1-0-NCHW-FP16-F=ConvAsm1x1U:2,16,4,16,1,2,2,2;ConvOclDirectFwd1x1:1,64,1,1,0,1,16,4,0
128-14-14-1x1-512-14-14-32-0x0-1x1-1x1-0-NCHW-FP32-B=ConvAsm1x1U:1,16,1,32,2,1,1,4;ConvOclDirectFwd1x1:8,64,16,16,0,2,16,4,1
208-14-14-3x3-96-14-14-8-1x1-1x1-1x1-0-NCHW-FP16-B=ConvOclDirectFwd:16,16,16,16,1,1,4,4,2
64-224-224-3x3-64-224-224-128-1x1-1x1-1x1-0-NCHW-FP32-W=ConvAsmBwdWrW3x3:0,0,16,4,2,1
32-149-149-3x3-32-147-147-8-0x0-1x1-1x1-0-NCHW-FP32-F=ConvOclDirectFwd:16,16,16,32,1,2,8,4,2
192-14-14-1x1-480-14-14-4-0x0-1x1-1x1-0-NCHW-FP16-B=ConvAsm1x1U:1,8,2,64,1,2,4,1;ConvOclDirectFwd1x1:1,64,1,1,0,4,4,4,0
128-7-7-1x1-1056-7-7-32-0x0-1x1-1x1-0-NCHW-FP32-B=ConvAsm1x1U:1,16,1,64,3,2,2,2;ConvOclDirectFwd1x1:1,128,1,1,0,1,16,8,0
1024-14-14-1x1-512-7-7-16-0x0-2x2-1x1-0-NCHW-FP32-F=ConvAsm1x1U:4,8,4,16,2,4,2,2;ConvOclDirectFwd1x1:1,64,1,1,1,1,32,256,0
96-28-28-5x5-32-28-28-8-2x2-1x1-1x1-0-NCHW-FP32-B=ConvOclDirectFwd:16,16,32,32,2,2,2,4,2
320-8-8-1x1-1280-8-8-1-0x0-1x1-1x1-0-NCHW-FP32-B=ConvAsm1x1U:1,8,1,64,1,4,4,4;ConvOclDirectFwd1x1:1,256,1,1,0,1,4,8,0
256-28-28-3x3-512-28-28-1-1x1-1x1-1x1-0-NCHW-FP16-F=ConvOclDirectFwd:16,16,32,32,2,2,2,2,1;ConvOclDirectFwdFused:16,16,32,32,2,2,2,2,1
32-128-256-1x1-256-128-256-1-0x0-1x1-1x1-0-NCHW-FP32-W=ConvAsmBwdWrW1x1:4,4,2,2,2,1,1,4,0,2
192-71-71-3x3-80-73-73-16-0x0-1x1-1x1-0-NCHW-FP16-B=ConvOclDirectFwd:16,8,16,16,1,2,8,1,1
480-14-14-1x1-16-14-14-8-0x0-1x1-1x1-0-NCHW-FP32-F=ConvAsm1x1U:1,8,1,32,1,4,4,1;ConvActivAsm1x1U:1,16,1,16,1,4;ConvOclDirectFwd1x1:1,64,1,1,1,4,64,64,0
1024-17-17-1x1-192-17-17-16-0x0-1x1-1x1-0-NCHW-FP16-F=ConvAsm1x1U:2,8,4,16,1,4,2,2;ConvOclDirectFwd1x1:1,64,1,1,0,1,8,8,0
48-35-35-1x1-192-35-35-8-0x0-1x1-1x1-0-NCHW-FP16-B=ConvAsm1x1U:1,16,2,32,1,2,1,4;ConvOclDirectFwd1x1:1,256,1,1,0,1,8,4,0
192-14-14-1x1-480-14-14-8-0x0-1x1-1x1-0-NCHW-FP32-B=ConvAsm1x1U:1,16,1,32,1,2,2,1;ConvOclDirectFwd1x1:1,256,1,1,0,4,16,4,0
192-14-14-1x1-1728-14-14-16-0x0-1x1-1x1-0-NCHW-FP16-W=ConvAsmBwdWrW1x1:2,8,4,8,2,1,1,4,0,1
128-7-7-5x5-32-7-7-16-2x2-1x1-1x1-0-NCHW-FP32-B=ConvOclDirectFwd:8,8,8,8,1,1,1,4,1
256-14-14-1x1-528-14-14-32-0x0-1x1-1x1-0-NCHW-FP16-W=ConvAsmBwdWrW1x1:2,8,2,8,2,1,4,4,0,1
448-8-8-1x1-2048-8-8-32-0x0-1x1-1x1-0-NCHW-FP32-B=ConvAsm1x1U:1,16,1,64,2,2,1,1;ConvOclDirectFwd1x1:1,64,1,1,0,2,16,4,0
48-7-7-1x1-832-7-7-1-0x0-1x1-1x1-0-NCHW-FP32-B=ConvAsm1x1U:1,8,1,64,1,2,1,1;ConvOclDirectFwd1x1:1,128,1,1,0,1,4,4,0
1200-7-7-1x1-192-7-7-16-0x0-1x1-1x1-0-NCHW-FP32-F=ConvAsm1x1U:2,8,2,32,1,4,2,2;ConvActivAsm1x1U:2,16,2,32,2,4;ConvOclDirectFwd1x1:1,64,1,1,1,4,16,256,0
96-28-28-3x3-96-28-28-32-1x1-1x1-1x1-0-NCHW-FP32-W=ConvAsmBwdWrW3x3:0,0,8,2,7,4
1280-8-8-1x1-384-8-8-32-0x0-1x1-1x1-0-NCHW-FP32-F=ConvAsm1x1U:4,8,4,16,1,4,1,8;ConvActivAsm1x1U:2,16,2,32,4,2;ConvOclDirectFwd1x1:1,64,1,1,1,4,16,2048,0
2048-7-7-1x1-512-7-7-64-0x0-1x1-1x1-0-NCHW-FP16-F=ConvAsm1x1U:2,8,4,16,1,4,4,1;ConvOclDirectFwd1x1:1,256,1,1,0,1,8,4,0
256-17-17-1x1-1024-17-17-128-0x0-1x1-1x1-0-NCHW-FP16-W=ConvAsmBwdWrW1x1:2,8,8,8,2,2,1,4,0,1
512-14-14-1x1-160-14-14-32-0x0-1x1-1x1-0-NCHW-FP32-F=ConvAsm1x1U:2,16,2,64,3,2,2,1;ConvActivAsm1x1U:4,16,5,16,2,2;ConvOclDirectFwd1x1:1,64,1,1,1,4,32,256,0
192-28-28-1x1-64-28-28-128-0x0-1x1-1x1-0-NCHW-FP16-F=ConvAsm1x1U:1,8,2,16,2,4,1,4;ConvOclDirectFwd1x1:1,64,1,1,0,4,16,8,0
224-14-14-1x1-576-14-14-64-0x0-1x1-1x1-0-NCHW-FP16-W=ConvAsmBwdWrW1x1:2,8,4,8,2,1,2,4,0,1
1280-8-8-1x1-384-8-8-64-0x0-1x1-1x1-0-NCHW-FP16-F=ConvAsm1x1U:1,8,2,32,2,4,2,4;ConvOclDirectFwd1x1:1,64,1,1,0,2,8,4,0
512-14-14-1x1-64-14-14-1-0x0-1x1-1x1-0-NCHW-FP16-F=ConvAsm1x1U:1,8,2,16,1,4,4,1;ConvOclDirectFwd1x1:1,64,1,1,0,4,4,8,0
512-7-7-3x3-512-7-7-128-1x1-1x1-1x1-0-NCHW-FP16-F=ConvOclDirectFwd:8,8,8,8,1,1,8,4,2;ConvOclDirectFwdFused:8,8,8,8,1,1,8,4,1
256-14-14-1x1-1024-14-14-32-0x0-1x1-1x1-0-NCHW-FP32-W=ConvAsmBwdWrW1x1:1,16,2,8,4,1,1,4,0,2
512-28-28-3x3-256-28-28-4-1x1-1x1-1x1-0-NCHW-FP16-W=ConvAsmBwdWrW3x3:0,1,8,4,2,1
192-14-14-1x1-480-14-14-128-0x0-1x1-1x1-0-NCHW-FP16-B=ConvAsm1x1U:1,16,2,16,1,2,1,2;ConvOclDirectFwd1x1:1,128,1,1,0,2,16,4,0
144-14-14-1x1-512-14-14-32-0x0-1x1-1x1-0-NCHW-FP32-W=ConvAsmBwdWrW1x1:2,8,4,4,4,2,1,4,0,1
128-28-28-3x3-128-56-56-128-1x1-2x2-1x1-0-NCHW-FP32-W=ConvAsmBwdWrW3x3:0,0,8,8,4,1
128-28-28-1x1-512-28-28-1-0x0-1x1-1x1-0-NCHW-FP32-F=ConvAsm1x1U:2,8,2,64,1,4,2,4;ConvActivAsm1x1U:1,16,2,64,1,2;ConvOclDirectFwd1x1:1,64,1,1,1,0,16,2048,0
288-35-35-1x1-64-35-35-256-0x0-1x1-1x1-0-NCHW-FP16-B=ConvAsm1x1U:1,16,2,64,1,2,1,4;ConvOclDirectFwd1x1:1,256,1,1,0,1,32,4,0
384-17-17-3x3-288-35-35-8-0x0-2x2-1x1-0-NCHW-FP16-B=ConvOclDirectFwd:16,8,16,16,1,2,4,1,1
512-14-14-3x3-512-14-14-16-1x1-1x1-1x1-0-NCHW-FP32-W=ConvAsmBwdWrW3x3:0,0,8,4,3,1
384-8-8-3x3-448-8-8-256-1x1-1x1-1x1-0-NCHW-FP16-W=ConvAsmBwdWrW3x3:0,1,8,2,3,4
2048-7-7-1x1-512-7-7-32-0x0-1x1-1x1-0-NCHW-FP16-F=ConvAsm1x1U:2,8,4,16,1,4,4,1;ConvOclDirectFwd1x1:1,256,1,1,0,1,8,4,0
192-14-14-1x1-1008-14-14-16-0x0-1x1-1x1-0-NCHW-FP32-W=ConvAsmBwdWrW1x1:1,16,4,8,2,1,1,4,0,1
64-64-128-5x5-32-64-128-1-2x2-1x1-1x1-0-NCHW-FP32-B=ConvOclDirectFwd:8,32,16,32,2,1,2,4,1
2048-7-7-1x1-1024-14-14-1-0x0-2x2-1x1-0-NCHW-FP32-W=ConvAsmBwdWrW1x1:1,16,2,2,8,1,1,4,0,0
2048-7-7-1x1-1024-14-14-16-0x0-2x2-1x1-0-NCHW-FP32-B=ConvAsm1x1U:1,16,1,64,4,2,4,1;ConvOclDirectFwd1x1:1,256,1,1,0,1,16,8,0
128-17-17-1x1-1024-17-17-128-0x0-1x1-1x1-0-NCHW-FP32-W=ConvAsmBwdWrW1x1:2,8,4,8,4,1,2,4,0,2
256-128-256-1x1-128-128-256-1-0x0-1x1-1x1-0-NCHW-FP32-F=ConvOclDirectFwdFused:1,64,1,1,1,0,32,256,0;ConvOclDirectFwd1x1:1,64,1,1,1,1,32,256,0
832-7-7-1x1-384-7-7-512-0x0-1x1-1x1-0-NCHW-FP16-F=ConvAsm1x1U:2,16,4,16,1,2,2,2;ConvOclDirectFwd1x1:8,64,8,8,0,1,16,4,1
192-14-14-1x1-1248-14-14-16-0x0-1x1-1x1-0-NCHW-FP32-W=ConvAsmBwdWrW1x1:2,8,4,8,4,1,1,4,0,1
1536-8-8-1x1-256-8-8-16-0x0-1x1-1x1-0-NCHW-FP32-F=ConvAsm1x1U:2,8,2,32,2,4,2,2;ConvActivAsm1x1U:2,16,2,16,2,4;ConvOclDirectFwd1x1:1,64,1,1,1,1,16,256,0
288-14-14-3x3-144-14-14-64-1x1-1x1-1x1-0-NCHW-FP16-W=ConvAsmBwdWrW3x3:0,0,8,2,3,4
512-14-14-1x1-128-14-14-512-0x0-1x1-1x1-0-NCHW-FP32-F=ConvAsm1x1U:4,16,4,64,1,2,1,4;ConvActivAsm1x1U:4,32,7,32,1,1;ConvOclDirectFwd1x1:1,64,1,1,1,0,32,2048,0
128-40-175-3x3-128-40-175-2-1x1-1x1-1x1-0-NCHW-FP16-F=ConvOclDirectFwd:8,32,16,32,2,1,8,4,2
128-112-112-3x3-64-112-112-8-1x1-1x1-1x1-0-NCHW-FP16-W=ConvAsmBwdWrW3x3:0,1,16,2,1,4
128-64-128-1x1-528-64-128-1-0x0-1x1-1x1-0-NCHW-FP16-W=ConvAsmBwdWrW1x1:4,4,4,1,8,1,1,4,0,1
192-71-71-3x3-192-35-35-8-0x0-2x2-1x1-0-NCHW-FP32-F=ConvOclDirectFwd:16,16,16,16,1,1,8,2,1
2048-7-7-1x1-512-7-7-64-0x0-1x1-1x1-0-NCHW-FP32-B=ConvAsm1x1U:4,16,4,16,1,2,2,2;ConvOclDirectFwd1x1:1,64,1,1,0,1,16,4,0
192-7-7-1x1-1680-7-7-16-0x0-1x1-1x1-0-NCHW-FP16-W=ConvAsmBwdWrW1x1:1,16,2,8,2,1,2,4,0,1
96-35-35-1x1-384-35-35-4-0x0-1x1-1x1-0-NCHW-FP32-W=ConvAsmBwdWrW1x1:2,8,2,4,4,1,1,4,0,2
48-35-35-1x1-288-35-35-64-0x0-1x1-1x1-0-NCHW-FP16-W=ConvAsmBwdWrW1x1:4,4,8,4,2,1,4,4,0,1
320-28-28-1x1-64-28-28-32-0x0-1x1-1x1-0-NCHW-FP32-F=ConvAsm1x1U:1,16,1,32,4,2,1,4;ConvActivAsm1x1U:1,16,1,16,4,1;ConvOclDirectFwd1x1:1,64,1,1,1,1,32,2048,0
512-7-7-1x1-512-7-7-16-0x0-1x1-1x1-0-NCHW-FP16-W=ConvAsmBwdWrW1x1:1,16,2,8,2,1,2,4,0,0
16-14-14-5x5-48-14-14-32-2x2-1x1-1x1-0-NCHW-FP32-F=ConvOclDirectFwd:8,8,16,16,2,2,2,2,2;ConvOclDirectFwdFused:8,8,16,16,2,2,2,1,2
32-28-28-1x1-192-28-28-256-0x0-1x1-1x1-0-NCHW-FP32-W=ConvAsmBwdWrW1x1:4,4,2,4,4,1,4,4,0,1
320-14-14-3x3-160-14-14-256-1x1-1x1-1x1-0-NCHW-FP16-W=ConvAsmBwdWrW3x3:0,0,8,2,7,8
320-8-8-1x1-1280-8-8-256-0x0-1x1-1x1-0-NCHW-FP16-B=ConvAsm1x1U:1,16,2,32,1,2,1,8;ConvOclDirectFwd1x1:1,256,1,1,0,4,16,4,0
128-28-28-3x3-128-28-28-128-1x1-1x1-1x1-0-NCHW-FP32-W=ConvAsmBwdWrW3x3:0,1,8,4,7,4
192-7-7-1x1-832-7-7-32-0x0-1x1-1x1-0-NCHW-FP16-W=ConvAsmBwdWrW1x1:2,8,2,8,2,1,2,4,0,1
512-7-7-3x3-512-7-7-64-1x1-1x1-1x1-0-NCHW-FP16-W=ConvAsmBwdWrW3x3:0,0,8,4,4,1
320-8-8-1x1-1280-8-8-64-0x0-1x1-1x1-0-NCHW-FP32-W=ConvAsmBwdWrW1x1:1,16,2,8,4,1,1,4,0,1
192-28-28-3x3-128-28-28-512-1x1-1x1-1x1-0-NCHW-FP16-B=ConvOclDirectFwd:32,8,32,32,1,4,8,2,1
128-17-17-1x1-1024-17-17-256-0x0-1x1-1x1-0-NCHW-FP16-F=ConvAsm1x1U:2,16,4,16,1,2,1,4;ConvOclDirectFwd1x1:1,128,1,1,0,1,16,4,0
192-7-7-1x1-1056-7-7-32-0x0-1x1-1x1-0-NCHW-FP32-W=ConvAsmBwdWrW1x1:1,16,2,4,8,1,1,4,0,1
256-56-56-1x1-64-56-56-16-0x0-1x1-1x1-0-NCHW-FP16-B=ConvAsm1x1U:1,16,2,64,1,2,4,1;ConvOclDirectFwd1x1:1,64,1,1,0,4,16,4,0
832-7-7-1x1-384-7-7-128-0x0-1x1-1x1-0-NCHW-FP32-F=ConvAsm1x1U:2,16,2,32,2,2,1,2;ConvActivAsm1x1U:2,16,4,16,1,1;ConvOclDirectFwd1x1:1,64,1,1,1,0,16,2048,0
192-56-56-1x1-96-56-56-16-0x0-1x1-1x1-0-NCHW-FP32-B=ConvAsm1x1U:1,16,1,64,1,2,2,1;ConvOclDirectFwd1x1:1,64,1,1,0,4,16,4,0
3-224-224-3x3-64-224-224-128-1x1-1x1-1x1-0-NCHW-FP16-F=ConvOclDirectFwd:16,16,16,32,1,2,8,1,1;ConvOclDirectFwdFused:16,16,32,32,2,2,8,1,2
32-28-28-1x1-256-28-28-8-0x0-1x1-1x1-0-NCHW-FP16-W=ConvAsmBwdWrW1x1:4,4,2,2,2,2,1,4,0,1
832-7-7-1x1-384-7-7-4-0x0-1x1-1x1-0-NCHW-FP32-F=ConvAsm1x1U:2,8,2,32,1,4,4,1;ConvActivAsm1x1U:1,16,2,16,1,4;ConvOclDirectFwd1x1:1,64,1,1,1,4,16,128,0
64-56-56-1x1-256-56-56-8-0x0-1x1-1x1-0-NCHW-FP32-B=ConvAsm1x1U:1,16,1,64,1,2,2,1;ConvOclDirectFwd1x1:1,128,1,1,0,4,16,4,0
2016-7-7-1x1-192-7-7-16-0x0-1x1-1x1-0-NCHW-FP32-F=ConvAsm1x1U:4,8,4,16,1,4,4,1;ConvActivAsm1x1U:4,16,4,16,1,4;ConvOclDirectFwd1x1:1,64,1,1,1,4,16,256,0
192-8-8-1x1-2048-8-8-128-0x0-1x1-1x1-0-NCHW-FP32-B=ConvAsm1x1U:1,16,1,64,4,2,1,4;ConvOclDirectFwd1x1:1,128,1,1,0,4,16,4,0
128-14-14-1x1-512-14-14-256-0x0-1x1-1x1-0-NCHW-FP16-B=ConvAsm1x1U:1,16,2,16,1,2,1,4;ConvOclDirectFwd1x1:1,256,1,1,0,2,32,4,0
192-71-71-3x3-192-35-35-64-0x0-2x2-1x1-0-NCHW-FP32-F=ConvOclDirectFwd:16,16,16,16,1,1,8,2,1
2048-7-7-1x1-1024-14-14-4-0x0-2x2-1x1-0-NCHW-FP16-B=ConvAsm1x1U:1,8,2,32,1,4,4,4;ConvOclDirectFwd1x1:1,256,1,1,0,1,8,8,0
32-149-149-3x3-32-147-147-16-0x0-1x1-1x1-0-NCHW-FP16-F=ConvOclDirectFwd:16,16,32,32,2,2,8,4,2;ConvOclDirectFwdFused:16,16,32,32,2,2,8,4,2
128-17-17-1x1-768-17-17-32-0x0-1x1-1x1-0-NCHW-FP32-B=ConvAsm1x1U:1,16,1,64,4,2,1,4;ConvOclDirectFwd1x1:1,128,1,1,0,1,16,4,0
160-14-14-1x1-512-14-14-64-0x0-1x1-1x1-0-NCHW-FP32-B=ConvAsm1x1U:1,16,1,32,4,2,2,2;ConvOclDirectFwd1x1:1,128,1,1,0,4,16,4,0
320-8-8-1x1-2048-8-8-128-0x0-1x1-1x1-0-NCHW-FP32-W=ConvAsmBwdWrW1x1:2,8,4,8,4,1,2,4,0,2
64-224-224-3x3-64-224-224-4-1x1-1x1-1x1-0-NCHW-FP16-B=ConvOclDirectFwd:16,16,32,32,2,2,8,2,2
192-13-13-3x3-384-13-13-4-1x1-1x1-1x1-0-NCHW-FP16-F=ConvOclDirectFwd:8,16,16,16,2,1,2,4,2;ConvOclDirectFwdFused:8,16,16,16,2,1,2,4,2
208-14-14-3x3-96-14-14-16-1x1-1x1-1x1-0-NCHW-FP32-W=ConvAsmBwdWrW3x3:0,0,8,2,14,1
160-7-7-1x1-832-7-7-128-0x0-1x1-1x1-0-NCHW-FP32-B=ConvAsm1x1U:1,16,1,64,2,2,2,2;ConvOclDirectFwd1x1:1,64,1,1,0,1,16,8,0
256-35-35-1x1-48-35-35-8-0x0-1x1-1x1-0-NCHW-FP16-F=ConvAsm1x1U:2,8,4,64,1,4,4,2;ConvOclDirectFwd1x1:1,64,1,1,0,1,8,4,0
128-7-7-1x1-832-7-7-512-0x0-1x1-1x1-0-NCHW-FP32-W=ConvAsmBwdWrW1x1:2,8,4,8,4,2,2,4,0,2
32-35-35-1x1-192-35-35-4-0x0-1x1-1x1-0-NCHW-FP32-W=ConvAsmBwdWrW1x1:4,4,2,4,2,1,2,2,0,2
256-56-56-1x1-64-56-56-16-0x0-1x1-1x1-0-NCHW-FP32-W=ConvAsmBwdWrW1x1:2,8,2,8,2,1,4,4,0,2
1280-8-8-1x1-192-8-8-1-0x0-1x1-1x1-0-NCHW-FP16-F=ConvAsm1x1U:1,8,2,16,1,4,4,2;ConvOclDirectFwd1x1:1,64,1,1,0,1,4,8,0
96-14-14-3x3-128-14-14-32-1x1-1x1-1x1-0-NCHW-FP16-F=ConvOclDirectFwd:8,16,16,16,2,1,8,4,2
192-13-13-3x3-384-13-13-128-1x1-1x1-1x1-0-NCHW-FP16-F=ConvOclDirectFwd:8,8,16,16,2,2,8,1,2;ConvOclDirectFwdFused:8,8,16,16,2,2,8,1,2
128-17-17-1x1-1024-17-17-64-0x0-1x1-1x1-0-NCHW-FP32-B=ConvAsm1x1U:1,32,1,64,2,1,1,2;ConvOclDirectFwd1x1:1,256,1,1,0,1,32,4,0
1024-14-14-1x1-512-28-28-4-0x0-2x2-1x1-0-NCHW-FP32-W=ConvAsmBwdWrW1x1:1,16,8,4,4,1,1,4,0,1
192-17-17-1x1-768-17-17-256-0x0-1x1-1x1-0-NCHW-FP32-B=ConvAsm1x1U:1,16,1,64,3,2,1,4;ConvOclDirectFwd1x1:1,128,1,1,0,1,32,4,0
1280-8-8-1x1-448-8-8-32-0x0-1x1-1x1-0-NCHW-FP16-B=ConvAsm1x1U:1,8,2,16,1,4,2,2;ConvOclDirectFwd1x1:1,64,1,1,0,4,16,4,0
16-14-14-1x1-480-14-14-128-0x0-1x1-1x1-0-NCHW-FP32-B=ConvAsm1x1U:1,8,1,32,1,2,2,2;ConvOclDirectFwd1x1:1,64,1,1,0,4,8,8,0
192-7-7-1x1-1344-7-7-16-0x0-1x1-1x1-0-NCHW-FP32-W=ConvAsmBwdWrW1x1:1,16,2,4,8,1,1,4,0,2
512-14-14-3x3-512-14-14-8-1x1-1x1-1x1-0-NCHW-FP16-F=ConvOclDirectFwd:8,16,16,16,2,1,8,1,2;ConvOclDirectFwdFused:8,16,16,16,2,1,8,1,2
832-7-7-1x1-256-7-7-512-0x0-1x1-1x1-0-NCHW-FP32-F=ConvAsm1x1U:2,16,2,32,2,2,1,4;ConvActivAsm1x1U:2,16,2,16,4,1;ConvOclDirectFwd1x1:1,64,1,1,1,4,32,2048,0
64-112-112-3x3-128-112-112-256-1x1-1x1-1x1-0-NCHW-FP16-F=ConvOclDirectFwd:8,16,16,32,2,2,8,1,2;ConvOclDirectFwdFused:16,8,16,32,1,4,8,1,1
16-14-14-1x1-480-14-14-256-0x0-1x1-1x1-0-NCHW-FP32-B=ConvAsm1x1U:1,16,1,64,2,2,2,1;ConvOclDirectFwd1x1:1,256,1,1,0,2,32,4,0
64-112-112-7x7-3-225-225-128-2x2-2x2-1x1-0-NCHW-FP32-B=ConvOclDirectFwd:16,16,32,32,2,2,8,2,1
128-7-7-5x5-48-7-7-32-2x2-1x1-1x1-0-NCHW-FP16-B=ConvOclDirectFwd:8,8,8,8,1,1,2,1,2
128-28-28-3x3-128-28-28-256-1x1-1x1-1x1-0-NCHW-FP16-B=ConvOclDirectFwd:32,8,32,32,1,4,8,2,2
384-13-13-3x3-384-13-13-1-1x1-1x1-1x1-0-NCHW-FP16-B=ConvOclDirectFwd:16,16,16,16,1,1,2,4,1
832-7-7-1x1-192-7-7-32-0x0-1x1-1x1-0-NCHW-FP32-F=ConvAsm1x1U:2,8,2,32,1,4,2,2;ConvActivAsm1x1U:4,16,4,16,2,4;ConvOclDirectFwd1x1:1,64,1,1,1,4,16,256,0
192-35-35-1x1-384-35-35-16-0x0-1x1-1x1-0-NCHW-FP32-B=ConvAsm1x1U:2,32,2,64,1,1,2,2;ConvOclDirectFwd1x1:1,256,1,1,0,1,32,4,0
384-13-13-3x3-384-13-13-32-1x1-1x1-1x1-0-NCHW-FP16-W=ConvAsmBwdWrW3x3:0,1,8,4,3,1
64-14-14-1x1-480-14-14-1-0x0-1x1-1x1-0-NCHW-FP32-W=ConvAsmBwdWrW1x1:2,8,2,1,8,1,1,4,0,1
128-7-7-1x1-832-7-7-256-0x0-1x1-1x1-0-NCHW-FP32-B=ConvAsm1x1U:1,16,1,64,2,2,1,2;ConvOclDirectFwd1x1:1,256,1,1,0,1,32,4,0
192-71-71-3x3-80-73-73-4-0x0-1x1-1x1-0-NCHW-FP16-B=ConvOclDirectFwd:16,8,16,16,1,2,8,1,1
96-35-35-3x3-96-35-35-64-1x1-1x1-1x1-0-NCHW-FP16-B=ConvOclDirectFwd:8,8,16,16,2,2,8,2,2
384-7-7-3x3-192-7-7-8-1x1-1x1-1x1-0-NCHW-FP16-B=ConvOclDirectFwd:8,8,8,8,1,1,2,2,2
128-14-14-1x1-528-14-14-8-0x0-1x1-1x1-0-NCHW-FP32-W=ConvAsmBwdWrW1x1:1,16,2,4,4,2,1,4,0,1
512-7-7-1x1-1024-14-14-64-0x0-2x2-1x1-0-NCHW-FP16-B=ConvAsm1x1U:1,16,2,32,1,2,2,2;ConvOclDirectFwd1x1:8,64,16,16,0,1,16,4,1
512-14-14-1x1-32-14-14-32-0x0-1x1-1x1-0-NCHW-FP32-F=ConvAsm1x1U:1,8,1,64,2,4,2,4;ConvActivAsm1x1U:2,16,2,64,1,4;ConvOclDirectFwd1x1:1,64,1,1,1,1,16,128,0
192-7-7-1x1-832-7-7-128-0x0-1x1-1x1-0-NCHW-FP16-W=ConvAsmBwdWrW1x1:1,16,2,8,2,1,4,2,0,2
384-8-8-3x3-448-8-8-4-1x1-1x1-1x1-0-NCHW-FP16-W=ConvAsmBwdWrW3x3:0,1,8,4,3,1
192-71-71-3x3-192-35-35-1-0x0-2x2-1x1-0-NCHW-FP32-F=ConvOclDirectFwd:16,16,16,16,1,1,8,1,1
16-64-128-1x1-480-64-128-1-0x0-1x1-1x1-0-NCHW-FP32-W=ConvAsmBwdWrW1x1:4,4,2,1,8,1,1,4,0,2
256-35-35-1x1-48-35-35-4-0x0-1x1-1x1-0-NCHW-FP32-F=ConvAsm1x1U:1,8,1,64,1,4,2,2;ConvActivAsm1x1U:2,16,2,64,1,4;ConvOclDirectFwd1x1:1,64,1,1,1,1,32,64,0
512-7-7-1x1-2048-7-7-8-0x0-1x1-1x1-0-NCHW-FP32-W=ConvAsmBwdWrW1x1:1,16,2,4,8,1,1,4,0,0
528-14-14-1x1-256-14-14-16-0x0-1x1-1x1-0-NCHW-FP16-F=ConvAsm1x1U:2,8,4,64,1,4,2,4;ConvOclDirectFwd1x1:1,256,1,1,0,4,4,4,0
128-28-28-3x3-128-28-28-128-1x1-1x1-1x1-0-NCHW-FP16-F=ConvOclDirectFwd:16,16,32,32,2,2,8,1,2;ConvOclDirectFwdFused:16,16,32,32,2,2,8,1,2
32-64-128-5x5-128-64-128-1-2x2-1x1-1x1-0-NCHW-FP32-F=ConvOclDirectFwd:16,16,16,32,1,2,8,1,1;ConvOclDirectFwdFused:16,16,16,32,1,2,8,1,1
256-14-14-1x1-1024-14-14-1-0x0-1x1-1x1-0-NCHW-FP16-W=ConvAsmBwdWrW1x1:1,16,2,4,2,1,1,4,0,1
24-64-128-5x5-64-64-128-1-2x2-1x1-1x1-0-NCHW-FP16-F=ConvOclDirectFwd:8,32,16,32,2,1,4,4,1
512-7-7-1x1-2048-7-7-16-0x0-1x1-1x1-0-NCHW-FP32-W=ConvAsmBwdWrW1x1:1,16,2,4,8,1,1,4,0,0
192-7-7-3x3-48-7-7-16-1x1-1x1-1x1-0-NCHW-FP16-F=ConvOclDirectFwd:8,8,8,8,1,1,1,4,2;ConvOclDirectFwdFused:8,8,8,8,1,1,1,4,2
192-35-35-3x3-224-35-35-16-1x1-1x1-1x1-0-NCHW-FP16-F=ConvOclDirectFwd:8,16,16,16,2,1,8,4,2;ConvOclDirectFwdFused:8,16,16,16,2,1,8,4,1
256-56-56-1x1-512-28-28-4-0x0-2x2-1x1-0-NCHW-FP32-F=ConvAsm1x1U:2,8,2,16,1,4,1,4;ConvOclDirectFwd1x1:1,64,1,1,1,0,32,2048,0
128-7-7-5x5-48-7-7-16-2x2-1x1-1x1-0-NCHW-FP16-B=ConvOclDirectFwd:8,8,8,8,1,1,1,2,2
32-28-28-5x5-16-28-28-512-2x2-1x1-1x1-0-NCHW-FP16-B=ConvOclDirectFwd:16,16,32,32,2,2,8,4,2
1024-14-14-1x1-2048-7-7-256-0x0-2x2-1x1-0-NCHW-FP32-F=ConvAsm1x1U:4,8,4,16,4,2,1,2;ConvOclDirectFwd1x1:1,64,1,1,1,1,16,2048,0
512-7-7-1x1-2048-7-7-16-0x0-1x1-1x1-0-NCHW-FP16-W=ConvAsmBwdWrW1x1:1,16,4,4,4,1,1,4,0,0
448-8-8-1x1-2048-8-8-128-0x0-1x1-1x1-0-NCHW-FP16-B=ConvAsm1x1U:1,16,2,32,1,2,1,8;ConvOclDirectFwd1x1:1,64,1,1,0,4,16,4,0
512-14-14-1x1-32-14-14-512-0x0-1x1-1x1-0-NCHW-FP32-F=ConvAsm1x1U:2,16,4,64,1,2,4,1;ConvActivAsm1x1U:4,32,7,32,1,1;ConvOclDirectFwd1x1:1,64,1,1,1,0,64,2048,0
192-7-7-1x1-1200-7-7-16-0x0-1x1-1x1-0-NCHW-FP16-W=ConvAsmBwdWrW1x1:1,16,2,8,2,1,2,4,0,0
32-35-35-1x1-192-35-35-1-0x0-1x1-1x1-0-NCHW-FP16-B=ConvAsm1x1U:1,8,2,64,1,2,2,4;ConvOclDirectFwd1x1:1,256,1,1,0,1,4,4,0
288-35-35-1x1-64-35-35-8-0x0-1x1-1x1-0-NCHW-FP32-F=ConvAsm1x1U:4,16,5,32,1,2,4,1;ConvActivAsm1x1U:2,16,5,32,1,4;ConvOclDirectFwd1x1:1,64,1,1,1,1,16,2048,0
32-14-14-5x5-64-14-14-16-2x2-1x1-1x1-0-NCHW-FP32-F=ConvOclDirectFwd:8,8,16,16,2,2,2,1,2;ConvOclDirectFwdFused:8,16,16,16,2,1,4,1,2
64-35-35-3x3-96-35-35-128-1x1-1x1-1x1-0-NCHW-FP16-F=ConvOclDirectFwd:16,8,16,16,1,2,8,1,1;ConvOclDirectFwdFused:8,8,16,16,2,2,8,2,1
32-14-14-1x1-512-14-14-8-0x0-1x1-1x1-0-NCHW-FP16-W=ConvAsmBwdWrW1x1:4,4,4,2,2,1,1,2,0,1
160-17-17-1x1-768-17-17-128-0x0-1x1-1x1-0-NCHW-FP16-B=ConvAsm1x1U:1,16,2,32,1,2,2,2;ConvOclDirectFwd1x1:1,256,1,1,0,1,32,4,0
192-28-28-1x1-64-28-28-64-0x0-1x1-1x1-0-NCHW-FP32-F=ConvAsm1x1U:3,16,3,32,1,2,1,4;ConvActivAsm1x1U:3,16,3,32,2,2;ConvOclDirectFwd1x1:1,64,1,1,1,4,16,2048,0
192-17-17-1x1-1024-17-17-4-0x0-1x1-1x1-0-NCHW-FP16-B=ConvAsm1x1U:1,16,2,16,1,2,2,2;ConvOclDirectFwd1x1:1,64,1,1,0,1,8,4,0
192-13-13-3x3-384-13-13-50-1x1-1x1-1x1-0-NCHW-FP16-F=ConvOclDirectFwd:8,8,16,16,2,2,8,1,2
3-299-299-3x3-32-149-149-16-0x0-2x2-1x1-0-NCHW-FP32-F=ConvOclDirectFwd:16,16,16,16,1,1,8,1,2;ConvOclDirectFwdFused:16,16,16,16,1,1,8,1,1
256-14-14-3x3-256-14-14-2-1x1-1x1-1x1-0-NCHW-FP32-W=ConvAsmBwdWrW3x3:0,0,8,4,2,1
192-17-17-3x3-192-8-8-256-0x0-2x2-1x1-0-NCHW-FP32-F=ConvOclDirectFwd:8,8,8,8,1,1,8,2,2
112-14-14-1x1-512-14-14-128-0x0-1x1-1x1-0-NCHW-FP16-W=ConvAsmBwdWrW1x1:4,4,4,4,4,1,2,2,0,1
192-71-71-3x3-192-35-35-4-0x0-2x2-1x1-0-NCHW-FP32-F=ConvOclDirectFwd:16,16,16,16,1,1,8,2,2
96-128-256-5x5-32-128-256-1-2x2-1x1-1x1-0-NCHW-FP32-B=ConvOclDirectFwd:8,32,16,32,2,1,8,1,1
112-14-14-1x1-512-14-14-64-0x0-1x1-1x1-0-NCHW-FP16-B=ConvAsm1x1U:1,16,2,64,1,2,1,4;ConvOclDirectFwd1x1:1,256,1,1,0,4,8,4,0
192-7-7-1x1-1104-7-7-16-0x0-1x1-1x1-0-NCHW-FP16-B=ConvAsm1x1U:1,16,2,32,1,2,4,1;ConvOclDirectFwd1x1:1,64,1,1,0,1,8,4,0
128-4-4-1x1-576-4-4-64-0x0-1x1-1x1-0-NCHW-FP32-W=ConvAsmBwdWrW1x1:2,8,2,8,2,2,2,4,0,0
144-14-14-1x1-512-14-14-64-0x0-1x1-1x1-0-NCHW-FP32-B=ConvAsm1x1U:1,32,1,16,2,1,2,2;ConvOclDirectFwd1x1:1,128,1,1,0,4,16,4,0
1280-8-8-1x1-384-8-8-16-0x0-1x1-1x1-0-NCHW-FP32-F=ConvAsm1x1U:2,8,2,32,1,4,1,4;ConvActivAsm1x1U:2,16,2,32,4,4;ConvOclDirectFwd1x1:1,64,1,1,1,0,32,256,0
256-8-8-1x1-1536-8-8-8-0x0-1x1-1x1-0-NCHW-FP16-B=ConvAsm1x1U:1,8,2,16,1,4,2,4;ConvOclDirectFwd1x1:1,64,1,1,0,4,16,8,0
1680-7-7-1x1-192-7-7-16-0x0-1x1-1x1-0-NCHW-FP32-F=ConvAsm1x1U:4,8,4,16,1,4,4,2;ConvActivAsm1x1U:2,16,4,16,1,4;ConvOclDirectFwd1x1:1,64,1,1,1,4,16,256,0
48-35-35-5x5-64-35-35-32-2x2-1x1-1x1-0-NCHW-FP32-F=ConvOclDirectFwd:8,8,16,16,2,2,4,1,2;ConvOclDirectFwdFused:8,8,16,16,2,2,4,2,2
256-28-28-1x1-512-28-28-256-0x0-1x1-1x1-0-NCHW-FP32-W=ConvAsmBwdWrW1x1:2,8,4,8,2,2,1,4,0,1
192-7-7-1x1-1728-7-7-16-0x0-1x1-1x1-0-NCHW-FP32-B=ConvAsm1x1U:1,8,1,64,2,4,1,4;ConvOclDirectFwd1x1:8,64,8,8,0,1,16,4,1
64-73-73-1x1-80-73-73-256-0x0-1x1-1x1-0-NCHW-FP32-F=ConvAsm1x1U:3,16,3,64,1,2,2,2;ConvActivAsm1x1U:2,32,3,64,1,1;ConvOclDirectFwd1x1:1,64,1,1,1,4,16,2048,0
64-28-28-1x1-256-28-28-16-0x0-1x1-1x1-0-NCHW-FP32-B=ConvAsm1x1U:1,16,1,32,2,2,2,2;ConvOclDirectFwd1x1:16,64,32,32,0,2,16,4,1
128-28-28-3x3-192-28-28-32-1x1-1x1-1x1-0-NCHW-FP16-F=ConvOclDirectFwd:16,16,32,32,2,2,8,1,1;ConvOclDirectFwdFused:16,16,32,32,2,2,8,1,2
160-14-14-3x3-320-14-14-8-1x1-1x1-1x1-0-NCHW-FP16-F=ConvOclDirectFwd:8,16,16,16,2,1,8,1,2;ConvOclDirectFwdFused:8,16,16,16,2,1,8,4,2
448-8-8-1x1-1280-8-8-8-0x0-1x1-1x1-0-NCHW-FP32-W=ConvAsmBwdWrW1x1:1,16,2,4,8,1,2,4,0,0
384-8-8-1x1-1280-8-8-64-0x0-1x1-1x1-0-NCHW-FP32-W=ConvAsmBwdWrW1x1:1,16,4,4,8,1,1,4,0,1
32-7-7-1x1-832-7-7-16-0x0-1x1-1x1-0-NCHW-FP32-W=ConvAsmBwdWrW1x1:4,4,4,4,2,1,2,4,0,1
32-35-35-1x1-192-35-35-4-0x0-1x1-1x1-0-NCHW-FP32-B=ConvAsm1x1U:1,8,1,64,2,4,1,8;ConvOclDirectFwd1x1:1,256,1,1,0,1,8,8,0
192-14-14-1x1-1104-14-14-16-0x0-1x1-1x1-0-NCHW-FP32-B=ConvAsm1x1U:1,16,1,32,2,2,1,2;ConvOclDirectFwd1x1:1,64,1,1,0,4,16,4,0
512-14-14-1x1-24-14-14-16-0x0-1x1-1x1-0-NCHW-FP32-F=ConvAsm1x1U:2,8,2,64,1,4,4,1;ConvActivAsm1x1U:2,16,2,32,1,4;ConvOclDirectFwd1x1:1,256,1,1,0,1,4,8,0
64-224-224-3x3-64-224-224-8-1x1-1x1-1x1-0-NCHW-FP32-W=ConvAsmBwdWrW3x3:0,1,16,4,2,2
144-14-14-1x1-512-14-14-4-0x0-1x1-1x1-0-NCHW-FP32-W=ConvAsmBwdWrW1x1:1,16,2,4,2,1,1,4,0,1
128-28-28-3x3-96-28-28-32-1x1-1x1-1x1-0-NCHW-FP32-W=ConvAsmBwdWrW3x3:0,0,8,4,4,2
128-7-7-1x1-832-7-7-16-0x0-1x1-1x1-0-NCHW-FP32-W=ConvAsmBwdWrW1x1:1,16,2,8,2,1,1,4,0,2
512-14-14-1x1-64-14-14-1-0x0-1x1-1x1-0-NCHW-FP32-F=ConvAsm1x1U:1,8,1,64,1,4,4,1;ConvActivAsm1x1U:1,16,1,16,1,3;ConvOclDirectFwd1x1:1,64,1,1,1,4,16,64,0
32-147-147-3x3-32-149-149-256-0x0-1x1-1x1-0-NCHW-FP16-B=ConvOclDirectFwd:16,16,32,32,2,2,8,4,1
32-14-14-1x1-512-14-14-16-0x0-1x1-1x1-0-NCHW-FP16-W=ConvAsmBwdWrW1x1:4,4,4,1,4,2,1,4,0,1
2048-7-7-1x1-1024-14-14-64-0x0-2x2-1x1-0-NCHW-FP16-W=ConvAsmBwdWrW1x1:1,16,4,8,2,1,1,2,0,3
256-28-28-1x1-32-28-28-64-0x0-1x1-1x1-0-NCHW-FP32-F=ConvAsm1x1U:2,16,2,64,1,2,1,1;ConvActivAsm1x1U:3,16,3,32,1,3;ConvOclDirectFwd1x1:1,64,1,1,1,4,32,2048,0
256-28-28-3x3-512-28-28-64-1x1-1x1-1x1-0-NCHW-FP16-F=ConvOclDirectFwd:16,16,32,32,2,2,8,1,2;ConvOclDirectFwdFused:16,16,32,32,2,2,8,1,1
256-14-14-3x3-256-14-14-8-1x1-1x1-1x1-0-NCHW-FP16-W=ConvAsmBwdWrW3x3:0,1,8,2,4,1
192-56-56-1x1-384-56-56-16-0x0-1x1-1x1-0-NCHW-FP16-W=ConvAsmBwdWrW1x1:4,4,8,1,8,1,4,4,0,1
32-147-147-3x3-64-147-147-4-1x1-1x1-1x1-0-NCHW-FP16-F=ConvOclDirectFwd:16,16,32,32,2,2,8,2,2;ConvOclDirectFwdFused:16,16,32,32,2,2,8,4,2
2048-7-7-1x1-512-7-7-4-0x0-1x1-1x1-0-NCHW-FP32-W=ConvAsmBwdWrW1x1:1,16,4,2,8,1,1,4,0,1
160-7-7-3x3-320-7-7-32-1x1-1x1-1x1-0-NCHW-FP16-F=ConvOclDirectFwd:8,8,8,8,1,1,8,4,2;ConvOclDirectFwdFused:8,8,8,8,1,1,8,4,2
192-14-14-1x1-480-14-14-4-0x0-1x1-1x1-0-NCHW-FP32-W=ConvAsmBwdWrW1x1:1,16,4,4,2,1,2,4,0,0
128-28-28-3x3-128-28-28-256-1x1-1x1-1x1-0-NCHW-FP16-W=ConvAsmBwdWrW3x3:0,1,8,2,2,8
384-13-13-3x3-384-13-13-512-1x1-1x1-1x1-0-NCHW-FP16-F=ConvOclDirectFwd:8,8,16,16,2,2,8,2,2;ConvOclDirectFwdFused:8,8,16,16,2,2,8,1,1
256-13-13-3x3-256-13-13-256-1x1-1x1-1x1-0-NCHW-FP16-F=ConvOclDirectFwd:8,8,16,16,2,2,8,1,2
128-28-28-1x1-256-28-28-16-0x0-1x1-1x1-0-NCHW-FP32-W=ConvAsmBwdWrW1x1:2,8,4,8,2,2,4,4,0,1
64-224-224-3x3-3-224-224-16-1x1-1x1-1x1-0-NCHW-FP32-W=ConvAsmBwdWrW3x3:0,1,16,1,2,4
2048-8-8-1x1-384-8-8-128-0x0-1x1-1x1-0-NCHW-FP16-F=ConvAsm1x1U:1,8,2,32,4,4,2,2;ConvOclDirectFwd1x1:1,64,1,1,0,4,16,8,0
160-14-14-1x1-512-14-14-128-0x0-1x1-1x1-0-NCHW-FP32-W=ConvAsmBwdWrW1x1:2,8,4,4,8,2,2,4,0,1
208-14-14-3x3-96-14-14-128-1x1-1x1-1x1-0-NCHW-FP16-W=ConvAsmBwdWrW3x3:0,0,8,2,3,4
24-14-14-1x1-512-14-14-32-0x0-1x1-1x1-0-NCHW-FP32-B=ConvAsm1x1U:1,16,1,64,1,2,2,1;ConvOclDirectFwd1x1:1,64,1,1,0,2,16,4,0
512-7-7-1x1-1024-14-14-4-0x0-2x2-1x1-0-NCHW-FP16-B=ConvAsm1x1U:2,8,4,16,1,4,4,1;ConvOclDirectFwd1x1:1,256,1,1,0,1,8,8,0
512-28-28-3x3-256-28-28-4-1x1-1x1-1x1-0-NCHW-FP16-B=ConvOclDirectFwd:16,16,32,32,2,2,4,4,2
1024-14-14-1x1-2048-7-7-16-0x0-2x2-1x1-0-NCHW-FP32-F=ConvAsm1x1U:4,16,4,16,1,2,1,2;ConvOclDirectFwd1x1:1,64,1,1,1,1,32,2048,0
384-13-13-3x3-192-13-13-16-1x1-1x1-1x1-0-NCHW-FP16-B=ConvOclDirectFwd:8,8,16,16,2,2,4,1,2
128-112-112-3x3-64-112-112-16-1x1-1x1-1x1-0-NCHW-FP16-B=ConvOclDirectFwd:8,16,16,32,2,2,8,1,2
64-35-35-1x1-384-35-35-16-0x0-1x1-1x1-0-NCHW-FP16-B=ConvAsm1x1U:1,16,2,16,1,2,1,2;ConvOclDirectFwd1x1:1,256,1,1,0,1,4,4,0
64-56-56-1x1-256-56-56-2-0x0-1x1-1x1-0-NCHW-FP16-F=ConvAsm1x1U:1,8,2,32,1,4,1,1;ConvOclDirectFwd1x1:1,64,1,1,0,4,16,4,0
96-35-35-3x3-96-35-35-128-1x1-1x1-1x1-0-NCHW-FP16-F=ConvOclDirectFwd:8,8,16,16,2,2,8,2,2;ConvOclDirectFwdFused:8,8,16,16,2,2,8,2,1
64-35-35-1x1-192-35-35-64-0x0-1x1-1x1-0-NCHW-FP16-W=ConvAsmBwdWrW1x1:4,4,8,4,2,1,4,4,0,1
256-13-13-3x3-384-13-13-128-1x1-1x1-1x1-0-NCHW-FP32-W=ConvAsmBwdWrW3x3:0,0,16,4,10,1
192-17-17-3x3-192-8-8-4-0x0-2x2-1x1-0-NCHW-FP32-F=ConvOclDirectFwd:8,8,8,8,1,1,1,4,2
192-28-28-1x1-336-28-28-16-0x0-1x1-1x1-0-NCHW-FP32-W=ConvAsmBwdWrW1x1:2,8,2,4,8,2,2,4,0,1
384-13-13-3x3-384-13-13-64-1x1-1x1-1x1-0-NCHW-FP16-F=ConvOclDirectFwd:8,8,16,16,2,2,8,1,1;ConvOclDirectFwdFused:8,8,16,16,2,2,8,1,1
128-56-56-3x3-256-56-56-2-1x1-1x1-1x1-0-NCHW-FP16-F=ConvOclDirectFwd:16,16,32,32,2,2,8,2,1
128-28-28-3x3-128-28-28-64-1x1-1x1-1x1-0-NCHW-FP32-W=ConvAsmBwdWrW3x3:0,0,8,2,4,1
192-14-14-1x1-1056-14-14-16-0x0-1x1-1x1-0-NCHW-FP32-F=ConvAsm1x1U:1,16,1,32,4,2,1,8;ConvOclDirectFwd1x1:1,64,1,1,1,4,16,2048,0
512-14-14-1x1-24-14-14-16-0x0-1x1-1x1-0-NCHW-FP16-F=ConvAsm1x1U:1,8,2,32,1,4,4,1;ConvOclDirectFwd1x1:1,64,1,1,0,4,4,8,0
192-35-35-3x3-192-71-71-128-0x0-2x2-1x1-0-NCHW-FP16-B=ConvOclDirectFwd:16,32,16,32,1,1,4,2,2
32-28-28-1x1-256-28-28-512-0x0-1x1-1x1-0-NCHW-FP16-B=ConvAsm1x1U:1,16,2,16,1,2,1,4;ConvOclDirectFwd1x1:1,64,1,1,0,2,32,8,0
16-14-14-1x1-480-14-14-64-0x0-1x1-1x1-0-NCHW-FP16-W=ConvAsmBwdWrW1x1:4,4,4,4,2,1,4,2,0,1
256-13-13-3x3-256-13-13-256-1x1-1x1-1x1-0-NCHW-FP16-B=ConvOclDirectFwd:8,8,16,16,2,2,8,2,1
512-14-14-1x1-1024-14-14-16-0x0-1x1-1x1-0-NCHW-FP16-W=ConvAsmBwdWrW1x1:1,16,4,8,2,1,1,2,0,1
1280-8-8-1x1-384-8-8-1-0x0-1x1-1x1-0-NCHW-FP32-F=ConvAsm1x1U:1,8,1,64,1,4,4,1;ConvActivAsm1x1U:1,16,2,16,1,4;ConvOclDirectFwd1x1:1,64,1,1,1,0,16,64,0
32-28-28-1x1-192-28-28-512-0x0-1x1-1x1-0-NCHW-FP16-W=ConvAsmBwdWrW1x1:4,4,4,1,8,1,4,4,0,1
512-7-7-1x1-2048-7-7-2-0x0-1x1-1x1-0-NCHW-FP32-F=ConvAsm1x1U:2,8,2,32,1,4,2,2;ConvActivAsm1x1U:2,16,2,32,1,2;ConvOclDirectFwd1x1:1,64,1,1,1,4,32,64,0
256-14-14-1x1-256-14-14-2-0x0-1x1-1x1-0-NCHW-FP16-B=ConvAsm1x1U:1,8,2,64,1,4,4,1;ConvOclDirectFwd1x1:1,64,1,1,0,4,8,8,0
64-112-112-7x7-3-225-225-32-2x2-2x2-1x1-0-NCHW-FP32-B=ConvOclDirectFwd:16,16,32,32,2,2,8,2,1
128-28-28-1x1-256-56-56-1-0x0-2x2-1x1-0-NCHW-FP32-B=ConvAsm1x1U:1,8,1,64,1,4,2,8;ConvOclDirectFwd1x1:1,256,1,1,0,1,4,8,0
32-147-147-3x3-32-149-149-1-0x0-1x1-1x1-0-NCHW-FP16-B=ConvOclDirectFwd:16,16,16,32,1,2,8,4,1
128-28-28-1x1-256-28-28-16-0x0-1x1-1x1-0-NCHW-FP16-W=ConvAsmBwdWrW1x1:4,4,4,1,8,1,1,4,0,1
1024-17-17-1x1-384-17-17-1-0x0-1x1-1x1-0-NCHW-FP32-F=ConvAsm1x1U:4,8,5,64,1,4,4,1;ConvActivAsm1x1U:3,16,3,64,1,4;ConvOclDirectFwd1x1:1,64,1,1,1,4,16,128,0
512-7-7-1x1-2048-7-7-32-0x0-1x1-1x1-0-NCHW-FP16-F=ConvAsm1x1U:2,8,4,16,1,4,2,4;ConvOclDirectFwd1x1:1,64,1,1,0,1,16,4,0
512-7-7-3x3-512-7-7-4-1x1-1x1-1x1-0-NCHW-FP16-B=ConvOclDirectFwd:8,8,8,8,1,1,2,2,1
384-8-8-1x1-1280-8-8-4-0x0-1x1-1x1-0-NCHW-FP16-W=ConvAsmBwdWrW1x1:1,16,2,4,2,1,1,4,0,1
1104-14-14-1x1-192-14-14-16-0x0-1x1-1x1-0-NCHW-FP16-B=ConvAsm1x1U:1,16,2,32,1,2,4,2;ConvOclDirectFwd1x1:1,64,1,1,0,4,4,4,0
112-14-14-3x3-224-14-14-1-1x1-1x1-1x1-0-NCHW-FP16-F=ConvOclDirectFwd:16,16,16,16,1,1,2,4,1;ConvOclDirectFwdFused:16,16,16,16,1,1,2,4,1
352-7-7-1x1-1056-7-7-32-0x0-1x1-1x1-0-NCHW-FP16-B=ConvAsm1x1U:1,16,2,32,1,2,2,2;ConvOclDirectFwd1x1:1,64,1,1,0,1,8,4,0
16-48-480-3x3-1-48-480-1-1x1-1x1-1x1-0-NCHW-FP16-B=ConvOclDirectFwd:16,16,16,16,1,1,1,4,1
16-14-14-5x5-48-14-14-16-2x2-1x1-1x1-0-NCHW-FP16-F=ConvOclDirectFwd:16,16,16,16,1,1,4,4,2;ConvOclDirectFwdFused:8,16,16,16,2,1,4,1,2
480-14-14-1x1-16-14-14-512-0x0-1x1-1x1-0-NCHW-FP32-F=ConvAsm1x1U:1,16,2,64,4,1,1,1;ConvActivAsm1x1U:2,16,2,64,4,1;ConvOclDirectFwd1x1:1,64,1,1,1,4,16,2048,0
160-7-7-1x1-832-7-7-8-0x0-1x1-1x1-0-NCHW-FP32-B=ConvAsm1x1U:1,8,1,64,1,2,2,2;ConvOclDirectFwd1x1:1,256,1,1,0,1,4,8,0
256-14-14-1x1-512-28-28-4-0x0-2x2-1x1-0-NCHW-FP32-W=ConvAsmBwdWrW1x1:1,16,4,4,2,1,1,4,0,1
192-56-56-3x3-64-56-56-4-1x1-1x1-1x1-0-NCHW-FP16-W=ConvAsmBwdWrW3x3:0,0,16,2,2,1
384-35-35-3x3-384-17-17-16-0x0-2x2-1x1-0-NCHW-FP32-F=ConvOclDirectFwd:32,8,32,32,1,4,8,1,1
384-35-35-1x1-96-35-35-4-0x0-1x1-1x1-0-NCHW-FP16-F=ConvAsm1x1U:2,8,4,64,1,4,4,2;ConvOclDirectFwd1x1:1,64,1,1,0,1,8,8,0
192-17-17-1x1-768-17-17-128-0x0-1x1-1x1-0-NCHW-FP32-B=ConvAsm1x1U:1,16,1,64,3,2,1,2;ConvOclDirectFwd1x1:1,256,1,1,0,1,32,4,0
512-7-7-1x1-1024-14-14-256-0x0-2x2-1x1-0-NCHW-FP32-B=ConvAsm1x1U:1,16,1,64,3,2,2,1;ConvOclDirectFwd1x1:1,128,1,1,0,1,32,4,0
128-28-28-3x3-96-28-28-16-1x1-1x1-1x1-0-NCHW-FP32-W=ConvAsmBwdWrW3x3:0,0,8,4,3,2
256-13-13-3x3-384-13-13-50-1x1-1x1-1x1-0-NCHW-FP16-B=ConvOclDirectFwd:8,8,16,16,2,2,8,2,2
192-17-17-1x1-1024-17-17-1-0x0-1x1-1x1-0-NCHW-FP32-W=ConvAsmBwdWrW1x1:1,16,2,4,4,1,1,4,0,1
288-35-35-1x1-64-35-35-32-0x0-1x1-1x1-0-NCHW-FP32-F=ConvAsm1x1U:4,16,5,64,1,2,1,1;ConvActivAsm1x1U:1,32,1,64,3,1;ConvOclDirectFwd1x1:1,64,1,1,1,0,16,2048,0
320-7-7-3x3-160-7-7-512-1x1-1x1-1x1-0-NCHW-FP32-W=ConvAsmBwdWrW3x3:0,1,8,4,7,1
256-14-14-3x3-128-14-14-32-1x1-1x1-1x1-0-NCHW-FP32-W=ConvAsmBwdWrW3x3:0,0,8,4,4,1
48-14-14-5x5-16-14-14-4-2x2-1x1-1x1-0-NCHW-FP16-B=ConvOclDirectFwd:16,16,16,16,1,1,1,4,2
112-14-14-1x1-512-14-14-8-0x0-1x1-1x1-0-NCHW-FP32-B=ConvAsm1x1U:1,8,1,32,1,2,1,4;ConvOclDirectFwd1x1:1,128,1,1,0,4,8,4,0
512-28-28-3x3-512-28-28-256-1x1-1x1-1x1-0-NCHW-FP16-F=ConvOclDirectFwd:16,16,32,32,2,2,8,2,2;ConvOclDirectFwdFused:16,16,32,32,2,2,8,1,2
1024-14-14-1x1-256-14-14-64-0x0-1x1-1x1-0-NCHW-FP16-F=ConvAsm1x1U:2,8,4,64,1,4,2,4;ConvOclDirectFwd1x1:1,128,1,1,0,4,8,4,0
512-7-7-1x1-2048-7-7-128-0x0-1x1-1x1-0-NCHW-FP32-F=ConvAsm1x1U:4,8,4,16,1,4,2,4;ConvActivAsm1x1U:2,16,2,32,3,3;ConvOclDirectFwd1x1:1,64,1,1,1,0,32,2048,0
32-14-14-1x1-528-14-14-512-0x0-1x1-1x1-0-NCHW-FP32-B=ConvAsm1x1U:1,16,1,32,1,2,2,2;ConvOclDirectFwd1x1:1,256,1,1,0,2,16,4,0
192-28-28-3x3-128-28-28-64-1x1-1x1-1x1-0-NCHW-FP16-B=ConvOclDirectFwd:32,8,32,32,1,4,8,2,2
1024-17-17-1x1-384-17-17-1-0x0-1x1-1x1-0-NCHW-FP16-F=ConvAsm1x1U:1,8,2,64,1,4,4,1;ConvOclDirectFwd1x1:1,64,1,1,0,1,4,8,0
320-7-7-3x3-160-7-7-16-1x1-1x1-1x1-0-NCHW-FP16-W=ConvAsmBwdWrW3x3:0,0,8,2,7,2
128-28-28-1x1-512-28-28-4-0x0-1x1-1x1-0-NCHW-FP32-W=ConvAsmBwdWrW1x1:2,8,2,8,2,2,2,4,0,0
128-112-112-3x3-128-112-112-8-1x1-1x1-1x1-0-NCHW-FP32-W=ConvAsmBwdWrW3x3:0,0,16,4,2,4
192-13-13-3x3-384-13-13-512-1x1-1x1-1x1-0-NCHW-FP16-F=ConvOclDirectFwd:8,8,16,16,2,2,8,2,1;ConvOclDirectFwdFused:8,8,16,16,2,2,8,2,1
256-28-28-1x1-128-28-28-1-0x0-1x1-1x1-0-NCHW-FP16-F=ConvAsm1x1U:1,8,2,64,1,4,4,1;ConvOclDirectFwd1x1:1,64,1,1,0,1,8,8,0
32-28-28-1x1-256-28-28-128-0x0-1x1-1x1-0-NCHW-FP16-B=ConvAsm1x1U:1,8,2,16,1,4,1,4;ConvOclDirectFwd1x1:1,64,1,1,0,4,16,4,0
160-7-7-1x1-832-7-7-512-0x0-1x1-1x1-0-NCHW-FP32-W=ConvAsmBwdWrW1x1:1,16,2,4,8,1,4,4,0,3
192-35-35-1x1-64-35-35-4-0x0-1x1-1x1-0-NCHW-FP32-F=ConvAsm1x1U:3,8,3,32,1,4,2,2;ConvActivAsm1x1U:2,16,3,32,1,4;ConvOclDirectFwd1x1:1,64,1,1,1,1,16,64,0
96-71-71-3x3-64-73-73-32-0x0-1x1-1x1-0-NCHW-FP16-B=ConvOclDirectFwd:16,8,16,16,1,2,8,1,2
512-14-14-1x1-112-14-14-64-0x0-1x1-1x1-0-NCHW-FP32-F=ConvAsm1x1U:3,16,4,64,1,2,2,2;ConvActivAsm1x1U:4,32,7,32,1,2;ConvOclDirectFwd1x1:1,64,1,1,1,4,32,128,0
256-13-13-3x3-384-13-13-1-1x1-1x1-1x1-0-NCHW-FP32-W=ConvAsmBwdWrW3x3:0,1,8,4,3,1
128-28-28-1x1-256-56-56-16-0x0-2x2-1x1-0-NCHW-FP32-B=ConvAsm1x1U:1,16,1,32,1,2,1,1;ConvOclDirectFwd1x1:1,256,1,1,0,1,32,4,0
48-14-14-5x5-16-14-14-32-2x2-1x1-1x1-0-NCHW-FP32-B=ConvOclDirectFwd:8,16,16,16,2,1,2,4,2
32-28-28-1x1-192-28-28-128-0x0-1x1-1x1-0-NCHW-FP16-F=ConvAsm1x1U:1,16,2,32,1,2,1,4;ConvOclDirectFwd1x1:1,64,1,1,0,4,16,4,0
192-14-14-1x1-1056-14-14-16-0x0-1x1-1x1-0-NCHW-FP16-F=ConvAsm1x1U:1,8,2,16,2,4,1,8;ConvOclDirectFwd1x1:1,64,1,1,0,4,8,4,0
512-7-7-1x1-2048-7-7-1-0x0-1x1-1x1-0-NCHW-FP16-W=ConvAsmBwdWrW1x1:1,16,2,4,2,1,1,4,0,1
256-56-56-1x1-64-56-56-8-0x0-1x1-1x1-0-NCHW-FP16-W=ConvAsmBwdWrW1x1:2,8,4,1,8,1,4,4,0,1
192-71-71-3x3-80-73-73-64-0x0-1x1-1x1-0-NCHW-FP32-B=ConvOclDirectFwd:8,8,16,16,2,2,8,1,1
256-13-13-3x3-384-13-13-1024-1x1-1x1-1x1-0-NCHW-FP16-B=ConvOclDirectFwd:8,8,16,16,2,2,8,2,1
128-17-17-1x1-768-17-17-4-0x0-1x1-1x1-0-NCHW-FP16-W=ConvAsmBwdWrW1x1:2,8,2,4,4,1,2,4,0,0
32-14-14-1x1-528-14-14-32-0x0-1x1-1x1-0-NCHW-FP32-W=ConvAsmBwdWrW1x1:4,4,4,4,4,1,2,4,0,1
64-14-14-1x1-480-14-14-64-0x0-1x1-1x1-0-NCHW-FP16-W=ConvAsmBwdWrW1x1:2,8,2,8,2,1,4,4,0,1
128-28-28-1x1-256-28-28-1-0x0-1x1-1x1-0-NCHW-FP16-B=ConvAsm1x1U:1,8,2,64,1,4,4,2;ConvOclDirectFwd1x1:1,64,1,1,0,1,4,4,0
64-112-112-7x7-3-224-224-32-3x3-2x2-1x1-0-NCHW-FP16-B=ConvOclDirectFwd:16,16,32,32,2,2,8,2,1
480-14-14-1x1-16-14-14-64-0x0-1x1-1x1-0-NCHW-FP16-F=ConvAsm1x1U:1,8,2,64,1,4,4,2;ConvOclDirectFwd1x1:1,256,1,1,0,4,4,4,0
384-17-17-3x3-384-35-35-32-0x0-2x2-1x1-0-NCHW-FP16-B=ConvOclDirectFwd:8,8,16,16,2,2,4,1,1
1056-14-14-1x1-192-14-14-16-0x0-1x1-1x1-0-NCHW-FP16-F=ConvAsm1x1U:2,8,4,64,1,4,4,2;ConvOclDirectFwd1x1:1,64,1,1,0,2,8,4,0
128-14-14-1x1-528-14-14-32-0x0-1x1-1x1-0-NCHW-FP16-W=ConvAsmBwdWrW1x1:2,8,2,8,2,1,4,4,0,1
192-14-14-1x1-480-14-14-128-0x0-1x1-1x1-0-NCHW-FP32-B=ConvAsm1x1U:1,32,1,32,2,1,2,1;ConvOclDirectFwd1x1:1,256,1,1,0,1,32,4,0
1024-14-14-1x1-512-28-28-8-0x0-2x2-1x1-0-NCHW-FP16-W=ConvAsmBwdWrW1x1:1,16,4,4,4,1,1,4,0,0
160-14-14-1x1-512-14-14-1-0x0-1x1-1x1-0-NCHW-FP16-B=ConvAsm1x1U:1,8,2,64,1,4,4,1;ConvOclDirectFwd1x1:1,128,1,1,0,1,4,4,0
192-14-14-1x1-768-14-14-16-0x0-1x1-1x1-0-NCHW-FP32-W=ConvAsmBwdWrW1x1:1,16,2,4,8,1,1,4,0,1
64-35-35-1x1-256-35-35-256-0x0-1x1-1x1-0-NCHW-FP16-W=ConvAsmBwdWrW1x1:4,4,4,4,4,2,4,4,0,1
32-28-28-1x1-256-28-28-128-0x0-1x1-1x1-0-NCHW-FP32-B=ConvAsm1x1U:1,16,1,64,1,2,2,1;ConvOclDirectFwd1x1:1,64,1,1,0,2,32,4,0
512-28-28-3x3-256-28-28-32-1x1-1x1-1x1-0-NCHW-FP16-W=ConvAsmBwdWrW3x3:0,1,8,4,2,2
96-14-14-1x1-576-14-14-64-0x0-1x1-1x1-0-NCHW-FP32-W=ConvAsmBwdWrW1x1:1,16,2,8,4,1,4,4,0,1
32-28-28-1x1-192-28-28-4-0x0-1x1-1x1-0-NCHW-FP32-W=ConvAsmBwdWrW1x1:4,4,2,4,2,1,2,4,0,1
32-28-28-5x5-96-28-28-512-2x2-1x1-1x1-0-NCHW-FP32-F=ConvOclDirectFwd:16,16,32,32,2,2,8,1,1;ConvOclDirectFwdFused:16,16,32,32,2,2,8,1,2
256-35-35-1x1-48-35-35-4-0x0-1x1-1x1-0-NCHW-FP16-F=ConvAsm1x1U:1,8,2,64,1,4,4,2;ConvOclDirectFwd1x1:1,64,1,1,0,1,8,8,0
1280-8-8-1x1-448-8-8-4-0x0-1x1-1x1-0-NCHW-FP16-F=ConvAsm1x1U:1,8,2,16,1,4,4,1;ConvOclDirectFwd1x1:1,128,1,1,0,2,4,8,0
64-56-56-3x3-64-56-56-1-1x1-1x1-1x1-0-NCHW-FP32-W=ConvAsmBwdWrW3x3:0,0,16,1,4,1
512-14-14-1x1-32-14-14-16-0x0-1x1-1x1-0-NCHW-FP32-F=ConvAsm1x1U:2,8,2,64,1,4,4,1;ConvActivAsm1x1U:2,16,2,16,1,4;ConvOclDirectFwd1x1:1,64,1,1,1,0,16,64,0
832-7-7-1x1-48-7-7-512-0x0-1x1-1x1-0-NCHW-FP32-F=ConvAsm1x1U:3,16,4,16,1,2,2,1;ConvActivAsm1x1U:4,16,4,16,1,2;ConvOclDirectFwd1x1:1,64,1,1,1,4,32,2048,0
48-35-35-5x5-64-35-35-1-2x2-1x1-1x1-0-NCHW-FP32-F=ConvOclDirectFwd:16,16,16,32,1,2,2,4,1;ConvOclDirectFwdFused:8,32,16,32,2,1,2,4,1
192-13-13-3x3-384-13-13-16-1x1-1x1-1x1-0-NCHW-FP16-F=ConvOclDirectFwd:8,8,16,16,2,2,8,4,2;ConvOclDirectFwdFused:8,8,16,16,2,2,8,4,2
512-14-14-1x1-112-14-14-1-0x0-1x1-1x1-0-NCHW-FP16-F=ConvAsm1x1U:1,8,2,16,1,4,4,1;ConvOclDirectFwd1x1:1,64,1,1,0,4,4,8,0
128-58-58-3x3-128-28-28-64-0x0-2x2-1x1-0-NCHW-FP32-F=ConvOclDirectFwd:16,16,16,32,1,2,8,2,2
512-14-14-1x1-144-14-14-256-0x0-1x1-1x1-0-NCHW-FP32-F=ConvAsm1x1U:4,8,4,64,2,2,2,2;ConvActivAsm1x1U:3,16,7,32,1,2;ConvOclDirectFwd1x1:1,64,1,1,1,0,64,2048,0
2048-7-7-1x1-512-7-7-2-0x0-1x1-1x1-0-NCHW-FP32-F=ConvAsm1x1U:1,8,1,64,1,4,4,1;ConvActivAsm1x1U:2,16,2,32,1,4;ConvOclDirectFwd1x1:1,64,1,1,1,4,16,128,0
384-35-35-1x1-192-35-35-8-0x0-1x1-1x1-0-NCHW-FP16-F=ConvAsm1x1U:4,8,8,32,1,4,1,4;ConvOclDirectFwd1x1:1,64,1,1,0,1,16,4,0
80-73-73-1x1-64-73-73-128-0x0-1x1-1x1-0-NCHW-FP16-W=ConvAsmBwdWrW1x1:4,4,4,4,2,2,4,4,0,1
1536-8-8-1x1-384-8-8-128-0x0-1x1-1x1-0-NCHW-FP32-F=ConvAsm1x1U:4,8,4,16,2,4,1,4;ConvActivAsm1x1U:2,16,2,32,4,2;ConvOclDirectFwd1x1:1,64,1,1,1,4,32,2048,0
224-35-35-3x3-192-35-35-128-1x1-1x1-1x1-0-NCHW-FP32-W=ConvAsmBwdWrW3x3:0,0,8,4,3,4
256-14-14-1x1-256-14-14-16-0x0-1x1-1x1-0-NCHW-FP16-W=ConvAsmBwdWrW1x1:2,8,2,4,2,1,1,4,0,1
64-56-56-1x1-64-56-56-64-0x0-1x1-1x1-0-NCHW-FP32-F=ConvAsm1x1U:2,16,2,64,1,2,1,1;ConvActivAsm1x1U:2,16,2,64,1,1;ConvOclDirectFwd1x1:1,64,1,1,1,0,16,128,0
192-28-28-1x1-16-28-28-4-0x0-1x1-1x1-0-NCHW-FP16-F=ConvAsm1x1U:1,8,2,16,1,4,4,1;ConvOclDirectFwd1x1:1,128,1,1,0,1,4,8,0
256-14-14-1x1-1024-14-14-256-0x0-1x1-1x1-0-NCHW-FP32-W=ConvAsmBwdWrW1x1:2,8,4,4,8,1,1,4,0,1
1024-14-14-1x1-512-28-28-16-0x0-2x2-1x1-0-NCHW-FP32-W=ConvAsmBwdWrW1x1:1,16,4,4,8,1,1,4,0,1
48-7-7-1x1-832-7-7-128-0x0-1x1-1x1-0-NCHW-FP16-B=ConvAsm1x1U:1,16,2,32,1,2,1,2;ConvOclDirectFwd1x1:8,64,8,8,0,1,16,4,1
512-7-7-1x1-1024-14-14-64-0x0-2x2-1x1-0-NCHW-FP16-W=ConvAsmBwdWrW1x1:1,16,4,8,2,1,1,2,0,2
512-14-14-1x1-160-14-14-512-0x0-1x1-1x1-0-NCHW-FP32-F=ConvAsm1x1U:4,8,4,64,2,2,1,4;ConvActivAsm1x1U:2,16,4,32,3,2;ConvOclDirectFwd1x1:1,64,1,1,1,1,32,2048,0
128-7-7-1x1-832-7-7-32-0x0-1x1-1x1-0-NCHW-FP32-W=ConvAsmBwdWrW1x1:1,16,2,4,8,1,2,4,0,1
1024-17-17-1x1-192-17-17-32-0x0-1x1-1x1-0-NCHW-FP32-F=ConvAsm1x1U:4,16,4,16,2,2,1,1;ConvActivAsm1x1U:2,16,2,32,4,1;ConvOclDirectFwd1x1:1,64,1,1,1,0,32,2048,0
384-8-8-1x1-2048-8-8-8-0x0-1x1-1x1-0-NCHW-FP16-B=ConvAsm1x1U:1,8,2,16,1,4,1,8;ConvOclDirectFwd1x1:1,256,1,1,0,2,8,4,0
256-35-35-1x1-64-35-35-1-0x0-1x1-1x1-0-NCHW-FP32-F=ConvAsm1x1U:1,8,1,64,1,4,2,1;ConvActivAsm1x1U:1,16,1,64,1,4;ConvOclDirectFwd1x1:1,64,1,1,1,0,16,64,0
320-14-14-3x3-160-14-14-4-1x1-1x1-1x1-0-NCHW-FP16-W=ConvAsmBwdWrW3x3:0,0,8,2,3,1
1632-7-7-1x1-192-7-7-16-0x0-1x1-1x1-0-NCHW-FP16-F=ConvAsm1x1U:1,8,2,32,1,4,4,1;ConvOclDirectFwd1x1:1,64,1,1,0,1,4,8,0
192-14-14-1x1-512-14-14-1-0x0-1x1-1x1-0-NCHW-FP32-W=ConvAsmBwdWrW1x1:1,16,2,2,4,1,1,4,0,0
64-56-56-1x1-64-56-56-4-0x0-1x1-1x1-0-NCHW-FP16-B=ConvAsm1x1U:1,8,2,32,1,2,2,1;ConvOclDirectFwd1x1:1,256,1,1,0,4,16,4,0
192-7-7-1x1-1632-7-7-16-0x0-1x1-1x1-0-NCHW-FP32-B=ConvAsm1x1U:1,8,1,64,2,4,1,4;ConvOclDirectFwd1x1:8,64,8,8,0,1,16,4,1
384-7-7-3x3-192-7-7-8-1x1-1x1-1x1-0-NCHW-FP32-W=ConvAsmBwdWrW3x3:0,0,8,4,7,1
64-28-28-1x1-256-28-28-128-0x0-1x1-1x1-0-NCHW-FP32-W=ConvAsmBwdWrW1x1:4,4,4,4,4,1,4,4,0,1
512-14-14-3x3-512-7-7-16-1x1-2x2-1x1-0-NCHW-FP32-F=ConvOclDirectFwd:8,8,8,8,1,1,8,2,2
256-56-56-3x3-128-56-56-4-1x1-1x1-1x1-0-NCHW-FP16-B=ConvOclDirectFwd:8,16,16,32,2,2,8,1,2
160-7-7-1x1-832-7-7-256-0x0-1x1-1x1-0-NCHW-FP16-B=ConvAsm1x1U:1,16,2,32,1,2,1,2;ConvOclDirectFwd1x1:1,256,1,1,0,1,32,4,0
512-7-7-3x3-512-16-16-256-0x0-2x2-1x1-0-NCHW-FP16-B=ConvOclDirectFwd:16,16,16,16,1,1,4,1,2
192-35-35-1x1-384-35-35-128-0x0-1x1-1x1-0-NCHW-FP16-W=ConvAsmBwdWrW1x1:4,4,4,4,4,2,4,4,0,1
512-7-7-1x1-1024-14-14-16-0x0-2x2-1x1-0-NCHW-FP32-B=ConvAsm1x1U:1,16,1,64,2,2,2,1;ConvOclDirectFwd1x1:8,64,16,16,0,1,16,4,1
384-7-7-3x3-192-7-7-512-1x1-1x1-1x1-0-NCHW-FP16-B=ConvOclDirectFwd:8,8,8,8,1,1,8,2,1
64-35-35-1x1-288-35-35-4-0x0-1x1-1x1-0-NCHW-FP16-W=ConvAsmBwdWrW1x1:4,4,4,4,2,1,2,2,0,1
1280-8-8-1x1-448-8-8-4-0x0-1x1-1x1-0-NCHW-FP32-F=ConvAsm1x1U:2,8,2,32,1,4,4,2;ConvActivAsm1x1U:2,16,2,32,1,4;ConvOclDirectFwd1x1:8,8,8,8,1,0,32,128,1
2048-7-7-1x1-512-7-7-64-0x0-1x1-1x1-0-NCHW-FP32-F=ConvAsm1x1U:2,16,2,32,2,2,1,8;ConvOclDirectFwd1x1:1,64,1,1,1,1,64,2048,0
24-14-14-1x1-512-14-14-8-0x0-1x1-1x1-0-NCHW-FP16-B=ConvAsm1x1U:1,8,2,64,1,2,2,1;ConvOclDirectFwd1x1:1,128,1,1,0,4,8,4,0
2048-7-7-1x1-512-7-7-128-0x0-1x1-1x1-0-NCHW-FP16-F=ConvAsm1x1U:2,8,4,16,1,4,4,2;ConvOclDirectFwd1x1:1,256,1,1,0,1,16,4,0
32-35-35-1x1-192-35-35-8-0x0-1x1-1x1-0-NCHW-FP32-B=ConvAsm1x1U:1,16,1,64,1,2,2,1;ConvOclDirectFwd1x1:1,256,1,1,0,1,8,4,0
832-7-7-1x1-384-7-7-8-0x0-1x1-1x1-0-NCHW-FP16-F=ConvAsm1x1U:1,8,2,32,1,4,4,1;ConvOclDirectFwd1x1:1,256,1,1,0,1,4,8,0
384-13-13-3x3-192-13-13-128-1x1-1x1-1x1-0-NCHW-FP16-B=ConvOclDirectFwd:8,8,16,16,2,2,8,2,1
512-28-28-3x3-256-28-28-1-1x1-1x1-1x1-0-NCHW-FP32-W=ConvAsmBwdWrW3x3:0,1,8,2,4,1
128-14-14-1x1-512-14-14-128-0x0-1x1-1x1-0-NCHW-FP16-W=ConvAsmBwdWrW1x1:4,4,8,1,8,2,1,4,0,1
832-7-7-1x1-160-7-7-256-0x0-1x1-1x1-0-NCHW-FP16-F=ConvAsm1x1U:2,8,4,16,1,4,2,4;ConvOclDirectFwd1x1:8,64,8,8,0,1,16,4,1
192-14-14-1x1-512-14-14-1-0x0-1x1-1x1-0-NCHW-FP16-B=ConvAsm1x1U:1,8,2,64,1,4,4,1;ConvOclDirectFwd1x1:1,256,1,1,0,4,4,8,0
192-35-35-1x1-32-35-35-16-0x0-1x1-1x1-0-NCHW-FP32-F=ConvAsm1x1U:2,16,2,32,1,2,2,1;ConvActivAsm1x1U:1,16,1,64,2,3;ConvOclDirectFwd1x1:1,64,1,1,1,1,16,2048,0
64-73-73-1x1-160-73-73-32-0x0-1x1-1x1-0-NCHW-FP16-B=ConvAsm1x1U:1,16,2,32,1,2,1,2;ConvOclDirectFwd1x1:1,256,1,1,0,1,32,4,0
2048-8-8-1x1-448-8-8-128-0x0-1x1-1x1-0-NCHW-FP16-F=ConvAsm1x1U:1,8,2,32,3,4,2,2;ConvOclDirectFwd1x1:1,64,1,1,0,4,16,8,0
192-27-27-5x5-64-27-27-4-2x2-1x1-1x1-0-NCHW-FP16-B=ConvOclDirectFwd:16,16,32,32,2,2,2,4,2
256-14-14-1x1-512-28-28-2-0x0-2x2-1x1-0-NCHW-FP32-W=ConvAsmBwdWrW1x1:1,16,2,4,4,2,1,4,0,1
608-14-14-1x1-96-14-14-64-0x0-1x1-1x1-0-NCHW-FP32-F=ConvAsm1x1U:2,16,4,64,1,2,2,1;ConvActivAsm1x1U:3,16,3,16,4,2;ConvOclDirectFwd1x1:1,64,1,1,1,1,16,2048,0
192-8-8-1x1-1280-8-8-32-0x0-1x1-1x1-0-NCHW-FP32-W=ConvAsmBwdWrW1x1:1,16,4,8,2,1,2,4,0,0
512-7-7-3x3-512-14-14-32-1x1-2x2-1x1-0-NCHW-FP32-B=ConvOclDirectFwd:8,16,8,16,1,1,2,2,2
128-14-14-1x1-512-14-14-4-0x0-1x1-1x1-0-NCHW-FP16-W=ConvAsmBwdWrW1x1:4,4,4,1,4,2,1,4,0,0
96-28-28-5x5-32-28-28-4-2x2-1x1-1x1-0-NCHW-FP32-B=ConvOclDirectFwd:8,32,32,32,4,1,1,4,2
384-35-35-1x1-192-35-35-32-0x0-1x1-1x1-0-NCHW-FP16-F=ConvAsm1x1U:2,8,4,64,1,4,2,2;ConvOclDirectFwd1x1:1,64,1,1,0,1,16,4,0
128-28-28-3x3-128-28-28-16-1x1-1x1-1x1-0-NCHW-FP16-B=ConvOclDirectFwd:16,16,32,32,2,2,8,2,1
48-7-7-5x5-128-7-7-256-2x2-1x1-1x1-0-NCHW-FP32-F=ConvOclDirectFwd:8,8,8,8,1,1,8,2,2;ConvOclDirectFwdFused:8,8,8,8,1,1,8,2,1
3-225-225-7x7-64-112-112-4-2x2-2x2-1x1-0-NCHW-FP32-F=ConvOclDirectFwd:16,16,16,32,1,2,8,1,2;ConvOclDirectFwdFused:16,16,16,32,1,2,8,1,2
64-56-56-1x1-64-56-56-256-0x0-1x1-1x1-0-NCHW-FP32-F=ConvAsm1x1U:1,8,1,64,1,4,1,4;ConvActivAsm1x1U:1,32,1,64,2,1;ConvOclDirectFwd1x1:1,64,1,1,1,0,16,2048,0
192-71-71-3x3-80-73-73-4-0x0-1x1-1x1-0-NCHW-FP32-B=ConvOclDirectFwd:8,16,16,16,2,1,8,1,1
192-14-14-1x1-912-14-14-16-0x0-1x1-1x1-0-NCHW-FP16-B=ConvAsm1x1U:1,16,2,16,1,2,2,2;ConvOclDirectFwd1x1:1,64,1,1,0,4,8,4,0
384-13-13-3x3-384-13-13-8-1x1-1x1-1x1-0-NCHW-FP16-F=ConvOclDirectFwd:8,16,16,16,2,1,4,2,2;ConvOclDirectFwdFused:8,16,16,16,2,1,4,2,2
160-14-14-1x1-528-14-14-128-0x0-1x1-1x1-0-NCHW-FP32-W=ConvAsmBwdWrW1x1:2,8,4,8,4,2,2,4,0,1
256-14-14-3x3-256-28-28-64-1x1-2x2-1x1-0-NCHW-FP32-B=ConvOclDirectFwd:32,32,32,32,1,1,4,4,2
48-64-128-1x1-832-64-128-1-0x0-1x1-1x1-0-NCHW-FP16-B=ConvOclDirectFwd1x1:1,256,1,1,0,2,8,4,0
512-14-14-1x1-144-14-14-4-0x0-1x1-1x1-0-NCHW-FP16-F=ConvAsm1x1U:1,8,2,16,1,4,4,1;ConvOclDirectFwd1x1:1,64,1,1,0,4,4,4,0
1024-17-17-1x1-384-17-17-4-0x0-1x1-1x1-0-NCHW-FP16-F=ConvAsm1x1U:1,8,6,32,1,4,4,1;ConvOclDirectFwd1x1:1,64,1,1,0,1,8,8,0
512-28-28-3x3-256-28-28-32-1x1-1x1-1x1-0-NCHW-FP32-W=ConvAsmBwdWrW3x3:0,1,8,4,4,1
192-35-35-1x1-384-35-35-128-0x0-1x1-1x1-0-NCHW-FP16-B=ConvAsm1x1U:1,16,2,32,1,2,1,2;ConvOclDirectFwd1x1:1,128,1,1,0,1,32,4,0
192-14-14-1x1-1920-14-14-16-0x0-1x1-1x1-0-NCHW-FP32-B=ConvAsm1x1U:1,32,1,16,2,1,2,1;ConvOclDirectFwd1x1:8,64,16,16,0,2,16,4,1
224-35-35-3x3-256-17-17-128-0x0-2x2-1x1-0-NCHW-FP32-F=ConvOclDirectFwd:32,8,32,32,1,4,8,1,2
384-17-17-3x3-384-35-35-8-0x0-2x2-1x1-0-NCHW-FP16-B=ConvOclDirectFwd:8,8,16,16,2,2,4,1,2
32-28-28-1x1-256-28-28-512-0x0-1x1-1x1-0-NCHW-FP32-W=ConvAsmBwdWrW1x1:4,4,4,4,4,1,4,2,0,2
512-7-7-1x1-1024-14-14-16-0x0-2x2-1x1-0-NCHW-FP32-W=ConvAsmBwdWrW1x1:1,16,2,4,8,1,1,4,0,0
48-7-7-1x1-832-7-7-128-0x0-1x1-1x1-0-NCHW-FP32-W=ConvAsmBwdWrW1x1:2,8,4,4,4,2,2,4,0,3
384-13-13-3x3-192-13-13-256-1x1-1x1-1x1-0-NCHW-FP16-W=ConvAsmBwdWrW3x3:0,0,8,4,5,1
32-14-14-1x1-512-14-14-16-0x0-1x1-1x1-0-NCHW-FP32-W=ConvAsmBwdWrW1x1:4,4,4,2,2,2,1,4,0,1
160-7-7-1x1-832-7-7-128-0x0-1x1-1x1-0-NCHW-FP32-W=ConvAsmBwdWrW1x1:1,16,2,8,4,1,4,4,0,2
96-28-28-3x3-64-28-28-32-1x1-1x1-1x1-0-NCHW-FP16-W=ConvAsmBwdWrW3x3:0,1,8,2,2,4
64-35-35-1x1-384-35-35-1-0x0-1x1-1x1-0-NCHW-FP16-W=ConvAsmBwdWrW1x1:4,4,2,4,2,1,1,2,0,1
64-35-35-1x1-288-35-35-256-0x0-1x1-1x1-0-NCHW-FP16-B=ConvAsm1x1U:1,16,2,16,1,2,1,2;ConvOclDirectFwd1x1:1,256,1,1,0,1,32,4,0
224-35-35-3x3-256-17-17-256-0x0-2x2-1x1-0-NCHW-FP32-F=ConvOclDirectFwd:32,8,32,32,1,4,8,1,1
128-14-14-1x1-512-14-14-8-0x0-1x1-1x1-0-NCHW-FP32-W=ConvAsmBwdWrW1x1:2,8,2,2,8,1,1,4,0,1
32-14-14-5x5-128-14-14-16-2x2-1x1-1x1-0-NCHW-FP32-F=ConvOclDirectFwd:8,16,16,16,2,1,4,1,2;ConvOclDirectFwdFused:8,8,16,16,2,2,4,4,2
320-8-8-1x1-1280-8-8-8-0x0-1x1-1x1-0-NCHW-FP32-W=ConvAsmBwdWrW1x1:1,16,4,4,4,1,1,4,0,0
320-8-8-3x3-320-17-17-64-0x0-2x2-1x1-0-NCHW-FP32-B=ConvOclDirectFwd:16,16,32,32,2,2,4,4,1
1392-7-7-1x1-192-7-7-16-0x0-1x1-1x1-0-NCHW-FP32-F=ConvAsm1x1U:2,8,2,32,1,4,2,2;ConvActivAsm1x1U:2,16,4,16,1,4;ConvOclDirectFwd1x1:1,64,1,1,1,4,16,256,0
256-14-14-3x3-256-14-14-16-1x1-1x1-1x1-0-NCHW-FP16-W=ConvAsmBwdWrW3x3:0,0,8,4,3,1
832-7-7-1x1-192-7-7-64-0x0-1x1-1x1-0-NCHW-FP32-F=ConvAsm1x1U:2,8,2,32,1,4,1,4;ConvActivAsm1x1U:1,16,2,32,2,2;ConvOclDirectFwd1x1:1,64,1,1,1,4,16,256,0
256-14-14-3x3-128-14-14-4-1x1-1x1-1x1-0-NCHW-FP16-W=ConvAsmBwdWrW3x3:0,0,8,2,4,1
1632-7-7-1x1-192-7-7-16-0x0-1x1-1x1-0-NCHW-FP32-F=ConvAsm1x1U:4,8,4,16,1,4,4,2;ConvActivAsm1x1U:2,16,4,16,1,4;ConvOclDirectFwd1x1:1,64,1,1,1,0,16,256,0
320-7-7-3x3-160-7-7-64-1x1-1x1-1x1-0-NCHW-FP32-W=ConvAsmBwdWrW3x3:0,1,8,2,6,2
64-35-35-1x1-256-35-35-32-0x0-1x1-1x1-0-NCHW-FP32-B=ConvAsm1x1U:1,16,1,64,3,2,2,2;ConvOclDirectFwd1x1:1,256,1,1,0,1,32,4,0
128-56-56-1x1-256-56-56-128-0x0-1x1-1x1-0-NCHW-FP32-B=ConvAsm1x1U:1,32,1,64,2,1,1,4;ConvOclDirectFwd1x1:1,64,1,1,0,2,32,4,0
64-28-28-1x1-320-28-28-32-0x0-1x1-1x1-0-NCHW-FP16-W=ConvAsmBwdWrW1x1:4,4,4,4,2,1,4,4,0,1
288-35-35-1x1-48-35-35-16-0x0-1x1-1x1-0-NCHW-FP16-F=ConvAsm1x1U:2,8,4,32,1,4,2,2;ConvOclDirectFwd1x1:1,64,1,1,0,1,16,4,0
208-14-14-3x3-96-14-14-16-1x1-1x1-1x1-0-NCHW-FP16-W=ConvAsmBwdWrW3x3:0,0,8,2,3,2
320-14-14-3x3-160-14-14-32-1x1-1x1-1x1-0-NCHW-FP16-W=ConvAsmBwdWrW3x3:0,1,8,2,3,4
192-17-17-3x3-192-8-8-1-0x0-2x2-1x1-0-NCHW-FP32-F=ConvOclDirectFwd:8,8,8,8,1,1,1,4,1
384-35-35-3x3-384-17-17-4-0x0-2x2-1x1-0-NCHW-FP32-F=ConvOclDirectFwd:32,8,32,32,1,4,4,1,2
64-56-56-3x3-64-56-56-8-1x1-1x1-1x1-0-NCHW-FP16-B=ConvOclDirectFwd:16,16,32,32,2,2,8,2,1
256-13-13-3x3-256-13-13-128-1x1-1x1-1x1-0-NCHW-FP16-W=ConvAsmBwdWrW3x3:0,1,8,4,4,1
448-8-8-1x1-2048-8-8-32-0x0-1x1-1x1-0-NCHW-FP16-B=ConvAsm1x1U:1,16,2,32,1,2,2,4;ConvOclDirectFwd1x1:1,64,1,1,0,4,16,4,0
480-14-14-1x1-16-14-14-8-0x0-1x1-1x1-0-NCHW-FP16-F=ConvAsm1x1U:1,8,2,64,1,4,4,2;ConvOclDirectFwd1x1:1,64,1,1,0,4,4,8,0
128-14-14-1x1-512-14-14-64-0x0-1x1-1x1-0-NCHW-FP32-W=ConvAsmBwdWrW1x1:1,16,2,8,4,1,4,4,0,1
160-7-7-1x1-832-7-7-1-0x0-1x1-1x1-0-NCHW-FP16-W=ConvAsmBwdWrW1x1:1,16,2,4,2,1,1,2,0,2
64-112-112-1x1-64-112-112-1-0x0-1x1-1x1-0-NCHW-FP32-F=ConvAsm1x1U:1,8,1,64,1,4,1,2;ConvActivAsm1x1U:2,16,2,64,1,3;ConvOclDirectFwd1x1:1,64,1,1,1,4,16,2048,0
64-147-147-3x3-32-147-147-8-1x1-1x1-1x1-0-NCHW-FP16-B=ConvOclDirectFwd:16,16,32,32,2,2,8,2,2
1024-17-17-1x1-128-17-17-256-0x0-1x1-1x1-0-NCHW-FP32-F=ConvAsm1x1U:3,16,5,64,1,2,1,2;ConvActivAsm1x1U:2,16,5,64,2,1;ConvOclDirectFwd1x1:1,64,1,1,1,1,32,2048,0
64-147-147-3x3-96-73-73-16-0x0-2x2-1x1-0-NCHW-FP32-F=ConvOclDirectFwd:16,16,16,16,1,1,8,2,2
256-56-56-3x3-256-56-56-8-1x1-1x1-1x1-0-NCHW-FP16-F=ConvOclDirectFwd:32,8,32,32,1,4,8,1,2;ConvOclDirectFwdFused:32,8,32,32,1,4,8,1,2
32-7-7-1x1-832-7-7-128-0x0-1x1-1x1-0-NCHW-FP16-W=ConvAsmBwdWrW1x1:4,4,4,4,2,2,2,4,0,1
192-64-128-1x1-832-64-128-1-0x0-1x1-1x1-0-NCHW-FP16-W=ConvAsmBwdWrW1x1:4,4,2,2,8,1,1,4,0,2
1280-8-8-1x1-384-8-8-8-0x0-1x1-1x1-0-NCHW-FP16-F=ConvAsm1x1U:1,8,2,32,2,4,4,2;ConvOclDirectFwd1x1:1,128,1,1,0,2,4,4,0
320-8-8-1x1-2048-8-8-16-0x0-1x1-1x1-0-NCHW-FP16-B=ConvAsm1x1U:1,16,2,32,1,2,2,4;ConvOclDirectFwd1x1:1,64,1,1,0,4,16,4,0
384-13-13-3x3-256-13-13-32-1x1-1x1-1x1-0-NCHW-FP16-F=ConvOclDirectFwd:8,8,16,16,2,2,8,4,2;ConvOclDirectFwdFused:8,8,16,16,2,2,8,4,2
96-14-14-1x1-576-14-14-32-0x0-1x1-1x1-0-NCHW-FP32-W=ConvAsmBwdWrW1x1:1,16,2,4,8,1,4,4,0,1
208-14-14-3x3-96-14-14-8-1x1-1x1-1x1-0-NCHW-FP32-W=ConvAsmBwdWrW3x3:0,0,16,4,2,1
1280-8-8-1x1-320-8-8-32-0x0-1x1-1x1-0-NCHW-FP32-F=ConvAsm1x1U:2,16,2,32,3,2,4,2;ConvActivAsm1x1U:4,16,4,16,3,4;ConvOclDirectFwd1x1:1,64,1,1,1,1,16,2048,0
96-28-28-3x3-64-28-28-32-1x1-1x1-1x1-0-NCHW-FP32-W=ConvAsmBwdWrW3x3:0,0,8,2,5,2
64-14-14-1x1-480-14-14-128-0x0-1x1-1x1-0-NCHW-FP16-W=ConvAsmBwdWrW1x1:2,8,2,8,2,1,4,4,0,1
832-7-7-1x1-192-7-7-128-0x0-1x1-1x1-0-NCHW-FP16-F=ConvAsm1x1U:2,8,4,16,1,4,2,4;ConvOclDirectFwd1x1:8,64,8,8,0,1,16,4,1
96-28-28-5x5-32-28-28-32-2x2-1x1-1x1-0-NCHW-FP16-B=ConvOclDirectFwd:16,16,32,32,2,2,4,4,2
16-14-14-1x1-480-14-14-64-0x0-1x1-1x1-0-NCHW-FP32-W=ConvAsmBwdWrW1x1:4,4,4,4,2,1,4,4,0,1
128-28-28-1x1-512-28-28-64-0x0-1x1-1x1-0-NCHW-FP16-B=ConvAsm1x1U:1,16,2,32,1,2,1,4;ConvOclDirectFwd1x1:1,128,1,1,0,4,16,4,0
192-17-17-1x1-1024-17-17-8-0x0-1x1-1x1-0-NCHW-FP32-B=ConvAsm1x1U:1,16,1,64,4,1,2,2;ConvOclDirectFwd1x1:1,64,1,1,0,1,16,4,0
288-14-14-3x3-144-14-14-8-1x1-1x1-1x1-0-NCHW-FP16-W=ConvAsmBwdWrW3x3:0,0,8,2,3,2
64-14-14-1x1-480-14-14-32-0x0-1x1-1x1-0-NCHW-FP32-B=ConvAsm1x1U:1,16,1,64,2,2,1,2;ConvOclDirectFwd1x1:1,64,1,1,0,4,16,4,0
192-71-71-3x3-80-73-73-256-0x0-1x1-1x1-0-NCHW-FP32-B=ConvOclDirectFwd:8,8,16,16,2,2,8,1,1
32-149-149-3x3-3-299-299-256-0x0-2x2-1x1-0-NCHW-FP32-B=ConvOclDirectFwd:16,16,32,32,2,2,8,2,1
112-64-128-1x1-512-64-128-1-0x0-1x1-1x1-0-NCHW-FP32-W=ConvAsmBwdWrW1x1:2,8,4,4,2,1,1,4,0,2
16-14-14-5x5-48-14-14-8-2x2-1x1-1x1-0-NCHW-FP32-F=ConvOclDirectFwd:16,16,16,16,1,1,2,2,2;ConvOclDirectFwdFused:16,16,16,16,1,1,2,2,2
128-28-28-1x1-256-28-28-512-0x0-1x1-1x1-0-NCHW-FP32-W=ConvAsmBwdWrW1x1:2,8,2,4,8,2,4,4,0,1
224-14-14-3x3-112-14-14-4-1x1-1x1-1x1-0-NCHW-FP32-W=ConvAsmBwdWrW3x3:0,0,16,4,3,1
256-28-28-1x1-128-28-28-256-0x0-1x1-1x1-0-NCHW-FP16-W=ConvAsmBwdWrW1x1:4,4,8,1,8,1,2,4,0,1
2048-7-7-1x1-1024-14-14-8-0x0-2x2-1x1-0-NCHW-FP32-W=ConvAsmBwdWrW1x1:1,16,2,4,8,1,1,4,0,3
128-14-14-1x1-512-14-14-512-0x0-1x1-1x1-0-NCHW-FP32-W=ConvAsmBwdWrW1x1:1,16,2,8,4,1,4,4,0,1
256-13-13-3x3-384-13-13-512-1x1-1x1-1x1-0-NCHW-FP16-B=ConvOclDirectFwd:8,8,16,16,2,2,8,2,2
32-7-7-1x1-832-7-7-1-0x0-1x1-1x1-0-NCHW-FP32-B=ConvAsm1x1U:1,8,1,16,1,2,1,1;ConvOclDirectFwd1x1:1,64,1,1,0,1,4,8,0
512-28-28-3x3-512-28-28-1-1x1-1x1-1x1-0-NCHW-FP16-B=ConvOclDirectFwd:16,16,32,32,2,2,2,4,1
128-4-4-1x1-576-4-4-64-0x0-1x1-1x1-0-NCHW-FP16-W=ConvAsmBwdWrW1x1:2,8,2,4,2,2,2,2,0,0
48-35-35-5x5-64-35-35-8-2x2-1x1-1x1-0-NCHW-FP16-F=ConvOclDirectFwd:8,16,16,16,2,1,8,4,1;ConvOclDirectFwdFused:16,8,16,16,1,2,8,4,2
128-112-112-3x3-64-112-112-32-1x1-1x1-1x1-0-NCHW-FP16-W=ConvAsmBwdWrW3x3:0,1,16,2,1,8
832-7-7-1x1-128-7-7-16-0x0-1x1-1x1-0-NCHW-FP32-F=ConvAsm1x1U:2,8,2,32,1,4,4,1;ConvActivAsm1x1U:1,16,2,16,1,4;ConvOclDirectFwd1x1:1,64,1,1,1,4,16,128,0
384-8-8-3x3-448-8-8-128-1x1-1x1-1x1-0-NCHW-FP16-B=ConvOclDirectFwd:8,8,8,8,1,1,8,2,2
128-14-14-1x1-512-14-14-256-0x0-1x1-1x1-0-NCHW-FP32-B=ConvAsm1x1U:1,16,1,32,2,2,2,4;ConvOclDirectFwd1x1:1,256,1,1,0,1,32,4,0
384-8-8-1x1-1280-8-8-1-0x0-1x1-1x1-0-NCHW-FP32-B=ConvAsm1x1U:1,8,1,64,1,4,4,1;ConvOclDirectFwd1x1:1,128,1,1,0,1,4,8,0
128-7-7-5x5-32-7-7-512-2x2-1x1-1x1-0-NCHW-FP16-B=ConvOclDirectFwd:8,8,8,8,1,1,8,2,2
128-14-14-1x1-528-14-14-16-0x0-1x1-1x1-0-NCHW-FP16-W=ConvAsmBwdWrW1x1:2,8,2,4,2,1,4,4,0,2
832-7-7-1x1-384-7-7-4-0x0-1x1-1x1-0-NCHW-FP16-W=ConvAsmBwdWrW1x1:1,16,4,4,2,1,1,4,0,0
1024-7-7-1x1-256-14-14-2-0x0-2x2-1x1-0-NCHW-FP32-B=ConvAsm1x1U:1,8,1,16,1,4,4,1;ConvOclDirectFwd1x1:1,256,1,1,0,1,4,4,0
64-14-14-1x1-480-14-14-512-0x0-1x1-1x1-0-NCHW-FP16-W=ConvAsmBwdWrW1x1:2,8,4,8,2,2,4,4,0,1
128-14-14-3x3-128-28-28-32-1x1-2x2-1x1-0-NCHW-FP32-B=ConvOclDirectFwd:32,8,32,32,1,4,4,4,2
64-512-1024-7x7-3-1024-2048-1-3x3-2x2-1x1-0-NCHW-FP16-B=ConvOclDirectFwd:16,16,32,32,2,2,8,2,1
128-14-14-1x1-528-14-14-4-0x0-1x1-1x1-0-NCHW-FP16-W=ConvAsmBwdWrW1x1:2,8,2,4,2,1,2,4,0,1
128-28-28-3x3-128-56-56-32-1x1-2x2-1x1-0-NCHW-FP32-B=ConvOclDirectFwd:16,16,32,32,2,2,8,2,2
96-28-28-1x1-192-28-28-128-0x0-1x1-1x1-0-NCHW-FP32-W=ConvAsmBwdWrW1x1:2,8,2,8,4,2,4,4,0,1
128-14-14-3x3-128-28-28-16-1x1-2x2-1x1-0-NCHW-FP32-B=ConvOclDirectFwd:32,32,32,32,1,1,4,4,2
208-14-14-3x3-96-14-14-64-1x1-1x1-1x1-0-NCHW-FP32-W=ConvAsmBwdWrW3x3:0,0,8,4,8,2
64-55-55-3x3-64-55-55-32-1x1-1x1-1x1-0-NCHW-FP32-W=ConvAsmBwdWrW3x3:0,0,16,4,3,2
32-28-28-1x1-192-28-28-32-0x0-1x1-1x1-0-NCHW-FP32-W=ConvAsmBwdWrW1x1:4,4,2,4,4,1,4,4,0,2
192-7-7-1x1-1872-7-7-16-0x0-1x1-1x1-0-NCHW-FP16-W=ConvAsmBwdWrW1x1:1,16,2,8,2,1,2,4,0,0
32-147-147-3x3-64-147-147-64-1x1-1x1-1x1-0-NCHW-FP16-F=ConvOclDirectFwd:16,16,32,32,2,2,8,4,1;ConvOclDirectFwdFused:16,16,32,32,2,2,8,4,1
64-112-112-1x1-64-112-112-16-0x0-1x1-1x1-0-NCHW-FP16-W=ConvAsmBwdWrW1x1:4,4,2,4,2,1,4,4,0,2
512-14-14-1x1-144-14-14-64-0x0-1x1-1x1-0-NCHW-FP32-F=ConvAsm1x1U:1,16,1,32,3,2,1,1;ConvActivAsm1x1U:1,16,1,32,4,1;ConvOclDirectFwd1x1:1,64,1,1,1,0,64,2048,0
256-64-128-3x3-128-64-128-1-1x1-1x1-1x1-0-NCHW-FP32-W=ConvAsmBwdWrW3x3:0,0,16,4,1,1
512-14-14-1x1-128-14-14-4-0x0-1x1-1x1-0-NCHW-FP32-F=ConvAsm1x1U:2,8,2,64,1,4,4,1;ConvActivAsm1x1U:2,16,2,16,1,4;ConvOclDirectFwd1x1:1,64,1,1,1,1,16,64,0
96-17-17-3x3-96-35-35-64-0x0-2x2-1x1-0-NCHW-FP32-B=ConvOclDirectFwd:16,8,16,16,1,2,4,1,1
256-14-14-1x1-256-14-14-1-0x0-1x1-1x1-0-NCHW-FP32-F=ConvAsm1x1U:1,8,1,32,1,4,4,1;ConvActivAsm1x1U:1,16,2,32,1,4;ConvOclDirectFwd1x1:1,64,1,1,1,4,16,64,0
512-14-14-3x3-512-14-14-8-1x1-1x1-1x1-0-NCHW-FP16-W=ConvAsmBwdWrW3x3:0,0,8,4,2,1
128-17-17-1x1-768-17-17-1-0x0-1x1-1x1-0-NCHW-FP16-B=ConvAsm1x1U:1,8,2,64,1,2,4,1;ConvOclDirectFwd1x1:1,64,1,1,0,1,4,4,0
768-17-17-1x1-192-17-17-256-0x0-1x1-1x1-0-NCHW-FP16-B=ConvAsm1x1U:1,16,2,32,1,2,2,2;ConvOclDirectFwd1x1:1,128,1,1,0,1,32,4,0
128-28-28-3x3-128-28-28-4-1x1-1x1-1x1-0-NCHW-FP16-W=ConvAsmBwdWrW3x3:0,0,8,2,2,1
384-35-35-1x1-192-35-35-256-0x0-1x1-1x1-0-NCHW-FP16-F=ConvAsm1x1U:2,16,4,64,1,2,1,4;ConvOclDirectFwd1x1:1,64,1,1,0,1,16,4,0
256-14-14-3x3-256-28-28-128-1x1-2x2-1x1-0-NCHW-FP16-B=ConvOclDirectFwd:32,32,32,32,1,1,4,2,2
384-35-35-1x1-64-35-35-32-0x0-1x1-1x1-0-NCHW-FP16-F=ConvAsm1x1U:2,8,4,64,1,4,2,2;ConvOclDirectFwd1x1:1,256,1,1,0,1,16,4,0
256-28-28-1x1-64-28-28-16-0x0-1x1-1x1-0-NCHW-FP16-F=ConvAsm1x1U:1,8,2,16,1,4,2,2;ConvOclDirectFwd1x1:1,64,1,1,0,2,8,4,0
144-14-14-3x3-288-14-14-32-1x1-1x1-1x1-0-NCHW-FP16-F=ConvOclDirectFwd:8,8,16,16,2,2,8,4,2;ConvOclDirectFwdFused:8,8,16,16,2,2,8,4,2
64-28-28-1x1-192-28-28-8-0x0-1x1-1x1-0-NCHW-FP16-B=ConvAsm1x1U:1,16,2,16,1,2,2,2;ConvOclDirectFwd1x1:1,128,1,1,0,2,16,4,0
96-17-17-3x3-96-35-35-32-0x0-2x2-1x1-0-NCHW-FP32-B=ConvOclDirectFwd:8,16,16,16,2,1,8,4,1
256-28-28-1x1-64-28-28-64-0x0-1x1-1x1-0-NCHW-FP32-F=ConvAsm1x1U:3,16,3,32,1,2,1,4;ConvActivAsm1x1U:3,16,3,16,1,1;ConvOclDirectFwd1x1:1,64,1,1,1,0,16,2048,0
32-35-35-1x1-192-35-35-1-0x0-1x1-1x1-0-NCHW-FP32-B=ConvAsm1x1U:1,8,2,64,1,4,1,1;ConvOclDirectFwd1x1:1,256,1,1,0,1,4,4,0
128-28-28-3x3-96-28-28-512-1x1-1x1-1x1-0-NCHW-FP32-W=ConvAsmBwdWrW3x3:0,1,8,4,9,4
96-28-28-3x3-128-28-28-256-1x1-1x1-1x1-0-NCHW-FP16-F=ConvOclDirectFwd:16,16,32,32,2,2,8,1,2;ConvOclDirectFwdFused:16,16,32,32,2,2,8,1,2
768-17-17-1x1-160-17-17-128-0x0-1x1-1x1-0-NCHW-FP32-F=ConvAsm1x1U:3,16,5,64,1,2,4,1;ConvActivAsm1x1U:3,16,5,32,2,2;ConvOclDirectFwd1x1:1,64,1,1,1,0,32,2048,0
256-13-13-3x3-384-13-13-4-1x1-1x1-1x1-0-NCHW-FP32-W=ConvAsmBwdWrW3x3:0,1,8,4,2,1
384-64-128-1x1-832-64-128-1-0x0-1x1-1x1-0-NCHW-FP16-B=ConvOclDirectFwd1x1:1,64,1,1,0,4,16,4,0
128-112-112-3x3-128-112-112-8-1x1-1x1-1x1-0-NCHW-FP16-F=ConvOclDirectFwd:16,8,16,32,1,4,8,1,1;ConvOclDirectFwdFused:8,16,16,16,2,1,8,4,1
64-14-14-1x1-480-14-14-64-0x0-1x1-1x1-0-NCHW-FP16-B=ConvAsm1x1U:1,16,2,64,1,2,1,8;ConvOclDirectFwd1x1:1,128,1,1,0,4,8,4,0
64-35-35-1x1-384-35-35-128-0x0-1x1-1x1-0-NCHW-FP16-B=ConvAsm1x1U:1,16,2,16,1,2,1,2;ConvOclDirectFwd1x1:1,128,1,1,0,1,32,4,0
144-14-14-1x1-512-14-14-64-0x0-1x1-1x1-0-NCHW-FP16-B=ConvAsm1x1U:1,16,2,16,2,2,2,2;ConvOclDirectFwd1x1:1,256,1,1,0,4,8,4,0
64-56-56-1x1-256-56-56-16-0x0-1x1-1x1-0-NCHW-FP32-W=ConvAsmBwdWrW1x1:4,4,4,4,4,1,4,4,0,1
128-14-14-3x3-128-14-14-32-1x1-1x1-1x1-0-NCHW-FP32-W=ConvAsmBwdWrW3x3:0,0,8,4,9,1
160-7-7-3x3-320-7-7-64-1x1-1x1-1x1-0-NCHW-FP16-F=ConvOclDirectFwd:8,8,8,8,1,1,8,4,2;ConvOclDirectFwdFused:8,8,8,8,1,1,8,4,2
16-14-14-1x1-480-14-14-1-0x0-1x1-1x1-0-NCHW-FP32-W=ConvAsmBwdWrW1x1:4,4,2,2,2,1,1,2,0,3
192-56-56-3x3-64-56-56-1-1x1-1x1-1x1-0-NCHW-FP32-W=ConvAsmBwdWrW3x3:0,0,16,2,2,1
96-28-28-1x1-192-28-28-16-0x0-1x1-1x1-0-NCHW-FP16-W=ConvAsmBwdWrW1x1:2,8,2,4,2,1,4,4,0,0
192-8-8-1x1-1280-8-8-4-0x0-1x1-1x1-0-NCHW-FP16-W=ConvAsmBwdWrW1x1:1,16,2,4,2,1,1,4,0,0
512-7-7-3x3-512-7-7-1-1x1-1x1-1x1-0-NCHW-FP32-W=ConvAsmBwdWrW3x3:0,0,8,2,7,1
128-112-112-3x3-64-112-112-64-1x1-1x1-1x1-0-NCHW-FP16-B=ConvOclDirectFwd:8,16,16,32,2,2,8,2,1
256-28-28-1x1-128-28-28-128-0x0-1x1-1x1-0-NCHW-FP32-F=ConvAsm1x1U:2,16,2,32,3,2,1,2;ConvActivAsm1x1U:4,16,5,32,2,1;ConvOclDirectFwd1x1:1,64,1,1,1,0,32,2048,0
1024-14-14-1x1-256-14-14-16-0x0-1x1-1x1-0-NCHW-FP32-B=ConvAsm1x1U:4,16,4,64,1,2,2,2;ConvOclDirectFwd1x1:1,128,1,1,0,2,16,4,0
1968-14-14-1x1-192-14-14-16-0x0-1x1-1x1-0-NCHW-FP32-F=ConvAsm1x1U:2,16,3,16,4,2,4,1;ConvActivAsm1x1U:3,16,3,16,4,4;ConvOclDirectFwd1x1:1,64,1,1,1,1,16,256,0
1024-7-7-1x1-256-14-14-8-0x0-2x2-1x1-0-NCHW-FP32-B=ConvAsm1x1U:1,8,1,64,1,4,4,4;ConvOclDirectFwd1x1:1,256,1,1,0,1,4,8,0
320-14-14-3x3-160-14-14-128-1x1-1x1-1x1-0-NCHW-FP16-B=ConvOclDirectFwd:8,8,16,16,2,2,8,2,2
112-14-14-1x1-512-14-14-128-0x0-1x1-1x1-0-NCHW-FP16-B=ConvAsm1x1U:1,16,2,16,1,2,1,8;ConvOclDirectFwd1x1:1,256,1,1,0,4,16,4,0
2048-8-8-1x1-448-8-8-4-0x0-1x1-1x1-0-NCHW-FP16-F=ConvAsm1x1U:1,8,2,16,1,4,4,1;ConvOclDirectFwd1x1:1,256,1,1,0,2,4,8,0
64-14-14-1x1-512-14-14-8-0x0-1x1-1x1-0-NCHW-FP16-W=ConvAsmBwdWrW1x1:4,4,2,4,2,1,1,2,0,1
128-7-7-1x1-1056-7-7-64-0x0-1x1-1x1-0-NCHW-FP16-B=ConvAsm1x1U:1,16,2,32,1,2,2,2;ConvOclDirectFwd1x1:1,128,1,1,0,1,8,4,0
48-7-7-1x1-832-7-7-8-0x0-1x1-1x1-0-NCHW-FP32-B=ConvAsm1x1U:1,8,1,64,1,4,1,8;ConvOclDirectFwd1x1:1,128,1,1,0,1,4,8,0
528-14-14-1x1-128-14-14-4-0x0-1x1-1x1-0-NCHW-FP32-F=ConvAsm1x1U:2,8,2,64,1,4,4,1;ConvActivAsm1x1U:2,16,2,16,1,4;ConvOclDirectFwd1x1:1,64,1,1,1,1,16,64,0
32-28-28-1x1-192-28-28-256-0x0-1x1-1x1-0-NCHW-FP16-B=ConvAsm1x1U:1,16,2,32,1,2,1,4;ConvOclDirectFwd1x1:1,256,1,1,0,2,32,4,0
256-56-56-3x3-256-56-56-32-1x1-1x1-1x1-0-NCHW-FP16-F=ConvOclDirectFwd:16,16,32,32,2,2,8,2,2;ConvOclDirectFwdFused:32,8,32,32,1,4,8,1,1
160-14-14-1x1-528-14-14-256-0x0-1x1-1x1-0-NCHW-FP16-F=ConvAsm1x1U:1,16,2,16,2,2,1,4;ConvOclDirectFwd1x1:1,256,1,1,0,4,16,4,0
144-14-14-3x3-288-14-14-256-1x1-1x1-1x1-0-NCHW-FP16-F=ConvOclDirectFwd:8,8,16,16,2,2,8,1,2;ConvOclDirectFwdFused:8,8,16,16,2,2,8,1,2
64-147-147-3x3-32-147-147-8-1x1-1x1-1x1-0-NCHW-FP16-W=ConvAsmBwdWrW3x3:0,1,16,2,1,4
512-14-14-1x1-1024-14-14-64-0x0-1x1-1x1-0-NCHW-FP16-W=ConvAsmBwdWrW1x1:2,8,4,8,2,1,1,2,0,3
160-14-14-1x1-512-14-14-512-0x0-1x1-1x1-0-NCHW-FP32-B=ConvAsm1x1U:1,32,1,16,2,1,2,2;ConvOclDirectFwd1x1:1,256,1,1,0,1,32,4,0
192-14-14-1x1-432-14-14-16-0x0-1x1-1x1-0-NCHW-FP32-B=ConvAsm1x1U:1,16,1,32,2,2,1,1;ConvOclDirectFwd1x1:1,256,1,1,0,4,16,4,0
128-28-28-3x3-96-28-28-32-1x1-1x1-1x1-0-NCHW-FP16-B=ConvOclDirectFwd:32,8,32,32,1,4,8,2,2
256-14-14-1x1-1024-14-14-64-0x0-1x1-1x1-0-NCHW-FP16-F=ConvAsm1x1U:1,16,2,16,2,2,1,4;ConvOclDirectFwd1x1:1,64,1,1,0,2,32,4,0
384-7-7-1x1-832-7-7-32-0x0-1x1-1x1-0-NCHW-FP16-B=ConvAsm1x1U:1,16,2,32,1,2,4,1;ConvOclDirectFwd1x1:1,64,1,1,0,1,8,4,0
64-28-28-1x1-192-28-28-64-0x0-1x1-1x1-0-NCHW-FP32-W=ConvAsmBwdWrW1x1:4,4,4,4,4,1,4,4,0,1
64-27-27-5x5-192-27-27-32-2x2-1x1-1x1-0-NCHW-FP32-F=ConvOclDirectFwd:16,16,32,32,2,2,8,1,2;ConvOclDirectFwdFused:16,16,32,32,2,2,8,1,2
2160-7-7-1x1-192-7-7-16-0x0-1x1-1x1-0-NCHW-FP32-F=ConvAsm1x1U:2,8,2,32,1,4,2,2;ConvActivAsm1x1U:4,16,4,16,1,4;ConvOclDirectFwd1x1:1,64,1,1,1,1,16,256,0
256-14-14-3x3-256-14-14-128-1x1-1x1-1x1-0-NCHW-FP16-F=ConvOclDirectFwd:8,8,16,16,2,2,8,1,2;ConvOclDirectFwdFused:8,8,16,16,2,2,8,1,1
1024-17-17-1x1-384-17-17-128-0x0-1x1-1x1-0-NCHW-FP16-F=ConvAsm1x1U:2,16,4,16,1,2,2,2;ConvOclDirectFwd1x1:1,128,1,1,0,1,16,4,0
1024-14-14-1x1-2048-7-7-4-0x0-2x2-1x1-0-NCHW-FP32-F=ConvAsm1x1U:4,8,4,16,1,4,4,2;ConvOclDirectFwd1x1:1,64,1,1,1,0,32,256,0
128-17-17-1x1-768-17-17-16-0x0-1x1-1x1-0-NCHW-FP16-B=ConvAsm1x1U:1,16,2,16,1,2,2,2;ConvOclDirectFwd1x1:1,64,1,1,0,1,8,4,0
384-35-35-1x1-96-35-35-1-0x0-1x1-1x1-0-NCHW-FP32-F=ConvAsm1x1U:2,8,2,64,1,2,4,2;ConvActivAsm1x1U:1,16,1,64,1,4;ConvOclDirectFwd1x1:1,64,1,1,1,1,16,64,0
80-73-73-1x1-64-73-73-256-0x0-1x1-1x1-0-NCHW-FP16-B=ConvAsm1x1U:3,8,6,64,1,4,1,4;ConvOclDirectFwd1x1:1,256,1,1,0,1,32,4,0
192-35-35-1x1-64-35-35-16-0x0-1x1-1x1-0-NCHW-FP16-F=ConvAsm1x1U:1,8,2,64,1,4,2,2;ConvOclDirectFwd1x1:1,256,1,1,0,1,16,8,0
96-71-71-3x3-64-73-73-256-0x0-1x1-1x1-0-NCHW-FP32-B=ConvOclDirectFwd:8,8,16,16,2,2,8,1,1
528-14-14-1x1-32-14-14-4-0x0-1x1-1x1-0-NCHW-FP16-F=ConvAsm1x1U:1,8,2,16,1,4,4,1;ConvOclDirectFwd1x1:1,64,1,1,0,4,4,8,0
32-7-7-1x1-832-7-7-64-0x0-1x1-1x1-0-NCHW-FP32-W=ConvAsmBwdWrW1x1:4,4,2,4,4,1,2,4,0,1
512-14-14-3x3-512-14-14-8-1x1-1x1-1x1-0-NCHW-FP32-W=ConvAsmBwdWrW3x3:0,1,8,4,3,1
64-147-147-3x3-32-147-147-4-1x1-1x1-1x1-0-NCHW-FP16-B=ConvOclDirectFwd:16,16,32,32,2,2,8,4,2
192-17-17-1x1-1024-17-17-64-0x0-1x1-1x1-0-NCHW-FP32-B=ConvAsm1x1U:1,32,1,64,2,1,2,2;ConvOclDirectFwd1x1:1,256,1,1,0,1,32,4,0
768-17-17-1x1-128-17-17-4-0x0-1x1-1x1-0-NCHW-FP32-F=ConvAsm1x1U:3,8,5,64,1,4,4,1;ConvActivAsm1x1U:3,16,3,16,1,4;ConvOclDirectFwd1x1:1,64,1,1,1,0,16,128,0
192-7-7-1x1-1776-7-7-16-0x0-1x1-1x1-0-NCHW-FP32-B=ConvOclDirectFwd1x1:8,64,8,8,0,1,16,4,1
768-17-17-1x1-128-17-17-256-0x0-1x1-1x1-0-NCHW-FP16-B=ConvAsm1x1U:1,16,2,16,1,2,2,2;ConvOclDirectFwd1x1:1,64,1,1,0,1,32,4,0
96-35-35-1x1-384-35-35-4-0x0-1x1-1x1-0-NCHW-FP16-W=ConvAsmBwdWrW1x1:4,4,4,4,2,1,2,4,0,0
128-17-17-1x1-768-17-17-256-0x0-1x1-1x1-0-NCHW-FP32-F=ConvAsm1x1U:1,16,1,64,4,2,1,4;ConvOclDirectFwd1x1:1,64,1,1,1,1,32,2048,0
2048-7-7-1x1-512-7-7-32-0x0-1x1-1x1-0-NCHW-FP32-W=ConvAsmBwdWrW1x1:1,16,4,8,4,1,1,4,0,2
128-14-14-1x1-528-14-14-64-0x0-1x1-1x1-0-NCHW-FP16-W=ConvAsmBwdWrW1x1:2,8,2,8,2,1,4,4,0,2
512-7-7-3x3-512-14-14-128-1x1-2x2-1x1-0-NCHW-FP16-B=ConvOclDirectFwd:8,8,8,8,1,1,4,1,1
1024-17-17-1x1-384-17-17-256-0x0-1x1-1x1-0-NCHW-FP32-F=ConvAsm1x1U:3,16,5,64,1,2,2,1;ConvActivAsm1x1U:3,16,5,64,2,2;ConvOclDirectFwd1x1:1,64,1,1,1,0,32,2048,0
512-28-28-1x1-256-14-14-64-0x0-2x2-1x1-0-NCHW-FP16-F=ConvAsm1x1U:2,8,4,64,1,4,1,8;ConvOclDirectFwd1x1:1,128,1,1,0,2,32,4,0
256-7-7-1x1-832-7-7-1-0x0-1x1-1x1-0-NCHW-FP16-W=ConvAsmBwdWrW1x1:1,16,2,4,2,1,1,4,0,1
16-14-14-5x5-48-14-14-32-2x2-1x1-1x1-0-NCHW-FP16-F=ConvOclDirectFwd:8,8,16,16,2,2,2,1,2;ConvOclDirectFwdFused:8,8,16,16,2,2,2,1,2
2048-7-7-1x1-512-7-7-256-0x0-1x1-1x1-0-NCHW-FP16-B=ConvAsm1x1U:1,16,2,32,1,2,2,2;ConvOclDirectFwd1x1:1,64,1,1,0,1,32,4,0
96-35-35-3x3-64-35-35-16-1x1-1x1-1x1-0-NCHW-FP32-W=ConvAsmBwdWrW3x3:0,0,8,2,4,2
832-7-7-1x1-32-7-7-128-0x0-1x1-1x1-0-NCHW-FP32-F=ConvAsm1x1U:2,8,2,32,1,4,2,2;ConvActivAsm1x1U:1,16,2,32,1,4;ConvOclDirectFwd1x1:1,64,1,1,1,1,16,128,0
256-13-13-3x3-384-13-13-128-1x1-1x1-1x1-0-NCHW-FP16-B=ConvOclDirectFwd:8,8,16,16,2,2,8,2,1
192-14-14-1x1-480-14-14-1-0x0-1x1-1x1-0-NCHW-FP32-B=ConvAsm1x1U:1,8,1,64,1,4,2,2;ConvOclDirectFwd1x1:1,64,1,1,0,4,4,4,0
32-28-28-1x1-256-28-28-1-0x0-1x1-1x1-0-NCHW-FP16-B=ConvAsm1x1U:1,8,2,64,1,2,2,1;ConvOclDirectFwd1x1:1,128,1,1,0,2,4,4,0
192-7-7-1x1-832-7-7-1-0x0-1x1-1x1-0-NCHW-FP16-B=ConvAsm1x1U:1,8,2,32,1,2,4,1;ConvOclDirectFwd1x1:1,64,1,1,0,1,4,4,0
832-7-7-1x1-160-7-7-4-0x0-1x1-1x1-0-NCHW-FP16-F=ConvAsm1x1U:1,8,2,16,1,4,4,1;ConvOclDirectFwd1x1:1,64,1,1,0,1,4,8,0
112-14-14-1x1-512-14-14-512-0x0-1x1-1x1-0-NCHW-FP32-B=ConvAsm1x1U:1,32,1,32,2,1,1,4;ConvOclDirectFwd1x1:1,64,1,1,0,2,32,4,0
384-7-7-1x1-832-7-7-512-0x0-1x1-1x1-0-NCHW-FP16-W=ConvAsmBwdWrW1x1:1,16,4,4,4,2,4,4,0,3
32-7-7-1x1-832-7-7-256-0x0-1x1-1x1-0-NCHW-FP16-B=ConvAsm1x1U:1,16,2,32,1,2,1,2;ConvOclDirectFwd1x1:1,128,1,1,0,1,16,4,0
608-14-14-1x1-160-14-14-32-0x0-1x1-1x1-0-NCHW-FP16-F=ConvAsm1x1U:2,8,4,64,1,4,4,2;ConvOclDirectFwd1x1:1,64,1,1,0,4,8,4,0
512-28-28-1x1-256-28-28-64-0x0-1x1-1x1-0-NCHW-FP16-F=ConvAsm1x1U:2,8,4,16,1,4,1,4;ConvOclDirectFwd1x1:1,64,1,1,0,4,16,4,0
1024-14-14-1x1-512-14-14-128-0x0-1x1-1x1-0-NCHW-FP32-F=ConvAsm1x1U:4,16,4,64,1,2,1,8;ConvActivAsm1x1U:4,16,4,64,3,2;ConvOclDirectFwd1x1:1,64,1,1,1,1,32,2048,0
2048-7-7-1x1-512-7-7-8-0x0-1x1-1x1-0-NCHW-FP32-W=ConvAsmBwdWrW1x1:1,16,2,4,8,1,1,4,0,2
320-7-7-3x3-160-7-7-512-1x1-1x1-1x1-0-NCHW-FP16-W=ConvAsmBwdWrW3x3:0,1,8,4,7,2
48-7-7-5x5-128-7-7-1-2x2-1x1-1x1-0-NCHW-FP32-F=ConvOclDirectFwd:8,8,8,8,1,1,1,4,1;ConvOclDirectFwdFused:8,8,8,8,1,1,1,4,1
512-28-28-1x1-256-56-56-4-0x0-2x2-1x1-0-NCHW-FP16-W=ConvAsmBwdWrW1x1:2,8,4,4,2,1,1,4,0,1
512-28-28-3x3-512-28-28-128-1x1-1x1-1x1-0-NCHW-FP16-B=ConvOclDirectFwd:16,16,32,32,2,2,8,1,2
192-56-56-3x3-64-56-56-512-1x1-1x1-1x1-0-NCHW-FP32-W=ConvAsmBwdWrW3x3:0,0,8,4,2,4
128-7-7-1x1-832-7-7-64-0x0-1x1-1x1-0-NCHW-FP16-B=ConvAsm1x1U:1,16,2,32,1,2,1,4;ConvOclDirectFwd1x1:1,256,1,1,0,1,8,4,0
128-14-14-1x1-528-14-14-256-0x0-1x1-1x1-0-NCHW-FP32-W=ConvAsmBwdWrW1x1:2,8,4,4,8,2,2,4,0,1
48-35-35-1x1-288-35-35-256-0x0-1x1-1x1-0-NCHW-FP16-W=ConvAsmBwdWrW1x1:4,4,4,4,4,1,4,4,0,1
256-28-28-3x3-512-28-28-256-1x1-1x1-1x1-0-NCHW-FP16-F=ConvOclDirectFwd:16,8,32,32,2,4,8,1,1;ConvOclDirectFwdFused:16,16,32,32,2,2,8,1,2
256-56-56-1x1-128-28-28-8-0x0-2x2-1x1-0-NCHW-FP16-F=ConvAsm1x1U:1,8,2,32,1,4,2,2;ConvOclDirectFwd1x1:1,256,1,1,0,2,16,8,0
64-64-128-1x1-480-64-128-1-0x0-1x1-1x1-0-NCHW-FP16-W=ConvAsmBwdWrW1x1:4,4,2,4,4,1,1,4,0,1
3-224-224-3x3-64-224-224-128-1x1-1x1-1x1-0-NCHW-FP32-F=ConvOclDirectFwd:8,32,16,32,2,1,8,1,2;ConvOclDirectFwdFused:8,32,16,32,2,1,8,1,1
224-35-35-3x3-192-35-35-128-1x1-1x1-1x1-0-NCHW-FP16-W=ConvAsmBwdWrW3x3:0,1,8,4,1,4
192-14-14-1x1-1392-14-14-16-0x0-1x1-1x1-0-NCHW-FP32-W=ConvAsmBwdWrW1x1:1,16,2,8,4,1,2,4,0,1
1056-14-14-1x1-192-14-14-16-0x0-1x1-1x1-0-NCHW-FP32-F=ConvAsm1x1U:4,16,4,64,1,2,4,1;ConvActivAsm1x1U:2,16,3,16,4,4;ConvOclDirectFwd1x1:1,64,1,1,1,0,16,256,0
480-14-14-1x1-64-14-14-64-0x0-1x1-1x1-0-NCHW-FP16-F=ConvAsm1x1U:1,8,2,16,2,4,1,8;ConvOclDirectFwd1x1:1,64,1,1,0,4,8,4,0
384-8-8-1x1-2048-8-8-128-0x0-1x1-1x1-0-NCHW-FP32-W=ConvAsmBwdWrW1x1:1,16,4,4,8,1,2,4,0,1
64-56-56-1x1-256-56-56-32-0x0-1x1-1x1-0-NCHW-FP32-W=ConvAsmBwdWrW1x1:4,4,4,4,4,1,4,4,0,1
160-73-73-1x1-64-73-73-128-0x0-1x1-1x1-0-NCHW-FP16-F=ConvAsm1x1U:3,8,6,64,1,4,1,4;ConvOclDirectFwd1x1:1,64,1,1,0,1,32,4,0
16-14-14-5x5-48-14-14-4-2x2-1x1-1x1-0-NCHW-FP16-F=ConvOclDirectFwd:16,16,16,16,1,1,1,4,2;ConvOclDirectFwdFused:16,16,16,16,1,1,2,4,2
192-13-13-3x3-384-13-13-1-1x1-1x1-1x1-0-NCHW-FP16-F=ConvOclDirectFwd:16,16,16,16,1,1,2,4,1;ConvOclDirectFwdFused:16,16,16,16,1,1,2,4,1
224-7-7-3x3-160-7-7-32-1x1-1x1-1x1-0-NCHW-FP16-B=ConvOclDirectFwd:8,8,8,8,1,1,4,1,2
16-28-28-1x1-192-28-28-8-0x0-1x1-1x1-0-NCHW-FP16-W=ConvAsmBwdWrW1x1:4,4,2,2,2,1,4,4,0,1
1024-17-17-1x1-192-17-17-256-0x0-1x1-1x1-0-NCHW-FP16-F=ConvAsm1x1U:2,16,4,16,1,2,1,4;ConvOclDirectFwd1x1:1,64,1,1,0,1,8,8,0
112-14-14-1x1-512-14-14-512-0x0-1x1-1x1-0-NCHW-FP16-B=ConvAsm1x1U:1,16,2,16,1,2,1,4;ConvOclDirectFwd1x1:1,256,1,1,0,2,16,4,0
224-35-35-3x3-192-35-35-64-1x1-1x1-1x1-0-NCHW-FP32-W=ConvAsmBwdWrW3x3:0,0,8,4,3,4
160-64-128-3x3-320-64-128-1-1x1-1x1-1x1-0-NCHW-FP16-F=ConvOclDirectFwd:16,16,32,32,2,2,8,2,1
192-8-8-1x1-1280-8-8-1-0x0-1x1-1x1-0-NCHW-FP16-W=ConvAsmBwdWrW1x1:1,16,2,2,4,1,1,4,0,0
528-14-14-1x1-160-14-14-256-0x0-1x1-1x1-0-NCHW-FP32-W=ConvAsmBwdWrW1x1:2,8,4,8,4,1,2,4,0,2
16-14-14-1x1-480-14-14-16-0x0-1x1-1x1-0-NCHW-FP16-B=ConvAsm1x1U:1,8,2,64,1,2,1,1;ConvOclDirectFwd1x1:1,64,1,1,0,4,8,8,0
128-56-56-1x1-256-56-56-64-0x0-1x1-1x1-0-NCHW-FP16-B=ConvAsm1x1U:1,16,2,32,1,2,1,4;ConvOclDirectFwd1x1:1,256,1,1,0,4,16,4,0
80-73-73-1x1-64-73-73-8-0x0-1x1-1x1-0-NCHW-FP16-B=ConvAsm1x1U:1,16,2,64,2,2,1,4;ConvOclDirectFwd1x1:16,64,32,32,0,1,16,4,1
48-7-7-1x1-832-7-7-1-0x0-1x1-1x1-0-NCHW-FP16-B=ConvAsm1x1U:1,8,2,32,1,2,4,2;ConvOclDirectFwd1x1:1,64,1,1,0,1,4,4,0
128-28-28-3x3-192-28-28-64-1x1-1x1-1x1-0-NCHW-FP16-F=ConvOclDirectFwd:16,16,32,32,2,2,8,1,2;ConvOclDirectFwdFused:16,16,32,32,2,2,8,1,2
48-14-14-5x5-16-14-14-64-2x2-1x1-1x1-0-NCHW-FP16-B=ConvOclDirectFwd:16,8,16,16,1,2,4,1,2
192-14-14-1x1-768-14-14-16-0x0-1x1-1x1-0-NCHW-FP16-B=ConvAsm1x1U:1,16,2,16,1,2,2,2;ConvOclDirectFwd1x1:1,64,1,1,0,4,8,4,0
2048-8-8-1x1-448-8-8-8-0x0-1x1-1x1-0-NCHW-FP32-F=ConvAsm1x1U:4,8,4,16,1,4,2,2;ConvActivAsm1x1U:4,16,4,16,1,4;ConvOclDirectFwd1x1:1,64,1,1,1,4,32,256,0
24-128-128-1x1-512-128-128-1-0x0-1x1-1x1-0-NCHW-FP32-W=ConvAsmBwdWrW1x1:4,4,8,4,2,1,1,4,0,3
832-64-128-1x1-384-64-128-1-0x0-1x1-1x1-0-NCHW-FP32-F=ConvOclDirectFwdFused:1,64,1,1,1,1,32,2048,0;ConvOclDirectFwd1x1:1,64,1,1,1,1,16,2048,0
64-112-112-7x7-3-225-225-8-2x2-2x2-1x1-0-NCHW-FP16-B=ConvOclDirectFwd:16,16,32,32,2,2,8,2,1
256-14-14-1x1-256-14-14-2-0x0-1x1-1x1-0-NCHW-FP32-W=ConvAsmBwdWrW1x1:1,16,2,4,2,1,2,4,0,0
96-128-256-1x1-192-128-256-1-0x0-1x1-1x1-0-NCHW-FP16-W=ConvAsmBwdWrW1x1:4,4,4,1,8,1,1,4,0,2
480-14-14-1x1-16-14-14-256-0x0-1x1-1x1-0-NCHW-FP32-F=ConvAsm1x1U:3,8,4,64,1,2,1,1;ConvActivAsm1x1U:1,16,2,64,1,2;ConvOclDirectFwd1x1:1,64,1,1,1,4,64,2048,0
384-35-35-3x3-384-17-17-8-0x0-2x2-1x1-0-NCHW-FP32-F=ConvOclDirectFwd:32,8,32,32,1,4,8,1,1
24-14-14-5x5-64-14-14-1-2x2-1x1-1x1-0-NCHW-FP32-F=ConvOclDirectFwd:16,16,16,16,1,1,1,4,1;ConvOclDirectFwdFused:16,16,16,16,1,1,1,4,1
480-14-14-1x1-96-14-14-256-0x0-1x1-1x1-0-NCHW-FP32-F=ConvAsm1x1U:2,16,2,64,2,2,1,1;ConvActivAsm1x1U:2,16,2,64,2,1;ConvOclDirectFwd1x1:1,64,1,1,1,1,16,2048,0
192-14-14-1x1-480-14-14-32-0x0-1x1-1x1-0-NCHW-FP16-W=ConvAsmBwdWrW1x1:2,8,2,8,2,1,2,4,0,1
512-14-14-1x1-160-14-14-16-0x0-1x1-1x1-0-NCHW-FP32-F=ConvAsm1x1U:1,8,1,32,3,4,1,4;ConvActivAsm1x1U:4,16,5,16,2,3;ConvOclDirectFwd1x1:1,64,1,1,1,1,16,256,0
32-7-7-1x1-832-7-7-32-0x0-1x1-1x1-0-NCHW-FP32-B=ConvAsm1x1U:1,16,1,64,1,2,2,1;ConvOclDirectFwd1x1:1,256,1,1,0,1,8,4,0
128-17-17-1x1-1024-17-17-4-0x0-1x1-1x1-0-NCHW-FP16-B=ConvAsm1x1U:1,16,2,16,1,2,2,2;ConvOclDirectFwd1x1:1,256,1,1,0,1,8,4,0
48-14-14-3x3-192-14-14-16-1x1-1x1-1x1-0-NCHW-FP16-B=ConvOclDirectFwd:8,8,16,16,2,2,4,1,2
208-14-14-3x3-96-14-14-32-1x1-1x1-1x1-0-NCHW-FP32-W=ConvAsmBwdWrW3x3:0,0,8,2,14,1
144-14-14-1x1-512-14-14-16-0x0-1x1-1x1-0-NCHW-FP16-W=ConvAsmBwdWrW1x1:4,4,4,4,2,1,2,4,0,0
320-7-7-3x3-160-7-7-64-1x1-1x1-1x1-0-NCHW-FP16-W=ConvAsmBwdWrW3x3:0,0,8,4,7,2
128-28-28-3x3-128-28-28-1-1x1-1x1-1x1-0-NCHW-FP16-F=ConvOclDirectFwd:16,16,16,16,1,1,2,4,1;ConvOclDirectFwdFused:16,16,16,16,1,1,2,4,1
384-13-13-3x3-192-13-13-512-1x1-1x1-1x1-0-NCHW-FP16-W=ConvAsmBwdWrW3x3:0,0,8,4,3,1
32-147-147-3x3-32-149-149-8-0x0-1x1-1x1-0-NCHW-FP16-B=ConvOclDirectFwd:16,16,32,32,2,2,8,2,2
128-28-28-1x1-512-28-28-256-0x0-1x1-1x1-0-NCHW-FP16-W=ConvAsmBwdWrW1x1:4,4,8,4,2,1,1,4,0,1
112-14-14-1x1-512-14-14-64-0x0-1x1-1x1-0-NCHW-FP32-B=ConvAsm1x1U:1,16,1,64,2,2,1,2;ConvOclDirectFwd1x1:1,128,1,1,0,4,16,4,0
1024-14-14-1x1-256-14-14-16-0x0-1x1-1x1-0-NCHW-FP32-F=ConvAsm1x1U:4,16,4,64,1,2,2,1;ConvOclDirectFwd1x1:1,64,1,1,1,0,16,2048,0
512-14-14-1x1-128-28-28-1-0x0-2x2-1x1-0-NCHW-FP32-B=ConvAsm1x1U:1,8,1,32,1,4,4,1;ConvOclDirectFwd1x1:1,128,1,1,0,1,8,4,0
192-17-17-1x1-768-17-17-16-0x0-1x1-1x1-0-NCHW-FP32-B=ConvAsm1x1U:1,16,1,64,2,2,2,4;ConvOclDirectFwd1x1:1,128,1,1,0,1,16,4,0
192-7-7-1x1-832-7-7-64-0x0-1x1-1x1-0-NCHW-FP16-B=ConvAsm1x1U:1,16,2,32,1,2,2,4;ConvOclDirectFwd1x1:1,256,1,1,0,1,16,4,0
832-7-7-1x1-32-7-7-16-0x0-1x1-1x1-0-NCHW-FP16-F=ConvAsm1x1U:1,8,2,32,1,4,4,1;ConvOclDirectFwd1x1:1,64,1,1,0,1,4,8,0
32-14-14-1x1-512-14-14-32-0x0-1x1-1x1-0-NCHW-FP32-B=ConvAsm1x1U:1,16,1,64,1,2,2,1;ConvOclDirectFwd1x1:8,64,16,16,0,2,16,4,1
128-128-256-1x1-256-128-256-1-0x0-1x1-1x1-0-NCHW-FP32-B=ConvOclDirectFwd1x1:1,128,1,1,0,4,16,8,0
480-14-14-1x1-64-14-14-256-0x0-1x1-1x1-0-NCHW-FP32-W=ConvAsmBwdWrW1x1:2,8,4,8,2,1,4,4,0,2
48-35-35-1x1-288-35-35-128-0x0-1x1-1x1-0-NCHW-FP32-B=ConvAsm1x1U:1,32,1,64,1,1,1,1;ConvOclDirectFwd1x1:1,256,1,1,0,1,32,4,0
512-14-14-1x1-32-14-14-8-0x0-1x1-1x1-0-NCHW-FP16-F=ConvAsm1x1U:1,8,2,64,1,2,4,1;ConvOclDirectFwd1x1:1,64,1,1,0,4,4,8,0
192-28-28-3x3-128-28-28-512-1x1-1x1-1x1-0-NCHW-FP32-W=ConvAsmBwdWrW3x3:0,0,8,4,6,4
192-14-14-1x1-1488-14-14-16-0x0-1x1-1x1-0-NCHW-FP16-B=ConvAsm1x1U:1,16,2,16,1,2,2,2;ConvOclDirectFwd1x1:1,64,1,1,0,4,16,4,0
352-7-7-1x1-1056-7-7-32-0x0-1x1-1x1-0-NCHW-FP32-B=ConvAsm1x1U:1,16,1,64,2,2,2,2;ConvOclDirectFwd1x1:1,64,1,1,0,1,16,8,0
2048-7-7-1x1-512-7-7-16-0x0-1x1-1x1-0-NCHW-FP16-B=ConvAsm1x1U:2,8,4,16,1,4,4,2;ConvOclDirectFwd1x1:1,64,1,1,0,1,8,4,0
832-7-7-1x1-48-7-7-8-0x0-1x1-1x1-0-NCHW-FP32-F=ConvAsm1x1U:1,8,1,16,1,4,4,1;ConvActivAsm1x1U:1,16,1,16,1,4;ConvOclDirectFwd1x1:1,64,1,1,1,4,32,128,0
512-14-14-3x3-512-14-14-16-1x1-1x1-1x1-0-NCHW-FP16-B=ConvOclDirectFwd:8,16,16,16,2,1,8,1,1
256-128-256-1x1-32-128-256-1-0x0-1x1-1x1-0-NCHW-FP16-F=ConvOclDirectFwd1x1:1,256,1,1,0,4,16,8,0
128-7-7-5x5-32-7-7-256-2x2-1x1-1x1-0-NCHW-FP32-B=ConvOclDirectFwd:8,8,8,8,1,1,8,2,1
512-64-128-1x1-112-64-128-1-0x0-1x1-1x1-0-NCHW-FP16-F=ConvOclDirectFwd1x1:1,128,1,1,0,2,8,8,0
32-28-28-1x1-192-28-28-32-0x0-1x1-1x1-0-NCHW-FP32-B=ConvAsm1x1U:1,16,1,32,1,2,2,1;ConvOclDirectFwd1x1:1,128,1,1,0,2,16,4,0
64-27-27-5x5-192-27-27-16-2x2-1x1-1x1-0-NCHW-FP32-F=ConvOclDirectFwd:16,16,32,32,2,2,8,1,2;ConvOclDirectFwdFused:16,16,32,32,2,2,8,1,2
512-28-28-3x3-512-28-28-4-1x1-1x1-1x1-0-NCHW-FP16-B=ConvOclDirectFwd:16,16,32,32,2,2,8,2,1
16-14-14-5x5-48-14-14-512-2x2-1x1-1x1-0-NCHW-FP16-F=ConvOclDirectFwd:8,8,16,16,2,2,8,1,2;ConvOclDirectFwdFused:8,8,16,16,2,2,8,1,2
256-14-14-1x1-512-28-28-1-0x0-2x2-1x1-0-NCHW-FP32-B=ConvAsm1x1U:1,8,1,64,1,4,2,4;ConvOclDirectFwd1x1:1,64,1,1,0,1,4,4,0
192-28-28-1x1-96-28-28-512-0x0-1x1-1x1-0-NCHW-FP16-F=ConvAsm1x1U:1,8,2,32,2,4,1,4;ConvOclDirectFwd1x1:1,128,1,1,0,4,16,4,0
24-14-14-1x1-512-14-14-64-0x0-1x1-1x1-0-NCHW-FP16-B=ConvAsm1x1U:1,16,2,32,1,2,1,4;ConvOclDirectFwd1x1:1,256,1,1,0,2,16,4,0
192-28-28-1x1-528-28-28-16-0x0-1x1-1x1-0-NCHW-FP32-W=ConvAsmBwdWrW1x1:2,8,2,8,4,2,1,4,0,1
256-14-14-1x1-1024-14-14-64-0x0-1x1-1x1-0-NCHW-FP32-F=ConvAsm1x1U:4,8,4,64,2,2,1,4;ConvActivAsm1x1U:2,16,4,64,3,2;ConvOclDirectFwd1x1:1,64,1,1,1,1,32,2048,0
1024-14-14-1x1-512-28-28-128-0x0-2x2-1x1-0-NCHW-FP32-B=ConvAsm1x1U:1,32,1,32,2,1,1,1;ConvOclDirectFwd1x1:1,128,1,1,0,2,32,4,0
144-14-14-1x1-512-14-14-1-0x0-1x1-1x1-0-NCHW-FP16-W=ConvAsmBwdWrW1x1:2,8,4,1,4,1,1,4,0,0
16-14-14-1x1-480-14-14-1-0x0-1x1-1x1-0-NCHW-FP16-W=ConvAsmBwdWrW1x1:4,4,2,1,2,1,1,4,0,0
128-28-28-3x3-128-28-28-16-1x1-1x1-1x1-0-NCHW-FP16-F=ConvOclDirectFwd:16,16,32,32,2,2,8,2,2;ConvOclDirectFwdFused:16,16,32,32,2,2,8,2,1
256-56-56-1x1-128-28-28-64-0x0-2x2-1x1-0-NCHW-FP32-F=ConvAsm1x1U:2,16,2,32,3,2,2,2;ConvOclDirectFwd1x1:1,64,1,1,1,4,16,2048,0
64-35-35-1x1-192-35-35-4-0x0-1x1-1x1-0-NCHW-FP32-B=ConvAsm1x1U:1,16,1,64,1,2,2,2;ConvOclDirectFwd1x1:1,256,1,1,0,1,8,8,0
32-14-14-1x1-512-14-14-1-0x0-1x1-1x1-0-NCHW-FP32-W=ConvAsmBwdWrW1x1:4,4,2,2,2,1,1,2,0,1
320-8-8-1x1-2048-8-8-8-0x0-1x1-1x1-0-NCHW-FP32-W=ConvAsmBwdWrW1x1:2,8,4,2,8,1,1,4,0,0
512-28-28-1x1-256-14-14-256-0x0-2x2-1x1-0-NCHW-FP16-F=ConvAsm1x1U:2,8,4,64,1,4,1,4;ConvOclDirectFwd1x1:1,128,1,1,0,2,32,4,0
320-7-7-3x3-160-7-7-32-1x1-1x1-1x1-0-NCHW-FP16-B=ConvOclDirectFwd:8,8,8,8,1,1,4,1,2
128-17-17-1x1-768-17-17-64-0x0-1x1-1x1-0-NCHW-FP16-B=ConvAsm1x1U:1,16,2,16,1,2,1,8;ConvOclDirectFwd1x1:1,256,1,1,0,1,32,4,0
768-17-17-1x1-128-17-17-1-0x0-1x1-1x1-0-NCHW-FP16-F=ConvAsm1x1U:1,8,2,32,1,4,4,1;ConvOclDirectFwd1x1:1,64,1,1,0,1,4,8,0
384-13-13-3x3-384-13-13-32-1x1-1x1-1x1-0-NCHW-FP16-F=ConvOclDirectFwd:8,8,16,16,2,2,8,1,1;ConvOclDirectFwdFused:8,8,16,16,2,2,8,1,1
192-35-35-1x1-32-35-35-8-0x0-1x1-1x1-0-NCHW-FP32-F=ConvAsm1x1U:3,8,3,32,1,4,2,2;ConvActivAsm1x1U:2,16,2,16,1,4;ConvOclDirectFwd1x1:1,64,1,1,1,4,16,64,0
64-35-35-1x1-288-35-35-32-0x0-1x1-1x1-0-NCHW-FP16-W=ConvAsmBwdWrW1x1:4,4,8,4,2,1,2,4,0,1
256-7-7-1x1-832-7-7-8-0x0-1x1-1x1-0-NCHW-FP32-W=ConvAsmBwdWrW1x1:1,16,2,4,8,1,1,4,0,1
64-14-14-5x5-32-14-14-64-2x2-1x1-1x1-0-NCHW-FP16-B=ConvOclDirectFwd:16,8,16,16,1,2,4,1,2
64-56-56-1x1-64-56-56-128-0x0-1x1-1x1-0-NCHW-FP16-F=ConvAsm1x1U:1,8,2,32,1,4,1,4;ConvOclDirectFwd1x1:1,128,1,1,0,4,16,4,0
256-56-56-1x1-512-28-28-4-0x0-2x2-1x1-0-NCHW-FP16-F=ConvAsm1x1U:1,8,2,32,2,4,2,2;ConvOclDirectFwd1x1:1,128,1,1,0,2,16,8,0
384-7-7-1x1-832-7-7-16-0x0-1x1-1x1-0-NCHW-FP32-W=ConvAsmBwdWrW1x1:1,16,2,8,4,1,1,4,0,1
96-28-28-5x5-32-28-28-512-2x2-1x1-1x1-0-NCHW-FP16-B=ConvOclDirectFwd:16,16,32,32,2,2,8,4,2
384-7-7-1x1-832-7-7-16-0x0-1x1-1x1-0-NCHW-FP16-W=ConvAsmBwdWrW1x1:1,16,2,8,2,1,2,4,0,1
512-28-28-1x1-128-28-28-4-0x0-1x1-1x1-0-NCHW-FP16-W=ConvAsmBwdWrW1x1:4,4,4,4,2,2,1,2,0,1
480-14-14-1x1-192-14-14-64-0x0-1x1-1x1-0-NCHW-FP32-F=ConvAsm1x1U:2,16,2,64,2,2,1,2;ConvActivAsm1x1U:3,16,4,64,1,1;ConvOclDirectFwd1x1:1,64,1,1,1,4,16,2048,0
64-14-14-5x5-24-14-14-16-2x2-1x1-1x1-0-NCHW-FP16-B=ConvOclDirectFwd:16,16,16,16,1,1,2,4,2
1056-14-14-1x1-192-14-14-16-0x0-1x1-1x1-0-NCHW-FP32-B=ConvAsm1x1U:1,32,1,32,1,1,2,2;ConvOclDirectFwd1x1:1,64,1,1,0,4,8,4,0
16-28-28-1x1-192-28-28-32-0x0-1x1-1x1-0-NCHW-FP16-W=ConvAsmBwdWrW1x1:4,4,2,1,8,2,4,4,0,1
32-14-14-1x1-528-14-14-128-0x0-1x1-1x1-0-NCHW-FP16-B=ConvAsm1x1U:1,16,2,16,1,2,1,4;ConvOclDirectFwd1x1:1,64,1,1,0,4,8,4,0
128-14-14-1x1-512-14-14-128-0x0-1x1-1x1-0-NCHW-FP32-W=ConvAsmBwdWrW1x1:1,16,2,4,8,1,4,4,0,2
128-7-7-1x1-832-7-7-4-0x0-1x1-1x1-0-NCHW-FP16-W=ConvAsmBwdWrW1x1:4,4,2,4,2,1,1,2,0,1
128-28-28-1x1-512-28-28-1-0x0-1x1-1x1-0-NCHW-FP16-W=ConvAsmBwdWrW1x1:4,4,4,2,2,1,1,4,0,0
192-28-28-1x1-32-28-28-128-0x0-1x1-1x1-0-NCHW-FP32-F=ConvAsm1x1U:2,16,2,32,4,2,1,1;ConvOclDirectFwd1x1:1,64,1,1,1,4,64,2048,0
64-80-350-5x5-128-39-174-16-1x1-2x2-1x1-0-NCHW-FP32-F=ConvOclDirectFwd:16,16,16,32,1,2,8,1,2
160-14-14-1x1-512-14-14-32-0x0-1x1-1x1-0-NCHW-FP32-W=ConvAsmBwdWrW1x1:2,8,4,2,8,2,1,4,0,1
128-14-14-1x1-512-14-14-128-0x0-1x1-1x1-0-NCHW-FP32-B=ConvAsm1x1U:1,16,1,64,2,2,1,2;ConvOclDirectFwd1x1:1,128,1,1,0,2,32,4,0
480-14-14-1x1-192-14-14-32-0x0-1x1-1x1-0-NCHW-FP16-F=ConvAsm1x1U:1,8,2,64,2,4,2,4;ConvOclDirectFwd1x1:1,128,1,1,0,4,8,4,0
384-64-128-3x3-192-64-128-1-1x1-1x1-1x1-0-NCHW-FP16-B=ConvOclDirectFwd:16,16,32,32,2,2,8,1,1
288-35-35-1x1-48-35-35-4-0x0-1x1-1x1-0-NCHW-FP16-F=ConvAsm1x1U:1,8,2,64,1,4,4,2;ConvOclDirectFwd1x1:1,256,1,1,0,1,8,8,0
48-14-14-5x5-16-14-14-4-2x2-1x1-1x1-0-NCHW-FP32-B=ConvOclDirectFwd:16,16,16,16,1,1,1,4,2
512-28-28-1x1-256-56-56-64-0x0-2x2-1x1-0-NCHW-FP32-B=ConvAsm1x1U:2,16,2,32,2,2,1,4;ConvOclDirectFwd1x1:1,256,1,1,0,2,32,4,0
16-28-28-1x1-192-28-28-512-0x0-1x1-1x1-0-NCHW-FP16-W=ConvAsmBwdWrW1x1:4,4,2,1,8,1,4,4,0,1
16-28-28-1x1-192-28-28-128-0x0-1x1-1x1-0-NCHW-FP16-B=ConvAsm1x1U:1,8,2,64,1,4,1,4;ConvOclDirectFwd1x1:1,256,1,1,0,2,32,4,0
32-64-128-1x1-512-64-128-1-0x0-1x1-1x1-0-NCHW-FP16-B=ConvOclDirectFwd1x1:1,128,1,1,0,4,16,4,0
64-224-224-3x3-3-224-224-2-1x1-1x1-1x1-0-NCHW-FP16-B=ConvOclDirectFwd:16,16,16,32,1,2,2,4,2
1248-14-14-1x1-192-14-14-16-0x0-1x1-1x1-0-NCHW-FP32-F=ConvAsm1x1U:3,8,3,16,1,4,1,4;ConvActivAsm1x1U:2,16,3,16,4,4;ConvOclDirectFwd1x1:1,64,1,1,1,4,16,256,0
48-14-14-5x5-16-14-14-64-2x2-1x1-1x1-0-NCHW-FP32-B=ConvOclDirectFwd:8,16,16,16,2,1,2,1,2
192-56-56-1x1-240-56-56-16-0x0-1x1-1x1-0-NCHW-FP16-B=ConvAsm1x1U:1,16,2,32,1,2,1,1;ConvOclDirectFwd1x1:1,256,1,1,0,4,16,4,0
288-14-14-3x3-144-14-14-64-1x1-1x1-1x1-0-NCHW-FP32-W=ConvAsmBwdWrW3x3:0,0,8,4,8,2
768-17-17-1x1-192-17-17-4-0x0-1x1-1x1-0-NCHW-FP16-F=ConvAsm1x1U:1,8,2,32,1,4,4,1;ConvOclDirectFwd1x1:1,64,1,1,0,1,4,8,0
528-14-14-1x1-256-14-14-4-0x0-1x1-1x1-0-NCHW-FP32-F=ConvAsm1x1U:2,8,2,64,1,4,2,2;ConvActivAsm1x1U:2,16,4,64,1,4;ConvOclDirectFwd1x1:1,64,1,1,1,0,16,128,0
128-17-17-1x1-768-17-17-16-0x0-1x1-1x1-0-NCHW-FP32-W=ConvAsmBwdWrW1x1:1,16,2,4,8,1,2,4,0,1
128-28-28-3x3-192-28-28-4-1x1-1x1-1x1-0-NCHW-FP16-F=ConvOclDirectFwd:16,16,32,32,2,2,4,2,2;ConvOclDirectFwdFused:16,16,32,32,2,2,4,4,2
32-28-28-1x1-192-28-28-1-0x0-1x1-1x1-0-NCHW-FP32-W=ConvAsmBwdWrW1x1:4,4,2,2,2,1,2,4,0,1
64-35-35-1x1-288-35-35-32-0x0-1x1-1x1-0-NCHW-FP32-W=ConvAsmBwdWrW1x1:2,8,4,8,2,1,4,4,0,2
192-14-14-1x1-1920-14-14-16-0x0-1x1-1x1-0-NCHW-FP32-W=ConvAsmBwdWrW1x1:1,16,4,4,8,1,1,4,0,1
1280-8-8-1x1-448-8-8-1-0x0-1x1-1x1-0-NCHW-FP16-F=ConvAsm1x1U:1,8,2,16,1,4,4,1;ConvOclDirectFwd1x1:1,64,1,1,0,1,4,8,0
64-54-54-3x3-64-54-54-8-1x1-1x1-1x1-0-NCHW-FP16-W=ConvAsmBwdWrW3x3:0,1,8,2,1,4
768-17-17-1x1-128-17-17-256-0x0-1x1-1x1-0-NCHW-FP32-F=ConvAsm1x1U:4,16,5,32,1,2,1,2;ConvActivAsm1x1U:3,16,5,64,1,1;ConvOclDirectFwd1x1:1,64,1,1,1,1,32,2048,0
16-28-28-1x1-192-28-28-128-0x0-1x1-1x1-0-NCHW-FP16-W=ConvAsmBwdWrW1x1:4,4,2,1,8,1,4,4,0,1
512-7-7-3x3-512-7-7-16-1x1-1x1-1x1-0-NCHW-FP32-W=ConvAsmBwdWrW3x3:0,1,8,2,7,1
128-28-28-1x1-512-28-28-2-0x0-1x1-1x1-0-NCHW-FP32-W=ConvAsmBwdWrW1x1:2,8,2,4,2,2,1,4,0,1
128-28-28-3x3-128-28-28-32-1x1-1x1-1x1-0-NCHW-FP16-F=ConvOclDirectFwd:16,16,32,32,2,2,8,1,1;ConvOclDirectFwdFused:16,16,32,32,2,2,8,1,1
64-56-56-1x1-256-56-56-64-0x0-1x1-1x1-0-NCHW-FP16-B=ConvAsm1x1U:1,16,2,32,1,2,1,4;ConvOclDirectFwd1x1:1,64,1,1,0,4,16,4,0
96-14-14-3x3-208-14-14-128-1x1-1x1-1x1-0-NCHW-FP16-F=ConvOclDirectFwd:8,8,16,16,2,2,8,1,2;ConvOclDirectFwdFused:8,8,16,16,2,2,8,1,1
192-28-28-1x1-96-28-28-128-0x0-1x1-1x1-0-NCHW-FP32-F=ConvAsm1x1U:2,16,2,32,3,2,1,1;ConvActivAsm1x1U:2,16,2,32,3,1;ConvOclDirectFwd1x1:1,64,1,1,1,1,16,2048,0
480-14-14-1x1-192-14-14-128-0x0-1x1-1x1-0-NCHW-FP16-F=ConvAsm1x1U:1,16,2,16,2,2,2,2;ConvOclDirectFwd1x1:8,64,16,16,0,2,16,4,1
48-7-7-5x5-128-7-7-4-2x2-1x1-1x1-0-NCHW-FP16-F=ConvOclDirectFwd:8,8,8,8,1,1,1,4,2;ConvOclDirectFwdFused:8,8,8,8,1,1,1,4,2
128-14-14-1x1-512-14-14-64-0x0-1x1-1x1-0-NCHW-FP16-W=ConvAsmBwdWrW1x1:4,4,8,4,2,2,1,2,0,1
448-8-8-1x1-1280-8-8-128-0x0-1x1-1x1-0-NCHW-FP32-B=ConvAsm1x1U:1,16,1,64,4,2,1,2;ConvOclDirectFwd1x1:1,64,1,1,0,4,16,4,0
256-14-14-1x1-512-28-28-16-0x0-2x2-1x1-0-NCHW-FP16-W=ConvAsmBwdWrW1x1:2,8,4,4,2,1,1,4,0,1
512-14-14-1x1-160-14-14-1-0x0-1x1-1x1-0-NCHW-FP32-F=ConvAsm1x1U:1,8,1,64,1,4,4,1;ConvActivAsm1x1U:1,16,1,64,1,4;ConvOclDirectFwd1x1:1,64,1,1,1,0,16,64,0
448-8-8-3x3-384-8-8-16-1x1-1x1-1x1-0-NCHW-FP16-F=ConvOclDirectFwd:8,8,8,8,1,1,8,4,1;ConvOclDirectFwdFused:8,8,8,8,1,1,8,4,1
32-7-7-1x1-832-7-7-16-0x0-1x1-1x1-0-NCHW-FP32-B=ConvAsm1x1U:1,8,1,64,1,2,1,4;ConvOclDirectFwd1x1:1,256,1,1,0,1,8,4,0
1024-17-17-1x1-128-17-17-128-0x0-1x1-1x1-0-NCHW-FP32-F=ConvAsm1x1U:4,16,5,64,1,2,1,1;ConvActivAsm1x1U:3,16,5,64,2,1;ConvOclDirectFwd1x1:1,64,1,1,1,0,32,2048,0
32-14-14-1x1-512-14-14-16-0x0-1x1-1x1-0-NCHW-FP16-B=ConvAsm1x1U:1,8,2,16,1,2,2,2;ConvOclDirectFwd1x1:1,128,1,1,0,4,8,4,0
192-17-17-1x1-1024-17-17-32-0x0-1x1-1x1-0-NCHW-FP16-W=ConvAsmBwdWrW1x1:4,4,4,4,4,1,1,2,0,2
480-14-14-1x1-64-14-14-256-0x0-1x1-1x1-0-NCHW-FP32-F=ConvAsm1x1U:4,16,4,64,1,2,4,1;ConvActivAsm1x1U:4,32,7,32,1,2;ConvOclDirectFwd1x1:1,64,1,1,1,1,16,2048,0
2048-8-8-1x1-192-8-8-256-0x0-1x1-1x1-0-NCHW-FP32-F=ConvAsm1x1U:4,8,4,16,2,4,1,4;ConvActivAsm1x1U:4,16,4,16,3,4;ConvOclDirectFwd1x1:1,64,1,1,1,0,32,2048,0
2112-7-7-1x1-192-7-7-16-0x0-1x1-1x1-0-NCHW-FP16-F=ConvAsm1x1U:1,8,2,16,1,4,4,1;ConvOclDirectFwd1x1:1,64,1,1,0,1,4,8,0
128-17-17-1x1-1024-17-17-256-0x0-1x1-1x1-0-NCHW-FP32-F=ConvAsm1x1U:1,16,1,64,4,2,1,4;ConvOclDirectFwd1x1:1,64,1,1,1,1,32,2048,0
128-7-7-1x1-832-7-7-32-0x0-1x1-1x1-0-NCHW-FP32-B=ConvAsm1x1U:1,16,1,64,1,2,1,1;ConvOclDirectFwd1x1:8,64,8,8,0,1,16,4,1
256-14-14-1x1-528-14-14-16-0x0-1x1-1x1-0-NCHW-FP16-B=ConvAsm1x1U:1,16,2,16,1,2,4,1;ConvOclDirectFwd1x1:1,64,1,1,0,4,8,4,0
160-7-7-1x1-832-7-7-16-0x0-1x1-1x1-0-NCHW-FP32-W=ConvAsmBwdWrW1x1:1,16,2,8,2,1,1,4,0,2
160-7-7-3x3-320-7-7-16-1x1-1x1-1x1-0-NCHW-FP16-F=ConvOclDirectFwd:8,8,8,8,1,1,4,4,2;ConvOclDirectFwdFused:8,8,8,8,1,1,4,4,2
512-14-14-1x1-64-14-14-4-0x0-1x1-1x1-0-NCHW-FP32-F=ConvAsm1x1U:1,8,1,64,1,4,4,1;ConvActivAsm1x1U:1,16,1,16,1,4;ConvOclDirectFwd1x1:1,64,1,1,1,4,16,64,0
768-17-17-1x1-160-17-17-256-0x0-1x1-1x1-0-NCHW-FP16-B=ConvAsm1x1U:1,16,2,16,1,2,2,2;ConvOclDirectFwd1x1:1,256,1,1,0,1,32,4,0
1584-14-14-1x1-192-14-14-16-0x0-1x1-1x1-0-NCHW-FP32-F=ConvAsm1x1U:3,16,3,16,4,2,4,1;ConvActivAsm1x1U:3,16,3,16,4,4;ConvOclDirectFwd1x1:1,64,1,1,1,0,32,256,0
384-8-8-1x1-1536-8-8-16-0x0-1x1-1x1-0-NCHW-FP32-W=ConvAsmBwdWrW1x1:1,16,2,4,8,1,2,4,0,0
256-7-7-1x1-832-7-7-2-0x0-1x1-1x1-0-NCHW-FP32-W=ConvAsmBwdWrW1x1:1,16,2,4,4,1,1,4,0,1
448-8-8-1x1-1280-8-8-4-0x0-1x1-1x1-0-NCHW-FP32-W=ConvAsmBwdWrW1x1:1,16,2,4,4,1,1,4,0,1
288-35-35-1x1-48-35-35-1-0x0-1x1-1x1-0-NCHW-FP32-F=ConvAsm1x1U:1,8,1,64,1,4,4,1;ConvActivAsm1x1U:1,16,1,64,1,4;ConvOclDirectFwd1x1:1,64,1,1,1,4,32,64,0
48-64-128-5x5-128-64-128-1-2x2-1x1-1x1-0-NCHW-FP32-F=ConvOclDirectFwd:16,16,16,32,1,2,8,1,1;ConvOclDirectFwdFused:16,16,16,32,1,2,8,1,1
384-17-17-1x1-1024-17-17-32-0x0-1x1-1x1-0-NCHW-FP16-W=ConvAsmBwdWrW1x1:2,8,4,8,2,1,1,2,0,2
192-17-17-1x1-1024-17-17-256-0x0-1x1-1x1-0-NCHW-FP16-W=ConvAsmBwdWrW1x1:4,4,8,4,4,2,2,2,0,2
1024-17-17-1x1-192-17-17-8-0x0-1x1-1x1-0-NCHW-FP16-F=ConvAsm1x1U:2,16,4,16,1,2,4,1;ConvOclDirectFwd1x1:1,64,1,1,0,1,8,8,0
64-35-35-1x1-192-35-35-32-0x0-1x1-1x1-0-NCHW-FP32-W=ConvAsmBwdWrW1x1:4,4,4,4,4,1,4,4,0,1
832-7-7-1x1-128-7-7-1-0x0-1x1-1x1-0-NCHW-FP32-F=ConvAsm1x1U:1,8,1,16,1,4,4,1;ConvActivAsm1x1U:1,16,1,16,1,3;ConvOclDirectFwd1x1:1,64,1,1,1,0,16,64,0
576-14-14-1x1-192-14-14-64-0x0-1x1-1x1-0-NCHW-FP32-F=ConvAsm1x1U:2,16,2,64,2,2,1,2;ConvActivAsm1x1U:3,16,3,16,4,1;ConvOclDirectFwd1x1:1,64,1,1,1,1,16,2048,0
32-28-28-5x5-16-28-28-512-2x2-1x1-1x1-0-NCHW-FP32-B=ConvOclDirectFwd:16,16,32,32,2,2,4,2,2
384-56-56-1x1-192-56-56-16-0x0-1x1-1x1-0-NCHW-FP32-F=ConvAsm1x1U:4,16,5,64,1,2,1,2;ConvActivAsm1x1U:4,16,5,64,2,1;ConvOclDirectFwd1x1:1,64,1,1,1,0,16,2048,0
64-112-112-7x7-3-224-224-128-3x3-2x2-1x1-0-NCHW-FP32-B=ConvOclDirectFwd:16,16,32,32,2,2,8,2,1
128-28-28-1x1-256-28-28-4-0x0-1x1-1x1-0-NCHW-FP32-B=ConvAsm1x1U:1,16,1,16,1,2,2,1;ConvOclDirectFwd1x1:1,128,1,1,0,2,16,4,0
128-28-28-3x3-128-28-28-8-1x1-1x1-1x1-0-NCHW-FP16-W=ConvAsmBwdWrW3x3:0,0,8,2,2,4
288-35-35-3x3-384-17-17-1-0x0-2x2-1x1-0-NCHW-FP32-F=ConvOclDirectFwd:32,8,32,32,1,4,2,1,1
512-28-28-1x1-128-28-28-8-0x0-1x1-1x1-0-NCHW-FP16-F=ConvAsm1x1U:1,8,2,16,2,4,1,4;ConvOclDirectFwd1x1:1,64,1,1,0,4,8,8,0
320-14-14-3x3-160-14-14-16-1x1-1x1-1x1-0-NCHW-FP16-W=ConvAsmBwdWrW3x3:0,0,8,2,3,4
256-56-56-1x1-512-28-28-256-0x0-2x2-1x1-0-NCHW-FP32-F=ConvAsm1x1U:3,16,3,16,2,2,1,4;ConvOclDirectFwd1x1:1,64,1,1,1,0,32,2048,0
1584-7-7-1x1-192-7-7-16-0x0-1x1-1x1-0-NCHW-FP32-F=ConvAsm1x1U:4,8,4,16,1,4,4,2;ConvActivAsm1x1U:4,16,4,16,1,4;ConvOclDirectFwd1x1:1,64,1,1,1,4,16,256,0
16-28-28-1x1-192-28-28-4-0x0-1x1-1x1-0-NCHW-FP32-W=ConvAsmBwdWrW1x1:4,4,2,2,2,1,2,4,0,1
832-7-7-1x1-256-7-7-256-0x0-1x1-1x1-0-NCHW-FP32-F=ConvAsm1x1U:4,16,4,16,1,2,1,2;ConvActivAsm1x1U:2,16,2,32,2,1;ConvOclDirectFwd1x1:1,64,1,1,1,0,32,2048,0
256-7-7-1x1-832-7-7-1-0x0-1x1-1x1-0-NCHW-FP16-B=ConvAsm1x1U:1,8,2,32,1,4,4,1;ConvOclDirectFwd1x1:1,64,1,1,0,1,4,4,0
192-8-8-3x3-192-17-17-128-0x0-2x2-1x1-0-NCHW-FP32-B=ConvOclDirectFwd:16,8,32,32,2,4,4,4,2
96-35-35-1x1-384-35-35-16-0x0-1x1-1x1-0-NCHW-FP32-W=ConvAsmBwdWrW1x1:4,4,8,4,4,1,2,4,0,1
512-28-28-1x1-128-28-28-16-0x0-1x1-1x1-0-NCHW-FP16-B=ConvAsm1x1U:1,16,2,32,1,2,4,1;ConvOclDirectFwd1x1:1,64,1,1,0,4,16,4,0
208-14-14-3x3-96-14-14-256-1x1-1x1-1x1-0-NCHW-FP16-B=ConvOclDirectFwd:8,8,16,16,2,2,8,2,2
1024-17-17-1x1-256-17-17-64-0x0-1x1-1x1-0-NCHW-FP32-F=ConvAsm1x1U:2,16,5,64,1,2,1,4;ConvActivAsm1x1U:4,16,5,64,2,1;ConvOclDirectFwd1x1:1,64,1,1,1,4,32,2048,0
1280-8-8-1x1-320-8-8-1-0x0-1x1-1x1-0-NCHW-FP32-F=ConvAsm1x1U:1,8,1,64,1,4,4,1;ConvActivAsm1x1U:2,16,2,16,1,4;ConvOclDirectFwd1x1:1,64,1,1,1,4,16,64,0
512-7-7-1x1-512-7-7-16-0x0-1x1-1x1-0-NCHW-FP16-F=ConvAsm1x1U:2,8,4,16,1,4,4,1;ConvOclDirectFwd1x1:1,128,1,1,0,1,8,8,0
256-8-8-1x1-1536-8-8-128-0x0-1x1-1x1-0-NCHW-FP32-B=ConvAsm1x1U:1,16,1,64,2,2,1,4;ConvOclDirectFwd1x1:1,128,1,1,0,4,16,4,0
96-14-14-1x1-480-14-14-4-0x0-1x1-1x1-0-NCHW-FP16-W=ConvAsmBwdWrW1x1:1,16,2,4,2,1,4,4,0,0
384-8-8-1x1-2048-8-8-256-0x0-1x1-1x1-0-NCHW-FP16-B=ConvAsm1x1U:1,16,2,32,1,2,1,8;ConvOclDirectFwd1x1:1,256,1,1,0,4,16,4,0
128-7-7-5x5-48-7-7-128-2x2-1x1-1x1-0-NCHW-FP16-B=ConvOclDirectFwd:8,8,8,8,1,1,4,4,2
160-14-14-1x1-528-14-14-512-0x0-1x1-1x1-0-NCHW-FP16-W=ConvAsmBwdWrW1x1:2,8,2,8,2,1,4,4,0,2
160-7-7-1x1-832-7-7-64-0x0-1x1-1x1-0-NCHW-FP32-B=ConvAsm1x1U:1,16,1,64,2,2,2,2;ConvOclDirectFwd1x1:1,128,1,1,0,1,16,8,0
32-14-14-1x1-528-14-14-1-0x0-1x1-1x1-0-NCHW-FP16-W=ConvAsmBwdWrW1x1:4,4,2,2,2,1,1,2,0,1
256-14-14-1x1-512-28-28-32-0x0-2x2-1x1-0-NCHW-FP16-W=ConvAsmBwdWrW1x1:2,8,4,8,2,1,2,2,0,1
256-14-14-3x3-256-14-14-128-1x1-1x1-1x1-0-NCHW-FP16-B=ConvOclDirectFwd:8,8,16,16,2,2,8,2,2
2048-8-8-1x1-320-8-8-1-0x0-1x1-1x1-0-NCHW-FP32-F=ConvAsm1x1U:1,8,1,32,1,4,4,1;ConvActivAsm1x1U:1,16,1,64,1,4;ConvOclDirectFwd1x1:1,64,1,1,1,0,16,128,0
208-14-14-3x3-96-14-14-4-1x1-1x1-1x1-0-NCHW-FP16-W=ConvAsmBwdWrW3x3:0,0,8,2,3,1
192-27-27-5x5-64-27-27-32-2x2-1x1-1x1-0-NCHW-FP32-B=ConvOclDirectFwd:16,16,32,32,2,2,4,2,2
192-28-28-3x3-128-28-28-256-1x1-1x1-1x1-0-NCHW-FP32-W=ConvAsmBwdWrW3x3:0,0,8,4,3,1
128-14-14-3x3-256-14-14-64-1x1-1x1-1x1-0-NCHW-FP16-F=ConvOclDirectFwd:8,16,16,16,2,1,8,1,2;ConvOclDirectFwdFused:8,8,16,16,2,2,8,2,1
256-13-13-3x3-384-13-13-32-1x1-1x1-1x1-0-NCHW-FP32-W=ConvAsmBwdWrW3x3:0,1,16,4,10,1
32-28-28-1x1-256-28-28-32-0x0-1x1-1x1-0-NCHW-FP16-B=ConvAsm1x1U:1,8,2,16,1,4,1,4;ConvOclDirectFwd1x1:1,64,1,1,0,2,8,4,0
16-14-14-1x1-480-14-14-128-0x0-1x1-1x1-0-NCHW-FP32-W=ConvAsmBwdWrW1x1:4,4,4,4,2,1,4,4,0,3
128-28-28-3x3-192-28-28-8-1x1-1x1-1x1-0-NCHW-FP16-F=ConvOclDirectFwd:16,16,32,32,2,2,8,2,1;ConvOclDirectFwdFused:16,16,32,32,2,2,8,2,1
512-28-28-1x1-256-14-14-4-0x0-2x2-1x1-0-NCHW-FP16-F=ConvAsm1x1U:1,8,2,64,1,4,4,1;ConvOclDirectFwd1x1:1,256,1,1,0,1,8,8,0
448-8-8-1x1-1280-8-8-256-0x0-1x1-1x1-0-NCHW-FP32-B=ConvAsm1x1U:1,16,1,64,4,2,1,4;ConvOclDirectFwd1x1:1,256,1,1,0,4,16,4,0
528-14-14-1x1-256-14-14-4-0x0-1x1-1x1-0-NCHW-FP16-F=ConvAsm1x1U:1,8,2,64,1,4,4,1;ConvOclDirectFwd1x1:1,64,1,1,0,4,4,4,0
64-73-73-1x1-160-73-73-4-0x0-1x1-1x1-0-NCHW-FP16-B=ConvAsm1x1U:1,16,2,32,1,2,2,2;ConvOclDirectFwd1x1:1,256,1,1,0,1,4,4,0
64-35-35-1x1-384-35-35-64-0x0-1x1-1x1-0-NCHW-FP16-B=ConvAsm1x1U:1,16,2,16,1,2,1,2;ConvOclDirectFwd1x1:1,64,1,1,0,1,32,4,0
32-14-14-1x1-512-14-14-32-0x0-1x1-1x1-0-NCHW-FP32-W=ConvAsmBwdWrW1x1:2,8,2,8,2,1,4,4,0,1
576-4-4-1x1-128-4-4-32-0x0-1x1-1x1-0-NCHW-FP16-F=ConvAsm1x1U:2,4,4,4,1,4,4,1;ConvOclDirectFwd1x1:1,64,1,1,0,1,4,8,0
192-14-14-1x1-1536-14-14-16-0x0-1x1-1x1-0-NCHW-FP16-W=ConvAsmBwdWrW1x1:4,4,4,4,4,1,1,2,0,2
48-35-35-1x1-288-35-35-4-0x0-1x1-1x1-0-NCHW-FP32-W=ConvAsmBwdWrW1x1:4,4,4,4,2,1,1,4,0,1
128-28-28-3x3-128-58-58-256-0x0-2x2-1x1-0-NCHW-FP32-B=ConvOclDirectFwd:8,32,32,32,4,1,8,2,1
48-35-35-5x5-64-35-35-4-2x2-1x1-1x1-0-NCHW-FP32-F=ConvOclDirectFwd:16,16,16,32,1,2,8,1,2;ConvOclDirectFwdFused:16,16,16,32,1,2,8,1,2
128-28-28-1x1-512-28-28-2-0x0-1x1-1x1-0-NCHW-FP16-B=ConvAsm1x1U:1,8,2,32,1,2,2,2;ConvOclDirectFwd1x1:1,64,1,1,0,4,16,4,0
96-56-56-1x1-192-56-56-16-0x0-1x1-1x1-0-NCHW-FP32-F=ConvAsm1x1U:2,16,2,64,2,2,2,2;ConvActivAsm1x1U:3,16,3,64,2,1;ConvOclDirectFwd1x1:1,64,1,1,1,0,16,2048,0
384-17-17-3x3-288-35-35-1-0x0-2x2-1x1-0-NCHW-FP32-B=ConvOclDirectFwd:8,16,16,32,2,2,4,2,1
512-14-14-1x1-64-14-14-64-0x0-1x1-1x1-0-NCHW-FP16-F=ConvAsm1x1U:1,8,2,32,2,4,1,8;ConvOclDirectFwd1x1:1,128,1,1,0,4,8,4,0
32-14-14-1x1-512-14-14-256-0x0-1x1-1x1-0-NCHW-FP32-B=ConvAsm1x1U:1,16,1,64,3,2,2,2;ConvOclDirectFwd1x1:1,64,1,1,0,2,32,4,0
512-7-7-3x3-512-16-16-64-0x0-2x2-1x1-0-NCHW-FP32-B=ConvOclDirectFwd:16,16,16,16,1,1,4,1,2
256-14-14-1x1-528-14-14-64-0x0-1x1-1x1-0-NCHW-FP16-B=ConvAsm1x1U:1,16,2,16,2,2,2,2;ConvOclDirectFwd1x1:1,256,1,1,0,4,16,4,0
128-112-112-3x3-128-112-112-4-1x1-1x1-1x1-0-NCHW-FP16-F=ConvOclDirectFwd:8,16,16,16,2,1,8,4,2;ConvOclDirectFwdFused:8,16,16,16,2,1,8,4,2
512-28-28-1x1-128-28-28-16-0x0-1x1-1x1-0-NCHW-FP32-B=ConvAsm1x1U:1,16,1,32,1,2,1,1;ConvOclDirectFwd1x1:1,64,1,1,0,2,16,4,0
256-28-28-1x1-64-28-28-8-0x0-1x1-1x1-0-NCHW-FP32-F=ConvAsm1x1U:2,16,2,16,1,2,4,1;ConvActivAsm1x1U:4,16,4,32,1,4;ConvOclDirectFwd1x1:1,64,1,1,1,0,16,128,0
48-35-35-1x1-192-35-35-32-0x0-1x1-1x1-0-NCHW-FP16-W=ConvAsmBwdWrW1x1:4,4,8,4,2,1,4,2,0,1
192-27-27-5x5-64-27-27-16-2x2-1x1-1x1-0-NCHW-FP32-B=ConvOclDirectFwd:16,16,32,32,2,2,4,2,2
832-7-7-1x1-192-7-7-16-0x0-1x1-1x1-0-NCHW-FP16-F=ConvAsm1x1U:1,8,2,32,1,4,4,1;ConvOclDirectFwd1x1:1,64,1,1,0,1,4,8,0
1024-17-17-1x1-256-17-17-128-0x0-1x1-1x1-0-NCHW-FP16-F=ConvAsm1x1U:2,16,4,16,1,2,2,2;ConvOclDirectFwd1x1:1,256,1,1,0,1,16,4,0
1024-14-14-1x1-256-14-14-1-0x0-1x1-1x1-0-NCHW-FP16-F=ConvAsm1x1U:1,8,2,32,1,4,4,1;ConvOclDirectFwd1x1:1,128,1,1,0,4,4,8,0
32-12-120-3x3-64-12-120-16-1x1-1x1-1x1-0-NCHW-FP16-F=ConvOclDirectFwd:8,16,16,32,2,2,8,4,2
64-14-14-1x1-480-14-14-8-0x0-1x1-1x1-0-NCHW-FP32-B=ConvAsm1x1U:1,16,1,64,1,2,1,4;ConvOclDirectFwd1x1:1,64,1,1,0,4,8,4,0
832-7-7-1x1-160-7-7-8-0x0-1x1-1x1-0-NCHW-FP16-F=ConvAsm1x1U:1,8,2,32,1,4,4,1;ConvOclDirectFwd1x1:1,128,1,1,0,1,4,4,0
192-14-14-1x1-1200-14-14-16-0x0-1x1-1x1-0-NCHW-FP32-B=ConvOclDirectFwd1x1:1,128,1,1,0,4,16,4,0
832-7-7-1x1-32-7-7-128-0x0-1x1-1x1-0-NCHW-FP16-F=ConvAsm1x1U:1,8,2,32,1,4,4,2;ConvOclDirectFwd1x1:1,256,1,1,0,1,8,8,0
32-7-7-5x5-128-7-7-4-2x2-1x1-1x1-0-NCHW-FP32-F=ConvOclDirectFwd:8,8,8,8,1,1,1,2,2;ConvOclDirectFwdFused:8,8,8,8,1,1,1,4,2
2048-7-7-1x1-512-7-7-1-0x0-1x1-1x1-0-NCHW-FP32-B=ConvAsm1x1U:1,8,1,64,1,4,4,2;ConvOclDirectFwd1x1:1,64,1,1,0,1,4,8,0
256-14-14-3x3-128-14-14-256-1x1-1x1-1x1-0-NCHW-FP32-W=ConvAsmBwdWrW3x3:0,0,8,4,4,1
512-28-28-3x3-256-28-28-16-1x1-1x1-1x1-0-NCHW-FP16-W=ConvAsmBwdWrW3x3:0,0,8,4,2,1
64-56-56-3x3-64-56-56-32-1x1-1x1-1x1-0-NCHW-FP16-W=ConvAsmBwdWrW3x3:0,1,8,2,1,8
192-7-7-1x1-832-7-7-256-0x0-1x1-1x1-0-NCHW-FP32-B=ConvAsm1x1U:1,16,1,64,2,2,1,4;ConvOclDirectFwd1x1:1,256,1,1,0,1,32,4,0
1024-14-14-1x1-512-14-14-16-0x0-1x1-1x1-0-NCHW-FP32-F=ConvAsm1x1U:3,16,7,32,1,2,1,4;ConvActivAsm1x1U:4,16,7,32,1,1;ConvOclDirectFwd1x1:1,64,1,1,1,0,32,2048,0
32-28-28-1x1-192-28-28-4-0x0-1x1-1x1-0-NCHW-FP16-W=ConvAsmBwdWrW1x1:4,4,2,1,4,1,2,4,0,1
64-112-112-7x7-3-230-230-4-0x0-2x2-1x1-0-NCHW-FP16-B=ConvOclDirectFwd:8,8,32,32,4,4,1,4,2
192-14-14-1x1-480-14-14-8-0x0-1x1-1x1-0-NCHW-FP16-B=ConvAsm1x1U:1,16,2,16,1,2,2,8;ConvOclDirectFwd1x1:1,128,1,1,0,4,8,8,0
256-8-8-1x1-1536-8-8-1-0x0-1x1-1x1-0-NCHW-FP32-B=ConvAsm1x1U:1,8,1,64,1,4,4,4;ConvOclDirectFwd1x1:1,256,1,1,0,1,4,8,0
528-14-14-1x1-128-14-14-64-0x0-1x1-1x1-0-NCHW-FP32-F=ConvAsm1x1U:4,16,4,64,1,2,1,2;ConvActivAsm1x1U:4,32,7,32,1,2;ConvOclDirectFwd1x1:1,64,1,1,1,4,16,2048,0
192-17-17-1x1-768-17-17-128-0x0-1x1-1x1-0-NCHW-FP16-B=ConvAsm1x1U:1,16,2,16,1,2,1,2;ConvOclDirectFwd1x1:1,256,1,1,0,1,32,4,0
128-17-17-1x1-1024-17-17-32-0x0-1x1-1x1-0-NCHW-FP16-B=ConvAsm1x1U:1,16,2,32,1,2,1,2;ConvOclDirectFwd1x1:1,64,1,1,0,1,8,4,0
192-7-7-1x1-1440-7-7-16-0x0-1x1-1x1-0-NCHW-FP32-B=ConvAsm1x1U:1,16,1,64,2,2,2,2;ConvOclDirectFwd1x1:8,64,8,8,0,1,16,4,1
192-7-7-3x3-128-14-14-32-1x1-2x2-1x1-0-NCHW-FP16-B=ConvOclDirectFwd:8,8,16,16,2,2,2,2,2
48-7-7-1x1-832-7-7-512-0x0-1x1-1x1-0-NCHW-FP32-B=ConvAsm1x1U:1,16,1,64,2,2,1,4;ConvOclDirectFwd1x1:1,256,1,1,0,1,32,4,0
48-35-35-1x1-256-35-35-256-0x0-1x1-1x1-0-NCHW-FP32-F=ConvAsm1x1U:2,16,2,64,3,2,2,1;ConvOclDirectFwd1x1:1,64,1,1,1,4,32,256,0
1024-17-17-1x1-128-17-17-256-0x0-1x1-1x1-0-NCHW-FP16-F=ConvAsm1x1U:2,16,4,16,1,2,4,1;ConvOclDirectFwd1x1:1,256,1,1,0,1,16,4,0
768-17-17-1x1-128-17-17-32-0x0-1x1-1x1-0-NCHW-FP16-F=ConvAsm1x1U:2,16,4,16,1,2,4,1;ConvOclDirectFwd1x1:1,64,1,1,0,1,16,4,0
192-35-35-1x1-384-35-35-128-0x0-1x1-1x1-0-NCHW-FP32-B=ConvAsm1x1U:1,16,1,64,2,1,1,8;ConvOclDirectFwd1x1:1,128,1,1,0,1,32,4,0
512-7-7-1x1-1024-14-14-128-0x0-2x2-1x1-0-NCHW-FP16-B=ConvAsm1x1U:1,16,2,16,1,2,2,2;ConvOclDirectFwd1x1:1,64,1,1,0,1,32,4,0
192-7-7-1x1-832-7-7-512-0x0-1x1-1x1-0-NCHW-FP32-W=ConvAsmBwdWrW1x1:1,16,2,8,4,1,4,4,0,2
256-14-14-3x3-256-14-14-2-1x1-1x1-1x1-0-NCHW-FP16-F=ConvOclDirectFwd:16,16,16,16,1,1,2,4,2
256-28-28-1x1-64-56-56-8-0x0-2x2-1x1-0-NCHW-FP32-W=ConvAsmBwdWrW1x1:2,8,2,4,4,2,4,4,0,0
16-14-14-5x5-48-14-14-256-2x2-1x1-1x1-0-NCHW-FP32-F=ConvOclDirectFwd:8,8,16,16,2,2,4,1,2;ConvOclDirectFwdFused:8,8,16,16,2,2,4,2,2
528-14-14-1x1-160-14-14-16-0x0-1x1-1x1-0-NCHW-FP32-F=ConvAsm1x1U:4,16,5,16,1,2,4,1;ConvActivAsm1x1U:4,16,5,16,2,4;ConvOclDirectFwd1x1:1,64,1,1,1,4,16,256,0
112-14-14-3x3-224-14-14-256-1x1-1x1-1x1-0-NCHW-FP16-F=ConvOclDirectFwd:8,8,16,16,2,2,8,1,2;ConvOclDirectFwdFused:8,8,16,16,2,2,8,1,2
320-14-14-3x3-160-14-14-1-1x1-1x1-1x1-0-NCHW-FP32-W=ConvAsmBwdWrW3x3:0,0,8,4,2,1
608-14-14-1x1-96-14-14-32-0x0-1x1-1x1-0-NCHW-FP16-F=ConvAsm1x1U:2,8,4,64,1,4,4,2;ConvOclDirectFwd1x1:1,64,1,1,0,4,8,4,0
256-56-56-1x1-64-56-56-2-0x0-1x1-1x1-0-NCHW-FP32-B=ConvAsm1x1U:1,16,1,64,1,2,4,1;ConvOclDirectFwd1x1:1,256,1,1,0,4,8,8,0
192-8-8-1x1-1280-8-8-256-0x0-1x1-1x1-0-NCHW-FP32-W=ConvAsmBwdWrW1x1:1,16,4,8,4,1,2,4,0,1
128-17-17-1x1-1024-17-17-4-0x0-1x1-1x1-0-NCHW-FP16-W=ConvAsmBwdWrW1x1:2,8,4,8,2,1,2,2,0,1
768-17-17-1x1-128-17-17-256-0x0-1x1-1x1-0-NCHW-FP32-B=ConvAsm1x1U:1,32,1,64,2,1,2,2;ConvOclDirectFwd1x1:1,256,1,1,0,1,32,4,0
256-14-14-1x1-528-14-14-256-0x0-1x1-1x1-0-NCHW-FP32-B=ConvAsm1x1U:1,16,1,64,3,2,1,2;ConvOclDirectFwd1x1:1,256,1,1,0,2,16,4,0
512-28-28-1x1-128-28-28-16-0x0-1x1-1x1-0-NCHW-FP16-W=ConvAsmBwdWrW1x1:4,4,8,4,2,1,2,2,0,1
320-28-28-1x1-128-28-28-64-0x0-1x1-1x1-0-NCHW-FP16-F=ConvAsm1x1U:1,8,2,32,2,4,1,4;ConvOclDirectFwd1x1:1,64,1,1,0,4,16,4,0
192-7-7-1x1-832-7-7-1-0x0-1x1-1x1-0-NCHW-FP32-B=ConvAsm1x1U:1,8,1,64,1,4,4,1;ConvOclDirectFwd1x1:1,64,1,1,0,1,4,8,0
144-14-14-1x1-512-14-14-4-0x0-1x1-1x1-0-NCHW-FP16-B=ConvAsm1x1U:1,8,2,64,1,4,2,1;ConvOclDirectFwd1x1:1,64,1,1,0,4,4,4,0
256-17-17-1x1-1024-17-17-8-0x0-1x1-1x1-0-NCHW-FP32-W=ConvAsmBwdWrW1x1:1,16,2,8,4,1,1,4,0,1
64-28-28-1x1-320-28-28-64-0x0-1x1-1x1-0-NCHW-FP32-W=ConvAsmBwdWrW1x1:2,8,2,8,4,1,4,4,0,1
448-8-8-1x1-1280-8-8-32-0x0-1x1-1x1-0-NCHW-FP32-W=ConvAsmBwdWrW1x1:1,16,2,8,4,1,2,4,0,3
512-7-7-1x1-2048-7-7-4-0x0-1x1-1x1-0-NCHW-FP32-F=ConvAsm1x1U:1,8,1,64,4,4,2,2;ConvActivAsm1x1U:2,16,2,32,2,4;ConvOclDirectFwd1x1:1,64,1,1,1,0,16,256,0
128-112-112-3x3-64-112-112-4-1x1-1x1-1x1-0-NCHW-FP32-W=ConvAsmBwdWrW3x3:0,1,16,4,2,4
192-28-28-1x1-32-28-28-128-0x0-1x1-1x1-0-NCHW-FP16-B=ConvAsm1x1U:1,8,2,16,1,4,2,2;ConvOclDirectFwd1x1:1,64,1,1,0,4,16,4,0
64-73-73-1x1-80-73-73-8-0x0-1x1-1x1-0-NCHW-FP16-F=ConvAsm1x1U:1,8,2,64,1,4,2,2;ConvOclDirectFwd1x1:1,64,1,1,0,1,16,8,0
384-17-17-1x1-1024-17-17-64-0x0-1x1-1x1-0-NCHW-FP16-B=ConvAsm1x1U:1,16,2,32,1,2,2,2;ConvOclDirectFwd1x1:16,64,32,32,0,1,16,4,1
1024-17-17-1x1-128-17-17-32-0x0-1x1-1x1-0-NCHW-FP16-F=ConvAsm1x1U:1,8,2,32,2,4,4,2;ConvOclDirectFwd1x1:16,64,32,32,0,1,16,4,1
112-14-14-1x1-512-14-14-16-0x0-1x1-1x1-0-NCHW-FP16-B=ConvAsm1x1U:1,16,2,16,1,2,2,2;ConvOclDirectFwd1x1:1,256,1,1,0,4,8,4,0
96-64-128-1x1-480-64-128-1-0x0-1x1-1x1-0-NCHW-FP32-W=ConvAsmBwdWrW1x1:2,8,2,8,4,1,2,4,0,2
192-14-14-1x1-480-14-14-512-0x0-1x1-1x1-0-NCHW-FP16-B=ConvAsm1x1U:1,16,2,16,1,2,1,2;ConvOclDirectFwd1x1:1,64,1,1,0,2,16,4,0
128-14-14-1x1-512-14-14-1-0x0-1x1-1x1-0-NCHW-FP16-B=ConvAsm1x1U:1,8,2,64,1,4,4,1;ConvOclDirectFwd1x1:1,256,1,1,0,1,4,4,0
128-14-14-5x5-32-14-14-16-2x2-1x1-1x1-0-NCHW-FP16-B=ConvOclDirectFwd:8,16,16,16,2,1,2,4,2
192-8-8-1x1-1280-8-8-8-0x0-1x1-1x1-0-NCHW-FP16-B=ConvAsm1x1U:1,8,2,16,2,4,2,1;ConvOclDirectFwd1x1:1,64,1,1,0,2,8,4,0
64-14-14-1x1-480-14-14-32-0x0-1x1-1x1-0-NCHW-FP32-W=ConvAsmBwdWrW1x1:4,4,4,4,4,1,2,4,0,1
384-13-13-3x3-192-13-13-16-1x1-1x1-1x1-0-NCHW-FP16-W=ConvAsmBwdWrW3x3:0,0,8,4,3,1
320-7-7-3x3-160-7-7-256-1x1-1x1-1x1-0-NCHW-FP16-B=ConvOclDirectFwd:8,8,8,8,1,1,8,4,1
192-14-14-1x1-1824-14-14-16-0x0-1x1-1x1-0-NCHW-FP16-W=ConvAsmBwdWrW1x1:2,8,4,8,2,1,1,4,0,1
16-14-14-1x1-480-14-14-4-0x0-1x1-1x1-0-NCHW-FP32-B=ConvAsm1x1U:1,8,1,64,1,2,1,1;ConvOclDirectFwd1x1:1,64,1,1,0,4,8,8,0
832-7-7-1x1-32-7-7-512-0x0-1x1-1x1-0-NCHW-FP16-F=ConvAsm1x1U:2,8,4,16,1,4,4,1;ConvOclDirectFwd1x1:1,64,1,1,0,1,16,4,0
64-73-73-1x1-80-73-73-128-0x0-1x1-1x1-0-NCHW-FP32-F=ConvAsm1x1U:2,16,2,64,1,2,4,1;ConvActivAsm1x1U:3,16,3,64,1,2;ConvOclDirectFwd1x1:1,64,1,1,1,1,16,256,0
512-28-28-3x3-256-28-28-256-1x1-1x1-1x1-0-NCHW-FP16-B=ConvOclDirectFwd:32,8,32,32,1,4,8,2,1
64-224-224-3x3-3-224-224-8-1x1-1x1-1x1-0-NCHW-FP32-B=ConvAsm3x3U:1,2,5;ConvOclDirectFwd:16,16,32,32,2,2,8,2,1
256-56-56-1x1-128-28-28-2-0x0-2x2-1x1-0-NCHW-FP32-F=ConvAsm1x1U:1,8,1,64,2,4,2,4;ConvOclDirectFwd1x1:1,64,1,1,1,1,16,64,0
64-14-14-1x1-512-14-14-4-0x0-1x1-1x1-0-NCHW-FP16-W=ConvAsmBwdWrW1x1:2,8,2,2,2,2,2,4,0,0
192-7-7-1x1-1536-7-7-16-0x0-1x1-1x1-0-NCHW-FP32-B=ConvAsm1x1U:1,16,1,64,2,2,2,2;ConvOclDirectFwd1x1:1,256,1,1,0,1,8,4,0
64-73-73-1x1-160-73-73-4-0x0-1x1-1x1-0-NCHW-FP32-B=ConvAsm1x1U:2,16,2,64,1,2,2,2;ConvOclDirectFwd1x1:1,256,1,1,0,1,32,4,0
320-14-14-3x3-160-14-14-128-1x1-1x1-1x1-0-NCHW-FP32-W=ConvAsmBwdWrW3x3:0,1,8,4,9,2
192-35-35-1x1-384-35-35-8-0x0-1x1-1x1-0-NCHW-FP32-W=ConvAsmBwdWrW1x1:4,4,8,4,4,1,1,4,0,1
32-147-147-3x3-64-147-147-256-1x1-1x1-1x1-0-NCHW-FP16-F=ConvOclDirectFwd:16,16,32,32,2,2,8,2,1;ConvOclDirectFwdFused:16,16,32,32,2,2,8,4,1
96-14-14-1x1-480-14-14-32-0x0-1x1-1x1-0-NCHW-FP32-W=ConvAsmBwdWrW1x1:1,16,2,4,8,1,4,4,0,1
16-48-480-3x3-1-48-480-16-1x1-1x1-1x1-0-NCHW-FP16-W=ConvAsmBwdWrW3x3:0,1,16,1,1,4
128-7-7-1x1-832-7-7-8-0x0-1x1-1x1-0-NCHW-FP16-W=ConvAsmBwdWrW1x1:2,8,2,8,2,1,2,4,0,0
192-14-14-1x1-1152-14-14-16-0x0-1x1-1x1-0-NCHW-FP32-B=ConvAsm1x1U:1,16,1,32,4,2,2,2;ConvOclDirectFwd1x1:8,64,16,16,0,2,16,4,1
256-7-7-1x1-832-7-7-4-0x0-1x1-1x1-0-NCHW-FP32-B=ConvAsm1x1U:1,8,1,64,1,4,2,4;ConvOclDirectFwd1x1:1,128,1,1,0,1,4,8,0
128-27-27-3x3-128-27-27-1-1x1-1x1-1x1-0-NCHW-FP32-W=ConvAsmBwdWrW3x3:0,0,8,4,1,1
48-35-35-1x1-256-35-35-16-0x0-1x1-1x1-0-NCHW-FP32-B=ConvAsm1x1U:1,16,1,64,2,1,2,2;ConvOclDirectFwd1x1:1,256,1,1,0,1,32,4,0
192-17-17-3x3-192-8-8-32-0x0-2x2-1x1-0-NCHW-FP32-F=ConvOclDirectFwd:8,8,8,8,1,1,8,1,2
32-35-35-1x1-192-35-35-128-0x0-1x1-1x1-0-NCHW-FP32-W=ConvAsmBwdWrW1x1:4,4,2,4,4,1,4,4,0,1
512-28-28-1x1-256-56-56-256-0x0-2x2-1x1-0-NCHW-FP16-W=ConvAsmBwdWrW1x1:2,8,4,8,2,1,2,4,0,1
112-14-14-1x1-512-14-14-512-0x0-1x1-1x1-0-NCHW-FP32-W=ConvAsmBwdWrW1x1:2,8,4,4,4,1,2,4,0,2
256-14-14-1x1-1024-14-14-16-0x0-1x1-1x1-0-NCHW-FP32-F=ConvAsm1x1U:4,16,4,64,1,2,1,2;ConvActivAsm1x1U:3,32,7,32,1,1;ConvOclDirectFwd1x1:1,64,1,1,1,4,32,2048,0
128-14-14-5x5-32-14-14-1-2x2-1x1-1x1-0-NCHW-FP16-B=ConvOclDirectFwd:16,16,16,16,1,1,1,4,1
288-14-14-3x3-144-14-14-16-1x1-1x1-1x1-0-NCHW-FP16-W=ConvAsmBwdWrW3x3:0,1,8,2,3,4
32-14-14-1x1-528-14-14-32-0x0-1x1-1x1-0-NCHW-FP16-W=ConvAsmBwdWrW1x1:2,8,2,2,4,1,4,4,0,0
768-17-17-1x1-128-17-17-128-0x0-1x1-1x1-0-NCHW-FP16-F=ConvAsm1x1U:2,16,4,16,1,2,2,2;ConvOclDirectFwd1x1:16,64,32,32,0,1,16,4,1
512-7-7-1x1-1024-14-14-16-0x0-2x2-1x1-0-NCHW-FP16-W=ConvAsmBwdWrW1x1:1,16,2,8,2,1,1,2,0,1
24-14-14-1x1-512-14-14-1-0x0-1x1-1x1-0-NCHW-FP32-B=ConvAsm1x1U:1,8,1,64,1,4,1,4;ConvOclDirectFwd1x1:1,64,1,1,0,4,4,8,0
2048-7-7-1x1-512-7-7-1-0x0-1x1-1x1-0-NCHW-FP32-W=ConvAsmBwdWrW1x1:1,16,4,2,8,1,1,4,0,0
160-7-7-1x1-1056-7-7-32-0x0-1x1-1x1-0-NCHW-FP32-W=ConvAsmBwdWrW1x1:1,16,2,8,4,1,1,4,0,2
2048-8-8-1x1-192-8-8-64-0x0-1x1-1x1-0-NCHW-FP16-F=ConvAsm1x1U:1,8,2,32,2,4,2,2;ConvOclDirectFwd1x1:1,256,1,1,0,2,8,4,0
1488-7-7-1x1-192-7-7-16-0x0-1x1-1x1-0-NCHW-FP16-F=ConvAsm1x1U:1,8,2,32,1,4,4,1;ConvOclDirectFwd1x1:1,64,1,1,0,1,4,8,0
64-14-14-1x1-512-14-14-256-0x0-1x1-1x1-0-NCHW-FP16-W=ConvAsmBwdWrW1x1:2,8,4,8,2,2,4,4,0,1
528-14-14-1x1-32-14-14-512-0x0-1x1-1x1-0-NCHW-FP32-F=ConvAsm1x1U:4,16,4,64,2,2,1,1;ConvActivAsm1x1U:4,32,7,32,1,1;ConvOclDirectFwd1x1:1,64,1,1,1,1,64,2048,0
256-28-28-1x1-32-28-28-256-0x0-1x1-1x1-0-NCHW-FP16-W=ConvAsmBwdWrW1x1:4,4,4,1,8,1,4,4,0,1
64-14-14-5x5-32-14-14-128-2x2-1x1-1x1-0-NCHW-FP16-B=ConvOclDirectFwd:8,8,16,16,2,2,4,4,1
32-7-7-1x1-832-7-7-4-0x0-1x1-1x1-0-NCHW-FP32-W=ConvAsmBwdWrW1x1:1,16,2,1,8,1,2,4,0,1
512-7-7-3x3-512-7-7-32-1x1-1x1-1x1-0-NCHW-FP16-W=ConvAsmBwdWrW3x3:0,0,8,4,4,1
256-56-56-3x3-256-56-56-1-1x1-1x1-1x1-0-NCHW-FP16-B=ConvOclDirectFwd:16,16,16,32,1,2,8,4,1
384-13-13-3x3-192-13-13-256-1x1-1x1-1x1-0-NCHW-FP16-B=ConvOclDirectFwd:8,8,16,16,2,2,8,2,1
96-35-35-3x3-64-35-35-32-1x1-1x1-1x1-0-NCHW-FP16-B=ConvOclDirectFwd:16,8,16,16,1,2,8,1,1
256-17-17-1x1-1024-17-17-16-0x0-1x1-1x1-0-NCHW-FP32-B=ConvAsm1x1U:1,16,1,64,4,2,1,4;ConvOclDirectFwd1x1:1,64,1,1,0,1,16,4,0
256-13-13-3x3-256-13-13-512-1x1-1x1-1x1-0-NCHW-FP16-W=ConvAsmBwdWrW3x3:0,0,8,4,4,1
768-17-17-1x1-192-17-17-128-0x0-1x1-1x1-0-NCHW-FP32-F=ConvAsm1x1U:4,16,5,64,1,2,1,2;ConvActivAsm1x1U:2,16,5,64,1,1;ConvOclDirectFwd1x1:1,64,1,1,1,1,16,2048,0
64-112-112-7x7-3-225-225-64-2x2-2x2-1x1-0-NCHW-FP16-B=ConvOclDirectFwd:16,16,32,32,2,2,8,2,1
160-14-14-1x1-528-14-14-4-0x0-1x1-1x1-0-NCHW-FP32-W=ConvAsmBwdWrW1x1:1,16,2,8,2,1,1,4,0,1
256-13-13-3x3-384-13-13-256-1x1-1x1-1x1-0-NCHW-FP32-W=ConvAsmBwdWrW3x3:0,0,16,4,4,1
320-7-7-3x3-160-7-7-1-1x1-1x1-1x1-0-NCHW-FP16-B=ConvOclDirectFwd:8,8,8,8,1,1,1,4,1
64-56-56-1x1-64-56-56-8-0x0-1x1-1x1-0-NCHW-FP16-F=ConvAsm1x1U:1,8,2,16,1,4,1,2;ConvOclDirectFwd1x1:1,128,1,1,0,2,32,4,0
384-17-17-1x1-1024-17-17-16-0x0-1x1-1x1-0-NCHW-FP16-B=ConvAsm1x1U:1,16,2,32,1,2,2,2;ConvOclDirectFwd1x1:1,64,1,1,0,1,8,4,0
512-7-7-1x1-2048-7-7-8-0x0-1x1-1x1-0-NCHW-FP32-F=ConvAsm1x1U:4,8,4,16,2,4,2,2;ConvOclDirectFwd1x1:1,64,1,1,1,1,16,2048,0
512-14-14-1x1-1024-14-14-64-0x0-1x1-1x1-0-NCHW-FP32-W=ConvAsmBwdWrW1x1:1,16,4,8,4,1,1,4,0,0
160-64-128-1x1-528-64-128-1-0x0-1x1-1x1-0-NCHW-FP32-B=ConvOclDirectFwd1x1:1,128,1,1,0,2,16,4,0
384-7-7-1x1-832-7-7-64-0x0-1x1-1x1-0-NCHW-FP16-W=ConvAsmBwdWrW1x1:1,16,2,8,2,1,2,2,0,2
96-14-14-3x3-208-14-14-8-1x1-1x1-1x1-0-NCHW-FP16-F=ConvOclDirectFwd:16,8,16,16,1,2,4,2,2;ConvOclDirectFwdFused:16,8,16,16,1,2,4,2,2
160-14-14-3x3-320-14-14-32-1x1-1x1-1x1-0-NCHW-FP16-F=ConvOclDirectFwd:8,8,16,16,2,2,8,2,2;ConvOclDirectFwdFused:8,8,16,16,2,2,8,2,1
96-73-73-3x3-64-147-147-4-0x0-2x2-1x1-0-NCHW-FP16-B=ConvOclDirectFwd:8,16,32,32,4,2,4,2,2
1536-8-8-1x1-256-8-8-8-0x0-1x1-1x1-0-NCHW-FP16-F=ConvAsm1x1U:1,8,2,16,1,2,4,1;ConvOclDirectFwd1x1:1,64,1,1,0,1,4,4,0
1536-8-8-1x1-256-8-8-4-0x0-1x1-1x1-0-NCHW-FP16-F=ConvAsm1x1U:1,8,2,16,1,4,4,1;ConvOclDirectFwd1x1:1,64,1,1,0,1,4,4,0
160-7-7-1x1-1056-7-7-32-0x0-1x1-1x1-0-NCHW-FP32-B=ConvAsm1x1U:1,16,1,64,3,1,2,4;ConvOclDirectFwd1x1:1,128,1,1,0,1,16,4,0
96-14-14-1x1-480-14-14-4-0x0-1x1-1x1-0-NCHW-FP16-B=ConvAsm1x1U:1,8,2,64,1,2,4,1;ConvOclDirectFwd1x1:1,64,1,1,0,4,8,8,0
32-149-149-3x3-3-299-299-64-0x0-2x2-1x1-0-NCHW-FP32-B=ConvOclDirectFwd:16,16,32,32,2,2,8,2,1
192-28-28-1x1-624-28-28-16-0x0-1x1-1x1-0-NCHW-FP16-W=ConvAsmBwdWrW1x1:2,8,4,8,2,1,2,4,0,1
48-7-7-1x1-832-7-7-1-0x0-1x1-1x1-0-NCHW-FP32-W=ConvAsmBwdWrW1x1:1,16,2,2,2,1,2,4,0,1
256-14-14-3x3-256-14-14-16-1x1-1x1-1x1-0-NCHW-FP32-W=ConvAsmBwdWrW3x3:0,0,8,4,6,1
1280-8-8-1x1-320-8-8-128-0x0-1x1-1x1-0-NCHW-FP32-F=ConvAsm1x1U:2,16,2,32,3,2,4,1;ConvActivAsm1x1U:2,16,2,32,4,4;ConvOclDirectFwd1x1:1,64,1,1,1,1,16,2048,0
320-8-8-3x3-320-17-17-64-0x0-2x2-1x1-0-NCHW-FP16-B=ConvOclDirectFwd:16,8,32,32,2,4,4,2,1
224-14-14-3x3-112-14-14-1-1x1-1x1-1x1-0-NCHW-FP16-B=ConvOclDirectFwd:16,16,16,16,1,1,1,4,1
480-14-14-1x1-192-14-14-16-0x0-1x1-1x1-0-NCHW-FP32-F=ConvAsm1x1U:4,8,4,64,1,4,2,2;ConvActivAsm1x1U:3,16,3,16,1,2;ConvOclDirectFwd1x1:1,64,1,1,1,4,16,256,0
64-56-56-3x3-192-56-56-32-1x1-1x1-1x1-0-NCHW-FP16-F=ConvOclDirectFwd:32,8,32,32,1,4,8,1,2;ConvOclDirectFwdFused:32,8,32,32,1,4,8,1,2
288-14-14-3x3-144-14-14-4-1x1-1x1-1x1-0-NCHW-FP16-W=ConvAsmBwdWrW3x3:0,0,8,2,3,1
64-35-35-1x1-288-35-35-32-0x0-1x1-1x1-0-NCHW-FP32-B=ConvAsm1x1U:1,32,1,64,1,1,1,1;ConvOclDirectFwd1x1:1,256,1,1,0,1,32,4,0
64-56-56-1x1-64-56-56-256-0x0-1x1-1x1-0-NCHW-FP32-W=ConvAsmBwdWrW1x1:4,4,2,4,4,1,4,4,0,1
512-7-7-1x1-1024-14-14-4-0x0-2x2-1x1-0-NCHW-FP32-W=ConvAsmBwdWrW1x1:1,16,2,4,8,1,1,4,0,0
128-56-56-3x3-256-56-56-64-1x1-1x1-1x1-0-NCHW-FP16-F=ConvOclDirectFwd:16,8,16,32,1,4,8,1,1;ConvOclDirectFwdFused:32,8,32,32,1,4,8,1,1
528-14-14-1x1-256-14-14-64-0x0-1x1-1x1-0-NCHW-FP16-F=ConvAsm1x1U:2,8,4,64,1,4,1,8;ConvOclDirectFwd1x1:1,128,1,1,0,4,16,4,0
64-28-28-1x1-256-28-28-512-0x0-1x1-1x1-0-NCHW-FP16-W=ConvAsmBwdWrW1x1:4,4,8,4,2,1,4,4,0,1
128-40-175-3x3-128-40-175-16-1x1-1x1-1x1-0-NCHW-FP16-W=ConvAsmBwdWrW3x3:0,0,16,2,1,1
128-112-112-3x3-128-112-112-16-1x1-1x1-1x1-0-NCHW-FP32-W=ConvAsmBwdWrW3x3:0,0,16,4,2,1
224-7-7-3x3-192-7-7-32-1x1-1x1-1x1-0-NCHW-FP16-W=ConvAsmBwdWrW3x3:0,1,8,2,2,2
832-7-7-1x1-256-7-7-32-0x0-1x1-1x1-0-NCHW-FP16-F=ConvAsm1x1U:2,8,4,16,1,4,4,2;ConvOclDirectFwd1x1:1,64,1,1,0,1,8,8,0
384-7-7-3x3-192-7-7-128-1x1-1x1-1x1-0-NCHW-FP32-W=ConvAsmBwdWrW3x3:0,0,8,4,7,1
384-13-13-3x3-192-13-13-1-1x1-1x1-1x1-0-NCHW-FP32-W=ConvAsmBwdWrW3x3:0,0,8,4,2,1
96-35-35-1x1-384-35-35-16-0x0-1x1-1x1-0-NCHW-FP32-B=ConvAsm1x1U:1,16,1,64,2,2,1,4;ConvOclDirectFwd1x1:1,256,1,1,0,1,32,4,0
384-35-35-1x1-192-35-35-4-0x0-1x1-1x1-0-NCHW-FP16-F=ConvAsm1x1U:2,8,4,64,1,4,2,2;ConvOclDirectFwd1x1:16,64,32,32,0,1,16,4,1
1024-14-14-1x1-256-14-14-32-0x0-1x1-1x1-0-NCHW-FP16-B=ConvAsm1x1U:1,16,2,16,1,2,4,1;ConvOclDirectFwd1x1:1,64,1,1,0,2,8,4,0
32-28-28-1x1-256-28-28-32-0x0-1x1-1x1-0-NCHW-FP32-W=ConvAsmBwdWrW1x1:2,8,2,4,4,1,4,4,0,2
768-17-17-1x1-128-17-17-64-0x0-1x1-1x1-0-NCHW-FP16-F=ConvAsm1x1U:1,16,2,32,2,2,2,2;ConvOclDirectFwd1x1:16,64,32,32,0,1,16,4,1
128-17-17-1x1-1024-17-17-64-0x0-1x1-1x1-0-NCHW-FP16-B=ConvAsm1x1U:1,16,2,32,1,2,1,2;ConvOclDirectFwd1x1:1,256,1,1,0,1,8,4,0
192-8-8-1x1-2048-8-8-16-0x0-1x1-1x1-0-NCHW-FP16-W=ConvAsmBwdWrW1x1:2,8,4,2,4,2,1,4,0,0
192-14-14-1x1-384-14-14-16-0x0-1x1-1x1-0-NCHW-FP16-W=ConvAsmBwdWrW1x1:2,8,2,8,2,1,2,4,0,1
32-24-240-3x3-16-24-240-1-1x1-1x1-1x1-0-NCHW-FP32-W=ConvAsmBwdWrW3x3:0,0,16,1,1,1
128-56-56-1x1-256-56-56-16-0x0-1x1-1x1-0-NCHW-FP16-W=ConvAsmBwdWrW1x1:4,4,4,1,8,1,1,4,0,2
24-64-128-1x1-512-64-128-1-0x0-1x1-1x1-0-NCHW-FP16-B=ConvOclDirectFwd1x1:1,256,1,1,0,4,16,4,0
1632-14-14-1x1-192-14-14-16-0x0-1x1-1x1-0-NCHW-FP16-F=ConvAsm1x1U:2,8,4,64,1,4,4,2;ConvOclDirectFwd1x1:1,64,1,1,0,4,8,4,0
320-8-8-1x1-2048-8-8-1-0x0-1x1-1x1-0-NCHW-FP32-B=ConvAsm1x1U:1,8,1,64,1,4,4,4;ConvOclDirectFwd1x1:1,64,1,1,0,1,4,4,0
528-14-14-1x1-256-14-14-512-0x0-1x1-1x1-0-NCHW-FP32-F=ConvAsm1x1U:4,16,4,64,1,2,1,2;ConvActivAsm1x1U:4,32,7,32,1,1;ConvOclDirectFwd1x1:1,64,1,1,1,0,32,2048,0
224-14-14-3x3-112-14-14-512-1x1-1x1-1x1-0-NCHW-FP16-W=ConvAsmBwdWrW3x3:0,1,8,2,5,4
1152-14-14-1x1-192-14-14-16-0x0-1x1-1x1-0-NCHW-FP32-F=ConvAsm1x1U:3,16,3,16,2,2,4,1;ConvActivAsm1x1U:3,16,3,16,4,4;ConvOclDirectFwd1x1:1,64,1,1,1,0,16,256,0
288-35-35-1x1-64-35-35-1-0x0-1x1-1x1-0-NCHW-FP16-F=ConvAsm1x1U:1,8,2,64,1,4,4,1;ConvOclDirectFwd1x1:1,128,1,1,0,1,4,8,0
192-35-35-1x1-384-35-35-4-0x0-1x1-1x1-0-NCHW-FP32-W=ConvAsmBwdWrW1x1:1,16,2,8,2,1,1,4,0,2
128-28-28-1x1-320-28-28-64-0x0-1x1-1x1-0-NCHW-FP32-B=ConvAsm1x1U:1,16,1,16,1,2,1,1;ConvOclDirectFwd1x1:1,128,1,1,0,1,32,4,0
64-55-55-3x3-64-55-55-32-1x1-1x1-1x1-0-NCHW-FP16-F=ConvOclDirectFwd:32,8,32,32,1,4,8,1,2
256-28-28-1x1-32-28-28-256-0x0-1x1-1x1-0-NCHW-FP32-B=ConvAsm1x1U:3,32,3,64,1,1,1,1;ConvOclDirectFwd1x1:1,256,1,1,0,1,32,4,0
128-14-14-1x1-528-14-14-128-0x0-1x1-1x1-0-NCHW-FP16-W=ConvAsmBwdWrW1x1:2,8,2,8,2,1,4,4,0,1
48-7-7-1x1-832-7-7-1-0x0-1x1-1x1-0-NCHW-FP16-W=ConvAsmBwdWrW1x1:4,4,2,2,2,1,1,2,0,0
64-28-28-1x1-192-28-28-32-0x0-1x1-1x1-0-NCHW-FP32-B=ConvAsm1x1U:1,16,1,32,1,2,1,1;ConvOclDirectFwd1x1:1,128,1,1,0,4,16,4,0
192-35-35-1x1-64-35-35-1-0x0-1x1-1x1-0-NCHW-FP16-F=ConvAsm1x1U:1,8,2,64,1,4,4,2;ConvOclDirectFwd1x1:1,64,1,1,0,1,4,4,0
384-8-8-3x3-448-8-8-256-1x1-1x1-1x1-0-NCHW-FP32-W=ConvAsmBwdWrW3x3:0,1,8,4,3,1
384-35-35-1x1-64-35-35-8-0x0-1x1-1x1-0-NCHW-FP32-F=ConvAsm1x1U:4,16,5,32,1,2,4,1;ConvActivAsm1x1U:2,16,5,32,1,4;ConvOclDirectFwd1x1:1,64,1,1,1,1,16,2048,0
384-8-8-1x1-1280-8-8-1-0x0-1x1-1x1-0-NCHW-FP32-W=ConvAsmBwdWrW1x1:1,16,4,4,4,1,1,4,0,0
48-35-35-1x1-192-35-35-32-0x0-1x1-1x1-0-NCHW-FP16-B=ConvAsm1x1U:1,16,2,16,1,2,1,4;ConvOclDirectFwd1x1:1,128,1,1,0,1,32,4,0
512-28-28-1x1-256-28-28-16-0x0-1x1-1x1-0-NCHW-FP16-F=ConvAsm1x1U:1,8,2,32,2,4,2,2;ConvOclDirectFwd1x1:1,64,1,1,0,4,16,4,0
512-7-7-1x1-1024-14-14-1-0x0-2x2-1x1-0-NCHW-FP16-W=ConvAsmBwdWrW1x1:1,16,2,4,2,1,1,4,0,1
192-7-7-1x1-1584-7-7-16-0x0-1x1-1x1-0-NCHW-FP16-B=ConvAsm1x1U:1,8,2,32,1,2,2,2;ConvOclDirectFwd1x1:1,128,1,1,0,1,8,4,0
832-7-7-1x1-128-7-7-512-0x0-1x1-1x1-0-NCHW-FP32-F=ConvAsm1x1U:4,16,4,16,1,2,2,2;ConvActivAsm1x1U:2,16,2,32,2,1;ConvOclDirectFwd1x1:1,64,1,1,1,0,32,2048,0
512-7-7-3x3-512-7-7-8-1x1-1x1-1x1-0-NCHW-FP16-F=ConvOclDirectFwd:8,8,8,8,1,1,4,4,2;ConvOclDirectFwdFused:8,8,8,8,1,1,4,4,2
384-28-28-1x1-768-28-28-16-0x0-1x1-1x1-0-NCHW-FP16-B=ConvAsm1x1U:1,16,2,16,1,2,2,2;ConvOclDirectFwd1x1:1,64,1,1,0,4,16,4,0
1024-14-14-1x1-256-14-14-64-0x0-1x1-1x1-0-NCHW-FP32-W=ConvAsmBwdWrW1x1:1,16,4,8,4,1,2,4,0,2
192-8-8-1x1-1280-8-8-32-0x0-1x1-1x1-0-NCHW-FP16-W=ConvAsmBwdWrW1x1:2,8,8,4,2,1,1,4,0,0
16-14-14-5x5-48-14-14-4-2x2-1x1-1x1-0-NCHW-FP32-F=ConvOclDirectFwd:16,16,16,16,1,1,2,4,2;ConvOclDirectFwdFused:8,16,16,16,2,1,1,4,2
512-14-14-1x1-128-14-14-8-0x0-1x1-1x1-0-NCHW-FP16-F=ConvAsm1x1U:1,8,2,64,1,4,4,4;ConvOclDirectFwd1x1:1,128,1,1,0,2,4,4,0
256-56-56-1x1-64-56-56-4-0x0-1x1-1x1-0-NCHW-FP16-W=ConvAsmBwdWrW1x1:4,4,4,1,4,2,1,4,0,1
256-20-84-3x3-256-20-84-1-1x1-1x1-1x1-0-NCHW-FP16-B=ConvOclDirectFwd:16,16,16,32,1,2,8,2,1
832-64-128-1x1-48-64-128-1-0x0-1x1-1x1-0-NCHW-FP16-F=ConvOclDirectFwd1x1:1,64,1,1,0,2,4,4,0
1776-7-7-1x1-192-7-7-16-0x0-1x1-1x1-0-NCHW-FP16-F=ConvAsm1x1U:1,8,2,32,1,4,4,1;ConvOclDirectFwd1x1:1,64,1,1,0,1,4,8,0
16-14-14-1x1-480-14-14-16-0x0-1x1-1x1-0-NCHW-FP16-W=ConvAsmBwdWrW1x1:4,4,2,4,2,1,4,4,0,0
64-14-14-5x5-32-14-14-256-2x2-1x1-1x1-0-NCHW-FP16-B=ConvOclDirectFwd:8,8,16,16,2,2,8,2,2
832-7-7-1x1-160-7-7-16-0x0-1x1-1x1-0-NCHW-FP32-F=ConvAsm1x1U:1,8,1,64,3,4,4,2;ConvActivAsm1x1U:1,16,1,32,3,4;ConvOclDirectFwd1x1:1,64,1,1,1,4,16,128,0
192-17-17-1x1-768-17-17-256-0x0-1x1-1x1-0-NCHW-FP16-W=ConvAsmBwdWrW1x1:2,8,4,4,4,2,4,4,0,1
224-7-7-3x3-192-7-7-32-1x1-1x1-1x1-0-NCHW-FP16-B=ConvOclDirectFwd:8,8,8,8,1,1,4,1,2
48-35-35-1x1-288-35-35-16-0x0-1x1-1x1-0-NCHW-FP16-W=ConvAsmBwdWrW1x1:4,4,4,4,2,1,4,4,0,0
384-8-8-1x1-1280-8-8-1-0x0-1x1-1x1-0-NCHW-FP16-B=ConvAsm1x1U:1,8,2,32,1,4,4,1;ConvOclDirectFwd1x1:1,64,1,1,0,1,4,8,0
160-64-128-1x1-512-64-128-1-0x0-1x1-1x1-0-NCHW-FP32-B=ConvOclDirectFwd1x1:1,64,1,1,0,2,16,4,0
128-17-17-1x1-768-17-17-8-0x0-1x1-1x1-0-NCHW-FP16-W=ConvAsmBwdWrW1x1:1,16,2,4,4,1,4,4,0,1
2048-8-8-1x1-192-8-8-4-0x0-1x1-1x1-0-NCHW-FP16-F=ConvAsm1x1U:1,8,2,16,1,4,4,1;ConvOclDirectFwd1x1:1,128,1,1,0,1,4,4,0
192-35-35-1x1-384-35-35-64-0x0-1x1-1x1-0-NCHW-FP32-W=ConvAsmBwdWrW1x1:1,16,2,8,4,1,2,4,0,2
64-28-28-3x3-64-28-28-32-1x1-1x1-1x1-0-NCHW-FP32-W=ConvAsmBwdWrW3x3:0,0,8,2,7,2
1200-14-14-1x1-192-14-14-16-0x0-1x1-1x1-0-NCHW-FP16-F=ConvAsm1x1U:2,8,4,64,1,4,4,2;ConvOclDirectFwd1x1:1,64,1,1,0,4,8,4,0
512-7-7-1x1-2048-7-7-64-0x0-1x1-1x1-0-NCHW-FP16-W=ConvAsmBwdWrW1x1:1,16,4,8,2,1,1,2,0,2
256-14-14-1x1-528-14-14-16-0x0-1x1-1x1-0-NCHW-FP32-W=ConvAsmBwdWrW1x1:1,16,2,8,4,1,1,4,0,1
96-28-28-1x1-192-28-28-32-0x0-1x1-1x1-0-NCHW-FP16-B=ConvAsm1x1U:1,16,2,16,1,2,2,2;ConvOclDirectFwd1x1:1,64,1,1,0,4,16,4,0
608-14-14-1x1-96-14-14-64-0x0-1x1-1x1-0-NCHW-FP16-F=ConvAsm1x1U:2,8,4,64,1,4,2,4
384-35-35-1x1-96-35-35-64-0x0-1x1-1x1-0-NCHW-FP16-F=ConvAsm1x1U:2,8,4,32,1,4,1,4;ConvOclDirectFwd1x1:1,256,1,1,0,1,16,4,0
96-73-73-3x3-64-147-147-64-0x0-2x2-1x1-0-NCHW-FP32-B=ConvOclDirectFwd:32,32,32,32,1,1,8,2,2
256-56-56-3x3-128-56-56-128-1x1-1x1-1x1-0-NCHW-FP32-W=ConvAsmBwdWrW3x3:0,0,16,4,4,1
128-17-17-1x1-768-17-17-8-0x0-1x1-1x1-0-NCHW-FP16-B=ConvAsm1x1U:1,16,2,16,1,2,1,4;ConvOclDirectFwd1x1:1,128,1,1,0,1,16,4,0
64-35-35-1x1-288-35-35-256-0x0-1x1-1x1-0-NCHW-FP32-F=ConvAsm1x1U:2,16,2,64,2,2,2,2;ConvOclDirectFwd1x1:1,64,1,1,1,0,32,2048,0
96-35-35-3x3-96-35-35-1-1x1-1x1-1x1-0-NCHW-FP16-F=ConvOclDirectFwd:16,16,16,16,1,1,4,4,1;ConvOclDirectFwdFused:16,16,16,16,1,1,4,4,1
64-73-73-1x1-160-73-73-8-0x0-1x1-1x1-0-NCHW-FP32-B=ConvAsm1x1U:1,16,1,64,1,2,1,2;ConvOclDirectFwd1x1:1,256,1,1,0,1,32,4,0
192-14-14-1x1-1008-14-14-16-0x0-1x1-1x1-0-NCHW-FP16-W=ConvAsmBwdWrW1x1:1,16,2,8,2,1,2,4,0,1
192-7-7-1x1-1056-7-7-16-0x0-1x1-1x1-0-NCHW-FP16-W=ConvAsmBwdWrW1x1:1,16,2,8,2,1,2,4,0,0
1024-14-14-1x1-256-14-14-1-0x0-1x1-1x1-0-NCHW-FP16-W=ConvAsmBwdWrW1x1:1,16,2,4,2,1,1,4,0,1
96-28-28-1x1-192-28-28-16-0x0-1x1-1x1-0-NCHW-FP16-B=ConvAsm1x1U:1,16,2,16,1,2,2,2;ConvOclDirectFwd1x1:1,64,1,1,0,4,16,4,0
96-35-35-1x1-384-35-35-256-0x0-1x1-1x1-0-NCHW-FP16-W=ConvAsmBwdWrW1x1:4,4,4,4,4,1,4,4,0,1
256-14-14-1x1-528-14-14-128-0x0-1x1-1x1-0-NCHW-FP32-B=ConvAsm1x1U:1,16,1,64,2,2,1,1;ConvOclDirectFwd1x1:1,256,1,1,0,4,16,4,0
256-14-14-1x1-1024-14-14-128-0x0-1x1-1x1-0-NCHW-FP16-B=ConvAsm1x1U:1,16,2,16,1,2,1,4;ConvOclDirectFwd1x1:1,256,1,1,0,2,32,4,0
192-17-17-1x1-1024-17-17-1-0x0-1x1-1x1-0-NCHW-FP16-B=ConvAsm1x1U:1,8,2,64,1,2,4,1;ConvOclDirectFwd1x1:1,128,1,1,0,1,4,4,0
256-56-56-1x1-128-28-28-256-0x0-2x2-1x1-0-NCHW-FP32-F=ConvAsm1x1U:3,16,3,32,2,2,1,4;ConvOclDirectFwd1x1:1,64,1,1,1,0,16,256,0
256-28-28-1x1-32-28-28-256-0x0-1x1-1x1-0-NCHW-FP32-W=ConvAsmBwdWrW1x1:4,4,4,4,4,1,4,4,0,1
512-28-28-1x1-128-28-28-8-0x0-1x1-1x1-0-NCHW-FP32-W=ConvAsmBwdWrW1x1:1,16,2,8,2,1,4,4,0,1
128-28-28-1x1-256-28-28-256-0x0-1x1-1x1-0-NCHW-FP32-F=ConvAsm1x1U:1,16,1,32,3,2,1,8;ConvOclDirectFwd1x1:1,64,1,1,1,4,32,2048,0
80-73-73-1x1-64-73-73-64-0x0-1x1-1x1-0-NCHW-FP32-B=ConvAsm1x1U:1,32,1,64,1,1,2,2;ConvOclDirectFwd1x1:1,256,1,1,0,1,32,4,0
96-35-35-1x1-384-35-35-8-0x0-1x1-1x1-0-NCHW-FP32-B=ConvAsm1x1U:1,16,1,64,2,1,1,4;ConvOclDirectFwd1x1:1,256,1,1,0,1,8,4,0
768-17-17-1x1-160-17-17-1-0x0-1x1-1x1-0-NCHW-FP32-F=ConvAsm1x1U:1,8,1,64,1,4,4,1;ConvActivAsm1x1U:1,16,1,64,1,4;ConvOclDirectFwd1x1:1,64,1,1,1,4,16,64,0
224-14-14-3x3-112-14-14-16-1x1-1x1-1x1-0-NCHW-FP32-W=ConvAsmBwdWrW3x3:0,0,8,4,5,2
32-7-7-1x1-832-7-7-8-0x0-1x1-1x1-0-NCHW-FP32-W=ConvAsmBwdWrW1x1:4,4,2,4,2,1,1,4,0,0
448-8-8-1x1-1280-8-8-256-0x0-1x1-1x1-0-NCHW-FP32-W=ConvAsmBwdWrW1x1:2,8,4,4,8,2,2,4,0,1
32-28-28-5x5-96-28-28-128-2x2-1x1-1x1-0-NCHW-FP16-F=ConvOclDirectFwd:16,16,32,32,2,2,8,1,2;ConvOclDirectFwdFused:16,16,32,32,2,2,8,1,2
256-14-14-1x1-256-14-14-8-0x0-1x1-1x1-0-NCHW-FP32-W=ConvAsmBwdWrW1x1:2,8,4,4,2,1,1,4,0,1
64-14-14-1x1-512-14-14-4-0x0-1x1-1x1-0-NCHW-FP32-W=ConvAsmBwdWrW1x1:2,8,2,2,4,1,2,4,0,1
1024-14-14-1x1-2048-7-7-128-0x0-2x2-1x1-0-NCHW-FP16-F=ConvAsm1x1U:2,8,4,16,1,4,2,4;ConvOclDirectFwd1x1:8,64,16,16,0,1,16,4,1
96-35-35-1x1-384-35-35-64-0x0-1x1-1x1-0-NCHW-FP16-B=ConvAsm1x1U:1,16,2,16,1,2,1,2;ConvOclDirectFwd1x1:1,64,1,1,0,1,32,4,0
96-17-17-3x3-96-35-35-16-0x0-2x2-1x1-0-NCHW-FP32-B=ConvOclDirectFwd:8,8,16,16,2,2,4,1,1
384-28-28-1x1-768-28-28-16-0x0-1x1-1x1-0-NCHW-FP16-W=ConvAsmBwdWrW1x1:1,16,2,8,2,1,4,4,0,1
512-14-14-3x3-512-14-14-16-1x1-1x1-1x1-0-NCHW-FP16-W=ConvAsmBwdWrW3x3:0,1,8,4,3,1
128-14-14-3x3-256-14-14-4-1x1-1x1-1x1-0-NCHW-FP16-F=ConvOclDirectFwd:16,16,16,16,1,1,4,4,2;ConvOclDirectFwdFused:16,16,16,16,1,1,4,4,2
384-13-13-3x3-384-13-13-256-1x1-1x1-1x1-0-NCHW-FP16-F=ConvOclDirectFwd:8,8,16,16,2,2,8,4,1;ConvOclDirectFwdFused:8,8,16,16,2,2,8,1,1
128-28-28-3x3-96-28-28-16-1x1-1x1-1x1-0-NCHW-FP16-W=ConvAsmBwdWrW3x3:0,0,8,2,2,4
384-17-17-3x3-384-35-35-8-0x0-2x2-1x1-0-NCHW-FP32-B=ConvOclDirectFwd:8,8,16,16,2,2,4,1,1
128-17-17-1x1-1024-17-17-16-0x0-1x1-1x1-0-NCHW-FP32-W=ConvAsmBwdWrW1x1:2,8,4,2,8,1,1,4,0,1
64-56-56-1x1-256-56-56-2-0x0-1x1-1x1-0-NCHW-FP16-W=ConvAsmBwdWrW1x1:4,4,4,1,4,2,1,4,0,1
96-35-35-3x3-64-35-35-4-1x1-1x1-1x1-0-NCHW-FP32-W=ConvAsmBwdWrW3x3:0,0,8,2,4,2
160-7-7-3x3-320-7-7-4-1x1-1x1-1x1-0-NCHW-FP16-F=ConvOclDirectFwd:8,8,8,8,1,1,2,2,2;ConvOclDirectFwdFused:8,8,8,8,1,1,2,2,2
512-14-14-1x1-128-28-28-1-0x0-2x2-1x1-0-NCHW-FP16-B=ConvAsm1x1U:1,8,2,16,1,4,4,1;ConvOclDirectFwd1x1:1,256,1,1,0,1,4,8,0
512-64-128-1x1-112-64-128-1-0x0-1x1-1x1-0-NCHW-FP32-F=ConvOclDirectFwdFused:1,64,1,1,1,1,64,2048,0;ConvOclDirectFwd1x1:1,64,1,1,1,1,64,2048,0
320-8-8-1x1-1280-8-8-8-0x0-1x1-1x1-0-NCHW-FP16-W=ConvAsmBwdWrW1x1:1,16,2,8,2,1,2,4,0,0
192-28-28-1x1-288-28-28-16-0x0-1x1-1x1-0-NCHW-FP16-B=ConvAsm1x1U:1,16,2,16,1,2,2,2;ConvOclDirectFwd1x1:1,64,1,1,0,4,16,4,0
512-4-4-3x3-512-7-7-64-1x1-2x2-1x1-0-NCHW-FP32-B=ConvOclDirectFwd:8,8,8,8,1,1,4,1,2
1024-14-14-1x1-512-28-28-32-0x0-2x2-1x1-0-NCHW-FP16-B=ConvAsm1x1U:1,16,2,16,1,2,2,2;ConvOclDirectFwd1x1:1,256,1,1,0,2,32,8,0
32-14-14-5x5-128-14-14-128-2x2-1x1-1x1-0-NCHW-FP16-F=ConvOclDirectFwd:8,8,16,16,2,2,8,1,2;ConvOclDirectFwdFused:8,8,16,16,2,2,8,1,2
1536-8-8-1x1-256-8-8-1-0x0-1x1-1x1-0-NCHW-FP32-F=ConvAsm1x1U:1,8,1,32,1,4,4,1;ConvActivAsm1x1U:1,16,1,16,1,3;ConvOclDirectFwd1x1:1,64,1,1,1,4,16,64,0
64-224-224-3x3-64-224-224-4-1x1-1x1-1x1-0-NCHW-FP16-F=ConvOclDirectFwd:16,16,32,32,2,2,8,2,2;ConvOclDirectFwdFused:16,16,32,32,2,2,8,2,2
256-14-14-1x1-528-14-14-512-0x0-1x1-1x1-0-NCHW-FP16-B=ConvAsm1x1U:1,16,2,16,1,2,1,2;ConvOclDirectFwd1x1:8,64,16,16,0,2,16,4,1
512-14-14-3x3-512-14-14-64-1x1-1x1-1x1-0-NCHW-FP16-B=ConvOclDirectFwd:8,8,16,16,2,2,8,2,2
192-8-8-1x1-2048-8-8-8-0x0-1x1-1x1-0-NCHW-FP16-W=ConvAsmBwdWrW1x1:1,16,4,4,2,1,1,4,0,0
192-17-17-1x1-1024-17-17-32-0x0-1x1-1x1-0-NCHW-FP32-W=ConvAsmBwdWrW1x1:1,16,2,8,4,1,1,4,0,2
512-14-14-3x3-512-14-14-32-1x1-1x1-1x1-0-NCHW-FP16-W=ConvAsmBwdWrW3x3:0,0,8,4,4,1
192-14-14-1x1-768-14-14-16-0x0-1x1-1x1-0-NCHW-FP32-B=ConvAsm1x1U:1,16,1,32,2,2,2,2;ConvOclDirectFwd1x1:1,64,1,1,0,4,16,4,0
512-14-14-1x1-112-14-14-8-0x0-1x1-1x1-0-NCHW-FP32-F=ConvAsm1x1U:4,8,4,64,1,4,4,1;ConvActivAsm1x1U:1,16,1,32,4,4;ConvOclDirectFwd1x1:1,64,1,1,1,4,64,128,0
192-14-14-1x1-528-14-14-16-0x0-1x1-1x1-0-NCHW-FP16-B=ConvAsm1x1U:1,16,2,16,1,2,4,1;ConvOclDirectFwd1x1:1,64,1,1,0,4,8,4,0
3-224-224-3x3-64-224-224-32-1x1-1x1-1x1-0-NCHW-FP32-F=ConvOclDirectFwd:8,32,32,32,4,1,4,1,2;ConvOclDirectFwdFused:8,32,32,32,4,1,4,1,2
128-28-28-3x3-192-28-28-512-1x1-1x1-1x1-0-NCHW-FP16-F=ConvOclDirectFwd:16,16,32,32,2,2,8,2,1;ConvOclDirectFwdFused:16,16,32,32,2,2,8,1,1
384-17-17-3x3-288-35-35-256-0x0-2x2-1x1-0-NCHW-FP32-B=ConvOclDirectFwd:16,16,16,16,1,1,4,1,1
128-28-28-1x1-256-28-28-128-0x0-1x1-1x1-0-NCHW-FP16-B=ConvAsm1x1U:1,16,2,16,1,2,1,4;ConvOclDirectFwd1x1:1,64,1,1,0,4,16,4,0
128-112-112-3x3-64-112-112-2-1x1-1x1-1x1-0-NCHW-FP16-B=ConvOclDirectFwd:8,32,16,32,2,1,8,1,2
512-14-14-1x1-64-14-14-32-0x0-1x1-1x1-0-NCHW-FP16-F=ConvAsm1x1U:1,8,2,64,2,4,4,2;ConvOclDirectFwd1x1:1,64,1,1,0,4,8,4,0
320-8-8-1x1-2048-8-8-64-0x0-1x1-1x1-0-NCHW-FP32-W=ConvAsmBwdWrW1x1:2,8,4,4,8,1,2,4,0,1
64-14-14-1x1-512-14-14-1-0x0-1x1-1x1-0-NCHW-FP16-B=ConvAsm1x1U:1,8,2,64,1,2,4,1;ConvOclDirectFwd1x1:1,256,1,1,0,1,4,4,0
64-112-112-7x7-3-224-224-64-3x3-2x2-1x1-0-NCHW-FP32-B=ConvOclDirectFwd:16,16,32,32,2,2,8,2,1
224-35-35-3x3-192-35-35-8-1x1-1x1-1x1-0-NCHW-FP16-B=ConvOclDirectFwd:16,8,16,16,1,2,8,1,2
48-35-35-1x1-288-35-35-256-0x0-1x1-1x1-0-NCHW-FP32-F=ConvAsm1x1U:2,16,2,64,3,2,1,2;ConvOclDirectFwd1x1:1,64,1,1,1,0,16,128,0
64-56-56-3x3-64-56-56-2-1x1-1x1-1x1-0-NCHW-FP16-W=ConvAsmBwdWrW3x3:0,0,16,1,2,1
64-224-224-3x3-3-224-224-8-1x1-1x1-1x1-0-NCHW-FP16-W=ConvAsmBwdWrW3x3:0,1,16,1,2,4
480-64-128-1x1-96-64-128-1-0x0-1x1-1x1-0-NCHW-FP32-F=ConvAsm1x1U:4,8,8,64,1,4,1,4;ConvActivAsm1x1U:4,16,4,64,1,3;ConvOclDirectFwd1x1:1,64,1,1,1,4,16,2048,0
192-7-7-1x1-832-7-7-32-0x0-1x1-1x1-0-NCHW-FP32-B=ConvAsm1x1U:1,16,1,64,2,2,4,1;ConvOclDirectFwd1x1:1,64,1,1,0,1,16,8,0
448-8-8-1x1-2048-8-8-256-0x0-1x1-1x1-0-NCHW-FP16-W=ConvAsmBwdWrW1x1:2,8,4,8,2,1,1,4,0,1
192-7-7-1x1-832-7-7-16-0x0-1x1-1x1-0-NCHW-FP32-B=ConvAsm1x1U:1,16,1,64,1,2,2,1;ConvOclDirectFwd1x1:1,256,1,1,0,1,8,4,0
192-28-28-1x1-384-28-28-16-0x0-1x1-1x1-0-NCHW-FP16-B=ConvAsm1x1U:1,16,2,16,1,2,2,2;ConvOclDirectFwd1x1:1,64,1,1,0,4,16,4,0
64-147-147-3x3-96-73-73-64-0x0-2x2-1x1-0-NCHW-FP32-F=ConvOclDirectFwd:16,16,16,16,1,1,8,2,1
48-35-35-1x1-256-35-35-16-0x0-1x1-1x1-0-NCHW-FP16-B=ConvAsm1x1U:1,16,2,64,1,2,1,2;ConvOclDirectFwd1x1:1,256,1,1,0,1,4,4,0
256-14-14-3x3-256-28-28-128-1x1-2x2-1x1-0-NCHW-FP32-B=ConvOclDirectFwd:32,32,32,32,1,1,4,4,2
48-35-35-1x1-192-35-35-4-0x0-1x1-1x1-0-NCHW-FP32-B=ConvAsm1x1U:1,16,1,64,1,1,2,4;ConvOclDirectFwd1x1:1,64,1,1,0,1,8,4,0
192-8-8-3x3-192-17-17-16-0x0-2x2-1x1-0-NCHW-FP16-B=ConvOclDirectFwd:8,8,32,32,4,4,4,2,1
64-224-224-3x3-64-224-224-64-1x1-1x1-1x1-0-NCHW-FP16-W=ConvAsmBwdWrW3x3:0,0,16,4,1,8
256-35-35-1x1-64-35-35-8-0x0-1x1-1x1-0-NCHW-FP16-F=ConvAsm1x1U:1,8,2,64,1,4,2,2;ConvOclDirectFwd1x1:1,256,1,1,0,1,8,4,0
32-28-28-5x5-96-28-28-64-2x2-1x1-1x1-0-NCHW-FP32-F=ConvOclDirectFwd:16,16,32,32,2,2,8,1,2;ConvOclDirectFwdFused:16,16,32,32,2,2,8,1,2
48-14-14-3x3-192-14-14-16-1x1-1x1-1x1-0-NCHW-FP16-W=ConvAsmBwdWrW3x3:0,0,8,2,2,4
128-17-17-1x1-1024-17-17-4-0x0-1x1-1x1-0-NCHW-FP32-W=ConvAsmBwdWrW1x1:1,16,2,4,4,1,1,4,0,1
768-17-17-1x1-160-17-17-16-0x0-1x1-1x1-0-NCHW-FP16-F=ConvAsm1x1U:3,8,6,32,1,4,4,1;ConvOclDirectFwd1x1:1,128,1,1,0,1,16,4,0
256-56-56-3x3-128-56-56-32-1x1-1x1-1x1-0-NCHW-FP16-B=ConvOclDirectFwd:32,8,32,32,1,4,8,1,1
64-35-35-1x1-192-35-35-256-0x0-1x1-1x1-0-NCHW-FP32-B=ConvAsm1x1U:1,32,1,64,1,1,1,1;ConvOclDirectFwd1x1:1,256,1,1,0,1,32,4,0
64-56-56-1x1-64-56-56-64-0x0-1x1-1x1-0-NCHW-FP16-B=ConvAsm1x1U:1,16,2,16,1,2,1,4;ConvOclDirectFwd1x1:1,128,1,1,0,4,16,8,0
64-27-27-5x5-192-27-27-4-2x2-1x1-1x1-0-NCHW-FP16-F=ConvOclDirectFwd:16,16,32,32,2,2,4,4,2;ConvOclDirectFwdFused:16,16,32,32,2,2,4,4,2
192-128-256-1x1-32-128-256-1-0x0-1x1-1x1-0-NCHW-FP16-F=ConvOclDirectFwd1x1:1,128,1,1,0,4,16,8,0
64-56-56-3x3-64-56-56-256-1x1-1x1-1x1-0-NCHW-FP16-B=ConvOclDirectFwd:16,16,32,32,2,2,8,1,1
768-17-17-1x1-160-17-17-256-0x0-1x1-1x1-0-NCHW-FP32-B=ConvAsm1x1U:1,32,1,64,3,1,4,1;ConvOclDirectFwd1x1:1,256,1,1,0,1,32,4,0
256-28-28-1x1-32-28-28-256-0x0-1x1-1x1-0-NCHW-FP16-F=ConvAsm1x1U:1,8,2,32,1,4,1,4;ConvOclDirectFwd1x1:1,128,1,1,0,4,16,4,0
64-56-56-1x1-256-56-56-128-0x0-1x1-1x1-0-NCHW-FP32-F=ConvAsm1x1U:1,16,1,64,2,2,1,4;ConvActivAsm1x1U:1,32,1,64,3,1;ConvOclDirectFwd1x1:1,64,1,1,1,1,32,64,0
64-56-56-1x1-256-56-56-64-0x0-1x1-1x1-0-NCHW-FP32-W=ConvAsmBwdWrW1x1:4,4,4,4,4,1,4,4,0,1
256-14-14-3x3-256-14-14-2-1x1-1x1-1x1-0-NCHW-FP16-W=ConvAsmBwdWrW3x3:0,1,8,2,2,1
64-73-73-1x1-80-73-73-256-0x0-1x1-1x1-0-NCHW-FP16-F=ConvAsm1x1U:2,16,4,64,1,2,1,1;ConvOclDirectFwd1x1:1,256,1,1,0,1,16,8,0
80-73-73-1x1-64-73-73-32-0x0-1x1-1x1-0-NCHW-FP32-B=ConvAsm1x1U:1,16,1,64,1,2,2,4;ConvOclDirectFwd1x1:1,256,1,1,0,1,32,4,0
1024-14-14-1x1-512-28-28-32-0x0-2x2-1x1-0-NCHW-FP32-W=ConvAsmBwdWrW1x1:1,16,4,8,4,1,1,4,0,2
512-28-28-1x1-256-56-56-32-0x0-2x2-1x1-0-NCHW-FP16-W=ConvAsmBwdWrW1x1:2,8,4,8,2,2,2,4,0,1
128-14-14-1x1-512-14-14-512-0x0-1x1-1x1-0-NCHW-FP32-B=ConvAsm1x1U:1,32,1,32,2,1,1,2;ConvOclDirectFwd1x1:1,128,1,1,0,2,32,4,0
512-28-28-3x3-512-28-28-32-1x1-1x1-1x1-0-NCHW-FP16-F=ConvOclDirectFwd:16,16,32,32,2,2,8,4,1;ConvOclDirectFwdFused:16,16,32,32,2,2,8,1,1
128-28-28-1x1-256-56-56-64-0x0-2x2-1x1-0-NCHW-FP32-W=ConvAsmBwdWrW1x1:2,8,4,8,2,1,4,4,0,1
1024-14-14-1x1-512-28-28-256-0x0-2x2-1x1-0-NCHW-FP16-W=ConvAsmBwdWrW1x1:1,16,8,8,2,1,1,2,0,1
1280-8-8-1x1-448-8-8-64-0x0-1x1-1x1-0-NCHW-FP32-F=ConvAsm1x1U:2,16,2,32,3,2,4,1;ConvActivAsm1x1U:2,16,2,32,4,1;ConvOclDirectFwd1x1:1,64,1,1,1,0,32,2048,0
2048-7-7-1x1-512-7-7-8-0x0-1x1-1x1-0-NCHW-FP16-B=ConvAsm1x1U:1,8,4,16,1,4,4,2;ConvOclDirectFwd1x1:1,128,1,1,0,1,8,8,0
32-28-28-1x1-256-28-28-4-0x0-1x1-1x1-0-NCHW-FP16-B=ConvAsm1x1U:1,8,2,16,1,2,2,1;ConvOclDirectFwd1x1:1,64,1,1,0,4,16,4,0
192-8-8-3x3-192-17-17-256-0x0-2x2-1x1-0-NCHW-FP32-B=ConvOclDirectFwd:32,32,32,32,1,1,4,4,2
144-14-14-1x1-512-14-14-512-0x0-1x1-1x1-0-NCHW-FP16-W=ConvAsmBwdWrW1x1:2,8,2,8,2,1,4,4,0,2
224-7-7-3x3-192-7-7-32-1x1-1x1-1x1-0-NCHW-FP32-W=ConvAsmBwdWrW3x3:0,1,8,2,7,1
160-14-14-1x1-528-14-14-16-0x0-1x1-1x1-0-NCHW-FP16-B=ConvAsm1x1U:1,16,2,16,1,2,2,2;ConvOclDirectFwd1x1:1,64,1,1,0,4,8,4,0
64-35-35-1x1-384-35-35-256-0x0-1x1-1x1-0-NCHW-FP16-W=ConvAsmBwdWrW1x1:4,4,8,4,2,1,2,4,0,1
128-7-7-5x5-48-7-7-256-2x2-1x1-1x1-0-NCHW-FP16-B=ConvOclDirectFwd:8,8,8,8,1,1,8,2,2
192-28-28-1x1-64-28-28-32-0x0-1x1-1x1-0-NCHW-FP32-F=ConvAsm1x1U:1,8,1,32,1,4,1,8;ConvActivAsm1x1U:2,16,2,32,2,3;ConvOclDirectFwd1x1:1,64,1,1,1,4,16,2048,0
512-28-28-1x1-128-28-28-16-0x0-1x1-1x1-0-NCHW-FP32-W=ConvAsmBwdWrW1x1:1,16,2,8,4,1,4,4,0,1
192-14-14-1x1-480-14-14-1-0x0-1x1-1x1-0-NCHW-FP16-B=ConvAsm1x1U:1,8,2,64,1,4,4,2;ConvOclDirectFwd1x1:1,64,1,1,0,4,4,8,0
2048-7-7-1x1-1024-14-14-256-0x0-2x2-1x1-0-NCHW-FP32-W=ConvAsmBwdWrW1x1:1,16,2,8,4,1,1,4,0,2
64-147-147-3x3-32-147-147-8-1x1-1x1-1x1-0-NCHW-FP32-W=ConvAsmBwdWrW3x3:0,0,16,4,2,4
64-56-56-3x3-64-56-56-128-1x1-1x1-1x1-0-NCHW-FP32-W=ConvAsmBwdWrW3x3:0,1,8,4,2,4
64-28-28-1x1-192-28-28-4-0x0-1x1-1x1-0-NCHW-FP32-B=ConvAsm1x1U:1,8,1,16,1,4,1,2;ConvOclDirectFwd1x1:1,64,1,1,0,1,8,4,0
64-28-28-1x1-192-28-28-4-0x0-1x1-1x1-0-NCHW-FP16-W=ConvAsmBwdWrW1x1:2,8,2,4,2,1,4,2,0,1
384-8-8-1x1-2048-8-8-4-0x0-1x1-1x1-0-NCHW-FP16-B=ConvAsm1x1U:1,8,2,16,1,4,2,1;ConvOclDirectFwd1x1:1,256,1,1,0,2,4,4,0
2048-7-7-1x1-512-7-7-2-0x0-1x1-1x1-0-NCHW-FP16-W=ConvAsmBwdWrW1x1:1,16,2,4,4,1,1,2,0,1
512-7-7-1x1-512-7-7-8-0x0-1x1-1x1-0-NCHW-FP32-F=ConvAsm1x1U:2,8,2,32,1,4,2,2;ConvActivAsm1x1U:2,16,4,16,1,4;ConvOclDirectFwd1x1:1,64,1,1,1,1,16,128,0
384-13-13-3x3-192-13-13-50-1x1-1x1-1x1-0-NCHW-FP32-W=ConvAsmBwdWrW3x3:0,0,16,4,7,1
48-35-35-1x1-256-35-35-64-0x0-1x1-1x1-0-NCHW-FP16-W=ConvAsmBwdWrW1x1:4,4,8,4,2,1,4,4,0,1
384-35-35-1x1-192-35-35-64-0x0-1x1-1x1-0-NCHW-FP16-F=ConvAsm1x1U:2,8,4,64,1,4,1,4;ConvOclDirectFwd1x1:1,256,1,1,0,1,16,4,0
512-7-7-1x1-512-7-7-2-0x0-1x1-1x1-0-NCHW-FP32-W=ConvAsmBwdWrW1x1:1,16,2,2,8,2,1,4,0,1
512-128-128-1x1-24-128-128-1-0x0-1x1-1x1-0-NCHW-FP32-F=ConvOclDirectFwdFused:1,256,1,1,0,1,16,8,0;ConvOclDirectFwd1x1:1,64,1,1,0,2,8,8,0
768-17-17-1x1-160-17-17-16-0x0-1x1-1x1-0-NCHW-FP32-F=ConvAsm1x1U:4,16,5,64,1,2,4,1;ConvActivAsm1x1U:4,16,7,16,1,2;ConvOclDirectFwd1x1:1,64,1,1,1,1,16,2048,0
24-14-14-1x1-512-14-14-64-0x0-1x1-1x1-0-NCHW-FP16-W=ConvAsmBwdWrW1x1:4,4,4,1,4,2,1,4,0,1
576-14-14-1x1-224-14-14-64-0x0-1x1-1x1-0-NCHW-FP32-F=ConvAsm1x1U:2,16,2,64,3,2,2,2;ConvActivAsm1x1U:4,32,7,16,1,1;ConvOclDirectFwd1x1:1,64,1,1,1,1,16,2048,0
32-28-28-5x5-16-28-28-1-2x2-1x1-1x1-0-NCHW-FP16-B=ConvOclDirectFwd:16,16,16,16,1,1,1,4,1
384-8-8-1x1-1536-8-8-32-0x0-1x1-1x1-0-NCHW-FP16-W=ConvAsmBwdWrW1x1:2,8,4,4,2,1,1,4,0,0
384-8-8-1x1-1280-8-8-64-0x0-1x1-1x1-0-NCHW-FP16-B=ConvAsm1x1U:1,16,2,32,1,2,2,4;ConvOclDirectFwd1x1:1,64,1,1,0,4,16,4,0
672-28-28-1x1-192-28-28-16-0x0-1x1-1x1-0-NCHW-FP32-F=ConvAsm1x1U:4,16,5,32,1,2,2,2;ConvActivAsm1x1U:4,16,5,32,1,1;ConvOclDirectFwd1x1:1,64,1,1,1,0,16,2048,0
256-8-8-1x1-1536-8-8-8-0x0-1x1-1x1-0-NCHW-FP32-B=ConvAsm1x1U:1,16,1,32,2,2,2,2;ConvOclDirectFwd1x1:1,64,1,1,0,2,4,4,0
192-56-56-1x1-336-56-56-16-0x0-1x1-1x1-0-NCHW-FP16-B=ConvAsm1x1U:1,16,2,64,1,2,1,1;ConvOclDirectFwd1x1:1,128,1,1,0,4,16,4,0
256-28-28-1x1-32-28-28-8-0x0-1x1-1x1-0-NCHW-FP16-F=ConvAsm1x1U:1,8,2,32,1,4,4,4;ConvOclDirectFwd1x1:1,256,1,1,0,2,4,4,0
48-64-128-5x5-128-64-128-1-2x2-1x1-1x1-0-NCHW-FP16-F=ConvOclDirectFwd:8,32,16,32,2,1,8,4,1
192-7-7-1x1-832-7-7-32-0x0-1x1-1x1-0-NCHW-FP16-B=ConvAsm1x1U:1,16,2,16,1,2,2,2;ConvOclDirectFwd1x1:1,64,1,1,0,1,8,4,0
24-14-14-1x1-512-14-14-4-0x0-1x1-1x1-0-NCHW-FP32-B=ConvAsm1x1U:1,8,1,32,1,2,2,1;ConvOclDirectFwd1x1:1,64,1,1,0,4,4,4,0
288-56-56-1x1-192-56-56-16-0x0-1x1-1x1-0-NCHW-FP32-F=ConvAsm1x1U:2,16,3,64,2,2,1,2;ConvActivAsm1x1U:3,16,3,64,2,1;ConvOclDirectFwd1x1:1,64,1,1,1,0,16,2048,0
256-56-56-3x3-128-56-56-2-1x1-1x1-1x1-0-NCHW-FP16-W=ConvAsmBwdWrW3x3:0,0,8,2,2,1
64-55-55-1x1-256-55-55-32-0x0-1x1-1x1-0-NCHW-FP16-F=ConvAsm1x1U:2,8,4,64,1,4,1,4;ConvOclDirectFwd1x1:1,256,1,1,0,1,32,4,0
320-8-8-1x1-1280-8-8-16-0x0-1x1-1x1-0-NCHW-FP16-B=ConvAsm1x1U:1,16,2,16,1,2,4,2;ConvOclDirectFwd1x1:1,64,1,1,0,2,8,4,0
160-14-14-1x1-512-14-14-8-0x0-1x1-1x1-0-NCHW-FP32-B=ConvAsm1x1U:1,16,1,64,1,2,1,2;ConvOclDirectFwd1x1:1,256,1,1,0,4,16,4,0
528-14-14-1x1-32-14-14-128-0x0-1x1-1x1-0-NCHW-FP32-F=ConvAsm1x1U:2,16,2,64,2,2,2,1;ConvOclDirectFwd1x1:1,64,1,1,1,4,16,2048,0
192-7-7-1x1-1056-7-7-16-0x0-1x1-1x1-0-NCHW-FP16-F=ConvAsm1x1U:2,8,4,16,1,4,4,1;ConvOclDirectFwd1x1:1,64,1,1,0,1,16,4,0
832-7-7-1x1-32-7-7-256-0x0-1x1-1x1-0-NCHW-FP32-F=ConvAsm1x1U:4,8,4,16,1,4,2,2;ConvActivAsm1x1U:1,16,1,64,4,4;ConvOclDirectFwd1x1:1,64,1,1,1,4,16,128,0
512-28-28-1x1-128-28-28-4-0x0-1x1-1x1-0-NCHW-FP32-F=ConvAsm1x1U:2,8,2,32,2,2,2,2;ConvActivAsm1x1U:4,16,4,32,1,3;ConvOclDirectFwd1x1:1,64,1,1,1,4,16,256,0
2048-7-7-1x1-1024-14-14-16-0x0-2x2-1x1-0-NCHW-FP32-W=ConvAsmBwdWrW1x1:1,16,4,4,8,1,1,4,0,1
256-14-14-1x1-1024-14-14-32-0x0-1x1-1x1-0-NCHW-FP32-B=ConvAsm1x1U:1,16,1,64,2,2,1,1;ConvOclDirectFwd1x1:1,64,1,1,0,4,16,4,0
96-35-35-3x3-64-35-35-8-1x1-1x1-1x1-0-NCHW-FP16-W=ConvAsmBwdWrW3x3:0,0,8,2,2,4
192-35-35-1x1-48-35-35-256-0x0-1x1-1x1-0-NCHW-FP16-F=ConvAsm1x1U:2,16,4,64,1,2,1,1;ConvOclDirectFwd1x1:1,256,1,1,0,1,16,8,0
96-35-35-3x3-96-35-35-32-1x1-1x1-1x1-0-NCHW-FP16-F=ConvOclDirectFwd:8,16,16,16,2,1,8,4,2;ConvOclDirectFwdFused:8,16,16,16,2,1,8,4,2
192-17-17-1x1-1024-17-17-16-0x0-1x1-1x1-0-NCHW-FP16-W=ConvAsmBwdWrW1x1:4,4,4,4,4,1,1,2,0,1
224-35-35-3x3-192-35-35-32-1x1-1x1-1x1-0-NCHW-FP16-W=ConvAsmBwdWrW3x3:0,0,8,2,2,8
192-71-71-3x3-80-73-73-1-0x0-1x1-1x1-0-NCHW-FP16-B=ConvOclDirectFwd:16,8,16,16,1,2,4,4,1
32-149-149-3x3-3-299-299-32-0x0-2x2-1x1-0-NCHW-FP16-B=ConvOclDirectFwd:16,16,32,32,2,2,8,2,1
192-56-56-3x3-64-56-56-32-1x1-1x1-1x1-0-NCHW-FP16-B=ConvOclDirectFwd:16,16,32,32,2,2,8,1,2
160-14-14-1x1-528-14-14-256-0x0-1x1-1x1-0-NCHW-FP32-F=ConvAsm1x1U:2,16,2,64,3,2,1,4;ConvOclDirectFwd1x1:1,64,1,1,1,0,32,256,0
16-14-14-1x1-480-14-14-32-0x0-1x1-1x1-0-NCHW-FP16-B=ConvAsm1x1U:1,8,2,32,1,4,1,1;ConvOclDirectFwd1x1:1,128,1,1,0,4,8,4,0
1024-14-14-1x1-512-28-28-1-0x0-2x2-1x1-0-NCHW-FP32-B=ConvAsm1x1U:1,8,1,64,1,4,2,2;ConvOclDirectFwd1x1:1,128,1,1,0,1,4,4,0
256-14-14-1x1-1024-14-14-32-0x0-1x1-1x1-0-NCHW-FP32-F=ConvAsm1x1U:4,8,4,64,1,4,1,4;ConvActivAsm1x1U:2,16,2,64,3,4;ConvOclDirectFwd1x1:1,64,1,1,1,1,32,2048,0
256-8-8-1x1-1536-8-8-1-0x0-1x1-1x1-0-NCHW-FP32-W=ConvAsmBwdWrW1x1:1,16,4,2,8,1,1,4,0,0
384-35-35-1x1-96-35-35-8-0x0-1x1-1x1-0-NCHW-FP32-F=ConvAsm1x1U:4,16,4,64,1,2,2,1;ConvActivAsm1x1U:2,16,2,64,2,2;ConvOclDirectFwd1x1:1,64,1,1,1,4,16,2048,0
512-14-14-1x1-144-14-14-1-0x0-1x1-1x1-0-NCHW-FP16-F=ConvAsm1x1U:1,8,2,16,1,4,4,1;ConvOclDirectFwd1x1:1,64,1,1,0,4,4,8,0
192-14-14-1x1-1632-14-14-16-0x0-1x1-1x1-0-NCHW-FP16-B=ConvAsm1x1U:1,16,2,16,1,2,2,2;ConvOclDirectFwd1x1:1,64,1,1,0,4,16,4,0
160-14-14-1x1-512-14-14-512-0x0-1x1-1x1-0-NCHW-FP16-B=ConvAsm1x1U:1,16,2,16,1,2,2,2;ConvOclDirectFwd1x1:1,64,1,1,0,2,16,4,0
320-8-8-1x1-2048-8-8-256-0x0-1x1-1x1-0-NCHW-FP16-B=ConvAsm1x1U:1,16,2,32,1,2,1,8;ConvOclDirectFwd1x1:1,256,1,1,0,4,16,4,0
128-28-28-1x1-256-56-56-32-0x0-2x2-1x1-0-NCHW-FP16-B=ConvAsm1x1U:1,16,2,16,1,2,2,2;ConvOclDirectFwd1x1:1,64,1,1,0,2,32,8,0
16-28-28-1x1-192-28-28-256-0x0-1x1-1x1-0-NCHW-FP32-B=ConvAsm1x1U:1,16,1,32,2,1,4,1;ConvOclDirectFwd1x1:1,128,1,1,0,2,32,4,0
256-14-14-3x3-256-7-7-64-1x1-2x2-1x1-0-NCHW-FP32-F=ConvOclDirectFwd:8,8,8,8,1,1,8,2,2
64-112-112-7x7-3-230-230-16-0x0-2x2-1x1-0-NCHW-FP32-B=ConvOclDirectFwd:16,16,32,32,2,2,8,2,1
192-28-28-3x3-128-28-28-128-1x1-1x1-1x1-0-NCHW-FP16-W=ConvAsmBwdWrW3x3:0,0,8,2,2,1
256-56-56-1x1-128-28-28-4-0x0-2x2-1x1-0-NCHW-FP16-F=ConvAsm1x1U:1,8,2,32,1,4,4,1;ConvOclDirectFwd1x1:1,64,1,1,0,2,16,8,0
192-71-71-3x3-80-73-73-64-0x0-1x1-1x1-0-NCHW-FP16-B=ConvOclDirectFwd:16,8,16,16,1,2,8,1,1
192-35-35-1x1-384-35-35-32-0x0-1x1-1x1-0-NCHW-FP16-B=ConvAsm1x1U:1,16,2,64,1,2,1,2;ConvOclDirectFwd1x1:1,128,1,1,0,1,32,4,0
192-28-28-1x1-480-28-28-16-0x0-1x1-1x1-0-NCHW-FP16-W=ConvAsmBwdWrW1x1:2,8,2,8,2,1,2,4,0,1
384-17-17-1x1-1024-17-17-256-0x0-1x1-1x1-0-NCHW-FP32-B=ConvAsm1x1U:1,16,1,64,4,2,1,4;ConvOclDirectFwd1x1:1,64,1,1,0,1,32,4,0
320-8-8-1x1-2048-8-8-64-0x0-1x1-1x1-0-NCHW-FP32-B=ConvAsm1x1U:1,16,1,64,2,2,1,4;ConvOclDirectFwd1x1:1,64,1,1,0,4,16,4,0
96-35-35-3x3-64-35-35-4-1x1-1x1-1x1-0-NCHW-FP16-B=ConvOclDirectFwd:16,16,16,32,1,2,8,2,2
128-17-17-1x1-1024-17-17-8-0x0-1x1-1x1-0-NCHW-FP32-B=ConvAsm1x1U:1,16,1,64,2,1,2,2;ConvOclDirectFwd1x1:1,64,1,1,0,1,16,4,0
64-14-14-1x1-576-14-14-64-0x0-1x1-1x1-0-NCHW-FP32-B=ConvAsm1x1U:1,16,1,32,2,2,1,4;ConvOclDirectFwd1x1:1,256,1,1,0,4,16,4,0
192-14-14-1x1-624-14-14-16-0x0-1x1-1x1-0-NCHW-FP16-W=ConvAsmBwdWrW1x1:2,8,4,8,2,1,2,4,0,0
608-14-14-1x1-128-14-14-32-0x0-1x1-1x1-0-NCHW-FP32-F=ConvAsm1x1U:2,16,4,64,1,2,2,1;ConvActivAsm1x1U:4,16,4,64,1,3;ConvOclDirectFwd1x1:1,64,1,1,1,0,16,2048,0
256-35-35-1x1-64-35-35-4-0x0-1x1-1x1-0-NCHW-FP16-F=ConvAsm1x1U:1,8,2,64,1,4,4,1;ConvOclDirectFwd1x1:1,128,1,1,0,1,8,8,0
160-14-14-1x1-528-14-14-8-0x0-1x1-1x1-0-NCHW-FP32-B=ConvAsm1x1U:1,16,1,16,1,1,2,2;ConvOclDirectFwd1x1:1,64,1,1,0,4,16,4,0
512-7-7-1x1-2048-7-7-16-0x0-1x1-1x1-0-NCHW-FP16-B=ConvAsm1x1U:2,8,4,16,1,4,2,2;ConvOclDirectFwd1x1:1,64,1,1,0,1,8,4,0
64-28-28-1x1-192-28-28-512-0x0-1x1-1x1-0-NCHW-FP16-W=ConvAsmBwdWrW1x1:4,4,8,1,8,1,4,4,0,1
64-55-55-3x3-64-55-55-32-1x1-1x1-1x1-0-NCHW-FP16-B=ConvOclDirectFwd:16,16,32,32,2,2,8,1,2
512-7-7-1x1-1024-14-14-64-0x0-2x2-1x1-0-NCHW-FP32-B=ConvAsm1x1U:2,16,2,32,1,2,2,2;ConvOclDirectFwd1x1:1,256,1,1,0,1,32,4,0
1056-7-7-1x1-128-7-7-32-0x0-1x1-1x1-0-NCHW-FP32-F=ConvAsm1x1U:2,8,2,32,2,4,2,2;ConvActivAsm1x1U:4,16,4,16,1,4;ConvOclDirectFwd1x1:1,64,1,1,1,0,16,256,0
256-28-28-3x3-512-28-28-4-1x1-1x1-1x1-0-NCHW-FP16-F=ConvOclDirectFwd:8,32,32,32,4,1,8,2,2;ConvOclDirectFwdFused:16,16,32,32,2,2,8,2,1
256-35-35-1x1-64-35-35-256-0x0-1x1-1x1-0-NCHW-FP16-W=ConvAsmBwdWrW1x1:4,4,4,4,4,1,4,4,0,1
256-56-56-1x1-512-28-28-32-0x0-2x2-1x1-0-NCHW-FP16-F=ConvAsm1x1U:1,8,2,32,2,4,1,4;ConvOclDirectFwd1x1:1,256,1,1,0,2,32,4,0
128-7-7-1x1-1024-7-7-32-0x0-1x1-1x1-0-NCHW-FP16-W=ConvAsmBwdWrW1x1:2,8,4,8,2,1,2,4,0,1
96-35-35-3x3-64-35-35-256-1x1-1x1-1x1-0-NCHW-FP32-W=ConvAsmBwdWrW3x3:0,0,8,4,3,4
320-8-8-1x1-1280-8-8-8-0x0-1x1-1x1-0-NCHW-FP32-B=ConvAsm1x1U:1,8,1,32,1,4,1,4;ConvOclDirectFwd1x1:1,128,1,1,0,2,8,8,0
16-14-14-1x1-480-14-14-32-0x0-1x1-1x1-0-NCHW-FP16-W=ConvAsmBwdWrW1x1:4,4,2,4,2,1,4,2,0,1
128-14-14-3x3-128-28-28-32-1x1-2x2-1x1-0-NCHW-FP32-W=ConvAsmBwdWrW3x3:0,0,8,4,3,1
192-7-7-3x3-384-7-7-128-1x1-1x1-1x1-0-NCHW-FP16-F=ConvOclDirectFwd:8,8,8,8,1,1,8,4,2;ConvOclDirectFwdFused:8,8,8,8,1,1,8,4,1
1280-8-8-1x1-192-8-8-16-0x0-1x1-1x1-0-NCHW-FP32-F=ConvAsm1x1U:2,8,2,32,1,4,2,2;ConvActivAsm1x1U:2,16,2,32,2,4;ConvOclDirectFwd1x1:8,8,8,8,1,0,32,128,1
80-73-73-3x3-192-71-71-8-0x0-1x1-1x1-0-NCHW-FP32-F=ConvOclDirectFwd:16,8,16,16,1,2,8,4,2
384-13-13-3x3-256-13-13-4-1x1-1x1-1x1-0-NCHW-FP16-F=ConvOclDirectFwd:8,16,16,16,2,1,2,4,2;ConvOclDirectFwdFused:8,16,16,16,2,1,2,4,2
864-14-14-1x1-192-14-14-16-0x0-1x1-1x1-0-NCHW-FP16-F=ConvAsm1x1U:2,8,4,64,1,4,4,2;ConvOclDirectFwd1x1:1,64,1,1,0,4,8,4,0
512-7-7-1x1-512-7-7-1-0x0-1x1-1x1-0-NCHW-FP32-W=ConvAsmBwdWrW1x1:1,16,4,4,2,1,1,2,0,1
64-56-56-1x1-256-56-56-32-0x0-1x1-1x1-0-NCHW-FP16-W=ConvAsmBwdWrW1x1:4,4,8,1,8,1,4,4,0,1
128-112-112-3x3-128-112-112-64-1x1-1x1-1x1-0-NCHW-FP16-F=ConvOclDirectFwd:8,16,16,32,2,2,8,4,1;ConvOclDirectFwdFused:16,8,16,32,1,4,8,1,1
1824-14-14-1x1-192-14-14-16-0x0-1x1-1x1-0-NCHW-FP16-F=ConvAsm1x1U:2,8,4,64,1,4,4,2;ConvOclDirectFwd1x1:1,64,1,1,0,4,8,4,0
192-56-56-3x3-64-56-56-32-1x1-1x1-1x1-0-NCHW-FP16-W=ConvAsmBwdWrW3x3:0,0,8,2,1,8
64-56-56-3x3-64-56-56-4-1x1-1x1-1x1-0-NCHW-FP16-B=ConvOclDirectFwd:16,16,16,32,1,2,8,2,2
384-7-7-3x3-192-7-7-16-1x1-1x1-1x1-0-NCHW-FP16-W=ConvAsmBwdWrW3x3:0,0,8,4,3,1
16-28-28-1x1-192-28-28-4-0x0-1x1-1x1-0-NCHW-FP32-B=ConvAsm1x1U:1,8,1,32,1,2,1,1;ConvOclDirectFwd1x1:1,128,1,1,0,1,8,4,0
2048-8-8-1x1-320-8-8-128-0x0-1x1-1x1-0-NCHW-FP32-F=ConvAsm1x1U:3,16,4,16,3,2,1,2;ConvActivAsm1x1U:3,16,4,16,3,2;ConvOclDirectFwd1x1:1,64,1,1,1,4,32,2048,0
16-14-14-1x1-480-14-14-512-0x0-1x1-1x1-0-NCHW-FP32-W=ConvAsmBwdWrW1x1:4,4,2,4,4,1,4,4,0,1
48-7-7-1x1-832-7-7-128-0x0-1x1-1x1-0-NCHW-FP16-W=ConvAsmBwdWrW1x1:4,4,4,4,2,1,2,2,0,0
192-35-35-1x1-48-35-35-4-0x0-1x1-1x1-0-NCHW-FP16-F=ConvAsm1x1U:1,8,2,32,1,4,4,1;ConvOclDirectFwd1x1:1,64,1,1,0,1,8,8,0
256-28-28-1x1-512-28-28-16-0x0-1x1-1x1-0-NCHW-FP16-W=ConvAsmBwdWrW1x1:4,4,8,4,2,1,1,2,0,1
32-35-35-1x1-192-35-35-256-0x0-1x1-1x1-0-NCHW-FP32-W=ConvAsmBwdWrW1x1:4,4,4,4,2,1,4,4,0,1
320-28-28-1x1-128-28-28-32-0x0-1x1-1x1-0-NCHW-FP32-F=ConvAsm1x1U:2,16,2,32,2,2,1,2;ConvActivAsm1x1U:3,16,5,32,1,1;ConvOclDirectFwd1x1:1,64,1,1,1,4,32,2048,0
256-7-7-1x1-832-7-7-512-0x0-1x1-1x1-0-NCHW-FP16-W=ConvAsmBwdWrW1x1:1,16,4,8,2,1,2,2,0,3
256-7-7-3x3-256-14-14-32-1x1-2x2-1x1-0-NCHW-FP32-B=ConvOclDirectFwd:8,8,8,16,1,2,2,2,1
64-73-73-1x1-160-73-73-64-0x0-1x1-1x1-0-NCHW-FP16-B=ConvAsm1x1U:1,16,2,64,1,2,1,2;ConvOclDirectFwd1x1:1,256,1,1,0,1,32,4,0
144-14-14-1x1-512-14-14-128-0x0-1x1-1x1-0-NCHW-FP32-B=ConvAsm1x1U:1,16,1,32,2,2,2,4;ConvOclDirectFwd1x1:1,256,1,1,0,1,32,4,0
208-14-14-3x3-96-14-14-512-1x1-1x1-1x1-0-NCHW-FP16-B=ConvOclDirectFwd:8,8,16,16,2,2,8,2,2
512-7-7-1x1-512-7-7-16-0x0-1x1-1x1-0-NCHW-FP32-W=ConvAsmBwdWrW1x1:1,16,2,4,8,1,1,4,0,2
256-64-128-3x3-128-64-128-1-1x1-1x1-1x1-0-NCHW-FP16-B=ConvOclDirectFwd:16,16,16,32,1,2,8,4,1
384-17-17-3x3-384-35-35-16-0x0-2x2-1x1-0-NCHW-FP16-B=ConvOclDirectFwd:8,16,16,16,2,1,4,1,1
64-112-112-7x7-3-224-224-128-3x3-2x2-1x1-0-NCHW-FP16-B=ConvOclDirectFwd:16,16,32,32,2,2,8,2,1
192-17-17-1x1-1024-17-17-128-0x0-1x1-1x1-0-NCHW-FP16-B=ConvAsm1x1U:1,16,2,32,1,2,1,2;ConvOclDirectFwd1x1:1,256,1,1,0,1,8,8,0
816-14-14-1x1-192-14-14-16-0x0-1x1-1x1-0-NCHW-FP32-F=ConvAsm1x1U:1,16,3,16,1,2,2,1;ConvActivAsm1x1U:3,16,3,16,4,4;ConvOclDirectFwd1x1:1,64,1,1,1,1,16,256,0
160-14-14-1x1-512-14-14-256-0x0-1x1-1x1-0-NCHW-FP32-B=ConvAsm1x1U:1,32,1,32,2,1,2,1;ConvOclDirectFwd1x1:1,256,1,1,0,1,32,4,0
160-73-73-1x1-64-73-73-16-0x0-1x1-1x1-0-NCHW-FP16-F=ConvAsm1x1U:3,8,6,64,1,4,1,4;ConvOclDirectFwd1x1:1,64,1,1,0,1,32,4,0
512-28-28-3x3-512-28-28-64-1x1-1x1-1x1-0-NCHW-FP16-W=ConvAsmBwdWrW3x3:0,1,8,4,2,1
192-17-17-1x1-768-17-17-16-0x0-1x1-1x1-0-NCHW-FP16-B=ConvAsm1x1U:1,16,2,16,1,2,2,2;ConvOclDirectFwd1x1:1,256,1,1,0,1,8,4,0
16-14-14-1x1-480-14-14-256-0x0-1x1-1x1-0-NCHW-FP32-W=ConvAsmBwdWrW1x1:4,4,4,4,2,1,4,4,0,3
320-7-7-3x3-160-7-7-16-1x1-1x1-1x1-0-NCHW-FP32-W=ConvAsmBwdWrW3x3:0,1,8,2,7,1
64-28-28-1x1-256-28-28-512-0x0-1x1-1x1-0-NCHW-FP32-B=ConvAsm1x1U:1,32,1,16,1,1,1,1;ConvOclDirectFwd1x1:1,64,1,1,0,2,32,4,0
64-14-14-5x5-32-14-14-64-2x2-1x1-1x1-0-NCHW-FP32-B=ConvOclDirectFwd:8,8,16,16,2,2,2,1,2
128-14-14-1x1-512-14-14-512-0x0-1x1-1x1-0-NCHW-FP16-W=ConvAsmBwdWrW1x1:4,4,8,4,4,2,2,4,0,1
192-28-28-1x1-64-28-28-16-0x0-1x1-1x1-0-NCHW-FP16-F=ConvAsm1x1U:1,8,2,16,1,4,2,2;ConvOclDirectFwd1x1:1,64,1,1,0,4,16,8,0
512-28-28-1x1-128-28-28-32-0x0-1x1-1x1-0-NCHW-FP16-F=ConvAsm1x1U:1,8,2,32,1,4,1,4;ConvOclDirectFwd1x1:1,64,1,1,0,4,16,4,0
128-14-14-1x1-512-14-14-64-0x0-1x1-1x1-0-NCHW-FP32-B=ConvAsm1x1U:1,32,1,32,2,1,2,1;ConvOclDirectFwd1x1:1,128,1,1,0,4,16,4,0
48-56-56-3x3-192-56-56-16-1x1-1x1-1x1-0-NCHW-FP16-W=ConvAsmBwdWrW3x3:0,1,8,2,1,4
192-7-7-1x1-1824-7-7-16-0x0-1x1-1x1-0-NCHW-FP16-B=ConvAsm1x1U:1,8,2,32,1,2,2,2;ConvOclDirectFwd1x1:1,128,1,1,0,1,8,4,0
384-35-35-1x1-192-35-35-128-0x0-1x1-1x1-0-NCHW-FP32-F=ConvAsm1x1U:3,16,3,64,2,2,2,2;ConvActivAsm1x1U:2,16,3,32,4,1;ConvOclDirectFwd1x1:1,64,1,1,1,1,32,2048,0
128-14-14-1x1-512-14-14-8-0x0-1x1-1x1-0-NCHW-FP16-B=ConvAsm1x1U:1,8,2,64,1,4,1,4;ConvOclDirectFwd1x1:1,256,1,1,0,4,8,4,0
192-17-17-3x3-320-8-8-1-0x0-2x2-1x1-0-NCHW-FP32-F=ConvOclDirectFwd:8,8,8,8,1,1,1,4,1
1024-17-17-1x1-192-17-17-256-0x0-1x1-1x1-0-NCHW-FP32-F=ConvAsm1x1U:3,16,5,64,2,2,2,1;ConvActivAsm1x1U:2,32,5,64,1,1;ConvOclDirectFwd1x1:1,64,1,1,1,4,32,2048,0
96-112-112-7x7-3-224-224-16-3x3-2x2-1x1-0-NCHW-FP32-B=ConvOclDirectFwd:16,16,32,32,2,2,8,2,1
32-14-14-1x1-528-14-14-512-0x0-1x1-1x1-0-NCHW-FP16-B=ConvAsm1x1U:1,16,2,16,1,2,1,2;ConvOclDirectFwd1x1:1,256,1,1,0,4,16,8,0
320-8-8-3x3-320-17-17-4-0x0-2x2-1x1-0-NCHW-FP32-B=ConvOclDirectFwd:16,16,32,32,2,2,2,4,2
160-7-7-3x3-320-7-7-256-1x1-1x1-1x1-0-NCHW-FP16-F=ConvOclDirectFwd:8,8,8,8,1,1,8,4,2;ConvOclDirectFwdFused:8,8,8,8,1,1,8,4,2
64-112-112-7x7-3-225-225-512-2x2-2x2-1x1-0-NCHW-FP16-B=ConvOclDirectFwd:16,32,32,32,2,1,1,4,1
128-128-256-1x1-256-128-256-1-0x0-1x1-1x1-0-NCHW-FP16-W=ConvAsmBwdWrW1x1:4,4,4,4,2,1,1,4,0,2
64-35-35-1x1-384-35-35-32-0x0-1x1-1x1-0-NCHW-FP16-W=ConvAsmBwdWrW1x1:4,4,8,4,2,1,2,4,0,1
320-8-8-3x3-192-17-17-16-0x0-2x2-1x1-0-NCHW-FP32-B=ConvOclDirectFwd:8,32,32,32,4,1,4,4,1
64-73-73-3x3-96-71-71-8-0x0-1x1-1x1-0-NCHW-FP32-F=ConvOclDirectFwd:16,8,16,16,1,2,8,4,1
96-35-35-3x3-96-35-35-64-1x1-1x1-1x1-0-NCHW-FP16-W=ConvAsmBwdWrW3x3:0,1,8,2,2,8
16-28-28-5x5-32-28-28-16-2x2-1x1-1x1-0-NCHW-FP32-F=ConvOclDirectFwd:8,32,32,32,4,1,4,4,2;ConvOclDirectFwdFused:8,32,32,32,4,1,4,4,2
32-14-14-5x5-64-14-14-512-2x2-1x1-1x1-0-NCHW-FP32-F=ConvOclDirectFwd:8,8,16,16,2,2,4,1,2;ConvOclDirectFwdFused:8,8,16,16,2,2,8,1,2
192-7-7-3x3-384-7-7-512-1x1-1x1-1x1-0-NCHW-FP16-F=ConvOclDirectFwd:8,8,8,8,1,1,8,4,2;ConvOclDirectFwdFused:8,8,8,8,1,1,8,4,2
192-7-7-1x1-1536-7-7-16-0x0-1x1-1x1-0-NCHW-FP16-W=ConvAsmBwdWrW1x1:1,16,2,8,2,1,2,4,0,1
256-28-28-1x1-128-28-28-512-0x0-1x1-1x1-0-NCHW-FP32-F=ConvAsm1x1U:3,16,3,32,2,2,1,4;ConvActivAsm1x1U:2,32,2,16,3,1;ConvOclDirectFwd1x1:1,64,1,1,1,0,16,256,0
16-28-28-1x1-192-28-28-128-0x0-1x1-1x1-0-NCHW-FP32-W=ConvAsmBwdWrW1x1:4,4,2,4,2,1,4,4,0,1
384-35-35-1x1-64-35-35-1-0x0-1x1-1x1-0-NCHW-FP16-F=ConvAsm1x1U:1,8,2,64,1,4,4,1;ConvOclDirectFwd1x1:1,64,1,1,0,1,4,4,0
192-56-56-1x1-384-56-56-16-0x0-1x1-1x1-0-NCHW-FP32-B=ConvAsm1x1U:1,32,1,64,1,1,1,1;ConvOclDirectFwd1x1:1,256,1,1,0,1,32,4,0
256-56-56-3x3-256-56-56-32-1x1-1x1-1x1-0-NCHW-FP16-B=ConvOclDirectFwd:16,16,32,32,2,2,8,1,1
384-13-13-3x3-384-13-13-64-1x1-1x1-1x1-0-NCHW-FP16-B=ConvOclDirectFwd:8,8,16,16,2,2,8,2,2
16-14-14-1x1-480-14-14-1-0x0-1x1-1x1-0-NCHW-FP16-B=ConvAsm1x1U:1,8,2,64,1,2,2,1;ConvOclDirectFwd1x1:1,128,1,1,0,4,4,4,0
960-14-14-1x1-192-14-14-16-0x0-1x1-1x1-0-NCHW-FP16-F=ConvAsm1x1U:2,8,4,64,1,4,4,2;ConvOclDirectFwd1x1:1,64,1,1,0,4,8,4,0
192-8-8-1x1-2048-8-8-4-0x0-1x1-1x1-0-NCHW-FP32-B=ConvAsm1x1U:1,8,1,64,1,4,1,4;ConvOclDirectFwd1x1:1,128,1,1,0,4,8,8,0
256-56-56-1x1-512-28-28-64-0x0-2x2-1x1-0-NCHW-FP16-F=ConvAsm1x1U:1,8,2,32,2,4,1,4;ConvOclDirectFwd1x1:1,256,1,1,0,2,32,4,0
128-7-7-5x5-32-7-7-256-2x2-1x1-1x1-0-NCHW-FP16-B=ConvOclDirectFwd:8,8,8,8,1,1,4,4,1
64-35-35-5x5-48-35-35-8-2x2-1x1-1x1-0-NCHW-FP16-B=ConvOclDirectFwd:16,8,16,16,1,2,8,4,2
192-14-14-1x1-1248-14-14-16-0x0-1x1-1x1-0-NCHW-FP32-B=ConvAsm1x1U:1,16,1,32,2,2,2,2;ConvOclDirectFwd1x1:1,128,1,1,0,4,16,4,0
1024-17-17-1x1-384-17-17-16-0x0-1x1-1x1-0-NCHW-FP32-F=ConvAsm1x1U:3,16,4,16,2,2,1,2;ConvActivAsm1x1U:2,16,2,32,4,1;ConvOclDirectFwd1x1:1,64,1,1,1,4,32,2048,0
256-14-14-1x1-528-14-14-1-0x0-1x1-1x1-0-NCHW-FP16-B=ConvAsm1x1U:1,8,2,64,1,4,4,1;ConvOclDirectFwd1x1:1,128,1,1,0,4,4,4,0
256-14-14-3x3-256-14-14-128-1x1-1x1-1x1-0-NCHW-FP16-W=ConvAsmBwdWrW3x3:0,1,8,4,6,1
832-7-7-1x1-192-7-7-16-0x0-1x1-1x1-0-NCHW-FP32-F=ConvAsm1x1U:2,8,2,32,1,4,2,2;ConvActivAsm1x1U:2,16,4,16,1,4;ConvOclDirectFwd1x1:1,64,1,1,1,0,16,128,0
256-7-7-1x1-832-7-7-8-0x0-1x1-1x1-0-NCHW-FP16-W=ConvAsmBwdWrW1x1:1,16,2,8,2,1,2,4,0,0
256-28-28-1x1-128-28-28-8-0x0-1x1-1x1-0-NCHW-FP32-F=ConvAsm1x1U:2,16,2,64,2,2,2,1;ConvActivAsm1x1U:1,16,1,32,4,2;ConvOclDirectFwd1x1:1,64,1,1,1,4,16,2048,0
288-35-35-1x1-64-35-35-64-0x0-1x1-1x1-0-NCHW-FP32-F=ConvAsm1x1U:2,16,2,64,3,2,2,2;ConvActivAsm1x1U:2,16,2,64,2,1;ConvOclDirectFwd1x1:1,64,1,1,1,4,16,2048,0
192-14-14-1x1-576-14-14-16-0x0-1x1-1x1-0-NCHW-FP16-B=ConvAsm1x1U:1,16,2,16,1,2,2,2;ConvOclDirectFwd1x1:1,256,1,1,0,4,16,4,0
512-7-7-3x3-512-7-7-8-1x1-1x1-1x1-0-NCHW-FP16-W=ConvAsmBwdWrW3x3:0,0,8,4,2,1
1024-14-14-1x1-512-7-7-8-0x0-2x2-1x1-0-NCHW-FP16-F=ConvAsm1x1U:1,8,4,16,1,4,4,1;ConvOclDirectFwd1x1:1,256,1,1,0,1,8,4,0
256-14-14-1x1-1024-14-14-256-0x0-1x1-1x1-0-NCHW-FP16-W=ConvAsmBwdWrW1x1:2,8,4,8,2,1,1,4,0,1
1824-7-7-1x1-192-7-7-16-0x0-1x1-1x1-0-NCHW-FP32-F=ConvAsm1x1U:4,8,4,16,1,4,4,2;ConvActivAsm1x1U:4,16,4,16,1,4;ConvOclDirectFwd1x1:1,64,1,1,1,4,16,256,0
480-14-14-1x1-96-14-14-512-0x0-1x1-1x1-0-NCHW-FP32-F=ConvAsm1x1U:4,16,4,64,1,2,1,1;ConvActivAsm1x1U:4,32,7,32,1,1;ConvOclDirectFwd1x1:1,64,1,1,1,1,64,2048,0
192-27-27-5x5-64-27-27-256-2x2-1x1-1x1-0-NCHW-FP16-B=ConvOclDirectFwd:16,16,32,32,2,2,8,2,1
528-14-14-1x1-160-14-14-512-0x0-1x1-1x1-0-NCHW-FP16-F=ConvAsm1x1U:1,8,2,64,2,4,1,4;ConvOclDirectFwd1x1:8,64,16,16,0,2,16,4,1
32-28-28-1x1-192-28-28-128-0x0-1x1-1x1-0-NCHW-FP16-W=ConvAsmBwdWrW1x1:4,4,4,1,8,2,4,4,0,1
64-12-120-3x3-32-12-120-16-1x1-1x1-1x1-0-NCHW-FP16-W=ConvAsmBwdWrW3x3:0,0,16,1,2,2
192-28-28-1x1-32-28-28-8-0x0-1x1-1x1-0-NCHW-FP32-F=ConvAsm1x1U:1,8,1,16,1,4,2,1;ConvActivAsm1x1U:1,16,2,32,1,4;ConvOclDirectFwd1x1:1,64,1,1,1,0,16,64,0
16-28-28-5x5-32-28-28-8-2x2-1x1-1x1-0-NCHW-FP32-F=ConvOclDirectFwd:16,16,32,32,2,2,2,2,2;ConvOclDirectFwdFused:16,16,32,32,2,2,2,4,2
48-35-35-1x1-288-35-35-256-0x0-1x1-1x1-0-NCHW-FP16-F=ConvAsm1x1U:2,8,4,64,1,4,1,4;ConvOclDirectFwd1x1:1,256,1,1,0,1,32,4,0
96-14-14-1x1-480-14-14-256-0x0-1x1-1x1-0-NCHW-FP32-B=ConvAsm1x1U:1,16,1,64,4,2,1,2;ConvOclDirectFwd1x1:1,256,1,1,0,1,32,4,0
64-35-35-1x1-256-35-35-128-0x0-1x1-1x1-0-NCHW-FP16-B=ConvAsm1x1U:1,16,2,16,1,2,1,2;ConvOclDirectFwd1x1:1,256,1,1,0,1,32,4,0
512-28-28-3x3-512-28-28-16-1x1-1x1-1x1-0-NCHW-FP32-W=ConvAsmBwdWrW3x3:0,1,8,4,2,1
832-7-7-1x1-48-7-7-256-0x0-1x1-1x1-0-NCHW-FP32-F=ConvAsm1x1U:1,16,1,64,4,2,4,1;ConvActivAsm1x1U:1,16,2,32,2,3;ConvOclDirectFwd1x1:1,64,1,1,1,1,32,2048,0
160-14-14-3x3-128-14-14-32-1x1-1x1-1x1-0-NCHW-FP32-W=ConvAsmBwdWrW3x3:0,0,8,2,3,1
24-14-14-1x1-512-14-14-256-0x0-1x1-1x1-0-NCHW-FP32-B=ConvAsm1x1U:1,8,1,64,1,2,1,4;ConvOclDirectFwd1x1:1,256,1,1,0,2,32,4,0
384-13-13-3x3-256-13-13-1-1x1-1x1-1x1-0-NCHW-FP16-F=ConvOclDirectFwd:16,16,16,16,1,1,1,4,1;ConvOclDirectFwdFused:16,16,16,16,1,1,2,4,1
384-17-17-3x3-384-35-35-4-0x0-2x2-1x1-0-NCHW-FP32-B=ConvOclDirectFwd:16,16,16,16,1,1,4,1,2
192-71-71-3x3-80-73-73-256-0x0-1x1-1x1-0-NCHW-FP16-B=ConvOclDirectFwd:8,16,16,32,2,2,8,2,2
448-8-8-1x1-1280-8-8-8-0x0-1x1-1x1-0-NCHW-FP16-W=ConvAsmBwdWrW1x1:1,16,2,8,2,1,2,4,0,1
32-14-14-1x1-528-14-14-256-0x0-1x1-1x1-0-NCHW-FP32-B=ConvAsm1x1U:1,16,1,64,1,2,2,1;ConvOclDirectFwd1x1:1,256,1,1,0,4,16,8,0
192-35-35-3x3-224-35-35-256-1x1-1x1-1x1-0-NCHW-FP16-F=ConvOclDirectFwd:8,8,16,16,2,2,8,2,1;ConvOclDirectFwdFused:8,8,16,16,2,2,8,2,1
384-7-7-3x3-192-7-7-64-1x1-1x1-1x1-0-NCHW-FP16-W=ConvAsmBwdWrW3x3:0,0,8,4,4,1
320-8-8-1x1-2048-8-8-64-0x0-1x1-1x1-0-NCHW-FP16-W=ConvAsmBwdWrW1x1:2,8,4,8,2,2,1,4,0,1
112-14-14-1x1-512-14-14-1-0x0-1x1-1x1-0-NCHW-FP16-B=ConvAsm1x1U:1,8,2,64,1,2,4,1;ConvOclDirectFwd1x1:1,256,1,1,0,4,4,8,0
80-73-73-3x3-192-71-71-32-0x0-1x1-1x1-0-NCHW-FP16-F=ConvOclDirectFwd:8,8,16,16,2,2,8,2,2;ConvOclDirectFwdFused:8,8,16,16,2,2,8,2,2
192-7-7-1x1-832-7-7-4-0x0-1x1-1x1-0-NCHW-FP16-W=ConvAsmBwdWrW1x1:4,4,2,4,2,1,1,2,0,1
112-14-14-1x1-512-14-14-1-0x0-1x1-1x1-0-NCHW-FP32-B=ConvAsm1x1U:1,8,1,64,1,2,4,2;ConvOclDirectFwd1x1:1,256,1,1,0,4,4,8,0
64-14-14-5x5-32-14-14-512-2x2-1x1-1x1-0-NCHW-FP16-B=ConvOclDirectFwd:8,8,16,16,2,2,8,2,2
256-19-87-5x5-128-40-175-16-1x1-2x2-1x1-0-NCHW-FP32-B=ConvOclDirectFwd:16,32,16,32,1,1,4,2,1
512-7-7-1x1-512-7-7-1-0x0-1x1-1x1-0-NCHW-FP16-F=ConvAsm1x1U:1,8,2,16,1,4,4,1;ConvOclDirectFwd1x1:1,128,1,1,0,1,4,8,0
768-17-17-1x1-128-17-17-256-0x0-1x1-1x1-0-NCHW-FP16-W=ConvAsmBwdWrW1x1:2,8,4,8,2,2,4,4,0,2
144-14-14-3x3-288-14-14-512-1x1-1x1-1x1-0-NCHW-FP16-F=ConvOclDirectFwd:8,8,16,16,2,2,8,1,1;ConvOclDirectFwdFused:8,8,16,16,2,2,8,4,1
64-73-73-1x1-160-73-73-32-0x0-1x1-1x1-0-NCHW-FP32-W=ConvAsmBwdWrW1x1:4,4,4,2,8,2,4,4,0,2
128-40-175-3x3-128-40-175-1-1x1-1x1-1x1-0-NCHW-FP16-F=ConvOclDirectFwd:8,32,16,32,2,1,8,4,1
64-80-350-3x3-64-80-350-16-1x1-1x1-1x1-0-NCHW-FP16-W=ConvAsmBwdWrW3x3:0,1,16,2,1,8
192-7-7-3x3-384-7-7-64-1x1-1x1-1x1-0-NCHW-FP16-F=ConvOclDirectFwd:8,8,8,8,1,1,8,4,2;ConvOclDirectFwdFused:8,8,8,8,1,1,8,4,2
320-28-28-1x1-128-28-28-64-0x0-1x1-1x1-0-NCHW-FP32-F=ConvAsm1x1U:2,16,2,32,2,2,1,4;ConvActivAsm1x1U:2,16,3,32,2,1;ConvOclDirectFwd1x1:1,64,1,1,1,0,32,2048,0
832-7-7-1x1-192-7-7-256-0x0-1x1-1x1-0-NCHW-FP32-F=ConvAsm1x1U:2,16,2,32,2,2,1,1;ConvActivAsm1x1U:1,16,1,64,4,1;ConvOclDirectFwd1x1:1,64,1,1,1,0,16,2048,0
576-14-14-1x1-160-14-14-32-0x0-1x1-1x1-0-NCHW-FP32-F=ConvAsm1x1U:4,16,5,16,1,2,2,1;ConvActivAsm1x1U:3,16,5,16,1,2;ConvOclDirectFwd1x1:1,64,1,1,1,4,16,2048,0
192-17-17-1x1-1024-17-17-64-0x0-1x1-1x1-0-NCHW-FP16-W=ConvAsmBwdWrW1x1:4,4,4,4,4,1,1,2,0,1
48-35-35-1x1-256-35-35-1-0x0-1x1-1x1-0-NCHW-FP16-B=ConvAsm1x1U:1,8,2,64,1,2,2,8;ConvOclDirectFwd1x1:1,64,1,1,0,1,4,4,0
1280-8-8-1x1-320-8-8-4-0x0-1x1-1x1-0-NCHW-FP16-F=ConvAsm1x1U:1,8,2,32,1,4,4,1;ConvOclDirectFwd1x1:1,64,1,1,0,1,4,8,0
64-35-35-1x1-256-35-35-64-0x0-1x1-1x1-0-NCHW-FP32-W=ConvAsmBwdWrW1x1:4,4,4,4,4,1,4,4,0,1
512-28-28-3x3-512-28-28-64-1x1-1x1-1x1-0-NCHW-FP16-B=ConvOclDirectFwd:16,16,32,32,2,2,8,1,1
128-4-4-1x1-576-4-4-32-0x0-1x1-1x1-0-NCHW-FP32-W=ConvAsmBwdWrW1x1:1,16,2,4,4,1,2,4,0,0
112-14-14-1x1-512-14-14-4-0x0-1x1-1x1-0-NCHW-FP16-W=ConvAsmBwdWrW1x1:4,4,4,2,2,2,1,4,0,0
64-56-56-1x1-64-56-56-1-0x0-1x1-1x1-0-NCHW-FP16-B=ConvAsm1x1U:1,8,2,64,1,2,4,2;ConvOclDirectFwd1x1:1,64,1,1,0,1,8,8,0
192-8-8-3x3-192-17-17-1-0x0-2x2-1x1-0-NCHW-FP32-B=ConvOclDirectFwd:8,16,32,32,4,2,1,4,1
512-7-7-1x1-1024-14-14-128-0x0-2x2-1x1-0-NCHW-FP32-B=ConvAsm1x1U:1,16,1,64,2,2,2,2;ConvOclDirectFwd1x1:1,256,1,1,0,1,32,4,0
256-14-14-1x1-1024-14-14-2-0x0-1x1-1x1-0-NCHW-FP32-B=ConvAsm1x1U:1,16,1,64,2,2,2,2;ConvOclDirectFwd1x1:1,128,1,1,0,4,8,8,0
48-35-35-1x1-256-35-35-8-0x0-1x1-1x1-0-NCHW-FP16-B=ConvAsm1x1U:1,16,2,16,1,2,1,2;ConvOclDirectFwd1x1:1,256,1,1,0,1,16,4,0
96-128-256-3x3-128-128-256-1-1x1-1x1-1x1-0-NCHW-FP16-F=ConvOclDirectFwd:16,16,32,32,2,2,8,1,1
64-56-56-1x1-256-56-56-64-0x0-1x1-1x1-0-NCHW-FP16-W=ConvAsmBwdWrW1x1:4,4,8,1,8,1,4,4,0,1
256-8-8-1x1-1536-8-8-4-0x0-1x1-1x1-0-NCHW-FP16-B=ConvAsm1x1U:1,8,2,32,1,2,4,1;ConvOclDirectFwd1x1:1,64,1,1,0,2,4,8,0
128-28-28-1x1-512-28-28-1-0x0-1x1-1x1-0-NCHW-FP32-W=ConvAsmBwdWrW1x1:2,8,2,4,2,1,1,4,0,1
512-28-28-1x1-128-28-28-1-0x0-1x1-1x1-0-NCHW-FP16-F=ConvAsm1x1U:1,8,2,64,1,4,4,1;ConvOclDirectFwd1x1:1,64,1,1,0,1,4,8,0
192-28-28-1x1-16-28-28-64-0x0-1x1-1x1-0-NCHW-FP16-F=ConvAsm1x1U:1,8,2,64,1,4,2,1;ConvOclDirectFwd1x1:1,64,1,1,0,4,16,8,0
96-14-14-1x1-480-14-14-8-0x0-1x1-1x1-0-NCHW-FP16-B=ConvAsm1x1U:1,16,2,16,1,2,2,8;ConvOclDirectFwd1x1:1,256,1,1,0,4,8,4,0
32-35-35-1x1-192-35-35-64-0x0-1x1-1x1-0-NCHW-FP16-W=ConvAsmBwdWrW1x1:4,4,4,4,2,1,4,4,0,1
64-128-256-1x1-192-128-256-1-0x0-1x1-1x1-0-NCHW-FP32-B=ConvOclDirectFwd1x1:1,256,1,1,0,4,16,4,0
32-149-149-3x3-3-299-299-32-0x0-2x2-1x1-0-NCHW-FP32-B=ConvOclDirectFwd:16,16,32,32,2,2,8,2,1
1024-14-14-1x1-512-28-28-1-0x0-2x2-1x1-0-NCHW-FP16-W=ConvAsmBwdWrW1x1:1,16,2,4,4,1,1,2,0,0
528-14-14-1x1-128-14-14-32-0x0-1x1-1x1-0-NCHW-FP32-F=ConvAsm1x1U:4,16,4,64,1,2,2,1;ConvOclDirectFwd1x1:1,64,1,1,1,4,16,2048,0
832-7-7-1x1-160-7-7-1-0x0-1x1-1x1-0-NCHW-FP32-F=ConvAsm1x1U:1,8,1,16,1,4,4,1;ConvActivAsm1x1U:1,16,1,16,1,4;ConvOclDirectFwd1x1:1,64,1,1,1,0,16,64,0
80-73-73-3x3-192-71-71-4-0x0-1x1-1x1-0-NCHW-FP32-F=ConvOclDirectFwd:16,8,16,16,1,2,8,4,2
160-73-73-1x1-64-73-73-8-0x0-1x1-1x1-0-NCHW-FP16-F=ConvAsm1x1U:3,8,6,64,1,4,2,2;ConvOclDirectFwd1x1:16,64,32,32,0,1,16,4,1
288-35-35-1x1-48-35-35-256-0x0-1x1-1x1-0-NCHW-FP16-B=ConvAsm1x1U:1,16,2,64,1,2,1,1;ConvOclDirectFwd1x1:1,128,1,1,0,1,16,4,0
512-4-4-3x3-512-7-7-16-1x1-2x2-1x1-0-NCHW-FP32-W=ConvAsmBwdWrW3x3:0,0,8,4,7,1
64-128-256-1x1-256-128-256-1-0x0-1x1-1x1-0-NCHW-FP16-W=ConvAsmBwdWrW1x1:4,4,4,2,2,1,1,4,0,3
512-14-14-1x1-128-28-28-2-0x0-2x2-1x1-0-NCHW-FP32-W=ConvAsmBwdWrW1x1:1,16,2,4,2,1,1,4,0,1
1280-8-8-1x1-192-8-8-32-0x0-1x1-1x1-0-NCHW-FP32-F=ConvAsm1x1U:2,8,2,32,1,4,1,4;ConvActivAsm1x1U:2,16,2,32,4,4;ConvOclDirectFwd1x1:1,64,1,1,1,0,32,256,0
64-56-56-3x3-192-56-56-16-1x1-1x1-1x1-0-NCHW-FP16-F=ConvOclDirectFwd:32,8,32,32,1,4,8,1,2;ConvOclDirectFwdFused:32,8,32,32,1,4,8,1,2
512-14-14-1x1-128-14-14-4-0x0-1x1-1x1-0-NCHW-FP16-F=ConvAsm1x1U:1,8,2,16,1,4,4,1;ConvOclDirectFwd1x1:1,256,1,1,0,4,4,4,0
128-4-4-1x1-576-4-4-32-0x0-1x1-1x1-0-NCHW-FP16-B=ConvAsm1x1U:2,4,4,4,1,2,4,1;ConvOclDirectFwd1x1:1,128,1,1,0,1,4,4,0
128-28-28-1x1-256-56-56-2-0x0-2x2-1x1-0-NCHW-FP32-W=ConvAsmBwdWrW1x1:4,4,4,4,2,1,2,4,0,0
2048-8-8-1x1-320-8-8-4-0x0-1x1-1x1-0-NCHW-FP16-F=ConvAsm1x1U:1,8,2,16,1,4,4,1;ConvOclDirectFwd1x1:1,64,1,1,0,1,4,4,0
128-14-14-1x1-512-14-14-32-0x0-1x1-1x1-0-NCHW-FP16-B=ConvAsm1x1U:1,16,2,16,1,2,2,2;ConvOclDirectFwd1x1:1,64,1,1,0,4,8,4,0
480-14-14-1x1-16-14-14-1-0x0-1x1-1x1-0-NCHW-FP32-F=ConvAsm1x1U:1,8,1,16,1,4,4,1;ConvActivAsm1x1U:1,16,1,16,1,3;ConvOclDirectFwd1x1:1,64,1,1,1,4,64,64,0
352-7-7-1x1-1024-7-7-64-0x0-1x1-1x1-0-NCHW-FP32-W=ConvAsmBwdWrW1x1:1,16,2,8,4,1,2,4,0,2
512-7-7-1x1-512-7-7-2-0x0-1x1-1x1-0-NCHW-FP32-F=ConvAsm1x1U:1,8,1,64,1,4,4,1;ConvOclDirectFwd1x1:1,64,1,1,1,4,16,64,0
64-35-35-3x3-96-35-35-64-1x1-1x1-1x1-0-NCHW-FP16-F=ConvOclDirectFwd:8,8,16,16,2,2,8,2,2;ConvOclDirectFwdFused:8,8,16,16,2,2,8,2,2
256-7-7-1x1-832-7-7-64-0x0-1x1-1x1-0-NCHW-FP16-B=ConvAsm1x1U:1,16,2,32,1,2,2,2;ConvOclDirectFwd1x1:1,256,1,1,0,1,16,4,0
320-14-14-3x3-160-14-14-512-1x1-1x1-1x1-0-NCHW-FP16-W=ConvAsmBwdWrW3x3:0,1,8,4,5,4
32-28-28-1x1-256-28-28-64-0x0-1x1-1x1-0-NCHW-FP16-B=ConvAsm1x1U:1,16,2,16,1,2,1,4;ConvOclDirectFwd1x1:1,64,1,1,0,4,16,4,0
256-20-84-3x3-256-20-84-16-1x1-1x1-1x1-0-NCHW-FP16-W=ConvAsmBwdWrW3x3:0,1,8,2,1,1
64-14-14-1x1-512-14-14-256-0x0-1x1-1x1-0-NCHW-FP32-W=ConvAsmBwdWrW1x1:2,8,4,8,2,1,4,4,0,2
384-8-8-1x1-1280-8-8-8-0x0-1x1-1x1-0-NCHW-FP16-W=ConvAsmBwdWrW1x1:1,16,4,4,4,1,1,4,0,0
1-161-700-5x20-32-79-341-4-0x0-2x2-1x1-0-NCHW-FP32-F=ConvOclDirectFwd:8,32,16,32,2,1,1,1,2
224-35-35-3x3-192-35-35-1-1x1-1x1-1x1-0-NCHW-FP16-B=ConvOclDirectFwd:16,8,16,16,1,2,4,2,1
160-14-14-3x3-128-28-28-32-1x1-2x2-1x1-0-NCHW-FP32-B=ConvOclDirectFwd:8,8,32,32,4,4,4,4,1
64-14-14-1x1-480-14-14-64-0x0-1x1-1x1-0-NCHW-FP32-B=ConvAsm1x1U:1,16,1,64,2,2,1,1;ConvOclDirectFwd1x1:1,256,1,1,0,2,16,4,0
384-13-13-3x3-192-13-13-8-1x1-1x1-1x1-0-NCHW-FP16-W=ConvAsmBwdWrW3x3:0,0,8,4,3,1
192-28-28-1x1-96-28-28-1-0x0-1x1-1x1-0-NCHW-FP32-F=ConvAsm1x1U:1,8,1,64,1,2,4,1;ConvActivAsm1x1U:1,16,1,64,1,4;ConvOclDirectFwd1x1:1,64,1,1,1,1,16,2048,0
24-14-14-1x1-512-14-14-128-0x0-1x1-1x1-0-NCHW-FP32-W=ConvAsmBwdWrW1x1:4,4,4,4,4,1,4,4,0,2
192-56-56-1x1-192-56-56-16-0x0-1x1-1x1-0-NCHW-FP32-W=ConvAsmBwdWrW1x1:4,4,4,4,8,2,2,4,0,1
256-14-14-3x3-256-14-14-32-1x1-1x1-1x1-0-NCHW-FP32-W=ConvAsmBwdWrW3x3:0,1,8,4,9,1
64-56-56-1x1-64-56-56-4-0x0-1x1-1x1-0-NCHW-FP16-W=ConvAsmBwdWrW1x1:4,4,2,1,8,1,4,4,0,1
320-8-8-1x1-2048-8-8-4-0x0-1x1-1x1-0-NCHW-FP16-W=ConvAsmBwdWrW1x1:1,16,2,4,2,1,1,4,0,0
32-14-14-1x1-528-14-14-64-0x0-1x1-1x1-0-NCHW-FP32-W=ConvAsmBwdWrW1x1:2,8,2,4,4,1,2,4,0,3
1280-8-8-1x1-384-8-8-4-0x0-1x1-1x1-0-NCHW-FP16-F=ConvAsm1x1U:1,8,2,16,1,4,4,1;ConvOclDirectFwd1x1:1,128,1,1,0,1,4,8,0
192-14-14-1x1-1152-14-14-16-0x0-1x1-1x1-0-NCHW-FP32-W=ConvAsmBwdWrW1x1:2,8,4,8,4,1,1,4,0,1
192-14-14-1x1-608-14-14-64-0x0-1x1-1x1-0-NCHW-FP32-W=ConvAsmBwdWrW1x1:2,8,4,8,4,1,2,4,0,1
192-35-35-1x1-384-35-35-1-0x0-1x1-1x1-0-NCHW-FP16-W=ConvAsmBwdWrW1x1:4,4,4,4,2,1,1,4,0,0
320-14-14-3x3-160-14-14-1-1x1-1x1-1x1-0-NCHW-FP16-B=ConvOclDirectFwd:16,16,16,16,1,1,1,4,1
128-28-28-1x1-512-28-28-8-0x0-1x1-1x1-0-NCHW-FP32-W=ConvAsmBwdWrW1x1:2,8,4,4,4,2,2,4,0,1
384-7-7-1x1-832-7-7-512-0x0-1x1-1x1-0-NCHW-FP32-W=ConvAsmBwdWrW1x1:1,16,2,8,4,1,4,4,0,2
32-28-28-5x5-16-28-28-128-2x2-1x1-1x1-0-NCHW-FP32-B=ConvOclDirectFwd:16,16,32,32,2,2,4,2,2
48-28-28-3x3-192-28-28-16-1x1-1x1-1x1-0-NCHW-FP16-B=ConvOclDirectFwd:16,16,32,32,2,2,8,1,2
24-14-14-1x1-512-14-14-1-0x0-1x1-1x1-0-NCHW-FP32-W=ConvAsmBwdWrW1x1:4,4,2,1,2,1,1,4,0,1
1024-14-14-1x1-512-14-14-32-0x0-1x1-1x1-0-NCHW-FP32-F=ConvAsm1x1U:3,16,4,64,1,2,1,8;ConvOclDirectFwd1x1:1,64,1,1,1,1,32,2048,0
256-128-256-1x1-64-128-256-1-0x0-1x1-1x1-0-NCHW-FP16-F=ConvOclDirectFwd1x1:1,256,1,1,0,4,16,4,0
192-7-7-1x1-1024-7-7-64-0x0-1x1-1x1-0-NCHW-FP32-W=ConvAsmBwdWrW1x1:1,16,2,4,8,1,1,4,0,3
1024-14-14-1x1-256-14-14-1-0x0-1x1-1x1-0-NCHW-FP32-B=ConvAsm1x1U:1,8,1,64,1,4,4,1;ConvOclDirectFwd1x1:1,256,1,1,0,4,4,8,0
256-14-14-1x1-512-28-28-32-0x0-2x2-1x1-0-NCHW-FP16-B=ConvAsm1x1U:1,16,2,16,1,2,2,4;ConvOclDirectFwd1x1:1,64,1,1,0,1,32,4,0
384-13-13-3x3-256-13-13-512-1x1-1x1-1x1-0-NCHW-FP16-F=ConvOclDirectFwd:8,8,16,16,2,2,8,1,2;ConvOclDirectFwdFused:8,8,16,16,2,2,8,1,1
96-14-14-1x1-480-14-14-32-0x0-1x1-1x1-0-NCHW-FP32-B=ConvAsm1x1U:1,16,1,32,2,2,1,2;ConvOclDirectFwd1x1:1,128,1,1,0,2,16,4,0
32-28-28-1x1-256-28-28-1-0x0-1x1-1x1-0-NCHW-FP32-W=ConvAsmBwdWrW1x1:4,4,2,2,2,1,1,4,0,1
384-35-35-1x1-96-35-35-1-0x0-1x1-1x1-0-NCHW-FP16-F=ConvAsm1x1U:1,8,2,64,1,4,4,1;ConvOclDirectFwd1x1:1,64,1,1,0,1,4,4,0
192-56-56-1x1-144-56-56-16-0x0-1x1-1x1-0-NCHW-FP16-B=ConvAsm1x1U:1,8,2,32,1,4,2,2;ConvOclDirectFwd1x1:1,128,1,1,0,4,16,4,0
384-7-7-3x3-192-7-7-1-1x1-1x1-1x1-0-NCHW-FP16-B=ConvOclDirectFwd:8,8,8,8,1,1,1,4,1
528-14-14-1x1-32-14-14-512-0x0-1x1-1x1-0-NCHW-FP16-F=ConvAsm1x1U:2,8,4,64,1,4,2,2;ConvOclDirectFwd1x1:1,64,1,1,0,4,16,4,0
2048-8-8-1x1-384-8-8-8-0x0-1x1-1x1-0-NCHW-FP16-F=ConvAsm1x1U:2,8,4,16,1,4,4,1;ConvOclDirectFwd1x1:1,64,1,1,0,2,4,4,0
256-17-17-1x1-1024-17-17-64-0x0-1x1-1x1-0-NCHW-FP32-W=ConvAsmBwdWrW1x1:2,8,4,4,8,1,1,4,0,1
512-7-7-3x3-512-4-4-64-1x1-2x2-1x1-0-NCHW-FP32-F=ConvOclDirectFwd:8,8,8,8,1,1,8,2,1
512-28-28-3x3-256-28-28-64-1x1-1x1-1x1-0-NCHW-FP16-W=ConvAsmBwdWrW3x3:0,1,8,8,1,1
512-14-14-1x1-144-14-14-512-0x0-1x1-1x1-0-NCHW-FP32-F=ConvAsm1x1U:4,8,7,32,2,2,1,2;ConvActivAsm1x1U:3,16,7,32,1,1;ConvOclDirectFwd1x1:1,64,1,1,1,1,16,2048,0
64-256-512-1x1-64-256-512-1-0x0-1x1-1x1-0-NCHW-FP16-W=ConvAsmBwdWrW1x1:4,4,2,1,4,1,1,4,0,3
384-8-8-3x3-448-8-8-16-1x1-1x1-1x1-0-NCHW-FP16-W=ConvAsmBwdWrW3x3:0,0,8,4,2,1
192-14-14-1x1-1056-14-14-16-0x0-1x1-1x1-0-NCHW-FP32-W=ConvAsmBwdWrW1x1:2,8,4,4,8,1,1,4,0,1
64-35-35-1x1-256-35-35-8-0x0-1x1-1x1-0-NCHW-FP32-W=ConvAsmBwdWrW1x1:4,4,4,2,2,1,1,4,0,1
256-56-56-3x3-256-56-56-8-1x1-1x1-1x1-0-NCHW-FP32-W=ConvAsmBwdWrW3x3:0,1,8,4,2,1
512-7-7-1x1-1024-14-14-256-0x0-2x2-1x1-0-NCHW-FP16-W=ConvAsmBwdWrW1x1:1,16,4,8,2,1,1,2,0,2
64-73-73-1x1-160-73-73-8-0x0-1x1-1x1-0-NCHW-FP32-W=ConvAsmBwdWrW1x1:4,4,4,4,4,1,4,4,0,1
1280-8-8-1x1-448-8-8-32-0x0-1x1-1x1-0-NCHW-FP16-F=ConvAsm1x1U:1,8,2,32,2,4,2,4;ConvOclDirectFwd1x1:1,64,1,1,0,2,8,4,0
512-7-7-1x1-2048-7-7-8-0x0-1x1-1x1-0-NCHW-FP32-B=ConvAsm1x1U:2,16,2,32,1,2,2,1;ConvOclDirectFwd1x1:1,64,1,1,0,1,16,4,0
2048-7-7-1x1-512-7-7-256-0x0-1x1-1x1-0-NCHW-FP16-W=ConvAsmBwdWrW1x1:1,16,4,8,2,1,1,2,0,3
96-35-35-1x1-384-35-35-4-0x0-1x1-1x1-0-NCHW-FP16-B=ConvAsm1x1U:1,16,2,32,1,2,2,2;ConvOclDirectFwd1x1:1,128,1,1,0,1,4,4,0
2048-7-7-1x1-1024-14-14-4-0x0-2x2-1x1-0-NCHW-FP32-W=ConvAsmBwdWrW1x1:1,16,2,4,8,1,1,4,0,2
192-7-7-1x1-1248-7-7-16-0x0-1x1-1x1-0-NCHW-FP32-W=ConvAsmBwdWrW1x1:1,16,2,4,8,1,1,4,0,2
64-56-56-1x1-64-56-56-8-0x0-1x1-1x1-0-NCHW-FP32-W=ConvAsmBwdWrW1x1:4,4,4,4,2,1,4,4,0,1
192-7-7-1x1-832-7-7-128-0x0-1x1-1x1-0-NCHW-FP16-B=ConvAsm1x1U:1,16,2,16,1,2,2,2;ConvOclDirectFwd1x1:1,128,1,1,0,1,8,4,0
64-14-14-1x1-480-14-14-4-0x0-1x1-1x1-0-NCHW-FP32-W=ConvAsmBwdWrW1x1:2,8,2,4,4,1,4,4,0,0
1024-14-14-1x1-256-14-14-32-0x0-1x1-1x1-0-NCHW-FP32-W=ConvAsmBwdWrW1x1:1,16,4,8,4,1,2,4,0,1
256-56-56-1x1-64-56-56-2-0x0-1x1-1x1-0-NCHW-FP16-F=ConvAsm1x1U:1,8,2,32,1,4,4,1;ConvOclDirectFwd1x1:1,64,1,1,0,2,8,4,0
64-14-14-5x5-32-14-14-32-2x2-1x1-1x1-0-NCHW-FP16-B=ConvOclDirectFwd:8,16,16,16,2,1,2,4,2
1280-8-8-1x1-448-8-8-256-0x0-1x1-1x1-0-NCHW-FP32-F=ConvAsm1x1U:1,16,1,64,4,2,1,8;ConvActivAsm1x1U:4,16,4,16,3,2;ConvOclDirectFwd1x1:1,64,1,1,1,0,32,2048,0
512-14-14-1x1-24-14-14-128-0x0-1x1-1x1-0-NCHW-FP16-F=ConvAsm1x1U:2,8,4,64,1,4,4,1;ConvOclDirectFwd1x1:1,128,1,1,0,4,8,4,0
192-14-14-1x1-480-14-14-16-0x0-1x1-1x1-0-NCHW-FP32-B=ConvAsm1x1U:1,16,1,32,2,2,2,2;ConvOclDirectFwd1x1:1,64,1,1,0,4,16,4,0
192-28-28-1x1-624-28-28-16-0x0-1x1-1x1-0-NCHW-FP32-B=ConvAsm1x1U:1,16,1,32,2,2,1,2;ConvOclDirectFwd1x1:1,128,1,1,0,4,16,4,0
96-71-71-3x3-64-73-73-8-0x0-1x1-1x1-0-NCHW-FP16-B=ConvOclDirectFwd:16,8,16,16,1,2,8,1,2
192-28-28-1x1-16-28-28-512-0x0-1x1-1x1-0-NCHW-FP16-F=ConvAsm1x1U:1,8,2,64,1,4,4,1;ConvOclDirectFwd1x1:1,256,1,1,0,4,16,4,0
64-27-27-5x5-192-27-27-512-2x2-1x1-1x1-0-NCHW-FP16-F=ConvOclDirectFwd:16,16,32,32,2,2,8,2,2;ConvOclDirectFwdFused:16,16,32,32,2,2,8,1,1
128-7-7-5x5-32-7-7-128-2x2-1x1-1x1-0-NCHW-FP16-B=ConvOclDirectFwd:8,8,8,8,1,1,4,4,2
64-56-56-3x3-64-56-56-8-1x1-1x1-1x1-0-NCHW-FP16-W=ConvAsmBwdWrW3x3:0,0,16,2,2,4
224-14-14-3x3-112-14-14-256-1x1-1x1-1x1-0-NCHW-FP16-B=ConvOclDirectFwd:8,8,16,16,2,2,8,2,2
512-14-14-1x1-144-14-14-8-0x0-1x1-1x1-0-NCHW-FP16-F=ConvAsm1x1U:1,8,2,16,1,2,4,1;ConvOclDirectFwd1x1:1,64,1,1,0,4,4,4,0
128-64-128-5x5-48-64-128-1-2x2-1x1-1x1-0-NCHW-FP16-B=ConvOclDirectFwd:16,16,16,32,1,2,4,4,1
256-35-35-1x1-64-35-35-8-0x0-1x1-1x1-0-NCHW-FP32-F=ConvAsm1x1U:4,16,5,32,1,2,4,1;ConvActivAsm1x1U:4,16,5,32,1,4;ConvOclDirectFwd1x1:1,64,1,1,1,1,16,128,0
528-14-14-1x1-160-14-14-4-0x0-1x1-1x1-0-NCHW-FP32-F=ConvAsm1x1U:1,8,1,16,1,4,2,2;ConvActivAsm1x1U:1,16,1,32,2,4;ConvOclDirectFwd1x1:1,64,1,1,1,1,16,128,0
64-256-512-3x3-192-256-512-1-1x1-1x1-1x1-0-NCHW-FP16-F=ConvOclDirectFwd:16,16,32,32,2,2,8,1,1
512-7-7-3x3-512-7-7-4-1x1-1x1-1x1-0-NCHW-FP16-W=ConvAsmBwdWrW3x3:0,0,8,4,2,1
192-7-7-1x1-1488-7-7-16-0x0-1x1-1x1-0-NCHW-FP16-B=ConvAsm1x1U:1,8,2,32,1,2,2,2;ConvOclDirectFwd1x1:1,128,1,1,0,1,8,4,0
224-35-35-3x3-192-35-35-4-1x1-1x1-1x1-0-NCHW-FP16-B=ConvOclDirectFwd:8,16,16,16,2,1,8,1,2
512-28-28-1x1-256-14-14-256-0x0-2x2-1x1-0-NCHW-FP32-F=ConvAsm1x1U:4,16,4,64,1,2,1,8;ConvOclDirectFwd1x1:1,64,1,1,1,4,32,2048,0
32-35-35-1x1-192-35-35-8-0x0-1x1-1x1-0-NCHW-FP16-B=ConvAsm1x1U:1,16,2,64,1,2,1,2;ConvOclDirectFwd1x1:1,256,1,1,0,1,16,8,0
2048-7-7-1x1-1024-14-14-256-0x0-2x2-1x1-0-NCHW-FP16-B=ConvAsm1x1U:2,16,4,16,1,2,1,2;ConvOclDirectFwd1x1:1,256,1,1,0,1,32,4,0
256-56-56-3x3-256-56-56-64-1x1-1x1-1x1-0-NCHW-FP16-F=ConvOclDirectFwd:32,8,32,32,1,4,8,1,2;ConvOclDirectFwdFused:32,8,32,32,1,4,8,1,1
128-7-7-5x5-48-7-7-4-2x2-1x1-1x1-0-NCHW-FP32-B=ConvOclDirectFwd:8,8,8,8,1,1,1,4,2
32-28-28-1x1-192-28-28-256-0x0-1x1-1x1-0-NCHW-FP32-B=ConvAsm1x1U:1,16,1,32,1,2,2,1;ConvOclDirectFwd1x1:1,128,1,1,0,2,32,4,0
192-14-14-1x1-512-14-14-16-0x0-1x1-1x1-0-NCHW-FP32-W=ConvAsmBwdWrW1x1:1,16,2,4,4,1,2,4,0,1
64-28-28-1x1-256-28-28-8-0x0-1x1-1x1-0-NCHW-FP16-W=ConvAsmBwdWrW1x1:4,4,2,4,2,1,2,2,0,1
448-8-8-3x3-384-8-8-4-1x1-1x1-1x1-0-NCHW-FP16-F=ConvOclDirectFwd:8,8,8,8,1,1,2,2,2;ConvOclDirectFwdFused:8,8,8,8,1,1,2,2,2
480-64-128-1x1-64-64-128-1-0x0-1x1-1x1-0-NCHW-FP32-F=ConvAsm1x1U:2,16,4,64,1,2,2,2;ConvActivAsm1x1U:3,16,4,64,1,4;ConvOclDirectFwd1x1:1,64,1,1,1,1,16,256,0
256-56-56-3x3-256-56-56-16-1x1-1x1-1x1-0-NCHW-FP32-W=ConvAsmBwdWrW3x3:0,0,16,4,2,1
1536-8-8-1x1-384-8-8-1-0x0-1x1-1x1-0-NCHW-FP32-F=ConvAsm1x1U:1,8,1,64,1,4,4,1;ConvActivAsm1x1U:1,16,1,32,1,4;ConvOclDirectFwd1x1:1,64,1,1,1,1,16,64,0
96-14-14-1x1-480-14-14-256-0x0-1x1-1x1-0-NCHW-FP16-B=ConvAsm1x1U:1,16,2,16,1,2,1,2;ConvOclDirectFwd1x1:1,256,1,1,0,2,32,4,0
192-28-28-3x3-128-28-28-8-1x1-1x1-1x1-0-NCHW-FP16-W=ConvAsmBwdWrW3x3:0,1,8,2,2,4
32-7-7-1x1-832-7-7-512-0x0-1x1-1x1-0-NCHW-FP32-B=ConvAsm1x1U:1,16,1,64,2,2,1,4;ConvOclDirectFwd1x1:1,256,1,1,0,1,32,4,0
192-8-8-3x3-192-17-17-8-0x0-2x2-1x1-0-NCHW-FP16-B=ConvOclDirectFwd:16,16,32,32,2,2,4,4,1
64-35-35-5x5-48-35-35-16-2x2-1x1-1x1-0-NCHW-FP16-B=ConvOclDirectFwd:8,8,16,16,2,2,8,2,2
160-7-7-1x1-832-7-7-4-0x0-1x1-1x1-0-NCHW-FP16-W=ConvAsmBwdWrW1x1:4,4,2,4,2,1,1,2,0,1
128-7-7-5x5-48-7-7-8-2x2-1x1-1x1-0-NCHW-FP16-B=ConvOclDirectFwd:8,8,8,8,1,1,1,2,2
96-28-28-3x3-96-14-14-32-1x1-2x2-1x1-0-NCHW-FP32-F=ConvOclDirectFwd:16,8,16,16,1,2,8,1,2
1280-8-8-1x1-320-8-8-4-0x0-1x1-1x1-0-NCHW-FP32-F=ConvAsm1x1U:2,8,2,32,1,4,4,1;ConvActivAsm1x1U:1,16,2,16,1,4;ConvOclDirectFwd1x1:8,8,8,8,1,0,32,128,1
512-28-28-3x3-256-28-28-128-1x1-1x1-1x1-0-NCHW-FP16-W=ConvAsmBwdWrW3x3:0,1,8,2,3,8
128-14-14-1x1-528-14-14-16-0x0-1x1-1x1-0-NCHW-FP32-B=ConvAsm1x1U:1,16,1,32,2,1,2,2;ConvOclDirectFwd1x1:8,64,16,16,0,2,16,4,1
528-14-14-1x1-256-14-14-64-0x0-1x1-1x1-0-NCHW-FP32-F=ConvAsm1x1U:4,16,4,64,1,2,2,2;ConvActivAsm1x1U:1,32,7,32,1,1;ConvOclDirectFwd1x1:1,64,1,1,1,0,16,2048,0
512-7-7-1x1-512-7-7-8-0x0-1x1-1x1-0-NCHW-FP32-W=ConvAsmBwdWrW1x1:1,16,2,4,4,1,1,4,0,2
256-14-14-1x1-528-14-14-1-0x0-1x1-1x1-0-NCHW-FP16-W=ConvAsmBwdWrW1x1:2,8,2,4,2,1,1,4,0,1
256-14-14-3x3-128-14-14-128-1x1-1x1-1x1-0-NCHW-FP16-W=ConvAsmBwdWrW3x3:0,0,8,2,6,4
192-28-28-1x1-32-28-28-4-0x0-1x1-1x1-0-NCHW-FP16-F=ConvAsm1x1U:1,8,2,32,1,2,4,1;ConvOclDirectFwd1x1:1,64,1,1,0,1,8,8,0
192-17-17-1x1-768-17-17-1-0x0-1x1-1x1-0-NCHW-FP16-W=ConvAsmBwdWrW1x1:2,8,2,4,2,1,1,4,0,1
192-7-7-1x1-1680-7-7-16-0x0-1x1-1x1-0-NCHW-FP16-B=ConvAsm1x1U:1,16,2,32,1,2,2,2;ConvOclDirectFwd1x1:1,128,1,1,0,1,8,4,0
64-35-35-1x1-256-35-35-256-0x0-1x1-1x1-0-NCHW-FP32-W=ConvAsmBwdWrW1x1:2,8,2,4,4,1,2,4,0,3
16-64-128-5x5-48-64-128-1-2x2-1x1-1x1-0-NCHW-FP32-F=ConvOclDirectFwd:8,32,16,32,2,1,4,4,1;ConvOclDirectFwdFused:8,32,16,32,2,1,4,4,1
32-28-28-1x1-192-28-28-512-0x0-1x1-1x1-0-NCHW-FP32-B=ConvAsm1x1U:2,32,2,32,1,1,2,1;ConvOclDirectFwd1x1:1,64,1,1,0,2,32,4,0
160-14-14-1x1-528-14-14-128-0x0-1x1-1x1-0-NCHW-FP16-B=ConvAsm1x1U:1,16,2,16,1,2,2,2;ConvOclDirectFwd1x1:8,64,16,16,0,2,16,4,1
48-35-35-5x5-64-35-35-128-2x2-1x1-1x1-0-NCHW-FP16-F=ConvOclDirectFwd:8,8,16,16,2,2,8,2,2;ConvOclDirectFwdFused:8,8,16,16,2,2,8,2,2
64-35-35-5x5-48-35-35-1-2x2-1x1-1x1-0-NCHW-FP32-B=ConvOclDirectFwd:16,16,16,16,1,1,4,4,1
96-28-28-3x3-128-28-28-512-1x1-1x1-1x1-0-NCHW-FP16-F=ConvOclDirectFwd:32,8,32,32,1,4,8,1,1;ConvOclDirectFwdFused:16,16,32,32,2,2,8,1,1
608-14-14-1x1-192-14-14-64-0x0-1x1-1x1-0-NCHW-FP32-F=ConvAsm1x1U:2,16,2,64,2,2,1,1;ConvActivAsm1x1U:2,16,4,64,1,1;ConvOclDirectFwd1x1:1,64,1,1,1,4,16,2048,0
256-28-28-3x3-256-14-14-32-1x1-2x2-1x1-0-NCHW-FP32-F=ConvOclDirectFwd:16,16,16,16,1,1,8,2,2
48-7-7-5x5-128-7-7-8-2x2-1x1-1x1-0-NCHW-FP32-F=ConvOclDirectFwd:8,8,8,8,1,1,2,2,2;ConvOclDirectFwdFused:8,8,8,8,1,1,2,4,2
96-71-71-3x3-64-73-73-256-0x0-1x1-1x1-0-NCHW-FP16-B=ConvOclDirectFwd:8,8,16,16,2,2,8,2,1
320-17-17-3x3-320-8-8-128-0x0-2x2-1x1-0-NCHW-FP32-F=ConvOclDirectFwd:8,8,8,8,1,1,8,2,1
256-56-56-1x1-64-56-56-256-0x0-1x1-1x1-0-NCHW-FP16-W=ConvAsmBwdWrW1x1:4,4,8,1,8,2,4,4,0,1
512-14-14-1x1-128-28-28-1-0x0-2x2-1x1-0-NCHW-FP16-W=ConvAsmBwdWrW1x1:2,8,2,2,2,1,1,4,0,1
512-28-28-3x3-512-28-28-128-1x1-1x1-1x1-0-NCHW-FP16-W=ConvAsmBwdWrW3x3:0,1,8,4,1,1
384-7-7-3x3-192-7-7-256-1x1-1x1-1x1-0-NCHW-FP16-W=ConvAsmBwdWrW3x3:0,1,8,4,4,1
512-28-28-1x1-128-28-28-128-0x0-1x1-1x1-0-NCHW-FP32-W=ConvAsmBwdWrW1x1:1,16,2,8,4,1,4,4,0,2
128-28-28-1x1-512-28-28-256-0x0-1x1-1x1-0-NCHW-FP32-F=ConvAsm1x1U:1,16,1,32,4,2,1,8;ConvActivAsm1x1U:2,16,2,32,3,2;ConvOclDirectFwd1x1:1,64,1,1,1,1,32,128,0
144-14-14-3x3-288-14-14-16-1x1-1x1-1x1-0-NCHW-FP16-F=ConvOclDirectFwd:8,16,16,16,2,1,8,1,2;ConvOclDirectFwdFused:8,16,16,16,2,1,8,4,2
128-28-28-1x1-256-56-56-16-0x0-2x2-1x1-0-NCHW-FP32-W=ConvAsmBwdWrW1x1:1,16,2,8,2,1,4,4,0,1
512-28-28-3x3-512-28-28-16-1x1-1x1-1x1-0-NCHW-FP16-F=ConvOclDirectFwd:16,16,32,32,2,2,8,1,2;ConvOclDirectFwdFused:16,16,32,32,2,2,8,1,2
192-7-7-1x1-832-7-7-8-0x0-1x1-1x1-0-NCHW-FP16-W=ConvAsmBwdWrW1x1:1,16,2,8,2,1,2,4,0,0
192-35-35-1x1-32-35-35-32-0x0-1x1-1x1-0-NCHW-FP32-F=ConvAsm1x1U:3,16,3,64,1,2,2,1;ConvActivAsm1x1U:1,16,1,64,3,2;ConvOclDirectFwd1x1:1,64,1,1,1,4,16,2048,0
32-14-14-1x1-528-14-14-128-0x0-1x1-1x1-0-NCHW-FP32-W=ConvAsmBwdWrW1x1:2,8,4,4,4,1,4,4,0,1
384-8-8-1x1-1536-8-8-16-0x0-1x1-1x1-0-NCHW-FP32-B=ConvAsm1x1U:1,16,1,64,2,2,2,4;ConvOclDirectFwd1x1:1,64,1,1,0,4,8,4,0
128-28-28-1x1-512-28-28-32-0x0-1x1-1x1-0-NCHW-FP32-W=ConvAsmBwdWrW1x1:1,16,2,4,8,1,4,4,0,1
48-7-7-5x5-128-7-7-1-2x2-1x1-1x1-0-NCHW-FP16-F=ConvOclDirectFwd:8,8,8,8,1,1,1,4,1;ConvOclDirectFwdFused:8,8,8,8,1,1,1,4,1
512-7-7-3x3-512-7-7-8-1x1-1x1-1x1-0-NCHW-FP16-B=ConvOclDirectFwd:8,8,8,8,1,1,4,1,1
192-28-28-1x1-64-28-28-128-0x0-1x1-1x1-0-NCHW-FP32-F=ConvAsm1x1U:2,16,2,32,2,1,1,4;ConvActivAsm1x1U:2,32,2,32,1,1;ConvOclDirectFwd1x1:1,64,1,1,1,0,16,2048,0
192-14-14-1x1-480-14-14-64-0x0-1x1-1x1-0-NCHW-FP16-W=ConvAsmBwdWrW1x1:1,16,2,8,2,1,4,4,0,1
288-35-35-1x1-48-35-35-32-0x0-1x1-1x1-0-NCHW-FP16-F=ConvAsm1x1U:3,8,6,16,1,4,2,2;ConvOclDirectFwd1x1:1,64,1,1,0,1,16,4,0
192-56-56-3x3-64-56-56-256-1x1-1x1-1x1-0-NCHW-FP16-B=ConvOclDirectFwd:16,16,32,32,2,2,8,1,2
128-7-7-1x1-1056-7-7-64-0x0-1x1-1x1-0-NCHW-FP32-B=ConvAsm1x1U:1,16,1,64,2,2,2,2;ConvOclDirectFwd1x1:1,64,1,1,0,1,16,4,0
512-14-14-3x3-512-7-7-128-1x1-2x2-1x1-0-NCHW-FP32-F=ConvOclDirectFwd:8,8,8,8,1,1,8,2,2
160-64-128-1x1-528-64-128-1-0x0-1x1-1x1-0-NCHW-FP16-B=ConvOclDirectFwd1x1:1,256,1,1,0,4,16,4,0
128-28-28-3x3-128-28-28-2-1x1-1x1-1x1-0-NCHW-FP32-W=ConvAsmBwdWrW3x3:0,0,8,2,3,1
256-56-56-3x3-128-56-56-64-1x1-1x1-1x1-0-NCHW-FP16-B=ConvOclDirectFwd:32,8,32,32,1,4,8,1,1
256-56-56-1x1-64-56-56-16-0x0-1x1-1x1-0-NCHW-FP32-F=ConvAsm1x1U:3,16,3,64,1,2,1,4;ConvOclDirectFwd1x1:1,64,1,1,1,4,16,2048,0
352-7-7-1x1-1056-7-7-32-0x0-1x1-1x1-0-NCHW-FP16-W=ConvAsmBwdWrW1x1:1,16,2,8,2,1,2,4,0,0
832-7-7-1x1-32-7-7-8-0x0-1x1-1x1-0-NCHW-FP16-F=ConvAsm1x1U:1,8,2,32,1,4,2,1;ConvOclDirectFwd1x1:1,64,1,1,0,1,4,8,0
2048-7-7-1x1-1024-14-14-2-0x0-2x2-1x1-0-NCHW-FP16-W=ConvAsmBwdWrW1x1:1,16,2,4,4,1,1,4,0,0
192-8-8-1x1-2048-8-8-64-0x0-1x1-1x1-0-NCHW-FP16-W=ConvAsmBwdWrW1x1:2,8,8,2,4,1,1,4,0,0
64-35-35-1x1-384-35-35-128-0x0-1x1-1x1-0-NCHW-FP32-B=ConvAsm1x1U:1,32,1,64,1,1,1,1;ConvOclDirectFwd1x1:1,256,1,1,0,1,32,4,0
32-28-28-5x5-16-28-28-256-2x2-1x1-1x1-0-NCHW-FP16-B=ConvOclDirectFwd:16,16,32,32,2,2,8,4,2
160-14-14-3x3-128-28-28-32-1x1-2x2-1x1-0-NCHW-FP16-B=ConvOclDirectFwd:8,16,32,32,4,2,4,2,1
192-27-27-5x5-64-27-27-64-2x2-1x1-1x1-0-NCHW-FP16-B=ConvOclDirectFwd:16,16,32,32,2,2,8,4,2
480-14-14-1x1-16-14-14-32-0x0-1x1-1x1-0-NCHW-FP16-F=ConvAsm1x1U:1,8,2,64,1,4,4,2;ConvOclDirectFwd1x1:1,128,1,1,0,4,4,8,0
192-8-8-1x1-1280-8-8-4-0x0-1x1-1x1-0-NCHW-FP32-B=ConvAsm1x1U:1,8,1,16,1,2,2,2;ConvOclDirectFwd1x1:1,64,1,1,0,1,4,8,0
384-13-13-3x3-384-13-13-1024-1x1-1x1-1x1-0-NCHW-FP16-B=ConvOclDirectFwd:8,8,16,16,2,2,8,2,2
192-7-7-1x1-1056-7-7-64-0x0-1x1-1x1-0-NCHW-FP32-W=ConvAsmBwdWrW1x1:1,16,4,4,8,1,2,4,0,1
192-7-7-1x1-1056-7-7-32-0x0-1x1-1x1-0-NCHW-FP16-W=ConvAsmBwdWrW1x1:1,16,2,8,2,1,2,4,0,0
512-28-28-1x1-256-56-56-128-0x0-2x2-1x1-0-NCHW-FP16-W=ConvAsmBwdWrW1x1:2,8,4,8,2,2,2,4,0,1
64-35-35-1x1-384-35-35-4-0x0-1x1-1x1-0-NCHW-FP32-W=ConvAsmBwdWrW1x1:4,4,4,2,8,1,2,4,0,1
32-35-35-1x1-192-35-35-64-0x0-1x1-1x1-0-NCHW-FP16-B=ConvAsm1x1U:1,16,2,64,1,2,1,2;ConvOclDirectFwd1x1:1,256,1,1,0,1,32,4,0
64-14-14-1x1-512-14-14-16-0x0-1x1-1x1-0-NCHW-FP32-W=ConvAsmBwdWrW1x1:4,4,4,4,2,1,1,4,0,1
480-14-14-1x1-16-14-14-16-0x0-1x1-1x1-0-NCHW-FP16-F=ConvAsm1x1U:1,8,2,16,1,4,4,1;ConvOclDirectFwd1x1:1,64,1,1,0,4,4,8,0
384-13-13-3x3-192-13-13-1024-1x1-1x1-1x1-0-NCHW-FP16-W=ConvAsmBwdWrW3x3:0,1,8,4,5,1
128-14-14-3x3-256-14-14-8-1x1-1x1-1x1-0-NCHW-FP16-F=ConvOclDirectFwd:16,8,16,16,1,2,4,2,2;ConvOclDirectFwdFused:16,8,16,16,1,2,4,2,2
64-56-56-1x1-256-56-56-128-0x0-1x1-1x1-0-NCHW-FP32-B=ConvAsm1x1U:1,32,1,64,1,1,1,1;ConvOclDirectFwd1x1:1,64,1,1,0,2,32,4,0
96-28-28-1x1-192-28-28-4-0x0-1x1-1x1-0-NCHW-FP32-W=ConvAsmBwdWrW1x1:2,8,2,8,2,1,4,4,0,1
2048-8-8-1x1-320-8-8-256-0x0-1x1-1x1-0-NCHW-FP16-F=ConvAsm1x1U:1,8,2,32,4,4,2,2;ConvOclDirectFwd1x1:1,64,1,1,0,4,16,8,0
64-56-56-1x1-64-56-56-32-0x0-1x1-1x1-0-NCHW-FP32-F=ConvAsm1x1U:1,8,1,64,1,4,1,4;ConvActivAsm1x1U:2,32,2,64,1,1;ConvOclDirectFwd1x1:1,64,1,1,1,4,16,2048,0
256-8-8-1x1-1536-8-8-32-0x0-1x1-1x1-0-NCHW-FP32-W=ConvAsmBwdWrW1x1:2,8,2,4,8,1,1,4,0,3
192-14-14-1x1-720-14-14-16-0x0-1x1-1x1-0-NCHW-FP32-W=ConvAsmBwdWrW1x1:1,16,2,8,4,1,2,4,0,1
768-17-17-1x1-128-17-17-128-0x0-1x1-1x1-0-NCHW-FP32-F=ConvAsm1x1U:4,16,5,64,1,2,1,2;ConvActivAsm1x1U:4,16,5,32,2,1;ConvOclDirectFwd1x1:1,64,1,1,1,0,16,2048,0
128-28-28-1x1-256-28-28-4-0x0-1x1-1x1-0-NCHW-FP16-B=ConvAsm1x1U:1,8,2,16,1,4,2,2;ConvOclDirectFwd1x1:1,64,1,1,0,4,16,4,0
24-14-14-5x5-64-14-14-8-2x2-1x1-1x1-0-NCHW-FP32-F=ConvOclDirectFwd:8,16,16,16,2,1,2,4,2;ConvOclDirectFwdFused:8,16,16,16,2,1,2,4,2
128-28-28-1x1-512-28-28-2-0x0-1x1-1x1-0-NCHW-FP32-F=ConvAsm1x1U:2,8,2,32,1,4,1,4;ConvActivAsm1x1U:2,16,2,64,2,2;ConvOclDirectFwd1x1:1,64,1,1,1,4,16,256,0
256-56-56-1x1-64-56-56-64-0x0-1x1-1x1-0-NCHW-FP16-B=ConvAsm1x1U:1,16,2,32,1,2,2,4;ConvOclDirectFwd1x1:1,64,1,1,0,4,16,4,0
128-112-112-3x3-128-112-112-4-1x1-1x1-1x1-0-NCHW-FP32-W=ConvAsmBwdWrW3x3:0,1,16,4,2,1
448-8-8-1x1-1280-8-8-4-0x0-1x1-1x1-0-NCHW-FP16-B=ConvAsm1x1U:1,8,2,16,1,4,4,1;ConvOclDirectFwd1x1:1,256,1,1,0,2,4,4,0
480-14-14-1x1-96-14-14-512-0x0-1x1-1x1-0-NCHW-FP16-F=ConvAsm1x1U:1,8,2,64,2,4,1,4;ConvOclDirectFwd1x1:1,128,1,1,0,4,16,4,0
48-7-7-1x1-832-7-7-16-0x0-1x1-1x1-0-NCHW-FP16-B=ConvAsm1x1U:1,8,2,16,1,2,2,1;ConvOclDirectFwd1x1:8,64,8,8,0,1,16,4,1
128-14-14-1x1-528-14-14-16-0x0-1x1-1x1-0-NCHW-FP16-B=ConvAsm1x1U:1,16,2,16,1,2,2,4;ConvOclDirectFwd1x1:1,64,1,1,0,4,8,4,0
256-14-14-1x1-1024-14-14-1-0x0-1x1-1x1-0-NCHW-FP32-B=ConvAsm1x1U:1,8,1,64,1,4,2,4;ConvOclDirectFwd1x1:1,64,1,1,0,4,8,8,0
832-7-7-1x1-160-7-7-512-0x0-1x1-1x1-0-NCHW-FP32-F=ConvAsm1x1U:2,16,2,32,2,2,1,1;ConvActivAsm1x1U:2,16,2,32,4,2;ConvOclDirectFwd1x1:1,64,1,1,1,4,32,2048,0
256-7-7-1x1-832-7-7-64-0x0-1x1-1x1-0-NCHW-FP32-W=ConvAsmBwdWrW1x1:1,16,4,4,8,1,2,4,0,1
3-299-299-3x3-32-149-149-128-0x0-2x2-1x1-0-NCHW-FP32-F=ConvOclDirectFwd:16,16,16,16,1,1,8,1,2;ConvOclDirectFwdFused:16,16,16,16,1,1,8,1,2
448-8-8-1x1-1280-8-8-32-0x0-1x1-1x1-0-NCHW-FP16-F=ConvAsm1x1U:1,8,2,32,2,4,1,4;ConvOclDirectFwd1x1:8,64,8,8,0,2,16,4,1
192-14-14-1x1-576-14-14-64-0x0-1x1-1x1-0-NCHW-FP32-B=ConvAsm1x1U:1,16,1,32,2,1,1,4;ConvOclDirectFwd1x1:1,64,1,1,0,2,16,4,0
512-10-42-3x3-512-10-42-2-1x1-1x1-1x1-0-NCHW-FP32-W=ConvAsmBwdWrW3x3:0,0,8,4,2,1
96-28-28-1x1-192-28-28-4-0x0-1x1-1x1-0-NCHW-FP32-B=ConvAsm1x1U:1,16,1,32,1,2,2,2;ConvOclDirectFwd1x1:1,64,1,1,0,1,8,4,0
1024-14-14-1x1-256-14-14-1-0x0-1x1-1x1-0-NCHW-FP32-F=ConvAsm1x1U:2,8,2,64,1,4,4,1;ConvActivAsm1x1U:1,16,1,64,1,3;ConvOclDirectFwd1x1:1,64,1,1,1,4,16,128,0
192-35-35-1x1-384-35-35-16-0x0-1x1-1x1-0-NCHW-FP16-W=ConvAsmBwdWrW1x1:2,8,2,8,2,1,4,4,0,1
32-28-28-5x5-96-28-28-8-2x2-1x1-1x1-0-NCHW-FP32-F=ConvOclDirectFwd:8,32,32,32,4,1,4,2,2;ConvOclDirectFwdFused:16,16,32,32,2,2,4,2,2
48-28-28-3x3-192-28-28-16-1x1-1x1-1x1-0-NCHW-FP32-W=ConvAsmBwdWrW3x3:0,1,8,2,7,4
64-56-56-1x1-64-56-56-512-0x0-1x1-1x1-0-NCHW-FP32-W=ConvAsmBwdWrW1x1:4,4,2,4,4,1,4,4,0,1
192-7-7-1x1-1344-7-7-16-0x0-1x1-1x1-0-NCHW-FP32-B=ConvAsm1x1U:1,16,1,64,2,2,4,1;ConvOclDirectFwd1x1:1,256,1,1,0,1,8,4,0
128-28-28-1x1-256-56-56-8-0x0-2x2-1x1-0-NCHW-FP16-W=ConvAsmBwdWrW1x1:4,4,4,1,8,1,2,4,0,0
64-224-224-3x3-3-224-224-256-1x1-1x1-1x1-0-NCHW-FP16-B=ConvOclDirectFwd:16,16,32,32,2,2,8,2,1
384-8-8-3x3-448-8-8-64-1x1-1x1-1x1-0-NCHW-FP16-W=ConvAsmBwdWrW3x3:0,0,8,4,3,1
256-13-13-3x3-256-13-13-1024-1x1-1x1-1x1-0-NCHW-FP32-W=ConvAsmBwdWrW3x3:0,0,16,4,8,1
224-14-14-3x3-112-14-14-256-1x1-1x1-1x1-0-NCHW-FP16-W=ConvAsmBwdWrW3x3:0,0,8,2,5,4
832-7-7-1x1-128-7-7-256-0x0-1x1-1x1-0-NCHW-FP16-F=ConvAsm1x1U:2,8,4,16,1,4,4,1;ConvOclDirectFwd1x1:1,64,1,1,0,1,16,4,0
64-35-35-5x5-48-35-35-32-2x2-1x1-1x1-0-NCHW-FP16-B=ConvOclDirectFwd:8,8,16,16,2,2,8,2,2
208-64-128-3x3-96-64-128-1-1x1-1x1-1x1-0-NCHW-FP32-W=ConvAsmBwdWrW3x3:0,0,16,4,3,1
384-7-7-3x3-192-7-7-32-1x1-1x1-1x1-0-NCHW-FP32-W=ConvAsmBwdWrW3x3:0,1,8,2,7,1
64-56-56-1x1-256-56-56-16-0x0-1x1-1x1-0-NCHW-FP16-W=ConvAsmBwdWrW1x1:4,4,4,1,8,2,2,4,0,1
64-224-224-3x3-64-224-224-32-1x1-1x1-1x1-0-NCHW-FP32-W=ConvAsmBwdWrW3x3:0,0,16,2,3,1
320-7-7-3x3-192-7-7-32-1x1-1x1-1x1-0-NCHW-FP16-B=ConvOclDirectFwd:8,8,8,8,1,1,4,1,2
1536-8-8-1x1-384-8-8-64-0x0-1x1-1x1-0-NCHW-FP32-F=ConvAsm1x1U:4,16,4,16,2,2,4,1;ConvActivAsm1x1U:2,16,2,32,4,4;ConvOclDirectFwd1x1:1,64,1,1,1,1,16,2048,0
480-28-28-1x1-192-28-28-16-0x0-1x1-1x1-0-NCHW-FP32-F=ConvAsm1x1U:4,16,5,32,1,2,1,1;ConvActivAsm1x1U:4,16,5,32,1,1;ConvOclDirectFwd1x1:1,64,1,1,1,1,16,2048,0
1280-8-8-1x1-192-8-8-256-0x0-1x1-1x1-0-NCHW-FP16-F=ConvAsm1x1U:1,8,2,32,2,4,2,4;ConvOclDirectFwd1x1:1,128,1,1,0,4,8,4,0
64-56-56-1x1-256-56-56-256-0x0-1x1-1x1-0-NCHW-FP32-F=ConvAsm1x1U:1,16,1,64,3,2,1,8;ConvActivAsm1x1U:2,16,2,64,3,1;ConvOclDirectFwd1x1:1,64,1,1,1,0,32,128,0
160-7-7-1x1-1056-7-7-64-0x0-1x1-1x1-0-NCHW-FP32-W=ConvAsmBwdWrW1x1:1,16,2,8,4,1,1,4,0,2
384-35-35-1x1-192-35-35-8-0x0-1x1-1x1-0-NCHW-FP32-F=ConvAsm1x1U:2,16,2,64,2,2,1,1;ConvActivAsm1x1U:2,16,2,32,4,1;ConvOclDirectFwd1x1:1,64,1,1,1,0,32,2048,0
192-7-7-1x1-2016-7-7-16-0x0-1x1-1x1-0-NCHW-FP32-B=ConvAsm1x1U:2,16,2,32,1,2,2,2;ConvOclDirectFwd1x1:8,64,8,8,0,1,16,4,1
32-14-14-5x5-128-14-14-128-2x2-1x1-1x1-0-NCHW-FP32-F=ConvOclDirectFwd:8,8,16,16,2,2,4,2,2;ConvOclDirectFwdFused:8,8,16,16,2,2,4,2,2
64-112-112-7x7-3-230-230-1-0x0-2x2-1x1-0-NCHW-FP32-B=ConvOclDirectFwd:16,32,32,32,2,1,1,4,1
256-14-14-3x3-128-14-14-4-1x1-1x1-1x1-0-NCHW-FP16-B=ConvOclDirectFwd:16,16,16,16,1,1,2,4,2
832-7-7-1x1-32-7-7-8-0x0-1x1-1x1-0-NCHW-FP32-F=ConvAsm1x1U:1,8,1,16,1,4,4,1;ConvActivAsm1x1U:1,16,1,16,1,4;ConvOclDirectFwd1x1:1,64,1,1,1,1,16,64,0
528-14-14-1x1-256-14-14-512-0x0-1x1-1x1-0-NCHW-FP16-F=ConvAsm1x1U:1,16,2,16,2,2,1,4;ConvOclDirectFwd1x1:1,128,1,1,0,2,16,4,0
128-7-7-1x1-832-7-7-8-0x0-1x1-1x1-0-NCHW-FP32-W=ConvAsmBwdWrW1x1:1,16,2,8,2,1,1,4,0,1
256-14-14-1x1-528-14-14-4-0x0-1x1-1x1-0-NCHW-FP16-W=ConvAsmBwdWrW1x1:2,8,2,8,2,1,2,4,0,0
1536-8-8-1x1-256-8-8-4-0x0-1x1-1x1-0-NCHW-FP32-F=ConvAsm1x1U:2,8,2,16,1,4,4,1;ConvActivAsm1x1U:1,16,1,32,1,4;ConvOclDirectFwd1x1:1,64,1,1,1,0,16,128,0
1024-17-17-1x1-192-17-17-8-0x0-1x1-1x1-0-NCHW-FP32-F=ConvAsm1x1U:4,8,5,64,2,2,2,2;ConvActivAsm1x1U:4,16,4,16,2,3;ConvOclDirectFwd1x1:1,64,1,1,1,4,32,256,0
64-28-28-1x1-192-28-28-8-0x0-1x1-1x1-0-NCHW-FP32-W=ConvAsmBwdWrW1x1:2,8,2,8,2,1,4,4,0,1
208-14-14-3x3-96-14-14-256-1x1-1x1-1x1-0-NCHW-FP32-W=ConvAsmBwdWrW3x3:0,0,8,4,13,4
512-7-7-1x1-1024-14-14-32-0x0-2x2-1x1-0-NCHW-FP16-W=ConvAsmBwdWrW1x1:1,16,4,8,2,1,1,2,0,2
256-14-14-1x1-128-28-28-256-0x0-2x2-1x1-0-NCHW-FP16-B=ConvAsm1x1U:1,16,2,16,1,2,2,4;ConvOclDirectFwd1x1:1,256,1,1,0,2,32,8,0
128-14-14-5x5-32-14-14-512-2x2-1x1-1x1-0-NCHW-FP16-B=ConvOclDirectFwd:8,8,16,16,2,2,8,2,2
64-112-112-7x7-3-224-224-64-3x3-2x2-1x1-0-NCHW-FP16-B=ConvOclDirectFwd:16,16,32,32,2,2,8,2,1
1024-14-14-1x1-512-28-28-8-0x0-2x2-1x1-0-NCHW-FP16-B=ConvAsm1x1U:1,16,2,32,1,2,4,1;ConvOclDirectFwd1x1:1,256,1,1,0,2,8,4,0
64-14-14-5x5-24-14-14-128-2x2-1x1-1x1-0-NCHW-FP16-B=ConvOclDirectFwd:8,8,16,16,2,2,4,4,2
64-35-35-1x1-192-35-35-64-0x0-1x1-1x1-0-NCHW-FP32-B=ConvAsm1x1U:1,32,1,64,1,1,1,1;ConvOclDirectFwd1x1:1,256,1,1,0,1,32,4,0
512-14-14-1x1-128-14-14-64-0x0-1x1-1x1-0-NCHW-FP16-F=ConvAsm1x1U:2,8,4,64,1,4,2,2;ConvOclDirectFwd1x1:1,128,1,1,0,4,8,4,0
512-14-14-3x3-512-14-14-4-1x1-1x1-1x1-0-NCHW-FP16-F=ConvOclDirectFwd:16,8,16,16,1,2,4,2,2;ConvOclDirectFwdFused:16,8,16,16,1,2,4,2,2
512-28-28-1x1-256-14-14-8-0x0-2x2-1x1-0-NCHW-FP16-F=ConvAsm1x1U:2,8,4,64,1,4,2,4;ConvOclDirectFwd1x1:16,64,32,32,0,2,16,4,1
128-28-28-1x1-256-28-28-32-0x0-1x1-1x1-0-NCHW-FP16-B=ConvAsm1x1U:1,16,2,16,1,2,2,2;ConvOclDirectFwd1x1:1,64,1,1,0,4,16,4,0
128-28-28-3x3-128-14-14-16-1x1-2x2-1x1-0-NCHW-FP32-F=ConvOclDirectFwd:16,16,16,16,1,1,8,2,2
192-56-56-1x1-288-56-56-16-0x0-1x1-1x1-0-NCHW-FP16-W=ConvAsmBwdWrW1x1:4,4,8,1,8,2,1,4,0,1
128-14-14-5x5-32-14-14-8-2x2-1x1-1x1-0-NCHW-FP16-B=ConvOclDirectFwd:16,16,16,16,1,1,2,4,2
96-28-28-1x1-192-28-28-16-0x0-1x1-1x1-0-NCHW-FP32-B=ConvAsm1x1U:1,16,1,16,1,2,2,2;ConvOclDirectFwd1x1:1,64,1,1,0,2,16,4,0
192-8-8-1x1-1280-8-8-64-0x0-1x1-1x1-0-NCHW-FP32-W=ConvAsmBwdWrW1x1:2,8,4,4,8,1,1,4,0,1
64-14-14-1x1-512-14-14-4-0x0-1x1-1x1-0-NCHW-FP16-B=ConvAsm1x1U:1,8,2,16,1,4,2,2;ConvOclDirectFwd1x1:1,64,1,1,0,4,4,4,0
384-13-13-3x3-384-13-13-16-1x1-1x1-1x1-0-NCHW-FP16-B=ConvOclDirectFwd:8,8,16,16,2,2,8,4,2
160-14-14-1x1-528-14-14-1-0x0-1x1-1x1-0-NCHW-FP32-B=ConvOclDirectFwd1x1:1,128,1,1,0,4,4,8,0
192-7-7-3x3-384-7-7-4-1x1-1x1-1x1-0-NCHW-FP16-F=ConvOclDirectFwd:8,8,8,8,1,1,2,2,2;ConvOclDirectFwdFused:8,8,8,8,1,1,2,2,2
384-8-8-1x1-1536-8-8-4-0x0-1x1-1x1-0-NCHW-FP32-W=ConvAsmBwdWrW1x1:1,16,2,4,4,1,2,4,0,1
512-14-14-1x1-32-14-14-64-0x0-1x1-1x1-0-NCHW-FP32-F=ConvAsm1x1U:2,16,2,64,1,2,4,1;ConvActivAsm1x1U:4,16,4,64,1,4;ConvOclDirectFwd1x1:1,64,1,1,1,1,16,256,0
512-14-14-1x1-128-14-14-16-0x0-1x1-1x1-0-NCHW-FP16-F=ConvAsm1x1U:1,8,2,64,2,4,4,4;ConvOclDirectFwd1x1:1,256,1,1,0,4,4,4,0
512-14-14-1x1-160-14-14-4-0x0-1x1-1x1-0-NCHW-FP16-F=ConvAsm1x1U:1,8,2,16,1,4,4,1;ConvOclDirectFwd1x1:1,64,1,1,0,4,4,4,0
64-35-35-1x1-192-35-35-128-0x0-1x1-1x1-0-NCHW-FP16-B=ConvAsm1x1U:1,16,2,64,1,2,1,2;ConvOclDirectFwd1x1:1,256,1,1,0,1,32,4,0
480-14-14-1x1-16-14-14-256-0x0-1x1-1x1-0-NCHW-FP32-B=ConvAsm1x1U:1,16,1,64,2,2,1,1;ConvOclDirectFwd1x1:1,64,1,1,0,2,16,4,0
512-64-128-1x1-128-64-128-1-0x0-1x1-1x1-0-NCHW-FP32-F=ConvOclDirectFwdFused:1,64,1,1,1,4,32,256,0;ConvOclDirectFwd1x1:1,64,1,1,1,1,16,2048,0
64-224-224-3x3-3-224-224-64-1x1-1x1-1x1-0-NCHW-FP16-W=ConvAsmBwdWrW3x3:0,1,16,1,2,4
192-7-7-1x1-2160-7-7-16-0x0-1x1-1x1-0-NCHW-FP16-B=ConvAsm1x1U:1,16,2,16,1,2,2,2;ConvOclDirectFwd1x1:1,64,1,1,0,1,8,4,0
32-149-149-3x3-32-147-147-128-0x0-1x1-1x1-0-NCHW-FP32-F=ConvOclDirectFwd:16,16,16,32,1,2,8,4,1
224-35-35-3x3-192-35-35-32-1x1-1x1-1x1-0-NCHW-FP16-B=ConvOclDirectFwd:8,8,16,16,2,2,8,2,2
256-56-56-1x1-64-56-56-32-0x0-1x1-1x1-0-NCHW-FP16-B=ConvAsm1x1U:1,16,2,64,1,2,2,2;ConvOclDirectFwd1x1:1,128,1,1,0,4,16,4,0
1024-14-14-1x1-256-14-14-8-0x0-1x1-1x1-0-NCHW-FP32-B=ConvAsm1x1U:2,16,4,64,1,2,4,1;ConvOclDirectFwd1x1:1,256,1,1,0,2,8,8,0
512-28-28-1x1-1024-14-14-128-0x0-2x2-1x1-0-NCHW-FP32-F=ConvAsm1x1U:2,16,2,64,3,2,2,1;ConvOclDirectFwd1x1:1,64,1,1,1,0,32,2048,0
448-8-8-1x1-1280-8-8-8-0x0-1x1-1x1-0-NCHW-FP32-B=ConvAsm1x1U:1,16,1,64,2,2,2,2;ConvOclDirectFwd1x1:1,128,1,1,0,2,8,8,0
192-28-28-1x1-432-28-28-16-0x0-1x1-1x1-0-NCHW-FP16-W=ConvAsmBwdWrW1x1:2,8,2,8,2,1,2,4,0,1
16-28-28-5x5-32-28-28-32-2x2-1x1-1x1-0-NCHW-FP16-F=ConvOclDirectFwd:8,32,32,32,4,1,8,4,2;ConvOclDirectFwdFused:16,16,32,32,2,2,4,4,2
512-7-7-1x1-512-7-7-8-0x0-1x1-1x1-0-NCHW-FP16-W=ConvAsmBwdWrW1x1:1,16,2,8,2,1,2,2,0,1
256-20-84-3x3-256-20-84-1-1x1-1x1-1x1-0-NCHW-FP16-F=ConvOclDirectFwd:8,32,16,32,2,1,8,4,1
192-14-14-1x1-720-14-14-16-0x0-1x1-1x1-0-NCHW-FP16-W=ConvAsmBwdWrW1x1:2,8,2,8,2,1,2,4,0,1
256-8-8-1x1-1536-8-8-4-0x0-1x1-1x1-0-NCHW-FP16-W=ConvAsmBwdWrW1x1:1,16,4,4,2,1,1,4,0,0
512-28-28-3x3-256-28-28-16-1x1-1x1-1x1-0-NCHW-FP32-W=ConvAsmBwdWrW3x3:0,0,8,4,3,1
192-14-14-1x1-480-14-14-32-0x0-1x1-1x1-0-NCHW-FP16-B=ConvAsm1x1U:1,16,2,16,1,2,2,2;ConvOclDirectFwd1x1:1,256,1,1,0,4,8,4,0
224-35-35-3x3-192-35-35-8-1x1-1x1-1x1-0-NCHW-FP16-W=ConvAsmBwdWrW3x3:0,1,8,2,2,4
160-7-7-1x1-1056-7-7-32-0x0-1x1-1x1-0-NCHW-FP16-W=ConvAsmBwdWrW1x1:1,16,2,8,2,1,2,4,0,1
64-35-35-1x1-384-35-35-16-0x0-1x1-1x1-0-NCHW-FP32-B=ConvAsm1x1U:2,32,2,64,1,1,2,1;ConvOclDirectFwd1x1:1,256,1,1,0,1,32,4,0
288-14-14-3x3-144-14-14-1-1x1-1x1-1x1-0-NCHW-FP32-W=ConvAsmBwdWrW3x3:0,0,8,4,2,1
1056-14-14-1x1-2112-14-14-16-0x0-1x1-1x1-0-NCHW-FP16-B=ConvAsm1x1U:1,16,2,16,1,2,4,2;ConvOclDirectFwd1x1:1,64,1,1,0,2,16,4,0
64-56-56-3x3-64-56-56-256-1x1-1x1-1x1-0-NCHW-FP32-W=ConvAsmBwdWrW3x3:0,0,8,4,2,8
160-14-14-1x1-512-14-14-1-0x0-1x1-1x1-0-NCHW-FP32-B=ConvAsm1x1U:1,8,1,64,1,2,4,2;ConvOclDirectFwd1x1:1,64,1,1,0,1,4,8,0
64-224-224-3x3-64-224-224-32-1x1-1x1-1x1-0-NCHW-FP16-F=ConvOclDirectFwd:8,16,16,32,2,2,8,1,1;ConvOclDirectFwdFused:16,16,32,32,2,2,8,4,1
192-28-28-1x1-96-28-28-512-0x0-1x1-1x1-0-NCHW-FP32-F=ConvAsm1x1U:3,16,5,32,1,2,1,1;ConvActivAsm1x1U:1,32,3,16,2,1;ConvOclDirectFwd1x1:1,64,1,1,1,4,16,2048,0
112-64-128-3x3-224-64-128-1-1x1-1x1-1x1-0-NCHW-FP16-F=ConvOclDirectFwd:8,32,16,32,2,1,8,4,1
128-28-28-1x1-256-28-28-512-0x0-1x1-1x1-0-NCHW-FP32-B=ConvAsm1x1U:1,16,1,32,2,2,1,4;ConvOclDirectFwd1x1:1,128,1,1,0,2,32,4,0
192-17-17-1x1-1024-17-17-256-0x0-1x1-1x1-0-NCHW-FP32-B=ConvAsm1x1U:1,16,1,64,2,2,1,4;ConvOclDirectFwd1x1:1,256,1,1,0,1,32,4,0
192-71-71-3x3-80-73-73-8-0x0-1x1-1x1-0-NCHW-FP32-B=ConvOclDirectFwd:8,8,16,16,2,2,8,1,1
256-56-56-1x1-64-56-56-64-0x0-1x1-1x1-0-NCHW-FP16-F=ConvAsm1x1U:1,8,2,64,1,4,1,8;ConvOclDirectFwd1x1:1,128,1,1,0,4,16,4,0
384-35-35-1x1-192-35-35-1-0x0-1x1-1x1-0-NCHW-FP16-F=ConvAsm1x1U:1,8,2,64,1,4,4,1;ConvOclDirectFwd1x1:1,256,1,1,0,1,8,8,0
512-7-7-1x1-2048-7-7-64-0x0-1x1-1x1-0-NCHW-FP32-F=ConvAsm1x1U:4,8,4,16,2,2,1,8;ConvActivAsm1x1U:2,16,2,32,4,2;ConvOclDirectFwd1x1:1,64,1,1,1,4,32,2048,0
192-7-7-1x1-1056-7-7-32-0x0-1x1-1x1-0-NCHW-FP16-B=ConvAsm1x1U:1,16,2,32,1,2,2,2;ConvOclDirectFwd1x1:1,64,1,1,0,1,8,4,0
512-14-14-1x1-24-14-14-64-0x0-1x1-1x1-0-NCHW-FP32-F=ConvAsm1x1U:4,8,4,64,1,4,2,2;ConvActivAsm1x1U:3,16,4,64,1,4;ConvOclDirectFwd1x1:1,64,1,1,0,1,8,8,0
192-28-28-3x3-128-28-28-1-1x1-1x1-1x1-0-NCHW-FP16-B=ConvOclDirectFwd:16,16,16,16,1,1,2,4,1
384-8-8-1x1-1536-8-8-8-0x0-1x1-1x1-0-NCHW-FP32-B=ConvAsm1x1U:1,16,1,32,2,2,2,2;ConvOclDirectFwd1x1:1,256,1,1,0,4,8,8,0
64-224-224-3x3-3-224-224-4-1x1-1x1-1x1-0-NCHW-FP16-W=ConvAsmBwdWrW3x3:0,1,16,1,2,2
208-14-14-3x3-96-14-14-512-1x1-1x1-1x1-0-NCHW-FP16-W=ConvAsmBwdWrW3x3:0,0,8,2,8,4
512-14-14-3x3-512-14-14-2-1x1-1x1-1x1-0-NCHW-FP16-W=ConvAsmBwdWrW3x3:0,1,8,2,3,1
64-14-14-1x1-512-14-14-16-0x0-1x1-1x1-0-NCHW-FP32-B=ConvAsm1x1U:1,16,1,32,1,2,1,1;ConvOclDirectFwd1x1:1,256,1,1,0,4,16,4,0
1024-14-14-1x1-256-14-14-4-0x0-1x1-1x1-0-NCHW-FP32-B=ConvAsm1x1U:2,16,2,64,1,2,4,2;ConvOclDirectFwd1x1:1,256,1,1,0,1,4,4,0
2048-7-7-1x1-512-7-7-2-0x0-1x1-1x1-0-NCHW-FP32-B=ConvAsm1x1U:1,8,1,64,1,4,4,2;ConvOclDirectFwd1x1:1,128,1,1,0,1,4,8,0
96-35-35-3x3-96-35-35-4-1x1-1x1-1x1-0-NCHW-FP16-W=ConvAsmBwdWrW3x3:0,0,8,2,1,2
384-13-13-3x3-384-13-13-128-1x1-1x1-1x1-0-NCHW-FP16-B=ConvOclDirectFwd:8,8,16,16,2,2,8,2,1
96-71-71-3x3-64-73-73-16-0x0-1x1-1x1-0-NCHW-FP16-B=ConvOclDirectFwd:16,8,16,16,1,2,8,1,2
192-14-14-1x1-480-14-14-256-0x0-1x1-1x1-0-NCHW-FP16-B=ConvAsm1x1U:1,16,2,16,1,2,2,2;ConvOclDirectFwd1x1:1,256,1,1,0,2,16,4,0
512-14-14-1x1-24-14-14-8-0x0-1x1-1x1-0-NCHW-FP32-F=ConvAsm1x1U:1,8,1,64,1,4,4,1;ConvActivAsm1x1U:1,16,1,16,1,4;ConvOclDirectFwd1x1:1,256,1,1,0,1,4,8,0
256-14-14-1x1-512-28-28-32-0x0-2x2-1x1-0-NCHW-FP32-B=ConvAsm1x1U:1,16,1,64,2,2,1,1;ConvOclDirectFwd1x1:1,256,1,1,0,1,32,4,0
256-13-13-3x3-256-13-13-50-1x1-1x1-1x1-0-NCHW-FP32-W=ConvAsmBwdWrW3x3:0,0,16,4,10,1
160-7-7-1x1-832-7-7-32-0x0-1x1-1x1-0-NCHW-FP32-W=ConvAsmBwdWrW1x1:1,16,2,8,4,1,2,4,0,1
448-8-8-1x1-2048-8-8-128-0x0-1x1-1x1-0-NCHW-FP32-W=ConvAsmBwdWrW1x1:1,16,4,8,4,1,2,4,0,1
320-8-8-1x1-2048-8-8-32-0x0-1x1-1x1-0-NCHW-FP32-W=ConvAsmBwdWrW1x1:2,8,4,2,8,1,1,4,0,1
32-14-14-1x1-512-14-14-64-0x0-1x1-1x1-0-NCHW-FP32-B=ConvAsm1x1U:1,16,1,64,1,2,2,2;ConvOclDirectFwd1x1:1,256,1,1,0,4,16,4,0
320-7-7-3x3-160-7-7-128-1x1-1x1-1x1-0-NCHW-FP32-W=ConvAsmBwdWrW3x3:0,1,8,2,7,3
1632-14-14-1x1-192-14-14-16-0x0-1x1-1x1-0-NCHW-FP32-F=ConvAsm1x1U:3,8,3,16,1,4,1,4;ConvActivAsm1x1U:3,16,3,16,4,4;ConvOclDirectFwd1x1:1,64,1,1,1,0,32,256,0
384-8-8-1x1-1280-8-8-4-0x0-1x1-1x1-0-NCHW-FP16-B=ConvAsm1x1U:1,8,2,16,1,4,4,1;ConvOclDirectFwd1x1:1,64,1,1,0,2,4,4,0
512-4-4-3x3-512-7-7-64-1x1-2x2-1x1-0-NCHW-FP32-W=ConvAsmBwdWrW3x3:0,0,8,4,7,1
528-14-14-1x1-256-14-14-8-0x0-1x1-1x1-0-NCHW-FP16-F=ConvAsm1x1U:1,8,2,64,1,4,2,2;ConvOclDirectFwd1x1:1,256,1,1,0,4,4,4,0
16-14-14-1x1-480-14-14-256-0x0-1x1-1x1-0-NCHW-FP16-F=ConvAsm1x1U:1,8,2,64,1,4,1,4;ConvOclDirectFwd1x1:1,128,1,1,0,4,8,4,0
32-14-14-1x1-512-14-14-128-0x0-1x1-1x1-0-NCHW-FP32-W=ConvAsmBwdWrW1x1:4,4,4,4,4,1,4,4,0,1
64-14-14-1x1-512-14-14-64-0x0-1x1-1x1-0-NCHW-FP16-W=ConvAsmBwdWrW1x1:4,4,4,2,4,2,1,4,0,2
64-80-350-3x3-64-80-350-2-1x1-1x1-1x1-0-NCHW-FP16-B=ConvOclDirectFwd:8,16,16,32,2,2,8,4,2
256-13-13-3x3-256-13-13-64-1x1-1x1-1x1-0-NCHW-FP16-F=ConvOclDirectFwd:8,8,16,16,2,2,8,2,2
512-14-14-1x1-32-14-14-256-0x0-1x1-1x1-0-NCHW-FP32-F=ConvAsm1x1U:4,16,4,64,1,2,1,1;ConvActivAsm1x1U:3,16,4,64,1,4;ConvOclDirectFwd1x1:1,64,1,1,1,0,32,2048,0
16-14-14-5x5-48-14-14-256-2x2-1x1-1x1-0-NCHW-FP16-F=ConvOclDirectFwd:8,8,16,16,2,2,8,1,2;ConvOclDirectFwdFused:8,8,16,16,2,2,8,2,2
320-8-8-1x1-2048-8-8-8-0x0-1x1-1x1-0-NCHW-FP16-W=ConvAsmBwdWrW1x1:1,16,2,8,2,1,1,4,0,0
256-14-14-1x1-1024-14-14-2-0x0-1x1-1x1-0-NCHW-FP32-W=ConvAsmBwdWrW1x1:1,16,2,4,4,1,1,4,0,1
48-35-35-5x5-64-35-35-256-2x2-1x1-1x1-0-NCHW-FP16-F=ConvOclDirectFwd:8,8,16,16,2,2,8,2,1;ConvOclDirectFwdFused:8,8,16,16,2,2,8,2,2
192-14-14-1x1-1200-14-14-16-0x0-1x1-1x1-0-NCHW-FP16-W=ConvAsmBwdWrW1x1:2,8,4,8,2,1,1,2,0,1
512-7-7-3x3-256-7-7-1-1x1-1x1-1x1-0-NCHW-FP16-B=ConvOclDirectFwd:8,8,8,8,1,1,1,4,1
192-28-28-1x1-720-28-28-16-0x0-1x1-1x1-0-NCHW-FP32-B=ConvOclDirectFwd1x1:1,64,1,1,0,4,16,4,0
192-14-14-1x1-624-14-14-16-0x0-1x1-1x1-0-NCHW-FP16-B=ConvAsm1x1U:1,16,2,16,1,2,2,2;ConvOclDirectFwd1x1:1,128,1,1,0,4,8,4,0
96-28-28-1x1-192-28-28-8-0x0-1x1-1x1-0-NCHW-FP16-B=ConvAsm1x1U:1,16,2,16,1,2,2,2;ConvOclDirectFwd1x1:1,64,1,1,0,4,8,4,0
160-14-14-1x1-528-14-14-32-0x0-1x1-1x1-0-NCHW-FP32-B=ConvAsm1x1U:1,16,1,32,2,1,2,2;ConvOclDirectFwd1x1:8,64,16,16,0,2,16,4,1
128-7-7-1x1-832-7-7-256-0x0-1x1-1x1-0-NCHW-FP32-W=ConvAsmBwdWrW1x1:1,16,2,8,4,1,2,4,0,3
192-14-14-1x1-960-14-14-16-0x0-1x1-1x1-0-NCHW-FP16-B=ConvAsm1x1U:1,16,2,16,1,2,2,2;ConvOclDirectFwd1x1:1,64,1,1,0,4,8,4,0
128-112-112-3x3-64-112-112-2-1x1-1x1-1x1-0-NCHW-FP32-W=ConvAsmBwdWrW3x3:0,0,16,2,2,1
384-8-8-1x1-2048-8-8-16-0x0-1x1-1x1-0-NCHW-FP32-W=ConvAsmBwdWrW1x1:1,16,2,4,8,1,1,4,0,1
192-17-17-3x3-320-8-8-256-0x0-2x2-1x1-0-NCHW-FP32-F=ConvOclDirectFwd:8,8,8,8,1,1,8,2,1
192-7-7-1x1-1296-7-7-16-0x0-1x1-1x1-0-NCHW-FP32-B=ConvAsm1x1U:1,16,1,64,2,2,2,2;ConvOclDirectFwd1x1:1,256,1,1,0,1,8,4,0
192-35-35-3x3-224-35-35-32-1x1-1x1-1x1-0-NCHW-FP16-F=ConvOclDirectFwd:8,8,16,16,2,2,8,2,2;ConvOclDirectFwdFused:8,8,16,16,2,2,8,2,2
256-28-28-1x1-128-28-28-256-0x0-1x1-1x1-0-NCHW-FP32-W=ConvAsmBwdWrW1x1:2,8,4,8,2,1,4,4,0,2
384-14-14-1x1-192-14-14-16-0x0-1x1-1x1-0-NCHW-FP16-F=ConvAsm1x1U:1,8,2,64,1,4,2,2;ConvOclDirectFwd1x1:1,64,1,1,0,4,8,4,0
384-17-17-1x1-1024-17-17-64-0x0-1x1-1x1-0-NCHW-FP16-W=ConvAsmBwdWrW1x1:2,8,4,8,2,1,1,4,0,1
256-14-14-1x1-1024-14-14-4-0x0-1x1-1x1-0-NCHW-FP32-F=ConvAsm1x1U:2,8,2,64,2,4,1,4;ConvActivAsm1x1U:4,16,4,64,1,2;ConvOclDirectFwd1x1:1,64,1,1,1,0,16,256,0
192-13-13-3x3-384-13-13-256-1x1-1x1-1x1-0-NCHW-FP16-F=ConvOclDirectFwd:8,8,16,16,2,2,8,1,1;ConvOclDirectFwdFused:8,8,16,16,2,2,8,1,1
192-8-8-1x1-1280-8-8-8-0x0-1x1-1x1-0-NCHW-FP32-B=ConvAsm1x1U:1,8,1,32,1,4,1,4;ConvOclDirectFwd1x1:1,128,1,1,0,2,8,8,0
48-35-35-1x1-192-35-35-16-0x0-1x1-1x1-0-NCHW-FP32-B=ConvAsm1x1U:1,16,1,64,2,2,2,2;ConvOclDirectFwd1x1:1,256,1,1,0,1,16,8,0
512-14-14-1x1-1024-14-14-128-0x0-1x1-1x1-0-NCHW-FP32-W=ConvAsmBwdWrW1x1:1,16,4,8,4,1,1,4,0,0
32-128-256-1x1-192-128-256-1-0x0-1x1-1x1-0-NCHW-FP32-W=ConvAsmBwdWrW1x1:4,4,2,2,4,1,1,4,0,2
64-35-35-1x1-384-35-35-32-0x0-1x1-1x1-0-NCHW-FP16-B=ConvAsm1x1U:1,16,2,16,1,2,1,2;ConvOclDirectFwd1x1:1,64,1,1,0,1,32,4,0
256-20-84-3x3-256-20-84-1-1x1-1x1-1x1-0-NCHW-FP32-W=ConvAsmBwdWrW3x3:0,0,16,4,2,1
528-14-14-1x1-128-14-14-256-0x0-1x1-1x1-0-NCHW-FP16-F=ConvAsm1x1U:1,16,2,16,2,2,2,2;ConvOclDirectFwd1x1:1,64,1,1,0,4,16,4,0
96-14-14-1x1-480-14-14-4-0x0-1x1-1x1-0-NCHW-FP32-W=ConvAsmBwdWrW1x1:2,8,2,8,2,1,2,2,0,2
192-28-28-1x1-16-28-28-4-0x0-1x1-1x1-0-NCHW-FP32-F=ConvAsm1x1U:1,8,1,32,1,4,2,1;ConvActivAsm1x1U:1,16,1,16,1,4;ConvOclDirectFwd1x1:1,64,1,1,1,4,64,64,0
48-56-56-3x3-192-56-56-16-1x1-1x1-1x1-0-NCHW-FP32-W=ConvAsmBwdWrW3x3:0,0,16,4,3,2
16-28-28-1x1-192-28-28-512-0x0-1x1-1x1-0-NCHW-FP32-W=ConvAsmBwdWrW1x1:4,4,2,4,2,1,4,4,0,3
192-35-35-1x1-64-35-35-32-0x0-1x1-1x1-0-NCHW-FP32-F=ConvAsm1x1U:2,16,2,64,3,2,1,1;ConvActivAsm1x1U:2,16,2,64,3,1;ConvOclDirectFwd1x1:1,64,1,1,1,4,16,2048,0
512-7-7-3x3-512-7-7-2-1x1-1x1-1x1-0-NCHW-FP32-W=ConvAsmBwdWrW3x3:0,1,8,4,7,1
160-14-14-1x1-512-14-14-1-0x0-1x1-1x1-0-NCHW-FP32-W=ConvAsmBwdWrW1x1:2,8,4,2,2,1,1,4,0,1
576-14-14-1x1-160-14-14-64-0x0-1x1-1x1-0-NCHW-FP16-F=ConvAsm1x1U:1,8,2,64,2,4,2,4;ConvOclDirectFwd1x1:1,64,1,1,0,4,16,4,0
64-35-35-1x1-256-35-35-256-0x0-1x1-1x1-0-NCHW-FP16-B=ConvAsm1x1U:1,16,2,16,1,2,1,2;ConvOclDirectFwd1x1:1,256,1,1,0,1,32,4,0
128-64-128-1x1-528-64-128-1-0x0-1x1-1x1-0-NCHW-FP16-B=ConvOclDirectFwd1x1:1,64,1,1,0,4,16,4,0
1296-7-7-1x1-192-7-7-16-0x0-1x1-1x1-0-NCHW-FP32-F=ConvAsm1x1U:2,8,2,32,1,4,2,2;ConvActivAsm1x1U:4,16,4,16,1,4;ConvOclDirectFwd1x1:1,64,1,1,1,1,16,256,0
48-35-35-1x1-288-35-35-8-0x0-1x1-1x1-0-NCHW-FP16-W=ConvAsmBwdWrW1x1:4,4,4,2,4,1,4,4,0,0
512-28-28-3x3-512-28-28-32-1x1-1x1-1x1-0-NCHW-FP16-W=ConvAsmBwdWrW3x3:0,0,8,4,2,2
96-35-35-3x3-96-35-35-1-1x1-1x1-1x1-0-NCHW-FP16-B=ConvOclDirectFwd:16,16,16,16,1,1,4,4,1
64-27-27-5x5-192-27-27-256-2x2-1x1-1x1-0-NCHW-FP16-F=ConvOclDirectFwd:16,16,32,32,2,2,8,1,1;ConvOclDirectFwdFused:16,16,32,32,2,2,8,1,1
320-17-17-3x3-320-8-8-4-0x0-2x2-1x1-0-NCHW-FP32-F=ConvOclDirectFwd:8,8,8,8,1,1,2,2,2
256-14-14-1x1-256-14-14-16-0x0-1x1-1x1-0-NCHW-FP32-W=ConvAsmBwdWrW1x1:2,8,2,2,8,1,2,4,0,1
256-14-14-1x1-528-14-14-8-0x0-1x1-1x1-0-NCHW-FP16-B=ConvAsm1x1U:1,16,2,16,1,2,2,2;ConvOclDirectFwd1x1:1,64,1,1,0,4,8,4,0
128-28-28-1x1-512-28-28-64-0x0-1x1-1x1-0-NCHW-FP32-W=ConvAsmBwdWrW1x1:1,16,2,4,8,1,4,4,0,2
512-14-14-1x1-24-14-14-4-0x0-1x1-1x1-0-NCHW-FP16-F=ConvAsm1x1U:1,8,2,16,1,4,4,1;ConvOclDirectFwd1x1:1,64,1,1,0,4,4,8,0
192-14-14-1x1-768-14-14-16-0x0-1x1-1x1-0-NCHW-FP16-W=ConvAsmBwdWrW1x1:2,8,2,8,2,1,2,4,0,1
256-28-28-1x1-128-28-28-4-0x0-1x1-1x1-0-NCHW-FP32-F=ConvAsm1x1U:1,8,1,32,2,4,2,8;ConvActivAsm1x1U:2,16,2,32,2,4;ConvOclDirectFwd1x1:1,64,1,1,1,0,16,128,0
432-28-28-1x1-192-28-28-16-0x0-1x1-1x1-0-NCHW-FP16-F=ConvAsm1x1U:1,8,2,32,2,4,2,2;ConvOclDirectFwd1x1:16,64,32,32,0,2,16,4,1
352-7-7-1x1-1056-7-7-64-0x0-1x1-1x1-0-NCHW-FP32-B=ConvAsm1x1U:1,16,1,64,2,2,2,2;ConvOclDirectFwd1x1:8,64,8,8,0,1,16,4,1
256-14-14-1x1-1024-14-14-128-0x0-1x1-1x1-0-NCHW-FP16-W=ConvAsmBwdWrW1x1:1,16,8,8,2,1,2,2,0,1
128-28-28-1x1-256-56-56-4-0x0-2x2-1x1-0-NCHW-FP32-B=ConvAsm1x1U:1,16,1,16,1,2,2,1;ConvOclDirectFwd1x1:1,256,1,1,0,1,8,4,0
192-7-7-1x1-2064-7-7-16-0x0-1x1-1x1-0-NCHW-FP32-B=ConvAsm1x1U:1,16,1,64,2,2,2,2;ConvOclDirectFwd1x1:1,128,1,1,0,1,16,4,0
384-7-7-1x1-832-7-7-32-0x0-1x1-1x1-0-NCHW-FP16-W=ConvAsmBwdWrW1x1:1,16,2,8,2,1,2,4,0,1
512-7-7-1x1-2048-7-7-2-0x0-1x1-1x1-0-NCHW-FP32-W=ConvAsmBwdWrW1x1:1,16,2,4,8,1,1,4,0,0
320-7-7-3x3-160-7-7-8-1x1-1x1-1x1-0-NCHW-FP16-W=ConvAsmBwdWrW3x3:0,0,8,2,1,1
256-56-56-1x1-512-28-28-16-0x0-2x2-1x1-0-NCHW-FP32-F=ConvAsm1x1U:2,16,3,16,2,2,2,2;ConvOclDirectFwd1x1:1,64,1,1,1,1,16,2048,0
224-35-35-3x3-256-17-17-16-0x0-2x2-1x1-0-NCHW-FP32-F=ConvOclDirectFwd:32,8,32,32,1,4,8,1,2
128-28-28-1x1-256-28-28-1-0x0-1x1-1x1-0-NCHW-FP16-W=ConvAsmBwdWrW1x1:4,4,2,4,2,1,1,2,0,1
96-128-256-5x5-32-128-256-1-2x2-1x1-1x1-0-NCHW-FP16-B=ConvOclDirectFwd:16,16,32,32,2,2,8,2,1
192-7-7-1x1-1488-7-7-16-0x0-1x1-1x1-0-NCHW-FP32-W=ConvAsmBwdWrW1x1:1,16,2,8,4,1,1,4,0,1
288-35-35-3x3-384-17-17-32-0x0-2x2-1x1-0-NCHW-FP32-F=ConvOclDirectFwd:32,8,32,32,1,4,8,1,2
32-14-14-1x1-528-14-14-4-0x0-1x1-1x1-0-NCHW-FP16-W=ConvAsmBwdWrW1x1:4,4,2,1,8,2,2,4,0,0
24-14-14-1x1-512-14-14-16-0x0-1x1-1x1-0-NCHW-FP32-W=ConvAsmBwdWrW1x1:4,4,2,2,2,1,1,4,0,3
256-28-28-1x1-512-28-28-64-0x0-1x1-1x1-0-NCHW-FP16-W=ConvAsmBwdWrW1x1:2,8,4,8,2,2,2,4,0,1
64-28-28-1x1-192-28-28-128-0x0-1x1-1x1-0-NCHW-FP16-W=ConvAsmBwdWrW1x1:4,4,8,1,8,2,4,4,0,1
320-8-8-3x3-192-17-17-32-0x0-2x2-1x1-0-NCHW-FP32-B=ConvOclDirectFwd:32,16,32,32,1,2,4,4,2
512-7-7-1x1-1024-14-14-1-0x0-2x2-1x1-0-NCHW-FP32-W=ConvAsmBwdWrW1x1:1,16,2,2,4,1,1,4,0,2
64-35-35-1x1-384-35-35-1-0x0-1x1-1x1-0-NCHW-FP16-B=ConvAsm1x1U:1,8,2,64,1,2,2,8;ConvOclDirectFwd1x1:1,128,1,1,0,1,4,4,0
256-17-17-3x3-224-35-35-64-0x0-2x2-1x1-0-NCHW-FP16-B=ConvOclDirectFwd:16,16,16,16,1,1,4,1,1
128-56-56-3x3-128-28-28-128-1x1-2x2-1x1-0-NCHW-FP32-F=ConvOclDirectFwd:16,16,16,16,1,1,8,2,2
3-224-224-3x3-64-224-224-32-1x1-1x1-1x1-0-NCHW-FP16-F=ConvOclDirectFwd:16,16,32,32,2,2,8,1,2;ConvOclDirectFwdFused:16,16,16,32,1,2,8,1,2
64-56-56-1x1-64-56-56-128-0x0-1x1-1x1-0-NCHW-FP16-B=ConvAsm1x1U:1,8,2,32,1,4,1,4;ConvOclDirectFwd1x1:1,64,1,1,0,4,16,4,0
48-7-7-1x1-832-7-7-64-0x0-1x1-1x1-0-NCHW-FP32-W=ConvAsmBwdWrW1x1:2,8,2,4,4,2,1,4,0,2
48-35-35-1x1-192-35-35-4-0x0-1x1-1x1-0-NCHW-FP16-W=ConvAsmBwdWrW1x1:4,4,2,4,2,1,2,2,0,1
512-14-14-1x1-112-14-14-256-0x0-1x1-1x1-0-NCHW-FP32-F=ConvAsm1x1U:4,16,4,64,1,2,1,2;ConvActivAsm1x1U:3,32,7,32,1,2;ConvOclDirectFwd1x1:1,64,1,1,1,0,16,2048,0
64-35-35-1x1-256-35-35-128-0x0-1x1-1x1-0-NCHW-FP32-B=ConvAsm1x1U:1,32,1,64,2,1,1,4;ConvOclDirectFwd1x1:1,64,1,1,0,1,32,4,0
32-14-14-1x1-512-14-14-1-0x0-1x1-1x1-0-NCHW-FP16-W=ConvAsmBwdWrW1x1:2,8,4,1,2,1,1,4,0,1
528-14-14-1x1-32-14-14-256-0x0-1x1-1x1-0-NCHW-FP32-F=ConvAsm1x1U:2,16,2,64,2,2,1,1;ConvActivAsm1x1U:4,32,7,32,1,2;ConvOclDirectFwd1x1:1,64,1,1,1,1,64,2048,0
192-28-28-1x1-96-28-28-64-0x0-1x1-1x1-0-NCHW-FP16-F=ConvAsm1x1U:1,8,2,16,2,4,1,4;ConvOclDirectFwd1x1:1,256,1,1,0,4,16,4,0
1024-14-14-1x1-512-7-7-32-0x0-2x2-1x1-0-NCHW-FP16-F=ConvAsm1x1U:2,8,4,16,1,4,4,2;ConvOclDirectFwd1x1:1,256,1,1,0,1,8,4,0
256-17-17-1x1-1024-17-17-4-0x0-1x1-1x1-0-NCHW-FP16-B=ConvAsm1x1U:1,16,2,16,1,2,2,2;ConvOclDirectFwd1x1:1,256,1,1,0,1,8,4,0
64-73-73-1x1-160-73-73-1-0x0-1x1-1x1-0-NCHW-FP32-W=ConvAsmBwdWrW1x1:4,4,2,4,2,1,1,4,0,2
64-28-28-1x1-320-28-28-64-0x0-1x1-1x1-0-NCHW-FP16-B=ConvAsm1x1U:1,16,2,16,1,2,1,4;ConvOclDirectFwd1x1:1,64,1,1,0,4,16,4,0
96-17-17-3x3-96-35-35-1-0x0-2x2-1x1-0-NCHW-FP16-B=ConvOclDirectFwd:8,32,32,32,4,1,2,4,1
576-14-14-1x1-192-14-14-64-0x0-1x1-1x1-0-NCHW-FP16-F=ConvAsm1x1U:2,8,4,64,1,4,2,4;ConvOclDirectFwd1x1:1,128,1,1,0,4,16,4,0
192-71-71-3x3-192-35-35-16-0x0-2x2-1x1-0-NCHW-FP32-F=ConvOclDirectFwd:16,16,16,16,1,1,8,2,2
96-35-35-3x3-96-35-35-1-1x1-1x1-1x1-0-NCHW-FP32-W=ConvAsmBwdWrW3x3:0,0,8,2,3,1
96-14-14-1x1-480-14-14-64-0x0-1x1-1x1-0-NCHW-FP32-B=ConvAsm1x1U:1,16,1,64,2,1,1,2;ConvOclDirectFwd1x1:1,256,1,1,0,2,16,4,0
1024-17-17-1x1-384-17-17-8-0x0-1x1-1x1-0-NCHW-FP32-F=ConvAsm1x1U:2,16,2,16,2,2,1,4;ConvActivAsm1x1U:2,16,2,32,4,4;ConvOclDirectFwd1x1:1,64,1,1,1,0,32,256,0
48-35-35-1x1-192-35-35-1-0x0-1x1-1x1-0-NCHW-FP16-W=ConvAsmBwdWrW1x1:4,4,2,2,2,1,1,2,0,1
1024-17-17-1x1-384-17-17-64-0x0-1x1-1x1-0-NCHW-FP16-F=ConvAsm1x1U:2,16,4,16,1,2,2,2;ConvOclDirectFwd1x1:16,64,32,32,0,1,16,4,1
528-14-14-1x1-256-14-14-1-0x0-1x1-1x1-0-NCHW-FP32-F=ConvAsm1x1U:1,8,1,64,1,4,4,1;ConvActivAsm1x1U:1,16,1,64,1,4;ConvOclDirectFwd1x1:1,64,1,1,1,0,16,64,0
384-8-8-3x3-448-8-8-64-1x1-1x1-1x1-0-NCHW-FP32-W=ConvAsmBwdWrW3x3:0,1,8,4,4,1
512-7-7-1x1-2048-7-7-16-0x0-1x1-1x1-0-NCHW-FP32-F=ConvAsm1x1U:2,16,2,32,2,2,1,2;ConvActivAsm1x1U:2,32,2,32,2,1;ConvOclDirectFwd1x1:1,64,1,1,1,1,32,2048,0
256-13-13-3x3-256-13-13-64-1x1-1x1-1x1-0-NCHW-FP16-W=ConvAsmBwdWrW3x3:0,0,8,4,3,1
256-14-14-3x3-256-28-28-32-1x1-2x2-1x1-0-NCHW-FP32-B=ConvOclDirectFwd:32,32,32,32,1,1,4,4,2
256-56-56-1x1-64-56-56-2-0x0-1x1-1x1-0-NCHW-FP16-W=ConvAsmBwdWrW1x1:4,4,4,1,4,1,2,4,0,0
128-40-175-3x3-128-40-175-2-1x1-1x1-1x1-0-NCHW-FP32-W=ConvAsmBwdWrW3x3:0,0,16,4,2,1
576-14-14-1x1-96-14-14-64-0x0-1x1-1x1-0-NCHW-FP16-F=ConvAsm1x1U:2,8,4,64,1,4,2,4;ConvOclDirectFwd1x1:1,64,1,1,0,4,16,4,0
512-7-7-1x1-2048-7-7-1-0x0-1x1-1x1-0-NCHW-FP16-F=ConvAsm1x1U:1,8,2,32,1,4,4,4;ConvOclDirectFwd1x1:1,256,1,1,0,1,4,8,0
64-80-350-3x3-64-80-350-1-1x1-1x1-1x1-0-NCHW-FP16-F=ConvOclDirectFwd:8,32,16,32,2,1,8,1,1
64-56-56-3x3-64-56-56-256-1x1-1x1-1x1-0-NCHW-FP16-W=ConvAsmBwdWrW3x3:0,0,16,2,2,2
2048-7-7-1x1-1024-14-14-8-0x0-2x2-1x1-0-NCHW-FP32-B=ConvAsm1x1U:2,16,2,32,1,2,4,4;ConvOclDirectFwd1x1:1,256,1,1,0,1,8,8,0
128-14-14-1x1-608-14-14-64-0x0-1x1-1x1-0-NCHW-FP32-W=ConvAsmBwdWrW1x1:1,16,2,4,8,1,2,4,0,1
192-28-28-1x1-240-28-28-16-0x0-1x1-1x1-0-NCHW-FP16-B=ConvAsm1x1U:1,16,2,16,1,2,4,1;ConvOclDirectFwd1x1:1,64,1,1,0,4,16,4,0
24-14-14-1x1-512-14-14-256-0x0-1x1-1x1-0-NCHW-FP32-W=ConvAsmBwdWrW1x1:4,4,4,4,4,1,4,4,0,2
64-35-35-3x3-96-35-35-8-1x1-1x1-1x1-0-NCHW-FP16-F=ConvOclDirectFwd:16,8,16,16,1,2,8,4,2;ConvOclDirectFwdFused:16,8,16,16,1,2,8,4,2
112-14-14-1x1-512-14-14-256-0x0-1x1-1x1-0-NCHW-FP32-W=ConvAsmBwdWrW1x1:4,4,8,4,4,1,2,4,0,1
64-73-73-1x1-160-73-73-64-0x0-1x1-1x1-0-NCHW-FP16-W=ConvAsmBwdWrW1x1:4,4,8,4,2,2,4,4,0,1
1392-7-7-1x1-192-7-7-16-0x0-1x1-1x1-0-NCHW-FP16-F=ConvAsm1x1U:1,8,2,32,1,4,4,1;ConvOclDirectFwd1x1:1,64,1,1,0,1,4,4,0
480-14-14-1x1-64-14-14-128-0x0-1x1-1x1-0-NCHW-FP32-F=ConvAsm1x1U:3,16,4,64,1,2,2,2;ConvActivAsm1x1U:4,32,7,32,1,2;ConvOclDirectFwd1x1:1,64,1,1,1,1,32,2048,0
256-14-14-1x1-512-28-28-1-0x0-2x2-1x1-0-NCHW-FP16-W=ConvAsmBwdWrW1x1:2,8,2,4,2,1,1,4,0,0
384-17-17-1x1-1024-17-17-32-0x0-1x1-1x1-0-NCHW-FP32-B=ConvAsm1x1U:1,16,1,64,4,2,1,2;ConvOclDirectFwd1x1:1,256,1,1,0,1,32,4,0
192-14-14-1x1-672-14-14-16-0x0-1x1-1x1-0-NCHW-FP32-B=ConvAsm1x1U:1,16,1,32,3,2,2,2;ConvOclDirectFwd1x1:1,128,1,1,0,2,16,4,0
64-35-35-1x1-384-35-35-4-0x0-1x1-1x1-0-NCHW-FP32-B=ConvAsm1x1U:1,16,1,64,2,2,1,2;ConvOclDirectFwd1x1:1,256,1,1,0,1,8,4,0
24-14-14-5x5-64-14-14-1-2x2-1x1-1x1-0-NCHW-FP16-F=ConvOclDirectFwd:16,16,16,16,1,1,1,4,1;ConvOclDirectFwdFused:16,16,16,16,1,1,1,4,1
128-28-28-1x1-256-56-56-1-0x0-2x2-1x1-0-NCHW-FP16-W=ConvAsmBwdWrW1x1:4,4,4,1,4,1,1,4,0,0
832-7-7-1x1-160-7-7-512-0x0-1x1-1x1-0-NCHW-FP16-F=ConvAsm1x1U:2,8,4,16,1,4,4,1;ConvOclDirectFwd1x1:8,64,8,8,0,1,16,4,1
256-14-14-1x1-512-28-28-4-0x0-2x2-1x1-0-NCHW-FP16-W=ConvAsmBwdWrW1x1:2,8,2,4,2,1,1,4,0,1
32-28-28-1x1-256-28-28-8-0x0-1x1-1x1-0-NCHW-FP16-B=ConvAsm1x1U:1,8,2,32,1,4,1,1;ConvOclDirectFwd1x1:1,64,1,1,0,2,16,8,0
80-73-73-3x3-192-71-71-256-0x0-1x1-1x1-0-NCHW-FP32-F=ConvOclDirectFwd:16,8,16,16,1,2,8,4,1
128-40-175-3x3-128-40-175-2-1x1-1x1-1x1-0-NCHW-FP16-B=ConvOclDirectFwd:8,16,16,32,2,2,8,1,2
256-7-7-1x1-832-7-7-128-0x0-1x1-1x1-0-NCHW-FP16-B=ConvAsm1x1U:1,16,2,32,1,2,2,2;ConvOclDirectFwd1x1:1,64,1,1,0,1,8,4,0
192-35-35-1x1-384-35-35-1-0x0-1x1-1x1-0-NCHW-FP16-B=ConvAsm1x1U:1,8,2,64,1,2,4,1;ConvOclDirectFwd1x1:1,128,1,1,0,1,4,4,0
32-28-28-5x5-96-28-28-16-2x2-1x1-1x1-0-NCHW-FP16-F=ConvOclDirectFwd:16,16,32,32,2,2,8,1,2;ConvOclDirectFwdFused:16,16,32,32,2,2,8,1,2
128-28-28-1x1-512-28-28-128-0x0-1x1-1x1-0-NCHW-FP32-W=ConvAsmBwdWrW1x1:1,16,2,4,8,1,4,4,0,2
256-55-55-1x1-64-55-55-32-0x0-1x1-1x1-0-NCHW-FP16-W=ConvAsmBwdWrW1x1:4,4,4,4,4,2,4,4,0,1
64-56-56-3x3-64-56-56-16-1x1-1x1-1x1-0-NCHW-FP16-F=ConvOclDirectFwd:16,16,32,32,2,2,8,4,2;ConvOclDirectFwdFused:16,16,32,32,2,2,8,4,2
48-7-7-5x5-128-7-7-512-2x2-1x1-1x1-0-NCHW-FP16-F=ConvOclDirectFwd:8,8,8,8,1,1,8,2,1;ConvOclDirectFwdFused:8,8,8,8,1,1,8,2,2
1024-7-7-1x1-256-14-14-16-0x0-2x2-1x1-0-NCHW-FP32-B=ConvAsm1x1U:1,16,1,64,1,2,4,2;ConvOclDirectFwd1x1:1,256,1,1,0,1,8,4,0
832-7-7-1x1-256-7-7-128-0x0-1x1-1x1-0-NCHW-FP16-F=ConvAsm1x1U:2,8,4,16,1,4,2,2;ConvOclDirectFwd1x1:8,64,8,8,0,1,16,4,1
256-14-14-1x1-1024-14-14-2-0x0-1x1-1x1-0-NCHW-FP16-F=ConvAsm1x1U:1,8,2,32,1,4,2,1;ConvOclDirectFwd1x1:1,256,1,1,0,2,8,4,0
256-14-14-3x3-128-14-14-512-1x1-1x1-1x1-0-NCHW-FP32-W=ConvAsmBwdWrW3x3:0,1,8,4,4,1
448-8-8-1x1-2048-8-8-4-0x0-1x1-1x1-0-NCHW-FP16-W=ConvAsmBwdWrW1x1:1,16,2,4,2,1,1,4,0,1
64-14-14-5x5-24-14-14-4-2x2-1x1-1x1-0-NCHW-FP32-B=ConvOclDirectFwd:16,16,16,16,1,1,1,4,2
160-17-17-1x1-768-17-17-256-0x0-1x1-1x1-0-NCHW-FP16-B=ConvAsm1x1U:1,16,2,32,1,2,1,2;ConvOclDirectFwd1x1:1,128,1,1,0,1,32,4,0
32-128-256-5x5-96-128-256-1-2x2-1x1-1x1-0-NCHW-FP32-F=ConvOclDirectFwd:16,16,16,32,1,2,8,1,1
128-7-7-5x5-32-7-7-4-2x2-1x1-1x1-0-NCHW-FP16-B=ConvOclDirectFwd:8,8,8,8,1,1,1,4,2
128-28-28-3x3-96-28-28-1-1x1-1x1-1x1-0-NCHW-FP16-B=ConvOclDirectFwd:16,16,16,16,1,1,2,4,1
64-35-35-3x3-96-35-35-32-1x1-1x1-1x1-0-NCHW-FP16-F=ConvOclDirectFwd:16,8,16,16,1,2,8,2,2;ConvOclDirectFwdFused:16,8,16,16,1,2,8,1,1
1024-17-17-1x1-256-17-17-16-0x0-1x1-1x1-0-NCHW-FP16-F=ConvAsm1x1U:3,8,6,32,1,4,4,1;ConvOclDirectFwd1x1:1,64,1,1,0,1,8,8,0
384-7-7-1x1-832-7-7-4-0x0-1x1-1x1-0-NCHW-FP16-F=ConvAsm1x1U:1,8,2,32,1,4,4,1;ConvOclDirectFwd1x1:1,64,1,1,0,1,8,8,0
256-28-28-1x1-64-28-28-512-0x0-1x1-1x1-0-NCHW-FP32-F=ConvAsm1x1U:2,16,2,32,2,2,1,4;ConvActivAsm1x1U:3,32,3,32,2,1;ConvOclDirectFwd1x1:1,64,1,1,1,0,16,2048,0
1024-14-14-1x1-2048-7-7-4-0x0-2x2-1x1-0-NCHW-FP16-F=ConvAsm1x1U:2,8,4,16,1,4,4,2;ConvOclDirectFwd1x1:1,256,1,1,0,1,16,4,0
32-28-28-5x5-192-28-28-16-2x2-1x1-1x1-0-NCHW-FP32-B=ConvOclDirectFwd:16,16,32,32,2,2,4,2,2
48-35-35-5x5-64-35-35-1-2x2-1x1-1x1-0-NCHW-FP16-F=ConvOclDirectFwd:16,16,16,16,1,1,2,4,1;ConvOclDirectFwdFused:8,32,16,32,2,1,2,4,1
64-14-14-1x1-512-14-14-32-0x0-1x1-1x1-0-NCHW-FP32-B=ConvAsm1x1U:1,16,1,64,2,2,1,1;ConvOclDirectFwd1x1:1,64,1,1,0,2,16,4,0
2048-7-7-1x1-1024-14-14-64-0x0-2x2-1x1-0-NCHW-FP32-W=ConvAsmBwdWrW1x1:1,16,4,8,4,1,1,4,0,1
192-14-14-1x1-1488-14-14-16-0x0-1x1-1x1-0-NCHW-FP32-W=ConvAsmBwdWrW1x1:2,8,4,4,8,1,2,4,0,1
64-56-56-1x1-256-56-56-16-0x0-1x1-1x1-0-NCHW-FP32-B=ConvAsm1x1U:1,8,1,64,1,4,1,4;ConvOclDirectFwd1x1:1,128,1,1,0,1,32,4,0
528-14-14-1x1-160-14-14-64-0x0-1x1-1x1-0-NCHW-FP16-F=ConvAsm1x1U:1,8,2,64,2,4,2,4;ConvOclDirectFwd1x1:1,64,1,1,0,4,16,4,0
96-28-28-1x1-192-28-28-64-0x0-1x1-1x1-0-NCHW-FP16-W=ConvAsmBwdWrW1x1:4,4,4,4,2,1,4,4,0,1
256-35-35-1x1-64-35-35-256-0x0-1x1-1x1-0-NCHW-FP16-B=ConvAsm1x1U:1,16,2,64,1,2,1,2;ConvOclDirectFwd1x1:1,64,1,1,0,1,32,4,0
256-14-14-1x1-1024-14-14-128-0x0-1x1-1x1-0-NCHW-FP32-W=ConvAsmBwdWrW1x1:1,16,4,8,4,1,2,4,0,1
32-14-14-1x1-528-14-14-4-0x0-1x1-1x1-0-NCHW-FP16-B=ConvAsm1x1U:1,8,2,64,1,4,2,1;ConvOclDirectFwd1x1:1,64,1,1,0,4,4,4,0
192-8-8-1x1-1280-8-8-32-0x0-1x1-1x1-0-NCHW-FP32-B=ConvAsm1x1U:1,16,1,64,2,2,1,4;ConvOclDirectFwd1x1:1,64,1,1,0,2,16,4,0
64-35-35-5x5-48-35-35-32-2x2-1x1-1x1-0-NCHW-FP32-B=ConvOclDirectFwd:16,8,16,16,1,2,8,2,2
2048-7-7-1x1-512-7-7-128-0x0-1x1-1x1-0-NCHW-FP32-B=ConvAsm1x1U:1,16,1,64,2,2,1,4;ConvOclDirectFwd1x1:1,256,1,1,0,1,32,4,0
192-14-14-1x1-1488-14-14-16-0x0-1x1-1x1-0-NCHW-FP16-W=ConvAsmBwdWrW1x1:2,8,4,8,2,1,2,4,0,1
832-7-7-1x1-160-7-7-64-0x0-1x1-1x1-0-NCHW-FP32-F=ConvAsm1x1U:2,8,2,32,1,4,1,4;ConvActivAsm1x1U:4,16,4,16,3,4;ConvOclDirectFwd1x1:1,64,1,1,1,4,64,256,0
256-14-14-3x3-256-14-14-8-1x1-1x1-1x1-0-NCHW-FP32-W=ConvAsmBwdWrW3x3:0,0,8,4,3,1
320-8-8-1x1-1280-8-8-128-0x0-1x1-1x1-0-NCHW-FP32-B=ConvAsm1x1U:1,16,1,64,4,2,1,4;ConvOclDirectFwd1x1:1,64,1,1,0,4,16,4,0
64-28-28-1x1-256-28-28-1-0x0-1x1-1x1-0-NCHW-FP16-W=ConvAsmBwdWrW1x1:4,4,4,1,2,1,1,4,0,0
192-56-56-3x3-64-56-56-16-1x1-1x1-1x1-0-NCHW-FP32-W=ConvAsmBwdWrW3x3:0,0,8,4,2,4
128-7-7-5x5-48-7-7-512-2x2-1x1-1x1-0-NCHW-FP32-B=ConvOclDirectFwd:8,8,8,8,1,1,8,2,1
384-17-17-3x3-288-35-35-128-0x0-2x2-1x1-0-NCHW-FP16-B=ConvOclDirectFwd:16,8,16,16,1,2,4,1,1
192-71-71-3x3-192-35-35-32-0x0-2x2-1x1-0-NCHW-FP32-F=ConvOclDirectFwd:16,16,16,16,1,1,8,2,1
384-8-8-1x1-1536-8-8-8-0x0-1x1-1x1-0-NCHW-FP32-W=ConvAsmBwdWrW1x1:1,16,2,8,4,1,2,4,0,1
512-28-28-1x1-128-28-28-8-0x0-1x1-1x1-0-NCHW-FP16-B=ConvAsm1x1U:1,16,2,16,1,2,4,1;ConvOclDirectFwd1x1:1,64,1,1,0,4,16,8,0
512-28-28-1x1-128-28-28-4-0x0-1x1-1x1-0-NCHW-FP16-B=ConvAsm1x1U:1,8,2,32,1,4,4,1;ConvOclDirectFwd1x1:1,64,1,1,0,2,4,4,0
192-14-14-1x1-576-14-14-16-0x0-1x1-1x1-0-NCHW-FP16-W=ConvAsmBwdWrW1x1:2,8,4,8,2,1,2,2,0,1
2048-7-7-1x1-1024-14-14-32-0x0-2x2-1x1-0-NCHW-FP16-B=ConvAsm1x1U:1,16,2,32,1,2,4,1;ConvOclDirectFwd1x1:1,64,1,1,0,1,16,4,0
224-14-14-3x3-112-14-14-4-1x1-1x1-1x1-0-NCHW-FP16-B=ConvOclDirectFwd:16,16,16,16,1,1,2,4,2
448-8-8-1x1-1280-8-8-1-0x0-1x1-1x1-0-NCHW-FP32-W=ConvAsmBwdWrW1x1:1,16,2,4,4,1,1,4,0,1
128-64-128-1x1-528-64-128-1-0x0-1x1-1x1-0-NCHW-FP32-W=ConvAsmBwdWrW1x1:2,8,4,8,2,1,1,4,0,1
512-14-14-3x3-512-14-14-2-1x1-1x1-1x1-0-NCHW-FP16-B=ConvOclDirectFwd:16,16,16,16,1,1,4,4,2
192-35-35-1x1-64-35-35-256-0x0-1x1-1x1-0-NCHW-FP16-F=ConvAsm1x1U:2,16,4,64,1,2,1,1;ConvOclDirectFwd1x1:1,64,1,1,0,1,16,8,0
480-14-14-1x1-192-14-14-64-0x0-1x1-1x1-0-NCHW-FP16-F=ConvAsm1x1U:1,8,2,64,2,4,1,8;ConvOclDirectFwd1x1:1,64,1,1,0,4,16,4,0
528-14-14-1x1-128-14-14-1-0x0-1x1-1x1-0-NCHW-FP32-F=ConvAsm1x1U:1,8,1,64,1,4,4,1;ConvActivAsm1x1U:2,16,2,16,1,4;ConvOclDirectFwd1x1:1,64,1,1,1,1,16,64,0
64-56-56-1x1-256-56-56-8-0x0-1x1-1x1-0-NCHW-FP16-W=ConvAsmBwdWrW1x1:4,4,4,1,8,1,2,4,0,1
64-28-28-1x1-192-28-28-64-0x0-1x1-1x1-0-NCHW-FP16-W=ConvAsmBwdWrW1x1:4,4,4,1,8,1,2,4,0,1
192-17-17-1x1-768-17-17-128-0x0-1x1-1x1-0-NCHW-FP32-W=ConvAsmBwdWrW1x1:1,16,4,4,8,1,2,4,0,1
1056-7-7-1x1-160-7-7-64-0x0-1x1-1x1-0-NCHW-FP32-F=ConvAsm1x1U:2,16,2,32,3,2,4,1;ConvActivAsm1x1U:4,16,4,16,3,4;ConvOclDirectFwd1x1:1,64,1,1,1,1,64,256,0
192-8-8-3x3-192-17-17-4-0x0-2x2-1x1-0-NCHW-FP16-B=ConvOclDirectFwd:8,8,32,32,4,4,2,4,2
128-56-56-1x1-256-56-56-32-0x0-1x1-1x1-0-NCHW-FP16-W=ConvAsmBwdWrW1x1:2,8,8,1,8,2,4,4,0,1
160-73-73-1x1-64-73-73-8-0x0-1x1-1x1-0-NCHW-FP32-F=ConvAsm1x1U:2,16,2,64,3,2,1,1;ConvActivAsm1x1U:2,16,2,64,3,1;ConvOclDirectFwd1x1:1,64,1,1,1,1,16,2048,0
256-20-84-5x5-512-9-41-16-1x1-2x2-1x1-0-NCHW-FP32-F=ConvOclDirectFwd:8,16,16,16,2,1,8,1,2
64-14-14-5x5-24-14-14-512-2x2-1x1-1x1-0-NCHW-FP16-B=ConvOclDirectFwd:8,8,16,16,2,2,8,2,2
1056-14-14-1x1-2112-14-14-16-0x0-1x1-1x1-0-NCHW-FP32-B=ConvAsm1x1U:1,32,1,32,2,1,4,1;ConvOclDirectFwd1x1:1,256,1,1,0,4,16,4,0
384-35-35-3x3-384-17-17-1-0x0-2x2-1x1-0-NCHW-FP32-F=ConvOclDirectFwd:32,8,32,32,1,4,2,1,1
256-35-35-1x1-64-35-35-16-0x0-1x1-1x1-0-NCHW-FP32-F=ConvAsm1x1U:2,16,2,64,2,2,2,1;ConvActivAsm1x1U:3,16,5,64,1,2;ConvOclDirectFwd1x1:1,64,1,1,1,4,16,2048,0
320-28-28-1x1-64-28-28-64-0x0-1x1-1x1-0-NCHW-FP32-F=ConvAsm1x1U:1,16,1,16,2,2,1,4;ConvActivAsm1x1U:3,16,3,32,2,2;ConvOclDirectFwd1x1:1,64,1,1,1,0,16,2048,0
384-8-8-1x1-1536-8-8-32-0x0-1x1-1x1-0-NCHW-FP16-B=ConvAsm1x1U:1,16,2,32,1,2,2,4;ConvOclDirectFwd1x1:1,256,1,1,0,4,16,4,0
160-7-7-1x1-832-7-7-8-0x0-1x1-1x1-0-NCHW-FP16-W=ConvAsmBwdWrW1x1:1,16,4,4,2,1,1,4,0,1
160-73-73-1x1-64-73-73-256-0x0-1x1-1x1-0-NCHW-FP16-F=ConvAsm1x1U:2,8,4,64,1,4,1,4;ConvOclDirectFwd1x1:1,64,1,1,0,1,32,4,0
64-73-73-1x1-160-73-73-64-0x0-1x1-1x1-0-NCHW-FP32-B=ConvAsm1x1U:1,32,1,64,1,1,1,1;ConvOclDirectFwd1x1:1,256,1,1,0,1,32,4,0
1280-8-8-1x1-320-8-8-8-0x0-1x1-1x1-0-NCHW-FP16-F=ConvAsm1x1U:1,8,2,32,1,2,4,1;ConvOclDirectFwd1x1:1,64,1,1,0,2,4,8,0
256-28-28-1x1-64-28-28-128-0x0-1x1-1x1-0-NCHW-FP32-F=ConvAsm1x1U:3,16,5,32,1,2,1,2;ConvActivAsm1x1U:3,16,3,32,2,1;ConvOclDirectFwd1x1:1,64,1,1,1,4,16,2048,0
32-128-256-1x1-256-128-256-1-0x0-1x1-1x1-0-NCHW-FP16-W=ConvAsmBwdWrW1x1:4,4,2,2,2,1,1,4,0,3
48-35-35-1x1-192-35-35-4-0x0-1x1-1x1-0-NCHW-FP32-W=ConvAsmBwdWrW1x1:4,4,4,1,8,1,2,4,0,1
32-28-28-1x1-192-28-28-1-0x0-1x1-1x1-0-NCHW-FP16-B=ConvAsm1x1U:1,8,2,64,1,2,2,4;ConvOclDirectFwd1x1:1,64,1,1,0,1,8,4,0
256-20-84-3x3-256-20-84-16-1x1-1x1-1x1-0-NCHW-FP16-F=ConvOclDirectFwd:16,16,32,32,2,2,8,4,1
192-14-14-1x1-480-14-14-32-0x0-1x1-1x1-0-NCHW-FP32-B=ConvAsm1x1U:1,16,1,32,2,2,2,2;ConvOclDirectFwd1x1:1,64,1,1,0,4,16,4,0
192-17-17-3x3-192-8-8-8-0x0-2x2-1x1-0-NCHW-FP32-F=ConvOclDirectFwd:8,8,8,8,1,1,2,2,2
64-35-35-1x1-256-35-35-8-0x0-1x1-1x1-0-NCHW-FP16-W=ConvAsmBwdWrW1x1:4,4,4,4,2,1,4,4,0,0
256-28-28-1x1-32-28-28-256-0x0-1x1-1x1-0-NCHW-FP32-F=ConvAsm1x1U:4,16,5,64,2,2,1,2;ConvActivAsm1x1U:3,16,3,64,2,1;ConvOclDirectFwd1x1:1,64,1,1,1,4,32,2048,0
768-17-17-1x1-192-17-17-256-0x0-1x1-1x1-0-NCHW-FP16-F=ConvAsm1x1U:2,16,4,16,1,2,2,2;ConvOclDirectFwd1x1:16,64,32,32,0,1,16,4,1
384-8-8-1x1-2048-8-8-64-0x0-1x1-1x1-0-NCHW-FP16-B=ConvAsm1x1U:1,16,2,32,1,2,2,4;ConvOclDirectFwd1x1:1,64,1,1,0,4,16,4,0
3-224-224-7x7-64-112-112-64-3x3-2x2-1x1-0-NCHW-FP32-F=ConvOclDirectFwd:16,8,16,16,1,2,8,1,2
96-14-14-1x1-608-14-14-32-0x0-1x1-1x1-0-NCHW-FP16-B=ConvAsm1x1U:1,16,2,16,1,2,2,2;ConvOclDirectFwd1x1:1,64,1,1,0,4,8,4,0
528-14-14-1x1-128-14-14-512-0x0-1x1-1x1-0-NCHW-FP16-F=ConvAsm1x1U:1,16,2,16,2,2,1,4;ConvOclDirectFwd1x1:8,64,16,16,0,2,16,4,1
384-35-35-1x1-64-35-35-256-0x0-1x1-1x1-0-NCHW-FP16-W=ConvAsmBwdWrW1x1:4,4,8,4,2,1,2,4,0,1
80-73-73-1x1-64-73-73-8-0x0-1x1-1x1-0-NCHW-FP16-W=ConvAsmBwdWrW1x1:4,4,4,2,4,2,4,4,0,1
1280-8-8-1x1-320-8-8-1-0x0-1x1-1x1-0-NCHW-FP16-F=ConvAsm1x1U:1,8,2,16,1,4,4,1;ConvOclDirectFwd1x1:1,64,1,1,0,1,4,8,0
64-256-512-1x1-64-256-512-1-0x0-1x1-1x1-0-NCHW-FP32-F=ConvOclDirectFwdFused:1,64,1,1,1,4,32,128,0;ConvOclDirectFwd1x1:1,64,1,1,1,0,32,256,0
256-14-14-3x3-256-14-14-8-1x1-1x1-1x1-0-NCHW-FP16-B=ConvOclDirectFwd:16,8,16,16,1,2,4,2,2
384-13-13-3x3-384-13-13-8-1x1-1x1-1x1-0-NCHW-FP16-W=ConvAsmBwdWrW3x3:0,0,8,4,3,1
256-28-28-1x1-32-28-28-1-0x0-1x1-1x1-0-NCHW-FP16-F=ConvAsm1x1U:1,8,2,32,1,4,4,2;ConvOclDirectFwd1x1:1,128,1,1,0,1,4,8,0
128-56-56-1x1-256-56-56-128-0x0-1x1-1x1-0-NCHW-FP16-B=ConvAsm1x1U:1,16,2,32,1,2,1,2;ConvOclDirectFwd1x1:1,128,1,1,0,4,16,4,0
64-55-55-1x1-64-55-55-32-0x0-1x1-1x1-0-NCHW-FP16-W=ConvAsmBwdWrW1x1:4,4,2,4,2,1,4,2,0,2
128-28-28-3x3-96-28-28-4-1x1-1x1-1x1-0-NCHW-FP16-B=ConvOclDirectFwd:8,32,32,32,4,1,2,4,2
192-56-56-1x1-192-56-56-16-0x0-1x1-1x1-0-NCHW-FP16-F=ConvAsm1x1U:1,8,2,32,1,4,1,4;ConvOclDirectFwd1x1:1,128,1,1,0,4,16,4,0
384-8-8-1x1-1280-8-8-128-0x0-1x1-1x1-0-NCHW-FP16-B=ConvAsm1x1U:1,16,2,32,1,2,2,4;ConvOclDirectFwd1x1:1,64,1,1,0,4,16,4,0
384-8-8-1x1-1280-8-8-256-0x0-1x1-1x1-0-NCHW-FP32-B=ConvAsm1x1U:1,16,1,64,4,2,1,4;ConvOclDirectFwd1x1:1,256,1,1,0,4,16,4,0
128-28-28-1x1-256-56-56-128-0x0-2x2-1x1-0-NCHW-FP32-B=ConvAsm1x1U:1,16,1,32,2,2,2,2;ConvOclDirectFwd1x1:1,256,1,1,0,2,32,4,0
96-35-35-3x3-96-35-35-32-1x1-1x1-1x1-0-NCHW-FP16-B=ConvOclDirectFwd:16,8,16,16,1,2,8,1,1
192-8-8-1x1-1280-8-8-128-0x0-1x1-1x1-0-NCHW-FP32-W=ConvAsmBwdWrW1x1:1,16,4,4,8,1,2,4,0,1
512-14-14-1x1-160-14-14-64-0x0-1x1-1x1-0-NCHW-FP16-F=ConvAsm1x1U:2,8,4,64,1,4,2,4;ConvOclDirectFwd1x1:1,128,1,1,0,4,16,4,0
1024-7-7-1x1-192-7-7-32-0x0-1x1-1x1-0-NCHW-FP32-F=ConvAsm1x1U:4,8,4,16,1,2,2,2;ConvActivAsm1x1U:4,16,4,16,2,4;ConvOclDirectFwd1x1:1,64,1,1,1,1,16,256,0
384-8-8-1x1-2048-8-8-128-0x0-1x1-1x1-0-NCHW-FP16-B=ConvAsm1x1U:1,16,2,16,1,2,2,2;ConvOclDirectFwd1x1:1,128,1,1,0,4,16,4,0
128-112-112-3x3-128-112-112-128-1x1-1x1-1x1-0-NCHW-FP16-W=ConvAsmBwdWrW3x3:0,0,16,4,1,1
112-14-14-1x1-512-14-14-32-0x0-1x1-1x1-0-NCHW-FP32-W=ConvAsmBwdWrW1x1:2,8,2,4,4,1,1,4,0,2
1280-8-8-1x1-384-8-8-32-0x0-1x1-1x1-0-NCHW-FP16-F=ConvAsm1x1U:1,8,2,16,2,4,2,2;ConvOclDirectFwd1x1:1,256,1,1,0,2,8,4,0
128-7-7-1x1-1056-7-7-32-0x0-1x1-1x1-0-NCHW-FP16-W=ConvAsmBwdWrW1x1:4,4,4,4,2,1,2,2,0,0
352-7-7-1x1-1056-7-7-64-0x0-1x1-1x1-0-NCHW-FP32-W=ConvAsmBwdWrW1x1:1,16,2,4,8,1,2,4,0,3
2048-8-8-1x1-384-8-8-1-0x0-1x1-1x1-0-NCHW-FP16-F=ConvAsm1x1U:1,8,2,32,1,4,4,1;ConvOclDirectFwd1x1:1,64,1,1,0,2,4,4,0
256-14-14-1x1-512-28-28-1-0x0-2x2-1x1-0-NCHW-FP32-W=ConvAsmBwdWrW1x1:1,16,2,4,2,1,1,4,0,2
32-149-149-3x3-3-299-299-128-0x0-2x2-1x1-0-NCHW-FP16-B=ConvOclDirectFwd:16,16,32,32,2,2,8,2,1
128-14-14-5x5-32-14-14-8-2x2-1x1-1x1-0-NCHW-FP32-B=ConvOclDirectFwd:16,16,16,16,1,1,2,4,2
32-147-147-3x3-64-147-147-16-1x1-1x1-1x1-0-NCHW-FP16-F=ConvOclDirectFwd:16,16,32,32,2,2,8,4,2;ConvOclDirectFwdFused:16,16,32,32,2,2,8,4,2
256-14-14-1x1-1024-14-14-1-0x0-1x1-1x1-0-NCHW-FP32-F=ConvAsm1x1U:2,8,2,64,1,4,2,2;ConvActivAsm1x1U:2,16,4,64,1,4;ConvOclDirectFwd1x1:1,64,1,1,1,0,16,2048,0
16-28-28-1x1-192-28-28-256-0x0-1x1-1x1-0-NCHW-FP16-B=ConvAsm1x1U:1,8,2,64,1,4,1,8;ConvOclDirectFwd1x1:1,64,1,1,0,2,32,8,0
192-56-56-3x3-64-56-56-32-1x1-1x1-1x1-0-NCHW-FP32-W=ConvAsmBwdWrW3x3:0,1,16,4,3,1
192-7-7-1x1-1440-7-7-16-0x0-1x1-1x1-0-NCHW-FP16-B=ConvAsm1x1U:2,16,4,16,1,2,2,1;ConvOclDirectFwd1x1:1,64,1,1,0,1,4,4,0
384-8-8-1x1-1280-8-8-256-0x0-1x1-1x1-0-NCHW-FP16-B=ConvAsm1x1U:1,16,2,32,1,2,2,2;ConvOclDirectFwd1x1:1,256,1,1,0,4,16,4,0
64-35-35-1x1-256-35-35-32-0x0-1x1-1x1-0-NCHW-FP16-W=ConvAsmBwdWrW1x1:4,4,8,4,2,1,4,4,0,1
384-13-13-3x3-384-13-13-16-1x1-1x1-1x1-0-NCHW-FP16-W=ConvAsmBwdWrW3x3:0,0,8,4,4,1
192-7-7-1x1-1440-7-7-16-0x0-1x1-1x1-0-NCHW-FP32-W=ConvAsmBwdWrW1x1:1,16,2,8,4,1,1,4,0,1
256-28-28-1x1-32-28-28-16-0x0-1x1-1x1-0-NCHW-FP16-F=ConvAsm1x1U:1,8,2,32,1,4,4,1;ConvOclDirectFwd1x1:1,64,1,1,0,2,8,4,0
512-14-14-1x1-112-14-14-32-0x0-1x1-1x1-0-NCHW-FP16-F=ConvAsm1x1U:2,8,4,64,1,4,4,1;ConvOclDirectFwd1x1:1,64,1,1,0,4,8,4,0
24-14-14-1x1-512-14-14-128-0x0-1x1-1x1-0-NCHW-FP16-B=ConvAsm1x1U:1,16,2,16,1,2,1,4;ConvOclDirectFwd1x1:1,256,1,1,0,4,8,4,0
32-28-28-1x1-256-28-28-256-0x0-1x1-1x1-0-NCHW-FP16-B=ConvAsm1x1U:1,16,2,16,1,2,1,4;ConvOclDirectFwd1x1:1,256,1,1,0,2,32,4,0
768-17-17-1x1-192-17-17-8-0x0-1x1-1x1-0-NCHW-FP16-F=ConvAsm1x1U:2,16,4,16,1,2,4,1;ConvOclDirectFwd1x1:1,64,1,1,0,1,8,8,0
256-14-14-3x3-128-14-14-8-1x1-1x1-1x1-0-NCHW-FP16-W=ConvAsmBwdWrW3x3:0,0,8,2,3,1
1-48-480-3x3-16-48-480-16-1x1-1x1-1x1-0-NCHW-FP16-F=ConvOclDirectFwd:8,32,16,32,2,1,8,1,2
128-28-28-3x3-128-56-56-16-1x1-2x2-1x1-0-NCHW-FP32-W=ConvAsmBwdWrW3x3:0,0,8,4,3,1
384-8-8-3x3-448-8-8-128-1x1-1x1-1x1-0-NCHW-FP16-W=ConvAsmBwdWrW3x3:0,1,8,4,7,1
192-7-7-1x1-1920-7-7-16-0x0-1x1-1x1-0-NCHW-FP32-B=ConvAsm1x1U:1,16,1,64,2,2,2,2;ConvOclDirectFwd1x1:1,64,1,1,0,1,16,4,0
128-64-128-1x1-512-64-128-1-0x0-1x1-1x1-0-NCHW-FP16-W=ConvAsmBwdWrW1x1:4,4,8,4,2,1,1,4,0,1
256-17-17-1x1-1024-17-17-1-0x0-1x1-1x1-0-NCHW-FP16-B=ConvAsm1x1U:1,8,2,64,1,2,4,1;ConvOclDirectFwd1x1:1,64,1,1,0,1,4,4,0
128-4-4-1x1-576-4-4-32-0x0-1x1-1x1-0-NCHW-FP32-B=ConvAsm1x1U:1,16,1,16,1,2,2,2;ConvOclDirectFwd1x1:1,128,1,1,0,1,4,4,0
384-17-17-3x3-288-35-35-128-0x0-2x2-1x1-0-NCHW-FP32-B=ConvOclDirectFwd:16,16,16,16,1,1,4,1,1
192-8-8-1x1-2048-8-8-1-0x0-1x1-1x1-0-NCHW-FP16-B=ConvAsm1x1U:1,8,2,32,1,4,4,2;ConvOclDirectFwd1x1:1,64,1,1,0,1,4,4,0
128-17-17-1x1-768-17-17-16-0x0-1x1-1x1-0-NCHW-FP32-B=ConvAsm1x1U:1,16,1,64,4,2,2,2;ConvOclDirectFwd1x1:1,256,1,1,0,1,16,4,0
48-7-7-1x1-832-7-7-256-0x0-1x1-1x1-0-NCHW-FP32-B=ConvAsm1x1U:1,16,1,64,2,2,1,2;ConvOclDirectFwd1x1:1,256,1,1,0,1,16,8,0
64-56-56-1x1-64-56-56-32-0x0-1x1-1x1-0-NCHW-FP16-B=ConvAsm1x1U:1,8,2,64,1,4,1,4;ConvOclDirectFwd1x1:1,64,1,1,0,4,16,4,0
128-28-28-1x1-512-28-28-4-0x0-1x1-1x1-0-NCHW-FP32-B=ConvAsm1x1U:1,8,1,16,1,4,1,4;ConvOclDirectFwd1x1:16,64,32,32,0,2,16,4,1
3-299-299-3x3-32-149-149-256-0x0-2x2-1x1-0-NCHW-FP32-F=ConvOclDirectFwd:16,16,16,16,1,1,8,1,2;ConvOclDirectFwdFused:16,16,16,16,1,1,8,1,2
256-13-13-3x3-256-13-13-1024-1x1-1x1-1x1-0-NCHW-FP16-F=ConvOclDirectFwd:8,8,16,16,2,2,8,1,1
192-8-8-1x1-1280-8-8-16-0x0-1x1-1x1-0-NCHW-FP32-B=ConvAsm1x1U:1,16,1,32,2,2,2,2;ConvOclDirectFwd1x1:1,128,1,1,0,2,8,4,0
16-28-28-1x1-192-28-28-8-0x0-1x1-1x1-0-NCHW-FP16-B=ConvAsm1x1U:1,8,2,16,1,2,1,1;ConvOclDirectFwd1x1:1,128,1,1,0,4,8,4,0
480-14-14-1x1-64-14-14-512-0x0-1x1-1x1-0-NCHW-FP32-F=ConvAsm1x1U:2,16,2,64,2,2,1,1;ConvActivAsm1x1U:4,16,4,64,1,1;ConvOclDirectFwd1x1:1,64,1,1,1,0,32,2048,0
32-28-28-1x1-192-28-28-8-0x0-1x1-1x1-0-NCHW-FP16-W=ConvAsmBwdWrW1x1:4,4,2,4,2,2,4,4,0,1
1024-14-14-1x1-256-14-14-1-0x0-1x1-1x1-0-NCHW-FP16-B=ConvAsm1x1U:1,8,2,32,1,4,4,1;ConvOclDirectFwd1x1:1,64,1,1,0,4,4,8,0
192-14-14-1x1-480-14-14-16-0x0-1x1-1x1-0-NCHW-FP32-W=ConvAsmBwdWrW1x1:1,16,2,4,8,1,2,4,0,1
96-28-28-5x5-32-28-28-8-2x2-1x1-1x1-0-NCHW-FP16-B=ConvOclDirectFwd:16,16,32,32,2,2,2,4,2
96-14-14-1x1-480-14-14-1-0x0-1x1-1x1-0-NCHW-FP32-B=ConvAsm1x1U:1,8,1,64,1,4,2,1;ConvOclDirectFwd1x1:1,256,1,1,0,4,4,8,0
768-17-17-1x1-128-17-17-8-0x0-1x1-1x1-0-NCHW-FP32-F=ConvAsm1x1U:4,8,5,64,1,4,2,2;ConvActivAsm1x1U:4,16,5,64,1,4;ConvOclDirectFwd1x1:1,64,1,1,1,4,16,256,0
384-8-8-3x3-448-8-8-256-1x1-1x1-1x1-0-NCHW-FP16-B=ConvOclDirectFwd:8,8,8,8,1,1,8,2,1
192-14-14-1x1-576-14-14-64-0x0-1x1-1x1-0-NCHW-FP32-W=ConvAsmBwdWrW1x1:2,8,4,8,4,1,2,4,0,1
32-149-149-3x3-32-147-147-32-0x0-1x1-1x1-0-NCHW-FP32-F=ConvOclDirectFwd:16,16,16,32,1,2,8,4,2
16-14-14-1x1-480-14-14-8-0x0-1x1-1x1-0-NCHW-FP16-B=ConvAsm1x1U:1,8,2,32,1,4,1,1;ConvOclDirectFwd1x1:1,64,1,1,0,4,4,4,0
1280-8-8-1x1-320-8-8-256-0x0-1x1-1x1-0-NCHW-FP32-F=ConvAsm1x1U:2,16,2,32,3,2,4,1;ConvActivAsm1x1U:2,16,4,16,3,4;ConvOclDirectFwd1x1:1,64,1,1,1,0,32,2048,0
256-55-55-1x1-64-55-55-32-0x0-1x1-1x1-0-NCHW-FP32-F=ConvAsm1x1U:3,16,3,64,2,2,1,1;ConvActivAsm1x1U:2,16,3,32,2,1;ConvOclDirectFwd1x1:1,64,1,1,1,0,32,256,0
224-7-7-3x3-224-7-7-32-1x1-1x1-1x1-0-NCHW-FP16-W=ConvAsmBwdWrW3x3:0,1,8,2,2,2
24-14-14-1x1-512-14-14-512-0x0-1x1-1x1-0-NCHW-FP16-W=ConvAsmBwdWrW1x1:4,4,8,4,2,2,4,4,0,1
192-28-28-1x1-16-28-28-32-0x0-1x1-1x1-0-NCHW-FP16-F=ConvAsm1x1U:1,8,2,64,1,4,4,1;ConvOclDirectFwd1x1:1,128,1,1,0,2,8,4,0
192-14-14-1x1-1488-14-14-16-0x0-1x1-1x1-0-NCHW-FP32-B=ConvAsm1x1U:1,16,1,32,2,1,2,2;ConvOclDirectFwd1x1:1,64,1,1,0,2,16,4,0
96-35-35-3x3-96-35-35-256-1x1-1x1-1x1-0-NCHW-FP32-W=ConvAsmBwdWrW3x3:0,0,8,4,3,4
64-28-28-3x3-96-28-28-32-1x1-1x1-1x1-0-NCHW-FP16-F=ConvOclDirectFwd:16,16,32,32,2,2,8,1,2
256-56-56-1x1-128-56-56-32-0x0-1x1-1x1-0-NCHW-FP32-F=ConvAsm1x1U:3,16,3,64,2,2,2,2;ConvOclDirectFwd1x1:1,64,1,1,1,4,32,2048,0
384-35-35-1x1-64-35-35-32-0x0-1x1-1x1-0-NCHW-FP32-F=ConvAsm1x1U:4,16,5,64,1,2,1,1;ConvActivAsm1x1U:4,16,5,64,2,1;ConvOclDirectFwd1x1:1,64,1,1,1,4,16,2048,0
160-14-14-1x1-528-14-14-256-0x0-1x1-1x1-0-NCHW-FP32-W=ConvAsmBwdWrW1x1:2,8,4,4,8,1,2,4,0,1
528-14-14-1x1-128-14-14-32-0x0-1x1-1x1-0-NCHW-FP16-F=ConvAsm1x1U:2,8,4,64,1,4,2,4;ConvOclDirectFwd1x1:1,64,1,1,0,4,8,4,0
224-7-7-3x3-224-7-7-32-1x1-1x1-1x1-0-NCHW-FP32-W=ConvAsmBwdWrW3x3:0,1,8,2,6,1
192-7-7-1x1-832-7-7-128-0x0-1x1-1x1-0-NCHW-FP32-W=ConvAsmBwdWrW1x1:1,16,2,4,8,1,4,4,0,2
128-7-7-5x5-48-7-7-512-2x2-1x1-1x1-0-NCHW-FP16-B=ConvOclDirectFwd:8,8,8,8,1,1,8,2,1
64-35-35-1x1-256-35-35-128-0x0-1x1-1x1-0-NCHW-FP32-W=ConvAsmBwdWrW1x1:4,4,4,2,8,1,4,4,0,2
512-28-28-3x3-512-28-28-4-1x1-1x1-1x1-0-NCHW-FP32-W=ConvAsmBwdWrW3x3:0,1,8,4,4,1
1152-14-14-1x1-192-14-14-16-0x0-1x1-1x1-0-NCHW-FP16-F=ConvAsm1x1U:2,8,4,64,1,4,4,2;ConvOclDirectFwd1x1:1,64,1,1,0,4,8,4,0
192-17-17-1x1-1024-17-17-16-0x0-1x1-1x1-0-NCHW-FP32-W=ConvAsmBwdWrW1x1:1,16,2,8,4,1,1,4,0,2
192-14-14-1x1-384-14-14-16-0x0-1x1-1x1-0-NCHW-FP16-B=ConvAsm1x1U:1,16,2,16,1,2,4,1;ConvOclDirectFwd1x1:1,64,1,1,0,4,8,4,0
528-14-14-1x1-32-14-14-256-0x0-1x1-1x1-0-NCHW-FP16-W=ConvAsmBwdWrW1x1:4,4,4,4,2,2,2,4,0,2
512-7-7-1x1-1024-14-14-8-0x0-2x2-1x1-0-NCHW-FP32-W=ConvAsmBwdWrW1x1:1,16,2,4,8,1,1,4,0,0
32-28-28-1x1-192-28-28-1-0x0-1x1-1x1-0-NCHW-FP32-B=ConvAsm1x1U:1,8,1,64,1,4,2,4;ConvOclDirectFwd1x1:1,256,1,1,0,1,4,8,0
128-28-28-1x1-512-28-28-1-0x0-1x1-1x1-0-NCHW-FP32-B=ConvAsm1x1U:1,8,1,64,1,4,1,4;ConvOclDirectFwd1x1:1,256,1,1,0,1,4,8,0
32-14-14-1x1-528-14-14-64-0x0-1x1-1x1-0-NCHW-FP16-B=ConvAsm1x1U:1,16,2,16,1,2,1,4;ConvOclDirectFwd1x1:1,256,1,1,0,4,16,4,0
192-28-28-1x1-64-28-28-512-0x0-1x1-1x1-0-NCHW-FP16-F=ConvAsm1x1U:1,8,2,32,2,4,1,4;ConvOclDirectFwd1x1:1,256,1,1,0,4,16,4,0
96-14-14-1x1-608-14-14-32-0x0-1x1-1x1-0-NCHW-FP32-B=ConvAsm1x1U:1,16,1,32,2,2,1,4;ConvOclDirectFwd1x1:1,64,1,1,0,4,16,4,0
16-14-14-1x1-480-14-14-256-0x0-1x1-1x1-0-NCHW-FP16-W=ConvAsmBwdWrW1x1:4,4,4,4,2,2,4,4,0,2
256-28-28-1x1-32-28-28-128-0x0-1x1-1x1-0-NCHW-FP16-W=ConvAsmBwdWrW1x1:4,4,4,1,8,1,4,4,0,1
832-7-7-1x1-48-7-7-16-0x0-1x1-1x1-0-NCHW-FP16-F=ConvAsm1x1U:1,8,2,16,1,4,4,1;ConvOclDirectFwd1x1:1,64,1,1,0,1,4,8,0
512-14-14-1x1-128-28-28-8-0x0-2x2-1x1-0-NCHW-FP32-B=ConvAsm1x1U:1,8,1,64,1,4,2,2;ConvOclDirectFwd1x1:1,256,1,1,0,1,8,8,0
32-149-149-3x3-32-147-147-1-0x0-1x1-1x1-0-NCHW-FP16-F=ConvOclDirectFwd:16,16,16,32,1,2,8,4,1;ConvOclDirectFwdFused:16,16,16,32,1,2,8,2,1
320-8-8-1x1-1280-8-8-256-0x0-1x1-1x1-0-NCHW-FP32-W=ConvAsmBwdWrW1x1:1,16,4,4,8,1,1,4,0,1
32-14-14-1x1-528-14-14-64-0x0-1x1-1x1-0-NCHW-FP16-W=ConvAsmBwdWrW1x1:4,4,4,4,2,1,2,2,0,3
3-224-224-3x3-64-224-224-16-1x1-1x1-1x1-0-NCHW-FP16-F=ConvOclDirectFwd:16,16,16,32,1,2,8,1,2;ConvOclDirectFwdFused:16,16,16,32,1,2,8,1,2
256-14-14-3x3-128-14-14-32-1x1-1x1-1x1-0-NCHW-FP16-W=ConvAsmBwdWrW3x3:0,0,8,2,3,4
192-28-28-1x1-96-28-28-16-0x0-1x1-1x1-0-NCHW-FP32-F=ConvAsm1x1U:2,16,2,32,2,2,2,1;ConvActivAsm1x1U:2,16,2,32,3,2;ConvOclDirectFwd1x1:1,64,1,1,1,0,16,2048,0
1024-14-14-1x1-512-14-14-64-0x0-1x1-1x1-0-NCHW-FP32-F=ConvAsm1x1U:4,16,4,64,1,2,1,8;ConvActivAsm1x1U:2,32,7,32,1,1;ConvOclDirectFwd1x1:1,64,1,1,1,1,32,2048,0
256-8-8-1x1-1536-8-8-32-0x0-1x1-1x1-0-NCHW-FP16-B=ConvAsm1x1U:1,16,2,16,1,2,2,4;ConvOclDirectFwd1x1:1,128,1,1,0,4,16,4,0
256-28-28-1x1-32-28-28-512-0x0-1x1-1x1-0-NCHW-FP32-F=ConvAsm1x1U:2,16,4,32,2,2,1,2;ConvActivAsm1x1U:3,16,3,64,4,1;ConvOclDirectFwd1x1:1,64,1,1,1,0,64,2048,0
512-28-28-1x1-128-28-28-8-0x0-1x1-1x1-0-NCHW-FP32-B=ConvAsm1x1U:1,16,1,16,1,2,2,1;ConvOclDirectFwd1x1:1,256,1,1,0,4,8,4,0
192-7-7-1x1-1920-7-7-16-0x0-1x1-1x1-0-NCHW-FP16-B=ConvAsm1x1U:1,16,2,32,1,2,2,2;ConvOclDirectFwd1x1:1,64,1,1,0,1,8,4,0
192-56-56-3x3-64-56-56-256-1x1-1x1-1x1-0-NCHW-FP16-W=ConvAsmBwdWrW3x3:0,0,8,2,1,1
192-56-56-1x1-240-56-56-16-0x0-1x1-1x1-0-NCHW-FP32-B=ConvAsm1x1U:1,16,1,64,1,2,2,1;ConvOclDirectFwd1x1:1,64,1,1,0,4,16,8,0
64-35-35-1x1-192-35-35-32-0x0-1x1-1x1-0-NCHW-FP16-B=ConvAsm1x1U:1,16,2,64,1,2,1,1;ConvOclDirectFwd1x1:1,256,1,1,0,1,32,4,0
1776-7-7-1x1-192-7-7-16-0x0-1x1-1x1-0-NCHW-FP32-F=ConvAsm1x1U:2,8,2,32,1,4,2,4;ConvActivAsm1x1U:4,16,4,16,1,4;ConvOclDirectFwd1x1:1,64,1,1,1,0,16,256,0
320-8-8-1x1-2048-8-8-8-0x0-1x1-1x1-0-NCHW-FP16-B=ConvAsm1x1U:1,16,2,32,1,2,2,8;ConvOclDirectFwd1x1:1,128,1,1,0,2,8,8,0
512-14-14-1x1-1024-14-14-16-0x0-1x1-1x1-0-NCHW-FP32-W=ConvAsmBwdWrW1x1:1,16,4,4,8,1,1,4,0,1
160-17-17-1x1-768-17-17-8-0x0-1x1-1x1-0-NCHW-FP32-B=ConvAsm1x1U:1,16,1,64,2,2,1,1;ConvOclDirectFwd1x1:1,64,1,1,0,1,16,4,0
256-17-17-1x1-1024-17-17-128-0x0-1x1-1x1-0-NCHW-FP32-W=ConvAsmBwdWrW1x1:2,8,4,4,8,1,1,4,0,1
160-7-7-1x1-832-7-7-16-0x0-1x1-1x1-0-NCHW-FP16-W=ConvAsmBwdWrW1x1:4,4,4,4,2,1,2,2,0,0
256-28-28-1x1-64-28-28-8-0x0-1x1-1x1-0-NCHW-FP16-F=ConvAsm1x1U:1,8,2,64,1,4,2,8;ConvOclDirectFwd1x1:1,256,1,1,0,2,8,4,0
64-14-14-1x1-480-14-14-8-0x0-1x1-1x1-0-NCHW-FP16-W=ConvAsmBwdWrW1x1:4,4,4,4,2,1,2,2,0,1
96-73-73-3x3-64-147-147-32-0x0-2x2-1x1-0-NCHW-FP16-B=ConvOclDirectFwd:8,16,32,32,4,2,4,2,1
128-7-7-5x5-48-7-7-16-2x2-1x1-1x1-0-NCHW-FP32-B=ConvOclDirectFwd:8,8,8,8,1,1,1,2,2
256-56-56-1x1-64-56-56-8-0x0-1x1-1x1-0-NCHW-FP32-B=ConvAsm1x1U:1,16,1,64,1,2,1,4
32-24-240-3x3-16-24-240-16-1x1-1x1-1x1-0-NCHW-FP16-W=ConvAsmBwdWrW3x3:0,0,16,1,1,4
192-8-8-3x3-192-17-17-16-0x0-2x2-1x1-0-NCHW-FP32-B=ConvOclDirectFwd:16,32,32,32,2,1,4,4,2
192-28-28-1x1-32-28-28-32-0x0-1x1-1x1-0-NCHW-FP32-F=ConvAsm1x1U:2,16,2,32,1,2,2,1;ConvActivAsm1x1U:3,16,3,64,1,3;ConvOclDirectFwd1x1:1,64,1,1,1,0,16,2048,0
80-73-73-1x1-64-73-73-64-0x0-1x1-1x1-0-NCHW-FP32-W=ConvAsmBwdWrW1x1:4,4,4,4,4,1,4,4,0,1
192-35-35-1x1-48-35-35-32-0x0-1x1-1x1-0-NCHW-FP32-F=ConvAsm1x1U:1,16,1,64,4,2,1,1;ConvActivAsm1x1U:1,16,1,64,4,1;ConvOclDirectFwd1x1:1,64,1,1,1,4,16,2048,0
528-14-14-1x1-256-14-14-32-0x0-1x1-1x1-0-NCHW-FP32-F=ConvAsm1x1U:4,16,4,64,1,2,1,2;ConvOclDirectFwd1x1:1,64,1,1,1,4,16,2048,0
512-9-41-5x5-256-20-84-16-1x1-2x2-1x1-0-NCHW-FP32-B=ConvOclDirectFwd:32,8,32,32,1,4,4,2,2
512-14-14-1x1-32-14-14-32-0x0-1x1-1x1-0-NCHW-FP16-F=ConvAsm1x1U:1,8,2,64,1,4,4,2;ConvOclDirectFwd1x1:1,256,1,1,0,4,4,4,0
64-56-56-1x1-64-56-56-8-0x0-1x1-1x1-0-NCHW-FP32-F=ConvAsm1x1U:1,16,1,64,2,2,1,1;ConvActivAsm1x1U:1,16,1,64,2,1;ConvOclDirectFwd1x1:1,64,1,1,1,4,16,2048,0
128-28-28-1x1-256-56-56-8-0x0-2x2-1x1-0-NCHW-FP32-B=ConvAsm1x1U:1,16,1,32,1,2,1,1;ConvOclDirectFwd1x1:1,64,1,1,0,1,32,4,0
32-14-14-1x1-528-14-14-256-0x0-1x1-1x1-0-NCHW-FP16-W=ConvAsmBwdWrW1x1:4,4,8,1,8,2,2,4,0,1
224-64-128-3x3-112-64-128-1-1x1-1x1-1x1-0-NCHW-FP16-B=ConvOclDirectFwd:16,16,16,32,1,2,8,4,1
64-28-28-1x1-256-28-28-32-0x0-1x1-1x1-0-NCHW-FP32-W=ConvAsmBwdWrW1x1:2,8,2,4,4,1,4,4,0,1
384-17-17-3x3-288-35-35-32-0x0-2x2-1x1-0-NCHW-FP32-B=ConvOclDirectFwd:16,16,16,16,1,1,4,1,1
64-35-35-1x1-192-35-35-4-0x0-1x1-1x1-0-NCHW-FP32-W=ConvAsmBwdWrW1x1:4,4,4,1,8,1,2,4,0,1
192-28-28-1x1-624-28-28-16-0x0-1x1-1x1-0-NCHW-FP32-W=ConvAsmBwdWrW1x1:1,16,2,8,4,1,2,4,0,2
32-7-7-1x1-832-7-7-1-0x0-1x1-1x1-0-NCHW-FP16-B=ConvAsm1x1U:1,8,2,32,1,4,2,1;ConvOclDirectFwd1x1:1,64,1,1,0,1,4,4,0
192-35-35-1x1-384-35-35-16-0x0-1x1-1x1-0-NCHW-FP32-W=ConvAsmBwdWrW1x1:4,4,8,4,4,1,1,4,0,1
256-56-56-1x1-64-56-56-128-0x0-1x1-1x1-0-NCHW-FP32-B=ConvAsm1x1U:1,16,1,64,2,1,1,4;ConvOclDirectFwd1x1:1,64,1,1,0,1,32,4,0
832-7-7-1x1-48-7-7-4-0x0-1x1-1x1-0-NCHW-FP16-F=ConvAsm1x1U:1,8,2,32,1,4,4,1;ConvOclDirectFwd1x1:1,64,1,1,0,1,4,8,0
144-64-128-1x1-512-64-128-1-0x0-1x1-1x1-0-NCHW-FP16-B=ConvOclDirectFwd1x1:1,256,1,1,0,4,16,4,0
64-14-14-1x1-576-14-14-64-0x0-1x1-1x1-0-NCHW-FP16-W=ConvAsmBwdWrW1x1:2,8,2,8,2,1,4,4,0,1
192-35-35-1x1-32-35-35-64-0x0-1x1-1x1-0-NCHW-FP32-F=ConvAsm1x1U:3,16,3,64,4,2,1,2;ConvActivAsm1x1U:3,16,3,64,4,1;ConvOclDirectFwd1x1:1,64,1,1,1,4,64,2048,0
208-14-14-3x3-96-14-14-256-1x1-1x1-1x1-0-NCHW-FP16-W=ConvAsmBwdWrW3x3:0,1,8,2,6,4
256-14-14-1x1-1024-7-7-8-0x0-2x2-1x1-0-NCHW-FP32-F=ConvAsm1x1U:2,8,2,32,2,4,2,2;ConvOclDirectFwd1x1:1,64,1,1,1,0,16,2048,0
1280-8-8-1x1-384-8-8-1-0x0-1x1-1x1-0-NCHW-FP16-F=ConvAsm1x1U:1,8,2,32,1,4,4,2;ConvOclDirectFwd1x1:1,128,1,1,0,1,4,8,0
256-17-17-3x3-224-35-35-256-0x0-2x2-1x1-0-NCHW-FP16-B=ConvOclDirectFwd:8,8,16,16,2,2,4,1,1
192-35-35-1x1-48-35-35-64-0x0-1x1-1x1-0-NCHW-FP16-F=ConvAsm1x1U:2,8,4,64,1,4,2,2;ConvOclDirectFwd1x1:1,64,1,1,0,1,16,8,0
528-64-128-1x1-256-64-128-1-0x0-1x1-1x1-0-NCHW-FP16-F=ConvOclDirectFwd1x1:1,256,1,1,0,4,16,4,0
256-35-35-1x1-48-35-35-32-0x0-1x1-1x1-0-NCHW-FP16-F=ConvAsm1x1U:3,8,6,16,1,4,2,2;ConvOclDirectFwd1x1:1,128,1,1,0,1,16,4,0
128-14-14-1x1-528-14-14-16-0x0-1x1-1x1-0-NCHW-FP32-W=ConvAsmBwdWrW1x1:1,16,2,8,2,1,1,4,0,2
256-14-14-1x1-1024-14-14-64-0x0-1x1-1x1-0-NCHW-FP32-B=ConvAsm1x1U:1,32,1,16,2,1,1,4;ConvOclDirectFwd1x1:1,128,1,1,0,2,32,4,0
32-7-7-5x5-128-7-7-1-2x2-1x1-1x1-0-NCHW-FP32-F=ConvOclDirectFwd:8,8,8,8,1,1,1,4,1;ConvOclDirectFwdFused:8,8,8,8,1,1,1,4,1
384-7-7-1x1-832-7-7-16-0x0-1x1-1x1-0-NCHW-FP16-B=ConvAsm1x1U:1,8,2,32,1,4,2,2;ConvOclDirectFwd1x1:1,64,1,1,0,1,8,4,0
256-28-28-1x1-64-28-28-1-0x0-1x1-1x1-0-NCHW-FP32-F=ConvAsm1x1U:1,8,1,64,1,4,4,2;ConvActivAsm1x1U:1,16,1,32,1,4;ConvOclDirectFwd1x1:1,64,1,1,1,0,16,64,0
48-7-7-1x1-832-7-7-8-0x0-1x1-1x1-0-NCHW-FP32-W=ConvAsmBwdWrW1x1:4,4,2,4,2,1,2,4,0,0
512-64-128-1x1-64-64-128-1-0x0-1x1-1x1-0-NCHW-FP32-F=ConvOclDirectFwdFused:1,64,1,1,1,4,16,256,0;ConvOclDirectFwd1x1:1,64,1,1,1,0,16,256,0
384-8-8-1x1-2048-8-8-4-0x0-1x1-1x1-0-NCHW-FP32-W=ConvAsmBwdWrW1x1:1,16,2,4,8,1,1,4,0,0
256-128-256-1x1-128-128-256-1-0x0-1x1-1x1-0-NCHW-FP16-F=ConvOclDirectFwd1x1:1,256,1,1,0,4,16,4,0
192-28-28-1x1-96-28-28-32-0x0-1x1-1x1-0-NCHW-FP16-F=ConvAsm1x1U:1,8,2,32,2,4,2,2;ConvOclDirectFwd1x1:1,64,1,1,0,4,16,4,0
1056-7-7-1x1-128-7-7-64-0x0-1x1-1x1-0-NCHW-FP32-F=ConvAsm1x1U:4,8,4,16,1,4,2,4;ConvOclDirectFwd1x1:1,64,1,1,1,4,32,256,0
192-27-27-5x5-64-27-27-16-2x2-1x1-1x1-0-NCHW-FP16-B=ConvOclDirectFwd:16,16,32,32,2,2,4,2,2
288-14-14-3x3-144-14-14-128-1x1-1x1-1x1-0-NCHW-FP32-W=ConvAsmBwdWrW3x3:0,0,8,4,9,2
1024-17-17-1x1-128-17-17-256-0x0-1x1-1x1-0-NCHW-FP32-W=ConvAsmBwdWrW1x1:4,4,8,4,4,1,1,4,0,0
256-35-35-1x1-64-35-35-4-0x0-1x1-1x1-0-NCHW-FP32-F=ConvAsm1x1U:2,16,2,32,1,2,4,1;ConvActivAsm1x1U:3,16,3,16,1,4;ConvOclDirectFwd1x1:1,64,1,1,1,1,16,64,0
80-73-73-1x1-64-73-73-1-0x0-1x1-1x1-0-NCHW-FP16-B=ConvAsm1x1U:1,8,2,64,1,2,4,1;ConvOclDirectFwd1x1:1,128,1,1,0,1,4,4,0
64-28-28-1x1-256-28-28-4-0x0-1x1-1x1-0-NCHW-FP32-B=ConvAsm1x1U:1,16,1,32,1,2,2,1;ConvOclDirectFwd1x1:1,128,1,1,0,1,8,4,0
128-112-112-3x3-128-112-112-4-1x1-1x1-1x1-0-NCHW-FP16-B=ConvOclDirectFwd:8,16,16,32,2,2,8,1,1
208-14-14-3x3-96-14-14-64-1x1-1x1-1x1-0-NCHW-FP16-W=ConvAsmBwdWrW3x3:0,0,8,2,3,4
832-7-7-1x1-48-7-7-128-0x0-1x1-1x1-0-NCHW-FP16-F=ConvAsm1x1U:1,8,2,32,1,4,4,1;ConvOclDirectFwd1x1:1,128,1,1,0,1,8,4,0
192-7-7-1x1-1104-7-7-16-0x0-1x1-1x1-0-NCHW-FP16-F=ConvAsm1x1U:2,8,4,16,1,2,2,2;ConvOclDirectFwd1x1:1,128,1,1,0,1,16,4,0
192-14-14-1x1-608-14-14-32-0x0-1x1-1x1-0-NCHW-FP32-B=ConvAsm1x1U:1,16,1,32,2,2,1,4;ConvOclDirectFwd1x1:1,256,1,1,0,4,16,4,0
1488-14-14-1x1-192-14-14-16-0x0-1x1-1x1-0-NCHW-FP16-F=ConvAsm1x1U:2,8,4,64,1,4,4,2;ConvOclDirectFwd1x1:1,64,1,1,0,4,8,4,0
384-17-17-1x1-1024-17-17-16-0x0-1x1-1x1-0-NCHW-FP32-B=ConvAsm1x1U:1,32,1,64,2,1,2,2;ConvOclDirectFwd1x1:1,64,1,1,0,1,16,4,0
64-56-56-1x1-256-56-56-16-0x0-1x1-1x1-0-NCHW-FP32-F=ConvAsm1x1U:1,16,1,64,2,2,2,1;ConvOclDirectFwd1x1:1,64,1,1,1,4,32,2048,0
32-28-28-5x5-96-28-28-256-2x2-1x1-1x1-0-NCHW-FP32-F=ConvOclDirectFwd:16,16,32,32,2,2,8,1,2;ConvOclDirectFwdFused:16,16,32,32,2,2,8,1,2
128-17-17-1x1-768-17-17-8-0x0-1x1-1x1-0-NCHW-FP32-W=ConvAsmBwdWrW1x1:1,16,2,4,8,1,2,4,0,1
128-7-7-1x1-832-7-7-512-0x0-1x1-1x1-0-NCHW-FP32-B=ConvAsm1x1U:1,16,1,64,3,2,1,4;ConvOclDirectFwd1x1:1,256,1,1,0,1,32,4,0
48-35-35-1x1-256-35-35-32-0x0-1x1-1x1-0-NCHW-FP16-W=ConvAsmBwdWrW1x1:4,4,8,4,2,1,4,2,0,1
192-14-14-1x1-672-14-14-16-0x0-1x1-1x1-0-NCHW-FP16-B=ConvAsm1x1U:1,16,2,16,1,2,2,2;ConvOclDirectFwd1x1:1,128,1,1,0,4,8,4,0
448-8-8-1x1-2048-8-8-64-0x0-1x1-1x1-0-NCHW-FP32-W=ConvAsmBwdWrW1x1:1,16,4,4,8,1,1,4,0,1
320-8-8-1x1-1280-8-8-32-0x0-1x1-1x1-0-NCHW-FP32-B=ConvAsm1x1U:1,16,1,64,2,2,1,4;ConvOclDirectFwd1x1:8,64,8,8,0,2,16,4,1
16-14-14-1x1-480-14-14-256-0x0-1x1-1x1-0-NCHW-FP32-F=ConvAsm1x1U:1,8,1,64,2,2,2,8;ConvOclDirectFwd1x1:1,64,1,1,1,1,16,256,0
528-28-28-1x1-192-28-28-16-0x0-1x1-1x1-0-NCHW-FP16-F=ConvAsm1x1U:1,8,2,32,2,4,2,2;ConvOclDirectFwd1x1:1,128,1,1,0,2,16,4,0
192-28-28-1x1-96-28-28-64-0x0-1x1-1x1-0-NCHW-FP32-F=ConvAsm1x1U:2,16,2,32,2,2,1,2;ConvActivAsm1x1U:3,16,3,32,2,1;ConvOclDirectFwd1x1:1,64,1,1,1,1,16,2048,0
128-7-7-1x1-1024-7-7-32-0x0-1x1-1x1-0-NCHW-FP32-W=ConvAsmBwdWrW1x1:1,16,2,8,2,1,1,4,0,3
480-64-128-1x1-192-64-128-1-0x0-1x1-1x1-0-NCHW-FP32-F=ConvAsm1x1U:4,16,4,64,1,2,2,1;ConvActivAsm1x1U:4,16,4,64,1,2;ConvOclDirectFwd1x1:1,64,1,1,1,4,32,2048,0
160-14-14-1x1-512-14-14-512-0x0-1x1-1x1-0-NCHW-FP16-W=ConvAsmBwdWrW1x1:2,8,2,8,2,1,4,4,0,2
48-14-14-5x5-16-14-14-32-2x2-1x1-1x1-0-NCHW-FP16-B=ConvOclDirectFwd:8,16,16,16,2,1,1,2,2
256-7-7-1x1-832-7-7-512-0x0-1x1-1x1-0-NCHW-FP32-B=ConvAsm1x1U:1,16,1,64,4,2,1,2;ConvOclDirectFwd1x1:1,256,1,1,0,1,32,4,0
256-56-56-3x3-256-56-56-128-1x1-1x1-1x1-0-NCHW-FP16-B=ConvOclDirectFwd:16,8,16,32,1,4,8,2,2
256-28-28-1x1-64-28-28-512-0x0-1x1-1x1-0-NCHW-FP16-F=ConvAsm1x1U:1,8,2,32,1,4,1,8;ConvOclDirectFwd1x1:1,128,1,1,0,4,16,4,0
256-56-56-1x1-64-56-56-64-0x0-1x1-1x1-0-NCHW-FP32-W=ConvAsmBwdWrW1x1:4,4,4,4,4,1,4,4,0,1
192-14-14-1x1-1344-14-14-16-0x0-1x1-1x1-0-NCHW-FP32-W=ConvAsmBwdWrW1x1:1,16,4,4,8,1,2,4,0,1
256-56-56-3x3-256-56-56-64-1x1-1x1-1x1-0-NCHW-FP16-B=ConvOclDirectFwd:32,8,32,32,1,4,8,1,2
384-35-35-1x1-96-35-35-32-0x0-1x1-1x1-0-NCHW-FP16-F=ConvAsm1x1U:2,8,4,64,1,4,2,2;ConvOclDirectFwd1x1:1,64,1,1,0,1,16,4,0
160-17-17-1x1-768-17-17-256-0x0-1x1-1x1-0-NCHW-FP16-W=ConvAsmBwdWrW1x1:2,8,8,4,4,2,2,4,0,1
320-8-8-1x1-1280-8-8-256-0x0-1x1-1x1-0-NCHW-FP16-W=ConvAsmBwdWrW1x1:4,4,4,2,8,2,1,2,0,1
256-14-14-3x3-128-14-14-32-1x1-1x1-1x1-0-NCHW-FP16-B=ConvOclDirectFwd:8,16,16,16,2,1,8,1,2
128-28-28-1x1-512-28-28-64-0x0-1x1-1x1-0-NCHW-FP32-B=ConvAsm1x1U:1,16,1,32,2,1,1,2;ConvOclDirectFwd1x1:1,256,1,1,0,1,32,4,0
24-14-14-5x5-64-14-14-512-2x2-1x1-1x1-0-NCHW-FP16-F=ConvOclDirectFwd:8,8,16,16,2,2,8,1,2;ConvOclDirectFwdFused:8,8,16,16,2,2,8,1,2
64-35-35-1x1-256-35-35-256-0x0-1x1-1x1-0-NCHW-FP32-F=ConvAsm1x1U:1,16,1,64,3,2,2,4;ConvOclDirectFwd1x1:1,64,1,1,1,1,64,128,0
192-35-35-1x1-384-35-35-4-0x0-1x1-1x1-0-NCHW-FP32-B=ConvAsm1x1U:2,16,2,64,1,2,2,2;ConvOclDirectFwd1x1:1,64,1,1,0,1,8,4,0
256-14-14-1x1-256-14-14-1-0x0-1x1-1x1-0-NCHW-FP16-F=ConvAsm1x1U:1,8,2,32,1,4,4,2;ConvOclDirectFwd1x1:1,128,1,1,0,4,4,8,0
64-28-28-1x1-256-28-28-64-0x0-1x1-1x1-0-NCHW-FP32-B=ConvAsm1x1U:1,32,1,32,1,1,1,1;ConvOclDirectFwd1x1:1,256,1,1,0,1,32,4,0
64-224-224-3x3-3-224-224-1-1x1-1x1-1x1-0-NCHW-FP32-B=ConvAsm3x3U:9,3,1;ConvOclDirectFwd:8,32,16,32,2,1,2,4,1
24-128-128-1x1-512-128-128-1-0x0-1x1-1x1-0-NCHW-FP32-B=ConvOclDirectFwd1x1:1,256,1,1,0,2,16,4,0
128-56-56-1x1-256-56-56-256-0x0-1x1-1x1-0-NCHW-FP32-B=ConvAsm1x1U:1,32,1,64,1,1,1,1;ConvOclDirectFwd1x1:1,64,1,1,0,2,32,4,0
64-56-56-3x3-192-56-56-64-1x1-1x1-1x1-0-NCHW-FP16-F=ConvOclDirectFwd:32,8,32,32,1,4,8,1,2;ConvOclDirectFwdFused:32,8,32,32,1,4,8,1,2
256-35-35-1x1-64-35-35-256-0x0-1x1-1x1-0-NCHW-FP32-F=ConvAsm1x1U:3,16,5,32,1,2,1,4;ConvActivAsm1x1U:3,16,3,32,4,1;ConvOclDirectFwd1x1:1,64,1,1,1,4,16,2048,0
64-56-56-1x1-64-56-56-4-0x0-1x1-1x1-0-NCHW-FP32-B=ConvAsm1x1U:1,8,1,64,1,4,1,2;ConvOclDirectFwd1x1:1,256,1,1,0,2,16,4,0
64-147-147-3x3-32-147-147-32-1x1-1x1-1x1-0-NCHW-FP32-W=ConvAsmBwdWrW3x3:0,1,16,4,2,4
64-28-28-1x1-256-28-28-64-0x0-1x1-1x1-0-NCHW-FP16-B=ConvAsm1x1U:1,16,2,16,1,2,1,4;ConvOclDirectFwd1x1:1,128,1,1,0,4,16,4,0
320-8-8-3x3-192-17-17-4-0x0-2x2-1x1-0-NCHW-FP16-B=ConvOclDirectFwd:16,8,32,32,2,4,2,4,1
64-73-73-3x3-96-71-71-256-0x0-1x1-1x1-0-NCHW-FP32-F=ConvOclDirectFwd:16,8,16,16,1,2,8,4,1
192-56-56-1x1-384-56-56-16-0x0-1x1-1x1-0-NCHW-FP32-W=ConvAsmBwdWrW1x1:2,8,2,8,8,1,2,4,0,1
128-28-28-1x1-256-14-14-128-0x0-2x2-1x1-0-NCHW-FP32-F=ConvAsm1x1U:4,16,4,64,1,2,1,4;ConvOclDirectFwd1x1:1,64,1,1,1,4,16,2048,0
32-7-7-1x1-832-7-7-8-0x0-1x1-1x1-0-NCHW-FP32-B=ConvAsm1x1U:1,16,1,16,1,2,1,1;ConvOclDirectFwd1x1:1,128,1,1,0,1,4,8,0
448-8-8-3x3-384-8-8-32-1x1-1x1-1x1-0-NCHW-FP16-F=ConvOclDirectFwd:8,8,8,8,1,1,8,4,1;ConvOclDirectFwdFused:8,8,8,8,1,1,8,4,2
1280-8-8-1x1-448-8-8-32-0x0-1x1-1x1-0-NCHW-FP32-B=ConvAsm1x1U:1,16,1,32,2,2,4,1;ConvOclDirectFwd1x1:1,64,1,1,0,4,8,8,0
48-35-35-1x1-288-35-35-64-0x0-1x1-1x1-0-NCHW-FP16-B=ConvAsm1x1U:1,16,2,64,1,2,1,2;ConvOclDirectFwd1x1:1,256,1,1,0,1,32,4,0
96-35-35-1x1-384-35-35-64-0x0-1x1-1x1-0-NCHW-FP16-W=ConvAsmBwdWrW1x1:4,4,8,4,2,1,4,4,0,1
32-14-14-1x1-512-14-14-4-0x0-1x1-1x1-0-NCHW-FP16-W=ConvAsmBwdWrW1x1:4,4,2,1,4,2,1,4,0,1
384-35-35-1x1-64-35-35-256-0x0-1x1-1x1-0-NCHW-FP32-F=ConvAsm1x1U:3,16,3,64,2,2,1,4;ConvActivAsm1x1U:3,32,3,32,2,2;ConvOclDirectFwd1x1:1,64,1,1,1,1,32,2048,0
512-7-7-1x1-1024-14-14-32-0x0-2x2-1x1-0-NCHW-FP16-B=ConvAsm1x1U:2,8,4,16,1,4,2,4;ConvOclDirectFwd1x1:8,64,16,16,0,1,16,4,1
96-28-28-1x1-192-28-28-512-0x0-1x1-1x1-0-NCHW-FP32-W=ConvAsmBwdWrW1x1:2,8,2,8,4,2,4,4,0,1
160-17-17-1x1-768-17-17-128-0x0-1x1-1x1-0-NCHW-FP16-W=ConvAsmBwdWrW1x1:2,8,4,8,2,1,2,4,0,1
64-56-56-1x1-64-56-56-128-0x0-1x1-1x1-0-NCHW-FP32-F=ConvAsm1x1U:2,16,2,64,1,2,2,1;ConvActivAsm1x1U:1,32,1,64,2,1;ConvOclDirectFwd1x1:1,64,1,1,1,0,16,256,0
256-28-28-1x1-64-28-28-32-0x0-1x1-1x1-0-NCHW-FP32-F=ConvAsm1x1U:2,16,2,32,1,2,1,1;ConvActivAsm1x1U:1,16,1,64,4,1;ConvOclDirectFwd1x1:1,64,1,1,1,0,32,2048,0
192-17-17-1x1-768-17-17-1-0x0-1x1-1x1-0-NCHW-FP32-B=ConvAsm1x1U:1,8,1,64,1,4,2,4;ConvOclDirectFwd1x1:1,256,1,1,0,1,4,8,0
512-28-28-3x3-512-28-28-64-1x1-1x1-1x1-0-NCHW-FP32-W=ConvAsmBwdWrW3x3:0,1,8,4,9,4
32-7-7-1x1-832-7-7-8-0x0-1x1-1x1-0-NCHW-FP16-B=ConvAsm1x1U:1,8,2,32,1,2,2,1;ConvOclDirectFwd1x1:1,256,1,1,0,1,8,4,0
112-14-14-1x1-512-14-14-256-0x0-1x1-1x1-0-NCHW-FP16-B=ConvAsm1x1U:1,16,2,16,1,2,1,4;ConvOclDirectFwd1x1:1,256,1,1,0,2,16,4,0
512-7-7-1x1-2048-7-7-2-0x0-1x1-1x1-0-NCHW-FP16-B=ConvAsm1x1U:1,8,2,32,1,4,4,1;ConvOclDirectFwd1x1:1,256,1,1,0,1,4,4,0
384-8-8-1x1-1536-8-8-16-0x0-1x1-1x1-0-NCHW-FP16-W=ConvAsmBwdWrW1x1:2,8,4,2,4,1,1,4,0,0
192-14-14-1x1-864-14-14-16-0x0-1x1-1x1-0-NCHW-FP32-B=ConvAsm1x1U:1,16,1,64,2,2,1,1;ConvOclDirectFwd1x1:1,128,1,1,0,4,16,4,0
1-161-700-5x20-32-79-341-8-0x0-2x2-1x1-0-NCHW-FP32-F=ConvOclDirectFwd:8,32,16,32,2,1,1,1,2
160-14-14-1x1-528-14-14-512-0x0-1x1-1x1-0-NCHW-FP32-B=ConvAsm1x1U:1,16,1,32,2,1,2,2;ConvOclDirectFwd1x1:1,256,1,1,0,2,16,4,0
144-14-14-1x1-512-14-14-512-0x0-1x1-1x1-0-NCHW-FP32-B=ConvAsm1x1U:1,32,1,32,2,1,1,2;ConvOclDirectFwd1x1:1,256,1,1,0,1,32,4,0
832-7-7-1x1-128-7-7-4-0x0-1x1-1x1-0-NCHW-FP16-F=ConvAsm1x1U:1,8,2,16,1,4,4,1;ConvOclDirectFwd1x1:1,128,1,1,0,1,4,8,0
352-7-7-1x1-1056-7-7-64-0x0-1x1-1x1-0-NCHW-FP16-B=ConvAsm1x1U:1,16,2,32,1,2,2,2;ConvOclDirectFwd1x1:1,128,1,1,0,1,8,4,0
512-14-14-1x1-112-14-14-512-0x0-1x1-1x1-0-NCHW-FP16-F=ConvAsm1x1U:2,8,4,64,1,4,1,2;ConvOclDirectFwd1x1:1,128,1,1,0,2,16,4,0
32-7-7-1x1-832-7-7-128-0x0-1x1-1x1-0-NCHW-FP32-W=ConvAsmBwdWrW1x1:1,16,2,4,4,1,4,4,0,2
192-7-7-1x1-1344-7-7-16-0x0-1x1-1x1-0-NCHW-FP16-B=ConvAsm1x1U:1,16,2,32,1,2,4,1;ConvOclDirectFwd1x1:1,64,1,1,0,1,8,4,0
96-35-35-3x3-64-35-35-1-1x1-1x1-1x1-0-NCHW-FP32-W=ConvAsmBwdWrW3x3:0,1,16,2,2,1
512-28-28-1x1-256-14-14-32-0x0-2x2-1x1-0-NCHW-FP32-F=ConvAsm1x1U:4,16,4,64,1,2,1,2;ConvOclDirectFwd1x1:1,64,1,1,1,1,32,2048,0
32-14-14-5x5-128-14-14-1-2x2-1x1-1x1-0-NCHW-FP16-F=ConvOclDirectFwd:16,16,16,16,1,1,1,4,1;ConvOclDirectFwdFused:16,16,16,16,1,1,1,4,1
