src/kernels/gfx90878.HIP.2_7_0.ufdb.txt
1-1-1-2x2-1-1-1-1-0x0-1x1-1x1-0-NCHW-FP32-F=miopenConvolutionFwdAlgoWinograd:ConvBinWinogradRxSf2x3,0.04,0,miopenConvolutionFwdAlgoWinograd,<unused>;miopenConvolutionFwdAlgoGEMM:gemm,0.0504,16,rocBlas,<unused>
