src/kernels/gfx906_60.cd.pdb.txt
64-54-54-3x3-64-54-54-32-1x1-1x1-1x1-0-NCHW-FP32-W=ConvAsmBwdWrW3x3:0,1,16,4,3,4
64-111-111-3x3-3-224-224-1-0x0-2x2-1x1-0-NCHW-FP16-B=ConvOclDirectFwd:16,16,32,32,2,2,1,4,1
116-28-28-1x1-116-28-28-1-0x0-1x1-1x1-0-NCHW-FP16-F=ConvAsm1x1U:1,8,2,32,1,2,2,1;ConvOclDirectFwd1x1:1,64,1,1,0,2,16,4,0
992-7-7-1x1-128-7-7-64-0x0-1x1-1x1-0-NCHW-FP16-W=ConvAsmBwdWrW1x1:2,8,4,8,2,1,2,2,0,2
192-28-28-1x1-672-28-28-2-0x0-1x1-1x1-0-NCHW-FP32-W=ConvAsmBwdWrW1x1:1,16,2,4,4,1,1,4,0,1
192-56-56-1x1-192-56-56-2-0x0-1x1-1x1-0-NCHW-FP16-F=ConvAsm1x1U:1,8,2,32,1,4,2,2;ConvOclDirectFwd1x1:1,64,1,1,0,2,8,4,0
128-14-14-1x1-256-14-14-32-0x0-1x1-1x1-0-NCHW-FP16-W=ConvAsmBwdWrW1x1:4,4,4,4,2,2,1,4,0,1
1296-14-14-1x1-192-14-14-2-0x0-1x1-1x1-0-NCHW-FP32-F=ConvAsm1x1U:1,8,1,32,1,4,4,1;ConvOclDirectFwd1x1:1,64,1,1,1,0,16,128,0
192-7-7-1x1-1824-7-7-256-0x0-1x1-1x1-0-NCHW-FP32-W=ConvAsmBwdWrW1x1:1,16,2,4,8,1,2,4,0,3
32-35-35-1x1-192-35-35-64-0x0-1x1-1x1-0-NCHW-FP16-B=ConvAsm1x1U:1,16,2,64,1,2,1,2;ConvOclDirectFwd1x1:1,64,1,1,0,1,8,8,0
512-29-29-1x1-256-57-57-32-0x0-2x2-1x1-0-NCHW-FP32-B=ConvAsm1x1U:3,16,3,32,1,1,1,4;ConvOclDirectFwd1x1:1,128,1,1,0,1,32,4,0
192-14-14-1x1-960-14-14-1-0x0-1x1-1x1-0-NCHW-FP32-B=ConvAsm1x1U:1,16,1,64,1,2,4,1;ConvOclDirectFwd1x1:1,256,1,1,0,1,4,4,0
384-13-13-3x3-256-13-13-4-1x1-1x1-1x1-0-NCHW-FP16-F=ConvOclDirectFwd:8,16,16,16,2,1,2,4,2;ConvOclDirectFwdFused:8,16,16,16,2,1,2,4,2
128-7-7-1x1-1472-7-7-2-0x0-1x1-1x1-0-NCHW-FP16-W=ConvAsmBwdWrW1x1:1,16,2,4,2,1,1,4,0,1
128-28-28-1x1-384-28-28-32-0x0-1x1-1x1-0-NCHW-FP32-W=ConvAsmBwdWrW1x1:2,8,2,8,4,1,2,4,0,2
528-14-14-1x1-128-14-14-256-0x0-1x1-1x1-0-NCHW-FP32-B=ConvAsm1x1U:1,32,1,32,2,1,1,1;ConvOclDirectFwd1x1:1,256,1,1,0,4,16,8,0
54-55-55-1x1-24-55-55-16-0x0-1x1-1x1-0-NCHW-FP16-W=ConvAsmBwdWrW1x1:4,4,2,2,2,1,4,4,0,1
192-28-28-1x1-32-28-28-128-0x0-1x1-1x1-0-NCHW-FP32-B=ConvAsm1x1U:1,16,1,32,1,2,1,1;ConvOclDirectFwd1x1:1,128,1,1,0,2,16,4,0
64-28-28-1x1-192-28-28-256-0x0-1x1-1x1-0-NCHW-FP32-W=ConvAsmBwdWrW1x1:2,8,2,8,2,1,4,4,0,1
512-15-15-3x3-512-15-15-48-1x1-1x1-1x1-0-NCHW-FP32-F_g32=ConvOclDirectFwd:16,8,16,16,1,2,8,1,1
128-14-14-1x1-1760-14-14-2-0x0-1x1-1x1-0-NCHW-FP16-W=ConvAsmBwdWrW1x1:2,8,2,8,2,1,1,4,0,0
192-14-14-1x1-1488-14-14-256-0x0-1x1-1x1-0-NCHW-FP16-W=ConvAsmBwdWrW1x1:2,8,4,8,2,1,4,4,0,1
832-7-7-1x1-128-7-7-256-0x0-1x1-1x1-0-NCHW-FP32-W=ConvAsmBwdWrW1x1:1,16,2,8,4,1,2,4,0,2
3-1-1-3x3-4-2-2-512-0x0-2x2-1x1-0-NCHW-FP32-B=ConvOclDirectFwd:8,8,8,8,1,1,2,1,2
384-8-8-3x3-448-8-8-2-1x1-1x1-1x1-0-NCHW-FP16-B=ConvOclDirectFwd:8,8,8,8,1,1,1,4,2
128-14-14-1x1-1056-14-14-256-0x0-1x1-1x1-0-NCHW-FP32-B=ConvAsm1x1U:1,32,1,32,2,1,1,1;ConvOclDirectFwd1x1:1,128,1,1,0,2,32,4,0
512-15-15-3x3-512-29-29-128-1x1-2x2-1x1-0-NCHW-FP32-B_g32=ConvOclDirectFwd:32,16,32,32,1,2,4,4,1
192-28-28-1x1-576-28-28-8-0x0-1x1-1x1-0-NCHW-FP32-W=ConvAsmBwdWrW1x1:1,16,2,4,8,1,2,4,0,1
256-28-28-3x3-256-14-14-1-1x1-2x2-1x1-0-NCHW-FP32-F=ConvOclDirectFwd:16,16,16,16,1,1,1,2,1
384-35-35-1x1-64-35-35-8-0x0-1x1-1x1-0-NCHW-FP16-F=ConvAsm1x1U:2,8,4,32,1,4,2,2;ConvOclDirectFwd1x1:1,128,1,1,0,1,8,4,0
160-7-7-1x1-832-7-7-128-0x0-1x1-1x1-0-NCHW-FP32-W=ConvAsmBwdWrW1x1:1,16,2,8,4,1,4,4,0,2
48-7-7-3x3-192-7-7-128-1x1-1x1-1x1-0-NCHW-FP32-W=ConvAsmBwdWrW3x3:0,1,8,2,7,2
128-14-14-1x1-320-14-14-64-0x0-1x1-1x1-0-NCHW-FP32-B=ConvAsm1x1U:1,32,1,16,1,1,1,1;ConvOclDirectFwd1x1:1,256,1,1,0,4,16,4,0
544-7-7-1x1-128-7-7-64-0x0-1x1-1x1-0-NCHW-FP32-F=ConvAsm1x1U:4,8,4,16,1,4,2,2;ConvOclDirectFwd1x1:1,64,1,1,1,1,16,256,0
128-28-28-3x3-32-28-28-16-1x1-1x1-1x1-0-NCHW-FP16-F=ConvOclDirectFwd:16,16,16,32,1,2,4,4,2
128-54-54-1x1-32-54-54-4-0x0-1x1-1x1-0-NCHW-FP16-B=ConvAsm1x1U:1,8,2,16,1,2,4,2;ConvOclDirectFwd1x1:1,256,1,1,0,4,4,4,0
128-14-14-1x1-1440-14-14-128-0x0-1x1-1x1-0-NCHW-FP32-B=ConvAsm1x1U:1,32,1,32,2,1,1,1;ConvOclDirectFwd1x1:1,256,1,1,0,1,32,4,0
1440-14-14-1x1-192-14-14-32-0x0-1x1-1x1-0-NCHW-FP16-F=ConvAsm1x1U:2,8,4,64,1,4,2,4;ConvOclDirectFwd1x1:1,256,1,1,0,4,4,4,0
768-28-28-1x1-384-28-28-256-0x0-1x1-1x1-0-NCHW-FP32-F=ConvAsm1x1U:3,16,5,32,1,2,1,8;ConvOclDirectFwd1x1:1,64,1,1,1,0,16,2048,0
128-57-57-3x3-128-57-57-256-1x1-1x1-1x1-0-NCHW-FP32-W_g32=ConvOclBwdWrW2<4>:1,7,3,1,5;ConvOclBwdWrW2<16>:1,7,3,1,5;ConvOclBwdWrW2<2>:1,7,3,1,5;ConvOclBwdWrW2<1>:1,7,3,1,5;ConvAsmBwdWrW3x3:0,1,16,2,2,8;ConvOclBwdWrW2<8>:1,7,3,1,5
128-14-14-1x1-704-14-14-2-0x0-1x1-1x1-0-NCHW-FP16-B=ConvAsm1x1U:1,8,2,32,1,2,4,1;ConvOclDirectFwd1x1:1,64,1,1,0,1,4,4,0
192-13-13-3x3-48-13-13-8-1x1-1x1-1x1-0-NCHW-FP16-B=ConvOclDirectFwd:16,16,16,16,1,1,2,4,2
128-14-14-1x1-1056-14-14-4-0x0-1x1-1x1-0-NCHW-FP32-W=ConvAsmBwdWrW1x1:1,16,2,8,4,1,2,4,0,1
16-54-54-1x1-128-54-54-512-0x0-1x1-1x1-0-NCHW-FP16-B=ConvAsm1x1U:1,16,2,64,1,2,1,4;ConvOclDirectFwd1x1:1,256,1,1,0,4,16,4,0
128-14-14-1x1-576-14-14-32-0x0-1x1-1x1-0-NCHW-FP16-W=ConvAsmBwdWrW1x1:2,8,4,8,2,1,2,4,0,1
5-10-10-3x3-3-10-10-512-1x1-1x1-1x1-0-NCHW-FP16-F=ConvOclDirectFwd:8,8,16,16,2,2,2,1,2
2048-7-7-1x1-1024-14-14-8-0x0-2x2-1x1-0-NCHW-FP16-W=ConvAsmBwdWrW1x1:1,16,4,4,4,1,1,4,0,0
64-55-55-3x3-16-55-55-8-1x1-1x1-1x1-0-NCHW-FP32-W=ConvAsmBwdWrW3x3:0,0,8,2,2,8
32-14-14-3x3-128-14-14-64-1x1-1x1-1x1-0-NCHW-FP32-W=ConvAsmBwdWrW3x3:0,0,8,4,6,4
128-14-14-1x1-800-14-14-1-0x0-1x1-1x1-0-NCHW-FP16-B=ConvAsm1x1U:1,8,2,64,1,2,4,1;ConvOclDirectFwd1x1:1,64,1,1,0,4,4,4,0
32-56-56-3x3-128-56-56-32-1x1-1x1-1x1-0-NCHW-FP32-W=ConvAsmBwdWrW3x3:0,0,8,2,3,2
128-7-7-1x1-1280-7-7-2-0x0-1x1-1x1-0-NCHW-FP16-B=ConvAsm1x1U:1,8,2,32,1,4,4,1;ConvOclDirectFwd1x1:1,64,1,1,0,1,4,8,0
48-35-35-1x1-192-35-35-8-0x0-1x1-1x1-0-NCHW-FP32-W=ConvAsmBwdWrW1x1:4,4,4,4,4,1,4,4,0,1
32-54-54-1x1-128-54-54-128-0x0-1x1-1x1-0-NCHW-FP16-F=ConvAsm1x1U:1,8,2,64,1,4,1,4;ConvOclDirectFwd1x1:1,128,1,1,0,2,32,4,0
64-112-112-7x7-3-230-230-32-0x0-2x2-1x1-0-NCHW-FP32-B=ConvOclDirectFwd:16,16,32,32,2,2,8,2,1
48-27-27-3x3-192-27-27-32-1x1-1x1-1x1-0-NCHW-FP16-W=ConvAsmBwdWrW3x3:0,1,8,2,4,4
256-14-14-3x3-128-28-28-16-1x1-2x2-1x1-0-NCHW-FP16-B=ConvOclDirectFwd:32,16,32,32,1,2,4,2,1
128-14-14-1x1-1056-14-14-1024-0x0-1x1-1x1-0-NCHW-FP16-W=ConvAsmBwdWrW1x1:2,8,4,4,4,1,4,4,0,1
256-28-28-3x3-256-28-28-2-1x1-1x1-1x1-0-NCHW-FP32-F_g32=ConvOclDirectFwd:16,16,16,32,1,2,4,4,2
256-64-64-1x1-1024-64-64-4-0x0-1x1-1x1-0-NCHW-FP32-W=ConvAsmBwdWrW1x1:2,8,4,4,8,1,1,4,0,1
128-28-28-1x1-416-28-28-1-0x0-1x1-1x1-0-NCHW-FP32-W=ConvAsmBwdWrW1x1:2,8,4,4,2,1,1,4,0,1
16-38-38-3x3-256-38-38-64-1x1-1x1-1x1-0-NCHW-FP32-W=ConvAsmBwdWrW3x3:0,0,8,4,3,4
192-28-28-1x1-528-28-28-4-0x0-1x1-1x1-0-NCHW-FP32-B=ConvAsm1x1U:1,16,1,16,1,2,2,2;ConvOclDirectFwd1x1:1,64,1,1,0,2,16,4,0
32-7-7-1x1-832-7-7-512-0x0-1x1-1x1-0-NCHW-FP16-W=ConvAsmBwdWrW1x1:2,8,4,4,4,2,4,2,0,2
128-7-7-1x1-672-7-7-256-0x0-1x1-1x1-0-NCHW-FP16-W=ConvAsmBwdWrW1x1:2,8,8,8,2,2,2,2,0,2
128-17-17-7x1-128-17-17-4-3x0-1x1-1x1-0-NCHW-FP32-W=ConvOclBwdWrW2<4>:1,6,8,3,7;ConvOclBwdWrW2<1>:1,9,8,3,9;ConvOclBwdWrW2<2>:1,6,3,8,7
288-28-28-1x1-128-28-28-128-0x0-1x1-1x1-0-NCHW-FP32-B=ConvAsm1x1U:1,32,1,32,2,1,1,2;ConvOclDirectFwd1x1:1,256,1,1,0,2,16,4,0
128-7-7-1x1-896-7-7-64-0x0-1x1-1x1-0-NCHW-FP16-W=ConvAsmBwdWrW1x1:4,4,4,4,4,1,1,2,0,0
256-56-56-3x3-256-56-56-256-1x1-1x1-1x1-0-NCHW-FP32-W=ConvAsmBwdWrW3x3:0,1,8,4,2,4
320-8-8-1x1-2048-8-8-1-0x0-1x1-1x1-0-NCHW-FP32-W=ConvAsmBwdWrW1x1:1,16,2,2,8,1,1,4,0,0
512-29-29-1x1-256-57-57-4-0x0-2x2-1x1-0-NCHW-FP32-B=ConvAsm1x1U:1,32,1,32,1,1,2,1;ConvOclDirectFwd1x1:16,64,32,32,0,1,16,4,1
192-14-14-1x1-672-14-14-2-0x0-1x1-1x1-0-NCHW-FP32-B=ConvAsm1x1U:1,16,1,32,1,1,4,1;ConvOclDirectFwd1x1:1,256,1,1,0,1,4,4,0
256-28-28-1x1-512-28-28-2-0x0-1x1-1x1-0-NCHW-FP16-W=ConvAsmBwdWrW1x1:2,8,4,4,2,1,1,4,0,1
48-27-27-1x1-256-27-27-1-0x0-1x1-1x1-0-NCHW-FP32-B=ConvAsm1x1U:1,8,1,64,1,4,2,4;ConvOclDirectFwd1x1:1,128,1,1,0,1,4,4,0
3-225-225-7x7-64-112-112-1-2x2-2x2-1x1-0-NCHW-FP32-F=ConvOclDirectFwd:16,8,16,16,1,2,8,1,1;ConvOclDirectFwdFused:16,8,16,16,1,2,8,1,1
128-28-28-1x1-192-28-28-2-0x0-1x1-1x1-0-NCHW-FP16-W=ConvAsmBwdWrW1x1:2,8,2,4,2,1,2,2,0,1
480-14-14-1x1-96-14-14-4-0x0-1x1-1x1-0-NCHW-FP32-F=ConvAsm1x1U:2,8,2,64,1,4,4,1;ConvActivAsm1x1U:1,16,1,16,1,4;ConvOclDirectFwd1x1:1,64,1,1,1,1,64,64,0
64-35-35-1x1-384-35-35-8-0x0-1x1-1x1-0-NCHW-FP32-W=ConvAsmBwdWrW1x1:4,4,4,4,4,1,2,4,0,1
1760-7-7-1x1-128-7-7-256-0x0-1x1-1x1-0-NCHW-FP16-F=ConvAsm1x1U:2,8,4,16,1,4,2,2;ConvOclDirectFwd1x1:1,128,1,1,0,1,8,4,0
128-28-28-3x3-32-28-28-64-1x1-1x1-1x1-0-NCHW-FP16-B=ConvOclDirectFwd:16,16,32,32,2,2,8,2,2
32-38-166-5x10-32-79-341-256-0x0-2x2-1x1-0-NCHW-FP32-W=ConvOclBwdWrW2<4>:8,7,1,3,5;ConvOclBwdWrW2<1>:3,10,3,3,5;ConvOclBwdWrW2<16>:8,7,1,3,5;ConvOclBwdWrW2<8>:8,9,1,3,5;ConvOclBwdWrW2<2>:8,11,1,3,5
1024-1-1-7x7-256-7-7-800-0x0-1x1-1x1-0-NCHW-FP32-B=ConvOclDirectFwd:8,8,8,8,1,1,8,1,1
128-7-7-1x1-768-7-7-256-0x0-1x1-1x1-0-NCHW-FP16-W=ConvAsmBwdWrW1x1:2,8,8,8,2,2,2,2,0,3
16-54-54-3x3-64-54-54-2-1x1-1x1-1x1-0-NCHW-FP32-F=ConvOclDirectFwd:8,32,16,32,2,1,8,4,2;ConvAsm3x3U:5,3,2
1680-14-14-1x1-192-14-14-256-0x0-1x1-1x1-0-NCHW-FP16-F=ConvAsm1x1U:2,8,4,64,1,4,1,4;ConvOclDirectFwd1x1:1,256,1,1,0,4,8,4,0
48-13-13-1x1-384-13-13-1-0x0-1x1-1x1-0-NCHW-FP32-W=ConvAsmBwdWrW1x1:4,4,2,2,2,1,1,2,0,0
512-8-8-3x3-512-15-15-1-1x1-2x2-1x1-0-NCHW-FP32-B=ConvOclDirectFwd:16,8,16,16,1,2,1,4,1
256-64-128-1x1-528-64-128-1-0x0-1x1-1x1-0-NCHW-FP32-B=ConvOclDirectFwd1x1:1,256,1,1,0,2,16,4,0
160-56-56-1x1-128-56-56-32-0x0-1x1-1x1-0-NCHW-FP32-F=ConvAsm1x1U:2,16,2,64,2,2,1,1;ConvOclDirectFwd1x1:1,64,1,1,1,1,16,2048,0
256-29-29-3x3-256-57-57-256-1x1-2x2-1x1-0-NCHW-FP16-W_g32=ConvOclBwdWrW2<4>:1,7,8,1,11;ConvOclBwdWrW2<16>:1,9,8,1,11;ConvOclBwdWrW2<2>:1,7,8,1,11;ConvOclBwdWrW2<1>:1,7,8,1,11;ConvAsmBwdWrW3x3:0,0,16,4,2,4;ConvOclBwdWrW2<8>:1,7,8,1,11
128-7-7-1x1-1440-7-7-64-0x0-1x1-1x1-0-NCHW-FP16-B=ConvAsm1x1U:2,16,4,16,1,2,1,1;ConvOclDirectFwd1x1:1,64,1,1,0,1,8,4,0
224-28-28-1x1-128-28-28-64-0x0-1x1-1x1-0-NCHW-FP32-F=ConvAsm1x1U:2,16,2,32,2,2,1,2;ConvOclDirectFwd1x1:1,64,1,1,1,1,16,2048,0
128-14-14-1x1-1216-14-14-1-0x0-1x1-1x1-0-NCHW-FP16-B=ConvAsm1x1U:1,8,2,64,1,4,4,2;ConvOclDirectFwd1x1:1,256,1,1,0,4,4,4,0
192-56-56-1x1-288-56-56-4-0x0-1x1-1x1-0-NCHW-FP32-W=ConvAsmBwdWrW1x1:2,8,4,2,8,1,2,4,0,1
192-14-14-1x1-672-14-14-2-0x0-1x1-1x1-0-NCHW-FP16-B=ConvAsm1x1U:1,8,2,32,1,4,4,1;ConvOclDirectFwd1x1:1,64,1,1,0,1,4,4,0
256-55-55-1x1-512-28-28-1-0x0-2x2-1x1-0-NCHW-FP32-F=ConvAsm1x1U:2,16,7,64,1,4;ConvOclDirectFwd1x1:1,64,1,1,1,1,16,128,0
128-56-56-3x3-256-56-56-32-1x1-1x1-1x1-0-NCHW-FP16-W=ConvAsmBwdWrW3x3:0,1,8,2,2,1
192-14-14-3x3-48-14-14-64-1x1-1x1-1x1-0-NCHW-FP16-F=ConvOclDirectFwd:16,8,16,16,1,2,4,2,2
192-14-14-1x1-1872-14-14-1-0x0-1x1-1x1-0-NCHW-FP16-B=ConvAsm1x1U:2,8,4,64,1,2,4,2;ConvOclDirectFwd1x1:1,128,1,1,0,4,4,4,0
384-56-56-1x1-192-56-56-16-0x0-1x1-1x1-0-NCHW-FP32-F=ConvAsm1x1U:3,16,3,64,2,2,1,2;ConvActivAsm1x1U:2,16,2,64,4,1;ConvOclDirectFwd1x1:1,64,1,1,1,1,64,2048,0
192-7-7-1x1-2064-7-7-32-0x0-1x1-1x1-0-NCHW-FP32-B=ConvAsm1x1U:2,16,2,32,1,2,2,2;ConvOclDirectFwd1x1:1,128,1,1,0,1,16,8,0
192-27-27-5x5-64-27-27-64-2x2-1x1-1x1-0-NCHW-FP16-W=ConvOclBwdWrW2<4>:1,7,1,8,7;ConvOclBwdWrW2<1>:1,9,3,3,7;ConvOclBwdWrW2<16>:1,7,1,8,7;ConvOclBwdWrW2<8>:1,9,1,8,7;ConvOclBwdWrW2<2>:1,10,1,8,5
192-14-14-1x1-1872-14-14-16-0x0-1x1-1x1-0-NCHW-FP32-W=ConvAsmBwdWrW1x1:2,8,4,8,4,1,2,4,0,1
256-55-55-1x1-512-28-28-16-0x0-2x2-1x1-0-NCHW-FP32-F=ConvAsm1x1U:4,16,5,32,1,4;ConvOclDirectFwd1x1:1,64,1,1,1,0,32,2048,0
192-7-7-1x1-1392-7-7-2-0x0-1x1-1x1-0-NCHW-FP16-W=ConvAsmBwdWrW1x1:1,16,2,8,2,1,1,4,0,1
128-28-28-1x1-384-28-28-1-0x0-1x1-1x1-0-NCHW-FP32-W=ConvAsmBwdWrW1x1:2,8,2,2,4,1,1,4,0,1
384-8-8-1x1-1280-8-8-512-0x0-1x1-1x1-0-NCHW-FP16-W=ConvAsmBwdWrW1x1:2,8,4,8,2,1,1,4,0,0
32-28-28-1x1-192-28-28-512-0x0-1x1-1x1-0-NCHW-FP16-W=ConvAsmBwdWrW1x1:4,4,4,2,4,1,4,4,0,3
128-7-7-1x1-1536-7-7-64-0x0-1x1-1x1-0-NCHW-FP32-B=ConvAsm1x1U:2,16,2,32,1,2,1,8;ConvOclDirectFwd1x1:1,256,1,1,0,1,16,8,0
32-79-341-5x20-1-161-700-2-0x0-2x2-1x1-0-NCHW-FP32-W=ConvOclBwdWrW2<1>:8,7,1,1,7;ConvOclBwdWrW2<2>:8,7,1,1,7
192-28-28-1x1-240-28-28-4-0x0-1x1-1x1-0-NCHW-FP32-W=ConvAsmBwdWrW1x1:2,8,4,2,4,1,1,4,0,1
128-14-14-1x1-576-14-14-64-0x0-1x1-1x1-0-NCHW-FP16-B=ConvAsm1x1U:1,16,2,16,1,2,2,2;ConvOclDirectFwd1x1:1,256,1,1,0,2,8,4,0
384-7-7-3x3-192-7-7-128-1x1-1x1-1x1-0-NCHW-FP16-W=ConvAsmBwdWrW3x3:0,0,8,4,4,1
16-55-55-1x1-64-55-55-128-0x0-1x1-1x1-0-NCHW-FP32-F=ConvAsm1x1U:1,8,1,64,1,4,1,2;ConvOclDirectFwd1x1:1,64,1,1,1,1,16,256,0
192-14-14-1x1-672-14-14-1-0x0-1x1-1x1-0-NCHW-FP16-W=ConvAsmBwdWrW1x1:1,16,2,4,2,1,1,4,0,0
128-14-14-1x1-1312-14-14-32-0x0-1x1-1x1-0-NCHW-FP16-W=ConvAsmBwdWrW1x1:2,8,4,4,4,1,2,4,0,2
128-7-7-1x1-1312-7-7-1024-0x0-1x1-1x1-0-NCHW-FP16-W=ConvAsmBwdWrW1x1:1,16,4,8,2,1,2,2,0,3
64-256-512-1x1-64-256-512-1-0x0-1x1-1x1-0-NCHW-FP16-W=ConvAsmBwdWrW1x1:4,4,2,1,4,1,1,4,0,3
256-57-57-1x1-512-29-29-4-0x0-2x2-1x1-0-NCHW-FP32-F=ConvAsm1x1U:4,16,4,64,1,2,1,1;ConvOclDirectFwd1x1:1,64,1,1,1,1,32,2048,0
256-56-56-3x3-256-56-56-2-1x1-1x1-1x1-0-NCHW-FP16-W=ConvAsmBwdWrW3x3:0,0,8,4,1,1
1600-14-14-1x1-128-14-14-2-0x0-1x1-1x1-0-NCHW-FP32-F=ConvAsm1x1U:1,8,1,32,1,4,4,2;ConvOclDirectFwd1x1:1,64,1,1,1,1,16,128,0
256-56-56-1x1-64-56-56-64-0x0-1x1-1x1-0-NCHW-FP16-W=ConvAsmBwdWrW1x1:4,4,4,1,8,2,1,4,0,1
480-7-7-1x1-120-7-7-256-0x0-1x1-1x1-0-NCHW-FP16-B_g3=ConvOclDirectFwd:8,8,8,8,1,1,8,2,1
120-14-14-1x1-480-14-14-64-0x0-1x1-1x1-0-NCHW-FP32-F_g3=ConvOclDirectFwd:8,8,8,8,1,1,8,4,2
1056-7-7-1x1-192-7-7-2-0x0-1x1-1x1-0-NCHW-FP16-F=ConvAsm1x1U:1,8,2,16,1,4,4,1;ConvOclDirectFwd1x1:1,256,1,1,0,1,4,8,0
1792-14-14-1x1-896-14-14-32-0x0-1x1-1x1-0-NCHW-FP16-F=ConvAsm1x1U:4,8,8,16,1,4,2,4;ConvOclDirectFwd1x1:1,64,1,1,0,4,8,4,0
192-7-7-1x1-1296-7-7-16-0x0-1x1-1x1-0-NCHW-FP16-B=ConvAsm1x1U:2,16,4,16,1,2,2,1;ConvOclDirectFwd1x1:1,64,1,1,0,1,4,4,0
512-7-7-3x3-512-7-7-1024-1x1-1x1-1x1-0-NCHW-FP16-F=ConvOclDirectFwd:8,8,8,8,1,1,8,4,1
128-14-14-1x1-896-14-14-4-0x0-1x1-1x1-0-NCHW-FP16-W=ConvAsmBwdWrW1x1:2,8,2,8,2,1,1,4,0,1
128-27-27-3x3-128-27-27-8-1x1-1x1-1x1-0-NCHW-FP16-B=ConvOclDirectFwd:16,16,32,32,2,2,4,4,2
128-56-56-3x3-256-56-56-256-1x1-1x1-1x1-0-NCHW-FP16-W=ConvAsmBwdWrW3x3:0,0,8,8,1,1
128-7-7-1x1-1600-7-7-16-0x0-1x1-1x1-0-NCHW-FP32-W=ConvAsmBwdWrW1x1:1,16,2,4,8,1,1,4,0,3
192-28-28-1x1-192-28-28-128-0x0-1x1-1x1-0-NCHW-FP16-F=ConvAsm1x1U:2,8,4,16,1,4,1,8;ConvOclDirectFwd1x1:1,64,1,1,0,4,16,4,0
192-28-28-1x1-336-28-28-4-0x0-1x1-1x1-0-NCHW-FP32-B=ConvAsm1x1U:1,16,1,32,1,2,4,1;ConvOclDirectFwd1x1:1,128,1,1,0,2,8,4,0
32-14-14-1x1-512-14-14-1-0x0-1x1-1x1-0-NCHW-FP16-B=ConvAsm1x1U:1,8,2,32,1,2,2,1;ConvOclDirectFwd1x1:1,256,1,1,0,4,4,8,0
512-7-7-1x1-2048-7-7-4-0x0-1x1-1x1-0-NCHW-FP32-F=ConvAsm1x1U:1,8,1,64,4,4,2,2;ConvActivAsm1x1U:2,16,2,32,2,2;ConvOclDirectFwd1x1:1,64,1,1,1,4,16,256,0
192-28-28-3x3-128-28-28-128-1x1-1x1-1x1-0-NCHW-FP16-B=ConvOclDirectFwd:16,16,32,32,2,2,8,2,1
32-28-28-5x5-96-28-28-256-2x2-1x1-1x1-0-NCHW-FP32-F=ConvOclDirectFwd:16,16,32,32,2,2,8,1,2;ConvOclDirectFwdFused:16,16,32,32,2,2,8,1,2
232-7-7-1x1-232-7-7-2-0x0-1x1-1x1-0-NCHW-FP32-F=ConvAsm1x1U:1,8,1,32,1,2,4,2;ConvOclDirectFwd1x1:1,64,1,1,0,1,4,4,0
128-14-14-1x1-1024-14-14-32-0x0-1x1-1x1-0-NCHW-FP16-B=ConvAsm1x1U:1,16,2,16,1,2,1,8;ConvOclDirectFwd1x1:1,64,1,1,0,4,8,4,0
832-7-7-1x1-32-7-7-256-0x0-1x1-1x1-0-NCHW-FP16-F=ConvAsm1x1U:2,8,4,16,1,2,4,2;ConvOclDirectFwd1x1:1,64,1,1,0,1,8,4,0
58-56-56-1x1-24-56-56-128-0x0-1x1-1x1-0-NCHW-FP16-W=ConvAsmBwdWrW1x1:4,4,2,1,4,2,4,4,0,1
192-28-28-1x1-32-28-28-1-0x0-1x1-1x1-0-NCHW-FP32-F=ConvAsm1x1U:1,8,1,64,1,4,4,1;ConvActivAsm1x1U:1,16,1,16,1,4;ConvOclDirectFwd1x1:1,64,1,1,1,0,16,64,0
192-14-14-1x1-480-14-14-8-0x0-1x1-1x1-0-NCHW-FP32-B=ConvAsm1x1U:1,16,1,32,1,2,2,1;ConvOclDirectFwd1x1:1,256,1,1,0,4,16,4,0
128-14-14-1x1-832-14-14-4-0x0-1x1-1x1-0-NCHW-FP16-B=ConvAsm1x1U:1,16,2,16,1,2,4,2;ConvOclDirectFwd1x1:1,64,1,1,0,4,4,4,0
96-14-14-1x1-480-14-14-128-0x0-1x1-1x1-0-NCHW-FP16-W=ConvAsmBwdWrW1x1:4,4,4,4,4,1,2,2,0,2
60-28-28-1x1-240-28-28-64-0x0-1x1-1x1-0-NCHW-FP16-B_g3=ConvOclDirectFwd:16,16,16,32,1,2,8,4,2
64-13-13-3x3-256-13-13-32-1x1-1x1-1x1-0-NCHW-FP16-F=ConvOclDirectFwd:8,8,16,16,2,2,8,4,2
256-28-28-1x1-128-28-28-8-0x0-1x1-1x1-0-NCHW-FP16-F=ConvAsm1x1U:1,8,2,32,2,4,2,8;ConvOclDirectFwd1x1:1,64,1,1,0,2,8,4,0
240-28-28-1x1-60-28-28-512-0x0-1x1-1x1-0-NCHW-FP16-F_g3=ConvOclDirectFwd:16,16,16,16,1,1,8,2,2
128-7-7-1x1-1792-7-7-512-0x0-1x1-1x1-0-NCHW-FP16-W=ConvAsmBwdWrW1x1:1,16,8,8,2,1,2,2,0,2
128-14-14-1x1-832-14-14-256-0x0-1x1-1x1-0-NCHW-FP32-W=ConvAsmBwdWrW1x1:2,8,4,8,4,1,2,4,0,1
96-14-14-1x1-480-14-14-1-0x0-1x1-1x1-0-NCHW-FP16-B=ConvAsm1x1U:1,8,2,64,1,4,4,1;ConvOclDirectFwd1x1:1,64,1,1,0,1,4,4,0
192-56-56-1x1-288-56-56-4-0x0-1x1-1x1-0-NCHW-FP32-B=ConvAsm1x1U:1,16,1,64,1,2,1,1;ConvOclDirectFwd1x1:1,128,1,1,0,2,16,4,0
128-57-57-3x3-128-57-57-4-1x1-1x1-1x1-0-NCHW-FP16-W_g32=ConvOclBwdWrW2<1>:1,9,3,1,9;ConvOclBwdWrW2<4>:1,10,1,1,9;ConvAsmBwdWrW3x3:0,0,16,1,3,1;ConvOclBwdWrW2<2>:1,10,1,1,9
384-56-56-1x1-192-56-56-32-0x0-1x1-1x1-0-NCHW-FP32-F=ConvAsm1x1U:2,16,5,64,1,2,2,2;ConvOclDirectFwd1x1:1,64,1,1,1,1,16,2048,0
128-14-14-1x1-832-14-14-4-0x0-1x1-1x1-0-NCHW-FP32-B=ConvAsm1x1U:1,16,1,32,1,2,2,2;ConvOclDirectFwd1x1:1,64,1,1,0,1,8,4,0
192-7-7-1x1-1056-7-7-16-0x0-1x1-1x1-0-NCHW-FP16-F=ConvAsm1x1U:1,16,4,16,1,2,2,2;ConvOclDirectFwd1x1:1,64,1,1,0,1,16,4,0
128-7-7-1x1-1760-7-7-512-0x0-1x1-1x1-0-NCHW-FP32-W=ConvAsmBwdWrW1x1:1,16,4,8,4,1,2,4,0,2
128-14-14-1x1-704-14-14-1-0x0-1x1-1x1-0-NCHW-FP32-W=ConvAsmBwdWrW1x1:2,8,4,4,2,1,1,4,0,1
512-28-28-1x1-256-28-28-64-0x0-1x1-1x1-0-NCHW-FP16-W=ConvAsmBwdWrW1x1:2,8,8,8,2,1,2,4,0,1
192-28-28-1x1-240-28-28-32-0x0-1x1-1x1-0-NCHW-FP32-W=ConvAsmBwdWrW1x1:2,8,2,8,4,1,2,4,0,2
160-14-14-3x3-160-14-14-32-1x1-1x1-1x1-0-NCHW-FP32-W=ConvAsmBwdWrW3x3:0,1,8,2,14,2
192-28-28-1x1-64-28-28-16-0x0-1x1-1x1-0-NCHW-FP32-F=ConvAsm1x1U:2,16,2,16,1,2,2,1;ConvActivAsm1x1U:1,16,1,32,4,2;ConvOclDirectFwd1x1:1,64,1,1,1,0,16,2048,0
576-7-7-1x1-128-7-7-128-0x0-1x1-1x1-0-NCHW-FP32-F=ConvAsm1x1U:4,8,4,16,1,4,1,4;ConvOclDirectFwd1x1:1,64,1,1,1,0,16,2048,0
192-14-14-1x1-1152-14-14-2-0x0-1x1-1x1-0-NCHW-FP16-W=ConvAsmBwdWrW1x1:1,16,2,4,4,1,1,4,0,0
32-35-35-1x1-192-35-35-4-0x0-1x1-1x1-0-NCHW-FP16-W=ConvAsmBwdWrW1x1:4,4,2,4,2,1,4,4,0,1
192-14-14-1x1-1920-14-14-128-0x0-1x1-1x1-0-NCHW-FP32-B=ConvAsm1x1U:1,32,1,32,2,1,1,1;ConvOclDirectFwd1x1:1,128,1,1,0,1,32,4,0
2048-8-8-1x1-192-8-8-256-0x0-1x1-1x1-0-NCHW-FP16-F=ConvAsm1x1U:1,8,2,32,4,4,2,2;ConvOclDirectFwd1x1:1,128,1,1,0,4,16,8,0
352-28-28-1x1-128-28-28-256-0x0-1x1-1x1-0-NCHW-FP32-F=ConvAsm1x1U:3,16,3,16,2,2,1,2;ConvOclDirectFwd1x1:1,64,1,1,1,4,16,2048,0
832-7-7-1x1-192-7-7-128-0x0-1x1-1x1-0-NCHW-FP32-F=ConvAsm1x1U:1,16,1,64,4,2,4,1;ConvActivAsm1x1U:4,16,4,16,1,2;ConvOclDirectFwd1x1:1,64,1,1,1,0,16,2048,0
60-14-14-1x1-240-14-14-256-0x0-1x1-1x1-0-NCHW-FP16-F_g3=ConvOclDirectFwd:16,16,16,16,1,1,8,2,2
128-14-14-1x1-288-14-14-256-0x0-1x1-1x1-0-NCHW-FP16-W=ConvAsmBwdWrW1x1:4,4,8,4,2,2,1,4,0,3
832-14-14-1x1-128-14-14-256-0x0-1x1-1x1-0-NCHW-FP16-W=ConvAsmBwdWrW1x1:2,8,8,8,2,1,2,4,0,1
128-7-7-1x1-544-7-7-128-0x0-1x1-1x1-0-NCHW-FP32-F=ConvAsm1x1U:1,8,1,64,2,4,1,8;ConvOclDirectFwd1x1:1,64,1,1,1,0,16,2048,0
512-28-28-1x1-128-28-28-16-0x0-1x1-1x1-0-NCHW-FP32-B=ConvAsm1x1U:1,16,1,32,1,2,2,2;ConvOclDirectFwd1x1:1,64,1,1,0,2,16,4,0
128-7-7-5x5-32-7-7-64-2x2-1x1-1x1-0-NCHW-FP16-B=ConvOclDirectFwd:8,8,8,8,1,1,2,1,2
1-7-7-3x3-1-5-5-32-0x0-1x1-1x1-0-NCHW-FP32-F=ConvOclDirectFwd:8,8,8,8,1,1,8,2,1
96-56-56-1x1-128-56-56-16-0x0-1x1-1x1-0-NCHW-FP16-W=ConvAsmBwdWrW1x1:4,4,8,4,2,1,4,2,0,1
320-8-8-1x1-1280-8-8-16-0x0-1x1-1x1-0-NCHW-FP32-W=ConvAsmBwdWrW1x1:1,16,4,4,4,1,1,4,0,0
512-14-14-1x1-32-14-14-1-0x0-1x1-1x1-0-NCHW-FP32-F=ConvAsm1x1U:1,8,1,32,1,4,4,1;ConvActivAsm1x1U:1,16,1,16,1,3;ConvOclDirectFwd1x1:1,64,1,1,1,4,16,64,0
1216-14-14-1x1-128-14-14-16-0x0-1x1-1x1-0-NCHW-FP32-F=ConvAsm1x1U:4,16,4,64,1,2,4,1;ConvOclDirectFwd1x1:1,64,1,1,1,4,16,256,0
120-14-14-1x1-480-14-14-256-0x0-1x1-1x1-0-NCHW-FP32-B_g3=ConvOclDirectFwd:8,16,8,16,1,1,8,2,2
544-7-7-1x1-128-7-7-512-0x0-1x1-1x1-0-NCHW-FP32-B=ConvAsm1x1U:1,16,1,64,2,2,2,2;ConvOclDirectFwd1x1:1,128,1,1,0,1,16,8,0
192-14-14-1x1-1152-14-14-8-0x0-1x1-1x1-0-NCHW-FP32-B=ConvAsm1x1U:1,16,1,32,2,2,2,2;ConvOclDirectFwd1x1:1,64,1,1,0,2,16,4,0
128-14-14-1x1-992-14-14-128-0x0-1x1-1x1-0-NCHW-FP32-W=ConvAsmBwdWrW1x1:2,8,4,8,4,1,2,4,0,2
128-7-7-1x1-960-7-7-64-0x0-1x1-1x1-0-NCHW-FP16-F=ConvAsm1x1U:2,8,4,16,1,4,1,2;ConvOclDirectFwd1x1:1,64,1,1,0,1,8,4,0
64-13-13-1x1-256-13-13-128-0x0-1x1-1x1-0-NCHW-FP32-W=ConvAsmBwdWrW1x1:4,4,4,4,4,1,4,4,0,1
192-56-56-1x1-96-56-56-128-0x0-1x1-1x1-0-NCHW-FP32-W=ConvAsmBwdWrW1x1:2,8,2,4,8,1,4,4,0,1
128-54-54-1x1-32-54-54-128-0x0-1x1-1x1-0-NCHW-FP16-F=ConvAsm1x1U:1,8,2,64,1,4,1,4;ConvOclDirectFwd1x1:1,128,1,1,0,2,16,4,0
192-14-14-1x1-864-14-14-128-0x0-1x1-1x1-0-NCHW-FP16-W=ConvAsmBwdWrW1x1:1,16,8,8,2,1,2,4,0,1
192-256-512-3x3-64-256-512-1-1x1-1x1-1x1-0-NCHW-FP16-B=ConvOclDirectFwd:16,16,32,32,2,2,8,2,1
512-64-128-1x1-24-64-128-1-0x0-1x1-1x1-0-NCHW-FP32-F=ConvOclDirectFwd1x1:1,128,1,1,0,1,8,8,0
192-7-7-1x1-1776-7-7-64-0x0-1x1-1x1-0-NCHW-FP32-W=ConvAsmBwdWrW1x1:1,16,2,8,4,1,2,4,0,2
32-128-256-5x5-16-128-256-1-2x2-1x1-1x1-0-NCHW-FP32-B=ConvOclDirectFwd:16,16,16,32,1,2,8,2,1
64-55-55-3x3-16-55-55-1-1x1-1x1-1x1-0-NCHW-FP32-W=ConvAsmBwdWrW3x3:0,1,8,1,2,1
60-28-28-3x3-60-28-28-16-1x1-1x1-1x1-0-NCHW-FP16-B=ConvOclDirectFwd:16,16,32,32,2,2,4,4,2
224-56-56-1x1-128-56-56-512-0x0-1x1-1x1-0-NCHW-FP32-W=ConvAsmBwdWrW1x1:2,8,4,2,8,1,4,4,0,1
224-35-35-3x3-256-17-17-64-0x0-2x2-1x1-0-NCHW-FP32-F=ConvOclDirectFwd:8,32,32,32,4,1,8,1,2
192-14-14-1x1-1392-14-14-4-0x0-1x1-1x1-0-NCHW-FP32-B=ConvAsm1x1U:2,16,2,16,1,2,2,2;ConvOclDirectFwd1x1:1,64,1,1,0,2,16,4,0
2048-7-7-1x1-512-7-7-16-0x0-1x1-1x1-0-NCHW-FP32-W=ConvAsmBwdWrW1x1:1,16,4,4,8,1,1,4,0,1
192-35-35-3x3-192-71-71-64-0x0-2x2-1x1-0-NCHW-FP32-B=ConvOclDirectFwd:16,8,16,16,1,2,8,4,1
192-56-56-1x1-192-56-56-4-0x0-1x1-1x1-0-NCHW-FP16-F=ConvAsm1x1U:1,8,2,32,1,4,1,4;ConvOclDirectFwd1x1:1,128,1,1,0,2,8,4,0
128-27-27-3x3-128-27-27-8-1x1-1x1-1x1-0-NCHW-FP16-W=ConvAsmBwdWrW3x3:0,0,16,4,2,1
192-14-14-1x1-1680-14-14-32-0x0-1x1-1x1-0-NCHW-FP16-B=ConvAsm1x1U:1,16,2,16,1,2,2,2;ConvOclDirectFwd1x1:1,128,1,1,0,4,8,4,0
512-14-14-3x3-512-14-14-4-1x1-1x1-1x1-0-NCHW-FP16-W=ConvAsmBwdWrW3x3:0,1,8,4,2,1
32-35-35-1x1-192-35-35-64-0x0-1x1-1x1-0-NCHW-FP32-W=ConvAsmBwdWrW1x1:4,4,4,4,4,1,4,4,0,1
608-14-14-1x1-192-14-14-32-0x0-1x1-1x1-0-NCHW-FP32-F=ConvAsm1x1U:2,16,4,64,1,2,2,1;ConvActivAsm1x1U:3,16,3,16,4,2;ConvOclDirectFwd1x1:1,64,1,1,1,4,16,2048,0
256-14-14-3x3-256-28-28-1024-1x1-2x2-1x1-0-NCHW-FP16-B=ConvOclDirectFwd:32,32,32,32,1,1,4,4,2
512-28-28-3x3-256-28-28-128-1x1-1x1-1x1-0-NCHW-FP16-B=ConvOclDirectFwd:16,16,32,32,2,2,8,2,1
480-14-14-1x1-192-14-14-16-0x0-1x1-1x1-0-NCHW-FP16-F=ConvAsm1x1U:2,8,4,64,1,4,2,2;ConvOclDirectFwd1x1:1,128,1,1,0,2,8,4,0
64-56-56-1x1-128-28-28-1-0x0-2x2-1x1-0-NCHW-FP16-F=ConvAsm1x1U:1,8,2,64,1,4,4,4;ConvOclDirectFwd1x1:1,64,1,1,0,1,4,8,0
256-14-14-3x3-256-7-7-16-1x1-2x2-1x1-0-NCHW-FP32-F=ConvOclDirectFwd:8,8,8,8,1,1,8,4,2
128-14-14-1x1-1504-14-14-4-0x0-1x1-1x1-0-NCHW-FP32-W=ConvAsmBwdWrW1x1:1,16,2,8,4,1,2,4,0,0
768-14-14-1x1-128-14-14-256-0x0-1x1-1x1-0-NCHW-FP16-F=ConvAsm1x1U:2,8,4,64,1,4,1,4;ConvOclDirectFwd1x1:1,256,1,1,0,4,8,4,0
128-14-14-1x1-608-14-14-1024-0x0-1x1-1x1-0-NCHW-FP16-W=ConvAsmBwdWrW1x1:2,8,4,8,2,1,4,4,0,2
512-7-7-3x3-512-7-7-512-1x1-1x1-1x1-0-NCHW-FP16-W=ConvAsmBwdWrW3x3:0,1,8,4,4,1
2016-14-14-1x1-192-14-14-64-0x0-1x1-1x1-0-NCHW-FP32-F=ConvAsm1x1U:3,16,3,16,2,2,1,1;ConvOclDirectFwd1x1:1,64,1,1,1,1,16,2048,0
192-7-7-1x1-1824-7-7-16-0x0-1x1-1x1-0-NCHW-FP32-W=ConvAsmBwdWrW1x1:1,16,4,4,8,1,1,4,0,1
32-28-28-1x1-192-28-28-1-0x0-1x1-1x1-0-NCHW-FP16-B=ConvAsm1x1U:1,8,2,32,1,2,2,1;ConvOclDirectFwd1x1:1,64,1,1,0,1,4,4,0
832-14-14-1x1-128-14-14-16-0x0-1x1-1x1-0-NCHW-FP32-W=ConvAsmBwdWrW1x1:1,16,2,4,8,1,2,4,0,1
384-28-28-1x1-128-28-28-32-0x0-1x1-1x1-0-NCHW-FP16-W=ConvAsmBwdWrW1x1:2,8,4,1,8,1,2,4,0,0
2048-8-8-1x1-448-8-8-64-0x0-1x1-1x1-0-NCHW-FP16-F=ConvAsm1x1U:2,8,4,16,2,4,1,4;ConvOclDirectFwd1x1:1,64,1,1,0,4,16,8,0
128-28-28-1x1-256-55-55-2-0x0-2x2-1x1-0-NCHW-FP32-W=ConvAsmBwdWrW1x1:2,8,2,4,2,1,2,4
256-8-8-1x1-1536-8-8-128-0x0-1x1-1x1-0-NCHW-FP16-B=ConvAsm1x1U:1,16,2,32,1,2,1,8;ConvOclDirectFwd1x1:1,64,1,1,0,4,16,4,0
192-28-28-1x1-672-28-28-1-0x0-1x1-1x1-0-NCHW-FP16-B=ConvAsm1x1U:1,16,2,64,1,2,4,1;ConvOclDirectFwd1x1:1,128,1,1,0,2,4,4,0
192-14-14-1x1-1872-14-14-512-0x0-1x1-1x1-0-NCHW-FP32-W=ConvAsmBwdWrW1x1:2,8,4,8,4,1,2,4,0,1
512-32-32-1x1-1024-64-64-4-0x0-2x2-1x1-0-NCHW-FP32-W=ConvAsmBwdWrW1x1:2,8,4,4,8,1,1,4,0,1
232-14-14-1x1-232-14-14-2-0x0-1x1-1x1-0-NCHW-FP32-B=ConvAsm1x1U:1,8,1,32,1,2,4,1;ConvOclDirectFwd1x1:1,256,1,1,0,4,4,4,0
192-14-14-1x1-864-14-14-16-0x0-1x1-1x1-0-NCHW-FP32-B=ConvAsm1x1U:1,32,1,32,1,1,1,1;ConvOclDirectFwd1x1:1,64,1,1,0,2,16,4,0
192-14-14-1x1-768-14-14-64-0x0-1x1-1x1-0-NCHW-FP32-B=ConvAsm1x1U:1,32,1,16,2,1,1,1;ConvOclDirectFwd1x1:1,128,1,1,0,2,16,4,0
320-14-14-3x3-160-14-14-256-1x1-1x1-1x1-0-NCHW-FP16-B=ConvOclDirectFwd:8,8,16,16,2,2,8,2,1
192-14-14-1x1-432-14-14-512-0x0-1x1-1x1-0-NCHW-FP32-W=ConvAsmBwdWrW1x1:1,16,2,4,8,1,2,4,0,1
192-27-27-3x3-48-27-27-256-1x1-1x1-1x1-0-NCHW-FP32-W=ConvAsmBwdWrW3x3:0,1,8,4,3,4
640-14-14-1x1-1280-14-14-256-0x0-1x1-1x1-0-NCHW-FP16-B=ConvAsm1x1U:1,16,2,16,1,2,1,2;ConvOclDirectFwd1x1:1,64,1,1,0,2,16,4,0
128-7-7-1x1-672-7-7-128-0x0-1x1-1x1-0-NCHW-FP32-B=ConvAsm1x1U:1,16,1,64,2,2,1,2;ConvOclDirectFwd1x1:1,128,1,1,0,1,16,8,0
1024-14-14-1x1-256-14-14-512-0x0-1x1-1x1-0-NCHW-FP32-F=ConvAsm1x1U:4,8,7,32,1,2,1,8;ConvOclDirectFwd1x1:1,64,1,1,1,0,64,2048,0
128-14-14-1x1-640-14-14-128-0x0-1x1-1x1-0-NCHW-FP16-F=ConvAsm1x1U:2,8,4,64,1,4,1,4;ConvOclDirectFwd1x1:1,64,1,1,0,2,16,4,0
24-28-28-1x1-58-28-28-32-0x0-1x1-1x1-0-NCHW-FP16-F=ConvAsm1x1U:1,8,2,16,1,4,1,2;ConvOclDirectFwd1x1:1,128,1,1,0,2,16,4,0
384-56-56-1x1-192-56-56-128-0x0-1x1-1x1-0-NCHW-FP32-F=ConvAsm1x1U:3,16,5,64,1,2,1,4;ConvOclDirectFwd1x1:1,64,1,1,1,4,16,2048,0
192-27-27-3x3-48-27-27-256-1x1-1x1-1x1-0-NCHW-FP16-B=ConvOclDirectFwd:16,16,32,32,2,2,8,2,1
24-56-56-1x1-58-56-56-8-0x0-1x1-1x1-0-NCHW-FP16-F=ConvAsm1x1U:1,8,2,32,1,4,1,4;ConvOclDirectFwd1x1:1,256,1,1,0,2,8,4,0
128-40-175-3x3-128-40-175-16-1x1-1x1-1x1-0-NCHW-FP16-B=ConvOclDirectFwd:8,16,16,32,2,2,8,1,2
512-7-7-1x1-2048-7-7-8-0x0-1x1-1x1-0-NCHW-FP16-W=ConvAsmBwdWrW1x1:1,16,4,4,4,1,1,4,0,0
192-14-14-1x1-512-14-14-4-0x0-1x1-1x1-0-NCHW-FP32-W=ConvAsmBwdWrW1x1:1,16,2,4,4,1,2,4,0,1
16-54-54-1x1-64-54-54-256-0x0-1x1-1x1-0-NCHW-FP16-B=ConvAsm1x1U:1,16,2,64,1,2,1,4;ConvOclDirectFwd1x1:1,256,1,1,0,4,16,4,0
224-14-14-1x1-576-14-14-32-0x0-1x1-1x1-0-NCHW-FP32-W=ConvAsmBwdWrW1x1:2,8,4,8,4,1,2,4,0,2
512-28-28-3x3-512-14-14-256-1x1-2x2-1x1-0-NCHW-FP32-F_g32=ConvOclDirectFwd:8,16,16,16,2,1,8,1,2
54-55-55-1x1-24-55-55-128-0x0-1x1-1x1-0-NCHW-FP16-B=ConvAsm1x1U:1,8,2,64,1,2,1,1;ConvOclDirectFwd1x1:1,64,1,1,0,1,8,4,0
128-14-14-1x1-1344-14-14-32-0x0-1x1-1x1-0-NCHW-FP16-W=ConvAsmBwdWrW1x1:2,8,4,8,2,1,1,4,0,1
1344-7-7-1x1-128-7-7-1-0x0-1x1-1x1-0-NCHW-FP32-F=ConvAsm1x1U:1,8,1,32,1,4,4,1;ConvOclDirectFwd1x1:1,64,1,1,1,4,16,64,0
128-56-56-1x1-128-56-56-256-0x0-1x1-1x1-0-NCHW-FP32-W=ConvAsmBwdWrW1x1:4,4,4,2,8,1,4,2,0,1
58-56-56-1x1-24-56-56-1024-0x0-1x1-1x1-0-NCHW-FP32-B=ConvAsm1x1U:1,8,1,64,2,1,2,2;ConvOclDirectFwd1x1:1,128,1,1,0,1,16,4,0
480-14-14-1x1-192-14-14-256-0x0-1x1-1x1-0-NCHW-FP32-F=ConvAsm1x1U:2,16,4,64,1,2,1,1;ConvActivAsm1x1U:4,16,4,64,1,1;ConvOclDirectFwd1x1:1,64,1,1,1,1,16,2048,0
48-27-27-1x1-384-27-27-16-0x0-1x1-1x1-0-NCHW-FP32-W=ConvAsmBwdWrW1x1:2,8,4,4,4,1,4,4,0,1
256-14-14-1x1-128-28-28-32-0x0-2x2-1x1-0-NCHW-FP16-B=ConvAsm1x1U:2,8,4,64,1,4,2,8;ConvOclDirectFwd1x1:1,64,1,1,0,1,16,8,0
256-29-29-3x3-256-29-29-64-1x1-1x1-1x1-0-NCHW-FP16-W_g32=ConvOclBwdWrW2<4>:1,6,3,1,11;ConvOclBwdWrW2<16>:1,6,3,1,11;ConvOclBwdWrW2<2>:1,6,8,1,5;ConvOclBwdWrW2<1>:1,7,8,1,11;ConvAsmBwdWrW3x3:0,0,16,2,3,8;ConvOclBwdWrW2<8>:1,7,8,1,11
384-13-13-3x3-192-13-13-4096-1x1-1x1-1x1-0-NCHW-FP16-B=ConvOclDirectFwd:8,8,16,16,2,2,8,2,2
1248-7-7-1x1-192-7-7-1024-0x0-1x1-1x1-0-NCHW-FP16-F=ConvAsm1x1U:2,8,4,16,1,4,1,4;ConvOclDirectFwd1x1:1,128,1,1,0,1,8,4,0
256-28-28-3x3-256-14-14-32-1x1-2x2-1x1-0-NCHW-FP32-F=ConvOclDirectFwd:8,16,16,16,2,1,8,1,2
480-14-14-1x1-128-14-14-128-0x0-1x1-1x1-0-NCHW-FP32-B=ConvAsm1x1U:1,32,1,16,2,1,4,1;ConvOclDirectFwd1x1:1,64,1,1,0,2,16,4,0
60-14-14-3x3-60-28-28-32-1x1-2x2-1x1-0-NCHW-FP16-W=ConvAsmBwdWrW3x3:0,0,16,4,3,2
192-8-8-1x1-2048-8-8-8-0x0-1x1-1x1-0-NCHW-FP16-W=ConvAsmBwdWrW1x1:1,16,2,4,4,2,1,4,0,0
544-14-14-1x1-128-14-14-512-0x0-1x1-1x1-0-NCHW-FP16-B=ConvAsm1x1U:1,16,2,16,1,2,1,4;ConvOclDirectFwd1x1:1,256,1,1,0,4,16,4,0
128-7-7-1x1-768-7-7-1-0x0-1x1-1x1-0-NCHW-FP16-B=ConvAsm1x1U:1,8,2,32,1,4,4,1;ConvOclDirectFwd1x1:1,128,1,1,0,1,4,4,0
256-35-35-1x1-48-35-35-1-0x0-1x1-1x1-0-NCHW-FP32-F=ConvAsm1x1U:1,8,1,64,1,4,4,1;ConvActivAsm1x1U:1,16,1,32,1,4;ConvOclDirectFwd1x1:1,64,1,1,1,4,32,64,0
64-28-28-1x1-192-28-28-1024-0x0-1x1-1x1-0-NCHW-FP32-W=ConvAsmBwdWrW1x1:4,4,4,4,4,1,4,2,0,2
128-28-28-1x1-320-28-28-8-0x0-1x1-1x1-0-NCHW-FP32-W=ConvAsmBwdWrW1x1:2,8,2,4,4,2,2,4,0,0
128-29-29-3x3-128-57-57-32-1x1-2x2-1x1-0-NCHW-FP32-W=ConvAsmBwdWrW3x3:0,0,8,4,3,1
128-14-14-1x1-672-14-14-128-0x0-1x1-1x1-0-NCHW-FP32-B=ConvAsm1x1U:1,32,1,32,2,1,1,1;ConvOclDirectFwd1x1:1,256,1,1,0,4,16,4,0
128-14-14-1x1-1472-14-14-512-0x0-1x1-1x1-0-NCHW-FP16-B=ConvAsm1x1U:1,16,2,16,1,2,1,8;ConvOclDirectFwd1x1:8,64,16,16,0,2,16,4,1
192-14-14-1x1-768-14-14-2-0x0-1x1-1x1-0-NCHW-FP16-W=ConvAsmBwdWrW1x1:2,8,2,4,2,1,1,4,0,0
64-28-28-1x1-256-28-28-1-0x0-1x1-1x1-0-NCHW-FP16-W=ConvAsmBwdWrW1x1:4,4,2,1,2,1,1,4,0,1
128-7-7-1x1-672-7-7-256-0x0-1x1-1x1-0-NCHW-FP32-W=ConvAsmBwdWrW1x1:2,8,4,8,4,2,2,4,0,2
128-14-14-1x1-1152-14-14-4-0x0-1x1-1x1-0-NCHW-FP16-B=ConvAsm1x1U:1,16,2,16,1,2,2,2;ConvOclDirectFwd1x1:1,64,1,1,0,4,4,4,0
128-28-28-1x1-416-28-28-8-0x0-1x1-1x1-0-NCHW-FP16-W=ConvAsmBwdWrW1x1:4,4,4,4,4,1,2,4,0,0
4-2-2-3x3-3-1-1-512-0x0-2x2-1x1-0-NCHW-FP32-F=ConvOclDirectFwd:8,8,8,8,1,1,1,2,2
960-7-7-1x1-128-7-7-512-0x0-1x1-1x1-0-NCHW-FP16-W=ConvAsmBwdWrW1x1:2,8,4,8,4,2,2,2,0,2
3-224-224-3x3-64-111-111-16-0x0-2x2-1x1-0-NCHW-FP32-F=ConvOclDirectFwd:16,16,16,16,1,1,8,1,2
992-14-14-1x1-128-14-14-1-0x0-1x1-1x1-0-NCHW-FP32-F=ConvAsm1x1U:1,8,1,64,1,4,4,1;ConvOclDirectFwd1x1:1,64,1,1,1,1,16,64,0
128-14-14-1x1-832-14-14-8-0x0-1x1-1x1-0-NCHW-FP16-W=ConvAsmBwdWrW1x1:2,8,4,8,2,1,2,4,0,1
192-7-7-1x1-1968-7-7-32-0x0-1x1-1x1-0-NCHW-FP32-W=ConvAsmBwdWrW1x1:1,16,2,8,4,1,2,4,0,2
1056-7-7-1x1-192-7-7-1024-0x0-1x1-1x1-0-NCHW-FP16-F=ConvAsm1x1U:2,8,4,16,1,4,1,4;ConvOclDirectFwd1x1:1,128,1,1,0,1,8,4,0
528-28-28-1x1-192-28-28-4-0x0-1x1-1x1-0-NCHW-FP16-F=ConvAsm1x1U:2,8,4,16,1,4,2,2;ConvOclDirectFwd1x1:1,64,1,1,0,2,4,4,0
128-7-7-1x1-576-7-7-32-0x0-1x1-1x1-0-NCHW-FP32-F=ConvAsm1x1U:1,8,1,64,2,4,2,4;ConvOclDirectFwd1x1:1,64,1,1,1,1,16,2048,0
128-28-28-1x1-416-28-28-4-0x0-1x1-1x1-0-NCHW-FP32-W=ConvAsmBwdWrW1x1:2,8,4,4,4,2,2,4,0,1
384-8-8-3x1-384-8-8-2-1x0-1x1-1x1-0-NCHW-FP16-W=ConvOclBwdWrW2<1>:1,8,8,8,9;ConvOclBwdWrW2<2>:1,8,3,8,3
128-14-14-1x1-1632-14-14-64-0x0-1x1-1x1-0-NCHW-FP16-B=ConvAsm1x1U:1,16,2,16,1,2,1,8;ConvOclDirectFwd1x1:1,64,1,1,0,4,8,4,0
128-7-7-1x1-1312-7-7-32-0x0-1x1-1x1-0-NCHW-FP32-W=ConvAsmBwdWrW1x1:1,16,2,4,8,1,1,4,0,3
256-28-28-1x1-64-56-56-2-0x0-2x2-1x1-0-NCHW-FP16-W=ConvAsmBwdWrW1x1:2,8,2,2,2,1,2,4,0,1
192-28-28-1x1-528-28-28-2-0x0-1x1-1x1-0-NCHW-FP16-B=ConvAsm1x1U:2,8,4,32,1,2,2,4;ConvOclDirectFwd1x1:1,64,1,1,0,4,16,4,0
60-28-28-1x1-240-28-28-256-0x0-1x1-1x1-0-NCHW-FP32-F_g3=ConvOclDirectFwd:16,16,16,16,1,1,8,2,2
672-14-14-1x1-128-14-14-4-0x0-1x1-1x1-0-NCHW-FP32-F=ConvAsm1x1U:2,8,2,64,1,4,4,1;ConvOclDirectFwd1x1:1,64,1,1,1,1,16,128,0
128-7-7-1x1-768-7-7-64-0x0-1x1-1x1-0-NCHW-FP32-F=ConvAsm1x1U:2,16,2,32,2,2,1,4;ConvOclDirectFwd1x1:1,64,1,1,1,0,16,2048,0
128-7-7-1x1-736-7-7-256-0x0-1x1-1x1-0-NCHW-FP32-B=ConvAsm1x1U:1,16,1,64,2,2,1,2;ConvOclDirectFwd1x1:1,256,1,1,0,1,16,4,0
192-14-14-1x1-2064-14-14-8-0x0-1x1-1x1-0-NCHW-FP32-W=ConvAsmBwdWrW1x1:1,16,4,8,4,1,1,4,0,1
1296-14-14-1x1-192-14-14-1-0x0-1x1-1x1-0-NCHW-FP32-F=ConvAsm1x1U:1,8,1,64,1,4,4,1;ConvOclDirectFwd1x1:1,64,1,1,1,4,16,128,0
1024-7-7-3x3-1024-7-7-64-1x1-1x1-1x1-0-NCHW-FP32-W_g32=ConvOclBwdWrW2<4>:1,7,8,1,7;ConvOclBwdWrW2<16>:1,7,8,1,7;ConvOclBwdWrW2<2>:1,7,8,1,7;ConvOclBwdWrW2<1>:1,7,8,1,7;ConvAsmBwdWrW3x3:0,1,8,4,7,1;ConvOclBwdWrW2<8>:1,7,8,1,7
528-28-28-1x1-192-28-28-16-0x0-1x1-1x1-0-NCHW-FP16-F=ConvAsm1x1U:2,8,4,32,2,2,1,4;ConvOclDirectFwd1x1:1,256,1,1,0,2,16,4,0
128-7-7-1x1-928-7-7-16-0x0-1x1-1x1-0-NCHW-FP16-F=ConvAsm1x1U:2,8,4,16,1,4,2,4;ConvOclDirectFwd1x1:1,64,1,1,0,1,8,4,0
16-54-54-1x1-96-54-54-32-0x0-1x1-1x1-0-NCHW-FP16-B=ConvAsm1x1U:1,8,2,64,1,4,1,2;ConvOclDirectFwd1x1:1,64,1,1,0,4,8,4,0
128-14-14-5x5-32-14-14-16-2x2-1x1-1x1-0-NCHW-FP16-B=ConvOclDirectFwd:8,16,16,16,2,1,1,4,2
48-13-13-1x1-384-13-13-256-0x0-1x1-1x1-0-NCHW-FP32-W=ConvAsmBwdWrW1x1:2,8,4,8,2,1,4,4,0,1
144-14-14-1x1-512-14-14-128-0x0-1x1-1x1-0-NCHW-FP16-B=ConvAsm1x1U:1,16,2,16,1,2,1,8;ConvOclDirectFwd1x1:1,128,1,1,0,4,16,4,0
116-14-14-1x1-116-14-14-512-0x0-1x1-1x1-0-NCHW-FP32-F=ConvAsm1x1U:3,16,4,64,1,2,1,4;ConvOclDirectFwd1x1:1,256,1,1,0,4,8,4,0
48-7-7-1x1-832-7-7-256-0x0-1x1-1x1-0-NCHW-FP32-W=ConvAsmBwdWrW1x1:2,8,4,8,2,2,2,4,0,2
224-56-56-1x1-128-56-56-512-0x0-1x1-1x1-0-NCHW-FP32-B=ConvAsm1x1U:1,16,1,64,2,2,1,8;ConvOclDirectFwd1x1:1,128,1,1,0,4,16,4,0
128-7-7-1x1-672-7-7-64-0x0-1x1-1x1-0-NCHW-FP32-W=ConvAsmBwdWrW1x1:1,16,2,8,4,1,2,4,0,2
192-13-13-3x3-48-13-13-32-1x1-1x1-1x1-0-NCHW-FP32-W=ConvAsmBwdWrW3x3:0,0,16,2,13,4
1408-14-14-1x1-128-14-14-32-0x0-1x1-1x1-0-NCHW-FP16-F=ConvAsm1x1U:2,8,4,64,1,4,2,4;ConvOclDirectFwd1x1:1,64,1,1,0,4,4,4,0
800-14-14-1x1-128-14-14-256-0x0-1x1-1x1-0-NCHW-FP32-F=ConvAsm1x1U:4,16,4,64,1,2,1,4;ConvOclDirectFwd1x1:1,64,1,1,1,1,16,2048,0
1024-15-15-1x1-1024-15-15-4-0x0-1x1-1x1-0-NCHW-FP32-W=ConvAsmBwdWrW1x1:1,16,4,8,4,1,1,4,0,2
512-14-14-1x1-2048-14-14-256-0x0-1x1-1x1-0-NCHW-FP32-F=ConvAsm1x1U:4,8,4,64,1,4,2,4;ConvOclDirectFwd1x1:1,64,1,1,1,4,16,2048,0
800-7-7-1x1-128-7-7-256-0x0-1x1-1x1-0-NCHW-FP32-F=ConvAsm1x1U:4,16,4,16,1,2,1,4;ConvOclDirectFwd1x1:1,64,1,1,1,4,16,2048,0
192-35-35-3x3-224-35-35-32-1x1-1x1-1x1-0-NCHW-FP16-F=ConvOclDirectFwd:8,8,16,16,2,2,8,2,2;ConvOclDirectFwdFused:8,8,16,16,2,2,8,2,2
64-13-13-1x1-512-13-13-1-0x0-1x1-1x1-0-NCHW-FP16-B=ConvAsm1x1U:1,8,2,64,1,2,4,2;ConvOclDirectFwd1x1:1,256,1,1,0,1,4,4,0
128-14-14-1x1-576-14-14-256-0x0-1x1-1x1-0-NCHW-FP16-B=ConvAsm1x1U:1,16,2,16,1,2,1,2;ConvOclDirectFwd1x1:1,256,1,1,0,2,16,4,0
116-14-14-1x1-116-14-14-16-0x0-1x1-1x1-0-NCHW-FP32-B=ConvAsm1x1U:4,4,4,4,1,4,1,2;ConvOclDirectFwd1x1:1,128,1,1,0,2,16,4,0
32-28-28-3x3-128-28-28-256-1x1-1x1-1x1-0-NCHW-FP16-B=ConvOclDirectFwd:16,16,32,32,2,2,8,2,1
192-28-28-1x1-384-28-28-128-0x0-1x1-1x1-0-NCHW-FP32-B=ConvAsm1x1U:1,32,1,32,2,1,1,1;ConvOclDirectFwd1x1:1,64,1,1,0,4,16,4,0
512-28-28-1x1-1024-14-14-32-0x0-2x2-1x1-0-NCHW-FP32-F=ConvAsm1x1U:4,8,4,64,2,2,1,4;ConvOclDirectFwd1x1:1,64,1,1,1,0,32,2048,0
32-7-7-5x5-128-7-7-32-2x2-1x1-1x1-0-NCHW-FP16-F=ConvOclDirectFwd:8,8,8,8,1,1,4,4,2;ConvOclDirectFwdFused:8,8,8,8,1,1,4,4,1
32-54-54-1x1-128-54-54-512-0x0-1x1-1x1-0-NCHW-FP32-W=ConvAsmBwdWrW1x1:4,4,2,4,4,1,4,4,0,1
128-27-27-1x1-32-27-27-512-0x0-1x1-1x1-0-NCHW-FP16-F=ConvAsm1x1U:3,8,6,64,1,4,1,4;ConvOclDirectFwd1x1:1,256,1,1,0,1,8,4,0
144-14-14-1x1-512-14-14-512-0x0-1x1-1x1-0-NCHW-FP32-W=ConvAsmBwdWrW1x1:2,8,4,4,4,2,1,4,0,1
96-71-71-3x3-64-73-73-32-0x0-1x1-1x1-0-NCHW-FP16-B=ConvOclDirectFwd:8,8,16,16,2,2,8,2,2
1024-17-17-1x1-384-17-17-16-0x0-1x1-1x1-0-NCHW-FP32-B=ConvAsm1x1U:3,16,5,16,1,2,2,2;ConvOclDirectFwd1x1:1,64,1,1,0,1,16,8,0
32-14-14-3x3-128-14-14-16-1x1-1x1-1x1-0-NCHW-FP16-B=ConvOclDirectFwd:16,8,16,16,1,2,4,2,2
128-54-54-3x3-32-54-54-1024-1x1-1x1-1x1-0-NCHW-FP16-W=ConvAsmBwdWrW3x3:0,0,8,4,1,8
128-7-7-1x1-576-7-7-16-0x0-1x1-1x1-0-NCHW-FP16-F=ConvAsm1x1U:2,8,4,16,1,2,2,1;ConvOclDirectFwd1x1:1,64,1,1,0,1,8,4,0
128-7-7-1x1-1120-7-7-2-0x0-1x1-1x1-0-NCHW-FP16-W=ConvAsmBwdWrW1x1:1,16,2,4,2,1,1,4,0,0
192-8-8-1x1-1280-8-8-512-0x0-1x1-1x1-0-NCHW-FP16-W=ConvAsmBwdWrW1x1:2,8,4,8,2,2,1,4,0,1
1056-7-7-1x1-128-7-7-256-0x0-1x1-1x1-0-NCHW-FP32-F=ConvAsm1x1U:4,16,4,16,1,2,1,1;ConvOclDirectFwd1x1:1,64,1,1,1,0,16,2048,0
128-14-14-3x3-32-14-14-32-1x1-1x1-1x1-0-NCHW-FP32-W=ConvAsmBwdWrW3x3:0,0,8,2,4,3
1296-7-7-1x1-192-7-7-4-0x0-1x1-1x1-0-NCHW-FP16-F=ConvAsm1x1U:1,8,2,16,1,4,4,1;ConvOclDirectFwd1x1:1,64,1,1,0,1,4,8,0
160-14-14-1x1-512-14-14-4-0x0-1x1-1x1-0-NCHW-FP16-B=ConvAsm1x1U:1,16,2,16,1,2,4,1;ConvOclDirectFwd1x1:1,64,1,1,0,4,4,4,0
128-7-7-1x1-1696-7-7-512-0x0-1x1-1x1-0-NCHW-FP32-W=ConvAsmBwdWrW1x1:1,16,4,8,4,1,2,4,0,1
128-29-29-3x3-128-57-57-4-1x1-2x2-1x1-0-NCHW-FP32-B=ConvOclDirectFwd:16,16,32,32,2,2,4,4,2
192-35-35-3x3-192-71-71-4-0x0-2x2-1x1-0-NCHW-FP32-B=ConvOclDirectFwd:16,8,16,16,1,2,4,1,2
192-27-27-3x3-48-27-27-2-1x1-1x1-1x1-0-NCHW-FP32-W=ConvAsmBwdWrW3x3:0,1,8,4,2,2
32-56-56-3x3-128-56-56-4-1x1-1x1-1x1-0-NCHW-FP16-B=ConvOclDirectFwd:16,16,32,32,2,2,8,2,1
64-55-55-11x11-3-224-224-2048-2x2-4x4-1x1-0-NCHW-FP16-W=ConvOclBwdWrW2<4>:8,11,1,8,11;ConvOclBwdWrW2<1>:8,7,1,8,11;ConvOclBwdWrW2<16>:8,11,1,8,11;ConvOclBwdWrW2<8>:8,7,1,8,11;ConvOclBwdWrW2<2>:8,7,1,8,11
128-7-7-1x1-928-7-7-512-0x0-1x1-1x1-0-NCHW-FP32-W=ConvAsmBwdWrW1x1:1,16,2,8,4,1,4,4,0,2
48-27-27-1x1-384-27-27-128-0x0-1x1-1x1-0-NCHW-FP16-B=ConvAsm1x1U:1,16,2,16,1,2,1,2;ConvOclDirectFwd1x1:1,128,1,1,0,1,16,4,0
54-28-28-3x3-54-55-55-32-1x1-2x2-1x1-0-NCHW-FP32-B=ConvOclDirectFwd:32,16,32,32,1,2,8,2,2
128-17-17-1x1-768-17-17-64-0x0-1x1-1x1-0-NCHW-FP16-W=ConvAsmBwdWrW1x1:2,8,4,4,4,1,4,4,0,1
256-56-56-1x1-64-56-56-256-0x0-1x1-1x1-0-NCHW-FP16-W=ConvAsmBwdWrW1x1:4,4,8,2,4,2,2,4,0,1
416-28-28-1x1-128-28-28-256-0x0-1x1-1x1-0-NCHW-FP32-B=ConvAsm1x1U:1,16,1,32,2,2,1,4;ConvOclDirectFwd1x1:1,128,1,1,0,4,16,4,0
128-14-14-1x1-1152-14-14-128-0x0-1x1-1x1-0-NCHW-FP16-W=ConvAsmBwdWrW1x1:2,8,4,8,2,1,4,4,0,3
416-14-14-1x1-128-14-14-256-0x0-1x1-1x1-0-NCHW-FP16-F=ConvAsm1x1U:2,8,4,64,1,4,1,4;ConvOclDirectFwd1x1:1,256,1,1,0,4,8,4,0
864-14-14-1x1-192-14-14-16-0x0-1x1-1x1-0-NCHW-FP16-F=ConvAsm1x1U:2,8,4,64,1,4,2,2;ConvOclDirectFwd1x1:1,64,1,1,0,4,8,4,0
48-27-27-1x1-192-27-27-32-0x0-1x1-1x1-0-NCHW-FP16-W=ConvAsmBwdWrW1x1:4,4,8,4,2,1,4,2,0,1
64-80-350-3x3-64-80-350-2-1x1-1x1-1x1-0-NCHW-FP32-W=ConvAsmBwdWrW3x3:0,0,16,2,2,1
1000-13-13-1x1-512-13-13-512-0x0-1x1-1x1-0-NCHW-FP16-F=ConvAsm1x1U:3,8,6,16,1,4,1,4;ConvOclDirectFwd1x1:1,128,1,1,0,1,8,4,0
128-14-14-1x1-1472-14-14-16-0x0-1x1-1x1-0-NCHW-FP16-W=ConvAsmBwdWrW1x1:2,8,4,8,2,1,1,4,0,1
128-14-14-1x1-1568-14-14-256-0x0-1x1-1x1-0-NCHW-FP16-W=ConvAsmBwdWrW1x1:2,8,8,8,2,1,1,4,0,1
512-14-14-1x1-128-14-14-64-0x0-1x1-1x1-0-NCHW-FP16-W=ConvAsmBwdWrW1x1:4,4,8,4,4,1,2,2,0,1
64-54-54-1x1-16-54-54-8-0x0-1x1-1x1-0-NCHW-FP32-W=ConvAsmBwdWrW1x1:4,4,2,2,2,1,4,4,0,1
1280-8-8-1x1-384-8-8-32-0x0-1x1-1x1-0-NCHW-FP16-F=ConvAsm1x1U:2,8,4,16,1,4,2,2;ConvOclDirectFwd1x1:1,256,1,1,0,2,8,4,0
128-56-56-1x1-160-56-56-4-0x0-1x1-1x1-0-NCHW-FP16-B=ConvAsm1x1U:2,8,4,32,1,4,1,2;ConvOclDirectFwd1x1:1,64,1,1,0,4,16,4,0
1024-14-14-1x1-512-14-14-2-0x0-1x1-1x1-0-NCHW-FP16-F=ConvAsm1x1U:2,8,4,64,1,4,4,2;ConvOclDirectFwd1x1:1,128,1,1,0,4,4,4,0
96-54-54-1x1-16-54-54-128-0x0-1x1-1x1-0-NCHW-FP32-F=ConvAsm1x1U:2,16,2,64,2,1,1,1;ConvOclDirectFwd1x1:1,64,1,1,1,1,32,128,0
16-54-54-3x3-64-54-54-16-1x1-1x1-1x1-0-NCHW-FP32-B=ConvOclDirectFwd:16,16,32,32,2,2,8,1,2;ConvAsm3x3U:0,8,3
128-64-128-1x1-512-64-128-1-0x0-1x1-1x1-0-NCHW-FP32-W=ConvAsmBwdWrW1x1:4,4,8,2,4,1,1,4,0,1
96-56-56-1x1-192-56-56-2-0x0-1x1-1x1-0-NCHW-FP16-F=ConvAsm1x1U:1,8,2,32,1,4,1,4;ConvOclDirectFwd1x1:1,64,1,1,0,4,16,4,0
2048-8-8-1x1-320-8-8-256-0x0-1x1-1x1-0-NCHW-FP16-F=ConvAsm1x1U:1,8,2,32,4,4,1,4;ConvOclDirectFwd1x1:1,256,1,1,0,4,16,8,0
512-7-7-1x1-512-7-7-32-0x0-1x1-1x1-0-NCHW-FP32-B=ConvAsm1x1U:4,8,4,16,1,4,1,4;ConvOclDirectFwd1x1:1,128,1,1,0,1,8,4,0
128-7-7-1x1-512-7-7-512-0x0-1x1-1x1-0-NCHW-FP16-B=ConvAsm1x1U:2,16,4,16,1,2,1,2;ConvOclDirectFwd1x1:8,64,8,8,0,1,16,4,1
128-4-4-1x1-608-4-4-32-0x0-1x1-1x1-0-NCHW-FP32-W=ConvAsmBwdWrW1x1:1,16,2,8,2,1,2,4,0,0
160-28-28-1x1-128-28-28-32-0x0-1x1-1x1-0-NCHW-FP32-F=ConvAsm1x1U:1,8,1,16,2,4,1,4;ConvOclDirectFwd1x1:1,64,1,1,1,4,16,2048,0
384-13-13-3x3-256-13-13-128-1x1-1x1-1x1-0-NCHW-FP16-B=ConvOclDirectFwd:8,8,16,16,2,2,8,2,1
64-14-14-5x5-32-14-14-32-2x2-1x1-1x1-0-NCHW-FP16-B=ConvOclDirectFwd:8,8,16,16,2,2,2,4,2
192-14-14-1x1-432-14-14-8-0x0-1x1-1x1-0-NCHW-FP32-W=ConvAsmBwdWrW1x1:1,16,2,4,4,1,1,4,0,2
96-35-35-3x3-96-17-17-16-0x0-2x2-1x1-0-NCHW-FP32-F=ConvOclDirectFwd:32,8,32,32,1,4,4,1,2
1024-7-7-1x1-464-7-7-128-0x0-1x1-1x1-0-NCHW-FP32-B=ConvAsm1x1U:2,16,2,32,1,2,4,1;ConvOclDirectFwd1x1:1,256,1,1,0,1,16,8,0
128-7-7-1x1-1728-7-7-16-0x0-1x1-1x1-0-NCHW-FP32-B=ConvAsm1x1U:2,16,2,32,1,2,2,2;ConvOclDirectFwd1x1:1,256,1,1,0,1,8,4,0
64-56-56-1x1-256-56-56-4-0x0-1x1-1x1-0-NCHW-FP16-F=ConvAsm1x1U:1,8,2,16,1,4,2,2;ConvOclDirectFwd1x1:1,64,1,1,0,2,8,4,0
128-14-14-1x1-736-14-14-256-0x0-1x1-1x1-0-NCHW-FP16-B=ConvAsm1x1U:1,16,2,16,1,2,2,2;ConvOclDirectFwd1x1:1,256,1,1,0,2,16,4,0
256-14-14-3x3-256-28-28-256-1x1-2x2-1x1-0-NCHW-FP32-W=ConvAsmBwdWrW3x3:0,0,8,8,3,1
128-14-14-1x1-800-14-14-64-0x0-1x1-1x1-0-NCHW-FP16-B=ConvAsm1x1U:1,16,2,16,1,2,1,2;ConvOclDirectFwd1x1:1,64,1,1,0,4,8,4,0
768-28-28-1x1-384-28-28-32-0x0-1x1-1x1-0-NCHW-FP16-F=ConvAsm1x1U:2,8,4,16,2,4,1,8;ConvOclDirectFwd1x1:1,128,1,1,0,2,8,4,0
64-55-55-1x1-16-55-55-2-0x0-1x1-1x1-0-NCHW-FP16-B=ConvAsm1x1U:1,8,2,32,1,4,4,2;ConvOclDirectFwd1x1:1,256,1,1,0,1,4,8,0
64-13-13-1x1-256-13-13-4-0x0-1x1-1x1-0-NCHW-FP16-F=ConvAsm1x1U:1,8,2,16,1,4,4,2;ConvOclDirectFwd1x1:1,64,1,1,0,1,4,8,0
512-28-28-3x3-512-28-28-8-1x1-1x1-1x1-0-NCHW-FP16-B=ConvOclDirectFwd:16,16,32,32,2,2,8,2,1
864-14-14-1x1-128-14-14-1024-0x0-1x1-1x1-0-NCHW-FP16-F=ConvAsm1x1U:2,8,4,64,1,4,1,4;ConvOclDirectFwd1x1:1,256,1,1,0,2,8,4,0
192-14-14-1x1-480-14-14-1-0x0-1x1-1x1-0-NCHW-FP32-W=ConvAsmBwdWrW1x1:1,16,4,4,2,1,1,4,0,1
544-14-14-1x1-128-14-14-8-0x0-1x1-1x1-0-NCHW-FP32-F=ConvAsm1x1U:4,8,4,64,1,4,4,1;ConvOclDirectFwd1x1:1,64,1,1,1,4,16,128,0
320-28-28-1x1-128-28-28-64-0x0-1x1-1x1-0-NCHW-FP16-W=ConvAsmBwdWrW1x1:4,4,8,1,8,2,1,4,0,1
1056-14-14-1x1-2112-14-14-64-0x0-1x1-1x1-0-NCHW-FP32-W=ConvAsmBwdWrW1x1:1,16,4,8,4,1,2,4,0,1
96-14-14-1x1-608-14-14-32-0x0-1x1-1x1-0-NCHW-FP32-B=ConvAsm1x1U:1,16,1,32,2,2,1,4;ConvOclDirectFwd1x1:1,128,1,1,0,4,16,4,0
128-7-7-1x1-928-7-7-8-0x0-1x1-1x1-0-NCHW-FP32-B=ConvAsm1x1U:1,16,1,16,1,2,2,4;ConvOclDirectFwd1x1:1,128,1,1,0,1,4,4,0
128-56-56-1x1-96-56-56-16-0x0-1x1-1x1-0-NCHW-FP16-W=ConvAsmBwdWrW1x1:4,4,8,4,2,1,4,2,0,1
256-13-13-1x1-64-13-13-1024-0x0-1x1-1x1-0-NCHW-FP16-B=ConvAsm1x1U:2,16,4,16,1,2,1,4;ConvOclDirectFwd1x1:8,64,16,16,0,1,16,4,1
896-7-7-1x1-128-7-7-256-0x0-1x1-1x1-0-NCHW-FP32-F=ConvAsm1x1U:4,8,4,16,2,2,1,4;ConvOclDirectFwd1x1:1,64,1,1,1,4,16,2048,0
256-19-19-3x3-512-10-10-64-1x1-2x2-1x1-0-NCHW-FP32-F=ConvOclDirectFwd:8,16,16,16,2,1,8,1,2
16-55-55-1x1-128-55-55-256-0x0-1x1-1x1-0-NCHW-FP16-B=ConvAsm1x1U:1,16,2,64,1,2,1,2;ConvOclDirectFwd1x1:1,128,1,1,0,1,16,4,0
128-7-7-1x1-1088-7-7-512-0x0-1x1-1x1-0-NCHW-FP32-B=ConvAsm1x1U:1,16,1,64,2,2,1,2;ConvOclDirectFwd1x1:1,128,1,1,0,1,32,4,0
256-28-28-1x1-512-28-28-64-0x0-1x1-1x1-0-NCHW-FP32-W=ConvAsmBwdWrW1x1:2,8,4,4,8,1,2,4,0,1
32-54-54-1x1-128-54-54-32-0x0-1x1-1x1-0-NCHW-FP32-W=ConvAsmBwdWrW1x1:4,4,4,4,2,1,4,4,0,2
16-64-128-1x1-480-64-128-1-0x0-1x1-1x1-0-NCHW-FP16-B=ConvAsm1x1U:1,8,2,64,1,2,2,4;ConvOclDirectFwd1x1:1,256,1,1,0,2,4,8,0
192-14-14-1x1-528-14-14-512-0x0-1x1-1x1-0-NCHW-FP16-B=ConvAsm1x1U:1,16,2,16,1,2,2,2;ConvOclDirectFwd1x1:1,256,1,1,0,4,16,4,0
128-54-54-3x3-32-54-54-4-1x1-1x1-1x1-0-NCHW-FP16-B=ConvOclDirectFwd:16,16,16,32,1,2,4,4,2
64-14-14-1x1-480-14-14-8-0x0-1x1-1x1-0-NCHW-FP32-W=ConvAsmBwdWrW1x1:2,8,2,4,4,1,2,2,0,1
320-8-8-1x1-2048-8-8-1024-0x0-1x1-1x1-0-NCHW-FP16-W=ConvAsmBwdWrW1x1:2,8,4,8,2,2,1,4,0,0
1024-17-17-1x1-384-17-17-16-0x0-1x1-1x1-0-NCHW-FP32-W=ConvAsmBwdWrW1x1:2,8,4,4,8,1,2,4,0,1
16-55-55-1x1-64-55-55-16-0x0-1x1-1x1-0-NCHW-FP32-W=ConvAsmBwdWrW1x1:4,4,2,2,2,1,4,4,0,2
64-55-55-11x11-3-224-224-256-2x2-4x4-1x1-0-NCHW-FP16-W=ConvOclBwdWrW2<4>:3,8,1,3,11;ConvOclBwdWrW2<1>:8,7,1,8,11;ConvOclBwdWrW2<16>:8,11,1,8,11;ConvOclBwdWrW2<8>:8,9,1,8,11;ConvOclBwdWrW2<2>:8,7,1,8,11
192-14-14-1x1-2064-14-14-128-0x0-1x1-1x1-0-NCHW-FP16-B=ConvAsm1x1U:1,16,2,16,1,2,1,8;ConvOclDirectFwd1x1:1,256,1,1,0,2,8,4,0
128-7-7-1x1-544-7-7-8-0x0-1x1-1x1-0-NCHW-FP16-B=ConvAsm1x1U:1,8,2,32,1,2,4,1;ConvOclDirectFwd1x1:1,64,1,1,0,1,4,4,0
192-14-14-1x1-1104-14-14-512-0x0-1x1-1x1-0-NCHW-FP16-B=ConvAsm1x1U:1,16,2,16,1,2,1,4;ConvOclDirectFwd1x1:8,64,16,16,0,2,16,4,1
128-28-28-3x3-128-28-28-64-1x1-1x1-1x1-0-NCHW-FP16-F=ConvOclDirectFwd:16,16,32,32,2,2,8,2,1;ConvOclDirectFwdFused:16,16,32,32,2,2,8,1,1
192-13-13-3x3-384-13-13-256-1x1-1x1-1x1-0-NCHW-FP16-B=ConvOclDirectFwd:8,8,16,16,2,2,8,2,2
384-28-28-1x1-768-28-28-4-0x0-1x1-1x1-0-NCHW-FP16-B=ConvAsm1x1U:1,16,2,32,1,2,2,2;ConvOclDirectFwd1x1:1,64,1,1,0,2,8,4,0
1824-7-7-1x1-192-7-7-2-0x0-1x1-1x1-0-NCHW-FP16-F=ConvAsm1x1U:1,8,2,32,1,4,4,1;ConvOclDirectFwd1x1:1,64,1,1,0,1,4,8,0
128-28-28-3x3-128-28-28-4-1x1-1x1-1x1-0-NCHW-FP16-B=ConvOclDirectFwd:32,8,32,32,1,4,4,4,2
480-14-14-1x1-16-14-14-32-0x0-1x1-1x1-0-NCHW-FP16-F=ConvAsm1x1U:1,8,2,32,1,4,4,2;ConvOclDirectFwd1x1:1,256,1,1,0,1,4,8,0
192-14-14-1x1-864-14-14-8-0x0-1x1-1x1-0-NCHW-FP16-W=ConvAsmBwdWrW1x1:2,8,4,8,2,1,1,4,0,1
224-14-14-3x3-112-14-14-64-1x1-1x1-1x1-0-NCHW-FP16-B=ConvOclDirectFwd:8,16,16,16,2,1,8,1,2
192-14-14-1x1-912-14-14-1-0x0-1x1-1x1-0-NCHW-FP32-W=ConvAsmBwdWrW1x1:1,16,2,4,4,1,1,4,0,0
192-7-7-1x1-1344-7-7-4-0x0-1x1-1x1-0-NCHW-FP16-W=ConvAsmBwdWrW1x1:1,16,2,8,2,1,1,4,0,1
256-14-14-1x1-256-14-14-16-0x0-1x1-1x1-0-NCHW-FP16-F=ConvAsm1x1U:2,8,4,64,1,4,2,4;ConvOclDirectFwd1x1:1,256,1,1,0,4,4,4,0
3-32-32-1x1-3-32-32-256-0x0-1x1-1x1-0-NCHW-FP32-W=ConvAsmBwdWrW1x1:4,4,2,1,2,2,4,4,0,2
192-14-14-1x1-768-14-14-128-0x0-1x1-1x1-0-NCHW-FP32-W=ConvAsmBwdWrW1x1:1,16,2,4,8,1,4,4,0,3
64-55-55-3x3-16-55-55-64-1x1-1x1-1x1-0-NCHW-FP16-B=ConvOclDirectFwd:32,8,32,32,1,4,8,4,2
120-7-7-1x1-480-7-7-128-0x0-1x1-1x1-0-NCHW-FP16-F_g3=ConvOclDirectFwd:8,8,8,8,1,1,8,2,1
224-28-28-1x1-128-28-28-16-0x0-1x1-1x1-0-NCHW-FP32-B=ConvAsm1x1U:2,16,2,32,1,1,2,2;ConvOclDirectFwd1x1:1,64,1,1,0,2,16,4,0
192-14-14-1x1-1776-14-14-512-0x0-1x1-1x1-0-NCHW-FP16-B=ConvAsm1x1U:1,16,2,16,1,2,1,4;ConvOclDirectFwd1x1:1,64,1,1,0,4,16,4,0
128-14-14-1x1-320-14-14-32-0x0-1x1-1x1-0-NCHW-FP16-W=ConvAsmBwdWrW1x1:4,4,4,4,4,1,2,2,0,2
736-14-14-1x1-128-14-14-128-0x0-1x1-1x1-0-NCHW-FP32-F=ConvAsm1x1U:3,16,5,16,1,2,2,2;ConvOclDirectFwd1x1:1,64,1,1,1,0,16,2048,0
320-28-28-1x1-128-28-28-16-0x0-1x1-1x1-0-NCHW-FP16-F=ConvAsm1x1U:2,8,4,32,1,4,2,2;ConvOclDirectFwd1x1:1,64,1,1,0,2,8,4,0
32-14-14-3x3-128-14-14-1-1x1-1x1-1x1-0-NCHW-FP16-B=ConvOclDirectFwd:16,16,16,16,1,1,1,4,1
624-28-28-1x1-192-28-28-64-0x0-1x1-1x1-0-NCHW-FP32-F=ConvAsm1x1U:3,16,5,16,1,2,1,1;ConvOclDirectFwd1x1:1,64,1,1,1,4,16,2048,0
192-17-17-7x1-160-17-17-512-3x0-1x1-1x1-0-NCHW-FP32-W=ConvOclBwdWrW2<4>:1,6,3,8,7;ConvOclBwdWrW2<1>:1,9,8,3,9;ConvOclBwdWrW2<16>:1,9,8,3,9;ConvOclBwdWrW2<8>:1,6,8,3,7;ConvOclBwdWrW2<2>:1,6,3,8,7
128-55-55-1x1-16-55-55-8-0x0-1x1-1x1-0-NCHW-FP32-F=ConvAsm1x1U:2,8,2,64,1,4,2,2;ConvOclDirectFwd1x1:1,64,1,1,1,0,32,256,0
1824-7-7-1x1-192-7-7-8-0x0-1x1-1x1-0-NCHW-FP32-F=ConvAsm1x1U:1,8,1,64,1,4,4,1;ConvOclDirectFwd1x1:1,64,1,1,1,1,16,256,0
192-56-56-1x1-192-56-56-4-0x0-1x1-1x1-0-NCHW-FP32-B=ConvAsm1x1U:1,32,1,64,1,1,2,2;ConvOclDirectFwd1x1:1,64,1,1,0,2,16,4,0
1792-7-7-1x1-128-7-7-256-0x0-1x1-1x1-0-NCHW-FP32-F=ConvAsm1x1U:4,16,4,16,1,2,1,4;ConvOclDirectFwd1x1:1,64,1,1,1,4,64,2048,0
768-28-28-1x1-384-28-28-1-0x0-1x1-1x1-0-NCHW-FP32-F=ConvAsm1x1U:3,8,3,64,1,4,2,2;ConvOclDirectFwd1x1:1,64,1,1,1,0,16,256,0
128-7-7-1x1-832-7-7-64-0x0-1x1-1x1-0-NCHW-FP32-W=ConvAsmBwdWrW1x1:1,16,2,8,4,1,2,4,0,2
192-27-27-5x5-64-27-27-256-2x2-1x1-1x1-0-NCHW-FP16-W=ConvOclBwdWrW2<4>:1,7,1,8,7;ConvOclBwdWrW2<1>:1,11,3,3,7;ConvOclBwdWrW2<16>:1,7,1,8,7;ConvOclBwdWrW2<8>:1,9,1,8,7;ConvOclBwdWrW2<2>:1,7,1,3,9
192-7-7-1x1-2016-7-7-16-0x0-1x1-1x1-0-NCHW-FP16-B=ConvAsm1x1U:1,16,2,32,1,2,2,2;ConvOclDirectFwd1x1:1,128,1,1,0,1,8,4,0
128-7-7-1x1-1376-7-7-4-0x0-1x1-1x1-0-NCHW-FP32-B=ConvAsm1x1U:1,8,1,64,1,2,2,4;ConvOclDirectFwd1x1:1,256,1,1,0,1,4,4,0
128-7-7-1x1-1344-7-7-64-0x0-1x1-1x1-0-NCHW-FP32-W=ConvAsmBwdWrW1x1:1,16,2,8,4,1,4,4,0,2
512-15-15-1x1-1024-15-15-32-0x0-1x1-1x1-0-NCHW-FP32-F=ConvAsm1x1U:2,8,4,64,1,4,1,8;ConvOclDirectFwd1x1:1,64,1,1,1,0,16,2048,0
256-14-14-1x1-1024-14-14-16-0x0-1x1-1x1-0-NCHW-FP16-F=ConvAsm1x1U:2,8,4,64,1,4,1,8;ConvOclDirectFwd1x1:1,128,1,1,0,4,8,4,0
128-56-56-1x1-64-56-56-4-0x0-1x1-1x1-0-NCHW-FP32-B=ConvAsm1x1U:1,16,1,64,1,2,2,1;ConvOclDirectFwd1x1:1,64,1,1,0,2,8,8,0
1008-14-14-1x1-192-14-14-8-0x0-1x1-1x1-0-NCHW-FP32-F=ConvAsm1x1U:3,8,3,16,1,4,2,2;ConvOclDirectFwd1x1:1,64,1,1,1,1,16,256,0
256-27-27-1x1-64-27-27-4-0x0-1x1-1x1-0-NCHW-FP32-W=ConvAsmBwdWrW1x1:4,4,2,4,2,1,1,4,0,1
160-56-56-1x1-128-56-56-64-0x0-1x1-1x1-0-NCHW-FP32-W=ConvAsmBwdWrW1x1:4,4,4,2,8,1,2,4,0,1
128-28-28-1x1-352-28-28-1-0x0-1x1-1x1-0-NCHW-FP32-W=ConvAsmBwdWrW1x1:1,16,2,4,2,1,1,4,0,2
480-7-7-1x1-120-7-7-128-0x0-1x1-1x1-0-NCHW-FP16-B_g3=ConvOclDirectFwd:8,8,8,8,1,1,8,4,2
128-28-28-1x1-224-28-28-16-0x0-1x1-1x1-0-NCHW-FP32-F=ConvAsm1x1U:3,16,3,32,1,2,1,1;ConvOclDirectFwd1x1:1,64,1,1,1,0,16,256,0
120-7-7-3x3-120-14-14-2-1x1-2x2-1x1-0-NCHW-FP32-B=ConvOclDirectFwd:8,8,16,16,2,2,1,4,1
128-7-7-1x1-992-7-7-8-0x0-1x1-1x1-0-NCHW-FP32-B=ConvAsm1x1U:1,16,1,16,1,2,2,1;ConvOclDirectFwd1x1:1,128,1,1,0,1,8,4,0
384-28-28-1x1-128-28-28-128-0x0-1x1-1x1-0-NCHW-FP16-B=ConvAsm1x1U:1,16,2,16,1,2,1,4;ConvOclDirectFwd1x1:1,256,1,1,0,4,16,4,0
116-28-28-1x1-116-28-28-32-0x0-1x1-1x1-0-NCHW-FP16-B=ConvAsm1x1U:4,4,8,4,1,2,1,8;ConvOclDirectFwd1x1:1,256,1,1,0,2,8,4,0
32-28-28-5x5-16-28-28-128-2x2-1x1-1x1-0-NCHW-FP16-B=ConvOclDirectFwd:32,8,32,32,1,4,8,4,2
912-14-14-1x1-192-14-14-2-0x0-1x1-1x1-0-NCHW-FP16-F=ConvAsm1x1U:1,8,2,16,1,4,4,1;ConvOclDirectFwd1x1:1,256,1,1,0,4,4,4,0
64-35-35-1x1-288-35-35-2-0x0-1x1-1x1-0-NCHW-FP16-B=ConvAsm1x1U:1,8,2,32,1,4,2,2;ConvOclDirectFwd1x1:1,128,1,1,0,1,4,4,0
128-7-7-1x1-960-7-7-512-0x0-1x1-1x1-0-NCHW-FP16-B=ConvAsm1x1U:2,16,4,16,1,2,1,2;ConvOclDirectFwd1x1:1,128,1,1,0,1,8,4,0
96-35-35-3x3-96-35-35-16-1x1-1x1-1x1-0-NCHW-FP16-W=ConvAsmBwdWrW3x3:0,0,8,2,3,4
192-28-28-1x1-576-28-28-512-0x0-1x1-1x1-0-NCHW-FP16-W=ConvAsmBwdWrW1x1:2,8,8,4,4,1,2,2,0,3
1280-8-8-1x1-448-8-8-512-0x0-1x1-1x1-0-NCHW-FP32-F=ConvAsm1x1U:2,16,2,32,3,2,2,2;ConvOclDirectFwd1x1:1,64,1,1,1,4,64,2048,0
512-15-15-3x3-512-8-8-16-1x1-2x2-1x1-0-NCHW-FP32-F=ConvOclDirectFwd:8,8,8,8,1,1,8,2,1
128-7-7-1x1-1184-7-7-2-0x0-1x1-1x1-0-NCHW-FP16-W=ConvAsmBwdWrW1x1:1,16,2,4,2,1,1,4,0,0
192-7-7-1x1-1680-7-7-32-0x0-1x1-1x1-0-NCHW-FP16-B=ConvAsm1x1U:2,8,4,16,1,4,1,1;ConvOclDirectFwd1x1:1,64,1,1,0,1,8,4,0
512-7-7-3x3-256-14-14-128-1x1-2x2-1x1-0-NCHW-FP16-B=ConvOclDirectFwd:8,8,8,16,1,2,4,1,2
608-7-7-1x1-128-7-7-64-0x0-1x1-1x1-0-NCHW-FP32-W=ConvAsmBwdWrW1x1:1,16,2,8,2,1,2,4,0,2
192-56-56-1x1-288-56-56-256-0x0-1x1-1x1-0-NCHW-FP32-W=ConvAsmBwdWrW1x1:2,8,4,2,8,1,2,4,0,2
4-2-2-3x3-3-1-1-32-0x0-2x2-1x1-0-NCHW-FP32-F=ConvOclDirectFwd:8,8,8,8,1,1,1,2,2
128-14-14-1x1-1760-14-14-32-0x0-1x1-1x1-0-NCHW-FP16-W=ConvAsmBwdWrW1x1:2,8,8,8,2,1,1,4,0,1
192-7-7-1x1-2064-7-7-64-0x0-1x1-1x1-0-NCHW-FP32-B=ConvAsm1x1U:2,16,2,32,1,2,1,4;ConvOclDirectFwd1x1:1,128,1,1,0,1,16,8,0
64-28-28-3x3-96-28-28-32-1x1-1x1-1x1-0-NCHW-FP16-F=ConvOclDirectFwd:16,16,32,32,2,2,8,4,2
64-13-13-1x1-384-13-13-8-0x0-1x1-1x1-0-NCHW-FP16-W=ConvAsmBwdWrW1x1:4,4,2,4,2,1,1,2,0,2
48-27-27-1x1-192-27-27-16-0x0-1x1-1x1-0-NCHW-FP32-B=ConvAsm1x1U:1,16,1,64,1,2,2,1;ConvOclDirectFwd1x1:1,64,1,1,0,1,16,8,0
832-14-14-1x1-128-14-14-32-0x0-1x1-1x1-0-NCHW-FP16-W=ConvAsmBwdWrW1x1:2,8,4,8,2,1,2,4,0,1
512-29-29-1x1-1024-15-15-16-0x0-2x2-1x1-0-NCHW-FP32-F=ConvAsm1x1U:2,16,4,64,1,2,2,1;ConvOclDirectFwd1x1:1,64,1,1,1,4,32,2048,0
192-7-7-1x1-1248-7-7-512-0x0-1x1-1x1-0-NCHW-FP32-B=ConvAsm1x1U:1,16,1,64,2,1,1,1;ConvOclDirectFwd1x1:1,256,1,1,0,1,32,4,0
128-40-175-3x3-128-40-175-1-1x1-1x1-1x1-0-NCHW-FP16-F=ConvOclDirectFwd:8,32,16,32,2,1,8,4,1
192-128-256-1x1-96-128-256-1-0x0-1x1-1x1-0-NCHW-FP16-F=ConvOclDirectFwd1x1:1,64,1,1,0,4,16,8,0
448-28-28-1x1-128-28-28-8-0x0-1x1-1x1-0-NCHW-FP16-F=ConvAsm1x1U:2,8,4,16,1,4,2,4;ConvOclDirectFwd1x1:1,256,1,1,0,2,4,4,0
64-147-147-3x3-32-147-147-32-1x1-1x1-1x1-0-NCHW-FP16-B=ConvOclDirectFwd:16,16,32,32,2,2,8,2,1
384-35-35-1x1-64-35-35-32-0x0-1x1-1x1-0-NCHW-FP32-F=ConvAsm1x1U:3,16,5,64,1,2,1,1;ConvActivAsm1x1U:3,16,5,32,1,1;ConvOclDirectFwd1x1:1,64,1,1,1,0,16,2048,0
192-27-27-5x5-64-27-27-4-2x2-1x1-1x1-0-NCHW-FP16-W=ConvOclBwdWrW2<4>:1,7,1,8,7;ConvOclBwdWrW2<1>:1,9,3,3,7;ConvOclBwdWrW2<2>:1,11,3,3,7
1248-14-14-1x1-192-14-14-64-0x0-1x1-1x1-0-NCHW-FP16-F=ConvAsm1x1U:2,8,4,64,1,4,2,4;ConvOclDirectFwd1x1:1,128,1,1,0,4,8,4,0
192-14-14-1x1-1344-14-14-1024-0x0-1x1-1x1-0-NCHW-FP16-W=ConvAsmBwdWrW1x1:2,8,4,4,8,1,1,4,0,1
1056-14-14-1x1-2112-14-14-256-0x0-1x1-1x1-0-NCHW-FP32-W=ConvAsmBwdWrW1x1:1,16,4,8,4,1,2,4,0,1
2048-7-7-1x1-1024-14-14-32-0x0-2x2-1x1-0-NCHW-FP16-B=ConvAsm1x1U:2,16,4,16,1,2,4,1;ConvOclDirectFwd1x1:1,64,1,1,0,1,16,8,0
232-14-14-1x1-232-14-14-16-0x0-1x1-1x1-0-NCHW-FP16-F=ConvAsm1x1U:2,8,4,64,1,4,2,2;ConvOclDirectFwd1x1:1,64,1,1,0,4,16,4,0
128-28-28-1x1-192-28-28-512-0x0-1x1-1x1-0-NCHW-FP32-F=ConvAsm1x1U:1,8,1,32,3,4,1,8;ConvOclDirectFwd1x1:1,64,1,1,1,0,16,2048,0
128-14-14-1x1-1248-14-14-1-0x0-1x1-1x1-0-NCHW-FP16-B=ConvAsm1x1U:1,8,2,64,1,4,2,1;ConvOclDirectFwd1x1:1,64,1,1,0,4,4,4,0
192-14-14-1x1-1008-14-14-32-0x0-1x1-1x1-0-NCHW-FP32-B=ConvAsm1x1U:1,16,1,32,2,2,1,8;ConvOclDirectFwd1x1:1,128,1,1,0,4,16,4,0
32-147-147-3x3-64-147-147-256-1x1-1x1-1x1-0-NCHW-FP16-F=ConvOclDirectFwd:16,16,32,32,2,2,8,4,1;ConvOclDirectFwdFused:16,16,32,32,2,2,8,2,1
128-14-14-1x1-1056-14-14-32-0x0-1x1-1x1-0-NCHW-FP16-W=ConvAsmBwdWrW1x1:2,8,2,8,2,1,4,4,0,2
192-28-28-1x1-624-28-28-32-0x0-1x1-1x1-0-NCHW-FP16-W=ConvAsmBwdWrW1x1:2,8,8,8,2,1,2,4,0,1
128-28-28-3x3-128-56-56-512-1x1-2x2-1x1-0-NCHW-FP32-B=ConvOclDirectFwd:32,32,32,32,1,1,8,2,1
432-28-28-1x1-192-28-28-8-0x0-1x1-1x1-0-NCHW-FP16-F=ConvAsm1x1U:1,8,2,16,1,4,1,4;ConvOclDirectFwd1x1:1,64,1,1,0,2,8,4,0
576-14-14-1x1-192-14-14-2-0x0-1x1-1x1-0-NCHW-FP32-F=ConvAsm1x1U:1,8,1,32,1,4,4,1;ConvOclDirectFwd1x1:1,64,1,1,1,4,16,64,0
1536-8-8-1x1-256-8-8-64-0x0-1x1-1x1-0-NCHW-FP16-F=ConvAsm1x1U:2,8,4,16,1,4,2,8;ConvOclDirectFwd1x1:1,64,1,1,0,2,8,4,0
192-56-56-1x1-128-56-56-16-0x0-1x1-1x1-0-NCHW-FP32-F=ConvAsm1x1U:3,16,3,32,1,2,1,4;ConvOclDirectFwd1x1:1,64,1,1,1,4,16,2048,0
32-12-120-3x3-64-12-120-16-1x1-1x1-1x1-0-NCHW-FP16-F=ConvOclDirectFwd:8,16,16,32,2,2,8,4,2
48-13-13-1x1-192-13-13-32-0x0-1x1-1x1-0-NCHW-FP16-F=ConvAsm1x1U:1,8,2,32,1,4,1,4;ConvOclDirectFwd1x1:1,128,1,1,0,1,8,4,0
128-14-14-1x1-512-14-14-4-0x0-1x1-1x1-0-NCHW-FP16-B=ConvAsm1x1U:1,8,2,32,1,4,2,1;ConvOclDirectFwd1x1:1,64,1,1,0,4,4,4,0
128-7-7-1x1-832-7-7-16-0x0-1x1-1x1-0-NCHW-FP32-B=ConvAsm1x1U:1,8,1,64,1,4,1,4;ConvOclDirectFwd1x1:1,256,1,1,0,1,8,4,0
192-14-14-1x1-576-14-14-128-0x0-1x1-1x1-0-NCHW-FP16-W=ConvAsmBwdWrW1x1:2,8,8,8,2,1,2,4,0,1
192-28-28-1x1-288-28-28-2-0x0-1x1-1x1-0-NCHW-FP16-B=ConvAsm1x1U:1,8,2,32,1,4,2,4;ConvOclDirectFwd1x1:1,64,1,1,0,2,4,4,0
32-149-149-3x3-32-147-147-1-0x0-1x1-1x1-0-NCHW-FP16-F=ConvOclDirectFwd:16,16,16,32,1,2,8,2,1;ConvOclDirectFwdFused:16,16,16,32,1,2,8,4,1
32-27-27-1x1-128-27-27-8-0x0-1x1-1x1-0-NCHW-FP32-B=ConvAsm1x1U:1,16,1,64,1,1,2,1;ConvOclDirectFwd1x1:1,128,1,1,0,1,8,4,0
120-7-7-3x3-120-14-14-8-1x1-2x2-1x1-0-NCHW-FP16-W=ConvAsmBwdWrW3x3:0,0,8,4,3,1
832-7-7-1x1-256-7-7-512-0x0-1x1-1x1-0-NCHW-FP16-F=ConvAsm1x1U:2,16,4,16,1,2,1,4;ConvOclDirectFwd1x1:1,64,1,1,0,1,16,4,0
256-28-28-1x1-512-28-28-128-0x0-1x1-1x1-0-NCHW-FP16-F=ConvAsm1x1U:1,8,2,32,2,4,1,4;ConvOclDirectFwd1x1:1,64,1,1,0,4,16,4,0
128-28-28-1x1-160-28-28-16-0x0-1x1-1x1-0-NCHW-FP32-B=ConvAsm1x1U:1,32,1,16,2,1,1,1;ConvOclDirectFwd1x1:16,64,32,32,0,2,16,4,1
192-14-14-1x1-1104-14-14-128-0x0-1x1-1x1-0-NCHW-FP32-B=ConvAsm1x1U:1,16,1,32,2,1,1,4;ConvOclDirectFwd1x1:1,64,1,1,0,2,16,4,0
192-14-14-1x1-1968-14-14-4-0x0-1x1-1x1-0-NCHW-FP16-W=ConvAsmBwdWrW1x1:2,8,4,8,2,1,1,4,0,1
256-13-13-3x3-256-13-13-8-1x1-1x1-1x1-0-NCHW-FP16-B=ConvOclDirectFwd:16,8,16,16,1,2,4,2,2
128-28-28-1x1-512-28-28-1-0x0-1x1-1x1-0-NCHW-FP16-W=ConvAsmBwdWrW1x1:2,8,2,4,2,1,1,4,0,1
96-54-54-1x1-16-54-54-16-0x0-1x1-1x1-0-NCHW-FP32-B=ConvAsm1x1U:1,16,1,64,1,1,2,1;ConvOclDirectFwd1x1:1,256,1,1,0,4,8,8,0
128-54-54-1x1-32-54-54-512-0x0-1x1-1x1-0-NCHW-FP16-F=ConvAsm1x1U:1,8,2,64,1,4,1,4;ConvOclDirectFwd1x1:1,128,1,1,0,4,16,4,0
192-7-7-1x1-1968-7-7-64-0x0-1x1-1x1-0-NCHW-FP16-B=ConvAsm1x1U:2,16,4,16,1,2,2,2;ConvOclDirectFwd1x1:1,256,1,1,0,1,8,4,0
1000-13-13-1x1-512-13-13-8-0x0-1x1-1x1-0-NCHW-FP16-B=ConvAsm1x1U:2,16,4,16,1,2,4,1;ConvOclDirectFwd1x1:1,64,1,1,0,1,8,4,0
1760-14-14-1x1-128-14-14-1-0x0-1x1-1x1-0-NCHW-FP32-F=ConvAsm1x1U:1,8,1,64,1,4,4,1;ConvOclDirectFwd1x1:1,64,1,1,1,4,16,128,0
5-10-10-3x3-3-10-10-64-1x1-1x1-1x1-0-NCHW-FP16-F=ConvOclDirectFwd:16,16,16,16,1,1,1,4,2
288-14-14-1x1-128-14-14-512-0x0-1x1-1x1-0-NCHW-FP16-W=ConvAsmBwdWrW1x1:4,4,8,4,4,2,2,4,0,1
1536-14-14-1x1-128-14-14-64-0x0-1x1-1x1-0-NCHW-FP16-F=ConvAsm1x1U:2,8,4,64,1,4,2,4;ConvOclDirectFwd1x1:1,64,1,1,0,4,8,4,0
58-56-56-1x1-24-56-56-2-0x0-1x1-1x1-0-NCHW-FP32-W=ConvAsmBwdWrW1x1:4,4,2,2,2,1,2,4,0,2
256-35-35-1x1-64-35-35-256-0x0-1x1-1x1-0-NCHW-FP32-F=ConvAsm1x1U:2,16,2,64,2,2,1,4;ConvActivAsm1x1U:2,16,2,64,3,1;ConvOclDirectFwd1x1:1,64,1,1,1,0,16,2048,0
624-28-28-1x1-192-28-28-512-0x0-1x1-1x1-0-NCHW-FP16-F=ConvAsm1x1U:3,8,6,16,1,4,1,4;ConvOclDirectFwd1x1:1,64,1,1,0,4,16,4,0
2048-7-7-1x1-1024-14-14-4-0x0-2x2-1x1-0-NCHW-FP16-W=ConvAsmBwdWrW1x1:1,16,4,4,4,1,1,4,0,0
1776-14-14-1x1-192-14-14-8-0x0-1x1-1x1-0-NCHW-FP16-F=ConvAsm1x1U:2,8,4,64,1,4,4,1;ConvOclDirectFwd1x1:1,64,1,1,0,4,4,4,0
624-28-28-1x1-192-28-28-32-0x0-1x1-1x1-0-NCHW-FP16-F=ConvAsm1x1U:2,8,4,16,1,4,1,8;ConvOclDirectFwd1x1:1,256,1,1,0,2,8,4,0
192-8-8-1x1-1280-8-8-256-0x0-1x1-1x1-0-NCHW-FP16-B=ConvAsm1x1U:1,16,2,32,1,2,1,4;ConvOclDirectFwd1x1:1,64,1,1,0,4,16,4,0
64-14-14-5x5-32-14-14-16-2x2-1x1-1x1-0-NCHW-FP16-B=ConvOclDirectFwd:8,16,16,16,2,1,1,4,2
24-14-14-1x1-512-14-14-1-0x0-1x1-1x1-0-NCHW-FP32-B=ConvAsm1x1U:1,16,1,64,1,2,1,4;ConvOclDirectFwd1x1:1,64,1,1,0,4,4,8,0
1056-7-7-1x1-128-7-7-16-0x0-1x1-1x1-0-NCHW-FP16-F=ConvAsm1x1U:1,8,2,16,1,4,4,4;ConvOclDirectFwd1x1:1,64,1,1,0,1,4,4,0
128-57-57-3x3-128-29-29-1-1x1-2x2-1x1-0-NCHW-FP32-F=ConvOclDirectFwd:16,16,16,16,1,1,2,2,1
58-56-56-1x1-24-56-56-1-0x0-1x1-1x1-0-NCHW-FP32-B=ConvAsm1x1U:1,8,1,64,1,1,4,1;ConvOclDirectFwd1x1:1,256,1,1,0,1,4,4,0
912-14-14-1x1-192-14-14-256-0x0-1x1-1x1-0-NCHW-FP16-F=ConvAsm1x1U:4,8,8,16,1,2,1,4;ConvOclDirectFwd1x1:1,256,1,1,0,2,8,4,0
128-28-28-3x3-32-28-28-32-1x1-1x1-1x1-0-NCHW-FP16-F=ConvOclDirectFwd:16,16,32,32,2,2,4,4,2
128-28-28-1x1-448-28-28-2-0x0-1x1-1x1-0-NCHW-FP32-B=ConvAsm1x1U:1,16,1,64,1,2,2,2;ConvOclDirectFwd1x1:1,64,1,1,0,1,8,4,0
116-28-28-1x1-116-28-28-16-0x0-1x1-1x1-0-NCHW-FP32-W=ConvAsmBwdWrW1x1:2,8,2,8,2,2,4,4,0,2
64-35-35-1x1-192-35-35-32-0x0-1x1-1x1-0-NCHW-FP32-B=ConvAsm1x1U:1,16,1,64,2,2,1,4;ConvOclDirectFwd1x1:1,64,1,1,0,1,32,4,0
1392-7-7-1x1-192-7-7-4-0x0-1x1-1x1-0-NCHW-FP16-F=ConvAsm1x1U:1,8,2,16,1,4,4,1;ConvOclDirectFwd1x1:1,64,1,1,0,1,4,8,0
1024-8-8-3x3-1024-15-15-32-1x1-2x2-1x1-0-NCHW-FP16-W_g32=ConvOclBwdWrW2<4>:1,6,8,1,9;ConvOclBwdWrW2<16>:1,6,8,1,9;ConvOclBwdWrW2<2>:1,6,8,1,9;ConvOclBwdWrW2<1>:1,6,8,1,9;ConvAsmBwdWrW3x3:0,0,8,8,5,1;ConvOclBwdWrW2<8>:1,6,8,1,9
320-28-28-1x1-128-28-28-32-0x0-1x1-1x1-0-NCHW-FP32-F=ConvAsm1x1U:1,16,1,32,4,2,2,2;ConvActivAsm1x1U:1,16,1,16,4,3;ConvOclDirectFwd1x1:1,64,1,1,1,0,16,2048,0
64-13-13-1x1-384-13-13-2-0x0-1x1-1x1-0-NCHW-FP16-W=ConvAsmBwdWrW1x1:4,4,4,2,2,1,1,2,0,0
128-7-7-1x1-992-7-7-32-0x0-1x1-1x1-0-NCHW-FP16-W=ConvAsmBwdWrW1x1:4,4,4,4,4,1,1,2,0,1
672-14-14-1x1-192-14-14-4-0x0-1x1-1x1-0-NCHW-FP32-F=ConvAsm1x1U:4,8,4,64,1,4,4,1;ConvOclDirectFwd1x1:1,64,1,1,1,1,16,128,0
48-27-27-1x1-256-27-27-2-0x0-1x1-1x1-0-NCHW-FP32-W=ConvAsmBwdWrW1x1:4,4,2,2,2,2,1,4,0,1
1312-14-14-1x1-128-14-14-1-0x0-1x1-1x1-0-NCHW-FP16-F=ConvAsm1x1U:1,8,2,16,1,4,4,1;ConvOclDirectFwd1x1:1,64,1,1,0,4,4,4,0
64-73-73-1x1-80-73-73-1-0x0-1x1-1x1-0-NCHW-FP16-F=ConvAsm1x1U:1,8,2,64,1,4,2,2;ConvOclDirectFwd1x1:1,64,1,1,0,1,4,8,0
512-28-28-3x3-512-28-28-1-1x1-1x1-1x1-0-NCHW-FP16-F=ConvOclDirectFwd:32,8,32,16,1,2,4,4,1;ConvOclDirectFwdFused:16,16,32,32,2,2,2,4,1
256-27-27-1x1-64-27-27-1-0x0-1x1-1x1-0-NCHW-FP32-W=ConvAsmBwdWrW1x1:4,4,2,1,4,1,1,4,0,1
1200-7-7-1x1-192-7-7-8-0x0-1x1-1x1-0-NCHW-FP32-F=ConvAsm1x1U:1,8,1,64,1,4,4,1;ConvOclDirectFwd1x1:1,64,1,1,1,1,16,128,0
256-56-56-1x1-64-56-56-32-0x0-1x1-1x1-0-NCHW-FP32-W=ConvAsmBwdWrW1x1:2,8,4,4,4,1,4,4,0,1
16-14-14-1x1-480-14-14-4-0x0-1x1-1x1-0-NCHW-FP32-W=ConvAsmBwdWrW1x1:4,4,2,4,2,1,2,4,0,1
128-7-7-1x1-608-7-7-16-0x0-1x1-1x1-0-NCHW-FP32-W=ConvAsmBwdWrW1x1:1,16,2,8,2,1,2,4,0,2
512-7-7-1x1-2048-7-7-256-0x0-1x1-1x1-0-NCHW-FP16-B=ConvAsm1x1U:2,16,4,16,1,2,1,1;ConvOclDirectFwd1x1:1,256,1,1,0,1,16,4,0
480-7-7-1x1-120-7-7-16-0x0-1x1-1x1-0-NCHW-FP32-B_g3=ConvOclDirectFwd:8,8,8,8,1,1,4,4,2
128-28-28-1x1-224-28-28-256-0x0-1x1-1x1-0-NCHW-FP32-F=ConvAsm1x1U:2,16,2,16,2,2,2,2;ConvOclDirectFwd1x1:1,64,1,1,1,0,16,2048,0
832-7-7-1x1-160-7-7-512-0x0-1x1-1x1-0-NCHW-FP32-F=ConvAsm1x1U:2,16,4,16,1,2,1,1;ConvActivAsm1x1U:2,16,2,16,4,2;ConvOclDirectFwd1x1:1,64,1,1,1,4,64,2048,0
54-55-55-1x1-24-55-55-4-0x0-1x1-1x1-0-NCHW-FP32-W=ConvAsmBwdWrW1x1:4,4,2,2,2,1,4,4,0,3
320-7-7-3x3-160-7-7-512-1x1-1x1-1x1-0-NCHW-FP16-B=ConvOclDirectFwd:8,8,8,8,1,1,8,4,2
1632-14-14-1x1-192-14-14-64-0x0-1x1-1x1-0-NCHW-FP16-F=ConvAsm1x1U:2,8,4,64,1,4,1,8;ConvOclDirectFwd1x1:1,64,1,1,0,4,8,4,0
192-14-14-1x1-1488-14-14-2-0x0-1x1-1x1-0-NCHW-FP32-W=ConvAsmBwdWrW1x1:1,16,2,8,4,1,1,4,0,1
3-2-2-3x3-4-3-3-128-1x1-2x2-1x1-0-NCHW-FP32-B=ConvOclDirectFwd:8,8,8,8,1,1,2,2,2
704-14-14-1x1-128-14-14-16-0x0-1x1-1x1-0-NCHW-FP32-W=ConvAsmBwdWrW1x1:1,16,2,8,2,1,1,4,0,2
16-24-240-3x3-32-24-240-1024-1x1-1x1-1x1-0-NCHW-FP32-F=ConvOclDirectFwd:16,8,16,16,1,2,8,4,2;ConvAsm3x3U:0,8,1
128-7-7-1x1-1184-7-7-1-0x0-1x1-1x1-0-NCHW-FP32-W=ConvAsmBwdWrW1x1:1,16,2,4,2,1,2,4,0,1
256-7-7-1x1-832-7-7-16-0x0-1x1-1x1-0-NCHW-FP32-W=ConvAsmBwdWrW1x1:1,16,2,4,8,1,1,4,0,1
288-28-28-1x1-128-28-28-64-0x0-1x1-1x1-0-NCHW-FP32-F=ConvAsm1x1U:2,16,2,16,2,2,1,2;ConvOclDirectFwd1x1:1,64,1,1,1,0,16,2048,0
232-14-14-1x1-232-14-14-256-0x0-1x1-1x1-0-NCHW-FP32-B=ConvAsm1x1U:4,8,4,64,1,2,1,8;ConvOclDirectFwd1x1:1,256,1,1,0,2,8,8,0
16-14-14-1x1-480-14-14-256-0x0-1x1-1x1-0-NCHW-FP16-W=ConvAsmBwdWrW1x1:4,4,4,4,2,2,4,4,0,2
192-28-28-3x3-128-28-28-16-1x1-1x1-1x1-0-NCHW-FP32-W=ConvAsmBwdWrW3x3:0,0,8,2,4,1
128-14-14-1x1-1728-14-14-64-0x0-1x1-1x1-0-NCHW-FP16-B=ConvAsm1x1U:1,16,2,16,1,2,1,4;ConvOclDirectFwd1x1:1,64,1,1,0,4,8,4,0
2048-7-7-1x1-512-7-7-32-0x0-1x1-1x1-0-NCHW-FP32-F=ConvAsm1x1U:4,8,4,16,3,4,1,4;ConvActivAsm1x1U:2,16,4,16,2,2;ConvOclDirectFwd1x1:1,64,1,1,1,1,16,256,0
128-7-7-1x1-960-7-7-4-0x0-1x1-1x1-0-NCHW-FP32-B=ConvAsm1x1U:1,16,1,64,1,2,4,1;ConvOclDirectFwd1x1:1,256,1,1,0,1,4,8,0
512-9-41-5x5-256-20-84-128-1x1-2x2-1x1-0-NCHW-FP32-B=ConvOclDirectFwd:16,16,32,32,2,2,4,2,2
32-147-147-3x3-32-149-149-8-0x0-1x1-1x1-0-NCHW-FP16-B=ConvOclDirectFwd:16,16,32,32,2,2,8,2,2
864-14-14-1x1-192-14-14-2-0x0-1x1-1x1-0-NCHW-FP32-F=ConvAsm1x1U:1,8,1,32,1,4,4,1;ConvOclDirectFwd1x1:1,64,1,1,1,1,16,128,0
768-14-14-1x1-128-14-14-256-0x0-1x1-1x1-0-NCHW-FP32-W=ConvAsmBwdWrW1x1:2,8,8,8,2,1,2,4,0,1
256-57-57-1x1-128-57-57-4-0x0-1x1-1x1-0-NCHW-FP32-W=ConvAsmBwdWrW1x1:2,8,2,4,2,1,1,4,0,2
128-28-28-1x1-224-28-28-2-0x0-1x1-1x1-0-NCHW-FP32-B=ConvAsm1x1U:1,16,1,32,1,1,4,1;ConvOclDirectFwd1x1:1,256,1,1,0,2,4,4,0
32-27-27-1x1-256-27-27-2-0x0-1x1-1x1-0-NCHW-FP32-W=ConvAsmBwdWrW1x1:4,4,2,2,2,2,1,4,0,1
128-7-7-1x1-672-7-7-1-0x0-1x1-1x1-0-NCHW-FP16-B=ConvAsm1x1U:1,8,2,16,1,2,4,1;ConvOclDirectFwd1x1:1,256,1,1,0,1,4,4,0
128-112-112-3x3-128-112-112-128-1x1-1x1-1x1-0-NCHW-FP16-W=ConvAsmBwdWrW3x3:0,1,8,4,1,4
116-28-28-1x1-116-28-28-32-0x0-1x1-1x1-0-NCHW-FP32-F=ConvAsm1x1U:1,8,1,32,2,4,1,4;ConvOclDirectFwd1x1:1,64,1,1,0,4,8,4,0
288-28-28-1x1-128-28-28-16-0x0-1x1-1x1-0-NCHW-FP32-W=ConvAsmBwdWrW1x1:2,8,2,4,2,2,2,4,0,0
224-56-56-1x1-128-56-56-32-0x0-1x1-1x1-0-NCHW-FP32-B=ConvAsm1x1U:1,32,1,64,1,1,1,1;ConvOclDirectFwd1x1:1,64,1,1,0,4,16,4,0
608-7-7-1x1-128-7-7-256-0x0-1x1-1x1-0-NCHW-FP32-W=ConvAsmBwdWrW1x1:1,16,2,8,2,1,2,4,0,3
116-14-14-1x1-116-14-14-1024-0x0-1x1-1x1-0-NCHW-FP16-F=ConvAsm1x1U:1,8,2,16,2,4,1,8;ConvOclDirectFwd1x1:1,64,1,1,0,2,4,4,0
128-27-27-1x1-32-27-27-8-0x0-1x1-1x1-0-NCHW-FP16-B=ConvAsm1x1U:1,8,2,32,1,4,4,1;ConvOclDirectFwd1x1:1,128,1,1,0,1,4,8,0
128-14-14-1x1-1696-14-14-512-0x0-1x1-1x1-0-NCHW-FP16-W=ConvAsmBwdWrW1x1:2,8,4,8,4,2,1,4,0,1
128-54-54-3x3-32-54-54-1024-1x1-1x1-1x1-0-NCHW-FP16-B=ConvOclDirectFwd:32,8,32,32,1,4,8,2,1
1-161-700-5x20-32-79-341-16-0x0-2x2-1x1-0-NCHW-FP32-F=ConvOclDirectFwd:8,32,16,32,2,1,1,1,2
256-56-56-1x1-64-56-56-64-0x0-1x1-1x1-0-NCHW-FP32-W=ConvAsmBwdWrW1x1:2,8,4,4,4,1,4,4,0,3
16-14-14-5x5-48-14-14-128-2x2-1x1-1x1-0-NCHW-FP32-F=ConvOclDirectFwd:8,8,16,16,1,1,8,2,2;ConvOclDirectFwdFused:8,8,16,16,2,2,4,2,2
256-14-14-1x1-128-28-28-12-0x0-2x2-1x1-0-NCHW-FP32-W=ConvAsmBwdWrW1x1:4,4,4,2,4,1,1,4,0,1
512-29-29-1x1-128-29-29-8-0x0-1x1-1x1-0-NCHW-FP32-W=ConvAsmBwdWrW1x1:4,4,8,2,4,1,1,2,0,1
768-14-14-1x1-128-14-14-32-0x0-1x1-1x1-0-NCHW-FP32-F=ConvAsm1x1U:4,16,4,64,1,2,2,1;ConvOclDirectFwd1x1:1,64,1,1,1,0,16,2048,0
192-14-14-1x1-1680-14-14-512-0x0-1x1-1x1-0-NCHW-FP16-W=ConvAsmBwdWrW1x1:2,8,8,8,2,1,2,4,0,1
128-7-7-1x1-576-7-7-4-0x0-1x1-1x1-0-NCHW-FP16-B=ConvAsm1x1U:1,8,2,16,1,2,4,1;ConvOclDirectFwd1x1:1,64,1,1,0,1,4,4,0
48-27-27-1x1-256-27-27-512-0x0-1x1-1x1-0-NCHW-FP16-B=ConvAsm1x1U:1,16,2,16,1,2,1,4;ConvOclDirectFwd1x1:1,64,1,1,0,1,16,4,0
576-14-14-1x1-192-14-14-1-0x0-1x1-1x1-0-NCHW-FP32-F=ConvAsm1x1U:1,8,1,64,1,4,4,2;ConvOclDirectFwd1x1:1,64,1,1,1,0,16,64,0
512-7-7-1x1-2048-7-7-512-0x0-1x1-1x1-0-NCHW-FP32-F=ConvAsm1x1U:4,8,4,16,1,4,1,8;ConvOclDirectFwd1x1:1,64,1,1,1,0,16,2048,0
128-14-14-1x1-1504-14-14-2-0x0-1x1-1x1-0-NCHW-FP16-B=ConvAsm1x1U:2,8,4,64,1,4,2,2;ConvOclDirectFwd1x1:1,256,1,1,0,4,4,4,0
256-56-56-3x3-128-56-56-16-1x1-1x1-1x1-0-NCHW-FP16-F=ConvOclDirectFwd:16,16,32,32,2,2,8,2,1
128-7-7-1x1-1376-7-7-128-0x0-1x1-1x1-0-NCHW-FP16-B=ConvAsm1x1U:2,16,4,16,1,2,1,4;ConvOclDirectFwd1x1:1,128,1,1,0,1,8,4,0
512-7-7-1x1-256-14-14-32-0x0-2x2-1x1-0-NCHW-FP16-B=ConvAsm1x1U:2,8,4,16,1,4,4,4;ConvOclDirectFwd1x1:1,64,1,1,0,1,8,8,0
480-14-14-1x1-128-14-14-16-0x0-1x1-1x1-0-NCHW-FP16-F=ConvAsm1x1U:2,8,4,64,1,4,4,4;ConvOclDirectFwd1x1:1,64,1,1,0,4,4,4,0
16-54-54-1x1-96-54-54-2-0x0-1x1-1x1-0-NCHW-FP16-W=ConvAsmBwdWrW1x1:4,4,2,1,2,1,2,4,0,1
128-54-54-1x1-16-54-54-2-0x0-1x1-1x1-0-NCHW-FP32-F=ConvAsm1x1U:1,8,1,32,1,4,4,2;ConvOclDirectFwd1x1:1,64,1,1,1,4,16,2048,0
128-7-7-1x1-1824-7-7-1024-0x0-1x1-1x1-0-NCHW-FP16-W=ConvAsmBwdWrW1x1:1,16,4,8,4,1,2,2,0,1
64-27-27-1x1-256-27-27-4-0x0-1x1-1x1-0-NCHW-FP16-F=ConvAsm1x1U:1,8,2,32,1,4,2,4;ConvOclDirectFwd1x1:1,64,1,1,0,1,8,4,0
2048-7-7-1x1-512-7-7-32-0x0-1x1-1x1-0-NCHW-FP32-W=ConvAsmBwdWrW1x1:1,16,2,8,4,1,2,4,0,3
384-8-8-1x1-1280-8-8-8-0x0-1x1-1x1-0-NCHW-FP32-B=ConvAsm1x1U:1,8,1,64,1,4,1,4;ConvOclDirectFwd1x1:1,64,1,1,0,2,8,8,0
1344-14-14-1x1-192-14-14-16-0x0-1x1-1x1-0-NCHW-FP32-F=ConvAsm1x1U:2,16,4,64,1,2,4,1;ConvActivAsm1x1U:2,16,7,16,1,2;ConvOclDirectFwd1x1:1,64,1,1,1,1,16,2048,0
384-7-7-3x3-192-7-7-4-1x1-1x1-1x1-0-NCHW-FP16-W=ConvAsmBwdWrW3x3:0,0,8,4,4,1
128-14-14-1x1-1248-14-14-32-0x0-1x1-1x1-0-NCHW-FP32-B=ConvAsm1x1U:1,32,1,16,2,1,1,1;ConvOclDirectFwd1x1:1,64,1,1,0,2,16,4,0
256-14-14-1x1-1024-14-14-256-0x0-1x1-1x1-0-NCHW-FP16-W=ConvAsmBwdWrW1x1:2,8,4,8,2,1,4,4,0,2
64-73-73-1x1-80-73-73-256-0x0-1x1-1x1-0-NCHW-FP16-F=ConvAsm1x1U:1,16,2,64,2,2,1,1;ConvOclDirectFwd1x1:1,128,1,1,0,1,8,4,0
192-56-56-1x1-192-56-56-16-0x0-1x1-1x1-0-NCHW-FP16-W=ConvAsmBwdWrW1x1:4,4,8,1,8,2,1,4,0,1
96-17-17-3x3-96-35-35-1024-0x0-2x2-1x1-0-NCHW-FP16-B=ConvOclDirectFwd:16,16,16,16,1,1,4,1,1
256-28-28-1x1-128-28-28-16-0x0-1x1-1x1-0-NCHW-FP16-B=ConvAsm1x1U:1,16,2,32,1,2,4,1;ConvOclDirectFwd1x1:1,64,1,1,0,4,16,4,0
1488-14-14-1x1-192-14-14-16-0x0-1x1-1x1-0-NCHW-FP32-F=ConvAsm1x1U:4,8,4,64,1,4,2,2;ConvActivAsm1x1U:3,16,3,16,4,4;ConvOclDirectFwd1x1:1,64,1,1,1,4,16,128,0
1696-7-7-1x1-128-7-7-256-0x0-1x1-1x1-0-NCHW-FP16-F=ConvAsm1x1U:2,8,4,16,1,4,2,4;ConvOclDirectFwd1x1:1,128,1,1,0,1,8,4,0
576-28-28-1x1-192-28-28-8-0x0-1x1-1x1-0-NCHW-FP32-F=ConvAsm1x1U:3,16,5,32,1,2,2,1;ConvOclDirectFwd1x1:1,64,1,1,1,4,16,2048,0
64-80-349-5x5-1-161-700-256-1x1-2x2-1x1-0-NCHW-FP32-W=ConvOclBwdWrW2<4>:8,12,3,3,5;ConvOclBwdWrW2<1>:8,12,3,3,5;ConvOclBwdWrW2<16>:8,8,3,3,5;ConvOclBwdWrW2<8>:8,12,3,3,5;ConvOclBwdWrW2<2>:8,6,3,3,5
1216-14-14-1x1-128-14-14-2-0x0-1x1-1x1-0-NCHW-FP32-F=ConvAsm1x1U:1,8,1,32,1,4,4,1;ConvOclDirectFwd1x1:1,64,1,1,1,1,16,128,0
832-7-7-1x1-256-7-7-128-0x0-1x1-1x1-0-NCHW-FP16-F=ConvAsm1x1U:2,8,4,16,1,4,2,4;ConvOclDirectFwd1x1:1,64,1,1,0,1,8,4,0
256-14-14-1x1-1024-7-7-4-0x0-2x2-1x1-0-NCHW-FP32-F=ConvAsm1x1U:1,8,1,64,2,4,4,2;ConvOclDirectFwd1x1:1,64,1,1,1,4,16,64,0
192-14-14-1x1-1776-14-14-8-0x0-1x1-1x1-0-NCHW-FP16-W=ConvAsmBwdWrW1x1:1,16,8,8,2,1,1,4,0,1
192-14-14-3x3-192-14-14-32-1x1-1x1-1x1-0-NCHW-FP16-F=ConvOclDirectFwd:8,16,16,16,2,1,8,1,2
128-14-14-1x1-960-14-14-16-0x0-1x1-1x1-0-NCHW-FP32-W=ConvAsmBwdWrW1x1:2,8,4,8,4,1,2,4,0,1
448-28-28-1x1-128-28-28-64-0x0-1x1-1x1-0-NCHW-FP16-F=ConvAsm1x1U:3,8,6,16,1,4,1,4;ConvOclDirectFwd1x1:1,128,1,1,0,4,8,4,0
384-28-28-1x1-192-28-28-128-0x0-1x1-1x1-0-NCHW-FP16-F=ConvAsm1x1U:3,8,6,16,1,4,1,4;ConvOclDirectFwd1x1:1,256,1,1,0,2,8,4,0
1000-13-13-1x1-512-13-13-8-0x0-1x1-1x1-0-NCHW-FP32-W=ConvAsmBwdWrW1x1:1,16,8,4,4,1,1,2,0,1
832-7-7-1x1-384-7-7-128-0x0-1x1-1x1-0-NCHW-FP16-F=ConvAsm1x1U:2,16,4,16,1,2,1,2;ConvOclDirectFwd1x1:1,128,1,1,0,1,8,4,0
128-56-56-1x1-128-56-56-128-0x0-1x1-1x1-0-NCHW-FP32-W=ConvAsmBwdWrW1x1:4,4,4,2,8,2,4,4,0,1
2048-8-8-1x1-1024-8-8-128-0x0-1x1-1x1-0-NCHW-FP32-B=ConvAsm1x1U:1,32,2,16,1,1,2,2;ConvOclDirectFwd1x1:1,256,1,1,0,4,16,8,0
128-7-7-1x1-1856-7-7-2-0x0-1x1-1x1-0-NCHW-FP16-B=ConvAsm1x1U:1,8,2,32,1,2,4,2;ConvOclDirectFwd1x1:1,128,1,1,0,1,4,4,0
192-28-28-1x1-624-28-28-128-0x0-1x1-1x1-0-NCHW-FP16-W=ConvAsmBwdWrW1x1:2,8,8,4,4,1,2,4,0,1
16-28-28-1x1-192-28-28-512-0x0-1x1-1x1-0-NCHW-FP32-W=ConvAsmBwdWrW1x1:4,4,2,4,2,1,4,4,0,3
128-28-28-1x1-416-28-28-2-0x0-1x1-1x1-0-NCHW-FP16-W=ConvAsmBwdWrW1x1:4,4,4,2,8,1,2,4,0,0
128-14-14-1x1-576-14-14-1024-0x0-1x1-1x1-0-NCHW-FP16-W=ConvAsmBwdWrW1x1:2,8,4,8,2,1,2,4,0,1
128-54-54-3x3-32-54-54-512-1x1-1x1-1x1-0-NCHW-FP32-W=ConvAsmBwdWrW3x3:0,0,8,4,2,4
48-27-27-1x1-256-27-27-1-0x0-1x1-1x1-0-NCHW-FP16-W=ConvAsmBwdWrW1x1:4,4,4,2,2,1,1,2,0,1
288-14-14-1x1-128-14-14-128-0x0-1x1-1x1-0-NCHW-FP16-F=ConvAsm1x1U:2,8,4,64,1,4,1,8;ConvOclDirectFwd1x1:1,64,1,1,0,2,8,4,0
128-14-14-1x1-1216-14-14-512-0x0-1x1-1x1-0-NCHW-FP16-B=ConvAsm1x1U:1,16,2,16,1,2,1,2;ConvOclDirectFwd1x1:1,64,1,1,0,4,16,4,0
608-7-7-1x1-128-7-7-16-0x0-1x1-1x1-0-NCHW-FP16-B=ConvAsm1x1U:1,8,2,32,1,4,4,2;ConvOclDirectFwd1x1:1,256,1,1,0,1,4,8,0
208-14-14-3x3-96-14-14-1-1x1-1x1-1x1-0-NCHW-FP16-B=ConvOclDirectFwd:16,16,16,16,1,1,2,4,1
1024-4-4-1x1-2048-7-7-64-0x0-2x2-1x1-0-NCHW-FP32-W=ConvAsmBwdWrW1x1:1,16,4,4,4,1,1,4,0,0
320-7-7-3x3-160-7-7-8-1x1-1x1-1x1-0-NCHW-FP32-W=ConvAsmBwdWrW3x3:0,1,8,2,6,1
1088-7-7-1x1-128-7-7-32-0x0-1x1-1x1-0-NCHW-FP16-F=ConvAsm1x1U:1,8,2,32,1,4,4,2;ConvOclDirectFwd1x1:1,64,1,1,0,1,4,8,0
512-14-14-1x1-128-14-14-512-0x0-1x1-1x1-0-NCHW-FP16-F=ConvAsm1x1U:2,8,4,64,1,4,1,4;ConvOclDirectFwd1x1:1,64,1,1,0,4,16,4,0
1024-7-7-3x3-1024-7-7-6-1x1-1x1-1x1-0-NCHW-FP32-B_g32=ConvOclDirectFwd:8,8,8,8,1,1,4,1,2
192-28-28-1x1-32-28-28-32-0x0-1x1-1x1-0-NCHW-FP16-F=ConvAsm1x1U:1,8,2,32,1,4,2,2;ConvOclDirectFwd1x1:1,64,1,1,0,4,16,4,0
12-64-64-1x1-512-64-64-4-0x0-1x1-1x1-0-NCHW-FP32-W=ConvAsmBwdWrW1x1:4,4,2,2,2,1,1,4,0,2
1536-14-14-1x1-128-14-14-2-0x0-1x1-1x1-0-NCHW-FP16-F=ConvAsm1x1U:1,8,2,16,1,4,4,1;ConvOclDirectFwd1x1:1,128,1,1,0,4,4,4,0
24-14-14-1x1-512-14-14-4-0x0-1x1-1x1-0-NCHW-FP16-W=ConvAsmBwdWrW1x1:4,4,4,1,2,2,1,4,0,1
48-27-27-1x1-256-27-27-16-0x0-1x1-1x1-0-NCHW-FP16-B=ConvAsm1x1U:2,16,4,64,1,2,1,2;ConvOclDirectFwd1x1:1,256,1,1,0,1,4,4,0
2048-7-7-1x1-1024-14-14-64-0x0-2x2-1x1-0-NCHW-FP32-W=ConvAsmBwdWrW1x1:1,16,4,8,4,1,2,4,0,2
192-7-7-1x1-1344-7-7-2-0x0-1x1-1x1-0-NCHW-FP16-W=ConvAsmBwdWrW1x1:1,16,4,4,2,1,1,4,0,0
128-14-14-1x1-864-14-14-512-0x0-1x1-1x1-0-NCHW-FP32-F=ConvAsm1x1U:4,8,4,64,1,4,1,4;ConvOclDirectFwd1x1:1,64,1,1,1,1,64,256,0
128-14-14-1x1-992-14-14-512-0x0-1x1-1x1-0-NCHW-FP32-W=ConvAsmBwdWrW1x1:1,16,2,8,4,1,2,4,0,2
1024-14-14-1x1-512-14-14-512-0x0-1x1-1x1-0-NCHW-FP16-F=ConvAsm1x1U:2,8,4,64,1,4,1,8;ConvOclDirectFwd1x1:1,64,1,1,0,4,16,4,0
1664-14-14-1x1-128-14-14-16-0x0-1x1-1x1-0-NCHW-FP16-F=ConvAsm1x1U:2,8,4,64,1,4,4,4;ConvOclDirectFwd1x1:1,64,1,1,0,4,4,4,0
192-14-14-1x1-432-14-14-8-0x0-1x1-1x1-0-NCHW-FP32-B=ConvAsm1x1U:1,16,1,16,1,2,2,2;ConvOclDirectFwd1x1:1,64,1,1,0,4,8,4,0
128-7-7-1x1-1056-7-7-2-0x0-1x1-1x1-0-NCHW-FP16-W=ConvAsmBwdWrW1x1:2,8,2,4,2,2,1,4,0,1
64-112-112-7x7-3-225-225-512-2x2-2x2-1x1-0-NCHW-FP32-B=ConvOclDirectFwd:16,16,32,32,2,2,8,2,1
192-7-7-1x1-2160-7-7-1-0x0-1x1-1x1-0-NCHW-FP16-W=ConvAsmBwdWrW1x1:1,16,2,4,4,1,1,2,0,1
32-7-7-5x5-128-7-7-4-2x2-1x1-1x1-0-NCHW-FP32-F=ConvOclDirectFwd:8,8,8,8,1,1,1,4,2;ConvOclDirectFwdFused:8,8,8,8,1,1,1,4,2
512-28-28-3x3-512-28-28-32-1x1-1x1-1x1-0-NCHW-FP16-B=ConvOclDirectFwd:16,16,32,32,2,2,8,2,2
256-14-14-3x3-256-28-28-16-1x1-2x2-1x1-0-NCHW-FP32-W=ConvAsmBwdWrW3x3:0,0,8,8,5,1
3-230-230-7x7-64-112-112-16-0x0-2x2-1x1-0-NCHW-FP32-F=ConvOclDirectFwd:16,8,16,16,1,2,8,1,2;ConvOclDirectFwdFused:16,8,16,16,1,2,8,1,2
128-14-14-1x1-864-14-14-16-0x0-1x1-1x1-0-NCHW-FP16-B=ConvAsm1x1U:1,16,2,16,1,2,1,2;ConvOclDirectFwd1x1:1,64,1,1,0,4,8,4,0
24-55-55-1x1-54-55-55-32-0x0-1x1-1x1-0-NCHW-FP16-F=ConvAsm1x1U:1,8,2,64,1,4,1,2;ConvOclDirectFwd1x1:1,256,1,1,0,1,8,8,0
1920-14-14-1x1-192-14-14-256-0x0-1x1-1x1-0-NCHW-FP16-F=ConvAsm1x1U:2,8,8,16,1,4,1,4;ConvOclDirectFwd1x1:1,256,1,1,0,2,8,4,0
1728-7-7-1x1-128-7-7-2-0x0-1x1-1x1-0-NCHW-FP16-F=ConvAsm1x1U:1,8,2,16,1,4,4,1;ConvOclDirectFwd1x1:1,64,1,1,0,1,4,8,0
128-14-14-1x1-1024-14-14-256-0x0-1x1-1x1-0-NCHW-FP32-B=ConvAsm1x1U:1,32,1,32,2,1,1,1;ConvOclDirectFwd1x1:1,256,1,1,0,1,32,4,0
128-7-7-1x1-1856-7-7-256-0x0-1x1-1x1-0-NCHW-FP16-W=ConvAsmBwdWrW1x1:1,16,8,4,4,1,2,2,0,2
800-7-7-1x1-128-7-7-128-0x0-1x1-1x1-0-NCHW-FP16-F=ConvAsm1x1U:2,8,4,16,1,4,2,8;ConvOclDirectFwd1x1:1,64,1,1,0,1,8,4,0
800-7-7-1x1-128-7-7-16-0x0-1x1-1x1-0-NCHW-FP16-F=ConvAsm1x1U:1,8,2,32,1,4,4,1;ConvOclDirectFwd1x1:1,64,1,1,0,1,4,8,0
192-14-14-1x1-1248-14-14-512-0x0-1x1-1x1-0-NCHW-FP32-B=ConvAsm1x1U:2,32,2,16,1,1,1,1;ConvOclDirectFwd1x1:1,256,1,1,0,1,32,4,0
192-17-17-1x1-1024-17-17-16-0x0-1x1-1x1-0-NCHW-FP16-W=ConvAsmBwdWrW1x1:2,8,8,8,2,1,1,2,0,1
128-14-14-1x1-1696-14-14-64-0x0-1x1-1x1-0-NCHW-FP32-B=ConvAsm1x1U:1,32,1,32,2,1,1,1;ConvOclDirectFwd1x1:1,128,1,1,0,2,16,4,0
1312-14-14-1x1-128-14-14-16-0x0-1x1-1x1-0-NCHW-FP32-F=ConvAsm1x1U:4,8,4,64,1,4,2,2;ConvOclDirectFwd1x1:1,64,1,1,1,1,16,2048,0
32-7-7-1x1-832-7-7-256-0x0-1x1-1x1-0-NCHW-FP16-B=ConvAsm1x1U:1,16,2,32,1,2,1,2;ConvOclDirectFwd1x1:1,256,1,1,0,1,16,4,0
192-14-14-1x1-816-14-14-4-0x0-1x1-1x1-0-NCHW-FP16-B=ConvAsm1x1U:1,16,2,16,1,2,4,1;ConvOclDirectFwd1x1:1,64,1,1,0,4,8,4,0
128-28-28-3x3-96-28-28-256-1x1-1x1-1x1-0-NCHW-FP32-W=ConvAsmBwdWrW3x3:0,0,8,4,4,4
16-55-55-1x1-64-55-55-256-0x0-1x1-1x1-0-NCHW-FP32-B=ConvAsm1x1U:1,8,1,64,1,2,1,2;ConvOclDirectFwd1x1:1,256,1,1,0,1,32,4,0
960-14-14-1x1-128-14-14-2-0x0-1x1-1x1-0-NCHW-FP32-F=ConvAsm1x1U:1,8,1,32,1,4,4,2;ConvOclDirectFwd1x1:1,64,1,1,1,1,16,128,0
512-7-7-1x1-128-7-7-64-0x0-1x1-1x1-0-NCHW-FP32-W=ConvAsmBwdWrW1x1:4,4,4,4,4,1,2,4,0,0
128-14-14-1x1-736-14-14-64-0x0-1x1-1x1-0-NCHW-FP32-B=ConvAsm1x1U:1,16,1,64,2,2,1,1;ConvOclDirectFwd1x1:1,64,1,1,0,2,16,4,0
128-7-7-1x1-1664-7-7-256-0x0-1x1-1x1-0-NCHW-FP16-W=ConvAsmBwdWrW1x1:1,16,8,8,2,1,2,2,0,2
32-27-27-1x1-128-27-27-128-0x0-1x1-1x1-0-NCHW-FP32-W=ConvAsmBwdWrW1x1:4,4,4,4,2,1,4,4,0,2
128-17-17-1x1-1024-17-17-256-0x0-1x1-1x1-0-NCHW-FP32-F=ConvAsm1x1U:2,16,2,32,3,2,1,4;ConvOclDirectFwd1x1:1,64,1,1,1,1,64,2048,0
288-14-14-1x1-128-14-14-128-0x0-1x1-1x1-0-NCHW-FP16-W=ConvAsmBwdWrW1x1:4,4,8,1,8,2,1,4,0,1
128-56-56-3x3-32-56-56-32-1x1-1x1-1x1-0-NCHW-FP16-F=ConvOclDirectFwd:16,16,32,32,2,2,8,1,2
672-7-7-1x1-128-7-7-32-0x0-1x1-1x1-0-NCHW-FP16-F=ConvAsm1x1U:1,8,2,32,1,4,4,2;ConvOclDirectFwd1x1:1,64,1,1,0,1,4,8,0
128-28-28-1x1-480-28-28-128-0x0-1x1-1x1-0-NCHW-FP16-B=ConvAsm1x1U:1,16,2,16,1,2,1,8;ConvOclDirectFwd1x1:1,256,1,1,0,4,16,4,0
16-54-54-3x3-64-54-54-256-1x1-1x1-1x1-0-NCHW-FP16-W=ConvAsmBwdWrW3x3:0,1,8,2,2,8
512-28-28-1x1-256-28-28-1-0x0-1x1-1x1-0-NCHW-FP32-F=ConvAsm1x1U:2,8,2,64,1,4,2,2;ConvOclDirectFwd1x1:1,64,1,1,1,4,16,128,0
32-27-27-1x1-128-27-27-512-0x0-1x1-1x1-0-NCHW-FP32-F=ConvAsm1x1U:2,16,2,64,3,2,1,1;ConvOclDirectFwd1x1:1,64,1,1,1,1,32,256,0
128-39-174-5x5-64-80-350-16-1x1-2x2-1x1-0-NCHW-FP32-W=ConvOclBwdWrW2<4>:8,7,1,3,5;ConvOclBwdWrW2<1>:8,7,1,3,5;ConvOclBwdWrW2<16>:3,10,3,3,5;ConvOclBwdWrW2<8>:8,7,1,3,5;ConvOclBwdWrW2<2>:8,7,1,3,5
256-14-14-3x3-128-7-7-12-1x1-2x2-1x1-0-NCHW-FP32-F=ConvOclDirectFwd:8,8,8,8,1,1,2,2,2
1056-14-14-1x1-192-14-14-512-0x0-1x1-1x1-0-NCHW-FP32-F=ConvAsm1x1U:3,8,7,32,1,2,1,4;ConvOclDirectFwd1x1:1,64,1,1,1,0,16,2048,0
1024-14-14-1x1-512-14-14-128-0x0-1x1-1x1-0-NCHW-FP32-F=ConvAsm1x1U:4,16,4,64,1,2,1,8;ConvActivAsm1x1U:4,16,7,32,1,2;ConvOclDirectFwd1x1:1,64,1,1,1,1,64,2048,0
288-28-28-1x1-128-28-28-1-0x0-1x1-1x1-0-NCHW-FP16-F=ConvAsm1x1U:1,8,2,32,1,4,4,1;ConvOclDirectFwd1x1:1,256,1,1,0,1,4,4,0
192-7-7-1x1-1056-7-7-128-0x0-1x1-1x1-0-NCHW-FP32-W=ConvAsmBwdWrW1x1:1,16,2,8,8,1,2,4,0,1
192-56-56-1x1-288-56-56-512-0x0-1x1-1x1-0-NCHW-FP32-B=ConvAsm1x1U:1,16,1,64,2,2,1,2;ConvOclDirectFwd1x1:1,64,1,1,0,1,32,4,0
192-28-28-1x1-64-28-28-8-0x0-1x1-1x1-0-NCHW-FP32-F=ConvAsm1x1U:2,8,2,32,1,4,1,2;ConvActivAsm1x1U:1,16,1,64,2,3;ConvOclDirectFwd1x1:1,64,1,1,1,0,16,64,0
60-28-28-3x3-60-14-14-32-1x1-2x2-1x1-0-NCHW-FP32-F=ConvOclDirectFwd:16,16,16,16,1,1,8,2,2
480-14-14-1x1-96-14-14-128-0x0-1x1-1x1-0-NCHW-FP32-F=ConvAsm1x1U:4,16,4,64,1,2,1,2;ConvActivAsm1x1U:2,16,2,64,2,1;ConvOclDirectFwd1x1:1,64,1,1,1,0,16,2048,0
128-7-7-1x1-1760-7-7-64-0x0-1x1-1x1-0-NCHW-FP32-W=ConvAsmBwdWrW1x1:1,16,4,4,8,1,2,4,0,1
128-7-7-5x5-832-7-7-1-2x2-1x1-1x1-0-NCHW-FP32-B=ConvOclDirectFwd:8,8,8,8,1,1,2,4,1
256-30-30-3x3-256-14-14-128-0x0-2x2-1x1-0-NCHW-FP32-F=ConvOclDirectFwd:16,8,16,16,1,2,8,1,2
16-55-55-1x1-128-55-55-2-0x0-1x1-1x1-0-NCHW-FP32-W=ConvAsmBwdWrW1x1:4,4,2,1,4,1,2,4,0,2
128-7-7-1x1-1568-7-7-32-0x0-1x1-1x1-0-NCHW-FP32-B=ConvAsm1x1U:2,16,2,32,1,2,2,2;ConvOclDirectFwd1x1:8,64,8,8,0,1,16,4,1
128-28-28-1x1-64-56-56-8-0x0-2x2-1x1-0-NCHW-FP16-B=ConvAsm1x1U:1,8,2,32,1,2,4,2;ConvOclDirectFwd1x1:1,64,1,1,0,1,8,4,0
128-54-54-1x1-16-54-54-128-0x0-1x1-1x1-0-NCHW-FP16-B=ConvAsm1x1U:2,16,4,64,1,2,1,1;ConvOclDirectFwd1x1:1,256,1,1,0,4,16,4,0
64-35-35-5x5-48-35-35-2-2x2-1x1-1x1-0-NCHW-FP32-W=ConvOclBwdWrW2<1>:1,7,3,3,7;ConvOclBwdWrW2<2>:1,9,1,3,5
1024-14-14-1x1-512-14-14-512-0x0-1x1-1x1-0-NCHW-FP32-W=ConvAsmBwdWrW1x1:1,16,2,8,8,1,1,4,0,1
128-56-56-1x1-160-56-56-1-0x0-1x1-1x1-0-NCHW-FP16-B=ConvAsm1x1U:1,8,2,64,1,4,2,2;ConvOclDirectFwd1x1:1,256,1,1,0,2,4,4,0
128-14-14-1x1-1632-14-14-512-0x0-1x1-1x1-0-NCHW-FP16-B=ConvAsm1x1U:1,16,2,16,1,2,1,8;ConvOclDirectFwd1x1:8,64,16,16,0,2,16,4,1
128-14-14-1x1-256-14-14-512-0x0-1x1-1x1-0-NCHW-FP32-F=ConvAsm1x1U:4,16,4,64,1,2,1,4;ConvOclDirectFwd1x1:1,64,1,1,1,0,16,256,0
128-14-14-1x1-1088-14-14-32-0x0-1x1-1x1-0-NCHW-FP32-W=ConvAsmBwdWrW1x1:1,16,2,8,4,1,1,4,0,2
384-35-35-1x1-192-35-35-64-0x0-1x1-1x1-0-NCHW-FP16-F=ConvAsm1x1U:3,16,6,16,1,2,1,4;ConvOclDirectFwd1x1:1,64,1,1,0,1,16,4,0
1024-7-7-3x3-1024-7-7-6-1x1-1x1-1x1-0-NCHW-FP32-F_g32=ConvOclDirectFwd:8,8,8,8,1,1,4,2,2
192-28-28-1x1-192-28-28-128-0x0-1x1-1x1-0-NCHW-FP32-W=ConvAsmBwdWrW1x1:2,8,4,4,4,2,2,4,0,2
256-27-27-1x1-32-27-27-128-0x0-1x1-1x1-0-NCHW-FP32-F=ConvAsm1x1U:3,16,3,64,2,2,2,2;ConvOclDirectFwd1x1:1,64,1,1,1,1,16,2048,0
120-14-14-1x1-480-14-14-256-0x0-1x1-1x1-0-NCHW-FP32-F_g3=ConvOclDirectFwd:16,8,16,8,1,1,8,2,2
60-28-28-3x3-60-28-28-1024-1x1-1x1-1x1-0-NCHW-FP32-W=ConvAsmBwdWrW3x3:0,1,16,4,11,4
128-14-14-1x1-576-14-14-128-0x0-1x1-1x1-0-NCHW-FP32-F=ConvAsm1x1U:1,16,1,32,3,2,2,4;ConvOclDirectFwd1x1:1,64,1,1,1,0,16,2048,0
48-14-14-5x5-16-14-14-32-2x2-1x1-1x1-0-NCHW-FP32-B=ConvOclDirectFwd:16,16,16,16,4,1,1,4,2
128-14-14-1x1-1312-14-14-32-0x0-1x1-1x1-0-NCHW-FP32-B=ConvAsm1x1U:1,32,1,32,2,1,1,1;ConvOclDirectFwd1x1:1,128,1,1,0,4,16,4,0
120-7-7-3x3-120-14-14-8-1x1-2x2-1x1-0-NCHW-FP32-B=ConvOclDirectFwd:8,16,16,16,2,1,1,4,1
800-7-7-1x1-128-7-7-512-0x0-1x1-1x1-0-NCHW-FP16-F=ConvAsm1x1U:2,8,4,16,1,4,1,2;ConvOclDirectFwd1x1:1,64,1,1,0,1,8,4,0
64-147-147-3x3-32-147-147-4-1x1-1x1-1x1-0-NCHW-FP32-W=ConvAsmBwdWrW3x3:0,0,16,2,2,2
128-56-56-1x1-160-56-56-2-0x0-1x1-1x1-0-NCHW-FP32-B=ConvAsm1x1U:1,16,1,32,1,2,2,2;ConvOclDirectFwd1x1:16,64,32,32,0,2,16,4,1
1024-14-14-1x1-512-14-14-128-0x0-1x1-1x1-0-NCHW-FP16-W=ConvAsmBwdWrW1x1:2,8,8,4,4,1,1,4,0,1
128-28-28-1x1-192-28-28-4-0x0-1x1-1x1-0-NCHW-FP16-W=ConvAsmBwdWrW1x1:2,8,2,8,2,1,4,2,0,1
384-13-13-3x3-192-13-13-2048-1x1-1x1-1x1-0-NCHW-FP32-W=ConvAsmBwdWrW3x3:0,1,16,4,5,1
64-147-147-3x3-32-147-147-128-1x1-1x1-1x1-0-NCHW-FP16-B=ConvOclDirectFwd:16,16,32,32,2,2,8,4,2
128-14-14-5x5-32-14-14-512-2x2-1x1-1x1-0-NCHW-FP16-B=ConvOclDirectFwd:8,8,16,16,2,2,8,2,1
336-56-56-1x1-192-56-56-16-0x0-1x1-1x1-0-NCHW-FP16-F=ConvAsm1x1U:1,8,2,64,2,4,1,4;ConvOclDirectFwd1x1:1,64,1,1,0,4,16,4,0
128-7-7-1x1-544-7-7-512-0x0-1x1-1x1-0-NCHW-FP32-W=ConvAsmBwdWrW1x1:2,8,4,8,4,2,2,4,0,1
16-54-54-3x3-64-54-54-512-1x1-1x1-1x1-0-NCHW-FP32-B=ConvOclDirectFwd:8,16,16,32,2,2,8,1,2;ConvAsm3x3U:3,8,6
24-14-14-5x5-64-14-14-16-2x2-1x1-1x1-0-NCHW-FP16-F=ConvOclDirectFwd:8,16,16,16,2,1,4,1,2;ConvOclDirectFwdFused:8,16,16,16,2,1,4,4,2
832-14-14-1x1-128-14-14-16-0x0-1x1-1x1-0-NCHW-FP16-F=ConvAsm1x1U:2,8,4,64,1,4,4,2;ConvOclDirectFwd1x1:1,64,1,1,0,2,4,4,0
384-13-13-3x3-256-13-13-16-1x1-1x1-1x1-0-NCHW-FP16-F=ConvOclDirectFwd:8,16,16,16,2,1,8,1,2;ConvOclDirectFwdFused:8,8,16,16,2,2,4,1,2
128-14-14-1x1-288-14-14-64-0x0-1x1-1x1-0-NCHW-FP16-B=ConvAsm1x1U:1,16,2,16,1,2,2,2;ConvOclDirectFwd1x1:1,128,1,1,0,4,8,4,0
2048-8-8-1x1-1024-15-15-16-0x0-2x2-1x1-0-NCHW-FP32-W=ConvAsmBwdWrW1x1:1,16,4,4,8,1,1,4,0,1
512-29-29-1x1-1024-15-15-32-0x0-2x2-1x1-0-NCHW-FP32-F=ConvAsm1x1U:4,16,4,64,1,2,2,1;ConvOclDirectFwd1x1:1,64,1,1,1,0,32,2048,0
128-14-14-1x1-448-14-14-1024-0x0-1x1-1x1-0-NCHW-FP16-W=ConvAsmBwdWrW1x1:4,4,8,4,4,1,2,2,0,1
128-14-14-1x1-864-14-14-1-0x0-1x1-1x1-0-NCHW-FP32-W=ConvAsmBwdWrW1x1:1,16,2,4,4,1,1,2,0,1
864-7-7-1x1-128-7-7-32-0x0-1x1-1x1-0-NCHW-FP16-B=ConvAsm1x1U:1,8,2,32,1,4,4,1;ConvOclDirectFwd1x1:1,128,1,1,0,1,4,8,0
256-15-15-1x1-1024-15-15-8-0x0-1x1-1x1-0-NCHW-FP32-W=ConvAsmBwdWrW1x1:1,16,2,4,8,1,1,4,0,2
192-14-14-1x1-2016-14-14-1-0x0-1x1-1x1-0-NCHW-FP32-B=ConvAsm1x1U:2,8,2,64,1,2,2,1;ConvOclDirectFwd1x1:1,64,1,1,0,4,4,4,0
1008-14-14-1x1-192-14-14-512-0x0-1x1-1x1-0-NCHW-FP32-F=ConvAsm1x1U:4,8,7,32,1,2,1,8;ConvOclDirectFwd1x1:1,64,1,1,1,1,16,2048,0
256-15-15-1x1-1024-15-15-1-0x0-1x1-1x1-0-NCHW-FP32-W=ConvAsmBwdWrW1x1:1,16,2,2,8,1,1,4,0,1
128-7-7-1x1-576-7-7-8-0x0-1x1-1x1-0-NCHW-FP32-B=ConvAsm1x1U:1,16,1,32,1,1,4,1;ConvOclDirectFwd1x1:1,256,1,1,0,1,4,8,0
128-14-14-1x1-800-14-14-16-0x0-1x1-1x1-0-NCHW-FP32-F=ConvAsm1x1U:1,16,1,32,4,2,2,2;ConvOclDirectFwd1x1:1,64,1,1,1,1,16,2048,0
256-14-14-3x3-256-28-28-64-1x1-2x2-1x1-0-NCHW-FP32-B=ConvOclDirectFwd:16,32,32,32,2,1,4,4,2
60-14-14-3x3-60-28-28-16-1x1-2x2-1x1-0-NCHW-FP16-B=ConvOclDirectFwd:8,16,32,32,4,2,4,4,2
1024-14-14-1x1-512-14-14-1-0x0-1x1-1x1-0-NCHW-FP16-F=ConvAsm1x1U:1,8,2,64,1,4,4,2;ConvOclDirectFwd1x1:1,128,1,1,0,4,4,4,0
1104-14-14-1x1-192-14-14-1-0x0-1x1-1x1-0-NCHW-FP32-F=ConvAsm1x1U:1,8,1,64,1,4,4,1;ConvOclDirectFwd1x1:1,64,1,1,1,1,16,128,0
1632-7-7-1x1-128-7-7-16-0x0-1x1-1x1-0-NCHW-FP32-F=ConvAsm1x1U:2,8,2,32,1,4,4,1;ConvOclDirectFwd1x1:1,64,1,1,1,1,16,256,0
512-14-14-1x1-144-14-14-4-0x0-1x1-1x1-0-NCHW-FP16-F=ConvAsm1x1U:1,8,2,16,1,4,4,1;ConvOclDirectFwd1x1:1,64,1,1,0,4,4,4,0
128-28-28-1x1-416-28-28-2-0x0-1x1-1x1-0-NCHW-FP16-B=ConvAsm1x1U:1,8,2,32,1,4,2,2;ConvOclDirectFwd1x1:1,64,1,1,0,2,4,4,0
128-28-28-1x1-480-28-28-512-0x0-1x1-1x1-0-NCHW-FP32-W=ConvAsmBwdWrW1x1:1,16,2,4,8,1,4,4,0,2
64-224-224-3x3-3-224-224-64-1x1-1x1-1x1-0-NCHW-FP16-F=ConvOclDirectFwd:16,16,32,32,2,2,8,2,1
128-14-14-1x1-736-14-14-32-0x0-1x1-1x1-0-NCHW-FP16-B=ConvAsm1x1U:1,16,2,16,1,2,1,4;ConvOclDirectFwd1x1:1,64,1,1,0,4,8,4,0
128-28-28-1x1-320-28-28-2-0x0-1x1-1x1-0-NCHW-FP16-W=ConvAsmBwdWrW1x1:1,16,2,4,2,1,2,4,0,1
832-7-7-1x1-32-7-7-32-0x0-1x1-1x1-0-NCHW-FP16-F=ConvAsm1x1U:1,8,2,16,1,4,4,1;ConvOclDirectFwd1x1:1,128,1,1,0,1,4,8,0
128-7-7-1x1-512-7-7-64-0x0-1x1-1x1-0-NCHW-FP16-F=ConvAsm1x1U:2,8,4,16,1,4,1,4;ConvOclDirectFwd1x1:1,64,1,1,0,1,8,4,0
128-7-7-1x1-832-7-7-4-0x0-1x1-1x1-0-NCHW-FP16-B=ConvAsm1x1U:1,8,2,16,1,2,4,1;ConvOclDirectFwd1x1:1,256,1,1,0,1,4,4,0
512-13-13-1x1-1000-13-13-16-0x0-1x1-1x1-0-NCHW-FP32-W=ConvAsmBwdWrW1x1:1,16,4,8,4,1,1,4,0,1
192-14-14-1x1-912-14-14-64-0x0-1x1-1x1-0-NCHW-FP32-W=ConvAsmBwdWrW1x1:1,16,2,8,8,1,2,4,0,1
64-56-56-1x1-64-56-56-128-0x0-1x1-1x1-0-NCHW-FP16-F=ConvAsm1x1U:1,8,2,64,2,4,1,4;ConvOclDirectFwd1x1:1,256,1,1,0,4,16,4,0
128-14-14-1x1-1248-14-14-128-0x0-1x1-1x1-0-NCHW-FP16-B=ConvAsm1x1U:1,16,2,16,1,2,1,4;ConvOclDirectFwd1x1:1,64,1,1,0,4,16,4,0
128-28-28-1x1-256-55-55-16-0x0-2x2-1x1-0-NCHW-FP32-W=ConvAsmBwdWrW1x1:1,16,2,4,4,1,8,4
256-57-57-1x1-128-57-57-64-0x0-1x1-1x1-0-NCHW-FP32-F=ConvAsm1x1U:3,16,3,32,2,2,2,4;ConvOclDirectFwd1x1:1,64,1,1,1,1,16,2048,0
192-28-28-1x1-576-28-28-128-0x0-1x1-1x1-0-NCHW-FP32-W=ConvAsmBwdWrW1x1:2,8,4,8,4,2,2,4,0,1
32-64-128-1x1-528-64-128-1-0x0-1x1-1x1-0-NCHW-FP16-B=ConvOclDirectFwd1x1:1,256,1,1,0,2,8,4,0
192-7-7-1x1-1296-7-7-32-0x0-1x1-1x1-0-NCHW-FP32-B=ConvAsm1x1U:2,16,2,32,1,2,2,2;ConvOclDirectFwd1x1:8,64,8,8,0,1,16,4,1
256-27-27-1x1-48-27-27-128-0x0-1x1-1x1-0-NCHW-FP32-B=ConvAsm1x1U:2,16,2,64,1,2,1,1;ConvOclDirectFwd1x1:1,256,1,1,0,1,16,4,0
2048-8-8-1x1-1024-8-8-64-0x0-1x1-1x1-0-NCHW-FP32-B=ConvAsm1x1U:1,32,1,32,2,1,2,2;ConvOclDirectFwd1x1:1,256,1,1,0,4,16,4,0
16-54-54-1x1-96-54-54-128-0x0-1x1-1x1-0-NCHW-FP16-W=ConvAsmBwdWrW1x1:4,4,2,2,2,1,4,4,0,3
128-28-28-1x1-416-28-28-256-0x0-1x1-1x1-0-NCHW-FP32-B=ConvAsm1x1U:1,32,1,16,1,1,1,1;ConvOclDirectFwd1x1:1,64,1,1,0,1,32,4,0
480-14-14-1x1-16-14-14-1-0x0-1x1-1x1-0-NCHW-FP16-F=ConvAsm1x1U:1,8,2,16,1,4,4,1;ConvOclDirectFwd1x1:1,64,1,1,0,4,4,4,0
64-13-13-1x1-384-13-13-512-0x0-1x1-1x1-0-NCHW-FP16-B=ConvAsm1x1U:2,16,4,16,1,2,1,4;ConvOclDirectFwd1x1:1,64,1,1,0,1,16,4,0
512-26-26-3x3-256-53-53-256-0x0-2x2-1x1-0-NCHW-FP32-B=ConvOclDirectFwd:32,32,32,32,1,1,8,2,1
192-7-7-1x1-2112-7-7-256-0x0-1x1-1x1-0-NCHW-FP32-W=ConvAsmBwdWrW1x1:1,16,2,8,8,1,1,4,0,1
64-13-13-1x1-256-13-13-512-0x0-1x1-1x1-0-NCHW-FP16-F=ConvAsm1x1U:3,8,6,32,1,4,1,4;ConvOclDirectFwd1x1:1,128,1,1,0,1,8,4,0
192-56-56-1x1-384-56-56-256-0x0-1x1-1x1-0-NCHW-FP32-B=ConvAsm1x1U:1,16,1,64,2,2,1,4;ConvOclDirectFwd1x1:1,64,1,1,0,4,16,4,0
992-14-14-1x1-128-14-14-32-0x0-1x1-1x1-0-NCHW-FP16-W=ConvAsmBwdWrW1x1:4,4,8,4,4,2,1,2,0,1
64-35-35-1x1-192-35-35-16-0x0-1x1-1x1-0-NCHW-FP16-B=ConvAsm1x1U:1,16,2,32,1,2,2,2;ConvOclDirectFwd1x1:1,256,1,1,0,1,4,4,0
1632-7-7-1x1-192-7-7-64-0x0-1x1-1x1-0-NCHW-FP16-F=ConvAsm1x1U:2,16,4,16,1,2,4,1;ConvOclDirectFwd1x1:1,64,1,1,0,1,8,8,0
192-7-7-1x1-1824-7-7-16-0x0-1x1-1x1-0-NCHW-FP16-B=ConvAsm1x1U:1,16,2,16,1,2,2,2;ConvOclDirectFwd1x1:1,64,1,1,0,1,8,4,0
240-14-14-1x1-60-14-14-256-0x0-1x1-1x1-0-NCHW-FP32-B_g3=ConvOclDirectFwd:8,16,8,16,1,1,8,2,2
32-27-27-1x1-128-27-27-128-0x0-1x1-1x1-0-NCHW-FP16-F=ConvAsm1x1U:1,8,2,64,1,4,1,2;ConvOclDirectFwd1x1:1,64,1,1,0,1,8,4,0
256-14-14-1x1-512-28-28-32-0x0-2x2-1x1-0-NCHW-FP16-W=ConvAsmBwdWrW1x1:2,8,2,8,2,1,2,4,0,3
192-7-7-1x1-1440-7-7-16-0x0-1x1-1x1-0-NCHW-FP32-W=ConvAsmBwdWrW1x1:1,16,2,8,4,1,1,4,0,1
256-13-13-3x3-384-13-13-64-1x1-1x1-1x1-0-NCHW-FP16-F=ConvOclDirectFwd:8,8,16,16,2,2,8,2,1
192-14-14-1x1-1920-14-14-4-0x0-1x1-1x1-0-NCHW-FP16-B=ConvAsm1x1U:2,8,4,64,1,4,1,8;ConvOclDirectFwd1x1:1,64,1,1,0,4,4,4,0
192-14-14-1x1-1728-14-14-16-0x0-1x1-1x1-0-NCHW-FP32-B=ConvAsm1x1U:1,16,1,32,2,2,1,4;ConvOclDirectFwd1x1:1,128,1,1,0,4,16,4,0
192-56-56-1x1-240-56-56-256-0x0-1x1-1x1-0-NCHW-FP16-W=ConvAsmBwdWrW1x1:4,4,4,2,8,1,4,4,0,2
256-56-56-3x3-256-56-56-64-1x1-1x1-1x1-0-NCHW-FP16-F=ConvOclDirectFwd:16,16,32,32,2,2,8,1,1;ConvOclDirectFwdFused:16,16,32,32,2,2,8,2,1
64-13-13-1x1-384-13-13-1-0x0-1x1-1x1-0-NCHW-FP16-B=ConvAsm1x1U:1,8,2,32,1,2,4,1;ConvOclDirectFwd1x1:1,256,1,1,0,1,4,4,0
1536-7-7-1x1-192-7-7-64-0x0-1x1-1x1-0-NCHW-FP32-F=ConvAsm1x1U:4,8,4,16,1,4,1,2;ConvOclDirectFwd1x1:1,64,1,1,1,0,16,2048,0
192-28-28-1x1-288-28-28-512-0x0-1x1-1x1-0-NCHW-FP32-W=ConvAsmBwdWrW1x1:1,16,2,4,8,1,4,4,0,1
64-13-13-1x1-512-13-13-64-0x0-1x1-1x1-0-NCHW-FP16-B=ConvAsm1x1U:1,16,2,32,1,2,1,2;ConvOclDirectFwd1x1:1,128,1,1,0,1,8,4,0
128-14-14-1x1-960-14-14-64-0x0-1x1-1x1-0-NCHW-FP16-B=ConvAsm1x1U:1,16,2,16,1,2,1,4;ConvOclDirectFwd1x1:1,128,1,1,0,4,8,4,0
32-27-27-3x3-128-27-27-256-1x1-1x1-1x1-0-NCHW-FP16-F=ConvOclDirectFwd:16,16,32,32,2,2,8,2,1
1024-14-14-1x1-1024-14-14-4-0x0-1x1-1x1-0-NCHW-FP32-F=ConvAsm1x1U:4,16,4,64,1,2,2,1;ConvOclDirectFwd1x1:1,64,1,1,1,4,16,2048,0
128-17-17-7x1-128-17-17-256-3x0-1x1-1x1-0-NCHW-FP32-W=ConvOclBwdWrW2<4>:1,6,8,3,7;ConvOclBwdWrW2<1>:1,9,8,3,9;ConvOclBwdWrW2<16>:1,6,3,8,7;ConvOclBwdWrW2<8>:1,6,8,3,7;ConvOclBwdWrW2<2>:1,6,3,8,7
128-7-7-1x1-768-7-7-128-0x0-1x1-1x1-0-NCHW-FP16-W=ConvAsmBwdWrW1x1:2,8,8,8,2,2,2,2,0,2
48-7-7-3x3-192-7-7-8-1x1-1x1-1x1-0-NCHW-FP32-W=ConvAsmBwdWrW3x3:0,0,8,2,7,1
192-7-7-1x1-1392-7-7-128-0x0-1x1-1x1-0-NCHW-FP16-B=ConvAsm1x1U:2,16,4,16,1,2,1,4;ConvOclDirectFwd1x1:1,64,1,1,0,1,8,4,0
96-71-71-3x3-64-73-73-64-0x0-1x1-1x1-0-NCHW-FP16-B=ConvOclDirectFwd:8,8,16,16,2,2,8,2,2
128-54-54-3x3-32-54-54-8-1x1-1x1-1x1-0-NCHW-FP16-W=ConvAsmBwdWrW3x3:0,1,8,2,2,4
128-14-14-1x1-1664-14-14-8-0x0-1x1-1x1-0-NCHW-FP32-B=ConvAsm1x1U:1,16,1,16,1,2,1,4;ConvOclDirectFwd1x1:1,64,1,1,0,4,16,4,0
128-54-54-3x3-32-54-54-128-1x1-1x1-1x1-0-NCHW-FP16-W=ConvAsmBwdWrW3x3:0,1,8,2,2,2
192-14-14-1x1-1488-14-14-2-0x0-1x1-1x1-0-NCHW-FP32-B=ConvAsm1x1U:1,16,1,32,1,1,2,2;ConvOclDirectFwd1x1:1,128,1,1,0,1,8,4,0
128-7-7-1x1-1504-7-7-256-0x0-1x1-1x1-0-NCHW-FP16-B=ConvAsm1x1U:2,16,4,16,1,2,1,2;ConvOclDirectFwd1x1:1,256,1,1,0,1,8,4,0
128-14-14-1x1-1312-14-14-256-0x0-1x1-1x1-0-NCHW-FP16-W=ConvAsmBwdWrW1x1:4,4,8,4,4,1,2,2,0,2
64-55-55-1x1-16-55-55-32-0x0-1x1-1x1-0-NCHW-FP32-F=ConvAsm1x1U:1,16,1,64,2,2,1,1;ConvOclDirectFwd1x1:1,64,1,1,1,0,64,128,0
16-55-55-1x1-64-55-55-128-0x0-1x1-1x1-0-NCHW-FP32-W=ConvAsmBwdWrW1x1:4,4,2,2,2,1,4,4,0,3
192-7-7-3x3-384-7-7-64-1x1-1x1-1x1-0-NCHW-FP16-F=ConvOclDirectFwd:8,8,8,8,1,1,8,4,2;ConvOclDirectFwdFused:8,8,8,8,1,1,8,4,2
128-7-7-1x1-1632-7-7-4-0x0-1x1-1x1-0-NCHW-FP32-W=ConvAsmBwdWrW1x1:1,16,2,4,4,1,1,4,0,1
384-13-13-3x3-384-13-13-256-1x1-1x1-1x1-0-NCHW-FP16-B=ConvOclDirectFwd:8,8,16,16,2,2,8,2,2
3-108-108-3x3-64-54-54-1-1x1-2x2-1x1-0-NCHW-FP32-F=ConvOclDirectFwd:16,16,16,16,1,1,4,1,1
64-14-14-1x1-512-14-14-32-0x0-1x1-1x1-0-NCHW-FP32-B=ConvAsm1x1U:1,16,1,64,2,2,1,4;ConvOclDirectFwd1x1:1,256,1,1,0,4,16,8,0
64-112-112-7x7-3-225-225-8-2x2-2x2-1x1-0-NCHW-FP16-B=ConvOclDirectFwd:16,32,32,32,2,1,1,4,1
352-28-28-1x1-128-28-28-32-0x0-1x1-1x1-0-NCHW-FP32-F=ConvAsm1x1U:3,16,5,32,1,2,2,1;ConvOclDirectFwd1x1:1,64,1,1,1,1,16,2048,0
768-17-17-1x1-128-17-17-16-0x0-1x1-1x1-0-NCHW-FP32-F=ConvAsm1x1U:2,16,5,64,1,2,4,1;ConvActivAsm1x1U:3,16,5,64,1,4;ConvOclDirectFwd1x1:1,64,1,1,1,0,32,256,0
24-14-14-1x1-512-14-14-32-0x0-1x1-1x1-0-NCHW-FP32-B=ConvAsm1x1U:1,16,1,32,1,2,1,4;ConvOclDirectFwd1x1:8,64,16,16,0,2,16,4,1
64-27-27-5x5-192-27-27-512-2x2-1x1-1x1-0-NCHW-FP16-F=ConvOclDirectFwd:16,16,32,32,2,2,8,1,2;ConvOclDirectFwdFused:8,16,32,32,4,2,8,2,1
512-14-14-1x1-128-28-28-32-0x0-2x2-1x1-0-NCHW-FP32-B=ConvAsm1x1U:2,16,2,64,1,2,2,1;ConvOclDirectFwd1x1:1,256,1,1,0,1,32,4,0
1024-14-14-3x3-1024-7-7-1-1x1-2x2-1x1-0-NCHW-FP32-F_g32=ConvOclDirectFwd:8,8,8,8,1,1,2,2,1
720-14-14-1x1-192-14-14-2-0x0-1x1-1x1-0-NCHW-FP16-F=ConvAsm1x1U:1,8,2,16,1,4,4,1;ConvOclDirectFwd1x1:1,256,1,1,0,4,4,4,0
192-28-28-1x1-192-28-28-8-0x0-1x1-1x1-0-NCHW-FP16-B=ConvAsm1x1U:2,8,4,16,1,2,2,2;ConvOclDirectFwd1x1:1,64,1,1,0,4,16,4,0
384-8-8-3x1-384-8-8-16-1x0-1x1-1x1-0-NCHW-FP16-W=ConvOclBwdWrW2<4>:1,8,1,8,9;ConvOclBwdWrW2<1>:1,8,8,8,9;ConvOclBwdWrW2<16>:1,8,1,8,9;ConvOclBwdWrW2<8>:1,8,1,8,9;ConvOclBwdWrW2<2>:1,8,1,8,9
256-13-13-3x3-256-13-13-256-1x1-1x1-1x1-0-NCHW-FP16-F=ConvOclDirectFwd:8,8,16,16,2,2,8,2,2
128-7-7-1x1-1728-7-7-2-0x0-1x1-1x1-0-NCHW-FP16-B=ConvAsm1x1U:1,8,2,32,1,2,4,4;ConvOclDirectFwd1x1:1,64,1,1,0,1,4,4,0
256-128-256-1x1-64-128-256-1-0x0-1x1-1x1-0-NCHW-FP16-F=ConvOclDirectFwd1x1:1,128,1,1,0,2,8,4,0
192-17-17-1x1-768-17-17-64-0x0-1x1-1x1-0-NCHW-FP32-B=ConvAsm1x1U:1,16,1,64,2,2,1,4;ConvOclDirectFwd1x1:16,64,32,32,0,1,16,4,1
192-7-7-1x1-1536-7-7-1024-0x0-1x1-1x1-0-NCHW-FP16-B=ConvAsm1x1U:2,16,4,16,1,2,1,4;ConvOclDirectFwd1x1:1,64,1,1,0,1,8,4,0
128-7-7-1x1-1568-7-7-8-0x0-1x1-1x1-0-NCHW-FP32-W=ConvAsmBwdWrW1x1:1,16,2,4,8,1,1,4,0,1
128-7-7-1x1-704-7-7-128-0x0-1x1-1x1-0-NCHW-FP32-F=ConvAsm1x1U:1,8,1,64,2,4,1,8;ConvOclDirectFwd1x1:1,64,1,1,1,4,16,2048,0
128-7-7-1x1-1664-7-7-16-0x0-1x1-1x1-0-NCHW-FP32-W=ConvAsmBwdWrW1x1:1,16,2,4,8,1,1,4,0,1
512-14-14-3x3-512-28-28-8-1x1-2x2-1x1-0-NCHW-FP32-B_g32=ConvOclDirectFwd:8,8,32,32,4,4,4,4,1
192-8-8-3x3-192-17-17-16-0x0-2x2-1x1-0-NCHW-FP32-B=ConvOclDirectFwd:32,16,32,32,1,2,4,4,2
128-14-14-1x1-896-14-14-512-0x0-1x1-1x1-0-NCHW-FP16-B=ConvAsm1x1U:1,16,2,16,1,2,1,8;ConvOclDirectFwd1x1:1,256,1,1,0,2,16,4,0
54-55-55-1x1-24-55-55-1024-0x0-1x1-1x1-0-NCHW-FP32-B=ConvAsm1x1U:1,8,1,64,1,2,1,2;ConvOclDirectFwd1x1:1,256,1,1,0,1,8,4,0
256-56-56-1x1-256-56-56-2-0x0-1x1-1x1-0-NCHW-FP32-F=ConvAsm1x1U:2,8,7,64,1,4,1,4;ConvOclDirectFwd1x1:1,64,1,1,1,0,16,2048,0
64-56-56-3x3-64-56-56-8-1x1-1x1-1x1-0-NCHW-FP16-B=ConvOclDirectFwd:16,16,32,32,2,2,8,2,1
1728-7-7-1x1-128-7-7-128-0x0-1x1-1x1-0-NCHW-FP16-F=ConvAsm1x1U:2,8,4,16,1,4,2,4;ConvOclDirectFwd1x1:1,64,1,1,0,1,8,4,0
128-7-7-1x1-1536-7-7-32-0x0-1x1-1x1-0-NCHW-FP32-B=ConvAsm1x1U:1,16,1,64,2,2,2,2;ConvOclDirectFwd1x1:1,64,1,1,0,1,16,4,0
128-14-14-1x1-576-14-14-512-0x0-1x1-1x1-0-NCHW-FP16-W=ConvAsmBwdWrW1x1:2,8,2,8,2,1,4,4,0,3
64-13-13-1x1-512-13-13-64-0x0-1x1-1x1-0-NCHW-FP16-W=ConvAsmBwdWrW1x1:4,4,4,4,4,2,2,4,0,1
384-27-27-1x1-64-27-27-128-0x0-1x1-1x1-0-NCHW-FP32-W=ConvAsmBwdWrW1x1:2,8,2,4,2,1,1,4,0,2
256-14-14-3x3-256-14-14-512-1x1-1x1-1x1-0-NCHW-FP16-W=ConvAsmBwdWrW3x3:0,1,8,4,4,1
16-55-55-3x3-64-55-55-128-1x1-1x1-1x1-0-NCHW-FP16-F=ConvOclDirectFwd:16,16,32,32,2,2,8,1,2
192-14-14-1x1-720-14-14-2-0x0-1x1-1x1-0-NCHW-FP16-B=ConvAsm1x1U:1,8,2,64,1,4,4,2;ConvOclDirectFwd1x1:1,256,1,1,0,1,4,4,0
48-35-35-5x5-64-35-35-32-2x2-1x1-1x1-0-NCHW-FP16-F=ConvOclDirectFwd:8,8,16,16,2,2,8,2,2;ConvOclDirectFwdFused:8,8,16,16,2,2,8,2,1
160-7-7-1x1-832-7-7-512-0x0-1x1-1x1-0-NCHW-FP32-W=ConvAsmBwdWrW1x1:1,16,2,8,4,1,4,4,0,2
58-56-56-1x1-24-56-56-8-0x0-1x1-1x1-0-NCHW-FP32-W=ConvAsmBwdWrW1x1:4,4,2,4,2,1,4,4,0,1
192-14-14-1x1-1824-14-14-32-0x0-1x1-1x1-0-NCHW-FP32-W=ConvAsmBwdWrW1x1:2,8,4,8,4,1,2,4,0,1
608-14-14-1x1-128-14-14-256-0x0-1x1-1x1-0-NCHW-FP32-F=ConvAsm1x1U:3,16,4,64,1,2,1,4;ConvOclDirectFwd1x1:1,64,1,1,1,4,16,2048,0
256-17-17-1x1-1024-17-17-64-0x0-1x1-1x1-0-NCHW-FP32-W=ConvAsmBwdWrW1x1:2,8,4,8,4,1,1,4,0,1
96-112-112-7x7-3-224-224-1-3x3-2x2-1x1-0-NCHW-FP32-W=ConvOclBwdWrW2<1>:3,8,1,3,7
24-28-28-1x1-58-28-28-512-0x0-1x1-1x1-0-NCHW-FP32-F=ConvAsm1x1U:1,8,1,32,1,4,1,2;ConvOclDirectFwd1x1:1,64,1,1,0,4,8,4,0
192-7-7-1x1-1392-7-7-4-0x0-1x1-1x1-0-NCHW-FP32-W=ConvAsmBwdWrW1x1:1,16,2,4,8,1,1,4,0,0
128-28-28-1x1-320-28-28-4-0x0-1x1-1x1-0-NCHW-FP16-W=ConvAsmBwdWrW1x1:2,8,2,8,2,1,2,2,0,1
16-54-54-3x3-64-54-54-16-1x1-1x1-1x1-0-NCHW-FP32-F=ConvOclDirectFwd:8,32,16,32,2,1,8,4,2;ConvAsm3x3U:0,8,3
80-73-73-1x1-64-73-73-512-0x0-1x1-1x1-0-NCHW-FP16-W=ConvAsmBwdWrW1x1:4,4,4,4,2,1,4,4,0,1
1632-7-7-1x1-192-7-7-16-0x0-1x1-1x1-0-NCHW-FP32-F=ConvAsm1x1U:4,8,4,16,1,4,4,2;ConvActivAsm1x1U:2,16,2,16,2,4;ConvOclDirectFwd1x1:1,64,1,1,1,0,16,256,0
64-73-73-1x1-80-73-73-1024-0x0-1x1-1x1-0-NCHW-FP16-F=ConvAsm1x1U:1,8,2,64,1,4,1,2;ConvOclDirectFwd1x1:1,256,1,1,0,1,8,4,0
512-13-13-1x1-1000-13-13-16-0x0-1x1-1x1-0-NCHW-FP16-W=ConvAsmBwdWrW1x1:1,16,8,4,4,1,1,2,0,1
128-14-14-1x1-736-14-14-16-0x0-1x1-1x1-0-NCHW-FP32-B=ConvAsm1x1U:1,16,1,32,1,2,1,1;ConvOclDirectFwd1x1:1,64,1,1,0,4,16,4,0
1056-7-7-1x1-192-7-7-16-0x0-1x1-1x1-0-NCHW-FP16-F=ConvAsm1x1U:1,8,2,32,1,4,4,1;ConvOclDirectFwd1x1:1,64,1,1,0,1,4,4,0
256-13-13-1x1-64-13-13-256-0x0-1x1-1x1-0-NCHW-FP32-W=ConvAsmBwdWrW1x1:4,4,4,4,4,1,4,4,0,1
1024-8-8-3x3-1024-15-15-64-1x1-2x2-1x1-0-NCHW-FP32-B_g32=ConvOclDirectFwd:8,8,8,16,1,2,4,1,2
192-14-14-1x1-1536-14-14-16-0x0-1x1-1x1-0-NCHW-FP32-W=ConvAsmBwdWrW1x1:2,8,4,4,8,1,2,4,0,1
128-14-14-1x1-1696-14-14-256-0x0-1x1-1x1-0-NCHW-FP32-W=ConvAsmBwdWrW1x1:2,8,4,4,8,1,1,4,0,1
1024-14-14-1x1-256-14-14-4-0x0-1x1-1x1-0-NCHW-FP32-W=ConvAsmBwdWrW1x1:1,16,4,8,2,1,1,4,0,1
128-28-28-1x1-224-28-28-32-0x0-1x1-1x1-0-NCHW-FP16-F=ConvAsm1x1U:1,8,2,16,2,4,1,4;ConvOclDirectFwd1x1:1,256,1,1,0,4,16,4,0
192-17-17-1x1-768-17-17-1024-0x0-1x1-1x1-0-NCHW-FP16-B=ConvAsm1x1U:2,16,4,16,1,2,1,4;ConvOclDirectFwd1x1:1,64,1,1,0,1,8,4,0
1344-7-7-1x1-192-7-7-32-0x0-1x1-1x1-0-NCHW-FP32-F=ConvAsm1x1U:2,8,2,32,1,4,2,2;ConvOclDirectFwd1x1:1,64,1,1,1,4,16,256,0
128-28-28-1x1-128-28-28-64-0x0-1x1-1x1-0-NCHW-FP32-B=ConvAsm1x1U:1,32,1,16,1,1,1,2;ConvOclDirectFwd1x1:1,128,1,1,0,4,16,4,0
256-29-29-3x3-256-29-29-2-1x1-1x1-1x1-0-NCHW-FP32-B_g32=ConvOclDirectFwd:32,8,32,16,1,2,8,4,2
128-14-14-1x1-928-14-14-256-0x0-1x1-1x1-0-NCHW-FP16-W=ConvAsmBwdWrW1x1:2,8,8,4,4,1,2,4,0,1
232-14-14-1x1-232-14-14-8-0x0-1x1-1x1-0-NCHW-FP32-B=ConvAsm1x1U:2,8,2,64,1,2,2,8;ConvOclDirectFwd1x1:1,64,1,1,0,1,16,4,0
112-14-14-1x1-512-14-14-256-0x0-1x1-1x1-0-NCHW-FP32-B=ConvAsm1x1U:1,32,1,16,2,1,2,2;ConvOclDirectFwd1x1:1,128,1,1,0,1,32,4,0
2048-8-8-1x1-1024-15-15-64-0x0-2x2-1x1-0-NCHW-FP32-B=ConvAsm1x1U:1,32,2,32,1,1,4,1;ConvOclDirectFwd1x1:1,256,1,1,0,1,32,4,0
720-28-28-1x1-192-28-28-1024-0x0-1x1-1x1-0-NCHW-FP16-F=ConvOclDirectFwd1x1:1,128,1,1,0,4,16,4,0
1056-14-14-1x1-2112-14-14-128-0x0-1x1-1x1-0-NCHW-FP32-W=ConvAsmBwdWrW1x1:1,16,4,8,4,1,1,4,0,1
608-7-7-1x1-128-7-7-16-0x0-1x1-1x1-0-NCHW-FP32-F=ConvAsm1x1U:1,8,1,64,1,4,4,4;ConvOclDirectFwd1x1:1,64,1,1,1,0,16,128,0
960-7-7-1x1-240-7-7-2-0x0-1x1-1x1-0-NCHW-FP32-F_g3=ConvOclDirectFwd:8,8,8,8,1,1,2,4,2
60-14-14-1x1-240-14-14-32-0x0-1x1-1x1-0-NCHW-FP16-F_g3=ConvOclDirectFwd:16,16,16,16,1,1,8,4,2
288-28-28-1x1-128-28-28-16-0x0-1x1-1x1-0-NCHW-FP32-B=ConvAsm1x1U:1,16,1,16,1,2,2,2;ConvOclDirectFwd1x1:1,64,1,1,0,2,16,4,0
64-13-13-1x1-384-13-13-16-0x0-1x1-1x1-0-NCHW-FP32-B=ConvAsm1x1U:1,16,1,64,1,2,1,2;ConvOclDirectFwd1x1:8,64,16,16,0,1,16,4,1
1344-7-7-1x1-192-7-7-4-0x0-1x1-1x1-0-NCHW-FP16-F=ConvAsm1x1U:1,8,2,16,1,4,4,1;ConvOclDirectFwd1x1:1,64,1,1,0,1,4,8,0
48-7-7-5x5-128-7-7-512-2x2-1x1-1x1-0-NCHW-FP32-F=ConvOclDirectFwd:8,8,8,8,1,1,8,1,1;ConvOclDirectFwdFused:8,8,8,8,1,1,8,2,1
1024-7-7-3x3-1024-7-7-4-1x1-1x1-1x1-0-NCHW-FP16-W_g32=ConvOclBwdWrW2<1>:1,7,8,1,7;ConvOclBwdWrW2<4>:1,6,3,1,7;ConvAsmBwdWrW3x3:0,0,8,4,4,1;ConvOclBwdWrW2<2>:1,7,8,1,7
128-14-14-1x1-544-14-14-32-0x0-1x1-1x1-0-NCHW-FP32-W=ConvAsmBwdWrW1x1:1,16,2,8,2,1,1,4,0,2
128-7-7-3x3-32-7-7-32-1x1-1x1-1x1-0-NCHW-FP16-B=ConvOclDirectFwd:8,8,8,8,1,1,1,4,2
240-28-28-1x1-60-28-28-512-0x0-1x1-1x1-0-NCHW-FP32-F_g3=ConvOclDirectFwd:16,16,16,16,1,1,8,2,1
64-35-35-1x1-384-35-35-256-0x0-1x1-1x1-0-NCHW-FP32-F=ConvAsm1x1U:1,16,1,64,4,2,1,4;ConvOclDirectFwd1x1:1,64,1,1,1,1,32,2048,0
64-56-56-3x3-64-56-56-1024-1x1-1x1-1x1-0-NCHW-FP16-F=ConvOclDirectFwd:16,16,32,32,2,2,8,1,1
768-17-17-1x1-160-17-17-512-0x0-1x1-1x1-0-NCHW-FP16-F=ConvAsm1x1U:1,16,4,16,1,2,2,2;ConvOclDirectFwd1x1:1,64,1,1,0,1,8,4,0
160-56-56-1x1-128-56-56-128-0x0-1x1-1x1-0-NCHW-FP32-W=ConvAsmBwdWrW1x1:2,8,2,4,8,1,4,4,0,2
96-112-112-7x7-3-224-224-8-3x3-2x2-1x1-0-NCHW-FP32-B=ConvOclDirectFwd:16,16,32,32,2,2,8,2,1
48-27-27-3x3-192-27-27-128-1x1-1x1-1x1-0-NCHW-FP16-B=ConvOclDirectFwd:16,16,32,32,2,2,8,2,1
256-7-7-3x3-256-14-14-256-1x1-2x2-1x1-0-NCHW-FP16-W=ConvAsmBwdWrW3x3:0,0,8,4,5,1
256-27-27-1x1-48-27-27-64-0x0-1x1-1x1-0-NCHW-FP32-F=ConvAsm1x1U:2,16,3,64,1,2,1,1;ConvOclDirectFwd1x1:1,64,1,1,1,1,16,2048,0
192-7-7-1x1-2064-7-7-1-0x0-1x1-1x1-0-NCHW-FP16-B=ConvAsm1x1U:1,8,2,32,1,4,4,1;ConvOclDirectFwd1x1:1,64,1,1,0,1,4,4,0
192-14-14-1x1-1488-14-14-256-0x0-1x1-1x1-0-NCHW-FP32-B=ConvAsm1x1U:1,16,1,64,2,2,1,1;ConvOclDirectFwd1x1:1,256,1,1,0,2,16,4,0
192-17-17-7x1-160-17-17-256-3x0-1x1-1x1-0-NCHW-FP32-W=ConvOclBwdWrW2<4>:1,6,3,8,7;ConvOclBwdWrW2<1>:1,9,8,3,9;ConvOclBwdWrW2<16>:1,6,8,3,7;ConvOclBwdWrW2<8>:1,9,8,3,9;ConvOclBwdWrW2<2>:1,6,8,3,7
192-14-14-1x1-1632-14-14-256-0x0-1x1-1x1-0-NCHW-FP16-B=ConvAsm1x1U:1,16,2,16,1,2,1,4;ConvOclDirectFwd1x1:1,64,1,1,0,2,16,4,0
256-28-28-1x1-64-56-56-256-0x0-2x2-1x1-0-NCHW-FP32-B=ConvAsm1x1U:1,32,1,16,1,1,1,2;ConvOclDirectFwd1x1:1,128,1,1,0,1,32,4,0
128-14-14-1x1-1312-14-14-2-0x0-1x1-1x1-0-NCHW-FP32-W=ConvAsmBwdWrW1x1:1,16,2,8,4,1,2,4,0,1
192-14-14-1x1-768-14-14-32-0x0-1x1-1x1-0-NCHW-FP32-B=ConvAsm1x1U:1,32,1,16,2,1,1,1;ConvOclDirectFwd1x1:8,64,16,16,0,2,16,4,1
1280-8-8-1x1-320-8-8-1-0x0-1x1-1x1-0-NCHW-FP16-F=ConvAsm1x1U:1,8,2,16,1,4,4,1;ConvOclDirectFwd1x1:1,128,1,1,0,1,4,8,0
192-7-7-1x1-1104-7-7-64-0x0-1x1-1x1-0-NCHW-FP16-B=ConvAsm1x1U:2,16,4,16,1,2,2,1;ConvOclDirectFwd1x1:1,128,1,1,0,1,8,4,0
64-55-55-1x1-256-55-55-1-0x0-1x1-1x1-0-NCHW-FP32-B=ConvAsm1x1U:1,16,1,64,1,2;ConvOclDirectFwd1x1:1,128,1,1,0,1,8,4,0
128-54-54-3x3-32-54-54-4-1x1-1x1-1x1-0-NCHW-FP16-W=ConvAsmBwdWrW3x3:0,0,8,2,2,2
256-57-57-1x1-64-57-57-128-0x0-1x1-1x1-0-NCHW-FP32-B=ConvAsm1x1U:2,32,2,64,1,1,1,1;ConvOclDirectFwd1x1:1,64,1,1,0,1,32,4,0
384-7-7-1x1-832-7-7-1-0x0-1x1-1x1-0-NCHW-FP32-W=ConvAsmBwdWrW1x1:1,16,2,2,8,1,1,4,0,1
1824-14-14-1x1-192-14-14-4-0x0-1x1-1x1-0-NCHW-FP32-F=ConvAsm1x1U:4,8,4,64,1,4,4,2;ConvOclDirectFwd1x1:1,64,1,1,1,4,16,256,0
64-27-27-3x3-256-27-27-16-1x1-1x1-1x1-0-NCHW-FP16-F=ConvOclDirectFwd:16,16,32,32,2,2,8,4,2
128-14-14-1x1-1472-14-14-32-0x0-1x1-1x1-0-NCHW-FP32-W=ConvAsmBwdWrW1x1:1,16,4,4,8,1,2,4,0,1
96-109-109-7x7-3-224-224-16-0x0-2x2-1x1-0-NCHW-FP16-W=ConvOclBwdWrW2<4>:8,10,1,3,11;ConvOclBwdWrW2<1>:3,10,1,3,7;ConvOclBwdWrW2<16>:8,9,1,3,9;ConvOclBwdWrW2<8>:8,10,1,3,11;ConvOclBwdWrW2<2>:8,10,1,3,11
864-7-7-1x1-128-7-7-256-0x0-1x1-1x1-0-NCHW-FP16-F=ConvAsm1x1U:2,8,4,16,1,4,1,8;ConvOclDirectFwd1x1:1,256,1,1,0,1,8,4,0
256-14-14-3x3-128-14-14-1-1x1-1x1-1x1-0-NCHW-FP16-B=ConvOclDirectFwd:16,16,16,16,1,1,1,4,1
128-14-14-1x1-1184-14-14-1024-0x0-1x1-1x1-0-NCHW-FP16-W=ConvAsmBwdWrW1x1:2,8,4,8,2,1,4,4,0,1
128-7-7-1x1-1760-7-7-256-0x0-1x1-1x1-0-NCHW-FP32-B=ConvAsm1x1U:1,16,1,64,2,2,1,1;ConvOclDirectFwd1x1:1,128,1,1,0,1,32,4,0
416-28-28-1x1-128-28-28-2-0x0-1x1-1x1-0-NCHW-FP32-F=ConvAsm1x1U:1,8,1,64,2,4,4,2;ConvOclDirectFwd1x1:1,64,1,1,1,0,16,128,0
1152-7-7-1x1-128-7-7-4-0x0-1x1-1x1-0-NCHW-FP32-F=ConvAsm1x1U:1,8,1,32,1,4,4,1;ConvOclDirectFwd1x1:1,64,1,1,1,1,16,64,0
320-8-8-1x1-2048-8-8-1-0x0-1x1-1x1-0-NCHW-FP16-W=ConvAsmBwdWrW1x1:1,16,2,2,4,1,1,4,0,1
32-24-240-3x3-16-24-240-16-1x1-1x1-1x1-0-NCHW-FP16-W=ConvAsmBwdWrW3x3:0,0,16,2,1,8
192-14-14-1x1-960-14-14-4-0x0-1x1-1x1-0-NCHW-FP32-W=ConvAsmBwdWrW1x1:1,16,2,4,8,1,1,4,0,1
3-224-224-3x3-64-224-224-8-1x1-1x1-1x1-0-NCHW-FP16-F=ConvOclDirectFwd:16,16,32,32,2,2,8,1,2;ConvOclDirectFwdFused:16,16,16,32,1,2,8,1,2
64-56-56-3x3-64-56-56-1-1x1-1x1-1x1-0-NCHW-FP16-B=ConvOclDirectFwd:16,16,16,32,1,2,2,4,1
192-7-7-1x1-2112-7-7-1-0x0-1x1-1x1-0-NCHW-FP32-B=ConvAsm1x1U:1,8,1,64,1,2,4,2;ConvOclDirectFwd1x1:1,128,1,1,0,1,4,4,0
32-54-54-1x1-128-54-54-512-0x0-1x1-1x1-0-NCHW-FP16-F=ConvAsm1x1U:1,8,2,64,1,4,1,4;ConvOclDirectFwd1x1:1,64,1,1,0,2,32,4,0
640-7-7-1x1-128-7-7-32-0x0-1x1-1x1-0-NCHW-FP32-W=ConvAsmBwdWrW1x1:1,16,2,8,2,1,2,4,0,2
2048-8-8-1x1-1024-8-8-256-0x0-1x1-1x1-0-NCHW-FP32-W=ConvAsmBwdWrW1x1:1,16,4,4,8,1,2,4,0,1
1536-14-14-1x1-128-14-14-1-0x0-1x1-1x1-0-NCHW-FP32-F=ConvAsm1x1U:1,8,1,64,1,4,4,1;ConvOclDirectFwd1x1:1,64,1,1,1,1,16,128,0
128-28-28-1x1-416-28-28-8-0x0-1x1-1x1-0-NCHW-FP32-W=ConvAsmBwdWrW1x1:2,8,4,4,4,1,2,4,0,1
128-56-56-1x1-64-56-56-32-0x0-1x1-1x1-0-NCHW-FP32-B=ConvAsm1x1U:1,16,1,64,1,2,1,1;ConvOclDirectFwd1x1:1,64,1,1,0,2,16,4,0
384-8-8-1x1-1280-8-8-8-0x0-1x1-1x1-0-NCHW-FP16-B=ConvAsm1x1U:1,16,2,16,1,2,4,1;ConvOclDirectFwd1x1:1,64,1,1,0,2,8,4,0
512-7-7-3x3-512-16-16-64-0x0-2x2-1x1-0-NCHW-FP16-B=ConvOclDirectFwd:16,8,16,16,1,2,4,1,2
232-7-7-1x1-232-7-7-256-0x0-1x1-1x1-0-NCHW-FP32-B=ConvAsm1x1U:1,8,1,64,2,2,1,8;ConvOclDirectFwd1x1:1,256,1,1,0,1,8,4,0
58-28-28-1x1-58-28-28-2-0x0-1x1-1x1-0-NCHW-FP32-F=ConvAsm1x1U:1,8,1,32,1,1,4,1;ConvOclDirectFwd1x1:1,128,1,1,0,1,8,4,0
128-7-7-1x1-768-7-7-8-0x0-1x1-1x1-0-NCHW-FP16-B=ConvAsm1x1U:1,8,2,32,1,2,4,1;ConvOclDirectFwd1x1:1,64,1,1,0,1,4,4,0
160-14-14-3x3-128-14-14-32-1x1-1x1-1x1-0-NCHW-FP16-B=ConvOclDirectFwd:8,16,16,16,2,1,8,1,2
512-7-7-3x3-512-7-7-1-1x1-1x1-1x1-0-NCHW-FP16-F=ConvOclDirectFwd:8,8,8,8,1,1,1,4,1;ConvOclDirectFwdFused:8,8,8,8,1,1,1,4,1
192-14-14-1x1-512-14-14-16-0x0-1x1-1x1-0-NCHW-FP16-W=ConvAsmBwdWrW1x1:2,8,4,8,2,1,2,2,0,1
192-14-14-1x1-2016-14-14-1-0x0-1x1-1x1-0-NCHW-FP16-W=ConvAsmBwdWrW1x1:1,16,4,4,2,1,1,4,0,0
128-14-14-1x1-1088-14-14-64-0x0-1x1-1x1-0-NCHW-FP32-W=ConvAsmBwdWrW1x1:1,16,2,8,4,1,4,4,0,3
512-28-28-1x1-256-56-56-6-0x0-2x2-1x1-0-NCHW-FP32-W=ConvAsmBwdWrW1x1:2,8,4,2,8,2,1,4,0,1
1280-7-7-1x1-128-7-7-1024-0x0-1x1-1x1-0-NCHW-FP16-F=ConvAsm1x1U:2,8,4,16,1,4,2,2;ConvOclDirectFwd1x1:1,256,1,1,0,1,8,4,0
864-7-7-1x1-128-7-7-128-0x0-1x1-1x1-0-NCHW-FP16-F=ConvAsm1x1U:2,8,4,16,1,4,2,4;ConvOclDirectFwd1x1:1,128,1,1,0,1,4,8,0
896-14-14-1x1-1792-14-14-64-0x0-1x1-1x1-0-NCHW-FP32-W=ConvAsmBwdWrW1x1:2,8,4,8,4,1,1,4,0,1
192-7-7-1x1-1584-7-7-256-0x0-1x1-1x1-0-NCHW-FP16-W=ConvAsmBwdWrW1x1:1,16,4,8,2,1,4,2,0,2
32-27-27-1x1-128-27-27-512-0x0-1x1-1x1-0-NCHW-FP16-B=ConvAsm1x1U:1,16,2,64,1,2,1,4;ConvOclDirectFwd1x1:1,128,1,1,0,1,16,4,0
336-28-28-1x1-192-28-28-512-0x0-1x1-1x1-0-NCHW-FP16-F=ConvAsm1x1U:1,8,2,32,2,4,1,8;ConvOclDirectFwd1x1:1,64,1,1,0,4,16,4,0
192-14-14-1x1-1056-14-14-32-0x0-1x1-1x1-0-NCHW-FP16-B=ConvAsm1x1U:1,16,2,16,1,2,2,2;ConvOclDirectFwd1x1:1,128,1,1,0,4,8,4,0
128-7-7-1x1-1600-7-7-64-0x0-1x1-1x1-0-NCHW-FP32-B=ConvAsm1x1U:1,16,1,64,2,2,1,1;ConvOclDirectFwd1x1:1,64,1,1,0,1,16,8,0
384-8-8-3x1-384-8-8-256-1x0-1x1-1x1-0-NCHW-FP32-W=ConvOclBwdWrW2<4>:1,7,8,3,9;ConvOclBwdWrW2<1>:1,7,8,3,9;ConvOclBwdWrW2<16>:1,7,8,3,9;ConvOclBwdWrW2<8>:1,7,8,3,9;ConvOclBwdWrW2<2>:1,7,8,3,9
256-14-14-3x3-256-28-28-64-1x1-2x2-1x1-0-NCHW-FP32-W=ConvAsmBwdWrW3x3:0,0,8,8,7,1
64-54-54-1x1-16-54-54-1-0x0-1x1-1x1-0-NCHW-FP32-W=ConvAsmBwdWrW1x1:4,4,2,2,2,1,1,4,0,2
128-27-27-3x3-32-27-27-1-1x1-1x1-1x1-0-NCHW-FP16-B=ConvOclDirectFwd:16,16,16,16,1,1,1,4,1
128-14-14-1x1-1632-14-14-16-0x0-1x1-1x1-0-NCHW-FP32-W=ConvAsmBwdWrW1x1:2,8,4,4,8,1,1,4,0,1
1920-14-14-1x1-192-14-14-1024-0x0-1x1-1x1-0-NCHW-FP16-F=ConvAsm1x1U:2,8,4,64,1,4,1,4;ConvOclDirectFwd1x1:1,256,1,1,0,2,8,4,0
512-14-14-1x1-2048-14-14-256-0x0-1x1-1x1-0-NCHW-FP16-W=ConvAsmBwdWrW1x1:1,16,4,8,4,1,1,2,0,2
116-14-14-1x1-116-14-14-256-0x0-1x1-1x1-0-NCHW-FP32-W=ConvAsmBwdWrW1x1:4,4,4,4,4,1,4,4,0,2
384-35-35-3x3-384-17-17-8-0x0-2x2-1x1-0-NCHW-FP32-F=ConvOclDirectFwd:8,32,32,32,4,1,8,1,2
192-14-14-1x1-1872-14-14-16-0x0-1x1-1x1-0-NCHW-FP16-W=ConvAsmBwdWrW1x1:4,4,8,4,4,1,1,2,0,1
128-56-56-1x1-64-56-56-4-0x0-1x1-1x1-0-NCHW-FP16-W=ConvAsmBwdWrW1x1:2,8,2,4,2,1,4,4,0,1
240-7-7-3x3-240-7-7-8-1x1-1x1-1x1-0-NCHW-FP32-W=ConvAsmBwdWrW3x3:0,1,8,2,6,1
16-28-28-5x5-32-28-28-32-2x2-1x1-1x1-0-NCHW-FP32-F=ConvOclDirectFwd:16,16,32,32,2,2,4,2,2;ConvOclDirectFwdFused:16,16,32,32,2,2,4,1,2
384-27-27-1x1-64-27-27-8-0x0-1x1-1x1-0-NCHW-FP32-F=ConvAsm1x1U:3,8,3,64,1,4,2,2;ConvOclDirectFwd1x1:1,64,1,1,1,4,16,2048,0
192-14-14-1x1-1776-14-14-4-0x0-1x1-1x1-0-NCHW-FP16-W=ConvAsmBwdWrW1x1:2,8,4,8,2,1,1,4,0,1
192-14-14-1x1-432-14-14-32-0x0-1x1-1x1-0-NCHW-FP32-W=ConvAsmBwdWrW1x1:1,16,2,4,8,1,2,4,0,1
128-7-7-1x1-1280-7-7-8-0x0-1x1-1x1-0-NCHW-FP16-B=ConvAsm1x1U:2,8,4,16,1,2,4,1;ConvOclDirectFwd1x1:1,256,1,1,0,1,4,4,0
232-7-7-1x1-232-7-7-16-0x0-1x1-1x1-0-NCHW-FP32-B=ConvAsm1x1U:2,8,2,32,1,2,4,2;ConvOclDirectFwd1x1:1,128,1,1,0,1,16,4,0
512-7-7-1x1-128-7-7-32-0x0-1x1-1x1-0-NCHW-FP32-B=ConvAsm1x1U:1,16,1,64,1,2,4,4;ConvOclDirectFwd1x1:1,256,1,1,0,1,4,8,0
24-14-14-5x5-64-14-14-32-2x2-1x1-1x1-0-NCHW-FP32-F=ConvOclDirectFwd:16,16,8,16,4,2,1,4,2;ConvOclDirectFwdFused:8,8,16,16,2,2,2,1,2
16-55-55-1x1-64-55-55-128-0x0-1x1-1x1-0-NCHW-FP32-B=ConvAsm1x1U:1,16,1,64,1,1,2,2;ConvOclDirectFwd1x1:1,256,1,1,0,1,32,4,0
1280-8-8-1x1-192-8-8-16-0x0-1x1-1x1-0-NCHW-FP32-F=ConvAsm1x1U:2,8,2,32,1,4,4,2;ConvActivAsm1x1U:1,16,1,64,4,4;ConvOclDirectFwd1x1:1,64,1,1,1,0,16,256,0
1344-7-7-1x1-192-7-7-4-0x0-1x1-1x1-0-NCHW-FP32-F=ConvAsm1x1U:1,8,1,64,1,4,4,1;ConvOclDirectFwd1x1:1,64,1,1,1,0,16,128,0
128-7-7-1x1-576-7-7-32-0x0-1x1-1x1-0-NCHW-FP16-F=ConvAsm1x1U:1,8,2,32,1,4,1,1;ConvOclDirectFwd1x1:1,256,1,1,0,1,8,4,0
128-14-14-1x1-384-14-14-16-0x0-1x1-1x1-0-NCHW-FP32-F=ConvAsm1x1U:1,8,1,32,3,4,1,8;ConvOclDirectFwd1x1:1,64,1,1,1,0,16,256,0
128-14-14-1x1-1696-14-14-4-0x0-1x1-1x1-0-NCHW-FP16-B=ConvAsm1x1U:1,16,2,16,1,2,2,4;ConvOclDirectFwd1x1:1,128,1,1,0,1,4,4,0
512-15-15-3x3-512-29-29-8-1x1-2x2-1x1-0-NCHW-FP32-W_g32=ConvOclBwdWrW2<1>:1,6,8,1,5;ConvOclBwdWrW2<4>:1,6,8,1,5;ConvAsmBwdWrW3x3:0,0,8,4,5,2;ConvOclBwdWrW2<8>:1,6,8,1,5;ConvOclBwdWrW2<2>:1,6,8,1,5
64-13-13-3x3-256-13-13-64-1x1-1x1-1x1-0-NCHW-FP16-W=ConvAsmBwdWrW3x3:0,0,8,4,4,4
1056-14-14-1x1-2112-14-14-1-0x0-1x1-1x1-0-NCHW-FP32-W=ConvAsmBwdWrW1x1:1,16,2,4,8,1,1,4,0,1
512-29-29-1x1-128-29-29-128-0x0-1x1-1x1-0-NCHW-FP32-W=ConvAsmBwdWrW1x1:4,4,8,4,4,1,2,4,0,0
64-56-56-3x3-192-56-56-8-1x1-1x1-1x1-0-NCHW-FP16-F=ConvOclDirectFwd:16,16,32,32,2,2,8,1,2;ConvOclDirectFwdFused:32,8,32,32,1,4,8,1,2
128-14-14-1x1-1440-14-14-256-0x0-1x1-1x1-0-NCHW-FP16-W=ConvAsmBwdWrW1x1:4,4,8,4,4,1,2,2,0,2
256-56-56-3x3-128-56-56-64-1x1-1x1-1x1-0-NCHW-FP32-W=ConvAsmBwdWrW3x3:0,1,16,4,3,1
256-28-28-1x1-64-56-56-32-0x0-2x2-1x1-0-NCHW-FP32-B=ConvAsm1x1U:1,16,1,32,1,2,2,2;ConvOclDirectFwd1x1:1,64,1,1,0,1,32,4,0
64-55-55-1x1-16-55-55-512-0x0-1x1-1x1-0-NCHW-FP16-W=ConvAsmBwdWrW1x1:4,4,2,2,2,1,4,4,0,1
192-14-14-1x1-384-14-14-2-0x0-1x1-1x1-0-NCHW-FP16-B=ConvAsm1x1U:1,8,2,32,1,2,4,1;ConvOclDirectFwd1x1:1,256,1,1,0,1,4,4,0
320-8-8-3x3-192-17-17-8-0x0-2x2-1x1-0-NCHW-FP32-B=ConvOclDirectFwd:32,8,32,32,1,4,8,2,2
256-20-84-3x3-256-20-84-2-1x1-1x1-1x1-0-NCHW-FP16-F=ConvOclDirectFwd:8,32,32,32,4,1,8,4,2
128-14-14-1x1-768-14-14-256-0x0-1x1-1x1-0-NCHW-FP32-B=ConvAsm1x1U:1,32,1,16,2,1,1,4;ConvOclDirectFwd1x1:1,256,1,1,0,4,16,4,0
16-54-54-1x1-96-54-54-512-0x0-1x1-1x1-0-NCHW-FP32-F=ConvAsm1x1U:1,16,1,64,1,2,2,1;ConvOclDirectFwd1x1:1,64,1,1,1,1,16,2048,0
192-14-14-1x1-1920-14-14-256-0x0-1x1-1x1-0-NCHW-FP32-B=ConvAsm1x1U:1,32,1,16,2,1,1,2;ConvOclDirectFwd1x1:1,256,1,1,0,1,32,4,0
192-14-14-1x1-864-14-14-8-0x0-1x1-1x1-0-NCHW-FP32-B=ConvAsm1x1U:1,16,1,32,1,2,2,2;ConvOclDirectFwd1x1:8,64,16,16,0,2,16,4,1
576-14-14-1x1-128-14-14-512-0x0-1x1-1x1-0-NCHW-FP16-W=ConvAsmBwdWrW1x1:2,8,4,8,2,1,4,4,0,2
4-3-3-3x3-3-2-2-32-1x1-2x2-1x1-0-NCHW-FP32-F=ConvOclDirectFwd:8,8,8,8,1,1,2,1,2
192-14-14-1x1-1200-14-14-1-0x0-1x1-1x1-0-NCHW-FP16-W=ConvAsmBwdWrW1x1:1,16,2,4,4,1,1,4,0,0
128-28-28-1x1-512-28-28-2-0x0-1x1-1x1-0-NCHW-FP16-B=ConvAsm1x1U:1,16,2,32,1,2,2,1;ConvOclDirectFwd1x1:1,256,1,1,0,4,16,4,0
116-14-14-1x1-116-14-14-1024-0x0-1x1-1x1-0-NCHW-FP16-B=ConvAsm1x1U:3,4,6,4,2,4,1,8;ConvOclDirectFwd1x1:1,64,1,1,0,4,4,4,0
288-35-35-1x1-64-35-35-1-0x0-1x1-1x1-0-NCHW-FP32-F=ConvAsm1x1U:1,8,1,64,1,2,4,1;ConvActivAsm1x1U:1,16,2,32,1,4;ConvOclDirectFwd1x1:1,64,1,1,1,1,16,64,0
1024-14-14-1x1-128-14-14-4-0x0-1x1-1x1-0-NCHW-FP32-F=ConvAsm1x1U:2,8,2,64,1,4,4,1;ConvOclDirectFwd1x1:1,64,1,1,1,1,16,128,0
128-7-7-1x1-1248-7-7-4-0x0-1x1-1x1-0-NCHW-FP16-W=ConvAsmBwdWrW1x1:2,8,2,8,2,1,1,4,0,1
256-14-14-1x1-512-28-28-128-0x0-2x2-1x1-0-NCHW-FP16-W=ConvAsmBwdWrW1x1:2,8,4,8,2,1,4,4,0,2
1024-8-8-3x3-1024-8-8-48-1x1-1x1-1x1-0-NCHW-FP32-F_g32=ConvOclDirectFwd:8,8,8,8,1,1,8,2,2
128-7-7-1x1-736-7-7-512-0x0-1x1-1x1-0-NCHW-FP16-B=ConvAsm1x1U:2,16,4,16,1,2,1,1;ConvOclDirectFwd1x1:1,256,1,1,0,1,8,4,0
256-27-27-3x3-64-27-27-32-1x1-1x1-1x1-0-NCHW-FP32-W=ConvAsmBwdWrW3x3:0,0,8,4,3,4
448-14-14-1x1-128-14-14-4-0x0-1x1-1x1-0-NCHW-FP32-F=ConvAsm1x1U:2,8,2,64,1,4,4,2;ConvOclDirectFwd1x1:1,64,1,1,1,0,16,64,0
128-14-14-1x1-1344-14-14-2-0x0-1x1-1x1-0-NCHW-FP32-W=ConvAsmBwdWrW1x1:1,16,2,4,8,1,2,4,0,0
240-28-28-1x1-60-28-28-4-0x0-1x1-1x1-0-NCHW-FP32-B_g3=ConvOclDirectFwd:16,16,16,16,1,1,8,4,2
512-7-7-1x1-1024-14-14-32-0x0-2x2-1x1-0-NCHW-FP32-W=ConvAsmBwdWrW1x1:1,16,2,8,4,1,2,4,0,3
128-7-7-1x1-1120-7-7-1-0x0-1x1-1x1-0-NCHW-FP32-B=ConvAsm1x1U:1,8,1,64,1,4,4,4;ConvOclDirectFwd1x1:1,64,1,1,0,1,4,4,0
128-7-7-1x1-640-7-7-4-0x0-1x1-1x1-0-NCHW-FP32-B=ConvAsm1x1U:1,8,1,64,1,2,4,2;ConvOclDirectFwd1x1:1,128,1,1,0,1,4,4,0
128-14-14-1x1-1536-14-14-32-0x0-1x1-1x1-0-NCHW-FP16-W=ConvAsmBwdWrW1x1:2,8,8,8,2,1,1,4,0,1
192-14-14-1x1-1728-14-14-512-0x0-1x1-1x1-0-NCHW-FP32-B=ConvAsm1x1U:1,32,1,16,2,1,1,4;ConvOclDirectFwd1x1:1,128,1,1,0,1,32,4,0
54-28-28-1x1-216-28-28-256-0x0-1x1-1x1-0-NCHW-FP16-F_g3=ConvOclDirectFwd:16,16,16,16,1,1,8,2,2
128-28-28-3x3-128-56-56-64-1x1-2x2-1x1-0-NCHW-FP16-B=ConvOclDirectFwd:8,16,32,32,4,2,8,2,1
256-13-13-3x3-384-13-13-128-1x1-1x1-1x1-0-NCHW-FP16-B=ConvOclDirectFwd:8,8,16,16,2,2,8,2,1
64-54-54-1x1-16-54-54-16-0x0-1x1-1x1-0-NCHW-FP16-W=ConvAsmBwdWrW1x1:4,4,2,1,4,1,4,4,0,1
128-56-56-3x3-128-56-56-256-1x1-1x1-1x1-0-NCHW-FP32-F_g32=ConvOclDirectFwd:8,32,16,32,2,1,8,4,1
1632-14-14-1x1-192-14-14-64-0x0-1x1-1x1-0-NCHW-FP32-F=ConvAsm1x1U:2,16,3,16,2,2,1,2;ConvOclDirectFwd1x1:1,64,1,1,1,1,16,2048,0
192-14-14-1x1-480-14-14-16-0x0-1x1-1x1-0-NCHW-FP16-W=ConvAsmBwdWrW1x1:2,8,8,4,2,1,1,4,0,1
480-14-14-1x1-96-14-14-512-0x0-1x1-1x1-0-NCHW-FP32-F=ConvAsm1x1U:4,8,4,64,2,2,1,4;ConvActivAsm1x1U:1,32,1,32,3,1;ConvOclDirectFwd1x1:1,64,1,1,1,1,16,2048,0
1536-14-14-1x1-192-14-14-128-0x0-1x1-1x1-0-NCHW-FP32-F=ConvAsm1x1U:3,16,4,64,1,2,1,1;ConvOclDirectFwd1x1:1,64,1,1,1,1,16,2048,0
256-14-14-3x3-256-14-14-256-1x1-1x1-1x1-0-NCHW-FP32-W=ConvAsmBwdWrW3x3:0,1,8,4,3,1
128-7-7-1x1-896-7-7-512-0x0-1x1-1x1-0-NCHW-FP16-W=ConvAsmBwdWrW1x1:2,8,8,4,4,2,2,2,0,2
960-7-7-1x1-240-7-7-512-0x0-1x1-1x1-0-NCHW-FP16-F_g3=ConvOclDirectFwd:8,8,8,8,1,1,8,2,1
192-14-14-1x1-1728-14-14-1-0x0-1x1-1x1-0-NCHW-FP32-W=ConvAsmBwdWrW1x1:1,16,4,4,4,1,1,4,0,0
160-17-17-1x1-768-17-17-256-0x0-1x1-1x1-0-NCHW-FP32-F=ConvAsm1x1U:2,16,2,32,3,2,1,4;ConvOclDirectFwd1x1:1,64,1,1,1,0,64,2048,0
192-14-14-1x1-528-14-14-512-0x0-1x1-1x1-0-NCHW-FP32-B=ConvAsm1x1U:2,16,2,64,1,2,1,2;ConvOclDirectFwd1x1:1,256,1,1,0,4,16,4,0
128-56-56-1x1-128-56-56-2-0x0-1x1-1x1-0-NCHW-FP16-F=ConvAsm1x1U:1,8,2,32,1,4,2,2;ConvOclDirectFwd1x1:1,64,1,1,0,4,16,4,0
128-56-56-1x1-192-56-56-512-0x0-1x1-1x1-0-NCHW-FP32-F=ConvAsm1x1U:2,16,2,64,2,2,1,4;ConvOclDirectFwd1x1:1,64,1,1,1,1,16,256,0
232-7-7-1x1-232-7-7-4-0x0-1x1-1x1-0-NCHW-FP32-W=ConvAsmBwdWrW1x1:1,16,2,4,2,1,1,4,0,1
192-14-14-1x1-1728-14-14-256-0x0-1x1-1x1-0-NCHW-FP32-B=ConvAsm1x1U:1,32,1,16,2,1,2,1;ConvOclDirectFwd1x1:1,128,1,1,0,1,32,4,0
1056-7-7-1x1-128-7-7-2-0x0-1x1-1x1-0-NCHW-FP16-F=ConvAsm1x1U:1,8,2,16,1,4,4,1;ConvOclDirectFwd1x1:1,64,1,1,0,1,4,8,0
1120-7-7-1x1-128-7-7-64-0x0-1x1-1x1-0-NCHW-FP16-F=ConvAsm1x1U:2,8,4,16,1,4,4,2;ConvOclDirectFwd1x1:1,128,1,1,0,1,8,4,0
736-14-14-1x1-128-14-14-256-0x0-1x1-1x1-0-NCHW-FP32-W=ConvAsmBwdWrW1x1:2,8,4,8,4,1,2,4,0,2
256-56-56-1x1-512-28-28-1-0x0-2x2-1x1-0-NCHW-FP32-F=ConvAsm1x1U:2,8,2,64,1,4,1,8;ConvOclDirectFwd1x1:1,64,1,1,1,0,16,128,0
128-7-7-1x1-1376-7-7-8-0x0-1x1-1x1-0-NCHW-FP16-W=ConvAsmBwdWrW1x1:1,16,2,8,2,1,2,4,0,0
896-14-14-1x1-1792-14-14-2-0x0-1x1-1x1-0-NCHW-FP16-W=ConvAsmBwdWrW1x1:1,16,2,8,4,1,1,4,0,1
2048-32-32-1x1-1024-64-64-4-0x0-2x2-1x1-0-NCHW-FP32-W=ConvAsmBwdWrW1x1:2,8,4,4,8,1,1,4,0,1
256-35-35-1x1-64-35-35-256-0x0-1x1-1x1-0-NCHW-FP16-F=ConvAsm1x1U:2,16,4,64,1,2,1,2;ConvOclDirectFwd1x1:16,64,32,32,0,1,16,4,1
608-14-14-1x1-128-14-14-16-0x0-1x1-1x1-0-NCHW-FP16-F=ConvAsm1x1U:2,8,4,64,1,4,4,4;ConvOclDirectFwd1x1:1,64,1,1,0,4,4,4,0
192-7-7-1x1-832-7-7-4-0x0-1x1-1x1-0-NCHW-FP16-W=ConvAsmBwdWrW1x1:1,16,2,8,2,1,2,4,0,1
128-7-7-1x1-960-7-7-64-0x0-1x1-1x1-0-NCHW-FP32-B=ConvAsm1x1U:2,16,2,32,1,2,1,4;ConvOclDirectFwd1x1:1,64,1,1,0,1,16,8,0
128-27-27-1x1-32-27-27-32-0x0-1x1-1x1-0-NCHW-FP32-F=ConvAsm1x1U:2,8,2,64,2,2,2,2;ConvOclDirectFwd1x1:1,64,1,1,1,0,16,2048,0
512-7-7-1x1-128-7-7-32-0x0-1x1-1x1-0-NCHW-FP16-F=ConvAsm1x1U:1,8,2,16,1,4,4,2;ConvOclDirectFwd1x1:1,64,1,1,0,1,4,8,0
1824-7-7-1x1-128-7-7-512-0x0-1x1-1x1-0-NCHW-FP16-F=ConvAsm1x1U:2,8,4,16,1,4,2,2;ConvOclDirectFwd1x1:1,256,1,1,0,1,8,4,0
128-14-14-1x1-864-14-14-16-0x0-1x1-1x1-0-NCHW-FP32-W=ConvAsmBwdWrW1x1:1,16,2,4,8,1,2,4,0,1
1216-14-14-1x1-128-14-14-128-0x0-1x1-1x1-0-NCHW-FP32-F=ConvAsm1x1U:4,8,4,64,1,4,1,4;ConvOclDirectFwd1x1:1,64,1,1,1,1,16,2048,0
256-28-28-1x1-512-28-28-8-0x0-1x1-1x1-0-NCHW-FP32-B=ConvAsm1x1U:1,16,1,32,1,2,1,2;ConvOclDirectFwd1x1:16,64,32,32,0,2,16,4,1
128-14-14-1x1-1376-14-14-1-0x0-1x1-1x1-0-NCHW-FP16-W=ConvAsmBwdWrW1x1:2,8,2,4,4,1,1,2,0,1
60-28-28-3x3-60-14-14-1024-1x1-2x2-1x1-0-NCHW-FP32-F=ConvOclDirectFwd:16,16,16,16,1,1,4,2,2
256-57-57-1x1-64-57-57-2-0x0-1x1-1x1-0-NCHW-FP32-W=ConvAsmBwdWrW1x1:4,4,4,2,2,2,1,4,0,1
192-28-28-1x1-432-28-28-1024-0x0-1x1-1x1-0-NCHW-FP16-B=ConvAsm1x1U:1,16,2,16,1,2,1,4;ConvOclDirectFwd1x1:1,256,1,1,0,4,16,4,0
256-28-28-1x1-512-28-28-512-0x0-1x1-1x1-0-NCHW-FP32-B=ConvAsm1x1U:2,32,2,16,1,1,1,1;ConvOclDirectFwd1x1:1,256,1,1,0,1,32,4,0
32-28-28-1x1-256-28-28-256-0x0-1x1-1x1-0-NCHW-FP16-W=ConvAsmBwdWrW1x1:4,4,4,2,4,1,4,2,0,3
96-14-14-1x1-480-14-14-64-0x0-1x1-1x1-0-NCHW-FP16-B=ConvAsm1x1U:1,16,2,16,1,2,1,4;ConvOclDirectFwd1x1:1,64,1,1,0,4,8,4,0
64-6-60-3x3-128-6-60-1-1x1-1x1-1x1-0-NCHW-FP16-F=ConvOclDirectFwd:8,32,8,32,1,1,1,4,1
192-28-28-1x1-64-28-28-4-0x0-1x1-1x1-0-NCHW-FP32-F=ConvAsm1x1U:2,8,2,32,1,4,2,4;ConvActivAsm1x1U:2,16,2,16,1,3;ConvOclDirectFwd1x1:1,64,1,1,1,0,16,2048,0
128-14-14-1x1-1536-14-14-256-0x0-1x1-1x1-0-NCHW-FP16-W=ConvAsmBwdWrW1x1:2,8,4,8,2,1,2,4,0,2
120-7-7-1x1-480-7-7-8-0x0-1x1-1x1-0-NCHW-FP32-F_g3=ConvOclDirectFwd:8,8,8,8,1,1,8,4,2
1024-8-8-1x1-2048-8-8-64-0x0-1x1-1x1-0-NCHW-FP32-W=ConvAsmBwdWrW1x1:1,16,4,4,8,1,1,4,0,1
192-14-14-1x1-912-14-14-256-0x0-1x1-1x1-0-NCHW-FP32-W=ConvAsmBwdWrW1x1:1,16,2,8,4,1,4,4,0,3
96-56-56-1x1-128-56-56-256-0x0-1x1-1x1-0-NCHW-FP32-B=ConvAsm1x1U:1,32,1,32,1,1,1,1;ConvOclDirectFwd1x1:1,128,1,1,0,2,32,4,0
120-14-14-1x1-480-14-14-512-0x0-1x1-1x1-0-NCHW-FP32-F_g3=ConvOclDirectFwd:8,16,8,16,1,1,8,2,2
128-14-14-1x1-256-14-14-128-0x0-1x1-1x1-0-NCHW-FP16-B=ConvAsm1x1U:1,16,2,16,1,2,1,8;ConvOclDirectFwd1x1:1,64,1,1,0,4,8,4,0
448-14-14-1x1-128-14-14-8-0x0-1x1-1x1-0-NCHW-FP32-F=ConvAsm1x1U:2,8,4,64,1,4,4,2;ConvOclDirectFwd1x1:1,64,1,1,1,1,16,128,0
1120-7-7-1x1-128-7-7-4-0x0-1x1-1x1-0-NCHW-FP16-F=ConvAsm1x1U:1,8,2,16,1,4,4,1;ConvOclDirectFwd1x1:1,64,1,1,0,1,4,8,0
128-28-28-1x1-224-28-28-128-0x0-1x1-1x1-0-NCHW-FP16-W=ConvAsmBwdWrW1x1:2,8,4,8,2,1,4,4,0,1
256-56-56-1x1-128-56-56-6-0x0-1x1-1x1-0-NCHW-FP32-W=ConvAsmBwdWrW1x1:4,4,4,4,2,1,1,4,0,1
1920-14-14-1x1-192-14-14-64-0x0-1x1-1x1-0-NCHW-FP32-F=ConvAsm1x1U:2,16,4,64,1,2,1,1;ConvOclDirectFwd1x1:1,64,1,1,1,1,16,2048,0
32-147-147-3x3-32-149-149-16-0x0-1x1-1x1-0-NCHW-FP32-B=ConvOclDirectFwd:16,16,32,32,2,2,8,2,1
320-8-8-1x1-1280-8-8-2-0x0-1x1-1x1-0-NCHW-FP16-B=ConvAsm1x1U:1,8,2,32,1,2,4,1;ConvOclDirectFwd1x1:1,64,1,1,0,1,4,4,0
1120-7-7-1x1-128-7-7-256-0x0-1x1-1x1-0-NCHW-FP32-F=ConvAsm1x1U:4,16,4,16,1,2,1,4;ConvOclDirectFwd1x1:1,64,1,1,1,0,16,2048,0
128-28-28-1x1-256-55-55-128-0x0-2x2-1x1-0-NCHW-FP32-B=ConvAsm1x1U:1,32,1,16,1,1;ConvOclDirectFwd1x1:1,256,1,1,0,1,32,4,0
320-7-7-3x3-192-7-7-32-1x1-1x1-1x1-0-NCHW-FP16-W=ConvAsmBwdWrW3x3:0,0,8,4,4,1
544-14-14-1x1-128-14-14-16-0x0-1x1-1x1-0-NCHW-FP32-F=ConvAsm1x1U:4,8,4,64,1,4,2,2;ConvOclDirectFwd1x1:1,64,1,1,1,1,16,256,0
192-14-14-1x1-720-14-14-1024-0x0-1x1-1x1-0-NCHW-FP16-W=ConvAsmBwdWrW1x1:2,8,4,8,2,1,4,2,0,2
768-7-7-1x1-128-7-7-128-0x0-1x1-1x1-0-NCHW-FP16-W=ConvAsmBwdWrW1x1:2,8,4,8,2,2,2,4,0,1
256-28-28-1x1-512-28-28-512-0x0-1x1-1x1-0-NCHW-FP32-W=ConvAsmBwdWrW1x1:2,8,2,8,8,2,2,4,0,1
48-35-35-5x5-64-35-35-1-2x2-1x1-1x1-0-NCHW-FP16-F=ConvOclDirectFwd:8,32,16,32,2,1,2,4,1;ConvOclDirectFwdFused:16,16,16,16,1,1,2,4,1
128-56-56-1x1-128-56-56-256-0x0-1x1-1x1-0-NCHW-FP16-W=ConvAsmBwdWrW1x1:4,4,4,2,8,1,4,4,0,2
128-27-27-1x1-32-27-27-8-0x0-1x1-1x1-0-NCHW-FP32-B=ConvAsm1x1U:1,8,1,32,1,4,2,2;ConvOclDirectFwd1x1:1,256,1,1,0,1,4,8,0
32-79-341-5x20-1-161-700-4-0x0-2x2-1x1-0-NCHW-FP32-B=ConvOclDirectFwd:16,16,16,32,1,2,1,1,2
128-14-14-1x1-1408-14-14-4-0x0-1x1-1x1-0-NCHW-FP32-W=ConvAsmBwdWrW1x1:1,16,2,4,8,1,1,4,0,1
16-55-55-1x1-128-55-55-256-0x0-1x1-1x1-0-NCHW-FP32-W=ConvAsmBwdWrW1x1:4,4,2,4,2,1,4,4,0,1
192-14-14-1x1-1920-14-14-64-0x0-1x1-1x1-0-NCHW-FP32-W=ConvAsmBwdWrW1x1:2,8,4,8,4,1,2,4,0,1
128-56-56-1x1-64-56-56-256-0x0-1x1-1x1-0-NCHW-FP16-W=ConvAsmBwdWrW1x1:4,4,8,1,8,2,4,4,0,1
832-7-7-1x1-128-7-7-256-0x0-1x1-1x1-0-NCHW-FP32-F=ConvAsm1x1U:1,16,1,64,4,2,4,1;ConvActivAsm1x1U:1,16,1,64,4,1;ConvOclDirectFwd1x1:1,64,1,1,1,4,16,2048,0
128-7-7-1x1-1600-7-7-32-0x0-1x1-1x1-0-NCHW-FP16-B=ConvAsm1x1U:1,16,2,32,1,2,2,2;ConvOclDirectFwd1x1:1,128,1,1,0,1,8,4,0
128-14-14-1x1-448-14-14-4-0x0-1x1-1x1-0-NCHW-FP16-W=ConvAsmBwdWrW1x1:2,8,2,4,2,1,1,4,0,1
384-8-8-1x1-2048-8-8-64-0x0-1x1-1x1-0-NCHW-FP16-W=ConvAsmBwdWrW1x1:2,8,4,4,4,1,1,4,0,0
64-35-35-1x1-384-35-35-16-0x0-1x1-1x1-0-NCHW-FP32-W=ConvAsmBwdWrW1x1:2,8,4,8,2,1,4,4,0,1
1776-14-14-1x1-192-14-14-64-0x0-1x1-1x1-0-NCHW-FP32-F=ConvAsm1x1U:3,8,7,32,1,2,2,2;ConvOclDirectFwd1x1:1,64,1,1,1,1,16,2048,0
128-7-7-1x1-1728-7-7-4-0x0-1x1-1x1-0-NCHW-FP32-W=ConvAsmBwdWrW1x1:1,16,2,4,8,1,1,4,0,1
960-14-14-1x1-128-14-14-128-0x0-1x1-1x1-0-NCHW-FP32-B=ConvAsm1x1U:1,32,1,16,2,1,4,1;ConvOclDirectFwd1x1:1,128,1,1,0,2,16,4,0
512-7-7-1x1-256-14-14-64-0x0-2x2-1x1-0-NCHW-FP32-B=ConvAsm1x1U:2,16,2,32,1,2,4,1;ConvOclDirectFwd1x1:1,256,1,1,0,1,16,4,0
128-7-7-1x1-1248-7-7-128-0x0-1x1-1x1-0-NCHW-FP32-B=ConvAsm1x1U:2,16,2,32,1,2,1,4;ConvOclDirectFwd1x1:1,256,1,1,0,1,16,4,0
192-14-14-1x1-1488-14-14-512-0x0-1x1-1x1-0-NCHW-FP32-W=ConvAsmBwdWrW1x1:2,8,4,8,4,1,2,4,0,2
16-55-55-1x1-128-55-55-16-0x0-1x1-1x1-0-NCHW-FP16-W=ConvAsmBwdWrW1x1:4,4,2,4,2,1,4,4,0,1
512-29-29-1x1-512-29-29-128-0x0-1x1-1x1-0-NCHW-FP32-F=ConvAsm1x1U:3,16,3,64,2,2,1,4;ConvOclDirectFwd1x1:1,64,1,1,1,4,32,2048,0
128-14-14-1x1-704-14-14-2-0x0-1x1-1x1-0-NCHW-FP16-W=ConvAsmBwdWrW1x1:2,8,2,4,4,1,2,4,0,0
1024-7-7-3x3-1024-14-14-2-1x1-2x2-1x1-0-NCHW-FP16-W_g32=ConvOclBwdWrW2<1>:1,7,8,1,7;ConvAsmBwdWrW3x3:0,0,8,4,5,1;ConvOclBwdWrW2<2>:1,7,8,1,7
128-14-14-1x1-320-14-14-256-0x0-1x1-1x1-0-NCHW-FP32-B=ConvAsm1x1U:1,16,1,32,2,2,2,2;ConvOclDirectFwd1x1:1,128,1,1,0,1,32,4,0
256-56-56-3x3-128-56-56-256-1x1-1x1-1x1-0-NCHW-FP16-F=ConvOclDirectFwd:16,16,32,32,2,2,8,1,1
60-28-28-1x1-240-28-28-128-0x0-1x1-1x1-0-NCHW-FP32-B_g3=ConvOclDirectFwd:16,16,16,16,1,1,8,2,2
128-28-28-1x1-512-28-28-1-0x0-1x1-1x1-0-NCHW-FP16-B=ConvAsm1x1U:1,8,2,64,1,4,2,2;ConvOclDirectFwd1x1:1,64,1,1,0,2,4,4,0
192-14-14-1x1-624-14-14-16-0x0-1x1-1x1-0-NCHW-FP32-B=ConvAsm1x1U:1,16,1,32,2,2,2,2;ConvOclDirectFwd1x1:1,128,1,1,0,4,16,4,0
3-224-224-7x7-64-112-112-64-3x3-2x2-1x1-0-NCHW-FP32-F=ConvOclDirectFwd:16,8,16,16,1,2,8,1,2
1344-14-14-1x1-128-14-14-4-0x0-1x1-1x1-0-NCHW-FP32-F=ConvAsm1x1U:2,8,2,64,1,4,4,2;ConvOclDirectFwd1x1:1,64,1,1,1,4,16,256,0
128-14-14-3x3-128-28-28-256-1x1-2x2-1x1-0-NCHW-FP32-B=ConvOclDirectFwd:32,16,32,32,1,2,4,4,1
1680-7-7-1x1-192-7-7-8-0x0-1x1-1x1-0-NCHW-FP32-F=ConvAsm1x1U:2,8,2,32,1,4,4,1;ConvOclDirectFwd1x1:1,64,1,1,1,1,16,128,0
2048-7-7-1x1-512-7-7-1-0x0-1x1-1x1-0-NCHW-FP32-B=ConvAsm1x1U:1,8,1,64,1,4,4,1;ConvOclDirectFwd1x1:1,128,1,1,0,1,4,8,0
192-14-14-1x1-720-14-14-128-0x0-1x1-1x1-0-NCHW-FP32-B=ConvAsm1x1U:2,16,2,16,1,1,1,4;ConvOclDirectFwd1x1:1,128,1,1,0,2,16,4,0
1024-8-8-3x3-1024-15-15-8-1x1-2x2-1x1-0-NCHW-FP32-W_g32=ConvOclBwdWrW2<1>:1,6,8,1,9;ConvOclBwdWrW2<4>:1,6,8,1,9;ConvAsmBwdWrW3x3:0,0,8,8,4,1;ConvOclBwdWrW2<8>:1,6,8,1,9;ConvOclBwdWrW2<2>:1,6,8,1,9
768-14-14-1x1-192-14-14-8-0x0-1x1-1x1-0-NCHW-FP32-F=ConvAsm1x1U:4,8,4,64,1,4,2,4;ConvOclDirectFwd1x1:1,64,1,1,1,0,32,128,0
96-14-14-1x1-480-14-14-4-0x0-1x1-1x1-0-NCHW-FP16-B=ConvAsm1x1U:1,8,2,32,1,4,2,2;ConvOclDirectFwd1x1:1,64,1,1,0,4,4,4,0
64-14-14-5x5-24-14-14-128-2x2-1x1-1x1-0-NCHW-FP32-B=ConvOclDirectFwd:16,16,16,16,4,4,1,1,2
160-56-56-1x1-128-56-56-64-0x0-1x1-1x1-0-NCHW-FP16-F=ConvAsm1x1U:2,8,4,32,1,4,1,8;ConvOclDirectFwd1x1:1,128,1,1,0,4,16,4,0
192-28-28-1x1-384-28-28-512-0x0-1x1-1x1-0-NCHW-FP32-B=ConvAsm1x1U:1,32,1,32,2,1,1,4;ConvOclDirectFwd1x1:1,256,1,1,0,4,16,4,0
1024-15-15-1x1-512-15-15-1-0x0-1x1-1x1-0-NCHW-FP32-W=ConvAsmBwdWrW1x1:1,16,4,4,4,1,1,4,0,0
640-7-7-1x1-128-7-7-512-0x0-1x1-1x1-0-NCHW-FP32-B=ConvAsm1x1U:2,16,2,32,1,2,2,2;ConvOclDirectFwd1x1:1,256,1,1,0,1,16,4,0
192-7-7-1x1-1296-7-7-4-0x0-1x1-1x1-0-NCHW-FP16-W=ConvAsmBwdWrW1x1:1,16,2,8,2,1,2,4,0,0
120-14-14-3x3-120-7-7-128-1x1-2x2-1x1-0-NCHW-FP32-F=ConvOclDirectFwd:8,8,8,8,1,1,8,2,1
96-112-112-7x7-3-224-224-8-3x3-2x2-1x1-0-NCHW-FP16-B=ConvOclDirectFwd:32,8,32,32,1,4,1,4,1
192-28-28-1x1-64-28-28-16-0x0-1x1-1x1-0-NCHW-FP16-F=ConvAsm1x1U:1,8,2,16,1,4,2,2;ConvOclDirectFwd1x1:1,64,1,1,0,2,8,4,0
256-19-19-1x1-512-19-19-32-0x0-1x1-1x1-0-NCHW-FP32-B=ConvAsm1x1U:1,32,1,64,2,1,2,2;ConvOclDirectFwd1x1:1,64,1,1,0,1,16,8,0
480-28-28-1x1-192-28-28-4-0x0-1x1-1x1-0-NCHW-FP16-F=ConvAsm1x1U:1,8,2,16,1,4,2,2;ConvOclDirectFwd1x1:1,64,1,1,0,2,4,4,0
64-56-56-1x1-64-56-56-1024-0x0-1x1-1x1-0-NCHW-FP16-F=ConvAsm1x1U:1,8,2,32,1,4,1,4;ConvOclDirectFwd1x1:1,256,1,1,0,4,16,4,0
256-14-14-1x1-1024-14-14-2-0x0-1x1-1x1-0-NCHW-FP32-F=ConvAsm1x1U:4,8,4,64,1,4,2,4;ConvActivAsm1x1U:2,16,4,64,1,4;ConvOclDirectFwd1x1:1,64,1,1,1,0,16,2048,0
512-15-15-3x3-512-15-15-128-1x1-1x1-1x1-0-NCHW-FP32-F_g32=ConvOclDirectFwd:16,8,16,16,1,2,8,1,2
192-8-8-1x1-2048-8-8-128-0x0-1x1-1x1-0-NCHW-FP32-W=ConvAsmBwdWrW1x1:2,8,4,4,8,2,2,4,0,1
1024-8-8-1x1-2048-8-8-128-0x0-1x1-1x1-0-NCHW-FP32-W=ConvAsmBwdWrW1x1:1,16,2,8,8,1,1,4,0,1
48-13-13-1x1-256-13-13-1024-0x0-1x1-1x1-0-NCHW-FP16-W=ConvAsmBwdWrW1x1:4,4,4,4,4,2,4,4,0,2
384-28-28-1x1-192-28-28-512-0x0-1x1-1x1-0-NCHW-FP32-F=ConvAsm1x1U:2,16,2,16,3,2,1,4;ConvOclDirectFwd1x1:1,64,1,1,1,4,32,2048,0
1280-8-8-1x1-320-8-8-2-0x0-1x1-1x1-0-NCHW-FP32-F=ConvAsm1x1U:1,8,1,64,1,4,4,1;ConvOclDirectFwd1x1:1,64,1,1,1,1,16,128,0
1024-8-8-3x3-1024-8-8-4-1x1-1x1-1x1-0-NCHW-FP32-B_g32=ConvOclDirectFwd:8,8,8,8,1,1,4,4,2
128-56-56-1x1-64-56-56-16-0x0-1x1-1x1-0-NCHW-FP16-W=ConvAsmBwdWrW1x1:2,8,2,4,2,1,4,4,0,1
96-54-54-1x1-16-54-54-1-0x0-1x1-1x1-0-NCHW-FP16-F=ConvAsm1x1U:1,8,2,64,1,4,4,1;ConvOclDirectFwd1x1:1,64,1,1,0,4,4,8,0
128-54-54-1x1-32-54-54-2-0x0-1x1-1x1-0-NCHW-FP16-F=ConvAsm1x1U:1,8,2,64,1,4,4,2;ConvOclDirectFwd1x1:1,64,1,1,0,4,8,4,0
128-14-14-5x5-32-14-14-1-2x2-1x1-1x1-0-NCHW-FP32-B=ConvOclDirectFwd:16,16,16,16,1,1,1,4,1
128-14-14-1x1-1408-14-14-1-0x0-1x1-1x1-0-NCHW-FP32-W=ConvAsmBwdWrW1x1:1,16,2,4,4,1,1,4,0,0
528-28-28-1x1-192-28-28-256-0x0-1x1-1x1-0-NCHW-FP16-F=ConvAsm1x1U:3,8,6,16,1,4,1,4;ConvOclDirectFwd1x1:1,128,1,1,0,4,16,4,0
992-7-7-1x1-128-7-7-8-0x0-1x1-1x1-0-NCHW-FP32-F=ConvAsm1x1U:1,8,1,32,1,4,4,1;ConvOclDirectFwd1x1:1,64,1,1,1,1,16,128,0
64-28-28-1x1-256-28-28-16-0x0-1x1-1x1-0-NCHW-FP32-B=ConvAsm1x1U:1,16,1,16,1,2,1,4;ConvOclDirectFwd1x1:1,128,1,1,0,2,16,4,0
672-14-14-1x1-128-14-14-128-0x0-1x1-1x1-0-NCHW-FP32-B=ConvAsm1x1U:1,32,1,32,2,1,2,2;ConvOclDirectFwd1x1:1,64,1,1,0,4,16,4,0
512-64-64-3x3-256-64-64-4-1x1-1x1-1x1-0-NCHW-FP32-W=ConvAsmBwdWrW3x3:0,0,16,4,4,1
256-29-29-1x1-512-29-29-8-0x0-1x1-1x1-0-NCHW-FP32-F=ConvAsm1x1U:4,16,4,16,1,2,2,2;ConvOclDirectFwd1x1:1,64,1,1,1,1,16,2048,0
16-54-54-1x1-96-54-54-512-0x0-1x1-1x1-0-NCHW-FP32-B=ConvAsm1x1U:1,32,1,64,1,1,2,2;ConvOclDirectFwd1x1:1,128,1,1,0,2,32,4,0
128-28-28-1x1-192-28-28-64-0x0-1x1-1x1-0-NCHW-FP32-B=ConvAsm1x1U:1,16,1,32,2,1,1,2;ConvOclDirectFwd1x1:1,128,1,1,0,4,16,4,0
256-56-56-1x1-128-56-56-512-0x0-1x1-1x1-0-NCHW-FP32-W=ConvAsmBwdWrW1x1:2,8,2,4,8,1,4,4,0,1
336-56-56-1x1-192-56-56-64-0x0-1x1-1x1-0-NCHW-FP16-F=ConvAsm1x1U:3,8,6,32,1,4,1,4;ConvOclDirectFwd1x1:1,64,1,1,0,4,16,4,0
256-56-56-1x1-128-56-56-2-0x0-1x1-1x1-0-NCHW-FP32-F=ConvAsm1x1U:4,8,7,64,1,2,2,2;ConvOclDirectFwd1x1:1,64,1,1,1,4,16,2048,0
576-7-7-1x1-128-7-7-4-0x0-1x1-1x1-0-NCHW-FP32-F=ConvAsm1x1U:1,8,1,64,1,4,4,1;ConvOclDirectFwd1x1:1,64,1,1,1,0,16,64,0
192-28-28-3x3-128-28-28-256-1x1-1x1-1x1-0-NCHW-FP32-W=ConvAsmBwdWrW3x3:0,1,8,4,4,4
192-14-14-1x1-1632-14-14-16-0x0-1x1-1x1-0-NCHW-FP16-B=ConvAsm1x1U:1,16,2,16,1,2,2,2;ConvOclDirectFwd1x1:1,64,1,1,0,4,16,4,0
1024-7-7-3x3-1024-14-14-6-1x1-2x2-1x1-0-NCHW-FP16-W_g32=ConvOclBwdWrW2<1>:1,7,8,1,7;ConvOclBwdWrW2<4>:1,7,8,1,7;ConvAsmBwdWrW3x3:0,0,8,4,3,1;ConvOclBwdWrW2<2>:1,7,8,1,7
480-14-14-1x1-128-14-14-16-0x0-1x1-1x1-0-NCHW-FP16-W=ConvAsmBwdWrW1x1:4,4,4,4,2,1,1,4,0,0
256-56-56-1x1-512-28-28-64-0x0-2x2-1x1-0-NCHW-FP16-F=ConvAsm1x1U:1,8,2,32,4,4,1,4;ConvOclDirectFwd1x1:16,64,32,32,0,2,16,4,1
256-19-19-3x3-512-10-10-32-1x1-2x2-1x1-0-NCHW-FP32-F=ConvOclDirectFwd:8,16,16,16,2,1,8,1,2
1584-14-14-1x1-192-14-14-128-0x0-1x1-1x1-0-NCHW-FP16-F=ConvAsm1x1U:2,8,4,64,1,4,1,8;ConvOclDirectFwd1x1:1,128,1,1,0,2,8,4,0
128-14-14-1x1-736-14-14-8-0x0-1x1-1x1-0-NCHW-FP32-B=ConvAsm1x1U:1,16,1,32,1,2,1,1;ConvOclDirectFwd1x1:1,64,1,1,0,4,16,4,0
192-14-14-1x1-1248-14-14-4-0x0-1x1-1x1-0-NCHW-FP32-W=ConvAsmBwdWrW1x1:1,16,2,4,8,1,1,4,0,1
768-7-7-1x1-128-7-7-64-0x0-1x1-1x1-0-NCHW-FP32-W=ConvAsmBwdWrW1x1:1,16,2,8,4,1,2,4,0,2
256-32-32-1x1-2048-32-32-4-0x0-1x1-1x1-0-NCHW-FP32-B=ConvAsm1x1U:2,32,2,64,1,1,1,2;ConvOclDirectFwd1x1:1,64,1,1,0,2,16,4,0
960-7-7-1x1-240-7-7-128-0x0-1x1-1x1-0-NCHW-FP32-B_g3=ConvOclDirectFwd:8,8,8,8,1,1,8,4,2
128-7-7-1x1-608-7-7-64-0x0-1x1-1x1-0-NCHW-FP16-F=ConvAsm1x1U:2,8,4,16,1,2,1,2;ConvOclDirectFwd1x1:1,128,1,1,0,1,8,4,0
288-28-28-1x1-192-28-28-64-0x0-1x1-1x1-0-NCHW-FP16-F=ConvAsm1x1U:3,8,6,16,1,4,1,4;ConvOclDirectFwd1x1:1,256,1,1,0,4,8,4,0
192-56-56-1x1-96-56-56-1024-0x0-1x1-1x1-0-NCHW-FP16-B=ConvOclDirectFwd1x1:1,128,1,1,0,4,16,4,0
3-2-2-3x3-4-3-3-256-1x1-2x2-1x1-0-NCHW-FP32-B=ConvOclDirectFwd:8,8,8,8,1,1,2,1,2
1184-7-7-1x1-128-7-7-256-0x0-1x1-1x1-0-NCHW-FP16-F=ConvAsm1x1U:2,8,4,16,1,4,1,8;ConvOclDirectFwd1x1:1,64,1,1,0,1,8,4,0
320-8-8-1x1-2048-8-8-2-0x0-1x1-1x1-0-NCHW-FP16-B=ConvAsm1x1U:1,8,2,32,1,2,4,4;ConvOclDirectFwd1x1:1,128,1,1,0,1,4,4,0
120-14-14-3x3-120-7-7-32-1x1-2x2-1x1-0-NCHW-FP32-F=ConvOclDirectFwd:8,8,8,8,1,1,8,4,2
96-56-56-1x1-128-56-56-512-0x0-1x1-1x1-0-NCHW-FP16-W=ConvAsmBwdWrW1x1:4,4,8,2,4,1,4,4,0,1
1776-7-7-1x1-192-7-7-1024-0x0-1x1-1x1-0-NCHW-FP16-F=ConvAsm1x1U:2,8,4,16,1,4,2,2;ConvOclDirectFwd1x1:1,256,1,1,0,1,8,4,0
320-14-14-1x1-128-14-14-8-0x0-1x1-1x1-0-NCHW-FP16-F=ConvAsm1x1U:1,8,2,64,1,4,4,1;ConvOclDirectFwd1x1:1,64,1,1,0,4,4,4,0
128-14-14-1x1-416-14-14-16-0x0-1x1-1x1-0-NCHW-FP16-B=ConvAsm1x1U:1,16,2,16,1,2,2,2;ConvOclDirectFwd1x1:1,128,1,1,0,4,8,4,0
528-14-14-1x1-256-14-14-512-0x0-1x1-1x1-0-NCHW-FP16-F=ConvAsm1x1U:2,8,4,64,1,4,1,8;ConvOclDirectFwd1x1:1,64,1,1,0,2,16,4,0
192-27-27-3x3-48-27-27-32-1x1-1x1-1x1-0-NCHW-FP16-F=ConvOclDirectFwd:16,16,32,32,2,2,8,4,2
32-7-7-5x5-128-7-7-256-2x2-1x1-1x1-0-NCHW-FP32-F=ConvOclDirectFwd:8,8,8,8,1,1,8,2,2;ConvOclDirectFwdFused:8,8,8,8,1,1,8,2,1
1280-8-8-1x1-320-8-8-512-0x0-1x1-1x1-0-NCHW-FP32-F=ConvAsm1x1U:2,16,2,16,3,2,2,2;ConvOclDirectFwd1x1:1,64,1,1,1,4,16,2048,0
128-7-7-1x1-1536-7-7-8-0x0-1x1-1x1-0-NCHW-FP32-W=ConvAsmBwdWrW1x1:1,16,4,2,8,1,1,4,0,1
384-28-28-1x1-768-28-28-64-0x0-1x1-1x1-0-NCHW-FP32-W=ConvAsmBwdWrW1x1:1,16,2,4,8,1,4,4,0,2
128-14-14-1x1-1472-14-14-256-0x0-1x1-1x1-0-NCHW-FP32-W=ConvAsmBwdWrW1x1:1,16,2,8,4,1,1,4,0,2
256-13-13-1x1-64-13-13-8-0x0-1x1-1x1-0-NCHW-FP16-W=ConvAsmBwdWrW1x1:4,4,2,4,2,1,2,4,0,1
64-224-224-3x3-3-224-224-16-1x1-1x1-1x1-0-NCHW-FP32-W=ConvAsmBwdWrW3x3:0,1,16,1,2,4
128-14-14-1x1-448-14-14-128-0x0-1x1-1x1-0-NCHW-FP16-W=ConvAsmBwdWrW1x1:4,4,8,4,4,1,2,2,0,1
800-14-14-1x1-128-14-14-16-0x0-1x1-1x1-0-NCHW-FP32-B=ConvAsm1x1U:2,16,2,64,1,2,4,1;ConvOclDirectFwd1x1:1,64,1,1,0,1,8,4,0
128-7-7-1x1-1184-7-7-64-0x0-1x1-1x1-0-NCHW-FP32-B=ConvAsm1x1U:2,16,2,32,1,2,2,2;ConvOclDirectFwd1x1:1,128,1,1,0,1,16,8,0
1024-14-14-1x1-512-7-7-2-0x0-2x2-1x1-0-NCHW-FP32-F=ConvAsm1x1U:2,8,2,32,1,4,4,1;ConvOclDirectFwd1x1:1,64,1,1,1,0,16,64,0
224-35-35-3x3-192-35-35-32-1x1-1x1-1x1-0-NCHW-FP16-W=ConvAsmBwdWrW3x3:0,1,8,4,2,2
192-14-14-1x1-960-14-14-64-0x0-1x1-1x1-0-NCHW-FP16-W=ConvAsmBwdWrW1x1:4,4,8,4,4,1,2,2,0,3
2048-14-14-1x1-512-14-14-256-0x0-1x1-1x1-0-NCHW-FP32-W=ConvAsmBwdWrW1x1:1,16,2,8,8,1,1,4,0,1
1312-14-14-1x1-128-14-14-64-0x0-1x1-1x1-0-NCHW-FP16-F=ConvAsm1x1U:2,8,4,64,1,4,2,4;ConvOclDirectFwd1x1:1,64,1,1,0,2,8,4,0
48-7-7-1x1-832-7-7-16-0x0-1x1-1x1-0-NCHW-FP32-B=ConvAsm1x1U:1,8,1,64,2,2,2,2;ConvOclDirectFwd1x1:1,64,1,1,0,1,16,8,0
1280-8-8-1x1-384-8-8-1024-0x0-1x1-1x1-0-NCHW-FP16-F=ConvAsm1x1U:2,8,4,16,2,4,2,4;ConvOclDirectFwd1x1:1,256,1,1,0,4,8,4,0
192-7-7-1x1-2064-7-7-64-0x0-1x1-1x1-0-NCHW-FP16-B=ConvAsm1x1U:2,16,4,16,1,2,1,4;ConvOclDirectFwd1x1:1,256,1,1,0,1,4,4,0
16-55-55-1x1-128-55-55-64-0x0-1x1-1x1-0-NCHW-FP32-W=ConvAsmBwdWrW1x1:4,4,2,4,2,1,4,2,0,2
48-13-13-1x1-192-13-13-1-0x0-1x1-1x1-0-NCHW-FP16-F=ConvAsm1x1U:1,8,2,16,1,2,4,1;ConvOclDirectFwd1x1:1,256,1,1,0,1,4,4,0
128-14-14-1x1-864-14-14-2-0x0-1x1-1x1-0-NCHW-FP32-B=ConvAsm1x1U:1,16,1,32,1,2,2,2;ConvOclDirectFwd1x1:1,128,1,1,0,1,4,4,0
54-55-55-1x1-24-55-55-256-0x0-1x1-1x1-0-NCHW-FP32-W=ConvAsmBwdWrW1x1:4,4,2,2,2,2,2,4,0,2
58-28-28-1x1-58-28-28-8-0x0-1x1-1x1-0-NCHW-FP32-B=ConvAsm1x1U:4,1,4,4,1,1,2,2;ConvOclDirectFwd1x1:1,128,1,1,0,4,16,4,0
128-7-7-1x1-1792-7-7-16-0x0-1x1-1x1-0-NCHW-FP32-W=ConvAsmBwdWrW1x1:1,16,2,4,8,1,1,4,0,3
192-7-7-1x1-2016-7-7-4-0x0-1x1-1x1-0-NCHW-FP16-W=ConvAsmBwdWrW1x1:1,16,4,8,2,1,1,4,0,1
512-28-28-1x1-512-28-28-16-0x0-1x1-1x1-0-NCHW-FP32-W=ConvAsmBwdWrW1x1:1,16,4,8,4,1,2,4,0,1
1776-7-7-1x1-192-7-7-256-0x0-1x1-1x1-0-NCHW-FP16-F=ConvAsm1x1U:2,16,4,16,1,2,1,2;ConvOclDirectFwd1x1:1,64,1,1,0,1,8,4,0
128-7-7-1x1-1152-7-7-32-0x0-1x1-1x1-0-NCHW-FP32-W=ConvAsmBwdWrW1x1:1,16,2,8,4,1,2,4,0,1
192-14-14-1x1-816-14-14-32-0x0-1x1-1x1-0-NCHW-FP32-B=ConvAsm1x1U:1,16,1,64,2,2,1,1;ConvOclDirectFwd1x1:1,64,1,1,0,4,16,4,0
480-28-28-1x1-128-28-28-64-0x0-1x1-1x1-0-NCHW-FP32-W=ConvAsmBwdWrW1x1:1,16,2,8,4,1,4,4,0,1
128-14-14-1x1-1024-14-14-256-0x0-1x1-1x1-0-NCHW-FP16-W=ConvAsmBwdWrW1x1:2,8,8,8,2,1,2,4,0,1
256-56-56-3x3-256-56-56-32-1x1-1x1-1x1-0-NCHW-FP32-W=ConvAsmBwdWrW3x3:0,0,16,4,4,1
16-54-54-1x1-64-54-54-512-0x0-1x1-1x1-0-NCHW-FP32-F=ConvAsm1x1U:1,16,1,64,1,2,2,2;ConvOclDirectFwd1x1:1,64,1,1,1,4,16,128,0
128-7-7-1x1-736-7-7-1024-0x0-1x1-1x1-0-NCHW-FP16-W=ConvAsmBwdWrW1x1:1,16,2,8,2,1,4,2,0,3
960-7-7-1x1-128-7-7-64-0x0-1x1-1x1-0-NCHW-FP16-B=ConvAsm1x1U:2,8,4,16,1,4,4,1;ConvOclDirectFwd1x1:1,64,1,1,0,1,8,4,0
1024-7-7-1x1-128-7-7-16-0x0-1x1-1x1-0-NCHW-FP32-F=ConvAsm1x1U:1,8,1,64,1,4,4,4;ConvOclDirectFwd1x1:1,64,1,1,1,1,16,128,0
256-27-27-1x1-64-27-27-32-0x0-1x1-1x1-0-NCHW-FP32-B=ConvAsm1x1U:3,16,3,64,1,2,2,1;ConvOclDirectFwd1x1:1,64,1,1,0,1,8,4,0
128-7-7-1x1-1248-7-7-1024-0x0-1x1-1x1-0-NCHW-FP16-B=ConvAsm1x1U:2,16,4,16,1,2,1,1;ConvOclDirectFwd1x1:1,128,1,1,0,1,8,4,0
64-28-28-1x1-192-28-28-2-0x0-1x1-1x1-0-NCHW-FP16-W=ConvAsmBwdWrW1x1:4,4,2,2,2,1,1,2,0,1
64-112-112-3x3-128-112-112-256-1x1-1x1-1x1-0-NCHW-FP16-F=ConvOclDirectFwd:8,16,16,32,2,2,8,1,1;ConvOclDirectFwdFused:16,8,16,32,1,4,8,1,2
192-28-28-1x1-336-28-28-128-0x0-1x1-1x1-0-NCHW-FP32-B=ConvAsm1x1U:1,16,1,32,2,1,2,2;ConvOclDirectFwd1x1:1,64,1,1,0,4,16,4,0
32-79-341-5x20-1-161-700-64-0x0-2x2-1x1-0-NCHW-FP32-B=ConvOclDirectFwd:8,16,16,32,2,2,1,1,1
128-7-7-1x1-1152-7-7-512-0x0-1x1-1x1-0-NCHW-FP16-B=ConvAsm1x1U:2,16,4,16,1,2,1,4;ConvOclDirectFwd1x1:1,256,1,1,0,1,8,4,0
128-14-14-1x1-832-14-14-64-0x0-1x1-1x1-0-NCHW-FP32-F=ConvAsm1x1U:4,8,4,64,1,4,1,4;ConvOclDirectFwd1x1:1,64,1,1,1,1,64,2048,0
128-14-14-1x1-288-14-14-1024-0x0-1x1-1x1-0-NCHW-FP16-B=ConvAsm1x1U:1,16,2,16,1,2,1,2;ConvOclDirectFwd1x1:1,256,1,1,0,2,16,4,0
480-14-14-1x1-192-14-14-512-0x0-1x1-1x1-0-NCHW-FP16-F=ConvAsm1x1U:2,8,4,64,1,4,1,8;ConvOclDirectFwd1x1:8,64,16,16,0,2,16,4,1
128-14-14-3x3-32-14-14-256-1x1-1x1-1x1-0-NCHW-FP16-F=ConvOclDirectFwd:8,8,16,16,2,2,8,4,2
1024-7-7-3x3-1024-7-7-128-1x1-1x1-1x1-0-NCHW-FP32-W_g32=ConvOclBwdWrW2<4>:1,7,8,1,7;ConvOclBwdWrW2<16>:1,7,8,1,7;ConvOclBwdWrW2<2>:1,7,8,1,7;ConvOclBwdWrW2<1>:1,7,8,1,7;ConvAsmBwdWrW3x3:0,0,8,4,5,1;ConvOclBwdWrW2<8>:1,7,8,1,7
128-14-14-1x1-1376-14-14-64-0x0-1x1-1x1-0-NCHW-FP16-W=ConvAsmBwdWrW1x1:4,4,8,4,4,1,2,2,0,3
48-27-27-1x1-384-27-27-256-0x0-1x1-1x1-0-NCHW-FP32-B=ConvAsm1x1U:1,16,1,64,2,1,1,8;ConvOclDirectFwd1x1:1,256,1,1,0,1,32,4,0
64-13-13-3x3-256-13-13-256-1x1-1x1-1x1-0-NCHW-FP16-B=ConvOclDirectFwd:8,8,16,16,2,2,8,2,2
1632-14-14-1x1-128-14-14-32-0x0-1x1-1x1-0-NCHW-FP32-F=ConvAsm1x1U:4,16,4,64,1,2,2,2;ConvOclDirectFwd1x1:1,64,1,1,1,4,16,2048,0
48-56-56-3x3-192-56-56-64-1x1-1x1-1x1-0-NCHW-FP16-B=ConvOclDirectFwd:16,16,32,32,2,2,8,2,1
896-14-14-1x1-128-14-14-512-0x0-1x1-1x1-0-NCHW-FP32-F=ConvAsm1x1U:4,16,4,64,1,2,2,2;ConvOclDirectFwd1x1:1,64,1,1,1,1,16,2048,0
128-14-14-1x1-672-14-14-256-0x0-1x1-1x1-0-NCHW-FP16-W=ConvAsmBwdWrW1x1:2,8,4,8,2,1,4,4,0,1
192-7-7-1x1-2160-7-7-256-0x0-1x1-1x1-0-NCHW-FP16-B=ConvAsm1x1U:2,16,4,16,1,2,1,4;ConvOclDirectFwd1x1:1,64,1,1,0,1,8,4,0
5-10-10-3x3-3-10-10-256-1x1-1x1-1x1-0-NCHW-FP32-F=ConvOclDirectFwd:8,8,16,16,2,2,1,2,2
768-14-14-1x1-128-14-14-512-0x0-1x1-1x1-0-NCHW-FP32-F=ConvAsm1x1U:4,16,4,64,1,2,1,1;ConvOclDirectFwd1x1:1,64,1,1,1,0,16,2048,0
192-56-56-1x1-240-56-56-8-0x0-1x1-1x1-0-NCHW-FP32-W=ConvAsmBwdWrW1x1:2,8,4,8,2,1,2,4,0,2
960-7-7-1x1-128-7-7-16-0x0-1x1-1x1-0-NCHW-FP32-B=ConvAsm1x1U:1,8,1,64,1,4,4,4;ConvOclDirectFwd1x1:1,256,1,1,0,1,4,8,0
128-28-28-1x1-64-56-56-1-0x0-2x2-1x1-0-NCHW-FP32-W=ConvAsmBwdWrW1x1:4,4,2,1,2,1,1,4,0,1
256-28-28-1x1-128-28-28-4-0x0-1x1-1x1-0-NCHW-FP32-F=ConvAsm1x1U:2,8,2,16,1,4,2,4;ConvActivAsm1x1U:2,16,2,32,2,4;ConvOclDirectFwd1x1:1,64,1,1,1,1,16,128,0
160-17-17-1x1-768-17-17-4-0x0-1x1-1x1-0-NCHW-FP16-W=ConvAsmBwdWrW1x1:4,4,4,4,4,1,1,4,0,0
192-7-7-1x1-1488-7-7-4-0x0-1x1-1x1-0-NCHW-FP16-B=ConvAsm1x1U:1,8,2,16,1,4,4,1;ConvOclDirectFwd1x1:1,256,1,1,0,1,4,4,0
64-56-56-3x3-64-56-56-2-1x1-1x1-1x1-0-NCHW-FP16-F=ConvOclDirectFwd:16,8,16,16,1,2,4,4,2
64-13-13-1x1-256-13-13-512-0x0-1x1-1x1-0-NCHW-FP32-W=ConvAsmBwdWrW1x1:4,4,4,4,4,1,4,4,0,2
256-56-56-1x1-128-28-28-64-0x0-2x2-1x1-0-NCHW-FP32-F=ConvAsm1x1U:1,16,1,32,4,2,1,4;ConvOclDirectFwd1x1:1,64,1,1,1,4,16,2048,0
384-27-27-1x1-48-27-27-32-0x0-1x1-1x1-0-NCHW-FP32-W=ConvAsmBwdWrW1x1:2,8,2,4,8,1,4,4,0,1
384-27-27-1x1-64-27-27-32-0x0-1x1-1x1-0-NCHW-FP32-B=ConvAsm1x1U:3,16,3,64,1,2,2,1;ConvOclDirectFwd1x1:1,256,1,1,0,1,16,8,0
224-56-56-1x1-128-56-56-64-0x0-1x1-1x1-0-NCHW-FP32-W=ConvAsmBwdWrW1x1:4,4,4,4,2,1,1,4,0,1
256-35-35-1x1-48-35-35-4-0x0-1x1-1x1-0-NCHW-FP32-F=ConvAsm1x1U:2,8,2,32,1,4,2,2;ConvActivAsm1x1U:1,16,1,32,2,4;ConvOclDirectFwd1x1:1,64,1,1,1,1,32,64,0
384-8-8-3x3-448-8-8-2-1x1-1x1-1x1-0-NCHW-FP32-W=ConvAsmBwdWrW3x3:0,1,8,4,2,1
288-14-14-1x1-128-14-14-2-0x0-1x1-1x1-0-NCHW-FP16-F=ConvAsm1x1U:1,8,2,64,1,4,4,2;ConvOclDirectFwd1x1:1,64,1,1,0,4,4,4,0
128-14-14-1x1-768-14-14-1-0x0-1x1-1x1-0-NCHW-FP32-W=ConvAsmBwdWrW1x1:2,8,2,4,2,1,1,4,0,0
120-7-7-3x3-120-14-14-128-1x1-2x2-1x1-0-NCHW-FP16-W=ConvAsmBwdWrW3x3:0,0,8,4,6,2
128-14-14-1x1-1248-14-14-128-0x0-1x1-1x1-0-NCHW-FP32-W=ConvAsmBwdWrW1x1:1,16,2,8,8,2,2,4,0,1
192-7-7-1x1-1776-7-7-512-0x0-1x1-1x1-0-NCHW-FP32-W=ConvAsmBwdWrW1x1:2,8,4,8,4,1,2,2,0,2
128-14-14-1x1-1152-14-14-256-0x0-1x1-1x1-0-NCHW-FP32-B=ConvAsm1x1U:1,32,1,16,2,1,1,2;ConvOclDirectFwd1x1:1,64,1,1,0,1,32,4,0
32-28-28-3x3-128-28-28-512-1x1-1x1-1x1-0-NCHW-FP32-W=ConvAsmBwdWrW3x3:0,1,8,2,10,4
384-28-28-1x1-128-28-28-16-0x0-1x1-1x1-0-NCHW-FP16-W=ConvAsmBwdWrW1x1:2,8,4,1,8,2,1,4,0,1
240-56-56-1x1-192-56-56-256-0x0-1x1-1x1-0-NCHW-FP16-F=ConvAsm1x1U:2,8,4,32,1,4,1,8;ConvOclDirectFwd1x1:1,256,1,1,0,4,16,4,0
48-27-27-1x1-384-27-27-32-0x0-1x1-1x1-0-NCHW-FP32-W=ConvAsmBwdWrW1x1:2,8,4,8,2,1,4,4,0,1
512-14-14-3x3-512-14-14-16-1x1-1x1-1x1-0-NCHW-FP16-W=ConvAsmBwdWrW3x3:0,1,8,4,3,1
384-13-13-1x1-48-13-13-64-0x0-1x1-1x1-0-NCHW-FP16-F=ConvAsm1x1U:1,8,6,32,1,4,4,1;ConvOclDirectFwd1x1:1,64,1,1,0,1,8,8,0
512-14-14-1x1-32-14-14-8-0x0-1x1-1x1-0-NCHW-FP32-F=ConvAsm1x1U:1,8,1,32,1,4,4,2;ConvActivAsm1x1U:1,16,1,32,1,4;ConvOclDirectFwd1x1:1,64,1,1,1,4,16,128,0
1792-7-7-1x1-128-7-7-1-0x0-1x1-1x1-0-NCHW-FP16-F=ConvAsm1x1U:1,8,2,16,1,4,4,1;ConvOclDirectFwd1x1:1,64,1,1,0,1,4,8,0
128-14-14-1x1-768-14-14-1-0x0-1x1-1x1-0-NCHW-FP16-W=ConvAsmBwdWrW1x1:2,8,2,4,2,1,1,2,0,0
128-7-7-1x1-928-7-7-128-0x0-1x1-1x1-0-NCHW-FP16-F=ConvAsm1x1U:2,8,4,16,1,4,1,4;ConvOclDirectFwd1x1:1,128,1,1,0,1,8,4,0
192-7-7-1x1-1584-7-7-16-0x0-1x1-1x1-0-NCHW-FP32-B=ConvAsm1x1U:1,16,1,64,2,2,2,2;ConvOclDirectFwd1x1:1,128,1,1,0,1,8,8,0
192-28-28-1x1-720-28-28-32-0x0-1x1-1x1-0-NCHW-FP16-B=ConvAsm1x1U:1,16,2,16,1,2,1,2;ConvOclDirectFwd1x1:1,128,1,1,0,4,16,4,0
256-14-14-1x1-512-28-28-1024-0x0-2x2-1x1-0-NCHW-FP32-W=ConvAsmBwdWrW1x1:1,16,2,8,2,1,1,4,0,1
512-7-7-1x1-256-14-14-256-0x0-2x2-1x1-0-NCHW-FP16-B=ConvAsm1x1U:2,8,4,16,1,4,1,4;ConvOclDirectFwd1x1:8,64,16,16,0,1,16,4,1
128-14-14-1x1-736-14-14-512-0x0-1x1-1x1-0-NCHW-FP16-F=ConvAsm1x1U:2,8,4,64,1,4,1,4;ConvOclDirectFwd1x1:1,256,1,1,0,2,16,4,0
24-55-55-1x1-54-55-55-128-0x0-1x1-1x1-0-NCHW-FP32-F=ConvAsm1x1U:1,16,1,64,1,2,1,1;ConvOclDirectFwd1x1:1,256,1,1,0,1,8,8,0
64-35-35-3x3-96-35-35-16-1x1-1x1-1x1-0-NCHW-FP16-F=ConvOclDirectFwd:16,8,16,16,1,2,8,2,2;ConvOclDirectFwdFused:16,8,16,16,1,2,8,1,2
64-35-35-5x5-48-35-35-256-2x2-1x1-1x1-0-NCHW-FP32-B=ConvOclDirectFwd:8,8,16,16,2,2,8,1,2
864-14-14-1x1-128-14-14-8-0x0-1x1-1x1-0-NCHW-FP16-F=ConvAsm1x1U:1,8,2,64,1,4,4,1;ConvOclDirectFwd1x1:1,64,1,1,0,4,4,4,0
128-14-14-1x1-992-14-14-512-0x0-1x1-1x1-0-NCHW-FP32-F=ConvAsm1x1U:4,8,4,64,1,4,1,4;ConvOclDirectFwd1x1:1,64,1,1,1,1,64,128,0
672-7-7-1x1-128-7-7-32-0x0-1x1-1x1-0-NCHW-FP16-W=ConvAsmBwdWrW1x1:2,8,4,8,2,2,2,4,0,0
192-14-14-1x1-672-14-14-32-0x0-1x1-1x1-0-NCHW-FP16-B=ConvAsm1x1U:1,16,2,16,1,2,2,2;ConvOclDirectFwd1x1:1,256,1,1,0,4,8,4,0
256-56-56-3x3-128-56-56-2-1x1-1x1-1x1-0-NCHW-FP32-W=ConvAsmBwdWrW3x3:0,1,16,4,3,1
256-55-55-1x1-512-28-28-32-0x0-2x2-1x1-0-NCHW-FP32-F=ConvAsm1x1U:1,16,1,16,4,2,1,4;ConvOclDirectFwd1x1:1,64,1,1,1,0,16,2048,0
128-14-14-1x1-1312-14-14-32-0x0-1x1-1x1-0-NCHW-FP32-W=ConvAsmBwdWrW1x1:1,16,2,8,4,1,1,4,0,1
64-55-55-1x1-16-55-55-32-0x0-1x1-1x1-0-NCHW-FP16-W=ConvAsmBwdWrW1x1:4,4,2,2,2,1,4,4,0,1
736-7-7-1x1-128-7-7-128-0x0-1x1-1x1-0-NCHW-FP16-F=ConvAsm1x1U:2,8,4,16,1,4,2,8;ConvOclDirectFwd1x1:1,64,1,1,0,1,4,8,0
512-28-28-1x1-256-55-55-32-0x0-2x2-1x1-0-NCHW-FP16-B=ConvAsm1x1U:1,16,2,32,1,2,2,2;ConvOclDirectFwd1x1:1,64,1,1,0,1,32,8,0
192-7-7-1x1-1248-7-7-64-0x0-1x1-1x1-0-NCHW-FP16-B=ConvAsm1x1U:1,16,2,32,1,2,1,4;ConvOclDirectFwd1x1:1,64,1,1,0,1,8,4,0
512-7-7-1x1-512-7-7-1-0x0-1x1-1x1-0-NCHW-FP32-F=ConvAsm1x1U:1,8,1,64,1,4,4,1;ConvActivAsm1x1U:1,16,1,64,1,3;ConvOclDirectFwd1x1:1,64,1,1,1,0,16,64,0
192-7-7-1x1-1968-7-7-16-0x0-1x1-1x1-0-NCHW-FP16-W=ConvAsmBwdWrW1x1:4,4,4,4,4,1,1,2,0,0
128-7-7-1x1-1472-7-7-2-0x0-1x1-1x1-0-NCHW-FP32-B=ConvAsm1x1U:1,16,1,64,1,2,4,1;ConvOclDirectFwd1x1:1,128,1,1,0,1,4,8,0
128-14-14-1x1-1088-14-14-512-0x0-1x1-1x1-0-NCHW-FP32-W=ConvAsmBwdWrW1x1:1,16,2,4,8,1,4,4,0,2
512-8-8-3x3-512-15-15-32-1x1-2x2-1x1-0-NCHW-FP32-W=ConvAsmBwdWrW3x3:0,0,8,8,8,1
1440-14-14-1x1-192-14-14-256-0x0-1x1-1x1-0-NCHW-FP32-F=ConvAsm1x1U:2,16,4,64,1,2,1,1;ConvOclDirectFwd1x1:1,64,1,1,1,0,32,2048,0
64-224-224-3x3-64-224-224-1-1x1-1x1-1x1-0-NCHW-FP32-W=ConvAsmBwdWrW3x3:0,0,16,2,2,1
192-14-14-1x1-1488-14-14-64-0x0-1x1-1x1-0-NCHW-FP16-B=ConvAsm1x1U:1,16,2,16,1,2,2,4;ConvOclDirectFwd1x1:1,64,1,1,0,4,8,4,0
64-13-13-1x1-512-13-13-32-0x0-1x1-1x1-0-NCHW-FP16-W=ConvAsmBwdWrW1x1:4,4,4,4,2,2,1,4,0,1
384-14-14-1x1-128-14-14-8-0x0-1x1-1x1-0-NCHW-FP16-F=ConvAsm1x1U:1,8,2,64,1,4,4,2;ConvOclDirectFwd1x1:1,64,1,1,0,4,4,4,0
1024-14-14-1x1-512-28-28-512-0x0-2x2-1x1-0-NCHW-FP16-B=ConvAsm1x1U:1,16,2,16,1,2,1,4;ConvOclDirectFwd1x1:1,256,1,1,0,2,32,8,0
128-14-14-1x1-992-14-14-16-0x0-1x1-1x1-0-NCHW-FP32-W=ConvAsmBwdWrW1x1:2,8,4,8,4,1,2,4,0,1
128-7-7-1x1-1376-7-7-4-0x0-1x1-1x1-0-NCHW-FP16-W=ConvAsmBwdWrW1x1:1,16,2,4,2,1,1,4,0,1
32-7-7-5x5-128-7-7-512-2x2-1x1-1x1-0-NCHW-FP16-F=ConvOclDirectFwd:8,8,8,8,1,1,8,2,1;ConvOclDirectFwdFused:8,8,8,8,1,1,8,2,2
48-35-35-1x1-192-35-35-1024-0x0-1x1-1x1-0-NCHW-FP16-W=ConvAsmBwdWrW1x1:4,4,4,4,4,1,4,4,0,1
256-14-14-3x3-128-28-28-256-1x1-2x2-1x1-0-NCHW-FP16-W=ConvAsmBwdWrW3x3:0,0,8,8,3,1
624-14-14-1x1-192-14-14-2-0x0-1x1-1x1-0-NCHW-FP16-F=ConvAsm1x1U:1,8,2,16,1,4,4,1;ConvOclDirectFwd1x1:1,256,1,1,0,4,4,4,0
128-29-29-3x3-128-57-57-2-1x1-2x2-1x1-0-NCHW-FP32-W=ConvAsmBwdWrW3x3:0,0,8,4,3,1
192-14-14-1x1-1056-14-14-512-0x0-1x1-1x1-0-NCHW-FP16-B=ConvAsm1x1U:1,16,2,16,1,2,1,4;ConvOclDirectFwd1x1:8,64,16,16,0,2,16,4,1
480-14-14-1x1-96-14-14-256-0x0-1x1-1x1-0-NCHW-FP32-W=ConvAsmBwdWrW1x1:1,16,2,4,8,1,4,4,0,2
384-28-28-1x1-128-28-28-1-0x0-1x1-1x1-0-NCHW-FP32-F=ConvAsm1x1U:1,8,1,64,1,4,4,2;ConvOclDirectFwd1x1:1,64,1,1,1,1,16,64,0
512-15-15-3x3-512-15-15-1-1x1-1x1-1x1-0-NCHW-FP32-F_g32=ConvOclDirectFwd:16,16,16,16,1,1,2,2,1
128-14-14-1x1-992-14-14-1-0x0-1x1-1x1-0-NCHW-FP32-W=ConvAsmBwdWrW1x1:1,16,4,4,2,1,1,4,0,1
624-28-28-1x1-192-28-28-512-0x0-1x1-1x1-0-NCHW-FP32-F=ConvAsm1x1U:3,16,3,32,2,2,1,4;ConvOclDirectFwd1x1:1,64,1,1,1,4,32,2048,0
256-17-17-1x1-1024-17-17-4-0x0-1x1-1x1-0-NCHW-FP16-W=ConvAsmBwdWrW1x1:2,8,4,4,4,1,1,4,0,0
128-56-56-3x3-128-56-56-4-1x1-1x1-1x1-0-NCHW-FP32-W_g32=ConvOclBwdWrW2<1>:1,8,3,1,7;ConvOclBwdWrW2<4>:1,8,1,1,9;ConvAsmBwdWrW3x3:0,1,16,2,2,4;ConvOclBwdWrW2<2>:1,9,1,1,7
1024-14-14-1x1-256-14-14-4-0x0-1x1-1x1-0-NCHW-FP32-B=ConvAsm1x1U:2,16,2,16,1,2,4,1;ConvOclDirectFwd1x1:1,64,1,1,0,4,4,8,0
480-28-28-1x1-128-28-28-8-0x0-1x1-1x1-0-NCHW-FP32-F=ConvAsm1x1U:4,16,4,32,1,2,2,1;ConvOclDirectFwd1x1:1,64,1,1,1,1,16,256,0
224-56-56-1x1-128-56-56-256-0x0-1x1-1x1-0-NCHW-FP32-B=ConvAsm1x1U:1,32,1,64,2,1,1,1;ConvOclDirectFwd1x1:1,256,1,1,0,4,16,4,0
128-56-56-1x1-64-56-56-16-0x0-1x1-1x1-0-NCHW-FP32-W=ConvAsmBwdWrW1x1:4,4,4,4,4,1,4,4,0,1
64-55-55-1x1-16-55-55-512-0x0-1x1-1x1-0-NCHW-FP32-W=ConvAsmBwdWrW1x1:4,4,2,2,2,1,2,4,0,3
1824-7-7-1x1-128-7-7-16-0x0-1x1-1x1-0-NCHW-FP16-F=ConvAsm1x1U:1,8,2,32,1,4,4,1;ConvOclDirectFwd1x1:1,256,1,1,0,1,4,8,0
120-14-14-1x1-480-14-14-64-0x0-1x1-1x1-0-NCHW-FP32-B_g3=ConvOclDirectFwd:16,16,16,16,1,1,8,2,2
384-28-28-1x1-128-28-28-4-0x0-1x1-1x1-0-NCHW-FP16-F=ConvAsm1x1U:2,8,4,32,1,4,4,2;ConvOclDirectFwd1x1:1,64,1,1,0,2,4,4,0
512-14-14-1x1-1024-14-14-128-0x0-1x1-1x1-0-NCHW-FP16-B=ConvAsm1x1U:1,16,2,64,1,2,1,2;ConvOclDirectFwd1x1:1,64,1,1,0,4,16,4,0
1024-14-14-3x3-1024-7-7-256-1x1-2x2-1x1-0-NCHW-FP32-F_g32=ConvOclDirectFwd:8,8,8,8,1,1,8,2,2
512-28-28-1x1-256-55-55-32-0x0-2x2-1x1-0-NCHW-FP16-W=ConvAsmBwdWrW1x1:2,8,8,4,4,1,2,4,0,1
48-64-128-1x1-832-64-128-1-0x0-1x1-1x1-0-NCHW-FP32-W=ConvAsmBwdWrW1x1:4,4,2,4,8,1,1,4,0,1
64-12-120-3x3-32-12-120-16-1x1-1x1-1x1-0-NCHW-FP16-B=ConvOclDirectFwd:16,16,16,32,1,2,8,2,2
384-7-7-3x3-192-7-7-256-1x1-1x1-1x1-0-NCHW-FP32-W=ConvAsmBwdWrW3x3:0,1,8,4,5,1
512-28-28-3x3-256-28-28-1024-1x1-1x1-1x1-0-NCHW-FP32-W=ConvAsmBwdWrW3x3:0,1,8,4,5,4
512-28-28-1x1-512-28-28-8-0x0-1x1-1x1-0-NCHW-FP32-F=ConvAsm1x1U:3,16,5,16,1,2,2,2;ConvOclDirectFwd1x1:1,64,1,1,1,0,16,2048,0
32-27-27-1x1-128-27-27-1-0x0-1x1-1x1-0-NCHW-FP16-F=ConvAsm1x1U:1,8,2,16,1,4,2,1;ConvOclDirectFwd1x1:1,128,1,1,0,1,4,4,0
1504-7-7-1x1-128-7-7-1-0x0-1x1-1x1-0-NCHW-FP32-F=ConvAsm1x1U:1,8,1,32,1,4,4,1;ConvOclDirectFwd1x1:1,64,1,1,1,1,16,64,0
24-112-112-3x3-3-224-224-16-1x1-2x2-1x1-0-NCHW-FP32-B=ConvOclDirectFwd:16,16,32,32,2,2,8,2,1
1280-14-14-1x1-640-14-14-1024-0x0-1x1-1x1-0-NCHW-FP16-F=ConvAsm1x1U:2,8,4,64,1,4,1,8;ConvOclDirectFwd1x1:1,256,1,1,0,2,8,4,0
1888-7-7-1x1-128-7-7-2-0x0-1x1-1x1-0-NCHW-FP16-F=ConvAsm1x1U:1,8,2,16,1,4,4,1;ConvOclDirectFwd1x1:1,64,1,1,0,1,4,8,0
58-28-28-1x1-24-28-28-512-0x0-1x1-1x1-0-NCHW-FP32-W=ConvAsmBwdWrW1x1:4,4,2,4,2,2,4,4,0,3
128-27-27-3x3-128-27-27-1024-1x1-1x1-1x1-0-NCHW-FP32-W=ConvAsmBwdWrW3x3:0,0,8,4,2,4
832-7-7-1x1-128-7-7-2-0x0-1x1-1x1-0-NCHW-FP16-F=ConvAsm1x1U:1,8,2,32,1,4,4,1;ConvOclDirectFwd1x1:1,256,1,1,0,1,4,8,0
288-14-14-1x1-128-14-14-32-0x0-1x1-1x1-0-NCHW-FP32-B=ConvAsm1x1U:1,16,1,32,1,2,2,2;ConvOclDirectFwd1x1:1,64,1,1,0,4,16,4,0
384-13-13-3x3-256-13-13-256-1x1-1x1-1x1-0-NCHW-FP16-W=ConvAsmBwdWrW3x3:0,0,8,8,3,1
192-27-27-3x3-48-27-27-64-1x1-1x1-1x1-0-NCHW-FP16-W=ConvAsmBwdWrW3x3:0,0,8,2,5,4
480-28-28-1x1-128-28-28-64-0x0-1x1-1x1-0-NCHW-FP16-F=ConvAsm1x1U:3,8,6,16,1,4,1,4;ConvOclDirectFwd1x1:1,256,1,1,0,2,8,4,0
384-8-8-3x3-448-8-8-1-1x1-1x1-1x1-0-NCHW-FP32-W=ConvAsmBwdWrW3x3:0,1,8,4,2,1
16-55-55-1x1-128-55-55-8-0x0-1x1-1x1-0-NCHW-FP16-B=ConvAsm1x1U:1,8,2,64,1,4,1,4;ConvOclDirectFwd1x1:1,256,1,1,0,1,4,4,0
160-14-14-1x1-512-14-14-8-0x0-1x1-1x1-0-NCHW-FP32-W=ConvAsmBwdWrW1x1:1,16,2,8,2,1,2,4,0,1
128-14-14-1x1-1088-14-14-64-0x0-1x1-1x1-0-NCHW-FP16-B=ConvAsm1x1U:1,16,2,16,1,2,1,4;ConvOclDirectFwd1x1:1,64,1,1,0,4,8,4,0
2048-8-8-1x1-448-8-8-16-0x0-1x1-1x1-0-NCHW-FP16-F=ConvAsm1x1U:1,8,2,32,4,4,4,2;ConvOclDirectFwd1x1:1,128,1,1,0,2,4,8,0
128-7-7-1x1-1280-7-7-64-0x0-1x1-1x1-0-NCHW-FP32-B=ConvAsm1x1U:2,16,2,32,1,2,1,4;ConvOclDirectFwd1x1:8,64,8,8,0,1,16,4,1
256-15-15-3x3-256-15-15-256-1x1-1x1-1x1-0-NCHW-FP32-W=ConvAsmBwdWrW3x3:0,0,16,4,7,1
64-55-55-1x1-64-55-55-16-0x0-1x1-1x1-0-NCHW-FP32-W=ConvAsmBwdWrW1x1:8,2,8,2,4,1,4,4
192-28-28-3x3-48-28-28-2-1x1-1x1-1x1-0-NCHW-FP16-F=ConvOclDirectFwd:16,16,16,16,1,1,2,4,2
384-8-8-1x1-1280-8-8-128-0x0-1x1-1x1-0-NCHW-FP16-B=ConvAsm1x1U:1,16,2,32,1,2,1,8;ConvOclDirectFwd1x1:1,64,1,1,0,4,16,4,0
64-55-55-11x11-3-227-227-32-0x0-4x4-1x1-0-NCHW-FP32-W=ConvOclBwdWrW2<4>:3,11,3,3,11;ConvOclBwdWrW2<1>:3,7,3,3,11;ConvOclBwdWrW2<16>:3,7,3,3,11;ConvOclBwdWrW2<8>:3,11,3,3,11;ConvOclBwdWrW2<2>:3,11,3,3,11
128-14-14-1x1-416-14-14-64-0x0-1x1-1x1-0-NCHW-FP32-B=ConvAsm1x1U:1,16,1,32,2,2,2,2;ConvOclDirectFwd1x1:1,64,1,1,0,4,16,4,0
128-28-28-1x1-416-28-28-256-0x0-1x1-1x1-0-NCHW-FP16-W=ConvAsmBwdWrW1x1:4,4,8,2,8,1,2,2,0,1
192-14-14-1x1-1824-14-14-4-0x0-1x1-1x1-0-NCHW-FP16-W=ConvAsmBwdWrW1x1:2,8,4,4,4,1,1,4,0,0
1216-14-14-1x1-128-14-14-32-0x0-1x1-1x1-0-NCHW-FP32-F=ConvAsm1x1U:4,8,4,64,2,2,2,2;ConvOclDirectFwd1x1:1,64,1,1,1,1,16,2048,0
2048-7-7-1x1-512-7-7-4-0x0-1x1-1x1-0-NCHW-FP32-W=ConvAsmBwdWrW1x1:1,16,4,2,8,1,1,4,0,0
192-17-17-1x1-1024-17-17-64-0x0-1x1-1x1-0-NCHW-FP16-W=ConvAsmBwdWrW1x1:4,4,8,4,4,1,2,4,0,1
192-14-14-1x1-960-14-14-16-0x0-1x1-1x1-0-NCHW-FP16-B=ConvAsm1x1U:1,16,2,16,1,2,2,2;ConvOclDirectFwd1x1:1,128,1,1,0,4,8,4,0
512-14-14-1x1-2048-14-14-64-0x0-1x1-1x1-0-NCHW-FP32-W=ConvAsmBwdWrW1x1:2,8,4,8,4,1,1,4,0,2
2048-8-8-1x1-384-8-8-8-0x0-1x1-1x1-0-NCHW-FP16-F=ConvAsm1x1U:2,8,4,16,1,4,4,1;ConvOclDirectFwd1x1:1,64,1,1,0,2,4,4,0
256-15-15-3x3-256-29-29-16-1x1-2x2-1x1-0-NCHW-FP32-W=ConvAsmBwdWrW3x3:0,0,8,8,4,1
2048-7-7-1x1-512-7-7-512-0x0-1x1-1x1-0-NCHW-FP16-W=ConvAsmBwdWrW1x1:1,16,8,4,4,1,1,2,0,2
128-56-56-3x3-32-56-56-128-1x1-1x1-1x1-0-NCHW-FP16-F=ConvOclDirectFwd:16,16,32,32,2,2,8,2,1
128-56-56-1x1-256-56-56-8-0x0-1x1-1x1-0-NCHW-FP32-B=ConvAsm1x1U:2,16,2,64,1,2,2,2;ConvOclDirectFwd1x1:1,128,1,1,0,2,16,4,0
16-54-54-3x3-64-54-54-64-1x1-1x1-1x1-0-NCHW-FP32-W=ConvAsmBwdWrW3x3:0,0,16,4,3,8
192-28-28-1x1-192-28-28-256-0x0-1x1-1x1-0-NCHW-FP32-B=ConvAsm1x1U:1,32,1,16,2,1,1,1;ConvOclDirectFwd1x1:1,64,1,1,0,2,32,4,0
128-14-14-1x1-256-14-14-1024-0x0-1x1-1x1-0-NCHW-FP16-B=ConvAsm1x1U:1,16,2,16,1,2,1,4;ConvOclDirectFwd1x1:1,256,1,1,0,2,16,4,0
512-28-28-1x1-128-28-28-1024-0x0-1x1-1x1-0-NCHW-FP32-W=ConvAsmBwdWrW1x1:1,16,2,8,4,1,4,4,0,1
128-14-14-1x1-1344-14-14-8-0x0-1x1-1x1-0-NCHW-FP32-W=ConvAsmBwdWrW1x1:1,16,2,4,8,1,1,4,0,1
64-55-55-3x3-64-55-55-32-1x1-1x1-1x1-0-NCHW-FP16-B=ConvOclDirectFwd:32,8,32,32,1,4,8,4,2
192-8-8-1x1-1280-8-8-1-0x0-1x1-1x1-0-NCHW-FP32-B=ConvAsm1x1U:1,8,1,64,1,4,2,2;ConvOclDirectFwd1x1:1,128,1,1,0,1,4,4,0
60-28-28-1x1-240-28-28-16-0x0-1x1-1x1-0-NCHW-FP32-F_g3=ConvOclDirectFwd:16,16,16,16,1,1,8,4,2
1024-14-14-1x1-512-28-28-6-0x0-2x2-1x1-0-NCHW-FP32-W=ConvAsmBwdWrW1x1:1,16,4,4,8,1,1,2,0,1
128-17-17-7x1-128-17-17-32-3x0-1x1-1x1-0-NCHW-FP16-W=ConvOclBwdWrW2<4>:1,9,8,3,9;ConvOclBwdWrW2<1>:1,6,8,3,7;ConvOclBwdWrW2<16>:1,12,8,8,9;ConvOclBwdWrW2<8>:1,9,8,3,9;ConvOclBwdWrW2<2>:1,9,8,3,9
960-14-14-1x1-128-14-14-64-0x0-1x1-1x1-0-NCHW-FP16-W=ConvAsmBwdWrW1x1:2,8,8,4,4,1,2,4,0,1
192-28-28-1x1-192-28-28-4-0x0-1x1-1x1-0-NCHW-FP16-B=ConvAsm1x1U:1,16,2,64,1,2,4,1;ConvOclDirectFwd1x1:1,128,1,1,0,2,4,4,0
2048-7-7-1x1-512-7-7-2-0x0-1x1-1x1-0-NCHW-FP16-F=ConvAsm1x1U:1,8,2,16,1,4,4,1;ConvOclDirectFwd1x1:1,256,1,1,0,1,4,4,0
128-14-14-1x1-1728-14-14-4-0x0-1x1-1x1-0-NCHW-FP32-B=ConvAsm1x1U:1,16,1,32,1,2,1,4;ConvOclDirectFwd1x1:1,64,1,1,0,4,16,4,0
256-28-28-1x1-32-28-28-16-0x0-1x1-1x1-0-NCHW-FP16-F=ConvAsm1x1U:2,8,4,32,1,4,4,2;ConvOclDirectFwd1x1:1,64,1,1,0,2,8,4,0
128-14-14-1x1-672-14-14-128-0x0-1x1-1x1-0-NCHW-FP16-B=ConvAsm1x1U:1,16,2,16,1,2,1,4;ConvOclDirectFwd1x1:1,256,1,1,0,4,8,4,0
1024-14-14-1x1-128-14-14-16-0x0-1x1-1x1-0-NCHW-FP32-F=ConvAsm1x1U:2,8,4,64,1,4,2,2;ConvOclDirectFwd1x1:1,64,1,1,1,0,16,2048,0
128-14-14-1x1-576-14-14-1-0x0-1x1-1x1-0-NCHW-FP32-B=ConvAsm1x1U:1,8,1,64,1,4,2,1;ConvOclDirectFwd1x1:1,128,1,1,0,1,4,4,0
48-56-56-3x3-192-56-56-16-1x1-1x1-1x1-0-NCHW-FP32-W=ConvAsmBwdWrW3x3:0,1,16,4,3,4
320-28-28-1x1-128-28-28-8-0x0-1x1-1x1-0-NCHW-FP16-F=ConvAsm1x1U:2,8,4,16,1,4,2,4;ConvOclDirectFwd1x1:1,64,1,1,0,2,8,4,0
256-29-29-3x3-256-57-57-32-1x1-2x2-1x1-0-NCHW-FP32-B_g32=ConvOclDirectFwd:8,16,16,32,2,2,8,1,2
528-14-14-1x1-32-14-14-512-0x0-1x1-1x1-0-NCHW-FP16-F=ConvAsm1x1U:2,8,4,64,1,4,1,4;ConvOclDirectFwd1x1:1,64,1,1,0,4,16,4,0
240-56-56-1x1-192-56-56-4-0x0-1x1-1x1-0-NCHW-FP16-F=ConvAsm1x1U:1,8,2,32,1,4,2,2;ConvOclDirectFwd1x1:1,128,1,1,0,2,8,4,0
128-104-104-3x3-64-209-209-32-0x0-2x2-1x1-0-NCHW-FP32-B=ConvOclDirectFwd:32,32,32,32,1,1,8,2,2
320-28-28-1x1-128-28-28-2-0x0-1x1-1x1-0-NCHW-FP32-F=ConvAsm1x1U:2,8,2,32,1,4,4,2;ConvOclDirectFwd1x1:1,64,1,1,1,0,16,128,0
1024-15-15-1x1-256-15-15-256-0x0-1x1-1x1-0-NCHW-FP32-W=ConvAsmBwdWrW1x1:2,8,4,8,4,1,1,4,0,2
128-56-56-1x1-64-56-56-512-0x0-1x1-1x1-0-NCHW-FP32-W=ConvAsmBwdWrW1x1:4,4,4,2,8,1,4,4,0,1
256-7-7-1x1-832-7-7-512-0x0-1x1-1x1-0-NCHW-FP32-W=ConvAsmBwdWrW1x1:1,16,4,8,4,1,2,4,0,2
5-10-10-3x3-3-10-10-256-1x1-1x1-1x1-0-NCHW-FP16-B=ConvOclDirectFwd:16,8,16,16,1,2,1,2,2
1024-17-17-1x1-128-17-17-8-0x0-1x1-1x1-0-NCHW-FP16-F=ConvAsm1x1U:2,8,6,32,1,4,4,1;ConvOclDirectFwd1x1:1,128,1,1,0,1,4,8,0
960-7-7-1x1-240-7-7-64-0x0-1x1-1x1-0-NCHW-FP32-F_g3=ConvOclDirectFwd:8,8,8,8,1,1,8,4,2
256-14-14-1x1-128-14-14-1-0x0-1x1-1x1-0-NCHW-FP16-F=ConvAsm1x1U:1,8,2,16,1,4,4,1;ConvOclDirectFwd1x1:1,256,1,1,0,4,4,4,0
192-56-56-1x1-128-56-56-512-0x0-1x1-1x1-0-NCHW-FP32-W=ConvAsmBwdWrW1x1:2,8,4,2,8,1,4,4,0,2
512-13-13-1x1-1000-13-13-32-0x0-1x1-1x1-0-NCHW-FP16-F=ConvAsm1x1U:3,8,6,32,1,4,1,4;ConvOclDirectFwd1x1:1,64,1,1,0,1,8,4,0
192-14-14-1x1-2064-14-14-64-0x0-1x1-1x1-0-NCHW-FP16-B=ConvAsm1x1U:1,16,2,16,1,2,1,4;ConvOclDirectFwd1x1:1,128,1,1,0,4,8,4,0
1024-7-7-1x1-2048-7-7-64-0x0-1x1-1x1-0-NCHW-FP32-W=ConvAsmBwdWrW1x1:1,16,4,8,4,1,1,4,0,2
192-7-7-1x1-1344-7-7-2-0x0-1x1-1x1-0-NCHW-FP16-B=ConvAsm1x1U:1,8,2,32,1,2,4,1;ConvOclDirectFwd1x1:1,64,1,1,0,1,4,4,0
64-27-27-3x3-256-27-27-32-1x1-1x1-1x1-0-NCHW-FP32-W=ConvAsmBwdWrW3x3:0,0,8,4,3,4
448-8-8-1x1-2048-8-8-1024-0x0-1x1-1x1-0-NCHW-FP16-B=ConvAsm1x1U:1,16,2,32,1,2,1,2;ConvOclDirectFwd1x1:1,256,1,1,0,4,16,4,0
192-35-35-3x3-224-35-35-256-1x1-1x1-1x1-0-NCHW-FP16-F=ConvOclDirectFwd:8,8,16,16,2,2,8,1,1;ConvOclDirectFwdFused:8,8,16,16,2,2,8,2,2
32-7-7-1x1-832-7-7-128-0x0-1x1-1x1-0-NCHW-FP16-B=ConvAsm1x1U:1,16,2,32,1,2,1,1;ConvOclDirectFwd1x1:1,128,1,1,0,1,16,4,0
3-6-6-3x3-4-3-3-512-1x1-2x2-1x1-0-NCHW-FP32-F=ConvOclDirectFwd:8,8,8,8,1,1,2,1,2
128-7-7-1x1-1440-7-7-256-0x0-1x1-1x1-0-NCHW-FP16-B=ConvAsm1x1U:2,16,4,16,1,2,1,2;ConvOclDirectFwd1x1:1,256,1,1,0,1,8,4,0
128-14-14-1x1-416-14-14-4-0x0-1x1-1x1-0-NCHW-FP32-B=ConvAsm1x1U:1,16,1,32,1,2,4,1;ConvOclDirectFwd1x1:1,128,1,1,0,4,4,4,0
16-28-28-5x5-32-28-28-4-2x2-1x1-1x1-0-NCHW-FP16-F=ConvOclDirectFwd:16,16,32,32,2,2,1,2,2;ConvOclDirectFwdFused:8,32,32,32,4,1,1,4,2
116-28-28-1x1-116-28-28-2-0x0-1x1-1x1-0-NCHW-FP32-B=ConvAsm1x1U:4,4,4,4,1,2,2,1;ConvOclDirectFwd1x1:1,256,1,1,0,2,16,4,0
1000-13-13-1x1-512-13-13-64-0x0-1x1-1x1-0-NCHW-FP32-B=ConvAsm1x1U:1,32,1,16,2,1,2,2;ConvOclDirectFwd1x1:1,256,1,1,0,1,32,4,0
128-14-14-1x1-1600-14-14-256-0x0-1x1-1x1-0-NCHW-FP16-B=ConvAsm1x1U:1,16,2,16,1,2,1,2;ConvOclDirectFwd1x1:8,64,16,16,0,2,16,4,1
24-14-14-5x5-64-14-14-32-2x2-1x1-1x1-0-NCHW-FP16-F=ConvOclDirectFwd:8,16,16,16,2,1,4,1,2;ConvOclDirectFwdFused:8,16,16,16,2,1,4,1,2
512-7-7-3x3-512-7-7-256-1x1-1x1-1x1-0-NCHW-FP16-W=ConvAsmBwdWrW3x3:0,0,8,4,2,1
192-27-27-5x5-64-27-27-512-2x2-1x1-1x1-0-NCHW-FP16-F=ConvOclDirectFwd:16,16,32,32,2,2,8,1,2
32-28-28-1x1-192-28-28-128-0x0-1x1-1x1-0-NCHW-FP16-W=ConvAsmBwdWrW1x1:4,4,4,1,8,1,4,4,0,1
128-14-14-1x1-928-14-14-4-0x0-1x1-1x1-0-NCHW-FP32-W=ConvAsmBwdWrW1x1:1,16,2,4,4,1,1,4,0,1
160-28-28-1x1-128-28-28-128-0x0-1x1-1x1-0-NCHW-FP32-B=ConvAsm1x1U:1,32,1,16,1,1,1,1;ConvOclDirectFwd1x1:1,256,1,1,0,4,16,4,0
128-7-7-1x1-640-7-7-16-0x0-1x1-1x1-0-NCHW-FP32-W=ConvAsmBwdWrW1x1:1,16,2,8,2,1,1,4,0,1
128-14-14-1x1-992-14-14-32-0x0-1x1-1x1-0-NCHW-FP32-B=ConvAsm1x1U:1,16,1,32,2,1,1,4;ConvOclDirectFwd1x1:1,64,1,1,0,2,16,4,0
128-14-14-1x1-1504-14-14-2-0x0-1x1-1x1-0-NCHW-FP16-W=ConvAsmBwdWrW1x1:2,8,2,4,4,1,1,4,0,0
192-56-56-1x1-144-56-56-2-0x0-1x1-1x1-0-NCHW-FP32-B=ConvAsm1x1U:1,16,1,64,1,2,2,1;ConvOclDirectFwd1x1:1,64,1,1,0,2,8,8,0
192-7-7-1x1-1200-7-7-4-0x0-1x1-1x1-0-NCHW-FP16-W=ConvAsmBwdWrW1x1:1,16,2,8,2,1,2,4,0,0
24-19-19-3x3-512-19-19-64-1x1-1x1-1x1-0-NCHW-FP32-W=ConvAsmBwdWrW3x3:0,1,8,4,3,2
192-14-14-1x1-480-14-14-256-0x0-1x1-1x1-0-NCHW-FP16-F=ConvAsm1x1U:1,8,2,32,4,4,1,4;ConvOclDirectFwd1x1:1,64,1,1,0,2,32,4,0
16-28-28-1x1-192-28-28-32-0x0-1x1-1x1-0-NCHW-FP32-B=ConvAsm1x1U:1,16,1,32,1,2,1,4;ConvOclDirectFwd1x1:1,64,1,1,0,2,16,4,0
256-14-14-1x1-1024-14-14-64-0x0-1x1-1x1-0-NCHW-FP16-W=ConvAsmBwdWrW1x1:2,8,4,8,2,1,4,4,0,3
32-28-28-5x5-96-28-28-512-2x2-1x1-1x1-0-NCHW-FP32-F=ConvOclDirectFwd:16,16,16,32,1,2,8,1,1;ConvOclDirectFwdFused:16,16,32,32,2,2,8,1,1
128-56-56-1x1-64-56-56-128-0x0-1x1-1x1-0-NCHW-FP32-W=ConvAsmBwdWrW1x1:4,4,4,4,4,1,4,4,0,3
1008-14-14-1x1-192-14-14-16-0x0-1x1-1x1-0-NCHW-FP16-F=ConvAsm1x1U:2,8,4,64,1,4,2,2;ConvOclDirectFwd1x1:1,64,1,1,0,4,8,4,0
192-14-14-1x1-1248-14-14-512-0x0-1x1-1x1-0-NCHW-FP32-W=ConvAsmBwdWrW1x1:1,16,4,4,8,1,2,4,0,1
512-7-7-1x1-512-7-7-2-0x0-1x1-1x1-0-NCHW-FP16-W=ConvAsmBwdWrW1x1:1,16,4,4,2,1,1,4,0,1
1120-7-7-1x1-128-7-7-1-0x0-1x1-1x1-0-NCHW-FP32-F=ConvAsm1x1U:1,8,1,16,1,4,4,1;ConvOclDirectFwd1x1:1,64,1,1,1,1,16,64,0
128-28-28-3x3-128-28-28-1024-1x1-1x1-1x1-0-NCHW-FP16-W=ConvAsmBwdWrW3x3:0,1,8,4,2,4
192-7-7-1x1-1152-7-7-512-0x0-1x1-1x1-0-NCHW-FP16-W=ConvAsmBwdWrW1x1:1,16,8,8,2,1,2,2,0,2
192-7-7-1x1-1536-7-7-64-0x0-1x1-1x1-0-NCHW-FP32-B=ConvAsm1x1U:2,16,2,32,1,2,1,4;ConvOclDirectFwd1x1:8,64,8,8,0,1,16,4,1
192-56-56-1x1-336-56-56-1-0x0-1x1-1x1-0-NCHW-FP16-W=ConvAsmBwdWrW1x1:4,4,4,2,8,1,1,2,0,1
1000-13-13-1x1-512-13-13-16-0x0-1x1-1x1-0-NCHW-FP16-B=ConvAsm1x1U:3,16,6,32,1,2,2,2;ConvOclDirectFwd1x1:1,64,1,1,0,1,8,4,0
192-14-14-1x1-1008-14-14-32-0x0-1x1-1x1-0-NCHW-FP16-W=ConvAsmBwdWrW1x1:2,8,4,8,2,1,1,4,0,1
128-28-28-3x3-128-28-28-1024-1x1-1x1-1x1-0-NCHW-FP32-W=ConvAsmBwdWrW3x3:0,1,8,4,8,4
128-28-28-1x1-416-28-28-1024-0x0-1x1-1x1-0-NCHW-FP16-B=ConvAsm1x1U:1,16,2,16,1,2,1,2;ConvOclDirectFwd1x1:1,256,1,1,0,4,16,4,0
128-14-14-1x1-320-14-14-256-0x0-1x1-1x1-0-NCHW-FP16-W=ConvAsmBwdWrW1x1:4,4,8,4,4,2,2,4,0,1
192-14-14-1x1-384-14-14-128-0x0-1x1-1x1-0-NCHW-FP32-W=ConvAsmBwdWrW1x1:2,8,4,8,4,2,2,4,0,1
384-28-28-1x1-768-28-28-4-0x0-1x1-1x1-0-NCHW-FP16-W=ConvAsmBwdWrW1x1:2,8,4,8,2,1,2,4,0,1
64-14-14-1x1-512-14-14-128-0x0-1x1-1x1-0-NCHW-FP16-W=ConvAsmBwdWrW1x1:2,8,4,8,2,1,4,4,0,1
128-7-7-1x1-1280-7-7-16-0x0-1x1-1x1-0-NCHW-FP32-B=ConvAsm1x1U:1,16,1,64,2,2,2,2;ConvOclDirectFwd1x1:1,64,1,1,0,1,16,4,0
60-14-14-3x3-60-28-28-64-1x1-2x2-1x1-0-NCHW-FP16-B=ConvOclDirectFwd:8,16,32,32,4,2,4,2,2
232-7-7-1x1-232-7-7-8-0x0-1x1-1x1-0-NCHW-FP32-F=ConvAsm1x1U:1,8,1,64,1,4,2,1;ConvOclDirectFwd1x1:1,256,1,1,0,1,4,4,0
192-14-14-1x1-864-14-14-16-0x0-1x1-1x1-0-NCHW-FP16-B=ConvAsm1x1U:1,16,2,16,1,2,2,2;ConvOclDirectFwd1x1:1,128,1,1,0,4,8,4,0
58-28-28-1x1-58-28-28-64-0x0-1x1-1x1-0-NCHW-FP16-W=ConvAsmBwdWrW1x1:4,4,2,4,2,2,4,2,0,2
1440-14-14-1x1-128-14-14-64-0x0-1x1-1x1-0-NCHW-FP16-F=ConvAsm1x1U:2,8,4,64,1,4,2,4;ConvOclDirectFwd1x1:1,64,1,1,0,4,8,4,0
640-14-14-1x1-1280-14-14-512-0x0-1x1-1x1-0-NCHW-FP16-B=ConvAsm1x1U:1,16,2,16,1,2,1,8;ConvOclDirectFwd1x1:1,64,1,1,0,4,16,4,0
512-7-7-3x3-512-14-14-16-1x1-2x2-1x1-0-NCHW-FP32-W=ConvAsmBwdWrW3x3:0,0,8,8,14,1
128-14-14-1x1-1120-14-14-128-0x0-1x1-1x1-0-NCHW-FP32-W=ConvAsmBwdWrW1x1:1,16,4,8,4,2,2,4,0,1
160-64-128-1x1-512-64-128-1-0x0-1x1-1x1-0-NCHW-FP16-B=ConvOclDirectFwd1x1:1,128,1,1,0,4,16,4,0
128-14-14-1x1-1152-14-14-64-0x0-1x1-1x1-0-NCHW-FP32-B=ConvAsm1x1U:1,32,1,32,2,1,1,2;ConvOclDirectFwd1x1:1,128,1,1,0,4,16,4,0
48-35-35-1x1-192-35-35-1-0x0-1x1-1x1-0-NCHW-FP16-W=ConvAsmBwdWrW1x1:4,4,2,2,2,1,1,2,0,1
128-7-7-1x1-864-7-7-4-0x0-1x1-1x1-0-NCHW-FP32-B=ConvAsm1x1U:1,8,1,64,1,2,4,2;ConvOclDirectFwd1x1:1,64,1,1,0,1,4,4,0
32-38-166-5x10-32-79-341-256-0x0-2x2-1x1-0-NCHW-FP32-B=ConvOclDirectFwd:16,32,16,32,1,1,8,4,1
128-28-28-1x1-512-28-28-128-0x0-1x1-1x1-0-NCHW-FP32-F=ConvAsm1x1U:1,16,1,32,4,2,1,2;ConvActivAsm1x1U:1,16,1,16,4,3;ConvOclDirectFwd1x1:16,16,32,32,1,0,32,128,1
192-56-56-1x1-192-56-56-512-0x0-1x1-1x1-0-NCHW-FP32-B=ConvAsm1x1U:2,16,2,32,1,2,1,4;ConvOclDirectFwd1x1:1,64,1,1,0,2,32,4,0
192-14-14-1x1-1296-14-14-1024-0x0-1x1-1x1-0-NCHW-FP16-W=ConvAsmBwdWrW1x1:2,8,8,4,4,1,1,4,0,1
1024-17-17-1x1-192-17-17-8-0x0-1x1-1x1-0-NCHW-FP32-F=ConvAsm1x1U:4,8,4,16,1,4,1,4;ConvActivAsm1x1U:2,16,2,32,4,3;ConvOclDirectFwd1x1:1,64,1,1,1,1,16,256,0
64-14-14-5x5-32-14-14-1-2x2-1x1-1x1-0-NCHW-FP16-B=ConvOclDirectFwd:16,16,16,16,1,1,1,4,1
512-28-28-1x1-1024-14-14-8-0x0-2x2-1x1-0-NCHW-FP16-F=ConvAsm1x1U:2,8,4,64,1,4,1,4;ConvOclDirectFwd1x1:1,256,1,1,0,2,16,4,0
128-14-14-1x1-512-14-14-1-0x0-1x1-1x1-0-NCHW-FP16-B=ConvAsm1x1U:1,8,2,32,1,4,4,2;ConvOclDirectFwd1x1:1,128,1,1,0,1,4,4,0
128-7-7-1x1-800-7-7-4-0x0-1x1-1x1-0-NCHW-FP32-W=ConvAsmBwdWrW1x1:1,16,2,8,2,1,1,2,0,1
32-28-28-3x3-128-28-28-128-1x1-1x1-1x1-0-NCHW-FP16-F=ConvOclDirectFwd:16,16,32,32,2,2,8,4,2
1280-7-7-1x1-128-7-7-1-0x0-1x1-1x1-0-NCHW-FP32-F=ConvAsm1x1U:1,8,1,16,1,4,4,1;ConvOclDirectFwd1x1:1,64,1,1,1,1,16,64,0
64-75-75-3x3-64-75-75-32-1x1-1x1-1x1-0-NCHW-FP32-W=ConvAsmBwdWrW3x3:0,0,16,4,2,4
2048-7-7-1x1-1024-7-7-32-0x0-1x1-1x1-0-NCHW-FP32-B=ConvAsm1x1U:2,16,2,32,1,2,2,4;ConvOclDirectFwd1x1:1,64,1,1,0,1,16,4,0
192-17-17-7x1-192-17-17-64-3x0-1x1-1x1-0-NCHW-FP32-W=ConvOclBwdWrW2<4>:1,6,3,8,7;ConvOclBwdWrW2<1>:1,9,8,3,9;ConvOclBwdWrW2<16>:1,6,8,3,7;ConvOclBwdWrW2<8>:1,7,8,3,9;ConvOclBwdWrW2<2>:1,6,8,3,7
192-8-8-1x1-2048-8-8-2-0x0-1x1-1x1-0-NCHW-FP16-B=ConvAsm1x1U:1,8,2,32,1,4,4,4;ConvOclDirectFwd1x1:1,64,1,1,0,1,4,4,0
1696-7-7-1x1-128-7-7-1024-0x0-1x1-1x1-0-NCHW-FP16-F=ConvAsm1x1U:2,8,4,16,1,4,2,2;ConvOclDirectFwd1x1:1,128,1,1,0,1,8,4,0
232-7-7-1x1-232-7-7-16-0x0-1x1-1x1-0-NCHW-FP16-B=ConvAsm1x1U:1,8,2,16,1,2,4,2;ConvOclDirectFwd1x1:1,64,1,1,0,1,4,4,0
480-28-28-1x1-128-28-28-256-0x0-1x1-1x1-0-NCHW-FP16-W=ConvAsmBwdWrW1x1:4,4,8,4,4,2,2,4,0,1
1568-7-7-1x1-128-7-7-64-0x0-1x1-1x1-0-NCHW-FP32-F=ConvAsm1x1U:4,8,4,16,1,4,2,2;ConvOclDirectFwd1x1:1,64,1,1,1,0,16,256,0
64-56-56-1x1-64-56-56-512-0x0-1x1-1x1-0-NCHW-FP16-W=ConvAsmBwdWrW1x1:4,4,4,1,8,1,4,4,0,3
256-28-28-1x1-128-28-28-32-0x0-1x1-1x1-0-NCHW-FP16-F=ConvAsm1x1U:1,8,2,32,2,4,1,4;ConvOclDirectFwd1x1:1,128,1,1,0,2,8,4,0
64-256-256-1x1-64-256-256-4-0x0-1x1-1x1-0-NCHW-FP32-F=ConvOclDirectFwd1x1:1,64,1,1,1,1,64,2048,0
128-7-7-1x1-704-7-7-64-0x0-1x1-1x1-0-NCHW-FP32-B=ConvAsm1x1U:1,16,1,64,2,2,2,2;ConvOclDirectFwd1x1:1,64,1,1,0,1,16,8,0
128-14-14-1x1-928-14-14-128-0x0-1x1-1x1-0-NCHW-FP16-F=ConvAsm1x1U:2,8,4,64,1,4,1,8;ConvOclDirectFwd1x1:1,256,1,1,0,4,8,4,0
256-14-14-3x3-128-28-28-4-1x1-2x2-1x1-0-NCHW-FP16-B=ConvOclDirectFwd:16,32,32,32,2,1,2,4,2
128-14-14-1x1-1056-14-14-8-0x0-1x1-1x1-0-NCHW-FP32-W=ConvAsmBwdWrW1x1:1,16,2,8,4,1,2,4,0,1
64-13-13-1x1-512-13-13-512-0x0-1x1-1x1-0-NCHW-FP32-W=ConvAsmBwdWrW1x1:4,4,4,2,4,1,1,4,0,1
128-14-14-1x1-320-14-14-128-0x0-1x1-1x1-0-NCHW-FP16-B=ConvAsm1x1U:1,16,2,16,1,2,2,2;ConvOclDirectFwd1x1:1,64,1,1,0,4,16,4,0
544-14-14-1x1-128-14-14-128-0x0-1x1-1x1-0-NCHW-FP32-B=ConvAsm1x1U:1,32,1,16,2,1,4,1;ConvOclDirectFwd1x1:1,64,1,1,0,2,16,4,0
512-28-28-1x1-1024-14-14-512-0x0-2x2-1x1-0-NCHW-FP16-F=ConvAsm1x1U:2,8,4,64,1,4,1,8;ConvOclDirectFwd1x1:1,256,1,1,0,2,32,4,0
2048-8-8-1x1-192-8-8-1024-0x0-1x1-1x1-0-NCHW-FP16-F=ConvAsm1x1U:2,8,4,16,2,4,1,4;ConvOclDirectFwd1x1:1,64,1,1,0,2,8,4,0
512-7-7-3x3-256-14-14-8-1x1-2x2-1x1-0-NCHW-FP16-B=ConvOclDirectFwd:16,8,16,16,1,2,2,2,1
58-28-28-1x1-58-28-28-512-0x0-1x1-1x1-0-NCHW-FP32-B=ConvAsm1x1U:4,1,4,4,2,2,1,8;ConvOclDirectFwd1x1:1,256,1,1,0,4,8,4,0
512-7-7-1x1-2048-7-7-2-0x0-1x1-1x1-0-NCHW-FP32-B=ConvAsm1x1U:2,16,2,32,1,2,4,1;ConvOclDirectFwd1x1:1,256,1,1,0,1,4,4,0
192-28-28-1x1-672-28-28-256-0x0-1x1-1x1-0-NCHW-FP16-B=ConvAsm1x1U:1,16,2,16,1,2,2,2;ConvOclDirectFwd1x1:1,128,1,1,0,4,16,4,0
512-16-16-3x3-512-7-7-64-0x0-2x2-1x1-0-NCHW-FP32-F=ConvOclDirectFwd:8,8,8,8,1,1,8,1,2
192-14-14-1x1-2064-14-14-16-0x0-1x1-1x1-0-NCHW-FP32-W=ConvAsmBwdWrW1x1:1,16,4,4,8,1,1,4,0,1
480-28-28-1x1-192-28-28-128-0x0-1x1-1x1-0-NCHW-FP16-F=ConvAsm1x1U:2,8,4,16,1,4,1,8;ConvOclDirectFwd1x1:1,256,1,1,0,4,8,4,0
1968-14-14-1x1-192-14-14-32-0x0-1x1-1x1-0-NCHW-FP32-F=ConvAsm1x1U:1,16,3,16,2,2,2,2;ConvOclDirectFwd1x1:1,64,1,1,1,1,16,2048,0
928-7-7-1x1-128-7-7-256-0x0-1x1-1x1-0-NCHW-FP32-W=ConvAsmBwdWrW1x1:1,16,2,4,8,1,2,4,0,2
256-56-56-1x1-128-56-56-64-0x0-1x1-1x1-0-NCHW-FP16-W=ConvAsmBwdWrW1x1:2,8,4,4,4,1,4,4,0,1
192-56-56-1x1-192-56-56-8-0x0-1x1-1x1-0-NCHW-FP32-B=ConvAsm1x1U:1,16,1,64,2,2,1,4;ConvOclDirectFwd1x1:1,128,1,1,0,2,16,4,0
256-28-28-1x1-32-28-28-16-0x0-1x1-1x1-0-NCHW-FP32-F=ConvAsm1x1U:1,8,1,16,1,4,2,2;ConvActivAsm1x1U:1,16,1,16,2,3;ConvOclDirectFwd1x1:1,64,1,1,1,4,16,128,0
1024-7-7-1x1-464-7-7-256-0x0-1x1-1x1-0-NCHW-FP32-B=ConvAsm1x1U:2,16,2,32,1,2,4,1;ConvOclDirectFwd1x1:1,256,1,1,0,1,16,8,0
384-14-14-1x1-128-14-14-128-0x0-1x1-1x1-0-NCHW-FP16-W=ConvAsmBwdWrW1x1:4,4,8,4,4,2,2,4,0,1
384-8-8-1x1-1536-8-8-32-0x0-1x1-1x1-0-NCHW-FP16-W=ConvAsmBwdWrW1x1:1,16,4,8,2,1,2,4,0,1
128-14-14-1x1-1536-14-14-4-0x0-1x1-1x1-0-NCHW-FP16-W=ConvAsmBwdWrW1x1:2,8,2,4,4,1,1,4,0,0
256-13-13-1x1-64-13-13-4-0x0-1x1-1x1-0-NCHW-FP16-B=ConvAsm1x1U:1,8,2,64,1,4,4,1;ConvOclDirectFwd1x1:1,64,1,1,0,1,4,8,0
128-14-14-1x1-1504-14-14-256-0x0-1x1-1x1-0-NCHW-FP32-W=ConvAsmBwdWrW1x1:1,16,2,8,8,1,2,4,0,1
128-7-7-1x1-1632-7-7-2-0x0-1x1-1x1-0-NCHW-FP32-W=ConvAsmBwdWrW1x1:1,16,2,4,4,1,1,4,0,1
1056-14-14-1x1-2112-14-14-8-0x0-1x1-1x1-0-NCHW-FP32-B=ConvAsm1x1U:1,32,1,16,2,1,2,2;ConvOclDirectFwd1x1:1,128,1,1,0,4,16,4,0
512-7-7-3x3-512-4-4-32-1x1-2x2-1x1-0-NCHW-FP32-F=ConvOclDirectFwd:8,8,8,8,1,1,8,2,2
32-149-149-3x3-3-299-299-2-0x0-2x2-1x1-0-NCHW-FP16-B=ConvOclDirectFwd:16,16,16,32,1,2,2,4,1
192-7-7-1x1-1584-7-7-32-0x0-1x1-1x1-0-NCHW-FP32-W=ConvAsmBwdWrW1x1:1,16,2,8,4,1,2,4,0,3
128-28-28-1x1-64-56-56-4-0x0-2x2-1x1-0-NCHW-FP16-B=ConvAsm1x1U:1,8,2,16,1,2,4,2;ConvOclDirectFwd1x1:1,128,1,1,0,2,4,4,0
192-56-56-1x1-192-56-56-2-0x0-1x1-1x1-0-NCHW-FP32-W=ConvAsmBwdWrW1x1:2,8,2,8,2,1,1,4,0,2
512-7-7-1x1-2048-7-7-2-0x0-1x1-1x1-0-NCHW-FP32-F=ConvAsm1x1U:4,8,4,16,1,4,2,2;ConvActivAsm1x1U:1,16,1,64,2,2;ConvOclDirectFwd1x1:8,8,8,8,1,0,32,128,1
128-7-7-1x1-1184-7-7-1024-0x0-1x1-1x1-0-NCHW-FP16-W=ConvAsmBwdWrW1x1:2,8,8,4,4,2,1,2,0,2
192-28-28-1x1-672-28-28-4-0x0-1x1-1x1-0-NCHW-FP32-W=ConvAsmBwdWrW1x1:1,16,2,4,8,1,2,4,0,1
1440-7-7-1x1-192-7-7-128-0x0-1x1-1x1-0-NCHW-FP32-F=ConvAsm1x1U:4,8,4,16,1,4,2,4;ConvOclDirectFwd1x1:1,64,1,1,1,4,16,2048,0
256-56-56-1x1-128-56-56-64-0x0-1x1-1x1-0-NCHW-FP32-W=ConvAsmBwdWrW1x1:2,8,2,4,8,1,4,4,0,2
64-112-112-1x1-64-112-112-8-0x0-1x1-1x1-0-NCHW-FP32-B=ConvAsm1x1U:1,16,1,64,1,2,1,4;ConvOclDirectFwd1x1:1,64,1,1,0,2,16,4,0
448-14-14-1x1-128-14-14-128-0x0-1x1-1x1-0-NCHW-FP32-F=ConvAsm1x1U:4,16,4,64,1,2,2,1;ConvOclDirectFwd1x1:1,64,1,1,1,1,16,2048,0
192-13-13-1x1-48-13-13-32-0x0-1x1-1x1-0-NCHW-FP32-W=ConvAsmBwdWrW1x1:2,8,2,4,4,1,4,4,0,1
128-14-14-1x1-416-14-14-512-0x0-1x1-1x1-0-NCHW-FP16-B=ConvAsm1x1U:1,16,2,16,1,2,1,2;ConvOclDirectFwd1x1:1,256,1,1,0,4,16,4,0
64-27-27-1x1-256-27-27-256-0x0-1x1-1x1-0-NCHW-FP16-W=ConvAsmBwdWrW1x1:4,4,4,4,4,1,4,4,0,2
384-7-7-3x3-192-7-7-1-1x1-1x1-1x1-0-NCHW-FP16-B=ConvOclDirectFwd:8,8,8,8,1,1,1,4,1
256-14-14-1x1-1024-14-14-2-0x0-1x1-1x1-0-NCHW-FP16-F=ConvAsm1x1U:1,8,2,32,1,4,2,2;ConvOclDirectFwd1x1:1,128,1,1,0,2,8,4,0
116-28-28-1x1-116-28-28-2-0x0-1x1-1x1-0-NCHW-FP16-B=ConvAsm1x1U:3,4,6,4,1,2,1,1;ConvOclDirectFwd1x1:1,64,1,1,0,1,16,4,0
64-35-35-1x1-192-35-35-1024-0x0-1x1-1x1-0-NCHW-FP16-W=ConvAsmBwdWrW1x1:4,4,4,4,4,1,4,4,0,2
256-28-28-3x3-256-28-28-64-1x1-1x1-1x1-0-NCHW-FP32-W_g32=ConvOclBwdWrW2<4>:1,6,3,1,7;ConvOclBwdWrW2<16>:1,9,8,1,7;ConvOclBwdWrW2<2>:1,7,8,1,7;ConvOclBwdWrW2<1>:1,7,8,1,7;ConvAsmBwdWrW3x3:0,0,8,4,2,8;ConvOclBwdWrW2<8>:1,7,8,1,7
128-28-28-1x1-256-14-14-512-0x0-2x2-1x1-0-NCHW-FP16-F=ConvAsm1x1U:2,8,4,64,1,4,1,8;ConvOclDirectFwd1x1:1,256,1,1,0,2,32,4,0
128-28-28-3x3-32-28-28-8-1x1-1x1-1x1-0-NCHW-FP16-F=ConvOclDirectFwd:16,16,32,32,2,2,2,4,2
128-28-28-1x1-256-28-28-8-0x0-1x1-1x1-0-NCHW-FP16-B=ConvAsm1x1U:1,8,2,32,2,4,1,4;ConvOclDirectFwd1x1:1,64,1,1,0,2,8,4,0
1664-7-7-1x1-128-7-7-128-0x0-1x1-1x1-0-NCHW-FP32-F=ConvAsm1x1U:4,16,4,16,1,2,2,2;ConvOclDirectFwd1x1:1,64,1,1,1,0,16,2048,0
192-14-14-1x1-528-14-14-32-0x0-1x1-1x1-0-NCHW-FP16-W=ConvAsmBwdWrW1x1:4,4,8,4,4,1,1,2,0,1
1696-7-7-1x1-128-7-7-4-0x0-1x1-1x1-0-NCHW-FP16-F=ConvAsm1x1U:1,8,2,32,1,4,4,1;ConvOclDirectFwd1x1:1,128,1,1,0,1,4,8,0
64-56-56-1x1-256-56-56-256-0x0-1x1-1x1-0-NCHW-FP16-W=ConvAsmBwdWrW1x1:4,4,8,4,2,1,2,4,0,1
192-7-7-1x1-1488-7-7-1-0x0-1x1-1x1-0-NCHW-FP32-W=ConvAsmBwdWrW1x1:1,16,2,2,8,1,1,4,0,0
128-64-128-5x5-32-64-128-1-2x2-1x1-1x1-0-NCHW-FP32-B=ConvOclDirectFwd:8,32,16,32,2,1,2,1,1
192-14-14-1x1-960-14-14-2-0x0-1x1-1x1-0-NCHW-FP16-B=ConvAsm1x1U:1,16,2,32,1,2,4,2;ConvOclDirectFwd1x1:1,256,1,1,0,4,4,4,0
528-28-28-1x1-192-28-28-128-0x0-1x1-1x1-0-NCHW-FP16-F=ConvAsm1x1U:1,8,2,32,2,4,1,4;ConvOclDirectFwd1x1:1,128,1,1,0,4,16,4,0
128-27-27-3x3-128-27-27-2-1x1-1x1-1x1-0-NCHW-FP32-W=ConvAsmBwdWrW3x3:0,1,8,4,2,1
480-14-14-1x1-120-14-14-4-0x0-1x1-1x1-0-NCHW-FP16-F_g3=ConvOclDirectFwd:8,8,8,8,1,1,4,2,2
192-28-28-1x1-16-28-28-256-0x0-1x1-1x1-0-NCHW-FP32-F=ConvAsm1x1U:3,16,3,64,1,2,4,1;ConvActivAsm1x1U:1,16,1,32,2,3;ConvOclDirectFwd1x1:1,64,1,1,1,0,32,2048,0
48-27-27-3x3-192-27-27-128-1x1-1x1-1x1-0-NCHW-FP32-W=ConvAsmBwdWrW3x3:0,1,8,4,3,4
128-14-14-1x1-672-14-14-2-0x0-1x1-1x1-0-NCHW-FP16-B=ConvAsm1x1U:1,8,2,32,1,4,4,1;ConvOclDirectFwd1x1:1,64,1,1,0,4,4,4,0
128-14-14-1x1-416-14-14-64-0x0-1x1-1x1-0-NCHW-FP16-W=ConvAsmBwdWrW1x1:4,4,8,4,4,1,2,2,0,1
1280-8-8-1x1-448-8-8-256-0x0-1x1-1x1-0-NCHW-FP16-F=ConvAsm1x1U:1,8,2,32,4,4,1,8;ConvOclDirectFwd1x1:1,128,1,1,0,4,8,4,0
192-28-28-1x1-32-28-28-128-0x0-1x1-1x1-0-NCHW-FP16-B=ConvAsm1x1U:1,8,2,32,1,4,1,4;ConvOclDirectFwd1x1:1,64,1,1,0,4,16,8,0
1024-7-7-3x3-1024-14-14-4-1x1-2x2-1x1-0-NCHW-FP32-B_g32=ConvOclDirectFwd:8,8,8,8,1,1,2,2,2
1504-14-14-1x1-128-14-14-64-0x0-1x1-1x1-0-NCHW-FP32-F=ConvAsm1x1U:4,16,4,64,1,2,1,1;ConvOclDirectFwd1x1:1,64,1,1,1,1,16,2048,0
128-14-14-1x1-704-14-14-32-0x0-1x1-1x1-0-NCHW-FP16-B=ConvAsm1x1U:1,16,2,16,1,2,1,4;ConvOclDirectFwd1x1:1,128,1,1,0,4,8,4,0
64-56-56-1x1-256-56-56-512-0x0-1x1-1x1-0-NCHW-FP32-B=ConvAsm1x1U:1,16,1,64,2,1,1,2;ConvOclDirectFwd1x1:1,128,1,1,0,1,32,4,0
1024-14-14-1x1-256-14-14-4-0x0-1x1-1x1-0-NCHW-FP16-W=ConvAsmBwdWrW1x1:1,16,2,8,2,1,1,4,0,1
3-300-300-7x7-64-150-150-64-3x3-2x2-1x1-0-NCHW-FP32-F=ConvOclDirectFwd:32,8,32,32,1,4,8,1,1
1024-14-14-1x1-512-7-7-32-0x0-2x2-1x1-0-NCHW-FP32-F=ConvAsm1x1U:4,8,4,16,1,4,2,2;ConvOclDirectFwd1x1:1,64,1,1,1,0,32,256,0
192-7-7-1x1-2016-7-7-128-0x0-1x1-1x1-0-NCHW-FP32-W=ConvAsmBwdWrW1x1:1,16,2,4,8,1,2,4,0,3
128-14-14-1x1-1248-14-14-256-0x0-1x1-1x1-0-NCHW-FP16-W=ConvAsmBwdWrW1x1:2,8,4,8,2,1,4,4,0,1
128-14-14-1x1-736-14-14-8-0x0-1x1-1x1-0-NCHW-FP16-W=ConvAsmBwdWrW1x1:2,8,4,4,4,1,2,4,0,0
240-28-28-1x1-60-28-28-8-0x0-1x1-1x1-0-NCHW-FP32-F_g3=ConvOclDirectFwd:16,16,16,16,1,1,8,2,2
1696-7-7-1x1-128-7-7-256-0x0-1x1-1x1-0-NCHW-FP32-F=ConvAsm1x1U:4,16,4,16,1,2,1,4;ConvOclDirectFwd1x1:1,64,1,1,1,4,64,2048,0
64-27-27-1x1-384-27-27-2-0x0-1x1-1x1-0-NCHW-FP16-W=ConvAsmBwdWrW1x1:2,8,2,4,2,1,1,4,0,1
384-13-13-3x3-384-13-13-64-1x1-1x1-1x1-0-NCHW-FP16-B=ConvOclDirectFwd:8,8,16,16,2,2,8,2,1
2160-7-7-1x1-192-7-7-4-0x0-1x1-1x1-0-NCHW-FP16-F=ConvAsm1x1U:1,8,2,32,1,4,4,1;ConvOclDirectFwd1x1:1,64,1,1,0,1,4,8,0
128-14-14-1x1-896-14-14-512-0x0-1x1-1x1-0-NCHW-FP32-W=ConvAsmBwdWrW1x1:2,8,4,8,4,1,2,4,0,1
48-35-35-1x1-256-35-35-1-0x0-1x1-1x1-0-NCHW-FP32-W=ConvAsmBwdWrW1x1:4,4,4,2,2,1,1,4,0,1
512-7-7-1x1-256-14-14-4-0x0-2x2-1x1-0-NCHW-FP32-W=ConvAsmBwdWrW1x1:1,16,2,4,2,1,1,4,0,2
192-14-14-1x1-1776-14-14-128-0x0-1x1-1x1-0-NCHW-FP32-B=ConvAsm1x1U:1,16,1,64,2,2,1,1;ConvOclDirectFwd1x1:1,64,1,1,0,2,16,4,0
128-7-7-1x1-768-7-7-256-0x0-1x1-1x1-0-NCHW-FP32-B=ConvAsm1x1U:2,16,2,32,1,2,1,4;ConvOclDirectFwd1x1:1,128,1,1,0,1,16,8,0
256-28-28-3x3-256-56-56-128-1x1-2x2-1x1-0-NCHW-FP32-B_g32=ConvOclDirectFwd:16,16,16,32,1,2,8,1,1
864-14-14-1x1-128-14-14-128-0x0-1x1-1x1-0-NCHW-FP32-B=ConvAsm1x1U:1,32,1,16,2,1,4,1;ConvOclDirectFwd1x1:1,64,1,1,0,4,16,4,0
128-54-54-3x3-32-54-54-32-1x1-1x1-1x1-0-NCHW-FP16-F=ConvOclDirectFwd:16,16,32,32,2,2,8,4,2
128-14-14-1x1-1536-14-14-2-0x0-1x1-1x1-0-NCHW-FP32-W=ConvAsmBwdWrW1x1:1,16,2,4,8,1,2,4,0,0
128-28-28-1x1-384-28-28-8-0x0-1x1-1x1-0-NCHW-FP32-B=ConvAsm1x1U:2,16,2,16,1,2,2,2;ConvOclDirectFwd1x1:16,64,32,32,0,2,16,4,1
64-35-35-5x5-48-35-35-64-2x2-1x1-1x1-0-NCHW-FP32-W=ConvOclBwdWrW2<4>:1,7,3,3,7;ConvOclBwdWrW2<1>:1,7,3,3,7;ConvOclBwdWrW2<16>:1,9,3,3,7;ConvOclBwdWrW2<8>:1,9,1,3,5;ConvOclBwdWrW2<2>:1,7,3,3,7
352-7-7-1x1-1024-7-7-32-0x0-1x1-1x1-0-NCHW-FP32-W=ConvAsmBwdWrW1x1:1,16,2,8,4,1,2,4,0,3
256-57-57-1x1-128-57-57-8-0x0-1x1-1x1-0-NCHW-FP32-W=ConvAsmBwdWrW1x1:2,8,2,4,2,1,1,4,0,2
1504-7-7-1x1-128-7-7-8-0x0-1x1-1x1-0-NCHW-FP32-F=ConvAsm1x1U:1,8,1,32,1,4,4,1;ConvOclDirectFwd1x1:1,64,1,1,1,1,16,128,0
192-7-7-1x1-1200-7-7-4-0x0-1x1-1x1-0-NCHW-FP16-B=ConvAsm1x1U:1,8,2,32,1,4,4,1;ConvOclDirectFwd1x1:1,256,1,1,0,1,4,4,0
256-14-14-1x1-512-7-7-2-0x0-2x2-1x1-0-NCHW-FP32-F=ConvAsm1x1U:1,8,1,32,1,4,4,1;ConvOclDirectFwd1x1:1,64,1,1,1,4,16,64,0
512-28-28-1x1-256-56-56-256-0x0-2x2-1x1-0-NCHW-FP32-B=ConvAsm1x1U:1,16,1,32,3,2,1,4;ConvOclDirectFwd1x1:1,256,1,1,0,1,32,4,0
384-28-28-1x1-192-28-28-64-0x0-1x1-1x1-0-NCHW-FP16-F=ConvAsm1x1U:2,8,4,16,1,4,1,8;ConvOclDirectFwd1x1:1,128,1,1,0,4,8,4,0
120-7-7-3x3-120-14-14-1-1x1-2x2-1x1-0-NCHW-FP32-B=ConvOclDirectFwd:8,8,16,8,2,1,1,4,1
192-7-7-1x1-1248-7-7-256-0x0-1x1-1x1-0-NCHW-FP32-B=ConvAsm1x1U:2,16,2,32,1,2,1,2;ConvOclDirectFwd1x1:1,256,1,1,0,1,32,4,0
192-14-14-1x1-864-14-14-512-0x0-1x1-1x1-0-NCHW-FP32-B=ConvAsm1x1U:1,32,1,16,2,1,1,1;ConvOclDirectFwd1x1:1,64,1,1,0,1,32,4,0
192-28-28-1x1-32-28-28-128-0x0-1x1-1x1-0-NCHW-FP16-W=ConvAsmBwdWrW1x1:4,4,4,4,2,1,4,4,0,2
1824-7-7-1x1-192-7-7-128-0x0-1x1-1x1-0-NCHW-FP16-F=ConvAsm1x1U:2,16,4,16,1,2,2,2;ConvOclDirectFwd1x1:1,64,1,1,0,1,8,4,0
1280-14-14-1x1-128-14-14-128-0x0-1x1-1x1-0-NCHW-FP16-F=ConvAsm1x1U:2,8,4,64,1,4,1,8;ConvOclDirectFwd1x1:1,64,1,1,0,2,8,4,0
1824-7-7-1x1-128-7-7-128-0x0-1x1-1x1-0-NCHW-FP32-F=ConvAsm1x1U:4,16,4,16,1,2,2,2;ConvOclDirectFwd1x1:1,64,1,1,1,0,16,2048,0
256-28-28-3x3-256-28-28-6-1x1-1x1-1x1-0-NCHW-FP32-W_g32=ConvOclBwdWrW2<1>:1,6,3,1,7;ConvOclBwdWrW2<4>:1,6,3,1,7;ConvAsmBwdWrW3x3:0,1,16,2,2,3;ConvOclBwdWrW2<2>:1,7,8,1,7
128-14-14-1x1-1248-14-14-16-0x0-1x1-1x1-0-NCHW-FP32-B=ConvAsm1x1U:1,16,1,32,2,2,1,4;ConvOclDirectFwd1x1:1,128,1,1,0,2,16,4,0
384-35-35-1x1-96-35-35-128-0x0-1x1-1x1-0-NCHW-FP32-F=ConvAsm1x1U:2,16,3,32,2,2,1,1;ConvActivAsm1x1U:3,16,3,32,4,1;ConvOclDirectFwd1x1:1,64,1,1,1,4,16,2048,0
256-56-56-1x1-128-28-28-8-0x0-2x2-1x1-0-NCHW-FP32-F=ConvAsm1x1U:2,8,2,32,1,4,1,4;ConvOclDirectFwd1x1:1,64,1,1,1,0,16,2048,0
32-147-147-3x3-64-147-147-1-1x1-1x1-1x1-0-NCHW-FP16-F=ConvOclDirectFwd:16,16,16,32,1,2,8,2,1;ConvOclDirectFwdFused:16,16,16,32,1,2,8,2,1
128-14-14-1x1-512-14-14-1024-0x0-1x1-1x1-0-NCHW-FP16-B=ConvAsm1x1U:1,16,2,16,1,2,1,8;ConvOclDirectFwd1x1:1,256,1,1,0,4,16,4,0
128-56-56-3x3-256-56-56-128-1x1-1x1-1x1-0-NCHW-FP32-W=ConvAsmBwdWrW3x3:0,1,8,4,2,4
256-28-28-1x1-64-56-56-8-0x0-2x2-1x1-0-NCHW-FP32-B=ConvAsm1x1U:1,16,1,32,1,1,4,1;ConvOclDirectFwd1x1:1,128,1,1,0,1,8,4,0
384-13-13-3x3-192-13-13-50-1x1-1x1-1x1-0-NCHW-FP16-W=ConvAsmBwdWrW3x3:0,0,8,4,3,1
256-28-28-1x1-512-28-28-32-0x0-1x1-1x1-0-NCHW-FP32-B=ConvAsm1x1U:1,16,1,32,2,2,1,4;ConvOclDirectFwd1x1:1,64,1,1,0,4,16,4,0
192-56-56-1x1-336-56-56-64-0x0-1x1-1x1-0-NCHW-FP32-B=ConvAsm1x1U:1,16,1,64,2,2,1,2;ConvOclDirectFwd1x1:1,64,1,1,0,4,16,4,0
64-13-13-1x1-384-13-13-32-0x0-1x1-1x1-0-NCHW-FP16-B=ConvAsm1x1U:1,16,2,32,1,2,1,2;ConvOclDirectFwd1x1:1,256,1,1,0,1,4,4,0
32-28-28-3x3-128-28-28-128-1x1-1x1-1x1-0-NCHW-FP32-W=ConvAsmBwdWrW3x3:0,1,8,4,6,4
192-56-56-1x1-288-56-56-256-0x0-1x1-1x1-0-NCHW-FP16-W=ConvAsmBwdWrW1x1:4,4,8,4,4,2,2,2,0,1
192-71-71-3x3-80-73-73-2-0x0-1x1-1x1-0-NCHW-FP16-B=ConvOclDirectFwd:16,8,16,16,1,2,8,4,2
1392-14-14-1x1-192-14-14-256-0x0-1x1-1x1-0-NCHW-FP16-F=ConvAsm1x1U:2,8,4,64,1,4,1,4;ConvOclDirectFwd1x1:1,256,1,1,0,4,8,4,0
240-7-7-1x1-960-7-7-8-0x0-1x1-1x1-0-NCHW-FP32-F_g3=ConvOclDirectFwd:8,8,8,8,1,1,8,4,2
512-7-7-1x1-512-7-7-16-0x0-1x1-1x1-0-NCHW-FP32-F=ConvAsm1x1U:2,8,2,32,1,4,1,8;ConvActivAsm1x1U:1,16,2,32,2,4;ConvOclDirectFwd1x1:1,64,1,1,1,4,16,256,0
192-14-14-1x1-864-14-14-4-0x0-1x1-1x1-0-NCHW-FP32-B=ConvAsm1x1U:1,16,1,16,1,2,2,2;ConvOclDirectFwd1x1:1,64,1,1,0,4,8,4,0
128-39-174-5x5-64-80-350-128-1x1-2x2-1x1-0-NCHW-FP32-B=ConvOclDirectFwd:16,16,16,32,1,2,4,1,1
160-14-14-1x1-512-14-14-128-0x0-1x1-1x1-0-NCHW-FP16-B=ConvAsm1x1U:1,16,2,16,1,2,1,8;ConvOclDirectFwd1x1:1,256,1,1,0,2,16,4,0
128-7-7-1x1-1504-7-7-4-0x0-1x1-1x1-0-NCHW-FP32-W=ConvAsmBwdWrW1x1:1,16,2,8,2,1,1,4,0,1
128-7-7-1x1-1376-7-7-2-0x0-1x1-1x1-0-NCHW-FP32-W=ConvAsmBwdWrW1x1:1,16,2,4,4,1,1,4,0,1
64-14-14-1x1-480-14-14-64-0x0-1x1-1x1-0-NCHW-FP16-B=ConvAsm1x1U:1,16,2,16,1,2,1,4;ConvOclDirectFwd1x1:1,64,1,1,0,4,8,4,0
192-14-14-1x1-1632-14-14-512-0x0-1x1-1x1-0-NCHW-FP32-W=ConvAsmBwdWrW1x1:1,16,4,4,8,2,1,4,0,1
16-55-55-1x1-64-55-55-2-0x0-1x1-1x1-0-NCHW-FP32-W=ConvAsmBwdWrW1x1:4,4,2,1,2,1,2,4,0,2
192-13-13-3x3-48-13-13-128-1x1-1x1-1x1-0-NCHW-FP16-B=ConvOclDirectFwd:8,8,16,16,2,2,8,4,2
192-14-14-1x1-1824-14-14-1-0x0-1x1-1x1-0-NCHW-FP32-W=ConvAsmBwdWrW1x1:1,16,4,4,4,1,1,4,0,0
128-7-7-1x1-1792-7-7-4-0x0-1x1-1x1-0-NCHW-FP16-W=ConvAsmBwdWrW1x1:1,16,2,8,2,1,1,2,0,1
224-56-56-1x1-128-56-56-32-0x0-1x1-1x1-0-NCHW-FP16-W=ConvAsmBwdWrW1x1:4,4,4,1,8,2,1,4,0,1
128-7-7-1x1-544-7-7-256-0x0-1x1-1x1-0-NCHW-FP32-W=ConvAsmBwdWrW1x1:2,8,4,4,8,2,2,4,0,1
1504-14-14-1x1-128-14-14-512-0x0-1x1-1x1-0-NCHW-FP16-F=ConvAsm1x1U:2,8,4,64,1,4,1,8;ConvOclDirectFwd1x1:1,128,1,1,0,4,8,4,0
288-35-35-3x3-384-17-17-512-0x0-2x2-1x1-0-NCHW-FP32-F=ConvOclDirectFwd:8,32,32,32,4,1,8,1,1
64-13-13-1x1-512-13-13-32-0x0-1x1-1x1-0-NCHW-FP16-B=ConvAsm1x1U:2,16,4,16,1,2,1,2;ConvOclDirectFwd1x1:1,64,1,1,0,1,8,4,0
192-28-28-3x3-128-28-28-32-1x1-1x1-1x1-0-NCHW-FP16-B=ConvOclDirectFwd:8,16,32,32,4,2,8,1,1
1120-14-14-1x1-128-14-14-64-0x0-1x1-1x1-0-NCHW-FP16-F=ConvAsm1x1U:4,8,8,16,1,4,1,8;ConvOclDirectFwd1x1:1,64,1,1,0,4,8,4,0
1024-14-14-1x1-1024-14-14-8-0x0-1x1-1x1-0-NCHW-FP32-F=ConvAsm1x1U:3,16,4,64,1,2,1,1;ConvOclDirectFwd1x1:1,64,1,1,1,0,32,2048,0
120-14-14-3x3-120-14-14-128-1x1-1x1-1x1-0-NCHW-FP16-B=ConvOclDirectFwd:8,8,16,16,2,2,8,2,2
24-56-56-1x1-58-56-56-1024-0x0-1x1-1x1-0-NCHW-FP16-F=ConvAsm1x1U:1,8,2,32,1,4,1,4;ConvOclDirectFwd1x1:1,256,1,1,0,2,16,4,0
480-14-14-1x1-128-14-14-4-0x0-1x1-1x1-0-NCHW-FP32-F=ConvAsm1x1U:2,8,2,32,1,4,4,2;ConvOclDirectFwd1x1:1,64,1,1,1,0,16,64,0
96-71-71-3x3-64-73-73-1-0x0-1x1-1x1-0-NCHW-FP32-B=ConvOclDirectFwd:16,16,16,32,1,2,8,4,1
128-54-54-1x1-16-54-54-512-0x0-1x1-1x1-0-NCHW-FP16-W=ConvAsmBwdWrW1x1:4,4,2,4,2,1,4,4,0,1
256-13-13-3x3-256-13-13-16-1x1-1x1-1x1-0-NCHW-FP32-W=ConvAsmBwdWrW3x3:0,1,16,4,4,1
128-7-7-1x1-1728-7-7-8-0x0-1x1-1x1-0-NCHW-FP16-W=ConvAsmBwdWrW1x1:1,16,2,8,2,1,1,2,0,1
192-13-13-1x1-48-13-13-4-0x0-1x1-1x1-0-NCHW-FP16-B=ConvAsm1x1U:1,8,2,64,1,4,4,1;ConvOclDirectFwd1x1:1,256,1,1,0,1,4,8,0
32-14-14-5x5-64-14-14-256-2x2-1x1-1x1-0-NCHW-FP16-F=ConvOclDirectFwd:8,8,16,16,2,2,8,1,2;ConvOclDirectFwdFused:8,8,16,16,2,2,8,1,2
192-14-14-1x1-1680-14-14-256-0x0-1x1-1x1-0-NCHW-FP16-W=ConvAsmBwdWrW1x1:2,8,8,8,2,1,2,4,0,1
128-14-14-1x1-960-14-14-128-0x0-1x1-1x1-0-NCHW-FP16-B=ConvAsm1x1U:1,16,2,16,1,2,1,2;ConvOclDirectFwd1x1:1,256,1,1,0,4,16,4,0
128-28-28-1x1-416-28-28-8-0x0-1x1-1x1-0-NCHW-FP32-B=ConvAsm1x1U:1,32,1,16,1,1,1,1;ConvOclDirectFwd1x1:1,128,1,1,0,2,16,4,0
320-8-8-3x3-192-17-17-32-0x0-2x2-1x1-0-NCHW-FP16-B=ConvOclDirectFwd:16,32,32,32,2,1,4,4,2
128-14-14-1x1-528-14-14-16-0x0-1x1-1x1-0-NCHW-FP16-B=ConvAsm1x1U:1,16,2,16,1,2,2,2;ConvOclDirectFwd1x1:1,64,1,1,0,4,8,4,0
512-14-14-1x1-64-14-14-1-0x0-1x1-1x1-0-NCHW-FP32-F=ConvAsm1x1U:1,8,1,32,1,4,4,1;ConvActivAsm1x1U:1,16,1,16,1,3;ConvOclDirectFwd1x1:1,64,1,1,1,1,16,64,0
192-56-56-1x1-192-56-56-4-0x0-1x1-1x1-0-NCHW-FP32-W=ConvAsmBwdWrW1x1:4,4,4,4,4,1,1,4,0,1
128-7-7-1x1-1888-7-7-128-0x0-1x1-1x1-0-NCHW-FP16-B=ConvAsm1x1U:2,16,4,16,1,2,1,4;ConvOclDirectFwd1x1:1,64,1,1,0,1,8,4,0
192-28-28-1x1-720-28-28-4-0x0-1x1-1x1-0-NCHW-FP16-W=ConvAsmBwdWrW1x1:2,8,4,8,2,1,2,4,0,1
240-7-7-1x1-960-7-7-32-0x0-1x1-1x1-0-NCHW-FP32-F_g3=ConvOclDirectFwd:8,8,8,8,1,1,8,4,2
256-56-56-3x3-128-56-56-64-1x1-1x1-1x1-0-NCHW-FP16-F=ConvOclDirectFwd:8,16,16,32,2,2,8,1,2
216-28-28-1x1-54-28-28-256-0x0-1x1-1x1-0-NCHW-FP16-B_g3=ConvOclDirectFwd:16,16,16,16,1,1,8,2,2
16-54-54-3x3-64-54-54-32-1x1-1x1-1x1-0-NCHW-FP16-B=ConvOclDirectFwd:16,16,32,32,2,2,8,1,2
320-14-14-3x3-160-14-14-8-1x1-1x1-1x1-0-NCHW-FP16-B=ConvOclDirectFwd:16,8,16,16,1,2,4,2,2
128-7-7-1x1-1088-7-7-32-0x0-1x1-1x1-0-NCHW-FP16-W=ConvAsmBwdWrW1x1:1,16,2,8,2,1,2,4,0,0
576-7-7-1x1-128-7-7-8-0x0-1x1-1x1-0-NCHW-FP16-F=ConvAsm1x1U:1,8,2,16,1,4,4,1;ConvOclDirectFwd1x1:1,256,1,1,0,1,4,4,0
192-14-14-1x1-864-14-14-8-0x0-1x1-1x1-0-NCHW-FP16-B=ConvAsm1x1U:1,16,2,16,1,2,2,2;ConvOclDirectFwd1x1:1,64,1,1,0,4,8,4,0
512-14-14-1x1-128-28-28-1-0x0-2x2-1x1-0-NCHW-FP16-W=ConvAsmBwdWrW1x1:2,8,2,2,2,1,1,4,0,1
128-7-7-1x1-1696-7-7-16-0x0-1x1-1x1-0-NCHW-FP32-W=ConvAsmBwdWrW1x1:1,16,2,4,8,1,1,4,0,2
1728-14-14-1x1-192-14-14-16-0x0-1x1-1x1-0-NCHW-FP16-F=ConvAsm1x1U:2,8,4,64,1,4,2,2;ConvOclDirectFwd1x1:1,64,1,1,0,4,8,4,0
896-7-7-1x1-128-7-7-256-0x0-1x1-1x1-0-NCHW-FP16-B=ConvAsm1x1U:2,16,4,16,1,2,4,1;ConvOclDirectFwd1x1:1,128,1,1,0,1,8,4,0
192-14-14-1x1-1248-14-14-32-0x0-1x1-1x1-0-NCHW-FP16-B=ConvAsm1x1U:1,16,2,16,1,2,2,2;ConvOclDirectFwd1x1:1,64,1,1,0,4,8,4,0
128-56-56-1x1-160-56-56-128-0x0-1x1-1x1-0-NCHW-FP16-W=ConvAsmBwdWrW1x1:4,4,8,4,2,2,2,4,0,1
2048-8-8-1x1-384-8-8-1024-0x0-1x1-1x1-0-NCHW-FP16-F=ConvAsm1x1U:2,8,4,16,2,4,1,8;ConvOclDirectFwd1x1:1,128,1,1,0,2,8,4,0
192-14-14-1x1-1872-14-14-256-0x0-1x1-1x1-0-NCHW-FP32-B=ConvAsm1x1U:1,16,1,64,2,2,1,2;ConvOclDirectFwd1x1:1,128,1,1,0,2,16,4,0
128-14-14-1x1-1376-14-14-128-0x0-1x1-1x1-0-NCHW-FP16-W=ConvAsmBwdWrW1x1:1,16,4,8,2,1,4,4,0,3
128-7-7-1x1-640-7-7-512-0x0-1x1-1x1-0-NCHW-FP32-W=ConvAsmBwdWrW1x1:2,8,4,4,8,2,2,4,0,1
64-27-27-3x3-256-27-27-64-1x1-1x1-1x1-0-NCHW-FP32-W=ConvAsmBwdWrW3x3:0,0,8,4,3,4
32-27-27-1x1-256-27-27-256-0x0-1x1-1x1-0-NCHW-FP16-B=ConvAsm1x1U:1,16,2,16,1,2,1,4;ConvOclDirectFwd1x1:1,64,1,1,0,1,16,4,0
128-7-7-1x1-1376-7-7-512-0x0-1x1-1x1-0-NCHW-FP16-B=ConvAsm1x1U:2,16,4,16,1,2,1,4;ConvOclDirectFwd1x1:1,128,1,1,0,1,8,4,0
240-7-7-1x1-960-7-7-4-0x0-1x1-1x1-0-NCHW-FP32-F_g3=ConvOclDirectFwd:8,8,8,8,1,1,8,4,2
1568-7-7-1x1-128-7-7-2-0x0-1x1-1x1-0-NCHW-FP16-F=ConvAsm1x1U:1,8,2,16,1,4,4,1;ConvOclDirectFwd1x1:1,64,1,1,0,1,4,8,0
160-17-17-7x1-160-17-17-128-3x0-1x1-1x1-0-NCHW-FP32-W=ConvOclBwdWrW2<4>:1,6,3,8,7;ConvOclBwdWrW2<1>:1,9,8,3,9;ConvOclBwdWrW2<16>:1,6,8,3,7;ConvOclBwdWrW2<8>:1,6,8,3,7;ConvOclBwdWrW2<2>:1,6,3,8,7
128-29-29-3x3-128-57-57-32-1x1-2x2-1x1-0-NCHW-FP32-B=ConvOclDirectFwd:8,32,32,32,4,1,8,2,2
192-14-14-1x1-512-14-14-8-0x0-1x1-1x1-0-NCHW-FP32-W=ConvAsmBwdWrW1x1:1,16,2,4,4,2,1,4,0,1
1216-14-14-1x1-128-14-14-32-0x0-1x1-1x1-0-NCHW-FP16-F=ConvAsm1x1U:2,8,4,64,1,4,2,4;ConvOclDirectFwd1x1:1,64,1,1,0,4,4,4,0
512-13-13-1x1-64-13-13-1-0x0-1x1-1x1-0-NCHW-FP16-F=ConvAsm1x1U:1,8,2,16,1,4,4,1;ConvOclDirectFwd1x1:1,128,1,1,0,1,4,8,0
48-27-27-1x1-192-27-27-8-0x0-1x1-1x1-0-NCHW-FP16-F=ConvAsm1x1U:2,8,4,64,1,2,2,2;ConvOclDirectFwd1x1:1,256,1,1,0,1,8,4,0
256-28-28-1x1-128-28-28-512-0x0-1x1-1x1-0-NCHW-FP32-W=ConvAsmBwdWrW1x1:1,16,2,8,2,1,4,4,0,2
192-7-7-1x1-1728-7-7-64-0x0-1x1-1x1-0-NCHW-FP16-W=ConvAsmBwdWrW1x1:1,16,4,8,2,1,1,2,0,2
64-55-55-1x1-16-55-55-256-0x0-1x1-1x1-0-NCHW-FP32-F=ConvAsm1x1U:1,16,2,64,2,1,1,1;ConvOclDirectFwd1x1:1,64,1,1,1,1,16,2048,0
256-27-27-1x1-48-27-27-2-0x0-1x1-1x1-0-NCHW-FP16-F=ConvAsm1x1U:1,8,2,64,1,4,4,1;ConvOclDirectFwd1x1:1,128,1,1,0,1,4,8,0
128-7-7-1x1-1344-7-7-32-0x0-1x1-1x1-0-NCHW-FP16-W=ConvAsmBwdWrW1x1:1,16,4,8,2,1,2,4,0,1
672-7-7-1x1-128-7-7-512-0x0-1x1-1x1-0-NCHW-FP32-F=ConvAsm1x1U:2,16,4,16,1,2,2,2;ConvOclDirectFwd1x1:1,64,1,1,1,4,16,2048,0
128-7-7-5x5-32-7-7-256-2x2-1x1-1x1-0-NCHW-FP32-B=ConvOclDirectFwd:8,8,8,8,1,1,8,2,1
128-56-56-1x1-64-56-56-8-0x0-1x1-1x1-0-NCHW-FP16-W=ConvAsmBwdWrW1x1:2,8,2,4,2,1,4,4,0,1
256-56-56-1x1-512-28-28-48-0x0-2x2-1x1-0-NCHW-FP32-F=ConvAsm1x1U:2,16,2,32,3,2,1,1;ConvOclDirectFwd1x1:1,64,1,1,1,4,16,2048,0
1024-4-4-1x1-2048-7-7-32-0x0-2x2-1x1-0-NCHW-FP16-B=ConvAsm1x1U:1,16,2,16,1,2,2,4;ConvOclDirectFwd1x1:1,64,1,1,0,1,16,4,0
120-7-7-3x3-120-14-14-4-1x1-2x2-1x1-0-NCHW-FP16-B=ConvOclDirectFwd:16,8,16,16,1,2,1,2,1
1-7-7-3x3-1-5-5-512-0x0-1x1-1x1-0-NCHW-FP32-F=ConvOclDirectFwd:8,8,8,8,1,1,1,1,2
192-14-14-1x1-2064-14-14-64-0x0-1x1-1x1-0-NCHW-FP16-W=ConvAsmBwdWrW1x1:2,8,8,8,2,1,1,4,0,1
96-14-14-1x1-480-14-14-1-0x0-1x1-1x1-0-NCHW-FP32-W=ConvAsmBwdWrW1x1:2,8,2,4,2,1,1,4,0,2
128-7-7-1x1-1888-7-7-16-0x0-1x1-1x1-0-NCHW-FP32-W=ConvAsmBwdWrW1x1:1,16,2,4,8,1,1,4,0,2
128-7-7-1x1-1152-7-7-512-0x0-1x1-1x1-0-NCHW-FP16-W=ConvAsmBwdWrW1x1:1,16,4,8,2,1,2,2,0,3
736-14-14-1x1-128-14-14-16-0x0-1x1-1x1-0-NCHW-FP32-W=ConvAsmBwdWrW1x1:1,16,2,4,4,2,1,4,0,2
1392-14-14-1x1-192-14-14-2-0x0-1x1-1x1-0-NCHW-FP32-F=ConvAsm1x1U:2,8,2,32,1,4,4,2;ConvOclDirectFwd1x1:1,64,1,1,1,4,16,128,0
128-56-56-1x1-128-56-56-128-0x0-1x1-1x1-0-NCHW-FP32-B=ConvAsm1x1U:2,32,2,32,1,1,1,2;ConvOclDirectFwd1x1:1,128,1,1,0,2,32,4,0
128-14-14-1x1-672-14-14-2-0x0-1x1-1x1-0-NCHW-FP32-B=ConvAsm1x1U:1,8,1,32,1,4,2,2;ConvOclDirectFwd1x1:1,128,1,1,0,1,4,8,0
128-28-28-1x1-384-28-28-4-0x0-1x1-1x1-0-NCHW-FP32-B=ConvAsm1x1U:1,32,1,32,1,1,2,2;ConvOclDirectFwd1x1:1,64,1,1,0,2,8,4,0
19-64-128-1x1-1024-64-128-1-0x0-1x1-1x1-0-NCHW-FP16-W=ConvAsmBwdWrW1x1:4,4,2,4,1,1,1,2,1,1
160-14-14-1x1-528-14-14-8-0x0-1x1-1x1-0-NCHW-FP32-B=ConvAsm1x1U:1,16,1,32,1,1,2,2;ConvOclDirectFwd1x1:1,64,1,1,0,4,16,4,0
960-7-7-1x1-128-7-7-512-0x0-1x1-1x1-0-NCHW-FP32-W=ConvAsmBwdWrW1x1:1,16,2,8,4,1,2,4,0,2
288-28-28-1x1-128-28-28-8-0x0-1x1-1x1-0-NCHW-FP16-F=ConvAsm1x1U:2,8,4,16,1,4,2,4;ConvOclDirectFwd1x1:1,64,1,1,0,2,8,4,0
1056-14-14-1x1-2112-14-14-8-0x0-1x1-1x1-0-NCHW-FP32-W=ConvAsmBwdWrW1x1:1,16,4,4,8,1,2,4,0,1
256-14-14-3x3-128-28-28-8-1x1-2x2-1x1-0-NCHW-FP16-W=ConvAsmBwdWrW3x3:0,0,8,4,1,1
736-14-14-1x1-128-14-14-2-0x0-1x1-1x1-0-NCHW-FP16-F=ConvAsm1x1U:1,8,2,16,1,4,4,1;ConvOclDirectFwd1x1:1,64,1,1,0,4,4,8,0
1024-7-7-3x3-1024-14-14-48-1x1-2x2-1x1-0-NCHW-FP16-W_g32=ConvOclBwdWrW2<4>:1,7,8,1,7;ConvOclBwdWrW2<16>:1,7,8,1,7;ConvOclBwdWrW2<2>:1,7,8,1,7;ConvOclBwdWrW2<1>:1,7,8,1,7;ConvAsmBwdWrW3x3:0,0,8,4,7,1;ConvOclBwdWrW2<8>:1,7,8,1,7
64-35-35-1x1-256-35-35-256-0x0-1x1-1x1-0-NCHW-FP16-W=ConvAsmBwdWrW1x1:4,4,4,4,4,1,4,4,0,1
256-14-14-3x3-512-7-7-1-1x1-2x2-1x1-0-NCHW-FP32-F=ConvOclDirectFwd:8,8,8,8,1,1,1,2,1
384-28-28-1x1-192-28-28-16-0x0-1x1-1x1-0-NCHW-FP16-F=ConvAsm1x1U:1,8,2,32,2,4,1,4;ConvOclDirectFwd1x1:1,64,1,1,0,2,8,4,0
192-28-28-1x1-192-28-28-1024-0x0-1x1-1x1-0-NCHW-FP16-W=ConvAsmBwdWrW1x1:4,4,8,4,4,2,2,4,0,1
128-56-56-1x1-192-56-56-64-0x0-1x1-1x1-0-NCHW-FP32-W=ConvAsmBwdWrW1x1:2,8,4,4,4,1,4,4,0,2
1184-14-14-1x1-128-14-14-64-0x0-1x1-1x1-0-NCHW-FP16-F=ConvAsm1x1U:2,8,4,64,1,4,2,2;ConvOclDirectFwd1x1:1,64,1,1,0,4,8,4,0
768-17-17-1x1-192-17-17-32-0x0-1x1-1x1-0-NCHW-FP16-F=ConvAsm1x1U:3,8,6,32,1,4,1,4;ConvOclDirectFwd1x1:1,64,1,1,0,1,8,4,0
288-35-35-1x1-48-35-35-1024-0x0-1x1-1x1-0-NCHW-FP16-F=ConvAsm1x1U:2,16,4,64,1,2,1,1;ConvOclDirectFwd1x1:1,128,1,1,0,1,8,4,0
192-28-28-1x1-672-28-28-8-0x0-1x1-1x1-0-NCHW-FP32-W=ConvAsmBwdWrW1x1:1,16,2,4,8,1,2,4,0,1
768-14-14-1x1-128-14-14-64-0x0-1x1-1x1-0-NCHW-FP16-W=ConvAsmBwdWrW1x1:4,4,8,4,4,2,1,4,0,1
1568-14-14-1x1-128-14-14-2-0x0-1x1-1x1-0-NCHW-FP16-F=ConvAsm1x1U:1,8,2,16,1,4,4,1;ConvOclDirectFwd1x1:1,128,1,1,0,4,4,4,0
240-7-7-1x1-960-7-7-512-0x0-1x1-1x1-0-NCHW-FP32-F_g3=ConvOclDirectFwd:8,8,8,8,1,1,8,4,2
120-14-14-3x3-120-14-14-32-1x1-1x1-1x1-0-NCHW-FP16-B=ConvOclDirectFwd:8,16,16,16,2,1,8,1,2
32-14-14-3x3-128-14-14-1-1x1-1x1-1x1-0-NCHW-FP32-W=ConvAsmBwdWrW3x3:0,0,16,1,2,1
256-15-15-3x3-256-29-29-32-1x1-2x2-1x1-0-NCHW-FP32-B=ConvOclDirectFwd:8,8,32,32,4,4,4,4,1
512-14-14-1x1-160-14-14-256-0x0-1x1-1x1-0-NCHW-FP16-F=ConvAsm1x1U:2,8,4,64,1,4,1,4;ConvOclDirectFwd1x1:8,64,16,16,0,2,16,4,1
192-14-14-1x1-1056-14-14-4-0x0-1x1-1x1-0-NCHW-FP32-B=ConvAsm1x1U:1,16,1,16,1,1,2,2;ConvOclDirectFwd1x1:1,64,1,1,0,4,16,4,0
1968-7-7-1x1-192-7-7-1-0x0-1x1-1x1-0-NCHW-FP16-F=ConvAsm1x1U:1,8,2,32,1,4,4,1;ConvOclDirectFwd1x1:1,128,1,1,0,1,4,8,0
2112-14-14-1x1-1056-14-14-4-0x0-1x1-1x1-0-NCHW-FP32-F=ConvAsm1x1U:3,16,5,16,1,2,2,1;ConvOclDirectFwd1x1:1,64,1,1,1,0,16,2048,0
128-7-7-1x1-800-7-7-32-0x0-1x1-1x1-0-NCHW-FP32-B=ConvAsm1x1U:2,16,2,32,1,2,2,2;ConvOclDirectFwd1x1:8,64,8,8,0,1,16,4,1
4-3-3-3x3-3-6-6-128-1x1-2x2-1x1-0-NCHW-FP32-B=ConvOclDirectFwd:8,8,8,8,1,1,1,1,2
512-7-7-1x1-512-7-7-8-0x0-1x1-1x1-0-NCHW-FP32-W=ConvAsmBwdWrW1x1:1,16,2,4,4,1,1,4,0,1
192-7-7-1x1-1152-7-7-256-0x0-1x1-1x1-0-NCHW-FP32-W=ConvAsmBwdWrW1x1:1,16,4,8,4,1,2,4,0,1
1440-7-7-1x1-128-7-7-64-0x0-1x1-1x1-0-NCHW-FP16-F=ConvAsm1x1U:2,8,4,16,1,4,4,2;ConvOclDirectFwd1x1:1,64,1,1,0,1,8,4,0
192-14-14-1x1-624-14-14-1024-0x0-1x1-1x1-0-NCHW-FP16-B=ConvAsm1x1U:1,16,2,16,1,2,1,4;ConvOclDirectFwd1x1:1,256,1,1,0,4,16,4,0
192-14-14-1x1-1632-14-14-4-0x0-1x1-1x1-0-NCHW-FP32-W=ConvAsmBwdWrW1x1:1,16,2,8,4,1,1,4,0,1
256-28-28-1x1-32-28-28-64-0x0-1x1-1x1-0-NCHW-FP16-F=ConvAsm1x1U:1,8,2,32,1,4,1,4;ConvOclDirectFwd1x1:1,64,1,1,0,4,16,4,0
1024-8-8-1x1-2048-8-8-256-0x0-1x1-1x1-0-NCHW-FP32-W=ConvAsmBwdWrW1x1:1,16,4,8,4,1,2,4,0,2
128-14-14-1x1-896-14-14-256-0x0-1x1-1x1-0-NCHW-FP32-B=ConvAsm1x1U:1,32,1,32,2,1,1,2;ConvOclDirectFwd1x1:1,256,1,1,0,1,32,4,0
128-56-56-1x1-96-56-56-2-0x0-1x1-1x1-0-NCHW-FP32-B=ConvAsm1x1U:1,16,1,64,1,2,2,2;ConvOclDirectFwd1x1:1,64,1,1,0,1,8,8,0
128-54-54-1x1-16-54-54-512-0x0-1x1-1x1-0-NCHW-FP16-B=ConvAsm1x1U:1,8,2,64,1,4,2,2;ConvOclDirectFwd1x1:1,128,1,1,0,4,16,4,0
128-57-57-3x3-128-57-57-128-1x1-1x1-1x1-0-NCHW-FP16-W_g32=ConvOclBwdWrW2<4>:1,9,3,1,9;ConvOclBwdWrW2<16>:1,9,3,1,9;ConvOclBwdWrW2<2>:1,9,3,1,9;ConvOclBwdWrW2<1>:1,6,3,1,11;ConvAsmBwdWrW3x3:0,1,16,2,1,8;ConvOclBwdWrW2<8>:1,9,3,1,9
160-28-28-1x1-128-28-28-256-0x0-1x1-1x1-0-NCHW-FP16-F=ConvAsm1x1U:1,8,2,32,2,4,1,4;ConvOclDirectFwd1x1:1,128,1,1,0,4,16,4,0
128-7-7-1x1-1408-7-7-8-0x0-1x1-1x1-0-NCHW-FP16-W=ConvAsmBwdWrW1x1:1,16,2,8,2,1,2,4,0,1
832-7-7-1x1-32-7-7-4-0x0-1x1-1x1-0-NCHW-FP16-F=ConvAsm1x1U:1,8,2,16,1,4,4,1;ConvOclDirectFwd1x1:1,64,1,1,0,1,4,8,0
128-14-14-1x1-1472-14-14-512-0x0-1x1-1x1-0-NCHW-FP32-W=ConvAsmBwdWrW1x1:2,8,4,8,4,1,1,4,0,2
128-14-14-1x1-1280-14-14-2-0x0-1x1-1x1-0-NCHW-FP16-B=ConvAsm1x1U:1,16,2,32,1,2,4,1;ConvOclDirectFwd1x1:1,128,1,1,0,4,4,4,0
1120-14-14-1x1-128-14-14-2-0x0-1x1-1x1-0-NCHW-FP32-F=ConvAsm1x1U:1,8,1,32,1,4,4,2;ConvOclDirectFwd1x1:1,64,1,1,1,1,16,128,0
128-14-14-1x1-736-14-14-256-0x0-1x1-1x1-0-NCHW-FP32-B=ConvAsm1x1U:1,32,1,32,2,1,1,1;ConvOclDirectFwd1x1:1,128,1,1,0,1,32,4,0
64-55-55-1x1-16-55-55-8-0x0-1x1-1x1-0-NCHW-FP32-F=ConvAsm1x1U:1,8,1,32,1,4,2,2;ConvOclDirectFwd1x1:1,64,1,1,1,0,16,256,0
192-14-14-1x1-1056-14-14-64-0x0-1x1-1x1-0-NCHW-FP16-W=ConvAsmBwdWrW1x1:2,8,8,8,2,1,1,4,0,1
128-28-28-1x1-288-28-28-8-0x0-1x1-1x1-0-NCHW-FP16-B=ConvAsm1x1U:1,16,2,16,1,2,2,2;ConvOclDirectFwd1x1:1,128,1,1,0,4,16,4,0
224-35-35-3x3-256-17-17-256-0x0-2x2-1x1-0-NCHW-FP32-F=ConvOclDirectFwd:8,32,32,32,4,1,8,1,2
512-28-28-3x3-512-28-28-64-1x1-1x1-1x1-0-NCHW-FP16-B=ConvOclDirectFwd:16,16,32,32,2,2,8,2,1
32-28-28-1x1-256-28-28-4-0x0-1x1-1x1-0-NCHW-FP16-B=ConvAsm1x1U:1,8,2,64,1,4,2,1;ConvOclDirectFwd1x1:1,256,1,1,0,2,4,4,0
288-35-35-3x3-384-17-17-8-0x0-2x2-1x1-0-NCHW-FP32-F=ConvOclDirectFwd:8,32,32,32,4,1,8,1,2
128-7-7-1x1-1312-7-7-32-0x0-1x1-1x1-0-NCHW-FP16-B=ConvAsm1x1U:2,16,4,16,1,2,1,2;ConvOclDirectFwd1x1:1,128,1,1,0,1,4,4,0
256-27-27-1x1-32-27-27-64-0x0-1x1-1x1-0-NCHW-FP32-B=ConvAsm1x1U:2,16,2,64,1,2,2,2;ConvOclDirectFwd1x1:1,256,1,1,0,1,16,8,0
64-55-55-1x1-256-55-55-2-0x0-1x1-1x1-0-NCHW-FP32-W=ConvAsmBwdWrW1x1:4,4,4,2,2,1,2,4
128-7-7-1x1-1504-7-7-128-0x0-1x1-1x1-0-NCHW-FP32-B=ConvAsm1x1U:1,16,1,64,2,2,1,2;ConvOclDirectFwd1x1:1,256,1,1,0,1,16,4,0
192-14-14-1x1-1104-14-14-4-0x0-1x1-1x1-0-NCHW-FP32-B=ConvAsm1x1U:1,16,1,16,1,2,1,2;ConvOclDirectFwd1x1:1,64,1,1,0,4,16,4,0
96-17-17-3x3-96-35-35-8-0x0-2x2-1x1-0-NCHW-FP32-B=ConvOclDirectFwd:8,16,16,16,2,1,4,1,2
48-35-35-1x1-192-35-35-1024-0x0-1x1-1x1-0-NCHW-FP16-B=ConvAsm1x1U:1,16,2,16,1,2,1,4;ConvOclDirectFwd1x1:1,128,1,1,0,1,16,4,0
128-7-7-1x1-960-7-7-8-0x0-1x1-1x1-0-NCHW-FP32-W=ConvAsmBwdWrW1x1:1,16,2,8,2,1,1,4,0,2
416-14-14-1x1-128-14-14-512-0x0-1x1-1x1-0-NCHW-FP32-F=ConvAsm1x1U:4,16,4,64,1,2,1,1;ConvOclDirectFwd1x1:1,64,1,1,1,0,16,2048,0
1024-15-15-1x1-2048-8-8-4-0x0-2x2-1x1-0-NCHW-FP32-F=ConvAsm1x1U:2,8,2,32,2,4,2,4;ConvOclDirectFwd1x1:1,64,1,1,1,4,32,256,0
256-56-56-1x1-512-28-28-2-0x0-2x2-1x1-0-NCHW-FP32-F=ConvAsm1x1U:4,8,4,64,1,4,1,1;ConvOclDirectFwd1x1:1,64,1,1,1,0,16,2048,0
128-7-7-1x1-576-7-7-4-0x0-1x1-1x1-0-NCHW-FP16-W=ConvAsmBwdWrW1x1:4,4,4,4,2,1,1,2,0,1
32-7-7-1x1-832-7-7-16-0x0-1x1-1x1-0-NCHW-FP16-B=ConvAsm1x1U:1,16,2,32,1,2,2,4;ConvOclDirectFwd1x1:1,64,1,1,0,1,8,4,0
256-56-56-3x3-128-56-56-8-1x1-1x1-1x1-0-NCHW-FP16-W=ConvAsmBwdWrW3x3:0,0,8,2,2,1
128-7-7-1x1-960-7-7-16-0x0-1x1-1x1-0-NCHW-FP32-W=ConvAsmBwdWrW1x1:1,16,2,4,8,1,2,4,0,1
384-28-28-1x1-128-28-28-256-0x0-1x1-1x1-0-NCHW-FP32-W=ConvAsmBwdWrW1x1:4,4,4,4,8,1,2,4,0,1
512-28-28-1x1-1024-14-14-16-0x0-2x2-1x1-0-NCHW-FP16-F=ConvAsm1x1U:2,8,4,64,1,4,1,4;ConvOclDirectFwd1x1:1,256,1,1,0,2,16,4,0
288-28-28-1x1-128-28-28-128-0x0-1x1-1x1-0-NCHW-FP16-W=ConvAsmBwdWrW1x1:4,4,8,4,4,2,2,4,0,1
80-73-73-3x3-192-71-71-64-0x0-1x1-1x1-0-NCHW-FP16-F=ConvOclDirectFwd:8,8,16,16,2,2,8,2,2;ConvOclDirectFwdFused:8,8,16,16,2,2,8,2,1
192-56-56-1x1-336-56-56-16-0x0-1x1-1x1-0-NCHW-FP32-W=ConvAsmBwdWrW1x1:4,4,4,4,8,1,2,4,0,0
24-28-28-1x1-58-28-28-2-0x0-1x1-1x1-0-NCHW-FP16-F=ConvAsm1x1U:1,8,2,32,1,2,2,2;ConvOclDirectFwd1x1:1,64,1,1,0,1,16,8,0
64-35-35-5x5-48-35-35-256-2x2-1x1-1x1-0-NCHW-FP32-W=ConvOclBwdWrW2<4>:1,7,1,3,5;ConvOclBwdWrW2<1>:1,7,3,3,7;ConvOclBwdWrW2<16>:1,9,1,3,5;ConvOclBwdWrW2<8>:1,7,3,3,7;ConvOclBwdWrW2<2>:1,9,1,3,5
128-7-7-1x1-864-7-7-64-0x0-1x1-1x1-0-NCHW-FP32-B=ConvAsm1x1U:2,16,2,32,1,2,1,4;ConvOclDirectFwd1x1:1,64,1,1,0,1,16,4,0
384-8-8-3x3-448-8-8-4-1x1-1x1-1x1-0-NCHW-FP16-W=ConvAsmBwdWrW3x3:0,1,8,4,3,1
464-7-7-1x1-1024-7-7-1024-0x0-1x1-1x1-0-NCHW-FP32-F=ConvAsm1x1U:2,16,2,32,2,2,1,4;ConvOclDirectFwd1x1:1,64,1,1,1,1,64,2048,0
384-8-8-1x1-1280-8-8-1-0x0-1x1-1x1-0-NCHW-FP32-B=ConvAsm1x1U:1,8,1,64,1,4,4,1;ConvOclDirectFwd1x1:1,64,1,1,0,1,4,8,0
128-14-14-3x3-32-14-14-64-1x1-1x1-1x1-0-NCHW-FP16-B=ConvOclDirectFwd:16,8,16,16,1,2,4,2,2
192-35-35-1x1-64-35-35-1024-0x0-1x1-1x1-0-NCHW-FP16-F=ConvAsm1x1U:2,8,4,32,1,4,1,4;ConvOclDirectFwd1x1:1,64,1,1,0,1,16,4,0
704-7-7-1x1-128-7-7-128-0x0-1x1-1x1-0-NCHW-FP32-F=ConvAsm1x1U:4,8,4,16,1,4,1,8;ConvOclDirectFwd1x1:1,64,1,1,1,1,16,2048,0
32-54-54-3x3-128-54-54-256-1x1-1x1-1x1-0-NCHW-FP32-W=ConvAsmBwdWrW3x3:0,0,8,4,2,8
120-7-7-1x1-480-7-7-256-0x0-1x1-1x1-0-NCHW-FP16-F_g3=ConvOclDirectFwd:8,8,8,8,1,1,8,2,1
16-48-480-3x3-1-48-480-4-1x1-1x1-1x1-0-NCHW-FP32-B=ConvOclDirectFwd:16,16,16,16,1,1,1,2,2;ConvAsm3x3U:9,1,2
192-14-14-1x1-1536-14-14-4-0x0-1x1-1x1-0-NCHW-FP16-B=ConvAsm1x1U:1,16,2,64,1,2,2,2;ConvOclDirectFwd1x1:1,64,1,1,0,4,4,4,0
128-14-14-1x1-1440-14-14-256-0x0-1x1-1x1-0-NCHW-FP16-B=ConvAsm1x1U:1,16,2,16,1,2,1,8;ConvOclDirectFwd1x1:1,64,1,1,0,2,16,4,0
192-7-7-1x1-1920-7-7-128-0x0-1x1-1x1-0-NCHW-FP16-B=ConvAsm1x1U:2,16,4,16,1,2,1,1;ConvOclDirectFwd1x1:1,64,1,1,0,1,8,4,0
192-14-14-1x1-1824-14-14-128-0x0-1x1-1x1-0-NCHW-FP32-B=ConvAsm1x1U:1,32,1,16,2,1,2,2;ConvOclDirectFwd1x1:1,64,1,1,0,1,32,4,0
96-71-71-3x3-64-73-73-32-0x0-1x1-1x1-0-NCHW-FP32-B=ConvOclDirectFwd:8,16,16,16,2,1,8,1,2
512-7-7-1x1-512-7-7-2-0x0-1x1-1x1-0-NCHW-FP16-F=ConvAsm1x1U:1,8,2,16,1,4,4,1;ConvOclDirectFwd1x1:1,128,1,1,0,1,4,4,0
512-15-15-1x1-1024-15-15-48-0x0-1x1-1x1-0-NCHW-FP32-B=ConvAsm1x1U:4,16,4,64,1,2,1,2;ConvOclDirectFwd1x1:1,256,1,1,0,1,32,4,0
192-13-13-3x3-384-13-13-16-1x1-1x1-1x1-0-NCHW-FP32-W=ConvAsmBwdWrW3x3:0,1,16,4,5,1
32-35-35-1x1-192-35-35-1-0x0-1x1-1x1-0-NCHW-FP16-W=ConvAsmBwdWrW1x1:4,4,2,1,4,1,1,2,0,2
48-35-35-5x5-64-35-35-8-2x2-1x1-1x1-0-NCHW-FP16-F=ConvOclDirectFwd:8,16,16,16,2,1,8,4,2;ConvOclDirectFwdFused:8,16,16,16,2,1,8,4,2
192-14-14-1x1-624-14-14-256-0x0-1x1-1x1-0-NCHW-FP16-B=ConvAsm1x1U:1,16,2,16,1,2,1,8;ConvOclDirectFwd1x1:1,256,1,1,0,2,16,4,0
256-13-13-3x3-256-13-13-64-1x1-1x1-1x1-0-NCHW-FP16-F=ConvOclDirectFwd:8,8,16,16,2,2,8,2,2
384-28-28-1x1-768-28-28-4-0x0-1x1-1x1-0-NCHW-FP32-W=ConvAsmBwdWrW1x1:1,16,2,8,4,1,2,4,0,1
128-56-56-1x1-128-56-56-64-0x0-1x1-1x1-0-NCHW-FP32-W=ConvAsmBwdWrW1x1:2,8,2,8,2,1,4,4,0,2
128-7-7-1x1-1440-7-7-2-0x0-1x1-1x1-0-NCHW-FP32-W=ConvAsmBwdWrW1x1:1,16,2,4,4,1,1,4,0,1
640-14-14-1x1-1280-14-14-4-0x0-1x1-1x1-0-NCHW-FP16-B=ConvAsm1x1U:1,16,2,16,1,2,2,2;ConvOclDirectFwd1x1:1,64,1,1,0,4,8,4,0
2016-14-14-1x1-192-14-14-8-0x0-1x1-1x1-0-NCHW-FP32-F=ConvAsm1x1U:4,8,4,64,1,4,2,1;ConvOclDirectFwd1x1:1,64,1,1,1,0,16,256,0
128-7-7-1x1-1088-7-7-32-0x0-1x1-1x1-0-NCHW-FP32-B=ConvAsm1x1U:1,16,1,64,2,1,2,2;ConvOclDirectFwd1x1:1,64,1,1,0,1,16,8,0
192-17-17-3x3-192-8-8-4-0x0-2x2-1x1-0-NCHW-FP32-F=ConvOclDirectFwd:8,8,8,8,1,1,1,4,2
32-54-54-1x1-128-54-54-256-0x0-1x1-1x1-0-NCHW-FP32-F=ConvAsm1x1U:1,16,1,64,3,1,1,4;ConvOclDirectFwd1x1:1,64,1,1,1,1,32,128,0
1296-7-7-1x1-192-7-7-128-0x0-1x1-1x1-0-NCHW-FP16-F=ConvAsm1x1U:2,16,4,16,1,2,2,2;ConvOclDirectFwd1x1:1,64,1,1,0,1,8,4,0
192-28-28-1x1-624-28-28-8-0x0-1x1-1x1-0-NCHW-FP32-B=ConvAsm1x1U:1,16,1,32,2,2,1,2;ConvOclDirectFwd1x1:1,128,1,1,0,2,16,4,0
64-13-13-1x1-384-13-13-8-0x0-1x1-1x1-0-NCHW-FP16-B=ConvAsm1x1U:1,8,2,16,1,4,2,1;ConvOclDirectFwd1x1:1,256,1,1,0,1,4,4,0
448-8-8-1x1-1280-8-8-2-0x0-1x1-1x1-0-NCHW-FP32-B=ConvAsm1x1U:1,8,1,64,1,2,4,2;ConvOclDirectFwd1x1:1,128,1,1,0,1,4,4,0
128-7-7-1x1-1632-7-7-256-0x0-1x1-1x1-0-NCHW-FP32-B=ConvAsm1x1U:1,16,1,64,2,2,1,2;ConvOclDirectFwd1x1:1,128,1,1,0,1,32,4,0
384-7-7-1x1-832-7-7-8-0x0-1x1-1x1-0-NCHW-FP32-W=ConvAsmBwdWrW1x1:1,16,2,8,4,1,1,4,0,1
448-28-28-1x1-128-28-28-16-0x0-1x1-1x1-0-NCHW-FP32-W=ConvAsmBwdWrW1x1:2,8,4,4,4,2,2,4,0,1
96-112-112-7x7-3-224-224-64-3x3-2x2-1x1-0-NCHW-FP16-W=ConvOclBwdWrW2<4>:3,10,1,3,7;ConvOclBwdWrW2<1>:3,6,1,3,7;ConvOclBwdWrW2<16>:8,7,1,3,9;ConvOclBwdWrW2<8>:3,6,1,3,7;ConvOclBwdWrW2<2>:3,10,1,3,7
128-28-28-1x1-384-28-28-128-0x0-1x1-1x1-0-NCHW-FP32-F=ConvAsm1x1U:2,16,2,32,2,2,1,4;ConvOclDirectFwd1x1:1,64,1,1,1,0,16,2048,0
256-64-128-1x1-832-64-128-1-0x0-1x1-1x1-0-NCHW-FP16-B=ConvOclDirectFwd1x1:1,128,1,1,0,4,16,4,0
384-8-8-1x1-2048-8-8-4-0x0-1x1-1x1-0-NCHW-FP16-B=ConvAsm1x1U:1,16,2,32,1,2,4,1;ConvOclDirectFwd1x1:1,64,1,1,0,2,4,4,0
256-14-14-1x1-1024-14-14-1-0x0-1x1-1x1-0-NCHW-FP32-B=ConvAsm1x1U:2,8,2,64,1,4,2,4;ConvOclDirectFwd1x1:1,256,1,1,0,1,4,4,0
208-14-14-3x3-96-14-14-4-1x1-1x1-1x1-0-NCHW-FP16-W=ConvAsmBwdWrW3x3:0,0,8,2,5,1
128-7-7-1x1-1664-7-7-8-0x0-1x1-1x1-0-NCHW-FP16-B=ConvAsm1x1U:1,8,2,16,1,2,2,1;ConvOclDirectFwd1x1:1,64,1,1,0,1,4,4,0
192-27-27-3x3-48-27-27-1-1x1-1x1-1x1-0-NCHW-FP16-B=ConvOclDirectFwd:16,16,16,16,1,1,1,4,1
96-17-17-3x3-96-35-35-4-0x0-2x2-1x1-0-NCHW-FP32-B=ConvOclDirectFwd:16,8,16,32,1,4,8,1,2
192-7-7-1x1-1392-7-7-16-0x0-1x1-1x1-0-NCHW-FP32-W=ConvAsmBwdWrW1x1:1,16,2,8,4,1,1,4,0,1
80-73-73-1x1-64-73-73-16-0x0-1x1-1x1-0-NCHW-FP32-W=ConvAsmBwdWrW1x1:4,4,4,2,4,1,4,4,0,2
256-38-38-1x1-256-38-38-32-0x0-1x1-1x1-0-NCHW-FP32-F=ConvAsm1x1U:3,16,3,64,2,2,1,2;ConvOclDirectFwd1x1:1,64,1,1,1,4,16,2048,0
256-7-7-1x1-832-7-7-8-0x0-1x1-1x1-0-NCHW-FP16-B=ConvAsm1x1U:1,8,2,16,1,4,2,8;ConvOclDirectFwd1x1:1,256,1,1,0,1,4,4,0
384-13-13-3x3-256-13-13-1-1x1-1x1-1x1-0-NCHW-FP16-F=ConvOclDirectFwd:16,16,16,16,1,1,1,4,1;ConvOclDirectFwdFused:16,16,16,16,1,1,1,4,1
1000-13-13-1x1-512-13-13-1-0x0-1x1-1x1-0-NCHW-FP16-B=ConvAsm1x1U:1,8,2,64,1,2,4,1;ConvOclDirectFwd1x1:1,64,1,1,0,1,4,4,0
512-14-14-1x1-128-14-14-16-0x0-1x1-1x1-0-NCHW-FP16-W=ConvAsmBwdWrW1x1:4,4,4,4,2,1,1,4,0,0
128-14-14-1x1-1568-14-14-128-0x0-1x1-1x1-0-NCHW-FP16-W=ConvAsmBwdWrW1x1:2,8,8,4,4,1,1,4,0,1
1776-14-14-1x1-192-14-14-4-0x0-1x1-1x1-0-NCHW-FP32-F=ConvAsm1x1U:2,8,4,64,1,4,4,1;ConvOclDirectFwd1x1:1,64,1,1,1,1,16,256,0
384-28-28-1x1-768-28-28-2-0x0-1x1-1x1-0-NCHW-FP32-W=ConvAsmBwdWrW1x1:1,16,2,8,4,1,2,4,0,1
128-7-7-1x1-1344-7-7-512-0x0-1x1-1x1-0-NCHW-FP32-B=ConvAsm1x1U:1,16,1,64,2,2,1,2;ConvOclDirectFwd1x1:1,64,1,1,0,1,32,4,0
192-7-7-1x1-1920-7-7-1-0x0-1x1-1x1-0-NCHW-FP16-B=ConvAsm1x1U:1,8,2,32,1,2,4,4;ConvOclDirectFwd1x1:1,128,1,1,0,1,4,4,0
800-7-7-1x1-128-7-7-1-0x0-1x1-1x1-0-NCHW-FP32-F=ConvAsm1x1U:1,8,1,16,1,4,4,2;ConvOclDirectFwd1x1:1,64,1,1,1,4,16,64,0
128-28-28-1x1-320-28-28-8-0x0-1x1-1x1-0-NCHW-FP16-B=ConvAsm1x1U:1,16,2,16,1,2,1,2;ConvOclDirectFwd1x1:1,64,1,1,0,4,16,4,0
672-7-7-1x1-128-7-7-32-0x0-1x1-1x1-0-NCHW-FP32-W=ConvAsmBwdWrW1x1:1,16,2,8,2,1,2,4,0,2
32-54-54-1x1-128-54-54-256-0x0-1x1-1x1-0-NCHW-FP32-B=ConvAsm1x1U:1,8,1,64,1,4,1,4;ConvOclDirectFwd1x1:1,128,1,1,0,1,32,4,0
128-7-7-1x1-896-7-7-512-0x0-1x1-1x1-0-NCHW-FP32-W=ConvAsmBwdWrW1x1:1,16,2,8,4,1,2,4,0,2
128-7-7-1x1-1376-7-7-1-0x0-1x1-1x1-0-NCHW-FP16-W=ConvAsmBwdWrW1x1:1,16,2,4,2,1,1,4,0,1
736-7-7-1x1-128-7-7-128-0x0-1x1-1x1-0-NCHW-FP32-W=ConvAsmBwdWrW1x1:1,16,2,8,2,1,2,4,0,2
116-14-14-1x1-116-14-14-512-0x0-1x1-1x1-0-NCHW-FP32-W=ConvAsmBwdWrW1x1:4,4,4,4,4,1,4,4,0,2
128-112-112-3x3-128-112-112-8-1x1-1x1-1x1-0-NCHW-FP16-F=ConvOclDirectFwd:8,16,16,32,2,2,8,1,2;ConvOclDirectFwdFused:16,8,16,32,1,4,8,1,1
192-28-28-1x1-672-28-28-32-0x0-1x1-1x1-0-NCHW-FP16-B=ConvAsm1x1U:1,16,2,16,1,2,1,2;ConvOclDirectFwd1x1:1,128,1,1,0,4,16,4,0
640-14-14-1x1-128-14-14-32-0x0-1x1-1x1-0-NCHW-FP32-B=ConvAsm1x1U:1,16,1,32,1,1,2,2;ConvOclDirectFwd1x1:1,64,1,1,0,4,16,4,0
480-14-14-1x1-64-14-14-4-0x0-1x1-1x1-0-NCHW-FP32-F=ConvAsm1x1U:1,8,1,32,1,4,4,2;ConvActivAsm1x1U:1,16,1,16,1,4;ConvOclDirectFwd1x1:1,64,1,1,1,1,16,64,0
192-28-28-1x1-576-28-28-8-0x0-1x1-1x1-0-NCHW-FP16-B=ConvAsm1x1U:1,16,2,16,1,2,2,2;ConvOclDirectFwd1x1:1,128,1,1,0,4,16,4,0
1056-14-14-1x1-2112-14-14-128-0x0-1x1-1x1-0-NCHW-FP16-W=ConvAsmBwdWrW1x1:2,8,8,8,2,1,1,4,0,1
16-28-28-1x1-192-28-28-64-0x0-1x1-1x1-0-NCHW-FP16-B=ConvAsm1x1U:1,8,2,32,1,4,1,4;ConvOclDirectFwd1x1:1,256,1,1,0,2,16,4,0
32-27-27-1x1-256-27-27-8-0x0-1x1-1x1-0-NCHW-FP16-B=ConvAsm1x1U:1,8,2,64,1,4,1,2;ConvOclDirectFwd1x1:1,128,1,1,0,1,4,4,0
1344-14-14-1x1-128-14-14-2-0x0-1x1-1x1-0-NCHW-FP16-F=ConvAsm1x1U:1,8,2,16,1,4,4,1;ConvOclDirectFwd1x1:1,128,1,1,0,4,4,4,0
128-7-7-1x1-832-7-7-64-0x0-1x1-1x1-0-NCHW-FP16-W=ConvAsmBwdWrW1x1:4,4,4,4,4,1,1,2,0,1
128-7-7-1x1-1408-7-7-64-0x0-1x1-1x1-0-NCHW-FP32-W=ConvAsmBwdWrW1x1:1,16,2,4,8,1,4,4,0,2
1584-14-14-1x1-192-14-14-64-0x0-1x1-1x1-0-NCHW-FP32-F=ConvAsm1x1U:4,16,4,64,1,2,1,1;ConvOclDirectFwd1x1:1,64,1,1,1,0,16,2048,0
128-7-7-1x1-896-7-7-16-0x0-1x1-1x1-0-NCHW-FP32-W=ConvAsmBwdWrW1x1:1,16,2,4,8,1,2,4,0,1
192-7-7-1x1-1872-7-7-64-0x0-1x1-1x1-0-NCHW-FP32-B=ConvAsm1x1U:2,16,2,32,1,2,1,4;ConvOclDirectFwd1x1:1,64,1,1,0,1,16,4,0
864-7-7-1x1-128-7-7-32-0x0-1x1-1x1-0-NCHW-FP32-F=ConvAsm1x1U:2,8,2,32,1,4,4,4;ConvOclDirectFwd1x1:1,64,1,1,1,4,16,128,0
2048-8-8-1x1-1024-8-8-256-0x0-1x1-1x1-0-NCHW-FP32-F=ConvAsm1x1U:2,16,2,32,3,2,4,1;ConvOclDirectFwd1x1:1,64,1,1,1,1,64,2048,0
1776-14-14-1x1-192-14-14-512-0x0-1x1-1x1-0-NCHW-FP16-F=ConvAsm1x1U:2,8,4,64,1,4,1,8;ConvOclDirectFwd1x1:1,128,1,1,0,2,8,4,0
128-28-28-1x1-224-28-28-16-0x0-1x1-1x1-0-NCHW-FP16-B=ConvAsm1x1U:1,16,2,16,1,2,2,2;ConvOclDirectFwd1x1:1,64,1,1,0,4,16,4,0
832-7-7-1x1-192-7-7-8-0x0-1x1-1x1-0-NCHW-FP32-F=ConvAsm1x1U:2,8,2,32,1,4,4,1;ConvActivAsm1x1U:1,16,2,16,1,3;ConvOclDirectFwd1x1:1,64,1,1,1,4,16,128,0
128-57-57-1x1-256-57-57-64-0x0-1x1-1x1-0-NCHW-FP32-W=ConvAsmBwdWrW1x1:2,8,2,4,2,1,1,4,0,2
512-32-32-3x3-256-32-32-4-1x1-1x1-1x1-0-NCHW-FP32-W=ConvAsmBwdWrW3x3:0,1,16,4,4,1
256-7-7-1x1-832-7-7-512-0x0-1x1-1x1-0-NCHW-FP32-B=ConvAsm1x1U:1,16,1,64,3,2,2,1;ConvOclDirectFwd1x1:1,256,1,1,0,1,32,4,0
448-8-8-1x1-2048-8-8-64-0x0-1x1-1x1-0-NCHW-FP16-W=ConvAsmBwdWrW1x1:2,8,4,4,4,2,1,4,0,0
448-28-28-1x1-128-28-28-4-0x0-1x1-1x1-0-NCHW-FP32-F=ConvAsm1x1U:4,8,4,16,1,4,2,2;ConvOclDirectFwd1x1:1,64,1,1,1,4,16,128,0
480-14-14-1x1-64-14-14-256-0x0-1x1-1x1-0-NCHW-FP16-F=ConvAsm1x1U:2,8,4,32,2,4,1,8;ConvOclDirectFwd1x1:1,64,1,1,0,2,16,4,0
960-7-7-1x1-240-7-7-1-0x0-1x1-1x1-0-NCHW-FP16-B_g3=ConvOclDirectFwd:8,8,8,8,1,1,2,2,1
48-35-35-1x1-256-35-35-64-0x0-1x1-1x1-0-NCHW-FP32-W=ConvAsmBwdWrW1x1:4,4,4,4,4,1,4,4,0,1
384-27-27-1x1-48-27-27-64-0x0-1x1-1x1-0-NCHW-FP16-F=ConvAsm1x1U:3,8,6,64,1,4,1,2;ConvOclDirectFwd1x1:1,64,1,1,0,1,8,4,0
1728-14-14-1x1-128-14-14-256-0x0-1x1-1x1-0-NCHW-FP32-F=ConvAsm1x1U:4,16,4,64,1,2,2,2;ConvOclDirectFwd1x1:1,64,1,1,1,1,16,2048,0
128-14-14-1x1-544-14-14-32-0x0-1x1-1x1-0-NCHW-FP16-W=ConvAsmBwdWrW1x1:2,8,4,8,2,1,2,4,0,1
128-14-14-1x1-992-14-14-64-0x0-1x1-1x1-0-NCHW-FP16-B=ConvAsm1x1U:1,16,2,16,1,2,1,2;ConvOclDirectFwd1x1:1,256,1,1,0,4,8,4,0
448-28-28-1x1-128-28-28-32-0x0-1x1-1x1-0-NCHW-FP32-W=ConvAsmBwdWrW1x1:1,16,2,8,4,1,4,4,0,1
320-28-28-1x1-64-28-28-32-0x0-1x1-1x1-0-NCHW-FP32-F=ConvAsm1x1U:3,16,3,16,1,2,2,1;ConvActivAsm1x1U:2,16,2,16,2,3;ConvOclDirectFwd1x1:1,64,1,1,1,0,16,128,0
384-8-8-3x1-384-8-8-256-1x0-1x1-1x1-0-NCHW-FP16-W=ConvOclBwdWrW2<4>:1,8,8,8,9;ConvOclBwdWrW2<1>:1,8,8,8,9;ConvOclBwdWrW2<16>:1,8,8,8,9;ConvOclBwdWrW2<8>:1,8,8,8,9;ConvOclBwdWrW2<2>:1,8,8,8,9
48-14-14-5x5-512-14-14-64-2x2-1x1-1x1-0-NCHW-FP32-B=ConvOclDirectFwd:8,8,16,16,2,2,8,2,2
128-7-7-1x1-1312-7-7-8-0x0-1x1-1x1-0-NCHW-FP32-W=ConvAsmBwdWrW1x1:1,16,2,8,4,1,2,4,0,0
1728-14-14-1x1-192-14-14-16-0x0-1x1-1x1-0-NCHW-FP32-F=ConvAsm1x1U:3,8,3,16,1,4,1,4;ConvActivAsm1x1U:1,16,3,16,4,4;ConvOclDirectFwd1x1:1,64,1,1,1,1,16,2048,0
384-13-13-1x1-64-13-13-2-0x0-1x1-1x1-0-NCHW-FP16-F=ConvAsm1x1U:1,8,2,16,1,4,4,1;ConvOclDirectFwd1x1:1,128,1,1,0,1,4,4,0
54-28-28-3x3-54-55-55-16-1x1-2x2-1x1-0-NCHW-FP32-B=ConvOclDirectFwd:16,8,16,32,1,4,4,1,1
128-14-14-1x1-256-14-14-8-0x0-1x1-1x1-0-NCHW-FP16-W=ConvAsmBwdWrW1x1:2,8,2,4,2,1,2,4,0,1
128-14-14-1x1-320-14-14-16-0x0-1x1-1x1-0-NCHW-FP32-B=ConvAsm1x1U:1,16,1,32,1,2,1,1;ConvOclDirectFwd1x1:1,64,1,1,0,4,16,4,0
192-28-28-1x1-240-28-28-4-0x0-1x1-1x1-0-NCHW-FP32-B=ConvAsm1x1U:1,16,1,16,1,2,2,1;ConvOclDirectFwd1x1:1,64,1,1,0,1,8,4,0
128-56-56-1x1-160-56-56-2-0x0-1x1-1x1-0-NCHW-FP16-W=ConvAsmBwdWrW1x1:4,4,4,1,8,1,2,4,0,0
128-7-7-1x1-768-7-7-64-0x0-1x1-1x1-0-NCHW-FP16-W=ConvAsmBwdWrW1x1:2,8,4,8,2,1,2,4,0,1
32-27-27-1x1-256-27-27-256-0x0-1x1-1x1-0-NCHW-FP32-B=ConvAsm1x1U:1,32,1,64,1,1,1,1;ConvOclDirectFwd1x1:1,256,1,1,0,1,32,4,0
528-14-14-1x1-128-14-14-4-0x0-1x1-1x1-0-NCHW-FP16-F=ConvAsm1x1U:1,8,2,16,1,4,4,1;ConvOclDirectFwd1x1:1,64,1,1,0,4,4,4,0
48-27-27-1x1-384-27-27-512-0x0-1x1-1x1-0-NCHW-FP32-W=ConvAsmBwdWrW1x1:2,8,4,8,2,1,4,4,0,2
128-7-7-1x1-1760-7-7-8-0x0-1x1-1x1-0-NCHW-FP32-W=ConvAsmBwdWrW1x1:1,16,2,4,8,1,1,4,0,1
1088-7-7-1x1-128-7-7-1024-0x0-1x1-1x1-0-NCHW-FP16-F=ConvAsm1x1U:2,8,4,16,1,4,1,4;ConvOclDirectFwd1x1:1,64,1,1,0,1,8,4,0
128-14-14-1x1-1056-14-14-64-0x0-1x1-1x1-0-NCHW-FP32-B=ConvAsm1x1U:1,16,1,32,2,2,2,2;ConvOclDirectFwd1x1:1,256,1,1,0,4,16,4,0
2048-7-7-1x1-512-7-7-4-0x0-1x1-1x1-0-NCHW-FP16-B=ConvAsm1x1U:1,8,2,32,1,2,4,2;ConvOclDirectFwd1x1:1,64,1,1,0,1,4,4,0
120-14-14-1x1-480-14-14-16-0x0-1x1-1x1-0-NCHW-FP32-B_g3=ConvOclDirectFwd:8,8,8,8,1,1,8,4,2
192-14-14-1x1-1440-14-14-256-0x0-1x1-1x1-0-NCHW-FP32-W=ConvAsmBwdWrW1x1:2,8,4,4,8,1,2,4,0,1
64-28-28-1x1-192-28-28-128-0x0-1x1-1x1-0-NCHW-FP32-W=ConvAsmBwdWrW1x1:2,8,2,4,4,1,4,4,0,2
128-57-57-3x3-128-57-57-16-1x1-1x1-1x1-0-NCHW-FP32-B_g32=ConvOclDirectFwd:16,16,16,32,1,2,8,4,1
128-14-14-1x1-640-14-14-128-0x0-1x1-1x1-0-NCHW-FP32-B=ConvAsm1x1U:1,16,1,32,2,1,1,4;ConvOclDirectFwd1x1:1,256,1,1,0,4,16,4,0
32-7-7-1x1-832-7-7-1-0x0-1x1-1x1-0-NCHW-FP16-W=ConvAsmBwdWrW1x1:4,4,2,1,2,1,1,2,0,1
512-28-28-1x1-256-28-28-64-0x0-1x1-1x1-0-NCHW-FP32-F=ConvAsm1x1U:4,16,5,32,1,2,1,4;ConvActivAsm1x1U:3,16,3,32,4,2;ConvOclDirectFwd1x1:1,64,1,1,1,4,16,2048,0
64-112-112-3x3-128-112-112-128-1x1-1x1-1x1-0-NCHW-FP16-W=ConvAsmBwdWrW3x3:0,0,8,4,1,4
64-57-57-1x1-128-57-57-8-0x0-1x1-1x1-0-NCHW-FP32-F=ConvAsm1x1U:2,16,2,64,1,2,1,1;ConvOclDirectFwd1x1:1,64,1,1,1,1,16,256,0
512-7-7-3x3-512-14-14-256-1x1-2x2-1x1-0-NCHW-FP16-W=ConvAsmBwdWrW3x3:0,0,8,4,9,1
128-28-28-1x1-256-28-28-64-0x0-1x1-1x1-0-NCHW-FP32-W=ConvAsmBwdWrW1x1:2,8,4,8,2,1,4,4,0,1
2048-7-7-1x1-1024-14-14-48-0x0-2x2-1x1-0-NCHW-FP32-B=ConvAsm1x1U:4,16,4,16,1,2,4,1;ConvOclDirectFwd1x1:1,256,1,1,0,1,32,4,0
192-28-28-1x1-336-28-28-128-0x0-1x1-1x1-0-NCHW-FP16-W=ConvAsmBwdWrW1x1:4,4,4,4,8,2,2,4,0,1
48-27-27-1x1-192-27-27-32-0x0-1x1-1x1-0-NCHW-FP16-F=ConvAsm1x1U:1,8,2,64,1,4,1,2;ConvOclDirectFwd1x1:1,128,1,1,0,1,8,4,0
1440-7-7-1x1-128-7-7-64-0x0-1x1-1x1-0-NCHW-FP32-F=ConvAsm1x1U:2,8,4,16,1,4,2,2;ConvOclDirectFwd1x1:1,64,1,1,1,4,16,256,0
128-28-28-1x1-256-14-14-128-0x0-2x2-1x1-0-NCHW-FP16-F=ConvAsm1x1U:2,8,4,64,1,4,1,4;ConvOclDirectFwd1x1:1,256,1,1,0,1,32,4,0
1440-7-7-1x1-128-7-7-2-0x0-1x1-1x1-0-NCHW-FP16-F=ConvAsm1x1U:1,8,2,16,1,4,4,1;ConvOclDirectFwd1x1:1,64,1,1,0,1,4,8,0
128-7-7-1x1-928-7-7-512-0x0-1x1-1x1-0-NCHW-FP32-B=ConvAsm1x1U:1,16,1,64,2,2,1,2;ConvOclDirectFwd1x1:1,128,1,1,0,1,32,4,0
128-56-56-1x1-128-56-56-128-0x0-1x1-1x1-0-NCHW-FP16-F=ConvAsm1x1U:3,8,6,64,1,4,1,4;ConvOclDirectFwd1x1:1,256,1,1,0,4,16,4,0
832-7-7-1x1-192-7-7-64-0x0-1x1-1x1-0-NCHW-FP32-F=ConvAsm1x1U:2,8,2,32,1,4,1,4;ConvActivAsm1x1U:1,16,1,64,4,2;ConvOclDirectFwd1x1:1,64,1,1,1,1,16,256,0
256-56-56-1x1-256-56-56-8-0x0-1x1-1x1-0-NCHW-FP32-F=ConvAsm1x1U:2,16,2,64,2,2,1,4;ConvOclDirectFwd1x1:1,64,1,1,1,4,16,2048,0
128-28-28-1x1-128-28-28-2-0x0-1x1-1x1-0-NCHW-FP16-W=ConvAsmBwdWrW1x1:4,4,4,1,2,1,1,4,0,1
1376-14-14-1x1-128-14-14-128-0x0-1x1-1x1-0-NCHW-FP32-F=ConvAsm1x1U:4,16,4,64,1,2,2,2;ConvOclDirectFwd1x1:1,64,1,1,1,1,16,2048,0
192-14-14-1x1-1200-14-14-32-0x0-1x1-1x1-0-NCHW-FP32-B=ConvAsm1x1U:1,16,1,32,2,1,1,4;ConvOclDirectFwd1x1:1,64,1,1,0,4,16,4,0
192-56-56-1x1-240-56-56-32-0x0-1x1-1x1-0-NCHW-FP16-B=ConvAsm1x1U:1,16,2,32,1,2,1,4;ConvOclDirectFwd1x1:1,256,1,1,0,4,16,4,0
128-7-7-1x1-1088-7-7-1024-0x0-1x1-1x1-0-NCHW-FP16-B=ConvAsm1x1U:2,16,4,16,1,2,1,2;ConvOclDirectFwd1x1:1,256,1,1,0,1,8,4,0
16-54-54-1x1-96-54-54-8-0x0-1x1-1x1-0-NCHW-FP32-B=ConvAsm1x1U:1,16,1,64,1,2,2,1;ConvOclDirectFwd1x1:1,256,1,1,0,1,8,8,0
48-64-128-1x1-832-64-128-1-0x0-1x1-1x1-0-NCHW-FP16-B=ConvOclDirectFwd1x1:1,128,1,1,0,2,8,4,0
256-27-27-1x1-64-27-27-1-0x0-1x1-1x1-0-NCHW-FP16-W=ConvAsmBwdWrW1x1:2,8,2,2,2,1,1,2,0,1
64-147-147-3x3-32-147-147-128-1x1-1x1-1x1-0-NCHW-FP16-W=ConvAsmBwdWrW3x3:0,0,16,4,1,4
128-14-14-1x1-992-14-14-8-0x0-1x1-1x1-0-NCHW-FP16-W=ConvAsmBwdWrW1x1:2,8,8,4,2,1,1,2,0,1
128-56-56-1x1-224-56-56-32-0x0-1x1-1x1-0-NCHW-FP32-B=ConvAsm1x1U:1,16,1,64,2,1,1,2;ConvOclDirectFwd1x1:1,64,1,1,0,1,32,4,0
128-7-7-1x1-928-7-7-8-0x0-1x1-1x1-0-NCHW-FP32-W=ConvAsmBwdWrW1x1:1,16,2,4,4,1,1,4,0,1
48-56-56-3x3-192-56-56-512-1x1-1x1-1x1-0-NCHW-FP32-W=ConvAsmBwdWrW3x3:0,0,16,4,3,4
60-28-28-3x3-60-28-28-512-1x1-1x1-1x1-0-NCHW-FP32-W=ConvAsmBwdWrW3x3:0,0,16,4,8,4
192-7-7-1x1-1536-7-7-128-0x0-1x1-1x1-0-NCHW-FP32-B=ConvAsm1x1U:1,16,1,64,2,2,1,1;ConvOclDirectFwd1x1:1,64,1,1,0,1,16,4,0
128-56-56-1x1-256-56-56-64-0x0-1x1-1x1-0-NCHW-FP16-B=ConvAsm1x1U:1,16,2,32,1,2,1,2;ConvOclDirectFwd1x1:1,128,1,1,0,4,16,4,0
128-7-7-1x1-1824-7-7-256-0x0-1x1-1x1-0-NCHW-FP32-B=ConvAsm1x1U:1,16,1,64,2,2,1,2;ConvOclDirectFwd1x1:1,64,1,1,0,1,32,4,0
320-8-8-3x3-192-17-17-8-0x0-2x2-1x1-0-NCHW-FP16-B=ConvOclDirectFwd:8,16,32,32,4,2,4,4,2
1024-14-14-3x3-1024-7-7-48-1x1-2x2-1x1-0-NCHW-FP32-F_g32=ConvOclDirectFwd:8,8,8,8,1,1,8,2,2
864-7-7-1x1-128-7-7-4-0x0-1x1-1x1-0-NCHW-FP32-F=ConvAsm1x1U:1,8,1,64,1,4,4,2;ConvOclDirectFwd1x1:1,64,1,1,1,1,16,64,0
192-28-28-1x1-480-28-28-512-0x0-1x1-1x1-0-NCHW-FP32-B=ConvAsm1x1U:1,16,1,32,2,1,1,2;ConvOclDirectFwd1x1:1,128,1,1,0,1,32,4,0
192-14-14-1x1-1104-14-14-32-0x0-1x1-1x1-0-NCHW-FP16-W=ConvAsmBwdWrW1x1:2,8,8,8,2,1,1,4,0,1
1056-14-14-1x1-192-14-14-4-0x0-1x1-1x1-0-NCHW-FP16-F=ConvAsm1x1U:1,8,2,64,1,4,4,1;ConvOclDirectFwd1x1:1,64,1,1,0,4,4,4,0
224-35-35-3x3-256-17-17-16-0x0-2x2-1x1-0-NCHW-FP32-F=ConvOclDirectFwd:8,32,32,32,4,1,8,1,2
256-29-29-1x1-512-29-29-8-0x0-1x1-1x1-0-NCHW-FP32-B=ConvAsm1x1U:2,16,2,64,1,1,2,4;ConvOclDirectFwd1x1:1,256,1,1,0,1,16,8,0
192-14-14-1x1-1248-14-14-256-0x0-1x1-1x1-0-NCHW-FP16-B=ConvAsm1x1U:1,16,2,16,1,2,1,2;ConvOclDirectFwd1x1:1,64,1,1,0,2,16,4,0
256-27-27-1x1-48-27-27-32-0x0-1x1-1x1-0-NCHW-FP32-F=ConvAsm1x1U:3,16,5,32,1,2,2,1;ConvOclDirectFwd1x1:1,64,1,1,1,4,32,2048,0
512-14-14-1x1-24-14-14-64-0x0-1x1-1x1-0-NCHW-FP16-F=ConvAsm1x1U:2,8,4,64,1,4,4,1;ConvOclDirectFwd1x1:1,128,1,1,0,4,4,4,0
1280-8-8-1x1-384-8-8-128-0x0-1x1-1x1-0-NCHW-FP16-F=ConvAsm1x1U:1,8,2,32,4,4,2,4;ConvOclDirectFwd1x1:1,64,1,1,0,2,8,4,0
1024-7-7-1x1-464-7-7-1024-0x0-1x1-1x1-0-NCHW-FP16-W=ConvAsmBwdWrW1x1:1,16,4,8,4,2,1,2,0,2
192-27-27-5x5-64-27-27-32-2x2-1x1-1x1-0-NCHW-FP32-W=ConvOclBwdWrW2<4>:1,6,1,3,7;ConvOclBwdWrW2<1>:1,11,3,3,7;ConvOclBwdWrW2<16>:1,11,3,3,7;ConvOclBwdWrW2<8>:1,11,3,3,7;ConvOclBwdWrW2<2>:1,10,3,3,9
288-28-28-1x1-128-28-28-2-0x0-1x1-1x1-0-NCHW-FP16-F=ConvAsm1x1U:1,8,2,32,1,4,4,4;ConvOclDirectFwd1x1:1,64,1,1,0,2,4,4,0
512-28-28-3x3-512-28-28-128-1x1-1x1-1x1-0-NCHW-FP16-W=ConvAsmBwdWrW3x3:0,0,8,4,2,1
128-14-14-1x1-864-14-14-8-0x0-1x1-1x1-0-NCHW-FP16-W=ConvAsmBwdWrW1x1:2,8,4,8,2,1,2,4,0,0
1728-14-14-1x1-128-14-14-2-0x0-1x1-1x1-0-NCHW-FP32-F=ConvAsm1x1U:1,8,1,64,1,4,4,1;ConvOclDirectFwd1x1:1,64,1,1,1,1,16,128,0
1024-4-4-1x1-2048-7-7-128-0x0-2x2-1x1-0-NCHW-FP16-W=ConvAsmBwdWrW1x1:1,16,4,4,4,2,1,4,0,0
128-14-14-1x1-1664-14-14-2-0x0-1x1-1x1-0-NCHW-FP16-W=ConvAsmBwdWrW1x1:1,16,4,2,8,1,2,4,0,0
1024-8-8-3x3-1024-15-15-2-1x1-2x2-1x1-0-NCHW-FP16-W_g32=ConvOclBwdWrW2<1>:1,6,8,1,9;ConvAsmBwdWrW3x3:0,0,8,8,1,1;ConvOclBwdWrW2<2>:1,7,3,1,9
736-14-14-1x1-128-14-14-32-0x0-1x1-1x1-0-NCHW-FP16-F=ConvAsm1x1U:2,8,4,64,1,4,2,4;ConvOclDirectFwd1x1:1,256,1,1,0,4,4,4,0
160-14-14-1x1-528-14-14-32-0x0-1x1-1x1-0-NCHW-FP32-W=ConvAsmBwdWrW1x1:1,16,2,4,8,1,2,4,0,1
96-14-14-1x1-480-14-14-4-0x0-1x1-1x1-0-NCHW-FP16-W=ConvAsmBwdWrW1x1:2,8,2,4,2,1,1,2,0,1
256-27-27-3x3-64-27-27-64-1x1-1x1-1x1-0-NCHW-FP16-W=ConvAsmBwdWrW3x3:0,0,8,4,5,1
320-28-28-1x1-128-28-28-4-0x0-1x1-1x1-0-NCHW-FP16-F=ConvAsm1x1U:1,8,2,32,1,4,2,1;ConvOclDirectFwd1x1:1,64,1,1,0,2,4,4,0
832-7-7-1x1-192-7-7-256-0x0-1x1-1x1-0-NCHW-FP32-F=ConvAsm1x1U:4,8,4,16,1,4,1,8;ConvActivAsm1x1U:2,16,2,32,2,1;ConvOclDirectFwd1x1:1,64,1,1,1,1,16,2048,0
256-35-35-1x1-64-35-35-512-0x0-1x1-1x1-0-NCHW-FP16-F=ConvAsm1x1U:3,8,6,16,1,4,1,4;ConvOclDirectFwd1x1:1,256,1,1,0,1,8,4,0
64-55-55-1x1-256-55-55-16-0x0-1x1-1x1-0-NCHW-FP32-F=ConvAsm1x1U:3,16,3,64,4,1;ConvOclDirectFwd1x1:1,64,1,1,1,1,32,2048,0
736-14-14-1x1-128-14-14-1024-0x0-1x1-1x1-0-NCHW-FP16-F=ConvAsm1x1U:2,8,4,64,1,4,2,4;ConvOclDirectFwd1x1:1,256,1,1,0,2,8,4,0
32-79-341-5x10-32-38-166-1-0x0-2x2-1x1-0-NCHW-FP32-F=ConvOclDirectFwd:16,16,16,16,1,1,8,2,1
2048-7-7-1x1-1024-14-14-128-0x0-2x2-1x1-0-NCHW-FP32-W=ConvAsmBwdWrW1x1:1,16,4,8,4,1,2,4,0,2
32-28-28-5x5-192-28-28-4-2x2-1x1-1x1-0-NCHW-FP32-B=ConvOclDirectFwd:16,16,32,32,2,2,4,2,2
192-14-14-1x1-528-14-14-2-0x0-1x1-1x1-0-NCHW-FP16-W=ConvAsmBwdWrW1x1:2,8,2,8,2,1,2,4,0,0
96-14-14-1x1-480-14-14-16-0x0-1x1-1x1-0-NCHW-FP32-B=ConvAsm1x1U:1,16,1,32,2,2,2,2;ConvOclDirectFwd1x1:1,64,1,1,0,4,16,4,0
512-28-28-1x1-128-28-28-4-0x0-1x1-1x1-0-NCHW-FP16-F=ConvAsm1x1U:1,8,2,64,1,4,2,2;ConvOclDirectFwd1x1:1,128,1,1,0,2,4,4,0
3-108-108-3x3-64-54-54-1024-1x1-2x2-1x1-0-NCHW-FP32-F=ConvOclDirectFwd:16,16,16,16,1,1,8,1,2
1024-8-8-1x1-2048-8-8-128-0x0-1x1-1x1-0-NCHW-FP32-B=ConvAsm1x1U:1,32,1,64,2,1,1,4;ConvOclDirectFwd1x1:1,128,1,1,0,4,16,8,0
128-56-56-1x1-256-56-56-64-0x0-1x1-1x1-0-NCHW-FP16-W=ConvAsmBwdWrW1x1:4,4,4,1,8,2,1,4,0,1
192-14-14-1x1-2016-14-14-32-0x0-1x1-1x1-0-NCHW-FP16-B=ConvAsm1x1U:1,16,2,16,1,2,1,4;ConvOclDirectFwd1x1:1,64,1,1,0,4,8,4,0
1024-8-8-3x3-1024-8-8-4-1x1-1x1-1x1-0-NCHW-FP32-W_g32=ConvOclBwdWrW2<1>:1,8,8,1,9;ConvOclBwdWrW2<4>:1,8,8,1,9;ConvAsmBwdWrW3x3:0,1,8,2,7,1;ConvOclBwdWrW2<2>:1,8,8,1,9
120-14-14-3x3-120-7-7-1024-1x1-2x2-1x1-0-NCHW-FP32-F=ConvOclDirectFwd:8,8,8,8,1,1,8,2,2
128-7-7-1x1-1600-7-7-4-0x0-1x1-1x1-0-NCHW-FP16-B=ConvAsm1x1U:1,8,2,16,1,2,4,1;ConvOclDirectFwd1x1:1,64,1,1,0,1,4,4,0
1680-7-7-1x1-192-7-7-32-0x0-1x1-1x1-0-NCHW-FP32-F=ConvAsm1x1U:2,8,2,32,1,4,2,2;ConvOclDirectFwd1x1:1,64,1,1,1,1,16,256,0
48-35-35-1x1-256-35-35-2-0x0-1x1-1x1-0-NCHW-FP16-W=ConvAsmBwdWrW1x1:4,4,2,4,2,1,2,2,0,2
528-14-14-1x1-32-14-14-1-0x0-1x1-1x1-0-NCHW-FP32-F=ConvAsm1x1U:1,8,1,16,1,4,4,1;ConvActivAsm1x1U:1,16,1,16,1,4;ConvOclDirectFwd1x1:1,64,1,1,1,4,16,64,0
1200-14-14-1x1-192-14-14-8-0x0-1x1-1x1-0-NCHW-FP32-F=ConvAsm1x1U:3,8,3,16,1,4,2,2;ConvOclDirectFwd1x1:1,64,1,1,1,1,16,256,0
512-28-28-1x1-1024-14-14-128-0x0-2x2-1x1-0-NCHW-FP16-F=ConvAsm1x1U:2,8,4,64,1,4,1,4;ConvOclDirectFwd1x1:1,256,1,1,0,2,16,4,0
1280-8-8-1x1-192-8-8-32-0x0-1x1-1x1-0-NCHW-FP32-F=ConvAsm1x1U:2,8,2,32,1,4,1,4;ConvActivAsm1x1U:4,16,4,16,2,4;ConvOclDirectFwd1x1:1,64,1,1,1,1,64,256,0
48-35-35-1x1-288-35-35-2-0x0-1x1-1x1-0-NCHW-FP32-W=ConvAsmBwdWrW1x1:4,4,4,1,8,1,2,4,0,1
1504-7-7-1x1-128-7-7-128-0x0-1x1-1x1-0-NCHW-FP32-F=ConvAsm1x1U:4,16,4,16,1,2,2,2;ConvOclDirectFwd1x1:1,64,1,1,1,1,16,2048,0
128-14-14-1x1-1536-14-14-4-0x0-1x1-1x1-0-NCHW-FP32-W=ConvAsmBwdWrW1x1:1,16,2,4,8,1,1,2,0,1
192-27-27-5x5-64-27-27-32-2x2-1x1-1x1-0-NCHW-FP16-W=ConvOclBwdWrW2<4>:1,12,1,8,9;ConvOclBwdWrW2<1>:1,9,3,3,7;ConvOclBwdWrW2<16>:1,7,1,8,7;ConvOclBwdWrW2<8>:1,9,1,8,7;ConvOclBwdWrW2<2>:3,6,1,8,9
1024-14-14-1x1-512-14-14-6-0x0-1x1-1x1-0-NCHW-FP32-W=ConvAsmBwdWrW1x1:1,16,4,8,4,1,1,4,0,1
192-14-14-1x1-720-14-14-2-0x0-1x1-1x1-0-NCHW-FP16-W=ConvAsmBwdWrW1x1:2,8,2,8,2,1,1,4,0,1
64-13-13-1x1-256-13-13-256-0x0-1x1-1x1-0-NCHW-FP32-W=ConvAsmBwdWrW1x1:4,4,4,4,4,1,4,4,0,1
128-7-7-1x1-704-7-7-1-0x0-1x1-1x1-0-NCHW-FP16-B=ConvAsm1x1U:1,8,2,32,1,4,4,1;ConvOclDirectFwd1x1:1,64,1,1,0,1,4,4,0
128-28-28-1x1-256-56-56-4-0x0-2x2-1x1-0-NCHW-FP16-W=ConvAsmBwdWrW1x1:4,4,4,1,4,2,1,4,0,0
288-14-14-1x1-128-14-14-256-0x0-1x1-1x1-0-NCHW-FP32-W=ConvAsmBwdWrW1x1:1,16,2,8,4,1,4,4,0,1
512-7-7-1x1-512-7-7-2-0x0-1x1-1x1-0-NCHW-FP32-B=ConvAsm1x1U:1,8,1,64,1,4,4,2;ConvOclDirectFwd1x1:1,128,1,1,0,1,4,8,0
256-14-14-1x1-512-7-7-8-0x0-2x2-1x1-0-NCHW-FP32-F=ConvAsm1x1U:1,8,1,64,2,4,4,2;ConvOclDirectFwd1x1:1,64,1,1,1,4,16,64,0
128-14-14-1x1-512-14-14-64-0x0-1x1-1x1-0-NCHW-FP16-B=ConvAsm1x1U:1,16,2,16,1,2,1,8;ConvOclDirectFwd1x1:1,256,1,1,0,2,8,4,0
256-27-27-1x1-48-27-27-64-0x0-1x1-1x1-0-NCHW-FP16-B=ConvAsm1x1U:3,8,6,64,1,4,1,2;ConvOclDirectFwd1x1:1,256,1,1,0,1,8,4,0
64-64-128-1x1-512-64-128-1-0x0-1x1-1x1-0-NCHW-FP16-B=ConvOclDirectFwd1x1:1,128,1,1,0,4,16,4,0
192-17-17-1x1-1024-17-17-1-0x0-1x1-1x1-0-NCHW-FP16-W=ConvAsmBwdWrW1x1:2,8,2,4,4,1,1,4,0,0
24-14-14-5x5-64-14-14-64-2x2-1x1-1x1-0-NCHW-FP32-F=ConvOclDirectFwd:8,8,16,16,2,2,4,1,2;ConvOclDirectFwdFused:8,8,16,16,2,2,4,2,2
288-14-14-3x3-144-14-14-128-1x1-1x1-1x1-0-NCHW-FP16-W=ConvAsmBwdWrW3x3:0,1,8,2,8,2
128-28-28-3x3-32-28-28-256-1x1-1x1-1x1-0-NCHW-FP16-F=ConvOclDirectFwd:16,16,32,32,2,2,8,2,1
192-14-14-1x1-1536-14-14-16-0x0-1x1-1x1-0-NCHW-FP16-W=ConvAsmBwdWrW1x1:2,8,8,8,2,1,2,4,0,1
256-120-192-3x3-256-120-192-32-1x1-1x1-1x1-0-NCHW-FP16-F=ConvOclDirectFwd:16,16,32,32,2,2,8,4,1
352-28-28-1x1-128-28-28-1-0x0-1x1-1x1-0-NCHW-FP16-F=ConvAsm1x1U:1,8,2,32,1,4,4,1;ConvOclDirectFwd1x1:1,64,1,1,0,1,4,8,0
192-28-28-1x1-480-28-28-64-0x0-1x1-1x1-0-NCHW-FP32-W=ConvAsmBwdWrW1x1:2,8,4,4,4,1,4,4,0,1
128-7-7-1x1-544-7-7-512-0x0-1x1-1x1-0-NCHW-FP32-B=ConvAsm1x1U:1,16,1,64,2,2,1,2;ConvOclDirectFwd1x1:1,128,1,1,0,1,32,4,0
64-112-112-7x7-3-224-224-8-3x3-2x2-1x1-0-NCHW-FP32-B=ConvOclDirectFwd:16,16,32,32,2,2,8,2,1
608-14-14-1x1-160-14-14-64-0x0-1x1-1x1-0-NCHW-FP32-F=ConvAsm1x1U:3,8,7,32,1,2,2,2;ConvActivAsm1x1U:4,16,5,16,2,1;ConvOclDirectFwd1x1:1,64,1,1,1,4,16,2048,0
128-14-14-1x1-1088-14-14-64-0x0-1x1-1x1-0-NCHW-FP32-B=ConvAsm1x1U:1,32,1,32,2,1,1,2;ConvOclDirectFwd1x1:1,128,1,1,0,2,16,4,0
16-54-54-3x3-64-54-54-512-1x1-1x1-1x1-0-NCHW-FP16-W=ConvAsmBwdWrW3x3:0,1,8,2,2,8
384-56-56-1x1-192-56-56-4-0x0-1x1-1x1-0-NCHW-FP16-F=ConvAsm1x1U:2,8,4,64,1,4,2,4;ConvOclDirectFwd1x1:1,256,1,1,0,2,8,4,0
384-14-14-1x1-128-14-14-32-0x0-1x1-1x1-0-NCHW-FP16-F=ConvAsm1x1U:2,8,4,64,1,4,2,8;ConvOclDirectFwd1x1:1,64,1,1,0,4,8,4,0
128-14-14-1x1-1248-14-14-16-0x0-1x1-1x1-0-NCHW-FP32-W=ConvAsmBwdWrW1x1:1,16,2,4,8,1,1,4,0,1
128-14-14-1x1-256-14-14-8-0x0-1x1-1x1-0-NCHW-FP16-B=ConvAsm1x1U:1,8,2,64,1,4,2,2;ConvOclDirectFwd1x1:1,128,1,1,0,4,4,4,0
128-7-7-1x1-1696-7-7-64-0x0-1x1-1x1-0-NCHW-FP16-B=ConvAsm1x1U:1,16,2,32,1,2,1,4;ConvOclDirectFwd1x1:1,256,1,1,0,1,4,4,0
192-14-14-1x1-1440-14-14-32-0x0-1x1-1x1-0-NCHW-FP32-B=ConvAsm1x1U:1,32,1,16,2,1,2,2;ConvOclDirectFwd1x1:1,64,1,1,0,4,16,4,0
128-14-14-1x1-992-14-14-2-0x0-1x1-1x1-0-NCHW-FP32-W=ConvAsmBwdWrW1x1:1,16,4,4,2,1,1,4,0,1
128-7-7-1x1-1056-7-7-64-0x0-1x1-1x1-0-NCHW-FP16-W=ConvAsmBwdWrW1x1:1,16,2,8,2,1,2,4,0,0
672-7-7-1x1-128-7-7-128-0x0-1x1-1x1-0-NCHW-FP16-F=ConvAsm1x1U:2,8,4,16,1,4,2,2;ConvOclDirectFwd1x1:1,64,1,1,0,1,4,8,0
128-14-14-1x1-480-14-14-4-0x0-1x1-1x1-0-NCHW-FP32-B=ConvAsm1x1U:1,16,1,16,1,1,4,1;ConvOclDirectFwd1x1:1,128,1,1,0,4,4,4,0
192-7-7-1x1-1680-7-7-512-0x0-1x1-1x1-0-NCHW-FP32-B=ConvAsm1x1U:1,16,1,64,2,1,1,1;ConvOclDirectFwd1x1:1,256,1,1,0,1,16,8,0
128-7-7-1x1-768-7-7-64-0x0-1x1-1x1-0-NCHW-FP32-B=ConvAsm1x1U:2,16,2,32,1,2,1,8;ConvOclDirectFwd1x1:1,64,1,1,0,1,16,4,0
128-7-7-1x1-1056-7-7-32-0x0-1x1-1x1-0-NCHW-FP16-W=ConvAsmBwdWrW1x1:1,16,2,8,2,1,2,4,0,0
512-14-14-1x1-64-14-14-256-0x0-1x1-1x1-0-NCHW-FP16-F=ConvAsm1x1U:2,8,4,32,2,4,1,8;ConvOclDirectFwd1x1:8,64,16,16,0,2,16,4,1
24-55-55-1x1-54-55-55-16-0x0-1x1-1x1-0-NCHW-FP16-F=ConvAsm1x1U:1,16,2,64,2,2,1,2;ConvOclDirectFwd1x1:1,64,1,1,0,1,16,4,0
216-28-28-1x1-54-28-28-16-0x0-1x1-1x1-0-NCHW-FP16-B_g3=ConvOclDirectFwd:16,16,16,16,1,1,4,4,2
112-14-14-1x1-512-14-14-8-0x0-1x1-1x1-0-NCHW-FP32-W=ConvAsmBwdWrW1x1:2,8,2,4,4,2,1,4,0,1
512-13-13-1x1-1000-13-13-256-0x0-1x1-1x1-0-NCHW-FP32-W=ConvAsmBwdWrW1x1:1,16,2,8,8,1,1,4,0,1
128-14-14-1x1-1728-14-14-256-0x0-1x1-1x1-0-NCHW-FP32-B=ConvAsm1x1U:1,32,1,32,2,1,1,2;ConvOclDirectFwd1x1:1,256,1,1,0,1,32,4,0
128-7-7-5x5-832-7-7-64-2x2-1x1-1x1-0-NCHW-FP32-W=ConvOclBwdWrW2<4>:1,7,1,8,7;ConvOclBwdWrW2<1>:1,7,3,3,7;ConvOclBwdWrW2<16>:1,7,1,8,7;ConvOclBwdWrW2<8>:1,7,1,8,7;ConvOclBwdWrW2<2>:1,7,1,8,7
384-7-7-3x3-192-7-7-32-1x1-1x1-1x1-0-NCHW-FP16-W=ConvAsmBwdWrW3x3:0,1,8,4,4,1
128-14-14-1x1-608-14-14-256-0x0-1x1-1x1-0-NCHW-FP16-B=ConvAsm1x1U:1,16,2,16,1,2,1,8;ConvOclDirectFwd1x1:1,128,1,1,0,2,16,4,0
128-14-14-1x1-1280-14-14-2-0x0-1x1-1x1-0-NCHW-FP32-B=ConvAsm1x1U:1,16,1,32,1,2,2,1;ConvOclDirectFwd1x1:1,64,1,1,0,4,4,4,0
416-14-14-1x1-128-14-14-16-0x0-1x1-1x1-0-NCHW-FP16-F=ConvAsm1x1U:2,8,4,64,1,4,4,2;ConvOclDirectFwd1x1:1,64,1,1,0,4,4,4,0
128-28-28-3x3-128-56-56-512-1x1-2x2-1x1-0-NCHW-FP16-W=ConvAsmBwdWrW3x3:0,0,8,4,3,1
256-14-14-3x3-256-14-14-512-1x1-1x1-1x1-0-NCHW-FP16-F=ConvOclDirectFwd:8,8,16,16,2,2,8,2,2
232-7-7-1x1-232-7-7-8-0x0-1x1-1x1-0-NCHW-FP32-W=ConvAsmBwdWrW1x1:1,16,2,4,2,1,1,4,0,1
16-64-128-1x1-480-64-128-1-0x0-1x1-1x1-0-NCHW-FP16-W=ConvAsmBwdWrW1x1:4,4,2,1,8,1,1,4,0,3
192-28-28-1x1-720-28-28-64-0x0-1x1-1x1-0-NCHW-FP32-W=ConvAsmBwdWrW1x1:2,8,2,4,8,1,4,4,0,1
128-7-7-1x1-960-7-7-512-0x0-1x1-1x1-0-NCHW-FP16-W=ConvAsmBwdWrW1x1:1,16,4,4,4,2,2,4,0,3
416-14-14-1x1-128-14-14-64-0x0-1x1-1x1-0-NCHW-FP32-B=ConvAsm1x1U:1,16,1,32,1,1,2,2;ConvOclDirectFwd1x1:1,64,1,1,0,4,16,4,0
256-8-8-1x1-1536-8-8-8-0x0-1x1-1x1-0-NCHW-FP32-B=ConvAsm1x1U:1,16,1,64,2,2,2,2;ConvOclDirectFwd1x1:1,64,1,1,0,4,8,8,0
16-55-55-1x1-128-55-55-2-0x0-1x1-1x1-0-NCHW-FP16-B=ConvAsm1x1U:1,8,2,32,1,2,2,1;ConvOclDirectFwd1x1:1,256,1,1,0,1,4,4,0
128-14-14-1x1-352-14-14-4-0x0-1x1-1x1-0-NCHW-FP32-B=ConvAsm1x1U:1,16,1,16,1,2,2,1;ConvOclDirectFwd1x1:1,256,1,1,0,4,4,4,0
128-28-28-1x1-384-28-28-256-0x0-1x1-1x1-0-NCHW-FP32-F=ConvAsm1x1U:1,16,1,32,3,2,1,8;ConvOclDirectFwd1x1:1,64,1,1,1,4,16,2048,0
640-7-7-1x1-128-7-7-16-0x0-1x1-1x1-0-NCHW-FP16-W=ConvAsmBwdWrW1x1:2,8,2,8,2,2,2,4,0,1
1024-14-14-1x1-2048-7-7-32-0x0-2x2-1x1-0-NCHW-FP32-F=ConvAsm1x1U:4,8,4,16,1,4,2,4;ConvOclDirectFwd1x1:1,64,1,1,1,0,16,256,0
192-7-7-1x1-1632-7-7-1024-0x0-1x1-1x1-0-NCHW-FP16-B=ConvAsm1x1U:2,16,4,16,1,2,1,4;ConvOclDirectFwd1x1:1,64,1,1,0,1,8,4,0
1344-14-14-1x1-192-14-14-512-0x0-1x1-1x1-0-NCHW-FP32-F=ConvAsm1x1U:3,16,4,64,1,2,1,1;ConvOclDirectFwd1x1:1,64,1,1,1,0,32,2048,0
64-28-28-1x1-256-28-28-16-0x0-1x1-1x1-0-NCHW-FP16-B=ConvAsm1x1U:1,16,2,16,1,2,2,2;ConvOclDirectFwd1x1:1,64,1,1,0,4,16,4,0
512-28-28-1x1-256-56-56-64-0x0-2x2-1x1-0-NCHW-FP32-W=ConvAsmBwdWrW1x1:2,8,2,8,4,1,4,4,0,1
192-7-7-1x1-1440-7-7-64-0x0-1x1-1x1-0-NCHW-FP32-W=ConvAsmBwdWrW1x1:1,16,2,8,4,1,4,4,0,3
512-14-14-3x3-512-7-7-64-1x1-2x2-1x1-0-NCHW-FP32-F=ConvOclDirectFwd:8,8,8,8,1,1,8,2,2
128-14-14-1x1-800-14-14-512-0x0-1x1-1x1-0-NCHW-FP32-W=ConvAsmBwdWrW1x1:2,8,4,8,4,1,2,2,0,2
1440-7-7-1x1-192-7-7-8-0x0-1x1-1x1-0-NCHW-FP16-F=ConvAsm1x1U:1,8,2,16,1,4,4,1;ConvOclDirectFwd1x1:1,128,1,1,0,1,4,8,0
192-7-7-1x1-1536-7-7-64-0x0-1x1-1x1-0-NCHW-FP16-B=ConvAsm1x1U:2,16,4,16,1,2,1,4;ConvOclDirectFwd1x1:1,64,1,1,0,1,8,4,0
704-14-14-1x1-128-14-14-32-0x0-1x1-1x1-0-NCHW-FP32-W=ConvAsmBwdWrW1x1:1,16,2,8,2,2,1,4,0,2
624-28-28-1x1-192-28-28-8-0x0-1x1-1x1-0-NCHW-FP32-F=ConvAsm1x1U:3,16,5,32,1,2,2,1;ConvOclDirectFwd1x1:1,64,1,1,1,4,16,2048,0
128-28-28-1x1-480-28-28-1024-0x0-1x1-1x1-0-NCHW-FP16-B=ConvAsm1x1U:1,16,2,16,1,2,1,2;ConvOclDirectFwd1x1:1,128,1,1,0,4,16,4,0
2048-8-8-1x1-448-8-8-256-0x0-1x1-1x1-0-NCHW-FP32-F=ConvAsm1x1U:4,8,4,16,2,4,1,4;ConvActivAsm1x1U:2,16,4,16,2,2;ConvOclDirectFwd1x1:1,64,1,1,1,1,64,2048,0
384-13-13-1x1-48-13-13-2-0x0-1x1-1x1-0-NCHW-FP16-F=ConvAsm1x1U:1,8,2,16,1,4,4,1;ConvOclDirectFwd1x1:1,128,1,1,0,1,4,4,0
192-27-27-1x1-48-27-27-1-0x0-1x1-1x1-0-NCHW-FP32-W=ConvAsmBwdWrW1x1:2,8,2,2,2,1,1,4,0,1
512-28-28-1x1-256-28-28-8-0x0-1x1-1x1-0-NCHW-FP32-F=ConvAsm1x1U:4,16,4,64,1,2,1,2;ConvOclDirectFwd1x1:1,64,1,1,1,0,16,2048,0
192-14-14-1x1-2064-14-14-4-0x0-1x1-1x1-0-NCHW-FP32-W=ConvAsmBwdWrW1x1:1,16,2,4,8,1,1,4,0,0
192-28-28-1x1-480-28-28-16-0x0-1x1-1x1-0-NCHW-FP16-B=ConvAsm1x1U:1,16,2,16,1,2,2,2;ConvOclDirectFwd1x1:1,128,1,1,0,4,16,4,0
192-17-17-3x3-320-8-8-4-0x0-2x2-1x1-0-NCHW-FP32-F=ConvOclDirectFwd:8,8,8,8,1,1,2,2,2
192-7-7-1x1-1776-7-7-8-0x0-1x1-1x1-0-NCHW-FP32-B=ConvAsm1x1U:2,8,2,32,1,1,2,2;ConvOclDirectFwd1x1:1,256,1,1,0,1,8,4,0
512-28-28-1x1-1024-14-14-16-0x0-2x2-1x1-0-NCHW-FP32-F=ConvAsm1x1U:4,8,7,32,2,2,2,2;ConvOclDirectFwd1x1:1,64,1,1,1,0,32,2048,0
192-7-7-1x1-1344-7-7-256-0x0-1x1-1x1-0-NCHW-FP16-W=ConvAsmBwdWrW1x1:1,16,2,8,4,1,2,2,0,2
128-7-7-1x1-1888-7-7-64-0x0-1x1-1x1-0-NCHW-FP32-W=ConvAsmBwdWrW1x1:1,16,2,4,8,1,1,4,0,2
128-14-14-1x1-1440-14-14-4-0x0-1x1-1x1-0-NCHW-FP32-B=ConvAsm1x1U:1,16,1,32,1,2,1,1;ConvOclDirectFwd1x1:1,64,1,1,0,4,16,4,0
48-35-35-1x1-256-35-35-8-0x0-1x1-1x1-0-NCHW-FP16-B=ConvAsm1x1U:1,16,2,16,1,2,1,1;ConvOclDirectFwd1x1:1,256,1,1,0,1,4,4,0
256-13-13-3x3-256-13-13-50-1x1-1x1-1x1-0-NCHW-FP32-W=ConvAsmBwdWrW3x3:0,1,16,4,9,1
128-14-14-1x1-1120-14-14-4-0x0-1x1-1x1-0-NCHW-FP16-W=ConvAsmBwdWrW1x1:1,16,2,8,2,1,2,4,0,0
256-14-14-1x1-128-28-28-8-0x0-2x2-1x1-0-NCHW-FP32-B=ConvAsm1x1U:1,16,1,64,1,2,4,4;ConvOclDirectFwd1x1:1,128,1,1,0,1,4,4,0
192-17-17-1x1-768-17-17-128-0x0-1x1-1x1-0-NCHW-FP16-B=ConvAsm1x1U:2,16,4,16,1,2,1,2;ConvOclDirectFwd1x1:16,64,32,32,0,1,16,4,1
128-56-56-3x3-32-56-56-4-1x1-1x1-1x1-0-NCHW-FP16-F=ConvOclDirectFwd:16,16,16,32,1,2,4,4,2
128-7-7-1x1-1280-7-7-64-0x0-1x1-1x1-0-NCHW-FP16-B=ConvAsm1x1U:1,16,2,32,1,2,1,1;ConvOclDirectFwd1x1:1,128,1,1,0,1,8,4,0
128-28-28-1x1-320-28-28-1-0x0-1x1-1x1-0-NCHW-FP16-W=ConvAsmBwdWrW1x1:2,8,2,4,2,1,1,2,0,1
128-28-28-1x1-224-28-28-4-0x0-1x1-1x1-0-NCHW-FP32-W=ConvAsmBwdWrW1x1:1,16,2,8,2,1,4,4,0,1
58-28-28-1x1-58-28-28-16-0x0-1x1-1x1-0-NCHW-FP32-B=ConvAsm1x1U:4,1,4,4,1,1,1,4;ConvOclDirectFwd1x1:1,64,1,1,0,2,16,4,0
128-14-14-1x1-832-14-14-1024-0x0-1x1-1x1-0-NCHW-FP16-B=ConvAsm1x1U:1,16,2,16,1,2,1,4;ConvOclDirectFwd1x1:1,256,1,1,0,4,16,4,0
192-35-35-1x1-48-35-35-1024-0x0-1x1-1x1-0-NCHW-FP16-F=ConvAsm1x1U:2,16,4,32,1,2,1,1;ConvOclDirectFwd1x1:1,64,1,1,0,1,16,4,0
128-28-28-1x1-288-28-28-64-0x0-1x1-1x1-0-NCHW-FP32-W=ConvAsmBwdWrW1x1:2,8,2,8,4,1,2,4,0,2
128-14-14-1x1-896-14-14-16-0x0-1x1-1x1-0-NCHW-FP32-W=ConvAsmBwdWrW1x1:2,8,4,8,4,1,2,2,0,1
256-13-13-3x3-64-13-13-16-1x1-1x1-1x1-0-NCHW-FP32-W=ConvAsmBwdWrW3x3:0,0,16,2,3,1
256-35-35-1x1-48-35-35-64-0x0-1x1-1x1-0-NCHW-FP32-F=ConvAsm1x1U:2,16,2,64,2,2,4,1;ConvActivAsm1x1U:2,16,2,64,2,1;ConvOclDirectFwd1x1:1,64,1,1,1,0,32,256,0
128-7-7-1x1-1408-7-7-64-0x0-1x1-1x1-0-NCHW-FP16-B=ConvAsm1x1U:2,16,4,16,1,2,2,2;ConvOclDirectFwd1x1:1,64,1,1,0,1,8,4,0
64-224-224-3x3-3-224-224-4-1x1-1x1-1x1-0-NCHW-FP32-W=ConvAsmBwdWrW3x3:0,1,16,1,3,4
16-55-55-3x3-64-55-55-2-1x1-1x1-1x1-0-NCHW-FP16-F=ConvOclDirectFwd:16,16,16,32,1,2,4,2,2
384-27-27-1x1-48-27-27-64-0x0-1x1-1x1-0-NCHW-FP16-W=ConvAsmBwdWrW1x1:4,4,4,4,4,2,2,4,0,1
192-14-14-1x1-768-14-14-2-0x0-1x1-1x1-0-NCHW-FP16-B=ConvAsm1x1U:1,8,2,64,1,4,4,1;ConvOclDirectFwd1x1:1,256,1,1,0,4,4,4,0
512-14-14-3x3-512-14-14-32-1x1-1x1-1x1-0-NCHW-FP32-W=ConvAsmBwdWrW3x3:0,0,8,4,9,1
96-14-14-1x1-480-14-14-64-0x0-1x1-1x1-0-NCHW-FP32-B=ConvAsm1x1U:1,16,1,32,2,1,1,4;ConvOclDirectFwd1x1:1,256,1,1,0,4,16,4,0
128-7-7-1x1-1248-7-7-512-0x0-1x1-1x1-0-NCHW-FP32-B=ConvAsm1x1U:1,16,1,64,2,2,1,2;ConvOclDirectFwd1x1:1,64,1,1,0,1,32,4,0
128-14-14-1x1-1696-14-14-32-0x0-1x1-1x1-0-NCHW-FP16-W=ConvAsmBwdWrW1x1:2,8,8,8,2,1,1,4,0,1
96-28-28-3x3-128-28-28-128-1x1-1x1-1x1-0-NCHW-FP16-F=ConvOclDirectFwd:16,16,32,32,2,2,8,2,1;ConvOclDirectFwdFused:16,16,32,32,2,2,8,1,2
2048-8-8-1x1-1024-8-8-16-0x0-1x1-1x1-0-NCHW-FP32-F=ConvAsm1x1U:3,16,4,16,1,2,2,1;ConvOclDirectFwd1x1:1,64,1,1,1,0,16,2048,0
192-17-17-1x1-1024-17-17-256-0x0-1x1-1x1-0-NCHW-FP16-W=ConvAsmBwdWrW1x1:4,4,8,4,4,1,2,2,0,2
54-28-28-1x1-216-28-28-8-0x0-1x1-1x1-0-NCHW-FP16-F_g3=ConvOclDirectFwd:16,16,16,16,1,1,8,1,2
64-54-54-1x1-16-54-54-1-0x0-1x1-1x1-0-NCHW-FP32-B=ConvAsm1x1U:1,8,1,64,1,4,4,1;ConvOclDirectFwd1x1:1,64,1,1,0,4,4,4,0
128-7-7-1x1-1440-7-7-1-0x0-1x1-1x1-0-NCHW-FP16-W=ConvAsmBwdWrW1x1:1,16,2,4,2,1,1,2,0,2
256-13-13-3x3-256-13-13-2-1x1-1x1-1x1-0-NCHW-FP16-W=ConvAsmBwdWrW3x3:0,0,8,4,1,1
16-54-54-1x1-96-54-54-128-0x0-1x1-1x1-0-NCHW-FP32-F=ConvAsm1x1U:1,16,1,64,1,2,2,1;ConvOclDirectFwd1x1:1,64,1,1,1,1,16,128,0
192-14-14-1x1-432-14-14-32-0x0-1x1-1x1-0-NCHW-FP32-B=ConvAsm1x1U:1,16,1,32,2,1,2,2;ConvOclDirectFwd1x1:1,64,1,1,0,4,16,4,0
1200-7-7-1x1-192-7-7-64-0x0-1x1-1x1-0-NCHW-FP16-F=ConvAsm1x1U:2,8,4,16,1,4,4,2;ConvOclDirectFwd1x1:1,64,1,1,0,1,8,8,0
896-7-7-1x1-128-7-7-4-0x0-1x1-1x1-0-NCHW-FP16-F=ConvAsm1x1U:1,8,2,16,1,4,4,1;ConvOclDirectFwd1x1:1,128,1,1,0,1,4,8,0
120-14-14-3x3-120-14-14-1024-1x1-1x1-1x1-0-NCHW-FP16-F=ConvOclDirectFwd:8,8,16,16,2,2,8,2,1
128-7-7-1x1-576-7-7-2-0x0-1x1-1x1-0-NCHW-FP16-B=ConvAsm1x1U:1,8,2,16,1,2,4,1;ConvOclDirectFwd1x1:1,64,1,1,0,1,4,4,0
192-7-7-1x1-1200-7-7-32-0x0-1x1-1x1-0-NCHW-FP32-B=ConvAsm1x1U:2,16,2,32,1,2,1,4;ConvOclDirectFwd1x1:1,64,1,1,0,1,16,4,0
192-14-14-1x1-1776-14-14-256-0x0-1x1-1x1-0-NCHW-FP16-W=ConvAsmBwdWrW1x1:2,8,8,8,2,1,2,4,0,1
112-14-14-1x1-512-14-14-1-0x0-1x1-1x1-0-NCHW-FP16-W=ConvAsmBwdWrW1x1:2,8,2,2,2,1,1,4,0,1
512-28-28-1x1-256-28-28-128-0x0-1x1-1x1-0-NCHW-FP32-F=ConvAsm1x1U:4,16,5,32,2,2,1,4;ConvActivAsm1x1U:4,16,6,16,1,2;ConvOclDirectFwd1x1:1,64,1,1,1,0,16,2048,0
232-14-14-1x1-232-14-14-512-0x0-1x1-1x1-0-NCHW-FP16-F=ConvAsm1x1U:2,8,4,64,1,4,1,4;ConvOclDirectFwd1x1:1,128,1,1,0,2,8,4,0
64-56-56-1x1-128-56-56-256-0x0-1x1-1x1-0-NCHW-FP16-W=ConvAsmBwdWrW1x1:4,4,2,4,4,1,4,2,0,2
160-56-56-1x1-128-56-56-512-0x0-1x1-1x1-0-NCHW-FP32-W=ConvAsmBwdWrW1x1:2,8,4,2,8,1,4,4,0,2
128-6-60-3x3-64-6-60-16-1x1-1x1-1x1-0-NCHW-FP32-W=ConvAsmBwdWrW3x3:0,0,16,2,3,1
384-13-13-1x1-48-13-13-256-0x0-1x1-1x1-0-NCHW-FP16-F=ConvAsm1x1U:3,8,6,32,1,4,1,2;ConvOclDirectFwd1x1:1,64,1,1,0,1,8,4,0
256-13-13-3x3-64-13-13-32-1x1-1x1-1x1-0-NCHW-FP16-B=ConvOclDirectFwd:8,16,16,16,2,1,4,1,2
128-27-27-3x3-32-27-27-128-1x1-1x1-1x1-0-NCHW-FP16-F=ConvOclDirectFwd:16,16,32,32,2,2,8,4,2
192-7-7-1x1-1536-7-7-1-0x0-1x1-1x1-0-NCHW-FP32-W=ConvAsmBwdWrW1x1:1,16,2,2,4,1,1,4,0,1
960-7-7-1x1-240-7-7-8-0x0-1x1-1x1-0-NCHW-FP16-B_g3=ConvOclDirectFwd:8,8,8,8,1,1,2,2,2
192-27-27-5x5-64-27-27-128-2x2-1x1-1x1-0-NCHW-FP32-F=ConvOclDirectFwd:16,16,32,32,2,2,8,1,2
128-7-7-1x1-704-7-7-32-0x0-1x1-1x1-0-NCHW-FP32-W=ConvAsmBwdWrW1x1:1,16,2,8,2,1,1,4,0,2
192-14-14-1x1-768-14-14-64-0x0-1x1-1x1-0-NCHW-FP32-W=ConvAsmBwdWrW1x1:1,16,2,4,8,1,4,4,0,3
64-56-56-1x1-128-56-56-128-0x0-1x1-1x1-0-NCHW-FP16-W=ConvAsmBwdWrW1x1:4,4,8,1,8,2,4,4,0,1
432-28-28-1x1-192-28-28-128-0x0-1x1-1x1-0-NCHW-FP16-F=ConvAsm1x1U:1,8,2,32,2,4,1,8;ConvOclDirectFwd1x1:1,64,1,1,0,4,16,4,0
128-7-7-1x1-1664-7-7-128-0x0-1x1-1x1-0-NCHW-FP16-B=ConvAsm1x1U:1,16,2,16,1,2,1,4;ConvOclDirectFwd1x1:1,64,1,1,0,1,8,4,0
192-7-7-1x1-1440-7-7-1-0x0-1x1-1x1-0-NCHW-FP16-W=ConvAsmBwdWrW1x1:1,16,2,4,2,1,1,4,0,1
64-112-112-7x7-3-224-224-8-3x3-2x2-1x1-0-NCHW-FP32-W=ConvOclBwdWrW2<4>:8,9,3,3,11;ConvOclBwdWrW2<1>:3,7,3,3,7;ConvOclBwdWrW2<8>:3,7,1,1,7;ConvOclBwdWrW2<2>:3,7,3,3,7
256-13-13-1x1-64-13-13-64-0x0-1x1-1x1-0-NCHW-FP32-B=ConvAsm1x1U:2,16,2,32,1,2,2,2;ConvOclDirectFwd1x1:1,256,1,1,0,1,8,4,0
288-56-56-1x1-192-56-56-1-0x0-1x1-1x1-0-NCHW-FP16-F=ConvAsm1x1U:1,8,2,64,1,4,4,2;ConvOclDirectFwd1x1:1,64,1,1,0,2,8,4,0
1280-7-7-1x1-128-7-7-32-0x0-1x1-1x1-0-NCHW-FP32-F=ConvAsm1x1U:4,8,4,16,1,2,4,1;ConvOclDirectFwd1x1:1,64,1,1,1,4,16,256,0
16-54-54-1x1-128-54-54-16-0x0-1x1-1x1-0-NCHW-FP16-W=ConvAsmBwdWrW1x1:4,4,2,1,4,1,2,4,0,2
96-112-112-7x7-3-224-224-2-3x3-2x2-1x1-0-NCHW-FP16-W=ConvOclBwdWrW2<1>:3,7,1,3,9;ConvOclBwdWrW2<2>:8,7,1,3,9
128-14-14-5x5-32-14-14-4-2x2-1x1-1x1-0-NCHW-FP16-B=ConvOclDirectFwd:16,16,16,16,1,1,1,4,1
192-14-14-1x1-1536-14-14-8-0x0-1x1-1x1-0-NCHW-FP16-W=ConvAsmBwdWrW1x1:2,8,4,8,2,1,2,4,0,1
528-64-128-1x1-128-64-128-1-0x0-1x1-1x1-0-NCHW-FP32-F=ConvOclDirectFwd1x1:1,64,1,1,1,0,16,2048,0
128-14-14-1x1-416-14-14-128-0x0-1x1-1x1-0-NCHW-FP32-W=ConvAsmBwdWrW1x1:1,16,2,4,8,1,4,4,0,3
1488-7-7-1x1-192-7-7-32-0x0-1x1-1x1-0-NCHW-FP16-F=ConvAsm1x1U:2,8,4,16,1,4,4,1;ConvOclDirectFwd1x1:1,64,1,1,0,1,8,4,0
32-64-128-1x1-512-64-128-1-0x0-1x1-1x1-0-NCHW-FP16-B=ConvOclDirectFwd1x1:1,128,1,1,0,4,16,4,0
64-56-56-1x1-256-56-56-128-0x0-1x1-1x1-0-NCHW-FP32-F=ConvAsm1x1U:1,16,1,64,4,2,1,2;ConvActivAsm1x1U:1,16,1,64,3,2;ConvOclDirectFwd1x1:1,64,1,1,1,1,32,2048,0
512-29-29-1x1-256-29-29-128-0x0-1x1-1x1-0-NCHW-FP32-B=ConvAsm1x1U:1,32,1,32,2,1,1,1;ConvOclDirectFwd1x1:1,256,1,1,0,1,32,4,0
96-35-35-3x3-96-35-35-1-1x1-1x1-1x1-0-NCHW-FP32-W=ConvAsmBwdWrW3x3:0,0,8,2,3,1
224-14-14-3x3-112-14-14-16-1x1-1x1-1x1-0-NCHW-FP16-B=ConvOclDirectFwd:16,8,16,16,1,2,4,2,2
192-27-27-3x3-48-27-27-16-1x1-1x1-1x1-0-NCHW-FP32-W=ConvAsmBwdWrW3x3:0,0,8,2,3,8
192-7-7-1x1-1632-7-7-4-0x0-1x1-1x1-0-NCHW-FP32-B=ConvAsm1x1U:1,16,1,32,1,1,4,1;ConvOclDirectFwd1x1:1,128,1,1,0,1,4,4,0
256-14-14-1x1-128-28-28-256-0x0-2x2-1x1-0-NCHW-FP16-B=ConvAsm1x1U:1,16,2,64,1,2,1,8;ConvOclDirectFwd1x1:8,64,16,16,0,2,16,4,1
576-28-28-1x1-192-28-28-2-0x0-1x1-1x1-0-NCHW-FP16-F=ConvAsm1x1U:3,8,6,32,1,4,4,2;ConvOclDirectFwd1x1:1,64,1,1,0,2,4,4,0
128-14-14-1x1-1632-14-14-64-0x0-1x1-1x1-0-NCHW-FP32-W=ConvAsmBwdWrW1x1:1,16,4,8,4,1,2,4,0,2
320-8-8-1x1-1280-8-8-16-0x0-1x1-1x1-0-NCHW-FP32-B=ConvAsm1x1U:2,16,2,32,1,2,2,2;ConvOclDirectFwd1x1:1,64,1,1,0,2,8,8,0
480-14-14-1x1-120-14-14-64-0x0-1x1-1x1-0-NCHW-FP16-B_g3=ConvOclDirectFwd:16,16,16,16,1,1,8,2,1
1824-14-14-1x1-192-14-14-32-0x0-1x1-1x1-0-NCHW-FP32-F=ConvAsm1x1U:2,16,3,16,2,2,2,1;ConvOclDirectFwd1x1:1,64,1,1,1,0,16,2048,0
256-13-13-1x1-48-13-13-4-0x0-1x1-1x1-0-NCHW-FP16-F=ConvAsm1x1U:1,8,2,64,1,4,4,1;ConvOclDirectFwd1x1:1,64,1,1,0,1,4,8,0
192-14-14-1x1-1104-14-14-8-0x0-1x1-1x1-0-NCHW-FP32-B=ConvAsm1x1U:1,16,1,32,2,2,2,2;ConvOclDirectFwd1x1:1,64,1,1,0,4,16,4,0
320-8-8-1x1-2048-8-8-512-0x0-1x1-1x1-0-NCHW-FP16-W=ConvAsmBwdWrW1x1:2,8,4,8,2,1,1,4,0,0
128-14-14-3x3-128-28-28-128-1x1-2x2-1x1-0-NCHW-FP32-B=ConvOclDirectFwd:8,16,32,32,4,2,4,4,2
512-15-15-3x3-512-15-15-128-1x1-1x1-1x1-0-NCHW-FP16-W_g32=ConvOclBwdWrW2<4>:1,6,8,1,9;ConvOclBwdWrW2<16>:1,6,8,1,9;ConvOclBwdWrW2<2>:1,6,8,1,9;ConvOclBwdWrW2<1>:1,6,8,1,9;ConvAsmBwdWrW3x3:0,0,8,4,5,4;ConvOclBwdWrW2<8>:1,6,8,1,9
256-14-14-1x1-528-14-14-16-0x0-1x1-1x1-0-NCHW-FP32-W=ConvAsmBwdWrW1x1:1,16,4,4,4,1,1,4,0,1
192-14-14-1x1-864-14-14-32-0x0-1x1-1x1-0-NCHW-FP32-B=ConvAsm1x1U:1,32,1,16,2,1,2,1;ConvOclDirectFwd1x1:1,128,1,1,0,4,16,4,0
16-54-54-3x3-64-54-54-8-1x1-1x1-1x1-0-NCHW-FP16-F=ConvOclDirectFwd:16,16,32,32,2,2,8,4,2
192-14-14-1x1-384-14-14-128-0x0-1x1-1x1-0-NCHW-FP16-W=ConvAsmBwdWrW1x1:2,8,8,8,2,2,2,4,0,1
128-14-14-1x1-896-14-14-2-0x0-1x1-1x1-0-NCHW-FP16-W=ConvAsmBwdWrW1x1:1,16,2,8,2,1,2,4,0,0
60-28-28-1x1-240-28-28-4-0x0-1x1-1x1-0-NCHW-FP32-F_g3=ConvOclDirectFwd:16,16,16,16,1,1,8,4,2
192-7-7-1x1-1056-7-7-4-0x0-1x1-1x1-0-NCHW-FP32-B=ConvAsm1x1U:1,16,1,16,1,2,4,1;ConvOclDirectFwd1x1:1,64,1,1,0,1,4,8,0
128-7-7-1x1-1696-7-7-2-0x0-1x1-1x1-0-NCHW-FP32-B=ConvAsm1x1U:1,8,1,64,1,2,4,2;ConvOclDirectFwd1x1:1,64,1,1,0,1,4,4,0
256-27-27-1x1-64-27-27-8-0x0-1x1-1x1-0-NCHW-FP16-W=ConvAsmBwdWrW1x1:4,4,2,4,2,1,1,4,0,1
1968-7-7-1x1-192-7-7-8-0x0-1x1-1x1-0-NCHW-FP16-F=ConvAsm1x1U:1,8,2,16,1,4,4,2;ConvOclDirectFwd1x1:1,64,1,1,0,1,4,8,0
128-14-14-1x1-256-14-14-1-0x0-1x1-1x1-0-NCHW-FP32-W=ConvAsmBwdWrW1x1:4,4,2,2,4,1,1,4,0,1
192-14-14-1x1-1488-14-14-1024-0x0-1x1-1x1-0-NCHW-FP16-W=ConvAsmBwdWrW1x1:1,16,8,4,4,1,1,4,0,1
128-28-28-1x1-288-28-28-16-0x0-1x1-1x1-0-NCHW-FP32-F=ConvAsm1x1U:1,8,1,16,2,4,1,4;ConvOclDirectFwd1x1:1,64,1,1,1,1,16,256,0
192-56-56-1x1-288-56-56-32-0x0-1x1-1x1-0-NCHW-FP16-B=ConvAsm1x1U:1,16,2,32,1,2,1,2;ConvOclDirectFwd1x1:1,256,1,1,0,4,16,4,0
512-7-7-1x1-512-7-7-8-0x0-1x1-1x1-0-NCHW-FP16-W=ConvAsmBwdWrW1x1:2,8,4,4,4,2,1,2,0,0
480-14-14-1x1-128-14-14-512-0x0-1x1-1x1-0-NCHW-FP32-F=ConvAsm1x1U:2,16,4,64,1,2,2,2;ConvOclDirectFwd1x1:1,64,1,1,1,0,16,2048,0
96-56-56-1x1-128-56-56-2-0x0-1x1-1x1-0-NCHW-FP32-F=ConvAsm1x1U:1,8,1,64,2,4,2,2;ConvOclDirectFwd1x1:1,64,1,1,1,0,16,256,0
128-56-56-1x1-160-56-56-1-0x0-1x1-1x1-0-NCHW-FP16-W=ConvAsmBwdWrW1x1:2,8,2,1,8,1,1,4,0,2
384-14-14-1x1-128-14-14-512-0x0-1x1-1x1-0-NCHW-FP32-F=ConvAsm1x1U:4,16,4,64,1,2,1,1;ConvOclDirectFwd1x1:1,64,1,1,1,4,16,2048,0
128-7-7-1x1-864-7-7-1024-0x0-1x1-1x1-0-NCHW-FP16-W=ConvAsmBwdWrW1x1:2,8,8,8,2,2,2,2,0,2
192-7-7-1x1-2016-7-7-128-0x0-1x1-1x1-0-NCHW-FP16-W=ConvAsmBwdWrW1x1:1,16,4,8,2,1,1,2,0,2
128-14-14-1x1-1280-14-14-512-0x0-1x1-1x1-0-NCHW-FP16-B=ConvAsm1x1U:1,16,2,16,1,2,1,8;ConvOclDirectFwd1x1:1,64,1,1,0,4,16,4,0
128-14-14-1x1-672-14-14-64-0x0-1x1-1x1-0-NCHW-FP32-W=ConvAsmBwdWrW1x1:1,16,2,8,4,1,2,4,0,2
192-7-7-1x1-2160-7-7-64-0x0-1x1-1x1-0-NCHW-FP16-B=ConvAsm1x1U:2,16,4,16,1,2,1,1;ConvOclDirectFwd1x1:1,128,1,1,0,1,4,4,0
2064-7-7-1x1-192-7-7-4-0x0-1x1-1x1-0-NCHW-FP32-F=ConvAsm1x1U:1,8,1,64,1,4,4,2;ConvOclDirectFwd1x1:1,64,1,1,1,1,16,128,0
128-17-17-1x1-768-17-17-16-0x0-1x1-1x1-0-NCHW-FP32-B=ConvAsm1x1U:1,16,1,64,2,2,2,2;ConvOclDirectFwd1x1:1,64,1,1,0,1,16,8,0
48-14-14-5x5-512-14-14-128-2x2-1x1-1x1-0-NCHW-FP32-W=ConvOclBwdWrW2<4>:1,7,1,8,7;ConvOclBwdWrW2<1>:1,7,1,8,7;ConvOclBwdWrW2<16>:1,6,1,3,7;ConvOclBwdWrW2<8>:1,9,1,8,7;ConvOclBwdWrW2<2>:1,7,1,8,7
64-112-112-1x1-64-112-112-2-0x0-1x1-1x1-0-NCHW-FP16-W=ConvAsmBwdWrW1x1:4,4,2,1,8,1,2,4,0,2
448-8-8-1x1-2048-8-8-1-0x0-1x1-1x1-0-NCHW-FP32-B=ConvAsm1x1U:1,8,1,64,1,4,4,2;ConvOclDirectFwd1x1:1,256,1,1,0,1,4,4,0
64-112-112-1x1-64-112-112-256-0x0-1x1-1x1-0-NCHW-FP32-B=ConvAsm1x1U:1,32,1,32,1,1,1,2;ConvOclDirectFwd1x1:1,64,1,1,0,2,32,4,0
3-10-10-3x3-5-10-10-256-1x1-1x1-1x1-0-NCHW-FP16-F=ConvOclDirectFwd:8,8,16,16,2,2,2,2,2
192-56-56-1x1-192-56-56-128-0x0-1x1-1x1-0-NCHW-FP32-W=ConvAsmBwdWrW1x1:4,4,4,4,8,1,2,4,0,1
512-15-15-3x3-512-15-15-8-1x1-1x1-1x1-0-NCHW-FP16-W_g32=ConvOclBwdWrW2<1>:1,6,8,1,9;ConvOclBwdWrW2<4>:1,6,8,1,9;ConvAsmBwdWrW3x3:0,0,8,2,1,2;ConvOclBwdWrW2<8>:1,6,8,1,9;ConvOclBwdWrW2<2>:1,6,8,1,9
256-28-28-1x1-512-28-28-6-0x0-1x1-1x1-0-NCHW-FP32-W=ConvAsmBwdWrW1x1:2,8,4,2,8,1,1,4,0,1
96-35-35-3x3-64-35-35-64-1x1-1x1-1x1-0-NCHW-FP32-W=ConvAsmBwdWrW3x3:0,1,8,4,3,4
192-7-7-1x1-1776-7-7-128-0x0-1x1-1x1-0-NCHW-FP32-W=ConvAsmBwdWrW1x1:1,16,2,8,4,1,2,4,0,2
448-8-8-1x1-1280-8-8-512-0x0-1x1-1x1-0-NCHW-FP32-W=ConvAsmBwdWrW1x1:2,8,4,8,4,1,2,4,0,2
160-14-14-1x1-512-14-14-1-0x0-1x1-1x1-0-NCHW-FP16-W=ConvAsmBwdWrW1x1:2,8,4,2,2,1,1,4,0,0
256-27-27-3x3-64-27-27-512-1x1-1x1-1x1-0-NCHW-FP16-F=ConvOclDirectFwd:16,16,32,32,2,2,8,4,2
224-28-28-1x1-128-28-28-512-0x0-1x1-1x1-0-NCHW-FP32-B=ConvAsm1x1U:1,32,1,32,2,1,1,1;ConvOclDirectFwd1x1:1,256,1,1,0,4,16,4,0
192-56-56-1x1-288-56-56-256-0x0-1x1-1x1-0-NCHW-FP16-B=ConvAsm1x1U:1,16,2,64,1,2,1,2;ConvOclDirectFwd1x1:1,128,1,1,0,4,16,4,0
128-28-28-1x1-64-56-56-64-0x0-2x2-1x1-0-NCHW-FP32-W=ConvAsmBwdWrW1x1:4,4,4,4,4,1,4,4,0,1
2112-14-14-1x1-1056-14-14-32-0x0-1x1-1x1-0-NCHW-FP32-F=ConvAsm1x1U:3,8,7,32,1,4,1,8;ConvOclDirectFwd1x1:1,64,1,1,1,4,16,2048,0
256-15-15-1x1-1024-15-15-16-0x0-1x1-1x1-0-NCHW-FP32-W=ConvAsmBwdWrW1x1:1,16,2,4,8,1,1,4,0,2
128-7-7-5x5-32-7-7-32-2x2-1x1-1x1-0-NCHW-FP32-B=ConvOclDirectFwd:8,8,8,8,1,1,2,4,2
416-14-14-1x1-128-14-14-64-0x0-1x1-1x1-0-NCHW-FP32-F=ConvAsm1x1U:4,8,7,32,1,2,2,2;ConvOclDirectFwd1x1:1,64,1,1,1,1,16,2048,0
896-14-14-1x1-1792-14-14-4-0x0-1x1-1x1-0-NCHW-FP16-W=ConvAsmBwdWrW1x1:1,16,2,8,4,1,1,4,0,1
128-56-56-1x1-192-56-56-16-0x0-1x1-1x1-0-NCHW-FP32-B=ConvAsm1x1U:1,16,1,64,1,2,1,4;ConvOclDirectFwd1x1:1,64,1,1,0,4,16,4,0
160-64-128-1x1-528-64-128-1-0x0-1x1-1x1-0-NCHW-FP16-B=ConvOclDirectFwd1x1:1,128,1,1,0,4,16,4,0
192-28-28-1x1-720-28-28-512-0x0-1x1-1x1-0-NCHW-FP16-W=ConvAsmBwdWrW1x1:2,8,4,8,2,1,4,4,0,1
512-14-14-1x1-128-14-14-128-0x0-1x1-1x1-0-NCHW-FP32-B=ConvAsm1x1U:1,32,1,32,2,1,2,2;ConvOclDirectFwd1x1:1,128,1,1,0,2,16,4,0
544-14-14-1x1-128-14-14-256-0x0-1x1-1x1-0-NCHW-FP32-W=ConvAsmBwdWrW1x1:2,8,4,4,8,1,2,4,0,1
544-14-14-1x1-128-14-14-16-0x0-1x1-1x1-0-NCHW-FP32-W=ConvAsmBwdWrW1x1:2,8,2,4,2,1,1,4,0,0
336-28-28-1x1-192-28-28-16-0x0-1x1-1x1-0-NCHW-FP32-F=ConvAsm1x1U:3,16,5,32,1,2,1,1;ConvActivAsm1x1U:4,16,5,32,1,1;ConvOclDirectFwd1x1:1,64,1,1,1,0,16,2048,0
640-14-14-1x1-1280-14-14-8-0x0-1x1-1x1-0-NCHW-FP16-B=ConvAsm1x1U:1,16,2,16,1,2,2,2;ConvOclDirectFwd1x1:1,64,1,1,0,4,8,4,0
480-7-7-1x1-120-7-7-128-0x0-1x1-1x1-0-NCHW-FP32-B_g3=ConvOclDirectFwd:8,8,8,8,1,1,8,4,2
384-35-35-1x1-96-35-35-64-0x0-1x1-1x1-0-NCHW-FP16-F=ConvAsm1x1U:3,16,6,16,1,2,2,1;ConvOclDirectFwd1x1:1,64,1,1,0,1,16,4,0
1248-14-14-1x1-128-14-14-1-0x0-1x1-1x1-0-NCHW-FP32-F=ConvAsm1x1U:1,8,1,64,1,4,4,1;ConvOclDirectFwd1x1:1,64,1,1,1,1,16,128,0
256-28-28-3x3-256-28-28-8-1x1-1x1-1x1-0-NCHW-FP32-B_g32=ConvOclDirectFwd:8,32,32,32,4,1,4,1,2
64-35-35-3x3-96-35-35-32-1x1-1x1-1x1-0-NCHW-FP16-F=ConvOclDirectFwd:16,8,16,16,1,2,8,4,2;ConvOclDirectFwdFused:8,8,16,16,2,2,8,2,2
256-27-27-1x1-48-27-27-32-0x0-1x1-1x1-0-NCHW-FP16-B=ConvAsm1x1U:3,8,6,64,1,4,2,2;ConvOclDirectFwd1x1:1,64,1,1,0,1,8,4,0
192-28-28-3x3-48-28-28-4-1x1-1x1-1x1-0-NCHW-FP16-F=ConvOclDirectFwd:16,16,16,32,1,2,2,4,2
64-57-57-1x1-128-57-57-128-0x0-1x1-1x1-0-NCHW-FP32-F=ConvAsm1x1U:3,16,3,64,1,2,1,2;ConvOclDirectFwd1x1:1,64,1,1,1,1,32,256,0
256-17-17-1x1-1024-17-17-128-0x0-1x1-1x1-0-NCHW-FP16-B=ConvAsm1x1U:2,16,4,16,1,2,1,4;ConvOclDirectFwd1x1:1,128,1,1,0,1,16,4,0
192-14-14-1x1-1344-14-14-32-0x0-1x1-1x1-0-NCHW-FP32-B=ConvAsm1x1U:1,32,1,16,2,1,1,1;ConvOclDirectFwd1x1:8,64,16,16,0,2,16,4,1
64-111-111-3x3-3-224-224-512-0x0-2x2-1x1-0-NCHW-FP16-B=ConvOclDirectFwd:16,16,32,32,2,2,8,2,1
2048-7-7-1x1-1024-7-7-32-0x0-1x1-1x1-0-NCHW-FP32-F=ConvAsm1x1U:4,16,4,16,1,2,1,1;ConvOclDirectFwd1x1:1,64,1,1,1,0,32,2048,0
64-56-56-3x3-64-56-56-128-1x1-1x1-1x1-0-NCHW-FP16-F=ConvOclDirectFwd:16,16,32,32,2,2,8,2,1;ConvOclDirectFwdFused:32,8,32,32,1,4,8,1,1
64-28-28-3x3-64-56-56-32-1x1-2x2-1x1-0-NCHW-FP16-B=ConvOclDirectFwd:16,8,32,32,2,4,4,4,1
256-17-17-1x1-1024-17-17-128-0x0-1x1-1x1-0-NCHW-FP32-B=ConvAsm1x1U:1,16,1,32,4,2,1,4;ConvOclDirectFwd1x1:1,64,1,1,0,1,32,4,0
544-7-7-1x1-128-7-7-2-0x0-1x1-1x1-0-NCHW-FP32-F=ConvAsm1x1U:1,8,1,64,1,4,4,1;ConvOclDirectFwd1x1:1,64,1,1,1,1,16,64,0
192-14-14-1x1-2064-14-14-4-0x0-1x1-1x1-0-NCHW-FP32-B=ConvAsm1x1U:1,16,1,32,2,2,2,2;ConvOclDirectFwd1x1:1,64,1,1,0,4,16,4,0
32-14-14-5x5-64-14-14-128-2x2-1x1-1x1-0-NCHW-FP32-F=ConvOclDirectFwd:8,8,16,16,1,1,8,1,2;ConvOclDirectFwdFused:8,8,16,16,2,2,4,2,2
48-35-35-1x1-288-35-35-4-0x0-1x1-1x1-0-NCHW-FP32-W=ConvAsmBwdWrW1x1:2,8,2,8,2,1,4,2,0,1
240-7-7-1x1-960-7-7-2-0x0-1x1-1x1-0-NCHW-FP32-B_g3=ConvOclDirectFwd:8,8,8,8,1,1,4,4,2
832-14-14-1x1-128-14-14-512-0x0-1x1-1x1-0-NCHW-FP32-B=ConvAsm1x1U:1,32,1,16,2,1,2,2;ConvOclDirectFwd1x1:1,256,1,1,0,4,16,4,0
256-57-57-1x1-256-57-57-48-0x0-1x1-1x1-0-NCHW-FP32-F=ConvAsm1x1U:3,16,3,32,2,2,1,4;ConvOclDirectFwd1x1:1,64,1,1,1,4,16,2048,0
416-14-14-1x1-128-14-14-32-0x0-1x1-1x1-0-NCHW-FP32-F=ConvAsm1x1U:4,8,7,32,1,2,2,2;ConvOclDirectFwd1x1:1,64,1,1,1,0,16,2048,0
192-7-7-1x1-2160-7-7-4-0x0-1x1-1x1-0-NCHW-FP16-B=ConvAsm1x1U:2,8,4,16,1,2,4,1;ConvOclDirectFwd1x1:1,128,1,1,0,1,8,4,0
128-112-112-3x3-128-112-112-64-1x1-1x1-1x1-0-NCHW-FP32-W=ConvAsmBwdWrW3x3:0,0,16,4,2,1
96-28-28-5x5-32-28-28-16-2x2-1x1-1x1-0-NCHW-FP32-B=ConvOclDirectFwd:16,16,32,32,2,2,4,4,2
1440-14-14-1x1-128-14-14-1024-0x0-1x1-1x1-0-NCHW-FP16-F=ConvAsm1x1U:2,8,4,64,1,4,1,8;ConvOclDirectFwd1x1:8,64,16,16,0,2,16,4,1
1872-7-7-1x1-192-7-7-8-0x0-1x1-1x1-0-NCHW-FP32-F=ConvAsm1x1U:2,8,2,32,1,4,4,1;ConvOclDirectFwd1x1:1,64,1,1,1,4,16,256,0
128-28-28-3x3-128-14-14-512-1x1-2x2-1x1-0-NCHW-FP32-F=ConvOclDirectFwd:8,16,16,16,2,1,8,1,2
1440-7-7-1x1-192-7-7-64-0x0-1x1-1x1-0-NCHW-FP32-F=ConvAsm1x1U:2,8,2,32,2,4,2,2;ConvOclDirectFwd1x1:1,64,1,1,1,1,16,2048,0
60-14-14-1x1-240-14-14-1024-0x0-1x1-1x1-0-NCHW-FP16-F_g3=ConvOclDirectFwd:16,16,16,16,1,1,8,2,2
384-8-8-1x1-2048-8-8-2-0x0-1x1-1x1-0-NCHW-FP32-B=ConvAsm1x1U:2,8,2,32,1,4,2,1;ConvOclDirectFwd1x1:1,64,1,1,0,1,4,4,0
1296-7-7-1x1-192-7-7-512-0x0-1x1-1x1-0-NCHW-FP32-F=ConvAsm1x1U:3,16,4,16,1,2,1,1;ConvOclDirectFwd1x1:1,64,1,1,1,4,64,2048,0
896-14-14-1x1-128-14-14-32-0x0-1x1-1x1-0-NCHW-FP16-F=ConvAsm1x1U:2,8,4,64,1,4,2,4;ConvOclDirectFwd1x1:1,64,1,1,0,4,8,4,0
192-7-7-1x1-1392-7-7-64-0x0-1x1-1x1-0-NCHW-FP32-B=ConvAsm1x1U:2,16,2,32,1,2,1,2;ConvOclDirectFwd1x1:8,64,8,8,0,1,16,4,1
128-56-56-1x1-256-56-56-2-0x0-1x1-1x1-0-NCHW-FP32-B=ConvAsm1x1U:1,16,1,64,1,2,2,2;ConvOclDirectFwd1x1:1,64,1,1,0,2,16,4,0
128-14-14-1x1-416-14-14-512-0x0-1x1-1x1-0-NCHW-FP32-B=ConvAsm1x1U:1,32,1,32,2,1,1,1;ConvOclDirectFwd1x1:1,256,1,1,0,1,32,4,0
192-56-56-1x1-96-56-56-4-0x0-1x1-1x1-0-NCHW-FP16-B=ConvAsm1x1U:2,8,4,64,1,2,2,2;ConvOclDirectFwd1x1:1,64,1,1,0,4,16,4,0
192-7-7-1x1-1824-7-7-128-0x0-1x1-1x1-0-NCHW-FP32-W=ConvAsmBwdWrW1x1:1,16,2,8,4,1,2,4,0,2
960-7-7-1x1-240-7-7-1-0x0-1x1-1x1-0-NCHW-FP32-F_g3=ConvOclDirectFwd:8,8,8,8,1,1,1,4,1
64-27-27-1x1-256-27-27-32-0x0-1x1-1x1-0-NCHW-FP32-F=ConvAsm1x1U:2,16,2,64,2,2,1,1;ConvOclDirectFwd1x1:1,64,1,1,1,0,16,256,0
192-14-14-1x1-1008-14-14-1-0x0-1x1-1x1-0-NCHW-FP16-B=ConvAsm1x1U:1,8,2,64,1,4,4,4;ConvOclDirectFwd1x1:1,64,1,1,0,4,4,4,0
528-28-28-1x1-192-28-28-8-0x0-1x1-1x1-0-NCHW-FP32-F=ConvAsm1x1U:3,16,5,16,1,2,2,1;ConvOclDirectFwd1x1:1,64,1,1,1,0,16,2048,0
448-8-8-1x1-1280-8-8-256-0x0-1x1-1x1-0-NCHW-FP32-B=ConvAsm1x1U:1,16,1,64,2,2,1,4;ConvOclDirectFwd1x1:8,64,8,8,0,2,16,4,1
128-7-7-1x1-768-7-7-256-0x0-1x1-1x1-0-NCHW-FP16-B=ConvAsm1x1U:2,16,4,16,1,2,1,4;ConvOclDirectFwd1x1:1,128,1,1,0,1,8,4,0
1024-8-8-3x3-1024-8-8-2-1x1-1x1-1x1-0-NCHW-FP32-F_g32=ConvOclDirectFwd:8,8,8,8,1,1,4,4,2
128-7-7-1x1-1056-7-7-1-0x0-1x1-1x1-0-NCHW-FP16-B=ConvAsm1x1U:1,8,2,16,1,2,4,1;ConvOclDirectFwd1x1:1,64,1,1,0,1,4,4,0
352-28-28-1x1-128-28-28-2-0x0-1x1-1x1-0-NCHW-FP16-F=ConvAsm1x1U:1,8,2,32,1,4,4,1;ConvOclDirectFwd1x1:1,128,1,1,0,2,4,4,0
240-7-7-3x3-240-7-7-512-1x1-1x1-1x1-0-NCHW-FP32-W=ConvAsmBwdWrW3x3:0,1,8,2,7,4
128-28-28-1x1-512-28-28-256-0x0-1x1-1x1-0-NCHW-FP32-W=ConvAsmBwdWrW1x1:1,16,2,8,4,1,4,4,0,1
288-35-35-1x1-48-35-35-4-0x0-1x1-1x1-0-NCHW-FP16-F=ConvAsm1x1U:1,8,2,64,1,4,4,2;ConvOclDirectFwd1x1:1,64,1,1,0,1,4,8,0
128-14-14-1x1-768-14-14-8-0x0-1x1-1x1-0-NCHW-FP32-B=ConvAsm1x1U:1,16,1,16,1,2,1,4;ConvOclDirectFwd1x1:1,256,1,1,0,4,16,4,0
96-54-54-1x1-16-54-54-1-0x0-1x1-1x1-0-NCHW-FP32-F=ConvAsm1x1U:1,8,1,32,1,4,4,1;ConvOclDirectFwd1x1:1,64,1,1,1,0,16,2048,0
192-14-14-1x1-672-14-14-16-0x0-1x1-1x1-0-NCHW-FP16-W=ConvAsmBwdWrW1x1:2,8,4,8,2,1,1,4,0,1
512-14-14-3x3-512-14-14-6-1x1-1x1-1x1-0-NCHW-FP32-W_g32=ConvOclBwdWrW2<1>:1,7,8,1,7;ConvOclBwdWrW2<4>:1,7,8,1,7;ConvAsmBwdWrW3x3:0,0,16,2,4,1;ConvOclBwdWrW2<2>:1,7,8,1,7
128-14-14-1x1-1696-14-14-1024-0x0-1x1-1x1-0-NCHW-FP16-B=ConvAsm1x1U:1,16,2,16,1,2,1,2;ConvOclDirectFwd1x1:1,128,1,1,0,2,16,4,0
256-7-7-3x3-256-14-14-128-1x1-2x2-1x1-0-NCHW-FP16-W=ConvAsmBwdWrW3x3:0,0,8,4,8,1
192-27-27-5x5-64-27-27-4-2x2-1x1-1x1-0-NCHW-FP16-B=ConvOclDirectFwd:16,16,32,32,2,2,2,4,2
128-7-7-1x1-1696-7-7-512-0x0-1x1-1x1-0-NCHW-FP16-B=ConvAsm1x1U:2,16,4,16,1,2,1,2;ConvOclDirectFwd1x1:1,256,1,1,0,1,8,4,0
192-14-14-1x1-1008-14-14-8-0x0-1x1-1x1-0-NCHW-FP16-B=ConvAsm1x1U:2,8,4,32,1,4,1,8;ConvOclDirectFwd1x1:1,64,1,1,0,4,8,4,0
64-35-35-5x5-48-35-35-8-2x2-1x1-1x1-0-NCHW-FP32-B=ConvOclDirectFwd:16,8,16,16,1,2,8,2,2
128-28-28-1x1-224-28-28-1-0x0-1x1-1x1-0-NCHW-FP16-W=ConvAsmBwdWrW1x1:4,4,2,1,8,1,1,4,0,1
192-7-7-1x1-1296-7-7-512-0x0-1x1-1x1-0-NCHW-FP16-B=ConvAsm1x1U:2,16,4,16,1,2,1,4;ConvOclDirectFwd1x1:1,64,1,1,0,1,8,4,0
240-28-28-1x1-60-28-28-32-0x0-1x1-1x1-0-NCHW-FP32-F_g3=ConvOclDirectFwd:16,16,16,16,1,1,8,2,2
128-7-7-1x1-1152-7-7-512-0x0-1x1-1x1-0-NCHW-FP32-B=ConvAsm1x1U:1,16,1,64,2,2,1,2;ConvOclDirectFwd1x1:1,128,1,1,0,1,32,4,0
160-7-7-3x3-320-7-7-8-1x1-1x1-1x1-0-NCHW-FP16-F=ConvOclDirectFwd:8,8,8,8,1,1,2,2,2;ConvOclDirectFwdFused:8,8,8,8,1,1,2,2,2
576-14-14-1x1-64-14-14-32-0x0-1x1-1x1-0-NCHW-FP16-F=ConvAsm1x1U:1,8,2,16,1,4,4,4;ConvOclDirectFwd1x1:1,64,1,1,0,4,8,4,0
64-28-28-1x1-256-28-28-8-0x0-1x1-1x1-0-NCHW-FP16-B=ConvAsm1x1U:1,16,2,16,1,2,2,2;ConvOclDirectFwd1x1:1,64,1,1,0,4,16,4,0
384-28-28-1x1-768-28-28-2-0x0-1x1-1x1-0-NCHW-FP16-B=ConvAsm1x1U:1,16,2,32,1,2,2,2;ConvOclDirectFwd1x1:1,256,1,1,0,2,8,4,0
192-27-27-1x1-48-27-27-16-0x0-1x1-1x1-0-NCHW-FP32-W=ConvAsmBwdWrW1x1:2,8,2,8,2,1,4,4,0,1
384-8-8-1x1-1536-8-8-128-0x0-1x1-1x1-0-NCHW-FP32-B=ConvAsm1x1U:1,16,1,64,4,2,1,4;ConvOclDirectFwd1x1:1,64,1,1,0,4,16,4,0
96-112-112-7x7-3-224-224-32-3x3-2x2-1x1-0-NCHW-FP32-W=ConvOclBwdWrW2<4>:3,7,3,3,7;ConvOclBwdWrW2<1>:3,7,3,3,7;ConvOclBwdWrW2<16>:3,8,3,1,7;ConvOclBwdWrW2<8>:3,8,1,3,7;ConvOclBwdWrW2<2>:3,7,3,3,7
192-7-7-1x1-1152-7-7-512-0x0-1x1-1x1-0-NCHW-FP16-B=ConvAsm1x1U:1,16,2,16,1,2,1,4;ConvOclDirectFwd1x1:1,256,1,1,0,1,8,4,0
192-14-14-1x1-1392-14-14-1024-0x0-1x1-1x1-0-NCHW-FP16-B=ConvAsm1x1U:1,16,2,16,1,2,1,8;ConvOclDirectFwd1x1:1,256,1,1,0,2,16,4,0
160-14-14-1x1-608-14-14-64-0x0-1x1-1x1-0-NCHW-FP32-W=ConvAsmBwdWrW1x1:1,16,2,8,4,1,2,4,0,2
192-14-14-1x1-1632-14-14-32-0x0-1x1-1x1-0-NCHW-FP32-B=ConvAsm1x1U:1,32,1,16,2,1,1,2;ConvOclDirectFwd1x1:1,64,1,1,0,4,16,4,0
128-7-7-1x1-1504-7-7-128-0x0-1x1-1x1-0-NCHW-FP32-W=ConvAsmBwdWrW1x1:1,16,4,4,8,1,2,4,0,1
192-14-14-1x1-1440-14-14-8-0x0-1x1-1x1-0-NCHW-FP32-W=ConvAsmBwdWrW1x1:1,16,2,8,4,1,2,4,0,1
512-7-7-1x1-512-7-7-2-0x0-1x1-1x1-0-NCHW-FP32-W=ConvAsmBwdWrW1x1:1,16,2,2,8,1,1,4,0,0
128-56-56-1x1-96-56-56-256-0x0-1x1-1x1-0-NCHW-FP16-B=ConvAsm1x1U:1,16,2,32,1,2,1,2;ConvOclDirectFwd1x1:1,64,1,1,0,4,16,4,0
1568-7-7-1x1-128-7-7-4-0x0-1x1-1x1-0-NCHW-FP16-F=ConvAsm1x1U:1,8,2,16,1,4,4,1;ConvOclDirectFwd1x1:1,128,1,1,0,1,4,8,0
192-28-28-1x1-672-28-28-128-0x0-1x1-1x1-0-NCHW-FP16-B=ConvAsm1x1U:1,16,2,16,1,2,1,2;ConvOclDirectFwd1x1:1,256,1,1,0,4,16,4,0
128-28-28-3x3-128-56-56-256-1x1-2x2-1x1-0-NCHW-FP16-W=ConvAsmBwdWrW3x3:0,0,8,4,3,1
120-7-7-1x1-480-7-7-1-0x0-1x1-1x1-0-NCHW-FP32-F_g3=ConvOclDirectFwd:8,8,8,8,1,1,2,4,1
32-149-149-3x3-3-299-299-1-0x0-2x2-1x1-0-NCHW-FP32-B=ConvOclDirectFwd:16,8,16,32,1,4,2,4,1
64-112-112-7x7-3-224-224-8-3x3-2x2-1x1-0-NCHW-FP16-B=ConvOclDirectFwd:16,16,32,32,2,2,1,4,1
1696-7-7-1x1-128-7-7-2-0x0-1x1-1x1-0-NCHW-FP32-F=ConvAsm1x1U:1,8,1,16,1,4,4,1;ConvOclDirectFwd1x1:1,64,1,1,1,1,16,128,0
512-7-7-1x1-1024-14-14-512-0x0-2x2-1x1-0-NCHW-FP16-B=ConvAsm1x1U:2,16,4,16,1,2,2,1;ConvOclDirectFwd1x1:1,64,1,1,0,1,32,4,0
2048-14-14-1x1-512-14-14-64-0x0-1x1-1x1-0-NCHW-FP16-F=ConvAsm1x1U:1,8,2,64,4,4,1,8;ConvOclDirectFwd1x1:1,128,1,1,0,4,16,4,0
128-17-17-1x1-1024-17-17-4-0x0-1x1-1x1-0-NCHW-FP16-B=ConvAsm1x1U:1,16,2,16,1,2,2,2;ConvOclDirectFwd1x1:1,64,1,1,0,1,8,4,0
512-7-7-1x1-512-7-7-8-0x0-1x1-1x1-0-NCHW-FP16-F=ConvAsm1x1U:1,8,2,32,1,4,4,2;ConvOclDirectFwd1x1:1,64,1,1,0,1,4,8,0
1024-15-15-1x1-512-15-15-4-0x0-1x1-1x1-0-NCHW-FP32-F=ConvAsm1x1U:4,8,4,64,1,4,2,2;ConvOclDirectFwd1x1:1,64,1,1,1,4,32,256,0
192-7-7-1x1-1056-7-7-128-0x0-1x1-1x1-0-NCHW-FP32-B=ConvAsm1x1U:2,16,2,32,1,2,1,2;ConvOclDirectFwd1x1:1,128,1,1,0,1,16,4,0
128-7-7-1x1-1504-7-7-2-0x0-1x1-1x1-0-NCHW-FP32-W=ConvAsmBwdWrW1x1:1,16,2,4,4,1,1,4,0,1
128-14-14-1x1-672-14-14-1-0x0-1x1-1x1-0-NCHW-FP16-W=ConvAsmBwdWrW1x1:2,8,2,4,2,1,1,4,0,0
384-8-8-3x3-448-8-8-1-1x1-1x1-1x1-0-NCHW-FP16-B=ConvOclDirectFwd:8,8,8,8,1,1,1,4,1
128-14-14-1x1-928-14-14-4-0x0-1x1-1x1-0-NCHW-FP16-B=ConvAsm1x1U:2,8,4,32,1,4,2,2;ConvOclDirectFwd1x1:1,64,1,1,0,4,4,4,0
512-8-8-3x3-512-8-8-16-1x1-1x1-1x1-0-NCHW-FP32-W=ConvAsmBwdWrW3x3:0,0,8,4,4,1
128-14-14-1x1-1056-14-14-16-0x0-1x1-1x1-0-NCHW-FP32-W=ConvAsmBwdWrW1x1:1,16,2,4,8,1,1,4,0,1
128-7-7-1x1-1056-7-7-4-0x0-1x1-1x1-0-NCHW-FP16-W=ConvAsmBwdWrW1x1:2,8,2,8,2,1,1,4,0,1
48-56-56-3x3-192-56-56-32-1x1-1x1-1x1-0-NCHW-FP16-W=ConvAsmBwdWrW3x3:0,1,16,4,2,4
704-14-14-1x1-128-14-14-128-0x0-1x1-1x1-0-NCHW-FP16-W=ConvAsmBwdWrW1x1:2,8,4,8,2,1,2,4,0,1
960-14-14-1x1-128-14-14-128-0x0-1x1-1x1-0-NCHW-FP16-W=ConvAsmBwdWrW1x1:2,8,8,8,2,1,2,4,0,1
58-28-28-1x1-24-28-28-32-0x0-1x1-1x1-0-NCHW-FP16-W=ConvAsmBwdWrW1x1:4,4,2,1,4,2,4,4,0,2
352-7-7-1x1-1056-7-7-32-0x0-1x1-1x1-0-NCHW-FP32-B=ConvAsm1x1U:1,16,1,64,2,2,2,2;ConvOclDirectFwd1x1:8,64,8,8,0,1,16,4,1
96-28-28-5x5-32-28-28-8-2x2-1x1-1x1-0-NCHW-FP16-B=ConvOclDirectFwd:16,16,32,32,2,2,2,4,2
128-54-54-1x1-32-54-54-64-0x0-1x1-1x1-0-NCHW-FP16-W=ConvAsmBwdWrW1x1:4,4,2,1,8,2,2,4,0,3
512-13-13-1x1-64-13-13-32-0x0-1x1-1x1-0-NCHW-FP32-F=ConvAsm1x1U:3,16,3,32,1,2,4,1;ConvOclDirectFwd1x1:1,64,1,1,1,1,16,256,0
192-14-14-1x1-912-14-14-2-0x0-1x1-1x1-0-NCHW-FP16-B=ConvAsm1x1U:1,8,2,64,2,4,4,1;ConvOclDirectFwd1x1:1,64,1,1,0,1,4,4,0
768-17-17-1x1-192-17-17-2-0x0-1x1-1x1-0-NCHW-FP32-F=ConvAsm1x1U:2,8,2,32,1,4,4,1;ConvOclDirectFwd1x1:1,64,1,1,1,1,16,128,0
96-17-17-3x3-96-35-35-32-0x0-2x2-1x1-0-NCHW-FP16-B=ConvOclDirectFwd:8,8,16,16,2,2,4,1,1
256-56-56-1x1-64-56-56-8-0x0-1x1-1x1-0-NCHW-FP16-W=ConvAsmBwdWrW1x1:4,4,4,4,4,1,4,2,0,1
128-14-14-1x1-1600-14-14-1-0x0-1x1-1x1-0-NCHW-FP32-B=ConvAsm1x1U:1,8,1,64,1,2,2,1;ConvOclDirectFwd1x1:1,64,1,1,0,1,4,4,0
528-14-14-1x1-160-14-14-64-0x0-1x1-1x1-0-NCHW-FP16-F=ConvAsm1x1U:2,8,4,64,1,4,2,2;ConvOclDirectFwd1x1:1,64,1,1,0,4,16,4,0
96-73-73-3x3-64-147-147-64-0x0-2x2-1x1-0-NCHW-FP32-B=ConvOclDirectFwd:32,32,32,32,1,1,8,2,2
60-14-14-1x1-240-14-14-1-0x0-1x1-1x1-0-NCHW-FP16-F_g3=ConvOclDirectFwd:8,16,8,16,1,1,2,4,1
192-14-14-1x1-1056-14-14-128-0x0-1x1-1x1-0-NCHW-FP16-B=ConvAsm1x1U:1,16,2,16,1,2,1,2;ConvOclDirectFwd1x1:1,64,1,1,0,4,16,4,0
128-7-7-1x1-928-7-7-4-0x0-1x1-1x1-0-NCHW-FP32-B=ConvAsm1x1U:1,8,1,64,1,4,2,2;ConvOclDirectFwd1x1:1,256,1,1,0,1,4,8,0
1536-8-8-1x1-384-8-8-4-0x0-1x1-1x1-0-NCHW-FP16-F=ConvAsm1x1U:1,8,2,16,1,4,4,1;ConvOclDirectFwd1x1:1,64,1,1,0,1,4,8,0
256-7-7-1x1-832-7-7-2-0x0-1x1-1x1-0-NCHW-FP16-W=ConvAsmBwdWrW1x1:1,16,4,4,2,1,1,4,0,1
64-27-27-1x1-384-27-27-128-0x0-1x1-1x1-0-NCHW-FP16-B=ConvAsm1x1U:1,16,2,16,1,2,1,4;ConvOclDirectFwd1x1:1,64,1,1,0,1,16,4,0
192-7-7-1x1-2016-7-7-32-0x0-1x1-1x1-0-NCHW-FP32-W=ConvAsmBwdWrW1x1:1,16,2,8,4,1,2,4,0,2
384-28-28-1x1-192-28-28-128-0x0-1x1-1x1-0-NCHW-FP32-F=ConvAsm1x1U:3,16,5,32,1,2,2,2;ConvOclDirectFwd1x1:1,64,1,1,1,0,16,2048,0
54-28-28-1x1-216-28-28-4-0x0-1x1-1x1-0-NCHW-FP32-F_g3=ConvOclDirectFwd:16,16,16,16,1,1,8,4,2
160-17-17-7x1-160-17-17-8-3x0-1x1-1x1-0-NCHW-FP16-W=ConvOclBwdWrW2<4>:1,9,8,3,9;ConvOclBwdWrW2<1>:1,9,8,3,9;ConvOclBwdWrW2<8>:1,9,8,3,9;ConvOclBwdWrW2<2>:1,9,8,3,9
704-7-7-1x1-128-7-7-1-0x0-1x1-1x1-0-NCHW-FP32-F=ConvAsm1x1U:1,8,1,64,1,4,4,1;ConvOclDirectFwd1x1:1,64,1,1,1,0,16,64,0
128-7-7-1x1-1056-7-7-1-0x0-1x1-1x1-0-NCHW-FP32-B=ConvAsm1x1U:1,8,1,64,1,4,4,2;ConvOclDirectFwd1x1:1,64,1,1,0,1,4,8,0
128-57-57-1x1-64-57-57-4-0x0-1x1-1x1-0-NCHW-FP32-B=ConvAsm1x1U:1,16,1,64,1,2,2,2;ConvOclDirectFwd1x1:1,128,1,1,0,1,8,8,0
