src/kernels/gfx906_64.OpenCL.fdb.txt
64-112-112-7x7-3-224-224-32-3x3-2x2-1x1-0-NCHW-FP32-W=miopenConvolutionBwdWeightsAlgoDirect:ConvOclBwdWrW2<1>,2,31933,1204224,miopenConvolutionBwdWeightsAlgoDirect;miopenConvolutionBwdWeightsAlgoGEMM:gemm,6,2447,7375872,MIOpenGEMM
128-56-56-1x1-64-56-56-32-0x0-1x1-1x1-0-NCHW-FP32-B=miopenConvolutionBwdDataAlgoWinograd:ConvBinWinogradRxSf3x2,0,411457,0,miopenConvolutionBwdDataAlgoWinograd
2048-7-7-1x1-1024-7-7-32-0x0-1x1-1x1-0-NCHW-FP32-B=miopenConvolutionBwdDataAlgoDirect:ConvAsm1x1U,0,967418,0,miopenConvolutionBwdDataAlgoDirect;miopenConvolutionBwdDataAlgoImplicitGEMM:ConvHipImplicitGemmBwdDataV1R1,1,25322,0,miopenConvolutionBwdDataAlgoImplicitGEMM;miopenConvolutionBwdDataAlgoWinograd:ConvBinWinogradRxSf3x2,2,21871,0,miopenConvolutionBwdDataAlgoWinograd;miopenConvolutionBwdDataAlgoGEMM:gemm,4,2293,0,MIOpenGEMM
1024-14-14-3x3-1024-14-14-32-1x1-1x1-1x1-0-NCHW-FP32-W_g64=miopenConvolutionBwdWeightsAlgoDirect:ConvAsmBwdWrW3x3,0,401128,0,miopenConvolutionBwdWeightsAlgoDirect;miopenConvolutionBwdWeightsAlgoWinograd:ConvBinWinogradRxSf2x3,1,37242,0,miopenConvolutionBwdWeightsAlgoWinograd;miopenConvolutionBwdWeightsAlgoGEMM:gemm,21,2457,7225344,MIOpenGEMM
3-224-224-7x7-64-112-112-32-3x3-2x2-1x1-0-NCHW-FP32-F=miopenConvolutionFwdAlgoDirect:ConvAsm7x7c3h224w224k64u2v2p3q3f1,0,73083,0,miopenConvolutionFwdAlgoDirect;miopenConvolutionFwdAlgoWinograd:ConvBinWinogradRxS,1,6212,0,miopenConvolutionFwdAlgoWinograd;miopenConvolutionFwdAlgoGEMM:GemmFwdRest,1,84397,7375872,MIOpenGEMM
1024-14-14-3x3-1024-14-14-32-1x1-1x1-1x1-0-NCHW-FP32-B_g64=miopenConvolutionBwdDataAlgoWinograd:ConvBinWinogradRxSf2x3,0,34886,0,miopenConvolutionBwdDataAlgoWinograd;miopenConvolutionBwdDataAlgoDirect:ConvOclDirectFwd,0,555307,0,miopenConvolutionBwdDataAlgoDirect;miopenConvolutionBwdDataAlgoGEMM:gemm,12,6481,7225344,MIOpenGEMM
1024-7-7-1x1-2048-7-7-32-0x0-1x1-1x1-0-NCHW-FP32-W=miopenConvolutionBwdWeightsAlgoDirect:ConvAsmBwdWrW1x1,1,979,0,miopenConvolutionBwdWeightsAlgoDirect;miopenConvolutionBwdWeightsAlgoGEMM:gemm,1,71778,0,MIOpenGEMM;miopenConvolutionBwdWeightsAlgoWinograd:ConvBinWinogradRxSf2x3,3,14276,0,miopenConvolutionBwdWeightsAlgoWinograd
512-28-28-1x1-256-28-28-32-0x0-1x1-1x1-0-NCHW-FP32-F=miopenConvolutionFwdAlgoDirect:ConvAsm1x1U,0,883351,0,miopenConvolutionFwdAlgoDirect;miopenConvolutionFwdAlgoWinograd:ConvBinWinogradRxSf3x2,1,4627,0,miopenConvolutionFwdAlgoWinograd;miopenConvolutionFwdAlgoGEMM:GemmFwd1x1_0_1,1,5492,0,MIOpenGEMM
256-56-56-1x1-256-56-56-32-0x0-1x1-1x1-0-NCHW-FP32-F=miopenConvolutionFwdAlgoImplicitGEMM:ConvHipImplicitGemmV4R4Fwd,1,27361,0,miopenConvolutionFwdAlgoImplicitGEMM;miopenConvolutionFwdAlgoDirect:ConvAsm1x1U,2,5184,0,miopenConvolutionFwdAlgoDirect;miopenConvolutionFwdAlgoGEMM:GemmFwd1x1_0_1,2,848,0,MIOpenGEMM;miopenConvolutionFwdAlgoWinograd:ConvBinWinogradRxSf3x2,2,75733,0,miopenConvolutionFwdAlgoWinograd
512-28-28-1x1-256-56-56-32-0x0-2x2-1x1-0-NCHW-FP32-W=miopenConvolutionBwdWeightsAlgoDirect:ConvOclBwdWrW1x1,1,26136,25690112,miopenConvolutionBwdWeightsAlgoDirect;miopenConvolutionBwdWeightsAlgoImplicitGEMM:ConvHipImplicitGemmV4R1WrW,3,60179,0,miopenConvolutionBwdWeightsAlgoImplicitGEMM;miopenConvolutionBwdWeightsAlgoGEMM:gemm,4,11533,802816,MIOpenGEMM
1024-14-14-3x3-1024-14-14-32-1x1-1x1-1x1-0-NCHW-FP32-F_g64=miopenConvolutionFwdAlgoWinograd:ConvBinWinogradRxSf2x3,0,304913,0,miopenConvolutionFwdAlgoWinograd;miopenConvolutionFwdAlgoDirect:ConvOclDirectFwd,0,535031,0,miopenConvolutionFwdAlgoDirect;miopenConvolutionFwdAlgoImplicitGEMM:ConvHipImplicitGemmV4R1Fwd,0,675122,0,miopenConvolutionFwdAlgoImplicitGEMM;miopenConvolutionFwdAlgoGEMM:GemmFwdRest,23,8527,7225344,MIOpenGEMM
1024-7-7-1x1-2048-7-7-32-0x0-1x1-1x1-0-NCHW-FP32-B=miopenConvolutionBwdDataAlgoDirect:ConvAsm1x1U,0,920219,0,miopenConvolutionBwdDataAlgoDirect;miopenConvolutionBwdDataAlgoImplicitGEMM:ConvHipImplicitGemmBwdDataV1R1,1,5055,0,miopenConvolutionBwdDataAlgoImplicitGEMM;miopenConvolutionBwdDataAlgoWinograd:ConvBinWinogradRxSf3x2,2,11768,0,miopenConvolutionBwdDataAlgoWinograd;miopenConvolutionBwdDataAlgoGEMM:gemm,2,89583,0,MIOpenGEMM
64-56-56-1x1-128-56-56-32-0x0-1x1-1x1-0-NCHW-FP32-F=miopenConvolutionFwdAlgoDirect:ConvOclDirectFwd1x1,0,347466,0,miopenConvolutionFwdAlgoDirect
1024-14-14-1x1-512-28-28-32-0x0-2x2-1x1-0-NCHW-FP32-W=miopenConvolutionBwdWeightsAlgoImplicitGEMM:ConvHipImplicitGemmV4R1WrW,0,951911,0,miopenConvolutionBwdWeightsAlgoImplicitGEMM;miopenConvolutionBwdWeightsAlgoDirect:ConvAsmBwdWrW1x1,1,14654,12845056,miopenConvolutionBwdWeightsAlgoDirect;miopenConvolutionBwdWeightsAlgoGEMM:gemm,2,5913,401408,MIOpenGEMM
512-28-28-1x1-256-56-56-32-0x0-2x2-1x1-0-NCHW-FP32-B=miopenConvolutionBwdDataAlgoDirect:ConvAsm1x1UV2,0,982386,0,miopenConvolutionBwdDataAlgoDirect;miopenConvolutionBwdDataAlgoGEMM:gemm,1,18804,77070336,MIOpenGEMM;miopenConvolutionBwdDataAlgoImplicitGEMM:ConvHipImplicitGemmBwdDataV4R1,1,54635,0,miopenConvolutionBwdDataAlgoImplicitGEMM;miopenConvolutionBwdDataAlgoWinograd:ConvBinWinogradRxSf2x3,5,62011,0,miopenConvolutionBwdDataAlgoWinograd
128-56-56-1x1-256-56-56-32-0x0-1x1-1x1-0-NCHW-FP32-W=miopenConvolutionBwdWeightsAlgoDirect:ConvAsmBwdWrW1x1,1,33913,0,miopenConvolutionBwdWeightsAlgoDirect
1024-7-7-1x1-2048-7-7-32-0x0-1x1-1x1-0-NCHW-FP32-F=miopenConvolutionFwdAlgoDirect:ConvAsm1x1U,1,54051,0,miopenConvolutionFwdAlgoDirect;miopenConvolutionFwdAlgoImplicitGEMM:ConvHipImplicitGemmV4R1Fwd,1,74127,0,miopenConvolutionFwdAlgoImplicitGEMM;miopenConvolutionFwdAlgoWinograd:ConvBinWinogradRxSf3x2,2,22332,0,miopenConvolutionFwdAlgoWinograd;miopenConvolutionFwdAlgoGEMM:GemmFwd1x1_0_1,3,19874,0,MIOpenGEMM
1024-14-14-1x1-1024-14-14-32-0x0-1x1-1x1-0-NCHW-FP32-W=miopenConvolutionBwdWeightsAlgoDirect:ConvAsmBwdWrW1x1,1,50364,0,miopenConvolutionBwdWeightsAlgoDirect;miopenConvolutionBwdWeightsAlgoGEMM:gemm,2,98003,0,MIOpenGEMM;miopenConvolutionBwdWeightsAlgoWinograd:ConvBinWinogradRxSf2x3,6,42235,0,miopenConvolutionBwdWeightsAlgoWinograd
256-56-56-1x1-256-56-56-32-0x0-1x1-1x1-0-NCHW-FP32-B=miopenConvolutionBwdDataAlgoDirect:ConvAsm1x1U,1,70507,0,miopenConvolutionBwdDataAlgoDirect;miopenConvolutionBwdDataAlgoGEMM:gemm,2,1038,0,MIOpenGEMM;miopenConvolutionBwdDataAlgoWinograd:ConvBinWinogradRxSf3x2,2,79042,0,miopenConvolutionBwdDataAlgoWinograd
512-28-28-1x1-512-28-28-32-0x0-1x1-1x1-0-NCHW-FP32-B=miopenConvolutionBwdDataAlgoDirect:ConvAsm1x1U,1,73359,0,miopenConvolutionBwdDataAlgoDirect;miopenConvolutionBwdDataAlgoGEMM:gemm,2,43383,0,MIOpenGEMM;miopenConvolutionBwdDataAlgoWinograd:ConvBinWinogradRxSf3x2,2,90817,0,miopenConvolutionBwdDataAlgoWinograd
256-56-56-3x3-256-56-56-32-1x1-1x1-1x1-0-NCHW-FP32-W_g32=miopenConvolutionBwdWeightsAlgoDirect:ConvAsmBwdWrW3x3,1,38563,0,miopenConvolutionBwdWeightsAlgoDirect;miopenConvolutionBwdWeightsAlgoWinograd:ConvBinWinogradRxSf2x3,4,88587,0,miopenConvolutionBwdWeightsAlgoWinograd;miopenConvolutionBwdWeightsAlgoGEMM:gemm,21,922,28901376,MIOpenGEMM
2048-7-7-1x1-2048-7-7-32-0x0-1x1-1x1-0-NCHW-FP32-B=miopenConvolutionBwdDataAlgoDirect:ConvAsm1x1U,1,48595,0,miopenConvolutionBwdDataAlgoDirect;miopenConvolutionBwdDataAlgoImplicitGEMM:ConvHipImplicitGemmBwdDataV1R1,1,53016,0,miopenConvolutionBwdDataAlgoImplicitGEMM;miopenConvolutionBwdDataAlgoWinograd:ConvBinWinogradRxSf3x2,3,95567,0,miopenConvolutionBwdDataAlgoWinograd;miopenConvolutionBwdDataAlgoGEMM:gemm,4,86071,0,MIOpenGEMM
1024-14-14-1x1-2048-7-7-32-0x0-2x2-1x1-0-NCHW-FP32-F=miopenConvolutionFwdAlgoGEMM:GemmFwd1x1_0_2,0,919836,19267584,MIOpenGEMM;miopenConvolutionFwdAlgoDirect:ConvAsm1x1U,1,26951,6422528,miopenConvolutionFwdAlgoDirect;miopenConvolutionFwdAlgoImplicitGEMM:ConvHipImplicitGemmV4R1Fwd,1,89942,0,miopenConvolutionFwdAlgoImplicitGEMM;miopenConvolutionFwdAlgoWinograd:ConvBinWinogradRxS,6,10066,0,miopenConvolutionFwdAlgoWinograd
256-56-56-1x1-64-56-56-32-0x0-1x1-1x1-0-NCHW-FP32-W=miopenConvolutionBwdWeightsAlgoDirect:ConvAsmBwdWrW1x1,0,689976,0,miopenConvolutionBwdWeightsAlgoDirect
1024-7-7-3x3-1024-7-7-32-1x1-1x1-1x1-0-NCHW-FP32-W_g32=miopenConvolutionBwdWeightsAlgoDirect:ConvAsmBwdWrW3x3,0,133091,0,miopenConvolutionBwdWeightsAlgoDirect;miopenConvolutionBwdWeightsAlgoWinograd:ConvBinWinogradRxSf2x3,0,533793,0,miopenConvolutionBwdWeightsAlgoWinograd;miopenConvolutionBwdWeightsAlgoGEMM:gemm,5,81548,1806336,MIOpenGEMM
256-56-56-1x1-512-28-28-32-0x0-2x2-1x1-0-NCHW-FP32-F=miopenConvolutionFwdAlgoImplicitGEMM:ConvHipImplicitGemmV4R4Fwd,0,99207,0,miopenConvolutionFwdAlgoImplicitGEMM;miopenConvolutionFwdAlgoGEMM:GemmFwd1x1_0_2,1,6361,77070336,MIOpenGEMM;miopenConvolutionFwdAlgoDirect:ConvAsm1x1UV2,1,8562,0,miopenConvolutionFwdAlgoDirect;miopenConvolutionFwdAlgoWinograd:ConvBinWinogradRxSf2x3,5,13975,0,miopenConvolutionFwdAlgoWinograd
128-56-56-1x1-256-56-56-32-0x0-1x1-1x1-0-NCHW-FP32-B=miopenConvolutionBwdDataAlgoDirect:ConvAsm1x1U,0,90504,0,miopenConvolutionBwdDataAlgoDirect;miopenConvolutionBwdDataAlgoWinograd:ConvBinWinogradRxSf3x2,1,40664,0,miopenConvolutionBwdDataAlgoWinograd;miopenConvolutionBwdDataAlgoGEMM:gemm,1,58554,0,MIOpenGEMM
256-56-56-3x3-256-56-56-32-1x1-1x1-1x1-0-NCHW-FP32-B_g32=miopenConvolutionBwdDataAlgoDirect:ConvAsm3x3U,0,547803,0,miopenConvolutionBwdDataAlgoDirect;miopenConvolutionBwdDataAlgoWinograd:ConvBinWinogradRxSf2x3,1,64803,0,miopenConvolutionBwdDataAlgoWinograd;miopenConvolutionBwdDataAlgoGEMM:gemm,12,1538,28901376,MIOpenGEMM
1024-14-14-1x1-1024-14-14-32-0x0-1x1-1x1-0-NCHW-FP32-B=miopenConvolutionBwdDataAlgoImplicitGEMM:ConvHipImplicitGemmBwdDataV1R1,1,40611,0,miopenConvolutionBwdDataAlgoImplicitGEMM;miopenConvolutionBwdDataAlgoDirect:ConvAsm1x1U,1,69218,0,miopenConvolutionBwdDataAlgoDirect;miopenConvolutionBwdDataAlgoWinograd:ConvBinWinogradRxSf3x2,2,76268,0,miopenConvolutionBwdDataAlgoWinograd;miopenConvolutionBwdDataAlgoGEMM:gemm,3,39598,0,MIOpenGEMM
1024-7-7-3x3-1024-7-7-32-1x1-1x1-1x1-0-NCHW-FP32-B_g32=miopenConvolutionBwdDataAlgoWinograd:ConvBinWinogradRxSf2x3,0,15333,0,miopenConvolutionBwdDataAlgoWinograd;miopenConvolutionBwdDataAlgoDirect:ConvOclDirectFwd,0,363287,0,miopenConvolutionBwdDataAlgoDirect;miopenConvolutionBwdDataAlgoGEMM:gemm,6,33941,1806336,MIOpenGEMM
2048-14-14-3x3-2048-7-7-32-1x1-2x2-1x1-0-NCHW-FP32-F_g64=miopenConvolutionFwdAlgoImplicitGEMM:ConvHipImplicitGemmV4R1Fwd,0,593255,0,miopenConvolutionFwdAlgoImplicitGEMM;miopenConvolutionFwdAlgoWinograd:ConvBinWinogradRxSf2x3,0,630314,0,miopenConvolutionFwdAlgoWinograd;miopenConvolutionFwdAlgoDirect:ConvOclDirectFwd,1,28633,0,miopenConvolutionFwdAlgoDirect;miopenConvolutionFwdAlgoGEMM:GemmFwdRest,35,6841,3612672,MIOpenGEMM
256-56-56-1x1-64-56-56-32-0x0-1x1-1x1-0-NCHW-FP32-B=miopenConvolutionBwdDataAlgoWinograd:ConvBinWinogradRxSf3x2,0,689259,0,miopenConvolutionBwdDataAlgoWinograd;miopenConvolutionBwdDataAlgoDirect:ConvAsm1x1U,0,929384,0,miopenConvolutionBwdDataAlgoDirect
512-14-14-3x3-512-28-28-32-1x1-2x2-1x1-0-NCHW-FP32-W_g32=miopenConvolutionBwdWeightsAlgoDirect:ConvAsmBwdWrW3x3,0,468411,0,miopenConvolutionBwdWeightsAlgoDirect;miopenConvolutionBwdWeightsAlgoGEMM:gemm,10,6399,3612672,MIOpenGEMM
256-56-56-3x3-256-56-56-32-1x1-1x1-1x1-0-NCHW-FP32-F_g32=miopenConvolutionFwdAlgoDirect:ConvAsm3x3U,0,482836,0,miopenConvolutionFwdAlgoDirect;miopenConvolutionFwdAlgoWinograd:ConvBinWinogradRxSf2x3,1,57016,0,miopenConvolutionFwdAlgoWinograd;miopenConvolutionFwdAlgoGEMM:GemmFwdRest,11,3601,28901376,MIOpenGEMM
512-28-28-1x1-512-28-28-32-0x0-1x1-1x1-0-NCHW-FP32-F=miopenConvolutionFwdAlgoImplicitGEMM:ConvHipImplicitGemmV4R4Fwd,1,31901,0,miopenConvolutionFwdAlgoImplicitGEMM;miopenConvolutionFwdAlgoDirect:ConvOclDirectFwd1x1,1,61508,0,miopenConvolutionFwdAlgoDirect;miopenConvolutionFwdAlgoGEMM:GemmFwd1x1_0_1,2,4179,0,MIOpenGEMM;miopenConvolutionFwdAlgoWinograd:ConvBinWinogradRxSf3x2,2,86854,0,miopenConvolutionFwdAlgoWinograd
2048-7-7-1x1-1024-7-7-32-0x0-1x1-1x1-0-NCHW-FP32-F=miopenConvolutionFwdAlgoDirect:ConvAsm1x1U,1,33243,0,miopenConvolutionFwdAlgoDirect;miopenConvolutionFwdAlgoImplicitGEMM:ConvHipImplicitGemmV4R1Fwd,1,79898,0,miopenConvolutionFwdAlgoImplicitGEMM;miopenConvolutionFwdAlgoWinograd:ConvBinWinogradRxSf3x2,2,34223,0,miopenConvolutionFwdAlgoWinograd;miopenConvolutionFwdAlgoGEMM:GemmFwd1x1_0_1,2,75332,0,MIOpenGEMM
1024-14-14-1x1-512-28-28-32-0x0-2x2-1x1-0-NCHW-FP32-B=miopenConvolutionBwdDataAlgoDirect:ConvAsm1x1UV2,1,3059,0,miopenConvolutionBwdDataAlgoDirect;miopenConvolutionBwdDataAlgoGEMM:gemm,1,13172,38535168,MIOpenGEMM;miopenConvolutionBwdDataAlgoWinograd:ConvBinWinogradRxSf2x3,6,32693,0,miopenConvolutionBwdDataAlgoWinograd
2048-14-14-1x1-1024-14-14-32-0x0-1x1-1x1-0-NCHW-FP32-W=miopenConvolutionBwdWeightsAlgoDirect:ConvAsmBwdWrW1x1,2,78029,0,miopenConvolutionBwdWeightsAlgoDirect;miopenConvolutionBwdWeightsAlgoGEMM:gemm,3,74892,0,MIOpenGEMM;miopenConvolutionBwdWeightsAlgoWinograd:ConvBinWinogradRxSf2x3,12,7481,0,miopenConvolutionBwdWeightsAlgoWinograd
2048-7-7-1x1-2048-7-7-32-0x0-1x1-1x1-0-NCHW-FP32-F=miopenConvolutionFwdAlgoDirect:ConvAsm1x1U,2,53243,0,miopenConvolutionFwdAlgoDirect;miopenConvolutionFwdAlgoImplicitGEMM:ConvHipImplicitGemmV4R4Fwd,2,63548,0,miopenConvolutionFwdAlgoImplicitGEMM;miopenConvolutionFwdAlgoWinograd:ConvBinWinogradRxSf3x2,4,782,0,miopenConvolutionFwdAlgoWinograd;miopenConvolutionFwdAlgoGEMM:GemmFwd1x1_0_1,4,34046,0,MIOpenGEMM
1024-14-14-1x1-1024-14-14-32-0x0-1x1-1x1-0-NCHW-FP32-F=miopenConvolutionFwdAlgoImplicitGEMM:ConvHipImplicitGemmV4R4Fwd,1,80646,0,miopenConvolutionFwdAlgoImplicitGEMM;miopenConvolutionFwdAlgoDirect:ConvAsm1x1U,1,99407,0,miopenConvolutionFwdAlgoDirect;miopenConvolutionFwdAlgoWinograd:ConvBinWinogradRxSf3x2,2,89309,0,miopenConvolutionFwdAlgoWinograd;miopenConvolutionFwdAlgoGEMM:GemmFwd1x1_0_1,2,97634,0,MIOpenGEMM
1024-14-14-3x3-1024-28-28-32-1x1-2x2-1x1-0-NCHW-FP32-W_g64=miopenConvolutionBwdWeightsAlgoDirect:ConvAsmBwdWrW3x3,0,533374,0,miopenConvolutionBwdWeightsAlgoDirect;miopenConvolutionBwdWeightsAlgoGEMM:gemm,33,265,7225344,MIOpenGEMM
2048-7-7-3x3-2048-7-7-32-1x1-1x1-1x1-0-NCHW-FP32-W_g64=miopenConvolutionBwdWeightsAlgoDirect:ConvAsmBwdWrW3x3,0,266782,0,miopenConvolutionBwdWeightsAlgoDirect;miopenConvolutionBwdWeightsAlgoWinograd:ConvBinWinogradRxSf2x3,1,28331,0,miopenConvolutionBwdWeightsAlgoWinograd;miopenConvolutionBwdWeightsAlgoGEMM:gemm,35,657,3612672,MIOpenGEMM
512-14-14-3x3-512-28-28-32-1x1-2x2-1x1-0-NCHW-FP32-B_g32=miopenConvolutionBwdDataAlgoWinograd:ConvBinWinogradRxSf2x3,0,454874,0,miopenConvolutionBwdDataAlgoWinograd;miopenConvolutionBwdDataAlgoDirect:ConvOclDirectFwd,0,574711,0,miopenConvolutionBwdDataAlgoDirect;miopenConvolutionBwdDataAlgoGEMM:gemm,7,33975,3612672,MIOpenGEMM
64-56-56-1x1-256-56-56-32-0x0-1x1-1x1-0-NCHW-FP32-F=miopenConvolutionFwdAlgoDirect:ConvOclDirectFwd1x1,0,42084,0,miopenConvolutionFwdAlgoDirect;miopenConvolutionFwdAlgoImplicitGEMM:ConvHipImplicitGemmV4R4Fwd,0,566011,0,miopenConvolutionFwdAlgoImplicitGEMM;miopenConvolutionFwdAlgoGEMM:GemmFwd1x1_0_1,0,651141,0,MIOpenGEMM;miopenConvolutionFwdAlgoWinograd:ConvBinWinogradRxSf3x2,0,831975,0,miopenConvolutionFwdAlgoWinograd
512-28-28-1x1-1024-14-14-32-0x0-2x2-1x1-0-NCHW-FP32-F=miopenConvolutionFwdAlgoGEMM:GemmFwd1x1_0_2,0,789061,38535168,MIOpenGEMM;miopenConvolutionFwdAlgoImplicitGEMM:ConvHipImplicitGemmV4R4Fwd,1,1586,0,miopenConvolutionFwdAlgoImplicitGEMM;miopenConvolutionFwdAlgoDirect:ConvAsm1x1U,1,29402,12845056,miopenConvolutionFwdAlgoDirect;miopenConvolutionFwdAlgoWinograd:ConvBinWinogradRxS,5,19669,0,miopenConvolutionFwdAlgoWinograd
256-28-28-3x3-256-56-56-32-1x1-2x2-1x1-0-NCHW-FP32-W_g32=miopenConvolutionBwdWeightsAlgoDirect:ConvAsmBwdWrW3x3,0,3228,0,miopenConvolutionBwdWeightsAlgoDirect;miopenConvolutionBwdWeightsAlgoGEMM:gemm,18,6579,7225344,MIOpenGEMM
256-56-56-1x1-128-56-56-32-0x0-1x1-1x1-0-NCHW-FP32-F=miopenConvolutionFwdAlgoDirect:ConvAsm1x1U,0,808832,0,miopenConvolutionFwdAlgoDirect;miopenConvolutionFwdAlgoWinograd:ConvBinWinogradRxSf3x2,1,41506,0,miopenConvolutionFwdAlgoWinograd;miopenConvolutionFwdAlgoGEMM:GemmFwd1x1_0_1,1,56968,0,MIOpenGEMM
256-56-56-1x1-256-56-56-32-0x0-1x1-1x1-0-NCHW-FP32-W=miopenConvolutionBwdWeightsAlgoDirect:ConvAsmBwdWrW1x1,1,942,0,miopenConvolutionBwdWeightsAlgoDirect
2048-7-7-3x3-2048-7-7-32-1x1-1x1-1x1-0-NCHW-FP32-B_g64=miopenConvolutionBwdDataAlgoWinograd:ConvBinWinogradRxSf2x3,0,173553,0,miopenConvolutionBwdDataAlgoWinograd;miopenConvolutionBwdDataAlgoDirect:ConvOclDirectFwd,0,658691,0,miopenConvolutionBwdDataAlgoDirect;miopenConvolutionBwdDataAlgoGEMM:gemm,13,6303,3612672,MIOpenGEMM
2048-14-14-1x1-1024-14-14-32-0x0-1x1-1x1-0-NCHW-FP32-B=miopenConvolutionBwdDataAlgoImplicitGEMM:ConvHipImplicitGemmBwdDataV4R1,2,65291,0,miopenConvolutionBwdDataAlgoImplicitGEMM;miopenConvolutionBwdDataAlgoDirect:ConvAsm1x1U,3,28705,0,miopenConvolutionBwdDataAlgoDirect;miopenConvolutionBwdDataAlgoGEMM:gemm,5,1321,0,MIOpenGEMM;miopenConvolutionBwdDataAlgoWinograd:ConvBinWinogradRxSf3x2,5,50158,0,miopenConvolutionBwdDataAlgoWinograd
1024-7-7-3x3-1024-7-7-32-1x1-1x1-1x1-0-NCHW-FP32-F_g32=miopenConvolutionFwdAlgoWinograd:ConvBinWinogradRxSf2x3,0,117985,0,miopenConvolutionFwdAlgoWinograd;miopenConvolutionFwdAlgoDirect:ConvOclDirectFwd,0,336307,0,miopenConvolutionFwdAlgoDirect;miopenConvolutionFwdAlgoImplicitGEMM:ConvHipImplicitGemmV4R1Fwd,0,337625,0,miopenConvolutionFwdAlgoImplicitGEMM;miopenConvolutionFwdAlgoGEMM:GemmFwdRest,19,2729,1806336,MIOpenGEMM
256-28-28-3x3-256-56-56-32-1x1-2x2-1x1-0-NCHW-FP32-B_g32=miopenConvolutionBwdDataAlgoWinograd:ConvBinWinogradRxSf2x3,0,895118,0,miopenConvolutionBwdDataAlgoWinograd;miopenConvolutionBwdDataAlgoDirect:ConvOclDirectFwd,0,974277,0,miopenConvolutionBwdDataAlgoDirect;miopenConvolutionBwdDataAlgoGEMM:gemm,7,21928,7225344,MIOpenGEMM
1024-14-14-3x3-1024-28-28-32-1x1-2x2-1x1-0-NCHW-FP32-B_g64=miopenConvolutionBwdDataAlgoDirect:ConvOclDirectFwd,0,890552,0,miopenConvolutionBwdDataAlgoDirect;miopenConvolutionBwdDataAlgoWinograd:ConvBinWinogradRxSf2x3,0,907729,0,miopenConvolutionBwdDataAlgoWinograd;miopenConvolutionBwdDataAlgoGEMM:gemm,15,7608,7225344,MIOpenGEMM
256-56-56-1x1-128-56-56-32-0x0-1x1-1x1-0-NCHW-FP32-W=miopenConvolutionBwdWeightsAlgoDirect:ConvAsmBwdWrW1x1,1,36082,0,miopenConvolutionBwdWeightsAlgoDirect
2048-7-7-3x3-2048-14-14-32-1x1-2x2-1x1-0-NCHW-FP32-W_g32=miopenConvolutionBwdWeightsAlgoDirect:ConvAsmBwdWrW3x3,0,56299,0,miopenConvolutionBwdWeightsAlgoDirect;miopenConvolutionBwdWeightsAlgoImplicitGEMM:ConvHipImplicitGemmV4R1WrW,0,676564,0,miopenConvolutionBwdWeightsAlgoImplicitGEMM;miopenConvolutionBwdWeightsAlgoGEMM:gemm,6,90341,3612672,MIOpenGEMM
256-56-56-3x3-256-28-28-32-1x1-2x2-1x1-0-NCHW-FP32-F_g32=miopenConvolutionFwdAlgoWinograd:ConvBinWinogradRxSf2x3,0,980325,0,miopenConvolutionFwdAlgoWinograd;miopenConvolutionFwdAlgoDirect:ConvOclDirectFwd,1,45914,0,miopenConvolutionFwdAlgoDirect;miopenConvolutionFwdAlgoGEMM:GemmFwdRest,9,51574,7225344,MIOpenGEMM
512-56-56-1x1-256-56-56-32-0x0-1x1-1x1-0-NCHW-FP32-W=miopenConvolutionBwdWeightsAlgoGEMM:gemm,3,35319,0,MIOpenGEMM;miopenConvolutionBwdWeightsAlgoWinograd:ConvBinWinogradRxSf2x3,14,4351,0,miopenConvolutionBwdWeightsAlgoWinograd
2048-7-7-3x3-2048-14-14-32-1x1-2x2-1x1-0-NCHW-FP32-B_g32=miopenConvolutionBwdDataAlgoWinograd:ConvBinWinogradRxSf2x3,1,17612,0,miopenConvolutionBwdDataAlgoWinograd;miopenConvolutionBwdDataAlgoDirect:ConvOclDirectFwd,6,9359,0,miopenConvolutionBwdDataAlgoDirect;miopenConvolutionBwdDataAlgoGEMM:gemm,9,33954,3612672,MIOpenGEMM
512-14-14-1x1-1024-14-14-32-0x0-1x1-1x1-0-NCHW-FP32-W=miopenConvolutionBwdWeightsAlgoDirect:ConvAsmBwdWrW1x1,0,895872,0,miopenConvolutionBwdWeightsAlgoDirect;miopenConvolutionBwdWeightsAlgoGEMM:gemm,1,85239,0,MIOpenGEMM;miopenConvolutionBwdWeightsAlgoWinograd:ConvBinWinogradRxSf2x3,2,79405,0,miopenConvolutionBwdWeightsAlgoWinograd
1024-14-14-1x1-2048-14-14-32-0x0-1x1-1x1-0-NCHW-FP32-F=miopenConvolutionFwdAlgoDirect:ConvAsm1x1U,4,13833,0,miopenConvolutionFwdAlgoDirect;miopenConvolutionFwdAlgoGEMM:GemmFwd1x1_0_1,4,91819,0,MIOpenGEMM;miopenConvolutionFwdAlgoWinograd:ConvBinWinogradRxSf3x2,5,46623,0,miopenConvolutionFwdAlgoWinograd
512-28-28-3x3-512-14-14-32-1x1-2x2-1x1-0-NCHW-FP32-F_g32=miopenConvolutionFwdAlgoWinograd:ConvBinWinogradRxSf2x3,0,44086,0,miopenConvolutionFwdAlgoWinograd;miopenConvolutionFwdAlgoImplicitGEMM:ConvHipImplicitGemmV4R1Fwd,0,625872,0,miopenConvolutionFwdAlgoImplicitGEMM;miopenConvolutionFwdAlgoDirect:ConvOclDirectFwd,0,743753,0,miopenConvolutionFwdAlgoDirect;miopenConvolutionFwdAlgoGEMM:GemmFwdRest,11,7282,3612672,MIOpenGEMM
256-56-56-1x1-128-56-56-32-0x0-1x1-1x1-0-NCHW-FP32-B=miopenConvolutionBwdDataAlgoDirect:ConvAsm1x1U,1,4536,0,miopenConvolutionBwdDataAlgoDirect;miopenConvolutionBwdDataAlgoWinograd:ConvBinWinogradRxSf3x2,1,40817,0,miopenConvolutionBwdDataAlgoWinograd;miopenConvolutionBwdDataAlgoGEMM:gemm,1,66929,0,MIOpenGEMM
512-28-28-3x3-512-56-56-32-1x1-2x2-1x1-0-NCHW-FP32-W_g64=miopenConvolutionBwdWeightsAlgoDirect:ConvAsmBwdWrW3x3,1,315,0,miopenConvolutionBwdWeightsAlgoDirect;miopenConvolutionBwdWeightsAlgoGEMM:gemm,41,3046,14450688,MIOpenGEMM
512-28-28-1x1-256-28-28-32-0x0-1x1-1x1-0-NCHW-FP32-W=miopenConvolutionBwdWeightsAlgoDirect:ConvAsmBwdWrW1x1,0,746839,0,miopenConvolutionBwdWeightsAlgoDirect;miopenConvolutionBwdWeightsAlgoWinograd:ConvBinWinogradRxSf2x3,3,26638,0,miopenConvolutionBwdWeightsAlgoWinograd;miopenConvolutionBwdWeightsAlgoGEMM:gemm,3,52112,0,MIOpenGEMM
512-14-14-1x1-1024-14-14-32-0x0-1x1-1x1-0-NCHW-FP32-B=miopenConvolutionBwdDataAlgoDirect:ConvAsm1x1U,1,7451,0,miopenConvolutionBwdDataAlgoDirect;miopenConvolutionBwdDataAlgoWinograd:ConvBinWinogradRxSf3x2,1,51736,0,miopenConvolutionBwdDataAlgoWinograd;miopenConvolutionBwdDataAlgoGEMM:gemm,2,10338,0,MIOpenGEMM
512-14-14-3x3-512-14-14-32-1x1-1x1-1x1-0-NCHW-FP32-W_g32=miopenConvolutionBwdWeightsAlgoDirect:ConvAsmBwdWrW3x3,0,216661,0,miopenConvolutionBwdWeightsAlgoDirect;miopenConvolutionBwdWeightsAlgoWinograd:ConvBinWinogradRxSf2x3,0,818868,0,miopenConvolutionBwdWeightsAlgoWinograd;miopenConvolutionBwdWeightsAlgoGEMM:gemm,14,2024,3612672,MIOpenGEMM
512-56-56-1x1-256-56-56-32-0x0-1x1-1x1-0-NCHW-FP32-B=miopenConvolutionBwdDataAlgoDirect:ConvAsm1x1U,2,55998,0,miopenConvolutionBwdDataAlgoDirect;miopenConvolutionBwdDataAlgoImplicitGEMM:ConvHipImplicitGemmBwdDataV4R1,2,64485,0,miopenConvolutionBwdDataAlgoImplicitGEMM;miopenConvolutionBwdDataAlgoWinograd:ConvBinWinogradRxSf3x2,5,352,0,miopenConvolutionBwdDataAlgoWinograd;miopenConvolutionBwdDataAlgoGEMM:gemm,5,21296,0,MIOpenGEMM
2048-14-14-3x3-2048-7-7-32-1x1-2x2-1x1-0-NCHW-FP32-F_g32=miopenConvolutionFwdAlgoImplicitGEMM:ConvHipImplicitGemmV4R1Fwd,0,65249,0,miopenConvolutionFwdAlgoImplicitGEMM;miopenConvolutionFwdAlgoWinograd:ConvBinWinogradRxSf2x3,0,943021,0,miopenConvolutionFwdAlgoWinograd;miopenConvolutionFwdAlgoDirect:ConvOclDirectFwd,2,2345,0,miopenConvolutionFwdAlgoDirect;miopenConvolutionFwdAlgoGEMM:GemmFwdRest,15,7822,3612672,MIOpenGEMM
2048-7-7-3x3-2048-7-7-32-1x1-1x1-1x1-0-NCHW-FP32-F_g64=miopenConvolutionFwdAlgoWinograd:ConvBinWinogradRxSf2x3,0,531349,0,miopenConvolutionFwdAlgoWinograd;miopenConvolutionFwdAlgoImplicitGEMM:ConvHipImplicitGemmV4R1Fwd,0,553003,0,miopenConvolutionFwdAlgoImplicitGEMM;miopenConvolutionFwdAlgoDirect:ConvOclDirectFwd,0,57153,0,miopenConvolutionFwdAlgoDirect;miopenConvolutionFwdAlgoGEMM:GemmFwdRest,39,5256,3612672,MIOpenGEMM
1024-14-14-3x3-1024-14-14-32-1x1-1x1-1x1-0-NCHW-FP32-W_g32=miopenConvolutionBwdWeightsAlgoDirect:ConvAsmBwdWrW3x3,0,414109,0,miopenConvolutionBwdWeightsAlgoDirect;miopenConvolutionBwdWeightsAlgoWinograd:ConvBinWinogradRxSf2x3,1,62364,0,miopenConvolutionBwdWeightsAlgoWinograd;miopenConvolutionBwdWeightsAlgoGEMM:gemm,19,7506,7225344,MIOpenGEMM
1024-28-28-3x3-1024-14-14-32-1x1-2x2-1x1-0-NCHW-FP32-F_g64=miopenConvolutionFwdAlgoWinograd:ConvBinWinogradRxSf2x3,1,77902,0,miopenConvolutionFwdAlgoWinograd;miopenConvolutionFwdAlgoImplicitGEMM:ConvHipImplicitGemmV4R1Fwd,1,85404,0,miopenConvolutionFwdAlgoImplicitGEMM;miopenConvolutionFwdAlgoDirect:ConvOclDirectFwd,2,83226,0,miopenConvolutionFwdAlgoDirect;miopenConvolutionFwdAlgoGEMM:GemmFwdRest,40,7071,7225344,MIOpenGEMM
512-28-28-1x1-512-28-28-32-0x0-1x1-1x1-0-NCHW-FP32-W=miopenConvolutionBwdWeightsAlgoDirect:ConvAsmBwdWrW1x1,1,68759,0,miopenConvolutionBwdWeightsAlgoDirect;miopenConvolutionBwdWeightsAlgoWinograd:ConvBinWinogradRxSf2x3,5,59038,0,miopenConvolutionBwdWeightsAlgoWinograd
128-56-56-1x1-256-56-56-32-0x0-1x1-1x1-0-NCHW-FP32-F=miopenConvolutionFwdAlgoDirect:ConvAsm1x1U,0,74848,0,miopenConvolutionFwdAlgoDirect
512-14-14-3x3-512-14-14-32-1x1-1x1-1x1-0-NCHW-FP32-B_g32=miopenConvolutionBwdDataAlgoWinograd:ConvBinWinogradRxSf2x3,0,203802,0,miopenConvolutionBwdDataAlgoWinograd;miopenConvolutionBwdDataAlgoDirect:ConvOclDirectFwd,0,292881,0,miopenConvolutionBwdDataAlgoDirect;miopenConvolutionBwdDataAlgoGEMM:gemm,6,15251,3612672,MIOpenGEMM
512-28-28-1x1-256-28-28-32-0x0-1x1-1x1-0-NCHW-FP32-B=miopenConvolutionBwdDataAlgoDirect:ConvAsm1x1U,1,4751,0,miopenConvolutionBwdDataAlgoDirect;miopenConvolutionBwdDataAlgoWinograd:ConvBinWinogradRxSf3x2,1,52188,0,miopenConvolutionBwdDataAlgoWinograd;miopenConvolutionBwdDataAlgoGEMM:gemm,2,71264,0,MIOpenGEMM
512-28-28-3x3-512-56-56-32-1x1-2x2-1x1-0-NCHW-FP32-B_g64=miopenConvolutionBwdDataAlgoDirect:ConvOclDirectFwd,1,40103,0,miopenConvolutionBwdDataAlgoDirect;miopenConvolutionBwdDataAlgoWinograd:ConvBinWinogradRxSf2x3,2,20541,0,miopenConvolutionBwdDataAlgoWinograd;miopenConvolutionBwdDataAlgoGEMM:gemm,21,6563,14450688,MIOpenGEMM
1024-14-14-1x1-512-14-14-32-0x0-1x1-1x1-0-NCHW-FP32-F=miopenConvolutionFwdAlgoDirect:ConvAsm1x1U,1,10171,0,miopenConvolutionFwdAlgoDirect;miopenConvolutionFwdAlgoWinograd:ConvBinWinogradRxSf3x2,1,74753,0,miopenConvolutionFwdAlgoWinograd;miopenConvolutionFwdAlgoGEMM:GemmFwd1x1_0_1,2,28041,0,MIOpenGEMM
1024-14-14-3x3-1024-28-28-32-1x1-2x2-1x1-0-NCHW-FP32-W_g32=miopenConvolutionBwdWeightsAlgoDirect:ConvAsmBwdWrW3x3,0,635796,0,miopenConvolutionBwdWeightsAlgoDirect;miopenConvolutionBwdWeightsAlgoGEMM:gemm,19,1327,7225344,MIOpenGEMM
1024-14-14-3x3-1024-14-14-32-1x1-1x1-1x1-0-NCHW-FP32-B_g32=miopenConvolutionBwdDataAlgoWinograd:ConvBinWinogradRxSf2x3,0,278797,0,miopenConvolutionBwdDataAlgoWinograd;miopenConvolutionBwdDataAlgoDirect:ConvOclDirectFwd,1,10801,0,miopenConvolutionBwdDataAlgoDirect;miopenConvolutionBwdDataAlgoGEMM:gemm,7,723,7225344,MIOpenGEMM
128-56-56-1x1-64-56-56-32-0x0-1x1-1x1-0-NCHW-FP32-W=miopenConvolutionBwdWeightsAlgoDirect:ConvAsmBwdWrW1x1,0,510268,0,miopenConvolutionBwdWeightsAlgoDirect
2048-7-7-3x3-2048-7-7-32-1x1-1x1-1x1-0-NCHW-FP32-W_g32=miopenConvolutionBwdWeightsAlgoDirect:ConvAsmBwdWrW3x3,0,43653,0,miopenConvolutionBwdWeightsAlgoDirect;miopenConvolutionBwdWeightsAlgoImplicitGEMM:ConvHipImplicitGemmV4R1WrW,0,591777,0,miopenConvolutionBwdWeightsAlgoImplicitGEMM;miopenConvolutionBwdWeightsAlgoWinograd:ConvBinWinogradRxSf2x3,1,23821,0,miopenConvolutionBwdWeightsAlgoWinograd;miopenConvolutionBwdWeightsAlgoGEMM:gemm,6,39269,3612672,MIOpenGEMM
128-56-56-3x3-128-56-56-32-1x1-1x1-1x1-0-NCHW-FP32-W_g32=miopenConvolutionBwdWeightsAlgoDirect:ConvAsmBwdWrW3x3,0,196344,0,miopenConvolutionBwdWeightsAlgoDirect;miopenConvolutionBwdWeightsAlgoWinograd:ConvBinWinogradRxSf2x3,2,94426,0,miopenConvolutionBwdWeightsAlgoWinograd;miopenConvolutionBwdWeightsAlgoGEMM:gemm,70,8952,14450688,MIOpenGEMM
1024-28-28-1x1-512-28-28-32-0x0-1x1-1x1-0-NCHW-FP32-W=miopenConvolutionBwdWeightsAlgoDirect:ConvAsmBwdWrW1x1,2,77177,0,miopenConvolutionBwdWeightsAlgoDirect;miopenConvolutionBwdWeightsAlgoWinograd:ConvBinWinogradRxSf2x3,16,4231,0,miopenConvolutionBwdWeightsAlgoWinograd
2048-7-7-1x1-1024-14-14-32-0x0-2x2-1x1-0-NCHW-FP32-W=miopenConvolutionBwdWeightsAlgoImplicitGEMM:ConvHipImplicitGemmV4R1WrW,0,845446,0,miopenConvolutionBwdWeightsAlgoImplicitGEMM;miopenConvolutionBwdWeightsAlgoDirect:ConvAsmBwdWrW1x1,1,16277,6422528,miopenConvolutionBwdWeightsAlgoDirect;miopenConvolutionBwdWeightsAlgoGEMM:gemm,2,1494,200704,MIOpenGEMM
512-56-56-3x3-512-28-28-32-1x1-2x2-1x1-0-NCHW-FP32-F_g64=miopenConvolutionFwdAlgoWinograd:ConvBinWinogradRxSf2x3,1,94818,0,miopenConvolutionFwdAlgoWinograd;miopenConvolutionFwdAlgoDirect:ConvOclDirectFwd,2,86515,0,miopenConvolutionFwdAlgoDirect;miopenConvolutionFwdAlgoGEMM:GemmFwdRest,35,1263,14450688,MIOpenGEMM
2048-7-7-1x1-2048-7-7-32-0x0-1x1-1x1-0-NCHW-FP32-W=miopenConvolutionBwdWeightsAlgoDirect:ConvAsmBwdWrW1x1,2,8069,0,miopenConvolutionBwdWeightsAlgoDirect;miopenConvolutionBwdWeightsAlgoGEMM:gemm,2,73613,0,MIOpenGEMM;miopenConvolutionBwdWeightsAlgoWinograd:ConvBinWinogradRxSf2x3,7,597,0,miopenConvolutionBwdWeightsAlgoWinograd
1024-14-14-3x3-1024-28-28-32-1x1-2x2-1x1-0-NCHW-FP32-B_g32=miopenConvolutionBwdDataAlgoWinograd:ConvBinWinogradRxSf2x3,1,4695,0,miopenConvolutionBwdDataAlgoWinograd;miopenConvolutionBwdDataAlgoDirect:ConvOclDirectFwd,1,75968,0,miopenConvolutionBwdDataAlgoDirect;miopenConvolutionBwdDataAlgoGEMM:gemm,8,11595,7225344,MIOpenGEMM
256-56-56-1x1-512-56-56-32-0x0-1x1-1x1-0-NCHW-FP32-F=miopenConvolutionFwdAlgoImplicitGEMM:ConvHipImplicitGemmV4R4Fwd,2,42537,0,miopenConvolutionFwdAlgoImplicitGEMM;miopenConvolutionFwdAlgoDirect:ConvAsm1x1U,3,17933,0,miopenConvolutionFwdAlgoDirect;miopenConvolutionFwdAlgoGEMM:GemmFwd1x1_0_1,3,20885,0,MIOpenGEMM;miopenConvolutionFwdAlgoWinograd:ConvBinWinogradRxSf3x2,5,21502,0,miopenConvolutionFwdAlgoWinograd
256-28-28-1x1-512-28-28-32-0x0-1x1-1x1-0-NCHW-FP32-F=miopenConvolutionFwdAlgoDirect:ConvOclDirectFwd1x1,0,786956,0,miopenConvolutionFwdAlgoDirect;miopenConvolutionFwdAlgoGEMM:GemmFwd1x1_0_1,1,48443,0,MIOpenGEMM;miopenConvolutionFwdAlgoWinograd:ConvBinWinogradRxSf3x2,1,86867,0,miopenConvolutionFwdAlgoWinograd
2048-7-7-3x3-2048-7-7-32-1x1-1x1-1x1-0-NCHW-FP32-B_g32=miopenConvolutionBwdDataAlgoWinograd:ConvBinWinogradRxSf2x3,0,264132,0,miopenConvolutionBwdDataAlgoWinograd;miopenConvolutionBwdDataAlgoDirect:ConvOclDirectFwd,1,35793,0,miopenConvolutionBwdDataAlgoDirect;miopenConvolutionBwdDataAlgoGEMM:gemm,9,13399,3612672,MIOpenGEMM
128-56-56-3x3-128-56-56-32-1x1-1x1-1x1-0-NCHW-FP32-B_g32=miopenConvolutionBwdDataAlgoDirect:ConvAsm3x3U,0,196583,0,miopenConvolutionBwdDataAlgoDirect;miopenConvolutionBwdDataAlgoWinograd:ConvBinWinogradRxSf2x3,1,37671,0,miopenConvolutionBwdDataAlgoWinograd;miopenConvolutionBwdDataAlgoGEMM:gemm,11,3469,14450688,MIOpenGEMM
1024-14-14-3x3-1024-14-14-32-1x1-1x1-1x1-0-NCHW-FP32-F_g32=miopenConvolutionFwdAlgoWinograd:ConvBinWinogradRxSf2x3,0,262427,0,miopenConvolutionFwdAlgoWinograd;miopenConvolutionFwdAlgoImplicitGEMM:ConvHipImplicitGemmV4R1Fwd,0,579067,0,miopenConvolutionFwdAlgoImplicitGEMM;miopenConvolutionFwdAlgoDirect:ConvOclDirectFwd,0,981689,0,miopenConvolutionFwdAlgoDirect;miopenConvolutionFwdAlgoGEMM:GemmFwdRest,11,6823,7225344,MIOpenGEMM
1024-28-28-1x1-512-28-28-32-0x0-1x1-1x1-0-NCHW-FP32-B=miopenConvolutionBwdDataAlgoDirect:ConvAsm1x1U,2,54338,0,miopenConvolutionBwdDataAlgoDirect;miopenConvolutionBwdDataAlgoImplicitGEMM:ConvHipImplicitGemmBwdDataV4R1,2,55845,0,miopenConvolutionBwdDataAlgoImplicitGEMM;miopenConvolutionBwdDataAlgoGEMM:gemm,4,79574,0,MIOpenGEMM;miopenConvolutionBwdDataAlgoWinograd:ConvBinWinogradRxSf3x2,5,28916,0,miopenConvolutionBwdDataAlgoWinograd
128-56-56-3x3-128-56-56-32-1x1-1x1-1x1-0-NCHW-FP32-F_g32=miopenConvolutionFwdAlgoDirect:ConvAsm3x3U,0,213615,0,miopenConvolutionFwdAlgoDirect;miopenConvolutionFwdAlgoWinograd:ConvBinWinogradRxSf2x3,1,28436,0,miopenConvolutionFwdAlgoWinograd;miopenConvolutionFwdAlgoGEMM:GemmFwdRest,12,7757,14450688,MIOpenGEMM
2048-7-7-1x1-1024-14-14-32-0x0-2x2-1x1-0-NCHW-FP32-B=miopenConvolutionBwdDataAlgoDirect:ConvAsm1x1UV2,1,3138,0,miopenConvolutionBwdDataAlgoDirect;miopenConvolutionBwdDataAlgoGEMM:gemm,1,25193,19267584,MIOpenGEMM;miopenConvolutionBwdDataAlgoImplicitGEMM:ConvHipImplicitGemmBwdDataV4R1,1,50591,0,miopenConvolutionBwdDataAlgoImplicitGEMM;miopenConvolutionBwdDataAlgoWinograd:ConvBinWinogradRxSf2x3,7,70122,0,miopenConvolutionBwdDataAlgoWinograd
512-14-14-3x3-512-14-14-32-1x1-1x1-1x1-0-NCHW-FP32-F_g32=miopenConvolutionFwdAlgoWinograd:ConvBinWinogradRxSf2x3,0,162116,0,miopenConvolutionFwdAlgoWinograd;miopenConvolutionFwdAlgoDirect:ConvAsm3x3U,0,387303,0,miopenConvolutionFwdAlgoDirect;miopenConvolutionFwdAlgoImplicitGEMM:ConvHipImplicitGemmV4R1Fwd,0,434421,0,miopenConvolutionFwdAlgoImplicitGEMM;miopenConvolutionFwdAlgoGEMM:GemmFwdRest,12,358,3612672,MIOpenGEMM
256-56-56-3x3-256-56-56-32-1x1-1x1-1x1-0-NCHW-FP32-W_g64=miopenConvolutionBwdWeightsAlgoDirect:ConvAsmBwdWrW3x3,0,506472,0,miopenConvolutionBwdWeightsAlgoDirect;miopenConvolutionBwdWeightsAlgoWinograd:ConvBinWinogradRxSf2x3,5,93524,0,miopenConvolutionBwdWeightsAlgoWinograd;miopenConvolutionBwdWeightsAlgoGEMM:gemm,128,389,28901376,MIOpenGEMM
1024-28-28-3x3-1024-14-14-32-1x1-2x2-1x1-0-NCHW-FP32-F_g32=miopenConvolutionFwdAlgoImplicitGEMM:ConvHipImplicitGemmV4R1Fwd,0,73788,0,miopenConvolutionFwdAlgoImplicitGEMM;miopenConvolutionFwdAlgoWinograd:ConvBinWinogradRxSf2x3,0,774189,0,miopenConvolutionFwdAlgoWinograd;miopenConvolutionFwdAlgoDirect:ConvOclDirectFwd,2,47,0,miopenConvolutionFwdAlgoDirect;miopenConvolutionFwdAlgoGEMM:GemmFwdRest,11,5774,7225344,MIOpenGEMM
2048-7-7-3x3-2048-7-7-32-1x1-1x1-1x1-0-NCHW-FP32-F_g32=miopenConvolutionFwdAlgoWinograd:ConvBinWinogradRxSf2x3,0,26596,0,miopenConvolutionFwdAlgoWinograd;miopenConvolutionFwdAlgoImplicitGEMM:ConvHipImplicitGemmV4R1Fwd,0,772613,0,miopenConvolutionFwdAlgoImplicitGEMM;miopenConvolutionFwdAlgoDirect:ConvOclDirectFwd,1,20709,0,miopenConvolutionFwdAlgoDirect;miopenConvolutionFwdAlgoGEMM:GemmFwdRest,15,7317,3612672,MIOpenGEMM
512-28-28-3x3-512-28-28-32-1x1-1x1-1x1-0-NCHW-FP32-W_g32=miopenConvolutionBwdWeightsAlgoDirect:ConvAsmBwdWrW3x3,0,438696,0,miopenConvolutionBwdWeightsAlgoDirect;miopenConvolutionBwdWeightsAlgoWinograd:ConvBinWinogradRxSf2x3,1,72897,0,miopenConvolutionBwdWeightsAlgoWinograd;miopenConvolutionBwdWeightsAlgoGEMM:gemm,17,1147,14450688,MIOpenGEMM
256-56-56-3x3-256-56-56-32-1x1-1x1-1x1-0-NCHW-FP32-B_g64=miopenConvolutionBwdDataAlgoDirect:ConvAsm3x3U,0,465421,0,miopenConvolutionBwdDataAlgoDirect;miopenConvolutionBwdDataAlgoWinograd:ConvBinWinogradRxSf2x3,2,44362,0,miopenConvolutionBwdDataAlgoWinograd;miopenConvolutionBwdDataAlgoGEMM:gemm,25,9266,28901376,MIOpenGEMM
2048-7-7-1x1-1024-7-7-32-0x0-1x1-1x1-0-NCHW-FP32-W=miopenConvolutionBwdWeightsAlgoDirect:ConvAsmBwdWrW1x1,0,996799,0,miopenConvolutionBwdWeightsAlgoDirect;miopenConvolutionBwdWeightsAlgoGEMM:gemm,1,70708,0,MIOpenGEMM;miopenConvolutionBwdWeightsAlgoWinograd:ConvBinWinogradRxSf2x3,2,98719,0,miopenConvolutionBwdWeightsAlgoWinograd
512-28-28-1x1-1024-28-28-32-0x0-1x1-1x1-0-NCHW-FP32-F=miopenConvolutionFwdAlgoImplicitGEMM:ConvHipImplicitGemmV4R4Fwd,2,41192,0,miopenConvolutionFwdAlgoImplicitGEMM;miopenConvolutionFwdAlgoDirect:ConvOclDirectFwd1x1,3,35551,0,miopenConvolutionFwdAlgoDirect;miopenConvolutionFwdAlgoGEMM:GemmFwd1x1_0_1,4,19747,0,MIOpenGEMM;miopenConvolutionFwdAlgoWinograd:ConvBinWinogradRxSf3x2,5,36864,0,miopenConvolutionFwdAlgoWinograd
1024-14-14-1x1-512-14-14-32-0x0-1x1-1x1-0-NCHW-FP32-W=miopenConvolutionBwdWeightsAlgoDirect:ConvAsmBwdWrW1x1,0,772483,0,miopenConvolutionBwdWeightsAlgoDirect;miopenConvolutionBwdWeightsAlgoGEMM:gemm,1,69385,0,MIOpenGEMM;miopenConvolutionBwdWeightsAlgoWinograd:ConvBinWinogradRxSf2x3,2,7704,0,miopenConvolutionBwdWeightsAlgoWinograd
2048-7-7-3x3-2048-14-14-32-1x1-2x2-1x1-0-NCHW-FP32-W_g64=miopenConvolutionBwdWeightsAlgoDirect:ConvAsmBwdWrW3x3,0,397557,0,miopenConvolutionBwdWeightsAlgoDirect;miopenConvolutionBwdWeightsAlgoGEMM:gemm,26,597,3612672,MIOpenGEMM
256-28-28-3x3-256-28-28-32-1x1-1x1-1x1-0-NCHW-FP32-W_g32=miopenConvolutionBwdWeightsAlgoDirect:ConvAsmBwdWrW3x3,0,398367,0,miopenConvolutionBwdWeightsAlgoDirect;miopenConvolutionBwdWeightsAlgoWinograd:ConvBinWinogradRxSf2x3,1,36196,0,miopenConvolutionBwdWeightsAlgoWinograd;miopenConvolutionBwdWeightsAlgoGEMM:gemm,20,8125,7225344,MIOpenGEMM
3-227-227-11x11-64-55-55-512-0x0-4x4-1x1-0-NCHW-FP32-F=miopenConvolutionFwdAlgoDirect:ConvOclDirectFwd11x11,22,7956,0,miopenConvolutionFwdAlgoDirect;miopenConvolutionFwdAlgoGEMM:GemmFwdRest,32,5096,4392300,MIOpenGEMM
512-28-28-3x3-512-28-28-32-1x1-1x1-1x1-0-NCHW-FP32-W_g64=miopenConvolutionBwdWeightsAlgoDirect:ConvAsmBwdWrW3x3,0,416258,0,miopenConvolutionBwdWeightsAlgoDirect;miopenConvolutionBwdWeightsAlgoWinograd:ConvBinWinogradRxSf2x3,4,88212,0,miopenConvolutionBwdWeightsAlgoWinograd;miopenConvolutionBwdWeightsAlgoGEMM:gemm,42,5242,14450688,MIOpenGEMM
384-13-13-3x3-192-13-13-512-1x1-1x1-1x1-0-NCHW-FP32-B=miopenConvolutionBwdDataAlgoWinograd:ConvBinWinograd3x3U,5,90786,0,miopenConvolutionBwdDataAlgoWinograd
2048-7-7-3x3-2048-14-14-32-1x1-2x2-1x1-0-NCHW-FP32-B_g64=miopenConvolutionBwdDataAlgoWinograd:ConvBinWinogradRxSf2x3,0,877456,0,miopenConvolutionBwdDataAlgoWinograd;miopenConvolutionBwdDataAlgoDirect:ConvOclDirectFwd,0,939868,0,miopenConvolutionBwdDataAlgoDirect;miopenConvolutionBwdDataAlgoGEMM:gemm,13,9319,3612672,MIOpenGEMM
1024-14-14-1x1-512-14-14-32-0x0-1x1-1x1-0-NCHW-FP32-B=miopenConvolutionBwdDataAlgoDirect:ConvAsm1x1U,0,945022,0,miopenConvolutionBwdDataAlgoDirect;miopenConvolutionBwdDataAlgoWinograd:ConvBinWinogradRxSf3x2,1,60043,0,miopenConvolutionBwdDataAlgoWinograd;miopenConvolutionBwdDataAlgoGEMM:gemm,3,12188,0,MIOpenGEMM
256-28-28-1x1-512-28-28-32-0x0-1x1-1x1-0-NCHW-FP32-W=miopenConvolutionBwdWeightsAlgoDirect:ConvAsmBwdWrW1x1,0,789909,0,miopenConvolutionBwdWeightsAlgoDirect;miopenConvolutionBwdWeightsAlgoGEMM:gemm,3,2431,0,MIOpenGEMM
512-28-28-3x3-512-28-28-32-1x1-1x1-1x1-0-NCHW-FP32-B_g32=miopenConvolutionBwdDataAlgoDirect:ConvAsm3x3U,0,700531,0,miopenConvolutionBwdDataAlgoDirect;miopenConvolutionBwdDataAlgoWinograd:ConvBinWinogradRxSf2x3,0,707243,0,miopenConvolutionBwdDataAlgoWinograd;miopenConvolutionBwdDataAlgoGEMM:gemm,6,83999,14450688,MIOpenGEMM
512-28-28-3x3-512-28-28-32-1x1-1x1-1x1-0-NCHW-FP32-B_g64=miopenConvolutionBwdDataAlgoDirect:ConvAsm3x3U,0,419241,0,miopenConvolutionBwdDataAlgoDirect;miopenConvolutionBwdDataAlgoWinograd:ConvBinWinogradRxSf2x3,1,50362,0,miopenConvolutionBwdDataAlgoWinograd;miopenConvolutionBwdDataAlgoGEMM:gemm,17,1047,14450688,MIOpenGEMM
256-56-56-3x3-256-56-56-32-1x1-1x1-1x1-0-NCHW-FP32-F_g64=miopenConvolutionFwdAlgoDirect:ConvAsm3x3U,0,636807,0,miopenConvolutionFwdAlgoDirect;miopenConvolutionFwdAlgoWinograd:ConvBinWinogradRxSf2x3,2,50741,0,miopenConvolutionFwdAlgoWinograd;miopenConvolutionFwdAlgoGEMM:GemmFwdRest,42,4254,28901376,MIOpenGEMM
384-13-13-3x3-256-13-13-512-1x1-1x1-1x1-0-NCHW-FP32-F=miopenConvolutionFwdAlgoWinograd:ConvBinWinograd3x3U,7,92979,0,miopenConvolutionFwdAlgoWinograd
256-14-14-1x1-1024-14-14-128-0x0-1x1-1x1-0-NCHW-FP32-W=miopenConvolutionBwdWeightsAlgoDirect:ConvAsmBwdWrW1x1,1,42222,0,miopenConvolutionBwdWeightsAlgoDirect;miopenConvolutionBwdWeightsAlgoGEMM:gemm,4,33809,0,MIOpenGEMM;miopenConvolutionBwdWeightsAlgoWinograd:ConvBinWinogradRxSf2x3,7,11198,0,miopenConvolutionBwdWeightsAlgoWinograd
256-28-28-3x3-256-28-28-32-1x1-1x1-1x1-0-NCHW-FP32-B_g32=miopenConvolutionBwdDataAlgoDirect:ConvAsm3x3U,0,254404,0,miopenConvolutionBwdDataAlgoDirect;miopenConvolutionBwdDataAlgoWinograd:ConvBinWinogradRxSf2x3,0,513682,0,miopenConvolutionBwdDataAlgoWinograd;miopenConvolutionBwdDataAlgoGEMM:gemm,6,24655,7225344,MIOpenGEMM
512-28-28-3x3-512-28-28-32-1x1-1x1-1x1-0-NCHW-FP32-F_g64=miopenConvolutionFwdAlgoDirect:ConvAsm3x3U,0,657991,0,miopenConvolutionFwdAlgoDirect;miopenConvolutionFwdAlgoWinograd:ConvBinWinogradRxSf2x3,6,5368,0,miopenConvolutionFwdAlgoWinograd;miopenConvolutionFwdAlgoGEMM:GemmFwdRest,36,1151,14450688,MIOpenGEMM
512-14-14-1x1-1024-14-14-32-0x0-1x1-1x1-0-NCHW-FP32-F=miopenConvolutionFwdAlgoDirect:ConvOclDirectFwd1x1,0,896272,0,miopenConvolutionFwdAlgoDirect;miopenConvolutionFwdAlgoWinograd:ConvBinWinogradRxSf3x2,1,54507,0,miopenConvolutionFwdAlgoWinograd;miopenConvolutionFwdAlgoGEMM:GemmFwd1x1_0_1,1,80632,0,MIOpenGEMM
2048-7-7-1x1-512-7-7-128-0x0-1x1-1x1-0-NCHW-FP32-F=miopenConvolutionFwdAlgoDirect:ConvAsm1x1U,2,31722,0,miopenConvolutionFwdAlgoDirect;miopenConvolutionFwdAlgoGEMM:GemmFwd1x1_0_1,13,8211,0,MIOpenGEMM
256-28-28-1x1-512-28-28-32-0x0-1x1-1x1-0-NCHW-FP32-B=miopenConvolutionBwdDataAlgoImplicitGEMM:ConvHipImplicitGemmBwdDataV1R1,0,830358,0,miopenConvolutionBwdDataAlgoImplicitGEMM;miopenConvolutionBwdDataAlgoDirect:ConvAsm1x1U,1,7898,0,miopenConvolutionBwdDataAlgoDirect;miopenConvolutionBwdDataAlgoGEMM:gemm,1,30135,0,MIOpenGEMM;miopenConvolutionBwdDataAlgoWinograd:ConvBinWinogradRxSf3x2,1,47469,0,miopenConvolutionBwdDataAlgoWinograd
256-14-14-1x1-1024-14-14-128-0x0-1x1-1x1-0-NCHW-FP32-B=miopenConvolutionBwdDataAlgoDirect:ConvAsm1x1U,1,78013,0,miopenConvolutionBwdDataAlgoDirect;miopenConvolutionBwdDataAlgoGEMM:gemm,9,7576,0,MIOpenGEMM
64-55-55-11x11-3-227-227-512-0x0-4x4-1x1-0-NCHW-FP32-W=miopenConvolutionBwdWeightsAlgoDirect:ConvOclBwdWrW2<8>,22,2119,5947392,miopenConvolutionBwdWeightsAlgoDirect;miopenConvolutionBwdWeightsAlgoGEMM:gemm,65,6855,4392300,MIOpenGEMM
64-56-56-3x3-64-56-56-128-1x1-1x1-1x1-0-NCHW-FP32-B=miopenConvolutionBwdDataAlgoWinograd:ConvBinWinograd3x3U,1,52576,0,miopenConvolutionBwdDataAlgoWinograd
128-28-28-1x1-256-56-56-128-0x0-2x2-1x1-0-NCHW-FP32-B=miopenConvolutionBwdDataAlgoDirect:ConvAsm1x1UV2,1,4486,0,miopenConvolutionBwdDataAlgoDirect;miopenConvolutionBwdDataAlgoWinograd:ConvBinWinogradRxSf2x3,7,24904,0,miopenConvolutionBwdDataAlgoWinograd
384-13-13-3x3-192-13-13-512-1x1-1x1-1x1-0-NCHW-FP32-W=miopenConvolutionBwdWeightsAlgoDirect:ConvAsmBwdWrW3x3,22,9974,0,miopenConvolutionBwdWeightsAlgoDirect;miopenConvolutionBwdWeightsAlgoWinograd:ConvBinWinogradRxS,23,2128,0,miopenConvolutionBwdWeightsAlgoWinograd;miopenConvolutionBwdWeightsAlgoImplicitGEMM:ConvHipImplicitGemmV4R1WrW,32,7083,0,miopenConvolutionBwdWeightsAlgoImplicitGEMM;miopenConvolutionBwdWeightsAlgoGEMM:gemm,911,84,1168128,MIOpenGEMM
512-28-28-1x1-1024-14-14-128-0x0-2x2-1x1-0-NCHW-FP32-F=miopenConvolutionFwdAlgoDirect:ConvAsm1x1U,4,87677,51380224,miopenConvolutionFwdAlgoDirect;miopenConvolutionFwdAlgoWinograd:ConvBinWinogradRxSf2x3,20,759,0,miopenConvolutionFwdAlgoWinograd
64-56-56-3x3-64-56-56-128-1x1-1x1-1x1-0-NCHW-FP32-F=miopenConvolutionFwdAlgoWinograd:ConvBinWinograd3x3U,1,38112,0,miopenConvolutionFwdAlgoWinograd
192-13-13-3x3-384-13-13-512-1x1-1x1-1x1-0-NCHW-FP32-F=miopenConvolutionFwdAlgoWinograd:ConvBinWinogradRxS,5,9084,0,miopenConvolutionFwdAlgoWinograd
1024-14-14-1x1-256-14-14-128-0x0-1x1-1x1-0-NCHW-FP32-F=miopenConvolutionFwdAlgoDirect:ConvAsm1x1U,1,61121,0,miopenConvolutionFwdAlgoDirect;miopenConvolutionFwdAlgoWinograd:ConvBinWinogradRxSf3x2,2,75198,0,miopenConvolutionFwdAlgoWinograd;miopenConvolutionFwdAlgoGEMM:GemmFwd1x1_0_1,6,78484,0,MIOpenGEMM
256-28-28-3x3-256-28-28-32-1x1-1x1-1x1-0-NCHW-FP32-F_g32=miopenConvolutionFwdAlgoDirect:ConvAsm3x3U,0,205276,0,miopenConvolutionFwdAlgoDirect;miopenConvolutionFwdAlgoWinograd:ConvBinWinogradRxSf2x3,0,565825,0,miopenConvolutionFwdAlgoWinograd;miopenConvolutionFwdAlgoGEMM:GemmFwdRest,11,501,7225344,MIOpenGEMM
2048-7-7-1x1-512-7-7-128-0x0-1x1-1x1-0-NCHW-FP32-W=miopenConvolutionBwdWeightsAlgoDirect:ConvAsmBwdWrW1x1,1,73453,0,miopenConvolutionBwdWeightsAlgoDirect;miopenConvolutionBwdWeightsAlgoGEMM:gemm,4,6294,0,MIOpenGEMM;miopenConvolutionBwdWeightsAlgoWinograd:ConvBinWinogradRxSf2x3,4,84177,0,miopenConvolutionBwdWeightsAlgoWinograd
512-28-28-3x3-512-28-28-32-1x1-1x1-1x1-0-NCHW-FP32-F_g32=miopenConvolutionFwdAlgoWinograd:ConvBinWinogradRxSf2x3,0,548522,0,miopenConvolutionFwdAlgoWinograd;miopenConvolutionFwdAlgoImplicitGEMM:ConvHipImplicitGemmV4R1Fwd,0,618397,0,miopenConvolutionFwdAlgoImplicitGEMM;miopenConvolutionFwdAlgoDirect:ConvAsm3x3U,0,771239,0,miopenConvolutionFwdAlgoDirect;miopenConvolutionFwdAlgoGEMM:GemmFwdRest,10,3278,14450688,MIOpenGEMM
512-28-28-1x1-128-28-28-128-0x0-1x1-1x1-0-NCHW-FP32-W=miopenConvolutionBwdWeightsAlgoDirect:ConvAsmBwdWrW1x1,1,8477,0,miopenConvolutionBwdWeightsAlgoDirect
256-56-56-1x1-128-28-28-128-0x0-2x2-1x1-0-NCHW-FP32-F=miopenConvolutionFwdAlgoDirect:ConvAsm1x1UV2,1,8092,0,miopenConvolutionFwdAlgoDirect;miopenConvolutionFwdAlgoWinograd:ConvBinWinogradRxS,5,21322,0,miopenConvolutionFwdAlgoWinograd
64-112-112-7x7-3-230-230-128-0x0-2x2-1x1-0-NCHW-FP32-W=miopenConvolutionBwdWeightsAlgoDirect:ConvOclBwdWrW2<8>,7,6044,602112,miopenConvolutionBwdWeightsAlgoDirect;miopenConvolutionBwdWeightsAlgoGEMM:gemm,18,29,7375872,MIOpenGEMM
256-56-56-1x1-512-28-28-128-0x0-2x2-1x1-0-NCHW-FP32-F=miopenConvolutionFwdAlgoDirect:ConvAsm1x1U,3,89315,102760448,miopenConvolutionFwdAlgoDirect;miopenConvolutionFwdAlgoGEMM:GemmFwd1x1_0_2,4,76323,308281344,MIOpenGEMM;miopenConvolutionFwdAlgoWinograd:ConvBinWinogradRxS,21,5416,0,miopenConvolutionFwdAlgoWinograd
64-56-56-1x1-256-56-56-128-0x0-1x1-1x1-0-NCHW-FP32-W=miopenConvolutionBwdWeightsAlgoDirect:ConvAsmBwdWrW1x1,2,81237,0,miopenConvolutionBwdWeightsAlgoDirect
2048-7-7-1x1-1024-14-14-128-0x0-2x2-1x1-0-NCHW-FP32-W=miopenConvolutionBwdWeightsAlgoDirect:ConvAsmBwdWrW1x1,3,67452,25690112,miopenConvolutionBwdWeightsAlgoDirect;miopenConvolutionBwdWeightsAlgoImplicitGEMM:ConvHipImplicitGemmV4R1WrW,4,48876,0,miopenConvolutionBwdWeightsAlgoImplicitGEMM;miopenConvolutionBwdWeightsAlgoGEMM:gemm,45,1451,200704,MIOpenGEMM
192-27-27-5x5-64-27-27-512-2x2-1x1-1x1-0-NCHW-FP32-W=miopenConvolutionBwdWeightsAlgoWinograd:ConvBinWinogradRxS,19,9234,0,miopenConvolutionBwdWeightsAlgoWinograd;miopenConvolutionBwdWeightsAlgoDirect:ConvOclBwdWrW53,33,6109,0,miopenConvolutionBwdWeightsAlgoDirect;miopenConvolutionBwdWeightsAlgoImplicitGEMM:ConvHipImplicitGemmV4R1WrW,49,9848,0,miopenConvolutionBwdWeightsAlgoImplicitGEMM;miopenConvolutionBwdWeightsAlgoGEMM:gemm,1147,92,4665600,MIOpenGEMM
512-28-28-1x1-128-28-28-128-0x0-1x1-1x1-0-NCHW-FP32-B=miopenConvolutionBwdDataAlgoDirect:ConvAsm1x1U,1,709,0,miopenConvolutionBwdDataAlgoDirect;miopenConvolutionBwdDataAlgoGEMM:gemm,8,96186,0,MIOpenGEMM
64-56-56-1x1-64-56-56-128-0x0-1x1-1x1-0-NCHW-FP32-F=miopenConvolutionFwdAlgoWinograd:ConvBinWinogradRxSf3x2,0,83672,0,miopenConvolutionFwdAlgoWinograd;miopenConvolutionFwdAlgoGEMM:GemmFwd1x1_0_1,10,7956,0,MIOpenGEMM
256-14-14-3x3-256-14-14-128-1x1-1x1-1x1-0-NCHW-FP32-W=miopenConvolutionBwdWeightsAlgoWinograd:ConvBinWinogradRxS,2,66045,0,miopenConvolutionBwdWeightsAlgoWinograd;miopenConvolutionBwdWeightsAlgoDirect:ConvAsmBwdWrW3x3,3,28327,0,miopenConvolutionBwdWeightsAlgoDirect;miopenConvolutionBwdWeightsAlgoImplicitGEMM:ConvHipImplicitGemmV4R1WrW,6,17603,0,miopenConvolutionBwdWeightsAlgoImplicitGEMM;miopenConvolutionBwdWeightsAlgoGEMM:gemm,23,9681,1806336,MIOpenGEMM
512-7-7-1x1-2048-7-7-128-0x0-1x1-1x1-0-NCHW-FP32-W=miopenConvolutionBwdWeightsAlgoDirect:ConvAsmBwdWrW1x1,1,74755,0,miopenConvolutionBwdWeightsAlgoDirect;miopenConvolutionBwdWeightsAlgoGEMM:gemm,3,54778,0,MIOpenGEMM;miopenConvolutionBwdWeightsAlgoWinograd:ConvBinWinogradRxSf2x3,5,54745,0,miopenConvolutionBwdWeightsAlgoWinograd
3-230-230-7x7-64-112-112-128-0x0-2x2-1x1-0-NCHW-FP32-F=miopenConvolutionFwdAlgoWinograd:ConvBinWinogradRxS,4,72642,0,miopenConvolutionFwdAlgoWinograd;miopenConvolutionFwdAlgoDirect:ConvOclDirectFwd,5,15755,0,miopenConvolutionFwdAlgoDirect;miopenConvolutionFwdAlgoGEMM:GemmFwdRest,44,8992,7375872,MIOpenGEMM
2048-7-7-1x1-512-7-7-128-0x0-1x1-1x1-0-NCHW-FP32-B=miopenConvolutionBwdDataAlgoDirect:ConvAsm1x1U,1,7435,0,miopenConvolutionBwdDataAlgoDirect;miopenConvolutionBwdDataAlgoWinograd:ConvBinWinogradRxSf3x2,4,1339,0,miopenConvolutionBwdDataAlgoWinograd;miopenConvolutionBwdDataAlgoGEMM:gemm,7,89649,0,MIOpenGEMM
64-56-56-1x1-64-56-56-128-0x0-1x1-1x1-0-NCHW-FP32-W=miopenConvolutionBwdWeightsAlgoDirect:ConvOclBwdWrW1x1,1,11589,0,miopenConvolutionBwdWeightsAlgoDirect
256-14-14-3x3-256-14-14-128-1x1-1x1-1x1-0-NCHW-FP32-B=miopenConvolutionBwdDataAlgoWinograd:ConvBinWinogradRxSf2x3,1,30988,0,miopenConvolutionBwdDataAlgoWinograd
2048-7-7-1x1-1024-14-14-128-0x0-2x2-1x1-0-NCHW-FP32-B=miopenConvolutionBwdDataAlgoDirect:ConvAsm1x1UV2,3,67102,0,miopenConvolutionBwdDataAlgoDirect;miopenConvolutionBwdDataAlgoGEMM:gemm,21,6144,77070336,MIOpenGEMM;miopenConvolutionBwdDataAlgoWinograd:ConvBinWinogradRxSf2x3,30,7803,0,miopenConvolutionBwdDataAlgoWinograd
128-28-28-1x1-512-28-28-128-0x0-1x1-1x1-0-NCHW-FP32-F=miopenConvolutionFwdAlgoDirect:ConvAsm1x1U,1,79864,0,miopenConvolutionFwdAlgoDirect;miopenConvolutionFwdAlgoGEMM:GemmFwd1x1_0_1,3,5681,0,MIOpenGEMM;miopenConvolutionFwdAlgoWinograd:ConvBinWinogradRxSf3x2,3,16614,0,miopenConvolutionFwdAlgoWinograd
256-14-14-3x3-256-14-14-128-1x1-1x1-1x1-0-NCHW-FP32-F=miopenConvolutionFwdAlgoWinograd:ConvBinWinograd3x3U,1,32053,0,miopenConvolutionFwdAlgoWinograd
1024-14-14-1x1-512-28-28-128-0x0-2x2-1x1-0-NCHW-FP32-B=miopenConvolutionBwdDataAlgoDirect:ConvAsm1x1UV2,3,22267,0,miopenConvolutionBwdDataAlgoDirect;miopenConvolutionBwdDataAlgoWinograd:ConvBinWinogradRxSf2x3,24,8969,0,miopenConvolutionBwdDataAlgoWinograd
1024-14-14-1x1-256-14-14-128-0x0-1x1-1x1-0-NCHW-FP32-B=miopenConvolutionBwdDataAlgoDirect:ConvAsm1x1U,1,77499,0,miopenConvolutionBwdDataAlgoDirect;miopenConvolutionBwdDataAlgoWinograd:ConvBinWinogradRxSf3x2,2,9501,0,miopenConvolutionBwdDataAlgoWinograd;miopenConvolutionBwdDataAlgoGEMM:gemm,6,45895,0,MIOpenGEMM
64-56-56-1x1-64-56-56-128-0x0-1x1-1x1-0-NCHW-FP32-B=miopenConvolutionBwdDataAlgoDirect:ConvAsm1x1U,0,703444,0,miopenConvolutionBwdDataAlgoDirect;miopenConvolutionBwdDataAlgoGEMM:gemm,3,2443,0,MIOpenGEMM
512-7-7-1x1-2048-7-7-128-0x0-1x1-1x1-0-NCHW-FP32-F=miopenConvolutionFwdAlgoDirect:ConvAsm1x1U,2,41749,0,miopenConvolutionFwdAlgoDirect;miopenConvolutionFwdAlgoGEMM:GemmFwd1x1_0_1,12,51,0,MIOpenGEMM
512-7-7-3x3-512-7-7-128-1x1-1x1-1x1-0-NCHW-FP32-F=miopenConvolutionFwdAlgoWinograd:ConvBinWinograd3x3U,1,56007,0,miopenConvolutionFwdAlgoWinograd
256-56-56-1x1-64-56-56-128-0x0-1x1-1x1-0-NCHW-FP32-B=miopenConvolutionBwdDataAlgoDirect:ConvAsm1x1U,1,68918,0,miopenConvolutionBwdDataAlgoDirect;miopenConvolutionBwdDataAlgoWinograd:ConvBinWinogradRxSf3x2,2,73816,0,miopenConvolutionBwdDataAlgoWinograd;miopenConvolutionBwdDataAlgoGEMM:gemm,5,90109,0,MIOpenGEMM
192-27-27-5x5-64-27-27-512-2x2-1x1-1x1-0-NCHW-FP32-B=miopenConvolutionBwdDataAlgoFFT:fft,14,3681,963706880,miopenConvolutionBwdDataAlgoFFT;miopenConvolutionBwdDataAlgoWinograd:ConvBinWinogradRxSf2x3,15,6037,0,miopenConvolutionBwdDataAlgoWinograd;miopenConvolutionBwdDataAlgoDirect:ConvOclDirectFwd,43,1785,0,miopenConvolutionBwdDataAlgoDirect;miopenConvolutionBwdDataAlgoImplicitGEMM:ConvHipImplicitGemmBwdDataV1R1,51,6347,0,miopenConvolutionBwdDataAlgoImplicitGEMM;miopenConvolutionBwdDataAlgoGEMM:gemm,79,5787,4665600,MIOpenGEMM
512-28-28-3x3-512-56-56-32-1x1-2x2-1x1-0-NCHW-FP32-W_g32=miopenConvolutionBwdWeightsAlgoDirect:ConvAsmBwdWrW3x3,0,903138,0,miopenConvolutionBwdWeightsAlgoDirect;miopenConvolutionBwdWeightsAlgoGEMM:gemm,18,7343,14450688,MIOpenGEMM
1024-14-14-1x1-2048-7-7-128-0x0-2x2-1x1-0-NCHW-FP32-F=miopenConvolutionFwdAlgoGEMM:GemmFwd1x1_0_2,5,1418,77070336,MIOpenGEMM;miopenConvolutionFwdAlgoWinograd:ConvBinWinogradRxSf2x3,27,8483,0,miopenConvolutionFwdAlgoWinograd
128-28-28-3x3-128-28-28-128-1x1-1x1-1x1-0-NCHW-FP32-W=miopenConvolutionBwdWeightsAlgoDirect:ConvAsmBwdWrW3x3,3,76406,0,miopenConvolutionBwdWeightsAlgoDirect;miopenConvolutionBwdWeightsAlgoWinograd:ConvBinWinogradRxS,6,20319,0,miopenConvolutionBwdWeightsAlgoWinograd;miopenConvolutionBwdWeightsAlgoImplicitGEMM:ConvHipImplicitGemmV4R1WrW,13,4884,0,miopenConvolutionBwdWeightsAlgoImplicitGEMM;miopenConvolutionBwdWeightsAlgoGEMM:gemm,96,6434,3612672,MIOpenGEMM
64-56-56-1x1-256-56-56-128-0x0-1x1-1x1-0-NCHW-FP32-B=miopenConvolutionBwdDataAlgoDirect:ConvAsm1x1U,1,95221,0,miopenConvolutionBwdDataAlgoDirect;miopenConvolutionBwdDataAlgoWinograd:ConvBinWinogradRxSf3x2,3,28325,0,miopenConvolutionBwdDataAlgoWinograd;miopenConvolutionBwdDataAlgoGEMM:gemm,3,68907,0,MIOpenGEMM
512-28-28-3x3-512-56-56-32-1x1-2x2-1x1-0-NCHW-FP32-B_g32=miopenConvolutionBwdDataAlgoWinograd:ConvBinWinogradRxSf2x3,1,42402,0,miopenConvolutionBwdDataAlgoWinograd;miopenConvolutionBwdDataAlgoDirect:ConvOclDirectFwd,2,6045,0,miopenConvolutionBwdDataAlgoDirect;miopenConvolutionBwdDataAlgoGEMM:gemm,10,5096,14450688,MIOpenGEMM
1024-14-14-1x1-256-14-14-128-0x0-1x1-1x1-0-NCHW-FP32-W=miopenConvolutionBwdWeightsAlgoDirect:ConvAsmBwdWrW1x1,1,93735,0,miopenConvolutionBwdWeightsAlgoDirect;miopenConvolutionBwdWeightsAlgoWinograd:ConvBinWinogradRxSf2x3,5,58495,0,miopenConvolutionBwdWeightsAlgoWinograd;miopenConvolutionBwdWeightsAlgoGEMM:gemm,9,11917,0,MIOpenGEMM
256-14-14-1x1-512-28-28-128-0x0-2x2-1x1-0-NCHW-FP32-W=miopenConvolutionBwdWeightsAlgoDirect:ConvOclBwdWrW1x1,1,96017,51380224,miopenConvolutionBwdWeightsAlgoDirect;miopenConvolutionBwdWeightsAlgoImplicitGEMM:ConvHipImplicitGemmV4R1WrW,4,17082,0,miopenConvolutionBwdWeightsAlgoImplicitGEMM;miopenConvolutionBwdWeightsAlgoGEMM:gemm,18,1175,401408,MIOpenGEMM
128-28-28-3x3-128-28-28-128-1x1-1x1-1x1-0-NCHW-FP32-B=miopenConvolutionBwdDataAlgoWinograd:ConvBinWinograd3x3U,1,26224,0,miopenConvolutionBwdDataAlgoWinograd
384-13-13-3x3-384-13-13-512-1x1-1x1-1x1-0-NCHW-FP32-F=miopenConvolutionFwdAlgoWinograd:ConvBinWinograd3x3U,11,2869,0,miopenConvolutionFwdAlgoWinograd
128-28-28-3x3-128-28-28-128-1x1-1x1-1x1-0-NCHW-FP32-F=miopenConvolutionFwdAlgoWinograd:ConvBinWinograd3x3U,1,30367,0,miopenConvolutionFwdAlgoWinograd
384-13-13-3x3-384-13-13-512-1x1-1x1-1x1-0-NCHW-FP32-B=miopenConvolutionBwdDataAlgoWinograd:ConvBinWinograd3x3U,11,1988,0,miopenConvolutionBwdDataAlgoWinograd
512-7-7-1x1-1024-14-14-128-0x0-2x2-1x1-0-NCHW-FP32-B=miopenConvolutionBwdDataAlgoDirect:ConvAsm1x1UV2,0,819547,0,miopenConvolutionBwdDataAlgoDirect;miopenConvolutionBwdDataAlgoGEMM:gemm,2,24352,38535168,MIOpenGEMM;miopenConvolutionBwdDataAlgoWinograd:ConvBinWinogradRxSf2x3,6,81853,0,miopenConvolutionBwdDataAlgoWinograd
512-28-28-1x1-256-14-14-128-0x0-2x2-1x1-0-NCHW-FP32-F=miopenConvolutionFwdAlgoDirect:ConvAsm1x1UV2,1,1257,0,miopenConvolutionFwdAlgoDirect;miopenConvolutionFwdAlgoWinograd:ConvBinWinogradRxS,5,12908,0,miopenConvolutionFwdAlgoWinograd
512-7-7-1x1-1024-14-14-128-0x0-2x2-1x1-0-NCHW-FP32-W=miopenConvolutionBwdWeightsAlgoDirect:ConvAsmBwdWrW1x1,1,39323,25690112,miopenConvolutionBwdWeightsAlgoDirect;miopenConvolutionBwdWeightsAlgoImplicitGEMM:ConvHipImplicitGemmV4R1WrW,1,53306,0,miopenConvolutionBwdWeightsAlgoImplicitGEMM;miopenConvolutionBwdWeightsAlgoGEMM:gemm,27,1596,200704,MIOpenGEMM
256-56-56-1x1-64-56-56-128-0x0-1x1-1x1-0-NCHW-FP32-F=miopenConvolutionFwdAlgoDirect:ConvOclDirectFwd1x1,1,37607,0,miopenConvolutionFwdAlgoDirect;miopenConvolutionFwdAlgoWinograd:ConvBinWinogradRxSf3x2,2,79105,0,miopenConvolutionFwdAlgoWinograd;miopenConvolutionFwdAlgoGEMM:GemmFwd1x1_0_1,3,88643,0,MIOpenGEMM
512-56-56-3x3-512-28-28-32-1x1-2x2-1x1-0-NCHW-FP32-F_g32=miopenConvolutionFwdAlgoImplicitGEMM:ConvHipImplicitGemmV4R1Fwd,1,54244,0,miopenConvolutionFwdAlgoImplicitGEMM;miopenConvolutionFwdAlgoWinograd:ConvBinWinogradRxSf2x3,1,7215,0,miopenConvolutionFwdAlgoWinograd;miopenConvolutionFwdAlgoDirect:ConvOclDirectFwd,3,3207,0,miopenConvolutionFwdAlgoDirect;miopenConvolutionFwdAlgoGEMM:GemmFwdRest,11,1058,14450688,MIOpenGEMM
64-56-56-3x3-64-56-56-128-1x1-1x1-1x1-0-NCHW-FP32-W=miopenConvolutionBwdWeightsAlgoDirect:ConvAsmBwdWrW3x3,3,32735,0,miopenConvolutionBwdWeightsAlgoDirect;miopenConvolutionBwdWeightsAlgoWinograd:ConvBinWinogradRxSf2x3,12,7974,0,miopenConvolutionBwdWeightsAlgoWinograd;miopenConvolutionBwdWeightsAlgoGEMM:gemm,39,1083,7225344,MIOpenGEMM;miopenConvolutionBwdWeightsAlgoImplicitGEMM:ConvHipImplicitGemmV4R1WrW,47,3208,0,miopenConvolutionBwdWeightsAlgoImplicitGEMM
64-27-27-5x5-192-27-27-512-2x2-1x1-1x1-0-NCHW-FP32-F=miopenConvolutionFwdAlgoFFT:fft,10,6274,856195072,miopenConvolutionFwdAlgoFFT;miopenConvolutionFwdAlgoWinograd:ConvBinWinogradRxSf2x3,16,2026,0,miopenConvolutionFwdAlgoWinograd;miopenConvolutionFwdAlgoImplicitGEMM:ConvHipImplicitGemmV4R1Fwd,22,5155,0,miopenConvolutionFwdAlgoImplicitGEMM;miopenConvolutionFwdAlgoDirect:ConvOclDirectFwd,44,5223,0,miopenConvolutionFwdAlgoDirect;miopenConvolutionFwdAlgoGEMM:GemmFwdRest,74,5764,4665600,MIOpenGEMM
256-56-56-3x3-128-56-56-128-1x1-1x1-1x1-0-NCHW-FP32-B=miopenConvolutionBwdDataAlgoWinograd:ConvBinWinograd3x3U,10,3402,0,miopenConvolutionBwdDataAlgoWinograd
512-14-14-3x3-512-14-14-128-1x1-1x1-1x1-0-NCHW-FP32-F=miopenConvolutionFwdAlgoWinograd:ConvBinWinogradRxS,5,20297,0,miopenConvolutionFwdAlgoWinograd
512-28-28-1x1-256-56-56-128-0x0-2x2-1x1-0-NCHW-FP32-W=miopenConvolutionBwdWeightsAlgoDirect:ConvAsmBwdWrW1x1,4,7353,102760448,miopenConvolutionBwdWeightsAlgoDirect;miopenConvolutionBwdWeightsAlgoImplicitGEMM:ConvHipImplicitGemmV4R1WrW,11,6417,0,miopenConvolutionBwdWeightsAlgoImplicitGEMM;miopenConvolutionBwdWeightsAlgoGEMM:gemm,15,7624,802816,MIOpenGEMM
256-13-13-3x3-384-13-13-512-1x1-1x1-1x1-0-NCHW-FP32-W=miopenConvolutionBwdWeightsAlgoWinograd:ConvBinWinogradRxS,23,6815,0,miopenConvolutionBwdWeightsAlgoWinograd;miopenConvolutionBwdWeightsAlgoDirect:ConvAsmBwdWrW3x3,27,6296,0,miopenConvolutionBwdWeightsAlgoDirect;miopenConvolutionBwdWeightsAlgoImplicitGEMM:ConvHipImplicitGemmV4R1WrW,39,2361,0,miopenConvolutionBwdWeightsAlgoImplicitGEMM;miopenConvolutionBwdWeightsAlgoGEMM:gemm,1348,24,2336256,MIOpenGEMM
256-56-56-1x1-64-56-56-128-0x0-1x1-1x1-0-NCHW-FP32-W=miopenConvolutionBwdWeightsAlgoDirect:ConvAsmBwdWrW1x1,3,784,0,miopenConvolutionBwdWeightsAlgoDirect
128-28-28-1x1-512-28-28-128-0x0-1x1-1x1-0-NCHW-FP32-W=miopenConvolutionBwdWeightsAlgoDirect:ConvAsmBwdWrW1x1,1,7022,0,miopenConvolutionBwdWeightsAlgoDirect
128-56-56-3x3-256-56-56-128-1x1-1x1-1x1-0-NCHW-FP32-F=miopenConvolutionFwdAlgoWinograd:ConvBinWinograd3x3U,10,611,0,miopenConvolutionFwdAlgoWinograd
512-28-28-1x1-256-56-56-128-0x0-2x2-1x1-0-NCHW-FP32-B=miopenConvolutionBwdDataAlgoDirect:ConvAsm1x1UV2,2,76529,0,miopenConvolutionBwdDataAlgoDirect;miopenConvolutionBwdDataAlgoGEMM:gemm,6,59963,308281344,MIOpenGEMM;miopenConvolutionBwdDataAlgoWinograd:ConvBinWinogradRxSf2x3,32,3333,0,miopenConvolutionBwdDataAlgoWinograd
256-14-14-1x1-1024-14-14-128-0x0-1x1-1x1-0-NCHW-FP32-F=miopenConvolutionFwdAlgoDirect:ConvOclDirectFwd1x1,1,45824,0,miopenConvolutionFwdAlgoDirect;miopenConvolutionFwdAlgoWinograd:ConvBinWinogradRxSf3x2,2,91538,0,miopenConvolutionFwdAlgoWinograd;miopenConvolutionFwdAlgoGEMM:GemmFwd1x1_0_1,3,77382,0,MIOpenGEMM
1024-14-14-1x1-512-7-7-128-0x0-2x2-1x1-0-NCHW-FP32-F=miopenConvolutionFwdAlgoGEMM:GemmFwd1x1_0_2,1,203,38535168,MIOpenGEMM;miopenConvolutionFwdAlgoWinograd:ConvBinWinogradRxS,6,30039,0,miopenConvolutionFwdAlgoWinograd
384-13-13-3x3-384-13-13-512-1x1-1x1-1x1-0-NCHW-FP32-W=miopenConvolutionBwdWeightsAlgoWinograd:ConvBinWinogradRxS,19,7365,0,miopenConvolutionBwdWeightsAlgoWinograd;miopenConvolutionBwdWeightsAlgoDirect:ConvAsmBwdWrW3x3,25,2877,0,miopenConvolutionBwdWeightsAlgoDirect;miopenConvolutionBwdWeightsAlgoImplicitGEMM:ConvHipImplicitGemmV4R1WrW,29,4536,0,miopenConvolutionBwdWeightsAlgoImplicitGEMM;miopenConvolutionBwdWeightsAlgoGEMM:gemm,568,745,2336256,MIOpenGEMM
512-7-7-1x1-2048-7-7-128-0x0-1x1-1x1-0-NCHW-FP32-B=miopenConvolutionBwdDataAlgoDirect:ConvAsm1x1U,1,52079,0,miopenConvolutionBwdDataAlgoDirect;miopenConvolutionBwdDataAlgoWinograd:ConvBinWinogradRxSf3x2,3,86684,0,miopenConvolutionBwdDataAlgoWinograd;miopenConvolutionBwdDataAlgoGEMM:gemm,6,455,0,MIOpenGEMM
64-224-224-3x3-64-224-224-128-1x1-1x1-1x1-0-NCHW-FP32-B=miopenConvolutionBwdDataAlgoWinograd:ConvBinWinograd3x3U,23,3966,0,miopenConvolutionBwdDataAlgoWinograd
128-28-28-1x1-512-28-28-128-0x0-1x1-1x1-0-NCHW-FP32-B=miopenConvolutionBwdDataAlgoDirect:ConvAsm1x1U,2,3141,0,miopenConvolutionBwdDataAlgoDirect;miopenConvolutionBwdDataAlgoWinograd:ConvBinWinogradRxSf3x2,3,25402,0,miopenConvolutionBwdDataAlgoWinograd;miopenConvolutionBwdDataAlgoGEMM:gemm,3,81189,0,MIOpenGEMM
256-14-14-1x1-512-28-28-128-0x0-2x2-1x1-0-NCHW-FP32-B=miopenConvolutionBwdDataAlgoDirect:ConvAsm1x1UV2,0,889163,0,miopenConvolutionBwdDataAlgoDirect;miopenConvolutionBwdDataAlgoWinograd:ConvBinWinogradRxSf2x3,6,1993,0,miopenConvolutionBwdDataAlgoWinograd
512-7-7-3x3-512-7-7-128-1x1-1x1-1x1-0-NCHW-FP32-W=miopenConvolutionBwdWeightsAlgoWinograd:ConvBinWinogradRxS,2,2448,0,miopenConvolutionBwdWeightsAlgoWinograd;miopenConvolutionBwdWeightsAlgoDirect:ConvAsmBwdWrW3x3,2,93264,0,miopenConvolutionBwdWeightsAlgoDirect;miopenConvolutionBwdWeightsAlgoImplicitGEMM:ConvHipImplicitGemmV4R1WrW,3,48638,0,miopenConvolutionBwdWeightsAlgoImplicitGEMM;miopenConvolutionBwdWeightsAlgoGEMM:gemm,25,54,903168,MIOpenGEMM
64-224-224-3x3-3-224-224-128-1x1-1x1-1x1-0-NCHW-FP32-W=miopenConvolutionBwdWeightsAlgoDirect:ConvAsmBwdWrW3x3,5,64998,0,miopenConvolutionBwdWeightsAlgoDirect;miopenConvolutionBwdWeightsAlgoGEMM:gemm,218,444,5419008,MIOpenGEMM;miopenConvolutionBwdWeightsAlgoWinograd:ConvBinWinogradRxSf2x3,366,712,0,miopenConvolutionBwdWeightsAlgoWinograd
1024-14-14-1x1-512-28-28-128-0x0-2x2-1x1-0-NCHW-FP32-W=miopenConvolutionBwdWeightsAlgoDirect:ConvAsmBwdWrW1x1,3,4222,51380224,miopenConvolutionBwdWeightsAlgoDirect;miopenConvolutionBwdWeightsAlgoImplicitGEMM:ConvHipImplicitGemmV4R1WrW,4,40612,0,miopenConvolutionBwdWeightsAlgoImplicitGEMM;miopenConvolutionBwdWeightsAlgoGEMM:gemm,26,2482,401408,MIOpenGEMM
128-28-28-1x1-256-56-56-128-0x0-2x2-1x1-0-NCHW-FP32-W=miopenConvolutionBwdWeightsAlgoDirect:ConvAsmBwdWrW1x1,1,96564,102760448,miopenConvolutionBwdWeightsAlgoDirect;miopenConvolutionBwdWeightsAlgoImplicitGEMM:ConvHipImplicitGemmV4R1WrW,12,976,0,miopenConvolutionBwdWeightsAlgoImplicitGEMM;miopenConvolutionBwdWeightsAlgoGEMM:gemm,21,4665,802816,MIOpenGEMM
64-224-224-3x3-64-224-224-128-1x1-1x1-1x1-0-NCHW-FP32-F=miopenConvolutionFwdAlgoWinograd:ConvBinWinograd3x3U,22,3341,0,miopenConvolutionFwdAlgoWinograd
64-56-56-1x1-256-56-56-128-0x0-1x1-1x1-0-NCHW-FP32-F=miopenConvolutionFwdAlgoDirect:ConvOclDirectFwd1x1,1,30783,0,miopenConvolutionFwdAlgoDirect
512-7-7-3x3-512-7-7-128-1x1-1x1-1x1-0-NCHW-FP32-B=miopenConvolutionBwdDataAlgoWinograd:ConvBinWinograd3x3U,1,60824,0,miopenConvolutionBwdDataAlgoWinograd
3-224-224-3x3-64-224-224-128-1x1-1x1-1x1-0-NCHW-FP32-F=miopenConvolutionFwdAlgoWinograd:ConvBinWinogradRxSf2x3,4,86952,0,miopenConvolutionFwdAlgoWinograd;miopenConvolutionFwdAlgoDirect:ConvOclDirectFwd,9,6876,0,miopenConvolutionFwdAlgoDirect;miopenConvolutionFwdAlgoGEMM:GemmFwdRest,43,3238,5419008,MIOpenGEMM
128-112-112-3x3-64-112-112-128-1x1-1x1-1x1-0-NCHW-FP32-B=miopenConvolutionBwdDataAlgoWinograd:ConvBinWinogradRxSf2x3,10,8221,0,miopenConvolutionBwdDataAlgoWinograd
128-112-112-3x3-128-112-112-128-1x1-1x1-1x1-0-NCHW-FP32-W=miopenConvolutionBwdWeightsAlgoDirect:ConvAsmBwdWrW3x3,70,7451,0,miopenConvolutionBwdWeightsAlgoDirect;miopenConvolutionBwdWeightsAlgoWinograd:ConvBinWinogradRxS,149,959,0,miopenConvolutionBwdWeightsAlgoWinograd;miopenConvolutionBwdWeightsAlgoImplicitGEMM:ConvHipImplicitGemmV4R1WrW,255,249,0,miopenConvolutionBwdWeightsAlgoImplicitGEMM;miopenConvolutionBwdWeightsAlgoGEMM:gemm,695,736,57802752,MIOpenGEMM
512-28-28-1x1-128-28-28-128-0x0-1x1-1x1-0-NCHW-FP32-F=miopenConvolutionFwdAlgoDirect:ConvAsm1x1U,1,48635,0,miopenConvolutionFwdAlgoDirect;miopenConvolutionFwdAlgoWinograd:ConvBinWinogradRxSf3x2,2,70023,0,miopenConvolutionFwdAlgoWinograd;miopenConvolutionFwdAlgoGEMM:GemmFwd1x1_0_1,4,24859,0,MIOpenGEMM
256-13-13-3x3-384-13-13-512-1x1-1x1-1x1-0-NCHW-FP32-B=miopenConvolutionBwdDataAlgoWinograd:ConvBinWinograd3x3U,7,93888,0,miopenConvolutionBwdDataAlgoWinograd
256-28-28-1x1-128-28-28-128-0x0-1x1-1x1-0-NCHW-FP32-F=miopenConvolutionFwdAlgoDirect:ConvAsm1x1U,0,867225,0,miopenConvolutionFwdAlgoDirect;miopenConvolutionFwdAlgoWinograd:ConvBinWinogradRxSf3x2,1,4812,0,miopenConvolutionFwdAlgoWinograd;miopenConvolutionFwdAlgoGEMM:GemmFwd1x1_0_1,2,64956,0,MIOpenGEMM
224-14-14-3x3-112-14-14-128-1x1-1x1-1x1-0-NCHW-FP32-W=miopenConvolutionBwdWeightsAlgoDirect:ConvAsmBwdWrW3x3,1,43566,0,miopenConvolutionBwdWeightsAlgoDirect;miopenConvolutionBwdWeightsAlgoWinograd:ConvBinWinogradRxSf2x3,1,58863,0,miopenConvolutionBwdWeightsAlgoWinograd;miopenConvolutionBwdWeightsAlgoGEMM:gemm,5,9561,790272,MIOpenGEMM
128-112-112-3x3-128-112-112-128-1x1-1x1-1x1-0-NCHW-FP32-B=miopenConvolutionBwdDataAlgoWinograd:ConvBinWinograd3x3U,20,6163,0,miopenConvolutionBwdDataAlgoWinograd
320-7-7-3x3-160-7-7-128-1x1-1x1-1x1-0-NCHW-FP32-B=miopenConvolutionBwdDataAlgoWinograd:ConvBinWinogradRxS,0,3152,0,miopenConvolutionBwdDataAlgoWinograd
16-14-14-5x5-48-14-14-128-2x2-1x1-1x1-0-NCHW-FP32-F=miopenConvolutionFwdAlgoWinograd:ConvBinWinogradRxSf2x3,0,130669,0,miopenConvolutionFwdAlgoWinograd;miopenConvolutionFwdAlgoImplicitGEMM:ConvHipImplicitGemmV4R1Fwd,0,249821,0,miopenConvolutionFwdAlgoImplicitGEMM;miopenConvolutionFwdAlgoDirect:ConvOclDirectFwd,0,285314,0,miopenConvolutionFwdAlgoDirect;miopenConvolutionFwdAlgoFFT:fft,0,3801,17879040,miopenConvolutionFwdAlgoFFT;miopenConvolutionFwdAlgoGEMM:GemmFwdRest,4,30899,313600,MIOpenGEMM
512-28-28-3x3-512-28-28-128-1x1-1x1-1x1-0-NCHW-FP32-W=miopenConvolutionBwdWeightsAlgoDirect:ConvAsmBwdWrW3x3,45,5196,0,miopenConvolutionBwdWeightsAlgoDirect;miopenConvolutionBwdWeightsAlgoImplicitGEMM:ConvHipImplicitGemmV4R1WrW,53,7787,0,miopenConvolutionBwdWeightsAlgoImplicitGEMM;miopenConvolutionBwdWeightsAlgoWinograd:ConvBinWinogradRxS,58,6593,0,miopenConvolutionBwdWeightsAlgoWinograd;miopenConvolutionBwdWeightsAlgoGEMM:gemm,79,2947,14450688,MIOpenGEMM
224-14-14-3x3-112-14-14-128-1x1-1x1-1x1-0-NCHW-FP32-B=miopenConvolutionBwdDataAlgoWinograd:ConvBinWinogradRxS,0,586541,0,miopenConvolutionBwdDataAlgoWinograd
64-28-28-1x1-192-28-28-128-0x0-1x1-1x1-0-NCHW-FP32-W=miopenConvolutionBwdWeightsAlgoDirect:ConvAsmBwdWrW1x1,0,637355,0,miopenConvolutionBwdWeightsAlgoDirect
288-14-14-3x3-144-14-14-128-1x1-1x1-1x1-0-NCHW-FP32-W=miopenConvolutionBwdWeightsAlgoWinograd:ConvBinWinogradRxS,2,2457,0,miopenConvolutionBwdWeightsAlgoWinograd;miopenConvolutionBwdWeightsAlgoDirect:ConvAsmBwdWrW3x3,2,38702,0,miopenConvolutionBwdWeightsAlgoDirect;miopenConvolutionBwdWeightsAlgoGEMM:gemm,7,58685,1016064,MIOpenGEMM
160-7-7-3x3-320-7-7-128-1x1-1x1-1x1-0-NCHW-FP32-F=miopenConvolutionFwdAlgoWinograd:ConvBinWinogradRxSf2x3,0,341948,0,miopenConvolutionFwdAlgoWinograd
512-28-28-3x3-256-28-28-128-1x1-1x1-1x1-0-NCHW-FP32-B=miopenConvolutionBwdDataAlgoWinograd:ConvBinWinograd3x3U,10,43,0,miopenConvolutionBwdDataAlgoWinograd
64-14-14-5x5-24-14-14-128-2x2-1x1-1x1-0-NCHW-FP32-W=miopenConvolutionBwdWeightsAlgoDirect:ConvOclBwdWrW53,0,441616,19660800,miopenConvolutionBwdWeightsAlgoDirect;miopenConvolutionBwdWeightsAlgoWinograd:ConvBinWinogradRxSf2x3,0,748382,0,miopenConvolutionBwdWeightsAlgoWinograd;miopenConvolutionBwdWeightsAlgoGEMM:gemm,4,16799,470400,MIOpenGEMM
112-14-14-3x3-224-14-14-128-1x1-1x1-1x1-0-NCHW-FP32-F=miopenConvolutionFwdAlgoWinograd:ConvBinWinograd3x3U,0,559146,0,miopenConvolutionFwdAlgoWinograd
64-112-112-7x7-3-225-225-128-2x2-2x2-1x1-0-NCHW-FP32-B=miopenConvolutionBwdDataAlgoDirect:ConvOclDirectFwd,9,21029,0,miopenConvolutionBwdDataAlgoDirect;miopenConvolutionBwdDataAlgoWinograd:ConvBinWinogradRxS,16,4177,0,miopenConvolutionBwdDataAlgoWinograd;miopenConvolutionBwdDataAlgoGEMM:gemm,43,42,7375872,MIOpenGEMM
320-14-14-3x3-160-14-14-128-1x1-1x1-1x1-0-NCHW-FP32-W=miopenConvolutionBwdWeightsAlgoWinograd:ConvBinWinogradRxS,2,11462,0,miopenConvolutionBwdWeightsAlgoWinograd;miopenConvolutionBwdWeightsAlgoDirect:ConvAsmBwdWrW3x3,2,76794,0,miopenConvolutionBwdWeightsAlgoDirect;miopenConvolutionBwdWeightsAlgoGEMM:gemm,11,6739,1128960,MIOpenGEMM
512-14-14-3x3-512-14-14-128-1x1-1x1-1x1-0-NCHW-FP32-B=miopenConvolutionBwdDataAlgoWinograd:ConvBinWinogradRxS,5,5426,0,miopenConvolutionBwdDataAlgoWinograd
64-14-14-5x5-24-14-14-128-2x2-1x1-1x1-0-NCHW-FP32-B=miopenConvolutionBwdDataAlgoWinograd:ConvBinWinogradRxSf2x3,0,222118,0,miopenConvolutionBwdDataAlgoWinograd;miopenConvolutionBwdDataAlgoFFT:fft,0,321625,28385280,miopenConvolutionBwdDataAlgoFFT;miopenConvolutionBwdDataAlgoDirect:ConvOclDirectFwd,0,470312,0,miopenConvolutionBwdDataAlgoDirect;miopenConvolutionBwdDataAlgoGEMM:gemm,5,35069,470400,MIOpenGEMM
288-14-14-3x3-144-14-14-128-1x1-1x1-1x1-0-NCHW-FP32-B=miopenConvolutionBwdDataAlgoWinograd:ConvBinWinogradRxS,0,928223,0,miopenConvolutionBwdDataAlgoWinograd
256-56-56-3x3-256-56-56-128-1x1-1x1-1x1-0-NCHW-FP32-W=miopenConvolutionBwdWeightsAlgoWinograd:ConvBinWinogradRxS,37,5703,0,miopenConvolutionBwdWeightsAlgoWinograd;miopenConvolutionBwdWeightsAlgoDirect:ConvAsmBwdWrW3x3,43,1428,0,miopenConvolutionBwdWeightsAlgoDirect;miopenConvolutionBwdWeightsAlgoGEMM:gemm,59,8748,28901376,MIOpenGEMM;miopenConvolutionBwdWeightsAlgoImplicitGEMM:ConvHipImplicitGemmV4R1WrW,75,9437,0,miopenConvolutionBwdWeightsAlgoImplicitGEMM
128-112-112-3x3-128-112-112-128-1x1-1x1-1x1-0-NCHW-FP32-F=miopenConvolutionFwdAlgoWinograd:ConvBinWinograd3x3U,20,8955,0,miopenConvolutionFwdAlgoWinograd
320-14-14-3x3-160-14-14-128-1x1-1x1-1x1-0-NCHW-FP32-B=miopenConvolutionBwdDataAlgoWinograd:ConvBinWinogradRxSf2x3,1,1432,0,miopenConvolutionBwdDataAlgoWinograd
3-225-225-7x7-64-112-112-128-2x2-2x2-1x1-0-NCHW-FP32-F=miopenConvolutionFwdAlgoWinograd:ConvBinWinogradRxS,4,53986,0,miopenConvolutionFwdAlgoWinograd;miopenConvolutionFwdAlgoDirect:ConvOclDirectFwd,4,9297,0,miopenConvolutionFwdAlgoDirect;miopenConvolutionFwdAlgoGEMM:GemmFwdRest,8,42573,7375872,MIOpenGEMM
64-28-28-1x1-192-28-28-128-0x0-1x1-1x1-0-NCHW-FP32-B=miopenConvolutionBwdDataAlgoDirect:ConvAsm1x1U,0,435806,0,miopenConvolutionBwdDataAlgoDirect;miopenConvolutionBwdDataAlgoWinograd:ConvBinWinogradRxSf3x2,0,684907,0,miopenConvolutionBwdDataAlgoWinograd;miopenConvolutionBwdDataAlgoGEMM:gemm,2,69376,0,MIOpenGEMM
192-14-14-1x1-480-14-14-128-0x0-1x1-1x1-0-NCHW-FP32-B=miopenConvolutionBwdDataAlgoDirect:ConvAsm1x1U,0,724313,0,miopenConvolutionBwdDataAlgoDirect;miopenConvolutionBwdDataAlgoGEMM:gemm,2,8883,0,MIOpenGEMM
128-112-112-3x3-64-112-112-128-1x1-1x1-1x1-0-NCHW-FP32-W=miopenConvolutionBwdWeightsAlgoDirect:ConvAsmBwdWrW3x3,37,1055,0,miopenConvolutionBwdWeightsAlgoDirect;miopenConvolutionBwdWeightsAlgoWinograd:ConvBinWinogradRxSf2x3,92,8261,0,miopenConvolutionBwdWeightsAlgoWinograd;miopenConvolutionBwdWeightsAlgoImplicitGEMM:ConvHipImplicitGemmV4R1WrW,316,886,0,miopenConvolutionBwdWeightsAlgoImplicitGEMM;miopenConvolutionBwdWeightsAlgoGEMM:gemm,1636,1,28901376,MIOpenGEMM
256-56-56-3x3-256-56-56-128-1x1-1x1-1x1-0-NCHW-FP32-B=miopenConvolutionBwdDataAlgoWinograd:ConvBinWinograd3x3U,20,935,0,miopenConvolutionBwdDataAlgoWinograd
144-14-14-3x3-288-14-14-128-1x1-1x1-1x1-0-NCHW-FP32-F=miopenConvolutionFwdAlgoWinograd:ConvBinWinogradRxSf2x3,0,872594,0,miopenConvolutionFwdAlgoWinograd
96-28-28-5x5-32-28-28-128-2x2-1x1-1x1-0-NCHW-FP32-W=miopenConvolutionBwdWeightsAlgoDirect:ConvOclBwdWrW53,1,77305,39321600,miopenConvolutionBwdWeightsAlgoDirect;miopenConvolutionBwdWeightsAlgoWinograd:ConvBinWinogradRxSf2x3,2,59438,0,miopenConvolutionBwdWeightsAlgoWinograd;miopenConvolutionBwdWeightsAlgoGEMM:gemm,6,37952,2508800,MIOpenGEMM
160-14-14-3x3-320-14-14-128-1x1-1x1-1x1-0-NCHW-FP32-F=miopenConvolutionFwdAlgoWinograd:ConvBinWinograd3x3U,1,1913,0,miopenConvolutionFwdAlgoWinograd
64-28-28-1x1-256-28-28-128-0x0-1x1-1x1-0-NCHW-FP32-W=miopenConvolutionBwdWeightsAlgoDirect:ConvAsmBwdWrW1x1,0,652405,0,miopenConvolutionBwdWeightsAlgoDirect
24-14-14-5x5-64-14-14-128-2x2-1x1-1x1-0-NCHW-FP32-F=miopenConvolutionFwdAlgoWinograd:ConvBinWinogradRxSf2x3,0,222267,0,miopenConvolutionFwdAlgoWinograd;miopenConvolutionFwdAlgoImplicitGEMM:ConvHipImplicitGemmV4R1Fwd,0,274435,0,miopenConvolutionFwdAlgoImplicitGEMM;miopenConvolutionFwdAlgoDirect:ConvOclDirectFwd,0,479974,0,miopenConvolutionFwdAlgoDirect;miopenConvolutionFwdAlgoFFT:fft,0,504967,23777280,miopenConvolutionFwdAlgoFFT;miopenConvolutionFwdAlgoGEMM:GemmFwdRest,5,28694,470400,MIOpenGEMM
256-56-56-3x3-256-56-56-128-1x1-1x1-1x1-0-NCHW-FP32-F=miopenConvolutionFwdAlgoWinograd:ConvBinWinograd3x3U,19,3155,0,miopenConvolutionFwdAlgoWinograd
64-28-28-1x1-256-28-28-128-0x0-1x1-1x1-0-NCHW-FP32-B=miopenConvolutionBwdDataAlgoDirect:ConvAsm1x1U,0,612509,0,miopenConvolutionBwdDataAlgoDirect;miopenConvolutionBwdDataAlgoWinograd:ConvBinWinogradRxSf3x2,0,913365,0,miopenConvolutionBwdDataAlgoWinograd;miopenConvolutionBwdDataAlgoGEMM:gemm,2,6602,0,MIOpenGEMM
512-14-14-1x1-128-14-14-128-0x0-1x1-1x1-0-NCHW-FP32-F=miopenConvolutionFwdAlgoDirect:ConvOclDirectFwd1x1,0,41356,0,miopenConvolutionFwdAlgoDirect;miopenConvolutionFwdAlgoWinograd:ConvBinWinogradRxSf3x2,0,838829,0,miopenConvolutionFwdAlgoWinograd;miopenConvolutionFwdAlgoGEMM:GemmFwd1x1_0_1,4,43422,0,MIOpenGEMM
480-14-14-1x1-192-14-14-128-0x0-1x1-1x1-0-NCHW-FP32-F=miopenConvolutionFwdAlgoDirect:ConvAsm1x1U,0,664813,0,miopenConvolutionFwdAlgoDirect;miopenConvolutionFwdAlgoWinograd:ConvBinWinogradRxSf3x2,1,15925,0,miopenConvolutionFwdAlgoWinograd;miopenConvolutionFwdAlgoGEMM:GemmFwd1x1_0_1,4,16088,0,MIOpenGEMM
512-28-28-3x3-512-28-28-128-1x1-1x1-1x1-0-NCHW-FP32-F=miopenConvolutionFwdAlgoWinograd:ConvBinWinograd3x3U,20,354,0,miopenConvolutionFwdAlgoWinograd
32-28-28-5x5-16-28-28-128-2x2-1x1-1x1-0-NCHW-FP32-W=miopenConvolutionBwdWeightsAlgoDirect:ConvOclBwdWrW53,0,367229,6553600,miopenConvolutionBwdWeightsAlgoDirect;miopenConvolutionBwdWeightsAlgoWinograd:ConvBinWinogradRxSf2x3,2,66158,0,miopenConvolutionBwdWeightsAlgoWinograd;miopenConvolutionBwdWeightsAlgoGEMM:gemm,3,50171,1254400,MIOpenGEMM
192-28-28-3x3-128-28-28-128-1x1-1x1-1x1-0-NCHW-FP32-W=miopenConvolutionBwdWeightsAlgoDirect:ConvAsmBwdWrW3x3,4,78109,0,miopenConvolutionBwdWeightsAlgoDirect;miopenConvolutionBwdWeightsAlgoWinograd:ConvBinWinogradRxS,5,80039,0,miopenConvolutionBwdWeightsAlgoWinograd;miopenConvolutionBwdWeightsAlgoImplicitGEMM:ConvHipImplicitGemmV4R1WrW,11,1493,0,miopenConvolutionBwdWeightsAlgoImplicitGEMM;miopenConvolutionBwdWeightsAlgoGEMM:gemm,16,6254,3612672,MIOpenGEMM
96-28-28-5x5-32-28-28-128-2x2-1x1-1x1-0-NCHW-FP32-B=miopenConvolutionBwdDataAlgoWinograd:ConvBinWinogradRxS,0,974391,0,miopenConvolutionBwdDataAlgoWinograd;miopenConvolutionBwdDataAlgoFFT:fft,0,990657,134807552,miopenConvolutionBwdDataAlgoFFT;miopenConvolutionBwdDataAlgoDirect:ConvOclDirectFwd,3,2302,0,miopenConvolutionBwdDataAlgoDirect;miopenConvolutionBwdDataAlgoImplicitGEMM:ConvHipImplicitGemmBwdDataV1R1,5,52392,0,miopenConvolutionBwdDataAlgoImplicitGEMM;miopenConvolutionBwdDataAlgoGEMM:gemm,7,16978,2508800,MIOpenGEMM
192-28-28-1x1-64-28-28-128-0x0-1x1-1x1-0-NCHW-FP32-F=miopenConvolutionFwdAlgoDirect:ConvOclDirectFwd1x1,0,24961,0,miopenConvolutionFwdAlgoDirect;miopenConvolutionFwdAlgoWinograd:ConvBinWinogradRxSf3x2,0,537324,0,miopenConvolutionFwdAlgoWinograd;miopenConvolutionFwdAlgoGEMM:GemmFwd1x1_0_1,1,82737,0,MIOpenGEMM
32-28-28-5x5-16-28-28-128-2x2-1x1-1x1-0-NCHW-FP32-B=miopenConvolutionBwdDataAlgoFFT:fft,0,33277,41222144,miopenConvolutionBwdDataAlgoFFT;miopenConvolutionBwdDataAlgoWinograd:ConvBinWinogradRxS,0,3482,0,miopenConvolutionBwdDataAlgoWinograd;miopenConvolutionBwdDataAlgoDirect:ConvOclDirectFwd,0,478798,0,miopenConvolutionBwdDataAlgoDirect;miopenConvolutionBwdDataAlgoGEMM:gemm,5,82,1254400,MIOpenGEMM
384-7-7-3x3-192-7-7-128-1x1-1x1-1x1-0-NCHW-FP32-W=miopenConvolutionBwdWeightsAlgoDirect:ConvAsmBwdWrW3x3,0,909536,0,miopenConvolutionBwdWeightsAlgoDirect;miopenConvolutionBwdWeightsAlgoWinograd:ConvBinWinogradRxS,0,994882,0,miopenConvolutionBwdWeightsAlgoWinograd;miopenConvolutionBwdWeightsAlgoImplicitGEMM:ConvHipImplicitGemmV4R1WrW,1,37953,0,miopenConvolutionBwdWeightsAlgoImplicitGEMM;miopenConvolutionBwdWeightsAlgoGEMM:gemm,10,3723,338688,MIOpenGEMM
512-28-28-3x3-256-28-28-128-1x1-1x1-1x1-0-NCHW-FP32-W=miopenConvolutionBwdWeightsAlgoWinograd:ConvBinWinogradRxS,19,338,0,miopenConvolutionBwdWeightsAlgoWinograd;miopenConvolutionBwdWeightsAlgoDirect:ConvAsmBwdWrW3x3,25,6423,0,miopenConvolutionBwdWeightsAlgoDirect;miopenConvolutionBwdWeightsAlgoImplicitGEMM:ConvHipImplicitGemmV4R1WrW,32,9757,0,miopenConvolutionBwdWeightsAlgoImplicitGEMM;miopenConvolutionBwdWeightsAlgoGEMM:gemm,95,9446,7225344,MIOpenGEMM
112-14-14-1x1-512-14-14-128-0x0-1x1-1x1-0-NCHW-FP32-W=miopenConvolutionBwdWeightsAlgoDirect:ConvAsmBwdWrW1x1,0,476006,0,miopenConvolutionBwdWeightsAlgoDirect
24-14-14-1x1-512-14-14-128-0x0-1x1-1x1-0-NCHW-FP32-B=miopenConvolutionBwdDataAlgoDirect:ConvAsm1x1U,0,108333,0,miopenConvolutionBwdDataAlgoDirect;miopenConvolutionBwdDataAlgoWinograd:ConvBinWinogradRxSf3x2,0,268781,0,miopenConvolutionBwdDataAlgoWinograd;miopenConvolutionBwdDataAlgoGEMM:gemm,0,767021,0,MIOpenGEMM
64-112-112-3x3-128-112-112-128-1x1-1x1-1x1-0-NCHW-FP32-F=miopenConvolutionFwdAlgoWinograd:ConvBinWinograd3x3U,10,6532,0,miopenConvolutionFwdAlgoWinograd
16-14-14-1x1-480-14-14-128-0x0-1x1-1x1-0-NCHW-FP32-W=miopenConvolutionBwdWeightsAlgoDirect:ConvAsmBwdWrW1x1,0,137096,0,miopenConvolutionBwdWeightsAlgoDirect;miopenConvolutionBwdWeightsAlgoWinograd:ConvBinWinogradRxSf2x3,0,818416,0,miopenConvolutionBwdWeightsAlgoWinograd;miopenConvolutionBwdWeightsAlgoGEMM:gemm,1,21958,0,MIOpenGEMM
192-28-28-3x3-128-28-28-128-1x1-1x1-1x1-0-NCHW-FP32-B=miopenConvolutionBwdDataAlgoWinograd:ConvBinWinogradRxS,1,83192,0,miopenConvolutionBwdDataAlgoWinograd
512-14-14-3x3-512-14-14-128-1x1-1x1-1x1-0-NCHW-FP32-W=miopenConvolutionBwdWeightsAlgoDirect:ConvAsmBwdWrW3x3,13,7124,0,miopenConvolutionBwdWeightsAlgoDirect;miopenConvolutionBwdWeightsAlgoWinograd:ConvBinWinogradRxS,14,2979,0,miopenConvolutionBwdWeightsAlgoWinograd;miopenConvolutionBwdWeightsAlgoImplicitGEMM:ConvHipImplicitGemmV4R1WrW,43,2389,0,miopenConvolutionBwdWeightsAlgoImplicitGEMM;miopenConvolutionBwdWeightsAlgoGEMM:gemm,636,652,3612672,MIOpenGEMM
256-28-28-1x1-64-28-28-128-0x0-1x1-1x1-0-NCHW-FP32-F=miopenConvolutionFwdAlgoDirect:ConvOclDirectFwd1x1,0,405403,0,miopenConvolutionFwdAlgoDirect;miopenConvolutionFwdAlgoWinograd:ConvBinWinogradRxSf3x2,0,913314,0,miopenConvolutionFwdAlgoWinograd;miopenConvolutionFwdAlgoGEMM:GemmFwd1x1_0_1,3,8188,0,MIOpenGEMM
32-28-28-5x5-96-28-28-128-2x2-1x1-1x1-0-NCHW-FP32-F=miopenConvolutionFwdAlgoFFT:fft,1,219,107511808,miopenConvolutionFwdAlgoFFT;miopenConvolutionFwdAlgoWinograd:ConvBinWinogradRxS,1,8192,0,miopenConvolutionFwdAlgoWinograd;miopenConvolutionFwdAlgoImplicitGEMM:ConvHipImplicitGemmV4R1Fwd,1,74633,0,miopenConvolutionFwdAlgoImplicitGEMM;miopenConvolutionFwdAlgoDirect:ConvOclDirectFwd,2,94922,0,miopenConvolutionFwdAlgoDirect;miopenConvolutionFwdAlgoGEMM:GemmFwdRest,6,91059,2508800,MIOpenGEMM
384-7-7-3x3-192-7-7-128-1x1-1x1-1x1-0-NCHW-FP32-B=miopenConvolutionBwdDataAlgoWinograd:ConvBinWinogradRxS,0,484533,0,miopenConvolutionBwdDataAlgoWinograd
512-14-14-1x1-24-14-14-128-0x0-1x1-1x1-0-NCHW-FP32-F=miopenConvolutionFwdAlgoDirect:ConvOclDirectFwd1x1,0,208152,0,miopenConvolutionFwdAlgoDirect;miopenConvolutionFwdAlgoWinograd:ConvBinWinogradRxSf3x2,0,246402,0,miopenConvolutionFwdAlgoWinograd;miopenConvolutionFwdAlgoGEMM:GemmFwd1x1_0_1,1,61909,0,MIOpenGEMM
16-14-14-1x1-480-14-14-128-0x0-1x1-1x1-0-NCHW-FP32-B=miopenConvolutionBwdDataAlgoDirect:ConvOclDirectFwd1x1,0,276799,0,miopenConvolutionBwdDataAlgoDirect;miopenConvolutionBwdDataAlgoGEMM:gemm,1,20564,0,MIOpenGEMM
192-7-7-3x3-384-7-7-128-1x1-1x1-1x1-0-NCHW-FP32-F=miopenConvolutionFwdAlgoWinograd:ConvBinWinogradRxSf2x3,0,509421,0,miopenConvolutionFwdAlgoWinograd
112-14-14-1x1-512-14-14-128-0x0-1x1-1x1-0-NCHW-FP32-B=miopenConvolutionBwdDataAlgoDirect:ConvAsm1x1U,0,527102,0,miopenConvolutionBwdDataAlgoDirect;miopenConvolutionBwdDataAlgoGEMM:gemm,15,11,0,MIOpenGEMM
256-28-28-3x3-512-28-28-128-1x1-1x1-1x1-0-NCHW-FP32-F=miopenConvolutionFwdAlgoWinograd:ConvBinWinograd3x3U,10,1298,0,miopenConvolutionFwdAlgoWinograd
32-28-28-1x1-256-28-28-128-0x0-1x1-1x1-0-NCHW-FP32-W=miopenConvolutionBwdWeightsAlgoDirect:ConvAsmBwdWrW1x1,0,414705,0,miopenConvolutionBwdWeightsAlgoDirect
64-14-14-5x5-32-14-14-128-2x2-1x1-1x1-0-NCHW-FP32-W=miopenConvolutionBwdWeightsAlgoDirect:ConvOclBwdWrW53,0,590233,26214400,miopenConvolutionBwdWeightsAlgoDirect;miopenConvolutionBwdWeightsAlgoWinograd:ConvBinWinogradRxSf2x3,0,802322,0,miopenConvolutionBwdWeightsAlgoWinograd;miopenConvolutionBwdWeightsAlgoGEMM:gemm,3,78532,627200,MIOpenGEMM
32-28-28-1x1-192-28-28-128-0x0-1x1-1x1-0-NCHW-FP32-W=miopenConvolutionBwdWeightsAlgoDirect:ConvAsmBwdWrW1x1,0,327028,0,miopenConvolutionBwdWeightsAlgoDirect
96-28-28-1x1-192-28-28-128-0x0-1x1-1x1-0-NCHW-FP32-W=miopenConvolutionBwdWeightsAlgoDirect:ConvAsmBwdWrW1x1,0,811081,0,miopenConvolutionBwdWeightsAlgoDirect
128-28-28-3x3-192-28-28-128-1x1-1x1-1x1-0-NCHW-FP32-F=miopenConvolutionFwdAlgoWinograd:ConvBinWinogradRxS,1,90037,0,miopenConvolutionFwdAlgoWinograd
160-14-14-1x1-512-14-14-128-0x0-1x1-1x1-0-NCHW-FP32-W=miopenConvolutionBwdWeightsAlgoDirect:ConvAsmBwdWrW1x1,0,805884,0,miopenConvolutionBwdWeightsAlgoDirect
480-14-14-1x1-16-14-14-128-0x0-1x1-1x1-0-NCHW-FP32-F=miopenConvolutionFwdAlgoDirect:ConvOclDirectFwd1x1,0,194012,0,miopenConvolutionFwdAlgoDirect;miopenConvolutionFwdAlgoGEMM:GemmFwd1x1_0_1,1,74084,0,MIOpenGEMM
256-56-56-3x3-128-56-56-128-1x1-1x1-1x1-0-NCHW-FP32-W=miopenConvolutionBwdWeightsAlgoDirect:ConvAsmBwdWrW3x3,22,118,0,miopenConvolutionBwdWeightsAlgoDirect;miopenConvolutionBwdWeightsAlgoWinograd:ConvBinWinogradRxS,29,771,0,miopenConvolutionBwdWeightsAlgoWinograd;miopenConvolutionBwdWeightsAlgoGEMM:gemm,33,1417,14450688,MIOpenGEMM;miopenConvolutionBwdWeightsAlgoImplicitGEMM:ConvHipImplicitGemmV4R1WrW,54,8305,0,miopenConvolutionBwdWeightsAlgoImplicitGEMM
128-7-7-5x5-48-7-7-128-2x2-1x1-1x1-0-NCHW-FP32-W=miopenConvolutionBwdWeightsAlgoWinograd:ConvBinWinogradRxSf2x3,0,429361,0,miopenConvolutionBwdWeightsAlgoWinograd;miopenConvolutionBwdWeightsAlgoDirect:ConvOclBwdWrW2<8>,0,825841,9830400,miopenConvolutionBwdWeightsAlgoDirect;miopenConvolutionBwdWeightsAlgoGEMM:gemm,3,88654,235200,MIOpenGEMM
64-14-14-5x5-32-14-14-128-2x2-1x1-1x1-0-NCHW-FP32-B=miopenConvolutionBwdDataAlgoWinograd:ConvBinWinogradRxSf2x3,0,2365,0,miopenConvolutionBwdDataAlgoWinograd;miopenConvolutionBwdDataAlgoFFT:fft,0,283126,29859840,miopenConvolutionBwdDataAlgoFFT;miopenConvolutionBwdDataAlgoDirect:ConvOclDirectFwd,0,626027,0,miopenConvolutionBwdDataAlgoDirect;miopenConvolutionBwdDataAlgoImplicitGEMM:ConvHipImplicitGemmBwdDataV1R1,1,79398,0,miopenConvolutionBwdDataAlgoImplicitGEMM;miopenConvolutionBwdDataAlgoGEMM:gemm,5,76937,627200,MIOpenGEMM
512-14-14-1x1-112-14-14-128-0x0-1x1-1x1-0-NCHW-FP32-F=miopenConvolutionFwdAlgoDirect:ConvAsm1x1U,0,403077,0,miopenConvolutionFwdAlgoDirect;miopenConvolutionFwdAlgoGEMM:GemmFwd1x1_0_1,4,2091,0,MIOpenGEMM
16-28-28-5x5-32-28-28-128-2x2-1x1-1x1-0-NCHW-FP32-F=miopenConvolutionFwdAlgoWinograd:ConvBinWinogradRxSf2x3,0,222166,0,miopenConvolutionFwdAlgoWinograd;miopenConvolutionFwdAlgoImplicitGEMM:ConvHipImplicitGemmV4R1Fwd,0,368746,0,miopenConvolutionFwdAlgoImplicitGEMM;miopenConvolutionFwdAlgoFFT:fft,0,451624,36208640,miopenConvolutionFwdAlgoFFT;miopenConvolutionFwdAlgoDirect:ConvOclDirectFwd,0,704594,0,miopenConvolutionFwdAlgoDirect;miopenConvolutionFwdAlgoGEMM:GemmFwdRest,10,8193,1254400,MIOpenGEMM
32-28-28-1x1-256-28-28-128-0x0-1x1-1x1-0-NCHW-FP32-B=miopenConvolutionBwdDataAlgoDirect:ConvAsm1x1U,0,284386,0,miopenConvolutionBwdDataAlgoDirect;miopenConvolutionBwdDataAlgoGEMM:gemm,1,58449,0,MIOpenGEMM
528-14-14-1x1-160-14-14-128-0x0-1x1-1x1-0-NCHW-FP32-F=miopenConvolutionFwdAlgoDirect:ConvAsm1x1U,0,717845,0,miopenConvolutionFwdAlgoDirect;miopenConvolutionFwdAlgoGEMM:GemmFwd1x1_0_1,4,57728,0,MIOpenGEMM
128-7-7-5x5-48-7-7-128-2x2-1x1-1x1-0-NCHW-FP32-B=miopenConvolutionBwdDataAlgoWinograd:ConvBinWinogradRxSf2x3,0,226735,0,miopenConvolutionBwdDataAlgoWinograd;miopenConvolutionBwdDataAlgoFFT:fft,0,268137,30449664,miopenConvolutionBwdDataAlgoFFT;miopenConvolutionBwdDataAlgoDirect:ConvOclDirectFwd,0,977576,0,miopenConvolutionBwdDataAlgoDirect;miopenConvolutionBwdDataAlgoGEMM:gemm,4,84224,235200,MIOpenGEMM
96-28-28-1x1-192-28-28-128-0x0-1x1-1x1-0-NCHW-FP32-B=miopenConvolutionBwdDataAlgoDirect:ConvAsm1x1U,0,475628,0,miopenConvolutionBwdDataAlgoDirect;miopenConvolutionBwdDataAlgoGEMM:gemm,28,2281,0,MIOpenGEMM
256-28-28-1x1-32-28-28-128-0x0-1x1-1x1-0-NCHW-FP32-F=miopenConvolutionFwdAlgoDirect:ConvAsm1x1U,0,243006,0,miopenConvolutionFwdAlgoDirect;miopenConvolutionFwdAlgoGEMM:GemmFwd1x1_0_1,2,36829,0,MIOpenGEMM
32-28-28-1x1-192-28-28-128-0x0-1x1-1x1-0-NCHW-FP32-B=miopenConvolutionBwdDataAlgoDirect:ConvAsm1x1U,0,198415,0,miopenConvolutionBwdDataAlgoDirect;miopenConvolutionBwdDataAlgoGEMM:gemm,1,14788,0,MIOpenGEMM
256-14-14-3x3-128-14-14-128-1x1-1x1-1x1-0-NCHW-FP32-W=miopenConvolutionBwdWeightsAlgoDirect:ConvAsmBwdWrW3x3,1,8945,0,miopenConvolutionBwdWeightsAlgoDirect;miopenConvolutionBwdWeightsAlgoWinograd:ConvBinWinogradRxS,2,16146,0,miopenConvolutionBwdWeightsAlgoWinograd;miopenConvolutionBwdWeightsAlgoImplicitGEMM:ConvHipImplicitGemmV4R1WrW,3,91691,0,miopenConvolutionBwdWeightsAlgoImplicitGEMM;miopenConvolutionBwdWeightsAlgoGEMM:gemm,5,358,903168,MIOpenGEMM
96-14-14-1x1-480-14-14-128-0x0-1x1-1x1-0-NCHW-FP32-W=miopenConvolutionBwdWeightsAlgoDirect:ConvAsmBwdWrW1x1,0,571581,0,miopenConvolutionBwdWeightsAlgoDirect;miopenConvolutionBwdWeightsAlgoWinograd:ConvBinWinogradRxSf2x3,1,14221,0,miopenConvolutionBwdWeightsAlgoWinograd;miopenConvolutionBwdWeightsAlgoGEMM:gemm,2,59945,0,MIOpenGEMM
48-14-14-5x5-16-14-14-128-2x2-1x1-1x1-0-NCHW-FP32-W=miopenConvolutionBwdWeightsAlgoDirect:ConvOclBwdWrW53,0,237619,9830400,miopenConvolutionBwdWeightsAlgoDirect;miopenConvolutionBwdWeightsAlgoWinograd:ConvBinWinogradRxSf2x3,0,786041,0,miopenConvolutionBwdWeightsAlgoWinograd;miopenConvolutionBwdWeightsAlgoGEMM:gemm,4,65644,313600,MIOpenGEMM
32-14-14-5x5-64-14-14-128-2x2-1x1-1x1-0-NCHW-FP32-F=miopenConvolutionFwdAlgoWinograd:ConvBinWinogradRxS,0,245866,0,miopenConvolutionFwdAlgoWinograd;miopenConvolutionFwdAlgoImplicitGEMM:ConvHipImplicitGemmV4R1Fwd,0,351085,0,miopenConvolutionFwdAlgoImplicitGEMM;miopenConvolutionFwdAlgoFFT:fft,0,407772,23777280,miopenConvolutionFwdAlgoFFT;miopenConvolutionFwdAlgoDirect:ConvOclDirectFwd,0,633964,0,miopenConvolutionFwdAlgoDirect;miopenConvolutionFwdAlgoGEMM:GemmFwdRest,6,3447,627200,MIOpenGEMM
48-7-7-5x5-128-7-7-128-2x2-1x1-1x1-0-NCHW-FP32-F=miopenConvolutionFwdAlgoWinograd:ConvBinWinogradRxSf2x3,0,19214,0,miopenConvolutionFwdAlgoWinograd;miopenConvolutionFwdAlgoImplicitGEMM:ConvHipImplicitGemmV4R1Fwd,0,318837,0,miopenConvolutionFwdAlgoImplicitGEMM;miopenConvolutionFwdAlgoFFT:fft,0,362104,22106112,miopenConvolutionFwdAlgoFFT;miopenConvolutionFwdAlgoDirect:ConvOclDirectFwd,0,829198,0,miopenConvolutionFwdAlgoDirect;miopenConvolutionFwdAlgoGEMM:GemmFwdRest,4,75002,235200,MIOpenGEMM
128-14-14-1x1-528-14-14-128-0x0-1x1-1x1-0-NCHW-FP32-W=miopenConvolutionBwdWeightsAlgoDirect:ConvAsmBwdWrW1x1,0,842804,0,miopenConvolutionBwdWeightsAlgoDirect;miopenConvolutionBwdWeightsAlgoWinograd:ConvBinWinogradRxSf2x3,1,7833,0,miopenConvolutionBwdWeightsAlgoWinograd;miopenConvolutionBwdWeightsAlgoGEMM:gemm,2,55905,0,MIOpenGEMM
512-28-28-3x3-512-28-28-128-1x1-1x1-1x1-0-NCHW-FP32-B=miopenConvolutionBwdDataAlgoWinograd:ConvBinWinograd3x3U,18,982,0,miopenConvolutionBwdDataAlgoWinograd
256-14-14-3x3-128-14-14-128-1x1-1x1-1x1-0-NCHW-FP32-B=miopenConvolutionBwdDataAlgoWinograd:ConvBinWinograd3x3U,0,647848,0,miopenConvolutionBwdDataAlgoWinograd
128-14-14-5x5-32-14-14-128-2x2-1x1-1x1-0-NCHW-FP32-W=miopenConvolutionBwdWeightsAlgoWinograd:ConvBinWinogradRxSf2x3,0,802133,0,miopenConvolutionBwdWeightsAlgoWinograd;miopenConvolutionBwdWeightsAlgoDirect:ConvOclBwdWrW53,1,14753,52428800,miopenConvolutionBwdWeightsAlgoDirect;miopenConvolutionBwdWeightsAlgoGEMM:gemm,3,72687,627200,MIOpenGEMM
128-14-14-1x1-528-14-14-128-0x0-1x1-1x1-0-NCHW-FP32-B=miopenConvolutionBwdDataAlgoDirect:ConvAsm1x1U,0,453058,0,miopenConvolutionBwdDataAlgoDirect;miopenConvolutionBwdDataAlgoGEMM:gemm,25,7782,0,MIOpenGEMM
192-28-28-1x1-32-28-28-128-0x0-1x1-1x1-0-NCHW-FP32-F=miopenConvolutionFwdAlgoDirect:ConvOclDirectFwd1x1,0,205917,0,miopenConvolutionFwdAlgoDirect;miopenConvolutionFwdAlgoGEMM:GemmFwd1x1_0_1,2,24318,0,MIOpenGEMM
48-14-14-5x5-16-14-14-128-2x2-1x1-1x1-0-NCHW-FP32-B=miopenConvolutionBwdDataAlgoWinograd:ConvBinWinogradRxS,0,175134,0,miopenConvolutionBwdDataAlgoWinograd;miopenConvolutionBwdDataAlgoDirect:ConvOclDirectFwd,0,417196,0,miopenConvolutionBwdDataAlgoDirect;miopenConvolutionBwdDataAlgoFFT:fft,0,67822,20275200,miopenConvolutionBwdDataAlgoFFT;miopenConvolutionBwdDataAlgoGEMM:gemm,5,2831,313600,MIOpenGEMM
128-14-14-5x5-32-14-14-128-2x2-1x1-1x1-0-NCHW-FP32-B=miopenConvolutionBwdDataAlgoWinograd:ConvBinWinogradRxSf2x3,0,415659,0,miopenConvolutionBwdDataAlgoWinograd;miopenConvolutionBwdDataAlgoFFT:fft,0,44624,59351040,miopenConvolutionBwdDataAlgoFFT;miopenConvolutionBwdDataAlgoDirect:ConvOclDirectFwd,1,10998,0,miopenConvolutionBwdDataAlgoDirect;miopenConvolutionBwdDataAlgoImplicitGEMM:ConvHipImplicitGemmBwdDataV1R1,1,69058,0,miopenConvolutionBwdDataAlgoImplicitGEMM;miopenConvolutionBwdDataAlgoGEMM:gemm,5,78508,627200,MIOpenGEMM
128-14-14-3x3-256-14-14-128-1x1-1x1-1x1-0-NCHW-FP32-F=miopenConvolutionFwdAlgoWinograd:ConvBinWinograd3x3U,0,666043,0,miopenConvolutionFwdAlgoWinograd
16-28-28-1x1-192-28-28-128-0x0-1x1-1x1-0-NCHW-FP32-W=miopenConvolutionBwdWeightsAlgoDirect:ConvAsmBwdWrW1x1,0,22264,0,miopenConvolutionBwdWeightsAlgoDirect
32-14-14-5x5-128-14-14-128-2x2-1x1-1x1-0-NCHW-FP32-F=miopenConvolutionFwdAlgoWinograd:ConvBinWinogradRxSf2x3,0,38228,0,miopenConvolutionFwdAlgoWinograd;miopenConvolutionFwdAlgoFFT:fft,0,50803,47370240,miopenConvolutionFwdAlgoFFT;miopenConvolutionFwdAlgoImplicitGEMM:ConvHipImplicitGemmV4R1Fwd,0,648786,0,miopenConvolutionFwdAlgoImplicitGEMM;miopenConvolutionFwdAlgoDirect:ConvOclDirectFwd,1,15229,0,miopenConvolutionFwdAlgoDirect;miopenConvolutionFwdAlgoGEMM:GemmFwdRest,7,56922,627200,MIOpenGEMM
384-7-7-1x1-832-7-7-128-0x0-1x1-1x1-0-NCHW-FP32-W=miopenConvolutionBwdWeightsAlgoDirect:ConvAsmBwdWrW1x1,0,983649,0,miopenConvolutionBwdWeightsAlgoDirect;miopenConvolutionBwdWeightsAlgoWinograd:ConvBinWinogradRxSf2x3,1,64726,0,miopenConvolutionBwdWeightsAlgoWinograd;miopenConvolutionBwdWeightsAlgoGEMM:gemm,2,7719,0,MIOpenGEMM
16-28-28-1x1-192-28-28-128-0x0-1x1-1x1-0-NCHW-FP32-B=miopenConvolutionBwdDataAlgoDirect:ConvOclDirectFwd1x1,0,267031,0,miopenConvolutionBwdDataAlgoDirect;miopenConvolutionBwdDataAlgoWinograd:ConvBinWinogradRxSf2x3,0,479083,0,miopenConvolutionBwdDataAlgoWinograd;miopenConvolutionBwdDataAlgoGEMM:gemm,0,605888,0,MIOpenGEMM
64-112-112-7x7-3-225-225-128-2x2-2x2-1x1-0-NCHW-FP32-W=miopenConvolutionBwdWeightsAlgoDirect:ConvOclBwdWrW2<2>,7,33631,2408448,miopenConvolutionBwdWeightsAlgoDirect;miopenConvolutionBwdWeightsAlgoGEMM:gemm,17,8281,7375872,MIOpenGEMM
832-7-7-1x1-192-7-7-128-0x0-1x1-1x1-0-NCHW-FP32-F=miopenConvolutionFwdAlgoDirect:ConvAsm1x1U,0,260304,0,miopenConvolutionFwdAlgoDirect;miopenConvolutionFwdAlgoWinograd:ConvBinWinogradRxSf3x2,0,701319,0,miopenConvolutionFwdAlgoWinograd;miopenConvolutionFwdAlgoGEMM:GemmFwd1x1_0_1,4,69476,0,MIOpenGEMM
384-7-7-1x1-832-7-7-128-0x0-1x1-1x1-0-NCHW-FP32-B=miopenConvolutionBwdDataAlgoDirect:ConvAsm1x1U,0,536271,0,miopenConvolutionBwdDataAlgoDirect;miopenConvolutionBwdDataAlgoWinograd:ConvBinWinogradRxSf3x2,1,32178,0,miopenConvolutionBwdDataAlgoWinograd;miopenConvolutionBwdDataAlgoGEMM:gemm,3,14479,0,MIOpenGEMM
192-56-56-3x3-64-56-56-128-1x1-1x1-1x1-0-NCHW-FP32-B=miopenConvolutionBwdDataAlgoWinograd:ConvBinWinogradRxSf2x3,3,48615,0,miopenConvolutionBwdDataAlgoWinograd
24-14-14-1x1-512-14-14-128-0x0-1x1-1x1-0-NCHW-FP32-W=miopenConvolutionBwdWeightsAlgoDirect:ConvAsmBwdWrW1x1,0,174508,0,miopenConvolutionBwdWeightsAlgoDirect;miopenConvolutionBwdWeightsAlgoWinograd:ConvBinWinogradRxSf2x3,0,789803,0,miopenConvolutionBwdWeightsAlgoWinograd;miopenConvolutionBwdWeightsAlgoGEMM:gemm,1,25145,0,MIOpenGEMM
64-56-56-3x3-192-56-56-128-1x1-1x1-1x1-0-NCHW-FP32-F=miopenConvolutionFwdAlgoWinograd:ConvBinWinograd3x3U,3,96784,0,miopenConvolutionFwdAlgoWinograd
528-14-14-1x1-128-14-14-128-0x0-1x1-1x1-0-NCHW-FP32-F=miopenConvolutionFwdAlgoDirect:ConvOclDirectFwd1x1,0,491033,0,miopenConvolutionFwdAlgoDirect;miopenConvolutionFwdAlgoWinograd:ConvBinWinogradRxSf3x2,0,857427,0,miopenConvolutionFwdAlgoWinograd;miopenConvolutionFwdAlgoGEMM:GemmFwd1x1_0_1,4,71194,0,MIOpenGEMM
480-14-14-1x1-96-14-14-128-0x0-1x1-1x1-0-NCHW-FP32-F=miopenConvolutionFwdAlgoDirect:ConvAsm1x1U,0,434901,0,miopenConvolutionFwdAlgoDirect;miopenConvolutionFwdAlgoGEMM:GemmFwd1x1_0_1,4,495,0,MIOpenGEMM
128-28-28-3x3-96-28-28-128-1x1-1x1-1x1-0-NCHW-FP32-B=miopenConvolutionBwdDataAlgoWinograd:ConvBinWinograd3x3U,0,984387,0,miopenConvolutionBwdDataAlgoWinograd
512-14-14-1x1-160-14-14-128-0x0-1x1-1x1-0-NCHW-FP32-F=miopenConvolutionFwdAlgoDirect:ConvOclDirectFwd1x1,0,614698,0,miopenConvolutionFwdAlgoDirect;miopenConvolutionFwdAlgoGEMM:GemmFwd1x1_0_1,4,80151,0,MIOpenGEMM
32-14-14-1x1-528-14-14-128-0x0-1x1-1x1-0-NCHW-FP32-W=miopenConvolutionBwdWeightsAlgoDirect:ConvAsmBwdWrW1x1,0,300029,0,miopenConvolutionBwdWeightsAlgoDirect;miopenConvolutionBwdWeightsAlgoWinograd:ConvBinWinogradRxSf2x3,0,845071,0,miopenConvolutionBwdWeightsAlgoWinograd;miopenConvolutionBwdWeightsAlgoGEMM:gemm,1,61133,0,MIOpenGEMM
32-7-7-5x5-128-7-7-128-2x2-1x1-1x1-0-NCHW-FP32-F=miopenConvolutionFwdAlgoWinograd:ConvBinWinogradRxSf2x3,0,133139,0,miopenConvolutionFwdAlgoWinograd;miopenConvolutionFwdAlgoImplicitGEMM:ConvHipImplicitGemmV4R1Fwd,0,198688,0,miopenConvolutionFwdAlgoImplicitGEMM;miopenConvolutionFwdAlgoFFT:fft,0,250217,22106112,miopenConvolutionFwdAlgoFFT;miopenConvolutionFwdAlgoDirect:ConvOclDirectFwd,0,510462,0,miopenConvolutionFwdAlgoDirect;miopenConvolutionFwdAlgoGEMM:GemmFwdRest,3,84892,156800,MIOpenGEMM
64-14-14-1x1-512-14-14-128-0x0-1x1-1x1-0-NCHW-FP32-W=miopenConvolutionBwdWeightsAlgoDirect:ConvAsmBwdWrW1x1,0,413616,0,miopenConvolutionBwdWeightsAlgoDirect
144-14-14-1x1-512-14-14-128-0x0-1x1-1x1-0-NCHW-FP32-W=miopenConvolutionBwdWeightsAlgoDirect:ConvAsmBwdWrW1x1,0,98392,0,miopenConvolutionBwdWeightsAlgoDirect
32-14-14-1x1-528-14-14-128-0x0-1x1-1x1-0-NCHW-FP32-B=miopenConvolutionBwdDataAlgoDirect:ConvOclDirectFwd1x1,0,266701,0,miopenConvolutionBwdDataAlgoDirect;miopenConvolutionBwdDataAlgoGEMM:gemm,1,2667,0,MIOpenGEMM
64-14-14-1x1-480-14-14-128-0x0-1x1-1x1-0-NCHW-FP32-W=miopenConvolutionBwdWeightsAlgoDirect:ConvAsmBwdWrW1x1,0,2994,0,miopenConvolutionBwdWeightsAlgoDirect;miopenConvolutionBwdWeightsAlgoWinograd:ConvBinWinogradRxSf2x3,0,823932,0,miopenConvolutionBwdWeightsAlgoWinograd;miopenConvolutionBwdWeightsAlgoGEMM:gemm,2,3297,0,MIOpenGEMM
160-7-7-1x1-832-7-7-128-0x0-1x1-1x1-0-NCHW-FP32-W=miopenConvolutionBwdWeightsAlgoDirect:ConvAsmBwdWrW1x1,0,389646,0,miopenConvolutionBwdWeightsAlgoDirect;miopenConvolutionBwdWeightsAlgoGEMM:gemm,1,39378,0,MIOpenGEMM
128-28-28-3x3-96-28-28-128-1x1-1x1-1x1-0-NCHW-FP32-W=miopenConvolutionBwdWeightsAlgoDirect:ConvAsmBwdWrW3x3,2,26918,0,miopenConvolutionBwdWeightsAlgoDirect;miopenConvolutionBwdWeightsAlgoWinograd:ConvBinWinogradRxSf2x3,2,9135,0,miopenConvolutionBwdWeightsAlgoWinograd;miopenConvolutionBwdWeightsAlgoGEMM:gemm,8,2,2709504,MIOpenGEMM
320-7-7-3x3-160-7-7-128-1x1-1x1-1x1-0-NCHW-FP32-W=miopenConvolutionBwdWeightsAlgoWinograd:ConvBinWinogradRxS,0,47852,0,miopenConvolutionBwdWeightsAlgoWinograd;miopenConvolutionBwdWeightsAlgoDirect:ConvAsmBwdWrW3x3,0,716415,0,miopenConvolutionBwdWeightsAlgoDirect;miopenConvolutionBwdWeightsAlgoGEMM:gemm,3,7002,282240,MIOpenGEMM
32-7-7-1x1-832-7-7-128-0x0-1x1-1x1-0-NCHW-FP32-W=miopenConvolutionBwdWeightsAlgoDirect:ConvAsmBwdWrW1x1,0,78244,0,miopenConvolutionBwdWeightsAlgoDirect
32-14-14-1x1-512-14-14-128-0x0-1x1-1x1-0-NCHW-FP32-B=miopenConvolutionBwdDataAlgoDirect:ConvOclDirectFwd1x1,0,217793,0,miopenConvolutionBwdDataAlgoDirect;miopenConvolutionBwdDataAlgoWinograd:ConvBinWinogradRxSf3x2,0,320372,0,miopenConvolutionBwdDataAlgoWinograd;miopenConvolutionBwdDataAlgoGEMM:gemm,1,667,0,MIOpenGEMM
160-7-7-1x1-832-7-7-128-0x0-1x1-1x1-0-NCHW-FP32-B=miopenConvolutionBwdDataAlgoDirect:ConvAsm1x1U,0,232141,0,miopenConvolutionBwdDataAlgoDirect;miopenConvolutionBwdDataAlgoWinograd:ConvBinWinogradRxSf3x2,0,602327,0,miopenConvolutionBwdDataAlgoWinograd;miopenConvolutionBwdDataAlgoGEMM:gemm,1,8942,0,MIOpenGEMM
96-28-28-3x3-128-28-28-128-1x1-1x1-1x1-0-NCHW-FP32-F=miopenConvolutionFwdAlgoWinograd:ConvBinWinogradRxSf2x3,0,975465,0,miopenConvolutionFwdAlgoWinograd
832-7-7-1x1-128-7-7-128-0x0-1x1-1x1-0-NCHW-FP32-F=miopenConvolutionFwdAlgoDirect:ConvAsm1x1U,0,180296,0,miopenConvolutionFwdAlgoDirect;miopenConvolutionFwdAlgoWinograd:ConvBinWinogradRxSf3x2,0,532935,0,miopenConvolutionFwdAlgoWinograd;miopenConvolutionFwdAlgoGEMM:GemmFwd1x1_0_1,2,6449,0,MIOpenGEMM
128-28-28-1x1-256-28-28-128-0x0-1x1-1x1-0-NCHW-FP32-B=miopenConvolutionBwdDataAlgoDirect:ConvAsm1x1U,0,640333,0,miopenConvolutionBwdDataAlgoDirect;miopenConvolutionBwdDataAlgoWinograd:ConvBinWinogradRxSf3x2,1,52452,0,miopenConvolutionBwdDataAlgoWinograd;miopenConvolutionBwdDataAlgoGEMM:gemm,66,7646,0,MIOpenGEMM
480-14-14-1x1-64-14-14-128-0x0-1x1-1x1-0-NCHW-FP32-F=miopenConvolutionFwdAlgoDirect:ConvAsm1x1U,0,212401,0,miopenConvolutionFwdAlgoDirect;miopenConvolutionFwdAlgoWinograd:ConvBinWinogradRxSf3x2,0,445214,0,miopenConvolutionFwdAlgoWinograd;miopenConvolutionFwdAlgoGEMM:GemmFwd1x1_0_1,3,41722,0,MIOpenGEMM
64-14-14-1x1-512-14-14-128-0x0-1x1-1x1-0-NCHW-FP32-B=miopenConvolutionBwdDataAlgoDirect:ConvAsm1x1U,0,322594,0,miopenConvolutionBwdDataAlgoDirect;miopenConvolutionBwdDataAlgoWinograd:ConvBinWinogradRxSf3x2,0,490648,0,miopenConvolutionBwdDataAlgoWinograd;miopenConvolutionBwdDataAlgoGEMM:gemm,2,14969,0,MIOpenGEMM
528-14-14-1x1-32-14-14-128-0x0-1x1-1x1-0-NCHW-FP32-F=miopenConvolutionFwdAlgoDirect:ConvOclDirectFwd1x1,0,197,0,miopenConvolutionFwdAlgoDirect;miopenConvolutionFwdAlgoGEMM:GemmFwd1x1_0_1,1,9488,0,MIOpenGEMM
32-7-7-1x1-832-7-7-128-0x0-1x1-1x1-0-NCHW-FP32-B=miopenConvolutionBwdDataAlgoDirect:ConvAsm1x1U,0,54017,0,miopenConvolutionBwdDataAlgoDirect;miopenConvolutionBwdDataAlgoWinograd:ConvBinWinogradRxSf3x2,0,188281,0,miopenConvolutionBwdDataAlgoWinograd;miopenConvolutionBwdDataAlgoGEMM:gemm,0,927658,0,MIOpenGEMM
832-7-7-1x1-160-7-7-128-0x0-1x1-1x1-0-NCHW-FP32-F=miopenConvolutionFwdAlgoDirect:ConvAsm1x1U,0,350086,0,miopenConvolutionFwdAlgoDirect;miopenConvolutionFwdAlgoWinograd:ConvBinWinogradRxSf3x2,0,57767,0,miopenConvolutionFwdAlgoWinograd;miopenConvolutionFwdAlgoGEMM:GemmFwd1x1_0_1,2,17335,0,MIOpenGEMM
144-14-14-1x1-512-14-14-128-0x0-1x1-1x1-0-NCHW-FP32-B=miopenConvolutionBwdDataAlgoDirect:ConvAsm1x1U,0,360799,0,miopenConvolutionBwdDataAlgoDirect;miopenConvolutionBwdDataAlgoWinograd:ConvBinWinogradRxSf3x2,0,823136,0,miopenConvolutionBwdDataAlgoWinograd;miopenConvolutionBwdDataAlgoGEMM:gemm,25,3207,0,MIOpenGEMM
192-14-14-1x1-480-14-14-128-0x0-1x1-1x1-0-NCHW-FP32-W=miopenConvolutionBwdWeightsAlgoDirect:ConvAsmBwdWrW1x1,0,757445,0,miopenConvolutionBwdWeightsAlgoDirect;miopenConvolutionBwdWeightsAlgoWinograd:ConvBinWinogradRxSf2x3,2,1583,0,miopenConvolutionBwdWeightsAlgoWinograd;miopenConvolutionBwdWeightsAlgoGEMM:gemm,2,14559,0,MIOpenGEMM
832-7-7-1x1-48-7-7-128-0x0-1x1-1x1-0-NCHW-FP32-F=miopenConvolutionFwdAlgoDirect:ConvOclDirectFwd1x1,0,13632,0,miopenConvolutionFwdAlgoDirect;miopenConvolutionFwdAlgoWinograd:ConvBinWinogradRxSf2x3,0,359556,0,miopenConvolutionFwdAlgoWinograd;miopenConvolutionFwdAlgoGEMM:GemmFwd1x1_0_1,2,2775,0,MIOpenGEMM
208-14-14-3x3-96-14-14-128-1x1-1x1-1x1-0-NCHW-FP32-W=miopenConvolutionBwdWeightsAlgoDirect:ConvAsmBwdWrW3x3,1,23169,0,miopenConvolutionBwdWeightsAlgoDirect;miopenConvolutionBwdWeightsAlgoWinograd:ConvBinWinogradRxS,1,56568,0,miopenConvolutionBwdWeightsAlgoWinograd;miopenConvolutionBwdWeightsAlgoGEMM:gemm,3,99202,677376,MIOpenGEMM
256-14-14-1x1-528-14-14-128-0x0-1x1-1x1-0-NCHW-FP32-W=miopenConvolutionBwdWeightsAlgoDirect:ConvAsmBwdWrW1x1,1,51029,0,miopenConvolutionBwdWeightsAlgoDirect;miopenConvolutionBwdWeightsAlgoWinograd:ConvBinWinogradRxSf2x3,3,10086,0,miopenConvolutionBwdWeightsAlgoWinograd;miopenConvolutionBwdWeightsAlgoGEMM:gemm,3,13052,0,MIOpenGEMM
512-14-14-1x1-64-14-14-128-0x0-1x1-1x1-0-NCHW-FP32-F=miopenConvolutionFwdAlgoDirect:ConvAsm1x1U,0,375165,0,miopenConvolutionFwdAlgoDirect;miopenConvolutionFwdAlgoGEMM:GemmFwd1x1_0_1,3,66936,0,MIOpenGEMM
208-14-14-3x3-96-14-14-128-1x1-1x1-1x1-0-NCHW-FP32-B=miopenConvolutionBwdDataAlgoWinograd:ConvBinWinograd3x3U,0,43084,0,miopenConvolutionBwdDataAlgoWinograd
256-7-7-1x1-832-7-7-128-0x0-1x1-1x1-0-NCHW-FP32-W=miopenConvolutionBwdWeightsAlgoDirect:ConvAsmBwdWrW1x1,0,40737,0,miopenConvolutionBwdWeightsAlgoDirect;miopenConvolutionBwdWeightsAlgoWinograd:ConvBinWinogradRxSf2x3,1,18101,0,miopenConvolutionBwdWeightsAlgoWinograd;miopenConvolutionBwdWeightsAlgoGEMM:gemm,1,33804,0,MIOpenGEMM
512-14-14-1x1-144-14-14-128-0x0-1x1-1x1-0-NCHW-FP32-F=miopenConvolutionFwdAlgoDirect:ConvAsm1x1U,0,61141,0,miopenConvolutionFwdAlgoDirect;miopenConvolutionFwdAlgoGEMM:GemmFwd1x1_0_1,4,4269,0,MIOpenGEMM
528-14-14-1x1-256-14-14-128-0x0-1x1-1x1-0-NCHW-FP32-F=miopenConvolutionFwdAlgoDirect:ConvAsm1x1U,0,966005,0,miopenConvolutionFwdAlgoDirect;miopenConvolutionFwdAlgoWinograd:ConvBinWinogradRxSf3x2,1,58099,0,miopenConvolutionFwdAlgoWinograd;miopenConvolutionFwdAlgoGEMM:GemmFwd1x1_0_1,4,48938,0,MIOpenGEMM
96-14-14-3x3-208-14-14-128-1x1-1x1-1x1-0-NCHW-FP32-F=miopenConvolutionFwdAlgoWinograd:ConvBinWinograd3x3U,0,43503,0,miopenConvolutionFwdAlgoWinograd
128-7-7-1x1-832-7-7-128-0x0-1x1-1x1-0-NCHW-FP32-W=miopenConvolutionBwdWeightsAlgoDirect:ConvAsmBwdWrW1x1,0,209677,0,miopenConvolutionBwdWeightsAlgoDirect;miopenConvolutionBwdWeightsAlgoGEMM:gemm,1,7297,0,MIOpenGEMM
48-7-7-1x1-832-7-7-128-0x0-1x1-1x1-0-NCHW-FP32-W=miopenConvolutionBwdWeightsAlgoDirect:ConvAsmBwdWrW1x1,0,121453,0,miopenConvolutionBwdWeightsAlgoDirect
128-14-14-1x1-512-14-14-128-0x0-1x1-1x1-0-NCHW-FP32-W=miopenConvolutionBwdWeightsAlgoDirect:ConvAsmBwdWrW1x1,0,599658,0,miopenConvolutionBwdWeightsAlgoDirect
512-14-14-1x1-32-14-14-128-0x0-1x1-1x1-0-NCHW-FP32-F=miopenConvolutionFwdAlgoDirect:ConvAsm1x1U,0,133097,0,miopenConvolutionFwdAlgoDirect;miopenConvolutionFwdAlgoWinograd:ConvBinWinogradRxSf3x2,0,239106,0,miopenConvolutionFwdAlgoWinograd;miopenConvolutionFwdAlgoGEMM:GemmFwd1x1_0_1,1,72989,0,MIOpenGEMM
160-14-14-1x1-528-14-14-128-0x0-1x1-1x1-0-NCHW-FP32-W=miopenConvolutionBwdWeightsAlgoDirect:ConvAsmBwdWrW1x1,0,732385,0,miopenConvolutionBwdWeightsAlgoDirect;miopenConvolutionBwdWeightsAlgoWinograd:ConvBinWinogradRxSf2x3,1,92175,0,miopenConvolutionBwdWeightsAlgoWinograd;miopenConvolutionBwdWeightsAlgoGEMM:gemm,2,57178,0,MIOpenGEMM
128-7-7-1x1-832-7-7-128-0x0-1x1-1x1-0-NCHW-FP32-B=miopenConvolutionBwdDataAlgoDirect:ConvAsm1x1U,0,161696,0,miopenConvolutionBwdDataAlgoDirect;miopenConvolutionBwdDataAlgoWinograd:ConvBinWinogradRxSf3x2,0,468309,0,miopenConvolutionBwdDataAlgoWinograd;miopenConvolutionBwdDataAlgoGEMM:gemm,1,56435,0,MIOpenGEMM
832-7-7-1x1-384-7-7-128-0x0-1x1-1x1-0-NCHW-FP32-F=miopenConvolutionFwdAlgoDirect:ConvAsm1x1U,0,499957,0,miopenConvolutionFwdAlgoDirect;miopenConvolutionFwdAlgoWinograd:ConvBinWinogradRxSf3x2,1,24937,0,miopenConvolutionFwdAlgoWinograd;miopenConvolutionFwdAlgoGEMM:GemmFwd1x1_0_1,4,30896,0,MIOpenGEMM
32-14-14-1x1-512-14-14-128-0x0-1x1-1x1-0-NCHW-FP32-W=miopenConvolutionBwdWeightsAlgoDirect:ConvAsmBwdWrW1x1,0,184346,0,miopenConvolutionBwdWeightsAlgoDirect
128-14-14-1x1-512-14-14-128-0x0-1x1-1x1-0-NCHW-FP32-B=miopenConvolutionBwdDataAlgoDirect:ConvAsm1x1U,0,484808,0,miopenConvolutionBwdDataAlgoDirect;miopenConvolutionBwdDataAlgoWinograd:ConvBinWinogradRxSf3x2,0,825802,0,miopenConvolutionBwdDataAlgoWinograd;miopenConvolutionBwdDataAlgoGEMM:gemm,19,4377,0,MIOpenGEMM
256-7-7-1x1-832-7-7-128-0x0-1x1-1x1-0-NCHW-FP32-B=miopenConvolutionBwdDataAlgoDirect:ConvAsm1x1U,0,339406,0,miopenConvolutionBwdDataAlgoDirect;miopenConvolutionBwdDataAlgoWinograd:ConvBinWinogradRxSf3x2,0,922131,0,miopenConvolutionBwdDataAlgoWinograd;miopenConvolutionBwdDataAlgoGEMM:gemm,2,45775,0,MIOpenGEMM
48-7-7-1x1-832-7-7-128-0x0-1x1-1x1-0-NCHW-FP32-B=miopenConvolutionBwdDataAlgoDirect:ConvAsm1x1U,0,68717,0,miopenConvolutionBwdDataAlgoDirect;miopenConvolutionBwdDataAlgoWinograd:ConvBinWinogradRxSf3x2,0,232096,0,miopenConvolutionBwdDataAlgoWinograd;miopenConvolutionBwdDataAlgoGEMM:gemm,1,395,0,MIOpenGEMM
832-7-7-1x1-256-7-7-128-0x0-1x1-1x1-0-NCHW-FP32-F=miopenConvolutionFwdAlgoDirect:ConvOclDirectFwd1x1,0,417922,0,miopenConvolutionFwdAlgoDirect;miopenConvolutionFwdAlgoWinograd:ConvBinWinogradRxSf3x2,0,947793,0,miopenConvolutionFwdAlgoWinograd;miopenConvolutionFwdAlgoGEMM:GemmFwd1x1_0_1,4,86237,0,MIOpenGEMM
192-7-7-1x1-832-7-7-128-0x0-1x1-1x1-0-NCHW-FP32-W=miopenConvolutionBwdWeightsAlgoDirect:ConvAsmBwdWrW1x1,0,319922,0,miopenConvolutionBwdWeightsAlgoDirect
64-14-14-1x1-480-14-14-128-0x0-1x1-1x1-0-NCHW-FP32-B=miopenConvolutionBwdDataAlgoDirect:ConvAsm1x1U,0,191566,0,miopenConvolutionBwdDataAlgoDirect;miopenConvolutionBwdDataAlgoWinograd:ConvBinWinogradRxSf3x2,0,435074,0,miopenConvolutionBwdDataAlgoWinograd;miopenConvolutionBwdDataAlgoGEMM:gemm,2,18144,0,MIOpenGEMM
128-7-7-5x5-32-7-7-128-2x2-1x1-1x1-0-NCHW-FP32-W=miopenConvolutionBwdWeightsAlgoWinograd:ConvBinWinogradRxSf2x3,0,354157,0,miopenConvolutionBwdWeightsAlgoWinograd;miopenConvolutionBwdWeightsAlgoDirect:ConvOclBwdWrW2<8>,0,555636,6553600,miopenConvolutionBwdWeightsAlgoDirect;miopenConvolutionBwdWeightsAlgoGEMM:gemm,2,69033,156800,MIOpenGEMM
192-7-7-1x1-832-7-7-128-0x0-1x1-1x1-0-NCHW-FP32-B=miopenConvolutionBwdDataAlgoDirect:ConvAsm1x1U,0,337002,0,miopenConvolutionBwdDataAlgoDirect;miopenConvolutionBwdDataAlgoWinograd:ConvBinWinogradRxSf3x2,0,717892,0,miopenConvolutionBwdDataAlgoWinograd;miopenConvolutionBwdDataAlgoGEMM:gemm,2,50249,0,MIOpenGEMM
192-56-56-3x3-64-56-56-128-1x1-1x1-1x1-0-NCHW-FP32-W=miopenConvolutionBwdWeightsAlgoDirect:ConvAsmBwdWrW3x3,9,42263,0,miopenConvolutionBwdWeightsAlgoDirect;miopenConvolutionBwdWeightsAlgoWinograd:ConvBinWinogradRxSf2x3,11,564,0,miopenConvolutionBwdWeightsAlgoWinograd;miopenConvolutionBwdWeightsAlgoGEMM:gemm,15,9174,7225344,MIOpenGEMM;miopenConvolutionBwdWeightsAlgoImplicitGEMM:ConvHipImplicitGemmV4R1WrW,41,2064,0,miopenConvolutionBwdWeightsAlgoImplicitGEMM
128-17-17-7x1-128-17-17-128-3x0-1x1-1x1-0-NCHW-FP32-B=miopenConvolutionBwdDataAlgoWinograd:ConvBinWinogradRxSf3x2,1,11478,0,miopenConvolutionBwdDataAlgoWinograd;miopenConvolutionBwdDataAlgoImplicitGEMM:ConvHipImplicitGemmBwdDataV1R1,1,97087,0,miopenConvolutionBwdDataAlgoImplicitGEMM;miopenConvolutionBwdDataAlgoGEMM:gemm,46,7621,1035776,MIOpenGEMM
96-14-14-1x1-480-14-14-128-0x0-1x1-1x1-0-NCHW-FP32-B=miopenConvolutionBwdDataAlgoDirect:ConvAsm1x1U,0,270022,0,miopenConvolutionBwdDataAlgoDirect;miopenConvolutionBwdDataAlgoGEMM:gemm,8,6898,0,MIOpenGEMM
160-17-17-1x7-160-17-17-128-0x3-1x1-1x1-0-NCHW-FP32-F=miopenConvolutionFwdAlgoImplicitGEMM:ConvHipImplicitGemmV4R1Fwd,1,41912,0,miopenConvolutionFwdAlgoImplicitGEMM;miopenConvolutionFwdAlgoWinograd:ConvBinWinogradRxSf3x2,1,58312,0,miopenConvolutionFwdAlgoWinograd;miopenConvolutionFwdAlgoGEMM:GemmFwdRest,7,953,1294720,MIOpenGEMM
192-8-8-1x1-1280-8-8-128-0x0-1x1-1x1-0-NCHW-FP32-W=miopenConvolutionBwdWeightsAlgoDirect:ConvAsmBwdWrW1x1,0,51112,0,miopenConvolutionBwdWeightsAlgoDirect;miopenConvolutionBwdWeightsAlgoWinograd:ConvBinWinogradRxSf2x3,1,41347,0,miopenConvolutionBwdWeightsAlgoWinograd;miopenConvolutionBwdWeightsAlgoGEMM:gemm,1,99939,0,MIOpenGEMM
128-17-17-7x1-128-17-17-128-3x0-1x1-1x1-0-NCHW-FP32-F=miopenConvolutionFwdAlgoImplicitGEMM:ConvHipImplicitGemmV4R1Fwd,0,935996,0,miopenConvolutionFwdAlgoImplicitGEMM;miopenConvolutionFwdAlgoWinograd:ConvBinWinogradRxSf3x2,1,8133,0,miopenConvolutionFwdAlgoWinograd;miopenConvolutionFwdAlgoGEMM:GemmFwdRest,7,29202,1035776,MIOpenGEMM
128-7-7-5x5-32-7-7-128-2x2-1x1-1x1-0-NCHW-FP32-B=miopenConvolutionBwdDataAlgoWinograd:ConvBinWinogradRxSf2x3,0,120387,0,miopenConvolutionBwdDataAlgoWinograd;miopenConvolutionBwdDataAlgoFFT:fft,0,237442,27697152,miopenConvolutionBwdDataAlgoFFT;miopenConvolutionBwdDataAlgoDirect:ConvOclDirectFwd,0,559159,0,miopenConvolutionBwdDataAlgoDirect;miopenConvolutionBwdDataAlgoImplicitGEMM:ConvHipImplicitGemmBwdDataV1R1,0,580918,0,miopenConvolutionBwdDataAlgoImplicitGEMM;miopenConvolutionBwdDataAlgoGEMM:gemm,4,4912,156800,MIOpenGEMM
192-17-17-7x1-160-17-17-128-3x0-1x1-1x1-0-NCHW-FP32-B=miopenConvolutionBwdDataAlgoWinograd:ConvBinWinogradRxSf3x2,2,5397,0,miopenConvolutionBwdDataAlgoWinograd;miopenConvolutionBwdDataAlgoImplicitGEMM:ConvHipImplicitGemmBwdDataV1R1,4,7484,0,miopenConvolutionBwdDataAlgoImplicitGEMM;miopenConvolutionBwdDataAlgoGEMM:gemm,6,4,1294720,MIOpenGEMM
160-17-17-7x1-192-17-17-128-3x0-1x1-1x1-0-NCHW-FP32-F=miopenConvolutionFwdAlgoImplicitGEMM:ConvHipImplicitGemmV4R1Fwd,1,51969,0,miopenConvolutionFwdAlgoImplicitGEMM;miopenConvolutionFwdAlgoWinograd:ConvBinWinogradRxSf3x2,1,83301,0,miopenConvolutionFwdAlgoWinograd;miopenConvolutionFwdAlgoGEMM:GemmFwdRest,9,97984,1294720,MIOpenGEMM
192-17-17-7x1-192-17-17-128-3x0-1x1-1x1-0-NCHW-FP32-W=miopenConvolutionBwdWeightsAlgoWinograd:ConvBinWinogradRxSf2x3,3,21488,0,miopenConvolutionBwdWeightsAlgoWinograd;miopenConvolutionBwdWeightsAlgoDirect:ConvOclBwdWrW53,3,46285,0,miopenConvolutionBwdWeightsAlgoDirect;miopenConvolutionBwdWeightsAlgoImplicitGEMM:ConvHipImplicitGemmV4R1WrW,6,14172,0,miopenConvolutionBwdWeightsAlgoImplicitGEMM;miopenConvolutionBwdWeightsAlgoGEMM:gemm,39,8601,1553664,MIOpenGEMM
192-17-17-1x7-160-17-17-128-0x3-1x1-1x1-0-NCHW-FP32-W=miopenConvolutionBwdWeightsAlgoWinograd:ConvBinWinogradRxSf2x3,1,98007,0,miopenConvolutionBwdWeightsAlgoWinograd;miopenConvolutionBwdWeightsAlgoDirect:ConvOclBwdWrW53,5,32521,0,miopenConvolutionBwdWeightsAlgoDirect;miopenConvolutionBwdWeightsAlgoGEMM:gemm,11,3274,1294720,MIOpenGEMM
192-35-35-1x1-64-35-35-128-0x0-1x1-1x1-0-NCHW-FP32-F=miopenConvolutionFwdAlgoDirect:ConvAsm1x1U,0,712458,0,miopenConvolutionFwdAlgoDirect;miopenConvolutionFwdAlgoWinograd:ConvBinWinogradRxSf3x2,0,872987,0,miopenConvolutionFwdAlgoWinograd;miopenConvolutionFwdAlgoGEMM:GemmFwd1x1_0_1,4,2423,0,MIOpenGEMM
192-17-17-7x1-192-17-17-128-3x0-1x1-1x1-0-NCHW-FP32-B=miopenConvolutionBwdDataAlgoWinograd:ConvBinWinogradRxSf3x2,2,43761,0,miopenConvolutionBwdDataAlgoWinograd;miopenConvolutionBwdDataAlgoImplicitGEMM:ConvHipImplicitGemmBwdDataV1R1,3,58004,0,miopenConvolutionBwdDataAlgoImplicitGEMM;miopenConvolutionBwdDataAlgoGEMM:gemm,8,8519,1553664,MIOpenGEMM
192-28-28-1x1-16-28-28-128-0x0-1x1-1x1-0-NCHW-FP32-F=miopenConvolutionFwdAlgoDirect:ConvOclDirectFwd1x1,0,161945,0,miopenConvolutionFwdAlgoDirect;miopenConvolutionFwdAlgoWinograd:ConvBinWinogradRxSf3x2,0,29991,0,miopenConvolutionFwdAlgoWinograd;miopenConvolutionFwdAlgoGEMM:GemmFwd1x1_0_1,1,74346,0,MIOpenGEMM
832-7-7-1x1-32-7-7-128-0x0-1x1-1x1-0-NCHW-FP32-F=miopenConvolutionFwdAlgoDirect:ConvOclDirectFwd1x1,0,88512,0,miopenConvolutionFwdAlgoDirect;miopenConvolutionFwdAlgoWinograd:ConvBinWinogradRxSf2x3,0,190068,0,miopenConvolutionFwdAlgoWinograd;miopenConvolutionFwdAlgoGEMM:GemmFwd1x1_0_1,2,35111,0,MIOpenGEMM
192-17-17-1x7-160-17-17-128-0x3-1x1-1x1-0-NCHW-FP32-B=miopenConvolutionBwdDataAlgoWinograd:ConvBinWinogradRxSf3x2,1,97214,0,miopenConvolutionBwdDataAlgoWinograd;miopenConvolutionBwdDataAlgoImplicitGEMM:ConvHipImplicitGemmBwdDataV1R1,4,42125,0,miopenConvolutionBwdDataAlgoImplicitGEMM;miopenConvolutionBwdDataAlgoGEMM:gemm,6,19121,1294720,MIOpenGEMM
192-17-17-7x1-192-17-17-128-3x0-1x1-1x1-0-NCHW-FP32-F=miopenConvolutionFwdAlgoImplicitGEMM:ConvHipImplicitGemmV4R1Fwd,2,2526,0,miopenConvolutionFwdAlgoImplicitGEMM;miopenConvolutionFwdAlgoWinograd:ConvBinWinogradRxSf3x2,2,38804,0,miopenConvolutionFwdAlgoWinograd;miopenConvolutionFwdAlgoGEMM:GemmFwdRest,16,2462,1553664,MIOpenGEMM
160-17-17-1x7-192-17-17-128-0x3-1x1-1x1-0-NCHW-FP32-F=miopenConvolutionFwdAlgoWinograd:ConvBinWinogradRxSf3x2,1,93433,0,miopenConvolutionFwdAlgoWinograd;miopenConvolutionFwdAlgoImplicitGEMM:ConvHipImplicitGemmV4R1Fwd,2,18478,0,miopenConvolutionFwdAlgoImplicitGEMM;miopenConvolutionFwdAlgoGEMM:GemmFwdRest,16,7214,1294720,MIOpenGEMM
48-35-35-1x1-192-35-35-128-0x0-1x1-1x1-0-NCHW-FP32-W=miopenConvolutionBwdWeightsAlgoDirect:ConvAsmBwdWrW1x1,0,975949,0,miopenConvolutionBwdWeightsAlgoDirect
384-8-8-1x1-2048-8-8-128-0x0-1x1-1x1-0-NCHW-FP32-B=miopenConvolutionBwdDataAlgoDirect:ConvAsm1x1U,1,13375,0,miopenConvolutionBwdDataAlgoDirect;miopenConvolutionBwdDataAlgoWinograd:ConvBinWinogradRxSf3x2,3,6465,0,miopenConvolutionBwdDataAlgoWinograd;miopenConvolutionBwdDataAlgoGEMM:gemm,5,11574,0,MIOpenGEMM
192-8-8-3x3-192-17-17-128-0x0-2x2-1x1-0-NCHW-FP32-W=miopenConvolutionBwdWeightsAlgoImplicitGEMM:ConvHipImplicitGemmV4R1WrW,1,2223,0,miopenConvolutionBwdWeightsAlgoImplicitGEMM;miopenConvolutionBwdWeightsAlgoGEMM:gemm,4,44006,442368,MIOpenGEMM;miopenConvolutionBwdWeightsAlgoDirect:ConvOclBwdWrW2NonTunable,13,1941,169869312,miopenConvolutionBwdWeightsAlgoDirect
48-35-35-1x1-192-35-35-128-0x0-1x1-1x1-0-NCHW-FP32-B=miopenConvolutionBwdDataAlgoDirect:ConvAsm1x1U,0,532208,0,miopenConvolutionBwdDataAlgoDirect;miopenConvolutionBwdDataAlgoGEMM:gemm,2,76814,0,MIOpenGEMM
160-17-17-7x1-160-17-17-128-3x0-1x1-1x1-0-NCHW-FP32-W=miopenConvolutionBwdWeightsAlgoWinograd:ConvBinWinogradRxSf2x3,2,19705,0,miopenConvolutionBwdWeightsAlgoWinograd;miopenConvolutionBwdWeightsAlgoDirect:ConvOclBwdWrW53,2,2868,0,miopenConvolutionBwdWeightsAlgoDirect;miopenConvolutionBwdWeightsAlgoGEMM:gemm,8,39263,1294720,MIOpenGEMM
64-35-35-1x1-256-35-35-128-0x0-1x1-1x1-0-NCHW-FP32-W=miopenConvolutionBwdWeightsAlgoDirect:ConvAsmBwdWrW1x1,1,16572,0,miopenConvolutionBwdWeightsAlgoDirect
2048-8-8-1x1-384-8-8-128-0x0-1x1-1x1-0-NCHW-FP32-F=miopenConvolutionFwdAlgoDirect:ConvAsm1x1U,1,75655,0,miopenConvolutionFwdAlgoDirect;miopenConvolutionFwdAlgoWinograd:ConvBinWinogradRxSf3x2,3,2708,0,miopenConvolutionFwdAlgoWinograd;miopenConvolutionFwdAlgoGEMM:GemmFwd1x1_0_1,5,35986,0,MIOpenGEMM
192-8-8-3x3-192-17-17-128-0x0-2x2-1x1-0-NCHW-FP32-B=miopenConvolutionBwdDataAlgoImplicitGEMM:ConvHipImplicitGemmBwdDataV1R1,1,4685,0,miopenConvolutionBwdDataAlgoImplicitGEMM;miopenConvolutionBwdDataAlgoWinograd:ConvBinWinogradRxS,1,51604,0,miopenConvolutionBwdDataAlgoWinograd;miopenConvolutionBwdDataAlgoDirect:ConvOclDirectFwd,4,94067,0,miopenConvolutionBwdDataAlgoDirect;miopenConvolutionBwdDataAlgoGEMM:gemm,6,22976,442368,MIOpenGEMM
3-299-299-3x3-32-149-149-128-0x0-2x2-1x1-0-NCHW-FP32-F=miopenConvolutionFwdAlgoWinograd:ConvBinWinogradRxSf2x3,1,9227,0,miopenConvolutionFwdAlgoWinograd;miopenConvolutionFwdAlgoDirect:ConvOclDirectFwd,3,1174,0,miopenConvolutionFwdAlgoDirect;miopenConvolutionFwdAlgoGEMM:GemmFwdRest,4,53792,2397708,MIOpenGEMM
160-17-17-7x1-160-17-17-128-3x0-1x1-1x1-0-NCHW-FP32-B=miopenConvolutionBwdDataAlgoWinograd:ConvBinWinogradRxSf3x2,1,69325,0,miopenConvolutionBwdDataAlgoWinograd;miopenConvolutionBwdDataAlgoImplicitGEMM:ConvHipImplicitGemmBwdDataV1R1,3,74455,0,miopenConvolutionBwdDataAlgoImplicitGEMM;miopenConvolutionBwdDataAlgoGEMM:gemm,6,4047,1294720,MIOpenGEMM
384-8-8-1x3-384-8-8-128-0x1-1x1-1x1-0-NCHW-FP32-B=miopenConvolutionBwdDataAlgoWinograd:ConvBinWinogradRxS,0,936606,0,miopenConvolutionBwdDataAlgoWinograd;miopenConvolutionBwdDataAlgoImplicitGEMM:ConvHipImplicitGemmBwdDataV1R1,1,18352,0,miopenConvolutionBwdDataAlgoImplicitGEMM;miopenConvolutionBwdDataAlgoGEMM:gemm,5,42027,294912,MIOpenGEMM
64-35-35-1x1-288-35-35-128-0x0-1x1-1x1-0-NCHW-FP32-W=miopenConvolutionBwdWeightsAlgoDirect:ConvAsmBwdWrW1x1,1,51467,0,miopenConvolutionBwdWeightsAlgoDirect;miopenConvolutionBwdWeightsAlgoGEMM:gemm,2,99506,0,MIOpenGEMM;miopenConvolutionBwdWeightsAlgoWinograd:ConvBinWinogradRxSf2x3,4,74267,0,miopenConvolutionBwdWeightsAlgoWinograd
192-35-35-1x1-48-35-35-128-0x0-1x1-1x1-0-NCHW-FP32-F=miopenConvolutionFwdAlgoDirect:ConvAsm1x1U,0,420331,0,miopenConvolutionFwdAlgoDirect;miopenConvolutionFwdAlgoGEMM:GemmFwd1x1_0_1,3,55282,0,MIOpenGEMM
192-17-17-3x3-192-8-8-128-0x0-2x2-1x1-0-NCHW-FP32-F=miopenConvolutionFwdAlgoWinograd:ConvBinWinogradRxSf2x3,0,987024,0,miopenConvolutionFwdAlgoWinograd;miopenConvolutionFwdAlgoDirect:ConvOclDirectFwd,2,93016,0,miopenConvolutionFwdAlgoDirect;miopenConvolutionFwdAlgoGEMM:GemmFwdRest,17,9536,442368,MIOpenGEMM
320-8-8-1x1-2048-8-8-128-0x0-1x1-1x1-0-NCHW-FP32-W=miopenConvolutionBwdWeightsAlgoDirect:ConvAsmBwdWrW1x1,1,8061,0,miopenConvolutionBwdWeightsAlgoDirect;miopenConvolutionBwdWeightsAlgoGEMM:gemm,3,22913,0,MIOpenGEMM;miopenConvolutionBwdWeightsAlgoWinograd:ConvBinWinogradRxSf2x3,3,84951,0,miopenConvolutionBwdWeightsAlgoWinograd
64-35-35-1x1-256-35-35-128-0x0-1x1-1x1-0-NCHW-FP32-B=miopenConvolutionBwdDataAlgoDirect:ConvAsm1x1U,0,732947,0,miopenConvolutionBwdDataAlgoDirect;miopenConvolutionBwdDataAlgoGEMM:gemm,5,38701,0,MIOpenGEMM
160-17-17-7x1-160-17-17-128-3x0-1x1-1x1-0-NCHW-FP32-F=miopenConvolutionFwdAlgoImplicitGEMM:ConvHipImplicitGemmV4R1Fwd,1,49661,0,miopenConvolutionFwdAlgoImplicitGEMM;miopenConvolutionFwdAlgoWinograd:ConvBinWinogradRxSf3x2,1,73981,0,miopenConvolutionFwdAlgoWinograd;miopenConvolutionFwdAlgoGEMM:GemmFwdRest,7,84144,1294720,MIOpenGEMM
384-8-8-1x3-384-8-8-128-0x1-1x1-1x1-0-NCHW-FP32-F=miopenConvolutionFwdAlgoImplicitGEMM:ConvHipImplicitGemmV4R1Fwd,0,782036,0,miopenConvolutionFwdAlgoImplicitGEMM;miopenConvolutionFwdAlgoWinograd:ConvBinWinogradRxS,0,901707,0,miopenConvolutionFwdAlgoWinograd;miopenConvolutionFwdAlgoGEMM:GemmFwdRest,9,7461,294912,MIOpenGEMM
192-17-17-1x7-192-17-17-128-0x3-1x1-1x1-0-NCHW-FP32-W=miopenConvolutionBwdWeightsAlgoWinograd:ConvBinWinogradRxSf2x3,2,66145,0,miopenConvolutionBwdWeightsAlgoWinograd;miopenConvolutionBwdWeightsAlgoImplicitGEMM:ConvHipImplicitGemmV4R1WrW,4,1324,0,miopenConvolutionBwdWeightsAlgoImplicitGEMM;miopenConvolutionBwdWeightsAlgoDirect:ConvOclBwdWrW53,5,62645,0,miopenConvolutionBwdWeightsAlgoDirect;miopenConvolutionBwdWeightsAlgoGEMM:gemm,6,17408,1553664,MIOpenGEMM
160-17-17-1x7-160-17-17-128-0x3-1x1-1x1-0-NCHW-FP32-W=miopenConvolutionBwdWeightsAlgoWinograd:ConvBinWinogradRxSf2x3,1,83147,0,miopenConvolutionBwdWeightsAlgoWinograd;miopenConvolutionBwdWeightsAlgoDirect:ConvOclBwdWrW53,3,55454,0,miopenConvolutionBwdWeightsAlgoDirect;miopenConvolutionBwdWeightsAlgoGEMM:gemm,5,95888,1294720,MIOpenGEMM
128-17-17-1x7-128-17-17-128-0x3-1x1-1x1-0-NCHW-FP32-B=miopenConvolutionBwdDataAlgoWinograd:ConvBinWinogradRxSf3x2,1,3723,0,miopenConvolutionBwdDataAlgoWinograd;miopenConvolutionBwdDataAlgoImplicitGEMM:ConvHipImplicitGemmBwdDataV1R1,2,22471,0,miopenConvolutionBwdDataAlgoImplicitGEMM;miopenConvolutionBwdDataAlgoGEMM:gemm,46,4361,1035776,MIOpenGEMM
448-8-8-1x1-1280-8-8-128-0x0-1x1-1x1-0-NCHW-FP32-B=miopenConvolutionBwdDataAlgoDirect:ConvAsm1x1U,0,931026,0,miopenConvolutionBwdDataAlgoDirect;miopenConvolutionBwdDataAlgoWinograd:ConvBinWinogradRxSf3x2,2,28151,0,miopenConvolutionBwdDataAlgoWinograd;miopenConvolutionBwdDataAlgoGEMM:gemm,5,30411,0,MIOpenGEMM
1280-8-8-1x1-192-8-8-128-0x0-1x1-1x1-0-NCHW-FP32-F=miopenConvolutionFwdAlgoDirect:ConvAsm1x1U,0,736715,0,miopenConvolutionFwdAlgoDirect;miopenConvolutionFwdAlgoWinograd:ConvBinWinogradRxSf3x2,1,18929,0,miopenConvolutionFwdAlgoWinograd;miopenConvolutionFwdAlgoGEMM:GemmFwd1x1_0_1,9,747,0,MIOpenGEMM
32-35-35-1x1-192-35-35-128-0x0-1x1-1x1-0-NCHW-FP32-W=miopenConvolutionBwdWeightsAlgoDirect:ConvAsmBwdWrW1x1,0,592804,0,miopenConvolutionBwdWeightsAlgoDirect
64-35-35-1x1-288-35-35-128-0x0-1x1-1x1-0-NCHW-FP32-B=miopenConvolutionBwdDataAlgoDirect:ConvAsm1x1U,0,898203,0,miopenConvolutionBwdDataAlgoDirect;miopenConvolutionBwdDataAlgoGEMM:gemm,8,3848,0,MIOpenGEMM
128-17-17-1x7-128-17-17-128-0x3-1x1-1x1-0-NCHW-FP32-F=miopenConvolutionFwdAlgoImplicitGEMM:ConvHipImplicitGemmV4R1Fwd,0,943513,0,miopenConvolutionFwdAlgoImplicitGEMM;miopenConvolutionFwdAlgoWinograd:ConvBinWinogradRxSf3x2,1,4353,0,miopenConvolutionFwdAlgoWinograd;miopenConvolutionFwdAlgoGEMM:GemmFwdRest,7,91776,1035776,MIOpenGEMM
1280-8-8-1x1-448-8-8-128-0x0-1x1-1x1-0-NCHW-FP32-F=miopenConvolutionFwdAlgoDirect:ConvAsm1x1U,1,31973,0,miopenConvolutionFwdAlgoDirect;miopenConvolutionFwdAlgoWinograd:ConvBinWinogradRxSf3x2,2,12684,0,miopenConvolutionFwdAlgoWinograd;miopenConvolutionFwdAlgoGEMM:GemmFwd1x1_0_1,5,727,0,MIOpenGEMM
320-8-8-1x1-2048-8-8-128-0x0-1x1-1x1-0-NCHW-FP32-B=miopenConvolutionBwdDataAlgoDirect:ConvAsm1x1U,1,3272,0,miopenConvolutionBwdDataAlgoDirect;miopenConvolutionBwdDataAlgoWinograd:ConvBinWinogradRxSf3x2,2,73066,0,miopenConvolutionBwdDataAlgoWinograd;miopenConvolutionBwdDataAlgoGEMM:gemm,4,76292,0,MIOpenGEMM
32-147-147-3x3-32-149-149-128-0x0-1x1-1x1-0-NCHW-FP32-W=miopenConvolutionBwdWeightsAlgoDirect:ConvOclBwdWrW53,21,2294,4718592,miopenConvolutionBwdWeightsAlgoDirect;miopenConvolutionBwdWeightsAlgoWinograd:ConvBinWinogradRxSf2x3,75,4314,0,miopenConvolutionBwdWeightsAlgoWinograd;miopenConvolutionBwdWeightsAlgoGEMM:gemm,82,3741,24893568,MIOpenGEMM
256-35-35-1x1-64-35-35-128-0x0-1x1-1x1-0-NCHW-FP32-F=miopenConvolutionFwdAlgoDirect:ConvOclDirectFwd1x1,0,670325,0,miopenConvolutionFwdAlgoDirect;miopenConvolutionFwdAlgoWinograd:ConvBinWinogradRxSf3x2,1,17595,0,miopenConvolutionFwdAlgoWinograd;miopenConvolutionFwdAlgoGEMM:GemmFwd1x1_0_1,5,89396,0,MIOpenGEMM
192-17-17-1x7-192-17-17-128-0x3-1x1-1x1-0-NCHW-FP32-B=miopenConvolutionBwdDataAlgoWinograd:ConvBinWinogradRxSf3x2,2,3131,0,miopenConvolutionBwdDataAlgoWinograd;miopenConvolutionBwdDataAlgoImplicitGEMM:ConvHipImplicitGemmBwdDataV1R1,4,1908,0,miopenConvolutionBwdDataAlgoImplicitGEMM;miopenConvolutionBwdDataAlgoGEMM:gemm,7,76896,1553664,MIOpenGEMM
192-17-17-7x1-128-17-17-128-3x0-1x1-1x1-0-NCHW-FP32-W=miopenConvolutionBwdWeightsAlgoWinograd:ConvBinWinogradRxSf2x3,2,2202,0,miopenConvolutionBwdWeightsAlgoWinograd;miopenConvolutionBwdWeightsAlgoDirect:ConvOclBwdWrW53,2,26793,0,miopenConvolutionBwdWeightsAlgoDirect;miopenConvolutionBwdWeightsAlgoImplicitGEMM:ConvHipImplicitGemmV4R1WrW,3,96473,0,miopenConvolutionBwdWeightsAlgoImplicitGEMM;miopenConvolutionBwdWeightsAlgoGEMM:gemm,5,2845,1035776,MIOpenGEMM
160-17-17-1x7-160-17-17-128-0x3-1x1-1x1-0-NCHW-FP32-B=miopenConvolutionBwdDataAlgoWinograd:ConvBinWinogradRxSf3x2,1,57411,0,miopenConvolutionBwdDataAlgoWinograd;miopenConvolutionBwdDataAlgoImplicitGEMM:ConvHipImplicitGemmBwdDataV1R1,3,50152,0,miopenConvolutionBwdDataAlgoImplicitGEMM;miopenConvolutionBwdDataAlgoGEMM:gemm,5,65074,1294720,MIOpenGEMM
64-35-35-5x5-48-35-35-128-2x2-1x1-1x1-0-NCHW-FP32-W=miopenConvolutionBwdWeightsAlgoWinograd:ConvBinWinogradRxSf2x3,3,78451,0,miopenConvolutionBwdWeightsAlgoWinograd;miopenConvolutionBwdWeightsAlgoDirect:ConvOclBwdWrW2<4>,4,55459,9830400,miopenConvolutionBwdWeightsAlgoDirect;miopenConvolutionBwdWeightsAlgoGEMM:gemm,12,7359,5880000,MIOpenGEMM
384-8-8-1x1-1280-8-8-128-0x0-1x1-1x1-0-NCHW-FP32-W=miopenConvolutionBwdWeightsAlgoDirect:ConvAsmBwdWrW1x1,0,822864,0,miopenConvolutionBwdWeightsAlgoDirect;miopenConvolutionBwdWeightsAlgoGEMM:gemm,2,22555,0,MIOpenGEMM;miopenConvolutionBwdWeightsAlgoWinograd:ConvBinWinogradRxSf2x3,2,80355,0,miopenConvolutionBwdWeightsAlgoWinograd
192-17-17-7x1-128-17-17-128-3x0-1x1-1x1-0-NCHW-FP32-B=miopenConvolutionBwdDataAlgoWinograd:ConvBinWinogradRxSf3x2,1,50323,0,miopenConvolutionBwdDataAlgoWinograd;miopenConvolutionBwdDataAlgoImplicitGEMM:ConvHipImplicitGemmBwdDataV1R1,2,15659,0,miopenConvolutionBwdDataAlgoImplicitGEMM;miopenConvolutionBwdDataAlgoGEMM:gemm,6,6022,1035776,MIOpenGEMM
128-28-28-1x1-256-28-28-128-0x0-1x1-1x1-0-NCHW-FP32-W=miopenConvolutionBwdWeightsAlgoDirect:ConvAsmBwdWrW1x1,0,830076,0,miopenConvolutionBwdWeightsAlgoDirect
32-35-35-1x1-192-35-35-128-0x0-1x1-1x1-0-NCHW-FP32-B=miopenConvolutionBwdDataAlgoDirect:ConvAsm1x1U,0,49388,0,miopenConvolutionBwdDataAlgoDirect;miopenConvolutionBwdDataAlgoGEMM:gemm,1,53282,0,MIOpenGEMM
768-17-17-1x1-160-17-17-128-0x0-1x1-1x1-0-NCHW-FP32-F=miopenConvolutionFwdAlgoDirect:ConvAsm1x1U,1,18099,0,miopenConvolutionFwdAlgoDirect;miopenConvolutionFwdAlgoGEMM:GemmFwd1x1_0_1,5,31557,0,MIOpenGEMM
64-35-35-5x5-48-35-35-128-2x2-1x1-1x1-0-NCHW-FP32-B=miopenConvolutionBwdDataAlgoWinograd:ConvBinWinogradRxS,2,7154,0,miopenConvolutionBwdDataAlgoWinograd;miopenConvolutionBwdDataAlgoDirect:ConvOclDirectFwd,7,54798,0,miopenConvolutionBwdDataAlgoDirect;miopenConvolutionBwdDataAlgoGEMM:gemm,17,2782,5880000,MIOpenGEMM
288-35-35-1x1-64-35-35-128-0x0-1x1-1x1-0-NCHW-FP32-F=miopenConvolutionFwdAlgoDirect:ConvAsm1x1U,0,690062,0,miopenConvolutionFwdAlgoDirect;miopenConvolutionFwdAlgoWinograd:ConvBinWinogradRxSf3x2,1,14857,0,miopenConvolutionFwdAlgoWinograd;miopenConvolutionFwdAlgoGEMM:GemmFwd1x1_0_1,5,88976,0,MIOpenGEMM
192-17-17-1x7-192-17-17-128-0x3-1x1-1x1-0-NCHW-FP32-F=miopenConvolutionFwdAlgoImplicitGEMM:ConvHipImplicitGemmV4R1Fwd,1,98569,0,miopenConvolutionFwdAlgoImplicitGEMM;miopenConvolutionFwdAlgoWinograd:ConvBinWinogradRxSf3x2,2,28713,0,miopenConvolutionFwdAlgoWinograd;miopenConvolutionFwdAlgoGEMM:GemmFwdRest,9,53279,1553664,MIOpenGEMM
384-8-8-1x1-1280-8-8-128-0x0-1x1-1x1-0-NCHW-FP32-B=miopenConvolutionBwdDataAlgoDirect:ConvAsm1x1U,0,671758,0,miopenConvolutionBwdDataAlgoDirect;miopenConvolutionBwdDataAlgoWinograd:ConvBinWinogradRxSf3x2,1,81001,0,miopenConvolutionBwdDataAlgoWinograd;miopenConvolutionBwdDataAlgoGEMM:gemm,4,54032,0,MIOpenGEMM
96-17-17-3x3-96-35-35-128-0x0-2x2-1x1-0-NCHW-FP32-B=miopenConvolutionBwdDataAlgoWinograd:ConvBinWinogradRxSf2x3,1,39325,0,miopenConvolutionBwdDataAlgoWinograd;miopenConvolutionBwdDataAlgoImplicitGEMM:ConvHipImplicitGemmBwdDataV1R1,3,52804,0,miopenConvolutionBwdDataAlgoImplicitGEMM;miopenConvolutionBwdDataAlgoDirect:ConvOclDirectFwd,4,34723,0,miopenConvolutionBwdDataAlgoDirect;miopenConvolutionBwdDataAlgoGEMM:gemm,28,996,998784,MIOpenGEMM
48-35-35-1x1-256-35-35-128-0x0-1x1-1x1-0-NCHW-FP32-W=miopenConvolutionBwdWeightsAlgoDirect:ConvAsmBwdWrW1x1,0,911827,0,miopenConvolutionBwdWeightsAlgoDirect
32-147-147-3x3-32-149-149-128-0x0-1x1-1x1-0-NCHW-FP32-B=miopenConvolutionBwdDataAlgoWinograd:ConvBinWinogradRxS,2,7756,0,miopenConvolutionBwdDataAlgoWinograd;miopenConvolutionBwdDataAlgoDirect:ConvOclDirectFwd,13,6947,0,miopenConvolutionBwdDataAlgoDirect;miopenConvolutionBwdDataAlgoImplicitGEMM:ConvHipImplicitGemmBwdDataV1R1,51,26,0,miopenConvolutionBwdDataAlgoImplicitGEMM;miopenConvolutionBwdDataAlgoGEMM:gemm,153,149,24893568,MIOpenGEMM
128-17-17-7x1-192-17-17-128-3x0-1x1-1x1-0-NCHW-FP32-F=miopenConvolutionFwdAlgoImplicitGEMM:ConvHipImplicitGemmV4R1Fwd,1,37539,0,miopenConvolutionFwdAlgoImplicitGEMM;miopenConvolutionFwdAlgoWinograd:ConvBinWinogradRxSf3x2,1,70852,0,miopenConvolutionFwdAlgoWinograd;miopenConvolutionFwdAlgoGEMM:GemmFwdRest,9,92288,1035776,MIOpenGEMM
2048-8-8-1x1-320-8-8-128-0x0-1x1-1x1-0-NCHW-FP32-F=miopenConvolutionFwdAlgoDirect:ConvAsm1x1U,1,44637,0,miopenConvolutionFwdAlgoDirect;miopenConvolutionFwdAlgoWinograd:ConvBinWinogradRxSf3x2,2,46632,0,miopenConvolutionFwdAlgoWinograd;miopenConvolutionFwdAlgoGEMM:GemmFwd1x1_0_1,5,33441,0,MIOpenGEMM
256-14-14-1x1-528-14-14-128-0x0-1x1-1x1-0-NCHW-FP32-B=miopenConvolutionBwdDataAlgoDirect:ConvAsm1x1U,0,691146,0,miopenConvolutionBwdDataAlgoDirect;miopenConvolutionBwdDataAlgoGEMM:gemm,2,48478,0,MIOpenGEMM
48-35-35-5x5-64-35-35-128-2x2-1x1-1x1-0-NCHW-FP32-F=miopenConvolutionFwdAlgoWinograd:ConvBinWinogradRxS,1,57344,0,miopenConvolutionFwdAlgoWinograd;miopenConvolutionFwdAlgoImplicitGEMM:ConvHipImplicitGemmV4R1Fwd,2,57294,0,miopenConvolutionFwdAlgoImplicitGEMM;miopenConvolutionFwdAlgoDirect:ConvOclDirectFwd,8,58482,0,miopenConvolutionFwdAlgoDirect;miopenConvolutionFwdAlgoGEMM:GemmFwdRest,9,36743,5880000,MIOpenGEMM
128-17-17-1x1-768-17-17-128-0x0-1x1-1x1-0-NCHW-FP32-W=miopenConvolutionBwdWeightsAlgoDirect:ConvAsmBwdWrW1x1,0,9585,0,miopenConvolutionBwdWeightsAlgoDirect
48-35-35-1x1-288-35-35-128-0x0-1x1-1x1-0-NCHW-FP32-W=miopenConvolutionBwdWeightsAlgoDirect:ConvAsmBwdWrW1x1,0,997435,0,miopenConvolutionBwdWeightsAlgoDirect;miopenConvolutionBwdWeightsAlgoGEMM:gemm,2,74176,0,MIOpenGEMM;miopenConvolutionBwdWeightsAlgoWinograd:ConvBinWinogradRxSf2x3,5,433,0,miopenConvolutionBwdWeightsAlgoWinograd
192-35-35-1x1-32-35-35-128-0x0-1x1-1x1-0-NCHW-FP32-F=miopenConvolutionFwdAlgoDirect:ConvOclDirectFwd1x1,0,303539,0,miopenConvolutionFwdAlgoDirect;miopenConvolutionFwdAlgoGEMM:GemmFwd1x1_0_1,1,95376,0,MIOpenGEMM
1280-8-8-1x1-384-8-8-128-0x0-1x1-1x1-0-NCHW-FP32-F=miopenConvolutionFwdAlgoDirect:ConvAsm1x1U,1,1902,0,miopenConvolutionFwdAlgoDirect;miopenConvolutionFwdAlgoWinograd:ConvBinWinogradRxSf3x2,1,82732,0,miopenConvolutionFwdAlgoWinograd;miopenConvolutionFwdAlgoGEMM:GemmFwd1x1_0_1,4,28096,0,MIOpenGEMM
192-17-17-1x7-128-17-17-128-0x3-1x1-1x1-0-NCHW-FP32-W=miopenConvolutionBwdWeightsAlgoWinograd:ConvBinWinogradRxSf2x3,1,73098,0,miopenConvolutionBwdWeightsAlgoWinograd;miopenConvolutionBwdWeightsAlgoDirect:ConvOclBwdWrW53,3,55516,0,miopenConvolutionBwdWeightsAlgoDirect;miopenConvolutionBwdWeightsAlgoImplicitGEMM:ConvHipImplicitGemmV4R1WrW,3,94078,0,miopenConvolutionBwdWeightsAlgoImplicitGEMM;miopenConvolutionBwdWeightsAlgoGEMM:gemm,5,2418,1035776,MIOpenGEMM
192-17-17-3x3-320-8-8-128-0x0-2x2-1x1-0-NCHW-FP32-F=miopenConvolutionFwdAlgoWinograd:ConvBinWinogradRxSf2x3,1,51386,0,miopenConvolutionFwdAlgoWinograd;miopenConvolutionFwdAlgoDirect:ConvOclDirectFwd,4,19787,0,miopenConvolutionFwdAlgoDirect;miopenConvolutionFwdAlgoGEMM:GemmFwdRest,5,76937,442368,MIOpenGEMM
384-8-8-3x1-384-8-8-128-1x0-1x1-1x1-0-NCHW-FP32-F=miopenConvolutionFwdAlgoImplicitGEMM:ConvHipImplicitGemmV4R1Fwd,0,841978,0,miopenConvolutionFwdAlgoImplicitGEMM;miopenConvolutionFwdAlgoWinograd:ConvBinWinogradRxSf2x3,0,992581,0,miopenConvolutionFwdAlgoWinograd;miopenConvolutionFwdAlgoGEMM:GemmFwdRest,11,8708,294912,MIOpenGEMM
96-35-35-3x3-96-17-17-128-0x0-2x2-1x1-0-NCHW-FP32-F=miopenConvolutionFwdAlgoWinograd:ConvBinWinogradRxS,1,30745,0,miopenConvolutionFwdAlgoWinograd;miopenConvolutionFwdAlgoDirect:ConvOclDirectFwd,5,97873,0,miopenConvolutionFwdAlgoDirect;miopenConvolutionFwdAlgoGEMM:GemmFwdRest,7,52516,998784,MIOpenGEMM
32-149-149-3x3-32-147-147-128-0x0-1x1-1x1-0-NCHW-FP32-F=miopenConvolutionFwdAlgoWinograd:ConvBinWinogradRxS,2,83678,0,miopenConvolutionFwdAlgoWinograd;miopenConvolutionFwdAlgoGEMM:GemmFwdRest,14,7452,24893568,MIOpenGEMM;miopenConvolutionFwdAlgoDirect:ConvOclDirectFwd,15,2682,0,miopenConvolutionFwdAlgoDirect
192-17-17-7x1-160-17-17-128-3x0-1x1-1x1-0-NCHW-FP32-W=miopenConvolutionBwdWeightsAlgoWinograd:ConvBinWinogradRxSf2x3,2,75518,0,miopenConvolutionBwdWeightsAlgoWinograd;miopenConvolutionBwdWeightsAlgoDirect:ConvOclBwdWrW53,3,3612,0,miopenConvolutionBwdWeightsAlgoDirect;miopenConvolutionBwdWeightsAlgoGEMM:gemm,5,31157,1294720,MIOpenGEMM
192-8-8-1x1-2048-8-8-128-0x0-1x1-1x1-0-NCHW-FP32-W=miopenConvolutionBwdWeightsAlgoDirect:ConvAsmBwdWrW1x1,0,768895,0,miopenConvolutionBwdWeightsAlgoDirect;miopenConvolutionBwdWeightsAlgoWinograd:ConvBinWinogradRxSf2x3,2,5391,0,miopenConvolutionBwdWeightsAlgoWinograd;miopenConvolutionBwdWeightsAlgoGEMM:gemm,2,82135,0,MIOpenGEMM
48-35-35-1x1-256-35-35-128-0x0-1x1-1x1-0-NCHW-FP32-B=miopenConvolutionBwdDataAlgoDirect:ConvAsm1x1U,0,554925,0,miopenConvolutionBwdDataAlgoDirect;miopenConvolutionBwdDataAlgoWinograd:ConvBinWinogradRxSf3x2,1,2779,0,miopenConvolutionBwdDataAlgoWinograd;miopenConvolutionBwdDataAlgoGEMM:gemm,5,3602,0,MIOpenGEMM
320-8-8-3x3-192-17-17-128-0x0-2x2-1x1-0-NCHW-FP32-W=miopenConvolutionBwdWeightsAlgoImplicitGEMM:ConvHipImplicitGemmV4R1WrW,1,80045,0,miopenConvolutionBwdWeightsAlgoImplicitGEMM;miopenConvolutionBwdWeightsAlgoGEMM:gemm,6,28862,442368,MIOpenGEMM;miopenConvolutionBwdWeightsAlgoDirect:ConvOclBwdWrW2NonTunable,21,781,283115520,miopenConvolutionBwdWeightsAlgoDirect
384-8-8-3x3-448-8-8-128-1x1-1x1-1x1-0-NCHW-FP32-W=miopenConvolutionBwdWeightsAlgoWinograd:ConvBinWinogradRxS,1,68954,0,miopenConvolutionBwdWeightsAlgoWinograd;miopenConvolutionBwdWeightsAlgoDirect:ConvOclBwdWrW53,2,95759,0,miopenConvolutionBwdWeightsAlgoDirect;miopenConvolutionBwdWeightsAlgoImplicitGEMM:ConvHipImplicitGemmV4R1WrW,3,33785,0,miopenConvolutionBwdWeightsAlgoImplicitGEMM;miopenConvolutionBwdWeightsAlgoGEMM:gemm,19,5296,1032192,MIOpenGEMM
48-35-35-1x1-288-35-35-128-0x0-1x1-1x1-0-NCHW-FP32-B=miopenConvolutionBwdDataAlgoDirect:ConvAsm1x1U,0,800466,0,miopenConvolutionBwdDataAlgoDirect;miopenConvolutionBwdDataAlgoGEMM:gemm,3,89217,0,MIOpenGEMM
192-71-71-3x3-80-73-73-128-0x0-1x1-1x1-0-NCHW-FP32-W=miopenConvolutionBwdWeightsAlgoWinograd:ConvBinWinogradRxSf2x3,25,4746,0,miopenConvolutionBwdWeightsAlgoWinograd;miopenConvolutionBwdWeightsAlgoDirect:ConvOclBwdWrW2NonTunable,82,5134,70778880,miopenConvolutionBwdWeightsAlgoDirect;miopenConvolutionBwdWeightsAlgoGEMM:gemm,214,915,14518080,MIOpenGEMM
320-8-8-1x1-1280-8-8-128-0x0-1x1-1x1-0-NCHW-FP32-W=miopenConvolutionBwdWeightsAlgoDirect:ConvAsmBwdWrW1x1,0,991839,0,miopenConvolutionBwdWeightsAlgoDirect;miopenConvolutionBwdWeightsAlgoWinograd:ConvBinWinogradRxSf2x3,2,72555,0,miopenConvolutionBwdWeightsAlgoWinograd;miopenConvolutionBwdWeightsAlgoGEMM:gemm,2,77637,0,MIOpenGEMM
384-8-8-3x3-448-8-8-128-1x1-1x1-1x1-0-NCHW-FP32-B=miopenConvolutionBwdDataAlgoWinograd:ConvBinWinograd3x3U,1,2062,0,miopenConvolutionBwdDataAlgoWinograd
192-17-17-1x7-128-17-17-128-0x3-1x1-1x1-0-NCHW-FP32-B=miopenConvolutionBwdDataAlgoWinograd:ConvBinWinogradRxSf3x2,1,59788,0,miopenConvolutionBwdDataAlgoWinograd;miopenConvolutionBwdDataAlgoImplicitGEMM:ConvHipImplicitGemmBwdDataV1R1,5,16191,0,miopenConvolutionBwdDataAlgoImplicitGEMM;miopenConvolutionBwdDataAlgoGEMM:gemm,9,2708,1035776,MIOpenGEMM
64-147-147-3x3-32-147-147-128-1x1-1x1-1x1-0-NCHW-FP32-W=miopenConvolutionBwdWeightsAlgoDirect:ConvAsmBwdWrW3x3,10,6795,0,miopenConvolutionBwdWeightsAlgoDirect;miopenConvolutionBwdWeightsAlgoGEMM:gemm,55,9369,24893568,MIOpenGEMM;miopenConvolutionBwdWeightsAlgoWinograd:ConvBinWinogradRxSf2x3,69,8769,0,miopenConvolutionBwdWeightsAlgoWinograd
192-8-8-1x1-2048-8-8-128-0x0-1x1-1x1-0-NCHW-FP32-B=miopenConvolutionBwdDataAlgoDirect:ConvAsm1x1U,0,639974,0,miopenConvolutionBwdDataAlgoDirect;miopenConvolutionBwdDataAlgoWinograd:ConvBinWinogradRxSf3x2,1,64166,0,miopenConvolutionBwdDataAlgoWinograd;miopenConvolutionBwdDataAlgoGEMM:gemm,3,35234,0,MIOpenGEMM
320-8-8-3x3-192-17-17-128-0x0-2x2-1x1-0-NCHW-FP32-B=miopenConvolutionBwdDataAlgoImplicitGEMM:ConvHipImplicitGemmBwdDataV1R1,1,71321,0,miopenConvolutionBwdDataAlgoImplicitGEMM;miopenConvolutionBwdDataAlgoWinograd:ConvBinWinogradRxS,2,5028,0,miopenConvolutionBwdDataAlgoWinograd;miopenConvolutionBwdDataAlgoGEMM:gemm,7,79872,442368,MIOpenGEMM;miopenConvolutionBwdDataAlgoDirect:ConvOclDirectFwd,8,7079,0,miopenConvolutionBwdDataAlgoDirect
448-8-8-3x3-384-8-8-128-1x1-1x1-1x1-0-NCHW-FP32-F=miopenConvolutionFwdAlgoWinograd:ConvBinWinograd3x3U,1,2629,0,miopenConvolutionFwdAlgoWinograd
256-35-35-1x1-48-35-35-128-0x0-1x1-1x1-0-NCHW-FP32-F=miopenConvolutionFwdAlgoDirect:ConvAsm1x1U,0,529045,0,miopenConvolutionFwdAlgoDirect;miopenConvolutionFwdAlgoGEMM:GemmFwd1x1_0_1,3,46306,0,MIOpenGEMM
64-147-147-3x3-32-147-147-128-1x1-1x1-1x1-0-NCHW-FP32-B=miopenConvolutionBwdDataAlgoWinograd:ConvBinWinogradRxS,4,98247,0,miopenConvolutionBwdDataAlgoWinograd
192-71-71-3x3-80-73-73-128-0x0-1x1-1x1-0-NCHW-FP32-B=miopenConvolutionBwdDataAlgoWinograd:ConvBinWinogradRxSf2x3,10,6959,0,miopenConvolutionBwdDataAlgoWinograd;miopenConvolutionBwdDataAlgoDirect:ConvOclDirectFwd,49,2524,0,miopenConvolutionBwdDataAlgoDirect;miopenConvolutionBwdDataAlgoGEMM:gemm,120,272,14518080,MIOpenGEMM
288-35-35-1x1-48-35-35-128-0x0-1x1-1x1-0-NCHW-FP32-F=miopenConvolutionFwdAlgoDirect:ConvOclDirectFwd1x1,0,653,0,miopenConvolutionFwdAlgoDirect;miopenConvolutionFwdAlgoGEMM:GemmFwd1x1_0_1,3,62081,0,MIOpenGEMM
32-147-147-3x3-64-147-147-128-1x1-1x1-1x1-0-NCHW-FP32-F=miopenConvolutionFwdAlgoWinograd:ConvBinWinograd3x3U,5,719,0,miopenConvolutionFwdAlgoWinograd
32-149-149-3x3-3-299-299-128-0x0-2x2-1x1-0-NCHW-FP32-W=miopenConvolutionBwdWeightsAlgoDirect:ConvOclBwdWrW2NonTunable,5,61859,442368,miopenConvolutionBwdWeightsAlgoDirect;miopenConvolutionBwdWeightsAlgoGEMM:gemm,7,57934,2397708,MIOpenGEMM
384-17-17-3x3-288-35-35-128-0x0-2x2-1x1-0-NCHW-FP32-W=miopenConvolutionBwdWeightsAlgoGEMM:gemm,21,3402,2996352,MIOpenGEMM;miopenConvolutionBwdWeightsAlgoDirect:ConvOclBwdWrW2NonTunable,74,4862,509607936,miopenConvolutionBwdWeightsAlgoDirect
2048-8-8-1x1-192-8-8-128-0x0-1x1-1x1-0-NCHW-FP32-F=miopenConvolutionFwdAlgoDirect:ConvAsm1x1U,1,8845,0,miopenConvolutionFwdAlgoDirect;miopenConvolutionFwdAlgoWinograd:ConvBinWinogradRxSf3x2,1,75741,0,miopenConvolutionFwdAlgoWinograd;miopenConvolutionFwdAlgoGEMM:GemmFwd1x1_0_1,4,60613,0,MIOpenGEMM
448-8-8-1x1-2048-8-8-128-0x0-1x1-1x1-0-NCHW-FP32-W=miopenConvolutionBwdWeightsAlgoDirect:ConvAsmBwdWrW1x1,2,32805,0,miopenConvolutionBwdWeightsAlgoDirect;miopenConvolutionBwdWeightsAlgoGEMM:gemm,4,14217,0,MIOpenGEMM;miopenConvolutionBwdWeightsAlgoWinograd:ConvBinWinogradRxSf2x3,5,48816,0,miopenConvolutionBwdWeightsAlgoWinograd
80-73-73-3x3-192-71-71-128-0x0-1x1-1x1-0-NCHW-FP32-F=miopenConvolutionFwdAlgoWinograd:ConvBinWinogradRxSf2x3,8,52507,0,miopenConvolutionFwdAlgoWinograd;miopenConvolutionFwdAlgoDirect:ConvOclDirectFwd,43,8556,0,miopenConvolutionFwdAlgoDirect;miopenConvolutionFwdAlgoGEMM:GemmFwdRest,81,7708,14518080,MIOpenGEMM
384-8-8-3x1-384-8-8-128-1x0-1x1-1x1-0-NCHW-FP32-W=miopenConvolutionBwdWeightsAlgoDirect:ConvOclBwdWrW53,1,1482,0,miopenConvolutionBwdWeightsAlgoDirect;miopenConvolutionBwdWeightsAlgoImplicitGEMM:ConvHipImplicitGemmV4R1WrW,1,28936,0,miopenConvolutionBwdWeightsAlgoImplicitGEMM;miopenConvolutionBwdWeightsAlgoWinograd:ConvBinWinogradRxSf2x3,1,54227,0,miopenConvolutionBwdWeightsAlgoWinograd;miopenConvolutionBwdWeightsAlgoGEMM:gemm,2,96672,294912,MIOpenGEMM
32-149-149-3x3-3-299-299-128-0x0-2x2-1x1-0-NCHW-FP32-B=miopenConvolutionBwdDataAlgoDirect:ConvOclDirectFwd,3,34256,0,miopenConvolutionBwdDataAlgoDirect;miopenConvolutionBwdDataAlgoWinograd:ConvBinWinogradRxS,5,64102,0,miopenConvolutionBwdDataAlgoWinograd;miopenConvolutionBwdDataAlgoGEMM:gemm,7,84415,2397708,MIOpenGEMM
128-17-17-1x7-192-17-17-128-0x3-1x1-1x1-0-NCHW-FP32-F=miopenConvolutionFwdAlgoWinograd:ConvBinWinogradRxSf3x2,1,48651,0,miopenConvolutionFwdAlgoWinograd;miopenConvolutionFwdAlgoImplicitGEMM:ConvHipImplicitGemmV4R1Fwd,1,49865,0,miopenConvolutionFwdAlgoImplicitGEMM;miopenConvolutionFwdAlgoGEMM:GemmFwdRest,8,88312,1035776,MIOpenGEMM
384-17-17-3x3-288-35-35-128-0x0-2x2-1x1-0-NCHW-FP32-B=miopenConvolutionBwdDataAlgoWinograd:ConvBinWinogradRxSf2x3,14,3149,0,miopenConvolutionBwdDataAlgoWinograd;miopenConvolutionBwdDataAlgoImplicitGEMM:ConvHipImplicitGemmBwdDataV1R1,15,874,0,miopenConvolutionBwdDataAlgoImplicitGEMM;miopenConvolutionBwdDataAlgoGEMM:gemm,26,2818,2996352,MIOpenGEMM;miopenConvolutionBwdDataAlgoDirect:ConvOclDirectFwd,43,187,0,miopenConvolutionBwdDataAlgoDirect
64-35-35-1x1-192-35-35-128-0x0-1x1-1x1-0-NCHW-FP32-W=miopenConvolutionBwdWeightsAlgoDirect:ConvAsmBwdWrW1x1,0,835232,0,miopenConvolutionBwdWeightsAlgoDirect
192-17-17-1x1-768-17-17-128-0x0-1x1-1x1-0-NCHW-FP32-W=miopenConvolutionBwdWeightsAlgoDirect:ConvAsmBwdWrW1x1,1,92421,0,miopenConvolutionBwdWeightsAlgoDirect
320-8-8-1x1-1280-8-8-128-0x0-1x1-1x1-0-NCHW-FP32-B=miopenConvolutionBwdDataAlgoDirect:ConvAsm1x1U,0,652376,0,miopenConvolutionBwdDataAlgoDirect;miopenConvolutionBwdDataAlgoWinograd:ConvBinWinogradRxSf3x2,1,69604,0,miopenConvolutionBwdDataAlgoWinograd;miopenConvolutionBwdDataAlgoGEMM:gemm,5,9733,0,MIOpenGEMM
448-8-8-1x1-2048-8-8-128-0x0-1x1-1x1-0-NCHW-FP32-B=miopenConvolutionBwdDataAlgoDirect:ConvAsm1x1U,1,7039,0,miopenConvolutionBwdDataAlgoDirect;miopenConvolutionBwdDataAlgoWinograd:ConvBinWinogradRxSf3x2,3,71642,0,miopenConvolutionBwdDataAlgoWinograd;miopenConvolutionBwdDataAlgoGEMM:gemm,5,57987,0,MIOpenGEMM
96-35-35-3x3-96-35-35-128-1x1-1x1-1x1-0-NCHW-FP32-B=miopenConvolutionBwdDataAlgoWinograd:ConvBinWinogradRxSf2x3,1,23049,0,miopenConvolutionBwdDataAlgoWinograd
64-35-35-3x3-96-35-35-128-1x1-1x1-1x1-0-NCHW-FP32-F=miopenConvolutionFwdAlgoWinograd:ConvBinWinogradRxS,0,904345,0,miopenConvolutionFwdAlgoWinograd
288-35-35-3x3-384-17-17-128-0x0-2x2-1x1-0-NCHW-FP32-F=miopenConvolutionFwdAlgoWinograd:ConvBinWinogradRxS,14,5411,0,miopenConvolutionFwdAlgoWinograd;miopenConvolutionFwdAlgoGEMM:GemmFwdRest,26,5298,2996352,MIOpenGEMM;miopenConvolutionFwdAlgoDirect:ConvOclDirectFwd,67,9922,0,miopenConvolutionFwdAlgoDirect
192-17-17-1x1-768-17-17-128-0x0-1x1-1x1-0-NCHW-FP32-B=miopenConvolutionBwdDataAlgoDirect:ConvAsm1x1U,1,9728,0,miopenConvolutionBwdDataAlgoDirect;miopenConvolutionBwdDataAlgoWinograd:ConvBinWinogradRxSf3x2,2,47988,0,miopenConvolutionBwdDataAlgoWinograd;miopenConvolutionBwdDataAlgoGEMM:gemm,4,927,0,MIOpenGEMM
64-35-35-1x1-192-35-35-128-0x0-1x1-1x1-0-NCHW-FP32-B=miopenConvolutionBwdDataAlgoDirect:ConvAsm1x1U,0,560222,0,miopenConvolutionBwdDataAlgoDirect;miopenConvolutionBwdDataAlgoGEMM:gemm,4,5313,0,MIOpenGEMM
2048-8-8-1x1-448-8-8-128-0x0-1x1-1x1-0-NCHW-FP32-F=miopenConvolutionFwdAlgoDirect:ConvAsm1x1U,2,30959,0,miopenConvolutionFwdAlgoDirect;miopenConvolutionFwdAlgoWinograd:ConvBinWinogradRxSf3x2,3,63503,0,miopenConvolutionFwdAlgoWinograd;miopenConvolutionFwdAlgoGEMM:GemmFwd1x1_0_1,5,98453,0,MIOpenGEMM
768-17-17-1x1-192-17-17-128-0x0-1x1-1x1-0-NCHW-FP32-F=miopenConvolutionFwdAlgoDirect:ConvAsm1x1U,1,38226,0,miopenConvolutionFwdAlgoDirect;miopenConvolutionFwdAlgoWinograd:ConvBinWinogradRxSf3x2,2,41648,0,miopenConvolutionFwdAlgoWinograd;miopenConvolutionFwdAlgoGEMM:GemmFwd1x1_0_1,6,38292,0,MIOpenGEMM
384-8-8-1x1-2048-8-8-128-0x0-1x1-1x1-0-NCHW-FP32-W=miopenConvolutionBwdWeightsAlgoDirect:ConvAsmBwdWrW1x1,1,35058,0,miopenConvolutionBwdWeightsAlgoDirect;miopenConvolutionBwdWeightsAlgoGEMM:gemm,3,35993,0,MIOpenGEMM;miopenConvolutionBwdWeightsAlgoWinograd:ConvBinWinogradRxSf2x3,4,67741,0,miopenConvolutionBwdWeightsAlgoWinograd
160-17-17-1x1-768-17-17-128-0x0-1x1-1x1-0-NCHW-FP32-W=miopenConvolutionBwdWeightsAlgoDirect:ConvAsmBwdWrW1x1,1,2153,0,miopenConvolutionBwdWeightsAlgoDirect
128-17-17-7x1-128-17-17-128-3x0-1x1-1x1-0-NCHW-FP32-W=miopenConvolutionBwdWeightsAlgoWinograd:ConvBinWinogradRxSf2x3,1,8445,0,miopenConvolutionBwdWeightsAlgoWinograd;miopenConvolutionBwdWeightsAlgoDirect:ConvOclBwdWrW53,1,94853,0,miopenConvolutionBwdWeightsAlgoDirect;miopenConvolutionBwdWeightsAlgoImplicitGEMM:ConvHipImplicitGemmV4R1WrW,3,99755,0,miopenConvolutionBwdWeightsAlgoImplicitGEMM;miopenConvolutionBwdWeightsAlgoGEMM:gemm,4,44119,1035776,MIOpenGEMM
384-8-8-3x1-384-8-8-128-1x0-1x1-1x1-0-NCHW-FP32-B=miopenConvolutionBwdDataAlgoImplicitGEMM:ConvHipImplicitGemmBwdDataV1R1,0,855427,0,miopenConvolutionBwdDataAlgoImplicitGEMM;miopenConvolutionBwdDataAlgoWinograd:ConvBinWinogradRxSf2x3,0,890922,0,miopenConvolutionBwdDataAlgoWinograd;miopenConvolutionBwdDataAlgoGEMM:gemm,4,8301,294912,MIOpenGEMM
1280-8-8-1x1-320-8-8-128-0x0-1x1-1x1-0-NCHW-FP32-F=miopenConvolutionFwdAlgoDirect:ConvAsm1x1U,0,895094,0,miopenConvolutionFwdAlgoDirect;miopenConvolutionFwdAlgoWinograd:ConvBinWinogradRxSf3x2,1,7109,0,miopenConvolutionFwdAlgoWinograd;miopenConvolutionFwdAlgoGEMM:GemmFwd1x1_0_1,7,30165,0,MIOpenGEMM
192-8-8-1x1-1280-8-8-128-0x0-1x1-1x1-0-NCHW-FP32-B=miopenConvolutionBwdDataAlgoDirect:ConvAsm1x1U,0,341377,0,miopenConvolutionBwdDataAlgoDirect;miopenConvolutionBwdDataAlgoWinograd:ConvBinWinogradRxSf3x2,1,646,0,miopenConvolutionBwdDataAlgoWinograd;miopenConvolutionBwdDataAlgoGEMM:gemm,4,19019,0,MIOpenGEMM
1024-17-17-1x1-192-17-17-64-0x0-1x1-1x1-0-NCHW-FP32-F=miopenConvolutionFwdAlgoDirect:ConvAsm1x1U,1,10329,0,miopenConvolutionFwdAlgoDirect;miopenConvolutionFwdAlgoWinograd:ConvBinWinogradRxSf3x2,1,61622,0,miopenConvolutionFwdAlgoWinograd;miopenConvolutionFwdAlgoGEMM:GemmFwd1x1_0_1,3,86529,0,MIOpenGEMM
768-17-17-1x1-128-17-17-128-0x0-1x1-1x1-0-NCHW-FP32-F=miopenConvolutionFwdAlgoDirect:ConvAsm1x1U,0,961946,0,miopenConvolutionFwdAlgoDirect;miopenConvolutionFwdAlgoWinograd:ConvBinWinogradRxSf3x2,1,67202,0,miopenConvolutionFwdAlgoWinograd;miopenConvolutionFwdAlgoGEMM:GemmFwd1x1_0_1,5,56588,0,MIOpenGEMM
256-8-8-1x1-1536-8-8-64-0x0-1x1-1x1-0-NCHW-FP32-W=miopenConvolutionBwdWeightsAlgoDirect:ConvAsmBwdWrW1x1,0,58076,0,miopenConvolutionBwdWeightsAlgoDirect;miopenConvolutionBwdWeightsAlgoWinograd:ConvBinWinogradRxSf2x3,1,20316,0,miopenConvolutionBwdWeightsAlgoWinograd;miopenConvolutionBwdWeightsAlgoGEMM:gemm,1,57429,0,MIOpenGEMM
384-8-8-1x3-384-8-8-128-0x1-1x1-1x1-0-NCHW-FP32-W=miopenConvolutionBwdWeightsAlgoDirect:ConvOclBwdWrW53,1,16797,0,miopenConvolutionBwdWeightsAlgoDirect;miopenConvolutionBwdWeightsAlgoImplicitGEMM:ConvHipImplicitGemmV4R1WrW,1,45814,0,miopenConvolutionBwdWeightsAlgoImplicitGEMM;miopenConvolutionBwdWeightsAlgoWinograd:ConvBinWinogradRxSf2x3,1,59833,0,miopenConvolutionBwdWeightsAlgoWinograd;miopenConvolutionBwdWeightsAlgoGEMM:gemm,4,15909,294912,MIOpenGEMM
128-17-17-1x1-1024-17-17-64-0x0-1x1-1x1-0-NCHW-FP32-W=miopenConvolutionBwdWeightsAlgoDirect:ConvAsmBwdWrW1x1,0,82444,0,miopenConvolutionBwdWeightsAlgoDirect
256-8-8-1x1-1536-8-8-64-0x0-1x1-1x1-0-NCHW-FP32-B=miopenConvolutionBwdDataAlgoDirect:ConvAsm1x1U,0,384259,0,miopenConvolutionBwdDataAlgoDirect;miopenConvolutionBwdDataAlgoGEMM:gemm,2,37605,0,MIOpenGEMM
192-17-17-3x3-192-8-8-64-0x0-2x2-1x1-0-NCHW-FP32-F=miopenConvolutionFwdAlgoWinograd:ConvBinWinogradRxS,0,495812,0,miopenConvolutionFwdAlgoWinograd;miopenConvolutionFwdAlgoDirect:ConvOclDirectFwd,1,85575,0,miopenConvolutionFwdAlgoDirect;miopenConvolutionFwdAlgoGEMM:GemmFwdRest,8,713,442368,MIOpenGEMM
96-35-35-3x3-96-35-35-128-1x1-1x1-1x1-0-NCHW-FP32-W=miopenConvolutionBwdWeightsAlgoDirect:ConvAsmBwdWrW3x3,3,27317,0,miopenConvolutionBwdWeightsAlgoDirect;miopenConvolutionBwdWeightsAlgoWinograd:ConvBinWinogradRxSf2x3,4,12995,0,miopenConvolutionBwdWeightsAlgoWinograd;miopenConvolutionBwdWeightsAlgoGEMM:gemm,11,829,4233600,MIOpenGEMM
192-17-17-1x7-192-17-17-64-0x3-1x1-1x1-0-NCHW-FP32-W=miopenConvolutionBwdWeightsAlgoWinograd:ConvBinWinogradRxSf2x3,1,41539,0,miopenConvolutionBwdWeightsAlgoWinograd;miopenConvolutionBwdWeightsAlgoImplicitGEMM:ConvHipImplicitGemmV4R1WrW,2,27666,0,miopenConvolutionBwdWeightsAlgoImplicitGEMM;miopenConvolutionBwdWeightsAlgoDirect:ConvOclBwdWrW53,2,94474,0,miopenConvolutionBwdWeightsAlgoDirect;miopenConvolutionBwdWeightsAlgoGEMM:gemm,4,11218,1553664,MIOpenGEMM
1536-8-8-1x1-256-8-8-64-0x0-1x1-1x1-0-NCHW-FP32-F=miopenConvolutionFwdAlgoDirect:ConvAsm1x1U,0,420191,0,miopenConvolutionFwdAlgoDirect;miopenConvolutionFwdAlgoWinograd:ConvBinWinogradRxSf3x2,1,7581,0,miopenConvolutionFwdAlgoWinograd;miopenConvolutionFwdAlgoGEMM:GemmFwd1x1_0_1,2,76288,0,MIOpenGEMM
80-73-73-1x1-64-73-73-128-0x0-1x1-1x1-0-NCHW-FP32-W=miopenConvolutionBwdWeightsAlgoDirect:ConvAsmBwdWrW1x1,2,27955,0,miopenConvolutionBwdWeightsAlgoDirect
192-17-17-1x7-192-17-17-64-0x3-1x1-1x1-0-NCHW-FP32-B=miopenConvolutionBwdDataAlgoWinograd:ConvBinWinogradRxSf3x2,1,26798,0,miopenConvolutionBwdDataAlgoWinograd;miopenConvolutionBwdDataAlgoImplicitGEMM:ConvHipImplicitGemmBwdDataV1R1,2,33178,0,miopenConvolutionBwdDataAlgoImplicitGEMM;miopenConvolutionBwdDataAlgoGEMM:gemm,5,13463,1553664,MIOpenGEMM
384-17-17-1x1-1024-17-17-64-0x0-1x1-1x1-0-NCHW-FP32-W=miopenConvolutionBwdWeightsAlgoDirect:ConvAsmBwdWrW1x1,1,95362,0,miopenConvolutionBwdWeightsAlgoDirect;miopenConvolutionBwdWeightsAlgoWinograd:ConvBinWinogradRxSf2x3,6,31455,0,miopenConvolutionBwdWeightsAlgoWinograd
192-17-17-1x7-192-17-17-64-0x3-1x1-1x1-0-NCHW-FP32-F=miopenConvolutionFwdAlgoWinograd:ConvBinWinogradRxSf3x2,1,20442,0,miopenConvolutionFwdAlgoWinograd;miopenConvolutionFwdAlgoImplicitGEMM:ConvHipImplicitGemmV4R1Fwd,1,25106,0,miopenConvolutionFwdAlgoImplicitGEMM;miopenConvolutionFwdAlgoGEMM:GemmFwdRest,13,1091,1553664,MIOpenGEMM
80-73-73-1x1-64-73-73-128-0x0-1x1-1x1-0-NCHW-FP32-B=miopenConvolutionBwdDataAlgoDirect:ConvAsm1x1U,0,805489,0,miopenConvolutionBwdDataAlgoDirect;miopenConvolutionBwdDataAlgoWinograd:ConvBinWinogradRxSf3x2,1,60766,0,miopenConvolutionBwdDataAlgoWinograd;miopenConvolutionBwdDataAlgoGEMM:gemm,3,61674,0,MIOpenGEMM
128-17-17-1x1-1024-17-17-64-0x0-1x1-1x1-0-NCHW-FP32-B=miopenConvolutionBwdDataAlgoDirect:ConvAsm1x1U,0,50652,0,miopenConvolutionBwdDataAlgoDirect;miopenConvolutionBwdDataAlgoWinograd:ConvBinWinogradRxSf3x2,1,11819,0,miopenConvolutionBwdDataAlgoWinograd;miopenConvolutionBwdDataAlgoGEMM:gemm,24,2352,0,MIOpenGEMM
1024-17-17-1x1-384-17-17-64-0x0-1x1-1x1-0-NCHW-FP32-F=miopenConvolutionFwdAlgoDirect:ConvAsm1x1U,1,96867,0,miopenConvolutionFwdAlgoDirect;miopenConvolutionFwdAlgoWinograd:ConvBinWinogradRxSf3x2,3,16569,0,miopenConvolutionFwdAlgoWinograd;miopenConvolutionFwdAlgoGEMM:GemmFwd1x1_0_1,4,44727,0,MIOpenGEMM
64-73-73-1x1-160-73-73-64-0x0-1x1-1x1-0-NCHW-FP32-W=miopenConvolutionBwdWeightsAlgoDirect:ConvAsmBwdWrW1x1,1,97673,0,miopenConvolutionBwdWeightsAlgoDirect;miopenConvolutionBwdWeightsAlgoGEMM:gemm,4,97161,0,MIOpenGEMM;miopenConvolutionBwdWeightsAlgoWinograd:ConvBinWinogradRxSf2x3,11,129,0,miopenConvolutionBwdWeightsAlgoWinograd
96-35-35-3x3-96-35-35-128-1x1-1x1-1x1-0-NCHW-FP32-F=miopenConvolutionFwdAlgoWinograd:ConvBinWinogradRxSf2x3,1,21233,0,miopenConvolutionFwdAlgoWinograd
1024-17-17-1x1-128-17-17-64-0x0-1x1-1x1-0-NCHW-FP32-F=miopenConvolutionFwdAlgoDirect:ConvAsm1x1U,0,637297,0,miopenConvolutionFwdAlgoDirect;miopenConvolutionFwdAlgoGEMM:GemmFwd1x1_0_1,2,82327,0,MIOpenGEMM
96-17-17-3x3-96-35-35-128-0x0-2x2-1x1-0-NCHW-FP32-W=miopenConvolutionBwdWeightsAlgoGEMM:gemm,3,58772,998784,MIOpenGEMM;miopenConvolutionBwdWeightsAlgoDirect:ConvOclBwdWrW2NonTunable,5,86773,42467328,miopenConvolutionBwdWeightsAlgoDirect
224-35-35-3x3-192-35-35-64-1x1-1x1-1x1-0-NCHW-FP32-W=miopenConvolutionBwdWeightsAlgoWinograd:ConvBinWinogradRxS,6,22737,0,miopenConvolutionBwdWeightsAlgoWinograd;miopenConvolutionBwdWeightsAlgoDirect:ConvAsmBwdWrW3x3,6,81404,0,miopenConvolutionBwdWeightsAlgoDirect;miopenConvolutionBwdWeightsAlgoImplicitGEMM:ConvHipImplicitGemmV4R1WrW,14,9023,0,miopenConvolutionBwdWeightsAlgoImplicitGEMM;miopenConvolutionBwdWeightsAlgoGEMM:gemm,73,5704,8467200,MIOpenGEMM
256-17-17-1x1-1024-17-17-64-0x0-1x1-1x1-0-NCHW-FP32-W=miopenConvolutionBwdWeightsAlgoDirect:ConvAsmBwdWrW1x1,1,3937,0,miopenConvolutionBwdWeightsAlgoDirect;miopenConvolutionBwdWeightsAlgoWinograd:ConvBinWinogradRxSf2x3,4,36228,0,miopenConvolutionBwdWeightsAlgoWinograd
64-73-73-1x1-80-73-73-128-0x0-1x1-1x1-0-NCHW-FP32-F=miopenConvolutionFwdAlgoDirect:ConvOclDirectFwd1x1,1,3361,0,miopenConvolutionFwdAlgoDirect
64-73-73-1x1-160-73-73-64-0x0-1x1-1x1-0-NCHW-FP32-B=miopenConvolutionBwdDataAlgoDirect:ConvAsm1x1U,1,26635,0,miopenConvolutionBwdDataAlgoDirect;miopenConvolutionBwdDataAlgoWinograd:ConvBinWinogradRxSf3x2,1,871,0,miopenConvolutionBwdDataAlgoWinograd
32-149-149-3x3-3-299-299-64-0x0-2x2-1x1-0-NCHW-FP32-B=miopenConvolutionBwdDataAlgoDirect:ConvOclDirectFwd,1,5853,0,miopenConvolutionBwdDataAlgoDirect;miopenConvolutionBwdDataAlgoWinograd:ConvBinWinogradRxS,2,88593,0,miopenConvolutionBwdDataAlgoWinograd;miopenConvolutionBwdDataAlgoGEMM:gemm,6,63411,2397708,MIOpenGEMM
224-35-35-3x3-192-35-35-64-1x1-1x1-1x1-0-NCHW-FP32-B=miopenConvolutionBwdDataAlgoWinograd:ConvBinWinogradRxS,2,58446,0,miopenConvolutionBwdDataAlgoWinograd
224-35-35-3x3-256-17-17-64-0x0-2x2-1x1-0-NCHW-FP32-F=miopenConvolutionFwdAlgoWinograd:ConvBinWinogradRxSf2x3,4,665,0,miopenConvolutionFwdAlgoWinograd;miopenConvolutionFwdAlgoGEMM:GemmFwdRest,7,93469,2330496,MIOpenGEMM;miopenConvolutionFwdAlgoDirect:ConvOclDirectFwd,18,8476,0,miopenConvolutionFwdAlgoDirect
192-35-35-3x3-224-35-35-64-1x1-1x1-1x1-0-NCHW-FP32-F=miopenConvolutionFwdAlgoWinograd:ConvBinWinogradRxS,2,53875,0,miopenConvolutionFwdAlgoWinograd
320-8-8-3x3-320-17-17-64-0x0-2x2-1x1-0-NCHW-FP32-W=miopenConvolutionBwdWeightsAlgoImplicitGEMM:ConvHipImplicitGemmV4R1WrW,1,286,0,miopenConvolutionBwdWeightsAlgoImplicitGEMM;miopenConvolutionBwdWeightsAlgoGEMM:gemm,2,75907,737280,MIOpenGEMM;miopenConvolutionBwdWeightsAlgoDirect:ConvOclBwdWrW2NonTunable,18,7212,235929600,miopenConvolutionBwdWeightsAlgoDirect
256-17-17-1x1-1024-17-17-64-0x0-1x1-1x1-0-NCHW-FP32-B=miopenConvolutionBwdDataAlgoDirect:ConvAsm1x1U,1,32496,0,miopenConvolutionBwdDataAlgoDirect;miopenConvolutionBwdDataAlgoGEMM:gemm,2,62808,0,MIOpenGEMM
3-299-299-3x3-32-149-149-64-0x0-2x2-1x1-0-NCHW-FP32-F=miopenConvolutionFwdAlgoWinograd:ConvBinWinogradRxSf2x3,1,8447,0,miopenConvolutionFwdAlgoWinograd;miopenConvolutionFwdAlgoDirect:ConvOclDirectFwd,1,71812,0,miopenConvolutionFwdAlgoDirect;miopenConvolutionFwdAlgoGEMM:GemmFwdRest,2,96496,2397708,MIOpenGEMM
160-73-73-1x1-64-73-73-64-0x0-1x1-1x1-0-NCHW-FP32-F=miopenConvolutionFwdAlgoDirect:ConvOclDirectFwd1x1,0,825722,0,miopenConvolutionFwdAlgoDirect;miopenConvolutionFwdAlgoWinograd:ConvBinWinogradRxSf3x2,1,63702,0,miopenConvolutionFwdAlgoWinograd;miopenConvolutionFwdAlgoGEMM:GemmFwd1x1_0_1,2,13848,0,MIOpenGEMM
96-35-35-3x3-64-35-35-128-1x1-1x1-1x1-0-NCHW-FP32-W=miopenConvolutionBwdWeightsAlgoDirect:ConvAsmBwdWrW3x3,2,2185,0,miopenConvolutionBwdWeightsAlgoDirect;miopenConvolutionBwdWeightsAlgoWinograd:ConvBinWinogradRxSf2x3,3,90518,0,miopenConvolutionBwdWeightsAlgoWinograd;miopenConvolutionBwdWeightsAlgoGEMM:gemm,10,7405,2822400,MIOpenGEMM;miopenConvolutionBwdWeightsAlgoImplicitGEMM:ConvHipImplicitGemmV4R1WrW,18,5854,0,miopenConvolutionBwdWeightsAlgoImplicitGEMM
256-17-17-7x1-224-17-17-64-3x0-1x1-1x1-0-NCHW-FP32-W=miopenConvolutionBwdWeightsAlgoWinograd:ConvBinWinogradRxSf2x3,2,25398,0,miopenConvolutionBwdWeightsAlgoWinograd;miopenConvolutionBwdWeightsAlgoDirect:ConvOclBwdWrW53,2,53404,0,miopenConvolutionBwdWeightsAlgoDirect;miopenConvolutionBwdWeightsAlgoGEMM:gemm,6,63032,1812608,MIOpenGEMM
96-35-35-3x3-64-35-35-128-1x1-1x1-1x1-0-NCHW-FP32-B=miopenConvolutionBwdDataAlgoWinograd:ConvBinWinograd3x3U,0,910097,0,miopenConvolutionBwdDataAlgoWinograd
320-8-8-3x3-320-17-17-64-0x0-2x2-1x1-0-NCHW-FP32-B=miopenConvolutionBwdDataAlgoImplicitGEMM:ConvHipImplicitGemmBwdDataV1R1,1,39689,0,miopenConvolutionBwdDataAlgoImplicitGEMM;miopenConvolutionBwdDataAlgoWinograd:ConvBinWinogradRxSf2x3,2,8314,0,miopenConvolutionBwdDataAlgoWinograd;miopenConvolutionBwdDataAlgoGEMM:gemm,4,8204,737280,MIOpenGEMM;miopenConvolutionBwdDataAlgoDirect:ConvOclDirectFwd,8,69422,0,miopenConvolutionBwdDataAlgoDirect
1024-17-17-1x1-256-17-17-64-0x0-1x1-1x1-0-NCHW-FP32-F=miopenConvolutionFwdAlgoDirect:ConvAsm1x1U,1,11383,0,miopenConvolutionFwdAlgoDirect;miopenConvolutionFwdAlgoWinograd:ConvBinWinogradRxSf3x2,1,97993,0,miopenConvolutionFwdAlgoWinograd;miopenConvolutionFwdAlgoGEMM:GemmFwd1x1_0_1,4,11418,0,MIOpenGEMM
256-17-17-7x1-224-17-17-64-3x0-1x1-1x1-0-NCHW-FP32-B=miopenConvolutionBwdDataAlgoWinograd:ConvBinWinogradRxSf3x2,2,3655,0,miopenConvolutionBwdDataAlgoWinograd;miopenConvolutionBwdDataAlgoImplicitGEMM:ConvHipImplicitGemmBwdDataV1R1,3,574,0,miopenConvolutionBwdDataAlgoImplicitGEMM;miopenConvolutionBwdDataAlgoGEMM:gemm,10,5241,1812608,MIOpenGEMM
224-17-17-7x1-192-17-17-64-3x0-1x1-1x1-0-NCHW-FP32-W=miopenConvolutionBwdWeightsAlgoWinograd:ConvBinWinogradRxSf2x3,1,69498,0,miopenConvolutionBwdWeightsAlgoWinograd;miopenConvolutionBwdWeightsAlgoDirect:ConvOclBwdWrW53,1,87118,0,miopenConvolutionBwdWeightsAlgoDirect;miopenConvolutionBwdWeightsAlgoImplicitGEMM:ConvHipImplicitGemmV4R1WrW,3,35869,0,miopenConvolutionBwdWeightsAlgoImplicitGEMM;miopenConvolutionBwdWeightsAlgoGEMM:gemm,4,67408,1553664,MIOpenGEMM
384-8-8-1x1-1536-8-8-64-0x0-1x1-1x1-0-NCHW-FP32-W=miopenConvolutionBwdWeightsAlgoDirect:ConvAsmBwdWrW1x1,0,89712,0,miopenConvolutionBwdWeightsAlgoDirect;miopenConvolutionBwdWeightsAlgoWinograd:ConvBinWinogradRxSf2x3,1,59752,0,miopenConvolutionBwdWeightsAlgoWinograd;miopenConvolutionBwdWeightsAlgoGEMM:gemm,1,61012,0,MIOpenGEMM
320-17-17-7x1-256-17-17-64-3x0-1x1-1x1-0-NCHW-FP32-W=miopenConvolutionBwdWeightsAlgoDirect:ConvOclBwdWrW53,3,53698,0,miopenConvolutionBwdWeightsAlgoDirect;miopenConvolutionBwdWeightsAlgoImplicitGEMM:ConvHipImplicitGemmV4R1WrW,3,85358,0,miopenConvolutionBwdWeightsAlgoImplicitGEMM;miopenConvolutionBwdWeightsAlgoWinograd:ConvBinWinogradRxSf2x3,4,4187,0,miopenConvolutionBwdWeightsAlgoWinograd;miopenConvolutionBwdWeightsAlgoGEMM:gemm,7,95581,2071552,MIOpenGEMM
320-17-17-3x3-320-8-8-64-0x0-2x2-1x1-0-NCHW-FP32-F=miopenConvolutionFwdAlgoWinograd:ConvBinWinogradRxS,1,31251,0,miopenConvolutionFwdAlgoWinograd;miopenConvolutionFwdAlgoDirect:ConvOclDirectFwd,4,807,0,miopenConvolutionFwdAlgoDirect;miopenConvolutionFwdAlgoGEMM:GemmFwdRest,5,92392,737280,MIOpenGEMM
192-17-17-1x1-1024-17-17-64-0x0-1x1-1x1-0-NCHW-FP32-W=miopenConvolutionBwdWeightsAlgoDirect:ConvAsmBwdWrW1x1,0,965607,0,miopenConvolutionBwdWeightsAlgoDirect
224-17-17-7x1-256-17-17-64-3x0-1x1-1x1-0-NCHW-FP32-F=miopenConvolutionFwdAlgoImplicitGEMM:ConvHipImplicitGemmV4R1Fwd,1,71683,0,miopenConvolutionFwdAlgoImplicitGEMM;miopenConvolutionFwdAlgoWinograd:ConvBinWinogradRxSf3x2,1,79508,0,miopenConvolutionFwdAlgoWinograd;miopenConvolutionFwdAlgoGEMM:GemmFwdRest,8,29737,1812608,MIOpenGEMM
192-17-17-7x1-224-17-17-64-3x0-1x1-1x1-0-NCHW-FP32-F=miopenConvolutionFwdAlgoImplicitGEMM:ConvHipImplicitGemmV4R1Fwd,1,52018,0,miopenConvolutionFwdAlgoImplicitGEMM;miopenConvolutionFwdAlgoWinograd:ConvBinWinogradRxSf3x2,1,5428,0,miopenConvolutionFwdAlgoWinograd;miopenConvolutionFwdAlgoGEMM:GemmFwdRest,9,73731,1553664,MIOpenGEMM
384-8-8-1x1-1536-8-8-64-0x0-1x1-1x1-0-NCHW-FP32-B=miopenConvolutionBwdDataAlgoDirect:ConvAsm1x1U,0,549256,0,miopenConvolutionBwdDataAlgoDirect;miopenConvolutionBwdDataAlgoWinograd:ConvBinWinogradRxSf3x2,1,19954,0,miopenConvolutionBwdDataAlgoWinograd;miopenConvolutionBwdDataAlgoGEMM:gemm,2,42284,0,MIOpenGEMM
384-35-35-1x1-96-35-35-64-0x0-1x1-1x1-0-NCHW-FP32-F=miopenConvolutionFwdAlgoDirect:ConvAsm1x1U,0,835059,0,miopenConvolutionFwdAlgoDirect;miopenConvolutionFwdAlgoGEMM:GemmFwd1x1_0_1,2,597,0,MIOpenGEMM
224-17-17-1x7-224-17-17-64-0x3-1x1-1x1-0-NCHW-FP32-W=miopenConvolutionBwdWeightsAlgoWinograd:ConvBinWinogradRxSf2x3,1,8821,0,miopenConvolutionBwdWeightsAlgoWinograd;miopenConvolutionBwdWeightsAlgoDirect:ConvOclBwdWrW53,3,68213,0,miopenConvolutionBwdWeightsAlgoDirect;miopenConvolutionBwdWeightsAlgoGEMM:gemm,4,7286,1812608,MIOpenGEMM
32-147-147-3x3-32-149-149-64-0x0-1x1-1x1-0-NCHW-FP32-W=miopenConvolutionBwdWeightsAlgoDirect:ConvOclBwdWrW53,10,3969,2359296,miopenConvolutionBwdWeightsAlgoDirect;miopenConvolutionBwdWeightsAlgoGEMM:gemm,35,704,24893568,MIOpenGEMM;miopenConvolutionBwdWeightsAlgoWinograd:ConvBinWinogradRxSf2x3,36,8796,0,miopenConvolutionBwdWeightsAlgoWinograd
448-8-8-1x1-1280-8-8-128-0x0-1x1-1x1-0-NCHW-FP32-W=miopenConvolutionBwdWeightsAlgoDirect:ConvAsmBwdWrW1x1,1,17488,0,miopenConvolutionBwdWeightsAlgoDirect;miopenConvolutionBwdWeightsAlgoGEMM:gemm,2,54184,0,MIOpenGEMM;miopenConvolutionBwdWeightsAlgoWinograd:ConvBinWinogradRxSf2x3,4,22812,0,miopenConvolutionBwdWeightsAlgoWinograd
320-17-17-7x1-256-17-17-64-3x0-1x1-1x1-0-NCHW-FP32-B=miopenConvolutionBwdDataAlgoWinograd:ConvBinWinogradRxSf3x2,2,5255,0,miopenConvolutionBwdDataAlgoWinograd;miopenConvolutionBwdDataAlgoImplicitGEMM:ConvHipImplicitGemmBwdDataV1R1,2,8431,0,miopenConvolutionBwdDataAlgoImplicitGEMM;miopenConvolutionBwdDataAlgoGEMM:gemm,7,7056,2071552,MIOpenGEMM
192-17-17-1x1-1024-17-17-64-0x0-1x1-1x1-0-NCHW-FP32-B=miopenConvolutionBwdDataAlgoDirect:ConvAsm1x1U,1,7696,0,miopenConvolutionBwdDataAlgoDirect;miopenConvolutionBwdDataAlgoGEMM:gemm,1,92729,0,MIOpenGEMM
224-17-17-1x7-192-17-17-64-0x3-1x1-1x1-0-NCHW-FP32-W=miopenConvolutionBwdWeightsAlgoWinograd:ConvBinWinogradRxSf2x3,1,37556,0,miopenConvolutionBwdWeightsAlgoWinograd;miopenConvolutionBwdWeightsAlgoDirect:ConvOclBwdWrW53,2,89911,0,miopenConvolutionBwdWeightsAlgoDirect;miopenConvolutionBwdWeightsAlgoImplicitGEMM:ConvHipImplicitGemmV4R1WrW,3,33637,0,miopenConvolutionBwdWeightsAlgoImplicitGEMM;miopenConvolutionBwdWeightsAlgoGEMM:gemm,5,14511,1553664,MIOpenGEMM
1536-8-8-1x1-384-8-8-64-0x0-1x1-1x1-0-NCHW-FP32-F=miopenConvolutionFwdAlgoDirect:ConvAsm1x1U,0,800284,0,miopenConvolutionFwdAlgoDirect;miopenConvolutionFwdAlgoWinograd:ConvBinWinogradRxSf3x2,1,40904,0,miopenConvolutionFwdAlgoWinograd;miopenConvolutionFwdAlgoGEMM:GemmFwd1x1_0_1,2,65773,0,MIOpenGEMM
224-17-17-1x7-224-17-17-64-0x3-1x1-1x1-0-NCHW-FP32-B=miopenConvolutionBwdDataAlgoWinograd:ConvBinWinogradRxSf3x2,1,5582,0,miopenConvolutionBwdDataAlgoWinograd;miopenConvolutionBwdDataAlgoImplicitGEMM:ConvHipImplicitGemmBwdDataV1R1,3,6399,0,miopenConvolutionBwdDataAlgoImplicitGEMM;miopenConvolutionBwdDataAlgoGEMM:gemm,4,41472,1812608,MIOpenGEMM
32-147-147-3x3-32-149-149-64-0x0-1x1-1x1-0-NCHW-FP32-B=miopenConvolutionBwdDataAlgoWinograd:ConvBinWinogradRxSf2x3,1,47271,0,miopenConvolutionBwdDataAlgoWinograd;miopenConvolutionBwdDataAlgoDirect:ConvOclDirectFwd,7,1877,0,miopenConvolutionBwdDataAlgoDirect;miopenConvolutionBwdDataAlgoGEMM:gemm,24,3917,24893568,MIOpenGEMM;miopenConvolutionBwdDataAlgoImplicitGEMM:ConvHipImplicitGemmBwdDataV1R1,25,4606,0,miopenConvolutionBwdDataAlgoImplicitGEMM
448-8-8-1x3-384-8-8-64-0x1-1x1-1x1-0-NCHW-FP32-B=miopenConvolutionBwdDataAlgoWinograd:ConvBinWinogradRxSf2x3,0,525646,0,miopenConvolutionBwdDataAlgoWinograd;miopenConvolutionBwdDataAlgoImplicitGEMM:ConvHipImplicitGemmBwdDataV1R1,0,897812,0,miopenConvolutionBwdDataAlgoImplicitGEMM;miopenConvolutionBwdDataAlgoGEMM:gemm,2,93417,294912,MIOpenGEMM
224-17-17-1x7-192-17-17-64-0x3-1x1-1x1-0-NCHW-FP32-B=miopenConvolutionBwdDataAlgoWinograd:ConvBinWinogradRxSf3x2,1,36536,0,miopenConvolutionBwdDataAlgoWinograd;miopenConvolutionBwdDataAlgoImplicitGEMM:ConvHipImplicitGemmBwdDataV1R1,3,57512,0,miopenConvolutionBwdDataAlgoImplicitGEMM;miopenConvolutionBwdDataAlgoGEMM:gemm,5,52862,1553664,MIOpenGEMM
256-17-17-7x1-320-17-17-64-3x0-1x1-1x1-0-NCHW-FP32-F=miopenConvolutionFwdAlgoImplicitGEMM:ConvHipImplicitGemmV4R1Fwd,1,95546,0,miopenConvolutionFwdAlgoImplicitGEMM;miopenConvolutionFwdAlgoWinograd:ConvBinWinogradRxSf3x2,2,37121,0,miopenConvolutionFwdAlgoWinograd;miopenConvolutionFwdAlgoGEMM:GemmFwdRest,6,16192,2071552,MIOpenGEMM
64-35-35-1x1-384-35-35-64-0x0-1x1-1x1-0-NCHW-FP32-W=miopenConvolutionBwdWeightsAlgoDirect:ConvAsmBwdWrW1x1,0,871259,0,miopenConvolutionBwdWeightsAlgoDirect
64-73-73-7x1-64-73-73-64-3x0-1x1-1x1-0-NCHW-FP32-F=miopenConvolutionFwdAlgoImplicitGEMM:ConvHipImplicitGemmV4R1Fwd,2,29822,0,miopenConvolutionFwdAlgoImplicitGEMM;miopenConvolutionFwdAlgoWinograd:ConvBinWinogradRxSf3x2,2,51508,0,miopenConvolutionFwdAlgoWinograd;miopenConvolutionFwdAlgoGEMM:GemmFwdRest,7,74794,9549568,MIOpenGEMM
224-17-17-1x7-224-17-17-64-0x3-1x1-1x1-0-NCHW-FP32-F=miopenConvolutionFwdAlgoImplicitGEMM:ConvHipImplicitGemmV4R1Fwd,1,48972,0,miopenConvolutionFwdAlgoImplicitGEMM;miopenConvolutionFwdAlgoWinograd:ConvBinWinogradRxSf3x2,1,58218,0,miopenConvolutionFwdAlgoWinograd;miopenConvolutionFwdAlgoGEMM:GemmFwdRest,6,70102,1812608,MIOpenGEMM
256-8-8-3x1-512-8-8-64-1x0-1x1-1x1-0-NCHW-FP32-W=miopenConvolutionBwdWeightsAlgoDirect:ConvOclBwdWrW53,0,547349,0,miopenConvolutionBwdWeightsAlgoDirect;miopenConvolutionBwdWeightsAlgoWinograd:ConvBinWinogradRxS,0,745532,0,miopenConvolutionBwdWeightsAlgoWinograd;miopenConvolutionBwdWeightsAlgoImplicitGEMM:ConvHipImplicitGemmV4R1WrW,1,10944,0,miopenConvolutionBwdWeightsAlgoImplicitGEMM;miopenConvolutionBwdWeightsAlgoGEMM:gemm,4,70656,393216,MIOpenGEMM
384-8-8-1x3-448-8-8-64-0x1-1x1-1x1-0-NCHW-FP32-F=miopenConvolutionFwdAlgoWinograd:ConvBinWinogradRxSf2x3,0,554808,0,miopenConvolutionFwdAlgoWinograd;miopenConvolutionFwdAlgoImplicitGEMM:ConvHipImplicitGemmV4R1Fwd,0,725192,0,miopenConvolutionFwdAlgoImplicitGEMM;miopenConvolutionFwdAlgoGEMM:GemmFwdRest,5,7483,294912,MIOpenGEMM
32-149-149-3x3-32-147-147-64-0x0-1x1-1x1-0-NCHW-FP32-F=miopenConvolutionFwdAlgoWinograd:ConvBinWinogradRxS,1,48693,0,miopenConvolutionFwdAlgoWinograd;miopenConvolutionFwdAlgoDirect:ConvOclDirectFwd,6,32888,0,miopenConvolutionFwdAlgoDirect;miopenConvolutionFwdAlgoGEMM:GemmFwdRest,7,90315,24893568,MIOpenGEMM
192-17-17-1x7-224-17-17-64-0x3-1x1-1x1-0-NCHW-FP32-F=miopenConvolutionFwdAlgoWinograd:ConvBinWinogradRxSf3x2,1,39653,0,miopenConvolutionFwdAlgoWinograd;miopenConvolutionFwdAlgoImplicitGEMM:ConvHipImplicitGemmV4R1Fwd,1,46732,0,miopenConvolutionFwdAlgoImplicitGEMM;miopenConvolutionFwdAlgoGEMM:GemmFwdRest,5,43586,1553664,MIOpenGEMM
256-17-17-1x7-256-17-17-64-0x3-1x1-1x1-0-NCHW-FP32-W=miopenConvolutionBwdWeightsAlgoWinograd:ConvBinWinogradRxSf2x3,2,37582,0,miopenConvolutionBwdWeightsAlgoWinograd;miopenConvolutionBwdWeightsAlgoImplicitGEMM:ConvHipImplicitGemmV4R1WrW,3,4858,0,miopenConvolutionBwdWeightsAlgoImplicitGEMM;miopenConvolutionBwdWeightsAlgoDirect:ConvOclBwdWrW53,4,9832,0,miopenConvolutionBwdWeightsAlgoDirect;miopenConvolutionBwdWeightsAlgoGEMM:gemm,5,18176,2071552,MIOpenGEMM
64-35-35-1x1-384-35-35-64-0x0-1x1-1x1-0-NCHW-FP32-B=miopenConvolutionBwdDataAlgoDirect:ConvAsm1x1U,0,676394,0,miopenConvolutionBwdDataAlgoDirect;miopenConvolutionBwdDataAlgoGEMM:gemm,4,36392,0,MIOpenGEMM
192-35-35-3x3-192-71-71-64-0x0-2x2-1x1-0-NCHW-FP32-W=miopenConvolutionBwdWeightsAlgoImplicitGEMM:ConvHipImplicitGemmV4R1WrW,11,1586,0,miopenConvolutionBwdWeightsAlgoImplicitGEMM;miopenConvolutionBwdWeightsAlgoGEMM:gemm,13,1445,8467200,MIOpenGEMM;miopenConvolutionBwdWeightsAlgoDirect:ConvOclBwdWrW2NonTunable,33,6171,84934656,miopenConvolutionBwdWeightsAlgoDirect
256-8-8-3x1-512-8-8-64-1x0-1x1-1x1-0-NCHW-FP32-B=miopenConvolutionBwdDataAlgoWinograd:ConvBinWinogradRxSf2x3,0,420263,0,miopenConvolutionBwdDataAlgoWinograd;miopenConvolutionBwdDataAlgoImplicitGEMM:ConvHipImplicitGemmBwdDataV1R1,2,47765,0,miopenConvolutionBwdDataAlgoImplicitGEMM;miopenConvolutionBwdDataAlgoGEMM:gemm,5,41728,393216,MIOpenGEMM
192-8-8-3x3-192-17-17-64-0x0-2x2-1x1-0-NCHW-FP32-W=miopenConvolutionBwdWeightsAlgoImplicitGEMM:ConvHipImplicitGemmV4R1WrW,0,713857,0,miopenConvolutionBwdWeightsAlgoImplicitGEMM;miopenConvolutionBwdWeightsAlgoGEMM:gemm,2,51333,442368,MIOpenGEMM;miopenConvolutionBwdWeightsAlgoDirect:ConvOclBwdWrW2NonTunable,7,746,84934656,miopenConvolutionBwdWeightsAlgoDirect
128-17-17-1x7-128-17-17-128-0x3-1x1-1x1-0-NCHW-FP32-W=miopenConvolutionBwdWeightsAlgoWinograd:ConvBinWinogradRxSf2x3,1,9042,0,miopenConvolutionBwdWeightsAlgoWinograd;miopenConvolutionBwdWeightsAlgoDirect:ConvOclBwdWrW53,3,83149,0,miopenConvolutionBwdWeightsAlgoDirect;miopenConvolutionBwdWeightsAlgoImplicitGEMM:ConvHipImplicitGemmV4R1WrW,4,27791,0,miopenConvolutionBwdWeightsAlgoImplicitGEMM;miopenConvolutionBwdWeightsAlgoGEMM:gemm,4,60024,1035776,MIOpenGEMM
256-8-8-3x1-384-8-8-64-1x0-1x1-1x1-0-NCHW-FP32-W=miopenConvolutionBwdWeightsAlgoDirect:ConvOclBwdWrW53,0,324144,0,miopenConvolutionBwdWeightsAlgoDirect;miopenConvolutionBwdWeightsAlgoWinograd:ConvBinWinogradRxSf2x3,0,674387,0,miopenConvolutionBwdWeightsAlgoWinograd;miopenConvolutionBwdWeightsAlgoImplicitGEMM:ConvHipImplicitGemmV4R1WrW,0,690039,0,miopenConvolutionBwdWeightsAlgoImplicitGEMM;miopenConvolutionBwdWeightsAlgoGEMM:gemm,2,3864,294912,MIOpenGEMM
256-17-17-1x7-256-17-17-64-0x3-1x1-1x1-0-NCHW-FP32-B=miopenConvolutionBwdDataAlgoWinograd:ConvBinWinogradRxSf3x2,2,2295,0,miopenConvolutionBwdDataAlgoWinograd;miopenConvolutionBwdDataAlgoImplicitGEMM:ConvHipImplicitGemmBwdDataV1R1,2,7751,0,miopenConvolutionBwdDataAlgoImplicitGEMM;miopenConvolutionBwdDataAlgoGEMM:gemm,6,30075,2071552,MIOpenGEMM
64-73-73-1x7-64-73-73-64-0x3-1x1-1x1-0-NCHW-FP32-W=miopenConvolutionBwdWeightsAlgoGEMM:gemm,7,54592,9549568,MIOpenGEMM;miopenConvolutionBwdWeightsAlgoWinograd:ConvBinWinogradRxSf2x3,8,1418,0,miopenConvolutionBwdWeightsAlgoWinograd;miopenConvolutionBwdWeightsAlgoDirect:ConvOclBwdWrW53,30,4384,7340032,miopenConvolutionBwdWeightsAlgoDirect;miopenConvolutionBwdWeightsAlgoImplicitGEMM:ConvHipImplicitGemmV4R1WrW,33,7587,0,miopenConvolutionBwdWeightsAlgoImplicitGEMM
96-71-71-3x3-64-73-73-64-0x0-1x1-1x1-0-NCHW-FP32-W=miopenConvolutionBwdWeightsAlgoWinograd:ConvBinWinogradRxSf2x3,8,35053,0,miopenConvolutionBwdWeightsAlgoWinograd
64-147-147-3x3-32-147-147-64-1x1-1x1-1x1-0-NCHW-FP32-W=miopenConvolutionBwdWeightsAlgoDirect:ConvAsmBwdWrW3x3,5,41035,0,miopenConvolutionBwdWeightsAlgoDirect;miopenConvolutionBwdWeightsAlgoWinograd:ConvBinWinogradRxSf2x3,43,1537,0,miopenConvolutionBwdWeightsAlgoWinograd;miopenConvolutionBwdWeightsAlgoGEMM:gemm,79,7769,24893568,MIOpenGEMM
384-35-35-1x1-64-35-35-64-0x0-1x1-1x1-0-NCHW-FP32-F=miopenConvolutionFwdAlgoDirect:ConvOclDirectFwd1x1,0,462238,0,miopenConvolutionFwdAlgoDirect;miopenConvolutionFwdAlgoGEMM:GemmFwd1x1_0_1,2,51291,0,MIOpenGEMM
192-35-35-3x3-192-71-71-64-0x0-2x2-1x1-0-NCHW-FP32-B=miopenConvolutionBwdDataAlgoWinograd:ConvBinWinogradRxS,9,34872,0,miopenConvolutionBwdDataAlgoWinograd;miopenConvolutionBwdDataAlgoImplicitGEMM:ConvHipImplicitGemmBwdDataV1R1,11,1636,0,miopenConvolutionBwdDataAlgoImplicitGEMM;miopenConvolutionBwdDataAlgoGEMM:gemm,19,983,8467200,MIOpenGEMM;miopenConvolutionBwdDataAlgoDirect:ConvOclDirectFwd,20,841,0,miopenConvolutionBwdDataAlgoDirect
192-8-8-3x3-192-17-17-64-0x0-2x2-1x1-0-NCHW-FP32-B=miopenConvolutionBwdDataAlgoWinograd:ConvBinWinogradRxS,0,816738,0,miopenConvolutionBwdDataAlgoWinograd;miopenConvolutionBwdDataAlgoImplicitGEMM:ConvHipImplicitGemmBwdDataV1R1,1,11082,0,miopenConvolutionBwdDataAlgoImplicitGEMM;miopenConvolutionBwdDataAlgoDirect:ConvOclDirectFwd,3,37235,0,miopenConvolutionBwdDataAlgoDirect;miopenConvolutionBwdDataAlgoGEMM:gemm,4,42415,442368,MIOpenGEMM
512-8-8-3x1-256-8-8-64-1x0-1x1-1x1-0-NCHW-FP32-F=miopenConvolutionFwdAlgoWinograd:ConvBinWinogradRxSf2x3,0,418088,0,miopenConvolutionFwdAlgoWinograd;miopenConvolutionFwdAlgoImplicitGEMM:ConvHipImplicitGemmV4R1Fwd,0,624631,0,miopenConvolutionFwdAlgoImplicitGEMM;miopenConvolutionFwdAlgoGEMM:GemmFwdRest,6,99123,393216,MIOpenGEMM
64-147-147-3x3-32-147-147-64-1x1-1x1-1x1-0-NCHW-FP32-B=miopenConvolutionBwdDataAlgoWinograd:ConvBinWinogradRxS,2,28348,0,miopenConvolutionBwdDataAlgoWinograd
256-8-8-3x1-384-8-8-64-1x0-1x1-1x1-0-NCHW-FP32-B=miopenConvolutionBwdDataAlgoWinograd:ConvBinWinogradRxSf2x3,0,342951,0,miopenConvolutionBwdDataAlgoWinograd;miopenConvolutionBwdDataAlgoImplicitGEMM:ConvHipImplicitGemmBwdDataV1R1,0,496383,0,miopenConvolutionBwdDataAlgoImplicitGEMM;miopenConvolutionBwdDataAlgoGEMM:gemm,3,90206,294912,MIOpenGEMM
256-17-17-1x7-256-17-17-64-0x3-1x1-1x1-0-NCHW-FP32-F=miopenConvolutionFwdAlgoImplicitGEMM:ConvHipImplicitGemmV4R1Fwd,1,9502,0,miopenConvolutionFwdAlgoImplicitGEMM;miopenConvolutionFwdAlgoWinograd:ConvBinWinogradRxSf3x2,1,97818,0,miopenConvolutionFwdAlgoWinograd;miopenConvolutionFwdAlgoGEMM:GemmFwdRest,8,79405,2071552,MIOpenGEMM
64-73-73-1x7-64-73-73-64-0x3-1x1-1x1-0-NCHW-FP32-B=miopenConvolutionBwdDataAlgoWinograd:ConvBinWinogradRxSf3x2,2,2933,0,miopenConvolutionBwdDataAlgoWinograd;miopenConvolutionBwdDataAlgoImplicitGEMM:ConvHipImplicitGemmBwdDataV1R1,11,2811,0,miopenConvolutionBwdDataAlgoImplicitGEMM;miopenConvolutionBwdDataAlgoGEMM:gemm,11,8313,9549568,MIOpenGEMM
32-147-147-3x3-64-147-147-64-1x1-1x1-1x1-0-NCHW-FP32-F=miopenConvolutionFwdAlgoWinograd:ConvBinWinogradRxSf2x3,2,67378,0,miopenConvolutionFwdAlgoWinograd
384-17-17-3x3-384-35-35-64-0x0-2x2-1x1-0-NCHW-FP32-W=miopenConvolutionBwdWeightsAlgoImplicitGEMM:ConvHipImplicitGemmV4R1WrW,5,96303,0,miopenConvolutionBwdWeightsAlgoImplicitGEMM;miopenConvolutionBwdWeightsAlgoGEMM:gemm,14,632,3995136,MIOpenGEMM;miopenConvolutionBwdWeightsAlgoDirect:ConvOclBwdWrW2NonTunable,47,359,339738624,miopenConvolutionBwdWeightsAlgoDirect
256-17-17-3x3-224-35-35-64-0x0-2x2-1x1-0-NCHW-FP32-W=miopenConvolutionBwdWeightsAlgoDirect:ConvOclBwdWrW2NonTunable,20,4418,132120576,miopenConvolutionBwdWeightsAlgoDirect;miopenConvolutionBwdWeightsAlgoGEMM:gemm,41,6402,2330496,MIOpenGEMM
32-149-149-3x3-3-299-299-64-0x0-2x2-1x1-0-NCHW-FP32-W=miopenConvolutionBwdWeightsAlgoDirect:ConvOclBwdWrW2NonTunable,3,565,221184,miopenConvolutionBwdWeightsAlgoDirect;miopenConvolutionBwdWeightsAlgoGEMM:gemm,4,50513,2397708,MIOpenGEMM
256-8-8-1x3-512-8-8-64-0x1-1x1-1x1-0-NCHW-FP32-W=miopenConvolutionBwdWeightsAlgoDirect:ConvOclBwdWrW53,0,533537,0,miopenConvolutionBwdWeightsAlgoDirect;miopenConvolutionBwdWeightsAlgoWinograd:ConvBinWinogradRxS,0,560428,0,miopenConvolutionBwdWeightsAlgoWinograd;miopenConvolutionBwdWeightsAlgoImplicitGEMM:ConvHipImplicitGemmV4R1WrW,0,677609,0,miopenConvolutionBwdWeightsAlgoImplicitGEMM;miopenConvolutionBwdWeightsAlgoGEMM:gemm,1,86478,393216,MIOpenGEMM
64-73-73-7x1-64-73-73-64-3x0-1x1-1x1-0-NCHW-FP32-B=miopenConvolutionBwdDataAlgoWinograd:ConvBinWinogradRxSf3x2,2,39713,0,miopenConvolutionBwdDataAlgoWinograd;miopenConvolutionBwdDataAlgoGEMM:gemm,8,44012,9549568,MIOpenGEMM;miopenConvolutionBwdDataAlgoImplicitGEMM:ConvHipImplicitGemmBwdDataV1R1,8,50131,0,miopenConvolutionBwdDataAlgoImplicitGEMM
384-8-8-3x1-256-8-8-64-1x0-1x1-1x1-0-NCHW-FP32-F=miopenConvolutionFwdAlgoWinograd:ConvBinWinogradRxSf2x3,0,31596,0,miopenConvolutionFwdAlgoWinograd;miopenConvolutionFwdAlgoImplicitGEMM:ConvHipImplicitGemmV4R1Fwd,0,865342,0,miopenConvolutionFwdAlgoImplicitGEMM;miopenConvolutionFwdAlgoGEMM:GemmFwdRest,22,2784,294912,MIOpenGEMM
192-71-71-3x3-192-35-35-64-0x0-2x2-1x1-0-NCHW-FP32-F=miopenConvolutionFwdAlgoWinograd:ConvBinWinogradRxS,9,18243,0,miopenConvolutionFwdAlgoWinograd;miopenConvolutionFwdAlgoGEMM:GemmFwdRest,11,768,8467200,MIOpenGEMM;miopenConvolutionFwdAlgoDirect:ConvOclDirectFwd,48,1707,0,miopenConvolutionFwdAlgoDirect
64-73-73-1x7-64-73-73-64-0x3-1x1-1x1-0-NCHW-FP32-F=miopenConvolutionFwdAlgoImplicitGEMM:ConvHipImplicitGemmV4R1Fwd,2,22172,0,miopenConvolutionFwdAlgoImplicitGEMM;miopenConvolutionFwdAlgoWinograd:ConvBinWinogradRxSf3x2,2,31499,0,miopenConvolutionFwdAlgoWinograd;miopenConvolutionFwdAlgoGEMM:GemmFwdRest,14,5873,9549568,MIOpenGEMM
96-35-35-3x3-96-35-35-64-1x1-1x1-1x1-0-NCHW-FP32-W=miopenConvolutionBwdWeightsAlgoDirect:ConvAsmBwdWrW3x3,1,88631,0,miopenConvolutionBwdWeightsAlgoDirect;miopenConvolutionBwdWeightsAlgoWinograd:ConvBinWinogradRxSf2x3,2,14146,0,miopenConvolutionBwdWeightsAlgoWinograd;miopenConvolutionBwdWeightsAlgoGEMM:gemm,5,9568,4233600,MIOpenGEMM
256-17-17-3x3-224-35-35-64-0x0-2x2-1x1-0-NCHW-FP32-B=miopenConvolutionBwdDataAlgoWinograd:ConvBinWinogradRxSf2x3,3,74799,0,miopenConvolutionBwdDataAlgoWinograd;miopenConvolutionBwdDataAlgoImplicitGEMM:ConvHipImplicitGemmBwdDataV1R1,4,92531,0,miopenConvolutionBwdDataAlgoImplicitGEMM;miopenConvolutionBwdDataAlgoDirect:ConvOclDirectFwd,11,5279,0,miopenConvolutionBwdDataAlgoDirect;miopenConvolutionBwdDataAlgoGEMM:gemm,13,1914,2330496,MIOpenGEMM
256-8-8-1x3-512-8-8-64-0x1-1x1-1x1-0-NCHW-FP32-B=miopenConvolutionBwdDataAlgoWinograd:ConvBinWinogradRxS,0,424792,0,miopenConvolutionBwdDataAlgoWinograd;miopenConvolutionBwdDataAlgoImplicitGEMM:ConvHipImplicitGemmBwdDataV1R1,1,27635,0,miopenConvolutionBwdDataAlgoImplicitGEMM;miopenConvolutionBwdDataAlgoGEMM:gemm,4,21337,393216,MIOpenGEMM
96-35-35-3x3-96-35-35-64-1x1-1x1-1x1-0-NCHW-FP32-B=miopenConvolutionBwdDataAlgoWinograd:ConvBinWinograd3x3U,0,643893,0,miopenConvolutionBwdDataAlgoWinograd
256-8-8-1x3-384-8-8-64-0x1-1x1-1x1-0-NCHW-FP32-W=miopenConvolutionBwdWeightsAlgoDirect:ConvOclBwdWrW53,0,489799,0,miopenConvolutionBwdWeightsAlgoDirect;miopenConvolutionBwdWeightsAlgoWinograd:ConvBinWinogradRxS,0,595816,0,miopenConvolutionBwdWeightsAlgoWinograd;miopenConvolutionBwdWeightsAlgoImplicitGEMM:ConvHipImplicitGemmV4R1WrW,0,750134,0,miopenConvolutionBwdWeightsAlgoImplicitGEMM;miopenConvolutionBwdWeightsAlgoGEMM:gemm,2,36513,294912,MIOpenGEMM
384-17-17-3x3-384-35-35-64-0x0-2x2-1x1-0-NCHW-FP32-B=miopenConvolutionBwdDataAlgoImplicitGEMM:ConvHipImplicitGemmBwdDataV1R1,7,43368,0,miopenConvolutionBwdDataAlgoImplicitGEMM;miopenConvolutionBwdDataAlgoWinograd:ConvBinWinogradRxS,9,20761,0,miopenConvolutionBwdDataAlgoWinograd;miopenConvolutionBwdDataAlgoGEMM:gemm,11,7997,3995136,MIOpenGEMM;miopenConvolutionBwdDataAlgoDirect:ConvOclDirectFwd,29,282,0,miopenConvolutionBwdDataAlgoDirect
96-35-35-3x3-64-35-35-64-1x1-1x1-1x1-0-NCHW-FP32-W=miopenConvolutionBwdWeightsAlgoDirect:ConvAsmBwdWrW3x3,0,985577,0,miopenConvolutionBwdWeightsAlgoDirect;miopenConvolutionBwdWeightsAlgoWinograd:ConvBinWinogradRxSf2x3,1,97128,0,miopenConvolutionBwdWeightsAlgoWinograd;miopenConvolutionBwdWeightsAlgoGEMM:gemm,8,49111,2822400,MIOpenGEMM;miopenConvolutionBwdWeightsAlgoImplicitGEMM:ConvHipImplicitGemmV4R1WrW,9,39542,0,miopenConvolutionBwdWeightsAlgoImplicitGEMM
96-35-35-3x3-96-35-35-64-1x1-1x1-1x1-0-NCHW-FP32-F=miopenConvolutionFwdAlgoWinograd:ConvBinWinograd3x3U,0,630564,0,miopenConvolutionFwdAlgoWinograd
96-35-35-3x3-64-35-35-64-1x1-1x1-1x1-0-NCHW-FP32-B=miopenConvolutionBwdDataAlgoWinograd:ConvBinWinograd3x3U,0,447608,0,miopenConvolutionBwdDataAlgoWinograd
256-8-8-1x3-384-8-8-64-0x1-1x1-1x1-0-NCHW-FP32-B=miopenConvolutionBwdDataAlgoWinograd:ConvBinWinogradRxS,0,327093,0,miopenConvolutionBwdDataAlgoWinograd;miopenConvolutionBwdDataAlgoImplicitGEMM:ConvHipImplicitGemmBwdDataV1R1,0,379518,0,miopenConvolutionBwdDataAlgoImplicitGEMM;miopenConvolutionBwdDataAlgoGEMM:gemm,3,17976,294912,MIOpenGEMM
512-8-8-1x3-256-8-8-64-0x1-1x1-1x1-0-NCHW-FP32-F=miopenConvolutionFwdAlgoWinograd:ConvBinWinogradRxSf2x3,0,418029,0,miopenConvolutionFwdAlgoWinograd;miopenConvolutionFwdAlgoImplicitGEMM:ConvHipImplicitGemmV4R1Fwd,0,455795,0,miopenConvolutionFwdAlgoImplicitGEMM;miopenConvolutionFwdAlgoGEMM:GemmFwdRest,4,18546,393216,MIOpenGEMM
96-35-35-1x1-384-35-35-64-0x0-1x1-1x1-0-NCHW-FP32-W=miopenConvolutionBwdWeightsAlgoDirect:ConvAsmBwdWrW1x1,1,1545,0,miopenConvolutionBwdWeightsAlgoDirect
64-35-35-3x3-96-35-35-64-1x1-1x1-1x1-0-NCHW-FP32-F=miopenConvolutionFwdAlgoWinograd:ConvBinWinogradRxS,0,433887,0,miopenConvolutionFwdAlgoWinograd
384-35-35-3x3-384-17-17-64-0x0-2x2-1x1-0-NCHW-FP32-F=miopenConvolutionFwdAlgoWinograd:ConvBinWinogradRxS,9,36122,0,miopenConvolutionFwdAlgoWinograd;miopenConvolutionFwdAlgoGEMM:GemmFwdRest,16,5251,3995136,MIOpenGEMM;miopenConvolutionFwdAlgoDirect:ConvOclDirectFwd,44,1984,0,miopenConvolutionFwdAlgoDirect
384-35-35-1x1-192-35-35-64-0x0-1x1-1x1-0-NCHW-FP32-F=miopenConvolutionFwdAlgoDirect:ConvAsm1x1U,1,46955,0,miopenConvolutionFwdAlgoDirect;miopenConvolutionFwdAlgoWinograd:ConvBinWinogradRxSf3x2,2,39479,0,miopenConvolutionFwdAlgoWinograd;miopenConvolutionFwdAlgoGEMM:GemmFwd1x1_0_1,4,30282,0,MIOpenGEMM
512-8-8-3x1-448-8-8-64-1x0-1x1-1x1-0-NCHW-FP32-W=miopenConvolutionBwdWeightsAlgoDirect:ConvOclBwdWrW53,0,821309,0,miopenConvolutionBwdWeightsAlgoDirect;miopenConvolutionBwdWeightsAlgoImplicitGEMM:ConvHipImplicitGemmV4R1WrW,0,914092,0,miopenConvolutionBwdWeightsAlgoImplicitGEMM;miopenConvolutionBwdWeightsAlgoWinograd:ConvBinWinogradRxSf2x3,1,12705,0,miopenConvolutionBwdWeightsAlgoWinograd;miopenConvolutionBwdWeightsAlgoGEMM:gemm,2,54,344064,MIOpenGEMM
384-8-8-1x3-256-8-8-64-0x1-1x1-1x1-0-NCHW-FP32-F=miopenConvolutionFwdAlgoWinograd:ConvBinWinogradRxS,0,318049,0,miopenConvolutionFwdAlgoWinograd;miopenConvolutionFwdAlgoImplicitGEMM:ConvHipImplicitGemmV4R1Fwd,0,628185,0,miopenConvolutionFwdAlgoImplicitGEMM;miopenConvolutionFwdAlgoGEMM:GemmFwdRest,5,4019,294912,MIOpenGEMM
96-71-71-3x3-64-73-73-64-0x0-1x1-1x1-0-NCHW-FP32-B=miopenConvolutionBwdDataAlgoWinograd:ConvBinWinogradRxSf2x3,1,78072,0,miopenConvolutionBwdDataAlgoWinograd;miopenConvolutionBwdDataAlgoDirect:ConvOclDirectFwd,9,98164,0,miopenConvolutionBwdDataAlgoDirect;miopenConvolutionBwdDataAlgoImplicitGEMM:ConvHipImplicitGemmBwdDataV1R1,11,8431,0,miopenConvolutionBwdDataAlgoImplicitGEMM;miopenConvolutionBwdDataAlgoGEMM:gemm,11,8624,11614464,MIOpenGEMM
384-17-17-1x1-1024-17-17-64-0x0-1x1-1x1-0-NCHW-FP32-B=miopenConvolutionBwdDataAlgoDirect:ConvAsm1x1U,1,59606,0,miopenConvolutionBwdDataAlgoDirect;miopenConvolutionBwdDataAlgoWinograd:ConvBinWinogradRxSf3x2,3,1582,0,miopenConvolutionBwdDataAlgoWinograd;miopenConvolutionBwdDataAlgoGEMM:gemm,3,35886,0,MIOpenGEMM
64-73-73-3x3-96-71-71-64-0x0-1x1-1x1-0-NCHW-FP32-F=miopenConvolutionFwdAlgoWinograd:ConvBinWinogradRxSf2x3,1,77361,0,miopenConvolutionFwdAlgoWinograd;miopenConvolutionFwdAlgoGEMM:GemmFwdRest,9,9631,11614464,MIOpenGEMM;miopenConvolutionFwdAlgoDirect:ConvOclDirectFwd,11,2234,0,miopenConvolutionFwdAlgoDirect
64-73-73-7x1-64-73-73-64-3x0-1x1-1x1-0-NCHW-FP32-W=miopenConvolutionBwdWeightsAlgoWinograd:ConvBinWinogradRxSf2x3,9,30126,0,miopenConvolutionBwdWeightsAlgoWinograd;miopenConvolutionBwdWeightsAlgoDirect:ConvOclBwdWrW2<4>,9,3876,1835008,miopenConvolutionBwdWeightsAlgoDirect;miopenConvolutionBwdWeightsAlgoGEMM:gemm,33,5193,9549568,MIOpenGEMM;miopenConvolutionBwdWeightsAlgoImplicitGEMM:ConvHipImplicitGemmV4R1WrW,34,4996,0,miopenConvolutionBwdWeightsAlgoImplicitGEMM
128-17-17-1x1-768-17-17-128-0x0-1x1-1x1-0-NCHW-FP32-B=miopenConvolutionBwdDataAlgoDirect:ConvAsm1x1U,0,724573,0,miopenConvolutionBwdDataAlgoDirect;miopenConvolutionBwdDataAlgoWinograd:ConvBinWinogradRxSf3x2,1,64729,0,miopenConvolutionBwdDataAlgoWinograd;miopenConvolutionBwdDataAlgoGEMM:gemm,40,3733,0,MIOpenGEMM
1024-64-64-1x1-512-32-32-2-0x0-2x2-1x1-0-NCHW-FP32-F=miopenConvolutionFwdAlgoImplicitGEMM:ConvHipImplicitGemmV4R4Fwd,0,470356,0,miopenConvolutionFwdAlgoImplicitGEMM;miopenConvolutionFwdAlgoGEMM:GemmFwd1x1_0_2,0,603865,12582912,MIOpenGEMM;miopenConvolutionFwdAlgoDirect:ConvOclDirectFwd1x1,1,5873,0,miopenConvolutionFwdAlgoDirect;miopenConvolutionFwdAlgoWinograd:ConvBinWinogradRxSf2x3,1,77136,0,miopenConvolutionFwdAlgoWinograd
256-32-32-1x1-2048-32-32-2-0x0-1x1-1x1-0-NCHW-FP32-B=miopenConvolutionBwdDataAlgoDirect:ConvAsm1x1U,0,324229,0,miopenConvolutionBwdDataAlgoDirect;miopenConvolutionBwdDataAlgoGEMM:gemm,0,360157,0,MIOpenGEMM;miopenConvolutionBwdDataAlgoWinograd:ConvBinWinogradRxSf3x2,0,504622,0,miopenConvolutionBwdDataAlgoWinograd;miopenConvolutionBwdDataAlgoImplicitGEMM:ConvHipImplicitGemmBwdDataV1R1,1,7496,0,miopenConvolutionBwdDataAlgoImplicitGEMM
256-64-64-1x1-1024-64-64-2-0x0-1x1-1x1-0-NCHW-FP32-W=miopenConvolutionBwdWeightsAlgoDirect:ConvAsmBwdWrW1x1,1,16792,0,miopenConvolutionBwdWeightsAlgoDirect;miopenConvolutionBwdWeightsAlgoWinograd:ConvBinWinogradRxSf2x3,4,13029,0,miopenConvolutionBwdWeightsAlgoWinograd
512-128-128-3x3-256-128-128-2-1x1-1x1-1x1-0-NCHW-FP32-W=miopenConvolutionBwdWeightsAlgoWinograd:ConvBinWinogradRxS,10,9338,0,miopenConvolutionBwdWeightsAlgoWinograd;miopenConvolutionBwdWeightsAlgoImplicitGEMM:ConvHipImplicitGemmV4R1WrW,11,7963,0,miopenConvolutionBwdWeightsAlgoImplicitGEMM;miopenConvolutionBwdWeightsAlgoGEMM:gemm,15,5189,150994944,MIOpenGEMM;miopenConvolutionBwdWeightsAlgoDirect:ConvOclBwdWrW53,16,5127,0,miopenConvolutionBwdWeightsAlgoDirect
512-128-128-3x3-256-128-128-2-1x1-1x1-1x1-0-NCHW-FP32-B=miopenConvolutionBwdDataAlgoWinograd:ConvBinWinogradRxS,3,26656,0,miopenConvolutionBwdDataAlgoWinograd
2048-32-32-1x1-256-32-32-2-0x0-1x1-1x1-0-NCHW-FP32-F=miopenConvolutionFwdAlgoDirect:ConvAsm1x1U,0,372686,0,miopenConvolutionFwdAlgoDirect;miopenConvolutionFwdAlgoGEMM:GemmFwd1x1_0_1,0,435692,0,MIOpenGEMM;miopenConvolutionFwdAlgoWinograd:ConvBinWinogradRxSf3x2,0,473764,0,miopenConvolutionFwdAlgoWinograd;miopenConvolutionFwdAlgoImplicitGEMM:ConvHipImplicitGemmV4R4Fwd,0,580448,0,miopenConvolutionFwdAlgoImplicitGEMM
256-64-64-1x1-1024-64-64-2-0x0-1x1-1x1-0-NCHW-FP32-B=miopenConvolutionBwdDataAlgoGEMM:gemm,0,661195,0,MIOpenGEMM;miopenConvolutionBwdDataAlgoWinograd:ConvBinWinogradRxSf3x2,1,8178,0,miopenConvolutionBwdDataAlgoWinograd;miopenConvolutionBwdDataAlgoDirect:ConvOclDirectFwd1x1,1,76521,0,miopenConvolutionBwdDataAlgoDirect;miopenConvolutionBwdDataAlgoImplicitGEMM:ConvHipImplicitGemmBwdDataV1R1,2,854,0,miopenConvolutionBwdDataAlgoImplicitGEMM
256-128-128-3x3-512-128-128-2-1x1-1x1-1x1-0-NCHW-FP32-F=miopenConvolutionFwdAlgoWinograd:ConvBinWinogradRxSf2x3,3,23602,0,miopenConvolutionFwdAlgoWinograd
512-128-128-1x1-128-128-128-2-0x0-1x1-1x1-0-NCHW-FP32-W=miopenConvolutionBwdWeightsAlgoDirect:ConvAsmBwdWrW1x1,1,4944,0,miopenConvolutionBwdWeightsAlgoDirect
1024-64-64-1x1-256-64-64-2-0x0-1x1-1x1-0-NCHW-FP32-F=miopenConvolutionFwdAlgoGEMM:GemmFwd1x1_0_1,0,674524,0,MIOpenGEMM;miopenConvolutionFwdAlgoImplicitGEMM:ConvHipImplicitGemmV4R4Fwd,0,689154,0,miopenConvolutionFwdAlgoImplicitGEMM;miopenConvolutionFwdAlgoWinograd:ConvBinWinogradRxSf3x2,1,3669,0,miopenConvolutionFwdAlgoWinograd;miopenConvolutionFwdAlgoDirect:ConvOclDirectFwd1x1,1,25989,0,miopenConvolutionFwdAlgoDirect
256-128-128-3x3-256-128-128-2-1x1-1x1-1x1-0-NCHW-FP32-W=miopenConvolutionBwdWeightsAlgoWinograd:ConvBinWinogradRxS,6,28807,0,miopenConvolutionBwdWeightsAlgoWinograd;miopenConvolutionBwdWeightsAlgoGEMM:gemm,7,7434,150994944,MIOpenGEMM;miopenConvolutionBwdWeightsAlgoDirect:ConvOclBwdWrW53,7,8384,0,miopenConvolutionBwdWeightsAlgoDirect;miopenConvolutionBwdWeightsAlgoImplicitGEMM:ConvHipImplicitGemmV4R1WrW,7,80217,0,miopenConvolutionBwdWeightsAlgoImplicitGEMM
256-256-256-3x3-256-256-256-2-1x1-1x1-1x1-0-NCHW-FP32-F=miopenConvolutionFwdAlgoWinograd:ConvBinWinograd3x3U,6,91186,0,miopenConvolutionFwdAlgoWinograd
224-17-17-7x1-192-17-17-64-3x0-1x1-1x1-0-NCHW-FP32-B=miopenConvolutionBwdDataAlgoWinograd:ConvBinWinogradRxSf3x2,1,34684,0,miopenConvolutionBwdDataAlgoWinograd;miopenConvolutionBwdDataAlgoImplicitGEMM:ConvHipImplicitGemmBwdDataV1R1,1,71926,0,miopenConvolutionBwdDataAlgoImplicitGEMM;miopenConvolutionBwdDataAlgoGEMM:gemm,3,54023,1553664,MIOpenGEMM
256-128-128-3x3-256-128-128-2-1x1-1x1-1x1-0-NCHW-FP32-B=miopenConvolutionBwdDataAlgoWinograd:ConvBinWinogradRxS,1,70878,0,miopenConvolutionBwdDataAlgoWinograd
512-128-128-1x1-128-128-128-2-0x0-1x1-1x1-0-NCHW-FP32-B=miopenConvolutionBwdDataAlgoWinograd:ConvBinWinogradRxSf3x2,0,868969,0,miopenConvolutionBwdDataAlgoWinograd;miopenConvolutionBwdDataAlgoGEMM:gemm,0,89048,0,MIOpenGEMM;miopenConvolutionBwdDataAlgoDirect:ConvOclDirectFwd1x1,2,54674,0,miopenConvolutionBwdDataAlgoDirect;miopenConvolutionBwdDataAlgoImplicitGEMM:ConvHipImplicitGemmBwdDataV1R1,2,80088,0,miopenConvolutionBwdDataAlgoImplicitGEMM
256-128-128-3x3-256-128-128-2-1x1-1x1-1x1-0-NCHW-FP32-F=miopenConvolutionFwdAlgoWinograd:ConvBinWinogradRxS,1,72259,0,miopenConvolutionFwdAlgoWinograd
96-35-35-1x1-384-35-35-64-0x0-1x1-1x1-0-NCHW-FP32-B=miopenConvolutionBwdDataAlgoDirect:ConvAsm1x1U,0,900639,0,miopenConvolutionBwdDataAlgoDirect;miopenConvolutionBwdDataAlgoWinograd:ConvBinWinogradRxSf3x2,1,6079,0,miopenConvolutionBwdDataAlgoWinograd;miopenConvolutionBwdDataAlgoGEMM:gemm,1,69549,0,MIOpenGEMM
96-73-73-3x3-64-147-147-64-0x0-2x2-1x1-0-NCHW-FP32-W=miopenConvolutionBwdWeightsAlgoGEMM:gemm,11,6873,12278016,MIOpenGEMM;miopenConvolutionBwdWeightsAlgoDirect:ConvOclBwdWrW2NonTunable,24,9514,14155776,miopenConvolutionBwdWeightsAlgoDirect;miopenConvolutionBwdWeightsAlgoImplicitGEMM:ConvHipImplicitGemmV4R1WrW,33,4884,0,miopenConvolutionBwdWeightsAlgoImplicitGEMM
256-256-256-1x1-256-256-256-2-0x0-1x1-1x1-0-NCHW-FP32-W=miopenConvolutionBwdWeightsAlgoDirect:ConvOclBwdWrW1x1,5,62216,0,miopenConvolutionBwdWeightsAlgoDirect
128-128-128-1x1-512-128-128-2-0x0-1x1-1x1-0-NCHW-FP32-F=miopenConvolutionFwdAlgoImplicitGEMM:ConvHipImplicitGemmV4R4Fwd,0,713443,0,miopenConvolutionFwdAlgoImplicitGEMM;miopenConvolutionFwdAlgoDirect:ConvOclDirectFwd1x1,0,850302,0,miopenConvolutionFwdAlgoDirect;miopenConvolutionFwdAlgoGEMM:GemmFwd1x1_0_1,0,877096,0,MIOpenGEMM;miopenConvolutionFwdAlgoWinograd:ConvBinWinogradRxSf3x2,1,4368,0,miopenConvolutionFwdAlgoWinograd
512-8-8-3x1-448-8-8-64-1x0-1x1-1x1-0-NCHW-FP32-B=miopenConvolutionBwdDataAlgoWinograd:ConvBinWinogradRxSf2x3,0,709089,0,miopenConvolutionBwdDataAlgoWinograd;miopenConvolutionBwdDataAlgoImplicitGEMM:ConvHipImplicitGemmBwdDataV1R1,0,760422,0,miopenConvolutionBwdDataAlgoImplicitGEMM;miopenConvolutionBwdDataAlgoGEMM:gemm,3,90209,344064,MIOpenGEMM
512-32-32-1x1-2048-32-32-2-0x0-1x1-1x1-0-NCHW-FP32-W=miopenConvolutionBwdWeightsAlgoGEMM:gemm,0,75493,0,MIOpenGEMM;miopenConvolutionBwdWeightsAlgoWinograd:ConvBinWinogradRxSf2x3,3,59076,0,miopenConvolutionBwdWeightsAlgoWinograd
64-256-256-1x1-256-256-256-2-0x0-1x1-1x1-0-NCHW-FP32-B=miopenConvolutionBwdDataAlgoWinograd:ConvBinWinogradRxSf3x2,1,44033,0,miopenConvolutionBwdDataAlgoWinograd;miopenConvolutionBwdDataAlgoImplicitGEMM:ConvHipImplicitGemmBwdDataV1R1,2,9613,0,miopenConvolutionBwdDataAlgoImplicitGEMM;miopenConvolutionBwdDataAlgoGEMM:gemm,2,97179,0,MIOpenGEMM;miopenConvolutionBwdDataAlgoDirect:ConvOclDirectFwd1x1,3,79347,0,miopenConvolutionBwdDataAlgoDirect
256-256-256-1x1-256-256-256-2-0x0-1x1-1x1-0-NCHW-FP32-B=miopenConvolutionBwdDataAlgoGEMM:gemm,2,74168,0,MIOpenGEMM;miopenConvolutionBwdDataAlgoImplicitGEMM:ConvHipImplicitGemmBwdDataV1R1,3,2442,0,miopenConvolutionBwdDataAlgoImplicitGEMM;miopenConvolutionBwdDataAlgoDirect:ConvOclDirectFwd1x1,3,60244,0,miopenConvolutionBwdDataAlgoDirect;miopenConvolutionBwdDataAlgoWinograd:ConvBinWinogradRxSf3x2,4,7745,0,miopenConvolutionBwdDataAlgoWinograd
128-128-128-3x3-128-128-128-2-1x1-1x1-1x1-0-NCHW-FP32-W=miopenConvolutionBwdWeightsAlgoDirect:ConvAsmBwdWrW3x3,0,999092,0,miopenConvolutionBwdWeightsAlgoDirect;miopenConvolutionBwdWeightsAlgoWinograd:ConvBinWinogradRxSf2x3,2,22674,0,miopenConvolutionBwdWeightsAlgoWinograd;miopenConvolutionBwdWeightsAlgoGEMM:gemm,2,61992,75497472,MIOpenGEMM;miopenConvolutionBwdWeightsAlgoImplicitGEMM:ConvHipImplicitGemmV4R1WrW,4,18781,0,miopenConvolutionBwdWeightsAlgoImplicitGEMM
192-35-35-1x1-384-35-35-64-0x0-1x1-1x1-0-NCHW-FP32-B=miopenConvolutionBwdDataAlgoDirect:ConvAsm1x1U,1,24957,0,miopenConvolutionBwdDataAlgoDirect;miopenConvolutionBwdDataAlgoWinograd:ConvBinWinogradRxSf3x2,2,40179,0,miopenConvolutionBwdDataAlgoWinograd;miopenConvolutionBwdDataAlgoGEMM:gemm,2,49421,0,MIOpenGEMM
512-32-32-1x1-2048-32-32-2-0x0-1x1-1x1-0-NCHW-FP32-B=miopenConvolutionBwdDataAlgoDirect:ConvAsm1x1U,0,516029,0,miopenConvolutionBwdDataAlgoDirect;miopenConvolutionBwdDataAlgoImplicitGEMM:ConvHipImplicitGemmBwdDataV1R1,0,603269,0,miopenConvolutionBwdDataAlgoImplicitGEMM;miopenConvolutionBwdDataAlgoGEMM:gemm,0,780054,0,MIOpenGEMM;miopenConvolutionBwdDataAlgoWinograd:ConvBinWinogradRxSf3x2,0,984241,0,miopenConvolutionBwdDataAlgoWinograd
128-128-128-3x3-128-128-128-2-1x1-1x1-1x1-0-NCHW-FP32-B=miopenConvolutionBwdDataAlgoWinograd:ConvBinWinogradRxS,0,442768,0,miopenConvolutionBwdDataAlgoWinograd
256-256-256-1x1-64-256-256-2-0x0-1x1-1x1-0-NCHW-FP32-F=miopenConvolutionFwdAlgoGEMM:GemmFwd1x1_0_1,0,74604,0,MIOpenGEMM;miopenConvolutionFwdAlgoImplicitGEMM:ConvHipImplicitGemmV4R4Fwd,0,78565,0,miopenConvolutionFwdAlgoImplicitGEMM;miopenConvolutionFwdAlgoDirect:ConvOclDirectFwd1x1,1,5459,0,miopenConvolutionFwdAlgoDirect;miopenConvolutionFwdAlgoWinograd:ConvBinWinogradRxSf3x2,1,1702,0,miopenConvolutionFwdAlgoWinograd
128-128-128-3x3-128-128-128-2-1x1-1x1-1x1-0-NCHW-FP32-F=miopenConvolutionFwdAlgoWinograd:ConvBinWinograd3x3U,0,442559,0,miopenConvolutionFwdAlgoWinograd
256-256-256-1x1-256-256-256-2-0x0-1x1-1x1-0-NCHW-FP32-F=miopenConvolutionFwdAlgoImplicitGEMM:ConvHipImplicitGemmV4R4Fwd,2,886,0,miopenConvolutionFwdAlgoImplicitGEMM;miopenConvolutionFwdAlgoGEMM:GemmFwd1x1_0_1,2,94151,0,MIOpenGEMM;miopenConvolutionFwdAlgoDirect:ConvOclDirectFwd1x1,3,71034,0,miopenConvolutionFwdAlgoDirect;miopenConvolutionFwdAlgoWinograd:ConvBinWinogradRxSf3x2,3,87491,0,miopenConvolutionFwdAlgoWinograd
1024-64-64-1x1-256-64-64-2-0x0-1x1-1x1-0-NCHW-FP32-W=miopenConvolutionBwdWeightsAlgoDirect:ConvAsmBwdWrW1x1,0,851702,0,miopenConvolutionBwdWeightsAlgoDirect;miopenConvolutionBwdWeightsAlgoWinograd:ConvBinWinogradRxSf2x3,3,66274,0,miopenConvolutionBwdWeightsAlgoWinograd
2048-32-32-1x1-512-32-32-2-0x0-1x1-1x1-0-NCHW-FP32-F=miopenConvolutionFwdAlgoGEMM:GemmFwd1x1_0_1,0,759401,0,MIOpenGEMM;miopenConvolutionFwdAlgoImplicitGEMM:ConvHipImplicitGemmV4R4Fwd,0,767427,0,miopenConvolutionFwdAlgoImplicitGEMM;miopenConvolutionFwdAlgoDirect:ConvAsm1x1U,0,795288,0,miopenConvolutionFwdAlgoDirect;miopenConvolutionFwdAlgoWinograd:ConvBinWinogradRxSf3x2,0,916107,0,miopenConvolutionFwdAlgoWinograd
512-32-32-1x1-1024-64-64-2-0x0-2x2-1x1-0-NCHW-FP32-W=miopenConvolutionBwdWeightsAlgoGEMM:gemm,0,649269,4194304,MIOpenGEMM;miopenConvolutionBwdWeightsAlgoDirect:ConvAsmBwdWrW1x1,0,723686,8388608,miopenConvolutionBwdWeightsAlgoDirect;miopenConvolutionBwdWeightsAlgoImplicitGEMM:ConvHipImplicitGemmV4R1WrW,1,10394,0,miopenConvolutionBwdWeightsAlgoImplicitGEMM
128-128-128-1x1-256-256-256-2-0x0-2x2-1x1-0-NCHW-FP32-W=miopenConvolutionBwdWeightsAlgoDirect:ConvAsmBwdWrW1x1,0,789681,33554432,miopenConvolutionBwdWeightsAlgoDirect;miopenConvolutionBwdWeightsAlgoGEMM:gemm,1,19189,16777216,MIOpenGEMM;miopenConvolutionBwdWeightsAlgoImplicitGEMM:ConvHipImplicitGemmV4R1WrW,12,3515,0,miopenConvolutionBwdWeightsAlgoImplicitGEMM
1024-64-64-1x1-256-64-64-2-0x0-1x1-1x1-0-NCHW-FP32-B=miopenConvolutionBwdDataAlgoImplicitGEMM:ConvHipImplicitGemmBwdDataV1R1,0,565028,0,miopenConvolutionBwdDataAlgoImplicitGEMM;miopenConvolutionBwdDataAlgoGEMM:gemm,0,824174,0,MIOpenGEMM;miopenConvolutionBwdDataAlgoWinograd:ConvBinWinogradRxSf3x2,0,948992,0,miopenConvolutionBwdDataAlgoWinograd;miopenConvolutionBwdDataAlgoDirect:ConvOclDirectFwd1x1,1,4817,0,miopenConvolutionBwdDataAlgoDirect
512-32-32-1x1-1024-64-64-2-0x0-2x2-1x1-0-NCHW-FP32-B=miopenConvolutionBwdDataAlgoDirect:ConvOclDirectFwd1x1,0,370971,0,miopenConvolutionBwdDataAlgoDirect;miopenConvolutionBwdDataAlgoImplicitGEMM:ConvHipImplicitGemmBwdDataV1R1,0,55274,0,miopenConvolutionBwdDataAlgoImplicitGEMM;miopenConvolutionBwdDataAlgoGEMM:gemm,0,572047,12582912,MIOpenGEMM;miopenConvolutionBwdDataAlgoWinograd:ConvBinWinogradRxSf2x3,1,95466,0,miopenConvolutionBwdDataAlgoWinograd
512-256-256-3x3-256-256-256-2-1x1-1x1-1x1-0-NCHW-FP32-W=miopenConvolutionBwdWeightsAlgoWinograd:ConvBinWinogradRxS,55,2814,0,miopenConvolutionBwdWeightsAlgoWinograd;miopenConvolutionBwdWeightsAlgoImplicitGEMM:ConvHipImplicitGemmV4R1WrW,60,7201,0,miopenConvolutionBwdWeightsAlgoImplicitGEMM;miopenConvolutionBwdWeightsAlgoGEMM:gemm,92,3642,603979776,MIOpenGEMM;miopenConvolutionBwdWeightsAlgoDirect:ConvOclBwdWrW53,115,651,0,miopenConvolutionBwdWeightsAlgoDirect
256-32-32-1x1-2048-32-32-2-0x0-1x1-1x1-0-NCHW-FP32-W=miopenConvolutionBwdWeightsAlgoGEMM:gemm,0,425696,0,MIOpenGEMM;miopenConvolutionBwdWeightsAlgoWinograd:ConvBinWinogradRxSf2x3,2,39036,0,miopenConvolutionBwdWeightsAlgoWinograd
128-128-128-1x1-256-256-256-2-0x0-2x2-1x1-0-NCHW-FP32-B=miopenConvolutionBwdDataAlgoGEMM:gemm,1,2532,50331648,MIOpenGEMM;miopenConvolutionBwdDataAlgoDirect:ConvOclDirectFwd1x1,1,56903,0,miopenConvolutionBwdDataAlgoDirect;miopenConvolutionBwdDataAlgoWinograd:ConvBinWinogradRxSf2x3,2,15764,0,miopenConvolutionBwdDataAlgoWinograd;miopenConvolutionBwdDataAlgoImplicitGEMM:ConvHipImplicitGemmBwdDataV1R1,2,18435,0,miopenConvolutionBwdDataAlgoImplicitGEMM
256-64-64-1x1-1024-64-64-2-0x0-1x1-1x1-0-NCHW-FP32-F=miopenConvolutionFwdAlgoGEMM:GemmFwd1x1_0_1,0,539812,0,MIOpenGEMM;miopenConvolutionFwdAlgoImplicitGEMM:ConvHipImplicitGemmV4R4Fwd,0,717135,0,miopenConvolutionFwdAlgoImplicitGEMM;miopenConvolutionFwdAlgoWinograd:ConvBinWinogradRxSf3x2,1,5906,0,miopenConvolutionFwdAlgoWinograd;miopenConvolutionFwdAlgoDirect:ConvOclDirectFwd1x1,1,26965,0,miopenConvolutionFwdAlgoDirect
512-256-256-3x3-256-256-256-2-1x1-1x1-1x1-0-NCHW-FP32-B=miopenConvolutionBwdDataAlgoWinograd:ConvBinWinograd3x3U,12,748,0,miopenConvolutionBwdDataAlgoWinograd
256-128-128-1x1-512-128-128-2-0x0-1x1-1x1-0-NCHW-FP32-B=miopenConvolutionBwdDataAlgoGEMM:gemm,1,66554,0,MIOpenGEMM;miopenConvolutionBwdDataAlgoWinograd:ConvBinWinogradRxSf3x2,2,12493,0,miopenConvolutionBwdDataAlgoWinograd;miopenConvolutionBwdDataAlgoDirect:ConvOclDirectFwd1x1,3,89898,0,miopenConvolutionBwdDataAlgoDirect;miopenConvolutionBwdDataAlgoImplicitGEMM:ConvHipImplicitGemmBwdDataV1R1,8,39089,0,miopenConvolutionBwdDataAlgoImplicitGEMM
512-128-128-1x1-1024-64-64-2-0x0-2x2-1x1-0-NCHW-FP32-F=miopenConvolutionFwdAlgoGEMM:GemmFwd1x1_0_2,1,21649,50331648,MIOpenGEMM;miopenConvolutionFwdAlgoImplicitGEMM:ConvHipImplicitGemmV4R4Fwd,1,56469,0,miopenConvolutionFwdAlgoImplicitGEMM;miopenConvolutionFwdAlgoDirect:ConvOclDirectFwd1x1,2,74422,0,miopenConvolutionFwdAlgoDirect;miopenConvolutionFwdAlgoWinograd:ConvBinWinogradRxS,6,14513,0,miopenConvolutionFwdAlgoWinograd
256-256-256-3x3-512-256-256-2-1x1-1x1-1x1-0-NCHW-FP32-F=miopenConvolutionFwdAlgoWinograd:ConvBinWinograd3x3U,12,9632,0,miopenConvolutionFwdAlgoWinograd
256-256-256-1x1-128-128-128-2-0x0-2x2-1x1-0-NCHW-FP32-F=miopenConvolutionFwdAlgoGEMM:GemmFwd1x1_0_2,0,634184,50331648,MIOpenGEMM;miopenConvolutionFwdAlgoImplicitGEMM:ConvHipImplicitGemmV4R4Fwd,0,951439,0,miopenConvolutionFwdAlgoImplicitGEMM;miopenConvolutionFwdAlgoDirect:ConvOclDirectFwd1x1,1,56177,0,miopenConvolutionFwdAlgoDirect;miopenConvolutionFwdAlgoWinograd:ConvBinWinogradRxSf2x3,1,79964,0,miopenConvolutionFwdAlgoWinograd
12-16-16-1x1-512-16-16-2-0x0-1x1-1x1-0-NCHW-FP32-W=miopenConvolutionBwdWeightsAlgoDirect:ConvAsmBwdWrW1x1,0,15156,0,miopenConvolutionBwdWeightsAlgoDirect;miopenConvolutionBwdWeightsAlgoGEMM:gemm,0,3129,0,MIOpenGEMM;miopenConvolutionBwdWeightsAlgoWinograd:ConvBinWinogradRxSf2x3,0,63207,0,miopenConvolutionBwdWeightsAlgoWinograd
64-512-512-7x7-3-1030-1030-2-0x0-2x2-1x1-0-NCHW-FP32-W=miopenConvolutionBwdWeightsAlgoGEMM:gemm,6,33622,154140672,MIOpenGEMM
512-32-32-3x3-256-32-32-2-1x1-1x1-1x1-0-NCHW-FP32-W=miopenConvolutionBwdWeightsAlgoDirect:ConvAsmBwdWrW3x3,0,547957,0,miopenConvolutionBwdWeightsAlgoDirect;miopenConvolutionBwdWeightsAlgoImplicitGEMM:ConvHipImplicitGemmV4R1WrW,0,883265,0,miopenConvolutionBwdWeightsAlgoImplicitGEMM;miopenConvolutionBwdWeightsAlgoWinograd:ConvBinWinogradRxSf2x3,1,384,0,miopenConvolutionBwdWeightsAlgoWinograd;miopenConvolutionBwdWeightsAlgoGEMM:gemm,1,49242,9437184,MIOpenGEMM
64-512-512-7x7-3-1030-1030-2-0x0-2x2-1x1-0-NCHW-FP32-B=miopenConvolutionBwdDataAlgoDirect:ConvOclDirectFwd,6,18213,0,miopenConvolutionBwdDataAlgoDirect;miopenConvolutionBwdDataAlgoWinograd:ConvBinWinogradRxSf2x3,7,93479,0,miopenConvolutionBwdDataAlgoWinograd;miopenConvolutionBwdDataAlgoGEMM:gemm,11,4044,154140672,MIOpenGEMM
512-32-32-3x3-256-32-32-2-1x1-1x1-1x1-0-NCHW-FP32-B=miopenConvolutionBwdDataAlgoWinograd:ConvBinWinogradRxS,0,233049,0,miopenConvolutionBwdDataAlgoWinograd
512-128-128-1x1-256-256-256-2-0x0-2x2-1x1-0-NCHW-FP32-W=miopenConvolutionBwdWeightsAlgoDirect:ConvAsmBwdWrW1x1,2,26453,33554432,miopenConvolutionBwdWeightsAlgoDirect;miopenConvolutionBwdWeightsAlgoGEMM:gemm,2,71751,16777216,MIOpenGEMM;miopenConvolutionBwdWeightsAlgoImplicitGEMM:ConvHipImplicitGemmV4R1WrW,11,7059,0,miopenConvolutionBwdWeightsAlgoImplicitGEMM
512-128-128-1x1-256-128-128-2-0x0-1x1-1x1-0-NCHW-FP32-F=miopenConvolutionFwdAlgoWinograd:ConvBinWinogradRxSf3x2,2,12292,0,miopenConvolutionFwdAlgoWinograd;miopenConvolutionFwdAlgoGEMM:GemmFwd1x1_0_1,3,48873,0,MIOpenGEMM;miopenConvolutionFwdAlgoDirect:ConvOclDirectFwd1x1,5,89997,0,miopenConvolutionFwdAlgoDirect;miopenConvolutionFwdAlgoImplicitGEMM:ConvHipImplicitGemmV4R4Fwd,17,526,0,miopenConvolutionFwdAlgoImplicitGEMM
12-16-16-1x1-512-16-16-2-0x0-1x1-1x1-0-NCHW-FP32-B=miopenConvolutionBwdDataAlgoDirect:ConvAsm1x1U,0,14533,0,miopenConvolutionBwdDataAlgoDirect;miopenConvolutionBwdDataAlgoGEMM:gemm,0,622,0,MIOpenGEMM;miopenConvolutionBwdDataAlgoImplicitGEMM:ConvHipImplicitGemmBwdDataV1R1,0,438279,0,miopenConvolutionBwdDataAlgoImplicitGEMM;miopenConvolutionBwdDataAlgoWinograd:ConvBinWinogradRxSf2x3,12,121,0,miopenConvolutionBwdDataAlgoWinograd
512-16-16-3x3-256-16-16-2-1x1-1x1-1x1-0-NCHW-FP32-W=miopenConvolutionBwdWeightsAlgoDirect:ConvAsmBwdWrW3x3,0,139879,0,miopenConvolutionBwdWeightsAlgoDirect;miopenConvolutionBwdWeightsAlgoImplicitGEMM:ConvHipImplicitGemmV4R1WrW,0,219257,0,miopenConvolutionBwdWeightsAlgoImplicitGEMM;miopenConvolutionBwdWeightsAlgoWinograd:ConvBinWinogradRxS,0,239654,0,miopenConvolutionBwdWeightsAlgoWinograd;miopenConvolutionBwdWeightsAlgoGEMM:gemm,0,360187,2359296,MIOpenGEMM
256-32-32-3x3-512-32-32-2-1x1-1x1-1x1-0-NCHW-FP32-F=miopenConvolutionFwdAlgoWinograd:ConvBinWinogradRxSf2x3,0,241094,0,miopenConvolutionFwdAlgoWinograd
512-32-32-1x1-12-32-32-2-0x0-1x1-1x1-0-NCHW-FP32-F=miopenConvolutionFwdAlgoDirect:ConvAsm1x1U,0,44364,0,miopenConvolutionFwdAlgoDirect;miopenConvolutionFwdAlgoGEMM:GemmFwd1x1_0_1,0,68934,0,MIOpenGEMM;miopenConvolutionFwdAlgoWinograd:ConvBinWinogradRxSf2x3,0,120864,0,miopenConvolutionFwdAlgoWinograd
3-1030-1030-7x7-64-512-512-2-0x0-2x2-1x1-0-NCHW-FP32-F=miopenConvolutionFwdAlgoDirect:ConvOclDirectFwd,2,90283,0,miopenConvolutionFwdAlgoDirect;miopenConvolutionFwdAlgoWinograd:ConvBinWinogradRxS,3,10073,0,miopenConvolutionFwdAlgoWinograd;miopenConvolutionFwdAlgoGEMM:GemmFwdRest,8,34667,154140672,MIOpenGEMM
512-16-16-3x3-256-16-16-2-1x1-1x1-1x1-0-NCHW-FP32-B=miopenConvolutionBwdDataAlgoWinograd:ConvBinWinogradRxS,0,112746,0,miopenConvolutionBwdDataAlgoWinograd
6-256-256-1x1-512-256-256-2-0x0-1x1-1x1-0-NCHW-FP32-W=miopenConvolutionBwdWeightsAlgoGEMM:gemm,3,36508,0,MIOpenGEMM;miopenConvolutionBwdWeightsAlgoDirect:ConvOclBwdWrW53,4,13544,24576,miopenConvolutionBwdWeightsAlgoDirect;miopenConvolutionBwdWeightsAlgoWinograd:ConvBinWinogradRxSf2x3,6,2287,0,miopenConvolutionBwdWeightsAlgoWinograd
512-16-16-1x1-12-16-16-2-0x0-1x1-1x1-0-NCHW-FP32-F=miopenConvolutionFwdAlgoDirect:ConvAsm1x1U,0,2467,0,miopenConvolutionFwdAlgoDirect;miopenConvolutionFwdAlgoWinograd:ConvBinWinogradRxSf3x2,0,176906,0,miopenConvolutionFwdAlgoWinograd;miopenConvolutionFwdAlgoGEMM:GemmFwd1x1_0_1,0,239649,0,MIOpenGEMM
256-16-16-3x3-512-16-16-2-1x1-1x1-1x1-0-NCHW-FP32-F=miopenConvolutionFwdAlgoWinograd:ConvBinWinogradRxS,0,73952,0,miopenConvolutionFwdAlgoWinograd
512-128-128-1x1-256-256-256-2-0x0-2x2-1x1-0-NCHW-FP32-B=miopenConvolutionBwdDataAlgoDirect:ConvOclDirectFwd1x1,2,1629,0,miopenConvolutionBwdDataAlgoDirect;miopenConvolutionBwdDataAlgoGEMM:gemm,2,9286,100663296,MIOpenGEMM;miopenConvolutionBwdDataAlgoImplicitGEMM:ConvHipImplicitGemmBwdDataV1R1,2,36596,0,miopenConvolutionBwdDataAlgoImplicitGEMM;miopenConvolutionBwdDataAlgoWinograd:ConvBinWinogradRxSf2x3,7,24442,0,miopenConvolutionBwdDataAlgoWinograd
128-128-128-1x1-512-128-128-2-0x0-1x1-1x1-0-NCHW-FP32-W=miopenConvolutionBwdWeightsAlgoDirect:ConvAsmBwdWrW1x1,1,6296,0,miopenConvolutionBwdWeightsAlgoDirect
6-256-256-1x1-512-256-256-2-0x0-1x1-1x1-0-NCHW-FP32-B=miopenConvolutionBwdDataAlgoWinograd:ConvBinWinogradRxSf2x3,1,16875,0,miopenConvolutionBwdDataAlgoWinograd;miopenConvolutionBwdDataAlgoGEMM:gemm,1,28246,0,MIOpenGEMM;miopenConvolutionBwdDataAlgoDirect:ConvOclDirectFwd1x1,1,69839,0,miopenConvolutionBwdDataAlgoDirect
256-32-32-3x3-256-32-32-2-1x1-1x1-1x1-0-NCHW-FP32-W=miopenConvolutionBwdWeightsAlgoDirect:ConvAsmBwdWrW3x3,0,320174,0,miopenConvolutionBwdWeightsAlgoDirect;miopenConvolutionBwdWeightsAlgoImplicitGEMM:ConvHipImplicitGemmV4R1WrW,0,719956,0,miopenConvolutionBwdWeightsAlgoImplicitGEMM;miopenConvolutionBwdWeightsAlgoGEMM:gemm,0,778752,9437184,MIOpenGEMM;miopenConvolutionBwdWeightsAlgoWinograd:ConvBinWinogradRxSf2x3,0,935354,0,miopenConvolutionBwdWeightsAlgoWinograd
448-8-8-3x1-512-8-8-64-1x0-1x1-1x1-0-NCHW-FP32-F=miopenConvolutionFwdAlgoWinograd:ConvBinWinogradRxSf2x3,0,711046,0,miopenConvolutionFwdAlgoWinograd;miopenConvolutionFwdAlgoImplicitGEMM:ConvHipImplicitGemmV4R1Fwd,0,899254,0,miopenConvolutionFwdAlgoImplicitGEMM;miopenConvolutionFwdAlgoGEMM:GemmFwdRest,4,4204,344064,MIOpenGEMM
6-128-128-1x1-512-128-128-2-0x0-1x1-1x1-0-NCHW-FP32-W=miopenConvolutionBwdWeightsAlgoDirect:ConvOclBwdWrW53,1,23736,24576,miopenConvolutionBwdWeightsAlgoDirect;miopenConvolutionBwdWeightsAlgoGEMM:gemm,1,95326,0,MIOpenGEMM;miopenConvolutionBwdWeightsAlgoWinograd:ConvBinWinogradRxSf2x3,2,15999,0,miopenConvolutionBwdWeightsAlgoWinograd
96-73-73-3x3-64-147-147-64-0x0-2x2-1x1-0-NCHW-FP32-B=miopenConvolutionBwdDataAlgoWinograd:ConvBinWinogradRxS,6,77189,0,miopenConvolutionBwdDataAlgoWinograd;miopenConvolutionBwdDataAlgoImplicitGEMM:ConvHipImplicitGemmBwdDataV1R1,13,9782,0,miopenConvolutionBwdDataAlgoImplicitGEMM;miopenConvolutionBwdDataAlgoDirect:ConvOclDirectFwd,14,1702,0,miopenConvolutionBwdDataAlgoDirect;miopenConvolutionBwdDataAlgoGEMM:gemm,16,6924,12278016,MIOpenGEMM
6-32-32-1x1-512-32-32-2-0x0-1x1-1x1-0-NCHW-FP32-B=miopenConvolutionBwdDataAlgoDirect:ConvOclDirectFwd1x1,0,21156,0,miopenConvolutionBwdDataAlgoDirect;miopenConvolutionBwdDataAlgoGEMM:gemm,0,23694,0,MIOpenGEMM;miopenConvolutionBwdDataAlgoWinograd:ConvBinWinogradRxSf2x3,0,90666,0,miopenConvolutionBwdDataAlgoWinograd
512-64-64-3x3-256-64-64-2-1x1-1x1-1x1-0-NCHW-FP32-W=miopenConvolutionBwdWeightsAlgoDirect:ConvAsmBwdWrW3x3,1,98444,0,miopenConvolutionBwdWeightsAlgoDirect;miopenConvolutionBwdWeightsAlgoImplicitGEMM:ConvHipImplicitGemmV4R1WrW,3,89359,0,miopenConvolutionBwdWeightsAlgoImplicitGEMM;miopenConvolutionBwdWeightsAlgoWinograd:ConvBinWinogradRxSf2x3,4,14374,0,miopenConvolutionBwdWeightsAlgoWinograd;miopenConvolutionBwdWeightsAlgoGEMM:gemm,4,43508,37748736,MIOpenGEMM
256-32-32-3x3-256-32-32-2-1x1-1x1-1x1-0-NCHW-FP32-B=miopenConvolutionBwdDataAlgoWinograd:ConvBinWinograd3x3U,0,126209,0,miopenConvolutionBwdDataAlgoWinograd
6-128-128-1x1-512-128-128-2-0x0-1x1-1x1-0-NCHW-FP32-B=miopenConvolutionBwdDataAlgoDirect:ConvOclDirectFwd1x1,0,219842,0,miopenConvolutionBwdDataAlgoDirect;miopenConvolutionBwdDataAlgoGEMM:gemm,0,267687,0,MIOpenGEMM;miopenConvolutionBwdDataAlgoWinograd:ConvBinWinogradRxSf2x3,0,446606,0,miopenConvolutionBwdDataAlgoWinograd
512-256-256-1x1-6-256-256-2-0x0-1x1-1x1-0-NCHW-FP32-F=miopenConvolutionFwdAlgoWinograd:ConvBinWinogradRxSf3x2,0,927897,0,miopenConvolutionFwdAlgoWinograd;miopenConvolutionFwdAlgoDirect:ConvOclDirectFwd1x1,1,8721,0,miopenConvolutionFwdAlgoDirect;miopenConvolutionFwdAlgoGEMM:GemmFwd1x1_0_1,12,7361,0,MIOpenGEMM
512-64-64-3x3-256-64-64-2-1x1-1x1-1x1-0-NCHW-FP32-B=miopenConvolutionBwdDataAlgoWinograd:ConvBinWinogradRxS,0,783897,0,miopenConvolutionBwdDataAlgoWinograd
448-8-8-1x3-384-8-8-64-0x1-1x1-1x1-0-NCHW-FP32-W=miopenConvolutionBwdWeightsAlgoDirect:ConvOclBwdWrW53,0,621408,0,miopenConvolutionBwdWeightsAlgoDirect;miopenConvolutionBwdWeightsAlgoImplicitGEMM:ConvHipImplicitGemmV4R1WrW,0,891956,0,miopenConvolutionBwdWeightsAlgoImplicitGEMM;miopenConvolutionBwdWeightsAlgoWinograd:ConvBinWinogradRxSf2x3,0,90572,0,miopenConvolutionBwdWeightsAlgoWinograd;miopenConvolutionBwdWeightsAlgoGEMM:gemm,2,3196,294912,MIOpenGEMM
256-256-256-1x1-512-128-128-2-0x0-2x2-1x1-0-NCHW-FP32-F=miopenConvolutionFwdAlgoImplicitGEMM:ConvHipImplicitGemmV4R4Fwd,1,64273,0,miopenConvolutionFwdAlgoImplicitGEMM;miopenConvolutionFwdAlgoGEMM:GemmFwd1x1_0_2,1,98379,100663296,MIOpenGEMM;miopenConvolutionFwdAlgoDirect:ConvOclDirectFwd1x1,2,54956,0,miopenConvolutionFwdAlgoDirect;miopenConvolutionFwdAlgoWinograd:ConvBinWinogradRxS,6,33901,0,miopenConvolutionFwdAlgoWinograd
256-32-32-3x3-256-32-32-2-1x1-1x1-1x1-0-NCHW-FP32-F=miopenConvolutionFwdAlgoWinograd:ConvBinWinogradRxS,0,129903,0,miopenConvolutionFwdAlgoWinograd
128-128-128-1x1-512-128-128-2-0x0-1x1-1x1-0-NCHW-FP32-B=miopenConvolutionBwdDataAlgoGEMM:gemm,0,684191,0,MIOpenGEMM;miopenConvolutionBwdDataAlgoImplicitGEMM:ConvHipImplicitGemmBwdDataV1R1,0,946439,0,miopenConvolutionBwdDataAlgoImplicitGEMM;miopenConvolutionBwdDataAlgoWinograd:ConvBinWinogradRxSf3x2,0,975146,0,miopenConvolutionBwdDataAlgoWinograd;miopenConvolutionBwdDataAlgoDirect:ConvOclDirectFwd1x1,1,18017,0,miopenConvolutionBwdDataAlgoDirect
12-256-256-1x1-512-256-256-2-0x0-1x1-1x1-0-NCHW-FP32-W=miopenConvolutionBwdWeightsAlgoGEMM:gemm,1,77754,0,MIOpenGEMM;miopenConvolutionBwdWeightsAlgoDirect:ConvOclBwdWrW53,6,13927,49152,miopenConvolutionBwdWeightsAlgoDirect;miopenConvolutionBwdWeightsAlgoWinograd:ConvBinWinogradRxSf2x3,6,47545,0,miopenConvolutionBwdWeightsAlgoWinograd
512-32-32-1x1-6-32-32-2-0x0-1x1-1x1-0-NCHW-FP32-F=miopenConvolutionFwdAlgoDirect:ConvOclDirectFwd1x1,0,45447,0,miopenConvolutionFwdAlgoDirect;miopenConvolutionFwdAlgoGEMM:GemmFwd1x1_0_1,0,50252,0,MIOpenGEMM;miopenConvolutionFwdAlgoWinograd:ConvBinWinogradRxSf2x3,0,122378,0,miopenConvolutionFwdAlgoWinograd
64-147-147-3x3-96-73-73-64-0x0-2x2-1x1-0-NCHW-FP32-F=miopenConvolutionFwdAlgoWinograd:ConvBinWinogradRxS,6,48105,0,miopenConvolutionFwdAlgoWinograd;miopenConvolutionFwdAlgoGEMM:GemmFwdRest,8,41827,12278016,MIOpenGEMM;miopenConvolutionFwdAlgoDirect:ConvOclDirectFwd,19,2325,0,miopenConvolutionFwdAlgoDirect
256-64-64-3x3-512-64-64-2-1x1-1x1-1x1-0-NCHW-FP32-F=miopenConvolutionFwdAlgoWinograd:ConvBinWinogradRxSf2x3,0,833016,0,miopenConvolutionFwdAlgoWinograd
512-128-128-1x1-6-128-128-2-0x0-1x1-1x1-0-NCHW-FP32-F=miopenConvolutionFwdAlgoDirect:ConvOclDirectFwd1x1,0,240249,0,miopenConvolutionFwdAlgoDirect;miopenConvolutionFwdAlgoWinograd:ConvBinWinogradRxSf3x2,0,261654,0,miopenConvolutionFwdAlgoWinograd;miopenConvolutionFwdAlgoGEMM:GemmFwd1x1_0_1,3,31227,0,MIOpenGEMM
256-14-14-3x3-256-14-14-400-1x1-1x1-1x1-0-NCHW-FP32-F=miopenConvolutionFwdAlgoWinograd:ConvBinWinogradRxSf2x3,3,93266,0,miopenConvolutionFwdAlgoWinograd
256-256-256-1x1-64-256-256-2-0x0-1x1-1x1-0-NCHW-FP32-W=miopenConvolutionBwdWeightsAlgoDirect:ConvOclBwdWrW1x1,1,42472,0,miopenConvolutionBwdWeightsAlgoDirect
12-256-256-1x1-512-256-256-2-0x0-1x1-1x1-0-NCHW-FP32-B=miopenConvolutionBwdDataAlgoGEMM:gemm,1,37627,0,MIOpenGEMM;miopenConvolutionBwdDataAlgoDirect:ConvOclDirectFwd1x1,1,59255,0,miopenConvolutionBwdDataAlgoDirect;miopenConvolutionBwdDataAlgoWinograd:ConvBinWinogradRxSf2x3,1,87561,0,miopenConvolutionBwdDataAlgoWinograd;miopenConvolutionBwdDataAlgoImplicitGEMM:ConvHipImplicitGemmBwdDataV1R1,2,17572,0,miopenConvolutionBwdDataAlgoImplicitGEMM
512-128-128-1x1-128-128-128-2-0x0-1x1-1x1-0-NCHW-FP32-F=miopenConvolutionFwdAlgoDirect:ConvOclDirectFwd1x1,0,616049,0,miopenConvolutionFwdAlgoDirect;miopenConvolutionFwdAlgoWinograd:ConvBinWinogradRxSf3x2,0,967776,0,miopenConvolutionFwdAlgoWinograd;miopenConvolutionFwdAlgoImplicitGEMM:ConvHipImplicitGemmV4R4Fwd,1,31906,0,miopenConvolutionFwdAlgoImplicitGEMM;miopenConvolutionFwdAlgoGEMM:GemmFwd1x1_0_1,1,3282,0,MIOpenGEMM
256-64-64-1x1-512-128-128-2-0x0-2x2-1x1-0-NCHW-FP32-W=miopenConvolutionBwdWeightsAlgoDirect:ConvOclBwdWrW1x1,0,853364,16777216,miopenConvolutionBwdWeightsAlgoDirect;miopenConvolutionBwdWeightsAlgoGEMM:gemm,1,17752,8388608,MIOpenGEMM;miopenConvolutionBwdWeightsAlgoImplicitGEMM:ConvHipImplicitGemmV4R1WrW,2,12797,0,miopenConvolutionBwdWeightsAlgoImplicitGEMM
64-256-256-1x1-256-256-256-2-0x0-1x1-1x1-0-NCHW-FP32-W=miopenConvolutionBwdWeightsAlgoDirect:ConvOclBwdWrW1x1,1,41663,0,miopenConvolutionBwdWeightsAlgoDirect
512-32-32-3x3-512-32-32-2-1x1-1x1-1x1-0-NCHW-FP32-W=miopenConvolutionBwdWeightsAlgoDirect:ConvOclBwdWrW53,1,7379,0,miopenConvolutionBwdWeightsAlgoDirect;miopenConvolutionBwdWeightsAlgoImplicitGEMM:ConvHipImplicitGemmV4R1WrW,1,51049,0,miopenConvolutionBwdWeightsAlgoImplicitGEMM;miopenConvolutionBwdWeightsAlgoGEMM:gemm,1,92056,18874368,MIOpenGEMM;miopenConvolutionBwdWeightsAlgoWinograd:ConvBinWinogradRxSf2x3,2,27077,0,miopenConvolutionBwdWeightsAlgoWinograd
256-64-64-3x3-256-64-64-2-1x1-1x1-1x1-0-NCHW-FP32-W=miopenConvolutionBwdWeightsAlgoDirect:ConvAsmBwdWrW3x3,1,8367,0,miopenConvolutionBwdWeightsAlgoDirect;miopenConvolutionBwdWeightsAlgoGEMM:gemm,2,2039,37748736,MIOpenGEMM;miopenConvolutionBwdWeightsAlgoWinograd:ConvBinWinogradRxSf2x3,2,9936,0,miopenConvolutionBwdWeightsAlgoWinograd;miopenConvolutionBwdWeightsAlgoImplicitGEMM:ConvHipImplicitGemmV4R1WrW,2,21295,0,miopenConvolutionBwdWeightsAlgoImplicitGEMM
1024-1-1-7x7-256-7-7-400-0x0-1x1-1x1-0-NCHW-FP32-B=miopenConvolutionBwdDataAlgoWinograd:ConvBinWinogradRxSf3x2,50,6254,0,miopenConvolutionBwdDataAlgoWinograd;miopenConvolutionBwdDataAlgoDirect:ConvOclDirectFwd,152,577,0,miopenConvolutionBwdDataAlgoDirect;miopenConvolutionBwdDataAlgoGEMM:gemm,1274,68,50176,MIOpenGEMM
256-256-256-1x1-64-256-256-2-0x0-1x1-1x1-0-NCHW-FP32-B=miopenConvolutionBwdDataAlgoWinograd:ConvBinWinogradRxSf3x2,1,3633,0,miopenConvolutionBwdDataAlgoWinograd;miopenConvolutionBwdDataAlgoGEMM:gemm,1,50194,0,MIOpenGEMM;miopenConvolutionBwdDataAlgoDirect:ConvOclDirectFwd1x1,7,9294,0,miopenConvolutionBwdDataAlgoDirect;miopenConvolutionBwdDataAlgoImplicitGEMM:ConvHipImplicitGemmBwdDataV1R1,9,70835,0,miopenConvolutionBwdDataAlgoImplicitGEMM
256-256-256-3x3-256-256-256-2-1x1-1x1-1x1-0-NCHW-FP32-W=miopenConvolutionBwdWeightsAlgoImplicitGEMM:ConvHipImplicitGemmV4R1WrW,31,9072,0,miopenConvolutionBwdWeightsAlgoImplicitGEMM;miopenConvolutionBwdWeightsAlgoWinograd:ConvBinWinogradRxSf2x3,36,4614,0,miopenConvolutionBwdWeightsAlgoWinograd;miopenConvolutionBwdWeightsAlgoGEMM:gemm,39,9895,603979776,MIOpenGEMM;miopenConvolutionBwdWeightsAlgoDirect:ConvOclBwdWrW53,57,5434,0,miopenConvolutionBwdWeightsAlgoDirect
512-32-32-3x3-512-32-32-2-1x1-1x1-1x1-0-NCHW-FP32-B=miopenConvolutionBwdDataAlgoWinograd:ConvBinWinogradRxSf2x3,0,445704,0,miopenConvolutionBwdDataAlgoWinograd
256-64-64-3x3-256-64-64-2-1x1-1x1-1x1-0-NCHW-FP32-B=miopenConvolutionBwdDataAlgoWinograd:ConvBinWinogradRxS,0,40806,0,miopenConvolutionBwdDataAlgoWinograd
12-128-128-1x1-512-128-128-2-0x0-1x1-1x1-0-NCHW-FP32-W=miopenConvolutionBwdWeightsAlgoGEMM:gemm,0,368229,0,MIOpenGEMM;miopenConvolutionBwdWeightsAlgoDirect:ConvAsmBwdWrW1x1,0,58763,0,miopenConvolutionBwdWeightsAlgoDirect;miopenConvolutionBwdWeightsAlgoWinograd:ConvBinWinogradRxSf2x3,1,49007,0,miopenConvolutionBwdWeightsAlgoWinograd
512-256-256-1x1-12-256-256-2-0x0-1x1-1x1-0-NCHW-FP32-F=miopenConvolutionFwdAlgoWinograd:ConvBinWinogradRxSf3x2,0,941809,0,miopenConvolutionFwdAlgoWinograd;miopenConvolutionFwdAlgoDirect:ConvOclDirectFwd1x1,4,6057,0,miopenConvolutionFwdAlgoDirect;miopenConvolutionFwdAlgoGEMM:GemmFwd1x1_0_1,25,7725,0,MIOpenGEMM
256-256-256-3x3-256-256-256-2-1x1-1x1-1x1-0-NCHW-FP32-B=miopenConvolutionBwdDataAlgoWinograd:ConvBinWinograd3x3U,6,5858,0,miopenConvolutionBwdDataAlgoWinograd
256-7-7-7x7-1024-1-1-400-0x0-1x1-1x1-0-NCHW-FP32-F=miopenConvolutionFwdAlgoWinograd:ConvBinWinogradRxSf2x3,4,88863,0,miopenConvolutionFwdAlgoWinograd;miopenConvolutionFwdAlgoDirect:ConvOclDirectFwd,138,423,0,miopenConvolutionFwdAlgoDirect;miopenConvolutionFwdAlgoGEMM:GemmFwdRest,902,282,50176,MIOpenGEMM
512-32-32-3x3-512-32-32-2-1x1-1x1-1x1-0-NCHW-FP32-F=miopenConvolutionFwdAlgoWinograd:ConvBinWinogradRxSf2x3,0,449486,0,miopenConvolutionFwdAlgoWinograd
256-64-64-3x3-256-64-64-2-1x1-1x1-1x1-0-NCHW-FP32-F=miopenConvolutionFwdAlgoWinograd:ConvBinWinogradRxSf2x3,0,427293,0,miopenConvolutionFwdAlgoWinograd
1024-1-1-1x1-1024-1-1-400-0x0-1x1-1x1-0-NCHW-FP32-W=miopenConvolutionBwdWeightsAlgoDirect:ConvOclBwdWrW53,0,888634,0,miopenConvolutionBwdWeightsAlgoDirect;miopenConvolutionBwdWeightsAlgoGEMM:gemm,7,9664,0,MIOpenGEMM
256-64-64-1x1-512-128-128-2-0x0-2x2-1x1-0-NCHW-FP32-B=miopenConvolutionBwdDataAlgoDirect:ConvOclDirectFwd1x1,0,577167,0,miopenConvolutionBwdDataAlgoDirect;miopenConvolutionBwdDataAlgoGEMM:gemm,0,773889,25165824,MIOpenGEMM;miopenConvolutionBwdDataAlgoImplicitGEMM:ConvHipImplicitGemmBwdDataV1R1,0,915922,0,miopenConvolutionBwdDataAlgoImplicitGEMM;miopenConvolutionBwdDataAlgoWinograd:ConvBinWinogradRxSf2x3,2,4689,0,miopenConvolutionBwdDataAlgoWinograd
64-256-256-1x1-256-256-256-2-0x0-1x1-1x1-0-NCHW-FP32-F=miopenConvolutionFwdAlgoWinograd:ConvBinWinogradRxSf3x2,1,35271,0,miopenConvolutionFwdAlgoWinograd;miopenConvolutionFwdAlgoGEMM:GemmFwd1x1_0_1,1,7396,0,MIOpenGEMM;miopenConvolutionFwdAlgoImplicitGEMM:ConvHipImplicitGemmV4R4Fwd,2,4299,0,miopenConvolutionFwdAlgoImplicitGEMM;miopenConvolutionFwdAlgoDirect:ConvOclDirectFwd1x1,53,2514,0,miopenConvolutionFwdAlgoDirect
6-16-16-1x1-512-16-16-2-0x0-1x1-1x1-0-NCHW-FP32-W=miopenConvolutionBwdWeightsAlgoDirect:ConvAsmBwdWrW1x1,0,17922,0,miopenConvolutionBwdWeightsAlgoDirect;miopenConvolutionBwdWeightsAlgoWinograd:ConvBinWinogradRxSf2x3,0,349197,0,miopenConvolutionBwdWeightsAlgoWinograd;miopenConvolutionBwdWeightsAlgoGEMM:gemm,0,670902,0,MIOpenGEMM
128-28-28-3x3-128-28-28-64-1x1-1x1-1x1-0-NCHW-FP32-F=miopenConvolutionFwdAlgoWinograd:ConvBinWinograd3x3U,0,671523,0,miopenConvolutionFwdAlgoWinograd;miopenConvolutionFwdAlgoGEMM:GemmFwdRest,5,15954,3612672,MIOpenGEMM
6-64-64-1x1-512-64-64-2-0x0-1x1-1x1-0-NCHW-FP32-W=miopenConvolutionBwdWeightsAlgoDirect:ConvAsmBwdWrW1x1,0,124177,0,miopenConvolutionBwdWeightsAlgoDirect;miopenConvolutionBwdWeightsAlgoGEMM:gemm,0,41579,0,MIOpenGEMM;miopenConvolutionBwdWeightsAlgoWinograd:ConvBinWinogradRxSf2x3,0,444673,0,miopenConvolutionBwdWeightsAlgoWinograd
12-128-128-1x1-512-128-128-2-0x0-1x1-1x1-0-NCHW-FP32-B=miopenConvolutionBwdDataAlgoGEMM:gemm,0,380691,0,MIOpenGEMM;miopenConvolutionBwdDataAlgoDirect:ConvOclDirectFwd1x1,0,844149,0,miopenConvolutionBwdDataAlgoDirect;miopenConvolutionBwdDataAlgoImplicitGEMM:ConvHipImplicitGemmBwdDataV1R1,1,39762,0,miopenConvolutionBwdDataAlgoImplicitGEMM;miopenConvolutionBwdDataAlgoWinograd:ConvBinWinogradRxSf2x3,11,9285,0,miopenConvolutionBwdDataAlgoWinograd
6-64-64-1x1-512-64-64-2-0x0-1x1-1x1-0-NCHW-FP32-B=miopenConvolutionBwdDataAlgoDirect:ConvOclDirectFwd1x1,0,30361,0,miopenConvolutionBwdDataAlgoDirect;miopenConvolutionBwdDataAlgoGEMM:gemm,0,83949,0,MIOpenGEMM;miopenConvolutionBwdDataAlgoWinograd:ConvBinWinogradRxSf2x3,0,215292,0,miopenConvolutionBwdDataAlgoWinograd
81-28-28-1x1-256-28-28-400-0x0-1x1-1x1-0-NCHW-FP32-W=miopenConvolutionBwdWeightsAlgoDirect:ConvAsmBwdWrW1x1,2,61923,0,miopenConvolutionBwdWeightsAlgoDirect;miopenConvolutionBwdWeightsAlgoWinograd:ConvBinWinogradRxSf2x3,11,5515,0,miopenConvolutionBwdWeightsAlgoWinograd;miopenConvolutionBwdWeightsAlgoGEMM:gemm,12,5509,0,MIOpenGEMM
6-16-16-1x1-512-16-16-2-0x0-1x1-1x1-0-NCHW-FP32-B=miopenConvolutionBwdDataAlgoDirect:ConvOclDirectFwd1x1,0,7289,0,miopenConvolutionBwdDataAlgoDirect;miopenConvolutionBwdDataAlgoGEMM:gemm,0,59347,0,MIOpenGEMM;miopenConvolutionBwdDataAlgoWinograd:ConvBinWinogradRxSf2x3,0,1673,0,miopenConvolutionBwdDataAlgoWinograd
512-64-64-1x1-6-64-64-2-0x0-1x1-1x1-0-NCHW-FP32-F=miopenConvolutionFwdAlgoGEMM:GemmFwd1x1_0_1,0,85374,0,MIOpenGEMM;miopenConvolutionFwdAlgoDirect:ConvOclDirectFwd1x1,0,102037,0,miopenConvolutionFwdAlgoDirect;miopenConvolutionFwdAlgoWinograd:ConvBinWinogradRxS,0,120066,0,miopenConvolutionFwdAlgoWinograd
2048-32-32-1x1-512-32-32-2-0x0-1x1-1x1-0-NCHW-FP32-W=miopenConvolutionBwdWeightsAlgoGEMM:gemm,0,779824,0,MIOpenGEMM
512-128-128-1x1-256-64-64-2-0x0-2x2-1x1-0-NCHW-FP32-F=miopenConvolutionFwdAlgoImplicitGEMM:ConvHipImplicitGemmV4R4Fwd,0,467438,0,miopenConvolutionFwdAlgoImplicitGEMM;miopenConvolutionFwdAlgoGEMM:GemmFwd1x1_0_2,0,639384,25165824,MIOpenGEMM;miopenConvolutionFwdAlgoDirect:ConvOclDirectFwd1x1,0,795224,0,miopenConvolutionFwdAlgoDirect;miopenConvolutionFwdAlgoWinograd:ConvBinWinogradRxS,1,67369,0,miopenConvolutionFwdAlgoWinograd
512-128-128-1x1-12-128-128-2-0x0-1x1-1x1-0-NCHW-FP32-F=miopenConvolutionFwdAlgoWinograd:ConvBinWinogradRxSf3x2,0,339279,0,miopenConvolutionFwdAlgoWinograd;miopenConvolutionFwdAlgoGEMM:GemmFwd1x1_0_1,0,82051,0,MIOpenGEMM;miopenConvolutionFwdAlgoDirect:ConvOclDirectFwd1x1,2,80007,0,miopenConvolutionFwdAlgoDirect
12-64-64-1x1-512-64-64-2-0x0-1x1-1x1-0-NCHW-FP32-W=miopenConvolutionBwdWeightsAlgoDirect:ConvOclBwdWrW53,0,236196,49152,miopenConvolutionBwdWeightsAlgoDirect;miopenConvolutionBwdWeightsAlgoGEMM:gemm,0,457953,0,MIOpenGEMM;miopenConvolutionBwdWeightsAlgoWinograd:ConvBinWinogradRxSf2x3,0,549761,0,miopenConvolutionBwdWeightsAlgoWinograd
256-28-28-1x1-1280-28-28-64-0x0-1x1-1x1-0-NCHW-FP32-B=miopenConvolutionBwdDataAlgoDirect:ConvAsm1x1U,3,77062,0,miopenConvolutionBwdDataAlgoDirect;miopenConvolutionBwdDataAlgoGEMM:gemm,6,66503,0,MIOpenGEMM;miopenConvolutionBwdDataAlgoWinograd:ConvBinWinogradRxSf3x2,7,38637,0,miopenConvolutionBwdDataAlgoWinograd
512-28-28-1x1-1024-28-28-64-0x0-1x1-1x1-0-NCHW-FP32-W=miopenConvolutionBwdWeightsAlgoDirect:ConvAsmBwdWrW1x1,5,41637,0,miopenConvolutionBwdWeightsAlgoDirect;miopenConvolutionBwdWeightsAlgoGEMM:gemm,9,88526,0,MIOpenGEMM;miopenConvolutionBwdWeightsAlgoWinograd:ConvBinWinogradRxSf2x3,34,8674,0,miopenConvolutionBwdWeightsAlgoWinograd
512-16-16-1x1-6-16-16-2-0x0-1x1-1x1-0-NCHW-FP32-F=miopenConvolutionFwdAlgoDirect:ConvAsm1x1U,0,23672,0,miopenConvolutionFwdAlgoDirect;miopenConvolutionFwdAlgoWinograd:ConvBinWinogradRxSf2x3,0,119173,0,miopenConvolutionFwdAlgoWinograd;miopenConvolutionFwdAlgoGEMM:GemmFwd1x1_0_1,0,246141,0,MIOpenGEMM
81-28-28-1x1-256-28-28-400-0x0-1x1-1x1-0-NCHW-FP32-B=miopenConvolutionBwdDataAlgoDirect:ConvAsm1x1U,1,63944,0,miopenConvolutionBwdDataAlgoDirect;miopenConvolutionBwdDataAlgoWinograd:ConvBinWinogradRxSf2x3,5,73433,0,miopenConvolutionBwdDataAlgoWinograd;miopenConvolutionBwdDataAlgoGEMM:gemm,7,99492,0,MIOpenGEMM
1024-1-1-1x1-1024-1-1-400-0x0-1x1-1x1-0-NCHW-FP32-B=miopenConvolutionBwdDataAlgoDirect:ConvOclDirectFwd1x1,0,74888,0,miopenConvolutionBwdDataAlgoDirect;miopenConvolutionBwdDataAlgoWinograd:ConvBinWinogradRxS,1,48111,0,miopenConvolutionBwdDataAlgoWinograd;miopenConvolutionBwdDataAlgoGEMM:gemm,48,7993,0,MIOpenGEMM
12-64-64-1x1-512-64-64-2-0x0-1x1-1x1-0-NCHW-FP32-B=miopenConvolutionBwdDataAlgoDirect:ConvAsm1x1U,0,103719,0,miopenConvolutionBwdDataAlgoDirect;miopenConvolutionBwdDataAlgoGEMM:gemm,0,164203,0,MIOpenGEMM;miopenConvolutionBwdDataAlgoImplicitGEMM:ConvHipImplicitGemmBwdDataV1R1,1,2106,0,miopenConvolutionBwdDataAlgoImplicitGEMM;miopenConvolutionBwdDataAlgoWinograd:ConvBinWinogradRxSf2x3,2,62568,0,miopenConvolutionBwdDataAlgoWinograd
1024-64-64-1x1-512-128-128-2-0x0-2x2-1x1-0-NCHW-FP32-W=miopenConvolutionBwdWeightsAlgoDirect:ConvAsmBwdWrW1x1,2,8069,16777216,miopenConvolutionBwdWeightsAlgoDirect;miopenConvolutionBwdWeightsAlgoGEMM:gemm,2,45503,8388608,MIOpenGEMM;miopenConvolutionBwdWeightsAlgoImplicitGEMM:ConvHipImplicitGemmV4R1WrW,3,59173,0,miopenConvolutionBwdWeightsAlgoImplicitGEMM
256-128-128-1x1-512-128-128-2-0x0-1x1-1x1-0-NCHW-FP32-W=miopenConvolutionBwdWeightsAlgoDirect:ConvAsmBwdWrW1x1,1,74258,0,miopenConvolutionBwdWeightsAlgoDirect
512-64-64-1x1-12-64-64-2-0x0-1x1-1x1-0-NCHW-FP32-F=miopenConvolutionFwdAlgoWinograd:ConvBinWinogradRxS,0,148777,0,miopenConvolutionFwdAlgoWinograd;miopenConvolutionFwdAlgoDirect:ConvOclDirectFwd1x1,0,159411,0,miopenConvolutionFwdAlgoDirect;miopenConvolutionFwdAlgoGEMM:GemmFwd1x1_0_1,0,177859,0,MIOpenGEMM
2048-32-32-1x1-512-32-32-2-0x0-1x1-1x1-0-NCHW-FP32-B=miopenConvolutionBwdDataAlgoDirect:ConvAsm1x1U,0,637354,0,miopenConvolutionBwdDataAlgoDirect;miopenConvolutionBwdDataAlgoWinograd:ConvBinWinogradRxSf3x2,0,933639,0,miopenConvolutionBwdDataAlgoWinograd;miopenConvolutionBwdDataAlgoGEMM:gemm,1,42763,0,MIOpenGEMM;miopenConvolutionBwdDataAlgoImplicitGEMM:ConvHipImplicitGemmBwdDataV1R1,2,1468,0,miopenConvolutionBwdDataAlgoImplicitGEMM
256-28-28-3x3-2048-28-28-64-12x12-1x1-12x12-0-NCHW-FP32-W=miopenConvolutionBwdWeightsAlgoImplicitGEMM:ConvHipImplicitGemmV4R1WrW,50,6411,0,miopenConvolutionBwdWeightsAlgoImplicitGEMM;miopenConvolutionBwdWeightsAlgoGEMM:gemm,325,975,57802752,MIOpenGEMM
6-32-32-1x1-512-32-32-2-0x0-1x1-1x1-0-NCHW-FP32-W=miopenConvolutionBwdWeightsAlgoDirect:ConvAsmBwdWrW1x1,0,58675,0,miopenConvolutionBwdWeightsAlgoDirect;miopenConvolutionBwdWeightsAlgoWinograd:ConvBinWinogradRxSf2x3,0,453085,0,miopenConvolutionBwdWeightsAlgoWinograd;miopenConvolutionBwdWeightsAlgoGEMM:gemm,0,58129,0,MIOpenGEMM
512-28-28-1x1-1024-28-28-64-0x0-1x1-1x1-0-NCHW-FP32-B=miopenConvolutionBwdDataAlgoDirect:ConvAsm1x1U,5,20826,0,miopenConvolutionBwdDataAlgoDirect;miopenConvolutionBwdDataAlgoGEMM:gemm,9,52235,0,MIOpenGEMM;miopenConvolutionBwdDataAlgoWinograd:ConvBinWinogradRxSf3x2,11,4083,0,miopenConvolutionBwdDataAlgoWinograd
256-28-28-1x1-81-28-28-400-0x0-1x1-1x1-0-NCHW-FP32-F=miopenConvolutionFwdAlgoDirect:ConvAsm1x1U,2,99572,0,miopenConvolutionFwdAlgoDirect;miopenConvolutionFwdAlgoWinograd:ConvBinWinogradRxSf3x2,3,77457,0,miopenConvolutionFwdAlgoWinograd;miopenConvolutionFwdAlgoGEMM:GemmFwd1x1_0_1,13,891,0,MIOpenGEMM
1280-28-28-1x1-256-28-28-64-0x0-1x1-1x1-0-NCHW-FP32-F=miopenConvolutionFwdAlgoDirect:ConvAsm1x1U,3,93777,0,miopenConvolutionFwdAlgoDirect
256-28-28-3x3-256-28-28-64-2x2-1x1-2x2-0-NCHW-FP32-B=miopenConvolutionBwdDataAlgoImplicitGEMM:ConvHipImplicitGemmBwdDataV1R1,17,7672,0,miopenConvolutionBwdDataAlgoImplicitGEMM;miopenConvolutionBwdDataAlgoGEMM:gemm,31,8734,7225344,MIOpenGEMM
1024-64-64-1x1-512-128-128-2-0x0-2x2-1x1-0-NCHW-FP32-B=miopenConvolutionBwdDataAlgoDirect:ConvOclDirectFwd1x1,2,8158,0,miopenConvolutionBwdDataAlgoDirect;miopenConvolutionBwdDataAlgoGEMM:gemm,2,21105,50331648,MIOpenGEMM;miopenConvolutionBwdDataAlgoImplicitGEMM:ConvHipImplicitGemmBwdDataV1R1,2,40101,0,miopenConvolutionBwdDataAlgoImplicitGEMM;miopenConvolutionBwdDataAlgoWinograd:ConvBinWinogradRxSf2x3,7,241,0,miopenConvolutionBwdDataAlgoWinograd
256-28-28-3x3-2048-28-28-64-12x12-1x1-12x12-0-NCHW-FP32-B=miopenConvolutionBwdDataAlgoImplicitGEMM:ConvHipImplicitGemmBwdDataV1R1,73,3535,0,miopenConvolutionBwdDataAlgoImplicitGEMM;miopenConvolutionBwdDataAlgoGEMM:gemm,172,546,57802752,MIOpenGEMM
512-32-32-1x1-2048-32-32-2-0x0-1x1-1x1-0-NCHW-FP32-F=miopenConvolutionFwdAlgoDirect:ConvAsm1x1U,0,785362,0,miopenConvolutionFwdAlgoDirect;miopenConvolutionFwdAlgoGEMM:GemmFwd1x1_0_1,0,820114,0,MIOpenGEMM;miopenConvolutionFwdAlgoWinograd:ConvBinWinogradRxSf3x2,0,987114,0,miopenConvolutionFwdAlgoWinograd;miopenConvolutionFwdAlgoImplicitGEMM:ConvHipImplicitGemmV4R4Fwd,1,35393,0,miopenConvolutionFwdAlgoImplicitGEMM
256-28-28-1x1-1024-28-28-64-0x0-1x1-1x1-0-NCHW-FP32-F=miopenConvolutionFwdAlgoDirect:ConvAsm1x1U,3,9927,0,miopenConvolutionFwdAlgoDirect;miopenConvolutionFwdAlgoGEMM:GemmFwd1x1_0_1,4,60304,0,MIOpenGEMM;miopenConvolutionFwdAlgoWinograd:ConvBinWinogradRxSf3x2,5,69938,0,miopenConvolutionFwdAlgoWinograd
256-28-28-3x3-256-28-28-64-2x2-1x1-2x2-0-NCHW-FP32-F=miopenConvolutionFwdAlgoImplicitGEMM:ConvHipImplicitGemmV4R1Fwd,6,34248,0,miopenConvolutionFwdAlgoImplicitGEMM;miopenConvolutionFwdAlgoGEMM:GemmFwdRest,20,3163,7225344,MIOpenGEMM
1024-1-1-1x1-1024-1-1-400-0x0-1x1-1x1-0-NCHW-FP32-F=miopenConvolutionFwdAlgoDirect:ConvOclDirectFwd1x1,0,912939,0,miopenConvolutionFwdAlgoDirect;miopenConvolutionFwdAlgoWinograd:ConvBinWinogradRxSf2x3,1,54142,0,miopenConvolutionFwdAlgoWinograd;miopenConvolutionFwdAlgoGEMM:GemmFwd1x1_0_1,42,6269,0,MIOpenGEMM
128-28-28-3x3-128-56-56-64-1x1-2x2-1x1-0-NCHW-FP32-W=miopenConvolutionBwdWeightsAlgoDirect:ConvAsmBwdWrW3x3,3,46514,0,miopenConvolutionBwdWeightsAlgoDirect;miopenConvolutionBwdWeightsAlgoImplicitGEMM:ConvHipImplicitGemmV4R1WrW,17,8433,0,miopenConvolutionBwdWeightsAlgoImplicitGEMM;miopenConvolutionBwdWeightsAlgoGEMM:gemm,175,52,3612672,MIOpenGEMM
1024-28-28-1x1-512-28-28-64-0x0-1x1-1x1-0-NCHW-FP32-F=miopenConvolutionFwdAlgoDirect:ConvAsm1x1U,7,43878,0,miopenConvolutionFwdAlgoDirect;miopenConvolutionFwdAlgoWinograd:ConvBinWinogradRxSf3x2,11,2672,0,miopenConvolutionFwdAlgoWinograd;miopenConvolutionFwdAlgoGEMM:GemmFwd1x1_0_1,13,1498,0,MIOpenGEMM
1024-1-1-7x7-256-7-7-400-0x0-1x1-1x1-0-NCHW-FP32-W=miopenConvolutionBwdWeightsAlgoWinograd:ConvBinWinogradRxS,3,32367,0,miopenConvolutionBwdWeightsAlgoWinograd;miopenConvolutionBwdWeightsAlgoDirect:ConvOclBwdWrW53,11,56,0,miopenConvolutionBwdWeightsAlgoDirect;miopenConvolutionBwdWeightsAlgoGEMM:gemm,88,8604,50176,MIOpenGEMM
12-32-32-1x1-512-32-32-2-0x0-1x1-1x1-0-NCHW-FP32-W=miopenConvolutionBwdWeightsAlgoDirect:ConvAsmBwdWrW1x1,0,47935,0,miopenConvolutionBwdWeightsAlgoDirect;miopenConvolutionBwdWeightsAlgoGEMM:gemm,0,138217,0,MIOpenGEMM;miopenConvolutionBwdWeightsAlgoWinograd:ConvBinWinogradRxSf2x3,0,268518,0,miopenConvolutionBwdWeightsAlgoWinograd
256-14-14-2x2-256-28-28-400-0x0-2x2-1x1-0-NCHW-FP32-W=miopenConvolutionBwdWeightsAlgoImplicitGEMM:ConvHipImplicitGemmV4R1WrW,9,50821,0,miopenConvolutionBwdWeightsAlgoImplicitGEMM;miopenConvolutionBwdWeightsAlgoDirect:ConvOclBwdWrW2<2>,26,825,209715200,miopenConvolutionBwdWeightsAlgoDirect;miopenConvolutionBwdWeightsAlgoGEMM:gemm,101,42,802816,MIOpenGEMM
2048-28-28-3x3-256-28-28-64-12x12-1x1-12x12-0-NCHW-FP32-F=miopenConvolutionFwdAlgoImplicitGEMM:ConvHipImplicitGemmV4R1Fwd,63,5522,0,miopenConvolutionFwdAlgoImplicitGEMM;miopenConvolutionFwdAlgoGEMM:GemmFwdRest,708,824,57802752,MIOpenGEMM
64-56-56-1x1-256-56-56-64-0x0-1x1-1x1-0-NCHW-FP32-W=miopenConvolutionBwdWeightsAlgoDirect:ConvAsmBwdWrW1x1,1,61132,0,miopenConvolutionBwdWeightsAlgoDirect
256-28-28-3x3-256-28-28-64-1x1-1x1-1x1-0-NCHW-FP32-W=miopenConvolutionBwdWeightsAlgoWinograd:ConvBinWinogradRxS,5,1015,0,miopenConvolutionBwdWeightsAlgoWinograd;miopenConvolutionBwdWeightsAlgoDirect:ConvAsmBwdWrW3x3,6,25022,0,miopenConvolutionBwdWeightsAlgoDirect;miopenConvolutionBwdWeightsAlgoImplicitGEMM:ConvHipImplicitGemmV4R1WrW,12,9835,0,miopenConvolutionBwdWeightsAlgoImplicitGEMM;miopenConvolutionBwdWeightsAlgoGEMM:gemm,70,236,7225344,MIOpenGEMM
256-14-14-2x2-256-28-28-400-0x0-2x2-1x1-0-NCHW-FP32-B=miopenConvolutionBwdDataAlgoImplicitGEMM:ConvHipImplicitGemmBwdDataV1R1,10,2645,0,miopenConvolutionBwdDataAlgoImplicitGEMM;miopenConvolutionBwdDataAlgoWinograd:ConvBinWinogradRxSf2x3,19,4863,0,miopenConvolutionBwdDataAlgoWinograd;miopenConvolutionBwdDataAlgoGEMM:gemm,72,1706,802816,MIOpenGEMM
64-256-256-3x3-64-256-256-2-1x1-1x1-1x1-0-NCHW-FP32-W=miopenConvolutionBwdWeightsAlgoDirect:ConvOclBwdWrW53,3,14963,294912,miopenConvolutionBwdWeightsAlgoDirect;miopenConvolutionBwdWeightsAlgoGEMM:gemm,4,73114,150994944,MIOpenGEMM;miopenConvolutionBwdWeightsAlgoWinograd:ConvBinWinogradRxSf2x3,5,47602,0,miopenConvolutionBwdWeightsAlgoWinograd;miopenConvolutionBwdWeightsAlgoImplicitGEMM:ConvHipImplicitGemmV4R1WrW,20,1167,0,miopenConvolutionBwdWeightsAlgoImplicitGEMM
512-28-28-3x3-512-28-28-64-4x4-1x1-4x4-0-NCHW-FP32-B=miopenConvolutionBwdDataAlgoImplicitGEMM:ConvHipImplicitGemmBwdDataV1R1,31,8733,0,miopenConvolutionBwdDataAlgoImplicitGEMM;miopenConvolutionBwdDataAlgoGEMM:gemm,40,6382,14450688,MIOpenGEMM
12-32-32-1x1-512-32-32-2-0x0-1x1-1x1-0-NCHW-FP32-B=miopenConvolutionBwdDataAlgoGEMM:gemm,0,2413,0,MIOpenGEMM;miopenConvolutionBwdDataAlgoDirect:ConvOclDirectFwd1x1,0,3612,0,miopenConvolutionBwdDataAlgoDirect;miopenConvolutionBwdDataAlgoImplicitGEMM:ConvHipImplicitGemmBwdDataV1R1,0,178535,0,miopenConvolutionBwdDataAlgoImplicitGEMM;miopenConvolutionBwdDataAlgoWinograd:ConvBinWinogradRxSf2x3,0,573437,0,miopenConvolutionBwdDataAlgoWinograd
256-28-28-3x3-256-28-28-64-1x1-1x1-1x1-0-NCHW-FP32-B=miopenConvolutionBwdDataAlgoWinograd:ConvBinWinograd3x3U,2,48101,0,miopenConvolutionBwdDataAlgoWinograd
128-28-28-3x3-128-56-56-64-1x1-2x2-1x1-0-NCHW-FP32-B=miopenConvolutionBwdDataAlgoWinograd:ConvBinWinogradRxSf2x3,3,41235,0,miopenConvolutionBwdDataAlgoWinograd;miopenConvolutionBwdDataAlgoImplicitGEMM:ConvHipImplicitGemmBwdDataV1R1,11,2985,0,miopenConvolutionBwdDataAlgoImplicitGEMM;miopenConvolutionBwdDataAlgoDirect:ConvOclDirectFwd,14,171,0,miopenConvolutionBwdDataAlgoDirect;miopenConvolutionBwdDataAlgoGEMM:gemm,46,4382,3612672,MIOpenGEMM
64-256-256-3x3-64-256-256-2-1x1-1x1-1x1-0-NCHW-FP32-B=miopenConvolutionBwdDataAlgoWinograd:ConvBinWinograd3x3U,0,466479,0,miopenConvolutionBwdDataAlgoWinograd
256-28-28-1x1-1024-28-28-64-0x0-1x1-1x1-0-NCHW-FP32-W=miopenConvolutionBwdWeightsAlgoDirect:ConvAsmBwdWrW1x1,2,70435,0,miopenConvolutionBwdWeightsAlgoDirect;miopenConvolutionBwdWeightsAlgoWinograd:ConvBinWinogradRxSf2x3,15,5956,0,miopenConvolutionBwdWeightsAlgoWinograd
256-28-28-2x2-256-14-14-400-0x0-2x2-1x1-0-NCHW-FP32-F=miopenConvolutionFwdAlgoWinograd:ConvBinWinogradRxS,18,656,0,miopenConvolutionFwdAlgoWinograd;miopenConvolutionFwdAlgoGEMM:GemmFwdRest,139,18,802816,MIOpenGEMM
256-28-28-3x3-256-28-28-64-1x1-1x1-1x1-0-NCHW-FP32-F=miopenConvolutionFwdAlgoWinograd:ConvBinWinogradRxSf2x3,2,51049,0,miopenConvolutionFwdAlgoWinograd
512-28-28-3x3-512-28-28-64-4x4-1x1-4x4-0-NCHW-FP32-F=miopenConvolutionFwdAlgoImplicitGEMM:ConvHipImplicitGemmV4R1Fwd,21,8393,0,miopenConvolutionFwdAlgoImplicitGEMM;miopenConvolutionFwdAlgoGEMM:GemmFwdRest,58,5672,14450688,MIOpenGEMM
64-256-256-3x3-64-256-256-2-1x1-1x1-1x1-0-NCHW-FP32-F=miopenConvolutionFwdAlgoWinograd:ConvBinWinograd3x3U,0,485412,0,miopenConvolutionFwdAlgoWinograd
512-28-28-1x1-2048-28-28-64-0x0-1x1-1x1-0-NCHW-FP32-F=miopenConvolutionFwdAlgoDirect:ConvAsm1x1U,13,7322,0,miopenConvolutionFwdAlgoDirect;miopenConvolutionFwdAlgoGEMM:GemmFwd1x1_0_1,15,9109,0,MIOpenGEMM;miopenConvolutionFwdAlgoWinograd:ConvBinWinogradRxSf3x2,22,8075,0,miopenConvolutionFwdAlgoWinograd
128-28-28-3x3-128-28-28-32-1x1-1x1-1x1-0-NCHW-FP32-F=miopenConvolutionFwdAlgoWinograd:ConvBinWinogradRxS,0,349013,0,miopenConvolutionFwdAlgoWinograd
21-28-28-1x1-256-28-28-64-0x0-1x1-1x1-0-NCHW-FP32-W=miopenConvolutionBwdWeightsAlgoDirect:ConvAsmBwdWrW1x1,0,333078,0,miopenConvolutionBwdWeightsAlgoDirect;miopenConvolutionBwdWeightsAlgoGEMM:gemm,2,30036,0,MIOpenGEMM;miopenConvolutionBwdWeightsAlgoWinograd:ConvBinWinogradRxSf2x3,2,3045,0,miopenConvolutionBwdWeightsAlgoWinograd
256-28-28-1x1-1024-28-28-64-0x0-1x1-1x1-0-NCHW-FP32-B=miopenConvolutionBwdDataAlgoDirect:ConvAsm1x1U,2,9082,0,miopenConvolutionBwdDataAlgoDirect;miopenConvolutionBwdDataAlgoGEMM:gemm,4,56999,0,MIOpenGEMM;miopenConvolutionBwdDataAlgoWinograd:ConvBinWinogradRxSf3x2,6,11263,0,miopenConvolutionBwdDataAlgoWinograd
21-28-28-1x1-256-28-28-64-0x0-1x1-1x1-0-NCHW-FP32-B=miopenConvolutionBwdDataAlgoDirect:ConvAsm1x1U,0,185274,0,miopenConvolutionBwdDataAlgoDirect;miopenConvolutionBwdDataAlgoGEMM:gemm,1,29734,0,MIOpenGEMM;miopenConvolutionBwdDataAlgoWinograd:ConvBinWinogradRxSf2x3,2,91847,0,miopenConvolutionBwdDataAlgoWinograd
256-28-28-1x1-1280-28-28-32-0x0-1x1-1x1-0-NCHW-FP32-B=miopenConvolutionBwdDataAlgoDirect:ConvAsm1x1U,2,10346,0,miopenConvolutionBwdDataAlgoDirect;miopenConvolutionBwdDataAlgoGEMM:gemm,3,21735,0,MIOpenGEMM;miopenConvolutionBwdDataAlgoWinograd:ConvBinWinogradRxSf3x2,3,81064,0,miopenConvolutionBwdDataAlgoWinograd
512-28-28-1x1-2048-28-28-64-0x0-1x1-1x1-0-NCHW-FP32-W=miopenConvolutionBwdWeightsAlgoDirect:ConvAsmBwdWrW1x1,11,812,0,miopenConvolutionBwdWeightsAlgoDirect;miopenConvolutionBwdWeightsAlgoGEMM:gemm,28,6587,0,MIOpenGEMM;miopenConvolutionBwdWeightsAlgoWinograd:ConvBinWinogradRxSf2x3,88,7311,0,miopenConvolutionBwdWeightsAlgoWinograd
256-28-28-1x1-2048-28-28-64-0x0-1x1-1x1-0-NCHW-FP32-W=miopenConvolutionBwdWeightsAlgoDirect:ConvAsmBwdWrW1x1,5,61812,0,miopenConvolutionBwdWeightsAlgoDirect;miopenConvolutionBwdWeightsAlgoGEMM:gemm,10,2456,0,MIOpenGEMM;miopenConvolutionBwdWeightsAlgoWinograd:ConvBinWinogradRxSf2x3,32,6937,0,miopenConvolutionBwdWeightsAlgoWinograd
512-28-28-3x3-512-28-28-64-2x2-1x1-2x2-0-NCHW-FP32-W=miopenConvolutionBwdWeightsAlgoImplicitGEMM:ConvHipImplicitGemmV4R1WrW,26,4703,0,miopenConvolutionBwdWeightsAlgoImplicitGEMM;miopenConvolutionBwdWeightsAlgoGEMM:gemm,36,6752,14450688,MIOpenGEMM
64-56-56-1x1-256-56-56-64-0x0-1x1-1x1-0-NCHW-FP32-B=miopenConvolutionBwdDataAlgoDirect:ConvAsm1x1U,1,11534,0,miopenConvolutionBwdDataAlgoDirect;miopenConvolutionBwdDataAlgoImplicitGEMM:ConvHipImplicitGemmBwdDataV1R1,1,37548,0,miopenConvolutionBwdDataAlgoImplicitGEMM;miopenConvolutionBwdDataAlgoGEMM:gemm,1,59468,0,MIOpenGEMM;miopenConvolutionBwdDataAlgoWinograd:ConvBinWinogradRxSf3x2,1,6522,0,miopenConvolutionBwdDataAlgoWinograd
64-56-56-3x3-64-56-56-64-1x1-1x1-1x1-0-NCHW-FP32-W=miopenConvolutionBwdWeightsAlgoDirect:ConvAsmBwdWrW3x3,2,45753,0,miopenConvolutionBwdWeightsAlgoDirect;miopenConvolutionBwdWeightsAlgoWinograd:ConvBinWinogradRxSf2x3,8,60773,0,miopenConvolutionBwdWeightsAlgoWinograd;miopenConvolutionBwdWeightsAlgoImplicitGEMM:ConvHipImplicitGemmV4R1WrW,24,7247,0,miopenConvolutionBwdWeightsAlgoImplicitGEMM;miopenConvolutionBwdWeightsAlgoGEMM:gemm,67,208,7225344,MIOpenGEMM
128-56-56-3x3-128-28-28-64-1x1-2x2-1x1-0-NCHW-FP32-F=miopenConvolutionFwdAlgoImplicitGEMM:ConvHipImplicitGemmV4R1Fwd,1,92423,0,miopenConvolutionFwdAlgoImplicitGEMM;miopenConvolutionFwdAlgoWinograd:ConvBinWinogradRxS,2,73347,0,miopenConvolutionFwdAlgoWinograd;miopenConvolutionFwdAlgoDirect:ConvOclDirectFwd,13,3998,0,miopenConvolutionFwdAlgoDirect;miopenConvolutionFwdAlgoGEMM:GemmFwdRest,20,5756,3612672,MIOpenGEMM
64-56-56-3x3-64-56-56-64-1x1-1x1-1x1-0-NCHW-FP32-B=miopenConvolutionBwdDataAlgoWinograd:ConvBinWinograd3x3U,0,699161,0,miopenConvolutionBwdDataAlgoWinograd;miopenConvolutionBwdDataAlgoGEMM:gemm,5,89067,7225344,MIOpenGEMM
64-256-256-1x1-64-256-256-2-0x0-1x1-1x1-0-NCHW-FP32-W=miopenConvolutionBwdWeightsAlgoDirect:ConvOclBwdWrW1x1,0,565521,0,miopenConvolutionBwdWeightsAlgoDirect
256-14-14-3x3-256-14-14-400-1x1-1x1-1x1-0-NCHW-FP32-W=miopenConvolutionBwdWeightsAlgoWinograd:ConvBinWinogradRxS,7,14632,0,miopenConvolutionBwdWeightsAlgoWinograd;miopenConvolutionBwdWeightsAlgoDirect:ConvAsmBwdWrW3x3,9,91951,0,miopenConvolutionBwdWeightsAlgoDirect;miopenConvolutionBwdWeightsAlgoImplicitGEMM:ConvHipImplicitGemmV4R1WrW,14,8488,0,miopenConvolutionBwdWeightsAlgoImplicitGEMM;miopenConvolutionBwdWeightsAlgoGEMM:gemm,20,6232,1806336,MIOpenGEMM
256-28-28-3x3-2048-28-28-32-12x12-1x1-12x12-0-NCHW-FP32-W=miopenConvolutionBwdWeightsAlgoImplicitGEMM:ConvHipImplicitGemmV4R1WrW,32,1182,0,miopenConvolutionBwdWeightsAlgoImplicitGEMM;miopenConvolutionBwdWeightsAlgoGEMM:gemm,134,65,57802752,MIOpenGEMM
512-28-28-3x3-512-28-28-64-2x2-1x1-2x2-0-NCHW-FP32-B=miopenConvolutionBwdDataAlgoImplicitGEMM:ConvHipImplicitGemmBwdDataV1R1,27,281,0,miopenConvolutionBwdDataAlgoImplicitGEMM;miopenConvolutionBwdDataAlgoGEMM:gemm,51,981,14450688,MIOpenGEMM
256-28-28-1x1-21-28-28-64-0x0-1x1-1x1-0-NCHW-FP32-F=miopenConvolutionFwdAlgoWinograd:ConvBinWinogradRxSf3x2,0,261661,0,miopenConvolutionFwdAlgoWinograd;miopenConvolutionFwdAlgoDirect:ConvAsm1x1U,0,285451,0,miopenConvolutionFwdAlgoDirect;miopenConvolutionFwdAlgoGEMM:GemmFwd1x1_0_1,1,1167,0,MIOpenGEMM
512-28-28-1x1-1024-28-28-32-0x0-1x1-1x1-0-NCHW-FP32-W=miopenConvolutionBwdWeightsAlgoDirect:ConvAsmBwdWrW1x1,2,70448,0,miopenConvolutionBwdWeightsAlgoDirect;miopenConvolutionBwdWeightsAlgoGEMM:gemm,4,64875,0,MIOpenGEMM;miopenConvolutionBwdWeightsAlgoWinograd:ConvBinWinogradRxSf2x3,15,5925,0,miopenConvolutionBwdWeightsAlgoWinograd
128-28-28-1x1-512-28-28-64-0x0-1x1-1x1-0-NCHW-FP32-W=miopenConvolutionBwdWeightsAlgoDirect:ConvAsmBwdWrW1x1,0,955967,0,miopenConvolutionBwdWeightsAlgoDirect
64-56-56-3x3-64-56-56-64-1x1-1x1-1x1-0-NCHW-FP32-F=miopenConvolutionFwdAlgoWinograd:ConvBinWinogradRxS,0,709936,0,miopenConvolutionFwdAlgoWinograd;miopenConvolutionFwdAlgoGEMM:GemmFwdRest,4,39706,7225344,MIOpenGEMM
256-14-14-3x3-256-14-14-400-1x1-1x1-1x1-0-NCHW-FP32-B=miopenConvolutionBwdDataAlgoWinograd:ConvBinWinogradRxSf2x3,3,86882,0,miopenConvolutionBwdDataAlgoWinograd
1280-28-28-1x1-256-28-28-32-0x0-1x1-1x1-0-NCHW-FP32-F=miopenConvolutionFwdAlgoDirect:ConvAsm1x1U,2,57598,0,miopenConvolutionFwdAlgoDirect;miopenConvolutionFwdAlgoWinograd:ConvBinWinogradRxSf3x2,3,78069,0,miopenConvolutionFwdAlgoWinograd;miopenConvolutionFwdAlgoGEMM:GemmFwd1x1_0_1,3,99851,0,MIOpenGEMM
1024-28-28-1x1-256-28-28-64-0x0-1x1-1x1-0-NCHW-FP32-F=miopenConvolutionFwdAlgoDirect:ConvAsm1x1U,3,69033,0,miopenConvolutionFwdAlgoDirect;miopenConvolutionFwdAlgoGEMM:GemmFwd1x1_0_1,5,50842,0,MIOpenGEMM;miopenConvolutionFwdAlgoWinograd:ConvBinWinogradRxSf3x2,5,87086,0,miopenConvolutionFwdAlgoWinograd
64-256-256-1x1-64-256-256-2-0x0-1x1-1x1-0-NCHW-FP32-B=miopenConvolutionBwdDataAlgoWinograd:ConvBinWinogradRxSf3x2,0,447117,0,miopenConvolutionBwdDataAlgoWinograd;miopenConvolutionBwdDataAlgoGEMM:gemm,0,543997,0,MIOpenGEMM;miopenConvolutionBwdDataAlgoImplicitGEMM:ConvHipImplicitGemmBwdDataV1R1,2,2243,0,miopenConvolutionBwdDataAlgoImplicitGEMM;miopenConvolutionBwdDataAlgoDirect:ConvOclDirectFwd1x1,4,13487,0,miopenConvolutionBwdDataAlgoDirect
512-28-28-3x3-512-28-28-64-2x2-1x1-2x2-0-NCHW-FP32-F=miopenConvolutionFwdAlgoImplicitGEMM:ConvHipImplicitGemmV4R1Fwd,21,4209,0,miopenConvolutionFwdAlgoImplicitGEMM;miopenConvolutionFwdAlgoGEMM:GemmFwdRest,52,5653,14450688,MIOpenGEMM
256-28-28-3x3-256-28-28-32-2x2-1x1-2x2-0-NCHW-FP32-B=miopenConvolutionBwdDataAlgoImplicitGEMM:ConvHipImplicitGemmBwdDataV1R1,29,8306,0,miopenConvolutionBwdDataAlgoImplicitGEMM;miopenConvolutionBwdDataAlgoGEMM:gemm,75,179,7225344,MIOpenGEMM
256-56-56-1x1-64-56-56-64-0x0-1x1-1x1-0-NCHW-FP32-F=miopenConvolutionFwdAlgoDirect:ConvOclDirectFwd1x1,0,729093,0,miopenConvolutionFwdAlgoDirect;miopenConvolutionFwdAlgoWinograd:ConvBinWinogradRxSf3x2,1,37437,0,miopenConvolutionFwdAlgoWinograd;miopenConvolutionFwdAlgoGEMM:GemmFwd1x1_0_1,1,77548,0,MIOpenGEMM
128-28-28-3x3-128-56-56-32-1x1-2x2-1x1-0-NCHW-FP32-W=miopenConvolutionBwdWeightsAlgoDirect:ConvAsmBwdWrW3x3,1,15714,0,miopenConvolutionBwdWeightsAlgoDirect;miopenConvolutionBwdWeightsAlgoGEMM:gemm,2,8032,3612672,MIOpenGEMM;miopenConvolutionBwdWeightsAlgoImplicitGEMM:ConvHipImplicitGemmV4R1WrW,2,91609,0,miopenConvolutionBwdWeightsAlgoImplicitGEMM
512-28-28-1x1-128-28-28-64-0x0-1x1-1x1-0-NCHW-FP32-W=miopenConvolutionBwdWeightsAlgoDirect:ConvAsmBwdWrW1x1,0,742752,0,miopenConvolutionBwdWeightsAlgoDirect
256-28-28-1x1-2048-28-28-64-0x0-1x1-1x1-0-NCHW-FP32-B=miopenConvolutionBwdDataAlgoDirect:ConvAsm1x1U,4,81207,0,miopenConvolutionBwdDataAlgoDirect;miopenConvolutionBwdDataAlgoWinograd:ConvBinWinogradRxSf3x2,11,5347,0,miopenConvolutionBwdDataAlgoWinograd;miopenConvolutionBwdDataAlgoGEMM:gemm,11,9173,0,MIOpenGEMM
256-28-28-1x1-1024-28-28-32-0x0-1x1-1x1-0-NCHW-FP32-F=miopenConvolutionFwdAlgoDirect:ConvAsm1x1U,2,38213,0,miopenConvolutionFwdAlgoDirect
256-28-28-3x3-2048-28-28-32-12x12-1x1-12x12-0-NCHW-FP32-B=miopenConvolutionBwdDataAlgoImplicitGEMM:ConvHipImplicitGemmBwdDataV1R1,47,94,0,miopenConvolutionBwdDataAlgoImplicitGEMM;miopenConvolutionBwdDataAlgoGEMM:gemm,155,32,57802752,MIOpenGEMM
512-28-28-1x1-1024-28-28-32-0x0-1x1-1x1-0-NCHW-FP32-B=miopenConvolutionBwdDataAlgoDirect:ConvAsm1x1U,4,35085,0,miopenConvolutionBwdDataAlgoDirect
512-28-28-1x1-2048-28-28-64-0x0-1x1-1x1-0-NCHW-FP32-B=miopenConvolutionBwdDataAlgoDirect:ConvAsm1x1U,10,2525,0,miopenConvolutionBwdDataAlgoDirect;miopenConvolutionBwdDataAlgoGEMM:gemm,17,9405,0,MIOpenGEMM;miopenConvolutionBwdDataAlgoWinograd:ConvBinWinogradRxSf3x2,22,8766,0,miopenConvolutionBwdDataAlgoWinograd
128-28-28-1x1-512-28-28-64-0x0-1x1-1x1-0-NCHW-FP32-B=miopenConvolutionBwdDataAlgoDirect:ConvAsm1x1U,0,734413,0,miopenConvolutionBwdDataAlgoDirect;miopenConvolutionBwdDataAlgoImplicitGEMM:ConvHipImplicitGemmBwdDataV4R1,1,35127,0,miopenConvolutionBwdDataAlgoImplicitGEMM;miopenConvolutionBwdDataAlgoWinograd:ConvBinWinogradRxSf3x2,1,63559,0,miopenConvolutionBwdDataAlgoWinograd;miopenConvolutionBwdDataAlgoGEMM:gemm,1,82349,0,MIOpenGEMM
64-256-256-1x1-64-256-256-2-0x0-1x1-1x1-0-NCHW-FP32-F=miopenConvolutionFwdAlgoWinograd:ConvBinWinogradRxSf3x2,0,335875,0,miopenConvolutionFwdAlgoWinograd;miopenConvolutionFwdAlgoGEMM:GemmFwd1x1_0_1,0,348944,0,MIOpenGEMM;miopenConvolutionFwdAlgoImplicitGEMM:ConvHipImplicitGemmV4R4Fwd,1,29377,0,miopenConvolutionFwdAlgoImplicitGEMM;miopenConvolutionFwdAlgoDirect:ConvOclDirectFwd1x1,1,30982,0,miopenConvolutionFwdAlgoDirect
256-28-28-3x3-256-28-28-32-2x2-1x1-2x2-0-NCHW-FP32-F=miopenConvolutionFwdAlgoImplicitGEMM:ConvHipImplicitGemmV4R1Fwd,26,9534,0,miopenConvolutionFwdAlgoImplicitGEMM;miopenConvolutionFwdAlgoGEMM:GemmFwdRest,134,588,7225344,MIOpenGEMM
1024-28-28-1x1-256-28-28-64-0x0-1x1-1x1-0-NCHW-FP32-W=miopenConvolutionBwdWeightsAlgoDirect:ConvAsmBwdWrW1x1,3,19809,0,miopenConvolutionBwdWeightsAlgoDirect;miopenConvolutionBwdWeightsAlgoGEMM:gemm,15,3288,0,MIOpenGEMM;miopenConvolutionBwdWeightsAlgoWinograd:ConvBinWinogradRxSf2x3,16,871,0,miopenConvolutionBwdWeightsAlgoWinograd
64-56-56-1x1-64-56-56-64-0x0-1x1-1x1-0-NCHW-FP32-W=miopenConvolutionBwdWeightsAlgoDirect:ConvOclBwdWrW1x1,0,486565,0,miopenConvolutionBwdWeightsAlgoDirect
128-28-28-3x3-128-56-56-32-1x1-2x2-1x1-0-NCHW-FP32-B=miopenConvolutionBwdDataAlgoWinograd:ConvBinWinogradRxSf2x3,1,59116,0,miopenConvolutionBwdDataAlgoWinograd;miopenConvolutionBwdDataAlgoImplicitGEMM:ConvHipImplicitGemmBwdDataV1R1,2,78153,0,miopenConvolutionBwdDataAlgoImplicitGEMM;miopenConvolutionBwdDataAlgoGEMM:gemm,3,16637,3612672,MIOpenGEMM;miopenConvolutionBwdDataAlgoDirect:ConvOclDirectFwd,3,52663,0,miopenConvolutionBwdDataAlgoDirect
2048-28-28-3x3-256-28-28-32-12x12-1x1-12x12-0-NCHW-FP32-F=miopenConvolutionFwdAlgoImplicitGEMM:ConvHipImplicitGemmV4R1Fwd,41,9689,0,miopenConvolutionFwdAlgoImplicitGEMM;miopenConvolutionFwdAlgoGEMM:GemmFwdRest,120,43,57802752,MIOpenGEMM
512-28-28-1x1-256-56-56-64-0x0-2x2-1x1-0-NCHW-FP32-W=miopenConvolutionBwdWeightsAlgoDirect:ConvAsmBwdWrW1x1,1,8661,51380224,miopenConvolutionBwdWeightsAlgoDirect;miopenConvolutionBwdWeightsAlgoImplicitGEMM:ConvHipImplicitGemmV4R1WrW,6,19651,0,miopenConvolutionBwdWeightsAlgoImplicitGEMM;miopenConvolutionBwdWeightsAlgoGEMM:gemm,8,18688,802816,MIOpenGEMM
512-28-28-1x1-128-28-28-64-0x0-1x1-1x1-0-NCHW-FP32-B=miopenConvolutionBwdDataAlgoDirect:ConvAsm1x1U,0,843916,0,miopenConvolutionBwdDataAlgoDirect;miopenConvolutionBwdDataAlgoWinograd:ConvBinWinogradRxSf3x2,1,50575,0,miopenConvolutionBwdDataAlgoWinograd;miopenConvolutionBwdDataAlgoGEMM:gemm,2,19829,0,MIOpenGEMM
512-28-28-1x1-2048-28-28-32-0x0-1x1-1x1-0-NCHW-FP32-W=miopenConvolutionBwdWeightsAlgoDirect:ConvAsmBwdWrW1x1,6,85,0,miopenConvolutionBwdWeightsAlgoDirect;miopenConvolutionBwdWeightsAlgoGEMM:gemm,17,2127,0,MIOpenGEMM;miopenConvolutionBwdWeightsAlgoWinograd:ConvBinWinogradRxSf2x3,35,159,0,miopenConvolutionBwdWeightsAlgoWinograd
256-28-28-3x3-256-28-28-32-1x1-1x1-1x1-0-NCHW-FP32-W=miopenConvolutionBwdWeightsAlgoDirect:ConvAsmBwdWrW3x3,3,9446,0,miopenConvolutionBwdWeightsAlgoDirect;miopenConvolutionBwdWeightsAlgoWinograd:ConvBinWinogradRxS,4,39009,0,miopenConvolutionBwdWeightsAlgoWinograd;miopenConvolutionBwdWeightsAlgoImplicitGEMM:ConvHipImplicitGemmV4R1WrW,10,7611,0,miopenConvolutionBwdWeightsAlgoImplicitGEMM;miopenConvolutionBwdWeightsAlgoGEMM:gemm,60,3578,7225344,MIOpenGEMM
512-28-28-1x1-128-28-28-64-0x0-1x1-1x1-0-NCHW-FP32-F=miopenConvolutionFwdAlgoImplicitGEMM:ConvHipImplicitGemmV4R4Fwd,0,698747,0,miopenConvolutionFwdAlgoImplicitGEMM;miopenConvolutionFwdAlgoDirect:ConvAsm1x1U,0,938053,0,miopenConvolutionFwdAlgoDirect;miopenConvolutionFwdAlgoWinograd:ConvBinWinogradRxSf3x2,1,51171,0,miopenConvolutionFwdAlgoWinograd;miopenConvolutionFwdAlgoGEMM:GemmFwd1x1_0_1,2,15149,0,MIOpenGEMM
128-56-56-3x3-128-28-28-32-1x1-2x2-1x1-0-NCHW-FP32-F=miopenConvolutionFwdAlgoWinograd:ConvBinWinogradRxS,1,68594,0,miopenConvolutionFwdAlgoWinograd;miopenConvolutionFwdAlgoImplicitGEMM:ConvHipImplicitGemmV4R1Fwd,5,75563,0,miopenConvolutionFwdAlgoImplicitGEMM;miopenConvolutionFwdAlgoDirect:ConvOclDirectFwd,7,7714,0,miopenConvolutionFwdAlgoDirect;miopenConvolutionFwdAlgoGEMM:GemmFwdRest,46,4306,3612672,MIOpenGEMM
2048-28-28-1x1-256-28-28-64-0x0-1x1-1x1-0-NCHW-FP32-F=miopenConvolutionFwdAlgoDirect:ConvAsm1x1U,7,51354,0,miopenConvolutionFwdAlgoDirect;miopenConvolutionFwdAlgoWinograd:ConvBinWinogradRxSf3x2,11,2298,0,miopenConvolutionFwdAlgoWinograd;miopenConvolutionFwdAlgoGEMM:GemmFwd1x1_0_1,18,308,0,MIOpenGEMM
64-56-56-1x1-256-56-56-32-0x0-1x1-1x1-0-NCHW-FP32-W=miopenConvolutionBwdWeightsAlgoDirect:ConvAsmBwdWrW1x1,0,726731,0,miopenConvolutionBwdWeightsAlgoDirect
64-56-56-1x1-64-56-56-64-0x0-1x1-1x1-0-NCHW-FP32-B=miopenConvolutionBwdDataAlgoDirect:ConvAsm1x1U,0,407673,0,miopenConvolutionBwdDataAlgoDirect;miopenConvolutionBwdDataAlgoGEMM:gemm,0,651017,0,MIOpenGEMM
1024-28-28-1x1-512-28-28-32-0x0-1x1-1x1-0-NCHW-FP32-F=miopenConvolutionFwdAlgoWinograd:ConvBinWinogradRxSf3x2,5,86767,0,miopenConvolutionFwdAlgoWinograd
256-28-28-3x3-256-28-28-32-1x1-1x1-1x1-0-NCHW-FP32-B=miopenConvolutionBwdDataAlgoWinograd:ConvBinWinograd3x3U,1,31833,0,miopenConvolutionBwdDataAlgoWinograd
2048-28-28-1x1-512-28-28-64-0x0-1x1-1x1-0-NCHW-FP32-F=miopenConvolutionFwdAlgoDirect:ConvAsm1x1U,13,7481,0,miopenConvolutionFwdAlgoDirect;miopenConvolutionFwdAlgoWinograd:ConvBinWinogradRxSf3x2,22,7218,0,miopenConvolutionFwdAlgoWinograd;miopenConvolutionFwdAlgoGEMM:GemmFwd1x1_0_1,23,411,0,MIOpenGEMM
256-28-28-1x1-2048-28-28-32-0x0-1x1-1x1-0-NCHW-FP32-W=miopenConvolutionBwdWeightsAlgoDirect:ConvAsmBwdWrW1x1,2,60681,0,miopenConvolutionBwdWeightsAlgoDirect;miopenConvolutionBwdWeightsAlgoGEMM:gemm,5,22675,0,MIOpenGEMM;miopenConvolutionBwdWeightsAlgoWinograd:ConvBinWinogradRxSf2x3,15,531,0,miopenConvolutionBwdWeightsAlgoWinograd
256-28-28-1x1-512-28-28-64-0x0-1x1-1x1-0-NCHW-FP32-W=miopenConvolutionBwdWeightsAlgoDirect:ConvAsmBwdWrW1x1,1,43791,0,miopenConvolutionBwdWeightsAlgoDirect;miopenConvolutionBwdWeightsAlgoGEMM:gemm,6,75901,0,MIOpenGEMM
2048-28-28-1x1-1024-28-28-64-0x0-1x1-1x1-0-NCHW-FP32-W=miopenConvolutionBwdWeightsAlgoDirect:ConvAsmBwdWrW1x1,24,1561,0,miopenConvolutionBwdWeightsAlgoDirect;miopenConvolutionBwdWeightsAlgoGEMM:gemm,37,8204,0,MIOpenGEMM;miopenConvolutionBwdWeightsAlgoWinograd:ConvBinWinogradRxSf2x3,170,887,0,miopenConvolutionBwdWeightsAlgoWinograd
1024-28-28-1x1-256-28-28-64-0x0-1x1-1x1-0-NCHW-FP32-B=miopenConvolutionBwdDataAlgoDirect:ConvAsm1x1U,2,86559,0,miopenConvolutionBwdDataAlgoDirect;miopenConvolutionBwdDataAlgoGEMM:gemm,10,619,0,MIOpenGEMM
512-28-28-1x1-256-56-56-64-0x0-2x2-1x1-0-NCHW-FP32-B=miopenConvolutionBwdDataAlgoDirect:ConvAsm1x1UV2,1,49789,0,miopenConvolutionBwdDataAlgoDirect;miopenConvolutionBwdDataAlgoImplicitGEMM:ConvHipImplicitGemmBwdDataV4R1,2,40815,0,miopenConvolutionBwdDataAlgoImplicitGEMM;miopenConvolutionBwdDataAlgoGEMM:gemm,2,77607,154140672,MIOpenGEMM;miopenConvolutionBwdDataAlgoWinograd:ConvBinWinogradRxSf2x3,12,1857,0,miopenConvolutionBwdDataAlgoWinograd
256-28-28-3x3-256-28-28-32-1x1-1x1-1x1-0-NCHW-FP32-F=miopenConvolutionFwdAlgoWinograd:ConvBinWinograd3x3U,1,40268,0,miopenConvolutionFwdAlgoWinograd
512-28-28-1x1-128-28-28-32-0x0-1x1-1x1-0-NCHW-FP32-W=miopenConvolutionBwdWeightsAlgoDirect:ConvAsmBwdWrW1x1,0,591413,0,miopenConvolutionBwdWeightsAlgoDirect
64-56-56-1x1-256-56-56-32-0x0-1x1-1x1-0-NCHW-FP32-B=miopenConvolutionBwdDataAlgoDirect:ConvAsm1x1U,0,625502,0,miopenConvolutionBwdDataAlgoDirect
128-28-28-1x1-512-28-28-64-0x0-1x1-1x1-0-NCHW-FP32-F=miopenConvolutionFwdAlgoDirect:ConvAsm1x1U,0,882025,0,miopenConvolutionFwdAlgoDirect;miopenConvolutionFwdAlgoGEMM:GemmFwd1x1_0_1,1,52384,0,MIOpenGEMM;miopenConvolutionFwdAlgoWinograd:ConvBinWinogradRxSf3x2,1,64325,0,miopenConvolutionFwdAlgoWinograd
256-28-28-1x1-1024-28-28-32-0x0-1x1-1x1-0-NCHW-FP32-W=miopenConvolutionBwdWeightsAlgoDirect:ConvAsmBwdWrW1x1,1,59917,0,miopenConvolutionBwdWeightsAlgoDirect;miopenConvolutionBwdWeightsAlgoGEMM:gemm,12,3116,0,MIOpenGEMM
512-28-28-1x1-2048-28-28-32-0x0-1x1-1x1-0-NCHW-FP32-B=miopenConvolutionBwdDataAlgoDirect:ConvAsm1x1U,6,69088,0,miopenConvolutionBwdDataAlgoDirect;miopenConvolutionBwdDataAlgoGEMM:gemm,16,4529,0,MIOpenGEMM
1024-28-28-1x1-512-28-28-64-0x0-1x1-1x1-0-NCHW-FP32-W=miopenConvolutionBwdWeightsAlgoDirect:ConvAsmBwdWrW1x1,5,62199,0,miopenConvolutionBwdWeightsAlgoDirect;miopenConvolutionBwdWeightsAlgoWinograd:ConvBinWinogradRxSf2x3,37,2844,0,miopenConvolutionBwdWeightsAlgoWinograd
256-1-1-1x1-2048-1-1-64-0x0-1x1-1x1-0-NCHW-FP32-W=miopenConvolutionBwdWeightsAlgoDirect:ConvAsmBwdWrW1x1,0,56774,0,miopenConvolutionBwdWeightsAlgoDirect;miopenConvolutionBwdWeightsAlgoWinograd:ConvBinWinogradRxSf2x3,0,296777,0,miopenConvolutionBwdWeightsAlgoWinograd;miopenConvolutionBwdWeightsAlgoGEMM:gemm,1,64443,0,MIOpenGEMM
21-28-28-1x1-256-28-28-32-0x0-1x1-1x1-0-NCHW-FP32-W=miopenConvolutionBwdWeightsAlgoDirect:ConvAsmBwdWrW1x1,0,451811,0,miopenConvolutionBwdWeightsAlgoDirect;miopenConvolutionBwdWeightsAlgoGEMM:gemm,2,65109,0,MIOpenGEMM;miopenConvolutionBwdWeightsAlgoWinograd:ConvBinWinogradRxSf2x3,2,96222,0,miopenConvolutionBwdWeightsAlgoWinograd
256-28-28-3x3-2048-28-28-64-36x36-1x1-36x36-0-NCHW-FP32-W=miopenConvolutionBwdWeightsAlgoImplicitGEMM:ConvHipImplicitGemmV4R1WrW,56,8999,0,miopenConvolutionBwdWeightsAlgoImplicitGEMM;miopenConvolutionBwdWeightsAlgoGEMM:gemm,384,103,57802752,MIOpenGEMM
64-56-56-1x1-64-56-56-64-0x0-1x1-1x1-0-NCHW-FP32-F=miopenConvolutionFwdAlgoDirect:ConvOclDirectFwd1x1,0,240569,0,miopenConvolutionFwdAlgoDirect;miopenConvolutionFwdAlgoWinograd:ConvBinWinogradRxSf3x2,0,44992,0,miopenConvolutionFwdAlgoWinograd;miopenConvolutionFwdAlgoGEMM:GemmFwd1x1_0_1,0,72968,0,MIOpenGEMM
512-28-28-1x1-128-28-28-32-0x0-1x1-1x1-0-NCHW-FP32-B=miopenConvolutionBwdDataAlgoWinograd:ConvBinWinogradRxSf3x2,1,35898,0,miopenConvolutionBwdDataAlgoWinograd
21-28-28-1x1-256-28-28-32-0x0-1x1-1x1-0-NCHW-FP32-B=miopenConvolutionBwdDataAlgoDirect:ConvOclDirectFwd1x1,0,533082,0,miopenConvolutionBwdDataAlgoDirect;miopenConvolutionBwdDataAlgoGEMM:gemm,1,74539,0,MIOpenGEMM;miopenConvolutionBwdDataAlgoWinograd:ConvBinWinogradRxSf2x3,3,41113,0,miopenConvolutionBwdDataAlgoWinograd
256-28-28-1x1-512-28-28-64-0x0-1x1-1x1-0-NCHW-FP32-B=miopenConvolutionBwdDataAlgoDirect:ConvAsm1x1U,2,52148,0,miopenConvolutionBwdDataAlgoDirect
256-28-28-1x1-2048-28-28-32-0x0-1x1-1x1-0-NCHW-FP32-B=miopenConvolutionBwdDataAlgoDirect:ConvAsm1x1U,2,9555,0,miopenConvolutionBwdDataAlgoDirect;miopenConvolutionBwdDataAlgoGEMM:gemm,4,65564,0,MIOpenGEMM;miopenConvolutionBwdDataAlgoWinograd:ConvBinWinogradRxSf3x2,5,77895,0,miopenConvolutionBwdDataAlgoWinograd
256-56-56-1x1-64-56-56-32-0x0-1x1-1x1-0-NCHW-FP32-F=miopenConvolutionFwdAlgoDirect:ConvAsm1x1U,0,572956,0,miopenConvolutionFwdAlgoDirect
512-28-28-1x1-2048-28-28-32-0x0-1x1-1x1-0-NCHW-FP32-F=miopenConvolutionFwdAlgoDirect:ConvAsm1x1U,6,55473,0,miopenConvolutionFwdAlgoDirect;miopenConvolutionFwdAlgoGEMM:GemmFwd1x1_0_1,6,89636,0,MIOpenGEMM;miopenConvolutionFwdAlgoWinograd:ConvBinWinogradRxSf3x2,10,8647,0,miopenConvolutionFwdAlgoWinograd
256-56-56-1x1-512-28-28-64-0x0-2x2-1x1-0-NCHW-FP32-F=miopenConvolutionFwdAlgoImplicitGEMM:ConvHipImplicitGemmV4R4Fwd,1,73832,0,miopenConvolutionFwdAlgoImplicitGEMM;miopenConvolutionFwdAlgoDirect:ConvAsm1x1UV2,1,85053,0,miopenConvolutionFwdAlgoDirect;miopenConvolutionFwdAlgoGEMM:GemmFwd1x1_0_2,2,2056,154140672,MIOpenGEMM;miopenConvolutionFwdAlgoWinograd:ConvBinWinogradRxS,10,3648,0,miopenConvolutionFwdAlgoWinograd
256-28-28-3x3-2048-28-28-64-36x36-1x1-36x36-0-NCHW-FP32-B=miopenConvolutionBwdDataAlgoImplicitGEMM:ConvHipImplicitGemmBwdDataV1R1,62,8724,0,miopenConvolutionBwdDataAlgoImplicitGEMM;miopenConvolutionBwdDataAlgoGEMM:gemm,273,567,57802752,MIOpenGEMM
256-28-28-1x1-1024-28-28-32-0x0-1x1-1x1-0-NCHW-FP32-B=miopenConvolutionBwdDataAlgoDirect:ConvAsm1x1U,2,69763,0,miopenConvolutionBwdDataAlgoDirect
128-28-28-3x3-128-28-28-64-1x1-1x1-1x1-0-NCHW-FP32-W=miopenConvolutionBwdWeightsAlgoDirect:ConvOclBwdWrW53,1,68299,0,miopenConvolutionBwdWeightsAlgoDirect;miopenConvolutionBwdWeightsAlgoWinograd:ConvBinWinogradRxS,2,59659,0,miopenConvolutionBwdWeightsAlgoWinograd;miopenConvolutionBwdWeightsAlgoGEMM:gemm,3,57982,3612672,MIOpenGEMM;miopenConvolutionBwdWeightsAlgoImplicitGEMM:ConvHipImplicitGemmV4R1WrW,5,43199,0,miopenConvolutionBwdWeightsAlgoImplicitGEMM
256-28-28-1x1-21-28-28-32-0x0-1x1-1x1-0-NCHW-FP32-F=miopenConvolutionFwdAlgoWinograd:ConvBinWinogradRxSf3x2,0,14399,0,miopenConvolutionFwdAlgoWinograd;miopenConvolutionFwdAlgoDirect:ConvAsm1x1U,0,233205,0,miopenConvolutionFwdAlgoDirect;miopenConvolutionFwdAlgoGEMM:GemmFwd1x1_0_1,0,375013,0,MIOpenGEMM
128-28-28-1x1-512-28-28-32-0x0-1x1-1x1-0-NCHW-FP32-F=miopenConvolutionFwdAlgoDirect:ConvOclDirectFwd1x1,0,598148,0,miopenConvolutionFwdAlgoDirect
128-28-28-3x3-128-28-28-64-1x1-1x1-1x1-0-NCHW-FP32-B=miopenConvolutionBwdDataAlgoWinograd:ConvBinWinograd3x3U,0,672367,0,miopenConvolutionBwdDataAlgoWinograd;miopenConvolutionBwdDataAlgoGEMM:gemm,4,80082,3612672,MIOpenGEMM
256-1-1-1x1-2048-1-1-64-0x0-1x1-1x1-0-NCHW-FP32-B=miopenConvolutionBwdDataAlgoDirect:ConvOclDirectFwd1x1,0,104578,0,miopenConvolutionBwdDataAlgoDirect;miopenConvolutionBwdDataAlgoGEMM:gemm,4,45281,0,MIOpenGEMM
2048-28-28-1x1-512-28-28-32-0x0-1x1-1x1-0-NCHW-FP32-F=miopenConvolutionFwdAlgoDirect:ConvAsm1x1U,7,16824,0,miopenConvolutionFwdAlgoDirect;miopenConvolutionFwdAlgoWinograd:ConvBinWinogradRxSf3x2,11,8438,0,miopenConvolutionFwdAlgoWinograd;miopenConvolutionFwdAlgoGEMM:GemmFwd1x1_0_1,12,448,0,MIOpenGEMM
1024-28-28-1x1-512-28-28-64-0x0-1x1-1x1-0-NCHW-FP32-B=miopenConvolutionBwdDataAlgoDirect:ConvAsm1x1U,6,71204,0,miopenConvolutionBwdDataAlgoDirect
256-56-56-1x1-64-56-56-64-0x0-1x1-1x1-0-NCHW-FP32-W=miopenConvolutionBwdWeightsAlgoDirect:ConvAsmBwdWrW1x1,1,69552,0,miopenConvolutionBwdWeightsAlgoDirect
2048-28-28-1x1-1024-28-28-64-0x0-1x1-1x1-0-NCHW-FP32-B=miopenConvolutionBwdDataAlgoDirect:ConvAsm1x1U,21,3637,0,miopenConvolutionBwdDataAlgoDirect;miopenConvolutionBwdDataAlgoGEMM:gemm,44,5383,0,MIOpenGEMM;miopenConvolutionBwdDataAlgoWinograd:ConvBinWinogradRxSf3x2,46,5101,0,miopenConvolutionBwdDataAlgoWinograd
128-28-28-1x1-512-28-28-32-0x0-1x1-1x1-0-NCHW-FP32-W=miopenConvolutionBwdWeightsAlgoDirect:ConvAsmBwdWrW1x1,0,402483,0,miopenConvolutionBwdWeightsAlgoDirect
512-28-28-1x1-256-28-28-64-0x0-1x1-1x1-0-NCHW-FP32-F=miopenConvolutionFwdAlgoDirect:ConvAsm1x1U,2,58915,0,miopenConvolutionFwdAlgoDirect
2048-28-28-3x3-256-28-28-64-36x36-1x1-36x36-0-NCHW-FP32-F=miopenConvolutionFwdAlgoImplicitGEMM:ConvHipImplicitGemmV4R1Fwd,43,8312,0,miopenConvolutionFwdAlgoImplicitGEMM;miopenConvolutionFwdAlgoGEMM:GemmFwdRest,357,978,57802752,MIOpenGEMM
1024-28-28-1x1-256-28-28-32-0x0-1x1-1x1-0-NCHW-FP32-F=miopenConvolutionFwdAlgoDirect:ConvAsm1x1U,2,17075,0,miopenConvolutionFwdAlgoDirect;miopenConvolutionFwdAlgoGEMM:GemmFwd1x1_0_1,10,2926,0,MIOpenGEMM
1024-28-28-1x1-256-28-28-32-0x0-1x1-1x1-0-NCHW-FP32-W=miopenConvolutionBwdWeightsAlgoDirect:ConvAsmBwdWrW1x1,1,56005,0,miopenConvolutionBwdWeightsAlgoDirect;miopenConvolutionBwdWeightsAlgoWinograd:ConvBinWinogradRxSf2x3,6,2498,0,miopenConvolutionBwdWeightsAlgoWinograd;miopenConvolutionBwdWeightsAlgoGEMM:gemm,6,82435,0,MIOpenGEMM
128-28-28-3x3-128-28-28-32-1x1-1x1-1x1-0-NCHW-FP32-W=miopenConvolutionBwdWeightsAlgoDirect:ConvAsmBwdWrW3x3,1,12323,0,miopenConvolutionBwdWeightsAlgoDirect;miopenConvolutionBwdWeightsAlgoWinograd:ConvBinWinogradRxSf2x3,2,40541,0,miopenConvolutionBwdWeightsAlgoWinograd;miopenConvolutionBwdWeightsAlgoImplicitGEMM:ConvHipImplicitGemmV4R1WrW,8,46087,0,miopenConvolutionBwdWeightsAlgoImplicitGEMM;miopenConvolutionBwdWeightsAlgoGEMM:gemm,80,3177,3612672,MIOpenGEMM
2048-28-28-1x1-256-28-28-32-0x0-1x1-1x1-0-NCHW-FP32-F=miopenConvolutionFwdAlgoDirect:ConvOclDirectFwd1x1,3,461,0,miopenConvolutionFwdAlgoDirect;miopenConvolutionFwdAlgoWinograd:ConvBinWinogradRxSf3x2,5,6447,0,miopenConvolutionFwdAlgoWinograd;miopenConvolutionFwdAlgoGEMM:GemmFwd1x1_0_1,6,40164,0,MIOpenGEMM
512-28-28-3x3-512-28-28-32-4x4-1x1-4x4-0-NCHW-FP32-B=miopenConvolutionBwdDataAlgoImplicitGEMM:ConvHipImplicitGemmBwdDataV4R1,14,145,0,miopenConvolutionBwdDataAlgoImplicitGEMM;miopenConvolutionBwdDataAlgoGEMM:gemm,32,7558,14450688,MIOpenGEMM
