src/kernels/gfx900_64.OpenCL.fdb.txt
256-56-56-3x3-256-28-28-32-1x1-2x2-1x1-0-NCHW-FP32-F_g32=miopenConvolutionFwdAlgoDirect:ConvOclDirectFwd,1.5643,0,miopenConvolutionFwdAlgoDirect,<unused>;miopenConvolutionFwdAlgoWinograd:ConvBinWinogradRxSf2x3,1.80033,0,miopenConvolutionFwdAlgoWinograd,<unused>;miopenConvolutionFwdAlgoGEMM:GemmFwdRest,15.4882,7225344,MIOpenGEMM,0_0_784_72_784_784_8_72
128-56-56-3x3-128-56-56-32-1x1-1x1-1x1-0-NCHW-FP32-B_g32=miopenConvolutionBwdDataAlgoDirect:ConvAsm3x3U,0.311419,0,miopenConvolutionBwdDataAlgoDirect,<unused>;miopenConvolutionBwdDataAlgoWinograd:ConvBinWinogradRxSf2x3,2.62194,0,miopenConvolutionBwdDataAlgoWinograd,<unused>;miopenConvolutionBwdDataAlgoGEMM:GemmBwdRest,17.0115,14450688,MIOpenGEMM,0_1_3136_36_3136_3136_36_4
1024-14-14-1x1-512-14-14-32-0x0-1x1-1x1-0-NCHW-FP32-W=miopenConvolutionBwdWeightsAlgoDirect:ConvAsmBwdWrW1x1,1.25434,0,miopenConvolutionBwdWeightsAlgoDirect,<unused>;miopenConvolutionBwdWeightsAlgoGEMM:GemmWrw1x1_stride1,2.88405,0,MIOpenGEMM,1_0_196_196_512_512_1024_196;miopenConvolutionBwdWeightsAlgoWinograd:ConvBinWinogradRxSf2x3,6.45453,0,miopenConvolutionBwdWeightsAlgoWinograd,1024x14x14x1x1x512x14x14x32xNCHWxFP32x0x0x1x1x1x1x1x0
1024-14-14-1x1-512-14-14-32-0x0-1x1-1x1-0-NCHW-FP32-F=miopenConvolutionFwdAlgoDirect:ConvAsm1x1U,1.49798,0,miopenConvolutionFwdAlgoDirect,<unused>;miopenConvolutionFwdAlgoWinograd:ConvBinWinogradRxSf3x2,2.71029,0,miopenConvolutionFwdAlgoWinograd,<unused>;miopenConvolutionFwdAlgoGEMM:GemmFwd1x1_0_1,3.76262,0,MIOpenGEMM,0_0_196_1024_196_196_512_1024
256-28-28-3x3-256-28-28-32-1x1-1x1-1x1-0-NCHW-FP32-W_g32=miopenConvolutionBwdWeightsAlgoDirect:ConvAsmBwdWrW3x3,0.227867,0,miopenConvolutionBwdWeightsAlgoDirect,<unused>;miopenConvolutionBwdWeightsAlgoWinograd:ConvBinWinogradRxSf2x3,15.7817,0,miopenConvolutionBwdWeightsAlgoWinograd,256x28x28x3x3x256x28x28x32xNCHWxFP32x1x1x1x1x1x1x32x0;miopenConvolutionBwdWeightsAlgoGEMM:GemmWrwUniversal,22.2396,7225344,MIOpenGEMM,1_0_784_784_72_72_8_784
256-56-56-1x1-256-56-56-32-0x0-1x1-1x1-0-NCHW-FP32-W=miopenConvolutionBwdWeightsAlgoDirect:ConvAsmBwdWrW1x1,2.56679,0,miopenConvolutionBwdWeightsAlgoDirect,<unused>
128-56-56-3x3-128-56-56-32-1x1-1x1-1x1-0-NCHW-FP32-F_g32=miopenConvolutionFwdAlgoDirect:ConvAsm3x3U,0.357541,0,miopenConvolutionFwdAlgoDirect,<unused>;miopenConvolutionFwdAlgoWinograd:ConvBinWinogradRxSf2x3,3.13818,0,miopenConvolutionFwdAlgoWinograd,<unused>;miopenConvolutionFwdAlgoGEMM:GemmFwdRest,20.1256,14450688,MIOpenGEMM,0_0_3136_36_3136_3136_4_36
1024-14-14-1x1-512-14-14-32-0x0-1x1-1x1-0-NCHW-FP32-B=miopenConvolutionBwdDataAlgoDirect:ConvAsm1x1U,1.99714,0,miopenConvolutionBwdDataAlgoDirect,<unused>;miopenConvolutionBwdDataAlgoGEMM:GemmBwd1x1_stride1,7.89237,0,MIOpenGEMM,0_1_196_512_196_196_512_1024
256-28-28-3x3-256-28-28-32-1x1-1x1-1x1-0-NCHW-FP32-B_g32=miopenConvolutionBwdDataAlgoDirect:ConvAsm3x3U,0.356598,0,miopenConvolutionBwdDataAlgoDirect,<unused>;miopenConvolutionBwdDataAlgoWinograd:ConvBinWinogradRxSf2x3,1.43461,0,miopenConvolutionBwdDataAlgoWinograd,<unused>;miopenConvolutionBwdDataAlgoGEMM:GemmBwdRest,12.9361,7225344,MIOpenGEMM,0_1_784_72_784_784_72_8
2048-7-7-1x1-1024-14-14-32-0x0-2x2-1x1-0-NCHW-FP32-W=miopenConvolutionBwdWeightsAlgoImplicitGEMM:ConvHipImplicitGemmV4R1WrW,1.42721,0,miopenConvolutionBwdWeightsAlgoImplicitGEMM,2048x7x7x1x1x1024x14x14x32xNCHWxFP32x0x0x2x2x1x1x1x0;miopenConvolutionBwdWeightsAlgoDirect:ConvAsmBwdWrW1x1,1.60813,6422528,miopenConvolutionBwdWeightsAlgoDirect,<unused>;miopenConvolutionBwdWeightsAlgoGEMM:GemmWrwUniversal,3.96677,200704,MIOpenGEMM,1_0_49_49_1024_1024_2048_49
256-56-56-1x1-64-56-56-32-0x0-1x1-1x1-0-NCHW-FP32-B=miopenConvolutionBwdDataAlgoDirect:ConvAsm1x1U,0.561067,0,miopenConvolutionBwdDataAlgoDirect,<unused>;miopenConvolutionBwdDataAlgoWinograd:ConvBinWinogradRxSf3x2,1.26903,0,miopenConvolutionBwdDataAlgoWinograd,<unused>;miopenConvolutionBwdDataAlgoGEMM:GemmBwd1x1_stride1,1.55275,0,MIOpenGEMM,0_1_3136_64_3136_3136_64_256
256-56-56-1x1-256-56-56-32-0x0-1x1-1x1-0-NCHW-FP32-B=miopenConvolutionBwdDataAlgoDirect:ConvAsm1x1U,1.9726,0,miopenConvolutionBwdDataAlgoDirect,<unused>;miopenConvolutionBwdDataAlgoGEMM:GemmBwd1x1_stride1,2.53574,0,MIOpenGEMM,0_1_3136_256_3136_3136_256_256;miopenConvolutionBwdDataAlgoWinograd:ConvBinWinogradRxSf3x2,4.69398,0,miopenConvolutionBwdDataAlgoWinograd,<unused>
512-28-28-1x1-512-28-28-32-0x0-1x1-1x1-0-NCHW-FP32-F=miopenConvolutionFwdAlgoImplicitGEMM:ConvHipImplicitGemmV4R4Fwd,2.254,0,miopenConvolutionFwdAlgoImplicitGEMM,512x28x28x1x1x512x28x28x32xNCHWxFP32x0x0x1x1x1x1x1x1;miopenConvolutionFwdAlgoDirect:ConvAsm1x1U,2.90546,0,miopenConvolutionFwdAlgoDirect,<unused>;miopenConvolutionFwdAlgoGEMM:GemmFwd1x1_0_1,3.01021,0,MIOpenGEMM,0_0_784_512_784_784_512_512;miopenConvolutionFwdAlgoWinograd:ConvBinWinogradRxSf3x2,4.92038,0,miopenConvolutionFwdAlgoWinograd,<unused>
2048-7-7-1x1-1024-7-7-32-0x0-1x1-1x1-0-NCHW-FP32-W=miopenConvolutionBwdWeightsAlgoDirect:ConvAsmBwdWrW1x1,1.5615,0,miopenConvolutionBwdWeightsAlgoDirect,<unused>;miopenConvolutionBwdWeightsAlgoGEMM:GemmWrw1x1_stride1,3.20674,0,MIOpenGEMM,1_0_49_49_1024_1024_2048_49;miopenConvolutionBwdWeightsAlgoWinograd:ConvBinWinogradRxSf2x3,4.79579,0,miopenConvolutionBwdWeightsAlgoWinograd,2048x7x7x1x1x1024x7x7x32xNCHWxFP32x0x0x1x1x1x1x1x0
2048-14-14-1x1-1024-14-14-32-0x0-1x1-1x1-0-NCHW-FP32-W=miopenConvolutionBwdWeightsAlgoGEMM:GemmWrw1x1_stride1,4.77902,0,MIOpenGEMM,1_0_196_196_1024_1024_2048_196;miopenConvolutionBwdWeightsAlgoDirect:ConvAsmBwdWrW1x1,5.18176,0,miopenConvolutionBwdWeightsAlgoDirect,<unused>;miopenConvolutionBwdWeightsAlgoWinograd:ConvBinWinogradRxSf2x3,21.8652,0,miopenConvolutionBwdWeightsAlgoWinograd,2048x14x14x1x1x1024x14x14x32xNCHWxFP32x0x0x1x1x1x1x1x0
256-28-28-3x3-256-28-28-32-1x1-1x1-1x1-0-NCHW-FP32-F_g32=miopenConvolutionFwdAlgoDirect:ConvAsm3x3U,0.36285,0,miopenConvolutionFwdAlgoDirect,<unused>;miopenConvolutionFwdAlgoWinograd:ConvBinWinogradRxSf2x3,2.30784,0,miopenConvolutionFwdAlgoWinograd,<unused>;miopenConvolutionFwdAlgoGEMM:GemmFwdRest,58.2773,7225344,MIOpenGEMM,0_0_784_72_784_784_8_72
512-14-14-1x1-1024-14-14-32-0x0-1x1-1x1-0-NCHW-FP32-F=miopenConvolutionFwdAlgoDirect:ConvAsm1x1U,1.7645,0,miopenConvolutionFwdAlgoDirect,<unused>;miopenConvolutionFwdAlgoWinograd:ConvBinWinogradRxSf3x2,2.53282,0,miopenConvolutionFwdAlgoWinograd,<unused>;miopenConvolutionFwdAlgoGEMM:GemmFwd1x1_0_1,3.56407,0,MIOpenGEMM,0_0_196_512_196_196_1024_512
2048-7-7-1x1-1024-14-14-32-0x0-2x2-1x1-0-NCHW-FP32-B=miopenConvolutionBwdDataAlgoDirect:ConvAsm1x1UV2,1.4211,0,miopenConvolutionBwdDataAlgoDirect,<unused>;miopenConvolutionBwdDataAlgoImplicitGEMM:ConvHipImplicitGemmBwdDataV1R1,1.66771,0,miopenConvolutionBwdDataAlgoImplicitGEMM,2048x7x7x1x1x1024x14x14x32xNCHWxFP32x0x0x2x2x1x1x1x0;miopenConvolutionBwdDataAlgoGEMM:GemmBwd1x1_stride2,2.32934,19267584,MIOpenGEMM,0_1_1568_1024_1568_1568_1024_2048;miopenConvolutionBwdDataAlgoWinograd:ConvBinWinogradRxSf2x3,11.7535,0,miopenConvolutionBwdDataAlgoWinograd,<unused>
64-56-56-1x1-256-56-56-32-0x0-1x1-1x1-0-NCHW-FP32-F=miopenConvolutionFwdAlgoImplicitGEMM:ConvHipImplicitGemmV4R4Fwd,0.598326,0,miopenConvolutionFwdAlgoImplicitGEMM,64x56x56x1x1x256x56x56x32xNCHWxFP32x0x0x1x1x1x1x1x1;miopenConvolutionFwdAlgoDirect:ConvAsm1x1U,0.644835,0,miopenConvolutionFwdAlgoDirect,<unused>;miopenConvolutionFwdAlgoGEMM:GemmFwd1x1_0_1,1.27088,0,MIOpenGEMM,0_0_3136_64_3136_3136_256_64;miopenConvolutionFwdAlgoWinograd:ConvBinWinogradRxSf3x2,1.47479,0,miopenConvolutionFwdAlgoWinograd,<unused>
256-56-56-1x1-256-56-56-32-0x0-1x1-1x1-0-NCHW-FP32-F=miopenConvolutionFwdAlgoImplicitGEMM:ConvHipImplicitGemmV4R4Fwd,2.18049,0,miopenConvolutionFwdAlgoImplicitGEMM,256x56x56x1x1x256x56x56x32xNCHWxFP32x0x0x1x1x1x1x1x1;miopenConvolutionFwdAlgoDirect:ConvAsm1x1U,2.64757,0,miopenConvolutionFwdAlgoDirect,<unused>;miopenConvolutionFwdAlgoGEMM:GemmFwd1x1_0_1,2.78791,0,MIOpenGEMM,0_0_3136_256_3136_3136_256_256;miopenConvolutionFwdAlgoWinograd:ConvBinWinogradRxSf3x2,4.69351,0,miopenConvolutionFwdAlgoWinograd,<unused>
2048-7-7-1x1-1024-7-7-32-0x0-1x1-1x1-0-NCHW-FP32-B=miopenConvolutionBwdDataAlgoDirect:ConvAsm1x1U,1.30279,0,miopenConvolutionBwdDataAlgoDirect,<unused>;miopenConvolutionBwdDataAlgoImplicitGEMM:ConvHipImplicitGemmBwdDataV1R1,3.54908,0,miopenConvolutionBwdDataAlgoImplicitGEMM,2048x7x7x1x1x1024x7x7x32xNCHWxFP32x0x0x1x1x1x1x1x0;miopenConvolutionBwdDataAlgoWinograd:ConvBinWinogradRxSf3x2,3.84104,0,miopenConvolutionBwdDataAlgoWinograd,<unused>;miopenConvolutionBwdDataAlgoGEMM:GemmBwd1x1_stride1,10.0231,0,MIOpenGEMM,0_1_49_1024_49_49_1024_2048
2048-14-14-1x1-1024-14-14-32-0x0-1x1-1x1-0-NCHW-FP32-B=miopenConvolutionBwdDataAlgoDirect:ConvAsm1x1U,4.71852,0,miopenConvolutionBwdDataAlgoDirect,<unused>;miopenConvolutionBwdDataAlgoImplicitGEMM:ConvHipImplicitGemmBwdDataV1R1,4.72974,0,miopenConvolutionBwdDataAlgoImplicitGEMM,2048x14x14x1x1x1024x14x14x32xNCHWxFP32x0x0x1x1x1x1x1x0;miopenConvolutionBwdDataAlgoGEMM:GemmBwd1x1_stride1,6.13412,0,MIOpenGEMM,0_1_196_1024_196_196_1024_2048;miopenConvolutionBwdDataAlgoWinograd:ConvBinWinogradRxSf3x2,6.50971,0,miopenConvolutionBwdDataAlgoWinograd,<unused>
256-28-28-1x1-512-28-28-32-0x0-1x1-1x1-0-NCHW-FP32-W=miopenConvolutionBwdWeightsAlgoDirect:ConvAsmBwdWrW1x1,1.26724,0,miopenConvolutionBwdWeightsAlgoDirect,<unused>
64-112-112-7x7-3-224-224-32-3x3-2x2-1x1-0-NCHW-FP32-W=miopenConvolutionBwdWeightsAlgoDirect:ConvOclBwdWrW2<4>,3.91046,301056,miopenConvolutionBwdWeightsAlgoDirect,<unused>;miopenConvolutionBwdWeightsAlgoGEMM:GemmWrwUniversal,8.42286,7375872,MIOpenGEMM,1_0_12544_12544_147_147_64_12544
1024-7-7-1x1-2048-7-7-32-0x0-1x1-1x1-0-NCHW-FP32-W=miopenConvolutionBwdWeightsAlgoDirect:ConvAsmBwdWrW1x1,1.54218,0,miopenConvolutionBwdWeightsAlgoDirect,<unused>;miopenConvolutionBwdWeightsAlgoGEMM:GemmWrw1x1_stride1,3.24739,0,MIOpenGEMM,1_0_49_49_2048_2048_1024_49;miopenConvolutionBwdWeightsAlgoWinograd:ConvBinWinogradRxSf2x3,5.47086,0,miopenConvolutionBwdWeightsAlgoWinograd,1024x7x7x1x1x2048x7x7x32xNCHWxFP32x0x0x1x1x1x1x1x0
512-28-28-3x3-512-28-28-32-1x1-1x1-1x1-0-NCHW-FP32-B_g64=miopenConvolutionBwdDataAlgoDirect:ConvAsm3x3U,0.702987,0,miopenConvolutionBwdDataAlgoDirect,<unused>;miopenConvolutionBwdDataAlgoWinograd:ConvBinWinogradRxSf2x3,5.64112,0,miopenConvolutionBwdDataAlgoWinograd,<unused>;miopenConvolutionBwdDataAlgoGEMM:GemmBwdRest,30.6574,14450688,MIOpenGEMM,0_1_784_72_784_784_72_8
256-56-56-3x3-256-56-56-32-1x1-1x1-1x1-0-NCHW-FP32-B_g64=miopenConvolutionBwdDataAlgoDirect:ConvAsm3x3U,1.56063,0,miopenConvolutionBwdDataAlgoDirect,<unused>;miopenConvolutionBwdDataAlgoWinograd:ConvBinWinogradRxSf2x3,8.92165,0,miopenConvolutionBwdDataAlgoWinograd,<unused>;miopenConvolutionBwdDataAlgoGEMM:GemmBwdRest,107.198,28901376,MIOpenGEMM,0_1_3136_36_3136_3136_36_4
128-56-56-1x1-64-56-56-32-0x0-1x1-1x1-0-NCHW-FP32-W=miopenConvolutionBwdWeightsAlgoDirect:ConvAsmBwdWrW1x1,0.645196,0,miopenConvolutionBwdWeightsAlgoDirect,<unused>
1024-14-14-1x1-2048-7-7-32-0x0-2x2-1x1-0-NCHW-FP32-F=miopenConvolutionFwdAlgoGEMM:GemmFwd1x1_0_2,1.27986,19267584,MIOpenGEMM,0_0_1568_1024_1568_1568_2048_1024;miopenConvolutionFwdAlgoDirect:ConvAsm1x1U,2.10947,6422528,miopenConvolutionFwdAlgoDirect,<unused>;miopenConvolutionFwdAlgoImplicitGEMM:ConvHipImplicitGemmV4R1Fwd,3.17837,0,miopenConvolutionFwdAlgoImplicitGEMM,1024x14x14x1x1x2048x7x7x32xNCHWxFP32x0x0x2x2x1x1x1x1;miopenConvolutionFwdAlgoWinograd:ConvBinWinogradRxS,8.62408,0,miopenConvolutionFwdAlgoWinograd,<unused>
128-56-56-1x1-256-56-56-32-0x0-1x1-1x1-0-NCHW-FP32-W=miopenConvolutionBwdWeightsAlgoDirect:ConvAsmBwdWrW1x1,1.45526,0,miopenConvolutionBwdWeightsAlgoDirect,<unused>
512-28-28-1x1-1024-28-28-32-0x0-1x1-1x1-0-NCHW-FP32-F=miopenConvolutionFwdAlgoGEMM:GemmFwd1x1_0_1,5.40263,0,MIOpenGEMM,0_0_784_512_784_784_1024_512;miopenConvolutionFwdAlgoDirect:ConvAsm1x1U,6.28091,0,miopenConvolutionFwdAlgoDirect,<unused>;miopenConvolutionFwdAlgoWinograd:ConvBinWinogradRxSf3x2,8.96351,0,miopenConvolutionFwdAlgoWinograd,<unused>
2048-7-7-1x1-2048-7-7-32-0x0-1x1-1x1-0-NCHW-FP32-F=miopenConvolutionFwdAlgoDirect:ConvAsm1x1U,3.87326,0,miopenConvolutionFwdAlgoDirect,<unused>;miopenConvolutionFwdAlgoImplicitGEMM:ConvHipImplicitGemmV4R4Fwd,4.22264,0,miopenConvolutionFwdAlgoImplicitGEMM,2048x7x7x1x1x2048x7x7x32xNCHWxFP32x0x0x1x1x1x1x1x1;miopenConvolutionFwdAlgoGEMM:GemmFwd1x1_0_1,5.04097,0,MIOpenGEMM,0_0_49_2048_49_49_2048_2048;miopenConvolutionFwdAlgoWinograd:ConvBinWinogradRxSf3x2,6.76118,0,miopenConvolutionFwdAlgoWinograd,<unused>
3-224-224-7x7-64-112-112-32-3x3-2x2-1x1-0-NCHW-FP32-F=miopenConvolutionFwdAlgoDirect:ConvAsm7x7c3h224w224k64u2v2p3q3f1,1.31123,0,miopenConvolutionFwdAlgoDirect,<unused>;miopenConvolutionFwdAlgoWinograd:ConvBinWinogradRxS,2.07192,0,miopenConvolutionFwdAlgoWinograd,<unused>;miopenConvolutionFwdAlgoGEMM:GemmFwdRest,3.44979,7375872,MIOpenGEMM,0_0_12544_147_12544_12544_64_147
512-28-28-3x3-512-28-28-32-1x1-1x1-1x1-0-NCHW-FP32-F_g64=miopenConvolutionFwdAlgoDirect:ConvAsm3x3U,0.806023,0,miopenConvolutionFwdAlgoDirect,<unused>;miopenConvolutionFwdAlgoWinograd:ConvBinWinogradRxSf2x3,2.76935,0,miopenConvolutionFwdAlgoWinograd,<unused>;miopenConvolutionFwdAlgoGEMM:GemmFwdRest,67.5008,14450688,MIOpenGEMM,0_0_784_72_784_784_8_72
256-28-28-1x1-512-28-28-32-0x0-1x1-1x1-0-NCHW-FP32-B=miopenConvolutionBwdDataAlgoDirect:ConvAsm1x1U,1.07808,0,miopenConvolutionBwdDataAlgoDirect,<unused>;miopenConvolutionBwdDataAlgoGEMM:GemmBwd1x1_stride1,2.439,0,MIOpenGEMM,0_1_784_512_784_784_512_256;miopenConvolutionBwdDataAlgoWinograd:ConvBinWinogradRxSf3x2,2.59491,0,miopenConvolutionBwdDataAlgoWinograd,<unused>
1024-14-14-1x1-2048-14-14-32-0x0-1x1-1x1-0-NCHW-FP32-F=miopenConvolutionFwdAlgoImplicitGEMM:ConvHipImplicitGemmV4R4Fwd,4.62865,0,miopenConvolutionFwdAlgoImplicitGEMM,1024x14x14x1x1x2048x14x14x32xNCHWxFP32x0x0x1x1x1x1x1x1;miopenConvolutionFwdAlgoDirect:ConvAsm1x1U,7.37989,0,miopenConvolutionFwdAlgoDirect,<unused>;miopenConvolutionFwdAlgoGEMM:GemmFwd1x1_0_1,7.83663,0,MIOpenGEMM,0_0_196_1024_196_196_2048_1024;miopenConvolutionFwdAlgoWinograd:ConvBinWinogradRxSf3x2,7.99473,0,miopenConvolutionFwdAlgoWinograd,<unused>
1024-7-7-1x1-2048-7-7-32-0x0-1x1-1x1-0-NCHW-FP32-B=miopenConvolutionBwdDataAlgoDirect:ConvAsm1x1U,1.54246,0,miopenConvolutionBwdDataAlgoDirect,<unused>;miopenConvolutionBwdDataAlgoImplicitGEMM:ConvHipImplicitGemmBwdDataV1R1,2.69002,0,miopenConvolutionBwdDataAlgoImplicitGEMM,1024x7x7x1x1x2048x7x7x32xNCHWxFP32x0x0x1x1x1x1x1x0;miopenConvolutionBwdDataAlgoWinograd:ConvBinWinogradRxSf3x2,3.85464,0,miopenConvolutionBwdDataAlgoWinograd,<unused>;miopenConvolutionBwdDataAlgoGEMM:GemmBwd1x1_stride1,4.93161,0,MIOpenGEMM,0_1_49_2048_49_49_2048_1024
256-56-56-3x3-256-56-56-32-1x1-1x1-1x1-0-NCHW-FP32-F_g64=miopenConvolutionFwdAlgoDirect:ConvAsm3x3U,0.80706,0,miopenConvolutionFwdAlgoDirect,<unused>;miopenConvolutionFwdAlgoWinograd:ConvBinWinogradRxSf2x3,6.01527,0,miopenConvolutionFwdAlgoWinograd,<unused>;miopenConvolutionFwdAlgoGEMM:GemmFwdRest,125.812,28901376,MIOpenGEMM,0_0_3136_36_3136_3136_4_36
1024-7-7-1x1-2048-7-7-32-0x0-1x1-1x1-0-NCHW-FP32-F=miopenConvolutionFwdAlgoDirect:ConvAsm1x1U,1.9826,0,miopenConvolutionFwdAlgoDirect,<unused>;miopenConvolutionFwdAlgoImplicitGEMM:ConvHipImplicitGemmV4R1Fwd,2.34472,0,miopenConvolutionFwdAlgoImplicitGEMM,1024x7x7x1x1x2048x7x7x32xNCHWxFP32x0x0x1x1x1x1x1x1;miopenConvolutionFwdAlgoWinograd:ConvBinWinogradRxSf3x2,3.6176,0,miopenConvolutionFwdAlgoWinograd,<unused>;miopenConvolutionFwdAlgoGEMM:GemmFwd1x1_0_1,5.99129,0,MIOpenGEMM,0_0_49_1024_49_49_2048_1024
128-56-56-1x1-64-56-56-32-0x0-1x1-1x1-0-NCHW-FP32-B=miopenConvolutionBwdDataAlgoDirect:ConvAsm1x1U,0.348767,0,miopenConvolutionBwdDataAlgoDirect,<unused>;miopenConvolutionBwdDataAlgoWinograd:ConvBinWinogradRxSf3x2,0.732035,0,miopenConvolutionBwdDataAlgoWinograd,<unused>;miopenConvolutionBwdDataAlgoGEMM:GemmBwd1x1_stride1,1.11816,0,MIOpenGEMM,0_1_3136_64_3136_3136_64_128
512-28-28-1x1-256-56-56-32-0x0-2x2-1x1-0-NCHW-FP32-W=miopenConvolutionBwdWeightsAlgoDirect:ConvAsmBwdWrW1x1,1.45513,25690112,miopenConvolutionBwdWeightsAlgoDirect,<unused>;miopenConvolutionBwdWeightsAlgoImplicitGEMM:ConvHipImplicitGemmV4R1WrW,5.20396,0,miopenConvolutionBwdWeightsAlgoImplicitGEMM,512x28x28x1x1x256x56x56x32xNCHWxFP32x0x0x2x2x1x1x1x0;miopenConvolutionBwdWeightsAlgoGEMM:GemmWrwUniversal,7.12769,802816,MIOpenGEMM,1_0_784_784_256_256_512_784
128-56-56-1x1-256-56-56-32-0x0-1x1-1x1-0-NCHW-FP32-B=miopenConvolutionBwdDataAlgoDirect:ConvAsm1x1U,1.06425,0,miopenConvolutionBwdDataAlgoDirect,<unused>;miopenConvolutionBwdDataAlgoGEMM:GemmBwd1x1_stride1,2.13459,0,MIOpenGEMM,0_1_3136_256_3136_3136_256_128;miopenConvolutionBwdDataAlgoWinograd:ConvBinWinogradRxSf3x2,2.56348,0,miopenConvolutionBwdDataAlgoWinograd,<unused>
2048-7-7-3x3-2048-7-7-32-1x1-1x1-1x1-0-NCHW-FP32-B_g32=miopenConvolutionBwdDataAlgoWinograd:ConvBinWinogradRxSf2x3,0.444441,0,miopenConvolutionBwdDataAlgoWinograd,<unused>;miopenConvolutionBwdDataAlgoDirect:ConvOclDirectFwd,2.52883,0,miopenConvolutionBwdDataAlgoDirect,<unused>;miopenConvolutionBwdDataAlgoGEMM:GemmBwdRest,15.4984,3612672,MIOpenGEMM,0_1_49_576_49_49_576_64
1024-7-7-3x3-1024-14-14-32-1x1-2x2-1x1-0-NCHW-FP32-W_g32=miopenConvolutionBwdWeightsAlgoDirect:ConvAsmBwdWrW3x3,0.282516,0,miopenConvolutionBwdWeightsAlgoDirect,<unused>;miopenConvolutionBwdWeightsAlgoGEMM:GemmWrwUniversal,18.8024,1806336,MIOpenGEMM,1_0_49_49_288_288_32_49
512-28-28-1x1-256-28-28-32-0x0-1x1-1x1-0-NCHW-FP32-F=miopenConvolutionFwdAlgoImplicitGEMM:ConvHipImplicitGemmV4R4Fwd,1.23327,0,miopenConvolutionFwdAlgoImplicitGEMM,512x28x28x1x1x256x28x28x32xNCHWxFP32x0x0x1x1x1x1x1x1;miopenConvolutionFwdAlgoDirect:ConvAsm1x1U,1.46148,0,miopenConvolutionFwdAlgoDirect,<unused>;miopenConvolutionFwdAlgoWinograd:ConvBinWinogradRxSf3x2,2.58302,0,miopenConvolutionFwdAlgoWinograd,<unused>;miopenConvolutionFwdAlgoGEMM:GemmFwd1x1_0_1,2.76796,0,MIOpenGEMM,0_0_784_512_784_784_256_512
2048-7-7-3x3-2048-14-14-32-1x1-2x2-1x1-0-NCHW-FP32-W_g64=miopenConvolutionBwdWeightsAlgoDirect:ConvAsmBwdWrW3x3,0.513977,0,miopenConvolutionBwdWeightsAlgoDirect,<unused>;miopenConvolutionBwdWeightsAlgoGEMM:GemmWrwUniversal,45.2961,3612672,MIOpenGEMM,1_0_49_49_288_288_32_49
2048-7-7-1x1-1024-7-7-32-0x0-1x1-1x1-0-NCHW-FP32-F=miopenConvolutionFwdAlgoDirect:ConvAsm1x1U,1.78148,0,miopenConvolutionFwdAlgoDirect,<unused>;miopenConvolutionFwdAlgoImplicitGEMM:ConvHipImplicitGemmV4R1Fwd,3.67506,0,miopenConvolutionFwdAlgoImplicitGEMM,2048x7x7x1x1x1024x7x7x32xNCHWxFP32x0x0x1x1x1x1x1x1;miopenConvolutionFwdAlgoWinograd:ConvBinWinogradRxSf3x2,3.69716,0,miopenConvolutionFwdAlgoWinograd,<unused>;miopenConvolutionFwdAlgoGEMM:GemmFwd1x1_0_1,5.30892,0,MIOpenGEMM,0_0_49_2048_49_49_1024_2048
1024-14-14-3x3-1024-14-14-32-1x1-1x1-1x1-0-NCHW-FP32-W_g64=miopenConvolutionBwdWeightsAlgoDirect:ConvAsmBwdWrW3x3,0.475204,0,miopenConvolutionBwdWeightsAlgoDirect,<unused>;miopenConvolutionBwdWeightsAlgoWinograd:ConvBinWinogradRxSf2x3,1.15924,0,miopenConvolutionBwdWeightsAlgoWinograd,1024x14x14x3x3x1024x14x14x32xNCHWxFP32x1x1x1x1x1x1x64x0;miopenConvolutionBwdWeightsAlgoGEMM:GemmWrwUniversal,37.2288,7225344,MIOpenGEMM,1_0_196_196_144_144_16_196
1024-7-7-3x3-1024-14-14-32-1x1-2x2-1x1-0-NCHW-FP32-B_g32=miopenConvolutionBwdDataAlgoDirect:ConvOclDirectFwd,0.567367,0,miopenConvolutionBwdDataAlgoDirect,<unused>;miopenConvolutionBwdDataAlgoWinograd:ConvBinWinogradRxSf2x3,1.20144,0,miopenConvolutionBwdDataAlgoWinograd,<unused>;miopenConvolutionBwdDataAlgoGEMM:GemmBwdRest,10.6362,1806336,MIOpenGEMM,0_1_49_288_49_49_288_32
512-28-28-1x1-512-28-28-32-0x0-1x1-1x1-0-NCHW-FP32-W=miopenConvolutionBwdWeightsAlgoDirect:ConvAsmBwdWrW1x1,2.24532,0,miopenConvolutionBwdWeightsAlgoDirect,<unused>;miopenConvolutionBwdWeightsAlgoWinograd:ConvBinWinogradRxSf2x3,8.88142,0,miopenConvolutionBwdWeightsAlgoWinograd,512x28x28x1x1x512x28x28x32xNCHWxFP32x0x0x1x1x1x1x1x0
1024-7-7-3x3-1024-7-7-32-1x1-1x1-1x1-0-NCHW-FP32-W_g32=miopenConvolutionBwdWeightsAlgoDirect:ConvAsmBwdWrW3x3,0.203552,0,miopenConvolutionBwdWeightsAlgoDirect,<unused>;miopenConvolutionBwdWeightsAlgoWinograd:ConvBinWinogradRxSf2x3,0.420959,0,miopenConvolutionBwdWeightsAlgoWinograd,1024x7x7x3x3x1024x7x7x32xNCHWxFP32x1x1x1x1x1x1x32x0;miopenConvolutionBwdWeightsAlgoGEMM:GemmWrwUniversal,15.555,1806336,MIOpenGEMM,1_0_49_49_288_288_32_49
512-28-28-1x1-256-56-56-32-0x0-2x2-1x1-0-NCHW-FP32-B=miopenConvolutionBwdDataAlgoDirect:ConvAsm1x1UV2,1.29049,0,miopenConvolutionBwdDataAlgoDirect,<unused>;miopenConvolutionBwdDataAlgoImplicitGEMM:ConvHipImplicitGemmBwdDataV4R1,1.63806,0,miopenConvolutionBwdDataAlgoImplicitGEMM,512x28x28x1x1x256x56x56x32xNCHWxFP32x0x0x2x2x1x1x1x0;miopenConvolutionBwdDataAlgoGEMM:GemmBwd1x1_stride2,1.90026,77070336,MIOpenGEMM,0_1_25088_256_25088_25088_256_512;miopenConvolutionBwdDataAlgoWinograd:ConvBinWinogradRxSf2x3,9.9938,0,miopenConvolutionBwdDataAlgoWinograd,<unused>
64-56-56-1x1-128-56-56-32-0x0-1x1-1x1-0-NCHW-FP32-F=miopenConvolutionFwdAlgoDirect:ConvAsm1x1U,0.347249,0,miopenConvolutionFwdAlgoDirect,<unused>;miopenConvolutionFwdAlgoWinograd:ConvBinWinogradRxSf3x2,0.772013,0,miopenConvolutionFwdAlgoWinograd,<unused>;miopenConvolutionFwdAlgoGEMM:GemmFwd1x1_0_1,0.779791,0,MIOpenGEMM,0_0_3136_64_3136_3136_128_64
1024-14-14-1x1-512-28-28-32-0x0-2x2-1x1-0-NCHW-FP32-W=miopenConvolutionBwdWeightsAlgoDirect:ConvAsmBwdWrW1x1,1.31766,12845056,miopenConvolutionBwdWeightsAlgoDirect,<unused>;miopenConvolutionBwdWeightsAlgoImplicitGEMM:ConvHipImplicitGemmV4R1WrW,1.70435,0,miopenConvolutionBwdWeightsAlgoImplicitGEMM,1024x14x14x1x1x512x28x28x32xNCHWxFP32x0x0x2x2x1x1x1x0;miopenConvolutionBwdWeightsAlgoGEMM:GemmWrwUniversal,3.75033,401408,MIOpenGEMM,1_0_196_196_512_512_1024_196
1024-14-14-3x3-1024-14-14-32-1x1-1x1-1x1-0-NCHW-FP32-B_g64=miopenConvolutionBwdDataAlgoWinograd:ConvBinWinogradRxSf2x3,0.508557,0,miopenConvolutionBwdDataAlgoWinograd,<unused>;miopenConvolutionBwdDataAlgoDirect:ConvOclDirectFwd,0.821361,0,miopenConvolutionBwdDataAlgoDirect,<unused>;miopenConvolutionBwdDataAlgoGEMM:GemmBwdRest,18.385,7225344,MIOpenGEMM,0_1_196_144_196_196_144_16
256-56-56-1x1-128-56-56-32-0x0-1x1-1x1-0-NCHW-FP32-F=miopenConvolutionFwdAlgoImplicitGEMM:ConvHipImplicitGemmV4R4Fwd,1.14568,0,miopenConvolutionFwdAlgoImplicitGEMM,256x56x56x1x1x128x56x56x32xNCHWxFP32x0x0x1x1x1x1x1x1;miopenConvolutionFwdAlgoDirect:ConvAsm1x1U,1.24201,0,miopenConvolutionFwdAlgoDirect,<unused>;miopenConvolutionFwdAlgoGEMM:GemmFwd1x1_0_1,2.24948,0,MIOpenGEMM,0_0_3136_256_3136_3136_128_256;miopenConvolutionFwdAlgoWinograd:ConvBinWinogradRxSf3x2,2.39124,0,miopenConvolutionFwdAlgoWinograd,<unused>
1024-28-28-3x3-1024-14-14-32-1x1-2x2-1x1-0-NCHW-FP32-F_g32=miopenConvolutionFwdAlgoImplicitGEMM:ConvHipImplicitGemmV4R1Fwd,0.916395,0,miopenConvolutionFwdAlgoImplicitGEMM,1024x28x28x3x3x1024x14x14x32xNCHWxFP32x1x1x2x2x1x1x32x1;miopenConvolutionFwdAlgoWinograd:ConvBinWinogradRxSf2x3,1.40299,0,miopenConvolutionFwdAlgoWinograd,<unused>;miopenConvolutionFwdAlgoDirect:ConvOclDirectFwd,3.41458,0,miopenConvolutionFwdAlgoDirect,<unused>;miopenConvolutionFwdAlgoGEMM:GemmFwdRest,18.6484,7225344,MIOpenGEMM,0_0_196_288_196_196_32_288
1024-14-14-3x3-1024-7-7-32-1x1-2x2-1x1-0-NCHW-FP32-F_g32=miopenConvolutionFwdAlgoWinograd:ConvBinWinogradRxSf2x3,0.484763,0,miopenConvolutionFwdAlgoWinograd,<unused>;miopenConvolutionFwdAlgoImplicitGEMM:ConvHipImplicitGemmV4R1Fwd,0.607811,0,miopenConvolutionFwdAlgoImplicitGEMM,1024x14x14x3x3x1024x7x7x32xNCHWxFP32x1x1x2x2x1x1x32x1;miopenConvolutionFwdAlgoDirect:ConvOclDirectFwd,1.064,0,miopenConvolutionFwdAlgoDirect,<unused>;miopenConvolutionFwdAlgoGEMM:GemmFwdRest,36.4102,1806336,MIOpenGEMM,0_0_49_288_49_49_32_288
1024-14-14-1x1-1024-14-14-32-0x0-1x1-1x1-0-NCHW-FP32-W=miopenConvolutionBwdWeightsAlgoDirect:ConvAsmBwdWrW1x1,2.4697,0,miopenConvolutionBwdWeightsAlgoDirect,<unused>;miopenConvolutionBwdWeightsAlgoGEMM:GemmWrw1x1_stride1,3.75575,0,MIOpenGEMM,1_0_196_196_1024_1024_1024_196;miopenConvolutionBwdWeightsAlgoWinograd:ConvBinWinogradRxS,10.8533,0,miopenConvolutionBwdWeightsAlgoWinograd,1024x14x14x1x1x1024x14x14x32xNCHWxFP32x0x0x1x1x1x1x1x0
512-56-56-1x1-256-56-56-32-0x0-1x1-1x1-0-NCHW-FP32-W=miopenConvolutionBwdWeightsAlgoGEMM:GemmWrw1x1_stride1,4.29889,0,MIOpenGEMM,1_0_3136_3136_256_256_512_3136;miopenConvolutionBwdWeightsAlgoWinograd:ConvBinWinogradRxS,23.4459,0,miopenConvolutionBwdWeightsAlgoWinograd,512x56x56x1x1x256x56x56x32xNCHWxFP32x0x0x1x1x1x1x1x0
2048-7-7-3x3-2048-14-14-32-1x1-2x2-1x1-0-NCHW-FP32-B_g64=miopenConvolutionBwdDataAlgoDirect:ConvOclDirectFwd,1.78876,0,miopenConvolutionBwdDataAlgoDirect,<unused>;miopenConvolutionBwdDataAlgoWinograd:ConvBinWinogradRxSf2x3,3.10396,0,miopenConvolutionBwdDataAlgoWinograd,<unused>;miopenConvolutionBwdDataAlgoGEMM:GemmBwdRest,34.4383,3612672,MIOpenGEMM,0_1_49_288_49_49_288_32
1024-7-7-3x3-1024-7-7-32-1x1-1x1-1x1-0-NCHW-FP32-B_g32=miopenConvolutionBwdDataAlgoWinograd:ConvBinWinogradRxSf2x3,0.53595,0,miopenConvolutionBwdDataAlgoWinograd,<unused>;miopenConvolutionBwdDataAlgoDirect:ConvOclDirectFwd,0.641411,0,miopenConvolutionBwdDataAlgoDirect,<unused>;miopenConvolutionBwdDataAlgoGEMM:GemmBwdRest,9.4792,1806336,MIOpenGEMM,0_1_49_288_49_49_288_32
2048-7-7-3x3-2048-7-7-32-1x1-1x1-1x1-0-NCHW-FP32-F_g32=miopenConvolutionFwdAlgoWinograd:ConvBinWinogradRxSf2x3,0.445415,0,miopenConvolutionFwdAlgoWinograd,<unused>;miopenConvolutionFwdAlgoImplicitGEMM:ConvHipImplicitGemmV4R1Fwd,0.922809,0,miopenConvolutionFwdAlgoImplicitGEMM,2048x7x7x3x3x2048x7x7x32xNCHWxFP32x1x1x1x1x1x1x32x1;miopenConvolutionFwdAlgoDirect:ConvOclDirectFwd,2.23083,0,miopenConvolutionFwdAlgoDirect,<unused>;miopenConvolutionFwdAlgoGEMM:GemmFwdRest,25.2471,3612672,MIOpenGEMM,0_0_49_576_49_49_64_576
256-56-56-1x1-128-56-56-32-0x0-1x1-1x1-0-NCHW-FP32-W=miopenConvolutionBwdWeightsAlgoDirect:ConvAsmBwdWrW1x1,1.49041,0,miopenConvolutionBwdWeightsAlgoDirect,<unused>
512-28-28-1x1-512-28-28-32-0x0-1x1-1x1-0-NCHW-FP32-B=miopenConvolutionBwdDataAlgoDirect:ConvAsm1x1U,2.02488,0,miopenConvolutionBwdDataAlgoDirect,<unused>;miopenConvolutionBwdDataAlgoImplicitGEMM:ConvHipImplicitGemmBwdDataV1R1,2.30316,0,miopenConvolutionBwdDataAlgoImplicitGEMM,512x28x28x1x1x512x28x28x32xNCHWxFP32x0x0x1x1x1x1x1x0;miopenConvolutionBwdDataAlgoGEMM:GemmBwd1x1_stride1,3.03952,0,MIOpenGEMM,0_1_784_512_784_784_512_512;miopenConvolutionBwdDataAlgoWinograd:ConvBinWinogradRxSf3x2,4.46976,0,miopenConvolutionBwdDataAlgoWinograd,<unused>
256-56-56-1x1-512-28-28-32-0x0-2x2-1x1-0-NCHW-FP32-F=miopenConvolutionFwdAlgoImplicitGEMM:ConvHipImplicitGemmV4R4Fwd,1.26763,0,miopenConvolutionFwdAlgoImplicitGEMM,256x56x56x1x1x512x28x28x32xNCHWxFP32x0x0x2x2x1x1x1x1;miopenConvolutionFwdAlgoDirect:ConvAsm1x1U,1.57832,25690112,miopenConvolutionFwdAlgoDirect,<unused>;miopenConvolutionFwdAlgoGEMM:GemmFwd1x1_0_2,1.59991,77070336,MIOpenGEMM,0_0_25088_256_25088_25088_512_256;miopenConvolutionFwdAlgoWinograd:ConvBinWinogradRxS,8.52506,0,miopenConvolutionFwdAlgoWinograd,<unused>
1024-14-14-1x1-512-28-28-32-0x0-2x2-1x1-0-NCHW-FP32-B=miopenConvolutionBwdDataAlgoDirect:ConvAsm1x1UV2,1.40237,0,miopenConvolutionBwdDataAlgoDirect,<unused>;miopenConvolutionBwdDataAlgoGEMM:GemmBwd1x1_stride2,1.71802,38535168,MIOpenGEMM,0_1_6272_512_6272_6272_512_1024;miopenConvolutionBwdDataAlgoWinograd:ConvBinWinogradRxSf2x3,10.4348,0,miopenConvolutionBwdDataAlgoWinograd,<unused>
512-14-14-3x3-512-28-28-32-1x1-2x2-1x1-0-NCHW-FP32-W_g32=miopenConvolutionBwdWeightsAlgoDirect:ConvAsmBwdWrW3x3,0.38029,0,miopenConvolutionBwdWeightsAlgoDirect,<unused>;miopenConvolutionBwdWeightsAlgoGEMM:GemmWrwUniversal,18.6821,3612672,MIOpenGEMM,1_0_196_196_144_144_16_196
512-28-28-1x1-256-28-28-32-0x0-1x1-1x1-0-NCHW-FP32-W=miopenConvolutionBwdWeightsAlgoDirect:ConvAsmBwdWrW1x1,1.19027,0,miopenConvolutionBwdWeightsAlgoDirect,<unused>;miopenConvolutionBwdWeightsAlgoWinograd:ConvBinWinogradRxSf2x3,5.70098,0,miopenConvolutionBwdWeightsAlgoWinograd,512x28x28x1x1x256x28x28x32xNCHWxFP32x0x0x1x1x1x1x1x0;miopenConvolutionBwdWeightsAlgoGEMM:GemmWrw1x1_stride1,5.80879,0,MIOpenGEMM,1_0_784_784_256_256_512_784
1024-14-14-1x1-1024-14-14-32-0x0-1x1-1x1-0-NCHW-FP32-B=miopenConvolutionBwdDataAlgoDirect:ConvAsm1x1U,2.36168,0,miopenConvolutionBwdDataAlgoDirect,<unused>;miopenConvolutionBwdDataAlgoImplicitGEMM:ConvHipImplicitGemmBwdDataV4R1,2.44341,0,miopenConvolutionBwdDataAlgoImplicitGEMM,1024x14x14x1x1x1024x14x14x32xNCHWxFP32x0x0x1x1x1x1x1x0;miopenConvolutionBwdDataAlgoGEMM:GemmBwd1x1_stride1,4.14348,0,MIOpenGEMM,0_1_196_1024_196_196_1024_1024;miopenConvolutionBwdDataAlgoWinograd:ConvBinWinogradRxSf3x2,4.32478,0,miopenConvolutionBwdDataAlgoWinograd,<unused>
1024-14-14-3x3-1024-14-14-32-1x1-1x1-1x1-0-NCHW-FP32-F_g64=miopenConvolutionFwdAlgoWinograd:ConvBinWinogradRxSf2x3,0.5463,0,miopenConvolutionFwdAlgoWinograd,<unused>;miopenConvolutionFwdAlgoImplicitGEMM:ConvHipImplicitGemmV4R1Fwd,0.673864,0,miopenConvolutionFwdAlgoImplicitGEMM,1024x14x14x3x3x1024x14x14x32xNCHWxFP32x1x1x1x1x1x1x64x1;miopenConvolutionFwdAlgoDirect:ConvOclDirectFwd,0.999121,0,miopenConvolutionFwdAlgoDirect,<unused>;miopenConvolutionFwdAlgoGEMM:GemmFwdRest,45.7856,7225344,MIOpenGEMM,0_0_196_144_196_196_16_144
1024-7-7-3x3-1024-7-7-32-1x1-1x1-1x1-0-NCHW-FP32-F_g32=miopenConvolutionFwdAlgoWinograd:ConvBinWinogradRxSf2x3,0.165509,0,miopenConvolutionFwdAlgoWinograd,<unused>;miopenConvolutionFwdAlgoImplicitGEMM:ConvHipImplicitGemmV4R1Fwd,0.330967,0,miopenConvolutionFwdAlgoImplicitGEMM,1024x7x7x3x3x1024x7x7x32xNCHWxFP32x1x1x1x1x1x1x32x1;miopenConvolutionFwdAlgoDirect:ConvOclDirectFwd,0.602599,0,miopenConvolutionFwdAlgoDirect,<unused>;miopenConvolutionFwdAlgoGEMM:GemmFwdRest,21.0169,1806336,MIOpenGEMM,0_0_49_288_49_49_32_288
512-56-56-1x1-256-56-56-32-0x0-1x1-1x1-0-NCHW-FP32-B=miopenConvolutionBwdDataAlgoDirect:ConvAsm1x1U,3.92405,0,miopenConvolutionBwdDataAlgoDirect,<unused>;miopenConvolutionBwdDataAlgoImplicitGEMM:ConvHipImplicitGemmBwdDataV4R1,4.37825,0,miopenConvolutionBwdDataAlgoImplicitGEMM,512x56x56x1x1x256x56x56x32xNCHWxFP32x0x0x1x1x1x1x1x0;miopenConvolutionBwdDataAlgoWinograd:ConvBinWinogradRxSf3x2,6.10479,0,miopenConvolutionBwdDataAlgoWinograd,<unused>;miopenConvolutionBwdDataAlgoGEMM:GemmBwd1x1_stride1,6.93978,0,MIOpenGEMM,0_1_3136_256_3136_3136_256_512
2048-14-14-3x3-2048-7-7-32-1x1-2x2-1x1-0-NCHW-FP32-F_g64=miopenConvolutionFwdAlgoImplicitGEMM:ConvHipImplicitGemmV4R1Fwd,1.13505,0,miopenConvolutionFwdAlgoImplicitGEMM,2048x14x14x3x3x2048x7x7x32xNCHWxFP32x1x1x2x2x1x1x64x1;miopenConvolutionFwdAlgoDirect:ConvOclDirectFwd,3.12202,0,miopenConvolutionFwdAlgoDirect,<unused>;miopenConvolutionFwdAlgoWinograd:ConvBinWinogradRxSf2x3,3.30586,0,miopenConvolutionFwdAlgoWinograd,<unused>;miopenConvolutionFwdAlgoGEMM:GemmFwdRest,113.595,3612672,MIOpenGEMM,0_0_49_288_49_49_32_288
512-14-14-3x3-512-28-28-32-1x1-2x2-1x1-0-NCHW-FP32-B_g32=miopenConvolutionBwdDataAlgoDirect:ConvOclDirectFwd,3.42821,0,miopenConvolutionBwdDataAlgoDirect,<unused>;miopenConvolutionBwdDataAlgoWinograd:ConvBinWinogradRxSf2x3,8.2568,0,miopenConvolutionBwdDataAlgoWinograd,<unused>;miopenConvolutionBwdDataAlgoGEMM:GemmBwdRest,49.8708,3612672,MIOpenGEMM,0_1_196_144_196_196_144_16
2048-7-7-1x1-2048-7-7-32-0x0-1x1-1x1-0-NCHW-FP32-W=miopenConvolutionBwdWeightsAlgoDirect:ConvAsmBwdWrW1x1,3.58537,0,miopenConvolutionBwdWeightsAlgoDirect,<unused>;miopenConvolutionBwdWeightsAlgoGEMM:GemmWrw1x1_stride1,3.75966,0,MIOpenGEMM,1_0_49_49_2048_2048_2048_49;miopenConvolutionBwdWeightsAlgoWinograd:ConvBinWinogradRxSf2x3,10.8303,0,miopenConvolutionBwdWeightsAlgoWinograd,2048x7x7x1x1x2048x7x7x32xNCHWxFP32x0x0x1x1x1x1x1x0
256-56-56-1x1-128-56-56-32-0x0-1x1-1x1-0-NCHW-FP32-B=miopenConvolutionBwdDataAlgoDirect:ConvAsm1x1U,1.0908,0,miopenConvolutionBwdDataAlgoDirect,<unused>;miopenConvolutionBwdDataAlgoWinograd:ConvBinWinogradRxSf3x2,2.37422,0,miopenConvolutionBwdDataAlgoWinograd,<unused>;miopenConvolutionBwdDataAlgoGEMM:GemmBwd1x1_stride1,2.93756,0,MIOpenGEMM,0_1_3136_128_3136_3136_128_256
512-28-28-1x1-1024-14-14-32-0x0-2x2-1x1-0-NCHW-FP32-F=miopenConvolutionFwdAlgoGEMM:GemmFwd1x1_0_2,1.2014,38535168,MIOpenGEMM,0_0_6272_512_6272_6272_1024_512;miopenConvolutionFwdAlgoImplicitGEMM:ConvHipImplicitGemmV4R4Fwd,1.37799,0,miopenConvolutionFwdAlgoImplicitGEMM,512x28x28x1x1x1024x14x14x32xNCHWxFP32x0x0x2x2x1x1x1x1;miopenConvolutionFwdAlgoDirect:ConvAsm1x1U,1.84278,12845056,miopenConvolutionFwdAlgoDirect,<unused>;miopenConvolutionFwdAlgoWinograd:ConvBinWinogradRxS,7.46894,0,miopenConvolutionFwdAlgoWinograd,<unused>
256-28-28-3x3-256-56-56-32-1x1-2x2-1x1-0-NCHW-FP32-W_g32=miopenConvolutionBwdWeightsAlgoDirect:ConvAsmBwdWrW3x3,0.425836,0,miopenConvolutionBwdWeightsAlgoDirect,<unused>;miopenConvolutionBwdWeightsAlgoGEMM:GemmWrwUniversal,26.6016,7225344,MIOpenGEMM,1_0_784_784_72_72_8_784
512-28-28-1x1-256-28-28-32-0x0-1x1-1x1-0-NCHW-FP32-B=miopenConvolutionBwdDataAlgoDirect:ConvAsm1x1U,1.17024,0,miopenConvolutionBwdDataAlgoDirect,<unused>;miopenConvolutionBwdDataAlgoWinograd:ConvBinWinogradRxSf3x2,2.59366,0,miopenConvolutionBwdDataAlgoWinograd,<unused>;miopenConvolutionBwdDataAlgoGEMM:GemmBwd1x1_stride1,5.35258,0,MIOpenGEMM,0_1_784_256_784_784_256_512
1024-14-14-1x1-1024-14-14-32-0x0-1x1-1x1-0-NCHW-FP32-F=miopenConvolutionFwdAlgoDirect:ConvAsm1x1U,4.24576,0,miopenConvolutionFwdAlgoDirect,<unused>;miopenConvolutionFwdAlgoGEMM:GemmFwd1x1_0_1,4.88455,0,MIOpenGEMM,0_0_196_1024_196_196_1024_1024;miopenConvolutionFwdAlgoWinograd:ConvBinWinogradRxSf3x2,5.07528,0,miopenConvolutionFwdAlgoWinograd,<unused>
512-14-14-1x1-1024-14-14-32-0x0-1x1-1x1-0-NCHW-FP32-W=miopenConvolutionBwdWeightsAlgoDirect:ConvAsmBwdWrW1x1,1.26017,0,miopenConvolutionBwdWeightsAlgoDirect,<unused>;miopenConvolutionBwdWeightsAlgoGEMM:GemmWrw1x1_stride1,3.30386,0,MIOpenGEMM,1_0_196_196_1024_1024_512_196;miopenConvolutionBwdWeightsAlgoWinograd:ConvBinWinogradRxSf2x3,4.46632,0,miopenConvolutionBwdWeightsAlgoWinograd,512x14x14x1x1x1024x14x14x32xNCHWxFP32x0x0x1x1x1x1x1x0
512-28-28-3x3-512-14-14-32-1x1-2x2-1x1-0-NCHW-FP32-F_g32=miopenConvolutionFwdAlgoImplicitGEMM:ConvHipImplicitGemmV4R1Fwd,0.460062,0,miopenConvolutionFwdAlgoImplicitGEMM,512x28x28x3x3x512x14x14x32xNCHWxFP32x1x1x2x2x1x1x32x1;miopenConvolutionFwdAlgoWinograd:ConvBinWinogradRxSf2x3,0.911864,0,miopenConvolutionFwdAlgoWinograd,<unused>;miopenConvolutionFwdAlgoDirect:ConvOclDirectFwd,0.912534,0,miopenConvolutionFwdAlgoDirect,<unused>;miopenConvolutionFwdAlgoGEMM:GemmFwdRest,28.092,3612672,MIOpenGEMM,0_0_196_144_196_196_16_144
256-28-28-3x3-256-56-56-32-1x1-2x2-1x1-0-NCHW-FP32-B_g32=miopenConvolutionBwdDataAlgoDirect:ConvOclDirectFwd,1.39933,0,miopenConvolutionBwdDataAlgoDirect,<unused>;miopenConvolutionBwdDataAlgoWinograd:ConvBinWinogradRxSf2x3,1.81528,0,miopenConvolutionBwdDataAlgoWinograd,<unused>;miopenConvolutionBwdDataAlgoGEMM:GemmBwdRest,13.733,7225344,MIOpenGEMM,0_1_784_72_784_784_72_8
256-56-56-1x1-512-56-56-32-0x0-1x1-1x1-0-NCHW-FP32-F=miopenConvolutionFwdAlgoGEMM:GemmFwd1x1_0_1,4.11823,0,MIOpenGEMM,0_0_3136_256_3136_3136_512_256;miopenConvolutionFwdAlgoDirect:ConvAsm1x1U,4.84924,0,miopenConvolutionFwdAlgoDirect,<unused>;miopenConvolutionFwdAlgoWinograd:ConvBinWinogradRxSf3x2,8.83844,0,miopenConvolutionFwdAlgoWinograd,<unused>
2048-7-7-1x1-2048-7-7-32-0x0-1x1-1x1-0-NCHW-FP32-B=miopenConvolutionBwdDataAlgoDirect:ConvAsm1x1U,2.5953,0,miopenConvolutionBwdDataAlgoDirect,<unused>;miopenConvolutionBwdDataAlgoImplicitGEMM:ConvHipImplicitGemmBwdDataV1R1,2.99802,0,miopenConvolutionBwdDataAlgoImplicitGEMM,2048x7x7x1x1x2048x7x7x32xNCHWxFP32x0x0x1x1x1x1x1x0;miopenConvolutionBwdDataAlgoWinograd:ConvBinWinogradRxSf3x2,5.36179,0,miopenConvolutionBwdDataAlgoWinograd,<unused>;miopenConvolutionBwdDataAlgoGEMM:GemmBwd1x1_stride1,5.67967,0,MIOpenGEMM,0_1_49_2048_49_49_2048_2048
1024-14-14-3x3-1024-28-28-32-1x1-2x2-1x1-0-NCHW-FP32-W_g64=miopenConvolutionBwdWeightsAlgoDirect:ConvAsmBwdWrW3x3,0.629797,0,miopenConvolutionBwdWeightsAlgoDirect,<unused>;miopenConvolutionBwdWeightsAlgoGEMM:GemmWrwUniversal,50.2094,7225344,MIOpenGEMM,1_0_196_196_144_144_16_196
128-56-56-1x1-256-56-56-32-0x0-1x1-1x1-0-NCHW-FP32-F=miopenConvolutionFwdAlgoDirect:ConvAsm1x1U,1.31672,0,miopenConvolutionFwdAlgoDirect,<unused>;miopenConvolutionFwdAlgoGEMM:GemmFwd1x1_0_1,2.21803,0,MIOpenGEMM,0_0_3136_128_3136_3136_256_128;miopenConvolutionFwdAlgoWinograd:ConvBinWinogradRxSf3x2,2.48222,0,miopenConvolutionFwdAlgoWinograd,<unused>
256-28-28-1x1-512-28-28-32-0x0-1x1-1x1-0-NCHW-FP32-F=miopenConvolutionFwdAlgoDirect:ConvAsm1x1U,1.28435,0,miopenConvolutionFwdAlgoDirect,<unused>;miopenConvolutionFwdAlgoGEMM:GemmFwd1x1_0_1,2.53878,0,MIOpenGEMM,0_0_784_256_784_784_512_256;miopenConvolutionFwdAlgoWinograd:ConvBinWinogradRxSf3x2,2.57923,0,miopenConvolutionFwdAlgoWinograd,<unused>
1024-14-14-3x3-1024-28-28-32-1x1-2x2-1x1-0-NCHW-FP32-B_g64=miopenConvolutionBwdDataAlgoDirect:ConvOclDirectFwd,1.34532,0,miopenConvolutionBwdDataAlgoDirect,<unused>;miopenConvolutionBwdDataAlgoWinograd:ConvBinWinogradRxSf2x3,2.4887,0,miopenConvolutionBwdDataAlgoWinograd,<unused>;miopenConvolutionBwdDataAlgoGEMM:GemmBwdRest,44.2141,7225344,MIOpenGEMM,0_1_196_144_196_196_144_16
256-56-56-1x1-64-56-56-32-0x0-1x1-1x1-0-NCHW-FP32-W=miopenConvolutionBwdWeightsAlgoDirect:ConvAsmBwdWrW1x1,0.97547,0,miopenConvolutionBwdWeightsAlgoDirect,<unused>
512-14-14-3x3-512-14-14-32-1x1-1x1-1x1-0-NCHW-FP32-W_g32=miopenConvolutionBwdWeightsAlgoDirect:ConvAsmBwdWrW3x3,0.246538,0,miopenConvolutionBwdWeightsAlgoDirect,<unused>;miopenConvolutionBwdWeightsAlgoWinograd:ConvBinWinogradRxSf2x3,0.412288,0,miopenConvolutionBwdWeightsAlgoWinograd,512x14x14x3x3x512x14x14x32xNCHWxFP32x1x1x1x1x1x1x32x0;miopenConvolutionBwdWeightsAlgoGEMM:GemmWrwUniversal,15.9475,3612672,MIOpenGEMM,1_0_196_196_144_144_16_196
256-13-13-3x3-384-13-13-512-1x1-1x1-1x1-0-NCHW-FP32-B=miopenConvolutionBwdDataAlgoWinograd:ConvBinWinogradRxS,9.20707,0,miopenConvolutionBwdDataAlgoWinograd,<unused>
512-14-14-1x1-1024-14-14-32-0x0-1x1-1x1-0-NCHW-FP32-B=miopenConvolutionBwdDataAlgoDirect:ConvAsm1x1U,1.34962,0,miopenConvolutionBwdDataAlgoDirect,<unused>;miopenConvolutionBwdDataAlgoWinograd:ConvBinWinogradRxSf3x2,2.57824,0,miopenConvolutionBwdDataAlgoWinograd,<unused>;miopenConvolutionBwdDataAlgoGEMM:GemmBwd1x1_stride1,4.4143,0,MIOpenGEMM,0_1_196_1024_196_196_1024_512
2048-7-7-3x3-2048-7-7-32-1x1-1x1-1x1-0-NCHW-FP32-W_g64=miopenConvolutionBwdWeightsAlgoDirect:ConvAsmBwdWrW3x3,0.415405,0,miopenConvolutionBwdWeightsAlgoDirect,<unused>;miopenConvolutionBwdWeightsAlgoWinograd:ConvBinWinogradRxSf2x3,3.44333,0,miopenConvolutionBwdWeightsAlgoWinograd,2048x7x7x3x3x2048x7x7x32xNCHWxFP32x1x1x1x1x1x1x64x0;miopenConvolutionBwdWeightsAlgoGEMM:GemmWrwUniversal,122.931,3612672,MIOpenGEMM,1_0_49_49_288_288_32_49
256-56-56-3x3-256-56-56-32-1x1-1x1-1x1-0-NCHW-FP32-W_g32=miopenConvolutionBwdWeightsAlgoDirect:ConvAsmBwdWrW3x3,0.787626,0,miopenConvolutionBwdWeightsAlgoDirect,<unused>;miopenConvolutionBwdWeightsAlgoWinograd:ConvBinWinogradRxSf2x3,24.8326,0,miopenConvolutionBwdWeightsAlgoWinograd,256x56x56x3x3x256x56x56x32xNCHWxFP32x1x1x1x1x1x1x32x0;miopenConvolutionBwdWeightsAlgoGEMM:GemmWrwUniversal,36.8973,28901376,MIOpenGEMM,1_0_3136_3136_72_72_8_3136
1024-28-28-3x3-1024-14-14-32-1x1-2x2-1x1-0-NCHW-FP32-F_g64=miopenConvolutionFwdAlgoImplicitGEMM:ConvHipImplicitGemmV4R1Fwd,1.59886,0,miopenConvolutionFwdAlgoImplicitGEMM,1024x28x28x3x3x1024x14x14x32xNCHWxFP32x1x1x2x2x1x1x64x1;miopenConvolutionFwdAlgoDirect:ConvOclDirectFwd,2.81767,0,miopenConvolutionFwdAlgoDirect,<unused>;miopenConvolutionFwdAlgoWinograd:ConvBinWinogradRxSf2x3,4.37038,0,miopenConvolutionFwdAlgoWinograd,<unused>;miopenConvolutionFwdAlgoGEMM:GemmFwdRest,57.4745,7225344,MIOpenGEMM,0_0_196_144_196_196_16_144
384-13-13-3x3-256-13-13-512-1x1-1x1-1x1-0-NCHW-FP32-F=miopenConvolutionFwdAlgoWinograd:ConvBinWinograd3x3U,10.0145,0,miopenConvolutionFwdAlgoWinograd,<unused>
384-13-13-3x3-384-13-13-512-1x1-1x1-1x1-0-NCHW-FP32-B=miopenConvolutionBwdDataAlgoWinograd:ConvBinWinogradRxSf2x3,17.3258,0,miopenConvolutionBwdDataAlgoWinograd,<unused>
512-14-14-3x3-512-14-14-32-1x1-1x1-1x1-0-NCHW-FP32-B_g32=miopenConvolutionBwdDataAlgoDirect:ConvOclDirectFwd,0.553701,0,miopenConvolutionBwdDataAlgoDirect,<unused>;miopenConvolutionBwdDataAlgoWinograd:ConvBinWinogradRxSf2x3,1.12153,0,miopenConvolutionBwdDataAlgoWinograd,<unused>;miopenConvolutionBwdDataAlgoGEMM:GemmBwdRest,13.1837,3612672,MIOpenGEMM,0_1_196_144_196_196_144_16
512-28-28-3x3-512-56-56-32-1x1-2x2-1x1-0-NCHW-FP32-W_g32=miopenConvolutionBwdWeightsAlgoDirect:ConvAsmBwdWrW3x3,1.00719,0,miopenConvolutionBwdWeightsAlgoDirect,<unused>;miopenConvolutionBwdWeightsAlgoGEMM:GemmWrwUniversal,31.5828,14450688,MIOpenGEMM,1_0_784_784_144_144_16_784
2048-7-7-3x3-2048-7-7-32-1x1-1x1-1x1-0-NCHW-FP32-B_g64=miopenConvolutionBwdDataAlgoDirect:ConvOclDirectFwd,1.06054,0,miopenConvolutionBwdDataAlgoDirect,<unused>;miopenConvolutionBwdDataAlgoWinograd:ConvBinWinogradRxSf2x3,2.0927,0,miopenConvolutionBwdDataAlgoWinograd,<unused>;miopenConvolutionBwdDataAlgoGEMM:GemmBwdRest,38.3524,3612672,MIOpenGEMM,0_1_49_288_49_49_288_32
256-56-56-3x3-256-56-56-32-1x1-1x1-1x1-0-NCHW-FP32-B_g32=miopenConvolutionBwdDataAlgoDirect:ConvAsm3x3U,0.688652,0,miopenConvolutionBwdDataAlgoDirect,<unused>;miopenConvolutionBwdDataAlgoWinograd:ConvBinWinogradRxSf2x3,2.74203,0,miopenConvolutionBwdDataAlgoWinograd,<unused>;miopenConvolutionBwdDataAlgoGEMM:GemmBwdRest,23.3451,28901376,MIOpenGEMM,0_1_3136_72_3136_3136_72_8
128-56-56-3x3-128-56-56-32-1x1-1x1-1x1-0-NCHW-FP32-W_g32=miopenConvolutionBwdWeightsAlgoDirect:ConvAsmBwdWrW3x3,0.335566,0,miopenConvolutionBwdWeightsAlgoDirect,<unused>;miopenConvolutionBwdWeightsAlgoWinograd:ConvBinWinogradRxSf2x3,35.0117,0,miopenConvolutionBwdWeightsAlgoWinograd,128x56x56x3x3x128x56x56x32xNCHWxFP32x1x1x1x1x1x1x32x0;miopenConvolutionBwdWeightsAlgoGEMM:GemmWrwUniversal,100.003,14450688,MIOpenGEMM,1_0_3136_3136_36_36_4_3136
2048-7-7-3x3-2048-14-14-32-1x1-2x2-1x1-0-NCHW-FP32-W_g32=miopenConvolutionBwdWeightsAlgoImplicitGEMM:ConvHipImplicitGemmV4R1WrW,0.969699,0,miopenConvolutionBwdWeightsAlgoImplicitGEMM,2048x7x7x3x3x2048x14x14x32xNCHWxFP32x1x1x2x2x1x1x32x0;miopenConvolutionBwdWeightsAlgoDirect:ConvAsmBwdWrW3x3,1.05981,0,miopenConvolutionBwdWeightsAlgoDirect,<unused>;miopenConvolutionBwdWeightsAlgoGEMM:GemmWrwUniversal,12.1656,3612672,MIOpenGEMM,1_0_49_49_576_576_64_49
256-56-56-3x3-256-56-56-32-1x1-1x1-1x1-0-NCHW-FP32-F_g32=miopenConvolutionFwdAlgoDirect:ConvAsm3x3U,0.688638,0,miopenConvolutionFwdAlgoDirect,<unused>;miopenConvolutionFwdAlgoWinograd:ConvBinWinogradRxSf2x3,2.71536,0,miopenConvolutionFwdAlgoWinograd,<unused>;miopenConvolutionFwdAlgoGEMM:GemmFwdRest,18.9594,28901376,MIOpenGEMM,0_0_3136_72_3136_3136_8_72
2048-7-7-3x3-2048-14-14-32-1x1-2x2-1x1-0-NCHW-FP32-B_g32=miopenConvolutionBwdDataAlgoWinograd:ConvBinWinogradRxSf2x3,1.85511,0,miopenConvolutionBwdDataAlgoWinograd,<unused>;miopenConvolutionBwdDataAlgoDirect:ConvOclDirectFwd,2.95758,0,miopenConvolutionBwdDataAlgoDirect,<unused>;miopenConvolutionBwdDataAlgoGEMM:GemmBwdRest,17.1507,3612672,MIOpenGEMM,0_1_49_576_49_49_576_64
256-14-14-1x1-1024-14-14-128-0x0-1x1-1x1-0-NCHW-FP32-F=miopenConvolutionFwdAlgoDirect:ConvAsm1x1U,3.86174,0,miopenConvolutionFwdAlgoDirect,<unused>;miopenConvolutionFwdAlgoGEMM:GemmFwd1x1_0_1,30.5358,0,MIOpenGEMM,0_0_196_256_196_196_1024_256
2048-7-7-3x3-2048-7-7-32-1x1-1x1-1x1-0-NCHW-FP32-F_g64=miopenConvolutionFwdAlgoWinograd:ConvBinWinogradRxSf2x3,0.677428,0,miopenConvolutionFwdAlgoWinograd,<unused>;miopenConvolutionFwdAlgoImplicitGEMM:ConvHipImplicitGemmV4R1Fwd,0.850401,0,miopenConvolutionFwdAlgoImplicitGEMM,2048x7x7x3x3x2048x7x7x32xNCHWxFP32x1x1x1x1x1x1x64x1;miopenConvolutionFwdAlgoDirect:ConvOclDirectFwd,1.05958,0,miopenConvolutionFwdAlgoDirect,<unused>;miopenConvolutionFwdAlgoGEMM:GemmFwdRest,43.9881,3612672,MIOpenGEMM,0_0_49_288_49_49_32_288
512-7-7-1x1-1024-14-14-128-0x0-2x2-1x1-0-NCHW-FP32-W=miopenConvolutionBwdWeightsAlgoDirect:ConvAsmBwdWrW1x1,4.50816,25690112,miopenConvolutionBwdWeightsAlgoDirect,<unused>;miopenConvolutionBwdWeightsAlgoImplicitGEMM:ConvHipImplicitGemmV4R1WrW,5.36565,0,miopenConvolutionBwdWeightsAlgoImplicitGEMM,512x7x7x1x1x1024x14x14x128xNCHWxFP32x0x0x2x2x1x1x1x0;miopenConvolutionBwdWeightsAlgoGEMM:GemmWrwUniversal,83.5336,200704,MIOpenGEMM,1_0_49_49_1024_1024_512_49
512-28-28-3x3-512-56-56-32-1x1-2x2-1x1-0-NCHW-FP32-B_g32=miopenConvolutionBwdDataAlgoWinograd:ConvBinWinogradRxSf2x3,2.20331,0,miopenConvolutionBwdDataAlgoWinograd,<unused>;miopenConvolutionBwdDataAlgoDirect:ConvOclDirectFwd,4.08299,0,miopenConvolutionBwdDataAlgoDirect,<unused>;miopenConvolutionBwdDataAlgoGEMM:GemmBwdRest,19.7798,14450688,MIOpenGEMM,0_1_784_144_784_784_144_16
1024-28-28-1x1-512-28-28-32-0x0-1x1-1x1-0-NCHW-FP32-W=miopenConvolutionBwdWeightsAlgoDirect:ConvAsmBwdWrW1x1,4.79368,0,miopenConvolutionBwdWeightsAlgoDirect,<unused>;miopenConvolutionBwdWeightsAlgoWinograd:ConvBinWinogradRxSf2x3,23.2689,0,miopenConvolutionBwdWeightsAlgoWinograd,1024x28x28x1x1x512x28x28x32xNCHWxFP32x0x0x1x1x1x1x1x0
2048-14-14-3x3-2048-7-7-32-1x1-2x2-1x1-0-NCHW-FP32-F_g32=miopenConvolutionFwdAlgoImplicitGEMM:ConvHipImplicitGemmV4R1Fwd,1.02552,0,miopenConvolutionFwdAlgoImplicitGEMM,2048x14x14x3x3x2048x7x7x32xNCHWxFP32x1x1x2x2x1x1x32x1;miopenConvolutionFwdAlgoWinograd:ConvBinWinogradRxSf2x3,1.71618,0,miopenConvolutionFwdAlgoWinograd,<unused>;miopenConvolutionFwdAlgoDirect:ConvOclDirectFwd,3.86994,0,miopenConvolutionFwdAlgoDirect,<unused>;miopenConvolutionFwdAlgoGEMM:GemmFwdRest,26.4528,3612672,MIOpenGEMM,0_0_49_576_49_49_64_576
256-56-56-3x3-256-56-56-32-1x1-1x1-1x1-0-NCHW-FP32-W_g64=miopenConvolutionBwdWeightsAlgoDirect:ConvAsmBwdWrW3x3,0.648453,0,miopenConvolutionBwdWeightsAlgoDirect,<unused>;miopenConvolutionBwdWeightsAlgoWinograd:ConvBinWinogradRxSf2x3,42.1387,0,miopenConvolutionBwdWeightsAlgoWinograd,256x56x56x3x3x256x56x56x32xNCHWxFP32x1x1x1x1x1x1x64x0;miopenConvolutionBwdWeightsAlgoGEMM:GemmWrwUniversal,226.657,28901376,MIOpenGEMM,1_0_3136_3136_36_36_4_3136
512-14-14-3x3-512-14-14-32-1x1-1x1-1x1-0-NCHW-FP32-F_g32=miopenConvolutionFwdAlgoWinograd:ConvBinWinogradRxSf2x3,0.516683,0,miopenConvolutionFwdAlgoWinograd,<unused>;miopenConvolutionFwdAlgoDirect:ConvOclDirectFwd,0.578646,0,miopenConvolutionFwdAlgoDirect,<unused>;miopenConvolutionFwdAlgoImplicitGEMM:ConvHipImplicitGemmV4R1Fwd,0.926039,0,miopenConvolutionFwdAlgoImplicitGEMM,512x14x14x3x3x512x14x14x32xNCHWxFP32x1x1x1x1x1x1x32x1;miopenConvolutionFwdAlgoGEMM:GemmFwdRest,27.9316,3612672,MIOpenGEMM,0_0_196_144_196_196_16_144
512-28-28-3x3-512-56-56-32-1x1-2x2-1x1-0-NCHW-FP32-W_g64=miopenConvolutionBwdWeightsAlgoDirect:ConvAsmBwdWrW3x3,1.22917,0,miopenConvolutionBwdWeightsAlgoDirect,<unused>;miopenConvolutionBwdWeightsAlgoGEMM:GemmWrwUniversal,172.329,14450688,MIOpenGEMM,1_0_784_784_72_72_8_784
64-27-27-5x5-192-27-27-512-2x2-1x1-1x1-0-NCHW-FP32-F=miopenConvolutionFwdAlgoWinograd:ConvBinWinogradRxS,26.8689,0,miopenConvolutionFwdAlgoWinograd,<unused>;miopenConvolutionFwdAlgoFFT:fft,42.3669,856195072,miopenConvolutionFwdAlgoFFT,64x27x27x5x5x192x27x27x512xNCHWxFP32x2x2x1x1x1x1x1x1;miopenConvolutionFwdAlgoImplicitGEMM:ConvHipImplicitGemmV4R1Fwd,71.9793,0,miopenConvolutionFwdAlgoImplicitGEMM,64x27x27x5x5x192x27x27x512xNCHWxFP32x2x2x1x1x1x1x1x1;miopenConvolutionFwdAlgoDirect:ConvOclDirectFwd,104.587,0,miopenConvolutionFwdAlgoDirect,<unused>;miopenConvolutionFwdAlgoGEMM:GemmFwdRest,622.068,4665600,MIOpenGEMM,0_0_729_1600_729_729_192_1600
1024-28-28-1x1-512-28-28-32-0x0-1x1-1x1-0-NCHW-FP32-B=miopenConvolutionBwdDataAlgoDirect:ConvAsm1x1U,4.0159,0,miopenConvolutionBwdDataAlgoDirect,<unused>;miopenConvolutionBwdDataAlgoGEMM:GemmBwd1x1_stride1,5.83567,0,MIOpenGEMM,0_1_784_512_784_784_512_1024;miopenConvolutionBwdDataAlgoWinograd:ConvBinWinogradRxSf3x2,6.38329,0,miopenConvolutionBwdDataAlgoWinograd,<unused>
512-7-7-1x1-1024-14-14-128-0x0-2x2-1x1-0-NCHW-FP32-B=miopenConvolutionBwdDataAlgoDirect:ConvAsm1x1UV2,1.83706,0,miopenConvolutionBwdDataAlgoDirect,<unused>;miopenConvolutionBwdDataAlgoGEMM:GemmBwd1x1_stride2,21.5276,38535168,MIOpenGEMM,0_1_6272_1024_6272_6272_1024_512;miopenConvolutionBwdDataAlgoWinograd:ConvBinWinogradRxSf2x3,51.5081,0,miopenConvolutionBwdDataAlgoWinograd,<unused>
512-7-7-3x3-512-7-7-128-1x1-1x1-1x1-0-NCHW-FP32-B=miopenConvolutionBwdDataAlgoWinograd:ConvBinWinograd3x3U,2.43311,0,miopenConvolutionBwdDataAlgoWinograd,<unused>
1024-14-14-3x3-1024-28-28-32-1x1-2x2-1x1-0-NCHW-FP32-W_g32=miopenConvolutionBwdWeightsAlgoDirect:ConvAsmBwdWrW3x3,0.8255,0,miopenConvolutionBwdWeightsAlgoDirect,<unused>;miopenConvolutionBwdWeightsAlgoGEMM:GemmWrwUniversal,31.9126,7225344,MIOpenGEMM,1_0_196_196_288_288_32_196
512-28-28-1x1-256-56-56-128-0x0-2x2-1x1-0-NCHW-FP32-B=miopenConvolutionBwdDataAlgoDirect:ConvAsm1x1UV2,6.22667,0,miopenConvolutionBwdDataAlgoDirect,<unused>;miopenConvolutionBwdDataAlgoWinograd:ConvBinWinogradRxSf2x3,59.0531,0,miopenConvolutionBwdDataAlgoWinograd,<unused>
512-28-28-3x3-512-56-56-32-1x1-2x2-1x1-0-NCHW-FP32-B_g64=miopenConvolutionBwdDataAlgoDirect:ConvOclDirectFwd,2.25287,0,miopenConvolutionBwdDataAlgoDirect,<unused>;miopenConvolutionBwdDataAlgoWinograd:ConvBinWinogradRxSf2x3,3.56347,0,miopenConvolutionBwdDataAlgoWinograd,<unused>;miopenConvolutionBwdDataAlgoGEMM:GemmBwdRest,24.445,14450688,MIOpenGEMM,0_1_784_72_784_784_72_8
512-28-28-1x1-128-28-28-128-0x0-1x1-1x1-0-NCHW-FP32-F=miopenConvolutionFwdAlgoDirect:ConvAsm1x1U,2.77203,0,miopenConvolutionFwdAlgoDirect,<unused>;miopenConvolutionFwdAlgoWinograd:ConvBinWinogradRxSf3x2,5.04158,0,miopenConvolutionFwdAlgoWinograd,<unused>;miopenConvolutionFwdAlgoGEMM:GemmFwd1x1_0_1,8.17974,0,MIOpenGEMM,0_0_784_512_784_784_128_512
512-56-56-3x3-512-28-28-32-1x1-2x2-1x1-0-NCHW-FP32-F_g32=miopenConvolutionFwdAlgoImplicitGEMM:ConvHipImplicitGemmV4R1Fwd,1.59953,0,miopenConvolutionFwdAlgoImplicitGEMM,512x56x56x3x3x512x28x28x32xNCHWxFP32x1x1x2x2x1x1x32x1;miopenConvolutionFwdAlgoWinograd:ConvBinWinogradRxSf2x3,2.92076,0,miopenConvolutionFwdAlgoWinograd,<unused>;miopenConvolutionFwdAlgoDirect:ConvOclDirectFwd,5.55399,0,miopenConvolutionFwdAlgoDirect,<unused>;miopenConvolutionFwdAlgoGEMM:GemmFwdRest,19.1417,14450688,MIOpenGEMM,0_0_784_144_784_784_16_144
384-13-13-3x3-384-13-13-512-1x1-1x1-1x1-0-NCHW-FP32-W=miopenConvolutionBwdWeightsAlgoWinograd:ConvBinWinogradRxS,34.9961,0,miopenConvolutionBwdWeightsAlgoWinograd,384x13x13x3x3x384x13x13x512xNCHWxFP32x1x1x1x1x1x1x1x0;miopenConvolutionBwdWeightsAlgoDirect:ConvAsmBwdWrW3x3,40.6035,0,miopenConvolutionBwdWeightsAlgoDirect,<unused>;miopenConvolutionBwdWeightsAlgoImplicitGEMM:ConvHipImplicitGemmV4R1WrW,49.3353,0,miopenConvolutionBwdWeightsAlgoImplicitGEMM,384x13x13x3x3x384x13x13x512xNCHWxFP32x1x1x1x1x1x1x1x0;miopenConvolutionBwdWeightsAlgoGEMM:GemmWrwUniversal,61.6114,2336256,MIOpenGEMM,1_0_169_169_3456_3456_384_169
1024-14-14-3x3-1024-14-14-32-1x1-1x1-1x1-0-NCHW-FP32-W_g32=miopenConvolutionBwdWeightsAlgoDirect:ConvAsmBwdWrW3x3,0.693934,0,miopenConvolutionBwdWeightsAlgoDirect,<unused>;miopenConvolutionBwdWeightsAlgoWinograd:ConvBinWinogradRxSf2x3,1.04236,0,miopenConvolutionBwdWeightsAlgoWinograd,1024x14x14x3x3x1024x14x14x32xNCHWxFP32x1x1x1x1x1x1x32x0;miopenConvolutionBwdWeightsAlgoGEMM:GemmWrwUniversal,29.6985,7225344,MIOpenGEMM,1_0_196_196_288_288_32_196
1024-14-14-3x3-1024-28-28-32-1x1-2x2-1x1-0-NCHW-FP32-B_g32=miopenConvolutionBwdDataAlgoWinograd:ConvBinWinogradRxSf2x3,2.08073,0,miopenConvolutionBwdDataAlgoWinograd,<unused>;miopenConvolutionBwdDataAlgoDirect:ConvOclDirectFwd,2.64842,0,miopenConvolutionBwdDataAlgoDirect,<unused>;miopenConvolutionBwdDataAlgoGEMM:GemmBwdRest,15.2951,7225344,MIOpenGEMM,0_1_196_288_196_196_288_32
128-28-28-3x3-128-28-28-128-1x1-1x1-1x1-0-NCHW-FP32-F=miopenConvolutionFwdAlgoWinograd:ConvBinWinogradRxSf2x3,1.72102,0,miopenConvolutionFwdAlgoWinograd,<unused>
512-56-56-3x3-512-28-28-32-1x1-2x2-1x1-0-NCHW-FP32-F_g64=miopenConvolutionFwdAlgoDirect:ConvOclDirectFwd,6.3337,0,miopenConvolutionFwdAlgoDirect,<unused>;miopenConvolutionFwdAlgoWinograd:ConvBinWinogradRxSf2x3,6.70716,0,miopenConvolutionFwdAlgoWinograd,<unused>;miopenConvolutionFwdAlgoGEMM:GemmFwdRest,105.268,14450688,MIOpenGEMM,0_0_784_72_784_784_8_72
512-7-7-3x3-512-7-7-128-1x1-1x1-1x1-0-NCHW-FP32-F=miopenConvolutionFwdAlgoWinograd:ConvBinWinograd3x3U,2.53787,0,miopenConvolutionFwdAlgoWinograd,<unused>
64-56-56-3x3-64-56-56-128-1x1-1x1-1x1-0-NCHW-FP32-W=miopenConvolutionBwdWeightsAlgoDirect:ConvAsmBwdWrW3x3,5.93396,0,miopenConvolutionBwdWeightsAlgoDirect,<unused>;miopenConvolutionBwdWeightsAlgoWinograd:ConvBinWinogradRxSf2x3,21.3372,0,miopenConvolutionBwdWeightsAlgoWinograd,64x56x56x3x3x64x56x56x128xNCHWxFP32x1x1x1x1x1x1x1x0;miopenConvolutionBwdWeightsAlgoImplicitGEMM:ConvHipImplicitGemmV4R1WrW,65.828,0,miopenConvolutionBwdWeightsAlgoImplicitGEMM,64x56x56x3x3x64x56x56x128xNCHWxFP32x1x1x1x1x1x1x1x0;miopenConvolutionBwdWeightsAlgoGEMM:GemmWrwUniversal,119.983,7225344,MIOpenGEMM,1_0_3136_3136_576_576_64_3136
1024-14-14-3x3-1024-14-14-32-1x1-1x1-1x1-0-NCHW-FP32-B_g32=miopenConvolutionBwdDataAlgoWinograd:ConvBinWinogradRxSf2x3,0.414914,0,miopenConvolutionBwdDataAlgoWinograd,<unused>;miopenConvolutionBwdDataAlgoDirect:ConvOclDirectFwd,1.97426,0,miopenConvolutionBwdDataAlgoDirect,<unused>;miopenConvolutionBwdDataAlgoGEMM:GemmBwdRest,11.8917,7225344,MIOpenGEMM,0_1_196_288_196_196_288_32
512-7-7-1x1-2048-7-7-128-0x0-1x1-1x1-0-NCHW-FP32-W=miopenConvolutionBwdWeightsAlgoDirect:ConvAsmBwdWrW1x1,3.2907,0,miopenConvolutionBwdWeightsAlgoDirect,<unused>;miopenConvolutionBwdWeightsAlgoGEMM:GemmWrw1x1_stride1,7.6607,0,MIOpenGEMM,1_0_49_49_2048_2048_512_49;miopenConvolutionBwdWeightsAlgoWinograd:ConvBinWinogradRxSf2x3,16.1329,0,miopenConvolutionBwdWeightsAlgoWinograd,512x7x7x1x1x2048x7x7x128xNCHWxFP32x0x0x1x1x1x1x1x0
1024-14-14-1x1-512-28-28-128-0x0-2x2-1x1-0-NCHW-FP32-W=miopenConvolutionBwdWeightsAlgoDirect:ConvAsmBwdWrW1x1,8.65557,51380224,miopenConvolutionBwdWeightsAlgoDirect,<unused>;miopenConvolutionBwdWeightsAlgoImplicitGEMM:ConvHipImplicitGemmV4R1WrW,22.1847,0,miopenConvolutionBwdWeightsAlgoImplicitGEMM,1024x14x14x1x1x512x28x28x128xNCHWxFP32x0x0x2x2x1x1x1x0;miopenConvolutionBwdWeightsAlgoGEMM:GemmWrwUniversal,179.78,401408,MIOpenGEMM,1_0_196_196_512_512_1024_196
64-56-56-3x3-64-56-56-128-1x1-1x1-1x1-0-NCHW-FP32-B=miopenConvolutionBwdDataAlgoWinograd:ConvBinWinogradRxS,2.24947,0,miopenConvolutionBwdDataAlgoWinograd,<unused>
256-56-56-1x1-512-28-28-128-0x0-2x2-1x1-0-NCHW-FP32-F=miopenConvolutionFwdAlgoDirect:ConvAsm1x1UV2,6.52887,0,miopenConvolutionFwdAlgoDirect,<unused>;miopenConvolutionFwdAlgoWinograd:ConvBinWinogradRxS,44.8218,0,miopenConvolutionFwdAlgoWinograd,<unused>
1024-14-14-1x1-512-7-7-128-0x0-2x2-1x1-0-NCHW-FP32-F=miopenConvolutionFwdAlgoDirect:ConvAsm1x1UV2,6.57129,0,miopenConvolutionFwdAlgoDirect,<unused>;miopenConvolutionFwdAlgoGEMM:GemmFwd1x1_0_2,12.9408,38535168,MIOpenGEMM,0_0_6272_1024_6272_6272_512_1024;miopenConvolutionFwdAlgoWinograd:ConvBinWinogradRxS,26.3359,0,miopenConvolutionFwdAlgoWinograd,<unused>
64-56-56-3x3-64-56-56-128-1x1-1x1-1x1-0-NCHW-FP32-F=miopenConvolutionFwdAlgoWinograd:ConvBinWinograd3x3U,1.68846,0,miopenConvolutionFwdAlgoWinograd,<unused>
2048-7-7-1x1-512-7-7-128-0x0-1x1-1x1-0-NCHW-FP32-F=miopenConvolutionFwdAlgoDirect:ConvAsm1x1U,3.02475,0,miopenConvolutionFwdAlgoDirect,<unused>;miopenConvolutionFwdAlgoWinograd:ConvBinWinogradRxSf3x2,6.38997,0,miopenConvolutionFwdAlgoWinograd,<unused>;miopenConvolutionFwdAlgoGEMM:GemmFwd1x1_0_1,13.3594,0,MIOpenGEMM,0_0_49_2048_49_49_512_2048
64-55-55-11x11-3-227-227-512-0x0-4x4-1x1-0-NCHW-FP32-W=miopenConvolutionBwdWeightsAlgoDirect:ConvOclBwdWrW2<8>,28.6642,5947392,miopenConvolutionBwdWeightsAlgoDirect,<unused>;miopenConvolutionBwdWeightsAlgoGEMM:GemmWrwUniversal,48.7468,4392300,MIOpenGEMM,1_0_3025_3025_363_363_64_3025
384-13-13-3x3-192-13-13-512-1x1-1x1-1x1-0-NCHW-FP32-W=miopenConvolutionBwdWeightsAlgoDirect:ConvAsmBwdWrW3x3,26.6267,0,miopenConvolutionBwdWeightsAlgoDirect,<unused>;miopenConvolutionBwdWeightsAlgoWinograd:ConvBinWinogradRxS,29.4069,0,miopenConvolutionBwdWeightsAlgoWinograd,384x13x13x3x3x192x13x13x512xNCHWxFP32x1x1x1x1x1x1x1x0;miopenConvolutionBwdWeightsAlgoImplicitGEMM:ConvHipImplicitGemmV4R1WrW,35.9318,0,miopenConvolutionBwdWeightsAlgoImplicitGEMM,384x13x13x3x3x192x13x13x512xNCHWxFP32x1x1x1x1x1x1x1x0;miopenConvolutionBwdWeightsAlgoGEMM:GemmWrwUniversal,358.508,1168128,MIOpenGEMM,1_0_169_169_1728_1728_384_169
1024-14-14-3x3-1024-14-14-32-1x1-1x1-1x1-0-NCHW-FP32-F_g32=miopenConvolutionFwdAlgoWinograd:ConvBinWinogradRxSf2x3,0.416309,0,miopenConvolutionFwdAlgoWinograd,<unused>;miopenConvolutionFwdAlgoImplicitGEMM:ConvHipImplicitGemmV4R1Fwd,0.838245,0,miopenConvolutionFwdAlgoImplicitGEMM,1024x14x14x3x3x1024x14x14x32xNCHWxFP32x1x1x1x1x1x1x32x1;miopenConvolutionFwdAlgoDirect:ConvAsm3x3U,2.56185,0,miopenConvolutionFwdAlgoDirect,<unused>;miopenConvolutionFwdAlgoGEMM:GemmFwdRest,17.4859,7225344,MIOpenGEMM,0_0_196_288_196_196_32_288
1024-14-14-1x1-512-28-28-128-0x0-2x2-1x1-0-NCHW-FP32-B=miopenConvolutionBwdDataAlgoDirect:ConvAsm1x1UV2,11.0032,0,miopenConvolutionBwdDataAlgoDirect,<unused>;miopenConvolutionBwdDataAlgoWinograd:ConvBinWinogradRxSf2x3,99.4454,0,miopenConvolutionBwdDataAlgoWinograd,<unused>
512-28-28-3x3-512-28-28-32-1x1-1x1-1x1-0-NCHW-FP32-W_g64=miopenConvolutionBwdWeightsAlgoDirect:ConvAsmBwdWrW3x3,0.458003,0,miopenConvolutionBwdWeightsAlgoDirect,<unused>;miopenConvolutionBwdWeightsAlgoWinograd:ConvBinWinogradRxSf2x3,24.1878,0,miopenConvolutionBwdWeightsAlgoWinograd,512x28x28x3x3x512x28x28x32xNCHWxFP32x1x1x1x1x1x1x64x0;miopenConvolutionBwdWeightsAlgoGEMM:GemmWrwUniversal,84.5755,14450688,MIOpenGEMM,1_0_784_784_72_72_8_784
128-28-28-1x1-256-56-56-128-0x0-2x2-1x1-0-NCHW-FP32-W=miopenConvolutionBwdWeightsAlgoDirect:ConvAsmBwdWrW1x1,6.05039,102760448,miopenConvolutionBwdWeightsAlgoDirect,<unused>;miopenConvolutionBwdWeightsAlgoImplicitGEMM:ConvHipImplicitGemmV4R1WrW,36.3189,0,miopenConvolutionBwdWeightsAlgoImplicitGEMM,128x28x28x1x1x256x56x56x128xNCHWxFP32x0x0x2x2x1x1x1x0;miopenConvolutionBwdWeightsAlgoGEMM:GemmWrwUniversal,250.495,802816,MIOpenGEMM,1_0_784_784_256_256_128_784
2048-7-7-3x3-2048-7-7-32-1x1-1x1-1x1-0-NCHW-FP32-W_g32=miopenConvolutionBwdWeightsAlgoDirect:ConvAsmBwdWrW3x3,0.662211,0,miopenConvolutionBwdWeightsAlgoDirect,<unused>;miopenConvolutionBwdWeightsAlgoImplicitGEMM:ConvHipImplicitGemmV4R1WrW,0.967922,0,miopenConvolutionBwdWeightsAlgoImplicitGEMM,2048x7x7x3x3x2048x7x7x32xNCHWxFP32x1x1x1x1x1x1x32x0;miopenConvolutionBwdWeightsAlgoWinograd:ConvBinWinogradRxSf2x3,1.16798,0,miopenConvolutionBwdWeightsAlgoWinograd,2048x7x7x3x3x2048x7x7x32xNCHWxFP32x1x1x1x1x1x1x32x0;miopenConvolutionBwdWeightsAlgoGEMM:GemmWrwUniversal,10.7164,3612672,MIOpenGEMM,1_0_49_49_576_576_64_49
512-28-28-3x3-512-28-28-32-1x1-1x1-1x1-0-NCHW-FP32-W_g32=miopenConvolutionBwdWeightsAlgoDirect:ConvAsmBwdWrW3x3,0.739148,0,miopenConvolutionBwdWeightsAlgoDirect,<unused>;miopenConvolutionBwdWeightsAlgoWinograd:ConvBinWinogradRxSf2x3,15.8914,0,miopenConvolutionBwdWeightsAlgoWinograd,512x28x28x3x3x512x28x28x32xNCHWxFP32x1x1x1x1x1x1x32x0;miopenConvolutionBwdWeightsAlgoGEMM:GemmWrwUniversal,32.7175,14450688,MIOpenGEMM,1_0_784_784_144_144_16_784
512-28-28-1x1-256-14-14-128-0x0-2x2-1x1-0-NCHW-FP32-F=miopenConvolutionFwdAlgoDirect:ConvAsm1x1UV2,1.98437,0,miopenConvolutionFwdAlgoDirect,<unused>;miopenConvolutionFwdAlgoWinograd:ConvBinWinogradRxSf2x3,11.7308,0,miopenConvolutionFwdAlgoWinograd,<unused>
2048-7-7-1x1-512-7-7-128-0x0-1x1-1x1-0-NCHW-FP32-W=miopenConvolutionBwdWeightsAlgoDirect:ConvAsmBwdWrW1x1,2.65942,0,miopenConvolutionBwdWeightsAlgoDirect,<unused>;miopenConvolutionBwdWeightsAlgoGEMM:GemmWrw1x1_stride1,5.78567,0,MIOpenGEMM,1_0_49_49_512_512_2048_49;miopenConvolutionBwdWeightsAlgoWinograd:ConvBinWinogradRxSf2x3,8.20424,0,miopenConvolutionBwdWeightsAlgoWinograd,2048x7x7x1x1x512x7x7x128xNCHWxFP32x0x0x1x1x1x1x1x0
128-28-28-3x3-128-28-28-128-1x1-1x1-1x1-0-NCHW-FP32-B=miopenConvolutionBwdDataAlgoWinograd:ConvBinWinogradRxSf2x3,2.07056,0,miopenConvolutionBwdDataAlgoWinograd,<unused>
256-14-14-1x1-1024-14-14-128-0x0-1x1-1x1-0-NCHW-FP32-W=miopenConvolutionBwdWeightsAlgoDirect:ConvAsmBwdWrW1x1,2.34221,0,miopenConvolutionBwdWeightsAlgoDirect,<unused>;miopenConvolutionBwdWeightsAlgoGEMM:GemmWrw1x1_stride1,6.3654,0,MIOpenGEMM,1_0_196_196_1024_1024_256_196;miopenConvolutionBwdWeightsAlgoWinograd:ConvBinWinogradRxS,14.8699,0,miopenConvolutionBwdWeightsAlgoWinograd,256x14x14x1x1x1024x14x14x128xNCHWxFP32x0x0x1x1x1x1x1x0
384-13-13-3x3-192-13-13-512-1x1-1x1-1x1-0-NCHW-FP32-B=miopenConvolutionBwdDataAlgoWinograd:ConvBinWinogradRxSf2x3,7.09031,0,miopenConvolutionBwdDataAlgoWinograd,<unused>
3-227-227-11x11-64-55-55-512-0x0-4x4-1x1-0-NCHW-FP32-F=miopenConvolutionFwdAlgoDirect:ConvOclDirectFwd11x11,26.4079,0,miopenConvolutionFwdAlgoDirect,<unused>;miopenConvolutionFwdAlgoGEMM:GemmFwdRest,39.5016,4392300,MIOpenGEMM,0_0_3025_363_3025_3025_64_363
512-7-7-1x1-2048-7-7-128-0x0-1x1-1x1-0-NCHW-FP32-B=miopenConvolutionBwdDataAlgoDirect:ConvAsm1x1U,3.06502,0,miopenConvolutionBwdDataAlgoDirect,<unused>;miopenConvolutionBwdDataAlgoGEMM:GemmBwd1x1_stride1,23.2441,0,MIOpenGEMM,0_1_49_2048_49_49_2048_512
512-28-28-3x3-512-28-28-32-1x1-1x1-1x1-0-NCHW-FP32-B_g32=miopenConvolutionBwdDataAlgoWinograd:ConvBinWinogradRxSf2x3,1.15662,0,miopenConvolutionBwdDataAlgoWinograd,<unused>;miopenConvolutionBwdDataAlgoDirect:ConvAsm3x3U,1.2966,0,miopenConvolutionBwdDataAlgoDirect,<unused>;miopenConvolutionBwdDataAlgoGEMM:GemmBwdRest,12.9226,14450688,MIOpenGEMM,0_1_784_144_784_784_144_16
192-27-27-5x5-64-27-27-512-2x2-1x1-1x1-0-NCHW-FP32-W=miopenConvolutionBwdWeightsAlgoWinograd:ConvBinWinogradRxSf2x3,28.017,0,miopenConvolutionBwdWeightsAlgoWinograd,192x27x27x5x5x64x27x27x512xNCHWxFP32x2x2x1x1x1x1x1x0;miopenConvolutionBwdWeightsAlgoDirect:ConvOclBwdWrW53,37.6515,0,miopenConvolutionBwdWeightsAlgoDirect,<unused>;miopenConvolutionBwdWeightsAlgoGEMM:GemmWrwUniversal,57.8327,4665600,MIOpenGEMM,1_0_729_729_1600_1600_192_729;miopenConvolutionBwdWeightsAlgoImplicitGEMM:ConvHipImplicitGemmV4R1WrW,76.9861,0,miopenConvolutionBwdWeightsAlgoImplicitGEMM,192x27x27x5x5x64x27x27x512xNCHWxFP32x2x2x1x1x1x1x1x0
256-56-56-1x1-128-28-28-128-0x0-2x2-1x1-0-NCHW-FP32-F=miopenConvolutionFwdAlgoDirect:ConvAsm1x1UV2,1.57718,0,miopenConvolutionFwdAlgoDirect,<unused>;miopenConvolutionFwdAlgoGEMM:GemmFwd1x1_0_2,5.39602,154140672,MIOpenGEMM,0_0_100352_256_100352_100352_128_256;miopenConvolutionFwdAlgoWinograd:ConvBinWinogradRxS,8.84667,0,miopenConvolutionFwdAlgoWinograd,<unused>
64-56-56-1x1-64-56-56-128-0x0-1x1-1x1-0-NCHW-FP32-W=miopenConvolutionBwdWeightsAlgoDirect:ConvAsmBwdWrW1x1,2.3519,0,miopenConvolutionBwdWeightsAlgoDirect,<unused>
128-28-28-1x1-256-56-56-128-0x0-2x2-1x1-0-NCHW-FP32-B=miopenConvolutionBwdDataAlgoDirect:ConvAsm1x1UV2,1.68894,0,miopenConvolutionBwdDataAlgoDirect,<unused>;miopenConvolutionBwdDataAlgoGEMM:GemmBwd1x1_stride2,7.43703,154140672,MIOpenGEMM,0_1_100352_256_100352_100352_256_128;miopenConvolutionBwdDataAlgoWinograd:ConvBinWinogradRxSf2x3,12.9052,0,miopenConvolutionBwdDataAlgoWinograd,<unused>
256-14-14-3x3-256-14-14-128-1x1-1x1-1x1-0-NCHW-FP32-B=miopenConvolutionBwdDataAlgoWinograd:ConvBinWinogradRxSf2x3,1.59342,0,miopenConvolutionBwdDataAlgoWinograd,<unused>
512-28-28-1x1-1024-14-14-128-0x0-2x2-1x1-0-NCHW-FP32-F=miopenConvolutionFwdAlgoDirect:ConvAsm1x1U,7.35785,51380224,miopenConvolutionFwdAlgoDirect,<unused>
512-7-7-1x1-2048-7-7-128-0x0-1x1-1x1-0-NCHW-FP32-F=miopenConvolutionFwdAlgoDirect:ConvAsm1x1U,3.69559,0,miopenConvolutionFwdAlgoDirect,<unused>;miopenConvolutionFwdAlgoGEMM:GemmFwd1x1_0_1,19.0878,0,MIOpenGEMM,0_0_49_512_49_49_2048_512
2048-7-7-1x1-512-7-7-128-0x0-1x1-1x1-0-NCHW-FP32-B=miopenConvolutionBwdDataAlgoDirect:ConvAsm1x1U,3.35236,0,miopenConvolutionBwdDataAlgoDirect,<unused>;miopenConvolutionBwdDataAlgoWinograd:ConvBinWinogradRxSf3x2,8.85322,0,miopenConvolutionBwdDataAlgoWinograd,<unused>;miopenConvolutionBwdDataAlgoGEMM:GemmBwd1x1_stride1,13.3155,0,MIOpenGEMM,0_1_49_512_49_49_512_2048
256-14-14-1x1-1024-14-14-128-0x0-1x1-1x1-0-NCHW-FP32-B=miopenConvolutionBwdDataAlgoDirect:ConvAsm1x1U,2.42417,0,miopenConvolutionBwdDataAlgoDirect,<unused>;miopenConvolutionBwdDataAlgoWinograd:ConvBinWinogradRxSf3x2,4.92686,0,miopenConvolutionBwdDataAlgoWinograd,<unused>;miopenConvolutionBwdDataAlgoGEMM:GemmBwd1x1_stride1,9.16204,0,MIOpenGEMM,0_1_196_1024_196_196_1024_256
64-56-56-1x1-64-56-56-128-0x0-1x1-1x1-0-NCHW-FP32-B=miopenConvolutionBwdDataAlgoDirect:ConvAsm1x1U,1.47393,0,miopenConvolutionBwdDataAlgoDirect,<unused>;miopenConvolutionBwdDataAlgoGEMM:GemmBwd1x1_stride1,14.1048,0,MIOpenGEMM,0_1_3136_64_3136_3136_64_64
1024-14-14-1x1-256-14-14-128-0x0-1x1-1x1-0-NCHW-FP32-W=miopenConvolutionBwdWeightsAlgoDirect:ConvAsmBwdWrW1x1,2.55763,0,miopenConvolutionBwdWeightsAlgoDirect,<unused>;miopenConvolutionBwdWeightsAlgoGEMM:GemmWrw1x1_stride1,20.308,0,MIOpenGEMM,1_0_196_196_256_256_1024_196;miopenConvolutionBwdWeightsAlgoWinograd:ConvBinWinogradRxSf2x3,22.6225,0,miopenConvolutionBwdWeightsAlgoWinograd,1024x14x14x1x1x256x14x14x128xNCHWxFP32x0x0x1x1x1x1x1x0
64-112-112-7x7-3-230-230-128-0x0-2x2-1x1-0-NCHW-FP32-W=miopenConvolutionBwdWeightsAlgoDirect:ConvOclBwdWrW2<8>,11.5403,602112,miopenConvolutionBwdWeightsAlgoDirect,<unused>;miopenConvolutionBwdWeightsAlgoGEMM:GemmWrwUniversal,91.5104,7375872,MIOpenGEMM,1_0_12544_12544_147_147_64_12544
256-14-14-3x3-256-14-14-128-1x1-1x1-1x1-0-NCHW-FP32-W=miopenConvolutionBwdWeightsAlgoDirect:ConvAsmBwdWrW3x3,6.14234,0,miopenConvolutionBwdWeightsAlgoDirect,<unused>;miopenConvolutionBwdWeightsAlgoWinograd:ConvBinWinogradRxS,7.05357,0,miopenConvolutionBwdWeightsAlgoWinograd,256x14x14x3x3x256x14x14x128xNCHWxFP32x1x1x1x1x1x1x1x0;miopenConvolutionBwdWeightsAlgoImplicitGEMM:ConvHipImplicitGemmV4R1WrW,15.8135,0,miopenConvolutionBwdWeightsAlgoImplicitGEMM,256x14x14x3x3x256x14x14x128xNCHWxFP32x1x1x1x1x1x1x1x0;miopenConvolutionBwdWeightsAlgoGEMM:GemmWrwUniversal,247.21,1806336,MIOpenGEMM,1_0_196_196_2304_2304_256_196
64-56-56-1x1-64-56-56-128-0x0-1x1-1x1-0-NCHW-FP32-F=miopenConvolutionFwdAlgoDirect:ConvAsm1x1U,1.16218,0,miopenConvolutionFwdAlgoDirect,<unused>;miopenConvolutionFwdAlgoGEMM:GemmFwd1x1_0_1,14.7313,0,MIOpenGEMM,0_0_3136_64_3136_3136_64_64
1024-14-14-1x1-256-14-14-128-0x0-1x1-1x1-0-NCHW-FP32-F=miopenConvolutionFwdAlgoDirect:ConvAsm1x1U,2.90753,0,miopenConvolutionFwdAlgoDirect,<unused>;miopenConvolutionFwdAlgoWinograd:ConvBinWinogradRxSf3x2,4.75138,0,miopenConvolutionFwdAlgoWinograd,<unused>;miopenConvolutionFwdAlgoGEMM:GemmFwd1x1_0_1,15.0973,0,MIOpenGEMM,0_0_196_1024_196_196_256_1024
3-230-230-7x7-64-112-112-128-0x0-2x2-1x1-0-NCHW-FP32-F=miopenConvolutionFwdAlgoWinograd:ConvBinWinogradRxS,8.07499,0,miopenConvolutionFwdAlgoWinograd,<unused>;miopenConvolutionFwdAlgoDirect:ConvOclDirectFwd,8.08127,0,miopenConvolutionFwdAlgoDirect,<unused>;miopenConvolutionFwdAlgoGEMM:GemmFwdRest,287.53,7375872,MIOpenGEMM,0_0_12544_147_12544_12544_64_147
192-13-13-3x3-384-13-13-512-1x1-1x1-1x1-0-NCHW-FP32-F=miopenConvolutionFwdAlgoWinograd:ConvBinWinogradRxS,7.60212,0,miopenConvolutionFwdAlgoWinograd,<unused>
256-14-14-3x3-256-14-14-128-1x1-1x1-1x1-0-NCHW-FP32-F=miopenConvolutionFwdAlgoWinograd:ConvBinWinogradRxS,2.11547,0,miopenConvolutionFwdAlgoWinograd,<unused>
512-28-28-3x3-512-28-28-32-1x1-1x1-1x1-0-NCHW-FP32-F_g32=miopenConvolutionFwdAlgoImplicitGEMM:ConvHipImplicitGemmV4R1Fwd,1.04766,0,miopenConvolutionFwdAlgoImplicitGEMM,512x28x28x3x3x512x28x28x32xNCHWxFP32x1x1x1x1x1x1x32x1;miopenConvolutionFwdAlgoWinograd:ConvBinWinogradRxSf2x3,1.14162,0,miopenConvolutionFwdAlgoWinograd,<unused>;miopenConvolutionFwdAlgoDirect:ConvAsm3x3U,1.30216,0,miopenConvolutionFwdAlgoDirect,<unused>;miopenConvolutionFwdAlgoGEMM:GemmFwdRest,18.0516,14450688,MIOpenGEMM,0_0_784_144_784_784_16_144
2048-7-7-1x1-1024-14-14-128-0x0-2x2-1x1-0-NCHW-FP32-B=miopenConvolutionBwdDataAlgoDirect:ConvAsm1x1U,5.59168,25690112,miopenConvolutionBwdDataAlgoDirect,<unused>;miopenConvolutionBwdDataAlgoGEMM:GemmBwd1x1_stride2,35.9905,77070336,MIOpenGEMM,0_1_6272_1024_6272_6272_1024_2048;miopenConvolutionBwdDataAlgoWinograd:ConvBinWinogradRxSf2x3,119.502,0,miopenConvolutionBwdDataAlgoWinograd,<unused>
256-56-56-1x1-64-56-56-128-0x0-1x1-1x1-0-NCHW-FP32-F=miopenConvolutionFwdAlgoDirect:ConvAsm1x1U,2.24895,0,miopenConvolutionFwdAlgoDirect,<unused>
2048-7-7-1x1-1024-14-14-128-0x0-2x2-1x1-0-NCHW-FP32-W=miopenConvolutionBwdWeightsAlgoImplicitGEMM:ConvHipImplicitGemmV4R1WrW,6.56574,0,miopenConvolutionBwdWeightsAlgoImplicitGEMM,2048x7x7x1x1x1024x14x14x128xNCHWxFP32x0x0x2x2x1x1x1x0;miopenConvolutionBwdWeightsAlgoDirect:ConvAsmBwdWrW1x1,7.47868,25690112,miopenConvolutionBwdWeightsAlgoDirect,<unused>;miopenConvolutionBwdWeightsAlgoGEMM:GemmWrwUniversal,55.5585,200704,MIOpenGEMM,1_0_49_49_1024_1024_2048_49
64-56-56-1x1-256-56-56-128-0x0-1x1-1x1-0-NCHW-FP32-F=miopenConvolutionFwdAlgoDirect:ConvOclDirectFwd1x1,3.51569,0,miopenConvolutionFwdAlgoDirect,<unused>
256-14-14-1x1-512-28-28-128-0x0-2x2-1x1-0-NCHW-FP32-B=miopenConvolutionBwdDataAlgoDirect:ConvAsm1x1UV2,1.75225,0,miopenConvolutionBwdDataAlgoDirect,<unused>;miopenConvolutionBwdDataAlgoGEMM:GemmBwd1x1_stride2,11.4655,77070336,MIOpenGEMM,0_1_25088_512_25088_25088_512_256;miopenConvolutionBwdDataAlgoWinograd:ConvBinWinogradRxSf2x3,19.392,0,miopenConvolutionBwdDataAlgoWinograd,<unused>
512-28-28-1x1-128-28-28-128-0x0-1x1-1x1-0-NCHW-FP32-W=miopenConvolutionBwdWeightsAlgoDirect:ConvAsmBwdWrW1x1,2.36451,0,miopenConvolutionBwdWeightsAlgoDirect,<unused>
256-56-56-1x1-64-56-56-128-0x0-1x1-1x1-0-NCHW-FP32-W=miopenConvolutionBwdWeightsAlgoDirect:ConvAsmBwdWrW1x1,13.3981,0,miopenConvolutionBwdWeightsAlgoDirect,<unused>
128-28-28-1x1-512-28-28-128-0x0-1x1-1x1-0-NCHW-FP32-W=miopenConvolutionBwdWeightsAlgoDirect:ConvAsmBwdWrW1x1,6.15867,0,miopenConvolutionBwdWeightsAlgoDirect,<unused>
64-56-56-1x1-256-56-56-128-0x0-1x1-1x1-0-NCHW-FP32-W=miopenConvolutionBwdWeightsAlgoDirect:ConvAsmBwdWrW1x1,8.46167,0,miopenConvolutionBwdWeightsAlgoDirect,<unused>
256-14-14-1x1-512-28-28-128-0x0-2x2-1x1-0-NCHW-FP32-W=miopenConvolutionBwdWeightsAlgoDirect:ConvAsmBwdWrW1x1,1.90043,51380224,miopenConvolutionBwdWeightsAlgoDirect,<unused>;miopenConvolutionBwdWeightsAlgoImplicitGEMM:ConvHipImplicitGemmV4R1WrW,5.16305,0,miopenConvolutionBwdWeightsAlgoImplicitGEMM,256x14x14x1x1x512x28x28x128xNCHWxFP32x0x0x2x2x1x1x1x0;miopenConvolutionBwdWeightsAlgoGEMM:GemmWrwUniversal,9.19598,401408,MIOpenGEMM,1_0_196_196_512_512_256_196
128-112-112-3x3-128-112-112-128-1x1-1x1-1x1-0-NCHW-FP32-F=miopenConvolutionFwdAlgoWinograd:ConvBinWinogradRxSf3x2,48.6886,0,miopenConvolutionFwdAlgoWinograd,<unused>
192-27-27-5x5-64-27-27-512-2x2-1x1-1x1-0-NCHW-FP32-B=miopenConvolutionBwdDataAlgoWinograd:ConvBinWinogradRxSf2x3,23.9973,0,miopenConvolutionBwdDataAlgoWinograd,<unused>;miopenConvolutionBwdDataAlgoFFT:fft,71.9965,963706880,miopenConvolutionBwdDataAlgoFFT,192x27x27x5x5x64x27x27x512xNCHWxFP32x2x2x1x1x1x1x1x0;miopenConvolutionBwdDataAlgoDirect:ConvOclDirectFwd,183.406,0,miopenConvolutionBwdDataAlgoDirect,<unused>;miopenConvolutionBwdDataAlgoImplicitGEMM:ConvHipImplicitGemmBwdDataV1R1,234.248,0,miopenConvolutionBwdDataAlgoImplicitGEMM,192x27x27x5x5x64x27x27x512xNCHWxFP32x2x2x1x1x1x1x1x0;miopenConvolutionBwdDataAlgoGEMM:GemmBwdRest,1788.9,4665600,MIOpenGEMM,0_1_729_1600_729_729_1600_192
512-7-7-3x3-512-7-7-128-1x1-1x1-1x1-0-NCHW-FP32-W=miopenConvolutionBwdWeightsAlgoWinograd:ConvBinWinogradRxS,4.11282,0,miopenConvolutionBwdWeightsAlgoWinograd,512x7x7x3x3x512x7x7x128xNCHWxFP32x1x1x1x1x1x1x1x0;miopenConvolutionBwdWeightsAlgoDirect:ConvAsmBwdWrW3x3,7.85078,0,miopenConvolutionBwdWeightsAlgoDirect,<unused>;miopenConvolutionBwdWeightsAlgoImplicitGEMM:ConvHipImplicitGemmV4R1WrW,28.5551,0,miopenConvolutionBwdWeightsAlgoImplicitGEMM,512x7x7x3x3x512x7x7x128xNCHWxFP32x1x1x1x1x1x1x1x0;miopenConvolutionBwdWeightsAlgoGEMM:GemmWrwUniversal,572.762,903168,MIOpenGEMM,1_0_49_49_4608_4608_512_49
256-56-56-1x1-64-56-56-128-0x0-1x1-1x1-0-NCHW-FP32-B=miopenConvolutionBwdDataAlgoDirect:ConvAsm1x1U,3.3139,0,miopenConvolutionBwdDataAlgoDirect,<unused>;miopenConvolutionBwdDataAlgoGEMM:GemmBwd1x1_stride1,8.41978,0,MIOpenGEMM,0_1_3136_64_3136_3136_64_256
512-28-28-1x1-128-28-28-128-0x0-1x1-1x1-0-NCHW-FP32-B=miopenConvolutionBwdDataAlgoDirect:ConvAsm1x1U,2.79288,0,miopenConvolutionBwdDataAlgoDirect,<unused>;miopenConvolutionBwdDataAlgoWinograd:ConvBinWinogradRxSf3x2,6.04862,0,miopenConvolutionBwdDataAlgoWinograd,<unused>;miopenConvolutionBwdDataAlgoGEMM:GemmBwd1x1_stride1,7.84376,0,MIOpenGEMM,0_1_784_128_784_784_128_512
1024-14-14-1x1-256-14-14-128-0x0-1x1-1x1-0-NCHW-FP32-B=miopenConvolutionBwdDataAlgoDirect:ConvOclDirectFwd1x1,11.6555,0,miopenConvolutionBwdDataAlgoDirect,<unused>;miopenConvolutionBwdDataAlgoGEMM:GemmBwd1x1_stride1,44.6012,0,MIOpenGEMM,0_1_196_256_196_196_256_1024
128-28-28-1x1-512-28-28-128-0x0-1x1-1x1-0-NCHW-FP32-B=miopenConvolutionBwdDataAlgoDirect:ConvAsm1x1U,2.48515,0,miopenConvolutionBwdDataAlgoDirect,<unused>;miopenConvolutionBwdDataAlgoGEMM:GemmBwd1x1_stride1,7.34865,0,MIOpenGEMM,0_1_784_512_784_784_512_128;miopenConvolutionBwdDataAlgoWinograd:ConvBinWinogradRxSf3x2,7.64207,0,miopenConvolutionBwdDataAlgoWinograd,<unused>
64-56-56-1x1-256-56-56-128-0x0-1x1-1x1-0-NCHW-FP32-B=miopenConvolutionBwdDataAlgoDirect:ConvAsm1x1U,6.51405,0,miopenConvolutionBwdDataAlgoDirect,<unused>
256-56-56-3x3-256-56-56-128-1x1-1x1-1x1-0-NCHW-FP32-B=miopenConvolutionBwdDataAlgoWinograd:ConvBinWinograd3x3U,57.2668,0,miopenConvolutionBwdDataAlgoWinograd,<unused>
64-112-112-3x3-128-112-112-128-1x1-1x1-1x1-0-NCHW-FP32-F=miopenConvolutionFwdAlgoWinograd:ConvBinWinogradRxSf2x3,13.3333,0,miopenConvolutionFwdAlgoWinograd,<unused>
512-28-28-1x1-256-56-56-128-0x0-2x2-1x1-0-NCHW-FP32-W=miopenConvolutionBwdWeightsAlgoDirect:ConvAsmBwdWrW1x1,42.479,102760448,miopenConvolutionBwdWeightsAlgoDirect,<unused>;miopenConvolutionBwdWeightsAlgoImplicitGEMM:ConvHipImplicitGemmV4R1WrW,96.3086,0,miopenConvolutionBwdWeightsAlgoImplicitGEMM,512x28x28x1x1x256x56x56x128xNCHWxFP32x0x0x2x2x1x1x1x0;miopenConvolutionBwdWeightsAlgoGEMM:GemmWrwUniversal,230.518,802816,MIOpenGEMM,1_0_784_784_256_256_512_784
1024-14-14-1x1-2048-7-7-128-0x0-2x2-1x1-0-NCHW-FP32-F=miopenConvolutionFwdAlgoDirect:ConvAsm1x1U,9.07386,25690112,miopenConvolutionFwdAlgoDirect,<unused>;miopenConvolutionFwdAlgoWinograd:ConvBinWinogradRxSf2x3,46.5945,0,miopenConvolutionFwdAlgoWinograd,<unused>
3-224-224-3x3-64-224-224-128-1x1-1x1-1x1-0-NCHW-FP32-F=miopenConvolutionFwdAlgoWinograd:ConvBinWinogradRxSf2x3,20.677,0,miopenConvolutionFwdAlgoWinograd,<unused>;miopenConvolutionFwdAlgoDirect:ConvOclDirectFwd,20.8685,0,miopenConvolutionFwdAlgoDirect,<unused>;miopenConvolutionFwdAlgoGEMM:GemmFwdRest,426.815,5419008,MIOpenGEMM,0_0_50176_27_50176_50176_64_27
256-56-56-3x3-256-56-56-128-1x1-1x1-1x1-0-NCHW-FP32-F=miopenConvolutionFwdAlgoWinograd:ConvBinWinogradRxSf2x3,24.0914,0,miopenConvolutionFwdAlgoWinograd,<unused>
128-28-28-1x1-512-28-28-128-0x0-1x1-1x1-0-NCHW-FP32-F=miopenConvolutionFwdAlgoDirect:ConvAsm1x1U,2.95177,0,miopenConvolutionFwdAlgoDirect,<unused>;miopenConvolutionFwdAlgoWinograd:ConvBinWinogradRxSf3x2,11.3871,0,miopenConvolutionFwdAlgoWinograd,<unused>;miopenConvolutionFwdAlgoGEMM:GemmFwd1x1_0_1,13.1373,0,MIOpenGEMM,0_0_784_128_784_784_512_128
384-13-13-3x3-384-13-13-512-1x1-1x1-1x1-0-NCHW-FP32-F=miopenConvolutionFwdAlgoWinograd:ConvBinWinogradRxSf2x3,15.6846,0,miopenConvolutionFwdAlgoWinograd,<unused>
128-28-28-3x3-128-28-28-128-1x1-1x1-1x1-0-NCHW-FP32-W=miopenConvolutionBwdWeightsAlgoDirect:ConvAsmBwdWrW3x3,5.91843,0,miopenConvolutionBwdWeightsAlgoDirect,<unused>;miopenConvolutionBwdWeightsAlgoWinograd:ConvBinWinogradRxS,13.9569,0,miopenConvolutionBwdWeightsAlgoWinograd,128x28x28x3x3x128x28x28x128xNCHWxFP32x1x1x1x1x1x1x1x0;miopenConvolutionBwdWeightsAlgoImplicitGEMM:ConvHipImplicitGemmV4R1WrW,24.971,0,miopenConvolutionBwdWeightsAlgoImplicitGEMM,128x28x28x3x3x128x28x28x128xNCHWxFP32x1x1x1x1x1x1x1x0;miopenConvolutionBwdWeightsAlgoGEMM:GemmWrwUniversal,288.938,3612672,MIOpenGEMM,1_0_784_784_1152_1152_128_784
192-28-28-3x3-128-28-28-128-1x1-1x1-1x1-0-NCHW-FP32-W=miopenConvolutionBwdWeightsAlgoDirect:ConvAsmBwdWrW3x3,5.70883,0,miopenConvolutionBwdWeightsAlgoDirect,<unused>;miopenConvolutionBwdWeightsAlgoWinograd:ConvBinWinogradRxSf2x3,8.28365,0,miopenConvolutionBwdWeightsAlgoWinograd,192x28x28x3x3x128x28x28x128xNCHWxFP32x1x1x1x1x1x1x1x0;miopenConvolutionBwdWeightsAlgoGEMM:GemmWrwUniversal,13.1829,3612672,MIOpenGEMM,1_0_784_784_1152_1152_192_784;miopenConvolutionBwdWeightsAlgoImplicitGEMM:ConvHipImplicitGemmV4R1WrW,14.972,0,miopenConvolutionBwdWeightsAlgoImplicitGEMM,192x28x28x3x3x128x28x28x128xNCHWxFP32x1x1x1x1x1x1x1x0
160-14-14-3x3-320-14-14-128-1x1-1x1-1x1-0-NCHW-FP32-F=miopenConvolutionFwdAlgoWinograd:ConvBinWinogradRxSf2x3,1.63468,0,miopenConvolutionFwdAlgoWinograd,<unused>
64-224-224-3x3-64-224-224-128-1x1-1x1-1x1-0-NCHW-FP32-B=miopenConvolutionBwdDataAlgoWinograd:ConvBinWinogradRxSf3x2,48.6286,0,miopenConvolutionBwdDataAlgoWinograd,<unused>
512-28-28-3x3-512-28-28-128-1x1-1x1-1x1-0-NCHW-FP32-W=miopenConvolutionBwdWeightsAlgoDirect:ConvAsmBwdWrW3x3,66.0209,0,miopenConvolutionBwdWeightsAlgoDirect,<unused>;miopenConvolutionBwdWeightsAlgoImplicitGEMM:ConvHipImplicitGemmV4R1WrW,73.8372,0,miopenConvolutionBwdWeightsAlgoImplicitGEMM,512x28x28x3x3x512x28x28x128xNCHWxFP32x1x1x1x1x1x1x1x0;miopenConvolutionBwdWeightsAlgoWinograd:ConvBinWinogradRxS,166.918,0,miopenConvolutionBwdWeightsAlgoWinograd,512x28x28x3x3x512x28x28x128xNCHWxFP32x1x1x1x1x1x1x1x0;miopenConvolutionBwdWeightsAlgoGEMM:GemmWrwUniversal,242.216,14450688,MIOpenGEMM,1_0_784_784_4608_4608_512_784
32-28-28-5x5-16-28-28-128-2x2-1x1-1x1-0-NCHW-FP32-W=miopenConvolutionBwdWeightsAlgoDirect:ConvOclBwdWrW53,0.425779,6553600,miopenConvolutionBwdWeightsAlgoDirect,<unused>;miopenConvolutionBwdWeightsAlgoWinograd:ConvBinWinogradRxSf2x3,3.25487,0,miopenConvolutionBwdWeightsAlgoWinograd,32x28x28x5x5x16x28x28x128xNCHWxFP32x2x2x1x1x1x1x1x0;miopenConvolutionBwdWeightsAlgoGEMM:GemmWrwUniversal,5.5216,1254400,MIOpenGEMM,1_0_784_784_400_400_32_784
256-28-28-1x1-64-28-28-128-0x0-1x1-1x1-0-NCHW-FP32-F=miopenConvolutionFwdAlgoDirect:ConvOclDirectFwd1x1,0.58198,0,miopenConvolutionFwdAlgoDirect,<unused>;miopenConvolutionFwdAlgoWinograd:ConvBinWinogradRxSf3x2,1.09201,0,miopenConvolutionFwdAlgoWinograd,<unused>;miopenConvolutionFwdAlgoGEMM:GemmFwd1x1_0_1,4.51945,0,MIOpenGEMM,0_0_784_256_784_784_64_256
32-28-28-5x5-16-28-28-128-2x2-1x1-1x1-0-NCHW-FP32-B=miopenConvolutionBwdDataAlgoWinograd:ConvBinWinogradRxS,0.461313,0,miopenConvolutionBwdDataAlgoWinograd,<unused>;miopenConvolutionBwdDataAlgoDirect:ConvOclDirectFwd,1.71285,0,miopenConvolutionBwdDataAlgoDirect,<unused>;miopenConvolutionBwdDataAlgoFFT:fft,4.9128,41222144,miopenConvolutionBwdDataAlgoFFT,32x28x28x5x5x16x28x28x128xNCHWxFP32x2x2x1x1x1x1x1x0;miopenConvolutionBwdDataAlgoGEMM:GemmBwdRest,20.7887,1254400,MIOpenGEMM,0_1_784_400_784_784_400_32
384-7-7-3x3-192-7-7-128-1x1-1x1-1x1-0-NCHW-FP32-W=miopenConvolutionBwdWeightsAlgoDirect:ConvAsmBwdWrW3x3,1.53696,0,miopenConvolutionBwdWeightsAlgoDirect,<unused>;miopenConvolutionBwdWeightsAlgoWinograd:ConvBinWinogradRxS,1.5528,0,miopenConvolutionBwdWeightsAlgoWinograd,384x7x7x3x3x192x7x7x128xNCHWxFP32x1x1x1x1x1x1x1x0;miopenConvolutionBwdWeightsAlgoImplicitGEMM:ConvHipImplicitGemmV4R1WrW,2.29691,0,miopenConvolutionBwdWeightsAlgoImplicitGEMM,384x7x7x3x3x192x7x7x128xNCHWxFP32x1x1x1x1x1x1x1x0;miopenConvolutionBwdWeightsAlgoGEMM:GemmWrwUniversal,8.50225,338688,MIOpenGEMM,1_0_49_49_1728_1728_384_49
192-28-28-3x3-128-28-28-128-1x1-1x1-1x1-0-NCHW-FP32-B=miopenConvolutionBwdDataAlgoWinograd:ConvBinWinograd3x3U,2.83547,0,miopenConvolutionBwdDataAlgoWinograd,<unused>
384-7-7-3x3-192-7-7-128-1x1-1x1-1x1-0-NCHW-FP32-B=miopenConvolutionBwdDataAlgoWinograd:ConvBinWinograd3x3U,0.499286,0,miopenConvolutionBwdDataAlgoWinograd,<unused>
128-28-28-3x3-192-28-28-128-1x1-1x1-1x1-0-NCHW-FP32-F=miopenConvolutionFwdAlgoWinograd:ConvBinWinograd3x3U,2.26479,0,miopenConvolutionFwdAlgoWinograd,<unused>
512-28-28-3x3-512-28-28-128-1x1-1x1-1x1-0-NCHW-FP32-B=miopenConvolutionBwdDataAlgoWinograd:ConvBinWinogradRxSf2x3,24.3047,0,miopenConvolutionBwdDataAlgoWinograd,<unused>
512-28-28-3x3-256-28-28-128-1x1-1x1-1x1-0-NCHW-FP32-W=miopenConvolutionBwdWeightsAlgoDirect:ConvAsmBwdWrW3x3,36.4016,0,miopenConvolutionBwdWeightsAlgoDirect,<unused>;miopenConvolutionBwdWeightsAlgoImplicitGEMM:ConvHipImplicitGemmV4R1WrW,46.7936,0,miopenConvolutionBwdWeightsAlgoImplicitGEMM,512x28x28x3x3x256x28x28x128xNCHWxFP32x1x1x1x1x1x1x1x0;miopenConvolutionBwdWeightsAlgoWinograd:ConvBinWinogradRxS,56.7263,0,miopenConvolutionBwdWeightsAlgoWinograd,512x28x28x3x3x256x28x28x128xNCHWxFP32x1x1x1x1x1x1x1x0;miopenConvolutionBwdWeightsAlgoGEMM:GemmWrwUniversal,94.4131,7225344,MIOpenGEMM,1_0_784_784_2304_2304_512_784
32-28-28-1x1-256-28-28-128-0x0-1x1-1x1-0-NCHW-FP32-W=miopenConvolutionBwdWeightsAlgoDirect:ConvAsmBwdWrW1x1,0.509401,0,miopenConvolutionBwdWeightsAlgoDirect,<unused>
256-13-13-3x3-384-13-13-512-1x1-1x1-1x1-0-NCHW-FP32-W=miopenConvolutionBwdWeightsAlgoWinograd:ConvBinWinogradRxS,25.9866,0,miopenConvolutionBwdWeightsAlgoWinograd,256x13x13x3x3x384x13x13x512xNCHWxFP32x1x1x1x1x1x1x1x0;miopenConvolutionBwdWeightsAlgoDirect:ConvAsmBwdWrW3x3,33.8976,0,miopenConvolutionBwdWeightsAlgoDirect,<unused>;miopenConvolutionBwdWeightsAlgoImplicitGEMM:ConvHipImplicitGemmV4R1WrW,34.4406,0,miopenConvolutionBwdWeightsAlgoImplicitGEMM,256x13x13x3x3x384x13x13x512xNCHWxFP32x1x1x1x1x1x1x1x0;miopenConvolutionBwdWeightsAlgoGEMM:GemmWrwUniversal,675.484,2336256,MIOpenGEMM,1_0_169_169_3456_3456_256_169
32-28-28-1x1-192-28-28-128-0x0-1x1-1x1-0-NCHW-FP32-B=miopenConvolutionBwdDataAlgoDirect:ConvAsm1x1U,0.285229,0,miopenConvolutionBwdDataAlgoDirect,<unused>;miopenConvolutionBwdDataAlgoWinograd:ConvBinWinogradRxSf3x2,0.776035,0,miopenConvolutionBwdDataAlgoWinograd,<unused>;miopenConvolutionBwdDataAlgoGEMM:GemmBwd1x1_stride1,1.89423,0,MIOpenGEMM,0_1_784_192_784_784_192_32
192-7-7-3x3-384-7-7-128-1x1-1x1-1x1-0-NCHW-FP32-F=miopenConvolutionFwdAlgoWinograd:ConvBinWinogradRxS,0.736113,0,miopenConvolutionFwdAlgoWinograd,<unused>
512-14-14-3x3-512-14-14-128-1x1-1x1-1x1-0-NCHW-FP32-W=miopenConvolutionBwdWeightsAlgoDirect:ConvAsmBwdWrW3x3,22.2446,0,miopenConvolutionBwdWeightsAlgoDirect,<unused>;miopenConvolutionBwdWeightsAlgoWinograd:ConvBinWinogradRxSf2x3,41.4038,0,miopenConvolutionBwdWeightsAlgoWinograd,512x14x14x3x3x512x14x14x128xNCHWxFP32x1x1x1x1x1x1x1x0;miopenConvolutionBwdWeightsAlgoImplicitGEMM:ConvHipImplicitGemmV4R1WrW,44.8778,0,miopenConvolutionBwdWeightsAlgoImplicitGEMM,512x14x14x3x3x512x14x14x128xNCHWxFP32x1x1x1x1x1x1x1x0;miopenConvolutionBwdWeightsAlgoGEMM:GemmWrwUniversal,508.209,3612672,MIOpenGEMM,1_0_196_196_4608_4608_512_196
512-28-28-3x3-256-28-28-128-1x1-1x1-1x1-0-NCHW-FP32-B=miopenConvolutionBwdDataAlgoWinograd:ConvBinWinogradRxSf2x3,20.4727,0,miopenConvolutionBwdDataAlgoWinograd,<unused>
16-28-28-5x5-32-28-28-128-2x2-1x1-1x1-0-NCHW-FP32-F=miopenConvolutionFwdAlgoWinograd:ConvBinWinogradRxSf2x3,0.235055,0,miopenConvolutionFwdAlgoWinograd,<unused>;miopenConvolutionFwdAlgoImplicitGEMM:ConvHipImplicitGemmV4R1Fwd,0.538455,0,miopenConvolutionFwdAlgoImplicitGEMM,16x28x28x5x5x32x28x28x128xNCHWxFP32x2x2x1x1x1x1x1x1;miopenConvolutionFwdAlgoFFT:fft,0.72547,36208640,miopenConvolutionFwdAlgoFFT,16x28x28x5x5x32x28x28x128xNCHWxFP32x2x2x1x1x1x1x1x1;miopenConvolutionFwdAlgoDirect:ConvOclDirectFwd,1.06887,0,miopenConvolutionFwdAlgoDirect,<unused>;miopenConvolutionFwdAlgoGEMM:GemmFwdRest,10.1426,1254400,MIOpenGEMM,0_0_784_400_784_784_32_400
64-14-14-5x5-32-14-14-128-2x2-1x1-1x1-0-NCHW-FP32-B=miopenConvolutionBwdDataAlgoWinograd:ConvBinWinogradRxSf2x3,0.238282,0,miopenConvolutionBwdDataAlgoWinograd,<unused>;miopenConvolutionBwdDataAlgoFFT:fft,0.381493,29859840,miopenConvolutionBwdDataAlgoFFT,64x14x14x5x5x32x14x14x128xNCHWxFP32x2x2x1x1x1x1x1x0;miopenConvolutionBwdDataAlgoDirect:ConvOclDirectFwd,0.698741,0,miopenConvolutionBwdDataAlgoDirect,<unused>;miopenConvolutionBwdDataAlgoImplicitGEMM:ConvHipImplicitGemmBwdDataV1R1,1.55479,0,miopenConvolutionBwdDataAlgoImplicitGEMM,64x14x14x5x5x32x14x14x128xNCHWxFP32x2x2x1x1x1x1x1x0;miopenConvolutionBwdDataAlgoGEMM:GemmBwdRest,5.59776,627200,MIOpenGEMM,0_1_196_800_196_196_800_64
256-28-28-3x3-512-28-28-128-1x1-1x1-1x1-0-NCHW-FP32-F=miopenConvolutionFwdAlgoWinograd:ConvBinWinogradRxSf2x3,19.7272,0,miopenConvolutionFwdAlgoWinograd,<unused>
32-28-28-1x1-256-28-28-128-0x0-1x1-1x1-0-NCHW-FP32-B=miopenConvolutionBwdDataAlgoDirect:ConvAsm1x1U,0.38462,0,miopenConvolutionBwdDataAlgoDirect,<unused>;miopenConvolutionBwdDataAlgoWinograd:ConvBinWinogradRxSf3x2,0.750005,0,miopenConvolutionBwdDataAlgoWinograd,<unused>;miopenConvolutionBwdDataAlgoGEMM:GemmBwd1x1_stride1,3.02711,0,MIOpenGEMM,0_1_784_256_784_784_256_32
128-7-7-5x5-48-7-7-128-2x2-1x1-1x1-0-NCHW-FP32-W=miopenConvolutionBwdWeightsAlgoWinograd:ConvBinWinogradRxSf2x3,0.543027,0,miopenConvolutionBwdWeightsAlgoWinograd,128x7x7x5x5x48x7x7x128xNCHWxFP32x2x2x1x1x1x1x1x0;miopenConvolutionBwdWeightsAlgoDirect:ConvOclBwdWrW2<16>,1.4634,4915200,miopenConvolutionBwdWeightsAlgoDirect,<unused>;miopenConvolutionBwdWeightsAlgoGEMM:GemmWrwUniversal,6.89127,235200,MIOpenGEMM,1_0_49_49_1200_1200_128_49
48-14-14-5x5-16-14-14-128-2x2-1x1-1x1-0-NCHW-FP32-W=miopenConvolutionBwdWeightsAlgoDirect:ConvOclBwdWrW53,0.279596,9830400,miopenConvolutionBwdWeightsAlgoDirect,<unused>;miopenConvolutionBwdWeightsAlgoWinograd:ConvBinWinogradRxSf2x3,1.2736,0,miopenConvolutionBwdWeightsAlgoWinograd,48x14x14x5x5x16x14x14x128xNCHWxFP32x2x2x1x1x1x1x1x0;miopenConvolutionBwdWeightsAlgoGEMM:GemmWrwUniversal,6.71619,313600,MIOpenGEMM,1_0_196_196_400_400_48_196
32-14-14-5x5-64-14-14-128-2x2-1x1-1x1-0-NCHW-FP32-F=miopenConvolutionFwdAlgoWinograd:ConvBinWinogradRxSf2x3,0.371154,0,miopenConvolutionFwdAlgoWinograd,<unused>;miopenConvolutionFwdAlgoFFT:fft,0.508077,23777280,miopenConvolutionFwdAlgoFFT,32x14x14x5x5x64x14x14x128xNCHWxFP32x2x2x1x1x1x1x1x1;miopenConvolutionFwdAlgoImplicitGEMM:ConvHipImplicitGemmV4R1Fwd,1.00571,0,miopenConvolutionFwdAlgoImplicitGEMM,32x14x14x5x5x64x14x14x128xNCHWxFP32x2x2x1x1x1x1x1x1;miopenConvolutionFwdAlgoDirect:ConvOclDirectFwd,1.14886,0,miopenConvolutionFwdAlgoDirect,<unused>;miopenConvolutionFwdAlgoGEMM:GemmFwdRest,13.3061,627200,MIOpenGEMM,0_0_196_800_196_196_64_800
128-7-7-5x5-48-7-7-128-2x2-1x1-1x1-0-NCHW-FP32-B=miopenConvolutionBwdDataAlgoWinograd:ConvBinWinogradRxSf2x3,0.254682,0,miopenConvolutionBwdDataAlgoWinograd,<unused>;miopenConvolutionBwdDataAlgoFFT:fft,0.421593,30449664,miopenConvolutionBwdDataAlgoFFT,128x7x7x5x5x48x7x7x128xNCHWxFP32x2x2x1x1x1x1x1x0;miopenConvolutionBwdDataAlgoDirect:ConvOclDirectFwd,0.943516,0,miopenConvolutionBwdDataAlgoDirect,<unused>;miopenConvolutionBwdDataAlgoGEMM:GemmBwdRest,7.52479,235200,MIOpenGEMM,0_1_49_1200_49_49_1200_128
128-112-112-3x3-64-112-112-128-1x1-1x1-1x1-0-NCHW-FP32-W=miopenConvolutionBwdWeightsAlgoDirect:ConvAsmBwdWrW3x3,67.2201,0,miopenConvolutionBwdWeightsAlgoDirect,<unused>;miopenConvolutionBwdWeightsAlgoWinograd:ConvBinWinogradRxS,225.758,0,miopenConvolutionBwdWeightsAlgoWinograd,128x112x112x3x3x64x112x112x128xNCHWxFP32x1x1x1x1x1x1x1x0;miopenConvolutionBwdWeightsAlgoImplicitGEMM:ConvHipImplicitGemmV4R1WrW,252.902,0,miopenConvolutionBwdWeightsAlgoImplicitGEMM,128x112x112x3x3x64x112x112x128xNCHWxFP32x1x1x1x1x1x1x1x0;miopenConvolutionBwdWeightsAlgoGEMM:GemmWrwUniversal,1124.26,28901376,MIOpenGEMM,1_0_12544_12544_576_576_128_12544
48-14-14-5x5-16-14-14-128-2x2-1x1-1x1-0-NCHW-FP32-B=miopenConvolutionBwdDataAlgoWinograd:ConvBinWinogradRxSf2x3,0.244617,0,miopenConvolutionBwdDataAlgoWinograd,<unused>;miopenConvolutionBwdDataAlgoDirect:ConvOclDirectFwd,1.25496,0,miopenConvolutionBwdDataAlgoDirect,<unused>;miopenConvolutionBwdDataAlgoFFT:fft,1.46443,20275200,miopenConvolutionBwdDataAlgoFFT,48x14x14x5x5x16x14x14x128xNCHWxFP32x2x2x1x1x1x1x1x0;miopenConvolutionBwdDataAlgoGEMM:GemmBwdRest,90.3909,313600,MIOpenGEMM,0_1_196_400_196_196_400_48
256-14-14-3x3-128-14-14-128-1x1-1x1-1x1-0-NCHW-FP32-W=miopenConvolutionBwdWeightsAlgoWinograd:ConvBinWinogradRxS,1.86735,0,miopenConvolutionBwdWeightsAlgoWinograd,256x14x14x3x3x128x14x14x128xNCHWxFP32x1x1x1x1x1x1x1x0;miopenConvolutionBwdWeightsAlgoDirect:ConvAsmBwdWrW3x3,1.87183,0,miopenConvolutionBwdWeightsAlgoDirect,<unused>;miopenConvolutionBwdWeightsAlgoImplicitGEMM:ConvHipImplicitGemmV4R1WrW,5.90994,0,miopenConvolutionBwdWeightsAlgoImplicitGEMM,256x14x14x3x3x128x14x14x128xNCHWxFP32x1x1x1x1x1x1x1x0;miopenConvolutionBwdWeightsAlgoGEMM:GemmWrwUniversal,17.4426,903168,MIOpenGEMM,1_0_196_196_1152_1152_256_196
192-28-28-1x1-32-28-28-128-0x0-1x1-1x1-0-NCHW-FP32-F=miopenConvolutionFwdAlgoDirect:ConvAsm1x1U,0.321392,0,miopenConvolutionFwdAlgoDirect,<unused>;miopenConvolutionFwdAlgoWinograd:ConvBinWinogradRxSf3x2,0.479286,0,miopenConvolutionFwdAlgoWinograd,<unused>;miopenConvolutionFwdAlgoGEMM:GemmFwd1x1_0_1,3.493,0,MIOpenGEMM,0_0_784_192_784_784_32_192
256-14-14-3x3-128-14-14-128-1x1-1x1-1x1-0-NCHW-FP32-B=miopenConvolutionBwdDataAlgoWinograd:ConvBinWinograd3x3U,0.76448,0,miopenConvolutionBwdDataAlgoWinograd,<unused>
128-14-14-5x5-32-14-14-128-2x2-1x1-1x1-0-NCHW-FP32-W=miopenConvolutionBwdWeightsAlgoDirect:ConvOclBwdWrW53,1.53046,52428800,miopenConvolutionBwdWeightsAlgoDirect,<unused>;miopenConvolutionBwdWeightsAlgoWinograd:ConvBinWinogradRxSf2x3,1.91367,0,miopenConvolutionBwdWeightsAlgoWinograd,128x14x14x5x5x32x14x14x128xNCHWxFP32x2x2x1x1x1x1x1x0;miopenConvolutionBwdWeightsAlgoGEMM:GemmWrwUniversal,26.0691,627200,MIOpenGEMM,1_0_196_196_800_800_128_196
256-56-56-3x3-128-56-56-128-1x1-1x1-1x1-0-NCHW-FP32-W=miopenConvolutionBwdWeightsAlgoWinograd:ConvBinWinogradRxSf2x3,35.114,0,miopenConvolutionBwdWeightsAlgoWinograd,256x56x56x3x3x128x56x56x128xNCHWxFP32x1x1x1x1x1x1x1x0;miopenConvolutionBwdWeightsAlgoDirect:ConvAsmBwdWrW3x3,39.6291,0,miopenConvolutionBwdWeightsAlgoDirect,<unused>;miopenConvolutionBwdWeightsAlgoImplicitGEMM:ConvHipImplicitGemmV4R1WrW,83.5657,0,miopenConvolutionBwdWeightsAlgoImplicitGEMM,256x56x56x3x3x128x56x56x128xNCHWxFP32x1x1x1x1x1x1x1x0;miopenConvolutionBwdWeightsAlgoGEMM:GemmWrwUniversal,116.338,14450688,MIOpenGEMM,1_0_3136_3136_1152_1152_256_3136
480-14-14-1x1-96-14-14-128-0x0-1x1-1x1-0-NCHW-FP32-F=miopenConvolutionFwdAlgoDirect:ConvOclDirectFwd1x1,0.526419,0,miopenConvolutionFwdAlgoDirect,<unused>;miopenConvolutionFwdAlgoGEMM:GemmFwd1x1_0_1,8.61149,0,MIOpenGEMM,0_0_196_480_196_196_96_480
512-28-28-3x3-512-28-28-128-1x1-1x1-1x1-0-NCHW-FP32-F=miopenConvolutionFwdAlgoWinograd:ConvBinWinogradRxSf2x3,24.2665,0,miopenConvolutionFwdAlgoWinograd,<unused>
128-14-14-3x3-256-14-14-128-1x1-1x1-1x1-0-NCHW-FP32-F=miopenConvolutionFwdAlgoWinograd:ConvBinWinograd3x3U,0.742316,0,miopenConvolutionFwdAlgoWinograd,<unused>
48-7-7-5x5-128-7-7-128-2x2-1x1-1x1-0-NCHW-FP32-F=miopenConvolutionFwdAlgoWinograd:ConvBinWinogradRxSf2x3,0.331828,0,miopenConvolutionFwdAlgoWinograd,<unused>;miopenConvolutionFwdAlgoImplicitGEMM:ConvHipImplicitGemmV4R1Fwd,0.561945,0,miopenConvolutionFwdAlgoImplicitGEMM,48x7x7x5x5x128x7x7x128xNCHWxFP32x2x2x1x1x1x1x1x1;miopenConvolutionFwdAlgoFFT:fft,0.630299,22106112,miopenConvolutionFwdAlgoFFT,48x7x7x5x5x128x7x7x128xNCHWxFP32x2x2x1x1x1x1x1x1;miopenConvolutionFwdAlgoDirect:ConvOclDirectFwd,1.25729,0,miopenConvolutionFwdAlgoDirect,<unused>;miopenConvolutionFwdAlgoGEMM:GemmFwdRest,8.95596,235200,MIOpenGEMM,0_0_49_1200_49_49_128_1200
256-28-28-1x1-32-28-28-128-0x0-1x1-1x1-0-NCHW-FP32-F=miopenConvolutionFwdAlgoDirect:ConvAsm1x1U,0.404582,0,miopenConvolutionFwdAlgoDirect,<unused>;miopenConvolutionFwdAlgoGEMM:GemmFwd1x1_0_1,3.38916,0,MIOpenGEMM,0_0_784_256_784_784_32_256
16-14-14-5x5-48-14-14-128-2x2-1x1-1x1-0-NCHW-FP32-F=miopenConvolutionFwdAlgoWinograd:ConvBinWinogradRxSf2x3,0.132378,0,miopenConvolutionFwdAlgoWinograd,<unused>;miopenConvolutionFwdAlgoImplicitGEMM:ConvHipImplicitGemmV4R1Fwd,0.371691,0,miopenConvolutionFwdAlgoImplicitGEMM,16x14x14x5x5x48x14x14x128xNCHWxFP32x2x2x1x1x1x1x1x1;miopenConvolutionFwdAlgoDirect:ConvOclDirectFwd,0.377072,0,miopenConvolutionFwdAlgoDirect,<unused>;miopenConvolutionFwdAlgoFFT:fft,0.684241,17879040,miopenConvolutionFwdAlgoFFT,16x14x14x5x5x48x14x14x128xNCHWxFP32x2x2x1x1x1x1x1x1;miopenConvolutionFwdAlgoGEMM:GemmFwdRest,4.36253,313600,MIOpenGEMM,0_0_196_400_196_196_48_400
128-14-14-5x5-32-14-14-128-2x2-1x1-1x1-0-NCHW-FP32-B=miopenConvolutionBwdDataAlgoFFT:fft,0.709851,59351040,miopenConvolutionBwdDataAlgoFFT,128x14x14x5x5x32x14x14x128xNCHWxFP32x2x2x1x1x1x1x1x0;miopenConvolutionBwdDataAlgoWinograd:ConvBinWinogradRxSf2x3,0.755095,0,miopenConvolutionBwdDataAlgoWinograd,<unused>;miopenConvolutionBwdDataAlgoDirect:ConvOclDirectFwd,2.26011,0,miopenConvolutionBwdDataAlgoDirect,<unused>;miopenConvolutionBwdDataAlgoImplicitGEMM:ConvHipImplicitGemmBwdDataV1R1,2.5245,0,miopenConvolutionBwdDataAlgoImplicitGEMM,128x14x14x5x5x32x14x14x128xNCHWxFP32x2x2x1x1x1x1x1x0;miopenConvolutionBwdDataAlgoGEMM:GemmBwdRest,9.50982,627200,MIOpenGEMM,0_1_196_800_196_196_800_128
256-56-56-3x3-128-56-56-128-1x1-1x1-1x1-0-NCHW-FP32-B=miopenConvolutionBwdDataAlgoWinograd:ConvBinWinogradRxS,14.6293,0,miopenConvolutionBwdDataAlgoWinograd,<unused>
64-14-14-1x1-480-14-14-128-0x0-1x1-1x1-0-NCHW-FP32-W=miopenConvolutionBwdWeightsAlgoDirect:ConvAsmBwdWrW1x1,0.450643,0,miopenConvolutionBwdWeightsAlgoDirect,<unused>;miopenConvolutionBwdWeightsAlgoWinograd:ConvBinWinogradRxSf2x3,1.26553,0,miopenConvolutionBwdWeightsAlgoWinograd,64x14x14x1x1x480x14x14x128xNCHWxFP32x0x0x1x1x1x1x1x0;miopenConvolutionBwdWeightsAlgoGEMM:GemmWrw1x1_stride1,3.22931,0,MIOpenGEMM,1_0_196_196_480_480_64_196
96-28-28-1x1-192-28-28-128-0x0-1x1-1x1-0-NCHW-FP32-W=miopenConvolutionBwdWeightsAlgoDirect:ConvAsmBwdWrW1x1,1.11239,0,miopenConvolutionBwdWeightsAlgoDirect,<unused>
128-112-112-3x3-128-112-112-128-1x1-1x1-1x1-0-NCHW-FP32-W=miopenConvolutionBwdWeightsAlgoDirect:ConvAsmBwdWrW3x3,109.399,0,miopenConvolutionBwdWeightsAlgoDirect,<unused>;miopenConvolutionBwdWeightsAlgoWinograd:ConvBinWinogradRxSf2x3,168.076,0,miopenConvolutionBwdWeightsAlgoWinograd,128x112x112x3x3x128x112x112x128xNCHWxFP32x1x1x1x1x1x1x1x0;miopenConvolutionBwdWeightsAlgoImplicitGEMM:ConvHipImplicitGemmV4R1WrW,343.86,0,miopenConvolutionBwdWeightsAlgoImplicitGEMM,128x112x112x3x3x128x112x112x128xNCHWxFP32x1x1x1x1x1x1x1x0;miopenConvolutionBwdWeightsAlgoGEMM:GemmWrwUniversal,465.006,57802752,MIOpenGEMM,1_0_12544_12544_1152_1152_128_12544
128-7-7-5x5-32-7-7-128-2x2-1x1-1x1-0-NCHW-FP32-W=miopenConvolutionBwdWeightsAlgoWinograd:ConvBinWinogradRxSf2x3,0.458146,0,miopenConvolutionBwdWeightsAlgoWinograd,128x7x7x5x5x32x7x7x128xNCHWxFP32x2x2x1x1x1x1x1x0;miopenConvolutionBwdWeightsAlgoDirect:ConvOclBwdWrW2<16>,0.650686,3276800,miopenConvolutionBwdWeightsAlgoDirect,<unused>;miopenConvolutionBwdWeightsAlgoGEMM:GemmWrwUniversal,9.22147,156800,MIOpenGEMM,1_0_49_49_800_800_128_49
224-14-14-3x3-112-14-14-128-1x1-1x1-1x1-0-NCHW-FP32-W=miopenConvolutionBwdWeightsAlgoWinograd:ConvBinWinogradRxS,1.65436,0,miopenConvolutionBwdWeightsAlgoWinograd,224x14x14x3x3x112x14x14x128xNCHWxFP32x1x1x1x1x1x1x1x0;miopenConvolutionBwdWeightsAlgoDirect:ConvAsmBwdWrW3x3,1.97677,0,miopenConvolutionBwdWeightsAlgoDirect,<unused>;miopenConvolutionBwdWeightsAlgoGEMM:GemmWrwUniversal,6.69829,790272,MIOpenGEMM,1_0_196_196_1008_1008_224_196
288-14-14-3x3-144-14-14-128-1x1-1x1-1x1-0-NCHW-FP32-W=miopenConvolutionBwdWeightsAlgoWinograd:ConvBinWinogradRxS,1.91112,0,miopenConvolutionBwdWeightsAlgoWinograd,288x14x14x3x3x144x14x14x128xNCHWxFP32x1x1x1x1x1x1x1x0;miopenConvolutionBwdWeightsAlgoDirect:ConvAsmBwdWrW3x3,2.31954,0,miopenConvolutionBwdWeightsAlgoDirect,<unused>;miopenConvolutionBwdWeightsAlgoGEMM:GemmWrwUniversal,10.6423,1016064,MIOpenGEMM,1_0_196_196_1296_1296_288_196
128-56-56-3x3-256-56-56-128-1x1-1x1-1x1-0-NCHW-FP32-F=miopenConvolutionFwdAlgoWinograd:ConvBinWinograd3x3U,27.7945,0,miopenConvolutionFwdAlgoWinograd,<unused>
32-14-14-5x5-128-14-14-128-2x2-1x1-1x1-0-NCHW-FP32-F=miopenConvolutionFwdAlgoWinograd:ConvBinWinogradRxSf2x3,0.500816,0,miopenConvolutionFwdAlgoWinograd,<unused>;miopenConvolutionFwdAlgoFFT:fft,0.795875,47370240,miopenConvolutionFwdAlgoFFT,32x14x14x5x5x128x14x14x128xNCHWxFP32x2x2x1x1x1x1x1x1;miopenConvolutionFwdAlgoImplicitGEMM:ConvHipImplicitGemmV4R1Fwd,0.967256,0,miopenConvolutionFwdAlgoImplicitGEMM,32x14x14x5x5x128x14x14x128xNCHWxFP32x2x2x1x1x1x1x1x1;miopenConvolutionFwdAlgoDirect:ConvOclDirectFwd,1.50581,0,miopenConvolutionFwdAlgoDirect,<unused>;miopenConvolutionFwdAlgoGEMM:GemmFwdRest,9.95256,627200,MIOpenGEMM,0_0_196_800_196_196_128_800
128-28-28-1x1-256-28-28-128-0x0-1x1-1x1-0-NCHW-FP32-W=miopenConvolutionBwdWeightsAlgoDirect:ConvAsmBwdWrW1x1,0.997313,0,miopenConvolutionBwdWeightsAlgoDirect,<unused>
288-14-14-3x3-144-14-14-128-1x1-1x1-1x1-0-NCHW-FP32-B=miopenConvolutionBwdDataAlgoWinograd:ConvBinWinograd3x3U,1.01954,0,miopenConvolutionBwdDataAlgoWinograd,<unused>
64-224-224-3x3-64-224-224-128-1x1-1x1-1x1-0-NCHW-FP32-F=miopenConvolutionFwdAlgoWinograd:ConvBinWinogradRxSf2x3,27.3642,0,miopenConvolutionFwdAlgoWinograd,<unused>
144-14-14-3x3-288-14-14-128-1x1-1x1-1x1-0-NCHW-FP32-F=miopenConvolutionFwdAlgoWinograd:ConvBinWinograd3x3U,0.938158,0,miopenConvolutionFwdAlgoWinograd,<unused>
128-7-7-5x5-32-7-7-128-2x2-1x1-1x1-0-NCHW-FP32-B=miopenConvolutionBwdDataAlgoWinograd:ConvBinWinogradRxSf2x3,0.164023,0,miopenConvolutionBwdDataAlgoWinograd,<unused>;miopenConvolutionBwdDataAlgoFFT:fft,1.13321,27697152,miopenConvolutionBwdDataAlgoFFT,128x7x7x5x5x32x7x7x128xNCHWxFP32x2x2x1x1x1x1x1x0;miopenConvolutionBwdDataAlgoImplicitGEMM:ConvHipImplicitGemmBwdDataV1R1,1.34485,0,miopenConvolutionBwdDataAlgoImplicitGEMM,128x7x7x5x5x32x7x7x128xNCHWxFP32x2x2x1x1x1x1x1x0;miopenConvolutionBwdDataAlgoDirect:ConvOclDirectFwd,1.41695,0,miopenConvolutionBwdDataAlgoDirect,<unused>;miopenConvolutionBwdDataAlgoGEMM:GemmBwdRest,6.60261,156800,MIOpenGEMM,0_1_49_800_49_49_800_128
64-14-14-1x1-480-14-14-128-0x0-1x1-1x1-0-NCHW-FP32-B=miopenConvolutionBwdDataAlgoWinograd:ConvBinWinogradRxSf3x2,0.762171,0,miopenConvolutionBwdDataAlgoWinograd,<unused>
224-14-14-3x3-112-14-14-128-1x1-1x1-1x1-0-NCHW-FP32-B=miopenConvolutionBwdDataAlgoWinograd:ConvBinWinogradRxSf2x3,0.856214,0,miopenConvolutionBwdDataAlgoWinograd,<unused>
32-14-14-1x1-512-14-14-128-0x0-1x1-1x1-0-NCHW-FP32-W=miopenConvolutionBwdWeightsAlgoDirect:ConvAsmBwdWrW1x1,0.487134,0,miopenConvolutionBwdWeightsAlgoDirect,<unused>;miopenConvolutionBwdWeightsAlgoGEMM:GemmWrw1x1_stride1,13.4433,0,MIOpenGEMM,1_0_196_196_512_512_32_196
512-14-14-3x3-512-14-14-128-1x1-1x1-1x1-0-NCHW-FP32-B=miopenConvolutionBwdDataAlgoWinograd:ConvBinWinogradRxSf2x3,10.969,0,miopenConvolutionBwdDataAlgoWinograd,<unused>
16-28-28-1x1-192-28-28-128-0x0-1x1-1x1-0-NCHW-FP32-W=miopenConvolutionBwdWeightsAlgoDirect:ConvAsmBwdWrW1x1,0.379954,0,miopenConvolutionBwdWeightsAlgoDirect,<unused>
32-7-7-5x5-128-7-7-128-2x2-1x1-1x1-0-NCHW-FP32-F=miopenConvolutionFwdAlgoWinograd:ConvBinWinogradRxSf2x3,0.146983,0,miopenConvolutionFwdAlgoWinograd,<unused>;miopenConvolutionFwdAlgoImplicitGEMM:ConvHipImplicitGemmV4R1Fwd,0.309364,0,miopenConvolutionFwdAlgoImplicitGEMM,32x7x7x5x5x128x7x7x128xNCHWxFP32x2x2x1x1x1x1x1x1;miopenConvolutionFwdAlgoFFT:fft,0.443829,22106112,miopenConvolutionFwdAlgoFFT,32x7x7x5x5x128x7x7x128xNCHWxFP32x2x2x1x1x1x1x1x1;miopenConvolutionFwdAlgoDirect:ConvOclDirectFwd,0.598233,0,miopenConvolutionFwdAlgoDirect,<unused>;miopenConvolutionFwdAlgoGEMM:GemmFwdRest,5.56581,156800,MIOpenGEMM,0_0_49_800_49_49_128_800
64-112-112-7x7-3-225-225-128-2x2-2x2-1x1-0-NCHW-FP32-W=miopenConvolutionBwdWeightsAlgoDirect:ConvOclBwdWrW2<4>,11.4492,1204224,miopenConvolutionBwdWeightsAlgoDirect,<unused>;miopenConvolutionBwdWeightsAlgoGEMM:GemmWrwUniversal,28.2939,7375872,MIOpenGEMM,1_0_12544_12544_147_147_64_12544
112-14-14-3x3-224-14-14-128-1x1-1x1-1x1-0-NCHW-FP32-F=miopenConvolutionFwdAlgoWinograd:ConvBinWinograd3x3U,0.585853,0,miopenConvolutionFwdAlgoWinograd,<unused>
144-14-14-1x1-512-14-14-128-0x0-1x1-1x1-0-NCHW-FP32-B=miopenConvolutionBwdDataAlgoDirect:ConvAsm1x1U,1.36147,0,miopenConvolutionBwdDataAlgoDirect,<unused>;miopenConvolutionBwdDataAlgoGEMM:GemmBwd1x1_stride1,108.898,0,MIOpenGEMM,0_1_196_512_196_196_512_144
512-14-14-3x3-512-14-14-128-1x1-1x1-1x1-0-NCHW-FP32-F=miopenConvolutionFwdAlgoWinograd:ConvBinWinogradRxSf2x3,6.48963,0,miopenConvolutionFwdAlgoWinograd,<unused>
480-14-14-1x1-64-14-14-128-0x0-1x1-1x1-0-NCHW-FP32-F=miopenConvolutionFwdAlgoDirect:ConvAsm1x1U,0.32503,0,miopenConvolutionFwdAlgoDirect,<unused>;miopenConvolutionFwdAlgoWinograd:ConvBinWinogradRxSf3x2,0.732674,0,miopenConvolutionFwdAlgoWinograd,<unused>;miopenConvolutionFwdAlgoGEMM:GemmFwd1x1_0_1,5.25493,0,MIOpenGEMM,0_0_196_480_196_196_64_480
64-112-112-7x7-3-225-225-128-2x2-2x2-1x1-0-NCHW-FP32-B=miopenConvolutionBwdDataAlgoDirect:ConvOclDirectFwd,25.9951,0,miopenConvolutionBwdDataAlgoDirect,<unused>;miopenConvolutionBwdDataAlgoWinograd:ConvBinWinogradRxSf2x3,39.5505,0,miopenConvolutionBwdDataAlgoWinograd,<unused>;miopenConvolutionBwdDataAlgoGEMM:GemmBwdRest,440.795,7375872,MIOpenGEMM,0_1_12544_147_12544_12544_147_64
32-14-14-1x1-512-14-14-128-0x0-1x1-1x1-0-NCHW-FP32-B=miopenConvolutionBwdDataAlgoDirect:ConvAsm1x1U,0.226827,0,miopenConvolutionBwdDataAlgoDirect,<unused>;miopenConvolutionBwdDataAlgoGEMM:GemmBwd1x1_stride1,1.60038,0,MIOpenGEMM,0_1_196_512_196_196_512_32
16-28-28-1x1-192-28-28-128-0x0-1x1-1x1-0-NCHW-FP32-B=miopenConvolutionBwdDataAlgoDirect:ConvAsm1x1U,0.27055,0,miopenConvolutionBwdDataAlgoDirect,<unused>;miopenConvolutionBwdDataAlgoWinograd:ConvBinWinogradRxSf2x3,0.798709,0,miopenConvolutionBwdDataAlgoWinograd,<unused>;miopenConvolutionBwdDataAlgoGEMM:GemmBwd1x1_stride1,1.66347,0,MIOpenGEMM,0_1_784_192_784_784_192_16
96-28-28-5x5-32-28-28-128-2x2-1x1-1x1-0-NCHW-FP32-W=miopenConvolutionBwdWeightsAlgoDirect:ConvOclBwdWrW53,2.51085,39321600,miopenConvolutionBwdWeightsAlgoDirect,<unused>;miopenConvolutionBwdWeightsAlgoWinograd:ConvBinWinogradRxSf2x3,4.25247,0,miopenConvolutionBwdWeightsAlgoWinograd,96x28x28x5x5x32x28x28x128xNCHWxFP32x2x2x1x1x1x1x1x0;miopenConvolutionBwdWeightsAlgoGEMM:GemmWrwUniversal,20.2642,2508800,MIOpenGEMM,1_0_784_784_800_800_96_784
192-14-14-1x1-480-14-14-128-0x0-1x1-1x1-0-NCHW-FP32-W=miopenConvolutionBwdWeightsAlgoDirect:ConvAsmBwdWrW1x1,0.842307,0,miopenConvolutionBwdWeightsAlgoDirect,<unused>;miopenConvolutionBwdWeightsAlgoWinograd:ConvBinWinogradRxSf2x3,2.42474,0,miopenConvolutionBwdWeightsAlgoWinograd,192x14x14x1x1x480x14x14x128xNCHWxFP32x0x0x1x1x1x1x1x0;miopenConvolutionBwdWeightsAlgoGEMM:GemmWrw1x1_stride1,2.91912,0,MIOpenGEMM,1_0_196_196_480_480_192_196
512-14-14-1x1-144-14-14-128-0x0-1x1-1x1-0-NCHW-FP32-F=miopenConvolutionFwdAlgoDirect:ConvAsm1x1U,0.624889,0,miopenConvolutionFwdAlgoDirect,<unused>;miopenConvolutionFwdAlgoGEMM:GemmFwd1x1_0_1,5.19044,0,MIOpenGEMM,0_0_196_512_196_196_144_512
3-225-225-7x7-64-112-112-128-2x2-2x2-1x1-0-NCHW-FP32-F=miopenConvolutionFwdAlgoWinograd:ConvBinWinogradRxS,5.32386,0,miopenConvolutionFwdAlgoWinograd,<unused>;miopenConvolutionFwdAlgoDirect:ConvOclDirectFwd,6.25055,0,miopenConvolutionFwdAlgoDirect,<unused>;miopenConvolutionFwdAlgoGEMM:GemmFwdRest,19.6715,7375872,MIOpenGEMM,0_0_12544_147_12544_12544_64_147
96-28-28-5x5-32-28-28-128-2x2-1x1-1x1-0-NCHW-FP32-B=miopenConvolutionBwdDataAlgoWinograd:ConvBinWinogradRxSf2x3,1.39354,0,miopenConvolutionBwdDataAlgoWinograd,<unused>;miopenConvolutionBwdDataAlgoFFT:fft,1.92724,134807552,miopenConvolutionBwdDataAlgoFFT,96x28x28x5x5x32x28x28x128xNCHWxFP32x2x2x1x1x1x1x1x0;miopenConvolutionBwdDataAlgoDirect:ConvOclDirectFwd,4.5858,0,miopenConvolutionBwdDataAlgoDirect,<unused>;miopenConvolutionBwdDataAlgoImplicitGEMM:ConvHipImplicitGemmBwdDataV1R1,7.1858,0,miopenConvolutionBwdDataAlgoImplicitGEMM,96x28x28x5x5x32x28x28x128xNCHWxFP32x2x2x1x1x1x1x1x0;miopenConvolutionBwdDataAlgoGEMM:GemmBwdRest,9.90816,2508800,MIOpenGEMM,0_1_784_800_784_784_800_96
512-14-14-1x1-32-14-14-128-0x0-1x1-1x1-0-NCHW-FP32-F=miopenConvolutionFwdAlgoDirect:ConvAsm1x1U,0.250262,0,miopenConvolutionFwdAlgoDirect,<unused>;miopenConvolutionFwdAlgoWinograd:ConvBinWinogradRxSf3x2,0.43714,0,miopenConvolutionFwdAlgoWinograd,<unused>;miopenConvolutionFwdAlgoGEMM:GemmFwd1x1_0_1,2.67885,0,MIOpenGEMM,0_0_196_512_196_196_32_512
528-14-14-1x1-256-14-14-128-0x0-1x1-1x1-0-NCHW-FP32-F=miopenConvolutionFwdAlgoDirect:ConvAsm1x1U,1.29056,0,miopenConvolutionFwdAlgoDirect,<unused>;miopenConvolutionFwdAlgoWinograd:ConvBinWinogradRxSf3x2,2.17904,0,miopenConvolutionFwdAlgoWinograd,<unused>;miopenConvolutionFwdAlgoGEMM:GemmFwd1x1_0_1,6.14616,0,MIOpenGEMM,0_0_196_528_196_196_256_528
192-14-14-1x1-480-14-14-128-0x0-1x1-1x1-0-NCHW-FP32-B=miopenConvolutionBwdDataAlgoDirect:ConvAsm1x1U,0.712417,0,miopenConvolutionBwdDataAlgoDirect,<unused>;miopenConvolutionBwdDataAlgoGEMM:GemmBwd1x1_stride1,3.16819,0,MIOpenGEMM,0_1_196_480_196_196_480_192
128-14-14-1x1-512-14-14-128-0x0-1x1-1x1-0-NCHW-FP32-W=miopenConvolutionBwdWeightsAlgoDirect:ConvAsmBwdWrW1x1,0.637007,0,miopenConvolutionBwdWeightsAlgoDirect,<unused>
32-28-28-5x5-96-28-28-128-2x2-1x1-1x1-0-NCHW-FP32-F=miopenConvolutionFwdAlgoWinograd:ConvBinWinogradRxS,1.25774,0,miopenConvolutionFwdAlgoWinograd,<unused>;miopenConvolutionFwdAlgoFFT:fft,1.81918,107511808,miopenConvolutionFwdAlgoFFT,32x28x28x5x5x96x28x28x128xNCHWxFP32x2x2x1x1x1x1x1x1;miopenConvolutionFwdAlgoImplicitGEMM:ConvHipImplicitGemmV4R1Fwd,3.08149,0,miopenConvolutionFwdAlgoImplicitGEMM,32x28x28x5x5x96x28x28x128xNCHWxFP32x2x2x1x1x1x1x1x1;miopenConvolutionFwdAlgoDirect:ConvOclDirectFwd,6.37949,0,miopenConvolutionFwdAlgoDirect,<unused>;miopenConvolutionFwdAlgoGEMM:GemmFwdRest,10.1595,2508800,MIOpenGEMM,0_0_784_800_784_784_96_800
24-14-14-1x1-512-14-14-128-0x0-1x1-1x1-0-NCHW-FP32-W=miopenConvolutionBwdWeightsAlgoDirect:ConvAsmBwdWrW1x1,0.286228,0,miopenConvolutionBwdWeightsAlgoDirect,<unused>;miopenConvolutionBwdWeightsAlgoWinograd:ConvBinWinogradRxSf2x3,1.08472,0,miopenConvolutionBwdWeightsAlgoWinograd,24x14x14x1x1x512x14x14x128xNCHWxFP32x0x0x1x1x1x1x1x0;miopenConvolutionBwdWeightsAlgoGEMM:GemmWrw1x1_stride1,2.23422,0,MIOpenGEMM,1_0_196_196_512_512_24_196
64-28-28-1x1-256-28-28-128-0x0-1x1-1x1-0-NCHW-FP32-W=miopenConvolutionBwdWeightsAlgoDirect:ConvAsmBwdWrW1x1,0.661302,0,miopenConvolutionBwdWeightsAlgoDirect,<unused>
128-112-112-3x3-128-112-112-128-1x1-1x1-1x1-0-NCHW-FP32-B=miopenConvolutionBwdDataAlgoWinograd:ConvBinWinograd3x3U,33.6644,0,miopenConvolutionBwdDataAlgoWinograd,<unused>
64-14-14-5x5-32-14-14-128-2x2-1x1-1x1-0-NCHW-FP32-W=miopenConvolutionBwdWeightsAlgoDirect:ConvOclBwdWrW2<16>,0.981137,1638400,miopenConvolutionBwdWeightsAlgoDirect,<unused>;miopenConvolutionBwdWeightsAlgoWinograd:ConvBinWinogradRxSf2x3,1.42236,0,miopenConvolutionBwdWeightsAlgoWinograd,64x14x14x5x5x32x14x14x128xNCHWxFP32x2x2x1x1x1x1x1x0;miopenConvolutionBwdWeightsAlgoGEMM:GemmWrwUniversal,9.59683,627200,MIOpenGEMM,1_0_196_196_800_800_64_196
480-14-14-1x1-192-14-14-128-0x0-1x1-1x1-0-NCHW-FP32-F=miopenConvolutionFwdAlgoDirect:ConvAsm1x1U,0.936066,0,miopenConvolutionFwdAlgoDirect,<unused>;miopenConvolutionFwdAlgoWinograd:ConvBinWinogradRxSf3x2,1.65366,0,miopenConvolutionFwdAlgoWinograd,<unused>;miopenConvolutionFwdAlgoGEMM:GemmFwd1x1_0_1,6.13765,0,MIOpenGEMM,0_0_196_480_196_196_192_480
192-28-28-1x1-16-28-28-128-0x0-1x1-1x1-0-NCHW-FP32-F=miopenConvolutionFwdAlgoDirect:ConvAsm1x1U,0.258686,0,miopenConvolutionFwdAlgoDirect,<unused>;miopenConvolutionFwdAlgoWinograd:ConvBinWinogradRxSf3x2,0.419664,0,miopenConvolutionFwdAlgoWinograd,<unused>;miopenConvolutionFwdAlgoGEMM:GemmFwd1x1_0_1,2.31036,0,MIOpenGEMM,0_0_784_192_784_784_16_192
24-14-14-1x1-512-14-14-128-0x0-1x1-1x1-0-NCHW-FP32-B=miopenConvolutionBwdDataAlgoDirect:ConvAsm1x1U,0.198987,0,miopenConvolutionBwdDataAlgoDirect,<unused>;miopenConvolutionBwdDataAlgoGEMM:GemmBwd1x1_stride1,1.50926,0,MIOpenGEMM,0_1_196_512_196_196_512_24
128-14-14-1x1-512-14-14-128-0x0-1x1-1x1-0-NCHW-FP32-B=miopenConvolutionBwdDataAlgoDirect:ConvAsm1x1U,0.658979,0,miopenConvolutionBwdDataAlgoDirect,<unused>;miopenConvolutionBwdDataAlgoWinograd:ConvBinWinogradRxSf3x2,1.37965,0,miopenConvolutionBwdDataAlgoWinograd,<unused>;miopenConvolutionBwdDataAlgoGEMM:GemmBwd1x1_stride1,28.2416,0,MIOpenGEMM,0_1_196_512_196_196_512_128
64-28-28-1x1-256-28-28-128-0x0-1x1-1x1-0-NCHW-FP32-B=miopenConvolutionBwdDataAlgoDirect:ConvAsm1x1U,0.542231,0,miopenConvolutionBwdDataAlgoDirect,<unused>;miopenConvolutionBwdDataAlgoWinograd:ConvBinWinogradRxSf3x2,1.50363,0,miopenConvolutionBwdDataAlgoWinograd,<unused>;miopenConvolutionBwdDataAlgoGEMM:GemmBwd1x1_stride1,5.17767,0,MIOpenGEMM,0_1_784_256_784_784_256_64
160-14-14-1x1-528-14-14-128-0x0-1x1-1x1-0-NCHW-FP32-W=miopenConvolutionBwdWeightsAlgoDirect:ConvAsmBwdWrW1x1,0.873234,0,miopenConvolutionBwdWeightsAlgoDirect,<unused>;miopenConvolutionBwdWeightsAlgoWinograd:ConvBinWinogradRxSf2x3,3.15216,0,miopenConvolutionBwdWeightsAlgoWinograd,160x14x14x1x1x528x14x14x128xNCHWxFP32x0x0x1x1x1x1x1x0;miopenConvolutionBwdWeightsAlgoGEMM:GemmWrw1x1_stride1,3.74457,0,MIOpenGEMM,1_0_196_196_528_528_160_196
192-7-7-1x1-832-7-7-128-0x0-1x1-1x1-0-NCHW-FP32-W=miopenConvolutionBwdWeightsAlgoDirect:ConvAsmBwdWrW1x1,0.391997,0,miopenConvolutionBwdWeightsAlgoDirect,<unused>;miopenConvolutionBwdWeightsAlgoGEMM:GemmWrw1x1_stride1,1.72033,0,MIOpenGEMM,1_0_49_49_832_832_192_49
16-14-14-1x1-480-14-14-128-0x0-1x1-1x1-0-NCHW-FP32-W=miopenConvolutionBwdWeightsAlgoDirect:ConvAsmBwdWrW1x1,0.194828,0,miopenConvolutionBwdWeightsAlgoDirect,<unused>;miopenConvolutionBwdWeightsAlgoWinograd:ConvBinWinogradRxSf2x3,1.02915,0,miopenConvolutionBwdWeightsAlgoWinograd,16x14x14x1x1x480x14x14x128xNCHWxFP32x0x0x1x1x1x1x1x0;miopenConvolutionBwdWeightsAlgoGEMM:GemmWrw1x1_stride1,1.78938,0,MIOpenGEMM,1_0_196_196_480_480_16_196
832-7-7-1x1-48-7-7-128-0x0-1x1-1x1-0-NCHW-FP32-F=miopenConvolutionFwdAlgoDirect:ConvAsm1x1U,0.113097,0,miopenConvolutionFwdAlgoDirect,<unused>;miopenConvolutionFwdAlgoWinograd:ConvBinWinogradRxSf2x3,0.368446,0,miopenConvolutionFwdAlgoWinograd,<unused>;miopenConvolutionFwdAlgoGEMM:GemmFwd1x1_0_1,2.27598,0,MIOpenGEMM,0_0_49_832_49_49_48_832
320-7-7-3x3-160-7-7-128-1x1-1x1-1x1-0-NCHW-FP32-W=miopenConvolutionBwdWeightsAlgoWinograd:ConvBinWinogradRxS,0.59523,0,miopenConvolutionBwdWeightsAlgoWinograd,320x7x7x3x3x160x7x7x128xNCHWxFP32x1x1x1x1x1x1x1x0;miopenConvolutionBwdWeightsAlgoDirect:ConvAsmBwdWrW3x3,0.781331,0,miopenConvolutionBwdWeightsAlgoDirect,<unused>;miopenConvolutionBwdWeightsAlgoGEMM:GemmWrwUniversal,14.5478,282240,MIOpenGEMM,1_0_49_49_1440_1440_320_49
512-14-14-1x1-24-14-14-128-0x0-1x1-1x1-0-NCHW-FP32-F=miopenConvolutionFwdAlgoDirect:ConvAsm1x1U,0.204743,0,miopenConvolutionFwdAlgoDirect,<unused>;miopenConvolutionFwdAlgoWinograd:ConvBinWinogradRxSf3x2,0.268366,0,miopenConvolutionFwdAlgoWinograd,<unused>;miopenConvolutionFwdAlgoGEMM:GemmFwd1x1_0_1,2.04057,0,MIOpenGEMM,0_0_196_512_196_196_24_512
512-14-14-1x1-128-14-14-128-0x0-1x1-1x1-0-NCHW-FP32-F=miopenConvolutionFwdAlgoDirect:ConvAsm1x1U,0.769679,0,miopenConvolutionFwdAlgoDirect,<unused>;miopenConvolutionFwdAlgoWinograd:ConvBinWinogradRxSf3x2,1.38601,0,miopenConvolutionFwdAlgoWinograd,<unused>;miopenConvolutionFwdAlgoGEMM:GemmFwd1x1_0_1,7.79793,0,MIOpenGEMM,0_0_196_512_196_196_128_512
384-7-7-1x1-832-7-7-128-0x0-1x1-1x1-0-NCHW-FP32-W=miopenConvolutionBwdWeightsAlgoDirect:ConvAsmBwdWrW1x1,0.728866,0,miopenConvolutionBwdWeightsAlgoDirect,<unused>;miopenConvolutionBwdWeightsAlgoWinograd:ConvBinWinogradRxSf2x3,2.47012,0,miopenConvolutionBwdWeightsAlgoWinograd,384x7x7x1x1x832x7x7x128xNCHWxFP32x0x0x1x1x1x1x1x0;miopenConvolutionBwdWeightsAlgoGEMM:GemmWrw1x1_stride1,2.97781,0,MIOpenGEMM,1_0_49_49_832_832_384_49
16-14-14-1x1-480-14-14-128-0x0-1x1-1x1-0-NCHW-FP32-B=miopenConvolutionBwdDataAlgoDirect:ConvAsm1x1U,0.151999,0,miopenConvolutionBwdDataAlgoDirect,<unused>;miopenConvolutionBwdDataAlgoWinograd:ConvBinWinogradRxSf2x3,0.472941,0,miopenConvolutionBwdDataAlgoWinograd,<unused>;miopenConvolutionBwdDataAlgoGEMM:GemmBwd1x1_stride1,1.01302,0,MIOpenGEMM,0_1_196_480_196_196_480_16
192-7-7-1x1-832-7-7-128-0x0-1x1-1x1-0-NCHW-FP32-B=miopenConvolutionBwdDataAlgoDirect:ConvAsm1x1U,0.278235,0,miopenConvolutionBwdDataAlgoDirect,<unused>;miopenConvolutionBwdDataAlgoWinograd:ConvBinWinogradRxSf3x2,0.761432,0,miopenConvolutionBwdDataAlgoWinograd,<unused>;miopenConvolutionBwdDataAlgoGEMM:GemmBwd1x1_stride1,2.67153,0,MIOpenGEMM,0_1_49_832_49_49_832_192
160-14-14-1x1-512-14-14-128-0x0-1x1-1x1-0-NCHW-FP32-W=miopenConvolutionBwdWeightsAlgoDirect:ConvAsmBwdWrW1x1,1.24991,0,miopenConvolutionBwdWeightsAlgoDirect,<unused>
128-28-28-1x1-256-28-28-128-0x0-1x1-1x1-0-NCHW-FP32-B=miopenConvolutionBwdDataAlgoDirect:ConvAsm1x1U,0.963538,0,miopenConvolutionBwdDataAlgoDirect,<unused>;miopenConvolutionBwdDataAlgoWinograd:ConvBinWinogradRxSf3x2,2.58458,0,miopenConvolutionBwdDataAlgoWinograd,<unused>;miopenConvolutionBwdDataAlgoGEMM:GemmBwd1x1_stride1,144.61,0,MIOpenGEMM,0_1_784_256_784_784_256_128
112-14-14-1x1-512-14-14-128-0x0-1x1-1x1-0-NCHW-FP32-W=miopenConvolutionBwdWeightsAlgoDirect:ConvAsmBwdWrW1x1,0.765371,0,miopenConvolutionBwdWeightsAlgoDirect,<unused>
384-7-7-1x1-832-7-7-128-0x0-1x1-1x1-0-NCHW-FP32-B=miopenConvolutionBwdDataAlgoDirect:ConvAsm1x1U,1.15573,0,miopenConvolutionBwdDataAlgoDirect,<unused>;miopenConvolutionBwdDataAlgoGEMM:GemmBwd1x1_stride1,18.9862,0,MIOpenGEMM,0_1_49_832_49_49_832_384
480-14-14-1x1-16-14-14-128-0x0-1x1-1x1-0-NCHW-FP32-F=miopenConvolutionFwdAlgoDirect:ConvAsm1x1U,0.15964,0,miopenConvolutionFwdAlgoDirect,<unused>;miopenConvolutionFwdAlgoGEMM:GemmFwd1x1_0_1,2.55668,0,MIOpenGEMM,0_0_196_480_196_196_16_480
832-7-7-1x1-192-7-7-128-0x0-1x1-1x1-0-NCHW-FP32-F=miopenConvolutionFwdAlgoDirect:ConvAsm1x1U,0.353839,0,miopenConvolutionFwdAlgoDirect,<unused>;miopenConvolutionFwdAlgoWinograd:ConvBinWinogradRxSf3x2,0.794873,0,miopenConvolutionFwdAlgoWinograd,<unused>;miopenConvolutionFwdAlgoGEMM:GemmFwd1x1_0_1,8.64733,0,MIOpenGEMM,0_0_49_832_49_49_192_832
128-28-28-3x3-96-28-28-128-1x1-1x1-1x1-0-NCHW-FP32-W=miopenConvolutionBwdWeightsAlgoDirect:ConvAsmBwdWrW3x3,3.99789,0,miopenConvolutionBwdWeightsAlgoDirect,<unused>;miopenConvolutionBwdWeightsAlgoWinograd:ConvBinWinogradRxSf2x3,5.39739,0,miopenConvolutionBwdWeightsAlgoWinograd,128x28x28x3x3x96x28x28x128xNCHWxFP32x1x1x1x1x1x1x1x0;miopenConvolutionBwdWeightsAlgoGEMM:GemmWrwUniversal,25.0407,2709504,MIOpenGEMM,1_0_784_784_864_864_128_784
128-28-28-3x3-96-28-28-128-1x1-1x1-1x1-0-NCHW-FP32-B=miopenConvolutionBwdDataAlgoWinograd:ConvBinWinograd3x3U,1.23436,0,miopenConvolutionBwdDataAlgoWinograd,<unused>
160-7-7-1x1-832-7-7-128-0x0-1x1-1x1-0-NCHW-FP32-W=miopenConvolutionBwdWeightsAlgoDirect:ConvAsmBwdWrW1x1,0.410531,0,miopenConvolutionBwdWeightsAlgoDirect,<unused>;miopenConvolutionBwdWeightsAlgoGEMM:GemmWrw1x1_stride1,2.27868,0,MIOpenGEMM,1_0_49_49_832_832_160_49
96-28-28-3x3-128-28-28-128-1x1-1x1-1x1-0-NCHW-FP32-F=miopenConvolutionFwdAlgoWinograd:ConvBinWinogradRxSf2x3,1.29913,0,miopenConvolutionFwdAlgoWinograd,<unused>
832-7-7-1x1-384-7-7-128-0x0-1x1-1x1-0-NCHW-FP32-F=miopenConvolutionFwdAlgoDirect:ConvOclDirectFwd1x1,0.847417,0,miopenConvolutionFwdAlgoDirect,<unused>;miopenConvolutionFwdAlgoWinograd:ConvBinWinogradRxSf3x2,2.10231,0,miopenConvolutionFwdAlgoWinograd,<unused>;miopenConvolutionFwdAlgoGEMM:GemmFwd1x1_0_1,5.98316,0,MIOpenGEMM,0_0_49_832_49_49_384_832
256-28-28-1x1-128-28-28-128-0x0-1x1-1x1-0-NCHW-FP32-F=miopenConvolutionFwdAlgoDirect:ConvOclDirectFwd1x1,1.05589,0,miopenConvolutionFwdAlgoDirect,<unused>;miopenConvolutionFwdAlgoWinograd:ConvBinWinogradRxSf3x2,2.56175,0,miopenConvolutionFwdAlgoWinograd,<unused>;miopenConvolutionFwdAlgoGEMM:GemmFwd1x1_0_1,4.36282,0,MIOpenGEMM,0_0_784_256_784_784_128_256
112-14-14-1x1-512-14-14-128-0x0-1x1-1x1-0-NCHW-FP32-B=miopenConvolutionBwdDataAlgoDirect:ConvAsm1x1U,0.599986,0,miopenConvolutionBwdDataAlgoDirect,<unused>;miopenConvolutionBwdDataAlgoWinograd:ConvBinWinogradRxSf3x2,1.28608,0,miopenConvolutionBwdDataAlgoWinograd,<unused>;miopenConvolutionBwdDataAlgoGEMM:GemmBwd1x1_stride1,20.7053,0,MIOpenGEMM,0_1_196_512_196_196_512_112
320-7-7-3x3-160-7-7-128-1x1-1x1-1x1-0-NCHW-FP32-B=miopenConvolutionBwdDataAlgoWinograd:ConvBinWinograd3x3U,0.397313,0,miopenConvolutionBwdDataAlgoWinograd,<unused>
208-14-14-3x3-96-14-14-128-1x1-1x1-1x1-0-NCHW-FP32-W=miopenConvolutionBwdWeightsAlgoDirect:ConvAsmBwdWrW3x3,1.84128,0,miopenConvolutionBwdWeightsAlgoDirect,<unused>;miopenConvolutionBwdWeightsAlgoWinograd:ConvBinWinogradRxS,2.18944,0,miopenConvolutionBwdWeightsAlgoWinograd,208x14x14x3x3x96x14x14x128xNCHWxFP32x1x1x1x1x1x1x1x0;miopenConvolutionBwdWeightsAlgoGEMM:GemmWrwUniversal,8.29686,677376,MIOpenGEMM,1_0_196_196_864_864_208_196
160-7-7-1x1-832-7-7-128-0x0-1x1-1x1-0-NCHW-FP32-B=miopenConvolutionBwdDataAlgoDirect:ConvAsm1x1U,0.348239,0,miopenConvolutionBwdDataAlgoDirect,<unused>;miopenConvolutionBwdDataAlgoWinograd:ConvBinWinogradRxSf3x2,1.04333,0,miopenConvolutionBwdDataAlgoWinograd,<unused>;miopenConvolutionBwdDataAlgoGEMM:GemmBwd1x1_stride1,3.12454,0,MIOpenGEMM,0_1_49_832_49_49_832_160
208-14-14-3x3-96-14-14-128-1x1-1x1-1x1-0-NCHW-FP32-B=miopenConvolutionBwdDataAlgoWinograd:ConvBinWinogradRxS,0.521151,0,miopenConvolutionBwdDataAlgoWinograd,<unused>
64-14-14-5x5-24-14-14-128-2x2-1x1-1x1-0-NCHW-FP32-W=miopenConvolutionBwdWeightsAlgoDirect:ConvOclBwdWrW53,0.510995,19660800,miopenConvolutionBwdWeightsAlgoDirect,<unused>;miopenConvolutionBwdWeightsAlgoWinograd:ConvBinWinogradRxSf2x3,0.869436,0,miopenConvolutionBwdWeightsAlgoWinograd,64x14x14x5x5x24x14x14x128xNCHWxFP32x2x2x1x1x1x1x1x0;miopenConvolutionBwdWeightsAlgoGEMM:GemmWrwUniversal,6.83578,470400,MIOpenGEMM,1_0_196_196_600_600_64_196
32-7-7-1x1-832-7-7-128-0x0-1x1-1x1-0-NCHW-FP32-W=miopenConvolutionBwdWeightsAlgoDirect:ConvAsmBwdWrW1x1,0.141438,0,miopenConvolutionBwdWeightsAlgoDirect,<unused>;miopenConvolutionBwdWeightsAlgoGEMM:GemmWrw1x1_stride1,1.82293,0,MIOpenGEMM,1_0_49_49_832_832_32_49
96-14-14-3x3-208-14-14-128-1x1-1x1-1x1-0-NCHW-FP32-F=miopenConvolutionFwdAlgoWinograd:ConvBinWinogradRxSf2x3,0.700121,0,miopenConvolutionFwdAlgoWinograd,<unused>
160-7-7-3x3-320-7-7-128-1x1-1x1-1x1-0-NCHW-FP32-F=miopenConvolutionFwdAlgoWinograd:ConvBinWinogradRxSf2x3,0.546477,0,miopenConvolutionFwdAlgoWinograd,<unused>
512-14-14-1x1-112-14-14-128-0x0-1x1-1x1-0-NCHW-FP32-F=miopenConvolutionFwdAlgoDirect:ConvAsm1x1U,0.477265,0,miopenConvolutionFwdAlgoDirect,<unused>;miopenConvolutionFwdAlgoGEMM:GemmFwd1x1_0_1,5.00723,0,MIOpenGEMM,0_0_196_512_196_196_112_512
64-14-14-5x5-24-14-14-128-2x2-1x1-1x1-0-NCHW-FP32-B=miopenConvolutionBwdDataAlgoWinograd:ConvBinWinogradRxSf2x3,0.23961,0,miopenConvolutionBwdDataAlgoWinograd,<unused>;miopenConvolutionBwdDataAlgoFFT:fft,0.327784,28385280,miopenConvolutionBwdDataAlgoFFT,64x14x14x5x5x24x14x14x128xNCHWxFP32x2x2x1x1x1x1x1x0;miopenConvolutionBwdDataAlgoDirect:ConvOclDirectFwd,0.616881,0,miopenConvolutionBwdDataAlgoDirect,<unused>;miopenConvolutionBwdDataAlgoGEMM:GemmBwdRest,5.95659,470400,MIOpenGEMM,0_1_196_600_196_196_600_64
48-7-7-1x1-832-7-7-128-0x0-1x1-1x1-0-NCHW-FP32-W=miopenConvolutionBwdWeightsAlgoDirect:ConvAsmBwdWrW1x1,0.222751,0,miopenConvolutionBwdWeightsAlgoDirect,<unused>;miopenConvolutionBwdWeightsAlgoGEMM:GemmWrw1x1_stride1,2.00207,0,MIOpenGEMM,1_0_49_49_832_832_48_49
320-14-14-3x3-160-14-14-128-1x1-1x1-1x1-0-NCHW-FP32-W=miopenConvolutionBwdWeightsAlgoWinograd:ConvBinWinogradRxS,2.82065,0,miopenConvolutionBwdWeightsAlgoWinograd,320x14x14x3x3x160x14x14x128xNCHWxFP32x1x1x1x1x1x1x1x0;miopenConvolutionBwdWeightsAlgoDirect:ConvOclBwdWrW53,4.08264,0,miopenConvolutionBwdWeightsAlgoDirect,<unused>;miopenConvolutionBwdWeightsAlgoGEMM:GemmWrwUniversal,13.2412,1128960,MIOpenGEMM,1_0_196_196_1440_1440_320_196
32-7-7-1x1-832-7-7-128-0x0-1x1-1x1-0-NCHW-FP32-B=miopenConvolutionBwdDataAlgoDirect:ConvAsm1x1U,0.08015,0,miopenConvolutionBwdDataAlgoDirect,<unused>;miopenConvolutionBwdDataAlgoWinograd:ConvBinWinogradRxSf3x2,0.25695,0,miopenConvolutionBwdDataAlgoWinograd,<unused>;miopenConvolutionBwdDataAlgoGEMM:GemmBwd1x1_stride1,1.6737,0,MIOpenGEMM,0_1_49_832_49_49_832_32
96-14-14-1x1-480-14-14-128-0x0-1x1-1x1-0-NCHW-FP32-W=miopenConvolutionBwdWeightsAlgoDirect:ConvAsmBwdWrW1x1,0.58741,0,miopenConvolutionBwdWeightsAlgoDirect,<unused>;miopenConvolutionBwdWeightsAlgoWinograd:ConvBinWinogradRxSf2x3,1.54459,0,miopenConvolutionBwdWeightsAlgoWinograd,96x14x14x1x1x480x14x14x128xNCHWxFP32x0x0x1x1x1x1x1x0;miopenConvolutionBwdWeightsAlgoGEMM:GemmWrw1x1_stride1,3.1385,0,MIOpenGEMM,1_0_196_196_480_480_96_196
832-7-7-1x1-160-7-7-128-0x0-1x1-1x1-0-NCHW-FP32-F=miopenConvolutionFwdAlgoDirect:ConvAsm1x1U,0.320186,0,miopenConvolutionFwdAlgoDirect,<unused>;miopenConvolutionFwdAlgoWinograd:ConvBinWinogradRxSf3x2,0.579944,0,miopenConvolutionFwdAlgoWinograd,<unused>;miopenConvolutionFwdAlgoGEMM:GemmFwd1x1_0_1,2.8487,0,MIOpenGEMM,0_0_49_832_49_49_160_832
24-14-14-5x5-64-14-14-128-2x2-1x1-1x1-0-NCHW-FP32-F=miopenConvolutionFwdAlgoWinograd:ConvBinWinogradRxS,0.190771,0,miopenConvolutionFwdAlgoWinograd,<unused>;miopenConvolutionFwdAlgoImplicitGEMM:ConvHipImplicitGemmV4R1Fwd,0.33013,0,miopenConvolutionFwdAlgoImplicitGEMM,24x14x14x5x5x64x14x14x128xNCHWxFP32x2x2x1x1x1x1x1x1;miopenConvolutionFwdAlgoFFT:fft,0.385469,23777280,miopenConvolutionFwdAlgoFFT,24x14x14x5x5x64x14x14x128xNCHWxFP32x2x2x1x1x1x1x1x1;miopenConvolutionFwdAlgoDirect:ConvOclDirectFwd,0.596657,0,miopenConvolutionFwdAlgoDirect,<unused>;miopenConvolutionFwdAlgoGEMM:GemmFwdRest,6.97393,470400,MIOpenGEMM,0_0_196_600_196_196_64_600
320-14-14-3x3-160-14-14-128-1x1-1x1-1x1-0-NCHW-FP32-B=miopenConvolutionBwdDataAlgoWinograd:ConvBinWinograd3x3U,1.11766,0,miopenConvolutionBwdDataAlgoWinograd,<unused>
832-7-7-1x1-128-7-7-128-0x0-1x1-1x1-0-NCHW-FP32-F=miopenConvolutionFwdAlgoDirect:ConvAsm1x1U,0.325063,0,miopenConvolutionFwdAlgoDirect,<unused>;miopenConvolutionFwdAlgoWinograd:ConvBinWinogradRxSf2x3,0.7158,0,miopenConvolutionFwdAlgoWinograd,<unused>;miopenConvolutionFwdAlgoGEMM:GemmFwd1x1_0_1,4.5971,0,MIOpenGEMM,0_0_49_832_49_49_128_832
832-7-7-1x1-32-7-7-128-0x0-1x1-1x1-0-NCHW-FP32-F=miopenConvolutionFwdAlgoDirect:ConvAsm1x1U,0.132913,0,miopenConvolutionFwdAlgoDirect,<unused>;miopenConvolutionFwdAlgoGEMM:GemmFwd1x1_0_1,4.24453,0,MIOpenGEMM,0_0_49_832_49_49_32_832
160-14-14-1x1-512-14-14-128-0x0-1x1-1x1-0-NCHW-FP32-B=miopenConvolutionBwdDataAlgoDirect:ConvAsm1x1U,0.772973,0,miopenConvolutionBwdDataAlgoDirect,<unused>;miopenConvolutionBwdDataAlgoWinograd:ConvBinWinogradRxSf3x2,1.71709,0,miopenConvolutionBwdDataAlgoWinograd,<unused>;miopenConvolutionBwdDataAlgoGEMM:GemmBwd1x1_stride1,51.0654,0,MIOpenGEMM,0_1_196_512_196_196_512_160
48-7-7-1x1-832-7-7-128-0x0-1x1-1x1-0-NCHW-FP32-B=miopenConvolutionBwdDataAlgoDirect:ConvAsm1x1U,0.106159,0,miopenConvolutionBwdDataAlgoDirect,<unused>
96-14-14-1x1-480-14-14-128-0x0-1x1-1x1-0-NCHW-FP32-B=miopenConvolutionBwdDataAlgoDirect:ConvAsm1x1U,0.35071,0,miopenConvolutionBwdDataAlgoDirect,<unused>;miopenConvolutionBwdDataAlgoGEMM:GemmBwd1x1_stride1,14.6655,0,MIOpenGEMM,0_1_196_480_196_196_480_96
64-224-224-3x3-64-224-224-128-1x1-1x1-1x1-0-NCHW-FP32-W=miopenConvolutionBwdWeightsAlgoDirect:ConvAsmBwdWrW3x3,75.4721,0,miopenConvolutionBwdWeightsAlgoDirect,<unused>;miopenConvolutionBwdWeightsAlgoGEMM:GemmWrwUniversal,198.635,115605504,MIOpenGEMM,1_0_50176_50176_576_576_64_50176;miopenConvolutionBwdWeightsAlgoWinograd:ConvBinWinogradRxSf2x3,685.754,0,miopenConvolutionBwdWeightsAlgoWinograd,64x224x224x3x3x64x224x224x128xNCHWxFP32x1x1x1x1x1x1x1x0;miopenConvolutionBwdWeightsAlgoImplicitGEMM:ConvHipImplicitGemmV4R1WrW,763.836,0,miopenConvolutionBwdWeightsAlgoImplicitGEMM,64x224x224x3x3x64x224x224x128xNCHWxFP32x1x1x1x1x1x1x1x0
128-7-7-1x1-832-7-7-128-0x0-1x1-1x1-0-NCHW-FP32-W=miopenConvolutionBwdWeightsAlgoDirect:ConvAsmBwdWrW1x1,0.379315,0,miopenConvolutionBwdWeightsAlgoDirect,<unused>;miopenConvolutionBwdWeightsAlgoGEMM:GemmWrw1x1_stride1,1.84649,0,MIOpenGEMM,1_0_49_49_832_832_128_49
192-56-56-3x3-64-56-56-128-1x1-1x1-1x1-0-NCHW-FP32-W=miopenConvolutionBwdWeightsAlgoDirect:ConvAsmBwdWrW3x3,11.9521,0,miopenConvolutionBwdWeightsAlgoDirect,<unused>;miopenConvolutionBwdWeightsAlgoWinograd:ConvBinWinogradRxSf2x3,18.6201,0,miopenConvolutionBwdWeightsAlgoWinograd,192x56x56x3x3x64x56x56x128xNCHWxFP32x1x1x1x1x1x1x1x0;miopenConvolutionBwdWeightsAlgoImplicitGEMM:ConvHipImplicitGemmV4R1WrW,69.9408,0,miopenConvolutionBwdWeightsAlgoImplicitGEMM,192x56x56x3x3x64x56x56x128xNCHWxFP32x1x1x1x1x1x1x1x0;miopenConvolutionBwdWeightsAlgoGEMM:GemmWrwUniversal,101.507,7225344,MIOpenGEMM,1_0_3136_3136_576_576_192_3136
512-14-14-1x1-160-14-14-128-0x0-1x1-1x1-0-NCHW-FP32-F=miopenConvolutionFwdAlgoDirect:ConvAsm1x1U,1.06061,0,miopenConvolutionFwdAlgoDirect,<unused>;miopenConvolutionFwdAlgoGEMM:GemmFwd1x1_0_1,7.63708,0,MIOpenGEMM,0_0_196_512_196_196_160_512
256-7-7-1x1-832-7-7-128-0x0-1x1-1x1-0-NCHW-FP32-W=miopenConvolutionBwdWeightsAlgoDirect:ConvAsmBwdWrW1x1,0.695412,0,miopenConvolutionBwdWeightsAlgoDirect,<unused>;miopenConvolutionBwdWeightsAlgoGEMM:GemmWrw1x1_stride1,2.146,0,MIOpenGEMM,1_0_49_49_832_832_256_49;miopenConvolutionBwdWeightsAlgoWinograd:ConvBinWinogradRxSf2x3,2.19034,0,miopenConvolutionBwdWeightsAlgoWinograd,256x7x7x1x1x832x7x7x128xNCHWxFP32x0x0x1x1x1x1x1x0
64-14-14-1x1-512-14-14-128-0x0-1x1-1x1-0-NCHW-FP32-B=miopenConvolutionBwdDataAlgoDirect:ConvAsm1x1U,0.298016,0,miopenConvolutionBwdDataAlgoDirect,<unused>;miopenConvolutionBwdDataAlgoWinograd:ConvBinWinogradRxSf3x2,0.652804,0,miopenConvolutionBwdDataAlgoWinograd,<unused>;miopenConvolutionBwdDataAlgoGEMM:GemmBwd1x1_stride1,2.72276,0,MIOpenGEMM,0_1_196_512_196_196_512_64
128-7-7-1x1-832-7-7-128-0x0-1x1-1x1-0-NCHW-FP32-B=miopenConvolutionBwdDataAlgoDirect:ConvAsm1x1U,0.190728,0,miopenConvolutionBwdDataAlgoDirect,<unused>;miopenConvolutionBwdDataAlgoWinograd:ConvBinWinogradRxSf3x2,0.579622,0,miopenConvolutionBwdDataAlgoWinograd,<unused>;miopenConvolutionBwdDataAlgoGEMM:GemmBwd1x1_stride1,2.87815,0,MIOpenGEMM,0_1_49_832_49_49_832_128
144-14-14-1x1-512-14-14-128-0x0-1x1-1x1-0-NCHW-FP32-W=miopenConvolutionBwdWeightsAlgoDirect:ConvAsmBwdWrW1x1,1.21551,0,miopenConvolutionBwdWeightsAlgoDirect,<unused>
192-56-56-3x3-64-56-56-128-1x1-1x1-1x1-0-NCHW-FP32-B=miopenConvolutionBwdDataAlgoWinograd:ConvBinWinogradRxSf2x3,4.5732,0,miopenConvolutionBwdDataAlgoWinograd,<unused>
256-7-7-1x1-832-7-7-128-0x0-1x1-1x1-0-NCHW-FP32-B=miopenConvolutionBwdDataAlgoDirect:ConvAsm1x1U,0.319556,0,miopenConvolutionBwdDataAlgoDirect,<unused>;miopenConvolutionBwdDataAlgoWinograd:ConvBinWinogradRxSf3x2,0.964116,0,miopenConvolutionBwdDataAlgoWinograd,<unused>;miopenConvolutionBwdDataAlgoGEMM:GemmBwd1x1_stride1,2.75827,0,MIOpenGEMM,0_1_49_832_49_49_832_256
528-14-14-1x1-32-14-14-128-0x0-1x1-1x1-0-NCHW-FP32-F=miopenConvolutionFwdAlgoDirect:ConvAsm1x1U,0.230197,0,miopenConvolutionFwdAlgoDirect,<unused>;miopenConvolutionFwdAlgoWinograd:ConvBinWinogradRxSf3x2,0.447408,0,miopenConvolutionFwdAlgoWinograd,<unused>;miopenConvolutionFwdAlgoGEMM:GemmFwd1x1_0_1,3.76856,0,MIOpenGEMM,0_0_196_528_196_196_32_528
256-56-56-3x3-256-56-56-128-1x1-1x1-1x1-0-NCHW-FP32-W=miopenConvolutionBwdWeightsAlgoWinograd:ConvBinWinogradRxSf2x3,78.5608,0,miopenConvolutionBwdWeightsAlgoWinograd,256x56x56x3x3x256x56x56x128xNCHWxFP32x1x1x1x1x1x1x1x0;miopenConvolutionBwdWeightsAlgoDirect:ConvAsmBwdWrW3x3,83.217,0,miopenConvolutionBwdWeightsAlgoDirect,<unused>;miopenConvolutionBwdWeightsAlgoImplicitGEMM:ConvHipImplicitGemmV4R1WrW,125.655,0,miopenConvolutionBwdWeightsAlgoImplicitGEMM,256x56x56x3x3x256x56x56x128xNCHWxFP32x1x1x1x1x1x1x1x0;miopenConvolutionBwdWeightsAlgoGEMM:GemmWrwUniversal,319.606,28901376,MIOpenGEMM,1_0_3136_3136_2304_2304_256_3136
96-28-28-1x1-192-28-28-128-0x0-1x1-1x1-0-NCHW-FP32-B=miopenConvolutionBwdDataAlgoDirect:ConvAsm1x1U,0.529028,0,miopenConvolutionBwdDataAlgoDirect,<unused>;miopenConvolutionBwdDataAlgoWinograd:ConvBinWinogradRxSf3x2,1.26154,0,miopenConvolutionBwdDataAlgoWinograd,<unused>;miopenConvolutionBwdDataAlgoGEMM:GemmBwd1x1_stride1,41.6651,0,MIOpenGEMM,0_1_784_192_784_784_192_96
64-56-56-3x3-192-56-56-128-1x1-1x1-1x1-0-NCHW-FP32-F=miopenConvolutionFwdAlgoWinograd:ConvBinWinograd3x3U,4.74558,0,miopenConvolutionFwdAlgoWinograd,<unused>
64-224-224-3x3-3-224-224-128-1x1-1x1-1x1-0-NCHW-FP32-W=miopenConvolutionBwdWeightsAlgoDirect:ConvOclBwdWrW53,20.5142,884736,miopenConvolutionBwdWeightsAlgoDirect,<unused>;miopenConvolutionBwdWeightsAlgoWinograd:ConvBinWinogradRxSf2x3,797.123,0,miopenConvolutionBwdWeightsAlgoWinograd,64x224x224x3x3x3x224x224x128xNCHWxFP32x1x1x1x1x1x1x1x0;miopenConvolutionBwdWeightsAlgoGEMM:GemmWrwUniversal,963.593,5419008,MIOpenGEMM,1_0_50176_50176_27_27_64_50176
832-7-7-1x1-256-7-7-128-0x0-1x1-1x1-0-NCHW-FP32-F=miopenConvolutionFwdAlgoDirect:ConvAsm1x1U,0.62189,0,miopenConvolutionFwdAlgoDirect,<unused>;miopenConvolutionFwdAlgoWinograd:ConvBinWinogradRxS,1.55782,0,miopenConvolutionFwdAlgoWinograd,<unused>;miopenConvolutionFwdAlgoGEMM:GemmFwd1x1_0_1,8.27477,0,MIOpenGEMM,0_0_49_832_49_49_256_832
128-112-112-3x3-64-112-112-128-1x1-1x1-1x1-0-NCHW-FP32-B=miopenConvolutionBwdDataAlgoWinograd:ConvBinWinograd3x3U,24.3864,0,miopenConvolutionBwdDataAlgoWinograd,<unused>
128-14-14-1x1-528-14-14-128-0x0-1x1-1x1-0-NCHW-FP32-W=miopenConvolutionBwdWeightsAlgoDirect:ConvAsmBwdWrW1x1,1.18935,0,miopenConvolutionBwdWeightsAlgoDirect,<unused>;miopenConvolutionBwdWeightsAlgoWinograd:ConvBinWinogradRxSf2x3,3.04117,0,miopenConvolutionBwdWeightsAlgoWinograd,128x14x14x1x1x528x14x14x128xNCHWxFP32x0x0x1x1x1x1x1x0;miopenConvolutionBwdWeightsAlgoGEMM:GemmWrw1x1_stride1,4.00423,0,MIOpenGEMM,1_0_196_196_528_528_128_196
32-14-14-1x1-528-14-14-128-0x0-1x1-1x1-0-NCHW-FP32-W=miopenConvolutionBwdWeightsAlgoDirect:ConvAsmBwdWrW1x1,0.317776,0,miopenConvolutionBwdWeightsAlgoDirect,<unused>;miopenConvolutionBwdWeightsAlgoWinograd:ConvBinWinogradRxSf2x3,1.41817,0,miopenConvolutionBwdWeightsAlgoWinograd,32x14x14x1x1x528x14x14x128xNCHWxFP32x0x0x1x1x1x1x1x0;miopenConvolutionBwdWeightsAlgoGEMM:GemmWrw1x1_stride1,2.17035,0,MIOpenGEMM,1_0_196_196_528_528_32_196
192-28-28-1x1-96-28-28-128-0x0-1x1-1x1-0-NCHW-FP32-F=miopenConvolutionFwdAlgoDirect:ConvOclDirectFwd1x1,0.72974,0,miopenConvolutionFwdAlgoDirect,<unused>;miopenConvolutionFwdAlgoWinograd:ConvBinWinogradRxSf3x2,1.49583,0,miopenConvolutionFwdAlgoWinograd,<unused>;miopenConvolutionFwdAlgoGEMM:GemmFwd1x1_0_1,6.96961,0,MIOpenGEMM,0_0_784_192_784_784_96_192
32-28-28-1x1-192-28-28-128-0x0-1x1-1x1-0-NCHW-FP32-W=miopenConvolutionBwdWeightsAlgoDirect:ConvAsmBwdWrW1x1,0.355959,0,miopenConvolutionBwdWeightsAlgoDirect,<unused>
528-14-14-1x1-128-14-14-128-0x0-1x1-1x1-0-NCHW-FP32-F=miopenConvolutionFwdAlgoDirect:ConvAsm1x1U,0.766767,0,miopenConvolutionFwdAlgoDirect,<unused>;miopenConvolutionFwdAlgoWinograd:ConvBinWinogradRxSf3x2,1.4497,0,miopenConvolutionFwdAlgoWinograd,<unused>;miopenConvolutionFwdAlgoGEMM:GemmFwd1x1_0_1,7.96721,0,MIOpenGEMM,0_0_196_528_196_196_128_528
192-28-28-1x1-64-28-28-128-0x0-1x1-1x1-0-NCHW-FP32-F=miopenConvolutionFwdAlgoDirect:ConvOclDirectFwd1x1,0.407079,0,miopenConvolutionFwdAlgoDirect,<unused>;miopenConvolutionFwdAlgoWinograd:ConvBinWinogradRxSf3x2,0.742187,0,miopenConvolutionFwdAlgoWinograd,<unused>;miopenConvolutionFwdAlgoGEMM:GemmFwd1x1_0_1,3.32872,0,MIOpenGEMM,0_0_784_192_784_784_64_192
528-14-14-1x1-160-14-14-128-0x0-1x1-1x1-0-NCHW-FP32-F=miopenConvolutionFwdAlgoDirect:ConvAsm1x1U,1.04338,0,miopenConvolutionFwdAlgoDirect,<unused>;miopenConvolutionFwdAlgoWinograd:ConvBinWinogradRxSf3x2,1.66185,0,miopenConvolutionFwdAlgoWinograd,<unused>;miopenConvolutionFwdAlgoGEMM:GemmFwd1x1_0_1,7.5974,0,MIOpenGEMM,0_0_196_528_196_196_160_528
160-14-14-1x1-528-14-14-128-0x0-1x1-1x1-0-NCHW-FP32-B=miopenConvolutionBwdDataAlgoDirect:ConvAsm1x1U,0.87858,0,miopenConvolutionBwdDataAlgoDirect,<unused>;miopenConvolutionBwdDataAlgoGEMM:GemmBwd1x1_stride1,55.5986,0,MIOpenGEMM,0_1_196_528_196_196_528_160
64-28-28-1x1-192-28-28-128-0x0-1x1-1x1-0-NCHW-FP32-W=miopenConvolutionBwdWeightsAlgoDirect:ConvAsmBwdWrW1x1,0.750799,0,miopenConvolutionBwdWeightsAlgoDirect,<unused>
32-14-14-1x1-528-14-14-128-0x0-1x1-1x1-0-NCHW-FP32-B=miopenConvolutionBwdDataAlgoWinograd:ConvBinWinogradRxSf3x2,0.991664,0,miopenConvolutionBwdDataAlgoWinograd,<unused>;miopenConvolutionBwdDataAlgoGEMM:GemmBwd1x1_stride1,8.83298,0,MIOpenGEMM,0_1_196_528_196_196_528_32
256-14-14-1x1-528-14-14-128-0x0-1x1-1x1-0-NCHW-FP32-W=miopenConvolutionBwdWeightsAlgoDirect:ConvAsmBwdWrW1x1,2.31163,0,miopenConvolutionBwdWeightsAlgoDirect,<unused>;miopenConvolutionBwdWeightsAlgoWinograd:ConvBinWinogradRxSf2x3,11.0952,0,miopenConvolutionBwdWeightsAlgoWinograd,256x14x14x1x1x528x14x14x128xNCHWxFP32x0x0x1x1x1x1x1x0;miopenConvolutionBwdWeightsAlgoGEMM:GemmWrw1x1_stride1,14.8676,0,MIOpenGEMM,1_0_196_196_528_528_256_196
256-14-14-1x1-528-14-14-128-0x0-1x1-1x1-0-NCHW-FP32-B=miopenConvolutionBwdDataAlgoDirect:ConvAsm1x1U,1.34475,0,miopenConvolutionBwdDataAlgoDirect,<unused>;miopenConvolutionBwdDataAlgoGEMM:GemmBwd1x1_stride1,4.91655,0,MIOpenGEMM,0_1_196_528_196_196_528_256
64-28-28-1x1-192-28-28-128-0x0-1x1-1x1-0-NCHW-FP32-B=miopenConvolutionBwdDataAlgoDirect:ConvAsm1x1U,0.38576,0,miopenConvolutionBwdDataAlgoDirect,<unused>;miopenConvolutionBwdDataAlgoWinograd:ConvBinWinogradRxSf3x2,0.958277,0,miopenConvolutionBwdDataAlgoWinograd,<unused>;miopenConvolutionBwdDataAlgoGEMM:GemmBwd1x1_stride1,4.03988,0,MIOpenGEMM,0_1_784_192_784_784_192_64
128-14-14-1x1-528-14-14-128-0x0-1x1-1x1-0-NCHW-FP32-B=miopenConvolutionBwdDataAlgoDirect:ConvAsm1x1U,0.697322,0,miopenConvolutionBwdDataAlgoDirect,<unused>;miopenConvolutionBwdDataAlgoGEMM:GemmBwd1x1_stride1,36.201,0,MIOpenGEMM,0_1_196_528_196_196_528_128
160-17-17-7x1-160-17-17-128-3x0-1x1-1x1-0-NCHW-FP32-B=miopenConvolutionBwdDataAlgoWinograd:ConvBinWinogradRxSf3x2,2.01647,0,miopenConvolutionBwdDataAlgoWinograd,<unused>;miopenConvolutionBwdDataAlgoImplicitGEMM:ConvHipImplicitGemmBwdDataV1R1,4.61366,0,miopenConvolutionBwdDataAlgoImplicitGEMM,160x17x17x1x7x160x17x17x128xNCHWxFP32x0x3x1x1x1x1x1x0;miopenConvolutionBwdDataAlgoGEMM:GemmBwdRest,7.62855,1294720,MIOpenGEMM,0_1_289_1120_289_289_1120_160
1280-8-8-1x1-320-8-8-128-0x0-1x1-1x1-0-NCHW-FP32-F=miopenConvolutionFwdAlgoDirect:ConvAsm1x1U,1.55614,0,miopenConvolutionFwdAlgoDirect,<unused>;miopenConvolutionFwdAlgoWinograd:ConvBinWinogradRxSf3x2,2.89829,0,miopenConvolutionFwdAlgoWinograd,<unused>;miopenConvolutionFwdAlgoGEMM:GemmFwd1x1_0_1,9.26565,0,MIOpenGEMM,0_0_64_1280_64_64_320_1280
192-17-17-3x3-320-8-8-128-0x0-2x2-1x1-0-NCHW-FP32-F=miopenConvolutionFwdAlgoWinograd:ConvBinWinogradRxSf2x3,2.65817,0,miopenConvolutionFwdAlgoWinograd,<unused>;miopenConvolutionFwdAlgoDirect:ConvOclDirectFwd,8.36819,0,miopenConvolutionFwdAlgoDirect,<unused>;miopenConvolutionFwdAlgoGEMM:GemmFwdRest,11.4186,442368,MIOpenGEMM,0_0_64_1728_64_64_320_1728
160-17-17-7x1-160-17-17-128-3x0-1x1-1x1-0-NCHW-FP32-F=miopenConvolutionFwdAlgoImplicitGEMM:ConvHipImplicitGemmV4R1Fwd,2.48151,0,miopenConvolutionFwdAlgoImplicitGEMM,160x17x17x1x7x160x17x17x128xNCHWxFP32x0x3x1x1x1x1x1x1;miopenConvolutionFwdAlgoWinograd:ConvBinWinogradRxSf3x2,2.86531,0,miopenConvolutionFwdAlgoWinograd,<unused>;miopenConvolutionFwdAlgoGEMM:GemmFwdRest,23.2565,1294720,MIOpenGEMM,0_0_289_1120_289_289_160_1120
192-17-17-1x7-160-17-17-128-0x3-1x1-1x1-0-NCHW-FP32-W=miopenConvolutionBwdWeightsAlgoWinograd:ConvBinWinogradRxSf2x3,3.48241,0,miopenConvolutionBwdWeightsAlgoWinograd,192x17x17x7x1x160x17x17x128xNCHWxFP32x3x0x1x1x1x1x1x0;miopenConvolutionBwdWeightsAlgoDirect:ConvOclBwdWrW53,4.20341,0,miopenConvolutionBwdWeightsAlgoDirect,<unused>;miopenConvolutionBwdWeightsAlgoGEMM:GemmWrwUniversal,20.4038,1294720,MIOpenGEMM,1_0_289_289_1120_1120_192_289
128-17-17-1x7-128-17-17-128-0x3-1x1-1x1-0-NCHW-FP32-W=miopenConvolutionBwdWeightsAlgoDirect:ConvOclBwdWrW53,2.56518,0,miopenConvolutionBwdWeightsAlgoDirect,<unused>;miopenConvolutionBwdWeightsAlgoWinograd:ConvBinWinogradRxSf2x3,3.46538,0,miopenConvolutionBwdWeightsAlgoWinograd,128x17x17x7x1x128x17x17x128xNCHWxFP32x3x0x1x1x1x1x1x0;miopenConvolutionBwdWeightsAlgoImplicitGEMM:ConvHipImplicitGemmV4R1WrW,8.90607,0,miopenConvolutionBwdWeightsAlgoImplicitGEMM,128x17x17x7x1x128x17x17x128xNCHWxFP32x3x0x1x1x1x1x1x0;miopenConvolutionBwdWeightsAlgoGEMM:GemmWrwUniversal,23.786,1035776,MIOpenGEMM,1_0_289_289_896_896_128_289
192-8-8-1x1-1280-8-8-128-0x0-1x1-1x1-0-NCHW-FP32-W=miopenConvolutionBwdWeightsAlgoDirect:ConvAsmBwdWrW1x1,0.572095,0,miopenConvolutionBwdWeightsAlgoDirect,<unused>;miopenConvolutionBwdWeightsAlgoWinograd:ConvBinWinogradRxSf2x3,3.27371,0,miopenConvolutionBwdWeightsAlgoWinograd,192x8x8x1x1x1280x8x8x128xNCHWxFP32x0x0x1x1x1x1x1x0;miopenConvolutionBwdWeightsAlgoGEMM:GemmWrw1x1_stride1,4.04666,0,MIOpenGEMM,1_0_64_64_1280_1280_192_64
192-17-17-1x7-160-17-17-128-0x3-1x1-1x1-0-NCHW-FP32-B=miopenConvolutionBwdDataAlgoWinograd:ConvBinWinogradRxSf3x2,2.30365,0,miopenConvolutionBwdDataAlgoWinograd,<unused>;miopenConvolutionBwdDataAlgoImplicitGEMM:ConvHipImplicitGemmBwdDataV1R1,5.71694,0,miopenConvolutionBwdDataAlgoImplicitGEMM,192x17x17x7x1x160x17x17x128xNCHWxFP32x3x0x1x1x1x1x1x0;miopenConvolutionBwdDataAlgoGEMM:GemmBwdRest,33.4563,1294720,MIOpenGEMM,0_1_289_1120_289_289_1120_192
64-14-14-1x1-512-14-14-128-0x0-1x1-1x1-0-NCHW-FP32-W=miopenConvolutionBwdWeightsAlgoDirect:ConvAsmBwdWrW1x1,0.528953,0,miopenConvolutionBwdWeightsAlgoDirect,<unused>
448-8-8-1x1-1280-8-8-128-0x0-1x1-1x1-0-NCHW-FP32-W=miopenConvolutionBwdWeightsAlgoDirect:ConvAsmBwdWrW1x1,2.06052,0,miopenConvolutionBwdWeightsAlgoDirect,<unused>;miopenConvolutionBwdWeightsAlgoGEMM:GemmWrw1x1_stride1,4.19888,0,MIOpenGEMM,1_0_64_64_1280_1280_448_64;miopenConvolutionBwdWeightsAlgoWinograd:ConvBinWinogradRxS,9.30462,0,miopenConvolutionBwdWeightsAlgoWinograd,448x8x8x1x1x1280x8x8x128xNCHWxFP32x0x0x1x1x1x1x1x0
192-8-8-1x1-1280-8-8-128-0x0-1x1-1x1-0-NCHW-FP32-B=miopenConvolutionBwdDataAlgoDirect:ConvAsm1x1U,0.442394,0,miopenConvolutionBwdDataAlgoDirect,<unused>;miopenConvolutionBwdDataAlgoGEMM:GemmBwd1x1_stride1,5.98759,0,MIOpenGEMM,0_1_64_1280_64_64_1280_192
160-17-17-1x7-192-17-17-128-0x3-1x1-1x1-0-NCHW-FP32-F=miopenConvolutionFwdAlgoWinograd:ConvBinWinogradRxS,5.15779,0,miopenConvolutionFwdAlgoWinograd,<unused>;miopenConvolutionFwdAlgoImplicitGEMM:ConvHipImplicitGemmV4R1Fwd,5.97489,0,miopenConvolutionFwdAlgoImplicitGEMM,160x17x17x7x1x192x17x17x128xNCHWxFP32x3x0x1x1x1x1x1x1;miopenConvolutionFwdAlgoGEMM:GemmFwdRest,202.603,1294720,MIOpenGEMM,0_0_289_1120_289_289_192_1120
192-17-17-1x7-192-17-17-128-0x3-1x1-1x1-0-NCHW-FP32-W=miopenConvolutionBwdWeightsAlgoDirect:ConvOclBwdWrW53,4.81718,0,miopenConvolutionBwdWeightsAlgoDirect,<unused>;miopenConvolutionBwdWeightsAlgoWinograd:ConvBinWinogradRxSf2x3,5.36997,0,miopenConvolutionBwdWeightsAlgoWinograd,192x17x17x7x1x192x17x17x128xNCHWxFP32x3x0x1x1x1x1x1x0;miopenConvolutionBwdWeightsAlgoImplicitGEMM:ConvHipImplicitGemmV4R1WrW,7.4524,0,miopenConvolutionBwdWeightsAlgoImplicitGEMM,192x17x17x7x1x192x17x17x128xNCHWxFP32x3x0x1x1x1x1x1x0;miopenConvolutionBwdWeightsAlgoGEMM:GemmWrwUniversal,10.7798,1553664,MIOpenGEMM,1_0_289_289_1344_1344_192_289
512-14-14-1x1-64-14-14-128-0x0-1x1-1x1-0-NCHW-FP32-F=miopenConvolutionFwdAlgoDirect:ConvAsm1x1U,0.387408,0,miopenConvolutionFwdAlgoDirect,<unused>;miopenConvolutionFwdAlgoWinograd:ConvBinWinogradRxSf3x2,0.810974,0,miopenConvolutionFwdAlgoWinograd,<unused>;miopenConvolutionFwdAlgoGEMM:GemmFwd1x1_0_1,5.68599,0,MIOpenGEMM,0_0_196_512_196_196_64_512
384-8-8-1x1-2048-8-8-128-0x0-1x1-1x1-0-NCHW-FP32-W=miopenConvolutionBwdWeightsAlgoDirect:ConvAsmBwdWrW1x1,2.44738,0,miopenConvolutionBwdWeightsAlgoDirect,<unused>;miopenConvolutionBwdWeightsAlgoGEMM:GemmWrw1x1_stride1,5.46058,0,MIOpenGEMM,1_0_64_64_2048_2048_384_64;miopenConvolutionBwdWeightsAlgoWinograd:ConvBinWinogradRxSf2x3,7.96497,0,miopenConvolutionBwdWeightsAlgoWinograd,384x8x8x1x1x2048x8x8x128xNCHWxFP32x0x0x1x1x1x1x1x0
192-17-17-7x1-160-17-17-128-3x0-1x1-1x1-0-NCHW-FP32-W=miopenConvolutionBwdWeightsAlgoWinograd:ConvBinWinogradRxSf2x3,3.27152,0,miopenConvolutionBwdWeightsAlgoWinograd,192x17x17x1x7x160x17x17x128xNCHWxFP32x0x3x1x1x1x1x1x0;miopenConvolutionBwdWeightsAlgoDirect:ConvOclBwdWrW53,9.11368,0,miopenConvolutionBwdWeightsAlgoDirect,<unused>;miopenConvolutionBwdWeightsAlgoGEMM:GemmWrwUniversal,9.80852,1294720,MIOpenGEMM,1_0_289_289_1120_1120_192_289
192-17-17-1x7-192-17-17-128-0x3-1x1-1x1-0-NCHW-FP32-B=miopenConvolutionBwdDataAlgoWinograd:ConvBinWinogradRxSf3x2,2.72962,0,miopenConvolutionBwdDataAlgoWinograd,<unused>;miopenConvolutionBwdDataAlgoImplicitGEMM:ConvHipImplicitGemmBwdDataV1R1,3.92867,0,miopenConvolutionBwdDataAlgoImplicitGEMM,192x17x17x7x1x192x17x17x128xNCHWxFP32x3x0x1x1x1x1x1x0;miopenConvolutionBwdDataAlgoGEMM:GemmBwdRest,12.1927,1553664,MIOpenGEMM,0_1_289_1344_289_289_1344_192
1280-8-8-1x1-192-8-8-128-0x0-1x1-1x1-0-NCHW-FP32-F=miopenConvolutionFwdAlgoDirect:ConvAsm1x1U,0.707965,0,miopenConvolutionFwdAlgoDirect,<unused>;miopenConvolutionFwdAlgoWinograd:ConvBinWinogradRxSf3x2,1.22207,0,miopenConvolutionFwdAlgoWinograd,<unused>;miopenConvolutionFwdAlgoGEMM:GemmFwd1x1_0_1,11.9476,0,MIOpenGEMM,0_0_64_1280_64_64_192_1280
192-17-17-7x1-160-17-17-128-3x0-1x1-1x1-0-NCHW-FP32-B=miopenConvolutionBwdDataAlgoWinograd:ConvBinWinogradRxSf3x2,3.51046,0,miopenConvolutionBwdDataAlgoWinograd,<unused>;miopenConvolutionBwdDataAlgoImplicitGEMM:ConvHipImplicitGemmBwdDataV1R1,6.22936,0,miopenConvolutionBwdDataAlgoImplicitGEMM,192x17x17x1x7x160x17x17x128xNCHWxFP32x0x3x1x1x1x1x1x0;miopenConvolutionBwdDataAlgoGEMM:GemmBwdRest,14.0615,1294720,MIOpenGEMM,0_1_289_1120_289_289_1120_192
448-8-8-1x1-1280-8-8-128-0x0-1x1-1x1-0-NCHW-FP32-B=miopenConvolutionBwdDataAlgoDirect:ConvAsm1x1U,1.26903,0,miopenConvolutionBwdDataAlgoDirect,<unused>;miopenConvolutionBwdDataAlgoGEMM:GemmBwd1x1_stride1,9.96325,0,MIOpenGEMM,0_1_64_1280_64_64_1280_448
64-35-35-1x1-192-35-35-128-0x0-1x1-1x1-0-NCHW-FP32-B=miopenConvolutionBwdDataAlgoDirect:ConvAsm1x1U,0.96375,0,miopenConvolutionBwdDataAlgoDirect,<unused>;miopenConvolutionBwdDataAlgoGEMM:GemmBwd1x1_stride1,13.8267,0,MIOpenGEMM,0_1_1225_192_1225_1225_192_64
288-35-35-3x3-384-17-17-128-0x0-2x2-1x1-0-NCHW-FP32-F=miopenConvolutionFwdAlgoWinograd:ConvBinWinogradRxSf2x3,17.4739,0,miopenConvolutionFwdAlgoWinograd,<unused>;miopenConvolutionFwdAlgoDirect:ConvOclDirectFwd,96.669,0,miopenConvolutionFwdAlgoDirect,<unused>;miopenConvolutionFwdAlgoGEMM:GemmFwdRest,124.948,2996352,MIOpenGEMM,0_0_289_2592_289_289_384_2592
384-8-8-1x1-2048-8-8-128-0x0-1x1-1x1-0-NCHW-FP32-B=miopenConvolutionBwdDataAlgoDirect:ConvAsm1x1U,1.99176,0,miopenConvolutionBwdDataAlgoDirect,<unused>;miopenConvolutionBwdDataAlgoWinograd:ConvBinWinogradRxSf3x2,5.32801,0,miopenConvolutionBwdDataAlgoWinograd,<unused>;miopenConvolutionBwdDataAlgoGEMM:GemmBwd1x1_stride1,9.19719,0,MIOpenGEMM,0_1_64_2048_64_64_2048_384
160-17-17-7x1-192-17-17-128-3x0-1x1-1x1-0-NCHW-FP32-F=miopenConvolutionFwdAlgoImplicitGEMM:ConvHipImplicitGemmV4R1Fwd,3.36957,0,miopenConvolutionFwdAlgoImplicitGEMM,160x17x17x1x7x192x17x17x128xNCHWxFP32x0x3x1x1x1x1x1x1;miopenConvolutionFwdAlgoWinograd:ConvBinWinogradRxSf3x2,3.89833,0,miopenConvolutionFwdAlgoWinograd,<unused>;miopenConvolutionFwdAlgoGEMM:GemmFwdRest,51.8441,1294720,MIOpenGEMM,0_0_289_1120_289_289_192_1120
192-17-17-1x7-192-17-17-128-0x3-1x1-1x1-0-NCHW-FP32-F=miopenConvolutionFwdAlgoImplicitGEMM:ConvHipImplicitGemmV4R1Fwd,3.58229,0,miopenConvolutionFwdAlgoImplicitGEMM,192x17x17x7x1x192x17x17x128xNCHWxFP32x3x0x1x1x1x1x1x1;miopenConvolutionFwdAlgoWinograd:ConvBinWinogradRxSf3x2,4.06815,0,miopenConvolutionFwdAlgoWinograd,<unused>;miopenConvolutionFwdAlgoGEMM:GemmFwdRest,26.8397,1553664,MIOpenGEMM,0_0_289_1344_289_289_192_1344
32-149-149-3x3-3-299-299-128-0x0-2x2-1x1-0-NCHW-FP32-W=miopenConvolutionBwdWeightsAlgoDirect:ConvOclBwdWrW2NonTunable,8.07801,442368,miopenConvolutionBwdWeightsAlgoDirect,<unused>;miopenConvolutionBwdWeightsAlgoGEMM:GemmWrwUniversal,33.1057,2397708,MIOpenGEMM,1_0_22201_22201_27_27_32_22201
192-8-8-3x3-192-17-17-128-0x0-2x2-1x1-0-NCHW-FP32-W=miopenConvolutionBwdWeightsAlgoImplicitGEMM:ConvHipImplicitGemmV4R1WrW,2.68632,0,miopenConvolutionBwdWeightsAlgoImplicitGEMM,192x8x8x3x3x192x17x17x128xNCHWxFP32x0x0x2x2x1x1x1x0;miopenConvolutionBwdWeightsAlgoGEMM:GemmWrwUniversal,5.97687,442368,MIOpenGEMM,1_0_64_64_1728_1728_192_64;miopenConvolutionBwdWeightsAlgoDirect:ConvOclBwdWrW2NonTunable,28.549,169869312,miopenConvolutionBwdWeightsAlgoDirect,<unused>
32-149-149-3x3-3-299-299-128-0x0-2x2-1x1-0-NCHW-FP32-B=miopenConvolutionBwdDataAlgoDirect:ConvOclDirectFwd,4.45173,0,miopenConvolutionBwdDataAlgoDirect,<unused>;miopenConvolutionBwdDataAlgoWinograd:ConvBinWinogradRxSf2x3,6.5274,0,miopenConvolutionBwdDataAlgoWinograd,<unused>;miopenConvolutionBwdDataAlgoGEMM:GemmBwdRest,12.0565,2397708,MIOpenGEMM,0_1_22201_27_22201_22201_27_32
192-17-17-1x7-128-17-17-128-0x3-1x1-1x1-0-NCHW-FP32-W=miopenConvolutionBwdWeightsAlgoWinograd:ConvBinWinogradRxSf2x3,2.63674,0,miopenConvolutionBwdWeightsAlgoWinograd,192x17x17x7x1x128x17x17x128xNCHWxFP32x3x0x1x1x1x1x1x0;miopenConvolutionBwdWeightsAlgoDirect:ConvOclBwdWrW53,3.45773,0,miopenConvolutionBwdWeightsAlgoDirect,<unused>;miopenConvolutionBwdWeightsAlgoImplicitGEMM:ConvHipImplicitGemmV4R1WrW,6.49116,0,miopenConvolutionBwdWeightsAlgoImplicitGEMM,192x17x17x7x1x128x17x17x128xNCHWxFP32x3x0x1x1x1x1x1x0;miopenConvolutionBwdWeightsAlgoGEMM:GemmWrwUniversal,8.85998,1035776,MIOpenGEMM,1_0_289_289_896_896_192_289
2048-8-8-1x1-384-8-8-128-0x0-1x1-1x1-0-NCHW-FP32-F=miopenConvolutionFwdAlgoDirect:ConvAsm1x1U,2.44092,0,miopenConvolutionFwdAlgoDirect,<unused>;miopenConvolutionFwdAlgoWinograd:ConvBinWinogradRxSf3x2,4.10212,0,miopenConvolutionFwdAlgoWinograd,<unused>;miopenConvolutionFwdAlgoGEMM:GemmFwd1x1_0_1,14.6791,0,MIOpenGEMM,0_0_64_2048_64_64_384_2048
64-35-35-1x1-256-35-35-128-0x0-1x1-1x1-0-NCHW-FP32-W=miopenConvolutionBwdWeightsAlgoDirect:ConvAsmBwdWrW1x1,1.90152,0,miopenConvolutionBwdWeightsAlgoDirect,<unused>
1280-8-8-1x1-448-8-8-128-0x0-1x1-1x1-0-NCHW-FP32-F=miopenConvolutionFwdAlgoDirect:ConvAsm1x1U,2.79432,0,miopenConvolutionFwdAlgoDirect,<unused>;miopenConvolutionFwdAlgoGEMM:GemmFwd1x1_0_1,12.7388,0,MIOpenGEMM,0_0_64_1280_64_64_448_1280
160-17-17-1x7-160-17-17-128-0x3-1x1-1x1-0-NCHW-FP32-W=miopenConvolutionBwdWeightsAlgoDirect:ConvOclBwdWrW53,3.60134,0,miopenConvolutionBwdWeightsAlgoDirect,<unused>;miopenConvolutionBwdWeightsAlgoWinograd:ConvBinWinogradRxSf2x3,3.90549,0,miopenConvolutionBwdWeightsAlgoWinograd,160x17x17x7x1x160x17x17x128xNCHWxFP32x3x0x1x1x1x1x1x0;miopenConvolutionBwdWeightsAlgoGEMM:GemmWrwUniversal,11.3932,1294720,MIOpenGEMM,1_0_289_289_1120_1120_160_289
3-299-299-3x3-32-149-149-128-0x0-2x2-1x1-0-NCHW-FP32-F=miopenConvolutionFwdAlgoWinograd:ConvBinWinogradRxSf2x3,4.05382,0,miopenConvolutionFwdAlgoWinograd,<unused>;miopenConvolutionFwdAlgoDirect:ConvOclDirectFwd,5.48883,0,miopenConvolutionFwdAlgoDirect,<unused>;miopenConvolutionFwdAlgoGEMM:GemmFwdRest,23.0198,2397708,MIOpenGEMM,0_0_22201_27_22201_22201_32_27
192-17-17-1x7-128-17-17-128-0x3-1x1-1x1-0-NCHW-FP32-B=miopenConvolutionBwdDataAlgoWinograd:ConvBinWinogradRxSf3x2,2.33487,0,miopenConvolutionBwdDataAlgoWinograd,<unused>;miopenConvolutionBwdDataAlgoImplicitGEMM:ConvHipImplicitGemmBwdDataV1R1,19.575,0,miopenConvolutionBwdDataAlgoImplicitGEMM,192x17x17x7x1x128x17x17x128xNCHWxFP32x3x0x1x1x1x1x1x0;miopenConvolutionBwdDataAlgoGEMM:GemmBwdRest,56.5301,1035776,MIOpenGEMM,0_1_289_896_289_289_896_192
192-8-8-3x3-192-17-17-128-0x0-2x2-1x1-0-NCHW-FP32-B=miopenConvolutionBwdDataAlgoWinograd:ConvBinWinogradRxSf2x3,1.95464,0,miopenConvolutionBwdDataAlgoWinograd,<unused>;miopenConvolutionBwdDataAlgoImplicitGEMM:ConvHipImplicitGemmBwdDataV1R1,2.25753,0,miopenConvolutionBwdDataAlgoImplicitGEMM,192x8x8x3x3x192x17x17x128xNCHWxFP32x0x0x2x2x1x1x1x0;miopenConvolutionBwdDataAlgoDirect:ConvOclDirectFwd,7.69204,0,miopenConvolutionBwdDataAlgoDirect,<unused>;miopenConvolutionBwdDataAlgoGEMM:GemmBwdRest,8.72998,442368,MIOpenGEMM,0_1_64_1728_64_64_1728_192
384-8-8-1x3-384-8-8-128-0x1-1x1-1x1-0-NCHW-FP32-B=miopenConvolutionBwdDataAlgoWinograd:ConvBinWinogradRxSf2x3,1.20339,0,miopenConvolutionBwdDataAlgoWinograd,<unused>;miopenConvolutionBwdDataAlgoImplicitGEMM:ConvHipImplicitGemmBwdDataV1R1,1.31071,0,miopenConvolutionBwdDataAlgoImplicitGEMM,384x8x8x3x1x384x8x8x128xNCHWxFP32x1x0x1x1x1x1x1x0;miopenConvolutionBwdDataAlgoGEMM:GemmBwdRest,12.7145,294912,MIOpenGEMM,0_1_64_1152_64_64_1152_384
160-17-17-1x7-160-17-17-128-0x3-1x1-1x1-0-NCHW-FP32-B=miopenConvolutionBwdDataAlgoWinograd:ConvBinWinogradRxSf3x2,2.86079,0,miopenConvolutionBwdDataAlgoWinograd,<unused>;miopenConvolutionBwdDataAlgoImplicitGEMM:ConvHipImplicitGemmBwdDataV1R1,6.44997,0,miopenConvolutionBwdDataAlgoImplicitGEMM,160x17x17x7x1x160x17x17x128xNCHWxFP32x3x0x1x1x1x1x1x0;miopenConvolutionBwdDataAlgoGEMM:GemmBwdRest,16.3158,1294720,MIOpenGEMM,0_1_289_1120_289_289_1120_160
320-8-8-1x1-2048-8-8-128-0x0-1x1-1x1-0-NCHW-FP32-W=miopenConvolutionBwdWeightsAlgoDirect:ConvAsmBwdWrW1x1,2.15567,0,miopenConvolutionBwdWeightsAlgoDirect,<unused>;miopenConvolutionBwdWeightsAlgoGEMM:GemmWrw1x1_stride1,4.72231,0,MIOpenGEMM,1_0_64_64_2048_2048_320_64;miopenConvolutionBwdWeightsAlgoWinograd:ConvBinWinogradRxSf2x3,6.86431,0,miopenConvolutionBwdWeightsAlgoWinograd,320x8x8x1x1x2048x8x8x128xNCHWxFP32x0x0x1x1x1x1x1x0
64-35-35-1x1-288-35-35-128-0x0-1x1-1x1-0-NCHW-FP32-W=miopenConvolutionBwdWeightsAlgoDirect:ConvAsmBwdWrW1x1,1.46715,0,miopenConvolutionBwdWeightsAlgoDirect,<unused>;miopenConvolutionBwdWeightsAlgoGEMM:GemmWrw1x1_stride1,3.60122,0,MIOpenGEMM,1_0_1225_1225_288_288_64_1225;miopenConvolutionBwdWeightsAlgoWinograd:ConvBinWinogradRxSf2x3,6.80817,0,miopenConvolutionBwdWeightsAlgoWinograd,64x35x35x1x1x288x35x35x128xNCHWxFP32x0x0x1x1x1x1x1x0
384-8-8-1x1-1280-8-8-128-0x0-1x1-1x1-0-NCHW-FP32-W=miopenConvolutionBwdWeightsAlgoDirect:ConvAsmBwdWrW1x1,1.90164,0,miopenConvolutionBwdWeightsAlgoDirect,<unused>;miopenConvolutionBwdWeightsAlgoGEMM:GemmWrw1x1_stride1,6.84538,0,MIOpenGEMM,1_0_64_64_1280_1280_384_64;miopenConvolutionBwdWeightsAlgoWinograd:ConvBinWinogradRxSf2x3,7.33804,0,miopenConvolutionBwdWeightsAlgoWinograd,384x8x8x1x1x1280x8x8x128xNCHWxFP32x0x0x1x1x1x1x1x0
64-35-35-1x1-256-35-35-128-0x0-1x1-1x1-0-NCHW-FP32-B=miopenConvolutionBwdDataAlgoDirect:ConvAsm1x1U,0.791897,0,miopenConvolutionBwdDataAlgoDirect,<unused>;miopenConvolutionBwdDataAlgoWinograd:ConvBinWinogradRxSf3x2,1.97154,0,miopenConvolutionBwdDataAlgoWinograd,<unused>;miopenConvolutionBwdDataAlgoGEMM:GemmBwd1x1_stride1,7.09314,0,MIOpenGEMM,0_1_1225_256_1225_1225_256_64
128-17-17-1x7-192-17-17-128-0x3-1x1-1x1-0-NCHW-FP32-F=miopenConvolutionFwdAlgoWinograd:ConvBinWinogradRxSf3x2,2.48978,0,miopenConvolutionFwdAlgoWinograd,<unused>;miopenConvolutionFwdAlgoImplicitGEMM:ConvHipImplicitGemmV4R1Fwd,4.31394,0,miopenConvolutionFwdAlgoImplicitGEMM,128x17x17x7x1x192x17x17x128xNCHWxFP32x3x0x1x1x1x1x1x1;miopenConvolutionFwdAlgoGEMM:GemmFwdRest,316.021,1035776,MIOpenGEMM,0_0_289_896_289_289_192_896
384-8-8-1x3-384-8-8-128-0x1-1x1-1x1-0-NCHW-FP32-F=miopenConvolutionFwdAlgoImplicitGEMM:ConvHipImplicitGemmV4R1Fwd,1.28999,0,miopenConvolutionFwdAlgoImplicitGEMM,384x8x8x3x1x384x8x8x128xNCHWxFP32x1x0x1x1x1x1x1x1;miopenConvolutionFwdAlgoWinograd:ConvBinWinogradRxSf2x3,1.34498,0,miopenConvolutionFwdAlgoWinograd,<unused>;miopenConvolutionFwdAlgoGEMM:GemmFwdRest,76.2905,294912,MIOpenGEMM,0_0_64_1152_64_64_384_1152
192-17-17-3x3-192-8-8-128-0x0-2x2-1x1-0-NCHW-FP32-F=miopenConvolutionFwdAlgoWinograd:ConvBinWinogradRxSf2x3,1.53469,0,miopenConvolutionFwdAlgoWinograd,<unused>;miopenConvolutionFwdAlgoDirect:ConvOclDirectFwd,6.57636,0,miopenConvolutionFwdAlgoDirect,<unused>;miopenConvolutionFwdAlgoGEMM:GemmFwdRest,158.429,442368,MIOpenGEMM,0_0_64_1728_64_64_192_1728
128-17-17-1x7-128-17-17-128-0x3-1x1-1x1-0-NCHW-FP32-B=miopenConvolutionBwdDataAlgoWinograd:ConvBinWinogradRxSf3x2,1.79537,0,miopenConvolutionBwdDataAlgoWinograd,<unused>;miopenConvolutionBwdDataAlgoImplicitGEMM:ConvHipImplicitGemmBwdDataV1R1,3.3762,0,miopenConvolutionBwdDataAlgoImplicitGEMM,128x17x17x7x1x128x17x17x128xNCHWxFP32x3x0x1x1x1x1x1x0;miopenConvolutionBwdDataAlgoGEMM:GemmBwdRest,107.673,1035776,MIOpenGEMM,0_1_289_896_289_289_896_128
160-17-17-1x7-160-17-17-128-0x3-1x1-1x1-0-NCHW-FP32-F=miopenConvolutionFwdAlgoImplicitGEMM:ConvHipImplicitGemmV4R1Fwd,1.67131,0,miopenConvolutionFwdAlgoImplicitGEMM,160x17x17x7x1x160x17x17x128xNCHWxFP32x3x0x1x1x1x1x1x1;miopenConvolutionFwdAlgoWinograd:ConvBinWinogradRxSf3x2,1.93027,0,miopenConvolutionFwdAlgoWinograd,<unused>;miopenConvolutionFwdAlgoGEMM:GemmFwdRest,9.82905,1294720,MIOpenGEMM,0_0_289_1120_289_289_160_1120
192-17-17-7x1-128-17-17-128-3x0-1x1-1x1-0-NCHW-FP32-W=miopenConvolutionBwdWeightsAlgoWinograd:ConvBinWinogradRxSf2x3,3.34865,0,miopenConvolutionBwdWeightsAlgoWinograd,192x17x17x1x7x128x17x17x128xNCHWxFP32x0x3x1x1x1x1x1x0;miopenConvolutionBwdWeightsAlgoDirect:ConvOclBwdWrW53,6.50072,0,miopenConvolutionBwdWeightsAlgoDirect,<unused>;miopenConvolutionBwdWeightsAlgoImplicitGEMM:ConvHipImplicitGemmV4R1WrW,8.0166,0,miopenConvolutionBwdWeightsAlgoImplicitGEMM,192x17x17x1x7x128x17x17x128xNCHWxFP32x0x3x1x1x1x1x1x0;miopenConvolutionBwdWeightsAlgoGEMM:GemmWrwUniversal,66.5203,1035776,MIOpenGEMM,1_0_289_289_896_896_192_289
160-17-17-7x1-160-17-17-128-3x0-1x1-1x1-0-NCHW-FP32-W=miopenConvolutionBwdWeightsAlgoWinograd:ConvBinWinogradRxSf2x3,3.09289,0,miopenConvolutionBwdWeightsAlgoWinograd,160x17x17x1x7x160x17x17x128xNCHWxFP32x0x3x1x1x1x1x1x0;miopenConvolutionBwdWeightsAlgoDirect:ConvOclBwdWrW53,5.64945,0,miopenConvolutionBwdWeightsAlgoDirect,<unused>;miopenConvolutionBwdWeightsAlgoGEMM:GemmWrwUniversal,15.7854,1294720,MIOpenGEMM,1_0_289_289_1120_1120_160_289
384-8-8-3x1-384-8-8-128-1x0-1x1-1x1-0-NCHW-FP32-W=miopenConvolutionBwdWeightsAlgoDirect:ConvOclBwdWrW53,1.78985,0,miopenConvolutionBwdWeightsAlgoDirect,<unused>;miopenConvolutionBwdWeightsAlgoWinograd:ConvBinWinogradRxSf2x3,2.84583,0,miopenConvolutionBwdWeightsAlgoWinograd,384x8x8x1x3x384x8x8x128xNCHWxFP32x0x1x1x1x1x1x1x0;miopenConvolutionBwdWeightsAlgoImplicitGEMM:ConvHipImplicitGemmV4R1WrW,4.30418,0,miopenConvolutionBwdWeightsAlgoImplicitGEMM,384x8x8x1x3x384x8x8x128xNCHWxFP32x0x1x1x1x1x1x1x0;miopenConvolutionBwdWeightsAlgoGEMM:GemmWrwUniversal,61.0888,294912,MIOpenGEMM,1_0_64_64_1152_1152_384_64
192-17-17-7x1-192-17-17-128-3x0-1x1-1x1-0-NCHW-FP32-W=miopenConvolutionBwdWeightsAlgoWinograd:ConvBinWinogradRxSf2x3,5.45054,0,miopenConvolutionBwdWeightsAlgoWinograd,192x17x17x1x7x192x17x17x128xNCHWxFP32x0x3x1x1x1x1x1x0;miopenConvolutionBwdWeightsAlgoImplicitGEMM:ConvHipImplicitGemmV4R1WrW,8.01478,0,miopenConvolutionBwdWeightsAlgoImplicitGEMM,192x17x17x1x7x192x17x17x128xNCHWxFP32x0x3x1x1x1x1x1x0;miopenConvolutionBwdWeightsAlgoDirect:ConvOclBwdWrW53,10.8773,0,miopenConvolutionBwdWeightsAlgoDirect,<unused>;miopenConvolutionBwdWeightsAlgoGEMM:GemmWrwUniversal,25.0064,1553664,MIOpenGEMM,1_0_289_289_1344_1344_192_289
320-8-8-1x1-2048-8-8-128-0x0-1x1-1x1-0-NCHW-FP32-B=miopenConvolutionBwdDataAlgoDirect:ConvAsm1x1U,1.69724,0,miopenConvolutionBwdDataAlgoDirect,<unused>;miopenConvolutionBwdDataAlgoWinograd:ConvBinWinogradRxSf3x2,4.36928,0,miopenConvolutionBwdDataAlgoWinograd,<unused>;miopenConvolutionBwdDataAlgoGEMM:GemmBwd1x1_stride1,9.37503,0,MIOpenGEMM,0_1_64_2048_64_64_2048_320
384-8-8-1x1-1280-8-8-128-0x0-1x1-1x1-0-NCHW-FP32-B=miopenConvolutionBwdDataAlgoDirect:ConvAsm1x1U,1.21399,0,miopenConvolutionBwdDataAlgoDirect,<unused>;miopenConvolutionBwdDataAlgoWinograd:ConvBinWinogradRxSf3x2,3.22258,0,miopenConvolutionBwdDataAlgoWinograd,<unused>;miopenConvolutionBwdDataAlgoGEMM:GemmBwd1x1_stride1,5.24994,0,MIOpenGEMM,0_1_64_1280_64_64_1280_384
192-17-17-7x1-128-17-17-128-3x0-1x1-1x1-0-NCHW-FP32-B=miopenConvolutionBwdDataAlgoWinograd:ConvBinWinogradRxSf3x2,1.80066,0,miopenConvolutionBwdDataAlgoWinograd,<unused>;miopenConvolutionBwdDataAlgoImplicitGEMM:ConvHipImplicitGemmBwdDataV1R1,3.33142,0,miopenConvolutionBwdDataAlgoImplicitGEMM,192x17x17x1x7x128x17x17x128xNCHWxFP32x0x3x1x1x1x1x1x0;miopenConvolutionBwdDataAlgoGEMM:GemmBwdRest,19.5876,1035776,MIOpenGEMM,0_1_289_896_289_289_896_192
256-35-35-1x1-64-35-35-128-0x0-1x1-1x1-0-NCHW-FP32-F=miopenConvolutionFwdAlgoDirect:ConvAsm1x1U,0.847961,0,miopenConvolutionFwdAlgoDirect,<unused>;miopenConvolutionFwdAlgoWinograd:ConvBinWinogradRxSf3x2,1.30686,0,miopenConvolutionFwdAlgoWinograd,<unused>;miopenConvolutionFwdAlgoGEMM:GemmFwd1x1_0_1,8.6564,0,MIOpenGEMM,0_0_1225_256_1225_1225_64_256
192-17-17-7x1-192-17-17-128-3x0-1x1-1x1-0-NCHW-FP32-B=miopenConvolutionBwdDataAlgoWinograd:ConvBinWinogradRxSf3x2,2.77211,0,miopenConvolutionBwdDataAlgoWinograd,<unused>;miopenConvolutionBwdDataAlgoImplicitGEMM:ConvHipImplicitGemmBwdDataV1R1,5.41807,0,miopenConvolutionBwdDataAlgoImplicitGEMM,192x17x17x1x7x192x17x17x128xNCHWxFP32x0x3x1x1x1x1x1x0;miopenConvolutionBwdDataAlgoGEMM:GemmBwdRest,9.43837,1553664,MIOpenGEMM,0_1_289_1344_289_289_1344_192
64-35-35-1x1-288-35-35-128-0x0-1x1-1x1-0-NCHW-FP32-B=miopenConvolutionBwdDataAlgoDirect:ConvAsm1x1U,1.10791,0,miopenConvolutionBwdDataAlgoDirect,<unused>;miopenConvolutionBwdDataAlgoGEMM:GemmBwd1x1_stride1,13.3655,0,MIOpenGEMM,0_1_1225_288_1225_1225_288_64
384-8-8-3x1-384-8-8-128-1x0-1x1-1x1-0-NCHW-FP32-B=miopenConvolutionBwdDataAlgoWinograd:ConvBinWinogradRxS,1.52375,0,miopenConvolutionBwdDataAlgoWinograd,<unused>;miopenConvolutionBwdDataAlgoImplicitGEMM:ConvHipImplicitGemmBwdDataV1R1,1.53697,0,miopenConvolutionBwdDataAlgoImplicitGEMM,384x8x8x1x3x384x8x8x128xNCHWxFP32x0x1x1x1x1x1x1x0;miopenConvolutionBwdDataAlgoGEMM:GemmBwdRest,8.64794,294912,MIOpenGEMM,0_1_64_1152_64_64_1152_384
192-35-35-1x1-64-35-35-128-0x0-1x1-1x1-0-NCHW-FP32-F=miopenConvolutionFwdAlgoDirect:ConvOclDirectFwd1x1,0.648613,0,miopenConvolutionFwdAlgoDirect,<unused>;miopenConvolutionFwdAlgoWinograd:ConvBinWinogradRxSf3x2,1.1308,0,miopenConvolutionFwdAlgoWinograd,<unused>;miopenConvolutionFwdAlgoGEMM:GemmFwd1x1_0_1,4.96224,0,MIOpenGEMM,0_0_1225_192_1225_1225_64_192
192-17-17-7x1-192-17-17-128-3x0-1x1-1x1-0-NCHW-FP32-F=miopenConvolutionFwdAlgoWinograd:ConvBinWinogradRxSf3x2,3.43855,0,miopenConvolutionFwdAlgoWinograd,<unused>;miopenConvolutionFwdAlgoImplicitGEMM:ConvHipImplicitGemmV4R1Fwd,9.42592,0,miopenConvolutionFwdAlgoImplicitGEMM,192x17x17x1x7x192x17x17x128xNCHWxFP32x0x3x1x1x1x1x1x1;miopenConvolutionFwdAlgoGEMM:GemmFwdRest,158.817,1553664,MIOpenGEMM,0_0_289_1344_289_289_192_1344
96-35-35-3x3-64-35-35-128-1x1-1x1-1x1-0-NCHW-FP32-W=miopenConvolutionBwdWeightsAlgoDirect:ConvAsmBwdWrW3x3,2.32635,0,miopenConvolutionBwdWeightsAlgoDirect,<unused>;miopenConvolutionBwdWeightsAlgoWinograd:ConvBinWinogradRxSf2x3,5.41603,0,miopenConvolutionBwdWeightsAlgoWinograd,96x35x35x3x3x64x35x35x128xNCHWxFP32x1x1x1x1x1x1x1x0;miopenConvolutionBwdWeightsAlgoGEMM:GemmWrwUniversal,23.3212,2822400,MIOpenGEMM,1_0_1225_1225_576_576_96_1225;miopenConvolutionBwdWeightsAlgoImplicitGEMM:ConvHipImplicitGemmV4R1WrW,26.819,0,miopenConvolutionBwdWeightsAlgoImplicitGEMM,96x35x35x3x3x64x35x35x128xNCHWxFP32x1x1x1x1x1x1x1x0
128-17-17-7x1-192-17-17-128-3x0-1x1-1x1-0-NCHW-FP32-F=miopenConvolutionFwdAlgoImplicitGEMM:ConvHipImplicitGemmV4R1Fwd,1.61772,0,miopenConvolutionFwdAlgoImplicitGEMM,128x17x17x1x7x192x17x17x128xNCHWxFP32x0x3x1x1x1x1x1x1;miopenConvolutionFwdAlgoWinograd:ConvBinWinogradRxSf3x2,1.74036,0,miopenConvolutionFwdAlgoWinograd,<unused>;miopenConvolutionFwdAlgoGEMM:GemmFwdRest,29.8249,1035776,MIOpenGEMM,0_0_289_896_289_289_192_896
1280-8-8-1x1-384-8-8-128-0x0-1x1-1x1-0-NCHW-FP32-F=miopenConvolutionFwdAlgoDirect:ConvAsm1x1U,1.2901,0,miopenConvolutionFwdAlgoDirect,<unused>;miopenConvolutionFwdAlgoWinograd:ConvBinWinogradRxSf3x2,2.18706,0,miopenConvolutionFwdAlgoWinograd,<unused>;miopenConvolutionFwdAlgoGEMM:GemmFwd1x1_0_1,6.98267,0,MIOpenGEMM,0_0_64_1280_64_64_384_1280
384-8-8-3x1-384-8-8-128-1x0-1x1-1x1-0-NCHW-FP32-F=miopenConvolutionFwdAlgoWinograd:ConvBinWinogradRxS,1.36682,0,miopenConvolutionFwdAlgoWinograd,<unused>;miopenConvolutionFwdAlgoImplicitGEMM:ConvHipImplicitGemmV4R1Fwd,3.22639,0,miopenConvolutionFwdAlgoImplicitGEMM,384x8x8x1x3x384x8x8x128xNCHWxFP32x0x1x1x1x1x1x1x1;miopenConvolutionFwdAlgoGEMM:GemmFwdRest,64.7528,294912,MIOpenGEMM,0_0_64_1152_64_64_384_1152
48-35-35-1x1-256-35-35-128-0x0-1x1-1x1-0-NCHW-FP32-W=miopenConvolutionBwdWeightsAlgoDirect:ConvAsmBwdWrW1x1,1.91656,0,miopenConvolutionBwdWeightsAlgoDirect,<unused>
96-35-35-3x3-64-35-35-128-1x1-1x1-1x1-0-NCHW-FP32-B=miopenConvolutionBwdDataAlgoWinograd:ConvBinWinogradRxS,1.1994,0,miopenConvolutionBwdDataAlgoWinograd,<unused>
2048-8-8-1x1-320-8-8-128-0x0-1x1-1x1-0-NCHW-FP32-F=miopenConvolutionFwdAlgoDirect:ConvAsm1x1U,1.97092,0,miopenConvolutionFwdAlgoDirect,<unused>;miopenConvolutionFwdAlgoWinograd:ConvBinWinogradRxSf3x2,3.33729,0,miopenConvolutionFwdAlgoWinograd,<unused>;miopenConvolutionFwdAlgoGEMM:GemmFwd1x1_0_1,10.7421,0,MIOpenGEMM,0_0_64_2048_64_64_320_2048
288-35-35-1x1-64-35-35-128-0x0-1x1-1x1-0-NCHW-FP32-F=miopenConvolutionFwdAlgoDirect:ConvAsm1x1U,0.861042,0,miopenConvolutionFwdAlgoDirect,<unused>;miopenConvolutionFwdAlgoGEMM:GemmFwd1x1_0_1,6.7364,0,MIOpenGEMM,0_0_1225_288_1225_1225_64_288
128-17-17-1x7-128-17-17-128-0x3-1x1-1x1-0-NCHW-FP32-F=miopenConvolutionFwdAlgoImplicitGEMM:ConvHipImplicitGemmV4R1Fwd,1.56052,0,miopenConvolutionFwdAlgoImplicitGEMM,128x17x17x7x1x128x17x17x128xNCHWxFP32x3x0x1x1x1x1x1x1;miopenConvolutionFwdAlgoWinograd:ConvBinWinogradRxSf3x2,1.76956,0,miopenConvolutionFwdAlgoWinograd,<unused>;miopenConvolutionFwdAlgoGEMM:GemmFwdRest,12.0637,1035776,MIOpenGEMM,0_0_289_896_289_289_128_896
64-35-35-3x3-96-35-35-128-1x1-1x1-1x1-0-NCHW-FP32-F=miopenConvolutionFwdAlgoWinograd:ConvBinWinograd3x3U,1.01311,0,miopenConvolutionFwdAlgoWinograd,<unused>
32-147-147-3x3-32-149-149-128-0x0-1x1-1x1-0-NCHW-FP32-W=miopenConvolutionBwdWeightsAlgoDirect:ConvOclBwdWrW2NonTunable,28.9936,4718592,miopenConvolutionBwdWeightsAlgoDirect,<unused>;miopenConvolutionBwdWeightsAlgoGEMM:GemmWrwUniversal,74.7781,24893568,MIOpenGEMM,1_0_21609_21609_288_288_32_21609;miopenConvolutionBwdWeightsAlgoWinograd:ConvBinWinogradRxSf2x3,77.239,0,miopenConvolutionBwdWeightsAlgoWinograd,32x147x147x3x3x32x149x149x128xNCHWxFP32x0x0x1x1x1x1x1x0
320-8-8-1x1-1280-8-8-128-0x0-1x1-1x1-0-NCHW-FP32-W=miopenConvolutionBwdWeightsAlgoDirect:ConvAsmBwdWrW1x1,1.13756,0,miopenConvolutionBwdWeightsAlgoDirect,<unused>;miopenConvolutionBwdWeightsAlgoGEMM:GemmWrw1x1_stride1,4.88953,0,MIOpenGEMM,1_0_64_64_1280_1280_320_64;miopenConvolutionBwdWeightsAlgoWinograd:ConvBinWinogradRxSf2x3,6.86704,0,miopenConvolutionBwdWeightsAlgoWinograd,320x8x8x1x1x1280x8x8x128xNCHWxFP32x0x0x1x1x1x1x1x0
128-17-17-7x1-128-17-17-128-3x0-1x1-1x1-0-NCHW-FP32-W=miopenConvolutionBwdWeightsAlgoWinograd:ConvBinWinogradRxSf2x3,1.22402,0,miopenConvolutionBwdWeightsAlgoWinograd,128x17x17x1x7x128x17x17x128xNCHWxFP32x0x3x1x1x1x1x1x0;miopenConvolutionBwdWeightsAlgoDirect:ConvOclBwdWrW53,4.27054,0,miopenConvolutionBwdWeightsAlgoDirect,<unused>;miopenConvolutionBwdWeightsAlgoImplicitGEMM:ConvHipImplicitGemmV4R1WrW,5.37387,0,miopenConvolutionBwdWeightsAlgoImplicitGEMM,128x17x17x1x7x128x17x17x128xNCHWxFP32x0x3x1x1x1x1x1x0;miopenConvolutionBwdWeightsAlgoGEMM:GemmWrwUniversal,7.03799,1035776,MIOpenGEMM,1_0_289_289_896_896_128_289
48-35-35-1x1-192-35-35-128-0x0-1x1-1x1-0-NCHW-FP32-B=miopenConvolutionBwdDataAlgoDirect:ConvAsm1x1U,0.631581,0,miopenConvolutionBwdDataAlgoDirect,<unused>;miopenConvolutionBwdDataAlgoWinograd:ConvBinWinogradRxSf3x2,1.52506,0,miopenConvolutionBwdDataAlgoWinograd,<unused>;miopenConvolutionBwdDataAlgoGEMM:GemmBwd1x1_stride1,5.55926,0,MIOpenGEMM,0_1_1225_192_1225_1225_192_48
192-17-17-1x1-768-17-17-128-0x0-1x1-1x1-0-NCHW-FP32-B=miopenConvolutionBwdDataAlgoDirect:ConvAsm1x1U,1.33248,0,miopenConvolutionBwdDataAlgoDirect,<unused>;miopenConvolutionBwdDataAlgoWinograd:ConvBinWinogradRxSf3x2,3.23982,0,miopenConvolutionBwdDataAlgoWinograd,<unused>;miopenConvolutionBwdDataAlgoGEMM:GemmBwd1x1_stride1,5.91013,0,MIOpenGEMM,0_1_289_768_289_289_768_192
320-8-8-1x1-1280-8-8-128-0x0-1x1-1x1-0-NCHW-FP32-B=miopenConvolutionBwdDataAlgoDirect:ConvAsm1x1U,1.22472,0,miopenConvolutionBwdDataAlgoDirect,<unused>;miopenConvolutionBwdDataAlgoWinograd:ConvBinWinogradRxSf3x2,2.76877,0,miopenConvolutionBwdDataAlgoWinograd,<unused>;miopenConvolutionBwdDataAlgoGEMM:GemmBwd1x1_stride1,9.87278,0,MIOpenGEMM,0_1_64_1280_64_64_1280_320
192-8-8-1x1-2048-8-8-128-0x0-1x1-1x1-0-NCHW-FP32-W=miopenConvolutionBwdWeightsAlgoDirect:ConvAsmBwdWrW1x1,1.31289,0,miopenConvolutionBwdWeightsAlgoDirect,<unused>;miopenConvolutionBwdWeightsAlgoGEMM:GemmWrw1x1_stride1,3.55794,0,MIOpenGEMM,1_0_64_64_2048_2048_192_64;miopenConvolutionBwdWeightsAlgoWinograd:ConvBinWinogradRxSf2x3,4.57814,0,miopenConvolutionBwdWeightsAlgoWinograd,192x8x8x1x1x2048x8x8x128xNCHWxFP32x0x0x1x1x1x1x1x0
48-35-35-1x1-192-35-35-128-0x0-1x1-1x1-0-NCHW-FP32-W=miopenConvolutionBwdWeightsAlgoDirect:ConvAsmBwdWrW1x1,1.31763,0,miopenConvolutionBwdWeightsAlgoDirect,<unused>
48-35-35-1x1-256-35-35-128-0x0-1x1-1x1-0-NCHW-FP32-B=miopenConvolutionBwdDataAlgoDirect:ConvAsm1x1U,0.75681,0,miopenConvolutionBwdDataAlgoDirect,<unused>;miopenConvolutionBwdDataAlgoWinograd:ConvBinWinogradRxSf3x2,1.88981,0,miopenConvolutionBwdDataAlgoWinograd,<unused>;miopenConvolutionBwdDataAlgoGEMM:GemmBwd1x1_stride1,4.45046,0,MIOpenGEMM,0_1_1225_256_1225_1225_256_48
384-8-8-3x3-448-8-8-128-1x1-1x1-1x1-0-NCHW-FP32-B=miopenConvolutionBwdDataAlgoWinograd:ConvBinWinograd3x3U,1.40616,0,miopenConvolutionBwdDataAlgoWinograd,<unused>
128-17-17-7x1-128-17-17-128-3x0-1x1-1x1-0-NCHW-FP32-B=miopenConvolutionBwdDataAlgoWinograd:ConvBinWinogradRxSf3x2,1.4725,0,miopenConvolutionBwdDataAlgoWinograd,<unused>;miopenConvolutionBwdDataAlgoImplicitGEMM:ConvHipImplicitGemmBwdDataV1R1,4.87867,0,miopenConvolutionBwdDataAlgoImplicitGEMM,128x17x17x1x7x128x17x17x128xNCHWxFP32x0x3x1x1x1x1x1x0;miopenConvolutionBwdDataAlgoGEMM:GemmBwdRest,196.928,1035776,MIOpenGEMM,0_1_289_896_289_289_896_128
96-35-35-3x3-96-35-35-128-1x1-1x1-1x1-0-NCHW-FP32-W=miopenConvolutionBwdWeightsAlgoDirect:ConvAsmBwdWrW3x3,5.57571,0,miopenConvolutionBwdWeightsAlgoDirect,<unused>;miopenConvolutionBwdWeightsAlgoWinograd:ConvBinWinogradRxSf2x3,7.72582,0,miopenConvolutionBwdWeightsAlgoWinograd,96x35x35x3x3x96x35x35x128xNCHWxFP32x1x1x1x1x1x1x1x0;miopenConvolutionBwdWeightsAlgoGEMM:GemmWrwUniversal,35.2723,4233600,MIOpenGEMM,1_0_1225_1225_864_864_96_1225
48-35-35-1x1-288-35-35-128-0x0-1x1-1x1-0-NCHW-FP32-W=miopenConvolutionBwdWeightsAlgoDirect:ConvAsmBwdWrW1x1,1.49922,0,miopenConvolutionBwdWeightsAlgoDirect,<unused>;miopenConvolutionBwdWeightsAlgoGEMM:GemmWrw1x1_stride1,5.08526,0,MIOpenGEMM,1_0_1225_1225_288_288_48_1225;miopenConvolutionBwdWeightsAlgoWinograd:ConvBinWinogradRxSf2x3,8.3492,0,miopenConvolutionBwdWeightsAlgoWinograd,48x35x35x1x1x288x35x35x128xNCHWxFP32x0x0x1x1x1x1x1x0
32-147-147-3x3-32-149-149-128-0x0-1x1-1x1-0-NCHW-FP32-B=miopenConvolutionBwdDataAlgoWinograd:ConvBinWinogradRxS,4.64668,0,miopenConvolutionBwdDataAlgoWinograd,<unused>;miopenConvolutionBwdDataAlgoDirect:ConvOclDirectFwd,24.2129,0,miopenConvolutionBwdDataAlgoDirect,<unused>;miopenConvolutionBwdDataAlgoImplicitGEMM:ConvHipImplicitGemmBwdDataV1R1,76.3489,0,miopenConvolutionBwdDataAlgoImplicitGEMM,32x147x147x3x3x32x149x149x128xNCHWxFP32x0x0x1x1x1x1x1x0;miopenConvolutionBwdDataAlgoGEMM:GemmBwdRest,233.008,24893568,MIOpenGEMM,0_1_21609_288_21609_21609_288_32
64-35-35-5x5-48-35-35-128-2x2-1x1-1x1-0-NCHW-FP32-W=miopenConvolutionBwdWeightsAlgoDirect:ConvOclBwdWrW2<8>,6.62156,4915200,miopenConvolutionBwdWeightsAlgoDirect,<unused>;miopenConvolutionBwdWeightsAlgoWinograd:ConvBinWinogradRxSf2x3,7.64982,0,miopenConvolutionBwdWeightsAlgoWinograd,64x35x35x5x5x48x35x35x128xNCHWxFP32x2x2x1x1x1x1x1x0;miopenConvolutionBwdWeightsAlgoGEMM:GemmWrwUniversal,25.8348,5880000,MIOpenGEMM,1_0_1225_1225_1200_1200_64_1225
96-35-35-3x3-96-35-35-128-1x1-1x1-1x1-0-NCHW-FP32-B=miopenConvolutionBwdDataAlgoWinograd:ConvBinWinogradRxSf2x3,2.02917,0,miopenConvolutionBwdDataAlgoWinograd,<unused>
128-17-17-7x1-128-17-17-128-3x0-1x1-1x1-0-NCHW-FP32-F=miopenConvolutionFwdAlgoWinograd:ConvBinWinogradRxSf3x2,1.69454,0,miopenConvolutionFwdAlgoWinograd,<unused>;miopenConvolutionFwdAlgoImplicitGEMM:ConvHipImplicitGemmV4R1Fwd,3.79501,0,miopenConvolutionFwdAlgoImplicitGEMM,128x17x17x1x7x128x17x17x128xNCHWxFP32x0x3x1x1x1x1x1x1;miopenConvolutionFwdAlgoGEMM:GemmFwdRest,181.411,1035776,MIOpenGEMM,0_0_289_896_289_289_128_896
768-17-17-1x1-192-17-17-128-0x0-1x1-1x1-0-NCHW-FP32-F=miopenConvolutionFwdAlgoDirect:ConvAsm1x1U,1.7185,0,miopenConvolutionFwdAlgoDirect,<unused>;miopenConvolutionFwdAlgoGEMM:GemmFwd1x1_0_1,9.51004,0,MIOpenGEMM,0_0_289_768_289_289_192_768
192-8-8-1x1-2048-8-8-128-0x0-1x1-1x1-0-NCHW-FP32-B=miopenConvolutionBwdDataAlgoDirect:ConvAsm1x1U,0.984648,0,miopenConvolutionBwdDataAlgoDirect,<unused>;miopenConvolutionBwdDataAlgoWinograd:ConvBinWinogradRxSf3x2,2.8782,0,miopenConvolutionBwdDataAlgoWinograd,<unused>;miopenConvolutionBwdDataAlgoGEMM:GemmBwd1x1_stride1,5.52331,0,MIOpenGEMM,0_1_64_2048_64_64_2048_192
256-35-35-1x1-48-35-35-128-0x0-1x1-1x1-0-NCHW-FP32-F=miopenConvolutionFwdAlgoDirect:ConvAsm1x1U,0.880595,0,miopenConvolutionFwdAlgoDirect,<unused>;miopenConvolutionFwdAlgoGEMM:GemmFwd1x1_0_1,6.03935,0,MIOpenGEMM,0_0_1225_256_1225_1225_48_256
96-35-35-3x3-96-35-35-128-1x1-1x1-1x1-0-NCHW-FP32-F=miopenConvolutionFwdAlgoWinograd:ConvBinWinogradRxSf2x3,2.12725,0,miopenConvolutionFwdAlgoWinograd,<unused>
64-35-35-5x5-48-35-35-128-2x2-1x1-1x1-0-NCHW-FP32-B=miopenConvolutionBwdDataAlgoWinograd:ConvBinWinogradRxS,3.8656,0,miopenConvolutionBwdDataAlgoWinograd,<unused>;miopenConvolutionBwdDataAlgoDirect:ConvOclDirectFwd,15.0348,0,miopenConvolutionBwdDataAlgoDirect,<unused>;miopenConvolutionBwdDataAlgoGEMM:GemmBwdRest,31.6366,5880000,MIOpenGEMM,0_1_1225_1200_1225_1225_1200_64
96-17-17-3x3-96-35-35-128-0x0-2x2-1x1-0-NCHW-FP32-W=miopenConvolutionBwdWeightsAlgoDirect:ConvOclBwdWrW2NonTunable,8.63001,42467328,miopenConvolutionBwdWeightsAlgoDirect,<unused>;miopenConvolutionBwdWeightsAlgoGEMM:GemmWrwUniversal,25.4608,998784,MIOpenGEMM,1_0_289_289_864_864_96_289
32-149-149-3x3-32-147-147-128-0x0-1x1-1x1-0-NCHW-FP32-F=miopenConvolutionFwdAlgoWinograd:ConvBinWinogradRxS,4.57468,0,miopenConvolutionFwdAlgoWinograd,<unused>;miopenConvolutionFwdAlgoDirect:ConvOclDirectFwd,22.6294,0,miopenConvolutionFwdAlgoDirect,<unused>;miopenConvolutionFwdAlgoGEMM:GemmFwdRest,39.0923,24893568,MIOpenGEMM,0_0_21609_288_21609_21609_32_288
48-35-35-1x1-288-35-35-128-0x0-1x1-1x1-0-NCHW-FP32-B=miopenConvolutionBwdDataAlgoDirect:ConvAsm1x1U,0.914036,0,miopenConvolutionBwdDataAlgoDirect,<unused>;miopenConvolutionBwdDataAlgoGEMM:GemmBwd1x1_stride1,9.97983,0,MIOpenGEMM,0_1_1225_288_1225_1225_288_48
192-35-35-1x1-48-35-35-128-0x0-1x1-1x1-0-NCHW-FP32-F=miopenConvolutionFwdAlgoDirect:ConvAsm1x1U,0.705654,0,miopenConvolutionFwdAlgoDirect,<unused>;miopenConvolutionFwdAlgoGEMM:GemmFwd1x1_0_1,5.60754,0,MIOpenGEMM,0_0_1225_192_1225_1225_48_192
448-8-8-1x1-2048-8-8-128-0x0-1x1-1x1-0-NCHW-FP32-W=miopenConvolutionBwdWeightsAlgoDirect:ConvAsmBwdWrW1x1,3.32214,0,miopenConvolutionBwdWeightsAlgoDirect,<unused>;miopenConvolutionBwdWeightsAlgoGEMM:GemmWrw1x1_stride1,8.81076,0,MIOpenGEMM,1_0_64_64_2048_2048_448_64;miopenConvolutionBwdWeightsAlgoWinograd:ConvBinWinogradRxSf2x3,12.1656,0,miopenConvolutionBwdWeightsAlgoWinograd,448x8x8x1x1x2048x8x8x128xNCHWxFP32x0x0x1x1x1x1x1x0
768-17-17-1x1-160-17-17-128-0x0-1x1-1x1-0-NCHW-FP32-F=miopenConvolutionFwdAlgoDirect:ConvOclDirectFwd1x1,2.04077,0,miopenConvolutionFwdAlgoDirect,<unused>;miopenConvolutionFwdAlgoGEMM:GemmFwd1x1_0_1,8.29474,0,MIOpenGEMM,0_0_289_768_289_289_160_768
320-8-8-3x3-192-17-17-128-0x0-2x2-1x1-0-NCHW-FP32-B=miopenConvolutionBwdDataAlgoImplicitGEMM:ConvHipImplicitGemmBwdDataV1R1,4.24292,0,miopenConvolutionBwdDataAlgoImplicitGEMM,320x8x8x3x3x192x17x17x128xNCHWxFP32x0x0x2x2x1x1x1x0;miopenConvolutionBwdDataAlgoWinograd:ConvBinWinogradRxSf2x3,4.37075,0,miopenConvolutionBwdDataAlgoWinograd,<unused>;miopenConvolutionBwdDataAlgoGEMM:GemmBwdRest,20.2297,442368,MIOpenGEMM,0_1_64_1728_64_64_1728_320;miopenConvolutionBwdDataAlgoDirect:ConvOclDirectFwd,23.2729,0,miopenConvolutionBwdDataAlgoDirect,<unused>
2048-8-8-1x1-192-8-8-128-0x0-1x1-1x1-0-NCHW-FP32-F=miopenConvolutionFwdAlgoDirect:ConvAsm1x1U,1.65262,0,miopenConvolutionFwdAlgoDirect,<unused>;miopenConvolutionFwdAlgoWinograd:ConvBinWinogradRxSf3x2,2.93673,0,miopenConvolutionFwdAlgoWinograd,<unused>;miopenConvolutionFwdAlgoGEMM:GemmFwd1x1_0_1,7.0247,0,MIOpenGEMM,0_0_64_2048_64_64_192_2048
96-17-17-3x3-96-35-35-128-0x0-2x2-1x1-0-NCHW-FP32-B=miopenConvolutionBwdDataAlgoWinograd:ConvBinWinogradRxSf2x3,2.23243,0,miopenConvolutionBwdDataAlgoWinograd,<unused>;miopenConvolutionBwdDataAlgoImplicitGEMM:ConvHipImplicitGemmBwdDataV1R1,5.09176,0,miopenConvolutionBwdDataAlgoImplicitGEMM,96x17x17x3x3x96x35x35x128xNCHWxFP32x0x0x2x2x1x1x1x0;miopenConvolutionBwdDataAlgoDirect:ConvOclDirectFwd,9.65022,0,miopenConvolutionBwdDataAlgoDirect,<unused>;miopenConvolutionBwdDataAlgoGEMM:GemmBwdRest,164.575,998784,MIOpenGEMM,0_1_289_864_289_289_864_96
192-71-71-3x3-80-73-73-128-0x0-1x1-1x1-0-NCHW-FP32-W=miopenConvolutionBwdWeightsAlgoWinograd:ConvBinWinogradRxSf2x3,95.8761,0,miopenConvolutionBwdWeightsAlgoWinograd,192x71x71x3x3x80x73x73x128xNCHWxFP32x0x0x1x1x1x1x1x0;miopenConvolutionBwdWeightsAlgoDirect:ConvOclBwdWrW2NonTunable,128.868,70778880,miopenConvolutionBwdWeightsAlgoDirect,<unused>;miopenConvolutionBwdWeightsAlgoGEMM:GemmWrwUniversal,771.322,14518080,MIOpenGEMM,1_0_5041_5041_720_720_192_5041
48-35-35-5x5-64-35-35-128-2x2-1x1-1x1-0-NCHW-FP32-F=miopenConvolutionFwdAlgoWinograd:ConvBinWinogradRxSf2x3,1.99416,0,miopenConvolutionFwdAlgoWinograd,<unused>;miopenConvolutionFwdAlgoImplicitGEMM:ConvHipImplicitGemmV4R1Fwd,3.46646,0,miopenConvolutionFwdAlgoImplicitGEMM,48x35x35x5x5x64x35x35x128xNCHWxFP32x2x2x1x1x1x1x1x1;miopenConvolutionFwdAlgoDirect:ConvOclDirectFwd,14.5502,0,miopenConvolutionFwdAlgoDirect,<unused>;miopenConvolutionFwdAlgoGEMM:GemmFwdRest,59.0478,5880000,MIOpenGEMM,0_0_1225_1200_1225_1225_64_1200
32-35-35-1x1-192-35-35-128-0x0-1x1-1x1-0-NCHW-FP32-W=miopenConvolutionBwdWeightsAlgoDirect:ConvAsmBwdWrW1x1,0.770558,0,miopenConvolutionBwdWeightsAlgoDirect,<unused>
288-35-35-1x1-48-35-35-128-0x0-1x1-1x1-0-NCHW-FP32-F=miopenConvolutionFwdAlgoDirect:ConvAsm1x1U,0.959215,0,miopenConvolutionFwdAlgoDirect,<unused>
160-17-17-1x1-768-17-17-128-0x0-1x1-1x1-0-NCHW-FP32-W=miopenConvolutionBwdWeightsAlgoDirect:ConvAsmBwdWrW1x1,2.37694,0,miopenConvolutionBwdWeightsAlgoDirect,<unused>
448-8-8-1x1-2048-8-8-128-0x0-1x1-1x1-0-NCHW-FP32-B=miopenConvolutionBwdDataAlgoDirect:ConvAsm1x1U,2.25577,0,miopenConvolutionBwdDataAlgoDirect,<unused>;miopenConvolutionBwdDataAlgoWinograd:ConvBinWinogradRxSf3x2,6.65444,0,miopenConvolutionBwdDataAlgoWinograd,<unused>;miopenConvolutionBwdDataAlgoGEMM:GemmBwd1x1_stride1,9.23394,0,MIOpenGEMM,0_1_64_2048_64_64_2048_448
384-17-17-3x3-288-35-35-128-0x0-2x2-1x1-0-NCHW-FP32-W=miopenConvolutionBwdWeightsAlgoDirect:ConvOclBwdWrW2NonTunable,129.664,509607936,miopenConvolutionBwdWeightsAlgoDirect,<unused>;miopenConvolutionBwdWeightsAlgoGEMM:GemmWrwUniversal,143.238,2996352,MIOpenGEMM,1_0_289_289_2592_2592_384_289
96-35-35-3x3-96-17-17-128-0x0-2x2-1x1-0-NCHW-FP32-F=miopenConvolutionFwdAlgoWinograd:ConvBinWinogradRxSf2x3,2.25765,0,miopenConvolutionFwdAlgoWinograd,<unused>;miopenConvolutionFwdAlgoDirect:ConvOclDirectFwd,10.7423,0,miopenConvolutionFwdAlgoDirect,<unused>;miopenConvolutionFwdAlgoGEMM:GemmFwdRest,27.6876,998784,MIOpenGEMM,0_0_289_864_289_289_96_864
64-147-147-3x3-32-147-147-128-1x1-1x1-1x1-0-NCHW-FP32-W=miopenConvolutionBwdWeightsAlgoDirect:ConvAsmBwdWrW3x3,32.3111,0,miopenConvolutionBwdWeightsAlgoDirect,<unused>;miopenConvolutionBwdWeightsAlgoWinograd:ConvBinWinogradRxSf2x3,206.137,0,miopenConvolutionBwdWeightsAlgoWinograd,64x147x147x3x3x32x147x147x128xNCHWxFP32x1x1x1x1x1x1x1x0;miopenConvolutionBwdWeightsAlgoGEMM:GemmWrwUniversal,674.918,24893568,MIOpenGEMM,1_0_21609_21609_288_288_64_21609
32-35-35-1x1-192-35-35-128-0x0-1x1-1x1-0-NCHW-FP32-B=miopenConvolutionBwdDataAlgoDirect:ConvAsm1x1U,0.440723,0,miopenConvolutionBwdDataAlgoDirect,<unused>;miopenConvolutionBwdDataAlgoWinograd:ConvBinWinogradRxSf3x2,1.12695,0,miopenConvolutionBwdDataAlgoWinograd,<unused>;miopenConvolutionBwdDataAlgoGEMM:GemmBwd1x1_stride1,2.52305,0,MIOpenGEMM,0_1_1225_192_1225_1225_192_32
384-8-8-3x3-448-8-8-128-1x1-1x1-1x1-0-NCHW-FP32-W=miopenConvolutionBwdWeightsAlgoWinograd:ConvBinWinogradRxS,3.08895,0,miopenConvolutionBwdWeightsAlgoWinograd,384x8x8x3x3x448x8x8x128xNCHWxFP32x1x1x1x1x1x1x1x0;miopenConvolutionBwdWeightsAlgoDirect:ConvOclBwdWrW53,4.01555,0,miopenConvolutionBwdWeightsAlgoDirect,<unused>;miopenConvolutionBwdWeightsAlgoImplicitGEMM:ConvHipImplicitGemmV4R1WrW,6.39612,0,miopenConvolutionBwdWeightsAlgoImplicitGEMM,384x8x8x3x3x448x8x8x128xNCHWxFP32x1x1x1x1x1x1x1x0;miopenConvolutionBwdWeightsAlgoGEMM:GemmWrwUniversal,27.8302,1032192,MIOpenGEMM,1_0_64_64_4032_4032_384_64
64-147-147-3x3-32-147-147-128-1x1-1x1-1x1-0-NCHW-FP32-B=miopenConvolutionBwdDataAlgoWinograd:ConvBinWinograd3x3U,5.92899,0,miopenConvolutionBwdDataAlgoWinograd,<unused>
64-35-35-1x1-192-35-35-128-0x0-1x1-1x1-0-NCHW-FP32-W=miopenConvolutionBwdWeightsAlgoDirect:ConvAsmBwdWrW1x1,0.928786,0,miopenConvolutionBwdWeightsAlgoDirect,<unused>
192-35-35-1x1-32-35-35-128-0x0-1x1-1x1-0-NCHW-FP32-F=miopenConvolutionFwdAlgoDirect:ConvAsm1x1U,0.478457,0,miopenConvolutionFwdAlgoDirect,<unused>;miopenConvolutionFwdAlgoWinograd:ConvBinWinogradRxSf3x2,0.761282,0,miopenConvolutionFwdAlgoWinograd,<unused>;miopenConvolutionFwdAlgoGEMM:GemmFwd1x1_0_1,3.29941,0,MIOpenGEMM,0_0_1225_192_1225_1225_32_192
448-8-8-3x3-384-8-8-128-1x1-1x1-1x1-0-NCHW-FP32-F=miopenConvolutionFwdAlgoWinograd:ConvBinWinograd3x3U,1.26035,0,miopenConvolutionFwdAlgoWinograd,<unused>
2048-8-8-1x1-448-8-8-128-0x0-1x1-1x1-0-NCHW-FP32-F=miopenConvolutionFwdAlgoDirect:ConvAsm1x1U,2.3936,0,miopenConvolutionFwdAlgoDirect,<unused>;miopenConvolutionFwdAlgoWinograd:ConvBinWinogradRxSf3x2,4.24576,0,miopenConvolutionFwdAlgoWinograd,<unused>;miopenConvolutionFwdAlgoGEMM:GemmFwd1x1_0_1,10.6857,0,MIOpenGEMM,0_0_64_2048_64_64_448_2048
320-8-8-3x3-192-17-17-128-0x0-2x2-1x1-0-NCHW-FP32-W=miopenConvolutionBwdWeightsAlgoImplicitGEMM:ConvHipImplicitGemmV4R1WrW,2.93841,0,miopenConvolutionBwdWeightsAlgoImplicitGEMM,320x8x8x3x3x192x17x17x128xNCHWxFP32x0x0x2x2x1x1x1x0;miopenConvolutionBwdWeightsAlgoGEMM:GemmWrwUniversal,9.53674,442368,MIOpenGEMM,1_0_64_64_1728_1728_320_64;miopenConvolutionBwdWeightsAlgoDirect:ConvOclBwdWrW2NonTunable,45.4834,283115520,miopenConvolutionBwdWeightsAlgoDirect,<unused>
384-8-8-1x1-1536-8-8-64-0x0-1x1-1x1-0-NCHW-FP32-B=miopenConvolutionBwdDataAlgoDirect:ConvAsm1x1U,0.763585,0,miopenConvolutionBwdDataAlgoDirect,<unused>;miopenConvolutionBwdDataAlgoWinograd:ConvBinWinogradRxSf3x2,1.83533,0,miopenConvolutionBwdDataAlgoWinograd,<unused>;miopenConvolutionBwdDataAlgoGEMM:GemmBwd1x1_stride1,3.68581,0,MIOpenGEMM,0_1_64_1536_64_64_1536_384
1024-17-17-1x1-256-17-17-64-0x0-1x1-1x1-0-NCHW-FP32-F=miopenConvolutionFwdAlgoDirect:ConvAsm1x1U,1.94299,0,miopenConvolutionFwdAlgoDirect,<unused>;miopenConvolutionFwdAlgoWinograd:ConvBinWinogradRxSf3x2,3.45369,0,miopenConvolutionFwdAlgoWinograd,<unused>;miopenConvolutionFwdAlgoGEMM:GemmFwd1x1_0_1,6.61241,0,MIOpenGEMM,0_0_289_1024_289_289_256_1024
160-17-17-1x1-768-17-17-128-0x0-1x1-1x1-0-NCHW-FP32-B=miopenConvolutionBwdDataAlgoDirect:ConvAsm1x1U,1.65266,0,miopenConvolutionBwdDataAlgoDirect,<unused>;miopenConvolutionBwdDataAlgoGEMM:GemmBwd1x1_stride1,276.723,0,MIOpenGEMM,0_1_289_768_289_289_768_160
192-17-17-1x1-1024-17-17-64-0x0-1x1-1x1-0-NCHW-FP32-W=miopenConvolutionBwdWeightsAlgoDirect:ConvAsmBwdWrW1x1,1.67724,0,miopenConvolutionBwdWeightsAlgoDirect,<unused>;miopenConvolutionBwdWeightsAlgoWinograd:ConvBinWinogradRxSf2x3,6.68083,0,miopenConvolutionBwdWeightsAlgoWinograd,192x17x17x1x1x1024x17x17x64xNCHWxFP32x0x0x1x1x1x1x1x0
1536-8-8-1x1-384-8-8-64-0x0-1x1-1x1-0-NCHW-FP32-F=miopenConvolutionFwdAlgoDirect:ConvAsm1x1U,1.24349,0,miopenConvolutionFwdAlgoDirect,<unused>;miopenConvolutionFwdAlgoWinograd:ConvBinWinogradRxSf3x2,2.27056,0,miopenConvolutionFwdAlgoWinograd,<unused>;miopenConvolutionFwdAlgoGEMM:GemmFwd1x1_0_1,3.89099,0,MIOpenGEMM,0_0_64_1536_64_64_384_1536
256-8-8-1x1-1536-8-8-64-0x0-1x1-1x1-0-NCHW-FP32-W=miopenConvolutionBwdWeightsAlgoDirect:ConvAsmBwdWrW1x1,0.486589,0,miopenConvolutionBwdWeightsAlgoDirect,<unused>;miopenConvolutionBwdWeightsAlgoGEMM:GemmWrw1x1_stride1,1.52394,0,MIOpenGEMM,1_0_64_64_1536_1536_256_64;miopenConvolutionBwdWeightsAlgoWinograd:ConvBinWinogradRxSf2x3,2.11952,0,miopenConvolutionBwdWeightsAlgoWinograd,256x8x8x1x1x1536x8x8x64xNCHWxFP32x0x0x1x1x1x1x1x0
192-17-17-1x1-1024-17-17-64-0x0-1x1-1x1-0-NCHW-FP32-B=miopenConvolutionBwdDataAlgoDirect:ConvAsm1x1U,1.88414,0,miopenConvolutionBwdDataAlgoDirect,<unused>
192-8-8-3x3-192-17-17-64-0x0-2x2-1x1-0-NCHW-FP32-W=miopenConvolutionBwdWeightsAlgoImplicitGEMM:ConvHipImplicitGemmV4R1WrW,1.98643,0,miopenConvolutionBwdWeightsAlgoImplicitGEMM,192x8x8x3x3x192x17x17x64xNCHWxFP32x0x0x2x2x1x1x1x0;miopenConvolutionBwdWeightsAlgoDirect:ConvOclBwdWrW2NonTunable,16.4939,84934656,miopenConvolutionBwdWeightsAlgoDirect,<unused>;miopenConvolutionBwdWeightsAlgoGEMM:GemmWrwUniversal,18.9172,442368,MIOpenGEMM,1_0_64_64_1728_1728_192_64
128-17-17-1x1-768-17-17-128-0x0-1x1-1x1-0-NCHW-FP32-W=miopenConvolutionBwdWeightsAlgoDirect:ConvAsmBwdWrW1x1,1.22592,0,miopenConvolutionBwdWeightsAlgoDirect,<unused>
256-8-8-1x1-1536-8-8-64-0x0-1x1-1x1-0-NCHW-FP32-B=miopenConvolutionBwdDataAlgoDirect:ConvAsm1x1U,0.417955,0,miopenConvolutionBwdDataAlgoDirect,<unused>;miopenConvolutionBwdDataAlgoWinograd:ConvBinWinogradRxSf3x2,0.927186,0,miopenConvolutionBwdDataAlgoWinograd,<unused>;miopenConvolutionBwdDataAlgoGEMM:GemmBwd1x1_stride1,3.0164,0,MIOpenGEMM,0_1_64_1536_64_64_1536_256
192-71-71-3x3-192-35-35-64-0x0-2x2-1x1-0-NCHW-FP32-F=miopenConvolutionFwdAlgoWinograd:ConvBinWinogradRxS,14.4151,0,miopenConvolutionFwdAlgoWinograd,<unused>;miopenConvolutionFwdAlgoGEMM:GemmFwdRest,38.6363,8467200,MIOpenGEMM,0_0_1225_1728_1225_1225_192_1728;miopenConvolutionFwdAlgoDirect:ConvOclDirectFwd,95.1193,0,miopenConvolutionFwdAlgoDirect,<unused>
1024-17-17-1x1-192-17-17-64-0x0-1x1-1x1-0-NCHW-FP32-F=miopenConvolutionFwdAlgoDirect:ConvAsm1x1U,1.63224,0,miopenConvolutionFwdAlgoDirect,<unused>;miopenConvolutionFwdAlgoGEMM:GemmFwd1x1_0_1,8.46842,0,MIOpenGEMM,0_0_289_1024_289_289_192_1024
192-8-8-3x3-192-17-17-64-0x0-2x2-1x1-0-NCHW-FP32-B=miopenConvolutionBwdDataAlgoImplicitGEMM:ConvHipImplicitGemmBwdDataV1R1,1.20942,0,miopenConvolutionBwdDataAlgoImplicitGEMM,192x8x8x3x3x192x17x17x64xNCHWxFP32x0x0x2x2x1x1x1x0;miopenConvolutionBwdDataAlgoWinograd:ConvBinWinogradRxS,1.33238,0,miopenConvolutionBwdDataAlgoWinograd,<unused>;miopenConvolutionBwdDataAlgoDirect:ConvOclDirectFwd,4.84822,0,miopenConvolutionBwdDataAlgoDirect,<unused>;miopenConvolutionBwdDataAlgoGEMM:GemmBwdRest,5.25029,442368,MIOpenGEMM,0_1_64_1728_64_64_1728_192
1536-8-8-1x1-256-8-8-64-0x0-1x1-1x1-0-NCHW-FP32-F=miopenConvolutionFwdAlgoDirect:ConvAsm1x1U,0.539187,0,miopenConvolutionFwdAlgoDirect,<unused>;miopenConvolutionFwdAlgoWinograd:ConvBinWinogradRxSf3x2,1.36697,0,miopenConvolutionFwdAlgoWinograd,<unused>;miopenConvolutionFwdAlgoGEMM:GemmFwd1x1_0_1,3.14537,0,MIOpenGEMM,0_0_64_1536_64_64_256_1536
256-17-17-3x3-224-35-35-64-0x0-2x2-1x1-0-NCHW-FP32-B=miopenConvolutionBwdDataAlgoWinograd:ConvBinWinogradRxSf2x3,7.93204,0,miopenConvolutionBwdDataAlgoWinograd,<unused>;miopenConvolutionBwdDataAlgoImplicitGEMM:ConvHipImplicitGemmBwdDataV1R1,8.42155,0,miopenConvolutionBwdDataAlgoImplicitGEMM,256x17x17x3x3x224x35x35x64xNCHWxFP32x0x0x2x2x1x1x1x0;miopenConvolutionBwdDataAlgoDirect:ConvOclDirectFwd,26.8474,0,miopenConvolutionBwdDataAlgoDirect,<unused>;miopenConvolutionBwdDataAlgoGEMM:GemmBwdRest,28.6723,2330496,MIOpenGEMM,0_1_289_2016_289_289_2016_256
192-17-17-3x3-192-8-8-64-0x0-2x2-1x1-0-NCHW-FP32-F=miopenConvolutionFwdAlgoWinograd:ConvBinWinogradRxSf2x3,2.03244,0,miopenConvolutionFwdAlgoWinograd,<unused>;miopenConvolutionFwdAlgoDirect:ConvOclDirectFwd,4.75703,0,miopenConvolutionFwdAlgoDirect,<unused>;miopenConvolutionFwdAlgoGEMM:GemmFwdRest,157.612,442368,MIOpenGEMM,0_0_64_1728_64_64_192_1728
128-17-17-1x1-1024-17-17-64-0x0-1x1-1x1-0-NCHW-FP32-W=miopenConvolutionBwdWeightsAlgoDirect:ConvAsmBwdWrW1x1,0.85533,0,miopenConvolutionBwdWeightsAlgoDirect,<unused>
224-35-35-3x3-256-17-17-64-0x0-2x2-1x1-0-NCHW-FP32-F=miopenConvolutionFwdAlgoWinograd:ConvBinWinogradRxSf2x3,4.42169,0,miopenConvolutionFwdAlgoWinograd,<unused>;miopenConvolutionFwdAlgoGEMM:GemmFwdRest,18.3141,2330496,MIOpenGEMM,0_0_289_2016_289_289_256_2016;miopenConvolutionFwdAlgoDirect:ConvOclDirectFwd,24.8285,0,miopenConvolutionFwdAlgoDirect,<unused>
224-35-35-3x3-192-35-35-64-1x1-1x1-1x1-0-NCHW-FP32-W=miopenConvolutionBwdWeightsAlgoWinograd:ConvBinWinogradRxS,10.1426,0,miopenConvolutionBwdWeightsAlgoWinograd,224x35x35x3x3x192x35x35x64xNCHWxFP32x1x1x1x1x1x1x1x0;miopenConvolutionBwdWeightsAlgoDirect:ConvAsmBwdWrW3x3,12.2645,0,miopenConvolutionBwdWeightsAlgoDirect,<unused>;miopenConvolutionBwdWeightsAlgoImplicitGEMM:ConvHipImplicitGemmV4R1WrW,24.265,0,miopenConvolutionBwdWeightsAlgoImplicitGEMM,224x35x35x3x3x192x35x35x64xNCHWxFP32x1x1x1x1x1x1x1x0;miopenConvolutionBwdWeightsAlgoGEMM:GemmWrwUniversal,66.715,8467200,MIOpenGEMM,1_0_1225_1225_1728_1728_224_1225
384-17-17-1x1-1024-17-17-64-0x0-1x1-1x1-0-NCHW-FP32-W=miopenConvolutionBwdWeightsAlgoDirect:ConvAsmBwdWrW1x1,2.30601,0,miopenConvolutionBwdWeightsAlgoDirect,<unused>;miopenConvolutionBwdWeightsAlgoWinograd:ConvBinWinogradRxSf2x3,8.50597,0,miopenConvolutionBwdWeightsAlgoWinograd,384x17x17x1x1x1024x17x17x64xNCHWxFP32x0x0x1x1x1x1x1x0
192-17-17-7x1-192-17-17-64-3x0-1x1-1x1-0-NCHW-FP32-W=miopenConvolutionBwdWeightsAlgoWinograd:ConvBinWinogradRxSf2x3,1.8692,0,miopenConvolutionBwdWeightsAlgoWinograd,192x17x17x1x7x192x17x17x64xNCHWxFP32x0x3x1x1x1x1x1x0;miopenConvolutionBwdWeightsAlgoDirect:ConvOclBwdWrW53,3.9701,0,miopenConvolutionBwdWeightsAlgoDirect,<unused>;miopenConvolutionBwdWeightsAlgoImplicitGEMM:ConvHipImplicitGemmV4R1WrW,4.25968,0,miopenConvolutionBwdWeightsAlgoImplicitGEMM,192x17x17x1x7x192x17x17x64xNCHWxFP32x0x3x1x1x1x1x1x0;miopenConvolutionBwdWeightsAlgoGEMM:GemmWrwUniversal,13.3311,1553664,MIOpenGEMM,1_0_289_289_1344_1344_192_289
224-35-35-3x3-192-35-35-64-1x1-1x1-1x1-0-NCHW-FP32-B=miopenConvolutionBwdDataAlgoWinograd:ConvBinWinogradRxS,3.61029,0,miopenConvolutionBwdDataAlgoWinograd,<unused>
192-35-35-3x3-224-35-35-64-1x1-1x1-1x1-0-NCHW-FP32-F=miopenConvolutionFwdAlgoWinograd:ConvBinWinogradRxS,3.69755,0,miopenConvolutionFwdAlgoWinograd,<unused>
192-17-17-7x1-192-17-17-64-3x0-1x1-1x1-0-NCHW-FP32-B=miopenConvolutionBwdDataAlgoWinograd:ConvBinWinogradRxSf3x2,1.29541,0,miopenConvolutionBwdDataAlgoWinograd,<unused>;miopenConvolutionBwdDataAlgoImplicitGEMM:ConvHipImplicitGemmBwdDataV1R1,2.91782,0,miopenConvolutionBwdDataAlgoImplicitGEMM,192x17x17x1x7x192x17x17x64xNCHWxFP32x0x3x1x1x1x1x1x0;miopenConvolutionBwdDataAlgoGEMM:GemmBwdRest,6.76548,1553664,MIOpenGEMM,0_1_289_1344_289_289_1344_192
32-149-149-3x3-3-299-299-64-0x0-2x2-1x1-0-NCHW-FP32-W=miopenConvolutionBwdWeightsAlgoDirect:ConvOclBwdWrW2NonTunable,5.44191,221184,miopenConvolutionBwdWeightsAlgoDirect,<unused>;miopenConvolutionBwdWeightsAlgoGEMM:GemmWrwUniversal,10.9691,2397708,MIOpenGEMM,1_0_22201_22201_27_27_32_22201
192-17-17-7x1-192-17-17-64-3x0-1x1-1x1-0-NCHW-FP32-F=miopenConvolutionFwdAlgoImplicitGEMM:ConvHipImplicitGemmV4R1Fwd,1.30996,0,miopenConvolutionFwdAlgoImplicitGEMM,192x17x17x1x7x192x17x17x64xNCHWxFP32x0x3x1x1x1x1x1x1;miopenConvolutionFwdAlgoWinograd:ConvBinWinogradRxSf3x2,1.38906,0,miopenConvolutionFwdAlgoWinograd,<unused>;miopenConvolutionFwdAlgoGEMM:GemmFwdRest,10.6273,1553664,MIOpenGEMM,0_0_289_1344_289_289_192_1344
384-17-17-1x1-1024-17-17-64-0x0-1x1-1x1-0-NCHW-FP32-B=miopenConvolutionBwdDataAlgoDirect:ConvAsm1x1U,2.25362,0,miopenConvolutionBwdDataAlgoDirect,<unused>
256-17-17-1x7-224-17-17-64-0x3-1x1-1x1-0-NCHW-FP32-W=miopenConvolutionBwdWeightsAlgoDirect:ConvOclBwdWrW53,3.9544,0,miopenConvolutionBwdWeightsAlgoDirect,<unused>;miopenConvolutionBwdWeightsAlgoWinograd:ConvBinWinogradRxSf2x3,4.24508,0,miopenConvolutionBwdWeightsAlgoWinograd,256x17x17x7x1x224x17x17x64xNCHWxFP32x3x0x1x1x1x1x1x0;miopenConvolutionBwdWeightsAlgoGEMM:GemmWrwUniversal,53.7922,1812608,MIOpenGEMM,1_0_289_289_1568_1568_256_289
32-149-149-3x3-3-299-299-64-0x0-2x2-1x1-0-NCHW-FP32-B=miopenConvolutionBwdDataAlgoDirect:ConvOclDirectFwd,3.11327,0,miopenConvolutionBwdDataAlgoDirect,<unused>;miopenConvolutionBwdDataAlgoWinograd:ConvBinWinogradRxS,4.89141,0,miopenConvolutionBwdDataAlgoWinograd,<unused>;miopenConvolutionBwdDataAlgoGEMM:GemmBwdRest,12.8643,2397708,MIOpenGEMM,0_1_22201_27_22201_22201_27_32
224-17-17-1x7-192-17-17-64-0x3-1x1-1x1-0-NCHW-FP32-W=miopenConvolutionBwdWeightsAlgoDirect:ConvOclBwdWrW53,2.7756,0,miopenConvolutionBwdWeightsAlgoDirect,<unused>;miopenConvolutionBwdWeightsAlgoWinograd:ConvBinWinogradRxSf2x3,3.23497,0,miopenConvolutionBwdWeightsAlgoWinograd,224x17x17x7x1x192x17x17x64xNCHWxFP32x3x0x1x1x1x1x1x0;miopenConvolutionBwdWeightsAlgoImplicitGEMM:ConvHipImplicitGemmV4R1WrW,5.37546,0,miopenConvolutionBwdWeightsAlgoImplicitGEMM,224x17x17x7x1x192x17x17x64xNCHWxFP32x3x0x1x1x1x1x1x0;miopenConvolutionBwdWeightsAlgoGEMM:GemmWrwUniversal,17.9599,1553664,MIOpenGEMM,1_0_289_289_1344_1344_224_289
256-17-17-1x7-224-17-17-64-0x3-1x1-1x1-0-NCHW-FP32-B=miopenConvolutionBwdDataAlgoWinograd:ConvBinWinogradRxSf3x2,2.84047,0,miopenConvolutionBwdDataAlgoWinograd,<unused>;miopenConvolutionBwdDataAlgoImplicitGEMM:ConvHipImplicitGemmBwdDataV1R1,5.73099,0,miopenConvolutionBwdDataAlgoImplicitGEMM,256x17x17x7x1x224x17x17x64xNCHWxFP32x3x0x1x1x1x1x1x0;miopenConvolutionBwdDataAlgoGEMM:GemmBwdRest,13.0506,1812608,MIOpenGEMM,0_1_289_1568_289_289_1568_256
64-73-73-1x1-160-73-73-64-0x0-1x1-1x1-0-NCHW-FP32-W=miopenConvolutionBwdWeightsAlgoDirect:ConvAsmBwdWrW1x1,2.41018,0,miopenConvolutionBwdWeightsAlgoDirect,<unused>;miopenConvolutionBwdWeightsAlgoGEMM:GemmWrw1x1_stride1,6.99613,0,MIOpenGEMM,1_0_5329_5329_160_160_64_5329;miopenConvolutionBwdWeightsAlgoWinograd:ConvBinWinogradRxSf2x3,18.0002,0,miopenConvolutionBwdWeightsAlgoWinograd,64x73x73x1x1x160x73x73x64xNCHWxFP32x0x0x1x1x1x1x1x0
3-299-299-3x3-32-149-149-64-0x0-2x2-1x1-0-NCHW-FP32-F=miopenConvolutionFwdAlgoDirect:ConvOclDirectFwd,2.95406,0,miopenConvolutionFwdAlgoDirect,<unused>;miopenConvolutionFwdAlgoWinograd:ConvBinWinogradRxSf2x3,3.12955,0,miopenConvolutionFwdAlgoWinograd,<unused>;miopenConvolutionFwdAlgoGEMM:GemmFwdRest,20.9835,2397708,MIOpenGEMM,0_0_22201_27_22201_22201_32_27
1024-17-17-1x1-384-17-17-64-0x0-1x1-1x1-0-NCHW-FP32-F=miopenConvolutionFwdAlgoDirect:ConvOclDirectFwd1x1,3.3016,0,miopenConvolutionFwdAlgoDirect,<unused>;miopenConvolutionFwdAlgoGEMM:GemmFwd1x1_0_1,8.36534,0,MIOpenGEMM,0_0_289_1024_289_289_384_1024
224-17-17-1x7-256-17-17-64-0x3-1x1-1x1-0-NCHW-FP32-F=miopenConvolutionFwdAlgoImplicitGEMM:ConvHipImplicitGemmV4R1Fwd,2.9041,0,miopenConvolutionFwdAlgoImplicitGEMM,224x17x17x7x1x256x17x17x64xNCHWxFP32x3x0x1x1x1x1x1x1;miopenConvolutionFwdAlgoWinograd:ConvBinWinogradRxSf3x2,3.06751,0,miopenConvolutionFwdAlgoWinograd,<unused>;miopenConvolutionFwdAlgoGEMM:GemmFwdRest,13.9889,1812608,MIOpenGEMM,0_0_289_1568_289_289_256_1568
224-17-17-1x7-192-17-17-64-0x3-1x1-1x1-0-NCHW-FP32-B=miopenConvolutionBwdDataAlgoWinograd:ConvBinWinogradRxSf3x2,1.65172,0,miopenConvolutionBwdDataAlgoWinograd,<unused>;miopenConvolutionBwdDataAlgoImplicitGEMM:ConvHipImplicitGemmBwdDataV1R1,2.24136,0,miopenConvolutionBwdDataAlgoImplicitGEMM,224x17x17x7x1x192x17x17x64xNCHWxFP32x3x0x1x1x1x1x1x0;miopenConvolutionBwdDataAlgoGEMM:GemmBwdRest,6.73886,1553664,MIOpenGEMM,0_1_289_1344_289_289_1344_224
224-17-17-7x1-224-17-17-64-3x0-1x1-1x1-0-NCHW-FP32-W=miopenConvolutionBwdWeightsAlgoWinograd:ConvBinWinogradRxSf2x3,2.7376,0,miopenConvolutionBwdWeightsAlgoWinograd,224x17x17x1x7x224x17x17x64xNCHWxFP32x0x3x1x1x1x1x1x0;miopenConvolutionBwdWeightsAlgoDirect:ConvOclBwdWrW53,7.00616,0,miopenConvolutionBwdWeightsAlgoDirect,<unused>;miopenConvolutionBwdWeightsAlgoGEMM:GemmWrwUniversal,8.4355,1812608,MIOpenGEMM,1_0_289_289_1568_1568_224_289
64-73-73-1x1-160-73-73-64-0x0-1x1-1x1-0-NCHW-FP32-B=miopenConvolutionBwdDataAlgoDirect:ConvAsm1x1U,1.321,0,miopenConvolutionBwdDataAlgoDirect,<unused>;miopenConvolutionBwdDataAlgoGEMM:GemmBwd1x1_stride1,3.4923,0,MIOpenGEMM,0_1_5329_160_5329_5329_160_64
64-73-73-1x1-80-73-73-128-0x0-1x1-1x1-0-NCHW-FP32-F=miopenConvolutionFwdAlgoDirect:ConvOclDirectFwd1x1,1.77586,0,miopenConvolutionFwdAlgoDirect,<unused>
256-17-17-1x1-1024-17-17-64-0x0-1x1-1x1-0-NCHW-FP32-W=miopenConvolutionBwdWeightsAlgoDirect:ConvAsmBwdWrW1x1,2.41449,0,miopenConvolutionBwdWeightsAlgoDirect,<unused>
192-17-17-1x7-224-17-17-64-0x3-1x1-1x1-0-NCHW-FP32-F=miopenConvolutionFwdAlgoImplicitGEMM:ConvHipImplicitGemmV4R1Fwd,2.27051,0,miopenConvolutionFwdAlgoImplicitGEMM,192x17x17x7x1x224x17x17x64xNCHWxFP32x3x0x1x1x1x1x1x1;miopenConvolutionFwdAlgoWinograd:ConvBinWinogradRxSf3x2,2.37461,0,miopenConvolutionFwdAlgoWinograd,<unused>;miopenConvolutionFwdAlgoGEMM:GemmFwdRest,8.91154,1553664,MIOpenGEMM,0_0_289_1344_289_289_224_1344
224-17-17-7x1-224-17-17-64-3x0-1x1-1x1-0-NCHW-FP32-B=miopenConvolutionBwdDataAlgoWinograd:ConvBinWinogradRxSf3x2,2.55143,0,miopenConvolutionBwdDataAlgoWinograd,<unused>;miopenConvolutionBwdDataAlgoImplicitGEMM:ConvHipImplicitGemmBwdDataV1R1,5.96756,0,miopenConvolutionBwdDataAlgoImplicitGEMM,224x17x17x1x7x224x17x17x64xNCHWxFP32x0x3x1x1x1x1x1x0;miopenConvolutionBwdDataAlgoGEMM:GemmBwdRest,16.3545,1812608,MIOpenGEMM,0_1_289_1568_289_289_1568_224
224-17-17-7x1-192-17-17-64-3x0-1x1-1x1-0-NCHW-FP32-W=miopenConvolutionBwdWeightsAlgoWinograd:ConvBinWinogradRxSf2x3,2.91852,0,miopenConvolutionBwdWeightsAlgoWinograd,224x17x17x1x7x192x17x17x64xNCHWxFP32x0x3x1x1x1x1x1x0;miopenConvolutionBwdWeightsAlgoImplicitGEMM:ConvHipImplicitGemmV4R1WrW,7.00069,0,miopenConvolutionBwdWeightsAlgoImplicitGEMM,224x17x17x1x7x192x17x17x64xNCHWxFP32x0x3x1x1x1x1x1x0;miopenConvolutionBwdWeightsAlgoDirect:ConvOclBwdWrW53,7.3262,0,miopenConvolutionBwdWeightsAlgoDirect,<unused>;miopenConvolutionBwdWeightsAlgoGEMM:GemmWrwUniversal,18.0819,1553664,MIOpenGEMM,1_0_289_289_1344_1344_224_289
96-35-35-1x1-384-35-35-64-0x0-1x1-1x1-0-NCHW-FP32-W=miopenConvolutionBwdWeightsAlgoDirect:ConvAsmBwdWrW1x1,2.28383,0,miopenConvolutionBwdWeightsAlgoDirect,<unused>
192-17-17-1x1-768-17-17-128-0x0-1x1-1x1-0-NCHW-FP32-W=miopenConvolutionBwdWeightsAlgoDirect:ConvAsmBwdWrW1x1,2.32944,0,miopenConvolutionBwdWeightsAlgoDirect,<unused>
160-73-73-1x1-64-73-73-64-0x0-1x1-1x1-0-NCHW-FP32-F=miopenConvolutionFwdAlgoDirect:ConvOclDirectFwd1x1,1.41395,0,miopenConvolutionFwdAlgoDirect,<unused>;miopenConvolutionFwdAlgoWinograd:ConvBinWinogradRxSf3x2,2.21517,0,miopenConvolutionFwdAlgoWinograd,<unused>;miopenConvolutionFwdAlgoGEMM:GemmFwd1x1_0_1,2.80321,0,MIOpenGEMM,0_0_5329_160_5329_5329_64_160
320-17-17-1x7-256-17-17-64-0x3-1x1-1x1-0-NCHW-FP32-W=miopenConvolutionBwdWeightsAlgoDirect:ConvOclBwdWrW53,8.72108,0,miopenConvolutionBwdWeightsAlgoDirect,<unused>;miopenConvolutionBwdWeightsAlgoImplicitGEMM:ConvHipImplicitGemmV4R1WrW,9.97871,0,miopenConvolutionBwdWeightsAlgoImplicitGEMM,320x17x17x7x1x256x17x17x64xNCHWxFP32x3x0x1x1x1x1x1x0;miopenConvolutionBwdWeightsAlgoWinograd:ConvBinWinogradRxSf2x3,13.4366,0,miopenConvolutionBwdWeightsAlgoWinograd,320x17x17x7x1x256x17x17x64xNCHWxFP32x3x0x1x1x1x1x1x0;miopenConvolutionBwdWeightsAlgoGEMM:GemmWrwUniversal,64.0488,2071552,MIOpenGEMM,1_0_289_289_1792_1792_320_289
128-17-17-1x1-1024-17-17-64-0x0-1x1-1x1-0-NCHW-FP32-B=miopenConvolutionBwdDataAlgoDirect:ConvAsm1x1U,1.03457,0,miopenConvolutionBwdDataAlgoDirect,<unused>;miopenConvolutionBwdDataAlgoGEMM:GemmBwd1x1_stride1,93.7372,0,MIOpenGEMM,0_1_289_1024_289_289_1024_128
32-147-147-3x3-64-147-147-128-1x1-1x1-1x1-0-NCHW-FP32-F=miopenConvolutionFwdAlgoWinograd:ConvBinWinogradRxS,7.8403,0,miopenConvolutionFwdAlgoWinograd,<unused>
224-17-17-7x1-192-17-17-64-3x0-1x1-1x1-0-NCHW-FP32-B=miopenConvolutionBwdDataAlgoWinograd:ConvBinWinogradRxSf3x2,1.62921,0,miopenConvolutionBwdDataAlgoWinograd,<unused>;miopenConvolutionBwdDataAlgoImplicitGEMM:ConvHipImplicitGemmBwdDataV1R1,4.14014,0,miopenConvolutionBwdDataAlgoImplicitGEMM,224x17x17x1x7x192x17x17x64xNCHWxFP32x0x3x1x1x1x1x1x0;miopenConvolutionBwdDataAlgoGEMM:GemmBwdRest,19.9002,1553664,MIOpenGEMM,0_1_289_1344_289_289_1344_224
224-17-17-7x1-224-17-17-64-3x0-1x1-1x1-0-NCHW-FP32-F=miopenConvolutionFwdAlgoWinograd:ConvBinWinogradRxSf3x2,1.91557,0,miopenConvolutionFwdAlgoWinograd,<unused>;miopenConvolutionFwdAlgoImplicitGEMM:ConvHipImplicitGemmV4R1Fwd,2.53792,0,miopenConvolutionFwdAlgoImplicitGEMM,224x17x17x1x7x224x17x17x64xNCHWxFP32x0x3x1x1x1x1x1x1;miopenConvolutionFwdAlgoGEMM:GemmFwdRest,14.0737,1812608,MIOpenGEMM,0_0_289_1568_289_289_224_1568
448-8-8-1x3-512-8-8-64-0x1-1x1-1x1-0-NCHW-FP32-F=miopenConvolutionFwdAlgoWinograd:ConvBinWinogradRxSf2x3,1.0267,0,miopenConvolutionFwdAlgoWinograd,<unused>;miopenConvolutionFwdAlgoImplicitGEMM:ConvHipImplicitGemmV4R1Fwd,2.93778,0,miopenConvolutionFwdAlgoImplicitGEMM,448x8x8x3x1x512x8x8x64xNCHWxFP32x1x0x1x1x1x1x1x1;miopenConvolutionFwdAlgoGEMM:GemmFwdRest,60.0524,344064,MIOpenGEMM,0_0_64_1344_64_64_512_1344
96-35-35-1x1-384-35-35-64-0x0-1x1-1x1-0-NCHW-FP32-B=miopenConvolutionBwdDataAlgoDirect:ConvAsm1x1U,1.21134,0,miopenConvolutionBwdDataAlgoDirect,<unused>
320-17-17-1x7-256-17-17-64-0x3-1x1-1x1-0-NCHW-FP32-B=miopenConvolutionBwdDataAlgoWinograd:ConvBinWinogradRxSf3x2,4.4118,0,miopenConvolutionBwdDataAlgoWinograd,<unused>;miopenConvolutionBwdDataAlgoImplicitGEMM:ConvHipImplicitGemmBwdDataV1R1,5.83705,0,miopenConvolutionBwdDataAlgoImplicitGEMM,320x17x17x7x1x256x17x17x64xNCHWxFP32x3x0x1x1x1x1x1x0;miopenConvolutionBwdDataAlgoGEMM:GemmBwdRest,22.102,2071552,MIOpenGEMM,0_1_289_1792_289_289_1792_320
448-8-8-3x1-384-8-8-64-1x0-1x1-1x1-0-NCHW-FP32-W=miopenConvolutionBwdWeightsAlgoDirect:ConvOclBwdWrW53,1.22968,0,miopenConvolutionBwdWeightsAlgoDirect,<unused>;miopenConvolutionBwdWeightsAlgoWinograd:ConvBinWinogradRxS,1.53056,0,miopenConvolutionBwdWeightsAlgoWinograd,448x8x8x1x3x384x8x8x64xNCHWxFP32x0x1x1x1x1x1x1x0;miopenConvolutionBwdWeightsAlgoImplicitGEMM:ConvHipImplicitGemmV4R1WrW,2.9336,0,miopenConvolutionBwdWeightsAlgoImplicitGEMM,448x8x8x1x3x384x8x8x64xNCHWxFP32x0x1x1x1x1x1x1x0;miopenConvolutionBwdWeightsAlgoGEMM:GemmWrwUniversal,8.18311,294912,MIOpenGEMM,1_0_64_64_1152_1152_448_64
96-73-73-3x3-64-147-147-64-0x0-2x2-1x1-0-NCHW-FP32-W=miopenConvolutionBwdWeightsAlgoGEMM:GemmWrwUniversal,15.8354,12278016,MIOpenGEMM,1_0_5329_5329_576_576_96_5329;miopenConvolutionBwdWeightsAlgoDirect:ConvOclBwdWrW2NonTunable,32.7675,14155776,miopenConvolutionBwdWeightsAlgoDirect,<unused>;miopenConvolutionBwdWeightsAlgoImplicitGEMM:ConvHipImplicitGemmV4R1WrW,62.4128,0,miopenConvolutionBwdWeightsAlgoImplicitGEMM,96x73x73x3x3x64x147x147x64xNCHWxFP32x0x0x2x2x1x1x1x0
192-17-17-7x1-224-17-17-64-3x0-1x1-1x1-0-NCHW-FP32-F=miopenConvolutionFwdAlgoImplicitGEMM:ConvHipImplicitGemmV4R1Fwd,2.32946,0,miopenConvolutionFwdAlgoImplicitGEMM,192x17x17x1x7x224x17x17x64xNCHWxFP32x0x3x1x1x1x1x1x1;miopenConvolutionFwdAlgoWinograd:ConvBinWinogradRxSf3x2,2.34688,0,miopenConvolutionFwdAlgoWinograd,<unused>;miopenConvolutionFwdAlgoGEMM:GemmFwdRest,18.3567,1553664,MIOpenGEMM,0_0_289_1344_289_289_224_1344
80-73-73-1x1-64-73-73-128-0x0-1x1-1x1-0-NCHW-FP32-W=miopenConvolutionBwdWeightsAlgoDirect:ConvAsmBwdWrW1x1,4.70056,0,miopenConvolutionBwdWeightsAlgoDirect,<unused>
192-35-35-3x3-192-71-71-64-0x0-2x2-1x1-0-NCHW-FP32-W=miopenConvolutionBwdWeightsAlgoImplicitGEMM:ConvHipImplicitGemmV4R1WrW,21.9464,0,miopenConvolutionBwdWeightsAlgoImplicitGEMM,192x35x35x3x3x192x71x71x64xNCHWxFP32x0x0x2x2x1x1x1x0;miopenConvolutionBwdWeightsAlgoGEMM:GemmWrwUniversal,26.733,8467200,MIOpenGEMM,1_0_1225_1225_1728_1728_192_1225;miopenConvolutionBwdWeightsAlgoDirect:ConvOclBwdWrW2NonTunable,47.8517,84934656,miopenConvolutionBwdWeightsAlgoDirect,<unused>
384-8-8-1x1-1536-8-8-64-0x0-1x1-1x1-0-NCHW-FP32-W=miopenConvolutionBwdWeightsAlgoDirect:ConvAsmBwdWrW1x1,1.16223,0,miopenConvolutionBwdWeightsAlgoDirect,<unused>;miopenConvolutionBwdWeightsAlgoGEMM:GemmWrw1x1_stride1,2.66409,0,MIOpenGEMM,1_0_64_64_1536_1536_384_64;miopenConvolutionBwdWeightsAlgoWinograd:ConvBinWinogradRxSf2x3,3.5617,0,miopenConvolutionBwdWeightsAlgoWinograd,384x8x8x1x1x1536x8x8x64xNCHWxFP32x0x0x1x1x1x1x1x0
128-17-17-1x1-768-17-17-128-0x0-1x1-1x1-0-NCHW-FP32-B=miopenConvolutionBwdDataAlgoDirect:ConvAsm1x1U,1.21113,0,miopenConvolutionBwdDataAlgoDirect,<unused>;miopenConvolutionBwdDataAlgoWinograd:ConvBinWinogradRxSf3x2,2.95095,0,miopenConvolutionBwdDataAlgoWinograd,<unused>;miopenConvolutionBwdDataAlgoGEMM:GemmBwd1x1_stride1,67.2602,0,MIOpenGEMM,0_1_289_768_289_289_768_128
256-17-17-1x1-1024-17-17-64-0x0-1x1-1x1-0-NCHW-FP32-B=miopenConvolutionBwdDataAlgoDirect:ConvAsm1x1U,1.4289,0,miopenConvolutionBwdDataAlgoDirect,<unused>;miopenConvolutionBwdDataAlgoGEMM:GemmBwd1x1_stride1,6.41338,0,MIOpenGEMM,0_1_289_1024_289_289_1024_256
384-35-35-1x1-192-35-35-64-0x0-1x1-1x1-0-NCHW-FP32-F=miopenConvolutionFwdAlgoDirect:ConvAsm1x1U,1.70795,0,miopenConvolutionFwdAlgoDirect,<unused>;miopenConvolutionFwdAlgoWinograd:ConvBinWinogradRxSf3x2,3.0568,0,miopenConvolutionFwdAlgoWinograd,<unused>;miopenConvolutionFwdAlgoGEMM:GemmFwd1x1_0_1,4.98296,0,MIOpenGEMM,0_0_1225_384_1225_1225_192_384
448-8-8-3x1-384-8-8-64-1x0-1x1-1x1-0-NCHW-FP32-B=miopenConvolutionBwdDataAlgoWinograd:ConvBinWinogradRxSf2x3,0.719313,0,miopenConvolutionBwdDataAlgoWinograd,<unused>;miopenConvolutionBwdDataAlgoImplicitGEMM:ConvHipImplicitGemmBwdDataV1R1,4.86447,0,miopenConvolutionBwdDataAlgoImplicitGEMM,448x8x8x1x3x384x8x8x64xNCHWxFP32x0x1x1x1x1x1x1x0;miopenConvolutionBwdDataAlgoGEMM:GemmBwdRest,9.56523,294912,MIOpenGEMM,0_1_64_1152_64_64_1152_448
256-17-17-1x7-320-17-17-64-0x3-1x1-1x1-0-NCHW-FP32-F=miopenConvolutionFwdAlgoWinograd:ConvBinWinogradRxSf3x2,3.40603,0,miopenConvolutionFwdAlgoWinograd,<unused>;miopenConvolutionFwdAlgoImplicitGEMM:ConvHipImplicitGemmV4R1Fwd,3.41803,0,miopenConvolutionFwdAlgoImplicitGEMM,256x17x17x7x1x320x17x17x64xNCHWxFP32x3x0x1x1x1x1x1x1;miopenConvolutionFwdAlgoGEMM:GemmFwdRest,48.5312,2071552,MIOpenGEMM,0_0_289_1792_289_289_320_1792
96-35-35-3x3-96-35-35-64-1x1-1x1-1x1-0-NCHW-FP32-B=miopenConvolutionBwdDataAlgoWinograd:ConvBinWinograd3x3U,0.720851,0,miopenConvolutionBwdDataAlgoWinograd,<unused>
1024-17-17-1x1-128-17-17-64-0x0-1x1-1x1-0-NCHW-FP32-F=miopenConvolutionFwdAlgoDirect:ConvAsm1x1U,1.00463,0,miopenConvolutionFwdAlgoDirect,<unused>;miopenConvolutionFwdAlgoWinograd:ConvBinWinogradRxSf3x2,1.95844,0,miopenConvolutionFwdAlgoWinograd,<unused>;miopenConvolutionFwdAlgoGEMM:GemmFwd1x1_0_1,4.11761,0,MIOpenGEMM,0_0_289_1024_289_289_128_1024
96-73-73-3x3-64-147-147-64-0x0-2x2-1x1-0-NCHW-FP32-B=miopenConvolutionBwdDataAlgoWinograd:ConvBinWinogradRxS,11.2715,0,miopenConvolutionBwdDataAlgoWinograd,<unused>;miopenConvolutionBwdDataAlgoImplicitGEMM:ConvHipImplicitGemmBwdDataV1R1,26.6841,0,miopenConvolutionBwdDataAlgoImplicitGEMM,96x73x73x3x3x64x147x147x64xNCHWxFP32x0x0x2x2x1x1x1x0;miopenConvolutionBwdDataAlgoDirect:ConvOclDirectFwd,27.9117,0,miopenConvolutionBwdDataAlgoDirect,<unused>;miopenConvolutionBwdDataAlgoGEMM:GemmBwdRest,36.8167,12278016,MIOpenGEMM,0_1_5329_576_5329_5329_576_96
384-35-35-1x1-96-35-35-64-0x0-1x1-1x1-0-NCHW-FP32-F=miopenConvolutionFwdAlgoDirect:ConvAsm1x1U,1.08311,0,miopenConvolutionFwdAlgoDirect,<unused>;miopenConvolutionFwdAlgoGEMM:GemmFwd1x1_0_1,4.95649,0,MIOpenGEMM,0_0_1225_384_1225_1225_96_384
64-73-73-3x3-96-71-71-64-0x0-1x1-1x1-0-NCHW-FP32-F=miopenConvolutionFwdAlgoWinograd:ConvBinWinogradRxSf2x3,2.2995,0,miopenConvolutionFwdAlgoWinograd,<unused>;miopenConvolutionFwdAlgoDirect:ConvOclDirectFwd,15.5523,0,miopenConvolutionFwdAlgoDirect,<unused>;miopenConvolutionFwdAlgoGEMM:GemmFwdRest,17.5278,11614464,MIOpenGEMM,0_0_5041_576_5041_5041_96_576
256-17-17-7x1-256-17-17-64-3x0-1x1-1x1-0-NCHW-FP32-W=miopenConvolutionBwdWeightsAlgoImplicitGEMM:ConvHipImplicitGemmV4R1WrW,4.66681,0,miopenConvolutionBwdWeightsAlgoImplicitGEMM,256x17x17x1x7x256x17x17x64xNCHWxFP32x0x3x1x1x1x1x1x0;miopenConvolutionBwdWeightsAlgoWinograd:ConvBinWinogradRxSf2x3,5.75734,0,miopenConvolutionBwdWeightsAlgoWinograd,256x17x17x1x7x256x17x17x64xNCHWxFP32x0x3x1x1x1x1x1x0;miopenConvolutionBwdWeightsAlgoDirect:ConvOclBwdWrW53,9.4454,0,miopenConvolutionBwdWeightsAlgoDirect,<unused>;miopenConvolutionBwdWeightsAlgoGEMM:GemmWrwUniversal,35.9349,2071552,MIOpenGEMM,1_0_289_289_1792_1792_256_289
320-8-8-3x3-320-17-17-64-0x0-2x2-1x1-0-NCHW-FP32-W=miopenConvolutionBwdWeightsAlgoImplicitGEMM:ConvHipImplicitGemmV4R1WrW,1.93881,0,miopenConvolutionBwdWeightsAlgoImplicitGEMM,320x8x8x3x3x320x17x17x64xNCHWxFP32x0x0x2x2x1x1x1x0;miopenConvolutionBwdWeightsAlgoGEMM:GemmWrwUniversal,17.7327,737280,MIOpenGEMM,1_0_64_64_2880_2880_320_64;miopenConvolutionBwdWeightsAlgoDirect:ConvOclBwdWrW2NonTunable,33.4398,235929600,miopenConvolutionBwdWeightsAlgoDirect,<unused>
192-35-35-3x3-192-71-71-64-0x0-2x2-1x1-0-NCHW-FP32-B=miopenConvolutionBwdDataAlgoWinograd:ConvBinWinogradRxS,16.8221,0,miopenConvolutionBwdDataAlgoWinograd,<unused>;miopenConvolutionBwdDataAlgoImplicitGEMM:ConvHipImplicitGemmBwdDataV1R1,19.9282,0,miopenConvolutionBwdDataAlgoImplicitGEMM,192x35x35x3x3x192x71x71x64xNCHWxFP32x0x0x2x2x1x1x1x0;miopenConvolutionBwdDataAlgoGEMM:GemmBwdRest,33.7576,8467200,MIOpenGEMM,0_1_1225_1728_1225_1225_1728_192;miopenConvolutionBwdDataAlgoDirect:ConvOclDirectFwd,43.8079,0,miopenConvolutionBwdDataAlgoDirect,<unused>
384-8-8-1x3-384-8-8-128-0x1-1x1-1x1-0-NCHW-FP32-W=miopenConvolutionBwdWeightsAlgoDirect:ConvOclBwdWrW53,1.45737,0,miopenConvolutionBwdWeightsAlgoDirect,<unused>;miopenConvolutionBwdWeightsAlgoImplicitGEMM:ConvHipImplicitGemmV4R1WrW,1.82974,0,miopenConvolutionBwdWeightsAlgoImplicitGEMM,384x8x8x3x1x384x8x8x128xNCHWxFP32x1x0x1x1x1x1x1x0;miopenConvolutionBwdWeightsAlgoWinograd:ConvBinWinogradRxS,1.94993,0,miopenConvolutionBwdWeightsAlgoWinograd,384x8x8x3x1x384x8x8x128xNCHWxFP32x1x0x1x1x1x1x1x0;miopenConvolutionBwdWeightsAlgoGEMM:GemmWrwUniversal,9.7733,294912,MIOpenGEMM,1_0_64_64_1152_1152_384_64
384-8-8-3x1-448-8-8-64-1x0-1x1-1x1-0-NCHW-FP32-F=miopenConvolutionFwdAlgoWinograd:ConvBinWinogradRxS,0.619082,0,miopenConvolutionFwdAlgoWinograd,<unused>;miopenConvolutionFwdAlgoImplicitGEMM:ConvHipImplicitGemmV4R1Fwd,0.939703,0,miopenConvolutionFwdAlgoImplicitGEMM,384x8x8x1x3x448x8x8x64xNCHWxFP32x0x1x1x1x1x1x1x1;miopenConvolutionFwdAlgoGEMM:GemmFwdRest,12.0103,294912,MIOpenGEMM,0_0_64_1152_64_64_448_1152
256-8-8-1x3-512-8-8-64-0x1-1x1-1x1-0-NCHW-FP32-B=miopenConvolutionBwdDataAlgoWinograd:ConvBinWinogradRxS,0.543097,0,miopenConvolutionBwdDataAlgoWinograd,<unused>;miopenConvolutionBwdDataAlgoImplicitGEMM:ConvHipImplicitGemmBwdDataV1R1,2.76203,0,miopenConvolutionBwdDataAlgoImplicitGEMM,256x8x8x3x1x512x8x8x64xNCHWxFP32x1x0x1x1x1x1x1x0;miopenConvolutionBwdDataAlgoGEMM:GemmBwdRest,8.94537,393216,MIOpenGEMM,0_1_64_1536_64_64_1536_256
384-17-17-3x3-288-35-35-128-0x0-2x2-1x1-0-NCHW-FP32-B=miopenConvolutionBwdDataAlgoWinograd:ConvBinWinogradRxS,18.7509,0,miopenConvolutionBwdDataAlgoWinograd,<unused>;miopenConvolutionBwdDataAlgoImplicitGEMM:ConvHipImplicitGemmBwdDataV1R1,24.9444,0,miopenConvolutionBwdDataAlgoImplicitGEMM,384x17x17x3x3x288x35x35x128xNCHWxFP32x0x0x2x2x1x1x1x0;miopenConvolutionBwdDataAlgoDirect:ConvOclDirectFwd,68.3162,0,miopenConvolutionBwdDataAlgoDirect,<unused>;miopenConvolutionBwdDataAlgoGEMM:GemmBwdRest,73.1054,2996352,MIOpenGEMM,0_1_289_2592_289_289_2592_384
96-35-35-3x3-64-35-35-64-1x1-1x1-1x1-0-NCHW-FP32-B=miopenConvolutionBwdDataAlgoWinograd:ConvBinWinograd3x3U,0.551118,0,miopenConvolutionBwdDataAlgoWinograd,<unused>
320-8-8-3x3-320-17-17-64-0x0-2x2-1x1-0-NCHW-FP32-B=miopenConvolutionBwdDataAlgoImplicitGEMM:ConvHipImplicitGemmBwdDataV1R1,2.44556,0,miopenConvolutionBwdDataAlgoImplicitGEMM,320x8x8x3x3x320x17x17x64xNCHWxFP32x0x0x2x2x1x1x1x0;miopenConvolutionBwdDataAlgoWinograd:ConvBinWinogradRxSf2x3,3.72686,0,miopenConvolutionBwdDataAlgoWinograd,<unused>;miopenConvolutionBwdDataAlgoGEMM:GemmBwdRest,9.50567,737280,MIOpenGEMM,0_1_64_2880_64_64_2880_320;miopenConvolutionBwdDataAlgoDirect:ConvOclDirectFwd,13.8458,0,miopenConvolutionBwdDataAlgoDirect,<unused>
768-17-17-1x1-128-17-17-128-0x0-1x1-1x1-0-NCHW-FP32-F=miopenConvolutionFwdAlgoDirect:ConvAsm1x1U,1.46385,0,miopenConvolutionFwdAlgoDirect,<unused>;miopenConvolutionFwdAlgoWinograd:ConvBinWinogradRxSf3x2,2.29111,0,miopenConvolutionFwdAlgoWinograd,<unused>;miopenConvolutionFwdAlgoGEMM:GemmFwd1x1_0_1,7.12544,0,MIOpenGEMM,0_0_289_768_289_289_128_768
256-17-17-7x1-256-17-17-64-3x0-1x1-1x1-0-NCHW-FP32-B=miopenConvolutionBwdDataAlgoWinograd:ConvBinWinogradRxSf3x2,3.48681,0,miopenConvolutionBwdDataAlgoWinograd,<unused>;miopenConvolutionBwdDataAlgoImplicitGEMM:ConvHipImplicitGemmBwdDataV1R1,4.81647,0,miopenConvolutionBwdDataAlgoImplicitGEMM,256x17x17x1x7x256x17x17x64xNCHWxFP32x0x3x1x1x1x1x1x0;miopenConvolutionBwdDataAlgoGEMM:GemmBwdRest,11.7203,2071552,MIOpenGEMM,0_1_289_1792_289_289_1792_256
64-147-147-3x3-96-73-73-64-0x0-2x2-1x1-0-NCHW-FP32-F=miopenConvolutionFwdAlgoWinograd:ConvBinWinogradRxSf2x3,8.03949,0,miopenConvolutionFwdAlgoWinograd,<unused>;miopenConvolutionFwdAlgoGEMM:GemmFwdRest,12.6241,12278016,MIOpenGEMM,0_0_5329_576_5329_5329_96_576;miopenConvolutionFwdAlgoDirect:ConvOclDirectFwd,28.7828,0,miopenConvolutionFwdAlgoDirect,<unused>
192-71-71-3x3-80-73-73-128-0x0-1x1-1x1-0-NCHW-FP32-B=miopenConvolutionBwdDataAlgoWinograd:ConvBinWinogradRxS,12.3032,0,miopenConvolutionBwdDataAlgoWinograd,<unused>;miopenConvolutionBwdDataAlgoDirect:ConvOclDirectFwd,69.7496,0,miopenConvolutionBwdDataAlgoDirect,<unused>;miopenConvolutionBwdDataAlgoGEMM:GemmBwdRest,77.8874,14518080,MIOpenGEMM,0_1_5041_720_5041_5041_720_192
64-35-35-1x1-384-35-35-64-0x0-1x1-1x1-0-NCHW-FP32-W=miopenConvolutionBwdWeightsAlgoDirect:ConvAsmBwdWrW1x1,0.953708,0,miopenConvolutionBwdWeightsAlgoDirect,<unused>
256-8-8-1x3-384-8-8-64-0x1-1x1-1x1-0-NCHW-FP32-W=miopenConvolutionBwdWeightsAlgoDirect:ConvOclBwdWrW53,0.484594,0,miopenConvolutionBwdWeightsAlgoDirect,<unused>;miopenConvolutionBwdWeightsAlgoWinograd:ConvBinWinogradRxSf2x3,0.732817,0,miopenConvolutionBwdWeightsAlgoWinograd,256x8x8x3x1x384x8x8x64xNCHWxFP32x1x0x1x1x1x1x1x0;miopenConvolutionBwdWeightsAlgoImplicitGEMM:ConvHipImplicitGemmV4R1WrW,1.71157,0,miopenConvolutionBwdWeightsAlgoImplicitGEMM,256x8x8x3x1x384x8x8x64xNCHWxFP32x1x0x1x1x1x1x1x0;miopenConvolutionBwdWeightsAlgoGEMM:GemmWrwUniversal,3.45739,294912,MIOpenGEMM,1_0_64_64_1152_1152_256_64
256-8-8-1x3-512-8-8-64-0x1-1x1-1x1-0-NCHW-FP32-W=miopenConvolutionBwdWeightsAlgoDirect:ConvOclBwdWrW53,0.797282,0,miopenConvolutionBwdWeightsAlgoDirect,<unused>;miopenConvolutionBwdWeightsAlgoWinograd:ConvBinWinogradRxS,0.898538,0,miopenConvolutionBwdWeightsAlgoWinograd,256x8x8x3x1x512x8x8x64xNCHWxFP32x1x0x1x1x1x1x1x0;miopenConvolutionBwdWeightsAlgoImplicitGEMM:ConvHipImplicitGemmV4R1WrW,1.13413,0,miopenConvolutionBwdWeightsAlgoImplicitGEMM,256x8x8x3x1x512x8x8x64xNCHWxFP32x1x0x1x1x1x1x1x0;miopenConvolutionBwdWeightsAlgoGEMM:GemmWrwUniversal,2.76451,393216,MIOpenGEMM,1_0_64_64_1536_1536_256_64
256-8-8-1x3-384-8-8-64-0x1-1x1-1x1-0-NCHW-FP32-B=miopenConvolutionBwdDataAlgoWinograd:ConvBinWinogradRxS,0.469484,0,miopenConvolutionBwdDataAlgoWinograd,<unused>;miopenConvolutionBwdDataAlgoImplicitGEMM:ConvHipImplicitGemmBwdDataV1R1,0.540106,0,miopenConvolutionBwdDataAlgoImplicitGEMM,256x8x8x3x1x384x8x8x64xNCHWxFP32x1x0x1x1x1x1x1x0;miopenConvolutionBwdDataAlgoGEMM:GemmBwdRest,4.60755,294912,MIOpenGEMM,0_1_64_1152_64_64_1152_256
64-35-35-1x1-384-35-35-64-0x0-1x1-1x1-0-NCHW-FP32-B=miopenConvolutionBwdDataAlgoDirect:ConvAsm1x1U,0.577075,0,miopenConvolutionBwdDataAlgoDirect,<unused>;miopenConvolutionBwdDataAlgoWinograd:ConvBinWinogradRxSf3x2,1.53119,0,miopenConvolutionBwdDataAlgoWinograd,<unused>;miopenConvolutionBwdDataAlgoGEMM:GemmBwd1x1_stride1,6.12204,0,MIOpenGEMM,0_1_1225_384_1225_1225_384_64
384-8-8-1x3-256-8-8-64-0x1-1x1-1x1-0-NCHW-FP32-F=miopenConvolutionFwdAlgoWinograd:ConvBinWinogradRxSf2x3,0.421327,0,miopenConvolutionFwdAlgoWinograd,<unused>;miopenConvolutionFwdAlgoImplicitGEMM:ConvHipImplicitGemmV4R1Fwd,2.38672,0,miopenConvolutionFwdAlgoImplicitGEMM,384x8x8x3x1x256x8x8x64xNCHWxFP32x1x0x1x1x1x1x1x1;miopenConvolutionFwdAlgoGEMM:GemmFwdRest,31.8821,294912,MIOpenGEMM,0_0_64_1152_64_64_256_1152
256-8-8-3x1-384-8-8-64-1x0-1x1-1x1-0-NCHW-FP32-W=miopenConvolutionBwdWeightsAlgoWinograd:ConvBinWinogradRxSf2x3,0.578502,0,miopenConvolutionBwdWeightsAlgoWinograd,256x8x8x1x3x384x8x8x64xNCHWxFP32x0x1x1x1x1x1x1x0;miopenConvolutionBwdWeightsAlgoDirect:ConvOclBwdWrW53,0.609975,0,miopenConvolutionBwdWeightsAlgoDirect,<unused>;miopenConvolutionBwdWeightsAlgoImplicitGEMM:ConvHipImplicitGemmV4R1WrW,1.01422,0,miopenConvolutionBwdWeightsAlgoImplicitGEMM,256x8x8x1x3x384x8x8x64xNCHWxFP32x0x1x1x1x1x1x1x0;miopenConvolutionBwdWeightsAlgoGEMM:GemmWrwUniversal,3.04728,294912,MIOpenGEMM,1_0_64_64_1152_1152_256_64
512-8-8-1x3-256-8-8-64-0x1-1x1-1x1-0-NCHW-FP32-F=miopenConvolutionFwdAlgoWinograd:ConvBinWinogradRxS,0.739427,0,miopenConvolutionFwdAlgoWinograd,<unused>;miopenConvolutionFwdAlgoImplicitGEMM:ConvHipImplicitGemmV4R1Fwd,1.43602,0,miopenConvolutionFwdAlgoImplicitGEMM,512x8x8x3x1x256x8x8x64xNCHWxFP32x1x0x1x1x1x1x1x1;miopenConvolutionFwdAlgoGEMM:GemmFwdRest,11.6078,393216,MIOpenGEMM,0_0_64_1536_64_64_256_1536
256-8-8-3x1-384-8-8-64-1x0-1x1-1x1-0-NCHW-FP32-B=miopenConvolutionBwdDataAlgoWinograd:ConvBinWinogradRxS,0.544072,0,miopenConvolutionBwdDataAlgoWinograd,<unused>;miopenConvolutionBwdDataAlgoImplicitGEMM:ConvHipImplicitGemmBwdDataV1R1,1.50528,0,miopenConvolutionBwdDataAlgoImplicitGEMM,256x8x8x1x3x384x8x8x64xNCHWxFP32x0x1x1x1x1x1x1x0;miopenConvolutionBwdDataAlgoGEMM:GemmBwdRest,11.8336,294912,MIOpenGEMM,0_1_64_1152_64_64_1152_256
256-8-8-3x1-512-8-8-64-1x0-1x1-1x1-0-NCHW-FP32-B=miopenConvolutionBwdDataAlgoWinograd:ConvBinWinogradRxS,0.584607,0,miopenConvolutionBwdDataAlgoWinograd,<unused>;miopenConvolutionBwdDataAlgoImplicitGEMM:ConvHipImplicitGemmBwdDataV1R1,0.826137,0,miopenConvolutionBwdDataAlgoImplicitGEMM,256x8x8x1x3x512x8x8x64xNCHWxFP32x0x1x1x1x1x1x1x0;miopenConvolutionBwdDataAlgoGEMM:GemmBwdRest,5.28114,393216,MIOpenGEMM,0_1_64_1536_64_64_1536_256
96-35-35-3x3-96-35-35-64-1x1-1x1-1x1-0-NCHW-FP32-F=miopenConvolutionFwdAlgoWinograd:ConvBinWinogradRxSf2x3,0.748818,0,miopenConvolutionFwdAlgoWinograd,<unused>
384-35-35-1x1-64-35-35-64-0x0-1x1-1x1-0-NCHW-FP32-F=miopenConvolutionFwdAlgoDirect:ConvAsm1x1U,0.777528,0,miopenConvolutionFwdAlgoDirect,<unused>;miopenConvolutionFwdAlgoWinograd:ConvBinWinogradRxSf3x2,1.39133,0,miopenConvolutionFwdAlgoWinograd,<unused>;miopenConvolutionFwdAlgoGEMM:GemmFwd1x1_0_1,3.52319,0,MIOpenGEMM,0_0_1225_384_1225_1225_64_384
384-8-8-3x1-256-8-8-64-1x0-1x1-1x1-0-NCHW-FP32-F=miopenConvolutionFwdAlgoWinograd:ConvBinWinogradRxSf2x3,0.502527,0,miopenConvolutionFwdAlgoWinograd,<unused>;miopenConvolutionFwdAlgoImplicitGEMM:ConvHipImplicitGemmV4R1Fwd,1.71349,0,miopenConvolutionFwdAlgoImplicitGEMM,384x8x8x1x3x256x8x8x64xNCHWxFP32x0x1x1x1x1x1x1x1;miopenConvolutionFwdAlgoGEMM:GemmFwdRest,61.9582,294912,MIOpenGEMM,0_0_64_1152_64_64_256_1152
32-147-147-3x3-64-147-147-64-1x1-1x1-1x1-0-NCHW-FP32-F=miopenConvolutionFwdAlgoWinograd:ConvBinWinograd3x3U,3.3485,0,miopenConvolutionFwdAlgoWinograd,<unused>
512-8-8-3x1-256-8-8-64-1x0-1x1-1x1-0-NCHW-FP32-F=miopenConvolutionFwdAlgoWinograd:ConvBinWinogradRxSf2x3,0.573116,0,miopenConvolutionFwdAlgoWinograd,<unused>;miopenConvolutionFwdAlgoImplicitGEMM:ConvHipImplicitGemmV4R1Fwd,4.15926,0,miopenConvolutionFwdAlgoImplicitGEMM,512x8x8x1x3x256x8x8x64xNCHWxFP32x0x1x1x1x1x1x1x1;miopenConvolutionFwdAlgoGEMM:GemmFwdRest,42.1474,393216,MIOpenGEMM,0_0_64_1536_64_64_256_1536
80-73-73-1x1-64-73-73-128-0x0-1x1-1x1-0-NCHW-FP32-B=miopenConvolutionBwdDataAlgoDirect:ConvAsm1x1U,1.32078,0,miopenConvolutionBwdDataAlgoDirect,<unused>;miopenConvolutionBwdDataAlgoWinograd:ConvBinWinogradRxSf3x2,2.76069,0,miopenConvolutionBwdDataAlgoWinograd,<unused>;miopenConvolutionBwdDataAlgoGEMM:GemmBwd1x1_stride1,5.70807,0,MIOpenGEMM,0_1_5329_64_5329_5329_64_80
384-17-17-3x3-384-35-35-64-0x0-2x2-1x1-0-NCHW-FP32-W=miopenConvolutionBwdWeightsAlgoImplicitGEMM:ConvHipImplicitGemmV4R1WrW,11.5849,0,miopenConvolutionBwdWeightsAlgoImplicitGEMM,384x17x17x3x3x384x35x35x64xNCHWxFP32x0x0x2x2x1x1x1x0;miopenConvolutionBwdWeightsAlgoGEMM:GemmWrwUniversal,17.9629,3995136,MIOpenGEMM,1_0_289_289_3456_3456_384_289;miopenConvolutionBwdWeightsAlgoDirect:ConvOclBwdWrW2NonTunable,72.9359,339738624,miopenConvolutionBwdWeightsAlgoDirect,<unused>
256-17-17-7x1-256-17-17-64-3x0-1x1-1x1-0-NCHW-FP32-F=miopenConvolutionFwdAlgoImplicitGEMM:ConvHipImplicitGemmV4R1Fwd,2.1726,0,miopenConvolutionFwdAlgoImplicitGEMM,256x17x17x1x7x256x17x17x64xNCHWxFP32x0x3x1x1x1x1x1x1;miopenConvolutionFwdAlgoWinograd:ConvBinWinogradRxSf3x2,2.2138,0,miopenConvolutionFwdAlgoWinograd,<unused>;miopenConvolutionFwdAlgoGEMM:GemmFwdRest,9.15818,2071552,MIOpenGEMM,0_0_289_1792_289_289_256_1792
64-147-147-3x3-32-147-147-64-1x1-1x1-1x1-0-NCHW-FP32-B=miopenConvolutionBwdDataAlgoWinograd:ConvBinWinogradRxS,3.50231,0,miopenConvolutionBwdDataAlgoWinograd,<unused>
384-35-35-3x3-384-17-17-64-0x0-2x2-1x1-0-NCHW-FP32-F=miopenConvolutionFwdAlgoWinograd:ConvBinWinogradRxSf2x3,11.6161,0,miopenConvolutionFwdAlgoWinograd,<unused>;miopenConvolutionFwdAlgoDirect:ConvOclDirectFwd,60.0669,0,miopenConvolutionFwdAlgoDirect,<unused>;miopenConvolutionFwdAlgoGEMM:GemmFwdRest,71.3272,3995136,MIOpenGEMM,0_0_289_3456_289_289_384_3456
32-149-149-3x3-32-147-147-64-0x0-1x1-1x1-0-NCHW-FP32-F=miopenConvolutionFwdAlgoWinograd:ConvBinWinogradRxS,1.83984,0,miopenConvolutionFwdAlgoWinograd,<unused>;miopenConvolutionFwdAlgoDirect:ConvOclDirectFwd,9.06969,0,miopenConvolutionFwdAlgoDirect,<unused>;miopenConvolutionFwdAlgoGEMM:GemmFwdRest,41.5698,24893568,MIOpenGEMM,0_0_21609_288_21609_21609_32_288
512-8-8-1x3-448-8-8-64-0x1-1x1-1x1-0-NCHW-FP32-W=miopenConvolutionBwdWeightsAlgoImplicitGEMM:ConvHipImplicitGemmV4R1WrW,1.31714,0,miopenConvolutionBwdWeightsAlgoImplicitGEMM,512x8x8x3x1x448x8x8x64xNCHWxFP32x1x0x1x1x1x1x1x0;miopenConvolutionBwdWeightsAlgoWinograd:ConvBinWinogradRxS,1.36417,0,miopenConvolutionBwdWeightsAlgoWinograd,512x8x8x3x1x448x8x8x64xNCHWxFP32x1x0x1x1x1x1x1x0;miopenConvolutionBwdWeightsAlgoDirect:ConvOclBwdWrW53,1.45598,0,miopenConvolutionBwdWeightsAlgoDirect,<unused>;miopenConvolutionBwdWeightsAlgoGEMM:GemmWrwUniversal,8.71996,344064,MIOpenGEMM,1_0_64_64_1344_1344_512_64
192-35-35-1x1-384-35-35-64-0x0-1x1-1x1-0-NCHW-FP32-W=miopenConvolutionBwdWeightsAlgoDirect:ConvAsmBwdWrW1x1,4.4703,0,miopenConvolutionBwdWeightsAlgoDirect,<unused>
512-8-8-1x3-448-8-8-64-0x1-1x1-1x1-0-NCHW-FP32-B=miopenConvolutionBwdDataAlgoWinograd:ConvBinWinogradRxSf2x3,0.828616,0,miopenConvolutionBwdDataAlgoWinograd,<unused>;miopenConvolutionBwdDataAlgoImplicitGEMM:ConvHipImplicitGemmBwdDataV1R1,1.46372,0,miopenConvolutionBwdDataAlgoImplicitGEMM,512x8x8x3x1x448x8x8x64xNCHWxFP32x1x0x1x1x1x1x1x0;miopenConvolutionBwdDataAlgoGEMM:GemmBwdRest,10.2096,344064,MIOpenGEMM,0_1_64_1344_64_64_1344_512
96-35-35-3x3-96-35-35-64-1x1-1x1-1x1-0-NCHW-FP32-W=miopenConvolutionBwdWeightsAlgoDirect:ConvAsmBwdWrW3x3,1.93352,0,miopenConvolutionBwdWeightsAlgoDirect,<unused>;miopenConvolutionBwdWeightsAlgoWinograd:ConvBinWinogradRxSf2x3,2.757,0,miopenConvolutionBwdWeightsAlgoWinograd,96x35x35x3x3x96x35x35x64xNCHWxFP32x1x1x1x1x1x1x1x0;miopenConvolutionBwdWeightsAlgoGEMM:GemmWrwUniversal,7.88066,4233600,MIOpenGEMM,1_0_1225_1225_864_864_96_1225
32-147-147-3x3-32-149-149-64-0x0-1x1-1x1-0-NCHW-FP32-B=miopenConvolutionBwdDataAlgoWinograd:ConvBinWinogradRxSf2x3,2.3067,0,miopenConvolutionBwdDataAlgoWinograd,<unused>;miopenConvolutionBwdDataAlgoDirect:ConvOclDirectFwd,13.4752,0,miopenConvolutionBwdDataAlgoDirect,<unused>;miopenConvolutionBwdDataAlgoImplicitGEMM:ConvHipImplicitGemmBwdDataV1R1,41.7692,0,miopenConvolutionBwdDataAlgoImplicitGEMM,32x147x147x3x3x32x149x149x64xNCHWxFP32x0x0x1x1x1x1x1x0;miopenConvolutionBwdDataAlgoGEMM:GemmBwdRest,44.5636,24893568,MIOpenGEMM,0_1_21609_288_21609_21609_288_32
192-35-35-1x1-384-35-35-64-0x0-1x1-1x1-0-NCHW-FP32-B=miopenConvolutionBwdDataAlgoDirect:ConvAsm1x1U,1.64422,0,miopenConvolutionBwdDataAlgoDirect,<unused>;miopenConvolutionBwdDataAlgoWinograd:ConvBinWinogradRxSf3x2,3.8055,0,miopenConvolutionBwdDataAlgoWinograd,<unused>;miopenConvolutionBwdDataAlgoGEMM:GemmBwd1x1_stride1,4.54457,0,MIOpenGEMM,0_1_1225_384_1225_1225_384_192
64-147-147-3x3-32-147-147-64-1x1-1x1-1x1-0-NCHW-FP32-W=miopenConvolutionBwdWeightsAlgoDirect:ConvAsmBwdWrW3x3,6.87408,0,miopenConvolutionBwdWeightsAlgoDirect,<unused>;miopenConvolutionBwdWeightsAlgoWinograd:ConvBinWinogradRxSf2x3,48.2956,0,miopenConvolutionBwdWeightsAlgoWinograd,64x147x147x3x3x32x147x147x64xNCHWxFP32x1x1x1x1x1x1x1x0;miopenConvolutionBwdWeightsAlgoGEMM:GemmWrwUniversal,117.143,24893568,MIOpenGEMM,1_0_21609_21609_288_288_64_21609
256-64-64-1x1-1024-64-64-2-0x0-1x1-1x1-0-NCHW-FP32-B=miopenConvolutionBwdDataAlgoGEMM:GemmBwd1x1_stride1,1.17445,0,MIOpenGEMM,0_1_4096_1024_4096_4096_1024_256;miopenConvolutionBwdDataAlgoImplicitGEMM:ConvHipImplicitGemmBwdDataV1R1,1.222,0,miopenConvolutionBwdDataAlgoImplicitGEMM,256x64x64x1x1x1024x64x64x2xNCHWxFP32x0x0x1x1x1x1x1x0;miopenConvolutionBwdDataAlgoDirect:ConvOclDirectFwd1x1,1.40816,0,miopenConvolutionBwdDataAlgoDirect,<unused>;miopenConvolutionBwdDataAlgoWinograd:ConvBinWinogradRxSf3x2,1.61188,0,miopenConvolutionBwdDataAlgoWinograd,<unused>
64-35-35-3x3-96-35-35-64-1x1-1x1-1x1-0-NCHW-FP32-F=miopenConvolutionFwdAlgoWinograd:ConvBinWinogradRxSf2x3,0.520627,0,miopenConvolutionFwdAlgoWinograd,<unused>
64-73-73-7x1-64-73-73-64-3x0-1x1-1x1-0-NCHW-FP32-F=miopenConvolutionFwdAlgoImplicitGEMM:ConvHipImplicitGemmV4R1Fwd,2.44167,0,miopenConvolutionFwdAlgoImplicitGEMM,64x73x73x1x7x64x73x73x64xNCHWxFP32x0x3x1x1x1x1x1x1;miopenConvolutionFwdAlgoWinograd:ConvBinWinogradRxSf3x2,2.90182,0,miopenConvolutionFwdAlgoWinograd,<unused>;miopenConvolutionFwdAlgoGEMM:GemmFwdRest,11.7764,9549568,MIOpenGEMM,0_0_5329_448_5329_5329_64_448
1024-64-64-1x1-256-64-64-2-0x0-1x1-1x1-0-NCHW-FP32-F=miopenConvolutionFwdAlgoWinograd:ConvBinWinogradRxSf3x2,1.11215,0,miopenConvolutionFwdAlgoWinograd,<unused>;miopenConvolutionFwdAlgoGEMM:GemmFwd1x1_0_1,1.65673,0,MIOpenGEMM,0_0_4096_1024_4096_4096_256_1024;miopenConvolutionFwdAlgoDirect:ConvOclDirectFwd1x1,2.27971,0,miopenConvolutionFwdAlgoDirect,<unused>;miopenConvolutionFwdAlgoImplicitGEMM:ConvHipImplicitGemmV4R4Fwd,2.46088,0,miopenConvolutionFwdAlgoImplicitGEMM,1024x64x64x1x1x256x64x64x2xNCHWxFP32x0x0x1x1x1x1x1x1
512-128-128-1x1-128-128-128-2-0x0-1x1-1x1-0-NCHW-FP32-W=miopenConvolutionBwdWeightsAlgoDirect:ConvAsmBwdWrW1x1,1.8662,0,miopenConvolutionBwdWeightsAlgoDirect,<unused>
256-8-8-3x1-512-8-8-64-1x0-1x1-1x1-0-NCHW-FP32-W=miopenConvolutionBwdWeightsAlgoDirect:ConvOclBwdWrW53,0.58816,0,miopenConvolutionBwdWeightsAlgoDirect,<unused>;miopenConvolutionBwdWeightsAlgoWinograd:ConvBinWinogradRxS,0.615383,0,miopenConvolutionBwdWeightsAlgoWinograd,256x8x8x1x3x512x8x8x64xNCHWxFP32x0x1x1x1x1x1x1x0;miopenConvolutionBwdWeightsAlgoImplicitGEMM:ConvHipImplicitGemmV4R1WrW,0.643037,0,miopenConvolutionBwdWeightsAlgoImplicitGEMM,256x8x8x1x3x512x8x8x64xNCHWxFP32x0x1x1x1x1x1x1x0;miopenConvolutionBwdWeightsAlgoGEMM:GemmWrwUniversal,1.72629,393216,MIOpenGEMM,1_0_64_64_1536_1536_256_64
512-128-128-1x1-128-128-128-2-0x0-1x1-1x1-0-NCHW-FP32-B=miopenConvolutionBwdDataAlgoGEMM:GemmBwd1x1_stride1,1.18865,0,MIOpenGEMM,0_1_16384_128_16384_16384_128_512;miopenConvolutionBwdDataAlgoWinograd:ConvBinWinogradRxSf3x2,1.31491,0,miopenConvolutionBwdDataAlgoWinograd,<unused>;miopenConvolutionBwdDataAlgoDirect:ConvOclDirectFwd1x1,3.83448,0,miopenConvolutionBwdDataAlgoDirect,<unused>;miopenConvolutionBwdDataAlgoImplicitGEMM:ConvHipImplicitGemmBwdDataV1R1,5.40087,0,miopenConvolutionBwdDataAlgoImplicitGEMM,512x128x128x1x1x128x128x128x2xNCHWxFP32x0x0x1x1x1x1x1x0
256-17-17-3x3-224-35-35-64-0x0-2x2-1x1-0-NCHW-FP32-W=miopenConvolutionBwdWeightsAlgoGEMM:GemmWrwUniversal,26.027,2330496,MIOpenGEMM,1_0_289_289_2016_2016_256_289;miopenConvolutionBwdWeightsAlgoDirect:ConvOclBwdWrW2NonTunable,34.1674,132120576,miopenConvolutionBwdWeightsAlgoDirect,<unused>
32-147-147-3x3-32-149-149-64-0x0-1x1-1x1-0-NCHW-FP32-W=miopenConvolutionBwdWeightsAlgoDirect:ConvOclBwdWrW2NonTunable,18.2978,2359296,miopenConvolutionBwdWeightsAlgoDirect,<unused>;miopenConvolutionBwdWeightsAlgoGEMM:GemmWrwUniversal,52.5913,24893568,MIOpenGEMM,1_0_21609_21609_288_288_32_21609;miopenConvolutionBwdWeightsAlgoWinograd:ConvBinWinogradRxSf2x3,65.5839,0,miopenConvolutionBwdWeightsAlgoWinograd,32x147x147x3x3x32x149x149x64xNCHWxFP32x0x0x1x1x1x1x1x0
256-128-128-3x3-512-128-128-2-1x1-1x1-1x1-0-NCHW-FP32-F=miopenConvolutionFwdAlgoWinograd:ConvBinWinogradRxS,6.68787,0,miopenConvolutionFwdAlgoWinograd,<unused>
64-73-73-1x7-64-73-73-64-0x3-1x1-1x1-0-NCHW-FP32-B=miopenConvolutionBwdDataAlgoWinograd:ConvBinWinogradRxSf3x2,4.09616,0,miopenConvolutionBwdDataAlgoWinograd,<unused>;miopenConvolutionBwdDataAlgoImplicitGEMM:ConvHipImplicitGemmBwdDataV1R1,16.4201,0,miopenConvolutionBwdDataAlgoImplicitGEMM,64x73x73x7x1x64x73x73x64xNCHWxFP32x3x0x1x1x1x1x1x0;miopenConvolutionBwdDataAlgoGEMM:GemmBwdRest,29.2472,9549568,MIOpenGEMM,0_1_5329_448_5329_5329_448_64
128-128-128-1x1-512-128-128-2-0x0-1x1-1x1-0-NCHW-FP32-F=miopenConvolutionFwdAlgoImplicitGEMM:ConvHipImplicitGemmV4R4Fwd,0.889157,0,miopenConvolutionFwdAlgoImplicitGEMM,128x128x128x1x1x512x128x128x2xNCHWxFP32x0x0x1x1x1x1x1x1;miopenConvolutionFwdAlgoDirect:ConvOclDirectFwd1x1,1.23697,0,miopenConvolutionFwdAlgoDirect,<unused>;miopenConvolutionFwdAlgoGEMM:GemmFwd1x1_0_1,1.37755,0,MIOpenGEMM,0_0_16384_128_16384_16384_512_128;miopenConvolutionFwdAlgoWinograd:ConvBinWinogradRxSf3x2,1.66203,0,miopenConvolutionFwdAlgoWinograd,<unused>
256-256-256-1x1-256-256-256-2-0x0-1x1-1x1-0-NCHW-FP32-B=miopenConvolutionBwdDataAlgoGEMM:GemmBwd1x1_stride1,4.98281,0,MIOpenGEMM,0_1_65536_256_65536_65536_256_256;miopenConvolutionBwdDataAlgoWinograd:ConvBinWinogradRxSf3x2,8.31514,0,miopenConvolutionBwdDataAlgoWinograd,<unused>;miopenConvolutionBwdDataAlgoDirect:ConvOclDirectFwd1x1,13.2891,0,miopenConvolutionBwdDataAlgoDirect,<unused>;miopenConvolutionBwdDataAlgoImplicitGEMM:ConvHipImplicitGemmBwdDataV1R1,24.1813,0,miopenConvolutionBwdDataAlgoImplicitGEMM,256x256x256x1x1x256x256x256x2xNCHWxFP32x0x0x1x1x1x1x1x0
64-73-73-1x7-64-73-73-64-0x3-1x1-1x1-0-NCHW-FP32-F=miopenConvolutionFwdAlgoImplicitGEMM:ConvHipImplicitGemmV4R1Fwd,3.66995,0,miopenConvolutionFwdAlgoImplicitGEMM,64x73x73x7x1x64x73x73x64xNCHWxFP32x3x0x1x1x1x1x1x1;miopenConvolutionFwdAlgoWinograd:ConvBinWinogradRxSf3x2,4.08185,0,miopenConvolutionFwdAlgoWinograd,<unused>;miopenConvolutionFwdAlgoGEMM:GemmFwdRest,17.762,9549568,MIOpenGEMM,0_0_5329_448_5329_5329_64_448
256-64-64-1x1-1024-64-64-2-0x0-1x1-1x1-0-NCHW-FP32-F=miopenConvolutionFwdAlgoGEMM:GemmFwd1x1_0_1,0.833103,0,MIOpenGEMM,0_0_4096_256_4096_4096_1024_256;miopenConvolutionFwdAlgoImplicitGEMM:ConvHipImplicitGemmV4R4Fwd,1.07888,0,miopenConvolutionFwdAlgoImplicitGEMM,256x64x64x1x1x1024x64x64x2xNCHWxFP32x0x0x1x1x1x1x1x1;miopenConvolutionFwdAlgoWinograd:ConvBinWinogradRxSf3x2,1.56365,0,miopenConvolutionFwdAlgoWinograd,<unused>;miopenConvolutionFwdAlgoDirect:ConvOclDirectFwd1x1,1.94538,0,miopenConvolutionFwdAlgoDirect,<unused>
256-128-128-3x3-256-128-128-2-1x1-1x1-1x1-0-NCHW-FP32-W=miopenConvolutionBwdWeightsAlgoWinograd:ConvBinWinogradRxS,7.66371,0,miopenConvolutionBwdWeightsAlgoWinograd,256x128x128x3x3x256x128x128x2xNCHWxFP32x1x1x1x1x1x1x1x0;miopenConvolutionBwdWeightsAlgoImplicitGEMM:ConvHipImplicitGemmV4R1WrW,9.81904,0,miopenConvolutionBwdWeightsAlgoImplicitGEMM,256x128x128x3x3x256x128x128x2xNCHWxFP32x1x1x1x1x1x1x1x0;miopenConvolutionBwdWeightsAlgoDirect:ConvOclBwdWrW53,11.3743,0,miopenConvolutionBwdWeightsAlgoDirect,<unused>;miopenConvolutionBwdWeightsAlgoGEMM:GemmWrwUniversal,12.6195,150994944,MIOpenGEMM,1_0_16384_16384_2304_2304_256_16384
128-128-128-3x3-128-128-128-2-1x1-1x1-1x1-0-NCHW-FP32-W=miopenConvolutionBwdWeightsAlgoDirect:ConvAsmBwdWrW3x3,1.18304,0,miopenConvolutionBwdWeightsAlgoDirect,<unused>;miopenConvolutionBwdWeightsAlgoWinograd:ConvBinWinogradRxSf2x3,2.94985,0,miopenConvolutionBwdWeightsAlgoWinograd,128x128x128x3x3x128x128x128x2xNCHWxFP32x1x1x1x1x1x1x1x0;miopenConvolutionBwdWeightsAlgoGEMM:GemmWrwUniversal,3.97486,75497472,MIOpenGEMM,1_0_16384_16384_1152_1152_128_16384;miopenConvolutionBwdWeightsAlgoImplicitGEMM:ConvHipImplicitGemmV4R1WrW,5.19124,0,miopenConvolutionBwdWeightsAlgoImplicitGEMM,128x128x128x3x3x128x128x128x2xNCHWxFP32x1x1x1x1x1x1x1x0
256-128-128-3x3-256-128-128-2-1x1-1x1-1x1-0-NCHW-FP32-B=miopenConvolutionBwdDataAlgoWinograd:ConvBinWinograd3x3U,2.05031,0,miopenConvolutionBwdDataAlgoWinograd,<unused>
320-17-17-3x3-320-8-8-64-0x0-2x2-1x1-0-NCHW-FP32-F=miopenConvolutionFwdAlgoWinograd:ConvBinWinogradRxS,1.96863,0,miopenConvolutionFwdAlgoWinograd,<unused>;miopenConvolutionFwdAlgoDirect:ConvOclDirectFwd,5.84619,0,miopenConvolutionFwdAlgoDirect,<unused>;miopenConvolutionFwdAlgoGEMM:GemmFwdRest,8.1009,737280,MIOpenGEMM,0_0_64_2880_64_64_320_2880
256-128-128-3x3-256-128-128-2-1x1-1x1-1x1-0-NCHW-FP32-F=miopenConvolutionFwdAlgoWinograd:ConvBinWinograd3x3U,1.91749,0,miopenConvolutionFwdAlgoWinograd,<unused>
128-128-128-3x3-128-128-128-2-1x1-1x1-1x1-0-NCHW-FP32-B=miopenConvolutionBwdDataAlgoWinograd:ConvBinWinogradRxS,0.559797,0,miopenConvolutionBwdDataAlgoWinograd,<unused>
64-512-512-7x7-3-1030-1030-2-0x0-2x2-1x1-0-NCHW-FP32-B=miopenConvolutionBwdDataAlgoDirect:ConvOclDirectFwd,9.81511,0,miopenConvolutionBwdDataAlgoDirect,<unused>;miopenConvolutionBwdDataAlgoWinograd:ConvBinWinogradRxSf2x3,14.7324,0,miopenConvolutionBwdDataAlgoWinograd,<unused>;miopenConvolutionBwdDataAlgoGEMM:GemmBwdRest,18.1461,154140672,MIOpenGEMM,0_1_262144_147_262144_262144_147_64
256-256-256-1x1-256-256-256-2-0x0-1x1-1x1-0-NCHW-FP32-F=miopenConvolutionFwdAlgoImplicitGEMM:ConvHipImplicitGemmV4R4Fwd,3.97346,0,miopenConvolutionFwdAlgoImplicitGEMM,256x256x256x1x1x256x256x256x2xNCHWxFP32x0x0x1x1x1x1x1x1;miopenConvolutionFwdAlgoGEMM:GemmFwd1x1_0_1,4.83284,0,MIOpenGEMM,0_0_65536_256_65536_65536_256_256;miopenConvolutionFwdAlgoDirect:ConvOclDirectFwd1x1,7.18316,0,miopenConvolutionFwdAlgoDirect,<unused>;miopenConvolutionFwdAlgoWinograd:ConvBinWinogradRxSf3x2,7.85665,0,miopenConvolutionFwdAlgoWinograd,<unused>
96-71-71-3x3-64-73-73-64-0x0-1x1-1x1-0-NCHW-FP32-B=miopenConvolutionBwdDataAlgoWinograd:ConvBinWinogradRxS,2.86187,0,miopenConvolutionBwdDataAlgoWinograd,<unused>;miopenConvolutionBwdDataAlgoDirect:ConvOclDirectFwd,17.5442,0,miopenConvolutionBwdDataAlgoDirect,<unused>;miopenConvolutionBwdDataAlgoGEMM:GemmBwdRest,17.9356,11614464,MIOpenGEMM,0_1_5041_576_5041_5041_576_96;miopenConvolutionBwdDataAlgoImplicitGEMM:ConvHipImplicitGemmBwdDataV1R1,20.6401,0,miopenConvolutionBwdDataAlgoImplicitGEMM,96x71x71x3x3x64x73x73x64xNCHWxFP32x0x0x1x1x1x1x1x0
128-128-128-3x3-128-128-128-2-1x1-1x1-1x1-0-NCHW-FP32-F=miopenConvolutionFwdAlgoWinograd:ConvBinWinograd3x3U,0.497707,0,miopenConvolutionFwdAlgoWinograd,<unused>
512-32-32-3x3-256-32-32-2-1x1-1x1-1x1-0-NCHW-FP32-W=miopenConvolutionBwdWeightsAlgoDirect:ConvAsmBwdWrW3x3,0.623967,0,miopenConvolutionBwdWeightsAlgoDirect,<unused>;miopenConvolutionBwdWeightsAlgoWinograd:ConvBinWinogradRxSf2x3,1.70672,0,miopenConvolutionBwdWeightsAlgoWinograd,512x32x32x3x3x256x32x32x2xNCHWxFP32x1x1x1x1x1x1x1x0;miopenConvolutionBwdWeightsAlgoGEMM:GemmWrwUniversal,3.83073,9437184,MIOpenGEMM,1_0_1024_1024_2304_2304_512_1024;miopenConvolutionBwdWeightsAlgoImplicitGEMM:ConvHipImplicitGemmV4R1WrW,4.7814,0,miopenConvolutionBwdWeightsAlgoImplicitGEMM,512x32x32x3x3x256x32x32x2xNCHWxFP32x1x1x1x1x1x1x1x0
96-71-71-3x3-64-73-73-64-0x0-1x1-1x1-0-NCHW-FP32-W=miopenConvolutionBwdWeightsAlgoWinograd:ConvBinWinogradRxSf2x3,12.572,0,miopenConvolutionBwdWeightsAlgoWinograd,96x71x71x3x3x64x73x73x64xNCHWxFP32x0x0x1x1x1x1x1x0
64-73-73-7x1-64-73-73-64-3x0-1x1-1x1-0-NCHW-FP32-W=miopenConvolutionBwdWeightsAlgoWinograd:ConvBinWinogradRxSf2x3,10.7154,0,miopenConvolutionBwdWeightsAlgoWinograd,64x73x73x1x7x64x73x73x64xNCHWxFP32x0x3x1x1x1x1x1x0;miopenConvolutionBwdWeightsAlgoGEMM:GemmWrwUniversal,13.6041,9549568,MIOpenGEMM,1_0_5329_5329_448_448_64_5329;miopenConvolutionBwdWeightsAlgoDirect:ConvOclBwdWrW53,35.9958,7340032,miopenConvolutionBwdWeightsAlgoDirect,<unused>;miopenConvolutionBwdWeightsAlgoImplicitGEMM:ConvHipImplicitGemmV4R1WrW,49.3267,0,miopenConvolutionBwdWeightsAlgoImplicitGEMM,64x73x73x1x7x64x73x73x64xNCHWxFP32x0x3x1x1x1x1x1x0
3-1030-1030-7x7-64-512-512-2-0x0-2x2-1x1-0-NCHW-FP32-F=miopenConvolutionFwdAlgoWinograd:ConvBinWinogradRxSf2x3,2.21805,0,miopenConvolutionFwdAlgoWinograd,<unused>;miopenConvolutionFwdAlgoDirect:ConvOclDirectFwdGen,2.52041,0,miopenConvolutionFwdAlgoDirect,<unused>;miopenConvolutionFwdAlgoGEMM:GemmFwdRest,6.28745,154140672,MIOpenGEMM,0_0_262144_147_262144_262144_64_147
512-32-32-3x3-256-32-32-2-1x1-1x1-1x1-0-NCHW-FP32-B=miopenConvolutionBwdDataAlgoWinograd:ConvBinWinograd3x3U,0.237522,0,miopenConvolutionBwdDataAlgoWinograd,<unused>
128-128-128-1x1-256-256-256-2-0x0-2x2-1x1-0-NCHW-FP32-W=miopenConvolutionBwdWeightsAlgoDirect:ConvAsmBwdWrW1x1,1.19796,33554432,miopenConvolutionBwdWeightsAlgoDirect,<unused>;miopenConvolutionBwdWeightsAlgoGEMM:GemmWrwUniversal,2.00075,16777216,MIOpenGEMM,1_0_16384_16384_256_256_128_16384;miopenConvolutionBwdWeightsAlgoImplicitGEMM:ConvHipImplicitGemmV4R1WrW,11.0034,0,miopenConvolutionBwdWeightsAlgoImplicitGEMM,128x128x128x1x1x256x256x256x2xNCHWxFP32x0x0x2x2x1x1x1x0
512-16-16-1x1-12-16-16-2-0x0-1x1-1x1-0-NCHW-FP32-F=miopenConvolutionFwdAlgoDirect:ConvAsm1x1U,0.058131,0,miopenConvolutionFwdAlgoDirect,<unused>;miopenConvolutionFwdAlgoGEMM:GemmFwd1x1_0_1,0.073939,0,MIOpenGEMM,0_0_256_512_256_256_12_512;miopenConvolutionFwdAlgoWinograd:ConvBinWinogradRxS,0.193946,0,miopenConvolutionFwdAlgoWinograd,<unused>
512-32-32-1x1-2048-32-32-2-0x0-1x1-1x1-0-NCHW-FP32-W=miopenConvolutionBwdWeightsAlgoGEMM:GemmWrw1x1_stride1,1.57061,0,MIOpenGEMM,1_0_1024_1024_2048_2048_512_1024;miopenConvolutionBwdWeightsAlgoWinograd:ConvBinWinogradRxSf2x3,11.6503,0,miopenConvolutionBwdWeightsAlgoWinograd,512x32x32x1x1x2048x32x32x2xNCHWxFP32x0x0x1x1x1x1x1x0
512-32-32-1x1-1024-64-64-2-0x0-2x2-1x1-0-NCHW-FP32-W=miopenConvolutionBwdWeightsAlgoDirect:ConvAsmBwdWrW1x1,1.121,8388608,miopenConvolutionBwdWeightsAlgoDirect,<unused>;miopenConvolutionBwdWeightsAlgoImplicitGEMM:ConvHipImplicitGemmV4R1WrW,1.43203,0,miopenConvolutionBwdWeightsAlgoImplicitGEMM,512x32x32x1x1x1024x64x64x2xNCHWxFP32x0x0x2x2x1x1x1x0;miopenConvolutionBwdWeightsAlgoGEMM:GemmWrwUniversal,1.43904,4194304,MIOpenGEMM,1_0_1024_1024_1024_1024_512_1024
256-32-32-3x3-512-32-32-2-1x1-1x1-1x1-0-NCHW-FP32-F=miopenConvolutionFwdAlgoWinograd:ConvBinWinogradRxS,0.255627,0,miopenConvolutionFwdAlgoWinograd,<unused>
6-256-256-1x1-512-256-256-2-0x0-1x1-1x1-0-NCHW-FP32-B=miopenConvolutionBwdDataAlgoGEMM:GemmBwd1x1_stride1,5.42996,0,MIOpenGEMM,0_1_65536_512_65536_65536_512_6;miopenConvolutionBwdDataAlgoDirect:ConvOclDirectFwd1x1,14.2009,0,miopenConvolutionBwdDataAlgoDirect,<unused>;miopenConvolutionBwdDataAlgoWinograd:ConvBinWinogradRxSf2x3,19.353,0,miopenConvolutionBwdDataAlgoWinograd,<unused>
128-128-128-1x1-512-128-128-2-0x0-1x1-1x1-0-NCHW-FP32-W=miopenConvolutionBwdWeightsAlgoDirect:ConvAsmBwdWrW1x1,2.13936,0,miopenConvolutionBwdWeightsAlgoDirect,<unused>
6-128-128-1x1-512-128-128-2-0x0-1x1-1x1-0-NCHW-FP32-W=miopenConvolutionBwdWeightsAlgoDirect:ConvAsmBwdWrW1x1,0.849073,0,miopenConvolutionBwdWeightsAlgoDirect,<unused>;miopenConvolutionBwdWeightsAlgoWinograd:ConvBinWinogradRxSf2x3,2.37794,0,miopenConvolutionBwdWeightsAlgoWinograd,6x128x128x1x1x512x128x128x2xNCHWxFP32x0x0x1x1x1x1x1x0;miopenConvolutionBwdWeightsAlgoGEMM:GemmWrw1x1_stride1,2.45858,0,MIOpenGEMM,1_0_16384_16384_512_512_6_16384
512-64-64-3x3-256-64-64-2-1x1-1x1-1x1-0-NCHW-FP32-W=miopenConvolutionBwdWeightsAlgoDirect:ConvAsmBwdWrW3x3,3.07142,0,miopenConvolutionBwdWeightsAlgoDirect,<unused>;miopenConvolutionBwdWeightsAlgoImplicitGEMM:ConvHipImplicitGemmV4R1WrW,5.02297,0,miopenConvolutionBwdWeightsAlgoImplicitGEMM,512x64x64x3x3x256x64x64x2xNCHWxFP32x1x1x1x1x1x1x1x0;miopenConvolutionBwdWeightsAlgoWinograd:ConvBinWinogradRxSf2x3,6.44466,0,miopenConvolutionBwdWeightsAlgoWinograd,512x64x64x3x3x256x64x64x2xNCHWxFP32x1x1x1x1x1x1x1x0;miopenConvolutionBwdWeightsAlgoGEMM:GemmWrwUniversal,7.36953,37748736,MIOpenGEMM,1_0_4096_4096_2304_2304_512_4096
128-128-128-1x1-256-256-256-2-0x0-2x2-1x1-0-NCHW-FP32-B=miopenConvolutionBwdDataAlgoDirect:ConvOclDirectFwd1x1,1.69313,0,miopenConvolutionBwdDataAlgoDirect,<unused>;miopenConvolutionBwdDataAlgoGEMM:GemmBwd1x1_stride2,2.27111,50331648,MIOpenGEMM,0_1_32768_256_32768_32768_256_128;miopenConvolutionBwdDataAlgoImplicitGEMM:ConvHipImplicitGemmBwdDataV1R1,2.81472,0,miopenConvolutionBwdDataAlgoImplicitGEMM,128x128x128x1x1x256x256x256x2xNCHWxFP32x0x0x2x2x1x1x1x0;miopenConvolutionBwdDataAlgoWinograd:ConvBinWinogradRxSf2x3,3.70777,0,miopenConvolutionBwdDataAlgoWinograd,<unused>
64-73-73-1x7-64-73-73-64-0x3-1x1-1x1-0-NCHW-FP32-W=miopenConvolutionBwdWeightsAlgoGEMM:GemmWrwUniversal,8.83037,9549568,MIOpenGEMM,1_0_5329_5329_448_448_64_5329;miopenConvolutionBwdWeightsAlgoDirect:ConvOclBwdWrW2<1>,10.922,7340032,miopenConvolutionBwdWeightsAlgoDirect,<unused>;miopenConvolutionBwdWeightsAlgoWinograd:ConvBinWinogradRxSf2x3,12.572,0,miopenConvolutionBwdWeightsAlgoWinograd,64x73x73x7x1x64x73x73x64xNCHWxFP32x3x0x1x1x1x1x1x0;miopenConvolutionBwdWeightsAlgoImplicitGEMM:ConvHipImplicitGemmV4R1WrW,51.8383,0,miopenConvolutionBwdWeightsAlgoImplicitGEMM,64x73x73x7x1x64x73x73x64xNCHWxFP32x3x0x1x1x1x1x1x0
6-128-128-1x1-512-128-128-2-0x0-1x1-1x1-0-NCHW-FP32-B=miopenConvolutionBwdDataAlgoDirect:ConvOclDirectFwd1x1,0.259142,0,miopenConvolutionBwdDataAlgoDirect,<unused>;miopenConvolutionBwdDataAlgoGEMM:GemmBwd1x1_stride1,0.35759,0,MIOpenGEMM,0_1_16384_512_16384_16384_512_6;miopenConvolutionBwdDataAlgoWinograd:ConvBinWinogradRxSf2x3,0.48199,0,miopenConvolutionBwdDataAlgoWinograd,<unused>
512-256-256-1x1-6-256-256-2-0x0-1x1-1x1-0-NCHW-FP32-F=miopenConvolutionFwdAlgoDirect:ConvOclDirectFwd1x1,0.712065,0,miopenConvolutionFwdAlgoDirect,<unused>;miopenConvolutionFwdAlgoWinograd:ConvBinWinogradRxSf3x2,1.58765,0,miopenConvolutionFwdAlgoWinograd,<unused>;miopenConvolutionFwdAlgoGEMM:GemmFwd1x1_0_1,17.4382,0,MIOpenGEMM,0_0_65536_512_65536_65536_6_512
512-64-64-3x3-256-64-64-2-1x1-1x1-1x1-0-NCHW-FP32-B=miopenConvolutionBwdDataAlgoWinograd:ConvBinWinogradRxS,1.33903,0,miopenConvolutionBwdDataAlgoWinograd,<unused>
512-32-32-1x1-1024-64-64-2-0x0-2x2-1x1-0-NCHW-FP32-B=miopenConvolutionBwdDataAlgoDirect:ConvOclDirectFwd1x1,0.594735,0,miopenConvolutionBwdDataAlgoDirect,<unused>;miopenConvolutionBwdDataAlgoImplicitGEMM:ConvHipImplicitGemmBwdDataV1R1,0.748647,0,miopenConvolutionBwdDataAlgoImplicitGEMM,512x32x32x1x1x1024x64x64x2xNCHWxFP32x0x0x2x2x1x1x1x0;miopenConvolutionBwdDataAlgoGEMM:GemmBwd1x1_stride2,1.11681,12582912,MIOpenGEMM,0_1_2048_1024_2048_2048_1024_512;miopenConvolutionBwdDataAlgoWinograd:ConvBinWinogradRxSf2x3,3.33872,0,miopenConvolutionBwdDataAlgoWinograd,<unused>
512-32-32-1x1-2048-32-32-2-0x0-1x1-1x1-0-NCHW-FP32-B=miopenConvolutionBwdDataAlgoDirect:ConvAsm1x1U,0.731964,0,miopenConvolutionBwdDataAlgoDirect,<unused>;miopenConvolutionBwdDataAlgoWinograd:ConvBinWinogradRxSf3x2,1.23703,0,miopenConvolutionBwdDataAlgoWinograd,<unused>;miopenConvolutionBwdDataAlgoGEMM:GemmBwd1x1_stride1,1.53374,0,MIOpenGEMM,0_1_1024_2048_1024_1024_2048_512;miopenConvolutionBwdDataAlgoImplicitGEMM:ConvHipImplicitGemmBwdDataV1R1,2.49474,0,miopenConvolutionBwdDataAlgoImplicitGEMM,512x32x32x1x1x2048x32x32x2xNCHWxFP32x0x0x1x1x1x1x1x0
256-64-64-3x3-512-64-64-2-1x1-1x1-1x1-0-NCHW-FP32-F=miopenConvolutionFwdAlgoWinograd:ConvBinWinograd3x3U,1.42601,0,miopenConvolutionFwdAlgoWinograd,<unused>
12-256-256-1x1-512-256-256-2-0x0-1x1-1x1-0-NCHW-FP32-W=miopenConvolutionBwdWeightsAlgoGEMM:GemmWrw1x1_stride1,2.80257,0,MIOpenGEMM,1_0_65536_65536_512_512_12_65536;miopenConvolutionBwdWeightsAlgoDirect:ConvOclBwdWrW53,9.91267,49152,miopenConvolutionBwdWeightsAlgoDirect,<unused>;miopenConvolutionBwdWeightsAlgoWinograd:ConvBinWinogradRxSf2x3,12.2769,0,miopenConvolutionBwdWeightsAlgoWinograd,12x256x256x1x1x512x256x256x2xNCHWxFP32x0x0x1x1x1x1x1x0
256-256-256-1x1-128-128-128-2-0x0-2x2-1x1-0-NCHW-FP32-F=miopenConvolutionFwdAlgoImplicitGEMM:ConvHipImplicitGemmV4R4Fwd,2.11015,0,miopenConvolutionFwdAlgoImplicitGEMM,256x256x256x1x1x128x128x128x2xNCHWxFP32x0x0x2x2x1x1x1x1;miopenConvolutionFwdAlgoGEMM:GemmFwd1x1_0_2,2.11286,50331648,MIOpenGEMM,0_0_32768_256_32768_32768_128_256;miopenConvolutionFwdAlgoWinograd:ConvBinWinogradRxSf2x3,4.92367,0,miopenConvolutionFwdAlgoWinograd,<unused>;miopenConvolutionFwdAlgoDirect:ConvOclDirectFwd1x1,6.30297,0,miopenConvolutionFwdAlgoDirect,<unused>
512-128-128-1x1-6-128-128-2-0x0-1x1-1x1-0-NCHW-FP32-F=miopenConvolutionFwdAlgoDirect:ConvOclDirectFwd1x1,0.326428,0,miopenConvolutionFwdAlgoDirect,<unused>;miopenConvolutionFwdAlgoWinograd:ConvBinWinogradRxSf3x2,0.414762,0,miopenConvolutionFwdAlgoWinograd,<unused>;miopenConvolutionFwdAlgoGEMM:GemmFwd1x1_0_1,4.85867,0,MIOpenGEMM,0_0_16384_512_16384_16384_6_512
256-32-32-3x3-256-32-32-2-1x1-1x1-1x1-0-NCHW-FP32-W=miopenConvolutionBwdWeightsAlgoDirect:ConvAsmBwdWrW3x3,0.44429,0,miopenConvolutionBwdWeightsAlgoDirect,<unused>;miopenConvolutionBwdWeightsAlgoImplicitGEMM:ConvHipImplicitGemmV4R1WrW,0.951788,0,miopenConvolutionBwdWeightsAlgoImplicitGEMM,256x32x32x3x3x256x32x32x2xNCHWxFP32x1x1x1x1x1x1x1x0;miopenConvolutionBwdWeightsAlgoGEMM:GemmWrwUniversal,1.10135,9437184,MIOpenGEMM,1_0_1024_1024_2304_2304_256_1024;miopenConvolutionBwdWeightsAlgoWinograd:ConvBinWinogradRxSf2x3,1.63665,0,miopenConvolutionBwdWeightsAlgoWinograd,256x32x32x3x3x256x32x32x2xNCHWxFP32x1x1x1x1x1x1x1x0
1024-64-64-1x1-512-32-32-2-0x0-2x2-1x1-0-NCHW-FP32-F=miopenConvolutionFwdAlgoGEMM:GemmFwd1x1_0_2,0.985318,12582912,MIOpenGEMM,0_0_2048_1024_2048_2048_512_1024;miopenConvolutionFwdAlgoImplicitGEMM:ConvHipImplicitGemmV4R4Fwd,1.09734,0,miopenConvolutionFwdAlgoImplicitGEMM,1024x64x64x1x1x512x32x32x2xNCHWxFP32x0x0x2x2x1x1x1x1;miopenConvolutionFwdAlgoDirect:ConvOclDirectFwd1x1,1.95868,0,miopenConvolutionFwdAlgoDirect,<unused>;miopenConvolutionFwdAlgoWinograd:ConvBinWinogradRxSf2x3,2.72895,0,miopenConvolutionFwdAlgoWinograd,<unused>
128-128-128-1x1-512-128-128-2-0x0-1x1-1x1-0-NCHW-FP32-B=miopenConvolutionBwdDataAlgoImplicitGEMM:ConvHipImplicitGemmBwdDataV1R1,1.07431,0,miopenConvolutionBwdDataAlgoImplicitGEMM,128x128x128x1x1x512x128x128x2xNCHWxFP32x0x0x1x1x1x1x1x0;miopenConvolutionBwdDataAlgoGEMM:GemmBwd1x1_stride1,1.35539,0,MIOpenGEMM,0_1_16384_512_16384_16384_512_128;miopenConvolutionBwdDataAlgoDirect:ConvOclDirectFwd1x1,1.41373,0,miopenConvolutionBwdDataAlgoDirect,<unused>;miopenConvolutionBwdDataAlgoWinograd:ConvBinWinogradRxSf3x2,1.76369,0,miopenConvolutionBwdDataAlgoWinograd,<unused>
2048-32-32-1x1-512-32-32-2-0x0-1x1-1x1-0-NCHW-FP32-F=miopenConvolutionFwdAlgoDirect:ConvOclDirectFwd1x1,0.873959,0,miopenConvolutionFwdAlgoDirect,<unused>;miopenConvolutionFwdAlgoImplicitGEMM:ConvHipImplicitGemmV4R4Fwd,0.945008,0,miopenConvolutionFwdAlgoImplicitGEMM,2048x32x32x1x1x512x32x32x2xNCHWxFP32x0x0x1x1x1x1x1x1;miopenConvolutionFwdAlgoGEMM:GemmFwd1x1_0_1,1.21401,0,MIOpenGEMM,0_0_1024_2048_1024_1024_512_2048;miopenConvolutionFwdAlgoWinograd:ConvBinWinogradRxSf3x2,1.55759,0,miopenConvolutionFwdAlgoWinograd,<unused>
256-32-32-3x3-256-32-32-2-1x1-1x1-1x1-0-NCHW-FP32-B=miopenConvolutionBwdDataAlgoWinograd:ConvBinWinogradRxS,0.182981,0,miopenConvolutionBwdDataAlgoWinograd,<unused>
12-256-256-1x1-512-256-256-2-0x0-1x1-1x1-0-NCHW-FP32-B=miopenConvolutionBwdDataAlgoGEMM:GemmBwd1x1_stride1,2.24841,0,MIOpenGEMM,0_1_65536_512_65536_65536_512_12;miopenConvolutionBwdDataAlgoDirect:ConvOclDirectFwd1x1,2.61984,0,miopenConvolutionBwdDataAlgoDirect,<unused>;miopenConvolutionBwdDataAlgoWinograd:ConvBinWinogradRxSf2x3,3.50878,0,miopenConvolutionBwdDataAlgoWinograd,<unused>;miopenConvolutionBwdDataAlgoImplicitGEMM:ConvHipImplicitGemmBwdDataV1R1,4.94136,0,miopenConvolutionBwdDataAlgoImplicitGEMM,12x256x256x1x1x512x256x256x2xNCHWxFP32x0x0x1x1x1x1x1x0
64-73-73-7x1-64-73-73-64-3x0-1x1-1x1-0-NCHW-FP32-B=miopenConvolutionBwdDataAlgoWinograd:ConvBinWinogradRxSf3x2,4.71286,0,miopenConvolutionBwdDataAlgoWinograd,<unused>;miopenConvolutionBwdDataAlgoGEMM:GemmBwdRest,12.5006,9549568,MIOpenGEMM,0_1_5329_448_5329_5329_448_64;miopenConvolutionBwdDataAlgoImplicitGEMM:ConvHipImplicitGemmBwdDataV1R1,15.7716,0,miopenConvolutionBwdDataAlgoImplicitGEMM,64x73x73x1x7x64x73x73x64xNCHWxFP32x0x3x1x1x1x1x1x0
256-64-64-3x3-256-64-64-2-1x1-1x1-1x1-0-NCHW-FP32-W=miopenConvolutionBwdWeightsAlgoDirect:ConvAsmBwdWrW3x3,1.56646,0,miopenConvolutionBwdWeightsAlgoDirect,<unused>;miopenConvolutionBwdWeightsAlgoGEMM:GemmWrwUniversal,3.21039,37748736,MIOpenGEMM,1_0_4096_4096_2304_2304_256_4096;miopenConvolutionBwdWeightsAlgoImplicitGEMM:ConvHipImplicitGemmV4R1WrW,3.2869,0,miopenConvolutionBwdWeightsAlgoImplicitGEMM,256x64x64x3x3x256x64x64x2xNCHWxFP32x1x1x1x1x1x1x1x0;miopenConvolutionBwdWeightsAlgoWinograd:ConvBinWinogradRxSf2x3,3.81775,0,miopenConvolutionBwdWeightsAlgoWinograd,256x64x64x3x3x256x64x64x2xNCHWxFP32x1x1x1x1x1x1x1x0
384-17-17-3x3-384-35-35-64-0x0-2x2-1x1-0-NCHW-FP32-B=miopenConvolutionBwdDataAlgoWinograd:ConvBinWinogradRxSf2x3,11.2075,0,miopenConvolutionBwdDataAlgoWinograd,<unused>;miopenConvolutionBwdDataAlgoImplicitGEMM:ConvHipImplicitGemmBwdDataV1R1,12.7585,0,miopenConvolutionBwdDataAlgoImplicitGEMM,384x17x17x3x3x384x35x35x64xNCHWxFP32x0x0x2x2x1x1x1x0;miopenConvolutionBwdDataAlgoGEMM:GemmBwdRest,22.7404,3995136,MIOpenGEMM,0_1_289_3456_289_289_3456_384;miopenConvolutionBwdDataAlgoDirect:ConvOclDirectFwd,56.132,0,miopenConvolutionBwdDataAlgoDirect,<unused>
512-16-16-3x3-256-16-16-2-1x1-1x1-1x1-0-NCHW-FP32-W=miopenConvolutionBwdWeightsAlgoDirect:ConvAsmBwdWrW3x3,0.293163,0,miopenConvolutionBwdWeightsAlgoDirect,<unused>;miopenConvolutionBwdWeightsAlgoWinograd:ConvBinWinogradRxS,0.372651,0,miopenConvolutionBwdWeightsAlgoWinograd,512x16x16x3x3x256x16x16x2xNCHWxFP32x1x1x1x1x1x1x1x0;miopenConvolutionBwdWeightsAlgoGEMM:GemmWrwUniversal,0.723312,2359296,MIOpenGEMM,1_0_256_256_2304_2304_512_256;miopenConvolutionBwdWeightsAlgoImplicitGEMM:ConvHipImplicitGemmV4R1WrW,3.96443,0,miopenConvolutionBwdWeightsAlgoImplicitGEMM,512x16x16x3x3x256x16x16x2xNCHWxFP32x1x1x1x1x1x1x1x0
256-64-64-1x1-512-128-128-2-0x0-2x2-1x1-0-NCHW-FP32-W=miopenConvolutionBwdWeightsAlgoDirect:ConvAsmBwdWrW1x1,1.65447,16777216,miopenConvolutionBwdWeightsAlgoDirect,<unused>;miopenConvolutionBwdWeightsAlgoGEMM:GemmWrwUniversal,3.26302,8388608,MIOpenGEMM,1_0_4096_4096_512_512_256_4096;miopenConvolutionBwdWeightsAlgoImplicitGEMM:ConvHipImplicitGemmV4R1WrW,6.46726,0,miopenConvolutionBwdWeightsAlgoImplicitGEMM,256x64x64x1x1x512x128x128x2xNCHWxFP32x0x0x2x2x1x1x1x0
512-32-32-3x3-512-32-32-2-1x1-1x1-1x1-0-NCHW-FP32-W=miopenConvolutionBwdWeightsAlgoDirect:ConvOclBwdWrW53,2.23586,0,miopenConvolutionBwdWeightsAlgoDirect,<unused>;miopenConvolutionBwdWeightsAlgoWinograd:ConvBinWinogradRxSf2x3,8.66836,0,miopenConvolutionBwdWeightsAlgoWinograd,512x32x32x3x3x512x32x32x2xNCHWxFP32x1x1x1x1x1x1x1x0;miopenConvolutionBwdWeightsAlgoGEMM:GemmWrwUniversal,13.3002,18874368,MIOpenGEMM,1_0_1024_1024_4608_4608_512_1024;miopenConvolutionBwdWeightsAlgoImplicitGEMM:ConvHipImplicitGemmV4R1WrW,14.7335,0,miopenConvolutionBwdWeightsAlgoImplicitGEMM,512x32x32x3x3x512x32x32x2xNCHWxFP32x1x1x1x1x1x1x1x0
512-16-16-3x3-256-16-16-2-1x1-1x1-1x1-0-NCHW-FP32-B=miopenConvolutionBwdDataAlgoWinograd:ConvBinWinogradRxSf2x3,0.181941,0,miopenConvolutionBwdDataAlgoWinograd,<unused>
256-64-64-3x3-256-64-64-2-1x1-1x1-1x1-0-NCHW-FP32-B=miopenConvolutionBwdDataAlgoWinograd:ConvBinWinograd3x3U,0.484754,0,miopenConvolutionBwdDataAlgoWinograd,<unused>
512-256-256-1x1-12-256-256-2-0x0-1x1-1x1-0-NCHW-FP32-F=miopenConvolutionFwdAlgoDirect:ConvOclDirectFwd1x1,0.868661,0,miopenConvolutionFwdAlgoDirect,<unused>;miopenConvolutionFwdAlgoWinograd:ConvBinWinogradRxSf3x2,1.35122,0,miopenConvolutionFwdAlgoWinograd,<unused>;miopenConvolutionFwdAlgoGEMM:GemmFwd1x1_0_1,35.7254,0,MIOpenGEMM,0_0_65536_512_65536_65536_12_512
256-32-32-1x1-2048-32-32-2-0x0-1x1-1x1-0-NCHW-FP32-W=miopenConvolutionBwdWeightsAlgoGEMM:GemmWrw1x1_stride1,0.738434,0,MIOpenGEMM,1_0_1024_1024_2048_2048_256_1024;miopenConvolutionBwdWeightsAlgoWinograd:ConvBinWinogradRxSf2x3,5.41653,0,miopenConvolutionBwdWeightsAlgoWinograd,256x32x32x1x1x2048x32x32x2xNCHWxFP32x0x0x1x1x1x1x1x0
256-64-64-1x1-1024-64-64-2-0x0-1x1-1x1-0-NCHW-FP32-W=miopenConvolutionBwdWeightsAlgoDirect:ConvAsmBwdWrW1x1,1.1937,0,miopenConvolutionBwdWeightsAlgoDirect,<unused>;miopenConvolutionBwdWeightsAlgoWinograd:ConvBinWinogradRxSf2x3,5.80647,0,miopenConvolutionBwdWeightsAlgoWinograd,256x64x64x1x1x1024x64x64x2xNCHWxFP32x0x0x1x1x1x1x1x0
512-32-32-3x3-512-32-32-2-1x1-1x1-1x1-0-NCHW-FP32-B=miopenConvolutionBwdDataAlgoWinograd:ConvBinWinogradRxS,0.611096,0,miopenConvolutionBwdDataAlgoWinograd,<unused>
256-32-32-3x3-256-32-32-2-1x1-1x1-1x1-0-NCHW-FP32-F=miopenConvolutionFwdAlgoWinograd:ConvBinWinogradRxSf2x3,0.149635,0,miopenConvolutionFwdAlgoWinograd,<unused>
512-128-128-1x1-128-128-128-2-0x0-1x1-1x1-0-NCHW-FP32-F=miopenConvolutionFwdAlgoImplicitGEMM:ConvHipImplicitGemmV4R4Fwd,0.840503,0,miopenConvolutionFwdAlgoImplicitGEMM,512x128x128x1x1x128x128x128x2xNCHWxFP32x0x0x1x1x1x1x1x1;miopenConvolutionFwdAlgoGEMM:GemmFwd1x1_0_1,1.12101,0,MIOpenGEMM,0_0_16384_512_16384_16384_128_512;miopenConvolutionFwdAlgoWinograd:ConvBinWinogradRxSf3x2,1.40553,0,miopenConvolutionFwdAlgoWinograd,<unused>;miopenConvolutionFwdAlgoDirect:ConvOclDirectFwd1x1,1.40847,0,miopenConvolutionFwdAlgoDirect,<unused>
512-256-256-3x3-256-256-256-2-1x1-1x1-1x1-0-NCHW-FP32-W=miopenConvolutionBwdWeightsAlgoWinograd:ConvBinWinogradRxS,90.4677,0,miopenConvolutionBwdWeightsAlgoWinograd,512x256x256x3x3x256x256x256x2xNCHWxFP32x1x1x1x1x1x1x1x0;miopenConvolutionBwdWeightsAlgoImplicitGEMM:ConvHipImplicitGemmV4R1WrW,97.4574,0,miopenConvolutionBwdWeightsAlgoImplicitGEMM,512x256x256x3x3x256x256x256x2xNCHWxFP32x1x1x1x1x1x1x1x0;miopenConvolutionBwdWeightsAlgoGEMM:GemmWrwUniversal,152.907,603979776,MIOpenGEMM,1_0_65536_65536_2304_2304_512_65536;miopenConvolutionBwdWeightsAlgoDirect:ConvOclBwdWrW53,159.066,0,miopenConvolutionBwdWeightsAlgoDirect,<unused>
256-16-16-3x3-512-16-16-2-1x1-1x1-1x1-0-NCHW-FP32-F=miopenConvolutionFwdAlgoWinograd:ConvBinWinogradRxSf2x3,0.087362,0,miopenConvolutionFwdAlgoWinograd,<unused>
256-64-64-1x1-512-128-128-2-0x0-2x2-1x1-0-NCHW-FP32-B=miopenConvolutionBwdDataAlgoDirect:ConvOclDirectFwd1x1,0.865663,0,miopenConvolutionBwdDataAlgoDirect,<unused>;miopenConvolutionBwdDataAlgoImplicitGEMM:ConvHipImplicitGemmBwdDataV1R1,1.32489,0,miopenConvolutionBwdDataAlgoImplicitGEMM,256x64x64x1x1x512x128x128x2xNCHWxFP32x0x0x2x2x1x1x1x0;miopenConvolutionBwdDataAlgoGEMM:GemmBwd1x1_stride2,1.3341,25165824,MIOpenGEMM,0_1_8192_512_8192_8192_512_256;miopenConvolutionBwdDataAlgoWinograd:ConvBinWinogradRxSf2x3,3.76347,0,miopenConvolutionBwdDataAlgoWinograd,<unused>
256-64-64-3x3-256-64-64-2-1x1-1x1-1x1-0-NCHW-FP32-F=miopenConvolutionFwdAlgoWinograd:ConvBinWinogradRxSf2x3,0.598381,0,miopenConvolutionFwdAlgoWinograd,<unused>
96-35-35-3x3-64-35-35-64-1x1-1x1-1x1-0-NCHW-FP32-W=miopenConvolutionBwdWeightsAlgoDirect:ConvAsmBwdWrW3x3,1.18573,0,miopenConvolutionBwdWeightsAlgoDirect,<unused>;miopenConvolutionBwdWeightsAlgoWinograd:ConvBinWinogradRxSf2x3,2.8626,0,miopenConvolutionBwdWeightsAlgoWinograd,96x35x35x3x3x64x35x35x64xNCHWxFP32x1x1x1x1x1x1x1x0;miopenConvolutionBwdWeightsAlgoGEMM:GemmWrwUniversal,8.52464,2822400,MIOpenGEMM,1_0_1225_1225_576_576_96_1225;miopenConvolutionBwdWeightsAlgoImplicitGEMM:ConvHipImplicitGemmV4R1WrW,15.0517,0,miopenConvolutionBwdWeightsAlgoImplicitGEMM,96x35x35x3x3x64x35x35x64xNCHWxFP32x1x1x1x1x1x1x1x0
512-32-32-3x3-512-32-32-2-1x1-1x1-1x1-0-NCHW-FP32-F=miopenConvolutionFwdAlgoWinograd:ConvBinWinogradRxSf2x3,0.636048,0,miopenConvolutionFwdAlgoWinograd,<unused>
6-16-16-1x1-512-16-16-2-0x0-1x1-1x1-0-NCHW-FP32-W=miopenConvolutionBwdWeightsAlgoDirect:ConvAsmBwdWrW1x1,0.017493,0,miopenConvolutionBwdWeightsAlgoDirect,<unused>;miopenConvolutionBwdWeightsAlgoWinograd:ConvBinWinogradRxS,0.095928,0,miopenConvolutionBwdWeightsAlgoWinograd,6x16x16x1x1x512x16x16x2xNCHWxFP32x0x0x1x1x1x1x1x0;miopenConvolutionBwdWeightsAlgoGEMM:GemmWrw1x1_stride1,0.307232,0,MIOpenGEMM,1_0_256_256_512_512_6_256
64-256-256-1x1-256-256-256-2-0x0-1x1-1x1-0-NCHW-FP32-F=miopenConvolutionFwdAlgoDirect:ConvOclDirectFwd1x1,2.32542,0,miopenConvolutionFwdAlgoDirect,<unused>;miopenConvolutionFwdAlgoWinograd:ConvBinWinogradRxSf3x2,2.63544,0,miopenConvolutionFwdAlgoWinograd,<unused>;miopenConvolutionFwdAlgoGEMM:GemmFwd1x1_0_1,5.97733,0,MIOpenGEMM,0_0_65536_64_65536_65536_256_64;miopenConvolutionFwdAlgoImplicitGEMM:ConvHipImplicitGemmV4R4Fwd,6.65876,0,miopenConvolutionFwdAlgoImplicitGEMM,64x256x256x1x1x256x256x256x2xNCHWxFP32x0x0x1x1x1x1x1x1
256-32-32-1x1-2048-32-32-2-0x0-1x1-1x1-0-NCHW-FP32-B=miopenConvolutionBwdDataAlgoWinograd:ConvBinWinogradRxSf3x2,0.977025,0,miopenConvolutionBwdDataAlgoWinograd,<unused>;miopenConvolutionBwdDataAlgoDirect:ConvAsm1x1U,1.63831,0,miopenConvolutionBwdDataAlgoDirect,<unused>;miopenConvolutionBwdDataAlgoGEMM:GemmBwd1x1_stride1,4.00838,0,MIOpenGEMM,0_1_1024_2048_1024_1024_2048_256;miopenConvolutionBwdDataAlgoImplicitGEMM:ConvHipImplicitGemmBwdDataV1R1,17.2423,0,miopenConvolutionBwdDataAlgoImplicitGEMM,256x32x32x1x1x2048x32x32x2xNCHWxFP32x0x0x1x1x1x1x1x0
12-128-128-1x1-512-128-128-2-0x0-1x1-1x1-0-NCHW-FP32-W=miopenConvolutionBwdWeightsAlgoGEMM:GemmWrw1x1_stride1,0.954661,0,MIOpenGEMM,1_0_16384_16384_512_512_12_16384;miopenConvolutionBwdWeightsAlgoDirect:ConvAsmBwdWrW1x1,0.970909,0,miopenConvolutionBwdWeightsAlgoDirect,<unused>;miopenConvolutionBwdWeightsAlgoWinograd:ConvBinWinogradRxSf2x3,2.71982,0,miopenConvolutionBwdWeightsAlgoWinograd,12x128x128x1x1x512x128x128x2xNCHWxFP32x0x0x1x1x1x1x1x0
6-16-16-1x1-512-16-16-2-0x0-1x1-1x1-0-NCHW-FP32-B=miopenConvolutionBwdDataAlgoDirect:ConvAsm1x1U,0.008444,0,miopenConvolutionBwdDataAlgoDirect,<unused>;miopenConvolutionBwdDataAlgoGEMM:GemmBwd1x1_stride1,0.01533,0,MIOpenGEMM,0_1_256_512_256_256_512_6;miopenConvolutionBwdDataAlgoWinograd:ConvBinWinogradRxSf2x3,0.04354,0,miopenConvolutionBwdDataAlgoWinograd,<unused>
512-128-128-1x1-256-64-64-2-0x0-2x2-1x1-0-NCHW-FP32-F=miopenConvolutionFwdAlgoImplicitGEMM:ConvHipImplicitGemmV4R4Fwd,0.839957,0,miopenConvolutionFwdAlgoImplicitGEMM,512x128x128x1x1x256x64x64x2xNCHWxFP32x0x0x2x2x1x1x1x1;miopenConvolutionFwdAlgoGEMM:GemmFwd1x1_0_2,0.978382,25165824,MIOpenGEMM,0_0_8192_512_8192_8192_256_512;miopenConvolutionFwdAlgoDirect:ConvOclDirectFwd1x1,1.85953,0,miopenConvolutionFwdAlgoDirect,<unused>;miopenConvolutionFwdAlgoWinograd:ConvBinWinogradRxSf2x3,2.93715,0,miopenConvolutionFwdAlgoWinograd,<unused>
6-64-64-1x1-512-64-64-2-0x0-1x1-1x1-0-NCHW-FP32-W=miopenConvolutionBwdWeightsAlgoDirect:ConvAsmBwdWrW1x1,0.166868,0,miopenConvolutionBwdWeightsAlgoDirect,<unused>;miopenConvolutionBwdWeightsAlgoWinograd:ConvBinWinogradRxSf2x3,0.638726,0,miopenConvolutionBwdWeightsAlgoWinograd,6x64x64x1x1x512x64x64x2xNCHWxFP32x0x0x1x1x1x1x1x0;miopenConvolutionBwdWeightsAlgoGEMM:GemmWrw1x1_stride1,0.769649,0,MIOpenGEMM,1_0_4096_4096_512_512_6_4096
1024-64-64-1x1-256-64-64-2-0x0-1x1-1x1-0-NCHW-FP32-W=miopenConvolutionBwdWeightsAlgoDirect:ConvAsmBwdWrW1x1,1.07248,0,miopenConvolutionBwdWeightsAlgoDirect,<unused>;miopenConvolutionBwdWeightsAlgoWinograd:ConvBinWinogradRxSf2x3,5.29272,0,miopenConvolutionBwdWeightsAlgoWinograd,1024x64x64x1x1x256x64x64x2xNCHWxFP32x0x0x1x1x1x1x1x0
512-128-128-3x3-256-128-128-2-1x1-1x1-1x1-0-NCHW-FP32-W=miopenConvolutionBwdWeightsAlgoWinograd:ConvBinWinogradRxS,18.0422,0,miopenConvolutionBwdWeightsAlgoWinograd,512x128x128x3x3x256x128x128x2xNCHWxFP32x1x1x1x1x1x1x1x0;miopenConvolutionBwdWeightsAlgoDirect:ConvOclBwdWrW53,24.9976,0,miopenConvolutionBwdWeightsAlgoDirect,<unused>;miopenConvolutionBwdWeightsAlgoGEMM:GemmWrwUniversal,34.7617,150994944,MIOpenGEMM,1_0_16384_16384_2304_2304_512_16384;miopenConvolutionBwdWeightsAlgoImplicitGEMM:ConvHipImplicitGemmV4R1WrW,35.8325,0,miopenConvolutionBwdWeightsAlgoImplicitGEMM,512x128x128x3x3x256x128x128x2xNCHWxFP32x1x1x1x1x1x1x1x0
512-16-16-1x1-6-16-16-2-0x0-1x1-1x1-0-NCHW-FP32-F=miopenConvolutionFwdAlgoDirect:ConvAsm1x1U,0.02396,0,miopenConvolutionFwdAlgoDirect,<unused>;miopenConvolutionFwdAlgoWinograd:ConvBinWinogradRxSf2x3,0.150516,0,miopenConvolutionFwdAlgoWinograd,<unused>;miopenConvolutionFwdAlgoGEMM:GemmFwd1x1_0_1,0.358679,0,MIOpenGEMM,0_0_256_512_256_256_6_512
2048-32-32-1x1-512-32-32-2-0x0-1x1-1x1-0-NCHW-FP32-W=miopenConvolutionBwdWeightsAlgoGEMM:GemmWrw1x1_stride1,1.23613,0,MIOpenGEMM,1_0_1024_1024_512_512_2048_1024;miopenConvolutionBwdWeightsAlgoWinograd:ConvBinWinogradRxSf2x3,5.14394,0,miopenConvolutionBwdWeightsAlgoWinograd,2048x32x32x1x1x512x32x32x2xNCHWxFP32x0x0x1x1x1x1x1x0
512-256-256-3x3-256-256-256-2-1x1-1x1-1x1-0-NCHW-FP32-B=miopenConvolutionBwdDataAlgoWinograd:ConvBinWinograd3x3U,15.6808,0,miopenConvolutionBwdDataAlgoWinograd,<unused>
