src/kernels/gfx900_64.OpenCL.2_5_0.ufdb.txt
1-1-1-2x2-1-1-1-1-0x0-1x1-1x1-0-NCHW-FP32-F=miopenConvolutionFwdAlgoWinograd:ConvBinWinogradRxSf2x3,0.052001,0,miopenConvolutionFwdAlgoWinograd,<unused>;miopenConvolutionFwdAlgoGEMM:gemm,0.015112,16,MIOpenGEMM,0_0_1_4_1_1_1_4
1-1-1-2x2-1-1-1-1-0x0-1x1-1x1-0-NCHW-FP32-B=miopenConvolutionBwdDataAlgoGEMM:gemm,0.019704,16,MIOpenGEMM,0_1_1_4_1_1_4_1;miopenConvolutionBwdDataAlgoWinograd:ConvBinWinogradRxSf2x3,0.05215,0,miopenConvolutionBwdDataAlgoWinograd,<unused>
1-1-1-2x2-1-1-1-1-0x0-1x1-1x1-0-NCHW-FP32-W=miopenConvolutionBwdWeightsAlgoWinograd:ConvBinWinogradRxSf2x3,0.051557,0,miopenConvolutionBwdWeightsAlgoWinograd,1x1x1x2x2x1x1x1x1xNCHWxFP32x0x0x1x1x1x1x1x0;miopenConvolutionBwdWeightsAlgoGEMM:gemm,0.014518,16,MIOpenGEMM,1_0_1_1_4_4_1_1
64-56-56-1x1-256-56-56-64-0x0-1x1-1x1-0-NCHW-FP32-F=miopenConvolutionFwdAlgoImplicitGEMM:ConvAsmImplicitGemmV4R1DynamicFwd,4.75423,0,miopenConvolutionFwdAlgoImplicitGEMM,<unused>
256-34-34-3x3-256-32-32-64-0x0-1x1-1x1-0-NCHW-FP32-F=miopenConvolutionFwdAlgoImplicitGEMM:ConvAsmImplicitGemmV4R1DynamicFwd,13.0758,0,miopenConvolutionFwdAlgoImplicitGEMM,<unused>
128-35-35-3x3-128-17-17-128-0x0-2x2-1x1-0-NCHW-FP32-F=miopenConvolutionFwdAlgoImplicitGEMM:ConvAsmImplicitGemmV4R1DynamicFwd,2.49978,0,miopenConvolutionFwdAlgoImplicitGEMM,<unused>
1536-8-8-1x1-256-8-8-64-0x0-1x1-1x1-0-NCHW-FP32-F=miopenConvolutionFwdAlgoImplicitGEMM:ConvAsmImplicitGemmV4R1DynamicFwd,0.791285,0,miopenConvolutionFwdAlgoImplicitGEMM,<unused>
48-7-7-5x5-128-7-7-128-2x2-1x1-1x1-0-NCHW-FP32-F=miopenConvolutionFwdAlgoImplicitGEMM:ConvAsmImplicitGemmV4R1DynamicFwd,0.617206,0,miopenConvolutionFwdAlgoImplicitGEMM,<unused>
128-17-17-1x7-128-17-17-128-0x3-1x1-1x1-0-NCHW-FP32-F=miopenConvolutionFwdAlgoImplicitGEMM:ConvAsmImplicitGemmV4R1DynamicFwd,1.82124,0,miopenConvolutionFwdAlgoImplicitGEMM,<unused>
256-28-28-1x1-128-28-28-128-0x0-1x1-1x1-0-NCHW-FP32-F=miopenConvolutionFwdAlgoImplicitGEMM:ConvAsmImplicitGemmV4R1DynamicFwd_1x1,2.33,0,miopenConvolutionFwdAlgoImplicitGEMM,<unused>
768-17-17-1x1-128-17-17-128-0x0-1x1-1x1-0-NCHW-FP32-F=miopenConvolutionFwdAlgoImplicitGEMM:ConvAsmImplicitGemmV4R1DynamicFwd_1x1,2.87505,0,miopenConvolutionFwdAlgoImplicitGEMM,<unused>
1-1-2-2-1x1x1-1-1-2-2-1-0x0x0-1x1x1-1x1x1-0-NCHW-FP32-F=miopenConvolutionFwdAlgoGEMM:gemm,0.004593,0,MIOpenGEMM,0_0_4_1_4_4_1_1
1-1-2-2-1x1x1-1-1-2-2-1-0x0x0-1x1x1-1x1x1-0-NCHW-FP32-B=miopenConvolutionBwdDataAlgoGEMM:gemm,0.004444,0,MIOpenGEMM,0_1_4_1_4_4_1_1
1-1-2-2-1x1x1-1-1-2-2-1-0x0x0-1x1x1-1x1x1-0-NCHW-FP32-W=miopenConvolutionBwdWeightsAlgoGEMM:gemm,0.006666,0,MIOpenGEMM,1_0_4_4_1_1_1_4
32-8-8-5x5-64-4-4-100-0x0-1x1-1x1-0-NCHW-FP32-F=miopenConvolutionFwdAlgoDirect:ConvOclDirectFwd,0.417943,0,miopenConvolutionFwdAlgoDirect,<unused>;miopenConvolutionFwdAlgoImplicitGEMM:ConvHipImplicitGemmV4R4Fwd,0.972633,0,miopenConvolutionFwdAlgoImplicitGEMM,<unused>;miopenConvolutionFwdAlgoWinograd:ConvBinWinogradRxSf2x3,0.113634,0,miopenConvolutionFwdAlgoWinograd,<unused>;miopenConvolutionFwdAlgoGEMM:gemm,9.7189,51200,MIOpenGEMM,0_0_16_800_16_16_64_800
