src/kernels/gfx900_56.OpenCL.fdb.txt
128-56-56-3x3-128-56-56-32-1x1-1x1-1x1-0-NCHW-FP32-B_g32=miopenConvolutionBwdDataAlgoDirect:ConvOclDirectFwd,0,949368,0,miopenConvolutionBwdDataAlgoDirect;miopenConvolutionBwdDataAlgoWinograd:ConvBinWinogradRxSf2x3,14,6225,0,miopenConvolutionBwdDataAlgoWinograd;miopenConvolutionBwdDataAlgoGEMM:gemm,220,513,14450688,MIOpenGEMM
1024-14-14-1x1-512-14-14-32-0x0-1x1-1x1-0-NCHW-FP32-F=miopenConvolutionFwdAlgoDirect:ConvAsm1x1U,3,3694,0,miopenConvolutionFwdAlgoDirect;miopenConvolutionFwdAlgoWinograd:ConvBinWinogradRxSf3x2,11,8808,0,miopenConvolutionFwdAlgoWinograd;miopenConvolutionFwdAlgoGEMM:GemmFwd1x1_0_1,37,7057,0,MIOpenGEMM
256-28-28-3x3-256-28-28-32-1x1-1x1-1x1-0-NCHW-FP32-W_g32=miopenConvolutionBwdWeightsAlgoDirect:ConvAsmBwdWrW3x3,0,376728,0,miopenConvolutionBwdWeightsAlgoDirect;miopenConvolutionBwdWeightsAlgoWinograd:ConvBinWinogradRxSf2x3,97,56,0,miopenConvolutionBwdWeightsAlgoWinograd;miopenConvolutionBwdWeightsAlgoGEMM:gemm,356,727,7225344,MIOpenGEMM
128-56-56-3x3-128-56-56-32-1x1-1x1-1x1-0-NCHW-FP32-F_g32=miopenConvolutionFwdAlgoDirect:ConvAsm3x3U,0,523553,0,miopenConvolutionFwdAlgoDirect;miopenConvolutionFwdAlgoWinograd:ConvBinWinogradRxSf2x3,9,32086,0,miopenConvolutionFwdAlgoWinograd;miopenConvolutionFwdAlgoGEMM:GemmFwdRest,165,767,14450688,MIOpenGEMM
256-56-56-3x3-256-28-28-32-1x1-2x2-1x1-0-NCHW-FP32-F_g32=miopenConvolutionFwdAlgoDirect:ConvOclDirectFwd,5,80882,0,miopenConvolutionFwdAlgoDirect;miopenConvolutionFwdAlgoWinograd:ConvBinWinogradRxSf2x3,24,3798,0,miopenConvolutionFwdAlgoWinograd;miopenConvolutionFwdAlgoGEMM:GemmFwdRest,66,1312,7225344,MIOpenGEMM
2048-7-7-1x1-1024-14-14-32-0x0-2x2-1x1-0-NCHW-FP32-W=miopenConvolutionBwdWeightsAlgoDirect:ConvAsmBwdWrW1x1,4,31244,6422528,miopenConvolutionBwdWeightsAlgoDirect;miopenConvolutionBwdWeightsAlgoImplicitGEMM:ConvHipImplicitGemmV4R1WrW,12,5679,0,miopenConvolutionBwdWeightsAlgoImplicitGEMM;miopenConvolutionBwdWeightsAlgoGEMM:gemm,65,6183,200704,MIOpenGEMM
256-28-28-3x3-256-28-28-32-1x1-1x1-1x1-0-NCHW-FP32-B_g32=miopenConvolutionBwdDataAlgoDirect:ConvAsm3x3U,0,810954,0,miopenConvolutionBwdDataAlgoDirect;miopenConvolutionBwdDataAlgoWinograd:ConvBinWinogradRxSf2x3,13,5176,0,miopenConvolutionBwdDataAlgoWinograd;miopenConvolutionBwdDataAlgoGEMM:gemm,229,356,7225344,MIOpenGEMM
256-56-56-1x1-64-56-56-32-0x0-1x1-1x1-0-NCHW-FP32-B=miopenConvolutionBwdDataAlgoDirect:ConvAsm1x1U,8,56741,0,miopenConvolutionBwdDataAlgoDirect;miopenConvolutionBwdDataAlgoWinograd:ConvBinWinogradRxSf3x2,31,6812,0,miopenConvolutionBwdDataAlgoWinograd;miopenConvolutionBwdDataAlgoGEMM:gemm,410,547,0,MIOpenGEMM
2048-7-7-3x3-2048-7-7-32-1x1-1x1-1x1-0-NCHW-FP32-B_g32=miopenConvolutionBwdDataAlgoDirect:ConvOclDirectFwd,10,7766,0,miopenConvolutionBwdDataAlgoDirect;miopenConvolutionBwdDataAlgoWinograd:ConvBinWinogradRxSf2x3,17,5042,0,miopenConvolutionBwdDataAlgoWinograd;miopenConvolutionBwdDataAlgoGEMM:gemm,49,2481,3612672,MIOpenGEMM
512-28-28-3x3-512-28-28-32-1x1-1x1-1x1-0-NCHW-FP32-B_g64=miopenConvolutionBwdDataAlgoDirect:ConvAsm3x3U,2,8596,0,miopenConvolutionBwdDataAlgoDirect;miopenConvolutionBwdDataAlgoWinograd:ConvBinWinogradRxSf2x3,21,4866,0,miopenConvolutionBwdDataAlgoWinograd;miopenConvolutionBwdDataAlgoGEMM:gemm,402,177,14450688,MIOpenGEMM
256-28-28-3x3-256-28-28-32-1x1-1x1-1x1-0-NCHW-FP32-F_g32=miopenConvolutionFwdAlgoDirect:ConvOclDirectFwd,1,83415,0,miopenConvolutionFwdAlgoDirect;miopenConvolutionFwdAlgoWinograd:ConvBinWinogradRxSf2x3,21,6502,0,miopenConvolutionFwdAlgoWinograd;miopenConvolutionFwdAlgoGEMM:GemmFwdRest,309,124,7225344,MIOpenGEMM
2048-7-7-1x1-1024-7-7-32-0x0-1x1-1x1-0-NCHW-FP32-W=miopenConvolutionBwdWeightsAlgoDirect:ConvAsmBwdWrW1x1,4,43605,0,miopenConvolutionBwdWeightsAlgoDirect;miopenConvolutionBwdWeightsAlgoGEMM:gemm,31,8769,0,MIOpenGEMM;miopenConvolutionBwdWeightsAlgoWinograd:ConvBinWinogradRxSf2x3,35,5309,0,miopenConvolutionBwdWeightsAlgoWinograd
1024-14-14-1x1-512-14-14-32-0x0-1x1-1x1-0-NCHW-FP32-W=miopenConvolutionBwdWeightsAlgoDirect:ConvAsmBwdWrW1x1,3,12076,0,miopenConvolutionBwdWeightsAlgoDirect;miopenConvolutionBwdWeightsAlgoGEMM:gemm,14,5045,0,MIOpenGEMM;miopenConvolutionBwdWeightsAlgoWinograd:ConvBinWinogradRxSf2x3,32,4848,0,miopenConvolutionBwdWeightsAlgoWinograd
256-56-56-3x3-256-56-56-32-1x1-1x1-1x1-0-NCHW-FP32-B_g64=miopenConvolutionBwdDataAlgoDirect:ConvAsm3x3U,1,34347,0,miopenConvolutionBwdDataAlgoDirect;miopenConvolutionBwdDataAlgoWinograd:ConvBinWinogradRxSf2x3,11,6373,0,miopenConvolutionBwdDataAlgoWinograd;miopenConvolutionBwdDataAlgoGEMM:gemm,263,523,28901376,MIOpenGEMM
2048-7-7-1x1-1024-14-14-32-0x0-2x2-1x1-0-NCHW-FP32-B=miopenConvolutionBwdDataAlgoDirect:ConvAsm1x1U,2,57262,6422528,miopenConvolutionBwdDataAlgoDirect;miopenConvolutionBwdDataAlgoGEMM:gemm,31,2721,19267584,MIOpenGEMM;miopenConvolutionBwdDataAlgoImplicitGEMM:ConvHipImplicitGemmBwdDataV1R1,32,3219,0,miopenConvolutionBwdDataAlgoImplicitGEMM;miopenConvolutionBwdDataAlgoWinograd:ConvBinWinogradRxSf2x3,132,798,0,miopenConvolutionBwdDataAlgoWinograd
64-56-56-1x1-256-56-56-32-0x0-1x1-1x1-0-NCHW-FP32-F=miopenConvolutionFwdAlgoDirect:ConvOclDirectFwd1x1,4,28769,0,miopenConvolutionFwdAlgoDirect;miopenConvolutionFwdAlgoGEMM:GemmFwd1x1_0_1,53,8293,0,MIOpenGEMM
512-28-28-3x3-512-28-28-32-1x1-1x1-1x1-0-NCHW-FP32-F_g64=miopenConvolutionFwdAlgoDirect:ConvAsm3x3U,1,14237,0,miopenConvolutionFwdAlgoDirect;miopenConvolutionFwdAlgoWinograd:ConvBinWinogradRxSf2x3,42,824,0,miopenConvolutionFwdAlgoWinograd;miopenConvolutionFwdAlgoGEMM:GemmFwdRest,209,532,14450688,MIOpenGEMM
2048-7-7-3x3-2048-7-7-32-1x1-1x1-1x1-0-NCHW-FP32-F_g32=miopenConvolutionFwdAlgoImplicitGEMM:ConvHipImplicitGemmV4R1Fwd,5,58523,0,miopenConvolutionFwdAlgoImplicitGEMM;miopenConvolutionFwdAlgoDirect:ConvOclDirectFwd,11,5684,0,miopenConvolutionFwdAlgoDirect;miopenConvolutionFwdAlgoWinograd:ConvBinWinogradRxSf2x3,15,3147,0,miopenConvolutionFwdAlgoWinograd;miopenConvolutionFwdAlgoGEMM:GemmFwdRest,498,905,3612672,MIOpenGEMM
1024-28-28-3x3-1024-14-14-32-1x1-2x2-1x1-0-NCHW-FP32-F_g32=miopenConvolutionFwdAlgoImplicitGEMM:ConvHipImplicitGemmV4R1Fwd,8,10171,0,miopenConvolutionFwdAlgoImplicitGEMM;miopenConvolutionFwdAlgoWinograd:ConvBinWinogradRxSf2x3,13,814,0,miopenConvolutionFwdAlgoWinograd;miopenConvolutionFwdAlgoDirect:ConvOclDirectFwd,21,9217,0,miopenConvolutionFwdAlgoDirect;miopenConvolutionFwdAlgoGEMM:GemmFwdRest,561,359,7225344,MIOpenGEMM
512-28-28-1x1-512-28-28-32-0x0-1x1-1x1-0-NCHW-FP32-F=miopenConvolutionFwdAlgoDirect:ConvAsm1x1U,8,82828,0,miopenConvolutionFwdAlgoDirect;miopenConvolutionFwdAlgoWinograd:ConvBinWinogradRxSf3x2,953,463,0,miopenConvolutionFwdAlgoWinograd
2048-7-7-1x1-2048-7-7-32-0x0-1x1-1x1-0-NCHW-FP32-W=miopenConvolutionBwdWeightsAlgoDirect:ConvAsmBwdWrW1x1,8,73905,0,miopenConvolutionBwdWeightsAlgoDirect;miopenConvolutionBwdWeightsAlgoGEMM:gemm,67,9239,0,MIOpenGEMM;miopenConvolutionBwdWeightsAlgoWinograd:ConvBinWinogradRxSf2x3,83,489,0,miopenConvolutionBwdWeightsAlgoWinograd
2048-7-7-1x1-1024-7-7-32-0x0-1x1-1x1-0-NCHW-FP32-B=miopenConvolutionBwdDataAlgoDirect:ConvAsm1x1U,4,15726,0,miopenConvolutionBwdDataAlgoDirect;miopenConvolutionBwdDataAlgoImplicitGEMM:ConvHipImplicitGemmBwdDataV1R1,17,5364,0,miopenConvolutionBwdDataAlgoImplicitGEMM;miopenConvolutionBwdDataAlgoWinograd:ConvBinWinogradRxSf3x2,22,3162,0,miopenConvolutionBwdDataAlgoWinograd;miopenConvolutionBwdDataAlgoGEMM:gemm,56,8785,0,MIOpenGEMM
1024-14-14-1x1-1024-14-14-32-0x0-1x1-1x1-0-NCHW-FP32-W=miopenConvolutionBwdWeightsAlgoDirect:ConvAsmBwdWrW1x1,16,5387,0,miopenConvolutionBwdWeightsAlgoDirect;miopenConvolutionBwdWeightsAlgoGEMM:gemm,54,6742,0,MIOpenGEMM;miopenConvolutionBwdWeightsAlgoWinograd:ConvBinWinogradRxSf2x3,103,991,0,miopenConvolutionBwdWeightsAlgoWinograd
1024-7-7-1x1-2048-7-7-32-0x0-1x1-1x1-0-NCHW-FP32-W=miopenConvolutionBwdWeightsAlgoDirect:ConvAsmBwdWrW1x1,4,159,0,miopenConvolutionBwdWeightsAlgoDirect;miopenConvolutionBwdWeightsAlgoGEMM:gemm,14,3099,0,MIOpenGEMM;miopenConvolutionBwdWeightsAlgoWinograd:ConvBinWinogradRxSf2x3,35,432,0,miopenConvolutionBwdWeightsAlgoWinograd
1024-14-14-1x1-2048-7-7-32-0x0-2x2-1x1-0-NCHW-FP32-F=miopenConvolutionFwdAlgoDirect:ConvAsm1x1U,7,44838,6422528,miopenConvolutionFwdAlgoDirect;miopenConvolutionFwdAlgoGEMM:GemmFwd1x1_0_2,25,7499,19267584,MIOpenGEMM;miopenConvolutionFwdAlgoImplicitGEMM:ConvHipImplicitGemmV4R1Fwd,30,9062,0,miopenConvolutionFwdAlgoImplicitGEMM;miopenConvolutionFwdAlgoWinograd:ConvBinWinogradRxSf2x3,120,665,0,miopenConvolutionFwdAlgoWinograd
256-56-56-3x3-256-56-56-32-1x1-1x1-1x1-0-NCHW-FP32-F_g64=miopenConvolutionFwdAlgoDirect:ConvAsm3x3U,1,4527,0,miopenConvolutionFwdAlgoDirect;miopenConvolutionFwdAlgoWinograd:ConvBinWinogradRxSf2x3,25,537,0,miopenConvolutionFwdAlgoWinograd;miopenConvolutionFwdAlgoGEMM:GemmFwdRest,312,288,28901376,MIOpenGEMM
1024-14-14-1x1-512-14-14-32-0x0-1x1-1x1-0-NCHW-FP32-B=miopenConvolutionBwdDataAlgoDirect:ConvAsm1x1U,2,8778,0,miopenConvolutionBwdDataAlgoDirect;miopenConvolutionBwdDataAlgoWinograd:ConvBinWinogradRxSf3x2,11,1127,0,miopenConvolutionBwdDataAlgoWinograd;miopenConvolutionBwdDataAlgoGEMM:gemm,41,8351,0,MIOpenGEMM
2048-14-14-1x1-1024-14-14-32-0x0-1x1-1x1-0-NCHW-FP32-W=miopenConvolutionBwdWeightsAlgoDirect:ConvAsmBwdWrW1x1,28,3194,0,miopenConvolutionBwdWeightsAlgoDirect;miopenConvolutionBwdWeightsAlgoWinograd:ConvBinWinogradRxSf2x3,233,103,0,miopenConvolutionBwdWeightsAlgoWinograd
128-56-56-1x1-64-56-56-32-0x0-1x1-1x1-0-NCHW-FP32-W=miopenConvolutionBwdWeightsAlgoDirect:ConvAsmBwdWrW1x1,1,51305,0,miopenConvolutionBwdWeightsAlgoDirect
512-56-56-1x1-256-56-56-32-0x0-1x1-1x1-0-NCHW-FP32-W=miopenConvolutionBwdWeightsAlgoDirect:ConvAsmBwdWrW1x1,29,1465,0,miopenConvolutionBwdWeightsAlgoDirect;miopenConvolutionBwdWeightsAlgoWinograd:ConvBinWinogradRxSf2x3,285,814,0,miopenConvolutionBwdWeightsAlgoWinograd
256-56-56-1x1-256-56-56-32-0x0-1x1-1x1-0-NCHW-FP32-W=miopenConvolutionBwdWeightsAlgoDirect:ConvAsmBwdWrW1x1,39,8848,0,miopenConvolutionBwdWeightsAlgoDirect;miopenConvolutionBwdWeightsAlgoWinograd:ConvBinWinogradRxSf2x3,153,973,0,miopenConvolutionBwdWeightsAlgoWinograd
512-28-28-1x1-1024-28-28-32-0x0-1x1-1x1-0-NCHW-FP32-F=miopenConvolutionFwdAlgoDirect:ConvAsm1x1U,35,1358,0,miopenConvolutionFwdAlgoDirect;miopenConvolutionFwdAlgoGEMM:GemmFwd1x1_0_1,977,989,0,MIOpenGEMM;miopenConvolutionFwdAlgoWinograd:ConvBinWinogradRxSf2x3,1801,17,0,miopenConvolutionFwdAlgoWinograd
1024-14-14-1x1-1024-14-14-32-0x0-1x1-1x1-0-NCHW-FP32-B=miopenConvolutionBwdDataAlgoDirect:ConvAsm1x1U,9,1142,0,miopenConvolutionBwdDataAlgoDirect;miopenConvolutionBwdDataAlgoWinograd:ConvBinWinogradRxSf3x2,38,3272,0,miopenConvolutionBwdDataAlgoWinograd;miopenConvolutionBwdDataAlgoGEMM:gemm,68,43,0,MIOpenGEMM
512-28-28-1x1-512-28-28-32-0x0-1x1-1x1-0-NCHW-FP32-W=miopenConvolutionBwdWeightsAlgoDirect:ConvOclBwdWrW1x1,121,13,0,miopenConvolutionBwdWeightsAlgoDirect;miopenConvolutionBwdWeightsAlgoWinograd:ConvBinWinogradRxSf2x3,430,901,0,miopenConvolutionBwdWeightsAlgoWinograd;miopenConvolutionBwdWeightsAlgoGEMM:gemm,569,248,0,MIOpenGEMM
2048-7-7-1x1-2048-7-7-32-0x0-1x1-1x1-0-NCHW-FP32-F=miopenConvolutionFwdAlgoDirect:ConvAsm1x1U,15,3346,0,miopenConvolutionFwdAlgoDirect;miopenConvolutionFwdAlgoImplicitGEMM:ConvHipImplicitGemmV4R1Fwd,16,4319,0,miopenConvolutionFwdAlgoImplicitGEMM;miopenConvolutionFwdAlgoGEMM:GemmFwd1x1_0_1,27,2798,0,MIOpenGEMM;miopenConvolutionFwdAlgoWinograd:ConvBinWinogradRxSf3x2,44,229,0,miopenConvolutionFwdAlgoWinograd
1024-7-7-1x1-2048-7-7-32-0x0-1x1-1x1-0-NCHW-FP32-B=miopenConvolutionBwdDataAlgoDirect:ConvAsm1x1U,5,36394,0,miopenConvolutionBwdDataAlgoDirect;miopenConvolutionBwdDataAlgoImplicitGEMM:ConvHipImplicitGemmBwdDataV1R1,8,47808,0,miopenConvolutionBwdDataAlgoImplicitGEMM;miopenConvolutionBwdDataAlgoWinograd:ConvBinWinogradRxSf3x2,31,134,0,miopenConvolutionBwdDataAlgoWinograd;miopenConvolutionBwdDataAlgoGEMM:gemm,42,8672,0,MIOpenGEMM
256-28-28-1x1-512-28-28-32-0x0-1x1-1x1-0-NCHW-FP32-W=miopenConvolutionBwdWeightsAlgoDirect:ConvAsmBwdWrW1x1,8,5193,0,miopenConvolutionBwdWeightsAlgoDirect;miopenConvolutionBwdWeightsAlgoWinograd:ConvBinWinogradRxSf2x3,37,3692,0,miopenConvolutionBwdWeightsAlgoWinograd;miopenConvolutionBwdWeightsAlgoGEMM:gemm,64,4424,0,MIOpenGEMM
1024-7-7-3x3-1024-14-14-32-1x1-2x2-1x1-0-NCHW-FP32-W_g32=miopenConvolutionBwdWeightsAlgoDirect:ConvAsmBwdWrW3x3,0,642925,0,miopenConvolutionBwdWeightsAlgoDirect;miopenConvolutionBwdWeightsAlgoGEMM:gemm,133,762,1806336,MIOpenGEMM
128-56-56-1x1-64-56-56-32-0x0-1x1-1x1-0-NCHW-FP32-B=miopenConvolutionBwdDataAlgoDirect:ConvAsm1x1U,0,796079,0,miopenConvolutionBwdDataAlgoDirect;miopenConvolutionBwdDataAlgoGEMM:gemm,21,2914,0,MIOpenGEMM
2048-7-7-1x1-2048-7-7-32-0x0-1x1-1x1-0-NCHW-FP32-B=miopenConvolutionBwdDataAlgoDirect:ConvAsm1x1U,8,34344,0,miopenConvolutionBwdDataAlgoDirect;miopenConvolutionBwdDataAlgoImplicitGEMM:ConvHipImplicitGemmBwdDataV1R1,28,2329,0,miopenConvolutionBwdDataAlgoImplicitGEMM;miopenConvolutionBwdDataAlgoWinograd:ConvBinWinogradRxSf3x2,62,1296,0,miopenConvolutionBwdDataAlgoWinograd;miopenConvolutionBwdDataAlgoGEMM:gemm,145,759,0,MIOpenGEMM
1024-7-7-1x1-2048-7-7-32-0x0-1x1-1x1-0-NCHW-FP32-F=miopenConvolutionFwdAlgoDirect:ConvAsm1x1U,6,72941,0,miopenConvolutionFwdAlgoDirect;miopenConvolutionFwdAlgoImplicitGEMM:ConvHipImplicitGemmV4R1Fwd,14,4171,0,miopenConvolutionFwdAlgoImplicitGEMM;miopenConvolutionFwdAlgoWinograd:ConvBinWinogradRxSf3x2,25,5945,0,miopenConvolutionFwdAlgoWinograd;miopenConvolutionFwdAlgoGEMM:GemmFwd1x1_0_1,83,9451,0,MIOpenGEMM
1024-7-7-3x3-1024-14-14-32-1x1-2x2-1x1-0-NCHW-FP32-B_g32=miopenConvolutionBwdDataAlgoDirect:ConvOclDirectFwd,1,23622,0,miopenConvolutionBwdDataAlgoDirect;miopenConvolutionBwdDataAlgoWinograd:ConvBinWinogradRxSf2x3,1,38974,0,miopenConvolutionBwdDataAlgoWinograd;miopenConvolutionBwdDataAlgoGEMM:gemm,42,3192,1806336,MIOpenGEMM
64-112-112-7x7-3-224-224-32-3x3-2x2-1x1-0-NCHW-FP32-W=miopenConvolutionBwdWeightsAlgoDirect:ConvOclBwdWrW2<4>,84,1902,301056,miopenConvolutionBwdWeightsAlgoDirect;miopenConvolutionBwdWeightsAlgoGEMM:gemm,452,347,7375872,MIOpenGEMM
256-56-56-1x1-256-56-56-32-0x0-1x1-1x1-0-NCHW-FP32-B=miopenConvolutionBwdDataAlgoDirect:ConvAsm1x1U,4,50967,0,miopenConvolutionBwdDataAlgoDirect;miopenConvolutionBwdDataAlgoWinograd:ConvBinWinogradRxSf3x2,36,5755,0,miopenConvolutionBwdDataAlgoWinograd;miopenConvolutionBwdDataAlgoGEMM:gemm,93,4616,0,MIOpenGEMM
512-28-28-1x1-512-28-28-32-0x0-1x1-1x1-0-NCHW-FP32-B=miopenConvolutionBwdDataAlgoDirect:ConvAsm1x1U,8,91948,0,miopenConvolutionBwdDataAlgoDirect;miopenConvolutionBwdDataAlgoWinograd:ConvBinWinogradRxS,59,6309,0,miopenConvolutionBwdDataAlgoWinograd;miopenConvolutionBwdDataAlgoGEMM:gemm,265,965,0,MIOpenGEMM
512-14-14-1x1-1024-14-14-32-0x0-1x1-1x1-0-NCHW-FP32-F=miopenConvolutionFwdAlgoDirect:ConvAsm1x1U,4,60149,0,miopenConvolutionFwdAlgoDirect;miopenConvolutionFwdAlgoWinograd:ConvBinWinogradRxSf3x2,9,90637,0,miopenConvolutionFwdAlgoWinograd;miopenConvolutionFwdAlgoGEMM:GemmFwd1x1_0_1,36,1271,0,MIOpenGEMM
3-224-224-7x7-64-112-112-32-3x3-2x2-1x1-0-NCHW-FP32-F=miopenConvolutionFwdAlgoDirect:ConvAsm7x7c3h224w224k64u2v2p3q3f1,72,1696,0,miopenConvolutionFwdAlgoDirect;miopenConvolutionFwdAlgoWinograd:ConvBinWinogradRxS,111,286,0,miopenConvolutionFwdAlgoWinograd;miopenConvolutionFwdAlgoGEMM:GemmFwdRest,937,194,7375872,MIOpenGEMM
2048-7-7-3x3-2048-14-14-32-1x1-2x2-1x1-0-NCHW-FP32-W_g64=miopenConvolutionBwdWeightsAlgoDirect:ConvAsmBwdWrW3x3,1,22063,0,miopenConvolutionBwdWeightsAlgoDirect;miopenConvolutionBwdWeightsAlgoGEMM:gemm,362,25,3612672,MIOpenGEMM
1024-14-14-1x1-1024-14-14-32-0x0-1x1-1x1-0-NCHW-FP32-F=miopenConvolutionFwdAlgoDirect:ConvAsm1x1U,17,3689,0,miopenConvolutionFwdAlgoDirect;miopenConvolutionFwdAlgoWinograd:ConvBinWinogradRxSf3x2,67,3728,0,miopenConvolutionFwdAlgoWinograd;miopenConvolutionFwdAlgoGEMM:GemmFwd1x1_0_1,358,29,0,MIOpenGEMM
256-28-28-1x1-512-28-28-32-0x0-1x1-1x1-0-NCHW-FP32-B=miopenConvolutionBwdDataAlgoDirect:ConvAsm1x1U,2,45218,0,miopenConvolutionBwdDataAlgoDirect;miopenConvolutionBwdDataAlgoWinograd:ConvBinWinogradRxSf3x2,6,79301,0,miopenConvolutionBwdDataAlgoWinograd;miopenConvolutionBwdDataAlgoGEMM:gemm,9,80978,0,MIOpenGEMM
512-56-56-1x1-256-56-56-32-0x0-1x1-1x1-0-NCHW-FP32-B=miopenConvolutionBwdDataAlgoDirect:ConvAsm1x1U,24,544,0,miopenConvolutionBwdDataAlgoDirect;miopenConvolutionBwdDataAlgoWinograd:ConvBinWinogradRxSf3x2,67,4051,0,miopenConvolutionBwdDataAlgoWinograd;miopenConvolutionBwdDataAlgoGEMM:gemm,116,303,0,MIOpenGEMM
1024-14-14-3x3-1024-7-7-32-1x1-2x2-1x1-0-NCHW-FP32-F_g32=miopenConvolutionFwdAlgoImplicitGEMM:ConvHipImplicitGemmV4R1Fwd,1,55755,0,miopenConvolutionFwdAlgoImplicitGEMM;miopenConvolutionFwdAlgoDirect:ConvOclDirectFwd,4,14079,0,miopenConvolutionFwdAlgoDirect;miopenConvolutionFwdAlgoWinograd:ConvBinWinogradRxSf2x3,7,51902,0,miopenConvolutionFwdAlgoWinograd;miopenConvolutionFwdAlgoGEMM:GemmFwdRest,196,7,1806336,MIOpenGEMM
1024-7-7-3x3-1024-7-7-32-1x1-1x1-1x1-0-NCHW-FP32-W_g32=miopenConvolutionBwdWeightsAlgoDirect:ConvAsmBwdWrW3x3,0,51829,0,miopenConvolutionBwdWeightsAlgoDirect;miopenConvolutionBwdWeightsAlgoWinograd:ConvBinWinogradRxSf2x3,6,11452,0,miopenConvolutionBwdWeightsAlgoWinograd;miopenConvolutionBwdWeightsAlgoGEMM:gemm,134,422,1806336,MIOpenGEMM
2048-7-7-1x1-1024-7-7-32-0x0-1x1-1x1-0-NCHW-FP32-F=miopenConvolutionFwdAlgoDirect:ConvAsm1x1U,5,31943,0,miopenConvolutionFwdAlgoDirect;miopenConvolutionFwdAlgoImplicitGEMM:ConvHipImplicitGemmV4R1Fwd,8,21906,0,miopenConvolutionFwdAlgoImplicitGEMM;miopenConvolutionFwdAlgoGEMM:GemmFwd1x1_0_1,18,8499,0,MIOpenGEMM;miopenConvolutionFwdAlgoWinograd:ConvBinWinogradRxSf3x2,20,9089,0,miopenConvolutionFwdAlgoWinograd
64-56-56-1x1-128-56-56-32-0x0-1x1-1x1-0-NCHW-FP32-F=miopenConvolutionFwdAlgoDirect:ConvOclDirectFwd1x1,0,625744,0,miopenConvolutionFwdAlgoDirect;miopenConvolutionFwdAlgoGEMM:GemmFwd1x1_0_1,8,12041,0,MIOpenGEMM
512-28-28-1x1-256-56-56-32-0x0-2x2-1x1-0-NCHW-FP32-W=miopenConvolutionBwdWeightsAlgoDirect:ConvOclBwdWrW1x1,120,914,25690112,miopenConvolutionBwdWeightsAlgoDirect;miopenConvolutionBwdWeightsAlgoGEMM:gemm,1203,9,802816,MIOpenGEMM;miopenConvolutionBwdWeightsAlgoImplicitGEMM:ConvHipImplicitGemmV4R1WrW,2040,24,0,miopenConvolutionBwdWeightsAlgoImplicitGEMM
2048-7-7-3x3-2048-14-14-32-1x1-2x2-1x1-0-NCHW-FP32-B_g64=miopenConvolutionBwdDataAlgoDirect:ConvOclDirectFwd,7,32187,0,miopenConvolutionBwdDataAlgoDirect;miopenConvolutionBwdDataAlgoWinograd:ConvBinWinogradRxSf2x3,30,7177,0,miopenConvolutionBwdDataAlgoWinograd;miopenConvolutionBwdDataAlgoGEMM:gemm,507,244,3612672,MIOpenGEMM
2048-14-14-1x1-1024-14-14-32-0x0-1x1-1x1-0-NCHW-FP32-B=miopenConvolutionBwdDataAlgoDirect:ConvAsm1x1U,24,833,0,miopenConvolutionBwdDataAlgoDirect;miopenConvolutionBwdDataAlgoWinograd:ConvBinWinogradRxSf3x2,81,2882,0,miopenConvolutionBwdDataAlgoWinograd;miopenConvolutionBwdDataAlgoGEMM:gemm,95,3143,0,MIOpenGEMM
1024-7-7-3x3-1024-7-7-32-1x1-1x1-1x1-0-NCHW-FP32-B_g32=miopenConvolutionBwdDataAlgoDirect:ConvOclDirectFwd,0,970691,0,miopenConvolutionBwdDataAlgoDirect;miopenConvolutionBwdDataAlgoWinograd:ConvBinWinogradRxSf2x3,2,17828,0,miopenConvolutionBwdDataAlgoWinograd;miopenConvolutionBwdDataAlgoGEMM:gemm,98,266,1806336,MIOpenGEMM
512-28-28-1x1-256-56-56-32-0x0-2x2-1x1-0-NCHW-FP32-B=miopenConvolutionBwdDataAlgoDirect:ConvAsm1x1UV2,1,58784,0,miopenConvolutionBwdDataAlgoDirect;miopenConvolutionBwdDataAlgoGEMM:gemm,10,2954,77070336,MIOpenGEMM;miopenConvolutionBwdDataAlgoWinograd:ConvBinWinogradRxSf2x3,60,797,0,miopenConvolutionBwdDataAlgoWinograd
512-14-14-3x3-512-28-28-32-1x1-2x2-1x1-0-NCHW-FP32-W_g32=miopenConvolutionBwdWeightsAlgoDirect:ConvAsmBwdWrW3x3,0,568235,0,miopenConvolutionBwdWeightsAlgoDirect;miopenConvolutionBwdWeightsAlgoGEMM:gemm,202,757,3612672,MIOpenGEMM
256-56-56-1x1-256-56-56-32-0x0-1x1-1x1-0-NCHW-FP32-F=miopenConvolutionFwdAlgoDirect:ConvAsm1x1U,17,5947,0,miopenConvolutionFwdAlgoDirect;miopenConvolutionFwdAlgoWinograd:ConvBinWinogradRxSf3x2,51,5923,0,miopenConvolutionFwdAlgoWinograd;miopenConvolutionFwdAlgoGEMM:GemmFwd1x1_0_1,65,6622,0,MIOpenGEMM
256-56-56-1x1-64-56-56-32-0x0-1x1-1x1-0-NCHW-FP32-W=miopenConvolutionBwdWeightsAlgoDirect:ConvAsmBwdWrW1x1,2,1635,0,miopenConvolutionBwdWeightsAlgoDirect
2048-14-14-3x3-2048-7-7-32-1x1-2x2-1x1-0-NCHW-FP32-F_g64=miopenConvolutionFwdAlgoImplicitGEMM:ConvHipImplicitGemmV4R1Fwd,2,58317,0,miopenConvolutionFwdAlgoImplicitGEMM;miopenConvolutionFwdAlgoDirect:ConvOclDirectFwd,8,704,0,miopenConvolutionFwdAlgoDirect;miopenConvolutionFwdAlgoWinograd:ConvBinWinogradRxSf2x3,22,891,0,miopenConvolutionFwdAlgoWinograd;miopenConvolutionFwdAlgoGEMM:GemmFwdRest,343,436,3612672,MIOpenGEMM
2048-7-7-3x3-2048-14-14-32-1x1-2x2-1x1-0-NCHW-FP32-W_g32=miopenConvolutionBwdWeightsAlgoDirect:ConvAsmBwdWrW3x3,3,8271,0,miopenConvolutionBwdWeightsAlgoDirect;miopenConvolutionBwdWeightsAlgoImplicitGEMM:ConvHipImplicitGemmV4R1WrW,9,98451,0,miopenConvolutionBwdWeightsAlgoImplicitGEMM;miopenConvolutionBwdWeightsAlgoGEMM:gemm,186,446,3612672,MIOpenGEMM
256-56-56-1x1-128-56-56-32-0x0-1x1-1x1-0-NCHW-FP32-W=miopenConvolutionBwdWeightsAlgoDirect:ConvAsmBwdWrW1x1,6,2,0,miopenConvolutionBwdWeightsAlgoDirect
1024-14-14-1x1-512-28-28-32-0x0-2x2-1x1-0-NCHW-FP32-W=miopenConvolutionBwdWeightsAlgoDirect:ConvAsmBwdWrW1x1,6,16685,12845056,miopenConvolutionBwdWeightsAlgoDirect;miopenConvolutionBwdWeightsAlgoImplicitGEMM:ConvHipImplicitGemmV4R1WrW,29,841,0,miopenConvolutionBwdWeightsAlgoImplicitGEMM;miopenConvolutionBwdWeightsAlgoGEMM:gemm,86,2614,401408,MIOpenGEMM
512-28-28-1x1-256-28-28-32-0x0-1x1-1x1-0-NCHW-FP32-F=miopenConvolutionFwdAlgoDirect:ConvAsm1x1U,6,95596,0,miopenConvolutionFwdAlgoDirect;miopenConvolutionFwdAlgoWinograd:ConvBinWinogradRxSf3x2,16,2905,0,miopenConvolutionFwdAlgoWinograd;miopenConvolutionFwdAlgoGEMM:GemmFwd1x1_0_1,42,2478,0,MIOpenGEMM
1024-7-7-3x3-1024-7-7-32-1x1-1x1-1x1-0-NCHW-FP32-F_g32=miopenConvolutionFwdAlgoDirect:ConvOclDirectFwd,2,88378,0,miopenConvolutionFwdAlgoDirect;miopenConvolutionFwdAlgoImplicitGEMM:ConvHipImplicitGemmV4R1Fwd,3,19216,0,miopenConvolutionFwdAlgoImplicitGEMM;miopenConvolutionFwdAlgoWinograd:ConvBinWinogradRxSf2x3,15,4748,0,miopenConvolutionFwdAlgoWinograd;miopenConvolutionFwdAlgoGEMM:GemmFwdRest,354,652,1806336,MIOpenGEMM
512-14-14-3x3-512-28-28-32-1x1-2x2-1x1-0-NCHW-FP32-B_g32=miopenConvolutionBwdDataAlgoDirect:ConvOclDirectFwd,5,1085,0,miopenConvolutionBwdDataAlgoDirect;miopenConvolutionBwdDataAlgoWinograd:ConvBinWinogradRxSf2x3,7,86635,0,miopenConvolutionBwdDataAlgoWinograd;miopenConvolutionBwdDataAlgoGEMM:gemm,72,6055,3612672,MIOpenGEMM
256-56-56-1x1-512-56-56-32-0x0-1x1-1x1-0-NCHW-FP32-F=miopenConvolutionFwdAlgoDirect:ConvOclDirectFwd1x1,22,5646,0,miopenConvolutionFwdAlgoDirect;miopenConvolutionFwdAlgoWinograd:ConvBinWinogradRxSf3x2,79,7054,0,miopenConvolutionFwdAlgoWinograd;miopenConvolutionFwdAlgoGEMM:GemmFwd1x1_0_1,99,263,0,MIOpenGEMM
2048-7-7-3x3-2048-14-14-32-1x1-2x2-1x1-0-NCHW-FP32-B_g32=miopenConvolutionBwdDataAlgoDirect:ConvOclDirectFwd,13,2288,0,miopenConvolutionBwdDataAlgoDirect;miopenConvolutionBwdDataAlgoWinograd:ConvBinWinogradRxSf2x3,34,4137,0,miopenConvolutionBwdDataAlgoWinograd;miopenConvolutionBwdDataAlgoGEMM:gemm,279,2,3612672,MIOpenGEMM
256-56-56-1x1-512-28-28-32-0x0-2x2-1x1-0-NCHW-FP32-F=miopenConvolutionFwdAlgoDirect:ConvOclDirectFwd1x1,9,814,0,miopenConvolutionFwdAlgoDirect;miopenConvolutionFwdAlgoGEMM:GemmFwd1x1_0_2,102,534,77070336,MIOpenGEMM;miopenConvolutionFwdAlgoWinograd:ConvBinWinogradRxSf2x3,117,423,0,miopenConvolutionFwdAlgoWinograd
512-28-28-3x3-512-14-14-32-1x1-2x2-1x1-0-NCHW-FP32-F_g32=miopenConvolutionFwdAlgoImplicitGEMM:ConvHipImplicitGemmV4R1Fwd,8,63414,0,miopenConvolutionFwdAlgoImplicitGEMM;miopenConvolutionFwdAlgoDirect:ConvOclDirectFwd,9,95214,0,miopenConvolutionFwdAlgoDirect;miopenConvolutionFwdAlgoWinograd:ConvBinWinogradRxSf2x3,12,8978,0,miopenConvolutionFwdAlgoWinograd;miopenConvolutionFwdAlgoGEMM:GemmFwdRest,513,976,3612672,MIOpenGEMM
256-56-56-1x1-128-56-56-32-0x0-1x1-1x1-0-NCHW-FP32-B=miopenConvolutionBwdDataAlgoDirect:ConvAsm1x1U,3,5994,0,miopenConvolutionBwdDataAlgoDirect;miopenConvolutionBwdDataAlgoWinograd:ConvBinWinogradRxSf3x2,6,69726,0,miopenConvolutionBwdDataAlgoWinograd;miopenConvolutionBwdDataAlgoGEMM:gemm,15,2802,0,MIOpenGEMM
1024-14-14-1x1-512-28-28-32-0x0-2x2-1x1-0-NCHW-FP32-B=miopenConvolutionBwdDataAlgoDirect:ConvAsm1x1UV2,2,29971,0,miopenConvolutionBwdDataAlgoDirect;miopenConvolutionBwdDataAlgoGEMM:gemm,24,5175,38535168,MIOpenGEMM;miopenConvolutionBwdDataAlgoWinograd:ConvBinWinogradRxSf2x3,93,432,0,miopenConvolutionBwdDataAlgoWinograd
128-56-56-1x1-256-56-56-32-0x0-1x1-1x1-0-NCHW-FP32-W=miopenConvolutionBwdWeightsAlgoDirect:ConvAsmBwdWrW1x1,6,86408,0,miopenConvolutionBwdWeightsAlgoDirect
512-14-14-1x1-1024-14-14-32-0x0-1x1-1x1-0-NCHW-FP32-W=miopenConvolutionBwdWeightsAlgoDirect:ConvAsmBwdWrW1x1,2,59996,0,miopenConvolutionBwdWeightsAlgoDirect;miopenConvolutionBwdWeightsAlgoGEMM:gemm,15,3208,0,MIOpenGEMM;miopenConvolutionBwdWeightsAlgoWinograd:ConvBinWinogradRxSf2x3,35,3117,0,miopenConvolutionBwdWeightsAlgoWinograd
2048-14-14-3x3-2048-7-7-32-1x1-2x2-1x1-0-NCHW-FP32-F_g32=miopenConvolutionFwdAlgoImplicitGEMM:ConvHipImplicitGemmV4R1Fwd,4,49395,0,miopenConvolutionFwdAlgoImplicitGEMM;miopenConvolutionFwdAlgoWinograd:ConvBinWinogradRxSf2x3,13,3477,0,miopenConvolutionFwdAlgoWinograd;miopenConvolutionFwdAlgoDirect:ConvOclDirectFwd,21,7523,0,miopenConvolutionFwdAlgoDirect;miopenConvolutionFwdAlgoGEMM:GemmFwdRest,298,911,3612672,MIOpenGEMM
1024-14-14-3x3-1024-28-28-32-1x1-2x2-1x1-0-NCHW-FP32-W_g64=miopenConvolutionBwdWeightsAlgoDirect:ConvAsmBwdWrW3x3,1,1293,0,miopenConvolutionBwdWeightsAlgoDirect;miopenConvolutionBwdWeightsAlgoGEMM:gemm,428,939,7225344,MIOpenGEMM
1024-14-14-1x1-2048-14-14-32-0x0-1x1-1x1-0-NCHW-FP32-F=miopenConvolutionFwdAlgoDirect:ConvAsm1x1U,29,673,0,miopenConvolutionFwdAlgoDirect;miopenConvolutionFwdAlgoWinograd:ConvBinWinogradRxSf3x2,70,5793,0,miopenConvolutionFwdAlgoWinograd;miopenConvolutionFwdAlgoGEMM:GemmFwd1x1_0_1,105,363,0,MIOpenGEMM
256-56-56-3x3-256-56-56-32-1x1-1x1-1x1-0-NCHW-FP32-W_g32=miopenConvolutionBwdWeightsAlgoDirect:ConvAsmBwdWrW3x3,1,92304,0,miopenConvolutionBwdWeightsAlgoDirect;miopenConvolutionBwdWeightsAlgoGEMM:gemm,162,46,28901376,MIOpenGEMM;miopenConvolutionBwdWeightsAlgoWinograd:ConvBinWinogradRxSf2x3,239,211,0,miopenConvolutionBwdWeightsAlgoWinograd
512-28-28-1x1-1024-14-14-32-0x0-2x2-1x1-0-NCHW-FP32-F=miopenConvolutionFwdAlgoDirect:ConvAsm1x1UV2,8,55371,0,miopenConvolutionFwdAlgoDirect;miopenConvolutionFwdAlgoWinograd:ConvBinWinogradRxSf2x3,83,978,0,miopenConvolutionFwdAlgoWinograd
1024-14-14-3x3-1024-28-28-32-1x1-2x2-1x1-0-NCHW-FP32-B_g64=miopenConvolutionBwdDataAlgoDirect:ConvOclDirectFwd,4,1726,0,miopenConvolutionBwdDataAlgoDirect;miopenConvolutionBwdDataAlgoWinograd:ConvBinWinogradRxSf2x3,7,71067,0,miopenConvolutionBwdDataAlgoWinograd;miopenConvolutionBwdDataAlgoGEMM:gemm,166,627,7225344,MIOpenGEMM
128-56-56-1x1-256-56-56-32-0x0-1x1-1x1-0-NCHW-FP32-F=miopenConvolutionFwdAlgoDirect:ConvAsm1x1U,3,7561,0,miopenConvolutionFwdAlgoDirect;miopenConvolutionFwdAlgoWinograd:ConvBinWinogradRxSf3x2,12,4702,0,miopenConvolutionFwdAlgoWinograd;miopenConvolutionFwdAlgoGEMM:GemmFwd1x1_0_1,14,2563,0,MIOpenGEMM
128-56-56-1x1-256-56-56-32-0x0-1x1-1x1-0-NCHW-FP32-B=miopenConvolutionBwdDataAlgoDirect:ConvAsm1x1U,1,61928,0,miopenConvolutionBwdDataAlgoDirect;miopenConvolutionBwdDataAlgoWinograd:ConvBinWinogradRxSf3x2,9,94239,0,miopenConvolutionBwdDataAlgoWinograd;miopenConvolutionBwdDataAlgoGEMM:gemm,15,1022,0,MIOpenGEMM
512-14-14-1x1-1024-14-14-32-0x0-1x1-1x1-0-NCHW-FP32-B=miopenConvolutionBwdDataAlgoDirect:ConvAsm1x1U,4,13774,0,miopenConvolutionBwdDataAlgoDirect;miopenConvolutionBwdDataAlgoWinograd:ConvBinWinogradRxSf3x2,8,91891,0,miopenConvolutionBwdDataAlgoWinograd;miopenConvolutionBwdDataAlgoGEMM:gemm,16,5106,0,MIOpenGEMM
256-56-56-3x3-256-56-56-32-1x1-1x1-1x1-0-NCHW-FP32-B_g32=miopenConvolutionBwdDataAlgoDirect:ConvAsm3x3U,1,17414,0,miopenConvolutionBwdDataAlgoDirect;miopenConvolutionBwdDataAlgoWinograd:ConvBinWinogradRxSf2x3,21,5894,0,miopenConvolutionBwdDataAlgoWinograd;miopenConvolutionBwdDataAlgoGEMM:gemm,248,761,28901376,MIOpenGEMM
1024-14-14-3x3-1024-28-28-32-1x1-2x2-1x1-0-NCHW-FP32-W_g32=miopenConvolutionBwdWeightsAlgoDirect:ConvAsmBwdWrW3x3,3,70915,0,miopenConvolutionBwdWeightsAlgoDirect;miopenConvolutionBwdWeightsAlgoGEMM:gemm,434,567,7225344,MIOpenGEMM
2048-7-7-3x3-2048-7-7-32-1x1-1x1-1x1-0-NCHW-FP32-W_g64=miopenConvolutionBwdWeightsAlgoDirect:ConvAsmBwdWrW3x3,2,87648,0,miopenConvolutionBwdWeightsAlgoDirect;miopenConvolutionBwdWeightsAlgoWinograd:ConvBinWinogradRxSf2x3,35,4364,0,miopenConvolutionBwdWeightsAlgoWinograd;miopenConvolutionBwdWeightsAlgoGEMM:gemm,344,193,3612672,MIOpenGEMM
512-28-28-3x3-512-56-56-32-1x1-2x2-1x1-0-NCHW-FP32-W_g64=miopenConvolutionBwdWeightsAlgoDirect:ConvAsmBwdWrW3x3,1,6722,0,miopenConvolutionBwdWeightsAlgoDirect;miopenConvolutionBwdWeightsAlgoGEMM:gemm,333,475,14450688,MIOpenGEMM
1024-28-28-3x3-1024-14-14-32-1x1-2x2-1x1-0-NCHW-FP32-F_g64=miopenConvolutionFwdAlgoImplicitGEMM:ConvHipImplicitGemmV4R1Fwd,3,64147,0,miopenConvolutionFwdAlgoImplicitGEMM;miopenConvolutionFwdAlgoDirect:ConvOclDirectFwd,8,52211,0,miopenConvolutionFwdAlgoDirect;miopenConvolutionFwdAlgoWinograd:ConvBinWinogradRxSf2x3,9,94113,0,miopenConvolutionFwdAlgoWinograd;miopenConvolutionFwdAlgoGEMM:GemmFwdRest,288,524,7225344,MIOpenGEMM
256-56-56-3x3-256-56-56-32-1x1-1x1-1x1-0-NCHW-FP32-F_g32=miopenConvolutionFwdAlgoDirect:ConvAsm3x3U,4,18513,0,miopenConvolutionFwdAlgoDirect;miopenConvolutionFwdAlgoWinograd:ConvBinWinogradRxSf2x3,42,6129,0,miopenConvolutionFwdAlgoWinograd;miopenConvolutionFwdAlgoGEMM:GemmFwdRest,534,444,28901376,MIOpenGEMM
1024-14-14-3x3-1024-14-14-32-1x1-1x1-1x1-0-NCHW-FP32-W_g64=miopenConvolutionBwdWeightsAlgoDirect:ConvAsmBwdWrW3x3,0,775577,0,miopenConvolutionBwdWeightsAlgoDirect;miopenConvolutionBwdWeightsAlgoWinograd:ConvBinWinogradRxSf2x3,12,3769,0,miopenConvolutionBwdWeightsAlgoWinograd;miopenConvolutionBwdWeightsAlgoGEMM:gemm,334,292,7225344,MIOpenGEMM
1024-14-14-3x3-1024-28-28-32-1x1-2x2-1x1-0-NCHW-FP32-B_g32=miopenConvolutionBwdDataAlgoDirect:ConvOclDirectFwd,19,2215,0,miopenConvolutionBwdDataAlgoDirect;miopenConvolutionBwdDataAlgoWinograd:ConvBinWinogradRxSf2x3,25,1401,0,miopenConvolutionBwdDataAlgoWinograd;miopenConvolutionBwdDataAlgoGEMM:gemm,260,821,7225344,MIOpenGEMM
256-56-56-1x1-128-56-56-32-0x0-1x1-1x1-0-NCHW-FP32-F=miopenConvolutionFwdAlgoDirect:ConvOclDirectFwd1x1,3,44767,0,miopenConvolutionFwdAlgoDirect;miopenConvolutionFwdAlgoGEMM:GemmFwd1x1_0_1,15,1391,0,MIOpenGEMM
512-14-14-3x3-512-14-14-32-1x1-1x1-1x1-0-NCHW-FP32-W_g32=miopenConvolutionBwdWeightsAlgoDirect:ConvAsmBwdWrW3x3,0,457259,0,miopenConvolutionBwdWeightsAlgoDirect;miopenConvolutionBwdWeightsAlgoWinograd:ConvBinWinogradRxSf2x3,13,7648,0,miopenConvolutionBwdWeightsAlgoWinograd;miopenConvolutionBwdWeightsAlgoGEMM:gemm,125,251,3612672,MIOpenGEMM
256-28-28-3x3-256-56-56-32-1x1-2x2-1x1-0-NCHW-FP32-W_g32=miopenConvolutionBwdWeightsAlgoDirect:ConvAsmBwdWrW3x3,0,656856,0,miopenConvolutionBwdWeightsAlgoDirect;miopenConvolutionBwdWeightsAlgoGEMM:gemm,183,74,7225344,MIOpenGEMM
2048-7-7-3x3-2048-7-7-32-1x1-1x1-1x1-0-NCHW-FP32-B_g64=miopenConvolutionBwdDataAlgoDirect:ConvOclDirectFwd,4,396,0,miopenConvolutionBwdDataAlgoDirect;miopenConvolutionBwdDataAlgoWinograd:ConvBinWinogradRxSf2x3,10,5843,0,miopenConvolutionBwdDataAlgoWinograd;miopenConvolutionBwdDataAlgoGEMM:gemm,269,276,3612672,MIOpenGEMM
128-56-56-3x3-128-56-56-32-1x1-1x1-1x1-0-NCHW-FP32-W_g32=miopenConvolutionBwdWeightsAlgoDirect:ConvAsmBwdWrW3x3,0,669336,0,miopenConvolutionBwdWeightsAlgoDirect;miopenConvolutionBwdWeightsAlgoWinograd:ConvBinWinogradRxSf2x3,88,2113,0,miopenConvolutionBwdWeightsAlgoWinograd;miopenConvolutionBwdWeightsAlgoGEMM:gemm,996,22,14450688,MIOpenGEMM
512-28-28-3x3-512-56-56-32-1x1-2x2-1x1-0-NCHW-FP32-B_g64=miopenConvolutionBwdDataAlgoDirect:ConvOclDirectFwd,9,26874,0,miopenConvolutionBwdDataAlgoDirect;miopenConvolutionBwdDataAlgoWinograd:ConvBinWinogradRxSf2x3,18,8499,0,miopenConvolutionBwdDataAlgoWinograd;miopenConvolutionBwdDataAlgoGEMM:gemm,574,93,14450688,MIOpenGEMM
512-28-28-3x3-512-56-56-32-1x1-2x2-1x1-0-NCHW-FP32-W_g32=miopenConvolutionBwdWeightsAlgoDirect:ConvAsmBwdWrW3x3,12,979,0,miopenConvolutionBwdWeightsAlgoDirect;miopenConvolutionBwdWeightsAlgoGEMM:gemm,452,339,14450688,MIOpenGEMM
1024-14-14-3x3-1024-14-14-32-1x1-1x1-1x1-0-NCHW-FP32-B_g64=miopenConvolutionBwdDataAlgoDirect:ConvOclDirectFwd,2,68744,0,miopenConvolutionBwdDataAlgoDirect;miopenConvolutionBwdDataAlgoWinograd:ConvBinWinogradRxSf2x3,16,2897,0,miopenConvolutionBwdDataAlgoWinograd;miopenConvolutionBwdDataAlgoGEMM:gemm,348,413,7225344,MIOpenGEMM
1024-28-28-1x1-512-28-28-32-0x0-1x1-1x1-0-NCHW-FP32-W=miopenConvolutionBwdWeightsAlgoDirect:ConvAsmBwdWrW1x1,23,409,0,miopenConvolutionBwdWeightsAlgoDirect;miopenConvolutionBwdWeightsAlgoGEMM:gemm,106,201,0,MIOpenGEMM;miopenConvolutionBwdWeightsAlgoWinograd:ConvBinWinogradRxSf2x3,204,312,0,miopenConvolutionBwdWeightsAlgoWinograd
256-13-13-3x3-384-13-13-512-1x1-1x1-1x1-0-NCHW-FP32-B=miopenConvolutionBwdDataAlgoWinograd:ConvBinWinograd3x3U,241,638,0,miopenConvolutionBwdDataAlgoWinograd
256-28-28-3x3-256-56-56-32-1x1-2x2-1x1-0-NCHW-FP32-B_g32=miopenConvolutionBwdDataAlgoDirect:ConvOclDirectFwd,3,88896,0,miopenConvolutionBwdDataAlgoDirect;miopenConvolutionBwdDataAlgoWinograd:ConvBinWinogradRxSf2x3,8,91035,0,miopenConvolutionBwdDataAlgoWinograd;miopenConvolutionBwdDataAlgoGEMM:gemm,100,126,7225344,MIOpenGEMM
512-14-14-3x3-512-14-14-32-1x1-1x1-1x1-0-NCHW-FP32-B_g32=miopenConvolutionBwdDataAlgoDirect:ConvOclDirectFwd,0,65565,0,miopenConvolutionBwdDataAlgoDirect;miopenConvolutionBwdDataAlgoWinograd:ConvBinWinogradRxSf2x3,4,10827,0,miopenConvolutionBwdDataAlgoWinograd;miopenConvolutionBwdDataAlgoGEMM:gemm,95,2321,3612672,MIOpenGEMM
512-28-28-3x3-512-56-56-32-1x1-2x2-1x1-0-NCHW-FP32-B_g32=miopenConvolutionBwdDataAlgoDirect:ConvOclDirectFwd,27,3125,0,miopenConvolutionBwdDataAlgoDirect;miopenConvolutionBwdDataAlgoWinograd:ConvBinWinogradRxSf2x3,28,5414,0,miopenConvolutionBwdDataAlgoWinograd;miopenConvolutionBwdDataAlgoGEMM:gemm,645,255,14450688,MIOpenGEMM
512-7-7-1x1-1024-14-14-128-0x0-2x2-1x1-0-NCHW-FP32-W=miopenConvolutionBwdWeightsAlgoDirect:ConvAsmBwdWrW1x1,34,5173,25690112,miopenConvolutionBwdWeightsAlgoDirect;miopenConvolutionBwdWeightsAlgoImplicitGEMM:ConvHipImplicitGemmV4R1WrW,57,886,0,miopenConvolutionBwdWeightsAlgoImplicitGEMM;miopenConvolutionBwdWeightsAlgoGEMM:gemm,978,363,200704,MIOpenGEMM
512-28-28-1x1-256-28-28-32-0x0-1x1-1x1-0-NCHW-FP32-W=miopenConvolutionBwdWeightsAlgoDirect:ConvAsmBwdWrW1x1,4,37552,0,miopenConvolutionBwdWeightsAlgoDirect;miopenConvolutionBwdWeightsAlgoGEMM:gemm,34,2079,0,MIOpenGEMM;miopenConvolutionBwdWeightsAlgoWinograd:ConvBinWinogradRxSf2x3,39,8898,0,miopenConvolutionBwdWeightsAlgoWinograd
384-13-13-3x3-256-13-13-512-1x1-1x1-1x1-0-NCHW-FP32-F=miopenConvolutionFwdAlgoWinograd:ConvBinWinogradRxS,240,864,0,miopenConvolutionFwdAlgoWinograd
1024-14-14-3x3-1024-14-14-32-1x1-1x1-1x1-0-NCHW-FP32-W_g32=miopenConvolutionBwdWeightsAlgoDirect:ConvAsmBwdWrW3x3,2,5056,0,miopenConvolutionBwdWeightsAlgoDirect;miopenConvolutionBwdWeightsAlgoWinograd:ConvBinWinogradRxSf2x3,27,1086,0,miopenConvolutionBwdWeightsAlgoWinograd;miopenConvolutionBwdWeightsAlgoGEMM:gemm,1228,5,7225344,MIOpenGEMM
512-56-56-3x3-512-28-28-32-1x1-2x2-1x1-0-NCHW-FP32-F_g64=miopenConvolutionFwdAlgoWinograd:ConvBinWinogradRxSf2x3,35,6757,0,miopenConvolutionFwdAlgoWinograd;miopenConvolutionFwdAlgoDirect:ConvOclDirectFwd,54,4483,0,miopenConvolutionFwdAlgoDirect;miopenConvolutionFwdAlgoGEMM:GemmFwdRest,650,69,14450688,MIOpenGEMM
512-56-56-3x3-512-28-28-32-1x1-2x2-1x1-0-NCHW-FP32-F_g32=miopenConvolutionFwdAlgoImplicitGEMM:ConvHipImplicitGemmV4R1Fwd,15,1322,0,miopenConvolutionFwdAlgoImplicitGEMM;miopenConvolutionFwdAlgoWinograd:ConvBinWinogradRxSf2x3,27,3735,0,miopenConvolutionFwdAlgoWinograd;miopenConvolutionFwdAlgoDirect:ConvOclDirectFwd,34,9005,0,miopenConvolutionFwdAlgoDirect;miopenConvolutionFwdAlgoGEMM:GemmFwdRest,785,921,14450688,MIOpenGEMM
1024-14-14-3x3-1024-14-14-32-1x1-1x1-1x1-0-NCHW-FP32-F_g64=miopenConvolutionFwdAlgoDirect:ConvOclDirectFwd,1,34946,0,miopenConvolutionFwdAlgoDirect;miopenConvolutionFwdAlgoImplicitGEMM:ConvHipImplicitGemmV4R1Fwd,2,31929,0,miopenConvolutionFwdAlgoImplicitGEMM;miopenConvolutionFwdAlgoWinograd:ConvBinWinogradRxSf2x3,5,54621,0,miopenConvolutionFwdAlgoWinograd;miopenConvolutionFwdAlgoGEMM:GemmFwdRest,470,403,7225344,MIOpenGEMM
2048-7-7-3x3-2048-7-7-32-1x1-1x1-1x1-0-NCHW-FP32-F_g64=miopenConvolutionFwdAlgoDirect:ConvOclDirectFwd,2,88922,0,miopenConvolutionFwdAlgoDirect;miopenConvolutionFwdAlgoWinograd:ConvBinWinogradRxSf2x3,7,73821,0,miopenConvolutionFwdAlgoWinograd;miopenConvolutionFwdAlgoImplicitGEMM:ConvHipImplicitGemmV4R1Fwd,8,46856,0,miopenConvolutionFwdAlgoImplicitGEMM;miopenConvolutionFwdAlgoGEMM:GemmFwdRest,853,774,3612672,MIOpenGEMM
512-14-14-3x3-512-14-14-32-1x1-1x1-1x1-0-NCHW-FP32-F_g32=miopenConvolutionFwdAlgoDirect:ConvAsm3x3U,1,38791,0,miopenConvolutionFwdAlgoDirect;miopenConvolutionFwdAlgoImplicitGEMM:ConvHipImplicitGemmV4R1Fwd,2,18181,0,miopenConvolutionFwdAlgoImplicitGEMM;miopenConvolutionFwdAlgoWinograd:ConvBinWinogradRxSf2x3,16,272,0,miopenConvolutionFwdAlgoWinograd;miopenConvolutionFwdAlgoGEMM:GemmFwdRest,605,399,3612672,MIOpenGEMM
384-13-13-3x3-384-13-13-512-1x1-1x1-1x1-0-NCHW-FP32-B=miopenConvolutionBwdDataAlgoWinograd:ConvBinWinograd3x3U,334,967,0,miopenConvolutionBwdDataAlgoWinograd
512-7-7-1x1-1024-14-14-128-0x0-2x2-1x1-0-NCHW-FP32-B=miopenConvolutionBwdDataAlgoDirect:ConvAsm1x1U,5,25513,25690112,miopenConvolutionBwdDataAlgoDirect;miopenConvolutionBwdDataAlgoGEMM:gemm,481,579,38535168,MIOpenGEMM
1024-14-14-3x3-1024-14-14-32-1x1-1x1-1x1-0-NCHW-FP32-B_g32=miopenConvolutionBwdDataAlgoDirect:ConvOclDirectFwd,5,92701,0,miopenConvolutionBwdDataAlgoDirect;miopenConvolutionBwdDataAlgoWinograd:ConvBinWinogradRxSf2x3,11,705,0,miopenConvolutionBwdDataAlgoWinograd;miopenConvolutionBwdDataAlgoGEMM:gemm,449,1,7225344,MIOpenGEMM
1024-28-28-1x1-512-28-28-32-0x0-1x1-1x1-0-NCHW-FP32-B=miopenConvolutionBwdDataAlgoDirect:ConvAsm1x1U,33,8687,0,miopenConvolutionBwdDataAlgoDirect;miopenConvolutionBwdDataAlgoWinograd:ConvBinWinogradRxSf3x2,120,582,0,miopenConvolutionBwdDataAlgoWinograd;miopenConvolutionBwdDataAlgoGEMM:gemm,151,619,0,MIOpenGEMM
64-27-27-5x5-192-27-27-512-2x2-1x1-1x1-0-NCHW-FP32-F=miopenConvolutionFwdAlgoFFT:fft,323,41,856195072,miopenConvolutionFwdAlgoFFT;miopenConvolutionFwdAlgoImplicitGEMM:ConvHipImplicitGemmV4R1Fwd,592,3,0,miopenConvolutionFwdAlgoImplicitGEMM;miopenConvolutionFwdAlgoWinograd:ConvBinWinogradRxSf2x3,725,91,0,miopenConvolutionFwdAlgoWinograd;miopenConvolutionFwdAlgoGEMM:GemmFwdRest,1275,86,4665600,MIOpenGEMM;miopenConvolutionFwdAlgoDirect:ConvOclDirectFwd,1849,29,0,miopenConvolutionFwdAlgoDirect
1024-14-14-3x3-1024-14-14-32-1x1-1x1-1x1-0-NCHW-FP32-F_g32=miopenConvolutionFwdAlgoWinograd:ConvBinWinogradRxSf2x3,1,37997,0,miopenConvolutionFwdAlgoWinograd;miopenConvolutionFwdAlgoDirect:ConvOclDirectFwd,1,90403,0,miopenConvolutionFwdAlgoDirect;miopenConvolutionFwdAlgoImplicitGEMM:ConvHipImplicitGemmV4R1Fwd,2,37367,0,miopenConvolutionFwdAlgoImplicitGEMM;miopenConvolutionFwdAlgoGEMM:GemmFwdRest,52,5803,7225344,MIOpenGEMM
512-28-28-3x3-512-28-28-32-1x1-1x1-1x1-0-NCHW-FP32-W_g64=miopenConvolutionBwdWeightsAlgoDirect:ConvAsmBwdWrW3x3,0,999215,0,miopenConvolutionBwdWeightsAlgoDirect;miopenConvolutionBwdWeightsAlgoWinograd:ConvBinWinogradRxSf2x3,62,498,0,miopenConvolutionBwdWeightsAlgoWinograd;miopenConvolutionBwdWeightsAlgoGEMM:gemm,1239,3,14450688,MIOpenGEMM
512-28-28-1x1-256-28-28-32-0x0-1x1-1x1-0-NCHW-FP32-B=miopenConvolutionBwdDataAlgoDirect:ConvAsm1x1U,3,46601,0,miopenConvolutionBwdDataAlgoDirect;miopenConvolutionBwdDataAlgoWinograd:ConvBinWinogradRxSf3x2,12,456,0,miopenConvolutionBwdDataAlgoWinograd;miopenConvolutionBwdDataAlgoGEMM:gemm,31,3533,0,MIOpenGEMM
512-28-28-3x3-512-28-28-32-1x1-1x1-1x1-0-NCHW-FP32-W_g32=miopenConvolutionBwdWeightsAlgoDirect:ConvAsmBwdWrW3x3,2,54067,0,miopenConvolutionBwdWeightsAlgoDirect;miopenConvolutionBwdWeightsAlgoWinograd:ConvBinWinogradRxSf2x3,75,1682,0,miopenConvolutionBwdWeightsAlgoWinograd;miopenConvolutionBwdWeightsAlgoGEMM:gemm,1638,38,14450688,MIOpenGEMM
512-7-7-3x3-512-7-7-128-1x1-1x1-1x1-0-NCHW-FP32-B=miopenConvolutionBwdDataAlgoWinograd:ConvBinWinogradRxS,3,49841,0,miopenConvolutionBwdDataAlgoWinograd
512-28-28-3x3-512-28-28-32-1x1-1x1-1x1-0-NCHW-FP32-B_g32=miopenConvolutionBwdDataAlgoDirect:ConvAsm3x3U,5,15312,0,miopenConvolutionBwdDataAlgoDirect;miopenConvolutionBwdDataAlgoWinograd:ConvBinWinogradRxSf2x3,78,2418,0,miopenConvolutionBwdDataAlgoWinograd;miopenConvolutionBwdDataAlgoGEMM:gemm,1268,6,14450688,MIOpenGEMM
1024-14-14-1x1-512-7-7-128-0x0-2x2-1x1-0-NCHW-FP32-F=miopenConvolutionFwdAlgoDirect:ConvAsm1x1U,16,2252,25690112,miopenConvolutionFwdAlgoDirect;miopenConvolutionFwdAlgoGEMM:GemmFwd1x1_0_2,50,4287,38535168,MIOpenGEMM;miopenConvolutionFwdAlgoWinograd:ConvBinWinogradRxS,191,771,0,miopenConvolutionFwdAlgoWinograd
512-7-7-3x3-512-7-7-128-1x1-1x1-1x1-0-NCHW-FP32-F=miopenConvolutionFwdAlgoWinograd:ConvBinWinograd3x3U,5,61717,0,miopenConvolutionFwdAlgoWinograd
512-28-28-3x3-512-28-28-32-1x1-1x1-1x1-0-NCHW-FP32-F_g32=miopenConvolutionFwdAlgoDirect:ConvAsm3x3U,14,292,0,miopenConvolutionFwdAlgoDirect;miopenConvolutionFwdAlgoImplicitGEMM:ConvHipImplicitGemmV4R1Fwd,37,9154,0,miopenConvolutionFwdAlgoImplicitGEMM;miopenConvolutionFwdAlgoWinograd:ConvBinWinogradRxSf2x3,141,893,0,miopenConvolutionFwdAlgoWinograd;miopenConvolutionFwdAlgoGEMM:GemmFwdRest,281,84,14450688,MIOpenGEMM
64-55-55-11x11-3-227-227-512-0x0-4x4-1x1-0-NCHW-FP32-W=miopenConvolutionBwdWeightsAlgoGEMM:gemm,434,857,4392300,MIOpenGEMM;miopenConvolutionBwdWeightsAlgoDirect:ConvOclBwdWrW2<2>,478,122,23789568,miopenConvolutionBwdWeightsAlgoDirect
2048-7-7-3x3-2048-7-7-32-1x1-1x1-1x1-0-NCHW-FP32-W_g32=miopenConvolutionBwdWeightsAlgoDirect:ConvAsmBwdWrW3x3,2,2237,0,miopenConvolutionBwdWeightsAlgoDirect;miopenConvolutionBwdWeightsAlgoImplicitGEMM:ConvHipImplicitGemmV4R1WrW,14,34,0,miopenConvolutionBwdWeightsAlgoImplicitGEMM;miopenConvolutionBwdWeightsAlgoWinograd:ConvBinWinogradRxSf2x3,41,6109,0,miopenConvolutionBwdWeightsAlgoWinograd;miopenConvolutionBwdWeightsAlgoGEMM:gemm,714,175,3612672,MIOpenGEMM
256-28-28-1x1-512-28-28-32-0x0-1x1-1x1-0-NCHW-FP32-F=miopenConvolutionFwdAlgoDirect:ConvOclDirectFwd1x1,4,26867,0,miopenConvolutionFwdAlgoDirect;miopenConvolutionFwdAlgoGEMM:GemmFwd1x1_0_1,41,146,0,MIOpenGEMM
128-28-28-3x3-128-28-28-128-1x1-1x1-1x1-0-NCHW-FP32-F=miopenConvolutionFwdAlgoWinograd:ConvBinWinogradRxSf3x2,28,6272,0,miopenConvolutionFwdAlgoWinograd
512-28-28-1x1-256-56-56-128-0x0-2x2-1x1-0-NCHW-FP32-B=miopenConvolutionBwdDataAlgoDirect:ConvOclDirectFwd1x1,485,275,0,miopenConvolutionBwdDataAlgoDirect;miopenConvolutionBwdDataAlgoWinograd:ConvBinWinogradRxSf2x3,1981,72,0,miopenConvolutionBwdDataAlgoWinograd;miopenConvolutionBwdDataAlgoGEMM:gemm,2206,31,308281344,MIOpenGEMM
3-227-227-11x11-64-55-55-512-0x0-4x4-1x1-0-NCHW-FP32-F=miopenConvolutionFwdAlgoDirect:ConvOclDirectFwd11x11,797,572,0,miopenConvolutionFwdAlgoDirect;miopenConvolutionFwdAlgoGEMM:GemmFwdRest,3746,83,4392300,MIOpenGEMM
256-14-14-1x1-1024-14-14-128-0x0-1x1-1x1-0-NCHW-FP32-F=miopenConvolutionFwdAlgoDirect:ConvOclDirectFwd1x1,82,5943,0,miopenConvolutionFwdAlgoDirect;miopenConvolutionFwdAlgoGEMM:GemmFwd1x1_0_1,522,78,0,MIOpenGEMM
256-56-56-3x3-256-56-56-32-1x1-1x1-1x1-0-NCHW-FP32-W_g64=miopenConvolutionBwdWeightsAlgoDirect:ConvAsmBwdWrW3x3,1,33167,0,miopenConvolutionBwdWeightsAlgoDirect;miopenConvolutionBwdWeightsAlgoWinograd:ConvBinWinogradRxSf2x3,681,604,0,miopenConvolutionBwdWeightsAlgoWinograd;miopenConvolutionBwdWeightsAlgoGEMM:gemm,3976,4,28901376,MIOpenGEMM
512-28-28-1x1-128-28-28-128-0x0-1x1-1x1-0-NCHW-FP32-F=miopenConvolutionFwdAlgoDirect:ConvAsm1x1U,10,5917,0,miopenConvolutionFwdAlgoDirect;miopenConvolutionFwdAlgoWinograd:ConvBinWinogradRxSf3x2,45,1361,0,miopenConvolutionFwdAlgoWinograd;miopenConvolutionFwdAlgoGEMM:GemmFwd1x1_0_1,141,4,0,MIOpenGEMM
256-56-56-1x1-128-28-28-128-0x0-2x2-1x1-0-NCHW-FP32-F=miopenConvolutionFwdAlgoDirect:ConvAsm1x1U,9,93574,102760448,miopenConvolutionFwdAlgoDirect;miopenConvolutionFwdAlgoWinograd:ConvBinWinogradRxSf2x3,267,673,0,miopenConvolutionFwdAlgoWinograd;miopenConvolutionFwdAlgoGEMM:GemmFwd1x1_0_2,717,711,154140672,MIOpenGEMM
128-28-28-3x3-128-28-28-128-1x1-1x1-1x1-0-NCHW-FP32-B=miopenConvolutionBwdDataAlgoWinograd:ConvBinWinogradRxS,3,53327,0,miopenConvolutionBwdDataAlgoWinograd
1024-14-14-1x1-512-28-28-128-0x0-2x2-1x1-0-NCHW-FP32-W=miopenConvolutionBwdWeightsAlgoImplicitGEMM:ConvHipImplicitGemmV4R1WrW,266,945,0,miopenConvolutionBwdWeightsAlgoImplicitGEMM;miopenConvolutionBwdWeightsAlgoDirect:ConvAsmBwdWrW1x1,1686,6,51380224,miopenConvolutionBwdWeightsAlgoDirect;miopenConvolutionBwdWeightsAlgoGEMM:gemm,2791,37,401408,MIOpenGEMM
256-14-14-3x3-256-14-14-128-1x1-1x1-1x1-0-NCHW-FP32-B=miopenConvolutionBwdDataAlgoWinograd:ConvBinWinogradRxS,3,47757,0,miopenConvolutionBwdDataAlgoWinograd
2048-7-7-1x1-512-7-7-128-0x0-1x1-1x1-0-NCHW-FP32-W=miopenConvolutionBwdWeightsAlgoDirect:ConvAsmBwdWrW1x1,28,6868,0,miopenConvolutionBwdWeightsAlgoDirect;miopenConvolutionBwdWeightsAlgoWinograd:ConvBinWinogradRxSf2x3,155,134,0,miopenConvolutionBwdWeightsAlgoWinograd;miopenConvolutionBwdWeightsAlgoGEMM:gemm,596,68,0,MIOpenGEMM
256-14-14-1x1-1024-14-14-128-0x0-1x1-1x1-0-NCHW-FP32-W=miopenConvolutionBwdWeightsAlgoDirect:ConvAsmBwdWrW1x1,55,8275,0,miopenConvolutionBwdWeightsAlgoDirect;miopenConvolutionBwdWeightsAlgoWinograd:ConvBinWinogradRxSf2x3,256,108,0,miopenConvolutionBwdWeightsAlgoWinograd;miopenConvolutionBwdWeightsAlgoGEMM:gemm,865,342,0,MIOpenGEMM
64-56-56-3x3-64-56-56-128-1x1-1x1-1x1-0-NCHW-FP32-F=miopenConvolutionFwdAlgoWinograd:ConvBinWinogradRxSf2x3,3,61305,0,miopenConvolutionFwdAlgoWinograd
384-13-13-3x3-192-13-13-512-1x1-1x1-1x1-0-NCHW-FP32-W=miopenConvolutionBwdWeightsAlgoWinograd:ConvBinWinogradRxS,27,882,0,miopenConvolutionBwdWeightsAlgoWinograd;miopenConvolutionBwdWeightsAlgoImplicitGEMM:ConvHipImplicitGemmV4R1WrW,32,8456,0,miopenConvolutionBwdWeightsAlgoImplicitGEMM;miopenConvolutionBwdWeightsAlgoDirect:ConvAsmBwdWrW3x3,41,2596,0,miopenConvolutionBwdWeightsAlgoDirect;miopenConvolutionBwdWeightsAlgoGEMM:gemm,44,8002,1168128,MIOpenGEMM
64-56-56-3x3-64-56-56-128-1x1-1x1-1x1-0-NCHW-FP32-W=miopenConvolutionBwdWeightsAlgoDirect:ConvAsmBwdWrW3x3,78,88,0,miopenConvolutionBwdWeightsAlgoDirect;miopenConvolutionBwdWeightsAlgoWinograd:ConvBinWinogradRxSf2x3,329,254,0,miopenConvolutionBwdWeightsAlgoWinograd;miopenConvolutionBwdWeightsAlgoImplicitGEMM:ConvHipImplicitGemmV4R1WrW,1222,63,0,miopenConvolutionBwdWeightsAlgoImplicitGEMM;miopenConvolutionBwdWeightsAlgoGEMM:gemm,3046,87,7225344,MIOpenGEMM
256-56-56-1x1-512-28-28-128-0x0-2x2-1x1-0-NCHW-FP32-F=miopenConvolutionFwdAlgoDirect:ConvAsm1x1U,61,8408,102760448,miopenConvolutionFwdAlgoDirect;miopenConvolutionFwdAlgoGEMM:GemmFwd1x1_0_2,813,339,308281344,MIOpenGEMM;miopenConvolutionFwdAlgoWinograd:ConvBinWinogradRxSf2x3,825,86,0,miopenConvolutionFwdAlgoWinograd
128-28-28-1x1-256-56-56-128-0x0-2x2-1x1-0-NCHW-FP32-W=miopenConvolutionBwdWeightsAlgoDirect:ConvAsmBwdWrW1x1,74,7186,102760448,miopenConvolutionBwdWeightsAlgoDirect;miopenConvolutionBwdWeightsAlgoImplicitGEMM:ConvHipImplicitGemmV4R1WrW,394,173,0,miopenConvolutionBwdWeightsAlgoImplicitGEMM;miopenConvolutionBwdWeightsAlgoGEMM:gemm,3253,19,802816,MIOpenGEMM
1024-14-14-1x1-512-28-28-128-0x0-2x2-1x1-0-NCHW-FP32-B=miopenConvolutionBwdDataAlgoDirect:ConvAsm1x1U,64,5759,51380224,miopenConvolutionBwdDataAlgoDirect;miopenConvolutionBwdDataAlgoWinograd:ConvBinWinogradRxSf2x3,1376,2,0,miopenConvolutionBwdDataAlgoWinograd;miopenConvolutionBwdDataAlgoGEMM:gemm,2824,69,154140672,MIOpenGEMM
64-56-56-3x3-64-56-56-128-1x1-1x1-1x1-0-NCHW-FP32-B=miopenConvolutionBwdDataAlgoWinograd:ConvBinWinogradRxS,5,91302,0,miopenConvolutionBwdDataAlgoWinograd
384-13-13-3x3-192-13-13-512-1x1-1x1-1x1-0-NCHW-FP32-B=miopenConvolutionBwdDataAlgoWinograd:ConvBinWinogradRxSf2x3,215,522,0,miopenConvolutionBwdDataAlgoWinograd
192-13-13-3x3-384-13-13-512-1x1-1x1-1x1-0-NCHW-FP32-F=miopenConvolutionFwdAlgoWinograd:ConvBinWinogradRxSf3x2,261,907,0,miopenConvolutionFwdAlgoWinograd
128-28-28-1x1-256-56-56-128-0x0-2x2-1x1-0-NCHW-FP32-B=miopenConvolutionBwdDataAlgoDirect:ConvAsm1x1UV2,15,3101,0,miopenConvolutionBwdDataAlgoDirect;miopenConvolutionBwdDataAlgoWinograd:ConvBinWinogradRxSf2x3,283,859,0,miopenConvolutionBwdDataAlgoWinograd;miopenConvolutionBwdDataAlgoGEMM:gemm,291,594,154140672,MIOpenGEMM
1024-14-14-1x1-256-14-14-128-0x0-1x1-1x1-0-NCHW-FP32-W=miopenConvolutionBwdWeightsAlgoDirect:ConvOclBwdWrW1x1,39,6641,0,miopenConvolutionBwdWeightsAlgoDirect;miopenConvolutionBwdWeightsAlgoWinograd:ConvBinWinogradRxSf2x3,243,34,0,miopenConvolutionBwdWeightsAlgoWinograd;miopenConvolutionBwdWeightsAlgoGEMM:gemm,1562,6,0,MIOpenGEMM
256-14-14-1x1-512-28-28-128-0x0-2x2-1x1-0-NCHW-FP32-B=miopenConvolutionBwdDataAlgoDirect:ConvOclDirectFwd1x1,21,4737,0,miopenConvolutionBwdDataAlgoDirect;miopenConvolutionBwdDataAlgoGEMM:gemm,136,243,77070336,MIOpenGEMM;miopenConvolutionBwdDataAlgoWinograd:ConvBinWinogradRxSf2x3,424,679,0,miopenConvolutionBwdDataAlgoWinograd
256-14-14-3x3-256-14-14-128-1x1-1x1-1x1-0-NCHW-FP32-W=miopenConvolutionBwdWeightsAlgoDirect:ConvOclBwdWrW53,42,8137,0,miopenConvolutionBwdWeightsAlgoDirect;miopenConvolutionBwdWeightsAlgoWinograd:ConvBinWinogradRxSf2x3,46,8501,0,miopenConvolutionBwdWeightsAlgoWinograd;miopenConvolutionBwdWeightsAlgoImplicitGEMM:ConvHipImplicitGemmV4R1WrW,118,353,0,miopenConvolutionBwdWeightsAlgoImplicitGEMM;miopenConvolutionBwdWeightsAlgoGEMM:gemm,837,789,1806336,MIOpenGEMM
2048-7-7-1x1-512-7-7-128-0x0-1x1-1x1-0-NCHW-FP32-B=miopenConvolutionBwdDataAlgoDirect:ConvAsm1x1U,9,45901,0,miopenConvolutionBwdDataAlgoDirect;miopenConvolutionBwdDataAlgoWinograd:ConvBinWinogradRxSf3x2,91,9155,0,miopenConvolutionBwdDataAlgoWinograd;miopenConvolutionBwdDataAlgoGEMM:gemm,434,353,0,MIOpenGEMM
256-14-14-3x3-256-14-14-128-1x1-1x1-1x1-0-NCHW-FP32-F=miopenConvolutionFwdAlgoWinograd:ConvBinWinogradRxSf2x3,22,3311,0,miopenConvolutionFwdAlgoWinograd
64-112-112-7x7-3-230-230-128-0x0-2x2-1x1-0-NCHW-FP32-W=miopenConvolutionBwdWeightsAlgoDirect:ConvOclBwdWrW2<2>,67,3784,2408448,miopenConvolutionBwdWeightsAlgoDirect;miopenConvolutionBwdWeightsAlgoGEMM:gemm,293,721,7375872,MIOpenGEMM
512-7-7-1x1-2048-7-7-128-0x0-1x1-1x1-0-NCHW-FP32-W=miopenConvolutionBwdWeightsAlgoDirect:ConvAsmBwdWrW1x1,31,9601,0,miopenConvolutionBwdWeightsAlgoDirect;miopenConvolutionBwdWeightsAlgoWinograd:ConvBinWinogradRxSf2x3,102,393,0,miopenConvolutionBwdWeightsAlgoWinograd;miopenConvolutionBwdWeightsAlgoGEMM:gemm,331,221,0,MIOpenGEMM
192-27-27-5x5-64-27-27-512-2x2-1x1-1x1-0-NCHW-FP32-W=miopenConvolutionBwdWeightsAlgoGEMM:gemm,100,894,4665600,MIOpenGEMM;miopenConvolutionBwdWeightsAlgoDirect:ConvOclBwdWrW2<1>,391,932,629145600,miopenConvolutionBwdWeightsAlgoDirect;miopenConvolutionBwdWeightsAlgoWinograd:ConvBinWinogradRxS,808,311,0,miopenConvolutionBwdWeightsAlgoWinograd;miopenConvolutionBwdWeightsAlgoImplicitGEMM:ConvHipImplicitGemmV4R1WrW,981,394,0,miopenConvolutionBwdWeightsAlgoImplicitGEMM
64-56-56-1x1-64-56-56-128-0x0-1x1-1x1-0-NCHW-FP32-B=miopenConvolutionBwdDataAlgoDirect:ConvAsm1x1U,1,5412,0,miopenConvolutionBwdDataAlgoDirect;miopenConvolutionBwdDataAlgoWinograd:ConvBinWinogradRxSf3x2,6,4059,0,miopenConvolutionBwdDataAlgoWinograd;miopenConvolutionBwdDataAlgoGEMM:gemm,560,33,0,MIOpenGEMM
512-7-7-3x3-512-7-7-128-1x1-1x1-1x1-0-NCHW-FP32-W=miopenConvolutionBwdWeightsAlgoWinograd:ConvBinWinogradRxS,50,3592,0,miopenConvolutionBwdWeightsAlgoWinograd;miopenConvolutionBwdWeightsAlgoDirect:ConvAsmBwdWrW3x3,53,9168,0,miopenConvolutionBwdWeightsAlgoDirect;miopenConvolutionBwdWeightsAlgoImplicitGEMM:ConvHipImplicitGemmV4R1WrW,176,427,0,miopenConvolutionBwdWeightsAlgoImplicitGEMM;miopenConvolutionBwdWeightsAlgoGEMM:gemm,3242,97,903168,MIOpenGEMM
512-7-7-1x1-2048-7-7-128-0x0-1x1-1x1-0-NCHW-FP32-B=miopenConvolutionBwdDataAlgoDirect:ConvAsm1x1U,18,8661,0,miopenConvolutionBwdDataAlgoDirect;miopenConvolutionBwdDataAlgoWinograd:ConvBinWinogradRxSf3x2,197,26,0,miopenConvolutionBwdDataAlgoWinograd;miopenConvolutionBwdDataAlgoGEMM:gemm,386,52,0,MIOpenGEMM
3-230-230-7x7-64-112-112-128-0x0-2x2-1x1-0-NCHW-FP32-F=miopenConvolutionFwdAlgoDirect:ConvOclDirectFwd,30,1244,0,miopenConvolutionFwdAlgoDirect;miopenConvolutionFwdAlgoWinograd:ConvBinWinogradRxS,40,2762,0,miopenConvolutionFwdAlgoWinograd;miopenConvolutionFwdAlgoGEMM:GemmFwdRest,737,385,7375872,MIOpenGEMM
512-28-28-1x1-256-14-14-128-0x0-2x2-1x1-0-NCHW-FP32-F=miopenConvolutionFwdAlgoDirect:ConvAsm1x1U,9,3608,51380224,miopenConvolutionFwdAlgoDirect;miopenConvolutionFwdAlgoWinograd:ConvBinWinogradRxS,251,0,miopenConvolutionFwdAlgoWinograd,<unused>;miopenConvolutionFwdAlgoGEMM:GemmFwd1x1_0_2,487,492,77070336,MIOpenGEMM
128-28-28-1x1-512-28-28-128-0x0-1x1-1x1-0-NCHW-FP32-B=miopenConvolutionBwdDataAlgoDirect:ConvAsm1x1U,5,39655,0,miopenConvolutionBwdDataAlgoDirect;miopenConvolutionBwdDataAlgoWinograd:ConvBinWinogradRxSf3x2,49,9613,0,miopenConvolutionBwdDataAlgoWinograd;miopenConvolutionBwdDataAlgoGEMM:gemm,760,632,0,MIOpenGEMM
2048-7-7-1x1-512-7-7-128-0x0-1x1-1x1-0-NCHW-FP32-F=miopenConvolutionFwdAlgoDirect:ConvAsm1x1U,38,602,0,miopenConvolutionFwdAlgoDirect;miopenConvolutionFwdAlgoWinograd:ConvBinWinogradRxSf3x2,153,439,0,miopenConvolutionFwdAlgoWinograd;miopenConvolutionFwdAlgoGEMM:GemmFwd1x1_0_1,1116,1,0,MIOpenGEMM
256-14-14-1x1-1024-14-14-128-0x0-1x1-1x1-0-NCHW-FP32-B=miopenConvolutionBwdDataAlgoDirect:ConvAsm1x1U,26,9844,0,miopenConvolutionBwdDataAlgoDirect;miopenConvolutionBwdDataAlgoWinograd:ConvBinWinogradRxSf3x2,94,2903,0,miopenConvolutionBwdDataAlgoWinograd;miopenConvolutionBwdDataAlgoGEMM:gemm,645,765,0,MIOpenGEMM
1024-14-14-1x1-256-14-14-128-0x0-1x1-1x1-0-NCHW-FP32-F=miopenConvolutionFwdAlgoDirect:ConvOclDirectFwd1x1,22,5876,0,miopenConvolutionFwdAlgoDirect;miopenConvolutionFwdAlgoWinograd:ConvBinWinogradRxSf3x2,96,2371,0,miopenConvolutionFwdAlgoWinograd;miopenConvolutionFwdAlgoGEMM:GemmFwd1x1_0_1,504,662,0,MIOpenGEMM
512-7-7-1x1-2048-7-7-128-0x0-1x1-1x1-0-NCHW-FP32-F=miopenConvolutionFwdAlgoDirect:ConvAsm1x1U,126,744,0,miopenConvolutionFwdAlgoDirect;miopenConvolutionFwdAlgoGEMM:GemmFwd1x1_0_1,2767,9,0,MIOpenGEMM
512-28-28-1x1-1024-14-14-128-0x0-2x2-1x1-0-NCHW-FP32-F=miopenConvolutionFwdAlgoWinograd:ConvBinWinogradRxS,47,6569,0,miopenConvolutionFwdAlgoWinograd;miopenConvolutionFwdAlgoGEMM:GemmFwd1x1_0_2,1892,82,154140672,MIOpenGEMM
64-56-56-1x1-64-56-56-128-0x0-1x1-1x1-0-NCHW-FP32-F=miopenConvolutionFwdAlgoWinograd:ConvBinWinogradRxSf3x2,1,6328,0,miopenConvolutionFwdAlgoWinograd;miopenConvolutionFwdAlgoGEMM:GemmFwd1x1_0_1,4,65516,0,MIOpenGEMM
2048-7-7-1x1-1024-14-14-128-0x0-2x2-1x1-0-NCHW-FP32-W=miopenConvolutionBwdWeightsAlgoDirect:ConvAsmBwdWrW1x1,232,34,25690112,miopenConvolutionBwdWeightsAlgoDirect;miopenConvolutionBwdWeightsAlgoImplicitGEMM:ConvHipImplicitGemmV4R1WrW,453,762,0,miopenConvolutionBwdWeightsAlgoImplicitGEMM;miopenConvolutionBwdWeightsAlgoGEMM:gemm,1650,7,200704,MIOpenGEMM
256-14-14-1x1-512-28-28-128-0x0-2x2-1x1-0-NCHW-FP32-W=miopenConvolutionBwdWeightsAlgoDirect:ConvAsmBwdWrW1x1,163,5,51380224,miopenConvolutionBwdWeightsAlgoDirect;miopenConvolutionBwdWeightsAlgoGEMM:gemm,1645,17,401408,MIOpenGEMM;miopenConvolutionBwdWeightsAlgoImplicitGEMM:ConvHipImplicitGemmV4R1WrW,1698,48,0,miopenConvolutionBwdWeightsAlgoImplicitGEMM
192-27-27-5x5-64-27-27-512-2x2-1x1-1x1-0-NCHW-FP32-B=miopenConvolutionBwdDataAlgoFFT:fft,242,106,963706880,miopenConvolutionBwdDataAlgoFFT;miopenConvolutionBwdDataAlgoWinograd:ConvBinWinogradRxSf3x2,663,58,0,miopenConvolutionBwdDataAlgoWinograd;miopenConvolutionBwdDataAlgoDirect:ConvOclDirectFwd,1038,27,0,miopenConvolutionBwdDataAlgoDirect;miopenConvolutionBwdDataAlgoImplicitGEMM:ConvHipImplicitGemmBwdDataV1R1,1198,6,0,miopenConvolutionBwdDataAlgoImplicitGEMM;miopenConvolutionBwdDataAlgoGEMM:gemm,1372,87,4665600,MIOpenGEMM
2048-7-7-1x1-1024-14-14-128-0x0-2x2-1x1-0-NCHW-FP32-B=miopenConvolutionBwdDataAlgoDirect:ConvAsm1x1UV2,40,5769,0,miopenConvolutionBwdDataAlgoDirect;miopenConvolutionBwdDataAlgoGEMM:gemm,267,13,77070336,MIOpenGEMM;miopenConvolutionBwdDataAlgoWinograd:ConvBinWinogradRxSf2x3,1125,38,0,miopenConvolutionBwdDataAlgoWinograd
384-13-13-3x3-384-13-13-512-1x1-1x1-1x1-0-NCHW-FP32-F=miopenConvolutionFwdAlgoWinograd:ConvBinWinogradRxS,134,833,0,miopenConvolutionFwdAlgoWinograd
64-56-56-1x1-256-56-56-128-0x0-1x1-1x1-0-NCHW-FP32-F=miopenConvolutionFwdAlgoDirect:ConvOclDirectFwd1x1,228,546,0,miopenConvolutionFwdAlgoDirect;miopenConvolutionFwdAlgoWinograd:ConvBinWinogradRxSf2x3,648,88,0,miopenConvolutionFwdAlgoWinograd;miopenConvolutionFwdAlgoGEMM:GemmFwd1x1_0_1,1691,45,0,MIOpenGEMM
1024-14-14-1x1-256-14-14-128-0x0-1x1-1x1-0-NCHW-FP32-B=miopenConvolutionBwdDataAlgoGEMM:gemm,395,245,0,MIOpenGEMM;miopenConvolutionBwdDataAlgoWinograd:ConvBinWinogradRxSf3x2,1235,38,0,miopenConvolutionBwdDataAlgoWinograd
512-28-28-1x1-128-28-28-128-0x0-1x1-1x1-0-NCHW-FP32-W=miopenConvolutionBwdWeightsAlgoDirect:ConvAsmBwdWrW1x1,35,1282,0,miopenConvolutionBwdWeightsAlgoDirect;miopenConvolutionBwdWeightsAlgoWinograd:ConvBinWinogradRxSf2x3,204,828,0,miopenConvolutionBwdWeightsAlgoWinograd;miopenConvolutionBwdWeightsAlgoGEMM:gemm,389,987,0,MIOpenGEMM
3-224-224-3x3-64-224-224-128-1x1-1x1-1x1-0-NCHW-FP32-F=miopenConvolutionFwdAlgoDirect:ConvOclDirectFwd,1772,41,0,miopenConvolutionFwdAlgoDirect;miopenConvolutionFwdAlgoWinograd:ConvBinWinogradRxSf2x3,1942,83,0,miopenConvolutionFwdAlgoWinograd;miopenConvolutionFwdAlgoGEMM:GemmFwdRest,3427,41,5419008,MIOpenGEMM
1024-14-14-1x1-2048-7-7-128-0x0-2x2-1x1-0-NCHW-FP32-F=miopenConvolutionFwdAlgoDirect:ConvAsm1x1U,42,5184,25690112,miopenConvolutionFwdAlgoDirect;miopenConvolutionFwdAlgoGEMM:GemmFwd1x1_0_2,56,5591,77070336,MIOpenGEMM;miopenConvolutionFwdAlgoWinograd:ConvBinWinogradRxSf2x3,465,802,0,miopenConvolutionFwdAlgoWinograd
64-112-112-3x3-128-112-112-128-1x1-1x1-1x1-0-NCHW-FP32-F=miopenConvolutionFwdAlgoWinograd:ConvBinWinogradRxSf2x3,145,791,0,miopenConvolutionFwdAlgoWinograd
512-28-28-1x1-128-28-28-128-0x0-1x1-1x1-0-NCHW-FP32-B=miopenConvolutionBwdDataAlgoDirect:ConvAsm1x1U,7,24011,0,miopenConvolutionBwdDataAlgoDirect;miopenConvolutionBwdDataAlgoWinograd:ConvBinWinogradRxSf3x2,78,7938,0,miopenConvolutionBwdDataAlgoWinograd;miopenConvolutionBwdDataAlgoGEMM:gemm,3072,0,MIOpenGEMM,0_1_784_128_784_784_128_512
64-56-56-1x1-256-56-56-128-0x0-1x1-1x1-0-NCHW-FP32-W=miopenConvolutionBwdWeightsAlgoDirect:ConvAsmBwdWrW1x1,502,658,0,miopenConvolutionBwdWeightsAlgoDirect;miopenConvolutionBwdWeightsAlgoGEMM:gemm,4012,4,0,MIOpenGEMM
128-28-28-1x1-512-28-28-128-0x0-1x1-1x1-0-NCHW-FP32-F=miopenConvolutionFwdAlgoDirect:ConvOclDirectFwd1x1,44,6281,0,miopenConvolutionFwdAlgoDirect;miopenConvolutionFwdAlgoWinograd:ConvBinWinogradRxSf3x2,112,179,0,miopenConvolutionFwdAlgoWinograd;miopenConvolutionFwdAlgoGEMM:GemmFwd1x1_0_1,661,181,0,MIOpenGEMM
192-28-28-3x3-128-28-28-128-1x1-1x1-1x1-0-NCHW-FP32-W=miopenConvolutionBwdWeightsAlgoDirect:ConvAsmBwdWrW3x3,50,2663,0,miopenConvolutionBwdWeightsAlgoDirect;miopenConvolutionBwdWeightsAlgoWinograd:ConvBinWinogradRxS,72,3362,0,miopenConvolutionBwdWeightsAlgoWinograd;miopenConvolutionBwdWeightsAlgoImplicitGEMM:ConvHipImplicitGemmV4R1WrW,142,81,0,miopenConvolutionBwdWeightsAlgoImplicitGEMM;miopenConvolutionBwdWeightsAlgoGEMM:gemm,184,9,3612672,MIOpenGEMM
128-28-28-3x3-128-28-28-128-1x1-1x1-1x1-0-NCHW-FP32-W=miopenConvolutionBwdWeightsAlgoGEMM:gemm,36,5154,3612672,MIOpenGEMM;miopenConvolutionBwdWeightsAlgoDirect:ConvAsmBwdWrW3x3,37,972,0,miopenConvolutionBwdWeightsAlgoDirect;miopenConvolutionBwdWeightsAlgoWinograd:ConvBinWinogradRxS,72,156,0,miopenConvolutionBwdWeightsAlgoWinograd;miopenConvolutionBwdWeightsAlgoImplicitGEMM:ConvHipImplicitGemmV4R1WrW,97,1614,0,miopenConvolutionBwdWeightsAlgoImplicitGEMM
512-14-14-3x3-512-14-14-128-1x1-1x1-1x1-0-NCHW-FP32-W=miopenConvolutionBwdWeightsAlgoDirect:ConvAsmBwdWrW3x3,253,69,0,miopenConvolutionBwdWeightsAlgoDirect;miopenConvolutionBwdWeightsAlgoImplicitGEMM:ConvHipImplicitGemmV4R1WrW,455,78,0,miopenConvolutionBwdWeightsAlgoImplicitGEMM;miopenConvolutionBwdWeightsAlgoWinograd:ConvBinWinogradRxSf2x3,458,189,0,miopenConvolutionBwdWeightsAlgoWinograd;miopenConvolutionBwdWeightsAlgoGEMM:gemm,2479,86,3612672,MIOpenGEMM
192-28-28-3x3-128-28-28-128-1x1-1x1-1x1-0-NCHW-FP32-B=miopenConvolutionBwdDataAlgoWinograd:ConvBinWinogradRxSf2x3,46,3091,0,miopenConvolutionBwdDataAlgoWinograd
128-28-28-3x3-192-28-28-128-1x1-1x1-1x1-0-NCHW-FP32-F=miopenConvolutionFwdAlgoWinograd:ConvBinWinogradRxSf3x2,55,4805,0,miopenConvolutionFwdAlgoWinograd
160-14-14-3x3-320-14-14-128-1x1-1x1-1x1-0-NCHW-FP32-F=miopenConvolutionFwdAlgoWinograd:ConvBinWinogradRxS,2,7918,0,miopenConvolutionFwdAlgoWinograd
64-56-56-1x1-256-56-56-128-0x0-1x1-1x1-0-NCHW-FP32-B=miopenConvolutionBwdDataAlgoDirect:ConvOclDirectFwd1x1,348,382,0,miopenConvolutionBwdDataAlgoDirect;miopenConvolutionBwdDataAlgoWinograd:ConvBinWinogradRxSf2x3,985,65,0,miopenConvolutionBwdDataAlgoWinograd;miopenConvolutionBwdDataAlgoGEMM:gemm,1422,74,0,MIOpenGEMM
256-14-14-3x3-128-14-14-128-1x1-1x1-1x1-0-NCHW-FP32-W=miopenConvolutionBwdWeightsAlgoWinograd:ConvBinWinogradRxS,11,1631,0,miopenConvolutionBwdWeightsAlgoWinograd;miopenConvolutionBwdWeightsAlgoDirect:ConvAsmBwdWrW3x3,17,1949,0,miopenConvolutionBwdWeightsAlgoDirect;miopenConvolutionBwdWeightsAlgoImplicitGEMM:ConvHipImplicitGemmV4R1WrW,97,2525,0,miopenConvolutionBwdWeightsAlgoImplicitGEMM;miopenConvolutionBwdWeightsAlgoGEMM:gemm,1081,26,903168,MIOpenGEMM
32-28-28-5x5-16-28-28-128-2x2-1x1-1x1-0-NCHW-FP32-W=miopenConvolutionBwdWeightsAlgoDirect:ConvOclBwdWrW53,0,975099,6553600,miopenConvolutionBwdWeightsAlgoDirect;miopenConvolutionBwdWeightsAlgoWinograd:ConvBinWinogradRxSf2x3,27,2787,0,miopenConvolutionBwdWeightsAlgoWinograd;miopenConvolutionBwdWeightsAlgoGEMM:gemm,264,342,1254400,MIOpenGEMM
256-13-13-3x3-384-13-13-512-1x1-1x1-1x1-0-NCHW-FP32-W=miopenConvolutionBwdWeightsAlgoDirect:ConvAsmBwdWrW3x3,591,871,0,miopenConvolutionBwdWeightsAlgoDirect;miopenConvolutionBwdWeightsAlgoWinograd:ConvBinWinogradRxS,985,196,0,miopenConvolutionBwdWeightsAlgoWinograd;miopenConvolutionBwdWeightsAlgoImplicitGEMM:ConvHipImplicitGemmV4R1WrW,1370,14,0,miopenConvolutionBwdWeightsAlgoImplicitGEMM;miopenConvolutionBwdWeightsAlgoGEMM:gemm,3684,89,2336256,MIOpenGEMM
256-14-14-3x3-128-14-14-128-1x1-1x1-1x1-0-NCHW-FP32-B=miopenConvolutionBwdDataAlgoWinograd:ConvBinWinogradRxS,1,65209,0,miopenConvolutionBwdDataAlgoWinograd
32-28-28-5x5-16-28-28-128-2x2-1x1-1x1-0-NCHW-FP32-B=miopenConvolutionBwdDataAlgoWinograd:ConvBinWinogradRxS,0,951598,0,miopenConvolutionBwdDataAlgoWinograd;miopenConvolutionBwdDataAlgoDirect:ConvOclDirectFwd,3,4061,0,miopenConvolutionBwdDataAlgoDirect;miopenConvolutionBwdDataAlgoFFT:fft,3,55072,41222144,miopenConvolutionBwdDataAlgoFFT;miopenConvolutionBwdDataAlgoGEMM:gemm,29,6403,1254400,MIOpenGEMM
128-14-14-3x3-256-14-14-128-1x1-1x1-1x1-0-NCHW-FP32-F=miopenConvolutionFwdAlgoWinograd:ConvBinWinograd3x3U,2,31137,0,miopenConvolutionFwdAlgoWinograd
256-56-56-3x3-256-56-56-128-1x1-1x1-1x1-0-NCHW-FP32-F=miopenConvolutionFwdAlgoWinograd:ConvBinWinograd3x3U,410,442,0,miopenConvolutionFwdAlgoWinograd
16-28-28-5x5-32-28-28-128-2x2-1x1-1x1-0-NCHW-FP32-F=miopenConvolutionFwdAlgoWinograd:ConvBinWinogradRxS,0,540804,0,miopenConvolutionFwdAlgoWinograd;miopenConvolutionFwdAlgoImplicitGEMM:ConvHipImplicitGemmV4R1Fwd,2,7492,0,miopenConvolutionFwdAlgoImplicitGEMM;miopenConvolutionFwdAlgoFFT:fft,3,325,36208640,miopenConvolutionFwdAlgoFFT;miopenConvolutionFwdAlgoDirect:ConvOclDirectFwd,5,38396,0,miopenConvolutionFwdAlgoDirect;miopenConvolutionFwdAlgoGEMM:GemmFwdRest,84,668,1254400,MIOpenGEMM
128-28-28-1x1-512-28-28-128-0x0-1x1-1x1-0-NCHW-FP32-W=miopenConvolutionBwdWeightsAlgoDirect:ConvOclBwdWrW1x1,66,7836,0,miopenConvolutionBwdWeightsAlgoDirect;miopenConvolutionBwdWeightsAlgoWinograd:ConvBinWinogradRxSf2x3,403,932,0,miopenConvolutionBwdWeightsAlgoWinograd;miopenConvolutionBwdWeightsAlgoGEMM:gemm,3015,57,0,MIOpenGEMM
224-14-14-3x3-112-14-14-128-1x1-1x1-1x1-0-NCHW-FP32-W=miopenConvolutionBwdWeightsAlgoWinograd:ConvBinWinogradRxS,5,64001,0,miopenConvolutionBwdWeightsAlgoWinograd;miopenConvolutionBwdWeightsAlgoDirect:ConvAsmBwdWrW3x3,9,45373,0,miopenConvolutionBwdWeightsAlgoDirect;miopenConvolutionBwdWeightsAlgoGEMM:gemm,951,745,790272,MIOpenGEMM
256-56-56-1x1-64-56-56-128-0x0-1x1-1x1-0-NCHW-FP32-W=miopenConvolutionBwdWeightsAlgoDirect:ConvOclBwdWrW53,168,785,2097152,miopenConvolutionBwdWeightsAlgoDirect
48-14-14-5x5-16-14-14-128-2x2-1x1-1x1-0-NCHW-FP32-W=miopenConvolutionBwdWeightsAlgoDirect:ConvOclBwdWrW2<4>,0,745843,2457600,miopenConvolutionBwdWeightsAlgoDirect;miopenConvolutionBwdWeightsAlgoWinograd:ConvBinWinogradRxS,3,7621,0,miopenConvolutionBwdWeightsAlgoWinograd;miopenConvolutionBwdWeightsAlgoGEMM:gemm,497,803,313600,MIOpenGEMM
224-14-14-3x3-112-14-14-128-1x1-1x1-1x1-0-NCHW-FP32-B=miopenConvolutionBwdDataAlgoWinograd:ConvBinWinogradRxSf2x3,2,84174,0,miopenConvolutionBwdDataAlgoWinograd
48-14-14-5x5-16-14-14-128-2x2-1x1-1x1-0-NCHW-FP32-B=miopenConvolutionBwdDataAlgoWinograd:ConvBinWinogradRxS,1,67981,0,miopenConvolutionBwdDataAlgoWinograd;miopenConvolutionBwdDataAlgoDirect:ConvOclDirectFwd,5,31743,0,miopenConvolutionBwdDataAlgoDirect;miopenConvolutionBwdDataAlgoFFT:fft,82,545,20275200,miopenConvolutionBwdDataAlgoFFT;miopenConvolutionBwdDataAlgoGEMM:gemm,1585,7,313600,MIOpenGEMM
112-14-14-3x3-224-14-14-128-1x1-1x1-1x1-0-NCHW-FP32-F=miopenConvolutionFwdAlgoWinograd:ConvBinWinograd3x3U,1,58539,0,miopenConvolutionFwdAlgoWinograd
16-14-14-5x5-48-14-14-128-2x2-1x1-1x1-0-NCHW-FP32-F=miopenConvolutionFwdAlgoWinograd:ConvBinWinogradRxS,0,870841,0,miopenConvolutionFwdAlgoWinograd;miopenConvolutionFwdAlgoDirect:ConvOclDirectFwd,4,83175,0,miopenConvolutionFwdAlgoDirect;miopenConvolutionFwdAlgoImplicitGEMM:ConvHipImplicitGemmV4R1Fwd,5,20401,0,miopenConvolutionFwdAlgoImplicitGEMM;miopenConvolutionFwdAlgoFFT:fft,16,957,17879040,miopenConvolutionFwdAlgoFFT;miopenConvolutionFwdAlgoGEMM:GemmFwdRest,50,2463,313600,MIOpenGEMM
288-14-14-3x3-144-14-14-128-1x1-1x1-1x1-0-NCHW-FP32-W=miopenConvolutionBwdWeightsAlgoDirect:ConvOclBwdWrW53,17,5195,0,miopenConvolutionBwdWeightsAlgoDirect;miopenConvolutionBwdWeightsAlgoWinograd:ConvBinWinogradRxS,17,8563,0,miopenConvolutionBwdWeightsAlgoWinograd;miopenConvolutionBwdWeightsAlgoGEMM:gemm,883,644,1016064,MIOpenGEMM
256-56-56-1x1-64-56-56-128-0x0-1x1-1x1-0-NCHW-FP32-F=miopenConvolutionFwdAlgoDirect:ConvAsm1x1U,26,9333,0,miopenConvolutionFwdAlgoDirect;miopenConvolutionFwdAlgoWinograd:ConvBinWinogradRxSf2x3,81,2599,0,miopenConvolutionFwdAlgoWinograd;miopenConvolutionFwdAlgoGEMM:GemmFwd1x1_0_1,426,945,0,MIOpenGEMM
288-14-14-3x3-144-14-14-128-1x1-1x1-1x1-0-NCHW-FP32-B=miopenConvolutionBwdDataAlgoWinograd:ConvBinWinogradRxS,1,92739,0,miopenConvolutionBwdDataAlgoWinograd
144-14-14-3x3-288-14-14-128-1x1-1x1-1x1-0-NCHW-FP32-F=miopenConvolutionFwdAlgoWinograd:ConvBinWinogradRxS,2,31521,0,miopenConvolutionFwdAlgoWinograd
32-28-28-1x1-192-28-28-128-0x0-1x1-1x1-0-NCHW-FP32-B=miopenConvolutionBwdDataAlgoDirect:ConvAsm1x1U,0,464763,0,miopenConvolutionBwdDataAlgoDirect;miopenConvolutionBwdDataAlgoGEMM:gemm,44,53,0,MIOpenGEMM
384-7-7-3x3-192-7-7-128-1x1-1x1-1x1-0-NCHW-FP32-W=miopenConvolutionBwdWeightsAlgoDirect:ConvAsmBwdWrW3x3,2,36577,0,miopenConvolutionBwdWeightsAlgoDirect;miopenConvolutionBwdWeightsAlgoWinograd:ConvBinWinogradRxS,2,64187,0,miopenConvolutionBwdWeightsAlgoWinograd;miopenConvolutionBwdWeightsAlgoImplicitGEMM:ConvHipImplicitGemmV4R1WrW,17,4606,0,miopenConvolutionBwdWeightsAlgoImplicitGEMM;miopenConvolutionBwdWeightsAlgoGEMM:gemm,109,887,338688,MIOpenGEMM
256-56-56-1x1-64-56-56-128-0x0-1x1-1x1-0-NCHW-FP32-B=miopenConvolutionBwdDataAlgoDirect:ConvAsm1x1U,10,58,0,miopenConvolutionBwdDataAlgoDirect;miopenConvolutionBwdDataAlgoWinograd:ConvBinWinogradRxSf3x2,70,8362,0,miopenConvolutionBwdDataAlgoWinograd;miopenConvolutionBwdDataAlgoGEMM:gemm,385,46,0,MIOpenGEMM
384-7-7-3x3-192-7-7-128-1x1-1x1-1x1-0-NCHW-FP32-B=miopenConvolutionBwdDataAlgoWinograd:ConvBinWinograd3x3U,1,5062,0,miopenConvolutionBwdDataAlgoWinograd
192-7-7-3x3-384-7-7-128-1x1-1x1-1x1-0-NCHW-FP32-F=miopenConvolutionFwdAlgoWinograd:ConvBinWinogradRxS,8,8342,0,miopenConvolutionFwdAlgoWinograd
512-28-28-1x1-256-56-56-128-0x0-2x2-1x1-0-NCHW-FP32-W=miopenConvolutionBwdWeightsAlgoDirect:ConvAsmBwdWrW1x1,49,366,102760448,miopenConvolutionBwdWeightsAlgoDirect;miopenConvolutionBwdWeightsAlgoImplicitGEMM:ConvHipImplicitGemmV4R1WrW,68,9746,0,miopenConvolutionBwdWeightsAlgoImplicitGEMM;miopenConvolutionBwdWeightsAlgoGEMM:gemm,205,457,802816,MIOpenGEMM
64-14-14-5x5-32-14-14-128-2x2-1x1-1x1-0-NCHW-FP32-B=miopenConvolutionBwdDataAlgoWinograd:ConvBinWinogradRxS,0,890127,0,miopenConvolutionBwdDataAlgoWinograd;miopenConvolutionBwdDataAlgoDirect:ConvOclDirectFwd,13,6444,0,miopenConvolutionBwdDataAlgoDirect;miopenConvolutionBwdDataAlgoImplicitGEMM:ConvHipImplicitGemmBwdDataV1R1,40,8095,0,miopenConvolutionBwdDataAlgoImplicitGEMM;miopenConvolutionBwdDataAlgoFFT:fft,79,1042,29859840,miopenConvolutionBwdDataAlgoFFT;miopenConvolutionBwdDataAlgoGEMM:gemm,683,695,627200,MIOpenGEMM
32-14-14-5x5-64-14-14-128-2x2-1x1-1x1-0-NCHW-FP32-F=miopenConvolutionFwdAlgoWinograd:ConvBinWinogradRxS,0,801799,0,miopenConvolutionFwdAlgoWinograd;miopenConvolutionFwdAlgoDirect:ConvOclDirectFwd,15,449,0,miopenConvolutionFwdAlgoDirect;miopenConvolutionFwdAlgoImplicitGEMM:ConvHipImplicitGemmV4R1Fwd,24,2927,0,miopenConvolutionFwdAlgoImplicitGEMM;miopenConvolutionFwdAlgoFFT:fft,57,6056,23777280,miopenConvolutionFwdAlgoFFT;miopenConvolutionFwdAlgoGEMM:GemmFwdRest,604,797,627200,MIOpenGEMM
128-14-14-5x5-32-14-14-128-2x2-1x1-1x1-0-NCHW-FP32-W=miopenConvolutionBwdWeightsAlgoWinograd:ConvBinWinogradRxS,3,22582,0,miopenConvolutionBwdWeightsAlgoWinograd;miopenConvolutionBwdWeightsAlgoDirect:ConvOclBwdWrW53,3,30793,52428800,miopenConvolutionBwdWeightsAlgoDirect;miopenConvolutionBwdWeightsAlgoGEMM:gemm,246,511,627200,MIOpenGEMM
192-28-28-1x1-32-28-28-128-0x0-1x1-1x1-0-NCHW-FP32-F=miopenConvolutionFwdAlgoDirect:ConvOclDirectFwd1x1,0,978216,0,miopenConvolutionFwdAlgoDirect;miopenConvolutionFwdAlgoGEMM:GemmFwd1x1_0_1,165,8,0,MIOpenGEMM
96-28-28-1x1-192-28-28-128-0x0-1x1-1x1-0-NCHW-FP32-W=miopenConvolutionBwdWeightsAlgoDirect:ConvAsmBwdWrW1x1,3,7428,0,miopenConvolutionBwdWeightsAlgoDirect;miopenConvolutionBwdWeightsAlgoGEMM:gemm,188,225,0,MIOpenGEMM
128-14-14-5x5-32-14-14-128-2x2-1x1-1x1-0-NCHW-FP32-B=miopenConvolutionBwdDataAlgoWinograd:ConvBinWinogradRxS,1,4672,0,miopenConvolutionBwdDataAlgoWinograd;miopenConvolutionBwdDataAlgoDirect:ConvOclDirectFwd,7,29491,0,miopenConvolutionBwdDataAlgoDirect;miopenConvolutionBwdDataAlgoImplicitGEMM:ConvHipImplicitGemmBwdDataV1R1,14,6457,0,miopenConvolutionBwdDataAlgoImplicitGEMM;miopenConvolutionBwdDataAlgoFFT:fft,15,3853,59351040,miopenConvolutionBwdDataAlgoFFT;miopenConvolutionBwdDataAlgoGEMM:gemm,97,937,627200,MIOpenGEMM
128-7-7-5x5-48-7-7-128-2x2-1x1-1x1-0-NCHW-FP32-W=miopenConvolutionBwdWeightsAlgoDirect:ConvOclBwdWrW53,5,3809,78643200,miopenConvolutionBwdWeightsAlgoDirect;miopenConvolutionBwdWeightsAlgoWinograd:ConvBinWinogradRxS,8,55634,0,miopenConvolutionBwdWeightsAlgoWinograd;miopenConvolutionBwdWeightsAlgoGEMM:gemm,2180,76,235200,MIOpenGEMM
32-14-14-5x5-128-14-14-128-2x2-1x1-1x1-0-NCHW-FP32-F=miopenConvolutionFwdAlgoWinograd:ConvBinWinogradRxSf2x3,0,91513,0,miopenConvolutionFwdAlgoWinograd;miopenConvolutionFwdAlgoFFT:fft,5,26946,47370240,miopenConvolutionFwdAlgoFFT;miopenConvolutionFwdAlgoImplicitGEMM:ConvHipImplicitGemmV4R1Fwd,5,38861,0,miopenConvolutionFwdAlgoImplicitGEMM;miopenConvolutionFwdAlgoDirect:ConvOclDirectFwd,6,19025,0,miopenConvolutionFwdAlgoDirect;miopenConvolutionFwdAlgoGEMM:GemmFwdRest,44,9578,627200,MIOpenGEMM
128-7-7-5x5-48-7-7-128-2x2-1x1-1x1-0-NCHW-FP32-B=miopenConvolutionBwdDataAlgoWinograd:ConvBinWinogradRxS,0,961015,0,miopenConvolutionBwdDataAlgoWinograd;miopenConvolutionBwdDataAlgoFFT:fft,1,4459,30449664,miopenConvolutionBwdDataAlgoFFT;miopenConvolutionBwdDataAlgoDirect:ConvOclDirectFwd,7,55802,0,miopenConvolutionBwdDataAlgoDirect;miopenConvolutionBwdDataAlgoGEMM:gemm,21,9212,235200,MIOpenGEMM
480-14-14-1x1-96-14-14-128-0x0-1x1-1x1-0-NCHW-FP32-F=miopenConvolutionFwdAlgoWinograd:ConvBinWinogradRxSf2x3,1,90007,0,miopenConvolutionFwdAlgoWinograd;miopenConvolutionFwdAlgoDirect:ConvAsm1x1U,1,90636,0,miopenConvolutionFwdAlgoDirect;miopenConvolutionFwdAlgoGEMM:GemmFwd1x1_0_1,5,33158,0,MIOpenGEMM
48-7-7-5x5-128-7-7-128-2x2-1x1-1x1-0-NCHW-FP32-F=miopenConvolutionFwdAlgoWinograd:ConvBinWinogradRxS,1,41678,0,miopenConvolutionFwdAlgoWinograd;miopenConvolutionFwdAlgoImplicitGEMM:ConvHipImplicitGemmV4R1Fwd,3,39434,0,miopenConvolutionFwdAlgoImplicitGEMM;miopenConvolutionFwdAlgoDirect:ConvOclDirectFwd,4,80946,0,miopenConvolutionFwdAlgoDirect;miopenConvolutionFwdAlgoFFT:fft,35,723,22106112,miopenConvolutionFwdAlgoFFT;miopenConvolutionFwdAlgoGEMM:GemmFwdRest,389,37,235200,MIOpenGEMM
64-112-112-7x7-3-225-225-128-2x2-2x2-1x1-0-NCHW-FP32-W=miopenConvolutionBwdWeightsAlgoDirect:ConvOclBwdWrW2<4>,72,2789,1204224,miopenConvolutionBwdWeightsAlgoDirect;miopenConvolutionBwdWeightsAlgoGEMM:gemm,632,253,7375872,MIOpenGEMM
128-7-7-5x5-32-7-7-128-2x2-1x1-1x1-0-NCHW-FP32-W=miopenConvolutionBwdWeightsAlgoDirect:ConvOclBwdWrW2<8>,1,11262,6553600,miopenConvolutionBwdWeightsAlgoDirect;miopenConvolutionBwdWeightsAlgoWinograd:ConvBinWinogradRxS,1,33057,0,miopenConvolutionBwdWeightsAlgoWinograd;miopenConvolutionBwdWeightsAlgoGEMM:gemm,110,406,156800,MIOpenGEMM
64-112-112-7x7-3-225-225-128-2x2-2x2-1x1-0-NCHW-FP32-B=miopenConvolutionBwdDataAlgoDirect:ConvOclDirectFwd,118,659,0,miopenConvolutionBwdDataAlgoDirect;miopenConvolutionBwdDataAlgoWinograd:ConvBinWinogradRxSf2x3,309,598,0,miopenConvolutionBwdDataAlgoWinograd;miopenConvolutionBwdDataAlgoGEMM:gemm,1364,45,7375872,MIOpenGEMM
128-7-7-5x5-32-7-7-128-2x2-1x1-1x1-0-NCHW-FP32-B=miopenConvolutionBwdDataAlgoWinograd:ConvBinWinogradRxSf2x3,0,517966,0,miopenConvolutionBwdDataAlgoWinograd;miopenConvolutionBwdDataAlgoDirect:ConvOclDirectFwd,4,6393,0,miopenConvolutionBwdDataAlgoDirect;miopenConvolutionBwdDataAlgoFFT:fft,8,46503,27697152,miopenConvolutionBwdDataAlgoFFT;miopenConvolutionBwdDataAlgoImplicitGEMM:ConvHipImplicitGemmBwdDataV1R1,11,7866,0,miopenConvolutionBwdDataAlgoImplicitGEMM;miopenConvolutionBwdDataAlgoGEMM:gemm,50,5357,156800,MIOpenGEMM
3-225-225-7x7-64-112-112-128-2x2-2x2-1x1-0-NCHW-FP32-F=miopenConvolutionFwdAlgoDirect:ConvOclDirectFwd,45,7879,0,miopenConvolutionFwdAlgoDirect;miopenConvolutionFwdAlgoWinograd:ConvBinWinogradRxS,57,518,0,miopenConvolutionFwdAlgoWinograd;miopenConvolutionFwdAlgoGEMM:GemmFwdRest,675,263,7375872,MIOpenGEMM
32-7-7-5x5-128-7-7-128-2x2-1x1-1x1-0-NCHW-FP32-F=miopenConvolutionFwdAlgoWinograd:ConvBinWinogradRxS,0,647375,0,miopenConvolutionFwdAlgoWinograd;miopenConvolutionFwdAlgoDirect:ConvOclDirectFwd,4,89949,0,miopenConvolutionFwdAlgoDirect;miopenConvolutionFwdAlgoImplicitGEMM:ConvHipImplicitGemmV4R1Fwd,5,64715,0,miopenConvolutionFwdAlgoImplicitGEMM;miopenConvolutionFwdAlgoFFT:fft,32,7154,22106112,miopenConvolutionFwdAlgoFFT;miopenConvolutionFwdAlgoGEMM:GemmFwdRest,823,335,156800,MIOpenGEMM
512-28-28-3x3-256-28-28-128-1x1-1x1-1x1-0-NCHW-FP32-W=miopenConvolutionBwdWeightsAlgoDirect:ConvOclBwdWrW53,54,4051,0,miopenConvolutionBwdWeightsAlgoDirect;miopenConvolutionBwdWeightsAlgoImplicitGEMM:ConvHipImplicitGemmV4R1WrW,57,1974,0,miopenConvolutionBwdWeightsAlgoImplicitGEMM;miopenConvolutionBwdWeightsAlgoGEMM:gemm,74,1417,7225344,MIOpenGEMM;miopenConvolutionBwdWeightsAlgoWinograd:ConvBinWinogradRxS,84,2165,0,miopenConvolutionBwdWeightsAlgoWinograd
96-28-28-1x1-192-28-28-128-0x0-1x1-1x1-0-NCHW-FP32-B=miopenConvolutionBwdDataAlgoDirect:ConvAsm1x1U,1,29383,0,miopenConvolutionBwdDataAlgoDirect;miopenConvolutionBwdDataAlgoWinograd:ConvBinWinogradRxSf3x2,6,10016,0,miopenConvolutionBwdDataAlgoWinograd;miopenConvolutionBwdDataAlgoGEMM:gemm,970,15,0,MIOpenGEMM
16-28-28-1x1-192-28-28-128-0x0-1x1-1x1-0-NCHW-FP32-W=miopenConvolutionBwdWeightsAlgoDirect:ConvOclBwdWrW1x1,1,705,0,miopenConvolutionBwdWeightsAlgoDirect
64-14-14-1x1-480-14-14-128-0x0-1x1-1x1-0-NCHW-FP32-W=miopenConvolutionBwdWeightsAlgoDirect:ConvAsmBwdWrW1x1,1,99841,0,miopenConvolutionBwdWeightsAlgoDirect;miopenConvolutionBwdWeightsAlgoWinograd:ConvBinWinogradRxS,7,30512,0,miopenConvolutionBwdWeightsAlgoWinograd;miopenConvolutionBwdWeightsAlgoGEMM:gemm,38,3193,0,MIOpenGEMM
16-28-28-1x1-192-28-28-128-0x0-1x1-1x1-0-NCHW-FP32-B=miopenConvolutionBwdDataAlgoDirect:ConvAsm1x1U,0,569826,0,miopenConvolutionBwdDataAlgoDirect;miopenConvolutionBwdDataAlgoWinograd:ConvBinWinogradRxSf2x3,8,26431,0,miopenConvolutionBwdDataAlgoWinograd;miopenConvolutionBwdDataAlgoGEMM:gemm,230,961,0,MIOpenGEMM
96-28-28-5x5-32-28-28-128-2x2-1x1-1x1-0-NCHW-FP32-W=miopenConvolutionBwdWeightsAlgoDirect:ConvOclBwdWrW53,11,8161,39321600,miopenConvolutionBwdWeightsAlgoDirect;miopenConvolutionBwdWeightsAlgoWinograd:ConvBinWinogradRxSf2x3,30,9098,0,miopenConvolutionBwdWeightsAlgoWinograd;miopenConvolutionBwdWeightsAlgoGEMM:gemm,52,1268,2508800,MIOpenGEMM
512-28-28-3x3-256-28-28-128-1x1-1x1-1x1-0-NCHW-FP32-B=miopenConvolutionBwdDataAlgoWinograd:ConvBinWinograd3x3U,180,478,0,miopenConvolutionBwdDataAlgoWinograd
192-28-28-1x1-96-28-28-128-0x0-1x1-1x1-0-NCHW-FP32-F=miopenConvolutionFwdAlgoDirect:ConvAsm1x1U,1,55382,0,miopenConvolutionFwdAlgoDirect;miopenConvolutionFwdAlgoGEMM:GemmFwd1x1_0_1,214,878,0,MIOpenGEMM
96-28-28-5x5-32-28-28-128-2x2-1x1-1x1-0-NCHW-FP32-B=miopenConvolutionBwdDataAlgoWinograd:ConvBinWinogradRxSf2x3,6,86455,0,miopenConvolutionBwdDataAlgoWinograd;miopenConvolutionBwdDataAlgoFFT:fft,12,2314,134807552,miopenConvolutionBwdDataAlgoFFT;miopenConvolutionBwdDataAlgoDirect:ConvOclDirectFwd,25,8373,0,miopenConvolutionBwdDataAlgoDirect;miopenConvolutionBwdDataAlgoGEMM:gemm,59,5239,2508800,MIOpenGEMM;miopenConvolutionBwdDataAlgoImplicitGEMM:ConvHipImplicitGemmBwdDataV1R1,75,7996,0,miopenConvolutionBwdDataAlgoImplicitGEMM
256-28-28-3x3-512-28-28-128-1x1-1x1-1x1-0-NCHW-FP32-F=miopenConvolutionFwdAlgoWinograd:ConvBinWinogradRxSf2x3,221,63,0,miopenConvolutionFwdAlgoWinograd
32-28-28-5x5-96-28-28-128-2x2-1x1-1x1-0-NCHW-FP32-F=miopenConvolutionFwdAlgoWinograd:ConvBinWinogradRxSf3x2,5,1305,0,miopenConvolutionFwdAlgoWinograd;miopenConvolutionFwdAlgoImplicitGEMM:ConvHipImplicitGemmV4R1Fwd,66,2015,0,miopenConvolutionFwdAlgoImplicitGEMM;miopenConvolutionFwdAlgoDirect:ConvOclDirectFwd,70,6054,0,miopenConvolutionFwdAlgoDirect;miopenConvolutionFwdAlgoFFT:fft,149,3,107511808,miopenConvolutionFwdAlgoFFT;miopenConvolutionFwdAlgoGEMM:GemmFwdRest,1913,33,2508800,MIOpenGEMM
64-28-28-1x1-256-28-28-128-0x0-1x1-1x1-0-NCHW-FP32-W=miopenConvolutionBwdWeightsAlgoDirect:ConvAsmBwdWrW1x1,7,1139,0,miopenConvolutionBwdWeightsAlgoDirect
144-14-14-1x1-512-14-14-128-0x0-1x1-1x1-0-NCHW-FP32-B=miopenConvolutionBwdDataAlgoDirect:ConvAsm1x1U,1,72193,0,miopenConvolutionBwdDataAlgoDirect;miopenConvolutionBwdDataAlgoWinograd:ConvBinWinogradRxSf3x2,5,35234,0,miopenConvolutionBwdDataAlgoWinograd;miopenConvolutionBwdDataAlgoGEMM:gemm,668,33,0,MIOpenGEMM
64-14-14-1x1-480-14-14-128-0x0-1x1-1x1-0-NCHW-FP32-B=miopenConvolutionBwdDataAlgoDirect:ConvAsm1x1U,0,920553,0,miopenConvolutionBwdDataAlgoDirect;miopenConvolutionBwdDataAlgoGEMM:gemm,158,241,0,MIOpenGEMM
512-14-14-1x1-144-14-14-128-0x0-1x1-1x1-0-NCHW-FP32-F=miopenConvolutionFwdAlgoDirect:ConvOclDirectFwd1x1,2,90497,0,miopenConvolutionFwdAlgoDirect;miopenConvolutionFwdAlgoGEMM:GemmFwd1x1_0_1,66,433,0,MIOpenGEMM
192-28-28-1x1-16-28-28-128-0x0-1x1-1x1-0-NCHW-FP32-F=miopenConvolutionFwdAlgoDirect:ConvOclDirectFwd1x1,0,347154,0,miopenConvolutionFwdAlgoDirect;miopenConvolutionFwdAlgoGEMM:GemmFwd1x1_0_1,43,6222,0,MIOpenGEMM
64-28-28-1x1-192-28-28-128-0x0-1x1-1x1-0-NCHW-FP32-W=miopenConvolutionBwdWeightsAlgoDirect:ConvOclBwdWrW1x1,1,63827,0,miopenConvolutionBwdWeightsAlgoDirect
64-14-14-5x5-32-14-14-128-2x2-1x1-1x1-0-NCHW-FP32-W=miopenConvolutionBwdWeightsAlgoDirect:ConvOclBwdWrW53,1,69228,26214400,miopenConvolutionBwdWeightsAlgoDirect;miopenConvolutionBwdWeightsAlgoWinograd:ConvBinWinogradRxS,5,464,0,miopenConvolutionBwdWeightsAlgoWinograd;miopenConvolutionBwdWeightsAlgoGEMM:gemm,383,384,627200,MIOpenGEMM
128-14-14-1x1-512-14-14-128-0x0-1x1-1x1-0-NCHW-FP32-W=miopenConvolutionBwdWeightsAlgoDirect:ConvAsmBwdWrW1x1,12,2475,0,miopenConvolutionBwdWeightsAlgoDirect;miopenConvolutionBwdWeightsAlgoGEMM:gemm,917,709,0,MIOpenGEMM
320-7-7-3x3-160-7-7-128-1x1-1x1-1x1-0-NCHW-FP32-W=miopenConvolutionBwdWeightsAlgoDirect:ConvOclBwdWrW53,2,8456,0,miopenConvolutionBwdWeightsAlgoDirect;miopenConvolutionBwdWeightsAlgoWinograd:ConvBinWinogradRxS,2,24941,0,miopenConvolutionBwdWeightsAlgoWinograd;miopenConvolutionBwdWeightsAlgoGEMM:gemm,15,1107,282240,MIOpenGEMM
128-14-14-1x1-512-14-14-128-0x0-1x1-1x1-0-NCHW-FP32-B=miopenConvolutionBwdDataAlgoDirect:ConvAsm1x1U,1,8242,0,miopenConvolutionBwdDataAlgoDirect;miopenConvolutionBwdDataAlgoGEMM:gemm,669,6,0,MIOpenGEMM
320-7-7-3x3-160-7-7-128-1x1-1x1-1x1-0-NCHW-FP32-B=miopenConvolutionBwdDataAlgoWinograd:ConvBinWinograd3x3U,1,12057,0,miopenConvolutionBwdDataAlgoWinograd
160-7-7-3x3-320-7-7-128-1x1-1x1-1x1-0-NCHW-FP32-F=miopenConvolutionFwdAlgoWinograd:ConvBinWinogradRxSf2x3,1,7515,0,miopenConvolutionFwdAlgoWinograd
480-14-14-1x1-64-14-14-128-0x0-1x1-1x1-0-NCHW-FP32-F=miopenConvolutionFwdAlgoDirect:ConvAsm1x1U,1,6454,0,miopenConvolutionFwdAlgoDirect;miopenConvolutionFwdAlgoGEMM:GemmFwd1x1_0_1,409,959,0,MIOpenGEMM
64-28-28-1x1-192-28-28-128-0x0-1x1-1x1-0-NCHW-FP32-B=miopenConvolutionBwdDataAlgoDirect:ConvAsm1x1U,0,990552,0,miopenConvolutionBwdDataAlgoDirect;miopenConvolutionBwdDataAlgoGEMM:gemm,270,863,0,MIOpenGEMM
192-28-28-1x1-64-28-28-128-0x0-1x1-1x1-0-NCHW-FP32-F=miopenConvolutionFwdAlgoDirect:ConvOclDirectFwd1x1,1,251,0,miopenConvolutionFwdAlgoDirect;miopenConvolutionFwdAlgoGEMM:GemmFwd1x1_0_1,89,793,0,MIOpenGEMM
256-28-28-1x1-64-28-28-128-0x0-1x1-1x1-0-NCHW-FP32-F=miopenConvolutionFwdAlgoWinograd:ConvBinWinogradRxSf3x2,3,4018,0,miopenConvolutionFwdAlgoWinograd;miopenConvolutionFwdAlgoGEMM:GemmFwd1x1_0_1,1853,8,0,MIOpenGEMM
32-14-14-1x1-512-14-14-128-0x0-1x1-1x1-0-NCHW-FP32-W=miopenConvolutionBwdWeightsAlgoDirect:ConvAsmBwdWrW1x1,0,595376,0,miopenConvolutionBwdWeightsAlgoDirect;miopenConvolutionBwdWeightsAlgoGEMM:gemm,52,727,0,MIOpenGEMM
320-14-14-3x3-160-14-14-128-1x1-1x1-1x1-0-NCHW-FP32-W=miopenConvolutionBwdWeightsAlgoWinograd:ConvBinWinogradRxS,20,356,0,miopenConvolutionBwdWeightsAlgoWinograd;miopenConvolutionBwdWeightsAlgoDirect:ConvAsmBwdWrW3x3,26,7792,0,miopenConvolutionBwdWeightsAlgoDirect;miopenConvolutionBwdWeightsAlgoGEMM:gemm,392,893,1128960,MIOpenGEMM
64-28-28-1x1-256-28-28-128-0x0-1x1-1x1-0-NCHW-FP32-B=miopenConvolutionBwdDataAlgoDirect:ConvAsm1x1U,23,181,0,miopenConvolutionBwdDataAlgoDirect;miopenConvolutionBwdDataAlgoWinograd:ConvBinWinogradRxSf2x3,64,5193,0,miopenConvolutionBwdDataAlgoWinograd;miopenConvolutionBwdDataAlgoGEMM:gemm,323,878,0,MIOpenGEMM
192-14-14-1x1-480-14-14-128-0x0-1x1-1x1-0-NCHW-FP32-W=miopenConvolutionBwdWeightsAlgoDirect:ConvAsmBwdWrW1x1,9,61195,0,miopenConvolutionBwdWeightsAlgoDirect;miopenConvolutionBwdWeightsAlgoWinograd:ConvBinWinogradRxSf2x3,41,6556,0,miopenConvolutionBwdWeightsAlgoWinograd;miopenConvolutionBwdWeightsAlgoGEMM:gemm,153,652,0,MIOpenGEMM
320-14-14-3x3-160-14-14-128-1x1-1x1-1x1-0-NCHW-FP32-B=miopenConvolutionBwdDataAlgoWinograd:ConvBinWinograd3x3U,6,44952,0,miopenConvolutionBwdDataAlgoWinograd
512-14-14-1x1-128-14-14-128-0x0-1x1-1x1-0-NCHW-FP32-F=miopenConvolutionFwdAlgoDirect:ConvAsm1x1U,1,72928,0,miopenConvolutionFwdAlgoDirect;miopenConvolutionFwdAlgoGEMM:GemmFwd1x1_0_1,124,136,0,MIOpenGEMM
32-28-28-1x1-256-28-28-128-0x0-1x1-1x1-0-NCHW-FP32-W=miopenConvolutionBwdWeightsAlgoDirect:ConvAsmBwdWrW1x1,1,44667,0,miopenConvolutionBwdWeightsAlgoDirect
32-28-28-1x1-192-28-28-128-0x0-1x1-1x1-0-NCHW-FP32-W=miopenConvolutionBwdWeightsAlgoDirect:ConvAsmBwdWrW1x1,4,1383,0,miopenConvolutionBwdWeightsAlgoDirect;miopenConvolutionBwdWeightsAlgoGEMM:gemm,2971,98,0,MIOpenGEMM
32-14-14-1x1-512-14-14-128-0x0-1x1-1x1-0-NCHW-FP32-B=miopenConvolutionBwdDataAlgoDirect:ConvAsm1x1U,0,732503,0,miopenConvolutionBwdDataAlgoDirect;miopenConvolutionBwdDataAlgoGEMM:gemm,58,6065,0,MIOpenGEMM
192-7-7-1x1-832-7-7-128-0x0-1x1-1x1-0-NCHW-FP32-W=miopenConvolutionBwdWeightsAlgoDirect:ConvAsmBwdWrW1x1,2,6485,0,miopenConvolutionBwdWeightsAlgoDirect;miopenConvolutionBwdWeightsAlgoGEMM:gemm,36,5286,0,MIOpenGEMM
528-14-14-1x1-256-14-14-128-0x0-1x1-1x1-0-NCHW-FP32-F=miopenConvolutionFwdAlgoDirect:ConvAsm1x1U,4,23938,0,miopenConvolutionFwdAlgoDirect;miopenConvolutionFwdAlgoWinograd:ConvBinWinogradRxSf3x2,13,4892,0,miopenConvolutionFwdAlgoWinograd;miopenConvolutionFwdAlgoGEMM:GemmFwd1x1_0_1,223,538,0,MIOpenGEMM
192-14-14-1x1-480-14-14-128-0x0-1x1-1x1-0-NCHW-FP32-B=miopenConvolutionBwdDataAlgoDirect:ConvAsm1x1U,1,83689,0,miopenConvolutionBwdDataAlgoDirect;miopenConvolutionBwdDataAlgoWinograd:ConvBinWinogradRxSf3x2,8,7755,0,miopenConvolutionBwdDataAlgoWinograd;miopenConvolutionBwdDataAlgoGEMM:gemm,137,49,0,MIOpenGEMM
112-14-14-1x1-512-14-14-128-0x0-1x1-1x1-0-NCHW-FP32-W=miopenConvolutionBwdWeightsAlgoDirect:ConvOclBwdWrW1x1,1,85658,0,miopenConvolutionBwdWeightsAlgoDirect;miopenConvolutionBwdWeightsAlgoWinograd:ConvBinWinogradRxS,33,4356,0,miopenConvolutionBwdWeightsAlgoWinograd;miopenConvolutionBwdWeightsAlgoGEMM:gemm,438,314,0,MIOpenGEMM
832-7-7-1x1-48-7-7-128-0x0-1x1-1x1-0-NCHW-FP32-F=miopenConvolutionFwdAlgoDirect:ConvAsm1x1U,0,817892,0,miopenConvolutionFwdAlgoDirect;miopenConvolutionFwdAlgoGEMM:GemmFwd1x1_0_1,121,779,0,MIOpenGEMM
32-28-28-1x1-256-28-28-128-0x0-1x1-1x1-0-NCHW-FP32-B=miopenConvolutionBwdDataAlgoDirect:ConvAsm1x1U,0,913431,0,miopenConvolutionBwdDataAlgoDirect;miopenConvolutionBwdDataAlgoWinograd:ConvBinWinogradRxS,1,52391,0,miopenConvolutionBwdDataAlgoWinograd;miopenConvolutionBwdDataAlgoGEMM:gemm,3,25331,0,MIOpenGEMM
192-7-7-1x1-832-7-7-128-0x0-1x1-1x1-0-NCHW-FP32-B=miopenConvolutionBwdDataAlgoDirect:ConvAsm1x1U,0,97371,0,miopenConvolutionBwdDataAlgoDirect;miopenConvolutionBwdDataAlgoGEMM:gemm,67,5974,0,MIOpenGEMM
512-14-14-1x1-32-14-14-128-0x0-1x1-1x1-0-NCHW-FP32-F=miopenConvolutionFwdAlgoDirect:ConvOclDirectFwd1x1,0,74697,0,miopenConvolutionFwdAlgoDirect;miopenConvolutionFwdAlgoGEMM:GemmFwd1x1_0_1,292,9,0,MIOpenGEMM
512-14-14-1x1-24-14-14-128-0x0-1x1-1x1-0-NCHW-FP32-F=miopenConvolutionFwdAlgoDirect:ConvAsm1x1U,0,356722,0,miopenConvolutionFwdAlgoDirect;miopenConvolutionFwdAlgoWinograd:ConvBinWinogradRxSf3x2,0,648691,0,miopenConvolutionFwdAlgoWinograd;miopenConvolutionFwdAlgoGEMM:GemmFwd1x1_0_1,99,4047,0,MIOpenGEMM
160-14-14-1x1-528-14-14-128-0x0-1x1-1x1-0-NCHW-FP32-W=miopenConvolutionBwdWeightsAlgoDirect:ConvAsmBwdWrW1x1,3,87044,0,miopenConvolutionBwdWeightsAlgoDirect;miopenConvolutionBwdWeightsAlgoWinograd:ConvBinWinogradRxSf2x3,35,435,0,miopenConvolutionBwdWeightsAlgoWinograd;miopenConvolutionBwdWeightsAlgoGEMM:gemm,88,9037,0,MIOpenGEMM
256-56-56-3x3-128-56-56-128-1x1-1x1-1x1-0-NCHW-FP32-W=miopenConvolutionBwdWeightsAlgoWinograd:ConvBinWinogradRxS,1472,0,miopenConvolutionBwdWeightsAlgoWinograd,256x56x56x3x3x128x56x56x128xNCHWxFP32x1x1x1x1x1x1x1x0;miopenConvolutionBwdWeightsAlgoDirect:ConvOclBwdWrW53,1494,63,37748736,miopenConvolutionBwdWeightsAlgoDirect;miopenConvolutionBwdWeightsAlgoImplicitGEMM:ConvHipImplicitGemmV4R1WrW,1759,55,0,miopenConvolutionBwdWeightsAlgoImplicitGEMM;miopenConvolutionBwdWeightsAlgoGEMM:gemm,2468,89,14450688,MIOpenGEMM
480-14-14-1x1-192-14-14-128-0x0-1x1-1x1-0-NCHW-FP32-F=miopenConvolutionFwdAlgoDirect:ConvAsm1x1U,2,97783,0,miopenConvolutionFwdAlgoDirect;miopenConvolutionFwdAlgoGEMM:GemmFwd1x1_0_1,1358,79,0,MIOpenGEMM
384-7-7-1x1-832-7-7-128-0x0-1x1-1x1-0-NCHW-FP32-W=miopenConvolutionBwdWeightsAlgoDirect:ConvAsmBwdWrW1x1,2,14614,0,miopenConvolutionBwdWeightsAlgoDirect
256-28-28-1x1-32-28-28-128-0x0-1x1-1x1-0-NCHW-FP32-F=miopenConvolutionFwdAlgoDirect:ConvOclDirectFwd1x1,0,801076,0,miopenConvolutionFwdAlgoDirect;miopenConvolutionFwdAlgoWinograd:ConvBinWinogradRxSf3x2,1,3904,0,miopenConvolutionFwdAlgoWinograd;miopenConvolutionFwdAlgoGEMM:GemmFwd1x1_0_1,131,707,0,MIOpenGEMM
256-56-56-3x3-128-56-56-128-1x1-1x1-1x1-0-NCHW-FP32-B=miopenConvolutionBwdDataAlgoWinograd:ConvBinWinogradRxS,320,172,0,miopenConvolutionBwdDataAlgoWinograd
192-56-56-3x3-64-56-56-128-1x1-1x1-1x1-0-NCHW-FP32-W=miopenConvolutionBwdWeightsAlgoDirect:ConvOclBwdWrW53,103,992,14155776,miopenConvolutionBwdWeightsAlgoDirect;miopenConvolutionBwdWeightsAlgoImplicitGEMM:ConvHipImplicitGemmV4R1WrW,396,587,0,miopenConvolutionBwdWeightsAlgoImplicitGEMM;miopenConvolutionBwdWeightsAlgoGEMM:gemm,1200,84,7225344,MIOpenGEMM;miopenConvolutionBwdWeightsAlgoWinograd:ConvBinWinogradRxS,1795,66,0,miopenConvolutionBwdWeightsAlgoWinograd
112-14-14-1x1-512-14-14-128-0x0-1x1-1x1-0-NCHW-FP32-B=miopenConvolutionBwdDataAlgoDirect:ConvAsm1x1U,1,75483,0,miopenConvolutionBwdDataAlgoDirect;miopenConvolutionBwdDataAlgoGEMM:gemm,1195,7,0,MIOpenGEMM
128-28-28-3x3-96-28-28-128-1x1-1x1-1x1-0-NCHW-FP32-W=miopenConvolutionBwdWeightsAlgoDirect:ConvAsmBwdWrW3x3,23,419,0,miopenConvolutionBwdWeightsAlgoDirect;miopenConvolutionBwdWeightsAlgoWinograd:ConvBinWinogradRxSf2x3,38,246,0,miopenConvolutionBwdWeightsAlgoWinograd;miopenConvolutionBwdWeightsAlgoGEMM:gemm,718,11,2709504,MIOpenGEMM
128-28-28-3x3-96-28-28-128-1x1-1x1-1x1-0-NCHW-FP32-B=miopenConvolutionBwdDataAlgoWinograd:ConvBinWinogradRxS,1,89432,0,miopenConvolutionBwdDataAlgoWinograd
192-56-56-3x3-64-56-56-128-1x1-1x1-1x1-0-NCHW-FP32-B=miopenConvolutionBwdDataAlgoWinograd:ConvBinWinogradRxS,6,92723,0,miopenConvolutionBwdDataAlgoWinograd
24-14-14-1x1-512-14-14-128-0x0-1x1-1x1-0-NCHW-FP32-W=miopenConvolutionBwdWeightsAlgoDirect:ConvAsmBwdWrW1x1,2,36217,0,miopenConvolutionBwdWeightsAlgoDirect;miopenConvolutionBwdWeightsAlgoWinograd:ConvBinWinogradRxS,4,99667,0,miopenConvolutionBwdWeightsAlgoWinograd;miopenConvolutionBwdWeightsAlgoGEMM:gemm,413,584,0,MIOpenGEMM
16-14-14-1x1-480-14-14-128-0x0-1x1-1x1-0-NCHW-FP32-W=miopenConvolutionBwdWeightsAlgoDirect:ConvOclBwdWrW1x1,0,550617,0,miopenConvolutionBwdWeightsAlgoDirect;miopenConvolutionBwdWeightsAlgoWinograd:ConvBinWinogradRxS,5,5139,0,miopenConvolutionBwdWeightsAlgoWinograd;miopenConvolutionBwdWeightsAlgoGEMM:gemm,360,55,0,MIOpenGEMM
24-14-14-1x1-512-14-14-128-0x0-1x1-1x1-0-NCHW-FP32-B=miopenConvolutionBwdDataAlgoDirect:ConvAsm1x1U,0,354574,0,miopenConvolutionBwdDataAlgoDirect;miopenConvolutionBwdDataAlgoGEMM:gemm,40,9305,0,MIOpenGEMM
96-28-28-3x3-128-28-28-128-1x1-1x1-1x1-0-NCHW-FP32-F=miopenConvolutionFwdAlgoWinograd:ConvBinWinograd3x3U,3,16623,0,miopenConvolutionFwdAlgoWinograd
128-56-56-3x3-256-56-56-128-1x1-1x1-1x1-0-NCHW-FP32-F=miopenConvolutionFwdAlgoWinograd:ConvBinWinogradRxSf2x3,306,393,0,miopenConvolutionFwdAlgoWinograd
64-56-56-3x3-192-56-56-128-1x1-1x1-1x1-0-NCHW-FP32-F=miopenConvolutionFwdAlgoWinograd:ConvBinWinogradRxS,46,6457,0,miopenConvolutionFwdAlgoWinograd
384-7-7-1x1-832-7-7-128-0x0-1x1-1x1-0-NCHW-FP32-B=miopenConvolutionBwdDataAlgoDirect:ConvAsm1x1U,1,30278,0,miopenConvolutionBwdDataAlgoDirect;miopenConvolutionBwdDataAlgoWinograd:ConvBinWinogradRxSf3x2,8,95738,0,miopenConvolutionBwdDataAlgoWinograd;miopenConvolutionBwdDataAlgoGEMM:gemm,112,612,0,MIOpenGEMM
208-14-14-3x3-96-14-14-128-1x1-1x1-1x1-0-NCHW-FP32-W=miopenConvolutionBwdWeightsAlgoDirect:ConvAsmBwdWrW3x3,4,4421,0,miopenConvolutionBwdWeightsAlgoDirect;miopenConvolutionBwdWeightsAlgoWinograd:ConvBinWinogradRxS,4,461,0,miopenConvolutionBwdWeightsAlgoWinograd;miopenConvolutionBwdWeightsAlgoGEMM:gemm,268,324,677376,MIOpenGEMM
16-14-14-1x1-480-14-14-128-0x0-1x1-1x1-0-NCHW-FP32-B=miopenConvolutionBwdDataAlgoDirect:ConvAsm1x1U,0,369767,0,miopenConvolutionBwdDataAlgoDirect;miopenConvolutionBwdDataAlgoWinograd:ConvBinWinogradRxSf2x3,10,2269,0,miopenConvolutionBwdDataAlgoWinograd;miopenConvolutionBwdDataAlgoGEMM:gemm,45,3405,0,MIOpenGEMM
208-14-14-3x3-96-14-14-128-1x1-1x1-1x1-0-NCHW-FP32-B=miopenConvolutionBwdDataAlgoWinograd:ConvBinWinogradRxS,1,1792,0,miopenConvolutionBwdDataAlgoWinograd
512-14-14-1x1-112-14-14-128-0x0-1x1-1x1-0-NCHW-FP32-F=miopenConvolutionFwdAlgoDirect:ConvOclDirectFwd1x1,1,12352,0,miopenConvolutionFwdAlgoDirect;miopenConvolutionFwdAlgoGEMM:GemmFwd1x1_0_1,103,918,0,MIOpenGEMM
128-28-28-1x1-256-28-28-128-0x0-1x1-1x1-0-NCHW-FP32-W=miopenConvolutionBwdWeightsAlgoDirect:ConvAsmBwdWrW1x1,7,99516,0,miopenConvolutionBwdWeightsAlgoDirect;miopenConvolutionBwdWeightsAlgoGEMM:gemm,119,684,0,MIOpenGEMM
96-14-14-3x3-208-14-14-128-1x1-1x1-1x1-0-NCHW-FP32-F=miopenConvolutionFwdAlgoWinograd:ConvBinWinograd3x3U,1,63958,0,miopenConvolutionFwdAlgoWinograd
832-7-7-1x1-192-7-7-128-0x0-1x1-1x1-0-NCHW-FP32-F=miopenConvolutionFwdAlgoDirect:ConvOclDirectFwd1x1,6,52674,0,miopenConvolutionFwdAlgoDirect;miopenConvolutionFwdAlgoWinograd:ConvBinWinogradRxSf3x2,22,4063,0,miopenConvolutionFwdAlgoWinograd;miopenConvolutionFwdAlgoGEMM:GemmFwd1x1_0_1,394,128,0,MIOpenGEMM
32-14-14-1x1-528-14-14-128-0x0-1x1-1x1-0-NCHW-FP32-W=miopenConvolutionBwdWeightsAlgoDirect:ConvAsmBwdWrW1x1,0,440305,0,miopenConvolutionBwdWeightsAlgoDirect;miopenConvolutionBwdWeightsAlgoWinograd:ConvBinWinogradRxSf2x3,2,57802,0,miopenConvolutionBwdWeightsAlgoWinograd;miopenConvolutionBwdWeightsAlgoGEMM:gemm,62,9559,0,MIOpenGEMM
96-14-14-1x1-480-14-14-128-0x0-1x1-1x1-0-NCHW-FP32-W=miopenConvolutionBwdWeightsAlgoDirect:ConvAsmBwdWrW1x1,1,12282,0,miopenConvolutionBwdWeightsAlgoDirect;miopenConvolutionBwdWeightsAlgoWinograd:ConvBinWinogradRxS,6,79705,0,miopenConvolutionBwdWeightsAlgoWinograd;miopenConvolutionBwdWeightsAlgoGEMM:gemm,36,1104,0,MIOpenGEMM
160-7-7-1x1-832-7-7-128-0x0-1x1-1x1-0-NCHW-FP32-W=miopenConvolutionBwdWeightsAlgoDirect:ConvAsmBwdWrW1x1,6,16601,0,miopenConvolutionBwdWeightsAlgoDirect;miopenConvolutionBwdWeightsAlgoGEMM:gemm,417,694,0,MIOpenGEMM
48-7-7-1x1-832-7-7-128-0x0-1x1-1x1-0-NCHW-FP32-W=miopenConvolutionBwdWeightsAlgoDirect:ConvOclBwdWrW1x1,0,450569,0,miopenConvolutionBwdWeightsAlgoDirect;miopenConvolutionBwdWeightsAlgoGEMM:gemm,78,9745,0,MIOpenGEMM
32-14-14-1x1-528-14-14-128-0x0-1x1-1x1-0-NCHW-FP32-B=miopenConvolutionBwdDataAlgoDirect:ConvAsm1x1U,1,3818,0,miopenConvolutionBwdDataAlgoDirect;miopenConvolutionBwdDataAlgoGEMM:gemm,86,3021,0,MIOpenGEMM
160-14-14-1x1-512-14-14-128-0x0-1x1-1x1-0-NCHW-FP32-W=miopenConvolutionBwdWeightsAlgoDirect:ConvAsmBwdWrW1x1,8,12689,0,miopenConvolutionBwdWeightsAlgoDirect;miopenConvolutionBwdWeightsAlgoGEMM:gemm,413,552,0,MIOpenGEMM
480-14-14-1x1-16-14-14-128-0x0-1x1-1x1-0-NCHW-FP32-F=miopenConvolutionFwdAlgoDirect:ConvAsm1x1U,0,300326,0,miopenConvolutionFwdAlgoDirect;miopenConvolutionFwdAlgoGEMM:GemmFwd1x1_0_1,48,494,0,MIOpenGEMM
48-7-7-1x1-832-7-7-128-0x0-1x1-1x1-0-NCHW-FP32-B=miopenConvolutionBwdDataAlgoWinograd:ConvBinWinogradRxS,2,51213,0,miopenConvolutionBwdDataAlgoWinograd;miopenConvolutionBwdDataAlgoGEMM:gemm,82,8557,0,MIOpenGEMM
160-7-7-1x1-832-7-7-128-0x0-1x1-1x1-0-NCHW-FP32-B=miopenConvolutionBwdDataAlgoDirect:ConvAsm1x1U,1,55555,0,miopenConvolutionBwdDataAlgoDirect;miopenConvolutionBwdDataAlgoGEMM:gemm,274,732,0,MIOpenGEMM
96-14-14-1x1-480-14-14-128-0x0-1x1-1x1-0-NCHW-FP32-B=miopenConvolutionBwdDataAlgoDirect:ConvAsm1x1U,1,51223,0,miopenConvolutionBwdDataAlgoDirect;miopenConvolutionBwdDataAlgoGEMM:gemm,317,177,0,MIOpenGEMM
832-7-7-1x1-384-7-7-128-0x0-1x1-1x1-0-NCHW-FP32-F=miopenConvolutionFwdAlgoDirect:ConvOclDirectFwd1x1,1,18632,0,miopenConvolutionFwdAlgoDirect;miopenConvolutionFwdAlgoWinograd:ConvBinWinogradRxSf3x2,12,1957,0,miopenConvolutionFwdAlgoWinograd;miopenConvolutionFwdAlgoGEMM:GemmFwd1x1_0_1,282,414,0,MIOpenGEMM
528-14-14-1x1-32-14-14-128-0x0-1x1-1x1-0-NCHW-FP32-F=miopenConvolutionFwdAlgoDirect:ConvAsm1x1U,0,626986,0,miopenConvolutionFwdAlgoDirect;miopenConvolutionFwdAlgoGEMM:GemmFwd1x1_0_1,135,337,0,MIOpenGEMM
256-7-7-1x1-832-7-7-128-0x0-1x1-1x1-0-NCHW-FP32-B=miopenConvolutionBwdDataAlgoDirect:ConvAsm1x1U,4,50568,0,miopenConvolutionBwdDataAlgoDirect;miopenConvolutionBwdDataAlgoGEMM:gemm,264,829,0,MIOpenGEMM
256-14-14-1x1-528-14-14-128-0x0-1x1-1x1-0-NCHW-FP32-W=miopenConvolutionBwdWeightsAlgoDirect:ConvAsmBwdWrW1x1,14,7356,0,miopenConvolutionBwdWeightsAlgoDirect;miopenConvolutionBwdWeightsAlgoWinograd:ConvBinWinogradRxSf2x3,67,7229,0,miopenConvolutionBwdWeightsAlgoWinograd;miopenConvolutionBwdWeightsAlgoGEMM:gemm,279,349,0,MIOpenGEMM
32-7-7-1x1-832-7-7-128-0x0-1x1-1x1-0-NCHW-FP32-W=miopenConvolutionBwdWeightsAlgoDirect:ConvOclBwdWrW1x1,0,334018,0,miopenConvolutionBwdWeightsAlgoDirect;miopenConvolutionBwdWeightsAlgoGEMM:gemm,161,345,0,MIOpenGEMM
160-14-14-1x1-512-14-14-128-0x0-1x1-1x1-0-NCHW-FP32-B=miopenConvolutionBwdDataAlgoDirect:ConvAsm1x1U,4,316,0,miopenConvolutionBwdDataAlgoDirect;miopenConvolutionBwdDataAlgoGEMM:gemm,2026,85,0,MIOpenGEMM
512-14-14-1x1-160-14-14-128-0x0-1x1-1x1-0-NCHW-FP32-F=miopenConvolutionFwdAlgoWinograd:ConvBinWinogradRxS,3,43143,0,miopenConvolutionFwdAlgoWinograd;miopenConvolutionFwdAlgoDirect:ConvOclDirectFwd1x1,3,82808,0,miopenConvolutionFwdAlgoDirect;miopenConvolutionFwdAlgoGEMM:GemmFwd1x1_0_1,6,54789,0,MIOpenGEMM
832-7-7-1x1-160-7-7-128-0x0-1x1-1x1-0-NCHW-FP32-F=miopenConvolutionFwdAlgoDirect:ConvOclDirectFwd1x1,0,877837,0,miopenConvolutionFwdAlgoDirect;miopenConvolutionFwdAlgoGEMM:GemmFwd1x1_0_1,170,979,0,MIOpenGEMM
32-7-7-1x1-832-7-7-128-0x0-1x1-1x1-0-NCHW-FP32-B=miopenConvolutionBwdDataAlgoDirect:ConvAsm1x1U,0,121191,0,miopenConvolutionBwdDataAlgoDirect;miopenConvolutionBwdDataAlgoGEMM:gemm,43,351,0,MIOpenGEMM
144-14-14-1x1-512-14-14-128-0x0-1x1-1x1-0-NCHW-FP32-W=miopenConvolutionBwdWeightsAlgoDirect:ConvAsmBwdWrW1x1,4,56081,0,miopenConvolutionBwdWeightsAlgoDirect
128-7-7-1x1-832-7-7-128-0x0-1x1-1x1-0-NCHW-FP32-W=miopenConvolutionBwdWeightsAlgoDirect:ConvAsmBwdWrW1x1,1,353,0,miopenConvolutionBwdWeightsAlgoDirect;miopenConvolutionBwdWeightsAlgoGEMM:gemm,64,578,0,MIOpenGEMM
256-14-14-1x1-528-14-14-128-0x0-1x1-1x1-0-NCHW-FP32-B=miopenConvolutionBwdDataAlgoDirect:ConvAsm1x1U,3,78308,0,miopenConvolutionBwdDataAlgoDirect;miopenConvolutionBwdDataAlgoGEMM:gemm,61,3127,0,MIOpenGEMM
128-7-7-1x1-832-7-7-128-0x0-1x1-1x1-0-NCHW-FP32-B=miopenConvolutionBwdDataAlgoDirect:ConvAsm1x1U,0,961376,0,miopenConvolutionBwdDataAlgoDirect;miopenConvolutionBwdDataAlgoGEMM:gemm,48,2232,0,MIOpenGEMM
832-7-7-1x1-32-7-7-128-0x0-1x1-1x1-0-NCHW-FP32-F=miopenConvolutionFwdAlgoWinograd:ConvBinWinogradRxSf3x2,0,491576,0,miopenConvolutionFwdAlgoWinograd;miopenConvolutionFwdAlgoGEMM:GemmFwd1x1_0_1,180,113,0,MIOpenGEMM
128-28-28-1x1-256-28-28-128-0x0-1x1-1x1-0-NCHW-FP32-B=miopenConvolutionBwdDataAlgoDirect:ConvAsm1x1U,2,87363,0,miopenConvolutionBwdDataAlgoDirect;miopenConvolutionBwdDataAlgoWinograd:ConvBinWinogradRxSf3x2,7,9715,0,miopenConvolutionBwdDataAlgoWinograd;miopenConvolutionBwdDataAlgoGEMM:gemm,1005,1,0,MIOpenGEMM
160-14-14-1x1-528-14-14-128-0x0-1x1-1x1-0-NCHW-FP32-B=miopenConvolutionBwdDataAlgoDirect:ConvAsm1x1U,10,9588,0,miopenConvolutionBwdDataAlgoDirect;miopenConvolutionBwdDataAlgoGEMM:gemm,3230,46,0,MIOpenGEMM
256-7-7-1x1-832-7-7-128-0x0-1x1-1x1-0-NCHW-FP32-W=miopenConvolutionBwdWeightsAlgoDirect:ConvAsmBwdWrW1x1,1,29174,0,miopenConvolutionBwdWeightsAlgoDirect;miopenConvolutionBwdWeightsAlgoGEMM:gemm,226,383,0,MIOpenGEMM
64-14-14-1x1-512-14-14-128-0x0-1x1-1x1-0-NCHW-FP32-B=miopenConvolutionBwdDataAlgoDirect:ConvAsm1x1U,0,587147,0,miopenConvolutionBwdDataAlgoDirect;miopenConvolutionBwdDataAlgoGEMM:gemm,41,2779,0,MIOpenGEMM
832-7-7-1x1-128-7-7-128-0x0-1x1-1x1-0-NCHW-FP32-F=miopenConvolutionFwdAlgoDirect:ConvOclDirectFwd1x1,1,1344,0,miopenConvolutionFwdAlgoDirect;miopenConvolutionFwdAlgoWinograd:ConvBinWinogradRxSf3x2,1,84167,0,miopenConvolutionFwdAlgoWinograd;miopenConvolutionFwdAlgoGEMM:GemmFwd1x1_0_1,147,511,0,MIOpenGEMM
256-28-28-1x1-128-28-28-128-0x0-1x1-1x1-0-NCHW-FP32-F=miopenConvolutionFwdAlgoDirect:ConvOclDirectFwd1x1,4,97809,0,miopenConvolutionFwdAlgoDirect;miopenConvolutionFwdAlgoGEMM:GemmFwd1x1_0_1,289,667,0,MIOpenGEMM
64-56-56-1x1-64-56-56-128-0x0-1x1-1x1-0-NCHW-FP32-W=miopenConvolutionBwdWeightsAlgoDirect:ConvAsmBwdWrW1x1,7,34633,0,miopenConvolutionBwdWeightsAlgoDirect
528-14-14-1x1-160-14-14-128-0x0-1x1-1x1-0-NCHW-FP32-F=miopenConvolutionFwdAlgoWinograd:ConvBinWinogradRxSf3x2,4,71077,0,miopenConvolutionFwdAlgoWinograd;miopenConvolutionFwdAlgoGEMM:GemmFwd1x1_0_1,98,2288,0,MIOpenGEMM
64-14-14-5x5-24-14-14-128-2x2-1x1-1x1-0-NCHW-FP32-W=miopenConvolutionBwdWeightsAlgoDirect:ConvOclBwdWrW53,1,23485,19660800,miopenConvolutionBwdWeightsAlgoDirect;miopenConvolutionBwdWeightsAlgoWinograd:ConvBinWinogradRxS,3,96618,0,miopenConvolutionBwdWeightsAlgoWinograd;miopenConvolutionBwdWeightsAlgoGEMM:gemm,205,363,470400,MIOpenGEMM
128-14-14-1x1-528-14-14-128-0x0-1x1-1x1-0-NCHW-FP32-W=miopenConvolutionBwdWeightsAlgoDirect:ConvAsmBwdWrW1x1,4,1093,0,miopenConvolutionBwdWeightsAlgoDirect;miopenConvolutionBwdWeightsAlgoWinograd:ConvBinWinogradRxSf2x3,20,1363,0,miopenConvolutionBwdWeightsAlgoWinograd;miopenConvolutionBwdWeightsAlgoGEMM:gemm,32,2983,0,MIOpenGEMM
64-14-14-5x5-24-14-14-128-2x2-1x1-1x1-0-NCHW-FP32-B=miopenConvolutionBwdDataAlgoWinograd:ConvBinWinogradRxS,1,88732,0,miopenConvolutionBwdDataAlgoWinograd;miopenConvolutionBwdDataAlgoDirect:ConvOclDirectFwd,5,95649,0,miopenConvolutionBwdDataAlgoDirect;miopenConvolutionBwdDataAlgoFFT:fft,17,1891,28385280,miopenConvolutionBwdDataAlgoFFT;miopenConvolutionBwdDataAlgoGEMM:gemm,224,328,470400,MIOpenGEMM
24-14-14-5x5-64-14-14-128-2x2-1x1-1x1-0-NCHW-FP32-F=miopenConvolutionFwdAlgoWinograd:ConvBinWinogradRxS,0,409684,0,miopenConvolutionFwdAlgoWinograd;miopenConvolutionFwdAlgoImplicitGEMM:ConvHipImplicitGemmV4R1Fwd,2,609,0,miopenConvolutionFwdAlgoImplicitGEMM;miopenConvolutionFwdAlgoFFT:fft,4,87333,23777280,miopenConvolutionFwdAlgoFFT;miopenConvolutionFwdAlgoDirect:ConvOclDirectFwd,5,70841,0,miopenConvolutionFwdAlgoDirect;miopenConvolutionFwdAlgoGEMM:GemmFwdRest,41,779,470400,MIOpenGEMM
832-7-7-1x1-256-7-7-128-0x0-1x1-1x1-0-NCHW-FP32-F=miopenConvolutionFwdAlgoDirect:ConvAsm1x1U,1,74881,0,miopenConvolutionFwdAlgoDirect;miopenConvolutionFwdAlgoGEMM:GemmFwd1x1_0_1,259,998,0,MIOpenGEMM
128-112-112-3x3-128-112-112-128-1x1-1x1-1x1-0-NCHW-FP32-W=miopenConvolutionBwdWeightsAlgoDirect:ConvAsmBwdWrW3x3,1166,29,0,miopenConvolutionBwdWeightsAlgoDirect;miopenConvolutionBwdWeightsAlgoWinograd:ConvBinWinogradRxS,3029,76,0,miopenConvolutionBwdWeightsAlgoWinograd;miopenConvolutionBwdWeightsAlgoImplicitGEMM:ConvHipImplicitGemmV4R1WrW,3574,34,0,miopenConvolutionBwdWeightsAlgoImplicitGEMM;miopenConvolutionBwdWeightsAlgoGEMM:gemm,3582,42,57802752,MIOpenGEMM
128-14-14-1x1-528-14-14-128-0x0-1x1-1x1-0-NCHW-FP32-B=miopenConvolutionBwdDataAlgoDirect:ConvAsm1x1U,2,6828,0,miopenConvolutionBwdDataAlgoDirect;miopenConvolutionBwdDataAlgoGEMM:gemm,545,951,0,MIOpenGEMM
128-112-112-3x3-128-112-112-128-1x1-1x1-1x1-0-NCHW-FP32-B=miopenConvolutionBwdDataAlgoWinograd:ConvBinWinogradRxSf2x3,421,789,0,miopenConvolutionBwdDataAlgoWinograd
528-14-14-1x1-128-14-14-128-0x0-1x1-1x1-0-NCHW-FP32-F=miopenConvolutionFwdAlgoDirect:ConvOclDirectFwd1x1,2,3729,0,miopenConvolutionFwdAlgoDirect;miopenConvolutionFwdAlgoGEMM:GemmFwd1x1_0_1,256,151,0,MIOpenGEMM
64-14-14-1x1-512-14-14-128-0x0-1x1-1x1-0-NCHW-FP32-W=miopenConvolutionBwdWeightsAlgoDirect:ConvAsmBwdWrW1x1,1,40654,0,miopenConvolutionBwdWeightsAlgoDirect;miopenConvolutionBwdWeightsAlgoGEMM:gemm,130,235,0,MIOpenGEMM
512-14-14-1x1-64-14-14-128-0x0-1x1-1x1-0-NCHW-FP32-F=miopenConvolutionFwdAlgoDirect:ConvOclDirectFwd1x1,3,28586,0,miopenConvolutionFwdAlgoDirect;miopenConvolutionFwdAlgoWinograd:ConvBinWinogradRxSf2x3,4,53009,0,miopenConvolutionFwdAlgoWinograd;miopenConvolutionFwdAlgoGEMM:GemmFwd1x1_0_1,63,1597,0,MIOpenGEMM
128-17-17-7x1-128-17-17-128-3x0-1x1-1x1-0-NCHW-FP32-W=miopenConvolutionBwdWeightsAlgoDirect:ConvOclBwdWrW53,16,787,0,miopenConvolutionBwdWeightsAlgoDirect;miopenConvolutionBwdWeightsAlgoWinograd:ConvBinWinogradRxSf2x3,22,8038,0,miopenConvolutionBwdWeightsAlgoWinograd;miopenConvolutionBwdWeightsAlgoImplicitGEMM:ConvHipImplicitGemmV4R1WrW,75,9381,0,miopenConvolutionBwdWeightsAlgoImplicitGEMM;miopenConvolutionBwdWeightsAlgoGEMM:gemm,1812,9,1035776,MIOpenGEMM
160-17-17-1x7-160-17-17-128-0x3-1x1-1x1-0-NCHW-FP32-B=miopenConvolutionBwdDataAlgoWinograd:ConvBinWinogradRxSf3x2,28,2438,0,miopenConvolutionBwdDataAlgoWinograd;miopenConvolutionBwdDataAlgoImplicitGEMM:ConvHipImplicitGemmBwdDataV1R1,75,1679,0,miopenConvolutionBwdDataAlgoImplicitGEMM;miopenConvolutionBwdDataAlgoGEMM:gemm,1217,11,1294720,MIOpenGEMM
128-17-17-7x1-128-17-17-128-3x0-1x1-1x1-0-NCHW-FP32-B=miopenConvolutionBwdDataAlgoWinograd:ConvBinWinogradRxSf3x2,5,5424,0,miopenConvolutionBwdDataAlgoWinograd;miopenConvolutionBwdDataAlgoImplicitGEMM:ConvHipImplicitGemmBwdDataV1R1,36,1028,0,miopenConvolutionBwdDataAlgoImplicitGEMM;miopenConvolutionBwdDataAlgoGEMM:gemm,2727,51,1035776,MIOpenGEMM
160-17-17-1x7-160-17-17-128-0x3-1x1-1x1-0-NCHW-FP32-F=miopenConvolutionFwdAlgoWinograd:ConvBinWinogradRxSf3x2,10,7013,0,miopenConvolutionFwdAlgoWinograd;miopenConvolutionFwdAlgoImplicitGEMM:ConvHipImplicitGemmV4R1Fwd,18,926,0,miopenConvolutionFwdAlgoImplicitGEMM;miopenConvolutionFwdAlgoGEMM:GemmFwdRest,1305,25,1294720,MIOpenGEMM
128-17-17-7x1-128-17-17-128-3x0-1x1-1x1-0-NCHW-FP32-F=miopenConvolutionFwdAlgoWinograd:ConvBinWinogradRxSf3x2,5,27587,0,miopenConvolutionFwdAlgoWinograd;miopenConvolutionFwdAlgoImplicitGEMM:ConvHipImplicitGemmV4R1Fwd,26,1401,0,miopenConvolutionFwdAlgoImplicitGEMM;miopenConvolutionFwdAlgoGEMM:GemmFwdRest,1667,73,1035776,MIOpenGEMM
128-17-17-1x7-128-17-17-128-0x3-1x1-1x1-0-NCHW-FP32-W=miopenConvolutionBwdWeightsAlgoWinograd:ConvBinWinogradRxSf2x3,13,8306,0,miopenConvolutionBwdWeightsAlgoWinograd;miopenConvolutionBwdWeightsAlgoImplicitGEMM:ConvHipImplicitGemmV4R1WrW,55,5893,0,miopenConvolutionBwdWeightsAlgoImplicitGEMM;miopenConvolutionBwdWeightsAlgoDirect:ConvOclBwdWrW53,64,7409,0,miopenConvolutionBwdWeightsAlgoDirect;miopenConvolutionBwdWeightsAlgoGEMM:gemm,935,192,1035776,MIOpenGEMM
448-8-8-1x1-1280-8-8-128-0x0-1x1-1x1-0-NCHW-FP32-W=miopenConvolutionBwdWeightsAlgoDirect:ConvAsmBwdWrW1x1,5,51317,0,miopenConvolutionBwdWeightsAlgoDirect;miopenConvolutionBwdWeightsAlgoWinograd:ConvBinWinogradRxS,79,2224,0,miopenConvolutionBwdWeightsAlgoWinograd;miopenConvolutionBwdWeightsAlgoGEMM:gemm,381,719,0,MIOpenGEMM
384-13-13-3x3-384-13-13-512-1x1-1x1-1x1-0-NCHW-FP32-W=miopenConvolutionBwdWeightsAlgoImplicitGEMM:ConvHipImplicitGemmV4R1WrW,436,905,0,miopenConvolutionBwdWeightsAlgoImplicitGEMM;miopenConvolutionBwdWeightsAlgoWinograd:ConvBinWinogradRxS,655,972,0,miopenConvolutionBwdWeightsAlgoWinograd;miopenConvolutionBwdWeightsAlgoDirect:ConvOclBwdWrW53,782,634,0,miopenConvolutionBwdWeightsAlgoDirect
1280-8-8-1x1-320-8-8-128-0x0-1x1-1x1-0-NCHW-FP32-F=miopenConvolutionFwdAlgoDirect:ConvAsm1x1U,3,95418,0,miopenConvolutionFwdAlgoDirect;miopenConvolutionFwdAlgoWinograd:ConvBinWinogradRxSf3x2,17,8168,0,miopenConvolutionFwdAlgoWinograd;miopenConvolutionFwdAlgoGEMM:GemmFwd1x1_0_1,163,908,0,MIOpenGEMM
512-14-14-3x3-512-14-14-128-1x1-1x1-1x1-0-NCHW-FP32-B=miopenConvolutionBwdDataAlgoWinograd:ConvBinWinogradRxSf3x2,49,7188,0,miopenConvolutionBwdDataAlgoWinograd
192-17-17-1x7-128-17-17-128-0x3-1x1-1x1-0-NCHW-FP32-B=miopenConvolutionBwdDataAlgoWinograd:ConvBinWinogradRxSf3x2,13,3442,0,miopenConvolutionBwdDataAlgoWinograd;miopenConvolutionBwdDataAlgoImplicitGEMM:ConvHipImplicitGemmBwdDataV1R1,43,417,0,miopenConvolutionBwdDataAlgoImplicitGEMM;miopenConvolutionBwdDataAlgoGEMM:gemm,2261,49,1035776,MIOpenGEMM
192-17-17-1x7-160-17-17-128-0x3-1x1-1x1-0-NCHW-FP32-B=miopenConvolutionBwdDataAlgoWinograd:ConvBinWinogradRxSf3x2,19,1038,0,miopenConvolutionBwdDataAlgoWinograd;miopenConvolutionBwdDataAlgoImplicitGEMM:ConvHipImplicitGemmBwdDataV1R1,83,5517,0,miopenConvolutionBwdDataAlgoImplicitGEMM;miopenConvolutionBwdDataAlgoGEMM:gemm,283,714,1294720,MIOpenGEMM
512-28-28-3x3-512-28-28-128-1x1-1x1-1x1-0-NCHW-FP32-F=miopenConvolutionFwdAlgoWinograd:ConvBinWinogradRxSf3x2,74,8199,0,miopenConvolutionFwdAlgoWinograd
128-17-17-1x7-192-17-17-128-0x3-1x1-1x1-0-NCHW-FP32-F=miopenConvolutionFwdAlgoWinograd:ConvBinWinogradRxSf3x2,41,9488,0,miopenConvolutionFwdAlgoWinograd;miopenConvolutionFwdAlgoImplicitGEMM:ConvHipImplicitGemmV4R1Fwd,48,4327,0,miopenConvolutionFwdAlgoImplicitGEMM;miopenConvolutionFwdAlgoGEMM:GemmFwdRest,1450,1,1035776,MIOpenGEMM
160-17-17-1x7-192-17-17-128-0x3-1x1-1x1-0-NCHW-FP32-F=miopenConvolutionFwdAlgoImplicitGEMM:ConvHipImplicitGemmV4R1Fwd,74,747,0,miopenConvolutionFwdAlgoImplicitGEMM;miopenConvolutionFwdAlgoWinograd:ConvBinWinogradRxSf2x3,97,3616,0,miopenConvolutionFwdAlgoWinograd;miopenConvolutionFwdAlgoGEMM:GemmFwdRest,1442,72,1294720,MIOpenGEMM
192-8-8-3x3-192-17-17-128-0x0-2x2-1x1-0-NCHW-FP32-W=miopenConvolutionBwdWeightsAlgoImplicitGEMM:ConvHipImplicitGemmV4R1WrW,62,834,0,miopenConvolutionBwdWeightsAlgoImplicitGEMM;miopenConvolutionBwdWeightsAlgoDirect:ConvOclBwdWrW2NonTunable,380,184,169869312,miopenConvolutionBwdWeightsAlgoDirect;miopenConvolutionBwdWeightsAlgoGEMM:gemm,1507,18,442368,MIOpenGEMM
384-8-8-3x3-448-8-8-128-1x1-1x1-1x1-0-NCHW-FP32-W=miopenConvolutionBwdWeightsAlgoDirect:ConvOclBwdWrW53,4,1864,0,miopenConvolutionBwdWeightsAlgoDirect;miopenConvolutionBwdWeightsAlgoWinograd:ConvBinWinogradRxS,6,85286,0,miopenConvolutionBwdWeightsAlgoWinograd;miopenConvolutionBwdWeightsAlgoGEMM:gemm,12,73,1032192,MIOpenGEMM;miopenConvolutionBwdWeightsAlgoImplicitGEMM:ConvHipImplicitGemmV4R1WrW,16,9949,0,miopenConvolutionBwdWeightsAlgoImplicitGEMM
128-17-17-1x7-128-17-17-128-0x3-1x1-1x1-0-NCHW-FP32-B=miopenConvolutionBwdDataAlgoWinograd:ConvBinWinogradRxS,12,5891,0,miopenConvolutionBwdDataAlgoWinograd;miopenConvolutionBwdDataAlgoImplicitGEMM:ConvHipImplicitGemmBwdDataV1R1,25,3325,0,miopenConvolutionBwdDataAlgoImplicitGEMM;miopenConvolutionBwdDataAlgoGEMM:gemm,2468,6,1035776,MIOpenGEMM
384-8-8-3x3-448-8-8-128-1x1-1x1-1x1-0-NCHW-FP32-B=miopenConvolutionBwdDataAlgoWinograd:ConvBinWinogradRxSf2x3,2,25351,0,miopenConvolutionBwdDataAlgoWinograd
192-35-35-1x1-48-35-35-128-0x0-1x1-1x1-0-NCHW-FP32-F=miopenConvolutionFwdAlgoDirect:ConvAsm1x1U,2,649,0,miopenConvolutionFwdAlgoDirect;miopenConvolutionFwdAlgoGEMM:GemmFwd1x1_0_1,2316,5,0,MIOpenGEMM
192-8-8-3x3-192-17-17-128-0x0-2x2-1x1-0-NCHW-FP32-B=miopenConvolutionBwdDataAlgoWinograd:ConvBinWinogradRxSf2x3,17,1371,0,miopenConvolutionBwdDataAlgoWinograd;miopenConvolutionBwdDataAlgoImplicitGEMM:ConvHipImplicitGemmBwdDataV1R1,23,762,0,miopenConvolutionBwdDataAlgoImplicitGEMM;miopenConvolutionBwdDataAlgoDirect:ConvOclDirectFwd,75,2873,0,miopenConvolutionBwdDataAlgoDirect;miopenConvolutionBwdDataAlgoGEMM:gemm,919,61,442368,MIOpenGEMM
448-8-8-3x3-384-8-8-128-1x1-1x1-1x1-0-NCHW-FP32-F=miopenConvolutionFwdAlgoWinograd:ConvBinWinogradRxSf2x3,7,51256,0,miopenConvolutionFwdAlgoWinograd
128-17-17-1x7-128-17-17-128-0x3-1x1-1x1-0-NCHW-FP32-F=miopenConvolutionFwdAlgoWinograd:ConvBinWinogradRxSf3x2,6,56233,0,miopenConvolutionFwdAlgoWinograd;miopenConvolutionFwdAlgoImplicitGEMM:ConvHipImplicitGemmV4R1Fwd,10,303,0,miopenConvolutionFwdAlgoImplicitGEMM;miopenConvolutionFwdAlgoGEMM:GemmFwdRest,3234,64,1035776,MIOpenGEMM
32-147-147-3x3-32-149-149-128-0x0-1x1-1x1-0-NCHW-FP32-B=miopenConvolutionBwdDataAlgoWinograd:ConvBinWinogradRxS,45,1906,0,miopenConvolutionBwdDataAlgoWinograd;miopenConvolutionBwdDataAlgoDirect:ConvOclDirectFwd,215,931,0,miopenConvolutionBwdDataAlgoDirect;miopenConvolutionBwdDataAlgoImplicitGEMM:ConvHipImplicitGemmBwdDataV1R1,531,4,0,miopenConvolutionBwdDataAlgoImplicitGEMM;miopenConvolutionBwdDataAlgoGEMM:gemm,2264,6,24893568,MIOpenGEMM
192-17-17-3x3-192-8-8-128-0x0-2x2-1x1-0-NCHW-FP32-F=miopenConvolutionFwdAlgoWinograd:ConvBinWinogradRxS,10,261,0,miopenConvolutionFwdAlgoWinograd;miopenConvolutionFwdAlgoDirect:ConvOclDirectFwd,30,8899,0,miopenConvolutionFwdAlgoDirect;miopenConvolutionFwdAlgoGEMM:GemmFwdRest,1176,69,442368,MIOpenGEMM
160-17-17-7x1-160-17-17-128-3x0-1x1-1x1-0-NCHW-FP32-W=miopenConvolutionBwdWeightsAlgoDirect:ConvOclBwdWrW53,20,1828,0,miopenConvolutionBwdWeightsAlgoDirect;miopenConvolutionBwdWeightsAlgoWinograd:ConvBinWinogradRxSf2x3,56,343,0,miopenConvolutionBwdWeightsAlgoWinograd;miopenConvolutionBwdWeightsAlgoGEMM:gemm,1100,86,1294720,MIOpenGEMM
32-149-149-3x3-32-147-147-128-0x0-1x1-1x1-0-NCHW-FP32-F=miopenConvolutionFwdAlgoWinograd:ConvBinWinogradRxS,31,7326,0,miopenConvolutionFwdAlgoWinograd;miopenConvolutionFwdAlgoDirect:ConvOclDirectFwd,191,21,0,miopenConvolutionFwdAlgoDirect;miopenConvolutionFwdAlgoGEMM:GemmFwdRest,467,395,24893568,MIOpenGEMM
192-17-17-1x7-192-17-17-128-0x3-1x1-1x1-0-NCHW-FP32-W=miopenConvolutionBwdWeightsAlgoWinograd:ConvBinWinogradRxS,57,5775,0,miopenConvolutionBwdWeightsAlgoWinograd;miopenConvolutionBwdWeightsAlgoDirect:ConvOclBwdWrW53,84,5143,0,miopenConvolutionBwdWeightsAlgoDirect;miopenConvolutionBwdWeightsAlgoImplicitGEMM:ConvHipImplicitGemmV4R1WrW,86,743,0,miopenConvolutionBwdWeightsAlgoImplicitGEMM;miopenConvolutionBwdWeightsAlgoGEMM:gemm,882,391,1553664,MIOpenGEMM
160-17-17-7x1-160-17-17-128-3x0-1x1-1x1-0-NCHW-FP32-B=miopenConvolutionBwdDataAlgoWinograd:ConvBinWinogradRxSf3x2,4,7463,0,miopenConvolutionBwdDataAlgoWinograd;miopenConvolutionBwdDataAlgoImplicitGEMM:ConvHipImplicitGemmBwdDataV1R1,13,2248,0,miopenConvolutionBwdDataAlgoImplicitGEMM;miopenConvolutionBwdDataAlgoGEMM:gemm,178,532,1294720,MIOpenGEMM
160-17-17-7x1-160-17-17-128-3x0-1x1-1x1-0-NCHW-FP32-F=miopenConvolutionFwdAlgoImplicitGEMM:ConvHipImplicitGemmV4R1Fwd,20,1288,0,miopenConvolutionFwdAlgoImplicitGEMM;miopenConvolutionFwdAlgoWinograd:ConvBinWinogradRxS,32,3484,0,miopenConvolutionFwdAlgoWinograd;miopenConvolutionFwdAlgoGEMM:GemmFwdRest,237,869,1294720,MIOpenGEMM
48-35-35-1x1-256-35-35-128-0x0-1x1-1x1-0-NCHW-FP32-W=miopenConvolutionBwdWeightsAlgoDirect:ConvAsmBwdWrW1x1,14,8197,0,miopenConvolutionBwdWeightsAlgoDirect;miopenConvolutionBwdWeightsAlgoGEMM:gemm,505,347,0,MIOpenGEMM
192-17-17-1x7-192-17-17-128-0x3-1x1-1x1-0-NCHW-FP32-B=miopenConvolutionBwdDataAlgoWinograd:ConvBinWinogradRxSf3x2,31,9874,0,miopenConvolutionBwdDataAlgoWinograd;miopenConvolutionBwdDataAlgoImplicitGEMM:ConvHipImplicitGemmBwdDataV1R1,157,968,0,miopenConvolutionBwdDataAlgoImplicitGEMM;miopenConvolutionBwdDataAlgoGEMM:gemm,682,757,1553664,MIOpenGEMM
768-17-17-1x1-128-17-17-128-0x0-1x1-1x1-0-NCHW-FP32-F=miopenConvolutionFwdAlgoDirect:ConvOclDirectFwd1x1,11,8379,0,miopenConvolutionFwdAlgoDirect;miopenConvolutionFwdAlgoWinograd:ConvBinWinogradRxSf3x2,58,3418,0,miopenConvolutionFwdAlgoWinograd;miopenConvolutionFwdAlgoGEMM:GemmFwd1x1_0_1,729,866,0,MIOpenGEMM
320-8-8-1x1-2048-8-8-128-0x0-1x1-1x1-0-NCHW-FP32-B=miopenConvolutionBwdDataAlgoDirect:ConvAsm1x1U,5,66889,0,miopenConvolutionBwdDataAlgoDirect;miopenConvolutionBwdDataAlgoWinograd:ConvBinWinogradRxSf3x2,40,503,0,miopenConvolutionBwdDataAlgoWinograd;miopenConvolutionBwdDataAlgoGEMM:gemm,153,492,0,MIOpenGEMM
160-17-17-1x7-160-17-17-128-0x3-1x1-1x1-0-NCHW-FP32-W=miopenConvolutionBwdWeightsAlgoWinograd:ConvBinWinogradRxSf2x3,67,392,0,miopenConvolutionBwdWeightsAlgoWinograd;miopenConvolutionBwdWeightsAlgoDirect:ConvOclBwdWrW53,86,6581,0,miopenConvolutionBwdWeightsAlgoDirect;miopenConvolutionBwdWeightsAlgoGEMM:gemm,2486,33,1294720,MIOpenGEMM
384-8-8-3x1-384-8-8-128-1x0-1x1-1x1-0-NCHW-FP32-W=miopenConvolutionBwdWeightsAlgoWinograd:ConvBinWinogradRxS,4,28283,0,miopenConvolutionBwdWeightsAlgoWinograd;miopenConvolutionBwdWeightsAlgoDirect:ConvOclBwdWrW53,9,50979,0,miopenConvolutionBwdWeightsAlgoDirect;miopenConvolutionBwdWeightsAlgoImplicitGEMM:ConvHipImplicitGemmV4R1WrW,28,84,0,miopenConvolutionBwdWeightsAlgoImplicitGEMM;miopenConvolutionBwdWeightsAlgoGEMM:gemm,324,401,294912,MIOpenGEMM
288-35-35-1x1-64-35-35-128-0x0-1x1-1x1-0-NCHW-FP32-F=miopenConvolutionFwdAlgoDirect:ConvOclDirectFwd1x1,1,49766,0,miopenConvolutionFwdAlgoDirect;miopenConvolutionFwdAlgoWinograd:ConvBinWinogradRxSf3x2,10,6458,0,miopenConvolutionFwdAlgoWinograd;miopenConvolutionFwdAlgoGEMM:GemmFwd1x1_0_1,122,266,0,MIOpenGEMM
192-17-17-1x7-192-17-17-128-0x3-1x1-1x1-0-NCHW-FP32-F=miopenConvolutionFwdAlgoWinograd:ConvBinWinogradRxSf3x2,38,9046,0,miopenConvolutionFwdAlgoWinograd;miopenConvolutionFwdAlgoImplicitGEMM:ConvHipImplicitGemmV4R1Fwd,97,104,0,miopenConvolutionFwdAlgoImplicitGEMM;miopenConvolutionFwdAlgoGEMM:GemmFwdRest,3361,23,1553664,MIOpenGEMM
384-8-8-3x1-384-8-8-128-1x0-1x1-1x1-0-NCHW-FP32-B=miopenConvolutionBwdDataAlgoWinograd:ConvBinWinogradRxSf2x3,3,36142,0,miopenConvolutionBwdDataAlgoWinograd;miopenConvolutionBwdDataAlgoImplicitGEMM:ConvHipImplicitGemmBwdDataV1R1,24,6477,0,miopenConvolutionBwdDataAlgoImplicitGEMM;miopenConvolutionBwdDataAlgoGEMM:gemm,1151,12,294912,MIOpenGEMM
192-17-17-7x1-160-17-17-128-3x0-1x1-1x1-0-NCHW-FP32-W=miopenConvolutionBwdWeightsAlgoDirect:ConvOclBwdWrW53,42,6356,0,miopenConvolutionBwdWeightsAlgoDirect;miopenConvolutionBwdWeightsAlgoWinograd:ConvBinWinogradRxSf2x3,50,6465,0,miopenConvolutionBwdWeightsAlgoWinograd;miopenConvolutionBwdWeightsAlgoGEMM:gemm,530,252,1294720,MIOpenGEMM
384-8-8-3x1-384-8-8-128-1x0-1x1-1x1-0-NCHW-FP32-F=miopenConvolutionFwdAlgoWinograd:ConvBinWinogradRxSf3x2,14,2514,0,miopenConvolutionFwdAlgoWinograd;miopenConvolutionFwdAlgoImplicitGEMM:ConvHipImplicitGemmV4R1Fwd,44,4144,0,miopenConvolutionFwdAlgoImplicitGEMM;miopenConvolutionFwdAlgoGEMM:GemmFwdRest,668,107,294912,MIOpenGEMM
192-17-17-7x1-160-17-17-128-3x0-1x1-1x1-0-NCHW-FP32-B=miopenConvolutionBwdDataAlgoWinograd:ConvBinWinogradRxSf3x2,21,9586,0,miopenConvolutionBwdDataAlgoWinograd;miopenConvolutionBwdDataAlgoImplicitGEMM:ConvHipImplicitGemmBwdDataV1R1,34,8527,0,miopenConvolutionBwdDataAlgoImplicitGEMM;miopenConvolutionBwdDataAlgoGEMM:gemm,126,493,1294720,MIOpenGEMM
384-8-8-1x3-384-8-8-128-0x1-1x1-1x1-0-NCHW-FP32-W=miopenConvolutionBwdWeightsAlgoWinograd:ConvBinWinogradRxS,16,3545,0,miopenConvolutionBwdWeightsAlgoWinograd;miopenConvolutionBwdWeightsAlgoDirect:ConvOclBwdWrW53,18,939,0,miopenConvolutionBwdWeightsAlgoDirect;miopenConvolutionBwdWeightsAlgoImplicitGEMM:ConvHipImplicitGemmV4R1WrW,38,1957,0,miopenConvolutionBwdWeightsAlgoImplicitGEMM;miopenConvolutionBwdWeightsAlgoGEMM:gemm,398,185,294912,MIOpenGEMM
160-17-17-7x1-192-17-17-128-3x0-1x1-1x1-0-NCHW-FP32-F=miopenConvolutionFwdAlgoWinograd:ConvBinWinogradRxSf3x2,47,3989,0,miopenConvolutionFwdAlgoWinograd;miopenConvolutionFwdAlgoImplicitGEMM:ConvHipImplicitGemmV4R1Fwd,52,4667,0,miopenConvolutionFwdAlgoImplicitGEMM;miopenConvolutionFwdAlgoGEMM:GemmFwdRest,2163,7,1294720,MIOpenGEMM
512-14-14-3x3-512-14-14-128-1x1-1x1-1x1-0-NCHW-FP32-F=miopenConvolutionFwdAlgoWinograd:ConvBinWinogradRxS,111,749,0,miopenConvolutionFwdAlgoWinograd
384-8-8-1x3-384-8-8-128-0x1-1x1-1x1-0-NCHW-FP32-B=miopenConvolutionBwdDataAlgoWinograd:ConvBinWinogradRxSf3x2,4,30137,0,miopenConvolutionBwdDataAlgoWinograd;miopenConvolutionBwdDataAlgoImplicitGEMM:ConvHipImplicitGemmBwdDataV1R1,32,1673,0,miopenConvolutionBwdDataAlgoImplicitGEMM;miopenConvolutionBwdDataAlgoGEMM:gemm,689,936,294912,MIOpenGEMM
192-17-17-1x7-160-17-17-128-0x3-1x1-1x1-0-NCHW-FP32-W=miopenConvolutionBwdWeightsAlgoWinograd:ConvBinWinogradRxS,72,7059,0,miopenConvolutionBwdWeightsAlgoWinograd;miopenConvolutionBwdWeightsAlgoDirect:ConvOclBwdWrW53,115,845,0,miopenConvolutionBwdWeightsAlgoDirect;miopenConvolutionBwdWeightsAlgoGEMM:gemm,1564,56,1294720,MIOpenGEMM
2048-8-8-1x1-320-8-8-128-0x0-1x1-1x1-0-NCHW-FP32-F=miopenConvolutionFwdAlgoDirect:ConvAsm1x1U,7,82123,0,miopenConvolutionFwdAlgoDirect;miopenConvolutionFwdAlgoWinograd:ConvBinWinogradRxSf3x2,44,4509,0,miopenConvolutionFwdAlgoWinograd;miopenConvolutionFwdAlgoGEMM:GemmFwd1x1_0_1,319,536,0,MIOpenGEMM
384-8-8-1x3-384-8-8-128-0x1-1x1-1x1-0-NCHW-FP32-F=miopenConvolutionFwdAlgoWinograd:ConvBinWinogradRxS,3,46524,0,miopenConvolutionFwdAlgoWinograd;miopenConvolutionFwdAlgoImplicitGEMM:ConvHipImplicitGemmV4R1Fwd,4,22149,0,miopenConvolutionFwdAlgoImplicitGEMM;miopenConvolutionFwdAlgoGEMM:GemmFwdRest,524,974,294912,MIOpenGEMM
32-35-35-1x1-192-35-35-128-0x0-1x1-1x1-0-NCHW-FP32-W=miopenConvolutionBwdWeightsAlgoDirect:ConvAsmBwdWrW1x1,5,76024,0,miopenConvolutionBwdWeightsAlgoDirect
80-73-73-1x1-64-73-73-128-0x0-1x1-1x1-0-NCHW-FP32-W=miopenConvolutionBwdWeightsAlgoDirect:ConvAsmBwdWrW1x1,23,4976,0,miopenConvolutionBwdWeightsAlgoDirect
48-35-35-1x1-256-35-35-128-0x0-1x1-1x1-0-NCHW-FP32-B=miopenConvolutionBwdDataAlgoDirect:ConvAsm1x1U,257,138,0,miopenConvolutionBwdDataAlgoDirect;miopenConvolutionBwdDataAlgoWinograd:ConvBinWinogradRxS,358,79,0,miopenConvolutionBwdDataAlgoWinograd;miopenConvolutionBwdDataAlgoGEMM:gemm,3528,31,0,MIOpenGEMM
48-35-35-1x1-288-35-35-128-0x0-1x1-1x1-0-NCHW-FP32-W=miopenConvolutionBwdWeightsAlgoDirect:ConvAsmBwdWrW1x1,8,37599,0,miopenConvolutionBwdWeightsAlgoDirect;miopenConvolutionBwdWeightsAlgoWinograd:ConvBinWinogradRxSf2x3,105,66,0,miopenConvolutionBwdWeightsAlgoWinograd;miopenConvolutionBwdWeightsAlgoGEMM:gemm,217,45,0,MIOpenGEMM
448-8-8-1x1-1280-8-8-128-0x0-1x1-1x1-0-NCHW-FP32-B=miopenConvolutionBwdDataAlgoDirect:ConvAsm1x1U,12,8328,0,miopenConvolutionBwdDataAlgoDirect;miopenConvolutionBwdDataAlgoWinograd:ConvBinWinogradRxSf2x3,53,472,0,miopenConvolutionBwdDataAlgoWinograd;miopenConvolutionBwdDataAlgoGEMM:gemm,544,44,0,MIOpenGEMM
1280-8-8-1x1-384-8-8-128-0x0-1x1-1x1-0-NCHW-FP32-F=miopenConvolutionFwdAlgoDirect:ConvAsm1x1U,6,5951,0,miopenConvolutionFwdAlgoDirect;miopenConvolutionFwdAlgoWinograd:ConvBinWinogradRxSf3x2,31,8754,0,miopenConvolutionFwdAlgoWinograd;miopenConvolutionFwdAlgoGEMM:GemmFwd1x1_0_1,1307,88,0,MIOpenGEMM
64-35-35-3x3-96-35-35-128-1x1-1x1-1x1-0-NCHW-FP32-F=miopenConvolutionFwdAlgoWinograd:ConvBinWinograd3x3U,2,95709,0,miopenConvolutionFwdAlgoWinograd
3-299-299-3x3-32-149-149-128-0x0-2x2-1x1-0-NCHW-FP32-F=miopenConvolutionFwdAlgoDirect:ConvOclDirectFwd,25,2335,0,miopenConvolutionFwdAlgoDirect;miopenConvolutionFwdAlgoWinograd:ConvBinWinogradRxSf2x3,29,616,0,miopenConvolutionFwdAlgoWinograd;miopenConvolutionFwdAlgoGEMM:GemmFwdRest,2305,42,2397708,MIOpenGEMM
320-8-8-3x3-192-17-17-128-0x0-2x2-1x1-0-NCHW-FP32-B=miopenConvolutionBwdDataAlgoImplicitGEMM:ConvHipImplicitGemmBwdDataV1R1,25,1091,0,miopenConvolutionBwdDataAlgoImplicitGEMM;miopenConvolutionBwdDataAlgoWinograd:ConvBinWinogradRxSf2x3,36,3304,0,miopenConvolutionBwdDataAlgoWinograd;miopenConvolutionBwdDataAlgoDirect:ConvOclDirectFwd,128,22,0,miopenConvolutionBwdDataAlgoDirect;miopenConvolutionBwdDataAlgoGEMM:gemm,709,378,442368,MIOpenGEMM
96-35-35-3x3-96-35-35-128-1x1-1x1-1x1-0-NCHW-FP32-B=miopenConvolutionBwdDataAlgoWinograd:ConvBinWinograd3x3U,4,39877,0,miopenConvolutionBwdDataAlgoWinograd
96-35-35-3x3-96-35-35-128-1x1-1x1-1x1-0-NCHW-FP32-F=miopenConvolutionFwdAlgoWinograd:ConvBinWinogradRxSf3x2,45,9338,0,miopenConvolutionFwdAlgoWinograd
192-17-17-3x3-320-8-8-128-0x0-2x2-1x1-0-NCHW-FP32-F=miopenConvolutionFwdAlgoWinograd:ConvBinWinogradRxSf2x3,33,8859,0,miopenConvolutionFwdAlgoWinograd;miopenConvolutionFwdAlgoDirect:ConvOclDirectFwd,51,4644,0,miopenConvolutionFwdAlgoDirect;miopenConvolutionFwdAlgoGEMM:GemmFwdRest,3293,88,442368,MIOpenGEMM
512-28-28-3x3-512-28-28-128-1x1-1x1-1x1-0-NCHW-FP32-B=miopenConvolutionBwdDataAlgoWinograd:ConvBinWinogradRxSf3x2,77,9427,0,miopenConvolutionBwdDataAlgoWinograd
96-17-17-3x3-96-35-35-128-0x0-2x2-1x1-0-NCHW-FP32-W=miopenConvolutionBwdWeightsAlgoDirect:ConvOclBwdWrW2NonTunable,186,189,42467328,miopenConvolutionBwdWeightsAlgoDirect;miopenConvolutionBwdWeightsAlgoGEMM:gemm,2941,96,998784,MIOpenGEMM
64-35-35-5x5-48-35-35-128-2x2-1x1-1x1-0-NCHW-FP32-W=miopenConvolutionBwdWeightsAlgoDirect:ConvOclBwdWrW53,56,809,39321600,miopenConvolutionBwdWeightsAlgoDirect;miopenConvolutionBwdWeightsAlgoWinograd:ConvBinWinogradRxSf2x3,110,255,0,miopenConvolutionBwdWeightsAlgoWinograd;miopenConvolutionBwdWeightsAlgoGEMM:gemm,1619,83,5880000,MIOpenGEMM
96-17-17-3x3-96-35-35-128-0x0-2x2-1x1-0-NCHW-FP32-B=miopenConvolutionBwdDataAlgoWinograd:ConvBinWinogradRxS,11,5256,0,miopenConvolutionBwdDataAlgoWinograd;miopenConvolutionBwdDataAlgoImplicitGEMM:ConvHipImplicitGemmBwdDataV1R1,51,9611,0,miopenConvolutionBwdDataAlgoImplicitGEMM;miopenConvolutionBwdDataAlgoDirect:ConvOclDirectFwd,71,207,0,miopenConvolutionBwdDataAlgoDirect;miopenConvolutionBwdDataAlgoGEMM:gemm,3108,99,998784,MIOpenGEMM
64-35-35-5x5-48-35-35-128-2x2-1x1-1x1-0-NCHW-FP32-B=miopenConvolutionBwdDataAlgoWinograd:ConvBinWinogradRxS,20,9355,0,miopenConvolutionBwdDataAlgoWinograd;miopenConvolutionBwdDataAlgoDirect:ConvOclDirectFwd,100,137,0,miopenConvolutionBwdDataAlgoDirect;miopenConvolutionBwdDataAlgoGEMM:gemm,981,44,5880000,MIOpenGEMM
96-35-35-3x3-96-17-17-128-0x0-2x2-1x1-0-NCHW-FP32-F=miopenConvolutionFwdAlgoWinograd:ConvBinWinogradRxSf2x3,9,48807,0,miopenConvolutionFwdAlgoWinograd;miopenConvolutionFwdAlgoDirect:ConvOclDirectFwd,99,6291,0,miopenConvolutionFwdAlgoDirect;miopenConvolutionFwdAlgoGEMM:GemmFwdRest,412,958,998784,MIOpenGEMM
192-8-8-1x1-1280-8-8-128-0x0-1x1-1x1-0-NCHW-FP32-W=miopenConvolutionBwdWeightsAlgoDirect:ConvAsmBwdWrW1x1,2,33483,0,miopenConvolutionBwdWeightsAlgoDirect;miopenConvolutionBwdWeightsAlgoGEMM:gemm,67,5455,0,MIOpenGEMM
192-17-17-7x1-192-17-17-128-3x0-1x1-1x1-0-NCHW-FP32-W=miopenConvolutionBwdWeightsAlgoDirect:ConvOclBwdWrW53,142,837,0,miopenConvolutionBwdWeightsAlgoDirect;miopenConvolutionBwdWeightsAlgoImplicitGEMM:ConvHipImplicitGemmV4R1WrW,382,209,0,miopenConvolutionBwdWeightsAlgoImplicitGEMM;miopenConvolutionBwdWeightsAlgoWinograd:ConvBinWinogradRxSf2x3,934,391,0,miopenConvolutionBwdWeightsAlgoWinograd;miopenConvolutionBwdWeightsAlgoGEMM:gemm,1625,53,1553664,MIOpenGEMM
192-8-8-1x1-1280-8-8-128-0x0-1x1-1x1-0-NCHW-FP32-B=miopenConvolutionBwdDataAlgoDirect:ConvAsm1x1U,1,91403,0,miopenConvolutionBwdDataAlgoDirect;miopenConvolutionBwdDataAlgoGEMM:gemm,194,306,0,MIOpenGEMM
48-35-35-5x5-64-35-35-128-2x2-1x1-1x1-0-NCHW-FP32-F=miopenConvolutionFwdAlgoWinograd:ConvBinWinogradRxS,17,1072,0,miopenConvolutionFwdAlgoWinograd;miopenConvolutionFwdAlgoImplicitGEMM:ConvHipImplicitGemmV4R1Fwd,32,73,0,miopenConvolutionFwdAlgoImplicitGEMM;miopenConvolutionFwdAlgoDirect:ConvOclDirectFwd,118,95,0,miopenConvolutionFwdAlgoDirect;miopenConvolutionFwdAlgoGEMM:GemmFwdRest,399,103,5880000,MIOpenGEMM
192-17-17-7x1-192-17-17-128-3x0-1x1-1x1-0-NCHW-FP32-B=miopenConvolutionBwdDataAlgoWinograd:ConvBinWinogradRxSf3x2,38,1848,0,miopenConvolutionBwdDataAlgoWinograd;miopenConvolutionBwdDataAlgoImplicitGEMM:ConvHipImplicitGemmBwdDataV1R1,57,1046,0,miopenConvolutionBwdDataAlgoImplicitGEMM;miopenConvolutionBwdDataAlgoGEMM:gemm,650,184,1553664,MIOpenGEMM
192-17-17-7x1-192-17-17-128-3x0-1x1-1x1-0-NCHW-FP32-F=miopenConvolutionFwdAlgoWinograd:ConvBinWinogradRxSf3x2,59,5097,0,miopenConvolutionFwdAlgoWinograd;miopenConvolutionFwdAlgoImplicitGEMM:ConvHipImplicitGemmV4R1Fwd,62,7073,0,miopenConvolutionFwdAlgoImplicitGEMM;miopenConvolutionFwdAlgoGEMM:GemmFwdRest,635,212,1553664,MIOpenGEMM
64-35-35-1x1-288-35-35-128-0x0-1x1-1x1-0-NCHW-FP32-W=miopenConvolutionBwdWeightsAlgoDirect:ConvAsmBwdWrW1x1,38,5011,0,miopenConvolutionBwdWeightsAlgoDirect;miopenConvolutionBwdWeightsAlgoWinograd:ConvBinWinogradRxSf2x3,153,53,0,miopenConvolutionBwdWeightsAlgoWinograd;miopenConvolutionBwdWeightsAlgoGEMM:gemm,331,63,0,MIOpenGEMM
256-35-35-1x1-64-35-35-128-0x0-1x1-1x1-0-NCHW-FP32-F=miopenConvolutionFwdAlgoDirect:ConvAsm1x1U,5,6233,0,miopenConvolutionFwdAlgoDirect;miopenConvolutionFwdAlgoGEMM:GemmFwd1x1_0_1,701,384,0,MIOpenGEMM
1280-8-8-1x1-192-8-8-128-0x0-1x1-1x1-0-NCHW-FP32-F=miopenConvolutionFwdAlgoDirect:ConvAsm1x1U,3,92609,0,miopenConvolutionFwdAlgoDirect;miopenConvolutionFwdAlgoGEMM:GemmFwd1x1_0_1,492,545,0,MIOpenGEMM
192-17-17-7x1-128-17-17-128-3x0-1x1-1x1-0-NCHW-FP32-W=miopenConvolutionBwdWeightsAlgoDirect:ConvOclBwdWrW2<1>,45,4115,88080384,miopenConvolutionBwdWeightsAlgoDirect;miopenConvolutionBwdWeightsAlgoWinograd:ConvBinWinogradRxS,83,9963,0,miopenConvolutionBwdWeightsAlgoWinograd;miopenConvolutionBwdWeightsAlgoImplicitGEMM:ConvHipImplicitGemmV4R1WrW,117,442,0,miopenConvolutionBwdWeightsAlgoImplicitGEMM;miopenConvolutionBwdWeightsAlgoGEMM:gemm,2580,78,1035776,MIOpenGEMM
1280-8-8-1x1-448-8-8-128-0x0-1x1-1x1-0-NCHW-FP32-F=miopenConvolutionFwdAlgoDirect:ConvAsm1x1U,17,424,0,miopenConvolutionFwdAlgoDirect;miopenConvolutionFwdAlgoWinograd:ConvBinWinogradRxSf3x2,37,4186,0,miopenConvolutionFwdAlgoWinograd;miopenConvolutionFwdAlgoGEMM:GemmFwd1x1_0_1,1612,7,0,MIOpenGEMM
192-17-17-7x1-128-17-17-128-3x0-1x1-1x1-0-NCHW-FP32-B=miopenConvolutionBwdDataAlgoWinograd:ConvBinWinogradRxSf3x2,18,1155,0,miopenConvolutionBwdDataAlgoWinograd;miopenConvolutionBwdDataAlgoImplicitGEMM:ConvHipImplicitGemmBwdDataV1R1,30,2441,0,miopenConvolutionBwdDataAlgoImplicitGEMM;miopenConvolutionBwdDataAlgoGEMM:gemm,200,718,1035776,MIOpenGEMM
192-8-8-1x1-2048-8-8-128-0x0-1x1-1x1-0-NCHW-FP32-B=miopenConvolutionBwdDataAlgoDirect:ConvAsm1x1U,2,88343,0,miopenConvolutionBwdDataAlgoDirect;miopenConvolutionBwdDataAlgoWinograd:ConvBinWinogradRxSf3x2,18,9606,0,miopenConvolutionBwdDataAlgoWinograd;miopenConvolutionBwdDataAlgoGEMM:gemm,114,913,0,MIOpenGEMM
128-17-17-7x1-192-17-17-128-3x0-1x1-1x1-0-NCHW-FP32-F=miopenConvolutionFwdAlgoWinograd:ConvBinWinogradRxSf3x2,37,965,0,miopenConvolutionFwdAlgoWinograd;miopenConvolutionFwdAlgoImplicitGEMM:ConvHipImplicitGemmV4R1Fwd,43,5367,0,miopenConvolutionFwdAlgoImplicitGEMM;miopenConvolutionFwdAlgoGEMM:GemmFwdRest,2504,79,1035776,MIOpenGEMM
64-224-224-3x3-64-224-224-128-1x1-1x1-1x1-0-NCHW-FP32-F=miopenConvolutionFwdAlgoWinograd:ConvBinWinogradRxSf2x3,1442,88,0,miopenConvolutionFwdAlgoWinograd
192-17-17-1x7-128-17-17-128-0x3-1x1-1x1-0-NCHW-FP32-W=miopenConvolutionBwdWeightsAlgoWinograd:ConvBinWinogradRxSf2x3,33,2765,0,miopenConvolutionBwdWeightsAlgoWinograd;miopenConvolutionBwdWeightsAlgoDirect:ConvOclBwdWrW53,43,6168,0,miopenConvolutionBwdWeightsAlgoDirect;miopenConvolutionBwdWeightsAlgoImplicitGEMM:ConvHipImplicitGemmV4R1WrW,60,7595,0,miopenConvolutionBwdWeightsAlgoImplicitGEMM;miopenConvolutionBwdWeightsAlgoGEMM:gemm,157,133,1035776,MIOpenGEMM
64-35-35-1x1-288-35-35-128-0x0-1x1-1x1-0-NCHW-FP32-B=miopenConvolutionBwdDataAlgoDirect:ConvAsm1x1U,5,2957,0,miopenConvolutionBwdDataAlgoDirect;miopenConvolutionBwdDataAlgoWinograd:ConvBinWinogradRxSf3x2,14,277,0,miopenConvolutionBwdDataAlgoWinograd;miopenConvolutionBwdDataAlgoGEMM:gemm,280,378,0,MIOpenGEMM
384-8-8-1x1-1280-8-8-128-0x0-1x1-1x1-0-NCHW-FP32-W=miopenConvolutionBwdWeightsAlgoDirect:ConvAsmBwdWrW1x1,11,4521,0,miopenConvolutionBwdWeightsAlgoDirect;miopenConvolutionBwdWeightsAlgoWinograd:ConvBinWinogradRxSf2x3,68,2506,0,miopenConvolutionBwdWeightsAlgoWinograd;miopenConvolutionBwdWeightsAlgoGEMM:gemm,427,739,0,MIOpenGEMM
256-35-35-1x1-48-35-35-128-0x0-1x1-1x1-0-NCHW-FP32-F=miopenConvolutionFwdAlgoDirect:ConvAsm1x1U,2,9718,0,miopenConvolutionFwdAlgoDirect;miopenConvolutionFwdAlgoWinograd:ConvBinWinogradRxSf3x2,12,6389,0,miopenConvolutionFwdAlgoWinograd;miopenConvolutionFwdAlgoGEMM:GemmFwd1x1_0_1,101,125,0,MIOpenGEMM
384-8-8-1x1-1280-8-8-128-0x0-1x1-1x1-0-NCHW-FP32-B=miopenConvolutionBwdDataAlgoDirect:ConvAsm1x1U,2,13816,0,miopenConvolutionBwdDataAlgoDirect;miopenConvolutionBwdDataAlgoWinograd:ConvBinWinogradRxSf3x2,18,6661,0,miopenConvolutionBwdDataAlgoWinograd;miopenConvolutionBwdDataAlgoGEMM:gemm,107,17,0,MIOpenGEMM
320-8-8-3x3-192-17-17-128-0x0-2x2-1x1-0-NCHW-FP32-W=miopenConvolutionBwdWeightsAlgoImplicitGEMM:ConvHipImplicitGemmV4R1WrW,41,2245,0,miopenConvolutionBwdWeightsAlgoImplicitGEMM;miopenConvolutionBwdWeightsAlgoDirect:ConvOclBwdWrW2NonTunable,387,967,283115520,miopenConvolutionBwdWeightsAlgoDirect;miopenConvolutionBwdWeightsAlgoGEMM:gemm,1215,83,442368,MIOpenGEMM
2048-8-8-1x1-192-8-8-128-0x0-1x1-1x1-0-NCHW-FP32-F=miopenConvolutionFwdAlgoDirect:ConvOclDirectFwd1x1,9,86347,0,miopenConvolutionFwdAlgoDirect;miopenConvolutionFwdAlgoGEMM:GemmFwd1x1_0_1,2278,36,0,MIOpenGEMM
48-35-35-1x1-288-35-35-128-0x0-1x1-1x1-0-NCHW-FP32-B=miopenConvolutionBwdDataAlgoDirect:ConvAsm1x1U,2,43173,0,miopenConvolutionBwdDataAlgoDirect;miopenConvolutionBwdDataAlgoGEMM:gemm,171,604,0,MIOpenGEMM
448-8-8-1x1-2048-8-8-128-0x0-1x1-1x1-0-NCHW-FP32-W=miopenConvolutionBwdWeightsAlgoDirect:ConvOclBwdWrW1x1,5,5905,0,miopenConvolutionBwdWeightsAlgoDirect
448-8-8-1x1-2048-8-8-128-0x0-1x1-1x1-0-NCHW-FP32-B=miopenConvolutionBwdDataAlgoDirect:ConvAsm1x1U,8,52883,0,miopenConvolutionBwdDataAlgoDirect;miopenConvolutionBwdDataAlgoWinograd:ConvBinWinogradRxSf3x2,53,1379,0,miopenConvolutionBwdDataAlgoWinograd;miopenConvolutionBwdDataAlgoGEMM:gemm,611,881,0,MIOpenGEMM
64-35-35-1x1-192-35-35-128-0x0-1x1-1x1-0-NCHW-FP32-W=miopenConvolutionBwdWeightsAlgoDirect:ConvAsmBwdWrW1x1,7,4288,0,miopenConvolutionBwdWeightsAlgoDirect;miopenConvolutionBwdWeightsAlgoGEMM:gemm,401,576,0,MIOpenGEMM
320-8-8-1x1-1280-8-8-128-0x0-1x1-1x1-0-NCHW-FP32-W=miopenConvolutionBwdWeightsAlgoDirect:ConvAsmBwdWrW1x1,2,22741,0,miopenConvolutionBwdWeightsAlgoDirect;miopenConvolutionBwdWeightsAlgoWinograd:ConvBinWinogradRxSf2x3,43,821,0,miopenConvolutionBwdWeightsAlgoWinograd;miopenConvolutionBwdWeightsAlgoGEMM:gemm,144,3,0,MIOpenGEMM
288-35-35-1x1-48-35-35-128-0x0-1x1-1x1-0-NCHW-FP32-F=miopenConvolutionFwdAlgoDirect:ConvAsm1x1U,3,25405,0,miopenConvolutionFwdAlgoDirect
2048-8-8-1x1-384-8-8-128-0x0-1x1-1x1-0-NCHW-FP32-F=miopenConvolutionFwdAlgoDirect:ConvAsm1x1U,38,5714,0,miopenConvolutionFwdAlgoDirect;miopenConvolutionFwdAlgoWinograd:ConvBinWinogradRxSf2x3,433,727,0,miopenConvolutionFwdAlgoWinograd;miopenConvolutionFwdAlgoGEMM:GemmFwd1x1_0_1,1855,68,0,MIOpenGEMM
384-17-17-3x3-288-35-35-128-0x0-2x2-1x1-0-NCHW-FP32-W=miopenConvolutionBwdWeightsAlgoGEMM:gemm,26,7745,2996352,MIOpenGEMM;miopenConvolutionBwdWeightsAlgoDirect:ConvOclBwdWrW2NonTunable,126,934,509607936,miopenConvolutionBwdWeightsAlgoDirect
320-8-8-1x1-1280-8-8-128-0x0-1x1-1x1-0-NCHW-FP32-B=miopenConvolutionBwdDataAlgoDirect:ConvAsm1x1U,6,3763,0,miopenConvolutionBwdDataAlgoDirect;miopenConvolutionBwdDataAlgoWinograd:ConvBinWinogradRxSf3x2,21,2577,0,miopenConvolutionBwdDataAlgoWinograd;miopenConvolutionBwdDataAlgoGEMM:gemm,317,948,0,MIOpenGEMM
64-35-35-1x1-192-35-35-128-0x0-1x1-1x1-0-NCHW-FP32-B=miopenConvolutionBwdDataAlgoDirect:ConvAsm1x1U,2,10859,0,miopenConvolutionBwdDataAlgoDirect;miopenConvolutionBwdDataAlgoWinograd:ConvBinWinogradRxSf3x2,8,11241,0,miopenConvolutionBwdDataAlgoWinograd;miopenConvolutionBwdDataAlgoGEMM:gemm,590,118,0,MIOpenGEMM
768-17-17-1x1-192-17-17-128-0x0-1x1-1x1-0-NCHW-FP32-F=miopenConvolutionFwdAlgoDirect:ConvAsm1x1U,3,10711,0,miopenConvolutionFwdAlgoDirect;miopenConvolutionFwdAlgoWinograd:ConvBinWinogradRxSf3x2,24,2374,0,miopenConvolutionFwdAlgoWinograd;miopenConvolutionFwdAlgoGEMM:GemmFwd1x1_0_1,164,227,0,MIOpenGEMM
2048-8-8-1x1-448-8-8-128-0x0-1x1-1x1-0-NCHW-FP32-F=miopenConvolutionFwdAlgoDirect:ConvAsm1x1U,17,7444,0,miopenConvolutionFwdAlgoDirect;miopenConvolutionFwdAlgoWinograd:ConvBinWinogradRxSf3x2,66,1523,0,miopenConvolutionFwdAlgoWinograd;miopenConvolutionFwdAlgoGEMM:GemmFwd1x1_0_1,427,13,0,MIOpenGEMM
384-17-17-3x3-288-35-35-128-0x0-2x2-1x1-0-NCHW-FP32-B=miopenConvolutionBwdDataAlgoImplicitGEMM:ConvHipImplicitGemmBwdDataV1R1,270,145,0,miopenConvolutionBwdDataAlgoImplicitGEMM;miopenConvolutionBwdDataAlgoWinograd:ConvBinWinogradRxS,541,84,0,miopenConvolutionBwdDataAlgoWinograd;miopenConvolutionBwdDataAlgoDirect:ConvOclDirectFwd,831,659,0,miopenConvolutionBwdDataAlgoDirect;miopenConvolutionBwdDataAlgoGEMM:gemm,984,75,2996352,MIOpenGEMM
192-35-35-1x1-64-35-35-128-0x0-1x1-1x1-0-NCHW-FP32-F=miopenConvolutionFwdAlgoDirect:ConvAsm1x1U,3,64997,0,miopenConvolutionFwdAlgoDirect;miopenConvolutionFwdAlgoGEMM:GemmFwd1x1_0_1,273,593,0,MIOpenGEMM
288-35-35-3x3-384-17-17-128-0x0-2x2-1x1-0-NCHW-FP32-F=miopenConvolutionFwdAlgoWinograd:ConvBinWinogradRxS,354,43,0,miopenConvolutionFwdAlgoWinograd;miopenConvolutionFwdAlgoDirect:ConvOclDirectFwd,820,718,0,miopenConvolutionFwdAlgoDirect;miopenConvolutionFwdAlgoGEMM:GemmFwdRest,1084,43,2996352,MIOpenGEMM
160-17-17-1x1-768-17-17-128-0x0-1x1-1x1-0-NCHW-FP32-W=miopenConvolutionBwdWeightsAlgoDirect:ConvAsmBwdWrW1x1,30,1583,0,miopenConvolutionBwdWeightsAlgoDirect;miopenConvolutionBwdWeightsAlgoWinograd:ConvBinWinogradRxSf2x3,108,844,0,miopenConvolutionBwdWeightsAlgoWinograd;miopenConvolutionBwdWeightsAlgoGEMM:gemm,407,22,0,MIOpenGEMM
128-112-112-3x3-64-112-112-128-1x1-1x1-1x1-0-NCHW-FP32-W=miopenConvolutionBwdWeightsAlgoDirect:ConvAsmBwdWrW3x3,616,758,0,miopenConvolutionBwdWeightsAlgoDirect;miopenConvolutionBwdWeightsAlgoWinograd:ConvBinWinogradRxSf2x3,2451,48,0,miopenConvolutionBwdWeightsAlgoWinograd;miopenConvolutionBwdWeightsAlgoImplicitGEMM:ConvHipImplicitGemmV4R1WrW,3093,99,0,miopenConvolutionBwdWeightsAlgoImplicitGEMM;miopenConvolutionBwdWeightsAlgoGEMM:gemm,4036,74,28901376,MIOpenGEMM
32-35-35-1x1-192-35-35-128-0x0-1x1-1x1-0-NCHW-FP32-B=miopenConvolutionBwdDataAlgoWinograd:ConvBinWinogradRxSf3x2,4,35664,0,miopenConvolutionBwdDataAlgoWinograd;miopenConvolutionBwdDataAlgoGEMM:gemm,380,707,0,MIOpenGEMM
128-112-112-3x3-64-112-112-128-1x1-1x1-1x1-0-NCHW-FP32-B=miopenConvolutionBwdDataAlgoWinograd:ConvBinWinogradRxS,132,346,0,miopenConvolutionBwdDataAlgoWinograd
384-8-8-1x1-2048-8-8-128-0x0-1x1-1x1-0-NCHW-FP32-W=miopenConvolutionBwdWeightsAlgoDirect:ConvOclBwdWrW1x1,34,9884,0,miopenConvolutionBwdWeightsAlgoDirect;miopenConvolutionBwdWeightsAlgoWinograd:ConvBinWinogradRxSf2x3,163,588,0,miopenConvolutionBwdWeightsAlgoWinograd;miopenConvolutionBwdWeightsAlgoGEMM:gemm,767,742,0,MIOpenGEMM
48-35-35-1x1-192-35-35-128-0x0-1x1-1x1-0-NCHW-FP32-W=miopenConvolutionBwdWeightsAlgoDirect:ConvOclBwdWrW1x1,3,84114,0,miopenConvolutionBwdWeightsAlgoDirect
64-147-147-3x3-32-147-147-128-1x1-1x1-1x1-0-NCHW-FP32-B=miopenConvolutionBwdDataAlgoWinograd:ConvBinWinogradRxS,116,905,0,miopenConvolutionBwdDataAlgoWinograd
64-35-35-1x1-256-35-35-128-0x0-1x1-1x1-0-NCHW-FP32-W=miopenConvolutionBwdWeightsAlgoWinograd:ConvBinWinogradRxSf2x3,112,892,0,miopenConvolutionBwdWeightsAlgoWinograd
384-8-8-1x1-2048-8-8-128-0x0-1x1-1x1-0-NCHW-FP32-B=miopenConvolutionBwdDataAlgoDirect:ConvAsm1x1U,5,1957,0,miopenConvolutionBwdDataAlgoDirect;miopenConvolutionBwdDataAlgoWinograd:ConvBinWinogradRxSf3x2,88,1709,0,miopenConvolutionBwdDataAlgoWinograd;miopenConvolutionBwdDataAlgoGEMM:gemm,667,502,0,MIOpenGEMM
48-35-35-1x1-192-35-35-128-0x0-1x1-1x1-0-NCHW-FP32-B=miopenConvolutionBwdDataAlgoDirect:ConvAsm1x1U,4,39369,0,miopenConvolutionBwdDataAlgoDirect;miopenConvolutionBwdDataAlgoWinograd:ConvBinWinogradRxSf3x2,7,52335,0,miopenConvolutionBwdDataAlgoWinograd;miopenConvolutionBwdDataAlgoGEMM:gemm,418,26,0,MIOpenGEMM
64-147-147-3x3-32-147-147-128-1x1-1x1-1x1-0-NCHW-FP32-W=miopenConvolutionBwdWeightsAlgoDirect:ConvAsmBwdWrW3x3,340,38,0,miopenConvolutionBwdWeightsAlgoDirect;miopenConvolutionBwdWeightsAlgoWinograd:ConvBinWinogradRxS,2012,7,0,miopenConvolutionBwdWeightsAlgoWinograd;miopenConvolutionBwdWeightsAlgoGEMM:gemm,2494,69,24893568,MIOpenGEMM
160-17-17-1x1-768-17-17-128-0x0-1x1-1x1-0-NCHW-FP32-B=miopenConvolutionBwdDataAlgoDirect:ConvAsm1x1U,5,91904,0,miopenConvolutionBwdDataAlgoDirect;miopenConvolutionBwdDataAlgoWinograd:ConvBinWinogradRxSf2x3,52,4421,0,miopenConvolutionBwdDataAlgoWinograd;miopenConvolutionBwdDataAlgoGEMM:gemm,2727,4,0,MIOpenGEMM
192-71-71-3x3-80-73-73-128-0x0-1x1-1x1-0-NCHW-FP32-B=miopenConvolutionBwdDataAlgoWinograd:ConvBinWinogradRxS,203,817,0,miopenConvolutionBwdDataAlgoWinograd;miopenConvolutionBwdDataAlgoDirect:ConvOclDirectFwd,702,683,0,miopenConvolutionBwdDataAlgoDirect;miopenConvolutionBwdDataAlgoGEMM:gemm,1503,26,14518080,MIOpenGEMM
192-35-35-1x1-32-35-35-128-0x0-1x1-1x1-0-NCHW-FP32-F=miopenConvolutionFwdAlgoDirect:ConvAsm1x1U,1,76504,0,miopenConvolutionFwdAlgoDirect;miopenConvolutionFwdAlgoGEMM:GemmFwd1x1_0_1,190,628,0,MIOpenGEMM
64-35-35-1x1-256-35-35-128-0x0-1x1-1x1-0-NCHW-FP32-B=miopenConvolutionBwdDataAlgoDirect:ConvAsm1x1U,1,87647,0,miopenConvolutionBwdDataAlgoDirect;miopenConvolutionBwdDataAlgoWinograd:ConvBinWinogradRxSf3x2,9,88802,0,miopenConvolutionBwdDataAlgoWinograd;miopenConvolutionBwdDataAlgoGEMM:gemm,366,258,0,MIOpenGEMM
512-28-28-3x3-512-28-28-128-1x1-1x1-1x1-0-NCHW-FP32-W=miopenConvolutionBwdWeightsAlgoDirect:ConvAsmBwdWrW3x3,727,809,0,miopenConvolutionBwdWeightsAlgoDirect;miopenConvolutionBwdWeightsAlgoImplicitGEMM:ConvHipImplicitGemmV4R1WrW,840,241,0,miopenConvolutionBwdWeightsAlgoImplicitGEMM;miopenConvolutionBwdWeightsAlgoGEMM:gemm,1101,62,14450688,MIOpenGEMM;miopenConvolutionBwdWeightsAlgoWinograd:ConvBinWinogradRxSf2x3,1234,6,0,miopenConvolutionBwdWeightsAlgoWinograd
768-17-17-1x1-160-17-17-128-0x0-1x1-1x1-0-NCHW-FP32-F=miopenConvolutionFwdAlgoDirect:ConvAsm1x1U,9,18698,0,miopenConvolutionFwdAlgoDirect;miopenConvolutionFwdAlgoWinograd:ConvBinWinogradRxSf3x2,40,9081,0,miopenConvolutionFwdAlgoWinograd;miopenConvolutionFwdAlgoGEMM:GemmFwd1x1_0_1,522,339,0,MIOpenGEMM
128-17-17-1x1-768-17-17-128-0x0-1x1-1x1-0-NCHW-FP32-W=miopenConvolutionBwdWeightsAlgoWinograd:ConvBinWinogradRxSf2x3,5,4897,0,miopenConvolutionBwdWeightsAlgoWinograd
32-149-149-3x3-3-299-299-128-0x0-2x2-1x1-0-NCHW-FP32-W=miopenConvolutionBwdWeightsAlgoDirect:ConvOclBwdWrW2NonTunable,95,9146,442368,miopenConvolutionBwdWeightsAlgoDirect;miopenConvolutionBwdWeightsAlgoGEMM:gemm,530,986,2397708,MIOpenGEMM
32-147-147-3x3-32-149-149-128-0x0-1x1-1x1-0-NCHW-FP32-W=miopenConvolutionBwdWeightsAlgoDirect:ConvOclBwdWrW53,202,333,4718592,miopenConvolutionBwdWeightsAlgoDirect;miopenConvolutionBwdWeightsAlgoGEMM:gemm,714,47,24893568,MIOpenGEMM;miopenConvolutionBwdWeightsAlgoWinograd:ConvBinWinogradRxS,1449,14,0,miopenConvolutionBwdWeightsAlgoWinograd
320-8-8-1x1-2048-8-8-128-0x0-1x1-1x1-0-NCHW-FP32-W=miopenConvolutionBwdWeightsAlgoDirect:ConvAsmBwdWrW1x1,4,56534,0,miopenConvolutionBwdWeightsAlgoDirect;miopenConvolutionBwdWeightsAlgoWinograd:ConvBinWinogradRxSf2x3,67,383,0,miopenConvolutionBwdWeightsAlgoWinograd;miopenConvolutionBwdWeightsAlgoGEMM:gemm,240,88,0,MIOpenGEMM
128-17-17-1x1-768-17-17-128-0x0-1x1-1x1-0-NCHW-FP32-B=miopenConvolutionBwdDataAlgoDirect:ConvAsm1x1U,2,14997,0,miopenConvolutionBwdDataAlgoDirect;miopenConvolutionBwdDataAlgoWinograd:ConvBinWinogradRxSf3x2,14,4319,0,miopenConvolutionBwdDataAlgoWinograd;miopenConvolutionBwdDataAlgoGEMM:gemm,2278,86,0,MIOpenGEMM
32-147-147-3x3-64-147-147-128-1x1-1x1-1x1-0-NCHW-FP32-F=miopenConvolutionFwdAlgoWinograd:ConvBinWinogradRxS,994,723,0,miopenConvolutionFwdAlgoWinograd
64-73-73-1x1-80-73-73-128-0x0-1x1-1x1-0-NCHW-FP32-F=miopenConvolutionFwdAlgoDirect:ConvAsm1x1U,6,71868,0,miopenConvolutionFwdAlgoDirect;miopenConvolutionFwdAlgoWinograd:ConvBinWinogradRxSf3x2,39,3806,0,miopenConvolutionFwdAlgoWinograd;miopenConvolutionFwdAlgoGEMM:GemmFwd1x1_0_1,338,99,0,MIOpenGEMM
192-8-8-1x1-2048-8-8-128-0x0-1x1-1x1-0-NCHW-FP32-W=miopenConvolutionBwdWeightsAlgoDirect:ConvAsmBwdWrW1x1,2,83786,0,miopenConvolutionBwdWeightsAlgoDirect;miopenConvolutionBwdWeightsAlgoWinograd:ConvBinWinogradRxSf2x3,30,1422,0,miopenConvolutionBwdWeightsAlgoWinograd;miopenConvolutionBwdWeightsAlgoGEMM:gemm,104,592,0,MIOpenGEMM
1024-17-17-1x1-128-17-17-64-0x0-1x1-1x1-0-NCHW-FP32-F=miopenConvolutionFwdAlgoDirect:ConvOclDirectFwd1x1,1,63912,0,miopenConvolutionFwdAlgoDirect;miopenConvolutionFwdAlgoGEMM:GemmFwd1x1_0_1,99,7828,0,MIOpenGEMM
32-149-149-3x3-3-299-299-128-0x0-2x2-1x1-0-NCHW-FP32-B=miopenConvolutionBwdDataAlgoDirect:ConvOclDirectFwd,41,2588,0,miopenConvolutionBwdDataAlgoDirect;miopenConvolutionBwdDataAlgoWinograd:ConvBinWinogradRxSf2x3,79,9498,0,miopenConvolutionBwdDataAlgoWinograd;miopenConvolutionBwdDataAlgoGEMM:gemm,1696,83,2397708,MIOpenGEMM
80-73-73-1x1-64-73-73-128-0x0-1x1-1x1-0-NCHW-FP32-B=miopenConvolutionBwdDataAlgoDirect:ConvAsm1x1U,4,30267,0,miopenConvolutionBwdDataAlgoDirect;miopenConvolutionBwdDataAlgoWinograd:ConvBinWinogradRxSf3x2,13,2988,0,miopenConvolutionBwdDataAlgoWinograd;miopenConvolutionBwdDataAlgoGEMM:gemm,309,239,0,MIOpenGEMM
80-73-73-3x3-192-71-71-128-0x0-1x1-1x1-0-NCHW-FP32-F=miopenConvolutionFwdAlgoWinograd:ConvBinWinogradRxSf2x3,503,166,0,miopenConvolutionFwdAlgoWinograd;miopenConvolutionFwdAlgoDirect:ConvOclDirectFwd,691,58,0,miopenConvolutionFwdAlgoDirect;miopenConvolutionFwdAlgoGEMM:GemmFwdRest,2204,22,14518080,MIOpenGEMM
64-73-73-1x1-160-73-73-64-0x0-1x1-1x1-0-NCHW-FP32-W=miopenConvolutionBwdWeightsAlgoDirect:ConvAsmBwdWrW1x1,20,8131,0,miopenConvolutionBwdWeightsAlgoDirect;miopenConvolutionBwdWeightsAlgoWinograd:ConvBinWinogradRxSf2x3,260,751,0,miopenConvolutionBwdWeightsAlgoWinograd;miopenConvolutionBwdWeightsAlgoGEMM:gemm,880,14,0,MIOpenGEMM
384-17-17-1x1-1024-17-17-64-0x0-1x1-1x1-0-NCHW-FP32-B=miopenConvolutionBwdDataAlgoDirect:ConvAsm1x1U,5,44315,0,miopenConvolutionBwdDataAlgoDirect;miopenConvolutionBwdDataAlgoGEMM:gemm,220,362,0,MIOpenGEMM
192-17-17-7x1-224-17-17-64-3x0-1x1-1x1-0-NCHW-FP32-F=miopenConvolutionFwdAlgoWinograd:ConvBinWinogradRxSf3x2,16,847,0,miopenConvolutionFwdAlgoWinograd;miopenConvolutionFwdAlgoImplicitGEMM:ConvHipImplicitGemmV4R1Fwd,21,6647,0,miopenConvolutionFwdAlgoImplicitGEMM;miopenConvolutionFwdAlgoGEMM:GemmFwdRest,324,381,1553664,MIOpenGEMM
64-73-73-1x1-160-73-73-64-0x0-1x1-1x1-0-NCHW-FP32-B=miopenConvolutionBwdDataAlgoDirect:ConvAsm1x1U,5,26386,0,miopenConvolutionBwdDataAlgoDirect;miopenConvolutionBwdDataAlgoGEMM:gemm,69,8964,0,MIOpenGEMM
224-17-17-1x7-192-17-17-64-0x3-1x1-1x1-0-NCHW-FP32-W=miopenConvolutionBwdWeightsAlgoWinograd:ConvBinWinogradRxSf2x3,29,9907,0,miopenConvolutionBwdWeightsAlgoWinograd;miopenConvolutionBwdWeightsAlgoImplicitGEMM:ConvHipImplicitGemmV4R1WrW,59,3596,0,miopenConvolutionBwdWeightsAlgoImplicitGEMM;miopenConvolutionBwdWeightsAlgoDirect:ConvOclBwdWrW53,68,5366,0,miopenConvolutionBwdWeightsAlgoDirect;miopenConvolutionBwdWeightsAlgoGEMM:gemm,637,649,1553664,MIOpenGEMM
96-35-35-3x3-64-35-35-128-1x1-1x1-1x1-0-NCHW-FP32-W=miopenConvolutionBwdWeightsAlgoDirect:ConvAsmBwdWrW3x3,37,8291,0,miopenConvolutionBwdWeightsAlgoDirect;miopenConvolutionBwdWeightsAlgoWinograd:ConvBinWinogradRxS,87,4715,0,miopenConvolutionBwdWeightsAlgoWinograd;miopenConvolutionBwdWeightsAlgoImplicitGEMM:ConvHipImplicitGemmV4R1WrW,312,531,0,miopenConvolutionBwdWeightsAlgoImplicitGEMM;miopenConvolutionBwdWeightsAlgoGEMM:gemm,561,384,2822400,MIOpenGEMM
224-17-17-1x7-192-17-17-64-0x3-1x1-1x1-0-NCHW-FP32-B=miopenConvolutionBwdDataAlgoWinograd:ConvBinWinogradRxSf3x2,21,5003,0,miopenConvolutionBwdDataAlgoWinograd;miopenConvolutionBwdDataAlgoImplicitGEMM:ConvHipImplicitGemmBwdDataV1R1,101,5,0,miopenConvolutionBwdDataAlgoImplicitGEMM;miopenConvolutionBwdDataAlgoGEMM:gemm,1653,68,1553664,MIOpenGEMM
96-35-35-3x3-64-35-35-128-1x1-1x1-1x1-0-NCHW-FP32-B=miopenConvolutionBwdDataAlgoWinograd:ConvBinWinogradRxS,1,78843,0,miopenConvolutionBwdDataAlgoWinograd
192-17-17-1x7-224-17-17-64-0x3-1x1-1x1-0-NCHW-FP32-F=miopenConvolutionFwdAlgoWinograd:ConvBinWinogradRxS,44,6329,0,miopenConvolutionFwdAlgoWinograd;miopenConvolutionFwdAlgoImplicitGEMM:ConvHipImplicitGemmV4R1Fwd,57,9338,0,miopenConvolutionFwdAlgoImplicitGEMM;miopenConvolutionFwdAlgoGEMM:GemmFwdRest,1888,38,1553664,MIOpenGEMM
224-17-17-1x7-224-17-17-64-0x3-1x1-1x1-0-NCHW-FP32-B=miopenConvolutionBwdDataAlgoWinograd:ConvBinWinogradRxSf3x2,22,9501,0,miopenConvolutionBwdDataAlgoWinograd;miopenConvolutionBwdDataAlgoImplicitGEMM:ConvHipImplicitGemmBwdDataV1R1,97,205,0,miopenConvolutionBwdDataAlgoImplicitGEMM;miopenConvolutionBwdDataAlgoGEMM:gemm,1004,7,1812608,MIOpenGEMM
192-8-8-3x3-192-17-17-64-0x0-2x2-1x1-0-NCHW-FP32-W=miopenConvolutionBwdWeightsAlgoImplicitGEMM:ConvHipImplicitGemmV4R1WrW,10,4308,0,miopenConvolutionBwdWeightsAlgoImplicitGEMM;miopenConvolutionBwdWeightsAlgoDirect:ConvOclBwdWrW2NonTunable,101,373,84934656,miopenConvolutionBwdWeightsAlgoDirect;miopenConvolutionBwdWeightsAlgoGEMM:gemm,292,2,442368,MIOpenGEMM
224-17-17-1x7-224-17-17-64-0x3-1x1-1x1-0-NCHW-FP32-F=miopenConvolutionFwdAlgoWinograd:ConvBinWinogradRxSf3x2,12,9573,0,miopenConvolutionFwdAlgoWinograd;miopenConvolutionFwdAlgoImplicitGEMM:ConvHipImplicitGemmV4R1Fwd,29,8169,0,miopenConvolutionFwdAlgoImplicitGEMM;miopenConvolutionFwdAlgoGEMM:GemmFwdRest,1983,58,1812608,MIOpenGEMM
160-73-73-1x1-64-73-73-64-0x0-1x1-1x1-0-NCHW-FP32-F=miopenConvolutionFwdAlgoDirect:ConvAsm1x1U,5,81048,0,miopenConvolutionFwdAlgoDirect;miopenConvolutionFwdAlgoWinograd:ConvBinWinogradRxSf3x2,21,48,0,miopenConvolutionFwdAlgoWinograd;miopenConvolutionFwdAlgoGEMM:GemmFwd1x1_0_1,525,587,0,MIOpenGEMM
192-8-8-3x3-192-17-17-64-0x0-2x2-1x1-0-NCHW-FP32-B=miopenConvolutionBwdDataAlgoWinograd:ConvBinWinogradRxSf2x3,3,42735,0,miopenConvolutionBwdDataAlgoWinograd;miopenConvolutionBwdDataAlgoImplicitGEMM:ConvHipImplicitGemmBwdDataV1R1,16,7544,0,miopenConvolutionBwdDataAlgoImplicitGEMM;miopenConvolutionBwdDataAlgoDirect:ConvOclDirectFwd,36,572,0,miopenConvolutionBwdDataAlgoDirect;miopenConvolutionBwdDataAlgoGEMM:gemm,564,772,442368,MIOpenGEMM
192-35-35-3x3-192-71-71-64-0x0-2x2-1x1-0-NCHW-FP32-W=miopenConvolutionBwdWeightsAlgoDirect:ConvOclBwdWrW2NonTunable,764,814,84934656,miopenConvolutionBwdWeightsAlgoDirect;miopenConvolutionBwdWeightsAlgoImplicitGEMM:ConvHipImplicitGemmV4R1WrW,1563,19,0,miopenConvolutionBwdWeightsAlgoImplicitGEMM;miopenConvolutionBwdWeightsAlgoGEMM:gemm,2996,88,8467200,MIOpenGEMM
192-17-17-3x3-192-8-8-64-0x0-2x2-1x1-0-NCHW-FP32-F=miopenConvolutionFwdAlgoWinograd:ConvBinWinogradRxSf2x3,1,45035,0,miopenConvolutionFwdAlgoWinograd;miopenConvolutionFwdAlgoDirect:ConvOclDirectFwd,8,40004,0,miopenConvolutionFwdAlgoDirect;miopenConvolutionFwdAlgoGEMM:GemmFwdRest,179,112,442368,MIOpenGEMM
96-35-35-3x3-96-35-35-128-1x1-1x1-1x1-0-NCHW-FP32-W=miopenConvolutionBwdWeightsAlgoWinograd:ConvBinWinogradRxSf2x3,10,1222,0,miopenConvolutionBwdWeightsAlgoWinograd;miopenConvolutionBwdWeightsAlgoDirect:ConvAsmBwdWrW3x3,11,7971,0,miopenConvolutionBwdWeightsAlgoDirect;miopenConvolutionBwdWeightsAlgoGEMM:gemm,24,1717,4233600,MIOpenGEMM
192-17-17-1x1-768-17-17-128-0x0-1x1-1x1-0-NCHW-FP32-W=miopenConvolutionBwdWeightsAlgoDirect:ConvAsmBwdWrW1x1,59,2695,0,miopenConvolutionBwdWeightsAlgoDirect;miopenConvolutionBwdWeightsAlgoWinograd:ConvBinWinogradRxSf2x3,146,704,0,miopenConvolutionBwdWeightsAlgoWinograd;miopenConvolutionBwdWeightsAlgoGEMM:gemm,400,131,0,MIOpenGEMM
192-17-17-1x7-192-17-17-64-0x3-1x1-1x1-0-NCHW-FP32-W=miopenConvolutionBwdWeightsAlgoWinograd:ConvBinWinogradRxSf2x3,47,2655,0,miopenConvolutionBwdWeightsAlgoWinograd;miopenConvolutionBwdWeightsAlgoDirect:ConvOclBwdWrW53,67,4831,0,miopenConvolutionBwdWeightsAlgoDirect;miopenConvolutionBwdWeightsAlgoImplicitGEMM:ConvHipImplicitGemmV4R1WrW,85,405,0,miopenConvolutionBwdWeightsAlgoImplicitGEMM;miopenConvolutionBwdWeightsAlgoGEMM:gemm,531,514,1553664,MIOpenGEMM
1024-17-17-1x1-384-17-17-64-0x0-1x1-1x1-0-NCHW-FP32-F=miopenConvolutionFwdAlgoDirect:ConvAsm1x1U,29,3811,0,miopenConvolutionFwdAlgoDirect;miopenConvolutionFwdAlgoWinograd:ConvBinWinogradRxSf3x2,43,1893,0,miopenConvolutionFwdAlgoWinograd;miopenConvolutionFwdAlgoGEMM:GemmFwd1x1_0_1,818,617,0,MIOpenGEMM
256-17-17-1x7-256-17-17-64-0x3-1x1-1x1-0-NCHW-FP32-W=miopenConvolutionBwdWeightsAlgoWinograd:ConvBinWinogradRxSf2x3,49,3692,0,miopenConvolutionBwdWeightsAlgoWinograd;miopenConvolutionBwdWeightsAlgoDirect:ConvOclBwdWrW53,161,202,0,miopenConvolutionBwdWeightsAlgoDirect;miopenConvolutionBwdWeightsAlgoImplicitGEMM:ConvHipImplicitGemmV4R1WrW,198,484,0,miopenConvolutionBwdWeightsAlgoImplicitGEMM;miopenConvolutionBwdWeightsAlgoGEMM:gemm,280,167,2071552,MIOpenGEMM
192-17-17-1x1-768-17-17-128-0x0-1x1-1x1-0-NCHW-FP32-B=miopenConvolutionBwdDataAlgoDirect:ConvAsm1x1U,18,3554,0,miopenConvolutionBwdDataAlgoDirect;miopenConvolutionBwdDataAlgoGEMM:gemm,1849,94,0,MIOpenGEMM
384-8-8-1x1-1536-8-8-64-0x0-1x1-1x1-0-NCHW-FP32-W=miopenConvolutionBwdWeightsAlgoDirect:ConvAsmBwdWrW1x1,4,57919,0,miopenConvolutionBwdWeightsAlgoDirect;miopenConvolutionBwdWeightsAlgoWinograd:ConvBinWinogradRxSf2x3,47,8256,0,miopenConvolutionBwdWeightsAlgoWinograd;miopenConvolutionBwdWeightsAlgoGEMM:gemm,144,636,0,MIOpenGEMM
192-17-17-1x7-192-17-17-64-0x3-1x1-1x1-0-NCHW-FP32-B=miopenConvolutionBwdDataAlgoWinograd:ConvBinWinogradRxSf3x2,9,5895,0,miopenConvolutionBwdDataAlgoWinograd;miopenConvolutionBwdDataAlgoImplicitGEMM:ConvHipImplicitGemmBwdDataV1R1,26,9109,0,miopenConvolutionBwdDataAlgoImplicitGEMM;miopenConvolutionBwdDataAlgoGEMM:gemm,198,125,1553664,MIOpenGEMM
192-35-35-3x3-192-71-71-64-0x0-2x2-1x1-0-NCHW-FP32-B=miopenConvolutionBwdDataAlgoImplicitGEMM:ConvHipImplicitGemmBwdDataV1R1,202,804,0,miopenConvolutionBwdDataAlgoImplicitGEMM;miopenConvolutionBwdDataAlgoWinograd:ConvBinWinogradRxSf2x3,312,666,0,miopenConvolutionBwdDataAlgoWinograd;miopenConvolutionBwdDataAlgoDirect:ConvOclDirectFwd,415,226,0,miopenConvolutionBwdDataAlgoDirect;miopenConvolutionBwdDataAlgoGEMM:gemm,1506,83,8467200,MIOpenGEMM
256-17-17-1x7-256-17-17-64-0x3-1x1-1x1-0-NCHW-FP32-B=miopenConvolutionBwdDataAlgoWinograd:ConvBinWinogradRxSf2x3,148,134,0,miopenConvolutionBwdDataAlgoWinograd;miopenConvolutionBwdDataAlgoGEMM:gemm,931,715,2071552,MIOpenGEMM;miopenConvolutionBwdDataAlgoImplicitGEMM:ConvHipImplicitGemmBwdDataV1R1,1180,75,0,miopenConvolutionBwdDataAlgoImplicitGEMM
32-149-149-3x3-32-147-147-64-0x0-1x1-1x1-0-NCHW-FP32-F=miopenConvolutionFwdAlgoWinograd:ConvBinWinogradRxS,6,32099,0,miopenConvolutionFwdAlgoWinograd;miopenConvolutionFwdAlgoDirect:ConvOclDirectFwd,70,6282,0,miopenConvolutionFwdAlgoDirect;miopenConvolutionFwdAlgoGEMM:GemmFwdRest,680,26,24893568,MIOpenGEMM
192-17-17-1x7-192-17-17-64-0x3-1x1-1x1-0-NCHW-FP32-F=miopenConvolutionFwdAlgoImplicitGEMM:ConvHipImplicitGemmV4R1Fwd,10,6042,0,miopenConvolutionFwdAlgoImplicitGEMM;miopenConvolutionFwdAlgoWinograd:ConvBinWinogradRxSf3x2,18,208,0,miopenConvolutionFwdAlgoWinograd;miopenConvolutionFwdAlgoGEMM:GemmFwdRest,829,67,1553664,MIOpenGEMM
256-17-17-1x1-1024-17-17-64-0x0-1x1-1x1-0-NCHW-FP32-W=miopenConvolutionBwdWeightsAlgoDirect:ConvAsmBwdWrW1x1,19,3293,0,miopenConvolutionBwdWeightsAlgoDirect;miopenConvolutionBwdWeightsAlgoWinograd:ConvBinWinogradRxSf2x3,77,6779,0,miopenConvolutionBwdWeightsAlgoWinograd;miopenConvolutionBwdWeightsAlgoGEMM:gemm,164,776,0,MIOpenGEMM
384-8-8-1x1-1536-8-8-64-0x0-1x1-1x1-0-NCHW-FP32-B=miopenConvolutionBwdDataAlgoDirect:ConvAsm1x1U,1,20917,0,miopenConvolutionBwdDataAlgoDirect;miopenConvolutionBwdDataAlgoWinograd:ConvBinWinogradRxSf3x2,8,39666,0,miopenConvolutionBwdDataAlgoWinograd;miopenConvolutionBwdDataAlgoGEMM:gemm,69,1715,0,MIOpenGEMM
384-17-17-3x3-384-35-35-64-0x0-2x2-1x1-0-NCHW-FP32-B=miopenConvolutionBwdDataAlgoDirect:ConvOclDirectFwd,671,276,0,miopenConvolutionBwdDataAlgoDirect;miopenConvolutionBwdDataAlgoGEMM:gemm,1112,7,3995136,MIOpenGEMM;miopenConvolutionBwdDataAlgoImplicitGEMM:ConvHipImplicitGemmBwdDataV1R1,1166,75,0,miopenConvolutionBwdDataAlgoImplicitGEMM;miopenConvolutionBwdDataAlgoWinograd:ConvBinWinogradRxS,1847,46,0,miopenConvolutionBwdDataAlgoWinograd
256-17-17-1x7-256-17-17-64-0x3-1x1-1x1-0-NCHW-FP32-F=miopenConvolutionFwdAlgoImplicitGEMM:ConvHipImplicitGemmV4R1Fwd,354,75,0,miopenConvolutionFwdAlgoImplicitGEMM;miopenConvolutionFwdAlgoWinograd:ConvBinWinogradRxSf3x2,362,293,0,miopenConvolutionFwdAlgoWinograd;miopenConvolutionFwdAlgoGEMM:GemmFwdRest,740,69,2071552,MIOpenGEMM
256-17-17-1x1-1024-17-17-64-0x0-1x1-1x1-0-NCHW-FP32-B=miopenConvolutionBwdDataAlgoDirect:ConvAsm1x1U,13,7026,0,miopenConvolutionBwdDataAlgoDirect;miopenConvolutionBwdDataAlgoWinograd:ConvBinWinogradRxSf2x3,220,37,0,miopenConvolutionBwdDataAlgoWinograd;miopenConvolutionBwdDataAlgoGEMM:gemm,975,181,0,MIOpenGEMM
192-71-71-3x3-192-35-35-64-0x0-2x2-1x1-0-NCHW-FP32-F=miopenConvolutionFwdAlgoWinograd:ConvBinWinogradRxS,17,5527,0,miopenConvolutionFwdAlgoWinograd;miopenConvolutionFwdAlgoGEMM:GemmFwdRest,22,7381,8467200,MIOpenGEMM;miopenConvolutionFwdAlgoDirect:ConvOclDirectFwd,92,6355,0,miopenConvolutionFwdAlgoDirect
256-17-17-3x3-224-35-35-64-0x0-2x2-1x1-0-NCHW-FP32-W=miopenConvolutionBwdWeightsAlgoGEMM:gemm,636,126,2330496,MIOpenGEMM;miopenConvolutionBwdWeightsAlgoDirect:ConvOclBwdWrW2NonTunable,764,26,132120576,miopenConvolutionBwdWeightsAlgoDirect
64-147-147-3x3-32-147-147-64-1x1-1x1-1x1-0-NCHW-FP32-W=miopenConvolutionBwdWeightsAlgoDirect:ConvAsmBwdWrW3x3,80,201,0,miopenConvolutionBwdWeightsAlgoDirect;miopenConvolutionBwdWeightsAlgoGEMM:gemm,551,649,24893568,MIOpenGEMM;miopenConvolutionBwdWeightsAlgoWinograd:ConvBinWinogradRxSf2x3,622,647,0,miopenConvolutionBwdWeightsAlgoWinograd
384-35-35-3x3-384-17-17-64-0x0-2x2-1x1-0-NCHW-FP32-F=miopenConvolutionFwdAlgoWinograd:ConvBinWinogradRxS,167,676,0,miopenConvolutionFwdAlgoWinograd;miopenConvolutionFwdAlgoDirect:ConvOclDirectFwd,394,889,0,miopenConvolutionFwdAlgoDirect;miopenConvolutionFwdAlgoGEMM:GemmFwdRest,854,144,3995136,MIOpenGEMM
224-35-35-3x3-192-35-35-64-1x1-1x1-1x1-0-NCHW-FP32-W=miopenConvolutionBwdWeightsAlgoDirect:ConvAsmBwdWrW3x3,58,3393,0,miopenConvolutionBwdWeightsAlgoDirect;miopenConvolutionBwdWeightsAlgoWinograd:ConvBinWinogradRxS,82,5281,0,miopenConvolutionBwdWeightsAlgoWinograd;miopenConvolutionBwdWeightsAlgoImplicitGEMM:ConvHipImplicitGemmV4R1WrW,112,253,0,miopenConvolutionBwdWeightsAlgoImplicitGEMM;miopenConvolutionBwdWeightsAlgoGEMM:gemm,260,833,8467200,MIOpenGEMM
1536-8-8-1x1-384-8-8-64-0x0-1x1-1x1-0-NCHW-FP32-F=miopenConvolutionFwdAlgoWinograd:ConvBinWinogradRxS,4,155,0,miopenConvolutionFwdAlgoWinograd;miopenConvolutionFwdAlgoDirect:ConvAsm1x1U,4,15533,0,miopenConvolutionFwdAlgoDirect;miopenConvolutionFwdAlgoGEMM:GemmFwd1x1_0_1,5,75668,0,MIOpenGEMM
1024-17-17-1x1-256-17-17-64-0x0-1x1-1x1-0-NCHW-FP32-F=miopenConvolutionFwdAlgoDirect:ConvAsm1x1U,7,98068,0,miopenConvolutionFwdAlgoDirect;miopenConvolutionFwdAlgoWinograd:ConvBinWinogradRxSf3x2,32,7239,0,miopenConvolutionFwdAlgoWinograd;miopenConvolutionFwdAlgoGEMM:GemmFwd1x1_0_1,180,477,0,MIOpenGEMM
256-56-56-3x3-256-56-56-128-1x1-1x1-1x1-0-NCHW-FP32-W=miopenConvolutionBwdWeightsAlgoDirect:ConvOclBwdWrW2NonTunable,542,207,301989888,miopenConvolutionBwdWeightsAlgoDirect;miopenConvolutionBwdWeightsAlgoImplicitGEMM:ConvHipImplicitGemmV4R1WrW,847,464,0,miopenConvolutionBwdWeightsAlgoImplicitGEMM;miopenConvolutionBwdWeightsAlgoGEMM:gemm,1211,18,28901376,MIOpenGEMM;miopenConvolutionBwdWeightsAlgoWinograd:ConvBinWinogradRxS,1742,86,0,miopenConvolutionBwdWeightsAlgoWinograd
192-35-35-1x1-384-35-35-64-0x0-1x1-1x1-0-NCHW-FP32-W=miopenConvolutionBwdWeightsAlgoDirect:ConvAsmBwdWrW1x1,33,6,0,miopenConvolutionBwdWeightsAlgoDirect;miopenConvolutionBwdWeightsAlgoGEMM:gemm,1921,46,0,MIOpenGEMM
64-147-147-3x3-32-147-147-64-1x1-1x1-1x1-0-NCHW-FP32-B=miopenConvolutionBwdDataAlgoWinograd:ConvBinWinogradRxS,47,9173,0,miopenConvolutionBwdDataAlgoWinograd
256-8-8-1x3-384-8-8-64-0x1-1x1-1x1-0-NCHW-FP32-W=miopenConvolutionBwdWeightsAlgoWinograd:ConvBinWinogradRxSf2x3,2,67529,0,miopenConvolutionBwdWeightsAlgoWinograd;miopenConvolutionBwdWeightsAlgoDirect:ConvOclBwdWrW53,15,4798,0,miopenConvolutionBwdWeightsAlgoDirect;miopenConvolutionBwdWeightsAlgoImplicitGEMM:ConvHipImplicitGemmV4R1WrW,59,5491,0,miopenConvolutionBwdWeightsAlgoImplicitGEMM;miopenConvolutionBwdWeightsAlgoGEMM:gemm,496,296,294912,MIOpenGEMM
256-17-17-3x3-224-35-35-64-0x0-2x2-1x1-0-NCHW-FP32-B=miopenConvolutionBwdDataAlgoWinograd:ConvBinWinogradRxS,152,954,0,miopenConvolutionBwdDataAlgoWinograd;miopenConvolutionBwdDataAlgoImplicitGEMM:ConvHipImplicitGemmBwdDataV1R1,266,474,0,miopenConvolutionBwdDataAlgoImplicitGEMM;miopenConvolutionBwdDataAlgoDirect:ConvOclDirectFwd,922,752,0,miopenConvolutionBwdDataAlgoDirect;miopenConvolutionBwdDataAlgoGEMM:gemm,1788,1,2330496,MIOpenGEMM
512-8-8-1x3-256-8-8-64-0x1-1x1-1x1-0-NCHW-FP32-F=miopenConvolutionFwdAlgoWinograd:ConvBinWinogradRxS,1,68688,0,miopenConvolutionFwdAlgoWinograd;miopenConvolutionFwdAlgoImplicitGEMM:ConvHipImplicitGemmV4R1Fwd,7,20744,0,miopenConvolutionFwdAlgoImplicitGEMM;miopenConvolutionFwdAlgoGEMM:GemmFwdRest,651,662,393216,MIOpenGEMM
256-8-8-1x3-384-8-8-64-0x1-1x1-1x1-0-NCHW-FP32-B=miopenConvolutionBwdDataAlgoWinograd:ConvBinWinogradRxSf3x2,2,28439,0,miopenConvolutionBwdDataAlgoWinograd;miopenConvolutionBwdDataAlgoImplicitGEMM:ConvHipImplicitGemmBwdDataV1R1,19,1088,0,miopenConvolutionBwdDataAlgoImplicitGEMM;miopenConvolutionBwdDataAlgoGEMM:gemm,647,76,294912,MIOpenGEMM
256-8-8-1x1-1536-8-8-64-0x0-1x1-1x1-0-NCHW-FP32-W=miopenConvolutionBwdWeightsAlgoDirect:ConvAsmBwdWrW1x1,1,16082,0,miopenConvolutionBwdWeightsAlgoDirect;miopenConvolutionBwdWeightsAlgoGEMM:gemm,107,62,0,MIOpenGEMM
32-147-147-3x3-64-147-147-64-1x1-1x1-1x1-0-NCHW-FP32-F=miopenConvolutionFwdAlgoWinograd:ConvBinWinogradRxSf3x2,285,204,0,miopenConvolutionFwdAlgoWinograd
224-35-35-3x3-192-35-35-64-1x1-1x1-1x1-0-NCHW-FP32-B=miopenConvolutionBwdDataAlgoWinograd:ConvBinWinogradRxS,23,5236,0,miopenConvolutionBwdDataAlgoWinograd
384-8-8-1x3-256-8-8-64-0x1-1x1-1x1-0-NCHW-FP32-F=miopenConvolutionFwdAlgoWinograd:ConvBinWinogradRxSf3x2,8,45401,0,miopenConvolutionFwdAlgoWinograd;miopenConvolutionFwdAlgoImplicitGEMM:ConvHipImplicitGemmV4R1Fwd,15,141,0,miopenConvolutionFwdAlgoImplicitGEMM;miopenConvolutionFwdAlgoGEMM:GemmFwdRest,164,162,294912,MIOpenGEMM
32-149-149-3x3-3-299-299-64-0x0-2x2-1x1-0-NCHW-FP32-W=miopenConvolutionBwdWeightsAlgoDirect:ConvOclBwdWrW2NonTunable,138,7,221184,miopenConvolutionBwdWeightsAlgoDirect;miopenConvolutionBwdWeightsAlgoGEMM:gemm,3869,77,2397708,MIOpenGEMM
192-17-17-1x1-1024-17-17-64-0x0-1x1-1x1-0-NCHW-FP32-W=miopenConvolutionBwdWeightsAlgoDirect:ConvOclBwdWrW1x1,26,1289,0,miopenConvolutionBwdWeightsAlgoDirect;miopenConvolutionBwdWeightsAlgoGEMM:gemm,125,913,0,MIOpenGEMM
192-35-35-3x3-224-35-35-64-1x1-1x1-1x1-0-NCHW-FP32-F=miopenConvolutionFwdAlgoWinograd:ConvBinWinogradRxSf2x3,538,142,0,miopenConvolutionFwdAlgoWinograd
32-149-149-3x3-3-299-299-64-0x0-2x2-1x1-0-NCHW-FP32-B=miopenConvolutionBwdDataAlgoDirect:ConvOclDirectFwd,28,407,0,miopenConvolutionBwdDataAlgoDirect;miopenConvolutionBwdDataAlgoWinograd:ConvBinWinogradRxSf2x3,29,2146,0,miopenConvolutionBwdDataAlgoWinograd;miopenConvolutionBwdDataAlgoGEMM:gemm,936,64,2397708,MIOpenGEMM
224-35-35-3x3-256-17-17-64-0x0-2x2-1x1-0-NCHW-FP32-F=miopenConvolutionFwdAlgoWinograd:ConvBinWinogradRxSf2x3,180,133,0,miopenConvolutionFwdAlgoWinograd;miopenConvolutionFwdAlgoDirect:ConvOclDirectFwd,598,49,0,miopenConvolutionFwdAlgoDirect;miopenConvolutionFwdAlgoGEMM:GemmFwdRest,2068,22,2330496,MIOpenGEMM
512-8-8-3x1-448-8-8-64-1x0-1x1-1x1-0-NCHW-FP32-W=miopenConvolutionBwdWeightsAlgoWinograd:ConvBinWinogradRxS,4,39864,0,miopenConvolutionBwdWeightsAlgoWinograd;miopenConvolutionBwdWeightsAlgoImplicitGEMM:ConvHipImplicitGemmV4R1WrW,17,1222,0,miopenConvolutionBwdWeightsAlgoImplicitGEMM;miopenConvolutionBwdWeightsAlgoDirect:ConvOclBwdWrW53,19,447,0,miopenConvolutionBwdWeightsAlgoDirect;miopenConvolutionBwdWeightsAlgoGEMM:gemm,1394,59,344064,MIOpenGEMM
3-299-299-3x3-32-149-149-64-0x0-2x2-1x1-0-NCHW-FP32-F=miopenConvolutionFwdAlgoGEMM:GemmFwdRest,4,4593,2397708,MIOpenGEMM;miopenConvolutionFwdAlgoWinograd:ConvBinWinogradRxSf2x3,5,50621,0,miopenConvolutionFwdAlgoWinograd;miopenConvolutionFwdAlgoDirect:ConvOclDirectFwd,6,39308,0,miopenConvolutionFwdAlgoDirect
256-8-8-1x1-1536-8-8-64-0x0-1x1-1x1-0-NCHW-FP32-B=miopenConvolutionBwdDataAlgoDirect:ConvOclDirectFwd1x1,2,51543,0,miopenConvolutionBwdDataAlgoDirect;miopenConvolutionBwdDataAlgoGEMM:gemm,148,5,0,MIOpenGEMM
512-8-8-3x1-448-8-8-64-1x0-1x1-1x1-0-NCHW-FP32-B=miopenConvolutionBwdDataAlgoWinograd:ConvBinWinogradRxSf3x2,6,38969,0,miopenConvolutionBwdDataAlgoWinograd;miopenConvolutionBwdDataAlgoImplicitGEMM:ConvHipImplicitGemmBwdDataV1R1,45,1697,0,miopenConvolutionBwdDataAlgoImplicitGEMM;miopenConvolutionBwdDataAlgoGEMM:gemm,533,402,344064,MIOpenGEMM
448-8-8-3x1-512-8-8-64-1x0-1x1-1x1-0-NCHW-FP32-F=miopenConvolutionFwdAlgoWinograd:ConvBinWinogradRxSf3x2,3,57039,0,miopenConvolutionFwdAlgoWinograd;miopenConvolutionFwdAlgoImplicitGEMM:ConvHipImplicitGemmV4R1Fwd,4,78002,0,miopenConvolutionFwdAlgoImplicitGEMM;miopenConvolutionFwdAlgoGEMM:GemmFwdRest,379,767,344064,MIOpenGEMM
256-17-17-7x1-224-17-17-64-3x0-1x1-1x1-0-NCHW-FP32-W=miopenConvolutionBwdWeightsAlgoDirect:ConvOclBwdWrW53,28,1644,0,miopenConvolutionBwdWeightsAlgoDirect;miopenConvolutionBwdWeightsAlgoWinograd:ConvBinWinogradRxSf2x3,29,166,0,miopenConvolutionBwdWeightsAlgoWinograd;miopenConvolutionBwdWeightsAlgoGEMM:gemm,128,649,1812608,MIOpenGEMM
96-35-35-1x1-384-35-35-64-0x0-1x1-1x1-0-NCHW-FP32-W=miopenConvolutionBwdWeightsAlgoDirect:ConvOclBwdWrW1x1,31,3889,0,miopenConvolutionBwdWeightsAlgoDirect;miopenConvolutionBwdWeightsAlgoGEMM:gemm,446,298,0,MIOpenGEMM
448-8-8-1x3-384-8-8-64-0x1-1x1-1x1-0-NCHW-FP32-W=miopenConvolutionBwdWeightsAlgoWinograd:ConvBinWinogradRxS,2,89,0,miopenConvolutionBwdWeightsAlgoWinograd;miopenConvolutionBwdWeightsAlgoDirect:ConvOclBwdWrW53,8,6351,0,miopenConvolutionBwdWeightsAlgoDirect;miopenConvolutionBwdWeightsAlgoImplicitGEMM:ConvHipImplicitGemmV4R1WrW,9,45339,0,miopenConvolutionBwdWeightsAlgoImplicitGEMM;miopenConvolutionBwdWeightsAlgoGEMM:gemm,329,18,294912,MIOpenGEMM
96-35-35-1x1-384-35-35-64-0x0-1x1-1x1-0-NCHW-FP32-B=miopenConvolutionBwdDataAlgoDirect:ConvAsm1x1U,2,3023,0,miopenConvolutionBwdDataAlgoDirect;miopenConvolutionBwdDataAlgoWinograd:ConvBinWinogradRxSf3x2,10,4853,0,miopenConvolutionBwdDataAlgoWinograd;miopenConvolutionBwdDataAlgoGEMM:gemm,225,275,0,MIOpenGEMM
448-8-8-1x3-384-8-8-64-0x1-1x1-1x1-0-NCHW-FP32-B=miopenConvolutionBwdDataAlgoWinograd:ConvBinWinogradRxS,1,69379,0,miopenConvolutionBwdDataAlgoWinograd;miopenConvolutionBwdDataAlgoImplicitGEMM:ConvHipImplicitGemmBwdDataV1R1,9,92887,0,miopenConvolutionBwdDataAlgoImplicitGEMM;miopenConvolutionBwdDataAlgoGEMM:gemm,72,9675,294912,MIOpenGEMM
256-17-17-7x1-224-17-17-64-3x0-1x1-1x1-0-NCHW-FP32-B=miopenConvolutionBwdDataAlgoWinograd:ConvBinWinogradRxSf3x2,32,3694,0,miopenConvolutionBwdDataAlgoWinograd;miopenConvolutionBwdDataAlgoImplicitGEMM:ConvHipImplicitGemmBwdDataV1R1,62,614,0,miopenConvolutionBwdDataAlgoImplicitGEMM;miopenConvolutionBwdDataAlgoGEMM:gemm,320,888,1812608,MIOpenGEMM
192-17-17-1x1-1024-17-17-64-0x0-1x1-1x1-0-NCHW-FP32-B=miopenConvolutionBwdDataAlgoDirect:ConvAsm1x1U,5,59825,0,miopenConvolutionBwdDataAlgoDirect;miopenConvolutionBwdDataAlgoGEMM:gemm,517,499,0,MIOpenGEMM
320-17-17-7x1-256-17-17-64-3x0-1x1-1x1-0-NCHW-FP32-W=miopenConvolutionBwdWeightsAlgoDirect:ConvOclBwdWrW53,57,8169,0,miopenConvolutionBwdWeightsAlgoDirect;miopenConvolutionBwdWeightsAlgoWinograd:ConvBinWinogradRxSf2x3,126,76,0,miopenConvolutionBwdWeightsAlgoWinograd;miopenConvolutionBwdWeightsAlgoImplicitGEMM:ConvHipImplicitGemmV4R1WrW,134,785,0,miopenConvolutionBwdWeightsAlgoImplicitGEMM;miopenConvolutionBwdWeightsAlgoGEMM:gemm,859,428,2071552,MIOpenGEMM
224-17-17-7x1-192-17-17-64-3x0-1x1-1x1-0-NCHW-FP32-W=miopenConvolutionBwdWeightsAlgoDirect:ConvOclBwdWrW53,18,3035,0,miopenConvolutionBwdWeightsAlgoDirect;miopenConvolutionBwdWeightsAlgoWinograd:ConvBinWinogradRxSf2x3,70,5153,0,miopenConvolutionBwdWeightsAlgoWinograd;miopenConvolutionBwdWeightsAlgoImplicitGEMM:ConvHipImplicitGemmV4R1WrW,105,628,0,miopenConvolutionBwdWeightsAlgoImplicitGEMM;miopenConvolutionBwdWeightsAlgoGEMM:gemm,1541,8,1553664,MIOpenGEMM
384-8-8-1x3-448-8-8-64-0x1-1x1-1x1-0-NCHW-FP32-F=miopenConvolutionFwdAlgoWinograd:ConvBinWinogradRxS,1,70774,0,miopenConvolutionFwdAlgoWinograd;miopenConvolutionFwdAlgoImplicitGEMM:ConvHipImplicitGemmV4R1Fwd,7,83713,0,miopenConvolutionFwdAlgoImplicitGEMM;miopenConvolutionFwdAlgoGEMM:GemmFwdRest,1211,94,294912,MIOpenGEMM
224-17-17-7x1-256-17-17-64-3x0-1x1-1x1-0-NCHW-FP32-F=miopenConvolutionFwdAlgoWinograd:ConvBinWinogradRxSf3x2,52,8673,0,miopenConvolutionFwdAlgoWinograd;miopenConvolutionFwdAlgoImplicitGEMM:ConvHipImplicitGemmV4R1Fwd,60,4163,0,miopenConvolutionFwdAlgoImplicitGEMM;miopenConvolutionFwdAlgoGEMM:GemmFwdRest,613,159,1812608,MIOpenGEMM
320-17-17-7x1-256-17-17-64-3x0-1x1-1x1-0-NCHW-FP32-B=miopenConvolutionBwdDataAlgoWinograd:ConvBinWinogradRxS,8,14606,0,miopenConvolutionBwdDataAlgoWinograd;miopenConvolutionBwdDataAlgoGEMM:gemm,12,9188,2071552,MIOpenGEMM;miopenConvolutionBwdDataAlgoImplicitGEMM:ConvHipImplicitGemmBwdDataV1R1,17,3572,0,miopenConvolutionBwdDataAlgoImplicitGEMM
224-17-17-7x1-192-17-17-64-3x0-1x1-1x1-0-NCHW-FP32-B=miopenConvolutionBwdDataAlgoWinograd:ConvBinWinogradRxSf3x2,12,6367,0,miopenConvolutionBwdDataAlgoWinograd;miopenConvolutionBwdDataAlgoImplicitGEMM:ConvHipImplicitGemmBwdDataV1R1,51,2906,0,miopenConvolutionBwdDataAlgoImplicitGEMM;miopenConvolutionBwdDataAlgoGEMM:gemm,384,569,1553664,MIOpenGEMM
224-17-17-1x7-224-17-17-64-0x3-1x1-1x1-0-NCHW-FP32-W=miopenConvolutionBwdWeightsAlgoWinograd:ConvBinWinogradRxSf2x3,18,888,0,miopenConvolutionBwdWeightsAlgoWinograd;miopenConvolutionBwdWeightsAlgoDirect:ConvOclBwdWrW53,74,958,0,miopenConvolutionBwdWeightsAlgoDirect;miopenConvolutionBwdWeightsAlgoGEMM:gemm,491,291,1812608,MIOpenGEMM
384-35-35-1x1-96-35-35-64-0x0-1x1-1x1-0-NCHW-FP32-F=miopenConvolutionFwdAlgoDirect:ConvAsm1x1U,6,87012,0,miopenConvolutionFwdAlgoDirect;miopenConvolutionFwdAlgoGEMM:GemmFwd1x1_0_1,632,92,0,MIOpenGEMM
96-35-35-3x3-64-35-35-64-1x1-1x1-1x1-0-NCHW-FP32-B=miopenConvolutionBwdDataAlgoWinograd:ConvBinWinograd3x3U,1,20638,0,miopenConvolutionBwdDataAlgoWinograd
64-35-35-3x3-96-35-35-64-1x1-1x1-1x1-0-NCHW-FP32-F=miopenConvolutionFwdAlgoWinograd:ConvBinWinogradRxS,1,20472,0,miopenConvolutionFwdAlgoWinograd
256-8-8-3x1-384-8-8-64-1x0-1x1-1x1-0-NCHW-FP32-W=miopenConvolutionBwdWeightsAlgoWinograd:ConvBinWinogradRxS,7,61702,0,miopenConvolutionBwdWeightsAlgoWinograd;miopenConvolutionBwdWeightsAlgoDirect:ConvOclBwdWrW53,8,43275,0,miopenConvolutionBwdWeightsAlgoDirect;miopenConvolutionBwdWeightsAlgoImplicitGEMM:ConvHipImplicitGemmV4R1WrW,24,9443,0,miopenConvolutionBwdWeightsAlgoImplicitGEMM;miopenConvolutionBwdWeightsAlgoGEMM:gemm,226,297,294912,MIOpenGEMM
256-17-17-7x1-320-17-17-64-3x0-1x1-1x1-0-NCHW-FP32-F=miopenConvolutionFwdAlgoWinograd:ConvBinWinogradRxSf3x2,41,135,0,miopenConvolutionFwdAlgoWinograd;miopenConvolutionFwdAlgoImplicitGEMM:ConvHipImplicitGemmV4R1Fwd,56,941,0,miopenConvolutionFwdAlgoImplicitGEMM;miopenConvolutionFwdAlgoGEMM:GemmFwdRest,919,262,2071552,MIOpenGEMM
1536-8-8-1x1-256-8-8-64-0x0-1x1-1x1-0-NCHW-FP32-F=miopenConvolutionFwdAlgoDirect:ConvAsm1x1U,1,88186,0,miopenConvolutionFwdAlgoDirect;miopenConvolutionFwdAlgoGEMM:GemmFwd1x1_0_1,572,803,0,MIOpenGEMM
192-35-35-1x1-384-35-35-64-0x0-1x1-1x1-0-NCHW-FP32-B=miopenConvolutionBwdDataAlgoDirect:ConvAsm1x1U,7,13008,0,miopenConvolutionBwdDataAlgoDirect;miopenConvolutionBwdDataAlgoWinograd:ConvBinWinogradRxS,57,6531,0,miopenConvolutionBwdDataAlgoWinograd;miopenConvolutionBwdDataAlgoGEMM:gemm,366,335,0,MIOpenGEMM
256-8-8-3x1-384-8-8-64-1x0-1x1-1x1-0-NCHW-FP32-B=miopenConvolutionBwdDataAlgoWinograd:ConvBinWinogradRxS,2,21032,0,miopenConvolutionBwdDataAlgoWinograd;miopenConvolutionBwdDataAlgoImplicitGEMM:ConvHipImplicitGemmBwdDataV1R1,36,7703,0,miopenConvolutionBwdDataAlgoImplicitGEMM;miopenConvolutionBwdDataAlgoGEMM:gemm,873,199,294912,MIOpenGEMM
96-73-73-3x3-64-147-147-64-0x0-2x2-1x1-0-NCHW-FP32-W=miopenConvolutionBwdWeightsAlgoImplicitGEMM:ConvHipImplicitGemmV4R1WrW,1417,6,0,miopenConvolutionBwdWeightsAlgoImplicitGEMM;miopenConvolutionBwdWeightsAlgoDirect:ConvOclBwdWrW2NonTunable,2091,86,14155776,miopenConvolutionBwdWeightsAlgoDirect;miopenConvolutionBwdWeightsAlgoGEMM:gemm,2097,36,12278016,MIOpenGEMM
384-8-8-3x1-256-8-8-64-1x0-1x1-1x1-0-NCHW-FP32-F=miopenConvolutionFwdAlgoWinograd:ConvBinWinogradRxS,1,26601,0,miopenConvolutionFwdAlgoWinograd;miopenConvolutionFwdAlgoImplicitGEMM:ConvHipImplicitGemmV4R1Fwd,6,25768,0,miopenConvolutionFwdAlgoImplicitGEMM;miopenConvolutionFwdAlgoGEMM:GemmFwdRest,365,619,294912,MIOpenGEMM
64-35-35-1x1-384-35-35-64-0x0-1x1-1x1-0-NCHW-FP32-W=miopenConvolutionBwdWeightsAlgoDirect:ConvAsmBwdWrW1x1,11,2248,0,miopenConvolutionBwdWeightsAlgoDirect;miopenConvolutionBwdWeightsAlgoGEMM:gemm,302,901,0,MIOpenGEMM
96-71-71-3x3-64-73-73-64-0x0-1x1-1x1-0-NCHW-FP32-W=miopenConvolutionBwdWeightsAlgoDirect:ConvOclBwdWrW2NonTunable,158,2,14155776,miopenConvolutionBwdWeightsAlgoDirect;miopenConvolutionBwdWeightsAlgoGEMM:gemm,1096,59,11614464,MIOpenGEMM
1024-17-17-1x1-192-17-17-64-0x0-1x1-1x1-0-NCHW-FP32-F=miopenConvolutionFwdAlgoDirect:ConvAsm1x1U,3,76287,0,miopenConvolutionFwdAlgoDirect;miopenConvolutionFwdAlgoWinograd:ConvBinWinogradRxSf3x2,17,1732,0,miopenConvolutionFwdAlgoWinograd;miopenConvolutionFwdAlgoGEMM:GemmFwd1x1_0_1,258,828,0,MIOpenGEMM
96-35-35-3x3-96-35-35-64-1x1-1x1-1x1-0-NCHW-FP32-B=miopenConvolutionBwdDataAlgoWinograd:ConvBinWinogradRxS,1,35954,0,miopenConvolutionBwdDataAlgoWinograd
96-73-73-3x3-64-147-147-64-0x0-2x2-1x1-0-NCHW-FP32-B=miopenConvolutionBwdDataAlgoWinograd:ConvBinWinogradRxSf2x3,60,7694,0,miopenConvolutionBwdDataAlgoWinograd;miopenConvolutionBwdDataAlgoDirect:ConvOclDirectFwd,73,5937,0,miopenConvolutionBwdDataAlgoDirect;miopenConvolutionBwdDataAlgoImplicitGEMM:ConvHipImplicitGemmBwdDataV1R1,74,8191,0,miopenConvolutionBwdDataAlgoImplicitGEMM;miopenConvolutionBwdDataAlgoGEMM:gemm,1519,72,12278016,MIOpenGEMM
96-71-71-3x3-64-73-73-64-0x0-1x1-1x1-0-NCHW-FP32-B=miopenConvolutionBwdDataAlgoWinograd:ConvBinWinogradRxS,22,5396,0,miopenConvolutionBwdDataAlgoWinograd;miopenConvolutionBwdDataAlgoDirect:ConvOclDirectFwd,104,967,0,miopenConvolutionBwdDataAlgoDirect;miopenConvolutionBwdDataAlgoImplicitGEMM:ConvHipImplicitGemmBwdDataV1R1,130,881,0,miopenConvolutionBwdDataAlgoImplicitGEMM;miopenConvolutionBwdDataAlgoGEMM:gemm,1020,49,11614464,MIOpenGEMM
384-35-35-1x1-192-35-35-64-0x0-1x1-1x1-0-NCHW-FP32-F=miopenConvolutionFwdAlgoDirect:ConvAsm1x1U,18,5479,0,miopenConvolutionFwdAlgoDirect;miopenConvolutionFwdAlgoGEMM:GemmFwd1x1_0_1,904,456,0,MIOpenGEMM
384-17-17-1x1-1024-17-17-64-0x0-1x1-1x1-0-NCHW-FP32-W=miopenConvolutionBwdWeightsAlgoDirect:ConvAsmBwdWrW1x1,52,855,0,miopenConvolutionBwdWeightsAlgoDirect;miopenConvolutionBwdWeightsAlgoWinograd:ConvBinWinogradRxSf2x3,277,22,0,miopenConvolutionBwdWeightsAlgoWinograd
320-8-8-3x3-320-17-17-64-0x0-2x2-1x1-0-NCHW-FP32-W=miopenConvolutionBwdWeightsAlgoImplicitGEMM:ConvHipImplicitGemmV4R1WrW,62,4436,0,miopenConvolutionBwdWeightsAlgoImplicitGEMM;miopenConvolutionBwdWeightsAlgoDirect:ConvOclBwdWrW2NonTunable,593,286,235929600,miopenConvolutionBwdWeightsAlgoDirect;miopenConvolutionBwdWeightsAlgoGEMM:gemm,1247,13,737280,MIOpenGEMM
256-8-8-3x1-512-8-8-64-1x0-1x1-1x1-0-NCHW-FP32-B=miopenConvolutionBwdDataAlgoWinograd:ConvBinWinogradRxSf2x3,1,27748,0,miopenConvolutionBwdDataAlgoWinograd;miopenConvolutionBwdDataAlgoImplicitGEMM:ConvHipImplicitGemmBwdDataV1R1,25,449,0,miopenConvolutionBwdDataAlgoImplicitGEMM;miopenConvolutionBwdDataAlgoGEMM:gemm,432,97,393216,MIOpenGEMM
64-73-73-3x3-96-71-71-64-0x0-1x1-1x1-0-NCHW-FP32-F=miopenConvolutionFwdAlgoWinograd:ConvBinWinogradRxS,9,21468,0,miopenConvolutionFwdAlgoWinograd;miopenConvolutionFwdAlgoDirect:ConvOclDirectFwd,132,512,0,miopenConvolutionFwdAlgoDirect;miopenConvolutionFwdAlgoGEMM:GemmFwdRest,598,193,11614464,MIOpenGEMM
64-147-147-3x3-96-73-73-64-0x0-2x2-1x1-0-NCHW-FP32-F=miopenConvolutionFwdAlgoWinograd:ConvBinWinogradRxSf2x3,85,9379,0,miopenConvolutionFwdAlgoWinograd;miopenConvolutionFwdAlgoDirect:ConvOclDirectFwd,266,654,0,miopenConvolutionFwdAlgoDirect;miopenConvolutionFwdAlgoGEMM:GemmFwdRest,300,352,12278016,MIOpenGEMM
64-35-35-1x1-384-35-35-64-0x0-1x1-1x1-0-NCHW-FP32-B=miopenConvolutionBwdDataAlgoDirect:ConvAsm1x1U,7,30134,0,miopenConvolutionBwdDataAlgoDirect;miopenConvolutionBwdDataAlgoWinograd:ConvBinWinogradRxSf3x2,38,1639,0,miopenConvolutionBwdDataAlgoWinograd;miopenConvolutionBwdDataAlgoGEMM:gemm,458,773,0,MIOpenGEMM
128-17-17-1x1-1024-17-17-64-0x0-1x1-1x1-0-NCHW-FP32-W=miopenConvolutionBwdWeightsAlgoDirect:ConvAsmBwdWrW1x1,2,9466,0,miopenConvolutionBwdWeightsAlgoDirect;miopenConvolutionBwdWeightsAlgoGEMM:gemm,229,621,0,MIOpenGEMM
96-35-35-3x3-96-35-35-64-1x1-1x1-1x1-0-NCHW-FP32-F=miopenConvolutionFwdAlgoWinograd:ConvBinWinograd3x3U,1,72572,0,miopenConvolutionFwdAlgoWinograd
320-8-8-3x3-320-17-17-64-0x0-2x2-1x1-0-NCHW-FP32-B=miopenConvolutionBwdDataAlgoImplicitGEMM:ConvHipImplicitGemmBwdDataV1R1,24,734,0,miopenConvolutionBwdDataAlgoImplicitGEMM;miopenConvolutionBwdDataAlgoWinograd:ConvBinWinogradRxSf2x3,28,297,0,miopenConvolutionBwdDataAlgoWinograd;miopenConvolutionBwdDataAlgoDirect:ConvOclDirectFwd,74,6832,0,miopenConvolutionBwdDataAlgoDirect;miopenConvolutionBwdDataAlgoGEMM:gemm,359,268,737280,MIOpenGEMM
256-8-8-3x1-512-8-8-64-1x0-1x1-1x1-0-NCHW-FP32-W=miopenConvolutionBwdWeightsAlgoDirect:ConvOclBwdWrW53,3,6162,0,miopenConvolutionBwdWeightsAlgoDirect;miopenConvolutionBwdWeightsAlgoWinograd:ConvBinWinogradRxS,4,24043,0,miopenConvolutionBwdWeightsAlgoWinograd;miopenConvolutionBwdWeightsAlgoImplicitGEMM:ConvHipImplicitGemmV4R1WrW,25,3455,0,miopenConvolutionBwdWeightsAlgoImplicitGEMM;miopenConvolutionBwdWeightsAlgoGEMM:gemm,632,41,393216,MIOpenGEMM
320-17-17-3x3-320-8-8-64-0x0-2x2-1x1-0-NCHW-FP32-F=miopenConvolutionFwdAlgoWinograd:ConvBinWinogradRxSf2x3,5,94218,0,miopenConvolutionFwdAlgoWinograd;miopenConvolutionFwdAlgoDirect:ConvOclDirectFwd,29,2658,0,miopenConvolutionFwdAlgoDirect;miopenConvolutionFwdAlgoGEMM:GemmFwdRest,704,616,737280,MIOpenGEMM
512-8-8-3x1-256-8-8-64-1x0-1x1-1x1-0-NCHW-FP32-F=miopenConvolutionFwdAlgoWinograd:ConvBinWinogradRxS,12,4376,0,miopenConvolutionFwdAlgoWinograd;miopenConvolutionFwdAlgoImplicitGEMM:ConvHipImplicitGemmV4R1Fwd,14,4997,0,miopenConvolutionFwdAlgoImplicitGEMM;miopenConvolutionFwdAlgoGEMM:GemmFwdRest,886,794,393216,MIOpenGEMM
384-35-35-1x1-64-35-35-64-0x0-1x1-1x1-0-NCHW-FP32-F=miopenConvolutionFwdAlgoDirect:ConvAsm1x1U,3,65128,0,miopenConvolutionFwdAlgoDirect;miopenConvolutionFwdAlgoGEMM:GemmFwd1x1_0_1,138,987,0,MIOpenGEMM
64-73-73-7x1-64-73-73-64-3x0-1x1-1x1-0-NCHW-FP32-W=miopenConvolutionBwdWeightsAlgoDirect:ConvOclBwdWrW53,95,4184,7340032,miopenConvolutionBwdWeightsAlgoDirect;miopenConvolutionBwdWeightsAlgoWinograd:ConvBinWinogradRxSf2x3,223,825,0,miopenConvolutionBwdWeightsAlgoWinograd;miopenConvolutionBwdWeightsAlgoImplicitGEMM:ConvHipImplicitGemmV4R1WrW,640,505,0,miopenConvolutionBwdWeightsAlgoImplicitGEMM;miopenConvolutionBwdWeightsAlgoGEMM:gemm,1050,82,9549568,MIOpenGEMM
256-8-8-1x3-512-8-8-64-0x1-1x1-1x1-0-NCHW-FP32-W=miopenConvolutionBwdWeightsAlgoWinograd:ConvBinWinogradRxS,2,1378,0,miopenConvolutionBwdWeightsAlgoWinograd;miopenConvolutionBwdWeightsAlgoDirect:ConvOclBwdWrW53,3,51842,0,miopenConvolutionBwdWeightsAlgoDirect;miopenConvolutionBwdWeightsAlgoImplicitGEMM:ConvHipImplicitGemmV4R1WrW,9,55875,0,miopenConvolutionBwdWeightsAlgoImplicitGEMM;miopenConvolutionBwdWeightsAlgoGEMM:gemm,184,199,393216,MIOpenGEMM
64-73-73-7x1-64-73-73-64-3x0-1x1-1x1-0-NCHW-FP32-B=miopenConvolutionBwdDataAlgoWinograd:ConvBinWinogradRxSf3x2,18,8091,0,miopenConvolutionBwdDataAlgoWinograd;miopenConvolutionBwdDataAlgoImplicitGEMM:ConvHipImplicitGemmBwdDataV1R1,70,2881,0,miopenConvolutionBwdDataAlgoImplicitGEMM;miopenConvolutionBwdDataAlgoGEMM:gemm,247,591,9549568,MIOpenGEMM
384-17-17-3x3-384-35-35-64-0x0-2x2-1x1-0-NCHW-FP32-W=miopenConvolutionBwdWeightsAlgoImplicitGEMM:ConvHipImplicitGemmV4R1WrW,143,185,0,miopenConvolutionBwdWeightsAlgoImplicitGEMM;miopenConvolutionBwdWeightsAlgoGEMM:gemm,523,82,3995136,MIOpenGEMM;miopenConvolutionBwdWeightsAlgoDirect:ConvOclBwdWrW2NonTunable,681,532,339738624,miopenConvolutionBwdWeightsAlgoDirect
256-8-8-1x3-512-8-8-64-0x1-1x1-1x1-0-NCHW-FP32-B=miopenConvolutionBwdDataAlgoWinograd:ConvBinWinogradRxSf2x3,1,11106,0,miopenConvolutionBwdDataAlgoWinograd;miopenConvolutionBwdDataAlgoImplicitGEMM:ConvHipImplicitGemmBwdDataV1R1,7,60134,0,miopenConvolutionBwdDataAlgoImplicitGEMM;miopenConvolutionBwdDataAlgoGEMM:gemm,328,563,393216,MIOpenGEMM
64-73-73-7x1-64-73-73-64-3x0-1x1-1x1-0-NCHW-FP32-F=miopenConvolutionFwdAlgoWinograd:ConvBinWinogradRxSf3x2,28,2021,0,miopenConvolutionFwdAlgoWinograd;miopenConvolutionFwdAlgoImplicitGEMM:ConvHipImplicitGemmV4R1Fwd,40,4676,0,miopenConvolutionFwdAlgoImplicitGEMM;miopenConvolutionFwdAlgoGEMM:GemmFwdRest,325,625,9549568,MIOpenGEMM
32-147-147-3x3-32-149-149-64-0x0-1x1-1x1-0-NCHW-FP32-W=miopenConvolutionBwdWeightsAlgoDirect:ConvOclBwdWrW53,18,75,2359296,miopenConvolutionBwdWeightsAlgoDirect;miopenConvolutionBwdWeightsAlgoGEMM:gemm,30,4824,24893568,MIOpenGEMM;miopenConvolutionBwdWeightsAlgoWinograd:ConvBinWinogradRxSf2x3,47,9507,0,miopenConvolutionBwdWeightsAlgoWinograd
96-35-35-3x3-96-35-35-64-1x1-1x1-1x1-0-NCHW-FP32-W=miopenConvolutionBwdWeightsAlgoDirect:ConvAsmBwdWrW3x3,15,3468,0,miopenConvolutionBwdWeightsAlgoDirect;miopenConvolutionBwdWeightsAlgoWinograd:ConvBinWinogradRxSf2x3,36,1087,0,miopenConvolutionBwdWeightsAlgoWinograd;miopenConvolutionBwdWeightsAlgoGEMM:gemm,368,944,4233600,MIOpenGEMM
1024-64-64-1x1-512-32-32-2-0x0-2x2-1x1-0-NCHW-FP32-F=miopenConvolutionFwdAlgoImplicitGEMM:ConvHipImplicitGemmV4R4Fwd,9,19222,0,miopenConvolutionFwdAlgoImplicitGEMM;miopenConvolutionFwdAlgoDirect:ConvOclDirectFwd1x1,11,5982,0,miopenConvolutionFwdAlgoDirect;miopenConvolutionFwdAlgoWinograd:ConvBinWinogradRxS,29,6898,0,miopenConvolutionFwdAlgoWinograd;miopenConvolutionFwdAlgoGEMM:GemmFwd1x1_0_2,75,3085,12582912,MIOpenGEMM
256-32-32-1x1-2048-32-32-2-0x0-1x1-1x1-0-NCHW-FP32-B=miopenConvolutionBwdDataAlgoDirect:ConvAsm1x1U,6,56098,0,miopenConvolutionBwdDataAlgoDirect;miopenConvolutionBwdDataAlgoWinograd:ConvBinWinogradRxSf3x2,9,5583,0,miopenConvolutionBwdDataAlgoWinograd;miopenConvolutionBwdDataAlgoImplicitGEMM:ConvHipImplicitGemmBwdDataV1R1,83,5596,0,miopenConvolutionBwdDataAlgoImplicitGEMM;miopenConvolutionBwdDataAlgoGEMM:gemm,92,497,0,MIOpenGEMM
64-73-73-1x7-64-73-73-64-0x3-1x1-1x1-0-NCHW-FP32-F=miopenConvolutionFwdAlgoWinograd:ConvBinWinogradRxSf3x2,31,5781,0,miopenConvolutionFwdAlgoWinograd;miopenConvolutionFwdAlgoImplicitGEMM:ConvHipImplicitGemmV4R1Fwd,40,6004,0,miopenConvolutionFwdAlgoImplicitGEMM;miopenConvolutionFwdAlgoGEMM:GemmFwdRest,516,572,9549568,MIOpenGEMM
64-73-73-1x7-64-73-73-64-0x3-1x1-1x1-0-NCHW-FP32-B=miopenConvolutionBwdDataAlgoWinograd:ConvBinWinogradRxSf3x2,33,1113,0,miopenConvolutionBwdDataAlgoWinograd;miopenConvolutionBwdDataAlgoImplicitGEMM:ConvHipImplicitGemmBwdDataV1R1,121,492,0,miopenConvolutionBwdDataAlgoImplicitGEMM;miopenConvolutionBwdDataAlgoGEMM:gemm,289,792,9549568,MIOpenGEMM
12-16-16-1x1-512-16-16-2-0x0-1x1-1x1-0-NCHW-FP32-W=miopenConvolutionBwdWeightsAlgoDirect:ConvAsmBwdWrW1x1,0,761316,0,miopenConvolutionBwdWeightsAlgoDirect;miopenConvolutionBwdWeightsAlgoWinograd:ConvBinWinogradRxS,5,84317,0,miopenConvolutionBwdWeightsAlgoWinograd;miopenConvolutionBwdWeightsAlgoGEMM:gemm,7,82665,0,MIOpenGEMM
1024-64-64-1x1-256-64-64-2-0x0-1x1-1x1-0-NCHW-FP32-W=miopenConvolutionBwdWeightsAlgoDirect:ConvAsmBwdWrW1x1,7,58307,0,miopenConvolutionBwdWeightsAlgoDirect;miopenConvolutionBwdWeightsAlgoWinograd:ConvBinWinogradRxSf2x3,56,933,0,miopenConvolutionBwdWeightsAlgoWinograd
12-16-16-1x1-512-16-16-2-0x0-1x1-1x1-0-NCHW-FP32-B=miopenConvolutionBwdDataAlgoDirect:ConvOclDirectFwd1x1,1,35245,0,miopenConvolutionBwdDataAlgoDirect;miopenConvolutionBwdDataAlgoGEMM:gemm,10,3045,0,MIOpenGEMM;miopenConvolutionBwdDataAlgoWinograd:ConvBinWinogradRxSf2x3,20,5993,0,miopenConvolutionBwdDataAlgoWinograd;miopenConvolutionBwdDataAlgoImplicitGEMM:ConvHipImplicitGemmBwdDataV1R1,26,5201,0,miopenConvolutionBwdDataAlgoImplicitGEMM
256-64-64-1x1-1024-64-64-2-0x0-1x1-1x1-0-NCHW-FP32-W=miopenConvolutionBwdWeightsAlgoDirect:ConvAsmBwdWrW1x1,6,97296,0,miopenConvolutionBwdWeightsAlgoDirect;miopenConvolutionBwdWeightsAlgoWinograd:ConvBinWinogradRxSf2x3,32,3378,0,miopenConvolutionBwdWeightsAlgoWinograd
2048-32-32-1x1-256-32-32-2-0x0-1x1-1x1-0-NCHW-FP32-F=miopenConvolutionFwdAlgoDirect:ConvAsm1x1U,36,3602,0,miopenConvolutionFwdAlgoDirect;miopenConvolutionFwdAlgoWinograd:ConvBinWinogradRxSf3x2,68,1159,0,miopenConvolutionFwdAlgoWinograd;miopenConvolutionFwdAlgoImplicitGEMM:ConvHipImplicitGemmV4R4Fwd,101,579,0,miopenConvolutionFwdAlgoImplicitGEMM;miopenConvolutionFwdAlgoGEMM:GemmFwd1x1_0_1,179,154,0,MIOpenGEMM
256-128-128-1x1-512-128-128-2-0x0-1x1-1x1-0-NCHW-FP32-B=miopenConvolutionBwdDataAlgoDirect:ConvOclDirectFwd1x1,10,8741,0,miopenConvolutionBwdDataAlgoDirect;miopenConvolutionBwdDataAlgoGEMM:gemm,14,1986,0,MIOpenGEMM;miopenConvolutionBwdDataAlgoImplicitGEMM:ConvHipImplicitGemmBwdDataV1R1,15,4288,0,miopenConvolutionBwdDataAlgoImplicitGEMM;miopenConvolutionBwdDataAlgoWinograd:ConvBinWinogradRxSf3x2,24,2964,0,miopenConvolutionBwdDataAlgoWinograd
256-256-256-3x3-256-256-256-2-1x1-1x1-1x1-0-NCHW-FP32-F=miopenConvolutionFwdAlgoWinograd:ConvBinWinogradRxS,102,623,0,miopenConvolutionFwdAlgoWinograd
512-128-128-1x1-1024-64-64-2-0x0-2x2-1x1-0-NCHW-FP32-F=miopenConvolutionFwdAlgoImplicitGEMM:ConvHipImplicitGemmV4R4Fwd,9,41681,0,miopenConvolutionFwdAlgoImplicitGEMM;miopenConvolutionFwdAlgoGEMM:GemmFwd1x1_0_2,13,3224,50331648,MIOpenGEMM;miopenConvolutionFwdAlgoDirect:ConvOclDirectFwd1x1,39,8514,0,miopenConvolutionFwdAlgoDirect;miopenConvolutionFwdAlgoWinograd:ConvBinWinogradRxS,90,795,0,miopenConvolutionFwdAlgoWinograd
64-512-512-7x7-3-1030-1030-2-0x0-2x2-1x1-0-NCHW-FP32-W=miopenConvolutionBwdWeightsAlgoGEMM:gemm,43,6129,154140672,MIOpenGEMM
512-128-128-1x1-256-128-128-2-0x0-1x1-1x1-0-NCHW-FP32-F=miopenConvolutionFwdAlgoWinograd:ConvBinWinogradRxSf2x3,6,14435,0,miopenConvolutionFwdAlgoWinograd;miopenConvolutionFwdAlgoDirect:ConvOclDirectFwd1x1,44,6681,0,miopenConvolutionFwdAlgoDirect;miopenConvolutionFwdAlgoGEMM:GemmFwd1x1_0_1,131,582,0,MIOpenGEMM;miopenConvolutionFwdAlgoImplicitGEMM:ConvHipImplicitGemmV4R4Fwd,167,98,0,miopenConvolutionFwdAlgoImplicitGEMM
64-256-256-1x1-256-256-256-2-0x0-1x1-1x1-0-NCHW-FP32-B=miopenConvolutionBwdDataAlgoWinograd:ConvBinWinogradRxSf3x2,10,2897,0,miopenConvolutionBwdDataAlgoWinograd;miopenConvolutionBwdDataAlgoDirect:ConvOclDirectFwd1x1,10,6792,0,miopenConvolutionBwdDataAlgoDirect;miopenConvolutionBwdDataAlgoImplicitGEMM:ConvHipImplicitGemmBwdDataV1R1,21,7675,0,miopenConvolutionBwdDataAlgoImplicitGEMM;miopenConvolutionBwdDataAlgoGEMM:gemm,53,5453,0,MIOpenGEMM
512-16-16-1x1-12-16-16-2-0x0-1x1-1x1-0-NCHW-FP32-F=miopenConvolutionFwdAlgoDirect:ConvAsm1x1U,0,28009,0,miopenConvolutionFwdAlgoDirect;miopenConvolutionFwdAlgoWinograd:ConvBinWinogradRxSf3x2,0,521444,0,miopenConvolutionFwdAlgoWinograd;miopenConvolutionFwdAlgoGEMM:GemmFwd1x1_0_1,27,1948,0,MIOpenGEMM
1024-64-64-1x1-256-64-64-2-0x0-1x1-1x1-0-NCHW-FP32-B=miopenConvolutionBwdDataAlgoWinograd:ConvBinWinogradRxSf3x2,8,43735,0,miopenConvolutionBwdDataAlgoWinograd;miopenConvolutionBwdDataAlgoDirect:ConvOclDirectFwd1x1,9,72197,0,miopenConvolutionBwdDataAlgoDirect;miopenConvolutionBwdDataAlgoImplicitGEMM:ConvHipImplicitGemmBwdDataV1R1,16,408,0,miopenConvolutionBwdDataAlgoImplicitGEMM;miopenConvolutionBwdDataAlgoGEMM:gemm,17,3336,0,MIOpenGEMM
96-35-35-3x3-64-35-35-64-1x1-1x1-1x1-0-NCHW-FP32-W=miopenConvolutionBwdWeightsAlgoDirect:ConvAsmBwdWrW3x3,11,5246,0,miopenConvolutionBwdWeightsAlgoDirect;miopenConvolutionBwdWeightsAlgoWinograd:ConvBinWinogradRxSf2x3,32,8819,0,miopenConvolutionBwdWeightsAlgoWinograd;miopenConvolutionBwdWeightsAlgoImplicitGEMM:ConvHipImplicitGemmV4R1WrW,159,975,0,miopenConvolutionBwdWeightsAlgoImplicitGEMM;miopenConvolutionBwdWeightsAlgoGEMM:gemm,427,833,2822400,MIOpenGEMM
256-64-64-1x1-1024-64-64-2-0x0-1x1-1x1-0-NCHW-FP32-B=miopenConvolutionBwdDataAlgoDirect:ConvOclDirectFwd1x1,3,83789,0,miopenConvolutionBwdDataAlgoDirect;miopenConvolutionBwdDataAlgoWinograd:ConvBinWinogradRxSf3x2,5,33132,0,miopenConvolutionBwdDataAlgoWinograd;miopenConvolutionBwdDataAlgoGEMM:gemm,19,4225,0,MIOpenGEMM;miopenConvolutionBwdDataAlgoImplicitGEMM:ConvHipImplicitGemmBwdDataV1R1,21,1359,0,miopenConvolutionBwdDataAlgoImplicitGEMM
64-512-512-7x7-3-1030-1030-2-0x0-2x2-1x1-0-NCHW-FP32-B=miopenConvolutionBwdDataAlgoDirect:ConvOclDirectFwd,32,3012,0,miopenConvolutionBwdDataAlgoDirect;miopenConvolutionBwdDataAlgoGEMM:gemm,71,7954,154140672,MIOpenGEMM;miopenConvolutionBwdDataAlgoWinograd:ConvBinWinogradRxSf2x3,72,9611,0,miopenConvolutionBwdDataAlgoWinograd
512-128-128-3x3-256-128-128-2-1x1-1x1-1x1-0-NCHW-FP32-W=miopenConvolutionBwdWeightsAlgoDirect:ConvOclBwdWrW53,95,4144,0,miopenConvolutionBwdWeightsAlgoDirect;miopenConvolutionBwdWeightsAlgoWinograd:ConvBinWinogradRxSf2x3,169,856,0,miopenConvolutionBwdWeightsAlgoWinograd;miopenConvolutionBwdWeightsAlgoImplicitGEMM:ConvHipImplicitGemmV4R1WrW,336,67,0,miopenConvolutionBwdWeightsAlgoImplicitGEMM;miopenConvolutionBwdWeightsAlgoGEMM:gemm,996,674,150994944,MIOpenGEMM
6-128-128-1x1-512-128-128-2-0x0-1x1-1x1-0-NCHW-FP32-W=miopenConvolutionBwdWeightsAlgoDirect:ConvAsmBwdWrW1x1,3,2309,0,miopenConvolutionBwdWeightsAlgoDirect;miopenConvolutionBwdWeightsAlgoWinograd:ConvBinWinogradRxSf2x3,6,74923,0,miopenConvolutionBwdWeightsAlgoWinograd;miopenConvolutionBwdWeightsAlgoGEMM:gemm,16,1005,0,MIOpenGEMM
256-256-256-1x1-64-256-256-2-0x0-1x1-1x1-0-NCHW-FP32-F=miopenConvolutionFwdAlgoDirect:ConvOclDirectFwd1x1,4,84701,0,miopenConvolutionFwdAlgoDirect;miopenConvolutionFwdAlgoWinograd:ConvBinWinogradRxSf3x2,8,43989,0,miopenConvolutionFwdAlgoWinograd;miopenConvolutionFwdAlgoImplicitGEMM:ConvHipImplicitGemmV4R4Fwd,9,832,0,miopenConvolutionFwdAlgoImplicitGEMM;miopenConvolutionFwdAlgoGEMM:GemmFwd1x1_0_1,14,6663,0,MIOpenGEMM
256-64-64-1x1-1024-64-64-2-0x0-1x1-1x1-0-NCHW-FP32-F=miopenConvolutionFwdAlgoDirect:ConvOclDirectFwd1x1,6,44324,0,miopenConvolutionFwdAlgoDirect;miopenConvolutionFwdAlgoWinograd:ConvBinWinogradRxSf3x2,8,20571,0,miopenConvolutionFwdAlgoWinograd;miopenConvolutionFwdAlgoImplicitGEMM:ConvHipImplicitGemmV4R4Fwd,8,2631,0,miopenConvolutionFwdAlgoImplicitGEMM;miopenConvolutionFwdAlgoGEMM:GemmFwd1x1_0_1,11,4687,0,MIOpenGEMM
128-128-128-1x1-512-128-128-2-0x0-1x1-1x1-0-NCHW-FP32-W=miopenConvolutionBwdWeightsAlgoGEMM:gemm,171,646,0,MIOpenGEMM
6-128-128-1x1-512-128-128-2-0x0-1x1-1x1-0-NCHW-FP32-B=miopenConvolutionBwdDataAlgoDirect:ConvOclDirectFwd1x1,27,8441,0,miopenConvolutionBwdDataAlgoDirect;miopenConvolutionBwdDataAlgoGEMM:gemm,49,5443,0,MIOpenGEMM;miopenConvolutionBwdDataAlgoWinograd:ConvBinWinogradRxSf2x3,64,7757,0,miopenConvolutionBwdDataAlgoWinograd
512-128-128-3x3-256-128-128-2-1x1-1x1-1x1-0-NCHW-FP32-B=miopenConvolutionBwdDataAlgoWinograd:ConvBinWinograd3x3U,63,3196,0,miopenConvolutionBwdDataAlgoWinograd
512-128-128-1x1-128-128-128-2-0x0-1x1-1x1-0-NCHW-FP32-W=miopenConvolutionBwdWeightsAlgoDirect:ConvAsmBwdWrW1x1,11,5363,0,miopenConvolutionBwdWeightsAlgoDirect
3-1030-1030-7x7-64-512-512-2-0x0-2x2-1x1-0-NCHW-FP32-F=miopenConvolutionFwdAlgoWinograd:ConvBinWinogradRxSf2x3,4,74636,0,miopenConvolutionFwdAlgoWinograd;miopenConvolutionFwdAlgoDirect:ConvOclDirectFwdGen,8,7024,0,miopenConvolutionFwdAlgoDirect;miopenConvolutionFwdAlgoGEMM:GemmFwdRest,31,7905,154140672,MIOpenGEMM
32-147-147-3x3-32-149-149-64-0x0-1x1-1x1-0-NCHW-FP32-B=miopenConvolutionBwdDataAlgoWinograd:ConvBinWinogradRxS,6,10205,0,miopenConvolutionBwdDataAlgoWinograd;miopenConvolutionBwdDataAlgoDirect:ConvOclDirectFwd,110,307,0,miopenConvolutionBwdDataAlgoDirect;miopenConvolutionBwdDataAlgoImplicitGEMM:ConvHipImplicitGemmBwdDataV1R1,329,12,0,miopenConvolutionBwdDataAlgoImplicitGEMM;miopenConvolutionBwdDataAlgoGEMM:gemm,1153,21,24893568,MIOpenGEMM
1024-64-64-1x1-256-64-64-2-0x0-1x1-1x1-0-NCHW-FP32-F=miopenConvolutionFwdAlgoWinograd:ConvBinWinogradRxSf3x2,3,99177,0,miopenConvolutionFwdAlgoWinograd;miopenConvolutionFwdAlgoImplicitGEMM:ConvHipImplicitGemmV4R4Fwd,4,32292,0,miopenConvolutionFwdAlgoImplicitGEMM;miopenConvolutionFwdAlgoDirect:ConvOclDirectFwd1x1,4,53551,0,miopenConvolutionFwdAlgoDirect;miopenConvolutionFwdAlgoGEMM:GemmFwd1x1_0_1,11,9784,0,MIOpenGEMM
256-128-128-3x3-512-128-128-2-1x1-1x1-1x1-0-NCHW-FP32-F=miopenConvolutionFwdAlgoWinograd:ConvBinWinogradRxS,38,641,0,miopenConvolutionFwdAlgoWinograd
512-32-32-3x3-256-32-32-2-1x1-1x1-1x1-0-NCHW-FP32-W=miopenConvolutionBwdWeightsAlgoDirect:ConvOclBwdWrW53,2,62788,0,miopenConvolutionBwdWeightsAlgoDirect;miopenConvolutionBwdWeightsAlgoWinograd:ConvBinWinogradRxS,8,1479,0,miopenConvolutionBwdWeightsAlgoWinograd;miopenConvolutionBwdWeightsAlgoImplicitGEMM:ConvHipImplicitGemmV4R1WrW,15,1783,0,miopenConvolutionBwdWeightsAlgoImplicitGEMM;miopenConvolutionBwdWeightsAlgoGEMM:gemm,35,146,9437184,MIOpenGEMM
512-128-128-1x1-6-128-128-2-0x0-1x1-1x1-0-NCHW-FP32-F=miopenConvolutionFwdAlgoDirect:ConvOclDirectFwd1x1,4,9537,0,miopenConvolutionFwdAlgoDirect;miopenConvolutionFwdAlgoWinograd:ConvBinWinogradRxSf3x2,5,67054,0,miopenConvolutionFwdAlgoWinograd;miopenConvolutionFwdAlgoGEMM:GemmFwd1x1_0_1,39,9795,0,MIOpenGEMM
128-128-128-1x1-512-128-128-2-0x0-1x1-1x1-0-NCHW-FP32-B=miopenConvolutionBwdDataAlgoWinograd:ConvBinWinogradRxSf3x2,3,15618,0,miopenConvolutionBwdDataAlgoWinograd;miopenConvolutionBwdDataAlgoDirect:ConvOclDirectFwd1x1,7,66142,0,miopenConvolutionBwdDataAlgoDirect;miopenConvolutionBwdDataAlgoImplicitGEMM:ConvHipImplicitGemmBwdDataV1R1,10,794,0,miopenConvolutionBwdDataAlgoImplicitGEMM;miopenConvolutionBwdDataAlgoGEMM:gemm,15,3788,0,MIOpenGEMM
512-32-32-3x3-256-32-32-2-1x1-1x1-1x1-0-NCHW-FP32-B=miopenConvolutionBwdDataAlgoWinograd:ConvBinWinogradRxS,6,85815,0,miopenConvolutionBwdDataAlgoWinograd
512-128-128-1x1-128-128-128-2-0x0-1x1-1x1-0-NCHW-FP32-B=miopenConvolutionBwdDataAlgoDirect:ConvOclDirectFwd1x1,4,75357,0,miopenConvolutionBwdDataAlgoDirect;miopenConvolutionBwdDataAlgoWinograd:ConvBinWinogradRxSf3x2,6,3299,0,miopenConvolutionBwdDataAlgoWinograd;miopenConvolutionBwdDataAlgoGEMM:gemm,8,5012,0,MIOpenGEMM;miopenConvolutionBwdDataAlgoImplicitGEMM:ConvHipImplicitGemmBwdDataV1R1,9,25035,0,miopenConvolutionBwdDataAlgoImplicitGEMM
256-32-32-3x3-512-32-32-2-1x1-1x1-1x1-0-NCHW-FP32-F=miopenConvolutionFwdAlgoWinograd:ConvBinWinogradRxSf2x3,18,85,0,miopenConvolutionFwdAlgoWinograd
256-64-64-1x1-512-128-128-2-0x0-2x2-1x1-0-NCHW-FP32-W=miopenConvolutionBwdWeightsAlgoDirect:ConvOclBwdWrW1x1,11,1238,16777216,miopenConvolutionBwdWeightsAlgoDirect;miopenConvolutionBwdWeightsAlgoImplicitGEMM:ConvHipImplicitGemmV4R1WrW,19,923,0,miopenConvolutionBwdWeightsAlgoImplicitGEMM;miopenConvolutionBwdWeightsAlgoGEMM:gemm,26,4519,8388608,MIOpenGEMM
512-128-128-1x1-128-128-128-2-0x0-1x1-1x1-0-NCHW-FP32-F=miopenConvolutionFwdAlgoWinograd:ConvBinWinogradRxS,30,9624,0,miopenConvolutionFwdAlgoWinograd;miopenConvolutionFwdAlgoDirect:ConvOclDirectFwd1x1,35,4412,0,miopenConvolutionFwdAlgoDirect;miopenConvolutionFwdAlgoImplicitGEMM:ConvHipImplicitGemmV4R4Fwd,41,8855,0,miopenConvolutionFwdAlgoImplicitGEMM;miopenConvolutionFwdAlgoGEMM:GemmFwd1x1_0_1,49,595,0,MIOpenGEMM
256-128-128-3x3-256-128-128-2-1x1-1x1-1x1-0-NCHW-FP32-W=miopenConvolutionBwdWeightsAlgoWinograd:ConvBinWinogradRxSf2x3,77,5805,0,miopenConvolutionBwdWeightsAlgoWinograd;miopenConvolutionBwdWeightsAlgoDirect:ConvOclBwdWrW53,90,6557,0,miopenConvolutionBwdWeightsAlgoDirect;miopenConvolutionBwdWeightsAlgoGEMM:gemm,116,673,150994944,MIOpenGEMM;miopenConvolutionBwdWeightsAlgoImplicitGEMM:ConvHipImplicitGemmV4R1WrW,120,565,0,miopenConvolutionBwdWeightsAlgoImplicitGEMM
256-256-256-1x1-256-256-256-2-0x0-1x1-1x1-0-NCHW-FP32-W=miopenConvolutionBwdWeightsAlgoGEMM:gemm,63,386,0,MIOpenGEMM
128-128-128-1x1-512-128-128-2-0x0-1x1-1x1-0-NCHW-FP32-F=miopenConvolutionFwdAlgoImplicitGEMM:ConvHipImplicitGemmV4R4Fwd,2,41464,0,miopenConvolutionFwdAlgoImplicitGEMM;miopenConvolutionFwdAlgoWinograd:ConvBinWinogradRxSf3x2,3,14506,0,miopenConvolutionFwdAlgoWinograd;miopenConvolutionFwdAlgoGEMM:GemmFwd1x1_0_1,3,54892,0,MIOpenGEMM;miopenConvolutionFwdAlgoDirect:ConvOclDirectFwd1x1,4,18384,0,miopenConvolutionFwdAlgoDirect
256-32-32-3x3-256-32-32-2-1x1-1x1-1x1-0-NCHW-FP32-W=miopenConvolutionBwdWeightsAlgoDirect:ConvAsmBwdWrW3x3,1,23979,0,miopenConvolutionBwdWeightsAlgoDirect;miopenConvolutionBwdWeightsAlgoWinograd:ConvBinWinogradRxSf2x3,7,19357,0,miopenConvolutionBwdWeightsAlgoWinograd;miopenConvolutionBwdWeightsAlgoImplicitGEMM:ConvHipImplicitGemmV4R1WrW,15,9574,0,miopenConvolutionBwdWeightsAlgoImplicitGEMM;miopenConvolutionBwdWeightsAlgoGEMM:gemm,29,1713,9437184,MIOpenGEMM
512-64-64-3x3-256-64-64-2-1x1-1x1-1x1-0-NCHW-FP32-W=miopenConvolutionBwdWeightsAlgoDirect:ConvAsmBwdWrW3x3,30,7699,0,miopenConvolutionBwdWeightsAlgoDirect;miopenConvolutionBwdWeightsAlgoWinograd:ConvBinWinogradRxS,61,6829,0,miopenConvolutionBwdWeightsAlgoWinograd;miopenConvolutionBwdWeightsAlgoImplicitGEMM:ConvHipImplicitGemmV4R1WrW,73,1726,0,miopenConvolutionBwdWeightsAlgoImplicitGEMM;miopenConvolutionBwdWeightsAlgoGEMM:gemm,93,2794,37748736,MIOpenGEMM
12-128-128-1x1-512-128-128-2-0x0-1x1-1x1-0-NCHW-FP32-W=miopenConvolutionBwdWeightsAlgoDirect:ConvAsmBwdWrW1x1,6,36783,0,miopenConvolutionBwdWeightsAlgoDirect;miopenConvolutionBwdWeightsAlgoGEMM:gemm,6,94769,0,MIOpenGEMM;miopenConvolutionBwdWeightsAlgoWinograd:ConvBinWinogradRxSf2x3,18,597,0,miopenConvolutionBwdWeightsAlgoWinograd
256-64-64-1x1-512-128-128-2-0x0-2x2-1x1-0-NCHW-FP32-B=miopenConvolutionBwdDataAlgoDirect:ConvOclDirectFwd1x1,5,82169,0,miopenConvolutionBwdDataAlgoDirect;miopenConvolutionBwdDataAlgoImplicitGEMM:ConvHipImplicitGemmBwdDataV1R1,26,9028,0,miopenConvolutionBwdDataAlgoImplicitGEMM;miopenConvolutionBwdDataAlgoGEMM:gemm,38,1826,25165824,MIOpenGEMM;miopenConvolutionBwdDataAlgoWinograd:ConvBinWinogradRxSf2x3,44,7539,0,miopenConvolutionBwdDataAlgoWinograd
256-128-128-3x3-256-128-128-2-1x1-1x1-1x1-0-NCHW-FP32-B=miopenConvolutionBwdDataAlgoWinograd:ConvBinWinograd3x3U,5,19807,0,miopenConvolutionBwdDataAlgoWinograd
256-32-32-3x3-256-32-32-2-1x1-1x1-1x1-0-NCHW-FP32-B=miopenConvolutionBwdDataAlgoWinograd:ConvBinWinogradRxS,0,393642,0,miopenConvolutionBwdDataAlgoWinograd
512-64-64-3x3-256-64-64-2-1x1-1x1-1x1-0-NCHW-FP32-B=miopenConvolutionBwdDataAlgoWinograd:ConvBinWinogradRxS,1,98908,0,miopenConvolutionBwdDataAlgoWinograd
12-128-128-1x1-512-128-128-2-0x0-1x1-1x1-0-NCHW-FP32-B=miopenConvolutionBwdDataAlgoDirect:ConvOclDirectFwd1x1,3,70792,0,miopenConvolutionBwdDataAlgoDirect;miopenConvolutionBwdDataAlgoGEMM:gemm,3,75842,0,MIOpenGEMM;miopenConvolutionBwdDataAlgoImplicitGEMM:ConvHipImplicitGemmBwdDataV1R1,10,4871,0,miopenConvolutionBwdDataAlgoImplicitGEMM;miopenConvolutionBwdDataAlgoWinograd:ConvBinWinogradRxSf2x3,16,2823,0,miopenConvolutionBwdDataAlgoWinograd
256-128-128-3x3-256-128-128-2-1x1-1x1-1x1-0-NCHW-FP32-F=miopenConvolutionFwdAlgoWinograd:ConvBinWinograd3x3U,8,20773,0,miopenConvolutionFwdAlgoWinograd
256-32-32-3x3-256-32-32-2-1x1-1x1-1x1-0-NCHW-FP32-F=miopenConvolutionFwdAlgoWinograd:ConvBinWinogradRxSf2x3,0,922556,0,miopenConvolutionFwdAlgoWinograd
512-128-128-1x1-256-64-64-2-0x0-2x2-1x1-0-NCHW-FP32-F=miopenConvolutionFwdAlgoImplicitGEMM:ConvHipImplicitGemmV4R4Fwd,4,91157,0,miopenConvolutionFwdAlgoImplicitGEMM;miopenConvolutionFwdAlgoDirect:ConvOclDirectFwd1x1,10,1888,0,miopenConvolutionFwdAlgoDirect;miopenConvolutionFwdAlgoGEMM:GemmFwd1x1_0_2,20,4576,25165824,MIOpenGEMM;miopenConvolutionFwdAlgoWinograd:ConvBinWinogradRxSf2x3,20,8873,0,miopenConvolutionFwdAlgoWinograd
64-73-73-1x7-64-73-73-64-0x3-1x1-1x1-0-NCHW-FP32-W=miopenConvolutionBwdWeightsAlgoWinograd:ConvBinWinogradRxSf2x3,132,957,0,miopenConvolutionBwdWeightsAlgoWinograd;miopenConvolutionBwdWeightsAlgoDirect:ConvOclBwdWrW53,213,113,7340032,miopenConvolutionBwdWeightsAlgoDirect;miopenConvolutionBwdWeightsAlgoGEMM:gemm,408,283,9549568,MIOpenGEMM;miopenConvolutionBwdWeightsAlgoImplicitGEMM:ConvHipImplicitGemmV4R1WrW,462,21,0,miopenConvolutionBwdWeightsAlgoImplicitGEMM
256-64-64-3x3-512-64-64-2-1x1-1x1-1x1-0-NCHW-FP32-F=miopenConvolutionFwdAlgoWinograd:ConvBinWinograd3x3U,4,26238,0,miopenConvolutionFwdAlgoWinograd
128-128-128-3x3-128-128-128-2-1x1-1x1-1x1-0-NCHW-FP32-W=miopenConvolutionBwdWeightsAlgoDirect:ConvAsmBwdWrW3x3,4,62693,0,miopenConvolutionBwdWeightsAlgoDirect;miopenConvolutionBwdWeightsAlgoWinograd:ConvBinWinogradRxSf2x3,22,3637,0,miopenConvolutionBwdWeightsAlgoWinograd;miopenConvolutionBwdWeightsAlgoGEMM:gemm,34,1738,75497472,MIOpenGEMM;miopenConvolutionBwdWeightsAlgoImplicitGEMM:ConvHipImplicitGemmV4R1WrW,51,2029,0,miopenConvolutionBwdWeightsAlgoImplicitGEMM
256-256-256-1x1-256-256-256-2-0x0-1x1-1x1-0-NCHW-FP32-B=miopenConvolutionBwdDataAlgoGEMM:gemm,17,8396,0,MIOpenGEMM;miopenConvolutionBwdDataAlgoImplicitGEMM:ConvHipImplicitGemmBwdDataV1R1,23,2068,0,miopenConvolutionBwdDataAlgoImplicitGEMM;miopenConvolutionBwdDataAlgoDirect:ConvOclDirectFwd1x1,24,4478,0,miopenConvolutionBwdDataAlgoDirect;miopenConvolutionBwdDataAlgoWinograd:ConvBinWinogradRxSf3x2,44,8847,0,miopenConvolutionBwdDataAlgoWinograd
512-128-128-1x1-12-128-128-2-0x0-1x1-1x1-0-NCHW-FP32-F=miopenConvolutionFwdAlgoWinograd:ConvBinWinogradRxS,2,62491,0,miopenConvolutionFwdAlgoWinograd;miopenConvolutionFwdAlgoDirect:ConvOclDirectFwd1x1,3,11364,0,miopenConvolutionFwdAlgoDirect;miopenConvolutionFwdAlgoGEMM:GemmFwd1x1_0_1,8,7548,0,MIOpenGEMM
128-128-128-3x3-128-128-128-2-1x1-1x1-1x1-0-NCHW-FP32-B=miopenConvolutionBwdDataAlgoWinograd:ConvBinWinogradRxSf3x2,3,938,0,miopenConvolutionBwdDataAlgoWinograd
256-64-64-3x3-256-64-64-2-1x1-1x1-1x1-0-NCHW-FP32-W=miopenConvolutionBwdWeightsAlgoDirect:ConvAsmBwdWrW3x3,7,99446,0,miopenConvolutionBwdWeightsAlgoDirect;miopenConvolutionBwdWeightsAlgoWinograd:ConvBinWinogradRxSf2x3,28,596,0,miopenConvolutionBwdWeightsAlgoWinograd;miopenConvolutionBwdWeightsAlgoImplicitGEMM:ConvHipImplicitGemmV4R1WrW,34,503,0,miopenConvolutionBwdWeightsAlgoImplicitGEMM;miopenConvolutionBwdWeightsAlgoGEMM:gemm,58,586,37748736,MIOpenGEMM
1024-64-64-1x1-512-128-128-2-0x0-2x2-1x1-0-NCHW-FP32-W=miopenConvolutionBwdWeightsAlgoDirect:ConvAsmBwdWrW1x1,27,452,16777216,miopenConvolutionBwdWeightsAlgoDirect;miopenConvolutionBwdWeightsAlgoImplicitGEMM:ConvHipImplicitGemmV4R1WrW,45,622,0,miopenConvolutionBwdWeightsAlgoImplicitGEMM;miopenConvolutionBwdWeightsAlgoGEMM:gemm,45,8049,8388608,MIOpenGEMM
128-128-128-3x3-128-128-128-2-1x1-1x1-1x1-0-NCHW-FP32-F=miopenConvolutionFwdAlgoWinograd:ConvBinWinograd3x3U,36,4114,0,miopenConvolutionFwdAlgoWinograd
256-64-64-3x3-256-64-64-2-1x1-1x1-1x1-0-NCHW-FP32-B=miopenConvolutionBwdDataAlgoWinograd:ConvBinWinogradRxS,1,9503,0,miopenConvolutionBwdDataAlgoWinograd
512-32-32-1x1-2048-32-32-2-0x0-1x1-1x1-0-NCHW-FP32-W=miopenConvolutionBwdWeightsAlgoDirect:ConvAsmBwdWrW1x1,3,22709,0,miopenConvolutionBwdWeightsAlgoDirect;miopenConvolutionBwdWeightsAlgoGEMM:gemm,13,57,0,MIOpenGEMM;miopenConvolutionBwdWeightsAlgoWinograd:ConvBinWinogradRxSf2x3,38,2746,0,miopenConvolutionBwdWeightsAlgoWinograd
256-128-128-1x1-512-128-128-2-0x0-1x1-1x1-0-NCHW-FP32-W=miopenConvolutionBwdWeightsAlgoDirect:ConvAsmBwdWrW1x1,19,119,0,miopenConvolutionBwdWeightsAlgoDirect;miopenConvolutionBwdWeightsAlgoWinograd:ConvBinWinogradRxSf2x3,91,2693,0,miopenConvolutionBwdWeightsAlgoWinograd
256-64-64-3x3-256-64-64-2-1x1-1x1-1x1-0-NCHW-FP32-F=miopenConvolutionFwdAlgoWinograd:ConvBinWinogradRxS,1,4768,0,miopenConvolutionFwdAlgoWinograd
512-32-32-1x1-1024-64-64-2-0x0-2x2-1x1-0-NCHW-FP32-W=miopenConvolutionBwdWeightsAlgoDirect:ConvAsmBwdWrW1x1,8,47841,8388608,miopenConvolutionBwdWeightsAlgoDirect;miopenConvolutionBwdWeightsAlgoGEMM:gemm,25,7735,4194304,MIOpenGEMM;miopenConvolutionBwdWeightsAlgoImplicitGEMM:ConvHipImplicitGemmV4R1WrW,58,9162,0,miopenConvolutionBwdWeightsAlgoImplicitGEMM
1024-64-64-1x1-512-128-128-2-0x0-2x2-1x1-0-NCHW-FP32-B=miopenConvolutionBwdDataAlgoDirect:ConvOclDirectFwd1x1,18,1994,0,miopenConvolutionBwdDataAlgoDirect;miopenConvolutionBwdDataAlgoImplicitGEMM:ConvHipImplicitGemmBwdDataV1R1,21,709,0,miopenConvolutionBwdDataAlgoImplicitGEMM;miopenConvolutionBwdDataAlgoGEMM:gemm,38,1413,50331648,MIOpenGEMM;miopenConvolutionBwdDataAlgoWinograd:ConvBinWinogradRxSf2x3,183,892,0,miopenConvolutionBwdDataAlgoWinograd
256-256-256-1x1-256-256-256-2-0x0-1x1-1x1-0-NCHW-FP32-F=miopenConvolutionFwdAlgoImplicitGEMM:ConvHipImplicitGemmV4R4Fwd,30,6951,0,miopenConvolutionFwdAlgoImplicitGEMM;miopenConvolutionFwdAlgoDirect:ConvOclDirectFwd1x1,30,8374,0,miopenConvolutionFwdAlgoDirect;miopenConvolutionFwdAlgoGEMM:GemmFwd1x1_0_1,46,6292,0,MIOpenGEMM;miopenConvolutionFwdAlgoWinograd:ConvBinWinogradRxSf3x2,57,5166,0,miopenConvolutionFwdAlgoWinograd
6-32-32-1x1-512-32-32-2-0x0-1x1-1x1-0-NCHW-FP32-B=miopenConvolutionBwdDataAlgoDirect:ConvAsm1x1U,0,624546,0,miopenConvolutionBwdDataAlgoDirect;miopenConvolutionBwdDataAlgoGEMM:gemm,59,8793,0,MIOpenGEMM;miopenConvolutionBwdDataAlgoWinograd:ConvBinWinogradRxSf2x3,64,4187,0,miopenConvolutionBwdDataAlgoWinograd
512-32-32-1x1-12-32-32-2-0x0-1x1-1x1-0-NCHW-FP32-F=miopenConvolutionFwdAlgoDirect:ConvOclDirectFwd1x1,0,121478,0,miopenConvolutionFwdAlgoDirect;miopenConvolutionFwdAlgoWinograd:ConvBinWinogradRxSf2x3,0,148741,0,miopenConvolutionFwdAlgoWinograd;miopenConvolutionFwdAlgoGEMM:GemmFwd1x1_0_1,0,591513,0,MIOpenGEMM
512-32-32-1x1-1024-64-64-2-0x0-2x2-1x1-0-NCHW-FP32-B=miopenConvolutionBwdDataAlgoDirect:ConvOclDirectFwd1x1,8,1918,0,miopenConvolutionBwdDataAlgoDirect;miopenConvolutionBwdDataAlgoImplicitGEMM:ConvHipImplicitGemmBwdDataV1R1,17,6876,0,miopenConvolutionBwdDataAlgoImplicitGEMM;miopenConvolutionBwdDataAlgoWinograd:ConvBinWinogradRxSf2x3,46,6552,0,miopenConvolutionBwdDataAlgoWinograd;miopenConvolutionBwdDataAlgoGEMM:gemm,89,6493,12582912,MIOpenGEMM
512-32-32-1x1-2048-32-32-2-0x0-1x1-1x1-0-NCHW-FP32-B=miopenConvolutionBwdDataAlgoDirect:ConvAsm1x1U,2,795,0,miopenConvolutionBwdDataAlgoDirect;miopenConvolutionBwdDataAlgoWinograd:ConvBinWinogradRxSf3x2,3,97957,0,miopenConvolutionBwdDataAlgoWinograd;miopenConvolutionBwdDataAlgoImplicitGEMM:ConvHipImplicitGemmBwdDataV1R1,12,355,0,miopenConvolutionBwdDataAlgoImplicitGEMM;miopenConvolutionBwdDataAlgoGEMM:gemm,14,5845,0,MIOpenGEMM
64-256-256-1x1-256-256-256-2-0x0-1x1-1x1-0-NCHW-FP32-W=miopenConvolutionBwdWeightsAlgoDirect:ConvOclBwdWrW1x1,34,6094,0,miopenConvolutionBwdWeightsAlgoDirect
128-128-128-1x1-256-256-256-2-0x0-2x2-1x1-0-NCHW-FP32-W=miopenConvolutionBwdWeightsAlgoDirect:ConvOclBwdWrW1x1,12,4921,33554432,miopenConvolutionBwdWeightsAlgoDirect;miopenConvolutionBwdWeightsAlgoGEMM:gemm,35,242,16777216,MIOpenGEMM;miopenConvolutionBwdWeightsAlgoImplicitGEMM:ConvHipImplicitGemmV4R1WrW,58,8486,0,miopenConvolutionBwdWeightsAlgoImplicitGEMM
512-32-32-1x1-6-32-32-2-0x0-1x1-1x1-0-NCHW-FP32-F=miopenConvolutionFwdAlgoWinograd:ConvBinWinogradRxS,0,263967,0,miopenConvolutionFwdAlgoWinograd;miopenConvolutionFwdAlgoDirect:ConvAsm1x1U,0,897993,0,miopenConvolutionFwdAlgoDirect;miopenConvolutionFwdAlgoGEMM:GemmFwd1x1_0_1,49,6573,0,MIOpenGEMM
6-256-256-1x1-512-256-256-2-0x0-1x1-1x1-0-NCHW-FP32-W=miopenConvolutionBwdWeightsAlgoGEMM:gemm,60,4965,0,MIOpenGEMM;miopenConvolutionBwdWeightsAlgoWinograd:ConvBinWinogradRxSf2x3,107,47,0,miopenConvolutionBwdWeightsAlgoWinograd;miopenConvolutionBwdWeightsAlgoDirect:ConvOclBwdWrW53,107,495,24576,miopenConvolutionBwdWeightsAlgoDirect
256-256-256-1x1-64-256-256-2-0x0-1x1-1x1-0-NCHW-FP32-W=miopenConvolutionBwdWeightsAlgoDirect:ConvOclBwdWrW1x1,22,2342,0,miopenConvolutionBwdWeightsAlgoDirect
2048-32-32-1x1-512-32-32-2-0x0-1x1-1x1-0-NCHW-FP32-F=miopenConvolutionFwdAlgoDirect:ConvAsm1x1U,11,8444,0,miopenConvolutionFwdAlgoDirect;miopenConvolutionFwdAlgoImplicitGEMM:ConvHipImplicitGemmV4R4Fwd,13,6354,0,miopenConvolutionFwdAlgoImplicitGEMM;miopenConvolutionFwdAlgoWinograd:ConvBinWinogradRxSf3x2,18,4817,0,miopenConvolutionFwdAlgoWinograd;miopenConvolutionFwdAlgoGEMM:GemmFwd1x1_0_1,38,7177,0,MIOpenGEMM
256-14-14-3x3-256-14-14-400-1x1-1x1-1x1-0-NCHW-FP32-F=miopenConvolutionFwdAlgoWinograd:ConvBinWinogradRxSf3x2,87,9669,0,miopenConvolutionFwdAlgoWinograd
128-128-128-1x1-256-256-256-2-0x0-2x2-1x1-0-NCHW-FP32-B=miopenConvolutionBwdDataAlgoDirect:ConvOclDirectFwd1x1,14,2941,0,miopenConvolutionBwdDataAlgoDirect;miopenConvolutionBwdDataAlgoImplicitGEMM:ConvHipImplicitGemmBwdDataV1R1,25,444,0,miopenConvolutionBwdDataAlgoImplicitGEMM;miopenConvolutionBwdDataAlgoGEMM:gemm,40,7728,50331648,MIOpenGEMM;miopenConvolutionBwdDataAlgoWinograd:ConvBinWinogradRxSf2x3,50,7995,0,miopenConvolutionBwdDataAlgoWinograd
128-112-112-3x3-128-112-112-128-1x1-1x1-1x1-0-NCHW-FP32-F=miopenConvolutionFwdAlgoWinograd:ConvBinWinogradRxSf2x3,1176,53,0,miopenConvolutionFwdAlgoWinograd
6-256-256-1x1-512-256-256-2-0x0-1x1-1x1-0-NCHW-FP32-B=miopenConvolutionBwdDataAlgoDirect:ConvOclDirectFwd1x1,10,872,0,miopenConvolutionBwdDataAlgoDirect;miopenConvolutionBwdDataAlgoWinograd:ConvBinWinogradRxSf2x3,19,9415,0,miopenConvolutionBwdDataAlgoWinograd;miopenConvolutionBwdDataAlgoGEMM:gemm,31,5736,0,MIOpenGEMM
512-256-256-3x3-256-256-256-2-1x1-1x1-1x1-0-NCHW-FP32-W=miopenConvolutionBwdWeightsAlgoWinograd:ConvBinWinogradRxS,516,369,0,miopenConvolutionBwdWeightsAlgoWinograd;miopenConvolutionBwdWeightsAlgoImplicitGEMM:ConvHipImplicitGemmV4R1WrW,525,58,0,miopenConvolutionBwdWeightsAlgoImplicitGEMM;miopenConvolutionBwdWeightsAlgoGEMM:gemm,688,272,603979776,MIOpenGEMM;miopenConvolutionBwdWeightsAlgoDirect:ConvOclBwdWrW53,1041,79,0,miopenConvolutionBwdWeightsAlgoDirect
512-32-32-3x3-512-32-32-2-1x1-1x1-1x1-0-NCHW-FP32-W=miopenConvolutionBwdWeightsAlgoDirect:ConvOclBwdWrW53,3,10171,0,miopenConvolutionBwdWeightsAlgoDirect;miopenConvolutionBwdWeightsAlgoWinograd:ConvBinWinogradRxS,15,6938,0,miopenConvolutionBwdWeightsAlgoWinograd;miopenConvolutionBwdWeightsAlgoImplicitGEMM:ConvHipImplicitGemmV4R1WrW,18,6378,0,miopenConvolutionBwdWeightsAlgoImplicitGEMM;miopenConvolutionBwdWeightsAlgoGEMM:gemm,63,2712,18874368,MIOpenGEMM
256-256-256-1x1-64-256-256-2-0x0-1x1-1x1-0-NCHW-FP32-B=miopenConvolutionBwdDataAlgoWinograd:ConvBinWinogradRxSf3x2,2,24159,0,miopenConvolutionBwdDataAlgoWinograd;miopenConvolutionBwdDataAlgoDirect:ConvOclDirectFwd1x1,5,4203,0,miopenConvolutionBwdDataAlgoDirect;miopenConvolutionBwdDataAlgoImplicitGEMM:ConvHipImplicitGemmBwdDataV1R1,12,5862,0,miopenConvolutionBwdDataAlgoImplicitGEMM;miopenConvolutionBwdDataAlgoGEMM:gemm,24,1414,0,MIOpenGEMM
256-32-32-1x1-2048-32-32-2-0x0-1x1-1x1-0-NCHW-FP32-W=miopenConvolutionBwdWeightsAlgoDirect:ConvAsmBwdWrW1x1,1,8802,0,miopenConvolutionBwdWeightsAlgoDirect;miopenConvolutionBwdWeightsAlgoWinograd:ConvBinWinogradRxSf2x3,35,9061,0,miopenConvolutionBwdWeightsAlgoWinograd
512-32-32-3x3-512-32-32-2-1x1-1x1-1x1-0-NCHW-FP32-B=miopenConvolutionBwdDataAlgoWinograd:ConvBinWinogradRxS,1,87833,0,miopenConvolutionBwdDataAlgoWinograd
512-32-32-3x3-512-32-32-2-1x1-1x1-1x1-0-NCHW-FP32-F=miopenConvolutionFwdAlgoWinograd:ConvBinWinogradRxS,1,76431,0,miopenConvolutionFwdAlgoWinograd
256-256-256-1x1-128-128-128-2-0x0-2x2-1x1-0-NCHW-FP32-F=miopenConvolutionFwdAlgoDirect:ConvOclDirectFwd1x1,8,82175,0,miopenConvolutionFwdAlgoDirect;miopenConvolutionFwdAlgoImplicitGEMM:ConvHipImplicitGemmV4R4Fwd,12,5671,0,miopenConvolutionFwdAlgoImplicitGEMM;miopenConvolutionFwdAlgoGEMM:GemmFwd1x1_0_2,25,6677,50331648,MIOpenGEMM;miopenConvolutionFwdAlgoWinograd:ConvBinWinogradRxSf2x3,33,77,0,miopenConvolutionFwdAlgoWinograd
64-256-256-1x1-256-256-256-2-0x0-1x1-1x1-0-NCHW-FP32-F=miopenConvolutionFwdAlgoWinograd:ConvBinWinogradRxSf3x2,7,49225,0,miopenConvolutionFwdAlgoWinograd;miopenConvolutionFwdAlgoDirect:ConvOclDirectFwd1x1,16,1067,0,miopenConvolutionFwdAlgoDirect;miopenConvolutionFwdAlgoImplicitGEMM:ConvHipImplicitGemmV4R4Fwd,24,1198,0,miopenConvolutionFwdAlgoImplicitGEMM;miopenConvolutionFwdAlgoGEMM:GemmFwd1x1_0_1,83,4884,0,MIOpenGEMM
512-256-256-1x1-6-256-256-2-0x0-1x1-1x1-0-NCHW-FP32-F=miopenConvolutionFwdAlgoWinograd:ConvBinWinogradRxSf3x2,2,75732,0,miopenConvolutionFwdAlgoWinograd;miopenConvolutionFwdAlgoDirect:ConvOclDirectFwd1x1,4,8345,0,miopenConvolutionFwdAlgoDirect;miopenConvolutionFwdAlgoGEMM:GemmFwd1x1_0_1,61,6468,0,MIOpenGEMM
6-64-64-1x1-512-64-64-2-0x0-1x1-1x1-0-NCHW-FP32-W=miopenConvolutionBwdWeightsAlgoDirect:ConvOclBwdWrW53,0,837389,24576,miopenConvolutionBwdWeightsAlgoDirect;miopenConvolutionBwdWeightsAlgoWinograd:ConvBinWinogradRxSf2x3,1,66291,0,miopenConvolutionBwdWeightsAlgoWinograd;miopenConvolutionBwdWeightsAlgoGEMM:gemm,19,8299,0,MIOpenGEMM
512-16-16-3x3-256-16-16-2-1x1-1x1-1x1-0-NCHW-FP32-W=miopenConvolutionBwdWeightsAlgoDirect:ConvOclBwdWrW53,1,21769,0,miopenConvolutionBwdWeightsAlgoDirect;miopenConvolutionBwdWeightsAlgoWinograd:ConvBinWinogradRxS,15,5945,0,miopenConvolutionBwdWeightsAlgoWinograd;miopenConvolutionBwdWeightsAlgoImplicitGEMM:ConvHipImplicitGemmV4R1WrW,21,9794,0,miopenConvolutionBwdWeightsAlgoImplicitGEMM;miopenConvolutionBwdWeightsAlgoGEMM:gemm,40,7715,2359296,MIOpenGEMM
512-16-16-3x3-256-16-16-2-1x1-1x1-1x1-0-NCHW-FP32-B=miopenConvolutionBwdDataAlgoWinograd:ConvBinWinograd3x3U,2,8712,0,miopenConvolutionBwdDataAlgoWinograd
12-256-256-1x1-512-256-256-2-0x0-1x1-1x1-0-NCHW-FP32-W=miopenConvolutionBwdWeightsAlgoGEMM:gemm,95,832,0,MIOpenGEMM;miopenConvolutionBwdWeightsAlgoWinograd:ConvBinWinogradRxSf2x3,249,732,0,miopenConvolutionBwdWeightsAlgoWinograd;miopenConvolutionBwdWeightsAlgoDirect:ConvOclBwdWrW53,943,681,49152,miopenConvolutionBwdWeightsAlgoDirect
6-64-64-1x1-512-64-64-2-0x0-1x1-1x1-0-NCHW-FP32-B=miopenConvolutionBwdDataAlgoDirect:ConvAsm1x1U,0,161758,0,miopenConvolutionBwdDataAlgoDirect;miopenConvolutionBwdDataAlgoGEMM:gemm,10,8626,0,MIOpenGEMM;miopenConvolutionBwdDataAlgoWinograd:ConvBinWinogradRxSf2x3,13,745,0,miopenConvolutionBwdDataAlgoWinograd
2048-32-32-1x1-512-32-32-2-0x0-1x1-1x1-0-NCHW-FP32-W=miopenConvolutionBwdWeightsAlgoGEMM:gemm,1,15061,0,MIOpenGEMM
256-16-16-3x3-512-16-16-2-1x1-1x1-1x1-0-NCHW-FP32-F=miopenConvolutionFwdAlgoWinograd:ConvBinWinogradRxSf2x3,10,9675,0,miopenConvolutionFwdAlgoWinograd
512-256-256-3x3-256-256-256-2-1x1-1x1-1x1-0-NCHW-FP32-B=miopenConvolutionBwdDataAlgoWinograd:ConvBinWinogradRxS,153,785,0,miopenConvolutionBwdDataAlgoWinograd
12-256-256-1x1-512-256-256-2-0x0-1x1-1x1-0-NCHW-FP32-B=miopenConvolutionBwdDataAlgoDirect:ConvOclDirectFwd1x1,15,734,0,miopenConvolutionBwdDataAlgoDirect;miopenConvolutionBwdDataAlgoImplicitGEMM:ConvHipImplicitGemmBwdDataV1R1,28,636,0,miopenConvolutionBwdDataAlgoImplicitGEMM;miopenConvolutionBwdDataAlgoGEMM:gemm,29,4691,0,MIOpenGEMM;miopenConvolutionBwdDataAlgoWinograd:ConvBinWinogradRxSf2x3,40,2,0,miopenConvolutionBwdDataAlgoWinograd
512-64-64-1x1-6-64-64-2-0x0-1x1-1x1-0-NCHW-FP32-F=miopenConvolutionFwdAlgoDirect:ConvAsm1x1U,1,52031,0,miopenConvolutionFwdAlgoDirect;miopenConvolutionFwdAlgoWinograd:ConvBinWinogradRxSf3x2,1,67416,0,miopenConvolutionFwdAlgoWinograd;miopenConvolutionFwdAlgoGEMM:GemmFwd1x1_0_1,13,9223,0,MIOpenGEMM
12-64-64-1x1-512-64-64-2-0x0-1x1-1x1-0-NCHW-FP32-W=miopenConvolutionBwdWeightsAlgoWinograd:ConvBinWinogradRxS,3,88612,0,miopenConvolutionBwdWeightsAlgoWinograd;miopenConvolutionBwdWeightsAlgoDirect:ConvAsmBwdWrW1x1,5,468,0,miopenConvolutionBwdWeightsAlgoDirect;miopenConvolutionBwdWeightsAlgoGEMM:gemm,10,4803,0,MIOpenGEMM
2048-32-32-1x1-512-32-32-2-0x0-1x1-1x1-0-NCHW-FP32-B=miopenConvolutionBwdDataAlgoDirect:ConvOclDirectFwd1x1,45,2881,0,miopenConvolutionBwdDataAlgoDirect;miopenConvolutionBwdDataAlgoWinograd:ConvBinWinogradRxSf2x3,88,9219,0,miopenConvolutionBwdDataAlgoWinograd;miopenConvolutionBwdDataAlgoImplicitGEMM:ConvHipImplicitGemmBwdDataV1R1,134,297,0,miopenConvolutionBwdDataAlgoImplicitGEMM;miopenConvolutionBwdDataAlgoGEMM:gemm,235,347,0,MIOpenGEMM
512-256-256-1x1-12-256-256-2-0x0-1x1-1x1-0-NCHW-FP32-F=miopenConvolutionFwdAlgoDirect:ConvOclDirectFwd1x1,5,4985,0,miopenConvolutionFwdAlgoDirect;miopenConvolutionFwdAlgoWinograd:ConvBinWinogradRxSf3x2,6,2708,0,miopenConvolutionFwdAlgoWinograd;miopenConvolutionFwdAlgoGEMM:GemmFwd1x1_0_1,185,655,0,MIOpenGEMM
12-64-64-1x1-512-64-64-2-0x0-1x1-1x1-0-NCHW-FP32-B=miopenConvolutionBwdDataAlgoDirect:ConvAsm1x1U,0,155906,0,miopenConvolutionBwdDataAlgoDirect;miopenConvolutionBwdDataAlgoGEMM:gemm,0,256222,0,MIOpenGEMM;miopenConvolutionBwdDataAlgoImplicitGEMM:ConvHipImplicitGemmBwdDataV1R1,0,278757,0,miopenConvolutionBwdDataAlgoImplicitGEMM;miopenConvolutionBwdDataAlgoWinograd:ConvBinWinogradRxSf2x3,0,604685,0,miopenConvolutionBwdDataAlgoWinograd
6-16-16-1x1-512-16-16-2-0x0-1x1-1x1-0-NCHW-FP32-W=miopenConvolutionBwdWeightsAlgoDirect:ConvAsmBwdWrW1x1,0,50022,0,miopenConvolutionBwdWeightsAlgoDirect;miopenConvolutionBwdWeightsAlgoWinograd:ConvBinWinogradRxSf2x3,0,657277,0,miopenConvolutionBwdWeightsAlgoWinograd;miopenConvolutionBwdWeightsAlgoGEMM:gemm,5,68658,0,MIOpenGEMM
512-32-32-1x1-2048-32-32-2-0x0-1x1-1x1-0-NCHW-FP32-F=miopenConvolutionFwdAlgoWinograd:ConvBinWinogradRxSf3x2,8,94046,0,miopenConvolutionFwdAlgoWinograd;miopenConvolutionFwdAlgoDirect:ConvAsm1x1U,14,581,0,miopenConvolutionFwdAlgoDirect;miopenConvolutionFwdAlgoImplicitGEMM:ConvHipImplicitGemmV4R4Fwd,29,706,0,miopenConvolutionFwdAlgoImplicitGEMM;miopenConvolutionFwdAlgoGEMM:GemmFwd1x1_0_1,125,194,0,MIOpenGEMM
256-256-256-3x3-512-256-256-2-1x1-1x1-1x1-0-NCHW-FP32-F=miopenConvolutionFwdAlgoWinograd:ConvBinWinogradRxSf2x3,362,606,0,miopenConvolutionFwdAlgoWinograd
512-64-64-1x1-12-64-64-2-0x0-1x1-1x1-0-NCHW-FP32-F=miopenConvolutionFwdAlgoDirect:ConvAsm1x1U,0,364712,0,miopenConvolutionFwdAlgoDirect;miopenConvolutionFwdAlgoWinograd:ConvBinWinogradRxSf3x2,2,19828,0,miopenConvolutionFwdAlgoWinograd;miopenConvolutionFwdAlgoGEMM:GemmFwd1x1_0_1,77,965,0,MIOpenGEMM
6-16-16-1x1-512-16-16-2-0x0-1x1-1x1-0-NCHW-FP32-B=miopenConvolutionBwdDataAlgoDirect:ConvAsm1x1U,0,17199,0,miopenConvolutionBwdDataAlgoDirect;miopenConvolutionBwdDataAlgoGEMM:gemm,2,91345,0,MIOpenGEMM;miopenConvolutionBwdDataAlgoWinograd:ConvBinWinogradRxSf2x3,10,9283,0,miopenConvolutionBwdDataAlgoWinograd
12-32-32-1x1-512-32-32-2-0x0-1x1-1x1-0-NCHW-FP32-W=miopenConvolutionBwdWeightsAlgoDirect:ConvAsmBwdWrW1x1,1,76936,0,miopenConvolutionBwdWeightsAlgoDirect;miopenConvolutionBwdWeightsAlgoWinograd:ConvBinWinogradRxS,2,60494,0,miopenConvolutionBwdWeightsAlgoWinograd;miopenConvolutionBwdWeightsAlgoGEMM:gemm,41,47,0,MIOpenGEMM
6-32-32-1x1-512-32-32-2-0x0-1x1-1x1-0-NCHW-FP32-W=miopenConvolutionBwdWeightsAlgoDirect:ConvAsmBwdWrW1x1,3,8222,0,miopenConvolutionBwdWeightsAlgoDirect;miopenConvolutionBwdWeightsAlgoWinograd:ConvBinWinogradRxS,11,631,0,miopenConvolutionBwdWeightsAlgoWinograd;miopenConvolutionBwdWeightsAlgoGEMM:gemm,90,6286,0,MIOpenGEMM
12-32-32-1x1-512-32-32-2-0x0-1x1-1x1-0-NCHW-FP32-B=miopenConvolutionBwdDataAlgoDirect:ConvAsm1x1U,0,425155,0,miopenConvolutionBwdDataAlgoDirect;miopenConvolutionBwdDataAlgoGEMM:gemm,1,80173,0,MIOpenGEMM;miopenConvolutionBwdDataAlgoImplicitGEMM:ConvHipImplicitGemmBwdDataV1R1,2,67302,0,miopenConvolutionBwdDataAlgoImplicitGEMM;miopenConvolutionBwdDataAlgoWinograd:ConvBinWinogradRxSf2x3,11,7634,0,miopenConvolutionBwdDataAlgoWinograd
512-16-16-1x1-6-16-16-2-0x0-1x1-1x1-0-NCHW-FP32-F=miopenConvolutionFwdAlgoDirect:ConvOclDirectFwd1x1,1,43748,0,miopenConvolutionFwdAlgoDirect;miopenConvolutionFwdAlgoWinograd:ConvBinWinogradRxSf3x2,2,21396,0,miopenConvolutionFwdAlgoWinograd;miopenConvolutionFwdAlgoGEMM:GemmFwd1x1_0_1,28,2532,0,MIOpenGEMM
512-128-128-1x1-256-256-256-2-0x0-2x2-1x1-0-NCHW-FP32-W=miopenConvolutionBwdWeightsAlgoDirect:ConvAsmBwdWrW1x1,50,3106,33554432,miopenConvolutionBwdWeightsAlgoDirect;miopenConvolutionBwdWeightsAlgoGEMM:gemm,53,494,16777216,MIOpenGEMM;miopenConvolutionBwdWeightsAlgoImplicitGEMM:ConvHipImplicitGemmV4R1WrW,232,332,0,miopenConvolutionBwdWeightsAlgoImplicitGEMM
128-28-28-3x3-128-28-28-64-1x1-1x1-1x1-0-NCHW-FP32-F=miopenConvolutionFwdAlgoWinograd:ConvBinWinogradRxS,1,61047,0,miopenConvolutionFwdAlgoWinograd
1024-1-1-7x7-256-7-7-400-0x0-1x1-1x1-0-NCHW-FP32-B=miopenConvolutionBwdDataAlgoWinograd:ConvBinWinogradRxSf3x2,1366,63,0,miopenConvolutionBwdDataAlgoWinograd;miopenConvolutionBwdDataAlgoDirect:ConvOclDirectFwd,3396,72,0,miopenConvolutionBwdDataAlgoDirect
256-28-28-3x3-256-28-28-64-2x2-1x1-2x2-0-NCHW-FP32-B=miopenConvolutionBwdDataAlgoImplicitGEMM:ConvHipImplicitGemmBwdDataV1R1,3374,79,0,miopenConvolutionBwdDataAlgoImplicitGEMM
256-28-28-3x3-256-28-28-64-2x2-1x1-2x2-0-NCHW-FP32-F=miopenConvolutionFwdAlgoImplicitGEMM:ConvHipImplicitGemmV4R1Fwd,109,721,0,miopenConvolutionFwdAlgoImplicitGEMM;miopenConvolutionFwdAlgoGEMM:GemmFwdRest,3147,85,7225344,MIOpenGEMM
256-7-7-7x7-1024-1-1-400-0x0-1x1-1x1-0-NCHW-FP32-F=miopenConvolutionFwdAlgoWinograd:ConvBinWinogradRxSf2x3,122,631,0,miopenConvolutionFwdAlgoWinograd;miopenConvolutionFwdAlgoDirect:ConvOclDirectFwd,3129,92,0,miopenConvolutionFwdAlgoDirect
256-28-28-3x3-2048-28-28-64-12x12-1x1-12x12-0-NCHW-FP32-B=miopenConvolutionBwdDataAlgoImplicitGEMM:ConvHipImplicitGemmBwdDataV1R1,2157,86,0,miopenConvolutionBwdDataAlgoImplicitGEMM
256-28-28-3x3-256-28-28-64-1x1-1x1-1x1-0-NCHW-FP32-W=miopenConvolutionBwdWeightsAlgoDirect:ConvAsmBwdWrW3x3,184,165,0,miopenConvolutionBwdWeightsAlgoDirect;miopenConvolutionBwdWeightsAlgoWinograd:ConvBinWinogradRxS,279,705,0,miopenConvolutionBwdWeightsAlgoWinograd;miopenConvolutionBwdWeightsAlgoImplicitGEMM:ConvHipImplicitGemmV4R1WrW,374,252,0,miopenConvolutionBwdWeightsAlgoImplicitGEMM;miopenConvolutionBwdWeightsAlgoGEMM:gemm,3487,33,7225344,MIOpenGEMM
512-128-128-1x1-256-256-256-2-0x0-2x2-1x1-0-NCHW-FP32-B=miopenConvolutionBwdDataAlgoImplicitGEMM:ConvHipImplicitGemmBwdDataV1R1,603,999,0,miopenConvolutionBwdDataAlgoImplicitGEMM;miopenConvolutionBwdDataAlgoDirect:ConvOclDirectFwd1x1,606,749,0,miopenConvolutionBwdDataAlgoDirect;miopenConvolutionBwdDataAlgoGEMM:gemm,1139,78,100663296,MIOpenGEMM
256-28-28-1x1-1280-28-28-64-0x0-1x1-1x1-0-NCHW-FP32-B=miopenConvolutionBwdDataAlgoDirect:ConvOclDirectFwd1x1,115,57,0,miopenConvolutionBwdDataAlgoDirect;miopenConvolutionBwdDataAlgoWinograd:ConvBinWinogradRxSf2x3,498,534,0,miopenConvolutionBwdDataAlgoWinograd;miopenConvolutionBwdDataAlgoGEMM:gemm,2884,85,0,MIOpenGEMM
256-28-28-3x3-256-28-28-64-1x1-1x1-1x1-0-NCHW-FP32-B=miopenConvolutionBwdDataAlgoWinograd:ConvBinWinogradRxS,55,5133,0,miopenConvolutionBwdDataAlgoWinograd
2048-28-28-3x3-256-28-28-64-12x12-1x1-12x12-0-NCHW-FP32-F=miopenConvolutionFwdAlgoImplicitGEMM:ConvHipImplicitGemmV4R1Fwd,1581,1,0,miopenConvolutionFwdAlgoImplicitGEMM
256-28-28-3x3-256-28-28-64-1x1-1x1-1x1-0-NCHW-FP32-F=miopenConvolutionFwdAlgoWinograd:ConvBinWinogradRxS,62,7081,0,miopenConvolutionFwdAlgoWinograd
21-28-28-1x1-256-28-28-64-0x0-1x1-1x1-0-NCHW-FP32-W=miopenConvolutionBwdWeightsAlgoDirect:ConvAsmBwdWrW1x1,7,7543,0,miopenConvolutionBwdWeightsAlgoDirect;miopenConvolutionBwdWeightsAlgoWinograd:ConvBinWinogradRxSf2x3,44,687,0,miopenConvolutionBwdWeightsAlgoWinograd;miopenConvolutionBwdWeightsAlgoGEMM:gemm,517,878,0,MIOpenGEMM
21-28-28-1x1-256-28-28-64-0x0-1x1-1x1-0-NCHW-FP32-B=miopenConvolutionBwdDataAlgoDirect:ConvAsm1x1U,1,87333,0,miopenConvolutionBwdDataAlgoDirect;miopenConvolutionBwdDataAlgoWinograd:ConvBinWinogradRxSf2x3,39,6091,0,miopenConvolutionBwdDataAlgoWinograd;miopenConvolutionBwdDataAlgoGEMM:gemm,249,609,0,MIOpenGEMM
1024-1-1-1x1-1024-1-1-400-0x0-1x1-1x1-0-NCHW-FP32-W=miopenConvolutionBwdWeightsAlgoDirect:ConvOclBwdWrW1x1,2,53537,0,miopenConvolutionBwdWeightsAlgoDirect
256-256-256-1x1-512-128-128-2-0x0-2x2-1x1-0-NCHW-FP32-F=miopenConvolutionFwdAlgoImplicitGEMM:ConvHipImplicitGemmV4R4Fwd,230,655,0,miopenConvolutionFwdAlgoImplicitGEMM;miopenConvolutionFwdAlgoGEMM:GemmFwd1x1_0_2,300,872,100663296,MIOpenGEMM;miopenConvolutionFwdAlgoDirect:ConvOclDirectFwd1x1,403,963,0,miopenConvolutionFwdAlgoDirect;miopenConvolutionFwdAlgoWinograd:ConvBinWinogradRxS,2641,4,0,miopenConvolutionFwdAlgoWinograd
1280-28-28-1x1-256-28-28-64-0x0-1x1-1x1-0-NCHW-FP32-F=miopenConvolutionFwdAlgoDirect:ConvAsm1x1U,72,1616,0,miopenConvolutionFwdAlgoDirect;miopenConvolutionFwdAlgoWinograd:ConvBinWinogradRxSf3x2,269,77,0,miopenConvolutionFwdAlgoWinograd;miopenConvolutionFwdAlgoGEMM:GemmFwd1x1_0_1,1161,41,0,MIOpenGEMM
256-28-28-1x1-21-28-28-64-0x0-1x1-1x1-0-NCHW-FP32-F=miopenConvolutionFwdAlgoWinograd:ConvBinWinogradRxSf3x2,1,8068,0,miopenConvolutionFwdAlgoWinograd;miopenConvolutionFwdAlgoDirect:ConvAsm1x1U,2,24325,0,miopenConvolutionFwdAlgoDirect;miopenConvolutionFwdAlgoGEMM:GemmFwd1x1_0_1,280,953,0,MIOpenGEMM
256-28-28-1x1-2048-28-28-64-0x0-1x1-1x1-0-NCHW-FP32-W=miopenConvolutionBwdWeightsAlgoDirect:ConvAsmBwdWrW1x1,118,74,0,miopenConvolutionBwdWeightsAlgoDirect;miopenConvolutionBwdWeightsAlgoWinograd:ConvBinWinogradRxSf2x3,1008,61,0,miopenConvolutionBwdWeightsAlgoWinograd;miopenConvolutionBwdWeightsAlgoGEMM:gemm,1188,84,0,MIOpenGEMM
128-28-28-3x3-128-56-56-64-1x1-2x2-1x1-0-NCHW-FP32-W=miopenConvolutionBwdWeightsAlgoDirect:ConvAsmBwdWrW3x3,395,125,0,miopenConvolutionBwdWeightsAlgoDirect;miopenConvolutionBwdWeightsAlgoImplicitGEMM:ConvHipImplicitGemmV4R1WrW,1985,21,0,miopenConvolutionBwdWeightsAlgoImplicitGEMM
128-28-28-3x3-128-56-56-64-1x1-2x2-1x1-0-NCHW-FP32-B=miopenConvolutionBwdDataAlgoDirect:ConvOclDirectFwd,243,694,0,miopenConvolutionBwdDataAlgoDirect;miopenConvolutionBwdDataAlgoWinograd:ConvBinWinogradRxSf2x3,410,999,0,miopenConvolutionBwdDataAlgoWinograd;miopenConvolutionBwdDataAlgoGEMM:gemm,1109,61,3612672,MIOpenGEMM;miopenConvolutionBwdDataAlgoImplicitGEMM:ConvHipImplicitGemmBwdDataV1R1,1263,86,0,miopenConvolutionBwdDataAlgoImplicitGEMM
128-56-56-3x3-128-28-28-64-1x1-2x2-1x1-0-NCHW-FP32-F=miopenConvolutionFwdAlgoImplicitGEMM:ConvHipImplicitGemmV4R1Fwd,72,78,0,miopenConvolutionFwdAlgoImplicitGEMM;miopenConvolutionFwdAlgoWinograd:ConvBinWinogradRxS,83,3059,0,miopenConvolutionFwdAlgoWinograd;miopenConvolutionFwdAlgoDirect:ConvOclDirectFwd,256,764,0,miopenConvolutionFwdAlgoDirect;miopenConvolutionFwdAlgoGEMM:GemmFwdRest,1384,46,3612672,MIOpenGEMM
256-28-28-1x1-2048-28-28-64-0x0-1x1-1x1-0-NCHW-FP32-B=miopenConvolutionBwdDataAlgoDirect:ConvAsm1x1U,55,1839,0,miopenConvolutionBwdDataAlgoDirect;miopenConvolutionBwdDataAlgoWinograd:ConvBinWinogradRxSf3x2,405,42,0,miopenConvolutionBwdDataAlgoWinograd;miopenConvolutionBwdDataAlgoGEMM:gemm,969,983,0,MIOpenGEMM
256-256-256-3x3-256-256-256-2-1x1-1x1-1x1-0-NCHW-FP32-W=miopenConvolutionBwdWeightsAlgoImplicitGEMM:ConvHipImplicitGemmV4R1WrW,688,784,0,miopenConvolutionBwdWeightsAlgoImplicitGEMM;miopenConvolutionBwdWeightsAlgoGEMM:gemm,756,781,603979776,MIOpenGEMM;miopenConvolutionBwdWeightsAlgoDirect:ConvOclBwdWrW2NonTunable,881,944,4718592,miopenConvolutionBwdWeightsAlgoDirect;miopenConvolutionBwdWeightsAlgoWinograd:ConvBinWinogradRxSf2x3,999,541,0,miopenConvolutionBwdWeightsAlgoWinograd
512-28-28-1x1-128-28-28-64-0x0-1x1-1x1-0-NCHW-FP32-W=miopenConvolutionBwdWeightsAlgoDirect:ConvAsmBwdWrW1x1,8,70816,0,miopenConvolutionBwdWeightsAlgoDirect;miopenConvolutionBwdWeightsAlgoWinograd:ConvBinWinogradRxSf2x3,73,186,0,miopenConvolutionBwdWeightsAlgoWinograd;miopenConvolutionBwdWeightsAlgoGEMM:gemm,80,1737,0,MIOpenGEMM
256-256-256-3x3-256-256-256-2-1x1-1x1-1x1-0-NCHW-FP32-B=miopenConvolutionBwdDataAlgoWinograd:ConvBinWinogradRxS,221,737,0,miopenConvolutionBwdDataAlgoWinograd
512-28-28-1x1-128-28-28-64-0x0-1x1-1x1-0-NCHW-FP32-B=miopenConvolutionBwdDataAlgoDirect:ConvAsm1x1U,3,30307,0,miopenConvolutionBwdDataAlgoDirect;miopenConvolutionBwdDataAlgoGEMM:gemm,236,404,0,MIOpenGEMM
64-56-56-1x1-256-56-56-64-0x0-1x1-1x1-0-NCHW-FP32-W=miopenConvolutionBwdWeightsAlgoDirect:ConvAsmBwdWrW1x1,11,2465,0,miopenConvolutionBwdWeightsAlgoDirect
2048-28-28-1x1-256-28-28-64-0x0-1x1-1x1-0-NCHW-FP32-F=miopenConvolutionFwdAlgoDirect:ConvOclDirectFwd1x1,103,238,0,miopenConvolutionFwdAlgoDirect;miopenConvolutionFwdAlgoWinograd:ConvBinWinogradRxSf3x2,310,559,0,miopenConvolutionFwdAlgoWinograd;miopenConvolutionFwdAlgoGEMM:GemmFwd1x1_0_1,975,53,0,MIOpenGEMM
256-28-28-1x1-1024-28-28-64-0x0-1x1-1x1-0-NCHW-FP32-F=miopenConvolutionFwdAlgoDirect:ConvOclDirectFwd1x1,854,381,0,miopenConvolutionFwdAlgoDirect;miopenConvolutionFwdAlgoWinograd:ConvBinWinogradRxS,3810,96,0,miopenConvolutionFwdAlgoWinograd
128-28-28-1x1-512-28-28-64-0x0-1x1-1x1-0-NCHW-FP32-F=miopenConvolutionFwdAlgoDirect:ConvAsm1x1U,5,6295,0,miopenConvolutionFwdAlgoDirect;miopenConvolutionFwdAlgoWinograd:ConvBinWinogradRxSf3x2,14,8721,0,miopenConvolutionFwdAlgoWinograd;miopenConvolutionFwdAlgoGEMM:GemmFwd1x1_0_1,240,683,0,MIOpenGEMM
1024-28-28-1x1-256-28-28-64-0x0-1x1-1x1-0-NCHW-FP32-W=miopenConvolutionBwdWeightsAlgoDirect:ConvOclBwdWrW1x1,207,536,0,miopenConvolutionBwdWeightsAlgoDirect;miopenConvolutionBwdWeightsAlgoGEMM:gemm,628,123,0,MIOpenGEMM
81-28-28-1x1-256-28-28-400-0x0-1x1-1x1-0-NCHW-FP32-W=miopenConvolutionBwdWeightsAlgoDirect:ConvAsmBwdWrW1x1,498,541,0,miopenConvolutionBwdWeightsAlgoDirect;miopenConvolutionBwdWeightsAlgoGEMM:gemm,1735,76,0,MIOpenGEMM;miopenConvolutionBwdWeightsAlgoWinograd:ConvBinWinogradRxSf2x3,2564,8,0,miopenConvolutionBwdWeightsAlgoWinograd
1024-1-1-1x1-1024-1-1-400-0x0-1x1-1x1-0-NCHW-FP32-B=miopenConvolutionBwdDataAlgoWinograd:ConvBinWinogradRxSf2x3,6,9648,0,miopenConvolutionBwdDataAlgoWinograd;miopenConvolutionBwdDataAlgoDirect:ConvOclDirectFwd1x1,16,3419,0,miopenConvolutionBwdDataAlgoDirect;miopenConvolutionBwdDataAlgoGEMM:gemm,1790,85,0,MIOpenGEMM
512-28-28-1x1-1024-28-28-64-0x0-1x1-1x1-0-NCHW-FP32-W=miopenConvolutionBwdWeightsAlgoGEMM:gemm,130,734,0,MIOpenGEMM;miopenConvolutionBwdWeightsAlgoWinograd:ConvBinWinogradRxSf2x3,3652,26,0,miopenConvolutionBwdWeightsAlgoWinograd
512-28-28-3x3-512-28-28-64-4x4-1x1-4x4-0-NCHW-FP32-B=miopenConvolutionBwdDataAlgoImplicitGEMM:ConvHipImplicitGemmBwdDataV1R1,352,754,0,miopenConvolutionBwdDataAlgoImplicitGEMM;miopenConvolutionBwdDataAlgoGEMM:gemm,699,965,14450688,MIOpenGEMM
128-28-28-3x3-128-28-28-64-1x1-1x1-1x1-0-NCHW-FP32-W=miopenConvolutionBwdWeightsAlgoDirect:ConvAsmBwdWrW3x3,15,8164,0,miopenConvolutionBwdWeightsAlgoDirect;miopenConvolutionBwdWeightsAlgoWinograd:ConvBinWinogradRxS,27,7539,0,miopenConvolutionBwdWeightsAlgoWinograd;miopenConvolutionBwdWeightsAlgoImplicitGEMM:ConvHipImplicitGemmV4R1WrW,48,7433,0,miopenConvolutionBwdWeightsAlgoImplicitGEMM;miopenConvolutionBwdWeightsAlgoGEMM:gemm,230,716,3612672,MIOpenGEMM
64-56-56-3x3-64-56-56-64-1x1-1x1-1x1-0-NCHW-FP32-W=miopenConvolutionBwdWeightsAlgoDirect:ConvOclBwdWrW53,4,20903,9437184,miopenConvolutionBwdWeightsAlgoDirect;miopenConvolutionBwdWeightsAlgoWinograd:ConvBinWinogradRxSf2x3,8,69967,0,miopenConvolutionBwdWeightsAlgoWinograd;miopenConvolutionBwdWeightsAlgoGEMM:gemm,8,83069,7225344,MIOpenGEMM;miopenConvolutionBwdWeightsAlgoImplicitGEMM:ConvHipImplicitGemmV4R1WrW,33,17,0,miopenConvolutionBwdWeightsAlgoImplicitGEMM
512-28-28-3x3-512-28-28-64-4x4-1x1-4x4-0-NCHW-FP32-F=miopenConvolutionFwdAlgoImplicitGEMM:ConvHipImplicitGemmV4R1Fwd,307,426,0,miopenConvolutionFwdAlgoImplicitGEMM;miopenConvolutionFwdAlgoGEMM:GemmFwdRest,1348,82,14450688,MIOpenGEMM
128-28-28-3x3-128-28-28-64-1x1-1x1-1x1-0-NCHW-FP32-B=miopenConvolutionBwdDataAlgoWinograd:ConvBinWinogradRxS,2,6618,0,miopenConvolutionBwdDataAlgoWinograd
64-56-56-3x3-64-56-56-64-1x1-1x1-1x1-0-NCHW-FP32-B=miopenConvolutionBwdDataAlgoWinograd:ConvBinWinogradRxSf2x3,1,39262,0,miopenConvolutionBwdDataAlgoWinograd
64-56-56-1x1-256-56-56-64-0x0-1x1-1x1-0-NCHW-FP32-B=miopenConvolutionBwdDataAlgoDirect:ConvAsm1x1U,3,3763,0,miopenConvolutionBwdDataAlgoDirect;miopenConvolutionBwdDataAlgoWinograd:ConvBinWinogradRxSf3x2,42,4608,0,miopenConvolutionBwdDataAlgoWinograd;miopenConvolutionBwdDataAlgoGEMM:gemm,79,6808,0,MIOpenGEMM
128-28-28-3x3-128-28-28-32-1x1-1x1-1x1-0-NCHW-FP32-F=miopenConvolutionFwdAlgoWinograd:ConvBinWinogradRxSf2x3,4,40226,0,miopenConvolutionFwdAlgoWinograd
64-56-56-3x3-64-56-56-64-1x1-1x1-1x1-0-NCHW-FP32-F=miopenConvolutionFwdAlgoWinograd:ConvBinWinogradRxS,1,55776,0,miopenConvolutionFwdAlgoWinograd
512-28-28-3x3-512-28-28-64-2x2-1x1-2x2-0-NCHW-FP32-W=miopenConvolutionBwdWeightsAlgoImplicitGEMM:ConvHipImplicitGemmV4R1WrW,381,81,0,miopenConvolutionBwdWeightsAlgoImplicitGEMM;miopenConvolutionBwdWeightsAlgoGEMM:gemm,1249,81,14450688,MIOpenGEMM
256-1-1-1x1-2048-1-1-64-0x0-1x1-1x1-0-NCHW-FP32-W=miopenConvolutionBwdWeightsAlgoDirect:ConvAsmBwdWrW1x1,0,164141,0,miopenConvolutionBwdWeightsAlgoDirect;miopenConvolutionBwdWeightsAlgoGEMM:gemm,351,129,0,MIOpenGEMM
1024-28-28-1x1-256-28-28-64-0x0-1x1-1x1-0-NCHW-FP32-B=miopenConvolutionBwdDataAlgoDirect:ConvAsm1x1U,17,7497,0,miopenConvolutionBwdDataAlgoDirect;miopenConvolutionBwdDataAlgoWinograd:ConvBinWinogradRxSf3x2,98,747,0,miopenConvolutionBwdDataAlgoWinograd;miopenConvolutionBwdDataAlgoGEMM:gemm,351,841,0,MIOpenGEMM
512-28-28-3x3-512-28-28-64-2x2-1x1-2x2-0-NCHW-FP32-B=miopenConvolutionBwdDataAlgoImplicitGEMM:ConvHipImplicitGemmBwdDataV1R1,457,634,0,miopenConvolutionBwdDataAlgoImplicitGEMM;miopenConvolutionBwdDataAlgoGEMM:gemm,1126,27,14450688,MIOpenGEMM
256-28-28-1x1-1280-28-28-32-0x0-1x1-1x1-0-NCHW-FP32-B=miopenConvolutionBwdDataAlgoDirect:ConvAsm1x1U,9,5351,0,miopenConvolutionBwdDataAlgoDirect;miopenConvolutionBwdDataAlgoWinograd:ConvBinWinogradRxSf3x2,80,8274,0,miopenConvolutionBwdDataAlgoWinograd;miopenConvolutionBwdDataAlgoGEMM:gemm,169,119,0,MIOpenGEMM
64-56-56-1x1-64-56-56-64-0x0-1x1-1x1-0-NCHW-FP32-W=miopenConvolutionBwdWeightsAlgoDirect:ConvAsmBwdWrW1x1,2,43593,0,miopenConvolutionBwdWeightsAlgoDirect
256-28-28-3x3-2048-28-28-32-12x12-1x1-12x12-0-NCHW-FP32-W=miopenConvolutionBwdWeightsAlgoImplicitGEMM:ConvHipImplicitGemmV4R1WrW,547,19,0,miopenConvolutionBwdWeightsAlgoImplicitGEMM;miopenConvolutionBwdWeightsAlgoGEMM:gemm,2191,79,57802752,MIOpenGEMM
512-28-28-3x3-512-28-28-64-2x2-1x1-2x2-0-NCHW-FP32-F=miopenConvolutionFwdAlgoImplicitGEMM:ConvHipImplicitGemmV4R1Fwd,652,295,0,miopenConvolutionFwdAlgoImplicitGEMM;miopenConvolutionFwdAlgoGEMM:GemmFwdRest,2766,3,14450688,MIOpenGEMM
256-1-1-1x1-2048-1-1-64-0x0-1x1-1x1-0-NCHW-FP32-B=miopenConvolutionBwdDataAlgoDirect:ConvAsm1x1U,0,291291,0,miopenConvolutionBwdDataAlgoDirect;miopenConvolutionBwdDataAlgoGEMM:gemm,484,949,0,MIOpenGEMM
256-56-56-1x1-64-56-56-64-0x0-1x1-1x1-0-NCHW-FP32-F=miopenConvolutionFwdAlgoDirect:ConvAsm1x1U,3,3417,0,miopenConvolutionFwdAlgoDirect;miopenConvolutionFwdAlgoGEMM:GemmFwd1x1_0_1,99,4026,0,MIOpenGEMM
512-28-28-1x1-1024-28-28-32-0x0-1x1-1x1-0-NCHW-FP32-W=miopenConvolutionBwdWeightsAlgoDirect:ConvAsmBwdWrW1x1,46,4573,0,miopenConvolutionBwdWeightsAlgoDirect;miopenConvolutionBwdWeightsAlgoGEMM:gemm,103,757,0,MIOpenGEMM;miopenConvolutionBwdWeightsAlgoWinograd:ConvBinWinogradRxSf2x3,297,868,0,miopenConvolutionBwdWeightsAlgoWinograd
256-28-28-3x3-2048-28-28-32-12x12-1x1-12x12-0-NCHW-FP32-B=miopenConvolutionBwdDataAlgoImplicitGEMM:ConvHipImplicitGemmBwdDataV1R1,54,6747,0,miopenConvolutionBwdDataAlgoImplicitGEMM;miopenConvolutionBwdDataAlgoGEMM:gemm,167,721,57802752,MIOpenGEMM
512-28-28-1x1-1024-28-28-64-0x0-1x1-1x1-0-NCHW-FP32-B=miopenConvolutionBwdDataAlgoDirect:ConvAsm1x1U,73,6383,0,miopenConvolutionBwdDataAlgoDirect;miopenConvolutionBwdDataAlgoWinograd:ConvBinWinogradRxSf3x2,259,792,0,miopenConvolutionBwdDataAlgoWinograd;miopenConvolutionBwdDataAlgoGEMM:gemm,475,837,0,MIOpenGEMM
64-56-56-1x1-64-56-56-64-0x0-1x1-1x1-0-NCHW-FP32-B=miopenConvolutionBwdDataAlgoDirect:ConvAsm1x1U,0,83611,0,miopenConvolutionBwdDataAlgoDirect;miopenConvolutionBwdDataAlgoGEMM:gemm,103,41,0,MIOpenGEMM
512-28-28-1x1-256-56-56-64-0x0-2x2-1x1-0-NCHW-FP32-W=miopenConvolutionBwdWeightsAlgoDirect:ConvAsmBwdWrW1x1,22,4729,51380224,miopenConvolutionBwdWeightsAlgoDirect;miopenConvolutionBwdWeightsAlgoImplicitGEMM:ConvHipImplicitGemmV4R1WrW,54,9799,0,miopenConvolutionBwdWeightsAlgoImplicitGEMM;miopenConvolutionBwdWeightsAlgoGEMM:gemm,256,949,802816,MIOpenGEMM
2048-28-28-3x3-256-28-28-32-12x12-1x1-12x12-0-NCHW-FP32-F=miopenConvolutionFwdAlgoImplicitGEMM:ConvHipImplicitGemmV4R1Fwd,358,915,0,miopenConvolutionFwdAlgoImplicitGEMM;miopenConvolutionFwdAlgoGEMM:GemmFwdRest,908,96,57802752,MIOpenGEMM
1280-28-28-1x1-256-28-28-32-0x0-1x1-1x1-0-NCHW-FP32-F=miopenConvolutionFwdAlgoDirect:ConvAsm1x1U,13,8016,0,miopenConvolutionFwdAlgoDirect;miopenConvolutionFwdAlgoWinograd:ConvBinWinogradRxSf2x3,62,3326,0,miopenConvolutionFwdAlgoWinograd;miopenConvolutionFwdAlgoGEMM:GemmFwd1x1_0_1,119,765,0,MIOpenGEMM
64-56-56-1x1-64-56-56-64-0x0-1x1-1x1-0-NCHW-FP32-F=miopenConvolutionFwdAlgoDirect:ConvOclDirectFwd1x1,0,998696,0,miopenConvolutionFwdAlgoDirect;miopenConvolutionFwdAlgoGEMM:GemmFwd1x1_0_1,105,33,0,MIOpenGEMM
1024-1-1-7x7-256-7-7-400-0x0-1x1-1x1-0-NCHW-FP32-W=miopenConvolutionBwdWeightsAlgoWinograd:ConvBinWinogradRxS,50,1607,0,miopenConvolutionBwdWeightsAlgoWinograd;miopenConvolutionBwdWeightsAlgoDirect:ConvOclBwdWrW53,143,293,0,miopenConvolutionBwdWeightsAlgoDirect;miopenConvolutionBwdWeightsAlgoGEMM:gemm,2076,2,50176,MIOpenGEMM
128-28-28-3x3-128-56-56-32-1x1-2x2-1x1-0-NCHW-FP32-W=miopenConvolutionBwdWeightsAlgoDirect:ConvAsmBwdWrW3x3,20,8391,0,miopenConvolutionBwdWeightsAlgoDirect;miopenConvolutionBwdWeightsAlgoImplicitGEMM:ConvHipImplicitGemmV4R1WrW,81,9693,0,miopenConvolutionBwdWeightsAlgoImplicitGEMM;miopenConvolutionBwdWeightsAlgoGEMM:gemm,331,46,3612672,MIOpenGEMM
512-28-28-1x1-256-56-56-64-0x0-2x2-1x1-0-NCHW-FP32-B=miopenConvolutionBwdDataAlgoDirect:ConvAsm1x1UV2,12,5804,0,miopenConvolutionBwdDataAlgoDirect;miopenConvolutionBwdDataAlgoGEMM:gemm,37,731,154140672,MIOpenGEMM;miopenConvolutionBwdDataAlgoWinograd:ConvBinWinogradRxSf2x3,224,384,0,miopenConvolutionBwdDataAlgoWinograd
512-28-28-1x1-2048-28-28-64-0x0-1x1-1x1-0-NCHW-FP32-F=miopenConvolutionFwdAlgoDirect:ConvAsm1x1U,114,993,0,miopenConvolutionFwdAlgoDirect;miopenConvolutionFwdAlgoWinograd:ConvBinWinogradRxSf3x2,350,57,0,miopenConvolutionFwdAlgoWinograd;miopenConvolutionFwdAlgoGEMM:GemmFwd1x1_0_1,683,344,0,MIOpenGEMM
128-28-28-3x3-128-56-56-32-1x1-2x2-1x1-0-NCHW-FP32-B=miopenConvolutionBwdDataAlgoWinograd:ConvBinWinogradRxSf2x3,34,1175,0,miopenConvolutionBwdDataAlgoWinograd;miopenConvolutionBwdDataAlgoImplicitGEMM:ConvHipImplicitGemmBwdDataV1R1,74,1387,0,miopenConvolutionBwdDataAlgoImplicitGEMM;miopenConvolutionBwdDataAlgoGEMM:gemm,124,557,3612672,MIOpenGEMM;miopenConvolutionBwdDataAlgoDirect:ConvOclDirectFwd,129,551,0,miopenConvolutionBwdDataAlgoDirect
256-28-28-1x1-2048-28-28-32-0x0-1x1-1x1-0-NCHW-FP32-W=miopenConvolutionBwdWeightsAlgoDirect:ConvAsmBwdWrW1x1,45,3503,0,miopenConvolutionBwdWeightsAlgoDirect;miopenConvolutionBwdWeightsAlgoGEMM:gemm,138,94,0,MIOpenGEMM;miopenConvolutionBwdWeightsAlgoWinograd:ConvBinWinogradRxSf2x3,211,523,0,miopenConvolutionBwdWeightsAlgoWinograd
256-56-56-1x1-64-56-56-64-0x0-1x1-1x1-0-NCHW-FP32-W=miopenConvolutionBwdWeightsAlgoDirect:ConvAsmBwdWrW1x1,27,3218,0,miopenConvolutionBwdWeightsAlgoDirect;miopenConvolutionBwdWeightsAlgoGEMM:gemm,545,56,0,MIOpenGEMM
256-56-56-1x1-512-28-28-64-0x0-2x2-1x1-0-NCHW-FP32-F=miopenConvolutionFwdAlgoDirect:ConvAsm1x1U,14,7216,51380224,miopenConvolutionFwdAlgoDirect;miopenConvolutionFwdAlgoGEMM:GemmFwd1x1_0_2,30,1632,154140672,MIOpenGEMM;miopenConvolutionFwdAlgoWinograd:ConvBinWinogradRxSf2x3,202,224,0,miopenConvolutionFwdAlgoWinograd
512-28-28-1x1-1024-28-28-32-0x0-1x1-1x1-0-NCHW-FP32-B=miopenConvolutionBwdDataAlgoDirect:ConvAsm1x1U,21,1139,0,miopenConvolutionBwdDataAlgoDirect;miopenConvolutionBwdDataAlgoWinograd:ConvBinWinogradRxSf3x2,144,605,0,miopenConvolutionBwdDataAlgoWinograd;miopenConvolutionBwdDataAlgoGEMM:gemm,218,4,0,MIOpenGEMM
128-56-56-3x3-128-28-28-32-1x1-2x2-1x1-0-NCHW-FP32-F=miopenConvolutionFwdAlgoWinograd:ConvBinWinogradRxS,7,33303,0,miopenConvolutionFwdAlgoWinograd;miopenConvolutionFwdAlgoImplicitGEMM:ConvHipImplicitGemmV4R1Fwd,16,4029,0,miopenConvolutionFwdAlgoImplicitGEMM;miopenConvolutionFwdAlgoDirect:ConvOclDirectFwd,94,1907,0,miopenConvolutionFwdAlgoDirect;miopenConvolutionFwdAlgoGEMM:GemmFwdRest,593,475,3612672,MIOpenGEMM
256-28-28-1x1-1024-28-28-32-0x0-1x1-1x1-0-NCHW-FP32-F=miopenConvolutionFwdAlgoDirect:ConvOclDirectFwd1x1,12,2979,0,miopenConvolutionFwdAlgoDirect;miopenConvolutionFwdAlgoWinograd:ConvBinWinogradRxSf2x3,52,6818,0,miopenConvolutionFwdAlgoWinograd;miopenConvolutionFwdAlgoGEMM:GemmFwd1x1_0_1,94,1746,0,MIOpenGEMM
256-28-28-1x1-512-28-28-64-0x0-1x1-1x1-0-NCHW-FP32-W=miopenConvolutionBwdWeightsAlgoDirect:ConvAsmBwdWrW1x1,30,876,0,miopenConvolutionBwdWeightsAlgoDirect;miopenConvolutionBwdWeightsAlgoWinograd:ConvBinWinogradRxSf2x3,178,15,0,miopenConvolutionBwdWeightsAlgoWinograd;miopenConvolutionBwdWeightsAlgoGEMM:gemm,486,653,0,MIOpenGEMM
256-56-56-1x1-64-56-56-64-0x0-1x1-1x1-0-NCHW-FP32-B=miopenConvolutionBwdDataAlgoDirect:ConvAsm1x1U,2,91955,0,miopenConvolutionBwdDataAlgoDirect;miopenConvolutionBwdDataAlgoGEMM:gemm,143,846,0,MIOpenGEMM
2048-1-1-1x1-256-1-1-64-0x0-1x1-1x1-0-NCHW-FP32-F=miopenConvolutionFwdAlgoDirect:ConvOclDirectFwd1x1,0,657432,0,miopenConvolutionFwdAlgoDirect;miopenConvolutionFwdAlgoGEMM:GemmFwd1x1_0_1,558,358,0,MIOpenGEMM
256-28-28-3x3-256-28-28-32-2x2-1x1-2x2-0-NCHW-FP32-B=miopenConvolutionBwdDataAlgoImplicitGEMM:ConvHipImplicitGemmBwdDataV1R1,39,5204,0,miopenConvolutionBwdDataAlgoImplicitGEMM;miopenConvolutionBwdDataAlgoGEMM:gemm,148,234,7225344,MIOpenGEMM
128-28-28-1x1-512-28-28-64-0x0-1x1-1x1-0-NCHW-FP32-W=miopenConvolutionBwdWeightsAlgoDirect:ConvAsmBwdWrW1x1,5,97699,0,miopenConvolutionBwdWeightsAlgoDirect;miopenConvolutionBwdWeightsAlgoGEMM:gemm,375,166,0,MIOpenGEMM
256-28-28-3x3-256-28-28-32-2x2-1x1-2x2-0-NCHW-FP32-F=miopenConvolutionFwdAlgoImplicitGEMM:ConvHipImplicitGemmV4R1Fwd,52,6432,0,miopenConvolutionFwdAlgoImplicitGEMM;miopenConvolutionFwdAlgoGEMM:GemmFwdRest,249,372,7225344,MIOpenGEMM
256-28-28-1x1-2048-28-28-32-0x0-1x1-1x1-0-NCHW-FP32-B=miopenConvolutionBwdDataAlgoDirect:ConvAsm1x1U,21,714,0,miopenConvolutionBwdDataAlgoDirect;miopenConvolutionBwdDataAlgoWinograd:ConvBinWinogradRxSf3x2,150,502,0,miopenConvolutionBwdDataAlgoWinograd;miopenConvolutionBwdDataAlgoGEMM:gemm,189,174,0,MIOpenGEMM
1024-1-1-1x1-1024-1-1-400-0x0-1x1-1x1-0-NCHW-FP32-F=miopenConvolutionFwdAlgoDirect:ConvOclDirectFwd1x1,6,43684,0,miopenConvolutionFwdAlgoDirect;miopenConvolutionFwdAlgoWinograd:ConvBinWinogradRxSf2x3,13,7912,0,miopenConvolutionFwdAlgoWinograd;miopenConvolutionFwdAlgoGEMM:GemmFwd1x1_0_1,3106,16,0,MIOpenGEMM
1024-28-28-1x1-512-28-28-64-0x0-1x1-1x1-0-NCHW-FP32-F=miopenConvolutionFwdAlgoDirect:ConvAsm1x1U,85,6453,0,miopenConvolutionFwdAlgoDirect;miopenConvolutionFwdAlgoWinograd:ConvBinWinogradRxSf2x3,193,212,0,miopenConvolutionFwdAlgoWinograd;miopenConvolutionFwdAlgoGEMM:GemmFwd1x1_0_1,477,438,0,MIOpenGEMM
512-28-28-1x1-128-28-28-32-0x0-1x1-1x1-0-NCHW-FP32-W=miopenConvolutionBwdWeightsAlgoDirect:ConvOclBwdWrW1x1,5,74526,0,miopenConvolutionBwdWeightsAlgoDirect;miopenConvolutionBwdWeightsAlgoGEMM:gemm,165,599,0,MIOpenGEMM
64-56-56-1x1-256-56-56-64-0x0-1x1-1x1-0-NCHW-FP32-F=miopenConvolutionFwdAlgoDirect:ConvOclDirectFwd1x1,2,3909,0,miopenConvolutionFwdAlgoDirect;miopenConvolutionFwdAlgoWinograd:ConvBinWinogradRxSf3x2,11,8588,0,miopenConvolutionFwdAlgoWinograd;miopenConvolutionFwdAlgoGEMM:GemmFwd1x1_0_1,128,482,0,MIOpenGEMM
256-28-28-1x1-512-28-28-64-0x0-1x1-1x1-0-NCHW-FP32-B=miopenConvolutionBwdDataAlgoDirect:ConvAsm1x1U,7,43905,0,miopenConvolutionBwdDataAlgoDirect;miopenConvolutionBwdDataAlgoWinograd:ConvBinWinogradRxSf3x2,34,9353,0,miopenConvolutionBwdDataAlgoWinograd;miopenConvolutionBwdDataAlgoGEMM:gemm,250,821,0,MIOpenGEMM
256-28-28-3x3-256-28-28-32-1x1-1x1-1x1-0-NCHW-FP32-W=miopenConvolutionBwdWeightsAlgoDirect:ConvOclBwdWrW53,47,374,0,miopenConvolutionBwdWeightsAlgoDirect;miopenConvolutionBwdWeightsAlgoWinograd:ConvBinWinogradRxS,81,9568,0,miopenConvolutionBwdWeightsAlgoWinograd;miopenConvolutionBwdWeightsAlgoImplicitGEMM:ConvHipImplicitGemmV4R1WrW,141,283,0,miopenConvolutionBwdWeightsAlgoImplicitGEMM;miopenConvolutionBwdWeightsAlgoGEMM:gemm,440,387,7225344,MIOpenGEMM
64-256-256-3x3-64-256-256-2-1x1-1x1-1x1-0-NCHW-FP32-W=miopenConvolutionBwdWeightsAlgoDirect:ConvOclBwdWrW53,45,7681,294912,miopenConvolutionBwdWeightsAlgoDirect;miopenConvolutionBwdWeightsAlgoGEMM:gemm,94,8249,150994944,MIOpenGEMM;miopenConvolutionBwdWeightsAlgoWinograd:ConvBinWinogradRxSf2x3,118,233,0,miopenConvolutionBwdWeightsAlgoWinograd;miopenConvolutionBwdWeightsAlgoImplicitGEMM:ConvHipImplicitGemmV4R1WrW,345,762,0,miopenConvolutionBwdWeightsAlgoImplicitGEMM
128-28-28-1x1-512-28-28-64-0x0-1x1-1x1-0-NCHW-FP32-B=miopenConvolutionBwdDataAlgoDirect:ConvAsm1x1U,2,46288,0,miopenConvolutionBwdDataAlgoDirect;miopenConvolutionBwdDataAlgoWinograd:ConvBinWinogradRxSf3x2,14,119,0,miopenConvolutionBwdDataAlgoWinograd;miopenConvolutionBwdDataAlgoGEMM:gemm,361,101,0,MIOpenGEMM
512-28-28-1x1-128-28-28-32-0x0-1x1-1x1-0-NCHW-FP32-B=miopenConvolutionBwdDataAlgoDirect:ConvAsm1x1U,2,3105,0,miopenConvolutionBwdDataAlgoDirect;miopenConvolutionBwdDataAlgoGEMM:gemm,123,553,0,MIOpenGEMM
81-28-28-1x1-256-28-28-400-0x0-1x1-1x1-0-NCHW-FP32-B=miopenConvolutionBwdDataAlgoDirect:ConvAsm1x1U,351,672,0,miopenConvolutionBwdDataAlgoDirect;miopenConvolutionBwdDataAlgoGEMM:gemm,1072,4,0,MIOpenGEMM;miopenConvolutionBwdDataAlgoWinograd:ConvBinWinogradRxSf2x3,1834,58,0,miopenConvolutionBwdDataAlgoWinograd
256-28-28-3x3-256-28-28-32-1x1-1x1-1x1-0-NCHW-FP32-B=miopenConvolutionBwdDataAlgoWinograd:ConvBinWinograd3x3U,7,41116,0,miopenConvolutionBwdDataAlgoWinograd
512-28-28-3x3-512-28-28-64-4x4-1x1-4x4-0-NCHW-FP32-W=miopenConvolutionBwdWeightsAlgoImplicitGEMM:ConvHipImplicitGemmV4R1WrW,840,689,0,miopenConvolutionBwdWeightsAlgoImplicitGEMM;miopenConvolutionBwdWeightsAlgoGEMM:gemm,3283,87,14450688,MIOpenGEMM
64-256-256-3x3-64-256-256-2-1x1-1x1-1x1-0-NCHW-FP32-B=miopenConvolutionBwdDataAlgoWinograd:ConvBinWinogradRxSf2x3,3,47671,0,miopenConvolutionBwdDataAlgoWinograd
512-28-28-1x1-128-28-28-64-0x0-1x1-1x1-0-NCHW-FP32-F=miopenConvolutionFwdAlgoDirect:ConvOclDirectFwd1x1,4,9549,0,miopenConvolutionFwdAlgoDirect;miopenConvolutionFwdAlgoWinograd:ConvBinWinogradRxSf3x2,20,897,0,miopenConvolutionFwdAlgoWinograd;miopenConvolutionFwdAlgoGEMM:GemmFwd1x1_0_1,120,162,0,MIOpenGEMM
128-28-28-1x1-512-28-28-32-0x0-1x1-1x1-0-NCHW-FP32-F=miopenConvolutionFwdAlgoDirect:ConvOclDirectFwd1x1,1,19077,0,miopenConvolutionFwdAlgoDirect;miopenConvolutionFwdAlgoWinograd:ConvBinWinogradRxSf2x3,2,62511,0,miopenConvolutionFwdAlgoWinograd;miopenConvolutionFwdAlgoGEMM:GemmFwd1x1_0_1,3,9822,0,MIOpenGEMM
256-28-28-3x3-256-28-28-32-1x1-1x1-1x1-0-NCHW-FP32-F=miopenConvolutionFwdAlgoWinograd:ConvBinWinograd3x3U,4,48217,0,miopenConvolutionFwdAlgoWinograd
64-256-256-3x3-64-256-256-2-1x1-1x1-1x1-0-NCHW-FP32-F=miopenConvolutionFwdAlgoWinograd:ConvBinWinogradRxS,1,45065,0,miopenConvolutionFwdAlgoWinograd
512-28-28-1x1-2048-28-28-32-0x0-1x1-1x1-0-NCHW-FP32-W=miopenConvolutionBwdWeightsAlgoDirect:ConvAsmBwdWrW1x1,85,5951,0,miopenConvolutionBwdWeightsAlgoDirect;miopenConvolutionBwdWeightsAlgoGEMM:gemm,299,86,0,MIOpenGEMM;miopenConvolutionBwdWeightsAlgoWinograd:ConvBinWinogradRxSf2x3,530,429,0,miopenConvolutionBwdWeightsAlgoWinograd
128-56-56-1x1-256-56-56-64-0x0-1x1-1x1-0-NCHW-FP32-W=miopenConvolutionBwdWeightsAlgoDirect:ConvAsmBwdWrW1x1,73,3272,0,miopenConvolutionBwdWeightsAlgoDirect
128-28-28-3x3-128-28-28-32-1x1-1x1-1x1-0-NCHW-FP32-W=miopenConvolutionBwdWeightsAlgoDirect:ConvAsmBwdWrW3x3,3,35599,0,miopenConvolutionBwdWeightsAlgoDirect;miopenConvolutionBwdWeightsAlgoWinograd:ConvBinWinogradRxS,3,47133,0,miopenConvolutionBwdWeightsAlgoWinograd;miopenConvolutionBwdWeightsAlgoImplicitGEMM:ConvHipImplicitGemmV4R1WrW,29,6886,0,miopenConvolutionBwdWeightsAlgoImplicitGEMM;miopenConvolutionBwdWeightsAlgoGEMM:gemm,145,604,3612672,MIOpenGEMM
1024-28-28-1x1-512-28-28-32-0x0-1x1-1x1-0-NCHW-FP32-F=miopenConvolutionFwdAlgoDirect:ConvAsm1x1U,49,7785,0,miopenConvolutionFwdAlgoDirect;miopenConvolutionFwdAlgoWinograd:ConvBinWinogradRxSf3x2,128,424,0,miopenConvolutionFwdAlgoWinograd;miopenConvolutionFwdAlgoGEMM:GemmFwd1x1_0_1,647,13,0,MIOpenGEMM
64-256-256-1x1-64-256-256-2-0x0-1x1-1x1-0-NCHW-FP32-W=miopenConvolutionBwdWeightsAlgoDirect:ConvAsmBwdWrW1x1,0,783911,0,miopenConvolutionBwdWeightsAlgoDirect
128-56-56-1x1-256-56-56-64-0x0-1x1-1x1-0-NCHW-FP32-B=miopenConvolutionBwdDataAlgoGEMM:gemm,4,45938,0,MIOpenGEMM;miopenConvolutionBwdDataAlgoWinograd:ConvBinWinogradRxSf3x2,5,90209,0,miopenConvolutionBwdDataAlgoWinograd;miopenConvolutionBwdDataAlgoDirect:ConvAsm1x1U,7,1084,0,miopenConvolutionBwdDataAlgoDirect
256-28-28-1x1-1280-28-28-64-0x0-1x1-1x1-0-NCHW-FP32-W=miopenConvolutionBwdWeightsAlgoDirect:ConvAsmBwdWrW1x1,38,1697,0,miopenConvolutionBwdWeightsAlgoDirect;miopenConvolutionBwdWeightsAlgoGEMM:gemm,345,469,0,MIOpenGEMM;miopenConvolutionBwdWeightsAlgoWinograd:ConvBinWinogradRxSf2x3,417,842,0,miopenConvolutionBwdWeightsAlgoWinograd
2048-28-28-1x1-256-28-28-32-0x0-1x1-1x1-0-NCHW-FP32-F=miopenConvolutionFwdAlgoDirect:ConvAsm1x1U,49,1153,0,miopenConvolutionFwdAlgoDirect;miopenConvolutionFwdAlgoWinograd:ConvBinWinogradRxSf3x2,115,749,0,miopenConvolutionFwdAlgoWinograd;miopenConvolutionFwdAlgoGEMM:GemmFwd1x1_0_1,377,933,0,MIOpenGEMM
128-28-28-3x3-128-28-28-32-1x1-1x1-1x1-0-NCHW-FP32-B=miopenConvolutionBwdDataAlgoWinograd:ConvBinWinogradRxS,0,913478,0,miopenConvolutionBwdDataAlgoWinograd
21-28-28-1x1-256-28-28-32-0x0-1x1-1x1-0-NCHW-FP32-W=miopenConvolutionBwdWeightsAlgoDirect:ConvAsmBwdWrW1x1,1,96051,0,miopenConvolutionBwdWeightsAlgoDirect;miopenConvolutionBwdWeightsAlgoWinograd:ConvBinWinogradRxSf2x3,4,32087,0,miopenConvolutionBwdWeightsAlgoWinograd;miopenConvolutionBwdWeightsAlgoGEMM:gemm,103,744,0,MIOpenGEMM
512-28-28-1x1-256-28-28-64-0x0-1x1-1x1-0-NCHW-FP32-F=miopenConvolutionFwdAlgoDirect:ConvAsm1x1U,24,2508,0,miopenConvolutionFwdAlgoDirect;miopenConvolutionFwdAlgoWinograd:ConvBinWinogradRxSf3x2,61,4048,0,miopenConvolutionFwdAlgoWinograd;miopenConvolutionFwdAlgoGEMM:GemmFwd1x1_0_1,319,884,0,MIOpenGEMM
64-256-256-1x1-64-256-256-2-0x0-1x1-1x1-0-NCHW-FP32-B=miopenConvolutionBwdDataAlgoWinograd:ConvBinWinogradRxSf3x2,1,27026,0,miopenConvolutionBwdDataAlgoWinograd;miopenConvolutionBwdDataAlgoDirect:ConvOclDirectFwd1x1,4,21555,0,miopenConvolutionBwdDataAlgoDirect;miopenConvolutionBwdDataAlgoImplicitGEMM:ConvHipImplicitGemmBwdDataV1R1,7,71025,0,miopenConvolutionBwdDataAlgoImplicitGEMM;miopenConvolutionBwdDataAlgoGEMM:gemm,8,89201,0,MIOpenGEMM
512-28-28-3x3-512-28-28-32-4x4-1x1-4x4-0-NCHW-FP32-B=miopenConvolutionBwdDataAlgoImplicitGEMM:ConvHipImplicitGemmBwdDataV1R1,146,25,0,miopenConvolutionBwdDataAlgoImplicitGEMM;miopenConvolutionBwdDataAlgoGEMM:gemm,350,99,14450688,MIOpenGEMM
256-1-1-1x1-2048-1-1-32-0x0-1x1-1x1-0-NCHW-FP32-W=miopenConvolutionBwdWeightsAlgoDirect:ConvAsmBwdWrW1x1,0,70221,0,miopenConvolutionBwdWeightsAlgoDirect;miopenConvolutionBwdWeightsAlgoGEMM:gemm,58,3151,0,MIOpenGEMM
512-28-28-3x3-512-28-28-32-4x4-1x1-4x4-0-NCHW-FP32-F=miopenConvolutionFwdAlgoImplicitGEMM:ConvHipImplicitGemmV4R1Fwd,65,9575,0,miopenConvolutionFwdAlgoImplicitGEMM;miopenConvolutionFwdAlgoGEMM:GemmFwdRest,465,944,14450688,MIOpenGEMM
64-256-256-1x1-64-256-256-2-0x0-1x1-1x1-0-NCHW-FP32-F=miopenConvolutionFwdAlgoWinograd:ConvBinWinogradRxSf3x2,1,45951,0,miopenConvolutionFwdAlgoWinograd;miopenConvolutionFwdAlgoDirect:ConvOclDirectFwd1x1,4,21811,0,miopenConvolutionFwdAlgoDirect;miopenConvolutionFwdAlgoImplicitGEMM:ConvHipImplicitGemmV4R4Fwd,6,20441,0,miopenConvolutionFwdAlgoImplicitGEMM;miopenConvolutionFwdAlgoGEMM:GemmFwd1x1_0_1,21,9644,0,MIOpenGEMM
64-56-56-1x1-256-56-56-32-0x0-1x1-1x1-0-NCHW-FP32-W=miopenConvolutionBwdWeightsAlgoDirect:ConvAsmBwdWrW1x1,5,59726,0,miopenConvolutionBwdWeightsAlgoDirect
21-28-28-1x1-256-28-28-32-0x0-1x1-1x1-0-NCHW-FP32-B=miopenConvolutionBwdDataAlgoDirect:ConvAsm1x1U,1,1499,0,miopenConvolutionBwdDataAlgoDirect;miopenConvolutionBwdDataAlgoWinograd:ConvBinWinogradRxSf2x3,11,3168,0,miopenConvolutionBwdDataAlgoWinograd;miopenConvolutionBwdDataAlgoGEMM:gemm,51,6104,0,MIOpenGEMM
256-28-28-1x1-1024-28-28-64-0x0-1x1-1x1-0-NCHW-FP32-W=miopenConvolutionBwdWeightsAlgoDirect:ConvAsmBwdWrW1x1,61,8537,0,miopenConvolutionBwdWeightsAlgoDirect;miopenConvolutionBwdWeightsAlgoWinograd:ConvBinWinogradRxSf2x3,402,647,0,miopenConvolutionBwdWeightsAlgoWinograd;miopenConvolutionBwdWeightsAlgoGEMM:gemm,447,396,0,MIOpenGEMM
2048-28-28-1x1-512-28-28-64-0x0-1x1-1x1-0-NCHW-FP32-W=miopenConvolutionBwdWeightsAlgoGEMM:gemm,26,5669,0,MIOpenGEMM;miopenConvolutionBwdWeightsAlgoDirect:ConvAsmBwdWrW1x1,28,7352,0,miopenConvolutionBwdWeightsAlgoDirect;miopenConvolutionBwdWeightsAlgoWinograd:ConvBinWinogradRxSf2x3,166,912,0,miopenConvolutionBwdWeightsAlgoWinograd
512-28-28-3x3-512-28-28-32-2x2-1x1-2x2-0-NCHW-FP32-W=miopenConvolutionBwdWeightsAlgoImplicitGEMM:ConvHipImplicitGemmV4R1WrW,203,547,0,miopenConvolutionBwdWeightsAlgoImplicitGEMM;miopenConvolutionBwdWeightsAlgoGEMM:gemm,350,123,14450688,MIOpenGEMM
64-56-56-3x3-64-56-56-32-1x1-1x1-1x1-0-NCHW-FP32-W=miopenConvolutionBwdWeightsAlgoDirect:ConvAsmBwdWrW3x3,8,66522,0,miopenConvolutionBwdWeightsAlgoDirect;miopenConvolutionBwdWeightsAlgoWinograd:ConvBinWinogradRxSf2x3,32,6196,0,miopenConvolutionBwdWeightsAlgoWinograd;miopenConvolutionBwdWeightsAlgoImplicitGEMM:ConvHipImplicitGemmV4R1WrW,129,961,0,miopenConvolutionBwdWeightsAlgoImplicitGEMM;miopenConvolutionBwdWeightsAlgoGEMM:gemm,149,946,7225344,MIOpenGEMM
256-56-56-1x1-128-56-56-64-0x0-1x1-1x1-0-NCHW-FP32-F=miopenConvolutionFwdAlgoDirect:ConvAsm1x1U,17,2203,0,miopenConvolutionFwdAlgoDirect;miopenConvolutionFwdAlgoWinograd:ConvBinWinogradRxSf3x2,38,2886,0,miopenConvolutionFwdAlgoWinograd;miopenConvolutionFwdAlgoGEMM:GemmFwd1x1_0_1,157,652,0,MIOpenGEMM
256-28-28-1x1-21-28-28-32-0x0-1x1-1x1-0-NCHW-FP32-F=miopenConvolutionFwdAlgoWinograd:ConvBinWinogradRxSf3x2,0,432728,0,miopenConvolutionFwdAlgoWinograd;miopenConvolutionFwdAlgoDirect:ConvAsm1x1U,0,481487,0,miopenConvolutionFwdAlgoDirect;miopenConvolutionFwdAlgoGEMM:GemmFwd1x1_0_1,23,5784,0,MIOpenGEMM
256-28-28-1x1-1024-28-28-32-0x0-1x1-1x1-0-NCHW-FP32-W=miopenConvolutionBwdWeightsAlgoDirect:ConvAsmBwdWrW1x1,25,4688,0,miopenConvolutionBwdWeightsAlgoDirect;miopenConvolutionBwdWeightsAlgoGEMM:gemm,133,529,0,MIOpenGEMM;miopenConvolutionBwdWeightsAlgoWinograd:ConvBinWinogradRxSf2x3,156,182,0,miopenConvolutionBwdWeightsAlgoWinograd
512-28-28-3x3-512-28-28-32-2x2-1x1-2x2-0-NCHW-FP32-B=miopenConvolutionBwdDataAlgoImplicitGEMM:ConvHipImplicitGemmBwdDataV1R1,176,708,0,miopenConvolutionBwdDataAlgoImplicitGEMM;miopenConvolutionBwdDataAlgoGEMM:gemm,457,19,14450688,MIOpenGEMM
64-56-56-3x3-64-56-56-32-1x1-1x1-1x1-0-NCHW-FP32-B=miopenConvolutionBwdDataAlgoWinograd:ConvBinWinograd3x3U,0,90301,0,miopenConvolutionBwdDataAlgoWinograd
256-28-28-3x3-256-28-28-64-2x2-1x1-2x2-0-NCHW-FP32-W=miopenConvolutionBwdWeightsAlgoImplicitGEMM:ConvHipImplicitGemmV4R1WrW,66,7635,0,miopenConvolutionBwdWeightsAlgoImplicitGEMM;miopenConvolutionBwdWeightsAlgoGEMM:gemm,445,804,7225344,MIOpenGEMM
64-56-56-1x1-256-56-56-32-0x0-1x1-1x1-0-NCHW-FP32-B=miopenConvolutionBwdDataAlgoDirect:ConvAsm1x1U,1,39946,0,miopenConvolutionBwdDataAlgoDirect;miopenConvolutionBwdDataAlgoGEMM:gemm,85,5144,0,MIOpenGEMM
64-56-56-3x3-64-56-56-32-1x1-1x1-1x1-0-NCHW-FP32-F=miopenConvolutionFwdAlgoWinograd:ConvBinWinogradRxSf3x2,2,12746,0,miopenConvolutionFwdAlgoWinograd
512-28-28-3x3-512-28-28-32-2x2-1x1-2x2-0-NCHW-FP32-F=miopenConvolutionFwdAlgoImplicitGEMM:ConvHipImplicitGemmV4R1Fwd,156,633,0,miopenConvolutionFwdAlgoImplicitGEMM;miopenConvolutionFwdAlgoGEMM:GemmFwdRest,424,995,14450688,MIOpenGEMM
64-56-56-1x1-64-56-56-32-0x0-1x1-1x1-0-NCHW-FP32-W=miopenConvolutionBwdWeightsAlgoGEMM:gemm,1,8595,0,MIOpenGEMM
512-28-28-1x1-2048-28-28-32-0x0-1x1-1x1-0-NCHW-FP32-B=miopenConvolutionBwdDataAlgoDirect:ConvAsm1x1U,39,2221,0,miopenConvolutionBwdDataAlgoDirect;miopenConvolutionBwdDataAlgoWinograd:ConvBinWinogradRxSf3x2,185,225,0,miopenConvolutionBwdDataAlgoWinograd;miopenConvolutionBwdDataAlgoGEMM:gemm,384,762,0,MIOpenGEMM
256-1-1-1x1-2048-1-1-32-0x0-1x1-1x1-0-NCHW-FP32-B=miopenConvolutionBwdDataAlgoDirect:ConvAsm1x1U,0,382238,0,miopenConvolutionBwdDataAlgoDirect;miopenConvolutionBwdDataAlgoWinograd:ConvBinWinogradRxS,0,700432,0,miopenConvolutionBwdDataAlgoWinograd;miopenConvolutionBwdDataAlgoImplicitGEMM:ConvHipImplicitGemmBwdDataV1R1,5,32111,0,miopenConvolutionBwdDataAlgoImplicitGEMM;miopenConvolutionBwdDataAlgoGEMM:gemm,300,669,0,MIOpenGEMM
512-28-28-1x1-2048-28-28-32-0x0-1x1-1x1-0-NCHW-FP32-F=miopenConvolutionFwdAlgoDirect:ConvAsm1x1U,55,6916,0,miopenConvolutionFwdAlgoDirect;miopenConvolutionFwdAlgoWinograd:ConvBinWinogradRxS,177,817,0,miopenConvolutionFwdAlgoWinograd;miopenConvolutionFwdAlgoGEMM:GemmFwd1x1_0_1,271,473,0,MIOpenGEMM
256-56-56-1x1-64-56-56-32-0x0-1x1-1x1-0-NCHW-FP32-F=miopenConvolutionFwdAlgoDirect:ConvOclDirectFwd1x1,1,56872,0,miopenConvolutionFwdAlgoDirect;miopenConvolutionFwdAlgoGEMM:GemmFwd1x1_0_1,55,2856,0,MIOpenGEMM
256-28-28-1x1-1024-28-28-32-0x0-1x1-1x1-0-NCHW-FP32-B=miopenConvolutionBwdDataAlgoDirect:ConvAsm1x1U,5,24632,0,miopenConvolutionBwdDataAlgoDirect;miopenConvolutionBwdDataAlgoWinograd:ConvBinWinogradRxSf3x2,61,7213,0,miopenConvolutionBwdDataAlgoWinograd;miopenConvolutionBwdDataAlgoGEMM:gemm,198,318,0,MIOpenGEMM
64-56-56-1x1-64-56-56-32-0x0-1x1-1x1-0-NCHW-FP32-B=miopenConvolutionBwdDataAlgoDirect:ConvAsm1x1U,0,395702,0,miopenConvolutionBwdDataAlgoDirect;miopenConvolutionBwdDataAlgoGEMM:gemm,50,3354,0,MIOpenGEMM
1024-28-28-1x1-256-28-28-32-0x0-1x1-1x1-0-NCHW-FP32-W=miopenConvolutionBwdWeightsAlgoDirect:ConvAsmBwdWrW1x1,21,3584,0,miopenConvolutionBwdWeightsAlgoDirect;miopenConvolutionBwdWeightsAlgoWinograd:ConvBinWinogradRxSf2x3,161,606,0,miopenConvolutionBwdWeightsAlgoWinograd;miopenConvolutionBwdWeightsAlgoGEMM:gemm,261,352,0,MIOpenGEMM
256-28-28-1x1-81-28-28-400-0x0-1x1-1x1-0-NCHW-FP32-F=miopenConvolutionFwdAlgoDirect:ConvAsm1x1U,21,7663,0,miopenConvolutionFwdAlgoDirect;miopenConvolutionFwdAlgoWinograd:ConvBinWinogradRxSf3x2,99,8164,0,miopenConvolutionFwdAlgoWinograd;miopenConvolutionFwdAlgoGEMM:GemmFwd1x1_0_1,1208,36,0,MIOpenGEMM
64-56-56-1x1-64-56-56-32-0x0-1x1-1x1-0-NCHW-FP32-F=miopenConvolutionFwdAlgoWinograd:ConvBinWinogradRxSf2x3,0,988522,0,miopenConvolutionFwdAlgoWinograd;miopenConvolutionFwdAlgoGEMM:GemmFwd1x1_0_1,30,5787,0,MIOpenGEMM
2048-1-1-1x1-256-1-1-32-0x0-1x1-1x1-0-NCHW-FP32-F=miopenConvolutionFwdAlgoDirect:ConvOclDirectFwd1x1,0,896705,0,miopenConvolutionFwdAlgoDirect;miopenConvolutionFwdAlgoWinograd:ConvBinWinogradRxSf2x3,1,7625,0,miopenConvolutionFwdAlgoWinograd;miopenConvolutionFwdAlgoImplicitGEMM:ConvHipImplicitGemmV4R1Fwd,11,3802,0,miopenConvolutionFwdAlgoImplicitGEMM;miopenConvolutionFwdAlgoGEMM:GemmFwd1x1_0_1,186,801,0,MIOpenGEMM
