src/kernels/gfx906_64.OpenCL.fdb.txt
64-112-112-7x7-3-224-224-32-3x3-2x2-1x1-0-NCHW-FP32-W=miopenConvolutionBwdWeightsAlgoDirect:ConvOclBwdWrW2<1>,2.31933,1204224,miopenConvolutionBwdWeightsAlgoDirect,<unused>;miopenConvolutionBwdWeightsAlgoGEMM:gemm,6.02447,7375872,MIOpenGEMM,1_0_12544_12544_147_147_64_12544
128-56-56-1x1-64-56-56-32-0x0-1x1-1x1-0-NCHW-FP32-B=miopenConvolutionBwdDataAlgoWinograd:ConvBinWinogradRxSf3x2,0.411457,0,miopenConvolutionBwdDataAlgoWinograd,<unused>
2048-7-7-1x1-1024-7-7-32-0x0-1x1-1x1-0-NCHW-FP32-B=miopenConvolutionBwdDataAlgoDirect:ConvAsm1x1U,0.967418,0,miopenConvolutionBwdDataAlgoDirect,<unused>;miopenConvolutionBwdDataAlgoImplicitGEMM:ConvHipImplicitGemmBwdDataV1R1,1.25322,0,miopenConvolutionBwdDataAlgoImplicitGEMM,2048x7x7x1x1x1024x7x7x32xNCHWxFP32x0x0x1x1x1x1x1x0;miopenConvolutionBwdDataAlgoWinograd:ConvBinWinogradRxSf3x2,2.21871,0,miopenConvolutionBwdDataAlgoWinograd,<unused>;miopenConvolutionBwdDataAlgoGEMM:gemm,4.02293,0,MIOpenGEMM,0_1_49_1024_49_49_1024_2048
1024-14-14-3x3-1024-14-14-32-1x1-1x1-1x1-0-NCHW-FP32-W_g64=miopenConvolutionBwdWeightsAlgoDirect:ConvAsmBwdWrW3x3,0.401128,0,miopenConvolutionBwdWeightsAlgoDirect,<unused>;miopenConvolutionBwdWeightsAlgoWinograd:ConvBinWinogradRxSf2x3,1.37242,0,miopenConvolutionBwdWeightsAlgoWinograd,1024x14x14x3x3x1024x14x14x32xNCHWxFP32x1x1x1x1x1x1x64x0;miopenConvolutionBwdWeightsAlgoGEMM:gemm,21.2457,7225344,MIOpenGEMM,1_0_196_196_144_144_16_196
3-224-224-7x7-64-112-112-32-3x3-2x2-1x1-0-NCHW-FP32-F=miopenConvolutionFwdAlgoDirect:ConvAsm7x7c3h224w224k64u2v2p3q3f1,0.73083,0,miopenConvolutionFwdAlgoDirect,<unused>;miopenConvolutionFwdAlgoWinograd:ConvBinWinogradRxS,1.06212,0,miopenConvolutionFwdAlgoWinograd,<unused>;miopenConvolutionFwdAlgoGEMM:GemmFwdRest,1.84397,7375872,MIOpenGEMM,0_0_12544_147_12544_12544_64_147
1024-14-14-3x3-1024-14-14-32-1x1-1x1-1x1-0-NCHW-FP32-B_g64=miopenConvolutionBwdDataAlgoWinograd:ConvBinWinogradRxSf2x3,0.34886,0,miopenConvolutionBwdDataAlgoWinograd,<unused>;miopenConvolutionBwdDataAlgoDirect:ConvOclDirectFwd,0.555307,0,miopenConvolutionBwdDataAlgoDirect,<unused>;miopenConvolutionBwdDataAlgoGEMM:gemm,12.6481,7225344,MIOpenGEMM,0_1_196_144_196_196_144_16
1024-7-7-1x1-2048-7-7-32-0x0-1x1-1x1-0-NCHW-FP32-W=miopenConvolutionBwdWeightsAlgoDirect:ConvAsmBwdWrW1x1,1.0979,0,miopenConvolutionBwdWeightsAlgoDirect,<unused>;miopenConvolutionBwdWeightsAlgoGEMM:gemm,1.71778,0,MIOpenGEMM,1_0_49_49_2048_2048_1024_49;miopenConvolutionBwdWeightsAlgoWinograd:ConvBinWinogradRxSf2x3,3.14276,0,miopenConvolutionBwdWeightsAlgoWinograd,1024x7x7x1x1x2048x7x7x32xNCHWxFP32x0x0x1x1x1x1x1x0
512-28-28-1x1-256-28-28-32-0x0-1x1-1x1-0-NCHW-FP32-F=miopenConvolutionFwdAlgoDirect:ConvAsm1x1U,0.883351,0,miopenConvolutionFwdAlgoDirect,<unused>;miopenConvolutionFwdAlgoWinograd:ConvBinWinogradRxSf3x2,1.4627,0,miopenConvolutionFwdAlgoWinograd,<unused>;miopenConvolutionFwdAlgoGEMM:GemmFwd1x1_0_1,1.5492,0,MIOpenGEMM,0_0_784_512_784_784_256_512
256-56-56-1x1-256-56-56-32-0x0-1x1-1x1-0-NCHW-FP32-F=miopenConvolutionFwdAlgoImplicitGEMM:ConvHipImplicitGemmV4R4Fwd,1.27361,0,miopenConvolutionFwdAlgoImplicitGEMM,256x56x56x1x1x256x56x56x32xNCHWxFP32x0x0x1x1x1x1x1x1;miopenConvolutionFwdAlgoDirect:ConvAsm1x1U,2.05184,0,miopenConvolutionFwdAlgoDirect,<unused>;miopenConvolutionFwdAlgoGEMM:GemmFwd1x1_0_1,2.0848,0,MIOpenGEMM,0_0_3136_256_3136_3136_256_256;miopenConvolutionFwdAlgoWinograd:ConvBinWinogradRxSf3x2,2.75733,0,miopenConvolutionFwdAlgoWinograd,<unused>
512-28-28-1x1-256-56-56-32-0x0-2x2-1x1-0-NCHW-FP32-W=miopenConvolutionBwdWeightsAlgoDirect:ConvOclBwdWrW1x1,1.26136,25690112,miopenConvolutionBwdWeightsAlgoDirect,<unused>;miopenConvolutionBwdWeightsAlgoImplicitGEMM:ConvHipImplicitGemmV4R1WrW,3.60179,0,miopenConvolutionBwdWeightsAlgoImplicitGEMM,512x28x28x1x1x256x56x56x32xNCHWxFP32x0x0x2x2x1x1x1x0;miopenConvolutionBwdWeightsAlgoGEMM:gemm,4.11533,802816,MIOpenGEMM,1_0_784_784_256_256_512_784
1024-14-14-3x3-1024-14-14-32-1x1-1x1-1x1-0-NCHW-FP32-F_g64=miopenConvolutionFwdAlgoWinograd:ConvBinWinogradRxSf2x3,0.304913,0,miopenConvolutionFwdAlgoWinograd,<unused>;miopenConvolutionFwdAlgoDirect:ConvOclDirectFwd,0.535031,0,miopenConvolutionFwdAlgoDirect,<unused>;miopenConvolutionFwdAlgoImplicitGEMM:ConvHipImplicitGemmV4R1Fwd,0.675122,0,miopenConvolutionFwdAlgoImplicitGEMM,1024x14x14x3x3x1024x14x14x32xNCHWxFP32x1x1x1x1x1x1x64x1;miopenConvolutionFwdAlgoGEMM:GemmFwdRest,23.8527,7225344,MIOpenGEMM,0_0_196_144_196_196_16_144
1024-7-7-1x1-2048-7-7-32-0x0-1x1-1x1-0-NCHW-FP32-B=miopenConvolutionBwdDataAlgoDirect:ConvAsm1x1U,0.920219,0,miopenConvolutionBwdDataAlgoDirect,<unused>;miopenConvolutionBwdDataAlgoImplicitGEMM:ConvHipImplicitGemmBwdDataV1R1,1.05055,0,miopenConvolutionBwdDataAlgoImplicitGEMM,1024x7x7x1x1x2048x7x7x32xNCHWxFP32x0x0x1x1x1x1x1x0;miopenConvolutionBwdDataAlgoWinograd:ConvBinWinogradRxSf3x2,2.11768,0,miopenConvolutionBwdDataAlgoWinograd,<unused>;miopenConvolutionBwdDataAlgoGEMM:gemm,2.89583,0,MIOpenGEMM,0_1_49_2048_49_49_2048_1024
64-56-56-1x1-128-56-56-32-0x0-1x1-1x1-0-NCHW-FP32-F=miopenConvolutionFwdAlgoDirect:ConvOclDirectFwd1x1,0.347466,0,miopenConvolutionFwdAlgoDirect,<unused>
1024-14-14-1x1-512-28-28-32-0x0-2x2-1x1-0-NCHW-FP32-W=miopenConvolutionBwdWeightsAlgoImplicitGEMM:ConvHipImplicitGemmV4R1WrW,0.951911,0,miopenConvolutionBwdWeightsAlgoImplicitGEMM,1024x14x14x1x1x512x28x28x32xNCHWxFP32x0x0x2x2x1x1x1x0;miopenConvolutionBwdWeightsAlgoDirect:ConvAsmBwdWrW1x1,1.14654,12845056,miopenConvolutionBwdWeightsAlgoDirect,<unused>;miopenConvolutionBwdWeightsAlgoGEMM:gemm,2.05913,401408,MIOpenGEMM,1_0_196_196_512_512_1024_196
512-28-28-1x1-256-56-56-32-0x0-2x2-1x1-0-NCHW-FP32-B=miopenConvolutionBwdDataAlgoDirect:ConvAsm1x1UV2,0.982386,0,miopenConvolutionBwdDataAlgoDirect,<unused>;miopenConvolutionBwdDataAlgoGEMM:gemm,1.18804,77070336,MIOpenGEMM,0_1_25088_256_25088_25088_256_512;miopenConvolutionBwdDataAlgoImplicitGEMM:ConvHipImplicitGemmBwdDataV4R1,1.54635,0,miopenConvolutionBwdDataAlgoImplicitGEMM,512x28x28x1x1x256x56x56x32xNCHWxFP32x0x0x2x2x1x1x1x0;miopenConvolutionBwdDataAlgoWinograd:ConvBinWinogradRxSf2x3,5.62011,0,miopenConvolutionBwdDataAlgoWinograd,<unused>
128-56-56-1x1-256-56-56-32-0x0-1x1-1x1-0-NCHW-FP32-W=miopenConvolutionBwdWeightsAlgoDirect:ConvAsmBwdWrW1x1,1.33913,0,miopenConvolutionBwdWeightsAlgoDirect,<unused>
1024-7-7-1x1-2048-7-7-32-0x0-1x1-1x1-0-NCHW-FP32-F=miopenConvolutionFwdAlgoDirect:ConvAsm1x1U,1.54051,0,miopenConvolutionFwdAlgoDirect,<unused>;miopenConvolutionFwdAlgoImplicitGEMM:ConvHipImplicitGemmV4R1Fwd,1.74127,0,miopenConvolutionFwdAlgoImplicitGEMM,1024x7x7x1x1x2048x7x7x32xNCHWxFP32x0x0x1x1x1x1x1x1;miopenConvolutionFwdAlgoWinograd:ConvBinWinogradRxSf3x2,2.22332,0,miopenConvolutionFwdAlgoWinograd,<unused>;miopenConvolutionFwdAlgoGEMM:GemmFwd1x1_0_1,3.19874,0,MIOpenGEMM,0_0_49_1024_49_49_2048_1024
1024-14-14-1x1-1024-14-14-32-0x0-1x1-1x1-0-NCHW-FP32-W=miopenConvolutionBwdWeightsAlgoDirect:ConvAsmBwdWrW1x1,1.50364,0,miopenConvolutionBwdWeightsAlgoDirect,<unused>;miopenConvolutionBwdWeightsAlgoGEMM:gemm,2.98003,0,MIOpenGEMM,1_0_196_196_1024_1024_1024_196;miopenConvolutionBwdWeightsAlgoWinograd:ConvBinWinogradRxSf2x3,6.42235,0,miopenConvolutionBwdWeightsAlgoWinograd,1024x14x14x1x1x1024x14x14x32xNCHWxFP32x0x0x1x1x1x1x1x0
256-56-56-1x1-256-56-56-32-0x0-1x1-1x1-0-NCHW-FP32-B=miopenConvolutionBwdDataAlgoDirect:ConvAsm1x1U,1.70507,0,miopenConvolutionBwdDataAlgoDirect,<unused>;miopenConvolutionBwdDataAlgoGEMM:gemm,2.1038,0,MIOpenGEMM,0_1_3136_256_3136_3136_256_256;miopenConvolutionBwdDataAlgoWinograd:ConvBinWinogradRxSf3x2,2.79042,0,miopenConvolutionBwdDataAlgoWinograd,<unused>
512-28-28-1x1-512-28-28-32-0x0-1x1-1x1-0-NCHW-FP32-B=miopenConvolutionBwdDataAlgoDirect:ConvAsm1x1U,1.73359,0,miopenConvolutionBwdDataAlgoDirect,<unused>;miopenConvolutionBwdDataAlgoGEMM:gemm,2.43383,0,MIOpenGEMM,0_1_784_512_784_784_512_512;miopenConvolutionBwdDataAlgoWinograd:ConvBinWinogradRxSf3x2,2.90817,0,miopenConvolutionBwdDataAlgoWinograd,<unused>
256-56-56-3x3-256-56-56-32-1x1-1x1-1x1-0-NCHW-FP32-W_g32=miopenConvolutionBwdWeightsAlgoDirect:ConvAsmBwdWrW3x3,1.38563,0,miopenConvolutionBwdWeightsAlgoDirect,<unused>;miopenConvolutionBwdWeightsAlgoWinograd:ConvBinWinogradRxSf2x3,4.88587,0,miopenConvolutionBwdWeightsAlgoWinograd,256x56x56x3x3x256x56x56x32xNCHWxFP32x1x1x1x1x1x1x32x0;miopenConvolutionBwdWeightsAlgoGEMM:gemm,21.0922,28901376,MIOpenGEMM,1_0_3136_3136_72_72_8_3136
2048-7-7-1x1-2048-7-7-32-0x0-1x1-1x1-0-NCHW-FP32-B=miopenConvolutionBwdDataAlgoDirect:ConvAsm1x1U,1.48595,0,miopenConvolutionBwdDataAlgoDirect,<unused>;miopenConvolutionBwdDataAlgoImplicitGEMM:ConvHipImplicitGemmBwdDataV1R1,1.53016,0,miopenConvolutionBwdDataAlgoImplicitGEMM,2048x7x7x1x1x2048x7x7x32xNCHWxFP32x0x0x1x1x1x1x1x0;miopenConvolutionBwdDataAlgoWinograd:ConvBinWinogradRxSf3x2,3.95567,0,miopenConvolutionBwdDataAlgoWinograd,<unused>;miopenConvolutionBwdDataAlgoGEMM:gemm,4.86071,0,MIOpenGEMM,0_1_49_2048_49_49_2048_2048
1024-14-14-1x1-2048-7-7-32-0x0-2x2-1x1-0-NCHW-FP32-F=miopenConvolutionFwdAlgoGEMM:GemmFwd1x1_0_2,0.919836,19267584,MIOpenGEMM,0_0_1568_1024_1568_1568_2048_1024;miopenConvolutionFwdAlgoDirect:ConvAsm1x1U,1.26951,6422528,miopenConvolutionFwdAlgoDirect,<unused>;miopenConvolutionFwdAlgoImplicitGEMM:ConvHipImplicitGemmV4R1Fwd,1.89942,0,miopenConvolutionFwdAlgoImplicitGEMM,1024x14x14x1x1x2048x7x7x32xNCHWxFP32x0x0x2x2x1x1x1x1;miopenConvolutionFwdAlgoWinograd:ConvBinWinogradRxS,6.10066,0,miopenConvolutionFwdAlgoWinograd,<unused>
256-56-56-1x1-64-56-56-32-0x0-1x1-1x1-0-NCHW-FP32-W=miopenConvolutionBwdWeightsAlgoDirect:ConvAsmBwdWrW1x1,0.689976,0,miopenConvolutionBwdWeightsAlgoDirect,<unused>
1024-7-7-3x3-1024-7-7-32-1x1-1x1-1x1-0-NCHW-FP32-W_g32=miopenConvolutionBwdWeightsAlgoDirect:ConvAsmBwdWrW3x3,0.133091,0,miopenConvolutionBwdWeightsAlgoDirect,<unused>;miopenConvolutionBwdWeightsAlgoWinograd:ConvBinWinogradRxSf2x3,0.533793,0,miopenConvolutionBwdWeightsAlgoWinograd,1024x7x7x3x3x1024x7x7x32xNCHWxFP32x1x1x1x1x1x1x32x0;miopenConvolutionBwdWeightsAlgoGEMM:gemm,5.81548,1806336,MIOpenGEMM,1_0_49_49_288_288_32_49
256-56-56-1x1-512-28-28-32-0x0-2x2-1x1-0-NCHW-FP32-F=miopenConvolutionFwdAlgoImplicitGEMM:ConvHipImplicitGemmV4R4Fwd,0.99207,0,miopenConvolutionFwdAlgoImplicitGEMM,256x56x56x1x1x512x28x28x32xNCHWxFP32x0x0x2x2x1x1x1x1;miopenConvolutionFwdAlgoGEMM:GemmFwd1x1_0_2,1.06361,77070336,MIOpenGEMM,0_0_25088_256_25088_25088_512_256;miopenConvolutionFwdAlgoDirect:ConvAsm1x1UV2,1.08562,0,miopenConvolutionFwdAlgoDirect,<unused>;miopenConvolutionFwdAlgoWinograd:ConvBinWinogradRxSf2x3,5.13975,0,miopenConvolutionFwdAlgoWinograd,<unused>
128-56-56-1x1-256-56-56-32-0x0-1x1-1x1-0-NCHW-FP32-B=miopenConvolutionBwdDataAlgoDirect:ConvAsm1x1U,0.90504,0,miopenConvolutionBwdDataAlgoDirect,<unused>;miopenConvolutionBwdDataAlgoWinograd:ConvBinWinogradRxSf3x2,1.40664,0,miopenConvolutionBwdDataAlgoWinograd,<unused>;miopenConvolutionBwdDataAlgoGEMM:gemm,1.58554,0,MIOpenGEMM,0_1_3136_256_3136_3136_256_128
256-56-56-3x3-256-56-56-32-1x1-1x1-1x1-0-NCHW-FP32-B_g32=miopenConvolutionBwdDataAlgoDirect:ConvAsm3x3U,0.547803,0,miopenConvolutionBwdDataAlgoDirect,<unused>;miopenConvolutionBwdDataAlgoWinograd:ConvBinWinogradRxSf2x3,1.64803,0,miopenConvolutionBwdDataAlgoWinograd,<unused>;miopenConvolutionBwdDataAlgoGEMM:gemm,12.1538,28901376,MIOpenGEMM,0_1_3136_72_3136_3136_72_8
1024-14-14-1x1-1024-14-14-32-0x0-1x1-1x1-0-NCHW-FP32-B=miopenConvolutionBwdDataAlgoImplicitGEMM:ConvHipImplicitGemmBwdDataV1R1,1.40611,0,miopenConvolutionBwdDataAlgoImplicitGEMM,1024x14x14x1x1x1024x14x14x32xNCHWxFP32x0x0x1x1x1x1x1x0;miopenConvolutionBwdDataAlgoDirect:ConvAsm1x1U,1.69218,0,miopenConvolutionBwdDataAlgoDirect,<unused>;miopenConvolutionBwdDataAlgoWinograd:ConvBinWinogradRxSf3x2,2.76268,0,miopenConvolutionBwdDataAlgoWinograd,<unused>;miopenConvolutionBwdDataAlgoGEMM:gemm,3.39598,0,MIOpenGEMM,0_1_196_1024_196_196_1024_1024
1024-7-7-3x3-1024-7-7-32-1x1-1x1-1x1-0-NCHW-FP32-B_g32=miopenConvolutionBwdDataAlgoWinograd:ConvBinWinogradRxSf2x3,0.15333,0,miopenConvolutionBwdDataAlgoWinograd,<unused>;miopenConvolutionBwdDataAlgoDirect:ConvOclDirectFwd,0.363287,0,miopenConvolutionBwdDataAlgoDirect,<unused>;miopenConvolutionBwdDataAlgoGEMM:gemm,6.33941,1806336,MIOpenGEMM,0_1_49_288_49_49_288_32
2048-14-14-3x3-2048-7-7-32-1x1-2x2-1x1-0-NCHW-FP32-F_g64=miopenConvolutionFwdAlgoImplicitGEMM:ConvHipImplicitGemmV4R1Fwd,0.593255,0,miopenConvolutionFwdAlgoImplicitGEMM,2048x14x14x3x3x2048x7x7x32xNCHWxFP32x1x1x2x2x1x1x64x1;miopenConvolutionFwdAlgoWinograd:ConvBinWinogradRxSf2x3,0.630314,0,miopenConvolutionFwdAlgoWinograd,<unused>;miopenConvolutionFwdAlgoDirect:ConvOclDirectFwd,1.28633,0,miopenConvolutionFwdAlgoDirect,<unused>;miopenConvolutionFwdAlgoGEMM:GemmFwdRest,35.6841,3612672,MIOpenGEMM,0_0_49_288_49_49_32_288
256-56-56-1x1-64-56-56-32-0x0-1x1-1x1-0-NCHW-FP32-B=miopenConvolutionBwdDataAlgoWinograd:ConvBinWinogradRxSf3x2,0.689259,0,miopenConvolutionBwdDataAlgoWinograd,<unused>;miopenConvolutionBwdDataAlgoDirect:ConvAsm1x1U,0.929384,0,miopenConvolutionBwdDataAlgoDirect,<unused>
512-14-14-3x3-512-28-28-32-1x1-2x2-1x1-0-NCHW-FP32-W_g32=miopenConvolutionBwdWeightsAlgoDirect:ConvAsmBwdWrW3x3,0.468411,0,miopenConvolutionBwdWeightsAlgoDirect,<unused>;miopenConvolutionBwdWeightsAlgoGEMM:gemm,10.6399,3612672,MIOpenGEMM,1_0_196_196_144_144_16_196
256-56-56-3x3-256-56-56-32-1x1-1x1-1x1-0-NCHW-FP32-F_g32=miopenConvolutionFwdAlgoDirect:ConvAsm3x3U,0.482836,0,miopenConvolutionFwdAlgoDirect,<unused>;miopenConvolutionFwdAlgoWinograd:ConvBinWinogradRxSf2x3,1.57016,0,miopenConvolutionFwdAlgoWinograd,<unused>;miopenConvolutionFwdAlgoGEMM:GemmFwdRest,11.3601,28901376,MIOpenGEMM,0_0_3136_72_3136_3136_8_72
512-28-28-1x1-512-28-28-32-0x0-1x1-1x1-0-NCHW-FP32-F=miopenConvolutionFwdAlgoImplicitGEMM:ConvHipImplicitGemmV4R4Fwd,1.31901,0,miopenConvolutionFwdAlgoImplicitGEMM,512x28x28x1x1x512x28x28x32xNCHWxFP32x0x0x1x1x1x1x1x1;miopenConvolutionFwdAlgoDirect:ConvOclDirectFwd1x1,1.61508,0,miopenConvolutionFwdAlgoDirect,<unused>;miopenConvolutionFwdAlgoGEMM:GemmFwd1x1_0_1,2.4179,0,MIOpenGEMM,0_0_784_512_784_784_512_512;miopenConvolutionFwdAlgoWinograd:ConvBinWinogradRxSf3x2,2.86854,0,miopenConvolutionFwdAlgoWinograd,<unused>
2048-7-7-1x1-1024-7-7-32-0x0-1x1-1x1-0-NCHW-FP32-F=miopenConvolutionFwdAlgoDirect:ConvAsm1x1U,1.33243,0,miopenConvolutionFwdAlgoDirect,<unused>;miopenConvolutionFwdAlgoImplicitGEMM:ConvHipImplicitGemmV4R1Fwd,1.79898,0,miopenConvolutionFwdAlgoImplicitGEMM,2048x7x7x1x1x1024x7x7x32xNCHWxFP32x0x0x1x1x1x1x1x1;miopenConvolutionFwdAlgoWinograd:ConvBinWinogradRxSf3x2,2.34223,0,miopenConvolutionFwdAlgoWinograd,<unused>;miopenConvolutionFwdAlgoGEMM:GemmFwd1x1_0_1,2.75332,0,MIOpenGEMM,0_0_49_2048_49_49_1024_2048
1024-14-14-1x1-512-28-28-32-0x0-2x2-1x1-0-NCHW-FP32-B=miopenConvolutionBwdDataAlgoDirect:ConvAsm1x1UV2,1.03059,0,miopenConvolutionBwdDataAlgoDirect,<unused>;miopenConvolutionBwdDataAlgoGEMM:gemm,1.13172,38535168,MIOpenGEMM,0_1_6272_512_6272_6272_512_1024;miopenConvolutionBwdDataAlgoWinograd:ConvBinWinogradRxSf2x3,6.32693,0,miopenConvolutionBwdDataAlgoWinograd,<unused>
2048-14-14-1x1-1024-14-14-32-0x0-1x1-1x1-0-NCHW-FP32-W=miopenConvolutionBwdWeightsAlgoDirect:ConvAsmBwdWrW1x1,2.78029,0,miopenConvolutionBwdWeightsAlgoDirect,<unused>;miopenConvolutionBwdWeightsAlgoGEMM:gemm,3.74892,0,MIOpenGEMM,1_0_196_196_1024_1024_2048_196;miopenConvolutionBwdWeightsAlgoWinograd:ConvBinWinogradRxSf2x3,12.7481,0,miopenConvolutionBwdWeightsAlgoWinograd,2048x14x14x1x1x1024x14x14x32xNCHWxFP32x0x0x1x1x1x1x1x0
2048-7-7-1x1-2048-7-7-32-0x0-1x1-1x1-0-NCHW-FP32-F=miopenConvolutionFwdAlgoDirect:ConvAsm1x1U,2.53243,0,miopenConvolutionFwdAlgoDirect,<unused>;miopenConvolutionFwdAlgoImplicitGEMM:ConvHipImplicitGemmV4R4Fwd,2.63548,0,miopenConvolutionFwdAlgoImplicitGEMM,2048x7x7x1x1x2048x7x7x32xNCHWxFP32x0x0x1x1x1x1x1x1;miopenConvolutionFwdAlgoWinograd:ConvBinWinogradRxSf3x2,4.0782,0,miopenConvolutionFwdAlgoWinograd,<unused>;miopenConvolutionFwdAlgoGEMM:GemmFwd1x1_0_1,4.34046,0,MIOpenGEMM,0_0_49_2048_49_49_2048_2048
1024-14-14-1x1-1024-14-14-32-0x0-1x1-1x1-0-NCHW-FP32-F=miopenConvolutionFwdAlgoImplicitGEMM:ConvHipImplicitGemmV4R4Fwd,1.80646,0,miopenConvolutionFwdAlgoImplicitGEMM,1024x14x14x1x1x1024x14x14x32xNCHWxFP32x0x0x1x1x1x1x1x1;miopenConvolutionFwdAlgoDirect:ConvAsm1x1U,1.99407,0,miopenConvolutionFwdAlgoDirect,<unused>;miopenConvolutionFwdAlgoWinograd:ConvBinWinogradRxSf3x2,2.89309,0,miopenConvolutionFwdAlgoWinograd,<unused>;miopenConvolutionFwdAlgoGEMM:GemmFwd1x1_0_1,2.97634,0,MIOpenGEMM,0_0_196_1024_196_196_1024_1024
1024-14-14-3x3-1024-28-28-32-1x1-2x2-1x1-0-NCHW-FP32-W_g64=miopenConvolutionBwdWeightsAlgoDirect:ConvAsmBwdWrW3x3,0.533374,0,miopenConvolutionBwdWeightsAlgoDirect,<unused>;miopenConvolutionBwdWeightsAlgoGEMM:gemm,33.265,7225344,MIOpenGEMM,1_0_196_196_144_144_16_196
2048-7-7-3x3-2048-7-7-32-1x1-1x1-1x1-0-NCHW-FP32-W_g64=miopenConvolutionBwdWeightsAlgoDirect:ConvAsmBwdWrW3x3,0.266782,0,miopenConvolutionBwdWeightsAlgoDirect,<unused>;miopenConvolutionBwdWeightsAlgoWinograd:ConvBinWinogradRxSf2x3,1.28331,0,miopenConvolutionBwdWeightsAlgoWinograd,2048x7x7x3x3x2048x7x7x32xNCHWxFP32x1x1x1x1x1x1x64x0;miopenConvolutionBwdWeightsAlgoGEMM:gemm,35.657,3612672,MIOpenGEMM,1_0_49_49_288_288_32_49
512-14-14-3x3-512-28-28-32-1x1-2x2-1x1-0-NCHW-FP32-B_g32=miopenConvolutionBwdDataAlgoWinograd:ConvBinWinogradRxSf2x3,0.454874,0,miopenConvolutionBwdDataAlgoWinograd,<unused>;miopenConvolutionBwdDataAlgoDirect:ConvOclDirectFwd,0.574711,0,miopenConvolutionBwdDataAlgoDirect,<unused>;miopenConvolutionBwdDataAlgoGEMM:gemm,7.33975,3612672,MIOpenGEMM,0_1_196_144_196_196_144_16
64-56-56-1x1-256-56-56-32-0x0-1x1-1x1-0-NCHW-FP32-F=miopenConvolutionFwdAlgoDirect:ConvOclDirectFwd1x1,0.42084,0,miopenConvolutionFwdAlgoDirect,<unused>;miopenConvolutionFwdAlgoImplicitGEMM:ConvHipImplicitGemmV4R4Fwd,0.566011,0,miopenConvolutionFwdAlgoImplicitGEMM,64x56x56x1x1x256x56x56x32xNCHWxFP32x0x0x1x1x1x1x1x1;miopenConvolutionFwdAlgoGEMM:GemmFwd1x1_0_1,0.651141,0,MIOpenGEMM,0_0_3136_64_3136_3136_256_64;miopenConvolutionFwdAlgoWinograd:ConvBinWinogradRxSf3x2,0.831975,0,miopenConvolutionFwdAlgoWinograd,<unused>
512-28-28-1x1-1024-14-14-32-0x0-2x2-1x1-0-NCHW-FP32-F=miopenConvolutionFwdAlgoGEMM:GemmFwd1x1_0_2,0.789061,38535168,MIOpenGEMM,0_0_6272_512_6272_6272_1024_512;miopenConvolutionFwdAlgoImplicitGEMM:ConvHipImplicitGemmV4R4Fwd,1.01586,0,miopenConvolutionFwdAlgoImplicitGEMM,512x28x28x1x1x1024x14x14x32xNCHWxFP32x0x0x2x2x1x1x1x1;miopenConvolutionFwdAlgoDirect:ConvAsm1x1U,1.29402,12845056,miopenConvolutionFwdAlgoDirect,<unused>;miopenConvolutionFwdAlgoWinograd:ConvBinWinogradRxS,5.19669,0,miopenConvolutionFwdAlgoWinograd,<unused>
256-28-28-3x3-256-56-56-32-1x1-2x2-1x1-0-NCHW-FP32-W_g32=miopenConvolutionBwdWeightsAlgoDirect:ConvAsmBwdWrW3x3,0.3228,0,miopenConvolutionBwdWeightsAlgoDirect,<unused>;miopenConvolutionBwdWeightsAlgoGEMM:gemm,18.6579,7225344,MIOpenGEMM,1_0_784_784_72_72_8_784
256-56-56-1x1-128-56-56-32-0x0-1x1-1x1-0-NCHW-FP32-F=miopenConvolutionFwdAlgoDirect:ConvAsm1x1U,0.808832,0,miopenConvolutionFwdAlgoDirect,<unused>;miopenConvolutionFwdAlgoWinograd:ConvBinWinogradRxSf3x2,1.41506,0,miopenConvolutionFwdAlgoWinograd,<unused>;miopenConvolutionFwdAlgoGEMM:GemmFwd1x1_0_1,1.56968,0,MIOpenGEMM,0_0_3136_256_3136_3136_128_256
256-56-56-1x1-256-56-56-32-0x0-1x1-1x1-0-NCHW-FP32-W=miopenConvolutionBwdWeightsAlgoDirect:ConvAsmBwdWrW1x1,1.942,0,miopenConvolutionBwdWeightsAlgoDirect,<unused>
2048-7-7-3x3-2048-7-7-32-1x1-1x1-1x1-0-NCHW-FP32-B_g64=miopenConvolutionBwdDataAlgoWinograd:ConvBinWinogradRxSf2x3,0.173553,0,miopenConvolutionBwdDataAlgoWinograd,<unused>;miopenConvolutionBwdDataAlgoDirect:ConvOclDirectFwd,0.658691,0,miopenConvolutionBwdDataAlgoDirect,<unused>;miopenConvolutionBwdDataAlgoGEMM:gemm,13.6303,3612672,MIOpenGEMM,0_1_49_288_49_49_288_32
2048-14-14-1x1-1024-14-14-32-0x0-1x1-1x1-0-NCHW-FP32-B=miopenConvolutionBwdDataAlgoImplicitGEMM:ConvHipImplicitGemmBwdDataV4R1,2.65291,0,miopenConvolutionBwdDataAlgoImplicitGEMM,2048x14x14x1x1x1024x14x14x32xNCHWxFP32x0x0x1x1x1x1x1x0;miopenConvolutionBwdDataAlgoDirect:ConvAsm1x1U,3.28705,0,miopenConvolutionBwdDataAlgoDirect,<unused>;miopenConvolutionBwdDataAlgoGEMM:gemm,5.1321,0,MIOpenGEMM,0_1_196_1024_196_196_1024_2048;miopenConvolutionBwdDataAlgoWinograd:ConvBinWinogradRxSf3x2,5.50158,0,miopenConvolutionBwdDataAlgoWinograd,<unused>
1024-7-7-3x3-1024-7-7-32-1x1-1x1-1x1-0-NCHW-FP32-F_g32=miopenConvolutionFwdAlgoWinograd:ConvBinWinogradRxSf2x3,0.117985,0,miopenConvolutionFwdAlgoWinograd,<unused>;miopenConvolutionFwdAlgoDirect:ConvOclDirectFwd,0.336307,0,miopenConvolutionFwdAlgoDirect,<unused>;miopenConvolutionFwdAlgoImplicitGEMM:ConvHipImplicitGemmV4R1Fwd,0.337625,0,miopenConvolutionFwdAlgoImplicitGEMM,1024x7x7x3x3x1024x7x7x32xNCHWxFP32x1x1x1x1x1x1x32x1;miopenConvolutionFwdAlgoGEMM:GemmFwdRest,19.2729,1806336,MIOpenGEMM,0_0_49_288_49_49_32_288
256-28-28-3x3-256-56-56-32-1x1-2x2-1x1-0-NCHW-FP32-B_g32=miopenConvolutionBwdDataAlgoWinograd:ConvBinWinogradRxSf2x3,0.895118,0,miopenConvolutionBwdDataAlgoWinograd,<unused>;miopenConvolutionBwdDataAlgoDirect:ConvOclDirectFwd,0.974277,0,miopenConvolutionBwdDataAlgoDirect,<unused>;miopenConvolutionBwdDataAlgoGEMM:gemm,7.21928,7225344,MIOpenGEMM,0_1_784_72_784_784_72_8
1024-14-14-3x3-1024-28-28-32-1x1-2x2-1x1-0-NCHW-FP32-B_g64=miopenConvolutionBwdDataAlgoDirect:ConvOclDirectFwd,0.890552,0,miopenConvolutionBwdDataAlgoDirect,<unused>;miopenConvolutionBwdDataAlgoWinograd:ConvBinWinogradRxSf2x3,0.907729,0,miopenConvolutionBwdDataAlgoWinograd,<unused>;miopenConvolutionBwdDataAlgoGEMM:gemm,15.7608,7225344,MIOpenGEMM,0_1_196_144_196_196_144_16
256-56-56-1x1-128-56-56-32-0x0-1x1-1x1-0-NCHW-FP32-W=miopenConvolutionBwdWeightsAlgoDirect:ConvAsmBwdWrW1x1,1.36082,0,miopenConvolutionBwdWeightsAlgoDirect,<unused>
2048-7-7-3x3-2048-14-14-32-1x1-2x2-1x1-0-NCHW-FP32-W_g32=miopenConvolutionBwdWeightsAlgoDirect:ConvAsmBwdWrW3x3,0.56299,0,miopenConvolutionBwdWeightsAlgoDirect,<unused>;miopenConvolutionBwdWeightsAlgoImplicitGEMM:ConvHipImplicitGemmV4R1WrW,0.676564,0,miopenConvolutionBwdWeightsAlgoImplicitGEMM,2048x7x7x3x3x2048x14x14x32xNCHWxFP32x1x1x2x2x1x1x32x0;miopenConvolutionBwdWeightsAlgoGEMM:gemm,6.90341,3612672,MIOpenGEMM,1_0_49_49_576_576_64_49
256-56-56-3x3-256-28-28-32-1x1-2x2-1x1-0-NCHW-FP32-F_g32=miopenConvolutionFwdAlgoWinograd:ConvBinWinogradRxSf2x3,0.980325,0,miopenConvolutionFwdAlgoWinograd,<unused>;miopenConvolutionFwdAlgoDirect:ConvOclDirectFwd,1.45914,0,miopenConvolutionFwdAlgoDirect,<unused>;miopenConvolutionFwdAlgoGEMM:GemmFwdRest,9.51574,7225344,MIOpenGEMM,0_0_784_72_784_784_8_72
512-56-56-1x1-256-56-56-32-0x0-1x1-1x1-0-NCHW-FP32-W=miopenConvolutionBwdWeightsAlgoGEMM:gemm,3.35319,0,MIOpenGEMM,1_0_3136_3136_256_256_512_3136;miopenConvolutionBwdWeightsAlgoWinograd:ConvBinWinogradRxSf2x3,14.4351,0,miopenConvolutionBwdWeightsAlgoWinograd,512x56x56x1x1x256x56x56x32xNCHWxFP32x0x0x1x1x1x1x1x0
2048-7-7-3x3-2048-14-14-32-1x1-2x2-1x1-0-NCHW-FP32-B_g32=miopenConvolutionBwdDataAlgoWinograd:ConvBinWinogradRxSf2x3,1.17612,0,miopenConvolutionBwdDataAlgoWinograd,<unused>;miopenConvolutionBwdDataAlgoDirect:ConvOclDirectFwd,6.09359,0,miopenConvolutionBwdDataAlgoDirect,<unused>;miopenConvolutionBwdDataAlgoGEMM:gemm,9.33954,3612672,MIOpenGEMM,0_1_49_576_49_49_576_64
512-14-14-1x1-1024-14-14-32-0x0-1x1-1x1-0-NCHW-FP32-W=miopenConvolutionBwdWeightsAlgoDirect:ConvAsmBwdWrW1x1,0.895872,0,miopenConvolutionBwdWeightsAlgoDirect,<unused>;miopenConvolutionBwdWeightsAlgoGEMM:gemm,1.85239,0,MIOpenGEMM,1_0_196_196_1024_1024_512_196;miopenConvolutionBwdWeightsAlgoWinograd:ConvBinWinogradRxSf2x3,2.79405,0,miopenConvolutionBwdWeightsAlgoWinograd,512x14x14x1x1x1024x14x14x32xNCHWxFP32x0x0x1x1x1x1x1x0
1024-14-14-1x1-2048-14-14-32-0x0-1x1-1x1-0-NCHW-FP32-F=miopenConvolutionFwdAlgoDirect:ConvAsm1x1U,4.13833,0,miopenConvolutionFwdAlgoDirect,<unused>;miopenConvolutionFwdAlgoGEMM:GemmFwd1x1_0_1,4.91819,0,MIOpenGEMM,0_0_196_1024_196_196_2048_1024;miopenConvolutionFwdAlgoWinograd:ConvBinWinogradRxSf3x2,5.46623,0,miopenConvolutionFwdAlgoWinograd,<unused>
512-28-28-3x3-512-14-14-32-1x1-2x2-1x1-0-NCHW-FP32-F_g32=miopenConvolutionFwdAlgoWinograd:ConvBinWinogradRxSf2x3,0.44086,0,miopenConvolutionFwdAlgoWinograd,<unused>;miopenConvolutionFwdAlgoImplicitGEMM:ConvHipImplicitGemmV4R1Fwd,0.625872,0,miopenConvolutionFwdAlgoImplicitGEMM,512x28x28x3x3x512x14x14x32xNCHWxFP32x1x1x2x2x1x1x32x1;miopenConvolutionFwdAlgoDirect:ConvOclDirectFwd,0.743753,0,miopenConvolutionFwdAlgoDirect,<unused>;miopenConvolutionFwdAlgoGEMM:GemmFwdRest,11.7282,3612672,MIOpenGEMM,0_0_196_144_196_196_16_144
256-56-56-1x1-128-56-56-32-0x0-1x1-1x1-0-NCHW-FP32-B=miopenConvolutionBwdDataAlgoDirect:ConvAsm1x1U,1.04536,0,miopenConvolutionBwdDataAlgoDirect,<unused>;miopenConvolutionBwdDataAlgoWinograd:ConvBinWinogradRxSf3x2,1.40817,0,miopenConvolutionBwdDataAlgoWinograd,<unused>;miopenConvolutionBwdDataAlgoGEMM:gemm,1.66929,0,MIOpenGEMM,0_1_3136_128_3136_3136_128_256
512-28-28-3x3-512-56-56-32-1x1-2x2-1x1-0-NCHW-FP32-W_g64=miopenConvolutionBwdWeightsAlgoDirect:ConvAsmBwdWrW3x3,1.0315,0,miopenConvolutionBwdWeightsAlgoDirect,<unused>;miopenConvolutionBwdWeightsAlgoGEMM:gemm,41.3046,14450688,MIOpenGEMM,1_0_784_784_72_72_8_784
512-28-28-1x1-256-28-28-32-0x0-1x1-1x1-0-NCHW-FP32-W=miopenConvolutionBwdWeightsAlgoDirect:ConvAsmBwdWrW1x1,0.746839,0,miopenConvolutionBwdWeightsAlgoDirect,<unused>;miopenConvolutionBwdWeightsAlgoWinograd:ConvBinWinogradRxSf2x3,3.26638,0,miopenConvolutionBwdWeightsAlgoWinograd,512x28x28x1x1x256x28x28x32xNCHWxFP32x0x0x1x1x1x1x1x0;miopenConvolutionBwdWeightsAlgoGEMM:gemm,3.52112,0,MIOpenGEMM,1_0_784_784_256_256_512_784
512-14-14-1x1-1024-14-14-32-0x0-1x1-1x1-0-NCHW-FP32-B=miopenConvolutionBwdDataAlgoDirect:ConvAsm1x1U,1.07451,0,miopenConvolutionBwdDataAlgoDirect,<unused>;miopenConvolutionBwdDataAlgoWinograd:ConvBinWinogradRxSf3x2,1.51736,0,miopenConvolutionBwdDataAlgoWinograd,<unused>;miopenConvolutionBwdDataAlgoGEMM:gemm,2.10338,0,MIOpenGEMM,0_1_196_1024_196_196_1024_512
512-14-14-3x3-512-14-14-32-1x1-1x1-1x1-0-NCHW-FP32-W_g32=miopenConvolutionBwdWeightsAlgoDirect:ConvAsmBwdWrW3x3,0.216661,0,miopenConvolutionBwdWeightsAlgoDirect,<unused>;miopenConvolutionBwdWeightsAlgoWinograd:ConvBinWinogradRxSf2x3,0.818868,0,miopenConvolutionBwdWeightsAlgoWinograd,512x14x14x3x3x512x14x14x32xNCHWxFP32x1x1x1x1x1x1x32x0;miopenConvolutionBwdWeightsAlgoGEMM:gemm,14.2024,3612672,MIOpenGEMM,1_0_196_196_144_144_16_196
512-56-56-1x1-256-56-56-32-0x0-1x1-1x1-0-NCHW-FP32-B=miopenConvolutionBwdDataAlgoDirect:ConvAsm1x1U,2.55998,0,miopenConvolutionBwdDataAlgoDirect,<unused>;miopenConvolutionBwdDataAlgoImplicitGEMM:ConvHipImplicitGemmBwdDataV4R1,2.64485,0,miopenConvolutionBwdDataAlgoImplicitGEMM,512x56x56x1x1x256x56x56x32xNCHWxFP32x0x0x1x1x1x1x1x0;miopenConvolutionBwdDataAlgoWinograd:ConvBinWinogradRxSf3x2,5.0352,0,miopenConvolutionBwdDataAlgoWinograd,<unused>;miopenConvolutionBwdDataAlgoGEMM:gemm,5.21296,0,MIOpenGEMM,0_1_3136_256_3136_3136_256_512
2048-14-14-3x3-2048-7-7-32-1x1-2x2-1x1-0-NCHW-FP32-F_g32=miopenConvolutionFwdAlgoImplicitGEMM:ConvHipImplicitGemmV4R1Fwd,0.65249,0,miopenConvolutionFwdAlgoImplicitGEMM,2048x14x14x3x3x2048x7x7x32xNCHWxFP32x1x1x2x2x1x1x32x1;miopenConvolutionFwdAlgoWinograd:ConvBinWinogradRxSf2x3,0.943021,0,miopenConvolutionFwdAlgoWinograd,<unused>;miopenConvolutionFwdAlgoDirect:ConvOclDirectFwd,2.2345,0,miopenConvolutionFwdAlgoDirect,<unused>;miopenConvolutionFwdAlgoGEMM:GemmFwdRest,15.7822,3612672,MIOpenGEMM,0_0_49_576_49_49_64_576
2048-7-7-3x3-2048-7-7-32-1x1-1x1-1x1-0-NCHW-FP32-F_g64=miopenConvolutionFwdAlgoWinograd:ConvBinWinogradRxSf2x3,0.531349,0,miopenConvolutionFwdAlgoWinograd,<unused>;miopenConvolutionFwdAlgoImplicitGEMM:ConvHipImplicitGemmV4R1Fwd,0.553003,0,miopenConvolutionFwdAlgoImplicitGEMM,2048x7x7x3x3x2048x7x7x32xNCHWxFP32x1x1x1x1x1x1x64x1;miopenConvolutionFwdAlgoDirect:ConvOclDirectFwd,0.57153,0,miopenConvolutionFwdAlgoDirect,<unused>;miopenConvolutionFwdAlgoGEMM:GemmFwdRest,39.5256,3612672,MIOpenGEMM,0_0_49_288_49_49_32_288
1024-14-14-3x3-1024-14-14-32-1x1-1x1-1x1-0-NCHW-FP32-W_g32=miopenConvolutionBwdWeightsAlgoDirect:ConvAsmBwdWrW3x3,0.414109,0,miopenConvolutionBwdWeightsAlgoDirect,<unused>;miopenConvolutionBwdWeightsAlgoWinograd:ConvBinWinogradRxSf2x3,1.62364,0,miopenConvolutionBwdWeightsAlgoWinograd,1024x14x14x3x3x1024x14x14x32xNCHWxFP32x1x1x1x1x1x1x32x0;miopenConvolutionBwdWeightsAlgoGEMM:gemm,19.7506,7225344,MIOpenGEMM,1_0_196_196_288_288_32_196
1024-28-28-3x3-1024-14-14-32-1x1-2x2-1x1-0-NCHW-FP32-F_g64=miopenConvolutionFwdAlgoWinograd:ConvBinWinogradRxSf2x3,1.77902,0,miopenConvolutionFwdAlgoWinograd,<unused>;miopenConvolutionFwdAlgoImplicitGEMM:ConvHipImplicitGemmV4R1Fwd,1.85404,0,miopenConvolutionFwdAlgoImplicitGEMM,1024x28x28x3x3x1024x14x14x32xNCHWxFP32x1x1x2x2x1x1x64x1;miopenConvolutionFwdAlgoDirect:ConvOclDirectFwd,2.83226,0,miopenConvolutionFwdAlgoDirect,<unused>;miopenConvolutionFwdAlgoGEMM:GemmFwdRest,40.7071,7225344,MIOpenGEMM,0_0_196_144_196_196_16_144
512-28-28-1x1-512-28-28-32-0x0-1x1-1x1-0-NCHW-FP32-W=miopenConvolutionBwdWeightsAlgoDirect:ConvAsmBwdWrW1x1,1.68759,0,miopenConvolutionBwdWeightsAlgoDirect,<unused>;miopenConvolutionBwdWeightsAlgoWinograd:ConvBinWinogradRxSf2x3,5.59038,0,miopenConvolutionBwdWeightsAlgoWinograd,512x28x28x1x1x512x28x28x32xNCHWxFP32x0x0x1x1x1x1x1x0
128-56-56-1x1-256-56-56-32-0x0-1x1-1x1-0-NCHW-FP32-F=miopenConvolutionFwdAlgoDirect:ConvAsm1x1U,0.74848,0,miopenConvolutionFwdAlgoDirect,<unused>
512-14-14-3x3-512-14-14-32-1x1-1x1-1x1-0-NCHW-FP32-B_g32=miopenConvolutionBwdDataAlgoWinograd:ConvBinWinogradRxSf2x3,0.203802,0,miopenConvolutionBwdDataAlgoWinograd,<unused>;miopenConvolutionBwdDataAlgoDirect:ConvOclDirectFwd,0.292881,0,miopenConvolutionBwdDataAlgoDirect,<unused>;miopenConvolutionBwdDataAlgoGEMM:gemm,6.15251,3612672,MIOpenGEMM,0_1_196_144_196_196_144_16
512-28-28-1x1-256-28-28-32-0x0-1x1-1x1-0-NCHW-FP32-B=miopenConvolutionBwdDataAlgoDirect:ConvAsm1x1U,1.04751,0,miopenConvolutionBwdDataAlgoDirect,<unused>;miopenConvolutionBwdDataAlgoWinograd:ConvBinWinogradRxSf3x2,1.52188,0,miopenConvolutionBwdDataAlgoWinograd,<unused>;miopenConvolutionBwdDataAlgoGEMM:gemm,2.71264,0,MIOpenGEMM,0_1_784_256_784_784_256_512
512-28-28-3x3-512-56-56-32-1x1-2x2-1x1-0-NCHW-FP32-B_g64=miopenConvolutionBwdDataAlgoDirect:ConvOclDirectFwd,1.40103,0,miopenConvolutionBwdDataAlgoDirect,<unused>;miopenConvolutionBwdDataAlgoWinograd:ConvBinWinogradRxSf2x3,2.20541,0,miopenConvolutionBwdDataAlgoWinograd,<unused>;miopenConvolutionBwdDataAlgoGEMM:gemm,21.6563,14450688,MIOpenGEMM,0_1_784_72_784_784_72_8
1024-14-14-1x1-512-14-14-32-0x0-1x1-1x1-0-NCHW-FP32-F=miopenConvolutionFwdAlgoDirect:ConvAsm1x1U,1.10171,0,miopenConvolutionFwdAlgoDirect,<unused>;miopenConvolutionFwdAlgoWinograd:ConvBinWinogradRxSf3x2,1.74753,0,miopenConvolutionFwdAlgoWinograd,<unused>;miopenConvolutionFwdAlgoGEMM:GemmFwd1x1_0_1,2.28041,0,MIOpenGEMM,0_0_196_1024_196_196_512_1024
1024-14-14-3x3-1024-28-28-32-1x1-2x2-1x1-0-NCHW-FP32-W_g32=miopenConvolutionBwdWeightsAlgoDirect:ConvAsmBwdWrW3x3,0.635796,0,miopenConvolutionBwdWeightsAlgoDirect,<unused>;miopenConvolutionBwdWeightsAlgoGEMM:gemm,19.1327,7225344,MIOpenGEMM,1_0_196_196_288_288_32_196
1024-14-14-3x3-1024-14-14-32-1x1-1x1-1x1-0-NCHW-FP32-B_g32=miopenConvolutionBwdDataAlgoWinograd:ConvBinWinogradRxSf2x3,0.278797,0,miopenConvolutionBwdDataAlgoWinograd,<unused>;miopenConvolutionBwdDataAlgoDirect:ConvOclDirectFwd,1.10801,0,miopenConvolutionBwdDataAlgoDirect,<unused>;miopenConvolutionBwdDataAlgoGEMM:gemm,7.0723,7225344,MIOpenGEMM,0_1_196_288_196_196_288_32
128-56-56-1x1-64-56-56-32-0x0-1x1-1x1-0-NCHW-FP32-W=miopenConvolutionBwdWeightsAlgoDirect:ConvAsmBwdWrW1x1,0.510268,0,miopenConvolutionBwdWeightsAlgoDirect,<unused>
2048-7-7-3x3-2048-7-7-32-1x1-1x1-1x1-0-NCHW-FP32-W_g32=miopenConvolutionBwdWeightsAlgoDirect:ConvAsmBwdWrW3x3,0.43653,0,miopenConvolutionBwdWeightsAlgoDirect,<unused>;miopenConvolutionBwdWeightsAlgoImplicitGEMM:ConvHipImplicitGemmV4R1WrW,0.591777,0,miopenConvolutionBwdWeightsAlgoImplicitGEMM,2048x7x7x3x3x2048x7x7x32xNCHWxFP32x1x1x1x1x1x1x32x0;miopenConvolutionBwdWeightsAlgoWinograd:ConvBinWinogradRxSf2x3,1.23821,0,miopenConvolutionBwdWeightsAlgoWinograd,2048x7x7x3x3x2048x7x7x32xNCHWxFP32x1x1x1x1x1x1x32x0;miopenConvolutionBwdWeightsAlgoGEMM:gemm,6.39269,3612672,MIOpenGEMM,1_0_49_49_576_576_64_49
128-56-56-3x3-128-56-56-32-1x1-1x1-1x1-0-NCHW-FP32-W_g32=miopenConvolutionBwdWeightsAlgoDirect:ConvAsmBwdWrW3x3,0.196344,0,miopenConvolutionBwdWeightsAlgoDirect,<unused>;miopenConvolutionBwdWeightsAlgoWinograd:ConvBinWinogradRxSf2x3,2.94426,0,miopenConvolutionBwdWeightsAlgoWinograd,128x56x56x3x3x128x56x56x32xNCHWxFP32x1x1x1x1x1x1x32x0;miopenConvolutionBwdWeightsAlgoGEMM:gemm,70.8952,14450688,MIOpenGEMM,1_0_3136_3136_36_36_4_3136
1024-28-28-1x1-512-28-28-32-0x0-1x1-1x1-0-NCHW-FP32-W=miopenConvolutionBwdWeightsAlgoDirect:ConvAsmBwdWrW1x1,2.77177,0,miopenConvolutionBwdWeightsAlgoDirect,<unused>;miopenConvolutionBwdWeightsAlgoWinograd:ConvBinWinogradRxSf2x3,16.4231,0,miopenConvolutionBwdWeightsAlgoWinograd,1024x28x28x1x1x512x28x28x32xNCHWxFP32x0x0x1x1x1x1x1x0
2048-7-7-1x1-1024-14-14-32-0x0-2x2-1x1-0-NCHW-FP32-W=miopenConvolutionBwdWeightsAlgoImplicitGEMM:ConvHipImplicitGemmV4R1WrW,0.845446,0,miopenConvolutionBwdWeightsAlgoImplicitGEMM,2048x7x7x1x1x1024x14x14x32xNCHWxFP32x0x0x2x2x1x1x1x0;miopenConvolutionBwdWeightsAlgoDirect:ConvAsmBwdWrW1x1,1.16277,6422528,miopenConvolutionBwdWeightsAlgoDirect,<unused>;miopenConvolutionBwdWeightsAlgoGEMM:gemm,2.01494,200704,MIOpenGEMM,1_0_49_49_1024_1024_2048_49
512-56-56-3x3-512-28-28-32-1x1-2x2-1x1-0-NCHW-FP32-F_g64=miopenConvolutionFwdAlgoWinograd:ConvBinWinogradRxSf2x3,1.94818,0,miopenConvolutionFwdAlgoWinograd,<unused>;miopenConvolutionFwdAlgoDirect:ConvOclDirectFwd,2.86515,0,miopenConvolutionFwdAlgoDirect,<unused>;miopenConvolutionFwdAlgoGEMM:GemmFwdRest,35.1263,14450688,MIOpenGEMM,0_0_784_72_784_784_8_72
2048-7-7-1x1-2048-7-7-32-0x0-1x1-1x1-0-NCHW-FP32-W=miopenConvolutionBwdWeightsAlgoDirect:ConvAsmBwdWrW1x1,2.08069,0,miopenConvolutionBwdWeightsAlgoDirect,<unused>;miopenConvolutionBwdWeightsAlgoGEMM:gemm,2.73613,0,MIOpenGEMM,1_0_49_49_2048_2048_2048_49;miopenConvolutionBwdWeightsAlgoWinograd:ConvBinWinogradRxSf2x3,7.00597,0,miopenConvolutionBwdWeightsAlgoWinograd,2048x7x7x1x1x2048x7x7x32xNCHWxFP32x0x0x1x1x1x1x1x0
1024-14-14-3x3-1024-28-28-32-1x1-2x2-1x1-0-NCHW-FP32-B_g32=miopenConvolutionBwdDataAlgoWinograd:ConvBinWinogradRxSf2x3,1.04695,0,miopenConvolutionBwdDataAlgoWinograd,<unused>;miopenConvolutionBwdDataAlgoDirect:ConvOclDirectFwd,1.75968,0,miopenConvolutionBwdDataAlgoDirect,<unused>;miopenConvolutionBwdDataAlgoGEMM:gemm,8.11595,7225344,MIOpenGEMM,0_1_196_288_196_196_288_32
256-56-56-1x1-512-56-56-32-0x0-1x1-1x1-0-NCHW-FP32-F=miopenConvolutionFwdAlgoImplicitGEMM:ConvHipImplicitGemmV4R4Fwd,2.42537,0,miopenConvolutionFwdAlgoImplicitGEMM,256x56x56x1x1x512x56x56x32xNCHWxFP32x0x0x1x1x1x1x1x1;miopenConvolutionFwdAlgoDirect:ConvAsm1x1U,3.17933,0,miopenConvolutionFwdAlgoDirect,<unused>;miopenConvolutionFwdAlgoGEMM:GemmFwd1x1_0_1,3.20885,0,MIOpenGEMM,0_0_3136_256_3136_3136_512_256;miopenConvolutionFwdAlgoWinograd:ConvBinWinogradRxSf3x2,5.21502,0,miopenConvolutionFwdAlgoWinograd,<unused>
256-28-28-1x1-512-28-28-32-0x0-1x1-1x1-0-NCHW-FP32-F=miopenConvolutionFwdAlgoDirect:ConvOclDirectFwd1x1,0.786956,0,miopenConvolutionFwdAlgoDirect,<unused>;miopenConvolutionFwdAlgoGEMM:GemmFwd1x1_0_1,1.48443,0,MIOpenGEMM,0_0_784_256_784_784_512_256;miopenConvolutionFwdAlgoWinograd:ConvBinWinogradRxSf3x2,1.86867,0,miopenConvolutionFwdAlgoWinograd,<unused>
2048-7-7-3x3-2048-7-7-32-1x1-1x1-1x1-0-NCHW-FP32-B_g32=miopenConvolutionBwdDataAlgoWinograd:ConvBinWinogradRxSf2x3,0.264132,0,miopenConvolutionBwdDataAlgoWinograd,<unused>;miopenConvolutionBwdDataAlgoDirect:ConvOclDirectFwd,1.35793,0,miopenConvolutionBwdDataAlgoDirect,<unused>;miopenConvolutionBwdDataAlgoGEMM:gemm,9.13399,3612672,MIOpenGEMM,0_1_49_576_49_49_576_64
128-56-56-3x3-128-56-56-32-1x1-1x1-1x1-0-NCHW-FP32-B_g32=miopenConvolutionBwdDataAlgoDirect:ConvAsm3x3U,0.196583,0,miopenConvolutionBwdDataAlgoDirect,<unused>;miopenConvolutionBwdDataAlgoWinograd:ConvBinWinogradRxSf2x3,1.37671,0,miopenConvolutionBwdDataAlgoWinograd,<unused>;miopenConvolutionBwdDataAlgoGEMM:gemm,11.3469,14450688,MIOpenGEMM,0_1_3136_36_3136_3136_36_4
1024-14-14-3x3-1024-14-14-32-1x1-1x1-1x1-0-NCHW-FP32-F_g32=miopenConvolutionFwdAlgoWinograd:ConvBinWinogradRxSf2x3,0.262427,0,miopenConvolutionFwdAlgoWinograd,<unused>;miopenConvolutionFwdAlgoImplicitGEMM:ConvHipImplicitGemmV4R1Fwd,0.579067,0,miopenConvolutionFwdAlgoImplicitGEMM,1024x14x14x3x3x1024x14x14x32xNCHWxFP32x1x1x1x1x1x1x32x1;miopenConvolutionFwdAlgoDirect:ConvOclDirectFwd,0.981689,0,miopenConvolutionFwdAlgoDirect,<unused>;miopenConvolutionFwdAlgoGEMM:GemmFwdRest,11.6823,7225344,MIOpenGEMM,0_0_196_288_196_196_32_288
1024-28-28-1x1-512-28-28-32-0x0-1x1-1x1-0-NCHW-FP32-B=miopenConvolutionBwdDataAlgoDirect:ConvAsm1x1U,2.54338,0,miopenConvolutionBwdDataAlgoDirect,<unused>;miopenConvolutionBwdDataAlgoImplicitGEMM:ConvHipImplicitGemmBwdDataV4R1,2.55845,0,miopenConvolutionBwdDataAlgoImplicitGEMM,1024x28x28x1x1x512x28x28x32xNCHWxFP32x0x0x1x1x1x1x1x0;miopenConvolutionBwdDataAlgoGEMM:gemm,4.79574,0,MIOpenGEMM,0_1_784_512_784_784_512_1024;miopenConvolutionBwdDataAlgoWinograd:ConvBinWinogradRxSf3x2,5.28916,0,miopenConvolutionBwdDataAlgoWinograd,<unused>
128-56-56-3x3-128-56-56-32-1x1-1x1-1x1-0-NCHW-FP32-F_g32=miopenConvolutionFwdAlgoDirect:ConvAsm3x3U,0.213615,0,miopenConvolutionFwdAlgoDirect,<unused>;miopenConvolutionFwdAlgoWinograd:ConvBinWinogradRxSf2x3,1.28436,0,miopenConvolutionFwdAlgoWinograd,<unused>;miopenConvolutionFwdAlgoGEMM:GemmFwdRest,12.7757,14450688,MIOpenGEMM,0_0_3136_36_3136_3136_4_36
2048-7-7-1x1-1024-14-14-32-0x0-2x2-1x1-0-NCHW-FP32-B=miopenConvolutionBwdDataAlgoDirect:ConvAsm1x1UV2,1.03138,0,miopenConvolutionBwdDataAlgoDirect,<unused>;miopenConvolutionBwdDataAlgoGEMM:gemm,1.25193,19267584,MIOpenGEMM,0_1_1568_1024_1568_1568_1024_2048;miopenConvolutionBwdDataAlgoImplicitGEMM:ConvHipImplicitGemmBwdDataV4R1,1.50591,0,miopenConvolutionBwdDataAlgoImplicitGEMM,2048x7x7x1x1x1024x14x14x32xNCHWxFP32x0x0x2x2x1x1x1x0;miopenConvolutionBwdDataAlgoWinograd:ConvBinWinogradRxSf2x3,7.70122,0,miopenConvolutionBwdDataAlgoWinograd,<unused>
512-14-14-3x3-512-14-14-32-1x1-1x1-1x1-0-NCHW-FP32-F_g32=miopenConvolutionFwdAlgoWinograd:ConvBinWinogradRxSf2x3,0.162116,0,miopenConvolutionFwdAlgoWinograd,<unused>;miopenConvolutionFwdAlgoDirect:ConvAsm3x3U,0.387303,0,miopenConvolutionFwdAlgoDirect,<unused>;miopenConvolutionFwdAlgoImplicitGEMM:ConvHipImplicitGemmV4R1Fwd,0.434421,0,miopenConvolutionFwdAlgoImplicitGEMM,512x14x14x3x3x512x14x14x32xNCHWxFP32x1x1x1x1x1x1x32x1;miopenConvolutionFwdAlgoGEMM:GemmFwdRest,12.0358,3612672,MIOpenGEMM,0_0_196_144_196_196_16_144
256-56-56-3x3-256-56-56-32-1x1-1x1-1x1-0-NCHW-FP32-W_g64=miopenConvolutionBwdWeightsAlgoDirect:ConvAsmBwdWrW3x3,0.506472,0,miopenConvolutionBwdWeightsAlgoDirect,<unused>;miopenConvolutionBwdWeightsAlgoWinograd:ConvBinWinogradRxSf2x3,5.93524,0,miopenConvolutionBwdWeightsAlgoWinograd,256x56x56x3x3x256x56x56x32xNCHWxFP32x1x1x1x1x1x1x64x0;miopenConvolutionBwdWeightsAlgoGEMM:gemm,128.389,28901376,MIOpenGEMM,1_0_3136_3136_36_36_4_3136
1024-28-28-3x3-1024-14-14-32-1x1-2x2-1x1-0-NCHW-FP32-F_g32=miopenConvolutionFwdAlgoImplicitGEMM:ConvHipImplicitGemmV4R1Fwd,0.73788,0,miopenConvolutionFwdAlgoImplicitGEMM,1024x28x28x3x3x1024x14x14x32xNCHWxFP32x1x1x2x2x1x1x32x1;miopenConvolutionFwdAlgoWinograd:ConvBinWinogradRxSf2x3,0.774189,0,miopenConvolutionFwdAlgoWinograd,<unused>;miopenConvolutionFwdAlgoDirect:ConvOclDirectFwd,2.047,0,miopenConvolutionFwdAlgoDirect,<unused>;miopenConvolutionFwdAlgoGEMM:GemmFwdRest,11.5774,7225344,MIOpenGEMM,0_0_196_288_196_196_32_288
2048-7-7-3x3-2048-7-7-32-1x1-1x1-1x1-0-NCHW-FP32-F_g32=miopenConvolutionFwdAlgoWinograd:ConvBinWinogradRxSf2x3,0.26596,0,miopenConvolutionFwdAlgoWinograd,<unused>;miopenConvolutionFwdAlgoImplicitGEMM:ConvHipImplicitGemmV4R1Fwd,0.772613,0,miopenConvolutionFwdAlgoImplicitGEMM,2048x7x7x3x3x2048x7x7x32xNCHWxFP32x1x1x1x1x1x1x32x1;miopenConvolutionFwdAlgoDirect:ConvOclDirectFwd,1.20709,0,miopenConvolutionFwdAlgoDirect,<unused>;miopenConvolutionFwdAlgoGEMM:GemmFwdRest,15.7317,3612672,MIOpenGEMM,0_0_49_576_49_49_64_576
512-28-28-3x3-512-28-28-32-1x1-1x1-1x1-0-NCHW-FP32-W_g32=miopenConvolutionBwdWeightsAlgoDirect:ConvAsmBwdWrW3x3,0.438696,0,miopenConvolutionBwdWeightsAlgoDirect,<unused>;miopenConvolutionBwdWeightsAlgoWinograd:ConvBinWinogradRxSf2x3,1.72897,0,miopenConvolutionBwdWeightsAlgoWinograd,512x28x28x3x3x512x28x28x32xNCHWxFP32x1x1x1x1x1x1x32x0;miopenConvolutionBwdWeightsAlgoGEMM:gemm,17.1147,14450688,MIOpenGEMM,1_0_784_784_144_144_16_784
256-56-56-3x3-256-56-56-32-1x1-1x1-1x1-0-NCHW-FP32-B_g64=miopenConvolutionBwdDataAlgoDirect:ConvAsm3x3U,0.465421,0,miopenConvolutionBwdDataAlgoDirect,<unused>;miopenConvolutionBwdDataAlgoWinograd:ConvBinWinogradRxSf2x3,2.44362,0,miopenConvolutionBwdDataAlgoWinograd,<unused>;miopenConvolutionBwdDataAlgoGEMM:gemm,25.9266,28901376,MIOpenGEMM,0_1_3136_36_3136_3136_36_4
2048-7-7-1x1-1024-7-7-32-0x0-1x1-1x1-0-NCHW-FP32-W=miopenConvolutionBwdWeightsAlgoDirect:ConvAsmBwdWrW1x1,0.996799,0,miopenConvolutionBwdWeightsAlgoDirect,<unused>;miopenConvolutionBwdWeightsAlgoGEMM:gemm,1.70708,0,MIOpenGEMM,1_0_49_49_1024_1024_2048_49;miopenConvolutionBwdWeightsAlgoWinograd:ConvBinWinogradRxSf2x3,2.98719,0,miopenConvolutionBwdWeightsAlgoWinograd,2048x7x7x1x1x1024x7x7x32xNCHWxFP32x0x0x1x1x1x1x1x0
512-28-28-1x1-1024-28-28-32-0x0-1x1-1x1-0-NCHW-FP32-F=miopenConvolutionFwdAlgoImplicitGEMM:ConvHipImplicitGemmV4R4Fwd,2.41192,0,miopenConvolutionFwdAlgoImplicitGEMM,512x28x28x1x1x1024x28x28x32xNCHWxFP32x0x0x1x1x1x1x1x1;miopenConvolutionFwdAlgoDirect:ConvOclDirectFwd1x1,3.35551,0,miopenConvolutionFwdAlgoDirect,<unused>;miopenConvolutionFwdAlgoGEMM:GemmFwd1x1_0_1,4.19747,0,MIOpenGEMM,0_0_784_512_784_784_1024_512;miopenConvolutionFwdAlgoWinograd:ConvBinWinogradRxSf3x2,5.36864,0,miopenConvolutionFwdAlgoWinograd,<unused>
1024-14-14-1x1-512-14-14-32-0x0-1x1-1x1-0-NCHW-FP32-W=miopenConvolutionBwdWeightsAlgoDirect:ConvAsmBwdWrW1x1,0.772483,0,miopenConvolutionBwdWeightsAlgoDirect,<unused>;miopenConvolutionBwdWeightsAlgoGEMM:gemm,1.69385,0,MIOpenGEMM,1_0_196_196_512_512_1024_196;miopenConvolutionBwdWeightsAlgoWinograd:ConvBinWinogradRxSf2x3,2.7704,0,miopenConvolutionBwdWeightsAlgoWinograd,1024x14x14x1x1x512x14x14x32xNCHWxFP32x0x0x1x1x1x1x1x0
2048-7-7-3x3-2048-14-14-32-1x1-2x2-1x1-0-NCHW-FP32-W_g64=miopenConvolutionBwdWeightsAlgoDirect:ConvAsmBwdWrW3x3,0.397557,0,miopenConvolutionBwdWeightsAlgoDirect,<unused>;miopenConvolutionBwdWeightsAlgoGEMM:gemm,26.597,3612672,MIOpenGEMM,1_0_49_49_288_288_32_49
256-28-28-3x3-256-28-28-32-1x1-1x1-1x1-0-NCHW-FP32-W_g32=miopenConvolutionBwdWeightsAlgoDirect:ConvAsmBwdWrW3x3,0.398367,0,miopenConvolutionBwdWeightsAlgoDirect,<unused>;miopenConvolutionBwdWeightsAlgoWinograd:ConvBinWinogradRxSf2x3,1.36196,0,miopenConvolutionBwdWeightsAlgoWinograd,256x28x28x3x3x256x28x28x32xNCHWxFP32x1x1x1x1x1x1x32x0;miopenConvolutionBwdWeightsAlgoGEMM:gemm,20.8125,7225344,MIOpenGEMM,1_0_784_784_72_72_8_784
3-227-227-11x11-64-55-55-512-0x0-4x4-1x1-0-NCHW-FP32-F=miopenConvolutionFwdAlgoDirect:ConvOclDirectFwd11x11,22.7956,0,miopenConvolutionFwdAlgoDirect,<unused>;miopenConvolutionFwdAlgoGEMM:GemmFwdRest,32.5096,4392300,MIOpenGEMM,0_0_3025_363_3025_3025_64_363
512-28-28-3x3-512-28-28-32-1x1-1x1-1x1-0-NCHW-FP32-W_g64=miopenConvolutionBwdWeightsAlgoDirect:ConvAsmBwdWrW3x3,0.416258,0,miopenConvolutionBwdWeightsAlgoDirect,<unused>;miopenConvolutionBwdWeightsAlgoWinograd:ConvBinWinogradRxSf2x3,4.88212,0,miopenConvolutionBwdWeightsAlgoWinograd,512x28x28x3x3x512x28x28x32xNCHWxFP32x1x1x1x1x1x1x64x0;miopenConvolutionBwdWeightsAlgoGEMM:gemm,42.5242,14450688,MIOpenGEMM,1_0_784_784_72_72_8_784
384-13-13-3x3-192-13-13-512-1x1-1x1-1x1-0-NCHW-FP32-B=miopenConvolutionBwdDataAlgoWinograd:ConvBinWinograd3x3U,5.90786,0,miopenConvolutionBwdDataAlgoWinograd,<unused>
2048-7-7-3x3-2048-14-14-32-1x1-2x2-1x1-0-NCHW-FP32-B_g64=miopenConvolutionBwdDataAlgoWinograd:ConvBinWinogradRxSf2x3,0.877456,0,miopenConvolutionBwdDataAlgoWinograd,<unused>;miopenConvolutionBwdDataAlgoDirect:ConvOclDirectFwd,0.939868,0,miopenConvolutionBwdDataAlgoDirect,<unused>;miopenConvolutionBwdDataAlgoGEMM:gemm,13.9319,3612672,MIOpenGEMM,0_1_49_288_49_49_288_32
1024-14-14-1x1-512-14-14-32-0x0-1x1-1x1-0-NCHW-FP32-B=miopenConvolutionBwdDataAlgoDirect:ConvAsm1x1U,0.945022,0,miopenConvolutionBwdDataAlgoDirect,<unused>;miopenConvolutionBwdDataAlgoWinograd:ConvBinWinogradRxSf3x2,1.60043,0,miopenConvolutionBwdDataAlgoWinograd,<unused>;miopenConvolutionBwdDataAlgoGEMM:gemm,3.12188,0,MIOpenGEMM,0_1_196_512_196_196_512_1024
256-28-28-1x1-512-28-28-32-0x0-1x1-1x1-0-NCHW-FP32-W=miopenConvolutionBwdWeightsAlgoDirect:ConvAsmBwdWrW1x1,0.789909,0,miopenConvolutionBwdWeightsAlgoDirect,<unused>;miopenConvolutionBwdWeightsAlgoGEMM:gemm,3.2431,0,MIOpenGEMM,1_0_784_784_512_512_256_784
512-28-28-3x3-512-28-28-32-1x1-1x1-1x1-0-NCHW-FP32-B_g32=miopenConvolutionBwdDataAlgoDirect:ConvAsm3x3U,0.700531,0,miopenConvolutionBwdDataAlgoDirect,<unused>;miopenConvolutionBwdDataAlgoWinograd:ConvBinWinogradRxSf2x3,0.707243,0,miopenConvolutionBwdDataAlgoWinograd,<unused>;miopenConvolutionBwdDataAlgoGEMM:gemm,6.83999,14450688,MIOpenGEMM,0_1_784_144_784_784_144_16
512-28-28-3x3-512-28-28-32-1x1-1x1-1x1-0-NCHW-FP32-B_g64=miopenConvolutionBwdDataAlgoDirect:ConvAsm3x3U,0.419241,0,miopenConvolutionBwdDataAlgoDirect,<unused>;miopenConvolutionBwdDataAlgoWinograd:ConvBinWinogradRxSf2x3,1.50362,0,miopenConvolutionBwdDataAlgoWinograd,<unused>;miopenConvolutionBwdDataAlgoGEMM:gemm,17.1047,14450688,MIOpenGEMM,0_1_784_72_784_784_72_8
256-56-56-3x3-256-56-56-32-1x1-1x1-1x1-0-NCHW-FP32-F_g64=miopenConvolutionFwdAlgoDirect:ConvAsm3x3U,0.636807,0,miopenConvolutionFwdAlgoDirect,<unused>;miopenConvolutionFwdAlgoWinograd:ConvBinWinogradRxSf2x3,2.50741,0,miopenConvolutionFwdAlgoWinograd,<unused>;miopenConvolutionFwdAlgoGEMM:GemmFwdRest,42.4254,28901376,MIOpenGEMM,0_0_3136_36_3136_3136_4_36
384-13-13-3x3-256-13-13-512-1x1-1x1-1x1-0-NCHW-FP32-F=miopenConvolutionFwdAlgoWinograd:ConvBinWinograd3x3U,7.92979,0,miopenConvolutionFwdAlgoWinograd,<unused>
256-14-14-1x1-1024-14-14-128-0x0-1x1-1x1-0-NCHW-FP32-W=miopenConvolutionBwdWeightsAlgoDirect:ConvAsmBwdWrW1x1,1.42222,0,miopenConvolutionBwdWeightsAlgoDirect,<unused>;miopenConvolutionBwdWeightsAlgoGEMM:gemm,4.33809,0,MIOpenGEMM,1_0_196_196_1024_1024_256_196;miopenConvolutionBwdWeightsAlgoWinograd:ConvBinWinogradRxSf2x3,7.11198,0,miopenConvolutionBwdWeightsAlgoWinograd,256x14x14x1x1x1024x14x14x128xNCHWxFP32x0x0x1x1x1x1x1x0
256-28-28-3x3-256-28-28-32-1x1-1x1-1x1-0-NCHW-FP32-B_g32=miopenConvolutionBwdDataAlgoDirect:ConvAsm3x3U,0.254404,0,miopenConvolutionBwdDataAlgoDirect,<unused>;miopenConvolutionBwdDataAlgoWinograd:ConvBinWinogradRxSf2x3,0.513682,0,miopenConvolutionBwdDataAlgoWinograd,<unused>;miopenConvolutionBwdDataAlgoGEMM:gemm,6.24655,7225344,MIOpenGEMM,0_1_784_72_784_784_72_8
512-28-28-3x3-512-28-28-32-1x1-1x1-1x1-0-NCHW-FP32-F_g64=miopenConvolutionFwdAlgoDirect:ConvAsm3x3U,0.657991,0,miopenConvolutionFwdAlgoDirect,<unused>;miopenConvolutionFwdAlgoWinograd:ConvBinWinogradRxSf2x3,6.5368,0,miopenConvolutionFwdAlgoWinograd,<unused>;miopenConvolutionFwdAlgoGEMM:GemmFwdRest,36.1151,14450688,MIOpenGEMM,0_0_784_72_784_784_8_72
512-14-14-1x1-1024-14-14-32-0x0-1x1-1x1-0-NCHW-FP32-F=miopenConvolutionFwdAlgoDirect:ConvOclDirectFwd1x1,0.896272,0,miopenConvolutionFwdAlgoDirect,<unused>;miopenConvolutionFwdAlgoWinograd:ConvBinWinogradRxSf3x2,1.54507,0,miopenConvolutionFwdAlgoWinograd,<unused>;miopenConvolutionFwdAlgoGEMM:GemmFwd1x1_0_1,1.80632,0,MIOpenGEMM,0_0_196_512_196_196_1024_512
2048-7-7-1x1-512-7-7-128-0x0-1x1-1x1-0-NCHW-FP32-F=miopenConvolutionFwdAlgoDirect:ConvAsm1x1U,2.31722,0,miopenConvolutionFwdAlgoDirect,<unused>;miopenConvolutionFwdAlgoGEMM:GemmFwd1x1_0_1,13.8211,0,MIOpenGEMM,0_0_49_2048_49_49_512_2048
256-28-28-1x1-512-28-28-32-0x0-1x1-1x1-0-NCHW-FP32-B=miopenConvolutionBwdDataAlgoImplicitGEMM:ConvHipImplicitGemmBwdDataV1R1,0.830358,0,miopenConvolutionBwdDataAlgoImplicitGEMM,256x28x28x1x1x512x28x28x32xNCHWxFP32x0x0x1x1x1x1x1x0;miopenConvolutionBwdDataAlgoDirect:ConvAsm1x1U,1.07898,0,miopenConvolutionBwdDataAlgoDirect,<unused>;miopenConvolutionBwdDataAlgoGEMM:gemm,1.30135,0,MIOpenGEMM,0_1_784_512_784_784_512_256;miopenConvolutionBwdDataAlgoWinograd:ConvBinWinogradRxSf3x2,1.47469,0,miopenConvolutionBwdDataAlgoWinograd,<unused>
256-14-14-1x1-1024-14-14-128-0x0-1x1-1x1-0-NCHW-FP32-B=miopenConvolutionBwdDataAlgoDirect:ConvAsm1x1U,1.78013,0,miopenConvolutionBwdDataAlgoDirect,<unused>;miopenConvolutionBwdDataAlgoGEMM:gemm,9.7576,0,MIOpenGEMM,0_1_196_1024_196_196_1024_256
64-55-55-11x11-3-227-227-512-0x0-4x4-1x1-0-NCHW-FP32-W=miopenConvolutionBwdWeightsAlgoDirect:ConvOclBwdWrW2<8>,22.2119,5947392,miopenConvolutionBwdWeightsAlgoDirect,<unused>;miopenConvolutionBwdWeightsAlgoGEMM:gemm,65.6855,4392300,MIOpenGEMM,1_0_3025_3025_363_363_64_3025
64-56-56-3x3-64-56-56-128-1x1-1x1-1x1-0-NCHW-FP32-B=miopenConvolutionBwdDataAlgoWinograd:ConvBinWinograd3x3U,1.52576,0,miopenConvolutionBwdDataAlgoWinograd,<unused>
128-28-28-1x1-256-56-56-128-0x0-2x2-1x1-0-NCHW-FP32-B=miopenConvolutionBwdDataAlgoDirect:ConvAsm1x1UV2,1.04486,0,miopenConvolutionBwdDataAlgoDirect,<unused>;miopenConvolutionBwdDataAlgoWinograd:ConvBinWinogradRxSf2x3,7.24904,0,miopenConvolutionBwdDataAlgoWinograd,<unused>
384-13-13-3x3-192-13-13-512-1x1-1x1-1x1-0-NCHW-FP32-W=miopenConvolutionBwdWeightsAlgoDirect:ConvAsmBwdWrW3x3,22.9974,0,miopenConvolutionBwdWeightsAlgoDirect,<unused>;miopenConvolutionBwdWeightsAlgoWinograd:ConvBinWinogradRxS,23.2128,0,miopenConvolutionBwdWeightsAlgoWinograd,384x13x13x3x3x192x13x13x512xNCHWxFP32x1x1x1x1x1x1x1x0;miopenConvolutionBwdWeightsAlgoImplicitGEMM:ConvHipImplicitGemmV4R1WrW,32.7083,0,miopenConvolutionBwdWeightsAlgoImplicitGEMM,384x13x13x3x3x192x13x13x512xNCHWxFP32x1x1x1x1x1x1x1x0;miopenConvolutionBwdWeightsAlgoGEMM:gemm,911.084,1168128,MIOpenGEMM,1_0_169_169_1728_1728_384_169
512-28-28-1x1-1024-14-14-128-0x0-2x2-1x1-0-NCHW-FP32-F=miopenConvolutionFwdAlgoDirect:ConvAsm1x1U,4.87677,51380224,miopenConvolutionFwdAlgoDirect,<unused>;miopenConvolutionFwdAlgoWinograd:ConvBinWinogradRxSf2x3,20.759,0,miopenConvolutionFwdAlgoWinograd,<unused>
64-56-56-3x3-64-56-56-128-1x1-1x1-1x1-0-NCHW-FP32-F=miopenConvolutionFwdAlgoWinograd:ConvBinWinograd3x3U,1.38112,0,miopenConvolutionFwdAlgoWinograd,<unused>
192-13-13-3x3-384-13-13-512-1x1-1x1-1x1-0-NCHW-FP32-F=miopenConvolutionFwdAlgoWinograd:ConvBinWinogradRxS,5.9084,0,miopenConvolutionFwdAlgoWinograd,<unused>
1024-14-14-1x1-256-14-14-128-0x0-1x1-1x1-0-NCHW-FP32-F=miopenConvolutionFwdAlgoDirect:ConvAsm1x1U,1.61121,0,miopenConvolutionFwdAlgoDirect,<unused>;miopenConvolutionFwdAlgoWinograd:ConvBinWinogradRxSf3x2,2.75198,0,miopenConvolutionFwdAlgoWinograd,<unused>;miopenConvolutionFwdAlgoGEMM:GemmFwd1x1_0_1,6.78484,0,MIOpenGEMM,0_0_196_1024_196_196_256_1024
256-28-28-3x3-256-28-28-32-1x1-1x1-1x1-0-NCHW-FP32-F_g32=miopenConvolutionFwdAlgoDirect:ConvAsm3x3U,0.205276,0,miopenConvolutionFwdAlgoDirect,<unused>;miopenConvolutionFwdAlgoWinograd:ConvBinWinogradRxSf2x3,0.565825,0,miopenConvolutionFwdAlgoWinograd,<unused>;miopenConvolutionFwdAlgoGEMM:GemmFwdRest,11.501,7225344,MIOpenGEMM,0_0_784_72_784_784_8_72
2048-7-7-1x1-512-7-7-128-0x0-1x1-1x1-0-NCHW-FP32-W=miopenConvolutionBwdWeightsAlgoDirect:ConvAsmBwdWrW1x1,1.73453,0,miopenConvolutionBwdWeightsAlgoDirect,<unused>;miopenConvolutionBwdWeightsAlgoGEMM:gemm,4.06294,0,MIOpenGEMM,1_0_49_49_512_512_2048_49;miopenConvolutionBwdWeightsAlgoWinograd:ConvBinWinogradRxSf2x3,4.84177,0,miopenConvolutionBwdWeightsAlgoWinograd,2048x7x7x1x1x512x7x7x128xNCHWxFP32x0x0x1x1x1x1x1x0
512-28-28-3x3-512-28-28-32-1x1-1x1-1x1-0-NCHW-FP32-F_g32=miopenConvolutionFwdAlgoWinograd:ConvBinWinogradRxSf2x3,0.548522,0,miopenConvolutionFwdAlgoWinograd,<unused>;miopenConvolutionFwdAlgoImplicitGEMM:ConvHipImplicitGemmV4R1Fwd,0.618397,0,miopenConvolutionFwdAlgoImplicitGEMM,512x28x28x3x3x512x28x28x32xNCHWxFP32x1x1x1x1x1x1x32x1;miopenConvolutionFwdAlgoDirect:ConvAsm3x3U,0.771239,0,miopenConvolutionFwdAlgoDirect,<unused>;miopenConvolutionFwdAlgoGEMM:GemmFwdRest,10.3278,14450688,MIOpenGEMM,0_0_784_144_784_784_16_144
512-28-28-1x1-128-28-28-128-0x0-1x1-1x1-0-NCHW-FP32-W=miopenConvolutionBwdWeightsAlgoDirect:ConvAsmBwdWrW1x1,1.8477,0,miopenConvolutionBwdWeightsAlgoDirect,<unused>
256-56-56-1x1-128-28-28-128-0x0-2x2-1x1-0-NCHW-FP32-F=miopenConvolutionFwdAlgoDirect:ConvAsm1x1UV2,1.08092,0,miopenConvolutionFwdAlgoDirect,<unused>;miopenConvolutionFwdAlgoWinograd:ConvBinWinogradRxS,5.21322,0,miopenConvolutionFwdAlgoWinograd,<unused>
64-112-112-7x7-3-230-230-128-0x0-2x2-1x1-0-NCHW-FP32-W=miopenConvolutionBwdWeightsAlgoDirect:ConvOclBwdWrW2<8>,7.6044,602112,miopenConvolutionBwdWeightsAlgoDirect,<unused>;miopenConvolutionBwdWeightsAlgoGEMM:gemm,18.29,7375872,MIOpenGEMM,1_0_12544_12544_147_147_64_12544
256-56-56-1x1-512-28-28-128-0x0-2x2-1x1-0-NCHW-FP32-F=miopenConvolutionFwdAlgoDirect:ConvAsm1x1U,3.89315,102760448,miopenConvolutionFwdAlgoDirect,<unused>;miopenConvolutionFwdAlgoGEMM:GemmFwd1x1_0_2,4.76323,308281344,MIOpenGEMM,0_0_100352_256_100352_100352_512_256;miopenConvolutionFwdAlgoWinograd:ConvBinWinogradRxS,21.5416,0,miopenConvolutionFwdAlgoWinograd,<unused>
64-56-56-1x1-256-56-56-128-0x0-1x1-1x1-0-NCHW-FP32-W=miopenConvolutionBwdWeightsAlgoDirect:ConvAsmBwdWrW1x1,2.81237,0,miopenConvolutionBwdWeightsAlgoDirect,<unused>
2048-7-7-1x1-1024-14-14-128-0x0-2x2-1x1-0-NCHW-FP32-W=miopenConvolutionBwdWeightsAlgoDirect:ConvAsmBwdWrW1x1,3.67452,25690112,miopenConvolutionBwdWeightsAlgoDirect,<unused>;miopenConvolutionBwdWeightsAlgoImplicitGEMM:ConvHipImplicitGemmV4R1WrW,4.48876,0,miopenConvolutionBwdWeightsAlgoImplicitGEMM,2048x7x7x1x1x1024x14x14x128xNCHWxFP32x0x0x2x2x1x1x1x0;miopenConvolutionBwdWeightsAlgoGEMM:gemm,45.1451,200704,MIOpenGEMM,1_0_49_49_1024_1024_2048_49
192-27-27-5x5-64-27-27-512-2x2-1x1-1x1-0-NCHW-FP32-W=miopenConvolutionBwdWeightsAlgoWinograd:ConvBinWinogradRxS,19.9234,0,miopenConvolutionBwdWeightsAlgoWinograd,192x27x27x5x5x64x27x27x512xNCHWxFP32x2x2x1x1x1x1x1x0;miopenConvolutionBwdWeightsAlgoDirect:ConvOclBwdWrW53,33.6109,0,miopenConvolutionBwdWeightsAlgoDirect,<unused>;miopenConvolutionBwdWeightsAlgoImplicitGEMM:ConvHipImplicitGemmV4R1WrW,49.9848,0,miopenConvolutionBwdWeightsAlgoImplicitGEMM,192x27x27x5x5x64x27x27x512xNCHWxFP32x2x2x1x1x1x1x1x0;miopenConvolutionBwdWeightsAlgoGEMM:gemm,1147.92,4665600,MIOpenGEMM,1_0_729_729_1600_1600_192_729
512-28-28-1x1-128-28-28-128-0x0-1x1-1x1-0-NCHW-FP32-B=miopenConvolutionBwdDataAlgoDirect:ConvAsm1x1U,1.709,0,miopenConvolutionBwdDataAlgoDirect,<unused>;miopenConvolutionBwdDataAlgoGEMM:gemm,8.96186,0,MIOpenGEMM,0_1_784_128_784_784_128_512
64-56-56-1x1-64-56-56-128-0x0-1x1-1x1-0-NCHW-FP32-F=miopenConvolutionFwdAlgoWinograd:ConvBinWinogradRxSf3x2,0.83672,0,miopenConvolutionFwdAlgoWinograd,<unused>;miopenConvolutionFwdAlgoGEMM:GemmFwd1x1_0_1,10.7956,0,MIOpenGEMM,0_0_3136_64_3136_3136_64_64
256-14-14-3x3-256-14-14-128-1x1-1x1-1x1-0-NCHW-FP32-W=miopenConvolutionBwdWeightsAlgoWinograd:ConvBinWinogradRxS,2.66045,0,miopenConvolutionBwdWeightsAlgoWinograd,256x14x14x3x3x256x14x14x128xNCHWxFP32x1x1x1x1x1x1x1x0;miopenConvolutionBwdWeightsAlgoDirect:ConvAsmBwdWrW3x3,3.28327,0,miopenConvolutionBwdWeightsAlgoDirect,<unused>;miopenConvolutionBwdWeightsAlgoImplicitGEMM:ConvHipImplicitGemmV4R1WrW,6.17603,0,miopenConvolutionBwdWeightsAlgoImplicitGEMM,256x14x14x3x3x256x14x14x128xNCHWxFP32x1x1x1x1x1x1x1x0;miopenConvolutionBwdWeightsAlgoGEMM:gemm,23.9681,1806336,MIOpenGEMM,1_0_196_196_2304_2304_256_196
512-7-7-1x1-2048-7-7-128-0x0-1x1-1x1-0-NCHW-FP32-W=miopenConvolutionBwdWeightsAlgoDirect:ConvAsmBwdWrW1x1,1.74755,0,miopenConvolutionBwdWeightsAlgoDirect,<unused>;miopenConvolutionBwdWeightsAlgoGEMM:gemm,3.54778,0,MIOpenGEMM,1_0_49_49_2048_2048_512_49;miopenConvolutionBwdWeightsAlgoWinograd:ConvBinWinogradRxSf2x3,5.54745,0,miopenConvolutionBwdWeightsAlgoWinograd,512x7x7x1x1x2048x7x7x128xNCHWxFP32x0x0x1x1x1x1x1x0
3-230-230-7x7-64-112-112-128-0x0-2x2-1x1-0-NCHW-FP32-F=miopenConvolutionFwdAlgoWinograd:ConvBinWinogradRxS,4.72642,0,miopenConvolutionFwdAlgoWinograd,<unused>;miopenConvolutionFwdAlgoDirect:ConvOclDirectFwd,5.15755,0,miopenConvolutionFwdAlgoDirect,<unused>;miopenConvolutionFwdAlgoGEMM:GemmFwdRest,44.8992,7375872,MIOpenGEMM,0_0_12544_147_12544_12544_64_147
2048-7-7-1x1-512-7-7-128-0x0-1x1-1x1-0-NCHW-FP32-B=miopenConvolutionBwdDataAlgoDirect:ConvAsm1x1U,1.7435,0,miopenConvolutionBwdDataAlgoDirect,<unused>;miopenConvolutionBwdDataAlgoWinograd:ConvBinWinogradRxSf3x2,4.01339,0,miopenConvolutionBwdDataAlgoWinograd,<unused>;miopenConvolutionBwdDataAlgoGEMM:gemm,7.89649,0,MIOpenGEMM,0_1_49_512_49_49_512_2048
64-56-56-1x1-64-56-56-128-0x0-1x1-1x1-0-NCHW-FP32-W=miopenConvolutionBwdWeightsAlgoDirect:ConvOclBwdWrW1x1,1.11589,0,miopenConvolutionBwdWeightsAlgoDirect,<unused>
256-14-14-3x3-256-14-14-128-1x1-1x1-1x1-0-NCHW-FP32-B=miopenConvolutionBwdDataAlgoWinograd:ConvBinWinogradRxSf2x3,1.30988,0,miopenConvolutionBwdDataAlgoWinograd,<unused>
2048-7-7-1x1-1024-14-14-128-0x0-2x2-1x1-0-NCHW-FP32-B=miopenConvolutionBwdDataAlgoDirect:ConvAsm1x1UV2,3.67102,0,miopenConvolutionBwdDataAlgoDirect,<unused>;miopenConvolutionBwdDataAlgoGEMM:gemm,21.6144,77070336,MIOpenGEMM,0_1_6272_1024_6272_6272_1024_2048;miopenConvolutionBwdDataAlgoWinograd:ConvBinWinogradRxSf2x3,30.7803,0,miopenConvolutionBwdDataAlgoWinograd,<unused>
128-28-28-1x1-512-28-28-128-0x0-1x1-1x1-0-NCHW-FP32-F=miopenConvolutionFwdAlgoDirect:ConvAsm1x1U,1.79864,0,miopenConvolutionFwdAlgoDirect,<unused>;miopenConvolutionFwdAlgoGEMM:GemmFwd1x1_0_1,3.05681,0,MIOpenGEMM,0_0_784_128_784_784_512_128;miopenConvolutionFwdAlgoWinograd:ConvBinWinogradRxSf3x2,3.16614,0,miopenConvolutionFwdAlgoWinograd,<unused>
256-14-14-3x3-256-14-14-128-1x1-1x1-1x1-0-NCHW-FP32-F=miopenConvolutionFwdAlgoWinograd:ConvBinWinograd3x3U,1.32053,0,miopenConvolutionFwdAlgoWinograd,<unused>
1024-14-14-1x1-512-28-28-128-0x0-2x2-1x1-0-NCHW-FP32-B=miopenConvolutionBwdDataAlgoDirect:ConvAsm1x1UV2,3.22267,0,miopenConvolutionBwdDataAlgoDirect,<unused>;miopenConvolutionBwdDataAlgoWinograd:ConvBinWinogradRxSf2x3,24.8969,0,miopenConvolutionBwdDataAlgoWinograd,<unused>
1024-14-14-1x1-256-14-14-128-0x0-1x1-1x1-0-NCHW-FP32-B=miopenConvolutionBwdDataAlgoDirect:ConvAsm1x1U,1.77499,0,miopenConvolutionBwdDataAlgoDirect,<unused>;miopenConvolutionBwdDataAlgoWinograd:ConvBinWinogradRxSf3x2,2.9501,0,miopenConvolutionBwdDataAlgoWinograd,<unused>;miopenConvolutionBwdDataAlgoGEMM:gemm,6.45895,0,MIOpenGEMM,0_1_196_256_196_196_256_1024
64-56-56-1x1-64-56-56-128-0x0-1x1-1x1-0-NCHW-FP32-B=miopenConvolutionBwdDataAlgoDirect:ConvAsm1x1U,0.703444,0,miopenConvolutionBwdDataAlgoDirect,<unused>;miopenConvolutionBwdDataAlgoGEMM:gemm,3.2443,0,MIOpenGEMM,0_1_3136_64_3136_3136_64_64
512-7-7-1x1-2048-7-7-128-0x0-1x1-1x1-0-NCHW-FP32-F=miopenConvolutionFwdAlgoDirect:ConvAsm1x1U,2.41749,0,miopenConvolutionFwdAlgoDirect,<unused>;miopenConvolutionFwdAlgoGEMM:GemmFwd1x1_0_1,12.0051,0,MIOpenGEMM,0_0_49_512_49_49_2048_512
512-7-7-3x3-512-7-7-128-1x1-1x1-1x1-0-NCHW-FP32-F=miopenConvolutionFwdAlgoWinograd:ConvBinWinograd3x3U,1.56007,0,miopenConvolutionFwdAlgoWinograd,<unused>
256-56-56-1x1-64-56-56-128-0x0-1x1-1x1-0-NCHW-FP32-B=miopenConvolutionBwdDataAlgoDirect:ConvAsm1x1U,1.68918,0,miopenConvolutionBwdDataAlgoDirect,<unused>;miopenConvolutionBwdDataAlgoWinograd:ConvBinWinogradRxSf3x2,2.73816,0,miopenConvolutionBwdDataAlgoWinograd,<unused>;miopenConvolutionBwdDataAlgoGEMM:gemm,5.90109,0,MIOpenGEMM,0_1_3136_64_3136_3136_64_256
192-27-27-5x5-64-27-27-512-2x2-1x1-1x1-0-NCHW-FP32-B=miopenConvolutionBwdDataAlgoFFT:fft,14.3681,963706880,miopenConvolutionBwdDataAlgoFFT,192x27x27x5x5x64x27x27x512xNCHWxFP32x2x2x1x1x1x1x1x0;miopenConvolutionBwdDataAlgoWinograd:ConvBinWinogradRxSf2x3,15.6037,0,miopenConvolutionBwdDataAlgoWinograd,<unused>;miopenConvolutionBwdDataAlgoDirect:ConvOclDirectFwd,43.1785,0,miopenConvolutionBwdDataAlgoDirect,<unused>;miopenConvolutionBwdDataAlgoImplicitGEMM:ConvHipImplicitGemmBwdDataV1R1,51.6347,0,miopenConvolutionBwdDataAlgoImplicitGEMM,192x27x27x5x5x64x27x27x512xNCHWxFP32x2x2x1x1x1x1x1x0;miopenConvolutionBwdDataAlgoGEMM:gemm,79.5787,4665600,MIOpenGEMM,0_1_729_1600_729_729_1600_192
512-28-28-3x3-512-56-56-32-1x1-2x2-1x1-0-NCHW-FP32-W_g32=miopenConvolutionBwdWeightsAlgoDirect:ConvAsmBwdWrW3x3,0.903138,0,miopenConvolutionBwdWeightsAlgoDirect,<unused>;miopenConvolutionBwdWeightsAlgoGEMM:gemm,18.7343,14450688,MIOpenGEMM,1_0_784_784_144_144_16_784
1024-14-14-1x1-2048-7-7-128-0x0-2x2-1x1-0-NCHW-FP32-F=miopenConvolutionFwdAlgoGEMM:GemmFwd1x1_0_2,5.1418,77070336,MIOpenGEMM,0_0_6272_1024_6272_6272_2048_1024;miopenConvolutionFwdAlgoWinograd:ConvBinWinogradRxSf2x3,27.8483,0,miopenConvolutionFwdAlgoWinograd,<unused>
128-28-28-3x3-128-28-28-128-1x1-1x1-1x1-0-NCHW-FP32-W=miopenConvolutionBwdWeightsAlgoDirect:ConvAsmBwdWrW3x3,3.76406,0,miopenConvolutionBwdWeightsAlgoDirect,<unused>;miopenConvolutionBwdWeightsAlgoWinograd:ConvBinWinogradRxS,6.20319,0,miopenConvolutionBwdWeightsAlgoWinograd,128x28x28x3x3x128x28x28x128xNCHWxFP32x1x1x1x1x1x1x1x0;miopenConvolutionBwdWeightsAlgoImplicitGEMM:ConvHipImplicitGemmV4R1WrW,13.4884,0,miopenConvolutionBwdWeightsAlgoImplicitGEMM,128x28x28x3x3x128x28x28x128xNCHWxFP32x1x1x1x1x1x1x1x0;miopenConvolutionBwdWeightsAlgoGEMM:gemm,96.6434,3612672,MIOpenGEMM,1_0_784_784_1152_1152_128_784
64-56-56-1x1-256-56-56-128-0x0-1x1-1x1-0-NCHW-FP32-B=miopenConvolutionBwdDataAlgoDirect:ConvAsm1x1U,1.95221,0,miopenConvolutionBwdDataAlgoDirect,<unused>;miopenConvolutionBwdDataAlgoWinograd:ConvBinWinogradRxSf3x2,3.28325,0,miopenConvolutionBwdDataAlgoWinograd,<unused>;miopenConvolutionBwdDataAlgoGEMM:gemm,3.68907,0,MIOpenGEMM,0_1_3136_256_3136_3136_256_64
512-28-28-3x3-512-56-56-32-1x1-2x2-1x1-0-NCHW-FP32-B_g32=miopenConvolutionBwdDataAlgoWinograd:ConvBinWinogradRxSf2x3,1.42402,0,miopenConvolutionBwdDataAlgoWinograd,<unused>;miopenConvolutionBwdDataAlgoDirect:ConvOclDirectFwd,2.06045,0,miopenConvolutionBwdDataAlgoDirect,<unused>;miopenConvolutionBwdDataAlgoGEMM:gemm,10.5096,14450688,MIOpenGEMM,0_1_784_144_784_784_144_16
1024-14-14-1x1-256-14-14-128-0x0-1x1-1x1-0-NCHW-FP32-W=miopenConvolutionBwdWeightsAlgoDirect:ConvAsmBwdWrW1x1,1.93735,0,miopenConvolutionBwdWeightsAlgoDirect,<unused>;miopenConvolutionBwdWeightsAlgoWinograd:ConvBinWinogradRxSf2x3,5.58495,0,miopenConvolutionBwdWeightsAlgoWinograd,1024x14x14x1x1x256x14x14x128xNCHWxFP32x0x0x1x1x1x1x1x0;miopenConvolutionBwdWeightsAlgoGEMM:gemm,9.11917,0,MIOpenGEMM,1_0_196_196_256_256_1024_196
256-14-14-1x1-512-28-28-128-0x0-2x2-1x1-0-NCHW-FP32-W=miopenConvolutionBwdWeightsAlgoDirect:ConvOclBwdWrW1x1,1.96017,51380224,miopenConvolutionBwdWeightsAlgoDirect,<unused>;miopenConvolutionBwdWeightsAlgoImplicitGEMM:ConvHipImplicitGemmV4R1WrW,4.17082,0,miopenConvolutionBwdWeightsAlgoImplicitGEMM,256x14x14x1x1x512x28x28x128xNCHWxFP32x0x0x2x2x1x1x1x0;miopenConvolutionBwdWeightsAlgoGEMM:gemm,18.1175,401408,MIOpenGEMM,1_0_196_196_512_512_256_196
128-28-28-3x3-128-28-28-128-1x1-1x1-1x1-0-NCHW-FP32-B=miopenConvolutionBwdDataAlgoWinograd:ConvBinWinograd3x3U,1.26224,0,miopenConvolutionBwdDataAlgoWinograd,<unused>
384-13-13-3x3-384-13-13-512-1x1-1x1-1x1-0-NCHW-FP32-F=miopenConvolutionFwdAlgoWinograd:ConvBinWinograd3x3U,11.2869,0,miopenConvolutionFwdAlgoWinograd,<unused>
128-28-28-3x3-128-28-28-128-1x1-1x1-1x1-0-NCHW-FP32-F=miopenConvolutionFwdAlgoWinograd:ConvBinWinograd3x3U,1.30367,0,miopenConvolutionFwdAlgoWinograd,<unused>
384-13-13-3x3-384-13-13-512-1x1-1x1-1x1-0-NCHW-FP32-B=miopenConvolutionBwdDataAlgoWinograd:ConvBinWinograd3x3U,11.1988,0,miopenConvolutionBwdDataAlgoWinograd,<unused>
512-7-7-1x1-1024-14-14-128-0x0-2x2-1x1-0-NCHW-FP32-B=miopenConvolutionBwdDataAlgoDirect:ConvAsm1x1UV2,0.819547,0,miopenConvolutionBwdDataAlgoDirect,<unused>;miopenConvolutionBwdDataAlgoGEMM:gemm,2.24352,38535168,MIOpenGEMM,0_1_6272_1024_6272_6272_1024_512;miopenConvolutionBwdDataAlgoWinograd:ConvBinWinogradRxSf2x3,6.81853,0,miopenConvolutionBwdDataAlgoWinograd,<unused>
512-28-28-1x1-256-14-14-128-0x0-2x2-1x1-0-NCHW-FP32-F=miopenConvolutionFwdAlgoDirect:ConvAsm1x1UV2,1.1257,0,miopenConvolutionFwdAlgoDirect,<unused>;miopenConvolutionFwdAlgoWinograd:ConvBinWinogradRxS,5.12908,0,miopenConvolutionFwdAlgoWinograd,<unused>
512-7-7-1x1-1024-14-14-128-0x0-2x2-1x1-0-NCHW-FP32-W=miopenConvolutionBwdWeightsAlgoDirect:ConvAsmBwdWrW1x1,1.39323,25690112,miopenConvolutionBwdWeightsAlgoDirect,<unused>;miopenConvolutionBwdWeightsAlgoImplicitGEMM:ConvHipImplicitGemmV4R1WrW,1.53306,0,miopenConvolutionBwdWeightsAlgoImplicitGEMM,512x7x7x1x1x1024x14x14x128xNCHWxFP32x0x0x2x2x1x1x1x0;miopenConvolutionBwdWeightsAlgoGEMM:gemm,27.1596,200704,MIOpenGEMM,1_0_49_49_1024_1024_512_49
256-56-56-1x1-64-56-56-128-0x0-1x1-1x1-0-NCHW-FP32-F=miopenConvolutionFwdAlgoDirect:ConvOclDirectFwd1x1,1.37607,0,miopenConvolutionFwdAlgoDirect,<unused>;miopenConvolutionFwdAlgoWinograd:ConvBinWinogradRxSf3x2,2.79105,0,miopenConvolutionFwdAlgoWinograd,<unused>;miopenConvolutionFwdAlgoGEMM:GemmFwd1x1_0_1,3.88643,0,MIOpenGEMM,0_0_3136_256_3136_3136_64_256
512-56-56-3x3-512-28-28-32-1x1-2x2-1x1-0-NCHW-FP32-F_g32=miopenConvolutionFwdAlgoImplicitGEMM:ConvHipImplicitGemmV4R1Fwd,1.54244,0,miopenConvolutionFwdAlgoImplicitGEMM,512x56x56x3x3x512x28x28x32xNCHWxFP32x1x1x2x2x1x1x32x1;miopenConvolutionFwdAlgoWinograd:ConvBinWinogradRxSf2x3,1.7215,0,miopenConvolutionFwdAlgoWinograd,<unused>;miopenConvolutionFwdAlgoDirect:ConvOclDirectFwd,3.3207,0,miopenConvolutionFwdAlgoDirect,<unused>;miopenConvolutionFwdAlgoGEMM:GemmFwdRest,11.1058,14450688,MIOpenGEMM,0_0_784_144_784_784_16_144
64-56-56-3x3-64-56-56-128-1x1-1x1-1x1-0-NCHW-FP32-W=miopenConvolutionBwdWeightsAlgoDirect:ConvAsmBwdWrW3x3,3.32735,0,miopenConvolutionBwdWeightsAlgoDirect,<unused>;miopenConvolutionBwdWeightsAlgoWinograd:ConvBinWinogradRxSf2x3,12.7974,0,miopenConvolutionBwdWeightsAlgoWinograd,64x56x56x3x3x64x56x56x128xNCHWxFP32x1x1x1x1x1x1x1x0;miopenConvolutionBwdWeightsAlgoGEMM:gemm,39.1083,7225344,MIOpenGEMM,1_0_3136_3136_576_576_64_3136;miopenConvolutionBwdWeightsAlgoImplicitGEMM:ConvHipImplicitGemmV4R1WrW,47.3208,0,miopenConvolutionBwdWeightsAlgoImplicitGEMM,64x56x56x3x3x64x56x56x128xNCHWxFP32x1x1x1x1x1x1x1x0
64-27-27-5x5-192-27-27-512-2x2-1x1-1x1-0-NCHW-FP32-F=miopenConvolutionFwdAlgoFFT:fft,10.6274,856195072,miopenConvolutionFwdAlgoFFT,64x27x27x5x5x192x27x27x512xNCHWxFP32x2x2x1x1x1x1x1x1;miopenConvolutionFwdAlgoWinograd:ConvBinWinogradRxSf2x3,16.2026,0,miopenConvolutionFwdAlgoWinograd,<unused>;miopenConvolutionFwdAlgoImplicitGEMM:ConvHipImplicitGemmV4R1Fwd,22.5155,0,miopenConvolutionFwdAlgoImplicitGEMM,64x27x27x5x5x192x27x27x512xNCHWxFP32x2x2x1x1x1x1x1x1;miopenConvolutionFwdAlgoDirect:ConvOclDirectFwd,44.5223,0,miopenConvolutionFwdAlgoDirect,<unused>;miopenConvolutionFwdAlgoGEMM:GemmFwdRest,74.5764,4665600,MIOpenGEMM,0_0_729_1600_729_729_192_1600
256-56-56-3x3-128-56-56-128-1x1-1x1-1x1-0-NCHW-FP32-B=miopenConvolutionBwdDataAlgoWinograd:ConvBinWinograd3x3U,10.3402,0,miopenConvolutionBwdDataAlgoWinograd,<unused>
512-14-14-3x3-512-14-14-128-1x1-1x1-1x1-0-NCHW-FP32-F=miopenConvolutionFwdAlgoWinograd:ConvBinWinogradRxS,5.20297,0,miopenConvolutionFwdAlgoWinograd,<unused>
512-28-28-1x1-256-56-56-128-0x0-2x2-1x1-0-NCHW-FP32-W=miopenConvolutionBwdWeightsAlgoDirect:ConvAsmBwdWrW1x1,4.07353,102760448,miopenConvolutionBwdWeightsAlgoDirect,<unused>;miopenConvolutionBwdWeightsAlgoImplicitGEMM:ConvHipImplicitGemmV4R1WrW,11.6417,0,miopenConvolutionBwdWeightsAlgoImplicitGEMM,512x28x28x1x1x256x56x56x128xNCHWxFP32x0x0x2x2x1x1x1x0;miopenConvolutionBwdWeightsAlgoGEMM:gemm,15.7624,802816,MIOpenGEMM,1_0_784_784_256_256_512_784
256-13-13-3x3-384-13-13-512-1x1-1x1-1x1-0-NCHW-FP32-W=miopenConvolutionBwdWeightsAlgoWinograd:ConvBinWinogradRxS,23.6815,0,miopenConvolutionBwdWeightsAlgoWinograd,256x13x13x3x3x384x13x13x512xNCHWxFP32x1x1x1x1x1x1x1x0;miopenConvolutionBwdWeightsAlgoDirect:ConvAsmBwdWrW3x3,27.6296,0,miopenConvolutionBwdWeightsAlgoDirect,<unused>;miopenConvolutionBwdWeightsAlgoImplicitGEMM:ConvHipImplicitGemmV4R1WrW,39.2361,0,miopenConvolutionBwdWeightsAlgoImplicitGEMM,256x13x13x3x3x384x13x13x512xNCHWxFP32x1x1x1x1x1x1x1x0;miopenConvolutionBwdWeightsAlgoGEMM:gemm,1348.24,2336256,MIOpenGEMM,1_0_169_169_3456_3456_256_169
256-56-56-1x1-64-56-56-128-0x0-1x1-1x1-0-NCHW-FP32-W=miopenConvolutionBwdWeightsAlgoDirect:ConvAsmBwdWrW1x1,3.00784,0,miopenConvolutionBwdWeightsAlgoDirect,<unused>
128-28-28-1x1-512-28-28-128-0x0-1x1-1x1-0-NCHW-FP32-W=miopenConvolutionBwdWeightsAlgoDirect:ConvAsmBwdWrW1x1,1.7022,0,miopenConvolutionBwdWeightsAlgoDirect,<unused>
128-56-56-3x3-256-56-56-128-1x1-1x1-1x1-0-NCHW-FP32-F=miopenConvolutionFwdAlgoWinograd:ConvBinWinograd3x3U,10.611,0,miopenConvolutionFwdAlgoWinograd,<unused>
512-28-28-1x1-256-56-56-128-0x0-2x2-1x1-0-NCHW-FP32-B=miopenConvolutionBwdDataAlgoDirect:ConvAsm1x1UV2,2.76529,0,miopenConvolutionBwdDataAlgoDirect,<unused>;miopenConvolutionBwdDataAlgoGEMM:gemm,6.59963,308281344,MIOpenGEMM,0_1_100352_256_100352_100352_256_512;miopenConvolutionBwdDataAlgoWinograd:ConvBinWinogradRxSf2x3,32.3333,0,miopenConvolutionBwdDataAlgoWinograd,<unused>
256-14-14-1x1-1024-14-14-128-0x0-1x1-1x1-0-NCHW-FP32-F=miopenConvolutionFwdAlgoDirect:ConvOclDirectFwd1x1,1.45824,0,miopenConvolutionFwdAlgoDirect,<unused>;miopenConvolutionFwdAlgoWinograd:ConvBinWinogradRxSf3x2,2.91538,0,miopenConvolutionFwdAlgoWinograd,<unused>;miopenConvolutionFwdAlgoGEMM:GemmFwd1x1_0_1,3.77382,0,MIOpenGEMM,0_0_196_256_196_196_1024_256
1024-14-14-1x1-512-7-7-128-0x0-2x2-1x1-0-NCHW-FP32-F=miopenConvolutionFwdAlgoGEMM:GemmFwd1x1_0_2,1.203,38535168,MIOpenGEMM,0_0_6272_1024_6272_6272_512_1024;miopenConvolutionFwdAlgoWinograd:ConvBinWinogradRxS,6.30039,0,miopenConvolutionFwdAlgoWinograd,<unused>
384-13-13-3x3-384-13-13-512-1x1-1x1-1x1-0-NCHW-FP32-W=miopenConvolutionBwdWeightsAlgoWinograd:ConvBinWinogradRxS,19.7365,0,miopenConvolutionBwdWeightsAlgoWinograd,384x13x13x3x3x384x13x13x512xNCHWxFP32x1x1x1x1x1x1x1x0;miopenConvolutionBwdWeightsAlgoDirect:ConvAsmBwdWrW3x3,25.2877,0,miopenConvolutionBwdWeightsAlgoDirect,<unused>;miopenConvolutionBwdWeightsAlgoImplicitGEMM:ConvHipImplicitGemmV4R1WrW,29.4536,0,miopenConvolutionBwdWeightsAlgoImplicitGEMM,384x13x13x3x3x384x13x13x512xNCHWxFP32x1x1x1x1x1x1x1x0;miopenConvolutionBwdWeightsAlgoGEMM:gemm,568.745,2336256,MIOpenGEMM,1_0_169_169_3456_3456_384_169
512-7-7-1x1-2048-7-7-128-0x0-1x1-1x1-0-NCHW-FP32-B=miopenConvolutionBwdDataAlgoDirect:ConvAsm1x1U,1.52079,0,miopenConvolutionBwdDataAlgoDirect,<unused>;miopenConvolutionBwdDataAlgoWinograd:ConvBinWinogradRxSf3x2,3.86684,0,miopenConvolutionBwdDataAlgoWinograd,<unused>;miopenConvolutionBwdDataAlgoGEMM:gemm,6.0455,0,MIOpenGEMM,0_1_49_2048_49_49_2048_512
64-224-224-3x3-64-224-224-128-1x1-1x1-1x1-0-NCHW-FP32-B=miopenConvolutionBwdDataAlgoWinograd:ConvBinWinograd3x3U,23.3966,0,miopenConvolutionBwdDataAlgoWinograd,<unused>
128-28-28-1x1-512-28-28-128-0x0-1x1-1x1-0-NCHW-FP32-B=miopenConvolutionBwdDataAlgoDirect:ConvAsm1x1U,2.03141,0,miopenConvolutionBwdDataAlgoDirect,<unused>;miopenConvolutionBwdDataAlgoWinograd:ConvBinWinogradRxSf3x2,3.25402,0,miopenConvolutionBwdDataAlgoWinograd,<unused>;miopenConvolutionBwdDataAlgoGEMM:gemm,3.81189,0,MIOpenGEMM,0_1_784_512_784_784_512_128
256-14-14-1x1-512-28-28-128-0x0-2x2-1x1-0-NCHW-FP32-B=miopenConvolutionBwdDataAlgoDirect:ConvAsm1x1UV2,0.889163,0,miopenConvolutionBwdDataAlgoDirect,<unused>;miopenConvolutionBwdDataAlgoWinograd:ConvBinWinogradRxSf2x3,6.1993,0,miopenConvolutionBwdDataAlgoWinograd,<unused>
512-7-7-3x3-512-7-7-128-1x1-1x1-1x1-0-NCHW-FP32-W=miopenConvolutionBwdWeightsAlgoWinograd:ConvBinWinogradRxS,2.02448,0,miopenConvolutionBwdWeightsAlgoWinograd,512x7x7x3x3x512x7x7x128xNCHWxFP32x1x1x1x1x1x1x1x0;miopenConvolutionBwdWeightsAlgoDirect:ConvAsmBwdWrW3x3,2.93264,0,miopenConvolutionBwdWeightsAlgoDirect,<unused>;miopenConvolutionBwdWeightsAlgoImplicitGEMM:ConvHipImplicitGemmV4R1WrW,3.48638,0,miopenConvolutionBwdWeightsAlgoImplicitGEMM,512x7x7x3x3x512x7x7x128xNCHWxFP32x1x1x1x1x1x1x1x0;miopenConvolutionBwdWeightsAlgoGEMM:gemm,25.0054,903168,MIOpenGEMM,1_0_49_49_4608_4608_512_49
64-224-224-3x3-3-224-224-128-1x1-1x1-1x1-0-NCHW-FP32-W=miopenConvolutionBwdWeightsAlgoDirect:ConvAsmBwdWrW3x3,5.64998,0,miopenConvolutionBwdWeightsAlgoDirect,<unused>;miopenConvolutionBwdWeightsAlgoGEMM:gemm,218.444,5419008,MIOpenGEMM,1_0_50176_50176_27_27_64_50176;miopenConvolutionBwdWeightsAlgoWinograd:ConvBinWinogradRxSf2x3,366.712,0,miopenConvolutionBwdWeightsAlgoWinograd,64x224x224x3x3x3x224x224x128xNCHWxFP32x1x1x1x1x1x1x1x0
1024-14-14-1x1-512-28-28-128-0x0-2x2-1x1-0-NCHW-FP32-W=miopenConvolutionBwdWeightsAlgoDirect:ConvAsmBwdWrW1x1,3.4222,51380224,miopenConvolutionBwdWeightsAlgoDirect,<unused>;miopenConvolutionBwdWeightsAlgoImplicitGEMM:ConvHipImplicitGemmV4R1WrW,4.40612,0,miopenConvolutionBwdWeightsAlgoImplicitGEMM,1024x14x14x1x1x512x28x28x128xNCHWxFP32x0x0x2x2x1x1x1x0;miopenConvolutionBwdWeightsAlgoGEMM:gemm,26.2482,401408,MIOpenGEMM,1_0_196_196_512_512_1024_196
128-28-28-1x1-256-56-56-128-0x0-2x2-1x1-0-NCHW-FP32-W=miopenConvolutionBwdWeightsAlgoDirect:ConvAsmBwdWrW1x1,1.96564,102760448,miopenConvolutionBwdWeightsAlgoDirect,<unused>;miopenConvolutionBwdWeightsAlgoImplicitGEMM:ConvHipImplicitGemmV4R1WrW,12.0976,0,miopenConvolutionBwdWeightsAlgoImplicitGEMM,128x28x28x1x1x256x56x56x128xNCHWxFP32x0x0x2x2x1x1x1x0;miopenConvolutionBwdWeightsAlgoGEMM:gemm,21.4665,802816,MIOpenGEMM,1_0_784_784_256_256_128_784
64-224-224-3x3-64-224-224-128-1x1-1x1-1x1-0-NCHW-FP32-F=miopenConvolutionFwdAlgoWinograd:ConvBinWinograd3x3U,22.3341,0,miopenConvolutionFwdAlgoWinograd,<unused>
64-56-56-1x1-256-56-56-128-0x0-1x1-1x1-0-NCHW-FP32-F=miopenConvolutionFwdAlgoDirect:ConvOclDirectFwd1x1,1.30783,0,miopenConvolutionFwdAlgoDirect,<unused>
512-7-7-3x3-512-7-7-128-1x1-1x1-1x1-0-NCHW-FP32-B=miopenConvolutionBwdDataAlgoWinograd:ConvBinWinograd3x3U,1.60824,0,miopenConvolutionBwdDataAlgoWinograd,<unused>
3-224-224-3x3-64-224-224-128-1x1-1x1-1x1-0-NCHW-FP32-F=miopenConvolutionFwdAlgoWinograd:ConvBinWinogradRxSf2x3,4.86952,0,miopenConvolutionFwdAlgoWinograd,<unused>;miopenConvolutionFwdAlgoDirect:ConvOclDirectFwd,9.06876,0,miopenConvolutionFwdAlgoDirect,<unused>;miopenConvolutionFwdAlgoGEMM:GemmFwdRest,43.3238,5419008,MIOpenGEMM,0_0_50176_27_50176_50176_64_27
128-112-112-3x3-64-112-112-128-1x1-1x1-1x1-0-NCHW-FP32-B=miopenConvolutionBwdDataAlgoWinograd:ConvBinWinogradRxSf2x3,10.8221,0,miopenConvolutionBwdDataAlgoWinograd,<unused>
128-112-112-3x3-128-112-112-128-1x1-1x1-1x1-0-NCHW-FP32-W=miopenConvolutionBwdWeightsAlgoDirect:ConvAsmBwdWrW3x3,70.7451,0,miopenConvolutionBwdWeightsAlgoDirect,<unused>;miopenConvolutionBwdWeightsAlgoWinograd:ConvBinWinogradRxS,149.959,0,miopenConvolutionBwdWeightsAlgoWinograd,128x112x112x3x3x128x112x112x128xNCHWxFP32x1x1x1x1x1x1x1x0;miopenConvolutionBwdWeightsAlgoImplicitGEMM:ConvHipImplicitGemmV4R1WrW,255.249,0,miopenConvolutionBwdWeightsAlgoImplicitGEMM,128x112x112x3x3x128x112x112x128xNCHWxFP32x1x1x1x1x1x1x1x0;miopenConvolutionBwdWeightsAlgoGEMM:gemm,695.736,57802752,MIOpenGEMM,1_0_12544_12544_1152_1152_128_12544
512-28-28-1x1-128-28-28-128-0x0-1x1-1x1-0-NCHW-FP32-F=miopenConvolutionFwdAlgoDirect:ConvAsm1x1U,1.48635,0,miopenConvolutionFwdAlgoDirect,<unused>;miopenConvolutionFwdAlgoWinograd:ConvBinWinogradRxSf3x2,2.70023,0,miopenConvolutionFwdAlgoWinograd,<unused>;miopenConvolutionFwdAlgoGEMM:GemmFwd1x1_0_1,4.24859,0,MIOpenGEMM,0_0_784_512_784_784_128_512
256-13-13-3x3-384-13-13-512-1x1-1x1-1x1-0-NCHW-FP32-B=miopenConvolutionBwdDataAlgoWinograd:ConvBinWinograd3x3U,7.93888,0,miopenConvolutionBwdDataAlgoWinograd,<unused>
256-28-28-1x1-128-28-28-128-0x0-1x1-1x1-0-NCHW-FP32-F=miopenConvolutionFwdAlgoDirect:ConvAsm1x1U,0.867225,0,miopenConvolutionFwdAlgoDirect,<unused>;miopenConvolutionFwdAlgoWinograd:ConvBinWinogradRxSf3x2,1.4812,0,miopenConvolutionFwdAlgoWinograd,<unused>;miopenConvolutionFwdAlgoGEMM:GemmFwd1x1_0_1,2.64956,0,MIOpenGEMM,0_0_784_256_784_784_128_256
224-14-14-3x3-112-14-14-128-1x1-1x1-1x1-0-NCHW-FP32-W=miopenConvolutionBwdWeightsAlgoDirect:ConvAsmBwdWrW3x3,1.43566,0,miopenConvolutionBwdWeightsAlgoDirect,<unused>;miopenConvolutionBwdWeightsAlgoWinograd:ConvBinWinogradRxSf2x3,1.58863,0,miopenConvolutionBwdWeightsAlgoWinograd,224x14x14x3x3x112x14x14x128xNCHWxFP32x1x1x1x1x1x1x1x0;miopenConvolutionBwdWeightsAlgoGEMM:gemm,5.9561,790272,MIOpenGEMM,1_0_196_196_1008_1008_224_196
128-112-112-3x3-128-112-112-128-1x1-1x1-1x1-0-NCHW-FP32-B=miopenConvolutionBwdDataAlgoWinograd:ConvBinWinograd3x3U,20.6163,0,miopenConvolutionBwdDataAlgoWinograd,<unused>
320-7-7-3x3-160-7-7-128-1x1-1x1-1x1-0-NCHW-FP32-B=miopenConvolutionBwdDataAlgoWinograd:ConvBinWinogradRxS,0.3152,0,miopenConvolutionBwdDataAlgoWinograd,<unused>
16-14-14-5x5-48-14-14-128-2x2-1x1-1x1-0-NCHW-FP32-F=miopenConvolutionFwdAlgoWinograd:ConvBinWinogradRxSf2x3,0.130669,0,miopenConvolutionFwdAlgoWinograd,<unused>;miopenConvolutionFwdAlgoImplicitGEMM:ConvHipImplicitGemmV4R1Fwd,0.249821,0,miopenConvolutionFwdAlgoImplicitGEMM,16x14x14x5x5x48x14x14x128xNCHWxFP32x2x2x1x1x1x1x1x1;miopenConvolutionFwdAlgoDirect:ConvOclDirectFwd,0.285314,0,miopenConvolutionFwdAlgoDirect,<unused>;miopenConvolutionFwdAlgoFFT:fft,0.3801,17879040,miopenConvolutionFwdAlgoFFT,16x14x14x5x5x48x14x14x128xNCHWxFP32x2x2x1x1x1x1x1x1;miopenConvolutionFwdAlgoGEMM:GemmFwdRest,4.30899,313600,MIOpenGEMM,0_0_196_400_196_196_48_400
512-28-28-3x3-512-28-28-128-1x1-1x1-1x1-0-NCHW-FP32-W=miopenConvolutionBwdWeightsAlgoDirect:ConvAsmBwdWrW3x3,45.5196,0,miopenConvolutionBwdWeightsAlgoDirect,<unused>;miopenConvolutionBwdWeightsAlgoImplicitGEMM:ConvHipImplicitGemmV4R1WrW,53.7787,0,miopenConvolutionBwdWeightsAlgoImplicitGEMM,512x28x28x3x3x512x28x28x128xNCHWxFP32x1x1x1x1x1x1x1x0;miopenConvolutionBwdWeightsAlgoWinograd:ConvBinWinogradRxS,58.6593,0,miopenConvolutionBwdWeightsAlgoWinograd,512x28x28x3x3x512x28x28x128xNCHWxFP32x1x1x1x1x1x1x1x0;miopenConvolutionBwdWeightsAlgoGEMM:gemm,79.2947,14450688,MIOpenGEMM,1_0_784_784_4608_4608_512_784
224-14-14-3x3-112-14-14-128-1x1-1x1-1x1-0-NCHW-FP32-B=miopenConvolutionBwdDataAlgoWinograd:ConvBinWinogradRxS,0.586541,0,miopenConvolutionBwdDataAlgoWinograd,<unused>
64-28-28-1x1-192-28-28-128-0x0-1x1-1x1-0-NCHW-FP32-W=miopenConvolutionBwdWeightsAlgoDirect:ConvAsmBwdWrW1x1,0.637355,0,miopenConvolutionBwdWeightsAlgoDirect,<unused>
288-14-14-3x3-144-14-14-128-1x1-1x1-1x1-0-NCHW-FP32-W=miopenConvolutionBwdWeightsAlgoWinograd:ConvBinWinogradRxS,2.02457,0,miopenConvolutionBwdWeightsAlgoWinograd,288x14x14x3x3x144x14x14x128xNCHWxFP32x1x1x1x1x1x1x1x0;miopenConvolutionBwdWeightsAlgoDirect:ConvAsmBwdWrW3x3,2.38702,0,miopenConvolutionBwdWeightsAlgoDirect,<unused>;miopenConvolutionBwdWeightsAlgoGEMM:gemm,7.58685,1016064,MIOpenGEMM,1_0_196_196_1296_1296_288_196
160-7-7-3x3-320-7-7-128-1x1-1x1-1x1-0-NCHW-FP32-F=miopenConvolutionFwdAlgoWinograd:ConvBinWinogradRxSf2x3,0.341948,0,miopenConvolutionFwdAlgoWinograd,<unused>
512-28-28-3x3-256-28-28-128-1x1-1x1-1x1-0-NCHW-FP32-B=miopenConvolutionBwdDataAlgoWinograd:ConvBinWinograd3x3U,10.043,0,miopenConvolutionBwdDataAlgoWinograd,<unused>
64-14-14-5x5-24-14-14-128-2x2-1x1-1x1-0-NCHW-FP32-W=miopenConvolutionBwdWeightsAlgoDirect:ConvOclBwdWrW53,0.441616,19660800,miopenConvolutionBwdWeightsAlgoDirect,<unused>;miopenConvolutionBwdWeightsAlgoWinograd:ConvBinWinogradRxSf2x3,0.748382,0,miopenConvolutionBwdWeightsAlgoWinograd,64x14x14x5x5x24x14x14x128xNCHWxFP32x2x2x1x1x1x1x1x0;miopenConvolutionBwdWeightsAlgoGEMM:gemm,4.16799,470400,MIOpenGEMM,1_0_196_196_600_600_64_196
112-14-14-3x3-224-14-14-128-1x1-1x1-1x1-0-NCHW-FP32-F=miopenConvolutionFwdAlgoWinograd:ConvBinWinograd3x3U,0.559146,0,miopenConvolutionFwdAlgoWinograd,<unused>
64-112-112-7x7-3-225-225-128-2x2-2x2-1x1-0-NCHW-FP32-B=miopenConvolutionBwdDataAlgoDirect:ConvOclDirectFwd,9.21029,0,miopenConvolutionBwdDataAlgoDirect,<unused>;miopenConvolutionBwdDataAlgoWinograd:ConvBinWinogradRxS,16.4177,0,miopenConvolutionBwdDataAlgoWinograd,<unused>;miopenConvolutionBwdDataAlgoGEMM:gemm,43.0042,7375872,MIOpenGEMM,0_1_12544_147_12544_12544_147_64
320-14-14-3x3-160-14-14-128-1x1-1x1-1x1-0-NCHW-FP32-W=miopenConvolutionBwdWeightsAlgoWinograd:ConvBinWinogradRxS,2.11462,0,miopenConvolutionBwdWeightsAlgoWinograd,320x14x14x3x3x160x14x14x128xNCHWxFP32x1x1x1x1x1x1x1x0;miopenConvolutionBwdWeightsAlgoDirect:ConvAsmBwdWrW3x3,2.76794,0,miopenConvolutionBwdWeightsAlgoDirect,<unused>;miopenConvolutionBwdWeightsAlgoGEMM:gemm,11.6739,1128960,MIOpenGEMM,1_0_196_196_1440_1440_320_196
512-14-14-3x3-512-14-14-128-1x1-1x1-1x1-0-NCHW-FP32-B=miopenConvolutionBwdDataAlgoWinograd:ConvBinWinogradRxS,5.05426,0,miopenConvolutionBwdDataAlgoWinograd,<unused>
64-14-14-5x5-24-14-14-128-2x2-1x1-1x1-0-NCHW-FP32-B=miopenConvolutionBwdDataAlgoWinograd:ConvBinWinogradRxSf2x3,0.222118,0,miopenConvolutionBwdDataAlgoWinograd,<unused>;miopenConvolutionBwdDataAlgoFFT:fft,0.321625,28385280,miopenConvolutionBwdDataAlgoFFT,64x14x14x5x5x24x14x14x128xNCHWxFP32x2x2x1x1x1x1x1x0;miopenConvolutionBwdDataAlgoDirect:ConvOclDirectFwd,0.470312,0,miopenConvolutionBwdDataAlgoDirect,<unused>;miopenConvolutionBwdDataAlgoGEMM:gemm,5.35069,470400,MIOpenGEMM,0_1_196_600_196_196_600_64
288-14-14-3x3-144-14-14-128-1x1-1x1-1x1-0-NCHW-FP32-B=miopenConvolutionBwdDataAlgoWinograd:ConvBinWinogradRxS,0.928223,0,miopenConvolutionBwdDataAlgoWinograd,<unused>
256-56-56-3x3-256-56-56-128-1x1-1x1-1x1-0-NCHW-FP32-W=miopenConvolutionBwdWeightsAlgoWinograd:ConvBinWinogradRxS,37.5703,0,miopenConvolutionBwdWeightsAlgoWinograd,256x56x56x3x3x256x56x56x128xNCHWxFP32x1x1x1x1x1x1x1x0;miopenConvolutionBwdWeightsAlgoDirect:ConvAsmBwdWrW3x3,43.1428,0,miopenConvolutionBwdWeightsAlgoDirect,<unused>;miopenConvolutionBwdWeightsAlgoGEMM:gemm,59.8748,28901376,MIOpenGEMM,1_0_3136_3136_2304_2304_256_3136;miopenConvolutionBwdWeightsAlgoImplicitGEMM:ConvHipImplicitGemmV4R1WrW,75.9437,0,miopenConvolutionBwdWeightsAlgoImplicitGEMM,256x56x56x3x3x256x56x56x128xNCHWxFP32x1x1x1x1x1x1x1x0
128-112-112-3x3-128-112-112-128-1x1-1x1-1x1-0-NCHW-FP32-F=miopenConvolutionFwdAlgoWinograd:ConvBinWinograd3x3U,20.8955,0,miopenConvolutionFwdAlgoWinograd,<unused>
320-14-14-3x3-160-14-14-128-1x1-1x1-1x1-0-NCHW-FP32-B=miopenConvolutionBwdDataAlgoWinograd:ConvBinWinogradRxSf2x3,1.01432,0,miopenConvolutionBwdDataAlgoWinograd,<unused>
3-225-225-7x7-64-112-112-128-2x2-2x2-1x1-0-NCHW-FP32-F=miopenConvolutionFwdAlgoWinograd:ConvBinWinogradRxS,4.53986,0,miopenConvolutionFwdAlgoWinograd,<unused>;miopenConvolutionFwdAlgoDirect:ConvOclDirectFwd,4.9297,0,miopenConvolutionFwdAlgoDirect,<unused>;miopenConvolutionFwdAlgoGEMM:GemmFwdRest,8.42573,7375872,MIOpenGEMM,0_0_12544_147_12544_12544_64_147
64-28-28-1x1-192-28-28-128-0x0-1x1-1x1-0-NCHW-FP32-B=miopenConvolutionBwdDataAlgoDirect:ConvAsm1x1U,0.435806,0,miopenConvolutionBwdDataAlgoDirect,<unused>;miopenConvolutionBwdDataAlgoWinograd:ConvBinWinogradRxSf3x2,0.684907,0,miopenConvolutionBwdDataAlgoWinograd,<unused>;miopenConvolutionBwdDataAlgoGEMM:gemm,2.69376,0,MIOpenGEMM,0_1_784_192_784_784_192_64
192-14-14-1x1-480-14-14-128-0x0-1x1-1x1-0-NCHW-FP32-B=miopenConvolutionBwdDataAlgoDirect:ConvAsm1x1U,0.724313,0,miopenConvolutionBwdDataAlgoDirect,<unused>;miopenConvolutionBwdDataAlgoGEMM:gemm,2.08883,0,MIOpenGEMM,0_1_196_480_196_196_480_192
128-112-112-3x3-64-112-112-128-1x1-1x1-1x1-0-NCHW-FP32-W=miopenConvolutionBwdWeightsAlgoDirect:ConvAsmBwdWrW3x3,37.1055,0,miopenConvolutionBwdWeightsAlgoDirect,<unused>;miopenConvolutionBwdWeightsAlgoWinograd:ConvBinWinogradRxSf2x3,92.8261,0,miopenConvolutionBwdWeightsAlgoWinograd,128x112x112x3x3x64x112x112x128xNCHWxFP32x1x1x1x1x1x1x1x0;miopenConvolutionBwdWeightsAlgoImplicitGEMM:ConvHipImplicitGemmV4R1WrW,316.886,0,miopenConvolutionBwdWeightsAlgoImplicitGEMM,128x112x112x3x3x64x112x112x128xNCHWxFP32x1x1x1x1x1x1x1x0;miopenConvolutionBwdWeightsAlgoGEMM:gemm,1636.1,28901376,MIOpenGEMM,1_0_12544_12544_576_576_128_12544
256-56-56-3x3-256-56-56-128-1x1-1x1-1x1-0-NCHW-FP32-B=miopenConvolutionBwdDataAlgoWinograd:ConvBinWinograd3x3U,20.0935,0,miopenConvolutionBwdDataAlgoWinograd,<unused>
144-14-14-3x3-288-14-14-128-1x1-1x1-1x1-0-NCHW-FP32-F=miopenConvolutionFwdAlgoWinograd:ConvBinWinogradRxSf2x3,0.872594,0,miopenConvolutionFwdAlgoWinograd,<unused>
96-28-28-5x5-32-28-28-128-2x2-1x1-1x1-0-NCHW-FP32-W=miopenConvolutionBwdWeightsAlgoDirect:ConvOclBwdWrW53,1.77305,39321600,miopenConvolutionBwdWeightsAlgoDirect,<unused>;miopenConvolutionBwdWeightsAlgoWinograd:ConvBinWinogradRxSf2x3,2.59438,0,miopenConvolutionBwdWeightsAlgoWinograd,96x28x28x5x5x32x28x28x128xNCHWxFP32x2x2x1x1x1x1x1x0;miopenConvolutionBwdWeightsAlgoGEMM:gemm,6.37952,2508800,MIOpenGEMM,1_0_784_784_800_800_96_784
160-14-14-3x3-320-14-14-128-1x1-1x1-1x1-0-NCHW-FP32-F=miopenConvolutionFwdAlgoWinograd:ConvBinWinograd3x3U,1.01913,0,miopenConvolutionFwdAlgoWinograd,<unused>
64-28-28-1x1-256-28-28-128-0x0-1x1-1x1-0-NCHW-FP32-W=miopenConvolutionBwdWeightsAlgoDirect:ConvAsmBwdWrW1x1,0.652405,0,miopenConvolutionBwdWeightsAlgoDirect,<unused>
24-14-14-5x5-64-14-14-128-2x2-1x1-1x1-0-NCHW-FP32-F=miopenConvolutionFwdAlgoWinograd:ConvBinWinogradRxSf2x3,0.222267,0,miopenConvolutionFwdAlgoWinograd,<unused>;miopenConvolutionFwdAlgoImplicitGEMM:ConvHipImplicitGemmV4R1Fwd,0.274435,0,miopenConvolutionFwdAlgoImplicitGEMM,24x14x14x5x5x64x14x14x128xNCHWxFP32x2x2x1x1x1x1x1x1;miopenConvolutionFwdAlgoDirect:ConvOclDirectFwd,0.479974,0,miopenConvolutionFwdAlgoDirect,<unused>;miopenConvolutionFwdAlgoFFT:fft,0.504967,23777280,miopenConvolutionFwdAlgoFFT,24x14x14x5x5x64x14x14x128xNCHWxFP32x2x2x1x1x1x1x1x1;miopenConvolutionFwdAlgoGEMM:GemmFwdRest,5.28694,470400,MIOpenGEMM,0_0_196_600_196_196_64_600
256-56-56-3x3-256-56-56-128-1x1-1x1-1x1-0-NCHW-FP32-F=miopenConvolutionFwdAlgoWinograd:ConvBinWinograd3x3U,19.3155,0,miopenConvolutionFwdAlgoWinograd,<unused>
64-28-28-1x1-256-28-28-128-0x0-1x1-1x1-0-NCHW-FP32-B=miopenConvolutionBwdDataAlgoDirect:ConvAsm1x1U,0.612509,0,miopenConvolutionBwdDataAlgoDirect,<unused>;miopenConvolutionBwdDataAlgoWinograd:ConvBinWinogradRxSf3x2,0.913365,0,miopenConvolutionBwdDataAlgoWinograd,<unused>;miopenConvolutionBwdDataAlgoGEMM:gemm,2.6602,0,MIOpenGEMM,0_1_784_256_784_784_256_64
512-14-14-1x1-128-14-14-128-0x0-1x1-1x1-0-NCHW-FP32-F=miopenConvolutionFwdAlgoDirect:ConvOclDirectFwd1x1,0.41356,0,miopenConvolutionFwdAlgoDirect,<unused>;miopenConvolutionFwdAlgoWinograd:ConvBinWinogradRxSf3x2,0.838829,0,miopenConvolutionFwdAlgoWinograd,<unused>;miopenConvolutionFwdAlgoGEMM:GemmFwd1x1_0_1,4.43422,0,MIOpenGEMM,0_0_196_512_196_196_128_512
480-14-14-1x1-192-14-14-128-0x0-1x1-1x1-0-NCHW-FP32-F=miopenConvolutionFwdAlgoDirect:ConvAsm1x1U,0.664813,0,miopenConvolutionFwdAlgoDirect,<unused>;miopenConvolutionFwdAlgoWinograd:ConvBinWinogradRxSf3x2,1.15925,0,miopenConvolutionFwdAlgoWinograd,<unused>;miopenConvolutionFwdAlgoGEMM:GemmFwd1x1_0_1,4.16088,0,MIOpenGEMM,0_0_196_480_196_196_192_480
512-28-28-3x3-512-28-28-128-1x1-1x1-1x1-0-NCHW-FP32-F=miopenConvolutionFwdAlgoWinograd:ConvBinWinograd3x3U,20.0354,0,miopenConvolutionFwdAlgoWinograd,<unused>
32-28-28-5x5-16-28-28-128-2x2-1x1-1x1-0-NCHW-FP32-W=miopenConvolutionBwdWeightsAlgoDirect:ConvOclBwdWrW53,0.367229,6553600,miopenConvolutionBwdWeightsAlgoDirect,<unused>;miopenConvolutionBwdWeightsAlgoWinograd:ConvBinWinogradRxSf2x3,2.66158,0,miopenConvolutionBwdWeightsAlgoWinograd,32x28x28x5x5x16x28x28x128xNCHWxFP32x2x2x1x1x1x1x1x0;miopenConvolutionBwdWeightsAlgoGEMM:gemm,3.50171,1254400,MIOpenGEMM,1_0_784_784_400_400_32_784
192-28-28-3x3-128-28-28-128-1x1-1x1-1x1-0-NCHW-FP32-W=miopenConvolutionBwdWeightsAlgoDirect:ConvAsmBwdWrW3x3,4.78109,0,miopenConvolutionBwdWeightsAlgoDirect,<unused>;miopenConvolutionBwdWeightsAlgoWinograd:ConvBinWinogradRxS,5.80039,0,miopenConvolutionBwdWeightsAlgoWinograd,192x28x28x3x3x128x28x28x128xNCHWxFP32x1x1x1x1x1x1x1x0;miopenConvolutionBwdWeightsAlgoImplicitGEMM:ConvHipImplicitGemmV4R1WrW,11.1493,0,miopenConvolutionBwdWeightsAlgoImplicitGEMM,192x28x28x3x3x128x28x28x128xNCHWxFP32x1x1x1x1x1x1x1x0;miopenConvolutionBwdWeightsAlgoGEMM:gemm,16.6254,3612672,MIOpenGEMM,1_0_784_784_1152_1152_192_784
96-28-28-5x5-32-28-28-128-2x2-1x1-1x1-0-NCHW-FP32-B=miopenConvolutionBwdDataAlgoWinograd:ConvBinWinogradRxS,0.974391,0,miopenConvolutionBwdDataAlgoWinograd,<unused>;miopenConvolutionBwdDataAlgoFFT:fft,0.990657,134807552,miopenConvolutionBwdDataAlgoFFT,96x28x28x5x5x32x28x28x128xNCHWxFP32x2x2x1x1x1x1x1x0;miopenConvolutionBwdDataAlgoDirect:ConvOclDirectFwd,3.02302,0,miopenConvolutionBwdDataAlgoDirect,<unused>;miopenConvolutionBwdDataAlgoImplicitGEMM:ConvHipImplicitGemmBwdDataV1R1,5.52392,0,miopenConvolutionBwdDataAlgoImplicitGEMM,96x28x28x5x5x32x28x28x128xNCHWxFP32x2x2x1x1x1x1x1x0;miopenConvolutionBwdDataAlgoGEMM:gemm,7.16978,2508800,MIOpenGEMM,0_1_784_800_784_784_800_96
192-28-28-1x1-64-28-28-128-0x0-1x1-1x1-0-NCHW-FP32-F=miopenConvolutionFwdAlgoDirect:ConvOclDirectFwd1x1,0.24961,0,miopenConvolutionFwdAlgoDirect,<unused>;miopenConvolutionFwdAlgoWinograd:ConvBinWinogradRxSf3x2,0.537324,0,miopenConvolutionFwdAlgoWinograd,<unused>;miopenConvolutionFwdAlgoGEMM:GemmFwd1x1_0_1,1.82737,0,MIOpenGEMM,0_0_784_192_784_784_64_192
32-28-28-5x5-16-28-28-128-2x2-1x1-1x1-0-NCHW-FP32-B=miopenConvolutionBwdDataAlgoFFT:fft,0.33277,41222144,miopenConvolutionBwdDataAlgoFFT,32x28x28x5x5x16x28x28x128xNCHWxFP32x2x2x1x1x1x1x1x0;miopenConvolutionBwdDataAlgoWinograd:ConvBinWinogradRxS,0.3482,0,miopenConvolutionBwdDataAlgoWinograd,<unused>;miopenConvolutionBwdDataAlgoDirect:ConvOclDirectFwd,0.478798,0,miopenConvolutionBwdDataAlgoDirect,<unused>;miopenConvolutionBwdDataAlgoGEMM:gemm,5.0082,1254400,MIOpenGEMM,0_1_784_400_784_784_400_32
384-7-7-3x3-192-7-7-128-1x1-1x1-1x1-0-NCHW-FP32-W=miopenConvolutionBwdWeightsAlgoDirect:ConvAsmBwdWrW3x3,0.909536,0,miopenConvolutionBwdWeightsAlgoDirect,<unused>;miopenConvolutionBwdWeightsAlgoWinograd:ConvBinWinogradRxS,0.994882,0,miopenConvolutionBwdWeightsAlgoWinograd,384x7x7x3x3x192x7x7x128xNCHWxFP32x1x1x1x1x1x1x1x0;miopenConvolutionBwdWeightsAlgoImplicitGEMM:ConvHipImplicitGemmV4R1WrW,1.37953,0,miopenConvolutionBwdWeightsAlgoImplicitGEMM,384x7x7x3x3x192x7x7x128xNCHWxFP32x1x1x1x1x1x1x1x0;miopenConvolutionBwdWeightsAlgoGEMM:gemm,10.3723,338688,MIOpenGEMM,1_0_49_49_1728_1728_384_49
512-28-28-3x3-256-28-28-128-1x1-1x1-1x1-0-NCHW-FP32-W=miopenConvolutionBwdWeightsAlgoWinograd:ConvBinWinogradRxS,19.0338,0,miopenConvolutionBwdWeightsAlgoWinograd,512x28x28x3x3x256x28x28x128xNCHWxFP32x1x1x1x1x1x1x1x0;miopenConvolutionBwdWeightsAlgoDirect:ConvAsmBwdWrW3x3,25.6423,0,miopenConvolutionBwdWeightsAlgoDirect,<unused>;miopenConvolutionBwdWeightsAlgoImplicitGEMM:ConvHipImplicitGemmV4R1WrW,32.9757,0,miopenConvolutionBwdWeightsAlgoImplicitGEMM,512x28x28x3x3x256x28x28x128xNCHWxFP32x1x1x1x1x1x1x1x0;miopenConvolutionBwdWeightsAlgoGEMM:gemm,95.9446,7225344,MIOpenGEMM,1_0_784_784_2304_2304_512_784
112-14-14-1x1-512-14-14-128-0x0-1x1-1x1-0-NCHW-FP32-W=miopenConvolutionBwdWeightsAlgoDirect:ConvAsmBwdWrW1x1,0.476006,0,miopenConvolutionBwdWeightsAlgoDirect,<unused>
24-14-14-1x1-512-14-14-128-0x0-1x1-1x1-0-NCHW-FP32-B=miopenConvolutionBwdDataAlgoDirect:ConvAsm1x1U,0.108333,0,miopenConvolutionBwdDataAlgoDirect,<unused>;miopenConvolutionBwdDataAlgoWinograd:ConvBinWinogradRxSf3x2,0.268781,0,miopenConvolutionBwdDataAlgoWinograd,<unused>;miopenConvolutionBwdDataAlgoGEMM:gemm,0.767021,0,MIOpenGEMM,0_1_196_512_196_196_512_24
64-112-112-3x3-128-112-112-128-1x1-1x1-1x1-0-NCHW-FP32-F=miopenConvolutionFwdAlgoWinograd:ConvBinWinograd3x3U,10.6532,0,miopenConvolutionFwdAlgoWinograd,<unused>
16-14-14-1x1-480-14-14-128-0x0-1x1-1x1-0-NCHW-FP32-W=miopenConvolutionBwdWeightsAlgoDirect:ConvAsmBwdWrW1x1,0.137096,0,miopenConvolutionBwdWeightsAlgoDirect,<unused>;miopenConvolutionBwdWeightsAlgoWinograd:ConvBinWinogradRxSf2x3,0.818416,0,miopenConvolutionBwdWeightsAlgoWinograd,16x14x14x1x1x480x14x14x128xNCHWxFP32x0x0x1x1x1x1x1x0;miopenConvolutionBwdWeightsAlgoGEMM:gemm,1.21958,0,MIOpenGEMM,1_0_196_196_480_480_16_196
192-28-28-3x3-128-28-28-128-1x1-1x1-1x1-0-NCHW-FP32-B=miopenConvolutionBwdDataAlgoWinograd:ConvBinWinogradRxS,1.83192,0,miopenConvolutionBwdDataAlgoWinograd,<unused>
512-14-14-3x3-512-14-14-128-1x1-1x1-1x1-0-NCHW-FP32-W=miopenConvolutionBwdWeightsAlgoDirect:ConvAsmBwdWrW3x3,13.7124,0,miopenConvolutionBwdWeightsAlgoDirect,<unused>;miopenConvolutionBwdWeightsAlgoWinograd:ConvBinWinogradRxS,14.2979,0,miopenConvolutionBwdWeightsAlgoWinograd,512x14x14x3x3x512x14x14x128xNCHWxFP32x1x1x1x1x1x1x1x0;miopenConvolutionBwdWeightsAlgoImplicitGEMM:ConvHipImplicitGemmV4R1WrW,43.2389,0,miopenConvolutionBwdWeightsAlgoImplicitGEMM,512x14x14x3x3x512x14x14x128xNCHWxFP32x1x1x1x1x1x1x1x0;miopenConvolutionBwdWeightsAlgoGEMM:gemm,636.652,3612672,MIOpenGEMM,1_0_196_196_4608_4608_512_196
256-28-28-1x1-64-28-28-128-0x0-1x1-1x1-0-NCHW-FP32-F=miopenConvolutionFwdAlgoDirect:ConvOclDirectFwd1x1,0.405403,0,miopenConvolutionFwdAlgoDirect,<unused>;miopenConvolutionFwdAlgoWinograd:ConvBinWinogradRxSf3x2,0.913314,0,miopenConvolutionFwdAlgoWinograd,<unused>;miopenConvolutionFwdAlgoGEMM:GemmFwd1x1_0_1,3.08188,0,MIOpenGEMM,0_0_784_256_784_784_64_256
32-28-28-5x5-96-28-28-128-2x2-1x1-1x1-0-NCHW-FP32-F=miopenConvolutionFwdAlgoFFT:fft,1.00219,107511808,miopenConvolutionFwdAlgoFFT,32x28x28x5x5x96x28x28x128xNCHWxFP32x2x2x1x1x1x1x1x1;miopenConvolutionFwdAlgoWinograd:ConvBinWinogradRxS,1.08192,0,miopenConvolutionFwdAlgoWinograd,<unused>;miopenConvolutionFwdAlgoImplicitGEMM:ConvHipImplicitGemmV4R1Fwd,1.74633,0,miopenConvolutionFwdAlgoImplicitGEMM,32x28x28x5x5x96x28x28x128xNCHWxFP32x2x2x1x1x1x1x1x1;miopenConvolutionFwdAlgoDirect:ConvOclDirectFwd,2.94922,0,miopenConvolutionFwdAlgoDirect,<unused>;miopenConvolutionFwdAlgoGEMM:GemmFwdRest,6.91059,2508800,MIOpenGEMM,0_0_784_800_784_784_96_800
384-7-7-3x3-192-7-7-128-1x1-1x1-1x1-0-NCHW-FP32-B=miopenConvolutionBwdDataAlgoWinograd:ConvBinWinogradRxS,0.484533,0,miopenConvolutionBwdDataAlgoWinograd,<unused>
512-14-14-1x1-24-14-14-128-0x0-1x1-1x1-0-NCHW-FP32-F=miopenConvolutionFwdAlgoDirect:ConvOclDirectFwd1x1,0.208152,0,miopenConvolutionFwdAlgoDirect,<unused>;miopenConvolutionFwdAlgoWinograd:ConvBinWinogradRxSf3x2,0.246402,0,miopenConvolutionFwdAlgoWinograd,<unused>;miopenConvolutionFwdAlgoGEMM:GemmFwd1x1_0_1,1.61909,0,MIOpenGEMM,0_0_196_512_196_196_24_512
16-14-14-1x1-480-14-14-128-0x0-1x1-1x1-0-NCHW-FP32-B=miopenConvolutionBwdDataAlgoDirect:ConvOclDirectFwd1x1,0.276799,0,miopenConvolutionBwdDataAlgoDirect,<unused>;miopenConvolutionBwdDataAlgoGEMM:gemm,1.20564,0,MIOpenGEMM,0_1_196_480_196_196_480_16
192-7-7-3x3-384-7-7-128-1x1-1x1-1x1-0-NCHW-FP32-F=miopenConvolutionFwdAlgoWinograd:ConvBinWinogradRxSf2x3,0.509421,0,miopenConvolutionFwdAlgoWinograd,<unused>
112-14-14-1x1-512-14-14-128-0x0-1x1-1x1-0-NCHW-FP32-B=miopenConvolutionBwdDataAlgoDirect:ConvAsm1x1U,0.527102,0,miopenConvolutionBwdDataAlgoDirect,<unused>;miopenConvolutionBwdDataAlgoGEMM:gemm,15.11,0,MIOpenGEMM,0_1_196_512_196_196_512_112
256-28-28-3x3-512-28-28-128-1x1-1x1-1x1-0-NCHW-FP32-F=miopenConvolutionFwdAlgoWinograd:ConvBinWinograd3x3U,10.1298,0,miopenConvolutionFwdAlgoWinograd,<unused>
32-28-28-1x1-256-28-28-128-0x0-1x1-1x1-0-NCHW-FP32-W=miopenConvolutionBwdWeightsAlgoDirect:ConvAsmBwdWrW1x1,0.414705,0,miopenConvolutionBwdWeightsAlgoDirect,<unused>
64-14-14-5x5-32-14-14-128-2x2-1x1-1x1-0-NCHW-FP32-W=miopenConvolutionBwdWeightsAlgoDirect:ConvOclBwdWrW53,0.590233,26214400,miopenConvolutionBwdWeightsAlgoDirect,<unused>;miopenConvolutionBwdWeightsAlgoWinograd:ConvBinWinogradRxSf2x3,0.802322,0,miopenConvolutionBwdWeightsAlgoWinograd,64x14x14x5x5x32x14x14x128xNCHWxFP32x2x2x1x1x1x1x1x0;miopenConvolutionBwdWeightsAlgoGEMM:gemm,3.78532,627200,MIOpenGEMM,1_0_196_196_800_800_64_196
32-28-28-1x1-192-28-28-128-0x0-1x1-1x1-0-NCHW-FP32-W=miopenConvolutionBwdWeightsAlgoDirect:ConvAsmBwdWrW1x1,0.327028,0,miopenConvolutionBwdWeightsAlgoDirect,<unused>
96-28-28-1x1-192-28-28-128-0x0-1x1-1x1-0-NCHW-FP32-W=miopenConvolutionBwdWeightsAlgoDirect:ConvAsmBwdWrW1x1,0.811081,0,miopenConvolutionBwdWeightsAlgoDirect,<unused>
128-28-28-3x3-192-28-28-128-1x1-1x1-1x1-0-NCHW-FP32-F=miopenConvolutionFwdAlgoWinograd:ConvBinWinogradRxS,1.90037,0,miopenConvolutionFwdAlgoWinograd,<unused>
160-14-14-1x1-512-14-14-128-0x0-1x1-1x1-0-NCHW-FP32-W=miopenConvolutionBwdWeightsAlgoDirect:ConvAsmBwdWrW1x1,0.805884,0,miopenConvolutionBwdWeightsAlgoDirect,<unused>
480-14-14-1x1-16-14-14-128-0x0-1x1-1x1-0-NCHW-FP32-F=miopenConvolutionFwdAlgoDirect:ConvOclDirectFwd1x1,0.194012,0,miopenConvolutionFwdAlgoDirect,<unused>;miopenConvolutionFwdAlgoGEMM:GemmFwd1x1_0_1,1.74084,0,MIOpenGEMM,0_0_196_480_196_196_16_480
256-56-56-3x3-128-56-56-128-1x1-1x1-1x1-0-NCHW-FP32-W=miopenConvolutionBwdWeightsAlgoDirect:ConvAsmBwdWrW3x3,22.118,0,miopenConvolutionBwdWeightsAlgoDirect,<unused>;miopenConvolutionBwdWeightsAlgoWinograd:ConvBinWinogradRxS,29.771,0,miopenConvolutionBwdWeightsAlgoWinograd,256x56x56x3x3x128x56x56x128xNCHWxFP32x1x1x1x1x1x1x1x0;miopenConvolutionBwdWeightsAlgoGEMM:gemm,33.1417,14450688,MIOpenGEMM,1_0_3136_3136_1152_1152_256_3136;miopenConvolutionBwdWeightsAlgoImplicitGEMM:ConvHipImplicitGemmV4R1WrW,54.8305,0,miopenConvolutionBwdWeightsAlgoImplicitGEMM,256x56x56x3x3x128x56x56x128xNCHWxFP32x1x1x1x1x1x1x1x0
128-7-7-5x5-48-7-7-128-2x2-1x1-1x1-0-NCHW-FP32-W=miopenConvolutionBwdWeightsAlgoWinograd:ConvBinWinogradRxSf2x3,0.429361,0,miopenConvolutionBwdWeightsAlgoWinograd,128x7x7x5x5x48x7x7x128xNCHWxFP32x2x2x1x1x1x1x1x0;miopenConvolutionBwdWeightsAlgoDirect:ConvOclBwdWrW2<8>,0.825841,9830400,miopenConvolutionBwdWeightsAlgoDirect,<unused>;miopenConvolutionBwdWeightsAlgoGEMM:gemm,3.88654,235200,MIOpenGEMM,1_0_49_49_1200_1200_128_49
64-14-14-5x5-32-14-14-128-2x2-1x1-1x1-0-NCHW-FP32-B=miopenConvolutionBwdDataAlgoWinograd:ConvBinWinogradRxSf2x3,0.2365,0,miopenConvolutionBwdDataAlgoWinograd,<unused>;miopenConvolutionBwdDataAlgoFFT:fft,0.283126,29859840,miopenConvolutionBwdDataAlgoFFT,64x14x14x5x5x32x14x14x128xNCHWxFP32x2x2x1x1x1x1x1x0;miopenConvolutionBwdDataAlgoDirect:ConvOclDirectFwd,0.626027,0,miopenConvolutionBwdDataAlgoDirect,<unused>;miopenConvolutionBwdDataAlgoImplicitGEMM:ConvHipImplicitGemmBwdDataV1R1,1.79398,0,miopenConvolutionBwdDataAlgoImplicitGEMM,64x14x14x5x5x32x14x14x128xNCHWxFP32x2x2x1x1x1x1x1x0;miopenConvolutionBwdDataAlgoGEMM:gemm,5.76937,627200,MIOpenGEMM,0_1_196_800_196_196_800_64
512-14-14-1x1-112-14-14-128-0x0-1x1-1x1-0-NCHW-FP32-F=miopenConvolutionFwdAlgoDirect:ConvAsm1x1U,0.403077,0,miopenConvolutionFwdAlgoDirect,<unused>;miopenConvolutionFwdAlgoGEMM:GemmFwd1x1_0_1,4.2091,0,MIOpenGEMM,0_0_196_512_196_196_112_512
16-28-28-5x5-32-28-28-128-2x2-1x1-1x1-0-NCHW-FP32-F=miopenConvolutionFwdAlgoWinograd:ConvBinWinogradRxSf2x3,0.222166,0,miopenConvolutionFwdAlgoWinograd,<unused>;miopenConvolutionFwdAlgoImplicitGEMM:ConvHipImplicitGemmV4R1Fwd,0.368746,0,miopenConvolutionFwdAlgoImplicitGEMM,16x28x28x5x5x32x28x28x128xNCHWxFP32x2x2x1x1x1x1x1x1;miopenConvolutionFwdAlgoFFT:fft,0.451624,36208640,miopenConvolutionFwdAlgoFFT,16x28x28x5x5x32x28x28x128xNCHWxFP32x2x2x1x1x1x1x1x1;miopenConvolutionFwdAlgoDirect:ConvOclDirectFwd,0.704594,0,miopenConvolutionFwdAlgoDirect,<unused>;miopenConvolutionFwdAlgoGEMM:GemmFwdRest,10.8193,1254400,MIOpenGEMM,0_0_784_400_784_784_32_400
32-28-28-1x1-256-28-28-128-0x0-1x1-1x1-0-NCHW-FP32-B=miopenConvolutionBwdDataAlgoDirect:ConvAsm1x1U,0.284386,0,miopenConvolutionBwdDataAlgoDirect,<unused>;miopenConvolutionBwdDataAlgoGEMM:gemm,1.58449,0,MIOpenGEMM,0_1_784_256_784_784_256_32
528-14-14-1x1-160-14-14-128-0x0-1x1-1x1-0-NCHW-FP32-F=miopenConvolutionFwdAlgoDirect:ConvAsm1x1U,0.717845,0,miopenConvolutionFwdAlgoDirect,<unused>;miopenConvolutionFwdAlgoGEMM:GemmFwd1x1_0_1,4.57728,0,MIOpenGEMM,0_0_196_528_196_196_160_528
128-7-7-5x5-48-7-7-128-2x2-1x1-1x1-0-NCHW-FP32-B=miopenConvolutionBwdDataAlgoWinograd:ConvBinWinogradRxSf2x3,0.226735,0,miopenConvolutionBwdDataAlgoWinograd,<unused>;miopenConvolutionBwdDataAlgoFFT:fft,0.268137,30449664,miopenConvolutionBwdDataAlgoFFT,128x7x7x5x5x48x7x7x128xNCHWxFP32x2x2x1x1x1x1x1x0;miopenConvolutionBwdDataAlgoDirect:ConvOclDirectFwd,0.977576,0,miopenConvolutionBwdDataAlgoDirect,<unused>;miopenConvolutionBwdDataAlgoGEMM:gemm,4.84224,235200,MIOpenGEMM,0_1_49_1200_49_49_1200_128
96-28-28-1x1-192-28-28-128-0x0-1x1-1x1-0-NCHW-FP32-B=miopenConvolutionBwdDataAlgoDirect:ConvAsm1x1U,0.475628,0,miopenConvolutionBwdDataAlgoDirect,<unused>;miopenConvolutionBwdDataAlgoGEMM:gemm,28.2281,0,MIOpenGEMM,0_1_784_192_784_784_192_96
256-28-28-1x1-32-28-28-128-0x0-1x1-1x1-0-NCHW-FP32-F=miopenConvolutionFwdAlgoDirect:ConvAsm1x1U,0.243006,0,miopenConvolutionFwdAlgoDirect,<unused>;miopenConvolutionFwdAlgoGEMM:GemmFwd1x1_0_1,2.36829,0,MIOpenGEMM,0_0_784_256_784_784_32_256
32-28-28-1x1-192-28-28-128-0x0-1x1-1x1-0-NCHW-FP32-B=miopenConvolutionBwdDataAlgoDirect:ConvAsm1x1U,0.198415,0,miopenConvolutionBwdDataAlgoDirect,<unused>;miopenConvolutionBwdDataAlgoGEMM:gemm,1.14788,0,MIOpenGEMM,0_1_784_192_784_784_192_32
256-14-14-3x3-128-14-14-128-1x1-1x1-1x1-0-NCHW-FP32-W=miopenConvolutionBwdWeightsAlgoDirect:ConvAsmBwdWrW3x3,1.8945,0,miopenConvolutionBwdWeightsAlgoDirect,<unused>;miopenConvolutionBwdWeightsAlgoWinograd:ConvBinWinogradRxS,2.16146,0,miopenConvolutionBwdWeightsAlgoWinograd,256x14x14x3x3x128x14x14x128xNCHWxFP32x1x1x1x1x1x1x1x0;miopenConvolutionBwdWeightsAlgoImplicitGEMM:ConvHipImplicitGemmV4R1WrW,3.91691,0,miopenConvolutionBwdWeightsAlgoImplicitGEMM,256x14x14x3x3x128x14x14x128xNCHWxFP32x1x1x1x1x1x1x1x0;miopenConvolutionBwdWeightsAlgoGEMM:gemm,5.358,903168,MIOpenGEMM,1_0_196_196_1152_1152_256_196
96-14-14-1x1-480-14-14-128-0x0-1x1-1x1-0-NCHW-FP32-W=miopenConvolutionBwdWeightsAlgoDirect:ConvAsmBwdWrW1x1,0.571581,0,miopenConvolutionBwdWeightsAlgoDirect,<unused>;miopenConvolutionBwdWeightsAlgoWinograd:ConvBinWinogradRxSf2x3,1.14221,0,miopenConvolutionBwdWeightsAlgoWinograd,96x14x14x1x1x480x14x14x128xNCHWxFP32x0x0x1x1x1x1x1x0;miopenConvolutionBwdWeightsAlgoGEMM:gemm,2.59945,0,MIOpenGEMM,1_0_196_196_480_480_96_196
48-14-14-5x5-16-14-14-128-2x2-1x1-1x1-0-NCHW-FP32-W=miopenConvolutionBwdWeightsAlgoDirect:ConvOclBwdWrW53,0.237619,9830400,miopenConvolutionBwdWeightsAlgoDirect,<unused>;miopenConvolutionBwdWeightsAlgoWinograd:ConvBinWinogradRxSf2x3,0.786041,0,miopenConvolutionBwdWeightsAlgoWinograd,48x14x14x5x5x16x14x14x128xNCHWxFP32x2x2x1x1x1x1x1x0;miopenConvolutionBwdWeightsAlgoGEMM:gemm,4.65644,313600,MIOpenGEMM,1_0_196_196_400_400_48_196
32-14-14-5x5-64-14-14-128-2x2-1x1-1x1-0-NCHW-FP32-F=miopenConvolutionFwdAlgoWinograd:ConvBinWinogradRxS,0.245866,0,miopenConvolutionFwdAlgoWinograd,<unused>;miopenConvolutionFwdAlgoImplicitGEMM:ConvHipImplicitGemmV4R1Fwd,0.351085,0,miopenConvolutionFwdAlgoImplicitGEMM,32x14x14x5x5x64x14x14x128xNCHWxFP32x2x2x1x1x1x1x1x1;miopenConvolutionFwdAlgoFFT:fft,0.407772,23777280,miopenConvolutionFwdAlgoFFT,32x14x14x5x5x64x14x14x128xNCHWxFP32x2x2x1x1x1x1x1x1;miopenConvolutionFwdAlgoDirect:ConvOclDirectFwd,0.633964,0,miopenConvolutionFwdAlgoDirect,<unused>;miopenConvolutionFwdAlgoGEMM:GemmFwdRest,6.3447,627200,MIOpenGEMM,0_0_196_800_196_196_64_800
48-7-7-5x5-128-7-7-128-2x2-1x1-1x1-0-NCHW-FP32-F=miopenConvolutionFwdAlgoWinograd:ConvBinWinogradRxSf2x3,0.19214,0,miopenConvolutionFwdAlgoWinograd,<unused>;miopenConvolutionFwdAlgoImplicitGEMM:ConvHipImplicitGemmV4R1Fwd,0.318837,0,miopenConvolutionFwdAlgoImplicitGEMM,48x7x7x5x5x128x7x7x128xNCHWxFP32x2x2x1x1x1x1x1x1;miopenConvolutionFwdAlgoFFT:fft,0.362104,22106112,miopenConvolutionFwdAlgoFFT,48x7x7x5x5x128x7x7x128xNCHWxFP32x2x2x1x1x1x1x1x1;miopenConvolutionFwdAlgoDirect:ConvOclDirectFwd,0.829198,0,miopenConvolutionFwdAlgoDirect,<unused>;miopenConvolutionFwdAlgoGEMM:GemmFwdRest,4.75002,235200,MIOpenGEMM,0_0_49_1200_49_49_128_1200
128-14-14-1x1-528-14-14-128-0x0-1x1-1x1-0-NCHW-FP32-W=miopenConvolutionBwdWeightsAlgoDirect:ConvAsmBwdWrW1x1,0.842804,0,miopenConvolutionBwdWeightsAlgoDirect,<unused>;miopenConvolutionBwdWeightsAlgoWinograd:ConvBinWinogradRxSf2x3,1.7833,0,miopenConvolutionBwdWeightsAlgoWinograd,128x14x14x1x1x528x14x14x128xNCHWxFP32x0x0x1x1x1x1x1x0;miopenConvolutionBwdWeightsAlgoGEMM:gemm,2.55905,0,MIOpenGEMM,1_0_196_196_528_528_128_196
512-28-28-3x3-512-28-28-128-1x1-1x1-1x1-0-NCHW-FP32-B=miopenConvolutionBwdDataAlgoWinograd:ConvBinWinograd3x3U,18.982,0,miopenConvolutionBwdDataAlgoWinograd,<unused>
256-14-14-3x3-128-14-14-128-1x1-1x1-1x1-0-NCHW-FP32-B=miopenConvolutionBwdDataAlgoWinograd:ConvBinWinograd3x3U,0.647848,0,miopenConvolutionBwdDataAlgoWinograd,<unused>
128-14-14-5x5-32-14-14-128-2x2-1x1-1x1-0-NCHW-FP32-W=miopenConvolutionBwdWeightsAlgoWinograd:ConvBinWinogradRxSf2x3,0.802133,0,miopenConvolutionBwdWeightsAlgoWinograd,128x14x14x5x5x32x14x14x128xNCHWxFP32x2x2x1x1x1x1x1x0;miopenConvolutionBwdWeightsAlgoDirect:ConvOclBwdWrW53,1.14753,52428800,miopenConvolutionBwdWeightsAlgoDirect,<unused>;miopenConvolutionBwdWeightsAlgoGEMM:gemm,3.72687,627200,MIOpenGEMM,1_0_196_196_800_800_128_196
128-14-14-1x1-528-14-14-128-0x0-1x1-1x1-0-NCHW-FP32-B=miopenConvolutionBwdDataAlgoDirect:ConvAsm1x1U,0.453058,0,miopenConvolutionBwdDataAlgoDirect,<unused>;miopenConvolutionBwdDataAlgoGEMM:gemm,25.7782,0,MIOpenGEMM,0_1_196_528_196_196_528_128
192-28-28-1x1-32-28-28-128-0x0-1x1-1x1-0-NCHW-FP32-F=miopenConvolutionFwdAlgoDirect:ConvOclDirectFwd1x1,0.205917,0,miopenConvolutionFwdAlgoDirect,<unused>;miopenConvolutionFwdAlgoGEMM:GemmFwd1x1_0_1,2.24318,0,MIOpenGEMM,0_0_784_192_784_784_32_192
48-14-14-5x5-16-14-14-128-2x2-1x1-1x1-0-NCHW-FP32-B=miopenConvolutionBwdDataAlgoWinograd:ConvBinWinogradRxS,0.175134,0,miopenConvolutionBwdDataAlgoWinograd,<unused>;miopenConvolutionBwdDataAlgoDirect:ConvOclDirectFwd,0.417196,0,miopenConvolutionBwdDataAlgoDirect,<unused>;miopenConvolutionBwdDataAlgoFFT:fft,0.67822,20275200,miopenConvolutionBwdDataAlgoFFT,48x14x14x5x5x16x14x14x128xNCHWxFP32x2x2x1x1x1x1x1x0;miopenConvolutionBwdDataAlgoGEMM:gemm,5.02831,313600,MIOpenGEMM,0_1_196_400_196_196_400_48
128-14-14-5x5-32-14-14-128-2x2-1x1-1x1-0-NCHW-FP32-B=miopenConvolutionBwdDataAlgoWinograd:ConvBinWinogradRxSf2x3,0.415659,0,miopenConvolutionBwdDataAlgoWinograd,<unused>;miopenConvolutionBwdDataAlgoFFT:fft,0.44624,59351040,miopenConvolutionBwdDataAlgoFFT,128x14x14x5x5x32x14x14x128xNCHWxFP32x2x2x1x1x1x1x1x0;miopenConvolutionBwdDataAlgoDirect:ConvOclDirectFwd,1.10998,0,miopenConvolutionBwdDataAlgoDirect,<unused>;miopenConvolutionBwdDataAlgoImplicitGEMM:ConvHipImplicitGemmBwdDataV1R1,1.69058,0,miopenConvolutionBwdDataAlgoImplicitGEMM,128x14x14x5x5x32x14x14x128xNCHWxFP32x2x2x1x1x1x1x1x0;miopenConvolutionBwdDataAlgoGEMM:gemm,5.78508,627200,MIOpenGEMM,0_1_196_800_196_196_800_128
128-14-14-3x3-256-14-14-128-1x1-1x1-1x1-0-NCHW-FP32-F=miopenConvolutionFwdAlgoWinograd:ConvBinWinograd3x3U,0.666043,0,miopenConvolutionFwdAlgoWinograd,<unused>
16-28-28-1x1-192-28-28-128-0x0-1x1-1x1-0-NCHW-FP32-W=miopenConvolutionBwdWeightsAlgoDirect:ConvAsmBwdWrW1x1,0.22264,0,miopenConvolutionBwdWeightsAlgoDirect,<unused>
32-14-14-5x5-128-14-14-128-2x2-1x1-1x1-0-NCHW-FP32-F=miopenConvolutionFwdAlgoWinograd:ConvBinWinogradRxSf2x3,0.38228,0,miopenConvolutionFwdAlgoWinograd,<unused>;miopenConvolutionFwdAlgoFFT:fft,0.50803,47370240,miopenConvolutionFwdAlgoFFT,32x14x14x5x5x128x14x14x128xNCHWxFP32x2x2x1x1x1x1x1x1;miopenConvolutionFwdAlgoImplicitGEMM:ConvHipImplicitGemmV4R1Fwd,0.648786,0,miopenConvolutionFwdAlgoImplicitGEMM,32x14x14x5x5x128x14x14x128xNCHWxFP32x2x2x1x1x1x1x1x1;miopenConvolutionFwdAlgoDirect:ConvOclDirectFwd,1.15229,0,miopenConvolutionFwdAlgoDirect,<unused>;miopenConvolutionFwdAlgoGEMM:GemmFwdRest,7.56922,627200,MIOpenGEMM,0_0_196_800_196_196_128_800
384-7-7-1x1-832-7-7-128-0x0-1x1-1x1-0-NCHW-FP32-W=miopenConvolutionBwdWeightsAlgoDirect:ConvAsmBwdWrW1x1,0.983649,0,miopenConvolutionBwdWeightsAlgoDirect,<unused>;miopenConvolutionBwdWeightsAlgoWinograd:ConvBinWinogradRxSf2x3,1.64726,0,miopenConvolutionBwdWeightsAlgoWinograd,384x7x7x1x1x832x7x7x128xNCHWxFP32x0x0x1x1x1x1x1x0;miopenConvolutionBwdWeightsAlgoGEMM:gemm,2.07719,0,MIOpenGEMM,1_0_49_49_832_832_384_49
16-28-28-1x1-192-28-28-128-0x0-1x1-1x1-0-NCHW-FP32-B=miopenConvolutionBwdDataAlgoDirect:ConvOclDirectFwd1x1,0.267031,0,miopenConvolutionBwdDataAlgoDirect,<unused>;miopenConvolutionBwdDataAlgoWinograd:ConvBinWinogradRxSf2x3,0.479083,0,miopenConvolutionBwdDataAlgoWinograd,<unused>;miopenConvolutionBwdDataAlgoGEMM:gemm,0.605888,0,MIOpenGEMM,0_1_784_192_784_784_192_16
64-112-112-7x7-3-225-225-128-2x2-2x2-1x1-0-NCHW-FP32-W=miopenConvolutionBwdWeightsAlgoDirect:ConvOclBwdWrW2<2>,7.33631,2408448,miopenConvolutionBwdWeightsAlgoDirect,<unused>;miopenConvolutionBwdWeightsAlgoGEMM:gemm,17.8281,7375872,MIOpenGEMM,1_0_12544_12544_147_147_64_12544
832-7-7-1x1-192-7-7-128-0x0-1x1-1x1-0-NCHW-FP32-F=miopenConvolutionFwdAlgoDirect:ConvAsm1x1U,0.260304,0,miopenConvolutionFwdAlgoDirect,<unused>;miopenConvolutionFwdAlgoWinograd:ConvBinWinogradRxSf3x2,0.701319,0,miopenConvolutionFwdAlgoWinograd,<unused>;miopenConvolutionFwdAlgoGEMM:GemmFwd1x1_0_1,4.69476,0,MIOpenGEMM,0_0_49_832_49_49_192_832
384-7-7-1x1-832-7-7-128-0x0-1x1-1x1-0-NCHW-FP32-B=miopenConvolutionBwdDataAlgoDirect:ConvAsm1x1U,0.536271,0,miopenConvolutionBwdDataAlgoDirect,<unused>;miopenConvolutionBwdDataAlgoWinograd:ConvBinWinogradRxSf3x2,1.32178,0,miopenConvolutionBwdDataAlgoWinograd,<unused>;miopenConvolutionBwdDataAlgoGEMM:gemm,3.14479,0,MIOpenGEMM,0_1_49_832_49_49_832_384
192-56-56-3x3-64-56-56-128-1x1-1x1-1x1-0-NCHW-FP32-B=miopenConvolutionBwdDataAlgoWinograd:ConvBinWinogradRxSf2x3,3.48615,0,miopenConvolutionBwdDataAlgoWinograd,<unused>
24-14-14-1x1-512-14-14-128-0x0-1x1-1x1-0-NCHW-FP32-W=miopenConvolutionBwdWeightsAlgoDirect:ConvAsmBwdWrW1x1,0.174508,0,miopenConvolutionBwdWeightsAlgoDirect,<unused>;miopenConvolutionBwdWeightsAlgoWinograd:ConvBinWinogradRxSf2x3,0.789803,0,miopenConvolutionBwdWeightsAlgoWinograd,24x14x14x1x1x512x14x14x128xNCHWxFP32x0x0x1x1x1x1x1x0;miopenConvolutionBwdWeightsAlgoGEMM:gemm,1.25145,0,MIOpenGEMM,1_0_196_196_512_512_24_196
64-56-56-3x3-192-56-56-128-1x1-1x1-1x1-0-NCHW-FP32-F=miopenConvolutionFwdAlgoWinograd:ConvBinWinograd3x3U,3.96784,0,miopenConvolutionFwdAlgoWinograd,<unused>
528-14-14-1x1-128-14-14-128-0x0-1x1-1x1-0-NCHW-FP32-F=miopenConvolutionFwdAlgoDirect:ConvOclDirectFwd1x1,0.491033,0,miopenConvolutionFwdAlgoDirect,<unused>;miopenConvolutionFwdAlgoWinograd:ConvBinWinogradRxSf3x2,0.857427,0,miopenConvolutionFwdAlgoWinograd,<unused>;miopenConvolutionFwdAlgoGEMM:GemmFwd1x1_0_1,4.71194,0,MIOpenGEMM,0_0_196_528_196_196_128_528
480-14-14-1x1-96-14-14-128-0x0-1x1-1x1-0-NCHW-FP32-F=miopenConvolutionFwdAlgoDirect:ConvAsm1x1U,0.434901,0,miopenConvolutionFwdAlgoDirect,<unused>;miopenConvolutionFwdAlgoGEMM:GemmFwd1x1_0_1,4.0495,0,MIOpenGEMM,0_0_196_480_196_196_96_480
128-28-28-3x3-96-28-28-128-1x1-1x1-1x1-0-NCHW-FP32-B=miopenConvolutionBwdDataAlgoWinograd:ConvBinWinograd3x3U,0.984387,0,miopenConvolutionBwdDataAlgoWinograd,<unused>
512-14-14-1x1-160-14-14-128-0x0-1x1-1x1-0-NCHW-FP32-F=miopenConvolutionFwdAlgoDirect:ConvOclDirectFwd1x1,0.614698,0,miopenConvolutionFwdAlgoDirect,<unused>;miopenConvolutionFwdAlgoGEMM:GemmFwd1x1_0_1,4.80151,0,MIOpenGEMM,0_0_196_512_196_196_160_512
32-14-14-1x1-528-14-14-128-0x0-1x1-1x1-0-NCHW-FP32-W=miopenConvolutionBwdWeightsAlgoDirect:ConvAsmBwdWrW1x1,0.300029,0,miopenConvolutionBwdWeightsAlgoDirect,<unused>;miopenConvolutionBwdWeightsAlgoWinograd:ConvBinWinogradRxSf2x3,0.845071,0,miopenConvolutionBwdWeightsAlgoWinograd,32x14x14x1x1x528x14x14x128xNCHWxFP32x0x0x1x1x1x1x1x0;miopenConvolutionBwdWeightsAlgoGEMM:gemm,1.61133,0,MIOpenGEMM,1_0_196_196_528_528_32_196
32-7-7-5x5-128-7-7-128-2x2-1x1-1x1-0-NCHW-FP32-F=miopenConvolutionFwdAlgoWinograd:ConvBinWinogradRxSf2x3,0.133139,0,miopenConvolutionFwdAlgoWinograd,<unused>;miopenConvolutionFwdAlgoImplicitGEMM:ConvHipImplicitGemmV4R1Fwd,0.198688,0,miopenConvolutionFwdAlgoImplicitGEMM,32x7x7x5x5x128x7x7x128xNCHWxFP32x2x2x1x1x1x1x1x1;miopenConvolutionFwdAlgoFFT:fft,0.250217,22106112,miopenConvolutionFwdAlgoFFT,32x7x7x5x5x128x7x7x128xNCHWxFP32x2x2x1x1x1x1x1x1;miopenConvolutionFwdAlgoDirect:ConvOclDirectFwd,0.510462,0,miopenConvolutionFwdAlgoDirect,<unused>;miopenConvolutionFwdAlgoGEMM:GemmFwdRest,3.84892,156800,MIOpenGEMM,0_0_49_800_49_49_128_800
64-14-14-1x1-512-14-14-128-0x0-1x1-1x1-0-NCHW-FP32-W=miopenConvolutionBwdWeightsAlgoDirect:ConvAsmBwdWrW1x1,0.413616,0,miopenConvolutionBwdWeightsAlgoDirect,<unused>
144-14-14-1x1-512-14-14-128-0x0-1x1-1x1-0-NCHW-FP32-W=miopenConvolutionBwdWeightsAlgoDirect:ConvAsmBwdWrW1x1,0.98392,0,miopenConvolutionBwdWeightsAlgoDirect,<unused>
32-14-14-1x1-528-14-14-128-0x0-1x1-1x1-0-NCHW-FP32-B=miopenConvolutionBwdDataAlgoDirect:ConvOclDirectFwd1x1,0.266701,0,miopenConvolutionBwdDataAlgoDirect,<unused>;miopenConvolutionBwdDataAlgoGEMM:gemm,1.02667,0,MIOpenGEMM,0_1_196_528_196_196_528_32
64-14-14-1x1-480-14-14-128-0x0-1x1-1x1-0-NCHW-FP32-W=miopenConvolutionBwdWeightsAlgoDirect:ConvAsmBwdWrW1x1,0.2994,0,miopenConvolutionBwdWeightsAlgoDirect,<unused>;miopenConvolutionBwdWeightsAlgoWinograd:ConvBinWinogradRxSf2x3,0.823932,0,miopenConvolutionBwdWeightsAlgoWinograd,64x14x14x1x1x480x14x14x128xNCHWxFP32x0x0x1x1x1x1x1x0;miopenConvolutionBwdWeightsAlgoGEMM:gemm,2.3297,0,MIOpenGEMM,1_0_196_196_480_480_64_196
160-7-7-1x1-832-7-7-128-0x0-1x1-1x1-0-NCHW-FP32-W=miopenConvolutionBwdWeightsAlgoDirect:ConvAsmBwdWrW1x1,0.389646,0,miopenConvolutionBwdWeightsAlgoDirect,<unused>;miopenConvolutionBwdWeightsAlgoGEMM:gemm,1.39378,0,MIOpenGEMM,1_0_49_49_832_832_160_49
128-28-28-3x3-96-28-28-128-1x1-1x1-1x1-0-NCHW-FP32-W=miopenConvolutionBwdWeightsAlgoDirect:ConvAsmBwdWrW3x3,2.26918,0,miopenConvolutionBwdWeightsAlgoDirect,<unused>;miopenConvolutionBwdWeightsAlgoWinograd:ConvBinWinogradRxSf2x3,2.9135,0,miopenConvolutionBwdWeightsAlgoWinograd,128x28x28x3x3x96x28x28x128xNCHWxFP32x1x1x1x1x1x1x1x0;miopenConvolutionBwdWeightsAlgoGEMM:gemm,8.02,2709504,MIOpenGEMM,1_0_784_784_864_864_128_784
320-7-7-3x3-160-7-7-128-1x1-1x1-1x1-0-NCHW-FP32-W=miopenConvolutionBwdWeightsAlgoWinograd:ConvBinWinogradRxS,0.47852,0,miopenConvolutionBwdWeightsAlgoWinograd,320x7x7x3x3x160x7x7x128xNCHWxFP32x1x1x1x1x1x1x1x0;miopenConvolutionBwdWeightsAlgoDirect:ConvAsmBwdWrW3x3,0.716415,0,miopenConvolutionBwdWeightsAlgoDirect,<unused>;miopenConvolutionBwdWeightsAlgoGEMM:gemm,3.07002,282240,MIOpenGEMM,1_0_49_49_1440_1440_320_49
32-7-7-1x1-832-7-7-128-0x0-1x1-1x1-0-NCHW-FP32-W=miopenConvolutionBwdWeightsAlgoDirect:ConvAsmBwdWrW1x1,0.078244,0,miopenConvolutionBwdWeightsAlgoDirect,<unused>
32-14-14-1x1-512-14-14-128-0x0-1x1-1x1-0-NCHW-FP32-B=miopenConvolutionBwdDataAlgoDirect:ConvOclDirectFwd1x1,0.217793,0,miopenConvolutionBwdDataAlgoDirect,<unused>;miopenConvolutionBwdDataAlgoWinograd:ConvBinWinogradRxSf3x2,0.320372,0,miopenConvolutionBwdDataAlgoWinograd,<unused>;miopenConvolutionBwdDataAlgoGEMM:gemm,1.0667,0,MIOpenGEMM,0_1_196_512_196_196_512_32
160-7-7-1x1-832-7-7-128-0x0-1x1-1x1-0-NCHW-FP32-B=miopenConvolutionBwdDataAlgoDirect:ConvAsm1x1U,0.232141,0,miopenConvolutionBwdDataAlgoDirect,<unused>;miopenConvolutionBwdDataAlgoWinograd:ConvBinWinogradRxSf3x2,0.602327,0,miopenConvolutionBwdDataAlgoWinograd,<unused>;miopenConvolutionBwdDataAlgoGEMM:gemm,1.8942,0,MIOpenGEMM,0_1_49_832_49_49_832_160
96-28-28-3x3-128-28-28-128-1x1-1x1-1x1-0-NCHW-FP32-F=miopenConvolutionFwdAlgoWinograd:ConvBinWinogradRxSf2x3,0.975465,0,miopenConvolutionFwdAlgoWinograd,<unused>
832-7-7-1x1-128-7-7-128-0x0-1x1-1x1-0-NCHW-FP32-F=miopenConvolutionFwdAlgoDirect:ConvAsm1x1U,0.180296,0,miopenConvolutionFwdAlgoDirect,<unused>;miopenConvolutionFwdAlgoWinograd:ConvBinWinogradRxSf3x2,0.532935,0,miopenConvolutionFwdAlgoWinograd,<unused>;miopenConvolutionFwdAlgoGEMM:GemmFwd1x1_0_1,2.6449,0,MIOpenGEMM,0_0_49_832_49_49_128_832
128-28-28-1x1-256-28-28-128-0x0-1x1-1x1-0-NCHW-FP32-B=miopenConvolutionBwdDataAlgoDirect:ConvAsm1x1U,0.640333,0,miopenConvolutionBwdDataAlgoDirect,<unused>;miopenConvolutionBwdDataAlgoWinograd:ConvBinWinogradRxSf3x2,1.52452,0,miopenConvolutionBwdDataAlgoWinograd,<unused>;miopenConvolutionBwdDataAlgoGEMM:gemm,66.7646,0,MIOpenGEMM,0_1_784_256_784_784_256_128
480-14-14-1x1-64-14-14-128-0x0-1x1-1x1-0-NCHW-FP32-F=miopenConvolutionFwdAlgoDirect:ConvAsm1x1U,0.212401,0,miopenConvolutionFwdAlgoDirect,<unused>;miopenConvolutionFwdAlgoWinograd:ConvBinWinogradRxSf3x2,0.445214,0,miopenConvolutionFwdAlgoWinograd,<unused>;miopenConvolutionFwdAlgoGEMM:GemmFwd1x1_0_1,3.41722,0,MIOpenGEMM,0_0_196_480_196_196_64_480
64-14-14-1x1-512-14-14-128-0x0-1x1-1x1-0-NCHW-FP32-B=miopenConvolutionBwdDataAlgoDirect:ConvAsm1x1U,0.322594,0,miopenConvolutionBwdDataAlgoDirect,<unused>;miopenConvolutionBwdDataAlgoWinograd:ConvBinWinogradRxSf3x2,0.490648,0,miopenConvolutionBwdDataAlgoWinograd,<unused>;miopenConvolutionBwdDataAlgoGEMM:gemm,2.14969,0,MIOpenGEMM,0_1_196_512_196_196_512_64
528-14-14-1x1-32-14-14-128-0x0-1x1-1x1-0-NCHW-FP32-F=miopenConvolutionFwdAlgoDirect:ConvOclDirectFwd1x1,0.197,0,miopenConvolutionFwdAlgoDirect,<unused>;miopenConvolutionFwdAlgoGEMM:GemmFwd1x1_0_1,1.9488,0,MIOpenGEMM,0_0_196_528_196_196_32_528
32-7-7-1x1-832-7-7-128-0x0-1x1-1x1-0-NCHW-FP32-B=miopenConvolutionBwdDataAlgoDirect:ConvAsm1x1U,0.054017,0,miopenConvolutionBwdDataAlgoDirect,<unused>;miopenConvolutionBwdDataAlgoWinograd:ConvBinWinogradRxSf3x2,0.188281,0,miopenConvolutionBwdDataAlgoWinograd,<unused>;miopenConvolutionBwdDataAlgoGEMM:gemm,0.927658,0,MIOpenGEMM,0_1_49_832_49_49_832_32
832-7-7-1x1-160-7-7-128-0x0-1x1-1x1-0-NCHW-FP32-F=miopenConvolutionFwdAlgoDirect:ConvAsm1x1U,0.350086,0,miopenConvolutionFwdAlgoDirect,<unused>;miopenConvolutionFwdAlgoWinograd:ConvBinWinogradRxSf3x2,0.57767,0,miopenConvolutionFwdAlgoWinograd,<unused>;miopenConvolutionFwdAlgoGEMM:GemmFwd1x1_0_1,2.17335,0,MIOpenGEMM,0_0_49_832_49_49_160_832
144-14-14-1x1-512-14-14-128-0x0-1x1-1x1-0-NCHW-FP32-B=miopenConvolutionBwdDataAlgoDirect:ConvAsm1x1U,0.360799,0,miopenConvolutionBwdDataAlgoDirect,<unused>;miopenConvolutionBwdDataAlgoWinograd:ConvBinWinogradRxSf3x2,0.823136,0,miopenConvolutionBwdDataAlgoWinograd,<unused>;miopenConvolutionBwdDataAlgoGEMM:gemm,25.3207,0,MIOpenGEMM,0_1_196_512_196_196_512_144
192-14-14-1x1-480-14-14-128-0x0-1x1-1x1-0-NCHW-FP32-W=miopenConvolutionBwdWeightsAlgoDirect:ConvAsmBwdWrW1x1,0.757445,0,miopenConvolutionBwdWeightsAlgoDirect,<unused>;miopenConvolutionBwdWeightsAlgoWinograd:ConvBinWinogradRxSf2x3,2.01583,0,miopenConvolutionBwdWeightsAlgoWinograd,192x14x14x1x1x480x14x14x128xNCHWxFP32x0x0x1x1x1x1x1x0;miopenConvolutionBwdWeightsAlgoGEMM:gemm,2.14559,0,MIOpenGEMM,1_0_196_196_480_480_192_196
832-7-7-1x1-48-7-7-128-0x0-1x1-1x1-0-NCHW-FP32-F=miopenConvolutionFwdAlgoDirect:ConvOclDirectFwd1x1,0.13632,0,miopenConvolutionFwdAlgoDirect,<unused>;miopenConvolutionFwdAlgoWinograd:ConvBinWinogradRxSf2x3,0.359556,0,miopenConvolutionFwdAlgoWinograd,<unused>;miopenConvolutionFwdAlgoGEMM:GemmFwd1x1_0_1,2.02775,0,MIOpenGEMM,0_0_49_832_49_49_48_832
208-14-14-3x3-96-14-14-128-1x1-1x1-1x1-0-NCHW-FP32-W=miopenConvolutionBwdWeightsAlgoDirect:ConvAsmBwdWrW3x3,1.23169,0,miopenConvolutionBwdWeightsAlgoDirect,<unused>;miopenConvolutionBwdWeightsAlgoWinograd:ConvBinWinogradRxS,1.56568,0,miopenConvolutionBwdWeightsAlgoWinograd,208x14x14x3x3x96x14x14x128xNCHWxFP32x1x1x1x1x1x1x1x0;miopenConvolutionBwdWeightsAlgoGEMM:gemm,3.99202,677376,MIOpenGEMM,1_0_196_196_864_864_208_196
256-14-14-1x1-528-14-14-128-0x0-1x1-1x1-0-NCHW-FP32-W=miopenConvolutionBwdWeightsAlgoDirect:ConvAsmBwdWrW1x1,1.51029,0,miopenConvolutionBwdWeightsAlgoDirect,<unused>;miopenConvolutionBwdWeightsAlgoWinograd:ConvBinWinogradRxSf2x3,3.10086,0,miopenConvolutionBwdWeightsAlgoWinograd,256x14x14x1x1x528x14x14x128xNCHWxFP32x0x0x1x1x1x1x1x0;miopenConvolutionBwdWeightsAlgoGEMM:gemm,3.13052,0,MIOpenGEMM,1_0_196_196_528_528_256_196
512-14-14-1x1-64-14-14-128-0x0-1x1-1x1-0-NCHW-FP32-F=miopenConvolutionFwdAlgoDirect:ConvAsm1x1U,0.375165,0,miopenConvolutionFwdAlgoDirect,<unused>;miopenConvolutionFwdAlgoGEMM:GemmFwd1x1_0_1,3.66936,0,MIOpenGEMM,0_0_196_512_196_196_64_512
208-14-14-3x3-96-14-14-128-1x1-1x1-1x1-0-NCHW-FP32-B=miopenConvolutionBwdDataAlgoWinograd:ConvBinWinograd3x3U,0.43084,0,miopenConvolutionBwdDataAlgoWinograd,<unused>
256-7-7-1x1-832-7-7-128-0x0-1x1-1x1-0-NCHW-FP32-W=miopenConvolutionBwdWeightsAlgoDirect:ConvAsmBwdWrW1x1,0.40737,0,miopenConvolutionBwdWeightsAlgoDirect,<unused>;miopenConvolutionBwdWeightsAlgoWinograd:ConvBinWinogradRxSf2x3,1.18101,0,miopenConvolutionBwdWeightsAlgoWinograd,256x7x7x1x1x832x7x7x128xNCHWxFP32x0x0x1x1x1x1x1x0;miopenConvolutionBwdWeightsAlgoGEMM:gemm,1.33804,0,MIOpenGEMM,1_0_49_49_832_832_256_49
512-14-14-1x1-144-14-14-128-0x0-1x1-1x1-0-NCHW-FP32-F=miopenConvolutionFwdAlgoDirect:ConvAsm1x1U,0.61141,0,miopenConvolutionFwdAlgoDirect,<unused>;miopenConvolutionFwdAlgoGEMM:GemmFwd1x1_0_1,4.4269,0,MIOpenGEMM,0_0_196_512_196_196_144_512
528-14-14-1x1-256-14-14-128-0x0-1x1-1x1-0-NCHW-FP32-F=miopenConvolutionFwdAlgoDirect:ConvAsm1x1U,0.966005,0,miopenConvolutionFwdAlgoDirect,<unused>;miopenConvolutionFwdAlgoWinograd:ConvBinWinogradRxSf3x2,1.58099,0,miopenConvolutionFwdAlgoWinograd,<unused>;miopenConvolutionFwdAlgoGEMM:GemmFwd1x1_0_1,4.48938,0,MIOpenGEMM,0_0_196_528_196_196_256_528
96-14-14-3x3-208-14-14-128-1x1-1x1-1x1-0-NCHW-FP32-F=miopenConvolutionFwdAlgoWinograd:ConvBinWinograd3x3U,0.43503,0,miopenConvolutionFwdAlgoWinograd,<unused>
128-7-7-1x1-832-7-7-128-0x0-1x1-1x1-0-NCHW-FP32-W=miopenConvolutionBwdWeightsAlgoDirect:ConvAsmBwdWrW1x1,0.209677,0,miopenConvolutionBwdWeightsAlgoDirect,<unused>;miopenConvolutionBwdWeightsAlgoGEMM:gemm,1.07297,0,MIOpenGEMM,1_0_49_49_832_832_128_49
48-7-7-1x1-832-7-7-128-0x0-1x1-1x1-0-NCHW-FP32-W=miopenConvolutionBwdWeightsAlgoDirect:ConvAsmBwdWrW1x1,0.121453,0,miopenConvolutionBwdWeightsAlgoDirect,<unused>
128-14-14-1x1-512-14-14-128-0x0-1x1-1x1-0-NCHW-FP32-W=miopenConvolutionBwdWeightsAlgoDirect:ConvAsmBwdWrW1x1,0.599658,0,miopenConvolutionBwdWeightsAlgoDirect,<unused>
512-14-14-1x1-32-14-14-128-0x0-1x1-1x1-0-NCHW-FP32-F=miopenConvolutionFwdAlgoDirect:ConvAsm1x1U,0.133097,0,miopenConvolutionFwdAlgoDirect,<unused>;miopenConvolutionFwdAlgoWinograd:ConvBinWinogradRxSf3x2,0.239106,0,miopenConvolutionFwdAlgoWinograd,<unused>;miopenConvolutionFwdAlgoGEMM:GemmFwd1x1_0_1,1.72989,0,MIOpenGEMM,0_0_196_512_196_196_32_512
160-14-14-1x1-528-14-14-128-0x0-1x1-1x1-0-NCHW-FP32-W=miopenConvolutionBwdWeightsAlgoDirect:ConvAsmBwdWrW1x1,0.732385,0,miopenConvolutionBwdWeightsAlgoDirect,<unused>;miopenConvolutionBwdWeightsAlgoWinograd:ConvBinWinogradRxSf2x3,1.92175,0,miopenConvolutionBwdWeightsAlgoWinograd,160x14x14x1x1x528x14x14x128xNCHWxFP32x0x0x1x1x1x1x1x0;miopenConvolutionBwdWeightsAlgoGEMM:gemm,2.57178,0,MIOpenGEMM,1_0_196_196_528_528_160_196
128-7-7-1x1-832-7-7-128-0x0-1x1-1x1-0-NCHW-FP32-B=miopenConvolutionBwdDataAlgoDirect:ConvAsm1x1U,0.161696,0,miopenConvolutionBwdDataAlgoDirect,<unused>;miopenConvolutionBwdDataAlgoWinograd:ConvBinWinogradRxSf3x2,0.468309,0,miopenConvolutionBwdDataAlgoWinograd,<unused>;miopenConvolutionBwdDataAlgoGEMM:gemm,1.56435,0,MIOpenGEMM,0_1_49_832_49_49_832_128
832-7-7-1x1-384-7-7-128-0x0-1x1-1x1-0-NCHW-FP32-F=miopenConvolutionFwdAlgoDirect:ConvAsm1x1U,0.499957,0,miopenConvolutionFwdAlgoDirect,<unused>;miopenConvolutionFwdAlgoWinograd:ConvBinWinogradRxSf3x2,1.24937,0,miopenConvolutionFwdAlgoWinograd,<unused>;miopenConvolutionFwdAlgoGEMM:GemmFwd1x1_0_1,4.30896,0,MIOpenGEMM,0_0_49_832_49_49_384_832
32-14-14-1x1-512-14-14-128-0x0-1x1-1x1-0-NCHW-FP32-W=miopenConvolutionBwdWeightsAlgoDirect:ConvAsmBwdWrW1x1,0.184346,0,miopenConvolutionBwdWeightsAlgoDirect,<unused>
128-14-14-1x1-512-14-14-128-0x0-1x1-1x1-0-NCHW-FP32-B=miopenConvolutionBwdDataAlgoDirect:ConvAsm1x1U,0.484808,0,miopenConvolutionBwdDataAlgoDirect,<unused>;miopenConvolutionBwdDataAlgoWinograd:ConvBinWinogradRxSf3x2,0.825802,0,miopenConvolutionBwdDataAlgoWinograd,<unused>;miopenConvolutionBwdDataAlgoGEMM:gemm,19.4377,0,MIOpenGEMM,0_1_196_512_196_196_512_128
256-7-7-1x1-832-7-7-128-0x0-1x1-1x1-0-NCHW-FP32-B=miopenConvolutionBwdDataAlgoDirect:ConvAsm1x1U,0.339406,0,miopenConvolutionBwdDataAlgoDirect,<unused>;miopenConvolutionBwdDataAlgoWinograd:ConvBinWinogradRxSf3x2,0.922131,0,miopenConvolutionBwdDataAlgoWinograd,<unused>;miopenConvolutionBwdDataAlgoGEMM:gemm,2.45775,0,MIOpenGEMM,0_1_49_832_49_49_832_256
48-7-7-1x1-832-7-7-128-0x0-1x1-1x1-0-NCHW-FP32-B=miopenConvolutionBwdDataAlgoDirect:ConvAsm1x1U,0.068717,0,miopenConvolutionBwdDataAlgoDirect,<unused>;miopenConvolutionBwdDataAlgoWinograd:ConvBinWinogradRxSf3x2,0.232096,0,miopenConvolutionBwdDataAlgoWinograd,<unused>;miopenConvolutionBwdDataAlgoGEMM:gemm,1.0395,0,MIOpenGEMM,0_1_49_832_49_49_832_48
832-7-7-1x1-256-7-7-128-0x0-1x1-1x1-0-NCHW-FP32-F=miopenConvolutionFwdAlgoDirect:ConvOclDirectFwd1x1,0.417922,0,miopenConvolutionFwdAlgoDirect,<unused>;miopenConvolutionFwdAlgoWinograd:ConvBinWinogradRxSf3x2,0.947793,0,miopenConvolutionFwdAlgoWinograd,<unused>;miopenConvolutionFwdAlgoGEMM:GemmFwd1x1_0_1,4.86237,0,MIOpenGEMM,0_0_49_832_49_49_256_832
192-7-7-1x1-832-7-7-128-0x0-1x1-1x1-0-NCHW-FP32-W=miopenConvolutionBwdWeightsAlgoDirect:ConvAsmBwdWrW1x1,0.319922,0,miopenConvolutionBwdWeightsAlgoDirect,<unused>
64-14-14-1x1-480-14-14-128-0x0-1x1-1x1-0-NCHW-FP32-B=miopenConvolutionBwdDataAlgoDirect:ConvAsm1x1U,0.191566,0,miopenConvolutionBwdDataAlgoDirect,<unused>;miopenConvolutionBwdDataAlgoWinograd:ConvBinWinogradRxSf3x2,0.435074,0,miopenConvolutionBwdDataAlgoWinograd,<unused>;miopenConvolutionBwdDataAlgoGEMM:gemm,2.18144,0,MIOpenGEMM,0_1_196_480_196_196_480_64
128-7-7-5x5-32-7-7-128-2x2-1x1-1x1-0-NCHW-FP32-W=miopenConvolutionBwdWeightsAlgoWinograd:ConvBinWinogradRxSf2x3,0.354157,0,miopenConvolutionBwdWeightsAlgoWinograd,128x7x7x5x5x32x7x7x128xNCHWxFP32x2x2x1x1x1x1x1x0;miopenConvolutionBwdWeightsAlgoDirect:ConvOclBwdWrW2<8>,0.555636,6553600,miopenConvolutionBwdWeightsAlgoDirect,<unused>;miopenConvolutionBwdWeightsAlgoGEMM:gemm,2.69033,156800,MIOpenGEMM,1_0_49_49_800_800_128_49
192-7-7-1x1-832-7-7-128-0x0-1x1-1x1-0-NCHW-FP32-B=miopenConvolutionBwdDataAlgoDirect:ConvAsm1x1U,0.337002,0,miopenConvolutionBwdDataAlgoDirect,<unused>;miopenConvolutionBwdDataAlgoWinograd:ConvBinWinogradRxSf3x2,0.717892,0,miopenConvolutionBwdDataAlgoWinograd,<unused>;miopenConvolutionBwdDataAlgoGEMM:gemm,2.50249,0,MIOpenGEMM,0_1_49_832_49_49_832_192
192-56-56-3x3-64-56-56-128-1x1-1x1-1x1-0-NCHW-FP32-W=miopenConvolutionBwdWeightsAlgoDirect:ConvAsmBwdWrW3x3,9.42263,0,miopenConvolutionBwdWeightsAlgoDirect,<unused>;miopenConvolutionBwdWeightsAlgoWinograd:ConvBinWinogradRxSf2x3,11.0564,0,miopenConvolutionBwdWeightsAlgoWinograd,192x56x56x3x3x64x56x56x128xNCHWxFP32x1x1x1x1x1x1x1x0;miopenConvolutionBwdWeightsAlgoGEMM:gemm,15.9174,7225344,MIOpenGEMM,1_0_3136_3136_576_576_192_3136;miopenConvolutionBwdWeightsAlgoImplicitGEMM:ConvHipImplicitGemmV4R1WrW,41.2064,0,miopenConvolutionBwdWeightsAlgoImplicitGEMM,192x56x56x3x3x64x56x56x128xNCHWxFP32x1x1x1x1x1x1x1x0
128-17-17-1x7-128-17-17-128-0x3-1x1-1x1-0-NCHW-FP32-B=miopenConvolutionBwdDataAlgoWinograd:ConvBinWinogradRxSf3x2,1.11478,0,miopenConvolutionBwdDataAlgoWinograd,<unused>;miopenConvolutionBwdDataAlgoImplicitGEMM:ConvHipImplicitGemmBwdDataV1R1,1.97087,0,miopenConvolutionBwdDataAlgoImplicitGEMM,128x17x17x7x1x128x17x17x128xNCHWxFP32x3x0x1x1x1x1x1x0;miopenConvolutionBwdDataAlgoGEMM:gemm,46.7621,1035776,MIOpenGEMM,0_1_289_896_289_289_896_128
96-14-14-1x1-480-14-14-128-0x0-1x1-1x1-0-NCHW-FP32-B=miopenConvolutionBwdDataAlgoDirect:ConvAsm1x1U,0.270022,0,miopenConvolutionBwdDataAlgoDirect,<unused>;miopenConvolutionBwdDataAlgoGEMM:gemm,8.6898,0,MIOpenGEMM,0_1_196_480_196_196_480_96
160-17-17-7x1-160-17-17-128-3x0-1x1-1x1-0-NCHW-FP32-F=miopenConvolutionFwdAlgoImplicitGEMM:ConvHipImplicitGemmV4R1Fwd,1.41912,0,miopenConvolutionFwdAlgoImplicitGEMM,160x17x17x1x7x160x17x17x128xNCHWxFP32x0x3x1x1x1x1x1x1;miopenConvolutionFwdAlgoWinograd:ConvBinWinogradRxSf3x2,1.58312,0,miopenConvolutionFwdAlgoWinograd,<unused>;miopenConvolutionFwdAlgoGEMM:GemmFwdRest,7.0953,1294720,MIOpenGEMM,0_0_289_1120_289_289_160_1120
192-8-8-1x1-1280-8-8-128-0x0-1x1-1x1-0-NCHW-FP32-W=miopenConvolutionBwdWeightsAlgoDirect:ConvAsmBwdWrW1x1,0.51112,0,miopenConvolutionBwdWeightsAlgoDirect,<unused>;miopenConvolutionBwdWeightsAlgoWinograd:ConvBinWinogradRxSf2x3,1.41347,0,miopenConvolutionBwdWeightsAlgoWinograd,192x8x8x1x1x1280x8x8x128xNCHWxFP32x0x0x1x1x1x1x1x0;miopenConvolutionBwdWeightsAlgoGEMM:gemm,1.99939,0,MIOpenGEMM,1_0_64_64_1280_1280_192_64
128-17-17-1x7-128-17-17-128-0x3-1x1-1x1-0-NCHW-FP32-F=miopenConvolutionFwdAlgoImplicitGEMM:ConvHipImplicitGemmV4R1Fwd,0.935996,0,miopenConvolutionFwdAlgoImplicitGEMM,128x17x17x7x1x128x17x17x128xNCHWxFP32x3x0x1x1x1x1x1x1;miopenConvolutionFwdAlgoWinograd:ConvBinWinogradRxSf3x2,1.08133,0,miopenConvolutionFwdAlgoWinograd,<unused>;miopenConvolutionFwdAlgoGEMM:GemmFwdRest,7.29202,1035776,MIOpenGEMM,0_0_289_896_289_289_128_896
128-7-7-5x5-32-7-7-128-2x2-1x1-1x1-0-NCHW-FP32-B=miopenConvolutionBwdDataAlgoWinograd:ConvBinWinogradRxSf2x3,0.120387,0,miopenConvolutionBwdDataAlgoWinograd,<unused>;miopenConvolutionBwdDataAlgoFFT:fft,0.237442,27697152,miopenConvolutionBwdDataAlgoFFT,128x7x7x5x5x32x7x7x128xNCHWxFP32x2x2x1x1x1x1x1x0;miopenConvolutionBwdDataAlgoDirect:ConvOclDirectFwd,0.559159,0,miopenConvolutionBwdDataAlgoDirect,<unused>;miopenConvolutionBwdDataAlgoImplicitGEMM:ConvHipImplicitGemmBwdDataV1R1,0.580918,0,miopenConvolutionBwdDataAlgoImplicitGEMM,128x7x7x5x5x32x7x7x128xNCHWxFP32x2x2x1x1x1x1x1x0;miopenConvolutionBwdDataAlgoGEMM:gemm,4.4912,156800,MIOpenGEMM,0_1_49_800_49_49_800_128
192-17-17-1x7-160-17-17-128-0x3-1x1-1x1-0-NCHW-FP32-B=miopenConvolutionBwdDataAlgoWinograd:ConvBinWinogradRxSf3x2,2.05397,0,miopenConvolutionBwdDataAlgoWinograd,<unused>;miopenConvolutionBwdDataAlgoImplicitGEMM:ConvHipImplicitGemmBwdDataV1R1,4.07484,0,miopenConvolutionBwdDataAlgoImplicitGEMM,192x17x17x7x1x160x17x17x128xNCHWxFP32x3x0x1x1x1x1x1x0;miopenConvolutionBwdDataAlgoGEMM:gemm,6.4,1294720,MIOpenGEMM,0_1_289_1120_289_289_1120_192
160-17-17-1x7-192-17-17-128-0x3-1x1-1x1-0-NCHW-FP32-F=miopenConvolutionFwdAlgoImplicitGEMM:ConvHipImplicitGemmV4R1Fwd,1.51969,0,miopenConvolutionFwdAlgoImplicitGEMM,160x17x17x7x1x192x17x17x128xNCHWxFP32x3x0x1x1x1x1x1x1;miopenConvolutionFwdAlgoWinograd:ConvBinWinogradRxSf3x2,1.83301,0,miopenConvolutionFwdAlgoWinograd,<unused>;miopenConvolutionFwdAlgoGEMM:GemmFwdRest,9.97984,1294720,MIOpenGEMM,0_0_289_1120_289_289_192_1120
192-17-17-1x7-192-17-17-128-0x3-1x1-1x1-0-NCHW-FP32-W=miopenConvolutionBwdWeightsAlgoWinograd:ConvBinWinogradRxSf2x3,3.21488,0,miopenConvolutionBwdWeightsAlgoWinograd,192x17x17x7x1x192x17x17x128xNCHWxFP32x3x0x1x1x1x1x1x0;miopenConvolutionBwdWeightsAlgoDirect:ConvOclBwdWrW53,3.46285,0,miopenConvolutionBwdWeightsAlgoDirect,<unused>;miopenConvolutionBwdWeightsAlgoImplicitGEMM:ConvHipImplicitGemmV4R1WrW,6.14172,0,miopenConvolutionBwdWeightsAlgoImplicitGEMM,192x17x17x7x1x192x17x17x128xNCHWxFP32x3x0x1x1x1x1x1x0;miopenConvolutionBwdWeightsAlgoGEMM:gemm,39.8601,1553664,MIOpenGEMM,1_0_289_289_1344_1344_192_289
192-17-17-7x1-160-17-17-128-3x0-1x1-1x1-0-NCHW-FP32-W=miopenConvolutionBwdWeightsAlgoWinograd:ConvBinWinogradRxSf2x3,1.98007,0,miopenConvolutionBwdWeightsAlgoWinograd,192x17x17x1x7x160x17x17x128xNCHWxFP32x0x3x1x1x1x1x1x0;miopenConvolutionBwdWeightsAlgoDirect:ConvOclBwdWrW53,5.32521,0,miopenConvolutionBwdWeightsAlgoDirect,<unused>;miopenConvolutionBwdWeightsAlgoGEMM:gemm,11.3274,1294720,MIOpenGEMM,1_0_289_289_1120_1120_192_289
192-35-35-1x1-64-35-35-128-0x0-1x1-1x1-0-NCHW-FP32-F=miopenConvolutionFwdAlgoDirect:ConvAsm1x1U,0.712458,0,miopenConvolutionFwdAlgoDirect,<unused>;miopenConvolutionFwdAlgoWinograd:ConvBinWinogradRxSf3x2,0.872987,0,miopenConvolutionFwdAlgoWinograd,<unused>;miopenConvolutionFwdAlgoGEMM:GemmFwd1x1_0_1,4.02423,0,MIOpenGEMM,0_0_1225_192_1225_1225_64_192
192-17-17-1x7-192-17-17-128-0x3-1x1-1x1-0-NCHW-FP32-B=miopenConvolutionBwdDataAlgoWinograd:ConvBinWinogradRxSf3x2,2.43761,0,miopenConvolutionBwdDataAlgoWinograd,<unused>;miopenConvolutionBwdDataAlgoImplicitGEMM:ConvHipImplicitGemmBwdDataV1R1,3.58004,0,miopenConvolutionBwdDataAlgoImplicitGEMM,192x17x17x7x1x192x17x17x128xNCHWxFP32x3x0x1x1x1x1x1x0;miopenConvolutionBwdDataAlgoGEMM:gemm,8.08519,1553664,MIOpenGEMM,0_1_289_1344_289_289_1344_192
192-28-28-1x1-16-28-28-128-0x0-1x1-1x1-0-NCHW-FP32-F=miopenConvolutionFwdAlgoDirect:ConvOclDirectFwd1x1,0.161945,0,miopenConvolutionFwdAlgoDirect,<unused>;miopenConvolutionFwdAlgoWinograd:ConvBinWinogradRxSf3x2,0.29991,0,miopenConvolutionFwdAlgoWinograd,<unused>;miopenConvolutionFwdAlgoGEMM:GemmFwd1x1_0_1,1.74346,0,MIOpenGEMM,0_0_784_192_784_784_16_192
832-7-7-1x1-32-7-7-128-0x0-1x1-1x1-0-NCHW-FP32-F=miopenConvolutionFwdAlgoDirect:ConvOclDirectFwd1x1,0.088512,0,miopenConvolutionFwdAlgoDirect,<unused>;miopenConvolutionFwdAlgoWinograd:ConvBinWinogradRxSf2x3,0.190068,0,miopenConvolutionFwdAlgoWinograd,<unused>;miopenConvolutionFwdAlgoGEMM:GemmFwd1x1_0_1,2.35111,0,MIOpenGEMM,0_0_49_832_49_49_32_832
192-17-17-7x1-160-17-17-128-3x0-1x1-1x1-0-NCHW-FP32-B=miopenConvolutionBwdDataAlgoWinograd:ConvBinWinogradRxSf3x2,1.97214,0,miopenConvolutionBwdDataAlgoWinograd,<unused>;miopenConvolutionBwdDataAlgoImplicitGEMM:ConvHipImplicitGemmBwdDataV1R1,4.42125,0,miopenConvolutionBwdDataAlgoImplicitGEMM,192x17x17x1x7x160x17x17x128xNCHWxFP32x0x3x1x1x1x1x1x0;miopenConvolutionBwdDataAlgoGEMM:gemm,6.19121,1294720,MIOpenGEMM,0_1_289_1120_289_289_1120_192
192-17-17-1x7-192-17-17-128-0x3-1x1-1x1-0-NCHW-FP32-F=miopenConvolutionFwdAlgoImplicitGEMM:ConvHipImplicitGemmV4R1Fwd,2.02526,0,miopenConvolutionFwdAlgoImplicitGEMM,192x17x17x7x1x192x17x17x128xNCHWxFP32x3x0x1x1x1x1x1x1;miopenConvolutionFwdAlgoWinograd:ConvBinWinogradRxSf3x2,2.38804,0,miopenConvolutionFwdAlgoWinograd,<unused>;miopenConvolutionFwdAlgoGEMM:GemmFwdRest,16.2462,1553664,MIOpenGEMM,0_0_289_1344_289_289_192_1344
160-17-17-7x1-192-17-17-128-3x0-1x1-1x1-0-NCHW-FP32-F=miopenConvolutionFwdAlgoWinograd:ConvBinWinogradRxSf3x2,1.93433,0,miopenConvolutionFwdAlgoWinograd,<unused>;miopenConvolutionFwdAlgoImplicitGEMM:ConvHipImplicitGemmV4R1Fwd,2.18478,0,miopenConvolutionFwdAlgoImplicitGEMM,160x17x17x1x7x192x17x17x128xNCHWxFP32x0x3x1x1x1x1x1x1;miopenConvolutionFwdAlgoGEMM:GemmFwdRest,16.7214,1294720,MIOpenGEMM,0_0_289_1120_289_289_192_1120
48-35-35-1x1-192-35-35-128-0x0-1x1-1x1-0-NCHW-FP32-W=miopenConvolutionBwdWeightsAlgoDirect:ConvAsmBwdWrW1x1,0.975949,0,miopenConvolutionBwdWeightsAlgoDirect,<unused>
384-8-8-1x1-2048-8-8-128-0x0-1x1-1x1-0-NCHW-FP32-B=miopenConvolutionBwdDataAlgoDirect:ConvAsm1x1U,1.13375,0,miopenConvolutionBwdDataAlgoDirect,<unused>;miopenConvolutionBwdDataAlgoWinograd:ConvBinWinogradRxSf3x2,3.06465,0,miopenConvolutionBwdDataAlgoWinograd,<unused>;miopenConvolutionBwdDataAlgoGEMM:gemm,5.11574,0,MIOpenGEMM,0_1_64_2048_64_64_2048_384
192-8-8-3x3-192-17-17-128-0x0-2x2-1x1-0-NCHW-FP32-W=miopenConvolutionBwdWeightsAlgoImplicitGEMM:ConvHipImplicitGemmV4R1WrW,1.2223,0,miopenConvolutionBwdWeightsAlgoImplicitGEMM,192x8x8x3x3x192x17x17x128xNCHWxFP32x0x0x2x2x1x1x1x0;miopenConvolutionBwdWeightsAlgoGEMM:gemm,4.44006,442368,MIOpenGEMM,1_0_64_64_1728_1728_192_64;miopenConvolutionBwdWeightsAlgoDirect:ConvOclBwdWrW2NonTunable,13.1941,169869312,miopenConvolutionBwdWeightsAlgoDirect,<unused>
48-35-35-1x1-192-35-35-128-0x0-1x1-1x1-0-NCHW-FP32-B=miopenConvolutionBwdDataAlgoDirect:ConvAsm1x1U,0.532208,0,miopenConvolutionBwdDataAlgoDirect,<unused>;miopenConvolutionBwdDataAlgoGEMM:gemm,2.76814,0,MIOpenGEMM,0_1_1225_192_1225_1225_192_48
160-17-17-1x7-160-17-17-128-0x3-1x1-1x1-0-NCHW-FP32-W=miopenConvolutionBwdWeightsAlgoWinograd:ConvBinWinogradRxSf2x3,2.19705,0,miopenConvolutionBwdWeightsAlgoWinograd,160x17x17x7x1x160x17x17x128xNCHWxFP32x3x0x1x1x1x1x1x0;miopenConvolutionBwdWeightsAlgoDirect:ConvOclBwdWrW53,2.2868,0,miopenConvolutionBwdWeightsAlgoDirect,<unused>;miopenConvolutionBwdWeightsAlgoGEMM:gemm,8.39263,1294720,MIOpenGEMM,1_0_289_289_1120_1120_160_289
64-35-35-1x1-256-35-35-128-0x0-1x1-1x1-0-NCHW-FP32-W=miopenConvolutionBwdWeightsAlgoDirect:ConvAsmBwdWrW1x1,1.16572,0,miopenConvolutionBwdWeightsAlgoDirect,<unused>
2048-8-8-1x1-384-8-8-128-0x0-1x1-1x1-0-NCHW-FP32-F=miopenConvolutionFwdAlgoDirect:ConvAsm1x1U,1.75655,0,miopenConvolutionFwdAlgoDirect,<unused>;miopenConvolutionFwdAlgoWinograd:ConvBinWinogradRxSf3x2,3.2708,0,miopenConvolutionFwdAlgoWinograd,<unused>;miopenConvolutionFwdAlgoGEMM:GemmFwd1x1_0_1,5.35986,0,MIOpenGEMM,0_0_64_2048_64_64_384_2048
192-8-8-3x3-192-17-17-128-0x0-2x2-1x1-0-NCHW-FP32-B=miopenConvolutionBwdDataAlgoImplicitGEMM:ConvHipImplicitGemmBwdDataV1R1,1.4685,0,miopenConvolutionBwdDataAlgoImplicitGEMM,192x8x8x3x3x192x17x17x128xNCHWxFP32x0x0x2x2x1x1x1x0;miopenConvolutionBwdDataAlgoWinograd:ConvBinWinogradRxS,1.51604,0,miopenConvolutionBwdDataAlgoWinograd,<unused>;miopenConvolutionBwdDataAlgoDirect:ConvOclDirectFwd,4.94067,0,miopenConvolutionBwdDataAlgoDirect,<unused>;miopenConvolutionBwdDataAlgoGEMM:gemm,6.22976,442368,MIOpenGEMM,0_1_64_1728_64_64_1728_192
3-299-299-3x3-32-149-149-128-0x0-2x2-1x1-0-NCHW-FP32-F=miopenConvolutionFwdAlgoWinograd:ConvBinWinogradRxSf2x3,1.9227,0,miopenConvolutionFwdAlgoWinograd,<unused>;miopenConvolutionFwdAlgoDirect:ConvOclDirectFwd,3.1174,0,miopenConvolutionFwdAlgoDirect,<unused>;miopenConvolutionFwdAlgoGEMM:GemmFwdRest,4.53792,2397708,MIOpenGEMM,0_0_22201_27_22201_22201_32_27
160-17-17-1x7-160-17-17-128-0x3-1x1-1x1-0-NCHW-FP32-B=miopenConvolutionBwdDataAlgoWinograd:ConvBinWinogradRxSf3x2,1.69325,0,miopenConvolutionBwdDataAlgoWinograd,<unused>;miopenConvolutionBwdDataAlgoImplicitGEMM:ConvHipImplicitGemmBwdDataV1R1,3.74455,0,miopenConvolutionBwdDataAlgoImplicitGEMM,160x17x17x7x1x160x17x17x128xNCHWxFP32x3x0x1x1x1x1x1x0;miopenConvolutionBwdDataAlgoGEMM:gemm,6.4047,1294720,MIOpenGEMM,0_1_289_1120_289_289_1120_160
384-8-8-3x1-384-8-8-128-1x0-1x1-1x1-0-NCHW-FP32-B=miopenConvolutionBwdDataAlgoWinograd:ConvBinWinogradRxS,0.936606,0,miopenConvolutionBwdDataAlgoWinograd,<unused>;miopenConvolutionBwdDataAlgoImplicitGEMM:ConvHipImplicitGemmBwdDataV1R1,1.18352,0,miopenConvolutionBwdDataAlgoImplicitGEMM,384x8x8x1x3x384x8x8x128xNCHWxFP32x0x1x1x1x1x1x1x0;miopenConvolutionBwdDataAlgoGEMM:gemm,5.42027,294912,MIOpenGEMM,0_1_64_1152_64_64_1152_384
64-35-35-1x1-288-35-35-128-0x0-1x1-1x1-0-NCHW-FP32-W=miopenConvolutionBwdWeightsAlgoDirect:ConvAsmBwdWrW1x1,1.51467,0,miopenConvolutionBwdWeightsAlgoDirect,<unused>;miopenConvolutionBwdWeightsAlgoGEMM:gemm,2.99506,0,MIOpenGEMM,1_0_1225_1225_288_288_64_1225;miopenConvolutionBwdWeightsAlgoWinograd:ConvBinWinogradRxSf2x3,4.74267,0,miopenConvolutionBwdWeightsAlgoWinograd,64x35x35x1x1x288x35x35x128xNCHWxFP32x0x0x1x1x1x1x1x0
192-35-35-1x1-48-35-35-128-0x0-1x1-1x1-0-NCHW-FP32-F=miopenConvolutionFwdAlgoDirect:ConvAsm1x1U,0.420331,0,miopenConvolutionFwdAlgoDirect,<unused>;miopenConvolutionFwdAlgoGEMM:GemmFwd1x1_0_1,3.55282,0,MIOpenGEMM,0_0_1225_192_1225_1225_48_192
192-17-17-3x3-192-8-8-128-0x0-2x2-1x1-0-NCHW-FP32-F=miopenConvolutionFwdAlgoWinograd:ConvBinWinogradRxSf2x3,0.987024,0,miopenConvolutionFwdAlgoWinograd,<unused>;miopenConvolutionFwdAlgoDirect:ConvOclDirectFwd,2.93016,0,miopenConvolutionFwdAlgoDirect,<unused>;miopenConvolutionFwdAlgoGEMM:GemmFwdRest,17.9536,442368,MIOpenGEMM,0_0_64_1728_64_64_192_1728
320-8-8-1x1-2048-8-8-128-0x0-1x1-1x1-0-NCHW-FP32-W=miopenConvolutionBwdWeightsAlgoDirect:ConvAsmBwdWrW1x1,1.8061,0,miopenConvolutionBwdWeightsAlgoDirect,<unused>;miopenConvolutionBwdWeightsAlgoGEMM:gemm,3.22913,0,MIOpenGEMM,1_0_64_64_2048_2048_320_64;miopenConvolutionBwdWeightsAlgoWinograd:ConvBinWinogradRxSf2x3,3.84951,0,miopenConvolutionBwdWeightsAlgoWinograd,320x8x8x1x1x2048x8x8x128xNCHWxFP32x0x0x1x1x1x1x1x0
64-35-35-1x1-256-35-35-128-0x0-1x1-1x1-0-NCHW-FP32-B=miopenConvolutionBwdDataAlgoDirect:ConvAsm1x1U,0.732947,0,miopenConvolutionBwdDataAlgoDirect,<unused>;miopenConvolutionBwdDataAlgoGEMM:gemm,5.38701,0,MIOpenGEMM,0_1_1225_256_1225_1225_256_64
160-17-17-1x7-160-17-17-128-0x3-1x1-1x1-0-NCHW-FP32-F=miopenConvolutionFwdAlgoImplicitGEMM:ConvHipImplicitGemmV4R1Fwd,1.49661,0,miopenConvolutionFwdAlgoImplicitGEMM,160x17x17x7x1x160x17x17x128xNCHWxFP32x3x0x1x1x1x1x1x1;miopenConvolutionFwdAlgoWinograd:ConvBinWinogradRxSf3x2,1.73981,0,miopenConvolutionFwdAlgoWinograd,<unused>;miopenConvolutionFwdAlgoGEMM:GemmFwdRest,7.84144,1294720,MIOpenGEMM,0_0_289_1120_289_289_160_1120
384-8-8-3x1-384-8-8-128-1x0-1x1-1x1-0-NCHW-FP32-F=miopenConvolutionFwdAlgoImplicitGEMM:ConvHipImplicitGemmV4R1Fwd,0.782036,0,miopenConvolutionFwdAlgoImplicitGEMM,384x8x8x1x3x384x8x8x128xNCHWxFP32x0x1x1x1x1x1x1x1;miopenConvolutionFwdAlgoWinograd:ConvBinWinogradRxS,0.901707,0,miopenConvolutionFwdAlgoWinograd,<unused>;miopenConvolutionFwdAlgoGEMM:GemmFwdRest,9.07461,294912,MIOpenGEMM,0_0_64_1152_64_64_384_1152
192-17-17-7x1-192-17-17-128-3x0-1x1-1x1-0-NCHW-FP32-W=miopenConvolutionBwdWeightsAlgoWinograd:ConvBinWinogradRxSf2x3,2.66145,0,miopenConvolutionBwdWeightsAlgoWinograd,192x17x17x1x7x192x17x17x128xNCHWxFP32x0x3x1x1x1x1x1x0;miopenConvolutionBwdWeightsAlgoImplicitGEMM:ConvHipImplicitGemmV4R1WrW,4.01324,0,miopenConvolutionBwdWeightsAlgoImplicitGEMM,192x17x17x1x7x192x17x17x128xNCHWxFP32x0x3x1x1x1x1x1x0;miopenConvolutionBwdWeightsAlgoDirect:ConvOclBwdWrW53,5.62645,0,miopenConvolutionBwdWeightsAlgoDirect,<unused>;miopenConvolutionBwdWeightsAlgoGEMM:gemm,6.17408,1553664,MIOpenGEMM,1_0_289_289_1344_1344_192_289
160-17-17-7x1-160-17-17-128-3x0-1x1-1x1-0-NCHW-FP32-W=miopenConvolutionBwdWeightsAlgoWinograd:ConvBinWinogradRxSf2x3,1.83147,0,miopenConvolutionBwdWeightsAlgoWinograd,160x17x17x1x7x160x17x17x128xNCHWxFP32x0x3x1x1x1x1x1x0;miopenConvolutionBwdWeightsAlgoDirect:ConvOclBwdWrW53,3.55454,0,miopenConvolutionBwdWeightsAlgoDirect,<unused>;miopenConvolutionBwdWeightsAlgoGEMM:gemm,5.95888,1294720,MIOpenGEMM,1_0_289_289_1120_1120_160_289
128-17-17-7x1-128-17-17-128-3x0-1x1-1x1-0-NCHW-FP32-B=miopenConvolutionBwdDataAlgoWinograd:ConvBinWinogradRxSf3x2,1.03723,0,miopenConvolutionBwdDataAlgoWinograd,<unused>;miopenConvolutionBwdDataAlgoImplicitGEMM:ConvHipImplicitGemmBwdDataV1R1,2.22471,0,miopenConvolutionBwdDataAlgoImplicitGEMM,128x17x17x1x7x128x17x17x128xNCHWxFP32x0x3x1x1x1x1x1x0;miopenConvolutionBwdDataAlgoGEMM:gemm,46.4361,1035776,MIOpenGEMM,0_1_289_896_289_289_896_128
448-8-8-1x1-1280-8-8-128-0x0-1x1-1x1-0-NCHW-FP32-B=miopenConvolutionBwdDataAlgoDirect:ConvAsm1x1U,0.931026,0,miopenConvolutionBwdDataAlgoDirect,<unused>;miopenConvolutionBwdDataAlgoWinograd:ConvBinWinogradRxSf3x2,2.28151,0,miopenConvolutionBwdDataAlgoWinograd,<unused>;miopenConvolutionBwdDataAlgoGEMM:gemm,5.30411,0,MIOpenGEMM,0_1_64_1280_64_64_1280_448
1280-8-8-1x1-192-8-8-128-0x0-1x1-1x1-0-NCHW-FP32-F=miopenConvolutionFwdAlgoDirect:ConvAsm1x1U,0.736715,0,miopenConvolutionFwdAlgoDirect,<unused>;miopenConvolutionFwdAlgoWinograd:ConvBinWinogradRxSf3x2,1.18929,0,miopenConvolutionFwdAlgoWinograd,<unused>;miopenConvolutionFwdAlgoGEMM:GemmFwd1x1_0_1,9.0747,0,MIOpenGEMM,0_0_64_1280_64_64_192_1280
32-35-35-1x1-192-35-35-128-0x0-1x1-1x1-0-NCHW-FP32-W=miopenConvolutionBwdWeightsAlgoDirect:ConvAsmBwdWrW1x1,0.592804,0,miopenConvolutionBwdWeightsAlgoDirect,<unused>
64-35-35-1x1-288-35-35-128-0x0-1x1-1x1-0-NCHW-FP32-B=miopenConvolutionBwdDataAlgoDirect:ConvAsm1x1U,0.898203,0,miopenConvolutionBwdDataAlgoDirect,<unused>;miopenConvolutionBwdDataAlgoGEMM:gemm,8.03848,0,MIOpenGEMM,0_1_1225_288_1225_1225_288_64
128-17-17-7x1-128-17-17-128-3x0-1x1-1x1-0-NCHW-FP32-F=miopenConvolutionFwdAlgoImplicitGEMM:ConvHipImplicitGemmV4R1Fwd,0.943513,0,miopenConvolutionFwdAlgoImplicitGEMM,128x17x17x1x7x128x17x17x128xNCHWxFP32x0x3x1x1x1x1x1x1;miopenConvolutionFwdAlgoWinograd:ConvBinWinogradRxSf3x2,1.04353,0,miopenConvolutionFwdAlgoWinograd,<unused>;miopenConvolutionFwdAlgoGEMM:GemmFwdRest,7.91776,1035776,MIOpenGEMM,0_0_289_896_289_289_128_896
1280-8-8-1x1-448-8-8-128-0x0-1x1-1x1-0-NCHW-FP32-F=miopenConvolutionFwdAlgoDirect:ConvAsm1x1U,1.31973,0,miopenConvolutionFwdAlgoDirect,<unused>;miopenConvolutionFwdAlgoWinograd:ConvBinWinogradRxSf3x2,2.12684,0,miopenConvolutionFwdAlgoWinograd,<unused>;miopenConvolutionFwdAlgoGEMM:GemmFwd1x1_0_1,5.00727,0,MIOpenGEMM,0_0_64_1280_64_64_448_1280
320-8-8-1x1-2048-8-8-128-0x0-1x1-1x1-0-NCHW-FP32-B=miopenConvolutionBwdDataAlgoDirect:ConvAsm1x1U,1.03272,0,miopenConvolutionBwdDataAlgoDirect,<unused>;miopenConvolutionBwdDataAlgoWinograd:ConvBinWinogradRxSf3x2,2.73066,0,miopenConvolutionBwdDataAlgoWinograd,<unused>;miopenConvolutionBwdDataAlgoGEMM:gemm,4.76292,0,MIOpenGEMM,0_1_64_2048_64_64_2048_320
32-147-147-3x3-32-149-149-128-0x0-1x1-1x1-0-NCHW-FP32-W=miopenConvolutionBwdWeightsAlgoDirect:ConvOclBwdWrW53,21.2294,4718592,miopenConvolutionBwdWeightsAlgoDirect,<unused>;miopenConvolutionBwdWeightsAlgoWinograd:ConvBinWinogradRxSf2x3,75.4314,0,miopenConvolutionBwdWeightsAlgoWinograd,32x147x147x3x3x32x149x149x128xNCHWxFP32x0x0x1x1x1x1x1x0;miopenConvolutionBwdWeightsAlgoGEMM:gemm,82.3741,24893568,MIOpenGEMM,1_0_21609_21609_288_288_32_21609
256-35-35-1x1-64-35-35-128-0x0-1x1-1x1-0-NCHW-FP32-F=miopenConvolutionFwdAlgoDirect:ConvOclDirectFwd1x1,0.670325,0,miopenConvolutionFwdAlgoDirect,<unused>;miopenConvolutionFwdAlgoWinograd:ConvBinWinogradRxSf3x2,1.17595,0,miopenConvolutionFwdAlgoWinograd,<unused>;miopenConvolutionFwdAlgoGEMM:GemmFwd1x1_0_1,5.89396,0,MIOpenGEMM,0_0_1225_256_1225_1225_64_256
192-17-17-7x1-192-17-17-128-3x0-1x1-1x1-0-NCHW-FP32-B=miopenConvolutionBwdDataAlgoWinograd:ConvBinWinogradRxSf3x2,2.3131,0,miopenConvolutionBwdDataAlgoWinograd,<unused>;miopenConvolutionBwdDataAlgoImplicitGEMM:ConvHipImplicitGemmBwdDataV1R1,4.1908,0,miopenConvolutionBwdDataAlgoImplicitGEMM,192x17x17x1x7x192x17x17x128xNCHWxFP32x0x3x1x1x1x1x1x0;miopenConvolutionBwdDataAlgoGEMM:gemm,7.76896,1553664,MIOpenGEMM,0_1_289_1344_289_289_1344_192
192-17-17-1x7-128-17-17-128-0x3-1x1-1x1-0-NCHW-FP32-W=miopenConvolutionBwdWeightsAlgoWinograd:ConvBinWinogradRxSf2x3,2.02202,0,miopenConvolutionBwdWeightsAlgoWinograd,192x17x17x7x1x128x17x17x128xNCHWxFP32x3x0x1x1x1x1x1x0;miopenConvolutionBwdWeightsAlgoDirect:ConvOclBwdWrW53,2.26793,0,miopenConvolutionBwdWeightsAlgoDirect,<unused>;miopenConvolutionBwdWeightsAlgoImplicitGEMM:ConvHipImplicitGemmV4R1WrW,3.96473,0,miopenConvolutionBwdWeightsAlgoImplicitGEMM,192x17x17x7x1x128x17x17x128xNCHWxFP32x3x0x1x1x1x1x1x0;miopenConvolutionBwdWeightsAlgoGEMM:gemm,5.2845,1035776,MIOpenGEMM,1_0_289_289_896_896_192_289
160-17-17-7x1-160-17-17-128-3x0-1x1-1x1-0-NCHW-FP32-B=miopenConvolutionBwdDataAlgoWinograd:ConvBinWinogradRxSf3x2,1.57411,0,miopenConvolutionBwdDataAlgoWinograd,<unused>;miopenConvolutionBwdDataAlgoImplicitGEMM:ConvHipImplicitGemmBwdDataV1R1,3.50152,0,miopenConvolutionBwdDataAlgoImplicitGEMM,160x17x17x1x7x160x17x17x128xNCHWxFP32x0x3x1x1x1x1x1x0;miopenConvolutionBwdDataAlgoGEMM:gemm,5.65074,1294720,MIOpenGEMM,0_1_289_1120_289_289_1120_160
64-35-35-5x5-48-35-35-128-2x2-1x1-1x1-0-NCHW-FP32-W=miopenConvolutionBwdWeightsAlgoWinograd:ConvBinWinogradRxSf2x3,3.78451,0,miopenConvolutionBwdWeightsAlgoWinograd,64x35x35x5x5x48x35x35x128xNCHWxFP32x2x2x1x1x1x1x1x0;miopenConvolutionBwdWeightsAlgoDirect:ConvOclBwdWrW2<4>,4.55459,9830400,miopenConvolutionBwdWeightsAlgoDirect,<unused>;miopenConvolutionBwdWeightsAlgoGEMM:gemm,12.7359,5880000,MIOpenGEMM,1_0_1225_1225_1200_1200_64_1225
384-8-8-1x1-1280-8-8-128-0x0-1x1-1x1-0-NCHW-FP32-W=miopenConvolutionBwdWeightsAlgoDirect:ConvAsmBwdWrW1x1,0.822864,0,miopenConvolutionBwdWeightsAlgoDirect,<unused>;miopenConvolutionBwdWeightsAlgoGEMM:gemm,2.22555,0,MIOpenGEMM,1_0_64_64_1280_1280_384_64;miopenConvolutionBwdWeightsAlgoWinograd:ConvBinWinogradRxSf2x3,2.80355,0,miopenConvolutionBwdWeightsAlgoWinograd,384x8x8x1x1x1280x8x8x128xNCHWxFP32x0x0x1x1x1x1x1x0
192-17-17-1x7-128-17-17-128-0x3-1x1-1x1-0-NCHW-FP32-B=miopenConvolutionBwdDataAlgoWinograd:ConvBinWinogradRxSf3x2,1.50323,0,miopenConvolutionBwdDataAlgoWinograd,<unused>;miopenConvolutionBwdDataAlgoImplicitGEMM:ConvHipImplicitGemmBwdDataV1R1,2.15659,0,miopenConvolutionBwdDataAlgoImplicitGEMM,192x17x17x7x1x128x17x17x128xNCHWxFP32x3x0x1x1x1x1x1x0;miopenConvolutionBwdDataAlgoGEMM:gemm,6.06022,1035776,MIOpenGEMM,0_1_289_896_289_289_896_192
128-28-28-1x1-256-28-28-128-0x0-1x1-1x1-0-NCHW-FP32-W=miopenConvolutionBwdWeightsAlgoDirect:ConvAsmBwdWrW1x1,0.830076,0,miopenConvolutionBwdWeightsAlgoDirect,<unused>
32-35-35-1x1-192-35-35-128-0x0-1x1-1x1-0-NCHW-FP32-B=miopenConvolutionBwdDataAlgoDirect:ConvAsm1x1U,0.49388,0,miopenConvolutionBwdDataAlgoDirect,<unused>;miopenConvolutionBwdDataAlgoGEMM:gemm,1.53282,0,MIOpenGEMM,0_1_1225_192_1225_1225_192_32
768-17-17-1x1-160-17-17-128-0x0-1x1-1x1-0-NCHW-FP32-F=miopenConvolutionFwdAlgoDirect:ConvAsm1x1U,1.18099,0,miopenConvolutionFwdAlgoDirect,<unused>;miopenConvolutionFwdAlgoGEMM:GemmFwd1x1_0_1,5.31557,0,MIOpenGEMM,0_0_289_768_289_289_160_768
64-35-35-5x5-48-35-35-128-2x2-1x1-1x1-0-NCHW-FP32-B=miopenConvolutionBwdDataAlgoWinograd:ConvBinWinogradRxS,2.07154,0,miopenConvolutionBwdDataAlgoWinograd,<unused>;miopenConvolutionBwdDataAlgoDirect:ConvOclDirectFwd,7.54798,0,miopenConvolutionBwdDataAlgoDirect,<unused>;miopenConvolutionBwdDataAlgoGEMM:gemm,17.2782,5880000,MIOpenGEMM,0_1_1225_1200_1225_1225_1200_64
288-35-35-1x1-64-35-35-128-0x0-1x1-1x1-0-NCHW-FP32-F=miopenConvolutionFwdAlgoDirect:ConvAsm1x1U,0.690062,0,miopenConvolutionFwdAlgoDirect,<unused>;miopenConvolutionFwdAlgoWinograd:ConvBinWinogradRxSf3x2,1.14857,0,miopenConvolutionFwdAlgoWinograd,<unused>;miopenConvolutionFwdAlgoGEMM:GemmFwd1x1_0_1,5.88976,0,MIOpenGEMM,0_0_1225_288_1225_1225_64_288
192-17-17-7x1-192-17-17-128-3x0-1x1-1x1-0-NCHW-FP32-F=miopenConvolutionFwdAlgoImplicitGEMM:ConvHipImplicitGemmV4R1Fwd,1.98569,0,miopenConvolutionFwdAlgoImplicitGEMM,192x17x17x1x7x192x17x17x128xNCHWxFP32x0x3x1x1x1x1x1x1;miopenConvolutionFwdAlgoWinograd:ConvBinWinogradRxSf3x2,2.28713,0,miopenConvolutionFwdAlgoWinograd,<unused>;miopenConvolutionFwdAlgoGEMM:GemmFwdRest,9.53279,1553664,MIOpenGEMM,0_0_289_1344_289_289_192_1344
384-8-8-1x1-1280-8-8-128-0x0-1x1-1x1-0-NCHW-FP32-B=miopenConvolutionBwdDataAlgoDirect:ConvAsm1x1U,0.671758,0,miopenConvolutionBwdDataAlgoDirect,<unused>;miopenConvolutionBwdDataAlgoWinograd:ConvBinWinogradRxSf3x2,1.81001,0,miopenConvolutionBwdDataAlgoWinograd,<unused>;miopenConvolutionBwdDataAlgoGEMM:gemm,4.54032,0,MIOpenGEMM,0_1_64_1280_64_64_1280_384
96-17-17-3x3-96-35-35-128-0x0-2x2-1x1-0-NCHW-FP32-B=miopenConvolutionBwdDataAlgoWinograd:ConvBinWinogradRxSf2x3,1.39325,0,miopenConvolutionBwdDataAlgoWinograd,<unused>;miopenConvolutionBwdDataAlgoImplicitGEMM:ConvHipImplicitGemmBwdDataV1R1,3.52804,0,miopenConvolutionBwdDataAlgoImplicitGEMM,96x17x17x3x3x96x35x35x128xNCHWxFP32x0x0x2x2x1x1x1x0;miopenConvolutionBwdDataAlgoDirect:ConvOclDirectFwd,4.34723,0,miopenConvolutionBwdDataAlgoDirect,<unused>;miopenConvolutionBwdDataAlgoGEMM:gemm,28.996,998784,MIOpenGEMM,0_1_289_864_289_289_864_96
48-35-35-1x1-256-35-35-128-0x0-1x1-1x1-0-NCHW-FP32-W=miopenConvolutionBwdWeightsAlgoDirect:ConvAsmBwdWrW1x1,0.911827,0,miopenConvolutionBwdWeightsAlgoDirect,<unused>
32-147-147-3x3-32-149-149-128-0x0-1x1-1x1-0-NCHW-FP32-B=miopenConvolutionBwdDataAlgoWinograd:ConvBinWinogradRxS,2.7756,0,miopenConvolutionBwdDataAlgoWinograd,<unused>;miopenConvolutionBwdDataAlgoDirect:ConvOclDirectFwd,13.6947,0,miopenConvolutionBwdDataAlgoDirect,<unused>;miopenConvolutionBwdDataAlgoImplicitGEMM:ConvHipImplicitGemmBwdDataV1R1,51.0026,0,miopenConvolutionBwdDataAlgoImplicitGEMM,32x147x147x3x3x32x149x149x128xNCHWxFP32x0x0x1x1x1x1x1x0;miopenConvolutionBwdDataAlgoGEMM:gemm,153.149,24893568,MIOpenGEMM,0_1_21609_288_21609_21609_288_32
128-17-17-1x7-192-17-17-128-0x3-1x1-1x1-0-NCHW-FP32-F=miopenConvolutionFwdAlgoImplicitGEMM:ConvHipImplicitGemmV4R1Fwd,1.37539,0,miopenConvolutionFwdAlgoImplicitGEMM,128x17x17x7x1x192x17x17x128xNCHWxFP32x3x0x1x1x1x1x1x1;miopenConvolutionFwdAlgoWinograd:ConvBinWinogradRxSf3x2,1.70852,0,miopenConvolutionFwdAlgoWinograd,<unused>;miopenConvolutionFwdAlgoGEMM:GemmFwdRest,9.92288,1035776,MIOpenGEMM,0_0_289_896_289_289_192_896
2048-8-8-1x1-320-8-8-128-0x0-1x1-1x1-0-NCHW-FP32-F=miopenConvolutionFwdAlgoDirect:ConvAsm1x1U,1.44637,0,miopenConvolutionFwdAlgoDirect,<unused>;miopenConvolutionFwdAlgoWinograd:ConvBinWinogradRxSf3x2,2.46632,0,miopenConvolutionFwdAlgoWinograd,<unused>;miopenConvolutionFwdAlgoGEMM:GemmFwd1x1_0_1,5.33441,0,MIOpenGEMM,0_0_64_2048_64_64_320_2048
256-14-14-1x1-528-14-14-128-0x0-1x1-1x1-0-NCHW-FP32-B=miopenConvolutionBwdDataAlgoDirect:ConvAsm1x1U,0.691146,0,miopenConvolutionBwdDataAlgoDirect,<unused>;miopenConvolutionBwdDataAlgoGEMM:gemm,2.48478,0,MIOpenGEMM,0_1_196_528_196_196_528_256
48-35-35-5x5-64-35-35-128-2x2-1x1-1x1-0-NCHW-FP32-F=miopenConvolutionFwdAlgoWinograd:ConvBinWinogradRxS,1.57344,0,miopenConvolutionFwdAlgoWinograd,<unused>;miopenConvolutionFwdAlgoImplicitGEMM:ConvHipImplicitGemmV4R1Fwd,2.57294,0,miopenConvolutionFwdAlgoImplicitGEMM,48x35x35x5x5x64x35x35x128xNCHWxFP32x2x2x1x1x1x1x1x1;miopenConvolutionFwdAlgoDirect:ConvOclDirectFwd,8.58482,0,miopenConvolutionFwdAlgoDirect,<unused>;miopenConvolutionFwdAlgoGEMM:GemmFwdRest,9.36743,5880000,MIOpenGEMM,0_0_1225_1200_1225_1225_64_1200
128-17-17-1x1-768-17-17-128-0x0-1x1-1x1-0-NCHW-FP32-W=miopenConvolutionBwdWeightsAlgoDirect:ConvAsmBwdWrW1x1,0.9585,0,miopenConvolutionBwdWeightsAlgoDirect,<unused>
48-35-35-1x1-288-35-35-128-0x0-1x1-1x1-0-NCHW-FP32-W=miopenConvolutionBwdWeightsAlgoDirect:ConvAsmBwdWrW1x1,0.997435,0,miopenConvolutionBwdWeightsAlgoDirect,<unused>;miopenConvolutionBwdWeightsAlgoGEMM:gemm,2.74176,0,MIOpenGEMM,1_0_1225_1225_288_288_48_1225;miopenConvolutionBwdWeightsAlgoWinograd:ConvBinWinogradRxSf2x3,5.0433,0,miopenConvolutionBwdWeightsAlgoWinograd,48x35x35x1x1x288x35x35x128xNCHWxFP32x0x0x1x1x1x1x1x0
192-35-35-1x1-32-35-35-128-0x0-1x1-1x1-0-NCHW-FP32-F=miopenConvolutionFwdAlgoDirect:ConvOclDirectFwd1x1,0.303539,0,miopenConvolutionFwdAlgoDirect,<unused>;miopenConvolutionFwdAlgoGEMM:GemmFwd1x1_0_1,1.95376,0,MIOpenGEMM,0_0_1225_192_1225_1225_32_192
1280-8-8-1x1-384-8-8-128-0x0-1x1-1x1-0-NCHW-FP32-F=miopenConvolutionFwdAlgoDirect:ConvAsm1x1U,1.01902,0,miopenConvolutionFwdAlgoDirect,<unused>;miopenConvolutionFwdAlgoWinograd:ConvBinWinogradRxSf3x2,1.82732,0,miopenConvolutionFwdAlgoWinograd,<unused>;miopenConvolutionFwdAlgoGEMM:GemmFwd1x1_0_1,4.28096,0,MIOpenGEMM,0_0_64_1280_64_64_384_1280
192-17-17-7x1-128-17-17-128-3x0-1x1-1x1-0-NCHW-FP32-W=miopenConvolutionBwdWeightsAlgoWinograd:ConvBinWinogradRxSf2x3,1.73098,0,miopenConvolutionBwdWeightsAlgoWinograd,192x17x17x1x7x128x17x17x128xNCHWxFP32x0x3x1x1x1x1x1x0;miopenConvolutionBwdWeightsAlgoDirect:ConvOclBwdWrW53,3.55516,0,miopenConvolutionBwdWeightsAlgoDirect,<unused>;miopenConvolutionBwdWeightsAlgoImplicitGEMM:ConvHipImplicitGemmV4R1WrW,3.94078,0,miopenConvolutionBwdWeightsAlgoImplicitGEMM,192x17x17x1x7x128x17x17x128xNCHWxFP32x0x3x1x1x1x1x1x0;miopenConvolutionBwdWeightsAlgoGEMM:gemm,5.02418,1035776,MIOpenGEMM,1_0_289_289_896_896_192_289
192-17-17-3x3-320-8-8-128-0x0-2x2-1x1-0-NCHW-FP32-F=miopenConvolutionFwdAlgoWinograd:ConvBinWinogradRxSf2x3,1.51386,0,miopenConvolutionFwdAlgoWinograd,<unused>;miopenConvolutionFwdAlgoDirect:ConvOclDirectFwd,4.19787,0,miopenConvolutionFwdAlgoDirect,<unused>;miopenConvolutionFwdAlgoGEMM:GemmFwdRest,5.76937,442368,MIOpenGEMM,0_0_64_1728_64_64_320_1728
384-8-8-1x3-384-8-8-128-0x1-1x1-1x1-0-NCHW-FP32-F=miopenConvolutionFwdAlgoImplicitGEMM:ConvHipImplicitGemmV4R1Fwd,0.841978,0,miopenConvolutionFwdAlgoImplicitGEMM,384x8x8x3x1x384x8x8x128xNCHWxFP32x1x0x1x1x1x1x1x1;miopenConvolutionFwdAlgoWinograd:ConvBinWinogradRxSf2x3,0.992581,0,miopenConvolutionFwdAlgoWinograd,<unused>;miopenConvolutionFwdAlgoGEMM:GemmFwdRest,11.8708,294912,MIOpenGEMM,0_0_64_1152_64_64_384_1152
96-35-35-3x3-96-17-17-128-0x0-2x2-1x1-0-NCHW-FP32-F=miopenConvolutionFwdAlgoWinograd:ConvBinWinogradRxS,1.30745,0,miopenConvolutionFwdAlgoWinograd,<unused>;miopenConvolutionFwdAlgoDirect:ConvOclDirectFwd,5.97873,0,miopenConvolutionFwdAlgoDirect,<unused>;miopenConvolutionFwdAlgoGEMM:GemmFwdRest,7.52516,998784,MIOpenGEMM,0_0_289_864_289_289_96_864
32-149-149-3x3-32-147-147-128-0x0-1x1-1x1-0-NCHW-FP32-F=miopenConvolutionFwdAlgoWinograd:ConvBinWinogradRxS,2.83678,0,miopenConvolutionFwdAlgoWinograd,<unused>;miopenConvolutionFwdAlgoGEMM:GemmFwdRest,14.7452,24893568,MIOpenGEMM,0_0_21609_288_21609_21609_32_288;miopenConvolutionFwdAlgoDirect:ConvOclDirectFwd,15.2682,0,miopenConvolutionFwdAlgoDirect,<unused>
192-17-17-1x7-160-17-17-128-0x3-1x1-1x1-0-NCHW-FP32-W=miopenConvolutionBwdWeightsAlgoWinograd:ConvBinWinogradRxSf2x3,2.75518,0,miopenConvolutionBwdWeightsAlgoWinograd,192x17x17x7x1x160x17x17x128xNCHWxFP32x3x0x1x1x1x1x1x0;miopenConvolutionBwdWeightsAlgoDirect:ConvOclBwdWrW53,3.03612,0,miopenConvolutionBwdWeightsAlgoDirect,<unused>;miopenConvolutionBwdWeightsAlgoGEMM:gemm,5.31157,1294720,MIOpenGEMM,1_0_289_289_1120_1120_192_289
192-8-8-1x1-2048-8-8-128-0x0-1x1-1x1-0-NCHW-FP32-W=miopenConvolutionBwdWeightsAlgoDirect:ConvAsmBwdWrW1x1,0.768895,0,miopenConvolutionBwdWeightsAlgoDirect,<unused>;miopenConvolutionBwdWeightsAlgoWinograd:ConvBinWinogradRxSf2x3,2.5391,0,miopenConvolutionBwdWeightsAlgoWinograd,192x8x8x1x1x2048x8x8x128xNCHWxFP32x0x0x1x1x1x1x1x0;miopenConvolutionBwdWeightsAlgoGEMM:gemm,2.82135,0,MIOpenGEMM,1_0_64_64_2048_2048_192_64
48-35-35-1x1-256-35-35-128-0x0-1x1-1x1-0-NCHW-FP32-B=miopenConvolutionBwdDataAlgoDirect:ConvAsm1x1U,0.554925,0,miopenConvolutionBwdDataAlgoDirect,<unused>;miopenConvolutionBwdDataAlgoWinograd:ConvBinWinogradRxSf3x2,1.02779,0,miopenConvolutionBwdDataAlgoWinograd,<unused>;miopenConvolutionBwdDataAlgoGEMM:gemm,5.03602,0,MIOpenGEMM,0_1_1225_256_1225_1225_256_48
320-8-8-3x3-192-17-17-128-0x0-2x2-1x1-0-NCHW-FP32-W=miopenConvolutionBwdWeightsAlgoImplicitGEMM:ConvHipImplicitGemmV4R1WrW,1.80045,0,miopenConvolutionBwdWeightsAlgoImplicitGEMM,320x8x8x3x3x192x17x17x128xNCHWxFP32x0x0x2x2x1x1x1x0;miopenConvolutionBwdWeightsAlgoGEMM:gemm,6.28862,442368,MIOpenGEMM,1_0_64_64_1728_1728_320_64;miopenConvolutionBwdWeightsAlgoDirect:ConvOclBwdWrW2NonTunable,21.0781,283115520,miopenConvolutionBwdWeightsAlgoDirect,<unused>
384-8-8-3x3-448-8-8-128-1x1-1x1-1x1-0-NCHW-FP32-W=miopenConvolutionBwdWeightsAlgoWinograd:ConvBinWinogradRxS,1.68954,0,miopenConvolutionBwdWeightsAlgoWinograd,384x8x8x3x3x448x8x8x128xNCHWxFP32x1x1x1x1x1x1x1x0;miopenConvolutionBwdWeightsAlgoDirect:ConvOclBwdWrW53,2.95759,0,miopenConvolutionBwdWeightsAlgoDirect,<unused>;miopenConvolutionBwdWeightsAlgoImplicitGEMM:ConvHipImplicitGemmV4R1WrW,3.33785,0,miopenConvolutionBwdWeightsAlgoImplicitGEMM,384x8x8x3x3x448x8x8x128xNCHWxFP32x1x1x1x1x1x1x1x0;miopenConvolutionBwdWeightsAlgoGEMM:gemm,19.5296,1032192,MIOpenGEMM,1_0_64_64_4032_4032_384_64
48-35-35-1x1-288-35-35-128-0x0-1x1-1x1-0-NCHW-FP32-B=miopenConvolutionBwdDataAlgoDirect:ConvAsm1x1U,0.800466,0,miopenConvolutionBwdDataAlgoDirect,<unused>;miopenConvolutionBwdDataAlgoGEMM:gemm,3.89217,0,MIOpenGEMM,0_1_1225_288_1225_1225_288_48
192-71-71-3x3-80-73-73-128-0x0-1x1-1x1-0-NCHW-FP32-W=miopenConvolutionBwdWeightsAlgoWinograd:ConvBinWinogradRxSf2x3,25.4746,0,miopenConvolutionBwdWeightsAlgoWinograd,192x71x71x3x3x80x73x73x128xNCHWxFP32x0x0x1x1x1x1x1x0;miopenConvolutionBwdWeightsAlgoDirect:ConvOclBwdWrW2NonTunable,82.5134,70778880,miopenConvolutionBwdWeightsAlgoDirect,<unused>;miopenConvolutionBwdWeightsAlgoGEMM:gemm,214.915,14518080,MIOpenGEMM,1_0_5041_5041_720_720_192_5041
320-8-8-1x1-1280-8-8-128-0x0-1x1-1x1-0-NCHW-FP32-W=miopenConvolutionBwdWeightsAlgoDirect:ConvAsmBwdWrW1x1,0.991839,0,miopenConvolutionBwdWeightsAlgoDirect,<unused>;miopenConvolutionBwdWeightsAlgoWinograd:ConvBinWinogradRxSf2x3,2.72555,0,miopenConvolutionBwdWeightsAlgoWinograd,320x8x8x1x1x1280x8x8x128xNCHWxFP32x0x0x1x1x1x1x1x0;miopenConvolutionBwdWeightsAlgoGEMM:gemm,2.77637,0,MIOpenGEMM,1_0_64_64_1280_1280_320_64
384-8-8-3x3-448-8-8-128-1x1-1x1-1x1-0-NCHW-FP32-B=miopenConvolutionBwdDataAlgoWinograd:ConvBinWinograd3x3U,1.02062,0,miopenConvolutionBwdDataAlgoWinograd,<unused>
192-17-17-7x1-128-17-17-128-3x0-1x1-1x1-0-NCHW-FP32-B=miopenConvolutionBwdDataAlgoWinograd:ConvBinWinogradRxSf3x2,1.59788,0,miopenConvolutionBwdDataAlgoWinograd,<unused>;miopenConvolutionBwdDataAlgoImplicitGEMM:ConvHipImplicitGemmBwdDataV1R1,5.16191,0,miopenConvolutionBwdDataAlgoImplicitGEMM,192x17x17x1x7x128x17x17x128xNCHWxFP32x0x3x1x1x1x1x1x0;miopenConvolutionBwdDataAlgoGEMM:gemm,9.02708,1035776,MIOpenGEMM,0_1_289_896_289_289_896_192
64-147-147-3x3-32-147-147-128-1x1-1x1-1x1-0-NCHW-FP32-W=miopenConvolutionBwdWeightsAlgoDirect:ConvAsmBwdWrW3x3,10.6795,0,miopenConvolutionBwdWeightsAlgoDirect,<unused>;miopenConvolutionBwdWeightsAlgoGEMM:gemm,55.9369,24893568,MIOpenGEMM,1_0_21609_21609_288_288_64_21609;miopenConvolutionBwdWeightsAlgoWinograd:ConvBinWinogradRxSf2x3,69.8769,0,miopenConvolutionBwdWeightsAlgoWinograd,64x147x147x3x3x32x147x147x128xNCHWxFP32x1x1x1x1x1x1x1x0
192-8-8-1x1-2048-8-8-128-0x0-1x1-1x1-0-NCHW-FP32-B=miopenConvolutionBwdDataAlgoDirect:ConvAsm1x1U,0.639974,0,miopenConvolutionBwdDataAlgoDirect,<unused>;miopenConvolutionBwdDataAlgoWinograd:ConvBinWinogradRxSf3x2,1.64166,0,miopenConvolutionBwdDataAlgoWinograd,<unused>;miopenConvolutionBwdDataAlgoGEMM:gemm,3.35234,0,MIOpenGEMM,0_1_64_2048_64_64_2048_192
320-8-8-3x3-192-17-17-128-0x0-2x2-1x1-0-NCHW-FP32-B=miopenConvolutionBwdDataAlgoImplicitGEMM:ConvHipImplicitGemmBwdDataV1R1,1.71321,0,miopenConvolutionBwdDataAlgoImplicitGEMM,320x8x8x3x3x192x17x17x128xNCHWxFP32x0x0x2x2x1x1x1x0;miopenConvolutionBwdDataAlgoWinograd:ConvBinWinogradRxS,2.5028,0,miopenConvolutionBwdDataAlgoWinograd,<unused>;miopenConvolutionBwdDataAlgoGEMM:gemm,7.79872,442368,MIOpenGEMM,0_1_64_1728_64_64_1728_320;miopenConvolutionBwdDataAlgoDirect:ConvOclDirectFwd,8.07079,0,miopenConvolutionBwdDataAlgoDirect,<unused>
448-8-8-3x3-384-8-8-128-1x1-1x1-1x1-0-NCHW-FP32-F=miopenConvolutionFwdAlgoWinograd:ConvBinWinograd3x3U,1.02629,0,miopenConvolutionFwdAlgoWinograd,<unused>
256-35-35-1x1-48-35-35-128-0x0-1x1-1x1-0-NCHW-FP32-F=miopenConvolutionFwdAlgoDirect:ConvAsm1x1U,0.529045,0,miopenConvolutionFwdAlgoDirect,<unused>;miopenConvolutionFwdAlgoGEMM:GemmFwd1x1_0_1,3.46306,0,MIOpenGEMM,0_0_1225_256_1225_1225_48_256
64-147-147-3x3-32-147-147-128-1x1-1x1-1x1-0-NCHW-FP32-B=miopenConvolutionBwdDataAlgoWinograd:ConvBinWinogradRxS,4.98247,0,miopenConvolutionBwdDataAlgoWinograd,<unused>
192-71-71-3x3-80-73-73-128-0x0-1x1-1x1-0-NCHW-FP32-B=miopenConvolutionBwdDataAlgoWinograd:ConvBinWinogradRxSf2x3,10.6959,0,miopenConvolutionBwdDataAlgoWinograd,<unused>;miopenConvolutionBwdDataAlgoDirect:ConvOclDirectFwd,49.2524,0,miopenConvolutionBwdDataAlgoDirect,<unused>;miopenConvolutionBwdDataAlgoGEMM:gemm,120.272,14518080,MIOpenGEMM,0_1_5041_720_5041_5041_720_192
288-35-35-1x1-48-35-35-128-0x0-1x1-1x1-0-NCHW-FP32-F=miopenConvolutionFwdAlgoDirect:ConvOclDirectFwd1x1,0.653,0,miopenConvolutionFwdAlgoDirect,<unused>;miopenConvolutionFwdAlgoGEMM:GemmFwd1x1_0_1,3.62081,0,MIOpenGEMM,0_0_1225_288_1225_1225_48_288
32-147-147-3x3-64-147-147-128-1x1-1x1-1x1-0-NCHW-FP32-F=miopenConvolutionFwdAlgoWinograd:ConvBinWinograd3x3U,5.0719,0,miopenConvolutionFwdAlgoWinograd,<unused>
32-149-149-3x3-3-299-299-128-0x0-2x2-1x1-0-NCHW-FP32-W=miopenConvolutionBwdWeightsAlgoDirect:ConvOclBwdWrW2NonTunable,5.61859,442368,miopenConvolutionBwdWeightsAlgoDirect,<unused>;miopenConvolutionBwdWeightsAlgoGEMM:gemm,7.57934,2397708,MIOpenGEMM,1_0_22201_22201_27_27_32_22201
384-17-17-3x3-288-35-35-128-0x0-2x2-1x1-0-NCHW-FP32-W=miopenConvolutionBwdWeightsAlgoGEMM:gemm,21.3402,2996352,MIOpenGEMM,1_0_289_289_2592_2592_384_289;miopenConvolutionBwdWeightsAlgoDirect:ConvOclBwdWrW2NonTunable,74.4862,509607936,miopenConvolutionBwdWeightsAlgoDirect,<unused>
2048-8-8-1x1-192-8-8-128-0x0-1x1-1x1-0-NCHW-FP32-F=miopenConvolutionFwdAlgoDirect:ConvAsm1x1U,1.08845,0,miopenConvolutionFwdAlgoDirect,<unused>;miopenConvolutionFwdAlgoWinograd:ConvBinWinogradRxSf3x2,1.75741,0,miopenConvolutionFwdAlgoWinograd,<unused>;miopenConvolutionFwdAlgoGEMM:GemmFwd1x1_0_1,4.60613,0,MIOpenGEMM,0_0_64_2048_64_64_192_2048
448-8-8-1x1-2048-8-8-128-0x0-1x1-1x1-0-NCHW-FP32-W=miopenConvolutionBwdWeightsAlgoDirect:ConvAsmBwdWrW1x1,2.32805,0,miopenConvolutionBwdWeightsAlgoDirect,<unused>;miopenConvolutionBwdWeightsAlgoGEMM:gemm,4.14217,0,MIOpenGEMM,1_0_64_64_2048_2048_448_64;miopenConvolutionBwdWeightsAlgoWinograd:ConvBinWinogradRxSf2x3,5.48816,0,miopenConvolutionBwdWeightsAlgoWinograd,448x8x8x1x1x2048x8x8x128xNCHWxFP32x0x0x1x1x1x1x1x0
80-73-73-3x3-192-71-71-128-0x0-1x1-1x1-0-NCHW-FP32-F=miopenConvolutionFwdAlgoWinograd:ConvBinWinogradRxSf2x3,8.52507,0,miopenConvolutionFwdAlgoWinograd,<unused>;miopenConvolutionFwdAlgoDirect:ConvOclDirectFwd,43.8556,0,miopenConvolutionFwdAlgoDirect,<unused>;miopenConvolutionFwdAlgoGEMM:GemmFwdRest,81.7708,14518080,MIOpenGEMM,0_0_5041_720_5041_5041_192_720
384-8-8-1x3-384-8-8-128-0x1-1x1-1x1-0-NCHW-FP32-W=miopenConvolutionBwdWeightsAlgoDirect:ConvOclBwdWrW53,1.01482,0,miopenConvolutionBwdWeightsAlgoDirect,<unused>;miopenConvolutionBwdWeightsAlgoImplicitGEMM:ConvHipImplicitGemmV4R1WrW,1.28936,0,miopenConvolutionBwdWeightsAlgoImplicitGEMM,384x8x8x3x1x384x8x8x128xNCHWxFP32x1x0x1x1x1x1x1x0;miopenConvolutionBwdWeightsAlgoWinograd:ConvBinWinogradRxSf2x3,1.54227,0,miopenConvolutionBwdWeightsAlgoWinograd,384x8x8x3x1x384x8x8x128xNCHWxFP32x1x0x1x1x1x1x1x0;miopenConvolutionBwdWeightsAlgoGEMM:gemm,2.96672,294912,MIOpenGEMM,1_0_64_64_1152_1152_384_64
32-149-149-3x3-3-299-299-128-0x0-2x2-1x1-0-NCHW-FP32-B=miopenConvolutionBwdDataAlgoDirect:ConvOclDirectFwd,3.34256,0,miopenConvolutionBwdDataAlgoDirect,<unused>;miopenConvolutionBwdDataAlgoWinograd:ConvBinWinogradRxS,5.64102,0,miopenConvolutionBwdDataAlgoWinograd,<unused>;miopenConvolutionBwdDataAlgoGEMM:gemm,7.84415,2397708,MIOpenGEMM,0_1_22201_27_22201_22201_27_32
128-17-17-7x1-192-17-17-128-3x0-1x1-1x1-0-NCHW-FP32-F=miopenConvolutionFwdAlgoWinograd:ConvBinWinogradRxSf3x2,1.48651,0,miopenConvolutionFwdAlgoWinograd,<unused>;miopenConvolutionFwdAlgoImplicitGEMM:ConvHipImplicitGemmV4R1Fwd,1.49865,0,miopenConvolutionFwdAlgoImplicitGEMM,128x17x17x1x7x192x17x17x128xNCHWxFP32x0x3x1x1x1x1x1x1;miopenConvolutionFwdAlgoGEMM:GemmFwdRest,8.88312,1035776,MIOpenGEMM,0_0_289_896_289_289_192_896
384-17-17-3x3-288-35-35-128-0x0-2x2-1x1-0-NCHW-FP32-B=miopenConvolutionBwdDataAlgoWinograd:ConvBinWinogradRxSf2x3,14.3149,0,miopenConvolutionBwdDataAlgoWinograd,<unused>;miopenConvolutionBwdDataAlgoImplicitGEMM:ConvHipImplicitGemmBwdDataV1R1,15.0874,0,miopenConvolutionBwdDataAlgoImplicitGEMM,384x17x17x3x3x288x35x35x128xNCHWxFP32x0x0x2x2x1x1x1x0;miopenConvolutionBwdDataAlgoGEMM:gemm,26.2818,2996352,MIOpenGEMM,0_1_289_2592_289_289_2592_384;miopenConvolutionBwdDataAlgoDirect:ConvOclDirectFwd,43.187,0,miopenConvolutionBwdDataAlgoDirect,<unused>
64-35-35-1x1-192-35-35-128-0x0-1x1-1x1-0-NCHW-FP32-W=miopenConvolutionBwdWeightsAlgoDirect:ConvAsmBwdWrW1x1,0.835232,0,miopenConvolutionBwdWeightsAlgoDirect,<unused>
192-17-17-1x1-768-17-17-128-0x0-1x1-1x1-0-NCHW-FP32-W=miopenConvolutionBwdWeightsAlgoDirect:ConvAsmBwdWrW1x1,1.92421,0,miopenConvolutionBwdWeightsAlgoDirect,<unused>
320-8-8-1x1-1280-8-8-128-0x0-1x1-1x1-0-NCHW-FP32-B=miopenConvolutionBwdDataAlgoDirect:ConvAsm1x1U,0.652376,0,miopenConvolutionBwdDataAlgoDirect,<unused>;miopenConvolutionBwdDataAlgoWinograd:ConvBinWinogradRxSf3x2,1.69604,0,miopenConvolutionBwdDataAlgoWinograd,<unused>;miopenConvolutionBwdDataAlgoGEMM:gemm,5.9733,0,MIOpenGEMM,0_1_64_1280_64_64_1280_320
448-8-8-1x1-2048-8-8-128-0x0-1x1-1x1-0-NCHW-FP32-B=miopenConvolutionBwdDataAlgoDirect:ConvAsm1x1U,1.7039,0,miopenConvolutionBwdDataAlgoDirect,<unused>;miopenConvolutionBwdDataAlgoWinograd:ConvBinWinogradRxSf3x2,3.71642,0,miopenConvolutionBwdDataAlgoWinograd,<unused>;miopenConvolutionBwdDataAlgoGEMM:gemm,5.57987,0,MIOpenGEMM,0_1_64_2048_64_64_2048_448
96-35-35-3x3-96-35-35-128-1x1-1x1-1x1-0-NCHW-FP32-B=miopenConvolutionBwdDataAlgoWinograd:ConvBinWinogradRxSf2x3,1.23049,0,miopenConvolutionBwdDataAlgoWinograd,<unused>
64-35-35-3x3-96-35-35-128-1x1-1x1-1x1-0-NCHW-FP32-F=miopenConvolutionFwdAlgoWinograd:ConvBinWinogradRxS,0.904345,0,miopenConvolutionFwdAlgoWinograd,<unused>
288-35-35-3x3-384-17-17-128-0x0-2x2-1x1-0-NCHW-FP32-F=miopenConvolutionFwdAlgoWinograd:ConvBinWinogradRxS,14.5411,0,miopenConvolutionFwdAlgoWinograd,<unused>;miopenConvolutionFwdAlgoGEMM:GemmFwdRest,26.5298,2996352,MIOpenGEMM,0_0_289_2592_289_289_384_2592;miopenConvolutionFwdAlgoDirect:ConvOclDirectFwd,67.9922,0,miopenConvolutionFwdAlgoDirect,<unused>
192-17-17-1x1-768-17-17-128-0x0-1x1-1x1-0-NCHW-FP32-B=miopenConvolutionBwdDataAlgoDirect:ConvAsm1x1U,1.09728,0,miopenConvolutionBwdDataAlgoDirect,<unused>;miopenConvolutionBwdDataAlgoWinograd:ConvBinWinogradRxSf3x2,2.47988,0,miopenConvolutionBwdDataAlgoWinograd,<unused>;miopenConvolutionBwdDataAlgoGEMM:gemm,4.0927,0,MIOpenGEMM,0_1_289_768_289_289_768_192
64-35-35-1x1-192-35-35-128-0x0-1x1-1x1-0-NCHW-FP32-B=miopenConvolutionBwdDataAlgoDirect:ConvAsm1x1U,0.560222,0,miopenConvolutionBwdDataAlgoDirect,<unused>;miopenConvolutionBwdDataAlgoGEMM:gemm,4.5313,0,MIOpenGEMM,0_1_1225_192_1225_1225_192_64
2048-8-8-1x1-448-8-8-128-0x0-1x1-1x1-0-NCHW-FP32-F=miopenConvolutionFwdAlgoDirect:ConvAsm1x1U,2.30959,0,miopenConvolutionFwdAlgoDirect,<unused>;miopenConvolutionFwdAlgoWinograd:ConvBinWinogradRxSf3x2,3.63503,0,miopenConvolutionFwdAlgoWinograd,<unused>;miopenConvolutionFwdAlgoGEMM:GemmFwd1x1_0_1,5.98453,0,MIOpenGEMM,0_0_64_2048_64_64_448_2048
768-17-17-1x1-192-17-17-128-0x0-1x1-1x1-0-NCHW-FP32-F=miopenConvolutionFwdAlgoDirect:ConvAsm1x1U,1.38226,0,miopenConvolutionFwdAlgoDirect,<unused>;miopenConvolutionFwdAlgoWinograd:ConvBinWinogradRxSf3x2,2.41648,0,miopenConvolutionFwdAlgoWinograd,<unused>;miopenConvolutionFwdAlgoGEMM:GemmFwd1x1_0_1,6.38292,0,MIOpenGEMM,0_0_289_768_289_289_192_768
384-8-8-1x1-2048-8-8-128-0x0-1x1-1x1-0-NCHW-FP32-W=miopenConvolutionBwdWeightsAlgoDirect:ConvAsmBwdWrW1x1,1.35058,0,miopenConvolutionBwdWeightsAlgoDirect,<unused>;miopenConvolutionBwdWeightsAlgoGEMM:gemm,3.35993,0,MIOpenGEMM,1_0_64_64_2048_2048_384_64;miopenConvolutionBwdWeightsAlgoWinograd:ConvBinWinogradRxSf2x3,4.67741,0,miopenConvolutionBwdWeightsAlgoWinograd,384x8x8x1x1x2048x8x8x128xNCHWxFP32x0x0x1x1x1x1x1x0
160-17-17-1x1-768-17-17-128-0x0-1x1-1x1-0-NCHW-FP32-W=miopenConvolutionBwdWeightsAlgoDirect:ConvAsmBwdWrW1x1,1.2153,0,miopenConvolutionBwdWeightsAlgoDirect,<unused>
128-17-17-1x7-128-17-17-128-0x3-1x1-1x1-0-NCHW-FP32-W=miopenConvolutionBwdWeightsAlgoWinograd:ConvBinWinogradRxSf2x3,1.8445,0,miopenConvolutionBwdWeightsAlgoWinograd,128x17x17x7x1x128x17x17x128xNCHWxFP32x3x0x1x1x1x1x1x0;miopenConvolutionBwdWeightsAlgoDirect:ConvOclBwdWrW53,1.94853,0,miopenConvolutionBwdWeightsAlgoDirect,<unused>;miopenConvolutionBwdWeightsAlgoImplicitGEMM:ConvHipImplicitGemmV4R1WrW,3.99755,0,miopenConvolutionBwdWeightsAlgoImplicitGEMM,128x17x17x7x1x128x17x17x128xNCHWxFP32x3x0x1x1x1x1x1x0;miopenConvolutionBwdWeightsAlgoGEMM:gemm,4.44119,1035776,MIOpenGEMM,1_0_289_289_896_896_128_289
384-8-8-1x3-384-8-8-128-0x1-1x1-1x1-0-NCHW-FP32-B=miopenConvolutionBwdDataAlgoImplicitGEMM:ConvHipImplicitGemmBwdDataV1R1,0.855427,0,miopenConvolutionBwdDataAlgoImplicitGEMM,384x8x8x3x1x384x8x8x128xNCHWxFP32x1x0x1x1x1x1x1x0;miopenConvolutionBwdDataAlgoWinograd:ConvBinWinogradRxSf2x3,0.890922,0,miopenConvolutionBwdDataAlgoWinograd,<unused>;miopenConvolutionBwdDataAlgoGEMM:gemm,4.8301,294912,MIOpenGEMM,0_1_64_1152_64_64_1152_384
1280-8-8-1x1-320-8-8-128-0x0-1x1-1x1-0-NCHW-FP32-F=miopenConvolutionFwdAlgoDirect:ConvAsm1x1U,0.895094,0,miopenConvolutionFwdAlgoDirect,<unused>;miopenConvolutionFwdAlgoWinograd:ConvBinWinogradRxSf3x2,1.7109,0,miopenConvolutionFwdAlgoWinograd,<unused>;miopenConvolutionFwdAlgoGEMM:GemmFwd1x1_0_1,7.30165,0,MIOpenGEMM,0_0_64_1280_64_64_320_1280
192-8-8-1x1-1280-8-8-128-0x0-1x1-1x1-0-NCHW-FP32-B=miopenConvolutionBwdDataAlgoDirect:ConvAsm1x1U,0.341377,0,miopenConvolutionBwdDataAlgoDirect,<unused>;miopenConvolutionBwdDataAlgoWinograd:ConvBinWinogradRxSf3x2,1.00646,0,miopenConvolutionBwdDataAlgoWinograd,<unused>;miopenConvolutionBwdDataAlgoGEMM:gemm,4.19019,0,MIOpenGEMM,0_1_64_1280_64_64_1280_192
1024-17-17-1x1-192-17-17-64-0x0-1x1-1x1-0-NCHW-FP32-F=miopenConvolutionFwdAlgoDirect:ConvAsm1x1U,1.10329,0,miopenConvolutionFwdAlgoDirect,<unused>;miopenConvolutionFwdAlgoWinograd:ConvBinWinogradRxSf3x2,1.61622,0,miopenConvolutionFwdAlgoWinograd,<unused>;miopenConvolutionFwdAlgoGEMM:GemmFwd1x1_0_1,3.86529,0,MIOpenGEMM,0_0_289_1024_289_289_192_1024
768-17-17-1x1-128-17-17-128-0x0-1x1-1x1-0-NCHW-FP32-F=miopenConvolutionFwdAlgoDirect:ConvAsm1x1U,0.961946,0,miopenConvolutionFwdAlgoDirect,<unused>;miopenConvolutionFwdAlgoWinograd:ConvBinWinogradRxSf3x2,1.67202,0,miopenConvolutionFwdAlgoWinograd,<unused>;miopenConvolutionFwdAlgoGEMM:GemmFwd1x1_0_1,5.56588,0,MIOpenGEMM,0_0_289_768_289_289_128_768
256-8-8-1x1-1536-8-8-64-0x0-1x1-1x1-0-NCHW-FP32-W=miopenConvolutionBwdWeightsAlgoDirect:ConvAsmBwdWrW1x1,0.58076,0,miopenConvolutionBwdWeightsAlgoDirect,<unused>;miopenConvolutionBwdWeightsAlgoWinograd:ConvBinWinogradRxSf2x3,1.20316,0,miopenConvolutionBwdWeightsAlgoWinograd,256x8x8x1x1x1536x8x8x64xNCHWxFP32x0x0x1x1x1x1x1x0;miopenConvolutionBwdWeightsAlgoGEMM:gemm,1.57429,0,MIOpenGEMM,1_0_64_64_1536_1536_256_64
384-8-8-3x1-384-8-8-128-1x0-1x1-1x1-0-NCHW-FP32-W=miopenConvolutionBwdWeightsAlgoDirect:ConvOclBwdWrW53,1.16797,0,miopenConvolutionBwdWeightsAlgoDirect,<unused>;miopenConvolutionBwdWeightsAlgoImplicitGEMM:ConvHipImplicitGemmV4R1WrW,1.45814,0,miopenConvolutionBwdWeightsAlgoImplicitGEMM,384x8x8x1x3x384x8x8x128xNCHWxFP32x0x1x1x1x1x1x1x0;miopenConvolutionBwdWeightsAlgoWinograd:ConvBinWinogradRxSf2x3,1.59833,0,miopenConvolutionBwdWeightsAlgoWinograd,384x8x8x1x3x384x8x8x128xNCHWxFP32x0x1x1x1x1x1x1x0;miopenConvolutionBwdWeightsAlgoGEMM:gemm,4.15909,294912,MIOpenGEMM,1_0_64_64_1152_1152_384_64
128-17-17-1x1-1024-17-17-64-0x0-1x1-1x1-0-NCHW-FP32-W=miopenConvolutionBwdWeightsAlgoDirect:ConvAsmBwdWrW1x1,0.82444,0,miopenConvolutionBwdWeightsAlgoDirect,<unused>
256-8-8-1x1-1536-8-8-64-0x0-1x1-1x1-0-NCHW-FP32-B=miopenConvolutionBwdDataAlgoDirect:ConvAsm1x1U,0.384259,0,miopenConvolutionBwdDataAlgoDirect,<unused>;miopenConvolutionBwdDataAlgoGEMM:gemm,2.37605,0,MIOpenGEMM,0_1_64_1536_64_64_1536_256
192-17-17-3x3-192-8-8-64-0x0-2x2-1x1-0-NCHW-FP32-F=miopenConvolutionFwdAlgoWinograd:ConvBinWinogradRxS,0.495812,0,miopenConvolutionFwdAlgoWinograd,<unused>;miopenConvolutionFwdAlgoDirect:ConvOclDirectFwd,1.85575,0,miopenConvolutionFwdAlgoDirect,<unused>;miopenConvolutionFwdAlgoGEMM:GemmFwdRest,8.713,442368,MIOpenGEMM,0_0_64_1728_64_64_192_1728
96-35-35-3x3-96-35-35-128-1x1-1x1-1x1-0-NCHW-FP32-W=miopenConvolutionBwdWeightsAlgoDirect:ConvAsmBwdWrW3x3,3.27317,0,miopenConvolutionBwdWeightsAlgoDirect,<unused>;miopenConvolutionBwdWeightsAlgoWinograd:ConvBinWinogradRxSf2x3,4.12995,0,miopenConvolutionBwdWeightsAlgoWinograd,96x35x35x3x3x96x35x35x128xNCHWxFP32x1x1x1x1x1x1x1x0;miopenConvolutionBwdWeightsAlgoGEMM:gemm,11.0829,4233600,MIOpenGEMM,1_0_1225_1225_864_864_96_1225
192-17-17-7x1-192-17-17-64-3x0-1x1-1x1-0-NCHW-FP32-W=miopenConvolutionBwdWeightsAlgoWinograd:ConvBinWinogradRxSf2x3,1.41539,0,miopenConvolutionBwdWeightsAlgoWinograd,192x17x17x1x7x192x17x17x64xNCHWxFP32x0x3x1x1x1x1x1x0;miopenConvolutionBwdWeightsAlgoImplicitGEMM:ConvHipImplicitGemmV4R1WrW,2.27666,0,miopenConvolutionBwdWeightsAlgoImplicitGEMM,192x17x17x1x7x192x17x17x64xNCHWxFP32x0x3x1x1x1x1x1x0;miopenConvolutionBwdWeightsAlgoDirect:ConvOclBwdWrW53,2.94474,0,miopenConvolutionBwdWeightsAlgoDirect,<unused>;miopenConvolutionBwdWeightsAlgoGEMM:gemm,4.11218,1553664,MIOpenGEMM,1_0_289_289_1344_1344_192_289
1536-8-8-1x1-256-8-8-64-0x0-1x1-1x1-0-NCHW-FP32-F=miopenConvolutionFwdAlgoDirect:ConvAsm1x1U,0.420191,0,miopenConvolutionFwdAlgoDirect,<unused>;miopenConvolutionFwdAlgoWinograd:ConvBinWinogradRxSf3x2,1.07581,0,miopenConvolutionFwdAlgoWinograd,<unused>;miopenConvolutionFwdAlgoGEMM:GemmFwd1x1_0_1,2.76288,0,MIOpenGEMM,0_0_64_1536_64_64_256_1536
80-73-73-1x1-64-73-73-128-0x0-1x1-1x1-0-NCHW-FP32-W=miopenConvolutionBwdWeightsAlgoDirect:ConvAsmBwdWrW1x1,2.27955,0,miopenConvolutionBwdWeightsAlgoDirect,<unused>
192-17-17-7x1-192-17-17-64-3x0-1x1-1x1-0-NCHW-FP32-B=miopenConvolutionBwdDataAlgoWinograd:ConvBinWinogradRxSf3x2,1.26798,0,miopenConvolutionBwdDataAlgoWinograd,<unused>;miopenConvolutionBwdDataAlgoImplicitGEMM:ConvHipImplicitGemmBwdDataV1R1,2.33178,0,miopenConvolutionBwdDataAlgoImplicitGEMM,192x17x17x1x7x192x17x17x64xNCHWxFP32x0x3x1x1x1x1x1x0;miopenConvolutionBwdDataAlgoGEMM:gemm,5.13463,1553664,MIOpenGEMM,0_1_289_1344_289_289_1344_192
384-17-17-1x1-1024-17-17-64-0x0-1x1-1x1-0-NCHW-FP32-W=miopenConvolutionBwdWeightsAlgoDirect:ConvAsmBwdWrW1x1,1.95362,0,miopenConvolutionBwdWeightsAlgoDirect,<unused>;miopenConvolutionBwdWeightsAlgoWinograd:ConvBinWinogradRxSf2x3,6.31455,0,miopenConvolutionBwdWeightsAlgoWinograd,384x17x17x1x1x1024x17x17x64xNCHWxFP32x0x0x1x1x1x1x1x0
192-17-17-7x1-192-17-17-64-3x0-1x1-1x1-0-NCHW-FP32-F=miopenConvolutionFwdAlgoWinograd:ConvBinWinogradRxSf3x2,1.20442,0,miopenConvolutionFwdAlgoWinograd,<unused>;miopenConvolutionFwdAlgoImplicitGEMM:ConvHipImplicitGemmV4R1Fwd,1.25106,0,miopenConvolutionFwdAlgoImplicitGEMM,192x17x17x1x7x192x17x17x64xNCHWxFP32x0x3x1x1x1x1x1x1;miopenConvolutionFwdAlgoGEMM:GemmFwdRest,13.1091,1553664,MIOpenGEMM,0_0_289_1344_289_289_192_1344
80-73-73-1x1-64-73-73-128-0x0-1x1-1x1-0-NCHW-FP32-B=miopenConvolutionBwdDataAlgoDirect:ConvAsm1x1U,0.805489,0,miopenConvolutionBwdDataAlgoDirect,<unused>;miopenConvolutionBwdDataAlgoWinograd:ConvBinWinogradRxSf3x2,1.60766,0,miopenConvolutionBwdDataAlgoWinograd,<unused>;miopenConvolutionBwdDataAlgoGEMM:gemm,3.61674,0,MIOpenGEMM,0_1_5329_64_5329_5329_64_80
128-17-17-1x1-1024-17-17-64-0x0-1x1-1x1-0-NCHW-FP32-B=miopenConvolutionBwdDataAlgoDirect:ConvAsm1x1U,0.50652,0,miopenConvolutionBwdDataAlgoDirect,<unused>;miopenConvolutionBwdDataAlgoWinograd:ConvBinWinogradRxSf3x2,1.11819,0,miopenConvolutionBwdDataAlgoWinograd,<unused>;miopenConvolutionBwdDataAlgoGEMM:gemm,24.2352,0,MIOpenGEMM,0_1_289_1024_289_289_1024_128
1024-17-17-1x1-384-17-17-64-0x0-1x1-1x1-0-NCHW-FP32-F=miopenConvolutionFwdAlgoDirect:ConvAsm1x1U,1.96867,0,miopenConvolutionFwdAlgoDirect,<unused>;miopenConvolutionFwdAlgoWinograd:ConvBinWinogradRxSf3x2,3.16569,0,miopenConvolutionFwdAlgoWinograd,<unused>;miopenConvolutionFwdAlgoGEMM:GemmFwd1x1_0_1,4.44727,0,MIOpenGEMM,0_0_289_1024_289_289_384_1024
64-73-73-1x1-160-73-73-64-0x0-1x1-1x1-0-NCHW-FP32-W=miopenConvolutionBwdWeightsAlgoDirect:ConvAsmBwdWrW1x1,1.97673,0,miopenConvolutionBwdWeightsAlgoDirect,<unused>;miopenConvolutionBwdWeightsAlgoGEMM:gemm,4.97161,0,MIOpenGEMM,1_0_5329_5329_160_160_64_5329;miopenConvolutionBwdWeightsAlgoWinograd:ConvBinWinogradRxSf2x3,11.129,0,miopenConvolutionBwdWeightsAlgoWinograd,64x73x73x1x1x160x73x73x64xNCHWxFP32x0x0x1x1x1x1x1x0
96-35-35-3x3-96-35-35-128-1x1-1x1-1x1-0-NCHW-FP32-F=miopenConvolutionFwdAlgoWinograd:ConvBinWinogradRxSf2x3,1.21233,0,miopenConvolutionFwdAlgoWinograd,<unused>
1024-17-17-1x1-128-17-17-64-0x0-1x1-1x1-0-NCHW-FP32-F=miopenConvolutionFwdAlgoDirect:ConvAsm1x1U,0.637297,0,miopenConvolutionFwdAlgoDirect,<unused>;miopenConvolutionFwdAlgoGEMM:GemmFwd1x1_0_1,2.82327,0,MIOpenGEMM,0_0_289_1024_289_289_128_1024
96-17-17-3x3-96-35-35-128-0x0-2x2-1x1-0-NCHW-FP32-W=miopenConvolutionBwdWeightsAlgoGEMM:gemm,3.58772,998784,MIOpenGEMM,1_0_289_289_864_864_96_289;miopenConvolutionBwdWeightsAlgoDirect:ConvOclBwdWrW2NonTunable,5.86773,42467328,miopenConvolutionBwdWeightsAlgoDirect,<unused>
224-35-35-3x3-192-35-35-64-1x1-1x1-1x1-0-NCHW-FP32-W=miopenConvolutionBwdWeightsAlgoWinograd:ConvBinWinogradRxS,6.22737,0,miopenConvolutionBwdWeightsAlgoWinograd,224x35x35x3x3x192x35x35x64xNCHWxFP32x1x1x1x1x1x1x1x0;miopenConvolutionBwdWeightsAlgoDirect:ConvAsmBwdWrW3x3,6.81404,0,miopenConvolutionBwdWeightsAlgoDirect,<unused>;miopenConvolutionBwdWeightsAlgoImplicitGEMM:ConvHipImplicitGemmV4R1WrW,14.9023,0,miopenConvolutionBwdWeightsAlgoImplicitGEMM,224x35x35x3x3x192x35x35x64xNCHWxFP32x1x1x1x1x1x1x1x0;miopenConvolutionBwdWeightsAlgoGEMM:gemm,73.5704,8467200,MIOpenGEMM,1_0_1225_1225_1728_1728_224_1225
256-17-17-1x1-1024-17-17-64-0x0-1x1-1x1-0-NCHW-FP32-W=miopenConvolutionBwdWeightsAlgoDirect:ConvAsmBwdWrW1x1,1.3937,0,miopenConvolutionBwdWeightsAlgoDirect,<unused>;miopenConvolutionBwdWeightsAlgoWinograd:ConvBinWinogradRxSf2x3,4.36228,0,miopenConvolutionBwdWeightsAlgoWinograd,256x17x17x1x1x1024x17x17x64xNCHWxFP32x0x0x1x1x1x1x1x0
64-73-73-1x1-80-73-73-128-0x0-1x1-1x1-0-NCHW-FP32-F=miopenConvolutionFwdAlgoDirect:ConvOclDirectFwd1x1,1.03361,0,miopenConvolutionFwdAlgoDirect,<unused>
64-73-73-1x1-160-73-73-64-0x0-1x1-1x1-0-NCHW-FP32-B=miopenConvolutionBwdDataAlgoDirect:ConvAsm1x1U,1.26635,0,miopenConvolutionBwdDataAlgoDirect,<unused>;miopenConvolutionBwdDataAlgoWinograd:ConvBinWinogradRxSf3x2,1.871,0,miopenConvolutionBwdDataAlgoWinograd,<unused>
32-149-149-3x3-3-299-299-64-0x0-2x2-1x1-0-NCHW-FP32-B=miopenConvolutionBwdDataAlgoDirect:ConvOclDirectFwd,1.5853,0,miopenConvolutionBwdDataAlgoDirect,<unused>;miopenConvolutionBwdDataAlgoWinograd:ConvBinWinogradRxS,2.88593,0,miopenConvolutionBwdDataAlgoWinograd,<unused>;miopenConvolutionBwdDataAlgoGEMM:gemm,6.63411,2397708,MIOpenGEMM,0_1_22201_27_22201_22201_27_32
224-35-35-3x3-192-35-35-64-1x1-1x1-1x1-0-NCHW-FP32-B=miopenConvolutionBwdDataAlgoWinograd:ConvBinWinogradRxS,2.58446,0,miopenConvolutionBwdDataAlgoWinograd,<unused>
224-35-35-3x3-256-17-17-64-0x0-2x2-1x1-0-NCHW-FP32-F=miopenConvolutionFwdAlgoWinograd:ConvBinWinogradRxSf2x3,4.0665,0,miopenConvolutionFwdAlgoWinograd,<unused>;miopenConvolutionFwdAlgoGEMM:GemmFwdRest,7.93469,2330496,MIOpenGEMM,0_0_289_2016_289_289_256_2016;miopenConvolutionFwdAlgoDirect:ConvOclDirectFwd,18.8476,0,miopenConvolutionFwdAlgoDirect,<unused>
192-35-35-3x3-224-35-35-64-1x1-1x1-1x1-0-NCHW-FP32-F=miopenConvolutionFwdAlgoWinograd:ConvBinWinogradRxS,2.53875,0,miopenConvolutionFwdAlgoWinograd,<unused>
320-8-8-3x3-320-17-17-64-0x0-2x2-1x1-0-NCHW-FP32-W=miopenConvolutionBwdWeightsAlgoImplicitGEMM:ConvHipImplicitGemmV4R1WrW,1.286,0,miopenConvolutionBwdWeightsAlgoImplicitGEMM,320x8x8x3x3x320x17x17x64xNCHWxFP32x0x0x2x2x1x1x1x0;miopenConvolutionBwdWeightsAlgoGEMM:gemm,2.75907,737280,MIOpenGEMM,1_0_64_64_2880_2880_320_64;miopenConvolutionBwdWeightsAlgoDirect:ConvOclBwdWrW2NonTunable,18.7212,235929600,miopenConvolutionBwdWeightsAlgoDirect,<unused>
256-17-17-1x1-1024-17-17-64-0x0-1x1-1x1-0-NCHW-FP32-B=miopenConvolutionBwdDataAlgoDirect:ConvAsm1x1U,1.32496,0,miopenConvolutionBwdDataAlgoDirect,<unused>;miopenConvolutionBwdDataAlgoGEMM:gemm,2.62808,0,MIOpenGEMM,0_1_289_1024_289_289_1024_256
3-299-299-3x3-32-149-149-64-0x0-2x2-1x1-0-NCHW-FP32-F=miopenConvolutionFwdAlgoWinograd:ConvBinWinogradRxSf2x3,1.08447,0,miopenConvolutionFwdAlgoWinograd,<unused>;miopenConvolutionFwdAlgoDirect:ConvOclDirectFwd,1.71812,0,miopenConvolutionFwdAlgoDirect,<unused>;miopenConvolutionFwdAlgoGEMM:GemmFwdRest,2.96496,2397708,MIOpenGEMM,0_0_22201_27_22201_22201_32_27
160-73-73-1x1-64-73-73-64-0x0-1x1-1x1-0-NCHW-FP32-F=miopenConvolutionFwdAlgoDirect:ConvOclDirectFwd1x1,0.825722,0,miopenConvolutionFwdAlgoDirect,<unused>;miopenConvolutionFwdAlgoWinograd:ConvBinWinogradRxSf3x2,1.63702,0,miopenConvolutionFwdAlgoWinograd,<unused>;miopenConvolutionFwdAlgoGEMM:GemmFwd1x1_0_1,2.13848,0,MIOpenGEMM,0_0_5329_160_5329_5329_64_160
96-35-35-3x3-64-35-35-128-1x1-1x1-1x1-0-NCHW-FP32-W=miopenConvolutionBwdWeightsAlgoDirect:ConvAsmBwdWrW3x3,2.2185,0,miopenConvolutionBwdWeightsAlgoDirect,<unused>;miopenConvolutionBwdWeightsAlgoWinograd:ConvBinWinogradRxSf2x3,3.90518,0,miopenConvolutionBwdWeightsAlgoWinograd,96x35x35x3x3x64x35x35x128xNCHWxFP32x1x1x1x1x1x1x1x0;miopenConvolutionBwdWeightsAlgoGEMM:gemm,10.7405,2822400,MIOpenGEMM,1_0_1225_1225_576_576_96_1225;miopenConvolutionBwdWeightsAlgoImplicitGEMM:ConvHipImplicitGemmV4R1WrW,18.5854,0,miopenConvolutionBwdWeightsAlgoImplicitGEMM,96x35x35x3x3x64x35x35x128xNCHWxFP32x1x1x1x1x1x1x1x0
256-17-17-1x7-224-17-17-64-0x3-1x1-1x1-0-NCHW-FP32-W=miopenConvolutionBwdWeightsAlgoWinograd:ConvBinWinogradRxSf2x3,2.25398,0,miopenConvolutionBwdWeightsAlgoWinograd,256x17x17x7x1x224x17x17x64xNCHWxFP32x3x0x1x1x1x1x1x0;miopenConvolutionBwdWeightsAlgoDirect:ConvOclBwdWrW53,2.53404,0,miopenConvolutionBwdWeightsAlgoDirect,<unused>;miopenConvolutionBwdWeightsAlgoGEMM:gemm,6.63032,1812608,MIOpenGEMM,1_0_289_289_1568_1568_256_289
96-35-35-3x3-64-35-35-128-1x1-1x1-1x1-0-NCHW-FP32-B=miopenConvolutionBwdDataAlgoWinograd:ConvBinWinograd3x3U,0.910097,0,miopenConvolutionBwdDataAlgoWinograd,<unused>
320-8-8-3x3-320-17-17-64-0x0-2x2-1x1-0-NCHW-FP32-B=miopenConvolutionBwdDataAlgoImplicitGEMM:ConvHipImplicitGemmBwdDataV1R1,1.39689,0,miopenConvolutionBwdDataAlgoImplicitGEMM,320x8x8x3x3x320x17x17x64xNCHWxFP32x0x0x2x2x1x1x1x0;miopenConvolutionBwdDataAlgoWinograd:ConvBinWinogradRxSf2x3,2.08314,0,miopenConvolutionBwdDataAlgoWinograd,<unused>;miopenConvolutionBwdDataAlgoGEMM:gemm,4.8204,737280,MIOpenGEMM,0_1_64_2880_64_64_2880_320;miopenConvolutionBwdDataAlgoDirect:ConvOclDirectFwd,8.69422,0,miopenConvolutionBwdDataAlgoDirect,<unused>
1024-17-17-1x1-256-17-17-64-0x0-1x1-1x1-0-NCHW-FP32-F=miopenConvolutionFwdAlgoDirect:ConvAsm1x1U,1.11383,0,miopenConvolutionFwdAlgoDirect,<unused>;miopenConvolutionFwdAlgoWinograd:ConvBinWinogradRxSf3x2,1.97993,0,miopenConvolutionFwdAlgoWinograd,<unused>;miopenConvolutionFwdAlgoGEMM:GemmFwd1x1_0_1,4.11418,0,MIOpenGEMM,0_0_289_1024_289_289_256_1024
256-17-17-1x7-224-17-17-64-0x3-1x1-1x1-0-NCHW-FP32-B=miopenConvolutionBwdDataAlgoWinograd:ConvBinWinogradRxSf3x2,2.03655,0,miopenConvolutionBwdDataAlgoWinograd,<unused>;miopenConvolutionBwdDataAlgoImplicitGEMM:ConvHipImplicitGemmBwdDataV1R1,3.574,0,miopenConvolutionBwdDataAlgoImplicitGEMM,256x17x17x7x1x224x17x17x64xNCHWxFP32x3x0x1x1x1x1x1x0;miopenConvolutionBwdDataAlgoGEMM:gemm,10.5241,1812608,MIOpenGEMM,0_1_289_1568_289_289_1568_256
224-17-17-1x7-192-17-17-64-0x3-1x1-1x1-0-NCHW-FP32-W=miopenConvolutionBwdWeightsAlgoWinograd:ConvBinWinogradRxSf2x3,1.69498,0,miopenConvolutionBwdWeightsAlgoWinograd,224x17x17x7x1x192x17x17x64xNCHWxFP32x3x0x1x1x1x1x1x0;miopenConvolutionBwdWeightsAlgoDirect:ConvOclBwdWrW53,1.87118,0,miopenConvolutionBwdWeightsAlgoDirect,<unused>;miopenConvolutionBwdWeightsAlgoImplicitGEMM:ConvHipImplicitGemmV4R1WrW,3.35869,0,miopenConvolutionBwdWeightsAlgoImplicitGEMM,224x17x17x7x1x192x17x17x64xNCHWxFP32x3x0x1x1x1x1x1x0;miopenConvolutionBwdWeightsAlgoGEMM:gemm,4.67408,1553664,MIOpenGEMM,1_0_289_289_1344_1344_224_289
384-8-8-1x1-1536-8-8-64-0x0-1x1-1x1-0-NCHW-FP32-W=miopenConvolutionBwdWeightsAlgoDirect:ConvAsmBwdWrW1x1,0.89712,0,miopenConvolutionBwdWeightsAlgoDirect,<unused>;miopenConvolutionBwdWeightsAlgoWinograd:ConvBinWinogradRxSf2x3,1.59752,0,miopenConvolutionBwdWeightsAlgoWinograd,384x8x8x1x1x1536x8x8x64xNCHWxFP32x0x0x1x1x1x1x1x0;miopenConvolutionBwdWeightsAlgoGEMM:gemm,1.61012,0,MIOpenGEMM,1_0_64_64_1536_1536_384_64
320-17-17-1x7-256-17-17-64-0x3-1x1-1x1-0-NCHW-FP32-W=miopenConvolutionBwdWeightsAlgoDirect:ConvOclBwdWrW53,3.53698,0,miopenConvolutionBwdWeightsAlgoDirect,<unused>;miopenConvolutionBwdWeightsAlgoImplicitGEMM:ConvHipImplicitGemmV4R1WrW,3.85358,0,miopenConvolutionBwdWeightsAlgoImplicitGEMM,320x17x17x7x1x256x17x17x64xNCHWxFP32x3x0x1x1x1x1x1x0;miopenConvolutionBwdWeightsAlgoWinograd:ConvBinWinogradRxSf2x3,4.04187,0,miopenConvolutionBwdWeightsAlgoWinograd,320x17x17x7x1x256x17x17x64xNCHWxFP32x3x0x1x1x1x1x1x0;miopenConvolutionBwdWeightsAlgoGEMM:gemm,7.95581,2071552,MIOpenGEMM,1_0_289_289_1792_1792_320_289
320-17-17-3x3-320-8-8-64-0x0-2x2-1x1-0-NCHW-FP32-F=miopenConvolutionFwdAlgoWinograd:ConvBinWinogradRxS,1.31251,0,miopenConvolutionFwdAlgoWinograd,<unused>;miopenConvolutionFwdAlgoDirect:ConvOclDirectFwd,4.0807,0,miopenConvolutionFwdAlgoDirect,<unused>;miopenConvolutionFwdAlgoGEMM:GemmFwdRest,5.92392,737280,MIOpenGEMM,0_0_64_2880_64_64_320_2880
192-17-17-1x1-1024-17-17-64-0x0-1x1-1x1-0-NCHW-FP32-W=miopenConvolutionBwdWeightsAlgoDirect:ConvAsmBwdWrW1x1,0.965607,0,miopenConvolutionBwdWeightsAlgoDirect,<unused>
224-17-17-1x7-256-17-17-64-0x3-1x1-1x1-0-NCHW-FP32-F=miopenConvolutionFwdAlgoImplicitGEMM:ConvHipImplicitGemmV4R1Fwd,1.71683,0,miopenConvolutionFwdAlgoImplicitGEMM,224x17x17x7x1x256x17x17x64xNCHWxFP32x3x0x1x1x1x1x1x1;miopenConvolutionFwdAlgoWinograd:ConvBinWinogradRxSf3x2,1.79508,0,miopenConvolutionFwdAlgoWinograd,<unused>;miopenConvolutionFwdAlgoGEMM:GemmFwdRest,8.29737,1812608,MIOpenGEMM,0_0_289_1568_289_289_256_1568
192-17-17-1x7-224-17-17-64-0x3-1x1-1x1-0-NCHW-FP32-F=miopenConvolutionFwdAlgoImplicitGEMM:ConvHipImplicitGemmV4R1Fwd,1.52018,0,miopenConvolutionFwdAlgoImplicitGEMM,192x17x17x7x1x224x17x17x64xNCHWxFP32x3x0x1x1x1x1x1x1;miopenConvolutionFwdAlgoWinograd:ConvBinWinogradRxSf3x2,1.5428,0,miopenConvolutionFwdAlgoWinograd,<unused>;miopenConvolutionFwdAlgoGEMM:GemmFwdRest,9.73731,1553664,MIOpenGEMM,0_0_289_1344_289_289_224_1344
384-8-8-1x1-1536-8-8-64-0x0-1x1-1x1-0-NCHW-FP32-B=miopenConvolutionBwdDataAlgoDirect:ConvAsm1x1U,0.549256,0,miopenConvolutionBwdDataAlgoDirect,<unused>;miopenConvolutionBwdDataAlgoWinograd:ConvBinWinogradRxSf3x2,1.19954,0,miopenConvolutionBwdDataAlgoWinograd,<unused>;miopenConvolutionBwdDataAlgoGEMM:gemm,2.42284,0,MIOpenGEMM,0_1_64_1536_64_64_1536_384
384-35-35-1x1-96-35-35-64-0x0-1x1-1x1-0-NCHW-FP32-F=miopenConvolutionFwdAlgoDirect:ConvAsm1x1U,0.835059,0,miopenConvolutionFwdAlgoDirect,<unused>;miopenConvolutionFwdAlgoGEMM:GemmFwd1x1_0_1,2.597,0,MIOpenGEMM,0_0_1225_384_1225_1225_96_384
224-17-17-7x1-224-17-17-64-3x0-1x1-1x1-0-NCHW-FP32-W=miopenConvolutionBwdWeightsAlgoWinograd:ConvBinWinogradRxSf2x3,1.8821,0,miopenConvolutionBwdWeightsAlgoWinograd,224x17x17x1x7x224x17x17x64xNCHWxFP32x0x3x1x1x1x1x1x0;miopenConvolutionBwdWeightsAlgoDirect:ConvOclBwdWrW53,3.68213,0,miopenConvolutionBwdWeightsAlgoDirect,<unused>;miopenConvolutionBwdWeightsAlgoGEMM:gemm,4.7286,1812608,MIOpenGEMM,1_0_289_289_1568_1568_224_289
32-147-147-3x3-32-149-149-64-0x0-1x1-1x1-0-NCHW-FP32-W=miopenConvolutionBwdWeightsAlgoDirect:ConvOclBwdWrW53,10.3969,2359296,miopenConvolutionBwdWeightsAlgoDirect,<unused>;miopenConvolutionBwdWeightsAlgoGEMM:gemm,35.0704,24893568,MIOpenGEMM,1_0_21609_21609_288_288_32_21609;miopenConvolutionBwdWeightsAlgoWinograd:ConvBinWinogradRxSf2x3,36.8796,0,miopenConvolutionBwdWeightsAlgoWinograd,32x147x147x3x3x32x149x149x64xNCHWxFP32x0x0x1x1x1x1x1x0
448-8-8-1x1-1280-8-8-128-0x0-1x1-1x1-0-NCHW-FP32-W=miopenConvolutionBwdWeightsAlgoDirect:ConvAsmBwdWrW1x1,1.17488,0,miopenConvolutionBwdWeightsAlgoDirect,<unused>;miopenConvolutionBwdWeightsAlgoGEMM:gemm,2.54184,0,MIOpenGEMM,1_0_64_64_1280_1280_448_64;miopenConvolutionBwdWeightsAlgoWinograd:ConvBinWinogradRxSf2x3,4.22812,0,miopenConvolutionBwdWeightsAlgoWinograd,448x8x8x1x1x1280x8x8x128xNCHWxFP32x0x0x1x1x1x1x1x0
320-17-17-1x7-256-17-17-64-0x3-1x1-1x1-0-NCHW-FP32-B=miopenConvolutionBwdDataAlgoWinograd:ConvBinWinogradRxSf3x2,2.5255,0,miopenConvolutionBwdDataAlgoWinograd,<unused>;miopenConvolutionBwdDataAlgoImplicitGEMM:ConvHipImplicitGemmBwdDataV1R1,2.8431,0,miopenConvolutionBwdDataAlgoImplicitGEMM,320x17x17x7x1x256x17x17x64xNCHWxFP32x3x0x1x1x1x1x1x0;miopenConvolutionBwdDataAlgoGEMM:gemm,7.7056,2071552,MIOpenGEMM,0_1_289_1792_289_289_1792_320
192-17-17-1x1-1024-17-17-64-0x0-1x1-1x1-0-NCHW-FP32-B=miopenConvolutionBwdDataAlgoDirect:ConvAsm1x1U,1.07696,0,miopenConvolutionBwdDataAlgoDirect,<unused>;miopenConvolutionBwdDataAlgoGEMM:gemm,1.92729,0,MIOpenGEMM,0_1_289_1024_289_289_1024_192
224-17-17-7x1-192-17-17-64-3x0-1x1-1x1-0-NCHW-FP32-W=miopenConvolutionBwdWeightsAlgoWinograd:ConvBinWinogradRxSf2x3,1.37556,0,miopenConvolutionBwdWeightsAlgoWinograd,224x17x17x1x7x192x17x17x64xNCHWxFP32x0x3x1x1x1x1x1x0;miopenConvolutionBwdWeightsAlgoDirect:ConvOclBwdWrW53,2.89911,0,miopenConvolutionBwdWeightsAlgoDirect,<unused>;miopenConvolutionBwdWeightsAlgoImplicitGEMM:ConvHipImplicitGemmV4R1WrW,3.33637,0,miopenConvolutionBwdWeightsAlgoImplicitGEMM,224x17x17x1x7x192x17x17x64xNCHWxFP32x0x3x1x1x1x1x1x0;miopenConvolutionBwdWeightsAlgoGEMM:gemm,5.14511,1553664,MIOpenGEMM,1_0_289_289_1344_1344_224_289
1536-8-8-1x1-384-8-8-64-0x0-1x1-1x1-0-NCHW-FP32-F=miopenConvolutionFwdAlgoDirect:ConvAsm1x1U,0.800284,0,miopenConvolutionFwdAlgoDirect,<unused>;miopenConvolutionFwdAlgoWinograd:ConvBinWinogradRxSf3x2,1.40904,0,miopenConvolutionFwdAlgoWinograd,<unused>;miopenConvolutionFwdAlgoGEMM:GemmFwd1x1_0_1,2.65773,0,MIOpenGEMM,0_0_64_1536_64_64_384_1536
224-17-17-7x1-224-17-17-64-3x0-1x1-1x1-0-NCHW-FP32-B=miopenConvolutionBwdDataAlgoWinograd:ConvBinWinogradRxSf3x2,1.5582,0,miopenConvolutionBwdDataAlgoWinograd,<unused>;miopenConvolutionBwdDataAlgoImplicitGEMM:ConvHipImplicitGemmBwdDataV1R1,3.06399,0,miopenConvolutionBwdDataAlgoImplicitGEMM,224x17x17x1x7x224x17x17x64xNCHWxFP32x0x3x1x1x1x1x1x0;miopenConvolutionBwdDataAlgoGEMM:gemm,4.41472,1812608,MIOpenGEMM,0_1_289_1568_289_289_1568_224
32-147-147-3x3-32-149-149-64-0x0-1x1-1x1-0-NCHW-FP32-B=miopenConvolutionBwdDataAlgoWinograd:ConvBinWinogradRxSf2x3,1.47271,0,miopenConvolutionBwdDataAlgoWinograd,<unused>;miopenConvolutionBwdDataAlgoDirect:ConvOclDirectFwd,7.1877,0,miopenConvolutionBwdDataAlgoDirect,<unused>;miopenConvolutionBwdDataAlgoGEMM:gemm,24.3917,24893568,MIOpenGEMM,0_1_21609_288_21609_21609_288_32;miopenConvolutionBwdDataAlgoImplicitGEMM:ConvHipImplicitGemmBwdDataV1R1,25.4606,0,miopenConvolutionBwdDataAlgoImplicitGEMM,32x147x147x3x3x32x149x149x64xNCHWxFP32x0x0x1x1x1x1x1x0
448-8-8-3x1-384-8-8-64-1x0-1x1-1x1-0-NCHW-FP32-B=miopenConvolutionBwdDataAlgoWinograd:ConvBinWinogradRxSf2x3,0.525646,0,miopenConvolutionBwdDataAlgoWinograd,<unused>;miopenConvolutionBwdDataAlgoImplicitGEMM:ConvHipImplicitGemmBwdDataV1R1,0.897812,0,miopenConvolutionBwdDataAlgoImplicitGEMM,448x8x8x1x3x384x8x8x64xNCHWxFP32x0x1x1x1x1x1x1x0;miopenConvolutionBwdDataAlgoGEMM:gemm,2.93417,294912,MIOpenGEMM,0_1_64_1152_64_64_1152_448
224-17-17-7x1-192-17-17-64-3x0-1x1-1x1-0-NCHW-FP32-B=miopenConvolutionBwdDataAlgoWinograd:ConvBinWinogradRxSf3x2,1.36536,0,miopenConvolutionBwdDataAlgoWinograd,<unused>;miopenConvolutionBwdDataAlgoImplicitGEMM:ConvHipImplicitGemmBwdDataV1R1,3.57512,0,miopenConvolutionBwdDataAlgoImplicitGEMM,224x17x17x1x7x192x17x17x64xNCHWxFP32x0x3x1x1x1x1x1x0;miopenConvolutionBwdDataAlgoGEMM:gemm,5.52862,1553664,MIOpenGEMM,0_1_289_1344_289_289_1344_224
256-17-17-1x7-320-17-17-64-0x3-1x1-1x1-0-NCHW-FP32-F=miopenConvolutionFwdAlgoImplicitGEMM:ConvHipImplicitGemmV4R1Fwd,1.95546,0,miopenConvolutionFwdAlgoImplicitGEMM,256x17x17x7x1x320x17x17x64xNCHWxFP32x3x0x1x1x1x1x1x1;miopenConvolutionFwdAlgoWinograd:ConvBinWinogradRxSf3x2,2.37121,0,miopenConvolutionFwdAlgoWinograd,<unused>;miopenConvolutionFwdAlgoGEMM:GemmFwdRest,6.16192,2071552,MIOpenGEMM,0_0_289_1792_289_289_320_1792
64-35-35-1x1-384-35-35-64-0x0-1x1-1x1-0-NCHW-FP32-W=miopenConvolutionBwdWeightsAlgoDirect:ConvAsmBwdWrW1x1,0.871259,0,miopenConvolutionBwdWeightsAlgoDirect,<unused>
64-73-73-1x7-64-73-73-64-0x3-1x1-1x1-0-NCHW-FP32-F=miopenConvolutionFwdAlgoImplicitGEMM:ConvHipImplicitGemmV4R1Fwd,2.29822,0,miopenConvolutionFwdAlgoImplicitGEMM,64x73x73x7x1x64x73x73x64xNCHWxFP32x3x0x1x1x1x1x1x1;miopenConvolutionFwdAlgoWinograd:ConvBinWinogradRxSf3x2,2.51508,0,miopenConvolutionFwdAlgoWinograd,<unused>;miopenConvolutionFwdAlgoGEMM:GemmFwdRest,7.74794,9549568,MIOpenGEMM,0_0_5329_448_5329_5329_64_448
224-17-17-7x1-224-17-17-64-3x0-1x1-1x1-0-NCHW-FP32-F=miopenConvolutionFwdAlgoImplicitGEMM:ConvHipImplicitGemmV4R1Fwd,1.48972,0,miopenConvolutionFwdAlgoImplicitGEMM,224x17x17x1x7x224x17x17x64xNCHWxFP32x0x3x1x1x1x1x1x1;miopenConvolutionFwdAlgoWinograd:ConvBinWinogradRxSf3x2,1.58218,0,miopenConvolutionFwdAlgoWinograd,<unused>;miopenConvolutionFwdAlgoGEMM:GemmFwdRest,6.70102,1812608,MIOpenGEMM,0_0_289_1568_289_289_224_1568
256-8-8-1x3-512-8-8-64-0x1-1x1-1x1-0-NCHW-FP32-W=miopenConvolutionBwdWeightsAlgoDirect:ConvOclBwdWrW53,0.547349,0,miopenConvolutionBwdWeightsAlgoDirect,<unused>;miopenConvolutionBwdWeightsAlgoWinograd:ConvBinWinogradRxS,0.745532,0,miopenConvolutionBwdWeightsAlgoWinograd,256x8x8x3x1x512x8x8x64xNCHWxFP32x1x0x1x1x1x1x1x0;miopenConvolutionBwdWeightsAlgoImplicitGEMM:ConvHipImplicitGemmV4R1WrW,1.10944,0,miopenConvolutionBwdWeightsAlgoImplicitGEMM,256x8x8x3x1x512x8x8x64xNCHWxFP32x1x0x1x1x1x1x1x0;miopenConvolutionBwdWeightsAlgoGEMM:gemm,4.70656,393216,MIOpenGEMM,1_0_64_64_1536_1536_256_64
384-8-8-3x1-448-8-8-64-1x0-1x1-1x1-0-NCHW-FP32-F=miopenConvolutionFwdAlgoWinograd:ConvBinWinogradRxSf2x3,0.554808,0,miopenConvolutionFwdAlgoWinograd,<unused>;miopenConvolutionFwdAlgoImplicitGEMM:ConvHipImplicitGemmV4R1Fwd,0.725192,0,miopenConvolutionFwdAlgoImplicitGEMM,384x8x8x1x3x448x8x8x64xNCHWxFP32x0x1x1x1x1x1x1x1;miopenConvolutionFwdAlgoGEMM:GemmFwdRest,5.7483,294912,MIOpenGEMM,0_0_64_1152_64_64_448_1152
32-149-149-3x3-32-147-147-64-0x0-1x1-1x1-0-NCHW-FP32-F=miopenConvolutionFwdAlgoWinograd:ConvBinWinogradRxS,1.48693,0,miopenConvolutionFwdAlgoWinograd,<unused>;miopenConvolutionFwdAlgoDirect:ConvOclDirectFwd,6.32888,0,miopenConvolutionFwdAlgoDirect,<unused>;miopenConvolutionFwdAlgoGEMM:GemmFwdRest,7.90315,24893568,MIOpenGEMM,0_0_21609_288_21609_21609_32_288
192-17-17-7x1-224-17-17-64-3x0-1x1-1x1-0-NCHW-FP32-F=miopenConvolutionFwdAlgoWinograd:ConvBinWinogradRxSf3x2,1.39653,0,miopenConvolutionFwdAlgoWinograd,<unused>;miopenConvolutionFwdAlgoImplicitGEMM:ConvHipImplicitGemmV4R1Fwd,1.46732,0,miopenConvolutionFwdAlgoImplicitGEMM,192x17x17x1x7x224x17x17x64xNCHWxFP32x0x3x1x1x1x1x1x1;miopenConvolutionFwdAlgoGEMM:GemmFwdRest,5.43586,1553664,MIOpenGEMM,0_0_289_1344_289_289_224_1344
256-17-17-7x1-256-17-17-64-3x0-1x1-1x1-0-NCHW-FP32-W=miopenConvolutionBwdWeightsAlgoWinograd:ConvBinWinogradRxSf2x3,2.37582,0,miopenConvolutionBwdWeightsAlgoWinograd,256x17x17x1x7x256x17x17x64xNCHWxFP32x0x3x1x1x1x1x1x0;miopenConvolutionBwdWeightsAlgoImplicitGEMM:ConvHipImplicitGemmV4R1WrW,3.04858,0,miopenConvolutionBwdWeightsAlgoImplicitGEMM,256x17x17x1x7x256x17x17x64xNCHWxFP32x0x3x1x1x1x1x1x0;miopenConvolutionBwdWeightsAlgoDirect:ConvOclBwdWrW53,4.9832,0,miopenConvolutionBwdWeightsAlgoDirect,<unused>;miopenConvolutionBwdWeightsAlgoGEMM:gemm,5.18176,2071552,MIOpenGEMM,1_0_289_289_1792_1792_256_289
64-35-35-1x1-384-35-35-64-0x0-1x1-1x1-0-NCHW-FP32-B=miopenConvolutionBwdDataAlgoDirect:ConvAsm1x1U,0.676394,0,miopenConvolutionBwdDataAlgoDirect,<unused>;miopenConvolutionBwdDataAlgoGEMM:gemm,4.36392,0,MIOpenGEMM,0_1_1225_384_1225_1225_384_64
192-35-35-3x3-192-71-71-64-0x0-2x2-1x1-0-NCHW-FP32-W=miopenConvolutionBwdWeightsAlgoImplicitGEMM:ConvHipImplicitGemmV4R1WrW,11.1586,0,miopenConvolutionBwdWeightsAlgoImplicitGEMM,192x35x35x3x3x192x71x71x64xNCHWxFP32x0x0x2x2x1x1x1x0;miopenConvolutionBwdWeightsAlgoGEMM:gemm,13.1445,8467200,MIOpenGEMM,1_0_1225_1225_1728_1728_192_1225;miopenConvolutionBwdWeightsAlgoDirect:ConvOclBwdWrW2NonTunable,33.6171,84934656,miopenConvolutionBwdWeightsAlgoDirect,<unused>
256-8-8-1x3-512-8-8-64-0x1-1x1-1x1-0-NCHW-FP32-B=miopenConvolutionBwdDataAlgoWinograd:ConvBinWinogradRxSf2x3,0.420263,0,miopenConvolutionBwdDataAlgoWinograd,<unused>;miopenConvolutionBwdDataAlgoImplicitGEMM:ConvHipImplicitGemmBwdDataV1R1,2.47765,0,miopenConvolutionBwdDataAlgoImplicitGEMM,256x8x8x3x1x512x8x8x64xNCHWxFP32x1x0x1x1x1x1x1x0;miopenConvolutionBwdDataAlgoGEMM:gemm,5.41728,393216,MIOpenGEMM,0_1_64_1536_64_64_1536_256
192-8-8-3x3-192-17-17-64-0x0-2x2-1x1-0-NCHW-FP32-W=miopenConvolutionBwdWeightsAlgoImplicitGEMM:ConvHipImplicitGemmV4R1WrW,0.713857,0,miopenConvolutionBwdWeightsAlgoImplicitGEMM,192x8x8x3x3x192x17x17x64xNCHWxFP32x0x0x2x2x1x1x1x0;miopenConvolutionBwdWeightsAlgoGEMM:gemm,2.51333,442368,MIOpenGEMM,1_0_64_64_1728_1728_192_64;miopenConvolutionBwdWeightsAlgoDirect:ConvOclBwdWrW2NonTunable,7.00746,84934656,miopenConvolutionBwdWeightsAlgoDirect,<unused>
128-17-17-7x1-128-17-17-128-3x0-1x1-1x1-0-NCHW-FP32-W=miopenConvolutionBwdWeightsAlgoWinograd:ConvBinWinogradRxSf2x3,1.9042,0,miopenConvolutionBwdWeightsAlgoWinograd,128x17x17x1x7x128x17x17x128xNCHWxFP32x0x3x1x1x1x1x1x0;miopenConvolutionBwdWeightsAlgoDirect:ConvOclBwdWrW53,3.83149,0,miopenConvolutionBwdWeightsAlgoDirect,<unused>;miopenConvolutionBwdWeightsAlgoImplicitGEMM:ConvHipImplicitGemmV4R1WrW,4.27791,0,miopenConvolutionBwdWeightsAlgoImplicitGEMM,128x17x17x1x7x128x17x17x128xNCHWxFP32x0x3x1x1x1x1x1x0;miopenConvolutionBwdWeightsAlgoGEMM:gemm,4.60024,1035776,MIOpenGEMM,1_0_289_289_896_896_128_289
256-8-8-1x3-384-8-8-64-0x1-1x1-1x1-0-NCHW-FP32-W=miopenConvolutionBwdWeightsAlgoDirect:ConvOclBwdWrW53,0.324144,0,miopenConvolutionBwdWeightsAlgoDirect,<unused>;miopenConvolutionBwdWeightsAlgoWinograd:ConvBinWinogradRxSf2x3,0.674387,0,miopenConvolutionBwdWeightsAlgoWinograd,256x8x8x3x1x384x8x8x64xNCHWxFP32x1x0x1x1x1x1x1x0;miopenConvolutionBwdWeightsAlgoImplicitGEMM:ConvHipImplicitGemmV4R1WrW,0.690039,0,miopenConvolutionBwdWeightsAlgoImplicitGEMM,256x8x8x3x1x384x8x8x64xNCHWxFP32x1x0x1x1x1x1x1x0;miopenConvolutionBwdWeightsAlgoGEMM:gemm,2.3864,294912,MIOpenGEMM,1_0_64_64_1152_1152_256_64
256-17-17-7x1-256-17-17-64-3x0-1x1-1x1-0-NCHW-FP32-B=miopenConvolutionBwdDataAlgoWinograd:ConvBinWinogradRxSf3x2,2.02295,0,miopenConvolutionBwdDataAlgoWinograd,<unused>;miopenConvolutionBwdDataAlgoImplicitGEMM:ConvHipImplicitGemmBwdDataV1R1,2.7751,0,miopenConvolutionBwdDataAlgoImplicitGEMM,256x17x17x1x7x256x17x17x64xNCHWxFP32x0x3x1x1x1x1x1x0;miopenConvolutionBwdDataAlgoGEMM:gemm,6.30075,2071552,MIOpenGEMM,0_1_289_1792_289_289_1792_256
64-73-73-7x1-64-73-73-64-3x0-1x1-1x1-0-NCHW-FP32-W=miopenConvolutionBwdWeightsAlgoGEMM:gemm,7.54592,9549568,MIOpenGEMM,1_0_5329_5329_448_448_64_5329;miopenConvolutionBwdWeightsAlgoWinograd:ConvBinWinogradRxSf2x3,8.1418,0,miopenConvolutionBwdWeightsAlgoWinograd,64x73x73x1x7x64x73x73x64xNCHWxFP32x0x3x1x1x1x1x1x0;miopenConvolutionBwdWeightsAlgoDirect:ConvOclBwdWrW53,30.4384,7340032,miopenConvolutionBwdWeightsAlgoDirect,<unused>;miopenConvolutionBwdWeightsAlgoImplicitGEMM:ConvHipImplicitGemmV4R1WrW,33.7587,0,miopenConvolutionBwdWeightsAlgoImplicitGEMM,64x73x73x1x7x64x73x73x64xNCHWxFP32x0x3x1x1x1x1x1x0
96-71-71-3x3-64-73-73-64-0x0-1x1-1x1-0-NCHW-FP32-W=miopenConvolutionBwdWeightsAlgoWinograd:ConvBinWinogradRxSf2x3,8.35053,0,miopenConvolutionBwdWeightsAlgoWinograd,96x71x71x3x3x64x73x73x64xNCHWxFP32x0x0x1x1x1x1x1x0
64-147-147-3x3-32-147-147-64-1x1-1x1-1x1-0-NCHW-FP32-W=miopenConvolutionBwdWeightsAlgoDirect:ConvAsmBwdWrW3x3,5.41035,0,miopenConvolutionBwdWeightsAlgoDirect,<unused>;miopenConvolutionBwdWeightsAlgoWinograd:ConvBinWinogradRxSf2x3,43.1537,0,miopenConvolutionBwdWeightsAlgoWinograd,64x147x147x3x3x32x147x147x64xNCHWxFP32x1x1x1x1x1x1x1x0;miopenConvolutionBwdWeightsAlgoGEMM:gemm,79.7769,24893568,MIOpenGEMM,1_0_21609_21609_288_288_64_21609
384-35-35-1x1-64-35-35-64-0x0-1x1-1x1-0-NCHW-FP32-F=miopenConvolutionFwdAlgoDirect:ConvOclDirectFwd1x1,0.462238,0,miopenConvolutionFwdAlgoDirect,<unused>;miopenConvolutionFwdAlgoGEMM:GemmFwd1x1_0_1,2.51291,0,MIOpenGEMM,0_0_1225_384_1225_1225_64_384
192-35-35-3x3-192-71-71-64-0x0-2x2-1x1-0-NCHW-FP32-B=miopenConvolutionBwdDataAlgoWinograd:ConvBinWinogradRxS,9.34872,0,miopenConvolutionBwdDataAlgoWinograd,<unused>;miopenConvolutionBwdDataAlgoImplicitGEMM:ConvHipImplicitGemmBwdDataV1R1,11.1636,0,miopenConvolutionBwdDataAlgoImplicitGEMM,192x35x35x3x3x192x71x71x64xNCHWxFP32x0x0x2x2x1x1x1x0;miopenConvolutionBwdDataAlgoGEMM:gemm,19.983,8467200,MIOpenGEMM,0_1_1225_1728_1225_1225_1728_192;miopenConvolutionBwdDataAlgoDirect:ConvOclDirectFwd,20.0841,0,miopenConvolutionBwdDataAlgoDirect,<unused>
192-8-8-3x3-192-17-17-64-0x0-2x2-1x1-0-NCHW-FP32-B=miopenConvolutionBwdDataAlgoWinograd:ConvBinWinogradRxS,0.816738,0,miopenConvolutionBwdDataAlgoWinograd,<unused>;miopenConvolutionBwdDataAlgoImplicitGEMM:ConvHipImplicitGemmBwdDataV1R1,1.11082,0,miopenConvolutionBwdDataAlgoImplicitGEMM,192x8x8x3x3x192x17x17x64xNCHWxFP32x0x0x2x2x1x1x1x0;miopenConvolutionBwdDataAlgoDirect:ConvOclDirectFwd,3.37235,0,miopenConvolutionBwdDataAlgoDirect,<unused>;miopenConvolutionBwdDataAlgoGEMM:gemm,4.42415,442368,MIOpenGEMM,0_1_64_1728_64_64_1728_192
512-8-8-1x3-256-8-8-64-0x1-1x1-1x1-0-NCHW-FP32-F=miopenConvolutionFwdAlgoWinograd:ConvBinWinogradRxSf2x3,0.418088,0,miopenConvolutionFwdAlgoWinograd,<unused>;miopenConvolutionFwdAlgoImplicitGEMM:ConvHipImplicitGemmV4R1Fwd,0.624631,0,miopenConvolutionFwdAlgoImplicitGEMM,512x8x8x3x1x256x8x8x64xNCHWxFP32x1x0x1x1x1x1x1x1;miopenConvolutionFwdAlgoGEMM:GemmFwdRest,6.99123,393216,MIOpenGEMM,0_0_64_1536_64_64_256_1536
64-147-147-3x3-32-147-147-64-1x1-1x1-1x1-0-NCHW-FP32-B=miopenConvolutionBwdDataAlgoWinograd:ConvBinWinogradRxS,2.28348,0,miopenConvolutionBwdDataAlgoWinograd,<unused>
256-8-8-1x3-384-8-8-64-0x1-1x1-1x1-0-NCHW-FP32-B=miopenConvolutionBwdDataAlgoWinograd:ConvBinWinogradRxSf2x3,0.342951,0,miopenConvolutionBwdDataAlgoWinograd,<unused>;miopenConvolutionBwdDataAlgoImplicitGEMM:ConvHipImplicitGemmBwdDataV1R1,0.496383,0,miopenConvolutionBwdDataAlgoImplicitGEMM,256x8x8x3x1x384x8x8x64xNCHWxFP32x1x0x1x1x1x1x1x0;miopenConvolutionBwdDataAlgoGEMM:gemm,3.90206,294912,MIOpenGEMM,0_1_64_1152_64_64_1152_256
256-17-17-7x1-256-17-17-64-3x0-1x1-1x1-0-NCHW-FP32-F=miopenConvolutionFwdAlgoImplicitGEMM:ConvHipImplicitGemmV4R1Fwd,1.9502,0,miopenConvolutionFwdAlgoImplicitGEMM,256x17x17x1x7x256x17x17x64xNCHWxFP32x0x3x1x1x1x1x1x1;miopenConvolutionFwdAlgoWinograd:ConvBinWinogradRxSf3x2,1.97818,0,miopenConvolutionFwdAlgoWinograd,<unused>;miopenConvolutionFwdAlgoGEMM:GemmFwdRest,8.79405,2071552,MIOpenGEMM,0_0_289_1792_289_289_256_1792
64-73-73-7x1-64-73-73-64-3x0-1x1-1x1-0-NCHW-FP32-B=miopenConvolutionBwdDataAlgoWinograd:ConvBinWinogradRxSf3x2,2.2933,0,miopenConvolutionBwdDataAlgoWinograd,<unused>;miopenConvolutionBwdDataAlgoImplicitGEMM:ConvHipImplicitGemmBwdDataV1R1,11.2811,0,miopenConvolutionBwdDataAlgoImplicitGEMM,64x73x73x1x7x64x73x73x64xNCHWxFP32x0x3x1x1x1x1x1x0;miopenConvolutionBwdDataAlgoGEMM:gemm,11.8313,9549568,MIOpenGEMM,0_1_5329_448_5329_5329_448_64
32-147-147-3x3-64-147-147-64-1x1-1x1-1x1-0-NCHW-FP32-F=miopenConvolutionFwdAlgoWinograd:ConvBinWinogradRxSf2x3,2.67378,0,miopenConvolutionFwdAlgoWinograd,<unused>
384-17-17-3x3-384-35-35-64-0x0-2x2-1x1-0-NCHW-FP32-W=miopenConvolutionBwdWeightsAlgoImplicitGEMM:ConvHipImplicitGemmV4R1WrW,5.96303,0,miopenConvolutionBwdWeightsAlgoImplicitGEMM,384x17x17x3x3x384x35x35x64xNCHWxFP32x0x0x2x2x1x1x1x0;miopenConvolutionBwdWeightsAlgoGEMM:gemm,14.632,3995136,MIOpenGEMM,1_0_289_289_3456_3456_384_289;miopenConvolutionBwdWeightsAlgoDirect:ConvOclBwdWrW2NonTunable,47.359,339738624,miopenConvolutionBwdWeightsAlgoDirect,<unused>
256-17-17-3x3-224-35-35-64-0x0-2x2-1x1-0-NCHW-FP32-W=miopenConvolutionBwdWeightsAlgoDirect:ConvOclBwdWrW2NonTunable,20.4418,132120576,miopenConvolutionBwdWeightsAlgoDirect,<unused>;miopenConvolutionBwdWeightsAlgoGEMM:gemm,41.6402,2330496,MIOpenGEMM,1_0_289_289_2016_2016_256_289
32-149-149-3x3-3-299-299-64-0x0-2x2-1x1-0-NCHW-FP32-W=miopenConvolutionBwdWeightsAlgoDirect:ConvOclBwdWrW2NonTunable,3.00565,221184,miopenConvolutionBwdWeightsAlgoDirect,<unused>;miopenConvolutionBwdWeightsAlgoGEMM:gemm,4.50513,2397708,MIOpenGEMM,1_0_22201_22201_27_27_32_22201
256-8-8-3x1-512-8-8-64-1x0-1x1-1x1-0-NCHW-FP32-W=miopenConvolutionBwdWeightsAlgoDirect:ConvOclBwdWrW53,0.533537,0,miopenConvolutionBwdWeightsAlgoDirect,<unused>;miopenConvolutionBwdWeightsAlgoWinograd:ConvBinWinogradRxS,0.560428,0,miopenConvolutionBwdWeightsAlgoWinograd,256x8x8x1x3x512x8x8x64xNCHWxFP32x0x1x1x1x1x1x1x0;miopenConvolutionBwdWeightsAlgoImplicitGEMM:ConvHipImplicitGemmV4R1WrW,0.677609,0,miopenConvolutionBwdWeightsAlgoImplicitGEMM,256x8x8x1x3x512x8x8x64xNCHWxFP32x0x1x1x1x1x1x1x0;miopenConvolutionBwdWeightsAlgoGEMM:gemm,1.86478,393216,MIOpenGEMM,1_0_64_64_1536_1536_256_64
64-73-73-1x7-64-73-73-64-0x3-1x1-1x1-0-NCHW-FP32-B=miopenConvolutionBwdDataAlgoWinograd:ConvBinWinogradRxSf3x2,2.39713,0,miopenConvolutionBwdDataAlgoWinograd,<unused>;miopenConvolutionBwdDataAlgoGEMM:gemm,8.44012,9549568,MIOpenGEMM,0_1_5329_448_5329_5329_448_64;miopenConvolutionBwdDataAlgoImplicitGEMM:ConvHipImplicitGemmBwdDataV1R1,8.50131,0,miopenConvolutionBwdDataAlgoImplicitGEMM,64x73x73x7x1x64x73x73x64xNCHWxFP32x3x0x1x1x1x1x1x0
384-8-8-1x3-256-8-8-64-0x1-1x1-1x1-0-NCHW-FP32-F=miopenConvolutionFwdAlgoWinograd:ConvBinWinogradRxSf2x3,0.31596,0,miopenConvolutionFwdAlgoWinograd,<unused>;miopenConvolutionFwdAlgoImplicitGEMM:ConvHipImplicitGemmV4R1Fwd,0.865342,0,miopenConvolutionFwdAlgoImplicitGEMM,384x8x8x3x1x256x8x8x64xNCHWxFP32x1x0x1x1x1x1x1x1;miopenConvolutionFwdAlgoGEMM:GemmFwdRest,22.2784,294912,MIOpenGEMM,0_0_64_1152_64_64_256_1152
192-71-71-3x3-192-35-35-64-0x0-2x2-1x1-0-NCHW-FP32-F=miopenConvolutionFwdAlgoWinograd:ConvBinWinogradRxS,9.18243,0,miopenConvolutionFwdAlgoWinograd,<unused>;miopenConvolutionFwdAlgoGEMM:GemmFwdRest,11.768,8467200,MIOpenGEMM,0_0_1225_1728_1225_1225_192_1728;miopenConvolutionFwdAlgoDirect:ConvOclDirectFwd,48.1707,0,miopenConvolutionFwdAlgoDirect,<unused>
64-73-73-7x1-64-73-73-64-3x0-1x1-1x1-0-NCHW-FP32-F=miopenConvolutionFwdAlgoImplicitGEMM:ConvHipImplicitGemmV4R1Fwd,2.22172,0,miopenConvolutionFwdAlgoImplicitGEMM,64x73x73x1x7x64x73x73x64xNCHWxFP32x0x3x1x1x1x1x1x1;miopenConvolutionFwdAlgoWinograd:ConvBinWinogradRxSf3x2,2.31499,0,miopenConvolutionFwdAlgoWinograd,<unused>;miopenConvolutionFwdAlgoGEMM:GemmFwdRest,14.5873,9549568,MIOpenGEMM,0_0_5329_448_5329_5329_64_448
96-35-35-3x3-96-35-35-64-1x1-1x1-1x1-0-NCHW-FP32-W=miopenConvolutionBwdWeightsAlgoDirect:ConvAsmBwdWrW3x3,1.88631,0,miopenConvolutionBwdWeightsAlgoDirect,<unused>;miopenConvolutionBwdWeightsAlgoWinograd:ConvBinWinogradRxSf2x3,2.14146,0,miopenConvolutionBwdWeightsAlgoWinograd,96x35x35x3x3x96x35x35x64xNCHWxFP32x1x1x1x1x1x1x1x0;miopenConvolutionBwdWeightsAlgoGEMM:gemm,5.9568,4233600,MIOpenGEMM,1_0_1225_1225_864_864_96_1225
256-17-17-3x3-224-35-35-64-0x0-2x2-1x1-0-NCHW-FP32-B=miopenConvolutionBwdDataAlgoWinograd:ConvBinWinogradRxSf2x3,3.74799,0,miopenConvolutionBwdDataAlgoWinograd,<unused>;miopenConvolutionBwdDataAlgoImplicitGEMM:ConvHipImplicitGemmBwdDataV1R1,4.92531,0,miopenConvolutionBwdDataAlgoImplicitGEMM,256x17x17x3x3x224x35x35x64xNCHWxFP32x0x0x2x2x1x1x1x0;miopenConvolutionBwdDataAlgoDirect:ConvOclDirectFwd,11.5279,0,miopenConvolutionBwdDataAlgoDirect,<unused>;miopenConvolutionBwdDataAlgoGEMM:gemm,13.1914,2330496,MIOpenGEMM,0_1_289_2016_289_289_2016_256
256-8-8-3x1-512-8-8-64-1x0-1x1-1x1-0-NCHW-FP32-B=miopenConvolutionBwdDataAlgoWinograd:ConvBinWinogradRxS,0.424792,0,miopenConvolutionBwdDataAlgoWinograd,<unused>;miopenConvolutionBwdDataAlgoImplicitGEMM:ConvHipImplicitGemmBwdDataV1R1,1.27635,0,miopenConvolutionBwdDataAlgoImplicitGEMM,256x8x8x1x3x512x8x8x64xNCHWxFP32x0x1x1x1x1x1x1x0;miopenConvolutionBwdDataAlgoGEMM:gemm,4.21337,393216,MIOpenGEMM,0_1_64_1536_64_64_1536_256
96-35-35-3x3-96-35-35-64-1x1-1x1-1x1-0-NCHW-FP32-B=miopenConvolutionBwdDataAlgoWinograd:ConvBinWinograd3x3U,0.643893,0,miopenConvolutionBwdDataAlgoWinograd,<unused>
256-8-8-3x1-384-8-8-64-1x0-1x1-1x1-0-NCHW-FP32-W=miopenConvolutionBwdWeightsAlgoDirect:ConvOclBwdWrW53,0.489799,0,miopenConvolutionBwdWeightsAlgoDirect,<unused>;miopenConvolutionBwdWeightsAlgoWinograd:ConvBinWinogradRxS,0.595816,0,miopenConvolutionBwdWeightsAlgoWinograd,256x8x8x1x3x384x8x8x64xNCHWxFP32x0x1x1x1x1x1x1x0;miopenConvolutionBwdWeightsAlgoImplicitGEMM:ConvHipImplicitGemmV4R1WrW,0.750134,0,miopenConvolutionBwdWeightsAlgoImplicitGEMM,256x8x8x1x3x384x8x8x64xNCHWxFP32x0x1x1x1x1x1x1x0;miopenConvolutionBwdWeightsAlgoGEMM:gemm,2.36513,294912,MIOpenGEMM,1_0_64_64_1152_1152_256_64
384-17-17-3x3-384-35-35-64-0x0-2x2-1x1-0-NCHW-FP32-B=miopenConvolutionBwdDataAlgoImplicitGEMM:ConvHipImplicitGemmBwdDataV1R1,7.43368,0,miopenConvolutionBwdDataAlgoImplicitGEMM,384x17x17x3x3x384x35x35x64xNCHWxFP32x0x0x2x2x1x1x1x0;miopenConvolutionBwdDataAlgoWinograd:ConvBinWinogradRxS,9.20761,0,miopenConvolutionBwdDataAlgoWinograd,<unused>;miopenConvolutionBwdDataAlgoGEMM:gemm,11.7997,3995136,MIOpenGEMM,0_1_289_3456_289_289_3456_384;miopenConvolutionBwdDataAlgoDirect:ConvOclDirectFwd,29.0282,0,miopenConvolutionBwdDataAlgoDirect,<unused>
96-35-35-3x3-64-35-35-64-1x1-1x1-1x1-0-NCHW-FP32-W=miopenConvolutionBwdWeightsAlgoDirect:ConvAsmBwdWrW3x3,0.985577,0,miopenConvolutionBwdWeightsAlgoDirect,<unused>;miopenConvolutionBwdWeightsAlgoWinograd:ConvBinWinogradRxSf2x3,1.97128,0,miopenConvolutionBwdWeightsAlgoWinograd,96x35x35x3x3x64x35x35x64xNCHWxFP32x1x1x1x1x1x1x1x0;miopenConvolutionBwdWeightsAlgoGEMM:gemm,8.49111,2822400,MIOpenGEMM,1_0_1225_1225_576_576_96_1225;miopenConvolutionBwdWeightsAlgoImplicitGEMM:ConvHipImplicitGemmV4R1WrW,9.39542,0,miopenConvolutionBwdWeightsAlgoImplicitGEMM,96x35x35x3x3x64x35x35x64xNCHWxFP32x1x1x1x1x1x1x1x0
96-35-35-3x3-96-35-35-64-1x1-1x1-1x1-0-NCHW-FP32-F=miopenConvolutionFwdAlgoWinograd:ConvBinWinograd3x3U,0.630564,0,miopenConvolutionFwdAlgoWinograd,<unused>
96-35-35-3x3-64-35-35-64-1x1-1x1-1x1-0-NCHW-FP32-B=miopenConvolutionBwdDataAlgoWinograd:ConvBinWinograd3x3U,0.447608,0,miopenConvolutionBwdDataAlgoWinograd,<unused>
256-8-8-3x1-384-8-8-64-1x0-1x1-1x1-0-NCHW-FP32-B=miopenConvolutionBwdDataAlgoWinograd:ConvBinWinogradRxS,0.327093,0,miopenConvolutionBwdDataAlgoWinograd,<unused>;miopenConvolutionBwdDataAlgoImplicitGEMM:ConvHipImplicitGemmBwdDataV1R1,0.379518,0,miopenConvolutionBwdDataAlgoImplicitGEMM,256x8x8x1x3x384x8x8x64xNCHWxFP32x0x1x1x1x1x1x1x0;miopenConvolutionBwdDataAlgoGEMM:gemm,3.17976,294912,MIOpenGEMM,0_1_64_1152_64_64_1152_256
512-8-8-3x1-256-8-8-64-1x0-1x1-1x1-0-NCHW-FP32-F=miopenConvolutionFwdAlgoWinograd:ConvBinWinogradRxSf2x3,0.418029,0,miopenConvolutionFwdAlgoWinograd,<unused>;miopenConvolutionFwdAlgoImplicitGEMM:ConvHipImplicitGemmV4R1Fwd,0.455795,0,miopenConvolutionFwdAlgoImplicitGEMM,512x8x8x1x3x256x8x8x64xNCHWxFP32x0x1x1x1x1x1x1x1;miopenConvolutionFwdAlgoGEMM:GemmFwdRest,4.18546,393216,MIOpenGEMM,0_0_64_1536_64_64_256_1536
96-35-35-1x1-384-35-35-64-0x0-1x1-1x1-0-NCHW-FP32-W=miopenConvolutionBwdWeightsAlgoDirect:ConvAsmBwdWrW1x1,1.01545,0,miopenConvolutionBwdWeightsAlgoDirect,<unused>
64-35-35-3x3-96-35-35-64-1x1-1x1-1x1-0-NCHW-FP32-F=miopenConvolutionFwdAlgoWinograd:ConvBinWinogradRxS,0.433887,0,miopenConvolutionFwdAlgoWinograd,<unused>
384-35-35-3x3-384-17-17-64-0x0-2x2-1x1-0-NCHW-FP32-F=miopenConvolutionFwdAlgoWinograd:ConvBinWinogradRxS,9.36122,0,miopenConvolutionFwdAlgoWinograd,<unused>;miopenConvolutionFwdAlgoGEMM:GemmFwdRest,16.5251,3995136,MIOpenGEMM,0_0_289_3456_289_289_384_3456;miopenConvolutionFwdAlgoDirect:ConvOclDirectFwd,44.1984,0,miopenConvolutionFwdAlgoDirect,<unused>
384-35-35-1x1-192-35-35-64-0x0-1x1-1x1-0-NCHW-FP32-F=miopenConvolutionFwdAlgoDirect:ConvAsm1x1U,1.46955,0,miopenConvolutionFwdAlgoDirect,<unused>;miopenConvolutionFwdAlgoWinograd:ConvBinWinogradRxSf3x2,2.39479,0,miopenConvolutionFwdAlgoWinograd,<unused>;miopenConvolutionFwdAlgoGEMM:GemmFwd1x1_0_1,4.30282,0,MIOpenGEMM,0_0_1225_384_1225_1225_192_384
512-8-8-1x3-448-8-8-64-0x1-1x1-1x1-0-NCHW-FP32-W=miopenConvolutionBwdWeightsAlgoDirect:ConvOclBwdWrW53,0.821309,0,miopenConvolutionBwdWeightsAlgoDirect,<unused>;miopenConvolutionBwdWeightsAlgoImplicitGEMM:ConvHipImplicitGemmV4R1WrW,0.914092,0,miopenConvolutionBwdWeightsAlgoImplicitGEMM,512x8x8x3x1x448x8x8x64xNCHWxFP32x1x0x1x1x1x1x1x0;miopenConvolutionBwdWeightsAlgoWinograd:ConvBinWinogradRxSf2x3,1.12705,0,miopenConvolutionBwdWeightsAlgoWinograd,512x8x8x3x1x448x8x8x64xNCHWxFP32x1x0x1x1x1x1x1x0;miopenConvolutionBwdWeightsAlgoGEMM:gemm,2.54,344064,MIOpenGEMM,1_0_64_64_1344_1344_512_64
384-8-8-3x1-256-8-8-64-1x0-1x1-1x1-0-NCHW-FP32-F=miopenConvolutionFwdAlgoWinograd:ConvBinWinogradRxS,0.318049,0,miopenConvolutionFwdAlgoWinograd,<unused>;miopenConvolutionFwdAlgoImplicitGEMM:ConvHipImplicitGemmV4R1Fwd,0.628185,0,miopenConvolutionFwdAlgoImplicitGEMM,384x8x8x1x3x256x8x8x64xNCHWxFP32x0x1x1x1x1x1x1x1;miopenConvolutionFwdAlgoGEMM:GemmFwdRest,5.04019,294912,MIOpenGEMM,0_0_64_1152_64_64_256_1152
96-71-71-3x3-64-73-73-64-0x0-1x1-1x1-0-NCHW-FP32-B=miopenConvolutionBwdDataAlgoWinograd:ConvBinWinogradRxSf2x3,1.78072,0,miopenConvolutionBwdDataAlgoWinograd,<unused>;miopenConvolutionBwdDataAlgoDirect:ConvOclDirectFwd,9.98164,0,miopenConvolutionBwdDataAlgoDirect,<unused>;miopenConvolutionBwdDataAlgoImplicitGEMM:ConvHipImplicitGemmBwdDataV1R1,11.8431,0,miopenConvolutionBwdDataAlgoImplicitGEMM,96x71x71x3x3x64x73x73x64xNCHWxFP32x0x0x1x1x1x1x1x0;miopenConvolutionBwdDataAlgoGEMM:gemm,11.8624,11614464,MIOpenGEMM,0_1_5041_576_5041_5041_576_96
384-17-17-1x1-1024-17-17-64-0x0-1x1-1x1-0-NCHW-FP32-B=miopenConvolutionBwdDataAlgoDirect:ConvAsm1x1U,1.59606,0,miopenConvolutionBwdDataAlgoDirect,<unused>;miopenConvolutionBwdDataAlgoWinograd:ConvBinWinogradRxSf3x2,3.01582,0,miopenConvolutionBwdDataAlgoWinograd,<unused>;miopenConvolutionBwdDataAlgoGEMM:gemm,3.35886,0,MIOpenGEMM,0_1_289_1024_289_289_1024_384
64-73-73-3x3-96-71-71-64-0x0-1x1-1x1-0-NCHW-FP32-F=miopenConvolutionFwdAlgoWinograd:ConvBinWinogradRxSf2x3,1.77361,0,miopenConvolutionFwdAlgoWinograd,<unused>;miopenConvolutionFwdAlgoGEMM:GemmFwdRest,9.09631,11614464,MIOpenGEMM,0_0_5041_576_5041_5041_96_576;miopenConvolutionFwdAlgoDirect:ConvOclDirectFwd,11.2234,0,miopenConvolutionFwdAlgoDirect,<unused>
64-73-73-1x7-64-73-73-64-0x3-1x1-1x1-0-NCHW-FP32-W=miopenConvolutionBwdWeightsAlgoWinograd:ConvBinWinogradRxSf2x3,9.30126,0,miopenConvolutionBwdWeightsAlgoWinograd,64x73x73x7x1x64x73x73x64xNCHWxFP32x3x0x1x1x1x1x1x0;miopenConvolutionBwdWeightsAlgoDirect:ConvOclBwdWrW2<4>,9.3876,1835008,miopenConvolutionBwdWeightsAlgoDirect,<unused>;miopenConvolutionBwdWeightsAlgoGEMM:gemm,33.5193,9549568,MIOpenGEMM,1_0_5329_5329_448_448_64_5329;miopenConvolutionBwdWeightsAlgoImplicitGEMM:ConvHipImplicitGemmV4R1WrW,34.4996,0,miopenConvolutionBwdWeightsAlgoImplicitGEMM,64x73x73x7x1x64x73x73x64xNCHWxFP32x3x0x1x1x1x1x1x0
128-17-17-1x1-768-17-17-128-0x0-1x1-1x1-0-NCHW-FP32-B=miopenConvolutionBwdDataAlgoDirect:ConvAsm1x1U,0.724573,0,miopenConvolutionBwdDataAlgoDirect,<unused>;miopenConvolutionBwdDataAlgoWinograd:ConvBinWinogradRxSf3x2,1.64729,0,miopenConvolutionBwdDataAlgoWinograd,<unused>;miopenConvolutionBwdDataAlgoGEMM:gemm,40.3733,0,MIOpenGEMM,0_1_289_768_289_289_768_128
1024-64-64-1x1-512-32-32-2-0x0-2x2-1x1-0-NCHW-FP32-F=miopenConvolutionFwdAlgoImplicitGEMM:ConvHipImplicitGemmV4R4Fwd,0.470356,0,miopenConvolutionFwdAlgoImplicitGEMM,1024x64x64x1x1x512x32x32x2xNCHWxFP32x0x0x2x2x1x1x1x1;miopenConvolutionFwdAlgoGEMM:GemmFwd1x1_0_2,0.603865,12582912,MIOpenGEMM,0_0_2048_1024_2048_2048_512_1024;miopenConvolutionFwdAlgoDirect:ConvOclDirectFwd1x1,1.05873,0,miopenConvolutionFwdAlgoDirect,<unused>;miopenConvolutionFwdAlgoWinograd:ConvBinWinogradRxSf2x3,1.77136,0,miopenConvolutionFwdAlgoWinograd,<unused>
256-32-32-1x1-2048-32-32-2-0x0-1x1-1x1-0-NCHW-FP32-B=miopenConvolutionBwdDataAlgoDirect:ConvAsm1x1U,0.324229,0,miopenConvolutionBwdDataAlgoDirect,<unused>;miopenConvolutionBwdDataAlgoGEMM:gemm,0.360157,0,MIOpenGEMM,0_1_1024_2048_1024_1024_2048_256;miopenConvolutionBwdDataAlgoWinograd:ConvBinWinogradRxSf3x2,0.504622,0,miopenConvolutionBwdDataAlgoWinograd,<unused>;miopenConvolutionBwdDataAlgoImplicitGEMM:ConvHipImplicitGemmBwdDataV1R1,1.07496,0,miopenConvolutionBwdDataAlgoImplicitGEMM,256x32x32x1x1x2048x32x32x2xNCHWxFP32x0x0x1x1x1x1x1x0
256-64-64-1x1-1024-64-64-2-0x0-1x1-1x1-0-NCHW-FP32-W=miopenConvolutionBwdWeightsAlgoDirect:ConvAsmBwdWrW1x1,1.16792,0,miopenConvolutionBwdWeightsAlgoDirect,<unused>;miopenConvolutionBwdWeightsAlgoWinograd:ConvBinWinogradRxSf2x3,4.13029,0,miopenConvolutionBwdWeightsAlgoWinograd,256x64x64x1x1x1024x64x64x2xNCHWxFP32x0x0x1x1x1x1x1x0
512-128-128-3x3-256-128-128-2-1x1-1x1-1x1-0-NCHW-FP32-W=miopenConvolutionBwdWeightsAlgoWinograd:ConvBinWinogradRxS,10.9338,0,miopenConvolutionBwdWeightsAlgoWinograd,512x128x128x3x3x256x128x128x2xNCHWxFP32x1x1x1x1x1x1x1x0;miopenConvolutionBwdWeightsAlgoImplicitGEMM:ConvHipImplicitGemmV4R1WrW,11.7963,0,miopenConvolutionBwdWeightsAlgoImplicitGEMM,512x128x128x3x3x256x128x128x2xNCHWxFP32x1x1x1x1x1x1x1x0;miopenConvolutionBwdWeightsAlgoGEMM:gemm,15.5189,150994944,MIOpenGEMM,1_0_16384_16384_2304_2304_512_16384;miopenConvolutionBwdWeightsAlgoDirect:ConvOclBwdWrW53,16.5127,0,miopenConvolutionBwdWeightsAlgoDirect,<unused>
512-128-128-3x3-256-128-128-2-1x1-1x1-1x1-0-NCHW-FP32-B=miopenConvolutionBwdDataAlgoWinograd:ConvBinWinogradRxS,3.26656,0,miopenConvolutionBwdDataAlgoWinograd,<unused>
2048-32-32-1x1-256-32-32-2-0x0-1x1-1x1-0-NCHW-FP32-F=miopenConvolutionFwdAlgoDirect:ConvAsm1x1U,0.372686,0,miopenConvolutionFwdAlgoDirect,<unused>;miopenConvolutionFwdAlgoGEMM:GemmFwd1x1_0_1,0.435692,0,MIOpenGEMM,0_0_1024_2048_1024_1024_256_2048;miopenConvolutionFwdAlgoWinograd:ConvBinWinogradRxSf3x2,0.473764,0,miopenConvolutionFwdAlgoWinograd,<unused>;miopenConvolutionFwdAlgoImplicitGEMM:ConvHipImplicitGemmV4R4Fwd,0.580448,0,miopenConvolutionFwdAlgoImplicitGEMM,2048x32x32x1x1x256x32x32x2xNCHWxFP32x0x0x1x1x1x1x1x1
256-64-64-1x1-1024-64-64-2-0x0-1x1-1x1-0-NCHW-FP32-B=miopenConvolutionBwdDataAlgoGEMM:gemm,0.661195,0,MIOpenGEMM,0_1_4096_1024_4096_4096_1024_256;miopenConvolutionBwdDataAlgoWinograd:ConvBinWinogradRxSf3x2,1.08178,0,miopenConvolutionBwdDataAlgoWinograd,<unused>;miopenConvolutionBwdDataAlgoDirect:ConvOclDirectFwd1x1,1.76521,0,miopenConvolutionBwdDataAlgoDirect,<unused>;miopenConvolutionBwdDataAlgoImplicitGEMM:ConvHipImplicitGemmBwdDataV1R1,2.0854,0,miopenConvolutionBwdDataAlgoImplicitGEMM,256x64x64x1x1x1024x64x64x2xNCHWxFP32x0x0x1x1x1x1x1x0
256-128-128-3x3-512-128-128-2-1x1-1x1-1x1-0-NCHW-FP32-F=miopenConvolutionFwdAlgoWinograd:ConvBinWinogradRxSf2x3,3.23602,0,miopenConvolutionFwdAlgoWinograd,<unused>
512-128-128-1x1-128-128-128-2-0x0-1x1-1x1-0-NCHW-FP32-W=miopenConvolutionBwdWeightsAlgoDirect:ConvAsmBwdWrW1x1,1.4944,0,miopenConvolutionBwdWeightsAlgoDirect,<unused>
1024-64-64-1x1-256-64-64-2-0x0-1x1-1x1-0-NCHW-FP32-F=miopenConvolutionFwdAlgoGEMM:GemmFwd1x1_0_1,0.674524,0,MIOpenGEMM,0_0_4096_1024_4096_4096_256_1024;miopenConvolutionFwdAlgoImplicitGEMM:ConvHipImplicitGemmV4R4Fwd,0.689154,0,miopenConvolutionFwdAlgoImplicitGEMM,1024x64x64x1x1x256x64x64x2xNCHWxFP32x0x0x1x1x1x1x1x1;miopenConvolutionFwdAlgoWinograd:ConvBinWinogradRxSf3x2,1.03669,0,miopenConvolutionFwdAlgoWinograd,<unused>;miopenConvolutionFwdAlgoDirect:ConvOclDirectFwd1x1,1.25989,0,miopenConvolutionFwdAlgoDirect,<unused>
256-128-128-3x3-256-128-128-2-1x1-1x1-1x1-0-NCHW-FP32-W=miopenConvolutionBwdWeightsAlgoWinograd:ConvBinWinogradRxS,6.28807,0,miopenConvolutionBwdWeightsAlgoWinograd,256x128x128x3x3x256x128x128x2xNCHWxFP32x1x1x1x1x1x1x1x0;miopenConvolutionBwdWeightsAlgoGEMM:gemm,7.07434,150994944,MIOpenGEMM,1_0_16384_16384_2304_2304_256_16384;miopenConvolutionBwdWeightsAlgoDirect:ConvOclBwdWrW53,7.08384,0,miopenConvolutionBwdWeightsAlgoDirect,<unused>;miopenConvolutionBwdWeightsAlgoImplicitGEMM:ConvHipImplicitGemmV4R1WrW,7.80217,0,miopenConvolutionBwdWeightsAlgoImplicitGEMM,256x128x128x3x3x256x128x128x2xNCHWxFP32x1x1x1x1x1x1x1x0
256-256-256-3x3-256-256-256-2-1x1-1x1-1x1-0-NCHW-FP32-F=miopenConvolutionFwdAlgoWinograd:ConvBinWinograd3x3U,6.91186,0,miopenConvolutionFwdAlgoWinograd,<unused>
224-17-17-1x7-192-17-17-64-0x3-1x1-1x1-0-NCHW-FP32-B=miopenConvolutionBwdDataAlgoWinograd:ConvBinWinogradRxSf3x2,1.34684,0,miopenConvolutionBwdDataAlgoWinograd,<unused>;miopenConvolutionBwdDataAlgoImplicitGEMM:ConvHipImplicitGemmBwdDataV1R1,1.71926,0,miopenConvolutionBwdDataAlgoImplicitGEMM,224x17x17x7x1x192x17x17x64xNCHWxFP32x3x0x1x1x1x1x1x0;miopenConvolutionBwdDataAlgoGEMM:gemm,3.54023,1553664,MIOpenGEMM,0_1_289_1344_289_289_1344_224
256-128-128-3x3-256-128-128-2-1x1-1x1-1x1-0-NCHW-FP32-B=miopenConvolutionBwdDataAlgoWinograd:ConvBinWinogradRxS,1.70878,0,miopenConvolutionBwdDataAlgoWinograd,<unused>
512-128-128-1x1-128-128-128-2-0x0-1x1-1x1-0-NCHW-FP32-B=miopenConvolutionBwdDataAlgoWinograd:ConvBinWinogradRxSf3x2,0.868969,0,miopenConvolutionBwdDataAlgoWinograd,<unused>;miopenConvolutionBwdDataAlgoGEMM:gemm,0.89048,0,MIOpenGEMM,0_1_16384_128_16384_16384_128_512;miopenConvolutionBwdDataAlgoDirect:ConvOclDirectFwd1x1,2.54674,0,miopenConvolutionBwdDataAlgoDirect,<unused>;miopenConvolutionBwdDataAlgoImplicitGEMM:ConvHipImplicitGemmBwdDataV1R1,2.80088,0,miopenConvolutionBwdDataAlgoImplicitGEMM,512x128x128x1x1x128x128x128x2xNCHWxFP32x0x0x1x1x1x1x1x0
256-128-128-3x3-256-128-128-2-1x1-1x1-1x1-0-NCHW-FP32-F=miopenConvolutionFwdAlgoWinograd:ConvBinWinogradRxS,1.72259,0,miopenConvolutionFwdAlgoWinograd,<unused>
96-35-35-1x1-384-35-35-64-0x0-1x1-1x1-0-NCHW-FP32-B=miopenConvolutionBwdDataAlgoDirect:ConvAsm1x1U,0.900639,0,miopenConvolutionBwdDataAlgoDirect,<unused>;miopenConvolutionBwdDataAlgoWinograd:ConvBinWinogradRxSf3x2,1.6079,0,miopenConvolutionBwdDataAlgoWinograd,<unused>;miopenConvolutionBwdDataAlgoGEMM:gemm,1.69549,0,MIOpenGEMM,0_1_1225_384_1225_1225_384_96
96-73-73-3x3-64-147-147-64-0x0-2x2-1x1-0-NCHW-FP32-W=miopenConvolutionBwdWeightsAlgoGEMM:gemm,11.6873,12278016,MIOpenGEMM,1_0_5329_5329_576_576_96_5329;miopenConvolutionBwdWeightsAlgoDirect:ConvOclBwdWrW2NonTunable,24.9514,14155776,miopenConvolutionBwdWeightsAlgoDirect,<unused>;miopenConvolutionBwdWeightsAlgoImplicitGEMM:ConvHipImplicitGemmV4R1WrW,33.4884,0,miopenConvolutionBwdWeightsAlgoImplicitGEMM,96x73x73x3x3x64x147x147x64xNCHWxFP32x0x0x2x2x1x1x1x0
256-256-256-1x1-256-256-256-2-0x0-1x1-1x1-0-NCHW-FP32-W=miopenConvolutionBwdWeightsAlgoDirect:ConvOclBwdWrW1x1,5.62216,0,miopenConvolutionBwdWeightsAlgoDirect,<unused>
128-128-128-1x1-512-128-128-2-0x0-1x1-1x1-0-NCHW-FP32-F=miopenConvolutionFwdAlgoImplicitGEMM:ConvHipImplicitGemmV4R4Fwd,0.713443,0,miopenConvolutionFwdAlgoImplicitGEMM,128x128x128x1x1x512x128x128x2xNCHWxFP32x0x0x1x1x1x1x1x1;miopenConvolutionFwdAlgoDirect:ConvOclDirectFwd1x1,0.850302,0,miopenConvolutionFwdAlgoDirect,<unused>;miopenConvolutionFwdAlgoGEMM:GemmFwd1x1_0_1,0.877096,0,MIOpenGEMM,0_0_16384_128_16384_16384_512_128;miopenConvolutionFwdAlgoWinograd:ConvBinWinogradRxSf3x2,1.04368,0,miopenConvolutionFwdAlgoWinograd,<unused>
512-8-8-1x3-448-8-8-64-0x1-1x1-1x1-0-NCHW-FP32-B=miopenConvolutionBwdDataAlgoWinograd:ConvBinWinogradRxSf2x3,0.709089,0,miopenConvolutionBwdDataAlgoWinograd,<unused>;miopenConvolutionBwdDataAlgoImplicitGEMM:ConvHipImplicitGemmBwdDataV1R1,0.760422,0,miopenConvolutionBwdDataAlgoImplicitGEMM,512x8x8x3x1x448x8x8x64xNCHWxFP32x1x0x1x1x1x1x1x0;miopenConvolutionBwdDataAlgoGEMM:gemm,3.90209,344064,MIOpenGEMM,0_1_64_1344_64_64_1344_512
512-32-32-1x1-2048-32-32-2-0x0-1x1-1x1-0-NCHW-FP32-W=miopenConvolutionBwdWeightsAlgoGEMM:gemm,0.75493,0,MIOpenGEMM,1_0_1024_1024_2048_2048_512_1024;miopenConvolutionBwdWeightsAlgoWinograd:ConvBinWinogradRxSf2x3,3.59076,0,miopenConvolutionBwdWeightsAlgoWinograd,512x32x32x1x1x2048x32x32x2xNCHWxFP32x0x0x1x1x1x1x1x0
64-256-256-1x1-256-256-256-2-0x0-1x1-1x1-0-NCHW-FP32-B=miopenConvolutionBwdDataAlgoWinograd:ConvBinWinogradRxSf3x2,1.44033,0,miopenConvolutionBwdDataAlgoWinograd,<unused>;miopenConvolutionBwdDataAlgoImplicitGEMM:ConvHipImplicitGemmBwdDataV1R1,2.9613,0,miopenConvolutionBwdDataAlgoImplicitGEMM,64x256x256x1x1x256x256x256x2xNCHWxFP32x0x0x1x1x1x1x1x0;miopenConvolutionBwdDataAlgoGEMM:gemm,2.97179,0,MIOpenGEMM,0_1_65536_256_65536_65536_256_64;miopenConvolutionBwdDataAlgoDirect:ConvOclDirectFwd1x1,3.79347,0,miopenConvolutionBwdDataAlgoDirect,<unused>
256-256-256-1x1-256-256-256-2-0x0-1x1-1x1-0-NCHW-FP32-B=miopenConvolutionBwdDataAlgoGEMM:gemm,2.74168,0,MIOpenGEMM,0_1_65536_256_65536_65536_256_256;miopenConvolutionBwdDataAlgoImplicitGEMM:ConvHipImplicitGemmBwdDataV1R1,3.02442,0,miopenConvolutionBwdDataAlgoImplicitGEMM,256x256x256x1x1x256x256x256x2xNCHWxFP32x0x0x1x1x1x1x1x0;miopenConvolutionBwdDataAlgoDirect:ConvOclDirectFwd1x1,3.60244,0,miopenConvolutionBwdDataAlgoDirect,<unused>;miopenConvolutionBwdDataAlgoWinograd:ConvBinWinogradRxSf3x2,4.07745,0,miopenConvolutionBwdDataAlgoWinograd,<unused>
128-128-128-3x3-128-128-128-2-1x1-1x1-1x1-0-NCHW-FP32-W=miopenConvolutionBwdWeightsAlgoDirect:ConvAsmBwdWrW3x3,0.999092,0,miopenConvolutionBwdWeightsAlgoDirect,<unused>;miopenConvolutionBwdWeightsAlgoWinograd:ConvBinWinogradRxSf2x3,2.22674,0,miopenConvolutionBwdWeightsAlgoWinograd,128x128x128x3x3x128x128x128x2xNCHWxFP32x1x1x1x1x1x1x1x0;miopenConvolutionBwdWeightsAlgoGEMM:gemm,2.61992,75497472,MIOpenGEMM,1_0_16384_16384_1152_1152_128_16384;miopenConvolutionBwdWeightsAlgoImplicitGEMM:ConvHipImplicitGemmV4R1WrW,4.18781,0,miopenConvolutionBwdWeightsAlgoImplicitGEMM,128x128x128x3x3x128x128x128x2xNCHWxFP32x1x1x1x1x1x1x1x0
192-35-35-1x1-384-35-35-64-0x0-1x1-1x1-0-NCHW-FP32-B=miopenConvolutionBwdDataAlgoDirect:ConvAsm1x1U,1.24957,0,miopenConvolutionBwdDataAlgoDirect,<unused>;miopenConvolutionBwdDataAlgoWinograd:ConvBinWinogradRxSf3x2,2.40179,0,miopenConvolutionBwdDataAlgoWinograd,<unused>;miopenConvolutionBwdDataAlgoGEMM:gemm,2.49421,0,MIOpenGEMM,0_1_1225_384_1225_1225_384_192
512-32-32-1x1-2048-32-32-2-0x0-1x1-1x1-0-NCHW-FP32-B=miopenConvolutionBwdDataAlgoDirect:ConvAsm1x1U,0.516029,0,miopenConvolutionBwdDataAlgoDirect,<unused>;miopenConvolutionBwdDataAlgoImplicitGEMM:ConvHipImplicitGemmBwdDataV1R1,0.603269,0,miopenConvolutionBwdDataAlgoImplicitGEMM,512x32x32x1x1x2048x32x32x2xNCHWxFP32x0x0x1x1x1x1x1x0;miopenConvolutionBwdDataAlgoGEMM:gemm,0.780054,0,MIOpenGEMM,0_1_1024_2048_1024_1024_2048_512;miopenConvolutionBwdDataAlgoWinograd:ConvBinWinogradRxSf3x2,0.984241,0,miopenConvolutionBwdDataAlgoWinograd,<unused>
128-128-128-3x3-128-128-128-2-1x1-1x1-1x1-0-NCHW-FP32-B=miopenConvolutionBwdDataAlgoWinograd:ConvBinWinogradRxS,0.442768,0,miopenConvolutionBwdDataAlgoWinograd,<unused>
256-256-256-1x1-64-256-256-2-0x0-1x1-1x1-0-NCHW-FP32-F=miopenConvolutionFwdAlgoGEMM:GemmFwd1x1_0_1,0.74604,0,MIOpenGEMM,0_0_65536_256_65536_65536_64_256;miopenConvolutionFwdAlgoImplicitGEMM:ConvHipImplicitGemmV4R4Fwd,0.78565,0,miopenConvolutionFwdAlgoImplicitGEMM,256x256x256x1x1x64x256x256x2xNCHWxFP32x0x0x1x1x1x1x1x1;miopenConvolutionFwdAlgoDirect:ConvOclDirectFwd1x1,1.05459,0,miopenConvolutionFwdAlgoDirect,<unused>;miopenConvolutionFwdAlgoWinograd:ConvBinWinogradRxSf3x2,1.1702,0,miopenConvolutionFwdAlgoWinograd,<unused>
128-128-128-3x3-128-128-128-2-1x1-1x1-1x1-0-NCHW-FP32-F=miopenConvolutionFwdAlgoWinograd:ConvBinWinograd3x3U,0.442559,0,miopenConvolutionFwdAlgoWinograd,<unused>
256-256-256-1x1-256-256-256-2-0x0-1x1-1x1-0-NCHW-FP32-F=miopenConvolutionFwdAlgoImplicitGEMM:ConvHipImplicitGemmV4R4Fwd,2.886,0,miopenConvolutionFwdAlgoImplicitGEMM,256x256x256x1x1x256x256x256x2xNCHWxFP32x0x0x1x1x1x1x1x1;miopenConvolutionFwdAlgoGEMM:GemmFwd1x1_0_1,2.94151,0,MIOpenGEMM,0_0_65536_256_65536_65536_256_256;miopenConvolutionFwdAlgoDirect:ConvOclDirectFwd1x1,3.71034,0,miopenConvolutionFwdAlgoDirect,<unused>;miopenConvolutionFwdAlgoWinograd:ConvBinWinogradRxSf3x2,3.87491,0,miopenConvolutionFwdAlgoWinograd,<unused>
1024-64-64-1x1-256-64-64-2-0x0-1x1-1x1-0-NCHW-FP32-W=miopenConvolutionBwdWeightsAlgoDirect:ConvAsmBwdWrW1x1,0.851702,0,miopenConvolutionBwdWeightsAlgoDirect,<unused>;miopenConvolutionBwdWeightsAlgoWinograd:ConvBinWinogradRxSf2x3,3.66274,0,miopenConvolutionBwdWeightsAlgoWinograd,1024x64x64x1x1x256x64x64x2xNCHWxFP32x0x0x1x1x1x1x1x0
2048-32-32-1x1-512-32-32-2-0x0-1x1-1x1-0-NCHW-FP32-F=miopenConvolutionFwdAlgoGEMM:GemmFwd1x1_0_1,0.759401,0,MIOpenGEMM,0_0_1024_2048_1024_1024_512_2048;miopenConvolutionFwdAlgoImplicitGEMM:ConvHipImplicitGemmV4R4Fwd,0.767427,0,miopenConvolutionFwdAlgoImplicitGEMM,2048x32x32x1x1x512x32x32x2xNCHWxFP32x0x0x1x1x1x1x1x1;miopenConvolutionFwdAlgoDirect:ConvAsm1x1U,0.795288,0,miopenConvolutionFwdAlgoDirect,<unused>;miopenConvolutionFwdAlgoWinograd:ConvBinWinogradRxSf3x2,0.916107,0,miopenConvolutionFwdAlgoWinograd,<unused>
512-32-32-1x1-1024-64-64-2-0x0-2x2-1x1-0-NCHW-FP32-W=miopenConvolutionBwdWeightsAlgoGEMM:gemm,0.649269,4194304,MIOpenGEMM,1_0_1024_1024_1024_1024_512_1024;miopenConvolutionBwdWeightsAlgoDirect:ConvAsmBwdWrW1x1,0.723686,8388608,miopenConvolutionBwdWeightsAlgoDirect,<unused>;miopenConvolutionBwdWeightsAlgoImplicitGEMM:ConvHipImplicitGemmV4R1WrW,1.10394,0,miopenConvolutionBwdWeightsAlgoImplicitGEMM,512x32x32x1x1x1024x64x64x2xNCHWxFP32x0x0x2x2x1x1x1x0
128-128-128-1x1-256-256-256-2-0x0-2x2-1x1-0-NCHW-FP32-W=miopenConvolutionBwdWeightsAlgoDirect:ConvAsmBwdWrW1x1,0.789681,33554432,miopenConvolutionBwdWeightsAlgoDirect,<unused>;miopenConvolutionBwdWeightsAlgoGEMM:gemm,1.19189,16777216,MIOpenGEMM,1_0_16384_16384_256_256_128_16384;miopenConvolutionBwdWeightsAlgoImplicitGEMM:ConvHipImplicitGemmV4R1WrW,12.3515,0,miopenConvolutionBwdWeightsAlgoImplicitGEMM,128x128x128x1x1x256x256x256x2xNCHWxFP32x0x0x2x2x1x1x1x0
1024-64-64-1x1-256-64-64-2-0x0-1x1-1x1-0-NCHW-FP32-B=miopenConvolutionBwdDataAlgoImplicitGEMM:ConvHipImplicitGemmBwdDataV1R1,0.565028,0,miopenConvolutionBwdDataAlgoImplicitGEMM,1024x64x64x1x1x256x64x64x2xNCHWxFP32x0x0x1x1x1x1x1x0;miopenConvolutionBwdDataAlgoGEMM:gemm,0.824174,0,MIOpenGEMM,0_1_4096_256_4096_4096_256_1024;miopenConvolutionBwdDataAlgoWinograd:ConvBinWinogradRxSf3x2,0.948992,0,miopenConvolutionBwdDataAlgoWinograd,<unused>;miopenConvolutionBwdDataAlgoDirect:ConvOclDirectFwd1x1,1.04817,0,miopenConvolutionBwdDataAlgoDirect,<unused>
512-32-32-1x1-1024-64-64-2-0x0-2x2-1x1-0-NCHW-FP32-B=miopenConvolutionBwdDataAlgoDirect:ConvOclDirectFwd1x1,0.370971,0,miopenConvolutionBwdDataAlgoDirect,<unused>;miopenConvolutionBwdDataAlgoImplicitGEMM:ConvHipImplicitGemmBwdDataV1R1,0.55274,0,miopenConvolutionBwdDataAlgoImplicitGEMM,512x32x32x1x1x1024x64x64x2xNCHWxFP32x0x0x2x2x1x1x1x0;miopenConvolutionBwdDataAlgoGEMM:gemm,0.572047,12582912,MIOpenGEMM,0_1_2048_1024_2048_2048_1024_512;miopenConvolutionBwdDataAlgoWinograd:ConvBinWinogradRxSf2x3,1.95466,0,miopenConvolutionBwdDataAlgoWinograd,<unused>
512-256-256-3x3-256-256-256-2-1x1-1x1-1x1-0-NCHW-FP32-W=miopenConvolutionBwdWeightsAlgoWinograd:ConvBinWinogradRxS,55.2814,0,miopenConvolutionBwdWeightsAlgoWinograd,512x256x256x3x3x256x256x256x2xNCHWxFP32x1x1x1x1x1x1x1x0;miopenConvolutionBwdWeightsAlgoImplicitGEMM:ConvHipImplicitGemmV4R1WrW,60.7201,0,miopenConvolutionBwdWeightsAlgoImplicitGEMM,512x256x256x3x3x256x256x256x2xNCHWxFP32x1x1x1x1x1x1x1x0;miopenConvolutionBwdWeightsAlgoGEMM:gemm,92.3642,603979776,MIOpenGEMM,1_0_65536_65536_2304_2304_512_65536;miopenConvolutionBwdWeightsAlgoDirect:ConvOclBwdWrW53,115.651,0,miopenConvolutionBwdWeightsAlgoDirect,<unused>
256-32-32-1x1-2048-32-32-2-0x0-1x1-1x1-0-NCHW-FP32-W=miopenConvolutionBwdWeightsAlgoGEMM:gemm,0.425696,0,MIOpenGEMM,1_0_1024_1024_2048_2048_256_1024;miopenConvolutionBwdWeightsAlgoWinograd:ConvBinWinogradRxSf2x3,2.39036,0,miopenConvolutionBwdWeightsAlgoWinograd,256x32x32x1x1x2048x32x32x2xNCHWxFP32x0x0x1x1x1x1x1x0
128-128-128-1x1-256-256-256-2-0x0-2x2-1x1-0-NCHW-FP32-B=miopenConvolutionBwdDataAlgoGEMM:gemm,1.02532,50331648,MIOpenGEMM,0_1_32768_256_32768_32768_256_128;miopenConvolutionBwdDataAlgoDirect:ConvOclDirectFwd1x1,1.56903,0,miopenConvolutionBwdDataAlgoDirect,<unused>;miopenConvolutionBwdDataAlgoWinograd:ConvBinWinogradRxSf2x3,2.15764,0,miopenConvolutionBwdDataAlgoWinograd,<unused>;miopenConvolutionBwdDataAlgoImplicitGEMM:ConvHipImplicitGemmBwdDataV1R1,2.18435,0,miopenConvolutionBwdDataAlgoImplicitGEMM,128x128x128x1x1x256x256x256x2xNCHWxFP32x0x0x2x2x1x1x1x0
256-64-64-1x1-1024-64-64-2-0x0-1x1-1x1-0-NCHW-FP32-F=miopenConvolutionFwdAlgoGEMM:GemmFwd1x1_0_1,0.539812,0,MIOpenGEMM,0_0_4096_256_4096_4096_1024_256;miopenConvolutionFwdAlgoImplicitGEMM:ConvHipImplicitGemmV4R4Fwd,0.717135,0,miopenConvolutionFwdAlgoImplicitGEMM,256x64x64x1x1x1024x64x64x2xNCHWxFP32x0x0x1x1x1x1x1x1;miopenConvolutionFwdAlgoWinograd:ConvBinWinogradRxSf3x2,1.05906,0,miopenConvolutionFwdAlgoWinograd,<unused>;miopenConvolutionFwdAlgoDirect:ConvOclDirectFwd1x1,1.26965,0,miopenConvolutionFwdAlgoDirect,<unused>
512-256-256-3x3-256-256-256-2-1x1-1x1-1x1-0-NCHW-FP32-B=miopenConvolutionBwdDataAlgoWinograd:ConvBinWinograd3x3U,12.748,0,miopenConvolutionBwdDataAlgoWinograd,<unused>
256-128-128-1x1-512-128-128-2-0x0-1x1-1x1-0-NCHW-FP32-B=miopenConvolutionBwdDataAlgoGEMM:gemm,1.66554,0,MIOpenGEMM,0_1_16384_512_16384_16384_512_256;miopenConvolutionBwdDataAlgoWinograd:ConvBinWinogradRxSf3x2,2.12493,0,miopenConvolutionBwdDataAlgoWinograd,<unused>;miopenConvolutionBwdDataAlgoDirect:ConvOclDirectFwd1x1,3.89898,0,miopenConvolutionBwdDataAlgoDirect,<unused>;miopenConvolutionBwdDataAlgoImplicitGEMM:ConvHipImplicitGemmBwdDataV1R1,8.39089,0,miopenConvolutionBwdDataAlgoImplicitGEMM,256x128x128x1x1x512x128x128x2xNCHWxFP32x0x0x1x1x1x1x1x0
512-128-128-1x1-1024-64-64-2-0x0-2x2-1x1-0-NCHW-FP32-F=miopenConvolutionFwdAlgoGEMM:GemmFwd1x1_0_2,1.21649,50331648,MIOpenGEMM,0_0_8192_512_8192_8192_1024_512;miopenConvolutionFwdAlgoImplicitGEMM:ConvHipImplicitGemmV4R4Fwd,1.56469,0,miopenConvolutionFwdAlgoImplicitGEMM,512x128x128x1x1x1024x64x64x2xNCHWxFP32x0x0x2x2x1x1x1x1;miopenConvolutionFwdAlgoDirect:ConvOclDirectFwd1x1,2.74422,0,miopenConvolutionFwdAlgoDirect,<unused>;miopenConvolutionFwdAlgoWinograd:ConvBinWinogradRxS,6.14513,0,miopenConvolutionFwdAlgoWinograd,<unused>
256-256-256-3x3-512-256-256-2-1x1-1x1-1x1-0-NCHW-FP32-F=miopenConvolutionFwdAlgoWinograd:ConvBinWinograd3x3U,12.9632,0,miopenConvolutionFwdAlgoWinograd,<unused>
256-256-256-1x1-128-128-128-2-0x0-2x2-1x1-0-NCHW-FP32-F=miopenConvolutionFwdAlgoGEMM:GemmFwd1x1_0_2,0.634184,50331648,MIOpenGEMM,0_0_32768_256_32768_32768_128_256;miopenConvolutionFwdAlgoImplicitGEMM:ConvHipImplicitGemmV4R4Fwd,0.951439,0,miopenConvolutionFwdAlgoImplicitGEMM,256x256x256x1x1x128x128x128x2xNCHWxFP32x0x0x2x2x1x1x1x1;miopenConvolutionFwdAlgoDirect:ConvOclDirectFwd1x1,1.56177,0,miopenConvolutionFwdAlgoDirect,<unused>;miopenConvolutionFwdAlgoWinograd:ConvBinWinogradRxSf2x3,1.79964,0,miopenConvolutionFwdAlgoWinograd,<unused>
12-16-16-1x1-512-16-16-2-0x0-1x1-1x1-0-NCHW-FP32-W=miopenConvolutionBwdWeightsAlgoDirect:ConvAsmBwdWrW1x1,0.015156,0,miopenConvolutionBwdWeightsAlgoDirect,<unused>;miopenConvolutionBwdWeightsAlgoGEMM:gemm,0.03129,0,MIOpenGEMM,1_0_256_256_512_512_12_256;miopenConvolutionBwdWeightsAlgoWinograd:ConvBinWinogradRxSf2x3,0.063207,0,miopenConvolutionBwdWeightsAlgoWinograd,12x16x16x1x1x512x16x16x2xNCHWxFP32x0x0x1x1x1x1x1x0
64-512-512-7x7-3-1030-1030-2-0x0-2x2-1x1-0-NCHW-FP32-W=miopenConvolutionBwdWeightsAlgoGEMM:gemm,6.33622,154140672,MIOpenGEMM,1_0_262144_262144_147_147_64_262144
512-32-32-3x3-256-32-32-2-1x1-1x1-1x1-0-NCHW-FP32-W=miopenConvolutionBwdWeightsAlgoDirect:ConvAsmBwdWrW3x3,0.547957,0,miopenConvolutionBwdWeightsAlgoDirect,<unused>;miopenConvolutionBwdWeightsAlgoImplicitGEMM:ConvHipImplicitGemmV4R1WrW,0.883265,0,miopenConvolutionBwdWeightsAlgoImplicitGEMM,512x32x32x3x3x256x32x32x2xNCHWxFP32x1x1x1x1x1x1x1x0;miopenConvolutionBwdWeightsAlgoWinograd:ConvBinWinogradRxSf2x3,1.384,0,miopenConvolutionBwdWeightsAlgoWinograd,512x32x32x3x3x256x32x32x2xNCHWxFP32x1x1x1x1x1x1x1x0;miopenConvolutionBwdWeightsAlgoGEMM:gemm,1.49242,9437184,MIOpenGEMM,1_0_1024_1024_2304_2304_512_1024
64-512-512-7x7-3-1030-1030-2-0x0-2x2-1x1-0-NCHW-FP32-B=miopenConvolutionBwdDataAlgoDirect:ConvOclDirectFwd,6.18213,0,miopenConvolutionBwdDataAlgoDirect,<unused>;miopenConvolutionBwdDataAlgoWinograd:ConvBinWinogradRxSf2x3,7.93479,0,miopenConvolutionBwdDataAlgoWinograd,<unused>;miopenConvolutionBwdDataAlgoGEMM:gemm,11.4044,154140672,MIOpenGEMM,0_1_262144_147_262144_262144_147_64
512-32-32-3x3-256-32-32-2-1x1-1x1-1x1-0-NCHW-FP32-B=miopenConvolutionBwdDataAlgoWinograd:ConvBinWinogradRxS,0.233049,0,miopenConvolutionBwdDataAlgoWinograd,<unused>
512-128-128-1x1-256-256-256-2-0x0-2x2-1x1-0-NCHW-FP32-W=miopenConvolutionBwdWeightsAlgoDirect:ConvAsmBwdWrW1x1,2.26453,33554432,miopenConvolutionBwdWeightsAlgoDirect,<unused>;miopenConvolutionBwdWeightsAlgoGEMM:gemm,2.71751,16777216,MIOpenGEMM,1_0_16384_16384_256_256_512_16384;miopenConvolutionBwdWeightsAlgoImplicitGEMM:ConvHipImplicitGemmV4R1WrW,11.7059,0,miopenConvolutionBwdWeightsAlgoImplicitGEMM,512x128x128x1x1x256x256x256x2xNCHWxFP32x0x0x2x2x1x1x1x0
512-128-128-1x1-256-128-128-2-0x0-1x1-1x1-0-NCHW-FP32-F=miopenConvolutionFwdAlgoWinograd:ConvBinWinogradRxSf3x2,2.12292,0,miopenConvolutionFwdAlgoWinograd,<unused>;miopenConvolutionFwdAlgoGEMM:GemmFwd1x1_0_1,3.48873,0,MIOpenGEMM,0_0_16384_512_16384_16384_256_512;miopenConvolutionFwdAlgoDirect:ConvOclDirectFwd1x1,5.89997,0,miopenConvolutionFwdAlgoDirect,<unused>;miopenConvolutionFwdAlgoImplicitGEMM:ConvHipImplicitGemmV4R4Fwd,17.0526,0,miopenConvolutionFwdAlgoImplicitGEMM,512x128x128x1x1x256x128x128x2xNCHWxFP32x0x0x1x1x1x1x1x1
12-16-16-1x1-512-16-16-2-0x0-1x1-1x1-0-NCHW-FP32-B=miopenConvolutionBwdDataAlgoDirect:ConvAsm1x1U,0.014533,0,miopenConvolutionBwdDataAlgoDirect,<unused>;miopenConvolutionBwdDataAlgoGEMM:gemm,0.0622,0,MIOpenGEMM,0_1_256_512_256_256_512_12;miopenConvolutionBwdDataAlgoImplicitGEMM:ConvHipImplicitGemmBwdDataV1R1,0.438279,0,miopenConvolutionBwdDataAlgoImplicitGEMM,12x16x16x1x1x512x16x16x2xNCHWxFP32x0x0x1x1x1x1x1x0;miopenConvolutionBwdDataAlgoWinograd:ConvBinWinogradRxSf2x3,12.121,0,miopenConvolutionBwdDataAlgoWinograd,<unused>
512-16-16-3x3-256-16-16-2-1x1-1x1-1x1-0-NCHW-FP32-W=miopenConvolutionBwdWeightsAlgoDirect:ConvAsmBwdWrW3x3,0.139879,0,miopenConvolutionBwdWeightsAlgoDirect,<unused>;miopenConvolutionBwdWeightsAlgoImplicitGEMM:ConvHipImplicitGemmV4R1WrW,0.219257,0,miopenConvolutionBwdWeightsAlgoImplicitGEMM,512x16x16x3x3x256x16x16x2xNCHWxFP32x1x1x1x1x1x1x1x0;miopenConvolutionBwdWeightsAlgoWinograd:ConvBinWinogradRxS,0.239654,0,miopenConvolutionBwdWeightsAlgoWinograd,512x16x16x3x3x256x16x16x2xNCHWxFP32x1x1x1x1x1x1x1x0;miopenConvolutionBwdWeightsAlgoGEMM:gemm,0.360187,2359296,MIOpenGEMM,1_0_256_256_2304_2304_512_256
256-32-32-3x3-512-32-32-2-1x1-1x1-1x1-0-NCHW-FP32-F=miopenConvolutionFwdAlgoWinograd:ConvBinWinogradRxSf2x3,0.241094,0,miopenConvolutionFwdAlgoWinograd,<unused>
512-32-32-1x1-12-32-32-2-0x0-1x1-1x1-0-NCHW-FP32-F=miopenConvolutionFwdAlgoDirect:ConvAsm1x1U,0.044364,0,miopenConvolutionFwdAlgoDirect,<unused>;miopenConvolutionFwdAlgoGEMM:GemmFwd1x1_0_1,0.068934,0,MIOpenGEMM,0_0_1024_512_1024_1024_12_512;miopenConvolutionFwdAlgoWinograd:ConvBinWinogradRxSf2x3,0.120864,0,miopenConvolutionFwdAlgoWinograd,<unused>
3-1030-1030-7x7-64-512-512-2-0x0-2x2-1x1-0-NCHW-FP32-F=miopenConvolutionFwdAlgoDirect:ConvOclDirectFwd,2.90283,0,miopenConvolutionFwdAlgoDirect,<unused>;miopenConvolutionFwdAlgoWinograd:ConvBinWinogradRxS,3.10073,0,miopenConvolutionFwdAlgoWinograd,<unused>;miopenConvolutionFwdAlgoGEMM:GemmFwdRest,8.34667,154140672,MIOpenGEMM,0_0_262144_147_262144_262144_64_147
512-16-16-3x3-256-16-16-2-1x1-1x1-1x1-0-NCHW-FP32-B=miopenConvolutionBwdDataAlgoWinograd:ConvBinWinogradRxS,0.112746,0,miopenConvolutionBwdDataAlgoWinograd,<unused>
6-256-256-1x1-512-256-256-2-0x0-1x1-1x1-0-NCHW-FP32-W=miopenConvolutionBwdWeightsAlgoGEMM:gemm,3.36508,0,MIOpenGEMM,1_0_65536_65536_512_512_6_65536;miopenConvolutionBwdWeightsAlgoDirect:ConvOclBwdWrW53,4.13544,24576,miopenConvolutionBwdWeightsAlgoDirect,<unused>;miopenConvolutionBwdWeightsAlgoWinograd:ConvBinWinogradRxSf2x3,6.02287,0,miopenConvolutionBwdWeightsAlgoWinograd,6x256x256x1x1x512x256x256x2xNCHWxFP32x0x0x1x1x1x1x1x0
512-16-16-1x1-12-16-16-2-0x0-1x1-1x1-0-NCHW-FP32-F=miopenConvolutionFwdAlgoDirect:ConvAsm1x1U,0.02467,0,miopenConvolutionFwdAlgoDirect,<unused>;miopenConvolutionFwdAlgoWinograd:ConvBinWinogradRxSf3x2,0.176906,0,miopenConvolutionFwdAlgoWinograd,<unused>;miopenConvolutionFwdAlgoGEMM:GemmFwd1x1_0_1,0.239649,0,MIOpenGEMM,0_0_256_512_256_256_12_512
256-16-16-3x3-512-16-16-2-1x1-1x1-1x1-0-NCHW-FP32-F=miopenConvolutionFwdAlgoWinograd:ConvBinWinogradRxS,0.073952,0,miopenConvolutionFwdAlgoWinograd,<unused>
512-128-128-1x1-256-256-256-2-0x0-2x2-1x1-0-NCHW-FP32-B=miopenConvolutionBwdDataAlgoDirect:ConvOclDirectFwd1x1,2.01629,0,miopenConvolutionBwdDataAlgoDirect,<unused>;miopenConvolutionBwdDataAlgoGEMM:gemm,2.09286,100663296,MIOpenGEMM,0_1_32768_256_32768_32768_256_512;miopenConvolutionBwdDataAlgoImplicitGEMM:ConvHipImplicitGemmBwdDataV1R1,2.36596,0,miopenConvolutionBwdDataAlgoImplicitGEMM,512x128x128x1x1x256x256x256x2xNCHWxFP32x0x0x2x2x1x1x1x0;miopenConvolutionBwdDataAlgoWinograd:ConvBinWinogradRxSf2x3,7.24442,0,miopenConvolutionBwdDataAlgoWinograd,<unused>
128-128-128-1x1-512-128-128-2-0x0-1x1-1x1-0-NCHW-FP32-W=miopenConvolutionBwdWeightsAlgoDirect:ConvAsmBwdWrW1x1,1.06296,0,miopenConvolutionBwdWeightsAlgoDirect,<unused>
6-256-256-1x1-512-256-256-2-0x0-1x1-1x1-0-NCHW-FP32-B=miopenConvolutionBwdDataAlgoWinograd:ConvBinWinogradRxSf2x3,1.16875,0,miopenConvolutionBwdDataAlgoWinograd,<unused>;miopenConvolutionBwdDataAlgoGEMM:gemm,1.28246,0,MIOpenGEMM,0_1_65536_512_65536_65536_512_6;miopenConvolutionBwdDataAlgoDirect:ConvOclDirectFwd1x1,1.69839,0,miopenConvolutionBwdDataAlgoDirect,<unused>
256-32-32-3x3-256-32-32-2-1x1-1x1-1x1-0-NCHW-FP32-W=miopenConvolutionBwdWeightsAlgoDirect:ConvAsmBwdWrW3x3,0.320174,0,miopenConvolutionBwdWeightsAlgoDirect,<unused>;miopenConvolutionBwdWeightsAlgoImplicitGEMM:ConvHipImplicitGemmV4R1WrW,0.719956,0,miopenConvolutionBwdWeightsAlgoImplicitGEMM,256x32x32x3x3x256x32x32x2xNCHWxFP32x1x1x1x1x1x1x1x0;miopenConvolutionBwdWeightsAlgoGEMM:gemm,0.778752,9437184,MIOpenGEMM,1_0_1024_1024_2304_2304_256_1024;miopenConvolutionBwdWeightsAlgoWinograd:ConvBinWinogradRxSf2x3,0.935354,0,miopenConvolutionBwdWeightsAlgoWinograd,256x32x32x3x3x256x32x32x2xNCHWxFP32x1x1x1x1x1x1x1x0
448-8-8-1x3-512-8-8-64-0x1-1x1-1x1-0-NCHW-FP32-F=miopenConvolutionFwdAlgoWinograd:ConvBinWinogradRxSf2x3,0.711046,0,miopenConvolutionFwdAlgoWinograd,<unused>;miopenConvolutionFwdAlgoImplicitGEMM:ConvHipImplicitGemmV4R1Fwd,0.899254,0,miopenConvolutionFwdAlgoImplicitGEMM,448x8x8x3x1x512x8x8x64xNCHWxFP32x1x0x1x1x1x1x1x1;miopenConvolutionFwdAlgoGEMM:GemmFwdRest,4.04204,344064,MIOpenGEMM,0_0_64_1344_64_64_512_1344
6-128-128-1x1-512-128-128-2-0x0-1x1-1x1-0-NCHW-FP32-W=miopenConvolutionBwdWeightsAlgoDirect:ConvOclBwdWrW53,1.23736,24576,miopenConvolutionBwdWeightsAlgoDirect,<unused>;miopenConvolutionBwdWeightsAlgoGEMM:gemm,1.95326,0,MIOpenGEMM,1_0_16384_16384_512_512_6_16384;miopenConvolutionBwdWeightsAlgoWinograd:ConvBinWinogradRxSf2x3,2.15999,0,miopenConvolutionBwdWeightsAlgoWinograd,6x128x128x1x1x512x128x128x2xNCHWxFP32x0x0x1x1x1x1x1x0
96-73-73-3x3-64-147-147-64-0x0-2x2-1x1-0-NCHW-FP32-B=miopenConvolutionBwdDataAlgoWinograd:ConvBinWinogradRxS,6.77189,0,miopenConvolutionBwdDataAlgoWinograd,<unused>;miopenConvolutionBwdDataAlgoImplicitGEMM:ConvHipImplicitGemmBwdDataV1R1,13.9782,0,miopenConvolutionBwdDataAlgoImplicitGEMM,96x73x73x3x3x64x147x147x64xNCHWxFP32x0x0x2x2x1x1x1x0;miopenConvolutionBwdDataAlgoDirect:ConvOclDirectFwd,14.1702,0,miopenConvolutionBwdDataAlgoDirect,<unused>;miopenConvolutionBwdDataAlgoGEMM:gemm,16.6924,12278016,MIOpenGEMM,0_1_5329_576_5329_5329_576_96
6-32-32-1x1-512-32-32-2-0x0-1x1-1x1-0-NCHW-FP32-B=miopenConvolutionBwdDataAlgoDirect:ConvOclDirectFwd1x1,0.021156,0,miopenConvolutionBwdDataAlgoDirect,<unused>;miopenConvolutionBwdDataAlgoGEMM:gemm,0.023694,0,MIOpenGEMM,0_1_1024_512_1024_1024_512_6;miopenConvolutionBwdDataAlgoWinograd:ConvBinWinogradRxSf2x3,0.090666,0,miopenConvolutionBwdDataAlgoWinograd,<unused>
512-64-64-3x3-256-64-64-2-1x1-1x1-1x1-0-NCHW-FP32-W=miopenConvolutionBwdWeightsAlgoDirect:ConvAsmBwdWrW3x3,1.98444,0,miopenConvolutionBwdWeightsAlgoDirect,<unused>;miopenConvolutionBwdWeightsAlgoImplicitGEMM:ConvHipImplicitGemmV4R1WrW,3.89359,0,miopenConvolutionBwdWeightsAlgoImplicitGEMM,512x64x64x3x3x256x64x64x2xNCHWxFP32x1x1x1x1x1x1x1x0;miopenConvolutionBwdWeightsAlgoWinograd:ConvBinWinogradRxSf2x3,4.14374,0,miopenConvolutionBwdWeightsAlgoWinograd,512x64x64x3x3x256x64x64x2xNCHWxFP32x1x1x1x1x1x1x1x0;miopenConvolutionBwdWeightsAlgoGEMM:gemm,4.43508,37748736,MIOpenGEMM,1_0_4096_4096_2304_2304_512_4096
256-32-32-3x3-256-32-32-2-1x1-1x1-1x1-0-NCHW-FP32-B=miopenConvolutionBwdDataAlgoWinograd:ConvBinWinograd3x3U,0.126209,0,miopenConvolutionBwdDataAlgoWinograd,<unused>
6-128-128-1x1-512-128-128-2-0x0-1x1-1x1-0-NCHW-FP32-B=miopenConvolutionBwdDataAlgoDirect:ConvOclDirectFwd1x1,0.219842,0,miopenConvolutionBwdDataAlgoDirect,<unused>;miopenConvolutionBwdDataAlgoGEMM:gemm,0.267687,0,MIOpenGEMM,0_1_16384_512_16384_16384_512_6;miopenConvolutionBwdDataAlgoWinograd:ConvBinWinogradRxSf2x3,0.446606,0,miopenConvolutionBwdDataAlgoWinograd,<unused>
512-256-256-1x1-6-256-256-2-0x0-1x1-1x1-0-NCHW-FP32-F=miopenConvolutionFwdAlgoWinograd:ConvBinWinogradRxSf3x2,0.927897,0,miopenConvolutionFwdAlgoWinograd,<unused>;miopenConvolutionFwdAlgoDirect:ConvOclDirectFwd1x1,1.08721,0,miopenConvolutionFwdAlgoDirect,<unused>;miopenConvolutionFwdAlgoGEMM:GemmFwd1x1_0_1,12.7361,0,MIOpenGEMM,0_0_65536_512_65536_65536_6_512
512-64-64-3x3-256-64-64-2-1x1-1x1-1x1-0-NCHW-FP32-B=miopenConvolutionBwdDataAlgoWinograd:ConvBinWinogradRxS,0.783897,0,miopenConvolutionBwdDataAlgoWinograd,<unused>
448-8-8-3x1-384-8-8-64-1x0-1x1-1x1-0-NCHW-FP32-W=miopenConvolutionBwdWeightsAlgoDirect:ConvOclBwdWrW53,0.621408,0,miopenConvolutionBwdWeightsAlgoDirect,<unused>;miopenConvolutionBwdWeightsAlgoImplicitGEMM:ConvHipImplicitGemmV4R1WrW,0.891956,0,miopenConvolutionBwdWeightsAlgoImplicitGEMM,448x8x8x1x3x384x8x8x64xNCHWxFP32x0x1x1x1x1x1x1x0;miopenConvolutionBwdWeightsAlgoWinograd:ConvBinWinogradRxSf2x3,0.90572,0,miopenConvolutionBwdWeightsAlgoWinograd,448x8x8x1x3x384x8x8x64xNCHWxFP32x0x1x1x1x1x1x1x0;miopenConvolutionBwdWeightsAlgoGEMM:gemm,2.3196,294912,MIOpenGEMM,1_0_64_64_1152_1152_448_64
256-256-256-1x1-512-128-128-2-0x0-2x2-1x1-0-NCHW-FP32-F=miopenConvolutionFwdAlgoImplicitGEMM:ConvHipImplicitGemmV4R4Fwd,1.64273,0,miopenConvolutionFwdAlgoImplicitGEMM,256x256x256x1x1x512x128x128x2xNCHWxFP32x0x0x2x2x1x1x1x1;miopenConvolutionFwdAlgoGEMM:GemmFwd1x1_0_2,1.98379,100663296,MIOpenGEMM,0_0_32768_256_32768_32768_512_256;miopenConvolutionFwdAlgoDirect:ConvOclDirectFwd1x1,2.54956,0,miopenConvolutionFwdAlgoDirect,<unused>;miopenConvolutionFwdAlgoWinograd:ConvBinWinogradRxS,6.33901,0,miopenConvolutionFwdAlgoWinograd,<unused>
256-32-32-3x3-256-32-32-2-1x1-1x1-1x1-0-NCHW-FP32-F=miopenConvolutionFwdAlgoWinograd:ConvBinWinogradRxS,0.129903,0,miopenConvolutionFwdAlgoWinograd,<unused>
128-128-128-1x1-512-128-128-2-0x0-1x1-1x1-0-NCHW-FP32-B=miopenConvolutionBwdDataAlgoGEMM:gemm,0.684191,0,MIOpenGEMM,0_1_16384_512_16384_16384_512_128;miopenConvolutionBwdDataAlgoImplicitGEMM:ConvHipImplicitGemmBwdDataV1R1,0.946439,0,miopenConvolutionBwdDataAlgoImplicitGEMM,128x128x128x1x1x512x128x128x2xNCHWxFP32x0x0x1x1x1x1x1x0;miopenConvolutionBwdDataAlgoWinograd:ConvBinWinogradRxSf3x2,0.975146,0,miopenConvolutionBwdDataAlgoWinograd,<unused>;miopenConvolutionBwdDataAlgoDirect:ConvOclDirectFwd1x1,1.18017,0,miopenConvolutionBwdDataAlgoDirect,<unused>
12-256-256-1x1-512-256-256-2-0x0-1x1-1x1-0-NCHW-FP32-W=miopenConvolutionBwdWeightsAlgoGEMM:gemm,1.77754,0,MIOpenGEMM,1_0_65536_65536_512_512_12_65536;miopenConvolutionBwdWeightsAlgoDirect:ConvOclBwdWrW53,6.13927,49152,miopenConvolutionBwdWeightsAlgoDirect,<unused>;miopenConvolutionBwdWeightsAlgoWinograd:ConvBinWinogradRxSf2x3,6.47545,0,miopenConvolutionBwdWeightsAlgoWinograd,12x256x256x1x1x512x256x256x2xNCHWxFP32x0x0x1x1x1x1x1x0
512-32-32-1x1-6-32-32-2-0x0-1x1-1x1-0-NCHW-FP32-F=miopenConvolutionFwdAlgoDirect:ConvOclDirectFwd1x1,0.045447,0,miopenConvolutionFwdAlgoDirect,<unused>;miopenConvolutionFwdAlgoGEMM:GemmFwd1x1_0_1,0.050252,0,MIOpenGEMM,0_0_1024_512_1024_1024_6_512;miopenConvolutionFwdAlgoWinograd:ConvBinWinogradRxSf2x3,0.122378,0,miopenConvolutionFwdAlgoWinograd,<unused>
64-147-147-3x3-96-73-73-64-0x0-2x2-1x1-0-NCHW-FP32-F=miopenConvolutionFwdAlgoWinograd:ConvBinWinogradRxS,6.48105,0,miopenConvolutionFwdAlgoWinograd,<unused>;miopenConvolutionFwdAlgoGEMM:GemmFwdRest,8.41827,12278016,MIOpenGEMM,0_0_5329_576_5329_5329_96_576;miopenConvolutionFwdAlgoDirect:ConvOclDirectFwd,19.2325,0,miopenConvolutionFwdAlgoDirect,<unused>
256-64-64-3x3-512-64-64-2-1x1-1x1-1x1-0-NCHW-FP32-F=miopenConvolutionFwdAlgoWinograd:ConvBinWinogradRxSf2x3,0.833016,0,miopenConvolutionFwdAlgoWinograd,<unused>
512-128-128-1x1-6-128-128-2-0x0-1x1-1x1-0-NCHW-FP32-F=miopenConvolutionFwdAlgoDirect:ConvOclDirectFwd1x1,0.240249,0,miopenConvolutionFwdAlgoDirect,<unused>;miopenConvolutionFwdAlgoWinograd:ConvBinWinogradRxSf3x2,0.261654,0,miopenConvolutionFwdAlgoWinograd,<unused>;miopenConvolutionFwdAlgoGEMM:GemmFwd1x1_0_1,3.31227,0,MIOpenGEMM,0_0_16384_512_16384_16384_6_512
256-14-14-3x3-256-14-14-400-1x1-1x1-1x1-0-NCHW-FP32-F=miopenConvolutionFwdAlgoWinograd:ConvBinWinogradRxSf2x3,3.93266,0,miopenConvolutionFwdAlgoWinograd,<unused>
256-256-256-1x1-64-256-256-2-0x0-1x1-1x1-0-NCHW-FP32-W=miopenConvolutionBwdWeightsAlgoDirect:ConvOclBwdWrW1x1,1.42472,0,miopenConvolutionBwdWeightsAlgoDirect,<unused>
12-256-256-1x1-512-256-256-2-0x0-1x1-1x1-0-NCHW-FP32-B=miopenConvolutionBwdDataAlgoGEMM:gemm,1.37627,0,MIOpenGEMM,0_1_65536_512_65536_65536_512_12;miopenConvolutionBwdDataAlgoDirect:ConvOclDirectFwd1x1,1.59255,0,miopenConvolutionBwdDataAlgoDirect,<unused>;miopenConvolutionBwdDataAlgoWinograd:ConvBinWinogradRxSf2x3,1.87561,0,miopenConvolutionBwdDataAlgoWinograd,<unused>;miopenConvolutionBwdDataAlgoImplicitGEMM:ConvHipImplicitGemmBwdDataV1R1,2.17572,0,miopenConvolutionBwdDataAlgoImplicitGEMM,12x256x256x1x1x512x256x256x2xNCHWxFP32x0x0x1x1x1x1x1x0
512-128-128-1x1-128-128-128-2-0x0-1x1-1x1-0-NCHW-FP32-F=miopenConvolutionFwdAlgoDirect:ConvOclDirectFwd1x1,0.616049,0,miopenConvolutionFwdAlgoDirect,<unused>;miopenConvolutionFwdAlgoWinograd:ConvBinWinogradRxSf3x2,0.967776,0,miopenConvolutionFwdAlgoWinograd,<unused>;miopenConvolutionFwdAlgoImplicitGEMM:ConvHipImplicitGemmV4R4Fwd,1.31906,0,miopenConvolutionFwdAlgoImplicitGEMM,512x128x128x1x1x128x128x128x2xNCHWxFP32x0x0x1x1x1x1x1x1;miopenConvolutionFwdAlgoGEMM:GemmFwd1x1_0_1,1.3282,0,MIOpenGEMM,0_0_16384_512_16384_16384_128_512
256-64-64-1x1-512-128-128-2-0x0-2x2-1x1-0-NCHW-FP32-W=miopenConvolutionBwdWeightsAlgoDirect:ConvOclBwdWrW1x1,0.853364,16777216,miopenConvolutionBwdWeightsAlgoDirect,<unused>;miopenConvolutionBwdWeightsAlgoGEMM:gemm,1.17752,8388608,MIOpenGEMM,1_0_4096_4096_512_512_256_4096;miopenConvolutionBwdWeightsAlgoImplicitGEMM:ConvHipImplicitGemmV4R1WrW,2.12797,0,miopenConvolutionBwdWeightsAlgoImplicitGEMM,256x64x64x1x1x512x128x128x2xNCHWxFP32x0x0x2x2x1x1x1x0
64-256-256-1x1-256-256-256-2-0x0-1x1-1x1-0-NCHW-FP32-W=miopenConvolutionBwdWeightsAlgoDirect:ConvOclBwdWrW1x1,1.41663,0,miopenConvolutionBwdWeightsAlgoDirect,<unused>
512-32-32-3x3-512-32-32-2-1x1-1x1-1x1-0-NCHW-FP32-W=miopenConvolutionBwdWeightsAlgoDirect:ConvOclBwdWrW53,1.07379,0,miopenConvolutionBwdWeightsAlgoDirect,<unused>;miopenConvolutionBwdWeightsAlgoImplicitGEMM:ConvHipImplicitGemmV4R1WrW,1.51049,0,miopenConvolutionBwdWeightsAlgoImplicitGEMM,512x32x32x3x3x512x32x32x2xNCHWxFP32x1x1x1x1x1x1x1x0;miopenConvolutionBwdWeightsAlgoGEMM:gemm,1.92056,18874368,MIOpenGEMM,1_0_1024_1024_4608_4608_512_1024;miopenConvolutionBwdWeightsAlgoWinograd:ConvBinWinogradRxSf2x3,2.27077,0,miopenConvolutionBwdWeightsAlgoWinograd,512x32x32x3x3x512x32x32x2xNCHWxFP32x1x1x1x1x1x1x1x0
256-64-64-3x3-256-64-64-2-1x1-1x1-1x1-0-NCHW-FP32-W=miopenConvolutionBwdWeightsAlgoDirect:ConvAsmBwdWrW3x3,1.08367,0,miopenConvolutionBwdWeightsAlgoDirect,<unused>;miopenConvolutionBwdWeightsAlgoGEMM:gemm,2.02039,37748736,MIOpenGEMM,1_0_4096_4096_2304_2304_256_4096;miopenConvolutionBwdWeightsAlgoWinograd:ConvBinWinogradRxSf2x3,2.09936,0,miopenConvolutionBwdWeightsAlgoWinograd,256x64x64x3x3x256x64x64x2xNCHWxFP32x1x1x1x1x1x1x1x0;miopenConvolutionBwdWeightsAlgoImplicitGEMM:ConvHipImplicitGemmV4R1WrW,2.21295,0,miopenConvolutionBwdWeightsAlgoImplicitGEMM,256x64x64x3x3x256x64x64x2xNCHWxFP32x1x1x1x1x1x1x1x0
1024-1-1-7x7-256-7-7-400-0x0-1x1-1x1-0-NCHW-FP32-B=miopenConvolutionBwdDataAlgoWinograd:ConvBinWinogradRxSf3x2,50.6254,0,miopenConvolutionBwdDataAlgoWinograd,<unused>;miopenConvolutionBwdDataAlgoDirect:ConvOclDirectFwd,152.577,0,miopenConvolutionBwdDataAlgoDirect,<unused>;miopenConvolutionBwdDataAlgoGEMM:gemm,1274.68,50176,MIOpenGEMM,0_1_1_12544_1_1_12544_1024
256-256-256-1x1-64-256-256-2-0x0-1x1-1x1-0-NCHW-FP32-B=miopenConvolutionBwdDataAlgoWinograd:ConvBinWinogradRxSf3x2,1.3633,0,miopenConvolutionBwdDataAlgoWinograd,<unused>;miopenConvolutionBwdDataAlgoGEMM:gemm,1.50194,0,MIOpenGEMM,0_1_65536_64_65536_65536_64_256;miopenConvolutionBwdDataAlgoDirect:ConvOclDirectFwd1x1,7.9294,0,miopenConvolutionBwdDataAlgoDirect,<unused>;miopenConvolutionBwdDataAlgoImplicitGEMM:ConvHipImplicitGemmBwdDataV1R1,9.70835,0,miopenConvolutionBwdDataAlgoImplicitGEMM,256x256x256x1x1x64x256x256x2xNCHWxFP32x0x0x1x1x1x1x1x0
256-256-256-3x3-256-256-256-2-1x1-1x1-1x1-0-NCHW-FP32-W=miopenConvolutionBwdWeightsAlgoImplicitGEMM:ConvHipImplicitGemmV4R1WrW,31.9072,0,miopenConvolutionBwdWeightsAlgoImplicitGEMM,256x256x256x3x3x256x256x256x2xNCHWxFP32x1x1x1x1x1x1x1x0;miopenConvolutionBwdWeightsAlgoWinograd:ConvBinWinogradRxSf2x3,36.4614,0,miopenConvolutionBwdWeightsAlgoWinograd,256x256x256x3x3x256x256x256x2xNCHWxFP32x1x1x1x1x1x1x1x0;miopenConvolutionBwdWeightsAlgoGEMM:gemm,39.9895,603979776,MIOpenGEMM,1_0_65536_65536_2304_2304_256_65536;miopenConvolutionBwdWeightsAlgoDirect:ConvOclBwdWrW53,57.5434,0,miopenConvolutionBwdWeightsAlgoDirect,<unused>
512-32-32-3x3-512-32-32-2-1x1-1x1-1x1-0-NCHW-FP32-B=miopenConvolutionBwdDataAlgoWinograd:ConvBinWinogradRxSf2x3,0.445704,0,miopenConvolutionBwdDataAlgoWinograd,<unused>
256-64-64-3x3-256-64-64-2-1x1-1x1-1x1-0-NCHW-FP32-B=miopenConvolutionBwdDataAlgoWinograd:ConvBinWinogradRxS,0.40806,0,miopenConvolutionBwdDataAlgoWinograd,<unused>
12-128-128-1x1-512-128-128-2-0x0-1x1-1x1-0-NCHW-FP32-W=miopenConvolutionBwdWeightsAlgoGEMM:gemm,0.368229,0,MIOpenGEMM,1_0_16384_16384_512_512_12_16384;miopenConvolutionBwdWeightsAlgoDirect:ConvAsmBwdWrW1x1,0.58763,0,miopenConvolutionBwdWeightsAlgoDirect,<unused>;miopenConvolutionBwdWeightsAlgoWinograd:ConvBinWinogradRxSf2x3,1.49007,0,miopenConvolutionBwdWeightsAlgoWinograd,12x128x128x1x1x512x128x128x2xNCHWxFP32x0x0x1x1x1x1x1x0
