src/kernels/gfx900_64.HIP.2_5_0.ufdb.txt
1-1-1-2x2-1-1-1-1-0x0-1x1-1x1-0-NCHW-FP32-F=miopenConvolutionFwdAlgoWinograd:ConvBinWinogradRxSf2x3,0.053631,0,miopenConvolutionFwdAlgoWinograd,<unused>;miopenConvolutionFwdAlgoGEMM:gemm,0.034816,16,rocBlas,<unused>
1-1-1-2x2-1-1-1-1-0x0-1x1-1x1-0-NCHW-FP32-B=miopenConvolutionBwdDataAlgoGEMM:gemm,0.036741,16,rocBlas,<unused>;miopenConvolutionBwdDataAlgoWinograd:ConvBinWinogradRxSf2x3,0.053483,0,miopenConvolutionBwdDataAlgoWinograd,<unused>
1-1-1-2x2-1-1-1-1-0x0-1x1-1x1-0-NCHW-FP32-W=miopenConvolutionBwdWeightsAlgoWinograd:ConvBinWinogradRxSf2x3,0.05378,0,miopenConvolutionBwdWeightsAlgoWinograd,1x1x1x2x2x1x1x1x1xNCHWxFP32x0x0x1x1x1x1x1x0;miopenConvolutionBwdWeightsAlgoGEMM:gemm,0.029186,16,rocBlas,<unused>
64-56-56-1x1-256-56-56-64-0x0-1x1-1x1-0-NCHW-FP32-F=miopenConvolutionFwdAlgoImplicitGEMM:ConvAsmImplicitGemmV4R1DynamicFwd,4.72488,0,miopenConvolutionFwdAlgoImplicitGEMM,<unused>
256-34-34-3x3-256-32-32-64-0x0-1x1-1x1-0-NCHW-FP32-F=miopenConvolutionFwdAlgoImplicitGEMM:ConvAsmImplicitGemmV4R1DynamicFwd,13.1792,0,miopenConvolutionFwdAlgoImplicitGEMM,<unused>
128-35-35-3x3-128-17-17-128-0x0-2x2-1x1-0-NCHW-FP32-F=miopenConvolutionFwdAlgoImplicitGEMM:ConvAsmImplicitGemmV4R1DynamicFwd,2.46954,0,miopenConvolutionFwdAlgoImplicitGEMM,<unused>
1536-8-8-1x1-256-8-8-64-0x0-1x1-1x1-0-NCHW-FP32-F=miopenConvolutionFwdAlgoImplicitGEMM:ConvAsmImplicitGemmV4R1DynamicFwd_1x1,0.744615,0,miopenConvolutionFwdAlgoImplicitGEMM,<unused>
48-7-7-5x5-128-7-7-128-2x2-1x1-1x1-0-NCHW-FP32-F=miopenConvolutionFwdAlgoImplicitGEMM:ConvAsmImplicitGemmV4R1DynamicFwd,0.616907,0,miopenConvolutionFwdAlgoImplicitGEMM,<unused>
128-17-17-1x7-128-17-17-128-0x3-1x1-1x1-0-NCHW-FP32-F=miopenConvolutionFwdAlgoImplicitGEMM:ConvAsmImplicitGemmV4R1DynamicFwd,1.83057,0,miopenConvolutionFwdAlgoImplicitGEMM,<unused>
256-28-28-1x1-128-28-28-128-0x0-1x1-1x1-0-NCHW-FP32-F=miopenConvolutionFwdAlgoImplicitGEMM:ConvAsmImplicitGemmV4R1DynamicFwd_1x1,2.38955,0,miopenConvolutionFwdAlgoImplicitGEMM,<unused>
768-17-17-1x1-128-17-17-128-0x0-1x1-1x1-0-NCHW-FP32-F=miopenConvolutionFwdAlgoImplicitGEMM:ConvAsmImplicitGemmV4R1DynamicFwd_1x1,2.80082,0,miopenConvolutionFwdAlgoImplicitGEMM,<unused>
1-1-2-2-1x1x1-1-1-2-2-1-0x0x0-1x1x1-1x1x1-0-NCHW-FP32-F=miopenConvolutionFwdAlgoGEMM:gemm,0.022667,0,rocBlas,<unused>
1-1-2-2-1x1x1-1-1-2-2-1-0x0x0-1x1x1-1x1x1-0-NCHW-FP32-B=miopenConvolutionBwdDataAlgoGEMM:gemm,0.023409,0,rocBlas,<unused>
