src/kernels/gfx906_60.cd.pdb.txt
64-56-56-1x1-64-56-56-64-0x0-1x1-1x1-0-NCHW-FP16-F=ConvAsm1x1U:1,8,2,32,1,4,1,4;ConvOclDirectFwd1x1:1,128,1,1,0,4,16,4,0
512-14-14-1x1-64-14-14-8-0x0-1x1-1x1-0-NCHW-FP16-F=ConvAsm1x1U:1,8,2,32,1,4,4,1;ConvOclDirectFwd1x1:1,64,1,1,0,4,4,4,0
128-28-28-1x1-256-28-28-256-0x0-1x1-1x1-0-NCHW-FP16-W=ConvAsmBwdWrW1x1:2,8,4,8,2,1,4,4,0,1
128-14-14-3x3-128-28-28-512-1x1-2x2-1x1-0-NCHW-FP16-B=ConvOclDirectFwd:32,32,32,32,1,1,4,2,2
128-14-14-3x3-128-28-28-64-1x1-2x2-1x1-0-NCHW-FP16-B=ConvOclDirectFwd:16,16,32,32,2,2,4,2,2
128-54-54-1x1-32-54-54-512-0x0-1x1-1x1-0-NCHW-FP16-W=ConvAsmBwdWrW1x1:4,4,2,4,2,1,4,4,0,1
864-14-14-1x1-192-14-14-16-0x0-1x1-1x1-0-NCHW-FP32-F=ConvAsm1x1U:4,8,7,32,1,2,2,2;ConvActivAsm1x1U:3,16,3,16,2,3;ConvOclDirectFwd1x1:1,64,1,1,1,4,16,2048,0
288-35-35-1x1-64-35-35-16-0x0-1x1-1x1-0-NCHW-FP32-F=ConvAsm1x1U:3,16,5,64,1,2,2,1;ConvActivAsm1x1U:3,16,5,64,1,2;ConvOclDirectFwd1x1:1,64,1,1,1,0,16,2048,0
1104-14-14-1x1-192-14-14-16-0x0-1x1-1x1-0-NCHW-FP16-F=ConvAsm1x1U:2,8,4,64,1,4,2,2;ConvOclDirectFwd1x1:1,64,1,1,0,4,8,4,0
256-35-35-1x1-64-35-35-16-0x0-1x1-1x1-0-NCHW-FP32-F=ConvAsm1x1U:1,16,1,64,4,2,2,1;ConvActivAsm1x1U:2,16,5,32,1,2;ConvOclDirectFwd1x1:1,64,1,1,1,4,16,64,0
512-14-14-1x1-128-14-14-32-0x0-1x1-1x1-0-NCHW-FP16-F=ConvAsm1x1U:2,8,4,64,1,4,2,4;ConvOclDirectFwd1x1:1,64,1,1,0,4,8,4,0
832-7-7-1x1-32-7-7-16-0x0-1x1-1x1-0-NCHW-FP32-F=ConvAsm1x1U:1,8,1,64,1,4,4,2;ConvActivAsm1x1U:1,16,1,16,1,4;ConvOclDirectFwd1x1:1,64,1,1,1,0,16,128,0
1280-8-8-1x1-192-8-8-4-0x0-1x1-1x1-0-NCHW-FP16-F=ConvAsm1x1U:1,8,2,16,1,4,4,1;ConvOclDirectFwd1x1:1,128,1,1,0,1,4,8,0
192-28-28-1x1-288-28-28-16-0x0-1x1-1x1-0-NCHW-FP16-B=ConvAsm1x1U:1,16,2,16,1,2,2,2;ConvOclDirectFwd1x1:1,128,1,1,0,4,16,4,0
128-56-56-3x3-32-56-56-64-1x1-1x1-1x1-0-NCHW-FP16-F=ConvOclDirectFwd:32,8,32,32,1,4,8,1,2
64-64-128-5x5-32-64-128-1-2x2-1x1-1x1-0-NCHW-FP16-B=ConvOclDirectFwd:8,32,16,32,2,1,2,4,1
32-27-27-1x1-128-27-27-16-0x0-1x1-1x1-0-NCHW-FP16-W=ConvAsmBwdWrW1x1:4,4,2,4,2,1,4,2,0,1
384-27-27-1x1-48-27-27-64-0x0-1x1-1x1-0-NCHW-FP32-W=ConvAsmBwdWrW1x1:4,4,4,4,4,1,2,4,0,1
128-27-27-3x3-128-27-27-1-1x1-1x1-1x1-0-NCHW-FP16-B=ConvOclDirectFwd:16,16,16,16,1,1,2,4,1
192-35-35-1x1-384-35-35-8-0x0-1x1-1x1-0-NCHW-FP16-W=ConvAsmBwdWrW1x1:2,8,4,8,2,1,2,4,0,1
2048-7-7-1x1-512-7-7-512-0x0-1x1-1x1-0-NCHW-FP16-F=ConvAsm1x1U:2,8,4,16,2,4,1,4;ConvOclDirectFwd1x1:1,128,1,1,0,1,16,4,0
96-56-56-1x1-128-56-56-512-0x0-1x1-1x1-0-NCHW-FP16-F=ConvAsm1x1U:1,8,2,32,2,4,1,4;ConvOclDirectFwd1x1:1,128,1,1,0,4,16,4,0
128-28-28-3x3-96-28-28-1-1x1-1x1-1x1-0-NCHW-FP16-B=ConvOclDirectFwd:16,16,16,16,1,1,2,2,1
16-14-14-1x1-480-14-14-256-0x0-1x1-1x1-0-NCHW-FP32-W=ConvAsmBwdWrW1x1:4,4,4,2,4,1,4,4,0,2
96-14-14-1x1-576-14-14-64-0x0-1x1-1x1-0-NCHW-FP32-B=ConvAsm1x1U:1,32,1,32,2,1,1,1;ConvOclDirectFwd1x1:1,128,1,1,0,4,16,4,0
256-56-56-1x1-128-56-56-16-0x0-1x1-1x1-0-NCHW-FP32-W=ConvAsmBwdWrW1x1:4,4,4,4,4,1,2,4,0,2
64-73-73-1x1-160-73-73-256-0x0-1x1-1x1-0-NCHW-FP32-W=ConvAsmBwdWrW1x1:4,4,4,4,4,1,4,4,0,2
64-112-112-3x3-128-112-112-16-1x1-1x1-1x1-0-NCHW-FP32-W=ConvAsmBwdWrW3x3:0,1,16,4,3,1
112-14-14-1x1-512-14-14-32-0x0-1x1-1x1-0-NCHW-FP16-B=ConvAsm1x1U:1,16,2,16,1,2,2,2;ConvOclDirectFwd1x1:1,64,1,1,0,4,8,4,0
144-14-14-1x1-512-14-14-64-0x0-1x1-1x1-0-NCHW-FP32-B=ConvAsm1x1U:1,16,1,32,2,2,1,8;ConvOclDirectFwd1x1:1,128,1,1,0,4,16,4,0
384-28-28-1x1-128-28-28-32-0x0-1x1-1x1-0-NCHW-FP32-B=ConvAsm1x1U:1,16,1,16,1,2,1,4;ConvOclDirectFwd1x1:16,64,32,32,0,2,16,4,1
3-2-2-3x3-4-3-3-256-1x1-2x2-1x1-0-NCHW-FP32-W=ConvAsmBwdWrW3x3:0,0,16,1,3,6
64-27-27-3x3-256-27-27-64-1x1-1x1-1x1-0-NCHW-FP16-W=ConvAsmBwdWrW3x3:0,0,8,2,2,1
2048-8-8-1x1-384-8-8-32-0x0-1x1-1x1-0-NCHW-FP32-F=ConvAsm1x1U:4,8,4,16,2,4,1,4;ConvActivAsm1x1U:2,16,2,32,4,2;ConvOclDirectFwd1x1:1,64,1,1,1,0,16,2048,0
128-7-7-1x1-832-7-7-128-0x0-1x1-1x1-0-NCHW-FP16-B=ConvAsm1x1U:1,16,2,32,1,2,1,2;ConvOclDirectFwd1x1:1,64,1,1,0,1,8,4,0
384-8-8-1x1-1536-8-8-32-0x0-1x1-1x1-0-NCHW-FP32-B=ConvAsm1x1U:1,16,1,64,2,2,1,4;ConvOclDirectFwd1x1:1,64,1,1,0,2,16,4,0
256-56-56-3x3-128-56-56-32-1x1-1x1-1x1-0-NCHW-FP32-W=ConvAsmBwdWrW3x3:0,1,8,4,2,1
224-56-56-1x1-128-56-56-128-0x0-1x1-1x1-0-NCHW-FP16-F=ConvAsm1x1U:2,8,4,16,1,4,1,8;ConvOclDirectFwd1x1:1,256,1,1,0,4,16,4,0
512-28-28-3x3-512-28-28-64-1x1-1x1-1x1-0-NCHW-FP16-B=ConvOclDirectFwd:32,8,32,32,1,4,8,2,1
512-7-7-1x1-2048-7-7-16-0x0-1x1-1x1-0-NCHW-FP16-B=ConvAsm1x1U:2,16,4,16,1,2,4,1;ConvOclDirectFwd1x1:1,64,1,1,0,1,8,4,0
288-14-14-3x3-144-14-14-256-1x1-1x1-1x1-0-NCHW-FP16-W=ConvAsmBwdWrW3x3:0,1,8,2,8,4
512-14-14-1x1-128-28-28-16-0x0-2x2-1x1-0-NCHW-FP16-B=ConvAsm1x1U:2,8,4,64,1,4,4,4;ConvOclDirectFwd1x1:1,64,1,1,0,1,16,8,0
32-14-14-5x5-64-14-14-8-2x2-1x1-1x1-0-NCHW-FP32-F=ConvOclDirectFwdFused:8,16,16,16,2,1,2,4,2;ConvOclDirectFwd:16,16,16,16,1,1,4,2,2
480-14-14-1x1-16-14-14-8-0x0-1x1-1x1-0-NCHW-FP16-F=ConvAsm1x1U:1,8,2,16,1,4,4,1;ConvOclDirectFwd1x1:1,128,1,1,0,1,4,4,0
832-7-7-1x1-32-7-7-4-0x0-1x1-1x1-0-NCHW-FP32-F=ConvAsm1x1U:1,8,1,32,1,4,4,2;ConvActivAsm1x1U:1,16,1,16,1,3;ConvOclDirectFwd1x1:1,64,1,1,1,0,16,64,0
16-14-14-1x1-480-14-14-8-0x0-1x1-1x1-0-NCHW-FP32-W=ConvAsmBwdWrW1x1:4,4,2,2,2,1,1,4,0,1
1024-17-17-1x1-192-17-17-8-0x0-1x1-1x1-0-NCHW-FP16-F=ConvAsm1x1U:2,8,4,16,1,4,2,2;ConvOclDirectFwd1x1:1,64,1,1,0,1,4,8,0
64-224-224-3x3-64-224-224-256-1x1-1x1-1x1-0-NCHW-FP16-B=ConvOclDirectFwd:16,16,32,32,2,2,8,4,1
32-28-28-3x3-128-28-28-256-1x1-1x1-1x1-0-NCHW-FP16-W=ConvAsmBwdWrW3x3:0,0,8,4,2,4
384-27-27-1x1-48-27-27-128-0x0-1x1-1x1-0-NCHW-FP16-B=ConvAsm1x1U:3,8,6,64,1,4,1,2;ConvOclDirectFwd1x1:1,256,1,1,0,1,16,4,0
96-35-35-1x1-384-35-35-256-0x0-1x1-1x1-0-NCHW-FP16-F=ConvAsm1x1U:2,16,4,32,1,2,1,4;ConvOclDirectFwd1x1:1,256,1,1,0,1,32,4,0
128-17-17-1x1-1024-17-17-4-0x0-1x1-1x1-0-NCHW-FP16-B=ConvAsm1x1U:1,16,2,16,1,2,2,2;ConvOclDirectFwd1x1:1,64,1,1,0,1,8,4,0
6-28-28-5x5-3-32-32-64-0x0-1x1-1x1-0-NCHW-FP16-B=ConvOclDirectFwd:16,16,32,32,2,2,2,1,2
128-14-14-1x1-352-14-14-32-0x0-1x1-1x1-0-NCHW-FP32-F=ConvAsm1x1U:3,16,3,16,2,2,1,4;ConvOclDirectFwd1x1:1,64,1,1,1,4,16,2048,0
768-14-14-1x1-128-14-14-512-0x0-1x1-1x1-0-NCHW-FP32-B=ConvAsm1x1U:1,32,1,16,2,1,2,2;ConvOclDirectFwd1x1:1,256,1,1,0,2,16,4,0
160-7-7-1x1-832-7-7-1-0x0-1x1-1x1-0-NCHW-FP32-W=ConvAsmBwdWrW1x1:1,16,2,2,8,1,1,2,0,1
32-7-7-1x1-832-7-7-16-0x0-1x1-1x1-0-NCHW-FP16-W=ConvAsmBwdWrW1x1:4,4,2,4,2,1,1,2,0,1
128-28-28-1x1-512-28-28-128-0x0-1x1-1x1-0-NCHW-FP16-B=ConvAsm1x1U:1,16,2,16,1,2,1,4;ConvOclDirectFwd1x1:1,64,1,1,0,4,16,4,0
64-28-28-1x1-256-28-28-1-0x0-1x1-1x1-0-NCHW-FP32-B=ConvAsm1x1U:1,8,1,64,1,4,2,2;ConvOclDirectFwd1x1:1,256,1,1,0,1,4,4,0
704-14-14-1x1-128-14-14-128-0x0-1x1-1x1-0-NCHW-FP32-W=ConvAsmBwdWrW1x1:2,8,4,4,4,1,2,4,0,0
64-224-224-3x3-3-224-224-128-1x1-1x1-1x1-0-NCHW-FP32-B=ConvAsm3x3U:2,3,8;ConvOclDirectFwd:16,16,32,32,2,2,8,2,1
64-209-209-3x3-128-104-104-128-0x0-2x2-1x1-0-NCHW-FP32-F=ConvOclDirectFwd:8,16,16,16,2,1,8,2,2
64-112-112-7x7-3-225-225-256-2x2-2x2-1x1-0-NCHW-FP32-B=ConvOclDirectFwd:16,16,32,32,2,2,8,2,1
384-13-13-3x3-384-13-13-1024-1x1-1x1-1x1-0-NCHW-FP16-W=ConvAsmBwdWrW3x3:0,0,8,8,6,1
128-28-28-3x3-128-28-28-8-1x1-1x1-1x1-0-NCHW-FP16-B=ConvOclDirectFwd:16,16,32,32,2,2,4,2,2
192-7-7-1x1-1152-7-7-16-0x0-1x1-1x1-0-NCHW-FP32-W=ConvAsmBwdWrW1x1:1,16,2,8,4,1,2,4,0,0
64-54-54-3x3-64-54-54-1-1x1-1x1-1x1-0-NCHW-FP16-B=ConvOclDirectFwd:16,16,16,16,1,1,4,4,1
160-7-7-3x3-320-7-7-64-1x1-1x1-1x1-0-NCHW-FP16-F=ConvOclDirectFwdFused:8,8,8,8,1,1,8,4,2;ConvOclDirectFwd:8,8,8,8,1,1,8,4,2
256-56-56-3x3-128-56-56-64-1x1-1x1-1x1-0-NCHW-FP16-W=ConvAsmBwdWrW3x3:0,0,16,4,2,1
64-112-112-7x7-3-230-230-1-0x0-2x2-1x1-0-NCHW-FP32-B=ConvOclDirectFwd:16,32,32,32,2,1,1,4,1
64-55-55-1x1-64-55-55-4-0x0-1x1-1x1-0-NCHW-FP32-B=ConvAsm1x1U:1,16,1,64,1,2;ConvOclDirectFwd1x1:1,64,1,1,0,1,8,4,0
512-7-7-1x1-512-7-7-8-0x0-1x1-1x1-0-NCHW-FP16-B=ConvAsm1x1U:1,16,2,16,1,2,4,1;ConvOclDirectFwd1x1:1,64,1,1,0,1,4,4,0
512-7-7-1x1-1024-14-14-256-0x0-2x2-1x1-0-NCHW-FP32-B=ConvAsm1x1U:2,16,2,32,1,1,1,2;ConvOclDirectFwd1x1:1,128,1,1,0,1,32,4,0
192-7-7-1x1-1440-7-7-16-0x0-1x1-1x1-0-NCHW-FP32-W=ConvAsmBwdWrW1x1:1,16,2,8,4,1,1,4,0,1
128-56-56-3x3-32-56-56-512-1x1-1x1-1x1-0-NCHW-FP16-B=ConvOclDirectFwd:8,16,16,32,2,2,8,1,2
672-7-7-1x1-128-7-7-32-0x0-1x1-1x1-0-NCHW-FP32-B=ConvAsm1x1U:1,16,1,64,1,2,4,2;ConvOclDirectFwd1x1:1,256,1,1,0,1,4,8,0
384-27-27-1x1-64-27-27-512-0x0-1x1-1x1-0-NCHW-FP16-W=ConvAsmBwdWrW1x1:4,4,4,4,2,1,2,4,0,0
192-7-7-1x1-1104-7-7-16-0x0-1x1-1x1-0-NCHW-FP32-B=ConvAsm1x1U:1,16,1,64,2,1,4;ConvOclDirectFwd1x1:1,256,1,1,0,1,8,4,0
128-27-27-1x1-32-27-27-16-0x0-1x1-1x1-0-NCHW-FP16-F=ConvAsm1x1U:1,8,2,64,1,2,4,2;ConvOclDirectFwd1x1:1,128,1,1,0,1,4,8,0
128-54-54-1x1-32-54-54-128-0x0-1x1-1x1-0-NCHW-FP16-F=ConvAsm1x1U:1,8,2,64,1,4,1,4;ConvOclDirectFwd1x1:1,128,1,1,0,2,16,4,0
512-28-28-1x1-256-55-55-2-0x0-2x2-1x1-0-NCHW-FP32-W=ConvAsmBwdWrW1x1:2,8,4,4,4,1,2,4
128-28-28-1x1-160-28-28-16-0x0-1x1-1x1-0-NCHW-FP16-B=ConvAsm1x1U:1,16,2,16,1,2,2,2;ConvOclDirectFwd1x1:1,64,1,1,0,4,16,4,0
448-28-28-1x1-128-28-28-512-0x0-1x1-1x1-0-NCHW-FP32-B=ConvAsm1x1U:2,16,2,16,1,2,1,4;ConvOclDirectFwd1x1:1,128,1,1,0,4,16,4,0
128-17-17-1x1-768-17-17-64-0x0-1x1-1x1-0-NCHW-FP16-W=ConvAsmBwdWrW1x1:4,4,8,4,4,2,1,4,0,1
256-28-28-1x1-128-28-28-512-0x0-1x1-1x1-0-NCHW-FP16-F=ConvAsm1x1U:1,8,2,32,2,4,1,8;ConvOclDirectFwd1x1:1,64,1,1,0,4,16,4,0
1024-7-7-1x1-256-14-14-16-0x0-2x2-1x1-0-NCHW-FP32-B=ConvAsm1x1U:2,16,2,32,1,2,4,1;ConvOclDirectFwd1x1:1,64,1,1,0,1,8,8,0
240-28-28-1x1-192-28-28-16-0x0-1x1-1x1-0-NCHW-FP32-F=ConvAsm1x1U:3,16,5,32,1,2,1,1;ConvActivAsm1x1U:2,16,2,32,3,1;ConvOclDirectFwd1x1:1,64,1,1,1,4,16,2048,0
512-14-14-1x1-24-14-14-1-0x0-1x1-1x1-0-NCHW-FP16-F=ConvAsm1x1U:1,8,2,16,1,4,4,1;ConvOclDirectFwd1x1:1,256,1,1,0,4,4,4,0
512-14-14-3x3-512-7-7-512-1x1-2x2-1x1-0-NCHW-FP32-F=ConvOclDirectFwd:8,8,8,8,1,1,8,2,1
64-35-35-1x1-288-35-35-8-0x0-1x1-1x1-0-NCHW-FP16-B=ConvAsm1x1U:1,16,2,32,1,2,2,2;ConvOclDirectFwd1x1:1,64,1,1,0,1,4,8,0
16-14-14-1x1-480-14-14-128-0x0-1x1-1x1-0-NCHW-FP16-B=ConvAsm1x1U:1,16,2,64,1,2,1,2;ConvOclDirectFwd1x1:1,128,1,1,0,4,8,4,0
48-27-27-3x3-192-27-27-512-1x1-1x1-1x1-0-NCHW-FP32-W=ConvAsmBwdWrW3x3:0,0,8,4,6,4
768-7-7-1x1-128-7-7-16-0x0-1x1-1x1-0-NCHW-FP32-B=ConvAsm1x1U:1,8,1,64,1,4,4,2;ConvOclDirectFwd1x1:1,256,1,1,0,1,4,8,0
384-35-35-3x3-384-17-17-128-0x0-2x2-1x1-0-NCHW-FP32-F=ConvOclDirectFwd:8,32,32,32,4,1,8,1,1
128-27-27-3x3-128-27-27-8-1x1-1x1-1x1-0-NCHW-FP16-F=ConvOclDirectFwd:16,16,32,32,2,2,4,2,2
384-27-27-1x1-48-27-27-512-0x0-1x1-1x1-0-NCHW-FP32-B=ConvAsm1x1U:3,16,3,64,1,1,1,1;ConvOclDirectFwd1x1:1,64,1,1,0,1,16,4,0
64-54-54-3x3-16-54-54-32-1x1-1x1-1x1-0-NCHW-FP16-F=ConvOclDirectFwd:16,16,32,32,2,2,8,4,2
256-27-27-1x1-64-27-27-32-0x0-1x1-1x1-0-NCHW-FP16-W=ConvAsmBwdWrW1x1:4,4,8,4,2,1,4,4,0,1
32-417-417-3x3-64-208-208-64-0x0-2x2-1x1-0-NCHW-FP32-F=ConvOclDirectFwd:16,16,16,16,1,1,8,2,1
512-14-14-1x1-24-14-14-32-0x0-1x1-1x1-0-NCHW-FP16-F=ConvAsm1x1U:1,8,2,64,1,4,4,1;ConvOclDirectFwd1x1:1,64,1,1,0,4,4,4,0
96-54-54-1x1-16-54-54-512-0x0-1x1-1x1-0-NCHW-FP32-B=ConvAsm1x1U:2,16,2,64,4,1,1,1;ConvOclDirectFwd1x1:1,256,1,1,0,4,16,4,0
5-10-10-3x3-3-10-10-16-1x1-1x1-1x1-0-NCHW-FP32-B=ConvOclDirectFwd:16,8,16,16,1,2,1,4,2
528-14-14-1x1-160-14-14-256-0x0-1x1-1x1-0-NCHW-FP32-B=ConvAsm1x1U:1,32,1,16,2,1,4,1;ConvOclDirectFwd1x1:1,64,1,1,0,4,16,4,0
448-8-8-1x1-2048-8-8-64-0x0-1x1-1x1-0-NCHW-FP16-B=ConvAsm1x1U:1,16,2,32,1,2,1,8;ConvOclDirectFwd1x1:1,64,1,1,0,4,16,4,0
160-17-17-1x1-768-17-17-16-0x0-1x1-1x1-0-NCHW-FP32-W=ConvAsmBwdWrW1x1:2,8,4,8,4,1,2,4,0,1
128-7-7-1x1-960-7-7-64-0x0-1x1-1x1-0-NCHW-FP16-F=ConvAsm1x1U:2,8,4,16,1,4,1,2;ConvOclDirectFwd1x1:1,64,1,1,0,1,8,4,0
64-147-147-3x3-32-147-147-256-1x1-1x1-1x1-0-NCHW-FP32-W=ConvAsmBwdWrW3x3:0,1,16,4,1,8
128-54-54-3x3-32-54-54-16-1x1-1x1-1x1-0-NCHW-FP16-F=ConvOclDirectFwd:16,16,32,32,2,2,8,2,2
24-10-10-3x3-512-10-10-32-1x1-1x1-1x1-0-NCHW-FP32-W=ConvAsmBwdWrW3x3:0,1,8,2,3,2
64-128-256-1x1-192-128-256-1-0x0-1x1-1x1-0-NCHW-FP32-B=ConvOclDirectFwd1x1:1,256,1,1,0,2,16,4,0
256-27-27-1x1-64-27-27-512-0x0-1x1-1x1-0-NCHW-FP32-B=ConvAsm1x1U:1,32,1,64,1,1,1,2;ConvOclDirectFwd1x1:1,256,1,1,0,1,32,4,0
2048-8-8-1x1-192-8-8-8-0x0-1x1-1x1-0-NCHW-FP16-F=ConvAsm1x1U:1,8,2,16,1,4,4,1;ConvOclDirectFwd1x1:1,128,1,1,0,1,4,4,0
256-56-56-1x1-64-56-56-2-0x0-1x1-1x1-0-NCHW-FP32-W=ConvAsmBwdWrW1x1:4,4,2,2,2,1,1,4,0,1
128-14-14-1x1-704-14-14-128-0x0-1x1-1x1-0-NCHW-FP16-B=ConvAsm1x1U:1,16,2,16,1,2,1,4;ConvOclDirectFwd1x1:1,256,1,1,0,4,16,4,0
32-14-14-1x1-512-14-14-512-0x0-1x1-1x1-0-NCHW-FP32-B=ConvAsm1x1U:1,16,1,32,1,2,1,4;ConvOclDirectFwd1x1:1,64,1,1,0,2,32,4,0
128-14-14-1x1-928-14-14-128-0x0-1x1-1x1-0-NCHW-FP16-F=ConvAsm1x1U:2,8,4,64,1,4,1,8;ConvOclDirectFwd1x1:1,256,1,1,0,4,8,4,0
256-56-56-3x3-128-56-56-64-1x1-1x1-1x1-0-NCHW-FP16-F=ConvOclDirectFwd:32,8,32,32,1,4,8,1,2
192-7-7-1x1-2064-7-7-16-0x0-1x1-1x1-0-NCHW-FP16-B=ConvAsm1x1U:1,16,2,16,1,2,2,2;ConvOclDirectFwd1x1:1,128,1,1,0,1,8,4,0
64-28-28-3x3-64-56-56-64-1x1-2x2-1x1-0-NCHW-FP32-W=ConvAsmBwdWrW3x3:0,0,8,8,4,4
48-7-7-1x1-832-7-7-32-0x0-1x1-1x1-0-NCHW-FP16-W=ConvAsmBwdWrW1x1:4,4,4,4,2,1,2,2,0,0
528-14-14-1x1-128-14-14-1-0x0-1x1-1x1-0-NCHW-FP16-F=ConvAsm1x1U:1,8,2,16,1,4,4,1;ConvOclDirectFwd1x1:1,64,1,1,0,4,4,8,0
160-14-14-3x3-128-28-28-32-1x1-2x2-1x1-0-NCHW-FP32-B=ConvOclDirectFwd:32,32,32,32,1,1,8,2,2
384-8-8-1x1-1536-8-8-16-0x0-1x1-1x1-0-NCHW-FP16-B=ConvAsm1x1U:1,16,2,32,1,2,2,4;ConvOclDirectFwd1x1:1,128,1,1,0,4,16,4,0
64-73-73-1x1-80-73-73-64-0x0-1x1-1x1-0-NCHW-FP32-F=ConvAsm1x1U:2,16,2,64,2,2,2,2;ConvActivAsm1x1U:1,32,1,64,2,1;ConvOclDirectFwd1x1:1,64,1,1,1,0,32,128,0
576-7-7-1x1-128-7-7-512-0x0-1x1-1x1-0-NCHW-FP16-B=ConvAsm1x1U:2,16,4,16,1,2,2,2;ConvOclDirectFwd1x1:1,64,1,1,0,1,16,4,0
768-14-14-1x1-128-14-14-64-0x0-1x1-1x1-0-NCHW-FP32-B=ConvAsm1x1U:1,32,2,16,1,1,4,1;ConvOclDirectFwd1x1:1,64,1,1,0,2,16,4,0
480-28-28-1x1-128-28-28-16-0x0-1x1-1x1-0-NCHW-FP16-F=ConvAsm1x1U:1,8,2,32,1,4,1,4;ConvOclDirectFwd1x1:1,128,1,1,0,2,8,4,0
128-54-54-1x1-32-54-54-16-0x0-1x1-1x1-0-NCHW-FP16-W=ConvAsmBwdWrW1x1:4,4,2,4,2,1,4,4,0,1
486-5-5-3x3-256-5-5-32-1x1-1x1-1x1-0-NCHW-FP32-W=ConvAsmBwdWrW3x3:0,0,8,2,4,2
512-7-7-1x1-128-7-7-128-0x0-1x1-1x1-0-NCHW-FP32-W=ConvAsmBwdWrW1x1:4,4,8,4,2,1,2,4,0,0
128-54-54-1x1-16-54-54-16-0x0-1x1-1x1-0-NCHW-FP16-F=ConvAsm1x1U:1,8,2,64,1,4,2,2;ConvOclDirectFwd1x1:1,64,1,1,0,4,8,4,0
1024-14-14-1x1-512-28-28-16-0x0-2x2-1x1-0-NCHW-FP32-W=ConvAsmBwdWrW1x1:1,16,4,4,8,2,1,4,0,1
256-55-55-1x1-64-55-55-2-0x0-1x1-1x1-0-NCHW-FP32-B=ConvAsm1x1U:1,32,1,32,1,4;ConvOclDirectFwd1x1:1,64,1,1,0,1,8,4,0
64-35-35-5x5-48-35-35-128-2x2-1x1-1x1-0-NCHW-FP16-B=ConvOclDirectFwd:8,8,16,16,2,2,8,2,1
384-8-8-1x1-1536-8-8-4-0x0-1x1-1x1-0-NCHW-FP32-B=ConvAsm1x1U:1,8,1,64,2,4,2,2;ConvOclDirectFwd1x1:1,64,1,1,0,1,4,4,0
384-27-27-1x1-64-27-27-128-0x0-1x1-1x1-0-NCHW-FP32-B=ConvAsm1x1U:1,32,1,64,1,1,2,2;ConvOclDirectFwd1x1:1,256,1,1,0,1,16,8,0
64-147-147-3x3-32-147-147-128-1x1-1x1-1x1-0-NCHW-FP16-W=ConvAsmBwdWrW3x3:0,0,16,4,2,4
128-28-28-3x3-128-58-58-128-0x0-2x2-1x1-0-NCHW-FP16-B=ConvOclDirectFwd:16,8,32,32,2,4,4,2,2
256-13-13-3x3-384-13-13-64-1x1-1x1-1x1-0-NCHW-FP16-B=ConvOclDirectFwd:8,8,16,16,2,2,8,2,2
192-14-14-1x1-608-14-14-32-0x0-1x1-1x1-0-NCHW-FP16-W=ConvAsmBwdWrW1x1:2,8,4,8,2,1,1,4,0,2
512-7-7-3x3-512-7-7-32-1x1-1x1-1x1-0-NCHW-FP16-W=ConvAsmBwdWrW3x3:0,0,8,4,2,1
1024-17-17-1x1-256-17-17-16-0x0-1x1-1x1-0-NCHW-FP16-F=ConvAsm1x1U:3,16,6,32,1,2,2,1;ConvOclDirectFwd1x1:1,128,1,1,0,1,8,4,0
320-14-14-1x1-128-14-14-128-0x0-1x1-1x1-0-NCHW-FP32-B=ConvAsm1x1U:2,16,2,16,1,2,1,4;ConvOclDirectFwd1x1:1,64,1,1,0,2,16,4,0
48-35-35-1x1-192-35-35-4-0x0-1x1-1x1-0-NCHW-FP32-B=ConvAsm1x1U:1,16,1,32,1,2,2,1;ConvOclDirectFwd1x1:1,128,1,1,0,1,8,4,0
608-7-7-1x1-128-7-7-64-0x0-1x1-1x1-0-NCHW-FP16-W=ConvAsmBwdWrW1x1:2,8,2,8,2,2,2,4,0,1
384-35-35-1x1-64-35-35-256-0x0-1x1-1x1-0-NCHW-FP32-F=ConvActivAsm1x1U:3,16,3,32,4,2
256-56-56-3x3-256-56-56-32-1x1-1x1-1x1-0-NCHW-FP16-B=ConvOclDirectFwd:16,16,32,32,2,2,8,1,2
64-28-28-3x3-64-56-56-16-1x1-2x2-1x1-0-NCHW-FP16-B=ConvOclDirectFwd:32,8,32,32,1,4,4,2,2
96-35-35-3x3-96-35-35-4-1x1-1x1-1x1-0-NCHW-FP16-W=ConvAsmBwdWrW3x3:0,0,8,4,1,2
256-14-14-1x1-128-14-14-128-0x0-1x1-1x1-0-NCHW-FP16-F=ConvAsm1x1U:2,8,4,64,1,4,1,4;ConvOclDirectFwd1x1:1,128,1,1,0,4,8,4,0
192-35-35-1x1-64-35-35-16-0x0-1x1-1x1-0-NCHW-FP32-F=ConvAsm1x1U:2,16,2,32,2,2,2,2;ConvActivAsm1x1U:2,16,2,32,2,2;ConvOclDirectFwd1x1:1,64,1,1,1,4,16,2048,0
192-56-56-1x1-192-56-56-16-0x0-1x1-1x1-0-NCHW-FP16-B=ConvAsm1x1U:1,16,2,32,1,2,2,2;ConvOclDirectFwd1x1:1,64,1,1,0,4,16,4,0
192-28-28-3x3-128-28-28-32-1x1-1x1-1x1-0-NCHW-FP32-W=ConvAsmBwdWrW3x3:0,0,8,2,2,1
224-14-14-3x3-112-14-14-128-1x1-1x1-1x1-0-NCHW-FP16-B=ConvOclDirectFwd:8,16,16,16,2,1,8,1,1
64-112-112-3x3-128-112-112-16-1x1-1x1-1x1-0-NCHW-FP16-F=ConvOclDirectFwdFused:16,8,16,32,1,4,8,1,1;ConvOclDirectFwd:16,8,16,32,1,4,8,1,2
384-35-35-1x1-96-35-35-256-0x0-1x1-1x1-0-NCHW-FP32-F=ConvAsm1x1U:3,16,3,64,2,2,1,2;ConvActivAsm1x1U:2,16,3,32,4,2;ConvOclDirectFwd1x1:1,64,1,1,1,0,16,2048,0
256-14-14-1x1-256-14-14-2-0x0-1x1-1x1-0-NCHW-FP32-W=ConvAsmBwdWrW1x1:1,16,2,4,2,1,1,4,0,1
3-225-225-7x7-64-112-112-16-2x2-2x2-1x1-0-NCHW-FP32-F=ConvOclDirectFwdFused:16,8,16,16,1,2,8,1,1;ConvOclDirectFwd:16,8,16,16,1,2,8,1,2
448-8-8-1x1-1280-8-8-16-0x0-1x1-1x1-0-NCHW-FP32-W=ConvAsmBwdWrW1x1:1,16,2,8,2,1,2,4,0,1
768-14-14-1x1-128-14-14-512-0x0-1x1-1x1-0-NCHW-FP16-F=ConvAsm1x1U:2,8,4,64,1,4,1,8;ConvOclDirectFwd1x1:1,64,1,1,0,4,8,4,0
352-14-14-1x1-128-14-14-128-0x0-1x1-1x1-0-NCHW-FP32-W=ConvAsmBwdWrW1x1:4,4,4,2,8,1,2,4,0,0
384-13-13-3x3-192-13-13-1-1x1-1x1-1x1-0-NCHW-FP32-W=ConvAsmBwdWrW3x3:0,0,8,4,2,1
64-28-28-1x1-320-28-28-32-0x0-1x1-1x1-0-NCHW-FP32-W=ConvAsmBwdWrW1x1:2,8,2,8,4,2,4,4,0,1
160-56-56-1x1-128-56-56-512-0x0-1x1-1x1-0-NCHW-FP32-W=ConvAsmBwdWrW1x1:2,8,4,8,2,1,4,4,0,1
256-28-28-3x3-512-28-28-512-1x1-1x1-1x1-0-NCHW-FP16-W=ConvAsmBwdWrW3x3:0,1,8,4,2,1
512-14-14-1x1-192-14-14-2-0x0-1x1-1x1-0-NCHW-FP32-F=ConvAsm1x1U:2,8,2,64,1,4,4,1;ConvActivAsm1x1U:2,16,2,32,1,4;ConvOclDirectFwd1x1:1,64,1,1,1,0,16,64,0
160-14-14-1x1-528-14-14-256-0x0-1x1-1x1-0-NCHW-FP16-B=ConvAsm1x1U:1,16,2,16,1,2,1,4;ConvOclDirectFwd1x1:1,256,1,1,0,2,16,4,0
512-7-7-3x3-512-7-7-4-1x1-1x1-1x1-0-NCHW-FP16-W=ConvAsmBwdWrW3x3:0,0,8,4,4,1
128-14-14-1x1-480-14-14-16-0x0-1x1-1x1-0-NCHW-FP16-B=ConvAsm1x1U:1,16,2,16,1,2,2,4;ConvOclDirectFwd1x1:1,128,1,1,0,4,8,4,0
192-14-14-1x1-1008-14-14-16-0x0-1x1-1x1-0-NCHW-FP32-B=ConvAsm1x1U:2,16,2,32,1,2,1,1;ConvOclDirectFwd1x1:1,128,1,1,0,4,16,4,0
192-7-7-1x1-832-7-7-4-0x0-1x1-1x1-0-NCHW-FP32-W=ConvAsmBwdWrW1x1:1,16,2,8,2,1,1,4,0,1
512-7-7-1x1-2048-7-7-2-0x0-1x1-1x1-0-NCHW-FP32-W=ConvAsmBwdWrW1x1:1,16,4,2,8,1,1,4,0,0
208-14-14-3x3-96-14-14-4-1x1-1x1-1x1-0-NCHW-FP16-W=ConvAsmBwdWrW3x3:0,0,8,2,3,1
128-28-28-1x1-128-28-28-256-0x0-1x1-1x1-0-NCHW-FP32-B=ConvAsm1x1U:1,32,1,16,1,1,1,1;ConvOclDirectFwd1x1:1,64,1,1,0,2,32,4,0
3-230-230-7x7-64-112-112-16-0x0-2x2-1x1-0-NCHW-FP32-F=ConvOclDirectFwdFused:16,8,16,16,1,2,8,1,2;ConvOclDirectFwd:16,8,16,16,1,2,8,1,2
320-7-7-3x3-160-7-7-4-1x1-1x1-1x1-0-NCHW-FP32-W=ConvAsmBwdWrW3x3:0,0,8,2,7,1
384-8-8-1x1-1536-8-8-1-0x0-1x1-1x1-0-NCHW-FP16-B=ConvAsm1x1U:1,8,2,32,1,4,4,1;ConvOclDirectFwd1x1:1,128,1,1,0,1,4,8,0
192-17-17-1x1-1024-17-17-256-0x0-1x1-1x1-0-NCHW-FP32-B=ConvAsm1x1U:1,16,1,64,2,2,1,8;ConvOclDirectFwd1x1:16,64,32,32,0,1,16,4,1
16-14-14-1x1-480-14-14-64-0x0-1x1-1x1-0-NCHW-FP32-W=ConvAsmBwdWrW1x1:4,4,4,4,2,1,4,4,0,1
64-224-224-3x3-64-224-224-4-1x1-1x1-1x1-0-NCHW-FP16-F=ConvOclDirectFwdFused:16,16,32,32,2,2,8,2,1;ConvOclDirectFwd:16,16,32,32,2,2,8,4,1
2048-7-7-1x1-512-7-7-1-0x0-1x1-1x1-0-NCHW-FP32-W=ConvAsmBwdWrW1x1:1,16,4,2,8,1,1,4,0,0
160-14-14-1x1-528-14-14-64-0x0-1x1-1x1-0-NCHW-FP32-B=ConvAsm1x1U:1,16,1,32,2,2,1,4;ConvOclDirectFwd1x1:1,64,1,1,0,4,16,4,0
256-13-13-3x3-256-13-13-16-1x1-1x1-1x1-0-NCHW-FP32-W=ConvAsmBwdWrW3x3:0,1,16,4,2,1
192-14-14-1x1-1536-14-14-16-0x0-1x1-1x1-0-NCHW-FP16-W=ConvAsmBwdWrW1x1:2,8,4,8,2,1,2,4,0,1
128-54-54-1x1-16-54-54-64-0x0-1x1-1x1-0-NCHW-FP16-W=ConvAsmBwdWrW1x1:4,4,2,2,2,1,4,4,0,1
1-5-5-3x3-1-7-7-64-0x0-1x1-1x1-0-NCHW-FP32-B=ConvOclDirectFwd:8,8,8,8,1,1,1,1,2
256-7-7-3x3-512-7-7-1-1x1-1x1-1x1-0-NCHW-FP16-F=ConvOclDirectFwd:8,8,8,8,1,1,1,2,1
1344-7-7-1x1-192-7-7-16-0x0-1x1-1x1-0-NCHW-FP32-F=ConvAsm1x1U:2,8,4,16,1,4,4,1;ConvActivAsm1x1U:4,16,4,16,1,4;ConvOclDirectFwd1x1:1,64,1,1,1,1,16,256,0
64-35-35-1x1-256-35-35-4-0x0-1x1-1x1-0-NCHW-FP16-B=ConvAsm1x1U:2,16,4,32,1,2,2,1;ConvOclDirectFwd1x1:1,256,1,1,0,1,8,4,0
32-27-27-3x3-128-27-27-256-1x1-1x1-1x1-0-NCHW-FP16-W=ConvAsmBwdWrW3x3:0,0,8,4,2,4
48-27-27-1x1-384-27-27-256-0x0-1x1-1x1-0-NCHW-FP32-F=ConvAsm1x1U:1,16,1,64,4,2,1,1;ConvOclDirectFwd1x1:1,64,1,1,1,4,16,128,0
256-14-14-3x3-256-14-14-32-1x1-1x1-1x1-0-NCHW-FP16-B=ConvOclDirectFwd:8,8,16,16,2,2,8,2,2
512-7-7-3x3-512-7-7-16-1x1-1x1-1x1-0-NCHW-FP16-B=ConvOclDirectFwd:8,8,8,8,1,1,4,1,2
1056-14-14-1x1-2112-14-14-16-0x0-1x1-1x1-0-NCHW-FP16-B=ConvAsm1x1U:1,16,2,16,1,2,1,4;ConvOclDirectFwd1x1:1,64,1,1,0,2,16,4,0
512-14-14-1x1-144-14-14-128-0x0-1x1-1x1-0-NCHW-FP32-F=ConvAsm1x1U:4,8,4,64,3,1,2,2;ConvActivAsm1x1U:4,16,7,32,1,2;ConvOclDirectFwd1x1:1,64,1,1,1,1,64,2048,0
384-13-13-3x3-384-13-13-64-1x1-1x1-1x1-0-NCHW-FP16-B=ConvOclDirectFwd:8,8,16,16,2,2,8,2,1
128-28-28-1x1-256-28-28-512-0x0-1x1-1x1-0-NCHW-FP32-W=ConvAsmBwdWrW1x1:2,8,2,4,8,1,4,4,0,1
24-14-14-1x1-512-14-14-16-0x0-1x1-1x1-0-NCHW-FP32-W=ConvAsmBwdWrW1x1:4,4,2,2,2,1,1,4,0,1
192-56-56-1x1-336-56-56-16-0x0-1x1-1x1-0-NCHW-FP16-B=ConvAsm1x1U:1,16,2,32,1,2,1,1;ConvOclDirectFwd1x1:1,128,1,1,0,4,16,4,0
512-28-28-1x1-256-14-14-16-0x0-2x2-1x1-0-NCHW-FP16-F=ConvAsm1x1U:2,8,4,64,1,4,2,8;ConvOclDirectFwd1x1:1,256,1,1,0,2,16,4,0
352-14-14-1x1-128-14-14-128-0x0-1x1-1x1-0-NCHW-FP32-B=ConvAsm1x1U:1,32,1,16,2,1,2,2;ConvOclDirectFwd1x1:1,64,1,1,0,2,16,4,0
1680-7-7-1x1-192-7-7-16-0x0-1x1-1x1-0-NCHW-FP16-F=ConvAsm1x1U:1,8,2,32,1,4,4,1;ConvOclDirectFwd1x1:1,64,1,1,0,1,4,8,0
128-54-54-1x1-16-54-54-512-0x0-1x1-1x1-0-NCHW-FP32-F=ConvAsm1x1U:2,16,3,64,4,2,1,1;ConvOclDirectFwd1x1:1,64,1,1,1,0,32,2048,0
128-28-28-1x1-256-28-28-256-0x0-1x1-1x1-0-NCHW-FP32-W=ConvAsmBwdWrW1x1:2,8,4,4,4,1,4,4,0,1
256-14-14-1x1-256-14-14-8-0x0-1x1-1x1-0-NCHW-FP32-B=ConvAsm1x1U:1,16,1,64,1,1,4,1;ConvOclDirectFwd1x1:1,128,1,1,0,4,8,8,0
512-28-28-3x3-256-28-28-256-1x1-1x1-1x1-0-NCHW-FP16-W=ConvAsmBwdWrW3x3:0,1,8,4,2,1
128-28-28-3x3-96-28-28-256-1x1-1x1-1x1-0-NCHW-FP32-W=ConvAsmBwdWrW3x3:0,0,8,4,4,2
3-225-225-7x7-64-112-112-4-2x2-2x2-1x1-0-NCHW-FP32-F=ConvOclDirectFwdFused:16,16,16,32,1,2,8,1,2;ConvOclDirectFwd:16,16,16,32,1,2,8,1,2
32-28-28-1x1-256-28-28-32-0x0-1x1-1x1-0-NCHW-FP32-W=ConvAsmBwdWrW1x1:2,8,2,8,2,1,4,4,0,2
192-28-28-1x1-32-28-28-128-0x0-1x1-1x1-0-NCHW-FP32-W=ConvAsmBwdWrW1x1:2,8,2,4,2,1,4,4,0,2
512-28-28-3x3-512-28-28-16-1x1-1x1-1x1-0-NCHW-FP16-B=ConvOclDirectFwd:32,8,32,32,1,4,8,2,2
16-54-54-3x3-64-54-54-128-1x1-1x1-1x1-0-NCHW-FP16-W=ConvAsmBwdWrW3x3:0,0,8,2,2,8
192-14-14-1x1-1152-14-14-16-0x0-1x1-1x1-0-NCHW-FP32-B=ConvAsm1x1U:1,16,1,32,2,2,1,4;ConvOclDirectFwd1x1:1,128,1,1,0,4,16,4,0
192-17-17-3x3-192-8-8-8-0x0-2x2-1x1-0-NCHW-FP32-F=ConvOclDirectFwd:8,8,8,8,1,1,2,2,2
320-7-7-3x3-160-7-7-512-1x1-1x1-1x1-0-NCHW-FP16-W=ConvAsmBwdWrW3x3:0,1,8,4,7,2
192-7-7-1x1-1776-7-7-16-0x0-1x1-1x1-0-NCHW-FP16-W=ConvAsmBwdWrW1x1:1,16,2,8,2,1,1,4,0,0
256-28-28-1x1-32-28-28-256-0x0-1x1-1x1-0-NCHW-FP16-W=ConvAsmBwdWrW1x1:4,4,4,2,4,1,4,2,0,2
64-35-35-5x5-48-35-35-32-2x2-1x1-1x1-0-NCHW-FP16-B=ConvOclDirectFwd:8,8,16,16,2,2,8,2,2
736-7-7-1x1-128-7-7-64-0x0-1x1-1x1-0-NCHW-FP16-B=ConvAsm1x1U:2,8,4,16,1,4,4,2;ConvOclDirectFwd1x1:1,64,1,1,0,1,4,4,0
224-14-14-3x3-112-14-14-128-1x1-1x1-1x1-0-NCHW-FP32-W=ConvAsmBwdWrW3x3:0,0,8,2,13,4
128-7-7-1x1-768-7-7-512-0x0-1x1-1x1-0-NCHW-FP16-F=ConvAsm1x1U:2,8,4,16,1,4,1,8;ConvOclDirectFwd1x1:1,256,1,1,0,1,8,4,0
256-13-13-3x3-256-13-13-64-1x1-1x1-1x1-0-NCHW-FP16-B=ConvOclDirectFwd:8,8,16,16,2,2,8,2,2
128-7-7-1x1-864-7-7-256-0x0-1x1-1x1-0-NCHW-FP16-F=ConvAsm1x1U:2,8,4,16,1,4,1,8;ConvOclDirectFwd1x1:1,64,1,1,0,1,8,4,0
160-17-17-1x1-768-17-17-8-0x0-1x1-1x1-0-NCHW-FP32-B=ConvAsm1x1U:1,16,1,64,2,2,1,1;ConvOclDirectFwd1x1:1,256,1,1,0,1,16,8,0
256-8-8-1x1-1536-8-8-64-0x0-1x1-1x1-0-NCHW-FP32-W=ConvAsmBwdWrW1x1:1,16,2,4,8,1,1,4,0,0
160-73-73-1x1-64-73-73-256-0x0-1x1-1x1-0-NCHW-FP32-F=ConvAsm1x1U:2,16,2,64,2,2,1,4;ConvActivAsm1x1U:3,32,3,64,1,1;ConvOclDirectFwd1x1:1,64,1,1,1,1,32,2048,0
256-14-14-3x3-256-7-7-512-1x1-2x2-1x1-0-NCHW-FP32-F=ConvOclDirectFwd:8,8,8,8,1,1,8,2,2
288-28-28-1x1-128-28-28-16-0x0-1x1-1x1-0-NCHW-FP32-B=ConvAsm1x1U:1,16,1,16,1,2,2,2;ConvOclDirectFwd1x1:1,64,1,1,0,2,16,4,0
128-56-56-1x1-96-56-56-256-0x0-1x1-1x1-0-NCHW-FP32-W=ConvAsmBwdWrW1x1:4,4,4,4,4,1,4,4,0,1
128-7-7-1x1-928-7-7-16-0x0-1x1-1x1-0-NCHW-FP32-F=ConvAsm1x1U:1,8,1,64,2,4,1,8;ConvOclDirectFwd1x1:1,64,1,1,1,4,16,2048,0
24-14-14-1x1-512-14-14-128-0x0-1x1-1x1-0-NCHW-FP16-W=ConvAsmBwdWrW1x1:4,4,4,4,2,2,2,4,0,3
2048-8-8-1x1-448-8-8-128-0x0-1x1-1x1-0-NCHW-FP32-F=ConvAsm1x1U:2,16,2,32,2,2,1,8;ConvActivAsm1x1U:4,16,4,16,3,2;ConvOclDirectFwd1x1:1,64,1,1,1,1,64,2048,0
256-14-14-1x1-128-28-28-128-0x0-2x2-1x1-0-NCHW-FP32-B=ConvAsm1x1U:1,32,1,16,1,1,2,4;ConvOclDirectFwd1x1:1,128,1,1,0,1,32,4,0
192-17-17-1x1-1024-17-17-128-0x0-1x1-1x1-0-NCHW-FP32-W=ConvAsmBwdWrW1x1:1,16,2,4,8,1,2,4,0,0
48-7-7-1x1-832-7-7-64-0x0-1x1-1x1-0-NCHW-FP16-B=ConvAsm1x1U:1,16,2,16,1,2,2,2;ConvOclDirectFwd1x1:1,64,1,1,0,1,8,4,0
512-14-14-1x1-128-28-28-1-0x0-2x2-1x1-0-NCHW-FP32-W=ConvAsmBwdWrW1x1:1,16,2,4,2,1,1,4,0,1
64-55-55-3x3-64-55-55-32-1x1-1x1-1x1-0-NCHW-FP32-W=ConvAsmBwdWrW3x3:0,1,8,4,2,4
32-149-149-3x3-32-147-147-8-0x0-1x1-1x1-0-NCHW-FP32-F=ConvOclDirectFwd:16,16,16,32,1,2,8,2,2
32-56-56-3x3-128-56-56-16-1x1-1x1-1x1-0-NCHW-FP16-B=ConvOclDirectFwd:16,16,32,32,2,2,8,1,2
384-8-8-1x1-1280-8-8-64-0x0-1x1-1x1-0-NCHW-FP16-B=ConvAsm1x1U:1,16,2,32,1,2,1,8;ConvOclDirectFwd1x1:1,128,1,1,0,4,16,4,0
32-28-28-1x1-192-28-28-64-0x0-1x1-1x1-0-NCHW-FP16-B=ConvAsm1x1U:1,16,2,32,1,2,1,2;ConvOclDirectFwd1x1:1,256,1,1,0,2,16,4,0
128-28-28-1x1-256-28-28-16-0x0-1x1-1x1-0-NCHW-FP32-W=ConvAsmBwdWrW1x1:2,8,4,8,2,1,4,4,0,1
256-14-14-1x1-1024-14-14-256-0x0-1x1-1x1-0-NCHW-FP16-F=ConvAsm1x1U:2,8,4,64,1,4,1,8;ConvOclDirectFwd1x1:1,128,1,1,0,2,32,4,0
128-28-28-1x1-512-28-28-128-0x0-1x1-1x1-0-NCHW-FP32-W=ConvAsmBwdWrW1x1:2,8,2,8,4,1,4,4,0,2
256-28-28-1x1-32-28-28-128-0x0-1x1-1x1-0-NCHW-FP16-W=ConvAsmBwdWrW1x1:2,8,2,2,4,1,4,4,0,2
192-28-28-1x1-96-28-28-8-0x0-1x1-1x1-0-NCHW-FP16-F=ConvAsm1x1U:1,8,2,32,1,4,2,2;ConvOclDirectFwd1x1:1,128,1,1,0,2,8,4,0
64-64-128-1x1-512-64-128-1-0x0-1x1-1x1-0-NCHW-FP32-B=ConvOclDirectFwd1x1:1,128,1,1,0,4,16,4,0
1-161-700-5x20-32-79-341-32-0x0-2x2-1x1-0-NCHW-FP32-F=ConvOclDirectFwd:8,32,16,32,2,1,1,1,2
1024-7-7-1x1-128-7-7-64-0x0-1x1-1x1-0-NCHW-FP16-F=ConvAsm1x1U:2,8,4,16,1,4,4,2;ConvOclDirectFwd1x1:1,256,1,1,0,1,8,4,0
128-28-28-1x1-512-28-28-1-0x0-1x1-1x1-0-NCHW-FP32-W=ConvAsmBwdWrW1x1:2,8,2,4,2,1,1,4,0,1
96-35-35-1x1-384-35-35-256-0x0-1x1-1x1-0-NCHW-FP16-W=ConvAsmBwdWrW1x1:4,4,4,4,4,1,4,4,0,2
832-7-7-1x1-160-7-7-512-0x0-1x1-1x1-0-NCHW-FP32-F=ConvAsm1x1U:2,16,4,16,1,2,1,1;ConvActivAsm1x1U:2,16,2,16,4,2;ConvOclDirectFwd1x1:1,64,1,1,1,4,64,2048,0
192-14-14-1x1-1104-14-14-16-0x0-1x1-1x1-0-NCHW-FP32-F=ConvAsm1x1U:1,16,1,64,4,2,1,1;ConvOclDirectFwd1x1:1,64,1,1,1,0,32,256,0
608-14-14-1x1-160-14-14-64-0x0-1x1-1x1-0-NCHW-FP32-F=ConvAsm1x1U:3,8,7,32,1,2,2,2;ConvActivAsm1x1U:4,16,5,16,2,1;ConvOclDirectFwd1x1:1,64,1,1,1,4,16,2048,0
384-8-8-1x1-1280-8-8-128-0x0-1x1-1x1-0-NCHW-FP16-W=ConvAsmBwdWrW1x1:2,8,4,8,2,2,1,4,0,1
864-14-14-1x1-128-14-14-128-0x0-1x1-1x1-0-NCHW-FP16-F=ConvAsm1x1U:2,8,4,64,1,4,1,8;ConvOclDirectFwd1x1:1,64,1,1,0,4,8,4,0
160-28-28-1x1-128-28-28-256-0x0-1x1-1x1-0-NCHW-FP32-W=ConvAsmBwdWrW1x1:2,8,2,8,2,1,4,4,0,0
48-27-27-3x3-192-27-27-16-1x1-1x1-1x1-0-NCHW-FP32-W=ConvAsmBwdWrW3x3:0,1,8,2,6,4
4-2-2-3x3-3-1-1-512-0x0-2x2-1x1-0-NCHW-FP32-F=ConvOclDirectFwd:8,8,8,8,1,1,1,4,2
832-7-7-1x1-256-7-7-64-0x0-1x1-1x1-0-NCHW-FP32-F=ConvAsm1x1U:2,8,2,32,1,4,1,8;ConvActivAsm1x1U:2,16,2,32,2,2;ConvOclDirectFwd1x1:1,64,1,1,1,1,16,2048,0
192-7-7-1x1-832-7-7-128-0x0-1x1-1x1-0-NCHW-FP32-B=ConvAsm1x1U:1,16,1,64,3,2,2,1;ConvOclDirectFwd1x1:1,64,1,1,0,1,16,8,0
2048-7-7-1x1-512-7-7-1-0x0-1x1-1x1-0-NCHW-FP16-F=ConvAsm1x1U:1,8,2,16,1,4,4,1;ConvOclDirectFwd1x1:1,64,1,1,0,1,4,4,0
32-27-27-1x1-256-27-27-128-0x0-1x1-1x1-0-NCHW-FP16-B=ConvAsm1x1U:1,16,2,64,1,2,1,2;ConvOclDirectFwd1x1:16,64,32,32,0,1,16,4,1
32-27-27-1x1-128-27-27-256-0x0-1x1-1x1-0-NCHW-FP32-B=ConvAsm1x1U:1,16,1,64,1,2,2,2;ConvOclDirectFwd1x1:1,64,1,1,0,1,32,4,0
32-14-14-5x5-64-14-14-4-2x2-1x1-1x1-0-NCHW-FP32-F=ConvOclDirectFwdFused:16,16,16,16,1,1,2,4,2;ConvOclDirectFwd:16,16,16,16,1,1,2,4,2
3-224-224-3x3-64-224-224-128-1x1-1x1-1x1-0-NCHW-FP16-B=ConvOclDirectFwd:16,16,16,32,1,2,8,1,2
1056-14-14-1x1-192-14-14-16-0x0-1x1-1x1-0-NCHW-FP16-B=ConvAsm1x1U:1,16,2,32,1,2,4,2;ConvOclDirectFwd1x1:1,64,1,1,0,4,4,4,0
32-28-28-1x1-256-28-28-4-0x0-1x1-1x1-0-NCHW-FP32-B=ConvAsm1x1U:1,16,1,16,1,2,2,1;ConvOclDirectFwd1x1:16,64,32,32,0,2,16,4,1
16-28-28-1x1-192-28-28-8-0x0-1x1-1x1-0-NCHW-FP16-B=ConvAsm1x1U:1,8,2,32,1,2,1,4;ConvOclDirectFwd1x1:1,256,1,1,0,2,4,4,0
16-54-54-1x1-96-54-54-512-0x0-1x1-1x1-0-NCHW-FP32-B=ConvAsm1x1U:1,32,1,64,1,1,2,2;ConvOclDirectFwd1x1:1,128,1,1,0,2,32,4,0
192-14-14-1x1-1632-14-14-16-0x0-1x1-1x1-0-NCHW-FP16-B=ConvAsm1x1U:1,16,2,16,1,2,2,2;ConvOclDirectFwd1x1:1,64,1,1,0,4,16,4,0
24-14-14-1x1-512-14-14-512-0x0-1x1-1x1-0-NCHW-FP16-B=ConvAsm1x1U:1,16,2,16,1,2,1,8;ConvOclDirectFwd1x1:1,256,1,1,0,2,32,4,0
128-28-28-1x1-256-56-56-4-0x0-2x2-1x1-0-NCHW-FP16-W=ConvAsmBwdWrW1x1:2,8,2,4,2,1,2,4,0,1
528-14-14-1x1-32-14-14-512-0x0-1x1-1x1-0-NCHW-FP32-F=ConvAsm1x1U:4,16,4,64,1,2,4,1;ConvActivAsm1x1U:2,16,2,64,2,4;ConvOclDirectFwd1x1:1,64,1,1,1,1,16,2048,0
2048-8-8-1x1-320-8-8-1-0x0-1x1-1x1-0-NCHW-FP32-F=ConvAsm1x1U:1,8,1,32,1,4,4,2;ConvActivAsm1x1U:1,16,1,64,1,4;ConvOclDirectFwd1x1:1,64,1,1,1,0,16,128,0
512-7-7-3x3-512-7-7-1-1x1-1x1-1x1-0-NCHW-FP16-F=ConvOclDirectFwdFused:8,8,8,8,1,1,1,4,1;ConvOclDirectFwd:8,8,8,8,1,1,1,4,1
480-64-128-1x1-64-64-128-1-0x0-1x1-1x1-0-NCHW-FP32-F=ConvAsm1x1U:4,8,4,64,1,4,2,1;ConvActivAsm1x1U:4,16,4,64,1,4;ConvOclDirectFwd1x1:1,64,1,1,1,1,16,256,0
16-54-54-1x1-64-54-54-16-0x0-1x1-1x1-0-NCHW-FP32-W=ConvAsmBwdWrW1x1:4,4,2,2,2,1,4,4,0,1
256-27-27-1x1-64-27-27-512-0x0-1x1-1x1-0-NCHW-FP32-W=ConvAsmBwdWrW1x1:2,8,2,8,2,1,4,2,0,1
192-7-7-1x1-1024-7-7-64-0x0-1x1-1x1-0-NCHW-FP32-W=ConvAsmBwdWrW1x1:1,16,2,8,4,1,4,4,0,3
192-56-56-1x1-336-56-56-16-0x0-1x1-1x1-0-NCHW-FP16-W=ConvAsmBwdWrW1x1:4,4,4,4,8,1,2,4,0,1
16-14-14-1x1-480-14-14-512-0x0-1x1-1x1-0-NCHW-FP16-B=ConvAsm1x1U:1,16,2,16,1,2,1,8;ConvOclDirectFwd1x1:1,256,1,1,0,2,16,4,0
64-28-28-1x1-192-28-28-512-0x0-1x1-1x1-0-NCHW-FP16-W=ConvAsmBwdWrW1x1:4,4,4,4,4,2,4,4,0,1
608-7-7-1x1-128-7-7-16-0x0-1x1-1x1-0-NCHW-FP32-W=ConvAsmBwdWrW1x1:2,8,4,4,2,1,2,4,0,0
768-7-7-1x1-128-7-7-128-0x0-1x1-1x1-0-NCHW-FP32-W=ConvAsmBwdWrW1x1:4,4,4,4,2,1,1,4,0,0
576-7-7-1x1-128-7-7-64-0x0-1x1-1x1-0-NCHW-FP32-B=ConvAsm1x1U:4,8,4,16,1,4,2,2;ConvOclDirectFwd1x1:1,128,1,1,0,1,8,4,0
1344-14-14-1x1-192-14-14-16-0x0-1x1-1x1-0-NCHW-FP16-F=ConvAsm1x1U:2,8,4,64,1,4,2,2;ConvOclDirectFwd1x1:1,64,1,1,0,4,8,4,0
256-7-7-3x3-256-14-14-32-1x1-2x2-1x1-0-NCHW-FP16-B=ConvOclDirectFwd:16,8,16,16,1,2,4,1,1
896-14-14-1x1-128-14-14-64-0x0-1x1-1x1-0-NCHW-FP32-W=ConvAsmBwdWrW1x1:2,8,4,8,4,2,2,4,0,1
128-54-54-1x1-32-54-54-16-0x0-1x1-1x1-0-NCHW-FP16-F=ConvAsm1x1U:1,8,2,32,1,4,1,4;ConvOclDirectFwd1x1:1,64,1,1,0,4,16,4,0
96-35-35-3x3-64-35-35-128-1x1-1x1-1x1-0-NCHW-FP32-W=ConvAsmBwdWrW3x3:0,0,8,4,5,8
32-7-7-3x3-128-7-7-16-1x1-1x1-1x1-0-NCHW-FP16-B=ConvOclDirectFwd:8,8,8,8,1,1,2,2,2
96-28-28-3x3-96-28-28-32-1x1-1x1-1x1-0-NCHW-FP32-W=ConvAsmBwdWrW3x3:0,0,8,2,6,4
640-14-14-1x1-128-14-14-512-0x0-1x1-1x1-0-NCHW-FP32-W=ConvAsmBwdWrW1x1:2,8,4,8,2,1,4,4,0,2
1280-8-8-1x1-192-8-8-32-0x0-1x1-1x1-0-NCHW-FP32-F=ConvAsm1x1U:2,8,2,32,1,4,1,4;ConvActivAsm1x1U:4,16,4,16,2,4;ConvOclDirectFwd1x1:1,64,1,1,1,1,64,256,0
256-7-7-3x3-256-14-14-128-1x1-2x2-1x1-0-NCHW-FP32-B=ConvOclDirectFwd:8,16,8,16,1,1,4,1,1
32-7-7-3x3-128-7-7-64-1x1-1x1-1x1-0-NCHW-FP16-B=ConvOclDirectFwd:8,8,8,8,1,1,4,1,2
64-128-256-1x1-192-128-256-1-0x0-1x1-1x1-0-NCHW-FP32-W=ConvAsmBwdWrW1x1:4,4,4,1,8,1,1,4,0,2
384-8-8-3x3-448-8-8-64-1x1-1x1-1x1-0-NCHW-FP16-B=ConvOclDirectFwd:8,8,8,8,1,1,8,4,2
64-55-55-1x1-64-55-55-16-0x0-1x1-1x1-0-NCHW-FP32-B=ConvAsm1x1U:3,32,3,64,2,1;ConvOclDirectFwd1x1:1,256,1,1,0,1,32,4,0
192-56-56-1x1-128-56-56-128-0x0-1x1-1x1-0-NCHW-FP32-B=ConvAsm1x1U:1,16,1,64,2,2,1,8;ConvOclDirectFwd1x1:1,64,1,1,0,4,16,4,0
384-13-13-3x3-256-13-13-512-1x1-1x1-1x1-0-NCHW-FP32-W=ConvAsmBwdWrW3x3:0,1,8,4,2,1
64-54-54-1x1-16-54-54-256-0x0-1x1-1x1-0-NCHW-FP16-F=ConvAsm1x1U:1,8,2,64,1,4,2,2;ConvOclDirectFwd1x1:1,128,1,1,0,4,16,4,0
384-8-8-1x1-2048-8-8-32-0x0-1x1-1x1-0-NCHW-FP16-W=ConvAsmBwdWrW1x1:1,16,4,8,2,1,1,4,0,1
5-10-10-3x3-3-10-10-256-1x1-1x1-1x1-0-NCHW-FP32-F=ConvOclDirectFwd:8,8,16,16,2,2,1,2,2
48-27-27-1x1-256-27-27-128-0x0-1x1-1x1-0-NCHW-FP32-B=ConvAsm1x1U:1,16,1,64,2,1,1,2;ConvOclDirectFwd1x1:1,128,1,1,0,1,32,4,0
256-14-14-1x1-1024-7-7-2-0x0-2x2-1x1-0-NCHW-FP32-F=ConvAsm1x1U:1,8,1,64,1,4,2,2;ConvOclDirectFwd1x1:1,64,1,1,1,4,16,64,0
64-73-73-1x1-80-73-73-128-0x0-1x1-1x1-0-NCHW-FP32-F=ConvAsm1x1U:2,16,2,64,3,2,1,2;ConvActivAsm1x1U:1,32,1,32,2,1;ConvOclDirectFwd1x1:1,64,1,1,1,0,16,2048,0
528-14-14-1x1-32-14-14-1-0x0-1x1-1x1-0-NCHW-FP16-F=ConvAsm1x1U:1,8,2,16,1,4,4,1;ConvOclDirectFwd1x1:1,64,1,1,0,4,4,8,0
64-64-128-1x1-512-64-128-1-0x0-1x1-1x1-0-NCHW-FP16-W=ConvAsmBwdWrW1x1:4,4,4,1,8,1,1,4,0,3
256-28-28-1x1-32-28-28-128-0x0-1x1-1x1-0-NCHW-FP32-B=ConvAsm1x1U:1,16,1,32,1,2,1,1;ConvOclDirectFwd1x1:1,128,1,1,0,2,16,4,0
128-7-7-3x3-32-7-7-128-1x1-1x1-1x1-0-NCHW-FP16-W=ConvAsmBwdWrW3x3:0,1,8,2,7,4
512-28-28-3x3-256-28-28-512-1x1-1x1-1x1-0-NCHW-FP16-F=ConvOclDirectFwd:16,16,32,32,2,2,8,1,1
48-27-27-1x1-384-27-27-256-0x0-1x1-1x1-0-NCHW-FP16-B=ConvAsm1x1U:2,16,4,64,1,2,1,2;ConvOclDirectFwd1x1:1,64,1,1,0,1,16,4,0
64-35-35-5x5-48-35-35-4-2x2-1x1-1x1-0-NCHW-FP32-B=ConvOclDirectFwd:8,16,16,16,2,1,4,1,2
24-14-14-1x1-512-14-14-64-0x0-1x1-1x1-0-NCHW-FP32-B=ConvAsm1x1U:1,16,1,64,2,2,1,4;ConvOclDirectFwd1x1:1,256,1,1,0,4,16,4,0
128-56-56-3x3-256-56-56-16-1x1-1x1-1x1-0-NCHW-FP16-B=ConvOclDirectFwd:16,16,32,32,2,2,8,1,2
192-8-8-1x1-1280-8-8-256-0x0-1x1-1x1-0-NCHW-FP16-B=ConvAsm1x1U:1,16,2,32,1,2,1,4;ConvOclDirectFwd1x1:1,64,1,1,0,4,16,4,0
288-14-14-1x1-128-14-14-128-0x0-1x1-1x1-0-NCHW-FP16-F=ConvAsm1x1U:2,8,4,64,1,4,1,8;ConvOclDirectFwd1x1:1,64,1,1,0,2,8,4,0
128-56-56-3x3-256-56-56-256-1x1-1x1-1x1-0-NCHW-FP32-W=ConvAsmBwdWrW3x3:0,1,16,4,2,1
704-7-7-1x1-128-7-7-256-0x0-1x1-1x1-0-NCHW-FP32-B=ConvAsm1x1U:2,16,2,32,1,2,4,1;ConvOclDirectFwd1x1:1,64,1,1,0,1,16,8,0
128-56-56-3x3-32-56-56-512-1x1-1x1-1x1-0-NCHW-FP32-W=ConvAsmBwdWrW3x3:0,0,8,2,3,2
1280-8-8-1x1-448-8-8-32-0x0-1x1-1x1-0-NCHW-FP32-B=ConvAsm1x1U:1,16,1,64,1,2,2,2;ConvOclDirectFwd1x1:1,64,1,1,0,4,8,8,0
1280-8-8-1x1-448-8-8-256-0x0-1x1-1x1-0-NCHW-FP32-F=ConvAsm1x1U:2,16,2,32,2,2,1,8;ConvActivAsm1x1U:2,16,2,32,4,2;ConvOclDirectFwd1x1:1,64,1,1,1,1,64,2048,0
1024-14-14-1x1-512-14-14-256-0x0-1x1-1x1-0-NCHW-FP16-B=ConvAsm1x1U:1,16,2,16,1,2,1,8;ConvOclDirectFwd1x1:1,256,1,1,0,2,16,4,0
256-56-56-3x3-128-56-56-4-1x1-1x1-1x1-0-NCHW-FP16-B=ConvOclDirectFwd:8,16,16,32,2,2,8,1,2
576-7-7-1x1-128-7-7-512-0x0-1x1-1x1-0-NCHW-FP32-B=ConvAsm1x1U:2,16,2,32,1,2,2,2;ConvOclDirectFwd1x1:1,256,1,1,0,1,16,8,0
64-55-55-1x1-64-55-55-32-0x0-1x1-1x1-0-NCHW-FP16-F=ConvAsm1x1U:1,16,2,64,2,2,1,4;ConvOclDirectFwd1x1:1,256,1,1,0,1,8,4,0
384-13-13-3x3-192-13-13-128-1x1-1x1-1x1-0-NCHW-FP16-W=ConvAsmBwdWrW3x3:0,1,8,4,3,1
832-7-7-1x1-160-7-7-32-0x0-1x1-1x1-0-NCHW-FP32-F=ConvAsm1x1U:2,8,2,32,1,4,2,2;ConvActivAsm1x1U:3,16,4,16,1,4;ConvOclDirectFwd1x1:1,64,1,1,1,4,16,256,0
256-28-28-1x1-128-28-28-512-0x0-1x1-1x1-0-NCHW-FP32-B=ConvAsm1x1U:1,16,1,32,2,2,2,2;ConvOclDirectFwd1x1:1,128,1,1,0,4,16,4,0
1680-7-7-1x1-192-7-7-16-0x0-1x1-1x1-0-NCHW-FP32-F=ConvAsm1x1U:4,8,4,16,1,4,4,2;ConvActivAsm1x1U:3,16,4,16,1,4;ConvOclDirectFwd1x1:1,64,1,1,1,4,16,256,0
128-14-14-1x1-512-14-14-16-0x0-1x1-1x1-0-NCHW-FP32-B=ConvAsm1x1U:1,16,1,64,2,2,1,4;ConvOclDirectFwd1x1:1,64,1,1,0,4,16,4,0
224-56-56-1x1-128-56-56-512-0x0-1x1-1x1-0-NCHW-FP32-B=ConvAsm1x1U:1,16,1,64,2,2,1,8;ConvOclDirectFwd1x1:1,128,1,1,0,4,16,4,0
256-14-14-1x1-256-14-14-1-0x0-1x1-1x1-0-NCHW-FP32-B=ConvAsm1x1U:1,8,1,64,1,4,4,2;ConvOclDirectFwd1x1:1,64,1,1,0,4,4,8,0
96-109-109-7x7-3-224-224-32-0x0-2x2-1x1-0-NCHW-FP32-B=ConvOclDirectFwd:16,16,32,32,2,2,8,2,1
16-54-54-1x1-96-54-54-512-0x0-1x1-1x1-0-NCHW-FP16-F=ConvAsm1x1U:1,8,2,64,2,4,1,4;ConvOclDirectFwd1x1:1,64,1,1,0,2,32,4,0
224-28-28-1x1-128-28-28-64-0x0-1x1-1x1-0-NCHW-FP32-W=ConvAsmBwdWrW1x1:2,8,2,8,4,1,4,4,0,1
192-14-14-1x1-576-14-14-16-0x0-1x1-1x1-0-NCHW-FP16-W=ConvAsmBwdWrW1x1:2,8,4,4,4,1,2,4,0,0
24-14-14-5x5-64-14-14-128-2x2-1x1-1x1-0-NCHW-FP32-F=ConvOclDirectFwdFused:8,8,16,16,2,2,4,2,2;ConvOclDirectFwd:8,8,16,16,1,1,8,1,2
512-14-14-1x1-160-14-14-1-0x0-1x1-1x1-0-NCHW-FP32-F=ConvAsm1x1U:1,8,1,64,1,4,4,2;ConvActivAsm1x1U:1,16,1,64,1,3;ConvOclDirectFwd1x1:1,64,1,1,1,4,16,64,0
192-14-14-1x1-1824-14-14-16-0x0-1x1-1x1-0-NCHW-FP32-W=ConvAsmBwdWrW1x1:1,16,4,8,4,1,1,4,0,1
32-149-149-3x3-3-299-299-16-0x0-2x2-1x1-0-NCHW-FP32-B=ConvOclDirectFwd:16,16,32,32,2,2,8,2,1
256-56-56-1x1-512-28-28-256-0x0-2x2-1x1-0-NCHW-FP16-F=ConvAsm1x1U:1,8,2,32,4,4,1,8;ConvOclDirectFwd1x1:1,256,1,1,0,2,16,4,0
128-28-28-1x1-192-28-28-512-0x0-1x1-1x1-0-NCHW-FP16-W=ConvAsmBwdWrW1x1:2,8,4,8,2,2,4,4,0,2
320-7-7-3x3-160-7-7-64-1x1-1x1-1x1-0-NCHW-FP16-B=ConvOclDirectFwd:8,8,8,8,1,1,4,1,2
32-54-54-1x1-128-54-54-128-0x0-1x1-1x1-0-NCHW-FP16-B=ConvAsm1x1U:1,16,2,64,1,2,1,4;ConvOclDirectFwd1x1:1,256,1,1,0,4,16,4,0
128-28-28-1x1-384-28-28-64-0x0-1x1-1x1-0-NCHW-FP16-F=ConvAsm1x1U:1,8,2,32,2,4,1,4;ConvOclDirectFwd1x1:1,256,1,1,0,4,16,4,0
48-35-35-5x5-64-35-35-8-2x2-1x1-1x1-0-NCHW-FP16-F=ConvOclDirectFwdFused:8,16,16,16,2,1,8,4,2;ConvOclDirectFwd:8,16,16,16,2,1,8,2,1
768-17-17-1x1-128-17-17-64-0x0-1x1-1x1-0-NCHW-FP16-F=ConvAsm1x1U:1,16,6,32,1,2,1,8;ConvOclDirectFwd1x1:1,64,1,1,0,1,8,4,0
128-38-38-3x3-64-75-75-32-1x1-2x2-1x1-0-NCHW-FP32-W=ConvAsmBwdWrW3x3:0,0,16,4,3,1
160-28-28-1x1-128-28-28-512-0x0-1x1-1x1-0-NCHW-FP32-W=ConvAsmBwdWrW1x1:2,8,2,8,4,2,4,4,0,1
128-17-17-1x1-768-17-17-256-0x0-1x1-1x1-0-NCHW-FP16-W=ConvAsmBwdWrW1x1:4,4,8,4,4,2,1,4,0,1
96-35-35-1x1-384-35-35-32-0x0-1x1-1x1-0-NCHW-FP16-B=ConvAsm1x1U:1,16,2,64,2,2,1,4;ConvOclDirectFwd1x1:1,64,1,1,0,1,16,4,0
1280-8-8-1x1-384-8-8-16-0x0-1x1-1x1-0-NCHW-FP16-F=ConvAsm1x1U:1,8,2,32,1,4,2,2;ConvOclDirectFwd1x1:1,64,1,1,0,2,4,4,0
512-28-28-1x1-128-28-28-64-0x0-1x1-1x1-0-NCHW-FP16-B=ConvAsm1x1U:1,16,2,16,1,2,2,2;ConvOclDirectFwd1x1:1,128,1,1,0,4,16,4,0
256-17-17-3x3-224-35-35-8-0x0-2x2-1x1-0-NCHW-FP32-B=ConvOclDirectFwd:8,16,16,16,2,1,4,1,1
384-7-7-1x1-832-7-7-4-0x0-1x1-1x1-0-NCHW-FP32-W=ConvAsmBwdWrW1x1:1,16,2,4,8,1,1,4,0,0
128-27-27-1x1-32-27-27-256-0x0-1x1-1x1-0-NCHW-FP32-F=ConvAsm1x1U:3,16,3,64,1,2,1,1;ConvOclDirectFwd1x1:1,64,1,1,1,4,16,256,0
96-35-35-3x3-96-35-35-8-1x1-1x1-1x1-0-NCHW-FP16-F=ConvOclDirectFwdFused:16,8,16,16,1,2,8,4,2;ConvOclDirectFwd:16,8,16,16,1,2,8,4,2
256-14-14-1x1-1024-14-14-256-0x0-1x1-1x1-0-NCHW-FP32-F=ConvAsm1x1U:2,16,2,64,3,2,1,4;ConvActivAsm1x1U:2,16,4,64,3,1;ConvOclDirectFwd1x1:1,64,1,1,1,1,64,256,0
256-35-35-1x1-64-35-35-8-0x0-1x1-1x1-0-NCHW-FP32-F=ConvAsm1x1U:1,8,1,32,1,4,1,4;ConvActivAsm1x1U:2,16,2,32,2,4;ConvOclDirectFwd1x1:1,64,1,1,1,0,16,128,0
256-7-7-3x3-256-14-14-512-1x1-2x2-1x1-0-NCHW-FP16-B=ConvOclDirectFwd:16,8,16,16,1,2,4,1,2
32-35-35-1x1-192-35-35-16-0x0-1x1-1x1-0-NCHW-FP16-W=ConvAsmBwdWrW1x1:4,4,4,4,2,1,4,2,0,1
256-28-28-1x1-32-28-28-1-0x0-1x1-1x1-0-NCHW-FP32-F=ConvAsm1x1U:1,8,1,64,1,2,4,1;ConvActivAsm1x1U:1,16,1,32,1,3;ConvOclDirectFwd1x1:1,64,1,1,1,1,16,64,0
2048-8-8-1x1-320-8-8-256-0x0-1x1-1x1-0-NCHW-FP16-F=ConvAsm1x1U:1,8,2,32,4,4,1,4;ConvOclDirectFwd1x1:1,256,1,1,0,4,16,8,0
160-73-73-1x1-64-73-73-256-0x0-1x1-1x1-0-NCHW-FP16-F=ConvAsm1x1U:2,16,4,64,1,2,1,4;ConvOclDirectFwd1x1:16,64,32,32,0,1,16,4,1
672-28-28-1x1-192-28-28-16-0x0-1x1-1x1-0-NCHW-FP32-F=ConvAsm1x1U:2,16,2,16,2,2,2,2;ConvActivAsm1x1U:3,16,5,32,1,1;ConvOclDirectFwd1x1:1,64,1,1,1,1,16,2048,0
832-7-7-1x1-128-7-7-1-0x0-1x1-1x1-0-NCHW-FP32-F=ConvAsm1x1U:1,8,1,16,1,4,4,1;ConvActivAsm1x1U:1,16,1,16,1,4;ConvOclDirectFwd1x1:1,64,1,1,1,1,16,64,0
256-27-27-1x1-64-27-27-32-0x0-1x1-1x1-0-NCHW-FP16-F=ConvAsm1x1U:2,16,4,64,1,2,2,1;ConvOclDirectFwd1x1:1,64,1,1,0,1,8,4,0
384-13-13-3x3-192-13-13-16-1x1-1x1-1x1-0-NCHW-FP32-W=ConvAsmBwdWrW3x3:0,0,16,4,2,1
320-28-28-1x1-128-28-28-32-0x0-1x1-1x1-0-NCHW-FP32-B=ConvAsm1x1U:2,16,2,32,1,2,2,2;ConvOclDirectFwd1x1:16,64,32,32,0,2,16,4,1
320-8-8-3x3-320-17-17-1-0x0-2x2-1x1-0-NCHW-FP32-B=ConvOclDirectFwd:16,32,32,32,2,1,1,4,1
64-224-224-3x3-3-224-224-64-1x1-1x1-1x1-0-NCHW-FP32-W=ConvAsmBwdWrW3x3:0,1,16,1,1,8
128-28-28-1x1-352-28-28-32-0x0-1x1-1x1-0-NCHW-FP32-F=ConvAsm1x1U:1,8,1,16,2,4,1,4;ConvOclDirectFwd1x1:1,64,1,1,1,4,16,2048,0
32-27-27-1x1-256-27-27-16-0x0-1x1-1x1-0-NCHW-FP16-B=ConvAsm1x1U:2,16,4,32,1,2,1,2;ConvOclDirectFwd1x1:1,256,1,1,0,1,4,4,0
16-54-54-1x1-64-54-54-32-0x0-1x1-1x1-0-NCHW-FP32-F=ConvAsm1x1U:1,16,1,64,1,2,1,1;ConvOclDirectFwd1x1:1,64,1,1,1,1,16,256,0
256-56-56-1x1-128-56-56-64-0x0-1x1-1x1-0-NCHW-FP32-F=ConvAsm1x1U:4,16,4,64,1,2,4,1;ConvActivAsm1x1U:3,16,3,64,4,1;ConvOclDirectFwd1x1:1,64,1,1,1,4,16,2048,0
192-14-14-1x1-1200-14-14-16-0x0-1x1-1x1-0-NCHW-FP16-W=ConvAsmBwdWrW1x1:2,8,8,8,2,1,1,4,0,1
64-55-55-1x1-256-55-55-2-0x0-1x1-1x1-0-NCHW-FP32-B=ConvAsm1x1U:1,32,1,64,2,2;ConvOclDirectFwd1x1:1,128,1,1,0,1,16,4,0
16-54-54-1x1-128-54-54-32-0x0-1x1-1x1-0-NCHW-FP32-F=ConvAsm1x1U:1,8,1,64,1,4,1,4;ConvOclDirectFwd1x1:1,64,1,1,1,1,16,2048,0
64-73-73-1x1-160-73-73-32-0x0-1x1-1x1-0-NCHW-FP16-W=ConvAsmBwdWrW1x1:4,4,4,4,4,1,4,4,0,1
208-14-14-3x3-96-14-14-256-1x1-1x1-1x1-0-NCHW-FP16-W=ConvAsmBwdWrW3x3:0,0,8,2,11,4
32-27-27-1x1-128-27-27-16-0x0-1x1-1x1-0-NCHW-FP32-F=ConvAsm1x1U:1,16,1,64,2,2,1,1;ConvOclDirectFwd1x1:1,64,1,1,1,1,16,256,0
16-54-54-3x3-64-54-54-512-1x1-1x1-1x1-0-NCHW-FP16-B=ConvOclDirectFwd:8,16,16,32,2,2,8,1,2
128-4-4-1x1-608-4-4-64-0x0-1x1-1x1-0-NCHW-FP16-B=ConvAsm1x1U:2,4,4,4,1,4,1,8;ConvOclDirectFwd1x1:1,64,1,1,0,2,8,4,0
128-14-14-1x1-672-14-14-128-0x0-1x1-1x1-0-NCHW-FP16-F=ConvAsm1x1U:2,8,4,64,1,4,1,4;ConvOclDirectFwd1x1:1,256,1,1,0,4,8,4,0
384-13-13-3x3-256-13-13-16-1x1-1x1-1x1-0-NCHW-FP16-F=ConvOclDirectFwdFused:8,8,16,16,2,2,4,1,2;ConvOclDirectFwd:16,8,16,16,1,2,8,1,2
256-56-56-1x1-64-56-56-8-0x0-1x1-1x1-0-NCHW-FP16-F=ConvAsm1x1U:1,8,2,64,2,4,2,2;ConvOclDirectFwd1x1:1,64,1,1,0,4,16,4,0
256-27-27-1x1-48-27-27-64-0x0-1x1-1x1-0-NCHW-FP32-W=ConvAsmBwdWrW1x1:4,4,4,4,4,1,4,4,0,2
512-14-14-1x1-1024-14-14-32-0x0-1x1-1x1-0-NCHW-FP16-W=ConvAsmBwdWrW1x1:1,16,8,8,2,1,1,2,0,2
3-10-10-3x3-5-10-10-512-1x1-1x1-1x1-0-NCHW-FP16-F=ConvOclDirectFwd:16,8,16,16,1,2,2,1,2
320-8-8-1x1-1280-8-8-8-0x0-1x1-1x1-0-NCHW-FP32-B=ConvAsm1x1U:1,8,1,32,1,4,1,4;ConvOclDirectFwd1x1:1,256,1,1,0,4,8,8,0
192-28-28-1x1-16-28-28-128-0x0-1x1-1x1-0-NCHW-FP16-F=ConvAsm1x1U:1,8,2,64,1,4,1,2;ConvOclDirectFwd1x1:1,64,1,1,0,4,16,4,0
2048-7-7-1x1-1024-14-14-256-0x0-2x2-1x1-0-NCHW-FP32-W=ConvAsmBwdWrW1x1:1,16,4,4,8,1,1,4,0,1
128-56-56-3x3-256-56-56-512-1x1-1x1-1x1-0-NCHW-FP16-W=ConvAsmBwdWrW3x3:0,0,8,8,1,1
32-28-28-3x3-128-28-28-512-1x1-1x1-1x1-0-NCHW-FP16-B=ConvOclDirectFwd:32,8,32,32,1,4,8,2,1
128-28-28-3x3-192-28-28-32-1x1-1x1-1x1-0-NCHW-FP16-F=ConvOclDirectFwdFused:16,16,32,32,2,2,8,1,1;ConvOclDirectFwd:16,16,32,32,2,2,8,1,2
128-56-56-1x1-64-56-56-16-0x0-1x1-1x1-0-NCHW-FP32-F=ConvAsm1x1U:2,16,2,64,1,2,1,4;ConvOclDirectFwd1x1:1,64,1,1,1,0,16,2048,0
288-35-35-1x1-64-35-35-256-0x0-1x1-1x1-0-NCHW-FP32-B=ConvAsm1x1U:1,16,1,64,2,2,1,4;ConvOclDirectFwd1x1:1,256,1,1,0,1,16,4,0
320-8-8-3x3-192-17-17-4-0x0-2x2-1x1-0-NCHW-FP32-B=ConvOclDirectFwd:16,16,32,32,2,2,4,4,1
768-17-17-1x1-160-17-17-32-0x0-1x1-1x1-0-NCHW-FP32-F=ConvAsm1x1U:4,16,5,64,1,2,4,1;ConvActivAsm1x1U:4,16,7,16,1,1;ConvOclDirectFwd1x1:1,64,1,1,1,1,16,2048,0
2048-7-7-1x1-1024-14-14-64-0x0-2x2-1x1-0-NCHW-FP32-B=ConvAsm1x1U:2,16,2,32,2,2,2,2;ConvOclDirectFwd1x1:1,256,1,1,0,1,32,4,0
192-28-28-1x1-96-28-28-4-0x0-1x1-1x1-0-NCHW-FP16-F=ConvAsm1x1U:1,8,2,16,1,4,2,2;ConvOclDirectFwd1x1:1,64,1,1,0,2,8,4,0
256-28-28-1x1-512-28-28-32-0x0-1x1-1x1-0-NCHW-FP32-B=ConvAsm1x1U:1,16,1,32,2,2,1,4;ConvOclDirectFwd1x1:1,64,1,1,0,4,16,4,0
16-14-14-5x5-48-14-14-256-2x2-1x1-1x1-0-NCHW-FP16-F=ConvOclDirectFwdFused:8,8,16,16,2,2,4,1,2;ConvOclDirectFwd:8,8,16,16,2,2,8,2,1
224-7-7-3x3-160-7-7-32-1x1-1x1-1x1-0-NCHW-FP32-W=ConvAsmBwdWrW3x3:0,0,8,4,2,1
720-28-28-1x1-192-28-28-16-0x0-1x1-1x1-0-NCHW-FP16-F=ConvAsm1x1U:1,8,2,32,2,4,1,8;ConvOclDirectFwd1x1:1,64,1,1,0,2,8,4,0
256-56-56-3x3-128-56-56-2-1x1-1x1-1x1-0-NCHW-FP16-B=ConvOclDirectFwd:16,16,16,32,1,2,8,2,2
64-35-35-1x1-384-35-35-1-0x0-1x1-1x1-0-NCHW-FP16-B=ConvAsm1x1U:1,8,2,64,1,2,2,1;ConvOclDirectFwd1x1:1,64,1,1,0,1,4,4,0
2048-8-8-1x1-384-8-8-128-0x0-1x1-1x1-0-NCHW-FP32-F=ConvAsm1x1U:3,16,4,16,2,2,2,1;ConvActivAsm1x1U:2,16,2,32,3,3;ConvOclDirectFwd1x1:1,64,1,1,1,0,16,2048,0
320-8-8-1x1-1280-8-8-64-0x0-1x1-1x1-0-NCHW-FP32-B=ConvAsm1x1U:1,16,1,64,2,2,1,4;ConvOclDirectFwd1x1:8,64,8,8,0,2,16,4,1
96-54-54-1x1-16-54-54-512-0x0-1x1-1x1-0-NCHW-FP32-W=ConvAsmBwdWrW1x1:4,4,2,2,2,1,4,4,0,1
192-13-13-3x3-384-13-13-128-1x1-1x1-1x1-0-NCHW-FP16-B=ConvOclDirectFwd:8,8,16,16,2,2,8,2,1
32-64-128-1x1-512-64-128-1-0x0-1x1-1x1-0-NCHW-FP32-W=ConvAsmBwdWrW1x1:4,4,2,2,4,1,1,4,0,1
512-7-7-1x1-1024-14-14-2-0x0-2x2-1x1-0-NCHW-FP32-W=ConvAsmBwdWrW1x1:1,16,8,2,4,1,1,2,0,1
324-3-3-3x3-256-3-3-32-1x1-1x1-1x1-0-NCHW-FP32-W=ConvAsmBwdWrW3x3:0,0,8,2,3,2
928-14-14-1x1-128-14-14-128-0x0-1x1-1x1-0-NCHW-FP32-B=ConvAsm1x1U:1,32,1,32,2,1,4,1;ConvOclDirectFwd1x1:1,64,1,1,0,4,16,4,0
128-10-10-3x3-256-5-5-32-1x1-2x2-1x1-0-NCHW-FP32-F=ConvOclDirectFwd:8,8,8,8,1,1,8,2,2
128-28-28-1x1-256-14-14-256-0x0-2x2-1x1-0-NCHW-FP16-F=ConvAsm1x1U:2,8,4,64,1,4,1,8;ConvOclDirectFwd1x1:1,256,1,1,0,2,32,4,0
48-27-27-1x1-384-27-27-64-0x0-1x1-1x1-0-NCHW-FP16-B=ConvAsm1x1U:1,16,2,16,1,2,1,4;ConvOclDirectFwd1x1:16,64,32,32,0,1,16,4,1
64-73-73-1x1-160-73-73-4-0x0-1x1-1x1-0-NCHW-FP16-W=ConvAsmBwdWrW1x1:4,4,8,4,2,1,4,4,0,1
256-13-13-3x3-256-13-13-1024-1x1-1x1-1x1-0-NCHW-FP16-W=ConvAsmBwdWrW3x3:0,1,8,8,6,1
256-14-14-1x1-528-14-14-32-0x0-1x1-1x1-0-NCHW-FP32-B=ConvAsm1x1U:1,16,1,64,2,1,1,2;ConvOclDirectFwd1x1:1,64,1,1,0,4,16,4,0
96-14-14-3x3-208-14-14-64-1x1-1x1-1x1-0-NCHW-FP16-F=ConvOclDirectFwdFused:8,16,16,16,2,1,8,1,1;ConvOclDirectFwd:8,16,16,16,2,1,8,4,2
96-73-73-3x3-64-147-147-1-0x0-2x2-1x1-0-NCHW-FP16-B=ConvOclDirectFwd:16,8,32,32,2,4,4,4,1
64-55-55-1x1-64-55-55-16-0x0-1x1-1x1-0-NCHW-FP32-W=ConvAsmBwdWrW1x1:8,2,8,2,4,1,4,4
256-27-27-3x3-64-27-27-128-1x1-1x1-1x1-0-NCHW-FP16-W=ConvAsmBwdWrW3x3:0,1,16,4,3,1
128-28-28-3x3-128-28-28-16-1x1-1x1-1x1-0-NCHW-FP16-W=ConvAsmBwdWrW3x3:0,0,16,4,2,1
64-35-35-1x1-384-35-35-4-0x0-1x1-1x1-0-NCHW-FP16-W=ConvAsmBwdWrW1x1:4,4,4,4,2,1,1,2,0,1
128-14-14-1x1-928-14-14-32-0x0-1x1-1x1-0-NCHW-FP32-F=ConvAsm1x1U:4,8,4,64,1,4,1,4;ConvOclDirectFwd1x1:1,64,1,1,1,0,16,256,0
256-7-7-1x1-832-7-7-256-0x0-1x1-1x1-0-NCHW-FP16-B=ConvAsm1x1U:2,16,4,16,1,2,1,2;ConvOclDirectFwd1x1:1,256,1,1,0,1,16,4,0
16-54-54-1x1-64-54-54-64-0x0-1x1-1x1-0-NCHW-FP16-B=ConvAsm1x1U:1,8,2,64,1,4,1,2;ConvOclDirectFwd1x1:1,256,1,1,0,2,16,4,0
32-54-54-1x1-128-54-54-128-0x0-1x1-1x1-0-NCHW-FP32-W=ConvAsmBwdWrW1x1:4,4,4,4,2,1,4,4,0,1
512-7-7-1x1-512-7-7-16-0x0-1x1-1x1-0-NCHW-FP32-B=ConvAsm1x1U:2,8,2,32,1,2,2,4;ConvOclDirectFwd1x1:1,128,1,1,0,1,8,4,0
256-28-28-1x1-64-28-28-128-0x0-1x1-1x1-0-NCHW-FP16-F=ConvAsm1x1U:1,8,2,32,2,4,1,8;ConvOclDirectFwd1x1:1,128,1,1,0,4,16,4,0
1024-14-14-1x1-512-28-28-2-0x0-2x2-1x1-0-NCHW-FP16-W=ConvAsmBwdWrW1x1:1,16,4,4,4,1,1,4,0,0
192-7-7-1x1-832-7-7-256-0x0-1x1-1x1-0-NCHW-FP16-B=ConvAsm1x1U:2,16,4,16,1,2,1,2;ConvOclDirectFwd1x1:1,128,1,1,0,1,8,4,0
512-14-14-3x3-512-14-14-64-1x1-1x1-1x1-0-NCHW-FP16-B=ConvOclDirectFwd:8,8,16,16,2,2,8,2,1
128-104-104-3x3-64-104-104-256-1x1-1x1-1x1-0-NCHW-FP32-W=ConvAsmBwdWrW3x3:0,0,16,4,2,1
160-17-17-1x1-768-17-17-128-0x0-1x1-1x1-0-NCHW-FP32-W=ConvAsmBwdWrW1x1:2,8,4,8,4,1,2,4,0,1
256-28-28-1x1-64-28-28-512-0x0-1x1-1x1-0-NCHW-FP32-F=ConvAsm1x1U:1,16,1,32,4,2,1,4;ConvActivAsm1x1U:1,32,1,32,3,1;ConvOclDirectFwd1x1:1,64,1,1,1,0,16,2048,0
1024-14-14-1x1-512-7-7-512-0x0-2x2-1x1-0-NCHW-FP32-F=ConvAsm1x1U:3,16,4,16,1,2,1,8;ConvOclDirectFwd1x1:1,64,1,1,1,4,32,2048,0
384-7-7-1x1-832-7-7-16-0x0-1x1-1x1-0-NCHW-FP16-B=ConvAsm1x1U:1,16,2,32,1,2,4,1;ConvOclDirectFwd1x1:1,64,1,1,0,1,8,4,0
288-56-56-1x1-192-56-56-16-0x0-1x1-1x1-0-NCHW-FP32-F=ConvAsm1x1U:2,16,4,32,1,2,1,4;ConvActivAsm1x1U:1,16,3,32,2,1;ConvOclDirectFwd1x1:1,64,1,1,1,1,64,2048,0
800-7-7-1x1-128-7-7-128-0x0-1x1-1x1-0-NCHW-FP32-W=ConvAsmBwdWrW1x1:2,8,4,8,2,1,2,4,0,0
384-17-17-3x3-288-35-35-1-0x0-2x2-1x1-0-NCHW-FP32-B=ConvOclDirectFwd:16,16,16,32,1,2,4,2,1
736-7-7-1x1-128-7-7-256-0x0-1x1-1x1-0-NCHW-FP32-W=ConvAsmBwdWrW1x1:2,8,4,4,4,1,2,4,0,0
672-14-14-1x1-128-14-14-512-0x0-1x1-1x1-0-NCHW-FP16-F=ConvAsm1x1U:2,8,4,32,1,4,1,8;ConvOclDirectFwd1x1:1,256,1,1,0,4,8,4,0
64-224-224-3x3-3-224-224-1-1x1-1x1-1x1-0-NCHW-FP16-B=ConvOclDirectFwd:16,16,16,16,1,1,2,4,1
96-35-35-3x3-64-35-35-16-1x1-1x1-1x1-0-NCHW-FP16-W=ConvAsmBwdWrW3x3:0,0,8,2,3,2
256-14-14-1x1-528-14-14-16-0x0-1x1-1x1-0-NCHW-FP16-W=ConvAsmBwdWrW1x1:2,8,2,8,2,1,4,4,0,2
512-14-14-3x3-512-14-14-32-1x1-1x1-1x1-0-NCHW-FP16-W=ConvAsmBwdWrW3x3:0,0,8,4,2,1
256-28-28-1x1-128-28-28-512-0x0-1x1-1x1-0-NCHW-FP32-F=ConvAsm1x1U:1,16,1,16,4,2,1,4;ConvActivAsm1x1U:2,32,2,16,3,1;ConvOclDirectFwd1x1:1,64,1,1,1,4,16,256,0
128-112-112-3x3-128-112-112-512-1x1-1x1-1x1-0-NCHW-FP16-B=ConvOclDirectFwd:8,16,16,32,2,2,8,1,1
128-28-28-3x3-128-56-56-16-1x1-2x2-1x1-0-NCHW-FP32-W=ConvAsmBwdWrW3x3:0,0,8,4,4,1
960-14-14-1x1-128-14-14-128-0x0-1x1-1x1-0-NCHW-FP32-B=ConvAsm1x1U:1,32,1,16,2,1,4,1;ConvOclDirectFwd1x1:1,128,1,1,0,2,16,4,0
32-27-27-1x1-256-27-27-512-0x0-1x1-1x1-0-NCHW-FP16-F=ConvAsm1x1U:1,8,2,64,1,4,1,2;ConvOclDirectFwd1x1:1,128,1,1,0,1,8,4,0
32-54-54-1x1-128-54-54-256-0x0-1x1-1x1-0-NCHW-FP16-B=ConvAsm1x1U:1,16,2,64,1,2,1,4;ConvOclDirectFwd1x1:1,256,1,1,0,2,16,4,0
96-14-14-1x1-608-14-14-32-0x0-1x1-1x1-0-NCHW-FP32-W=ConvAsmBwdWrW1x1:1,16,2,8,4,1,4,4,0,1
32-54-54-1x1-128-54-54-32-0x0-1x1-1x1-0-NCHW-FP32-W=ConvAsmBwdWrW1x1:4,4,4,4,2,1,4,4,0,1
192-14-14-1x1-480-14-14-4-0x0-1x1-1x1-0-NCHW-FP16-B=ConvAsm1x1U:1,8,2,64,1,4,2,1;ConvOclDirectFwd1x1:1,64,1,1,0,4,4,4,0
32-14-14-1x1-528-14-14-256-0x0-1x1-1x1-0-NCHW-FP32-W=ConvAsmBwdWrW1x1:2,8,2,8,4,1,4,4,0,1
576-14-14-1x1-192-14-14-32-0x0-1x1-1x1-0-NCHW-FP32-F=ConvAsm1x1U:4,16,4,64,1,2,2,1;ConvActivAsm1x1U:2,16,3,16,2,2;ConvOclDirectFwd1x1:1,64,1,1,1,4,16,2048,0
160-14-14-1x1-608-14-14-32-0x0-1x1-1x1-0-NCHW-FP16-B=ConvAsm1x1U:1,16,2,16,1,2,2,2;ConvOclDirectFwd1x1:1,64,1,1,0,4,8,4,0
32-27-27-1x1-256-27-27-128-0x0-1x1-1x1-0-NCHW-FP16-F=ConvAsm1x1U:1,8,2,16,1,4,1,4;ConvOclDirectFwd1x1:1,128,1,1,0,1,8,4,0
96-14-14-1x1-480-14-14-512-0x0-1x1-1x1-0-NCHW-FP32-B=ConvAsm1x1U:1,16,1,32,2,2,1,8;ConvOclDirectFwd1x1:1,64,1,1,0,1,32,4,0
384-13-13-3x3-384-13-13-128-1x1-1x1-1x1-0-NCHW-FP32-W=ConvAsmBwdWrW3x3:0,1,16,4,9,1
64-56-56-3x3-64-56-56-32-1x1-1x1-1x1-0-NCHW-FP16-W=ConvAsmBwdWrW3x3:0,1,8,4,1,4
256-7-7-1x1-832-7-7-8-0x0-1x1-1x1-0-NCHW-FP16-B=ConvAsm1x1U:1,8,2,16,1,4,2,8;ConvOclDirectFwd1x1:1,256,1,1,0,1,4,4,0
96-28-28-3x3-96-28-28-32-1x1-1x1-1x1-0-NCHW-FP16-W=ConvAsmBwdWrW3x3:0,0,8,2,7,2
256-28-28-1x1-128-28-28-128-0x0-1x1-1x1-0-NCHW-FP16-F=ConvAsm1x1U:1,8,2,32,2,4,1,8;ConvOclDirectFwd1x1:1,128,1,1,0,2,8,4,0
2048-7-7-1x1-512-7-7-4-0x0-1x1-1x1-0-NCHW-FP16-B=ConvAsm1x1U:1,8,2,32,1,2,4,2;ConvOclDirectFwd1x1:1,64,1,1,0,1,4,4,0
544-14-14-1x1-128-14-14-128-0x0-1x1-1x1-0-NCHW-FP32-B=ConvAsm1x1U:1,32,1,16,2,1,4,1;ConvOclDirectFwd1x1:1,64,1,1,0,2,16,4,0
528-14-14-1x1-128-14-14-8-0x0-1x1-1x1-0-NCHW-FP16-F=ConvAsm1x1U:1,8,2,64,1,4,4,1;ConvOclDirectFwd1x1:1,64,1,1,0,4,4,4,0
128-14-14-1x1-528-14-14-256-0x0-1x1-1x1-0-NCHW-FP16-B=ConvAsm1x1U:1,16,2,16,1,2,1,4;ConvOclDirectFwd1x1:8,64,16,16,0,2,16,4,1
64-56-56-1x1-256-56-56-4-0x0-1x1-1x1-0-NCHW-FP16-F=ConvAsm1x1U:1,8,2,16,1,4,2,2;ConvOclDirectFwd1x1:1,64,1,1,0,2,8,4,0
32-149-149-3x3-32-147-147-256-0x0-1x1-1x1-0-NCHW-FP32-F=ConvOclDirectFwd:16,16,16,32,1,2,8,4,1
192-8-8-1x1-1280-8-8-4-0x0-1x1-1x1-0-NCHW-FP16-W=ConvAsmBwdWrW1x1:1,16,4,4,2,1,1,4,0,0
128-112-112-3x3-64-112-112-64-1x1-1x1-1x1-0-NCHW-FP16-B=ConvOclDirectFwd:16,8,16,32,1,4,8,1,2
256-14-14-3x3-256-30-30-64-0x0-2x2-1x1-0-NCHW-FP32-B=ConvOclDirectFwd:32,16,32,32,1,2,4,4,1
512-14-14-3x3-512-14-14-128-1x1-1x1-1x1-0-NCHW-FP32-W=ConvAsmBwdWrW3x3:0,1,8,4,4,1
896-14-14-1x1-128-14-14-512-0x0-1x1-1x1-0-NCHW-FP32-W=ConvAsmBwdWrW1x1:2,8,4,8,4,1,2,4,0,1
128-28-28-3x3-256-14-14-12-1x1-2x2-1x1-0-NCHW-FP32-F=ConvOclDirectFwd:8,16,16,16,2,1,8,1,2
32-28-28-1x1-256-28-28-512-0x0-1x1-1x1-0-NCHW-FP32-B=ConvAsm1x1U:1,16,1,32,1,2,1,4;ConvOclDirectFwd1x1:1,64,1,1,0,2,32,4,0
128-14-14-1x1-512-14-14-1-0x0-1x1-1x1-0-NCHW-FP32-W=ConvAsmBwdWrW1x1:2,8,2,2,2,1,1,4,0,1
128-56-56-1x1-256-56-56-16-0x0-1x1-1x1-0-NCHW-FP16-B=ConvAsm1x1U:1,16,2,32,1,2,1,4;ConvOclDirectFwd1x1:1,64,1,1,0,4,16,4,0
208-64-128-3x3-96-64-128-1-1x1-1x1-1x1-0-NCHW-FP32-W=ConvAsmBwdWrW3x3:0,1,16,4,2,1
96-28-28-1x1-192-28-28-16-0x0-1x1-1x1-0-NCHW-FP32-W=ConvAsmBwdWrW1x1:2,8,2,4,4,2,4,4,0,1
384-13-13-3x3-192-13-13-50-1x1-1x1-1x1-0-NCHW-FP32-W=ConvAsmBwdWrW3x3:0,0,8,4,2,1
96-109-109-7x7-3-224-224-256-0x0-2x2-1x1-0-NCHW-FP32-B=ConvOclDirectFwd:16,16,32,32,2,2,8,2,1
128-56-56-1x1-256-56-56-32-0x0-1x1-1x1-0-NCHW-FP32-B=ConvAsm1x1U:1,16,1,64,2,2,1,4;ConvOclDirectFwd1x1:1,128,1,1,0,2,16,4,0
192-7-7-1x1-1920-7-7-16-0x0-1x1-1x1-0-NCHW-FP16-B=ConvAsm1x1U:1,16,2,16,1,2,2,2;ConvOclDirectFwd1x1:1,64,1,1,0,1,8,4,0
224-7-7-3x3-224-7-7-32-1x1-1x1-1x1-0-NCHW-FP16-W=ConvAsmBwdWrW3x3:0,1,8,4,4,1
256-53-53-3x3-512-26-26-256-0x0-2x2-1x1-0-NCHW-FP32-F=ConvOclDirectFwd:8,32,32,32,4,1,8,1,1
16-14-14-5x5-48-14-14-128-2x2-1x1-1x1-0-NCHW-FP32-F=ConvOclDirectFwdFused:8,8,16,16,2,2,4,2,2;ConvOclDirectFwd:8,8,16,16,1,1,8,2,2
832-7-7-1x1-160-7-7-1-0x0-1x1-1x1-0-NCHW-FP16-F=ConvAsm1x1U:1,8,2,16,1,4,4,1;ConvOclDirectFwd1x1:1,256,1,1,0,1,4,8,0
128-56-56-3x3-32-56-56-512-1x1-1x1-1x1-0-NCHW-FP16-F=ConvOclDirectFwd:32,8,32,32,1,4,8,1,1
192-14-14-1x1-1920-14-14-16-0x0-1x1-1x1-0-NCHW-FP32-B=ConvAsm1x1U:1,32,1,16,2,1,2,1;ConvOclDirectFwd1x1:1,128,1,1,0,2,16,4,0
128-56-56-3x3-128-28-28-64-1x1-2x2-1x1-0-NCHW-FP32-F=ConvOclDirectFwd:32,8,32,32,1,4,8,1,1
32-7-7-5x5-128-7-7-1-2x2-1x1-1x1-0-NCHW-FP32-F=ConvOclDirectFwdFused:8,8,8,8,1,1,1,4,1;ConvOclDirectFwd:8,8,8,8,1,1,1,4,1
128-54-54-1x1-32-54-54-512-0x0-1x1-1x1-0-NCHW-FP16-F=ConvAsm1x1U:1,8,2,64,1,4,1,4;ConvOclDirectFwd1x1:1,128,1,1,0,4,16,4,0
192-28-28-1x1-16-28-28-4-0x0-1x1-1x1-0-NCHW-FP32-F=ConvAsm1x1U:1,8,1,64,1,4,4,1;ConvActivAsm1x1U:1,16,1,32,1,4;ConvOclDirectFwd1x1:1,64,1,1,1,1,64,64,0
128-14-14-1x1-992-14-14-128-0x0-1x1-1x1-0-NCHW-FP32-F=ConvAsm1x1U:2,16,3,16,2,2,1,2;ConvOclDirectFwd1x1:1,64,1,1,1,0,16,256,0
16-54-54-1x1-96-54-54-128-0x0-1x1-1x1-0-NCHW-FP16-F=ConvAsm1x1U:1,8,2,64,1,4,1,4;ConvOclDirectFwd1x1:1,256,1,1,0,4,16,4,0
96-28-28-1x1-192-28-28-128-0x0-1x1-1x1-0-NCHW-FP32-W=ConvAsmBwdWrW1x1:2,8,2,4,4,1,2,4,0,3
512-7-7-1x1-1024-14-14-512-0x0-2x2-1x1-0-NCHW-FP32-B=ConvAsm1x1U:1,16,1,64,2,2,1,2;ConvOclDirectFwd1x1:1,128,1,1,0,1,32,4,0
64-112-112-7x7-3-225-225-16-2x2-2x2-1x1-0-NCHW-FP16-B=ConvOclDirectFwd:16,16,32,32,2,2,8,2,1
256-28-28-1x1-32-28-28-8-0x0-1x1-1x1-0-NCHW-FP32-F=ConvAsm1x1U:1,8,1,16,1,4,2,1;ConvActivAsm1x1U:1,16,2,16,1,4;ConvOclDirectFwd1x1:1,64,1,1,1,4,64,64,0
16-54-54-1x1-64-54-54-64-0x0-1x1-1x1-0-NCHW-FP32-F=ConvAsm1x1U:1,8,1,64,1,4,1,2;ConvOclDirectFwd1x1:1,64,1,1,1,4,16,256,0
512-7-7-3x3-512-7-7-512-1x1-1x1-1x1-0-NCHW-FP16-W=ConvAsmBwdWrW3x3:0,1,8,4,4,1
192-28-28-1x1-32-28-28-4-0x0-1x1-1x1-0-NCHW-FP32-F=ConvAsm1x1U:1,8,1,16,1,4,4,1;ConvActivAsm1x1U:1,16,1,16,1,4;ConvOclDirectFwd1x1:1,64,1,1,1,0,16,2048,0
32-28-28-1x1-192-28-28-256-0x0-1x1-1x1-0-NCHW-FP16-B=ConvAsm1x1U:1,16,2,32,1,2,1,4;ConvOclDirectFwd1x1:1,64,1,1,0,4,16,4,0
512-28-28-1x1-128-28-28-2-0x0-1x1-1x1-0-NCHW-FP32-W=ConvAsmBwdWrW1x1:2,8,4,4,2,1,2,4,0,0
1024-7-7-1x1-256-14-14-1-0x0-2x2-1x1-0-NCHW-FP16-W=ConvAsmBwdWrW1x1:1,16,4,4,2,1,1,2,0,1
1024-17-17-1x1-384-17-17-16-0x0-1x1-1x1-0-NCHW-FP32-B=ConvAsm1x1U:3,16,5,16,1,2,2,2;ConvOclDirectFwd1x1:1,64,1,1,0,1,16,8,0
128-56-56-1x1-256-56-56-16-0x0-1x1-1x1-0-NCHW-FP32-W=ConvAsmBwdWrW1x1:2,8,4,2,8,1,4,4,0,1
64-56-56-3x3-64-56-56-4-1x1-1x1-1x1-0-NCHW-FP16-F=ConvOclDirectFwdFused:8,32,16,32,2,1,8,4,2;ConvOclDirectFwd:8,32,16,32,2,1,8,4,2
384-17-17-1x1-1024-17-17-64-0x0-1x1-1x1-0-NCHW-FP32-B=ConvAsm1x1U:1,16,1,64,2,2,1,4;ConvOclDirectFwd1x1:1,256,1,1,0,1,16,4,0
64-27-27-1x1-384-27-27-256-0x0-1x1-1x1-0-NCHW-FP16-W=ConvAsmBwdWrW1x1:2,8,4,8,2,2,4,4,0,1
256-13-13-3x3-384-13-13-64-1x1-1x1-1x1-0-NCHW-FP16-F=ConvOclDirectFwd:8,8,16,16,2,2,8,1,2
1024-17-17-1x1-128-17-17-256-0x0-1x1-1x1-0-NCHW-FP16-F=ConvAsm1x1U:2,16,6,32,1,2,1,8;ConvOclDirectFwd1x1:16,64,32,32,0,1,16,4,1
288-28-28-1x1-128-28-28-512-0x0-1x1-1x1-0-NCHW-FP16-F=ConvAsm1x1U:3,8,6,16,1,4,1,4;ConvOclDirectFwd1x1:1,64,1,1,0,4,16,4,0
128-38-38-3x3-64-75-75-32-1x1-2x2-1x1-0-NCHW-FP32-B=ConvOclDirectFwd:16,16,16,16,1,1,4,1,2
192-28-28-1x1-288-28-28-16-0x0-1x1-1x1-0-NCHW-FP32-W=ConvAsmBwdWrW1x1:1,16,2,8,2,1,4,4,0,1
192-28-28-1x1-240-28-28-16-0x0-1x1-1x1-0-NCHW-FP16-W=ConvAsmBwdWrW1x1:4,4,8,2,4,1,2,4,0,0
1024-14-14-1x1-512-14-14-32-0x0-1x1-1x1-0-NCHW-FP32-F=ConvAsm1x1U:4,16,4,64,1,2,1,8;ConvActivAsm1x1U:2,32,7,32,1,1;ConvOclDirectFwd1x1:1,64,1,1,1,0,64,2048,0
16-14-14-1x1-480-14-14-32-0x0-1x1-1x1-0-NCHW-FP32-W=ConvAsmBwdWrW1x1:4,4,2,4,4,1,4,2,0,1
96-35-35-3x3-64-35-35-8-1x1-1x1-1x1-0-NCHW-FP16-B=ConvOclDirectFwd:16,8,16,16,1,2,8,1,2
192-17-17-1x1-1024-17-17-128-0x0-1x1-1x1-0-NCHW-FP32-B=ConvAsm1x1U:1,32,1,64,2,1,1,2;ConvOclDirectFwd1x1:1,256,1,1,0,1,16,4,0
128-17-17-1x1-768-17-17-128-0x0-1x1-1x1-0-NCHW-FP16-W=ConvAsmBwdWrW1x1:2,8,4,4,4,1,4,4,0,1
64-28-28-1x1-256-28-28-128-0x0-1x1-1x1-0-NCHW-FP32-B=ConvAsm1x1U:1,16,1,32,2,2,1,4;ConvOclDirectFwd1x1:1,64,1,1,0,4,16,4,0
48-14-14-5x5-16-14-14-256-2x2-1x1-1x1-0-NCHW-FP32-B=ConvOclDirectFwd:8,8,16,16,2,2,4,1,2
448-8-8-1x1-2048-8-8-128-0x0-1x1-1x1-0-NCHW-FP32-B=ConvAsm1x1U:1,16,1,64,2,2,1,4;ConvOclDirectFwd1x1:1,128,1,1,0,4,16,4,0
256-8-8-1x1-1536-8-8-1-0x0-1x1-1x1-0-NCHW-FP32-W=ConvAsmBwdWrW1x1:1,16,8,2,4,1,1,4,0,0
528-14-14-1x1-256-14-14-512-0x0-1x1-1x1-0-NCHW-FP32-F=ConvAsm1x1U:3,16,4,64,1,2,1,2;ConvActivAsm1x1U:4,32,7,32,1,1;ConvOclDirectFwd1x1:1,64,1,1,1,1,16,2048,0
32-128-256-1x1-192-128-256-1-0x0-1x1-1x1-0-NCHW-FP32-W=ConvAsmBwdWrW1x1:4,4,2,1,8,1,1,4,0,2
256-17-17-3x3-224-35-35-128-0x0-2x2-1x1-0-NCHW-FP16-B=ConvOclDirectFwd:16,16,16,16,1,1,4,1,2
2048-7-7-1x1-512-7-7-8-0x0-1x1-1x1-0-NCHW-FP32-F=ConvAsm1x1U:2,8,4,16,1,2,4,1;ConvActivAsm1x1U:4,16,4,16,1,3;ConvOclDirectFwd1x1:1,64,1,1,1,1,64,256,0
528-14-14-1x1-256-14-14-8-0x0-1x1-1x1-0-NCHW-FP16-F=ConvAsm1x1U:2,8,4,64,1,4,4,4;ConvOclDirectFwd1x1:1,128,1,1,0,4,4,4,0
256-28-28-3x3-512-28-28-64-1x1-1x1-1x1-0-NCHW-FP16-W=ConvAsmBwdWrW3x3:0,1,8,4,1,1
1248-7-7-1x1-192-7-7-16-0x0-1x1-1x1-0-NCHW-FP32-F=ConvAsm1x1U:1,8,1,64,4,4,4,2;ConvActivAsm1x1U:1,16,2,32,2,4;ConvOclDirectFwd1x1:1,64,1,1,1,4,16,256,0
64-55-55-1x1-64-55-55-32-0x0-1x1-1x1-0-NCHW-FP32-W=ConvAsmBwdWrW1x1:4,4,2,4,2,1,2,2,0,3
384-13-13-3x3-384-13-13-16-1x1-1x1-1x1-0-NCHW-FP16-W=ConvAsmBwdWrW3x3:0,0,8,8,4,1
192-8-8-3x3-192-17-17-128-0x0-2x2-1x1-0-NCHW-FP16-B=ConvOclDirectFwd:32,32,32,32,1,1,4,2,2
512-28-28-3x3-256-28-28-128-1x1-1x1-1x1-0-NCHW-FP16-W=ConvAsmBwdWrW3x3:0,0,8,4,2,1
256-56-56-1x1-64-56-56-1-0x0-1x1-1x1-0-NCHW-FP16-F=ConvAsm1x1U:1,8,2,64,1,4,4,1;ConvOclDirectFwd1x1:1,256,1,1,0,2,4,4,0
256-7-7-1x1-832-7-7-256-0x0-1x1-1x1-0-NCHW-FP32-W=ConvAsmBwdWrW1x1:1,16,4,4,8,1,2,4,0,1
512-14-14-1x1-160-14-14-256-0x0-1x1-1x1-0-NCHW-FP32-F=ConvAsm1x1U:2,16,2,64,3,2,2,2;ConvActivAsm1x1U:4,16,7,32,1,2;ConvOclDirectFwd1x1:1,64,1,1,1,1,16,2048,0
64-35-35-1x1-192-35-35-8-0x0-1x1-1x1-0-NCHW-FP16-W=ConvAsmBwdWrW1x1:4,4,4,4,2,1,4,4,0,0
1024-14-14-1x1-512-14-14-256-0x0-1x1-1x1-0-NCHW-FP32-F=ConvAsm1x1U:4,16,4,64,3,2,1,4;ConvActivAsm1x1U:4,16,7,32,1,2;ConvOclDirectFwd1x1:1,64,1,1,1,1,64,2048,0
48-27-27-3x3-192-27-27-128-1x1-1x1-1x1-0-NCHW-FP32-W=ConvAsmBwdWrW3x3:0,1,8,2,6,4
5-10-10-3x3-3-10-10-32-1x1-1x1-1x1-0-NCHW-FP16-B=ConvOclDirectFwd:16,8,16,16,1,2,1,1,2
384-35-35-1x1-64-35-35-64-0x0-1x1-1x1-0-NCHW-FP16-F=ConvAsm1x1U:3,8,6,32,1,4,1,4;ConvOclDirectFwd1x1:1,128,1,1,0,1,16,4,0
128-28-28-1x1-352-28-28-32-0x0-1x1-1x1-0-NCHW-FP16-B=ConvAsm1x1U:1,16,2,16,1,2,2,2;ConvOclDirectFwd1x1:1,256,1,1,0,4,16,4,0
160-14-14-1x1-512-14-14-128-0x0-1x1-1x1-0-NCHW-FP16-W=ConvAsmBwdWrW1x1:2,8,4,8,2,1,2,4,0,1
32-7-7-5x5-128-7-7-16-2x2-1x1-1x1-0-NCHW-FP16-F=ConvOclDirectFwdFused:8,8,8,8,1,1,2,4,2;ConvOclDirectFwd:8,8,8,8,1,1,2,2,2
1024-17-17-1x1-384-17-17-4-0x0-1x1-1x1-0-NCHW-FP16-F=ConvAsm1x1U:2,8,4,16,1,4,2,2;ConvOclDirectFwd1x1:1,256,1,1,0,1,8,8,0
2048-7-7-1x1-512-7-7-32-0x0-1x1-1x1-0-NCHW-FP32-F=ConvAsm1x1U:4,8,4,16,2,4,1,4;ConvActivAsm1x1U:2,16,4,16,2,2;ConvOclDirectFwd1x1:1,64,1,1,1,0,16,2048,0
128-14-14-1x1-528-14-14-16-0x0-1x1-1x1-0-NCHW-FP16-B=ConvAsm1x1U:1,16,2,16,1,2,2,2;ConvOclDirectFwd1x1:1,64,1,1,0,4,8,4,0
256-28-28-3x3-512-28-28-16-1x1-1x1-1x1-0-NCHW-FP16-F=ConvOclDirectFwdFused:16,16,32,32,2,2,8,1,1;ConvOclDirectFwd:16,16,32,32,2,2,8,1,1
288-14-14-3x3-144-14-14-16-1x1-1x1-1x1-0-NCHW-FP16-W=ConvAsmBwdWrW3x3:0,1,8,2,8,2
288-64-128-3x3-144-64-128-1-1x1-1x1-1x1-0-NCHW-FP16-B=ConvOclDirectFwd:16,16,16,32,1,2,8,4,1
256-52-52-3x3-128-52-52-256-1x1-1x1-1x1-0-NCHW-FP32-W=ConvAsmBwdWrW3x3:0,1,8,4,2,1
256-64-128-1x1-528-64-128-1-0x0-1x1-1x1-0-NCHW-FP32-B=ConvOclDirectFwd1x1:1,256,1,1,0,2,16,4,0
512-7-7-3x3-512-14-14-64-1x1-2x2-1x1-0-NCHW-FP32-B=ConvOclDirectFwd:8,8,8,8,1,1,4,4,2
192-56-56-1x1-288-56-56-16-0x0-1x1-1x1-0-NCHW-FP16-B=ConvAsm1x1U:1,16,2,32,1,2,1,2;ConvOclDirectFwd1x1:1,256,1,1,0,4,16,4,0
4-2-2-3x3-3-6-6-64-0x0-2x2-1x1-0-NCHW-FP32-B=ConvOclDirectFwd:8,8,8,8,1,1,1,2,2
128-28-28-1x1-256-28-28-512-0x0-1x1-1x1-0-NCHW-FP32-F=ConvAsm1x1U:1,8,1,32,2,4,2,4;ConvOclDirectFwd1x1:1,64,1,1,1,0,16,256,0
192-71-71-3x3-80-73-73-256-0x0-1x1-1x1-0-NCHW-FP16-B=ConvOclDirectFwd:16,8,16,16,1,2,8,1,2
512-7-7-1x1-1024-14-14-1-0x0-2x2-1x1-0-NCHW-FP32-B=ConvAsm1x1U:1,8,1,64,1,4,4,2;ConvOclDirectFwd1x1:1,256,1,1,0,1,4,4,0
2048-8-8-1x1-448-8-8-8-0x0-1x1-1x1-0-NCHW-FP16-F=ConvAsm1x1U:2,8,4,16,1,4,4,1;ConvOclDirectFwd1x1:1,64,1,1,0,2,4,4,0
128-28-28-1x1-256-55-55-64-0x0-2x2-1x1-0-NCHW-FP32-W=ConvAsmBwdWrW1x1:1,16,2,4,4,1,8,4
1024-17-17-1x1-192-17-17-64-0x0-1x1-1x1-0-NCHW-FP16-F=ConvAsm1x1U:2,8,4,16,2,4,1,8;ConvOclDirectFwd1x1:1,64,1,1,0,1,8,4,0
256-13-13-3x3-64-13-13-256-1x1-1x1-1x1-0-NCHW-FP16-F=ConvOclDirectFwd:8,8,16,16,2,2,8,2,1
48-35-35-5x5-64-35-35-16-2x2-1x1-1x1-0-NCHW-FP32-F=ConvOclDirectFwdFused:8,8,16,16,2,2,4,1,2;ConvOclDirectFwd:16,8,16,16,1,2,8,1,2
128-7-7-3x3-32-7-7-128-1x1-1x1-1x1-0-NCHW-FP16-B=ConvOclDirectFwd:8,8,8,8,1,1,4,1,2
32-27-27-1x1-256-27-27-64-0x0-1x1-1x1-0-NCHW-FP16-F=ConvAsm1x1U:1,8,2,16,1,4,1,4;ConvOclDirectFwd1x1:1,64,1,1,0,1,8,4,0
48-27-27-1x1-384-27-27-64-0x0-1x1-1x1-0-NCHW-FP16-F=ConvAsm1x1U:3,8,6,64,1,4,1,4;ConvOclDirectFwd1x1:1,64,1,1,0,1,8,4,0
512-14-14-1x1-64-14-14-256-0x0-1x1-1x1-0-NCHW-FP16-F=ConvAsm1x1U:2,8,4,32,2,4,1,8;ConvOclDirectFwd1x1:8,64,16,16,0,2,16,4,1
512-7-7-3x3-512-7-7-8-1x1-1x1-1x1-0-NCHW-FP16-B=ConvOclDirectFwd:8,8,8,8,1,1,4,1,2
512-28-28-1x1-256-56-56-256-0x0-2x2-1x1-0-NCHW-FP16-W=ConvAsmBwdWrW1x1:2,8,8,8,2,1,2,4,0,1
144-14-14-1x1-512-14-14-1-0x0-1x1-1x1-0-NCHW-FP32-W=ConvAsmBwdWrW1x1:2,8,2,4,2,1,1,4,0,1
128-7-7-1x1-1024-7-7-64-0x0-1x1-1x1-0-NCHW-FP32-B=ConvAsm1x1U:1,16,1,64,2,2,1,4;ConvOclDirectFwd1x1:8,64,8,8,0,1,16,4,1
1056-7-7-1x1-192-7-7-16-0x0-1x1-1x1-0-NCHW-FP32-B=ConvAsm1x1U:1,16,1,64,1,2,4,1;ConvOclDirectFwd1x1:1,128,1,1,0,1,4,8,0
160-14-14-1x1-512-14-14-32-0x0-1x1-1x1-0-NCHW-FP16-B=ConvAsm1x1U:1,16,2,16,1,2,2,2;ConvOclDirectFwd1x1:1,128,1,1,0,4,8,4,0
384-17-17-3x3-288-35-35-64-0x0-2x2-1x1-0-NCHW-FP32-B=ConvOclDirectFwd:16,16,16,16,1,1,4,1,2
16-28-28-1x1-192-28-28-256-0x0-1x1-1x1-0-NCHW-FP32-W=ConvAsmBwdWrW1x1:4,4,2,4,2,1,4,4,0,1
48-35-35-1x1-192-35-35-16-0x0-1x1-1x1-0-NCHW-FP16-W=ConvAsmBwdWrW1x1:4,4,8,4,2,1,4,4,0,1
384-7-7-1x1-832-7-7-1-0x0-1x1-1x1-0-NCHW-FP16-B=ConvAsm1x1U:1,8,2,32,1,4,4,1;ConvOclDirectFwd1x1:1,64,1,1,0,1,4,4,0
48-27-27-1x1-192-27-27-64-0x0-1x1-1x1-0-NCHW-FP32-F=ConvAsm1x1U:1,16,1,32,4,2,1,2;ConvOclDirectFwd1x1:1,64,1,1,1,0,16,256,0
64-13-13-3x3-256-13-13-128-1x1-1x1-1x1-0-NCHW-FP32-W=ConvAsmBwdWrW3x3:0,0,16,4,10,1
192-14-14-1x1-576-14-14-32-0x0-1x1-1x1-0-NCHW-FP16-W=ConvAsmBwdWrW1x1:2,8,8,8,2,1,2,4,0,1
128-14-14-5x5-32-14-14-128-2x2-1x1-1x1-0-NCHW-FP16-B=ConvOclDirectFwd:8,8,16,16,2,2,4,4,2
256-64-128-1x1-528-64-128-1-0x0-1x1-1x1-0-NCHW-FP16-B=ConvOclDirectFwd1x1:1,64,1,1,0,4,16,4,0
1024-17-17-1x1-256-17-17-64-0x0-1x1-1x1-0-NCHW-FP32-F=ConvAsm1x1U:3,16,5,64,1,2,1,4;ConvActivAsm1x1U:3,16,5,64,2,1;ConvOclDirectFwd1x1:1,64,1,1,1,1,16,2048,0
64-80-350-3x3-64-80-350-2-1x1-1x1-1x1-0-NCHW-FP16-W=ConvAsmBwdWrW3x3:0,0,16,2,1,1
32-7-7-5x5-128-7-7-512-2x2-1x1-1x1-0-NCHW-FP16-F=ConvOclDirectFwdFused:8,8,8,8,1,1,8,2,2;ConvOclDirectFwd:8,8,8,8,1,1,8,2,1
1536-8-8-1x1-384-8-8-4-0x0-1x1-1x1-0-NCHW-FP16-F=ConvAsm1x1U:1,8,2,16,1,4,4,1;ConvOclDirectFwd1x1:1,64,1,1,0,1,4,8,0
96-64-128-3x3-208-64-128-1-1x1-1x1-1x1-0-NCHW-FP16-F=ConvOclDirectFwd:16,16,32,32,2,2,8,2,1
256-56-56-1x1-64-56-56-32-0x0-1x1-1x1-0-NCHW-FP32-F=ConvAsm1x1U:3,16,5,64,1,2,2,2;ConvActivAsm1x1U:1,16,1,32,4,2;ConvOclDirectFwd1x1:1,64,1,1,1,0,16,256,0
256-8-8-1x1-1536-8-8-16-0x0-1x1-1x1-0-NCHW-FP32-B=ConvAsm1x1U:1,16,1,32,1,2,1,2;ConvOclDirectFwd1x1:1,64,1,1,0,4,8,8,0
480-14-14-1x1-64-14-14-256-0x0-1x1-1x1-0-NCHW-FP16-B=ConvAsm1x1U:1,16,2,16,1,2,2,2;ConvOclDirectFwd1x1:1,128,1,1,0,4,16,4,0
192-7-7-1x1-1056-7-7-16-0x0-1x1-1x1-0-NCHW-FP16-W=ConvAsmBwdWrW1x1:1,16,4,8,2,1,2,4,0,1
64-13-13-3x3-256-13-13-512-1x1-1x1-1x1-0-NCHW-FP32-W=ConvAsmBwdWrW3x3:0,0,16,4,10,1
3-2-2-3x3-4-3-3-64-1x1-2x2-1x1-0-NCHW-FP32-W=ConvAsmBwdWrW3x3:0,0,16,1,2,8
192-28-28-3x3-128-28-28-512-1x1-1x1-1x1-0-NCHW-FP32-W=ConvAsmBwdWrW3x3:0,0,8,4,3,1
256-7-7-3x3-256-14-14-256-1x1-2x2-1x1-0-NCHW-FP16-B=ConvOclDirectFwd:8,16,8,16,1,1,4,1,2
736-7-7-1x1-128-7-7-32-0x0-1x1-1x1-0-NCHW-FP16-B=ConvAsm1x1U:1,8,2,32,1,4,4,4;ConvOclDirectFwd1x1:1,64,1,1,0,1,4,4,0
512-14-14-1x1-24-14-14-512-0x0-1x1-1x1-0-NCHW-FP16-F=ConvAsm1x1U:2,8,4,64,1,4,4,1;ConvOclDirectFwd1x1:1,64,1,1,0,2,16,4,0
512-4-4-3x3-512-7-7-64-1x1-2x2-1x1-0-NCHW-FP16-B=ConvOclDirectFwd:8,8,8,8,1,1,4,1,1
448-8-8-1x1-1280-8-8-32-0x0-1x1-1x1-0-NCHW-FP32-B=ConvAsm1x1U:1,16,1,64,2,2,1,4;ConvOclDirectFwd1x1:1,128,1,1,0,4,8,4,0
512-7-7-1x1-2048-7-7-16-0x0-1x1-1x1-0-NCHW-FP32-W=ConvAsmBwdWrW1x1:1,16,2,8,4,1,1,4,0,3
480-14-14-1x1-128-14-14-64-0x0-1x1-1x1-0-NCHW-FP32-W=ConvAsmBwdWrW1x1:2,8,2,8,2,2,1,4,0,1
384-7-7-3x3-192-7-7-128-1x1-1x1-1x1-0-NCHW-FP32-W=ConvAsmBwdWrW3x3:0,0,8,4,2,1
512-14-14-1x1-112-14-14-16-0x0-1x1-1x1-0-NCHW-FP32-F=ConvAsm1x1U:2,8,7,16,1,4,2,2;ConvActivAsm1x1U:2,16,7,32,1,4;ConvOclDirectFwd1x1:1,64,1,1,1,1,64,256,0
32-35-35-1x1-192-35-35-32-0x0-1x1-1x1-0-NCHW-FP16-B=ConvAsm1x1U:1,16,2,64,1,2,1,2;ConvOclDirectFwd1x1:16,64,32,32,0,1,16,4,1
192-7-7-3x3-384-7-7-16-1x1-1x1-1x1-0-NCHW-FP16-F=ConvOclDirectFwdFused:8,8,8,8,1,1,4,4,2;ConvOclDirectFwd:8,8,8,8,1,1,4,4,2
832-7-7-1x1-128-7-7-256-0x0-1x1-1x1-0-NCHW-FP16-F=ConvAsm1x1U:2,8,4,16,1,4,2,4;ConvOclDirectFwd1x1:1,64,1,1,0,1,8,4,0
320-8-8-1x1-1280-8-8-128-0x0-1x1-1x1-0-NCHW-FP16-B=ConvAsm1x1U:1,16,2,32,1,2,1,4;ConvOclDirectFwd1x1:1,64,1,1,0,4,16,4,0
256-53-53-3x3-512-26-26-128-0x0-2x2-1x1-0-NCHW-FP32-F=ConvOclDirectFwd:8,32,32,32,4,1,8,1,2
576-7-7-1x1-128-7-7-512-0x0-1x1-1x1-0-NCHW-FP16-F=ConvAsm1x1U:2,8,4,16,1,4,1,4;ConvOclDirectFwd1x1:1,128,1,1,0,1,8,4,0
480-14-14-1x1-192-14-14-8-0x0-1x1-1x1-0-NCHW-FP32-F=ConvAsm1x1U:3,8,3,16,1,2,2,2;ConvActivAsm1x1U:3,16,3,16,2,4;ConvOclDirectFwd1x1:1,64,1,1,1,1,16,128,0
128-14-14-1x1-528-14-14-128-0x0-1x1-1x1-0-NCHW-FP32-W=ConvAsmBwdWrW1x1:2,8,4,4,8,2,2,4,0,1
80-73-73-3x3-192-71-71-16-0x0-1x1-1x1-0-NCHW-FP16-F=ConvOclDirectFwdFused:8,8,16,16,2,2,8,2,1;ConvOclDirectFwd:8,8,16,16,2,2,8,2,2
192-28-28-1x1-64-28-28-1-0x0-1x1-1x1-0-NCHW-FP32-F=ConvAsm1x1U:1,8,1,64,1,4,4,2;ConvActivAsm1x1U:1,16,1,32,1,4;ConvOclDirectFwd1x1:1,64,1,1,1,4,16,64,0
64-28-28-1x1-256-28-28-512-0x0-1x1-1x1-0-NCHW-FP16-B=ConvAsm1x1U:1,16,2,16,1,2,1,4;ConvOclDirectFwd1x1:1,64,1,1,0,4,16,4,0
32-28-28-1x1-256-28-28-1-0x0-1x1-1x1-0-NCHW-FP16-W=ConvAsmBwdWrW1x1:4,4,4,1,2,1,1,4,0,1
1024-17-17-1x1-384-17-17-128-0x0-1x1-1x1-0-NCHW-FP32-F=ConvAsm1x1U:3,16,5,64,2,2,1,2;ConvActivAsm1x1U:2,16,5,64,2,2;ConvOclDirectFwd1x1:1,64,1,1,1,1,64,2048,0
768-28-28-1x1-384-28-28-16-0x0-1x1-1x1-0-NCHW-FP16-F=ConvAsm1x1U:1,8,2,32,4,4,1,4;ConvOclDirectFwd1x1:1,64,1,1,0,2,8,4,0
512-7-7-3x3-512-7-7-12-1x1-1x1-1x1-0-NCHW-FP32-W=ConvAsmBwdWrW3x3:0,1,8,4,2,1
64-56-56-1x1-64-56-56-512-0x0-1x1-1x1-0-NCHW-FP32-F=ConvAsm1x1U:1,8,1,64,2,4,1,4;ConvActivAsm1x1U:1,32,1,64,3,1;ConvOclDirectFwd1x1:1,64,1,1,1,0,32,128,0
192-14-14-1x1-480-14-14-128-0x0-1x1-1x1-0-NCHW-FP16-B=ConvAsm1x1U:1,16,2,16,1,2,2,2;ConvOclDirectFwd1x1:1,256,1,1,0,4,16,4,0
384-13-13-3x3-256-13-13-32-1x1-1x1-1x1-0-NCHW-FP32-W=ConvAsmBwdWrW3x3:0,0,8,4,4,1
1024-14-14-1x1-256-14-14-16-0x0-1x1-1x1-0-NCHW-FP32-W=ConvAsmBwdWrW1x1:2,8,4,4,4,1,1,4,0,0
384-8-8-1x1-1280-8-8-1-0x0-1x1-1x1-0-NCHW-FP32-B=ConvAsm1x1U:1,8,1,64,1,4,4,1;ConvOclDirectFwd1x1:1,64,1,1,0,1,4,8,0
64-55-55-1x1-256-55-55-8-0x0-1x1-1x1-0-NCHW-FP32-F=ConvAsm1x1U:2,16,3,64,2,1;ConvOclDirectFwd1x1:1,64,1,1,1,0,32,2048,0
128-28-28-1x1-320-28-28-32-0x0-1x1-1x1-0-NCHW-FP32-B=ConvAsm1x1U:1,16,1,32,2,2,2,2;ConvOclDirectFwd1x1:1,64,1,1,0,4,16,4,0
384-13-13-3x3-192-13-13-256-1x1-1x1-1x1-0-NCHW-FP16-F=ConvOclDirectFwd:8,8,16,16,2,2,8,1,1
512-13-13-1x1-1000-13-13-128-0x0-1x1-1x1-0-NCHW-FP16-F=ConvAsm1x1U:3,8,6,32,1,4,1,1;ConvOclDirectFwd1x1:8,64,16,16,0,1,16,4,1
528-14-14-1x1-32-14-14-256-0x0-1x1-1x1-0-NCHW-FP16-B=ConvAsm1x1U:1,8,2,32,2,4,1,4;ConvOclDirectFwd1x1:1,128,1,1,0,4,16,4,0
16-54-54-3x3-64-54-54-128-1x1-1x1-1x1-0-NCHW-FP32-W=ConvAsmBwdWrW3x3:0,0,16,4,3,8
128-28-28-1x1-256-28-28-1-0x0-1x1-1x1-0-NCHW-FP32-B=ConvAsm1x1U:1,8,1,64,1,4,2,1;ConvOclDirectFwd1x1:1,256,1,1,0,1,4,4,0
384-7-7-1x1-832-7-7-256-0x0-1x1-1x1-0-NCHW-FP16-B=ConvAsm1x1U:2,16,4,16,1,2,2,1;ConvOclDirectFwd1x1:1,256,1,1,0,1,16,4,0
384-14-14-1x1-128-14-14-32-0x0-1x1-1x1-0-NCHW-FP32-B=ConvAsm1x1U:1,16,1,32,1,1,2,2;ConvOclDirectFwd1x1:1,256,1,1,0,4,16,4,0
128-56-56-1x1-64-56-56-512-0x0-1x1-1x1-0-NCHW-FP16-W=ConvAsmBwdWrW1x1:4,4,4,4,2,1,4,4,0,1
256-14-14-1x1-1024-14-14-2-0x0-1x1-1x1-0-NCHW-FP16-B=ConvAsm1x1U:2,8,4,64,1,4,2,1;ConvOclDirectFwd1x1:1,128,1,1,0,4,8,4,0
128-14-14-1x1-512-14-14-128-0x0-1x1-1x1-0-NCHW-FP32-F=ConvAsm1x1U:4,8,4,64,1,4,1,4;ConvOclDirectFwd1x1:1,64,1,1,1,4,16,2048,0
512-64-128-1x1-24-64-128-1-0x0-1x1-1x1-0-NCHW-FP16-F=ConvOclDirectFwd1x1:1,64,1,1,0,4,4,8,0
1056-7-7-1x1-352-7-7-32-0x0-1x1-1x1-0-NCHW-FP16-F=ConvAsm1x1U:1,8,2,32,2,4,4,2;ConvOclDirectFwd1x1:1,128,1,1,0,1,8,8,0
256-64-128-1x1-832-64-128-1-0x0-1x1-1x1-0-NCHW-FP32-W=ConvAsmBwdWrW1x1:2,8,4,8,4,1,1,4,0,1
32-27-27-1x1-256-27-27-64-0x0-1x1-1x1-0-NCHW-FP32-B=ConvAsm1x1U:1,32,1,64,1,1,1,1;ConvOclDirectFwd1x1:1,128,1,1,0,1,32,4,0
256-8-8-1x1-1536-8-8-32-0x0-1x1-1x1-0-NCHW-FP16-W=ConvAsmBwdWrW1x1:2,8,4,4,4,1,1,4,0,0
64-73-73-3x3-96-71-71-1-0x0-1x1-1x1-0-NCHW-FP32-F=ConvOclDirectFwd:16,16,16,32,1,2,8,1,1
4-3-3-3x3-3-6-6-256-1x1-2x2-1x1-0-NCHW-FP32-B=ConvOclDirectFwd:8,8,8,8,1,1,1,2,2
32-28-28-1x1-256-28-28-8-0x0-1x1-1x1-0-NCHW-FP16-W=ConvAsmBwdWrW1x1:4,4,2,1,4,2,1,4,0,1
32-28-28-1x1-256-28-28-64-0x0-1x1-1x1-0-NCHW-FP16-W=ConvAsmBwdWrW1x1:2,8,2,4,2,1,4,4,0,2
224-64-128-3x3-112-64-128-1-1x1-1x1-1x1-0-NCHW-FP32-W=ConvAsmBwdWrW3x3:0,1,16,4,2,1
192-7-7-1x1-1536-7-7-16-0x0-1x1-1x1-0-NCHW-FP16-B=ConvAsm1x1U:2,16,4,16,1,2,2,1;ConvOclDirectFwd1x1:1,64,1,1,0,1,8,4,0
4-2-2-3x3-3-1-1-32-0x0-2x2-1x1-0-NCHW-FP32-F=ConvOclDirectFwd:8,8,8,8,1,1,2,4,2
64-35-35-1x1-192-35-35-4-0x0-1x1-1x1-0-NCHW-FP32-W=ConvAsmBwdWrW1x1:4,4,4,1,8,1,2,4,0,1
736-14-14-1x1-128-14-14-16-0x0-1x1-1x1-0-NCHW-FP32-F=ConvAsm1x1U:4,16,4,64,1,2,4,1;ConvOclDirectFwd1x1:1,64,1,1,1,1,16,256,0
128-56-56-1x1-64-56-56-128-0x0-1x1-1x1-0-NCHW-FP32-F=ConvAsm1x1U:2,16,2,64,2,2,1,1;ConvOclDirectFwd1x1:1,64,1,1,1,0,16,256,0
192-27-27-5x5-64-27-27-256-2x2-1x1-1x1-0-NCHW-FP32-B=ConvOclDirectFwd:16,16,32,32,2,2,8,1,1
64-73-73-1x1-160-73-73-1-0x0-1x1-1x1-0-NCHW-FP32-W=ConvAsmBwdWrW1x1:4,4,2,4,2,1,1,4,0,3
32-27-27-1x1-128-27-27-256-0x0-1x1-1x1-0-NCHW-FP16-W=ConvAsmBwdWrW1x1:4,4,2,4,2,1,4,4,0,1
3-299-299-3x3-32-149-149-16-0x0-2x2-1x1-0-NCHW-FP32-F=ConvOclDirectFwdFused:16,16,16,16,1,1,8,1,2;ConvOclDirectFwd:16,16,16,16,1,1,8,1,1
324-38-38-3x3-256-38-38-64-1x1-1x1-1x1-0-NCHW-FP32-W=ConvAsmBwdWrW3x3:0,0,16,4,2,1
992-7-7-1x1-128-7-7-16-0x0-1x1-1x1-0-NCHW-FP32-W=ConvAsmBwdWrW1x1:2,8,4,8,2,1,2,4,0,1
96-56-56-1x1-128-56-56-512-0x0-1x1-1x1-0-NCHW-FP32-B=ConvAsm1x1U:1,16,1,64,2,2,1,4;ConvOclDirectFwd1x1:1,128,1,1,0,2,32,4,0
1024-17-17-1x1-192-17-17-8-0x0-1x1-1x1-0-NCHW-FP32-F=ConvAsm1x1U:4,8,4,16,1,4,1,4;ConvActivAsm1x1U:2,16,2,32,4,3;ConvOclDirectFwd1x1:1,64,1,1,1,1,16,256,0
128-7-7-1x1-736-7-7-32-0x0-1x1-1x1-0-NCHW-FP32-F=ConvAsm1x1U:1,8,1,64,2,4,1,8;ConvOclDirectFwd1x1:1,64,1,1,1,4,16,2048,0
1024-17-17-1x1-128-17-17-256-0x0-1x1-1x1-0-NCHW-FP32-B=ConvAsm1x1U:1,32,1,32,2,1,1,2;ConvOclDirectFwd1x1:1,256,1,1,0,1,16,4,0
512-28-28-3x3-256-28-28-4-1x1-1x1-1x1-0-NCHW-FP16-B=ConvOclDirectFwd:16,16,32,32,2,2,4,4,2
384-7-7-1x1-832-7-7-32-0x0-1x1-1x1-0-NCHW-FP16-B=ConvAsm1x1U:1,16,2,32,1,2,4,1;ConvOclDirectFwd1x1:1,256,1,1,0,1,16,4,0
128-54-54-1x1-16-54-54-128-0x0-1x1-1x1-0-NCHW-FP16-F=ConvAsm1x1U:1,8,2,64,1,4,2,2;ConvOclDirectFwd1x1:1,128,1,1,0,4,16,4,0
1968-7-7-1x1-192-7-7-16-0x0-1x1-1x1-0-NCHW-FP32-F=ConvAsm1x1U:4,8,4,16,1,4,4,2;ConvActivAsm1x1U:2,16,2,32,2,4;ConvOclDirectFwd1x1:1,64,1,1,1,4,16,256,0
832-64-128-1x1-192-64-128-1-0x0-1x1-1x1-0-NCHW-FP32-F=ConvOclDirectFwd1x1:1,64,1,1,1,4,16,2048,0
128-28-28-1x1-160-28-28-64-0x0-1x1-1x1-0-NCHW-FP32-B=ConvAsm1x1U:1,32,1,32,1,1,1,1;ConvOclDirectFwd1x1:1,256,1,1,0,4,16,4,0
32-54-54-3x3-128-54-54-64-1x1-1x1-1x1-0-NCHW-FP16-W=ConvAsmBwdWrW3x3:0,0,8,4,1,4
832-7-7-1x1-192-7-7-4-0x0-1x1-1x1-0-NCHW-FP32-F=ConvAsm1x1U:1,8,1,64,1,4,4,1;ConvActivAsm1x1U:1,16,1,16,1,4;ConvOclDirectFwd1x1:1,64,1,1,1,1,16,64,0
128-28-28-1x1-128-28-28-16-0x0-1x1-1x1-0-NCHW-FP32-F=ConvAsm1x1U:2,16,2,16,1,2,1,1;ConvOclDirectFwd1x1:1,64,1,1,1,0,16,2048,0
128-4-4-1x1-608-4-4-32-0x0-1x1-1x1-0-NCHW-FP32-W=ConvAsmBwdWrW1x1:1,16,2,4,2,1,2,4,0,2
192-27-27-3x3-48-27-27-256-1x1-1x1-1x1-0-NCHW-FP16-B=ConvOclDirectFwd:32,8,32,32,1,4,8,2,2
576-7-7-1x1-128-7-7-16-0x0-1x1-1x1-0-NCHW-FP32-B=ConvAsm1x1U:1,8,1,64,1,4,4,4;ConvOclDirectFwd1x1:1,256,1,1,0,1,4,8,0
192-56-56-3x3-64-56-56-512-1x1-1x1-1x1-0-NCHW-FP32-W=ConvAsmBwdWrW3x3:0,0,16,4,4,1
32-27-27-1x1-128-27-27-16-0x0-1x1-1x1-0-NCHW-FP32-B=ConvAsm1x1U:1,16,1,64,2,2,1,1;ConvOclDirectFwd1x1:1,256,1,1,0,1,8,8,0
256-35-35-1x1-48-35-35-4-0x0-1x1-1x1-0-NCHW-FP32-F=ConvAsm1x1U:2,8,2,32,1,4,2,2;ConvActivAsm1x1U:1,16,1,32,2,4;ConvOclDirectFwd1x1:1,64,1,1,1,1,32,64,0
128-54-54-1x1-32-54-54-256-0x0-1x1-1x1-0-NCHW-FP32-W=ConvAsmBwdWrW1x1:4,4,4,4,2,1,4,4,0,1
256-28-28-1x1-512-28-28-128-0x0-1x1-1x1-0-NCHW-FP32-B=ConvAsm1x1U:1,16,1,32,2,2,1,4;ConvOclDirectFwd1x1:1,128,1,1,0,4,16,4,0
3-10-10-3x3-5-10-10-32-1x1-1x1-1x1-0-NCHW-FP32-F=ConvOclDirectFwd:16,16,16,16,1,1,2,2,2
128-7-7-5x5-32-7-7-128-2x2-1x1-1x1-0-NCHW-FP32-B=ConvOclDirectFwd:16,16,8,8,2,2,1,4,2
416-28-28-1x1-128-28-28-32-0x0-1x1-1x1-0-NCHW-FP32-B=ConvAsm1x1U:2,16,2,32,1,2,2,2;ConvOclDirectFwd1x1:1,128,1,1,0,2,16,4,0
448-8-8-1x1-2048-8-8-16-0x0-1x1-1x1-0-NCHW-FP32-W=ConvAsmBwdWrW1x1:2,8,4,2,8,1,1,4,0,0
128-56-56-1x1-224-56-56-512-0x0-1x1-1x1-0-NCHW-FP16-B=ConvAsm1x1U:1,16,2,32,1,2,1,2;ConvOclDirectFwd1x1:1,256,1,1,0,4,16,4,0
128-7-7-1x1-608-7-7-512-0x0-1x1-1x1-0-NCHW-FP32-F=ConvAsm1x1U:4,8,4,16,1,4,1,4;ConvOclDirectFwd1x1:1,64,1,1,1,4,16,128,0
256-27-27-1x1-64-27-27-256-0x0-1x1-1x1-0-NCHW-FP16-W=ConvAsmBwdWrW1x1:4,4,8,4,2,1,4,4,0,1
64-55-55-1x1-256-55-55-32-0x0-1x1-1x1-0-NCHW-FP16-B=ConvAsm1x1U:1,16,2,64,1,2,1,4;ConvOclDirectFwd1x1:1,128,1,1,0,1,8,4,0
128-28-28-3x3-96-28-28-4-1x1-1x1-1x1-0-NCHW-FP32-W=ConvAsmBwdWrW3x3:0,0,8,4,2,2
64-224-224-3x3-64-224-224-1-1x1-1x1-1x1-0-NCHW-FP16-B=ConvOclDirectFwd:16,16,32,32,2,2,8,4,1
3-224-224-3x3-64-224-224-64-1x1-1x1-1x1-0-NCHW-FP16-F=ConvOclDirectFwdFused:8,32,16,32,2,1,8,1,1;ConvOclDirectFwd:16,16,16,32,1,2,8,1,2
1024-14-14-1x1-512-14-14-64-0x0-1x1-1x1-0-NCHW-FP16-F=ConvAsm1x1U:2,8,4,64,2,4,1,4;ConvOclDirectFwd1x1:1,128,1,1,0,4,8,4,0
96-14-14-3x3-208-14-14-4-1x1-1x1-1x1-0-NCHW-FP16-F=ConvOclDirectFwdFused:16,16,16,16,1,1,4,4,2;ConvOclDirectFwd:16,16,16,16,1,1,2,4,2
1104-14-14-1x1-192-14-14-16-0x0-1x1-1x1-0-NCHW-FP16-W=ConvAsmBwdWrW1x1:2,8,4,4,4,1,1,4,0,0
128-14-14-1x1-800-14-14-32-0x0-1x1-1x1-0-NCHW-FP16-F=ConvAsm1x1U:2,8,4,64,1,4,1,4;ConvOclDirectFwd1x1:1,64,1,1,0,4,8,4,0
192-27-27-5x5-64-27-27-64-2x2-1x1-1x1-0-NCHW-FP16-F=ConvOclDirectFwd:16,16,32,32,2,2,8,4,2
128-64-128-1x1-832-64-128-1-0x0-1x1-1x1-0-NCHW-FP16-B=ConvOclDirectFwd1x1:1,128,1,1,0,4,16,4,0
384-8-8-1x1-1536-8-8-4-0x0-1x1-1x1-0-NCHW-FP32-W=ConvAsmBwdWrW1x1:1,16,2,4,4,1,1,4,0,1
640-7-7-1x1-128-7-7-32-0x0-1x1-1x1-0-NCHW-FP32-W=ConvAsmBwdWrW1x1:2,8,2,8,2,1,2,4,0,0
384-17-17-1x1-1024-17-17-16-0x0-1x1-1x1-0-NCHW-FP32-F=ConvAsm1x1U:3,16,5,64,1,2,1,1;ConvOclDirectFwd1x1:1,64,1,1,1,0,16,2048,0
96-35-35-3x3-64-35-35-64-1x1-1x1-1x1-0-NCHW-FP32-W=ConvAsmBwdWrW3x3:0,0,8,4,3,4
128-28-28-1x1-192-28-28-512-0x0-1x1-1x1-0-NCHW-FP32-F=ConvAsm1x1U:1,8,1,32,3,4,1,8;ConvOclDirectFwd1x1:1,64,1,1,1,0,16,2048,0
160-7-7-1x1-832-7-7-512-0x0-1x1-1x1-0-NCHW-FP32-B=ConvAsm1x1U:1,16,1,32,2,2,1,4;ConvOclDirectFwd1x1:1,128,1,1,0,1,16,8,0
192-14-14-1x1-480-14-14-4-0x0-1x1-1x1-0-NCHW-FP32-W=ConvAsmBwdWrW1x1:1,16,4,4,2,1,1,4,0,1
96-28-28-1x1-192-28-28-16-0x0-1x1-1x1-0-NCHW-FP32-B=ConvAsm1x1U:1,16,1,32,1,2,2,2;ConvOclDirectFwd1x1:1,256,1,1,0,2,16,4,0
32-7-7-1x1-832-7-7-128-0x0-1x1-1x1-0-NCHW-FP16-W=ConvAsmBwdWrW1x1:2,8,2,8,2,1,4,4,0,0
512-14-14-1x1-144-14-14-1-0x0-1x1-1x1-0-NCHW-FP32-F=ConvAsm1x1U:1,8,1,64,1,4,4,1;ConvActivAsm1x1U:1,16,1,32,1,4;ConvOclDirectFwd1x1:1,64,1,1,1,1,64,64,0
192-56-56-1x1-288-56-56-16-0x0-1x1-1x1-0-NCHW-FP32-W=ConvAsmBwdWrW1x1:2,8,4,8,2,1,2,4,0,2
64-224-224-3x3-3-224-224-256-1x1-1x1-1x1-0-NCHW-FP16-F=ConvOclDirectFwd:16,16,32,32,2,2,8,2,1
1392-14-14-1x1-192-14-14-16-0x0-1x1-1x1-0-NCHW-FP32-F=ConvAsm1x1U:2,16,4,64,1,2,4,1;ConvActivAsm1x1U:3,16,3,16,4,4;ConvOclDirectFwd1x1:1,64,1,1,1,1,16,2048,0
32-54-54-1x1-128-54-54-256-0x0-1x1-1x1-0-NCHW-FP16-W=ConvAsmBwdWrW1x1:4,4,2,1,8,1,4,4,0,1
128-56-56-3x3-32-56-56-128-1x1-1x1-1x1-0-NCHW-FP16-W=ConvAsmBwdWrW3x3:0,0,8,4,1,8
64-14-14-5x5-32-14-14-128-2x2-1x1-1x1-0-NCHW-FP32-B=ConvOclDirectFwd:8,8,16,16,1,1,4,2,2
64-56-56-1x1-64-56-56-4-0x0-1x1-1x1-0-NCHW-FP32-W=ConvAsmBwdWrW1x1:4,4,4,4,2,1,4,4,0,1
256-14-14-3x3-256-28-28-16-1x1-2x2-1x1-0-NCHW-FP32-B=ConvOclDirectFwd:8,32,32,32,4,1,4,4,1
128-112-112-3x3-128-112-112-16-1x1-1x1-1x1-0-NCHW-FP16-W=ConvAsmBwdWrW3x3:0,0,8,4,1,4
32-14-14-5x5-128-14-14-512-2x2-1x1-1x1-0-NCHW-FP32-F=ConvOclDirectFwdFused:8,8,16,16,2,2,8,1,1;ConvOclDirectFwd:8,16,16,16,2,1,4,2,1
160-14-14-1x1-528-14-14-32-0x0-1x1-1x1-0-NCHW-FP32-B=ConvAsm1x1U:1,16,1,32,2,1,2,2;ConvOclDirectFwd1x1:1,128,1,1,0,4,16,4,0
384-7-7-1x1-832-7-7-128-0x0-1x1-1x1-0-NCHW-FP16-B=ConvAsm1x1U:2,16,4,16,1,2,2,2;ConvOclDirectFwd1x1:1,128,1,1,0,1,8,4,0
3-10-10-3x3-5-10-10-64-1x1-1x1-1x1-0-NCHW-FP16-B=ConvOclDirectFwd:8,16,16,16,2,1,1,1,2
208-14-14-3x3-96-14-14-8-1x1-1x1-1x1-0-NCHW-FP16-B=ConvOclDirectFwd:16,16,16,16,1,1,4,4,2
192-14-14-3x3-128-14-14-32-1x1-1x1-1x1-0-NCHW-FP16-B=ConvOclDirectFwd:8,16,16,16,2,1,8,1,2
384-28-28-1x1-128-28-28-32-0x0-1x1-1x1-0-NCHW-FP16-F=ConvAsm1x1U:2,8,4,32,1,4,1,4;ConvOclDirectFwd1x1:1,128,1,1,0,4,8,4,0
512-28-28-3x3-256-28-28-4-1x1-1x1-1x1-0-NCHW-FP32-W=ConvAsmBwdWrW3x3:0,1,8,4,3,1
384-7-7-1x1-832-7-7-256-0x0-1x1-1x1-0-NCHW-FP32-B=ConvAsm1x1U:1,16,1,64,2,2,1,2;ConvOclDirectFwd1x1:8,64,8,8,0,1,16,4,1
192-35-35-1x1-48-35-35-4-0x0-1x1-1x1-0-NCHW-FP16-F=ConvAsm1x1U:1,8,2,64,1,4,4,2;ConvOclDirectFwd1x1:1,64,1,1,0,1,4,4,0
64-56-56-1x1-64-56-56-32-0x0-1x1-1x1-0-NCHW-FP32-F=ConvAsm1x1U:2,16,2,32,1,2,2,2;ConvActivAsm1x1U:1,16,1,64,3,1;ConvOclDirectFwd1x1:1,64,1,1,1,0,16,256,0
256-28-28-1x1-512-28-28-32-0x0-1x1-1x1-0-NCHW-FP16-B=ConvAsm1x1U:1,16,2,16,1,2,2,2;ConvOclDirectFwd1x1:1,64,1,1,0,4,16,4,0
128-38-38-1x1-64-75-75-64-0x0-2x2-1x1-0-NCHW-FP32-B=ConvAsm1x1U:2,16,2,32,1,2,2,2;ConvOclDirectFwd1x1:1,64,1,1,0,1,32,4,0
64-73-73-1x1-80-73-73-4-0x0-1x1-1x1-0-NCHW-FP32-F=ConvAsm1x1U:1,16,1,64,2,2,1,2;ConvActivAsm1x1U:1,16,1,64,2,1;ConvOclDirectFwd1x1:1,64,1,1,1,0,32,256,0
832-7-7-1x1-32-7-7-512-0x0-1x1-1x1-0-NCHW-FP32-F=ConvAsm1x1U:4,8,4,16,1,4,1,4;ConvActivAsm1x1U:2,16,2,32,2,3;ConvOclDirectFwd1x1:1,64,1,1,1,1,16,2048,0
320-14-14-1x1-128-14-14-256-0x0-1x1-1x1-0-NCHW-FP32-B=ConvAsm1x1U:1,32,1,16,2,1,2,2;ConvOclDirectFwd1x1:1,256,1,1,0,4,16,4,0
256-13-13-3x3-384-13-13-128-1x1-1x1-1x1-0-NCHW-FP16-W=ConvAsmBwdWrW3x3:0,1,8,4,3,1
128-56-56-1x1-160-56-56-512-0x0-1x1-1x1-0-NCHW-FP32-W=ConvAsmBwdWrW1x1:2,8,4,8,2,1,4,4,0,2
256-17-17-1x1-1024-17-17-1-0x0-1x1-1x1-0-NCHW-FP16-B=ConvAsm1x1U:1,16,2,64,1,2,4,1;ConvOclDirectFwd1x1:1,64,1,1,0,1,4,4,0
128-7-7-1x1-736-7-7-16-0x0-1x1-1x1-0-NCHW-FP16-B=ConvAsm1x1U:1,8,2,32,1,4,2,1;ConvOclDirectFwd1x1:1,64,1,1,0,1,8,4,0
2048-7-7-1x1-512-7-7-32-0x0-1x1-1x1-0-NCHW-FP32-W=ConvAsmBwdWrW1x1:1,16,4,4,8,1,1,4,0,1
80-73-73-3x3-192-71-71-128-0x0-1x1-1x1-0-NCHW-FP16-F=ConvOclDirectFwdFused:8,8,16,16,2,2,8,2,1;ConvOclDirectFwd:8,8,16,16,2,2,8,2,2
128-28-28-3x3-32-28-28-256-1x1-1x1-1x1-0-NCHW-FP32-W=ConvAsmBwdWrW3x3:0,0,8,2,5,3
160-7-7-1x1-832-7-7-32-0x0-1x1-1x1-0-NCHW-FP16-W=ConvAsmBwdWrW1x1:1,16,2,8,2,1,2,4,0,1
48-35-35-1x1-192-35-35-8-0x0-1x1-1x1-0-NCHW-FP32-W=ConvAsmBwdWrW1x1:2,8,2,8,2,1,4,4,0,1
512-14-14-1x1-32-14-14-256-0x0-1x1-1x1-0-NCHW-FP16-F=ConvAsm1x1U:2,8,4,64,1,4,1,4;ConvOclDirectFwd1x1:1,256,1,1,0,2,16,4,0
128-56-56-1x1-96-56-56-64-0x0-1x1-1x1-0-NCHW-FP32-B=ConvAsm1x1U:1,32,1,64,1,1,1,1;ConvOclDirectFwd1x1:1,64,1,1,0,2,16,4,0
64-224-224-3x3-3-224-224-8-1x1-1x1-1x1-0-NCHW-FP32-W=ConvAsmBwdWrW3x3:0,1,16,1,2,4
256-56-56-1x1-128-28-28-16-0x0-2x2-1x1-0-NCHW-FP16-F=ConvAsm1x1U:1,8,2,32,1,4,1,4;ConvOclDirectFwd1x1:1,64,1,1,0,2,8,8,0
32-24-240-3x3-16-24-240-1-1x1-1x1-1x1-0-NCHW-FP32-W=ConvAsmBwdWrW3x3:0,0,16,1,2,1
96-35-35-1x1-384-35-35-1-0x0-1x1-1x1-0-NCHW-FP32-B=ConvAsm1x1U:1,16,1,64,1,1,4,2;ConvOclDirectFwd1x1:1,64,1,1,0,1,8,8,0
16-10-10-5x5-6-14-14-64-0x0-1x1-1x1-0-NCHW-FP16-B=ConvOclDirectFwd:16,8,16,16,1,2,1,4,2
80-73-73-1x1-64-73-73-4-0x0-1x1-1x1-0-NCHW-FP16-W=ConvAsmBwdWrW1x1:4,4,4,4,2,1,4,4,0,1
128-14-14-1x1-384-14-14-64-0x0-1x1-1x1-0-NCHW-FP32-F=ConvAsm1x1U:4,16,4,64,1,2,1,2;ConvOclDirectFwd1x1:1,64,1,1,1,4,16,2048,0
16-54-54-1x1-96-54-54-64-0x0-1x1-1x1-0-NCHW-FP16-F=ConvAsm1x1U:1,8,2,32,1,4,1,4;ConvOclDirectFwd1x1:1,64,1,1,0,2,32,4,0
64-56-56-1x1-256-56-56-256-0x0-1x1-1x1-0-NCHW-FP16-F=ConvAsm1x1U:1,8,2,32,2,4,1,8;ConvOclDirectFwd1x1:1,128,1,1,0,4,16,4,0
192-14-14-1x1-608-14-14-64-0x0-1x1-1x1-0-NCHW-FP16-W=ConvAsmBwdWrW1x1:2,8,8,8,2,1,2,4,0,1
1056-7-7-1x1-192-7-7-64-0x0-1x1-1x1-0-NCHW-FP32-F=ConvAsm1x1U:3,16,4,16,1,2,4,1;ConvActivAsm1x1U:2,16,4,16,1,2;ConvOclDirectFwd1x1:1,64,1,1,1,4,16,256,0
64-56-56-1x1-256-56-56-8-0x0-1x1-1x1-0-NCHW-FP16-B=ConvAsm1x1U:1,16,2,64,1,2,2,2;ConvOclDirectFwd1x1:1,128,1,1,0,4,16,4,0
512-7-7-1x1-1024-14-14-2-0x0-2x2-1x1-0-NCHW-FP16-B=ConvAsm1x1U:1,8,2,32,1,4,4,1;ConvOclDirectFwd1x1:1,64,1,1,0,1,4,8,0
512-14-14-1x1-1024-14-14-16-0x0-1x1-1x1-0-NCHW-FP16-F=ConvAsm1x1U:2,8,4,64,1,4,1,8;ConvOclDirectFwd1x1:1,128,1,1,0,2,8,4,0
16-54-54-1x1-64-54-54-128-0x0-1x1-1x1-0-NCHW-FP32-W=ConvAsmBwdWrW1x1:4,4,2,2,2,2,4,4,0,2
64-35-35-1x1-192-35-35-256-0x0-1x1-1x1-0-NCHW-FP16-W=ConvAsmBwdWrW1x1:4,4,4,4,4,1,4,4,0,1
384-27-27-1x1-48-27-27-32-0x0-1x1-1x1-0-NCHW-FP16-W=ConvAsmBwdWrW1x1:4,4,4,4,2,1,2,4,0,0
128-7-7-1x1-608-7-7-64-0x0-1x1-1x1-0-NCHW-FP32-F=ConvAsm1x1U:4,8,4,16,1,4,1,4;ConvOclDirectFwd1x1:1,64,1,1,1,4,16,2048,0
64-224-224-3x3-3-224-224-16-1x1-1x1-1x1-0-NCHW-FP32-F=ConvAsm3x3U:3,3,7;ConvOclDirectFwd:16,16,32,32,2,2,8,2,1
192-28-28-1x1-384-28-28-16-0x0-1x1-1x1-0-NCHW-FP16-W=ConvAsmBwdWrW1x1:2,8,4,8,2,1,2,4,0,1
800-7-7-1x1-128-7-7-128-0x0-1x1-1x1-0-NCHW-FP16-F=ConvAsm1x1U:2,8,4,16,1,4,2,8;ConvOclDirectFwd1x1:1,64,1,1,0,1,8,4,0
160-17-17-1x1-768-17-17-64-0x0-1x1-1x1-0-NCHW-FP16-B=ConvAsm1x1U:1,16,2,32,2,2,1,4;ConvOclDirectFwd1x1:1,64,1,1,0,1,16,4,0
144-14-14-1x1-512-14-14-32-0x0-1x1-1x1-0-NCHW-FP32-B=ConvAsm1x1U:1,16,1,32,2,2,1,4;ConvOclDirectFwd1x1:1,256,1,1,0,4,16,4,0
64-54-54-1x1-16-54-54-32-0x0-1x1-1x1-0-NCHW-FP32-W=ConvAsmBwdWrW1x1:4,4,2,2,2,1,4,4,0,2
1024-14-14-1x1-256-14-14-256-0x0-1x1-1x1-0-NCHW-FP32-B=ConvAsm1x1U:1,32,1,16,2,1,1,4;ConvOclDirectFwd1x1:1,128,1,1,0,2,16,4,0
48-56-56-3x3-192-56-56-16-1x1-1x1-1x1-0-NCHW-FP32-W=ConvAsmBwdWrW3x3:0,1,8,4,2,4
64-56-56-3x3-64-56-56-128-1x1-1x1-1x1-0-NCHW-FP32-W=ConvAsmBwdWrW3x3:0,0,8,2,4,4
256-80-128-3x3-256-80-128-32-1x1-1x1-1x1-0-NCHW-FP16-F=ConvOclDirectFwd:8,16,16,32,2,2,8,4,2
48-27-27-1x1-192-27-27-16-0x0-1x1-1x1-0-NCHW-FP16-B=ConvAsm1x1U:1,16,2,64,1,2,1,2;ConvOclDirectFwd1x1:1,256,1,1,0,1,4,4,0
3-230-230-7x7-64-112-112-1-0x0-2x2-1x1-0-NCHW-FP32-F=ConvOclDirectFwdFused:16,8,16,16,1,2,8,1,1;ConvOclDirectFwd:16,8,16,16,1,2,8,1,1
128-28-28-1x1-256-28-28-8-0x0-1x1-1x1-0-NCHW-FP16-W=ConvAsmBwdWrW1x1:4,4,4,1,8,1,1,4,0,1
544-7-7-1x1-128-7-7-128-0x0-1x1-1x1-0-NCHW-FP16-B=ConvAsm1x1U:2,8,4,16,1,4,2,2;ConvOclDirectFwd1x1:1,64,1,1,0,1,8,4,0
160-7-7-1x1-832-7-7-4-0x0-1x1-1x1-0-NCHW-FP16-B=ConvAsm1x1U:1,8,2,32,1,4,2,1;ConvOclDirectFwd1x1:1,64,1,1,0,1,4,8,0
1024-17-17-1x1-128-17-17-128-0x0-1x1-1x1-0-NCHW-FP32-F=ConvAsm1x1U:3,16,5,64,1,2,2,2;ConvActivAsm1x1U:3,16,5,64,1,1;ConvOclDirectFwd1x1:1,64,1,1,1,0,16,2048,0
128-14-14-3x3-128-28-28-256-1x1-2x2-1x1-0-NCHW-FP32-W=ConvAsmBwdWrW3x3:0,0,8,4,15,1
528-14-14-1x1-256-14-14-1-0x0-1x1-1x1-0-NCHW-FP32-F=ConvAsm1x1U:1,8,1,64,1,4,4,1;ConvActivAsm1x1U:1,16,1,64,1,4;ConvOclDirectFwd1x1:1,64,1,1,1,4,16,64,0
3-10-10-3x3-5-10-10-32-1x1-1x1-1x1-0-NCHW-FP16-B=ConvOclDirectFwd:8,16,16,16,2,1,2,2,2
1280-8-8-1x1-448-8-8-8-0x0-1x1-1x1-0-NCHW-FP32-F=ConvAsm1x1U:2,8,2,32,1,4,2,2;ConvActivAsm1x1U:1,16,1,32,4,4;ConvOclDirectFwd1x1:1,64,1,1,1,1,16,256,0
96-28-28-5x5-32-28-28-32-2x2-1x1-1x1-0-NCHW-FP32-B=ConvOclDirectFwd:16,16,32,32,2,2,4,2,2
128-56-56-3x3-32-56-56-16-1x1-1x1-1x1-0-NCHW-FP16-B=ConvOclDirectFwd:16,16,32,32,2,2,8,2,2
112-14-14-1x1-512-14-14-64-0x0-1x1-1x1-0-NCHW-FP32-W=ConvAsmBwdWrW1x1:2,8,2,4,4,1,1,4,0,2
96-56-56-1x1-128-56-56-32-0x0-1x1-1x1-0-NCHW-FP16-F=ConvAsm1x1U:2,8,4,64,1,4,1,8;ConvOclDirectFwd1x1:1,128,1,1,0,4,16,4,0
192-56-56-1x1-192-56-56-16-0x0-1x1-1x1-0-NCHW-FP16-W=ConvAsmBwdWrW1x1:4,4,8,1,8,1,1,4,0,1
192-27-27-3x3-48-27-27-512-1x1-1x1-1x1-0-NCHW-FP16-F=ConvOclDirectFwd:16,16,32,32,2,2,8,1,2
32-28-28-1x1-192-28-28-4-0x0-1x1-1x1-0-NCHW-FP16-B=ConvAsm1x1U:1,8,2,32,1,4,1,1;ConvOclDirectFwd1x1:1,128,1,1,0,1,4,4,0
512-7-7-1x1-256-7-7-64-0x0-1x1-1x1-0-NCHW-FP32-W=ConvAsmBwdWrW1x1:2,8,4,4,2,1,1,4
528-64-128-1x1-32-64-128-1-0x0-1x1-1x1-0-NCHW-FP32-F=ConvOclDirectFwd1x1:1,64,1,1,1,1,16,128,0
64-56-56-1x1-64-56-56-8-0x0-1x1-1x1-0-NCHW-FP16-B=ConvAsm1x1U:1,8,2,32,1,4,1,4;ConvOclDirectFwd1x1:1,128,1,1,0,2,16,4,0
64-56-56-1x1-256-56-56-512-0x0-1x1-1x1-0-NCHW-FP16-B=ConvAsm1x1U:1,16,2,32,1,2,1,4;ConvOclDirectFwd1x1:1,256,1,1,0,4,16,4,0
16-14-14-5x5-48-14-14-16-2x2-1x1-1x1-0-NCHW-FP32-F=ConvOclDirectFwdFused:8,8,16,16,2,2,1,2,2;ConvOclDirectFwd:16,16,16,16,1,1,4,2,2
112-14-14-1x1-512-14-14-4-0x0-1x1-1x1-0-NCHW-FP16-W=ConvAsmBwdWrW1x1:1,16,2,4,2,1,2,4,0,1
128-14-14-1x1-384-14-14-32-0x0-1x1-1x1-0-NCHW-FP32-F=ConvAsm1x1U:4,8,4,64,1,4,1,4;ConvOclDirectFwd1x1:1,64,1,1,1,4,16,256,0
96-35-35-3x3-96-35-35-16-1x1-1x1-1x1-0-NCHW-FP16-F=ConvOclDirectFwdFused:16,8,16,16,1,2,8,1,2;ConvOclDirectFwd:16,8,16,16,1,2,8,1,2
192-14-14-1x1-512-14-14-1-0x0-1x1-1x1-0-NCHW-FP16-B=ConvAsm1x1U:1,8,2,64,1,2,4,1;ConvOclDirectFwd1x1:1,64,1,1,0,1,4,4,0
640-7-7-1x1-128-7-7-32-0x0-1x1-1x1-0-NCHW-FP32-B=ConvAsm1x1U:1,16,1,64,1,2,4,2;ConvOclDirectFwd1x1:1,256,1,1,0,1,4,8,0
256-56-56-1x1-64-56-56-4-0x0-1x1-1x1-0-NCHW-FP32-F=ConvAsm1x1U:1,8,1,64,2,4,1,8;ConvActivAsm1x1U:2,16,2,64,2,2;ConvOclDirectFwd1x1:1,64,1,1,1,4,16,256,0
160-14-14-1x1-528-14-14-1-0x0-1x1-1x1-0-NCHW-FP32-W=ConvAsmBwdWrW1x1:1,16,2,4,4,1,1,2,0,1
128-14-14-1x1-704-14-14-256-0x0-1x1-1x1-0-NCHW-FP32-F=ConvAsm1x1U:2,16,2,16,2,2,2,2;ConvOclDirectFwd1x1:1,64,1,1,1,1,64,256,0
16-54-54-1x1-96-54-54-256-0x0-1x1-1x1-0-NCHW-FP16-W=ConvAsmBwdWrW1x1:4,4,2,2,2,1,4,4,0,1
64-35-35-1x1-288-35-35-1-0x0-1x1-1x1-0-NCHW-FP16-B=ConvAsm1x1U:1,8,2,64,1,2,4,2;ConvOclDirectFwd1x1:1,256,1,1,0,1,4,4,0
192-17-17-1x1-768-17-17-256-0x0-1x1-1x1-0-NCHW-FP32-B=ConvAsm1x1U:1,32,1,64,2,1,1,1;ConvOclDirectFwd1x1:1,256,1,1,0,1,32,4,0
128-54-54-1x1-16-54-54-32-0x0-1x1-1x1-0-NCHW-FP16-B=ConvAsm1x1U:1,8,2,64,1,4,1,2;ConvOclDirectFwd1x1:1,64,1,1,0,2,8,4,0
288-28-28-1x1-128-28-28-512-0x0-1x1-1x1-0-NCHW-FP32-B=ConvAsm1x1U:1,32,1,32,2,1,1,1;ConvOclDirectFwd1x1:1,128,1,1,0,4,16,4,0
256-17-17-3x3-224-35-35-256-0x0-2x2-1x1-0-NCHW-FP16-B=ConvOclDirectFwd:16,16,16,16,1,1,4,1,1
32-149-149-3x3-32-147-147-64-0x0-1x1-1x1-0-NCHW-FP32-F=ConvOclDirectFwd:16,16,16,32,1,2,8,4,2
512-26-26-3x3-256-53-53-64-0x0-2x2-1x1-0-NCHW-FP32-B=ConvOclDirectFwd:32,32,32,32,1,1,8,2,2
96-14-14-3x3-64-14-14-32-1x1-1x1-1x1-0-NCHW-FP32-W=ConvAsmBwdWrW3x3:0,0,16,2,3,2
512-7-7-1x1-2048-7-7-16-0x0-1x1-1x1-0-NCHW-FP32-B=ConvAsm1x1U:2,16,2,32,1,2,1,4;ConvOclDirectFwd1x1:8,64,8,8,0,1,16,4,1
384-8-8-1x1-2048-8-8-32-0x0-1x1-1x1-0-NCHW-FP32-W=ConvAsmBwdWrW1x1:2,8,4,4,8,1,1,4,0,1
384-28-28-1x1-128-28-28-128-0x0-1x1-1x1-0-NCHW-FP16-W=ConvAsmBwdWrW1x1:4,4,4,4,4,1,2,4,0,0
832-7-7-1x1-32-7-7-4-0x0-1x1-1x1-0-NCHW-FP16-F=ConvAsm1x1U:1,8,2,16,1,4,4,1;ConvOclDirectFwd1x1:1,64,1,1,0,1,4,8,0
160-17-17-1x1-768-17-17-1-0x0-1x1-1x1-0-NCHW-FP32-B=ConvAsm1x1U:1,16,1,64,1,1,4,1;ConvOclDirectFwd1x1:1,64,1,1,0,1,4,4,0
16-28-28-5x5-32-28-28-512-2x2-1x1-1x1-0-NCHW-FP16-F=ConvOclDirectFwdFused:8,32,32,32,4,1,8,1,1;ConvOclDirectFwd:16,16,32,32,2,2,8,2,2
128-28-28-1x1-512-28-28-4-0x0-1x1-1x1-0-NCHW-FP16-F=ConvAsm1x1U:1,8,2,16,1,4,1,4;ConvOclDirectFwd1x1:1,64,1,1,0,4,16,4,0
512-7-7-3x3-512-7-7-128-1x1-1x1-1x1-0-NCHW-FP16-F=ConvOclDirectFwdFused:8,8,8,8,1,1,8,4,1;ConvOclDirectFwd:8,8,8,8,1,1,8,2,2
64-112-112-7x7-3-230-230-128-0x0-2x2-1x1-0-NCHW-FP16-B=ConvOclDirectFwd:16,16,16,16,1,1,1,1,1
512-7-7-3x3-512-7-7-512-1x1-1x1-1x1-0-NCHW-FP16-F=ConvOclDirectFwd:8,8,8,8,1,1,8,4,1
192-35-35-3x3-192-71-71-128-0x0-2x2-1x1-0-NCHW-FP32-B=ConvOclDirectFwd:16,16,16,16,1,1,4,1,1
1280-8-8-1x1-320-8-8-128-0x0-1x1-1x1-0-NCHW-FP16-F=ConvAsm1x1U:1,8,2,32,4,4,2,2;ConvOclDirectFwd1x1:1,64,1,1,0,2,8,4,0
32-7-7-3x3-128-7-7-32-1x1-1x1-1x1-0-NCHW-FP16-B=ConvOclDirectFwd:8,8,8,8,1,1,2,2,2
192-35-35-1x1-384-35-35-256-0x0-1x1-1x1-0-NCHW-FP16-F=ConvAsm1x1U:3,16,6,32,1,2,1,4;ConvOclDirectFwd1x1:1,64,1,1,0,1,16,4,0
144-14-14-3x3-288-14-14-4-1x1-1x1-1x1-0-NCHW-FP16-F=ConvOclDirectFwdFused:16,16,16,16,1,1,4,4,2;ConvOclDirectFwd:16,16,16,16,1,1,4,4,2
1728-14-14-1x1-192-14-14-16-0x0-1x1-1x1-0-NCHW-FP16-F=ConvAsm1x1U:2,8,4,64,1,4,2,2;ConvOclDirectFwd1x1:1,64,1,1,0,4,8,4,0
128-112-112-3x3-128-112-112-64-1x1-1x1-1x1-0-NCHW-FP32-W=ConvAsmBwdWrW3x3:0,0,16,4,3,1
352-28-28-1x1-128-28-28-512-0x0-1x1-1x1-0-NCHW-FP32-W=ConvAsmBwdWrW1x1:1,16,2,4,4,1,4,4,0,2
512-10-42-3x3-512-10-42-16-1x1-1x1-1x1-0-NCHW-FP16-W=ConvAsmBwdWrW3x3:0,0,8,4,4,1
96-54-54-1x1-16-54-54-16-0x0-1x1-1x1-0-NCHW-FP32-B=ConvAsm1x1U:1,16,1,64,1,1,2,1;ConvOclDirectFwd1x1:1,256,1,1,0,4,8,8,0
64-56-56-1x1-256-56-56-1-0x0-1x1-1x1-0-NCHW-FP32-W=ConvAsmBwdWrW1x1:4,4,4,1,4,1,1,4,0,1
144-14-14-3x3-288-14-14-512-1x1-1x1-1x1-0-NCHW-FP16-F=ConvOclDirectFwdFused:8,8,16,16,2,2,8,1,2;ConvOclDirectFwd:8,8,16,16,2,2,8,1,1
64-35-35-3x3-96-35-35-32-1x1-1x1-1x1-0-NCHW-FP16-F=ConvOclDirectFwdFused:8,8,16,16,2,2,8,2,2;ConvOclDirectFwd:16,8,16,16,1,2,8,1,2
480-14-14-1x1-128-14-14-16-0x0-1x1-1x1-0-NCHW-FP16-F=ConvAsm1x1U:2,8,4,64,1,4,4,4;ConvOclDirectFwd1x1:1,64,1,1,0,4,4,4,0
512-7-7-1x1-2048-7-7-128-0x0-1x1-1x1-0-NCHW-FP32-B=ConvAsm1x1U:1,16,1,64,2,2,1,4;ConvOclDirectFwd1x1:1,256,1,1,0,1,16,4,0
128-28-28-1x1-512-28-28-128-0x0-1x1-1x1-0-NCHW-FP32-B=ConvAsm1x1U:1,32,1,16,2,1,1,1;ConvOclDirectFwd1x1:1,256,1,1,0,1,32,4,0
128-56-56-1x1-256-56-56-256-0x0-1x1-1x1-0-NCHW-FP16-W=ConvAsmBwdWrW1x1:2,8,4,8,2,1,4,4,0,2
1024-14-14-1x1-256-14-14-2-0x0-1x1-1x1-0-NCHW-FP32-B=ConvAsm1x1U:1,8,1,64,1,4,2,4;ConvOclDirectFwd1x1:1,256,1,1,0,1,4,4,0
528-14-14-1x1-160-14-14-512-0x0-1x1-1x1-0-NCHW-FP32-F=ConvAsm1x1U:3,16,5,16,2,2,2,1;ConvActivAsm1x1U:2,16,4,32,3,1;ConvOclDirectFwd1x1:1,64,1,1,1,4,16,2048,0
128-28-28-1x1-256-56-56-32-0x0-2x2-1x1-0-NCHW-FP32-B=ConvAsm1x1U:1,16,1,64,2,2,1,4;ConvOclDirectFwd1x1:1,128,1,1,0,2,16,4,0
64-56-56-1x1-256-56-56-128-0x0-1x1-1x1-0-NCHW-FP16-W=ConvAsmBwdWrW1x1:4,4,4,4,4,2,4,4,0,2
32-56-56-3x3-128-56-56-256-1x1-1x1-1x1-0-NCHW-FP16-B=ConvOclDirectFwd:8,16,16,32,2,2,8,1,1
224-28-28-1x1-128-28-28-32-0x0-1x1-1x1-0-NCHW-FP16-B=ConvAsm1x1U:1,16,2,16,1,2,2,2;ConvOclDirectFwd1x1:1,64,1,1,0,4,16,4,0
128-14-14-1x1-800-14-14-512-0x0-1x1-1x1-0-NCHW-FP32-F=ConvAsm1x1U:4,8,4,64,1,4,1,4;ConvOclDirectFwd1x1:1,64,1,1,1,1,64,128,0
480-14-14-1x1-192-14-14-8-0x0-1x1-1x1-0-NCHW-FP16-F=ConvAsm1x1U:2,8,4,64,1,4,4,1;ConvOclDirectFwd1x1:1,64,1,1,0,2,4,4,0
288-35-35-1x1-64-35-35-256-0x0-1x1-1x1-0-NCHW-FP32-F=ConvAsm1x1U:2,16,2,64,2,2,1,4;ConvActivAsm1x1U:2,16,2,64,3,1;ConvOclDirectFwd1x1:1,64,1,1,1,4,16,2048,0
128-112-112-3x3-64-112-112-128-1x1-1x1-1x1-0-NCHW-FP16-B=ConvOclDirectFwd:16,8,16,32,1,4,8,1,2
96-35-35-3x3-96-35-35-1-1x1-1x1-1x1-0-NCHW-FP16-B=ConvOclDirectFwd:16,16,16,16,1,1,4,4,1
128-28-28-3x3-128-28-28-1-1x1-1x1-1x1-0-NCHW-FP16-B=ConvOclDirectFwd:16,16,16,16,1,1,2,4,1
320-7-7-3x3-160-7-7-256-1x1-1x1-1x1-0-NCHW-FP16-B=ConvOclDirectFwd:8,8,8,8,1,1,8,4,1
48-27-27-1x1-192-27-27-256-0x0-1x1-1x1-0-NCHW-FP32-F=ConvAsm1x1U:1,16,1,64,3,2,1,4;ConvOclDirectFwd1x1:1,64,1,1,1,0,16,256,0
256-7-7-1x1-832-7-7-8-0x0-1x1-1x1-0-NCHW-FP32-W=ConvAsmBwdWrW1x1:1,16,2,4,8,1,1,4,0,1
192-56-56-3x3-64-56-56-256-1x1-1x1-1x1-0-NCHW-FP32-W=ConvAsmBwdWrW3x3:0,0,16,4,4,1
80-73-73-1x1-64-73-73-4-0x0-1x1-1x1-0-NCHW-FP32-W=ConvAsmBwdWrW1x1:4,4,2,2,2,1,1,4,0,3
608-14-14-1x1-128-14-14-64-0x0-1x1-1x1-0-NCHW-FP32-W=ConvAsmBwdWrW1x1:2,8,4,4,4,1,2,4,0,0
480-14-14-1x1-64-14-14-64-0x0-1x1-1x1-0-NCHW-FP16-F=ConvAsm1x1U:1,8,2,64,2,4,2,4;ConvOclDirectFwd1x1:1,64,1,1,0,2,8,4,0
160-14-14-3x3-320-14-14-64-1x1-1x1-1x1-0-NCHW-FP16-F=ConvOclDirectFwdFused:8,8,16,16,2,2,8,1,2;ConvOclDirectFwd:8,8,16,16,2,2,8,1,2
512-10-10-3x3-256-19-19-64-1x1-2x2-1x1-0-NCHW-FP32-W=ConvAsmBwdWrW3x3:0,0,8,8,8,1
128-28-28-1x1-160-28-28-32-0x0-1x1-1x1-0-NCHW-FP32-B=ConvAsm1x1U:1,16,1,32,2,2,2,2;ConvOclDirectFwd1x1:16,64,32,32,0,2,16,4,1
64-12-120-3x3-32-12-120-1-1x1-1x1-1x1-0-NCHW-FP16-B=ConvOclDirectFwd:8,16,8,16,1,1,1,4,1
128-7-7-1x1-608-7-7-32-0x0-1x1-1x1-0-NCHW-FP16-F=ConvAsm1x1U:1,8,2,32,1,4,1,4;ConvOclDirectFwd1x1:1,128,1,1,0,1,8,4,0
5-10-10-3x3-3-10-10-128-1x1-1x1-1x1-0-NCHW-FP16-F=ConvOclDirectFwd:16,8,16,16,1,2,2,1,2
64-27-27-1x1-384-27-27-256-0x0-1x1-1x1-0-NCHW-FP16-B=ConvAsm1x1U:2,16,4,64,1,2,1,4;ConvOclDirectFwd1x1:16,64,32,32,0,1,16,4,1
64-112-112-7x7-3-224-224-16-3x3-2x2-1x1-0-NCHW-FP32-B=ConvOclDirectFwd:16,16,32,32,2,2,8,2,1
64-28-28-1x1-192-28-28-1-0x0-1x1-1x1-0-NCHW-FP32-B=ConvAsm1x1U:1,8,1,64,1,4,2,2;ConvOclDirectFwd1x1:1,256,1,1,0,1,4,8,0
192-27-27-1x1-48-27-27-64-0x0-1x1-1x1-0-NCHW-FP32-B=ConvAsm1x1U:3,16,3,64,1,1,1,1;ConvOclDirectFwd1x1:1,64,1,1,0,1,16,8,0
480-14-14-1x1-96-14-14-64-0x0-1x1-1x1-0-NCHW-FP16-F=ConvAsm1x1U:2,8,4,64,1,4,2,4;ConvOclDirectFwd1x1:1,64,1,1,0,2,16,4,0
32-27-27-1x1-128-27-27-64-0x0-1x1-1x1-0-NCHW-FP16-B=ConvAsm1x1U:1,16,2,64,1,2,1,2;ConvOclDirectFwd1x1:1,256,1,1,0,1,4,4,0
1000-13-13-1x1-512-13-13-32-0x0-1x1-1x1-0-NCHW-FP16-B=ConvAsm1x1U:3,16,6,32,1,2,1,2;ConvOclDirectFwd1x1:1,64,1,1,0,1,8,4,0
256-14-14-1x1-1024-14-14-1-0x0-1x1-1x1-0-NCHW-FP32-F=ConvAsm1x1U:2,8,2,64,1,4,2,4;ConvActivAsm1x1U:2,16,4,64,1,4;ConvOclDirectFwd1x1:1,64,1,1,1,0,16,128,0
128-28-28-1x1-480-28-28-16-0x0-1x1-1x1-0-NCHW-FP32-F=ConvAsm1x1U:1,8,1,16,2,4,1,4;ConvOclDirectFwd1x1:1,64,1,1,1,0,16,256,0
320-28-28-1x1-128-28-28-256-0x0-1x1-1x1-0-NCHW-FP32-B=ConvAsm1x1U:1,32,1,16,2,1,1,1;ConvOclDirectFwd1x1:1,64,1,1,0,4,16,4,0
928-14-14-1x1-128-14-14-128-0x0-1x1-1x1-0-NCHW-FP16-W=ConvAsmBwdWrW1x1:2,8,4,8,2,1,2,4,0,1
64-56-56-1x1-256-56-56-16-0x0-1x1-1x1-0-NCHW-FP32-F=ConvAsm1x1U:1,16,1,64,4,2,1,2;ConvActivAsm1x1U:1,16,1,64,4,1;ConvOclDirectFwd1x1:1,64,1,1,1,0,32,2048,0
832-7-7-1x1-256-7-7-16-0x0-1x1-1x1-0-NCHW-FP32-F=ConvAsm1x1U:2,8,2,32,1,4,2,4;ConvActivAsm1x1U:2,16,2,32,2,4;ConvOclDirectFwd1x1:1,64,1,1,1,1,16,128,0
64-80-350-3x3-64-80-350-16-1x1-1x1-1x1-0-NCHW-FP32-W=ConvAsmBwdWrW3x3:0,1,16,2,1,8
32-147-147-3x3-64-147-147-1-1x1-1x1-1x1-0-NCHW-FP16-F=ConvOclDirectFwdFused:16,16,16,32,1,2,8,2,1;ConvOclDirectFwd:16,16,16,32,1,2,8,2,1
64-55-55-1x1-64-55-55-128-0x0-1x1-1x1-0-NCHW-FP32-F=ConvAsm1x1U:3,32,3,64,1,1;ConvOclDirectFwd1x1:1,64,1,1,1,4,32,2048,0
64-28-28-1x1-192-28-28-512-0x0-1x1-1x1-0-NCHW-FP16-B=ConvAsm1x1U:1,16,2,16,1,2,1,4;ConvOclDirectFwd1x1:1,64,1,1,0,4,16,4,0
576-14-14-1x1-192-14-14-32-0x0-1x1-1x1-0-NCHW-FP16-F=ConvAsm1x1U:1,8,2,32,2,4,1,4;ConvOclDirectFwd1x1:1,256,1,1,0,4,8,4,0
5-10-10-3x3-3-10-10-512-1x1-1x1-1x1-0-NCHW-FP16-B=ConvOclDirectFwd:8,8,16,16,2,2,2,1,2
32-38-166-5x10-32-79-341-4-0x0-2x2-1x1-0-NCHW-FP32-B=ConvOclDirectFwd:16,8,16,32,1,4,4,4,2
2048-7-7-1x1-1024-14-14-256-0x0-2x2-1x1-0-NCHW-FP16-B=ConvAsm1x1U:2,16,4,16,1,2,1,4;ConvOclDirectFwd1x1:1,128,1,1,0,1,32,4,0
256-30-30-3x3-256-14-14-128-0x0-2x2-1x1-0-NCHW-FP32-F=ConvOclDirectFwd:16,8,16,16,1,2,8,1,2
512-7-7-1x1-512-7-7-1-0x0-1x1-1x1-0-NCHW-FP16-F=ConvAsm1x1U:1,8,2,16,1,4,4,1;ConvOclDirectFwd1x1:1,128,1,1,0,1,4,8,0
384-14-14-1x1-128-14-14-512-0x0-1x1-1x1-0-NCHW-FP32-W=ConvAsmBwdWrW1x1:4,4,8,4,4,2,2,4,0,1
16-14-14-1x1-480-14-14-256-0x0-1x1-1x1-0-NCHW-FP32-F=ConvAsm1x1U:1,8,1,64,2,4,1,1;ConvOclDirectFwd1x1:1,64,1,1,1,1,64,2048,0
128-28-28-1x1-320-28-28-256-0x0-1x1-1x1-0-NCHW-FP32-W=ConvAsmBwdWrW1x1:4,4,4,4,4,2,2,2,0,1
256-56-56-1x1-128-28-28-2-0x0-2x2-1x1-0-NCHW-FP32-F=ConvAsm1x1U:2,8,2,32,1,4,2,4;ConvOclDirectFwd1x1:1,64,1,1,1,4,16,64,0
128-28-28-1x1-256-28-28-1-0x0-1x1-1x1-0-NCHW-FP16-W=ConvAsmBwdWrW1x1:4,4,4,2,2,1,1,4,0,0
64-54-54-1x1-16-54-54-32-0x0-1x1-1x1-0-NCHW-FP16-W=ConvAsmBwdWrW1x1:4,4,2,1,2,1,4,4,0,1
192-14-14-1x1-912-14-14-16-0x0-1x1-1x1-0-NCHW-FP32-W=ConvAsmBwdWrW1x1:1,16,4,4,8,1,2,4,0,1
544-7-7-1x1-128-7-7-128-0x0-1x1-1x1-0-NCHW-FP32-B=ConvAsm1x1U:4,8,4,16,1,4,1,8;ConvOclDirectFwd1x1:1,128,1,1,0,1,8,4,0
64-35-35-3x3-96-35-35-8-1x1-1x1-1x1-0-NCHW-FP16-F=ConvOclDirectFwdFused:16,8,16,16,1,2,8,4,2;ConvOclDirectFwd:16,8,16,16,1,2,8,4,2
128-14-14-1x1-896-14-14-64-0x0-1x1-1x1-0-NCHW-FP32-F=ConvAsm1x1U:4,8,4,64,1,4,1,4;ConvOclDirectFwd1x1:1,64,1,1,1,1,16,2048,0
528-14-14-1x1-256-14-14-256-0x0-1x1-1x1-0-NCHW-FP32-F=ConvAsm1x1U:2,16,2,64,2,2,1,8;ConvActivAsm1x1U:1,32,7,32,1,1;ConvOclDirectFwd1x1:1,64,1,1,1,0,16,2048,0
1536-8-8-1x1-384-8-8-32-0x0-1x1-1x1-0-NCHW-FP16-F=ConvAsm1x1U:1,8,2,32,2,4,2,2;ConvOclDirectFwd1x1:8,64,8,8,0,2,16,4,1
64-56-56-1x1-64-56-56-512-0x0-1x1-1x1-0-NCHW-FP16-B=ConvAsm1x1U:1,16,2,32,1,2,1,2;ConvOclDirectFwd1x1:1,256,1,1,0,4,16,4,0
160-64-128-3x3-320-64-128-1-1x1-1x1-1x1-0-NCHW-FP16-F=ConvOclDirectFwd:16,16,32,32,2,2,8,2,1
192-14-14-1x1-480-14-14-16-0x0-1x1-1x1-0-NCHW-FP32-W=ConvAsmBwdWrW1x1:1,16,2,4,8,1,2,4,0,1
512-14-14-3x3-512-14-14-512-1x1-1x1-1x1-0-NCHW-FP16-F=ConvOclDirectFwd:8,8,16,16,2,2,8,2,2
192-14-14-1x1-1680-14-14-16-0x0-1x1-1x1-0-NCHW-FP16-W=ConvAsmBwdWrW1x1:2,8,2,8,2,1,1,4,0,3
64-112-112-3x3-128-112-112-512-1x1-1x1-1x1-0-NCHW-FP16-F=ConvOclDirectFwd:8,16,16,32,2,2,8,1,1
384-13-13-3x3-192-13-13-16-1x1-1x1-1x1-0-NCHW-FP16-B=ConvOclDirectFwd:8,16,16,16,2,1,4,1,2
128-7-7-1x1-640-7-7-16-0x0-1x1-1x1-0-NCHW-FP32-F=ConvAsm1x1U:2,8,2,32,1,4,1,4;ConvOclDirectFwd1x1:1,64,1,1,1,1,16,256,0
160-14-14-1x1-528-14-14-4-0x0-1x1-1x1-0-NCHW-FP16-B=ConvAsm1x1U:1,16,2,16,1,2,4,1;ConvOclDirectFwd1x1:1,64,1,1,0,4,4,4,0
256-14-14-1x1-128-14-14-512-0x0-1x1-1x1-0-NCHW-FP16-F=ConvAsm1x1U:2,8,4,64,1,4,1,4
320-28-28-1x1-64-28-28-32-0x0-1x1-1x1-0-NCHW-FP32-F=ConvAsm1x1U:3,16,3,16,1,2,2,1;ConvActivAsm1x1U:2,16,2,16,2,3;ConvOclDirectFwd1x1:1,64,1,1,1,0,16,128,0
192-14-14-1x1-768-14-14-16-0x0-1x1-1x1-0-NCHW-FP16-B=ConvAsm1x1U:1,16,2,16,1,2,2,2;ConvOclDirectFwd1x1:1,64,1,1,0,4,8,4,0
320-8-8-1x1-1280-8-8-8-0x0-1x1-1x1-0-NCHW-FP32-W=ConvAsmBwdWrW1x1:1,16,2,4,8,1,1,4,0,0
256-7-7-1x1-832-7-7-128-0x0-1x1-1x1-0-NCHW-FP32-W=ConvAsmBwdWrW1x1:1,16,4,8,4,1,2,4,0,1
128-14-14-1x1-256-14-14-128-0x0-1x1-1x1-0-NCHW-FP16-B=ConvAsm1x1U:1,16,2,16,1,2,1,8;ConvOclDirectFwd1x1:1,64,1,1,0,4,8,4,0
528-14-14-1x1-32-14-14-256-0x0-1x1-1x1-0-NCHW-FP16-F=ConvAsm1x1U:2,8,4,64,1,4,1,4;ConvOclDirectFwd1x1:1,64,1,1,0,4,16,4,0
24-14-14-1x1-512-14-14-1-0x0-1x1-1x1-0-NCHW-FP32-W=ConvAsmBwdWrW1x1:4,4,2,2,2,1,1,4,0,3
48-27-27-1x1-256-27-27-128-0x0-1x1-1x1-0-NCHW-FP16-W=ConvAsmBwdWrW1x1:4,4,4,4,2,1,4,4,0,1
576-7-7-1x1-128-7-7-64-0x0-1x1-1x1-0-NCHW-FP16-F=ConvAsm1x1U:2,8,4,16,1,4,4,1;ConvOclDirectFwd1x1:1,64,1,1,0,1,4,4,0
256-64-128-1x1-832-64-128-1-0x0-1x1-1x1-0-NCHW-FP16-W=ConvAsmBwdWrW1x1:2,8,2,4,8,1,1,4,0,3
832-7-7-1x1-128-7-7-1-0x0-1x1-1x1-0-NCHW-FP16-F=ConvAsm1x1U:1,8,2,16,1,4,4,1;ConvOclDirectFwd1x1:1,128,1,1,0,1,4,8,0
96-14-14-1x1-480-14-14-128-0x0-1x1-1x1-0-NCHW-FP32-W=ConvAsmBwdWrW1x1:1,16,2,4,8,1,4,4,0,3
160-14-14-1x1-528-14-14-8-0x0-1x1-1x1-0-NCHW-FP32-B=ConvAsm1x1U:1,16,1,32,1,1,2,2;ConvOclDirectFwd1x1:1,64,1,1,0,4,16,4,0
512-14-14-1x1-1024-14-14-256-0x0-1x1-1x1-0-NCHW-FP32-B=ConvAsm1x1U:1,16,1,32,4,2,1,8;ConvOclDirectFwd1x1:1,256,1,1,0,4,16,8,0
48-35-35-1x1-256-35-35-32-0x0-1x1-1x1-0-NCHW-FP16-W=ConvAsmBwdWrW1x1:4,4,4,4,4,1,4,4,0,1
48-35-35-1x1-288-35-35-4-0x0-1x1-1x1-0-NCHW-FP32-W=ConvAsmBwdWrW1x1:2,8,2,8,2,1,4,4,0,1
16-54-54-1x1-96-54-54-512-0x0-1x1-1x1-0-NCHW-FP32-W=ConvAsmBwdWrW1x1:4,4,2,2,2,1,4,4,0,3
256-28-28-3x3-512-28-28-1-1x1-1x1-1x1-0-NCHW-FP16-F=ConvOclDirectFwdFused:16,16,32,32,2,2,2,4,1;ConvOclDirectFwd:16,16,32,32,2,2,2,4,1
1584-7-7-1x1-192-7-7-16-0x0-1x1-1x1-0-NCHW-FP32-F=ConvAsm1x1U:2,8,2,32,1,4,2,2;ConvActivAsm1x1U:4,16,4,16,1,4;ConvOclDirectFwd1x1:1,64,1,1,1,4,16,256,0
128-7-7-1x1-768-7-7-32-0x0-1x1-1x1-0-NCHW-FP16-W=ConvAsmBwdWrW1x1:2,8,4,8,2,2,2,4,0,0
2112-7-7-1x1-192-7-7-16-0x0-1x1-1x1-0-NCHW-FP16-F=ConvAsm1x1U:1,8,2,32,1,4,4,1;ConvOclDirectFwd1x1:1,64,1,1,0,1,4,8,0
160-17-17-1x1-768-17-17-4-0x0-1x1-1x1-0-NCHW-FP32-W=ConvAsmBwdWrW1x1:1,16,2,4,8,1,2,4,0,1
64-56-56-1x1-256-56-56-16-0x0-1x1-1x1-0-NCHW-FP16-F=ConvAsm1x1U:1,8,2,32,2,4,1,8;ConvOclDirectFwd1x1:1,64,1,1,0,4,16,4,0
528-14-14-1x1-192-14-14-16-0x0-1x1-1x1-0-NCHW-FP32-F=ConvAsm1x1U:3,8,3,16,1,4,1,4;ConvActivAsm1x1U:1,16,3,16,4,4;ConvOclDirectFwd1x1:1,64,1,1,1,0,16,128,0
480-14-14-1x1-192-14-14-256-0x0-1x1-1x1-0-NCHW-FP32-W=ConvAsmBwdWrW1x1:2,8,4,8,2,1,4,4,0,2
64-28-28-3x3-64-56-56-16-1x1-2x2-1x1-0-NCHW-FP32-W=ConvAsmBwdWrW3x3:0,0,16,4,3,2
128-28-28-1x1-512-28-28-64-0x0-1x1-1x1-0-NCHW-FP16-F=ConvAsm1x1U:1,8,2,32,2,4,1,8;ConvOclDirectFwd1x1:1,256,1,1,0,4,16,4,0
192-28-28-3x3-128-28-28-1-1x1-1x1-1x1-0-NCHW-FP16-B=ConvOclDirectFwd:16,16,16,16,1,1,2,4,1
128-27-27-1x1-32-27-27-32-0x0-1x1-1x1-0-NCHW-FP16-B=ConvAsm1x1U:1,8,2,64,1,4,2,2;ConvOclDirectFwd1x1:1,256,1,1,0,1,4,4,0
224-35-35-3x3-192-35-35-128-1x1-1x1-1x1-0-NCHW-FP16-B=ConvOclDirectFwd:8,8,16,16,2,2,8,2,1
128-14-14-1x1-288-14-14-16-0x0-1x1-1x1-0-NCHW-FP32-F=ConvAsm1x1U:2,16,2,16,1,2,2,1;ConvOclDirectFwd1x1:1,64,1,1,1,1,16,256,0
384-7-7-3x3-192-7-7-16-1x1-1x1-1x1-0-NCHW-FP32-W=ConvAsmBwdWrW3x3:0,1,8,4,2,1
384-35-35-1x1-192-35-35-32-0x0-1x1-1x1-0-NCHW-FP32-F=ConvAsm1x1U:2,16,3,32,2,2,1,4;ConvActivAsm1x1U:1,16,3,32,2,2;ConvOclDirectFwd1x1:1,64,1,1,1,4,16,2048,0
64-73-73-3x3-96-71-71-256-0x0-1x1-1x1-0-NCHW-FP16-F=ConvOclDirectFwdFused:8,8,16,16,2,2,8,2,1;ConvOclDirectFwd:8,8,16,16,2,2,8,1,1
224-35-35-3x3-192-35-35-8-1x1-1x1-1x1-0-NCHW-FP32-W=ConvAsmBwdWrW3x3:0,1,8,4,3,2
192-27-27-5x5-64-27-27-32-2x2-1x1-1x1-0-NCHW-FP16-F=ConvOclDirectFwd:16,16,32,32,2,2,8,1,2
192-17-17-3x3-320-8-8-256-0x0-2x2-1x1-0-NCHW-FP32-F=ConvOclDirectFwd:8,8,8,8,1,1,8,2,2
128-28-28-1x1-320-28-28-32-0x0-1x1-1x1-0-NCHW-FP16-B=ConvAsm1x1U:1,16,2,16,1,2,1,4;ConvOclDirectFwd1x1:1,64,1,1,0,4,16,4,0
480-14-14-1x1-96-14-14-256-0x0-1x1-1x1-0-NCHW-FP32-B=ConvAsm1x1U:1,16,1,32,4,2,2,2;ConvOclDirectFwd1x1:1,256,1,1,0,2,16,4,0
256-14-14-1x1-1024-7-7-2-0x0-2x2-1x1-0-NCHW-FP16-F=ConvAsm1x1U:1,8,2,32,1,4,4,1;ConvOclDirectFwd1x1:1,128,1,1,0,1,4,4,0
64-28-28-1x1-192-28-28-4-0x0-1x1-1x1-0-NCHW-FP16-B=ConvAsm1x1U:1,8,2,16,1,2,2,2;ConvOclDirectFwd1x1:1,64,1,1,0,2,4,4,0
160-7-7-1x1-832-7-7-32-0x0-1x1-1x1-0-NCHW-FP32-B=ConvAsm1x1U:1,8,1,64,2,2,1,4;ConvOclDirectFwd1x1:1,64,1,1,0,1,16,4,0
2048-7-7-1x1-512-7-7-8-0x0-1x1-1x1-0-NCHW-FP16-F=ConvAsm1x1U:2,8,4,16,1,4,4,1;ConvOclDirectFwd1x1:1,64,1,1,0,1,4,4,0
320-14-14-3x3-160-14-14-64-1x1-1x1-1x1-0-NCHW-FP16-W=ConvAsmBwdWrW3x3:0,1,8,4,5,2
128-7-7-1x1-736-7-7-512-0x0-1x1-1x1-0-NCHW-FP16-F=ConvAsm1x1U:2,8,4,16,1,4,1,4;ConvOclDirectFwd1x1:1,256,1,1,0,1,8,4,0
64-27-27-3x3-256-27-27-16-1x1-1x1-1x1-0-NCHW-FP16-F=ConvOclDirectFwd:16,16,32,32,2,2,8,1,2
64-56-56-3x3-64-56-56-8-1x1-1x1-1x1-0-NCHW-FP16-F=ConvOclDirectFwdFused:16,16,32,32,2,2,8,2,1;ConvOclDirectFwd:16,16,32,32,2,2,8,4,2
160-7-7-3x3-320-7-7-16-1x1-1x1-1x1-0-NCHW-FP16-F=ConvOclDirectFwdFused:8,8,8,8,1,1,4,4,2;ConvOclDirectFwd:8,8,8,8,1,1,4,4,2
64-14-14-5x5-24-14-14-256-2x2-1x1-1x1-0-NCHW-FP16-B=ConvOclDirectFwd:8,8,16,16,2,2,8,2,1
128-7-7-1x1-832-7-7-512-0x0-1x1-1x1-0-NCHW-FP32-B=ConvAsm1x1U:1,16,1,64,2,2,1,4;ConvOclDirectFwd1x1:1,128,1,1,0,1,32,4,0
144-14-14-1x1-512-14-14-4-0x0-1x1-1x1-0-NCHW-FP32-W=ConvAsmBwdWrW1x1:1,16,2,4,2,1,2,4,0,0
64-14-14-1x1-480-14-14-1-0x0-1x1-1x1-0-NCHW-FP16-W=ConvAsmBwdWrW1x1:2,8,2,2,2,1,1,4,0,1
992-7-7-1x1-128-7-7-16-0x0-1x1-1x1-0-NCHW-FP16-F=ConvAsm1x1U:1,8,2,32,1,4,4,1;ConvOclDirectFwd1x1:1,64,1,1,0,1,4,8,0
208-14-14-3x3-96-14-14-64-1x1-1x1-1x1-0-NCHW-FP16-W=ConvAsmBwdWrW3x3:0,0,8,2,6,1
512-7-7-1x1-2048-7-7-1-0x0-1x1-1x1-0-NCHW-FP32-W=ConvAsmBwdWrW1x1:1,16,2,2,8,1,1,4,0,1
64-56-56-1x1-64-56-56-32-0x0-1x1-1x1-0-NCHW-FP32-W=ConvAsmBwdWrW1x1:4,4,2,4,2,1,4,4,0,1
64-13-13-1x1-512-13-13-64-0x0-1x1-1x1-0-NCHW-FP32-F=ConvAsm1x1U:3,16,3,64,1,2,1,8;ConvOclDirectFwd1x1:1,64,1,1,1,4,16,2048,0
1024-17-17-1x1-128-17-17-32-0x0-1x1-1x1-0-NCHW-FP32-F=ConvAsm1x1U:2,16,5,64,1,2,2,1;ConvActivAsm1x1U:4,16,5,64,1,2;ConvOclDirectFwd1x1:1,64,1,1,1,1,16,2048,0
32-28-28-1x1-192-28-28-128-0x0-1x1-1x1-0-NCHW-FP16-B=ConvAsm1x1U:1,16,2,32,1,2,1,4;ConvOclDirectFwd1x1:1,64,1,1,0,4,16,4,0
256-4-4-1x1-512-7-7-12-0x0-2x2-1x1-0-NCHW-FP32-B=ConvAsm1x1U:1,8,1,16,1,4,2,4;ConvOclDirectFwd1x1:1,128,1,1,0,1,4,4,0
96-14-14-1x1-576-14-14-64-0x0-1x1-1x1-0-NCHW-FP16-W=ConvAsmBwdWrW1x1:2,8,4,8,2,1,2,4,0,3
64-73-73-1x1-80-73-73-16-0x0-1x1-1x1-0-NCHW-FP32-F=ConvAsm1x1U:1,16,1,64,4,2,2,1;ConvActivAsm1x1U:1,32,1,64,2,1;ConvOclDirectFwd1x1:1,64,1,1,1,4,64,2048,0
24-14-14-1x1-512-14-14-128-0x0-1x1-1x1-0-NCHW-FP32-B=ConvAsm1x1U:1,32,1,16,1,1,2,2;ConvOclDirectFwd1x1:1,64,1,1,0,4,16,8,0
512-19-19-3x3-256-38-38-32-1x1-2x2-1x1-0-NCHW-FP32-B=ConvOclDirectFwd:8,16,16,16,2,1,8,4,1
160-14-14-1x1-528-14-14-16-0x0-1x1-1x1-0-NCHW-FP32-B=ConvAsm1x1U:1,16,1,16,4,2,1,2;ConvOclDirectFwd1x1:1,256,1,1,0,4,16,4,0
192-17-17-1x1-1024-17-17-4-0x0-1x1-1x1-0-NCHW-FP16-B=ConvAsm1x1U:1,16,2,32,1,2,2,2;ConvOclDirectFwd1x1:1,256,1,1,0,1,8,4,0
128-14-14-1x1-528-14-14-16-0x0-1x1-1x1-0-NCHW-FP32-W=ConvAsmBwdWrW1x1:1,16,2,8,2,1,1,4,0,2
64-27-27-1x1-384-27-27-128-0x0-1x1-1x1-0-NCHW-FP16-B=ConvAsm1x1U:1,16,2,16,1,2,1,4;ConvOclDirectFwd1x1:1,64,1,1,0,1,16,4,0
256-13-13-3x3-256-13-13-512-1x1-1x1-1x1-0-NCHW-FP16-W=ConvAsmBwdWrW3x3:0,0,8,4,2,1
128-28-28-1x1-512-28-28-32-0x0-1x1-1x1-0-NCHW-FP16-W=ConvAsmBwdWrW1x1:4,4,8,4,2,2,1,2,0,1
384-8-8-1x1-1280-8-8-16-0x0-1x1-1x1-0-NCHW-FP16-W=ConvAsmBwdWrW1x1:1,16,4,8,2,1,1,4,0,1
256-7-7-1x1-832-7-7-512-0x0-1x1-1x1-0-NCHW-FP16-B=ConvAsm1x1U:1,16,2,32,2,2,1,4;ConvOclDirectFwd1x1:1,128,1,1,0,1,8,4,0
64-56-56-1x1-128-56-56-32-0x0-1x1-1x1-0-NCHW-FP32-W=ConvAsmBwdWrW1x1:4,4,4,4,2,1,4,4,0,1
128-28-28-3x3-128-58-58-512-0x0-2x2-1x1-0-NCHW-FP16-B=ConvOclDirectFwd:16,16,32,32,2,2,4,2,1
48-7-7-5x5-128-7-7-256-2x2-1x1-1x1-0-NCHW-FP32-F=ConvOclDirectFwdFused:8,8,8,8,1,1,8,2,2;ConvOclDirectFwd:8,8,8,8,1,1,8,2,2
48-7-7-1x1-832-7-7-128-0x0-1x1-1x1-0-NCHW-FP16-B=ConvAsm1x1U:1,16,2,32,1,2,1,2;ConvOclDirectFwd1x1:1,64,1,1,0,1,16,4,0
128-38-38-1x1-256-38-38-64-0x0-1x1-1x1-0-NCHW-FP32-F=ConvAsm1x1U:1,16,1,64,4,2,1,4;ConvOclDirectFwd1x1:1,64,1,1,1,0,16,2048,0
128-56-56-1x1-256-56-56-16-0x0-1x1-1x1-0-NCHW-FP16-W=ConvAsmBwdWrW1x1:4,4,4,1,8,1,1,4,0,1
96-28-28-3x3-128-28-28-1-1x1-1x1-1x1-0-NCHW-FP16-F=ConvOclDirectFwdFused:16,16,16,16,1,1,2,2,1;ConvOclDirectFwd:16,16,16,16,1,1,2,4,1
128-112-112-3x3-64-112-112-32-1x1-1x1-1x1-0-NCHW-FP16-B=ConvOclDirectFwd:8,16,16,32,2,2,8,1,1
192-35-35-1x1-384-35-35-1-0x0-1x1-1x1-0-NCHW-FP32-W=ConvAsmBwdWrW1x1:1,16,2,4,4,1,1,4,0,1
128-54-54-1x1-16-54-54-512-0x0-1x1-1x1-0-NCHW-FP16-B=ConvAsm1x1U:1,8,2,64,1,4,2,2;ConvOclDirectFwd1x1:1,128,1,1,0,4,16,4,0
128-7-7-3x3-32-7-7-512-1x1-1x1-1x1-0-NCHW-FP16-W=ConvAsmBwdWrW3x3:0,1,8,2,6,4
416-14-14-1x1-128-14-14-16-0x0-1x1-1x1-0-NCHW-FP32-B=ConvAsm1x1U:2,16,2,64,1,2,4,4;ConvOclDirectFwd1x1:1,64,1,1,0,1,8,4,0
256-14-14-3x3-256-14-14-32-1x1-1x1-1x1-0-NCHW-FP16-F=ConvOclDirectFwdFused:8,8,16,16,2,2,8,4,2;ConvOclDirectFwd:8,8,16,16,2,2,8,2,1
192-14-14-1x1-480-14-14-1-0x0-1x1-1x1-0-NCHW-FP32-W=ConvAsmBwdWrW1x1:1,16,4,2,4,1,1,4,0,1
64-55-55-1x1-64-55-55-32-0x0-1x1-1x1-0-NCHW-FP32-F=ConvAsm1x1U:2,16,2,64,2,1,1,4;ConvActivAsm1x1U:1,32,1,64,2,1;ConvOclDirectFwd1x1:1,64,1,1,1,1,16,128,0
24-128-128-1x1-512-128-128-1-0x0-1x1-1x1-0-NCHW-FP16-W=ConvAsmBwdWrW1x1:4,4,2,1,8,1,1,4,0,1
48-7-7-1x1-832-7-7-16-0x0-1x1-1x1-0-NCHW-FP16-B=ConvAsm1x1U:1,8,2,32,1,2,2,1;ConvOclDirectFwd1x1:1,64,1,1,0,1,8,4,0
288-35-35-1x1-64-35-35-128-0x0-1x1-1x1-0-NCHW-FP16-F=ConvAsm1x1U:2,16,4,32,1,2,1,2;ConvOclDirectFwd1x1:1,128,1,1,0,1,8,4,0
480-14-14-1x1-64-14-14-16-0x0-1x1-1x1-0-NCHW-FP32-F=ConvAsm1x1U:1,8,1,32,2,4,2,2;ConvActivAsm1x1U:1,16,2,64,1,4;ConvOclDirectFwd1x1:1,64,1,1,1,0,16,128,0
608-7-7-1x1-128-7-7-16-0x0-1x1-1x1-0-NCHW-FP16-W=ConvAsmBwdWrW1x1:2,8,2,8,2,1,2,2,0,1
32-54-54-1x1-128-54-54-128-0x0-1x1-1x1-0-NCHW-FP32-B=ConvAsm1x1U:1,32,1,64,1,1,2,2;ConvOclDirectFwd1x1:1,128,1,1,0,1,32,4,0
48-7-7-1x1-832-7-7-128-0x0-1x1-1x1-0-NCHW-FP16-W=ConvAsmBwdWrW1x1:4,4,4,4,2,1,2,2,0,2
128-28-28-3x3-128-28-28-4-1x1-1x1-1x1-0-NCHW-FP16-F=ConvOclDirectFwdFused:16,16,32,32,2,2,2,4,2;ConvOclDirectFwd:16,16,32,32,2,2,2,4,2
256-27-27-1x1-64-27-27-128-0x0-1x1-1x1-0-NCHW-FP16-B=ConvAsm1x1U:2,16,4,64,1,2,1,4;ConvOclDirectFwd1x1:16,64,32,32,0,1,16,4,1
448-8-8-1x1-1280-8-8-32-0x0-1x1-1x1-0-NCHW-FP16-B=ConvAsm1x1U:1,16,2,16,1,2,2,4;ConvOclDirectFwd1x1:1,64,1,1,0,4,16,4,0
192-28-28-1x1-96-28-28-8-0x0-1x1-1x1-0-NCHW-FP32-F=ConvAsm1x1U:1,8,1,32,2,2,2,2;ConvActivAsm1x1U:1,16,1,64,3,2;ConvOclDirectFwd1x1:1,64,1,1,1,0,16,2048,0
128-28-28-1x1-512-28-28-256-0x0-1x1-1x1-0-NCHW-FP16-F=ConvAsm1x1U:1,8,2,32,2,4,1,4;ConvOclDirectFwd1x1:1,64,1,1,0,4,16,4,0
64-13-13-1x1-256-13-13-512-0x0-1x1-1x1-0-NCHW-FP32-F=ConvAsm1x1U:3,16,3,64,1,2,1,4;ConvOclDirectFwd1x1:1,64,1,1,1,0,32,2048,0
320-14-14-1x1-128-14-14-512-0x0-1x1-1x1-0-NCHW-FP16-F=ConvAsm1x1U:2,8,4,64,1,4,1,4;ConvOclDirectFwd1x1:1,256,1,1,0,4,8,4,0
384-27-27-1x1-64-27-27-512-0x0-1x1-1x1-0-NCHW-FP32-B=ConvAsm1x1U:2,16,2,64,1,2,1,4;ConvOclDirectFwd1x1:1,128,1,1,0,1,32,4,0
256-56-56-1x1-128-28-28-8-0x0-2x2-1x1-0-NCHW-FP16-F=ConvAsm1x1U:1,8,2,32,2,4,2,4;ConvOclDirectFwd1x1:1,256,1,1,0,2,16,8,0
192-27-27-1x1-48-27-27-512-0x0-1x1-1x1-0-NCHW-FP32-B=ConvAsm1x1U:3,16,3,64,1,1,1,1;ConvOclDirectFwd1x1:1,256,1,1,0,1,16,4,0
192-7-7-1x1-1024-7-7-32-0x0-1x1-1x1-0-NCHW-FP16-W=ConvAsmBwdWrW1x1:1,16,2,8,2,1,2,2,0,3
256-27-27-3x3-64-27-27-512-1x1-1x1-1x1-0-NCHW-FP16-B=ConvOclDirectFwd:16,16,32,32,2,2,8,1,2
320-14-14-3x3-160-14-14-256-1x1-1x1-1x1-0-NCHW-FP16-W=ConvAsmBwdWrW3x3:0,0,8,4,9,2
128-28-28-1x1-512-28-28-8-0x0-1x1-1x1-0-NCHW-FP32-F=ConvAsm1x1U:1,16,1,32,2,2,2,2;ConvActivAsm1x1U:2,16,2,16,2,2;ConvOclDirectFwd1x1:1,64,1,1,1,0,16,256,0
1024-14-14-1x1-512-28-28-32-0x0-2x2-1x1-0-NCHW-FP32-B=ConvAsm1x1U:1,32,1,16,2,1,2,2;ConvOclDirectFwd1x1:1,256,1,1,0,1,32,4,0
32-27-27-1x1-256-27-27-32-0x0-1x1-1x1-0-NCHW-FP32-F=ConvAsm1x1U:1,8,1,64,2,4,1,4;ConvOclDirectFwd1x1:1,64,1,1,1,1,32,256,0
192-7-7-1x1-2160-7-7-16-0x0-1x1-1x1-0-NCHW-FP16-B=ConvAsm1x1U:1,16,2,16,1,2,2,2;ConvOclDirectFwd1x1:1,64,1,1,0,1,8,4,0
528-14-14-1x1-160-14-14-128-0x0-1x1-1x1-0-NCHW-FP16-F=ConvAsm1x1U:2,8,4,64,1,4,1,4;ConvOclDirectFwd1x1:1,64,1,1,0,4,16,4,0
640-7-7-1x1-128-7-7-64-0x0-1x1-1x1-0-NCHW-FP16-F=ConvAsm1x1U:2,8,4,16,1,4,4,1;ConvOclDirectFwd1x1:1,64,1,1,0,1,4,4,0
64-13-13-3x3-256-13-13-32-1x1-1x1-1x1-0-NCHW-FP16-B=ConvOclDirectFwd:8,8,16,16,2,2,8,4,2
128-40-175-3x3-128-40-175-2-1x1-1x1-1x1-0-NCHW-FP16-F=ConvOclDirectFwd:8,16,16,32,2,2,8,1,2
192-14-14-1x1-1200-14-14-16-0x0-1x1-1x1-0-NCHW-FP32-W=ConvAsmBwdWrW1x1:1,16,2,8,4,1,2,4,0,0
1024-14-14-1x1-256-14-14-1-0x0-1x1-1x1-0-NCHW-FP32-F=ConvAsm1x1U:2,8,2,64,1,4,4,1;ConvActivAsm1x1U:2,16,2,64,1,4;ConvOclDirectFwd1x1:1,64,1,1,1,4,16,64,0
128-14-14-1x1-640-14-14-256-0x0-1x1-1x1-0-NCHW-FP32-F=ConvAsm1x1U:1,16,1,32,3,2,2,2;ConvOclDirectFwd1x1:1,64,1,1,1,4,16,2048,0
48-7-7-5x5-128-7-7-1-2x2-1x1-1x1-0-NCHW-FP32-F=ConvOclDirectFwdFused:8,8,8,8,1,1,1,4,1;ConvOclDirectFwd:8,8,8,8,1,1,1,4,1
64-14-14-1x1-576-14-14-32-0x0-1x1-1x1-0-NCHW-FP16-B=ConvAsm1x1U:1,16,2,16,1,2,2,4;ConvOclDirectFwd1x1:1,256,1,1,0,4,8,4,0
128-28-28-1x1-256-55-55-1-0x0-2x2-1x1-0-NCHW-FP32-W=ConvAsmBwdWrW1x1:4,4,4,2,2,1,1,4
32-27-27-3x3-128-27-27-512-1x1-1x1-1x1-0-NCHW-FP16-B=ConvOclDirectFwd:16,16,32,32,2,2,8,1,2
64-56-56-3x3-192-56-56-16-1x1-1x1-1x1-0-NCHW-FP16-F=ConvOclDirectFwdFused:32,8,32,32,1,4,8,1,2;ConvOclDirectFwd:32,8,32,32,1,4,8,1,2
512-28-28-1x1-1024-14-14-8-0x0-2x2-1x1-0-NCHW-FP16-F=ConvAsm1x1U:2,8,4,64,1,4,1,4;ConvOclDirectFwd1x1:1,256,1,1,0,2,16,4,0
320-8-8-1x1-1280-8-8-16-0x0-1x1-1x1-0-NCHW-FP16-B=ConvAsm1x1U:1,16,2,16,1,2,2,2;ConvOclDirectFwd1x1:1,64,1,1,0,2,8,4,0
96-56-56-1x1-128-56-56-32-0x0-1x1-1x1-0-NCHW-FP32-F=ConvAsm1x1U:1,16,1,64,3,2,1,1;ConvOclDirectFwd1x1:1,64,1,1,1,0,16,2048,0
128-56-56-3x3-256-56-56-128-1x1-1x1-1x1-0-NCHW-FP16-F=ConvOclDirectFwdFused:16,16,32,32,2,2,8,2,1;ConvOclDirectFwd:16,8,16,32,1,4,8,1,1
512-4-4-3x3-512-7-7-16-1x1-2x2-1x1-0-NCHW-FP32-W=ConvAsmBwdWrW3x3:0,0,8,4,7,1
256-14-14-3x3-256-7-7-256-1x1-2x2-1x1-0-NCHW-FP32-F=ConvOclDirectFwd:8,8,8,8,1,1,8,2,1
128-58-58-3x3-128-28-28-256-0x0-2x2-1x1-0-NCHW-FP32-F=ConvOclDirectFwd:16,16,16,32,1,2,8,2,1
64-28-28-1x1-256-28-28-8-0x0-1x1-1x1-0-NCHW-FP16-W=ConvAsmBwdWrW1x1:4,4,4,2,2,1,1,4,0,1
608-14-14-1x1-192-14-14-32-0x0-1x1-1x1-0-NCHW-FP16-F=ConvAsm1x1U:1,8,2,32,2,4,1,4;ConvOclDirectFwd1x1:1,64,1,1,0,4,16,4,0
128-56-56-3x3-32-56-56-256-1x1-1x1-1x1-0-NCHW-FP16-B=ConvOclDirectFwd:16,16,32,32,2,2,8,1,1
1024-14-14-1x1-512-28-28-128-0x0-2x2-1x1-0-NCHW-FP16-B=ConvAsm1x1U:1,16,2,16,2,2,1,4;ConvOclDirectFwd1x1:1,256,1,1,0,2,32,8,0
64-27-27-1x1-384-27-27-16-0x0-1x1-1x1-0-NCHW-FP16-F=ConvAsm1x1U:3,8,6,32,1,4,1,4;ConvOclDirectFwd1x1:1,64,1,1,0,1,8,4,0
24-14-14-5x5-64-14-14-16-2x2-1x1-1x1-0-NCHW-FP16-F=ConvOclDirectFwdFused:8,16,16,16,2,1,4,4,2;ConvOclDirectFwd:8,16,16,16,2,1,4,1,2
48-27-27-3x3-192-27-27-256-1x1-1x1-1x1-0-NCHW-FP32-W=ConvAsmBwdWrW3x3:0,0,8,4,2,4
64-13-13-3x3-256-13-13-64-1x1-1x1-1x1-0-NCHW-FP16-B=ConvOclDirectFwd:8,8,16,16,2,2,8,2,2
32-14-14-5x5-64-14-14-1-2x2-1x1-1x1-0-NCHW-FP32-F=ConvOclDirectFwdFused:16,16,16,16,1,1,1,4,1;ConvOclDirectFwd:16,16,16,16,1,1,1,4,1
224-64-128-3x3-112-64-128-1-1x1-1x1-1x1-0-NCHW-FP16-B=ConvOclDirectFwd:16,8,16,16,1,2,8,1,1
128-14-14-3x3-96-14-14-32-1x1-1x1-1x1-0-NCHW-FP32-W=ConvAsmBwdWrW3x3:0,0,8,4,5,2
128-28-28-1x1-512-28-28-512-0x0-1x1-1x1-0-NCHW-FP32-W=ConvAsmBwdWrW1x1:2,8,4,8,2,2,2,4,0,2
32-27-27-3x3-128-27-27-16-1x1-1x1-1x1-0-NCHW-FP32-W=ConvAsmBwdWrW3x3:0,0,8,4,2,4
512-7-7-1x1-2048-7-7-64-0x0-1x1-1x1-0-NCHW-FP32-W=ConvAsmBwdWrW1x1:1,16,4,8,4,1,1,4,0,2
128-28-28-1x1-288-28-28-16-0x0-1x1-1x1-0-NCHW-FP16-W=ConvAsmBwdWrW1x1:4,4,8,4,2,1,2,4,0,0
512-7-7-1x1-1024-14-14-2-0x0-2x2-1x1-0-NCHW-FP32-B=ConvAsm1x1U:1,8,1,64,1,4,2,1;ConvOclDirectFwd1x1:1,128,1,1,0,1,4,8,0
352-14-14-1x1-128-14-14-32-0x0-1x1-1x1-0-NCHW-FP32-W=ConvAsmBwdWrW1x1:2,8,2,8,2,1,2,4,0,0
192-27-27-3x3-48-27-27-32-1x1-1x1-1x1-0-NCHW-FP16-W=ConvAsmBwdWrW3x3:0,0,8,2,1,2
64-73-73-1x1-80-73-73-8-0x0-1x1-1x1-0-NCHW-FP16-F=ConvAsm1x1U:1,8,2,64,1,4,2,2;ConvOclDirectFwd1x1:1,128,1,1,0,1,8,4,0
256-14-14-1x1-528-14-14-4-0x0-1x1-1x1-0-NCHW-FP32-W=ConvAsmBwdWrW1x1:1,16,2,8,4,1,2,4,0,0
128-7-7-1x1-992-7-7-256-0x0-1x1-1x1-0-NCHW-FP16-B=ConvAsm1x1U:2,16,4,16,1,2,1,4;ConvOclDirectFwd1x1:1,256,1,1,0,1,8,4,0
384-27-27-1x1-64-27-27-256-0x0-1x1-1x1-0-NCHW-FP32-B=ConvAsm1x1U:1,32,1,64,2,1,1,1;ConvOclDirectFwd1x1:1,256,1,1,0,1,32,4,0
288-28-28-1x1-128-28-28-128-0x0-1x1-1x1-0-NCHW-FP32-B=ConvAsm1x1U:1,32,1,32,2,1,1,2;ConvOclDirectFwd1x1:1,256,1,1,0,2,16,4,0
256-55-55-1x1-64-55-55-16-0x0-1x1-1x1-0-NCHW-FP32-F=ConvAsm1x1U:3,16,3,64,4,1;ConvOclDirectFwd1x1:1,64,1,1,1,4,16,2048,0
128-7-7-1x1-736-7-7-128-0x0-1x1-1x1-0-NCHW-FP32-F=ConvAsm1x1U:1,8,1,64,2,4,1,8;ConvOclDirectFwd1x1:1,64,1,1,1,4,16,2048,0
64-73-73-1x1-160-73-73-16-0x0-1x1-1x1-0-NCHW-FP16-W=ConvAsmBwdWrW1x1:4,4,4,4,4,1,4,4,0,1
64-80-350-3x3-64-80-350-1-1x1-1x1-1x1-0-NCHW-FP32-W=ConvAsmBwdWrW3x3:0,1,16,2,1,1
128-112-112-3x3-128-112-112-32-1x1-1x1-1x1-0-NCHW-FP16-B=ConvOclDirectFwd:8,16,16,32,2,2,8,1,1
384-8-8-1x1-2048-8-8-16-0x0-1x1-1x1-0-NCHW-FP32-W=ConvAsmBwdWrW1x1:2,8,4,2,8,1,1,4,0,0
128-54-54-1x1-16-54-54-128-0x0-1x1-1x1-0-NCHW-FP16-B=ConvAsm1x1U:2,16,4,64,1,2,1,1;ConvOclDirectFwd1x1:1,256,1,1,0,4,16,4,0
64-73-73-1x1-160-73-73-1-0x0-1x1-1x1-0-NCHW-FP32-B=ConvAsm1x1U:1,16,1,64,1,2,2,1;ConvOclDirectFwd1x1:1,128,1,1,0,1,8,8,0
288-14-14-1x1-128-14-14-512-0x0-1x1-1x1-0-NCHW-FP32-W=ConvAsmBwdWrW1x1:4,4,4,4,4,1,2,4,0,0
256-27-27-1x1-48-27-27-16-0x0-1x1-1x1-0-NCHW-FP32-B=ConvAsm1x1U:1,16,1,64,1,2,2,1;ConvOclDirectFwd1x1:1,128,1,1,0,1,8,8,0
288-35-35-3x3-384-17-17-128-0x0-2x2-1x1-0-NCHW-FP32-F=ConvOclDirectFwd:32,8,32,32,1,4,8,1,1
160-7-7-3x3-320-7-7-256-1x1-1x1-1x1-0-NCHW-FP16-F=ConvOclDirectFwdFused:8,8,8,8,1,1,8,4,2;ConvOclDirectFwd:8,8,8,8,1,1,8,2,2
192-7-7-1x1-1024-7-7-64-0x0-1x1-1x1-0-NCHW-FP16-B=ConvAsm1x1U:2,16,4,16,1,2,2,2;ConvOclDirectFwd1x1:1,64,1,1,0,1,8,4,0
128-7-7-1x1-832-7-7-256-0x0-1x1-1x1-0-NCHW-FP32-F=ConvAsm1x1U:1,8,1,64,2,4,1,8;ConvOclDirectFwd1x1:1,64,1,1,1,1,64,2048,0
128-28-28-1x1-256-28-28-64-0x0-1x1-1x1-0-NCHW-FP16-F=ConvAsm1x1U:2,8,4,16,1,4,1,8;ConvOclDirectFwd1x1:1,128,1,1,0,4,16,4,0
128-56-56-1x1-64-56-56-256-0x0-1x1-1x1-0-NCHW-FP32-B=ConvAsm1x1U:1,32,1,64,1,1,1,1;ConvOclDirectFwd1x1:1,64,1,1,0,1,32,4,0
128-14-14-1x1-544-14-14-32-0x0-1x1-1x1-0-NCHW-FP32-F=ConvAsm1x1U:4,8,4,64,1,2,2,2;ConvOclDirectFwd1x1:1,64,1,1,1,1,16,2048,0
32-7-7-5x5-128-7-7-128-2x2-1x1-1x1-0-NCHW-FP16-F=ConvOclDirectFwdFused:8,8,8,8,1,1,8,2,2;ConvOclDirectFwd:8,8,8,8,1,1,8,2,2
192-56-56-1x1-240-56-56-16-0x0-1x1-1x1-0-NCHW-FP16-W=ConvAsmBwdWrW1x1:4,4,8,1,8,2,1,4,0,1
512-64-128-1x1-64-64-128-1-0x0-1x1-1x1-0-NCHW-FP32-F=ConvOclDirectFwd1x1:1,64,1,1,1,1,16,256,0
256-14-14-1x1-1024-14-14-128-0x0-1x1-1x1-0-NCHW-FP32-B=ConvAsm1x1U:1,32,1,16,2,1,1,4;ConvOclDirectFwd1x1:1,256,1,1,0,2,16,4,0
486-5-5-3x3-256-5-5-64-1x1-1x1-1x1-0-NCHW-FP32-W=ConvAsmBwdWrW3x3:0,0,8,2,5,2
4-2-2-3x3-3-6-6-256-0x0-2x2-1x1-0-NCHW-FP32-B=ConvOclDirectFwd:8,8,8,8,1,1,1,1,2
160-14-14-3x3-128-14-14-32-1x1-1x1-1x1-0-NCHW-FP32-W=ConvAsmBwdWrW3x3:0,0,8,2,3,1
96-14-14-1x1-480-14-14-64-0x0-1x1-1x1-0-NCHW-FP32-W=ConvAsmBwdWrW1x1:1,16,2,8,4,1,4,4,0,1
384-27-27-1x1-48-27-27-16-0x0-1x1-1x1-0-NCHW-FP16-W=ConvAsmBwdWrW1x1:4,4,4,4,2,1,2,4,0,0
192-7-7-1x1-1392-7-7-16-0x0-1x1-1x1-0-NCHW-FP32-B=ConvAsm1x1U:1,16,1,32,2,2,2,2;ConvOclDirectFwd1x1:1,256,1,1,0,1,8,4,0
256-17-17-3x3-224-35-35-32-0x0-2x2-1x1-0-NCHW-FP16-B=ConvOclDirectFwd:16,8,16,16,1,2,4,1,1
128-28-28-1x1-320-28-28-64-0x0-1x1-1x1-0-NCHW-FP32-W=ConvAsmBwdWrW1x1:1,16,2,8,4,1,4,4,0,2
1280-8-8-1x1-320-8-8-4-0x0-1x1-1x1-0-NCHW-FP32-F=ConvAsm1x1U:2,8,2,32,1,4,4,2;ConvActivAsm1x1U:1,16,2,16,1,4;ConvOclDirectFwd1x1:1,64,1,1,1,0,16,256,0
528-64-128-1x1-160-64-128-1-0x0-1x1-1x1-0-NCHW-FP16-F=ConvOclDirectFwd1x1:1,256,1,1,0,2,8,4,0
192-7-7-1x1-1728-7-7-16-0x0-1x1-1x1-0-NCHW-FP16-B=ConvAsm1x1U:2,8,4,16,1,4,2,2;ConvOclDirectFwd1x1:1,64,1,1,0,1,8,4,0
512-7-7-1x1-1024-14-14-512-0x0-2x2-1x1-0-NCHW-FP16-W=ConvAsmBwdWrW1x1:1,16,8,4,4,1,1,2,0,3
528-14-14-1x1-256-14-14-32-0x0-1x1-1x1-0-NCHW-FP16-F=ConvAsm1x1U:1,8,2,32,4,4,1,8;ConvOclDirectFwd1x1:1,64,1,1,0,4,8,4,0
480-14-14-1x1-96-14-14-8-0x0-1x1-1x1-0-NCHW-FP32-F=ConvAsm1x1U:2,8,2,64,1,4,2,2;ConvActivAsm1x1U:3,16,3,16,1,4;ConvOclDirectFwd1x1:1,64,1,1,1,0,16,64,0
32-35-35-1x1-192-35-35-128-0x0-1x1-1x1-0-NCHW-FP16-W=ConvAsmBwdWrW1x1:4,4,4,4,2,1,4,4,0,1
896-7-7-1x1-128-7-7-256-0x0-1x1-1x1-0-NCHW-FP32-W=ConvAsmBwdWrW1x1:4,4,8,4,2,1,1,4,0,0
192-56-56-3x3-64-56-56-8-1x1-1x1-1x1-0-NCHW-FP16-W=ConvAsmBwdWrW3x3:0,0,8,2,2,1
256-5-5-3x3-128-10-10-32-1x1-2x2-1x1-0-NCHW-FP32-B=ConvOclDirectFwd:16,16,16,16,1,1,4,1,2
1000-13-13-1x1-512-13-13-64-0x0-1x1-1x1-0-NCHW-FP16-B=ConvAsm1x1U:2,16,6,32,1,2,1,2;ConvOclDirectFwd1x1:1,256,1,1,0,1,16,4,0
528-14-14-1x1-32-14-14-32-0x0-1x1-1x1-0-NCHW-FP32-F=ConvAsm1x1U:4,8,4,64,1,2,4,1;ConvActivAsm1x1U:2,16,2,64,1,4;ConvOclDirectFwd1x1:1,64,1,1,1,1,16,128,0
64-56-56-1x1-256-56-56-512-0x0-1x1-1x1-0-NCHW-FP16-W=ConvAsmBwdWrW1x1:4,4,4,4,4,1,4,4,0,1
3-1-1-3x3-4-2-2-512-0x0-2x2-1x1-0-NCHW-FP32-B=ConvOclDirectFwd:8,8,8,8,1,1,1,2,2
576-14-14-1x1-224-14-14-32-0x0-1x1-1x1-0-NCHW-FP32-F=ConvAsm1x1U:3,16,4,64,1,2,1,1;ConvActivAsm1x1U:4,32,7,16,1,2;ConvOclDirectFwd1x1:1,64,1,1,1,4,16,2048,0
96-56-56-1x1-128-56-56-128-0x0-1x1-1x1-0-NCHW-FP32-B=ConvAsm1x1U:1,16,1,64,2,1,1,2;ConvOclDirectFwd1x1:1,64,1,1,0,2,16,4,0
256-14-14-1x1-1024-14-14-512-0x0-1x1-1x1-0-NCHW-FP16-B=ConvAsm1x1U:1,16,2,16,1,2,1,4;ConvOclDirectFwd1x1:1,128,1,1,0,4,16,4,0
288-28-28-1x1-128-28-28-128-0x0-1x1-1x1-0-NCHW-FP32-W=ConvAsmBwdWrW1x1:2,8,2,4,4,2,2,4,0,1
384-13-13-3x3-384-13-13-8-1x1-1x1-1x1-0-NCHW-FP32-W=ConvAsmBwdWrW3x3:0,1,8,4,3,1
128-28-28-3x3-128-28-28-2-1x1-1x1-1x1-0-NCHW-FP16-F=ConvOclDirectFwd:16,16,32,32,2,2,2,4,2
16-14-14-5x5-48-14-14-1-2x2-1x1-1x1-0-NCHW-FP16-F=ConvOclDirectFwdFused:16,16,16,16,1,1,1,4,1;ConvOclDirectFwd:16,16,16,16,1,1,1,4,1
192-56-56-1x1-96-56-56-16-0x0-1x1-1x1-0-NCHW-FP16-B=ConvAsm1x1U:1,16,2,32,1,2,2,2;ConvOclDirectFwd1x1:1,64,1,1,0,4,16,4,0
608-7-7-1x1-128-7-7-512-0x0-1x1-1x1-0-NCHW-FP16-B=ConvAsm1x1U:2,16,4,16,1,2,2,2;ConvOclDirectFwd1x1:1,64,1,1,0,1,16,4,0
64-28-28-1x1-256-28-28-16-0x0-1x1-1x1-0-NCHW-FP32-W=ConvAsmBwdWrW1x1:2,8,2,8,2,1,4,4,0,1
64-14-14-1x1-480-14-14-256-0x0-1x1-1x1-0-NCHW-FP16-B=ConvAsm1x1U:1,16,2,16,1,2,1,4;ConvOclDirectFwd1x1:1,256,1,1,0,2,16,4,0
2048-7-7-1x1-512-7-7-128-0x0-1x1-1x1-0-NCHW-FP16-F=ConvAsm1x1U:2,8,4,16,2,4,1,8;ConvOclDirectFwd1x1:1,128,1,1,0,1,8,4,0
16-3-3-3x3-256-3-3-64-1x1-1x1-1x1-0-NCHW-FP32-B=ConvOclDirectFwd:8,8,8,8,1,1,4,1,2
1024-17-17-1x1-192-17-17-16-0x0-1x1-1x1-0-NCHW-FP32-F=ConvAsm1x1U:2,16,2,32,4,1,2,1;ConvActivAsm1x1U:2,16,2,32,4,2;ConvOclDirectFwd1x1:1,64,1,1,1,1,16,256,0
512-28-28-3x3-256-28-28-1-1x1-1x1-1x1-0-NCHW-FP16-B=ConvOclDirectFwd:16,16,16,16,1,1,4,4,1
128-56-56-3x3-256-56-56-64-1x1-1x1-1x1-0-NCHW-FP16-F=ConvOclDirectFwdFused:16,8,16,32,1,4,8,1,1;ConvOclDirectFwd:16,8,16,32,1,4,8,1,2
192-17-17-1x1-1024-17-17-16-0x0-1x1-1x1-0-NCHW-FP16-W=ConvAsmBwdWrW1x1:2,8,8,8,2,2,1,2,0,1
384-17-17-3x3-384-35-35-4-0x0-2x2-1x1-0-NCHW-FP16-B=ConvOclDirectFwd:8,16,16,16,2,1,4,1,1
128-28-28-1x1-256-56-56-128-0x0-2x2-1x1-0-NCHW-FP32-W=ConvAsmBwdWrW1x1:2,8,2,4,8,1,4,4,0,1
256-27-27-1x1-64-27-27-256-0x0-1x1-1x1-0-NCHW-FP16-F=ConvAsm1x1U:3,8,6,64,1,4,1,4;ConvOclDirectFwd1x1:1,64,1,1,0,1,8,4,0
192-35-35-1x1-64-35-35-16-0x0-1x1-1x1-0-NCHW-FP16-F=ConvAsm1x1U:2,8,4,64,1,2,2,2;ConvOclDirectFwd1x1:1,256,1,1,0,1,16,4,0
512-14-14-1x1-128-14-14-16-0x0-1x1-1x1-0-NCHW-FP32-F=ConvAsm1x1U:2,8,4,64,1,4,2,2;ConvActivAsm1x1U:4,16,7,32,1,4;ConvOclDirectFwd1x1:1,64,1,1,1,0,64,128,0
128-56-56-1x1-64-56-56-16-0x0-1x1-1x1-0-NCHW-FP32-B=ConvAsm1x1U:1,16,1,64,1,2,1,2;ConvOclDirectFwd1x1:1,256,1,1,0,2,16,4,0
64-73-73-1x1-160-73-73-4-0x0-1x1-1x1-0-NCHW-FP32-W=ConvAsmBwdWrW1x1:4,4,2,4,4,1,4,4,0,0
80-73-73-3x3-192-71-71-32-0x0-1x1-1x1-0-NCHW-FP16-F=ConvOclDirectFwdFused:8,8,16,16,2,2,8,4,1;ConvOclDirectFwd:8,8,16,16,2,2,8,2,2
512-28-28-1x1-128-28-28-128-0x0-1x1-1x1-0-NCHW-FP16-B=ConvAsm1x1U:1,16,2,16,1,2,1,4;ConvOclDirectFwd1x1:1,64,1,1,0,4,16,4,0
832-14-14-1x1-128-14-14-256-0x0-1x1-1x1-0-NCHW-FP32-B=ConvAsm1x1U:2,32,2,16,1,1,1,4;ConvOclDirectFwd1x1:1,256,1,1,0,2,16,4,0
192-56-56-1x1-128-56-56-512-0x0-1x1-1x1-0-NCHW-FP32-B=ConvAsm1x1U:1,32,1,64,2,1,1,2;ConvOclDirectFwd1x1:1,256,1,1,0,2,16,4,0
512-28-28-1x1-256-28-28-128-0x0-1x1-1x1-0-NCHW-FP32-F=ConvAsm1x1U:4,16,5,32,2,2,1,4;ConvActivAsm1x1U:4,16,6,16,1,2;ConvOclDirectFwd1x1:1,64,1,1,1,0,16,2048,0
192-8-8-1x1-2048-8-8-4-0x0-1x1-1x1-0-NCHW-FP16-B=ConvAsm1x1U:1,8,2,16,1,4,2,4;ConvOclDirectFwd1x1:1,256,1,1,0,2,8,4,0
256-27-27-1x1-32-27-27-64-0x0-1x1-1x1-0-NCHW-FP16-F=ConvAsm1x1U:2,16,4,64,1,2,2,1;ConvOclDirectFwd1x1:1,256,1,1,0,1,8,4,0
128-14-14-1x1-736-14-14-64-0x0-1x1-1x1-0-NCHW-FP32-F=ConvAsm1x1U:1,8,1,32,2,4,2,4;ConvOclDirectFwd1x1:1,64,1,1,1,1,16,256,0
320-28-28-1x1-128-28-28-16-0x0-1x1-1x1-0-NCHW-FP32-W=ConvAsmBwdWrW1x1:2,8,2,4,4,2,2,4,0,1
128-7-7-1x1-832-7-7-16-0x0-1x1-1x1-0-NCHW-FP16-B=ConvAsm1x1U:2,8,4,16,1,4,2,1;ConvOclDirectFwd1x1:1,64,1,1,0,1,4,4,0
64-112-112-3x3-128-112-112-4-1x1-1x1-1x1-0-NCHW-FP16-F=ConvOclDirectFwdFused:8,16,16,16,2,1,8,4,2;ConvOclDirectFwd:8,16,16,16,2,1,8,4,2
256-14-14-1x1-256-14-14-8-0x0-1x1-1x1-0-NCHW-FP32-W=ConvAsmBwdWrW1x1:2,8,2,8,2,1,1,4,0,1
192-17-17-1x1-768-17-17-16-0x0-1x1-1x1-0-NCHW-FP32-W=ConvAsmBwdWrW1x1:1,16,4,4,8,1,2,4,0,1
192-35-35-1x1-384-35-35-64-0x0-1x1-1x1-0-NCHW-FP32-W=ConvAsmBwdWrW1x1:1,16,2,8,4,1,2,4,0,2
32-27-27-1x1-128-27-27-64-0x0-1x1-1x1-0-NCHW-FP32-W=ConvAsmBwdWrW1x1:4,4,2,4,2,1,4,2,0,1
128-14-14-1x1-528-14-14-256-0x0-1x1-1x1-0-NCHW-FP16-W=ConvAsmBwdWrW1x1:2,8,8,8,2,2,2,4,0,1
96-54-54-1x1-16-54-54-64-0x0-1x1-1x1-0-NCHW-FP16-B=ConvAsm1x1U:2,16,4,64,1,2,1,1;ConvOclDirectFwd1x1:1,64,1,1,0,4,8,4,0
256-20-84-3x3-256-20-84-16-1x1-1x1-1x1-0-NCHW-FP16-B=ConvOclDirectFwd:16,16,32,32,2,2,8,4,1
64-54-54-3x3-16-54-54-16-1x1-1x1-1x1-0-NCHW-FP32-W=ConvAsmBwdWrW3x3:0,0,8,2,2,8
3-224-224-3x3-64-224-224-32-1x1-1x1-1x1-0-NCHW-FP16-B=ConvOclDirectFwd:16,16,16,32,1,2,8,1,2
448-14-14-1x1-128-14-14-256-0x0-1x1-1x1-0-NCHW-FP32-W=ConvAsmBwdWrW1x1:2,8,4,8,2,1,2,4,0,2
192-7-7-1x1-1680-7-7-16-0x0-1x1-1x1-0-NCHW-FP16-W=ConvAsmBwdWrW1x1:1,16,2,8,2,1,1,4,0,0
128-14-14-1x1-864-14-14-256-0x0-1x1-1x1-0-NCHW-FP16-F=ConvAsm1x1U:2,8,4,64,1,4,1,4;ConvOclDirectFwd1x1:1,128,1,1,0,2,16,4,0
160-14-14-1x1-512-14-14-16-0x0-1x1-1x1-0-NCHW-FP16-W=ConvAsmBwdWrW1x1:4,4,4,4,2,1,1,4,0,0
64-80-350-3x3-64-80-350-1-1x1-1x1-1x1-0-NCHW-FP16-F=ConvOclDirectFwd:16,16,16,32,1,2,8,1,1
832-14-14-1x1-128-14-14-32-0x0-1x1-1x1-0-NCHW-FP32-W=ConvAsmBwdWrW1x1:2,8,4,8,2,1,2,4,0,1
608-14-14-1x1-160-14-14-32-0x0-1x1-1x1-0-NCHW-FP16-F=ConvAsm1x1U:1,8,2,16,2,4,1,4;ConvOclDirectFwd1x1:1,64,1,1,0,2,8,4,0
1280-8-8-1x1-320-8-8-256-0x0-1x1-1x1-0-NCHW-FP16-F=ConvAsm1x1U:1,8,2,32,4,4,1,8;ConvOclDirectFwd1x1:1,128,1,1,0,4,8,4,0
192-14-14-1x1-480-14-14-8-0x0-1x1-1x1-0-NCHW-FP32-W=ConvAsmBwdWrW1x1:1,16,2,8,2,1,2,4,0,1
384-27-27-1x1-64-27-27-128-0x0-1x1-1x1-0-NCHW-FP16-F=ConvAsm1x1U:3,8,6,64,1,4,1,4;ConvOclDirectFwd1x1:1,256,1,1,0,1,8,4,0
256-28-28-3x3-512-28-28-16-1x1-1x1-1x1-0-NCHW-FP32-W=ConvAsmBwdWrW3x3:0,1,8,2,3,1
832-7-7-1x1-128-7-7-512-0x0-1x1-1x1-0-NCHW-FP16-F=ConvAsm1x1U:2,8,4,16,1,4,2,4;ConvOclDirectFwd1x1:1,64,1,1,0,1,16,4,0
128-3-3-3x3-256-1-1-64-0x0-1x1-1x1-0-NCHW-FP32-F=ConvOclDirectFwd:8,8,8,8,1,1,8,2,2
384-17-17-3x3-288-35-35-32-0x0-2x2-1x1-0-NCHW-FP32-B=ConvOclDirectFwd:16,16,16,16,1,1,4,1,2
192-14-14-1x1-1584-14-14-16-0x0-1x1-1x1-0-NCHW-FP16-W=ConvAsmBwdWrW1x1:2,8,4,8,2,1,2,4,0,1
256-13-13-3x3-64-13-13-128-1x1-1x1-1x1-0-NCHW-FP16-W=ConvAsmBwdWrW3x3:0,0,8,4,10,1
256-56-56-3x3-256-56-56-512-1x1-1x1-1x1-0-NCHW-FP16-B=ConvOclDirectFwd:8,16,16,32,2,2,8,1,1
192-56-56-1x1-96-56-56-16-0x0-1x1-1x1-0-NCHW-FP32-B=ConvAsm1x1U:1,16,1,64,1,2,1,2;ConvOclDirectFwd1x1:1,128,1,1,0,4,16,4,0
384-35-35-1x1-96-35-35-4-0x0-1x1-1x1-0-NCHW-FP16-F=ConvAsm1x1U:2,8,4,64,1,2,4,1;ConvOclDirectFwd1x1:1,64,1,1,0,1,8,8,0
640-14-14-1x1-128-14-14-32-0x0-1x1-1x1-0-NCHW-FP32-B=ConvAsm1x1U:1,16,1,32,1,1,2,2;ConvOclDirectFwd1x1:1,64,1,1,0,4,16,4,0
192-14-14-1x1-864-14-14-16-0x0-1x1-1x1-0-NCHW-FP32-B=ConvAsm1x1U:1,32,1,32,1,1,1,1;ConvOclDirectFwd1x1:1,64,1,1,0,2,16,4,0
16-14-14-5x5-48-14-14-1-2x2-1x1-1x1-0-NCHW-FP32-F=ConvOclDirectFwdFused:16,16,16,16,1,1,2,4,1;ConvOclDirectFwd:16,16,16,16,1,1,1,4,1
384-17-17-3x3-288-35-35-128-0x0-2x2-1x1-0-NCHW-FP32-B=ConvOclDirectFwd:16,16,16,16,1,1,4,1,1
16-64-128-5x5-48-64-128-1-2x2-1x1-1x1-0-NCHW-FP32-F=ConvOclDirectFwdFused:8,32,16,32,2,1,4,4,1;ConvOclDirectFwd:8,32,16,32,2,1,4,4,1
192-8-8-1x1-1280-8-8-4-0x0-1x1-1x1-0-NCHW-FP32-B=ConvAsm1x1U:1,8,1,64,2,2,2,2;ConvOclDirectFwd1x1:1,64,1,1,0,1,4,8,0
128-14-14-1x1-512-14-14-64-0x0-1x1-1x1-0-NCHW-FP16-F=ConvAsm1x1U:2,8,4,64,1,4,1,8;ConvOclDirectFwd1x1:1,128,1,1,0,2,8,4,0
128-28-28-1x1-256-56-56-512-0x0-2x2-1x1-0-NCHW-FP16-W=ConvAsmBwdWrW1x1:8,2,8,2,8,1,2,4,1
3-230-230-7x7-64-112-112-8-0x0-2x2-1x1-0-NCHW-FP32-F=ConvOclDirectFwdFused:16,8,16,16,1,2,8,1,2;ConvOclDirectFwd:16,16,16,16,1,1,8,1,2
48-35-35-1x1-288-35-35-128-0x0-1x1-1x1-0-NCHW-FP32-B=ConvAsm1x1U:1,32,1,64,2,1,1,1;ConvOclDirectFwd1x1:1,128,1,1,0,1,32,4,0
192-14-14-1x1-1584-14-14-16-0x0-1x1-1x1-0-NCHW-FP32-W=ConvAsmBwdWrW1x1:1,16,4,8,4,1,1,2,0,2
96-28-28-3x3-128-28-28-16-1x1-1x1-1x1-0-NCHW-FP16-F=ConvOclDirectFwdFused:16,16,32,32,2,2,8,2,1;ConvOclDirectFwd:16,16,32,32,2,2,8,2,1
16-54-54-3x3-64-54-54-128-1x1-1x1-1x1-0-NCHW-FP32-B=ConvAsm3x3U:7,8,3;ConvOclDirectFwd:8,32,16,32,2,1,8,2,2
128-28-28-1x1-480-28-28-512-0x0-1x1-1x1-0-NCHW-FP32-B=ConvAsm1x1U:1,32,1,32,2,1,1,1;ConvOclDirectFwd1x1:1,64,1,1,0,1,32,4,0
144-14-14-1x1-512-14-14-4-0x0-1x1-1x1-0-NCHW-FP16-B=ConvAsm1x1U:1,8,2,32,1,4,2,4;ConvOclDirectFwd1x1:1,64,1,1,0,4,4,4,0
16-14-14-1x1-480-14-14-128-0x0-1x1-1x1-0-NCHW-FP16-W=ConvAsmBwdWrW1x1:4,4,4,4,2,1,4,2,0,2
64-55-55-3x3-64-55-55-2-1x1-1x1-1x1-0-NCHW-FP32-W=ConvAsmBwdWrW3x3:5,0,16,4,2,2
1056-7-7-1x1-160-7-7-32-0x0-1x1-1x1-0-NCHW-FP32-F=ConvAsm1x1U:2,8,2,32,1,4,2,2;ConvActivAsm1x1U:2,16,2,32,3,4;ConvOclDirectFwd1x1:1,64,1,1,1,0,16,256,0
960-14-14-1x1-128-14-14-512-0x0-1x1-1x1-0-NCHW-FP16-B=ConvAsm1x1U:1,16,2,16,1,2,1,4;ConvOclDirectFwd1x1:1,256,1,1,0,2,16,4,0
96-56-56-1x1-128-56-56-256-0x0-1x1-1x1-0-NCHW-FP32-B=ConvAsm1x1U:1,32,1,32,1,1,1,1;ConvOclDirectFwd1x1:1,128,1,1,0,2,32,4,0
64-224-224-3x3-64-224-224-128-1x1-1x1-1x1-0-NCHW-FP16-F=ConvOclDirectFwdFused:32,8,32,32,1,4,8,4,1;ConvOclDirectFwd:16,16,32,32,2,2,8,2,1
64-112-112-7x7-3-230-230-1-0x0-2x2-1x1-0-NCHW-FP16-B=ConvOclDirectFwd:16,32,32,32,2,1,1,4,1
192-14-14-1x1-1152-14-14-16-0x0-1x1-1x1-0-NCHW-FP16-B=ConvAsm1x1U:1,16,2,16,1,2,2,2;ConvOclDirectFwd1x1:1,64,1,1,0,4,16,4,0
512-28-28-3x3-256-28-28-2-1x1-1x1-1x1-0-NCHW-FP16-B=ConvOclDirectFwd:16,16,32,32,2,2,2,4,2
352-28-28-1x1-128-28-28-32-0x0-1x1-1x1-0-NCHW-FP16-F=ConvAsm1x1U:2,8,4,16,1,4,1,4;ConvOclDirectFwd1x1:1,64,1,1,0,2,8,4,0
2048-7-7-1x1-1024-14-14-32-0x0-2x2-1x1-0-NCHW-FP16-B=ConvAsm1x1U:2,16,4,16,1,2,4,1;ConvOclDirectFwd1x1:1,64,1,1,0,1,16,4,0
160-14-14-1x1-576-14-14-32-0x0-1x1-1x1-0-NCHW-FP16-B=ConvAsm1x1U:1,16,2,16,1,2,2,2;ConvOclDirectFwd1x1:1,64,1,1,0,4,8,4,0
1024-14-14-1x1-512-7-7-8-0x0-2x2-1x1-0-NCHW-FP16-F=ConvAsm1x1U:2,8,4,16,1,4,4,1;ConvOclDirectFwd1x1:1,256,1,1,0,1,8,4,0
128-27-27-1x1-32-27-27-256-0x0-1x1-1x1-0-NCHW-FP32-W=ConvAsmBwdWrW1x1:4,4,2,4,2,1,4,2,0,1
128-27-27-3x3-32-27-27-64-1x1-1x1-1x1-0-NCHW-FP16-B=ConvOclDirectFwd:16,16,32,32,2,2,8,2,1
832-7-7-1x1-384-7-7-8-0x0-1x1-1x1-0-NCHW-FP32-F=ConvAsm1x1U:2,8,2,32,1,4,2,2;ConvActivAsm1x1U:1,16,2,32,2,3;ConvOclDirectFwd1x1:1,64,1,1,1,4,16,128,0
256-52-52-3x3-128-105-105-64-0x0-2x2-1x1-0-NCHW-FP32-B=ConvOclDirectFwd:16,32,16,32,1,1,8,1,2
256-38-38-3x3-512-19-19-32-1x1-2x2-1x1-0-NCHW-FP32-F=ConvOclDirectFwd:32,8,32,32,1,4,8,1,1
832-7-7-1x1-48-7-7-32-0x0-1x1-1x1-0-NCHW-FP16-F=ConvAsm1x1U:1,8,2,16,1,4,4,1;ConvOclDirectFwd1x1:1,64,1,1,0,1,4,8,0
1024-14-14-1x1-256-14-14-32-0x0-1x1-1x1-0-NCHW-FP32-W=ConvAsmBwdWrW1x1:2,8,4,8,4,2,1,4,0,1
64-27-27-1x1-256-27-27-16-0x0-1x1-1x1-0-NCHW-FP16-W=ConvAsmBwdWrW1x1:4,4,4,4,2,1,4,4,0,0
256-56-56-1x1-128-56-56-256-0x0-1x1-1x1-0-NCHW-FP16-F=ConvAsm1x1U:1,8,2,32,2,4,1,4;ConvOclDirectFwd1x1:1,128,1,1,0,4,16,4,0
1024-14-14-1x1-512-28-28-8-0x0-2x2-1x1-0-NCHW-FP32-W=ConvAsmBwdWrW1x1:1,16,2,4,8,1,1,4,0,0
32-56-56-3x3-128-56-56-64-1x1-1x1-1x1-0-NCHW-FP16-W=ConvAsmBwdWrW3x3:0,1,8,4,1,8
64-35-35-3x3-96-35-35-1-1x1-1x1-1x1-0-NCHW-FP16-F=ConvOclDirectFwdFused:16,16,16,16,1,1,4,2,1;ConvOclDirectFwd:16,16,16,16,1,1,4,4,1
576-14-14-1x1-128-14-14-16-0x0-1x1-1x1-0-NCHW-FP32-W=ConvAsmBwdWrW1x1:1,16,2,4,2,1,2,4,0,0
832-7-7-1x1-384-7-7-32-0x0-1x1-1x1-0-NCHW-FP16-F=ConvAsm1x1U:2,8,4,16,1,4,2,2;ConvOclDirectFwd1x1:1,128,1,1,0,1,8,4,0
624-28-28-1x1-192-28-28-16-0x0-1x1-1x1-0-NCHW-FP16-F=ConvAsm1x1U:1,8,2,32,2,4,1,4;ConvOclDirectFwd1x1:1,64,1,1,0,2,8,4,0
256-14-14-1x1-1024-14-14-64-0x0-1x1-1x1-0-NCHW-FP32-F=ConvAsm1x1U:4,8,4,64,1,4,1,8;ConvActivAsm1x1U:2,16,2,64,3,4;ConvOclDirectFwd1x1:1,64,1,1,1,1,16,2048,0
384-35-35-1x1-64-35-35-128-0x0-1x1-1x1-0-NCHW-FP32-F=ConvAsm1x1U:4,16,5,64,1,2,1,1;ConvActivAsm1x1U:1,32,7,16,1,2;ConvOclDirectFwd1x1:1,64,1,1,1,4,16,2048,0
448-8-8-1x1-1280-8-8-4-0x0-1x1-1x1-0-NCHW-FP16-B=ConvAsm1x1U:1,8,2,16,1,4,4,1;ConvOclDirectFwd1x1:1,64,1,1,0,2,4,4,0
256-28-28-1x1-128-28-28-32-0x0-1x1-1x1-0-NCHW-FP32-F=ConvAsm1x1U:3,16,5,32,1,2,2,2;ConvActivAsm1x1U:2,16,2,16,2,2;ConvOclDirectFwd1x1:1,64,1,1,1,0,16,2048,0
256-28-28-1x1-32-28-28-256-0x0-1x1-1x1-0-NCHW-FP32-W=ConvAsmBwdWrW1x1:4,4,4,2,8,2,4,4,0,1
128-14-14-1x1-640-14-14-32-0x0-1x1-1x1-0-NCHW-FP16-W=ConvAsmBwdWrW1x1:2,8,2,8,2,1,4,4,0,1
256-56-56-1x1-64-56-56-8-0x0-1x1-1x1-0-NCHW-FP32-B=ConvAsm1x1U:1,16,1,64,1,2,2,2;ConvOclDirectFwd1x1:1,64,1,1,0,4,16,4,0
864-7-7-1x1-128-7-7-16-0x0-1x1-1x1-0-NCHW-FP16-B=ConvAsm1x1U:1,8,2,16,1,4,4,1;ConvOclDirectFwd1x1:1,128,1,1,0,1,4,8,0
256-8-8-1x1-1536-8-8-128-0x0-1x1-1x1-0-NCHW-FP16-B=ConvAsm1x1U:1,16,2,32,1,2,1,8;ConvOclDirectFwd1x1:1,64,1,1,0,4,16,4,0
512-4-4-3x3-512-7-7-32-1x1-2x2-1x1-0-NCHW-FP32-W=ConvAsmBwdWrW3x3:0,0,8,4,7,1
384-8-8-3x3-448-8-8-128-1x1-1x1-1x1-0-NCHW-FP16-W=ConvAsmBwdWrW3x3:0,0,8,4,4,1
128-56-56-3x3-32-56-56-64-1x1-1x1-1x1-0-NCHW-FP32-W=ConvAsmBwdWrW3x3:0,0,8,4,2,4
256-8-8-1x1-1536-8-8-64-0x0-1x1-1x1-0-NCHW-FP16-W=ConvAsmBwdWrW1x1:2,8,4,8,2,2,1,4,0,1
528-14-14-1x1-256-14-14-4-0x0-1x1-1x1-0-NCHW-FP16-F=ConvAsm1x1U:1,8,2,64,1,4,4,1;ConvOclDirectFwd1x1:1,64,1,1,0,4,4,4,0
3-10-10-3x3-5-10-10-64-1x1-1x1-1x1-0-NCHW-FP16-F=ConvOclDirectFwd:16,16,16,16,1,1,1,2,2
256-13-13-3x3-384-13-13-32-1x1-1x1-1x1-0-NCHW-FP16-F=ConvOclDirectFwd:8,8,16,16,2,2,8,1,2
192-7-7-1x1-1024-7-7-32-0x0-1x1-1x1-0-NCHW-FP16-B=ConvAsm1x1U:2,8,4,16,1,4,1,8;ConvOclDirectFwd1x1:1,128,1,1,0,1,8,4,0
48-27-27-1x1-256-27-27-16-0x0-1x1-1x1-0-NCHW-FP32-B=ConvAsm1x1U:1,32,1,64,1,1,1,1;ConvOclDirectFwd1x1:1,256,1,1,0,1,16,4,0
128-112-112-3x3-64-112-112-4-1x1-1x1-1x1-0-NCHW-FP32-W=ConvAsmBwdWrW3x3:0,0,16,4,2,4
192-28-28-3x3-128-28-28-1-1x1-1x1-1x1-0-NCHW-FP32-W=ConvAsmBwdWrW3x3:0,0,8,4,2,1
2048-7-7-1x1-512-7-7-16-0x0-1x1-1x1-0-NCHW-FP16-F=ConvAsm1x1U:2,8,4,16,2,4,4,1;ConvOclDirectFwd1x1:1,128,1,1,0,1,8,4,0
256-28-28-3x3-512-28-28-512-1x1-1x1-1x1-0-NCHW-FP16-B=ConvOclDirectFwd:16,16,32,32,2,2,8,1,1
256-7-7-1x1-832-7-7-16-0x0-1x1-1x1-0-NCHW-FP32-B=ConvAsm1x1U:1,16,1,64,2,2,4,1;ConvOclDirectFwd1x1:1,64,1,1,0,1,16,4,0
48-7-7-1x1-832-7-7-1-0x0-1x1-1x1-0-NCHW-FP16-B=ConvAsm1x1U:1,8,2,16,1,4,2,1;ConvOclDirectFwd1x1:1,64,1,1,0,1,4,8,0
128-28-28-1x1-512-14-14-16-0x0-2x2-1x1-0-NCHW-FP32-F=ConvAsm1x1U:2,8,2,64,2,2,1,4;ConvOclDirectFwd1x1:1,64,1,1,1,0,32,2048,0
256-28-28-1x1-512-28-28-128-0x0-1x1-1x1-0-NCHW-FP32-W=ConvAsmBwdWrW1x1:2,8,4,4,8,1,2,4,0,1
192-14-14-1x1-1824-14-14-16-0x0-1x1-1x1-0-NCHW-FP32-B=ConvAsm1x1U:1,32,1,16,2,1,1,1;ConvOclDirectFwd1x1:1,256,1,1,0,4,16,8,0
256-14-14-3x3-256-28-28-64-1x1-2x2-1x1-0-NCHW-FP32-W=ConvAsmBwdWrW3x3:0,0,8,8,7,1
256-56-56-1x1-64-56-56-16-0x0-1x1-1x1-0-NCHW-FP16-W=ConvAsmBwdWrW1x1:4,4,4,4,4,1,4,2,0,1
192-28-28-1x1-32-28-28-8-0x0-1x1-1x1-0-NCHW-FP16-F=ConvAsm1x1U:1,8,2,32,1,4,4,1;ConvOclDirectFwd1x1:1,128,1,1,0,2,4,4,0
128-28-28-1x1-128-28-28-32-0x0-1x1-1x1-0-NCHW-FP32-F=ConvAsm1x1U:1,16,1,32,2,2,2,2;ConvOclDirectFwd1x1:1,64,1,1,1,0,16,256,0
64-14-14-5x5-24-14-14-4-2x2-1x1-1x1-0-NCHW-FP32-B=ConvOclDirectFwd:16,16,16,16,1,1,1,4,2
384-8-8-1x1-1280-8-8-32-0x0-1x1-1x1-0-NCHW-FP32-B=ConvAsm1x1U:1,16,1,32,2,2,1,4;ConvOclDirectFwd1x1:1,64,1,1,0,4,8,4,0
1056-14-14-1x1-192-14-14-16-0x0-1x1-1x1-0-NCHW-FP32-F=ConvAsm1x1U:4,16,4,64,1,2,4,1;ConvActivAsm1x1U:1,16,3,16,4,4;ConvOclDirectFwd1x1:1,64,1,1,1,0,16,256,0
384-13-13-3x3-256-13-13-128-1x1-1x1-1x1-0-NCHW-FP16-B=ConvOclDirectFwd:8,8,16,16,2,2,8,2,1
64-54-54-3x3-64-54-54-8-1x1-1x1-1x1-0-NCHW-FP32-W=ConvAsmBwdWrW3x3:0,0,8,4,2,4
1024-14-14-1x1-512-28-28-16-0x0-2x2-1x1-0-NCHW-FP32-B=ConvAsm1x1U:4,16,4,64,1,2,4,1;ConvOclDirectFwd1x1:1,256,1,1,0,1,32,4,0
128-7-7-1x1-608-7-7-512-0x0-1x1-1x1-0-NCHW-FP16-F=ConvAsm1x1U:2,8,4,16,1,4,1,4;ConvOclDirectFwd1x1:1,256,1,1,0,1,8,4,0
64-35-35-1x1-192-35-35-32-0x0-1x1-1x1-0-NCHW-FP32-B=ConvAsm1x1U:1,16,1,64,2,2,1,4;ConvOclDirectFwd1x1:1,64,1,1,0,1,32,4,0
256-14-14-1x1-1024-14-14-8-0x0-1x1-1x1-0-NCHW-FP32-W=ConvAsmBwdWrW1x1:1,16,4,4,4,1,1,4,0,1
384-27-27-1x1-48-27-27-32-0x0-1x1-1x1-0-NCHW-FP32-F=ConvAsm1x1U:3,16,5,32,1,2,2,1;ConvOclDirectFwd1x1:1,64,1,1,1,1,32,2048,0
1536-7-7-1x1-192-7-7-16-0x0-1x1-1x1-0-NCHW-FP16-F=ConvAsm1x1U:1,8,2,32,1,4,4,1;ConvOclDirectFwd1x1:1,64,1,1,0,1,4,8,0
256-28-28-1x1-32-28-28-128-0x0-1x1-1x1-0-NCHW-FP32-W=ConvAsmBwdWrW1x1:4,4,4,2,8,2,4,4,0,1
128-28-28-1x1-512-28-28-8-0x0-1x1-1x1-0-NCHW-FP32-W=ConvAsmBwdWrW1x1:1,16,2,4,8,1,4,4,0,1
832-7-7-1x1-128-7-7-64-0x0-1x1-1x1-0-NCHW-FP32-F=ConvAsm1x1U:1,8,1,64,2,4,2,4;ConvActivAsm1x1U:2,16,2,32,2,4;ConvOclDirectFwd1x1:1,64,1,1,1,4,16,128,0
32-54-54-1x1-128-54-54-32-0x0-1x1-1x1-0-NCHW-FP32-B=ConvAsm1x1U:1,32,1,64,1,1,1,1;ConvOclDirectFwd1x1:1,256,1,1,0,1,32,4,0
1024-14-14-1x1-256-14-14-4-0x0-1x1-1x1-0-NCHW-FP32-F=ConvAsm1x1U:2,8,4,64,1,4,2,2;ConvActivAsm1x1U:1,16,1,64,4,3;ConvOclDirectFwd1x1:1,64,1,1,1,4,16,256,0
1104-14-14-1x1-192-14-14-16-0x0-1x1-1x1-0-NCHW-FP32-F=ConvAsm1x1U:3,16,4,64,1,2,4,1;ConvActivAsm1x1U:1,16,3,16,4,4;ConvOclDirectFwd1x1:1,64,1,1,1,4,16,256,0
288-35-35-1x1-48-35-35-1-0x0-1x1-1x1-0-NCHW-FP32-F=ConvAsm1x1U:1,8,1,64,1,4,4,2;ConvActivAsm1x1U:1,16,1,32,1,3;ConvOclDirectFwd1x1:1,64,1,1,1,4,32,64,0
256-28-28-1x1-128-28-28-64-0x0-1x1-1x1-0-NCHW-FP16-W=ConvAsmBwdWrW1x1:2,8,4,8,2,1,4,4,0,2
256-8-8-1x1-1536-8-8-16-0x0-1x1-1x1-0-NCHW-FP16-B=ConvAsm1x1U:1,16,2,32,1,2,2,4;ConvOclDirectFwd1x1:8,64,8,8,0,2,16,4,1
192-8-8-1x1-2048-8-8-8-0x0-1x1-1x1-0-NCHW-FP32-W=ConvAsmBwdWrW1x1:1,16,2,4,8,1,1,4,0,0
480-14-14-1x1-128-14-14-512-0x0-1x1-1x1-0-NCHW-FP32-B=ConvAsm1x1U:1,32,1,16,2,1,2,2;ConvOclDirectFwd1x1:1,256,1,1,0,2,16,4,0
1280-8-8-1x1-384-8-8-8-0x0-1x1-1x1-0-NCHW-FP32-F=ConvAsm1x1U:2,8,2,32,1,4,2,2;ConvActivAsm1x1U:1,16,1,64,4,4;ConvOclDirectFwd1x1:1,64,1,1,1,1,64,128,0
1024-17-17-1x1-384-17-17-16-0x0-1x1-1x1-0-NCHW-FP16-B=ConvAsm1x1U:2,8,4,16,1,2,1,4;ConvOclDirectFwd1x1:16,64,32,32,0,1,16,4,1
192-14-14-1x1-384-14-14-16-0x0-1x1-1x1-0-NCHW-FP16-W=ConvAsmBwdWrW1x1:2,8,2,8,2,1,2,4,0,0
800-7-7-1x1-128-7-7-128-0x0-1x1-1x1-0-NCHW-FP32-B=ConvAsm1x1U:1,32,1,64,1,1,4,1;ConvOclDirectFwd1x1:1,64,1,1,0,1,8,4,0
192-14-14-1x1-1728-14-14-16-0x0-1x1-1x1-0-NCHW-FP16-B=ConvAsm1x1U:1,16,2,16,1,2,2,2;ConvOclDirectFwd1x1:1,64,1,1,0,4,16,4,0
384-35-35-1x1-192-35-35-4-0x0-1x1-1x1-0-NCHW-FP32-F=ConvAsm1x1U:2,16,2,64,2,2,2,4;ConvActivAsm1x1U:2,16,2,64,4,2;ConvOclDirectFwd1x1:1,64,1,1,1,4,16,2048,0
192-7-7-1x1-832-7-7-8-0x0-1x1-1x1-0-NCHW-FP32-B=ConvAsm1x1U:1,8,1,64,1,2,2,2;ConvOclDirectFwd1x1:1,128,1,1,0,1,4,8,0
128-3-3-3x3-256-1-1-32-0x0-1x1-1x1-0-NCHW-FP32-F=ConvOclDirectFwd:8,8,8,8,1,1,8,2,2
96-14-14-1x1-480-14-14-128-0x0-1x1-1x1-0-NCHW-FP32-B=ConvAsm1x1U:1,32,1,16,2,1,2,2;ConvOclDirectFwd1x1:1,128,1,1,0,4,16,4,0
64-112-112-7x7-3-224-224-64-3x3-2x2-1x1-0-NCHW-FP32-B=ConvOclDirectFwd:16,16,32,32,2,2,8,2,1
256-7-7-1x1-832-7-7-512-0x0-1x1-1x1-0-NCHW-FP32-B=ConvAsm1x1U:1,16,1,64,3,2,2,1;ConvOclDirectFwd1x1:1,256,1,1,0,1,32,4,0
224-14-14-3x3-112-14-14-32-1x1-1x1-1x1-0-NCHW-FP16-W=ConvAsmBwdWrW3x3:0,0,8,2,8,4
384-7-7-1x1-832-7-7-256-0x0-1x1-1x1-0-NCHW-FP32-W=ConvAsmBwdWrW1x1:1,16,2,8,4,1,4,4,0,3
1024-17-17-1x1-384-17-17-256-0x0-1x1-1x1-0-NCHW-FP16-F=ConvAsm1x1U:1,16,2,32,3,2,1,4;ConvOclDirectFwd1x1:1,64,1,1,0,1,16,4,0
256-14-14-1x1-1024-14-14-2-0x0-1x1-1x1-0-NCHW-FP32-B=ConvAsm1x1U:2,8,2,64,1,4,1,1;ConvOclDirectFwd1x1:1,64,1,1,0,4,4,4,0
512-28-28-1x1-256-56-56-32-0x0-2x2-1x1-0-NCHW-FP32-B=ConvAsm1x1U:1,16,1,32,2,2,1,4;ConvOclDirectFwd1x1:1,256,1,1,0,1,32,4,0
192-35-35-3x3-192-71-71-4-0x0-2x2-1x1-0-NCHW-FP32-B=ConvOclDirectFwd:16,8,16,16,1,2,4,1,2
288-14-14-3x3-144-14-14-512-1x1-1x1-1x1-0-NCHW-FP16-W=ConvAsmBwdWrW3x3:0,1,8,2,8,4
128-28-28-1x1-128-28-28-256-0x0-1x1-1x1-0-NCHW-FP32-F=ConvAsm1x1U:1,16,1,32,4,2,1,2;ConvOclDirectFwd1x1:1,64,1,1,1,0,32,256,0
64-73-73-1x1-160-73-73-256-0x0-1x1-1x1-0-NCHW-FP16-B=ConvAsm1x1U:2,16,4,64,1,2,1,2;ConvOclDirectFwd1x1:16,64,32,32,0,1,16,4,1
2048-7-7-1x1-512-7-7-128-0x0-1x1-1x1-0-NCHW-FP32-B=ConvAsm1x1U:1,16,1,64,2,2,2,2;ConvOclDirectFwd1x1:1,256,1,1,0,1,32,4,0
24-14-14-1x1-512-14-14-8-0x0-1x1-1x1-0-NCHW-FP32-B=ConvAsm1x1U:1,8,1,64,1,2,1,1;ConvOclDirectFwd1x1:1,64,1,1,0,4,8,4,0
256-55-55-1x1-512-28-28-8-0x0-2x2-1x1-0-NCHW-FP32-F=ConvAsm1x1U:3,16,3,32,2,4;ConvOclDirectFwd1x1:1,64,1,1,1,1,16,2048,0
512-14-14-1x1-144-14-14-64-0x0-1x1-1x1-0-NCHW-FP32-F=ConvAsm1x1U:1,16,1,32,4,2,1,1;ConvActivAsm1x1U:1,16,1,32,4,1;ConvOclDirectFwd1x1:1,64,1,1,1,4,64,2048,0
48-27-27-1x1-256-27-27-64-0x0-1x1-1x1-0-NCHW-FP16-F=ConvAsm1x1U:3,8,6,64,1,4,1,4;ConvOclDirectFwd1x1:1,64,1,1,0,1,8,4,0
64-55-55-1x1-256-55-55-16-0x0-1x1-1x1-0-NCHW-FP32-W=ConvAsmBwdWrW1x1:4,4,4,2,8,1,4,4
32-27-27-3x3-128-27-27-128-1x1-1x1-1x1-0-NCHW-FP16-B=ConvOclDirectFwd:32,8,32,32,1,4,8,2,1
64-27-27-1x1-256-27-27-256-0x0-1x1-1x1-0-NCHW-FP16-B=ConvAsm1x1U:1,16,2,16,1,2,1,4;ConvOclDirectFwd1x1:1,64,1,1,0,1,16,4,0
160-7-7-1x1-832-7-7-1-0x0-1x1-1x1-0-NCHW-FP16-B=ConvAsm1x1U:1,8,2,32,1,4,4,1;ConvOclDirectFwd1x1:1,128,1,1,0,1,4,4,0
768-17-17-1x1-192-17-17-64-0x0-1x1-1x1-0-NCHW-FP16-F=ConvAsm1x1U:3,16,6,32,1,2,2,4;ConvOclDirectFwd1x1:1,64,1,1,0,1,8,4,0
128-112-112-3x3-128-112-112-4-1x1-1x1-1x1-0-NCHW-FP32-W=ConvAsmBwdWrW3x3:0,0,16,4,2,1
256-13-13-3x3-256-13-13-50-1x1-1x1-1x1-0-NCHW-FP16-F=ConvOclDirectFwd:8,16,16,16,2,1,8,1,2
1024-14-14-1x1-512-14-14-256-0x0-1x1-1x1-0-NCHW-FP16-W=ConvAsmBwdWrW1x1:2,8,8,8,2,1,2,4,0,1
192-14-14-1x1-480-14-14-128-0x0-1x1-1x1-0-NCHW-FP32-B=ConvAsm1x1U:1,32,1,16,3,1,1,4;ConvOclDirectFwd1x1:1,128,1,1,0,4,16,4,0
672-14-14-1x1-128-14-14-64-0x0-1x1-1x1-0-NCHW-FP16-F=ConvAsm1x1U:2,8,4,64,1,4,1,8;ConvOclDirectFwd1x1:1,64,1,1,0,4,8,4,0
128-14-14-3x3-128-28-28-128-1x1-2x2-1x1-0-NCHW-FP16-B=ConvOclDirectFwd:32,32,32,32,1,1,4,2,2
1280-8-8-1x1-384-8-8-8-0x0-1x1-1x1-0-NCHW-FP16-F=ConvAsm1x1U:1,8,2,16,1,4,4,1;ConvOclDirectFwd1x1:1,64,1,1,0,2,4,8,0
192-28-28-1x1-64-28-28-64-0x0-1x1-1x1-0-NCHW-FP16-F=ConvAsm1x1U:1,8,2,32,2,4,1,4;ConvOclDirectFwd1x1:1,64,1,1,0,4,16,4,0
336-56-56-1x1-192-56-56-16-0x0-1x1-1x1-0-NCHW-FP16-F=ConvAsm1x1U:1,8,2,64,2,4,1,4;ConvOclDirectFwd1x1:1,64,1,1,0,4,16,4,0
128-55-55-1x1-256-55-55-32-0x0-1x1-1x1-0-NCHW-FP32-B=ConvAsm1x1U:2,32,2,64,1,2
64-35-35-1x1-288-35-35-16-0x0-1x1-1x1-0-NCHW-FP16-W=ConvAsmBwdWrW1x1:4,4,4,4,2,1,1,4,0,1
704-14-14-1x1-128-14-14-128-0x0-1x1-1x1-0-NCHW-FP32-B=ConvAsm1x1U:1,32,1,16,2,1,4,1;ConvOclDirectFwd1x1:8,64,16,16,0,2,16,4,1
48-27-27-1x1-192-27-27-64-0x0-1x1-1x1-0-NCHW-FP16-W=ConvAsmBwdWrW1x1:4,4,4,4,2,1,4,4,0,1
192-35-35-1x1-48-35-35-128-0x0-1x1-1x1-0-NCHW-FP32-F=ConvAsm1x1U:2,16,2,64,2,2,1,1;ConvActivAsm1x1U:2,16,4,64,1,1;ConvOclDirectFwd1x1:1,64,1,1,1,4,16,2048,0
48-27-27-3x3-192-27-27-16-1x1-1x1-1x1-0-NCHW-FP16-B=ConvOclDirectFwd:32,8,32,32,1,4,8,2,2
192-17-17-1x1-768-17-17-256-0x0-1x1-1x1-0-NCHW-FP16-F=ConvAsm1x1U:2,16,4,16,1,2,1,4;ConvOclDirectFwd1x1:16,64,32,32,0,1,16,4,1
512-14-14-1x1-1024-14-14-32-0x0-1x1-1x1-0-NCHW-FP32-B=ConvAsm1x1U:1,32,1,16,2,1,2,2;ConvOclDirectFwd1x1:1,64,1,1,0,2,16,4,0
352-28-28-1x1-128-28-28-64-0x0-1x1-1x1-0-NCHW-FP32-B=ConvAsm1x1U:1,32,1,16,1,1,1,1;ConvOclDirectFwd1x1:1,128,1,1,0,4,16,4,0
256-56-56-3x3-128-56-56-512-1x1-1x1-1x1-0-NCHW-FP16-B=ConvOclDirectFwd:8,16,32,32,4,2,8,1,1
192-27-27-5x5-64-27-27-512-2x2-1x1-1x1-0-NCHW-FP16-B=ConvOclDirectFwd:16,16,32,32,2,2,8,1,2
128-28-28-1x1-512-28-28-256-0x0-1x1-1x1-0-NCHW-FP32-W=ConvAsmBwdWrW1x1:1,16,2,8,4,1,4,4,0,3
192-56-56-3x3-64-56-56-256-1x1-1x1-1x1-0-NCHW-FP16-W=ConvAsmBwdWrW3x3:0,0,8,2,2,1
32-147-147-3x3-64-147-147-8-1x1-1x1-1x1-0-NCHW-FP16-F=ConvOclDirectFwdFused:16,16,32,32,2,2,8,4,2;ConvOclDirectFwd:16,16,32,32,2,2,8,2,1
448-8-8-1x1-1280-8-8-16-0x0-1x1-1x1-0-NCHW-FP32-B=ConvAsm1x1U:1,16,1,32,2,2,2,2;ConvOclDirectFwd1x1:1,64,1,1,0,2,8,4,0
32-54-54-1x1-128-54-54-16-0x0-1x1-1x1-0-NCHW-FP16-F=ConvAsm1x1U:1,8,2,64,1,4,1,4;ConvOclDirectFwd1x1:1,256,1,1,0,4,8,4,0
16-54-54-1x1-128-54-54-128-0x0-1x1-1x1-0-NCHW-FP32-B=ConvAsm1x1U:1,16,1,64,1,2,2,1;ConvOclDirectFwd1x1:1,256,1,1,0,1,32,4,0
384-27-27-1x1-48-27-27-512-0x0-1x1-1x1-0-NCHW-FP16-F=ConvAsm1x1U:3,8,6,64,1,4,1,2;ConvOclDirectFwd1x1:1,256,1,1,0,1,8,4,0
256-28-28-1x1-512-28-28-512-0x0-1x1-1x1-0-NCHW-FP16-W=ConvAsmBwdWrW1x1:2,8,8,8,2,2,2,4,0,1
192-27-27-3x3-48-27-27-128-1x1-1x1-1x1-0-NCHW-FP16-F=ConvOclDirectFwd:16,16,32,32,2,2,8,1,2
128-28-28-1x1-224-28-28-64-0x0-1x1-1x1-0-NCHW-FP32-F=ConvAsm1x1U:2,16,2,16,2,2,2,2;ConvOclDirectFwd1x1:1,64,1,1,1,0,16,2048,0
160-28-28-1x1-128-28-28-64-0x0-1x1-1x1-0-NCHW-FP32-F=ConvAsm1x1U:1,16,1,16,2,2,1,4;ConvOclDirectFwd1x1:1,64,1,1,1,0,16,2048,0
128-14-14-1x1-736-14-14-32-0x0-1x1-1x1-0-NCHW-FP32-F=ConvAsm1x1U:1,16,1,32,4,2,1,4;ConvOclDirectFwd1x1:1,64,1,1,1,1,16,256,0
192-56-56-1x1-128-56-56-32-0x0-1x1-1x1-0-NCHW-FP32-W=ConvAsmBwdWrW1x1:2,8,2,8,2,1,4,4,0,1
112-14-14-1x1-512-14-14-32-0x0-1x1-1x1-0-NCHW-FP32-W=ConvAsmBwdWrW1x1:2,8,2,4,4,1,1,4,0,1
528-14-14-1x1-128-14-14-4-0x0-1x1-1x1-0-NCHW-FP32-F=ConvAsm1x1U:2,8,4,64,1,4,4,1;ConvActivAsm1x1U:2,16,2,16,1,4;ConvOclDirectFwd1x1:1,64,1,1,1,4,16,64,0
384-17-17-3x3-384-35-35-256-0x0-2x2-1x1-0-NCHW-FP32-B=ConvOclDirectFwd:16,16,16,16,1,1,4,1,1
480-14-14-1x1-96-14-14-32-0x0-1x1-1x1-0-NCHW-FP32-F=ConvAsm1x1U:3,16,3,16,1,2,2,1;ConvActivAsm1x1U:2,16,3,16,2,4;ConvOclDirectFwd1x1:1,64,1,1,1,4,16,256,0
256-14-14-3x3-256-14-14-8-1x1-1x1-1x1-0-NCHW-FP16-W=ConvAsmBwdWrW3x3:0,0,8,4,3,1
384-8-8-1x1-2048-8-8-256-0x0-1x1-1x1-0-NCHW-FP16-W=ConvAsmBwdWrW1x1:2,8,8,4,4,2,1,4,0,1
448-8-8-1x1-1280-8-8-256-0x0-1x1-1x1-0-NCHW-FP16-B=ConvAsm1x1U:1,16,2,32,1,2,1,8;ConvOclDirectFwd1x1:1,128,1,1,0,4,16,4,0
128-7-7-1x1-832-7-7-32-0x0-1x1-1x1-0-NCHW-FP32-F=ConvAsm1x1U:1,8,1,64,2,4,2,4;ConvOclDirectFwd1x1:1,64,1,1,1,0,16,2048,0
24-14-14-1x1-512-14-14-128-0x0-1x1-1x1-0-NCHW-FP32-W=ConvAsmBwdWrW1x1:4,4,4,4,4,1,4,4,0,1
1024-14-14-1x1-2048-7-7-1-0x0-2x2-1x1-0-NCHW-FP32-F=ConvAsm1x1U:1,8,1,64,1,4,4,1;ConvOclDirectFwd1x1:1,64,1,1,1,0,32,64,0
288-14-14-3x3-144-14-14-4-1x1-1x1-1x1-0-NCHW-FP32-W=ConvAsmBwdWrW3x3:0,0,8,4,2,1
48-35-35-1x1-288-35-35-128-0x0-1x1-1x1-0-NCHW-FP16-W=ConvAsmBwdWrW1x1:4,4,4,4,4,1,4,4,0,2
192-14-14-1x1-512-14-14-16-0x0-1x1-1x1-0-NCHW-FP32-B=ConvAsm1x1U:2,16,2,64,1,2,1,1;ConvOclDirectFwd1x1:1,64,1,1,0,2,16,4,0
512-14-14-1x1-1024-14-14-128-0x0-1x1-1x1-0-NCHW-FP16-F=ConvAsm1x1U:2,8,4,64,1,4,1,4;ConvOclDirectFwd1x1:1,64,1,1,0,2,8,4,0
256-56-56-1x1-64-56-56-2-0x0-1x1-1x1-0-NCHW-FP32-B=ConvAsm1x1U:1,16,1,64,1,1,4,1;ConvOclDirectFwd1x1:1,128,1,1,0,1,8,8,0
2048-8-8-1x1-192-8-8-1-0x0-1x1-1x1-0-NCHW-FP16-F=ConvAsm1x1U:1,8,2,16,1,4,4,1;ConvOclDirectFwd1x1:1,128,1,1,0,2,4,4,0
32-14-14-3x3-128-14-14-16-1x1-1x1-1x1-0-NCHW-FP16-B=ConvOclDirectFwd:16,8,16,16,1,2,4,2,2
192-35-35-3x3-192-71-71-64-0x0-2x2-1x1-0-NCHW-FP16-B=ConvOclDirectFwd:16,16,16,16,1,1,4,1,2
256-17-17-1x1-1024-17-17-16-0x0-1x1-1x1-0-NCHW-FP32-B=ConvAsm1x1U:2,32,2,32,1,1,2,2;ConvOclDirectFwd1x1:1,256,1,1,0,1,16,4,0
512-28-28-1x1-128-28-28-2-0x0-1x1-1x1-0-NCHW-FP16-W=ConvAsmBwdWrW1x1:4,4,4,1,8,1,1,4,0,0
32-7-7-3x3-128-7-7-256-1x1-1x1-1x1-0-NCHW-FP16-F=ConvOclDirectFwd:8,8,8,8,1,1,8,4,2
448-8-8-1x1-2048-8-8-32-0x0-1x1-1x1-0-NCHW-FP16-B=ConvAsm1x1U:1,16,2,16,1,2,2,2;ConvOclDirectFwd1x1:1,64,1,1,0,4,16,4,0
192-27-27-1x1-48-27-27-128-0x0-1x1-1x1-0-NCHW-FP32-B=ConvAsm1x1U:3,16,3,64,1,1,1,1;ConvOclDirectFwd1x1:1,256,1,1,0,1,16,8,0
16-28-28-1x1-192-28-28-32-0x0-1x1-1x1-0-NCHW-FP16-W=ConvAsmBwdWrW1x1:4,4,2,4,2,1,4,4,0,1
64-112-112-7x7-3-225-225-32-2x2-2x2-1x1-0-NCHW-FP16-B=ConvOclDirectFwd:16,16,32,32,2,2,8,2,1
16-14-14-1x1-480-14-14-32-0x0-1x1-1x1-0-NCHW-FP32-B=ConvAsm1x1U:1,8,1,64,2,2,1,2;ConvOclDirectFwd1x1:8,64,16,16,0,2,16,4,1
256-7-7-3x3-256-14-14-32-1x1-2x2-1x1-0-NCHW-FP32-B=ConvOclDirectFwd:16,8,16,16,1,2,4,1,1
512-14-14-1x1-144-14-14-4-0x0-1x1-1x1-0-NCHW-FP16-F=ConvAsm1x1U:1,8,2,16,1,4,4,1;ConvOclDirectFwd1x1:1,64,1,1,0,4,4,4,0
256-14-14-3x3-256-14-14-256-1x1-1x1-1x1-0-NCHW-FP16-W=ConvAsmBwdWrW3x3:0,0,8,4,4,1
528-14-14-1x1-160-14-14-4-0x0-1x1-1x1-0-NCHW-FP16-F=ConvAsm1x1U:1,8,2,64,1,4,4,1;ConvOclDirectFwd1x1:1,64,1,1,0,4,4,4,0
192-35-35-1x1-48-35-35-64-0x0-1x1-1x1-0-NCHW-FP16-F=ConvAsm1x1U:2,16,4,64,1,2,2,1;ConvOclDirectFwd1x1:16,64,32,32,0,1,16,4,1
480-14-14-1x1-16-14-14-128-0x0-1x1-1x1-0-NCHW-FP16-F=ConvAsm1x1U:2,8,4,64,1,4,4,2;ConvOclDirectFwd1x1:1,64,1,1,0,2,8,4,0
832-7-7-1x1-48-7-7-1-0x0-1x1-1x1-0-NCHW-FP16-F=ConvAsm1x1U:1,8,2,16,1,4,4,1;ConvOclDirectFwd1x1:1,256,1,1,0,1,4,8,0
32-7-7-1x1-832-7-7-32-0x0-1x1-1x1-0-NCHW-FP16-W=ConvAsmBwdWrW1x1:2,8,2,8,2,1,4,4,0,1
48-35-35-1x1-288-35-35-8-0x0-1x1-1x1-0-NCHW-FP16-W=ConvAsmBwdWrW1x1:4,4,4,4,2,1,4,4,0,1
128-7-7-3x3-32-7-7-256-1x1-1x1-1x1-0-NCHW-FP16-W=ConvAsmBwdWrW3x3:0,0,8,2,7,4
64-55-55-1x1-256-55-55-4-0x0-1x1-1x1-0-NCHW-FP32-B=ConvAsm1x1U:2,32,2,64,1,2;ConvOclDirectFwd1x1:1,64,1,1,0,1,16,4,0
128-54-54-1x1-16-54-54-128-0x0-1x1-1x1-0-NCHW-FP32-W=ConvAsmBwdWrW1x1:4,4,2,4,2,1,4,4,0,1
528-14-14-1x1-32-14-14-8-0x0-1x1-1x1-0-NCHW-FP32-F=ConvAsm1x1U:1,8,1,64,1,4,4,1;ConvActivAsm1x1U:1,16,1,16,1,4;ConvOclDirectFwd1x1:1,64,1,1,1,1,16,64,0
1024-14-14-1x1-256-14-14-16-0x0-1x1-1x1-0-NCHW-FP32-B=ConvAsm1x1U:2,16,2,64,1,1,4,2;ConvOclDirectFwd1x1:1,256,1,1,0,4,16,4,0
192-28-28-3x3-128-28-28-128-1x1-1x1-1x1-0-NCHW-FP32-W=ConvAsmBwdWrW3x3:0,0,8,4,4,2
144-14-14-1x1-512-14-14-8-0x0-1x1-1x1-0-NCHW-FP16-W=ConvAsmBwdWrW1x1:4,4,4,4,2,1,1,2,0,1
128-7-7-1x1-640-7-7-32-0x0-1x1-1x1-0-NCHW-FP16-F=ConvAsm1x1U:1,8,2,16,1,4,1,1;ConvOclDirectFwd1x1:1,128,1,1,0,1,8,8,0
224-14-14-3x3-112-14-14-8-1x1-1x1-1x1-0-NCHW-FP32-W=ConvAsmBwdWrW3x3:0,1,8,2,9,2
64-35-35-1x1-384-35-35-256-0x0-1x1-1x1-0-NCHW-FP32-F=ConvAsm1x1U:1,16,1,64,4,2,1,4;ConvOclDirectFwd1x1:1,64,1,1,1,1,32,2048,0
16-28-28-5x5-32-28-28-4-2x2-1x1-1x1-0-NCHW-FP16-F=ConvOclDirectFwdFused:8,32,32,32,4,1,1,4,2;ConvOclDirectFwd:16,16,32,32,2,2,1,2,2
512-28-28-1x1-128-28-28-256-0x0-1x1-1x1-0-NCHW-FP16-W=ConvAsmBwdWrW1x1:4,4,8,4,4,1,2,2,0,2
512-64-128-1x1-112-64-128-1-0x0-1x1-1x1-0-NCHW-FP16-F=ConvOclDirectFwd1x1:1,128,1,1,0,2,8,8,0
160-14-14-1x1-528-14-14-4-0x0-1x1-1x1-0-NCHW-FP16-W=ConvAsmBwdWrW1x1:2,8,2,8,2,1,2,4,0,1
512-7-7-1x1-1024-14-14-16-0x0-2x2-1x1-0-NCHW-FP32-B=ConvAsm1x1U:2,16,2,32,1,2,2,1;ConvOclDirectFwd1x1:1,256,1,1,0,1,16,4,0
672-14-14-1x1-128-14-14-256-0x0-1x1-1x1-0-NCHW-FP32-W=ConvAsmBwdWrW1x1:2,8,4,8,2,1,4,4,0,1
1024-14-14-1x1-256-14-14-2-0x0-1x1-1x1-0-NCHW-FP32-W=ConvAsmBwdWrW1x1:1,16,4,8,2,1,1,4,0,1
256-27-27-1x1-48-27-27-16-0x0-1x1-1x1-0-NCHW-FP16-F=ConvAsm1x1U:3,8,6,64,1,4,4,1;ConvOclDirectFwd1x1:1,64,1,1,0,1,8,8,0
16-28-28-1x1-192-28-28-16-0x0-1x1-1x1-0-NCHW-FP16-B=ConvAsm1x1U:1,8,2,32,1,4,1,2;ConvOclDirectFwd1x1:1,128,1,1,0,2,8,4,0
64-55-55-1x1-256-55-55-8-0x0-1x1-1x1-0-NCHW-FP32-W=ConvAsmBwdWrW1x1:4,4,4,4,4,1,4,4
416-14-14-1x1-128-14-14-512-0x0-1x1-1x1-0-NCHW-FP32-B=ConvAsm1x1U:1,32,1,16,2,1,1,4;ConvOclDirectFwd1x1:1,256,1,1,0,2,16,4,0
1024-4-4-1x1-2048-7-7-16-0x0-2x2-1x1-0-NCHW-FP32-W=ConvAsmBwdWrW1x1:1,16,2,4,4,1,1,4,0,0
512-4-4-3x3-512-7-7-512-1x1-2x2-1x1-0-NCHW-FP32-B=ConvOclDirectFwd:8,8,8,8,1,1,4,4,1
224-28-28-1x1-128-28-28-32-0x0-1x1-1x1-0-NCHW-FP32-W=ConvAsmBwdWrW1x1:2,8,2,8,2,1,4,4,0,0
192-56-56-3x3-48-56-56-16-1x1-1x1-1x1-0-NCHW-FP16-F=ConvOclDirectFwdFused:32,8,32,32,1,4,8,1,2;ConvOclDirectFwd:32,8,32,32,1,4,8,1,2
256-14-14-3x3-256-14-14-1-1x1-1x1-1x1-0-NCHW-FP32-W=ConvAsmBwdWrW3x3:0,1,8,4,2,1
512-14-14-1x1-24-14-14-256-0x0-1x1-1x1-0-NCHW-FP32-W=ConvAsmBwdWrW1x1:4,4,2,4,8,1,4,4,0,1
64-35-35-1x1-288-35-35-32-0x0-1x1-1x1-0-NCHW-FP16-W=ConvAsmBwdWrW1x1:4,4,4,4,4,1,2,4,0,1
128-7-7-1x1-736-7-7-32-0x0-1x1-1x1-0-NCHW-FP16-B=ConvAsm1x1U:2,16,4,16,1,2,2,1;ConvOclDirectFwd1x1:1,64,1,1,0,1,8,4,0
128-14-14-1x1-448-14-14-64-0x0-1x1-1x1-0-NCHW-FP16-W=ConvAsmBwdWrW1x1:4,4,4,4,4,1,2,4,0,0
128-56-56-3x3-256-56-56-256-1x1-1x1-1x1-0-NCHW-FP16-F=ConvOclDirectFwdFused:32,8,32,32,1,4,8,1,2;ConvOclDirectFwd:32,8,32,32,1,4,8,1,2
1-5-5-3x3-1-7-7-16-0x0-1x1-1x1-0-NCHW-FP32-B=ConvOclDirectFwd:8,8,8,8,1,1,8,2,1
48-35-35-1x1-256-35-35-64-0x0-1x1-1x1-0-NCHW-FP32-W=ConvAsmBwdWrW1x1:4,4,4,4,4,1,4,4,0,1
128-14-14-1x1-320-14-14-128-0x0-1x1-1x1-0-NCHW-FP32-F=ConvAsm1x1U:2,16,2,16,2,2,2,2;ConvOclDirectFwd1x1:1,64,1,1,1,4,16,256,0
128-14-14-1x1-864-14-14-32-0x0-1x1-1x1-0-NCHW-FP32-F=ConvAsm1x1U:4,8,4,32,1,4,1,4;ConvOclDirectFwd1x1:1,64,1,1,1,1,16,256,0
96-28-28-1x1-192-28-28-4-0x0-1x1-1x1-0-NCHW-FP16-B=ConvAsm1x1U:1,16,2,16,1,2,2,1;ConvOclDirectFwd1x1:1,64,1,1,0,2,4,4,0
64-56-56-1x1-64-56-56-16-0x0-1x1-1x1-0-NCHW-FP32-F=ConvAsm1x1U:2,16,2,64,1,2,2,2;ConvActivAsm1x1U:1,16,1,64,2,1;ConvOclDirectFwd1x1:1,64,1,1,1,4,16,256,0
64-73-73-1x1-160-73-73-16-0x0-1x1-1x1-0-NCHW-FP16-B=ConvAsm1x1U:1,16,2,64,1,2,1,2;ConvOclDirectFwd1x1:1,128,1,1,0,1,16,4,0
192-17-17-1x1-768-17-17-1-0x0-1x1-1x1-0-NCHW-FP16-B=ConvAsm1x1U:1,8,2,64,1,4,4,1;ConvOclDirectFwd1x1:1,64,1,1,0,1,4,4,0
16-54-54-1x1-96-54-54-32-0x0-1x1-1x1-0-NCHW-FP32-W=ConvAsmBwdWrW1x1:4,4,2,2,2,1,4,4,0,2
192-7-7-1x1-2112-7-7-16-0x0-1x1-1x1-0-NCHW-FP16-B=ConvAsm1x1U:1,16,2,32,1,2,2,2;ConvOclDirectFwd1x1:1,128,1,1,0,1,8,4,0
128-28-28-1x1-256-56-56-32-0x0-2x2-1x1-0-NCHW-FP32-W=ConvAsmBwdWrW1x1:1,16,2,8,2,1,4,4,0,2
288-28-28-1x1-128-28-28-256-0x0-1x1-1x1-0-NCHW-FP32-B=ConvAsm1x1U:1,32,1,32,2,1,1,1;ConvOclDirectFwd1x1:1,128,1,1,0,4,16,4,0
1280-8-8-1x1-448-8-8-32-0x0-1x1-1x1-0-NCHW-FP32-W=ConvAsmBwdWrW1x1:1,16,2,8,4,1,2,4,0,1
832-7-7-1x1-128-7-7-256-0x0-1x1-1x1-0-NCHW-FP32-F=ConvAsm1x1U:1,16,1,64,4,2,4,1;ConvActivAsm1x1U:1,16,1,64,4,1;ConvOclDirectFwd1x1:1,64,1,1,1,4,16,2048,0
64-14-14-1x1-480-14-14-256-0x0-1x1-1x1-0-NCHW-FP16-W=ConvAsmBwdWrW1x1:2,8,4,8,2,1,4,4,0,2
384-13-13-3x3-384-13-13-256-1x1-1x1-1x1-0-NCHW-FP16-F=ConvOclDirectFwdFused:8,8,16,16,2,2,8,1,1;ConvOclDirectFwd:8,8,16,16,2,2,8,1,1
2048-7-7-1x1-1024-4-4-16-0x0-2x2-1x1-0-NCHW-FP32-F=ConvAsm1x1U:1,8,1,16,2,4,2,2;ConvOclDirectFwd1x1:1,64,1,1,1,1,32,256,0
128-14-14-1x1-704-14-14-16-0x0-1x1-1x1-0-NCHW-FP32-F=ConvAsm1x1U:1,8,1,32,2,4,1,8;ConvOclDirectFwd1x1:1,64,1,1,1,1,16,256,0
608-14-14-1x1-128-14-14-128-0x0-1x1-1x1-0-NCHW-FP32-W=ConvAsmBwdWrW1x1:2,8,4,4,4,1,2,4,0,0
128-27-27-3x3-32-27-27-32-1x1-1x1-1x1-0-NCHW-FP16-W=ConvAsmBwdWrW3x3:0,0,8,2,2,4
384-27-27-1x1-48-27-27-16-0x0-1x1-1x1-0-NCHW-FP16-F=ConvAsm1x1U:3,8,6,64,1,4,4,1;ConvOclDirectFwd1x1:1,64,1,1,0,1,8,4,0
256-13-13-3x3-384-13-13-512-1x1-1x1-1x1-0-NCHW-FP16-F=ConvOclDirectFwd:8,8,16,16,2,2,8,1,2
224-28-28-1x1-128-28-28-512-0x0-1x1-1x1-0-NCHW-FP32-W=ConvAsmBwdWrW1x1:2,8,4,8,2,2,4,4,0,2
128-14-14-3x3-32-14-14-256-1x1-1x1-1x1-0-NCHW-FP32-W=ConvAsmBwdWrW3x3:0,1,8,2,9,8
256-14-14-3x3-192-14-14-32-1x1-1x1-1x1-0-NCHW-FP16-W=ConvAsmBwdWrW3x3:0,0,8,4,4,1
32-79-341-5x20-1-161-700-4-0x0-2x2-1x1-0-NCHW-FP32-B=ConvOclDirectFwd:16,16,16,32,1,2,1,1,2
896-7-7-1x1-128-7-7-64-0x0-1x1-1x1-0-NCHW-FP16-F=ConvAsm1x1U:2,8,4,16,1,4,4,1;ConvOclDirectFwd1x1:1,64,1,1,0,1,4,4,0
384-17-17-1x1-1024-17-17-64-0x0-1x1-1x1-0-NCHW-FP16-B=ConvAsm1x1U:2,16,4,16,1,2,1,4;ConvOclDirectFwd1x1:1,64,1,1,0,1,16,4,0
384-17-17-1x1-1024-17-17-1-0x0-1x1-1x1-0-NCHW-FP32-W=ConvAsmBwdWrW1x1:1,16,2,4,4,1,1,4,0,0
128-28-28-1x1-512-28-28-256-0x0-1x1-1x1-0-NCHW-FP32-B=ConvAsm1x1U:1,16,1,16,2,2,1,4;ConvOclDirectFwd1x1:1,256,1,1,0,1,16,8,0
64-27-27-1x1-384-27-27-128-0x0-1x1-1x1-0-NCHW-FP32-F=ConvAsm1x1U:1,8,1,32,3,4,1,4;ConvOclDirectFwd1x1:1,64,1,1,1,0,16,64,0
512-10-42-3x3-512-10-42-1-1x1-1x1-1x1-0-NCHW-FP16-F=ConvOclDirectFwd:16,16,16,16,1,1,4,2,1
512-14-14-1x1-128-14-14-32-0x0-1x1-1x1-0-NCHW-FP32-F=ConvAsm1x1U:4,8,7,32,1,2,2,2;ConvActivAsm1x1U:3,16,4,64,1,2;ConvOclDirectFwd1x1:1,64,1,1,1,0,16,2048,0
96-28-28-1x1-192-28-28-1-0x0-1x1-1x1-0-NCHW-FP32-W=ConvAsmBwdWrW1x1:2,8,2,2,2,1,1,4,0,1
128-4-4-1x1-576-4-4-32-0x0-1x1-1x1-0-NCHW-FP16-B=ConvAsm1x1U:1,4,2,4,1,2,2,1;ConvOclDirectFwd1x1:1,64,1,1,0,2,4,8,0
128-7-7-5x5-48-7-7-512-2x2-1x1-1x1-0-NCHW-FP32-B=ConvOclDirectFwd:8,8,8,8,1,1,4,4,1
128-7-7-1x1-576-7-7-512-0x0-1x1-1x1-0-NCHW-FP16-F=ConvAsm1x1U:2,16,4,16,1,2,1,1;ConvOclDirectFwd1x1:1,256,1,1,0,1,8,4,0
320-7-7-3x3-160-7-7-64-1x1-1x1-1x1-0-NCHW-FP16-W=ConvAsmBwdWrW3x3:0,0,8,4,6,2
64-14-14-1x1-480-14-14-32-0x0-1x1-1x1-0-NCHW-FP32-B=ConvAsm1x1U:1,16,1,32,2,2,1,4;ConvOclDirectFwd1x1:1,128,1,1,0,4,16,4,0
48-14-14-5x5-16-14-14-32-2x2-1x1-1x1-0-NCHW-FP16-B=ConvOclDirectFwd:8,16,16,16,2,1,1,4,2
192-35-35-3x3-224-35-35-8-1x1-1x1-1x1-0-NCHW-FP16-F=ConvOclDirectFwdFused:8,16,16,16,2,1,8,4,1;ConvOclDirectFwd:8,8,16,16,2,2,8,2,1
1024-17-17-1x1-256-17-17-8-0x0-1x1-1x1-0-NCHW-FP16-F=ConvAsm1x1U:2,8,6,32,1,4,2,2;ConvOclDirectFwd1x1:1,256,1,1,0,1,8,4,0
32-27-27-1x1-128-27-27-128-0x0-1x1-1x1-0-NCHW-FP16-W=ConvAsmBwdWrW1x1:4,4,2,4,2,1,4,4,0,2
32-149-149-3x3-32-147-147-32-0x0-1x1-1x1-0-NCHW-FP16-F=ConvOclDirectFwdFused:16,16,32,32,2,2,8,2,1;ConvOclDirectFwd:16,16,32,32,2,2,8,4,1
256-56-56-1x1-64-56-56-256-0x0-1x1-1x1-0-NCHW-FP32-W=ConvAsmBwdWrW1x1:2,8,2,8,2,1,4,4,0,2
128-7-7-1x1-864-7-7-16-0x0-1x1-1x1-0-NCHW-FP32-F=ConvAsm1x1U:2,8,2,32,1,4,1,8;ConvOclDirectFwd1x1:1,64,1,1,1,1,16,256,0
192-28-28-1x1-528-28-28-16-0x0-1x1-1x1-0-NCHW-FP32-B=ConvAsm1x1U:1,16,1,16,1,2,1,2;ConvOclDirectFwd1x1:1,128,1,1,0,4,16,4,0
32-7-7-3x3-128-7-7-32-1x1-1x1-1x1-0-NCHW-FP16-F=ConvOclDirectFwd:8,8,8,8,1,1,4,4,2
256-28-28-1x1-64-28-28-32-0x0-1x1-1x1-0-NCHW-FP16-F=ConvAsm1x1U:1,8,2,32,1,4,1,4;ConvOclDirectFwd1x1:1,64,1,1,0,2,8,4,0
128-55-55-1x1-256-55-55-16-0x0-1x1-1x1-0-NCHW-FP32-W=ConvAsmBwdWrW1x1:8,2,8,2,4,1,1,4
64-13-13-3x3-256-13-13-256-1x1-1x1-1x1-0-NCHW-FP16-W=ConvAsmBwdWrW3x3:0,1,8,4,10,4
128-14-14-1x1-576-14-14-16-0x0-1x1-1x1-0-NCHW-FP16-W=ConvAsmBwdWrW1x1:2,8,2,8,2,1,2,4,0,0
128-14-14-1x1-608-14-14-32-0x0-1x1-1x1-0-NCHW-FP32-F=ConvAsm1x1U:4,8,4,64,1,4,2,2;ConvOclDirectFwd1x1:1,64,1,1,1,0,16,2048,0
32-7-7-3x3-128-7-7-256-1x1-1x1-1x1-0-NCHW-FP16-W=ConvAsmBwdWrW3x3:0,0,8,2,7,4
384-27-27-1x1-64-27-27-32-0x0-1x1-1x1-0-NCHW-FP32-B=ConvAsm1x1U:3,16,3,64,1,2,2,1;ConvOclDirectFwd1x1:1,256,1,1,0,1,16,8,0
1024-17-17-1x1-192-17-17-128-0x0-1x1-1x1-0-NCHW-FP32-F=ConvAsm1x1U:4,16,5,64,1,2,2,1;ConvActivAsm1x1U:3,16,5,64,2,1;ConvOclDirectFwd1x1:1,64,1,1,1,4,16,2048,0
512-28-28-3x3-512-28-28-32-1x1-1x1-1x1-0-NCHW-FP16-F=ConvOclDirectFwdFused:16,16,32,32,2,2,8,1,1;ConvOclDirectFwd:16,16,32,32,2,2,8,1,1
32-7-7-3x3-128-7-7-16-1x1-1x1-1x1-0-NCHW-FP16-W=ConvAsmBwdWrW3x3:0,1,8,2,3,4
128-54-54-1x1-16-54-54-64-0x0-1x1-1x1-0-NCHW-FP32-W=ConvAsmBwdWrW1x1:4,4,2,4,2,1,4,4,0,3
64-56-56-3x3-64-56-56-32-1x1-1x1-1x1-0-NCHW-FP32-W=ConvAsmBwdWrW3x3:0,0,8,4,2,4
128-14-14-3x3-128-28-28-512-1x1-2x2-1x1-0-NCHW-FP32-B=ConvOclDirectFwd:32,16,32,32,1,2,8,2,2
64-147-147-3x3-32-147-147-4-1x1-1x1-1x1-0-NCHW-FP32-W=ConvAsmBwdWrW3x3:0,1,16,4,2,4
416-14-14-1x1-128-14-14-64-0x0-1x1-1x1-0-NCHW-FP32-B=ConvAsm1x1U:1,16,1,32,1,1,2,2;ConvOclDirectFwd1x1:1,64,1,1,0,4,16,4,0
384-17-17-1x1-1024-17-17-4-0x0-1x1-1x1-0-NCHW-FP32-B=ConvAsm1x1U:1,16,1,64,2,2,2,2;ConvOclDirectFwd1x1:1,64,1,1,0,1,16,4,0
64-28-28-1x1-256-28-28-8-0x0-1x1-1x1-0-NCHW-FP32-B=ConvAsm1x1U:1,16,1,16,1,2,1,1;ConvOclDirectFwd1x1:16,64,32,32,0,2,16,4,1
512-7-7-3x3-512-7-7-64-1x1-1x1-1x1-0-NCHW-FP16-B=ConvOclDirectFwd:8,8,8,8,1,1,8,4,2
16-54-54-1x1-64-54-54-32-0x0-1x1-1x1-0-NCHW-FP32-B=ConvAsm1x1U:1,16,1,64,1,2,2,1;ConvOclDirectFwd1x1:1,128,1,1,0,2,16,4,0
512-14-14-3x3-512-14-14-1-1x1-1x1-1x1-0-NCHW-FP16-F=ConvOclDirectFwdFused:16,16,16,16,1,1,2,4,1;ConvOclDirectFwd:16,16,16,16,1,1,2,4,1
480-14-14-1x1-64-14-14-32-0x0-1x1-1x1-0-NCHW-FP16-F=ConvAsm1x1U:2,8,4,64,1,4,4,2;ConvOclDirectFwd1x1:1,64,1,1,0,4,8,4,0
512-14-14-3x3-512-14-14-256-1x1-1x1-1x1-0-NCHW-FP32-W=ConvAsmBwdWrW3x3:0,1,8,4,4,1
224-35-35-3x3-256-17-17-128-0x0-2x2-1x1-0-NCHW-FP32-F=ConvOclDirectFwd:8,32,32,32,4,1,8,1,1
192-7-7-1x1-1200-7-7-16-0x0-1x1-1x1-0-NCHW-FP32-B=ConvAsm1x1U:1,16,1,64,2,2,4;ConvOclDirectFwd1x1:1,256,1,1,0,1,8,4,0
48-27-27-1x1-256-27-27-32-0x0-1x1-1x1-0-NCHW-FP16-W=ConvAsmBwdWrW1x1:4,4,4,4,2,1,4,4,0,0
16-54-54-3x3-64-54-54-128-1x1-1x1-1x1-0-NCHW-FP32-F=ConvAsm3x3U:7,8,6;ConvOclDirectFwd:16,8,16,16,1,2,8,1,2
2048-7-7-1x1-512-7-7-32-0x0-1x1-1x1-0-NCHW-FP32-B=ConvAsm1x1U:2,16,2,32,1,2,2,2;ConvOclDirectFwd1x1:1,256,1,1,0,1,8,4,0
128-14-14-1x1-928-14-14-256-0x0-1x1-1x1-0-NCHW-FP16-W=ConvAsmBwdWrW1x1:2,8,8,8,2,1,2,4,0,1
64-55-55-3x3-64-55-55-16-1x1-1x1-1x1-0-NCHW-FP32-W=ConvAsmBwdWrW3x3:2,0,8,4,2,4
64-112-112-1x1-64-112-112-1-0x0-1x1-1x1-0-NCHW-FP16-W=ConvAsmBwdWrW1x1:4,4,2,1,2,1,1,4,0,2
128-28-28-1x1-256-56-56-2-0x0-2x2-1x1-0-NCHW-FP32-B=ConvAsm1x1U:1,8,1,32,1,4,1,2;ConvOclDirectFwd1x1:1,256,1,1,0,1,8,4,0
512-64-128-1x1-128-64-128-1-0x0-1x1-1x1-0-NCHW-FP32-F=ConvOclDirectFwd1x1:1,64,1,1,1,0,16,2048,0
96-35-35-1x1-384-35-35-1-0x0-1x1-1x1-0-NCHW-FP16-W=ConvAsmBwdWrW1x1:4,4,4,4,2,1,1,2,0,1
480-14-14-1x1-16-14-14-256-0x0-1x1-1x1-0-NCHW-FP16-W=ConvAsmBwdWrW1x1:4,4,4,4,2,1,4,2,0,2
24-14-14-1x1-512-14-14-16-0x0-1x1-1x1-0-NCHW-FP32-B=ConvAsm1x1U:1,8,1,64,4,2,1,1;ConvOclDirectFwd1x1:1,64,1,1,0,4,16,4,0
512-14-14-1x1-1024-14-14-32-0x0-1x1-1x1-0-NCHW-FP16-F=ConvAsm1x1U:2,8,4,64,1,4,1,4;ConvOclDirectFwd1x1:1,128,1,1,0,4,8,4,0
64-28-28-1x1-256-28-28-32-0x0-1x1-1x1-0-NCHW-FP16-B=ConvAsm1x1U:1,16,2,16,1,2,1,4;ConvOclDirectFwd1x1:1,64,1,1,0,4,16,4,0
224-28-28-1x1-128-28-28-32-0x0-1x1-1x1-0-NCHW-FP16-W=ConvAsmBwdWrW1x1:2,8,2,8,2,1,4,4,0,1
128-56-56-1x1-256-56-56-256-0x0-1x1-1x1-0-NCHW-FP32-F=ConvAsm1x1U:2,16,2,64,2,2,1,4;ConvOclDirectFwd1x1:1,64,1,1,1,4,16,256,0
64-27-27-1x1-384-27-27-64-0x0-1x1-1x1-0-NCHW-FP32-F=ConvAsm1x1U:1,16,1,32,3,2,1,4;ConvOclDirectFwd1x1:1,64,1,1,1,0,16,128,0
736-7-7-1x1-128-7-7-64-0x0-1x1-1x1-0-NCHW-FP16-W=ConvAsmBwdWrW1x1:2,8,4,8,2,2,2,4,0,0
96-35-35-3x3-96-35-35-64-1x1-1x1-1x1-0-NCHW-FP16-W=ConvAsmBwdWrW3x3:0,0,8,2,3,4
96-27-27-5x5-256-27-27-50-2x2-1x1-1x1-0-NCHW-FP32-F=ConvOclDirectFwd:8,16,32,32,2,2,8,1,2
480-14-14-1x1-16-14-14-1-0x0-1x1-1x1-0-NCHW-FP32-F=ConvAsm1x1U:1,8,1,16,1,4,4,1;ConvActivAsm1x1U:1,16,1,16,1,3;ConvOclDirectFwd1x1:1,64,1,1,1,4,32,64,0
3-10-10-3x3-5-10-10-128-1x1-1x1-1x1-0-NCHW-FP16-B=ConvOclDirectFwd:16,8,16,16,1,2,4,1,2
384-17-17-3x3-288-35-35-4-0x0-2x2-1x1-0-NCHW-FP32-B=ConvOclDirectFwd:8,16,16,16,2,1,4,1,2
128-7-7-1x1-768-7-7-256-0x0-1x1-1x1-0-NCHW-FP16-B=ConvAsm1x1U:2,16,4,16,1,2,1,4;ConvOclDirectFwd1x1:1,128,1,1,0,1,8,4,0
352-7-7-1x1-1024-7-7-32-0x0-1x1-1x1-0-NCHW-FP32-B=ConvAsm1x1U:2,16,2,32,1,2,1,1;ConvOclDirectFwd1x1:1,64,1,1,0,1,16,4,0
480-14-14-1x1-192-14-14-256-0x0-1x1-1x1-0-NCHW-FP16-F=ConvAsm1x1U:2,8,4,64,1,4,1,8;ConvOclDirectFwd1x1:1,64,1,1,0,2,16,4,0
512-28-28-1x1-128-28-28-4-0x0-1x1-1x1-0-NCHW-FP32-F=ConvAsm1x1U:2,8,2,64,1,4,1,8;ConvActivAsm1x1U:3,16,4,32,1,3;ConvOclDirectFwd1x1:1,64,1,1,1,1,16,256,0
512-28-28-1x1-256-56-56-1-0x0-2x2-1x1-0-NCHW-FP16-B=ConvAsm1x1U:1,8,2,64,1,4,4,2;ConvOclDirectFwd1x1:1,64,1,1,0,1,4,8,0
256-27-27-1x1-64-27-27-16-0x0-1x1-1x1-0-NCHW-FP16-F=ConvAsm1x1U:1,8,2,16,1,4,2,4;ConvOclDirectFwd1x1:1,256,1,1,0,1,8,4,0
320-17-17-3x3-320-8-8-128-0x0-2x2-1x1-0-NCHW-FP32-F=ConvOclDirectFwd:8,8,8,8,1,1,8,1,2
256-28-28-1x1-32-28-28-16-0x0-1x1-1x1-0-NCHW-FP32-F=ConvAsm1x1U:1,8,1,16,1,4,2,2;ConvActivAsm1x1U:1,16,1,16,2,3;ConvOclDirectFwd1x1:1,64,1,1,1,4,16,128,0
480-64-128-1x1-16-64-128-1-0x0-1x1-1x1-0-NCHW-FP16-F=ConvAsm1x1U:1,8,2,32,1,4,4,2;ConvOclDirectFwd1x1:1,64,1,1,0,2,4,8,0
128-14-14-1x1-512-14-14-512-0x0-1x1-1x1-0-NCHW-FP16-F=ConvAsm1x1U:2,8,4,64,1,4,1,4;ConvOclDirectFwd1x1:1,128,1,1,0,4,16,4,0
320-8-8-3x3-320-17-17-32-0x0-2x2-1x1-0-NCHW-FP32-B=ConvOclDirectFwd:32,32,32,32,1,1,4,4,2
384-13-13-3x3-384-13-13-128-1x1-1x1-1x1-0-NCHW-FP16-B=ConvOclDirectFwd:8,8,16,16,2,2,8,2,1
96-17-17-3x3-96-35-35-32-0x0-2x2-1x1-0-NCHW-FP32-B=ConvOclDirectFwd:16,16,16,16,1,1,4,1,2
64-55-55-1x1-256-55-55-1-0x0-1x1-1x1-0-NCHW-FP32-W=ConvAsmBwdWrW1x1:8,2,4,2,2,1,1,4
256-64-128-3x3-128-64-128-1-1x1-1x1-1x1-0-NCHW-FP32-W=ConvAsmBwdWrW3x3:0,0,16,4,1,1
512-7-7-3x3-512-16-16-64-0x0-2x2-1x1-0-NCHW-FP16-B=ConvOclDirectFwd:8,16,16,16,2,1,4,1,1
192-17-17-1x1-768-17-17-4-0x0-1x1-1x1-0-NCHW-FP32-W=ConvAsmBwdWrW1x1:1,16,2,4,8,1,1,4,0,1
128-28-28-3x3-128-28-28-32-1x1-1x1-1x1-0-NCHW-FP16-B=ConvOclDirectFwd:16,8,32,32,2,4,8,1,1
384-27-27-1x1-48-27-27-64-0x0-1x1-1x1-0-NCHW-FP32-B=ConvAsm1x1U:2,16,3,64,1,2,1,1;ConvOclDirectFwd1x1:1,64,1,1,0,1,16,8,0
32-14-14-1x1-528-14-14-128-0x0-1x1-1x1-0-NCHW-FP16-B=ConvAsm1x1U:1,16,2,16,1,2,1,4;ConvOclDirectFwd1x1:1,64,1,1,0,4,8,4,0
32-14-14-1x1-528-14-14-64-0x0-1x1-1x1-0-NCHW-FP16-B=ConvAsm1x1U:1,16,2,16,1,2,1,4;ConvOclDirectFwd1x1:1,256,1,1,0,4,8,4,0
128-56-56-1x1-192-56-56-256-0x0-1x1-1x1-0-NCHW-FP32-F=ConvAsm1x1U:1,8,1,64,2,4,1,4;ConvOclDirectFwd1x1:1,64,1,1,1,4,16,128,0
2048-8-8-1x1-384-8-8-8-0x0-1x1-1x1-0-NCHW-FP32-F=ConvAsm1x1U:4,8,4,16,1,4,2,2;ConvActivAsm1x1U:1,16,1,64,4,4;ConvOclDirectFwd1x1:1,64,1,1,1,0,64,256,0
384-13-13-3x3-192-13-13-512-1x1-1x1-1x1-0-NCHW-FP16-B=ConvOclDirectFwd:8,8,16,16,2,2,8,2,2
80-73-73-3x3-192-71-71-256-0x0-1x1-1x1-0-NCHW-FP32-F=ConvOclDirectFwd:16,8,16,16,1,2,8,2,2
128-17-17-1x1-768-17-17-256-0x0-1x1-1x1-0-NCHW-FP32-W=ConvAsmBwdWrW1x1:2,8,4,8,4,1,2,4,0,1
512-7-7-1x1-2048-7-7-256-0x0-1x1-1x1-0-NCHW-FP32-W=ConvAsmBwdWrW1x1:1,16,4,8,4,1,1,4,0,2
32-7-7-1x1-832-7-7-4-0x0-1x1-1x1-0-NCHW-FP32-B=ConvAsm1x1U:1,16,1,16,1,2,1;ConvOclDirectFwd1x1:1,128,1,1,0,1,4,8,0
224-28-28-1x1-128-28-28-32-0x0-1x1-1x1-0-NCHW-FP32-B=ConvAsm1x1U:1,16,1,16,1,2,2,1;ConvOclDirectFwd1x1:16,64,32,32,0,2,16,4,1
96-14-14-1x1-480-14-14-8-0x0-1x1-1x1-0-NCHW-FP32-B=ConvAsm1x1U:1,16,1,16,1,2,2,1;ConvOclDirectFwd1x1:1,128,1,1,0,4,8,4,0
160-64-128-1x1-512-64-128-1-0x0-1x1-1x1-0-NCHW-FP16-W=ConvAsmBwdWrW1x1:4,4,8,4,4,1,1,4,0,1
16-54-54-1x1-96-54-54-256-0x0-1x1-1x1-0-NCHW-FP32-B=ConvAsm1x1U:1,16,1,64,1,1,1,2;ConvOclDirectFwd1x1:1,256,1,1,0,1,32,4,0
320-8-8-1x1-1280-8-8-32-0x0-1x1-1x1-0-NCHW-FP16-B=ConvAsm1x1U:1,16,2,32,1,2,2,4;ConvOclDirectFwd1x1:1,64,1,1,0,2,8,4,0
256-14-14-1x1-512-28-28-4-0x0-2x2-1x1-0-NCHW-FP32-B=ConvAsm1x1U:1,16,1,64,2,2,2,1;ConvOclDirectFwd1x1:1,64,1,1,0,1,8,4,0
192-14-14-1x1-1104-14-14-16-0x0-1x1-1x1-0-NCHW-FP16-F=ConvAsm1x1U:2,8,4,64,1,4,1,4;ConvOclDirectFwd1x1:1,128,1,1,0,4,8,4,0
2048-7-7-1x1-1024-4-4-256-0x0-2x2-1x1-0-NCHW-FP32-F=ConvAsm1x1U:1,8,1,16,4,4,1,4;ConvOclDirectFwd1x1:1,64,1,1,1,4,32,2048,0
48-35-35-1x1-256-35-35-256-0x0-1x1-1x1-0-NCHW-FP16-B=ConvAsm1x1U:2,16,4,64,1,2,1,2;ConvOclDirectFwd1x1:1,256,1,1,0,1,16,4,0
64-56-56-1x1-256-56-56-4-0x0-1x1-1x1-0-NCHW-FP32-W=ConvAsmBwdWrW1x1:2,8,2,4,4,1,4,4,0,1
16-64-128-1x1-480-64-128-1-0x0-1x1-1x1-0-NCHW-FP32-W=ConvAsmBwdWrW1x1:4,4,2,1,8,1,1,4,0,2
256-13-13-3x3-256-13-13-1024-1x1-1x1-1x1-0-NCHW-FP16-B=ConvOclDirectFwd:8,8,16,16,2,2,8,2,1
512-28-28-3x3-512-28-28-256-1x1-1x1-1x1-0-NCHW-FP32-W=ConvAsmBwdWrW3x3:0,1,8,4,3,4
16-28-28-1x1-192-28-28-4-0x0-1x1-1x1-0-NCHW-FP32-B=ConvAsm1x1U:1,8,1,16,1,1,1,1;ConvOclDirectFwd1x1:1,256,1,1,0,1,8,4,0
512-4-4-3x3-512-7-7-16-1x1-2x2-1x1-0-NCHW-FP32-B=ConvOclDirectFwd:8,8,8,8,1,1,4,1,1
512-14-14-1x1-64-14-14-128-0x0-1x1-1x1-0-NCHW-FP16-F=ConvAsm1x1U:2,8,4,32,2,4,1,8;ConvOclDirectFwd1x1:1,64,1,1,0,2,8,4,0
192-8-8-1x1-2048-8-8-128-0x0-1x1-1x1-0-NCHW-FP16-B=ConvAsm1x1U:1,16,2,32,1,2,1,8;ConvOclDirectFwd1x1:1,64,1,1,0,4,16,4,0
128-14-14-3x3-32-14-14-64-1x1-1x1-1x1-0-NCHW-FP16-F=ConvOclDirectFwd:16,8,16,16,1,2,4,2,2
992-7-7-1x1-128-7-7-128-0x0-1x1-1x1-0-NCHW-FP16-F=ConvAsm1x1U:2,8,4,16,1,4,2,2;ConvOclDirectFwd1x1:1,64,1,1,0,1,4,4,0
2048-7-7-1x1-512-7-7-16-0x0-1x1-1x1-0-NCHW-FP32-B=ConvAsm1x1U:2,16,2,32,1,2,4,4;ConvOclDirectFwd1x1:1,128,1,1,0,1,8,4,0
512-28-28-1x1-128-28-28-128-0x0-1x1-1x1-0-NCHW-FP32-F=ConvAsm1x1U:3,16,3,16,2,2,2,2;ConvActivAsm1x1U:4,16,5,16,1,1;ConvOclDirectFwd1x1:1,64,1,1,1,1,16,2048,0
288-35-35-1x1-48-35-35-64-0x0-1x1-1x1-0-NCHW-FP32-F=ConvAsm1x1U:2,16,2,64,2,2,1,1;ConvActivAsm1x1U:2,16,2,64,2,1;ConvOclDirectFwd1x1:1,64,1,1,1,4,32,2048,0
64-256-512-1x1-64-256-512-1-0x0-1x1-1x1-0-NCHW-FP32-F=ConvOclDirectFwd1x1:1,64,1,1,1,4,32,128,0
1104-14-14-1x1-192-14-14-16-0x0-1x1-1x1-0-NCHW-FP32-W=ConvAsmBwdWrW1x1:1,16,4,4,8,1,2,4,0,1
48-7-7-5x5-128-7-7-64-2x2-1x1-1x1-0-NCHW-FP32-F=ConvOclDirectFwdFused:8,8,8,8,1,1,8,2,1;ConvOclDirectFwd:8,8,8,8,1,1,8,2,2
256-14-14-3x3-256-28-28-512-1x1-2x2-1x1-0-NCHW-FP32-W=ConvAsmBwdWrW3x3:0,0,8,8,2,1
448-28-28-1x1-128-28-28-128-0x0-1x1-1x1-0-NCHW-FP32-W=ConvAsmBwdWrW1x1:1,16,2,8,2,1,4,4,0,1
128-28-28-1x1-256-28-28-256-0x0-1x1-1x1-0-NCHW-FP32-B=ConvAsm1x1U:1,16,1,32,2,2,1,4;ConvOclDirectFwd1x1:1,64,1,1,0,2,32,4,0
128-7-7-1x1-960-7-7-32-0x0-1x1-1x1-0-NCHW-FP16-F=ConvAsm1x1U:2,8,4,16,1,4,1,2;ConvOclDirectFwd1x1:1,64,1,1,0,1,8,4,0
192-56-56-1x1-192-56-56-16-0x0-1x1-1x1-0-NCHW-FP32-F=ConvAsm1x1U:2,16,3,64,2,2,2,2;ConvActivAsm1x1U:3,16,3,64,2,1;ConvOclDirectFwd1x1:1,64,1,1,1,0,16,2048,0
96-28-28-1x1-192-28-28-8-0x0-1x1-1x1-0-NCHW-FP32-B=ConvAsm1x1U:1,16,1,16,1,2,2,1;ConvOclDirectFwd1x1:1,256,1,1,0,2,8,4,0
32-35-35-1x1-192-35-35-8-0x0-1x1-1x1-0-NCHW-FP16-W=ConvAsmBwdWrW1x1:4,4,2,4,2,1,4,4,0,1
192-56-56-1x1-288-56-56-16-0x0-1x1-1x1-0-NCHW-FP16-W=ConvAsmBwdWrW1x1:4,4,8,4,4,1,2,4,0,1
256-7-7-3x3-256-14-14-256-1x1-2x2-1x1-0-NCHW-FP32-W=ConvAsmBwdWrW3x3:0,0,8,8,4,1
64-13-13-1x1-512-13-13-32-0x0-1x1-1x1-0-NCHW-FP32-F=ConvAsm1x1U:1,16,1,64,4,2,1,1;ConvOclDirectFwd1x1:1,64,1,1,1,0,16,2048,0
320-28-28-1x1-128-28-28-128-0x0-1x1-1x1-0-NCHW-FP32-B=ConvAsm1x1U:1,32,1,16,2,1,2,2;ConvOclDirectFwd1x1:1,256,1,1,0,2,16,4,0
64-56-56-1x1-64-56-56-256-0x0-1x1-1x1-0-NCHW-FP16-F=ConvAsm1x1U:1,8,2,32,1,4,1,4;ConvOclDirectFwd1x1:1,64,1,1,0,4,16,4,0
128-56-56-1x1-64-56-56-512-0x0-1x1-1x1-0-NCHW-FP32-B=ConvAsm1x1U:1,32,1,64,2,1,1,1;ConvOclDirectFwd1x1:1,64,1,1,0,1,32,4,0
256-56-56-3x3-256-56-56-32-1x1-1x1-1x1-0-NCHW-FP32-W=ConvAsmBwdWrW3x3:0,1,16,4,3,1
608-14-14-1x1-128-14-14-32-0x0-1x1-1x1-0-NCHW-FP32-F=ConvAsm1x1U:2,8,2,64,1,4,1,8;ConvActivAsm1x1U:2,16,4,64,1,2;ConvOclDirectFwd1x1:1,64,1,1,1,1,16,2048,0
256-27-27-1x1-48-27-27-16-0x0-1x1-1x1-0-NCHW-FP32-W=ConvAsmBwdWrW1x1:2,8,2,8,2,1,4,4,0,1
256-7-7-3x3-256-14-14-32-1x1-2x2-1x1-0-NCHW-FP32-W=ConvAsmBwdWrW3x3:0,0,8,8,4,1
448-8-8-1x1-2048-8-8-128-0x0-1x1-1x1-0-NCHW-FP16-B=ConvAsm1x1U:1,16,2,16,1,2,1,8;ConvOclDirectFwd1x1:1,128,1,1,0,4,16,4,0
128-17-17-1x1-768-17-17-128-0x0-1x1-1x1-0-NCHW-FP16-B=ConvAsm1x1U:1,16,2,32,2,2,1,4;ConvOclDirectFwd1x1:1,64,1,1,0,1,16,4,0
480-28-28-1x1-128-28-28-128-0x0-1x1-1x1-0-NCHW-FP32-B=ConvAsm1x1U:1,32,1,32,2,1,2,2;ConvOclDirectFwd1x1:1,256,1,1,0,4,16,4,0
64-14-14-1x1-512-14-14-128-0x0-1x1-1x1-0-NCHW-FP16-B=ConvAsm1x1U:1,16,2,16,1,2,1,4;ConvOclDirectFwd1x1:1,256,1,1,0,2,8,4,0
1024-4-4-1x1-2048-7-7-32-0x0-2x2-1x1-0-NCHW-FP32-B=ConvAsm1x1U:1,32,1,16,2,1,2,2;ConvOclDirectFwd1x1:1,128,1,1,0,1,16,4,0
128-17-17-1x1-1024-17-17-128-0x0-1x1-1x1-0-NCHW-FP16-B=ConvAsm1x1U:1,16,2,32,2,2,1,4;ConvOclDirectFwd1x1:1,64,1,1,0,1,16,4,0
128-28-28-1x1-512-28-28-16-0x0-1x1-1x1-0-NCHW-FP32-B=ConvAsm1x1U:1,16,1,32,2,2,1,4;ConvOclDirectFwd1x1:1,64,1,1,0,2,16,4,0
224-14-14-3x3-112-14-14-16-1x1-1x1-1x1-0-NCHW-FP16-W=ConvAsmBwdWrW3x3:0,0,8,2,7,4
128-28-28-3x3-128-28-28-256-1x1-1x1-1x1-0-NCHW-FP16-B=ConvOclDirectFwd:32,8,32,32,1,4,8,2,2
1280-8-8-1x1-320-8-8-64-0x0-1x1-1x1-0-NCHW-FP16-F=ConvAsm1x1U:1,8,2,32,2,4,1,4;ConvOclDirectFwd1x1:1,64,1,1,0,2,8,4,0
32-14-14-5x5-128-14-14-256-2x2-1x1-1x1-0-NCHW-FP16-F=ConvOclDirectFwdFused:8,8,16,16,2,2,8,1,2;ConvOclDirectFwd:8,8,16,16,2,2,8,1,2
192-7-7-1x1-1200-7-7-16-0x0-1x1-1x1-0-NCHW-FP16-W=ConvAsmBwdWrW1x1:1,16,4,8,2,1,2,4,0,1
256-28-28-1x1-512-28-28-256-0x0-1x1-1x1-0-NCHW-FP32-W=ConvAsmBwdWrW1x1:2,8,4,8,4,2,2,4,0,2
192-13-13-3x3-384-13-13-16-1x1-1x1-1x1-0-NCHW-FP16-F=ConvOclDirectFwdFused:8,8,16,16,2,2,8,4,2;ConvOclDirectFwd:8,8,16,16,2,2,8,4,2
32-28-28-3x3-128-28-28-16-1x1-1x1-1x1-0-NCHW-FP16-B=ConvOclDirectFwd:16,16,32,32,2,2,8,2,1
1280-8-8-1x1-320-8-8-8-0x0-1x1-1x1-0-NCHW-FP32-F=ConvAsm1x1U:2,8,2,32,1,4,2,2;ConvActivAsm1x1U:1,16,1,64,3,4;ConvOclDirectFwd1x1:1,64,1,1,1,4,16,256,0
128-14-14-1x1-576-14-14-512-0x0-1x1-1x1-0-NCHW-FP32-F=ConvAsm1x1U:4,8,4,64,1,4,1,4;ConvOclDirectFwd1x1:1,64,1,1,1,1,64,256,0
256-14-14-3x3-256-14-14-2-1x1-1x1-1x1-0-NCHW-FP16-B=ConvOclDirectFwd:16,16,16,16,1,1,2,4,2
128-56-56-3x3-256-56-56-512-1x1-1x1-1x1-0-NCHW-FP32-W=ConvAsmBwdWrW3x3:0,1,8,4,2,1
128-56-56-1x1-64-56-56-64-0x0-1x1-1x1-0-NCHW-FP32-W=ConvAsmBwdWrW1x1:4,4,4,4,2,1,4,4,0,2
256-14-14-1x1-1024-14-14-64-0x0-1x1-1x1-0-NCHW-FP32-W=ConvAsmBwdWrW1x1:1,16,4,8,4,1,2,4,0,1
160-7-7-1x1-832-7-7-16-0x0-1x1-1x1-0-NCHW-FP16-B=ConvAsm1x1U:2,8,4,16,1,4,2,1;ConvOclDirectFwd1x1:1,64,1,1,0,1,8,4,0
128-17-17-1x1-768-17-17-1-0x0-1x1-1x1-0-NCHW-FP32-B=ConvAsm1x1U:1,8,1,64,1,2,2,2;ConvOclDirectFwd1x1:1,128,1,1,0,1,4,8,0
128-7-7-1x1-928-7-7-128-0x0-1x1-1x1-0-NCHW-FP32-F=ConvAsm1x1U:1,8,1,64,2,4,1,8;ConvOclDirectFwd1x1:1,64,1,1,1,4,16,256,0
128-112-112-3x3-64-112-112-32-1x1-1x1-1x1-0-NCHW-FP32-W=ConvAsmBwdWrW3x3:0,0,16,4,2,4
64-28-28-1x1-192-28-28-8-0x0-1x1-1x1-0-NCHW-FP32-W=ConvAsmBwdWrW1x1:2,8,2,4,4,2,4,4,0,1
160-7-7-3x3-320-7-7-1-1x1-1x1-1x1-0-NCHW-FP16-F=ConvOclDirectFwdFused:8,8,8,8,1,1,1,4,1;ConvOclDirectFwd:8,8,8,8,1,1,1,4,1
64-28-28-1x1-192-28-28-16-0x0-1x1-1x1-0-NCHW-FP32-W=ConvAsmBwdWrW1x1:2,8,2,8,2,1,4,4,0,1
128-14-14-1x1-800-14-14-32-0x0-1x1-1x1-0-NCHW-FP32-F=ConvAsm1x1U:4,8,4,64,1,4,2,2;ConvOclDirectFwd1x1:1,64,1,1,1,1,16,2048,0
480-14-14-1x1-128-14-14-512-0x0-1x1-1x1-0-NCHW-FP32-W=ConvAsmBwdWrW1x1:4,4,4,4,8,1,2,4,0,1
128-7-7-1x1-800-7-7-512-0x0-1x1-1x1-0-NCHW-FP16-F=ConvAsm1x1U:2,8,4,16,1,4,1,4;ConvOclDirectFwd1x1:1,64,1,1,0,1,8,4,0
480-14-14-1x1-64-14-14-128-0x0-1x1-1x1-0-NCHW-FP32-F=ConvAsm1x1U:4,16,4,64,1,2,2,2;ConvActivAsm1x1U:2,16,4,64,1,4;ConvOclDirectFwd1x1:1,64,1,1,1,1,64,2048,0
192-64-128-1x1-832-64-128-1-0x0-1x1-1x1-0-NCHW-FP16-W=ConvAsmBwdWrW1x1:4,4,2,2,8,1,1,4,0,3
128-54-54-1x1-16-54-54-64-0x0-1x1-1x1-0-NCHW-FP16-B=ConvAsm1x1U:2,16,4,64,1,2,1,1;ConvOclDirectFwd1x1:1,64,1,1,0,2,8,4,0
704-14-14-1x1-128-14-14-64-0x0-1x1-1x1-0-NCHW-FP32-B=ConvAsm1x1U:1,16,1,32,1,1,2,2;ConvOclDirectFwd1x1:8,64,16,16,0,2,16,4,1
256-13-13-3x3-384-13-13-32-1x1-1x1-1x1-0-NCHW-FP16-W=ConvAsmBwdWrW3x3:0,1,8,4,2,1
512-7-7-3x3-512-7-7-32-1x1-1x1-1x1-0-NCHW-FP32-W=ConvAsmBwdWrW3x3:0,1,8,4,2,1
96-14-14-1x1-608-14-14-32-0x0-1x1-1x1-0-NCHW-FP16-B=ConvAsm1x1U:1,16,2,16,1,2,2,2;ConvOclDirectFwd1x1:1,64,1,1,0,2,8,4,0
128-7-7-1x1-832-7-7-256-0x0-1x1-1x1-0-NCHW-FP16-W=ConvAsmBwdWrW1x1:2,8,8,8,2,2,2,2,0,2
256-27-27-3x3-64-27-27-128-1x1-1x1-1x1-0-NCHW-FP16-B=ConvOclDirectFwd:32,8,32,32,1,4,8,2,1
48-7-7-1x1-832-7-7-32-0x0-1x1-1x1-0-NCHW-FP32-W=ConvAsmBwdWrW1x1:2,8,2,4,4,2,1,2,0,1
992-14-14-1x1-128-14-14-128-0x0-1x1-1x1-0-NCHW-FP16-W=ConvAsmBwdWrW1x1:2,8,8,8,2,1,2,4,0,1
96-54-54-1x1-16-54-54-256-0x0-1x1-1x1-0-NCHW-FP32-F=ConvAsm1x1U:2,16,2,64,1,2,1,1;ConvOclDirectFwd1x1:1,64,1,1,1,0,16,256,0
192-7-7-1x1-1968-7-7-16-0x0-1x1-1x1-0-NCHW-FP16-B=ConvAsm1x1U:1,16,2,16,1,2,2,2;ConvOclDirectFwd1x1:1,128,1,1,0,1,8,4,0
512-28-28-3x3-256-28-28-64-1x1-1x1-1x1-0-NCHW-FP16-W=ConvAsmBwdWrW3x3:0,0,8,4,2,1
512-28-28-1x1-256-55-55-128-0x0-2x2-1x1-0-NCHW-FP32-W=ConvAsmBwdWrW1x1:2,8,4,4,8,1,2,4
128-14-14-1x1-960-14-14-32-0x0-1x1-1x1-0-NCHW-FP32-F=ConvAsm1x1U:2,8,2,64,2,4,1,4;ConvOclDirectFwd1x1:1,64,1,1,1,0,16,2048,0
64-112-112-7x7-3-225-225-1-2x2-2x2-1x1-0-NCHW-FP32-B=ConvOclDirectFwd:16,16,32,32,2,2,1,2,1
112-14-14-3x3-224-14-14-64-1x1-1x1-1x1-0-NCHW-FP16-F=ConvOclDirectFwdFused:8,8,16,16,2,2,8,2,2;ConvOclDirectFwd:8,16,16,16,2,1,8,1,1
512-28-28-1x1-128-28-28-4-0x0-1x1-1x1-0-NCHW-FP32-W=ConvAsmBwdWrW1x1:2,8,4,4,2,1,1,4,0,1
64-80-350-3x3-64-80-350-2-1x1-1x1-1x1-0-NCHW-FP16-B=ConvOclDirectFwd:16,8,16,32,1,4,8,2,2
3-224-224-3x3-64-224-224-1-1x1-1x1-1x1-0-NCHW-FP32-F=ConvOclDirectFwdFused:8,32,16,32,2,1,8,1,1;ConvOclDirectFwd:8,16,32,32,1,4,4,2,1
64-208-208-3x3-32-208-208-32-1x1-1x1-1x1-0-NCHW-FP32-W=ConvAsmBwdWrW3x3:0,0,16,4,2,4
48-27-27-3x3-192-27-27-32-1x1-1x1-1x1-0-NCHW-FP16-F=ConvOclDirectFwd:16,16,32,32,2,2,8,1,2
832-7-7-1x1-256-7-7-512-0x0-1x1-1x1-0-NCHW-FP32-F=ConvAsm1x1U:2,16,2,32,2,2,1,4;ConvActivAsm1x1U:1,16,1,64,4,1;ConvOclDirectFwd1x1:1,64,1,1,1,0,64,2048,0
128-28-28-1x1-352-28-28-256-0x0-1x1-1x1-0-NCHW-FP32-F=ConvAsm1x1U:1,16,1,32,3,2,1,4;ConvOclDirectFwd1x1:1,64,1,1,1,0,16,256,0
128-28-28-3x3-128-56-56-64-1x1-2x2-1x1-0-NCHW-FP32-W=ConvAsmBwdWrW3x3:0,0,16,4,1,1
256-27-27-1x1-64-27-27-128-0x0-1x1-1x1-0-NCHW-FP16-W=ConvAsmBwdWrW1x1:4,4,8,4,2,1,4,4,0,1
256-27-27-1x1-48-27-27-512-0x0-1x1-1x1-0-NCHW-FP16-W=ConvAsmBwdWrW1x1:4,4,4,4,2,1,4,4,0,0
128-14-14-1x1-864-14-14-64-0x0-1x1-1x1-0-NCHW-FP32-F=ConvAsm1x1U:4,16,4,64,1,2,1,4;ConvOclDirectFwd1x1:1,64,1,1,1,4,16,2048,0
64-55-55-1x1-256-55-55-2-0x0-1x1-1x1-0-NCHW-FP32-F=ConvAsm1x1U:2,16,3,64,2,2;ConvOclDirectFwd1x1:1,64,1,1,1,1,32,256,0
192-14-14-1x1-1440-14-14-16-0x0-1x1-1x1-0-NCHW-FP32-W=ConvAsmBwdWrW1x1:1,16,8,8,2,1,1,4,0,1
192-17-17-1x1-1024-17-17-128-0x0-1x1-1x1-0-NCHW-FP16-W=ConvAsmBwdWrW1x1:4,4,8,4,4,1,2,4,0,1
48-14-14-5x5-16-14-14-32-2x2-1x1-1x1-0-NCHW-FP32-B=ConvOclDirectFwd:16,16,16,16,4,1,1,4,2
64-35-35-1x1-192-35-35-16-0x0-1x1-1x1-0-NCHW-FP32-W=ConvAsmBwdWrW1x1:2,8,2,2,8,1,4,4,0,1
128-7-7-5x5-48-7-7-8-2x2-1x1-1x1-0-NCHW-FP16-B=ConvOclDirectFwd:8,8,8,8,1,1,1,2,2
48-27-27-1x1-384-27-27-128-0x0-1x1-1x1-0-NCHW-FP16-B=ConvAsm1x1U:1,16,2,16,1,2,1,2;ConvOclDirectFwd1x1:1,128,1,1,0,1,16,4,0
64-14-14-1x1-512-14-14-128-0x0-1x1-1x1-0-NCHW-FP32-B=ConvAsm1x1U:1,32,1,32,2,1,1,4;ConvOclDirectFwd1x1:1,256,1,1,0,4,16,4,0
384-28-28-1x1-128-28-28-16-0x0-1x1-1x1-0-NCHW-FP32-F=ConvAsm1x1U:4,8,7,64,1,2,2,4;ConvOclDirectFwd1x1:1,64,1,1,1,4,16,2048,0
1104-7-7-1x1-192-7-7-16-0x0-1x1-1x1-0-NCHW-FP32-B=ConvAsm1x1U:1,8,1,64,1,2,4,2;ConvOclDirectFwd1x1:1,256,1,1,0,1,4,8,0
32-54-54-3x3-128-54-54-128-1x1-1x1-1x1-0-NCHW-FP16-W=ConvAsmBwdWrW3x3:0,1,8,4,1,4
64-14-14-1x1-480-14-14-16-0x0-1x1-1x1-0-NCHW-FP16-B=ConvAsm1x1U:1,8,2,32,2,4,1,1;ConvOclDirectFwd1x1:1,64,1,1,0,4,16,4,0
32-149-149-3x3-3-299-299-4-0x0-2x2-1x1-0-NCHW-FP32-B=ConvOclDirectFwd:16,16,32,32,2,2,8,2,1
384-7-7-3x3-192-7-7-512-1x1-1x1-1x1-0-NCHW-FP32-W=ConvAsmBwdWrW3x3:0,0,8,4,2,1
1280-8-8-1x1-320-8-8-256-0x0-1x1-1x1-0-NCHW-FP32-F=ConvAsm1x1U:2,16,2,32,3,2,4,1;ConvActivAsm1x1U:2,16,2,16,4,2;ConvOclDirectFwd1x1:1,64,1,1,1,0,16,2048,0
352-28-28-1x1-128-28-28-16-0x0-1x1-1x1-0-NCHW-FP32-B=ConvAsm1x1U:2,16,2,32,1,2,2,2;ConvOclDirectFwd1x1:1,128,1,1,0,2,16,4,0
128-27-27-1x1-32-27-27-64-0x0-1x1-1x1-0-NCHW-FP32-F=ConvAsm1x1U:3,16,3,64,1,2,2,1;ConvOclDirectFwd1x1:1,64,1,1,1,1,16,2048,0
128-14-14-1x1-608-14-14-64-0x0-1x1-1x1-0-NCHW-FP16-W=ConvAsmBwdWrW1x1:2,8,2,8,2,1,4,4,0,2
32-7-7-1x1-832-7-7-512-0x0-1x1-1x1-0-NCHW-FP32-B=ConvAsm1x1U:1,16,1,64,2,2,2,2;ConvOclDirectFwd1x1:1,256,1,1,0,1,32,4,0
512-7-7-3x3-256-7-7-1-1x1-1x1-1x1-0-NCHW-FP32-W=ConvAsmBwdWrW3x3:0,1,8,2,6,1
128-14-14-1x1-528-14-14-512-0x0-1x1-1x1-0-NCHW-FP32-B=ConvAsm1x1U:1,16,1,32,2,1,1,4;ConvOclDirectFwd1x1:1,256,1,1,0,4,16,4,0
48-27-27-1x1-192-27-27-32-0x0-1x1-1x1-0-NCHW-FP16-F=ConvAsm1x1U:1,8,2,64,1,4,1,2;ConvOclDirectFwd1x1:1,128,1,1,0,1,8,4,0
64-14-14-1x1-480-14-14-16-0x0-1x1-1x1-0-NCHW-FP32-W=ConvAsmBwdWrW1x1:2,8,2,4,4,1,2,4,0,3
64-112-112-7x7-3-225-225-8-2x2-2x2-1x1-0-NCHW-FP32-B=ConvOclDirectFwd:16,16,32,32,2,2,8,2,1
128-54-54-1x1-16-54-54-512-0x0-1x1-1x1-0-NCHW-FP16-F=ConvAsm1x1U:2,8,4,64,1,4,2,2;ConvOclDirectFwd1x1:1,256,1,1,0,4,16,4,0
48-35-35-1x1-192-35-35-8-0x0-1x1-1x1-0-NCHW-FP16-B=ConvAsm1x1U:1,16,2,32,1,2,1,1;ConvOclDirectFwd1x1:1,256,1,1,0,1,4,4,0
64-55-55-1x1-256-55-55-32-0x0-1x1-1x1-0-NCHW-FP16-F=ConvAsm1x1U:1,16,2,64,2,2,1,4;ConvOclDirectFwd1x1:1,64,1,1,0,1,8,4,0
128-7-7-1x1-704-7-7-32-0x0-1x1-1x1-0-NCHW-FP16-B=ConvAsm1x1U:2,16,4,16,1,2,2,1;ConvOclDirectFwd1x1:1,128,1,1,0,1,8,4,0
80-73-73-1x1-64-73-73-64-0x0-1x1-1x1-0-NCHW-FP16-W=ConvAsmBwdWrW1x1:4,4,4,4,2,1,4,4,0,3
736-14-14-1x1-128-14-14-512-0x0-1x1-1x1-0-NCHW-FP32-B=ConvAsm1x1U:1,32,1,32,2,1,1,1;ConvOclDirectFwd1x1:1,256,1,1,0,4,16,4,0
512-28-28-1x1-256-56-56-64-0x0-2x2-1x1-0-NCHW-FP16-W=ConvAsmBwdWrW1x1:2,8,8,8,2,1,2,4,0,1
704-14-14-1x1-128-14-14-128-0x0-1x1-1x1-0-NCHW-FP16-F=ConvAsm1x1U:2,8,4,64,1,4,1,4;ConvOclDirectFwd1x1:1,128,1,1,0,2,8,4,0
992-14-14-1x1-128-14-14-16-0x0-1x1-1x1-0-NCHW-FP32-W=ConvAsmBwdWrW1x1:2,8,4,8,2,1,2,4,0,1
32-14-14-5x5-64-14-14-64-2x2-1x1-1x1-0-NCHW-FP16-F=ConvOclDirectFwdFused:8,8,16,16,2,2,4,4,2;ConvOclDirectFwd:8,8,16,16,2,2,4,4,2
256-35-35-1x1-48-35-35-4-0x0-1x1-1x1-0-NCHW-FP16-F=ConvAsm1x1U:1,8,2,64,1,4,4,1;ConvOclDirectFwd1x1:1,64,1,1,0,1,4,8,0
2048-7-7-1x1-512-7-7-64-0x0-1x1-1x1-0-NCHW-FP32-F=ConvAsm1x1U:4,16,4,16,1,2,1,8;ConvActivAsm1x1U:2,16,2,32,4,1;ConvOclDirectFwd1x1:1,64,1,1,1,0,64,2048,0
2048-8-8-1x1-448-8-8-4-0x0-1x1-1x1-0-NCHW-FP32-F=ConvAsm1x1U:1,8,1,64,4,4,4,1;ConvActivAsm1x1U:1,16,1,32,2,4;ConvOclDirectFwd1x1:1,64,1,1,1,4,16,256,0
128-54-54-1x1-16-54-54-128-0x0-1x1-1x1-0-NCHW-FP32-F=ConvAsm1x1U:2,16,2,64,3,1,1,1;ConvOclDirectFwd1x1:1,64,1,1,1,4,32,256,0
512-14-14-3x3-512-14-14-256-1x1-1x1-1x1-0-NCHW-FP16-B=ConvOclDirectFwd:8,8,16,16,2,2,8,2,1
32-14-14-1x1-512-14-14-8-0x0-1x1-1x1-0-NCHW-FP16-W=ConvAsmBwdWrW1x1:4,4,2,2,2,2,1,4,0,1
24-14-14-1x1-512-14-14-4-0x0-1x1-1x1-0-NCHW-FP16-B=ConvAsm1x1U:1,8,2,16,1,4,1,1;ConvOclDirectFwd1x1:1,64,1,1,0,4,4,4,0
64-112-112-1x1-64-112-112-16-0x0-1x1-1x1-0-NCHW-FP16-F=ConvAsm1x1U:1,8,2,64,1,4,2,2;ConvOclDirectFwd1x1:1,256,1,1,0,2,16,4,0
128-28-28-1x1-512-14-14-1-0x0-2x2-1x1-0-NCHW-FP16-F=ConvAsm1x1U:1,8,2,64,1,4,4,1;ConvOclDirectFwd1x1:1,64,1,1,0,2,4,4,0
32-27-27-1x1-128-27-27-512-0x0-1x1-1x1-0-NCHW-FP32-F=ConvAsm1x1U:2,16,2,64,3,2,1,1;ConvOclDirectFwd1x1:1,64,1,1,1,1,32,256,0
192-7-7-1x1-1920-7-7-16-0x0-1x1-1x1-0-NCHW-FP32-B=ConvAsm1x1U:1,16,1,64,2,2,2,2;ConvOclDirectFwd1x1:1,64,1,1,0,1,16,8,0
32-28-28-1x1-192-28-28-8-0x0-1x1-1x1-0-NCHW-FP16-B=ConvAsm1x1U:1,8,2,32,1,2,1,1;ConvOclDirectFwd1x1:1,64,1,1,0,4,16,4,0
256-14-14-1x1-528-14-14-4-0x0-1x1-1x1-0-NCHW-FP16-W=ConvAsmBwdWrW1x1:2,8,2,8,2,1,1,4,0,1
512-7-7-1x1-2048-7-7-128-0x0-1x1-1x1-0-NCHW-FP16-F=ConvAsm1x1U:2,8,4,16,1,4,1,4;ConvOclDirectFwd1x1:1,128,1,1,0,1,16,4,0
128-56-56-1x1-160-56-56-256-0x0-1x1-1x1-0-NCHW-FP32-F=ConvAsm1x1U:2,16,2,64,3,2,1,2;ConvOclDirectFwd1x1:1,64,1,1,1,1,64,128,0
192-17-17-1x1-1024-17-17-16-0x0-1x1-1x1-0-NCHW-FP16-B=ConvAsm1x1U:1,16,2,16,2,2,1,4;ConvOclDirectFwd1x1:1,64,1,1,0,1,8,4,0
64-224-224-3x3-64-224-224-64-1x1-1x1-1x1-0-NCHW-FP16-W=ConvAsmBwdWrW3x3:0,1,16,4,1,4
128-7-7-1x1-544-7-7-64-0x0-1x1-1x1-0-NCHW-FP32-F=ConvAsm1x1U:1,8,1,64,2,4,1,8;ConvOclDirectFwd1x1:1,64,1,1,1,1,16,2048,0
512-14-14-3x3-512-14-14-16-1x1-1x1-1x1-0-NCHW-FP32-W=ConvAsmBwdWrW3x3:0,1,8,4,2,1
384-8-8-3x3-448-8-8-32-1x1-1x1-1x1-0-NCHW-FP32-W=ConvAsmBwdWrW3x3:0,1,8,2,2,1
128-7-7-1x1-704-7-7-16-0x0-1x1-1x1-0-NCHW-FP32-F=ConvAsm1x1U:2,8,2,32,1,4,1,4;ConvOclDirectFwd1x1:1,64,1,1,1,0,16,2048,0
1024-14-14-1x1-512-28-28-32-0x0-2x2-1x1-0-NCHW-FP32-W=ConvAsmBwdWrW1x1:1,16,2,4,8,1,1,4,0,0
352-28-28-1x1-128-28-28-32-0x0-1x1-1x1-0-NCHW-FP32-W=ConvAsmBwdWrW1x1:2,8,2,4,4,2,2,4,0,1
48-27-27-1x1-256-27-27-32-0x0-1x1-1x1-0-NCHW-FP16-B=ConvAsm1x1U:2,16,4,64,1,2,1,1;ConvOclDirectFwd1x1:1,64,1,1,0,1,8,4,0
256-55-55-1x1-128-28-28-8-0x0-2x2-1x1-0-NCHW-FP32-F=ConvAsm1x1U:1,16,1,32,4,2;ConvOclDirectFwd1x1:1,64,1,1,1,4,16,2048,0
128-14-14-1x1-864-14-14-256-0x0-1x1-1x1-0-NCHW-FP32-F=ConvAsm1x1U:2,16,2,64,2,2,1,2;ConvOclDirectFwd1x1:1,64,1,1,1,1,16,2048,0
32-28-28-5x5-96-28-28-32-2x2-1x1-1x1-0-NCHW-FP16-F=ConvOclDirectFwdFused:8,16,32,32,4,2,8,2,1;ConvOclDirectFwd:8,16,32,32,4,2,8,2,1
128-17-17-1x1-1024-17-17-1-0x0-1x1-1x1-0-NCHW-FP16-W=ConvAsmBwdWrW1x1:1,16,2,4,2,1,1,4,0,1
256-14-14-3x3-128-14-14-16-1x1-1x1-1x1-0-NCHW-FP16-B=ConvOclDirectFwd:16,8,16,16,1,2,4,2,2
512-28-28-1x1-256-56-56-512-0x0-2x2-1x1-0-NCHW-FP16-W=ConvAsmBwdWrW1x1:2,8,8,8,2,2,2,4,0,1
992-7-7-1x1-128-7-7-512-0x0-1x1-1x1-0-NCHW-FP32-B=ConvAsm1x1U:2,16,2,32,1,2,2,2;ConvOclDirectFwd1x1:1,256,1,1,0,1,16,4,0
128-28-28-1x1-288-28-28-256-0x0-1x1-1x1-0-NCHW-FP32-F=ConvAsm1x1U:1,8,1,32,4,2,1,4;ConvOclDirectFwd1x1:1,64,1,1,1,0,16,2048,0
864-7-7-1x1-128-7-7-256-0x0-1x1-1x1-0-NCHW-FP32-B=ConvAsm1x1U:2,16,2,32,1,2,4,1;ConvOclDirectFwd1x1:1,64,1,1,0,1,16,8,0
64-28-28-1x1-192-28-28-8-0x0-1x1-1x1-0-NCHW-FP16-W=ConvAsmBwdWrW1x1:4,4,4,1,8,1,2,4,0,1
928-7-7-1x1-128-7-7-512-0x0-1x1-1x1-0-NCHW-FP32-B=ConvAsm1x1U:2,16,2,32,1,2,2,2;ConvOclDirectFwd1x1:1,256,1,1,0,1,16,8,0
192-28-28-1x1-432-28-28-16-0x0-1x1-1x1-0-NCHW-FP32-W=ConvAsmBwdWrW1x1:1,16,2,4,4,1,4,4,0,2
486-19-19-3x3-512-19-19-64-1x1-1x1-1x1-0-NCHW-FP32-W=ConvAsmBwdWrW3x3:0,0,8,2,6,1
64-28-28-1x1-192-28-28-2-0x0-1x1-1x1-0-NCHW-FP16-W=ConvAsmBwdWrW1x1:2,8,2,1,4,1,1,4,0,1
256-14-14-1x1-256-14-14-16-0x0-1x1-1x1-0-NCHW-FP16-W=ConvAsmBwdWrW1x1:4,4,8,1,8,2,1,4,0,0
64-27-27-1x1-384-27-27-256-0x0-1x1-1x1-0-NCHW-FP32-F=ConvAsm1x1U:2,16,2,32,2,2,1,2;ConvOclDirectFwd1x1:1,64,1,1,1,4,16,64,0
256-56-56-3x3-128-56-56-128-1x1-1x1-1x1-0-NCHW-FP32-W=ConvAsmBwdWrW3x3:0,1,8,4,2,1
32-147-147-3x3-32-149-149-32-0x0-1x1-1x1-0-NCHW-FP16-B=ConvOclDirectFwd:16,16,32,32,2,2,8,4,2
128-39-174-5x5-64-80-350-16-1x1-2x2-1x1-0-NCHW-FP32-B=ConvOclDirectFwd:16,16,16,32,1,2,4,2,2
64-35-35-1x1-384-35-35-64-0x0-1x1-1x1-0-NCHW-FP16-W=ConvAsmBwdWrW1x1:2,8,4,8,2,1,4,4,0,1
448-8-8-1x1-1280-8-8-32-0x0-1x1-1x1-0-NCHW-FP32-F=ConvAsm1x1U:2,8,2,32,2,4,1,4;ConvOclDirectFwd1x1:1,64,1,1,1,0,16,2048,0
32-14-14-1x1-528-14-14-4-0x0-1x1-1x1-0-NCHW-FP16-B=ConvAsm1x1U:1,8,2,16,1,4,1,1;ConvOclDirectFwd1x1:1,64,1,1,0,4,4,4,0
1024-14-14-1x1-512-7-7-256-0x0-2x2-1x1-0-NCHW-FP16-F=ConvAsm1x1U:2,8,4,16,1,4,1,8;ConvOclDirectFwd1x1:8,64,16,16,0,1,16,4,1
192-71-71-3x3-192-35-35-1-0x0-2x2-1x1-0-NCHW-FP32-F=ConvOclDirectFwd:16,16,16,16,1,1,8,1,1
1024-17-17-1x1-128-17-17-64-0x0-1x1-1x1-0-NCHW-FP16-F=ConvAsm1x1U:1,16,6,32,1,2,1,8;ConvOclDirectFwd1x1:1,64,1,1,0,1,8,4,0
224-14-14-3x3-112-14-14-8-1x1-1x1-1x1-0-NCHW-FP16-B=ConvOclDirectFwd:8,16,16,16,2,1,2,4,2
608-14-14-1x1-96-14-14-64-0x0-1x1-1x1-0-NCHW-FP32-F=ConvAsm1x1U:4,8,4,64,1,4,1,4;ConvActivAsm1x1U:3,16,3,16,4,2;ConvOclDirectFwd1x1:1,64,1,1,1,4,16,2048,0
736-14-14-1x1-128-14-14-32-0x0-1x1-1x1-0-NCHW-FP32-W=ConvAsmBwdWrW1x1:2,8,4,4,4,1,2,4,0,0
64-14-14-1x1-480-14-14-256-0x0-1x1-1x1-0-NCHW-FP32-F=ConvAsm1x1U:1,16,1,32,2,2,1,4;ConvOclDirectFwd1x1:1,64,1,1,1,1,16,128,0
64-14-14-1x1-480-14-14-4-0x0-1x1-1x1-0-NCHW-FP32-B=ConvAsm1x1U:1,16,1,32,1,2,2,1;ConvOclDirectFwd1x1:1,64,1,1,0,4,8,8,0
32-14-14-3x3-128-14-14-32-1x1-1x1-1x1-0-NCHW-FP16-W=ConvAsmBwdWrW3x3:0,0,8,2,2,4
64-35-35-1x1-384-35-35-256-0x0-1x1-1x1-0-NCHW-FP32-B=ConvAsm1x1U:1,16,1,64,2,2,1,8;ConvOclDirectFwd1x1:1,256,1,1,0,1,32,4,0
512-28-28-1x1-256-56-56-16-0x0-2x2-1x1-0-NCHW-FP32-B=ConvAsm1x1U:2,16,2,32,1,2,2,2;ConvOclDirectFwd1x1:1,256,1,1,0,1,32,4,0
128-28-28-1x1-128-28-28-256-0x0-1x1-1x1-0-NCHW-FP32-W=ConvAsmBwdWrW1x1:2,8,2,8,2,1,4,4,0,2
64-55-55-1x1-256-55-55-1-0x0-1x1-1x1-0-NCHW-FP32-F=ConvAsm1x1U:2,16,2,64,1,2;ConvOclDirectFwd1x1:1,64,1,1,1,1,16,128,0
192-64-128-1x1-480-64-128-1-0x0-1x1-1x1-0-NCHW-FP16-B=ConvAsm1x1U:1,16,2,64,1,2,2,2;ConvOclDirectFwd1x1:1,128,1,1,0,4,16,4,0
64-27-27-3x3-256-27-27-32-1x1-1x1-1x1-0-NCHW-FP16-W=ConvAsmBwdWrW3x3:0,0,8,2,2,1
320-8-8-1x1-2048-8-8-32-0x0-1x1-1x1-0-NCHW-FP16-B=ConvAsm1x1U:1,16,2,32,1,2,1,8;ConvOclDirectFwd1x1:1,64,1,1,0,4,16,4,0
256-13-13-3x3-256-13-13-32-1x1-1x1-1x1-0-NCHW-FP16-F=ConvOclDirectFwd:8,8,16,16,2,2,8,4,2
1024-14-14-1x1-512-7-7-128-0x0-2x2-1x1-0-NCHW-FP32-F=ConvAsm1x1U:4,16,4,16,1,2,1,8;ConvOclDirectFwd1x1:1,64,1,1,1,1,32,2048,0
32-28-28-1x1-256-28-28-1-0x0-1x1-1x1-0-NCHW-FP32-W=ConvAsmBwdWrW1x1:4,4,2,1,2,1,1,4,0,1
256-7-7-3x3-256-14-14-128-1x1-2x2-1x1-0-NCHW-FP32-W=ConvAsmBwdWrW3x3:0,0,8,8,6,1
192-14-14-1x1-2064-14-14-16-0x0-1x1-1x1-0-NCHW-FP32-B=ConvAsm1x1U:1,16,1,32,2,2,1,4;ConvOclDirectFwd1x1:1,64,1,1,0,4,16,4,0
256-56-56-1x1-64-56-56-128-0x0-1x1-1x1-0-NCHW-FP32-F=ConvAsm1x1U:2,16,2,64,2,2,1,4;ConvActivAsm1x1U:3,16,3,32,2,1;ConvOclDirectFwd1x1:1,64,1,1,1,0,16,2048,0
128-14-14-1x1-608-14-14-32-0x0-1x1-1x1-0-NCHW-FP16-B=ConvAsm1x1U:1,8,2,16,2,2,1,4;ConvOclDirectFwd1x1:1,64,1,1,0,2,8,4,0
512-14-14-1x1-128-14-14-1-0x0-1x1-1x1-0-NCHW-FP32-F=ConvAsm1x1U:1,8,1,32,1,4,4,1;ConvActivAsm1x1U:1,16,1,32,1,3;ConvOclDirectFwd1x1:1,64,1,1,1,4,16,64,0
896-7-7-1x1-128-7-7-256-0x0-1x1-1x1-0-NCHW-FP16-B=ConvAsm1x1U:2,16,4,16,1,2,4,1;ConvOclDirectFwd1x1:1,128,1,1,0,1,8,4,0
192-35-35-1x1-64-35-35-4-0x0-1x1-1x1-0-NCHW-FP32-F=ConvAsm1x1U:3,8,3,32,1,4,2,2;ConvActivAsm1x1U:2,16,3,16,1,4;ConvOclDirectFwd1x1:1,64,1,1,1,1,16,2048,0
608-7-7-1x1-128-7-7-64-0x0-1x1-1x1-0-NCHW-FP32-W=ConvAsmBwdWrW1x1:4,4,4,4,2,1,1,4,0,0
384-7-7-3x3-192-7-7-16-1x1-1x1-1x1-0-NCHW-FP16-W=ConvAsmBwdWrW3x3:0,0,8,4,3,1
832-64-128-1x1-256-64-128-1-0x0-1x1-1x1-0-NCHW-FP32-F=ConvOclDirectFwd1x1:1,64,1,1,1,1,64,2048,0
64-35-35-1x1-384-35-35-16-0x0-1x1-1x1-0-NCHW-FP16-W=ConvAsmBwdWrW1x1:4,4,4,4,4,1,2,4,0,1
192-13-13-3x3-384-13-13-32-1x1-1x1-1x1-0-NCHW-FP32-W=ConvAsmBwdWrW3x3:0,1,16,4,2,1
192-35-35-1x1-64-35-35-256-0x0-1x1-1x1-0-NCHW-FP32-F=ConvAsm1x1U:2,16,2,64,3,2,1,2;ConvActivAsm1x1U:3,32,3,32,1,1;ConvOclDirectFwd1x1:1,64,1,1,1,4,16,2048,0
320-8-8-3x3-192-17-17-256-0x0-2x2-1x1-0-NCHW-FP32-B=ConvOclDirectFwd:32,32,32,32,1,1,8,4,2
64-73-73-1x1-160-73-73-8-0x0-1x1-1x1-0-NCHW-FP32-B=ConvAsm1x1U:1,32,1,64,1,1,1,1;ConvOclDirectFwd1x1:1,256,1,1,0,1,32,4,0
256-14-14-1x1-1024-14-14-128-0x0-1x1-1x1-0-NCHW-FP32-W=ConvAsmBwdWrW1x1:1,16,4,8,4,1,2,4,0,2
512-14-14-1x1-128-28-28-16-0x0-2x2-1x1-0-NCHW-FP32-W=ConvAsmBwdWrW1x1:2,8,2,8,2,1,1,4,0,2
480-14-14-1x1-64-14-14-256-0x0-1x1-1x1-0-NCHW-FP32-W=ConvAsmBwdWrW1x1:2,8,2,8,4,1,4,4,0,1
48-7-7-1x1-832-7-7-128-0x0-1x1-1x1-0-NCHW-FP32-W=ConvAsmBwdWrW1x1:2,8,4,8,2,2,2,4,0,2
1536-8-8-1x1-256-8-8-4-0x0-1x1-1x1-0-NCHW-FP32-F=ConvAsm1x1U:1,8,1,64,1,4,4,1;ConvActivAsm1x1U:1,16,1,32,1,4;ConvOclDirectFwd1x1:1,64,1,1,1,0,16,128,0
320-14-14-1x1-128-14-14-64-0x0-1x1-1x1-0-NCHW-FP16-F=ConvAsm1x1U:2,8,4,64,1,4,1,4;ConvOclDirectFwd1x1:1,128,1,1,0,4,8,4,0
48-14-14-5x5-16-14-14-8-2x2-1x1-1x1-0-NCHW-FP32-B=ConvOclDirectFwd:16,16,16,16,1,1,1,4,2
256-27-27-3x3-64-27-27-64-1x1-1x1-1x1-0-NCHW-FP16-W=ConvAsmBwdWrW3x3:0,0,8,2,3,1
128-56-56-1x1-224-56-56-16-0x0-1x1-1x1-0-NCHW-FP16-B=ConvAsm1x1U:1,16,2,32,1,2,1,2;ConvOclDirectFwd1x1:1,128,1,1,0,4,16,4,0
128-14-14-1x1-960-14-14-512-0x0-1x1-1x1-0-NCHW-FP32-F=ConvAsm1x1U:4,8,4,64,1,4,1,4;ConvOclDirectFwd1x1:1,64,1,1,1,1,64,2048,0
832-64-128-1x1-160-64-128-1-0x0-1x1-1x1-0-NCHW-FP16-F=ConvOclDirectFwd1x1:1,128,1,1,0,4,16,4,0
224-28-28-1x1-128-28-28-512-0x0-1x1-1x1-0-NCHW-FP32-B=ConvAsm1x1U:1,32,1,32,2,1,1,1;ConvOclDirectFwd1x1:1,256,1,1,0,4,16,4,0
32-28-28-1x1-256-28-28-4-0x0-1x1-1x1-0-NCHW-FP16-B=ConvAsm1x1U:1,8,2,64,1,4,2,1;ConvOclDirectFwd1x1:1,256,1,1,0,2,4,4,0
192-28-28-3x3-128-28-28-8-1x1-1x1-1x1-0-NCHW-FP32-W=ConvAsmBwdWrW3x3:0,0,8,2,2,1
256-27-27-1x1-48-27-27-512-0x0-1x1-1x1-0-NCHW-FP32-W=ConvAsmBwdWrW1x1:4,4,4,4,4,1,4,4,0,1
1280-8-8-1x1-448-8-8-32-0x0-1x1-1x1-0-NCHW-FP32-F=ConvAsm1x1U:2,8,2,32,2,4,1,4;ConvActivAsm1x1U:2,16,2,32,4,2;ConvOclDirectFwd1x1:1,64,1,1,1,1,16,2048,0
80-73-73-1x1-64-73-73-4-0x0-1x1-1x1-0-NCHW-FP32-B=ConvAsm1x1U:1,16,1,64,1,2,2,2;ConvOclDirectFwd1x1:1,256,1,1,0,1,8,4,0
480-14-14-1x1-64-14-14-4-0x0-1x1-1x1-0-NCHW-FP16-F=ConvAsm1x1U:1,8,2,16,1,4,4,1;ConvOclDirectFwd1x1:1,256,1,1,0,4,4,4,0
320-8-8-1x1-2048-8-8-32-0x0-1x1-1x1-0-NCHW-FP32-W=ConvAsmBwdWrW1x1:2,8,4,2,8,1,1,4,0,1
32-27-27-1x1-128-27-27-128-0x0-1x1-1x1-0-NCHW-FP16-F=ConvAsm1x1U:1,8,2,64,1,4,1,2;ConvOclDirectFwd1x1:1,64,1,1,0,1,8,4,0
192-14-14-1x1-1344-14-14-16-0x0-1x1-1x1-0-NCHW-FP32-W=ConvAsmBwdWrW1x1:1,16,4,8,4,1,2,4,0,1
256-28-28-1x1-64-56-56-2-0x0-2x2-1x1-0-NCHW-FP32-W=ConvAsmBwdWrW1x1:4,4,2,2,2,1,1,4,0,1
128-28-28-1x1-256-14-14-12-0x0-2x2-1x1-0-NCHW-FP32-F=ConvAsm1x1U:1,8,1,64,4,4,2,1;ConvOclDirectFwd1x1:1,64,1,1,1,4,16,256,0
512-28-28-3x3-512-28-28-16-1x1-1x1-1x1-0-NCHW-FP32-W=ConvAsmBwdWrW3x3:0,1,8,4,2,1
256-14-14-1x1-512-7-7-256-0x0-2x2-1x1-0-NCHW-FP32-F=ConvAsm1x1U:4,8,4,16,1,4,1,4;ConvOclDirectFwd1x1:1,64,1,1,1,4,32,2048,0
288-28-28-1x1-192-28-28-16-0x0-1x1-1x1-0-NCHW-FP16-F=ConvAsm1x1U:1,8,2,32,2,4,1,4;ConvOclDirectFwd1x1:1,64,1,1,0,2,8,4,0
128-7-7-5x5-32-7-7-4-2x2-1x1-1x1-0-NCHW-FP16-B=ConvOclDirectFwd:8,8,8,8,1,1,1,2,2
384-13-13-3x3-192-13-13-1-1x1-1x1-1x1-0-NCHW-FP16-B=ConvOclDirectFwd:16,16,16,16,1,1,1,4,1
192-28-28-1x1-64-28-28-32-0x0-1x1-1x1-0-NCHW-FP16-F=ConvAsm1x1U:1,8,2,16,1,4,1,4;ConvOclDirectFwd1x1:1,64,1,1,0,4,16,4,0
1024-14-14-1x1-256-14-14-64-0x0-1x1-1x1-0-NCHW-FP32-B=ConvAsm1x1U:1,32,1,32,2,1,2,2;ConvOclDirectFwd1x1:1,128,1,1,0,2,16,4,0
128-28-28-1x1-192-28-28-64-0x0-1x1-1x1-0-NCHW-FP32-F=ConvAsm1x1U:1,8,1,32,2,4,1,8;ConvOclDirectFwd1x1:1,64,1,1,1,4,16,256,0
256-28-28-1x1-128-28-28-8-0x0-1x1-1x1-0-NCHW-FP32-F=ConvAsm1x1U:2,8,2,16,1,4,1,4;ConvActivAsm1x1U:2,16,2,16,2,2;ConvOclDirectFwd1x1:1,64,1,1,1,0,16,2048,0
5-10-10-3x3-3-10-10-128-1x1-1x1-1x1-0-NCHW-FP16-B=ConvOclDirectFwd:16,8,16,16,1,2,1,4,2
128-28-28-3x3-128-28-28-16-1x1-1x1-1x1-0-NCHW-FP16-F=ConvOclDirectFwdFused:16,16,32,32,2,2,8,2,1;ConvOclDirectFwd:16,16,32,32,2,2,8,2,1
160-28-28-1x1-128-28-28-256-0x0-1x1-1x1-0-NCHW-FP32-B=ConvAsm1x1U:1,32,1,32,2,1,1,1;ConvOclDirectFwd1x1:1,256,1,1,0,2,16,4,0
480-14-14-1x1-96-14-14-16-0x0-1x1-1x1-0-NCHW-FP32-F=ConvAsm1x1U:2,8,2,64,1,4,2,2;ConvActivAsm1x1U:1,16,3,16,1,3;ConvOclDirectFwd1x1:1,64,1,1,1,0,16,128,0
128-28-28-3x3-128-58-58-256-0x0-2x2-1x1-0-NCHW-FP32-B=ConvOclDirectFwd:16,32,16,32,1,1,8,1,2
256-27-27-1x1-32-27-27-256-0x0-1x1-1x1-0-NCHW-FP16-F=ConvAsm1x1U:2,16,4,64,1,2,1,1;ConvOclDirectFwd1x1:1,256,1,1,0,1,8,4,0
256-7-7-1x1-832-7-7-4-0x0-1x1-1x1-0-NCHW-FP16-W=ConvAsmBwdWrW1x1:1,16,2,8,2,1,1,2,0,1
960-14-14-1x1-128-14-14-256-0x0-1x1-1x1-0-NCHW-FP32-B=ConvAsm1x1U:1,32,1,16,2,1,4,1;ConvOclDirectFwd1x1:1,256,1,1,0,2,16,4,0
160-17-17-1x1-768-17-17-8-0x0-1x1-1x1-0-NCHW-FP16-B=ConvAsm1x1U:1,16,2,16,1,2,2,2;ConvOclDirectFwd1x1:1,64,1,1,0,1,8,4,0
128-5-5-3x3-256-3-3-32-0x0-1x1-1x1-0-NCHW-FP32-F=ConvOclDirectFwd:8,8,8,8,1,1,8,2,2
256-56-56-3x3-256-56-56-8-1x1-1x1-1x1-0-NCHW-FP16-W=ConvAsmBwdWrW3x3:0,0,8,4,1,1
928-14-14-1x1-128-14-14-64-0x0-1x1-1x1-0-NCHW-FP32-B=ConvAsm1x1U:2,32,2,16,1,1,4,1;ConvOclDirectFwd1x1:1,64,1,1,0,4,16,4,0
256-28-28-1x1-64-56-56-1-0x0-2x2-1x1-0-NCHW-FP32-B=ConvAsm1x1U:1,8,1,64,1,4,4,2;ConvOclDirectFwd1x1:1,64,1,1,0,1,4,4,0
192-17-17-1x1-768-17-17-1-0x0-1x1-1x1-0-NCHW-FP16-W=ConvAsmBwdWrW1x1:2,8,2,4,4,1,1,4,0,0
96-56-56-1x1-128-56-56-256-0x0-1x1-1x1-0-NCHW-FP32-W=ConvAsmBwdWrW1x1:4,4,4,4,4,1,4,4,0,2
128-14-14-1x1-320-14-14-64-0x0-1x1-1x1-0-NCHW-FP32-F=ConvAsm1x1U:2,16,4,64,1,2,1,1;ConvOclDirectFwd1x1:1,64,1,1,1,0,16,2048,0
192-17-17-3x3-320-8-8-64-0x0-2x2-1x1-0-NCHW-FP32-F=ConvOclDirectFwd:8,8,8,8,1,1,8,2,2
384-8-8-1x1-1536-8-8-16-0x0-1x1-1x1-0-NCHW-FP16-W=ConvAsmBwdWrW1x1:1,16,2,8,2,1,2,4,0,1
256-14-14-1x1-256-14-14-2-0x0-1x1-1x1-0-NCHW-FP16-W=ConvAsmBwdWrW1x1:2,8,2,2,2,2,1,4,0,1
384-8-8-1x1-1536-8-8-8-0x0-1x1-1x1-0-NCHW-FP32-W=ConvAsmBwdWrW1x1:1,16,2,8,4,1,2,4,0,1
832-7-7-1x1-384-7-7-64-0x0-1x1-1x1-0-NCHW-FP16-F=ConvAsm1x1U:2,8,4,16,1,4,2,4;ConvOclDirectFwd1x1:1,128,1,1,0,1,8,4,0
1280-8-8-1x1-192-8-8-8-0x0-1x1-1x1-0-NCHW-FP32-F=ConvAsm1x1U:2,8,2,32,1,4,4,2;ConvActivAsm1x1U:2,16,2,32,1,4;ConvOclDirectFwd1x1:1,64,1,1,1,1,16,256,0
544-7-7-1x1-128-7-7-512-0x0-1x1-1x1-0-NCHW-FP32-W=ConvAsmBwdWrW1x1:2,8,4,8,2,1,2,4,0,1
384-13-13-3x3-256-13-13-512-1x1-1x1-1x1-0-NCHW-FP16-W=ConvAsmBwdWrW3x3:0,0,8,4,2,1
2048-7-7-1x1-1024-4-4-256-0x0-2x2-1x1-0-NCHW-FP16-F=ConvAsm1x1U:2,4,4,4,2,4,1,8;ConvOclDirectFwd1x1:1,256,1,1,0,1,16,4,0
64-35-35-1x1-288-35-35-256-0x0-1x1-1x1-0-NCHW-FP16-F=ConvAsm1x1U:3,8,6,32,1,4,1,4;ConvOclDirectFwd1x1:1,256,1,1,0,1,8,4,0
64-28-28-1x1-256-28-28-1-0x0-1x1-1x1-0-NCHW-FP16-B=ConvAsm1x1U:1,8,2,64,1,2,2,1;ConvOclDirectFwd1x1:1,128,1,1,0,1,4,4,0
192-14-14-1x1-1056-14-14-16-0x0-1x1-1x1-0-NCHW-FP16-W=ConvAsmBwdWrW1x1:2,8,4,8,2,1,1,4,0,1
512-28-28-1x1-256-56-56-64-0x0-2x2-1x1-0-NCHW-FP32-W=ConvAsmBwdWrW1x1:2,8,4,8,4,1,2,4,0,2
128-28-28-3x3-128-56-56-512-1x1-2x2-1x1-0-NCHW-FP32-B=ConvOclDirectFwd:32,16,32,32,1,2,8,2,2
32-28-28-1x1-192-28-28-1-0x0-1x1-1x1-0-NCHW-FP16-W=ConvAsmBwdWrW1x1:4,4,4,1,2,1,1,4,0,1
64-112-112-1x1-64-112-112-16-0x0-1x1-1x1-0-NCHW-FP32-F=ConvAsm1x1U:1,16,1,64,2,2,1,4;ConvActivAsm1x1U:1,32,1,64,2,1;ConvOclDirectFwd1x1:1,64,1,1,1,1,32,256,0
1024-14-14-1x1-256-14-14-32-0x0-1x1-1x1-0-NCHW-FP16-B=ConvAsm1x1U:2,8,4,64,1,4,1,8;ConvOclDirectFwd1x1:1,64,1,1,0,4,16,4,0
1824-14-14-1x1-192-14-14-16-0x0-1x1-1x1-0-NCHW-FP16-F=ConvAsm1x1U:2,8,4,64,1,4,2,2;ConvOclDirectFwd1x1:1,64,1,1,0,2,8,4,0
3-32-32-1x1-3-32-32-512-0x0-1x1-1x1-0-NCHW-FP32-W=ConvAsmBwdWrW1x1:4,4,2,1,2,2,4,4,0,2
128-7-7-1x1-864-7-7-64-0x0-1x1-1x1-0-NCHW-FP32-F=ConvAsm1x1U:1,8,1,64,2,4,1,8;ConvOclDirectFwd1x1:1,64,1,1,1,4,16,256,0
128-7-7-1x1-672-7-7-16-0x0-1x1-1x1-0-NCHW-FP32-F=ConvAsm1x1U:1,8,1,64,2,4,2,4;ConvOclDirectFwd1x1:1,64,1,1,1,0,16,2048,0
512-14-14-1x1-24-14-14-1-0x0-1x1-1x1-0-NCHW-FP32-F=ConvAsm1x1U:1,8,1,64,1,4,4,1;ConvActivAsm1x1U:1,16,1,16,1,3;ConvOclDirectFwd1x1:1,256,1,1,0,4,4,8,0
128-28-28-3x3-128-56-56-32-1x1-2x2-1x1-0-NCHW-FP32-B=ConvOclDirectFwd:8,16,32,32,4,2,8,2,1
64-6-60-3x3-128-6-60-16-1x1-1x1-1x1-0-NCHW-FP16-F=ConvOclDirectFwd:8,16,8,32,1,2,8,4,2
416-14-14-1x1-128-14-14-256-0x0-1x1-1x1-0-NCHW-FP32-B=ConvAsm1x1U:2,32,2,16,1,1,2,2;ConvOclDirectFwd1x1:1,256,1,1,0,2,16,4,0
528-14-14-1x1-160-14-14-512-0x0-1x1-1x1-0-NCHW-FP16-F=ConvAsm1x1U:2,8,4,64,1,4,1,4;ConvOclDirectFwd1x1:1,64,1,1,0,2,16,4,0
32-54-54-1x1-128-54-54-32-0x0-1x1-1x1-0-NCHW-FP32-F=ConvAsm1x1U:2,16,2,64,1,2,1,2;ConvOclDirectFwd1x1:1,64,1,1,1,1,32,128,0
192-8-8-1x1-2048-8-8-8-0x0-1x1-1x1-0-NCHW-FP16-B=ConvAsm1x1U:1,16,2,16,1,2,2,2;ConvOclDirectFwd1x1:1,64,1,1,0,2,8,4,0
64-112-112-3x3-128-112-112-16-1x1-1x1-1x1-0-NCHW-FP16-B=ConvOclDirectFwd:8,16,16,32,2,2,8,1,2
1824-7-7-1x1-192-7-7-16-0x0-1x1-1x1-0-NCHW-FP16-F=ConvAsm1x1U:1,8,2,32,1,4,4,1;ConvOclDirectFwd1x1:1,64,1,1,0,1,4,8,0
256-27-27-1x1-48-27-27-256-0x0-1x1-1x1-0-NCHW-FP16-B=ConvAsm1x1U:2,16,4,32,1,2,1,1;ConvOclDirectFwd1x1:1,256,1,1,0,1,8,4,0
128-14-14-1x1-480-14-14-256-0x0-1x1-1x1-0-NCHW-FP32-F=ConvAsm1x1U:1,16,1,32,3,2,1,4;ConvOclDirectFwd1x1:1,64,1,1,1,1,16,2048,0
32-147-147-3x3-32-149-149-8-0x0-1x1-1x1-0-NCHW-FP32-B=ConvOclDirectFwd:16,16,16,32,1,2,8,2,2
256-19-19-1x1-512-19-19-64-0x0-1x1-1x1-0-NCHW-FP32-W=ConvAsmBwdWrW1x1:2,8,4,8,2,1,1,4,0,1
736-7-7-1x1-128-7-7-128-0x0-1x1-1x1-0-NCHW-FP32-W=ConvAsmBwdWrW1x1:2,8,4,4,4,1,2,4,0,0
128-7-7-1x1-736-7-7-32-0x0-1x1-1x1-0-NCHW-FP16-F=ConvAsm1x1U:2,8,4,16,1,4,1,1;ConvOclDirectFwd1x1:1,64,1,1,0,1,8,8,0
576-14-14-1x1-192-14-14-16-0x0-1x1-1x1-0-NCHW-FP32-F=ConvAsm1x1U:2,16,3,16,1,2,2,1;ConvActivAsm1x1U:2,16,2,16,2,2;ConvOclDirectFwd1x1:1,64,1,1,1,1,16,256,0
32-28-28-1x1-192-28-28-16-0x0-1x1-1x1-0-NCHW-FP16-W=ConvAsmBwdWrW1x1:4,4,2,4,2,1,4,2,0,1
224-56-56-1x1-128-56-56-256-0x0-1x1-1x1-0-NCHW-FP32-B=ConvAsm1x1U:1,32,1,64,2,1,1,1;ConvOclDirectFwd1x1:1,256,1,1,0,4,16,4,0
832-7-7-1x1-48-7-7-16-0x0-1x1-1x1-0-NCHW-FP32-F=ConvAsm1x1U:1,8,1,64,1,4,4,1;ConvActivAsm1x1U:1,16,1,16,1,4;ConvOclDirectFwd1x1:8,8,8,8,1,0,32,128,1
256-27-27-1x1-48-27-27-32-0x0-1x1-1x1-0-NCHW-FP16-B=ConvAsm1x1U:3,8,6,64,1,4,2,2;ConvOclDirectFwd1x1:1,64,1,1,0,1,8,4,0
384-17-17-1x1-1024-17-17-256-0x0-1x1-1x1-0-NCHW-FP32-W=ConvAsmBwdWrW1x1:1,16,4,8,4,1,1,4,0,2
128-7-7-1x1-800-7-7-256-0x0-1x1-1x1-0-NCHW-FP16-F=ConvAsm1x1U:2,8,4,16,1,4,1,4;ConvOclDirectFwd1x1:1,128,1,1,0,1,8,4,0
24-14-14-5x5-64-14-14-32-2x2-1x1-1x1-0-NCHW-FP32-F=ConvOclDirectFwdFused:8,8,16,16,2,2,2,1,2;ConvOclDirectFwd:16,16,8,16,4,2,1,4,2
64-256-512-1x1-64-256-512-1-0x0-1x1-1x1-0-NCHW-FP32-W=ConvAsmBwdWrW1x1:4,4,2,2,2,1,1,4,0,3
384-27-27-1x1-48-27-27-128-0x0-1x1-1x1-0-NCHW-FP16-W=ConvAsmBwdWrW1x1:2,8,4,8,2,2,4,4,0,1
192-56-56-1x1-144-56-56-16-0x0-1x1-1x1-0-NCHW-FP32-B=ConvAsm1x1U:1,16,1,64,2,2,1,1;ConvOclDirectFwd1x1:1,64,1,1,0,4,16,4,0
3-32-32-1x1-3-32-32-256-0x0-1x1-1x1-0-NCHW-FP32-F=ConvAsm1x1U:4,1,4,4,1,1,2,2;ConvOclDirectFwd1x1:1,256,1,1,0,4,8,4,0
64-112-112-1x1-64-112-112-2-0x0-1x1-1x1-0-NCHW-FP16-F=ConvAsm1x1U:1,8,2,64,1,4,1,2;ConvOclDirectFwd1x1:1,64,1,1,0,4,16,4,0
48-27-27-1x1-192-27-27-16-0x0-1x1-1x1-0-NCHW-FP32-B=ConvAsm1x1U:1,16,1,64,1,2,2,1;ConvOclDirectFwd1x1:1,64,1,1,0,1,16,8,0
128-56-56-3x3-256-56-56-8-1x1-1x1-1x1-0-NCHW-FP16-F=ConvOclDirectFwdFused:32,8,32,32,1,4,8,1,2;ConvOclDirectFwd:32,8,32,32,1,4,8,1,2
64-64-128-1x1-480-64-128-1-0x0-1x1-1x1-0-NCHW-FP16-B=ConvAsm1x1U:1,16,2,64,1,2,2,2;ConvOclDirectFwd1x1:1,256,1,1,0,4,16,4,0
256-14-14-3x3-256-14-14-32-1x1-1x1-1x1-0-NCHW-FP32-W=ConvAsmBwdWrW3x3:0,0,8,4,4,1
128-40-175-3x3-128-40-175-1-1x1-1x1-1x1-0-NCHW-FP32-W=ConvAsmBwdWrW3x3:0,0,16,4,2,1
224-35-35-3x3-192-35-35-16-1x1-1x1-1x1-0-NCHW-FP16-W=ConvAsmBwdWrW3x3:0,0,8,4,1,2
128-14-14-5x5-32-14-14-512-2x2-1x1-1x1-0-NCHW-FP16-B=ConvOclDirectFwd:8,8,16,16,2,2,8,2,1
1024-14-14-1x1-512-14-14-16-0x0-1x1-1x1-0-NCHW-FP16-F=ConvAsm1x1U:2,8,4,64,2,4,1,8;ConvOclDirectFwd1x1:1,128,1,1,0,2,8,4,0
128-56-56-1x1-256-56-56-64-0x0-1x1-1x1-0-NCHW-FP32-B=ConvAsm1x1U:1,16,1,64,2,2,1,4;ConvOclDirectFwd1x1:1,256,1,1,0,2,16,4,0
576-14-14-1x1-128-14-14-512-0x0-1x1-1x1-0-NCHW-FP16-F=ConvAsm1x1U:2,8,4,64,1,4,1,4;ConvOclDirectFwd1x1:1,256,1,1,0,4,8,4,0
1024-14-14-1x1-256-14-14-64-0x0-1x1-1x1-0-NCHW-FP16-B=ConvAsm1x1U:2,8,4,64,1,4,1,8;ConvOclDirectFwd1x1:1,128,1,1,0,4,8,4,0
112-14-14-1x1-512-14-14-8-0x0-1x1-1x1-0-NCHW-FP32-W=ConvAsmBwdWrW1x1:2,8,2,4,2,1,1,4,0,1
128-14-14-3x3-256-14-14-16-1x1-1x1-1x1-0-NCHW-FP16-F=ConvOclDirectFwdFused:8,16,16,16,2,1,8,4,2;ConvOclDirectFwd:8,16,16,16,2,1,8,4,2
256-109-175-3x3-256-109-175-16-1x1-1x1-1x1-0-NCHW-FP16-F=ConvOclDirectFwd:16,8,16,32,1,4,8,4,1
32-7-7-1x1-832-7-7-4-0x0-1x1-1x1-0-NCHW-FP16-B=ConvAsm1x1U:1,8,2,16,1,4,1,1;ConvOclDirectFwd1x1:1,64,1,1,0,1,8,4,0
320-8-8-3x3-320-17-17-16-0x0-2x2-1x1-0-NCHW-FP32-B=ConvOclDirectFwd:32,16,32,32,1,2,4,2,2
3-224-224-7x7-96-109-109-256-0x0-2x2-1x1-0-NCHW-FP32-F=ConvOclDirectFwd:16,8,16,16,1,2,8,1,1
2048-7-7-1x1-512-7-7-8-0x0-1x1-1x1-0-NCHW-FP16-W=ConvAsmBwdWrW1x1:1,16,4,8,2,1,1,4,0,1
256-120-192-3x3-256-120-192-128-1x1-1x1-1x1-0-NCHW-FP16-F=ConvOclDirectFwd:16,16,32,32,2,2,8,1,1
832-7-7-1x1-192-7-7-8-0x0-1x1-1x1-0-NCHW-FP16-F=ConvAsm1x1U:1,8,2,32,1,4,4,1;ConvOclDirectFwd1x1:1,64,1,1,0,1,4,8,0
24-14-14-1x1-512-14-14-512-0x0-1x1-1x1-0-NCHW-FP32-W=ConvAsmBwdWrW1x1:4,4,8,4,2,1,4,4,0,2
480-14-14-1x1-96-14-14-128-0x0-1x1-1x1-0-NCHW-FP32-F=ConvAsm1x1U:4,16,4,64,1,2,1,2;ConvActivAsm1x1U:2,16,2,64,2,1;ConvOclDirectFwd1x1:1,64,1,1,1,0,16,2048,0
256-27-27-1x1-48-27-27-64-0x0-1x1-1x1-0-NCHW-FP16-F=ConvAsm1x1U:3,8,6,64,1,4,1,2;ConvOclDirectFwd1x1:1,64,1,1,0,1,8,4,0
80-73-73-3x3-192-71-71-4-0x0-1x1-1x1-0-NCHW-FP16-F=ConvOclDirectFwdFused:16,8,16,16,1,2,8,1,1;ConvOclDirectFwd:16,8,16,16,1,2,8,1,1
64-112-112-3x3-128-112-112-64-1x1-1x1-1x1-0-NCHW-FP16-W=ConvAsmBwdWrW3x3:0,1,8,4,1,4
384-8-8-1x1-2048-8-8-64-0x0-1x1-1x1-0-NCHW-FP16-W=ConvAsmBwdWrW1x1:1,16,4,8,2,1,1,4,0,1
96-54-54-1x1-16-54-54-32-0x0-1x1-1x1-0-NCHW-FP32-F=ConvAsm1x1U:1,16,1,64,3,2,1,1;ConvOclDirectFwd1x1:1,64,1,1,1,1,64,256,0
256-14-14-1x1-1024-14-14-2-0x0-1x1-1x1-0-NCHW-FP32-F=ConvAsm1x1U:4,8,4,64,1,4,2,4;ConvActivAsm1x1U:2,16,4,64,1,4;ConvOclDirectFwd1x1:1,64,1,1,1,0,16,2048,0
1024-17-17-1x1-384-17-17-16-0x0-1x1-1x1-0-NCHW-FP32-W=ConvAsmBwdWrW1x1:2,8,4,8,4,1,2,4,0,2
128-14-14-1x1-608-14-14-512-0x0-1x1-1x1-0-NCHW-FP32-F=ConvAsm1x1U:2,16,2,64,3,2,1,2;ConvOclDirectFwd1x1:1,64,1,1,1,1,32,2048,0
128-28-28-3x3-128-28-28-1-1x1-1x1-1x1-0-NCHW-FP16-F=ConvOclDirectFwdFused:16,16,16,16,1,1,2,2,1;ConvOclDirectFwd:16,16,16,16,1,1,2,2,1
192-14-14-1x1-1920-14-14-16-0x0-1x1-1x1-0-NCHW-FP32-W=ConvAsmBwdWrW1x1:1,16,4,8,4,1,1,4,0,1
128-14-14-1x1-352-14-14-128-0x0-1x1-1x1-0-NCHW-FP16-B=ConvAsm1x1U:1,16,2,16,1,2,2,2;ConvOclDirectFwd1x1:1,128,1,1,0,4,16,4,0
128-56-56-1x1-256-56-56-512-0x0-1x1-1x1-0-NCHW-FP32-F=ConvAsm1x1U:1,8,1,64,2,4,1,4;ConvOclDirectFwd1x1:1,64,1,1,1,1,32,256,0
1024-14-14-1x1-512-7-7-4-0x0-2x2-1x1-0-NCHW-FP16-F=ConvAsm1x1U:1,8,2,32,1,4,4,1;ConvOclDirectFwd1x1:1,256,1,1,0,1,4,4,0
16-28-28-1x1-192-28-28-32-0x0-1x1-1x1-0-NCHW-FP32-W=ConvAsmBwdWrW1x1:4,4,4,4,2,2,4,4,0,1
128-56-56-1x1-256-56-56-128-0x0-1x1-1x1-0-NCHW-FP16-W=ConvAsmBwdWrW1x1:2,8,4,8,2,1,4,4,0,3
320-8-8-1x1-2048-8-8-16-0x0-1x1-1x1-0-NCHW-FP32-B=ConvAsm1x1U:1,16,1,64,2,2,1,4;ConvOclDirectFwd1x1:1,256,1,1,0,2,16,4,0
48-27-27-1x1-256-27-27-256-0x0-1x1-1x1-0-NCHW-FP16-F=ConvAsm1x1U:3,8,6,64,1,4,1,4;ConvOclDirectFwd1x1:1,256,1,1,0,1,8,4,0
192-7-7-1x1-1056-7-7-64-0x0-1x1-1x1-0-NCHW-FP32-B=ConvAsm1x1U:1,16,1,64,2,2,2,2;ConvOclDirectFwd1x1:1,128,1,1,0,1,16,4,0
256-5-5-3x3-128-10-10-32-1x1-2x2-1x1-0-NCHW-FP32-W=ConvAsmBwdWrW3x3:0,0,8,4,7,1
384-8-8-1x1-1280-8-8-1-0x0-1x1-1x1-0-NCHW-FP16-B=ConvAsm1x1U:1,8,2,32,1,4,4,1;ConvOclDirectFwd1x1:1,128,1,1,0,1,4,8,0
144-14-14-1x1-512-14-14-32-0x0-1x1-1x1-0-NCHW-FP32-W=ConvAsmBwdWrW1x1:1,16,2,8,4,1,2,4,0,2
832-7-7-1x1-128-7-7-128-0x0-1x1-1x1-0-NCHW-FP32-B=ConvAsm1x1U:4,8,4,16,1,4,1,4;ConvOclDirectFwd1x1:1,64,1,1,0,1,8,4,0
64-35-35-1x1-192-35-35-16-0x0-1x1-1x1-0-NCHW-FP32-B=ConvAsm1x1U:1,16,1,64,4,2,2,2;ConvOclDirectFwd1x1:1,128,1,1,0,1,16,8,0
64-56-56-1x1-256-56-56-256-0x0-1x1-1x1-0-NCHW-FP16-B=ConvAsm1x1U:1,16,2,32,1,2,1,2;ConvOclDirectFwd1x1:1,64,1,1,0,4,16,4,0
256-13-13-3x3-384-13-13-256-1x1-1x1-1x1-0-NCHW-FP16-F=ConvOclDirectFwd:8,8,16,16,2,2,8,1,2
192-8-8-1x1-1280-8-8-128-0x0-1x1-1x1-0-NCHW-FP32-B=ConvAsm1x1U:1,16,1,64,2,2,1,4;ConvOclDirectFwd1x1:8,64,8,8,0,2,16,4,1
528-14-14-1x1-128-14-14-1-0x0-1x1-1x1-0-NCHW-FP32-F=ConvAsm1x1U:1,8,1,64,1,2,4,1;ConvActivAsm1x1U:1,16,1,32,1,4;ConvOclDirectFwd1x1:8,8,16,16,1,0,32,128,1
512-7-7-1x1-1024-14-14-8-0x0-2x2-1x1-0-NCHW-FP16-B=ConvAsm1x1U:1,16,2,16,1,2,4,4;ConvOclDirectFwd1x1:1,64,1,1,0,1,8,8,0
512-14-14-3x3-512-14-14-8-1x1-1x1-1x1-0-NCHW-FP16-B=ConvOclDirectFwd:8,16,16,16,2,1,8,1,2
128-28-28-1x1-224-28-28-32-0x0-1x1-1x1-0-NCHW-FP32-F=ConvAsm1x1U:2,16,2,16,2,2,2,2;ConvOclDirectFwd1x1:1,64,1,1,1,0,16,256,0
96-28-28-1x1-192-28-28-128-0x0-1x1-1x1-0-NCHW-FP32-B=ConvAsm1x1U:1,16,1,32,2,2,1,1;ConvOclDirectFwd1x1:1,64,1,1,0,1,32,4,0
224-14-14-3x3-112-14-14-32-1x1-1x1-1x1-0-NCHW-FP16-B=ConvOclDirectFwd:16,8,16,16,1,2,8,1,2
160-17-17-1x1-768-17-17-64-0x0-1x1-1x1-0-NCHW-FP32-B=ConvAsm1x1U:1,16,1,64,4,2,1,4;ConvOclDirectFwd1x1:1,128,1,1,0,1,16,4,0
192-71-71-3x3-192-35-35-256-0x0-2x2-1x1-0-NCHW-FP32-F=ConvOclDirectFwd:16,16,16,16,1,1,8,2,1
256-30-30-3x3-256-14-14-256-0x0-2x2-1x1-0-NCHW-FP32-F=ConvOclDirectFwd:16,8,16,16,1,2,8,1,1
16-54-54-3x3-64-54-54-64-1x1-1x1-1x1-0-NCHW-FP32-B=ConvAsm3x3U:7,8,3;ConvOclDirectFwd:8,32,16,32,2,1,8,2,2
64-28-28-1x1-192-28-28-64-0x0-1x1-1x1-0-NCHW-FP16-W=ConvAsmBwdWrW1x1:4,4,8,4,2,1,4,4,0,1
128-28-28-1x1-256-28-28-512-0x0-1x1-1x1-0-NCHW-FP16-B=ConvAsm1x1U:1,16,2,16,1,2,1,2;ConvOclDirectFwd1x1:1,128,1,1,0,4,16,4,0
192-17-17-1x1-1024-17-17-4-0x0-1x1-1x1-0-NCHW-FP16-W=ConvAsmBwdWrW1x1:2,8,4,4,4,1,1,2,0,1
128-56-56-1x1-128-56-56-32-0x0-1x1-1x1-0-NCHW-FP32-B=ConvAsm1x1U:1,32,1,64,1,1,1,1;ConvOclDirectFwd1x1:1,128,1,1,0,2,32,4,0
992-7-7-1x1-128-7-7-32-0x0-1x1-1x1-0-NCHW-FP16-B=ConvAsm1x1U:1,8,2,32,1,4,4,2;ConvOclDirectFwd1x1:1,64,1,1,0,1,4,4,0
288-14-14-1x1-128-14-14-64-0x0-1x1-1x1-0-NCHW-FP32-B=ConvAsm1x1U:1,16,1,16,1,1,2,2;ConvOclDirectFwd1x1:1,128,1,1,0,4,16,4,0
768-17-17-1x1-160-17-17-16-0x0-1x1-1x1-0-NCHW-FP16-F=ConvAsm1x1U:3,8,6,32,1,4,2,2;ConvOclDirectFwd1x1:1,64,1,1,0,1,8,8,0
48-35-35-1x1-288-35-35-64-0x0-1x1-1x1-0-NCHW-FP16-B=ConvAsm1x1U:1,16,2,64,1,2,1,2;ConvOclDirectFwd1x1:1,256,1,1,0,1,8,8,0
192-28-28-5x5-32-28-28-16-2x2-1x1-1x1-0-NCHW-FP32-F=ConvOclDirectFwd:16,16,32,32,2,2,2,2,1
128-28-28-1x1-128-28-28-32-0x0-1x1-1x1-0-NCHW-FP32-W=ConvAsmBwdWrW1x1:2,8,2,8,2,1,4,4,0,1
192-28-28-1x1-16-28-28-1-0x0-1x1-1x1-0-NCHW-FP32-F=ConvAsm1x1U:1,8,1,64,1,4,4,1;ConvActivAsm1x1U:1,16,1,16,1,3;ConvOclDirectFwd1x1:1,64,1,1,1,0,64,64,0
320-8-8-3x3-192-17-17-32-0x0-2x2-1x1-0-NCHW-FP32-B=ConvOclDirectFwd:32,32,32,32,1,1,8,4,2
192-28-28-1x1-128-28-28-128-0x0-1x1-1x1-0-NCHW-FP16-F=ConvAsm1x1U:2,8,4,32,1,4,1,4;ConvOclDirectFwd1x1:1,256,1,1,0,4,16,4,0
128-27-27-1x1-32-27-27-32-0x0-1x1-1x1-0-NCHW-FP16-F=ConvAsm1x1U:1,8,2,64,1,4,2,2;ConvOclDirectFwd1x1:1,256,1,1,0,1,8,4,0
128-7-7-5x5-48-7-7-4-2x2-1x1-1x1-0-NCHW-FP16-B=ConvOclDirectFwd:8,8,8,8,1,1,1,2,2
256-14-14-1x1-528-14-14-4-0x0-1x1-1x1-0-NCHW-FP32-B=ConvAsm1x1U:1,16,1,32,1,1,4,1;ConvOclDirectFwd1x1:1,128,1,1,0,1,8,4,0
32-28-28-1x1-192-28-28-128-0x0-1x1-1x1-0-NCHW-FP16-F=ConvAsm1x1U:1,8,2,16,2,4,1,4;ConvOclDirectFwd1x1:16,64,32,32,0,2,16,4,1
512-7-7-3x3-512-7-7-8-1x1-1x1-1x1-0-NCHW-FP16-F=ConvOclDirectFwdFused:8,8,8,8,1,1,4,4,2;ConvOclDirectFwd:8,8,8,8,1,1,4,4,2
2048-8-8-1x1-320-8-8-32-0x0-1x1-1x1-0-NCHW-FP32-F=ConvAsm1x1U:2,8,2,32,3,4,1,4;ConvActivAsm1x1U:4,16,4,16,3,4;ConvOclDirectFwd1x1:1,64,1,1,1,0,64,256,0
1728-7-7-1x1-192-7-7-16-0x0-1x1-1x1-0-NCHW-FP32-F=ConvAsm1x1U:4,8,4,16,1,4,4,2;ConvActivAsm1x1U:2,16,2,32,2,4;ConvOclDirectFwd1x1:1,64,1,1,1,1,16,256,0
128-28-28-1x1-480-28-28-16-0x0-1x1-1x1-0-NCHW-FP16-W=ConvAsmBwdWrW1x1:4,4,4,4,4,1,2,4,0,0
64-28-28-1x1-192-28-28-1-0x0-1x1-1x1-0-NCHW-FP16-B=ConvAsm1x1U:1,8,2,64,1,2,4,1;ConvOclDirectFwd1x1:1,256,1,1,0,1,4,4,0
64-224-224-3x3-3-224-224-4-1x1-1x1-1x1-0-NCHW-FP16-B=ConvOclDirectFwd:16,16,32,32,2,2,8,2,1
256-56-56-3x3-256-56-56-16-1x1-1x1-1x1-0-NCHW-FP16-F=ConvOclDirectFwdFused:32,8,32,32,1,4,8,1,2;ConvOclDirectFwd:32,8,32,32,1,4,8,1,2
64-13-13-3x3-256-13-13-64-1x1-1x1-1x1-0-NCHW-FP16-W=ConvAsmBwdWrW3x3:0,0,8,4,10,1
1056-14-14-1x1-2112-14-14-16-0x0-1x1-1x1-0-NCHW-FP32-B=ConvAsm1x1U:1,32,1,16,2,1,2,2;ConvOclDirectFwd1x1:1,256,1,1,0,4,16,4,0
448-8-8-3x3-384-8-8-128-1x1-1x1-1x1-0-NCHW-FP16-F=ConvOclDirectFwdFused:8,8,8,8,1,1,8,4,2;ConvOclDirectFwd:8,8,8,8,1,1,8,4,2
1024-7-7-1x1-192-7-7-32-0x0-1x1-1x1-0-NCHW-FP16-F=ConvAsm1x1U:2,8,4,16,1,4,4,1;ConvOclDirectFwd1x1:1,128,1,1,0,1,4,4,0
64-112-112-7x7-3-230-230-32-0x0-2x2-1x1-0-NCHW-FP32-B=ConvOclDirectFwd:16,16,32,32,2,2,8,2,1
608-14-14-1x1-128-14-14-32-0x0-1x1-1x1-0-NCHW-FP16-F=ConvAsm1x1U:2,8,4,64,1,4,2,8;ConvOclDirectFwd1x1:1,128,1,1,0,4,8,4,0
192-14-14-1x1-384-14-14-16-0x0-1x1-1x1-0-NCHW-FP16-B=ConvAsm1x1U:1,16,2,16,1,2,2,2;ConvOclDirectFwd1x1:1,64,1,1,0,4,8,4,0
128-28-28-1x1-256-28-28-8-0x0-1x1-1x1-0-NCHW-FP16-B=ConvAsm1x1U:1,8,2,32,2,4,1,4;ConvOclDirectFwd1x1:1,64,1,1,0,2,8,4,0
384-13-13-3x3-384-13-13-16-1x1-1x1-1x1-0-NCHW-FP16-F=ConvOclDirectFwdFused:8,8,16,16,2,2,8,4,2;ConvOclDirectFwd:8,8,16,16,2,2,8,4,2
320-28-28-1x1-64-28-28-64-0x0-1x1-1x1-0-NCHW-FP16-F=ConvAsm1x1U:1,8,2,32,2,4,1,4;ConvOclDirectFwd1x1:1,128,1,1,0,4,16,4,0
64-35-35-1x1-192-35-35-256-0x0-1x1-1x1-0-NCHW-FP32-B=ConvAsm1x1U:1,16,1,64,2,2,1,4;ConvOclDirectFwd1x1:1,128,1,1,0,1,32,4,0
96-71-71-3x3-64-73-73-32-0x0-1x1-1x1-0-NCHW-FP16-B=ConvOclDirectFwd:16,8,16,16,1,2,8,1,1
128-14-14-1x1-384-14-14-16-0x0-1x1-1x1-0-NCHW-FP16-B=ConvAsm1x1U:1,16,2,16,1,2,2,4;ConvOclDirectFwd1x1:1,128,1,1,0,4,8,4,0
16-14-14-5x5-48-14-14-256-2x2-1x1-1x1-0-NCHW-FP32-F=ConvOclDirectFwdFused:8,8,16,16,2,2,4,1,2;ConvOclDirectFwd:8,8,16,16,2,2,4,1,2
16-14-14-1x1-480-14-14-256-0x0-1x1-1x1-0-NCHW-FP16-F=ConvAsm1x1U:1,8,2,64,1,4,1,4;ConvOclDirectFwd1x1:1,64,1,1,0,4,4,4,0
192-35-35-1x1-64-35-35-32-0x0-1x1-1x1-0-NCHW-FP32-F=ConvAsm1x1U:2,16,2,64,1,2,1,4;ConvActivAsm1x1U:2,16,2,64,3,1;ConvOclDirectFwd1x1:1,64,1,1,1,1,64,2048,0
1536-14-14-1x1-192-14-14-16-0x0-1x1-1x1-0-NCHW-FP32-F=ConvActivAsm1x1U:4,16,7,32,1,2
480-14-14-1x1-128-14-14-64-0x0-1x1-1x1-0-NCHW-FP16-F=ConvAsm1x1U:2,8,4,64,1,4,1,8;ConvOclDirectFwd1x1:1,64,1,1,0,4,8,4,0
128-28-28-1x1-256-56-56-2-0x0-2x2-1x1-0-NCHW-FP16-B=ConvAsm1x1U:1,16,2,32,1,2,4,1;ConvOclDirectFwd1x1:1,128,1,1,0,2,4,8,0
192-14-14-1x1-1488-14-14-16-0x0-1x1-1x1-0-NCHW-FP32-W=ConvAsmBwdWrW1x1:2,8,2,8,4,1,2,4,0,0
32-28-28-1x1-192-28-28-256-0x0-1x1-1x1-0-NCHW-FP32-B=ConvAsm1x1U:1,16,1,32,1,2,1,4;ConvOclDirectFwd1x1:1,64,1,1,0,1,32,4,0
48-27-27-1x1-256-27-27-16-0x0-1x1-1x1-0-NCHW-FP32-F=ConvAsm1x1U:1,8,1,64,2,4,1,8;ConvOclDirectFwd1x1:1,64,1,1,1,0,16,2048,0
3-224-224-3x3-64-224-224-32-1x1-1x1-1x1-0-NCHW-FP16-F=ConvOclDirectFwdFused:16,16,32,32,2,2,8,1,2;ConvOclDirectFwd:16,16,16,32,1,2,8,1,2
384-13-13-3x3-384-13-13-16-1x1-1x1-1x1-0-NCHW-FP32-W=ConvAsmBwdWrW3x3:0,1,8,4,3,1
256-27-27-1x1-32-27-27-256-0x0-1x1-1x1-0-NCHW-FP16-W=ConvAsmBwdWrW1x1:4,4,4,4,2,1,4,4,0,2
1968-14-14-1x1-192-14-14-16-0x0-1x1-1x1-0-NCHW-FP16-F=ConvAsm1x1U:2,8,4,64,1,4,2,2;ConvOclDirectFwd1x1:1,64,1,1,0,2,8,4,0
192-17-17-1x1-1024-17-17-32-0x0-1x1-1x1-0-NCHW-FP32-W=ConvAsmBwdWrW1x1:1,16,4,8,4,1,2,4,0,1
928-14-14-1x1-128-14-14-128-0x0-1x1-1x1-0-NCHW-FP16-B=ConvAsm1x1U:1,16,2,16,1,2,2,4;ConvOclDirectFwd1x1:1,256,1,1,0,2,8,4,0
512-14-14-1x1-64-14-14-8-0x0-1x1-1x1-0-NCHW-FP32-F=ConvAsm1x1U:2,8,2,64,1,4,4,1;ConvActivAsm1x1U:1,16,2,64,1,4;ConvOclDirectFwd1x1:1,64,1,1,1,1,16,64,0
64-56-56-1x1-128-56-56-64-0x0-1x1-1x1-0-NCHW-FP32-B=ConvAsm1x1U:1,32,1,64,1,1,1,1;ConvOclDirectFwd1x1:1,64,1,1,0,1,32,4,0
528-14-14-1x1-128-14-14-32-0x0-1x1-1x1-0-NCHW-FP16-F=ConvAsm1x1U:2,8,4,64,1,2,2,8;ConvOclDirectFwd1x1:1,128,1,1,0,4,8,4,0
64-28-28-1x1-192-28-28-16-0x0-1x1-1x1-0-NCHW-FP16-B=ConvAsm1x1U:1,16,2,16,1,2,2,2;ConvOclDirectFwd1x1:1,256,1,1,0,2,8,4,0
160-17-17-1x1-768-17-17-1-0x0-1x1-1x1-0-NCHW-FP32-W=ConvAsmBwdWrW1x1:1,16,2,4,2,1,1,4,0,0
1776-7-7-1x1-192-7-7-16-0x0-1x1-1x1-0-NCHW-FP32-F=ConvAsm1x1U:4,8,4,16,1,4,4,2;ConvActivAsm1x1U:1,16,1,64,4,4;ConvOclDirectFwd1x1:1,64,1,1,1,0,16,256,0
96-28-28-1x1-192-28-28-256-0x0-1x1-1x1-0-NCHW-FP32-W=ConvAsmBwdWrW1x1:4,4,4,4,4,1,2,4,0,1
512-7-7-1x1-2048-7-7-512-0x0-1x1-1x1-0-NCHW-FP16-F=ConvAsm1x1U:2,8,4,16,1,4,1,4;ConvOclDirectFwd1x1:8,64,8,8,0,1,16,4,1
128-28-28-1x1-512-28-28-2-0x0-1x1-1x1-0-NCHW-FP16-F=ConvAsm1x1U:1,8,2,64,1,4,2,4;ConvOclDirectFwd1x1:1,64,1,1,0,2,8,4,0
32-28-28-1x1-192-28-28-1-0x0-1x1-1x1-0-NCHW-FP32-W=ConvAsmBwdWrW1x1:4,4,2,4,2,1,1,4,0,1
256-55-55-1x1-64-55-55-32-0x0-1x1-1x1-0-NCHW-FP32-B=ConvAsm1x1U:1,16,1,64,2,2,1,4;ConvOclDirectFwd1x1:1,256,1,1,0,1,32,4,0
192-7-7-1x1-1344-7-7-16-0x0-1x1-1x1-0-NCHW-FP32-W=ConvAsmBwdWrW1x1:1,16,2,4,8,1,1,4,0,3
320-8-8-1x1-2048-8-8-1-0x0-1x1-1x1-0-NCHW-FP32-B=ConvAsm1x1U:1,8,1,64,1,4,2,2;ConvOclDirectFwd1x1:1,128,1,1,0,1,4,8,0
256-28-28-1x1-32-28-28-32-0x0-1x1-1x1-0-NCHW-FP16-F=ConvAsm1x1U:1,8,2,64,1,4,2,2;ConvOclDirectFwd1x1:1,64,1,1,0,2,8,4,0
32-14-14-1x1-528-14-14-32-0x0-1x1-1x1-0-NCHW-FP16-B=ConvAsm1x1U:1,8,2,16,1,4,1,4;ConvOclDirectFwd1x1:1,128,1,1,0,4,8,4,0
192-14-14-1x1-512-14-14-2-0x0-1x1-1x1-0-NCHW-FP32-B=ConvAsm1x1U:2,8,2,64,1,2,2,2;ConvOclDirectFwd1x1:1,128,1,1,0,4,4,4,0
128-28-28-1x1-512-28-28-8-0x0-1x1-1x1-0-NCHW-FP32-B=ConvAsm1x1U:1,16,1,32,1,2,1,2;ConvOclDirectFwd1x1:1,128,1,1,0,2,16,4,0
160-14-14-3x3-320-14-14-1-1x1-1x1-1x1-0-NCHW-FP16-F=ConvOclDirectFwdFused:16,16,16,16,1,1,2,4,1;ConvOclDirectFwd:16,16,16,16,1,1,2,2,1
336-56-56-1x1-192-56-56-16-0x0-1x1-1x1-0-NCHW-FP32-F=ConvAsm1x1U:1,16,1,64,4,2,4,1;ConvActivAsm1x1U:2,16,3,64,2,1;ConvOclDirectFwd1x1:1,64,1,1,1,1,32,2048,0
64-14-14-5x5-32-14-14-512-2x2-1x1-1x1-0-NCHW-FP32-B=ConvOclDirectFwd:8,8,16,16,2,2,8,2,1
16-54-54-1x1-96-54-54-256-0x0-1x1-1x1-0-NCHW-FP32-F=ConvAsm1x1U:1,16,1,32,1,2,2,2;ConvOclDirectFwd1x1:1,64,1,1,1,1,16,128,0
32-7-7-5x5-128-7-7-8-2x2-1x1-1x1-0-NCHW-FP32-F=ConvOclDirectFwdFused:8,8,8,8,1,1,2,4,2;ConvOclDirectFwd:8,8,8,8,1,1,2,2,2
64-14-14-5x5-24-14-14-128-2x2-1x1-1x1-0-NCHW-FP32-B=ConvOclDirectFwd:16,16,16,16,4,4,1,1,2
288-14-14-1x1-128-14-14-512-0x0-1x1-1x1-0-NCHW-FP16-F=ConvAsm1x1U:2,8,4,32,1,4,1,8;ConvOclDirectFwd1x1:1,256,1,1,0,2,8,4,0
512-28-28-1x1-128-28-28-16-0x0-1x1-1x1-0-NCHW-FP16-W=ConvAsmBwdWrW1x1:4,4,8,4,2,2,1,2,0,1
48-35-35-1x1-192-35-35-16-0x0-1x1-1x1-0-NCHW-FP32-B=ConvAsm1x1U:1,16,1,64,1,2,2,1;ConvOclDirectFwd1x1:1,64,1,1,0,1,16,8,0
256-14-14-1x1-128-28-28-128-0x0-2x2-1x1-0-NCHW-FP16-B=ConvAsm1x1U:1,8,2,32,2,4,1,4;ConvOclDirectFwd1x1:1,128,1,1,0,1,16,8,0
192-13-13-3x3-384-13-13-16-1x1-1x1-1x1-0-NCHW-FP32-W=ConvAsmBwdWrW3x3:0,0,16,4,2,1
3-1024-2048-7x7-64-512-1024-1-3x3-2x2-1x1-0-NCHW-FP32-F=ConvOclDirectFwd:16,16,16,32,1,2,8,1,1
96-35-35-1x1-384-35-35-256-0x0-1x1-1x1-0-NCHW-FP32-B=ConvAsm1x1U:1,16,1,64,2,2,1,4;ConvOclDirectFwd1x1:1,256,1,1,0,1,32,4,0
512-14-14-1x1-1024-14-14-64-0x0-1x1-1x1-0-NCHW-FP32-W=ConvAsmBwdWrW1x1:1,16,4,8,4,1,1,4,0,2
192-7-7-1x1-1968-7-7-16-0x0-1x1-1x1-0-NCHW-FP16-W=ConvAsmBwdWrW1x1:1,16,4,8,2,1,1,4,0,1
992-7-7-1x1-128-7-7-512-0x0-1x1-1x1-0-NCHW-FP16-F=ConvAsm1x1U:2,8,4,16,1,4,1,8;ConvOclDirectFwd1x1:1,64,1,1,0,1,8,4,0
1-161-700-5x5-64-80-349-16-1x1-2x2-1x1-0-NCHW-FP32-F=ConvOclDirectFwd:8,32,16,32,2,1,8,1,2
1-7-7-3x3-1-5-5-64-0x0-1x1-1x1-0-NCHW-FP32-F=ConvOclDirectFwd:8,8,8,8,1,1,8,2,1
192-128-256-1x1-64-128-256-1-0x0-1x1-1x1-0-NCHW-FP32-F=ConvOclDirectFwd1x1:1,64,1,1,1,1,16,2048,0
32-14-14-1x1-528-14-14-512-0x0-1x1-1x1-0-NCHW-FP16-W=ConvAsmBwdWrW1x1:2,8,8,4,2,1,4,4,0,2
256-13-13-3x3-64-13-13-512-1x1-1x1-1x1-0-NCHW-FP16-F=ConvOclDirectFwd:8,8,16,16,2,2,8,1,1
224-14-14-3x3-112-14-14-64-1x1-1x1-1x1-0-NCHW-FP16-B=ConvOclDirectFwd:8,8,16,16,2,2,4,1,2
128-28-28-3x3-128-58-58-256-0x0-2x2-1x1-0-NCHW-FP16-B=ConvOclDirectFwd:16,8,32,32,2,4,4,2,2
256-14-14-1x1-128-14-14-256-0x0-1x1-1x1-0-NCHW-FP32-W=ConvAsmBwdWrW1x1:2,8,4,8,2,1,4,4,0,1
2048-8-8-1x1-192-8-8-128-0x0-1x1-1x1-0-NCHW-FP32-F=ConvAsm1x1U:4,8,4,16,2,2,1,4;ConvActivAsm1x1U:1,16,2,32,2,2;ConvOclDirectFwd1x1:1,64,1,1,1,1,16,256,0
384-8-8-1x1-1536-8-8-16-0x0-1x1-1x1-0-NCHW-FP32-B=ConvAsm1x1U:1,16,1,64,2,2,2,4;ConvOclDirectFwd1x1:1,256,1,1,0,2,16,4,0
32-64-128-5x5-64-64-128-1-2x2-1x1-1x1-0-NCHW-FP32-F=ConvOclDirectFwdFused:8,32,16,32,2,1,4,4,1;ConvOclDirectFwd:8,32,16,32,2,1,4,4,1
192-7-7-1x1-1392-7-7-16-0x0-1x1-1x1-0-NCHW-FP16-B=ConvAsm1x1U:2,16,4,16,1,2,2,1;ConvOclDirectFwd1x1:1,128,1,1,0,1,8,4,0
384-13-13-3x3-256-13-13-64-1x1-1x1-1x1-0-NCHW-FP32-W=ConvAsmBwdWrW3x3:0,1,8,4,3,1
1776-14-14-1x1-192-14-14-16-0x0-1x1-1x1-0-NCHW-FP16-F=ConvAsm1x1U:2,8,4,64,1,4,2,2;ConvOclDirectFwd1x1:1,64,1,1,0,4,8,4,0
576-14-14-1x1-160-14-14-64-0x0-1x1-1x1-0-NCHW-FP16-F=ConvAsm1x1U:2,8,4,64,1,4,1,8;ConvOclDirectFwd1x1:1,64,1,1,0,4,8,4,0
64-28-28-1x1-256-28-28-4-0x0-1x1-1x1-0-NCHW-FP32-B=ConvAsm1x1U:1,16,1,32,1,1,2,1;ConvOclDirectFwd1x1:1,64,1,1,0,1,8,4,0
64-55-55-1x1-64-55-55-1-0x0-1x1-1x1-0-NCHW-FP32-W=ConvAsmBwdWrW1x1:8,2,2,2,2,1,1,4
96-28-28-1x1-192-28-28-8-0x0-1x1-1x1-0-NCHW-FP32-W=ConvAsmBwdWrW1x1:2,8,2,2,8,1,4,4,0,0
64-28-28-1x1-256-28-28-512-0x0-1x1-1x1-0-NCHW-FP16-W=ConvAsmBwdWrW1x1:4,4,4,4,4,1,4,4,0,2
384-13-13-3x3-192-13-13-64-1x1-1x1-1x1-0-NCHW-FP32-W=ConvAsmBwdWrW3x3:0,1,16,4,2,1
64-14-14-1x1-480-14-14-128-0x0-1x1-1x1-0-NCHW-FP16-W=ConvAsmBwdWrW1x1:2,8,4,8,2,1,4,4,0,1
16-54-54-1x1-64-54-54-16-0x0-1x1-1x1-0-NCHW-FP16-F=ConvAsm1x1U:1,8,2,32,1,2,1,2;ConvOclDirectFwd1x1:1,256,1,1,0,2,8,4,0
256-13-13-3x3-64-13-13-64-1x1-1x1-1x1-0-NCHW-FP16-B=ConvOclDirectFwd:8,8,16,16,2,2,4,1,2
256-56-56-3x3-256-56-56-128-1x1-1x1-1x1-0-NCHW-FP16-W=ConvAsmBwdWrW3x3:0,0,16,4,2,1
128-14-14-3x3-128-14-14-32-1x1-1x1-1x1-0-NCHW-FP16-B=ConvOclDirectFwd:8,16,16,16,2,1,8,1,2
64-147-147-3x3-32-147-147-128-1x1-1x1-1x1-0-NCHW-FP16-B=ConvOclDirectFwd:16,16,32,32,2,2,8,2,1
480-14-14-1x1-64-14-14-16-0x0-1x1-1x1-0-NCHW-FP16-F=ConvAsm1x1U:1,8,2,64,1,4,4,4;ConvOclDirectFwd1x1:1,256,1,1,0,4,4,4,0
800-14-14-1x1-128-14-14-16-0x0-1x1-1x1-0-NCHW-FP32-W=ConvAsmBwdWrW1x1:2,8,4,4,4,1,2,4,0,0
256-56-56-3x3-256-56-56-4-1x1-1x1-1x1-0-NCHW-FP32-W=ConvAsmBwdWrW3x3:0,0,16,4,3,1
96-28-28-1x1-192-28-28-16-0x0-1x1-1x1-0-NCHW-FP16-W=ConvAsmBwdWrW1x1:4,4,4,1,8,1,1,4,0,1
544-7-7-1x1-128-7-7-512-0x0-1x1-1x1-0-NCHW-FP32-B=ConvAsm1x1U:1,16,1,64,2,2,2,2;ConvOclDirectFwd1x1:1,128,1,1,0,1,16,8,0
160-14-14-1x1-528-14-14-1-0x0-1x1-1x1-0-NCHW-FP16-B=ConvAsm1x1U:1,8,2,64,1,2,4,1;ConvOclDirectFwd1x1:1,128,1,1,0,1,4,4,0
64-28-28-1x1-320-28-28-32-0x0-1x1-1x1-0-NCHW-FP16-B=ConvAsm1x1U:1,16,2,16,1,2,1,4;ConvOclDirectFwd1x1:1,64,1,1,0,4,16,4,0
64-28-28-1x1-256-28-28-256-0x0-1x1-1x1-0-NCHW-FP32-F=ConvAsm1x1U:1,16,1,16,3,2,1,2;ConvOclDirectFwd1x1:1,64,1,1,1,1,32,64,0
64-112-112-1x1-64-112-112-16-0x0-1x1-1x1-0-NCHW-FP32-W=ConvAsmBwdWrW1x1:4,4,4,4,2,1,4,4,0,1
64-75-75-1x1-128-38-38-32-0x0-2x2-1x1-0-NCHW-FP32-F=ConvAsm1x1U:1,16,1,64,3,2,1,2;ConvOclDirectFwd1x1:1,64,1,1,1,0,32,256,0
64-147-147-3x3-96-73-73-1-0x0-2x2-1x1-0-NCHW-FP32-F=ConvOclDirectFwd:16,16,16,32,1,2,8,2,1
48-35-35-5x5-64-35-35-4-2x2-1x1-1x1-0-NCHW-FP16-F=ConvOclDirectFwdFused:8,16,16,16,2,1,4,1,2;ConvOclDirectFwd:8,16,16,16,2,1,4,1,2
160-14-14-1x1-528-14-14-8-0x0-1x1-1x1-0-NCHW-FP16-W=ConvAsmBwdWrW1x1:2,8,4,8,2,1,2,4,0,0
16-54-54-1x1-64-54-54-512-0x0-1x1-1x1-0-NCHW-FP32-F=ConvAsm1x1U:1,16,1,64,1,2,2,2;ConvOclDirectFwd1x1:1,64,1,1,1,4,16,128,0
1440-14-14-1x1-192-14-14-16-0x0-1x1-1x1-0-NCHW-FP32-F=ConvAsm1x1U:4,16,4,64,1,2,4,1;ConvActivAsm1x1U:2,16,3,16,4,4;ConvOclDirectFwd1x1:1,64,1,1,1,0,16,256,0
16-54-54-1x1-128-54-54-128-0x0-1x1-1x1-0-NCHW-FP16-W=ConvAsmBwdWrW1x1:4,4,2,2,2,1,4,4,0,2
1024-14-14-1x1-512-14-14-32-0x0-1x1-1x1-0-NCHW-FP32-W=ConvAsmBwdWrW1x1:1,16,2,4,8,1,1,4,0,0
512-14-14-1x1-128-14-14-64-0x0-1x1-1x1-0-NCHW-FP32-W=ConvAsmBwdWrW1x1:2,8,4,8,2,1,2,4,0,2
128-27-27-1x1-32-27-27-32-0x0-1x1-1x1-0-NCHW-FP32-B=ConvAsm1x1U:1,16,1,64,1,2,2,1;ConvOclDirectFwd1x1:1,256,1,1,0,1,16,8,0
528-64-128-1x1-32-64-128-1-0x0-1x1-1x1-0-NCHW-FP16-F=ConvOclDirectFwd1x1:1,256,1,1,0,2,4,4,0
256-27-27-1x1-48-27-27-256-0x0-1x1-1x1-0-NCHW-FP32-B=ConvAsm1x1U:3,16,3,64,1,1,1,1;ConvOclDirectFwd1x1:1,256,1,1,0,1,16,8,0
192-35-35-1x1-384-35-35-256-0x0-1x1-1x1-0-NCHW-FP32-W=ConvAsmBwdWrW1x1:1,16,2,8,4,1,2,4,0,2
96-14-14-1x1-480-14-14-32-0x0-1x1-1x1-0-NCHW-FP16-W=ConvAsmBwdWrW1x1:4,4,4,4,4,1,2,2,0,1
192-35-35-1x1-384-35-35-4-0x0-1x1-1x1-0-NCHW-FP16-W=ConvAsmBwdWrW1x1:2,8,4,8,2,1,2,4,0,1
256-17-17-3x3-224-35-35-1-0x0-2x2-1x1-0-NCHW-FP32-B=ConvOclDirectFwd:8,16,16,16,2,1,2,2,1
256-80-128-3x3-256-80-128-16-1x1-1x1-1x1-0-NCHW-FP16-F=ConvOclDirectFwd:16,8,16,32,1,4,8,1,2
3-224-224-3x3-64-224-224-16-1x1-1x1-1x1-0-NCHW-FP16-W=ConvAsmBwdWrW3x3:0,0,16,1,2,4
128-27-27-1x1-32-27-27-128-0x0-1x1-1x1-0-NCHW-FP32-W=ConvAsmBwdWrW1x1:4,4,2,4,2,1,4,2,0,2
512-28-28-3x3-256-28-28-128-1x1-1x1-1x1-0-NCHW-FP16-B=ConvOclDirectFwd:32,8,32,32,1,4,8,2,1
672-14-14-1x1-192-14-14-16-0x0-1x1-1x1-0-NCHW-FP16-F=ConvAsm1x1U:2,8,4,64,1,4,2,1;ConvOclDirectFwd1x1:1,64,1,1,0,2,8,4,0
2048-7-7-1x1-1024-4-4-16-0x0-2x2-1x1-0-NCHW-FP16-F=ConvAsm1x1U:2,4,4,4,1,4,2,4;ConvOclDirectFwd1x1:1,64,1,1,0,2,4,8,0
128-7-7-1x1-768-7-7-32-0x0-1x1-1x1-0-NCHW-FP16-B=ConvAsm1x1U:2,16,4,16,1,2,2,1;ConvOclDirectFwd1x1:1,256,1,1,0,1,4,4,0
608-7-7-1x1-128-7-7-16-0x0-1x1-1x1-0-NCHW-FP16-F=ConvAsm1x1U:1,8,2,16,1,4,4,1;ConvOclDirectFwd1x1:1,64,1,1,0,1,4,4,0
128-28-28-3x3-96-28-28-8-1x1-1x1-1x1-0-NCHW-FP16-W=ConvAsmBwdWrW3x3:0,0,8,4,2,2
128-7-7-1x1-960-7-7-16-0x0-1x1-1x1-0-NCHW-FP16-F=ConvAsm1x1U:2,8,4,16,1,4,2,4;ConvOclDirectFwd1x1:1,64,1,1,0,1,8,4,0
320-8-8-1x1-1280-8-8-4-0x0-1x1-1x1-0-NCHW-FP32-W=ConvAsmBwdWrW1x1:1,16,2,4,4,1,1,4,0,1
128-28-28-1x1-288-28-28-128-0x0-1x1-1x1-0-NCHW-FP32-B=ConvAsm1x1U:1,16,1,32,2,1,1,2;ConvOclDirectFwd1x1:1,64,1,1,0,1,32,4,0
96-73-73-3x3-64-147-147-256-0x0-2x2-1x1-0-NCHW-FP32-B=ConvOclDirectFwd:32,16,32,32,1,2,8,2,2
192-7-7-1x1-1776-7-7-16-0x0-1x1-1x1-0-NCHW-FP16-B=ConvAsm1x1U:2,8,4,16,1,4,2,2;ConvOclDirectFwd1x1:1,64,1,1,0,1,8,4,0
48-35-35-5x5-64-35-35-1-2x2-1x1-1x1-0-NCHW-FP16-F=ConvOclDirectFwdFused:16,16,16,16,1,1,2,4,1;ConvOclDirectFwd:16,16,16,16,1,1,2,4,1
576-14-14-1x1-128-14-14-128-0x0-1x1-1x1-0-NCHW-FP32-B=ConvAsm1x1U:1,32,2,16,1,1,2,2;ConvOclDirectFwd1x1:1,64,1,1,0,2,16,4,0
800-7-7-1x1-128-7-7-512-0x0-1x1-1x1-0-NCHW-FP16-F=ConvAsm1x1U:2,8,4,16,1,4,1,2;ConvOclDirectFwd1x1:1,64,1,1,0,1,8,4,0
3-32-32-1x1-3-32-32-64-0x0-1x1-1x1-0-NCHW-FP32-B=ConvAsm1x1U:4,1,4,4,3,1,1,2;ConvOclDirectFwd1x1:1,64,1,1,0,2,16,4,0
192-7-7-1x1-1824-7-7-16-0x0-1x1-1x1-0-NCHW-FP32-W=ConvAsmBwdWrW1x1:1,16,2,8,4,1,1,4,0,1
128-7-7-1x1-768-7-7-16-0x0-1x1-1x1-0-NCHW-FP32-F=ConvAsm1x1U:2,8,2,32,1,4,1,4;ConvOclDirectFwd1x1:1,64,1,1,1,1,16,256,0
24-5-5-3x3-256-5-5-32-1x1-1x1-1x1-0-NCHW-FP32-W=ConvAsmBwdWrW3x3:0,0,8,2,5,3
128-14-14-3x3-32-14-14-128-1x1-1x1-1x1-0-NCHW-FP16-B=ConvOclDirectFwd:8,16,16,16,2,1,8,1,2
384-35-35-1x1-96-35-35-128-0x0-1x1-1x1-0-NCHW-FP16-F=ConvAsm1x1U:4,8,8,32,1,4,1,4;ConvOclDirectFwd1x1:1,128,1,1,0,1,16,4,0
64-28-28-1x1-320-28-28-32-0x0-1x1-1x1-0-NCHW-FP16-W=ConvAsmBwdWrW1x1:4,4,4,1,8,1,1,4,0,1
736-14-14-1x1-128-14-14-128-0x0-1x1-1x1-0-NCHW-FP32-W=ConvAsmBwdWrW1x1:2,8,4,4,4,1,2,4,0,0
80-73-73-1x1-64-73-73-128-0x0-1x1-1x1-0-NCHW-FP16-B=ConvAsm1x1U:1,16,2,64,1,2,1,2;ConvOclDirectFwd1x1:16,64,32,32,0,1,16,4,1
320-14-14-1x1-128-14-14-16-0x0-1x1-1x1-0-NCHW-FP32-W=ConvAsmBwdWrW1x1:2,8,2,4,2,1,1,4,0,1
32-147-147-3x3-64-147-147-256-1x1-1x1-1x1-0-NCHW-FP16-F=ConvOclDirectFwdFused:16,16,32,32,2,2,8,2,1;ConvOclDirectFwd:16,16,32,32,2,2,8,2,1
128-28-28-1x1-512-28-28-2-0x0-1x1-1x1-0-NCHW-FP32-W=ConvAsmBwdWrW1x1:2,8,2,4,4,1,1,4,0,1
128-7-7-1x1-608-7-7-16-0x0-1x1-1x1-0-NCHW-FP32-F=ConvAsm1x1U:1,8,1,64,2,4,2,2;ConvOclDirectFwd1x1:1,64,1,1,1,4,16,2048,0
256-8-8-1x1-1536-8-8-1-0x0-1x1-1x1-0-NCHW-FP16-W=ConvAsmBwdWrW1x1:1,16,2,4,2,1,1,4,0,1
1280-8-8-1x1-384-8-8-256-0x0-1x1-1x1-0-NCHW-FP16-F=ConvAsm1x1U:1,8,2,32,4,4,1,8;ConvOclDirectFwd1x1:1,256,1,1,0,4,8,4,0
192-28-28-1x1-16-28-28-256-0x0-1x1-1x1-0-NCHW-FP32-F=ConvAsm1x1U:3,16,3,64,1,2,4,1;ConvActivAsm1x1U:1,16,1,32,2,3;ConvOclDirectFwd1x1:1,64,1,1,1,0,32,2048,0
512-7-7-1x1-128-7-7-512-0x0-1x1-1x1-0-NCHW-FP32-B=ConvAsm1x1U:1,16,1,64,2,2,2,2;ConvOclDirectFwd1x1:1,64,1,1,0,1,16,4,0
1000-13-13-1x1-512-13-13-256-0x0-1x1-1x1-0-NCHW-FP16-B=ConvAsm1x1U:3,16,6,32,1,2,1,2;ConvOclDirectFwd1x1:1,64,1,1,0,1,16,4,0
736-14-14-1x1-128-14-14-32-0x0-1x1-1x1-0-NCHW-FP16-F=ConvAsm1x1U:2,8,4,64,1,4,2,4;ConvOclDirectFwd1x1:1,256,1,1,0,4,4,4,0
256-56-56-1x1-64-56-56-4-0x0-1x1-1x1-0-NCHW-FP32-W=ConvAsmBwdWrW1x1:2,8,2,8,2,1,4,4,0,1
128-54-54-1x1-16-54-54-16-0x0-1x1-1x1-0-NCHW-FP32-F=ConvAsm1x1U:2,8,2,64,1,2,2,2;ConvOclDirectFwd1x1:1,64,1,1,1,0,32,128,0
192-27-27-5x5-64-27-27-256-2x2-1x1-1x1-0-NCHW-FP16-B=ConvOclDirectFwd:16,16,32,32,2,2,8,4,2
64-56-56-1x1-128-56-56-32-0x0-1x1-1x1-0-NCHW-FP32-B=ConvAsm1x1U:1,32,1,64,1,1,1,1;ConvOclDirectFwd1x1:1,256,1,1,0,2,16,4,0
640-7-7-1x1-128-7-7-16-0x0-1x1-1x1-0-NCHW-FP16-F=ConvAsm1x1U:1,8,2,16,1,4,4,1;ConvOclDirectFwd1x1:1,64,1,1,0,1,4,4,0
576-4-4-1x1-128-4-4-32-0x0-1x1-1x1-0-NCHW-FP16-F=ConvAsm1x1U:1,4,2,4,1,4,4,2;ConvOclDirectFwd1x1:1,64,1,1,0,1,4,4,0
320-28-28-1x1-128-28-28-256-0x0-1x1-1x1-0-NCHW-FP16-F=ConvAsm1x1U:3,8,6,16,1,4,1,4;ConvOclDirectFwd1x1:1,256,1,1,0,4,8,4,0
448-28-28-1x1-128-28-28-16-0x0-1x1-1x1-0-NCHW-FP16-F=ConvAsm1x1U:1,8,2,32,1,4,1,4;ConvOclDirectFwd1x1:1,128,1,1,0,2,8,4,0
512-14-14-1x1-32-14-14-8-0x0-1x1-1x1-0-NCHW-FP16-F=ConvAsm1x1U:1,8,2,16,1,4,4,1;ConvOclDirectFwd1x1:1,256,1,1,0,4,4,4,0
256-14-14-1x1-1024-14-14-32-0x0-1x1-1x1-0-NCHW-FP32-F=ConvAsm1x1U:4,16,4,64,1,2,1,2;ConvActivAsm1x1U:2,16,2,64,3,4;ConvOclDirectFwd1x1:1,64,1,1,1,0,16,2048,0
128-64-128-5x5-32-64-128-1-2x2-1x1-1x1-0-NCHW-FP16-B=ConvOclDirectFwd:8,32,16,32,2,1,4,2,1
64-28-28-1x1-256-28-28-16-0x0-1x1-1x1-0-NCHW-FP16-B=ConvAsm1x1U:1,16,2,16,1,2,2,2;ConvOclDirectFwd1x1:1,64,1,1,0,4,16,4,0
512-14-14-1x1-128-28-28-16-0x0-2x2-1x1-0-NCHW-FP32-B=ConvAsm1x1U:4,8,4,64,1,4,2,2;ConvOclDirectFwd1x1:1,128,1,1,0,1,8,8,0
480-14-14-1x1-96-14-14-512-0x0-1x1-1x1-0-NCHW-FP16-F=ConvAsm1x1U:2,8,4,64,1,4,1,4;ConvOclDirectFwd1x1:8,64,16,16,0,2,16,4,1
576-14-14-1x1-64-14-14-64-0x0-1x1-1x1-0-NCHW-FP16-F=ConvAsm1x1U:2,8,4,64,1,4,2,4;ConvOclDirectFwd1x1:1,64,1,1,0,2,8,4,0
192-14-14-1x1-512-14-14-2-0x0-1x1-1x1-0-NCHW-FP16-W=ConvAsmBwdWrW1x1:4,4,4,4,2,2,1,2,0,0
128-28-28-1x1-352-28-28-128-0x0-1x1-1x1-0-NCHW-FP32-F=ConvAsm1x1U:1,16,1,32,4,2,2,2;ConvOclDirectFwd1x1:1,64,1,1,1,4,16,2048,0
192-28-28-1x1-64-28-28-2-0x0-1x1-1x1-0-NCHW-FP32-F=ConvAsm1x1U:4,8,5,32,1,2,4,1;ConvActivAsm1x1U:1,16,1,32,1,4;ConvOclDirectFwd1x1:1,64,1,1,1,0,16,2048,0
128-28-28-3x3-192-28-28-4-1x1-1x1-1x1-0-NCHW-FP16-F=ConvOclDirectFwdFused:16,16,32,32,2,2,4,4,2;ConvOclDirectFwd:16,16,32,32,2,2,4,4,2
32-28-28-5x5-96-28-28-128-2x2-1x1-1x1-0-NCHW-FP32-F=ConvOclDirectFwdFused:16,16,32,32,2,2,8,1,2;ConvOclDirectFwd:16,16,32,32,2,2,8,1,2
32-28-28-1x1-256-28-28-4-0x0-1x1-1x1-0-NCHW-FP32-W=ConvAsmBwdWrW1x1:4,4,2,2,2,1,1,4,0,1
192-7-7-1x1-832-7-7-1-0x0-1x1-1x1-0-NCHW-FP32-B=ConvAsm1x1U:1,8,1,32,1,2,4,1;ConvOclDirectFwd1x1:1,128,1,1,0,1,4,4,0
64-73-73-1x1-160-73-73-64-0x0-1x1-1x1-0-NCHW-FP32-B=ConvAsm1x1U:1,16,1,64,1,2,1,2;ConvOclDirectFwd1x1:1,64,1,1,0,1,32,4,0
64-13-13-3x3-256-13-13-128-1x1-1x1-1x1-0-NCHW-FP16-W=ConvAsmBwdWrW3x3:0,0,8,4,10,1
128-14-14-1x1-736-14-14-256-0x0-1x1-1x1-0-NCHW-FP32-F=ConvAsm1x1U:4,16,4,64,1,2,1,4;ConvOclDirectFwd1x1:1,64,1,1,1,1,64,2048,0
1024-13-13-3x3-512-13-13-128-1x1-1x1-1x1-0-NCHW-FP32-W=ConvAsmBwdWrW3x3:0,1,8,4,2,1
512-14-14-1x1-128-28-28-8-0x0-2x2-1x1-0-NCHW-FP32-B=ConvAsm1x1U:1,16,1,64,1,2,4,1;ConvOclDirectFwd1x1:1,256,1,1,0,1,8,8,0
512-28-28-3x3-256-28-28-16-1x1-1x1-1x1-0-NCHW-FP16-B=ConvOclDirectFwd:32,8,32,32,1,4,8,2,2
48-35-35-1x1-192-35-35-4-0x0-1x1-1x1-0-NCHW-FP16-B=ConvAsm1x1U:1,16,2,32,1,2,2,2;ConvOclDirectFwd1x1:1,256,1,1,0,1,4,4,0
448-8-8-1x1-1280-8-8-256-0x0-1x1-1x1-0-NCHW-FP32-W=ConvAsmBwdWrW1x1:1,16,2,8,4,1,2,4,0,1
576-14-14-1x1-128-14-14-256-0x0-1x1-1x1-0-NCHW-FP32-B=ConvAsm1x1U:1,16,1,32,2,1,1,4;ConvOclDirectFwd1x1:1,256,1,1,0,4,16,4,0
96-35-35-3x3-96-35-35-32-1x1-1x1-1x1-0-NCHW-FP16-W=ConvAsmBwdWrW3x3:0,0,8,2,3,4
32-149-149-3x3-32-147-147-32-0x0-1x1-1x1-0-NCHW-FP32-F=ConvOclDirectFwd:16,16,16,32,1,2,8,4,2
128-27-27-1x1-32-27-27-128-0x0-1x1-1x1-0-NCHW-FP32-F=ConvAsm1x1U:2,16,2,64,2,2,1,1;ConvOclDirectFwd1x1:1,64,1,1,1,0,16,256,0
192-7-7-1x1-1488-7-7-16-0x0-1x1-1x1-0-NCHW-FP32-W=ConvAsmBwdWrW1x1:1,16,2,8,4,1,2,4,0,2
256-38-38-3x3-128-38-38-32-1x1-1x1-1x1-0-NCHW-FP32-W=ConvAsmBwdWrW3x3:0,0,16,4,2,1
864-7-7-1x1-128-7-7-64-0x0-1x1-1x1-0-NCHW-FP32-W=ConvAsmBwdWrW1x1:4,4,4,4,4,1,1,4,0,0
256-52-52-3x3-128-52-52-32-1x1-1x1-1x1-0-NCHW-FP32-W=ConvAsmBwdWrW3x3:0,0,8,4,2,1
128-7-7-3x3-32-7-7-32-1x1-1x1-1x1-0-NCHW-FP16-F=ConvOclDirectFwd:8,8,8,8,1,1,1,4,2
128-6-60-3x3-64-6-60-1-1x1-1x1-1x1-0-NCHW-FP16-B=ConvOclDirectFwd:8,16,8,16,1,1,1,4,1
832-14-14-1x1-128-14-14-128-0x0-1x1-1x1-0-NCHW-FP32-B=ConvAsm1x1U:1,32,1,32,2,1,2,2;ConvOclDirectFwd1x1:8,64,16,16,0,2,16,4,1
320-8-8-1x1-2048-8-8-128-0x0-1x1-1x1-0-NCHW-FP16-B=ConvAsm1x1U:1,16,2,32,1,2,1,8;ConvOclDirectFwd1x1:1,64,1,1,0,4,16,4,0
832-7-7-1x1-192-7-7-1-0x0-1x1-1x1-0-NCHW-FP16-F=ConvAsm1x1U:1,8,2,16,1,4,4,1;ConvOclDirectFwd1x1:1,128,1,1,0,1,4,8,0
128-10-10-1x1-512-10-10-32-0x0-1x1-1x1-0-NCHW-FP32-W=ConvAsmBwdWrW1x1:4,4,4,4,2,1,1,4,0,1
224-35-35-3x3-256-17-17-64-0x0-2x2-1x1-0-NCHW-FP32-F=ConvOclDirectFwd:8,32,32,32,4,1,8,1,1
16-54-54-3x3-64-54-54-16-1x1-1x1-1x1-0-NCHW-FP32-B=ConvAsm3x3U:5,8,3;ConvOclDirectFwd:8,32,16,32,2,1,8,2,2
512-14-14-1x1-1024-14-14-16-0x0-1x1-1x1-0-NCHW-FP16-W=ConvAsmBwdWrW1x1:1,16,8,8,2,1,1,2,0,1
512-28-28-1x1-128-28-28-2-0x0-1x1-1x1-0-NCHW-FP32-B=ConvAsm1x1U:2,16,2,64,1,2,4,1;ConvOclDirectFwd1x1:1,64,1,1,0,1,4,8,0
3-32-32-1x1-3-32-32-512-0x0-1x1-1x1-0-NCHW-FP32-F=ConvAsm1x1U:4,1,4,4,2,1,2,1;ConvOclDirectFwd1x1:1,256,1,1,0,4,4,4,0
32-28-28-1x1-192-28-28-8-0x0-1x1-1x1-0-NCHW-FP32-W=ConvAsmBwdWrW1x1:2,8,2,4,2,1,4,4,0,1
128-7-7-3x3-32-7-7-16-1x1-1x1-1x1-0-NCHW-FP32-W=ConvAsmBwdWrW3x3:0,0,8,2,6,4
256-56-56-3x3-256-56-56-1-1x1-1x1-1x1-0-NCHW-FP16-F=ConvOclDirectFwdFused:16,16,16,32,1,2,8,2,1;ConvOclDirectFwd:8,32,16,32,2,1,8,2,1
112-14-14-1x1-512-14-14-256-0x0-1x1-1x1-0-NCHW-FP32-W=ConvAsmBwdWrW1x1:4,4,8,4,4,1,2,4,0,1
128-56-56-1x1-128-56-56-512-0x0-1x1-1x1-0-NCHW-FP32-B=ConvAsm1x1U:2,16,2,64,1,2,1,4;ConvOclDirectFwd1x1:1,64,1,1,0,2,32,4,0
64-14-14-5x5-32-14-14-64-2x2-1x1-1x1-0-NCHW-FP16-B=ConvOclDirectFwd:8,8,16,16,2,2,4,4,2
864-7-7-1x1-128-7-7-128-0x0-1x1-1x1-0-NCHW-FP16-F=ConvAsm1x1U:2,8,4,16,1,4,2,4
192-8-8-1x1-1280-8-8-1-0x0-1x1-1x1-0-NCHW-FP16-W=ConvAsmBwdWrW1x1:1,16,4,4,2,1,1,4,0,1
384-13-13-3x3-384-13-13-64-1x1-1x1-1x1-0-NCHW-FP16-F=ConvOclDirectFwdFused:8,8,16,16,2,2,8,1,1;ConvOclDirectFwd:8,8,16,16,2,2,8,1,1
64-56-56-1x1-256-56-56-512-0x0-1x1-1x1-0-NCHW-FP32-F=ConvAsm1x1U:1,16,1,64,3,2,1,2;ConvOclDirectFwd1x1:1,64,1,1,1,0,64,256,0
512-28-28-1x1-128-28-28-2-0x0-1x1-1x1-0-NCHW-FP16-F=ConvAsm1x1U:1,8,2,32,1,4,4,4;ConvOclDirectFwd1x1:1,64,1,1,0,2,4,4,0
192-28-28-1x1-32-28-28-32-0x0-1x1-1x1-0-NCHW-FP16-F=ConvAsm1x1U:1,8,2,32,1,4,2,2;ConvOclDirectFwd1x1:1,64,1,1,0,4,16,4,0
256-56-56-1x1-128-28-28-16-0x0-2x2-1x1-0-NCHW-FP32-F=ConvAsm1x1U:1,8,1,32,3,4,1,4;ConvOclDirectFwd1x1:1,64,1,1,1,4,16,256,0
96-14-14-1x1-576-14-14-32-0x0-1x1-1x1-0-NCHW-FP32-B=ConvAsm1x1U:1,16,1,32,2,2,1,4;ConvOclDirectFwd1x1:8,64,16,16,0,2,16,4,1
64-55-55-1x1-256-55-55-4-0x0-1x1-1x1-0-NCHW-FP32-F=ConvAsm1x1U:2,16,2,64,2,1;ConvOclDirectFwd1x1:1,64,1,1,1,1,16,256,0
96-14-14-1x1-480-14-14-16-0x0-1x1-1x1-0-NCHW-FP16-W=ConvAsmBwdWrW1x1:2,8,4,1,8,1,1,4,0,1
3-224-224-3x3-64-224-224-64-1x1-1x1-1x1-0-NCHW-FP32-F=ConvOclDirectFwdFused:8,32,32,32,4,1,4,1,1;ConvOclDirectFwd:8,32,32,32,4,1,4,1,2
128-14-14-1x1-608-14-14-64-0x0-1x1-1x1-0-NCHW-FP32-B=ConvAsm1x1U:1,16,1,32,4,2,1,2;ConvOclDirectFwd1x1:8,64,16,16,0,2,16,4,1
384-8-8-1x1-1280-8-8-64-0x0-1x1-1x1-0-NCHW-FP16-W=ConvAsmBwdWrW1x1:1,16,4,8,2,1,1,4,0,1
160-14-14-1x1-576-14-14-64-0x0-1x1-1x1-0-NCHW-FP16-B=ConvAsm1x1U:1,16,2,16,1,2,2,2;ConvOclDirectFwd1x1:1,64,1,1,0,4,8,4,0
128-7-7-1x1-864-7-7-32-0x0-1x1-1x1-0-NCHW-FP32-F=ConvAsm1x1U:1,8,1,64,2,4,2,4;ConvOclDirectFwd1x1:1,64,1,1,1,0,64,128,0
1-7-7-3x3-1-5-5-16-0x0-1x1-1x1-0-NCHW-FP32-F=ConvOclDirectFwd:8,8,8,8,1,1,1,1,2
1024-14-14-1x1-2048-7-7-2-0x0-2x2-1x1-0-NCHW-FP16-F=ConvAsm1x1U:1,8,2,32,1,4,4,4;ConvOclDirectFwd1x1:1,128,1,1,0,1,8,4,0
384-13-13-3x3-256-13-13-64-1x1-1x1-1x1-0-NCHW-FP16-W=ConvAsmBwdWrW3x3:0,1,8,4,2,1
5-10-10-3x3-3-10-10-32-1x1-1x1-1x1-0-NCHW-FP32-F=ConvOclDirectFwd:16,16,16,16,1,1,2,2,2
192-14-14-1x1-912-14-14-16-0x0-1x1-1x1-0-NCHW-FP32-B=ConvAsm1x1U:1,16,1,32,2,1,2,2;ConvOclDirectFwd1x1:1,128,1,1,0,2,16,4,0
192-35-35-3x3-192-71-71-8-0x0-2x2-1x1-0-NCHW-FP32-B=ConvOclDirectFwd:16,16,16,16,1,1,4,1,2
128-28-28-1x1-480-28-28-16-0x0-1x1-1x1-0-NCHW-FP16-B=ConvAsm1x1U:1,16,2,16,1,2,2,2;ConvOclDirectFwd1x1:1,256,1,1,0,4,16,4,0
128-7-7-1x1-992-7-7-32-0x0-1x1-1x1-0-NCHW-FP16-F=ConvAsm1x1U:2,8,4,16,1,4,1,8;ConvOclDirectFwd1x1:1,128,1,1,0,1,4,4,0
48-27-27-1x1-256-27-27-128-0x0-1x1-1x1-0-NCHW-FP16-B=ConvAsm1x1U:1,16,2,64,1,2,1,1;ConvOclDirectFwd1x1:1,256,1,1,0,1,16,4,0
256-38-38-1x1-256-38-38-32-0x0-1x1-1x1-0-NCHW-FP32-W=ConvAsmBwdWrW1x1:4,4,8,4,4,1,2,4,0,1
256-13-13-3x3-64-13-13-16-1x1-1x1-1x1-0-NCHW-FP16-F=ConvOclDirectFwd:8,16,16,16,2,1,2,4,2
64-56-56-1x1-128-56-56-512-0x0-1x1-1x1-0-NCHW-FP32-W=ConvAsmBwdWrW1x1:4,4,4,4,2,1,4,4,0,1
480-14-14-1x1-16-14-14-1-0x0-1x1-1x1-0-NCHW-FP16-F=ConvAsm1x1U:1,8,2,16,1,4,4,1;ConvOclDirectFwd1x1:1,64,1,1,0,4,4,4,0
256-28-28-3x3-256-14-14-128-1x1-2x2-1x1-0-NCHW-FP32-F=ConvOclDirectFwd:8,16,16,16,2,1,8,1,1
128-28-28-1x1-288-28-28-128-0x0-1x1-1x1-0-NCHW-FP32-W=ConvAsmBwdWrW1x1:2,8,2,4,4,1,2,4,0,1
256-3-3-3x3-128-5-5-64-0x0-1x1-1x1-0-NCHW-FP32-B=ConvOclDirectFwd:8,8,8,8,1,1,8,2,2
128-112-112-3x3-64-112-112-256-1x1-1x1-1x1-0-NCHW-FP16-F=ConvOclDirectFwd:16,8,16,32,1,4,8,1,2
64-224-224-3x3-3-224-224-32-1x1-1x1-1x1-0-NCHW-FP32-F=ConvAsm3x3U:5,3,7;ConvOclDirectFwd:16,16,32,32,2,2,8,2,1
128-28-28-3x3-128-28-28-1-1x1-1x1-1x1-0-NCHW-FP32-W=ConvAsmBwdWrW3x3:0,0,8,2,3,1
320-8-8-1x1-2048-8-8-256-0x0-1x1-1x1-0-NCHW-FP16-B=ConvAsm1x1U:1,16,2,32,1,2,1,8;ConvOclDirectFwd1x1:1,256,1,1,0,4,16,4,0
256-17-17-3x3-224-35-35-4-0x0-2x2-1x1-0-NCHW-FP32-B=ConvOclDirectFwd:8,8,16,16,2,2,4,1,1
64-27-27-1x1-256-27-27-64-0x0-1x1-1x1-0-NCHW-FP16-W=ConvAsmBwdWrW1x1:4,4,4,4,4,1,4,4,0,1
2160-7-7-1x1-192-7-7-16-0x0-1x1-1x1-0-NCHW-FP16-F=ConvAsm1x1U:1,8,2,32,1,4,4,1;ConvOclDirectFwd1x1:1,64,1,1,0,1,4,8,0
16-14-14-1x1-480-14-14-16-0x0-1x1-1x1-0-NCHW-FP32-B=ConvAsm1x1U:1,16,1,32,1,2,2;ConvOclDirectFwd1x1:1,64,1,1,0,4,16,8,0
2048-7-7-1x1-1024-14-14-16-0x0-2x2-1x1-0-NCHW-FP32-W=ConvAsmBwdWrW1x1:1,16,2,4,8,1,1,4,0,0
64-73-73-1x1-160-73-73-16-0x0-1x1-1x1-0-NCHW-FP32-B=ConvAsm1x1U:1,16,1,64,1,2,2,2;ConvOclDirectFwd1x1:1,128,1,1,0,1,32,4,0
448-8-8-1x1-2048-8-8-4-0x0-1x1-1x1-0-NCHW-FP32-B=ConvAsm1x1U:1,8,1,64,2,2,2,4;ConvOclDirectFwd1x1:1,64,1,1,0,2,8,8,0
48-7-7-5x5-128-7-7-32-2x2-1x1-1x1-0-NCHW-FP16-F=ConvOclDirectFwdFused:8,8,8,8,1,1,4,4,2;ConvOclDirectFwd:8,8,8,8,1,1,4,4,2
256-13-13-3x3-64-13-13-16-1x1-1x1-1x1-0-NCHW-FP16-W=ConvAsmBwdWrW3x3:0,1,8,4,4,1
192-7-7-1x1-1104-7-7-16-0x0-1x1-1x1-0-NCHW-FP16-W=ConvAsmBwdWrW1x1:2,8,4,8,2,1,1,4,0,1
608-14-14-1x1-128-14-14-256-0x0-1x1-1x1-0-NCHW-FP32-B=ConvAsm1x1U:1,32,1,32,2,1,2,2;ConvOclDirectFwd1x1:1,256,1,1,0,2,16,4,0
48-14-14-5x5-16-14-14-64-2x2-1x1-1x1-0-NCHW-FP16-B=ConvOclDirectFwd:8,8,16,16,2,2,2,4,2
160-7-7-1x1-832-7-7-16-0x0-1x1-1x1-0-NCHW-FP32-W=ConvAsmBwdWrW1x1:1,16,2,4,4,1,1,4,0,2
16-14-14-1x1-480-14-14-64-0x0-1x1-1x1-0-NCHW-FP16-W=ConvAsmBwdWrW1x1:2,8,2,4,2,1,4,4,0,2
128-28-28-3x3-128-56-56-128-1x1-2x2-1x1-0-NCHW-FP32-W=ConvAsmBwdWrW3x3:0,0,8,4,2,1
32-54-54-3x3-128-54-54-32-1x1-1x1-1x1-0-NCHW-FP16-F=ConvOclDirectFwd:32,8,32,32,1,4,8,1,2
256-13-13-3x3-256-13-13-128-1x1-1x1-1x1-0-NCHW-FP16-B=ConvOclDirectFwd:8,8,16,16,2,2,8,2,1
128-56-56-1x1-256-56-56-32-0x0-1x1-1x1-0-NCHW-FP16-B=ConvAsm1x1U:1,16,2,32,1,2,1,2;ConvOclDirectFwd1x1:1,64,1,1,0,4,16,4,0
80-73-73-3x3-192-71-71-256-0x0-1x1-1x1-0-NCHW-FP16-F=ConvOclDirectFwdFused:8,8,16,16,2,2,8,2,2;ConvOclDirectFwd:8,16,16,32,2,2,8,1,1
960-7-7-1x1-128-7-7-32-0x0-1x1-1x1-0-NCHW-FP16-B=ConvAsm1x1U:1,8,2,32,1,4,4,2;ConvOclDirectFwd1x1:1,64,1,1,0,1,4,4,0
1488-14-14-1x1-192-14-14-16-0x0-1x1-1x1-0-NCHW-FP16-F=ConvAsm1x1U:2,8,4,64,1,4,2,2;ConvOclDirectFwd1x1:1,64,1,1,0,4,8,4,0
256-27-27-1x1-48-27-27-512-0x0-1x1-1x1-0-NCHW-FP16-B=ConvAsm1x1U:2,16,4,64,1,2,1,1;ConvOclDirectFwd1x1:1,128,1,1,0,1,16,4,0
3-224-224-3x3-64-224-224-16-1x1-1x1-1x1-0-NCHW-FP16-F=ConvOclDirectFwdFused:16,16,32,32,2,2,8,1,2;ConvOclDirectFwd:16,16,16,32,1,2,8,1,2
768-14-14-1x1-128-14-14-256-0x0-1x1-1x1-0-NCHW-FP32-B=ConvAsm1x1U:1,32,1,32,2,1,4,1;ConvOclDirectFwd1x1:1,256,1,1,0,4,16,4,0
192-7-7-1x1-832-7-7-4-0x0-1x1-1x1-0-NCHW-FP16-W=ConvAsmBwdWrW1x1:2,8,2,8,2,1,1,4,0,1
112-14-14-1x1-512-14-14-64-0x0-1x1-1x1-0-NCHW-FP16-W=ConvAsmBwdWrW1x1:4,4,8,4,2,2,1,2,0,1
192-14-14-1x1-1872-14-14-16-0x0-1x1-1x1-0-NCHW-FP16-W=ConvAsmBwdWrW1x1:4,4,8,4,4,1,1,2,0,1
128-56-56-1x1-128-56-56-128-0x0-1x1-1x1-0-NCHW-FP32-B=ConvAsm1x1U:2,32,2,32,1,1,1,2;ConvOclDirectFwd1x1:1,128,1,1,0,2,32,4,0
2048-8-8-1x1-448-8-8-1-0x0-1x1-1x1-0-NCHW-FP32-F=ConvAsm1x1U:1,8,1,64,1,2,4,1;ConvActivAsm1x1U:1,16,1,32,1,4;ConvOclDirectFwd1x1:1,64,1,1,1,0,16,128,0
96-71-71-3x3-64-73-73-1-0x0-1x1-1x1-0-NCHW-FP16-B=ConvOclDirectFwd:16,16,16,32,1,2,4,4,1
512-28-28-1x1-128-28-28-256-0x0-1x1-1x1-0-NCHW-FP16-F=ConvAsm1x1U:1,8,2,32,4,4,1,8;ConvOclDirectFwd1x1:1,128,1,1,0,4,16,4,0
672-14-14-1x1-192-14-14-16-0x0-1x1-1x1-0-NCHW-FP32-F=ConvAsm1x1U:4,16,4,64,1,2,4,1;ConvActivAsm1x1U:1,16,3,16,2,3;ConvOclDirectFwd1x1:1,64,1,1,1,4,16,128,0
64-55-55-1x1-64-55-55-2-0x0-1x1-1x1-0-NCHW-FP32-W=ConvAsmBwdWrW1x1:8,2,2,2,2,1,2,4
96-54-54-1x1-16-54-54-512-0x0-1x1-1x1-0-NCHW-FP16-B=ConvAsm1x1U:1,8,2,64,1,4,2,2;ConvOclDirectFwd1x1:1,128,1,1,0,4,16,4,0
64-56-56-3x3-192-56-56-256-1x1-1x1-1x1-0-NCHW-FP16-F=ConvOclDirectFwdFused:32,8,32,32,1,4,8,1,2;ConvOclDirectFwd:32,8,32,32,1,4,8,1,1
256-19-19-1x1-512-19-19-32-0x0-1x1-1x1-0-NCHW-FP32-B=ConvAsm1x1U:2,16,2,64,1,2,1,4;ConvOclDirectFwd1x1:1,64,1,1,0,1,16,8,0
64-56-56-1x1-64-56-56-8-0x0-1x1-1x1-0-NCHW-FP32-F=ConvAsm1x1U:1,16,1,64,2,2,2,1;ConvActivAsm1x1U:1,16,1,64,2,3;ConvOclDirectFwd1x1:1,64,1,1,1,4,16,2048,0
192-8-8-1x1-2048-8-8-4-0x0-1x1-1x1-0-NCHW-FP16-W=ConvAsmBwdWrW1x1:1,16,2,4,4,1,1,4,0,0
128-7-7-1x1-704-7-7-512-0x0-1x1-1x1-0-NCHW-FP16-F=ConvAsm1x1U:2,16,4,16,1,2,1,4;ConvOclDirectFwd1x1:1,256,1,1,0,1,8,4,0
384-7-7-3x3-192-7-7-4-1x1-1x1-1x1-0-NCHW-FP16-B=ConvOclDirectFwd:8,8,8,8,1,1,1,4,1
128-14-14-1x1-608-14-14-256-0x0-1x1-1x1-0-NCHW-FP32-F=ConvAsm1x1U:1,16,1,32,3,2,2,2;ConvOclDirectFwd1x1:1,64,1,1,1,1,16,256,0
64-56-56-1x1-128-56-56-16-0x0-1x1-1x1-0-NCHW-FP16-F=ConvAsm1x1U:1,8,2,16,1,4,1,4;ConvOclDirectFwd1x1:1,128,1,1,0,4,16,4,0
320-14-14-3x3-160-14-14-128-1x1-1x1-1x1-0-NCHW-FP16-B=ConvOclDirectFwd:8,8,16,16,2,2,8,2,1
128-28-28-1x1-256-56-56-64-0x0-2x2-1x1-0-NCHW-FP32-W=ConvAsmBwdWrW1x1:2,8,2,4,8,1,4,4,0,2
256-7-7-1x1-832-7-7-64-0x0-1x1-1x1-0-NCHW-FP32-W=ConvAsmBwdWrW1x1:1,16,4,8,4,1,2,4,0,1
320-14-14-1x1-128-14-14-32-0x0-1x1-1x1-0-NCHW-FP32-W=ConvAsmBwdWrW1x1:2,8,2,4,2,1,1,4,0,1
384-13-13-3x3-384-13-13-128-1x1-1x1-1x1-0-NCHW-FP16-F=ConvOclDirectFwdFused:8,8,16,16,2,2,8,1,1;ConvOclDirectFwd:8,8,16,16,2,2,8,1,2
128-14-14-1x1-256-14-14-32-0x0-1x1-1x1-0-NCHW-FP32-F=ConvAsm1x1U:2,16,2,64,1,2,1,2;ConvOclDirectFwd1x1:1,64,1,1,1,4,16,2048,0
48-35-35-1x1-256-35-35-256-0x0-1x1-1x1-0-NCHW-FP32-F=ConvAsm1x1U:1,8,1,64,3,2,1,8;ConvOclDirectFwd1x1:1,64,1,1,1,1,32,2048,0
64-27-27-1x1-256-27-27-128-0x0-1x1-1x1-0-NCHW-FP16-F=ConvAsm1x1U:3,8,6,32,1,4,1,4;ConvOclDirectFwd1x1:1,256,1,1,0,1,8,4,0
992-14-14-1x1-128-14-14-128-0x0-1x1-1x1-0-NCHW-FP32-B=ConvAsm1x1U:1,32,1,32,2,1,4,1;ConvOclDirectFwd1x1:1,256,1,1,0,2,16,4,0
256-80-128-3x3-256-80-128-32-1x1-1x1-1x1-0-NCHW-FP16-W=ConvAsmBwdWrW3x3:0,1,8,4,1,1
128-7-7-3x3-32-7-7-256-1x1-1x1-1x1-0-NCHW-FP16-B=ConvOclDirectFwd:8,8,8,8,1,1,4,1,2
32-27-27-1x1-128-27-27-256-0x0-1x1-1x1-0-NCHW-FP32-F=ConvAsm1x1U:2,16,2,64,2,2,1,2;ConvOclDirectFwd1x1:1,64,1,1,1,1,32,128,0
128-7-7-5x5-48-7-7-64-2x2-1x1-1x1-0-NCHW-FP16-B=ConvOclDirectFwd:8,8,8,8,1,1,4,4,2
256-55-55-1x1-64-55-55-2-0x0-1x1-1x1-0-NCHW-FP32-F=ConvAsm1x1U:3,16,3,32,1,4;ConvOclDirectFwd1x1:1,64,1,1,1,1,16,128,0
1024-7-7-1x1-256-14-14-1-0x0-2x2-1x1-0-NCHW-FP32-W=ConvAsmBwdWrW1x1:1,16,2,2,8,1,1,4,0,0
128-14-14-1x1-384-14-14-512-0x0-1x1-1x1-0-NCHW-FP32-F=ConvAsm1x1U:4,8,4,64,1,4,1,4;ConvOclDirectFwd1x1:1,64,1,1,1,1,16,128,0
128-28-28-3x3-128-56-56-128-1x1-2x2-1x1-0-NCHW-FP32-B=ConvOclDirectFwd:32,32,32,32,1,1,8,2,1
1280-8-8-1x1-448-8-8-64-0x0-1x1-1x1-0-NCHW-FP32-F=ConvAsm1x1U:2,16,2,32,2,2,1,8;ConvActivAsm1x1U:2,16,2,32,4,1;ConvOclDirectFwd1x1:1,64,1,1,1,4,64,2048,0
1024-17-17-1x1-384-17-17-64-0x0-1x1-1x1-0-NCHW-FP32-F=ConvAsm1x1U:4,16,5,64,2,2,1,2;ConvActivAsm1x1U:3,16,5,64,2,2;ConvOclDirectFwd1x1:1,64,1,1,1,1,32,2048,0
3-225-225-7x7-64-112-112-64-2x2-2x2-1x1-0-NCHW-FP32-F=ConvOclDirectFwdFused:16,8,16,16,1,2,8,1,2;ConvOclDirectFwd:16,8,16,16,1,2,8,1,2
128-7-7-3x3-32-7-7-16-1x1-1x1-1x1-0-NCHW-FP16-F=ConvOclDirectFwd:8,8,8,8,1,1,1,4,2
288-14-14-3x3-144-14-14-8-1x1-1x1-1x1-0-NCHW-FP32-W=ConvAsmBwdWrW3x3:0,1,8,4,2,2
800-7-7-1x1-128-7-7-16-0x0-1x1-1x1-0-NCHW-FP16-B=ConvAsm1x1U:1,8,2,16,1,4,4,2;ConvOclDirectFwd1x1:1,256,1,1,0,1,4,4,0
256-28-28-1x1-512-28-28-512-0x0-1x1-1x1-0-NCHW-FP32-W=ConvAsmBwdWrW1x1:2,8,2,8,4,1,2,4,0,2
256-55-55-1x1-64-55-55-32-0x0-1x1-1x1-0-NCHW-FP32-W=ConvAsmBwdWrW1x1:4,4,4,4,4,1,4,4,0,1
256-14-14-1x1-1024-14-14-64-0x0-1x1-1x1-0-NCHW-FP16-W=ConvAsmBwdWrW1x1:2,8,8,4,4,2,1,2,0,1
1024-14-14-1x1-512-14-14-32-0x0-1x1-1x1-0-NCHW-FP32-B=ConvAsm1x1U:1,32,1,32,2,1,2,2;ConvOclDirectFwd1x1:8,64,16,16,0,2,16,4,1
48-35-35-1x1-288-35-35-128-0x0-1x1-1x1-0-NCHW-FP32-W=ConvAsmBwdWrW1x1:2,8,2,4,4,1,2,4,0,2
160-14-14-3x3-320-14-14-16-1x1-1x1-1x1-0-NCHW-FP16-F=ConvOclDirectFwdFused:8,16,16,16,2,1,8,1,2;ConvOclDirectFwd:8,16,16,16,2,1,8,1,2
768-28-28-1x1-384-28-28-16-0x0-1x1-1x1-0-NCHW-FP32-F=ConvAsm1x1U:3,16,5,16,2,2,1,1;ConvActivAsm1x1U:3,16,5,32,2,2;ConvOclDirectFwd1x1:1,64,1,1,1,1,16,2048,0
128-56-56-1x1-256-56-56-512-0x0-1x1-1x1-0-NCHW-FP16-W=ConvAsmBwdWrW1x1:8,2,8,2,8,2,2,4,1
128-14-14-5x5-32-14-14-32-2x2-1x1-1x1-0-NCHW-FP16-B=ConvOclDirectFwd:8,16,16,16,2,1,2,4,2
384-13-13-3x3-384-13-13-1-1x1-1x1-1x1-0-NCHW-FP16-B=ConvOclDirectFwd:16,16,16,16,1,1,1,4,1
256-14-14-1x1-1024-14-14-4-0x0-1x1-1x1-0-NCHW-FP16-F=ConvAsm1x1U:2,8,4,64,1,4,2,2;ConvOclDirectFwd1x1:1,64,1,1,0,4,8,4,0
128-14-14-1x1-352-14-14-128-0x0-1x1-1x1-0-NCHW-FP32-F=ConvAsm1x1U:2,16,2,16,2,2,2,2;ConvOclDirectFwd1x1:1,64,1,1,1,1,16,256,0
64-112-112-7x7-3-230-230-64-0x0-2x2-1x1-0-NCHW-FP16-B=ConvOclDirectFwd:16,16,32,32,2,2,8,2,1
384-8-8-1x1-1536-8-8-128-0x0-1x1-1x1-0-NCHW-FP16-W=ConvAsmBwdWrW1x1:2,8,4,8,2,2,1,4,0,1
416-28-28-1x1-128-28-28-64-0x0-1x1-1x1-0-NCHW-FP32-B=ConvAsm1x1U:1,16,1,32,2,1,2,2;ConvOclDirectFwd1x1:1,64,1,1,0,4,16,4,0
64-55-55-3x3-64-55-55-32-1x1-1x1-1x1-0-NCHW-FP16-B=ConvOclDirectFwd:8,16,16,32,2,2,8,1,2
64-28-28-1x1-192-28-28-64-0x0-1x1-1x1-0-NCHW-FP32-B=ConvAsm1x1U:1,16,1,16,1,2,1,4;ConvOclDirectFwd1x1:1,256,1,1,0,2,16,4,0
224-56-56-1x1-128-56-56-16-0x0-1x1-1x1-0-NCHW-FP32-F=ConvAsm1x1U:2,16,3,64,1,2,1,4;ConvOclDirectFwd1x1:1,64,1,1,1,0,16,2048,0
1-1760-1760-1x1-1-1760-1760-1-0x0-1x1-1x1-0-NCHW-FP32-F=ConvOclDirectFwd1x1:1,256,1,1,0,4,16,4,0
128-14-14-1x1-800-14-14-128-0x0-1x1-1x1-0-NCHW-FP32-F=ConvAsm1x1U:4,8,4,64,1,4,1,4;ConvOclDirectFwd1x1:1,64,1,1,1,0,64,128,0
64-13-13-3x3-256-13-13-512-1x1-1x1-1x1-0-NCHW-FP16-F=ConvOclDirectFwd:8,8,16,16,2,2,8,1,2
256-56-56-3x3-256-56-56-512-1x1-1x1-1x1-0-NCHW-FP16-F=ConvOclDirectFwd:16,16,32,32,2,2,8,4,1
32-24-240-3x3-16-24-240-1-1x1-1x1-1x1-0-NCHW-FP16-B=ConvOclDirectFwd:16,16,16,16,1,1,8,1,1
128-56-56-1x1-256-56-56-64-0x0-1x1-1x1-0-NCHW-FP16-W=ConvAsmBwdWrW1x1:2,8,4,8,2,1,4,2,0,3
32-14-14-5x5-64-14-14-8-2x2-1x1-1x1-0-NCHW-FP16-F=ConvOclDirectFwdFused:8,16,16,16,2,1,1,4,2;ConvOclDirectFwd:8,16,16,16,2,1,1,2,2
96-71-71-3x3-64-73-73-16-0x0-1x1-1x1-0-NCHW-FP16-B=ConvOclDirectFwd:16,8,16,16,1,2,8,1,2
160-14-14-3x3-128-28-28-32-1x1-2x2-1x1-0-NCHW-FP16-B=ConvOclDirectFwd:32,16,32,32,1,2,4,2,2
288-14-14-3x3-144-14-14-64-1x1-1x1-1x1-0-NCHW-FP16-B=ConvOclDirectFwd:8,8,16,16,2,2,8,2,1
64-35-35-1x1-192-35-35-128-0x0-1x1-1x1-0-NCHW-FP32-B=ConvAsm1x1U:2,32,2,32,1,1,2,1;ConvOclDirectFwd1x1:1,64,1,1,0,1,32,4,0
512-4-4-3x3-512-7-7-128-1x1-2x2-1x1-0-NCHW-FP32-B=ConvOclDirectFwd:8,8,8,8,1,1,4,1,2
32-7-7-1x1-832-7-7-1-0x0-1x1-1x1-0-NCHW-FP32-W=ConvAsmBwdWrW1x1:2,8,2,2,2,1,1,2,0,2
32-28-28-3x3-128-28-28-32-1x1-1x1-1x1-0-NCHW-FP16-F=ConvOclDirectFwd:16,16,32,32,2,2,8,1,2
1280-8-8-1x1-192-8-8-128-0x0-1x1-1x1-0-NCHW-FP16-F=ConvAsm1x1U:2,8,4,16,1,4,1,4;ConvOclDirectFwd1x1:1,64,1,1,0,2,8,4,0
256-28-28-1x1-128-28-28-16-0x0-1x1-1x1-0-NCHW-FP32-W=ConvAsmBwdWrW1x1:2,8,4,8,2,1,4,4,0,1
192-7-7-1x1-2064-7-7-16-0x0-1x1-1x1-0-NCHW-FP32-B=ConvAsm1x1U:1,16,1,64,2,2,2,2;ConvOclDirectFwd1x1:1,256,1,1,0,1,8,4,0
32-147-147-3x3-32-149-149-8-0x0-1x1-1x1-0-NCHW-FP16-B=ConvOclDirectFwd:16,16,32,32,2,2,8,2,1
256-80-128-3x3-256-80-128-64-1x1-1x1-1x1-0-NCHW-FP16-B=ConvOclDirectFwd:8,16,16,32,2,2,8,1,1
192-7-7-1x1-1344-7-7-16-0x0-1x1-1x1-0-NCHW-FP16-W=ConvAsmBwdWrW1x1:1,16,4,8,2,1,2,4,0,1
32-14-14-5x5-64-14-14-128-2x2-1x1-1x1-0-NCHW-FP16-F=ConvOclDirectFwdFused:8,8,16,16,2,2,8,2,2;ConvOclDirectFwd:8,8,16,16,2,2,8,2,2
32-24-240-3x3-16-24-240-16-1x1-1x1-1x1-0-NCHW-FP16-W=ConvAsmBwdWrW3x3:0,0,16,2,1,8
192-27-27-5x5-64-27-27-256-2x2-1x1-1x1-0-NCHW-FP32-F=ConvOclDirectFwd:16,16,32,32,2,2,8,1,2
256-7-7-1x1-832-7-7-8-0x0-1x1-1x1-0-NCHW-FP32-B=ConvAsm1x1U:1,16,1,32,1,2,2,1;ConvOclDirectFwd1x1:1,128,1,1,0,1,4,4,0
192-35-35-1x1-48-35-35-1-0x0-1x1-1x1-0-NCHW-FP32-F=ConvAsm1x1U:1,8,1,64,1,2,4,1;ConvActivAsm1x1U:1,16,1,64,1,3;ConvOclDirectFwd1x1:1,64,1,1,1,1,32,2048,0
1488-14-14-1x1-192-14-14-16-0x0-1x1-1x1-0-NCHW-FP32-F=ConvAsm1x1U:4,8,4,64,1,4,2,2;ConvActivAsm1x1U:3,16,3,16,4,4;ConvOclDirectFwd1x1:1,64,1,1,1,4,16,128,0
480-14-14-1x1-16-14-14-4-0x0-1x1-1x1-0-NCHW-FP32-F=ConvAsm1x1U:1,8,1,16,1,4,4,1;ConvActivAsm1x1U:1,16,1,16,1,3;ConvOclDirectFwd1x1:1,64,1,1,1,0,64,64,0
320-17-17-3x3-320-8-8-64-0x0-2x2-1x1-0-NCHW-FP32-F=ConvOclDirectFwd:8,8,8,8,1,1,8,1,1
832-7-7-1x1-160-7-7-64-0x0-1x1-1x1-0-NCHW-FP32-F=ConvAsm1x1U:2,8,2,32,1,4,1,4;ConvActivAsm1x1U:4,16,4,16,3,4;ConvOclDirectFwd1x1:1,64,1,1,1,1,16,256,0
32-28-28-1x1-192-28-28-64-0x0-1x1-1x1-0-NCHW-FP32-B=ConvAsm1x1U:1,16,1,32,2,2,1,4;ConvOclDirectFwd1x1:16,64,32,32,0,2,16,4,1
64-112-112-3x3-128-112-112-32-1x1-1x1-1x1-0-NCHW-FP16-B=ConvOclDirectFwd:8,16,16,32,2,2,8,1,2
96-28-28-5x5-32-28-28-4-2x2-1x1-1x1-0-NCHW-FP16-B=ConvOclDirectFwd:8,32,32,32,4,1,1,4,2
128-28-28-1x1-512-28-28-4-0x0-1x1-1x1-0-NCHW-FP16-B=ConvAsm1x1U:1,16,2,16,1,2,2,2;ConvOclDirectFwd1x1:1,64,1,1,0,4,16,4,0
160-73-73-1x1-64-73-73-4-0x0-1x1-1x1-0-NCHW-FP32-F=ConvAsm1x1U:2,16,2,64,2,2,2,1;ConvActivAsm1x1U:2,16,2,64,2,2;ConvOclDirectFwd1x1:1,64,1,1,1,4,16,2048,0
128-28-28-3x3-192-28-28-64-1x1-1x1-1x1-0-NCHW-FP16-F=ConvOclDirectFwdFused:16,16,32,32,2,2,8,2,1;ConvOclDirectFwd:16,16,32,32,2,2,8,1,1
832-7-7-1x1-48-7-7-512-0x0-1x1-1x1-0-NCHW-FP16-F=ConvAsm1x1U:2,16,4,16,1,2,2,1;ConvOclDirectFwd1x1:1,64,1,1,0,1,16,4,0
128-112-112-3x3-64-112-112-512-1x1-1x1-1x1-0-NCHW-FP16-B=ConvOclDirectFwd:8,16,16,32,2,2,8,2,1
64-56-56-1x1-256-56-56-16-0x0-1x1-1x1-0-NCHW-FP16-B=ConvAsm1x1U:1,16,2,32,1,2,1,4;ConvOclDirectFwd1x1:1,128,1,1,0,4,16,4,0
192-28-28-1x1-128-28-28-64-0x0-1x1-1x1-0-NCHW-FP32-W=ConvAsmBwdWrW1x1:2,8,2,8,2,1,4,4,0,0
64-55-55-3x3-64-55-55-64-1x1-1x1-1x1-0-NCHW-FP32-W=ConvAsmBwdWrW3x3:7,1,16,4,3,4
256-14-14-3x3-128-14-14-128-1x1-1x1-1x1-0-NCHW-FP16-B=ConvOclDirectFwd:8,8,16,16,2,2,8,2,1
48-35-35-1x1-192-35-35-64-0x0-1x1-1x1-0-NCHW-FP16-B=ConvAsm1x1U:1,16,2,64,1,2,1,2;ConvOclDirectFwd1x1:1,256,1,1,0,1,16,4,0
384-17-17-1x1-1024-17-17-32-0x0-1x1-1x1-0-NCHW-FP32-W=ConvAsmBwdWrW1x1:2,8,4,4,8,1,2,4,0,1
128-28-28-1x1-416-28-28-512-0x0-1x1-1x1-0-NCHW-FP32-F=ConvAsm1x1U:2,16,2,32,2,2,2,2;ConvOclDirectFwd1x1:1,64,1,1,1,0,16,256,0
128-14-14-1x1-416-14-14-128-0x0-1x1-1x1-0-NCHW-FP32-F=ConvAsm1x1U:4,8,4,64,1,4,1,4;ConvOclDirectFwd1x1:1,64,1,1,1,1,16,128,0
256-28-28-1x1-128-28-28-128-0x0-1x1-1x1-0-NCHW-FP32-F=ConvAsm1x1U:3,16,3,32,2,2,1,2;ConvActivAsm1x1U:4,16,5,32,2,1;ConvOclDirectFwd1x1:1,64,1,1,1,4,16,2048,0
512-28-28-3x3-512-28-28-512-1x1-1x1-1x1-0-NCHW-FP32-W=ConvAsmBwdWrW3x3:0,1,8,4,2,1
128-14-14-1x1-480-14-14-128-0x0-1x1-1x1-0-NCHW-FP32-F=ConvAsm1x1U:4,8,4,32,1,4,1,4;ConvOclDirectFwd1x1:1,64,1,1,1,0,16,2048,0
288-35-35-1x1-64-35-35-64-0x0-1x1-1x1-0-NCHW-FP16-F=ConvAsm1x1U:3,8,6,32,1,4,1,4;ConvOclDirectFwd1x1:16,64,32,32,0,1,16,4,1
192-14-14-1x1-480-14-14-512-0x0-1x1-1x1-0-NCHW-FP32-W=ConvAsmBwdWrW1x1:1,16,2,8,4,1,2,4,0,2
64-14-14-1x1-576-14-14-64-0x0-1x1-1x1-0-NCHW-FP16-B=ConvAsm1x1U:1,16,2,16,1,2,1,2;ConvOclDirectFwd1x1:1,256,1,1,0,4,4,4,0
64-35-35-1x1-256-35-35-16-0x0-1x1-1x1-0-NCHW-FP16-B=ConvAsm1x1U:1,16,2,64,1,2,1,1;ConvOclDirectFwd1x1:1,64,1,1,0,1,8,4,0
128-7-7-1x1-832-7-7-4-0x0-1x1-1x1-0-NCHW-FP16-W=ConvAsmBwdWrW1x1:1,16,2,4,2,1,1,2,0,3
224-14-14-3x3-112-14-14-256-1x1-1x1-1x1-0-NCHW-FP16-W=ConvAsmBwdWrW3x3:0,1,8,2,8,4
64-13-13-3x3-256-13-13-512-1x1-1x1-1x1-0-NCHW-FP16-W=ConvAsmBwdWrW3x3:0,0,8,4,10,1
64-35-35-1x1-256-35-35-128-0x0-1x1-1x1-0-NCHW-FP16-B=ConvAsm1x1U:1,16,2,64,1,2,1,2;ConvOclDirectFwd1x1:1,256,1,1,0,1,16,4,0
32-35-35-1x1-192-35-35-64-0x0-1x1-1x1-0-NCHW-FP16-B=ConvAsm1x1U:1,16,2,64,1,2,1,2;ConvOclDirectFwd1x1:1,64,1,1,0,1,8,8,0
64-27-27-3x3-256-27-27-512-1x1-1x1-1x1-0-NCHW-FP32-W=ConvAsmBwdWrW3x3:0,1,8,4,9,4
96-28-28-1x1-192-28-28-512-0x0-1x1-1x1-0-NCHW-FP16-B=ConvAsm1x1U:1,16,2,16,1,2,1,4;ConvOclDirectFwd1x1:1,128,1,1,0,4,16,4,0
32-14-14-1x1-528-14-14-512-0x0-1x1-1x1-0-NCHW-FP32-B=ConvAsm1x1U:1,16,1,64,3,2,1,4;ConvOclDirectFwd1x1:1,256,1,1,0,4,16,4,0
128-7-7-5x5-32-7-7-4-2x2-1x1-1x1-0-NCHW-FP32-B=ConvOclDirectFwd:8,8,8,8,1,1,1,4,2
128-28-28-1x1-448-28-28-16-0x0-1x1-1x1-0-NCHW-FP32-F=ConvAsm1x1U:1,8,1,32,2,4,1,8;ConvOclDirectFwd1x1:1,64,1,1,1,1,16,256,0
512-28-28-3x3-512-28-28-8-1x1-1x1-1x1-0-NCHW-FP16-B=ConvOclDirectFwd:32,8,32,32,1,4,8,2,2
192-71-71-3x3-192-35-35-8-0x0-2x2-1x1-0-NCHW-FP32-F=ConvOclDirectFwd:16,16,16,16,1,1,8,1,2
192-28-28-1x1-672-28-28-16-0x0-1x1-1x1-0-NCHW-FP32-B=ConvAsm1x1U:1,16,1,32,2,1,2,2;ConvOclDirectFwd1x1:1,64,1,1,0,2,16,4,0
256-13-13-3x3-256-13-13-1024-1x1-1x1-1x1-0-NCHW-FP16-F=ConvOclDirectFwd:8,8,16,16,2,2,8,1,1
576-14-14-1x1-128-14-14-128-0x0-1x1-1x1-0-NCHW-FP16-B=ConvAsm1x1U:1,16,2,16,1,2,2,4;ConvOclDirectFwd1x1:1,128,1,1,0,4,8,4,0
256-35-35-1x1-64-35-35-1-0x0-1x1-1x1-0-NCHW-FP16-F=ConvAsm1x1U:1,8,2,32,1,4,4,1;ConvOclDirectFwd1x1:1,64,1,1,0,1,4,8,0
1024-14-14-1x1-512-14-14-128-0x0-1x1-1x1-0-NCHW-FP16-F=ConvAsm1x1U:2,8,4,64,2,4,1,8;ConvOclDirectFwd1x1:1,64,1,1,0,4,16,4,0
96-35-35-3x3-96-35-35-1-1x1-1x1-1x1-0-NCHW-FP32-W=ConvAsmBwdWrW3x3:0,0,16,2,1,1
256-80-128-3x3-256-80-128-16-1x1-1x1-1x1-0-NCHW-FP16-W=ConvAsmBwdWrW3x3:0,0,16,4,1,1
64-73-73-1x1-80-73-73-64-0x0-1x1-1x1-0-NCHW-FP16-F=ConvAsm1x1U:1,16,2,64,1,2,1,1;ConvOclDirectFwd1x1:1,128,1,1,0,1,8,4,0
144-14-14-1x1-512-14-14-16-0x0-1x1-1x1-0-NCHW-FP32-W=ConvAsmBwdWrW1x1:1,16,2,8,2,2,1,4,0,1
512-28-28-1x1-128-28-28-16-0x0-1x1-1x1-0-NCHW-FP16-B=ConvAsm1x1U:1,16,2,32,1,2,4,2;ConvOclDirectFwd1x1:1,64,1,1,0,4,16,4,0
128-54-54-1x1-16-54-54-64-0x0-1x1-1x1-0-NCHW-FP32-F=ConvAsm1x1U:2,16,2,64,3,1,1,1;ConvOclDirectFwd1x1:1,64,1,1,1,4,64,256,0
256-14-14-1x1-528-14-14-1-0x0-1x1-1x1-0-NCHW-FP32-B=ConvAsm1x1U:1,8,1,64,1,4,2,2;ConvOclDirectFwd1x1:1,128,1,1,0,1,4,8,0
512-14-14-1x1-160-14-14-512-0x0-1x1-1x1-0-NCHW-FP32-F=ConvAsm1x1U:4,8,7,32,2,4,1,4;ConvActivAsm1x1U:4,16,4,64,3,2;ConvOclDirectFwd1x1:1,64,1,1,1,1,64,2048,0
480-14-14-1x1-192-14-14-256-0x0-1x1-1x1-0-NCHW-FP16-W=ConvAsmBwdWrW1x1:2,8,8,8,2,1,2,4,0,1
96-54-54-1x1-16-54-54-256-0x0-1x1-1x1-0-NCHW-FP16-F=ConvAsm1x1U:1,8,2,64,1,4,2,2;ConvOclDirectFwd1x1:1,256,1,1,0,4,16,4,0
384-35-35-1x1-96-35-35-16-0x0-1x1-1x1-0-NCHW-FP16-F=ConvAsm1x1U:2,8,8,32,1,4,1,4;ConvOclDirectFwd1x1:1,64,1,1,0,1,8,4,0
128-112-112-3x3-64-112-112-128-1x1-1x1-1x1-0-NCHW-FP16-W=ConvAsmBwdWrW3x3:0,0,8,4,1,4
1-2-2-3x3-2-5-5-32-0x0-2x2-1x1-0-NCHW-FP32-B=ConvOclDirectFwd:8,8,8,8,1,1,2,1,2
96-56-56-1x1-128-56-56-16-0x0-1x1-1x1-0-NCHW-FP32-W=ConvAsmBwdWrW1x1:4,4,4,4,4,1,4,4,0,1
448-8-8-1x1-2048-8-8-1-0x0-1x1-1x1-0-NCHW-FP16-W=ConvAsmBwdWrW1x1:1,16,2,4,2,1,1,4,0,1
16-28-28-1x1-192-28-28-4-0x0-1x1-1x1-0-NCHW-FP16-W=ConvAsmBwdWrW1x1:2,8,2,1,4,1,4,4,0,2
2048-7-7-1x1-1024-14-14-4-0x0-2x2-1x1-0-NCHW-FP16-B=ConvAsm1x1U:2,8,4,16,1,4,4,1;ConvOclDirectFwd1x1:1,128,1,1,0,1,8,8,0
16-54-54-1x1-96-54-54-64-0x0-1x1-1x1-0-NCHW-FP16-W=ConvAsmBwdWrW1x1:4,4,2,2,2,1,4,4,0,2
32-27-27-1x1-128-27-27-512-0x0-1x1-1x1-0-NCHW-FP16-F=ConvAsm1x1U:1,8,2,16,1,4,1,4;ConvOclDirectFwd1x1:1,256,1,1,0,1,8,4,0
256-14-14-1x1-128-14-14-64-0x0-1x1-1x1-0-NCHW-FP16-F=ConvAsm1x1U:2,8,4,64,1,4,1,4;ConvOclDirectFwd1x1:1,64,1,1,0,4,8,4,0
256-17-17-1x1-1024-17-17-1-0x0-1x1-1x1-0-NCHW-FP32-W=ConvAsmBwdWrW1x1:1,16,2,4,4,1,1,4,0,0
384-13-13-3x3-256-13-13-128-1x1-1x1-1x1-0-NCHW-FP32-W=ConvAsmBwdWrW3x3:0,0,16,4,3,1
128-14-14-1x1-736-14-14-64-0x0-1x1-1x1-0-NCHW-FP16-B=ConvAsm1x1U:1,16,2,16,1,2,1,2;ConvOclDirectFwd1x1:1,64,1,1,0,4,8,4,0
48-14-14-3x3-192-14-14-16-1x1-1x1-1x1-0-NCHW-FP16-B=ConvOclDirectFwd:8,8,16,16,2,2,4,1,2
288-35-35-3x3-384-17-17-8-0x0-2x2-1x1-0-NCHW-FP32-F=ConvOclDirectFwd:8,32,32,32,4,1,8,1,1
64-14-14-1x1-512-14-14-16-0x0-1x1-1x1-0-NCHW-FP32-B=ConvAsm1x1U:1,16,1,64,2,2,1,1;ConvOclDirectFwd1x1:1,128,1,1,0,4,16,4,0
128-7-7-1x1-928-7-7-256-0x0-1x1-1x1-0-NCHW-FP16-F=ConvAsm1x1U:1,16,4,16,1,2,1,1;ConvOclDirectFwd1x1:1,256,1,1,0,1,8,4,0
64-56-56-1x1-64-56-56-4-0x0-1x1-1x1-0-NCHW-FP16-F=ConvAsm1x1U:1,8,2,64,1,4,2,2;ConvOclDirectFwd1x1:1,64,1,1,0,2,4,4,0
768-17-17-1x1-128-17-17-4-0x0-1x1-1x1-0-NCHW-FP32-F=ConvAsm1x1U:2,8,5,64,1,2,4,1;ConvActivAsm1x1U:2,16,3,16,1,4;ConvOclDirectFwd1x1:1,64,1,1,1,4,16,128,0
128-14-14-1x1-528-14-14-512-0x0-1x1-1x1-0-NCHW-FP16-W=ConvAsmBwdWrW1x1:2,8,8,8,2,2,2,4,0,1
192-7-7-1x1-1056-7-7-16-0x0-1x1-1x1-0-NCHW-FP32-W=ConvAsmBwdWrW1x1:2,8,4,8,2,1,1,4,0,0
448-8-8-3x3-384-8-8-256-1x1-1x1-1x1-0-NCHW-FP16-F=ConvOclDirectFwdFused:8,8,8,8,1,1,8,4,2;ConvOclDirectFwd:8,8,8,8,1,1,8,2,1
96-28-28-1x1-192-28-28-256-0x0-1x1-1x1-0-NCHW-FP16-B=ConvAsm1x1U:1,8,2,32,2,4,1,4;ConvOclDirectFwd1x1:1,128,1,1,0,4,16,4,0
384-13-13-3x3-192-13-13-4-1x1-1x1-1x1-0-NCHW-FP32-W=ConvAsmBwdWrW3x3:0,1,16,4,2,1
16-28-28-1x1-192-28-28-64-0x0-1x1-1x1-0-NCHW-FP16-B=ConvAsm1x1U:1,8,2,32,1,4,1,4;ConvOclDirectFwd1x1:1,256,1,1,0,2,16,4,0
64-56-56-1x1-64-56-56-4-0x0-1x1-1x1-0-NCHW-FP16-B=ConvAsm1x1U:1,8,2,64,1,4,1,1;ConvOclDirectFwd1x1:1,64,1,1,0,2,8,4,0
320-8-8-3x3-192-17-17-1-0x0-2x2-1x1-0-NCHW-FP32-B=ConvOclDirectFwd:16,8,32,32,2,4,1,4,1
192-14-14-1x1-816-14-14-16-0x0-1x1-1x1-0-NCHW-FP16-B=ConvAsm1x1U:1,16,2,16,2,2,1,4;ConvOclDirectFwd1x1:1,64,1,1,0,4,8,4,0
