src/kernels/gfx900_64.OpenCL.fdb.txt
256-56-56-3x3-256-28-28-32-1x1-2x2-1x1-0-NCHW-FP32-F_g32=miopenConvolutionFwdAlgoDirect:ConvOclDirectFwd,1,5643,0,miopenConvolutionFwdAlgoDirect;miopenConvolutionFwdAlgoWinograd:ConvBinWinogradRxSf2x3,1,80033,0,miopenConvolutionFwdAlgoWinograd;miopenConvolutionFwdAlgoGEMM:GemmFwdRest,15,4882,7225344,MIOpenGEMM
128-56-56-3x3-128-56-56-32-1x1-1x1-1x1-0-NCHW-FP32-B_g32=miopenConvolutionBwdDataAlgoDirect:ConvAsm3x3U,0,311419,0,miopenConvolutionBwdDataAlgoDirect;miopenConvolutionBwdDataAlgoWinograd:ConvBinWinogradRxSf2x3,2,62194,0,miopenConvolutionBwdDataAlgoWinograd;miopenConvolutionBwdDataAlgoGEMM:gemm,17,115,14450688,MIOpenGEMM
1024-14-14-1x1-512-14-14-32-0x0-1x1-1x1-0-NCHW-FP32-W=miopenConvolutionBwdWeightsAlgoDirect:ConvAsmBwdWrW1x1,1,25434,0,miopenConvolutionBwdWeightsAlgoDirect;miopenConvolutionBwdWeightsAlgoGEMM:gemm,2,88405,0,MIOpenGEMM;miopenConvolutionBwdWeightsAlgoWinograd:ConvBinWinogradRxSf2x3,6,45453,0,miopenConvolutionBwdWeightsAlgoWinograd
1024-14-14-1x1-512-14-14-32-0x0-1x1-1x1-0-NCHW-FP32-F=miopenConvolutionFwdAlgoDirect:ConvAsm1x1U,1,49798,0,miopenConvolutionFwdAlgoDirect;miopenConvolutionFwdAlgoWinograd:ConvBinWinogradRxSf3x2,2,71029,0,miopenConvolutionFwdAlgoWinograd;miopenConvolutionFwdAlgoGEMM:GemmFwd1x1_0_1,3,76262,0,MIOpenGEMM
256-28-28-3x3-256-28-28-32-1x1-1x1-1x1-0-NCHW-FP32-W_g32=miopenConvolutionBwdWeightsAlgoDirect:ConvAsmBwdWrW3x3,0,227867,0,miopenConvolutionBwdWeightsAlgoDirect;miopenConvolutionBwdWeightsAlgoWinograd:ConvBinWinogradRxSf2x3,15,7817,0,miopenConvolutionBwdWeightsAlgoWinograd;miopenConvolutionBwdWeightsAlgoGEMM:gemm,22,2396,7225344,MIOpenGEMM
256-56-56-1x1-256-56-56-32-0x0-1x1-1x1-0-NCHW-FP32-W=miopenConvolutionBwdWeightsAlgoDirect:ConvAsmBwdWrW1x1,2,56679,0,miopenConvolutionBwdWeightsAlgoDirect
128-56-56-3x3-128-56-56-32-1x1-1x1-1x1-0-NCHW-FP32-F_g32=miopenConvolutionFwdAlgoDirect:ConvAsm3x3U,0,357541,0,miopenConvolutionFwdAlgoDirect;miopenConvolutionFwdAlgoWinograd:ConvBinWinogradRxSf2x3,3,13818,0,miopenConvolutionFwdAlgoWinograd;miopenConvolutionFwdAlgoGEMM:GemmFwdRest,20,1256,14450688,MIOpenGEMM
1024-14-14-1x1-512-14-14-32-0x0-1x1-1x1-0-NCHW-FP32-B=miopenConvolutionBwdDataAlgoDirect:ConvAsm1x1U,1,99714,0,miopenConvolutionBwdDataAlgoDirect;miopenConvolutionBwdDataAlgoGEMM:gemm,7,89237,0,MIOpenGEMM
256-28-28-3x3-256-28-28-32-1x1-1x1-1x1-0-NCHW-FP32-B_g32=miopenConvolutionBwdDataAlgoDirect:ConvAsm3x3U,0,356598,0,miopenConvolutionBwdDataAlgoDirect;miopenConvolutionBwdDataAlgoWinograd:ConvBinWinogradRxSf2x3,1,43461,0,miopenConvolutionBwdDataAlgoWinograd;miopenConvolutionBwdDataAlgoGEMM:gemm,12,9361,7225344,MIOpenGEMM
2048-7-7-1x1-1024-14-14-32-0x0-2x2-1x1-0-NCHW-FP32-W=miopenConvolutionBwdWeightsAlgoImplicitGEMM:ConvHipImplicitGemmV4R1WrW,1,42721,0,miopenConvolutionBwdWeightsAlgoImplicitGEMM;miopenConvolutionBwdWeightsAlgoDirect:ConvAsmBwdWrW1x1,1,60813,6422528,miopenConvolutionBwdWeightsAlgoDirect;miopenConvolutionBwdWeightsAlgoGEMM:gemm,3,96677,200704,MIOpenGEMM
256-56-56-1x1-64-56-56-32-0x0-1x1-1x1-0-NCHW-FP32-B=miopenConvolutionBwdDataAlgoDirect:ConvAsm1x1U,0,561067,0,miopenConvolutionBwdDataAlgoDirect;miopenConvolutionBwdDataAlgoWinograd:ConvBinWinogradRxSf3x2,1,26903,0,miopenConvolutionBwdDataAlgoWinograd;miopenConvolutionBwdDataAlgoGEMM:gemm,1,55275,0,MIOpenGEMM
256-56-56-1x1-256-56-56-32-0x0-1x1-1x1-0-NCHW-FP32-B=miopenConvolutionBwdDataAlgoDirect:ConvAsm1x1U,1,9726,0,miopenConvolutionBwdDataAlgoDirect;miopenConvolutionBwdDataAlgoGEMM:gemm,2,53574,0,MIOpenGEMM;miopenConvolutionBwdDataAlgoWinograd:ConvBinWinogradRxSf3x2,4,69398,0,miopenConvolutionBwdDataAlgoWinograd
512-28-28-1x1-512-28-28-32-0x0-1x1-1x1-0-NCHW-FP32-F=miopenConvolutionFwdAlgoImplicitGEMM:ConvHipImplicitGemmV4R4Fwd,2,254,0,miopenConvolutionFwdAlgoImplicitGEMM;miopenConvolutionFwdAlgoDirect:ConvAsm1x1U,2,90546,0,miopenConvolutionFwdAlgoDirect;miopenConvolutionFwdAlgoGEMM:GemmFwd1x1_0_1,3,1021,0,MIOpenGEMM;miopenConvolutionFwdAlgoWinograd:ConvBinWinogradRxSf3x2,4,92038,0,miopenConvolutionFwdAlgoWinograd
2048-7-7-1x1-1024-7-7-32-0x0-1x1-1x1-0-NCHW-FP32-W=miopenConvolutionBwdWeightsAlgoDirect:ConvAsmBwdWrW1x1,1,5615,0,miopenConvolutionBwdWeightsAlgoDirect;miopenConvolutionBwdWeightsAlgoGEMM:gemm,3,20674,0,MIOpenGEMM;miopenConvolutionBwdWeightsAlgoWinograd:ConvBinWinogradRxSf2x3,4,79579,0,miopenConvolutionBwdWeightsAlgoWinograd
2048-14-14-1x1-1024-14-14-32-0x0-1x1-1x1-0-NCHW-FP32-W=miopenConvolutionBwdWeightsAlgoGEMM:gemm,4,77902,0,MIOpenGEMM;miopenConvolutionBwdWeightsAlgoDirect:ConvAsmBwdWrW1x1,5,18176,0,miopenConvolutionBwdWeightsAlgoDirect;miopenConvolutionBwdWeightsAlgoWinograd:ConvBinWinogradRxSf2x3,21,8652,0,miopenConvolutionBwdWeightsAlgoWinograd
256-28-28-3x3-256-28-28-32-1x1-1x1-1x1-0-NCHW-FP32-F_g32=miopenConvolutionFwdAlgoDirect:ConvAsm3x3U,0,36285,0,miopenConvolutionFwdAlgoDirect;miopenConvolutionFwdAlgoWinograd:ConvBinWinogradRxSf2x3,2,30784,0,miopenConvolutionFwdAlgoWinograd;miopenConvolutionFwdAlgoGEMM:GemmFwdRest,58,2773,7225344,MIOpenGEMM
512-14-14-1x1-1024-14-14-32-0x0-1x1-1x1-0-NCHW-FP32-F=miopenConvolutionFwdAlgoDirect:ConvAsm1x1U,1,7645,0,miopenConvolutionFwdAlgoDirect;miopenConvolutionFwdAlgoWinograd:ConvBinWinogradRxSf3x2,2,53282,0,miopenConvolutionFwdAlgoWinograd;miopenConvolutionFwdAlgoGEMM:GemmFwd1x1_0_1,3,56407,0,MIOpenGEMM
2048-7-7-1x1-1024-14-14-32-0x0-2x2-1x1-0-NCHW-FP32-B=miopenConvolutionBwdDataAlgoDirect:ConvAsm1x1UV2,1,4211,0,miopenConvolutionBwdDataAlgoDirect;miopenConvolutionBwdDataAlgoImplicitGEMM:ConvHipImplicitGemmBwdDataV1R1,1,66771,0,miopenConvolutionBwdDataAlgoImplicitGEMM;miopenConvolutionBwdDataAlgoGEMM:gemm,2,32934,19267584,MIOpenGEMM;miopenConvolutionBwdDataAlgoWinograd:ConvBinWinogradRxSf2x3,11,7535,0,miopenConvolutionBwdDataAlgoWinograd
64-56-56-1x1-256-56-56-32-0x0-1x1-1x1-0-NCHW-FP32-F=miopenConvolutionFwdAlgoImplicitGEMM:ConvHipImplicitGemmV4R4Fwd,0,598326,0,miopenConvolutionFwdAlgoImplicitGEMM;miopenConvolutionFwdAlgoDirect:ConvAsm1x1U,0,644835,0,miopenConvolutionFwdAlgoDirect;miopenConvolutionFwdAlgoGEMM:GemmFwd1x1_0_1,1,27088,0,MIOpenGEMM;miopenConvolutionFwdAlgoWinograd:ConvBinWinogradRxSf3x2,1,47479,0,miopenConvolutionFwdAlgoWinograd
256-56-56-1x1-256-56-56-32-0x0-1x1-1x1-0-NCHW-FP32-F=miopenConvolutionFwdAlgoImplicitGEMM:ConvHipImplicitGemmV4R4Fwd,2,18049,0,miopenConvolutionFwdAlgoImplicitGEMM;miopenConvolutionFwdAlgoDirect:ConvAsm1x1U,2,64757,0,miopenConvolutionFwdAlgoDirect;miopenConvolutionFwdAlgoGEMM:GemmFwd1x1_0_1,2,78791,0,MIOpenGEMM;miopenConvolutionFwdAlgoWinograd:ConvBinWinogradRxSf3x2,4,69351,0,miopenConvolutionFwdAlgoWinograd
2048-7-7-1x1-1024-7-7-32-0x0-1x1-1x1-0-NCHW-FP32-B=miopenConvolutionBwdDataAlgoDirect:ConvAsm1x1U,1,30279,0,miopenConvolutionBwdDataAlgoDirect;miopenConvolutionBwdDataAlgoImplicitGEMM:ConvHipImplicitGemmBwdDataV1R1,3,54908,0,miopenConvolutionBwdDataAlgoImplicitGEMM;miopenConvolutionBwdDataAlgoWinograd:ConvBinWinogradRxSf3x2,3,84104,0,miopenConvolutionBwdDataAlgoWinograd;miopenConvolutionBwdDataAlgoGEMM:gemm,10,231,0,MIOpenGEMM
2048-14-14-1x1-1024-14-14-32-0x0-1x1-1x1-0-NCHW-FP32-B=miopenConvolutionBwdDataAlgoDirect:ConvAsm1x1U,4,71852,0,miopenConvolutionBwdDataAlgoDirect;miopenConvolutionBwdDataAlgoImplicitGEMM:ConvHipImplicitGemmBwdDataV1R1,4,72974,0,miopenConvolutionBwdDataAlgoImplicitGEMM;miopenConvolutionBwdDataAlgoGEMM:gemm,6,13412,0,MIOpenGEMM;miopenConvolutionBwdDataAlgoWinograd:ConvBinWinogradRxSf3x2,6,50971,0,miopenConvolutionBwdDataAlgoWinograd
256-28-28-1x1-512-28-28-32-0x0-1x1-1x1-0-NCHW-FP32-W=miopenConvolutionBwdWeightsAlgoDirect:ConvAsmBwdWrW1x1,1,26724,0,miopenConvolutionBwdWeightsAlgoDirect
64-112-112-7x7-3-224-224-32-3x3-2x2-1x1-0-NCHW-FP32-W=miopenConvolutionBwdWeightsAlgoDirect:ConvOclBwdWrW2<4>,3,91046,301056,miopenConvolutionBwdWeightsAlgoDirect;miopenConvolutionBwdWeightsAlgoGEMM:gemm,8,42286,7375872,MIOpenGEMM
1024-7-7-1x1-2048-7-7-32-0x0-1x1-1x1-0-NCHW-FP32-W=miopenConvolutionBwdWeightsAlgoDirect:ConvAsmBwdWrW1x1,1,54218,0,miopenConvolutionBwdWeightsAlgoDirect;miopenConvolutionBwdWeightsAlgoGEMM:gemm,3,24739,0,MIOpenGEMM;miopenConvolutionBwdWeightsAlgoWinograd:ConvBinWinogradRxSf2x3,5,47086,0,miopenConvolutionBwdWeightsAlgoWinograd
512-28-28-3x3-512-28-28-32-1x1-1x1-1x1-0-NCHW-FP32-B_g64=miopenConvolutionBwdDataAlgoDirect:ConvAsm3x3U,0,702987,0,miopenConvolutionBwdDataAlgoDirect;miopenConvolutionBwdDataAlgoWinograd:ConvBinWinogradRxSf2x3,5,64112,0,miopenConvolutionBwdDataAlgoWinograd;miopenConvolutionBwdDataAlgoGEMM:gemm,30,6574,14450688,MIOpenGEMM
256-56-56-3x3-256-56-56-32-1x1-1x1-1x1-0-NCHW-FP32-B_g64=miopenConvolutionBwdDataAlgoDirect:ConvAsm3x3U,1,56063,0,miopenConvolutionBwdDataAlgoDirect;miopenConvolutionBwdDataAlgoWinograd:ConvBinWinogradRxSf2x3,8,92165,0,miopenConvolutionBwdDataAlgoWinograd;miopenConvolutionBwdDataAlgoGEMM:gemm,107,198,28901376,MIOpenGEMM
128-56-56-1x1-64-56-56-32-0x0-1x1-1x1-0-NCHW-FP32-W=miopenConvolutionBwdWeightsAlgoDirect:ConvAsmBwdWrW1x1,0,645196,0,miopenConvolutionBwdWeightsAlgoDirect
1024-14-14-1x1-2048-7-7-32-0x0-2x2-1x1-0-NCHW-FP32-F=miopenConvolutionFwdAlgoGEMM:GemmFwd1x1_0_2,1,27986,19267584,MIOpenGEMM;miopenConvolutionFwdAlgoDirect:ConvAsm1x1U,2,10947,6422528,miopenConvolutionFwdAlgoDirect;miopenConvolutionFwdAlgoImplicitGEMM:ConvHipImplicitGemmV4R1Fwd,3,17837,0,miopenConvolutionFwdAlgoImplicitGEMM;miopenConvolutionFwdAlgoWinograd:ConvBinWinogradRxS,8,62408,0,miopenConvolutionFwdAlgoWinograd
128-56-56-1x1-256-56-56-32-0x0-1x1-1x1-0-NCHW-FP32-W=miopenConvolutionBwdWeightsAlgoDirect:ConvAsmBwdWrW1x1,1,45526,0,miopenConvolutionBwdWeightsAlgoDirect
512-28-28-1x1-1024-28-28-32-0x0-1x1-1x1-0-NCHW-FP32-F=miopenConvolutionFwdAlgoGEMM:GemmFwd1x1_0_1,5,40263,0,MIOpenGEMM;miopenConvolutionFwdAlgoDirect:ConvAsm1x1U,6,28091,0,miopenConvolutionFwdAlgoDirect;miopenConvolutionFwdAlgoWinograd:ConvBinWinogradRxSf3x2,8,96351,0,miopenConvolutionFwdAlgoWinograd
2048-7-7-1x1-2048-7-7-32-0x0-1x1-1x1-0-NCHW-FP32-F=miopenConvolutionFwdAlgoDirect:ConvAsm1x1U,3,87326,0,miopenConvolutionFwdAlgoDirect;miopenConvolutionFwdAlgoImplicitGEMM:ConvHipImplicitGemmV4R4Fwd,4,22264,0,miopenConvolutionFwdAlgoImplicitGEMM;miopenConvolutionFwdAlgoGEMM:GemmFwd1x1_0_1,5,4097,0,MIOpenGEMM;miopenConvolutionFwdAlgoWinograd:ConvBinWinogradRxSf3x2,6,76118,0,miopenConvolutionFwdAlgoWinograd
3-224-224-7x7-64-112-112-32-3x3-2x2-1x1-0-NCHW-FP32-F=miopenConvolutionFwdAlgoDirect:ConvAsm7x7c3h224w224k64u2v2p3q3f1,1,31123,0,miopenConvolutionFwdAlgoDirect;miopenConvolutionFwdAlgoWinograd:ConvBinWinogradRxS,2,7192,0,miopenConvolutionFwdAlgoWinograd;miopenConvolutionFwdAlgoGEMM:GemmFwdRest,3,44979,7375872,MIOpenGEMM
512-28-28-3x3-512-28-28-32-1x1-1x1-1x1-0-NCHW-FP32-F_g64=miopenConvolutionFwdAlgoDirect:ConvAsm3x3U,0,806023,0,miopenConvolutionFwdAlgoDirect;miopenConvolutionFwdAlgoWinograd:ConvBinWinogradRxSf2x3,2,76935,0,miopenConvolutionFwdAlgoWinograd;miopenConvolutionFwdAlgoGEMM:GemmFwdRest,67,5008,14450688,MIOpenGEMM
256-28-28-1x1-512-28-28-32-0x0-1x1-1x1-0-NCHW-FP32-B=miopenConvolutionBwdDataAlgoDirect:ConvAsm1x1U,1,7808,0,miopenConvolutionBwdDataAlgoDirect;miopenConvolutionBwdDataAlgoGEMM:gemm,2,439,0,MIOpenGEMM;miopenConvolutionBwdDataAlgoWinograd:ConvBinWinogradRxSf3x2,2,59491,0,miopenConvolutionBwdDataAlgoWinograd
1024-14-14-1x1-2048-14-14-32-0x0-1x1-1x1-0-NCHW-FP32-F=miopenConvolutionFwdAlgoImplicitGEMM:ConvHipImplicitGemmV4R4Fwd,4,62865,0,miopenConvolutionFwdAlgoImplicitGEMM;miopenConvolutionFwdAlgoDirect:ConvAsm1x1U,7,37989,0,miopenConvolutionFwdAlgoDirect;miopenConvolutionFwdAlgoGEMM:GemmFwd1x1_0_1,7,83663,0,MIOpenGEMM;miopenConvolutionFwdAlgoWinograd:ConvBinWinogradRxSf3x2,7,99473,0,miopenConvolutionFwdAlgoWinograd
1024-7-7-1x1-2048-7-7-32-0x0-1x1-1x1-0-NCHW-FP32-B=miopenConvolutionBwdDataAlgoDirect:ConvAsm1x1U,1,54246,0,miopenConvolutionBwdDataAlgoDirect;miopenConvolutionBwdDataAlgoImplicitGEMM:ConvHipImplicitGemmBwdDataV1R1,2,69002,0,miopenConvolutionBwdDataAlgoImplicitGEMM;miopenConvolutionBwdDataAlgoWinograd:ConvBinWinogradRxSf3x2,3,85464,0,miopenConvolutionBwdDataAlgoWinograd;miopenConvolutionBwdDataAlgoGEMM:gemm,4,93161,0,MIOpenGEMM
256-56-56-3x3-256-56-56-32-1x1-1x1-1x1-0-NCHW-FP32-F_g64=miopenConvolutionFwdAlgoDirect:ConvAsm3x3U,0,80706,0,miopenConvolutionFwdAlgoDirect;miopenConvolutionFwdAlgoWinograd:ConvBinWinogradRxSf2x3,6,1527,0,miopenConvolutionFwdAlgoWinograd;miopenConvolutionFwdAlgoGEMM:GemmFwdRest,125,812,28901376,MIOpenGEMM
1024-7-7-1x1-2048-7-7-32-0x0-1x1-1x1-0-NCHW-FP32-F=miopenConvolutionFwdAlgoDirect:ConvAsm1x1U,1,9826,0,miopenConvolutionFwdAlgoDirect;miopenConvolutionFwdAlgoImplicitGEMM:ConvHipImplicitGemmV4R1Fwd,2,34472,0,miopenConvolutionFwdAlgoImplicitGEMM;miopenConvolutionFwdAlgoWinograd:ConvBinWinogradRxSf3x2,3,6176,0,miopenConvolutionFwdAlgoWinograd;miopenConvolutionFwdAlgoGEMM:GemmFwd1x1_0_1,5,99129,0,MIOpenGEMM
128-56-56-1x1-64-56-56-32-0x0-1x1-1x1-0-NCHW-FP32-B=miopenConvolutionBwdDataAlgoDirect:ConvAsm1x1U,0,348767,0,miopenConvolutionBwdDataAlgoDirect;miopenConvolutionBwdDataAlgoWinograd:ConvBinWinogradRxSf3x2,0,732035,0,miopenConvolutionBwdDataAlgoWinograd;miopenConvolutionBwdDataAlgoGEMM:gemm,1,11816,0,MIOpenGEMM
512-28-28-1x1-256-56-56-32-0x0-2x2-1x1-0-NCHW-FP32-W=miopenConvolutionBwdWeightsAlgoDirect:ConvAsmBwdWrW1x1,1,45513,25690112,miopenConvolutionBwdWeightsAlgoDirect;miopenConvolutionBwdWeightsAlgoImplicitGEMM:ConvHipImplicitGemmV4R1WrW,5,20396,0,miopenConvolutionBwdWeightsAlgoImplicitGEMM;miopenConvolutionBwdWeightsAlgoGEMM:gemm,7,12769,802816,MIOpenGEMM
128-56-56-1x1-256-56-56-32-0x0-1x1-1x1-0-NCHW-FP32-B=miopenConvolutionBwdDataAlgoDirect:ConvAsm1x1U,1,6425,0,miopenConvolutionBwdDataAlgoDirect;miopenConvolutionBwdDataAlgoGEMM:gemm,2,13459,0,MIOpenGEMM;miopenConvolutionBwdDataAlgoWinograd:ConvBinWinogradRxSf3x2,2,56348,0,miopenConvolutionBwdDataAlgoWinograd
2048-7-7-3x3-2048-7-7-32-1x1-1x1-1x1-0-NCHW-FP32-B_g32=miopenConvolutionBwdDataAlgoWinograd:ConvBinWinogradRxSf2x3,0,444441,0,miopenConvolutionBwdDataAlgoWinograd;miopenConvolutionBwdDataAlgoDirect:ConvOclDirectFwd,2,52883,0,miopenConvolutionBwdDataAlgoDirect;miopenConvolutionBwdDataAlgoGEMM:gemm,15,4984,3612672,MIOpenGEMM
1024-7-7-3x3-1024-14-14-32-1x1-2x2-1x1-0-NCHW-FP32-W_g32=miopenConvolutionBwdWeightsAlgoDirect:ConvAsmBwdWrW3x3,0,282516,0,miopenConvolutionBwdWeightsAlgoDirect;miopenConvolutionBwdWeightsAlgoGEMM:gemm,18,8024,1806336,MIOpenGEMM
512-28-28-1x1-256-28-28-32-0x0-1x1-1x1-0-NCHW-FP32-F=miopenConvolutionFwdAlgoImplicitGEMM:ConvHipImplicitGemmV4R4Fwd,1,23327,0,miopenConvolutionFwdAlgoImplicitGEMM;miopenConvolutionFwdAlgoDirect:ConvAsm1x1U,1,46148,0,miopenConvolutionFwdAlgoDirect;miopenConvolutionFwdAlgoWinograd:ConvBinWinogradRxSf3x2,2,58302,0,miopenConvolutionFwdAlgoWinograd;miopenConvolutionFwdAlgoGEMM:GemmFwd1x1_0_1,2,76796,0,MIOpenGEMM
2048-7-7-3x3-2048-14-14-32-1x1-2x2-1x1-0-NCHW-FP32-W_g64=miopenConvolutionBwdWeightsAlgoDirect:ConvAsmBwdWrW3x3,0,513977,0,miopenConvolutionBwdWeightsAlgoDirect;miopenConvolutionBwdWeightsAlgoGEMM:gemm,45,2961,3612672,MIOpenGEMM
2048-7-7-1x1-1024-7-7-32-0x0-1x1-1x1-0-NCHW-FP32-F=miopenConvolutionFwdAlgoDirect:ConvAsm1x1U,1,78148,0,miopenConvolutionFwdAlgoDirect;miopenConvolutionFwdAlgoImplicitGEMM:ConvHipImplicitGemmV4R1Fwd,3,67506,0,miopenConvolutionFwdAlgoImplicitGEMM;miopenConvolutionFwdAlgoWinograd:ConvBinWinogradRxSf3x2,3,69716,0,miopenConvolutionFwdAlgoWinograd;miopenConvolutionFwdAlgoGEMM:GemmFwd1x1_0_1,5,30892,0,MIOpenGEMM
1024-14-14-3x3-1024-14-14-32-1x1-1x1-1x1-0-NCHW-FP32-W_g64=miopenConvolutionBwdWeightsAlgoDirect:ConvAsmBwdWrW3x3,0,475204,0,miopenConvolutionBwdWeightsAlgoDirect;miopenConvolutionBwdWeightsAlgoWinograd:ConvBinWinogradRxSf2x3,1,15924,0,miopenConvolutionBwdWeightsAlgoWinograd;miopenConvolutionBwdWeightsAlgoGEMM:gemm,37,2288,7225344,MIOpenGEMM
1024-7-7-3x3-1024-14-14-32-1x1-2x2-1x1-0-NCHW-FP32-B_g32=miopenConvolutionBwdDataAlgoDirect:ConvOclDirectFwd,0,567367,0,miopenConvolutionBwdDataAlgoDirect;miopenConvolutionBwdDataAlgoWinograd:ConvBinWinogradRxSf2x3,1,20144,0,miopenConvolutionBwdDataAlgoWinograd;miopenConvolutionBwdDataAlgoGEMM:gemm,10,6362,1806336,MIOpenGEMM
512-28-28-1x1-512-28-28-32-0x0-1x1-1x1-0-NCHW-FP32-W=miopenConvolutionBwdWeightsAlgoDirect:ConvAsmBwdWrW1x1,2,24532,0,miopenConvolutionBwdWeightsAlgoDirect;miopenConvolutionBwdWeightsAlgoWinograd:ConvBinWinogradRxSf2x3,8,88142,0,miopenConvolutionBwdWeightsAlgoWinograd
1024-7-7-3x3-1024-7-7-32-1x1-1x1-1x1-0-NCHW-FP32-W_g32=miopenConvolutionBwdWeightsAlgoDirect:ConvAsmBwdWrW3x3,0,203552,0,miopenConvolutionBwdWeightsAlgoDirect;miopenConvolutionBwdWeightsAlgoWinograd:ConvBinWinogradRxSf2x3,0,420959,0,miopenConvolutionBwdWeightsAlgoWinograd;miopenConvolutionBwdWeightsAlgoGEMM:gemm,15,555,1806336,MIOpenGEMM
512-28-28-1x1-256-56-56-32-0x0-2x2-1x1-0-NCHW-FP32-B=miopenConvolutionBwdDataAlgoDirect:ConvAsm1x1UV2,1,29049,0,miopenConvolutionBwdDataAlgoDirect;miopenConvolutionBwdDataAlgoImplicitGEMM:ConvHipImplicitGemmBwdDataV4R1,1,63806,0,miopenConvolutionBwdDataAlgoImplicitGEMM;miopenConvolutionBwdDataAlgoGEMM:gemm,1,90026,77070336,MIOpenGEMM;miopenConvolutionBwdDataAlgoWinograd:ConvBinWinogradRxSf2x3,9,9938,0,miopenConvolutionBwdDataAlgoWinograd
64-56-56-1x1-128-56-56-32-0x0-1x1-1x1-0-NCHW-FP32-F=miopenConvolutionFwdAlgoDirect:ConvAsm1x1U,0,347249,0,miopenConvolutionFwdAlgoDirect;miopenConvolutionFwdAlgoWinograd:ConvBinWinogradRxSf3x2,0,772013,0,miopenConvolutionFwdAlgoWinograd;miopenConvolutionFwdAlgoGEMM:GemmFwd1x1_0_1,0,779791,0,MIOpenGEMM
1024-14-14-1x1-512-28-28-32-0x0-2x2-1x1-0-NCHW-FP32-W=miopenConvolutionBwdWeightsAlgoDirect:ConvAsmBwdWrW1x1,1,31766,12845056,miopenConvolutionBwdWeightsAlgoDirect;miopenConvolutionBwdWeightsAlgoImplicitGEMM:ConvHipImplicitGemmV4R1WrW,1,70435,0,miopenConvolutionBwdWeightsAlgoImplicitGEMM;miopenConvolutionBwdWeightsAlgoGEMM:gemm,3,75033,401408,MIOpenGEMM
1024-14-14-3x3-1024-14-14-32-1x1-1x1-1x1-0-NCHW-FP32-B_g64=miopenConvolutionBwdDataAlgoWinograd:ConvBinWinogradRxSf2x3,0,508557,0,miopenConvolutionBwdDataAlgoWinograd;miopenConvolutionBwdDataAlgoDirect:ConvOclDirectFwd,0,821361,0,miopenConvolutionBwdDataAlgoDirect;miopenConvolutionBwdDataAlgoGEMM:gemm,18,385,7225344,MIOpenGEMM
256-56-56-1x1-128-56-56-32-0x0-1x1-1x1-0-NCHW-FP32-F=miopenConvolutionFwdAlgoImplicitGEMM:ConvHipImplicitGemmV4R4Fwd,1,14568,0,miopenConvolutionFwdAlgoImplicitGEMM;miopenConvolutionFwdAlgoDirect:ConvAsm1x1U,1,24201,0,miopenConvolutionFwdAlgoDirect;miopenConvolutionFwdAlgoGEMM:GemmFwd1x1_0_1,2,24948,0,MIOpenGEMM;miopenConvolutionFwdAlgoWinograd:ConvBinWinogradRxSf3x2,2,39124,0,miopenConvolutionFwdAlgoWinograd
1024-28-28-3x3-1024-14-14-32-1x1-2x2-1x1-0-NCHW-FP32-F_g32=miopenConvolutionFwdAlgoImplicitGEMM:ConvHipImplicitGemmV4R1Fwd,0,916395,0,miopenConvolutionFwdAlgoImplicitGEMM;miopenConvolutionFwdAlgoWinograd:ConvBinWinogradRxSf2x3,1,40299,0,miopenConvolutionFwdAlgoWinograd;miopenConvolutionFwdAlgoDirect:ConvOclDirectFwd,3,41458,0,miopenConvolutionFwdAlgoDirect;miopenConvolutionFwdAlgoGEMM:GemmFwdRest,18,6484,7225344,MIOpenGEMM
1024-14-14-3x3-1024-7-7-32-1x1-2x2-1x1-0-NCHW-FP32-F_g32=miopenConvolutionFwdAlgoWinograd:ConvBinWinogradRxSf2x3,0,484763,0,miopenConvolutionFwdAlgoWinograd;miopenConvolutionFwdAlgoImplicitGEMM:ConvHipImplicitGemmV4R1Fwd,0,607811,0,miopenConvolutionFwdAlgoImplicitGEMM;miopenConvolutionFwdAlgoDirect:ConvOclDirectFwd,1,64,0,miopenConvolutionFwdAlgoDirect;miopenConvolutionFwdAlgoGEMM:GemmFwdRest,36,4102,1806336,MIOpenGEMM
1024-14-14-1x1-1024-14-14-32-0x0-1x1-1x1-0-NCHW-FP32-W=miopenConvolutionBwdWeightsAlgoDirect:ConvAsmBwdWrW1x1,2,4697,0,miopenConvolutionBwdWeightsAlgoDirect;miopenConvolutionBwdWeightsAlgoGEMM:gemm,3,75575,0,MIOpenGEMM;miopenConvolutionBwdWeightsAlgoWinograd:ConvBinWinogradRxS,10,8533,0,miopenConvolutionBwdWeightsAlgoWinograd
512-56-56-1x1-256-56-56-32-0x0-1x1-1x1-0-NCHW-FP32-W=miopenConvolutionBwdWeightsAlgoGEMM:gemm,4,29889,0,MIOpenGEMM;miopenConvolutionBwdWeightsAlgoWinograd:ConvBinWinogradRxS,23,4459,0,miopenConvolutionBwdWeightsAlgoWinograd
2048-7-7-3x3-2048-14-14-32-1x1-2x2-1x1-0-NCHW-FP32-B_g64=miopenConvolutionBwdDataAlgoDirect:ConvOclDirectFwd,1,78876,0,miopenConvolutionBwdDataAlgoDirect;miopenConvolutionBwdDataAlgoWinograd:ConvBinWinogradRxSf2x3,3,10396,0,miopenConvolutionBwdDataAlgoWinograd;miopenConvolutionBwdDataAlgoGEMM:gemm,34,4383,3612672,MIOpenGEMM
1024-7-7-3x3-1024-7-7-32-1x1-1x1-1x1-0-NCHW-FP32-B_g32=miopenConvolutionBwdDataAlgoWinograd:ConvBinWinogradRxSf2x3,0,53595,0,miopenConvolutionBwdDataAlgoWinograd;miopenConvolutionBwdDataAlgoDirect:ConvOclDirectFwd,0,641411,0,miopenConvolutionBwdDataAlgoDirect;miopenConvolutionBwdDataAlgoGEMM:gemm,9,4792,1806336,MIOpenGEMM
2048-7-7-3x3-2048-7-7-32-1x1-1x1-1x1-0-NCHW-FP32-F_g32=miopenConvolutionFwdAlgoWinograd:ConvBinWinogradRxSf2x3,0,445415,0,miopenConvolutionFwdAlgoWinograd;miopenConvolutionFwdAlgoImplicitGEMM:ConvHipImplicitGemmV4R1Fwd,0,922809,0,miopenConvolutionFwdAlgoImplicitGEMM;miopenConvolutionFwdAlgoDirect:ConvOclDirectFwd,2,23083,0,miopenConvolutionFwdAlgoDirect;miopenConvolutionFwdAlgoGEMM:GemmFwdRest,25,2471,3612672,MIOpenGEMM
256-56-56-1x1-128-56-56-32-0x0-1x1-1x1-0-NCHW-FP32-W=miopenConvolutionBwdWeightsAlgoDirect:ConvAsmBwdWrW1x1,1,49041,0,miopenConvolutionBwdWeightsAlgoDirect
512-28-28-1x1-512-28-28-32-0x0-1x1-1x1-0-NCHW-FP32-B=miopenConvolutionBwdDataAlgoDirect:ConvAsm1x1U,2,2488,0,miopenConvolutionBwdDataAlgoDirect;miopenConvolutionBwdDataAlgoImplicitGEMM:ConvHipImplicitGemmBwdDataV1R1,2,30316,0,miopenConvolutionBwdDataAlgoImplicitGEMM;miopenConvolutionBwdDataAlgoGEMM:gemm,3,3952,0,MIOpenGEMM;miopenConvolutionBwdDataAlgoWinograd:ConvBinWinogradRxSf3x2,4,46976,0,miopenConvolutionBwdDataAlgoWinograd
256-56-56-1x1-512-28-28-32-0x0-2x2-1x1-0-NCHW-FP32-F=miopenConvolutionFwdAlgoImplicitGEMM:ConvHipImplicitGemmV4R4Fwd,1,26763,0,miopenConvolutionFwdAlgoImplicitGEMM;miopenConvolutionFwdAlgoDirect:ConvAsm1x1U,1,57832,25690112,miopenConvolutionFwdAlgoDirect;miopenConvolutionFwdAlgoGEMM:GemmFwd1x1_0_2,1,59991,77070336,MIOpenGEMM;miopenConvolutionFwdAlgoWinograd:ConvBinWinogradRxS,8,52506,0,miopenConvolutionFwdAlgoWinograd
1024-14-14-1x1-512-28-28-32-0x0-2x2-1x1-0-NCHW-FP32-B=miopenConvolutionBwdDataAlgoDirect:ConvAsm1x1UV2,1,40237,0,miopenConvolutionBwdDataAlgoDirect;miopenConvolutionBwdDataAlgoGEMM:gemm,1,71802,38535168,MIOpenGEMM;miopenConvolutionBwdDataAlgoWinograd:ConvBinWinogradRxSf2x3,10,4348,0,miopenConvolutionBwdDataAlgoWinograd
512-14-14-3x3-512-28-28-32-1x1-2x2-1x1-0-NCHW-FP32-W_g32=miopenConvolutionBwdWeightsAlgoDirect:ConvAsmBwdWrW3x3,0,38029,0,miopenConvolutionBwdWeightsAlgoDirect;miopenConvolutionBwdWeightsAlgoGEMM:gemm,18,6821,3612672,MIOpenGEMM
512-28-28-1x1-256-28-28-32-0x0-1x1-1x1-0-NCHW-FP32-W=miopenConvolutionBwdWeightsAlgoDirect:ConvAsmBwdWrW1x1,1,19027,0,miopenConvolutionBwdWeightsAlgoDirect;miopenConvolutionBwdWeightsAlgoWinograd:ConvBinWinogradRxSf2x3,5,70098,0,miopenConvolutionBwdWeightsAlgoWinograd;miopenConvolutionBwdWeightsAlgoGEMM:gemm,5,80879,0,MIOpenGEMM
1024-14-14-1x1-1024-14-14-32-0x0-1x1-1x1-0-NCHW-FP32-B=miopenConvolutionBwdDataAlgoDirect:ConvAsm1x1U,2,36168,0,miopenConvolutionBwdDataAlgoDirect;miopenConvolutionBwdDataAlgoImplicitGEMM:ConvHipImplicitGemmBwdDataV4R1,2,44341,0,miopenConvolutionBwdDataAlgoImplicitGEMM;miopenConvolutionBwdDataAlgoGEMM:gemm,4,14348,0,MIOpenGEMM;miopenConvolutionBwdDataAlgoWinograd:ConvBinWinogradRxSf3x2,4,32478,0,miopenConvolutionBwdDataAlgoWinograd
1024-14-14-3x3-1024-14-14-32-1x1-1x1-1x1-0-NCHW-FP32-F_g64=miopenConvolutionFwdAlgoWinograd:ConvBinWinogradRxSf2x3,0,5463,0,miopenConvolutionFwdAlgoWinograd;miopenConvolutionFwdAlgoImplicitGEMM:ConvHipImplicitGemmV4R1Fwd,0,673864,0,miopenConvolutionFwdAlgoImplicitGEMM;miopenConvolutionFwdAlgoDirect:ConvOclDirectFwd,0,999121,0,miopenConvolutionFwdAlgoDirect;miopenConvolutionFwdAlgoGEMM:GemmFwdRest,45,7856,7225344,MIOpenGEMM
1024-7-7-3x3-1024-7-7-32-1x1-1x1-1x1-0-NCHW-FP32-F_g32=miopenConvolutionFwdAlgoWinograd:ConvBinWinogradRxSf2x3,0,165509,0,miopenConvolutionFwdAlgoWinograd;miopenConvolutionFwdAlgoImplicitGEMM:ConvHipImplicitGemmV4R1Fwd,0,330967,0,miopenConvolutionFwdAlgoImplicitGEMM;miopenConvolutionFwdAlgoDirect:ConvOclDirectFwd,0,602599,0,miopenConvolutionFwdAlgoDirect;miopenConvolutionFwdAlgoGEMM:GemmFwdRest,21,169,1806336,MIOpenGEMM
512-56-56-1x1-256-56-56-32-0x0-1x1-1x1-0-NCHW-FP32-B=miopenConvolutionBwdDataAlgoDirect:ConvAsm1x1U,3,92405,0,miopenConvolutionBwdDataAlgoDirect;miopenConvolutionBwdDataAlgoImplicitGEMM:ConvHipImplicitGemmBwdDataV4R1,4,37825,0,miopenConvolutionBwdDataAlgoImplicitGEMM;miopenConvolutionBwdDataAlgoWinograd:ConvBinWinogradRxSf3x2,6,10479,0,miopenConvolutionBwdDataAlgoWinograd;miopenConvolutionBwdDataAlgoGEMM:gemm,6,93978,0,MIOpenGEMM
2048-14-14-3x3-2048-7-7-32-1x1-2x2-1x1-0-NCHW-FP32-F_g64=miopenConvolutionFwdAlgoImplicitGEMM:ConvHipImplicitGemmV4R1Fwd,1,13505,0,miopenConvolutionFwdAlgoImplicitGEMM;miopenConvolutionFwdAlgoDirect:ConvOclDirectFwd,3,12202,0,miopenConvolutionFwdAlgoDirect;miopenConvolutionFwdAlgoWinograd:ConvBinWinogradRxSf2x3,3,30586,0,miopenConvolutionFwdAlgoWinograd;miopenConvolutionFwdAlgoGEMM:GemmFwdRest,113,595,3612672,MIOpenGEMM
512-14-14-3x3-512-28-28-32-1x1-2x2-1x1-0-NCHW-FP32-B_g32=miopenConvolutionBwdDataAlgoDirect:ConvOclDirectFwd,3,42821,0,miopenConvolutionBwdDataAlgoDirect;miopenConvolutionBwdDataAlgoWinograd:ConvBinWinogradRxSf2x3,8,2568,0,miopenConvolutionBwdDataAlgoWinograd;miopenConvolutionBwdDataAlgoGEMM:gemm,49,8708,3612672,MIOpenGEMM
2048-7-7-1x1-2048-7-7-32-0x0-1x1-1x1-0-NCHW-FP32-W=miopenConvolutionBwdWeightsAlgoDirect:ConvAsmBwdWrW1x1,3,58537,0,miopenConvolutionBwdWeightsAlgoDirect;miopenConvolutionBwdWeightsAlgoGEMM:gemm,3,75966,0,MIOpenGEMM;miopenConvolutionBwdWeightsAlgoWinograd:ConvBinWinogradRxSf2x3,10,8303,0,miopenConvolutionBwdWeightsAlgoWinograd
256-56-56-1x1-128-56-56-32-0x0-1x1-1x1-0-NCHW-FP32-B=miopenConvolutionBwdDataAlgoDirect:ConvAsm1x1U,1,908,0,miopenConvolutionBwdDataAlgoDirect;miopenConvolutionBwdDataAlgoWinograd:ConvBinWinogradRxSf3x2,2,37422,0,miopenConvolutionBwdDataAlgoWinograd;miopenConvolutionBwdDataAlgoGEMM:gemm,2,93756,0,MIOpenGEMM
512-28-28-1x1-1024-14-14-32-0x0-2x2-1x1-0-NCHW-FP32-F=miopenConvolutionFwdAlgoGEMM:GemmFwd1x1_0_2,1,2014,38535168,MIOpenGEMM;miopenConvolutionFwdAlgoImplicitGEMM:ConvHipImplicitGemmV4R4Fwd,1,37799,0,miopenConvolutionFwdAlgoImplicitGEMM;miopenConvolutionFwdAlgoDirect:ConvAsm1x1U,1,84278,12845056,miopenConvolutionFwdAlgoDirect;miopenConvolutionFwdAlgoWinograd:ConvBinWinogradRxS,7,46894,0,miopenConvolutionFwdAlgoWinograd
256-28-28-3x3-256-56-56-32-1x1-2x2-1x1-0-NCHW-FP32-W_g32=miopenConvolutionBwdWeightsAlgoDirect:ConvAsmBwdWrW3x3,0,425836,0,miopenConvolutionBwdWeightsAlgoDirect;miopenConvolutionBwdWeightsAlgoGEMM:gemm,26,6016,7225344,MIOpenGEMM
512-28-28-1x1-256-28-28-32-0x0-1x1-1x1-0-NCHW-FP32-B=miopenConvolutionBwdDataAlgoDirect:ConvAsm1x1U,1,17024,0,miopenConvolutionBwdDataAlgoDirect;miopenConvolutionBwdDataAlgoWinograd:ConvBinWinogradRxSf3x2,2,59366,0,miopenConvolutionBwdDataAlgoWinograd;miopenConvolutionBwdDataAlgoGEMM:gemm,5,35258,0,MIOpenGEMM
1024-14-14-1x1-1024-14-14-32-0x0-1x1-1x1-0-NCHW-FP32-F=miopenConvolutionFwdAlgoDirect:ConvAsm1x1U,4,24576,0,miopenConvolutionFwdAlgoDirect;miopenConvolutionFwdAlgoGEMM:GemmFwd1x1_0_1,4,88455,0,MIOpenGEMM;miopenConvolutionFwdAlgoWinograd:ConvBinWinogradRxSf3x2,5,7528,0,miopenConvolutionFwdAlgoWinograd
512-14-14-1x1-1024-14-14-32-0x0-1x1-1x1-0-NCHW-FP32-W=miopenConvolutionBwdWeightsAlgoDirect:ConvAsmBwdWrW1x1,1,26017,0,miopenConvolutionBwdWeightsAlgoDirect;miopenConvolutionBwdWeightsAlgoGEMM:gemm,3,30386,0,MIOpenGEMM;miopenConvolutionBwdWeightsAlgoWinograd:ConvBinWinogradRxSf2x3,4,46632,0,miopenConvolutionBwdWeightsAlgoWinograd
512-28-28-3x3-512-14-14-32-1x1-2x2-1x1-0-NCHW-FP32-F_g32=miopenConvolutionFwdAlgoImplicitGEMM:ConvHipImplicitGemmV4R1Fwd,0,460062,0,miopenConvolutionFwdAlgoImplicitGEMM;miopenConvolutionFwdAlgoWinograd:ConvBinWinogradRxSf2x3,0,911864,0,miopenConvolutionFwdAlgoWinograd;miopenConvolutionFwdAlgoDirect:ConvOclDirectFwd,0,912534,0,miopenConvolutionFwdAlgoDirect;miopenConvolutionFwdAlgoGEMM:GemmFwdRest,28,92,3612672,MIOpenGEMM
256-28-28-3x3-256-56-56-32-1x1-2x2-1x1-0-NCHW-FP32-B_g32=miopenConvolutionBwdDataAlgoDirect:ConvOclDirectFwd,1,39933,0,miopenConvolutionBwdDataAlgoDirect;miopenConvolutionBwdDataAlgoWinograd:ConvBinWinogradRxSf2x3,1,81528,0,miopenConvolutionBwdDataAlgoWinograd;miopenConvolutionBwdDataAlgoGEMM:gemm,13,733,7225344,MIOpenGEMM
256-56-56-1x1-512-56-56-32-0x0-1x1-1x1-0-NCHW-FP32-F=miopenConvolutionFwdAlgoGEMM:GemmFwd1x1_0_1,4,11823,0,MIOpenGEMM;miopenConvolutionFwdAlgoDirect:ConvAsm1x1U,4,84924,0,miopenConvolutionFwdAlgoDirect;miopenConvolutionFwdAlgoWinograd:ConvBinWinogradRxSf3x2,8,83844,0,miopenConvolutionFwdAlgoWinograd
2048-7-7-1x1-2048-7-7-32-0x0-1x1-1x1-0-NCHW-FP32-B=miopenConvolutionBwdDataAlgoDirect:ConvAsm1x1U,2,5953,0,miopenConvolutionBwdDataAlgoDirect;miopenConvolutionBwdDataAlgoImplicitGEMM:ConvHipImplicitGemmBwdDataV1R1,2,99802,0,miopenConvolutionBwdDataAlgoImplicitGEMM;miopenConvolutionBwdDataAlgoWinograd:ConvBinWinogradRxSf3x2,5,36179,0,miopenConvolutionBwdDataAlgoWinograd;miopenConvolutionBwdDataAlgoGEMM:gemm,5,67967,0,MIOpenGEMM
1024-14-14-3x3-1024-28-28-32-1x1-2x2-1x1-0-NCHW-FP32-W_g64=miopenConvolutionBwdWeightsAlgoDirect:ConvAsmBwdWrW3x3,0,629797,0,miopenConvolutionBwdWeightsAlgoDirect;miopenConvolutionBwdWeightsAlgoGEMM:gemm,50,2094,7225344,MIOpenGEMM
128-56-56-1x1-256-56-56-32-0x0-1x1-1x1-0-NCHW-FP32-F=miopenConvolutionFwdAlgoDirect:ConvAsm1x1U,1,31672,0,miopenConvolutionFwdAlgoDirect;miopenConvolutionFwdAlgoGEMM:GemmFwd1x1_0_1,2,21803,0,MIOpenGEMM;miopenConvolutionFwdAlgoWinograd:ConvBinWinogradRxSf3x2,2,48222,0,miopenConvolutionFwdAlgoWinograd
256-28-28-1x1-512-28-28-32-0x0-1x1-1x1-0-NCHW-FP32-F=miopenConvolutionFwdAlgoDirect:ConvAsm1x1U,1,28435,0,miopenConvolutionFwdAlgoDirect;miopenConvolutionFwdAlgoGEMM:GemmFwd1x1_0_1,2,53878,0,MIOpenGEMM;miopenConvolutionFwdAlgoWinograd:ConvBinWinogradRxSf3x2,2,57923,0,miopenConvolutionFwdAlgoWinograd
1024-14-14-3x3-1024-28-28-32-1x1-2x2-1x1-0-NCHW-FP32-B_g64=miopenConvolutionBwdDataAlgoDirect:ConvOclDirectFwd,1,34532,0,miopenConvolutionBwdDataAlgoDirect;miopenConvolutionBwdDataAlgoWinograd:ConvBinWinogradRxSf2x3,2,4887,0,miopenConvolutionBwdDataAlgoWinograd;miopenConvolutionBwdDataAlgoGEMM:gemm,44,2141,7225344,MIOpenGEMM
256-56-56-1x1-64-56-56-32-0x0-1x1-1x1-0-NCHW-FP32-W=miopenConvolutionBwdWeightsAlgoDirect:ConvAsmBwdWrW1x1,0,97547,0,miopenConvolutionBwdWeightsAlgoDirect
512-14-14-3x3-512-14-14-32-1x1-1x1-1x1-0-NCHW-FP32-W_g32=miopenConvolutionBwdWeightsAlgoDirect:ConvAsmBwdWrW3x3,0,246538,0,miopenConvolutionBwdWeightsAlgoDirect;miopenConvolutionBwdWeightsAlgoWinograd:ConvBinWinogradRxSf2x3,0,412288,0,miopenConvolutionBwdWeightsAlgoWinograd;miopenConvolutionBwdWeightsAlgoGEMM:gemm,15,9475,3612672,MIOpenGEMM
256-13-13-3x3-384-13-13-512-1x1-1x1-1x1-0-NCHW-FP32-B=miopenConvolutionBwdDataAlgoWinograd:ConvBinWinogradRxS,9,20707,0,miopenConvolutionBwdDataAlgoWinograd
512-14-14-1x1-1024-14-14-32-0x0-1x1-1x1-0-NCHW-FP32-B=miopenConvolutionBwdDataAlgoDirect:ConvAsm1x1U,1,34962,0,miopenConvolutionBwdDataAlgoDirect;miopenConvolutionBwdDataAlgoWinograd:ConvBinWinogradRxSf3x2,2,57824,0,miopenConvolutionBwdDataAlgoWinograd;miopenConvolutionBwdDataAlgoGEMM:gemm,4,4143,0,MIOpenGEMM
2048-7-7-3x3-2048-7-7-32-1x1-1x1-1x1-0-NCHW-FP32-W_g64=miopenConvolutionBwdWeightsAlgoDirect:ConvAsmBwdWrW3x3,0,415405,0,miopenConvolutionBwdWeightsAlgoDirect;miopenConvolutionBwdWeightsAlgoWinograd:ConvBinWinogradRxSf2x3,3,44333,0,miopenConvolutionBwdWeightsAlgoWinograd;miopenConvolutionBwdWeightsAlgoGEMM:gemm,122,931,3612672,MIOpenGEMM
256-56-56-3x3-256-56-56-32-1x1-1x1-1x1-0-NCHW-FP32-W_g32=miopenConvolutionBwdWeightsAlgoDirect:ConvAsmBwdWrW3x3,0,787626,0,miopenConvolutionBwdWeightsAlgoDirect;miopenConvolutionBwdWeightsAlgoWinograd:ConvBinWinogradRxSf2x3,24,8326,0,miopenConvolutionBwdWeightsAlgoWinograd;miopenConvolutionBwdWeightsAlgoGEMM:gemm,36,8973,28901376,MIOpenGEMM
1024-28-28-3x3-1024-14-14-32-1x1-2x2-1x1-0-NCHW-FP32-F_g64=miopenConvolutionFwdAlgoImplicitGEMM:ConvHipImplicitGemmV4R1Fwd,1,59886,0,miopenConvolutionFwdAlgoImplicitGEMM;miopenConvolutionFwdAlgoDirect:ConvOclDirectFwd,2,81767,0,miopenConvolutionFwdAlgoDirect;miopenConvolutionFwdAlgoWinograd:ConvBinWinogradRxSf2x3,4,37038,0,miopenConvolutionFwdAlgoWinograd;miopenConvolutionFwdAlgoGEMM:GemmFwdRest,57,4745,7225344,MIOpenGEMM
384-13-13-3x3-256-13-13-512-1x1-1x1-1x1-0-NCHW-FP32-F=miopenConvolutionFwdAlgoWinograd:ConvBinWinograd3x3U,10,145,0,miopenConvolutionFwdAlgoWinograd
384-13-13-3x3-384-13-13-512-1x1-1x1-1x1-0-NCHW-FP32-B=miopenConvolutionBwdDataAlgoWinograd:ConvBinWinogradRxSf2x3,17,3258,0,miopenConvolutionBwdDataAlgoWinograd
512-14-14-3x3-512-14-14-32-1x1-1x1-1x1-0-NCHW-FP32-B_g32=miopenConvolutionBwdDataAlgoDirect:ConvOclDirectFwd,0,553701,0,miopenConvolutionBwdDataAlgoDirect;miopenConvolutionBwdDataAlgoWinograd:ConvBinWinogradRxSf2x3,1,12153,0,miopenConvolutionBwdDataAlgoWinograd;miopenConvolutionBwdDataAlgoGEMM:gemm,13,1837,3612672,MIOpenGEMM
512-28-28-3x3-512-56-56-32-1x1-2x2-1x1-0-NCHW-FP32-W_g32=miopenConvolutionBwdWeightsAlgoDirect:ConvAsmBwdWrW3x3,1,719,0,miopenConvolutionBwdWeightsAlgoDirect;miopenConvolutionBwdWeightsAlgoGEMM:gemm,31,5828,14450688,MIOpenGEMM
2048-7-7-3x3-2048-7-7-32-1x1-1x1-1x1-0-NCHW-FP32-B_g64=miopenConvolutionBwdDataAlgoDirect:ConvOclDirectFwd,1,6054,0,miopenConvolutionBwdDataAlgoDirect;miopenConvolutionBwdDataAlgoWinograd:ConvBinWinogradRxSf2x3,2,927,0,miopenConvolutionBwdDataAlgoWinograd;miopenConvolutionBwdDataAlgoGEMM:gemm,38,3524,3612672,MIOpenGEMM
256-56-56-3x3-256-56-56-32-1x1-1x1-1x1-0-NCHW-FP32-B_g32=miopenConvolutionBwdDataAlgoDirect:ConvAsm3x3U,0,688652,0,miopenConvolutionBwdDataAlgoDirect;miopenConvolutionBwdDataAlgoWinograd:ConvBinWinogradRxSf2x3,2,74203,0,miopenConvolutionBwdDataAlgoWinograd;miopenConvolutionBwdDataAlgoGEMM:gemm,23,3451,28901376,MIOpenGEMM
128-56-56-3x3-128-56-56-32-1x1-1x1-1x1-0-NCHW-FP32-W_g32=miopenConvolutionBwdWeightsAlgoDirect:ConvAsmBwdWrW3x3,0,335566,0,miopenConvolutionBwdWeightsAlgoDirect;miopenConvolutionBwdWeightsAlgoWinograd:ConvBinWinogradRxSf2x3,35,117,0,miopenConvolutionBwdWeightsAlgoWinograd;miopenConvolutionBwdWeightsAlgoGEMM:gemm,100,3,14450688,MIOpenGEMM
2048-7-7-3x3-2048-14-14-32-1x1-2x2-1x1-0-NCHW-FP32-W_g32=miopenConvolutionBwdWeightsAlgoImplicitGEMM:ConvHipImplicitGemmV4R1WrW,0,969699,0,miopenConvolutionBwdWeightsAlgoImplicitGEMM;miopenConvolutionBwdWeightsAlgoDirect:ConvAsmBwdWrW3x3,1,5981,0,miopenConvolutionBwdWeightsAlgoDirect;miopenConvolutionBwdWeightsAlgoGEMM:gemm,12,1656,3612672,MIOpenGEMM
256-56-56-3x3-256-56-56-32-1x1-1x1-1x1-0-NCHW-FP32-F_g32=miopenConvolutionFwdAlgoDirect:ConvAsm3x3U,0,688638,0,miopenConvolutionFwdAlgoDirect;miopenConvolutionFwdAlgoWinograd:ConvBinWinogradRxSf2x3,2,71536,0,miopenConvolutionFwdAlgoWinograd;miopenConvolutionFwdAlgoGEMM:GemmFwdRest,18,9594,28901376,MIOpenGEMM
2048-7-7-3x3-2048-14-14-32-1x1-2x2-1x1-0-NCHW-FP32-B_g32=miopenConvolutionBwdDataAlgoWinograd:ConvBinWinogradRxSf2x3,1,85511,0,miopenConvolutionBwdDataAlgoWinograd;miopenConvolutionBwdDataAlgoDirect:ConvOclDirectFwd,2,95758,0,miopenConvolutionBwdDataAlgoDirect;miopenConvolutionBwdDataAlgoGEMM:gemm,17,1507,3612672,MIOpenGEMM
256-14-14-1x1-1024-14-14-128-0x0-1x1-1x1-0-NCHW-FP32-F=miopenConvolutionFwdAlgoDirect:ConvAsm1x1U,3,86174,0,miopenConvolutionFwdAlgoDirect;miopenConvolutionFwdAlgoGEMM:GemmFwd1x1_0_1,30,5358,0,MIOpenGEMM
2048-7-7-3x3-2048-7-7-32-1x1-1x1-1x1-0-NCHW-FP32-F_g64=miopenConvolutionFwdAlgoWinograd:ConvBinWinogradRxSf2x3,0,677428,0,miopenConvolutionFwdAlgoWinograd;miopenConvolutionFwdAlgoImplicitGEMM:ConvHipImplicitGemmV4R1Fwd,0,850401,0,miopenConvolutionFwdAlgoImplicitGEMM;miopenConvolutionFwdAlgoDirect:ConvOclDirectFwd,1,5958,0,miopenConvolutionFwdAlgoDirect;miopenConvolutionFwdAlgoGEMM:GemmFwdRest,43,9881,3612672,MIOpenGEMM
512-7-7-1x1-1024-14-14-128-0x0-2x2-1x1-0-NCHW-FP32-W=miopenConvolutionBwdWeightsAlgoDirect:ConvAsmBwdWrW1x1,4,50816,25690112,miopenConvolutionBwdWeightsAlgoDirect;miopenConvolutionBwdWeightsAlgoImplicitGEMM:ConvHipImplicitGemmV4R1WrW,5,36565,0,miopenConvolutionBwdWeightsAlgoImplicitGEMM;miopenConvolutionBwdWeightsAlgoGEMM:gemm,83,5336,200704,MIOpenGEMM
512-28-28-3x3-512-56-56-32-1x1-2x2-1x1-0-NCHW-FP32-B_g32=miopenConvolutionBwdDataAlgoWinograd:ConvBinWinogradRxSf2x3,2,20331,0,miopenConvolutionBwdDataAlgoWinograd;miopenConvolutionBwdDataAlgoDirect:ConvOclDirectFwd,4,8299,0,miopenConvolutionBwdDataAlgoDirect;miopenConvolutionBwdDataAlgoGEMM:gemm,19,7798,14450688,MIOpenGEMM
1024-28-28-1x1-512-28-28-32-0x0-1x1-1x1-0-NCHW-FP32-W=miopenConvolutionBwdWeightsAlgoDirect:ConvAsmBwdWrW1x1,4,79368,0,miopenConvolutionBwdWeightsAlgoDirect;miopenConvolutionBwdWeightsAlgoWinograd:ConvBinWinogradRxSf2x3,23,2689,0,miopenConvolutionBwdWeightsAlgoWinograd
2048-14-14-3x3-2048-7-7-32-1x1-2x2-1x1-0-NCHW-FP32-F_g32=miopenConvolutionFwdAlgoImplicitGEMM:ConvHipImplicitGemmV4R1Fwd,1,2552,0,miopenConvolutionFwdAlgoImplicitGEMM;miopenConvolutionFwdAlgoWinograd:ConvBinWinogradRxSf2x3,1,71618,0,miopenConvolutionFwdAlgoWinograd;miopenConvolutionFwdAlgoDirect:ConvOclDirectFwd,3,86994,0,miopenConvolutionFwdAlgoDirect;miopenConvolutionFwdAlgoGEMM:GemmFwdRest,26,4528,3612672,MIOpenGEMM
256-56-56-3x3-256-56-56-32-1x1-1x1-1x1-0-NCHW-FP32-W_g64=miopenConvolutionBwdWeightsAlgoDirect:ConvAsmBwdWrW3x3,0,648453,0,miopenConvolutionBwdWeightsAlgoDirect;miopenConvolutionBwdWeightsAlgoWinograd:ConvBinWinogradRxSf2x3,42,1387,0,miopenConvolutionBwdWeightsAlgoWinograd;miopenConvolutionBwdWeightsAlgoGEMM:gemm,226,657,28901376,MIOpenGEMM
512-14-14-3x3-512-14-14-32-1x1-1x1-1x1-0-NCHW-FP32-F_g32=miopenConvolutionFwdAlgoWinograd:ConvBinWinogradRxSf2x3,0,516683,0,miopenConvolutionFwdAlgoWinograd;miopenConvolutionFwdAlgoDirect:ConvOclDirectFwd,0,578646,0,miopenConvolutionFwdAlgoDirect;miopenConvolutionFwdAlgoImplicitGEMM:ConvHipImplicitGemmV4R1Fwd,0,926039,0,miopenConvolutionFwdAlgoImplicitGEMM;miopenConvolutionFwdAlgoGEMM:GemmFwdRest,27,9316,3612672,MIOpenGEMM
512-28-28-3x3-512-56-56-32-1x1-2x2-1x1-0-NCHW-FP32-W_g64=miopenConvolutionBwdWeightsAlgoDirect:ConvAsmBwdWrW3x3,1,22917,0,miopenConvolutionBwdWeightsAlgoDirect;miopenConvolutionBwdWeightsAlgoGEMM:gemm,172,329,14450688,MIOpenGEMM
64-27-27-5x5-192-27-27-512-2x2-1x1-1x1-0-NCHW-FP32-F=miopenConvolutionFwdAlgoWinograd:ConvBinWinogradRxS,26,8689,0,miopenConvolutionFwdAlgoWinograd;miopenConvolutionFwdAlgoFFT:fft,42,3669,856195072,miopenConvolutionFwdAlgoFFT;miopenConvolutionFwdAlgoImplicitGEMM:ConvHipImplicitGemmV4R1Fwd,71,9793,0,miopenConvolutionFwdAlgoImplicitGEMM;miopenConvolutionFwdAlgoDirect:ConvOclDirectFwd,104,587,0,miopenConvolutionFwdAlgoDirect;miopenConvolutionFwdAlgoGEMM:GemmFwdRest,622,68,4665600,MIOpenGEMM
1024-28-28-1x1-512-28-28-32-0x0-1x1-1x1-0-NCHW-FP32-B=miopenConvolutionBwdDataAlgoDirect:ConvAsm1x1U,4,159,0,miopenConvolutionBwdDataAlgoDirect;miopenConvolutionBwdDataAlgoGEMM:gemm,5,83567,0,MIOpenGEMM;miopenConvolutionBwdDataAlgoWinograd:ConvBinWinogradRxSf3x2,6,38329,0,miopenConvolutionBwdDataAlgoWinograd
512-7-7-1x1-1024-14-14-128-0x0-2x2-1x1-0-NCHW-FP32-B=miopenConvolutionBwdDataAlgoDirect:ConvAsm1x1UV2,1,83706,0,miopenConvolutionBwdDataAlgoDirect;miopenConvolutionBwdDataAlgoGEMM:gemm,21,5276,38535168,MIOpenGEMM;miopenConvolutionBwdDataAlgoWinograd:ConvBinWinogradRxSf2x3,51,5081,0,miopenConvolutionBwdDataAlgoWinograd
512-7-7-3x3-512-7-7-128-1x1-1x1-1x1-0-NCHW-FP32-B=miopenConvolutionBwdDataAlgoWinograd:ConvBinWinograd3x3U,2,43311,0,miopenConvolutionBwdDataAlgoWinograd
1024-14-14-3x3-1024-28-28-32-1x1-2x2-1x1-0-NCHW-FP32-W_g32=miopenConvolutionBwdWeightsAlgoDirect:ConvAsmBwdWrW3x3,0,8255,0,miopenConvolutionBwdWeightsAlgoDirect;miopenConvolutionBwdWeightsAlgoGEMM:gemm,31,9126,7225344,MIOpenGEMM
512-28-28-1x1-256-56-56-128-0x0-2x2-1x1-0-NCHW-FP32-B=miopenConvolutionBwdDataAlgoDirect:ConvAsm1x1UV2,6,22667,0,miopenConvolutionBwdDataAlgoDirect;miopenConvolutionBwdDataAlgoWinograd:ConvBinWinogradRxSf2x3,59,531,0,miopenConvolutionBwdDataAlgoWinograd
512-28-28-3x3-512-56-56-32-1x1-2x2-1x1-0-NCHW-FP32-B_g64=miopenConvolutionBwdDataAlgoDirect:ConvOclDirectFwd,2,25287,0,miopenConvolutionBwdDataAlgoDirect;miopenConvolutionBwdDataAlgoWinograd:ConvBinWinogradRxSf2x3,3,56347,0,miopenConvolutionBwdDataAlgoWinograd;miopenConvolutionBwdDataAlgoGEMM:gemm,24,445,14450688,MIOpenGEMM
512-28-28-1x1-128-28-28-128-0x0-1x1-1x1-0-NCHW-FP32-F=miopenConvolutionFwdAlgoDirect:ConvAsm1x1U,2,77203,0,miopenConvolutionFwdAlgoDirect;miopenConvolutionFwdAlgoWinograd:ConvBinWinogradRxSf3x2,5,4158,0,miopenConvolutionFwdAlgoWinograd;miopenConvolutionFwdAlgoGEMM:GemmFwd1x1_0_1,8,17974,0,MIOpenGEMM
512-56-56-3x3-512-28-28-32-1x1-2x2-1x1-0-NCHW-FP32-F_g32=miopenConvolutionFwdAlgoImplicitGEMM:ConvHipImplicitGemmV4R1Fwd,1,59953,0,miopenConvolutionFwdAlgoImplicitGEMM;miopenConvolutionFwdAlgoWinograd:ConvBinWinogradRxSf2x3,2,92076,0,miopenConvolutionFwdAlgoWinograd;miopenConvolutionFwdAlgoDirect:ConvOclDirectFwd,5,55399,0,miopenConvolutionFwdAlgoDirect;miopenConvolutionFwdAlgoGEMM:GemmFwdRest,19,1417,14450688,MIOpenGEMM
384-13-13-3x3-384-13-13-512-1x1-1x1-1x1-0-NCHW-FP32-W=miopenConvolutionBwdWeightsAlgoWinograd:ConvBinWinogradRxS,34,9961,0,miopenConvolutionBwdWeightsAlgoWinograd;miopenConvolutionBwdWeightsAlgoDirect:ConvAsmBwdWrW3x3,40,6035,0,miopenConvolutionBwdWeightsAlgoDirect;miopenConvolutionBwdWeightsAlgoImplicitGEMM:ConvHipImplicitGemmV4R1WrW,49,3353,0,miopenConvolutionBwdWeightsAlgoImplicitGEMM;miopenConvolutionBwdWeightsAlgoGEMM:gemm,61,6114,2336256,MIOpenGEMM
1024-14-14-3x3-1024-14-14-32-1x1-1x1-1x1-0-NCHW-FP32-W_g32=miopenConvolutionBwdWeightsAlgoDirect:ConvAsmBwdWrW3x3,0,693934,0,miopenConvolutionBwdWeightsAlgoDirect;miopenConvolutionBwdWeightsAlgoWinograd:ConvBinWinogradRxSf2x3,1,4236,0,miopenConvolutionBwdWeightsAlgoWinograd;miopenConvolutionBwdWeightsAlgoGEMM:gemm,29,6985,7225344,MIOpenGEMM
1024-14-14-3x3-1024-28-28-32-1x1-2x2-1x1-0-NCHW-FP32-B_g32=miopenConvolutionBwdDataAlgoWinograd:ConvBinWinogradRxSf2x3,2,8073,0,miopenConvolutionBwdDataAlgoWinograd;miopenConvolutionBwdDataAlgoDirect:ConvOclDirectFwd,2,64842,0,miopenConvolutionBwdDataAlgoDirect;miopenConvolutionBwdDataAlgoGEMM:gemm,15,2951,7225344,MIOpenGEMM
128-28-28-3x3-128-28-28-128-1x1-1x1-1x1-0-NCHW-FP32-F=miopenConvolutionFwdAlgoWinograd:ConvBinWinogradRxSf2x3,1,72102,0,miopenConvolutionFwdAlgoWinograd
512-56-56-3x3-512-28-28-32-1x1-2x2-1x1-0-NCHW-FP32-F_g64=miopenConvolutionFwdAlgoDirect:ConvOclDirectFwd,6,3337,0,miopenConvolutionFwdAlgoDirect;miopenConvolutionFwdAlgoWinograd:ConvBinWinogradRxSf2x3,6,70716,0,miopenConvolutionFwdAlgoWinograd;miopenConvolutionFwdAlgoGEMM:GemmFwdRest,105,268,14450688,MIOpenGEMM
512-7-7-3x3-512-7-7-128-1x1-1x1-1x1-0-NCHW-FP32-F=miopenConvolutionFwdAlgoWinograd:ConvBinWinograd3x3U,2,53787,0,miopenConvolutionFwdAlgoWinograd
64-56-56-3x3-64-56-56-128-1x1-1x1-1x1-0-NCHW-FP32-W=miopenConvolutionBwdWeightsAlgoDirect:ConvAsmBwdWrW3x3,5,93396,0,miopenConvolutionBwdWeightsAlgoDirect;miopenConvolutionBwdWeightsAlgoWinograd:ConvBinWinogradRxSf2x3,21,3372,0,miopenConvolutionBwdWeightsAlgoWinograd;miopenConvolutionBwdWeightsAlgoImplicitGEMM:ConvHipImplicitGemmV4R1WrW,65,828,0,miopenConvolutionBwdWeightsAlgoImplicitGEMM;miopenConvolutionBwdWeightsAlgoGEMM:gemm,119,983,7225344,MIOpenGEMM
1024-14-14-3x3-1024-14-14-32-1x1-1x1-1x1-0-NCHW-FP32-B_g32=miopenConvolutionBwdDataAlgoWinograd:ConvBinWinogradRxSf2x3,0,414914,0,miopenConvolutionBwdDataAlgoWinograd;miopenConvolutionBwdDataAlgoDirect:ConvOclDirectFwd,1,97426,0,miopenConvolutionBwdDataAlgoDirect;miopenConvolutionBwdDataAlgoGEMM:gemm,11,8917,7225344,MIOpenGEMM
512-7-7-1x1-2048-7-7-128-0x0-1x1-1x1-0-NCHW-FP32-W=miopenConvolutionBwdWeightsAlgoDirect:ConvAsmBwdWrW1x1,3,2907,0,miopenConvolutionBwdWeightsAlgoDirect;miopenConvolutionBwdWeightsAlgoGEMM:gemm,7,6607,0,MIOpenGEMM;miopenConvolutionBwdWeightsAlgoWinograd:ConvBinWinogradRxSf2x3,16,1329,0,miopenConvolutionBwdWeightsAlgoWinograd
1024-14-14-1x1-512-28-28-128-0x0-2x2-1x1-0-NCHW-FP32-W=miopenConvolutionBwdWeightsAlgoDirect:ConvAsmBwdWrW1x1,8,65557,51380224,miopenConvolutionBwdWeightsAlgoDirect;miopenConvolutionBwdWeightsAlgoImplicitGEMM:ConvHipImplicitGemmV4R1WrW,22,1847,0,miopenConvolutionBwdWeightsAlgoImplicitGEMM;miopenConvolutionBwdWeightsAlgoGEMM:gemm,179,78,401408,MIOpenGEMM
64-56-56-3x3-64-56-56-128-1x1-1x1-1x1-0-NCHW-FP32-B=miopenConvolutionBwdDataAlgoWinograd:ConvBinWinogradRxS,2,24947,0,miopenConvolutionBwdDataAlgoWinograd
256-56-56-1x1-512-28-28-128-0x0-2x2-1x1-0-NCHW-FP32-F=miopenConvolutionFwdAlgoDirect:ConvAsm1x1UV2,6,52887,0,miopenConvolutionFwdAlgoDirect;miopenConvolutionFwdAlgoWinograd:ConvBinWinogradRxS,44,8218,0,miopenConvolutionFwdAlgoWinograd
1024-14-14-1x1-512-7-7-128-0x0-2x2-1x1-0-NCHW-FP32-F=miopenConvolutionFwdAlgoDirect:ConvAsm1x1UV2,6,57129,0,miopenConvolutionFwdAlgoDirect;miopenConvolutionFwdAlgoGEMM:GemmFwd1x1_0_2,12,9408,38535168,MIOpenGEMM;miopenConvolutionFwdAlgoWinograd:ConvBinWinogradRxS,26,3359,0,miopenConvolutionFwdAlgoWinograd
64-56-56-3x3-64-56-56-128-1x1-1x1-1x1-0-NCHW-FP32-F=miopenConvolutionFwdAlgoWinograd:ConvBinWinograd3x3U,1,68846,0,miopenConvolutionFwdAlgoWinograd
2048-7-7-1x1-512-7-7-128-0x0-1x1-1x1-0-NCHW-FP32-F=miopenConvolutionFwdAlgoDirect:ConvAsm1x1U,3,2475,0,miopenConvolutionFwdAlgoDirect;miopenConvolutionFwdAlgoWinograd:ConvBinWinogradRxSf3x2,6,38997,0,miopenConvolutionFwdAlgoWinograd;miopenConvolutionFwdAlgoGEMM:GemmFwd1x1_0_1,13,3594,0,MIOpenGEMM
64-55-55-11x11-3-227-227-512-0x0-4x4-1x1-0-NCHW-FP32-W=miopenConvolutionBwdWeightsAlgoDirect:ConvOclBwdWrW2<8>,28,6642,5947392,miopenConvolutionBwdWeightsAlgoDirect;miopenConvolutionBwdWeightsAlgoGEMM:gemm,48,7468,4392300,MIOpenGEMM
384-13-13-3x3-192-13-13-512-1x1-1x1-1x1-0-NCHW-FP32-W=miopenConvolutionBwdWeightsAlgoDirect:ConvAsmBwdWrW3x3,26,6267,0,miopenConvolutionBwdWeightsAlgoDirect;miopenConvolutionBwdWeightsAlgoWinograd:ConvBinWinogradRxS,29,4069,0,miopenConvolutionBwdWeightsAlgoWinograd;miopenConvolutionBwdWeightsAlgoImplicitGEMM:ConvHipImplicitGemmV4R1WrW,35,9318,0,miopenConvolutionBwdWeightsAlgoImplicitGEMM;miopenConvolutionBwdWeightsAlgoGEMM:gemm,358,508,1168128,MIOpenGEMM
1024-14-14-3x3-1024-14-14-32-1x1-1x1-1x1-0-NCHW-FP32-F_g32=miopenConvolutionFwdAlgoWinograd:ConvBinWinogradRxSf2x3,0,416309,0,miopenConvolutionFwdAlgoWinograd;miopenConvolutionFwdAlgoImplicitGEMM:ConvHipImplicitGemmV4R1Fwd,0,838245,0,miopenConvolutionFwdAlgoImplicitGEMM;miopenConvolutionFwdAlgoDirect:ConvAsm3x3U,2,56185,0,miopenConvolutionFwdAlgoDirect;miopenConvolutionFwdAlgoGEMM:GemmFwdRest,17,4859,7225344,MIOpenGEMM
1024-14-14-1x1-512-28-28-128-0x0-2x2-1x1-0-NCHW-FP32-B=miopenConvolutionBwdDataAlgoDirect:ConvAsm1x1UV2,11,32,0,miopenConvolutionBwdDataAlgoDirect;miopenConvolutionBwdDataAlgoWinograd:ConvBinWinogradRxSf2x3,99,4454,0,miopenConvolutionBwdDataAlgoWinograd
512-28-28-3x3-512-28-28-32-1x1-1x1-1x1-0-NCHW-FP32-W_g64=miopenConvolutionBwdWeightsAlgoDirect:ConvAsmBwdWrW3x3,0,458003,0,miopenConvolutionBwdWeightsAlgoDirect;miopenConvolutionBwdWeightsAlgoWinograd:ConvBinWinogradRxSf2x3,24,1878,0,miopenConvolutionBwdWeightsAlgoWinograd;miopenConvolutionBwdWeightsAlgoGEMM:gemm,84,5755,14450688,MIOpenGEMM
128-28-28-1x1-256-56-56-128-0x0-2x2-1x1-0-NCHW-FP32-W=miopenConvolutionBwdWeightsAlgoDirect:ConvAsmBwdWrW1x1,6,5039,102760448,miopenConvolutionBwdWeightsAlgoDirect;miopenConvolutionBwdWeightsAlgoImplicitGEMM:ConvHipImplicitGemmV4R1WrW,36,3189,0,miopenConvolutionBwdWeightsAlgoImplicitGEMM;miopenConvolutionBwdWeightsAlgoGEMM:gemm,250,495,802816,MIOpenGEMM
2048-7-7-3x3-2048-7-7-32-1x1-1x1-1x1-0-NCHW-FP32-W_g32=miopenConvolutionBwdWeightsAlgoDirect:ConvAsmBwdWrW3x3,0,662211,0,miopenConvolutionBwdWeightsAlgoDirect;miopenConvolutionBwdWeightsAlgoImplicitGEMM:ConvHipImplicitGemmV4R1WrW,0,967922,0,miopenConvolutionBwdWeightsAlgoImplicitGEMM;miopenConvolutionBwdWeightsAlgoWinograd:ConvBinWinogradRxSf2x3,1,16798,0,miopenConvolutionBwdWeightsAlgoWinograd;miopenConvolutionBwdWeightsAlgoGEMM:gemm,10,7164,3612672,MIOpenGEMM
512-28-28-3x3-512-28-28-32-1x1-1x1-1x1-0-NCHW-FP32-W_g32=miopenConvolutionBwdWeightsAlgoDirect:ConvAsmBwdWrW3x3,0,739148,0,miopenConvolutionBwdWeightsAlgoDirect;miopenConvolutionBwdWeightsAlgoWinograd:ConvBinWinogradRxSf2x3,15,8914,0,miopenConvolutionBwdWeightsAlgoWinograd;miopenConvolutionBwdWeightsAlgoGEMM:gemm,32,7175,14450688,MIOpenGEMM
512-28-28-1x1-256-14-14-128-0x0-2x2-1x1-0-NCHW-FP32-F=miopenConvolutionFwdAlgoDirect:ConvAsm1x1UV2,1,98437,0,miopenConvolutionFwdAlgoDirect;miopenConvolutionFwdAlgoWinograd:ConvBinWinogradRxSf2x3,11,7308,0,miopenConvolutionFwdAlgoWinograd
2048-7-7-1x1-512-7-7-128-0x0-1x1-1x1-0-NCHW-FP32-W=miopenConvolutionBwdWeightsAlgoDirect:ConvAsmBwdWrW1x1,2,65942,0,miopenConvolutionBwdWeightsAlgoDirect;miopenConvolutionBwdWeightsAlgoGEMM:gemm,5,78567,0,MIOpenGEMM;miopenConvolutionBwdWeightsAlgoWinograd:ConvBinWinogradRxSf2x3,8,20424,0,miopenConvolutionBwdWeightsAlgoWinograd
128-28-28-3x3-128-28-28-128-1x1-1x1-1x1-0-NCHW-FP32-B=miopenConvolutionBwdDataAlgoWinograd:ConvBinWinogradRxSf2x3,2,7056,0,miopenConvolutionBwdDataAlgoWinograd
256-14-14-1x1-1024-14-14-128-0x0-1x1-1x1-0-NCHW-FP32-W=miopenConvolutionBwdWeightsAlgoDirect:ConvAsmBwdWrW1x1,2,34221,0,miopenConvolutionBwdWeightsAlgoDirect;miopenConvolutionBwdWeightsAlgoGEMM:gemm,6,3654,0,MIOpenGEMM;miopenConvolutionBwdWeightsAlgoWinograd:ConvBinWinogradRxS,14,8699,0,miopenConvolutionBwdWeightsAlgoWinograd
384-13-13-3x3-192-13-13-512-1x1-1x1-1x1-0-NCHW-FP32-B=miopenConvolutionBwdDataAlgoWinograd:ConvBinWinogradRxSf2x3,7,9031,0,miopenConvolutionBwdDataAlgoWinograd
3-227-227-11x11-64-55-55-512-0x0-4x4-1x1-0-NCHW-FP32-F=miopenConvolutionFwdAlgoDirect:ConvOclDirectFwd11x11,26,4079,0,miopenConvolutionFwdAlgoDirect;miopenConvolutionFwdAlgoGEMM:GemmFwdRest,39,5016,4392300,MIOpenGEMM
512-7-7-1x1-2048-7-7-128-0x0-1x1-1x1-0-NCHW-FP32-B=miopenConvolutionBwdDataAlgoDirect:ConvAsm1x1U,3,6502,0,miopenConvolutionBwdDataAlgoDirect;miopenConvolutionBwdDataAlgoGEMM:gemm,23,2441,0,MIOpenGEMM
512-28-28-3x3-512-28-28-32-1x1-1x1-1x1-0-NCHW-FP32-B_g32=miopenConvolutionBwdDataAlgoWinograd:ConvBinWinogradRxSf2x3,1,15662,0,miopenConvolutionBwdDataAlgoWinograd;miopenConvolutionBwdDataAlgoDirect:ConvAsm3x3U,1,2966,0,miopenConvolutionBwdDataAlgoDirect;miopenConvolutionBwdDataAlgoGEMM:gemm,12,9226,14450688,MIOpenGEMM
192-27-27-5x5-64-27-27-512-2x2-1x1-1x1-0-NCHW-FP32-W=miopenConvolutionBwdWeightsAlgoWinograd:ConvBinWinogradRxSf2x3,28,17,0,miopenConvolutionBwdWeightsAlgoWinograd;miopenConvolutionBwdWeightsAlgoDirect:ConvOclBwdWrW53,37,6515,0,miopenConvolutionBwdWeightsAlgoDirect;miopenConvolutionBwdWeightsAlgoGEMM:gemm,57,8327,4665600,MIOpenGEMM;miopenConvolutionBwdWeightsAlgoImplicitGEMM:ConvHipImplicitGemmV4R1WrW,76,9861,0,miopenConvolutionBwdWeightsAlgoImplicitGEMM
256-56-56-1x1-128-28-28-128-0x0-2x2-1x1-0-NCHW-FP32-F=miopenConvolutionFwdAlgoDirect:ConvAsm1x1UV2,1,57718,0,miopenConvolutionFwdAlgoDirect;miopenConvolutionFwdAlgoGEMM:GemmFwd1x1_0_2,5,39602,154140672,MIOpenGEMM;miopenConvolutionFwdAlgoWinograd:ConvBinWinogradRxS,8,84667,0,miopenConvolutionFwdAlgoWinograd
64-56-56-1x1-64-56-56-128-0x0-1x1-1x1-0-NCHW-FP32-W=miopenConvolutionBwdWeightsAlgoDirect:ConvAsmBwdWrW1x1,2,3519,0,miopenConvolutionBwdWeightsAlgoDirect
128-28-28-1x1-256-56-56-128-0x0-2x2-1x1-0-NCHW-FP32-B=miopenConvolutionBwdDataAlgoDirect:ConvAsm1x1UV2,1,68894,0,miopenConvolutionBwdDataAlgoDirect;miopenConvolutionBwdDataAlgoGEMM:gemm,7,43703,154140672,MIOpenGEMM;miopenConvolutionBwdDataAlgoWinograd:ConvBinWinogradRxSf2x3,12,9052,0,miopenConvolutionBwdDataAlgoWinograd
256-14-14-3x3-256-14-14-128-1x1-1x1-1x1-0-NCHW-FP32-B=miopenConvolutionBwdDataAlgoWinograd:ConvBinWinogradRxSf2x3,1,59342,0,miopenConvolutionBwdDataAlgoWinograd
512-28-28-1x1-1024-14-14-128-0x0-2x2-1x1-0-NCHW-FP32-F=miopenConvolutionFwdAlgoDirect:ConvAsm1x1U,7,35785,51380224,miopenConvolutionFwdAlgoDirect
512-7-7-1x1-2048-7-7-128-0x0-1x1-1x1-0-NCHW-FP32-F=miopenConvolutionFwdAlgoDirect:ConvAsm1x1U,3,69559,0,miopenConvolutionFwdAlgoDirect;miopenConvolutionFwdAlgoGEMM:GemmFwd1x1_0_1,19,878,0,MIOpenGEMM
2048-7-7-1x1-512-7-7-128-0x0-1x1-1x1-0-NCHW-FP32-B=miopenConvolutionBwdDataAlgoDirect:ConvAsm1x1U,3,35236,0,miopenConvolutionBwdDataAlgoDirect;miopenConvolutionBwdDataAlgoWinograd:ConvBinWinogradRxSf3x2,8,85322,0,miopenConvolutionBwdDataAlgoWinograd;miopenConvolutionBwdDataAlgoGEMM:gemm,13,3155,0,MIOpenGEMM
256-14-14-1x1-1024-14-14-128-0x0-1x1-1x1-0-NCHW-FP32-B=miopenConvolutionBwdDataAlgoDirect:ConvAsm1x1U,2,42417,0,miopenConvolutionBwdDataAlgoDirect;miopenConvolutionBwdDataAlgoWinograd:ConvBinWinogradRxSf3x2,4,92686,0,miopenConvolutionBwdDataAlgoWinograd;miopenConvolutionBwdDataAlgoGEMM:gemm,9,16204,0,MIOpenGEMM
64-56-56-1x1-64-56-56-128-0x0-1x1-1x1-0-NCHW-FP32-B=miopenConvolutionBwdDataAlgoDirect:ConvAsm1x1U,1,47393,0,miopenConvolutionBwdDataAlgoDirect;miopenConvolutionBwdDataAlgoGEMM:gemm,14,1048,0,MIOpenGEMM
1024-14-14-1x1-256-14-14-128-0x0-1x1-1x1-0-NCHW-FP32-W=miopenConvolutionBwdWeightsAlgoDirect:ConvAsmBwdWrW1x1,2,55763,0,miopenConvolutionBwdWeightsAlgoDirect;miopenConvolutionBwdWeightsAlgoGEMM:gemm,20,308,0,MIOpenGEMM;miopenConvolutionBwdWeightsAlgoWinograd:ConvBinWinogradRxSf2x3,22,6225,0,miopenConvolutionBwdWeightsAlgoWinograd
64-112-112-7x7-3-230-230-128-0x0-2x2-1x1-0-NCHW-FP32-W=miopenConvolutionBwdWeightsAlgoDirect:ConvOclBwdWrW2<8>,11,5403,602112,miopenConvolutionBwdWeightsAlgoDirect;miopenConvolutionBwdWeightsAlgoGEMM:gemm,91,5104,7375872,MIOpenGEMM
256-14-14-3x3-256-14-14-128-1x1-1x1-1x1-0-NCHW-FP32-W=miopenConvolutionBwdWeightsAlgoDirect:ConvAsmBwdWrW3x3,6,14234,0,miopenConvolutionBwdWeightsAlgoDirect;miopenConvolutionBwdWeightsAlgoWinograd:ConvBinWinogradRxS,7,5357,0,miopenConvolutionBwdWeightsAlgoWinograd;miopenConvolutionBwdWeightsAlgoImplicitGEMM:ConvHipImplicitGemmV4R1WrW,15,8135,0,miopenConvolutionBwdWeightsAlgoImplicitGEMM;miopenConvolutionBwdWeightsAlgoGEMM:gemm,247,21,1806336,MIOpenGEMM
64-56-56-1x1-64-56-56-128-0x0-1x1-1x1-0-NCHW-FP32-F=miopenConvolutionFwdAlgoDirect:ConvAsm1x1U,1,16218,0,miopenConvolutionFwdAlgoDirect;miopenConvolutionFwdAlgoGEMM:GemmFwd1x1_0_1,14,7313,0,MIOpenGEMM
1024-14-14-1x1-256-14-14-128-0x0-1x1-1x1-0-NCHW-FP32-F=miopenConvolutionFwdAlgoDirect:ConvAsm1x1U,2,90753,0,miopenConvolutionFwdAlgoDirect;miopenConvolutionFwdAlgoWinograd:ConvBinWinogradRxSf3x2,4,75138,0,miopenConvolutionFwdAlgoWinograd;miopenConvolutionFwdAlgoGEMM:GemmFwd1x1_0_1,15,973,0,MIOpenGEMM
3-230-230-7x7-64-112-112-128-0x0-2x2-1x1-0-NCHW-FP32-F=miopenConvolutionFwdAlgoWinograd:ConvBinWinogradRxS,8,7499,0,miopenConvolutionFwdAlgoWinograd;miopenConvolutionFwdAlgoDirect:ConvOclDirectFwd,8,8127,0,miopenConvolutionFwdAlgoDirect;miopenConvolutionFwdAlgoGEMM:GemmFwdRest,287,53,7375872,MIOpenGEMM
192-13-13-3x3-384-13-13-512-1x1-1x1-1x1-0-NCHW-FP32-F=miopenConvolutionFwdAlgoWinograd:ConvBinWinogradRxS,7,60212,0,miopenConvolutionFwdAlgoWinograd
256-14-14-3x3-256-14-14-128-1x1-1x1-1x1-0-NCHW-FP32-F=miopenConvolutionFwdAlgoWinograd:ConvBinWinogradRxS,2,11547,0,miopenConvolutionFwdAlgoWinograd
512-28-28-3x3-512-28-28-32-1x1-1x1-1x1-0-NCHW-FP32-F_g32=miopenConvolutionFwdAlgoImplicitGEMM:ConvHipImplicitGemmV4R1Fwd,1,4766,0,miopenConvolutionFwdAlgoImplicitGEMM;miopenConvolutionFwdAlgoWinograd:ConvBinWinogradRxSf2x3,1,14162,0,miopenConvolutionFwdAlgoWinograd;miopenConvolutionFwdAlgoDirect:ConvAsm3x3U,1,30216,0,miopenConvolutionFwdAlgoDirect;miopenConvolutionFwdAlgoGEMM:GemmFwdRest,18,516,14450688,MIOpenGEMM
2048-7-7-1x1-1024-14-14-128-0x0-2x2-1x1-0-NCHW-FP32-B=miopenConvolutionBwdDataAlgoDirect:ConvAsm1x1U,5,59168,25690112,miopenConvolutionBwdDataAlgoDirect;miopenConvolutionBwdDataAlgoGEMM:gemm,35,9905,77070336,MIOpenGEMM;miopenConvolutionBwdDataAlgoWinograd:ConvBinWinogradRxSf2x3,119,502,0,miopenConvolutionBwdDataAlgoWinograd
256-56-56-1x1-64-56-56-128-0x0-1x1-1x1-0-NCHW-FP32-F=miopenConvolutionFwdAlgoDirect:ConvAsm1x1U,2,24895,0,miopenConvolutionFwdAlgoDirect
2048-7-7-1x1-1024-14-14-128-0x0-2x2-1x1-0-NCHW-FP32-W=miopenConvolutionBwdWeightsAlgoImplicitGEMM:ConvHipImplicitGemmV4R1WrW,6,56574,0,miopenConvolutionBwdWeightsAlgoImplicitGEMM;miopenConvolutionBwdWeightsAlgoDirect:ConvAsmBwdWrW1x1,7,47868,25690112,miopenConvolutionBwdWeightsAlgoDirect;miopenConvolutionBwdWeightsAlgoGEMM:gemm,55,5585,200704,MIOpenGEMM
64-56-56-1x1-256-56-56-128-0x0-1x1-1x1-0-NCHW-FP32-F=miopenConvolutionFwdAlgoDirect:ConvOclDirectFwd1x1,3,51569,0,miopenConvolutionFwdAlgoDirect
256-14-14-1x1-512-28-28-128-0x0-2x2-1x1-0-NCHW-FP32-B=miopenConvolutionBwdDataAlgoDirect:ConvAsm1x1UV2,1,75225,0,miopenConvolutionBwdDataAlgoDirect;miopenConvolutionBwdDataAlgoGEMM:gemm,11,4655,77070336,MIOpenGEMM;miopenConvolutionBwdDataAlgoWinograd:ConvBinWinogradRxSf2x3,19,392,0,miopenConvolutionBwdDataAlgoWinograd
512-28-28-1x1-128-28-28-128-0x0-1x1-1x1-0-NCHW-FP32-W=miopenConvolutionBwdWeightsAlgoDirect:ConvAsmBwdWrW1x1,2,36451,0,miopenConvolutionBwdWeightsAlgoDirect
256-56-56-1x1-64-56-56-128-0x0-1x1-1x1-0-NCHW-FP32-W=miopenConvolutionBwdWeightsAlgoDirect:ConvAsmBwdWrW1x1,13,3981,0,miopenConvolutionBwdWeightsAlgoDirect
128-28-28-1x1-512-28-28-128-0x0-1x1-1x1-0-NCHW-FP32-W=miopenConvolutionBwdWeightsAlgoDirect:ConvAsmBwdWrW1x1,6,15867,0,miopenConvolutionBwdWeightsAlgoDirect
64-56-56-1x1-256-56-56-128-0x0-1x1-1x1-0-NCHW-FP32-W=miopenConvolutionBwdWeightsAlgoDirect:ConvAsmBwdWrW1x1,8,46167,0,miopenConvolutionBwdWeightsAlgoDirect
256-14-14-1x1-512-28-28-128-0x0-2x2-1x1-0-NCHW-FP32-W=miopenConvolutionBwdWeightsAlgoDirect:ConvAsmBwdWrW1x1,1,90043,51380224,miopenConvolutionBwdWeightsAlgoDirect;miopenConvolutionBwdWeightsAlgoImplicitGEMM:ConvHipImplicitGemmV4R1WrW,5,16305,0,miopenConvolutionBwdWeightsAlgoImplicitGEMM;miopenConvolutionBwdWeightsAlgoGEMM:gemm,9,19598,401408,MIOpenGEMM
128-112-112-3x3-128-112-112-128-1x1-1x1-1x1-0-NCHW-FP32-F=miopenConvolutionFwdAlgoWinograd:ConvBinWinogradRxSf3x2,48,6886,0,miopenConvolutionFwdAlgoWinograd
192-27-27-5x5-64-27-27-512-2x2-1x1-1x1-0-NCHW-FP32-B=miopenConvolutionBwdDataAlgoWinograd:ConvBinWinogradRxSf2x3,23,9973,0,miopenConvolutionBwdDataAlgoWinograd;miopenConvolutionBwdDataAlgoFFT:fft,71,9965,963706880,miopenConvolutionBwdDataAlgoFFT;miopenConvolutionBwdDataAlgoDirect:ConvOclDirectFwd,183,406,0,miopenConvolutionBwdDataAlgoDirect;miopenConvolutionBwdDataAlgoImplicitGEMM:ConvHipImplicitGemmBwdDataV1R1,234,248,0,miopenConvolutionBwdDataAlgoImplicitGEMM;miopenConvolutionBwdDataAlgoGEMM:gemm,1788,9,4665600,MIOpenGEMM
512-7-7-3x3-512-7-7-128-1x1-1x1-1x1-0-NCHW-FP32-W=miopenConvolutionBwdWeightsAlgoWinograd:ConvBinWinogradRxS,4,11282,0,miopenConvolutionBwdWeightsAlgoWinograd;miopenConvolutionBwdWeightsAlgoDirect:ConvAsmBwdWrW3x3,7,85078,0,miopenConvolutionBwdWeightsAlgoDirect;miopenConvolutionBwdWeightsAlgoImplicitGEMM:ConvHipImplicitGemmV4R1WrW,28,5551,0,miopenConvolutionBwdWeightsAlgoImplicitGEMM;miopenConvolutionBwdWeightsAlgoGEMM:gemm,572,762,903168,MIOpenGEMM
256-56-56-1x1-64-56-56-128-0x0-1x1-1x1-0-NCHW-FP32-B=miopenConvolutionBwdDataAlgoDirect:ConvAsm1x1U,3,3139,0,miopenConvolutionBwdDataAlgoDirect;miopenConvolutionBwdDataAlgoGEMM:gemm,8,41978,0,MIOpenGEMM
512-28-28-1x1-128-28-28-128-0x0-1x1-1x1-0-NCHW-FP32-B=miopenConvolutionBwdDataAlgoDirect:ConvAsm1x1U,2,79288,0,miopenConvolutionBwdDataAlgoDirect;miopenConvolutionBwdDataAlgoWinograd:ConvBinWinogradRxSf3x2,6,4862,0,miopenConvolutionBwdDataAlgoWinograd;miopenConvolutionBwdDataAlgoGEMM:gemm,7,84376,0,MIOpenGEMM
1024-14-14-1x1-256-14-14-128-0x0-1x1-1x1-0-NCHW-FP32-B=miopenConvolutionBwdDataAlgoDirect:ConvOclDirectFwd1x1,11,6555,0,miopenConvolutionBwdDataAlgoDirect;miopenConvolutionBwdDataAlgoGEMM:gemm,44,6012,0,MIOpenGEMM
128-28-28-1x1-512-28-28-128-0x0-1x1-1x1-0-NCHW-FP32-B=miopenConvolutionBwdDataAlgoDirect:ConvAsm1x1U,2,48515,0,miopenConvolutionBwdDataAlgoDirect;miopenConvolutionBwdDataAlgoGEMM:gemm,7,34865,0,MIOpenGEMM;miopenConvolutionBwdDataAlgoWinograd:ConvBinWinogradRxSf3x2,7,64207,0,miopenConvolutionBwdDataAlgoWinograd
64-56-56-1x1-256-56-56-128-0x0-1x1-1x1-0-NCHW-FP32-B=miopenConvolutionBwdDataAlgoDirect:ConvAsm1x1U,6,51405,0,miopenConvolutionBwdDataAlgoDirect
256-56-56-3x3-256-56-56-128-1x1-1x1-1x1-0-NCHW-FP32-B=miopenConvolutionBwdDataAlgoWinograd:ConvBinWinograd3x3U,57,2668,0,miopenConvolutionBwdDataAlgoWinograd
64-112-112-3x3-128-112-112-128-1x1-1x1-1x1-0-NCHW-FP32-F=miopenConvolutionFwdAlgoWinograd:ConvBinWinogradRxSf2x3,13,3333,0,miopenConvolutionFwdAlgoWinograd
512-28-28-1x1-256-56-56-128-0x0-2x2-1x1-0-NCHW-FP32-W=miopenConvolutionBwdWeightsAlgoDirect:ConvAsmBwdWrW1x1,42,479,102760448,miopenConvolutionBwdWeightsAlgoDirect;miopenConvolutionBwdWeightsAlgoImplicitGEMM:ConvHipImplicitGemmV4R1WrW,96,3086,0,miopenConvolutionBwdWeightsAlgoImplicitGEMM;miopenConvolutionBwdWeightsAlgoGEMM:gemm,230,518,802816,MIOpenGEMM
1024-14-14-1x1-2048-7-7-128-0x0-2x2-1x1-0-NCHW-FP32-F=miopenConvolutionFwdAlgoDirect:ConvAsm1x1U,9,7386,25690112,miopenConvolutionFwdAlgoDirect;miopenConvolutionFwdAlgoWinograd:ConvBinWinogradRxSf2x3,46,5945,0,miopenConvolutionFwdAlgoWinograd
3-224-224-3x3-64-224-224-128-1x1-1x1-1x1-0-NCHW-FP32-F=miopenConvolutionFwdAlgoWinograd:ConvBinWinogradRxSf2x3,20,677,0,miopenConvolutionFwdAlgoWinograd;miopenConvolutionFwdAlgoDirect:ConvOclDirectFwd,20,8685,0,miopenConvolutionFwdAlgoDirect;miopenConvolutionFwdAlgoGEMM:GemmFwdRest,426,815,5419008,MIOpenGEMM
256-56-56-3x3-256-56-56-128-1x1-1x1-1x1-0-NCHW-FP32-F=miopenConvolutionFwdAlgoWinograd:ConvBinWinogradRxSf2x3,24,914,0,miopenConvolutionFwdAlgoWinograd
128-28-28-1x1-512-28-28-128-0x0-1x1-1x1-0-NCHW-FP32-F=miopenConvolutionFwdAlgoDirect:ConvAsm1x1U,2,95177,0,miopenConvolutionFwdAlgoDirect;miopenConvolutionFwdAlgoWinograd:ConvBinWinogradRxSf3x2,11,3871,0,miopenConvolutionFwdAlgoWinograd;miopenConvolutionFwdAlgoGEMM:GemmFwd1x1_0_1,13,1373,0,MIOpenGEMM
384-13-13-3x3-384-13-13-512-1x1-1x1-1x1-0-NCHW-FP32-F=miopenConvolutionFwdAlgoWinograd:ConvBinWinogradRxSf2x3,15,6846,0,miopenConvolutionFwdAlgoWinograd
128-28-28-3x3-128-28-28-128-1x1-1x1-1x1-0-NCHW-FP32-W=miopenConvolutionBwdWeightsAlgoDirect:ConvAsmBwdWrW3x3,5,91843,0,miopenConvolutionBwdWeightsAlgoDirect;miopenConvolutionBwdWeightsAlgoWinograd:ConvBinWinogradRxS,13,9569,0,miopenConvolutionBwdWeightsAlgoWinograd;miopenConvolutionBwdWeightsAlgoImplicitGEMM:ConvHipImplicitGemmV4R1WrW,24,971,0,miopenConvolutionBwdWeightsAlgoImplicitGEMM;miopenConvolutionBwdWeightsAlgoGEMM:gemm,288,938,3612672,MIOpenGEMM
192-28-28-3x3-128-28-28-128-1x1-1x1-1x1-0-NCHW-FP32-W=miopenConvolutionBwdWeightsAlgoDirect:ConvAsmBwdWrW3x3,5,70883,0,miopenConvolutionBwdWeightsAlgoDirect;miopenConvolutionBwdWeightsAlgoWinograd:ConvBinWinogradRxSf2x3,8,28365,0,miopenConvolutionBwdWeightsAlgoWinograd;miopenConvolutionBwdWeightsAlgoGEMM:gemm,13,1829,3612672,MIOpenGEMM;miopenConvolutionBwdWeightsAlgoImplicitGEMM:ConvHipImplicitGemmV4R1WrW,14,972,0,miopenConvolutionBwdWeightsAlgoImplicitGEMM
160-14-14-3x3-320-14-14-128-1x1-1x1-1x1-0-NCHW-FP32-F=miopenConvolutionFwdAlgoWinograd:ConvBinWinogradRxSf2x3,1,63468,0,miopenConvolutionFwdAlgoWinograd
64-224-224-3x3-64-224-224-128-1x1-1x1-1x1-0-NCHW-FP32-B=miopenConvolutionBwdDataAlgoWinograd:ConvBinWinogradRxSf3x2,48,6286,0,miopenConvolutionBwdDataAlgoWinograd
512-28-28-3x3-512-28-28-128-1x1-1x1-1x1-0-NCHW-FP32-W=miopenConvolutionBwdWeightsAlgoDirect:ConvAsmBwdWrW3x3,66,209,0,miopenConvolutionBwdWeightsAlgoDirect;miopenConvolutionBwdWeightsAlgoImplicitGEMM:ConvHipImplicitGemmV4R1WrW,73,8372,0,miopenConvolutionBwdWeightsAlgoImplicitGEMM;miopenConvolutionBwdWeightsAlgoWinograd:ConvBinWinogradRxS,166,918,0,miopenConvolutionBwdWeightsAlgoWinograd;miopenConvolutionBwdWeightsAlgoGEMM:gemm,242,216,14450688,MIOpenGEMM
32-28-28-5x5-16-28-28-128-2x2-1x1-1x1-0-NCHW-FP32-W=miopenConvolutionBwdWeightsAlgoDirect:ConvOclBwdWrW53,0,425779,6553600,miopenConvolutionBwdWeightsAlgoDirect;miopenConvolutionBwdWeightsAlgoWinograd:ConvBinWinogradRxSf2x3,3,25487,0,miopenConvolutionBwdWeightsAlgoWinograd;miopenConvolutionBwdWeightsAlgoGEMM:gemm,5,5216,1254400,MIOpenGEMM
256-28-28-1x1-64-28-28-128-0x0-1x1-1x1-0-NCHW-FP32-F=miopenConvolutionFwdAlgoDirect:ConvOclDirectFwd1x1,0,58198,0,miopenConvolutionFwdAlgoDirect;miopenConvolutionFwdAlgoWinograd:ConvBinWinogradRxSf3x2,1,9201,0,miopenConvolutionFwdAlgoWinograd;miopenConvolutionFwdAlgoGEMM:GemmFwd1x1_0_1,4,51945,0,MIOpenGEMM
32-28-28-5x5-16-28-28-128-2x2-1x1-1x1-0-NCHW-FP32-B=miopenConvolutionBwdDataAlgoWinograd:ConvBinWinogradRxS,0,461313,0,miopenConvolutionBwdDataAlgoWinograd;miopenConvolutionBwdDataAlgoDirect:ConvOclDirectFwd,1,71285,0,miopenConvolutionBwdDataAlgoDirect;miopenConvolutionBwdDataAlgoFFT:fft,4,9128,41222144,miopenConvolutionBwdDataAlgoFFT;miopenConvolutionBwdDataAlgoGEMM:gemm,20,7887,1254400,MIOpenGEMM
384-7-7-3x3-192-7-7-128-1x1-1x1-1x1-0-NCHW-FP32-W=miopenConvolutionBwdWeightsAlgoDirect:ConvAsmBwdWrW3x3,1,53696,0,miopenConvolutionBwdWeightsAlgoDirect;miopenConvolutionBwdWeightsAlgoWinograd:ConvBinWinogradRxS,1,5528,0,miopenConvolutionBwdWeightsAlgoWinograd;miopenConvolutionBwdWeightsAlgoImplicitGEMM:ConvHipImplicitGemmV4R1WrW,2,29691,0,miopenConvolutionBwdWeightsAlgoImplicitGEMM;miopenConvolutionBwdWeightsAlgoGEMM:gemm,8,50225,338688,MIOpenGEMM
192-28-28-3x3-128-28-28-128-1x1-1x1-1x1-0-NCHW-FP32-B=miopenConvolutionBwdDataAlgoWinograd:ConvBinWinograd3x3U,2,83547,0,miopenConvolutionBwdDataAlgoWinograd
384-7-7-3x3-192-7-7-128-1x1-1x1-1x1-0-NCHW-FP32-B=miopenConvolutionBwdDataAlgoWinograd:ConvBinWinograd3x3U,0,499286,0,miopenConvolutionBwdDataAlgoWinograd
128-28-28-3x3-192-28-28-128-1x1-1x1-1x1-0-NCHW-FP32-F=miopenConvolutionFwdAlgoWinograd:ConvBinWinograd3x3U,2,26479,0,miopenConvolutionFwdAlgoWinograd
512-28-28-3x3-512-28-28-128-1x1-1x1-1x1-0-NCHW-FP32-B=miopenConvolutionBwdDataAlgoWinograd:ConvBinWinogradRxSf2x3,24,3047,0,miopenConvolutionBwdDataAlgoWinograd
512-28-28-3x3-256-28-28-128-1x1-1x1-1x1-0-NCHW-FP32-W=miopenConvolutionBwdWeightsAlgoDirect:ConvAsmBwdWrW3x3,36,4016,0,miopenConvolutionBwdWeightsAlgoDirect;miopenConvolutionBwdWeightsAlgoImplicitGEMM:ConvHipImplicitGemmV4R1WrW,46,7936,0,miopenConvolutionBwdWeightsAlgoImplicitGEMM;miopenConvolutionBwdWeightsAlgoWinograd:ConvBinWinogradRxS,56,7263,0,miopenConvolutionBwdWeightsAlgoWinograd;miopenConvolutionBwdWeightsAlgoGEMM:gemm,94,4131,7225344,MIOpenGEMM
32-28-28-1x1-256-28-28-128-0x0-1x1-1x1-0-NCHW-FP32-W=miopenConvolutionBwdWeightsAlgoDirect:ConvAsmBwdWrW1x1,0,509401,0,miopenConvolutionBwdWeightsAlgoDirect
256-13-13-3x3-384-13-13-512-1x1-1x1-1x1-0-NCHW-FP32-W=miopenConvolutionBwdWeightsAlgoWinograd:ConvBinWinogradRxS,25,9866,0,miopenConvolutionBwdWeightsAlgoWinograd;miopenConvolutionBwdWeightsAlgoDirect:ConvAsmBwdWrW3x3,33,8976,0,miopenConvolutionBwdWeightsAlgoDirect;miopenConvolutionBwdWeightsAlgoImplicitGEMM:ConvHipImplicitGemmV4R1WrW,34,4406,0,miopenConvolutionBwdWeightsAlgoImplicitGEMM;miopenConvolutionBwdWeightsAlgoGEMM:gemm,675,484,2336256,MIOpenGEMM
32-28-28-1x1-192-28-28-128-0x0-1x1-1x1-0-NCHW-FP32-B=miopenConvolutionBwdDataAlgoDirect:ConvAsm1x1U,0,285229,0,miopenConvolutionBwdDataAlgoDirect;miopenConvolutionBwdDataAlgoWinograd:ConvBinWinogradRxSf3x2,0,776035,0,miopenConvolutionBwdDataAlgoWinograd;miopenConvolutionBwdDataAlgoGEMM:gemm,1,89423,0,MIOpenGEMM
192-7-7-3x3-384-7-7-128-1x1-1x1-1x1-0-NCHW-FP32-F=miopenConvolutionFwdAlgoWinograd:ConvBinWinogradRxS,0,736113,0,miopenConvolutionFwdAlgoWinograd
512-14-14-3x3-512-14-14-128-1x1-1x1-1x1-0-NCHW-FP32-W=miopenConvolutionBwdWeightsAlgoDirect:ConvAsmBwdWrW3x3,22,2446,0,miopenConvolutionBwdWeightsAlgoDirect;miopenConvolutionBwdWeightsAlgoWinograd:ConvBinWinogradRxSf2x3,41,4038,0,miopenConvolutionBwdWeightsAlgoWinograd;miopenConvolutionBwdWeightsAlgoImplicitGEMM:ConvHipImplicitGemmV4R1WrW,44,8778,0,miopenConvolutionBwdWeightsAlgoImplicitGEMM;miopenConvolutionBwdWeightsAlgoGEMM:gemm,508,209,3612672,MIOpenGEMM
512-28-28-3x3-256-28-28-128-1x1-1x1-1x1-0-NCHW-FP32-B=miopenConvolutionBwdDataAlgoWinograd:ConvBinWinogradRxSf2x3,20,4727,0,miopenConvolutionBwdDataAlgoWinograd
16-28-28-5x5-32-28-28-128-2x2-1x1-1x1-0-NCHW-FP32-F=miopenConvolutionFwdAlgoWinograd:ConvBinWinogradRxSf2x3,0,235055,0,miopenConvolutionFwdAlgoWinograd;miopenConvolutionFwdAlgoImplicitGEMM:ConvHipImplicitGemmV4R1Fwd,0,538455,0,miopenConvolutionFwdAlgoImplicitGEMM;miopenConvolutionFwdAlgoFFT:fft,0,72547,36208640,miopenConvolutionFwdAlgoFFT;miopenConvolutionFwdAlgoDirect:ConvOclDirectFwd,1,6887,0,miopenConvolutionFwdAlgoDirect;miopenConvolutionFwdAlgoGEMM:GemmFwdRest,10,1426,1254400,MIOpenGEMM
64-14-14-5x5-32-14-14-128-2x2-1x1-1x1-0-NCHW-FP32-B=miopenConvolutionBwdDataAlgoWinograd:ConvBinWinogradRxSf2x3,0,238282,0,miopenConvolutionBwdDataAlgoWinograd;miopenConvolutionBwdDataAlgoFFT:fft,0,381493,29859840,miopenConvolutionBwdDataAlgoFFT;miopenConvolutionBwdDataAlgoDirect:ConvOclDirectFwd,0,698741,0,miopenConvolutionBwdDataAlgoDirect;miopenConvolutionBwdDataAlgoImplicitGEMM:ConvHipImplicitGemmBwdDataV1R1,1,55479,0,miopenConvolutionBwdDataAlgoImplicitGEMM;miopenConvolutionBwdDataAlgoGEMM:gemm,5,59776,627200,MIOpenGEMM
256-28-28-3x3-512-28-28-128-1x1-1x1-1x1-0-NCHW-FP32-F=miopenConvolutionFwdAlgoWinograd:ConvBinWinogradRxSf2x3,19,7272,0,miopenConvolutionFwdAlgoWinograd
32-28-28-1x1-256-28-28-128-0x0-1x1-1x1-0-NCHW-FP32-B=miopenConvolutionBwdDataAlgoDirect:ConvAsm1x1U,0,38462,0,miopenConvolutionBwdDataAlgoDirect;miopenConvolutionBwdDataAlgoWinograd:ConvBinWinogradRxSf3x2,0,750005,0,miopenConvolutionBwdDataAlgoWinograd;miopenConvolutionBwdDataAlgoGEMM:gemm,3,2711,0,MIOpenGEMM
128-7-7-5x5-48-7-7-128-2x2-1x1-1x1-0-NCHW-FP32-W=miopenConvolutionBwdWeightsAlgoWinograd:ConvBinWinogradRxSf2x3,0,543027,0,miopenConvolutionBwdWeightsAlgoWinograd;miopenConvolutionBwdWeightsAlgoDirect:ConvOclBwdWrW2<16>,1,4634,4915200,miopenConvolutionBwdWeightsAlgoDirect;miopenConvolutionBwdWeightsAlgoGEMM:gemm,6,89127,235200,MIOpenGEMM
48-14-14-5x5-16-14-14-128-2x2-1x1-1x1-0-NCHW-FP32-W=miopenConvolutionBwdWeightsAlgoDirect:ConvOclBwdWrW53,0,279596,9830400,miopenConvolutionBwdWeightsAlgoDirect;miopenConvolutionBwdWeightsAlgoWinograd:ConvBinWinogradRxSf2x3,1,2736,0,miopenConvolutionBwdWeightsAlgoWinograd;miopenConvolutionBwdWeightsAlgoGEMM:gemm,6,71619,313600,MIOpenGEMM
32-14-14-5x5-64-14-14-128-2x2-1x1-1x1-0-NCHW-FP32-F=miopenConvolutionFwdAlgoWinograd:ConvBinWinogradRxSf2x3,0,371154,0,miopenConvolutionFwdAlgoWinograd;miopenConvolutionFwdAlgoFFT:fft,0,508077,23777280,miopenConvolutionFwdAlgoFFT;miopenConvolutionFwdAlgoImplicitGEMM:ConvHipImplicitGemmV4R1Fwd,1,571,0,miopenConvolutionFwdAlgoImplicitGEMM;miopenConvolutionFwdAlgoDirect:ConvOclDirectFwd,1,14886,0,miopenConvolutionFwdAlgoDirect;miopenConvolutionFwdAlgoGEMM:GemmFwdRest,13,3061,627200,MIOpenGEMM
128-7-7-5x5-48-7-7-128-2x2-1x1-1x1-0-NCHW-FP32-B=miopenConvolutionBwdDataAlgoWinograd:ConvBinWinogradRxSf2x3,0,254682,0,miopenConvolutionBwdDataAlgoWinograd;miopenConvolutionBwdDataAlgoFFT:fft,0,421593,30449664,miopenConvolutionBwdDataAlgoFFT;miopenConvolutionBwdDataAlgoDirect:ConvOclDirectFwd,0,943516,0,miopenConvolutionBwdDataAlgoDirect;miopenConvolutionBwdDataAlgoGEMM:gemm,7,52479,235200,MIOpenGEMM
128-112-112-3x3-64-112-112-128-1x1-1x1-1x1-0-NCHW-FP32-W=miopenConvolutionBwdWeightsAlgoDirect:ConvAsmBwdWrW3x3,67,2201,0,miopenConvolutionBwdWeightsAlgoDirect;miopenConvolutionBwdWeightsAlgoWinograd:ConvBinWinogradRxS,225,758,0,miopenConvolutionBwdWeightsAlgoWinograd;miopenConvolutionBwdWeightsAlgoImplicitGEMM:ConvHipImplicitGemmV4R1WrW,252,902,0,miopenConvolutionBwdWeightsAlgoImplicitGEMM;miopenConvolutionBwdWeightsAlgoGEMM:gemm,1124,26,28901376,MIOpenGEMM
48-14-14-5x5-16-14-14-128-2x2-1x1-1x1-0-NCHW-FP32-B=miopenConvolutionBwdDataAlgoWinograd:ConvBinWinogradRxSf2x3,0,244617,0,miopenConvolutionBwdDataAlgoWinograd;miopenConvolutionBwdDataAlgoDirect:ConvOclDirectFwd,1,25496,0,miopenConvolutionBwdDataAlgoDirect;miopenConvolutionBwdDataAlgoFFT:fft,1,46443,20275200,miopenConvolutionBwdDataAlgoFFT;miopenConvolutionBwdDataAlgoGEMM:gemm,90,3909,313600,MIOpenGEMM
256-14-14-3x3-128-14-14-128-1x1-1x1-1x1-0-NCHW-FP32-W=miopenConvolutionBwdWeightsAlgoWinograd:ConvBinWinogradRxS,1,86735,0,miopenConvolutionBwdWeightsAlgoWinograd;miopenConvolutionBwdWeightsAlgoDirect:ConvAsmBwdWrW3x3,1,87183,0,miopenConvolutionBwdWeightsAlgoDirect;miopenConvolutionBwdWeightsAlgoImplicitGEMM:ConvHipImplicitGemmV4R1WrW,5,90994,0,miopenConvolutionBwdWeightsAlgoImplicitGEMM;miopenConvolutionBwdWeightsAlgoGEMM:gemm,17,4426,903168,MIOpenGEMM
192-28-28-1x1-32-28-28-128-0x0-1x1-1x1-0-NCHW-FP32-F=miopenConvolutionFwdAlgoDirect:ConvAsm1x1U,0,321392,0,miopenConvolutionFwdAlgoDirect;miopenConvolutionFwdAlgoWinograd:ConvBinWinogradRxSf3x2,0,479286,0,miopenConvolutionFwdAlgoWinograd;miopenConvolutionFwdAlgoGEMM:GemmFwd1x1_0_1,3,493,0,MIOpenGEMM
256-14-14-3x3-128-14-14-128-1x1-1x1-1x1-0-NCHW-FP32-B=miopenConvolutionBwdDataAlgoWinograd:ConvBinWinograd3x3U,0,76448,0,miopenConvolutionBwdDataAlgoWinograd
128-14-14-5x5-32-14-14-128-2x2-1x1-1x1-0-NCHW-FP32-W=miopenConvolutionBwdWeightsAlgoDirect:ConvOclBwdWrW53,1,53046,52428800,miopenConvolutionBwdWeightsAlgoDirect;miopenConvolutionBwdWeightsAlgoWinograd:ConvBinWinogradRxSf2x3,1,91367,0,miopenConvolutionBwdWeightsAlgoWinograd;miopenConvolutionBwdWeightsAlgoGEMM:gemm,26,691,627200,MIOpenGEMM
256-56-56-3x3-128-56-56-128-1x1-1x1-1x1-0-NCHW-FP32-W=miopenConvolutionBwdWeightsAlgoWinograd:ConvBinWinogradRxSf2x3,35,114,0,miopenConvolutionBwdWeightsAlgoWinograd;miopenConvolutionBwdWeightsAlgoDirect:ConvAsmBwdWrW3x3,39,6291,0,miopenConvolutionBwdWeightsAlgoDirect;miopenConvolutionBwdWeightsAlgoImplicitGEMM:ConvHipImplicitGemmV4R1WrW,83,5657,0,miopenConvolutionBwdWeightsAlgoImplicitGEMM;miopenConvolutionBwdWeightsAlgoGEMM:gemm,116,338,14450688,MIOpenGEMM
480-14-14-1x1-96-14-14-128-0x0-1x1-1x1-0-NCHW-FP32-F=miopenConvolutionFwdAlgoDirect:ConvOclDirectFwd1x1,0,526419,0,miopenConvolutionFwdAlgoDirect;miopenConvolutionFwdAlgoGEMM:GemmFwd1x1_0_1,8,61149,0,MIOpenGEMM
512-28-28-3x3-512-28-28-128-1x1-1x1-1x1-0-NCHW-FP32-F=miopenConvolutionFwdAlgoWinograd:ConvBinWinogradRxSf2x3,24,2665,0,miopenConvolutionFwdAlgoWinograd
128-14-14-3x3-256-14-14-128-1x1-1x1-1x1-0-NCHW-FP32-F=miopenConvolutionFwdAlgoWinograd:ConvBinWinograd3x3U,0,742316,0,miopenConvolutionFwdAlgoWinograd
48-7-7-5x5-128-7-7-128-2x2-1x1-1x1-0-NCHW-FP32-F=miopenConvolutionFwdAlgoWinograd:ConvBinWinogradRxSf2x3,0,331828,0,miopenConvolutionFwdAlgoWinograd;miopenConvolutionFwdAlgoImplicitGEMM:ConvHipImplicitGemmV4R1Fwd,0,561945,0,miopenConvolutionFwdAlgoImplicitGEMM;miopenConvolutionFwdAlgoFFT:fft,0,630299,22106112,miopenConvolutionFwdAlgoFFT;miopenConvolutionFwdAlgoDirect:ConvOclDirectFwd,1,25729,0,miopenConvolutionFwdAlgoDirect;miopenConvolutionFwdAlgoGEMM:GemmFwdRest,8,95596,235200,MIOpenGEMM
256-28-28-1x1-32-28-28-128-0x0-1x1-1x1-0-NCHW-FP32-F=miopenConvolutionFwdAlgoDirect:ConvAsm1x1U,0,404582,0,miopenConvolutionFwdAlgoDirect;miopenConvolutionFwdAlgoGEMM:GemmFwd1x1_0_1,3,38916,0,MIOpenGEMM
16-14-14-5x5-48-14-14-128-2x2-1x1-1x1-0-NCHW-FP32-F=miopenConvolutionFwdAlgoWinograd:ConvBinWinogradRxSf2x3,0,132378,0,miopenConvolutionFwdAlgoWinograd;miopenConvolutionFwdAlgoImplicitGEMM:ConvHipImplicitGemmV4R1Fwd,0,371691,0,miopenConvolutionFwdAlgoImplicitGEMM;miopenConvolutionFwdAlgoDirect:ConvOclDirectFwd,0,377072,0,miopenConvolutionFwdAlgoDirect;miopenConvolutionFwdAlgoFFT:fft,0,684241,17879040,miopenConvolutionFwdAlgoFFT;miopenConvolutionFwdAlgoGEMM:GemmFwdRest,4,36253,313600,MIOpenGEMM
128-14-14-5x5-32-14-14-128-2x2-1x1-1x1-0-NCHW-FP32-B=miopenConvolutionBwdDataAlgoFFT:fft,0,709851,59351040,miopenConvolutionBwdDataAlgoFFT;miopenConvolutionBwdDataAlgoWinograd:ConvBinWinogradRxSf2x3,0,755095,0,miopenConvolutionBwdDataAlgoWinograd;miopenConvolutionBwdDataAlgoDirect:ConvOclDirectFwd,2,26011,0,miopenConvolutionBwdDataAlgoDirect;miopenConvolutionBwdDataAlgoImplicitGEMM:ConvHipImplicitGemmBwdDataV1R1,2,5245,0,miopenConvolutionBwdDataAlgoImplicitGEMM;miopenConvolutionBwdDataAlgoGEMM:gemm,9,50982,627200,MIOpenGEMM
256-56-56-3x3-128-56-56-128-1x1-1x1-1x1-0-NCHW-FP32-B=miopenConvolutionBwdDataAlgoWinograd:ConvBinWinogradRxS,14,6293,0,miopenConvolutionBwdDataAlgoWinograd
64-14-14-1x1-480-14-14-128-0x0-1x1-1x1-0-NCHW-FP32-W=miopenConvolutionBwdWeightsAlgoDirect:ConvAsmBwdWrW1x1,0,450643,0,miopenConvolutionBwdWeightsAlgoDirect;miopenConvolutionBwdWeightsAlgoWinograd:ConvBinWinogradRxSf2x3,1,26553,0,miopenConvolutionBwdWeightsAlgoWinograd;miopenConvolutionBwdWeightsAlgoGEMM:gemm,3,22931,0,MIOpenGEMM
96-28-28-1x1-192-28-28-128-0x0-1x1-1x1-0-NCHW-FP32-W=miopenConvolutionBwdWeightsAlgoDirect:ConvAsmBwdWrW1x1,1,11239,0,miopenConvolutionBwdWeightsAlgoDirect
128-112-112-3x3-128-112-112-128-1x1-1x1-1x1-0-NCHW-FP32-W=miopenConvolutionBwdWeightsAlgoDirect:ConvAsmBwdWrW3x3,109,399,0,miopenConvolutionBwdWeightsAlgoDirect;miopenConvolutionBwdWeightsAlgoWinograd:ConvBinWinogradRxSf2x3,168,76,0,miopenConvolutionBwdWeightsAlgoWinograd;miopenConvolutionBwdWeightsAlgoImplicitGEMM:ConvHipImplicitGemmV4R1WrW,343,86,0,miopenConvolutionBwdWeightsAlgoImplicitGEMM;miopenConvolutionBwdWeightsAlgoGEMM:gemm,465,6,57802752,MIOpenGEMM
128-7-7-5x5-32-7-7-128-2x2-1x1-1x1-0-NCHW-FP32-W=miopenConvolutionBwdWeightsAlgoWinograd:ConvBinWinogradRxSf2x3,0,458146,0,miopenConvolutionBwdWeightsAlgoWinograd;miopenConvolutionBwdWeightsAlgoDirect:ConvOclBwdWrW2<16>,0,650686,3276800,miopenConvolutionBwdWeightsAlgoDirect;miopenConvolutionBwdWeightsAlgoGEMM:gemm,9,22147,156800,MIOpenGEMM
224-14-14-3x3-112-14-14-128-1x1-1x1-1x1-0-NCHW-FP32-W=miopenConvolutionBwdWeightsAlgoWinograd:ConvBinWinogradRxS,1,65436,0,miopenConvolutionBwdWeightsAlgoWinograd;miopenConvolutionBwdWeightsAlgoDirect:ConvAsmBwdWrW3x3,1,97677,0,miopenConvolutionBwdWeightsAlgoDirect;miopenConvolutionBwdWeightsAlgoGEMM:gemm,6,69829,790272,MIOpenGEMM
288-14-14-3x3-144-14-14-128-1x1-1x1-1x1-0-NCHW-FP32-W=miopenConvolutionBwdWeightsAlgoWinograd:ConvBinWinogradRxS,1,91112,0,miopenConvolutionBwdWeightsAlgoWinograd;miopenConvolutionBwdWeightsAlgoDirect:ConvAsmBwdWrW3x3,2,31954,0,miopenConvolutionBwdWeightsAlgoDirect;miopenConvolutionBwdWeightsAlgoGEMM:gemm,10,6423,1016064,MIOpenGEMM
128-56-56-3x3-256-56-56-128-1x1-1x1-1x1-0-NCHW-FP32-F=miopenConvolutionFwdAlgoWinograd:ConvBinWinograd3x3U,27,7945,0,miopenConvolutionFwdAlgoWinograd
32-14-14-5x5-128-14-14-128-2x2-1x1-1x1-0-NCHW-FP32-F=miopenConvolutionFwdAlgoWinograd:ConvBinWinogradRxSf2x3,0,500816,0,miopenConvolutionFwdAlgoWinograd;miopenConvolutionFwdAlgoFFT:fft,0,795875,47370240,miopenConvolutionFwdAlgoFFT;miopenConvolutionFwdAlgoImplicitGEMM:ConvHipImplicitGemmV4R1Fwd,0,967256,0,miopenConvolutionFwdAlgoImplicitGEMM;miopenConvolutionFwdAlgoDirect:ConvOclDirectFwd,1,50581,0,miopenConvolutionFwdAlgoDirect;miopenConvolutionFwdAlgoGEMM:GemmFwdRest,9,95256,627200,MIOpenGEMM
128-28-28-1x1-256-28-28-128-0x0-1x1-1x1-0-NCHW-FP32-W=miopenConvolutionBwdWeightsAlgoDirect:ConvAsmBwdWrW1x1,0,997313,0,miopenConvolutionBwdWeightsAlgoDirect
288-14-14-3x3-144-14-14-128-1x1-1x1-1x1-0-NCHW-FP32-B=miopenConvolutionBwdDataAlgoWinograd:ConvBinWinograd3x3U,1,1954,0,miopenConvolutionBwdDataAlgoWinograd
64-224-224-3x3-64-224-224-128-1x1-1x1-1x1-0-NCHW-FP32-F=miopenConvolutionFwdAlgoWinograd:ConvBinWinogradRxSf2x3,27,3642,0,miopenConvolutionFwdAlgoWinograd
144-14-14-3x3-288-14-14-128-1x1-1x1-1x1-0-NCHW-FP32-F=miopenConvolutionFwdAlgoWinograd:ConvBinWinograd3x3U,0,938158,0,miopenConvolutionFwdAlgoWinograd
128-7-7-5x5-32-7-7-128-2x2-1x1-1x1-0-NCHW-FP32-B=miopenConvolutionBwdDataAlgoWinograd:ConvBinWinogradRxSf2x3,0,164023,0,miopenConvolutionBwdDataAlgoWinograd;miopenConvolutionBwdDataAlgoFFT:fft,1,13321,27697152,miopenConvolutionBwdDataAlgoFFT;miopenConvolutionBwdDataAlgoImplicitGEMM:ConvHipImplicitGemmBwdDataV1R1,1,34485,0,miopenConvolutionBwdDataAlgoImplicitGEMM;miopenConvolutionBwdDataAlgoDirect:ConvOclDirectFwd,1,41695,0,miopenConvolutionBwdDataAlgoDirect;miopenConvolutionBwdDataAlgoGEMM:gemm,6,60261,156800,MIOpenGEMM
64-14-14-1x1-480-14-14-128-0x0-1x1-1x1-0-NCHW-FP32-B=miopenConvolutionBwdDataAlgoWinograd:ConvBinWinogradRxSf3x2,0,762171,0,miopenConvolutionBwdDataAlgoWinograd
224-14-14-3x3-112-14-14-128-1x1-1x1-1x1-0-NCHW-FP32-B=miopenConvolutionBwdDataAlgoWinograd:ConvBinWinogradRxSf2x3,0,856214,0,miopenConvolutionBwdDataAlgoWinograd
32-14-14-1x1-512-14-14-128-0x0-1x1-1x1-0-NCHW-FP32-W=miopenConvolutionBwdWeightsAlgoDirect:ConvAsmBwdWrW1x1,0,487134,0,miopenConvolutionBwdWeightsAlgoDirect;miopenConvolutionBwdWeightsAlgoGEMM:gemm,13,4433,0,MIOpenGEMM
512-14-14-3x3-512-14-14-128-1x1-1x1-1x1-0-NCHW-FP32-B=miopenConvolutionBwdDataAlgoWinograd:ConvBinWinogradRxSf2x3,10,969,0,miopenConvolutionBwdDataAlgoWinograd
16-28-28-1x1-192-28-28-128-0x0-1x1-1x1-0-NCHW-FP32-W=miopenConvolutionBwdWeightsAlgoDirect:ConvAsmBwdWrW1x1,0,379954,0,miopenConvolutionBwdWeightsAlgoDirect
32-7-7-5x5-128-7-7-128-2x2-1x1-1x1-0-NCHW-FP32-F=miopenConvolutionFwdAlgoWinograd:ConvBinWinogradRxSf2x3,0,146983,0,miopenConvolutionFwdAlgoWinograd;miopenConvolutionFwdAlgoImplicitGEMM:ConvHipImplicitGemmV4R1Fwd,0,309364,0,miopenConvolutionFwdAlgoImplicitGEMM;miopenConvolutionFwdAlgoFFT:fft,0,443829,22106112,miopenConvolutionFwdAlgoFFT;miopenConvolutionFwdAlgoDirect:ConvOclDirectFwd,0,598233,0,miopenConvolutionFwdAlgoDirect;miopenConvolutionFwdAlgoGEMM:GemmFwdRest,5,56581,156800,MIOpenGEMM
64-112-112-7x7-3-225-225-128-2x2-2x2-1x1-0-NCHW-FP32-W=miopenConvolutionBwdWeightsAlgoDirect:ConvOclBwdWrW2<4>,11,4492,1204224,miopenConvolutionBwdWeightsAlgoDirect;miopenConvolutionBwdWeightsAlgoGEMM:gemm,28,2939,7375872,MIOpenGEMM
112-14-14-3x3-224-14-14-128-1x1-1x1-1x1-0-NCHW-FP32-F=miopenConvolutionFwdAlgoWinograd:ConvBinWinograd3x3U,0,585853,0,miopenConvolutionFwdAlgoWinograd
144-14-14-1x1-512-14-14-128-0x0-1x1-1x1-0-NCHW-FP32-B=miopenConvolutionBwdDataAlgoDirect:ConvAsm1x1U,1,36147,0,miopenConvolutionBwdDataAlgoDirect;miopenConvolutionBwdDataAlgoGEMM:gemm,108,898,0,MIOpenGEMM
512-14-14-3x3-512-14-14-128-1x1-1x1-1x1-0-NCHW-FP32-F=miopenConvolutionFwdAlgoWinograd:ConvBinWinogradRxSf2x3,6,48963,0,miopenConvolutionFwdAlgoWinograd
480-14-14-1x1-64-14-14-128-0x0-1x1-1x1-0-NCHW-FP32-F=miopenConvolutionFwdAlgoDirect:ConvAsm1x1U,0,32503,0,miopenConvolutionFwdAlgoDirect;miopenConvolutionFwdAlgoWinograd:ConvBinWinogradRxSf3x2,0,732674,0,miopenConvolutionFwdAlgoWinograd;miopenConvolutionFwdAlgoGEMM:GemmFwd1x1_0_1,5,25493,0,MIOpenGEMM
64-112-112-7x7-3-225-225-128-2x2-2x2-1x1-0-NCHW-FP32-B=miopenConvolutionBwdDataAlgoDirect:ConvOclDirectFwd,25,9951,0,miopenConvolutionBwdDataAlgoDirect;miopenConvolutionBwdDataAlgoWinograd:ConvBinWinogradRxSf2x3,39,5505,0,miopenConvolutionBwdDataAlgoWinograd;miopenConvolutionBwdDataAlgoGEMM:gemm,440,795,7375872,MIOpenGEMM
32-14-14-1x1-512-14-14-128-0x0-1x1-1x1-0-NCHW-FP32-B=miopenConvolutionBwdDataAlgoDirect:ConvAsm1x1U,0,226827,0,miopenConvolutionBwdDataAlgoDirect;miopenConvolutionBwdDataAlgoGEMM:gemm,1,60038,0,MIOpenGEMM
16-28-28-1x1-192-28-28-128-0x0-1x1-1x1-0-NCHW-FP32-B=miopenConvolutionBwdDataAlgoDirect:ConvAsm1x1U,0,27055,0,miopenConvolutionBwdDataAlgoDirect;miopenConvolutionBwdDataAlgoWinograd:ConvBinWinogradRxSf2x3,0,798709,0,miopenConvolutionBwdDataAlgoWinograd;miopenConvolutionBwdDataAlgoGEMM:gemm,1,66347,0,MIOpenGEMM
96-28-28-5x5-32-28-28-128-2x2-1x1-1x1-0-NCHW-FP32-W=miopenConvolutionBwdWeightsAlgoDirect:ConvOclBwdWrW53,2,51085,39321600,miopenConvolutionBwdWeightsAlgoDirect;miopenConvolutionBwdWeightsAlgoWinograd:ConvBinWinogradRxSf2x3,4,25247,0,miopenConvolutionBwdWeightsAlgoWinograd;miopenConvolutionBwdWeightsAlgoGEMM:gemm,20,2642,2508800,MIOpenGEMM
192-14-14-1x1-480-14-14-128-0x0-1x1-1x1-0-NCHW-FP32-W=miopenConvolutionBwdWeightsAlgoDirect:ConvAsmBwdWrW1x1,0,842307,0,miopenConvolutionBwdWeightsAlgoDirect;miopenConvolutionBwdWeightsAlgoWinograd:ConvBinWinogradRxSf2x3,2,42474,0,miopenConvolutionBwdWeightsAlgoWinograd;miopenConvolutionBwdWeightsAlgoGEMM:gemm,2,91912,0,MIOpenGEMM
512-14-14-1x1-144-14-14-128-0x0-1x1-1x1-0-NCHW-FP32-F=miopenConvolutionFwdAlgoDirect:ConvAsm1x1U,0,624889,0,miopenConvolutionFwdAlgoDirect;miopenConvolutionFwdAlgoGEMM:GemmFwd1x1_0_1,5,19044,0,MIOpenGEMM
3-225-225-7x7-64-112-112-128-2x2-2x2-1x1-0-NCHW-FP32-F=miopenConvolutionFwdAlgoWinograd:ConvBinWinogradRxS,5,32386,0,miopenConvolutionFwdAlgoWinograd;miopenConvolutionFwdAlgoDirect:ConvOclDirectFwd,6,25055,0,miopenConvolutionFwdAlgoDirect;miopenConvolutionFwdAlgoGEMM:GemmFwdRest,19,6715,7375872,MIOpenGEMM
96-28-28-5x5-32-28-28-128-2x2-1x1-1x1-0-NCHW-FP32-B=miopenConvolutionBwdDataAlgoWinograd:ConvBinWinogradRxSf2x3,1,39354,0,miopenConvolutionBwdDataAlgoWinograd;miopenConvolutionBwdDataAlgoFFT:fft,1,92724,134807552,miopenConvolutionBwdDataAlgoFFT;miopenConvolutionBwdDataAlgoDirect:ConvOclDirectFwd,4,5858,0,miopenConvolutionBwdDataAlgoDirect;miopenConvolutionBwdDataAlgoImplicitGEMM:ConvHipImplicitGemmBwdDataV1R1,7,1858,0,miopenConvolutionBwdDataAlgoImplicitGEMM;miopenConvolutionBwdDataAlgoGEMM:gemm,9,90816,2508800,MIOpenGEMM
512-14-14-1x1-32-14-14-128-0x0-1x1-1x1-0-NCHW-FP32-F=miopenConvolutionFwdAlgoDirect:ConvAsm1x1U,0,250262,0,miopenConvolutionFwdAlgoDirect;miopenConvolutionFwdAlgoWinograd:ConvBinWinogradRxSf3x2,0,43714,0,miopenConvolutionFwdAlgoWinograd;miopenConvolutionFwdAlgoGEMM:GemmFwd1x1_0_1,2,67885,0,MIOpenGEMM
528-14-14-1x1-256-14-14-128-0x0-1x1-1x1-0-NCHW-FP32-F=miopenConvolutionFwdAlgoDirect:ConvAsm1x1U,1,29056,0,miopenConvolutionFwdAlgoDirect;miopenConvolutionFwdAlgoWinograd:ConvBinWinogradRxSf3x2,2,17904,0,miopenConvolutionFwdAlgoWinograd;miopenConvolutionFwdAlgoGEMM:GemmFwd1x1_0_1,6,14616,0,MIOpenGEMM
192-14-14-1x1-480-14-14-128-0x0-1x1-1x1-0-NCHW-FP32-B=miopenConvolutionBwdDataAlgoDirect:ConvAsm1x1U,0,712417,0,miopenConvolutionBwdDataAlgoDirect;miopenConvolutionBwdDataAlgoGEMM:gemm,3,16819,0,MIOpenGEMM
128-14-14-1x1-512-14-14-128-0x0-1x1-1x1-0-NCHW-FP32-W=miopenConvolutionBwdWeightsAlgoDirect:ConvAsmBwdWrW1x1,0,637007,0,miopenConvolutionBwdWeightsAlgoDirect
32-28-28-5x5-96-28-28-128-2x2-1x1-1x1-0-NCHW-FP32-F=miopenConvolutionFwdAlgoWinograd:ConvBinWinogradRxS,1,25774,0,miopenConvolutionFwdAlgoWinograd;miopenConvolutionFwdAlgoFFT:fft,1,81918,107511808,miopenConvolutionFwdAlgoFFT;miopenConvolutionFwdAlgoImplicitGEMM:ConvHipImplicitGemmV4R1Fwd,3,8149,0,miopenConvolutionFwdAlgoImplicitGEMM;miopenConvolutionFwdAlgoDirect:ConvOclDirectFwd,6,37949,0,miopenConvolutionFwdAlgoDirect;miopenConvolutionFwdAlgoGEMM:GemmFwdRest,10,1595,2508800,MIOpenGEMM
24-14-14-1x1-512-14-14-128-0x0-1x1-1x1-0-NCHW-FP32-W=miopenConvolutionBwdWeightsAlgoDirect:ConvAsmBwdWrW1x1,0,286228,0,miopenConvolutionBwdWeightsAlgoDirect;miopenConvolutionBwdWeightsAlgoWinograd:ConvBinWinogradRxSf2x3,1,8472,0,miopenConvolutionBwdWeightsAlgoWinograd;miopenConvolutionBwdWeightsAlgoGEMM:gemm,2,23422,0,MIOpenGEMM
64-28-28-1x1-256-28-28-128-0x0-1x1-1x1-0-NCHW-FP32-W=miopenConvolutionBwdWeightsAlgoDirect:ConvAsmBwdWrW1x1,0,661302,0,miopenConvolutionBwdWeightsAlgoDirect
128-112-112-3x3-128-112-112-128-1x1-1x1-1x1-0-NCHW-FP32-B=miopenConvolutionBwdDataAlgoWinograd:ConvBinWinograd3x3U,33,6644,0,miopenConvolutionBwdDataAlgoWinograd
64-14-14-5x5-32-14-14-128-2x2-1x1-1x1-0-NCHW-FP32-W=miopenConvolutionBwdWeightsAlgoDirect:ConvOclBwdWrW2<16>,0,981137,1638400,miopenConvolutionBwdWeightsAlgoDirect;miopenConvolutionBwdWeightsAlgoWinograd:ConvBinWinogradRxSf2x3,1,42236,0,miopenConvolutionBwdWeightsAlgoWinograd;miopenConvolutionBwdWeightsAlgoGEMM:gemm,9,59683,627200,MIOpenGEMM
480-14-14-1x1-192-14-14-128-0x0-1x1-1x1-0-NCHW-FP32-F=miopenConvolutionFwdAlgoDirect:ConvAsm1x1U,0,936066,0,miopenConvolutionFwdAlgoDirect;miopenConvolutionFwdAlgoWinograd:ConvBinWinogradRxSf3x2,1,65366,0,miopenConvolutionFwdAlgoWinograd;miopenConvolutionFwdAlgoGEMM:GemmFwd1x1_0_1,6,13765,0,MIOpenGEMM
192-28-28-1x1-16-28-28-128-0x0-1x1-1x1-0-NCHW-FP32-F=miopenConvolutionFwdAlgoDirect:ConvAsm1x1U,0,258686,0,miopenConvolutionFwdAlgoDirect;miopenConvolutionFwdAlgoWinograd:ConvBinWinogradRxSf3x2,0,419664,0,miopenConvolutionFwdAlgoWinograd;miopenConvolutionFwdAlgoGEMM:GemmFwd1x1_0_1,2,31036,0,MIOpenGEMM
24-14-14-1x1-512-14-14-128-0x0-1x1-1x1-0-NCHW-FP32-B=miopenConvolutionBwdDataAlgoDirect:ConvAsm1x1U,0,198987,0,miopenConvolutionBwdDataAlgoDirect;miopenConvolutionBwdDataAlgoGEMM:gemm,1,50926,0,MIOpenGEMM
128-14-14-1x1-512-14-14-128-0x0-1x1-1x1-0-NCHW-FP32-B=miopenConvolutionBwdDataAlgoDirect:ConvAsm1x1U,0,658979,0,miopenConvolutionBwdDataAlgoDirect;miopenConvolutionBwdDataAlgoWinograd:ConvBinWinogradRxSf3x2,1,37965,0,miopenConvolutionBwdDataAlgoWinograd;miopenConvolutionBwdDataAlgoGEMM:gemm,28,2416,0,MIOpenGEMM
64-28-28-1x1-256-28-28-128-0x0-1x1-1x1-0-NCHW-FP32-B=miopenConvolutionBwdDataAlgoDirect:ConvAsm1x1U,0,542231,0,miopenConvolutionBwdDataAlgoDirect;miopenConvolutionBwdDataAlgoWinograd:ConvBinWinogradRxSf3x2,1,50363,0,miopenConvolutionBwdDataAlgoWinograd;miopenConvolutionBwdDataAlgoGEMM:gemm,5,17767,0,MIOpenGEMM
160-14-14-1x1-528-14-14-128-0x0-1x1-1x1-0-NCHW-FP32-W=miopenConvolutionBwdWeightsAlgoDirect:ConvAsmBwdWrW1x1,0,873234,0,miopenConvolutionBwdWeightsAlgoDirect;miopenConvolutionBwdWeightsAlgoWinograd:ConvBinWinogradRxSf2x3,3,15216,0,miopenConvolutionBwdWeightsAlgoWinograd;miopenConvolutionBwdWeightsAlgoGEMM:gemm,3,74457,0,MIOpenGEMM
192-7-7-1x1-832-7-7-128-0x0-1x1-1x1-0-NCHW-FP32-W=miopenConvolutionBwdWeightsAlgoDirect:ConvAsmBwdWrW1x1,0,391997,0,miopenConvolutionBwdWeightsAlgoDirect;miopenConvolutionBwdWeightsAlgoGEMM:gemm,1,72033,0,MIOpenGEMM
16-14-14-1x1-480-14-14-128-0x0-1x1-1x1-0-NCHW-FP32-W=miopenConvolutionBwdWeightsAlgoDirect:ConvAsmBwdWrW1x1,0,194828,0,miopenConvolutionBwdWeightsAlgoDirect;miopenConvolutionBwdWeightsAlgoWinograd:ConvBinWinogradRxSf2x3,1,2915,0,miopenConvolutionBwdWeightsAlgoWinograd;miopenConvolutionBwdWeightsAlgoGEMM:gemm,1,78938,0,MIOpenGEMM
832-7-7-1x1-48-7-7-128-0x0-1x1-1x1-0-NCHW-FP32-F=miopenConvolutionFwdAlgoDirect:ConvAsm1x1U,0,113097,0,miopenConvolutionFwdAlgoDirect;miopenConvolutionFwdAlgoWinograd:ConvBinWinogradRxSf2x3,0,368446,0,miopenConvolutionFwdAlgoWinograd;miopenConvolutionFwdAlgoGEMM:GemmFwd1x1_0_1,2,27598,0,MIOpenGEMM
320-7-7-3x3-160-7-7-128-1x1-1x1-1x1-0-NCHW-FP32-W=miopenConvolutionBwdWeightsAlgoWinograd:ConvBinWinogradRxS,0,59523,0,miopenConvolutionBwdWeightsAlgoWinograd;miopenConvolutionBwdWeightsAlgoDirect:ConvAsmBwdWrW3x3,0,781331,0,miopenConvolutionBwdWeightsAlgoDirect;miopenConvolutionBwdWeightsAlgoGEMM:gemm,14,5478,282240,MIOpenGEMM
512-14-14-1x1-24-14-14-128-0x0-1x1-1x1-0-NCHW-FP32-F=miopenConvolutionFwdAlgoDirect:ConvAsm1x1U,0,204743,0,miopenConvolutionFwdAlgoDirect;miopenConvolutionFwdAlgoWinograd:ConvBinWinogradRxSf3x2,0,268366,0,miopenConvolutionFwdAlgoWinograd;miopenConvolutionFwdAlgoGEMM:GemmFwd1x1_0_1,2,4057,0,MIOpenGEMM
512-14-14-1x1-128-14-14-128-0x0-1x1-1x1-0-NCHW-FP32-F=miopenConvolutionFwdAlgoDirect:ConvAsm1x1U,0,769679,0,miopenConvolutionFwdAlgoDirect;miopenConvolutionFwdAlgoWinograd:ConvBinWinogradRxSf3x2,1,38601,0,miopenConvolutionFwdAlgoWinograd;miopenConvolutionFwdAlgoGEMM:GemmFwd1x1_0_1,7,79793,0,MIOpenGEMM
384-7-7-1x1-832-7-7-128-0x0-1x1-1x1-0-NCHW-FP32-W=miopenConvolutionBwdWeightsAlgoDirect:ConvAsmBwdWrW1x1,0,728866,0,miopenConvolutionBwdWeightsAlgoDirect;miopenConvolutionBwdWeightsAlgoWinograd:ConvBinWinogradRxSf2x3,2,47012,0,miopenConvolutionBwdWeightsAlgoWinograd;miopenConvolutionBwdWeightsAlgoGEMM:gemm,2,97781,0,MIOpenGEMM
16-14-14-1x1-480-14-14-128-0x0-1x1-1x1-0-NCHW-FP32-B=miopenConvolutionBwdDataAlgoDirect:ConvAsm1x1U,0,151999,0,miopenConvolutionBwdDataAlgoDirect;miopenConvolutionBwdDataAlgoWinograd:ConvBinWinogradRxSf2x3,0,472941,0,miopenConvolutionBwdDataAlgoWinograd;miopenConvolutionBwdDataAlgoGEMM:gemm,1,1302,0,MIOpenGEMM
192-7-7-1x1-832-7-7-128-0x0-1x1-1x1-0-NCHW-FP32-B=miopenConvolutionBwdDataAlgoDirect:ConvAsm1x1U,0,278235,0,miopenConvolutionBwdDataAlgoDirect;miopenConvolutionBwdDataAlgoWinograd:ConvBinWinogradRxSf3x2,0,761432,0,miopenConvolutionBwdDataAlgoWinograd;miopenConvolutionBwdDataAlgoGEMM:gemm,2,67153,0,MIOpenGEMM
160-14-14-1x1-512-14-14-128-0x0-1x1-1x1-0-NCHW-FP32-W=miopenConvolutionBwdWeightsAlgoDirect:ConvAsmBwdWrW1x1,1,24991,0,miopenConvolutionBwdWeightsAlgoDirect
128-28-28-1x1-256-28-28-128-0x0-1x1-1x1-0-NCHW-FP32-B=miopenConvolutionBwdDataAlgoDirect:ConvAsm1x1U,0,963538,0,miopenConvolutionBwdDataAlgoDirect;miopenConvolutionBwdDataAlgoWinograd:ConvBinWinogradRxSf3x2,2,58458,0,miopenConvolutionBwdDataAlgoWinograd;miopenConvolutionBwdDataAlgoGEMM:gemm,144,61,0,MIOpenGEMM
112-14-14-1x1-512-14-14-128-0x0-1x1-1x1-0-NCHW-FP32-W=miopenConvolutionBwdWeightsAlgoDirect:ConvAsmBwdWrW1x1,0,765371,0,miopenConvolutionBwdWeightsAlgoDirect
384-7-7-1x1-832-7-7-128-0x0-1x1-1x1-0-NCHW-FP32-B=miopenConvolutionBwdDataAlgoDirect:ConvAsm1x1U,1,15573,0,miopenConvolutionBwdDataAlgoDirect;miopenConvolutionBwdDataAlgoGEMM:gemm,18,9862,0,MIOpenGEMM
480-14-14-1x1-16-14-14-128-0x0-1x1-1x1-0-NCHW-FP32-F=miopenConvolutionFwdAlgoDirect:ConvAsm1x1U,0,15964,0,miopenConvolutionFwdAlgoDirect;miopenConvolutionFwdAlgoGEMM:GemmFwd1x1_0_1,2,55668,0,MIOpenGEMM
832-7-7-1x1-192-7-7-128-0x0-1x1-1x1-0-NCHW-FP32-F=miopenConvolutionFwdAlgoDirect:ConvAsm1x1U,0,353839,0,miopenConvolutionFwdAlgoDirect;miopenConvolutionFwdAlgoWinograd:ConvBinWinogradRxSf3x2,0,794873,0,miopenConvolutionFwdAlgoWinograd;miopenConvolutionFwdAlgoGEMM:GemmFwd1x1_0_1,8,64733,0,MIOpenGEMM
128-28-28-3x3-96-28-28-128-1x1-1x1-1x1-0-NCHW-FP32-W=miopenConvolutionBwdWeightsAlgoDirect:ConvAsmBwdWrW3x3,3,99789,0,miopenConvolutionBwdWeightsAlgoDirect;miopenConvolutionBwdWeightsAlgoWinograd:ConvBinWinogradRxSf2x3,5,39739,0,miopenConvolutionBwdWeightsAlgoWinograd;miopenConvolutionBwdWeightsAlgoGEMM:gemm,25,407,2709504,MIOpenGEMM
128-28-28-3x3-96-28-28-128-1x1-1x1-1x1-0-NCHW-FP32-B=miopenConvolutionBwdDataAlgoWinograd:ConvBinWinograd3x3U,1,23436,0,miopenConvolutionBwdDataAlgoWinograd
160-7-7-1x1-832-7-7-128-0x0-1x1-1x1-0-NCHW-FP32-W=miopenConvolutionBwdWeightsAlgoDirect:ConvAsmBwdWrW1x1,0,410531,0,miopenConvolutionBwdWeightsAlgoDirect;miopenConvolutionBwdWeightsAlgoGEMM:gemm,2,27868,0,MIOpenGEMM
96-28-28-3x3-128-28-28-128-1x1-1x1-1x1-0-NCHW-FP32-F=miopenConvolutionFwdAlgoWinograd:ConvBinWinogradRxSf2x3,1,29913,0,miopenConvolutionFwdAlgoWinograd
832-7-7-1x1-384-7-7-128-0x0-1x1-1x1-0-NCHW-FP32-F=miopenConvolutionFwdAlgoDirect:ConvOclDirectFwd1x1,0,847417,0,miopenConvolutionFwdAlgoDirect;miopenConvolutionFwdAlgoWinograd:ConvBinWinogradRxSf3x2,2,10231,0,miopenConvolutionFwdAlgoWinograd;miopenConvolutionFwdAlgoGEMM:GemmFwd1x1_0_1,5,98316,0,MIOpenGEMM
256-28-28-1x1-128-28-28-128-0x0-1x1-1x1-0-NCHW-FP32-F=miopenConvolutionFwdAlgoDirect:ConvOclDirectFwd1x1,1,5589,0,miopenConvolutionFwdAlgoDirect;miopenConvolutionFwdAlgoWinograd:ConvBinWinogradRxSf3x2,2,56175,0,miopenConvolutionFwdAlgoWinograd;miopenConvolutionFwdAlgoGEMM:GemmFwd1x1_0_1,4,36282,0,MIOpenGEMM
112-14-14-1x1-512-14-14-128-0x0-1x1-1x1-0-NCHW-FP32-B=miopenConvolutionBwdDataAlgoDirect:ConvAsm1x1U,0,599986,0,miopenConvolutionBwdDataAlgoDirect;miopenConvolutionBwdDataAlgoWinograd:ConvBinWinogradRxSf3x2,1,28608,0,miopenConvolutionBwdDataAlgoWinograd;miopenConvolutionBwdDataAlgoGEMM:gemm,20,7053,0,MIOpenGEMM
320-7-7-3x3-160-7-7-128-1x1-1x1-1x1-0-NCHW-FP32-B=miopenConvolutionBwdDataAlgoWinograd:ConvBinWinograd3x3U,0,397313,0,miopenConvolutionBwdDataAlgoWinograd
208-14-14-3x3-96-14-14-128-1x1-1x1-1x1-0-NCHW-FP32-W=miopenConvolutionBwdWeightsAlgoDirect:ConvAsmBwdWrW3x3,1,84128,0,miopenConvolutionBwdWeightsAlgoDirect;miopenConvolutionBwdWeightsAlgoWinograd:ConvBinWinogradRxS,2,18944,0,miopenConvolutionBwdWeightsAlgoWinograd;miopenConvolutionBwdWeightsAlgoGEMM:gemm,8,29686,677376,MIOpenGEMM
160-7-7-1x1-832-7-7-128-0x0-1x1-1x1-0-NCHW-FP32-B=miopenConvolutionBwdDataAlgoDirect:ConvAsm1x1U,0,348239,0,miopenConvolutionBwdDataAlgoDirect;miopenConvolutionBwdDataAlgoWinograd:ConvBinWinogradRxSf3x2,1,4333,0,miopenConvolutionBwdDataAlgoWinograd;miopenConvolutionBwdDataAlgoGEMM:gemm,3,12454,0,MIOpenGEMM
208-14-14-3x3-96-14-14-128-1x1-1x1-1x1-0-NCHW-FP32-B=miopenConvolutionBwdDataAlgoWinograd:ConvBinWinogradRxS,0,521151,0,miopenConvolutionBwdDataAlgoWinograd
64-14-14-5x5-24-14-14-128-2x2-1x1-1x1-0-NCHW-FP32-W=miopenConvolutionBwdWeightsAlgoDirect:ConvOclBwdWrW53,0,510995,19660800,miopenConvolutionBwdWeightsAlgoDirect;miopenConvolutionBwdWeightsAlgoWinograd:ConvBinWinogradRxSf2x3,0,869436,0,miopenConvolutionBwdWeightsAlgoWinograd;miopenConvolutionBwdWeightsAlgoGEMM:gemm,6,83578,470400,MIOpenGEMM
32-7-7-1x1-832-7-7-128-0x0-1x1-1x1-0-NCHW-FP32-W=miopenConvolutionBwdWeightsAlgoDirect:ConvAsmBwdWrW1x1,0,141438,0,miopenConvolutionBwdWeightsAlgoDirect;miopenConvolutionBwdWeightsAlgoGEMM:gemm,1,82293,0,MIOpenGEMM
96-14-14-3x3-208-14-14-128-1x1-1x1-1x1-0-NCHW-FP32-F=miopenConvolutionFwdAlgoWinograd:ConvBinWinogradRxSf2x3,0,700121,0,miopenConvolutionFwdAlgoWinograd
160-7-7-3x3-320-7-7-128-1x1-1x1-1x1-0-NCHW-FP32-F=miopenConvolutionFwdAlgoWinograd:ConvBinWinogradRxSf2x3,0,546477,0,miopenConvolutionFwdAlgoWinograd
512-14-14-1x1-112-14-14-128-0x0-1x1-1x1-0-NCHW-FP32-F=miopenConvolutionFwdAlgoDirect:ConvAsm1x1U,0,477265,0,miopenConvolutionFwdAlgoDirect;miopenConvolutionFwdAlgoGEMM:GemmFwd1x1_0_1,5,723,0,MIOpenGEMM
64-14-14-5x5-24-14-14-128-2x2-1x1-1x1-0-NCHW-FP32-B=miopenConvolutionBwdDataAlgoWinograd:ConvBinWinogradRxSf2x3,0,23961,0,miopenConvolutionBwdDataAlgoWinograd;miopenConvolutionBwdDataAlgoFFT:fft,0,327784,28385280,miopenConvolutionBwdDataAlgoFFT;miopenConvolutionBwdDataAlgoDirect:ConvOclDirectFwd,0,616881,0,miopenConvolutionBwdDataAlgoDirect;miopenConvolutionBwdDataAlgoGEMM:gemm,5,95659,470400,MIOpenGEMM
48-7-7-1x1-832-7-7-128-0x0-1x1-1x1-0-NCHW-FP32-W=miopenConvolutionBwdWeightsAlgoDirect:ConvAsmBwdWrW1x1,0,222751,0,miopenConvolutionBwdWeightsAlgoDirect;miopenConvolutionBwdWeightsAlgoGEMM:gemm,2,207,0,MIOpenGEMM
320-14-14-3x3-160-14-14-128-1x1-1x1-1x1-0-NCHW-FP32-W=miopenConvolutionBwdWeightsAlgoWinograd:ConvBinWinogradRxS,2,82065,0,miopenConvolutionBwdWeightsAlgoWinograd;miopenConvolutionBwdWeightsAlgoDirect:ConvOclBwdWrW53,4,8264,0,miopenConvolutionBwdWeightsAlgoDirect;miopenConvolutionBwdWeightsAlgoGEMM:gemm,13,2412,1128960,MIOpenGEMM
32-7-7-1x1-832-7-7-128-0x0-1x1-1x1-0-NCHW-FP32-B=miopenConvolutionBwdDataAlgoDirect:ConvAsm1x1U,0,8015,0,miopenConvolutionBwdDataAlgoDirect;miopenConvolutionBwdDataAlgoWinograd:ConvBinWinogradRxSf3x2,0,25695,0,miopenConvolutionBwdDataAlgoWinograd;miopenConvolutionBwdDataAlgoGEMM:gemm,1,6737,0,MIOpenGEMM
96-14-14-1x1-480-14-14-128-0x0-1x1-1x1-0-NCHW-FP32-W=miopenConvolutionBwdWeightsAlgoDirect:ConvAsmBwdWrW1x1,0,58741,0,miopenConvolutionBwdWeightsAlgoDirect;miopenConvolutionBwdWeightsAlgoWinograd:ConvBinWinogradRxSf2x3,1,54459,0,miopenConvolutionBwdWeightsAlgoWinograd;miopenConvolutionBwdWeightsAlgoGEMM:gemm,3,1385,0,MIOpenGEMM
832-7-7-1x1-160-7-7-128-0x0-1x1-1x1-0-NCHW-FP32-F=miopenConvolutionFwdAlgoDirect:ConvAsm1x1U,0,320186,0,miopenConvolutionFwdAlgoDirect;miopenConvolutionFwdAlgoWinograd:ConvBinWinogradRxSf3x2,0,579944,0,miopenConvolutionFwdAlgoWinograd;miopenConvolutionFwdAlgoGEMM:GemmFwd1x1_0_1,2,8487,0,MIOpenGEMM
24-14-14-5x5-64-14-14-128-2x2-1x1-1x1-0-NCHW-FP32-F=miopenConvolutionFwdAlgoWinograd:ConvBinWinogradRxS,0,190771,0,miopenConvolutionFwdAlgoWinograd;miopenConvolutionFwdAlgoImplicitGEMM:ConvHipImplicitGemmV4R1Fwd,0,33013,0,miopenConvolutionFwdAlgoImplicitGEMM;miopenConvolutionFwdAlgoFFT:fft,0,385469,23777280,miopenConvolutionFwdAlgoFFT;miopenConvolutionFwdAlgoDirect:ConvOclDirectFwd,0,596657,0,miopenConvolutionFwdAlgoDirect;miopenConvolutionFwdAlgoGEMM:GemmFwdRest,6,97393,470400,MIOpenGEMM
320-14-14-3x3-160-14-14-128-1x1-1x1-1x1-0-NCHW-FP32-B=miopenConvolutionBwdDataAlgoWinograd:ConvBinWinograd3x3U,1,11766,0,miopenConvolutionBwdDataAlgoWinograd
832-7-7-1x1-128-7-7-128-0x0-1x1-1x1-0-NCHW-FP32-F=miopenConvolutionFwdAlgoDirect:ConvAsm1x1U,0,325063,0,miopenConvolutionFwdAlgoDirect;miopenConvolutionFwdAlgoWinograd:ConvBinWinogradRxSf2x3,0,7158,0,miopenConvolutionFwdAlgoWinograd;miopenConvolutionFwdAlgoGEMM:GemmFwd1x1_0_1,4,5971,0,MIOpenGEMM
832-7-7-1x1-32-7-7-128-0x0-1x1-1x1-0-NCHW-FP32-F=miopenConvolutionFwdAlgoDirect:ConvAsm1x1U,0,132913,0,miopenConvolutionFwdAlgoDirect;miopenConvolutionFwdAlgoGEMM:GemmFwd1x1_0_1,4,24453,0,MIOpenGEMM
160-14-14-1x1-512-14-14-128-0x0-1x1-1x1-0-NCHW-FP32-B=miopenConvolutionBwdDataAlgoDirect:ConvAsm1x1U,0,772973,0,miopenConvolutionBwdDataAlgoDirect;miopenConvolutionBwdDataAlgoWinograd:ConvBinWinogradRxSf3x2,1,71709,0,miopenConvolutionBwdDataAlgoWinograd;miopenConvolutionBwdDataAlgoGEMM:gemm,51,654,0,MIOpenGEMM
48-7-7-1x1-832-7-7-128-0x0-1x1-1x1-0-NCHW-FP32-B=miopenConvolutionBwdDataAlgoDirect:ConvAsm1x1U,0,106159,0,miopenConvolutionBwdDataAlgoDirect
96-14-14-1x1-480-14-14-128-0x0-1x1-1x1-0-NCHW-FP32-B=miopenConvolutionBwdDataAlgoDirect:ConvAsm1x1U,0,35071,0,miopenConvolutionBwdDataAlgoDirect;miopenConvolutionBwdDataAlgoGEMM:gemm,14,6655,0,MIOpenGEMM
64-224-224-3x3-64-224-224-128-1x1-1x1-1x1-0-NCHW-FP32-W=miopenConvolutionBwdWeightsAlgoDirect:ConvAsmBwdWrW3x3,75,4721,0,miopenConvolutionBwdWeightsAlgoDirect;miopenConvolutionBwdWeightsAlgoGEMM:gemm,198,635,115605504,MIOpenGEMM;miopenConvolutionBwdWeightsAlgoWinograd:ConvBinWinogradRxSf2x3,685,754,0,miopenConvolutionBwdWeightsAlgoWinograd;miopenConvolutionBwdWeightsAlgoImplicitGEMM:ConvHipImplicitGemmV4R1WrW,763,836,0,miopenConvolutionBwdWeightsAlgoImplicitGEMM
128-7-7-1x1-832-7-7-128-0x0-1x1-1x1-0-NCHW-FP32-W=miopenConvolutionBwdWeightsAlgoDirect:ConvAsmBwdWrW1x1,0,379315,0,miopenConvolutionBwdWeightsAlgoDirect;miopenConvolutionBwdWeightsAlgoGEMM:gemm,1,84649,0,MIOpenGEMM
192-56-56-3x3-64-56-56-128-1x1-1x1-1x1-0-NCHW-FP32-W=miopenConvolutionBwdWeightsAlgoDirect:ConvAsmBwdWrW3x3,11,9521,0,miopenConvolutionBwdWeightsAlgoDirect;miopenConvolutionBwdWeightsAlgoWinograd:ConvBinWinogradRxSf2x3,18,6201,0,miopenConvolutionBwdWeightsAlgoWinograd;miopenConvolutionBwdWeightsAlgoImplicitGEMM:ConvHipImplicitGemmV4R1WrW,69,9408,0,miopenConvolutionBwdWeightsAlgoImplicitGEMM;miopenConvolutionBwdWeightsAlgoGEMM:gemm,101,507,7225344,MIOpenGEMM
512-14-14-1x1-160-14-14-128-0x0-1x1-1x1-0-NCHW-FP32-F=miopenConvolutionFwdAlgoDirect:ConvAsm1x1U,1,6061,0,miopenConvolutionFwdAlgoDirect;miopenConvolutionFwdAlgoGEMM:GemmFwd1x1_0_1,7,63708,0,MIOpenGEMM
256-7-7-1x1-832-7-7-128-0x0-1x1-1x1-0-NCHW-FP32-W=miopenConvolutionBwdWeightsAlgoDirect:ConvAsmBwdWrW1x1,0,695412,0,miopenConvolutionBwdWeightsAlgoDirect;miopenConvolutionBwdWeightsAlgoGEMM:gemm,2,146,0,MIOpenGEMM;miopenConvolutionBwdWeightsAlgoWinograd:ConvBinWinogradRxSf2x3,2,19034,0,miopenConvolutionBwdWeightsAlgoWinograd
64-14-14-1x1-512-14-14-128-0x0-1x1-1x1-0-NCHW-FP32-B=miopenConvolutionBwdDataAlgoDirect:ConvAsm1x1U,0,298016,0,miopenConvolutionBwdDataAlgoDirect;miopenConvolutionBwdDataAlgoWinograd:ConvBinWinogradRxSf3x2,0,652804,0,miopenConvolutionBwdDataAlgoWinograd;miopenConvolutionBwdDataAlgoGEMM:gemm,2,72276,0,MIOpenGEMM
128-7-7-1x1-832-7-7-128-0x0-1x1-1x1-0-NCHW-FP32-B=miopenConvolutionBwdDataAlgoDirect:ConvAsm1x1U,0,190728,0,miopenConvolutionBwdDataAlgoDirect;miopenConvolutionBwdDataAlgoWinograd:ConvBinWinogradRxSf3x2,0,579622,0,miopenConvolutionBwdDataAlgoWinograd;miopenConvolutionBwdDataAlgoGEMM:gemm,2,87815,0,MIOpenGEMM
144-14-14-1x1-512-14-14-128-0x0-1x1-1x1-0-NCHW-FP32-W=miopenConvolutionBwdWeightsAlgoDirect:ConvAsmBwdWrW1x1,1,21551,0,miopenConvolutionBwdWeightsAlgoDirect
192-56-56-3x3-64-56-56-128-1x1-1x1-1x1-0-NCHW-FP32-B=miopenConvolutionBwdDataAlgoWinograd:ConvBinWinogradRxSf2x3,4,5732,0,miopenConvolutionBwdDataAlgoWinograd
256-7-7-1x1-832-7-7-128-0x0-1x1-1x1-0-NCHW-FP32-B=miopenConvolutionBwdDataAlgoDirect:ConvAsm1x1U,0,319556,0,miopenConvolutionBwdDataAlgoDirect;miopenConvolutionBwdDataAlgoWinograd:ConvBinWinogradRxSf3x2,0,964116,0,miopenConvolutionBwdDataAlgoWinograd;miopenConvolutionBwdDataAlgoGEMM:gemm,2,75827,0,MIOpenGEMM
528-14-14-1x1-32-14-14-128-0x0-1x1-1x1-0-NCHW-FP32-F=miopenConvolutionFwdAlgoDirect:ConvAsm1x1U,0,230197,0,miopenConvolutionFwdAlgoDirect;miopenConvolutionFwdAlgoWinograd:ConvBinWinogradRxSf3x2,0,447408,0,miopenConvolutionFwdAlgoWinograd;miopenConvolutionFwdAlgoGEMM:GemmFwd1x1_0_1,3,76856,0,MIOpenGEMM
256-56-56-3x3-256-56-56-128-1x1-1x1-1x1-0-NCHW-FP32-W=miopenConvolutionBwdWeightsAlgoWinograd:ConvBinWinogradRxSf2x3,78,5608,0,miopenConvolutionBwdWeightsAlgoWinograd;miopenConvolutionBwdWeightsAlgoDirect:ConvAsmBwdWrW3x3,83,217,0,miopenConvolutionBwdWeightsAlgoDirect;miopenConvolutionBwdWeightsAlgoImplicitGEMM:ConvHipImplicitGemmV4R1WrW,125,655,0,miopenConvolutionBwdWeightsAlgoImplicitGEMM;miopenConvolutionBwdWeightsAlgoGEMM:gemm,319,606,28901376,MIOpenGEMM
96-28-28-1x1-192-28-28-128-0x0-1x1-1x1-0-NCHW-FP32-B=miopenConvolutionBwdDataAlgoDirect:ConvAsm1x1U,0,529028,0,miopenConvolutionBwdDataAlgoDirect;miopenConvolutionBwdDataAlgoWinograd:ConvBinWinogradRxSf3x2,1,26154,0,miopenConvolutionBwdDataAlgoWinograd;miopenConvolutionBwdDataAlgoGEMM:gemm,41,6651,0,MIOpenGEMM
64-56-56-3x3-192-56-56-128-1x1-1x1-1x1-0-NCHW-FP32-F=miopenConvolutionFwdAlgoWinograd:ConvBinWinograd3x3U,4,74558,0,miopenConvolutionFwdAlgoWinograd
64-224-224-3x3-3-224-224-128-1x1-1x1-1x1-0-NCHW-FP32-W=miopenConvolutionBwdWeightsAlgoDirect:ConvOclBwdWrW53,20,5142,884736,miopenConvolutionBwdWeightsAlgoDirect;miopenConvolutionBwdWeightsAlgoWinograd:ConvBinWinogradRxSf2x3,797,123,0,miopenConvolutionBwdWeightsAlgoWinograd;miopenConvolutionBwdWeightsAlgoGEMM:gemm,963,593,5419008,MIOpenGEMM
832-7-7-1x1-256-7-7-128-0x0-1x1-1x1-0-NCHW-FP32-F=miopenConvolutionFwdAlgoDirect:ConvAsm1x1U,0,62189,0,miopenConvolutionFwdAlgoDirect;miopenConvolutionFwdAlgoWinograd:ConvBinWinogradRxS,1,55782,0,miopenConvolutionFwdAlgoWinograd;miopenConvolutionFwdAlgoGEMM:GemmFwd1x1_0_1,8,27477,0,MIOpenGEMM
128-112-112-3x3-64-112-112-128-1x1-1x1-1x1-0-NCHW-FP32-B=miopenConvolutionBwdDataAlgoWinograd:ConvBinWinograd3x3U,24,3864,0,miopenConvolutionBwdDataAlgoWinograd
128-14-14-1x1-528-14-14-128-0x0-1x1-1x1-0-NCHW-FP32-W=miopenConvolutionBwdWeightsAlgoDirect:ConvAsmBwdWrW1x1,1,18935,0,miopenConvolutionBwdWeightsAlgoDirect;miopenConvolutionBwdWeightsAlgoWinograd:ConvBinWinogradRxSf2x3,3,4117,0,miopenConvolutionBwdWeightsAlgoWinograd;miopenConvolutionBwdWeightsAlgoGEMM:gemm,4,423,0,MIOpenGEMM
32-14-14-1x1-528-14-14-128-0x0-1x1-1x1-0-NCHW-FP32-W=miopenConvolutionBwdWeightsAlgoDirect:ConvAsmBwdWrW1x1,0,317776,0,miopenConvolutionBwdWeightsAlgoDirect;miopenConvolutionBwdWeightsAlgoWinograd:ConvBinWinogradRxSf2x3,1,41817,0,miopenConvolutionBwdWeightsAlgoWinograd;miopenConvolutionBwdWeightsAlgoGEMM:gemm,2,17035,0,MIOpenGEMM
192-28-28-1x1-96-28-28-128-0x0-1x1-1x1-0-NCHW-FP32-F=miopenConvolutionFwdAlgoDirect:ConvOclDirectFwd1x1,0,72974,0,miopenConvolutionFwdAlgoDirect;miopenConvolutionFwdAlgoWinograd:ConvBinWinogradRxSf3x2,1,49583,0,miopenConvolutionFwdAlgoWinograd;miopenConvolutionFwdAlgoGEMM:GemmFwd1x1_0_1,6,96961,0,MIOpenGEMM
32-28-28-1x1-192-28-28-128-0x0-1x1-1x1-0-NCHW-FP32-W=miopenConvolutionBwdWeightsAlgoDirect:ConvAsmBwdWrW1x1,0,355959,0,miopenConvolutionBwdWeightsAlgoDirect
528-14-14-1x1-128-14-14-128-0x0-1x1-1x1-0-NCHW-FP32-F=miopenConvolutionFwdAlgoDirect:ConvAsm1x1U,0,766767,0,miopenConvolutionFwdAlgoDirect;miopenConvolutionFwdAlgoWinograd:ConvBinWinogradRxSf3x2,1,4497,0,miopenConvolutionFwdAlgoWinograd;miopenConvolutionFwdAlgoGEMM:GemmFwd1x1_0_1,7,96721,0,MIOpenGEMM
192-28-28-1x1-64-28-28-128-0x0-1x1-1x1-0-NCHW-FP32-F=miopenConvolutionFwdAlgoDirect:ConvOclDirectFwd1x1,0,407079,0,miopenConvolutionFwdAlgoDirect;miopenConvolutionFwdAlgoWinograd:ConvBinWinogradRxSf3x2,0,742187,0,miopenConvolutionFwdAlgoWinograd;miopenConvolutionFwdAlgoGEMM:GemmFwd1x1_0_1,3,32872,0,MIOpenGEMM
528-14-14-1x1-160-14-14-128-0x0-1x1-1x1-0-NCHW-FP32-F=miopenConvolutionFwdAlgoDirect:ConvAsm1x1U,1,4338,0,miopenConvolutionFwdAlgoDirect;miopenConvolutionFwdAlgoWinograd:ConvBinWinogradRxSf3x2,1,66185,0,miopenConvolutionFwdAlgoWinograd;miopenConvolutionFwdAlgoGEMM:GemmFwd1x1_0_1,7,5974,0,MIOpenGEMM
160-14-14-1x1-528-14-14-128-0x0-1x1-1x1-0-NCHW-FP32-B=miopenConvolutionBwdDataAlgoDirect:ConvAsm1x1U,0,87858,0,miopenConvolutionBwdDataAlgoDirect;miopenConvolutionBwdDataAlgoGEMM:gemm,55,5986,0,MIOpenGEMM
64-28-28-1x1-192-28-28-128-0x0-1x1-1x1-0-NCHW-FP32-W=miopenConvolutionBwdWeightsAlgoDirect:ConvAsmBwdWrW1x1,0,750799,0,miopenConvolutionBwdWeightsAlgoDirect
32-14-14-1x1-528-14-14-128-0x0-1x1-1x1-0-NCHW-FP32-B=miopenConvolutionBwdDataAlgoWinograd:ConvBinWinogradRxSf3x2,0,991664,0,miopenConvolutionBwdDataAlgoWinograd;miopenConvolutionBwdDataAlgoGEMM:gemm,8,83298,0,MIOpenGEMM
256-14-14-1x1-528-14-14-128-0x0-1x1-1x1-0-NCHW-FP32-W=miopenConvolutionBwdWeightsAlgoDirect:ConvAsmBwdWrW1x1,2,31163,0,miopenConvolutionBwdWeightsAlgoDirect;miopenConvolutionBwdWeightsAlgoWinograd:ConvBinWinogradRxSf2x3,11,952,0,miopenConvolutionBwdWeightsAlgoWinograd;miopenConvolutionBwdWeightsAlgoGEMM:gemm,14,8676,0,MIOpenGEMM
256-14-14-1x1-528-14-14-128-0x0-1x1-1x1-0-NCHW-FP32-B=miopenConvolutionBwdDataAlgoDirect:ConvAsm1x1U,1,34475,0,miopenConvolutionBwdDataAlgoDirect;miopenConvolutionBwdDataAlgoGEMM:gemm,4,91655,0,MIOpenGEMM
64-28-28-1x1-192-28-28-128-0x0-1x1-1x1-0-NCHW-FP32-B=miopenConvolutionBwdDataAlgoDirect:ConvAsm1x1U,0,38576,0,miopenConvolutionBwdDataAlgoDirect;miopenConvolutionBwdDataAlgoWinograd:ConvBinWinogradRxSf3x2,0,958277,0,miopenConvolutionBwdDataAlgoWinograd;miopenConvolutionBwdDataAlgoGEMM:gemm,4,3988,0,MIOpenGEMM
128-14-14-1x1-528-14-14-128-0x0-1x1-1x1-0-NCHW-FP32-B=miopenConvolutionBwdDataAlgoDirect:ConvAsm1x1U,0,697322,0,miopenConvolutionBwdDataAlgoDirect;miopenConvolutionBwdDataAlgoGEMM:gemm,36,201,0,MIOpenGEMM
160-17-17-1x7-160-17-17-128-0x3-1x1-1x1-0-NCHW-FP32-B=miopenConvolutionBwdDataAlgoWinograd:ConvBinWinogradRxSf3x2,2,1647,0,miopenConvolutionBwdDataAlgoWinograd;miopenConvolutionBwdDataAlgoImplicitGEMM:ConvHipImplicitGemmBwdDataV1R1,4,61366,0,miopenConvolutionBwdDataAlgoImplicitGEMM;miopenConvolutionBwdDataAlgoGEMM:gemm,7,62855,1294720,MIOpenGEMM
1280-8-8-1x1-320-8-8-128-0x0-1x1-1x1-0-NCHW-FP32-F=miopenConvolutionFwdAlgoDirect:ConvAsm1x1U,1,55614,0,miopenConvolutionFwdAlgoDirect;miopenConvolutionFwdAlgoWinograd:ConvBinWinogradRxSf3x2,2,89829,0,miopenConvolutionFwdAlgoWinograd;miopenConvolutionFwdAlgoGEMM:GemmFwd1x1_0_1,9,26565,0,MIOpenGEMM
192-17-17-3x3-320-8-8-128-0x0-2x2-1x1-0-NCHW-FP32-F=miopenConvolutionFwdAlgoWinograd:ConvBinWinogradRxSf2x3,2,65817,0,miopenConvolutionFwdAlgoWinograd;miopenConvolutionFwdAlgoDirect:ConvOclDirectFwd,8,36819,0,miopenConvolutionFwdAlgoDirect;miopenConvolutionFwdAlgoGEMM:GemmFwdRest,11,4186,442368,MIOpenGEMM
160-17-17-1x7-160-17-17-128-0x3-1x1-1x1-0-NCHW-FP32-F=miopenConvolutionFwdAlgoImplicitGEMM:ConvHipImplicitGemmV4R1Fwd,2,48151,0,miopenConvolutionFwdAlgoImplicitGEMM;miopenConvolutionFwdAlgoWinograd:ConvBinWinogradRxSf3x2,2,86531,0,miopenConvolutionFwdAlgoWinograd;miopenConvolutionFwdAlgoGEMM:GemmFwdRest,23,2565,1294720,MIOpenGEMM
192-17-17-7x1-160-17-17-128-3x0-1x1-1x1-0-NCHW-FP32-W=miopenConvolutionBwdWeightsAlgoWinograd:ConvBinWinogradRxSf2x3,3,48241,0,miopenConvolutionBwdWeightsAlgoWinograd;miopenConvolutionBwdWeightsAlgoDirect:ConvOclBwdWrW53,4,20341,0,miopenConvolutionBwdWeightsAlgoDirect;miopenConvolutionBwdWeightsAlgoGEMM:gemm,20,4038,1294720,MIOpenGEMM
128-17-17-7x1-128-17-17-128-3x0-1x1-1x1-0-NCHW-FP32-W=miopenConvolutionBwdWeightsAlgoDirect:ConvOclBwdWrW53,2,56518,0,miopenConvolutionBwdWeightsAlgoDirect;miopenConvolutionBwdWeightsAlgoWinograd:ConvBinWinogradRxSf2x3,3,46538,0,miopenConvolutionBwdWeightsAlgoWinograd;miopenConvolutionBwdWeightsAlgoImplicitGEMM:ConvHipImplicitGemmV4R1WrW,8,90607,0,miopenConvolutionBwdWeightsAlgoImplicitGEMM;miopenConvolutionBwdWeightsAlgoGEMM:gemm,23,786,1035776,MIOpenGEMM
192-8-8-1x1-1280-8-8-128-0x0-1x1-1x1-0-NCHW-FP32-W=miopenConvolutionBwdWeightsAlgoDirect:ConvAsmBwdWrW1x1,0,572095,0,miopenConvolutionBwdWeightsAlgoDirect;miopenConvolutionBwdWeightsAlgoWinograd:ConvBinWinogradRxSf2x3,3,27371,0,miopenConvolutionBwdWeightsAlgoWinograd;miopenConvolutionBwdWeightsAlgoGEMM:gemm,4,4666,0,MIOpenGEMM
192-17-17-7x1-160-17-17-128-3x0-1x1-1x1-0-NCHW-FP32-B=miopenConvolutionBwdDataAlgoWinograd:ConvBinWinogradRxSf3x2,2,30365,0,miopenConvolutionBwdDataAlgoWinograd;miopenConvolutionBwdDataAlgoImplicitGEMM:ConvHipImplicitGemmBwdDataV1R1,5,71694,0,miopenConvolutionBwdDataAlgoImplicitGEMM;miopenConvolutionBwdDataAlgoGEMM:gemm,33,4563,1294720,MIOpenGEMM
64-14-14-1x1-512-14-14-128-0x0-1x1-1x1-0-NCHW-FP32-W=miopenConvolutionBwdWeightsAlgoDirect:ConvAsmBwdWrW1x1,0,528953,0,miopenConvolutionBwdWeightsAlgoDirect
448-8-8-1x1-1280-8-8-128-0x0-1x1-1x1-0-NCHW-FP32-W=miopenConvolutionBwdWeightsAlgoDirect:ConvAsmBwdWrW1x1,2,6052,0,miopenConvolutionBwdWeightsAlgoDirect;miopenConvolutionBwdWeightsAlgoGEMM:gemm,4,19888,0,MIOpenGEMM;miopenConvolutionBwdWeightsAlgoWinograd:ConvBinWinogradRxS,9,30462,0,miopenConvolutionBwdWeightsAlgoWinograd
192-8-8-1x1-1280-8-8-128-0x0-1x1-1x1-0-NCHW-FP32-B=miopenConvolutionBwdDataAlgoDirect:ConvAsm1x1U,0,442394,0,miopenConvolutionBwdDataAlgoDirect;miopenConvolutionBwdDataAlgoGEMM:gemm,5,98759,0,MIOpenGEMM
160-17-17-7x1-192-17-17-128-3x0-1x1-1x1-0-NCHW-FP32-F=miopenConvolutionFwdAlgoWinograd:ConvBinWinogradRxS,5,15779,0,miopenConvolutionFwdAlgoWinograd;miopenConvolutionFwdAlgoImplicitGEMM:ConvHipImplicitGemmV4R1Fwd,5,97489,0,miopenConvolutionFwdAlgoImplicitGEMM;miopenConvolutionFwdAlgoGEMM:GemmFwdRest,202,603,1294720,MIOpenGEMM
192-17-17-7x1-192-17-17-128-3x0-1x1-1x1-0-NCHW-FP32-W=miopenConvolutionBwdWeightsAlgoDirect:ConvOclBwdWrW53,4,81718,0,miopenConvolutionBwdWeightsAlgoDirect;miopenConvolutionBwdWeightsAlgoWinograd:ConvBinWinogradRxSf2x3,5,36997,0,miopenConvolutionBwdWeightsAlgoWinograd;miopenConvolutionBwdWeightsAlgoImplicitGEMM:ConvHipImplicitGemmV4R1WrW,7,4524,0,miopenConvolutionBwdWeightsAlgoImplicitGEMM;miopenConvolutionBwdWeightsAlgoGEMM:gemm,10,7798,1553664,MIOpenGEMM
512-14-14-1x1-64-14-14-128-0x0-1x1-1x1-0-NCHW-FP32-F=miopenConvolutionFwdAlgoDirect:ConvAsm1x1U,0,387408,0,miopenConvolutionFwdAlgoDirect;miopenConvolutionFwdAlgoWinograd:ConvBinWinogradRxSf3x2,0,810974,0,miopenConvolutionFwdAlgoWinograd;miopenConvolutionFwdAlgoGEMM:GemmFwd1x1_0_1,5,68599,0,MIOpenGEMM
384-8-8-1x1-2048-8-8-128-0x0-1x1-1x1-0-NCHW-FP32-W=miopenConvolutionBwdWeightsAlgoDirect:ConvAsmBwdWrW1x1,2,44738,0,miopenConvolutionBwdWeightsAlgoDirect;miopenConvolutionBwdWeightsAlgoGEMM:gemm,5,46058,0,MIOpenGEMM;miopenConvolutionBwdWeightsAlgoWinograd:ConvBinWinogradRxSf2x3,7,96497,0,miopenConvolutionBwdWeightsAlgoWinograd
192-17-17-1x7-160-17-17-128-0x3-1x1-1x1-0-NCHW-FP32-W=miopenConvolutionBwdWeightsAlgoWinograd:ConvBinWinogradRxSf2x3,3,27152,0,miopenConvolutionBwdWeightsAlgoWinograd;miopenConvolutionBwdWeightsAlgoDirect:ConvOclBwdWrW53,9,11368,0,miopenConvolutionBwdWeightsAlgoDirect;miopenConvolutionBwdWeightsAlgoGEMM:gemm,9,80852,1294720,MIOpenGEMM
192-17-17-7x1-192-17-17-128-3x0-1x1-1x1-0-NCHW-FP32-B=miopenConvolutionBwdDataAlgoWinograd:ConvBinWinogradRxSf3x2,2,72962,0,miopenConvolutionBwdDataAlgoWinograd;miopenConvolutionBwdDataAlgoImplicitGEMM:ConvHipImplicitGemmBwdDataV1R1,3,92867,0,miopenConvolutionBwdDataAlgoImplicitGEMM;miopenConvolutionBwdDataAlgoGEMM:gemm,12,1927,1553664,MIOpenGEMM
1280-8-8-1x1-192-8-8-128-0x0-1x1-1x1-0-NCHW-FP32-F=miopenConvolutionFwdAlgoDirect:ConvAsm1x1U,0,707965,0,miopenConvolutionFwdAlgoDirect;miopenConvolutionFwdAlgoWinograd:ConvBinWinogradRxSf3x2,1,22207,0,miopenConvolutionFwdAlgoWinograd;miopenConvolutionFwdAlgoGEMM:GemmFwd1x1_0_1,11,9476,0,MIOpenGEMM
192-17-17-1x7-160-17-17-128-0x3-1x1-1x1-0-NCHW-FP32-B=miopenConvolutionBwdDataAlgoWinograd:ConvBinWinogradRxSf3x2,3,51046,0,miopenConvolutionBwdDataAlgoWinograd;miopenConvolutionBwdDataAlgoImplicitGEMM:ConvHipImplicitGemmBwdDataV1R1,6,22936,0,miopenConvolutionBwdDataAlgoImplicitGEMM;miopenConvolutionBwdDataAlgoGEMM:gemm,14,615,1294720,MIOpenGEMM
448-8-8-1x1-1280-8-8-128-0x0-1x1-1x1-0-NCHW-FP32-B=miopenConvolutionBwdDataAlgoDirect:ConvAsm1x1U,1,26903,0,miopenConvolutionBwdDataAlgoDirect;miopenConvolutionBwdDataAlgoGEMM:gemm,9,96325,0,MIOpenGEMM
64-35-35-1x1-192-35-35-128-0x0-1x1-1x1-0-NCHW-FP32-B=miopenConvolutionBwdDataAlgoDirect:ConvAsm1x1U,0,96375,0,miopenConvolutionBwdDataAlgoDirect;miopenConvolutionBwdDataAlgoGEMM:gemm,13,8267,0,MIOpenGEMM
288-35-35-3x3-384-17-17-128-0x0-2x2-1x1-0-NCHW-FP32-F=miopenConvolutionFwdAlgoWinograd:ConvBinWinogradRxSf2x3,17,4739,0,miopenConvolutionFwdAlgoWinograd;miopenConvolutionFwdAlgoDirect:ConvOclDirectFwd,96,669,0,miopenConvolutionFwdAlgoDirect;miopenConvolutionFwdAlgoGEMM:GemmFwdRest,124,948,2996352,MIOpenGEMM
384-8-8-1x1-2048-8-8-128-0x0-1x1-1x1-0-NCHW-FP32-B=miopenConvolutionBwdDataAlgoDirect:ConvAsm1x1U,1,99176,0,miopenConvolutionBwdDataAlgoDirect;miopenConvolutionBwdDataAlgoWinograd:ConvBinWinogradRxSf3x2,5,32801,0,miopenConvolutionBwdDataAlgoWinograd;miopenConvolutionBwdDataAlgoGEMM:gemm,9,19719,0,MIOpenGEMM
160-17-17-1x7-192-17-17-128-0x3-1x1-1x1-0-NCHW-FP32-F=miopenConvolutionFwdAlgoImplicitGEMM:ConvHipImplicitGemmV4R1Fwd,3,36957,0,miopenConvolutionFwdAlgoImplicitGEMM;miopenConvolutionFwdAlgoWinograd:ConvBinWinogradRxSf3x2,3,89833,0,miopenConvolutionFwdAlgoWinograd;miopenConvolutionFwdAlgoGEMM:GemmFwdRest,51,8441,1294720,MIOpenGEMM
192-17-17-7x1-192-17-17-128-3x0-1x1-1x1-0-NCHW-FP32-F=miopenConvolutionFwdAlgoImplicitGEMM:ConvHipImplicitGemmV4R1Fwd,3,58229,0,miopenConvolutionFwdAlgoImplicitGEMM;miopenConvolutionFwdAlgoWinograd:ConvBinWinogradRxSf3x2,4,6815,0,miopenConvolutionFwdAlgoWinograd;miopenConvolutionFwdAlgoGEMM:GemmFwdRest,26,8397,1553664,MIOpenGEMM
32-149-149-3x3-3-299-299-128-0x0-2x2-1x1-0-NCHW-FP32-W=miopenConvolutionBwdWeightsAlgoDirect:ConvOclBwdWrW2NonTunable,8,7801,442368,miopenConvolutionBwdWeightsAlgoDirect;miopenConvolutionBwdWeightsAlgoGEMM:gemm,33,1057,2397708,MIOpenGEMM
192-8-8-3x3-192-17-17-128-0x0-2x2-1x1-0-NCHW-FP32-W=miopenConvolutionBwdWeightsAlgoImplicitGEMM:ConvHipImplicitGemmV4R1WrW,2,68632,0,miopenConvolutionBwdWeightsAlgoImplicitGEMM;miopenConvolutionBwdWeightsAlgoGEMM:gemm,5,97687,442368,MIOpenGEMM;miopenConvolutionBwdWeightsAlgoDirect:ConvOclBwdWrW2NonTunable,28,549,169869312,miopenConvolutionBwdWeightsAlgoDirect
32-149-149-3x3-3-299-299-128-0x0-2x2-1x1-0-NCHW-FP32-B=miopenConvolutionBwdDataAlgoDirect:ConvOclDirectFwd,4,45173,0,miopenConvolutionBwdDataAlgoDirect;miopenConvolutionBwdDataAlgoWinograd:ConvBinWinogradRxSf2x3,6,5274,0,miopenConvolutionBwdDataAlgoWinograd;miopenConvolutionBwdDataAlgoGEMM:gemm,12,565,2397708,MIOpenGEMM
192-17-17-7x1-128-17-17-128-3x0-1x1-1x1-0-NCHW-FP32-W=miopenConvolutionBwdWeightsAlgoWinograd:ConvBinWinogradRxSf2x3,2,63674,0,miopenConvolutionBwdWeightsAlgoWinograd;miopenConvolutionBwdWeightsAlgoDirect:ConvOclBwdWrW53,3,45773,0,miopenConvolutionBwdWeightsAlgoDirect;miopenConvolutionBwdWeightsAlgoImplicitGEMM:ConvHipImplicitGemmV4R1WrW,6,49116,0,miopenConvolutionBwdWeightsAlgoImplicitGEMM;miopenConvolutionBwdWeightsAlgoGEMM:gemm,8,85998,1035776,MIOpenGEMM
2048-8-8-1x1-384-8-8-128-0x0-1x1-1x1-0-NCHW-FP32-F=miopenConvolutionFwdAlgoDirect:ConvAsm1x1U,2,44092,0,miopenConvolutionFwdAlgoDirect;miopenConvolutionFwdAlgoWinograd:ConvBinWinogradRxSf3x2,4,10212,0,miopenConvolutionFwdAlgoWinograd;miopenConvolutionFwdAlgoGEMM:GemmFwd1x1_0_1,14,6791,0,MIOpenGEMM
64-35-35-1x1-256-35-35-128-0x0-1x1-1x1-0-NCHW-FP32-W=miopenConvolutionBwdWeightsAlgoDirect:ConvAsmBwdWrW1x1,1,90152,0,miopenConvolutionBwdWeightsAlgoDirect
1280-8-8-1x1-448-8-8-128-0x0-1x1-1x1-0-NCHW-FP32-F=miopenConvolutionFwdAlgoDirect:ConvAsm1x1U,2,79432,0,miopenConvolutionFwdAlgoDirect;miopenConvolutionFwdAlgoGEMM:GemmFwd1x1_0_1,12,7388,0,MIOpenGEMM
160-17-17-7x1-160-17-17-128-3x0-1x1-1x1-0-NCHW-FP32-W=miopenConvolutionBwdWeightsAlgoDirect:ConvOclBwdWrW53,3,60134,0,miopenConvolutionBwdWeightsAlgoDirect;miopenConvolutionBwdWeightsAlgoWinograd:ConvBinWinogradRxSf2x3,3,90549,0,miopenConvolutionBwdWeightsAlgoWinograd;miopenConvolutionBwdWeightsAlgoGEMM:gemm,11,3932,1294720,MIOpenGEMM
3-299-299-3x3-32-149-149-128-0x0-2x2-1x1-0-NCHW-FP32-F=miopenConvolutionFwdAlgoWinograd:ConvBinWinogradRxSf2x3,4,5382,0,miopenConvolutionFwdAlgoWinograd;miopenConvolutionFwdAlgoDirect:ConvOclDirectFwd,5,48883,0,miopenConvolutionFwdAlgoDirect;miopenConvolutionFwdAlgoGEMM:GemmFwdRest,23,198,2397708,MIOpenGEMM
192-17-17-7x1-128-17-17-128-3x0-1x1-1x1-0-NCHW-FP32-B=miopenConvolutionBwdDataAlgoWinograd:ConvBinWinogradRxSf3x2,2,33487,0,miopenConvolutionBwdDataAlgoWinograd;miopenConvolutionBwdDataAlgoImplicitGEMM:ConvHipImplicitGemmBwdDataV1R1,19,575,0,miopenConvolutionBwdDataAlgoImplicitGEMM;miopenConvolutionBwdDataAlgoGEMM:gemm,56,5301,1035776,MIOpenGEMM
192-8-8-3x3-192-17-17-128-0x0-2x2-1x1-0-NCHW-FP32-B=miopenConvolutionBwdDataAlgoWinograd:ConvBinWinogradRxSf2x3,1,95464,0,miopenConvolutionBwdDataAlgoWinograd;miopenConvolutionBwdDataAlgoImplicitGEMM:ConvHipImplicitGemmBwdDataV1R1,2,25753,0,miopenConvolutionBwdDataAlgoImplicitGEMM;miopenConvolutionBwdDataAlgoDirect:ConvOclDirectFwd,7,69204,0,miopenConvolutionBwdDataAlgoDirect;miopenConvolutionBwdDataAlgoGEMM:gemm,8,72998,442368,MIOpenGEMM
384-8-8-3x1-384-8-8-128-1x0-1x1-1x1-0-NCHW-FP32-B=miopenConvolutionBwdDataAlgoWinograd:ConvBinWinogradRxSf2x3,1,20339,0,miopenConvolutionBwdDataAlgoWinograd;miopenConvolutionBwdDataAlgoImplicitGEMM:ConvHipImplicitGemmBwdDataV1R1,1,31071,0,miopenConvolutionBwdDataAlgoImplicitGEMM;miopenConvolutionBwdDataAlgoGEMM:gemm,12,7145,294912,MIOpenGEMM
160-17-17-7x1-160-17-17-128-3x0-1x1-1x1-0-NCHW-FP32-B=miopenConvolutionBwdDataAlgoWinograd:ConvBinWinogradRxSf3x2,2,86079,0,miopenConvolutionBwdDataAlgoWinograd;miopenConvolutionBwdDataAlgoImplicitGEMM:ConvHipImplicitGemmBwdDataV1R1,6,44997,0,miopenConvolutionBwdDataAlgoImplicitGEMM;miopenConvolutionBwdDataAlgoGEMM:gemm,16,3158,1294720,MIOpenGEMM
320-8-8-1x1-2048-8-8-128-0x0-1x1-1x1-0-NCHW-FP32-W=miopenConvolutionBwdWeightsAlgoDirect:ConvAsmBwdWrW1x1,2,15567,0,miopenConvolutionBwdWeightsAlgoDirect;miopenConvolutionBwdWeightsAlgoGEMM:gemm,4,72231,0,MIOpenGEMM;miopenConvolutionBwdWeightsAlgoWinograd:ConvBinWinogradRxSf2x3,6,86431,0,miopenConvolutionBwdWeightsAlgoWinograd
64-35-35-1x1-288-35-35-128-0x0-1x1-1x1-0-NCHW-FP32-W=miopenConvolutionBwdWeightsAlgoDirect:ConvAsmBwdWrW1x1,1,46715,0,miopenConvolutionBwdWeightsAlgoDirect;miopenConvolutionBwdWeightsAlgoGEMM:gemm,3,60122,0,MIOpenGEMM;miopenConvolutionBwdWeightsAlgoWinograd:ConvBinWinogradRxSf2x3,6,80817,0,miopenConvolutionBwdWeightsAlgoWinograd
384-8-8-1x1-1280-8-8-128-0x0-1x1-1x1-0-NCHW-FP32-W=miopenConvolutionBwdWeightsAlgoDirect:ConvAsmBwdWrW1x1,1,90164,0,miopenConvolutionBwdWeightsAlgoDirect;miopenConvolutionBwdWeightsAlgoGEMM:gemm,6,84538,0,MIOpenGEMM;miopenConvolutionBwdWeightsAlgoWinograd:ConvBinWinogradRxSf2x3,7,33804,0,miopenConvolutionBwdWeightsAlgoWinograd
64-35-35-1x1-256-35-35-128-0x0-1x1-1x1-0-NCHW-FP32-B=miopenConvolutionBwdDataAlgoDirect:ConvAsm1x1U,0,791897,0,miopenConvolutionBwdDataAlgoDirect;miopenConvolutionBwdDataAlgoWinograd:ConvBinWinogradRxSf3x2,1,97154,0,miopenConvolutionBwdDataAlgoWinograd;miopenConvolutionBwdDataAlgoGEMM:gemm,7,9314,0,MIOpenGEMM
128-17-17-7x1-192-17-17-128-3x0-1x1-1x1-0-NCHW-FP32-F=miopenConvolutionFwdAlgoWinograd:ConvBinWinogradRxSf3x2,2,48978,0,miopenConvolutionFwdAlgoWinograd;miopenConvolutionFwdAlgoImplicitGEMM:ConvHipImplicitGemmV4R1Fwd,4,31394,0,miopenConvolutionFwdAlgoImplicitGEMM;miopenConvolutionFwdAlgoGEMM:GemmFwdRest,316,21,1035776,MIOpenGEMM
384-8-8-3x1-384-8-8-128-1x0-1x1-1x1-0-NCHW-FP32-F=miopenConvolutionFwdAlgoImplicitGEMM:ConvHipImplicitGemmV4R1Fwd,1,28999,0,miopenConvolutionFwdAlgoImplicitGEMM;miopenConvolutionFwdAlgoWinograd:ConvBinWinogradRxSf2x3,1,34498,0,miopenConvolutionFwdAlgoWinograd;miopenConvolutionFwdAlgoGEMM:GemmFwdRest,76,2905,294912,MIOpenGEMM
192-17-17-3x3-192-8-8-128-0x0-2x2-1x1-0-NCHW-FP32-F=miopenConvolutionFwdAlgoWinograd:ConvBinWinogradRxSf2x3,1,53469,0,miopenConvolutionFwdAlgoWinograd;miopenConvolutionFwdAlgoDirect:ConvOclDirectFwd,6,57636,0,miopenConvolutionFwdAlgoDirect;miopenConvolutionFwdAlgoGEMM:GemmFwdRest,158,429,442368,MIOpenGEMM
128-17-17-7x1-128-17-17-128-3x0-1x1-1x1-0-NCHW-FP32-B=miopenConvolutionBwdDataAlgoWinograd:ConvBinWinogradRxSf3x2,1,79537,0,miopenConvolutionBwdDataAlgoWinograd;miopenConvolutionBwdDataAlgoImplicitGEMM:ConvHipImplicitGemmBwdDataV1R1,3,3762,0,miopenConvolutionBwdDataAlgoImplicitGEMM;miopenConvolutionBwdDataAlgoGEMM:gemm,107,673,1035776,MIOpenGEMM
160-17-17-7x1-160-17-17-128-3x0-1x1-1x1-0-NCHW-FP32-F=miopenConvolutionFwdAlgoImplicitGEMM:ConvHipImplicitGemmV4R1Fwd,1,67131,0,miopenConvolutionFwdAlgoImplicitGEMM;miopenConvolutionFwdAlgoWinograd:ConvBinWinogradRxSf3x2,1,93027,0,miopenConvolutionFwdAlgoWinograd;miopenConvolutionFwdAlgoGEMM:GemmFwdRest,9,82905,1294720,MIOpenGEMM
192-17-17-1x7-128-17-17-128-0x3-1x1-1x1-0-NCHW-FP32-W=miopenConvolutionBwdWeightsAlgoWinograd:ConvBinWinogradRxSf2x3,3,34865,0,miopenConvolutionBwdWeightsAlgoWinograd;miopenConvolutionBwdWeightsAlgoDirect:ConvOclBwdWrW53,6,50072,0,miopenConvolutionBwdWeightsAlgoDirect;miopenConvolutionBwdWeightsAlgoImplicitGEMM:ConvHipImplicitGemmV4R1WrW,8,166,0,miopenConvolutionBwdWeightsAlgoImplicitGEMM;miopenConvolutionBwdWeightsAlgoGEMM:gemm,66,5203,1035776,MIOpenGEMM
160-17-17-1x7-160-17-17-128-0x3-1x1-1x1-0-NCHW-FP32-W=miopenConvolutionBwdWeightsAlgoWinograd:ConvBinWinogradRxSf2x3,3,9289,0,miopenConvolutionBwdWeightsAlgoWinograd;miopenConvolutionBwdWeightsAlgoDirect:ConvOclBwdWrW53,5,64945,0,miopenConvolutionBwdWeightsAlgoDirect;miopenConvolutionBwdWeightsAlgoGEMM:gemm,15,7854,1294720,MIOpenGEMM
384-8-8-1x3-384-8-8-128-0x1-1x1-1x1-0-NCHW-FP32-W=miopenConvolutionBwdWeightsAlgoDirect:ConvOclBwdWrW53,1,78985,0,miopenConvolutionBwdWeightsAlgoDirect;miopenConvolutionBwdWeightsAlgoWinograd:ConvBinWinogradRxSf2x3,2,84583,0,miopenConvolutionBwdWeightsAlgoWinograd;miopenConvolutionBwdWeightsAlgoImplicitGEMM:ConvHipImplicitGemmV4R1WrW,4,30418,0,miopenConvolutionBwdWeightsAlgoImplicitGEMM;miopenConvolutionBwdWeightsAlgoGEMM:gemm,61,888,294912,MIOpenGEMM
192-17-17-1x7-192-17-17-128-0x3-1x1-1x1-0-NCHW-FP32-W=miopenConvolutionBwdWeightsAlgoWinograd:ConvBinWinogradRxSf2x3,5,45054,0,miopenConvolutionBwdWeightsAlgoWinograd;miopenConvolutionBwdWeightsAlgoImplicitGEMM:ConvHipImplicitGemmV4R1WrW,8,1478,0,miopenConvolutionBwdWeightsAlgoImplicitGEMM;miopenConvolutionBwdWeightsAlgoDirect:ConvOclBwdWrW53,10,8773,0,miopenConvolutionBwdWeightsAlgoDirect;miopenConvolutionBwdWeightsAlgoGEMM:gemm,25,64,1553664,MIOpenGEMM
320-8-8-1x1-2048-8-8-128-0x0-1x1-1x1-0-NCHW-FP32-B=miopenConvolutionBwdDataAlgoDirect:ConvAsm1x1U,1,69724,0,miopenConvolutionBwdDataAlgoDirect;miopenConvolutionBwdDataAlgoWinograd:ConvBinWinogradRxSf3x2,4,36928,0,miopenConvolutionBwdDataAlgoWinograd;miopenConvolutionBwdDataAlgoGEMM:gemm,9,37503,0,MIOpenGEMM
384-8-8-1x1-1280-8-8-128-0x0-1x1-1x1-0-NCHW-FP32-B=miopenConvolutionBwdDataAlgoDirect:ConvAsm1x1U,1,21399,0,miopenConvolutionBwdDataAlgoDirect;miopenConvolutionBwdDataAlgoWinograd:ConvBinWinogradRxSf3x2,3,22258,0,miopenConvolutionBwdDataAlgoWinograd;miopenConvolutionBwdDataAlgoGEMM:gemm,5,24994,0,MIOpenGEMM
192-17-17-1x7-128-17-17-128-0x3-1x1-1x1-0-NCHW-FP32-B=miopenConvolutionBwdDataAlgoWinograd:ConvBinWinogradRxSf3x2,1,80066,0,miopenConvolutionBwdDataAlgoWinograd;miopenConvolutionBwdDataAlgoImplicitGEMM:ConvHipImplicitGemmBwdDataV1R1,3,33142,0,miopenConvolutionBwdDataAlgoImplicitGEMM;miopenConvolutionBwdDataAlgoGEMM:gemm,19,5876,1035776,MIOpenGEMM
256-35-35-1x1-64-35-35-128-0x0-1x1-1x1-0-NCHW-FP32-F=miopenConvolutionFwdAlgoDirect:ConvAsm1x1U,0,847961,0,miopenConvolutionFwdAlgoDirect;miopenConvolutionFwdAlgoWinograd:ConvBinWinogradRxSf3x2,1,30686,0,miopenConvolutionFwdAlgoWinograd;miopenConvolutionFwdAlgoGEMM:GemmFwd1x1_0_1,8,6564,0,MIOpenGEMM
192-17-17-1x7-192-17-17-128-0x3-1x1-1x1-0-NCHW-FP32-B=miopenConvolutionBwdDataAlgoWinograd:ConvBinWinogradRxSf3x2,2,77211,0,miopenConvolutionBwdDataAlgoWinograd;miopenConvolutionBwdDataAlgoImplicitGEMM:ConvHipImplicitGemmBwdDataV1R1,5,41807,0,miopenConvolutionBwdDataAlgoImplicitGEMM;miopenConvolutionBwdDataAlgoGEMM:gemm,9,43837,1553664,MIOpenGEMM
64-35-35-1x1-288-35-35-128-0x0-1x1-1x1-0-NCHW-FP32-B=miopenConvolutionBwdDataAlgoDirect:ConvAsm1x1U,1,10791,0,miopenConvolutionBwdDataAlgoDirect;miopenConvolutionBwdDataAlgoGEMM:gemm,13,3655,0,MIOpenGEMM
384-8-8-1x3-384-8-8-128-0x1-1x1-1x1-0-NCHW-FP32-B=miopenConvolutionBwdDataAlgoWinograd:ConvBinWinogradRxS,1,52375,0,miopenConvolutionBwdDataAlgoWinograd;miopenConvolutionBwdDataAlgoImplicitGEMM:ConvHipImplicitGemmBwdDataV1R1,1,53697,0,miopenConvolutionBwdDataAlgoImplicitGEMM;miopenConvolutionBwdDataAlgoGEMM:gemm,8,64794,294912,MIOpenGEMM
192-35-35-1x1-64-35-35-128-0x0-1x1-1x1-0-NCHW-FP32-F=miopenConvolutionFwdAlgoDirect:ConvOclDirectFwd1x1,0,648613,0,miopenConvolutionFwdAlgoDirect;miopenConvolutionFwdAlgoWinograd:ConvBinWinogradRxSf3x2,1,1308,0,miopenConvolutionFwdAlgoWinograd;miopenConvolutionFwdAlgoGEMM:GemmFwd1x1_0_1,4,96224,0,MIOpenGEMM
192-17-17-1x7-192-17-17-128-0x3-1x1-1x1-0-NCHW-FP32-F=miopenConvolutionFwdAlgoWinograd:ConvBinWinogradRxSf3x2,3,43855,0,miopenConvolutionFwdAlgoWinograd;miopenConvolutionFwdAlgoImplicitGEMM:ConvHipImplicitGemmV4R1Fwd,9,42592,0,miopenConvolutionFwdAlgoImplicitGEMM;miopenConvolutionFwdAlgoGEMM:GemmFwdRest,158,817,1553664,MIOpenGEMM
96-35-35-3x3-64-35-35-128-1x1-1x1-1x1-0-NCHW-FP32-W=miopenConvolutionBwdWeightsAlgoDirect:ConvAsmBwdWrW3x3,2,32635,0,miopenConvolutionBwdWeightsAlgoDirect;miopenConvolutionBwdWeightsAlgoWinograd:ConvBinWinogradRxSf2x3,5,41603,0,miopenConvolutionBwdWeightsAlgoWinograd;miopenConvolutionBwdWeightsAlgoGEMM:gemm,23,3212,2822400,MIOpenGEMM;miopenConvolutionBwdWeightsAlgoImplicitGEMM:ConvHipImplicitGemmV4R1WrW,26,819,0,miopenConvolutionBwdWeightsAlgoImplicitGEMM
128-17-17-1x7-192-17-17-128-0x3-1x1-1x1-0-NCHW-FP32-F=miopenConvolutionFwdAlgoImplicitGEMM:ConvHipImplicitGemmV4R1Fwd,1,61772,0,miopenConvolutionFwdAlgoImplicitGEMM;miopenConvolutionFwdAlgoWinograd:ConvBinWinogradRxSf3x2,1,74036,0,miopenConvolutionFwdAlgoWinograd;miopenConvolutionFwdAlgoGEMM:GemmFwdRest,29,8249,1035776,MIOpenGEMM
1280-8-8-1x1-384-8-8-128-0x0-1x1-1x1-0-NCHW-FP32-F=miopenConvolutionFwdAlgoDirect:ConvAsm1x1U,1,2901,0,miopenConvolutionFwdAlgoDirect;miopenConvolutionFwdAlgoWinograd:ConvBinWinogradRxSf3x2,2,18706,0,miopenConvolutionFwdAlgoWinograd;miopenConvolutionFwdAlgoGEMM:GemmFwd1x1_0_1,6,98267,0,MIOpenGEMM
384-8-8-1x3-384-8-8-128-0x1-1x1-1x1-0-NCHW-FP32-F=miopenConvolutionFwdAlgoWinograd:ConvBinWinogradRxS,1,36682,0,miopenConvolutionFwdAlgoWinograd;miopenConvolutionFwdAlgoImplicitGEMM:ConvHipImplicitGemmV4R1Fwd,3,22639,0,miopenConvolutionFwdAlgoImplicitGEMM;miopenConvolutionFwdAlgoGEMM:GemmFwdRest,64,7528,294912,MIOpenGEMM
48-35-35-1x1-256-35-35-128-0x0-1x1-1x1-0-NCHW-FP32-W=miopenConvolutionBwdWeightsAlgoDirect:ConvAsmBwdWrW1x1,1,91656,0,miopenConvolutionBwdWeightsAlgoDirect
96-35-35-3x3-64-35-35-128-1x1-1x1-1x1-0-NCHW-FP32-B=miopenConvolutionBwdDataAlgoWinograd:ConvBinWinogradRxS,1,1994,0,miopenConvolutionBwdDataAlgoWinograd
2048-8-8-1x1-320-8-8-128-0x0-1x1-1x1-0-NCHW-FP32-F=miopenConvolutionFwdAlgoDirect:ConvAsm1x1U,1,97092,0,miopenConvolutionFwdAlgoDirect;miopenConvolutionFwdAlgoWinograd:ConvBinWinogradRxSf3x2,3,33729,0,miopenConvolutionFwdAlgoWinograd;miopenConvolutionFwdAlgoGEMM:GemmFwd1x1_0_1,10,7421,0,MIOpenGEMM
288-35-35-1x1-64-35-35-128-0x0-1x1-1x1-0-NCHW-FP32-F=miopenConvolutionFwdAlgoDirect:ConvAsm1x1U,0,861042,0,miopenConvolutionFwdAlgoDirect;miopenConvolutionFwdAlgoGEMM:GemmFwd1x1_0_1,6,7364,0,MIOpenGEMM
128-17-17-7x1-128-17-17-128-3x0-1x1-1x1-0-NCHW-FP32-F=miopenConvolutionFwdAlgoImplicitGEMM:ConvHipImplicitGemmV4R1Fwd,1,56052,0,miopenConvolutionFwdAlgoImplicitGEMM;miopenConvolutionFwdAlgoWinograd:ConvBinWinogradRxSf3x2,1,76956,0,miopenConvolutionFwdAlgoWinograd;miopenConvolutionFwdAlgoGEMM:GemmFwdRest,12,637,1035776,MIOpenGEMM
64-35-35-3x3-96-35-35-128-1x1-1x1-1x1-0-NCHW-FP32-F=miopenConvolutionFwdAlgoWinograd:ConvBinWinograd3x3U,1,1311,0,miopenConvolutionFwdAlgoWinograd
32-147-147-3x3-32-149-149-128-0x0-1x1-1x1-0-NCHW-FP32-W=miopenConvolutionBwdWeightsAlgoDirect:ConvOclBwdWrW2NonTunable,28,9936,4718592,miopenConvolutionBwdWeightsAlgoDirect;miopenConvolutionBwdWeightsAlgoGEMM:gemm,74,7781,24893568,MIOpenGEMM;miopenConvolutionBwdWeightsAlgoWinograd:ConvBinWinogradRxSf2x3,77,239,0,miopenConvolutionBwdWeightsAlgoWinograd
320-8-8-1x1-1280-8-8-128-0x0-1x1-1x1-0-NCHW-FP32-W=miopenConvolutionBwdWeightsAlgoDirect:ConvAsmBwdWrW1x1,1,13756,0,miopenConvolutionBwdWeightsAlgoDirect;miopenConvolutionBwdWeightsAlgoGEMM:gemm,4,88953,0,MIOpenGEMM;miopenConvolutionBwdWeightsAlgoWinograd:ConvBinWinogradRxSf2x3,6,86704,0,miopenConvolutionBwdWeightsAlgoWinograd
128-17-17-1x7-128-17-17-128-0x3-1x1-1x1-0-NCHW-FP32-W=miopenConvolutionBwdWeightsAlgoWinograd:ConvBinWinogradRxSf2x3,1,22402,0,miopenConvolutionBwdWeightsAlgoWinograd;miopenConvolutionBwdWeightsAlgoDirect:ConvOclBwdWrW53,4,27054,0,miopenConvolutionBwdWeightsAlgoDirect;miopenConvolutionBwdWeightsAlgoImplicitGEMM:ConvHipImplicitGemmV4R1WrW,5,37387,0,miopenConvolutionBwdWeightsAlgoImplicitGEMM;miopenConvolutionBwdWeightsAlgoGEMM:gemm,7,3799,1035776,MIOpenGEMM
48-35-35-1x1-192-35-35-128-0x0-1x1-1x1-0-NCHW-FP32-B=miopenConvolutionBwdDataAlgoDirect:ConvAsm1x1U,0,631581,0,miopenConvolutionBwdDataAlgoDirect;miopenConvolutionBwdDataAlgoWinograd:ConvBinWinogradRxSf3x2,1,52506,0,miopenConvolutionBwdDataAlgoWinograd;miopenConvolutionBwdDataAlgoGEMM:gemm,5,55926,0,MIOpenGEMM
192-17-17-1x1-768-17-17-128-0x0-1x1-1x1-0-NCHW-FP32-B=miopenConvolutionBwdDataAlgoDirect:ConvAsm1x1U,1,33248,0,miopenConvolutionBwdDataAlgoDirect;miopenConvolutionBwdDataAlgoWinograd:ConvBinWinogradRxSf3x2,3,23982,0,miopenConvolutionBwdDataAlgoWinograd;miopenConvolutionBwdDataAlgoGEMM:gemm,5,91013,0,MIOpenGEMM
320-8-8-1x1-1280-8-8-128-0x0-1x1-1x1-0-NCHW-FP32-B=miopenConvolutionBwdDataAlgoDirect:ConvAsm1x1U,1,22472,0,miopenConvolutionBwdDataAlgoDirect;miopenConvolutionBwdDataAlgoWinograd:ConvBinWinogradRxSf3x2,2,76877,0,miopenConvolutionBwdDataAlgoWinograd;miopenConvolutionBwdDataAlgoGEMM:gemm,9,87278,0,MIOpenGEMM
192-8-8-1x1-2048-8-8-128-0x0-1x1-1x1-0-NCHW-FP32-W=miopenConvolutionBwdWeightsAlgoDirect:ConvAsmBwdWrW1x1,1,31289,0,miopenConvolutionBwdWeightsAlgoDirect;miopenConvolutionBwdWeightsAlgoGEMM:gemm,3,55794,0,MIOpenGEMM;miopenConvolutionBwdWeightsAlgoWinograd:ConvBinWinogradRxSf2x3,4,57814,0,miopenConvolutionBwdWeightsAlgoWinograd
48-35-35-1x1-192-35-35-128-0x0-1x1-1x1-0-NCHW-FP32-W=miopenConvolutionBwdWeightsAlgoDirect:ConvAsmBwdWrW1x1,1,31763,0,miopenConvolutionBwdWeightsAlgoDirect
48-35-35-1x1-256-35-35-128-0x0-1x1-1x1-0-NCHW-FP32-B=miopenConvolutionBwdDataAlgoDirect:ConvAsm1x1U,0,75681,0,miopenConvolutionBwdDataAlgoDirect;miopenConvolutionBwdDataAlgoWinograd:ConvBinWinogradRxSf3x2,1,88981,0,miopenConvolutionBwdDataAlgoWinograd;miopenConvolutionBwdDataAlgoGEMM:gemm,4,45046,0,MIOpenGEMM
384-8-8-3x3-448-8-8-128-1x1-1x1-1x1-0-NCHW-FP32-B=miopenConvolutionBwdDataAlgoWinograd:ConvBinWinograd3x3U,1,40616,0,miopenConvolutionBwdDataAlgoWinograd
128-17-17-1x7-128-17-17-128-0x3-1x1-1x1-0-NCHW-FP32-B=miopenConvolutionBwdDataAlgoWinograd:ConvBinWinogradRxSf3x2,1,4725,0,miopenConvolutionBwdDataAlgoWinograd;miopenConvolutionBwdDataAlgoImplicitGEMM:ConvHipImplicitGemmBwdDataV1R1,4,87867,0,miopenConvolutionBwdDataAlgoImplicitGEMM;miopenConvolutionBwdDataAlgoGEMM:gemm,196,928,1035776,MIOpenGEMM
96-35-35-3x3-96-35-35-128-1x1-1x1-1x1-0-NCHW-FP32-W=miopenConvolutionBwdWeightsAlgoDirect:ConvAsmBwdWrW3x3,5,57571,0,miopenConvolutionBwdWeightsAlgoDirect;miopenConvolutionBwdWeightsAlgoWinograd:ConvBinWinogradRxSf2x3,7,72582,0,miopenConvolutionBwdWeightsAlgoWinograd;miopenConvolutionBwdWeightsAlgoGEMM:gemm,35,2723,4233600,MIOpenGEMM
48-35-35-1x1-288-35-35-128-0x0-1x1-1x1-0-NCHW-FP32-W=miopenConvolutionBwdWeightsAlgoDirect:ConvAsmBwdWrW1x1,1,49922,0,miopenConvolutionBwdWeightsAlgoDirect;miopenConvolutionBwdWeightsAlgoGEMM:gemm,5,8526,0,MIOpenGEMM;miopenConvolutionBwdWeightsAlgoWinograd:ConvBinWinogradRxSf2x3,8,3492,0,miopenConvolutionBwdWeightsAlgoWinograd
32-147-147-3x3-32-149-149-128-0x0-1x1-1x1-0-NCHW-FP32-B=miopenConvolutionBwdDataAlgoWinograd:ConvBinWinogradRxS,4,64668,0,miopenConvolutionBwdDataAlgoWinograd;miopenConvolutionBwdDataAlgoDirect:ConvOclDirectFwd,24,2129,0,miopenConvolutionBwdDataAlgoDirect;miopenConvolutionBwdDataAlgoImplicitGEMM:ConvHipImplicitGemmBwdDataV1R1,76,3489,0,miopenConvolutionBwdDataAlgoImplicitGEMM;miopenConvolutionBwdDataAlgoGEMM:gemm,233,8,24893568,MIOpenGEMM
64-35-35-5x5-48-35-35-128-2x2-1x1-1x1-0-NCHW-FP32-W=miopenConvolutionBwdWeightsAlgoDirect:ConvOclBwdWrW2<8>,6,62156,4915200,miopenConvolutionBwdWeightsAlgoDirect;miopenConvolutionBwdWeightsAlgoWinograd:ConvBinWinogradRxSf2x3,7,64982,0,miopenConvolutionBwdWeightsAlgoWinograd;miopenConvolutionBwdWeightsAlgoGEMM:gemm,25,8348,5880000,MIOpenGEMM
96-35-35-3x3-96-35-35-128-1x1-1x1-1x1-0-NCHW-FP32-B=miopenConvolutionBwdDataAlgoWinograd:ConvBinWinogradRxSf2x3,2,2917,0,miopenConvolutionBwdDataAlgoWinograd
128-17-17-1x7-128-17-17-128-0x3-1x1-1x1-0-NCHW-FP32-F=miopenConvolutionFwdAlgoWinograd:ConvBinWinogradRxSf3x2,1,69454,0,miopenConvolutionFwdAlgoWinograd;miopenConvolutionFwdAlgoImplicitGEMM:ConvHipImplicitGemmV4R1Fwd,3,79501,0,miopenConvolutionFwdAlgoImplicitGEMM;miopenConvolutionFwdAlgoGEMM:GemmFwdRest,181,411,1035776,MIOpenGEMM
768-17-17-1x1-192-17-17-128-0x0-1x1-1x1-0-NCHW-FP32-F=miopenConvolutionFwdAlgoDirect:ConvAsm1x1U,1,7185,0,miopenConvolutionFwdAlgoDirect;miopenConvolutionFwdAlgoGEMM:GemmFwd1x1_0_1,9,51004,0,MIOpenGEMM
192-8-8-1x1-2048-8-8-128-0x0-1x1-1x1-0-NCHW-FP32-B=miopenConvolutionBwdDataAlgoDirect:ConvAsm1x1U,0,984648,0,miopenConvolutionBwdDataAlgoDirect;miopenConvolutionBwdDataAlgoWinograd:ConvBinWinogradRxSf3x2,2,8782,0,miopenConvolutionBwdDataAlgoWinograd;miopenConvolutionBwdDataAlgoGEMM:gemm,5,52331,0,MIOpenGEMM
256-35-35-1x1-48-35-35-128-0x0-1x1-1x1-0-NCHW-FP32-F=miopenConvolutionFwdAlgoDirect:ConvAsm1x1U,0,880595,0,miopenConvolutionFwdAlgoDirect;miopenConvolutionFwdAlgoGEMM:GemmFwd1x1_0_1,6,3935,0,MIOpenGEMM
96-35-35-3x3-96-35-35-128-1x1-1x1-1x1-0-NCHW-FP32-F=miopenConvolutionFwdAlgoWinograd:ConvBinWinogradRxSf2x3,2,12725,0,miopenConvolutionFwdAlgoWinograd
64-35-35-5x5-48-35-35-128-2x2-1x1-1x1-0-NCHW-FP32-B=miopenConvolutionBwdDataAlgoWinograd:ConvBinWinogradRxS,3,8656,0,miopenConvolutionBwdDataAlgoWinograd;miopenConvolutionBwdDataAlgoDirect:ConvOclDirectFwd,15,348,0,miopenConvolutionBwdDataAlgoDirect;miopenConvolutionBwdDataAlgoGEMM:gemm,31,6366,5880000,MIOpenGEMM
96-17-17-3x3-96-35-35-128-0x0-2x2-1x1-0-NCHW-FP32-W=miopenConvolutionBwdWeightsAlgoDirect:ConvOclBwdWrW2NonTunable,8,63001,42467328,miopenConvolutionBwdWeightsAlgoDirect;miopenConvolutionBwdWeightsAlgoGEMM:gemm,25,4608,998784,MIOpenGEMM
32-149-149-3x3-32-147-147-128-0x0-1x1-1x1-0-NCHW-FP32-F=miopenConvolutionFwdAlgoWinograd:ConvBinWinogradRxS,4,57468,0,miopenConvolutionFwdAlgoWinograd;miopenConvolutionFwdAlgoDirect:ConvOclDirectFwd,22,6294,0,miopenConvolutionFwdAlgoDirect;miopenConvolutionFwdAlgoGEMM:GemmFwdRest,39,923,24893568,MIOpenGEMM
48-35-35-1x1-288-35-35-128-0x0-1x1-1x1-0-NCHW-FP32-B=miopenConvolutionBwdDataAlgoDirect:ConvAsm1x1U,0,914036,0,miopenConvolutionBwdDataAlgoDirect;miopenConvolutionBwdDataAlgoGEMM:gemm,9,97983,0,MIOpenGEMM
192-35-35-1x1-48-35-35-128-0x0-1x1-1x1-0-NCHW-FP32-F=miopenConvolutionFwdAlgoDirect:ConvAsm1x1U,0,705654,0,miopenConvolutionFwdAlgoDirect;miopenConvolutionFwdAlgoGEMM:GemmFwd1x1_0_1,5,60754,0,MIOpenGEMM
448-8-8-1x1-2048-8-8-128-0x0-1x1-1x1-0-NCHW-FP32-W=miopenConvolutionBwdWeightsAlgoDirect:ConvAsmBwdWrW1x1,3,32214,0,miopenConvolutionBwdWeightsAlgoDirect;miopenConvolutionBwdWeightsAlgoGEMM:gemm,8,81076,0,MIOpenGEMM;miopenConvolutionBwdWeightsAlgoWinograd:ConvBinWinogradRxSf2x3,12,1656,0,miopenConvolutionBwdWeightsAlgoWinograd
768-17-17-1x1-160-17-17-128-0x0-1x1-1x1-0-NCHW-FP32-F=miopenConvolutionFwdAlgoDirect:ConvOclDirectFwd1x1,2,4077,0,miopenConvolutionFwdAlgoDirect;miopenConvolutionFwdAlgoGEMM:GemmFwd1x1_0_1,8,29474,0,MIOpenGEMM
320-8-8-3x3-192-17-17-128-0x0-2x2-1x1-0-NCHW-FP32-B=miopenConvolutionBwdDataAlgoImplicitGEMM:ConvHipImplicitGemmBwdDataV1R1,4,24292,0,miopenConvolutionBwdDataAlgoImplicitGEMM;miopenConvolutionBwdDataAlgoWinograd:ConvBinWinogradRxSf2x3,4,37075,0,miopenConvolutionBwdDataAlgoWinograd;miopenConvolutionBwdDataAlgoGEMM:gemm,20,2297,442368,MIOpenGEMM;miopenConvolutionBwdDataAlgoDirect:ConvOclDirectFwd,23,2729,0,miopenConvolutionBwdDataAlgoDirect
2048-8-8-1x1-192-8-8-128-0x0-1x1-1x1-0-NCHW-FP32-F=miopenConvolutionFwdAlgoDirect:ConvAsm1x1U,1,65262,0,miopenConvolutionFwdAlgoDirect;miopenConvolutionFwdAlgoWinograd:ConvBinWinogradRxSf3x2,2,93673,0,miopenConvolutionFwdAlgoWinograd;miopenConvolutionFwdAlgoGEMM:GemmFwd1x1_0_1,7,247,0,MIOpenGEMM
96-17-17-3x3-96-35-35-128-0x0-2x2-1x1-0-NCHW-FP32-B=miopenConvolutionBwdDataAlgoWinograd:ConvBinWinogradRxSf2x3,2,23243,0,miopenConvolutionBwdDataAlgoWinograd;miopenConvolutionBwdDataAlgoImplicitGEMM:ConvHipImplicitGemmBwdDataV1R1,5,9176,0,miopenConvolutionBwdDataAlgoImplicitGEMM;miopenConvolutionBwdDataAlgoDirect:ConvOclDirectFwd,9,65022,0,miopenConvolutionBwdDataAlgoDirect;miopenConvolutionBwdDataAlgoGEMM:gemm,164,575,998784,MIOpenGEMM
192-71-71-3x3-80-73-73-128-0x0-1x1-1x1-0-NCHW-FP32-W=miopenConvolutionBwdWeightsAlgoWinograd:ConvBinWinogradRxSf2x3,95,8761,0,miopenConvolutionBwdWeightsAlgoWinograd;miopenConvolutionBwdWeightsAlgoDirect:ConvOclBwdWrW2NonTunable,128,868,70778880,miopenConvolutionBwdWeightsAlgoDirect;miopenConvolutionBwdWeightsAlgoGEMM:gemm,771,322,14518080,MIOpenGEMM
48-35-35-5x5-64-35-35-128-2x2-1x1-1x1-0-NCHW-FP32-F=miopenConvolutionFwdAlgoWinograd:ConvBinWinogradRxSf2x3,1,99416,0,miopenConvolutionFwdAlgoWinograd;miopenConvolutionFwdAlgoImplicitGEMM:ConvHipImplicitGemmV4R1Fwd,3,46646,0,miopenConvolutionFwdAlgoImplicitGEMM;miopenConvolutionFwdAlgoDirect:ConvOclDirectFwd,14,5502,0,miopenConvolutionFwdAlgoDirect;miopenConvolutionFwdAlgoGEMM:GemmFwdRest,59,478,5880000,MIOpenGEMM
32-35-35-1x1-192-35-35-128-0x0-1x1-1x1-0-NCHW-FP32-W=miopenConvolutionBwdWeightsAlgoDirect:ConvAsmBwdWrW1x1,0,770558,0,miopenConvolutionBwdWeightsAlgoDirect
288-35-35-1x1-48-35-35-128-0x0-1x1-1x1-0-NCHW-FP32-F=miopenConvolutionFwdAlgoDirect:ConvAsm1x1U,0,959215,0,miopenConvolutionFwdAlgoDirect
160-17-17-1x1-768-17-17-128-0x0-1x1-1x1-0-NCHW-FP32-W=miopenConvolutionBwdWeightsAlgoDirect:ConvAsmBwdWrW1x1,2,37694,0,miopenConvolutionBwdWeightsAlgoDirect
448-8-8-1x1-2048-8-8-128-0x0-1x1-1x1-0-NCHW-FP32-B=miopenConvolutionBwdDataAlgoDirect:ConvAsm1x1U,2,25577,0,miopenConvolutionBwdDataAlgoDirect;miopenConvolutionBwdDataAlgoWinograd:ConvBinWinogradRxSf3x2,6,65444,0,miopenConvolutionBwdDataAlgoWinograd;miopenConvolutionBwdDataAlgoGEMM:gemm,9,23394,0,MIOpenGEMM
384-17-17-3x3-288-35-35-128-0x0-2x2-1x1-0-NCHW-FP32-W=miopenConvolutionBwdWeightsAlgoDirect:ConvOclBwdWrW2NonTunable,129,664,509607936,miopenConvolutionBwdWeightsAlgoDirect;miopenConvolutionBwdWeightsAlgoGEMM:gemm,143,238,2996352,MIOpenGEMM
96-35-35-3x3-96-17-17-128-0x0-2x2-1x1-0-NCHW-FP32-F=miopenConvolutionFwdAlgoWinograd:ConvBinWinogradRxSf2x3,2,25765,0,miopenConvolutionFwdAlgoWinograd;miopenConvolutionFwdAlgoDirect:ConvOclDirectFwd,10,7423,0,miopenConvolutionFwdAlgoDirect;miopenConvolutionFwdAlgoGEMM:GemmFwdRest,27,6876,998784,MIOpenGEMM
64-147-147-3x3-32-147-147-128-1x1-1x1-1x1-0-NCHW-FP32-W=miopenConvolutionBwdWeightsAlgoDirect:ConvAsmBwdWrW3x3,32,3111,0,miopenConvolutionBwdWeightsAlgoDirect;miopenConvolutionBwdWeightsAlgoWinograd:ConvBinWinogradRxSf2x3,206,137,0,miopenConvolutionBwdWeightsAlgoWinograd;miopenConvolutionBwdWeightsAlgoGEMM:gemm,674,918,24893568,MIOpenGEMM
32-35-35-1x1-192-35-35-128-0x0-1x1-1x1-0-NCHW-FP32-B=miopenConvolutionBwdDataAlgoDirect:ConvAsm1x1U,0,440723,0,miopenConvolutionBwdDataAlgoDirect;miopenConvolutionBwdDataAlgoWinograd:ConvBinWinogradRxSf3x2,1,12695,0,miopenConvolutionBwdDataAlgoWinograd;miopenConvolutionBwdDataAlgoGEMM:gemm,2,52305,0,MIOpenGEMM
384-8-8-3x3-448-8-8-128-1x1-1x1-1x1-0-NCHW-FP32-W=miopenConvolutionBwdWeightsAlgoWinograd:ConvBinWinogradRxS,3,8895,0,miopenConvolutionBwdWeightsAlgoWinograd;miopenConvolutionBwdWeightsAlgoDirect:ConvOclBwdWrW53,4,1555,0,miopenConvolutionBwdWeightsAlgoDirect;miopenConvolutionBwdWeightsAlgoImplicitGEMM:ConvHipImplicitGemmV4R1WrW,6,39612,0,miopenConvolutionBwdWeightsAlgoImplicitGEMM;miopenConvolutionBwdWeightsAlgoGEMM:gemm,27,8302,1032192,MIOpenGEMM
64-147-147-3x3-32-147-147-128-1x1-1x1-1x1-0-NCHW-FP32-B=miopenConvolutionBwdDataAlgoWinograd:ConvBinWinograd3x3U,5,92899,0,miopenConvolutionBwdDataAlgoWinograd
64-35-35-1x1-192-35-35-128-0x0-1x1-1x1-0-NCHW-FP32-W=miopenConvolutionBwdWeightsAlgoDirect:ConvAsmBwdWrW1x1,0,928786,0,miopenConvolutionBwdWeightsAlgoDirect
192-35-35-1x1-32-35-35-128-0x0-1x1-1x1-0-NCHW-FP32-F=miopenConvolutionFwdAlgoDirect:ConvAsm1x1U,0,478457,0,miopenConvolutionFwdAlgoDirect;miopenConvolutionFwdAlgoWinograd:ConvBinWinogradRxSf3x2,0,761282,0,miopenConvolutionFwdAlgoWinograd;miopenConvolutionFwdAlgoGEMM:GemmFwd1x1_0_1,3,29941,0,MIOpenGEMM
448-8-8-3x3-384-8-8-128-1x1-1x1-1x1-0-NCHW-FP32-F=miopenConvolutionFwdAlgoWinograd:ConvBinWinograd3x3U,1,26035,0,miopenConvolutionFwdAlgoWinograd
2048-8-8-1x1-448-8-8-128-0x0-1x1-1x1-0-NCHW-FP32-F=miopenConvolutionFwdAlgoDirect:ConvAsm1x1U,2,3936,0,miopenConvolutionFwdAlgoDirect;miopenConvolutionFwdAlgoWinograd:ConvBinWinogradRxSf3x2,4,24576,0,miopenConvolutionFwdAlgoWinograd;miopenConvolutionFwdAlgoGEMM:GemmFwd1x1_0_1,10,6857,0,MIOpenGEMM
320-8-8-3x3-192-17-17-128-0x0-2x2-1x1-0-NCHW-FP32-W=miopenConvolutionBwdWeightsAlgoImplicitGEMM:ConvHipImplicitGemmV4R1WrW,2,93841,0,miopenConvolutionBwdWeightsAlgoImplicitGEMM;miopenConvolutionBwdWeightsAlgoGEMM:gemm,9,53674,442368,MIOpenGEMM;miopenConvolutionBwdWeightsAlgoDirect:ConvOclBwdWrW2NonTunable,45,4834,283115520,miopenConvolutionBwdWeightsAlgoDirect
384-8-8-1x1-1536-8-8-64-0x0-1x1-1x1-0-NCHW-FP32-B=miopenConvolutionBwdDataAlgoDirect:ConvAsm1x1U,0,763585,0,miopenConvolutionBwdDataAlgoDirect;miopenConvolutionBwdDataAlgoWinograd:ConvBinWinogradRxSf3x2,1,83533,0,miopenConvolutionBwdDataAlgoWinograd;miopenConvolutionBwdDataAlgoGEMM:gemm,3,68581,0,MIOpenGEMM
1024-17-17-1x1-256-17-17-64-0x0-1x1-1x1-0-NCHW-FP32-F=miopenConvolutionFwdAlgoDirect:ConvAsm1x1U,1,94299,0,miopenConvolutionFwdAlgoDirect;miopenConvolutionFwdAlgoWinograd:ConvBinWinogradRxSf3x2,3,45369,0,miopenConvolutionFwdAlgoWinograd;miopenConvolutionFwdAlgoGEMM:GemmFwd1x1_0_1,6,61241,0,MIOpenGEMM
160-17-17-1x1-768-17-17-128-0x0-1x1-1x1-0-NCHW-FP32-B=miopenConvolutionBwdDataAlgoDirect:ConvAsm1x1U,1,65266,0,miopenConvolutionBwdDataAlgoDirect;miopenConvolutionBwdDataAlgoGEMM:gemm,276,723,0,MIOpenGEMM
192-17-17-1x1-1024-17-17-64-0x0-1x1-1x1-0-NCHW-FP32-W=miopenConvolutionBwdWeightsAlgoDirect:ConvAsmBwdWrW1x1,1,67724,0,miopenConvolutionBwdWeightsAlgoDirect;miopenConvolutionBwdWeightsAlgoWinograd:ConvBinWinogradRxSf2x3,6,68083,0,miopenConvolutionBwdWeightsAlgoWinograd
1536-8-8-1x1-384-8-8-64-0x0-1x1-1x1-0-NCHW-FP32-F=miopenConvolutionFwdAlgoDirect:ConvAsm1x1U,1,24349,0,miopenConvolutionFwdAlgoDirect;miopenConvolutionFwdAlgoWinograd:ConvBinWinogradRxSf3x2,2,27056,0,miopenConvolutionFwdAlgoWinograd;miopenConvolutionFwdAlgoGEMM:GemmFwd1x1_0_1,3,89099,0,MIOpenGEMM
256-8-8-1x1-1536-8-8-64-0x0-1x1-1x1-0-NCHW-FP32-W=miopenConvolutionBwdWeightsAlgoDirect:ConvAsmBwdWrW1x1,0,486589,0,miopenConvolutionBwdWeightsAlgoDirect;miopenConvolutionBwdWeightsAlgoGEMM:gemm,1,52394,0,MIOpenGEMM;miopenConvolutionBwdWeightsAlgoWinograd:ConvBinWinogradRxSf2x3,2,11952,0,miopenConvolutionBwdWeightsAlgoWinograd
192-17-17-1x1-1024-17-17-64-0x0-1x1-1x1-0-NCHW-FP32-B=miopenConvolutionBwdDataAlgoDirect:ConvAsm1x1U,1,88414,0,miopenConvolutionBwdDataAlgoDirect
192-8-8-3x3-192-17-17-64-0x0-2x2-1x1-0-NCHW-FP32-W=miopenConvolutionBwdWeightsAlgoImplicitGEMM:ConvHipImplicitGemmV4R1WrW,1,98643,0,miopenConvolutionBwdWeightsAlgoImplicitGEMM;miopenConvolutionBwdWeightsAlgoDirect:ConvOclBwdWrW2NonTunable,16,4939,84934656,miopenConvolutionBwdWeightsAlgoDirect;miopenConvolutionBwdWeightsAlgoGEMM:gemm,18,9172,442368,MIOpenGEMM
128-17-17-1x1-768-17-17-128-0x0-1x1-1x1-0-NCHW-FP32-W=miopenConvolutionBwdWeightsAlgoDirect:ConvAsmBwdWrW1x1,1,22592,0,miopenConvolutionBwdWeightsAlgoDirect
256-8-8-1x1-1536-8-8-64-0x0-1x1-1x1-0-NCHW-FP32-B=miopenConvolutionBwdDataAlgoDirect:ConvAsm1x1U,0,417955,0,miopenConvolutionBwdDataAlgoDirect;miopenConvolutionBwdDataAlgoWinograd:ConvBinWinogradRxSf3x2,0,927186,0,miopenConvolutionBwdDataAlgoWinograd;miopenConvolutionBwdDataAlgoGEMM:gemm,3,164,0,MIOpenGEMM
192-71-71-3x3-192-35-35-64-0x0-2x2-1x1-0-NCHW-FP32-F=miopenConvolutionFwdAlgoWinograd:ConvBinWinogradRxS,14,4151,0,miopenConvolutionFwdAlgoWinograd;miopenConvolutionFwdAlgoGEMM:GemmFwdRest,38,6363,8467200,MIOpenGEMM;miopenConvolutionFwdAlgoDirect:ConvOclDirectFwd,95,1193,0,miopenConvolutionFwdAlgoDirect
1024-17-17-1x1-192-17-17-64-0x0-1x1-1x1-0-NCHW-FP32-F=miopenConvolutionFwdAlgoDirect:ConvAsm1x1U,1,63224,0,miopenConvolutionFwdAlgoDirect;miopenConvolutionFwdAlgoGEMM:GemmFwd1x1_0_1,8,46842,0,MIOpenGEMM
192-8-8-3x3-192-17-17-64-0x0-2x2-1x1-0-NCHW-FP32-B=miopenConvolutionBwdDataAlgoImplicitGEMM:ConvHipImplicitGemmBwdDataV1R1,1,20942,0,miopenConvolutionBwdDataAlgoImplicitGEMM;miopenConvolutionBwdDataAlgoWinograd:ConvBinWinogradRxS,1,33238,0,miopenConvolutionBwdDataAlgoWinograd;miopenConvolutionBwdDataAlgoDirect:ConvOclDirectFwd,4,84822,0,miopenConvolutionBwdDataAlgoDirect;miopenConvolutionBwdDataAlgoGEMM:gemm,5,25029,442368,MIOpenGEMM
1536-8-8-1x1-256-8-8-64-0x0-1x1-1x1-0-NCHW-FP32-F=miopenConvolutionFwdAlgoDirect:ConvAsm1x1U,0,539187,0,miopenConvolutionFwdAlgoDirect;miopenConvolutionFwdAlgoWinograd:ConvBinWinogradRxSf3x2,1,36697,0,miopenConvolutionFwdAlgoWinograd;miopenConvolutionFwdAlgoGEMM:GemmFwd1x1_0_1,3,14537,0,MIOpenGEMM
256-17-17-3x3-224-35-35-64-0x0-2x2-1x1-0-NCHW-FP32-B=miopenConvolutionBwdDataAlgoWinograd:ConvBinWinogradRxSf2x3,7,93204,0,miopenConvolutionBwdDataAlgoWinograd;miopenConvolutionBwdDataAlgoImplicitGEMM:ConvHipImplicitGemmBwdDataV1R1,8,42155,0,miopenConvolutionBwdDataAlgoImplicitGEMM;miopenConvolutionBwdDataAlgoDirect:ConvOclDirectFwd,26,8474,0,miopenConvolutionBwdDataAlgoDirect;miopenConvolutionBwdDataAlgoGEMM:gemm,28,6723,2330496,MIOpenGEMM
192-17-17-3x3-192-8-8-64-0x0-2x2-1x1-0-NCHW-FP32-F=miopenConvolutionFwdAlgoWinograd:ConvBinWinogradRxSf2x3,2,3244,0,miopenConvolutionFwdAlgoWinograd;miopenConvolutionFwdAlgoDirect:ConvOclDirectFwd,4,75703,0,miopenConvolutionFwdAlgoDirect;miopenConvolutionFwdAlgoGEMM:GemmFwdRest,157,612,442368,MIOpenGEMM
128-17-17-1x1-1024-17-17-64-0x0-1x1-1x1-0-NCHW-FP32-W=miopenConvolutionBwdWeightsAlgoDirect:ConvAsmBwdWrW1x1,0,85533,0,miopenConvolutionBwdWeightsAlgoDirect
224-35-35-3x3-256-17-17-64-0x0-2x2-1x1-0-NCHW-FP32-F=miopenConvolutionFwdAlgoWinograd:ConvBinWinogradRxSf2x3,4,42169,0,miopenConvolutionFwdAlgoWinograd;miopenConvolutionFwdAlgoGEMM:GemmFwdRest,18,3141,2330496,MIOpenGEMM;miopenConvolutionFwdAlgoDirect:ConvOclDirectFwd,24,8285,0,miopenConvolutionFwdAlgoDirect
224-35-35-3x3-192-35-35-64-1x1-1x1-1x1-0-NCHW-FP32-W=miopenConvolutionBwdWeightsAlgoWinograd:ConvBinWinogradRxS,10,1426,0,miopenConvolutionBwdWeightsAlgoWinograd;miopenConvolutionBwdWeightsAlgoDirect:ConvAsmBwdWrW3x3,12,2645,0,miopenConvolutionBwdWeightsAlgoDirect;miopenConvolutionBwdWeightsAlgoImplicitGEMM:ConvHipImplicitGemmV4R1WrW,24,265,0,miopenConvolutionBwdWeightsAlgoImplicitGEMM;miopenConvolutionBwdWeightsAlgoGEMM:gemm,66,715,8467200,MIOpenGEMM
384-17-17-1x1-1024-17-17-64-0x0-1x1-1x1-0-NCHW-FP32-W=miopenConvolutionBwdWeightsAlgoDirect:ConvAsmBwdWrW1x1,2,30601,0,miopenConvolutionBwdWeightsAlgoDirect;miopenConvolutionBwdWeightsAlgoWinograd:ConvBinWinogradRxSf2x3,8,50597,0,miopenConvolutionBwdWeightsAlgoWinograd
192-17-17-1x7-192-17-17-64-0x3-1x1-1x1-0-NCHW-FP32-W=miopenConvolutionBwdWeightsAlgoWinograd:ConvBinWinogradRxSf2x3,1,8692,0,miopenConvolutionBwdWeightsAlgoWinograd;miopenConvolutionBwdWeightsAlgoDirect:ConvOclBwdWrW53,3,9701,0,miopenConvolutionBwdWeightsAlgoDirect;miopenConvolutionBwdWeightsAlgoImplicitGEMM:ConvHipImplicitGemmV4R1WrW,4,25968,0,miopenConvolutionBwdWeightsAlgoImplicitGEMM;miopenConvolutionBwdWeightsAlgoGEMM:gemm,13,3311,1553664,MIOpenGEMM
224-35-35-3x3-192-35-35-64-1x1-1x1-1x1-0-NCHW-FP32-B=miopenConvolutionBwdDataAlgoWinograd:ConvBinWinogradRxS,3,61029,0,miopenConvolutionBwdDataAlgoWinograd
192-35-35-3x3-224-35-35-64-1x1-1x1-1x1-0-NCHW-FP32-F=miopenConvolutionFwdAlgoWinograd:ConvBinWinogradRxS,3,69755,0,miopenConvolutionFwdAlgoWinograd
192-17-17-1x7-192-17-17-64-0x3-1x1-1x1-0-NCHW-FP32-B=miopenConvolutionBwdDataAlgoWinograd:ConvBinWinogradRxSf3x2,1,29541,0,miopenConvolutionBwdDataAlgoWinograd;miopenConvolutionBwdDataAlgoImplicitGEMM:ConvHipImplicitGemmBwdDataV1R1,2,91782,0,miopenConvolutionBwdDataAlgoImplicitGEMM;miopenConvolutionBwdDataAlgoGEMM:gemm,6,76548,1553664,MIOpenGEMM
32-149-149-3x3-3-299-299-64-0x0-2x2-1x1-0-NCHW-FP32-W=miopenConvolutionBwdWeightsAlgoDirect:ConvOclBwdWrW2NonTunable,5,44191,221184,miopenConvolutionBwdWeightsAlgoDirect;miopenConvolutionBwdWeightsAlgoGEMM:gemm,10,9691,2397708,MIOpenGEMM
192-17-17-1x7-192-17-17-64-0x3-1x1-1x1-0-NCHW-FP32-F=miopenConvolutionFwdAlgoImplicitGEMM:ConvHipImplicitGemmV4R1Fwd,1,30996,0,miopenConvolutionFwdAlgoImplicitGEMM;miopenConvolutionFwdAlgoWinograd:ConvBinWinogradRxSf3x2,1,38906,0,miopenConvolutionFwdAlgoWinograd;miopenConvolutionFwdAlgoGEMM:GemmFwdRest,10,6273,1553664,MIOpenGEMM
384-17-17-1x1-1024-17-17-64-0x0-1x1-1x1-0-NCHW-FP32-B=miopenConvolutionBwdDataAlgoDirect:ConvAsm1x1U,2,25362,0,miopenConvolutionBwdDataAlgoDirect
256-17-17-7x1-224-17-17-64-3x0-1x1-1x1-0-NCHW-FP32-W=miopenConvolutionBwdWeightsAlgoDirect:ConvOclBwdWrW53,3,9544,0,miopenConvolutionBwdWeightsAlgoDirect;miopenConvolutionBwdWeightsAlgoWinograd:ConvBinWinogradRxSf2x3,4,24508,0,miopenConvolutionBwdWeightsAlgoWinograd;miopenConvolutionBwdWeightsAlgoGEMM:gemm,53,7922,1812608,MIOpenGEMM
32-149-149-3x3-3-299-299-64-0x0-2x2-1x1-0-NCHW-FP32-B=miopenConvolutionBwdDataAlgoDirect:ConvOclDirectFwd,3,11327,0,miopenConvolutionBwdDataAlgoDirect;miopenConvolutionBwdDataAlgoWinograd:ConvBinWinogradRxS,4,89141,0,miopenConvolutionBwdDataAlgoWinograd;miopenConvolutionBwdDataAlgoGEMM:gemm,12,8643,2397708,MIOpenGEMM
224-17-17-7x1-192-17-17-64-3x0-1x1-1x1-0-NCHW-FP32-W=miopenConvolutionBwdWeightsAlgoDirect:ConvOclBwdWrW53,2,7756,0,miopenConvolutionBwdWeightsAlgoDirect;miopenConvolutionBwdWeightsAlgoWinograd:ConvBinWinogradRxSf2x3,3,23497,0,miopenConvolutionBwdWeightsAlgoWinograd;miopenConvolutionBwdWeightsAlgoImplicitGEMM:ConvHipImplicitGemmV4R1WrW,5,37546,0,miopenConvolutionBwdWeightsAlgoImplicitGEMM;miopenConvolutionBwdWeightsAlgoGEMM:gemm,17,9599,1553664,MIOpenGEMM
256-17-17-7x1-224-17-17-64-3x0-1x1-1x1-0-NCHW-FP32-B=miopenConvolutionBwdDataAlgoWinograd:ConvBinWinogradRxSf3x2,2,84047,0,miopenConvolutionBwdDataAlgoWinograd;miopenConvolutionBwdDataAlgoImplicitGEMM:ConvHipImplicitGemmBwdDataV1R1,5,73099,0,miopenConvolutionBwdDataAlgoImplicitGEMM;miopenConvolutionBwdDataAlgoGEMM:gemm,13,506,1812608,MIOpenGEMM
64-73-73-1x1-160-73-73-64-0x0-1x1-1x1-0-NCHW-FP32-W=miopenConvolutionBwdWeightsAlgoDirect:ConvAsmBwdWrW1x1,2,41018,0,miopenConvolutionBwdWeightsAlgoDirect;miopenConvolutionBwdWeightsAlgoGEMM:gemm,6,99613,0,MIOpenGEMM;miopenConvolutionBwdWeightsAlgoWinograd:ConvBinWinogradRxSf2x3,18,2,0,miopenConvolutionBwdWeightsAlgoWinograd
3-299-299-3x3-32-149-149-64-0x0-2x2-1x1-0-NCHW-FP32-F=miopenConvolutionFwdAlgoDirect:ConvOclDirectFwd,2,95406,0,miopenConvolutionFwdAlgoDirect;miopenConvolutionFwdAlgoWinograd:ConvBinWinogradRxSf2x3,3,12955,0,miopenConvolutionFwdAlgoWinograd;miopenConvolutionFwdAlgoGEMM:GemmFwdRest,20,9835,2397708,MIOpenGEMM
1024-17-17-1x1-384-17-17-64-0x0-1x1-1x1-0-NCHW-FP32-F=miopenConvolutionFwdAlgoDirect:ConvOclDirectFwd1x1,3,3016,0,miopenConvolutionFwdAlgoDirect;miopenConvolutionFwdAlgoGEMM:GemmFwd1x1_0_1,8,36534,0,MIOpenGEMM
224-17-17-7x1-256-17-17-64-3x0-1x1-1x1-0-NCHW-FP32-F=miopenConvolutionFwdAlgoImplicitGEMM:ConvHipImplicitGemmV4R1Fwd,2,9041,0,miopenConvolutionFwdAlgoImplicitGEMM;miopenConvolutionFwdAlgoWinograd:ConvBinWinogradRxSf3x2,3,6751,0,miopenConvolutionFwdAlgoWinograd;miopenConvolutionFwdAlgoGEMM:GemmFwdRest,13,9889,1812608,MIOpenGEMM
224-17-17-7x1-192-17-17-64-3x0-1x1-1x1-0-NCHW-FP32-B=miopenConvolutionBwdDataAlgoWinograd:ConvBinWinogradRxSf3x2,1,65172,0,miopenConvolutionBwdDataAlgoWinograd;miopenConvolutionBwdDataAlgoImplicitGEMM:ConvHipImplicitGemmBwdDataV1R1,2,24136,0,miopenConvolutionBwdDataAlgoImplicitGEMM;miopenConvolutionBwdDataAlgoGEMM:gemm,6,73886,1553664,MIOpenGEMM
224-17-17-1x7-224-17-17-64-0x3-1x1-1x1-0-NCHW-FP32-W=miopenConvolutionBwdWeightsAlgoWinograd:ConvBinWinogradRxSf2x3,2,7376,0,miopenConvolutionBwdWeightsAlgoWinograd;miopenConvolutionBwdWeightsAlgoDirect:ConvOclBwdWrW53,7,616,0,miopenConvolutionBwdWeightsAlgoDirect;miopenConvolutionBwdWeightsAlgoGEMM:gemm,8,4355,1812608,MIOpenGEMM
64-73-73-1x1-160-73-73-64-0x0-1x1-1x1-0-NCHW-FP32-B=miopenConvolutionBwdDataAlgoDirect:ConvAsm1x1U,1,321,0,miopenConvolutionBwdDataAlgoDirect;miopenConvolutionBwdDataAlgoGEMM:gemm,3,4923,0,MIOpenGEMM
64-73-73-1x1-80-73-73-128-0x0-1x1-1x1-0-NCHW-FP32-F=miopenConvolutionFwdAlgoDirect:ConvOclDirectFwd1x1,1,77586,0,miopenConvolutionFwdAlgoDirect
256-17-17-1x1-1024-17-17-64-0x0-1x1-1x1-0-NCHW-FP32-W=miopenConvolutionBwdWeightsAlgoDirect:ConvAsmBwdWrW1x1,2,41449,0,miopenConvolutionBwdWeightsAlgoDirect
192-17-17-7x1-224-17-17-64-3x0-1x1-1x1-0-NCHW-FP32-F=miopenConvolutionFwdAlgoImplicitGEMM:ConvHipImplicitGemmV4R1Fwd,2,27051,0,miopenConvolutionFwdAlgoImplicitGEMM;miopenConvolutionFwdAlgoWinograd:ConvBinWinogradRxSf3x2,2,37461,0,miopenConvolutionFwdAlgoWinograd;miopenConvolutionFwdAlgoGEMM:GemmFwdRest,8,91154,1553664,MIOpenGEMM
224-17-17-1x7-224-17-17-64-0x3-1x1-1x1-0-NCHW-FP32-B=miopenConvolutionBwdDataAlgoWinograd:ConvBinWinogradRxSf3x2,2,55143,0,miopenConvolutionBwdDataAlgoWinograd;miopenConvolutionBwdDataAlgoImplicitGEMM:ConvHipImplicitGemmBwdDataV1R1,5,96756,0,miopenConvolutionBwdDataAlgoImplicitGEMM;miopenConvolutionBwdDataAlgoGEMM:gemm,16,3545,1812608,MIOpenGEMM
224-17-17-1x7-192-17-17-64-0x3-1x1-1x1-0-NCHW-FP32-W=miopenConvolutionBwdWeightsAlgoWinograd:ConvBinWinogradRxSf2x3,2,91852,0,miopenConvolutionBwdWeightsAlgoWinograd;miopenConvolutionBwdWeightsAlgoImplicitGEMM:ConvHipImplicitGemmV4R1WrW,7,69,0,miopenConvolutionBwdWeightsAlgoImplicitGEMM;miopenConvolutionBwdWeightsAlgoDirect:ConvOclBwdWrW53,7,3262,0,miopenConvolutionBwdWeightsAlgoDirect;miopenConvolutionBwdWeightsAlgoGEMM:gemm,18,819,1553664,MIOpenGEMM
96-35-35-1x1-384-35-35-64-0x0-1x1-1x1-0-NCHW-FP32-W=miopenConvolutionBwdWeightsAlgoDirect:ConvAsmBwdWrW1x1,2,28383,0,miopenConvolutionBwdWeightsAlgoDirect
192-17-17-1x1-768-17-17-128-0x0-1x1-1x1-0-NCHW-FP32-W=miopenConvolutionBwdWeightsAlgoDirect:ConvAsmBwdWrW1x1,2,32944,0,miopenConvolutionBwdWeightsAlgoDirect
160-73-73-1x1-64-73-73-64-0x0-1x1-1x1-0-NCHW-FP32-F=miopenConvolutionFwdAlgoDirect:ConvOclDirectFwd1x1,1,41395,0,miopenConvolutionFwdAlgoDirect;miopenConvolutionFwdAlgoWinograd:ConvBinWinogradRxSf3x2,2,21517,0,miopenConvolutionFwdAlgoWinograd;miopenConvolutionFwdAlgoGEMM:GemmFwd1x1_0_1,2,80321,0,MIOpenGEMM
320-17-17-7x1-256-17-17-64-3x0-1x1-1x1-0-NCHW-FP32-W=miopenConvolutionBwdWeightsAlgoDirect:ConvOclBwdWrW53,8,72108,0,miopenConvolutionBwdWeightsAlgoDirect;miopenConvolutionBwdWeightsAlgoImplicitGEMM:ConvHipImplicitGemmV4R1WrW,9,97871,0,miopenConvolutionBwdWeightsAlgoImplicitGEMM;miopenConvolutionBwdWeightsAlgoWinograd:ConvBinWinogradRxSf2x3,13,4366,0,miopenConvolutionBwdWeightsAlgoWinograd;miopenConvolutionBwdWeightsAlgoGEMM:gemm,64,488,2071552,MIOpenGEMM
128-17-17-1x1-1024-17-17-64-0x0-1x1-1x1-0-NCHW-FP32-B=miopenConvolutionBwdDataAlgoDirect:ConvAsm1x1U,1,3457,0,miopenConvolutionBwdDataAlgoDirect;miopenConvolutionBwdDataAlgoGEMM:gemm,93,7372,0,MIOpenGEMM
32-147-147-3x3-64-147-147-128-1x1-1x1-1x1-0-NCHW-FP32-F=miopenConvolutionFwdAlgoWinograd:ConvBinWinogradRxS,7,8403,0,miopenConvolutionFwdAlgoWinograd
224-17-17-1x7-192-17-17-64-0x3-1x1-1x1-0-NCHW-FP32-B=miopenConvolutionBwdDataAlgoWinograd:ConvBinWinogradRxSf3x2,1,62921,0,miopenConvolutionBwdDataAlgoWinograd;miopenConvolutionBwdDataAlgoImplicitGEMM:ConvHipImplicitGemmBwdDataV1R1,4,14014,0,miopenConvolutionBwdDataAlgoImplicitGEMM;miopenConvolutionBwdDataAlgoGEMM:gemm,19,9002,1553664,MIOpenGEMM
224-17-17-1x7-224-17-17-64-0x3-1x1-1x1-0-NCHW-FP32-F=miopenConvolutionFwdAlgoWinograd:ConvBinWinogradRxSf3x2,1,91557,0,miopenConvolutionFwdAlgoWinograd;miopenConvolutionFwdAlgoImplicitGEMM:ConvHipImplicitGemmV4R1Fwd,2,53792,0,miopenConvolutionFwdAlgoImplicitGEMM;miopenConvolutionFwdAlgoGEMM:GemmFwdRest,14,737,1812608,MIOpenGEMM
448-8-8-3x1-512-8-8-64-1x0-1x1-1x1-0-NCHW-FP32-F=miopenConvolutionFwdAlgoWinograd:ConvBinWinogradRxSf2x3,1,267,0,miopenConvolutionFwdAlgoWinograd;miopenConvolutionFwdAlgoImplicitGEMM:ConvHipImplicitGemmV4R1Fwd,2,93778,0,miopenConvolutionFwdAlgoImplicitGEMM;miopenConvolutionFwdAlgoGEMM:GemmFwdRest,60,524,344064,MIOpenGEMM
96-35-35-1x1-384-35-35-64-0x0-1x1-1x1-0-NCHW-FP32-B=miopenConvolutionBwdDataAlgoDirect:ConvAsm1x1U,1,21134,0,miopenConvolutionBwdDataAlgoDirect
320-17-17-7x1-256-17-17-64-3x0-1x1-1x1-0-NCHW-FP32-B=miopenConvolutionBwdDataAlgoWinograd:ConvBinWinogradRxSf3x2,4,4118,0,miopenConvolutionBwdDataAlgoWinograd;miopenConvolutionBwdDataAlgoImplicitGEMM:ConvHipImplicitGemmBwdDataV1R1,5,83705,0,miopenConvolutionBwdDataAlgoImplicitGEMM;miopenConvolutionBwdDataAlgoGEMM:gemm,22,102,2071552,MIOpenGEMM
448-8-8-1x3-384-8-8-64-0x1-1x1-1x1-0-NCHW-FP32-W=miopenConvolutionBwdWeightsAlgoDirect:ConvOclBwdWrW53,1,22968,0,miopenConvolutionBwdWeightsAlgoDirect;miopenConvolutionBwdWeightsAlgoWinograd:ConvBinWinogradRxS,1,53056,0,miopenConvolutionBwdWeightsAlgoWinograd;miopenConvolutionBwdWeightsAlgoImplicitGEMM:ConvHipImplicitGemmV4R1WrW,2,9336,0,miopenConvolutionBwdWeightsAlgoImplicitGEMM;miopenConvolutionBwdWeightsAlgoGEMM:gemm,8,18311,294912,MIOpenGEMM
96-73-73-3x3-64-147-147-64-0x0-2x2-1x1-0-NCHW-FP32-W=miopenConvolutionBwdWeightsAlgoGEMM:gemm,15,8354,12278016,MIOpenGEMM;miopenConvolutionBwdWeightsAlgoDirect:ConvOclBwdWrW2NonTunable,32,7675,14155776,miopenConvolutionBwdWeightsAlgoDirect;miopenConvolutionBwdWeightsAlgoImplicitGEMM:ConvHipImplicitGemmV4R1WrW,62,4128,0,miopenConvolutionBwdWeightsAlgoImplicitGEMM
192-17-17-1x7-224-17-17-64-0x3-1x1-1x1-0-NCHW-FP32-F=miopenConvolutionFwdAlgoImplicitGEMM:ConvHipImplicitGemmV4R1Fwd,2,32946,0,miopenConvolutionFwdAlgoImplicitGEMM;miopenConvolutionFwdAlgoWinograd:ConvBinWinogradRxSf3x2,2,34688,0,miopenConvolutionFwdAlgoWinograd;miopenConvolutionFwdAlgoGEMM:GemmFwdRest,18,3567,1553664,MIOpenGEMM
80-73-73-1x1-64-73-73-128-0x0-1x1-1x1-0-NCHW-FP32-W=miopenConvolutionBwdWeightsAlgoDirect:ConvAsmBwdWrW1x1,4,70056,0,miopenConvolutionBwdWeightsAlgoDirect
192-35-35-3x3-192-71-71-64-0x0-2x2-1x1-0-NCHW-FP32-W=miopenConvolutionBwdWeightsAlgoImplicitGEMM:ConvHipImplicitGemmV4R1WrW,21,9464,0,miopenConvolutionBwdWeightsAlgoImplicitGEMM;miopenConvolutionBwdWeightsAlgoGEMM:gemm,26,733,8467200,MIOpenGEMM;miopenConvolutionBwdWeightsAlgoDirect:ConvOclBwdWrW2NonTunable,47,8517,84934656,miopenConvolutionBwdWeightsAlgoDirect
384-8-8-1x1-1536-8-8-64-0x0-1x1-1x1-0-NCHW-FP32-W=miopenConvolutionBwdWeightsAlgoDirect:ConvAsmBwdWrW1x1,1,16223,0,miopenConvolutionBwdWeightsAlgoDirect;miopenConvolutionBwdWeightsAlgoGEMM:gemm,2,66409,0,MIOpenGEMM;miopenConvolutionBwdWeightsAlgoWinograd:ConvBinWinogradRxSf2x3,3,5617,0,miopenConvolutionBwdWeightsAlgoWinograd
128-17-17-1x1-768-17-17-128-0x0-1x1-1x1-0-NCHW-FP32-B=miopenConvolutionBwdDataAlgoDirect:ConvAsm1x1U,1,21113,0,miopenConvolutionBwdDataAlgoDirect;miopenConvolutionBwdDataAlgoWinograd:ConvBinWinogradRxSf3x2,2,95095,0,miopenConvolutionBwdDataAlgoWinograd;miopenConvolutionBwdDataAlgoGEMM:gemm,67,2602,0,MIOpenGEMM
256-17-17-1x1-1024-17-17-64-0x0-1x1-1x1-0-NCHW-FP32-B=miopenConvolutionBwdDataAlgoDirect:ConvAsm1x1U,1,4289,0,miopenConvolutionBwdDataAlgoDirect;miopenConvolutionBwdDataAlgoGEMM:gemm,6,41338,0,MIOpenGEMM
384-35-35-1x1-192-35-35-64-0x0-1x1-1x1-0-NCHW-FP32-F=miopenConvolutionFwdAlgoDirect:ConvAsm1x1U,1,70795,0,miopenConvolutionFwdAlgoDirect;miopenConvolutionFwdAlgoWinograd:ConvBinWinogradRxSf3x2,3,568,0,miopenConvolutionFwdAlgoWinograd;miopenConvolutionFwdAlgoGEMM:GemmFwd1x1_0_1,4,98296,0,MIOpenGEMM
448-8-8-1x3-384-8-8-64-0x1-1x1-1x1-0-NCHW-FP32-B=miopenConvolutionBwdDataAlgoWinograd:ConvBinWinogradRxSf2x3,0,719313,0,miopenConvolutionBwdDataAlgoWinograd;miopenConvolutionBwdDataAlgoImplicitGEMM:ConvHipImplicitGemmBwdDataV1R1,4,86447,0,miopenConvolutionBwdDataAlgoImplicitGEMM;miopenConvolutionBwdDataAlgoGEMM:gemm,9,56523,294912,MIOpenGEMM
256-17-17-7x1-320-17-17-64-3x0-1x1-1x1-0-NCHW-FP32-F=miopenConvolutionFwdAlgoWinograd:ConvBinWinogradRxSf3x2,3,40603,0,miopenConvolutionFwdAlgoWinograd;miopenConvolutionFwdAlgoImplicitGEMM:ConvHipImplicitGemmV4R1Fwd,3,41803,0,miopenConvolutionFwdAlgoImplicitGEMM;miopenConvolutionFwdAlgoGEMM:GemmFwdRest,48,5312,2071552,MIOpenGEMM
96-35-35-3x3-96-35-35-64-1x1-1x1-1x1-0-NCHW-FP32-B=miopenConvolutionBwdDataAlgoWinograd:ConvBinWinograd3x3U,0,720851,0,miopenConvolutionBwdDataAlgoWinograd
1024-17-17-1x1-128-17-17-64-0x0-1x1-1x1-0-NCHW-FP32-F=miopenConvolutionFwdAlgoDirect:ConvAsm1x1U,1,463,0,miopenConvolutionFwdAlgoDirect;miopenConvolutionFwdAlgoWinograd:ConvBinWinogradRxSf3x2,1,95844,0,miopenConvolutionFwdAlgoWinograd;miopenConvolutionFwdAlgoGEMM:GemmFwd1x1_0_1,4,11761,0,MIOpenGEMM
96-73-73-3x3-64-147-147-64-0x0-2x2-1x1-0-NCHW-FP32-B=miopenConvolutionBwdDataAlgoWinograd:ConvBinWinogradRxS,11,2715,0,miopenConvolutionBwdDataAlgoWinograd;miopenConvolutionBwdDataAlgoImplicitGEMM:ConvHipImplicitGemmBwdDataV1R1,26,6841,0,miopenConvolutionBwdDataAlgoImplicitGEMM;miopenConvolutionBwdDataAlgoDirect:ConvOclDirectFwd,27,9117,0,miopenConvolutionBwdDataAlgoDirect;miopenConvolutionBwdDataAlgoGEMM:gemm,36,8167,12278016,MIOpenGEMM
384-35-35-1x1-96-35-35-64-0x0-1x1-1x1-0-NCHW-FP32-F=miopenConvolutionFwdAlgoDirect:ConvAsm1x1U,1,8311,0,miopenConvolutionFwdAlgoDirect;miopenConvolutionFwdAlgoGEMM:GemmFwd1x1_0_1,4,95649,0,MIOpenGEMM
64-73-73-3x3-96-71-71-64-0x0-1x1-1x1-0-NCHW-FP32-F=miopenConvolutionFwdAlgoWinograd:ConvBinWinogradRxSf2x3,2,2995,0,miopenConvolutionFwdAlgoWinograd;miopenConvolutionFwdAlgoDirect:ConvOclDirectFwd,15,5523,0,miopenConvolutionFwdAlgoDirect;miopenConvolutionFwdAlgoGEMM:GemmFwdRest,17,5278,11614464,MIOpenGEMM
256-17-17-1x7-256-17-17-64-0x3-1x1-1x1-0-NCHW-FP32-W=miopenConvolutionBwdWeightsAlgoImplicitGEMM:ConvHipImplicitGemmV4R1WrW,4,66681,0,miopenConvolutionBwdWeightsAlgoImplicitGEMM;miopenConvolutionBwdWeightsAlgoWinograd:ConvBinWinogradRxSf2x3,5,75734,0,miopenConvolutionBwdWeightsAlgoWinograd;miopenConvolutionBwdWeightsAlgoDirect:ConvOclBwdWrW53,9,4454,0,miopenConvolutionBwdWeightsAlgoDirect;miopenConvolutionBwdWeightsAlgoGEMM:gemm,35,9349,2071552,MIOpenGEMM
320-8-8-3x3-320-17-17-64-0x0-2x2-1x1-0-NCHW-FP32-W=miopenConvolutionBwdWeightsAlgoImplicitGEMM:ConvHipImplicitGemmV4R1WrW,1,93881,0,miopenConvolutionBwdWeightsAlgoImplicitGEMM;miopenConvolutionBwdWeightsAlgoGEMM:gemm,17,7327,737280,MIOpenGEMM;miopenConvolutionBwdWeightsAlgoDirect:ConvOclBwdWrW2NonTunable,33,4398,235929600,miopenConvolutionBwdWeightsAlgoDirect
192-35-35-3x3-192-71-71-64-0x0-2x2-1x1-0-NCHW-FP32-B=miopenConvolutionBwdDataAlgoWinograd:ConvBinWinogradRxS,16,8221,0,miopenConvolutionBwdDataAlgoWinograd;miopenConvolutionBwdDataAlgoImplicitGEMM:ConvHipImplicitGemmBwdDataV1R1,19,9282,0,miopenConvolutionBwdDataAlgoImplicitGEMM;miopenConvolutionBwdDataAlgoGEMM:gemm,33,7576,8467200,MIOpenGEMM;miopenConvolutionBwdDataAlgoDirect:ConvOclDirectFwd,43,8079,0,miopenConvolutionBwdDataAlgoDirect
384-8-8-3x1-384-8-8-128-1x0-1x1-1x1-0-NCHW-FP32-W=miopenConvolutionBwdWeightsAlgoDirect:ConvOclBwdWrW53,1,45737,0,miopenConvolutionBwdWeightsAlgoDirect;miopenConvolutionBwdWeightsAlgoImplicitGEMM:ConvHipImplicitGemmV4R1WrW,1,82974,0,miopenConvolutionBwdWeightsAlgoImplicitGEMM;miopenConvolutionBwdWeightsAlgoWinograd:ConvBinWinogradRxS,1,94993,0,miopenConvolutionBwdWeightsAlgoWinograd;miopenConvolutionBwdWeightsAlgoGEMM:gemm,9,7733,294912,MIOpenGEMM
384-8-8-1x3-448-8-8-64-0x1-1x1-1x1-0-NCHW-FP32-F=miopenConvolutionFwdAlgoWinograd:ConvBinWinogradRxS,0,619082,0,miopenConvolutionFwdAlgoWinograd;miopenConvolutionFwdAlgoImplicitGEMM:ConvHipImplicitGemmV4R1Fwd,0,939703,0,miopenConvolutionFwdAlgoImplicitGEMM;miopenConvolutionFwdAlgoGEMM:GemmFwdRest,12,103,294912,MIOpenGEMM
256-8-8-3x1-512-8-8-64-1x0-1x1-1x1-0-NCHW-FP32-B=miopenConvolutionBwdDataAlgoWinograd:ConvBinWinogradRxS,0,543097,0,miopenConvolutionBwdDataAlgoWinograd;miopenConvolutionBwdDataAlgoImplicitGEMM:ConvHipImplicitGemmBwdDataV1R1,2,76203,0,miopenConvolutionBwdDataAlgoImplicitGEMM;miopenConvolutionBwdDataAlgoGEMM:gemm,8,94537,393216,MIOpenGEMM
384-17-17-3x3-288-35-35-128-0x0-2x2-1x1-0-NCHW-FP32-B=miopenConvolutionBwdDataAlgoWinograd:ConvBinWinogradRxS,18,7509,0,miopenConvolutionBwdDataAlgoWinograd;miopenConvolutionBwdDataAlgoImplicitGEMM:ConvHipImplicitGemmBwdDataV1R1,24,9444,0,miopenConvolutionBwdDataAlgoImplicitGEMM;miopenConvolutionBwdDataAlgoDirect:ConvOclDirectFwd,68,3162,0,miopenConvolutionBwdDataAlgoDirect;miopenConvolutionBwdDataAlgoGEMM:gemm,73,1054,2996352,MIOpenGEMM
96-35-35-3x3-64-35-35-64-1x1-1x1-1x1-0-NCHW-FP32-B=miopenConvolutionBwdDataAlgoWinograd:ConvBinWinograd3x3U,0,551118,0,miopenConvolutionBwdDataAlgoWinograd
320-8-8-3x3-320-17-17-64-0x0-2x2-1x1-0-NCHW-FP32-B=miopenConvolutionBwdDataAlgoImplicitGEMM:ConvHipImplicitGemmBwdDataV1R1,2,44556,0,miopenConvolutionBwdDataAlgoImplicitGEMM;miopenConvolutionBwdDataAlgoWinograd:ConvBinWinogradRxSf2x3,3,72686,0,miopenConvolutionBwdDataAlgoWinograd;miopenConvolutionBwdDataAlgoGEMM:gemm,9,50567,737280,MIOpenGEMM;miopenConvolutionBwdDataAlgoDirect:ConvOclDirectFwd,13,8458,0,miopenConvolutionBwdDataAlgoDirect
768-17-17-1x1-128-17-17-128-0x0-1x1-1x1-0-NCHW-FP32-F=miopenConvolutionFwdAlgoDirect:ConvAsm1x1U,1,46385,0,miopenConvolutionFwdAlgoDirect;miopenConvolutionFwdAlgoWinograd:ConvBinWinogradRxSf3x2,2,29111,0,miopenConvolutionFwdAlgoWinograd;miopenConvolutionFwdAlgoGEMM:GemmFwd1x1_0_1,7,12544,0,MIOpenGEMM
256-17-17-1x7-256-17-17-64-0x3-1x1-1x1-0-NCHW-FP32-B=miopenConvolutionBwdDataAlgoWinograd:ConvBinWinogradRxSf3x2,3,48681,0,miopenConvolutionBwdDataAlgoWinograd;miopenConvolutionBwdDataAlgoImplicitGEMM:ConvHipImplicitGemmBwdDataV1R1,4,81647,0,miopenConvolutionBwdDataAlgoImplicitGEMM;miopenConvolutionBwdDataAlgoGEMM:gemm,11,7203,2071552,MIOpenGEMM
64-147-147-3x3-96-73-73-64-0x0-2x2-1x1-0-NCHW-FP32-F=miopenConvolutionFwdAlgoWinograd:ConvBinWinogradRxSf2x3,8,3949,0,miopenConvolutionFwdAlgoWinograd;miopenConvolutionFwdAlgoGEMM:GemmFwdRest,12,6241,12278016,MIOpenGEMM;miopenConvolutionFwdAlgoDirect:ConvOclDirectFwd,28,7828,0,miopenConvolutionFwdAlgoDirect
192-71-71-3x3-80-73-73-128-0x0-1x1-1x1-0-NCHW-FP32-B=miopenConvolutionBwdDataAlgoWinograd:ConvBinWinogradRxS,12,3032,0,miopenConvolutionBwdDataAlgoWinograd;miopenConvolutionBwdDataAlgoDirect:ConvOclDirectFwd,69,7496,0,miopenConvolutionBwdDataAlgoDirect;miopenConvolutionBwdDataAlgoGEMM:gemm,77,8874,14518080,MIOpenGEMM
64-35-35-1x1-384-35-35-64-0x0-1x1-1x1-0-NCHW-FP32-W=miopenConvolutionBwdWeightsAlgoDirect:ConvAsmBwdWrW1x1,0,953708,0,miopenConvolutionBwdWeightsAlgoDirect
256-8-8-3x1-384-8-8-64-1x0-1x1-1x1-0-NCHW-FP32-W=miopenConvolutionBwdWeightsAlgoDirect:ConvOclBwdWrW53,0,484594,0,miopenConvolutionBwdWeightsAlgoDirect;miopenConvolutionBwdWeightsAlgoWinograd:ConvBinWinogradRxSf2x3,0,732817,0,miopenConvolutionBwdWeightsAlgoWinograd;miopenConvolutionBwdWeightsAlgoImplicitGEMM:ConvHipImplicitGemmV4R1WrW,1,71157,0,miopenConvolutionBwdWeightsAlgoImplicitGEMM;miopenConvolutionBwdWeightsAlgoGEMM:gemm,3,45739,294912,MIOpenGEMM
256-8-8-3x1-512-8-8-64-1x0-1x1-1x1-0-NCHW-FP32-W=miopenConvolutionBwdWeightsAlgoDirect:ConvOclBwdWrW53,0,797282,0,miopenConvolutionBwdWeightsAlgoDirect;miopenConvolutionBwdWeightsAlgoWinograd:ConvBinWinogradRxS,0,898538,0,miopenConvolutionBwdWeightsAlgoWinograd;miopenConvolutionBwdWeightsAlgoImplicitGEMM:ConvHipImplicitGemmV4R1WrW,1,13413,0,miopenConvolutionBwdWeightsAlgoImplicitGEMM;miopenConvolutionBwdWeightsAlgoGEMM:gemm,2,76451,393216,MIOpenGEMM
256-8-8-3x1-384-8-8-64-1x0-1x1-1x1-0-NCHW-FP32-B=miopenConvolutionBwdDataAlgoWinograd:ConvBinWinogradRxS,0,469484,0,miopenConvolutionBwdDataAlgoWinograd;miopenConvolutionBwdDataAlgoImplicitGEMM:ConvHipImplicitGemmBwdDataV1R1,0,540106,0,miopenConvolutionBwdDataAlgoImplicitGEMM;miopenConvolutionBwdDataAlgoGEMM:gemm,4,60755,294912,MIOpenGEMM
64-35-35-1x1-384-35-35-64-0x0-1x1-1x1-0-NCHW-FP32-B=miopenConvolutionBwdDataAlgoDirect:ConvAsm1x1U,0,577075,0,miopenConvolutionBwdDataAlgoDirect;miopenConvolutionBwdDataAlgoWinograd:ConvBinWinogradRxSf3x2,1,53119,0,miopenConvolutionBwdDataAlgoWinograd;miopenConvolutionBwdDataAlgoGEMM:gemm,6,12204,0,MIOpenGEMM
384-8-8-3x1-256-8-8-64-1x0-1x1-1x1-0-NCHW-FP32-F=miopenConvolutionFwdAlgoWinograd:ConvBinWinogradRxSf2x3,0,421327,0,miopenConvolutionFwdAlgoWinograd;miopenConvolutionFwdAlgoImplicitGEMM:ConvHipImplicitGemmV4R1Fwd,2,38672,0,miopenConvolutionFwdAlgoImplicitGEMM;miopenConvolutionFwdAlgoGEMM:GemmFwdRest,31,8821,294912,MIOpenGEMM
256-8-8-1x3-384-8-8-64-0x1-1x1-1x1-0-NCHW-FP32-W=miopenConvolutionBwdWeightsAlgoWinograd:ConvBinWinogradRxSf2x3,0,578502,0,miopenConvolutionBwdWeightsAlgoWinograd;miopenConvolutionBwdWeightsAlgoDirect:ConvOclBwdWrW53,0,609975,0,miopenConvolutionBwdWeightsAlgoDirect;miopenConvolutionBwdWeightsAlgoImplicitGEMM:ConvHipImplicitGemmV4R1WrW,1,1422,0,miopenConvolutionBwdWeightsAlgoImplicitGEMM;miopenConvolutionBwdWeightsAlgoGEMM:gemm,3,4728,294912,MIOpenGEMM
512-8-8-3x1-256-8-8-64-1x0-1x1-1x1-0-NCHW-FP32-F=miopenConvolutionFwdAlgoWinograd:ConvBinWinogradRxS,0,739427,0,miopenConvolutionFwdAlgoWinograd;miopenConvolutionFwdAlgoImplicitGEMM:ConvHipImplicitGemmV4R1Fwd,1,43602,0,miopenConvolutionFwdAlgoImplicitGEMM;miopenConvolutionFwdAlgoGEMM:GemmFwdRest,11,6078,393216,MIOpenGEMM
256-8-8-1x3-384-8-8-64-0x1-1x1-1x1-0-NCHW-FP32-B=miopenConvolutionBwdDataAlgoWinograd:ConvBinWinogradRxS,0,544072,0,miopenConvolutionBwdDataAlgoWinograd;miopenConvolutionBwdDataAlgoImplicitGEMM:ConvHipImplicitGemmBwdDataV1R1,1,50528,0,miopenConvolutionBwdDataAlgoImplicitGEMM;miopenConvolutionBwdDataAlgoGEMM:gemm,11,8336,294912,MIOpenGEMM
256-8-8-1x3-512-8-8-64-0x1-1x1-1x1-0-NCHW-FP32-B=miopenConvolutionBwdDataAlgoWinograd:ConvBinWinogradRxS,0,584607,0,miopenConvolutionBwdDataAlgoWinograd;miopenConvolutionBwdDataAlgoImplicitGEMM:ConvHipImplicitGemmBwdDataV1R1,0,826137,0,miopenConvolutionBwdDataAlgoImplicitGEMM;miopenConvolutionBwdDataAlgoGEMM:gemm,5,28114,393216,MIOpenGEMM
96-35-35-3x3-96-35-35-64-1x1-1x1-1x1-0-NCHW-FP32-F=miopenConvolutionFwdAlgoWinograd:ConvBinWinogradRxSf2x3,0,748818,0,miopenConvolutionFwdAlgoWinograd
384-35-35-1x1-64-35-35-64-0x0-1x1-1x1-0-NCHW-FP32-F=miopenConvolutionFwdAlgoDirect:ConvAsm1x1U,0,777528,0,miopenConvolutionFwdAlgoDirect;miopenConvolutionFwdAlgoWinograd:ConvBinWinogradRxSf3x2,1,39133,0,miopenConvolutionFwdAlgoWinograd;miopenConvolutionFwdAlgoGEMM:GemmFwd1x1_0_1,3,52319,0,MIOpenGEMM
384-8-8-1x3-256-8-8-64-0x1-1x1-1x1-0-NCHW-FP32-F=miopenConvolutionFwdAlgoWinograd:ConvBinWinogradRxSf2x3,0,502527,0,miopenConvolutionFwdAlgoWinograd;miopenConvolutionFwdAlgoImplicitGEMM:ConvHipImplicitGemmV4R1Fwd,1,71349,0,miopenConvolutionFwdAlgoImplicitGEMM;miopenConvolutionFwdAlgoGEMM:GemmFwdRest,61,9582,294912,MIOpenGEMM
32-147-147-3x3-64-147-147-64-1x1-1x1-1x1-0-NCHW-FP32-F=miopenConvolutionFwdAlgoWinograd:ConvBinWinograd3x3U,3,3485,0,miopenConvolutionFwdAlgoWinograd
512-8-8-1x3-256-8-8-64-0x1-1x1-1x1-0-NCHW-FP32-F=miopenConvolutionFwdAlgoWinograd:ConvBinWinogradRxSf2x3,0,573116,0,miopenConvolutionFwdAlgoWinograd;miopenConvolutionFwdAlgoImplicitGEMM:ConvHipImplicitGemmV4R1Fwd,4,15926,0,miopenConvolutionFwdAlgoImplicitGEMM;miopenConvolutionFwdAlgoGEMM:GemmFwdRest,42,1474,393216,MIOpenGEMM
80-73-73-1x1-64-73-73-128-0x0-1x1-1x1-0-NCHW-FP32-B=miopenConvolutionBwdDataAlgoDirect:ConvAsm1x1U,1,32078,0,miopenConvolutionBwdDataAlgoDirect;miopenConvolutionBwdDataAlgoWinograd:ConvBinWinogradRxSf3x2,2,76069,0,miopenConvolutionBwdDataAlgoWinograd;miopenConvolutionBwdDataAlgoGEMM:gemm,5,70807,0,MIOpenGEMM
384-17-17-3x3-384-35-35-64-0x0-2x2-1x1-0-NCHW-FP32-W=miopenConvolutionBwdWeightsAlgoImplicitGEMM:ConvHipImplicitGemmV4R1WrW,11,5849,0,miopenConvolutionBwdWeightsAlgoImplicitGEMM;miopenConvolutionBwdWeightsAlgoGEMM:gemm,17,9629,3995136,MIOpenGEMM;miopenConvolutionBwdWeightsAlgoDirect:ConvOclBwdWrW2NonTunable,72,9359,339738624,miopenConvolutionBwdWeightsAlgoDirect
256-17-17-1x7-256-17-17-64-0x3-1x1-1x1-0-NCHW-FP32-F=miopenConvolutionFwdAlgoImplicitGEMM:ConvHipImplicitGemmV4R1Fwd,2,1726,0,miopenConvolutionFwdAlgoImplicitGEMM;miopenConvolutionFwdAlgoWinograd:ConvBinWinogradRxSf3x2,2,2138,0,miopenConvolutionFwdAlgoWinograd;miopenConvolutionFwdAlgoGEMM:GemmFwdRest,9,15818,2071552,MIOpenGEMM
64-147-147-3x3-32-147-147-64-1x1-1x1-1x1-0-NCHW-FP32-B=miopenConvolutionBwdDataAlgoWinograd:ConvBinWinogradRxS,3,50231,0,miopenConvolutionBwdDataAlgoWinograd
384-35-35-3x3-384-17-17-64-0x0-2x2-1x1-0-NCHW-FP32-F=miopenConvolutionFwdAlgoWinograd:ConvBinWinogradRxSf2x3,11,6161,0,miopenConvolutionFwdAlgoWinograd;miopenConvolutionFwdAlgoDirect:ConvOclDirectFwd,60,669,0,miopenConvolutionFwdAlgoDirect;miopenConvolutionFwdAlgoGEMM:GemmFwdRest,71,3272,3995136,MIOpenGEMM
32-149-149-3x3-32-147-147-64-0x0-1x1-1x1-0-NCHW-FP32-F=miopenConvolutionFwdAlgoWinograd:ConvBinWinogradRxS,1,83984,0,miopenConvolutionFwdAlgoWinograd;miopenConvolutionFwdAlgoDirect:ConvOclDirectFwd,9,6969,0,miopenConvolutionFwdAlgoDirect;miopenConvolutionFwdAlgoGEMM:GemmFwdRest,41,5698,24893568,MIOpenGEMM
512-8-8-3x1-448-8-8-64-1x0-1x1-1x1-0-NCHW-FP32-W=miopenConvolutionBwdWeightsAlgoImplicitGEMM:ConvHipImplicitGemmV4R1WrW,1,31714,0,miopenConvolutionBwdWeightsAlgoImplicitGEMM;miopenConvolutionBwdWeightsAlgoWinograd:ConvBinWinogradRxS,1,36417,0,miopenConvolutionBwdWeightsAlgoWinograd;miopenConvolutionBwdWeightsAlgoDirect:ConvOclBwdWrW53,1,45598,0,miopenConvolutionBwdWeightsAlgoDirect;miopenConvolutionBwdWeightsAlgoGEMM:gemm,8,71996,344064,MIOpenGEMM
192-35-35-1x1-384-35-35-64-0x0-1x1-1x1-0-NCHW-FP32-W=miopenConvolutionBwdWeightsAlgoDirect:ConvAsmBwdWrW1x1,4,4703,0,miopenConvolutionBwdWeightsAlgoDirect
512-8-8-3x1-448-8-8-64-1x0-1x1-1x1-0-NCHW-FP32-B=miopenConvolutionBwdDataAlgoWinograd:ConvBinWinogradRxSf2x3,0,828616,0,miopenConvolutionBwdDataAlgoWinograd;miopenConvolutionBwdDataAlgoImplicitGEMM:ConvHipImplicitGemmBwdDataV1R1,1,46372,0,miopenConvolutionBwdDataAlgoImplicitGEMM;miopenConvolutionBwdDataAlgoGEMM:gemm,10,2096,344064,MIOpenGEMM
96-35-35-3x3-96-35-35-64-1x1-1x1-1x1-0-NCHW-FP32-W=miopenConvolutionBwdWeightsAlgoDirect:ConvAsmBwdWrW3x3,1,93352,0,miopenConvolutionBwdWeightsAlgoDirect;miopenConvolutionBwdWeightsAlgoWinograd:ConvBinWinogradRxSf2x3,2,757,0,miopenConvolutionBwdWeightsAlgoWinograd;miopenConvolutionBwdWeightsAlgoGEMM:gemm,7,88066,4233600,MIOpenGEMM
32-147-147-3x3-32-149-149-64-0x0-1x1-1x1-0-NCHW-FP32-B=miopenConvolutionBwdDataAlgoWinograd:ConvBinWinogradRxSf2x3,2,3067,0,miopenConvolutionBwdDataAlgoWinograd;miopenConvolutionBwdDataAlgoDirect:ConvOclDirectFwd,13,4752,0,miopenConvolutionBwdDataAlgoDirect;miopenConvolutionBwdDataAlgoImplicitGEMM:ConvHipImplicitGemmBwdDataV1R1,41,7692,0,miopenConvolutionBwdDataAlgoImplicitGEMM;miopenConvolutionBwdDataAlgoGEMM:gemm,44,5636,24893568,MIOpenGEMM
192-35-35-1x1-384-35-35-64-0x0-1x1-1x1-0-NCHW-FP32-B=miopenConvolutionBwdDataAlgoDirect:ConvAsm1x1U,1,64422,0,miopenConvolutionBwdDataAlgoDirect;miopenConvolutionBwdDataAlgoWinograd:ConvBinWinogradRxSf3x2,3,8055,0,miopenConvolutionBwdDataAlgoWinograd;miopenConvolutionBwdDataAlgoGEMM:gemm,4,54457,0,MIOpenGEMM
64-147-147-3x3-32-147-147-64-1x1-1x1-1x1-0-NCHW-FP32-W=miopenConvolutionBwdWeightsAlgoDirect:ConvAsmBwdWrW3x3,6,87408,0,miopenConvolutionBwdWeightsAlgoDirect;miopenConvolutionBwdWeightsAlgoWinograd:ConvBinWinogradRxSf2x3,48,2956,0,miopenConvolutionBwdWeightsAlgoWinograd;miopenConvolutionBwdWeightsAlgoGEMM:gemm,117,143,24893568,MIOpenGEMM
256-64-64-1x1-1024-64-64-2-0x0-1x1-1x1-0-NCHW-FP32-B=miopenConvolutionBwdDataAlgoGEMM:gemm,1,17445,0,MIOpenGEMM;miopenConvolutionBwdDataAlgoImplicitGEMM:ConvHipImplicitGemmBwdDataV1R1,1,222,0,miopenConvolutionBwdDataAlgoImplicitGEMM;miopenConvolutionBwdDataAlgoDirect:ConvOclDirectFwd1x1,1,40816,0,miopenConvolutionBwdDataAlgoDirect;miopenConvolutionBwdDataAlgoWinograd:ConvBinWinogradRxSf3x2,1,61188,0,miopenConvolutionBwdDataAlgoWinograd
64-35-35-3x3-96-35-35-64-1x1-1x1-1x1-0-NCHW-FP32-F=miopenConvolutionFwdAlgoWinograd:ConvBinWinogradRxSf2x3,0,520627,0,miopenConvolutionFwdAlgoWinograd
64-73-73-1x7-64-73-73-64-0x3-1x1-1x1-0-NCHW-FP32-F=miopenConvolutionFwdAlgoImplicitGEMM:ConvHipImplicitGemmV4R1Fwd,2,44167,0,miopenConvolutionFwdAlgoImplicitGEMM;miopenConvolutionFwdAlgoWinograd:ConvBinWinogradRxSf3x2,2,90182,0,miopenConvolutionFwdAlgoWinograd;miopenConvolutionFwdAlgoGEMM:GemmFwdRest,11,7764,9549568,MIOpenGEMM
1024-64-64-1x1-256-64-64-2-0x0-1x1-1x1-0-NCHW-FP32-F=miopenConvolutionFwdAlgoWinograd:ConvBinWinogradRxSf3x2,1,11215,0,miopenConvolutionFwdAlgoWinograd;miopenConvolutionFwdAlgoGEMM:GemmFwd1x1_0_1,1,65673,0,MIOpenGEMM;miopenConvolutionFwdAlgoDirect:ConvOclDirectFwd1x1,2,27971,0,miopenConvolutionFwdAlgoDirect;miopenConvolutionFwdAlgoImplicitGEMM:ConvHipImplicitGemmV4R4Fwd,2,46088,0,miopenConvolutionFwdAlgoImplicitGEMM
512-128-128-1x1-128-128-128-2-0x0-1x1-1x1-0-NCHW-FP32-W=miopenConvolutionBwdWeightsAlgoDirect:ConvAsmBwdWrW1x1,1,8662,0,miopenConvolutionBwdWeightsAlgoDirect
256-8-8-1x3-512-8-8-64-0x1-1x1-1x1-0-NCHW-FP32-W=miopenConvolutionBwdWeightsAlgoDirect:ConvOclBwdWrW53,0,58816,0,miopenConvolutionBwdWeightsAlgoDirect;miopenConvolutionBwdWeightsAlgoWinograd:ConvBinWinogradRxS,0,615383,0,miopenConvolutionBwdWeightsAlgoWinograd;miopenConvolutionBwdWeightsAlgoImplicitGEMM:ConvHipImplicitGemmV4R1WrW,0,643037,0,miopenConvolutionBwdWeightsAlgoImplicitGEMM;miopenConvolutionBwdWeightsAlgoGEMM:gemm,1,72629,393216,MIOpenGEMM
512-128-128-1x1-128-128-128-2-0x0-1x1-1x1-0-NCHW-FP32-B=miopenConvolutionBwdDataAlgoGEMM:gemm,1,18865,0,MIOpenGEMM;miopenConvolutionBwdDataAlgoWinograd:ConvBinWinogradRxSf3x2,1,31491,0,miopenConvolutionBwdDataAlgoWinograd;miopenConvolutionBwdDataAlgoDirect:ConvOclDirectFwd1x1,3,83448,0,miopenConvolutionBwdDataAlgoDirect;miopenConvolutionBwdDataAlgoImplicitGEMM:ConvHipImplicitGemmBwdDataV1R1,5,40087,0,miopenConvolutionBwdDataAlgoImplicitGEMM
256-17-17-3x3-224-35-35-64-0x0-2x2-1x1-0-NCHW-FP32-W=miopenConvolutionBwdWeightsAlgoGEMM:gemm,26,27,2330496,MIOpenGEMM;miopenConvolutionBwdWeightsAlgoDirect:ConvOclBwdWrW2NonTunable,34,1674,132120576,miopenConvolutionBwdWeightsAlgoDirect
32-147-147-3x3-32-149-149-64-0x0-1x1-1x1-0-NCHW-FP32-W=miopenConvolutionBwdWeightsAlgoDirect:ConvOclBwdWrW2NonTunable,18,2978,2359296,miopenConvolutionBwdWeightsAlgoDirect;miopenConvolutionBwdWeightsAlgoGEMM:gemm,52,5913,24893568,MIOpenGEMM;miopenConvolutionBwdWeightsAlgoWinograd:ConvBinWinogradRxSf2x3,65,5839,0,miopenConvolutionBwdWeightsAlgoWinograd
256-128-128-3x3-512-128-128-2-1x1-1x1-1x1-0-NCHW-FP32-F=miopenConvolutionFwdAlgoWinograd:ConvBinWinogradRxS,6,68787,0,miopenConvolutionFwdAlgoWinograd
64-73-73-7x1-64-73-73-64-3x0-1x1-1x1-0-NCHW-FP32-B=miopenConvolutionBwdDataAlgoWinograd:ConvBinWinogradRxSf3x2,4,9616,0,miopenConvolutionBwdDataAlgoWinograd;miopenConvolutionBwdDataAlgoImplicitGEMM:ConvHipImplicitGemmBwdDataV1R1,16,4201,0,miopenConvolutionBwdDataAlgoImplicitGEMM;miopenConvolutionBwdDataAlgoGEMM:gemm,29,2472,9549568,MIOpenGEMM
128-128-128-1x1-512-128-128-2-0x0-1x1-1x1-0-NCHW-FP32-F=miopenConvolutionFwdAlgoImplicitGEMM:ConvHipImplicitGemmV4R4Fwd,0,889157,0,miopenConvolutionFwdAlgoImplicitGEMM;miopenConvolutionFwdAlgoDirect:ConvOclDirectFwd1x1,1,23697,0,miopenConvolutionFwdAlgoDirect;miopenConvolutionFwdAlgoGEMM:GemmFwd1x1_0_1,1,37755,0,MIOpenGEMM;miopenConvolutionFwdAlgoWinograd:ConvBinWinogradRxSf3x2,1,66203,0,miopenConvolutionFwdAlgoWinograd
256-256-256-1x1-256-256-256-2-0x0-1x1-1x1-0-NCHW-FP32-B=miopenConvolutionBwdDataAlgoGEMM:gemm,4,98281,0,MIOpenGEMM;miopenConvolutionBwdDataAlgoWinograd:ConvBinWinogradRxSf3x2,8,31514,0,miopenConvolutionBwdDataAlgoWinograd;miopenConvolutionBwdDataAlgoDirect:ConvOclDirectFwd1x1,13,2891,0,miopenConvolutionBwdDataAlgoDirect;miopenConvolutionBwdDataAlgoImplicitGEMM:ConvHipImplicitGemmBwdDataV1R1,24,1813,0,miopenConvolutionBwdDataAlgoImplicitGEMM
64-73-73-7x1-64-73-73-64-3x0-1x1-1x1-0-NCHW-FP32-F=miopenConvolutionFwdAlgoImplicitGEMM:ConvHipImplicitGemmV4R1Fwd,3,66995,0,miopenConvolutionFwdAlgoImplicitGEMM;miopenConvolutionFwdAlgoWinograd:ConvBinWinogradRxSf3x2,4,8185,0,miopenConvolutionFwdAlgoWinograd;miopenConvolutionFwdAlgoGEMM:GemmFwdRest,17,762,9549568,MIOpenGEMM
256-64-64-1x1-1024-64-64-2-0x0-1x1-1x1-0-NCHW-FP32-F=miopenConvolutionFwdAlgoGEMM:GemmFwd1x1_0_1,0,833103,0,MIOpenGEMM;miopenConvolutionFwdAlgoImplicitGEMM:ConvHipImplicitGemmV4R4Fwd,1,7888,0,miopenConvolutionFwdAlgoImplicitGEMM;miopenConvolutionFwdAlgoWinograd:ConvBinWinogradRxSf3x2,1,56365,0,miopenConvolutionFwdAlgoWinograd;miopenConvolutionFwdAlgoDirect:ConvOclDirectFwd1x1,1,94538,0,miopenConvolutionFwdAlgoDirect
256-128-128-3x3-256-128-128-2-1x1-1x1-1x1-0-NCHW-FP32-W=miopenConvolutionBwdWeightsAlgoWinograd:ConvBinWinogradRxS,7,66371,0,miopenConvolutionBwdWeightsAlgoWinograd;miopenConvolutionBwdWeightsAlgoImplicitGEMM:ConvHipImplicitGemmV4R1WrW,9,81904,0,miopenConvolutionBwdWeightsAlgoImplicitGEMM;miopenConvolutionBwdWeightsAlgoDirect:ConvOclBwdWrW53,11,3743,0,miopenConvolutionBwdWeightsAlgoDirect;miopenConvolutionBwdWeightsAlgoGEMM:gemm,12,6195,150994944,MIOpenGEMM
128-128-128-3x3-128-128-128-2-1x1-1x1-1x1-0-NCHW-FP32-W=miopenConvolutionBwdWeightsAlgoDirect:ConvAsmBwdWrW3x3,1,18304,0,miopenConvolutionBwdWeightsAlgoDirect;miopenConvolutionBwdWeightsAlgoWinograd:ConvBinWinogradRxSf2x3,2,94985,0,miopenConvolutionBwdWeightsAlgoWinograd;miopenConvolutionBwdWeightsAlgoGEMM:gemm,3,97486,75497472,MIOpenGEMM;miopenConvolutionBwdWeightsAlgoImplicitGEMM:ConvHipImplicitGemmV4R1WrW,5,19124,0,miopenConvolutionBwdWeightsAlgoImplicitGEMM
256-128-128-3x3-256-128-128-2-1x1-1x1-1x1-0-NCHW-FP32-B=miopenConvolutionBwdDataAlgoWinograd:ConvBinWinograd3x3U,2,5031,0,miopenConvolutionBwdDataAlgoWinograd
320-17-17-3x3-320-8-8-64-0x0-2x2-1x1-0-NCHW-FP32-F=miopenConvolutionFwdAlgoWinograd:ConvBinWinogradRxS,1,96863,0,miopenConvolutionFwdAlgoWinograd;miopenConvolutionFwdAlgoDirect:ConvOclDirectFwd,5,84619,0,miopenConvolutionFwdAlgoDirect;miopenConvolutionFwdAlgoGEMM:GemmFwdRest,8,1009,737280,MIOpenGEMM
256-128-128-3x3-256-128-128-2-1x1-1x1-1x1-0-NCHW-FP32-F=miopenConvolutionFwdAlgoWinograd:ConvBinWinograd3x3U,1,91749,0,miopenConvolutionFwdAlgoWinograd
128-128-128-3x3-128-128-128-2-1x1-1x1-1x1-0-NCHW-FP32-B=miopenConvolutionBwdDataAlgoWinograd:ConvBinWinogradRxS,0,559797,0,miopenConvolutionBwdDataAlgoWinograd
64-512-512-7x7-3-1030-1030-2-0x0-2x2-1x1-0-NCHW-FP32-B=miopenConvolutionBwdDataAlgoDirect:ConvOclDirectFwd,9,81511,0,miopenConvolutionBwdDataAlgoDirect;miopenConvolutionBwdDataAlgoWinograd:ConvBinWinogradRxSf2x3,14,7324,0,miopenConvolutionBwdDataAlgoWinograd;miopenConvolutionBwdDataAlgoGEMM:gemm,18,1461,154140672,MIOpenGEMM
256-256-256-1x1-256-256-256-2-0x0-1x1-1x1-0-NCHW-FP32-F=miopenConvolutionFwdAlgoImplicitGEMM:ConvHipImplicitGemmV4R4Fwd,3,97346,0,miopenConvolutionFwdAlgoImplicitGEMM;miopenConvolutionFwdAlgoGEMM:GemmFwd1x1_0_1,4,83284,0,MIOpenGEMM;miopenConvolutionFwdAlgoDirect:ConvOclDirectFwd1x1,7,18316,0,miopenConvolutionFwdAlgoDirect;miopenConvolutionFwdAlgoWinograd:ConvBinWinogradRxSf3x2,7,85665,0,miopenConvolutionFwdAlgoWinograd
96-71-71-3x3-64-73-73-64-0x0-1x1-1x1-0-NCHW-FP32-B=miopenConvolutionBwdDataAlgoWinograd:ConvBinWinogradRxS,2,86187,0,miopenConvolutionBwdDataAlgoWinograd;miopenConvolutionBwdDataAlgoDirect:ConvOclDirectFwd,17,5442,0,miopenConvolutionBwdDataAlgoDirect;miopenConvolutionBwdDataAlgoGEMM:gemm,17,9356,11614464,MIOpenGEMM;miopenConvolutionBwdDataAlgoImplicitGEMM:ConvHipImplicitGemmBwdDataV1R1,20,6401,0,miopenConvolutionBwdDataAlgoImplicitGEMM
128-128-128-3x3-128-128-128-2-1x1-1x1-1x1-0-NCHW-FP32-F=miopenConvolutionFwdAlgoWinograd:ConvBinWinograd3x3U,0,497707,0,miopenConvolutionFwdAlgoWinograd
512-32-32-3x3-256-32-32-2-1x1-1x1-1x1-0-NCHW-FP32-W=miopenConvolutionBwdWeightsAlgoDirect:ConvAsmBwdWrW3x3,0,623967,0,miopenConvolutionBwdWeightsAlgoDirect;miopenConvolutionBwdWeightsAlgoWinograd:ConvBinWinogradRxSf2x3,1,70672,0,miopenConvolutionBwdWeightsAlgoWinograd;miopenConvolutionBwdWeightsAlgoGEMM:gemm,3,83073,9437184,MIOpenGEMM;miopenConvolutionBwdWeightsAlgoImplicitGEMM:ConvHipImplicitGemmV4R1WrW,4,7814,0,miopenConvolutionBwdWeightsAlgoImplicitGEMM
96-71-71-3x3-64-73-73-64-0x0-1x1-1x1-0-NCHW-FP32-W=miopenConvolutionBwdWeightsAlgoWinograd:ConvBinWinogradRxSf2x3,12,572,0,miopenConvolutionBwdWeightsAlgoWinograd
64-73-73-1x7-64-73-73-64-0x3-1x1-1x1-0-NCHW-FP32-W=miopenConvolutionBwdWeightsAlgoWinograd:ConvBinWinogradRxSf2x3,10,7154,0,miopenConvolutionBwdWeightsAlgoWinograd;miopenConvolutionBwdWeightsAlgoGEMM:gemm,13,6041,9549568,MIOpenGEMM;miopenConvolutionBwdWeightsAlgoDirect:ConvOclBwdWrW53,35,9958,7340032,miopenConvolutionBwdWeightsAlgoDirect;miopenConvolutionBwdWeightsAlgoImplicitGEMM:ConvHipImplicitGemmV4R1WrW,49,3267,0,miopenConvolutionBwdWeightsAlgoImplicitGEMM
3-1030-1030-7x7-64-512-512-2-0x0-2x2-1x1-0-NCHW-FP32-F=miopenConvolutionFwdAlgoWinograd:ConvBinWinogradRxSf2x3,2,21805,0,miopenConvolutionFwdAlgoWinograd;miopenConvolutionFwdAlgoDirect:ConvOclDirectFwdGen,2,52041,0,miopenConvolutionFwdAlgoDirect;miopenConvolutionFwdAlgoGEMM:GemmFwdRest,6,28745,154140672,MIOpenGEMM
512-32-32-3x3-256-32-32-2-1x1-1x1-1x1-0-NCHW-FP32-B=miopenConvolutionBwdDataAlgoWinograd:ConvBinWinograd3x3U,0,237522,0,miopenConvolutionBwdDataAlgoWinograd
128-128-128-1x1-256-256-256-2-0x0-2x2-1x1-0-NCHW-FP32-W=miopenConvolutionBwdWeightsAlgoDirect:ConvAsmBwdWrW1x1,1,19796,33554432,miopenConvolutionBwdWeightsAlgoDirect;miopenConvolutionBwdWeightsAlgoGEMM:gemm,2,75,16777216,MIOpenGEMM;miopenConvolutionBwdWeightsAlgoImplicitGEMM:ConvHipImplicitGemmV4R1WrW,11,34,0,miopenConvolutionBwdWeightsAlgoImplicitGEMM
512-16-16-1x1-12-16-16-2-0x0-1x1-1x1-0-NCHW-FP32-F=miopenConvolutionFwdAlgoDirect:ConvAsm1x1U,0,58131,0,miopenConvolutionFwdAlgoDirect;miopenConvolutionFwdAlgoGEMM:GemmFwd1x1_0_1,0,73939,0,MIOpenGEMM;miopenConvolutionFwdAlgoWinograd:ConvBinWinogradRxS,0,193946,0,miopenConvolutionFwdAlgoWinograd
512-32-32-1x1-2048-32-32-2-0x0-1x1-1x1-0-NCHW-FP32-W=miopenConvolutionBwdWeightsAlgoGEMM:gemm,1,57061,0,MIOpenGEMM;miopenConvolutionBwdWeightsAlgoWinograd:ConvBinWinogradRxSf2x3,11,6503,0,miopenConvolutionBwdWeightsAlgoWinograd
512-32-32-1x1-1024-64-64-2-0x0-2x2-1x1-0-NCHW-FP32-W=miopenConvolutionBwdWeightsAlgoDirect:ConvAsmBwdWrW1x1,1,121,8388608,miopenConvolutionBwdWeightsAlgoDirect;miopenConvolutionBwdWeightsAlgoImplicitGEMM:ConvHipImplicitGemmV4R1WrW,1,43203,0,miopenConvolutionBwdWeightsAlgoImplicitGEMM;miopenConvolutionBwdWeightsAlgoGEMM:gemm,1,43904,4194304,MIOpenGEMM
256-32-32-3x3-512-32-32-2-1x1-1x1-1x1-0-NCHW-FP32-F=miopenConvolutionFwdAlgoWinograd:ConvBinWinogradRxS,0,255627,0,miopenConvolutionFwdAlgoWinograd
6-256-256-1x1-512-256-256-2-0x0-1x1-1x1-0-NCHW-FP32-B=miopenConvolutionBwdDataAlgoGEMM:gemm,5,42996,0,MIOpenGEMM;miopenConvolutionBwdDataAlgoDirect:ConvOclDirectFwd1x1,14,2009,0,miopenConvolutionBwdDataAlgoDirect;miopenConvolutionBwdDataAlgoWinograd:ConvBinWinogradRxSf2x3,19,353,0,miopenConvolutionBwdDataAlgoWinograd
128-128-128-1x1-512-128-128-2-0x0-1x1-1x1-0-NCHW-FP32-W=miopenConvolutionBwdWeightsAlgoDirect:ConvAsmBwdWrW1x1,2,13936,0,miopenConvolutionBwdWeightsAlgoDirect
6-128-128-1x1-512-128-128-2-0x0-1x1-1x1-0-NCHW-FP32-W=miopenConvolutionBwdWeightsAlgoDirect:ConvAsmBwdWrW1x1,0,849073,0,miopenConvolutionBwdWeightsAlgoDirect;miopenConvolutionBwdWeightsAlgoWinograd:ConvBinWinogradRxSf2x3,2,37794,0,miopenConvolutionBwdWeightsAlgoWinograd;miopenConvolutionBwdWeightsAlgoGEMM:gemm,2,45858,0,MIOpenGEMM
512-64-64-3x3-256-64-64-2-1x1-1x1-1x1-0-NCHW-FP32-W=miopenConvolutionBwdWeightsAlgoDirect:ConvAsmBwdWrW3x3,3,7142,0,miopenConvolutionBwdWeightsAlgoDirect;miopenConvolutionBwdWeightsAlgoImplicitGEMM:ConvHipImplicitGemmV4R1WrW,5,2297,0,miopenConvolutionBwdWeightsAlgoImplicitGEMM;miopenConvolutionBwdWeightsAlgoWinograd:ConvBinWinogradRxSf2x3,6,44466,0,miopenConvolutionBwdWeightsAlgoWinograd;miopenConvolutionBwdWeightsAlgoGEMM:gemm,7,36953,37748736,MIOpenGEMM
128-128-128-1x1-256-256-256-2-0x0-2x2-1x1-0-NCHW-FP32-B=miopenConvolutionBwdDataAlgoDirect:ConvOclDirectFwd1x1,1,69313,0,miopenConvolutionBwdDataAlgoDirect;miopenConvolutionBwdDataAlgoGEMM:gemm,2,27111,50331648,MIOpenGEMM;miopenConvolutionBwdDataAlgoImplicitGEMM:ConvHipImplicitGemmBwdDataV1R1,2,81472,0,miopenConvolutionBwdDataAlgoImplicitGEMM;miopenConvolutionBwdDataAlgoWinograd:ConvBinWinogradRxSf2x3,3,70777,0,miopenConvolutionBwdDataAlgoWinograd
64-73-73-7x1-64-73-73-64-3x0-1x1-1x1-0-NCHW-FP32-W=miopenConvolutionBwdWeightsAlgoGEMM:gemm,8,83037,9549568,MIOpenGEMM;miopenConvolutionBwdWeightsAlgoDirect:ConvOclBwdWrW2<1>,10,922,7340032,miopenConvolutionBwdWeightsAlgoDirect;miopenConvolutionBwdWeightsAlgoWinograd:ConvBinWinogradRxSf2x3,12,572,0,miopenConvolutionBwdWeightsAlgoWinograd;miopenConvolutionBwdWeightsAlgoImplicitGEMM:ConvHipImplicitGemmV4R1WrW,51,8383,0,miopenConvolutionBwdWeightsAlgoImplicitGEMM
6-128-128-1x1-512-128-128-2-0x0-1x1-1x1-0-NCHW-FP32-B=miopenConvolutionBwdDataAlgoDirect:ConvOclDirectFwd1x1,0,259142,0,miopenConvolutionBwdDataAlgoDirect;miopenConvolutionBwdDataAlgoGEMM:gemm,0,35759,0,MIOpenGEMM;miopenConvolutionBwdDataAlgoWinograd:ConvBinWinogradRxSf2x3,0,48199,0,miopenConvolutionBwdDataAlgoWinograd
512-256-256-1x1-6-256-256-2-0x0-1x1-1x1-0-NCHW-FP32-F=miopenConvolutionFwdAlgoDirect:ConvOclDirectFwd1x1,0,712065,0,miopenConvolutionFwdAlgoDirect;miopenConvolutionFwdAlgoWinograd:ConvBinWinogradRxSf3x2,1,58765,0,miopenConvolutionFwdAlgoWinograd;miopenConvolutionFwdAlgoGEMM:GemmFwd1x1_0_1,17,4382,0,MIOpenGEMM
512-64-64-3x3-256-64-64-2-1x1-1x1-1x1-0-NCHW-FP32-B=miopenConvolutionBwdDataAlgoWinograd:ConvBinWinogradRxS,1,33903,0,miopenConvolutionBwdDataAlgoWinograd
512-32-32-1x1-1024-64-64-2-0x0-2x2-1x1-0-NCHW-FP32-B=miopenConvolutionBwdDataAlgoDirect:ConvOclDirectFwd1x1,0,594735,0,miopenConvolutionBwdDataAlgoDirect;miopenConvolutionBwdDataAlgoImplicitGEMM:ConvHipImplicitGemmBwdDataV1R1,0,748647,0,miopenConvolutionBwdDataAlgoImplicitGEMM;miopenConvolutionBwdDataAlgoGEMM:gemm,1,11681,12582912,MIOpenGEMM;miopenConvolutionBwdDataAlgoWinograd:ConvBinWinogradRxSf2x3,3,33872,0,miopenConvolutionBwdDataAlgoWinograd
512-32-32-1x1-2048-32-32-2-0x0-1x1-1x1-0-NCHW-FP32-B=miopenConvolutionBwdDataAlgoDirect:ConvAsm1x1U,0,731964,0,miopenConvolutionBwdDataAlgoDirect;miopenConvolutionBwdDataAlgoWinograd:ConvBinWinogradRxSf3x2,1,23703,0,miopenConvolutionBwdDataAlgoWinograd;miopenConvolutionBwdDataAlgoGEMM:gemm,1,53374,0,MIOpenGEMM;miopenConvolutionBwdDataAlgoImplicitGEMM:ConvHipImplicitGemmBwdDataV1R1,2,49474,0,miopenConvolutionBwdDataAlgoImplicitGEMM
256-64-64-3x3-512-64-64-2-1x1-1x1-1x1-0-NCHW-FP32-F=miopenConvolutionFwdAlgoWinograd:ConvBinWinograd3x3U,1,42601,0,miopenConvolutionFwdAlgoWinograd
12-256-256-1x1-512-256-256-2-0x0-1x1-1x1-0-NCHW-FP32-W=miopenConvolutionBwdWeightsAlgoGEMM:gemm,2,80257,0,MIOpenGEMM;miopenConvolutionBwdWeightsAlgoDirect:ConvOclBwdWrW53,9,91267,49152,miopenConvolutionBwdWeightsAlgoDirect;miopenConvolutionBwdWeightsAlgoWinograd:ConvBinWinogradRxSf2x3,12,2769,0,miopenConvolutionBwdWeightsAlgoWinograd
256-256-256-1x1-128-128-128-2-0x0-2x2-1x1-0-NCHW-FP32-F=miopenConvolutionFwdAlgoImplicitGEMM:ConvHipImplicitGemmV4R4Fwd,2,11015,0,miopenConvolutionFwdAlgoImplicitGEMM;miopenConvolutionFwdAlgoGEMM:GemmFwd1x1_0_2,2,11286,50331648,MIOpenGEMM;miopenConvolutionFwdAlgoWinograd:ConvBinWinogradRxSf2x3,4,92367,0,miopenConvolutionFwdAlgoWinograd;miopenConvolutionFwdAlgoDirect:ConvOclDirectFwd1x1,6,30297,0,miopenConvolutionFwdAlgoDirect
512-128-128-1x1-6-128-128-2-0x0-1x1-1x1-0-NCHW-FP32-F=miopenConvolutionFwdAlgoDirect:ConvOclDirectFwd1x1,0,326428,0,miopenConvolutionFwdAlgoDirect;miopenConvolutionFwdAlgoWinograd:ConvBinWinogradRxSf3x2,0,414762,0,miopenConvolutionFwdAlgoWinograd;miopenConvolutionFwdAlgoGEMM:GemmFwd1x1_0_1,4,85867,0,MIOpenGEMM
256-32-32-3x3-256-32-32-2-1x1-1x1-1x1-0-NCHW-FP32-W=miopenConvolutionBwdWeightsAlgoDirect:ConvAsmBwdWrW3x3,0,44429,0,miopenConvolutionBwdWeightsAlgoDirect;miopenConvolutionBwdWeightsAlgoImplicitGEMM:ConvHipImplicitGemmV4R1WrW,0,951788,0,miopenConvolutionBwdWeightsAlgoImplicitGEMM;miopenConvolutionBwdWeightsAlgoGEMM:gemm,1,10135,9437184,MIOpenGEMM;miopenConvolutionBwdWeightsAlgoWinograd:ConvBinWinogradRxSf2x3,1,63665,0,miopenConvolutionBwdWeightsAlgoWinograd
1024-64-64-1x1-512-32-32-2-0x0-2x2-1x1-0-NCHW-FP32-F=miopenConvolutionFwdAlgoGEMM:GemmFwd1x1_0_2,0,985318,12582912,MIOpenGEMM;miopenConvolutionFwdAlgoImplicitGEMM:ConvHipImplicitGemmV4R4Fwd,1,9734,0,miopenConvolutionFwdAlgoImplicitGEMM;miopenConvolutionFwdAlgoDirect:ConvOclDirectFwd1x1,1,95868,0,miopenConvolutionFwdAlgoDirect;miopenConvolutionFwdAlgoWinograd:ConvBinWinogradRxSf2x3,2,72895,0,miopenConvolutionFwdAlgoWinograd
128-128-128-1x1-512-128-128-2-0x0-1x1-1x1-0-NCHW-FP32-B=miopenConvolutionBwdDataAlgoImplicitGEMM:ConvHipImplicitGemmBwdDataV1R1,1,7431,0,miopenConvolutionBwdDataAlgoImplicitGEMM;miopenConvolutionBwdDataAlgoGEMM:gemm,1,35539,0,MIOpenGEMM;miopenConvolutionBwdDataAlgoDirect:ConvOclDirectFwd1x1,1,41373,0,miopenConvolutionBwdDataAlgoDirect;miopenConvolutionBwdDataAlgoWinograd:ConvBinWinogradRxSf3x2,1,76369,0,miopenConvolutionBwdDataAlgoWinograd
2048-32-32-1x1-512-32-32-2-0x0-1x1-1x1-0-NCHW-FP32-F=miopenConvolutionFwdAlgoDirect:ConvOclDirectFwd1x1,0,873959,0,miopenConvolutionFwdAlgoDirect;miopenConvolutionFwdAlgoImplicitGEMM:ConvHipImplicitGemmV4R4Fwd,0,945008,0,miopenConvolutionFwdAlgoImplicitGEMM;miopenConvolutionFwdAlgoGEMM:GemmFwd1x1_0_1,1,21401,0,MIOpenGEMM;miopenConvolutionFwdAlgoWinograd:ConvBinWinogradRxSf3x2,1,55759,0,miopenConvolutionFwdAlgoWinograd
256-32-32-3x3-256-32-32-2-1x1-1x1-1x1-0-NCHW-FP32-B=miopenConvolutionBwdDataAlgoWinograd:ConvBinWinogradRxS,0,182981,0,miopenConvolutionBwdDataAlgoWinograd
12-256-256-1x1-512-256-256-2-0x0-1x1-1x1-0-NCHW-FP32-B=miopenConvolutionBwdDataAlgoGEMM:gemm,2,24841,0,MIOpenGEMM;miopenConvolutionBwdDataAlgoDirect:ConvOclDirectFwd1x1,2,61984,0,miopenConvolutionBwdDataAlgoDirect;miopenConvolutionBwdDataAlgoWinograd:ConvBinWinogradRxSf2x3,3,50878,0,miopenConvolutionBwdDataAlgoWinograd;miopenConvolutionBwdDataAlgoImplicitGEMM:ConvHipImplicitGemmBwdDataV1R1,4,94136,0,miopenConvolutionBwdDataAlgoImplicitGEMM
64-73-73-1x7-64-73-73-64-0x3-1x1-1x1-0-NCHW-FP32-B=miopenConvolutionBwdDataAlgoWinograd:ConvBinWinogradRxSf3x2,4,71286,0,miopenConvolutionBwdDataAlgoWinograd;miopenConvolutionBwdDataAlgoGEMM:gemm,12,5006,9549568,MIOpenGEMM;miopenConvolutionBwdDataAlgoImplicitGEMM:ConvHipImplicitGemmBwdDataV1R1,15,7716,0,miopenConvolutionBwdDataAlgoImplicitGEMM
256-64-64-3x3-256-64-64-2-1x1-1x1-1x1-0-NCHW-FP32-W=miopenConvolutionBwdWeightsAlgoDirect:ConvAsmBwdWrW3x3,1,56646,0,miopenConvolutionBwdWeightsAlgoDirect;miopenConvolutionBwdWeightsAlgoGEMM:gemm,3,21039,37748736,MIOpenGEMM;miopenConvolutionBwdWeightsAlgoImplicitGEMM:ConvHipImplicitGemmV4R1WrW,3,2869,0,miopenConvolutionBwdWeightsAlgoImplicitGEMM;miopenConvolutionBwdWeightsAlgoWinograd:ConvBinWinogradRxSf2x3,3,81775,0,miopenConvolutionBwdWeightsAlgoWinograd
384-17-17-3x3-384-35-35-64-0x0-2x2-1x1-0-NCHW-FP32-B=miopenConvolutionBwdDataAlgoWinograd:ConvBinWinogradRxSf2x3,11,2075,0,miopenConvolutionBwdDataAlgoWinograd;miopenConvolutionBwdDataAlgoImplicitGEMM:ConvHipImplicitGemmBwdDataV1R1,12,7585,0,miopenConvolutionBwdDataAlgoImplicitGEMM;miopenConvolutionBwdDataAlgoGEMM:gemm,22,7404,3995136,MIOpenGEMM;miopenConvolutionBwdDataAlgoDirect:ConvOclDirectFwd,56,132,0,miopenConvolutionBwdDataAlgoDirect
512-16-16-3x3-256-16-16-2-1x1-1x1-1x1-0-NCHW-FP32-W=miopenConvolutionBwdWeightsAlgoDirect:ConvAsmBwdWrW3x3,0,293163,0,miopenConvolutionBwdWeightsAlgoDirect;miopenConvolutionBwdWeightsAlgoWinograd:ConvBinWinogradRxS,0,372651,0,miopenConvolutionBwdWeightsAlgoWinograd;miopenConvolutionBwdWeightsAlgoGEMM:gemm,0,723312,2359296,MIOpenGEMM;miopenConvolutionBwdWeightsAlgoImplicitGEMM:ConvHipImplicitGemmV4R1WrW,3,96443,0,miopenConvolutionBwdWeightsAlgoImplicitGEMM
256-64-64-1x1-512-128-128-2-0x0-2x2-1x1-0-NCHW-FP32-W=miopenConvolutionBwdWeightsAlgoDirect:ConvAsmBwdWrW1x1,1,65447,16777216,miopenConvolutionBwdWeightsAlgoDirect;miopenConvolutionBwdWeightsAlgoGEMM:gemm,3,26302,8388608,MIOpenGEMM;miopenConvolutionBwdWeightsAlgoImplicitGEMM:ConvHipImplicitGemmV4R1WrW,6,46726,0,miopenConvolutionBwdWeightsAlgoImplicitGEMM
512-32-32-3x3-512-32-32-2-1x1-1x1-1x1-0-NCHW-FP32-W=miopenConvolutionBwdWeightsAlgoDirect:ConvOclBwdWrW53,2,23586,0,miopenConvolutionBwdWeightsAlgoDirect;miopenConvolutionBwdWeightsAlgoWinograd:ConvBinWinogradRxSf2x3,8,66836,0,miopenConvolutionBwdWeightsAlgoWinograd;miopenConvolutionBwdWeightsAlgoGEMM:gemm,13,3002,18874368,MIOpenGEMM;miopenConvolutionBwdWeightsAlgoImplicitGEMM:ConvHipImplicitGemmV4R1WrW,14,7335,0,miopenConvolutionBwdWeightsAlgoImplicitGEMM
512-16-16-3x3-256-16-16-2-1x1-1x1-1x1-0-NCHW-FP32-B=miopenConvolutionBwdDataAlgoWinograd:ConvBinWinogradRxSf2x3,0,181941,0,miopenConvolutionBwdDataAlgoWinograd
256-64-64-3x3-256-64-64-2-1x1-1x1-1x1-0-NCHW-FP32-B=miopenConvolutionBwdDataAlgoWinograd:ConvBinWinograd3x3U,0,484754,0,miopenConvolutionBwdDataAlgoWinograd
512-256-256-1x1-12-256-256-2-0x0-1x1-1x1-0-NCHW-FP32-F=miopenConvolutionFwdAlgoDirect:ConvOclDirectFwd1x1,0,868661,0,miopenConvolutionFwdAlgoDirect;miopenConvolutionFwdAlgoWinograd:ConvBinWinogradRxSf3x2,1,35122,0,miopenConvolutionFwdAlgoWinograd;miopenConvolutionFwdAlgoGEMM:GemmFwd1x1_0_1,35,7254,0,MIOpenGEMM
256-32-32-1x1-2048-32-32-2-0x0-1x1-1x1-0-NCHW-FP32-W=miopenConvolutionBwdWeightsAlgoGEMM:gemm,0,738434,0,MIOpenGEMM;miopenConvolutionBwdWeightsAlgoWinograd:ConvBinWinogradRxSf2x3,5,41653,0,miopenConvolutionBwdWeightsAlgoWinograd
256-64-64-1x1-1024-64-64-2-0x0-1x1-1x1-0-NCHW-FP32-W=miopenConvolutionBwdWeightsAlgoDirect:ConvAsmBwdWrW1x1,1,1937,0,miopenConvolutionBwdWeightsAlgoDirect;miopenConvolutionBwdWeightsAlgoWinograd:ConvBinWinogradRxSf2x3,5,80647,0,miopenConvolutionBwdWeightsAlgoWinograd
512-32-32-3x3-512-32-32-2-1x1-1x1-1x1-0-NCHW-FP32-B=miopenConvolutionBwdDataAlgoWinograd:ConvBinWinogradRxS,0,611096,0,miopenConvolutionBwdDataAlgoWinograd
256-32-32-3x3-256-32-32-2-1x1-1x1-1x1-0-NCHW-FP32-F=miopenConvolutionFwdAlgoWinograd:ConvBinWinogradRxSf2x3,0,149635,0,miopenConvolutionFwdAlgoWinograd
512-128-128-1x1-128-128-128-2-0x0-1x1-1x1-0-NCHW-FP32-F=miopenConvolutionFwdAlgoImplicitGEMM:ConvHipImplicitGemmV4R4Fwd,0,840503,0,miopenConvolutionFwdAlgoImplicitGEMM;miopenConvolutionFwdAlgoGEMM:GemmFwd1x1_0_1,1,12101,0,MIOpenGEMM;miopenConvolutionFwdAlgoWinograd:ConvBinWinogradRxSf3x2,1,40553,0,miopenConvolutionFwdAlgoWinograd;miopenConvolutionFwdAlgoDirect:ConvOclDirectFwd1x1,1,40847,0,miopenConvolutionFwdAlgoDirect
512-256-256-3x3-256-256-256-2-1x1-1x1-1x1-0-NCHW-FP32-W=miopenConvolutionBwdWeightsAlgoWinograd:ConvBinWinogradRxS,90,4677,0,miopenConvolutionBwdWeightsAlgoWinograd;miopenConvolutionBwdWeightsAlgoImplicitGEMM:ConvHipImplicitGemmV4R1WrW,97,4574,0,miopenConvolutionBwdWeightsAlgoImplicitGEMM;miopenConvolutionBwdWeightsAlgoGEMM:gemm,152,907,603979776,MIOpenGEMM;miopenConvolutionBwdWeightsAlgoDirect:ConvOclBwdWrW53,159,66,0,miopenConvolutionBwdWeightsAlgoDirect
256-16-16-3x3-512-16-16-2-1x1-1x1-1x1-0-NCHW-FP32-F=miopenConvolutionFwdAlgoWinograd:ConvBinWinogradRxSf2x3,0,87362,0,miopenConvolutionFwdAlgoWinograd
256-64-64-1x1-512-128-128-2-0x0-2x2-1x1-0-NCHW-FP32-B=miopenConvolutionBwdDataAlgoDirect:ConvOclDirectFwd1x1,0,865663,0,miopenConvolutionBwdDataAlgoDirect;miopenConvolutionBwdDataAlgoImplicitGEMM:ConvHipImplicitGemmBwdDataV1R1,1,32489,0,miopenConvolutionBwdDataAlgoImplicitGEMM;miopenConvolutionBwdDataAlgoGEMM:gemm,1,3341,25165824,MIOpenGEMM;miopenConvolutionBwdDataAlgoWinograd:ConvBinWinogradRxSf2x3,3,76347,0,miopenConvolutionBwdDataAlgoWinograd
256-64-64-3x3-256-64-64-2-1x1-1x1-1x1-0-NCHW-FP32-F=miopenConvolutionFwdAlgoWinograd:ConvBinWinogradRxSf2x3,0,598381,0,miopenConvolutionFwdAlgoWinograd
96-35-35-3x3-64-35-35-64-1x1-1x1-1x1-0-NCHW-FP32-W=miopenConvolutionBwdWeightsAlgoDirect:ConvAsmBwdWrW3x3,1,18573,0,miopenConvolutionBwdWeightsAlgoDirect;miopenConvolutionBwdWeightsAlgoWinograd:ConvBinWinogradRxSf2x3,2,8626,0,miopenConvolutionBwdWeightsAlgoWinograd;miopenConvolutionBwdWeightsAlgoGEMM:gemm,8,52464,2822400,MIOpenGEMM;miopenConvolutionBwdWeightsAlgoImplicitGEMM:ConvHipImplicitGemmV4R1WrW,15,517,0,miopenConvolutionBwdWeightsAlgoImplicitGEMM
512-32-32-3x3-512-32-32-2-1x1-1x1-1x1-0-NCHW-FP32-F=miopenConvolutionFwdAlgoWinograd:ConvBinWinogradRxSf2x3,0,636048,0,miopenConvolutionFwdAlgoWinograd
6-16-16-1x1-512-16-16-2-0x0-1x1-1x1-0-NCHW-FP32-W=miopenConvolutionBwdWeightsAlgoDirect:ConvAsmBwdWrW1x1,0,17493,0,miopenConvolutionBwdWeightsAlgoDirect;miopenConvolutionBwdWeightsAlgoWinograd:ConvBinWinogradRxS,0,95928,0,miopenConvolutionBwdWeightsAlgoWinograd;miopenConvolutionBwdWeightsAlgoGEMM:gemm,0,307232,0,MIOpenGEMM
64-256-256-1x1-256-256-256-2-0x0-1x1-1x1-0-NCHW-FP32-F=miopenConvolutionFwdAlgoDirect:ConvOclDirectFwd1x1,2,32542,0,miopenConvolutionFwdAlgoDirect;miopenConvolutionFwdAlgoWinograd:ConvBinWinogradRxSf3x2,2,63544,0,miopenConvolutionFwdAlgoWinograd;miopenConvolutionFwdAlgoGEMM:GemmFwd1x1_0_1,5,97733,0,MIOpenGEMM;miopenConvolutionFwdAlgoImplicitGEMM:ConvHipImplicitGemmV4R4Fwd,6,65876,0,miopenConvolutionFwdAlgoImplicitGEMM
256-32-32-1x1-2048-32-32-2-0x0-1x1-1x1-0-NCHW-FP32-B=miopenConvolutionBwdDataAlgoWinograd:ConvBinWinogradRxSf3x2,0,977025,0,miopenConvolutionBwdDataAlgoWinograd;miopenConvolutionBwdDataAlgoDirect:ConvAsm1x1U,1,63831,0,miopenConvolutionBwdDataAlgoDirect;miopenConvolutionBwdDataAlgoGEMM:gemm,4,838,0,MIOpenGEMM;miopenConvolutionBwdDataAlgoImplicitGEMM:ConvHipImplicitGemmBwdDataV1R1,17,2423,0,miopenConvolutionBwdDataAlgoImplicitGEMM
12-128-128-1x1-512-128-128-2-0x0-1x1-1x1-0-NCHW-FP32-W=miopenConvolutionBwdWeightsAlgoGEMM:gemm,0,954661,0,MIOpenGEMM;miopenConvolutionBwdWeightsAlgoDirect:ConvAsmBwdWrW1x1,0,970909,0,miopenConvolutionBwdWeightsAlgoDirect;miopenConvolutionBwdWeightsAlgoWinograd:ConvBinWinogradRxSf2x3,2,71982,0,miopenConvolutionBwdWeightsAlgoWinograd
6-16-16-1x1-512-16-16-2-0x0-1x1-1x1-0-NCHW-FP32-B=miopenConvolutionBwdDataAlgoDirect:ConvAsm1x1U,0,8444,0,miopenConvolutionBwdDataAlgoDirect;miopenConvolutionBwdDataAlgoGEMM:gemm,0,1533,0,MIOpenGEMM;miopenConvolutionBwdDataAlgoWinograd:ConvBinWinogradRxSf2x3,0,4354,0,miopenConvolutionBwdDataAlgoWinograd
512-128-128-1x1-256-64-64-2-0x0-2x2-1x1-0-NCHW-FP32-F=miopenConvolutionFwdAlgoImplicitGEMM:ConvHipImplicitGemmV4R4Fwd,0,839957,0,miopenConvolutionFwdAlgoImplicitGEMM;miopenConvolutionFwdAlgoGEMM:GemmFwd1x1_0_2,0,978382,25165824,MIOpenGEMM;miopenConvolutionFwdAlgoDirect:ConvOclDirectFwd1x1,1,85953,0,miopenConvolutionFwdAlgoDirect;miopenConvolutionFwdAlgoWinograd:ConvBinWinogradRxSf2x3,2,93715,0,miopenConvolutionFwdAlgoWinograd
6-64-64-1x1-512-64-64-2-0x0-1x1-1x1-0-NCHW-FP32-W=miopenConvolutionBwdWeightsAlgoDirect:ConvAsmBwdWrW1x1,0,166868,0,miopenConvolutionBwdWeightsAlgoDirect;miopenConvolutionBwdWeightsAlgoWinograd:ConvBinWinogradRxSf2x3,0,638726,0,miopenConvolutionBwdWeightsAlgoWinograd;miopenConvolutionBwdWeightsAlgoGEMM:gemm,0,769649,0,MIOpenGEMM
1024-64-64-1x1-256-64-64-2-0x0-1x1-1x1-0-NCHW-FP32-W=miopenConvolutionBwdWeightsAlgoDirect:ConvAsmBwdWrW1x1,1,7248,0,miopenConvolutionBwdWeightsAlgoDirect;miopenConvolutionBwdWeightsAlgoWinograd:ConvBinWinogradRxSf2x3,5,29272,0,miopenConvolutionBwdWeightsAlgoWinograd
512-128-128-3x3-256-128-128-2-1x1-1x1-1x1-0-NCHW-FP32-W=miopenConvolutionBwdWeightsAlgoWinograd:ConvBinWinogradRxS,18,422,0,miopenConvolutionBwdWeightsAlgoWinograd;miopenConvolutionBwdWeightsAlgoDirect:ConvOclBwdWrW53,24,9976,0,miopenConvolutionBwdWeightsAlgoDirect;miopenConvolutionBwdWeightsAlgoGEMM:gemm,34,7617,150994944,MIOpenGEMM;miopenConvolutionBwdWeightsAlgoImplicitGEMM:ConvHipImplicitGemmV4R1WrW,35,8325,0,miopenConvolutionBwdWeightsAlgoImplicitGEMM
512-16-16-1x1-6-16-16-2-0x0-1x1-1x1-0-NCHW-FP32-F=miopenConvolutionFwdAlgoDirect:ConvAsm1x1U,0,2396,0,miopenConvolutionFwdAlgoDirect;miopenConvolutionFwdAlgoWinograd:ConvBinWinogradRxSf2x3,0,150516,0,miopenConvolutionFwdAlgoWinograd;miopenConvolutionFwdAlgoGEMM:GemmFwd1x1_0_1,0,358679,0,MIOpenGEMM
2048-32-32-1x1-512-32-32-2-0x0-1x1-1x1-0-NCHW-FP32-W=miopenConvolutionBwdWeightsAlgoGEMM:gemm,1,23613,0,MIOpenGEMM;miopenConvolutionBwdWeightsAlgoWinograd:ConvBinWinogradRxSf2x3,5,14394,0,miopenConvolutionBwdWeightsAlgoWinograd
512-256-256-3x3-256-256-256-2-1x1-1x1-1x1-0-NCHW-FP32-B=miopenConvolutionBwdDataAlgoWinograd:ConvBinWinograd3x3U,15,6808,0,miopenConvolutionBwdDataAlgoWinograd
12-128-128-1x1-512-128-128-2-0x0-1x1-1x1-0-NCHW-FP32-B=miopenConvolutionBwdDataAlgoGEMM:gemm,0,455439,0,MIOpenGEMM;miopenConvolutionBwdDataAlgoWinograd:ConvBinWinogradRxSf2x3,0,63929,0,miopenConvolutionBwdDataAlgoWinograd;miopenConvolutionBwdDataAlgoDirect:ConvOclDirectFwd1x1,0,667333,0,miopenConvolutionBwdDataAlgoDirect;miopenConvolutionBwdDataAlgoImplicitGEMM:ConvHipImplicitGemmBwdDataV1R1,0,953516,0,miopenConvolutionBwdDataAlgoImplicitGEMM
1024-1-1-1x1-1024-1-1-400-0x0-1x1-1x1-0-NCHW-FP32-B=miopenConvolutionBwdDataAlgoWinograd:ConvBinWinogradRxSf2x3,2,3285,0,miopenConvolutionBwdDataAlgoWinograd;miopenConvolutionBwdDataAlgoDirect:ConvOclDirectFwd1x1,2,56144,0,miopenConvolutionBwdDataAlgoDirect;miopenConvolutionBwdDataAlgoGEMM:gemm,197,282,0,MIOpenGEMM
512-128-128-3x3-256-128-128-2-1x1-1x1-1x1-0-NCHW-FP32-B=miopenConvolutionBwdDataAlgoWinograd:ConvBinWinogradRxSf2x3,6,46579,0,miopenConvolutionBwdDataAlgoWinograd
81-28-28-1x1-256-28-28-400-0x0-1x1-1x1-0-NCHW-FP32-W=miopenConvolutionBwdWeightsAlgoDirect:ConvAsmBwdWrW1x1,7,10583,0,miopenConvolutionBwdWeightsAlgoDirect;miopenConvolutionBwdWeightsAlgoGEMM:gemm,15,4313,0,MIOpenGEMM;miopenConvolutionBwdWeightsAlgoWinograd:ConvBinWinogradRxS,24,343,0,miopenConvolutionBwdWeightsAlgoWinograd
6-64-64-1x1-512-64-64-2-0x0-1x1-1x1-0-NCHW-FP32-B=miopenConvolutionBwdDataAlgoDirect:ConvOclDirectFwd1x1,0,85281,0,miopenConvolutionBwdDataAlgoDirect;miopenConvolutionBwdDataAlgoGEMM:gemm,0,87005,0,MIOpenGEMM;miopenConvolutionBwdDataAlgoWinograd:ConvBinWinogradRxSf2x3,0,539275,0,miopenConvolutionBwdDataAlgoWinograd
256-128-128-1x1-512-128-128-2-0x0-1x1-1x1-0-NCHW-FP32-W=miopenConvolutionBwdWeightsAlgoDirect:ConvAsmBwdWrW1x1,3,8099,0,miopenConvolutionBwdWeightsAlgoDirect;miopenConvolutionBwdWeightsAlgoWinograd:ConvBinWinogradRxSf2x3,11,5043,0,miopenConvolutionBwdWeightsAlgoWinograd
2048-32-32-1x1-256-32-32-2-0x0-1x1-1x1-0-NCHW-FP32-F=miopenConvolutionFwdAlgoDirect:ConvAsm1x1U,1,49758,0,miopenConvolutionFwdAlgoDirect;miopenConvolutionFwdAlgoWinograd:ConvBinWinogradRxSf3x2,1,52821,0,miopenConvolutionFwdAlgoWinograd;miopenConvolutionFwdAlgoGEMM:GemmFwd1x1_0_1,2,49039,0,MIOpenGEMM;miopenConvolutionFwdAlgoImplicitGEMM:ConvHipImplicitGemmV4R4Fwd,4,39191,0,miopenConvolutionFwdAlgoImplicitGEMM
12-16-16-1x1-512-16-16-2-0x0-1x1-1x1-0-NCHW-FP32-W=miopenConvolutionBwdWeightsAlgoDirect:ConvAsmBwdWrW1x1,0,5856,0,miopenConvolutionBwdWeightsAlgoDirect;miopenConvolutionBwdWeightsAlgoGEMM:gemm,0,79943,0,MIOpenGEMM;miopenConvolutionBwdWeightsAlgoWinograd:ConvBinWinogradRxSf2x3,0,165619,0,miopenConvolutionBwdWeightsAlgoWinograd
1024-64-64-1x1-256-64-64-2-0x0-1x1-1x1-0-NCHW-FP32-B=miopenConvolutionBwdDataAlgoGEMM:gemm,1,35077,0,MIOpenGEMM;miopenConvolutionBwdDataAlgoWinograd:ConvBinWinogradRxSf3x2,1,37219,0,miopenConvolutionBwdDataAlgoWinograd;miopenConvolutionBwdDataAlgoDirect:ConvOclDirectFwd1x1,1,47454,0,miopenConvolutionBwdDataAlgoDirect;miopenConvolutionBwdDataAlgoImplicitGEMM:ConvHipImplicitGemmBwdDataV1R1,1,75752,0,miopenConvolutionBwdDataAlgoImplicitGEMM
64-256-256-1x1-256-256-256-2-0x0-1x1-1x1-0-NCHW-FP32-W=miopenConvolutionBwdWeightsAlgoDirect:ConvOclBwdWrW1x1,1,79811,0,miopenConvolutionBwdWeightsAlgoDirect
256-256-256-3x3-512-256-256-2-1x1-1x1-1x1-0-NCHW-FP32-F=miopenConvolutionFwdAlgoWinograd:ConvBinWinograd3x3U,16,432,0,miopenConvolutionFwdAlgoWinograd
512-128-128-1x1-12-128-128-2-0x0-1x1-1x1-0-NCHW-FP32-F=miopenConvolutionFwdAlgoWinograd:ConvBinWinogradRxSf3x2,0,429354,0,miopenConvolutionFwdAlgoWinograd;miopenConvolutionFwdAlgoDirect:ConvOclDirectFwd1x1,0,512221,0,miopenConvolutionFwdAlgoDirect;miopenConvolutionFwdAlgoGEMM:GemmFwd1x1_0_1,0,578014,0,MIOpenGEMM
2048-32-32-1x1-512-32-32-2-0x0-1x1-1x1-0-NCHW-FP32-B=miopenConvolutionBwdDataAlgoDirect:ConvAsm1x1U,1,24214,0,miopenConvolutionBwdDataAlgoDirect;miopenConvolutionBwdDataAlgoWinograd:ConvBinWinogradRxSf3x2,1,37664,0,miopenConvolutionBwdDataAlgoWinograd;miopenConvolutionBwdDataAlgoGEMM:gemm,1,50689,0,MIOpenGEMM;miopenConvolutionBwdDataAlgoImplicitGEMM:ConvHipImplicitGemmBwdDataV1R1,3,81541,0,miopenConvolutionBwdDataAlgoImplicitGEMM
512-64-64-1x1-6-64-64-2-0x0-1x1-1x1-0-NCHW-FP32-F=miopenConvolutionFwdAlgoDirect:ConvOclDirectFwd1x1,0,9787,0,miopenConvolutionFwdAlgoDirect;miopenConvolutionFwdAlgoGEMM:GemmFwd1x1_0_1,0,165774,0,MIOpenGEMM;miopenConvolutionFwdAlgoWinograd:ConvBinWinogradRxS,0,179748,0,miopenConvolutionFwdAlgoWinograd
256-128-128-1x1-512-128-128-2-0x0-1x1-1x1-0-NCHW-FP32-B=miopenConvolutionBwdDataAlgoGEMM:gemm,1,99688,0,MIOpenGEMM;miopenConvolutionBwdDataAlgoWinograd:ConvBinWinogradRxSf3x2,3,4562,0,miopenConvolutionBwdDataAlgoWinograd;miopenConvolutionBwdDataAlgoDirect:ConvOclDirectFwd1x1,3,65618,0,miopenConvolutionBwdDataAlgoDirect;miopenConvolutionBwdDataAlgoImplicitGEMM:ConvHipImplicitGemmBwdDataV1R1,4,30421,0,miopenConvolutionBwdDataAlgoImplicitGEMM
12-16-16-1x1-512-16-16-2-0x0-1x1-1x1-0-NCHW-FP32-B=miopenConvolutionBwdDataAlgoDirect:ConvOclDirectFwd1x1,0,23894,0,miopenConvolutionBwdDataAlgoDirect;miopenConvolutionBwdDataAlgoGEMM:gemm,0,75618,0,MIOpenGEMM;miopenConvolutionBwdDataAlgoImplicitGEMM:ConvHipImplicitGemmBwdDataV1R1,0,314505,0,miopenConvolutionBwdDataAlgoImplicitGEMM;miopenConvolutionBwdDataAlgoWinograd:ConvBinWinogradRxSf2x3,0,847846,0,miopenConvolutionBwdDataAlgoWinograd
12-64-64-1x1-512-64-64-2-0x0-1x1-1x1-0-NCHW-FP32-W=miopenConvolutionBwdWeightsAlgoDirect:ConvOclBwdWrW53,0,236944,49152,miopenConvolutionBwdWeightsAlgoDirect;miopenConvolutionBwdWeightsAlgoGEMM:gemm,0,574233,0,MIOpenGEMM;miopenConvolutionBwdWeightsAlgoWinograd:ConvBinWinogradRxSf2x3,0,680416,0,miopenConvolutionBwdWeightsAlgoWinograd
512-128-128-1x1-256-256-256-2-0x0-2x2-1x1-0-NCHW-FP32-W=miopenConvolutionBwdWeightsAlgoDirect:ConvAsmBwdWrW1x1,3,55941,33554432,miopenConvolutionBwdWeightsAlgoDirect;miopenConvolutionBwdWeightsAlgoGEMM:gemm,5,91925,16777216,MIOpenGEMM;miopenConvolutionBwdWeightsAlgoImplicitGEMM:ConvHipImplicitGemmV4R1WrW,18,837,0,miopenConvolutionBwdWeightsAlgoImplicitGEMM
1024-64-64-1x1-512-128-128-2-0x0-2x2-1x1-0-NCHW-FP32-W=miopenConvolutionBwdWeightsAlgoDirect:ConvAsmBwdWrW1x1,3,5813,16777216,miopenConvolutionBwdWeightsAlgoDirect;miopenConvolutionBwdWeightsAlgoGEMM:gemm,4,47918,8388608,MIOpenGEMM;miopenConvolutionBwdWeightsAlgoImplicitGEMM:ConvHipImplicitGemmV4R1WrW,6,43704,0,miopenConvolutionBwdWeightsAlgoImplicitGEMM
81-28-28-1x1-256-28-28-400-0x0-1x1-1x1-0-NCHW-FP32-B=miopenConvolutionBwdDataAlgoDirect:ConvAsm1x1U,2,33642,0,miopenConvolutionBwdDataAlgoDirect;miopenConvolutionBwdDataAlgoWinograd:ConvBinWinogradRxSf2x3,12,9647,0,miopenConvolutionBwdDataAlgoWinograd;miopenConvolutionBwdDataAlgoGEMM:gemm,24,5019,0,MIOpenGEMM
1024-1-1-1x1-1024-1-1-400-0x0-1x1-1x1-0-NCHW-FP32-F=miopenConvolutionFwdAlgoDirect:ConvOclDirectFwd1x1,1,58915,0,miopenConvolutionFwdAlgoDirect;miopenConvolutionFwdAlgoWinograd:ConvBinWinogradRxSf2x3,2,59691,0,miopenConvolutionFwdAlgoWinograd;miopenConvolutionFwdAlgoGEMM:GemmFwd1x1_0_1,58,8276,0,MIOpenGEMM
64-256-256-1x1-256-256-256-2-0x0-1x1-1x1-0-NCHW-FP32-B=miopenConvolutionBwdDataAlgoWinograd:ConvBinWinogradRxSf2x3,2,21135,0,miopenConvolutionBwdDataAlgoWinograd;miopenConvolutionBwdDataAlgoImplicitGEMM:ConvHipImplicitGemmBwdDataV1R1,3,8715,0,miopenConvolutionBwdDataAlgoImplicitGEMM;miopenConvolutionBwdDataAlgoDirect:ConvOclDirectFwd1x1,4,69494,0,miopenConvolutionBwdDataAlgoDirect;miopenConvolutionBwdDataAlgoGEMM:gemm,29,5646,0,MIOpenGEMM
512-32-32-1x1-2048-32-32-2-0x0-1x1-1x1-0-NCHW-FP32-F=miopenConvolutionFwdAlgoDirect:ConvAsm1x1U,1,13248,0,miopenConvolutionFwdAlgoDirect;miopenConvolutionFwdAlgoGEMM:GemmFwd1x1_0_1,1,47704,0,MIOpenGEMM;miopenConvolutionFwdAlgoWinograd:ConvBinWinogradRxSf3x2,1,62346,0,miopenConvolutionFwdAlgoWinograd;miopenConvolutionFwdAlgoImplicitGEMM:ConvHipImplicitGemmV4R4Fwd,7,21693,0,miopenConvolutionFwdAlgoImplicitGEMM
128-28-28-3x3-128-56-56-64-1x1-2x2-1x1-0-NCHW-FP32-W=miopenConvolutionBwdWeightsAlgoDirect:ConvAsmBwdWrW3x3,7,87337,0,miopenConvolutionBwdWeightsAlgoDirect;miopenConvolutionBwdWeightsAlgoImplicitGEMM:ConvHipImplicitGemmV4R1WrW,23,1421,0,miopenConvolutionBwdWeightsAlgoImplicitGEMM;miopenConvolutionBwdWeightsAlgoGEMM:gemm,81,4664,3612672,MIOpenGEMM
512-128-128-1x1-256-128-128-2-0x0-1x1-1x1-0-NCHW-FP32-F=miopenConvolutionFwdAlgoImplicitGEMM:ConvHipImplicitGemmV4R4Fwd,2,17692,0,miopenConvolutionFwdAlgoImplicitGEMM;miopenConvolutionFwdAlgoWinograd:ConvBinWinogradRxSf3x2,2,76001,0,miopenConvolutionFwdAlgoWinograd;miopenConvolutionFwdAlgoDirect:ConvOclDirectFwd1x1,2,77471,0,miopenConvolutionFwdAlgoDirect;miopenConvolutionFwdAlgoGEMM:GemmFwd1x1_0_1,3,33005,0,MIOpenGEMM
12-64-64-1x1-512-64-64-2-0x0-1x1-1x1-0-NCHW-FP32-B=miopenConvolutionBwdDataAlgoDirect:ConvOclDirectFwd1x1,0,56549,0,miopenConvolutionBwdDataAlgoDirect;miopenConvolutionBwdDataAlgoGEMM:gemm,0,140029,0,MIOpenGEMM;miopenConvolutionBwdDataAlgoWinograd:ConvBinWinogradRxSf2x3,1,98955,0,miopenConvolutionBwdDataAlgoWinograd;miopenConvolutionBwdDataAlgoImplicitGEMM:ConvHipImplicitGemmBwdDataV1R1,2,671,0,miopenConvolutionBwdDataAlgoImplicitGEMM
12-32-32-1x1-512-32-32-2-0x0-1x1-1x1-0-NCHW-FP32-W=miopenConvolutionBwdWeightsAlgoDirect:ConvAsmBwdWrW1x1,0,405627,0,miopenConvolutionBwdWeightsAlgoDirect;miopenConvolutionBwdWeightsAlgoGEMM:gemm,0,553949,0,MIOpenGEMM;miopenConvolutionBwdWeightsAlgoWinograd:ConvBinWinogradRxS,2,49799,0,miopenConvolutionBwdWeightsAlgoWinograd
512-28-28-1x1-1024-28-28-64-0x0-1x1-1x1-0-NCHW-FP32-B=miopenConvolutionBwdDataAlgoDirect:ConvAsm1x1U,16,8726,0,miopenConvolutionBwdDataAlgoDirect
64-256-256-3x3-64-256-256-2-1x1-1x1-1x1-0-NCHW-FP32-W=miopenConvolutionBwdWeightsAlgoDirect:ConvOclBwdWrW53,4,53321,294912,miopenConvolutionBwdWeightsAlgoDirect;miopenConvolutionBwdWeightsAlgoGEMM:gemm,7,2221,150994944,MIOpenGEMM;miopenConvolutionBwdWeightsAlgoWinograd:ConvBinWinogradRxSf2x3,7,61074,0,miopenConvolutionBwdWeightsAlgoWinograd;miopenConvolutionBwdWeightsAlgoImplicitGEMM:ConvHipImplicitGemmV4R1WrW,29,4227,0,miopenConvolutionBwdWeightsAlgoImplicitGEMM
256-256-256-1x1-64-256-256-2-0x0-1x1-1x1-0-NCHW-FP32-F=miopenConvolutionFwdAlgoWinograd:ConvBinWinogradRxSf3x2,1,59428,0,miopenConvolutionFwdAlgoWinograd;miopenConvolutionFwdAlgoGEMM:GemmFwd1x1_0_1,1,97318,0,MIOpenGEMM;miopenConvolutionFwdAlgoImplicitGEMM:ConvHipImplicitGemmV4R4Fwd,3,21423,0,miopenConvolutionFwdAlgoImplicitGEMM;miopenConvolutionFwdAlgoDirect:ConvOclDirectFwd1x1,3,26563,0,miopenConvolutionFwdAlgoDirect
1024-64-64-1x1-512-128-128-2-0x0-2x2-1x1-0-NCHW-FP32-B=miopenConvolutionBwdDataAlgoDirect:ConvOclDirectFwd1x1,2,22052,0,miopenConvolutionBwdDataAlgoDirect;miopenConvolutionBwdDataAlgoImplicitGEMM:ConvHipImplicitGemmBwdDataV1R1,3,19257,0,miopenConvolutionBwdDataAlgoImplicitGEMM;miopenConvolutionBwdDataAlgoGEMM:gemm,4,30361,50331648,MIOpenGEMM;miopenConvolutionBwdDataAlgoWinograd:ConvBinWinogradRxSf2x3,13,4471,0,miopenConvolutionBwdDataAlgoWinograd
512-128-128-1x1-256-256-256-2-0x0-2x2-1x1-0-NCHW-FP32-B=miopenConvolutionBwdDataAlgoImplicitGEMM:ConvHipImplicitGemmBwdDataV1R1,2,88543,0,miopenConvolutionBwdDataAlgoImplicitGEMM;miopenConvolutionBwdDataAlgoDirect:ConvOclDirectFwd1x1,2,94515,0,miopenConvolutionBwdDataAlgoDirect;miopenConvolutionBwdDataAlgoGEMM:gemm,3,8479,100663296,MIOpenGEMM;miopenConvolutionBwdDataAlgoWinograd:ConvBinWinogradRxSf2x3,13,809,0,miopenConvolutionBwdDataAlgoWinograd
12-32-32-1x1-512-32-32-2-0x0-1x1-1x1-0-NCHW-FP32-B=miopenConvolutionBwdDataAlgoDirect:ConvOclDirectFwd1x1,0,82314,0,miopenConvolutionBwdDataAlgoDirect;miopenConvolutionBwdDataAlgoGEMM:gemm,1,63433,0,MIOpenGEMM;miopenConvolutionBwdDataAlgoWinograd:ConvBinWinogradRxSf2x3,2,48563,0,miopenConvolutionBwdDataAlgoWinograd;miopenConvolutionBwdDataAlgoImplicitGEMM:ConvHipImplicitGemmBwdDataV1R1,2,83895,0,miopenConvolutionBwdDataAlgoImplicitGEMM
512-64-64-1x1-12-64-64-2-0x0-1x1-1x1-0-NCHW-FP32-F=miopenConvolutionFwdAlgoDirect:ConvOclDirectFwd1x1,0,634554,0,miopenConvolutionFwdAlgoDirect;miopenConvolutionFwdAlgoWinograd:ConvBinWinogradRxS,0,692229,0,miopenConvolutionFwdAlgoWinograd;miopenConvolutionFwdAlgoGEMM:GemmFwd1x1_0_1,7,386,0,MIOpenGEMM
2048-28-28-3x3-256-28-28-64-12x12-1x1-12x12-0-NCHW-FP32-F=miopenConvolutionFwdAlgoImplicitGEMM:ConvHipImplicitGemmV4R1Fwd,61,9709,0,miopenConvolutionFwdAlgoImplicitGEMM;miopenConvolutionFwdAlgoGEMM:GemmFwdRest,138,157,57802752,MIOpenGEMM
64-256-256-3x3-64-256-256-2-1x1-1x1-1x1-0-NCHW-FP32-B=miopenConvolutionBwdDataAlgoWinograd:ConvBinWinograd3x3U,0,541074,0,miopenConvolutionBwdDataAlgoWinograd
128-28-28-3x3-128-56-56-64-1x1-2x2-1x1-0-NCHW-FP32-B=miopenConvolutionBwdDataAlgoWinograd:ConvBinWinogradRxSf2x3,6,79094,0,miopenConvolutionBwdDataAlgoWinograd;miopenConvolutionBwdDataAlgoImplicitGEMM:ConvHipImplicitGemmBwdDataV1R1,15,7675,0,miopenConvolutionBwdDataAlgoImplicitGEMM;miopenConvolutionBwdDataAlgoDirect:ConvOclDirectFwd,23,4469,0,miopenConvolutionBwdDataAlgoDirect;miopenConvolutionBwdDataAlgoGEMM:gemm,51,8209,3612672,MIOpenGEMM
6-32-32-1x1-512-32-32-2-0x0-1x1-1x1-0-NCHW-FP32-W=miopenConvolutionBwdWeightsAlgoDirect:ConvAsmBwdWrW1x1,0,136233,0,miopenConvolutionBwdWeightsAlgoDirect;miopenConvolutionBwdWeightsAlgoWinograd:ConvBinWinogradRxS,2,997,0,miopenConvolutionBwdWeightsAlgoWinograd;miopenConvolutionBwdWeightsAlgoGEMM:gemm,2,88559,0,MIOpenGEMM
64-256-256-3x3-64-256-256-2-1x1-1x1-1x1-0-NCHW-FP32-F=miopenConvolutionFwdAlgoWinograd:ConvBinWinogradRxS,0,719703,0,miopenConvolutionFwdAlgoWinograd
256-28-28-1x1-81-28-28-400-0x0-1x1-1x1-0-NCHW-FP32-F=miopenConvolutionFwdAlgoDirect:ConvAsm1x1U,3,24692,0,miopenConvolutionFwdAlgoDirect;miopenConvolutionFwdAlgoWinograd:ConvBinWinogradRxSf3x2,5,3428,0,miopenConvolutionFwdAlgoWinograd;miopenConvolutionFwdAlgoGEMM:GemmFwd1x1_0_1,13,4879,0,MIOpenGEMM
512-32-32-1x1-12-32-32-2-0x0-1x1-1x1-0-NCHW-FP32-F=miopenConvolutionFwdAlgoDirect:ConvAsm1x1U,0,50071,0,miopenConvolutionFwdAlgoDirect;miopenConvolutionFwdAlgoGEMM:GemmFwd1x1_0_1,0,171449,0,MIOpenGEMM;miopenConvolutionFwdAlgoWinograd:ConvBinWinogradRxS,0,280465,0,miopenConvolutionFwdAlgoWinograd
256-256-256-1x1-512-128-128-2-0x0-2x2-1x1-0-NCHW-FP32-F=miopenConvolutionFwdAlgoGEMM:GemmFwd1x1_0_2,4,35306,100663296,MIOpenGEMM;miopenConvolutionFwdAlgoImplicitGEMM:ConvHipImplicitGemmV4R4Fwd,4,39074,0,miopenConvolutionFwdAlgoImplicitGEMM;miopenConvolutionFwdAlgoDirect:ConvOclDirectFwd1x1,6,83262,0,miopenConvolutionFwdAlgoDirect;miopenConvolutionFwdAlgoWinograd:ConvBinWinogradRxS,16,296,0,miopenConvolutionFwdAlgoWinograd
512-128-128-1x1-1024-64-64-2-0x0-2x2-1x1-0-NCHW-FP32-F=miopenConvolutionFwdAlgoGEMM:GemmFwd1x1_0_2,2,42978,50331648,MIOpenGEMM;miopenConvolutionFwdAlgoImplicitGEMM:ConvHipImplicitGemmV4R4Fwd,2,78579,0,miopenConvolutionFwdAlgoImplicitGEMM;miopenConvolutionFwdAlgoDirect:ConvOclDirectFwd1x1,5,18934,0,miopenConvolutionFwdAlgoDirect;miopenConvolutionFwdAlgoWinograd:ConvBinWinogradRxS,10,519,0,miopenConvolutionFwdAlgoWinograd
6-32-32-1x1-512-32-32-2-0x0-1x1-1x1-0-NCHW-FP32-B=miopenConvolutionBwdDataAlgoDirect:ConvAsm1x1U,0,57149,0,miopenConvolutionBwdDataAlgoDirect;miopenConvolutionBwdDataAlgoGEMM:gemm,0,67921,0,MIOpenGEMM;miopenConvolutionBwdDataAlgoWinograd:ConvBinWinogradRxSf2x3,23,5222,0,miopenConvolutionBwdDataAlgoWinograd
64-512-512-7x7-3-1030-1030-2-0x0-2x2-1x1-0-NCHW-FP32-W=miopenConvolutionBwdWeightsAlgoGEMM:gemm,8,7115,154140672,MIOpenGEMM
128-56-56-3x3-128-28-28-64-1x1-2x2-1x1-0-NCHW-FP32-F=miopenConvolutionFwdAlgoWinograd:ConvBinWinogradRxSf2x3,4,73084,0,miopenConvolutionFwdAlgoWinograd;miopenConvolutionFwdAlgoImplicitGEMM:ConvHipImplicitGemmV4R1Fwd,5,10074,0,miopenConvolutionFwdAlgoImplicitGEMM;miopenConvolutionFwdAlgoDirect:ConvOclDirectFwd,38,6922,0,miopenConvolutionFwdAlgoDirect;miopenConvolutionFwdAlgoGEMM:GemmFwdRest,127,609,3612672,MIOpenGEMM
6-256-256-1x1-512-256-256-2-0x0-1x1-1x1-0-NCHW-FP32-W=miopenConvolutionBwdWeightsAlgoGEMM:gemm,4,79513,0,MIOpenGEMM;miopenConvolutionBwdWeightsAlgoDirect:ConvOclBwdWrW53,6,69667,24576,miopenConvolutionBwdWeightsAlgoDirect;miopenConvolutionBwdWeightsAlgoWinograd:ConvBinWinogradRxSf2x3,9,9055,0,miopenConvolutionBwdWeightsAlgoWinograd
64-256-256-1x1-64-256-256-2-0x0-1x1-1x1-0-NCHW-FP32-W=miopenConvolutionBwdWeightsAlgoDirect:ConvAsmBwdWrW1x1,0,698557,0,miopenConvolutionBwdWeightsAlgoDirect
512-32-32-1x1-6-32-32-2-0x0-1x1-1x1-0-NCHW-FP32-F=miopenConvolutionFwdAlgoDirect:ConvOclDirectFwd1x1,0,226789,0,miopenConvolutionFwdAlgoDirect;miopenConvolutionFwdAlgoGEMM:GemmFwd1x1_0_1,0,334827,0,MIOpenGEMM;miopenConvolutionFwdAlgoWinograd:ConvBinWinogradRxS,0,378539,0,miopenConvolutionFwdAlgoWinograd
64-256-256-1x1-64-256-256-2-0x0-1x1-1x1-0-NCHW-FP32-B=miopenConvolutionBwdDataAlgoGEMM:gemm,0,557352,0,MIOpenGEMM;miopenConvolutionBwdDataAlgoWinograd:ConvBinWinogradRxS,0,568767,0,miopenConvolutionBwdDataAlgoWinograd;miopenConvolutionBwdDataAlgoImplicitGEMM:ConvHipImplicitGemmBwdDataV1R1,0,797171,0,miopenConvolutionBwdDataAlgoImplicitGEMM;miopenConvolutionBwdDataAlgoDirect:ConvOclDirectFwd1x1,2,11199,0,miopenConvolutionBwdDataAlgoDirect
256-56-56-1x1-64-56-56-64-0x0-1x1-1x1-0-NCHW-FP32-F=miopenConvolutionFwdAlgoDirect:ConvOclDirectFwd1x1,1,22348,0,miopenConvolutionFwdAlgoDirect;miopenConvolutionFwdAlgoWinograd:ConvBinWinogradRxSf3x2,2,38456,0,miopenConvolutionFwdAlgoWinograd;miopenConvolutionFwdAlgoGEMM:GemmFwd1x1_0_1,3,33247,0,MIOpenGEMM
256-14-14-2x2-256-28-28-400-0x0-2x2-1x1-0-NCHW-FP32-W=miopenConvolutionBwdWeightsAlgoImplicitGEMM:ConvHipImplicitGemmV4R1WrW,31,4319,0,miopenConvolutionBwdWeightsAlgoImplicitGEMM;miopenConvolutionBwdWeightsAlgoDirect:ConvOclBwdWrW2<4>,34,8361,104857600,miopenConvolutionBwdWeightsAlgoDirect;miopenConvolutionBwdWeightsAlgoGEMM:gemm,768,785,802816,MIOpenGEMM
512-28-28-1x1-128-28-28-64-0x0-1x1-1x1-0-NCHW-FP32-W=miopenConvolutionBwdWeightsAlgoDirect:ConvAsmBwdWrW1x1,1,18774,0,miopenConvolutionBwdWeightsAlgoDirect
1024-28-28-1x1-512-28-28-64-0x0-1x1-1x1-0-NCHW-FP32-F=miopenConvolutionFwdAlgoDirect:ConvAsm1x1U,11,429,0,miopenConvolutionFwdAlgoDirect;miopenConvolutionFwdAlgoGEMM:GemmFwd1x1_0_1,15,383,0,MIOpenGEMM;miopenConvolutionFwdAlgoWinograd:ConvBinWinogradRxSf3x2,18,337,0,miopenConvolutionFwdAlgoWinograd
64-256-256-1x1-64-256-256-2-0x0-1x1-1x1-0-NCHW-FP32-F=miopenConvolutionFwdAlgoWinograd:ConvBinWinogradRxSf2x3,0,725829,0,miopenConvolutionFwdAlgoWinograd;miopenConvolutionFwdAlgoDirect:ConvOclDirectFwd1x1,1,81098,0,miopenConvolutionFwdAlgoDirect;miopenConvolutionFwdAlgoGEMM:GemmFwd1x1_0_1,3,4234,0,MIOpenGEMM;miopenConvolutionFwdAlgoImplicitGEMM:ConvHipImplicitGemmV4R4Fwd,4,68349,0,miopenConvolutionFwdAlgoImplicitGEMM
256-28-28-1x1-2048-28-28-64-0x0-1x1-1x1-0-NCHW-FP32-W=miopenConvolutionBwdWeightsAlgoDirect:ConvAsmBwdWrW1x1,10,1745,0,miopenConvolutionBwdWeightsAlgoDirect;miopenConvolutionBwdWeightsAlgoWinograd:ConvBinWinogradRxSf2x3,89,4718,0,miopenConvolutionBwdWeightsAlgoWinograd
128-28-28-1x1-512-28-28-64-0x0-1x1-1x1-0-NCHW-FP32-B=miopenConvolutionBwdDataAlgoDirect:ConvAsm1x1U,1,3993,0,miopenConvolutionBwdDataAlgoDirect;miopenConvolutionBwdDataAlgoWinograd:ConvBinWinogradRxSf3x2,2,80646,0,miopenConvolutionBwdDataAlgoWinograd;miopenConvolutionBwdDataAlgoGEMM:gemm,3,2321,0,MIOpenGEMM
512-28-28-1x1-256-56-56-64-0x0-2x2-1x1-0-NCHW-FP32-W=miopenConvolutionBwdWeightsAlgoDirect:ConvAsmBwdWrW1x1,2,86383,51380224,miopenConvolutionBwdWeightsAlgoDirect;miopenConvolutionBwdWeightsAlgoImplicitGEMM:ConvHipImplicitGemmV4R1WrW,11,4524,0,miopenConvolutionBwdWeightsAlgoImplicitGEMM;miopenConvolutionBwdWeightsAlgoGEMM:gemm,13,4515,802816,MIOpenGEMM
256-14-14-2x2-256-28-28-400-0x0-2x2-1x1-0-NCHW-FP32-B=miopenConvolutionBwdDataAlgoImplicitGEMM:ConvHipImplicitGemmBwdDataV1R1,15,3911,0,miopenConvolutionBwdDataAlgoImplicitGEMM;miopenConvolutionBwdDataAlgoWinograd:ConvBinWinogradRxSf2x3,21,7451,0,miopenConvolutionBwdDataAlgoWinograd;miopenConvolutionBwdDataAlgoGEMM:gemm,35,1626,802816,MIOpenGEMM
512-28-28-1x1-2048-28-28-64-0x0-1x1-1x1-0-NCHW-FP32-B=miopenConvolutionBwdDataAlgoDirect:ConvAsm1x1U,19,1954,0,miopenConvolutionBwdDataAlgoDirect;miopenConvolutionBwdDataAlgoGEMM:gemm,22,5119,0,MIOpenGEMM;miopenConvolutionBwdDataAlgoWinograd:ConvBinWinogradRxSf3x2,30,7992,0,miopenConvolutionBwdDataAlgoWinograd
256-28-28-3x3-256-28-28-64-1x1-1x1-1x1-0-NCHW-FP32-W=miopenConvolutionBwdWeightsAlgoWinograd:ConvBinWinogradRxS,8,31172,0,miopenConvolutionBwdWeightsAlgoWinograd;miopenConvolutionBwdWeightsAlgoDirect:ConvAsmBwdWrW3x3,11,6839,0,miopenConvolutionBwdWeightsAlgoDirect;miopenConvolutionBwdWeightsAlgoImplicitGEMM:ConvHipImplicitGemmV4R1WrW,20,144,0,miopenConvolutionBwdWeightsAlgoImplicitGEMM;miopenConvolutionBwdWeightsAlgoGEMM:gemm,138,127,7225344,MIOpenGEMM
512-28-28-1x1-128-28-28-64-0x0-1x1-1x1-0-NCHW-FP32-B=miopenConvolutionBwdDataAlgoDirect:ConvAsm1x1U,1,10736,0,miopenConvolutionBwdDataAlgoDirect;miopenConvolutionBwdDataAlgoWinograd:ConvBinWinogradRxSf3x2,2,5838,0,miopenConvolutionBwdDataAlgoWinograd;miopenConvolutionBwdDataAlgoGEMM:gemm,3,49319,0,MIOpenGEMM
512-28-28-1x1-128-28-28-64-0x0-1x1-1x1-0-NCHW-FP32-F=miopenConvolutionFwdAlgoImplicitGEMM:ConvHipImplicitGemmV4R4Fwd,1,23075,0,miopenConvolutionFwdAlgoImplicitGEMM;miopenConvolutionFwdAlgoDirect:ConvOclDirectFwd1x1,1,41412,0,miopenConvolutionFwdAlgoDirect;miopenConvolutionFwdAlgoWinograd:ConvBinWinogradRxSf3x2,2,58477,0,miopenConvolutionFwdAlgoWinograd;miopenConvolutionFwdAlgoGEMM:GemmFwd1x1_0_1,3,89935,0,MIOpenGEMM
256-28-28-1x1-1024-28-28-64-0x0-1x1-1x1-0-NCHW-FP32-W=miopenConvolutionBwdWeightsAlgoDirect:ConvAsmBwdWrW1x1,5,22644,0,miopenConvolutionBwdWeightsAlgoDirect;miopenConvolutionBwdWeightsAlgoWinograd:ConvBinWinogradRxS,60,2635,0,miopenConvolutionBwdWeightsAlgoWinograd
256-28-28-3x3-256-28-28-64-1x1-1x1-1x1-0-NCHW-FP32-B=miopenConvolutionBwdDataAlgoWinograd:ConvBinWinograd3x3U,3,5062,0,miopenConvolutionBwdDataAlgoWinograd
256-256-256-1x1-64-256-256-2-0x0-1x1-1x1-0-NCHW-FP32-W=miopenConvolutionBwdWeightsAlgoDirect:ConvOclBwdWrW1x1,2,58247,0,miopenConvolutionBwdWeightsAlgoDirect
256-256-256-3x3-256-256-256-2-1x1-1x1-1x1-0-NCHW-FP32-W=miopenConvolutionBwdWeightsAlgoWinograd:ConvBinWinogradRxS,36,9241,0,miopenConvolutionBwdWeightsAlgoWinograd;miopenConvolutionBwdWeightsAlgoGEMM:gemm,43,3138,603979776,MIOpenGEMM;miopenConvolutionBwdWeightsAlgoImplicitGEMM:ConvHipImplicitGemmV4R1WrW,47,7051,0,miopenConvolutionBwdWeightsAlgoImplicitGEMM;miopenConvolutionBwdWeightsAlgoDirect:ConvOclBwdWrW53,57,103,0,miopenConvolutionBwdWeightsAlgoDirect
256-28-28-2x2-256-14-14-400-0x0-2x2-1x1-0-NCHW-FP32-F=miopenConvolutionFwdAlgoWinograd:ConvBinWinogradRxSf2x3,21,8023,0,miopenConvolutionFwdAlgoWinograd;miopenConvolutionFwdAlgoGEMM:GemmFwdRest,832,194,802816,MIOpenGEMM
512-28-28-1x1-256-56-56-64-0x0-2x2-1x1-0-NCHW-FP32-B=miopenConvolutionBwdDataAlgoDirect:ConvAsm1x1UV2,2,56937,0,miopenConvolutionBwdDataAlgoDirect;miopenConvolutionBwdDataAlgoImplicitGEMM:ConvHipImplicitGemmBwdDataV4R1,3,3327,0,miopenConvolutionBwdDataAlgoImplicitGEMM;miopenConvolutionBwdDataAlgoGEMM:gemm,4,2853,154140672,MIOpenGEMM;miopenConvolutionBwdDataAlgoWinograd:ConvBinWinogradRxSf2x3,18,8316,0,miopenConvolutionBwdDataAlgoWinograd
256-28-28-1x1-2048-28-28-64-0x0-1x1-1x1-0-NCHW-FP32-B=miopenConvolutionBwdDataAlgoDirect:ConvAsm1x1U,13,5627,0,miopenConvolutionBwdDataAlgoDirect;miopenConvolutionBwdDataAlgoWinograd:ConvBinWinogradRxS,25,6369,0,miopenConvolutionBwdDataAlgoWinograd
256-28-28-3x3-256-28-28-64-1x1-1x1-1x1-0-NCHW-FP32-F=miopenConvolutionFwdAlgoWinograd:ConvBinWinogradRxSf2x3,3,22995,0,miopenConvolutionFwdAlgoWinograd
256-256-256-3x3-256-256-256-2-1x1-1x1-1x1-0-NCHW-FP32-B=miopenConvolutionBwdDataAlgoWinograd:ConvBinWinograd3x3U,7,88931,0,miopenConvolutionBwdDataAlgoWinograd
256-256-256-1x1-64-256-256-2-0x0-1x1-1x1-0-NCHW-FP32-B=miopenConvolutionBwdDataAlgoWinograd:ConvBinWinogradRxSf3x2,1,92398,0,miopenConvolutionBwdDataAlgoWinograd;miopenConvolutionBwdDataAlgoGEMM:gemm,4,2961,0,MIOpenGEMM;miopenConvolutionBwdDataAlgoDirect:ConvOclDirectFwd1x1,4,63675,0,miopenConvolutionBwdDataAlgoDirect;miopenConvolutionBwdDataAlgoImplicitGEMM:ConvHipImplicitGemmBwdDataV1R1,4,87227,0,miopenConvolutionBwdDataAlgoImplicitGEMM
256-56-56-1x1-512-28-28-64-0x0-2x2-1x1-0-NCHW-FP32-F=miopenConvolutionFwdAlgoImplicitGEMM:ConvHipImplicitGemmV4R4Fwd,2,38228,0,miopenConvolutionFwdAlgoImplicitGEMM;miopenConvolutionFwdAlgoGEMM:GemmFwd1x1_0_2,3,24351,154140672,MIOpenGEMM;miopenConvolutionFwdAlgoDirect:ConvAsm1x1U,3,40191,51380224,miopenConvolutionFwdAlgoDirect;miopenConvolutionFwdAlgoWinograd:ConvBinWinogradRxS,12,3073,0,miopenConvolutionFwdAlgoWinograd
512-28-28-3x3-512-28-28-64-2x2-1x1-2x2-0-NCHW-FP32-W=miopenConvolutionBwdWeightsAlgoImplicitGEMM:ConvHipImplicitGemmV4R1WrW,66,2782,0,miopenConvolutionBwdWeightsAlgoImplicitGEMM;miopenConvolutionBwdWeightsAlgoGEMM:gemm,214,465,14450688,MIOpenGEMM
128-28-28-1x1-512-28-28-64-0x0-1x1-1x1-0-NCHW-FP32-F=miopenConvolutionFwdAlgoImplicitGEMM:ConvHipImplicitGemmV4R4Fwd,1,11914,0,miopenConvolutionFwdAlgoImplicitGEMM;miopenConvolutionFwdAlgoDirect:ConvAsm1x1U,1,34394,0,miopenConvolutionFwdAlgoDirect;miopenConvolutionFwdAlgoWinograd:ConvBinWinogradRxSf3x2,2,81943,0,miopenConvolutionFwdAlgoWinograd;miopenConvolutionFwdAlgoGEMM:GemmFwd1x1_0_1,2,82098,0,MIOpenGEMM
256-256-256-3x3-256-256-256-2-1x1-1x1-1x1-0-NCHW-FP32-F=miopenConvolutionFwdAlgoWinograd:ConvBinWinogradRxS,8,4778,0,miopenConvolutionFwdAlgoWinograd
21-28-28-1x1-256-28-28-64-0x0-1x1-1x1-0-NCHW-FP32-W=miopenConvolutionBwdWeightsAlgoDirect:ConvOclBwdWrW53,1,14503,1376256,miopenConvolutionBwdWeightsAlgoDirect;miopenConvolutionBwdWeightsAlgoGEMM:gemm,3,26162,0,MIOpenGEMM;miopenConvolutionBwdWeightsAlgoWinograd:ConvBinWinogradRxSf2x3,5,21007,0,miopenConvolutionBwdWeightsAlgoWinograd
64-56-56-3x3-64-56-56-64-1x1-1x1-1x1-0-NCHW-FP32-F=miopenConvolutionFwdAlgoWinograd:ConvBinWinograd3x3U,1,25248,0,miopenConvolutionFwdAlgoWinograd;miopenConvolutionFwdAlgoGEMM:GemmFwdRest,8,3629,7225344,MIOpenGEMM
2048-28-28-1x1-512-28-28-64-0x0-1x1-1x1-0-NCHW-FP32-F=miopenConvolutionFwdAlgoDirect:ConvAsm1x1U,27,7598,0,miopenConvolutionFwdAlgoDirect
1024-1-1-7x7-256-7-7-400-0x0-1x1-1x1-0-NCHW-FP32-W=miopenConvolutionBwdWeightsAlgoWinograd:ConvBinWinogradRxS,7,15937,0,miopenConvolutionBwdWeightsAlgoWinograd;miopenConvolutionBwdWeightsAlgoDirect:ConvOclBwdWrW53,49,744,0,miopenConvolutionBwdWeightsAlgoDirect;miopenConvolutionBwdWeightsAlgoGEMM:gemm,265,838,50176,MIOpenGEMM
512-28-28-3x3-512-28-28-64-2x2-1x1-2x2-0-NCHW-FP32-B=miopenConvolutionBwdDataAlgoImplicitGEMM:ConvHipImplicitGemmBwdDataV1R1,84,3908,0,miopenConvolutionBwdDataAlgoImplicitGEMM;miopenConvolutionBwdDataAlgoGEMM:gemm,459,498,14450688,MIOpenGEMM
256-28-28-1x1-1024-28-28-64-0x0-1x1-1x1-0-NCHW-FP32-B=miopenConvolutionBwdDataAlgoDirect:ConvAsm1x1U,4,50552,0,miopenConvolutionBwdDataAlgoDirect;miopenConvolutionBwdDataAlgoWinograd:ConvBinWinogradRxSf3x2,10,1369,0,miopenConvolutionBwdDataAlgoWinograd;miopenConvolutionBwdDataAlgoGEMM:gemm,12,2474,0,MIOpenGEMM
256-14-14-3x3-256-14-14-400-1x1-1x1-1x1-0-NCHW-FP32-W=miopenConvolutionBwdWeightsAlgoWinograd:ConvBinWinogradRxS,16,6483,0,miopenConvolutionBwdWeightsAlgoWinograd;miopenConvolutionBwdWeightsAlgoDirect:ConvAsmBwdWrW3x3,17,1938,0,miopenConvolutionBwdWeightsAlgoDirect;miopenConvolutionBwdWeightsAlgoImplicitGEMM:ConvHipImplicitGemmV4R1WrW,27,6324,0,miopenConvolutionBwdWeightsAlgoImplicitGEMM;miopenConvolutionBwdWeightsAlgoGEMM:gemm,949,808,1806336,MIOpenGEMM
1024-28-28-1x1-512-28-28-64-0x0-1x1-1x1-0-NCHW-FP32-W=miopenConvolutionBwdWeightsAlgoDirect:ConvAsmBwdWrW1x1,14,293,0,miopenConvolutionBwdWeightsAlgoDirect;miopenConvolutionBwdWeightsAlgoWinograd:ConvBinWinogradRxSf2x3,101,82,0,miopenConvolutionBwdWeightsAlgoWinograd
128-56-56-1x1-256-56-56-64-0x0-1x1-1x1-0-NCHW-FP32-W=miopenConvolutionBwdWeightsAlgoDirect:ConvAsmBwdWrW1x1,2,86341,0,miopenConvolutionBwdWeightsAlgoDirect
256-28-28-3x3-2048-28-28-64-36x36-1x1-36x36-0-NCHW-FP32-W=miopenConvolutionBwdWeightsAlgoImplicitGEMM:ConvHipImplicitGemmV4R1WrW,139,803,0,miopenConvolutionBwdWeightsAlgoImplicitGEMM;miopenConvolutionBwdWeightsAlgoGEMM:gemm,1069,83,57802752,MIOpenGEMM
128-28-28-3x3-128-28-28-64-1x1-1x1-1x1-0-NCHW-FP32-W=miopenConvolutionBwdWeightsAlgoDirect:ConvOclBwdWrW53,2,53996,0,miopenConvolutionBwdWeightsAlgoDirect;miopenConvolutionBwdWeightsAlgoWinograd:ConvBinWinogradRxS,3,9825,0,miopenConvolutionBwdWeightsAlgoWinograd;miopenConvolutionBwdWeightsAlgoGEMM:gemm,6,57023,3612672,MIOpenGEMM;miopenConvolutionBwdWeightsAlgoImplicitGEMM:ConvHipImplicitGemmV4R1WrW,10,1421,0,miopenConvolutionBwdWeightsAlgoImplicitGEMM
2048-28-28-1x1-256-28-28-64-0x0-1x1-1x1-0-NCHW-FP32-F=miopenConvolutionFwdAlgoDirect:ConvAsm1x1U,16,209,0,miopenConvolutionFwdAlgoDirect
256-14-14-3x3-256-14-14-400-1x1-1x1-1x1-0-NCHW-FP32-B=miopenConvolutionBwdDataAlgoWinograd:ConvBinWinograd3x3U,7,99323,0,miopenConvolutionBwdDataAlgoWinograd
512-28-28-3x3-512-28-28-64-2x2-1x1-2x2-0-NCHW-FP32-F=miopenConvolutionFwdAlgoImplicitGEMM:ConvHipImplicitGemmV4R1Fwd,106,766,0,miopenConvolutionFwdAlgoImplicitGEMM;miopenConvolutionFwdAlgoGEMM:GemmFwdRest,528,52,14450688,MIOpenGEMM
128-28-28-3x3-128-28-28-64-1x1-1x1-1x1-0-NCHW-FP32-B=miopenConvolutionBwdDataAlgoWinograd:ConvBinWinograd3x3U,1,22307,0,miopenConvolutionBwdDataAlgoWinograd;miopenConvolutionBwdDataAlgoGEMM:gemm,9,32611,3612672,MIOpenGEMM
64-56-56-1x1-64-56-56-64-0x0-1x1-1x1-0-NCHW-FP32-W=miopenConvolutionBwdWeightsAlgoDirect:ConvAsmBwdWrW1x1,0,783999,0,miopenConvolutionBwdWeightsAlgoDirect
128-28-28-3x3-128-28-28-64-1x1-1x1-1x1-0-NCHW-FP32-F=miopenConvolutionFwdAlgoWinograd:ConvBinWinograd3x3U,1,22264,0,miopenConvolutionFwdAlgoWinograd;miopenConvolutionFwdAlgoGEMM:GemmFwdRest,9,7114,3612672,MIOpenGEMM
2048-28-28-3x3-256-28-28-32-12x12-1x1-12x12-0-NCHW-FP32-F=miopenConvolutionFwdAlgoImplicitGEMM:ConvHipImplicitGemmV4R1Fwd,53,3243,0,miopenConvolutionFwdAlgoImplicitGEMM;miopenConvolutionFwdAlgoGEMM:GemmFwdRest,194,226,57802752,MIOpenGEMM
1024-1-1-7x7-256-7-7-400-0x0-1x1-1x1-0-NCHW-FP32-B=miopenConvolutionBwdDataAlgoWinograd:ConvBinWinogradRxSf3x2,72,2351,0,miopenConvolutionBwdDataAlgoWinograd;miopenConvolutionBwdDataAlgoDirect:ConvOclDirectFwd,258,73,0,miopenConvolutionBwdDataAlgoDirect;miopenConvolutionBwdDataAlgoGEMM:gemm,1918,12,50176,MIOpenGEMM
128-28-28-3x3-128-56-56-32-1x1-2x2-1x1-0-NCHW-FP32-W=miopenConvolutionBwdWeightsAlgoDirect:ConvAsmBwdWrW3x3,3,47236,0,miopenConvolutionBwdWeightsAlgoDirect;miopenConvolutionBwdWeightsAlgoImplicitGEMM:ConvHipImplicitGemmV4R1WrW,6,26921,0,miopenConvolutionBwdWeightsAlgoImplicitGEMM;miopenConvolutionBwdWeightsAlgoGEMM:gemm,43,2058,3612672,MIOpenGEMM
128-56-56-1x1-256-56-56-64-0x0-1x1-1x1-0-NCHW-FP32-B=miopenConvolutionBwdDataAlgoDirect:ConvAsm1x1U,4,69677,0,miopenConvolutionBwdDataAlgoDirect;miopenConvolutionBwdDataAlgoGEMM:gemm,25,8578,0,MIOpenGEMM
1024-28-28-1x1-512-28-28-64-0x0-1x1-1x1-0-NCHW-FP32-B=miopenConvolutionBwdDataAlgoDirect:ConvAsm1x1U,24,4054,0,miopenConvolutionBwdDataAlgoDirect
256-1-1-1x1-2048-1-1-64-0x0-1x1-1x1-0-NCHW-FP32-W=miopenConvolutionBwdWeightsAlgoDirect:ConvAsmBwdWrW1x1,0,53494,0,miopenConvolutionBwdWeightsAlgoDirect;miopenConvolutionBwdWeightsAlgoGEMM:gemm,4,10366,0,MIOpenGEMM
21-28-28-1x1-256-28-28-64-0x0-1x1-1x1-0-NCHW-FP32-B=miopenConvolutionBwdDataAlgoDirect:ConvAsm1x1U,0,29106,0,miopenConvolutionBwdDataAlgoDirect;miopenConvolutionBwdDataAlgoGEMM:gemm,1,15673,0,MIOpenGEMM;miopenConvolutionBwdDataAlgoWinograd:ConvBinWinogradRxSf2x3,5,38868,0,miopenConvolutionBwdDataAlgoWinograd
256-28-28-3x3-2048-28-28-64-36x36-1x1-36x36-0-NCHW-FP32-B=miopenConvolutionBwdDataAlgoImplicitGEMM:ConvHipImplicitGemmBwdDataV1R1,94,2187,0,miopenConvolutionBwdDataAlgoImplicitGEMM;miopenConvolutionBwdDataAlgoGEMM:gemm,727,678,57802752,MIOpenGEMM
64-56-56-1x1-64-56-56-64-0x0-1x1-1x1-0-NCHW-FP32-B=miopenConvolutionBwdDataAlgoDirect:ConvAsm1x1U,0,304211,0,miopenConvolutionBwdDataAlgoDirect;miopenConvolutionBwdDataAlgoWinograd:ConvBinWinogradRxSf3x2,0,770177,0,miopenConvolutionBwdDataAlgoWinograd;miopenConvolutionBwdDataAlgoGEMM:gemm,1,15503,0,MIOpenGEMM
256-256-256-1x1-256-256-256-2-0x0-1x1-1x1-0-NCHW-FP32-W=miopenConvolutionBwdWeightsAlgoGEMM:gemm,12,9724,0,MIOpenGEMM
256-14-14-3x3-256-14-14-400-1x1-1x1-1x1-0-NCHW-FP32-F=miopenConvolutionFwdAlgoWinograd:ConvBinWinogradRxS,7,1017,0,miopenConvolutionFwdAlgoWinograd
256-28-28-1x1-512-28-28-64-0x0-1x1-1x1-0-NCHW-FP32-W=miopenConvolutionBwdWeightsAlgoDirect:ConvAsmBwdWrW1x1,6,13952,0,miopenConvolutionBwdWeightsAlgoDirect;miopenConvolutionBwdWeightsAlgoGEMM:gemm,38,7874,0,MIOpenGEMM;miopenConvolutionBwdWeightsAlgoWinograd:ConvBinWinogradRxSf2x3,44,672,0,miopenConvolutionBwdWeightsAlgoWinograd
128-28-28-3x3-128-56-56-32-1x1-2x2-1x1-0-NCHW-FP32-B=miopenConvolutionBwdDataAlgoWinograd:ConvBinWinogradRxSf2x3,2,94765,0,miopenConvolutionBwdDataAlgoWinograd;miopenConvolutionBwdDataAlgoImplicitGEMM:ConvHipImplicitGemmBwdDataV1R1,10,1572,0,miopenConvolutionBwdDataAlgoImplicitGEMM;miopenConvolutionBwdDataAlgoDirect:ConvOclDirectFwd,10,8226,0,miopenConvolutionBwdDataAlgoDirect;miopenConvolutionBwdDataAlgoGEMM:gemm,40,4719,3612672,MIOpenGEMM
256-28-28-1x1-21-28-28-64-0x0-1x1-1x1-0-NCHW-FP32-F=miopenConvolutionFwdAlgoWinograd:ConvBinWinogradRxSf3x2,0,371262,0,miopenConvolutionFwdAlgoWinograd;miopenConvolutionFwdAlgoDirect:ConvAsm1x1U,0,988938,0,miopenConvolutionFwdAlgoDirect;miopenConvolutionFwdAlgoGEMM:GemmFwd1x1_0_1,5,50198,0,MIOpenGEMM
2048-28-28-3x3-256-28-28-64-36x36-1x1-36x36-0-NCHW-FP32-F=miopenConvolutionFwdAlgoImplicitGEMM:ConvHipImplicitGemmV4R1Fwd,79,6488,0,miopenConvolutionFwdAlgoImplicitGEMM;miopenConvolutionFwdAlgoGEMM:GemmFwdRest,1948,5,57802752,MIOpenGEMM
256-28-28-1x1-2048-28-28-32-0x0-1x1-1x1-0-NCHW-FP32-W=miopenConvolutionBwdWeightsAlgoDirect:ConvAsmBwdWrW1x1,7,71416,0,miopenConvolutionBwdWeightsAlgoDirect;miopenConvolutionBwdWeightsAlgoWinograd:ConvBinWinogradRxSf2x3,44,3719,0,miopenConvolutionBwdWeightsAlgoWinograd
256-56-56-1x1-128-56-56-64-0x0-1x1-1x1-0-NCHW-FP32-F=miopenConvolutionFwdAlgoDirect:ConvAsm1x1U,4,17327,0,miopenConvolutionFwdAlgoDirect
512-28-28-1x1-1024-28-28-32-0x0-1x1-1x1-0-NCHW-FP32-B=miopenConvolutionBwdDataAlgoDirect:ConvAsm1x1U,8,16977,0,miopenConvolutionBwdDataAlgoDirect
256-7-7-7x7-1024-1-1-400-0x0-1x1-1x1-0-NCHW-FP32-F=miopenConvolutionFwdAlgoWinograd:ConvBinWinogradRxSf2x3,14,5451,0,miopenConvolutionFwdAlgoWinograd;miopenConvolutionFwdAlgoDirect:ConvOclDirectFwd,341,219,0,miopenConvolutionFwdAlgoDirect;miopenConvolutionFwdAlgoGEMM:GemmFwdRest,1839,38,50176,MIOpenGEMM
1024-28-28-1x1-256-28-28-64-0x0-1x1-1x1-0-NCHW-FP32-F=miopenConvolutionFwdAlgoDirect:ConvAsm1x1U,6,68922,0,miopenConvolutionFwdAlgoDirect;miopenConvolutionFwdAlgoWinograd:ConvBinWinogradRxSf2x3,12,6529,0,miopenConvolutionFwdAlgoWinograd;miopenConvolutionFwdAlgoGEMM:GemmFwd1x1_0_1,17,7623,0,MIOpenGEMM
512-28-28-1x1-1024-28-28-64-0x0-1x1-1x1-0-NCHW-FP32-F=miopenConvolutionFwdAlgoDirect:ConvAsm1x1U,11,5892,0,miopenConvolutionFwdAlgoDirect
128-56-56-3x3-128-28-28-32-1x1-2x2-1x1-0-NCHW-FP32-F=miopenConvolutionFwdAlgoWinograd:ConvBinWinogradRxSf2x3,4,68,0,miopenConvolutionFwdAlgoWinograd;miopenConvolutionFwdAlgoImplicitGEMM:ConvHipImplicitGemmV4R1Fwd,13,5271,0,miopenConvolutionFwdAlgoImplicitGEMM;miopenConvolutionFwdAlgoDirect:ConvOclDirectFwd,60,1015,0,miopenConvolutionFwdAlgoDirect;miopenConvolutionFwdAlgoGEMM:GemmFwdRest,129,286,3612672,MIOpenGEMM
256-1-1-1x1-2048-1-1-64-0x0-1x1-1x1-0-NCHW-FP32-B=miopenConvolutionBwdDataAlgoWinograd:ConvBinWinogradRxSf2x3,0,157844,0,miopenConvolutionBwdDataAlgoWinograd;miopenConvolutionBwdDataAlgoGEMM:gemm,10,9204,0,MIOpenGEMM
64-56-56-1x1-64-56-56-64-0x0-1x1-1x1-0-NCHW-FP32-F=miopenConvolutionFwdAlgoDirect:ConvAsm1x1U,0,338443,0,miopenConvolutionFwdAlgoDirect;miopenConvolutionFwdAlgoWinograd:ConvBinWinogradRxSf3x2,0,724774,0,miopenConvolutionFwdAlgoWinograd;miopenConvolutionFwdAlgoGEMM:GemmFwd1x1_0_1,1,26765,0,MIOpenGEMM
256-28-28-3x3-256-28-28-64-2x2-1x1-2x2-0-NCHW-FP32-W=miopenConvolutionBwdWeightsAlgoImplicitGEMM:ConvHipImplicitGemmV4R1WrW,52,961,0,miopenConvolutionBwdWeightsAlgoImplicitGEMM;miopenConvolutionBwdWeightsAlgoGEMM:gemm,210,758,7225344,MIOpenGEMM
512-28-28-1x1-1024-28-28-64-0x0-1x1-1x1-0-NCHW-FP32-W=miopenConvolutionBwdWeightsAlgoDirect:ConvAsmBwdWrW1x1,19,3798,0,miopenConvolutionBwdWeightsAlgoDirect;miopenConvolutionBwdWeightsAlgoWinograd:ConvBinWinogradRxSf2x3,117,133,0,miopenConvolutionBwdWeightsAlgoWinograd
256-28-28-3x3-2048-28-28-64-24x24-1x1-24x24-0-NCHW-FP32-W=miopenConvolutionBwdWeightsAlgoImplicitGEMM:ConvHipImplicitGemmV4R1WrW,199,331,0,miopenConvolutionBwdWeightsAlgoImplicitGEMM;miopenConvolutionBwdWeightsAlgoGEMM:gemm,934,894,57802752,MIOpenGEMM
256-28-28-1x1-512-28-28-64-0x0-1x1-1x1-0-NCHW-FP32-B=miopenConvolutionBwdDataAlgoDirect:ConvAsm1x1U,4,78349,0,miopenConvolutionBwdDataAlgoDirect
512-28-28-1x1-2048-28-28-32-0x0-1x1-1x1-0-NCHW-FP32-B=miopenConvolutionBwdDataAlgoDirect:ConvAsm1x1U,8,32373,0,miopenConvolutionBwdDataAlgoDirect;miopenConvolutionBwdDataAlgoGEMM:gemm,9,803,0,MIOpenGEMM;miopenConvolutionBwdDataAlgoImplicitGEMM:ConvHipImplicitGemmBwdDataV1R1,9,52484,0,miopenConvolutionBwdDataAlgoImplicitGEMM;miopenConvolutionBwdDataAlgoWinograd:ConvBinWinogradRxSf3x2,13,4481,0,miopenConvolutionBwdDataAlgoWinograd
256-28-28-3x3-256-28-28-64-2x2-1x1-2x2-0-NCHW-FP32-B=miopenConvolutionBwdDataAlgoImplicitGEMM:ConvHipImplicitGemmBwdDataV1R1,39,2049,0,miopenConvolutionBwdDataAlgoImplicitGEMM;miopenConvolutionBwdDataAlgoGEMM:gemm,250,78,7225344,MIOpenGEMM
256-28-28-1x1-2048-28-28-32-0x0-1x1-1x1-0-NCHW-FP32-B=miopenConvolutionBwdDataAlgoDirect:ConvAsm1x1U,11,7339,0,miopenConvolutionBwdDataAlgoDirect
2048-1-1-1x1-256-1-1-64-0x0-1x1-1x1-0-NCHW-FP32-F=miopenConvolutionFwdAlgoDirect:ConvOclDirectFwd1x1,2,3278,0,miopenConvolutionFwdAlgoDirect;miopenConvolutionFwdAlgoGEMM:GemmFwd1x1_0_1,21,8115,0,MIOpenGEMM
64-112-112-7x7-3-224-224-64-3x3-2x2-1x1-0-NCHW-FP32-W=miopenConvolutionBwdWeightsAlgoDirect:ConvOclBwdWrW2<2>,7,94365,1204224,miopenConvolutionBwdWeightsAlgoDirect;miopenConvolutionBwdWeightsAlgoGEMM:gemm,92,6598,7375872,MIOpenGEMM
512-28-28-1x1-128-28-28-32-0x0-1x1-1x1-0-NCHW-FP32-W=miopenConvolutionBwdWeightsAlgoDirect:ConvAsmBwdWrW1x1,1,1608,0,miopenConvolutionBwdWeightsAlgoDirect;miopenConvolutionBwdWeightsAlgoGEMM:gemm,20,9592,0,MIOpenGEMM
256-56-56-1x1-64-56-56-64-0x0-1x1-1x1-0-NCHW-FP32-W=miopenConvolutionBwdWeightsAlgoDirect:ConvAsmBwdWrW1x1,1,92382,0,miopenConvolutionBwdWeightsAlgoDirect
256-56-56-1x1-64-56-56-32-0x0-1x1-1x1-0-NCHW-FP32-F=miopenConvolutionFwdAlgoDirect:ConvOclDirectFwd1x1,0,651607,0,miopenConvolutionFwdAlgoDirect;miopenConvolutionFwdAlgoWinograd:ConvBinWinogradRxSf3x2,1,27088,0,miopenConvolutionFwdAlgoWinograd;miopenConvolutionFwdAlgoGEMM:GemmFwd1x1_0_1,1,66484,0,MIOpenGEMM
256-28-28-3x3-256-28-28-64-2x2-1x1-2x2-0-NCHW-FP32-F=miopenConvolutionFwdAlgoImplicitGEMM:ConvHipImplicitGemmV4R1Fwd,33,6648,0,miopenConvolutionFwdAlgoImplicitGEMM;miopenConvolutionFwdAlgoGEMM:GemmFwdRest,226,754,7225344,MIOpenGEMM
256-28-28-3x3-256-28-28-32-1x1-1x1-1x1-0-NCHW-FP32-W=miopenConvolutionBwdWeightsAlgoWinograd:ConvBinWinogradRxS,2,47608,0,miopenConvolutionBwdWeightsAlgoWinograd;miopenConvolutionBwdWeightsAlgoDirect:ConvAsmBwdWrW3x3,5,14892,0,miopenConvolutionBwdWeightsAlgoDirect;miopenConvolutionBwdWeightsAlgoGEMM:gemm,9,41659,7225344,MIOpenGEMM;miopenConvolutionBwdWeightsAlgoImplicitGEMM:ConvHipImplicitGemmV4R1WrW,9,64018,0,miopenConvolutionBwdWeightsAlgoImplicitGEMM
1024-1-1-1x1-1024-1-1-400-0x0-1x1-1x1-0-NCHW-FP32-W=miopenConvolutionBwdWeightsAlgoDirect:ConvAsmBwdWrW1x1,0,46683,0,miopenConvolutionBwdWeightsAlgoDirect;miopenConvolutionBwdWeightsAlgoWinograd:ConvBinWinogradRxSf2x3,2,4163,0,miopenConvolutionBwdWeightsAlgoWinograd;miopenConvolutionBwdWeightsAlgoGEMM:gemm,11,5777,0,MIOpenGEMM
512-28-28-1x1-256-28-28-64-0x0-1x1-1x1-0-NCHW-FP32-F=miopenConvolutionFwdAlgoDirect:ConvAsm1x1U,2,84394,0,miopenConvolutionFwdAlgoDirect
64-112-112-7x7-3-224-224-64-3x3-2x2-1x1-0-NCHW-FP32-B=miopenConvolutionBwdDataAlgoDirect:ConvOclDirectFwd,8,10783,0,miopenConvolutionBwdDataAlgoDirect;miopenConvolutionBwdDataAlgoWinograd:ConvBinWinogradRxS,9,3499,0,miopenConvolutionBwdDataAlgoWinograd;miopenConvolutionBwdDataAlgoGEMM:gemm,92,452,7375872,MIOpenGEMM
1024-28-28-1x1-256-28-28-64-0x0-1x1-1x1-0-NCHW-FP32-W=miopenConvolutionBwdWeightsAlgoDirect:ConvAsmBwdWrW1x1,10,4456,0,miopenConvolutionBwdWeightsAlgoDirect;miopenConvolutionBwdWeightsAlgoGEMM:gemm,23,4041,0,MIOpenGEMM;miopenConvolutionBwdWeightsAlgoWinograd:ConvBinWinogradRxSf2x3,57,3765,0,miopenConvolutionBwdWeightsAlgoWinograd
256-28-28-3x3-2048-28-28-64-24x24-1x1-24x24-0-NCHW-FP32-B=miopenConvolutionBwdDataAlgoImplicitGEMM:ConvHipImplicitGemmBwdDataV1R1,79,2571,0,miopenConvolutionBwdDataAlgoImplicitGEMM;miopenConvolutionBwdDataAlgoGEMM:gemm,350,94,57802752,MIOpenGEMM
256-28-28-3x3-256-28-28-32-1x1-1x1-1x1-0-NCHW-FP32-B=miopenConvolutionBwdDataAlgoWinograd:ConvBinWinogradRxSf2x3,2,32491,0,miopenConvolutionBwdDataAlgoWinograd;miopenConvolutionBwdDataAlgoGEMM:gemm,11,5876,7225344,MIOpenGEMM
512-28-28-1x1-128-28-28-32-0x0-1x1-1x1-0-NCHW-FP32-B=miopenConvolutionBwdDataAlgoWinograd:ConvBinWinogradRxSf3x2,1,26551,0,miopenConvolutionBwdDataAlgoWinograd
512-28-28-3x3-512-28-28-32-2x2-1x1-2x2-0-NCHW-FP32-W=miopenConvolutionBwdWeightsAlgoImplicitGEMM:ConvHipImplicitGemmV4R1WrW,22,6406,0,miopenConvolutionBwdWeightsAlgoImplicitGEMM;miopenConvolutionBwdWeightsAlgoGEMM:gemm,24,9346,14450688,MIOpenGEMM
256-56-56-1x1-64-56-56-64-0x0-1x1-1x1-0-NCHW-FP32-B=miopenConvolutionBwdDataAlgoDirect:ConvAsm1x1U,1,5244,0,miopenConvolutionBwdDataAlgoDirect;miopenConvolutionBwdDataAlgoGEMM:gemm,2,12675,0,MIOpenGEMM;miopenConvolutionBwdDataAlgoWinograd:ConvBinWinogradRxSf3x2,2,38647,0,miopenConvolutionBwdDataAlgoWinograd
1024-28-28-1x1-512-28-28-32-0x0-1x1-1x1-0-NCHW-FP32-F=miopenConvolutionFwdAlgoDirect:ConvAsm1x1U,6,6737,0,miopenConvolutionFwdAlgoDirect;miopenConvolutionFwdAlgoGEMM:GemmFwd1x1_0_1,10,2547,0,MIOpenGEMM;miopenConvolutionFwdAlgoWinograd:ConvBinWinogradRxSf3x2,10,4498,0,miopenConvolutionFwdAlgoWinograd
64-56-56-3x3-64-56-56-32-1x1-1x1-1x1-0-NCHW-FP32-F=miopenConvolutionFwdAlgoWinograd:ConvBinWinograd3x3U,0,677073,0,miopenConvolutionFwdAlgoWinograd;miopenConvolutionFwdAlgoGEMM:GemmFwdRest,4,20064,7225344,MIOpenGEMM
256-28-28-3x3-256-28-28-32-1x1-1x1-1x1-0-NCHW-FP32-F=miopenConvolutionFwdAlgoWinograd:ConvBinWinogradRxSf2x3,2,32934,0,miopenConvolutionFwdAlgoWinograd;miopenConvolutionFwdAlgoGEMM:GemmFwdRest,11,5219,7225344,MIOpenGEMM
128-28-28-1x1-512-28-28-32-0x0-1x1-1x1-0-NCHW-FP32-B=miopenConvolutionBwdDataAlgoDirect:ConvAsm1x1U,0,535583,0,miopenConvolutionBwdDataAlgoDirect;miopenConvolutionBwdDataAlgoGEMM:gemm,1,41468,0,MIOpenGEMM;miopenConvolutionBwdDataAlgoWinograd:ConvBinWinogradRxSf3x2,1,43206,0,miopenConvolutionBwdDataAlgoWinograd
2048-28-28-3x3-256-28-28-64-24x24-1x1-24x24-0-NCHW-FP32-F=miopenConvolutionFwdAlgoImplicitGEMM:ConvHipImplicitGemmV4R1Fwd,103,159,0,miopenConvolutionFwdAlgoImplicitGEMM;miopenConvolutionFwdAlgoGEMM:GemmFwdRest,975,781,57802752,MIOpenGEMM
2048-28-28-1x1-256-28-28-32-0x0-1x1-1x1-0-NCHW-FP32-F=miopenConvolutionFwdAlgoDirect:ConvAsm1x1U,5,60288,0,miopenConvolutionFwdAlgoDirect
3-224-224-7x7-64-112-112-64-3x3-2x2-1x1-0-NCHW-FP32-F=miopenConvolutionFwdAlgoDirect:ConvAsm7x7c3h224w224k64u2v2p3q3f1,1,85087,0,miopenConvolutionFwdAlgoDirect;miopenConvolutionFwdAlgoWinograd:ConvBinWinogradRxS,4,7254,0,miopenConvolutionFwdAlgoWinograd;miopenConvolutionFwdAlgoGEMM:GemmFwdRest,61,587,7375872,MIOpenGEMM
256-28-28-1x1-1280-28-28-64-0x0-1x1-1x1-0-NCHW-FP32-W=miopenConvolutionBwdWeightsAlgoDirect:ConvAsmBwdWrW1x1,7,68413,0,miopenConvolutionBwdWeightsAlgoDirect;miopenConvolutionBwdWeightsAlgoWinograd:ConvBinWinogradRxSf2x3,58,4543,0,miopenConvolutionBwdWeightsAlgoWinograd
21-28-28-1x1-256-28-28-32-0x0-1x1-1x1-0-NCHW-FP32-W=miopenConvolutionBwdWeightsAlgoDirect:ConvAsmBwdWrW1x1,0,157816,0,miopenConvolutionBwdWeightsAlgoDirect;miopenConvolutionBwdWeightsAlgoGEMM:gemm,0,905355,0,MIOpenGEMM;miopenConvolutionBwdWeightsAlgoWinograd:ConvBinWinogradRxSf2x3,1,24934,0,miopenConvolutionBwdWeightsAlgoWinograd
512-28-28-3x3-512-28-28-32-2x2-1x1-2x2-0-NCHW-FP32-B=miopenConvolutionBwdDataAlgoImplicitGEMM:ConvHipImplicitGemmBwdDataV4R1,24,2373,0,miopenConvolutionBwdDataAlgoImplicitGEMM;miopenConvolutionBwdDataAlgoGEMM:gemm,24,6266,14450688,MIOpenGEMM
256-1-1-1x1-2048-1-1-32-0x0-1x1-1x1-0-NCHW-FP32-W=miopenConvolutionBwdWeightsAlgoDirect:ConvAsmBwdWrW1x1,0,51062,0,miopenConvolutionBwdWeightsAlgoDirect;miopenConvolutionBwdWeightsAlgoGEMM:gemm,2,19056,0,MIOpenGEMM
512-28-28-3x3-512-28-28-32-2x2-1x1-2x2-0-NCHW-FP32-F=miopenConvolutionFwdAlgoImplicitGEMM:ConvHipImplicitGemmV4R1Fwd,19,5183,0,miopenConvolutionFwdAlgoImplicitGEMM;miopenConvolutionFwdAlgoGEMM:GemmFwdRest,28,3687,14450688,MIOpenGEMM
64-56-56-1x1-64-56-56-32-0x0-1x1-1x1-0-NCHW-FP32-W=miopenConvolutionBwdWeightsAlgoDirect:ConvAsmBwdWrW1x1,0,402423,0,miopenConvolutionBwdWeightsAlgoDirect
256-28-28-3x3-2048-28-28-64-12x12-1x1-12x12-0-NCHW-FP32-W=miopenConvolutionBwdWeightsAlgoImplicitGEMM:ConvHipImplicitGemmV4R1WrW,197,488,0,miopenConvolutionBwdWeightsAlgoImplicitGEMM;miopenConvolutionBwdWeightsAlgoGEMM:gemm,1014,21,57802752,MIOpenGEMM
256-28-28-1x1-1024-28-28-32-0x0-1x1-1x1-0-NCHW-FP32-W=miopenConvolutionBwdWeightsAlgoDirect:ConvAsmBwdWrW1x1,2,63702,0,miopenConvolutionBwdWeightsAlgoDirect
512-28-28-1x1-128-28-28-32-0x0-1x1-1x1-0-NCHW-FP32-F=miopenConvolutionFwdAlgoDirect:ConvOclDirectFwd1x1,0,729045,0,miopenConvolutionFwdAlgoDirect;miopenConvolutionFwdAlgoWinograd:ConvBinWinogradRxSf3x2,1,41074,0,miopenConvolutionFwdAlgoWinograd;miopenConvolutionFwdAlgoGEMM:GemmFwd1x1_0_1,1,96029,0,MIOpenGEMM
128-28-28-1x1-512-28-28-32-0x0-1x1-1x1-0-NCHW-FP32-F=miopenConvolutionFwdAlgoWinograd:ConvBinWinogradRxSf3x2,1,24399,0,miopenConvolutionFwdAlgoWinograd
21-28-28-1x1-256-28-28-32-0x0-1x1-1x1-0-NCHW-FP32-B=miopenConvolutionBwdDataAlgoDirect:ConvAsm1x1U,0,91651,0,miopenConvolutionBwdDataAlgoDirect;miopenConvolutionBwdDataAlgoWinograd:ConvBinWinogradRxSf2x3,0,307961,0,miopenConvolutionBwdDataAlgoWinograd;miopenConvolutionBwdDataAlgoGEMM:gemm,0,359405,0,MIOpenGEMM
2048-28-28-1x1-512-28-28-32-0x0-1x1-1x1-0-NCHW-FP32-F=miopenConvolutionFwdAlgoGEMM:GemmFwd1x1_0_1,9,18217,0,MIOpenGEMM;miopenConvolutionFwdAlgoWinograd:ConvBinWinogradRxSf3x2,12,8441,0,miopenConvolutionFwdAlgoWinograd;miopenConvolutionFwdAlgoDirect:ConvOclDirectFwd1x1,16,4839,0,miopenConvolutionFwdAlgoDirect
64-56-56-1x1-256-56-56-64-0x0-1x1-1x1-0-NCHW-FP32-F=miopenConvolutionFwdAlgoImplicitGEMM:ConvHipImplicitGemmV4R4Fwd,1,15935,0,miopenConvolutionFwdAlgoImplicitGEMM;miopenConvolutionFwdAlgoDirect:ConvAsm1x1U,1,26184,0,miopenConvolutionFwdAlgoDirect;miopenConvolutionFwdAlgoGEMM:GemmFwd1x1_0_1,2,12921,0,MIOpenGEMM;miopenConvolutionFwdAlgoWinograd:ConvBinWinogradRxSf3x2,2,87081,0,miopenConvolutionFwdAlgoWinograd
2048-28-28-1x1-512-28-28-64-0x0-1x1-1x1-0-NCHW-FP32-W=miopenConvolutionBwdWeightsAlgoGEMM:gemm,29,4425,0,MIOpenGEMM;miopenConvolutionBwdWeightsAlgoDirect:ConvAsmBwdWrW1x1,40,348,0,miopenConvolutionBwdWeightsAlgoDirect;miopenConvolutionBwdWeightsAlgoWinograd:ConvBinWinogradRxSf2x3,233,451,0,miopenConvolutionBwdWeightsAlgoWinograd
256-1-1-1x1-2048-1-1-32-0x0-1x1-1x1-0-NCHW-FP32-B=miopenConvolutionBwdDataAlgoDirect:ConvOclDirectFwd1x1,0,96605,0,miopenConvolutionBwdDataAlgoDirect;miopenConvolutionBwdDataAlgoWinograd:ConvBinWinogradRxS,0,145268,0,miopenConvolutionBwdDataAlgoWinograd;miopenConvolutionBwdDataAlgoImplicitGEMM:ConvHipImplicitGemmBwdDataV1R1,0,668969,0,miopenConvolutionBwdDataAlgoImplicitGEMM;miopenConvolutionBwdDataAlgoGEMM:gemm,3,37461,0,MIOpenGEMM
256-28-28-1x1-1280-28-28-64-0x0-1x1-1x1-0-NCHW-FP32-B=miopenConvolutionBwdDataAlgoDirect:ConvAsm1x1U,6,89667,0,miopenConvolutionBwdDataAlgoDirect
512-28-28-3x3-512-28-28-64-4x4-1x1-4x4-0-NCHW-FP32-W=miopenConvolutionBwdWeightsAlgoImplicitGEMM:ConvHipImplicitGemmV4R1WrW,107,561,0,miopenConvolutionBwdWeightsAlgoImplicitGEMM;miopenConvolutionBwdWeightsAlgoGEMM:gemm,810,529,14450688,MIOpenGEMM
64-56-56-1x1-256-56-56-64-0x0-1x1-1x1-0-NCHW-FP32-W=miopenConvolutionBwdWeightsAlgoDirect:ConvOclBwdWrW1x1,2,81779,0,miopenConvolutionBwdWeightsAlgoDirect
1024-28-28-1x1-256-28-28-64-0x0-1x1-1x1-0-NCHW-FP32-B=miopenConvolutionBwdDataAlgoDirect:ConvAsm1x1U,9,23986,0,miopenConvolutionBwdDataAlgoDirect;miopenConvolutionBwdDataAlgoGEMM:gemm,55,602,0,MIOpenGEMM
