src/kernels/gfx908_120.HIP.fdb.txt
512-28-28-1x1-1024-28-28-32-0x0-1x1-1x1-0-NCHW-BF16-F=miopenConvolutionFwdAlgoImplicitGEMM:ConvHipImplicitGemmV4R4GenFwdXdlops,0.429079,0,miopenConvolutionFwdAlgoImplicitGEMM,<unused>
1024-14-14-3x3-1024-14-14-32-1x1-1x1-1x1-0-NCHW-BF16-F_g32=miopenConvolutionFwdAlgoImplicitGEMM:ConvHipImplicitGemmV4R4GenFwdXdlops,0.150068,0,miopenConvolutionFwdAlgoImplicitGEMM,<unused>;miopenConvolutionFwdAlgoDirect:ConvOclDirectFwd,0.585867,0,miopenConvolutionFwdAlgoDirect,<unused>
1024-14-14-1x1-2048-14-14-32-0x0-1x1-1x1-0-NCHW-BF16-F=miopenConvolutionFwdAlgoImplicitGEMM:ConvHipImplicitGemmV4R4GenFwdXdlops,0.38218,0,miopenConvolutionFwdAlgoImplicitGEMM,<unused>
1024-28-28-3x3-1024-14-14-32-1x1-2x2-1x1-0-NCHW-BF16-F_g32=miopenConvolutionFwdAlgoImplicitGEMM:ConvHipImplicitGemmV4R4GenFwdXdlops,0.166829,0,miopenConvolutionFwdAlgoImplicitGEMM,<unused>;miopenConvolutionFwdAlgoDirect:ConvOclDirectFwd,0.887052,0,miopenConvolutionFwdAlgoDirect,<unused>
2048-14-14-3x3-2048-7-7-32-1x1-2x2-1x1-0-NCHW-BF16-F_g32=miopenConvolutionFwdAlgoImplicitGEMM:ConvHipImplicitGemmV4R4GenFwdXdlops,0.138717,0,miopenConvolutionFwdAlgoImplicitGEMM,<unused>;miopenConvolutionFwdAlgoDirect:ConvOclDirectFwd,1.15005,0,miopenConvolutionFwdAlgoDirect,<unused>
2048-7-7-1x1-2048-7-7-32-0x0-1x1-1x1-0-NCHW-BF16-F=miopenConvolutionFwdAlgoImplicitGEMM:ConvHipImplicitGemmV4R4GenFwdXdlops,0.342574,0,miopenConvolutionFwdAlgoImplicitGEMM,<unused>
2048-7-7-3x3-2048-7-7-32-1x1-1x1-1x1-0-NCHW-BF16-F_g32=miopenConvolutionFwdAlgoImplicitGEMM:ConvHipImplicitGemmV4R4GenFwdXdlops,0.123113,0,miopenConvolutionFwdAlgoImplicitGEMM,<unused>;miopenConvolutionFwdAlgoDirect:ConvOclDirectFwd,0.786078,0,miopenConvolutionFwdAlgoDirect,<unused>
256-56-56-3x3-256-56-56-32-1x1-1x1-1x1-0-NCHW-BF16-F_g32=miopenConvolutionFwdAlgoDirect:ConvOclDirectFwd,0.627407,0,miopenConvolutionFwdAlgoDirect,<unused>
256-56-56-1x1-512-56-56-32-0x0-1x1-1x1-0-NCHW-BF16-F=miopenConvolutionFwdAlgoImplicitGEMM:ConvHipImplicitGemmV4R4GenFwdXdlops,0.447267,0,miopenConvolutionFwdAlgoImplicitGEMM,<unused>
512-28-28-3x3-512-28-28-32-1x1-1x1-1x1-0-NCHW-BF16-F_g32=miopenConvolutionFwdAlgoImplicitGEMM:ConvHipImplicitGemmV4R4GenFwdXdlops,0.256436,0,miopenConvolutionFwdAlgoImplicitGEMM,<unused>;miopenConvolutionFwdAlgoDirect:ConvOclDirectFwd,0.555291,0,miopenConvolutionFwdAlgoDirect,<unused>
512-56-56-3x3-512-28-28-32-1x1-2x2-1x1-0-NCHW-BF16-F_g32=miopenConvolutionFwdAlgoImplicitGEMM:ConvHipImplicitGemmV4R4GenFwdXdlops,0.317281,0,miopenConvolutionFwdAlgoImplicitGEMM,<unused>;miopenConvolutionFwdAlgoDirect:ConvOclDirectFwd,0.875587,0,miopenConvolutionFwdAlgoDirect,<unused>
1024-14-14-1x1-1024-14-14-32-0x0-1x1-1x1-0-NCHW-FP32-F=miopenConvolutionFwdAlgoImplicitGEMM:ConvHipImplicitGemmV4R4GenXdlopsFwdFp32,0.450529,0,miopenConvolutionFwdAlgoImplicitGEMM,<unused>;miopenConvolutionFwdAlgoDirect:ConvAsm1x1U,1.0668,0,miopenConvolutionFwdAlgoDirect,<unused>;miopenConvolutionFwdAlgoWinograd:ConvBinWinogradRxSf3x2,1.76166,0,miopenConvolutionFwdAlgoWinograd,<unused>
1024-14-14-1x1-2048-7-7-32-0x0-2x2-1x1-0-NCHW-FP32-F=miopenConvolutionFwdAlgoImplicitGEMM:ConvHipImplicitGemmV4R4GenXdlopsFwdFp32,0.477881,0,miopenConvolutionFwdAlgoImplicitGEMM,<unused>;miopenConvolutionFwdAlgoDirect:ConvAsm1x1U,0.648181,6422528,miopenConvolutionFwdAlgoDirect,<unused>;miopenConvolutionFwdAlgoWinograd:ConvBinWinogradRxSf2x3,4.25167,0,miopenConvolutionFwdAlgoWinograd,<unused>
256-56-56-1x1-256-56-56-32-0x0-1x1-1x1-0-NCHW-FP32-F=miopenConvolutionFwdAlgoImplicitGEMM:ConvHipImplicitGemmV4R4GenXdlopsFwdFp32,0.444333,0,miopenConvolutionFwdAlgoImplicitGEMM,<unused>;miopenConvolutionFwdAlgoDirect:ConvAsm1x1U,0.761101,0,miopenConvolutionFwdAlgoDirect,<unused>;miopenConvolutionFwdAlgoWinograd:ConvBinWinogradRxSf3x2,1.67339,0,miopenConvolutionFwdAlgoWinograd,<unused>
256-56-56-1x1-512-28-28-32-0x0-2x2-1x1-0-NCHW-FP32-F=miopenConvolutionFwdAlgoImplicitGEMM:ConvHipImplicitGemmV4R4GenXdlopsFwdFp32,0.348678,0,miopenConvolutionFwdAlgoImplicitGEMM,<unused>;miopenConvolutionFwdAlgoDirect:ConvAsm1x1U,0.501095,25690112,miopenConvolutionFwdAlgoDirect,<unused>;miopenConvolutionFwdAlgoWinograd:ConvBinWinogradRxSf2x3,3.33385,0,miopenConvolutionFwdAlgoWinograd,<unused>
3-224-224-7x7-64-112-112-32-3x3-2x2-1x1-0-NCHW-FP32-F=miopenConvolutionFwdAlgoDirect:ConvAsm7x7c3h224w224k64u2v2p3q3f1,0.478014,0,miopenConvolutionFwdAlgoDirect,<unused>;miopenConvolutionFwdAlgoWinograd:ConvBinWinogradRxS,0.692042,0,miopenConvolutionFwdAlgoWinograd,<unused>
512-28-28-1x1-1024-14-14-32-0x0-2x2-1x1-0-NCHW-FP32-F=miopenConvolutionFwdAlgoImplicitGEMM:ConvHipImplicitGemmV4R4GenXdlopsFwdFp32,0.302311,0,miopenConvolutionFwdAlgoImplicitGEMM,<unused>;miopenConvolutionFwdAlgoDirect:ConvAsm1x1U,0.611462,12845056,miopenConvolutionFwdAlgoDirect,<unused>;miopenConvolutionFwdAlgoWinograd:ConvBinWinogradRxSf2x3,3.37251,0,miopenConvolutionFwdAlgoWinograd,<unused>
512-28-28-1x1-512-28-28-32-0x0-1x1-1x1-0-NCHW-FP32-F=miopenConvolutionFwdAlgoImplicitGEMM:ConvHipImplicitGemmV4R4GenXdlopsFwdFp32,0.415724,0,miopenConvolutionFwdAlgoImplicitGEMM,<unused>;miopenConvolutionFwdAlgoDirect:ConvAsm1x1U,0.814978,0,miopenConvolutionFwdAlgoDirect,<unused>;miopenConvolutionFwdAlgoWinograd:ConvBinWinogradRxSf3x2,1.81515,0,miopenConvolutionFwdAlgoWinograd,<unused>
64-56-56-1x1-256-56-56-32-0x0-1x1-1x1-0-NCHW-FP32-F=miopenConvolutionFwdAlgoImplicitGEMM:ConvHipImplicitGemmV4R4GenXdlopsFwdFp32,0.186333,0,miopenConvolutionFwdAlgoImplicitGEMM,<unused>;miopenConvolutionFwdAlgoDirect:ConvAsm1x1U,0.213302,0,miopenConvolutionFwdAlgoDirect,<unused>;miopenConvolutionFwdAlgoWinograd:ConvBinWinogradRxSf3x2,0.552195,0,miopenConvolutionFwdAlgoWinograd,<unused>
1024-14-14-1x1-2048-14-14-32-0x0-1x1-1x1-0-NCHW-FP32-F=miopenConvolutionFwdAlgoImplicitGEMM:ConvHipImplicitGemmV4R4GenXdlopsFwdFp32,0.749374,0,miopenConvolutionFwdAlgoImplicitGEMM,<unused>;miopenConvolutionFwdAlgoDirect:ConvAsm1x1U,2.00955,0,miopenConvolutionFwdAlgoDirect,<unused>;miopenConvolutionFwdAlgoWinograd:ConvBinWinogradRxSf3x2,3.65768,0,miopenConvolutionFwdAlgoWinograd,<unused>
2048-7-7-1x1-2048-7-7-32-0x0-1x1-1x1-0-NCHW-FP32-F=miopenConvolutionFwdAlgoImplicitGEMM:ConvHipImplicitGemmV4R4GenXdlopsFwdFp32,0.792916,0,miopenConvolutionFwdAlgoImplicitGEMM,<unused>;miopenConvolutionFwdAlgoDirect:ConvAsm1x1U,1.26156,0,miopenConvolutionFwdAlgoDirect,<unused>;miopenConvolutionFwdAlgoWinograd:ConvBinWinogradRxSf3x2,2.47927,0,miopenConvolutionFwdAlgoWinograd,<unused>
256-56-56-1x1-512-56-56-32-0x0-1x1-1x1-0-NCHW-FP32-F=miopenConvolutionFwdAlgoImplicitGEMM:ConvHipImplicitGemmV4R4GenXdlopsFwdFp32,0.847566,0,miopenConvolutionFwdAlgoImplicitGEMM,<unused>;miopenConvolutionFwdAlgoDirect:ConvAsm1x1U,1.45427,0,miopenConvolutionFwdAlgoDirect,<unused>;miopenConvolutionFwdAlgoWinograd:ConvBinWinogradRxSf3x2,3.41215,0,miopenConvolutionFwdAlgoWinograd,<unused>
512-28-28-1x1-1024-28-28-32-0x0-1x1-1x1-0-NCHW-FP32-F=miopenConvolutionFwdAlgoImplicitGEMM:ConvHipImplicitGemmV4R4GenXdlopsFwdFp32,0.809266,0,miopenConvolutionFwdAlgoImplicitGEMM,<unused>;miopenConvolutionFwdAlgoDirect:ConvAsm1x1U,1.56344,0,miopenConvolutionFwdAlgoDirect,<unused>;miopenConvolutionFwdAlgoWinograd:ConvBinWinogradRxSf3x2,3.64363,0,miopenConvolutionFwdAlgoWinograd,<unused>
1024-14-14-3x3-1024-14-14-32-1x1-1x1-1x1-0-NCHW-FP32-F_g32=miopenConvolutionFwdAlgoWinograd:ConvBinWinogradRxSf2x3,0.175189,0,miopenConvolutionFwdAlgoWinograd,<unused>;miopenConvolutionFwdAlgoImplicitGEMM:ConvHipImplicitGemmV4R4GenXdlopsFwdFp32,0.191203,0,miopenConvolutionFwdAlgoImplicitGEMM,<unused>;miopenConvolutionFwdAlgoDirect:ConvOclDirectFwd,0.581644,0,miopenConvolutionFwdAlgoDirect,<unused>
1024-28-28-3x3-1024-14-14-32-1x1-2x2-1x1-0-NCHW-FP32-F_g32=miopenConvolutionFwdAlgoImplicitGEMM:ConvHipImplicitGemmV4R4GenXdlopsFwdFp32,0.258233,0,miopenConvolutionFwdAlgoImplicitGEMM,<unused>;miopenConvolutionFwdAlgoWinograd:ConvBinWinogradRxSf2x3,0.519037,0,miopenConvolutionFwdAlgoWinograd,<unused>;miopenConvolutionFwdAlgoDirect:ConvOclDirectFwd,0.928215,0,miopenConvolutionFwdAlgoDirect,<unused>
2048-14-14-3x3-2048-7-7-32-1x1-2x2-1x1-0-NCHW-FP32-F_g32=miopenConvolutionFwdAlgoImplicitGEMM:ConvHipImplicitGemmV4R4GenXdlopsFwdFp32,0.248122,0,miopenConvolutionFwdAlgoImplicitGEMM,<unused>;miopenConvolutionFwdAlgoWinograd:ConvBinWinogradRxSf2x3,0.705966,0,miopenConvolutionFwdAlgoWinograd,<unused>;miopenConvolutionFwdAlgoDirect:ConvOclDirectFwd,1.21779,0,miopenConvolutionFwdAlgoDirect,<unused>
2048-7-7-3x3-2048-7-7-32-1x1-1x1-1x1-0-NCHW-FP32-F_g32=miopenConvolutionFwdAlgoWinograd:ConvBinWinogradRxSf2x3,0.207213,0,miopenConvolutionFwdAlgoWinograd,<unused>;miopenConvolutionFwdAlgoImplicitGEMM:ConvHipImplicitGemmV4R4GenXdlopsFwdFp32,0.232061,0,miopenConvolutionFwdAlgoImplicitGEMM,<unused>;miopenConvolutionFwdAlgoDirect:ConvOclDirectFwd,0.708966,0,miopenConvolutionFwdAlgoDirect,<unused>
256-56-56-3x3-256-56-56-32-1x1-1x1-1x1-0-NCHW-FP32-F_g32=miopenConvolutionFwdAlgoDirect:ConvAsm3x3U,0.246954,0,miopenConvolutionFwdAlgoDirect,<unused>;miopenConvolutionFwdAlgoImplicitGEMM:ConvHipImplicitGemmV4R4GenXdlopsFwdFp32,0.403959,0,miopenConvolutionFwdAlgoImplicitGEMM,<unused>;miopenConvolutionFwdAlgoWinograd:ConvBinWinogradRxSf2x3,0.91258,0,miopenConvolutionFwdAlgoWinograd,<unused>
512-28-28-3x3-512-28-28-32-1x1-1x1-1x1-0-NCHW-FP32-F_g32=miopenConvolutionFwdAlgoImplicitGEMM:ConvHipImplicitGemmV4R4GenXdlopsFwdFp32,0.296037,0,miopenConvolutionFwdAlgoImplicitGEMM,<unused>;miopenConvolutionFwdAlgoWinograd:ConvBinWinogradRxSf2x3,0.369405,0,miopenConvolutionFwdAlgoWinograd,<unused>;miopenConvolutionFwdAlgoDirect:ConvAsm3x3U,0.410915,0,miopenConvolutionFwdAlgoDirect,<unused>
512-56-56-3x3-512-28-28-32-1x1-2x2-1x1-0-NCHW-FP32-F_g32=miopenConvolutionFwdAlgoImplicitGEMM:ConvHipImplicitGemmV4R4GenXdlopsFwdFp32,0.452553,0,miopenConvolutionFwdAlgoImplicitGEMM,<unused>;miopenConvolutionFwdAlgoWinograd:ConvBinWinogradRxSf2x3,1.00547,0,miopenConvolutionFwdAlgoWinograd,<unused>;miopenConvolutionFwdAlgoDirect:ConvOclDirectFwd,1.09247,0,miopenConvolutionFwdAlgoDirect,<unused>
256-56-56-1x1-512-28-28-32-0x0-2x2-1x1-0-NCHW-FP16-F=miopenConvolutionFwdAlgoImplicitGEMM:ConvHipImplicitGemmV4R4GenFwdXdlops,0.145342,0,miopenConvolutionFwdAlgoImplicitGEMM,<unused>;miopenConvolutionFwdAlgoDirect:ConvAsm1x1U,0.350739,12845056,miopenConvolutionFwdAlgoDirect,<unused>;miopenConvolutionFwdAlgoWinograd:ConvBinWinogradRxS,2.22398,0,miopenConvolutionFwdAlgoWinograd,<unused>
3-224-224-7x7-64-112-112-32-3x3-2x2-1x1-0-NCHW-FP16-F=miopenConvolutionFwdAlgoDirect:ConvOclDirectFwdGen,0.873058,0,miopenConvolutionFwdAlgoDirect,<unused>
512-28-28-1x1-1024-28-28-32-0x0-1x1-1x1-0-NCHW-FP16-F=miopenConvolutionFwdAlgoImplicitGEMM:ConvHipImplicitGemmV4R4GenFwdXdlops,0.254099,0,miopenConvolutionFwdAlgoImplicitGEMM,<unused>;miopenConvolutionFwdAlgoDirect:ConvAsm1x1U,1.0757,0,miopenConvolutionFwdAlgoDirect,<unused>;miopenConvolutionFwdAlgoWinograd:ConvBinWinogradRxS,4.56005,0,miopenConvolutionFwdAlgoWinograd,<unused>
64-56-56-1x1-256-56-56-32-0x0-1x1-1x1-0-NCHW-FP16-F=miopenConvolutionFwdAlgoImplicitGEMM:ConvHipImplicitGemmV4R4GenFwdXdlops,0.082,0,miopenConvolutionFwdAlgoImplicitGEMM,<unused>;miopenConvolutionFwdAlgoDirect:ConvAsm1x1U,0.146192,0,miopenConvolutionFwdAlgoDirect,<unused>;miopenConvolutionFwdAlgoWinograd:ConvBinWinogradRxS,0.59855,0,miopenConvolutionFwdAlgoWinograd,<unused>
1024-14-14-1x1-1024-14-14-32-0x0-1x1-1x1-0-NCHW-FP16-F=miopenConvolutionFwdAlgoImplicitGEMM:ConvHipImplicitGemmV4R4GenFwdXdlops,0.145933,0,miopenConvolutionFwdAlgoImplicitGEMM,<unused>;miopenConvolutionFwdAlgoDirect:ConvAsm1x1U,0.692782,0,miopenConvolutionFwdAlgoDirect,<unused>;miopenConvolutionFwdAlgoWinograd:ConvBinWinogradRxS,2.57811,0,miopenConvolutionFwdAlgoWinograd,<unused>
1024-14-14-3x3-1024-14-14-32-1x1-1x1-1x1-0-NCHW-FP16-F_g32=miopenConvolutionFwdAlgoImplicitGEMM:ConvHipImplicitGemmV4R4GenFwdXdlops,0.148283,0,miopenConvolutionFwdAlgoImplicitGEMM,<unused>;miopenConvolutionFwdAlgoDirect:ConvOclDirectFwd,0.382341,0,miopenConvolutionFwdAlgoDirect,<unused>
1024-14-14-1x1-2048-14-14-32-0x0-1x1-1x1-0-NCHW-FP16-F=miopenConvolutionFwdAlgoImplicitGEMM:ConvHipImplicitGemmV4R4GenFwdXdlops,0.271154,0,miopenConvolutionFwdAlgoImplicitGEMM,<unused>;miopenConvolutionFwdAlgoDirect:ConvAsm1x1U,1.24917,0,miopenConvolutionFwdAlgoDirect,<unused>;miopenConvolutionFwdAlgoWinograd:ConvBinWinogradRxS,5.06679,0,miopenConvolutionFwdAlgoWinograd,<unused>
1024-14-14-1x1-2048-7-7-32-0x0-2x2-1x1-0-NCHW-FP16-F=miopenConvolutionFwdAlgoImplicitGEMM:ConvHipImplicitGemmV4R4GenFwdXdlops,0.248316,0,miopenConvolutionFwdAlgoImplicitGEMM,<unused>;miopenConvolutionFwdAlgoDirect:ConvAsm1x1U,0.499901,3211264,miopenConvolutionFwdAlgoDirect,<unused>;miopenConvolutionFwdAlgoWinograd:ConvBinWinogradRxS,3.20528,0,miopenConvolutionFwdAlgoWinograd,<unused>
1024-28-28-3x3-1024-14-14-32-1x1-2x2-1x1-0-NCHW-FP16-F_g32=miopenConvolutionFwdAlgoImplicitGEMM:ConvHipImplicitGemmV4R4GenFwdXdlops,0.188132,0,miopenConvolutionFwdAlgoImplicitGEMM,<unused>
2048-14-14-3x3-2048-7-7-32-1x1-2x2-1x1-0-NCHW-FP16-F_g32=miopenConvolutionFwdAlgoImplicitGEMM:ConvHipImplicitGemmV4R4GenFwdXdlops,0.150672,0,miopenConvolutionFwdAlgoImplicitGEMM,<unused>
2048-7-7-1x1-2048-7-7-32-0x0-1x1-1x1-0-NCHW-FP16-F=miopenConvolutionFwdAlgoImplicitGEMM:ConvHipImplicitGemmV4R4GenFwdXdlops,0.38024,0,miopenConvolutionFwdAlgoImplicitGEMM,<unused>;miopenConvolutionFwdAlgoDirect:ConvAsm1x1U,0.9476,0,miopenConvolutionFwdAlgoDirect,<unused>;miopenConvolutionFwdAlgoWinograd:ConvBinWinogradRxS,3.28274,0,miopenConvolutionFwdAlgoWinograd,<unused>
2048-7-7-3x3-2048-7-7-32-1x1-1x1-1x1-0-NCHW-FP16-F_g32=miopenConvolutionFwdAlgoImplicitGEMM:ConvHipImplicitGemmV4R4GenFwdXdlops,0.123564,0,miopenConvolutionFwdAlgoImplicitGEMM,<unused>;miopenConvolutionFwdAlgoDirect:ConvOclDirectFwd,0.653499,0,miopenConvolutionFwdAlgoDirect,<unused>
256-56-56-1x1-256-56-56-32-0x0-1x1-1x1-0-NCHW-FP16-F=miopenConvolutionFwdAlgoImplicitGEMM:ConvHipImplicitGemmV4R4GenFwdXdlops,0.148788,0,miopenConvolutionFwdAlgoImplicitGEMM,<unused>;miopenConvolutionFwdAlgoDirect:ConvAsm1x1U,0.475833,0,miopenConvolutionFwdAlgoDirect,<unused>;miopenConvolutionFwdAlgoWinograd:ConvBinWinogradRxS,2.07512,0,miopenConvolutionFwdAlgoWinograd,<unused>
256-56-56-3x3-256-56-56-32-1x1-1x1-1x1-0-NCHW-FP16-F_g32=miopenConvolutionFwdAlgoDirect:ConvOclDirectFwd,0.423703,0,miopenConvolutionFwdAlgoDirect,<unused>
256-56-56-1x1-512-56-56-32-0x0-1x1-1x1-0-NCHW-FP16-F=miopenConvolutionFwdAlgoImplicitGEMM:ConvHipImplicitGemmV4R4GenFwdXdlops,0.276052,0,miopenConvolutionFwdAlgoImplicitGEMM,<unused>;miopenConvolutionFwdAlgoDirect:ConvAsm1x1U,0.905926,0,miopenConvolutionFwdAlgoDirect,<unused>;miopenConvolutionFwdAlgoWinograd:ConvBinWinogradRxS,4.10845,0,miopenConvolutionFwdAlgoWinograd,<unused>
512-28-28-1x1-1024-14-14-32-0x0-2x2-1x1-0-NCHW-FP16-F=miopenConvolutionFwdAlgoImplicitGEMM:ConvHipImplicitGemmV4R4GenFwdXdlops,0.167009,0,miopenConvolutionFwdAlgoImplicitGEMM,<unused>;miopenConvolutionFwdAlgoDirect:ConvAsm1x1U,0.371441,6422528,miopenConvolutionFwdAlgoDirect,<unused>;miopenConvolutionFwdAlgoWinograd:ConvBinWinogradRxS,2.65927,0,miopenConvolutionFwdAlgoWinograd,<unused>
512-28-28-1x1-512-28-28-32-0x0-1x1-1x1-0-NCHW-FP16-F=miopenConvolutionFwdAlgoImplicitGEMM:ConvHipImplicitGemmV4R4GenFwdXdlops,0.135016,0,miopenConvolutionFwdAlgoImplicitGEMM,<unused>;miopenConvolutionFwdAlgoDirect:ConvAsm1x1U,0.565502,0,miopenConvolutionFwdAlgoDirect,<unused>;miopenConvolutionFwdAlgoWinograd:ConvBinWinogradRxS,2.29615,0,miopenConvolutionFwdAlgoWinograd,<unused>
512-28-28-3x3-512-28-28-32-1x1-1x1-1x1-0-NCHW-FP16-F_g32=miopenConvolutionFwdAlgoImplicitGEMM:ConvHipImplicitGemmV4R4GenFwdXdlops,0.227929,0,miopenConvolutionFwdAlgoImplicitGEMM,<unused>;miopenConvolutionFwdAlgoDirect:ConvOclDirectFwd,0.358589,0,miopenConvolutionFwdAlgoDirect,<unused>
3-224-224-7x7-64-112-112-32-3x3-2x2-1x1-0-NCHW-BF16-F=miopenConvolutionFwdAlgoDirect:ConvOclDirectFwd,0.917435,0,miopenConvolutionFwdAlgoDirect,<unused>
512-56-56-3x3-512-28-28-32-1x1-2x2-1x1-0-NCHW-FP16-F_g32=miopenConvolutionFwdAlgoImplicitGEMM:ConvHipImplicitGemmV4R4GenFwdXdlops,0.411627,0,miopenConvolutionFwdAlgoImplicitGEMM,<unused>
1024-14-14-1x1-1024-14-14-32-0x0-1x1-1x1-0-NCHW-BF16-F=miopenConvolutionFwdAlgoImplicitGEMM:ConvHipImplicitGemmV4R4GenFwdXdlops,0.224738,0,miopenConvolutionFwdAlgoImplicitGEMM,<unused>
256-56-56-1x1-256-56-56-32-0x0-1x1-1x1-0-NCHW-BF16-F=miopenConvolutionFwdAlgoImplicitGEMM:ConvHipImplicitGemmV4R4GenFwdXdlops,0.237508,0,miopenConvolutionFwdAlgoImplicitGEMM,<unused>
512-28-28-1x1-512-28-28-32-0x0-1x1-1x1-0-NCHW-BF16-F=miopenConvolutionFwdAlgoImplicitGEMM:ConvHipImplicitGemmV4R4GenFwdXdlops,0.230072,0,miopenConvolutionFwdAlgoImplicitGEMM,<unused>
512-28-28-1x1-1024-14-14-32-0x0-2x2-1x1-0-NCHW-BF16-F=miopenConvolutionFwdAlgoImplicitGEMM:ConvHipImplicitGemmV4R4GenFwdXdlops,0.202182,0,miopenConvolutionFwdAlgoImplicitGEMM,<unused>
256-56-56-1x1-512-28-28-32-0x0-2x2-1x1-0-NCHW-BF16-F=miopenConvolutionFwdAlgoImplicitGEMM:ConvHipImplicitGemmV4R4GenFwdXdlops,0.22899,0,miopenConvolutionFwdAlgoImplicitGEMM,<unused>
64-56-56-1x1-256-56-56-32-0x0-1x1-1x1-0-NCHW-BF16-F=miopenConvolutionFwdAlgoImplicitGEMM:ConvHipImplicitGemmV4R4GenFwdXdlops,0.110789,0,miopenConvolutionFwdAlgoImplicitGEMM,<unused>
1024-28-28-1x1-512-28-28-32-0x0-1x1-1x1-0-NCHW-BF16-B=miopenConvolutionBwdDataAlgoImplicitGEMM:ConvHipImplicitGemmBwdDataV1R1Xdlops,0.60691,51380224,miopenConvolutionBwdDataAlgoImplicitGEMM,<unused>
1024-14-14-1x1-2048-7-7-32-0x0-2x2-1x1-0-NCHW-BF16-F=miopenConvolutionFwdAlgoImplicitGEMM:ConvHipImplicitGemmV4R4GenFwdXdlops,0.221184,0,miopenConvolutionFwdAlgoImplicitGEMM,<unused>
1024-14-14-3x3-1024-14-14-32-1x1-1x1-1x1-0-NCHW-BF16-B_g32=miopenConvolutionBwdDataAlgoDirect:ConvOclDirectFwd,0.528971,0,miopenConvolutionBwdDataAlgoDirect,<unused>;miopenConvolutionBwdDataAlgoImplicitGEMM:ConvHipImplicitGemmBwdDataV1R1Xdlops,0.738601,25690112,miopenConvolutionBwdDataAlgoImplicitGEMM,<unused>
2048-14-14-1x1-1024-14-14-32-0x0-1x1-1x1-0-NCHW-BF16-B=miopenConvolutionBwdDataAlgoImplicitGEMM:ConvHipImplicitGemmBwdDataV1R1Xdlops,0.556599,25690112,miopenConvolutionBwdDataAlgoImplicitGEMM,<unused>
1024-14-14-3x3-1024-28-28-32-1x1-2x2-1x1-0-NCHW-BF16-B_g32=miopenConvolutionBwdDataAlgoDirect:ConvOclDirectFwd,0.749633,0,miopenConvolutionBwdDataAlgoDirect,<unused>;miopenConvolutionBwdDataAlgoImplicitGEMM:ConvHipImplicitGemmBwdDataV1R1Xdlops,1.45956,102760448,miopenConvolutionBwdDataAlgoImplicitGEMM,<unused>
2048-7-7-3x3-2048-14-14-32-1x1-2x2-1x1-0-NCHW-BF16-B_g32=miopenConvolutionBwdDataAlgoDirect:ConvOclDirectFwd,0.818427,0,miopenConvolutionBwdDataAlgoDirect,<unused>;miopenConvolutionBwdDataAlgoImplicitGEMM:ConvHipImplicitGemmBwdDataV1R1Xdlops,0.879806,51380224,miopenConvolutionBwdDataAlgoImplicitGEMM,<unused>
2048-7-7-1x1-2048-7-7-32-0x0-1x1-1x1-0-NCHW-BF16-B=miopenConvolutionBwdDataAlgoImplicitGEMM:ConvHipImplicitGemmBwdDataV1R1Xdlops,0.449949,12845056,miopenConvolutionBwdDataAlgoImplicitGEMM,<unused>
2048-7-7-3x3-2048-7-7-32-1x1-1x1-1x1-0-NCHW-BF16-B_g32=miopenConvolutionBwdDataAlgoImplicitGEMM:ConvHipImplicitGemmBwdDataV1R1Xdlops,0.477575,12845056,miopenConvolutionBwdDataAlgoImplicitGEMM,<unused>;miopenConvolutionBwdDataAlgoDirect:ConvOclDirectFwd,0.761065,0,miopenConvolutionBwdDataAlgoDirect,<unused>
256-56-56-3x3-256-56-56-32-1x1-1x1-1x1-0-NCHW-BF16-B_g32=miopenConvolutionBwdDataAlgoDirect:ConvOclDirectFwd,0.567153,0,miopenConvolutionBwdDataAlgoDirect,<unused>
512-56-56-1x1-256-56-56-32-0x0-1x1-1x1-0-NCHW-BF16-B=miopenConvolutionBwdDataAlgoImplicitGEMM:ConvHipImplicitGemmBwdDataV1R1Xdlops,0.795457,102760448,miopenConvolutionBwdDataAlgoImplicitGEMM,<unused>
512-28-28-3x3-512-28-28-32-1x1-1x1-1x1-0-NCHW-BF16-B_g32=miopenConvolutionBwdDataAlgoDirect:ConvOclDirectFwd,0.495136,0,miopenConvolutionBwdDataAlgoDirect,<unused>;miopenConvolutionBwdDataAlgoImplicitGEMM:ConvHipImplicitGemmBwdDataV1R1Xdlops,1.42255,51380224,miopenConvolutionBwdDataAlgoImplicitGEMM,<unused>
512-28-28-3x3-512-56-56-32-1x1-2x2-1x1-0-NCHW-BF16-B_g32=miopenConvolutionBwdDataAlgoDirect:ConvOclDirectFwd,0.997003,0,miopenConvolutionBwdDataAlgoDirect,<unused>;miopenConvolutionBwdDataAlgoImplicitGEMM:ConvHipImplicitGemmBwdDataV1R1Xdlops,2.81685,205520896,miopenConvolutionBwdDataAlgoImplicitGEMM,<unused>
1024-14-14-1x1-1024-14-14-32-0x0-1x1-1x1-0-NCHW-FP32-B=miopenConvolutionBwdDataAlgoImplicitGEMM:ConvHipImplicitGemmV4R4Xdlops_1x1,0.497019,0,miopenConvolutionBwdDataAlgoImplicitGEMM,<unused>;miopenConvolutionBwdDataAlgoDirect:ConvAsm1x1U,0.722482,0,miopenConvolutionBwdDataAlgoDirect,<unused>;miopenConvolutionBwdDataAlgoWinograd:ConvBinWinogradRxSf3x2,1.78823,0,miopenConvolutionBwdDataAlgoWinograd,<unused>
2048-7-7-1x1-1024-14-14-32-0x0-2x2-1x1-0-NCHW-FP32-B=miopenConvolutionBwdDataAlgoImplicitGEMM:ConvHipImplicitGemmV4R4Xdlops_1x1,0.406067,0,miopenConvolutionBwdDataAlgoImplicitGEMM,<unused>;miopenConvolutionBwdDataAlgoDirect:ConvAsm1x1UV2,0.540922,0,miopenConvolutionBwdDataAlgoDirect,<unused>;miopenConvolutionBwdDataAlgoWinograd:ConvBinWinogradRxSf2x3,4.21129,0,miopenConvolutionBwdDataAlgoWinograd,<unused>
256-56-56-1x1-256-56-56-32-0x0-1x1-1x1-0-NCHW-FP32-B=miopenConvolutionBwdDataAlgoImplicitGEMM:ConvHipImplicitGemmV4R4Xdlops_1x1,0.444989,0,miopenConvolutionBwdDataAlgoImplicitGEMM,<unused>;miopenConvolutionBwdDataAlgoDirect:ConvAsm1x1U,0.665655,0,miopenConvolutionBwdDataAlgoDirect,<unused>;miopenConvolutionBwdDataAlgoWinograd:ConvBinWinogradRxSf3x2,1.67809,0,miopenConvolutionBwdDataAlgoWinograd,<unused>
512-28-28-1x1-256-56-56-32-0x0-2x2-1x1-0-NCHW-FP32-B=miopenConvolutionBwdDataAlgoDirect:ConvAsm1x1UV2,0.436366,0,miopenConvolutionBwdDataAlgoDirect,<unused>;miopenConvolutionBwdDataAlgoImplicitGEMM:ConvHipImplicitGemmV4R4Xdlops_1x1,0.443426,0,miopenConvolutionBwdDataAlgoImplicitGEMM,<unused>;miopenConvolutionBwdDataAlgoWinograd:ConvBinWinogradRxSf2x3,3.54492,0,miopenConvolutionBwdDataAlgoWinograd,<unused>
64-112-112-7x7-3-224-224-32-3x3-2x2-1x1-0-NCHW-FP32-B=miopenConvolutionBwdDataAlgoDirect:ConvOclDirectFwd,1.15651,0,miopenConvolutionBwdDataAlgoDirect,<unused>;miopenConvolutionBwdDataAlgoWinograd:ConvBinWinogradRxSf2x3,2.49039,0,miopenConvolutionBwdDataAlgoWinograd,<unused>
1024-14-14-1x1-512-28-28-32-0x0-2x2-1x1-0-NCHW-FP32-B=miopenConvolutionBwdDataAlgoImplicitGEMM:ConvHipImplicitGemmV4R4Xdlops_1x1,0.448493,0,miopenConvolutionBwdDataAlgoImplicitGEMM,<unused>;miopenConvolutionBwdDataAlgoDirect:ConvAsm1x1UV2,0.475582,0,miopenConvolutionBwdDataAlgoDirect,<unused>;miopenConvolutionBwdDataAlgoWinograd:ConvBinWinogradRxSf2x3,3.80394,0,miopenConvolutionBwdDataAlgoWinograd,<unused>
512-28-28-1x1-512-28-28-32-0x0-1x1-1x1-0-NCHW-FP32-B=miopenConvolutionBwdDataAlgoImplicitGEMM:ConvHipImplicitGemmV4R4Xdlops_1x1,0.435791,0,miopenConvolutionBwdDataAlgoImplicitGEMM,<unused>;miopenConvolutionBwdDataAlgoDirect:ConvAsm1x1U,0.660205,0,miopenConvolutionBwdDataAlgoDirect,<unused>;miopenConvolutionBwdDataAlgoWinograd:ConvBinWinogradRxSf3x2,1.83879,0,miopenConvolutionBwdDataAlgoWinograd,<unused>
256-56-56-1x1-64-56-56-32-0x0-1x1-1x1-0-NCHW-FP32-B=miopenConvolutionBwdDataAlgoDirect:ConvAsm1x1U,0.191355,0,miopenConvolutionBwdDataAlgoDirect,<unused>;miopenConvolutionBwdDataAlgoImplicitGEMM:ConvHipImplicitGemmV4R4Xdlops_1x1,0.205044,0,miopenConvolutionBwdDataAlgoImplicitGEMM,<unused>;miopenConvolutionBwdDataAlgoWinograd:ConvBinWinogradRxSf3x2,0.517027,0,miopenConvolutionBwdDataAlgoWinograd,<unused>
2048-14-14-1x1-1024-14-14-32-0x0-1x1-1x1-0-NCHW-FP32-B=miopenConvolutionBwdDataAlgoImplicitGEMM:ConvHipImplicitGemmV4R4Xdlops_1x1,0.964711,0,miopenConvolutionBwdDataAlgoImplicitGEMM,<unused>;miopenConvolutionBwdDataAlgoDirect:ConvAsm1x1U,1.43066,0,miopenConvolutionBwdDataAlgoDirect,<unused>;miopenConvolutionBwdDataAlgoWinograd:ConvBinWinogradRxSf3x2,3.57977,0,miopenConvolutionBwdDataAlgoWinograd,<unused>
2048-7-7-1x1-2048-7-7-32-0x0-1x1-1x1-0-NCHW-FP32-B=miopenConvolutionBwdDataAlgoImplicitGEMM:ConvHipImplicitGemmV4R4Xdlops_1x1,0.771502,0,miopenConvolutionBwdDataAlgoImplicitGEMM,<unused>;miopenConvolutionBwdDataAlgoDirect:ConvAsm1x1U,0.891888,0,miopenConvolutionBwdDataAlgoDirect,<unused>;miopenConvolutionBwdDataAlgoWinograd:ConvBinWinogradRxSf3x2,2.51887,0,miopenConvolutionBwdDataAlgoWinograd,<unused>
512-56-56-1x1-256-56-56-32-0x0-1x1-1x1-0-NCHW-FP32-B=miopenConvolutionBwdDataAlgoImplicitGEMM:ConvHipImplicitGemmV4R4Xdlops_1x1,0.831871,0,miopenConvolutionBwdDataAlgoImplicitGEMM,<unused>;miopenConvolutionBwdDataAlgoDirect:ConvAsm1x1U,1.32491,0,miopenConvolutionBwdDataAlgoDirect,<unused>;miopenConvolutionBwdDataAlgoWinograd:ConvBinWinogradRxSf3x2,3.36356,0,miopenConvolutionBwdDataAlgoWinograd,<unused>
1024-28-28-1x1-512-28-28-32-0x0-1x1-1x1-0-NCHW-FP32-B=miopenConvolutionBwdDataAlgoImplicitGEMM:ConvHipImplicitGemmV4R4Xdlops_1x1,0.868134,0,miopenConvolutionBwdDataAlgoImplicitGEMM,<unused>;miopenConvolutionBwdDataAlgoDirect:ConvAsm1x1U,1.37485,0,miopenConvolutionBwdDataAlgoDirect,<unused>;miopenConvolutionBwdDataAlgoWinograd:ConvBinWinogradRxSf3x2,3.70535,0,miopenConvolutionBwdDataAlgoWinograd,<unused>
1024-14-14-3x3-1024-14-14-32-1x1-1x1-1x1-0-NCHW-FP32-B_g32=miopenConvolutionBwdDataAlgoWinograd:ConvBinWinogradRxSf2x3,0.175193,0,miopenConvolutionBwdDataAlgoWinograd,<unused>;miopenConvolutionBwdDataAlgoImplicitGEMM:ConvHipImplicitGemmBwdDataV1R1Xdlops,0.362145,0,miopenConvolutionBwdDataAlgoImplicitGEMM,<unused>;miopenConvolutionBwdDataAlgoDirect:ConvOclDirectFwd,0.514857,0,miopenConvolutionBwdDataAlgoDirect,<unused>
1024-14-14-3x3-1024-28-28-32-1x1-2x2-1x1-0-NCHW-FP32-B_g32=miopenConvolutionBwdDataAlgoImplicitGEMM:ConvHipImplicitGemmBwdDataV1R1Xdlops,0.539837,0,miopenConvolutionBwdDataAlgoImplicitGEMM,<unused>;miopenConvolutionBwdDataAlgoWinograd:ConvBinWinogradRxSf2x3,0.6564,0,miopenConvolutionBwdDataAlgoWinograd,<unused>;miopenConvolutionBwdDataAlgoDirect:ConvOclDirectFwd,0.706997,0,miopenConvolutionBwdDataAlgoDirect,<unused>
2048-7-7-3x3-2048-14-14-32-1x1-2x2-1x1-0-NCHW-FP32-B_g32=miopenConvolutionBwdDataAlgoImplicitGEMM:ConvHipImplicitGemmBwdDataV1R1Xdlops,0.404305,0,miopenConvolutionBwdDataAlgoImplicitGEMM,<unused>;miopenConvolutionBwdDataAlgoWinograd:ConvBinWinogradRxSf2x3,0.676948,0,miopenConvolutionBwdDataAlgoWinograd,<unused>;miopenConvolutionBwdDataAlgoDirect:ConvOclDirectFwd,0.728086,0,miopenConvolutionBwdDataAlgoDirect,<unused>
2048-7-7-3x3-2048-7-7-32-1x1-1x1-1x1-0-NCHW-FP32-B_g32=miopenConvolutionBwdDataAlgoWinograd:ConvBinWinogradRxSf2x3,0.206533,0,miopenConvolutionBwdDataAlgoWinograd,<unused>;miopenConvolutionBwdDataAlgoImplicitGEMM:ConvHipImplicitGemmBwdDataV1R1Xdlops,0.287088,0,miopenConvolutionBwdDataAlgoImplicitGEMM,<unused>;miopenConvolutionBwdDataAlgoDirect:ConvOclDirectFwd,0.712191,0,miopenConvolutionBwdDataAlgoDirect,<unused>
256-56-56-3x3-256-56-56-32-1x1-1x1-1x1-0-NCHW-FP32-B_g32=miopenConvolutionBwdDataAlgoDirect:ConvAsm3x3U,0.249895,0,miopenConvolutionBwdDataAlgoDirect,<unused>;miopenConvolutionBwdDataAlgoWinograd:ConvBinWinogradRxSf2x3,0.912378,0,miopenConvolutionBwdDataAlgoWinograd,<unused>;miopenConvolutionBwdDataAlgoImplicitGEMM:ConvHipImplicitGemmBwdDataV1R1Xdlops,1.13297,0,miopenConvolutionBwdDataAlgoImplicitGEMM,<unused>
512-28-28-3x3-512-28-28-32-1x1-1x1-1x1-0-NCHW-FP32-B_g32=miopenConvolutionBwdDataAlgoWinograd:ConvBinWinogradRxSf2x3,0.37026,0,miopenConvolutionBwdDataAlgoWinograd,<unused>;miopenConvolutionBwdDataAlgoDirect:ConvAsm3x3U,0.409814,0,miopenConvolutionBwdDataAlgoDirect,<unused>;miopenConvolutionBwdDataAlgoImplicitGEMM:ConvHipImplicitGemmBwdDataV1R1Xdlops,0.564293,0,miopenConvolutionBwdDataAlgoImplicitGEMM,<unused>
512-28-28-3x3-512-56-56-32-1x1-2x2-1x1-0-NCHW-FP32-B_g32=miopenConvolutionBwdDataAlgoWinograd:ConvBinWinogradRxSf2x3,0.76754,0,miopenConvolutionBwdDataAlgoWinograd,<unused>;miopenConvolutionBwdDataAlgoImplicitGEMM:ConvHipImplicitGemmBwdDataV1R1Xdlops,1.0649,0,miopenConvolutionBwdDataAlgoImplicitGEMM,<unused>;miopenConvolutionBwdDataAlgoDirect:ConvOclDirectFwd,1.08785,0,miopenConvolutionBwdDataAlgoDirect,<unused>
512-28-28-1x1-256-56-56-32-0x0-2x2-1x1-0-NCHW-FP16-B=miopenConvolutionBwdDataAlgoDirect:ConvAsm1x1U,0.432764,12845056,miopenConvolutionBwdDataAlgoDirect,<unused>;miopenConvolutionBwdDataAlgoImplicitGEMM:ConvHipImplicitGemmBwdDataV1R1Xdlops,0.596284,102760448,miopenConvolutionBwdDataAlgoImplicitGEMM,<unused>;miopenConvolutionBwdDataAlgoWinograd:ConvBinWinogradRxS,2.22278,0,miopenConvolutionBwdDataAlgoWinograd,<unused>
64-112-112-7x7-3-224-224-32-3x3-2x2-1x1-0-NCHW-FP16-B=miopenConvolutionBwdDataAlgoDirect:ConvOclDirectFwd,1.51669,0,miopenConvolutionBwdDataAlgoDirect,<unused>;miopenConvolutionBwdDataAlgoWinograd:ConvBinWinogradRxS,1.5925,0,miopenConvolutionBwdDataAlgoWinograd,<unused>
1024-28-28-1x1-512-28-28-32-0x0-1x1-1x1-0-NCHW-FP16-B=miopenConvolutionBwdDataAlgoImplicitGEMM:ConvHipImplicitGemmBwdDataV1R1Xdlops,0.528816,51380224,miopenConvolutionBwdDataAlgoImplicitGEMM,<unused>;miopenConvolutionBwdDataAlgoDirect:ConvAsm1x1U,0.948039,0,miopenConvolutionBwdDataAlgoDirect,<unused>;miopenConvolutionBwdDataAlgoWinograd:ConvBinWinogradRxS,4.54127,0,miopenConvolutionBwdDataAlgoWinograd,<unused>
256-56-56-1x1-64-56-56-32-0x0-1x1-1x1-0-NCHW-FP16-B=miopenConvolutionBwdDataAlgoDirect:ConvAsm1x1U,0.144434,0,miopenConvolutionBwdDataAlgoDirect,<unused>;miopenConvolutionBwdDataAlgoImplicitGEMM:ConvHipImplicitGemmBwdDataV1R1Xdlops,0.192601,25690112,miopenConvolutionBwdDataAlgoImplicitGEMM,<unused>;miopenConvolutionBwdDataAlgoWinograd:ConvBinWinogradRxS,0.587271,0,miopenConvolutionBwdDataAlgoWinograd,<unused>
1024-14-14-1x1-1024-14-14-32-0x0-1x1-1x1-0-NCHW-FP16-B=miopenConvolutionBwdDataAlgoImplicitGEMM:ConvHipImplicitGemmBwdDataV1R1Xdlops,0.289063,25690112,miopenConvolutionBwdDataAlgoImplicitGEMM,<unused>;miopenConvolutionBwdDataAlgoDirect:ConvAsm1x1U,0.612191,0,miopenConvolutionBwdDataAlgoDirect,<unused>;miopenConvolutionBwdDataAlgoWinograd:ConvBinWinogradRxS,2.57334,0,miopenConvolutionBwdDataAlgoWinograd,<unused>
1024-14-14-3x3-1024-14-14-32-1x1-1x1-1x1-0-NCHW-FP16-B_g32=miopenConvolutionBwdDataAlgoDirect:ConvOclDirectFwd,0.368583,0,miopenConvolutionBwdDataAlgoDirect,<unused>;miopenConvolutionBwdDataAlgoImplicitGEMM:ConvHipImplicitGemmBwdDataV1R1Xdlops,0.804466,25690112,miopenConvolutionBwdDataAlgoImplicitGEMM,<unused>
2048-14-14-1x1-1024-14-14-32-0x0-1x1-1x1-0-NCHW-FP16-B=miopenConvolutionBwdDataAlgoImplicitGEMM:ConvHipImplicitGemmBwdDataV1R1Xdlops,0.443412,25690112,miopenConvolutionBwdDataAlgoImplicitGEMM,<unused>;miopenConvolutionBwdDataAlgoDirect:ConvAsm1x1U,1.24472,0,miopenConvolutionBwdDataAlgoDirect,<unused>;miopenConvolutionBwdDataAlgoWinograd:ConvBinWinogradRxS,5.0595,0,miopenConvolutionBwdDataAlgoWinograd,<unused>
2048-7-7-1x1-1024-14-14-32-0x0-2x2-1x1-0-NCHW-FP16-B=miopenConvolutionBwdDataAlgoImplicitGEMM:ConvHipImplicitGemmBwdDataV1R1Xdlops,0.342354,25690112,miopenConvolutionBwdDataAlgoImplicitGEMM,<unused>;miopenConvolutionBwdDataAlgoDirect:ConvAsm1x1U,0.49707,3211264,miopenConvolutionBwdDataAlgoDirect,<unused>;miopenConvolutionBwdDataAlgoWinograd:ConvBinWinogradRxS,3.14746,0,miopenConvolutionBwdDataAlgoWinograd,<unused>
1024-14-14-3x3-1024-28-28-32-1x1-2x2-1x1-0-NCHW-FP16-B_g32=miopenConvolutionBwdDataAlgoDirect:ConvOclDirectFwd,0.731759,0,miopenConvolutionBwdDataAlgoDirect,<unused>;miopenConvolutionBwdDataAlgoImplicitGEMM:ConvHipImplicitGemmBwdDataV1R1Xdlops,1.45971,102760448,miopenConvolutionBwdDataAlgoImplicitGEMM,<unused>
2048-7-7-3x3-2048-14-14-32-1x1-2x2-1x1-0-NCHW-FP16-B_g32=miopenConvolutionBwdDataAlgoDirect:ConvOclDirectFwd,0.784031,0,miopenConvolutionBwdDataAlgoDirect,<unused>;miopenConvolutionBwdDataAlgoImplicitGEMM:ConvHipImplicitGemmBwdDataV1R1Xdlops,0.875168,51380224,miopenConvolutionBwdDataAlgoImplicitGEMM,<unused>
2048-7-7-1x1-2048-7-7-32-0x0-1x1-1x1-0-NCHW-FP16-B=miopenConvolutionBwdDataAlgoImplicitGEMM:ConvHipImplicitGemmBwdDataV1R1Xdlops,0.470334,12845056,miopenConvolutionBwdDataAlgoImplicitGEMM,<unused>;miopenConvolutionBwdDataAlgoDirect:ConvAsm1x1U,0.749188,0,miopenConvolutionBwdDataAlgoDirect,<unused>;miopenConvolutionBwdDataAlgoWinograd:ConvBinWinogradRxS,3.21285,0,miopenConvolutionBwdDataAlgoWinograd,<unused>
2048-7-7-3x3-2048-7-7-32-1x1-1x1-1x1-0-NCHW-FP16-B_g32=miopenConvolutionBwdDataAlgoImplicitGEMM:ConvHipImplicitGemmBwdDataV1R1Xdlops,0.502474,12845056,miopenConvolutionBwdDataAlgoImplicitGEMM,<unused>;miopenConvolutionBwdDataAlgoDirect:ConvOclDirectFwd,0.725628,0,miopenConvolutionBwdDataAlgoDirect,<unused>
256-56-56-1x1-256-56-56-32-0x0-1x1-1x1-0-NCHW-FP16-B=miopenConvolutionBwdDataAlgoDirect:ConvAsm1x1U,0.478006,0,miopenConvolutionBwdDataAlgoDirect,<unused>;miopenConvolutionBwdDataAlgoImplicitGEMM:ConvHipImplicitGemmBwdDataV1R1Xdlops,0.604736,102760448,miopenConvolutionBwdDataAlgoImplicitGEMM,<unused>;miopenConvolutionBwdDataAlgoWinograd:ConvBinWinogradRxS,2.00744,0,miopenConvolutionBwdDataAlgoWinograd,<unused>
256-56-56-3x3-256-56-56-32-1x1-1x1-1x1-0-NCHW-FP16-B_g32=miopenConvolutionBwdDataAlgoDirect:ConvOclDirectFwd,0.397048,0,miopenConvolutionBwdDataAlgoDirect,<unused>
512-56-56-1x1-256-56-56-32-0x0-1x1-1x1-0-NCHW-FP16-B=miopenConvolutionBwdDataAlgoImplicitGEMM:ConvHipImplicitGemmBwdDataV1R1Xdlops,0.733655,102760448,miopenConvolutionBwdDataAlgoImplicitGEMM,<unused>;miopenConvolutionBwdDataAlgoDirect:ConvAsm1x1U,0.913088,0,miopenConvolutionBwdDataAlgoDirect,<unused>;miopenConvolutionBwdDataAlgoWinograd:ConvBinWinogradRxS,4.19375,0,miopenConvolutionBwdDataAlgoWinograd,<unused>
1024-14-14-1x1-512-28-28-32-0x0-2x2-1x1-0-NCHW-FP16-B=miopenConvolutionBwdDataAlgoImplicitGEMM:ConvHipImplicitGemmBwdDataV1R1Xdlops,0.356003,51380224,miopenConvolutionBwdDataAlgoImplicitGEMM,<unused>;miopenConvolutionBwdDataAlgoDirect:ConvAsm1x1U,0.436553,6422528,miopenConvolutionBwdDataAlgoDirect,<unused>;miopenConvolutionBwdDataAlgoWinograd:ConvBinWinogradRxS,2.44405,0,miopenConvolutionBwdDataAlgoWinograd,<unused>
512-28-28-1x1-512-28-28-32-0x0-1x1-1x1-0-NCHW-FP16-B=miopenConvolutionBwdDataAlgoImplicitGEMM:ConvHipImplicitGemmBwdDataV1R1Xdlops,0.390532,51380224,miopenConvolutionBwdDataAlgoImplicitGEMM,<unused>;miopenConvolutionBwdDataAlgoDirect:ConvAsm1x1U,0.506181,0,miopenConvolutionBwdDataAlgoDirect,<unused>;miopenConvolutionBwdDataAlgoWinograd:ConvBinWinogradRxS,2.23492,0,miopenConvolutionBwdDataAlgoWinograd,<unused>
512-28-28-3x3-512-28-28-32-1x1-1x1-1x1-0-NCHW-FP16-B_g32=miopenConvolutionBwdDataAlgoDirect:ConvOclDirectFwd,0.320154,0,miopenConvolutionBwdDataAlgoDirect,<unused>;miopenConvolutionBwdDataAlgoImplicitGEMM:ConvHipImplicitGemmBwdDataV1R1Xdlops,1.94435,51380224,miopenConvolutionBwdDataAlgoImplicitGEMM,<unused>
512-28-28-3x3-512-56-56-32-1x1-2x2-1x1-0-NCHW-FP16-B_g32=miopenConvolutionBwdDataAlgoDirect:ConvOclDirectFwd,1.03717,0,miopenConvolutionBwdDataAlgoDirect,<unused>;miopenConvolutionBwdDataAlgoImplicitGEMM:ConvHipImplicitGemmBwdDataV1R1Xdlops,3.43458,205520896,miopenConvolutionBwdDataAlgoImplicitGEMM,<unused>
64-112-112-7x7-3-224-224-32-3x3-2x2-1x1-0-NCHW-BF16-B=miopenConvolutionBwdDataAlgoDirect:ConvOclDirectFwd,1.46565,0,miopenConvolutionBwdDataAlgoDirect,<unused>
1024-14-14-1x1-1024-14-14-32-0x0-1x1-1x1-0-NCHW-BF16-B=miopenConvolutionBwdDataAlgoImplicitGEMM:ConvHipImplicitGemmBwdDataV1R1Xdlops,0.34904,25690112,miopenConvolutionBwdDataAlgoImplicitGEMM,<unused>
256-56-56-1x1-256-56-56-32-0x0-1x1-1x1-0-NCHW-BF16-B=miopenConvolutionBwdDataAlgoImplicitGEMM:ConvHipImplicitGemmBwdDataV1R1Xdlops,0.621483,102760448,miopenConvolutionBwdDataAlgoImplicitGEMM,<unused>
512-28-28-1x1-512-28-28-32-0x0-1x1-1x1-0-NCHW-BF16-B=miopenConvolutionBwdDataAlgoImplicitGEMM:ConvHipImplicitGemmBwdDataV1R1Xdlops,0.430649,51380224,miopenConvolutionBwdDataAlgoImplicitGEMM,<unused>
1024-14-14-1x1-512-28-28-32-0x0-2x2-1x1-0-NCHW-BF16-B=miopenConvolutionBwdDataAlgoImplicitGEMM:ConvHipImplicitGemmBwdDataV1R1Xdlops,0.434494,51380224,miopenConvolutionBwdDataAlgoImplicitGEMM,<unused>
512-28-28-1x1-256-56-56-32-0x0-2x2-1x1-0-NCHW-BF16-B=miopenConvolutionBwdDataAlgoImplicitGEMM:ConvHipImplicitGemmBwdDataV1R1Xdlops,0.621348,102760448,miopenConvolutionBwdDataAlgoImplicitGEMM,<unused>
2048-7-7-1x1-1024-14-14-32-0x0-2x2-1x1-0-NCHW-BF16-B=miopenConvolutionBwdDataAlgoImplicitGEMM:ConvHipImplicitGemmBwdDataV1R1Xdlops,0.340003,25690112,miopenConvolutionBwdDataAlgoImplicitGEMM,<unused>
256-56-56-1x1-64-56-56-32-0x0-1x1-1x1-0-NCHW-BF16-B=miopenConvolutionBwdDataAlgoImplicitGEMM:ConvHipImplicitGemmBwdDataV1R1Xdlops,0.192486,25690112,miopenConvolutionBwdDataAlgoImplicitGEMM,<unused>
1024-28-28-1x1-512-28-28-32-0x0-1x1-1x1-0-NCHW-BF16-W=miopenConvolutionBwdWeightsAlgoImplicitGEMM:ConvHipImplicitGemmV4R4GenWrWXdlops,0.668635,2097152,miopenConvolutionBwdWeightsAlgoImplicitGEMM,1024x28x28x1x1x512x28x28x32xNCHWxBF16x0x0x1x1x1x1x1x0;miopenConvolutionBwdWeightsAlgoDirect:ConvAsmBwdWrW1x1,1.53235,0,miopenConvolutionBwdWeightsAlgoDirect,<unused>
1024-14-14-3x3-1024-14-14-32-1x1-1x1-1x1-0-NCHW-BF16-W_g32=miopenConvolutionBwdWeightsAlgoImplicitGEMM:ConvHipImplicitGemmV4R4GenWrWXdlops,0.694138,1179648,miopenConvolutionBwdWeightsAlgoImplicitGEMM,1024x14x14x3x3x1024x14x14x32xNCHWxBF16x1x1x1x1x1x1x32x0;miopenConvolutionBwdWeightsAlgoDirect:ConvOclBwdWrW2<8>,1.48028,2359296,miopenConvolutionBwdWeightsAlgoDirect,<unused>
2048-14-14-1x1-1024-14-14-32-0x0-1x1-1x1-0-NCHW-BF16-W=miopenConvolutionBwdWeightsAlgoImplicitGEMM:ConvHipImplicitGemmV4R4GenWrWXdlops,0.705484,8388608,miopenConvolutionBwdWeightsAlgoImplicitGEMM,2048x14x14x1x1x1024x14x14x32xNCHWxBF16x0x0x1x1x1x1x1x0;miopenConvolutionBwdWeightsAlgoDirect:ConvAsmBwdWrW1x1,1.63552,0,miopenConvolutionBwdWeightsAlgoDirect,<unused>
1024-14-14-3x3-1024-28-28-32-1x1-2x2-1x1-0-NCHW-BF16-W_g32=miopenConvolutionBwdWeightsAlgoImplicitGEMM:ConvHipImplicitGemmV4R4GenWrWXdlops,0.261772,1179648,miopenConvolutionBwdWeightsAlgoImplicitGEMM,1024x14x14x3x3x1024x28x28x32xNCHWxBF16x1x1x2x2x1x1x32x0;miopenConvolutionBwdWeightsAlgoDirect:ConvOclBwdWrW2<8>,1.49219,2359296,miopenConvolutionBwdWeightsAlgoDirect,<unused>
2048-7-7-3x3-2048-14-14-32-1x1-2x2-1x1-0-NCHW-BF16-W_g32=miopenConvolutionBwdWeightsAlgoImplicitGEMM:ConvHipImplicitGemmV4R4GenWrWXdlops,0.238018,4718592,miopenConvolutionBwdWeightsAlgoImplicitGEMM,2048x7x7x3x3x2048x14x14x32xNCHWxBF16x1x1x2x2x1x1x32x0;miopenConvolutionBwdWeightsAlgoDirect:ConvOclBwdWrW2<16>,2.75392,4718592,miopenConvolutionBwdWeightsAlgoDirect,<unused>
2048-7-7-1x1-2048-7-7-32-0x0-1x1-1x1-0-NCHW-BF16-W=miopenConvolutionBwdWeightsAlgoImplicitGEMM:ConvHipImplicitGemmV4R4GenWrWXdlops,0.764051,16777216,miopenConvolutionBwdWeightsAlgoImplicitGEMM,2048x7x7x1x1x2048x7x7x32xNCHWxBF16x0x0x1x1x1x1x1x0;miopenConvolutionBwdWeightsAlgoDirect:ConvAsmBwdWrW1x1,0.849207,0,miopenConvolutionBwdWeightsAlgoDirect,<unused>
2048-7-7-3x3-2048-7-7-32-1x1-1x1-1x1-0-NCHW-BF16-W_g32=miopenConvolutionBwdWeightsAlgoImplicitGEMM:ConvHipImplicitGemmV4R4GenWrWXdlops,0.225611,4718592,miopenConvolutionBwdWeightsAlgoImplicitGEMM,2048x7x7x3x3x2048x7x7x32xNCHWxBF16x1x1x1x1x1x1x32x0;miopenConvolutionBwdWeightsAlgoDirect:ConvOclBwdWrW2<16>,2.88855,4718592,miopenConvolutionBwdWeightsAlgoDirect,<unused>
256-56-56-3x3-256-56-56-32-1x1-1x1-1x1-0-NCHW-BF16-W_g32=miopenConvolutionBwdWeightsAlgoDirect:ConvOclBwdWrW2<1>,0.833737,1179648,miopenConvolutionBwdWeightsAlgoDirect,<unused>
512-56-56-1x1-256-56-56-32-0x0-1x1-1x1-0-NCHW-BF16-W=miopenConvolutionBwdWeightsAlgoImplicitGEMM:ConvHipImplicitGemmV4R4GenWrWXdlops,0.708149,524288,miopenConvolutionBwdWeightsAlgoImplicitGEMM,512x56x56x1x1x256x56x56x32xNCHWxBF16x0x0x1x1x1x1x1x0;miopenConvolutionBwdWeightsAlgoDirect:ConvAsmBwdWrW1x1,1.90671,0,miopenConvolutionBwdWeightsAlgoDirect,<unused>
512-28-28-3x3-512-28-28-32-1x1-1x1-1x1-0-NCHW-BF16-W_g32=miopenConvolutionBwdWeightsAlgoImplicitGEMM:ConvHipImplicitGemmV4R4GenWrWXdlops,0.36275,294912,miopenConvolutionBwdWeightsAlgoImplicitGEMM,512x28x28x3x3x512x28x28x32xNCHWxBF16x1x1x1x1x1x1x32x0;miopenConvolutionBwdWeightsAlgoDirect:ConvOclBwdWrW2<2>,1.08862,2359296,miopenConvolutionBwdWeightsAlgoDirect,<unused>
512-28-28-3x3-512-56-56-32-1x1-2x2-1x1-0-NCHW-BF16-W_g32=miopenConvolutionBwdWeightsAlgoImplicitGEMM:ConvHipImplicitGemmV4R4GenWrWXdlops,0.408983,294912,miopenConvolutionBwdWeightsAlgoImplicitGEMM,512x28x28x3x3x512x56x56x32xNCHWxBF16x1x1x2x2x1x1x32x0;miopenConvolutionBwdWeightsAlgoDirect:ConvOclBwdWrW2<2>,1.37392,2359296,miopenConvolutionBwdWeightsAlgoDirect,<unused>
1024-14-14-1x1-1024-14-14-32-0x0-1x1-1x1-0-NCHW-FP32-W=miopenConvolutionBwdWeightsAlgoDirect:ConvAsmBwdWrW1x1,1.00596,0,miopenConvolutionBwdWeightsAlgoDirect,<unused>;miopenConvolutionBwdWeightsAlgoWinograd:ConvBinWinogradRxSf2x3,3.76004,0,miopenConvolutionBwdWeightsAlgoWinograd,1024x14x14x1x1x1024x14x14x32xNCHWxFP32x0x0x1x1x1x1x1x0
2048-7-7-1x1-1024-14-14-32-0x0-2x2-1x1-0-NCHW-FP32-W=miopenConvolutionBwdWeightsAlgoDirect:ConvAsmBwdWrW1x1,0.597662,6422528,miopenConvolutionBwdWeightsAlgoDirect,<unused>
256-56-56-1x1-256-56-56-32-0x0-1x1-1x1-0-NCHW-FP32-W=miopenConvolutionBwdWeightsAlgoDirect:ConvAsmBwdWrW1x1,1.31459,0,miopenConvolutionBwdWeightsAlgoDirect,<unused>;miopenConvolutionBwdWeightsAlgoWinograd:ConvBinWinogradRxSf2x3,6.28357,0,miopenConvolutionBwdWeightsAlgoWinograd,256x56x56x1x1x256x56x56x32xNCHWxFP32x0x0x1x1x1x1x1x0
512-28-28-1x1-256-56-56-32-0x0-2x2-1x1-0-NCHW-FP32-W=miopenConvolutionBwdWeightsAlgoDirect:ConvAsmBwdWrW1x1,0.68503,25690112,miopenConvolutionBwdWeightsAlgoDirect,<unused>
64-112-112-7x7-3-224-224-32-3x3-2x2-1x1-0-NCHW-FP32-W=miopenConvolutionBwdWeightsAlgoDirect:ConvOclBwdWrW2<1>,1.28274,1204224,miopenConvolutionBwdWeightsAlgoDirect,<unused>
1024-14-14-1x1-512-28-28-32-0x0-2x2-1x1-0-NCHW-FP32-W=miopenConvolutionBwdWeightsAlgoDirect:ConvAsmBwdWrW1x1,0.632152,12845056,miopenConvolutionBwdWeightsAlgoDirect,<unused>
512-28-28-1x1-512-28-28-32-0x0-1x1-1x1-0-NCHW-FP32-W=miopenConvolutionBwdWeightsAlgoDirect:ConvAsmBwdWrW1x1,1.02639,0,miopenConvolutionBwdWeightsAlgoDirect,<unused>;miopenConvolutionBwdWeightsAlgoWinograd:ConvBinWinogradRxSf2x3,4.41871,0,miopenConvolutionBwdWeightsAlgoWinograd,512x28x28x1x1x512x28x28x32xNCHWxFP32x0x0x1x1x1x1x1x0
256-56-56-1x1-64-56-56-32-0x0-1x1-1x1-0-NCHW-FP32-W=miopenConvolutionBwdWeightsAlgoDirect:ConvAsmBwdWrW1x1,0.419938,0,miopenConvolutionBwdWeightsAlgoDirect,<unused>;miopenConvolutionBwdWeightsAlgoWinograd:ConvBinWinogradRxSf2x3,4.96864,0,miopenConvolutionBwdWeightsAlgoWinograd,256x56x56x1x1x64x56x56x32xNCHWxFP32x0x0x1x1x1x1x1x0
2048-14-14-1x1-1024-14-14-32-0x0-1x1-1x1-0-NCHW-FP32-W=miopenConvolutionBwdWeightsAlgoDirect:ConvAsmBwdWrW1x1,1.76289,0,miopenConvolutionBwdWeightsAlgoDirect,<unused>;miopenConvolutionBwdWeightsAlgoWinograd:ConvBinWinogradRxSf2x3,7.26437,0,miopenConvolutionBwdWeightsAlgoWinograd,2048x14x14x1x1x1024x14x14x32xNCHWxFP32x0x0x1x1x1x1x1x0
2048-7-7-1x1-2048-7-7-32-0x0-1x1-1x1-0-NCHW-FP32-W=miopenConvolutionBwdWeightsAlgoDirect:ConvAsmBwdWrW1x1,0.984715,0,miopenConvolutionBwdWeightsAlgoDirect,<unused>;miopenConvolutionBwdWeightsAlgoWinograd:ConvBinWinogradRxSf2x3,3.89273,0,miopenConvolutionBwdWeightsAlgoWinograd,2048x7x7x1x1x2048x7x7x32xNCHWxFP32x0x0x1x1x1x1x1x0
512-56-56-1x1-256-56-56-32-0x0-1x1-1x1-0-NCHW-FP32-W=miopenConvolutionBwdWeightsAlgoDirect:ConvAsmBwdWrW1x1,2.58671,0,miopenConvolutionBwdWeightsAlgoDirect,<unused>;miopenConvolutionBwdWeightsAlgoWinograd:ConvBinWinogradRxSf2x3,12.739,0,miopenConvolutionBwdWeightsAlgoWinograd,512x56x56x1x1x256x56x56x32xNCHWxFP32x0x0x1x1x1x1x1x0
1024-28-28-1x1-512-28-28-32-0x0-1x1-1x1-0-NCHW-FP32-W=miopenConvolutionBwdWeightsAlgoDirect:ConvAsmBwdWrW1x1,1.88168,0,miopenConvolutionBwdWeightsAlgoDirect,<unused>;miopenConvolutionBwdWeightsAlgoWinograd:ConvBinWinogradRxSf2x3,7.94907,0,miopenConvolutionBwdWeightsAlgoWinograd,1024x28x28x1x1x512x28x28x32xNCHWxFP32x0x0x1x1x1x1x1x0
1024-14-14-3x3-1024-14-14-32-1x1-1x1-1x1-0-NCHW-FP32-W_g32=miopenConvolutionBwdWeightsAlgoImplicitGEMM:ConvHipImplicitGemmV4R4GenWrWXdlops,0.262834,0,miopenConvolutionBwdWeightsAlgoImplicitGEMM,1024x14x14x3x3x1024x14x14x32xNCHWxFP32x1x1x1x1x1x1x32x0;miopenConvolutionBwdWeightsAlgoDirect:ConvAsmBwdWrW3x3,0.268007,0,miopenConvolutionBwdWeightsAlgoDirect,<unused>;miopenConvolutionBwdWeightsAlgoWinograd:ConvBinWinogradRxSf2x3,0.498565,0,miopenConvolutionBwdWeightsAlgoWinograd,1024x14x14x3x3x1024x14x14x32xNCHWxFP32x1x1x1x1x1x1x32x0
1024-14-14-3x3-1024-28-28-32-1x1-2x2-1x1-0-NCHW-FP32-W_g32=miopenConvolutionBwdWeightsAlgoImplicitGEMM:ConvHipImplicitGemmV4R4GenWrWXdlops,0.276502,0,miopenConvolutionBwdWeightsAlgoImplicitGEMM,1024x14x14x3x3x1024x28x28x32xNCHWxFP32x1x1x2x2x1x1x32x0;miopenConvolutionBwdWeightsAlgoDirect:ConvAsmBwdWrW3x3,0.416146,0,miopenConvolutionBwdWeightsAlgoDirect,<unused>
2048-7-7-3x3-2048-14-14-32-1x1-2x2-1x1-0-NCHW-FP32-W_g32=miopenConvolutionBwdWeightsAlgoImplicitGEMM:ConvHipImplicitGemmV4R4GenWrWXdlops,0.278449,0,miopenConvolutionBwdWeightsAlgoImplicitGEMM,2048x7x7x3x3x2048x14x14x32xNCHWxFP32x1x1x2x2x1x1x32x0;miopenConvolutionBwdWeightsAlgoDirect:ConvAsmBwdWrW3x3,0.38989,0,miopenConvolutionBwdWeightsAlgoDirect,<unused>
2048-7-7-3x3-2048-7-7-32-1x1-1x1-1x1-0-NCHW-FP32-W_g32=miopenConvolutionBwdWeightsAlgoDirect:ConvAsmBwdWrW3x3,0.238773,0,miopenConvolutionBwdWeightsAlgoDirect,<unused>;miopenConvolutionBwdWeightsAlgoImplicitGEMM:ConvHipImplicitGemmV4R4GenWrWXdlops,0.265201,0,miopenConvolutionBwdWeightsAlgoImplicitGEMM,2048x7x7x3x3x2048x7x7x32xNCHWxFP32x1x1x1x1x1x1x32x0;miopenConvolutionBwdWeightsAlgoWinograd:ConvBinWinogradRxSf2x3,0.595738,0,miopenConvolutionBwdWeightsAlgoWinograd,2048x7x7x3x3x2048x7x7x32xNCHWxFP32x1x1x1x1x1x1x32x0
256-56-56-3x3-256-56-56-32-1x1-1x1-1x1-0-NCHW-FP32-W_g32=miopenConvolutionBwdWeightsAlgoDirect:ConvAsmBwdWrW3x3,0.365602,0,miopenConvolutionBwdWeightsAlgoDirect,<unused>;miopenConvolutionBwdWeightsAlgoWinograd:ConvBinWinogradRxSf2x3,8.53279,0,miopenConvolutionBwdWeightsAlgoWinograd,256x56x56x3x3x256x56x56x32xNCHWxFP32x1x1x1x1x1x1x32x0
512-28-28-3x3-512-28-28-32-1x1-1x1-1x1-0-NCHW-FP32-W_g32=miopenConvolutionBwdWeightsAlgoDirect:ConvAsmBwdWrW3x3,0.275678,0,miopenConvolutionBwdWeightsAlgoDirect,<unused>;miopenConvolutionBwdWeightsAlgoImplicitGEMM:ConvHipImplicitGemmV4R4GenWrWXdlops,0.449297,0,miopenConvolutionBwdWeightsAlgoImplicitGEMM,512x28x28x3x3x512x28x28x32xNCHWxFP32x1x1x1x1x1x1x32x0;miopenConvolutionBwdWeightsAlgoWinograd:ConvBinWinogradRxSf2x3,2.26854,0,miopenConvolutionBwdWeightsAlgoWinograd,512x28x28x3x3x512x28x28x32xNCHWxFP32x1x1x1x1x1x1x32x0
512-28-28-3x3-512-56-56-32-1x1-2x2-1x1-0-NCHW-FP32-W_g32=miopenConvolutionBwdWeightsAlgoDirect:ConvAsmBwdWrW3x3,0.495254,0,miopenConvolutionBwdWeightsAlgoDirect,<unused>;miopenConvolutionBwdWeightsAlgoImplicitGEMM:ConvHipImplicitGemmV4R4GenWrWXdlops,0.573568,0,miopenConvolutionBwdWeightsAlgoImplicitGEMM,512x28x28x3x3x512x56x56x32xNCHWxFP32x1x1x2x2x1x1x32x0
512-28-28-1x1-256-56-56-32-0x0-2x2-1x1-0-NCHW-FP16-W=miopenConvolutionBwdWeightsAlgoImplicitGEMM:ConvHipImplicitGemmV4R4GenWrWXdlops,0.375781,524288,miopenConvolutionBwdWeightsAlgoImplicitGEMM,512x28x28x1x1x256x56x56x32xNCHWxFP16x0x0x2x2x1x1x1x0;miopenConvolutionBwdWeightsAlgoDirect:ConvAsmBwdWrW1x1,0.488857,12845056,miopenConvolutionBwdWeightsAlgoDirect,<unused>
64-112-112-7x7-3-224-224-32-3x3-2x2-1x1-0-NCHW-FP16-W=miopenConvolutionBwdWeightsAlgoDirect:ConvOclBwdWrW2<1>,0.839101,602112,miopenConvolutionBwdWeightsAlgoDirect,<unused>
1024-28-28-1x1-512-28-28-32-0x0-1x1-1x1-0-NCHW-FP16-W=miopenConvolutionBwdWeightsAlgoImplicitGEMM:ConvHipImplicitGemmV4R4GenWrWXdlops,0.914356,2097152,miopenConvolutionBwdWeightsAlgoImplicitGEMM,1024x28x28x1x1x512x28x28x32xNCHWxFP16x0x0x1x1x1x1x1x0;miopenConvolutionBwdWeightsAlgoDirect:ConvAsmBwdWrW1x1,1.23122,0,miopenConvolutionBwdWeightsAlgoDirect,<unused>
256-56-56-1x1-64-56-56-32-0x0-1x1-1x1-0-NCHW-FP16-W=miopenConvolutionBwdWeightsAlgoImplicitGEMM:ConvHipImplicitGemmV4R4GenWrWXdlops,0.272521,65536,miopenConvolutionBwdWeightsAlgoImplicitGEMM,256x56x56x1x1x64x56x56x32xNCHWxFP16x0x0x1x1x1x1x1x0;miopenConvolutionBwdWeightsAlgoDirect:ConvAsmBwdWrW1x1,0.291258,0,miopenConvolutionBwdWeightsAlgoDirect,<unused>
1024-14-14-1x1-1024-14-14-32-0x0-1x1-1x1-0-NCHW-FP16-W=miopenConvolutionBwdWeightsAlgoImplicitGEMM:ConvHipImplicitGemmV4R4GenWrWXdlops,0.607199,4194304,miopenConvolutionBwdWeightsAlgoImplicitGEMM,1024x14x14x1x1x1024x14x14x32xNCHWxFP16x0x0x1x1x1x1x1x0;miopenConvolutionBwdWeightsAlgoDirect:ConvAsmBwdWrW1x1,0.680728,0,miopenConvolutionBwdWeightsAlgoDirect,<unused>
1024-14-14-3x3-1024-14-14-32-1x1-1x1-1x1-0-NCHW-FP16-W_g32=miopenConvolutionBwdWeightsAlgoDirect:ConvAsmBwdWrW3x3,0.179253,0,miopenConvolutionBwdWeightsAlgoDirect,<unused>;miopenConvolutionBwdWeightsAlgoImplicitGEMM:ConvHipImplicitGemmV4R4GenWrWXdlops,0.222258,1179648,miopenConvolutionBwdWeightsAlgoImplicitGEMM,1024x14x14x3x3x1024x14x14x32xNCHWxFP16x1x1x1x1x1x1x32x0
2048-14-14-1x1-1024-14-14-32-0x0-1x1-1x1-0-NCHW-FP16-W=miopenConvolutionBwdWeightsAlgoImplicitGEMM:ConvHipImplicitGemmV4R4GenWrWXdlops,1.02661,8388608,miopenConvolutionBwdWeightsAlgoImplicitGEMM,2048x14x14x1x1x1024x14x14x32xNCHWxFP16x0x0x1x1x1x1x1x0;miopenConvolutionBwdWeightsAlgoDirect:ConvAsmBwdWrW1x1,1.2315,0,miopenConvolutionBwdWeightsAlgoDirect,<unused>
2048-7-7-1x1-1024-14-14-32-0x0-2x2-1x1-0-NCHW-FP16-W=miopenConvolutionBwdWeightsAlgoDirect:ConvAsmBwdWrW1x1,0.460141,3211264,miopenConvolutionBwdWeightsAlgoDirect,<unused>;miopenConvolutionBwdWeightsAlgoImplicitGEMM:ConvHipImplicitGemmV4R4GenWrWXdlops,0.725376,8388608,miopenConvolutionBwdWeightsAlgoImplicitGEMM,2048x7x7x1x1x1024x14x14x32xNCHWxFP16x0x0x2x2x1x1x1x0
1024-14-14-3x3-1024-28-28-32-1x1-2x2-1x1-0-NCHW-FP16-W_g32=miopenConvolutionBwdWeightsAlgoDirect:ConvAsmBwdWrW3x3,0.272526,0,miopenConvolutionBwdWeightsAlgoDirect,<unused>;miopenConvolutionBwdWeightsAlgoImplicitGEMM:ConvHipImplicitGemmV4R4GenWrWXdlops,0.273771,1179648,miopenConvolutionBwdWeightsAlgoImplicitGEMM,1024x14x14x3x3x1024x28x28x32xNCHWxFP16x1x1x2x2x1x1x32x0
2048-7-7-3x3-2048-14-14-32-1x1-2x2-1x1-0-NCHW-FP16-W_g32=miopenConvolutionBwdWeightsAlgoImplicitGEMM:ConvHipImplicitGemmV4R4GenWrWXdlops,0.271417,4718592,miopenConvolutionBwdWeightsAlgoImplicitGEMM,2048x7x7x3x3x2048x14x14x32xNCHWxFP16x1x1x2x2x1x1x32x0;miopenConvolutionBwdWeightsAlgoDirect:ConvAsmBwdWrW3x3,0.378652,0,miopenConvolutionBwdWeightsAlgoDirect,<unused>
2048-7-7-1x1-2048-7-7-32-0x0-1x1-1x1-0-NCHW-FP16-W=miopenConvolutionBwdWeightsAlgoDirect:ConvAsmBwdWrW1x1,0.79748,0,miopenConvolutionBwdWeightsAlgoDirect,<unused>;miopenConvolutionBwdWeightsAlgoImplicitGEMM:ConvHipImplicitGemmV4R4GenWrWXdlops,0.893447,16777216,miopenConvolutionBwdWeightsAlgoImplicitGEMM,2048x7x7x1x1x2048x7x7x32xNCHWxFP16x0x0x1x1x1x1x1x0
2048-7-7-3x3-2048-7-7-32-1x1-1x1-1x1-0-NCHW-FP16-W_g32=miopenConvolutionBwdWeightsAlgoImplicitGEMM:ConvHipImplicitGemmV4R4GenWrWXdlops,0.229169,4718592,miopenConvolutionBwdWeightsAlgoImplicitGEMM,2048x7x7x3x3x2048x7x7x32xNCHWxFP16x1x1x1x1x1x1x32x0;miopenConvolutionBwdWeightsAlgoDirect:ConvAsmBwdWrW3x3,0.318445,0,miopenConvolutionBwdWeightsAlgoDirect,<unused>
256-56-56-1x1-256-56-56-32-0x0-1x1-1x1-0-NCHW-FP16-W=miopenConvolutionBwdWeightsAlgoDirect:ConvAsmBwdWrW1x1,0.82794,0,miopenConvolutionBwdWeightsAlgoDirect,<unused>;miopenConvolutionBwdWeightsAlgoImplicitGEMM:ConvHipImplicitGemmV4R4GenWrWXdlops,0.880002,262144,miopenConvolutionBwdWeightsAlgoImplicitGEMM,256x56x56x1x1x256x56x56x32xNCHWxFP16x0x0x1x1x1x1x1x0
256-56-56-3x3-256-56-56-32-1x1-1x1-1x1-0-NCHW-FP16-W_g32=miopenConvolutionBwdWeightsAlgoDirect:ConvAsmBwdWrW3x3,0.296483,0,miopenConvolutionBwdWeightsAlgoDirect,<unused>
512-56-56-1x1-256-56-56-32-0x0-1x1-1x1-0-NCHW-FP16-W=miopenConvolutionBwdWeightsAlgoDirect:ConvAsmBwdWrW1x1,1.57151,0,miopenConvolutionBwdWeightsAlgoDirect,<unused>;miopenConvolutionBwdWeightsAlgoImplicitGEMM:ConvHipImplicitGemmV4R4GenWrWXdlops,1.61537,524288,miopenConvolutionBwdWeightsAlgoImplicitGEMM,512x56x56x1x1x256x56x56x32xNCHWxFP16x0x0x1x1x1x1x1x0
1024-14-14-1x1-512-28-28-32-0x0-2x2-1x1-0-NCHW-FP16-W=miopenConvolutionBwdWeightsAlgoImplicitGEMM:ConvHipImplicitGemmV4R4GenWrWXdlops,0.362653,2097152,miopenConvolutionBwdWeightsAlgoImplicitGEMM,1024x14x14x1x1x512x28x28x32xNCHWxFP16x0x0x2x2x1x1x1x0;miopenConvolutionBwdWeightsAlgoDirect:ConvAsmBwdWrW1x1,0.444135,6422528,miopenConvolutionBwdWeightsAlgoDirect,<unused>
512-28-28-1x1-512-28-28-32-0x0-1x1-1x1-0-NCHW-FP16-W=miopenConvolutionBwdWeightsAlgoImplicitGEMM:ConvHipImplicitGemmV4R4GenWrWXdlops,0.487171,1048576,miopenConvolutionBwdWeightsAlgoImplicitGEMM,512x28x28x1x1x512x28x28x32xNCHWxFP16x0x0x1x1x1x1x1x0;miopenConvolutionBwdWeightsAlgoDirect:ConvAsmBwdWrW1x1,0.708203,0,miopenConvolutionBwdWeightsAlgoDirect,<unused>
512-28-28-3x3-512-28-28-32-1x1-1x1-1x1-0-NCHW-FP16-W_g32=miopenConvolutionBwdWeightsAlgoDirect:ConvAsmBwdWrW3x3,0.191568,0,miopenConvolutionBwdWeightsAlgoDirect,<unused>;miopenConvolutionBwdWeightsAlgoImplicitGEMM:ConvHipImplicitGemmV4R4GenWrWXdlops,0.364213,294912,miopenConvolutionBwdWeightsAlgoImplicitGEMM,512x28x28x3x3x512x28x28x32xNCHWxFP16x1x1x1x1x1x1x32x0
512-28-28-3x3-512-56-56-32-1x1-2x2-1x1-0-NCHW-FP16-W_g32=miopenConvolutionBwdWeightsAlgoDirect:ConvAsmBwdWrW3x3,0.350205,0,miopenConvolutionBwdWeightsAlgoDirect,<unused>;miopenConvolutionBwdWeightsAlgoImplicitGEMM:ConvHipImplicitGemmV4R4GenWrWXdlops,0.468973,294912,miopenConvolutionBwdWeightsAlgoImplicitGEMM,512x28x28x3x3x512x56x56x32xNCHWxFP16x1x1x2x2x1x1x32x0
64-112-112-7x7-3-224-224-32-3x3-2x2-1x1-0-NCHW-BF16-W=miopenConvolutionBwdWeightsAlgoDirect:ConvOclBwdWrW2<1>,0.975226,602112,miopenConvolutionBwdWeightsAlgoDirect,<unused>
1024-14-14-1x1-1024-14-14-32-0x0-1x1-1x1-0-NCHW-BF16-W=miopenConvolutionBwdWeightsAlgoImplicitGEMM:ConvHipImplicitGemmV4R4GenWrWXdlops,0.414667,4194304,miopenConvolutionBwdWeightsAlgoImplicitGEMM,1024x14x14x1x1x1024x14x14x32xNCHWxBF16x0x0x1x1x1x1x1x0;miopenConvolutionBwdWeightsAlgoDirect:ConvAsmBwdWrW1x1,0.800159,0,miopenConvolutionBwdWeightsAlgoDirect,<unused>
256-56-56-1x1-256-56-56-32-0x0-1x1-1x1-0-NCHW-BF16-W=miopenConvolutionBwdWeightsAlgoImplicitGEMM:ConvHipImplicitGemmV4R4GenWrWXdlops,0.465107,262144,miopenConvolutionBwdWeightsAlgoImplicitGEMM,256x56x56x1x1x256x56x56x32xNCHWxBF16x0x0x1x1x1x1x1x0;miopenConvolutionBwdWeightsAlgoDirect:ConvAsmBwdWrW1x1,1.06407,0,miopenConvolutionBwdWeightsAlgoDirect,<unused>
512-28-28-1x1-512-28-28-32-0x0-1x1-1x1-0-NCHW-BF16-W=miopenConvolutionBwdWeightsAlgoImplicitGEMM:ConvHipImplicitGemmV4R4GenWrWXdlops,0.382134,1048576,miopenConvolutionBwdWeightsAlgoImplicitGEMM,512x28x28x1x1x512x28x28x32xNCHWxBF16x0x0x1x1x1x1x1x0;miopenConvolutionBwdWeightsAlgoDirect:ConvAsmBwdWrW1x1,0.828302,0,miopenConvolutionBwdWeightsAlgoDirect,<unused>
1024-14-14-1x1-512-28-28-32-0x0-2x2-1x1-0-NCHW-BF16-W=miopenConvolutionBwdWeightsAlgoImplicitGEMM:ConvHipImplicitGemmV4R4GenWrWXdlops,0.341949,2097152,miopenConvolutionBwdWeightsAlgoImplicitGEMM,1024x14x14x1x1x512x28x28x32xNCHWxBF16x0x0x2x2x1x1x1x0;miopenConvolutionBwdWeightsAlgoDirect:ConvAsmBwdWrW1x1,0.448223,6422528,miopenConvolutionBwdWeightsAlgoDirect,<unused>
512-28-28-1x1-256-56-56-32-0x0-2x2-1x1-0-NCHW-BF16-W=miopenConvolutionBwdWeightsAlgoImplicitGEMM:ConvHipImplicitGemmV4R4GenWrWXdlops,0.277695,524288,miopenConvolutionBwdWeightsAlgoImplicitGEMM,512x28x28x1x1x256x56x56x32xNCHWxBF16x0x0x2x2x1x1x1x0;miopenConvolutionBwdWeightsAlgoDirect:ConvAsmBwdWrW1x1,0.500641,12845056,miopenConvolutionBwdWeightsAlgoDirect,<unused>
256-56-56-1x1-64-56-56-32-0x0-1x1-1x1-0-NCHW-BF16-W=miopenConvolutionBwdWeightsAlgoImplicitGEMM:ConvHipImplicitGemmV4R4GenWrWXdlops,0.216485,65536,miopenConvolutionBwdWeightsAlgoImplicitGEMM,256x56x56x1x1x64x56x56x32xNCHWxBF16x0x0x1x1x1x1x1x0;miopenConvolutionBwdWeightsAlgoDirect:ConvAsmBwdWrW1x1,0.363331,0,miopenConvolutionBwdWeightsAlgoDirect,<unused>
2048-7-7-1x1-1024-14-14-32-0x0-2x2-1x1-0-NCHW-BF16-W=miopenConvolutionBwdWeightsAlgoDirect:ConvAsmBwdWrW1x1,0.458651,3211264,miopenConvolutionBwdWeightsAlgoDirect,<unused>;miopenConvolutionBwdWeightsAlgoImplicitGEMM:ConvHipImplicitGemmV4R4GenWrWXdlops,0.527726,8388608,miopenConvolutionBwdWeightsAlgoImplicitGEMM,2048x7x7x1x1x1024x14x14x32xNCHWxBF16x0x0x2x2x1x1x1x0
128-28-28-3x3-128-28-28-32-1x1-1x1-1x1-0-NCHW-BF16-W=miopenConvolutionBwdWeightsAlgoWinograd:ConvWinograd3x3MultipassWrW<3-5>,0.243917,30507008,miopenConvolutionBwdWeightsAlgoWinograd,128x28x28x3x3x128x28x28x32xNCHWxBF16x1x1x1x1x1x1x1x0;miopenConvolutionBwdWeightsAlgoImplicitGEMM:ConvHipImplicitGemmV4R4GenWrWXdlops,0.276183,589824,miopenConvolutionBwdWeightsAlgoImplicitGEMM,128x28x28x3x3x128x28x28x32xNCHWxBF16x1x1x1x1x1x1x1x0;miopenConvolutionBwdWeightsAlgoDirect:ConvOclBwdWrW53,1.27053,0,miopenConvolutionBwdWeightsAlgoDirect,<unused>
128-28-28-3x3-128-28-28-64-1x1-1x1-1x1-0-NCHW-BF16-W=miopenConvolutionBwdWeightsAlgoWinograd:ConvWinograd3x3MultipassWrW<3-5>,0.413347,59408384,miopenConvolutionBwdWeightsAlgoWinograd,128x28x28x3x3x128x28x28x64xNCHWxBF16x1x1x1x1x1x1x1x0;miopenConvolutionBwdWeightsAlgoImplicitGEMM:ConvHipImplicitGemmV4R4GenWrWXdlops,0.452317,589824,miopenConvolutionBwdWeightsAlgoImplicitGEMM,128x28x28x3x3x128x28x28x64xNCHWxBF16x1x1x1x1x1x1x1x0;miopenConvolutionBwdWeightsAlgoDirect:ConvOclBwdWrW53,2.53891,0,miopenConvolutionBwdWeightsAlgoDirect,<unused>
128-28-28-3x3-128-28-28-128-1x1-1x1-1x1-0-NCHW-BF16-W=miopenConvolutionBwdWeightsAlgoImplicitGEMM:ConvHipImplicitGemmV4R4GenWrWXdlops,0.760477,589824,miopenConvolutionBwdWeightsAlgoImplicitGEMM,128x28x28x3x3x128x28x28x128xNCHWxBF16x1x1x1x1x1x1x1x0;miopenConvolutionBwdWeightsAlgoWinograd:ConvWinograd3x3MultipassWrW<3-4>,1.06147,116785152,miopenConvolutionBwdWeightsAlgoWinograd,128x28x28x3x3x128x28x28x128xNCHWxBF16x1x1x1x1x1x1x1x0;miopenConvolutionBwdWeightsAlgoDirect:ConvOclBwdWrW53,5.07439,0,miopenConvolutionBwdWeightsAlgoDirect,<unused>
256-14-14-3x3-256-14-14-128-1x1-1x1-1x1-0-NCHW-BF16-W=miopenConvolutionBwdWeightsAlgoWinograd:ConvWinograd3x3MultipassWrW<3-5>,0.501656,64225280,miopenConvolutionBwdWeightsAlgoWinograd,256x14x14x3x3x256x14x14x128xNCHWxBF16x1x1x1x1x1x1x1x0;miopenConvolutionBwdWeightsAlgoImplicitGEMM:ConvHipImplicitGemmV4R4GenWrWXdlops,0.819392,2359296,miopenConvolutionBwdWeightsAlgoImplicitGEMM,256x14x14x3x3x256x14x14x128xNCHWxBF16x1x1x1x1x1x1x1x0;miopenConvolutionBwdWeightsAlgoDirect:ConvOclBwdWrW53,2.794,0,miopenConvolutionBwdWeightsAlgoDirect,<unused>
512-7-7-3x3-512-7-7-128-1x1-1x1-1x1-0-NCHW-BF16-W=miopenConvolutionBwdWeightsAlgoWinograd:ConvWinograd3x3MultipassWrW<3-4>,0.528581,56623104,miopenConvolutionBwdWeightsAlgoWinograd,512x7x7x3x3x512x7x7x128xNCHWxBF16x1x1x1x1x1x1x1x0;miopenConvolutionBwdWeightsAlgoImplicitGEMM:ConvHipImplicitGemmV4R4GenWrWXdlops,0.846273,9437184,miopenConvolutionBwdWeightsAlgoImplicitGEMM,512x7x7x3x3x512x7x7x128xNCHWxBF16x1x1x1x1x1x1x1x0;miopenConvolutionBwdWeightsAlgoDirect:ConvOclBwdWrW53,4.84611,0,miopenConvolutionBwdWeightsAlgoDirect,<unused>
64-56-56-3x3-64-56-56-32-1x1-1x1-1x1-0-NCHW-BF16-W=miopenConvolutionBwdWeightsAlgoWinograd:ConvWinograd3x3MultipassWrW<3-5>,0.446634,58204160,miopenConvolutionBwdWeightsAlgoWinograd,64x56x56x3x3x64x56x56x32xNCHWxBF16x1x1x1x1x1x1x1x0;miopenConvolutionBwdWeightsAlgoImplicitGEMM:ConvHipImplicitGemmV4R4GenWrWXdlops,0.452116,147456,miopenConvolutionBwdWeightsAlgoImplicitGEMM,64x56x56x3x3x64x56x56x32xNCHWxBF16x1x1x1x1x1x1x1x0;miopenConvolutionBwdWeightsAlgoDirect:ConvOclBwdWrW53,0.87689,2359296,miopenConvolutionBwdWeightsAlgoDirect,<unused>
64-56-56-3x3-64-56-56-64-1x1-1x1-1x1-0-NCHW-BF16-W=miopenConvolutionBwdWeightsAlgoImplicitGEMM:ConvHipImplicitGemmV4R4GenWrWXdlops,0.826827,147456,miopenConvolutionBwdWeightsAlgoImplicitGEMM,64x56x56x3x3x64x56x56x64xNCHWxBF16x1x1x1x1x1x1x1x0;miopenConvolutionBwdWeightsAlgoWinograd:ConvWinograd3x3MultipassWrW<3-4>,1.16343,115900416,miopenConvolutionBwdWeightsAlgoWinograd,64x56x56x3x3x64x56x56x64xNCHWxBF16x1x1x1x1x1x1x1x0;miopenConvolutionBwdWeightsAlgoDirect:ConvOclBwdWrW53,1.79391,4718592,miopenConvolutionBwdWeightsAlgoDirect,<unused>
64-56-56-3x3-64-56-56-128-1x1-1x1-1x1-0-NCHW-BF16-W=miopenConvolutionBwdWeightsAlgoImplicitGEMM:ConvHipImplicitGemmV4R4GenWrWXdlops,1.55598,147456,miopenConvolutionBwdWeightsAlgoImplicitGEMM,64x56x56x3x3x64x56x56x128xNCHWxBF16x1x1x1x1x1x1x1x0;miopenConvolutionBwdWeightsAlgoWinograd:ConvWinograd3x3MultipassWrW<3-6>,2.68746,210239488,miopenConvolutionBwdWeightsAlgoWinograd,64x56x56x3x3x64x56x56x128xNCHWxBF16x1x1x1x1x1x1x1x0;miopenConvolutionBwdWeightsAlgoDirect:ConvOclBwdWrW53,3.60532,9437184,miopenConvolutionBwdWeightsAlgoDirect,<unused>
32-30-30-3x3-3-32-32-32-0x0-1x1-1x1-0-NCHW-BF16-W=miopenConvolutionBwdWeightsAlgoDirect:ConvOclBwdWrW53,0.045783,55296,miopenConvolutionBwdWeightsAlgoDirect,<unused>;miopenConvolutionBwdWeightsAlgoWinograd:ConvWinograd3x3MultipassWrW<3-6>,0.26217,3596288,miopenConvolutionBwdWeightsAlgoWinograd,32x30x30x3x3x3x32x32x32xNCHWxBF16x0x0x1x1x1x1x1x0
2048-28-28-1x1-1024-28-28-32-0x0-1x1-1x1-0-NCHW-BF16-W=miopenConvolutionBwdWeightsAlgoImplicitGEMM:ConvHipImplicitGemmV4R4GenWrWXdlops,2.084,8388608,miopenConvolutionBwdWeightsAlgoImplicitGEMM,2048x28x28x1x1x1024x28x28x32xNCHWxBF16x0x0x1x1x1x1x1x0;miopenConvolutionBwdWeightsAlgoDirect:ConvAsmBwdWrW1x1,6.10077,0,miopenConvolutionBwdWeightsAlgoDirect,<unused>
2048-28-28-1x1-1024-28-28-64-0x0-1x1-1x1-0-NCHW-BF16-W=miopenConvolutionBwdWeightsAlgoImplicitGEMM:ConvHipImplicitGemmV4R4GenWrWXdlops,3.88912,8388608,miopenConvolutionBwdWeightsAlgoImplicitGEMM,2048x28x28x1x1x1024x28x28x64xNCHWxBF16x0x0x1x1x1x1x1x0;miopenConvolutionBwdWeightsAlgoDirect:ConvAsmBwdWrW1x1,12.3784,0,miopenConvolutionBwdWeightsAlgoDirect,<unused>
256-28-28-1x1-1024-28-28-32-0x0-1x1-1x1-0-NCHW-BF16-W=miopenConvolutionBwdWeightsAlgoImplicitGEMM:ConvHipImplicitGemmV4R4GenWrWXdlops,0.437673,1048576,miopenConvolutionBwdWeightsAlgoImplicitGEMM,256x28x28x1x1x1024x28x28x32xNCHWxBF16x0x0x1x1x1x1x1x0;miopenConvolutionBwdWeightsAlgoDirect:ConvAsmBwdWrW1x1,0.859423,0,miopenConvolutionBwdWeightsAlgoDirect,<unused>
256-28-28-1x1-1024-28-28-64-0x0-1x1-1x1-0-NCHW-BF16-W=miopenConvolutionBwdWeightsAlgoImplicitGEMM:ConvHipImplicitGemmV4R4GenWrWXdlops,0.669368,1048576,miopenConvolutionBwdWeightsAlgoImplicitGEMM,256x28x28x1x1x1024x28x28x64xNCHWxBF16x0x0x1x1x1x1x1x0;miopenConvolutionBwdWeightsAlgoDirect:ConvAsmBwdWrW1x1,1.80465,0,miopenConvolutionBwdWeightsAlgoDirect,<unused>
512-28-28-1x1-1024-28-28-32-0x0-1x1-1x1-0-NCHW-BF16-W=miopenConvolutionBwdWeightsAlgoImplicitGEMM:ConvHipImplicitGemmV4R4GenWrWXdlops,0.674099,2097152,miopenConvolutionBwdWeightsAlgoImplicitGEMM,512x28x28x1x1x1024x28x28x32xNCHWxBF16x0x0x1x1x1x1x1x0;miopenConvolutionBwdWeightsAlgoDirect:ConvAsmBwdWrW1x1,1.64847,0,miopenConvolutionBwdWeightsAlgoDirect,<unused>
512-28-28-1x1-1024-28-28-64-0x0-1x1-1x1-0-NCHW-BF16-W=miopenConvolutionBwdWeightsAlgoImplicitGEMM:ConvHipImplicitGemmV4R4GenWrWXdlops,1.15553,2097152,miopenConvolutionBwdWeightsAlgoImplicitGEMM,512x28x28x1x1x1024x28x28x64xNCHWxBF16x0x0x1x1x1x1x1x0;miopenConvolutionBwdWeightsAlgoDirect:ConvAsmBwdWrW1x1,3.28942,0,miopenConvolutionBwdWeightsAlgoDirect,<unused>
256-28-28-1x1-1280-28-28-32-0x0-1x1-1x1-0-NCHW-BF16-W=miopenConvolutionBwdWeightsAlgoImplicitGEMM:ConvHipImplicitGemmV4R4GenWrWXdlops,0.44514,1310720,miopenConvolutionBwdWeightsAlgoImplicitGEMM,256x28x28x1x1x1280x28x28x32xNCHWxBF16x0x0x1x1x1x1x1x0;miopenConvolutionBwdWeightsAlgoDirect:ConvAsmBwdWrW1x1,0.982957,0,miopenConvolutionBwdWeightsAlgoDirect,<unused>
256-28-28-1x1-1280-28-28-64-0x0-1x1-1x1-0-NCHW-BF16-W=miopenConvolutionBwdWeightsAlgoImplicitGEMM:ConvHipImplicitGemmV4R4GenWrWXdlops,0.762522,1310720,miopenConvolutionBwdWeightsAlgoImplicitGEMM,256x28x28x1x1x1280x28x28x64xNCHWxBF16x0x0x1x1x1x1x1x0;miopenConvolutionBwdWeightsAlgoDirect:ConvAsmBwdWrW1x1,2.03028,0,miopenConvolutionBwdWeightsAlgoDirect,<unused>
256-1-1-1x1-2048-1-1-32-0x0-1x1-1x1-0-NCHW-BF16-W=miopenConvolutionBwdWeightsAlgoDirect:ConvAsmBwdWrW1x1,0.020424,0,miopenConvolutionBwdWeightsAlgoDirect,<unused>;miopenConvolutionBwdWeightsAlgoImplicitGEMM:ConvHipImplicitGemmV4R4GenWrWXdlops,0.044538,2097152,miopenConvolutionBwdWeightsAlgoImplicitGEMM,256x1x1x1x1x2048x1x1x32xNCHWxBF16x0x0x1x1x1x1x1x0
256-1-1-1x1-2048-1-1-64-0x0-1x1-1x1-0-NCHW-BF16-W=miopenConvolutionBwdWeightsAlgoDirect:ConvAsmBwdWrW1x1,0.031218,0,miopenConvolutionBwdWeightsAlgoDirect,<unused>;miopenConvolutionBwdWeightsAlgoImplicitGEMM:ConvHipImplicitGemmV4R4GenWrWXdlops,0.041183,2097152,miopenConvolutionBwdWeightsAlgoImplicitGEMM,256x1x1x1x1x2048x1x1x64xNCHWxBF16x0x0x1x1x1x1x1x0
256-28-28-1x1-2048-28-28-32-0x0-1x1-1x1-0-NCHW-BF16-W=miopenConvolutionBwdWeightsAlgoImplicitGEMM:ConvHipImplicitGemmV4R4GenWrWXdlops,0.67164,2097152,miopenConvolutionBwdWeightsAlgoImplicitGEMM,256x28x28x1x1x2048x28x28x32xNCHWxBF16x0x0x1x1x1x1x1x0;miopenConvolutionBwdWeightsAlgoDirect:ConvAsmBwdWrW1x1,1.67132,0,miopenConvolutionBwdWeightsAlgoDirect,<unused>
256-28-28-1x1-2048-28-28-64-0x0-1x1-1x1-0-NCHW-BF16-W=miopenConvolutionBwdWeightsAlgoImplicitGEMM:ConvHipImplicitGemmV4R4GenWrWXdlops,1.1524,2097152,miopenConvolutionBwdWeightsAlgoImplicitGEMM,256x28x28x1x1x2048x28x28x64xNCHWxBF16x0x0x1x1x1x1x1x0;miopenConvolutionBwdWeightsAlgoDirect:ConvAsmBwdWrW1x1,3.4119,0,miopenConvolutionBwdWeightsAlgoDirect,<unused>
256-28-28-3x3-2048-28-28-32-36x36-1x1-36x36-0-NCHW-BF16-W=miopenConvolutionBwdWeightsAlgoImplicitGEMM:ConvHipImplicitGemmV4R4GenWrWXdlops,3.8742,18874368,miopenConvolutionBwdWeightsAlgoImplicitGEMM,256x28x28x3x3x2048x28x28x32xNCHWxBF16x36x36x1x1x36x36x1x0
256-28-28-3x3-2048-28-28-64-36x36-1x1-36x36-0-NCHW-BF16-W=miopenConvolutionBwdWeightsAlgoImplicitGEMM:ConvHipImplicitGemmV4R4GenWrWXdlops,7.5588,18874368,miopenConvolutionBwdWeightsAlgoImplicitGEMM,256x28x28x3x3x2048x28x28x64xNCHWxBF16x36x36x1x1x36x36x1x0
512-28-28-1x1-2048-28-28-32-0x0-1x1-1x1-0-NCHW-BF16-W=miopenConvolutionBwdWeightsAlgoImplicitGEMM:ConvHipImplicitGemmV4R4GenWrWXdlops,1.16451,4194304,miopenConvolutionBwdWeightsAlgoImplicitGEMM,512x28x28x1x1x2048x28x28x32xNCHWxBF16x0x0x1x1x1x1x1x0;miopenConvolutionBwdWeightsAlgoDirect:ConvAsmBwdWrW1x1,3.16364,0,miopenConvolutionBwdWeightsAlgoDirect,<unused>
512-28-28-1x1-2048-28-28-64-0x0-1x1-1x1-0-NCHW-BF16-W=miopenConvolutionBwdWeightsAlgoImplicitGEMM:ConvHipImplicitGemmV4R4GenWrWXdlops,2.05528,4194304,miopenConvolutionBwdWeightsAlgoImplicitGEMM,512x28x28x1x1x2048x28x28x64xNCHWxBF16x0x0x1x1x1x1x1x0;miopenConvolutionBwdWeightsAlgoDirect:ConvAsmBwdWrW1x1,6.30681,0,miopenConvolutionBwdWeightsAlgoDirect,<unused>
1024-28-28-1x1-256-28-28-32-0x0-1x1-1x1-0-NCHW-BF16-W=miopenConvolutionBwdWeightsAlgoImplicitGEMM:ConvHipImplicitGemmV4R4GenWrWXdlops,0.388934,1048576,miopenConvolutionBwdWeightsAlgoImplicitGEMM,1024x28x28x1x1x256x28x28x32xNCHWxBF16x0x0x1x1x1x1x1x0;miopenConvolutionBwdWeightsAlgoDirect:ConvAsmBwdWrW1x1,0.799431,0,miopenConvolutionBwdWeightsAlgoDirect,<unused>
1024-28-28-1x1-256-28-28-64-0x0-1x1-1x1-0-NCHW-BF16-W=miopenConvolutionBwdWeightsAlgoImplicitGEMM:ConvHipImplicitGemmV4R4GenWrWXdlops,0.655098,1048576,miopenConvolutionBwdWeightsAlgoImplicitGEMM,1024x28x28x1x1x256x28x28x64xNCHWxBF16x0x0x1x1x1x1x1x0;miopenConvolutionBwdWeightsAlgoDirect:ConvAsmBwdWrW1x1,1.63352,0,miopenConvolutionBwdWeightsAlgoDirect,<unused>
21-28-28-1x1-256-28-28-32-0x0-1x1-1x1-0-NCHW-BF16-W=miopenConvolutionBwdWeightsAlgoDirect:ConvAsmBwdWrW1x1,0.053269,0,miopenConvolutionBwdWeightsAlgoDirect,<unused>
21-28-28-1x1-256-28-28-64-0x0-1x1-1x1-0-NCHW-BF16-W=miopenConvolutionBwdWeightsAlgoDirect:ConvAsmBwdWrW1x1,0.096208,0,miopenConvolutionBwdWeightsAlgoDirect,<unused>
256-28-28-3x3-256-28-28-32-1x1-1x1-1x1-0-NCHW-BF16-W=miopenConvolutionBwdWeightsAlgoWinograd:ConvWinograd3x3MultipassWrW<3-5>,0.496377,64225280,miopenConvolutionBwdWeightsAlgoWinograd,256x28x28x3x3x256x28x28x32xNCHWxBF16x1x1x1x1x1x1x1x0;miopenConvolutionBwdWeightsAlgoImplicitGEMM:ConvHipImplicitGemmV4R4GenWrWXdlops,0.768584,2359296,miopenConvolutionBwdWeightsAlgoImplicitGEMM,256x28x28x3x3x256x28x28x32xNCHWxBF16x1x1x1x1x1x1x1x0;miopenConvolutionBwdWeightsAlgoDirect:ConvOclBwdWrW53,2.79593,0,miopenConvolutionBwdWeightsAlgoDirect,<unused>
256-28-28-3x3-256-28-28-64-1x1-1x1-1x1-0-NCHW-BF16-W=miopenConvolutionBwdWeightsAlgoWinograd:ConvWinograd3x3MultipassWrW<3-4>,1.3761,120324096,miopenConvolutionBwdWeightsAlgoWinograd,256x28x28x3x3x256x28x28x64xNCHWxBF16x1x1x1x1x1x1x1x0;miopenConvolutionBwdWeightsAlgoImplicitGEMM:ConvHipImplicitGemmV4R4GenWrWXdlops,1.41467,2359296,miopenConvolutionBwdWeightsAlgoImplicitGEMM,256x28x28x3x3x256x28x28x64xNCHWxBF16x1x1x1x1x1x1x1x0;miopenConvolutionBwdWeightsAlgoDirect:ConvOclBwdWrW53,5.64919,0,miopenConvolutionBwdWeightsAlgoDirect,<unused>
256-28-28-3x3-256-28-28-32-2x2-1x1-2x2-0-NCHW-BF16-W=miopenConvolutionBwdWeightsAlgoImplicitGEMM:ConvHipImplicitGemmV4R4GenWrWXdlops,0.779151,2359296,miopenConvolutionBwdWeightsAlgoImplicitGEMM,256x28x28x3x3x256x28x28x32xNCHWxBF16x2x2x1x1x2x2x1x0
256-28-28-3x3-256-28-28-64-2x2-1x1-2x2-0-NCHW-BF16-W=miopenConvolutionBwdWeightsAlgoImplicitGEMM:ConvHipImplicitGemmV4R4GenWrWXdlops,1.46353,2359296,miopenConvolutionBwdWeightsAlgoImplicitGEMM,256x28x28x3x3x256x28x28x64xNCHWxBF16x2x2x1x1x2x2x1x0
1024-28-28-1x1-512-28-28-64-0x0-1x1-1x1-0-NCHW-BF16-W=miopenConvolutionBwdWeightsAlgoImplicitGEMM:ConvHipImplicitGemmV4R4GenWrWXdlops,1.16374,2097152,miopenConvolutionBwdWeightsAlgoImplicitGEMM,1024x28x28x1x1x512x28x28x64xNCHWxBF16x0x0x1x1x1x1x1x0;miopenConvolutionBwdWeightsAlgoDirect:ConvAsmBwdWrW1x1,3.01789,0,miopenConvolutionBwdWeightsAlgoDirect,<unused>
2048-28-28-1x1-512-28-28-32-0x0-1x1-1x1-0-NCHW-BF16-W=miopenConvolutionBwdWeightsAlgoImplicitGEMM:ConvHipImplicitGemmV4R4GenWrWXdlops,1.16918,4194304,miopenConvolutionBwdWeightsAlgoImplicitGEMM,2048x28x28x1x1x512x28x28x32xNCHWxBF16x0x0x1x1x1x1x1x0;miopenConvolutionBwdWeightsAlgoDirect:ConvAsmBwdWrW1x1,3.02071,0,miopenConvolutionBwdWeightsAlgoDirect,<unused>
2048-28-28-1x1-512-28-28-64-0x0-1x1-1x1-0-NCHW-BF16-W=miopenConvolutionBwdWeightsAlgoImplicitGEMM:ConvHipImplicitGemmV4R4GenWrWXdlops,2.01555,4194304,miopenConvolutionBwdWeightsAlgoImplicitGEMM,2048x28x28x1x1x512x28x28x64xNCHWxBF16x0x0x1x1x1x1x1x0;miopenConvolutionBwdWeightsAlgoDirect:ConvAsmBwdWrW1x1,6.17577,0,miopenConvolutionBwdWeightsAlgoDirect,<unused>
512-28-28-3x3-512-28-28-32-2x2-1x1-2x2-0-NCHW-BF16-W=miopenConvolutionBwdWeightsAlgoImplicitGEMM:ConvHipImplicitGemmV4R4GenWrWXdlops,2.76275,9437184,miopenConvolutionBwdWeightsAlgoImplicitGEMM,512x28x28x3x3x512x28x28x32xNCHWxBF16x2x2x1x1x2x2x1x0
512-28-28-3x3-512-28-28-64-2x2-1x1-2x2-0-NCHW-BF16-W=miopenConvolutionBwdWeightsAlgoImplicitGEMM:ConvHipImplicitGemmV4R4GenWrWXdlops,5.34504,9437184,miopenConvolutionBwdWeightsAlgoImplicitGEMM,512x28x28x3x3x512x28x28x64xNCHWxBF16x2x2x1x1x2x2x1x0
512-28-28-3x3-512-28-28-32-4x4-1x1-4x4-0-NCHW-BF16-W=miopenConvolutionBwdWeightsAlgoImplicitGEMM:ConvHipImplicitGemmV4R4GenWrWXdlops,2.51876,9437184,miopenConvolutionBwdWeightsAlgoImplicitGEMM,512x28x28x3x3x512x28x28x32xNCHWxBF16x4x4x1x1x4x4x1x0
512-28-28-3x3-512-28-28-64-4x4-1x1-4x4-0-NCHW-BF16-W=miopenConvolutionBwdWeightsAlgoImplicitGEMM:ConvHipImplicitGemmV4R4GenWrWXdlops,4.91434,9437184,miopenConvolutionBwdWeightsAlgoImplicitGEMM,512x28x28x3x3x512x28x28x64xNCHWxBF16x4x4x1x1x4x4x1x0
2048-7-7-1x1-1024-14-14-128-0x0-2x2-1x1-0-NCHW-FP32-W=miopenConvolutionBwdWeightsAlgoDirect:ConvAsmBwdWrW1x1,2.13052,25690112,miopenConvolutionBwdWeightsAlgoDirect,<unused>
256-14-14-1x1-1024-14-14-128-0x0-1x1-1x1-0-NCHW-FP32-W=miopenConvolutionBwdWeightsAlgoDirect:ConvAsmBwdWrW1x1,1.33495,0,miopenConvolutionBwdWeightsAlgoDirect,<unused>;miopenConvolutionBwdWeightsAlgoWinograd:ConvBinWinogradRxSf2x3,4.39789,0,miopenConvolutionBwdWeightsAlgoWinograd,256x14x14x1x1x1024x14x14x128xNCHWxFP32x0x0x1x1x1x1x1x0
512-7-7-1x1-1024-14-14-128-0x0-2x2-1x1-0-NCHW-FP32-W=miopenConvolutionBwdWeightsAlgoDirect:ConvAsmBwdWrW1x1,0.718173,25690112,miopenConvolutionBwdWeightsAlgoDirect,<unused>
128-28-28-3x3-128-28-28-128-1x1-1x1-1x1-0-NCHW-FP32-W=miopenConvolutionBwdWeightsAlgoWinograd:ConvWinograd3x3MultipassWrW<3-5>,1.85687,234422272,miopenConvolutionBwdWeightsAlgoWinograd,128x28x28x3x3x128x28x28x128xNCHWxFP32x1x1x1x1x1x1x1x0;miopenConvolutionBwdWeightsAlgoDirect:ConvAsmBwdWrW3x3,1.95996,0,miopenConvolutionBwdWeightsAlgoDirect,<unused>
512-28-28-1x1-128-28-28-128-0x0-1x1-1x1-0-NCHW-FP32-W=miopenConvolutionBwdWeightsAlgoDirect:ConvAsmBwdWrW1x1,1.31671,0,miopenConvolutionBwdWeightsAlgoDirect,<unused>;miopenConvolutionBwdWeightsAlgoWinograd:ConvBinWinogradRxSf2x3,5.58835,0,miopenConvolutionBwdWeightsAlgoWinograd,512x28x28x1x1x128x28x28x128xNCHWxFP32x0x0x1x1x1x1x1x0
512-7-7-1x1-2048-7-7-128-0x0-1x1-1x1-0-NCHW-FP32-W=miopenConvolutionBwdWeightsAlgoDirect:ConvAsmBwdWrW1x1,1.08093,0,miopenConvolutionBwdWeightsAlgoDirect,<unused>;miopenConvolutionBwdWeightsAlgoWinograd:ConvBinWinogradRxSf2x3,3.99563,0,miopenConvolutionBwdWeightsAlgoWinograd,512x7x7x1x1x2048x7x7x128xNCHWxFP32x0x0x1x1x1x1x1x0
1024-14-14-1x1-256-14-14-128-0x0-1x1-1x1-0-NCHW-FP32-W=miopenConvolutionBwdWeightsAlgoDirect:ConvAsmBwdWrW1x1,1.32815,0,miopenConvolutionBwdWeightsAlgoDirect,<unused>;miopenConvolutionBwdWeightsAlgoWinograd:ConvBinWinogradRxSf2x3,4.18243,0,miopenConvolutionBwdWeightsAlgoWinograd,1024x14x14x1x1x256x14x14x128xNCHWxFP32x0x0x1x1x1x1x1x0
256-14-14-3x3-256-14-14-128-1x1-1x1-1x1-0-NCHW-FP32-W=miopenConvolutionBwdWeightsAlgoWinograd:ConvWinograd3x3MultipassWrW<3-5>,1.43189,128450560,miopenConvolutionBwdWeightsAlgoWinograd,256x14x14x3x3x256x14x14x128xNCHWxFP32x1x1x1x1x1x1x1x0;miopenConvolutionBwdWeightsAlgoDirect:ConvAsmBwdWrW3x3,1.91136,0,miopenConvolutionBwdWeightsAlgoDirect,<unused>
128-28-28-1x1-256-56-56-128-0x0-2x2-1x1-0-NCHW-FP32-W=miopenConvolutionBwdWeightsAlgoDirect:ConvAsmBwdWrW1x1,1.0876,102760448,miopenConvolutionBwdWeightsAlgoDirect,<unused>
512-28-28-1x1-256-56-56-128-0x0-2x2-1x1-0-NCHW-FP32-W=miopenConvolutionBwdWeightsAlgoDirect:ConvAsmBwdWrW1x1,2.80214,102760448,miopenConvolutionBwdWeightsAlgoDirect,<unused>
64-56-56-1x1-256-56-56-128-0x0-1x1-1x1-0-NCHW-FP32-W=miopenConvolutionBwdWeightsAlgoDirect:ConvAsmBwdWrW1x1,1.70252,0,miopenConvolutionBwdWeightsAlgoDirect,<unused>;miopenConvolutionBwdWeightsAlgoWinograd:ConvBinWinogradRxSf2x3,23.6374,0,miopenConvolutionBwdWeightsAlgoWinograd,64x56x56x1x1x256x56x56x128xNCHWxFP32x0x0x1x1x1x1x1x0
64-112-112-7x7-3-230-230-128-0x0-2x2-1x1-0-NCHW-FP32-W=miopenConvolutionBwdWeightsAlgoDirect:ConvOclBwdWrW2<1>,4.55897,4816896,miopenConvolutionBwdWeightsAlgoDirect,<unused>
1024-14-14-1x1-512-28-28-128-0x0-2x2-1x1-0-NCHW-FP32-W=miopenConvolutionBwdWeightsAlgoDirect:ConvAsmBwdWrW1x1,2.3581,51380224,miopenConvolutionBwdWeightsAlgoDirect,<unused>
128-28-28-1x1-512-28-28-128-0x0-1x1-1x1-0-NCHW-FP32-W=miopenConvolutionBwdWeightsAlgoDirect:ConvAsmBwdWrW1x1,1.32264,0,miopenConvolutionBwdWeightsAlgoDirect,<unused>;miopenConvolutionBwdWeightsAlgoWinograd:ConvBinWinogradRxSf2x3,5.7799,0,miopenConvolutionBwdWeightsAlgoWinograd,128x28x28x1x1x512x28x28x128xNCHWxFP32x0x0x1x1x1x1x1x0
256-14-14-1x1-512-28-28-128-0x0-2x2-1x1-0-NCHW-FP32-W=miopenConvolutionBwdWeightsAlgoDirect:ConvAsmBwdWrW1x1,0.946508,51380224,miopenConvolutionBwdWeightsAlgoDirect,<unused>
2048-7-7-1x1-512-7-7-128-0x0-1x1-1x1-0-NCHW-FP32-W=miopenConvolutionBwdWeightsAlgoDirect:ConvAsmBwdWrW1x1,1.04953,0,miopenConvolutionBwdWeightsAlgoDirect,<unused>;miopenConvolutionBwdWeightsAlgoWinograd:ConvBinWinogradRxSf2x3,3.81455,0,miopenConvolutionBwdWeightsAlgoWinograd,2048x7x7x1x1x512x7x7x128xNCHWxFP32x0x0x1x1x1x1x1x0
512-7-7-3x3-512-7-7-128-1x1-1x1-1x1-0-NCHW-FP32-W=miopenConvolutionBwdWeightsAlgoWinograd:ConvWinograd3x3MultipassWrW<3-4>,0.855238,113246208,miopenConvolutionBwdWeightsAlgoWinograd,512x7x7x3x3x512x7x7x128xNCHWxFP32x1x1x1x1x1x1x1x0;miopenConvolutionBwdWeightsAlgoDirect:ConvAsmBwdWrW3x3,1.78984,0,miopenConvolutionBwdWeightsAlgoDirect,<unused>
256-56-56-1x1-64-56-56-128-0x0-1x1-1x1-0-NCHW-FP32-W=miopenConvolutionBwdWeightsAlgoDirect:ConvAsmBwdWrW1x1,1.77836,0,miopenConvolutionBwdWeightsAlgoDirect,<unused>;miopenConvolutionBwdWeightsAlgoWinograd:ConvBinWinogradRxSf2x3,22.9098,0,miopenConvolutionBwdWeightsAlgoWinograd,256x56x56x1x1x64x56x56x128xNCHWxFP32x0x0x1x1x1x1x1x0
64-56-56-1x1-64-56-56-128-0x0-1x1-1x1-0-NCHW-FP32-W=miopenConvolutionBwdWeightsAlgoDirect:ConvAsmBwdWrW1x1,0.867446,0,miopenConvolutionBwdWeightsAlgoDirect,<unused>;miopenConvolutionBwdWeightsAlgoWinograd:ConvBinWinogradRxSf2x3,23.2729,0,miopenConvolutionBwdWeightsAlgoWinograd,64x56x56x1x1x64x56x56x128xNCHWxFP32x0x0x1x1x1x1x1x0
64-56-56-3x3-64-56-56-128-1x1-1x1-1x1-0-NCHW-FP32-W=miopenConvolutionBwdWeightsAlgoDirect:ConvAsmBwdWrW3x3,2.44169,0,miopenConvolutionBwdWeightsAlgoDirect,<unused>;miopenConvolutionBwdWeightsAlgoWinograd:ConvWinograd3x3MultipassWrW<3-6>,3.15896,420478976,miopenConvolutionBwdWeightsAlgoWinograd,64x56x56x3x3x64x56x56x128xNCHWxFP32x1x1x1x1x1x1x1x0
128-56-56-1x1-256-56-56-32-0x0-1x1-1x1-0-NCHW-FP32-W=miopenConvolutionBwdWeightsAlgoDirect:ConvAsmBwdWrW1x1,0.691109,0,miopenConvolutionBwdWeightsAlgoDirect,<unused>;miopenConvolutionBwdWeightsAlgoWinograd:ConvBinWinogradRxSf2x3,5.76125,0,miopenConvolutionBwdWeightsAlgoWinograd,128x56x56x1x1x256x56x56x32xNCHWxFP32x0x0x1x1x1x1x1x0
256-28-28-1x1-512-28-28-32-0x0-1x1-1x1-0-NCHW-FP32-W=miopenConvolutionBwdWeightsAlgoDirect:ConvAsmBwdWrW1x1,0.662956,0,miopenConvolutionBwdWeightsAlgoDirect,<unused>;miopenConvolutionBwdWeightsAlgoWinograd:ConvBinWinogradRxSf2x3,2.8006,0,miopenConvolutionBwdWeightsAlgoWinograd,256x28x28x1x1x512x28x28x32xNCHWxFP32x0x0x1x1x1x1x1x0
2048-28-28-1x1-1024-28-28-64-0x0-1x1-1x1-0-NCHW-FP32-W=miopenConvolutionBwdWeightsAlgoDirect:ConvAsmBwdWrW1x1,13.9989,0,miopenConvolutionBwdWeightsAlgoDirect,<unused>;miopenConvolutionBwdWeightsAlgoWinograd:ConvBinWinogradRxSf2x3,73.3296,0,miopenConvolutionBwdWeightsAlgoWinograd,2048x28x28x1x1x1024x28x28x64xNCHWxFP32x0x0x1x1x1x1x1x0
256-28-28-1x1-1024-28-28-64-0x0-1x1-1x1-0-NCHW-FP32-W=miopenConvolutionBwdWeightsAlgoDirect:ConvAsmBwdWrW1x1,2.24118,0,miopenConvolutionBwdWeightsAlgoDirect,<unused>;miopenConvolutionBwdWeightsAlgoWinograd:ConvBinWinogradRxSf2x3,9.7968,0,miopenConvolutionBwdWeightsAlgoWinograd,256x28x28x1x1x1024x28x28x64xNCHWxFP32x0x0x1x1x1x1x1x0
512-28-28-1x1-1024-28-28-64-0x0-1x1-1x1-0-NCHW-FP32-W=miopenConvolutionBwdWeightsAlgoDirect:ConvAsmBwdWrW1x1,4.09621,0,miopenConvolutionBwdWeightsAlgoDirect,<unused>;miopenConvolutionBwdWeightsAlgoWinograd:ConvBinWinogradRxSf2x3,17.3562,0,miopenConvolutionBwdWeightsAlgoWinograd,512x28x28x1x1x1024x28x28x64xNCHWxFP32x0x0x1x1x1x1x1x0
128-28-28-3x3-128-28-28-64-1x1-1x1-1x1-0-NCHW-FP32-W=miopenConvolutionBwdWeightsAlgoWinograd:ConvWinograd3x3MultipassWrW<3-5>,0.871691,118816768,miopenConvolutionBwdWeightsAlgoWinograd,128x28x28x3x3x128x28x28x64xNCHWxFP32x1x1x1x1x1x1x1x0;miopenConvolutionBwdWeightsAlgoDirect:ConvAsmBwdWrW3x3,0.9951,0,miopenConvolutionBwdWeightsAlgoDirect,<unused>
512-28-28-1x1-128-28-28-64-0x0-1x1-1x1-0-NCHW-FP32-W=miopenConvolutionBwdWeightsAlgoDirect:ConvAsmBwdWrW1x1,0.680751,0,miopenConvolutionBwdWeightsAlgoDirect,<unused>;miopenConvolutionBwdWeightsAlgoWinograd:ConvBinWinogradRxSf2x3,2.68084,0,miopenConvolutionBwdWeightsAlgoWinograd,512x28x28x1x1x128x28x28x64xNCHWxFP32x0x0x1x1x1x1x1x0
128-28-28-3x3-128-56-56-64-1x1-2x2-1x1-0-NCHW-FP32-W=miopenConvolutionBwdWeightsAlgoDirect:ConvAsmBwdWrW3x3,1.67271,0,miopenConvolutionBwdWeightsAlgoDirect,<unused>;miopenConvolutionBwdWeightsAlgoWinograd:ConvWinograd3x3MultipassWrW<3-2>,2.06042,322764800,miopenConvolutionBwdWeightsAlgoWinograd,128x28x28x3x3x128x56x56x64xNCHWxFP32x1x1x2x2x1x1x1x0
256-28-28-1x1-1280-28-28-64-0x0-1x1-1x1-0-NCHW-FP32-W=miopenConvolutionBwdWeightsAlgoDirect:ConvAsmBwdWrW1x1,2.59392,0,miopenConvolutionBwdWeightsAlgoDirect,<unused>;miopenConvolutionBwdWeightsAlgoWinograd:ConvBinWinogradRxSf2x3,10.8452,0,miopenConvolutionBwdWeightsAlgoWinograd,256x28x28x1x1x1280x28x28x64xNCHWxFP32x0x0x1x1x1x1x1x0
256-1-1-1x1-2048-1-1-64-0x0-1x1-1x1-0-NCHW-FP32-W=miopenConvolutionBwdWeightsAlgoDirect:ConvAsmBwdWrW1x1,0.031817,0,miopenConvolutionBwdWeightsAlgoDirect,<unused>;miopenConvolutionBwdWeightsAlgoWinograd:ConvBinWinogradRxS,0.10079,0,miopenConvolutionBwdWeightsAlgoWinograd,256x1x1x1x1x2048x1x1x64xNCHWxFP32x0x0x1x1x1x1x1x0
256-28-28-1x1-2048-28-28-64-0x0-1x1-1x1-0-NCHW-FP32-W=miopenConvolutionBwdWeightsAlgoDirect:ConvAsmBwdWrW1x1,4.18461,0,miopenConvolutionBwdWeightsAlgoDirect,<unused>;miopenConvolutionBwdWeightsAlgoWinograd:ConvBinWinogradRxSf2x3,19.4044,0,miopenConvolutionBwdWeightsAlgoWinograd,256x28x28x1x1x2048x28x28x64xNCHWxFP32x0x0x1x1x1x1x1x0
512-28-28-1x1-2048-28-28-64-0x0-1x1-1x1-0-NCHW-FP32-W=miopenConvolutionBwdWeightsAlgoDirect:ConvAsmBwdWrW1x1,7.83515,0,miopenConvolutionBwdWeightsAlgoDirect,<unused>;miopenConvolutionBwdWeightsAlgoWinograd:ConvBinWinogradRxSf2x3,43.3685,0,miopenConvolutionBwdWeightsAlgoWinograd,512x28x28x1x1x2048x28x28x64xNCHWxFP32x0x0x1x1x1x1x1x0
1024-28-28-1x1-256-28-28-64-0x0-1x1-1x1-0-NCHW-FP32-W=miopenConvolutionBwdWeightsAlgoDirect:ConvAsmBwdWrW1x1,2.08005,0,miopenConvolutionBwdWeightsAlgoDirect,<unused>;miopenConvolutionBwdWeightsAlgoWinograd:ConvBinWinogradRxSf2x3,9.20919,0,miopenConvolutionBwdWeightsAlgoWinograd,1024x28x28x1x1x256x28x28x64xNCHWxFP32x0x0x1x1x1x1x1x0
21-28-28-1x1-256-28-28-64-0x0-1x1-1x1-0-NCHW-FP32-W=miopenConvolutionBwdWeightsAlgoDirect:ConvAsmBwdWrW1x1,0.12825,0,miopenConvolutionBwdWeightsAlgoDirect,<unused>;miopenConvolutionBwdWeightsAlgoWinograd:ConvBinWinogradRxSf2x3,1.68381,0,miopenConvolutionBwdWeightsAlgoWinograd,21x28x28x1x1x256x28x28x64xNCHWxFP32x0x0x1x1x1x1x1x0
256-28-28-3x3-256-28-28-64-1x1-1x1-1x1-0-NCHW-FP32-W=miopenConvolutionBwdWeightsAlgoWinograd:ConvWinograd3x3MultipassWrW<3-5>,2.21292,244056064,miopenConvolutionBwdWeightsAlgoWinograd,256x28x28x3x3x256x28x28x64xNCHWxFP32x1x1x1x1x1x1x1x0;miopenConvolutionBwdWeightsAlgoDirect:ConvAsmBwdWrW3x3,3.64542,0,miopenConvolutionBwdWeightsAlgoDirect,<unused>
128-56-56-1x1-256-56-56-64-0x0-1x1-1x1-0-NCHW-FP32-W=miopenConvolutionBwdWeightsAlgoDirect:ConvAsmBwdWrW1x1,1.37212,0,miopenConvolutionBwdWeightsAlgoDirect,<unused>;miopenConvolutionBwdWeightsAlgoWinograd:ConvBinWinogradRxSf2x3,11.8593,0,miopenConvolutionBwdWeightsAlgoWinograd,128x56x56x1x1x256x56x56x64xNCHWxFP32x0x0x1x1x1x1x1x0
512-28-28-1x1-256-56-56-64-0x0-2x2-1x1-0-NCHW-FP32-W=miopenConvolutionBwdWeightsAlgoDirect:ConvAsmBwdWrW1x1,1.40477,51380224,miopenConvolutionBwdWeightsAlgoDirect,<unused>
64-56-56-1x1-256-56-56-64-0x0-1x1-1x1-0-NCHW-FP32-W=miopenConvolutionBwdWeightsAlgoDirect:ConvAsmBwdWrW1x1,0.843725,0,miopenConvolutionBwdWeightsAlgoDirect,<unused>;miopenConvolutionBwdWeightsAlgoWinograd:ConvBinWinogradRxSf2x3,11.6708,0,miopenConvolutionBwdWeightsAlgoWinograd,64x56x56x1x1x256x56x56x64xNCHWxFP32x0x0x1x1x1x1x1x0
64-112-112-7x7-3-224-224-64-3x3-2x2-1x1-0-NCHW-FP32-W=miopenConvolutionBwdWeightsAlgoDirect:ConvOclBwdWrW2<1>,2.42083,2408448,miopenConvolutionBwdWeightsAlgoDirect,<unused>
1024-28-28-1x1-512-28-28-64-0x0-1x1-1x1-0-NCHW-FP32-W=miopenConvolutionBwdWeightsAlgoDirect:ConvAsmBwdWrW1x1,3.90899,0,miopenConvolutionBwdWeightsAlgoDirect,<unused>;miopenConvolutionBwdWeightsAlgoWinograd:ConvBinWinogradRxSf2x3,16.5015,0,miopenConvolutionBwdWeightsAlgoWinograd,1024x28x28x1x1x512x28x28x64xNCHWxFP32x0x0x1x1x1x1x1x0
128-28-28-1x1-512-28-28-64-0x0-1x1-1x1-0-NCHW-FP32-W=miopenConvolutionBwdWeightsAlgoDirect:ConvAsmBwdWrW1x1,0.685263,0,miopenConvolutionBwdWeightsAlgoDirect,<unused>;miopenConvolutionBwdWeightsAlgoWinograd:ConvBinWinogradRxSf2x3,2.8074,0,miopenConvolutionBwdWeightsAlgoWinograd,128x28x28x1x1x512x28x28x64xNCHWxFP32x0x0x1x1x1x1x1x0
2048-28-28-1x1-512-28-28-64-0x0-1x1-1x1-0-NCHW-FP32-W=miopenConvolutionBwdWeightsAlgoDirect:ConvAsmBwdWrW1x1,6.91746,0,miopenConvolutionBwdWeightsAlgoDirect,<unused>;miopenConvolutionBwdWeightsAlgoWinograd:ConvBinWinogradRxSf2x3,33.3223,0,miopenConvolutionBwdWeightsAlgoWinograd,2048x28x28x1x1x512x28x28x64xNCHWxFP32x0x0x1x1x1x1x1x0
256-28-28-1x1-512-28-28-64-0x0-1x1-1x1-0-NCHW-FP32-W=miopenConvolutionBwdWeightsAlgoDirect:ConvAsmBwdWrW1x1,1.31367,0,miopenConvolutionBwdWeightsAlgoDirect,<unused>;miopenConvolutionBwdWeightsAlgoWinograd:ConvBinWinogradRxSf2x3,5.75884,0,miopenConvolutionBwdWeightsAlgoWinograd,256x28x28x1x1x512x28x28x64xNCHWxFP32x0x0x1x1x1x1x1x0
256-56-56-1x1-64-56-56-64-0x0-1x1-1x1-0-NCHW-FP32-W=miopenConvolutionBwdWeightsAlgoDirect:ConvAsmBwdWrW1x1,0.825276,0,miopenConvolutionBwdWeightsAlgoDirect,<unused>;miopenConvolutionBwdWeightsAlgoWinograd:ConvBinWinogradRxSf2x3,11.28,0,miopenConvolutionBwdWeightsAlgoWinograd,256x56x56x1x1x64x56x56x64xNCHWxFP32x0x0x1x1x1x1x1x0
64-56-56-1x1-64-56-56-64-0x0-1x1-1x1-0-NCHW-FP32-W=miopenConvolutionBwdWeightsAlgoDirect:ConvAsmBwdWrW1x1,0.44378,0,miopenConvolutionBwdWeightsAlgoDirect,<unused>;miopenConvolutionBwdWeightsAlgoWinograd:ConvBinWinogradRxSf2x3,9.8983,0,miopenConvolutionBwdWeightsAlgoWinograd,64x56x56x1x1x64x56x56x64xNCHWxFP32x0x0x1x1x1x1x1x0
64-56-56-3x3-64-56-56-64-1x1-1x1-1x1-0-NCHW-FP32-W=miopenConvolutionBwdWeightsAlgoDirect:ConvAsmBwdWrW3x3,1.1951,0,miopenConvolutionBwdWeightsAlgoDirect,<unused>;miopenConvolutionBwdWeightsAlgoWinograd:ConvWinograd3x3MultipassWrW<3-6>,1.83175,210763776,miopenConvolutionBwdWeightsAlgoWinograd,64x56x56x3x3x64x56x56x64xNCHWxFP32x1x1x1x1x1x1x1x0
2048-28-28-1x1-1024-28-28-32-0x0-1x1-1x1-0-NCHW-FP32-W=miopenConvolutionBwdWeightsAlgoDirect:ConvAsmBwdWrW1x1,6.84764,0,miopenConvolutionBwdWeightsAlgoDirect,<unused>;miopenConvolutionBwdWeightsAlgoWinograd:ConvBinWinogradRxSf2x3,32.1915,0,miopenConvolutionBwdWeightsAlgoWinograd,2048x28x28x1x1x1024x28x28x32xNCHWxFP32x0x0x1x1x1x1x1x0
256-28-28-1x1-1024-28-28-32-0x0-1x1-1x1-0-NCHW-FP32-W=miopenConvolutionBwdWeightsAlgoDirect:ConvAsmBwdWrW1x1,1.06237,0,miopenConvolutionBwdWeightsAlgoDirect,<unused>;miopenConvolutionBwdWeightsAlgoWinograd:ConvBinWinogradRxSf2x3,4.85201,0,miopenConvolutionBwdWeightsAlgoWinograd,256x28x28x1x1x1024x28x28x32xNCHWxFP32x0x0x1x1x1x1x1x0
512-28-28-1x1-1024-28-28-32-0x0-1x1-1x1-0-NCHW-FP32-W=miopenConvolutionBwdWeightsAlgoDirect:ConvAsmBwdWrW1x1,2.00952,0,miopenConvolutionBwdWeightsAlgoDirect,<unused>;miopenConvolutionBwdWeightsAlgoWinograd:ConvBinWinogradRxSf2x3,8.38768,0,miopenConvolutionBwdWeightsAlgoWinograd,512x28x28x1x1x1024x28x28x32xNCHWxFP32x0x0x1x1x1x1x1x0
128-28-28-3x3-128-28-28-32-1x1-1x1-1x1-0-NCHW-FP32-W=miopenConvolutionBwdWeightsAlgoWinograd:ConvWinograd3x3MultipassWrW<3-5>,0.477239,61014016,miopenConvolutionBwdWeightsAlgoWinograd,128x28x28x3x3x128x28x28x32xNCHWxFP32x1x1x1x1x1x1x1x0;miopenConvolutionBwdWeightsAlgoDirect:ConvAsmBwdWrW3x3,0.488267,0,miopenConvolutionBwdWeightsAlgoDirect,<unused>
512-28-28-1x1-128-28-28-32-0x0-1x1-1x1-0-NCHW-FP32-W=miopenConvolutionBwdWeightsAlgoDirect:ConvAsmBwdWrW1x1,0.349632,0,miopenConvolutionBwdWeightsAlgoDirect,<unused>;miopenConvolutionBwdWeightsAlgoWinograd:ConvBinWinogradRxSf2x3,1.28803,0,miopenConvolutionBwdWeightsAlgoWinograd,512x28x28x1x1x128x28x28x32xNCHWxFP32x0x0x1x1x1x1x1x0
128-28-28-3x3-128-56-56-32-1x1-2x2-1x1-0-NCHW-FP32-W=miopenConvolutionBwdWeightsAlgoDirect:ConvAsmBwdWrW3x3,0.845889,0,miopenConvolutionBwdWeightsAlgoDirect,<unused>;miopenConvolutionBwdWeightsAlgoWinograd:ConvWinograd3x3MultipassWrW<3-3>,1.14576,163774464,miopenConvolutionBwdWeightsAlgoWinograd,128x28x28x3x3x128x56x56x32xNCHWxFP32x1x1x2x2x1x1x1x0
256-28-28-1x1-1280-28-28-32-0x0-1x1-1x1-0-NCHW-FP32-W=miopenConvolutionBwdWeightsAlgoDirect:ConvAsmBwdWrW1x1,1.30604,0,miopenConvolutionBwdWeightsAlgoDirect,<unused>;miopenConvolutionBwdWeightsAlgoWinograd:ConvBinWinogradRxSf2x3,5.1022,0,miopenConvolutionBwdWeightsAlgoWinograd,256x28x28x1x1x1280x28x28x32xNCHWxFP32x0x0x1x1x1x1x1x0
256-1-1-1x1-2048-1-1-32-0x0-1x1-1x1-0-NCHW-FP32-W=miopenConvolutionBwdWeightsAlgoDirect:ConvAsmBwdWrW1x1,0.02109,0,miopenConvolutionBwdWeightsAlgoDirect,<unused>;miopenConvolutionBwdWeightsAlgoWinograd:ConvBinWinogradRxS,0.066102,0,miopenConvolutionBwdWeightsAlgoWinograd,256x1x1x1x1x2048x1x1x32xNCHWxFP32x0x0x1x1x1x1x1x0
256-28-28-1x1-2048-28-28-32-0x0-1x1-1x1-0-NCHW-FP32-W=miopenConvolutionBwdWeightsAlgoDirect:ConvAsmBwdWrW1x1,2.1253,0,miopenConvolutionBwdWeightsAlgoDirect,<unused>;miopenConvolutionBwdWeightsAlgoWinograd:ConvBinWinogradRxSf2x3,9.62975,0,miopenConvolutionBwdWeightsAlgoWinograd,256x28x28x1x1x2048x28x28x32xNCHWxFP32x0x0x1x1x1x1x1x0
512-28-28-1x1-2048-28-28-32-0x0-1x1-1x1-0-NCHW-FP32-W=miopenConvolutionBwdWeightsAlgoDirect:ConvAsmBwdWrW1x1,3.74674,0,miopenConvolutionBwdWeightsAlgoDirect,<unused>;miopenConvolutionBwdWeightsAlgoWinograd:ConvBinWinogradRxSf2x3,19.3285,0,miopenConvolutionBwdWeightsAlgoWinograd,512x28x28x1x1x2048x28x28x32xNCHWxFP32x0x0x1x1x1x1x1x0
1024-28-28-1x1-256-28-28-32-0x0-1x1-1x1-0-NCHW-FP32-W=miopenConvolutionBwdWeightsAlgoDirect:ConvAsmBwdWrW1x1,1.00723,0,miopenConvolutionBwdWeightsAlgoDirect,<unused>;miopenConvolutionBwdWeightsAlgoWinograd:ConvBinWinogradRxSf2x3,4.33675,0,miopenConvolutionBwdWeightsAlgoWinograd,1024x28x28x1x1x256x28x28x32xNCHWxFP32x0x0x1x1x1x1x1x0
21-28-28-1x1-256-28-28-32-0x0-1x1-1x1-0-NCHW-FP32-W=miopenConvolutionBwdWeightsAlgoDirect:ConvAsmBwdWrW1x1,0.069266,0,miopenConvolutionBwdWeightsAlgoDirect,<unused>;miopenConvolutionBwdWeightsAlgoWinograd:ConvBinWinogradRxSf2x3,0.81848,0,miopenConvolutionBwdWeightsAlgoWinograd,21x28x28x1x1x256x28x28x32xNCHWxFP32x0x0x1x1x1x1x1x0
256-28-28-3x3-256-28-28-32-1x1-1x1-1x1-0-NCHW-FP32-W=miopenConvolutionBwdWeightsAlgoWinograd:ConvWinograd3x3MultipassWrW<3-4>,1.38031,125042688,miopenConvolutionBwdWeightsAlgoWinograd,256x28x28x3x3x256x28x28x32xNCHWxFP32x1x1x1x1x1x1x1x0;miopenConvolutionBwdWeightsAlgoDirect:ConvAsmBwdWrW3x3,1.79711,0,miopenConvolutionBwdWeightsAlgoDirect,<unused>
64-56-56-1x1-256-56-56-32-0x0-1x1-1x1-0-NCHW-FP32-W=miopenConvolutionBwdWeightsAlgoDirect:ConvAsmBwdWrW1x1,0.429942,0,miopenConvolutionBwdWeightsAlgoDirect,<unused>;miopenConvolutionBwdWeightsAlgoWinograd:ConvBinWinogradRxSf2x3,5.04877,0,miopenConvolutionBwdWeightsAlgoWinograd,64x56x56x1x1x256x56x56x32xNCHWxFP32x0x0x1x1x1x1x1x0
128-28-28-1x1-512-28-28-32-0x0-1x1-1x1-0-NCHW-FP32-W=miopenConvolutionBwdWeightsAlgoDirect:ConvAsmBwdWrW1x1,0.348899,0,miopenConvolutionBwdWeightsAlgoDirect,<unused>;miopenConvolutionBwdWeightsAlgoWinograd:ConvBinWinogradRxSf2x3,1.32892,0,miopenConvolutionBwdWeightsAlgoWinograd,128x28x28x1x1x512x28x28x32xNCHWxFP32x0x0x1x1x1x1x1x0
2048-28-28-1x1-512-28-28-32-0x0-1x1-1x1-0-NCHW-FP32-W=miopenConvolutionBwdWeightsAlgoDirect:ConvAsmBwdWrW1x1,3.42794,0,miopenConvolutionBwdWeightsAlgoDirect,<unused>;miopenConvolutionBwdWeightsAlgoWinograd:ConvBinWinogradRxSf2x3,15.7098,0,miopenConvolutionBwdWeightsAlgoWinograd,2048x28x28x1x1x512x28x28x32xNCHWxFP32x0x0x1x1x1x1x1x0
64-56-56-1x1-64-56-56-32-0x0-1x1-1x1-0-NCHW-FP32-W=miopenConvolutionBwdWeightsAlgoDirect:ConvAsmBwdWrW1x1,0.224171,0,miopenConvolutionBwdWeightsAlgoDirect,<unused>;miopenConvolutionBwdWeightsAlgoWinograd:ConvBinWinogradRxSf2x3,4.30226,0,miopenConvolutionBwdWeightsAlgoWinograd,64x56x56x1x1x64x56x56x32xNCHWxFP32x0x0x1x1x1x1x1x0
64-56-56-3x3-64-56-56-32-1x1-1x1-1x1-0-NCHW-FP32-W=miopenConvolutionBwdWeightsAlgoDirect:ConvAsmBwdWrW3x3,0.601405,0,miopenConvolutionBwdWeightsAlgoDirect,<unused>;miopenConvolutionBwdWeightsAlgoWinograd:ConvWinograd3x3MultipassWrW<3-5>,0.908222,116408320,miopenConvolutionBwdWeightsAlgoWinograd,64x56x56x3x3x64x56x56x32xNCHWxFP32x1x1x1x1x1x1x1x0
2048-7-7-1x1-1024-14-14-128-0x0-2x2-1x1-0-NCHW-FP16-W=miopenConvolutionBwdWeightsAlgoDirect:ConvAsmBwdWrW1x1,1.64325,12845056,miopenConvolutionBwdWeightsAlgoDirect,<unused>;miopenConvolutionBwdWeightsAlgoImplicitGEMM:ConvHipImplicitGemmV4R4GenWrWXdlops,1.75713,8388608,miopenConvolutionBwdWeightsAlgoImplicitGEMM,2048x7x7x1x1x1024x14x14x128xNCHWxFP16x0x0x2x2x1x1x1x0
256-14-14-1x1-1024-14-14-128-0x0-1x1-1x1-0-NCHW-FP16-W=miopenConvolutionBwdWeightsAlgoImplicitGEMM:ConvHipImplicitGemmV4R4GenWrWXdlops,0.570224,1048576,miopenConvolutionBwdWeightsAlgoImplicitGEMM,256x14x14x1x1x1024x14x14x128xNCHWxFP16x0x0x1x1x1x1x1x0;miopenConvolutionBwdWeightsAlgoDirect:ConvAsmBwdWrW1x1,0.829573,0,miopenConvolutionBwdWeightsAlgoDirect,<unused>
512-7-7-1x1-1024-14-14-128-0x0-2x2-1x1-0-NCHW-FP16-W=miopenConvolutionBwdWeightsAlgoDirect:ConvAsmBwdWrW1x1,0.552093,12845056,miopenConvolutionBwdWeightsAlgoDirect,<unused>;miopenConvolutionBwdWeightsAlgoImplicitGEMM:ConvHipImplicitGemmV4R4GenWrWXdlops,0.623566,2097152,miopenConvolutionBwdWeightsAlgoImplicitGEMM,512x7x7x1x1x1024x14x14x128xNCHWxFP16x0x0x2x2x1x1x1x0
128-28-28-3x3-128-28-28-128-1x1-1x1-1x1-0-NCHW-FP16-W=miopenConvolutionBwdWeightsAlgoImplicitGEMM:ConvHipImplicitGemmV4R4GenWrWXdlops,0.784068,589824,miopenConvolutionBwdWeightsAlgoImplicitGEMM,128x28x28x3x3x128x28x28x128xNCHWxFP16x1x1x1x1x1x1x1x0;miopenConvolutionBwdWeightsAlgoDirect:ConvAsmBwdWrW3x3,1.29323,0,miopenConvolutionBwdWeightsAlgoDirect,<unused>
512-28-28-1x1-128-28-28-128-0x0-1x1-1x1-0-NCHW-FP16-W=miopenConvolutionBwdWeightsAlgoImplicitGEMM:ConvHipImplicitGemmV4R4GenWrWXdlops,0.487697,262144,miopenConvolutionBwdWeightsAlgoImplicitGEMM,512x28x28x1x1x128x28x28x128xNCHWxFP16x0x0x1x1x1x1x1x0;miopenConvolutionBwdWeightsAlgoDirect:ConvAsmBwdWrW1x1,0.850144,0,miopenConvolutionBwdWeightsAlgoDirect,<unused>
512-7-7-1x1-2048-7-7-128-0x0-1x1-1x1-0-NCHW-FP16-W=miopenConvolutionBwdWeightsAlgoImplicitGEMM:ConvHipImplicitGemmV4R4GenWrWXdlops,0.819292,4194304,miopenConvolutionBwdWeightsAlgoImplicitGEMM,512x7x7x1x1x2048x7x7x128xNCHWxFP16x0x0x1x1x1x1x1x0;miopenConvolutionBwdWeightsAlgoDirect:ConvAsmBwdWrW1x1,0.925386,0,miopenConvolutionBwdWeightsAlgoDirect,<unused>
1024-14-14-1x1-256-14-14-128-0x0-1x1-1x1-0-NCHW-FP16-W=miopenConvolutionBwdWeightsAlgoImplicitGEMM:ConvHipImplicitGemmV4R4GenWrWXdlops,0.570948,1048576,miopenConvolutionBwdWeightsAlgoImplicitGEMM,1024x14x14x1x1x256x14x14x128xNCHWxFP16x0x0x1x1x1x1x1x0;miopenConvolutionBwdWeightsAlgoDirect:ConvAsmBwdWrW1x1,0.82979,0,miopenConvolutionBwdWeightsAlgoDirect,<unused>
256-14-14-3x3-256-14-14-128-1x1-1x1-1x1-0-NCHW-FP16-W=miopenConvolutionBwdWeightsAlgoImplicitGEMM:ConvHipImplicitGemmV4R4GenWrWXdlops,0.850796,2359296,miopenConvolutionBwdWeightsAlgoImplicitGEMM,256x14x14x3x3x256x14x14x128xNCHWxFP16x1x1x1x1x1x1x1x0;miopenConvolutionBwdWeightsAlgoDirect:ConvAsmBwdWrW3x3,1.278,0,miopenConvolutionBwdWeightsAlgoDirect,<unused>
128-28-28-1x1-256-56-56-128-0x0-2x2-1x1-0-NCHW-FP16-W=miopenConvolutionBwdWeightsAlgoImplicitGEMM:ConvHipImplicitGemmV4R4GenWrWXdlops,0.387057,131072,miopenConvolutionBwdWeightsAlgoImplicitGEMM,128x28x28x1x1x256x56x56x128xNCHWxFP16x0x0x2x2x1x1x1x0;miopenConvolutionBwdWeightsAlgoDirect:ConvAsmBwdWrW1x1,0.797035,51380224,miopenConvolutionBwdWeightsAlgoDirect,<unused>
512-28-28-1x1-256-56-56-128-0x0-2x2-1x1-0-NCHW-FP16-W=miopenConvolutionBwdWeightsAlgoImplicitGEMM:ConvHipImplicitGemmV4R4GenWrWXdlops,1.16258,524288,miopenConvolutionBwdWeightsAlgoImplicitGEMM,512x28x28x1x1x256x56x56x128xNCHWxFP16x0x0x2x2x1x1x1x0;miopenConvolutionBwdWeightsAlgoDirect:ConvAsmBwdWrW1x1,1.82307,51380224,miopenConvolutionBwdWeightsAlgoDirect,<unused>
64-56-56-1x1-256-56-56-128-0x0-1x1-1x1-0-NCHW-FP16-W=miopenConvolutionBwdWeightsAlgoImplicitGEMM:ConvHipImplicitGemmV4R4GenWrWXdlops,0.709427,65536,miopenConvolutionBwdWeightsAlgoImplicitGEMM,64x56x56x1x1x256x56x56x128xNCHWxFP16x0x0x1x1x1x1x1x0;miopenConvolutionBwdWeightsAlgoDirect:ConvAsmBwdWrW1x1,1.08156,0,miopenConvolutionBwdWeightsAlgoDirect,<unused>
64-112-112-7x7-3-230-230-128-0x0-2x2-1x1-0-NCHW-FP16-W=miopenConvolutionBwdWeightsAlgoDirect:ConvOclBwdWrW2<1>,3.15309,2408448,miopenConvolutionBwdWeightsAlgoDirect,<unused>
1024-14-14-1x1-512-28-28-128-0x0-2x2-1x1-0-NCHW-FP16-W=miopenConvolutionBwdWeightsAlgoImplicitGEMM:ConvHipImplicitGemmV4R4GenWrWXdlops,0.966158,2097152,miopenConvolutionBwdWeightsAlgoImplicitGEMM,1024x14x14x1x1x512x28x28x128xNCHWxFP16x0x0x2x2x1x1x1x0;miopenConvolutionBwdWeightsAlgoDirect:ConvAsmBwdWrW1x1,1.62773,25690112,miopenConvolutionBwdWeightsAlgoDirect,<unused>
128-28-28-1x1-512-28-28-128-0x0-1x1-1x1-0-NCHW-FP16-W=miopenConvolutionBwdWeightsAlgoImplicitGEMM:ConvHipImplicitGemmV4R4GenWrWXdlops,0.464407,262144,miopenConvolutionBwdWeightsAlgoImplicitGEMM,128x28x28x1x1x512x28x28x128xNCHWxFP16x0x0x1x1x1x1x1x0;miopenConvolutionBwdWeightsAlgoDirect:ConvAsmBwdWrW1x1,0.892984,0,miopenConvolutionBwdWeightsAlgoDirect,<unused>
256-14-14-1x1-512-28-28-128-0x0-2x2-1x1-0-NCHW-FP16-W=miopenConvolutionBwdWeightsAlgoImplicitGEMM:ConvHipImplicitGemmV4R4GenWrWXdlops,0.34829,524288,miopenConvolutionBwdWeightsAlgoImplicitGEMM,256x14x14x1x1x512x28x28x128xNCHWxFP16x0x0x2x2x1x1x1x0;miopenConvolutionBwdWeightsAlgoDirect:ConvAsmBwdWrW1x1,0.629608,25690112,miopenConvolutionBwdWeightsAlgoDirect,<unused>
2048-7-7-1x1-512-7-7-128-0x0-1x1-1x1-0-NCHW-FP16-W=miopenConvolutionBwdWeightsAlgoImplicitGEMM:ConvHipImplicitGemmV4R4GenWrWXdlops,0.88485,4194304,miopenConvolutionBwdWeightsAlgoImplicitGEMM,2048x7x7x1x1x512x7x7x128xNCHWxFP16x0x0x1x1x1x1x1x0;miopenConvolutionBwdWeightsAlgoDirect:ConvAsmBwdWrW1x1,0.927874,0,miopenConvolutionBwdWeightsAlgoDirect,<unused>
512-7-7-3x3-512-7-7-128-1x1-1x1-1x1-0-NCHW-FP16-W=miopenConvolutionBwdWeightsAlgoImplicitGEMM:ConvHipImplicitGemmV4R4GenWrWXdlops,0.87717,9437184,miopenConvolutionBwdWeightsAlgoImplicitGEMM,512x7x7x3x3x512x7x7x128xNCHWxFP16x1x1x1x1x1x1x1x0;miopenConvolutionBwdWeightsAlgoDirect:ConvAsmBwdWrW3x3,2.31674,0,miopenConvolutionBwdWeightsAlgoDirect,<unused>
256-56-56-1x1-64-56-56-128-0x0-1x1-1x1-0-NCHW-FP16-W=miopenConvolutionBwdWeightsAlgoImplicitGEMM:ConvHipImplicitGemmV4R4GenWrWXdlops,0.940153,65536,miopenConvolutionBwdWeightsAlgoImplicitGEMM,256x56x56x1x1x64x56x56x128xNCHWxFP16x0x0x1x1x1x1x1x0;miopenConvolutionBwdWeightsAlgoDirect:ConvAsmBwdWrW1x1,1.05152,0,miopenConvolutionBwdWeightsAlgoDirect,<unused>
64-56-56-1x1-64-56-56-128-0x0-1x1-1x1-0-NCHW-FP16-W=miopenConvolutionBwdWeightsAlgoDirect:ConvAsmBwdWrW1x1,0.407585,0,miopenConvolutionBwdWeightsAlgoDirect,<unused>;miopenConvolutionBwdWeightsAlgoImplicitGEMM:ConvHipImplicitGemmV4R4GenWrWXdlops,0.46748,16384,miopenConvolutionBwdWeightsAlgoImplicitGEMM,64x56x56x1x1x64x56x56x128xNCHWxFP16x0x0x1x1x1x1x1x0
64-56-56-3x3-64-56-56-128-1x1-1x1-1x1-0-NCHW-FP16-W=miopenConvolutionBwdWeightsAlgoDirect:ConvAsmBwdWrW3x3,1.41196,0,miopenConvolutionBwdWeightsAlgoDirect,<unused>;miopenConvolutionBwdWeightsAlgoImplicitGEMM:ConvHipImplicitGemmV4R4GenWrWXdlops,1.57179,147456,miopenConvolutionBwdWeightsAlgoImplicitGEMM,64x56x56x3x3x64x56x56x128xNCHWxFP16x1x1x1x1x1x1x1x0
2048-28-28-1x1-1024-28-28-64-0x0-1x1-1x1-0-NCHW-FP16-W=miopenConvolutionBwdWeightsAlgoImplicitGEMM:ConvHipImplicitGemmV4R4GenWrWXdlops,8.27787,8388608,miopenConvolutionBwdWeightsAlgoImplicitGEMM,2048x28x28x1x1x1024x28x28x64xNCHWxFP16x0x0x1x1x1x1x1x0;miopenConvolutionBwdWeightsAlgoDirect:ConvAsmBwdWrW1x1,8.80227,0,miopenConvolutionBwdWeightsAlgoDirect,<unused>
256-28-28-1x1-1024-28-28-64-0x0-1x1-1x1-0-NCHW-FP16-W=miopenConvolutionBwdWeightsAlgoImplicitGEMM:ConvHipImplicitGemmV4R4GenWrWXdlops,0.979046,1048576,miopenConvolutionBwdWeightsAlgoImplicitGEMM,256x28x28x1x1x1024x28x28x64xNCHWxFP16x0x0x1x1x1x1x1x0;miopenConvolutionBwdWeightsAlgoDirect:ConvAsmBwdWrW1x1,1.38982,0,miopenConvolutionBwdWeightsAlgoDirect,<unused>
512-28-28-1x1-1024-28-28-64-0x0-1x1-1x1-0-NCHW-FP16-W=miopenConvolutionBwdWeightsAlgoImplicitGEMM:ConvHipImplicitGemmV4R4GenWrWXdlops,1.89927,2097152,miopenConvolutionBwdWeightsAlgoImplicitGEMM,512x28x28x1x1x1024x28x28x64xNCHWxFP16x0x0x1x1x1x1x1x0;miopenConvolutionBwdWeightsAlgoDirect:ConvAsmBwdWrW1x1,2.46282,0,miopenConvolutionBwdWeightsAlgoDirect,<unused>
128-28-28-3x3-128-28-28-64-1x1-1x1-1x1-0-NCHW-FP16-W=miopenConvolutionBwdWeightsAlgoImplicitGEMM:ConvHipImplicitGemmV4R4GenWrWXdlops,0.492712,589824,miopenConvolutionBwdWeightsAlgoImplicitGEMM,128x28x28x3x3x128x28x28x64xNCHWxFP16x1x1x1x1x1x1x1x0;miopenConvolutionBwdWeightsAlgoDirect:ConvAsmBwdWrW3x3,0.659134,0,miopenConvolutionBwdWeightsAlgoDirect,<unused>
512-28-28-1x1-128-28-28-64-0x0-1x1-1x1-0-NCHW-FP16-W=miopenConvolutionBwdWeightsAlgoImplicitGEMM:ConvHipImplicitGemmV4R4GenWrWXdlops,0.299149,262144,miopenConvolutionBwdWeightsAlgoImplicitGEMM,512x28x28x1x1x128x28x28x64xNCHWxFP16x0x0x1x1x1x1x1x0;miopenConvolutionBwdWeightsAlgoDirect:ConvAsmBwdWrW1x1,0.430913,0,miopenConvolutionBwdWeightsAlgoDirect,<unused>
128-28-28-3x3-128-56-56-64-1x1-2x2-1x1-0-NCHW-FP16-W=miopenConvolutionBwdWeightsAlgoImplicitGEMM:ConvHipImplicitGemmV4R4GenWrWXdlops,0.543029,589824,miopenConvolutionBwdWeightsAlgoImplicitGEMM,128x28x28x3x3x128x56x56x64xNCHWxFP16x1x1x2x2x1x1x1x0;miopenConvolutionBwdWeightsAlgoDirect:ConvAsmBwdWrW3x3,1.01585,0,miopenConvolutionBwdWeightsAlgoDirect,<unused>;miopenConvolutionBwdWeightsAlgoWinograd:ConvWinograd3x3MultipassWrW<3-2>,1.77591,161382400,miopenConvolutionBwdWeightsAlgoWinograd,128x28x28x3x3x128x56x56x64xNCHWxFP16x1x1x2x2x1x1x1x0
256-28-28-1x1-1280-28-28-64-0x0-1x1-1x1-0-NCHW-FP16-W=miopenConvolutionBwdWeightsAlgoImplicitGEMM:ConvHipImplicitGemmV4R4GenWrWXdlops,1.25573,1310720,miopenConvolutionBwdWeightsAlgoImplicitGEMM,256x28x28x1x1x1280x28x28x64xNCHWxFP16x0x0x1x1x1x1x1x0;miopenConvolutionBwdWeightsAlgoDirect:ConvAsmBwdWrW1x1,1.45249,0,miopenConvolutionBwdWeightsAlgoDirect,<unused>
256-1-1-1x1-2048-1-1-64-0x0-1x1-1x1-0-NCHW-FP16-W=miopenConvolutionBwdWeightsAlgoDirect:ConvAsmBwdWrW1x1,0.030683,0,miopenConvolutionBwdWeightsAlgoDirect,<unused>;miopenConvolutionBwdWeightsAlgoImplicitGEMM:ConvHipImplicitGemmV4R4GenWrWXdlops,0.046417,2097152,miopenConvolutionBwdWeightsAlgoImplicitGEMM,256x1x1x1x1x2048x1x1x64xNCHWxFP16x0x0x1x1x1x1x1x0
256-28-28-1x1-2048-28-28-64-0x0-1x1-1x1-0-NCHW-FP16-W=miopenConvolutionBwdWeightsAlgoImplicitGEMM:ConvHipImplicitGemmV4R4GenWrWXdlops,1.88473,2097152,miopenConvolutionBwdWeightsAlgoImplicitGEMM,256x28x28x1x1x2048x28x28x64xNCHWxFP16x0x0x1x1x1x1x1x0;miopenConvolutionBwdWeightsAlgoDirect:ConvAsmBwdWrW1x1,2.88739,0,miopenConvolutionBwdWeightsAlgoDirect,<unused>
256-28-28-3x3-2048-28-28-64-36x36-1x1-36x36-0-NCHW-FP16-W=miopenConvolutionBwdWeightsAlgoImplicitGEMM:ConvHipImplicitGemmV4R4GenWrWXdlops,6.80392,18874368,miopenConvolutionBwdWeightsAlgoImplicitGEMM,256x28x28x3x3x2048x28x28x64xNCHWxFP16x36x36x1x1x36x36x1x0
512-28-28-1x1-2048-28-28-64-0x0-1x1-1x1-0-NCHW-FP16-W=miopenConvolutionBwdWeightsAlgoImplicitGEMM:ConvHipImplicitGemmV4R4GenWrWXdlops,3.9834,4194304,miopenConvolutionBwdWeightsAlgoImplicitGEMM,512x28x28x1x1x2048x28x28x64xNCHWxFP16x0x0x1x1x1x1x1x0;miopenConvolutionBwdWeightsAlgoDirect:ConvAsmBwdWrW1x1,5.3737,0,miopenConvolutionBwdWeightsAlgoDirect,<unused>
1024-28-28-1x1-256-28-28-64-0x0-1x1-1x1-0-NCHW-FP16-W=miopenConvolutionBwdWeightsAlgoImplicitGEMM:ConvHipImplicitGemmV4R4GenWrWXdlops,0.776804,1048576,miopenConvolutionBwdWeightsAlgoImplicitGEMM,1024x28x28x1x1x256x28x28x64xNCHWxFP16x0x0x1x1x1x1x1x0;miopenConvolutionBwdWeightsAlgoDirect:ConvAsmBwdWrW1x1,1.37439,0,miopenConvolutionBwdWeightsAlgoDirect,<unused>
21-28-28-1x1-256-28-28-64-0x0-1x1-1x1-0-NCHW-FP16-W=miopenConvolutionBwdWeightsAlgoDirect:ConvAsmBwdWrW1x1,0.096838,0,miopenConvolutionBwdWeightsAlgoDirect,<unused>
256-28-28-3x3-256-28-28-64-1x1-1x1-1x1-0-NCHW-FP16-W=miopenConvolutionBwdWeightsAlgoImplicitGEMM:ConvHipImplicitGemmV4R4GenWrWXdlops,1.40898,2359296,miopenConvolutionBwdWeightsAlgoImplicitGEMM,256x28x28x3x3x256x28x28x64xNCHWxFP16x1x1x1x1x1x1x1x0;miopenConvolutionBwdWeightsAlgoDirect:ConvAsmBwdWrW3x3,2.25565,0,miopenConvolutionBwdWeightsAlgoDirect,<unused>
256-28-28-3x3-256-28-28-64-2x2-1x1-2x2-0-NCHW-FP16-W=miopenConvolutionBwdWeightsAlgoImplicitGEMM:ConvHipImplicitGemmV4R4GenWrWXdlops,1.44968,2359296,miopenConvolutionBwdWeightsAlgoImplicitGEMM,256x28x28x3x3x256x28x28x64xNCHWxFP16x2x2x1x1x2x2x1x0
128-56-56-1x1-256-56-56-64-0x0-1x1-1x1-0-NCHW-FP16-W=miopenConvolutionBwdWeightsAlgoImplicitGEMM:ConvHipImplicitGemmV4R4GenWrWXdlops,0.789905,131072,miopenConvolutionBwdWeightsAlgoImplicitGEMM,128x56x56x1x1x256x56x56x64xNCHWxFP16x0x0x1x1x1x1x1x0;miopenConvolutionBwdWeightsAlgoDirect:ConvAsmBwdWrW1x1,0.923071,0,miopenConvolutionBwdWeightsAlgoDirect,<unused>
512-28-28-1x1-256-56-56-64-0x0-2x2-1x1-0-NCHW-FP16-W=miopenConvolutionBwdWeightsAlgoImplicitGEMM:ConvHipImplicitGemmV4R4GenWrWXdlops,0.692119,524288,miopenConvolutionBwdWeightsAlgoImplicitGEMM,512x28x28x1x1x256x56x56x64xNCHWxFP16x0x0x2x2x1x1x1x0;miopenConvolutionBwdWeightsAlgoDirect:ConvAsmBwdWrW1x1,0.956355,25690112,miopenConvolutionBwdWeightsAlgoDirect,<unused>
64-56-56-1x1-256-56-56-64-0x0-1x1-1x1-0-NCHW-FP16-W=miopenConvolutionBwdWeightsAlgoImplicitGEMM:ConvHipImplicitGemmV4R4GenWrWXdlops,0.400993,65536,miopenConvolutionBwdWeightsAlgoImplicitGEMM,64x56x56x1x1x256x56x56x64xNCHWxFP16x0x0x1x1x1x1x1x0;miopenConvolutionBwdWeightsAlgoDirect:ConvAsmBwdWrW1x1,0.564663,0,miopenConvolutionBwdWeightsAlgoDirect,<unused>
64-112-112-7x7-3-224-224-64-3x3-2x2-1x1-0-NCHW-FP16-W=miopenConvolutionBwdWeightsAlgoDirect:ConvOclBwdWrW2<2>,1.65635,602112,miopenConvolutionBwdWeightsAlgoDirect,<unused>
1024-28-28-1x1-512-28-28-64-0x0-1x1-1x1-0-NCHW-FP16-W=miopenConvolutionBwdWeightsAlgoImplicitGEMM:ConvHipImplicitGemmV4R4GenWrWXdlops,1.64112,2097152,miopenConvolutionBwdWeightsAlgoImplicitGEMM,1024x28x28x1x1x512x28x28x64xNCHWxFP16x0x0x1x1x1x1x1x0;miopenConvolutionBwdWeightsAlgoDirect:ConvAsmBwdWrW1x1,2.44652,0,miopenConvolutionBwdWeightsAlgoDirect,<unused>
128-28-28-1x1-512-28-28-64-0x0-1x1-1x1-0-NCHW-FP16-W=miopenConvolutionBwdWeightsAlgoImplicitGEMM:ConvHipImplicitGemmV4R4GenWrWXdlops,0.288089,262144,miopenConvolutionBwdWeightsAlgoImplicitGEMM,128x28x28x1x1x512x28x28x64xNCHWxFP16x0x0x1x1x1x1x1x0;miopenConvolutionBwdWeightsAlgoDirect:ConvAsmBwdWrW1x1,0.484129,0,miopenConvolutionBwdWeightsAlgoDirect,<unused>
2048-28-28-1x1-512-28-28-64-0x0-1x1-1x1-0-NCHW-FP16-W=miopenConvolutionBwdWeightsAlgoImplicitGEMM:ConvHipImplicitGemmV4R4GenWrWXdlops,3.65595,4194304,miopenConvolutionBwdWeightsAlgoImplicitGEMM,2048x28x28x1x1x512x28x28x64xNCHWxFP16x0x0x1x1x1x1x1x0;miopenConvolutionBwdWeightsAlgoDirect:ConvAsmBwdWrW1x1,4.48271,0,miopenConvolutionBwdWeightsAlgoDirect,<unused>
256-28-28-1x1-512-28-28-64-0x0-1x1-1x1-0-NCHW-FP16-W=miopenConvolutionBwdWeightsAlgoImplicitGEMM:ConvHipImplicitGemmV4R4GenWrWXdlops,0.473692,524288,miopenConvolutionBwdWeightsAlgoImplicitGEMM,256x28x28x1x1x512x28x28x64xNCHWxFP16x0x0x1x1x1x1x1x0;miopenConvolutionBwdWeightsAlgoDirect:ConvAsmBwdWrW1x1,0.835417,0,miopenConvolutionBwdWeightsAlgoDirect,<unused>
512-28-28-3x3-512-28-28-64-2x2-1x1-2x2-0-NCHW-FP16-W=miopenConvolutionBwdWeightsAlgoImplicitGEMM:ConvHipImplicitGemmV4R4GenWrWXdlops,5.31086,9437184,miopenConvolutionBwdWeightsAlgoImplicitGEMM,512x28x28x3x3x512x28x28x64xNCHWxFP16x2x2x1x1x2x2x1x0
512-28-28-3x3-512-28-28-64-4x4-1x1-4x4-0-NCHW-FP16-W=miopenConvolutionBwdWeightsAlgoImplicitGEMM:ConvHipImplicitGemmV4R4GenWrWXdlops,4.68715,9437184,miopenConvolutionBwdWeightsAlgoImplicitGEMM,512x28x28x3x3x512x28x28x64xNCHWxFP16x4x4x1x1x4x4x1x0
256-56-56-1x1-64-56-56-64-0x0-1x1-1x1-0-NCHW-FP16-W=miopenConvolutionBwdWeightsAlgoImplicitGEMM:ConvHipImplicitGemmV4R4GenWrWXdlops,0.463315,65536,miopenConvolutionBwdWeightsAlgoImplicitGEMM,256x56x56x1x1x64x56x56x64xNCHWxFP16x0x0x1x1x1x1x1x0;miopenConvolutionBwdWeightsAlgoDirect:ConvAsmBwdWrW1x1,0.563288,0,miopenConvolutionBwdWeightsAlgoDirect,<unused>
64-56-56-1x1-64-56-56-64-0x0-1x1-1x1-0-NCHW-FP16-W=miopenConvolutionBwdWeightsAlgoDirect:ConvAsmBwdWrW1x1,0.207469,0,miopenConvolutionBwdWeightsAlgoDirect,<unused>;miopenConvolutionBwdWeightsAlgoImplicitGEMM:ConvHipImplicitGemmV4R4GenWrWXdlops,0.301157,16384,miopenConvolutionBwdWeightsAlgoImplicitGEMM,64x56x56x1x1x64x56x56x64xNCHWxFP16x0x0x1x1x1x1x1x0
64-56-56-3x3-64-56-56-64-1x1-1x1-1x1-0-NCHW-FP16-W=miopenConvolutionBwdWeightsAlgoDirect:ConvAsmBwdWrW3x3,0.712885,0,miopenConvolutionBwdWeightsAlgoDirect,<unused>;miopenConvolutionBwdWeightsAlgoImplicitGEMM:ConvHipImplicitGemmV4R4GenWrWXdlops,0.836428,147456,miopenConvolutionBwdWeightsAlgoImplicitGEMM,64x56x56x3x3x64x56x56x64xNCHWxFP16x1x1x1x1x1x1x1x0
2048-28-28-1x1-1024-28-28-32-0x0-1x1-1x1-0-NCHW-FP16-W=miopenConvolutionBwdWeightsAlgoDirect:ConvAsmBwdWrW1x1,4.21444,0,miopenConvolutionBwdWeightsAlgoDirect,<unused>;miopenConvolutionBwdWeightsAlgoImplicitGEMM:ConvHipImplicitGemmV4R4GenWrWXdlops,4.28278,8388608,miopenConvolutionBwdWeightsAlgoImplicitGEMM,2048x28x28x1x1x1024x28x28x32xNCHWxFP16x0x0x1x1x1x1x1x0
256-28-28-1x1-1024-28-28-32-0x0-1x1-1x1-0-NCHW-FP16-W=miopenConvolutionBwdWeightsAlgoImplicitGEMM:ConvHipImplicitGemmV4R4GenWrWXdlops,0.577359,1048576,miopenConvolutionBwdWeightsAlgoImplicitGEMM,256x28x28x1x1x1024x28x28x32xNCHWxFP16x0x0x1x1x1x1x1x0;miopenConvolutionBwdWeightsAlgoDirect:ConvAsmBwdWrW1x1,0.71417,0,miopenConvolutionBwdWeightsAlgoDirect,<unused>
512-28-28-1x1-1024-28-28-32-0x0-1x1-1x1-0-NCHW-FP16-W=miopenConvolutionBwdWeightsAlgoImplicitGEMM:ConvHipImplicitGemmV4R4GenWrWXdlops,1.05651,2097152,miopenConvolutionBwdWeightsAlgoImplicitGEMM,512x28x28x1x1x1024x28x28x32xNCHWxFP16x0x0x1x1x1x1x1x0;miopenConvolutionBwdWeightsAlgoDirect:ConvAsmBwdWrW1x1,1.23912,0,miopenConvolutionBwdWeightsAlgoDirect,<unused>
128-28-28-3x3-128-28-28-32-1x1-1x1-1x1-0-NCHW-FP16-W=miopenConvolutionBwdWeightsAlgoImplicitGEMM:ConvHipImplicitGemmV4R4GenWrWXdlops,0.329512,589824,miopenConvolutionBwdWeightsAlgoImplicitGEMM,128x28x28x3x3x128x28x28x32xNCHWxFP16x1x1x1x1x1x1x1x0;miopenConvolutionBwdWeightsAlgoDirect:ConvAsmBwdWrW3x3,0.338465,0,miopenConvolutionBwdWeightsAlgoDirect,<unused>
512-28-28-1x1-128-28-28-32-0x0-1x1-1x1-0-NCHW-FP16-W=miopenConvolutionBwdWeightsAlgoImplicitGEMM:ConvHipImplicitGemmV4R4GenWrWXdlops,0.230238,262144,miopenConvolutionBwdWeightsAlgoImplicitGEMM,512x28x28x1x1x128x28x28x32xNCHWxFP16x0x0x1x1x1x1x1x0;miopenConvolutionBwdWeightsAlgoDirect:ConvAsmBwdWrW1x1,0.232288,0,miopenConvolutionBwdWeightsAlgoDirect,<unused>
128-28-28-3x3-128-56-56-32-1x1-2x2-1x1-0-NCHW-FP16-W=miopenConvolutionBwdWeightsAlgoImplicitGEMM:ConvHipImplicitGemmV4R4GenWrWXdlops,0.370817,589824,miopenConvolutionBwdWeightsAlgoImplicitGEMM,128x28x28x3x3x128x56x56x32xNCHWxFP16x1x1x2x2x1x1x1x0;miopenConvolutionBwdWeightsAlgoDirect:ConvAsmBwdWrW3x3,0.511583,0,miopenConvolutionBwdWeightsAlgoDirect,<unused>;miopenConvolutionBwdWeightsAlgoWinograd:ConvWinograd3x3MultipassWrW<3-3>,0.60529,81887232,miopenConvolutionBwdWeightsAlgoWinograd,128x28x28x3x3x128x56x56x32xNCHWxFP16x1x1x2x2x1x1x1x0
256-28-28-1x1-1280-28-28-32-0x0-1x1-1x1-0-NCHW-FP16-W=miopenConvolutionBwdWeightsAlgoDirect:ConvAsmBwdWrW1x1,0.74372,0,miopenConvolutionBwdWeightsAlgoDirect,<unused>;miopenConvolutionBwdWeightsAlgoImplicitGEMM:ConvHipImplicitGemmV4R4GenWrWXdlops,0.773358,1310720,miopenConvolutionBwdWeightsAlgoImplicitGEMM,256x28x28x1x1x1280x28x28x32xNCHWxFP16x0x0x1x1x1x1x1x0
256-1-1-1x1-2048-1-1-32-0x0-1x1-1x1-0-NCHW-FP16-W=miopenConvolutionBwdWeightsAlgoDirect:ConvAsmBwdWrW1x1,0.020408,0,miopenConvolutionBwdWeightsAlgoDirect,<unused>;miopenConvolutionBwdWeightsAlgoImplicitGEMM:ConvHipImplicitGemmV4R4GenWrWXdlops,0.042608,2097152,miopenConvolutionBwdWeightsAlgoImplicitGEMM,256x1x1x1x1x2048x1x1x32xNCHWxFP16x0x0x1x1x1x1x1x0
256-28-28-1x1-2048-28-28-32-0x0-1x1-1x1-0-NCHW-FP16-W=miopenConvolutionBwdWeightsAlgoImplicitGEMM:ConvHipImplicitGemmV4R4GenWrWXdlops,1.1367,2097152,miopenConvolutionBwdWeightsAlgoImplicitGEMM,256x28x28x1x1x2048x28x28x32xNCHWxFP16x0x0x1x1x1x1x1x0;miopenConvolutionBwdWeightsAlgoDirect:ConvAsmBwdWrW1x1,1.29691,0,miopenConvolutionBwdWeightsAlgoDirect,<unused>
256-28-28-3x3-2048-28-28-32-36x36-1x1-36x36-0-NCHW-FP16-W=miopenConvolutionBwdWeightsAlgoImplicitGEMM:ConvHipImplicitGemmV4R4GenWrWXdlops,3.63595,18874368,miopenConvolutionBwdWeightsAlgoImplicitGEMM,256x28x28x3x3x2048x28x28x32xNCHWxFP16x36x36x1x1x36x36x1x0
512-28-28-1x1-2048-28-28-32-0x0-1x1-1x1-0-NCHW-FP16-W=miopenConvolutionBwdWeightsAlgoImplicitGEMM:ConvHipImplicitGemmV4R4GenWrWXdlops,2.23923,4194304,miopenConvolutionBwdWeightsAlgoImplicitGEMM,512x28x28x1x1x2048x28x28x32xNCHWxFP16x0x0x1x1x1x1x1x0;miopenConvolutionBwdWeightsAlgoDirect:ConvAsmBwdWrW1x1,2.29408,0,miopenConvolutionBwdWeightsAlgoDirect,<unused>
1024-28-28-1x1-256-28-28-32-0x0-1x1-1x1-0-NCHW-FP16-W=miopenConvolutionBwdWeightsAlgoImplicitGEMM:ConvHipImplicitGemmV4R4GenWrWXdlops,0.488466,1048576,miopenConvolutionBwdWeightsAlgoImplicitGEMM,1024x28x28x1x1x256x28x28x32xNCHWxFP16x0x0x1x1x1x1x1x0;miopenConvolutionBwdWeightsAlgoDirect:ConvAsmBwdWrW1x1,0.705018,0,miopenConvolutionBwdWeightsAlgoDirect,<unused>
21-28-28-1x1-256-28-28-32-0x0-1x1-1x1-0-NCHW-FP16-W=miopenConvolutionBwdWeightsAlgoDirect:ConvAsmBwdWrW1x1,0.05331,0,miopenConvolutionBwdWeightsAlgoDirect,<unused>
256-28-28-3x3-256-28-28-32-1x1-1x1-1x1-0-NCHW-FP16-W=miopenConvolutionBwdWeightsAlgoImplicitGEMM:ConvHipImplicitGemmV4R4GenWrWXdlops,0.776311,2359296,miopenConvolutionBwdWeightsAlgoImplicitGEMM,256x28x28x3x3x256x28x28x32xNCHWxFP16x1x1x1x1x1x1x1x0;miopenConvolutionBwdWeightsAlgoDirect:ConvAsmBwdWrW3x3,1.10884,0,miopenConvolutionBwdWeightsAlgoDirect,<unused>
256-28-28-3x3-256-28-28-32-2x2-1x1-2x2-0-NCHW-FP16-W=miopenConvolutionBwdWeightsAlgoImplicitGEMM:ConvHipImplicitGemmV4R4GenWrWXdlops,0.806242,2359296,miopenConvolutionBwdWeightsAlgoImplicitGEMM,256x28x28x3x3x256x28x28x32xNCHWxFP16x2x2x1x1x2x2x1x0
128-56-56-1x1-256-56-56-32-0x0-1x1-1x1-0-NCHW-FP16-W=miopenConvolutionBwdWeightsAlgoImplicitGEMM:ConvHipImplicitGemmV4R4GenWrWXdlops,0.44985,131072,miopenConvolutionBwdWeightsAlgoImplicitGEMM,128x56x56x1x1x256x56x56x32xNCHWxFP16x0x0x1x1x1x1x1x0;miopenConvolutionBwdWeightsAlgoDirect:ConvAsmBwdWrW1x1,0.472524,0,miopenConvolutionBwdWeightsAlgoDirect,<unused>
64-56-56-1x1-256-56-56-32-0x0-1x1-1x1-0-NCHW-FP16-W=miopenConvolutionBwdWeightsAlgoImplicitGEMM:ConvHipImplicitGemmV4R4GenWrWXdlops,0.243234,65536,miopenConvolutionBwdWeightsAlgoImplicitGEMM,64x56x56x1x1x256x56x56x32xNCHWxFP16x0x0x1x1x1x1x1x0;miopenConvolutionBwdWeightsAlgoDirect:ConvAsmBwdWrW1x1,0.279006,0,miopenConvolutionBwdWeightsAlgoDirect,<unused>
128-28-28-1x1-512-28-28-32-0x0-1x1-1x1-0-NCHW-FP16-W=miopenConvolutionBwdWeightsAlgoImplicitGEMM:ConvHipImplicitGemmV4R4GenWrWXdlops,0.204865,262144,miopenConvolutionBwdWeightsAlgoImplicitGEMM,128x28x28x1x1x512x28x28x32xNCHWxFP16x0x0x1x1x1x1x1x0;miopenConvolutionBwdWeightsAlgoDirect:ConvAsmBwdWrW1x1,0.255899,0,miopenConvolutionBwdWeightsAlgoDirect,<unused>
2048-28-28-1x1-512-28-28-32-0x0-1x1-1x1-0-NCHW-FP16-W=miopenConvolutionBwdWeightsAlgoImplicitGEMM:ConvHipImplicitGemmV4R4GenWrWXdlops,2.03334,4194304,miopenConvolutionBwdWeightsAlgoImplicitGEMM,2048x28x28x1x1x512x28x28x32xNCHWxFP16x0x0x1x1x1x1x1x0;miopenConvolutionBwdWeightsAlgoDirect:ConvAsmBwdWrW1x1,2.21693,0,miopenConvolutionBwdWeightsAlgoDirect,<unused>
256-28-28-1x1-512-28-28-32-0x0-1x1-1x1-0-NCHW-FP16-W=miopenConvolutionBwdWeightsAlgoImplicitGEMM:ConvHipImplicitGemmV4R4GenWrWXdlops,0.28413,524288,miopenConvolutionBwdWeightsAlgoImplicitGEMM,256x28x28x1x1x512x28x28x32xNCHWxFP16x0x0x1x1x1x1x1x0;miopenConvolutionBwdWeightsAlgoDirect:ConvAsmBwdWrW1x1,0.432707,0,miopenConvolutionBwdWeightsAlgoDirect,<unused>
512-28-28-3x3-512-28-28-32-2x2-1x1-2x2-0-NCHW-FP16-W=miopenConvolutionBwdWeightsAlgoImplicitGEMM:ConvHipImplicitGemmV4R4GenWrWXdlops,2.74887,9437184,miopenConvolutionBwdWeightsAlgoImplicitGEMM,512x28x28x3x3x512x28x28x32xNCHWxFP16x2x2x1x1x2x2x1x0
512-28-28-3x3-512-28-28-32-4x4-1x1-4x4-0-NCHW-FP16-W=miopenConvolutionBwdWeightsAlgoImplicitGEMM:ConvHipImplicitGemmV4R4GenWrWXdlops,2.41371,9437184,miopenConvolutionBwdWeightsAlgoImplicitGEMM,512x28x28x3x3x512x28x28x32xNCHWxFP16x4x4x1x1x4x4x1x0
64-56-56-1x1-64-56-56-32-0x0-1x1-1x1-0-NCHW-FP16-W=miopenConvolutionBwdWeightsAlgoDirect:ConvAsmBwdWrW1x1,0.11918,0,miopenConvolutionBwdWeightsAlgoDirect,<unused>;miopenConvolutionBwdWeightsAlgoImplicitGEMM:ConvHipImplicitGemmV4R4GenWrWXdlops,0.214617,16384,miopenConvolutionBwdWeightsAlgoImplicitGEMM,64x56x56x1x1x64x56x56x32xNCHWxFP16x0x0x1x1x1x1x1x0
64-56-56-3x3-64-56-56-32-1x1-1x1-1x1-0-NCHW-FP16-W=miopenConvolutionBwdWeightsAlgoDirect:ConvAsmBwdWrW3x3,0.35474,0,miopenConvolutionBwdWeightsAlgoDirect,<unused>;miopenConvolutionBwdWeightsAlgoImplicitGEMM:ConvHipImplicitGemmV4R4GenWrWXdlops,0.436406,147456,miopenConvolutionBwdWeightsAlgoImplicitGEMM,64x56x56x3x3x64x56x56x32xNCHWxFP16x1x1x1x1x1x1x1x0
64-112-112-7x7-3-230-230-128-0x0-2x2-1x1-0-NCHW-BF16-W=miopenConvolutionBwdWeightsAlgoDirect:ConvOclBwdWrW2<1>,3.66654,2408448,miopenConvolutionBwdWeightsAlgoDirect,<unused>
128-28-28-1x1-512-28-28-128-0x0-1x1-1x1-0-NCHW-BF16-W=miopenConvolutionBwdWeightsAlgoImplicitGEMM:ConvHipImplicitGemmV4R4GenWrWXdlops,0.387449,262144,miopenConvolutionBwdWeightsAlgoImplicitGEMM,128x28x28x1x1x512x28x28x128xNCHWxBF16x0x0x1x1x1x1x1x0;miopenConvolutionBwdWeightsAlgoDirect:ConvAsmBwdWrW1x1,1.05391,0,miopenConvolutionBwdWeightsAlgoDirect,<unused>
64-56-56-1x1-256-56-56-32-0x0-1x1-1x1-0-NCHW-BF16-W=miopenConvolutionBwdWeightsAlgoImplicitGEMM:ConvHipImplicitGemmV4R4GenWrWXdlops,0.211555,65536,miopenConvolutionBwdWeightsAlgoImplicitGEMM,64x56x56x1x1x256x56x56x32xNCHWxBF16x0x0x1x1x1x1x1x0;miopenConvolutionBwdWeightsAlgoDirect:ConvAsmBwdWrW1x1,0.361095,0,miopenConvolutionBwdWeightsAlgoDirect,<unused>
64-56-56-1x1-64-56-56-128-0x0-1x1-1x1-0-NCHW-BF16-W=miopenConvolutionBwdWeightsAlgoDirect:ConvAsmBwdWrW1x1,0.414024,0,miopenConvolutionBwdWeightsAlgoDirect,<unused>;miopenConvolutionBwdWeightsAlgoImplicitGEMM:ConvHipImplicitGemmV4R4GenWrWXdlops,0.537352,16384,miopenConvolutionBwdWeightsAlgoImplicitGEMM,64x56x56x1x1x64x56x56x128xNCHWxBF16x0x0x1x1x1x1x1x0
512-28-28-1x1-256-56-56-64-0x0-2x2-1x1-0-NCHW-BF16-W=miopenConvolutionBwdWeightsAlgoImplicitGEMM:ConvHipImplicitGemmV4R4GenWrWXdlops,0.415345,524288,miopenConvolutionBwdWeightsAlgoImplicitGEMM,512x28x28x1x1x256x56x56x64xNCHWxBF16x0x0x2x2x1x1x1x0;miopenConvolutionBwdWeightsAlgoDirect:ConvAsmBwdWrW1x1,0.999832,25690112,miopenConvolutionBwdWeightsAlgoDirect,<unused>
1024-14-14-1x1-512-28-28-128-0x0-2x2-1x1-0-NCHW-BF16-W=miopenConvolutionBwdWeightsAlgoImplicitGEMM:ConvHipImplicitGemmV4R4GenWrWXdlops,0.79353,2097152,miopenConvolutionBwdWeightsAlgoImplicitGEMM,1024x14x14x1x1x512x28x28x128xNCHWxBF16x0x0x2x2x1x1x1x0;miopenConvolutionBwdWeightsAlgoDirect:ConvAsmBwdWrW1x1,1.7086,25690112,miopenConvolutionBwdWeightsAlgoDirect,<unused>
64-112-112-7x7-3-224-224-64-3x3-2x2-1x1-0-NCHW-BF16-W=miopenConvolutionBwdWeightsAlgoDirect:ConvOclBwdWrW2<1>,1.87662,1204224,miopenConvolutionBwdWeightsAlgoDirect,<unused>
64-56-56-1x1-256-56-56-128-0x0-1x1-1x1-0-NCHW-BF16-W=miopenConvolutionBwdWeightsAlgoImplicitGEMM:ConvHipImplicitGemmV4R4GenWrWXdlops,0.537177,65536,miopenConvolutionBwdWeightsAlgoImplicitGEMM,64x56x56x1x1x256x56x56x128xNCHWxBF16x0x0x1x1x1x1x1x0;miopenConvolutionBwdWeightsAlgoDirect:ConvAsmBwdWrW1x1,1.39924,0,miopenConvolutionBwdWeightsAlgoDirect,<unused>
2048-7-7-1x1-1024-14-14-128-0x0-2x2-1x1-0-NCHW-BF16-W=miopenConvolutionBwdWeightsAlgoImplicitGEMM:ConvHipImplicitGemmV4R4GenWrWXdlops,1.5123,8388608,miopenConvolutionBwdWeightsAlgoImplicitGEMM,2048x7x7x1x1x1024x14x14x128xNCHWxBF16x0x0x2x2x1x1x1x0;miopenConvolutionBwdWeightsAlgoDirect:ConvAsmBwdWrW1x1,1.785,12845056,miopenConvolutionBwdWeightsAlgoDirect,<unused>
512-28-28-1x1-256-56-56-128-0x0-2x2-1x1-0-NCHW-BF16-W=miopenConvolutionBwdWeightsAlgoImplicitGEMM:ConvHipImplicitGemmV4R4GenWrWXdlops,0.647499,524288,miopenConvolutionBwdWeightsAlgoImplicitGEMM,512x28x28x1x1x256x56x56x128xNCHWxBF16x0x0x2x2x1x1x1x0;miopenConvolutionBwdWeightsAlgoDirect:ConvAsmBwdWrW1x1,1.99384,51380224,miopenConvolutionBwdWeightsAlgoDirect,<unused>
128-56-56-1x1-256-56-56-64-0x0-1x1-1x1-0-NCHW-BF16-W=miopenConvolutionBwdWeightsAlgoImplicitGEMM:ConvHipImplicitGemmV4R4GenWrWXdlops,0.485504,131072,miopenConvolutionBwdWeightsAlgoImplicitGEMM,128x56x56x1x1x256x56x56x64xNCHWxBF16x0x0x1x1x1x1x1x0;miopenConvolutionBwdWeightsAlgoDirect:ConvAsmBwdWrW1x1,1.24125,0,miopenConvolutionBwdWeightsAlgoDirect,<unused>
512-7-7-1x1-1024-14-14-128-0x0-2x2-1x1-0-NCHW-BF16-W=miopenConvolutionBwdWeightsAlgoImplicitGEMM:ConvHipImplicitGemmV4R4GenWrWXdlops,0.552924,2097152,miopenConvolutionBwdWeightsAlgoImplicitGEMM,512x7x7x1x1x1024x14x14x128xNCHWxBF16x0x0x2x2x1x1x1x0;miopenConvolutionBwdWeightsAlgoDirect:ConvAsmBwdWrW1x1,0.580033,12845056,miopenConvolutionBwdWeightsAlgoDirect,<unused>
2048-7-7-1x1-512-7-7-128-0x0-1x1-1x1-0-NCHW-BF16-W=miopenConvolutionBwdWeightsAlgoImplicitGEMM:ConvHipImplicitGemmV4R4GenWrWXdlops,0.849622,4194304,miopenConvolutionBwdWeightsAlgoImplicitGEMM,2048x7x7x1x1x512x7x7x128xNCHWxBF16x0x0x1x1x1x1x1x0;miopenConvolutionBwdWeightsAlgoDirect:ConvAsmBwdWrW1x1,0.963061,0,miopenConvolutionBwdWeightsAlgoDirect,<unused>
64-56-56-1x1-64-56-56-64-0x0-1x1-1x1-0-NCHW-BF16-W=miopenConvolutionBwdWeightsAlgoDirect:ConvAsmBwdWrW1x1,0.212496,0,miopenConvolutionBwdWeightsAlgoDirect,<unused>;miopenConvolutionBwdWeightsAlgoImplicitGEMM:ConvHipImplicitGemmV4R4GenWrWXdlops,0.339431,16384,miopenConvolutionBwdWeightsAlgoImplicitGEMM,64x56x56x1x1x64x56x56x64xNCHWxBF16x0x0x1x1x1x1x1x0
512-28-28-1x1-128-28-28-128-0x0-1x1-1x1-0-NCHW-BF16-W=miopenConvolutionBwdWeightsAlgoImplicitGEMM:ConvHipImplicitGemmV4R4GenWrWXdlops,0.410659,262144,miopenConvolutionBwdWeightsAlgoImplicitGEMM,512x28x28x1x1x128x28x28x128xNCHWxBF16x0x0x1x1x1x1x1x0;miopenConvolutionBwdWeightsAlgoDirect:ConvAsmBwdWrW1x1,1.05352,0,miopenConvolutionBwdWeightsAlgoDirect,<unused>
256-28-28-1x1-512-28-28-64-0x0-1x1-1x1-0-NCHW-BF16-W=miopenConvolutionBwdWeightsAlgoImplicitGEMM:ConvHipImplicitGemmV4R4GenWrWXdlops,0.380747,524288,miopenConvolutionBwdWeightsAlgoImplicitGEMM,256x28x28x1x1x512x28x28x64xNCHWxBF16x0x0x1x1x1x1x1x0;miopenConvolutionBwdWeightsAlgoDirect:ConvAsmBwdWrW1x1,0.881632,0,miopenConvolutionBwdWeightsAlgoDirect,<unused>
256-14-14-1x1-1024-14-14-128-0x0-1x1-1x1-0-NCHW-BF16-W=miopenConvolutionBwdWeightsAlgoImplicitGEMM:ConvHipImplicitGemmV4R4GenWrWXdlops,0.404719,1048576,miopenConvolutionBwdWeightsAlgoImplicitGEMM,256x14x14x1x1x1024x14x14x128xNCHWxBF16x0x0x1x1x1x1x1x0;miopenConvolutionBwdWeightsAlgoDirect:ConvAsmBwdWrW1x1,0.901314,0,miopenConvolutionBwdWeightsAlgoDirect,<unused>
256-28-28-1x1-512-28-28-32-0x0-1x1-1x1-0-NCHW-BF16-W=miopenConvolutionBwdWeightsAlgoImplicitGEMM:ConvHipImplicitGemmV4R4GenWrWXdlops,0.253821,524288,miopenConvolutionBwdWeightsAlgoImplicitGEMM,256x28x28x1x1x512x28x28x32xNCHWxBF16x0x0x1x1x1x1x1x0;miopenConvolutionBwdWeightsAlgoDirect:ConvAsmBwdWrW1x1,0.439307,0,miopenConvolutionBwdWeightsAlgoDirect,<unused>
128-28-28-1x1-512-28-28-32-0x0-1x1-1x1-0-NCHW-BF16-W=miopenConvolutionBwdWeightsAlgoImplicitGEMM:ConvHipImplicitGemmV4R4GenWrWXdlops,0.1745,262144,miopenConvolutionBwdWeightsAlgoImplicitGEMM,128x28x28x1x1x512x28x28x32xNCHWxBF16x0x0x1x1x1x1x1x0;miopenConvolutionBwdWeightsAlgoDirect:ConvAsmBwdWrW1x1,0.265954,0,miopenConvolutionBwdWeightsAlgoDirect,<unused>
64-56-56-1x1-256-56-56-64-0x0-1x1-1x1-0-NCHW-BF16-W=miopenConvolutionBwdWeightsAlgoImplicitGEMM:ConvHipImplicitGemmV4R4GenWrWXdlops,0.3124,65536,miopenConvolutionBwdWeightsAlgoImplicitGEMM,64x56x56x1x1x256x56x56x64xNCHWxBF16x0x0x1x1x1x1x1x0;miopenConvolutionBwdWeightsAlgoDirect:ConvAsmBwdWrW1x1,0.706981,0,miopenConvolutionBwdWeightsAlgoDirect,<unused>
256-56-56-1x1-64-56-56-64-0x0-1x1-1x1-0-NCHW-BF16-W=miopenConvolutionBwdWeightsAlgoImplicitGEMM:ConvHipImplicitGemmV4R4GenWrWXdlops,0.318464,65536,miopenConvolutionBwdWeightsAlgoImplicitGEMM,256x56x56x1x1x64x56x56x64xNCHWxBF16x0x0x1x1x1x1x1x0;miopenConvolutionBwdWeightsAlgoDirect:ConvAsmBwdWrW1x1,0.714257,0,miopenConvolutionBwdWeightsAlgoDirect,<unused>
512-28-28-1x1-128-28-28-64-0x0-1x1-1x1-0-NCHW-BF16-W=miopenConvolutionBwdWeightsAlgoImplicitGEMM:ConvHipImplicitGemmV4R4GenWrWXdlops,0.247176,262144,miopenConvolutionBwdWeightsAlgoImplicitGEMM,512x28x28x1x1x128x28x28x64xNCHWxBF16x0x0x1x1x1x1x1x0;miopenConvolutionBwdWeightsAlgoDirect:ConvAsmBwdWrW1x1,0.517509,0,miopenConvolutionBwdWeightsAlgoDirect,<unused>
512-7-7-1x1-2048-7-7-128-0x0-1x1-1x1-0-NCHW-BF16-W=miopenConvolutionBwdWeightsAlgoImplicitGEMM:ConvHipImplicitGemmV4R4GenWrWXdlops,0.849554,4194304,miopenConvolutionBwdWeightsAlgoImplicitGEMM,512x7x7x1x1x2048x7x7x128xNCHWxBF16x0x0x1x1x1x1x1x0;miopenConvolutionBwdWeightsAlgoDirect:ConvAsmBwdWrW1x1,0.967932,0,miopenConvolutionBwdWeightsAlgoDirect,<unused>
128-28-28-1x1-256-56-56-128-0x0-2x2-1x1-0-NCHW-BF16-W=miopenConvolutionBwdWeightsAlgoImplicitGEMM:ConvHipImplicitGemmV4R4GenWrWXdlops,0.286996,131072,miopenConvolutionBwdWeightsAlgoImplicitGEMM,128x28x28x1x1x256x56x56x128xNCHWxBF16x0x0x2x2x1x1x1x0;miopenConvolutionBwdWeightsAlgoDirect:ConvAsmBwdWrW1x1,0.921501,51380224,miopenConvolutionBwdWeightsAlgoDirect,<unused>
512-28-28-1x1-128-28-28-32-0x0-1x1-1x1-0-NCHW-BF16-W=miopenConvolutionBwdWeightsAlgoImplicitGEMM:ConvHipImplicitGemmV4R4GenWrWXdlops,0.180512,262144,miopenConvolutionBwdWeightsAlgoImplicitGEMM,512x28x28x1x1x128x28x28x32xNCHWxBF16x0x0x1x1x1x1x1x0;miopenConvolutionBwdWeightsAlgoDirect:ConvAsmBwdWrW1x1,0.262195,0,miopenConvolutionBwdWeightsAlgoDirect,<unused>
128-28-28-1x1-512-28-28-64-0x0-1x1-1x1-0-NCHW-BF16-W=miopenConvolutionBwdWeightsAlgoImplicitGEMM:ConvHipImplicitGemmV4R4GenWrWXdlops,0.239372,262144,miopenConvolutionBwdWeightsAlgoImplicitGEMM,128x28x28x1x1x512x28x28x64xNCHWxBF16x0x0x1x1x1x1x1x0;miopenConvolutionBwdWeightsAlgoDirect:ConvAsmBwdWrW1x1,0.531645,0,miopenConvolutionBwdWeightsAlgoDirect,<unused>
128-28-28-3x3-128-56-56-64-1x1-2x2-1x1-0-NCHW-BF16-W=miopenConvolutionBwdWeightsAlgoImplicitGEMM:ConvHipImplicitGemmV4R4GenWrWXdlops,0.511111,589824,miopenConvolutionBwdWeightsAlgoImplicitGEMM,128x28x28x3x3x128x56x56x64xNCHWxBF16x1x1x2x2x1x1x1x0;miopenConvolutionBwdWeightsAlgoWinograd:ConvWinograd3x3MultipassWrW<3-2>,1.1877,161382400,miopenConvolutionBwdWeightsAlgoWinograd,128x28x28x3x3x128x56x56x64xNCHWxBF16x1x1x2x2x1x1x1x0;miopenConvolutionBwdWeightsAlgoDirect:ConvOclBwdWrW2NonTunable,8.20312,18874368,miopenConvolutionBwdWeightsAlgoDirect,<unused>
256-14-14-1x1-512-28-28-128-0x0-2x2-1x1-0-NCHW-BF16-W=miopenConvolutionBwdWeightsAlgoImplicitGEMM:ConvHipImplicitGemmV4R4GenWrWXdlops,0.318704,524288,miopenConvolutionBwdWeightsAlgoImplicitGEMM,256x14x14x1x1x512x28x28x128xNCHWxBF16x0x0x2x2x1x1x1x0;miopenConvolutionBwdWeightsAlgoDirect:ConvAsmBwdWrW1x1,0.611583,25690112,miopenConvolutionBwdWeightsAlgoDirect,<unused>
1024-14-14-1x1-256-14-14-128-0x0-1x1-1x1-0-NCHW-BF16-W=miopenConvolutionBwdWeightsAlgoImplicitGEMM:ConvHipImplicitGemmV4R4GenWrWXdlops,0.402857,1048576,miopenConvolutionBwdWeightsAlgoImplicitGEMM,1024x14x14x1x1x256x14x14x128xNCHWxBF16x0x0x1x1x1x1x1x0;miopenConvolutionBwdWeightsAlgoDirect:ConvAsmBwdWrW1x1,0.840121,0,miopenConvolutionBwdWeightsAlgoDirect,<unused>
256-56-56-1x1-64-56-56-128-0x0-1x1-1x1-0-NCHW-BF16-W=miopenConvolutionBwdWeightsAlgoImplicitGEMM:ConvHipImplicitGemmV4R4GenWrWXdlops,0.550361,65536,miopenConvolutionBwdWeightsAlgoImplicitGEMM,256x56x56x1x1x64x56x56x128xNCHWxBF16x0x0x1x1x1x1x1x0;miopenConvolutionBwdWeightsAlgoDirect:ConvAsmBwdWrW1x1,1.39379,0,miopenConvolutionBwdWeightsAlgoDirect,<unused>
128-56-56-1x1-256-56-56-32-0x0-1x1-1x1-0-NCHW-BF16-W=miopenConvolutionBwdWeightsAlgoImplicitGEMM:ConvHipImplicitGemmV4R4GenWrWXdlops,0.272324,131072,miopenConvolutionBwdWeightsAlgoImplicitGEMM,128x56x56x1x1x256x56x56x32xNCHWxBF16x0x0x1x1x1x1x1x0;miopenConvolutionBwdWeightsAlgoDirect:ConvAsmBwdWrW1x1,0.629411,0,miopenConvolutionBwdWeightsAlgoDirect,<unused>
64-56-56-1x1-64-56-56-32-0x0-1x1-1x1-0-NCHW-BF16-W=miopenConvolutionBwdWeightsAlgoDirect:ConvAsmBwdWrW1x1,0.12204,0,miopenConvolutionBwdWeightsAlgoDirect,<unused>;miopenConvolutionBwdWeightsAlgoImplicitGEMM:ConvHipImplicitGemmV4R4GenWrWXdlops,0.229837,16384,miopenConvolutionBwdWeightsAlgoImplicitGEMM,64x56x56x1x1x64x56x56x32xNCHWxBF16x0x0x1x1x1x1x1x0
128-28-28-3x3-128-56-56-32-1x1-2x2-1x1-0-NCHW-BF16-W=miopenConvolutionBwdWeightsAlgoImplicitGEMM:ConvHipImplicitGemmV4R4GenWrWXdlops,0.314054,589824,miopenConvolutionBwdWeightsAlgoImplicitGEMM,128x28x28x3x3x128x56x56x32xNCHWxBF16x1x1x2x2x1x1x1x0;miopenConvolutionBwdWeightsAlgoWinograd:ConvWinograd3x3MultipassWrW<3-3>,0.548552,81887232,miopenConvolutionBwdWeightsAlgoWinograd,128x28x28x3x3x128x56x56x32xNCHWxBF16x1x1x2x2x1x1x1x0;miopenConvolutionBwdWeightsAlgoDirect:ConvOclBwdWrW2NonTunable,4.09985,9437184,miopenConvolutionBwdWeightsAlgoDirect,<unused>
32-30-30-3x3-3-32-32-32-0x0-1x1-1x1-0-NCHW-FP16-W=miopenConvolutionBwdWeightsAlgoDirect:ConvOclBwdWrW53,0.038896,55296,miopenConvolutionBwdWeightsAlgoDirect,<unused>
128-28-28-3x3-128-28-28-32-1x1-1x1-1x1-0-NCHW-BF16-B=miopenConvolutionBwdDataAlgoImplicitGEMM:ConvHipImplicitGemmBwdDataV1R1Xdlops,0.662579,12845056,miopenConvolutionBwdDataAlgoImplicitGEMM,<unused>;miopenConvolutionBwdDataAlgoDirect:ConvOclDirectFwd,1.13665,0,miopenConvolutionBwdDataAlgoDirect,<unused>
128-28-28-3x3-128-28-28-64-1x1-1x1-1x1-0-NCHW-BF16-B=miopenConvolutionBwdDataAlgoImplicitGEMM:ConvHipImplicitGemmBwdDataV1R1Xdlops,1.25946,25690112,miopenConvolutionBwdDataAlgoImplicitGEMM,<unused>;miopenConvolutionBwdDataAlgoDirect:ConvOclDirectFwd,1.89218,0,miopenConvolutionBwdDataAlgoDirect,<unused>
128-28-28-3x3-128-28-28-128-1x1-1x1-1x1-0-NCHW-BF16-B=miopenConvolutionBwdDataAlgoImplicitGEMM:ConvHipImplicitGemmBwdDataV1R1Xdlops,2.47886,51380224,miopenConvolutionBwdDataAlgoImplicitGEMM,<unused>;miopenConvolutionBwdDataAlgoDirect:ConvOclDirectFwd,3.4991,0,miopenConvolutionBwdDataAlgoDirect,<unused>
256-14-14-3x3-256-14-14-128-1x1-1x1-1x1-0-NCHW-BF16-B=miopenConvolutionBwdDataAlgoImplicitGEMM:ConvHipImplicitGemmBwdDataV1R1Xdlops,1.45807,25690112,miopenConvolutionBwdDataAlgoImplicitGEMM,<unused>;miopenConvolutionBwdDataAlgoDirect:ConvOclDirectFwd,3.96934,0,miopenConvolutionBwdDataAlgoDirect,<unused>
512-7-7-3x3-512-7-7-128-1x1-1x1-1x1-0-NCHW-BF16-B=miopenConvolutionBwdDataAlgoImplicitGEMM:ConvHipImplicitGemmBwdDataV1R1Xdlops,1.03528,12845056,miopenConvolutionBwdDataAlgoImplicitGEMM,<unused>;miopenConvolutionBwdDataAlgoDirect:ConvOclDirectFwd,5.98087,0,miopenConvolutionBwdDataAlgoDirect,<unused>
64-56-56-3x3-64-56-56-32-1x1-1x1-1x1-0-NCHW-BF16-B=miopenConvolutionBwdDataAlgoDirect:ConvOclDirectFwd,1.09812,0,miopenConvolutionBwdDataAlgoDirect,<unused>;miopenConvolutionBwdDataAlgoImplicitGEMM:ConvHipImplicitGemmBwdDataV1R1Xdlops,1.151,25690112,miopenConvolutionBwdDataAlgoImplicitGEMM,<unused>
64-56-56-3x3-64-56-56-64-1x1-1x1-1x1-0-NCHW-BF16-B=miopenConvolutionBwdDataAlgoDirect:ConvOclDirectFwd,1.99661,0,miopenConvolutionBwdDataAlgoDirect,<unused>;miopenConvolutionBwdDataAlgoImplicitGEMM:ConvHipImplicitGemmBwdDataV1R1Xdlops,2.2368,51380224,miopenConvolutionBwdDataAlgoImplicitGEMM,<unused>
64-56-56-3x3-64-56-56-128-1x1-1x1-1x1-0-NCHW-BF16-B=miopenConvolutionBwdDataAlgoDirect:ConvOclDirectFwd,3.83235,0,miopenConvolutionBwdDataAlgoDirect,<unused>;miopenConvolutionBwdDataAlgoImplicitGEMM:ConvHipImplicitGemmBwdDataV1R1Xdlops,4.38211,102760448,miopenConvolutionBwdDataAlgoImplicitGEMM,<unused>
32-30-30-3x3-3-32-32-32-0x0-1x1-1x1-0-NCHW-BF16-B=miopenConvolutionBwdDataAlgoDirect:ConvOclDirectFwd,0.055242,0,miopenConvolutionBwdDataAlgoDirect,<unused>
2048-28-28-1x1-1024-28-28-32-0x0-1x1-1x1-0-NCHW-BF16-B=miopenConvolutionBwdDataAlgoImplicitGEMM:ConvHipImplicitGemmBwdDataV1R1Xdlops,1.95786,102760448,miopenConvolutionBwdDataAlgoImplicitGEMM,<unused>
2048-28-28-1x1-1024-28-28-64-0x0-1x1-1x1-0-NCHW-BF16-B=miopenConvolutionBwdDataAlgoImplicitGEMM:ConvHipImplicitGemmBwdDataV1R1Xdlops,3.66963,205520896,miopenConvolutionBwdDataAlgoImplicitGEMM,<unused>
256-28-28-1x1-1024-28-28-32-0x0-1x1-1x1-0-NCHW-BF16-B=miopenConvolutionBwdDataAlgoImplicitGEMM:ConvHipImplicitGemmBwdDataV1R1Xdlops,0.637106,102760448,miopenConvolutionBwdDataAlgoImplicitGEMM,<unused>
256-28-28-1x1-1024-28-28-64-0x0-1x1-1x1-0-NCHW-BF16-B=miopenConvolutionBwdDataAlgoImplicitGEMM:ConvHipImplicitGemmBwdDataV1R1Xdlops,1.24386,205520896,miopenConvolutionBwdDataAlgoImplicitGEMM,<unused>
512-28-28-1x1-1024-28-28-32-0x0-1x1-1x1-0-NCHW-BF16-B=miopenConvolutionBwdDataAlgoImplicitGEMM:ConvHipImplicitGemmBwdDataV1R1Xdlops,0.817647,102760448,miopenConvolutionBwdDataAlgoImplicitGEMM,<unused>
512-28-28-1x1-1024-28-28-64-0x0-1x1-1x1-0-NCHW-BF16-B=miopenConvolutionBwdDataAlgoImplicitGEMM:ConvHipImplicitGemmBwdDataV1R1Xdlops,1.57139,205520896,miopenConvolutionBwdDataAlgoImplicitGEMM,<unused>
256-28-28-1x1-1280-28-28-32-0x0-1x1-1x1-0-NCHW-BF16-B=miopenConvolutionBwdDataAlgoImplicitGEMM:ConvHipImplicitGemmBwdDataV1R1Xdlops,0.790079,128450560,miopenConvolutionBwdDataAlgoImplicitGEMM,<unused>
256-28-28-1x1-1280-28-28-64-0x0-1x1-1x1-0-NCHW-BF16-B=miopenConvolutionBwdDataAlgoImplicitGEMM:ConvHipImplicitGemmBwdDataV1R1Xdlops,1.5534,256901120,miopenConvolutionBwdDataAlgoImplicitGEMM,<unused>
256-1-1-1x1-2048-1-1-32-0x0-1x1-1x1-0-NCHW-BF16-B=miopenConvolutionBwdDataAlgoImplicitGEMM:ConvHipImplicitGemmBwdDataV1R1Xdlops,0.041473,262144,miopenConvolutionBwdDataAlgoImplicitGEMM,<unused>
256-1-1-1x1-2048-1-1-64-0x0-1x1-1x1-0-NCHW-BF16-B=miopenConvolutionBwdDataAlgoImplicitGEMM:ConvHipImplicitGemmBwdDataV1R1Xdlops,0.061676,524288,miopenConvolutionBwdDataAlgoImplicitGEMM,<unused>
256-28-28-1x1-2048-28-28-32-0x0-1x1-1x1-0-NCHW-BF16-B=miopenConvolutionBwdDataAlgoImplicitGEMM:ConvHipImplicitGemmBwdDataV1R1Xdlops,1.25188,205520896,miopenConvolutionBwdDataAlgoImplicitGEMM,<unused>
256-28-28-1x1-2048-28-28-64-0x0-1x1-1x1-0-NCHW-BF16-B=miopenConvolutionBwdDataAlgoImplicitGEMM:ConvHipImplicitGemmBwdDataV1R1Xdlops,2.49488,411041792,miopenConvolutionBwdDataAlgoImplicitGEMM,<unused>
256-28-28-3x3-2048-28-28-32-12x12-1x1-12x12-0-NCHW-BF16-B=miopenConvolutionBwdDataAlgoImplicitGEMM:ConvHipImplicitGemmBwdDataV1R1Xdlops,9.52442,205520896,miopenConvolutionBwdDataAlgoImplicitGEMM,<unused>
256-28-28-3x3-2048-28-28-32-24x24-1x1-24x24-0-NCHW-BF16-B=miopenConvolutionBwdDataAlgoImplicitGEMM:ConvHipImplicitGemmBwdDataV1R1Xdlops,7.93856,205520896,miopenConvolutionBwdDataAlgoImplicitGEMM,<unused>
256-28-28-3x3-2048-28-28-64-12x12-1x1-12x12-0-NCHW-BF16-B=miopenConvolutionBwdDataAlgoImplicitGEMM:ConvHipImplicitGemmBwdDataV1R1Xdlops,18.9853,411041792,miopenConvolutionBwdDataAlgoImplicitGEMM,<unused>
256-28-28-3x3-2048-28-28-32-36x36-1x1-36x36-0-NCHW-BF16-B=miopenConvolutionBwdDataAlgoImplicitGEMM:ConvHipImplicitGemmBwdDataV1R1Xdlops,5.34382,205520896,miopenConvolutionBwdDataAlgoImplicitGEMM,<unused>
256-28-28-3x3-2048-28-28-64-24x24-1x1-24x24-0-NCHW-BF16-B=miopenConvolutionBwdDataAlgoImplicitGEMM:ConvHipImplicitGemmBwdDataV1R1Xdlops,15.9807,411041792,miopenConvolutionBwdDataAlgoImplicitGEMM,<unused>
512-28-28-1x1-2048-28-28-32-0x0-1x1-1x1-0-NCHW-BF16-B=miopenConvolutionBwdDataAlgoImplicitGEMM:ConvHipImplicitGemmBwdDataV1R1Xdlops,1.59939,205520896,miopenConvolutionBwdDataAlgoImplicitGEMM,<unused>
256-28-28-3x3-2048-28-28-64-36x36-1x1-36x36-0-NCHW-BF16-B=miopenConvolutionBwdDataAlgoImplicitGEMM:ConvHipImplicitGemmBwdDataV1R1Xdlops,10.9231,411041792,miopenConvolutionBwdDataAlgoImplicitGEMM,<unused>
512-28-28-1x1-2048-28-28-64-0x0-1x1-1x1-0-NCHW-BF16-B=miopenConvolutionBwdDataAlgoImplicitGEMM:ConvHipImplicitGemmBwdDataV1R1Xdlops,3.16096,411041792,miopenConvolutionBwdDataAlgoImplicitGEMM,<unused>
1024-28-28-1x1-256-28-28-32-0x0-1x1-1x1-0-NCHW-BF16-B=miopenConvolutionBwdDataAlgoImplicitGEMM:ConvHipImplicitGemmBwdDataV1R1Xdlops,0.339042,25690112,miopenConvolutionBwdDataAlgoImplicitGEMM,<unused>
1024-28-28-1x1-256-28-28-64-0x0-1x1-1x1-0-NCHW-BF16-B=miopenConvolutionBwdDataAlgoImplicitGEMM:ConvHipImplicitGemmBwdDataV1R1Xdlops,0.600018,51380224,miopenConvolutionBwdDataAlgoImplicitGEMM,<unused>
256-28-28-3x3-256-28-28-32-1x1-1x1-1x1-0-NCHW-BF16-B=miopenConvolutionBwdDataAlgoImplicitGEMM:ConvHipImplicitGemmBwdDataV1R1Xdlops,1.43653,25690112,miopenConvolutionBwdDataAlgoImplicitGEMM,<unused>;miopenConvolutionBwdDataAlgoDirect:ConvOclDirectFwd,3.76937,0,miopenConvolutionBwdDataAlgoDirect,<unused>
256-28-28-3x3-256-28-28-64-1x1-1x1-1x1-0-NCHW-BF16-B=miopenConvolutionBwdDataAlgoImplicitGEMM:ConvHipImplicitGemmBwdDataV1R1Xdlops,2.81103,51380224,miopenConvolutionBwdDataAlgoImplicitGEMM,<unused>;miopenConvolutionBwdDataAlgoDirect:ConvOclDirectFwd,6.9507,0,miopenConvolutionBwdDataAlgoDirect,<unused>
256-28-28-3x3-256-28-28-32-2x2-1x1-2x2-0-NCHW-BF16-B=miopenConvolutionBwdDataAlgoImplicitGEMM:ConvHipImplicitGemmBwdDataV1R1Xdlops,1.41079,25690112,miopenConvolutionBwdDataAlgoImplicitGEMM,<unused>
256-28-28-3x3-256-28-28-64-2x2-1x1-2x2-0-NCHW-BF16-B=miopenConvolutionBwdDataAlgoImplicitGEMM:ConvHipImplicitGemmBwdDataV1R1Xdlops,2.77521,51380224,miopenConvolutionBwdDataAlgoImplicitGEMM,<unused>
1024-28-28-1x1-512-28-28-64-0x0-1x1-1x1-0-NCHW-BF16-B=miopenConvolutionBwdDataAlgoImplicitGEMM:ConvHipImplicitGemmBwdDataV1R1Xdlops,1.15227,102760448,miopenConvolutionBwdDataAlgoImplicitGEMM,<unused>
2048-28-28-1x1-512-28-28-32-0x0-1x1-1x1-0-NCHW-BF16-B=miopenConvolutionBwdDataAlgoImplicitGEMM:ConvHipImplicitGemmBwdDataV1R1Xdlops,0.987931,51380224,miopenConvolutionBwdDataAlgoImplicitGEMM,<unused>
2048-28-28-1x1-512-28-28-64-0x0-1x1-1x1-0-NCHW-BF16-B=miopenConvolutionBwdDataAlgoImplicitGEMM:ConvHipImplicitGemmBwdDataV1R1Xdlops,1.89335,102760448,miopenConvolutionBwdDataAlgoImplicitGEMM,<unused>
512-28-28-3x3-512-28-28-32-2x2-1x1-2x2-0-NCHW-BF16-B=miopenConvolutionBwdDataAlgoImplicitGEMM:ConvHipImplicitGemmBwdDataV1R1Xdlops,3.44136,51380224,miopenConvolutionBwdDataAlgoImplicitGEMM,<unused>
512-28-28-3x3-512-28-28-32-4x4-1x1-4x4-0-NCHW-BF16-B=miopenConvolutionBwdDataAlgoImplicitGEMM:ConvHipImplicitGemmBwdDataV1R1Xdlops,3.30542,51380224,miopenConvolutionBwdDataAlgoImplicitGEMM,<unused>
512-28-28-3x3-512-28-28-64-2x2-1x1-2x2-0-NCHW-BF16-B=miopenConvolutionBwdDataAlgoImplicitGEMM:ConvHipImplicitGemmBwdDataV1R1Xdlops,6.832,102760448,miopenConvolutionBwdDataAlgoImplicitGEMM,<unused>
2048-7-7-1x1-1024-14-14-128-0x0-2x2-1x1-0-NCHW-FP32-B=miopenConvolutionBwdDataAlgoImplicitGEMM:ConvHipImplicitGemmV4R4Xdlops_1x1,1.33092,0,miopenConvolutionBwdDataAlgoImplicitGEMM,<unused>;miopenConvolutionBwdDataAlgoDirect:ConvAsm1x1UV2,1.81132,0,miopenConvolutionBwdDataAlgoDirect,<unused>;miopenConvolutionBwdDataAlgoWinograd:ConvBinWinogradRxSf2x3,17.5897,0,miopenConvolutionBwdDataAlgoWinograd,<unused>
512-28-28-3x3-512-28-28-64-4x4-1x1-4x4-0-NCHW-BF16-B=miopenConvolutionBwdDataAlgoImplicitGEMM:ConvHipImplicitGemmBwdDataV1R1Xdlops,6.58568,102760448,miopenConvolutionBwdDataAlgoImplicitGEMM,<unused>
256-14-14-1x1-1024-14-14-128-0x0-1x1-1x1-0-NCHW-FP32-B=miopenConvolutionBwdDataAlgoImplicitGEMM:ConvHipImplicitGemmV4R4Xdlops_1x1,0.530048,0,miopenConvolutionBwdDataAlgoImplicitGEMM,<unused>;miopenConvolutionBwdDataAlgoDirect:ConvAsm1x1U,0.751606,0,miopenConvolutionBwdDataAlgoDirect,<unused>;miopenConvolutionBwdDataAlgoWinograd:ConvBinWinogradRxSf3x2,1.88238,0,miopenConvolutionBwdDataAlgoWinograd,<unused>
512-7-7-1x1-1024-14-14-128-0x0-2x2-1x1-0-NCHW-FP32-B=miopenConvolutionBwdDataAlgoDirect:ConvAsm1x1UV2,0.508848,0,miopenConvolutionBwdDataAlgoDirect,<unused>;miopenConvolutionBwdDataAlgoImplicitGEMM:ConvHipImplicitGemmV4R4Xdlops_1x1,0.586877,0,miopenConvolutionBwdDataAlgoImplicitGEMM,<unused>;miopenConvolutionBwdDataAlgoWinograd:ConvBinWinogradRxSf2x3,4.26391,0,miopenConvolutionBwdDataAlgoWinograd,<unused>
128-28-28-3x3-128-28-28-128-1x1-1x1-1x1-0-NCHW-FP32-B=miopenConvolutionBwdDataAlgoWinograd:ConvBinWinograd3x3U,0.897289,0,miopenConvolutionBwdDataAlgoWinograd,<unused>
512-28-28-1x1-128-28-28-128-0x0-1x1-1x1-0-NCHW-FP32-B=miopenConvolutionBwdDataAlgoImplicitGEMM:ConvHipImplicitGemmV4R4Xdlops_1x1,0.433509,0,miopenConvolutionBwdDataAlgoImplicitGEMM,<unused>;miopenConvolutionBwdDataAlgoDirect:ConvAsm1x1U,0.706966,0,miopenConvolutionBwdDataAlgoDirect,<unused>;miopenConvolutionBwdDataAlgoWinograd:ConvBinWinogradRxSf3x2,1.85174,0,miopenConvolutionBwdDataAlgoWinograd,<unused>
512-7-7-1x1-2048-7-7-128-0x0-1x1-1x1-0-NCHW-FP32-B=miopenConvolutionBwdDataAlgoImplicitGEMM:ConvHipImplicitGemmV4R4Xdlops_1x1,0.540128,0,miopenConvolutionBwdDataAlgoImplicitGEMM,<unused>;miopenConvolutionBwdDataAlgoDirect:ConvAsm1x1U,0.818496,0,miopenConvolutionBwdDataAlgoDirect,<unused>;miopenConvolutionBwdDataAlgoWinograd:ConvBinWinogradRxSf3x2,2.61184,0,miopenConvolutionBwdDataAlgoWinograd,<unused>
1024-14-14-1x1-256-14-14-128-0x0-1x1-1x1-0-NCHW-FP32-B=miopenConvolutionBwdDataAlgoImplicitGEMM:ConvHipImplicitGemmV4R4Xdlops_1x1,0.460014,0,miopenConvolutionBwdDataAlgoImplicitGEMM,<unused>;miopenConvolutionBwdDataAlgoDirect:ConvAsm1x1U,0.722156,0,miopenConvolutionBwdDataAlgoDirect,<unused>;miopenConvolutionBwdDataAlgoWinograd:ConvBinWinogradRxSf3x2,1.81618,0,miopenConvolutionBwdDataAlgoWinograd,<unused>
256-14-14-3x3-256-14-14-128-1x1-1x1-1x1-0-NCHW-FP32-B=miopenConvolutionBwdDataAlgoWinograd:ConvBinWinograd3x3U,0.919198,0,miopenConvolutionBwdDataAlgoWinograd,<unused>
128-28-28-1x1-256-56-56-128-0x0-2x2-1x1-0-NCHW-FP32-B=miopenConvolutionBwdDataAlgoDirect:ConvAsm1x1UV2,0.590081,0,miopenConvolutionBwdDataAlgoDirect,<unused>;miopenConvolutionBwdDataAlgoImplicitGEMM:ConvHipImplicitGemmV4R4Xdlops_1x1,1.20567,0,miopenConvolutionBwdDataAlgoImplicitGEMM,<unused>;miopenConvolutionBwdDataAlgoWinograd:ConvBinWinogradRxSf2x3,3.71072,0,miopenConvolutionBwdDataAlgoWinograd,<unused>
512-28-28-1x1-256-56-56-128-0x0-2x2-1x1-0-NCHW-FP32-B=miopenConvolutionBwdDataAlgoDirect:ConvAsm1x1UV2,1.64501,0,miopenConvolutionBwdDataAlgoDirect,<unused>;miopenConvolutionBwdDataAlgoImplicitGEMM:ConvHipImplicitGemmV4R4Xdlops_1x1,1.69469,0,miopenConvolutionBwdDataAlgoImplicitGEMM,<unused>;miopenConvolutionBwdDataAlgoWinograd:ConvBinWinogradRxSf2x3,14.639,0,miopenConvolutionBwdDataAlgoWinograd,<unused>
64-56-56-1x1-256-56-56-128-0x0-1x1-1x1-0-NCHW-FP32-B=miopenConvolutionBwdDataAlgoDirect:ConvAsm1x1U,0.709222,0,miopenConvolutionBwdDataAlgoDirect,<unused>;miopenConvolutionBwdDataAlgoImplicitGEMM:ConvHipImplicitGemmV4R4Xdlops_1x1,0.721366,0,miopenConvolutionBwdDataAlgoImplicitGEMM,<unused>;miopenConvolutionBwdDataAlgoWinograd:ConvBinWinogradRxSf3x2,1.93949,0,miopenConvolutionBwdDataAlgoWinograd,<unused>
64-112-112-7x7-3-230-230-128-0x0-2x2-1x1-0-NCHW-FP32-B=miopenConvolutionBwdDataAlgoDirect:ConvOclDirectFwd,5.75604,0,miopenConvolutionBwdDataAlgoDirect,<unused>;miopenConvolutionBwdDataAlgoWinograd:ConvBinWinogradRxSf2x3,10.9135,0,miopenConvolutionBwdDataAlgoWinograd,<unused>
1024-14-14-1x1-512-28-28-128-0x0-2x2-1x1-0-NCHW-FP32-B=miopenConvolutionBwdDataAlgoImplicitGEMM:ConvHipImplicitGemmV4R4Xdlops_1x1,1.35475,0,miopenConvolutionBwdDataAlgoImplicitGEMM,<unused>;miopenConvolutionBwdDataAlgoDirect:ConvAsm1x1UV2,1.78734,0,miopenConvolutionBwdDataAlgoDirect,<unused>;miopenConvolutionBwdDataAlgoWinograd:ConvBinWinogradRxSf2x3,15.6269,0,miopenConvolutionBwdDataAlgoWinograd,<unused>
128-28-28-1x1-512-28-28-128-0x0-1x1-1x1-0-NCHW-FP32-B=miopenConvolutionBwdDataAlgoImplicitGEMM:ConvHipImplicitGemmV4R4Xdlops_1x1,0.557516,0,miopenConvolutionBwdDataAlgoImplicitGEMM,<unused>;miopenConvolutionBwdDataAlgoDirect:ConvAsm1x1U,0.686814,0,miopenConvolutionBwdDataAlgoDirect,<unused>;miopenConvolutionBwdDataAlgoWinograd:ConvBinWinogradRxSf3x2,1.94181,0,miopenConvolutionBwdDataAlgoWinograd,<unused>
256-14-14-1x1-512-28-28-128-0x0-2x2-1x1-0-NCHW-FP32-B=miopenConvolutionBwdDataAlgoDirect:ConvAsm1x1UV2,0.569726,0,miopenConvolutionBwdDataAlgoDirect,<unused>;miopenConvolutionBwdDataAlgoImplicitGEMM:ConvHipImplicitGemmV4R4Xdlops_1x1,0.783536,0,miopenConvolutionBwdDataAlgoImplicitGEMM,<unused>;miopenConvolutionBwdDataAlgoWinograd:ConvBinWinogradRxSf2x3,3.98806,0,miopenConvolutionBwdDataAlgoWinograd,<unused>
2048-7-7-1x1-512-7-7-128-0x0-1x1-1x1-0-NCHW-FP32-B=miopenConvolutionBwdDataAlgoImplicitGEMM:ConvHipImplicitGemmV4R4Xdlops_1x1,0.510516,0,miopenConvolutionBwdDataAlgoImplicitGEMM,<unused>;miopenConvolutionBwdDataAlgoDirect:ConvAsm1x1U,0.897994,0,miopenConvolutionBwdDataAlgoDirect,<unused>;miopenConvolutionBwdDataAlgoWinograd:ConvBinWinogradRxSf3x2,2.48816,0,miopenConvolutionBwdDataAlgoWinograd,<unused>
512-7-7-3x3-512-7-7-128-1x1-1x1-1x1-0-NCHW-FP32-B=miopenConvolutionBwdDataAlgoWinograd:ConvBinWinograd3x3U,1.15611,0,miopenConvolutionBwdDataAlgoWinograd,<unused>
256-56-56-1x1-64-56-56-128-0x0-1x1-1x1-0-NCHW-FP32-B=miopenConvolutionBwdDataAlgoDirect:ConvAsm1x1U,0.687987,0,miopenConvolutionBwdDataAlgoDirect,<unused>;miopenConvolutionBwdDataAlgoImplicitGEMM:ConvHipImplicitGemmV4R4Xdlops_1x1,0.746508,0,miopenConvolutionBwdDataAlgoImplicitGEMM,<unused>;miopenConvolutionBwdDataAlgoWinograd:ConvBinWinogradRxSf3x2,1.68606,0,miopenConvolutionBwdDataAlgoWinograd,<unused>
64-56-56-1x1-64-56-56-128-0x0-1x1-1x1-0-NCHW-FP32-B=miopenConvolutionBwdDataAlgoDirect:ConvAsm1x1U,0.221328,0,miopenConvolutionBwdDataAlgoDirect,<unused>;miopenConvolutionBwdDataAlgoImplicitGEMM:ConvHipImplicitGemmV4R4Xdlops_1x1,0.255043,0,miopenConvolutionBwdDataAlgoImplicitGEMM,<unused>;miopenConvolutionBwdDataAlgoWinograd:ConvBinWinogradRxSf3x2,0.559678,0,miopenConvolutionBwdDataAlgoWinograd,<unused>
64-56-56-3x3-64-56-56-128-1x1-1x1-1x1-0-NCHW-FP32-B=miopenConvolutionBwdDataAlgoWinograd:ConvBinWinograd3x3U,0.937845,0,miopenConvolutionBwdDataAlgoWinograd,<unused>
128-56-56-1x1-256-56-56-32-0x0-1x1-1x1-0-NCHW-FP32-B=miopenConvolutionBwdDataAlgoImplicitGEMM:ConvHipImplicitGemmV4R4Xdlops_1x1,0.26668,0,miopenConvolutionBwdDataAlgoImplicitGEMM,<unused>;miopenConvolutionBwdDataAlgoDirect:ConvAsm1x1U,0.341341,0,miopenConvolutionBwdDataAlgoDirect,<unused>;miopenConvolutionBwdDataAlgoWinograd:ConvBinWinogradRxSf3x2,0.948708,0,miopenConvolutionBwdDataAlgoWinograd,<unused>
256-28-28-1x1-512-28-28-32-0x0-1x1-1x1-0-NCHW-FP32-B=miopenConvolutionBwdDataAlgoImplicitGEMM:ConvHipImplicitGemmV4R4Xdlops_1x1,0.237537,0,miopenConvolutionBwdDataAlgoImplicitGEMM,<unused>;miopenConvolutionBwdDataAlgoDirect:ConvAsm1x1U,0.341371,0,miopenConvolutionBwdDataAlgoDirect,<unused>;miopenConvolutionBwdDataAlgoWinograd:ConvBinWinogradRxSf3x2,1.01471,0,miopenConvolutionBwdDataAlgoWinograd,<unused>
2048-28-28-1x1-1024-28-28-64-0x0-1x1-1x1-0-NCHW-FP32-B=miopenConvolutionBwdDataAlgoImplicitGEMM:ConvHipImplicitGemmV4R4Xdlops_1x1,6.19626,0,miopenConvolutionBwdDataAlgoImplicitGEMM,<unused>;miopenConvolutionBwdDataAlgoDirect:ConvAsm1x1U,10.7349,0,miopenConvolutionBwdDataAlgoDirect,<unused>;miopenConvolutionBwdDataAlgoWinograd:ConvBinWinogradRxSf3x2,30.3072,0,miopenConvolutionBwdDataAlgoWinograd,<unused>
256-28-28-1x1-1024-28-28-64-0x0-1x1-1x1-0-NCHW-FP32-B=miopenConvolutionBwdDataAlgoImplicitGEMM:ConvHipImplicitGemmV4R4Xdlops_1x1,0.922673,0,miopenConvolutionBwdDataAlgoImplicitGEMM,<unused>;miopenConvolutionBwdDataAlgoDirect:ConvAsm1x1U,1.28602,0,miopenConvolutionBwdDataAlgoDirect,<unused>;miopenConvolutionBwdDataAlgoWinograd:ConvBinWinogradRxSf3x2,3.84256,0,miopenConvolutionBwdDataAlgoWinograd,<unused>
512-28-28-1x1-1024-28-28-64-0x0-1x1-1x1-0-NCHW-FP32-B=miopenConvolutionBwdDataAlgoImplicitGEMM:ConvHipImplicitGemmV4R4Xdlops_1x1,1.6492,0,miopenConvolutionBwdDataAlgoImplicitGEMM,<unused>;miopenConvolutionBwdDataAlgoDirect:ConvAsm1x1U,2.65975,0,miopenConvolutionBwdDataAlgoDirect,<unused>;miopenConvolutionBwdDataAlgoWinograd:ConvBinWinogradRxSf3x2,7.59691,0,miopenConvolutionBwdDataAlgoWinograd,<unused>
128-28-28-3x3-128-28-28-64-1x1-1x1-1x1-0-NCHW-FP32-B=miopenConvolutionBwdDataAlgoWinograd:ConvBinWinogradRxSf2x3,0.486907,0,miopenConvolutionBwdDataAlgoWinograd,<unused>
512-28-28-1x1-128-28-28-64-0x0-1x1-1x1-0-NCHW-FP32-B=miopenConvolutionBwdDataAlgoImplicitGEMM:ConvHipImplicitGemmV4R4Xdlops_1x1,0.234975,0,miopenConvolutionBwdDataAlgoImplicitGEMM,<unused>;miopenConvolutionBwdDataAlgoDirect:ConvAsm1x1U,0.369992,0,miopenConvolutionBwdDataAlgoDirect,<unused>;miopenConvolutionBwdDataAlgoWinograd:ConvBinWinogradRxSf3x2,0.962001,0,miopenConvolutionBwdDataAlgoWinograd,<unused>
128-28-28-3x3-128-56-56-64-1x1-2x2-1x1-0-NCHW-FP32-B=miopenConvolutionBwdDataAlgoImplicitGEMM:ConvHipImplicitGemmBwdDataV1R1Xdlops,0.733436,0,miopenConvolutionBwdDataAlgoImplicitGEMM,<unused>;miopenConvolutionBwdDataAlgoWinograd:ConvBinWinogradRxS,1.83342,0,miopenConvolutionBwdDataAlgoWinograd,<unused>;miopenConvolutionBwdDataAlgoDirect:ConvOclDirectFwd,3.40547,0,miopenConvolutionBwdDataAlgoDirect,<unused>
256-28-28-1x1-1280-28-28-64-0x0-1x1-1x1-0-NCHW-FP32-B=miopenConvolutionBwdDataAlgoImplicitGEMM:ConvHipImplicitGemmV4R4Xdlops_1x1,1.1254,0,miopenConvolutionBwdDataAlgoImplicitGEMM,<unused>;miopenConvolutionBwdDataAlgoDirect:ConvAsm1x1U,1.59681,0,miopenConvolutionBwdDataAlgoDirect,<unused>;miopenConvolutionBwdDataAlgoWinograd:ConvBinWinogradRxSf3x2,4.75443,0,miopenConvolutionBwdDataAlgoWinograd,<unused>
256-1-1-1x1-2048-1-1-64-0x0-1x1-1x1-0-NCHW-FP32-B=miopenConvolutionBwdDataAlgoImplicitGEMM:ConvHipImplicitGemmV4R4Xdlops_1x1,0.036452,0,miopenConvolutionBwdDataAlgoImplicitGEMM,<unused>;miopenConvolutionBwdDataAlgoDirect:ConvAsm1x1U,0.065188,0,miopenConvolutionBwdDataAlgoDirect,<unused>;miopenConvolutionBwdDataAlgoWinograd:ConvBinWinogradRxSf2x3,0.144744,0,miopenConvolutionBwdDataAlgoWinograd,<unused>
256-28-28-1x1-2048-28-28-64-0x0-1x1-1x1-0-NCHW-FP32-B=miopenConvolutionBwdDataAlgoImplicitGEMM:ConvHipImplicitGemmV4R4Xdlops_1x1,1.80201,0,miopenConvolutionBwdDataAlgoImplicitGEMM,<unused>;miopenConvolutionBwdDataAlgoDirect:ConvAsm1x1U,2.56323,0,miopenConvolutionBwdDataAlgoDirect,<unused>;miopenConvolutionBwdDataAlgoWinograd:ConvBinWinogradRxSf3x2,7.8558,0,miopenConvolutionBwdDataAlgoWinograd,<unused>
256-28-28-3x3-2048-28-28-64-12x12-1x1-12x12-0-NCHW-FP32-B=miopenConvolutionBwdDataAlgoImplicitGEMM:ConvHipImplicitGemmBwdDataV1R1Xdlops,13.6792,0,miopenConvolutionBwdDataAlgoImplicitGEMM,<unused>
256-28-28-3x3-2048-28-28-64-24x24-1x1-24x24-0-NCHW-FP32-B=miopenConvolutionBwdDataAlgoImplicitGEMM:ConvHipImplicitGemmBwdDataV1R1Xdlops,13.4653,0,miopenConvolutionBwdDataAlgoImplicitGEMM,<unused>
256-28-28-3x3-2048-28-28-64-36x36-1x1-36x36-0-NCHW-FP32-B=miopenConvolutionBwdDataAlgoImplicitGEMM:ConvHipImplicitGemmBwdDataV1R1Xdlops,13.1884,0,miopenConvolutionBwdDataAlgoImplicitGEMM,<unused>
512-28-28-1x1-2048-28-28-64-0x0-1x1-1x1-0-NCHW-FP32-B=miopenConvolutionBwdDataAlgoImplicitGEMM:ConvHipImplicitGemmV4R4Xdlops_1x1,3.26178,0,miopenConvolutionBwdDataAlgoImplicitGEMM,<unused>;miopenConvolutionBwdDataAlgoDirect:ConvAsm1x1U,5.29744,0,miopenConvolutionBwdDataAlgoDirect,<unused>;miopenConvolutionBwdDataAlgoWinograd:ConvBinWinogradRxSf3x2,15.4177,0,miopenConvolutionBwdDataAlgoWinograd,<unused>
1024-28-28-1x1-256-28-28-64-0x0-1x1-1x1-0-NCHW-FP32-B=miopenConvolutionBwdDataAlgoImplicitGEMM:ConvHipImplicitGemmV4R4Xdlops_1x1,0.836409,0,miopenConvolutionBwdDataAlgoImplicitGEMM,<unused>;miopenConvolutionBwdDataAlgoDirect:ConvAsm1x1U,1.36535,0,miopenConvolutionBwdDataAlgoDirect,<unused>;miopenConvolutionBwdDataAlgoWinograd:ConvBinWinogradRxSf3x2,3.75657,0,miopenConvolutionBwdDataAlgoWinograd,<unused>
21-28-28-1x1-256-28-28-64-0x0-1x1-1x1-0-NCHW-FP32-B=miopenConvolutionBwdDataAlgoDirect:ConvAsm1x1U,0.069762,0,miopenConvolutionBwdDataAlgoDirect,<unused>;miopenConvolutionBwdDataAlgoWinograd:ConvBinWinogradRxSf2x3,0.213045,0,miopenConvolutionBwdDataAlgoWinograd,<unused>
256-28-28-3x3-256-28-28-64-1x1-1x1-1x1-0-NCHW-FP32-B=miopenConvolutionBwdDataAlgoWinograd:ConvBinWinogradRxS,1.67475,0,miopenConvolutionBwdDataAlgoWinograd,<unused>
256-28-28-3x3-256-28-28-64-2x2-1x1-2x2-0-NCHW-FP32-B=miopenConvolutionBwdDataAlgoImplicitGEMM:ConvHipImplicitGemmBwdDataV1R1Xdlops,1.63942,0,miopenConvolutionBwdDataAlgoImplicitGEMM,<unused>
128-56-56-1x1-256-56-56-64-0x0-1x1-1x1-0-NCHW-FP32-B=miopenConvolutionBwdDataAlgoImplicitGEMM:ConvHipImplicitGemmV4R4Xdlops_1x1,0.513096,0,miopenConvolutionBwdDataAlgoImplicitGEMM,<unused>;miopenConvolutionBwdDataAlgoDirect:ConvAsm1x1U,0.652527,0,miopenConvolutionBwdDataAlgoDirect,<unused>;miopenConvolutionBwdDataAlgoWinograd:ConvBinWinogradRxSf3x2,1.78779,0,miopenConvolutionBwdDataAlgoWinograd,<unused>
512-28-28-1x1-256-56-56-64-0x0-2x2-1x1-0-NCHW-FP32-B=miopenConvolutionBwdDataAlgoDirect:ConvAsm1x1UV2,0.839825,0,miopenConvolutionBwdDataAlgoDirect,<unused>;miopenConvolutionBwdDataAlgoImplicitGEMM:ConvHipImplicitGemmV4R4Xdlops_1x1,0.86232,0,miopenConvolutionBwdDataAlgoImplicitGEMM,<unused>;miopenConvolutionBwdDataAlgoWinograd:ConvBinWinogradRxSf2x3,7.17586,0,miopenConvolutionBwdDataAlgoWinograd,<unused>
64-56-56-1x1-256-56-56-64-0x0-1x1-1x1-0-NCHW-FP32-B=miopenConvolutionBwdDataAlgoDirect:ConvAsm1x1U,0.359706,0,miopenConvolutionBwdDataAlgoDirect,<unused>;miopenConvolutionBwdDataAlgoImplicitGEMM:ConvHipImplicitGemmV4R4Xdlops_1x1,0.366772,0,miopenConvolutionBwdDataAlgoImplicitGEMM,<unused>;miopenConvolutionBwdDataAlgoWinograd:ConvBinWinogradRxSf3x2,1.03719,0,miopenConvolutionBwdDataAlgoWinograd,<unused>
64-112-112-7x7-3-224-224-64-3x3-2x2-1x1-0-NCHW-FP32-B=miopenConvolutionBwdDataAlgoDirect:ConvOclDirectFwd,2.17213,0,miopenConvolutionBwdDataAlgoDirect,<unused>;miopenConvolutionBwdDataAlgoWinograd:ConvBinWinogradRxSf2x3,5.06857,0,miopenConvolutionBwdDataAlgoWinograd,<unused>
1024-28-28-1x1-512-28-28-64-0x0-1x1-1x1-0-NCHW-FP32-B=miopenConvolutionBwdDataAlgoImplicitGEMM:ConvHipImplicitGemmV4R4Xdlops_1x1,1.6154,0,miopenConvolutionBwdDataAlgoImplicitGEMM,<unused>;miopenConvolutionBwdDataAlgoDirect:ConvAsm1x1U,2.6487,0,miopenConvolutionBwdDataAlgoDirect,<unused>;miopenConvolutionBwdDataAlgoWinograd:ConvBinWinogradRxSf3x2,7.40915,0,miopenConvolutionBwdDataAlgoWinograd,<unused>
128-28-28-1x1-512-28-28-64-0x0-1x1-1x1-0-NCHW-FP32-B=miopenConvolutionBwdDataAlgoImplicitGEMM:ConvHipImplicitGemmV4R4Xdlops_1x1,0.294449,0,miopenConvolutionBwdDataAlgoImplicitGEMM,<unused>;miopenConvolutionBwdDataAlgoDirect:ConvAsm1x1U,0.349437,0,miopenConvolutionBwdDataAlgoDirect,<unused>;miopenConvolutionBwdDataAlgoWinograd:ConvBinWinogradRxSf3x2,1.04599,0,miopenConvolutionBwdDataAlgoWinograd,<unused>
2048-28-28-1x1-512-28-28-64-0x0-1x1-1x1-0-NCHW-FP32-B=miopenConvolutionBwdDataAlgoImplicitGEMM:ConvHipImplicitGemmV4R4Xdlops_1x1,3.18106,0,miopenConvolutionBwdDataAlgoImplicitGEMM,<unused>;miopenConvolutionBwdDataAlgoDirect:ConvAsm1x1U,5.27371,0,miopenConvolutionBwdDataAlgoDirect,<unused>;miopenConvolutionBwdDataAlgoWinograd:ConvBinWinogradRxSf3x2,14.8925,0,miopenConvolutionBwdDataAlgoWinograd,<unused>
256-28-28-1x1-512-28-28-64-0x0-1x1-1x1-0-NCHW-FP32-B=miopenConvolutionBwdDataAlgoImplicitGEMM:ConvHipImplicitGemmV4R4Xdlops_1x1,0.460851,0,miopenConvolutionBwdDataAlgoImplicitGEMM,<unused>;miopenConvolutionBwdDataAlgoDirect:ConvAsm1x1U,0.665894,0,miopenConvolutionBwdDataAlgoDirect,<unused>;miopenConvolutionBwdDataAlgoWinograd:ConvBinWinogradRxSf3x2,1.81588,0,miopenConvolutionBwdDataAlgoWinograd,<unused>
512-28-28-3x3-512-28-28-64-4x4-1x1-4x4-0-NCHW-FP32-B=miopenConvolutionBwdDataAlgoImplicitGEMM:ConvHipImplicitGemmBwdDataV1R1Xdlops,6.25483,0,miopenConvolutionBwdDataAlgoImplicitGEMM,<unused>
512-28-28-3x3-512-28-28-64-2x2-1x1-2x2-0-NCHW-FP32-B=miopenConvolutionBwdDataAlgoImplicitGEMM:ConvHipImplicitGemmBwdDataV1R1Xdlops,6.40488,0,miopenConvolutionBwdDataAlgoImplicitGEMM,<unused>
256-56-56-1x1-64-56-56-64-0x0-1x1-1x1-0-NCHW-FP32-B=miopenConvolutionBwdDataAlgoDirect:ConvAsm1x1U,0.348727,0,miopenConvolutionBwdDataAlgoDirect,<unused>;miopenConvolutionBwdDataAlgoImplicitGEMM:ConvHipImplicitGemmV4R4Xdlops_1x1,0.394413,0,miopenConvolutionBwdDataAlgoImplicitGEMM,<unused>;miopenConvolutionBwdDataAlgoWinograd:ConvBinWinogradRxSf3x2,0.929975,0,miopenConvolutionBwdDataAlgoWinograd,<unused>
64-56-56-1x1-64-56-56-64-0x0-1x1-1x1-0-NCHW-FP32-B=miopenConvolutionBwdDataAlgoDirect:ConvAsm1x1U,0.117725,0,miopenConvolutionBwdDataAlgoDirect,<unused>;miopenConvolutionBwdDataAlgoImplicitGEMM:ConvHipImplicitGemmV4R4Xdlops_1x1,0.139359,0,miopenConvolutionBwdDataAlgoImplicitGEMM,<unused>;miopenConvolutionBwdDataAlgoWinograd:ConvBinWinogradRxSf3x2,0.303873,0,miopenConvolutionBwdDataAlgoWinograd,<unused>
64-56-56-3x3-64-56-56-64-1x1-1x1-1x1-0-NCHW-FP32-B=miopenConvolutionBwdDataAlgoWinograd:ConvBinWinogradRxSf2x3,0.489494,0,miopenConvolutionBwdDataAlgoWinograd,<unused>
2048-28-28-1x1-1024-28-28-32-0x0-1x1-1x1-0-NCHW-FP32-B=miopenConvolutionBwdDataAlgoImplicitGEMM:ConvHipImplicitGemmV4R4Xdlops_1x1,3.28641,0,miopenConvolutionBwdDataAlgoImplicitGEMM,<unused>;miopenConvolutionBwdDataAlgoDirect:ConvAsm1x1U,5.27351,0,miopenConvolutionBwdDataAlgoDirect,<unused>;miopenConvolutionBwdDataAlgoWinograd:ConvBinWinogradRxSf3x2,14.9033,0,miopenConvolutionBwdDataAlgoWinograd,<unused>
256-28-28-1x1-1024-28-28-32-0x0-1x1-1x1-0-NCHW-FP32-B=miopenConvolutionBwdDataAlgoImplicitGEMM:ConvHipImplicitGemmV4R4Xdlops_1x1,0.4956,0,miopenConvolutionBwdDataAlgoImplicitGEMM,<unused>;miopenConvolutionBwdDataAlgoDirect:ConvAsm1x1U,0.667484,0,miopenConvolutionBwdDataAlgoDirect,<unused>;miopenConvolutionBwdDataAlgoWinograd:ConvBinWinogradRxSf3x2,1.8203,0,miopenConvolutionBwdDataAlgoWinograd,<unused>
512-28-28-1x1-1024-28-28-32-0x0-1x1-1x1-0-NCHW-FP32-B=miopenConvolutionBwdDataAlgoImplicitGEMM:ConvHipImplicitGemmV4R4Xdlops_1x1,0.858984,0,miopenConvolutionBwdDataAlgoImplicitGEMM,<unused>;miopenConvolutionBwdDataAlgoDirect:ConvAsm1x1U,1.33253,0,miopenConvolutionBwdDataAlgoDirect,<unused>;miopenConvolutionBwdDataAlgoWinograd:ConvBinWinogradRxSf3x2,3.68568,0,miopenConvolutionBwdDataAlgoWinograd,<unused>
128-28-28-3x3-128-28-28-32-1x1-1x1-1x1-0-NCHW-FP32-B=miopenConvolutionBwdDataAlgoWinograd:ConvBinWinograd3x3U,0.254682,0,miopenConvolutionBwdDataAlgoWinograd,<unused>
512-28-28-1x1-128-28-28-32-0x0-1x1-1x1-0-NCHW-FP32-B=miopenConvolutionBwdDataAlgoImplicitGEMM:ConvHipImplicitGemmV4R4Xdlops_1x1,0.133724,0,miopenConvolutionBwdDataAlgoImplicitGEMM,<unused>;miopenConvolutionBwdDataAlgoDirect:ConvAsm1x1U,0.18742,0,miopenConvolutionBwdDataAlgoDirect,<unused>;miopenConvolutionBwdDataAlgoWinograd:ConvBinWinogradRxSf3x2,0.571881,0,miopenConvolutionBwdDataAlgoWinograd,<unused>
128-28-28-3x3-128-56-56-32-1x1-2x2-1x1-0-NCHW-FP32-B=miopenConvolutionBwdDataAlgoImplicitGEMM:ConvHipImplicitGemmBwdDataV1R1Xdlops,0.369479,0,miopenConvolutionBwdDataAlgoImplicitGEMM,<unused>;miopenConvolutionBwdDataAlgoWinograd:ConvBinWinogradRxSf2x3,0.948881,0,miopenConvolutionBwdDataAlgoWinograd,<unused>;miopenConvolutionBwdDataAlgoDirect:ConvOclDirectFwd,1.75834,0,miopenConvolutionBwdDataAlgoDirect,<unused>
256-28-28-1x1-1280-28-28-32-0x0-1x1-1x1-0-NCHW-FP32-B=miopenConvolutionBwdDataAlgoImplicitGEMM:ConvHipImplicitGemmV4R4Xdlops_1x1,0.571919,0,miopenConvolutionBwdDataAlgoImplicitGEMM,<unused>;miopenConvolutionBwdDataAlgoDirect:ConvAsm1x1U,0.809222,0,miopenConvolutionBwdDataAlgoDirect,<unused>;miopenConvolutionBwdDataAlgoWinograd:ConvBinWinogradRxSf3x2,2.3145,0,miopenConvolutionBwdDataAlgoWinograd,<unused>
256-1-1-1x1-2048-1-1-32-0x0-1x1-1x1-0-NCHW-FP32-B=miopenConvolutionBwdDataAlgoImplicitGEMM:ConvHipImplicitGemmV4R4Xdlops_1x1,0.015926,0,miopenConvolutionBwdDataAlgoImplicitGEMM,<unused>;miopenConvolutionBwdDataAlgoDirect:ConvAsm1x1U,0.040732,0,miopenConvolutionBwdDataAlgoDirect,<unused>;miopenConvolutionBwdDataAlgoWinograd:ConvBinWinogradRxSf2x3,0.091696,0,miopenConvolutionBwdDataAlgoWinograd,<unused>
256-28-28-1x1-2048-28-28-32-0x0-1x1-1x1-0-NCHW-FP32-B=miopenConvolutionBwdDataAlgoImplicitGEMM:ConvHipImplicitGemmV4R4Xdlops_1x1,0.934238,0,miopenConvolutionBwdDataAlgoImplicitGEMM,<unused>;miopenConvolutionBwdDataAlgoDirect:ConvAsm1x1U,1.29563,0,miopenConvolutionBwdDataAlgoDirect,<unused>;miopenConvolutionBwdDataAlgoWinograd:ConvBinWinogradRxSf3x2,3.84563,0,miopenConvolutionBwdDataAlgoWinograd,<unused>
256-28-28-3x3-2048-28-28-32-12x12-1x1-12x12-0-NCHW-FP32-B=miopenConvolutionBwdDataAlgoImplicitGEMM:ConvHipImplicitGemmBwdDataV1R1Xdlops,6.62636,0,miopenConvolutionBwdDataAlgoImplicitGEMM,<unused>
256-28-28-3x3-2048-28-28-32-24x24-1x1-24x24-0-NCHW-FP32-B=miopenConvolutionBwdDataAlgoImplicitGEMM:ConvHipImplicitGemmBwdDataV1R1Xdlops,6.52115,0,miopenConvolutionBwdDataAlgoImplicitGEMM,<unused>
256-28-28-3x3-2048-28-28-32-36x36-1x1-36x36-0-NCHW-FP32-B=miopenConvolutionBwdDataAlgoImplicitGEMM:ConvHipImplicitGemmBwdDataV1R1Xdlops,6.39918,0,miopenConvolutionBwdDataAlgoImplicitGEMM,<unused>
512-28-28-1x1-2048-28-28-32-0x0-1x1-1x1-0-NCHW-FP32-B=miopenConvolutionBwdDataAlgoImplicitGEMM:ConvHipImplicitGemmV4R4Xdlops_1x1,1.69293,0,miopenConvolutionBwdDataAlgoImplicitGEMM,<unused>;miopenConvolutionBwdDataAlgoDirect:ConvAsm1x1U,2.66435,0,miopenConvolutionBwdDataAlgoDirect,<unused>;miopenConvolutionBwdDataAlgoWinograd:ConvBinWinogradRxSf3x2,7.52973,0,miopenConvolutionBwdDataAlgoWinograd,<unused>
1024-28-28-1x1-256-28-28-32-0x0-1x1-1x1-0-NCHW-FP32-B=miopenConvolutionBwdDataAlgoImplicitGEMM:ConvHipImplicitGemmV4R4Xdlops_1x1,0.455197,0,miopenConvolutionBwdDataAlgoImplicitGEMM,<unused>;miopenConvolutionBwdDataAlgoDirect:ConvAsm1x1U,0.715703,0,miopenConvolutionBwdDataAlgoDirect,<unused>;miopenConvolutionBwdDataAlgoWinograd:ConvBinWinogradRxSf3x2,1.77108,0,miopenConvolutionBwdDataAlgoWinograd,<unused>
21-28-28-1x1-256-28-28-32-0x0-1x1-1x1-0-NCHW-FP32-B=miopenConvolutionBwdDataAlgoDirect:ConvAsm1x1U,0.041703,0,miopenConvolutionBwdDataAlgoDirect,<unused>;miopenConvolutionBwdDataAlgoWinograd:ConvBinWinogradRxSf2x3,0.123857,0,miopenConvolutionBwdDataAlgoWinograd,<unused>
256-28-28-3x3-256-28-28-32-1x1-1x1-1x1-0-NCHW-FP32-B=miopenConvolutionBwdDataAlgoWinograd:ConvBinWinogradRxSf2x3,0.900389,0,miopenConvolutionBwdDataAlgoWinograd,<unused>
256-28-28-3x3-256-28-28-32-2x2-1x1-2x2-0-NCHW-FP32-B=miopenConvolutionBwdDataAlgoImplicitGEMM:ConvHipImplicitGemmBwdDataV1R1Xdlops,0.831479,0,miopenConvolutionBwdDataAlgoImplicitGEMM,<unused>
64-56-56-1x1-256-56-56-32-0x0-1x1-1x1-0-NCHW-FP32-B=miopenConvolutionBwdDataAlgoDirect:ConvAsm1x1U,0.185265,0,miopenConvolutionBwdDataAlgoDirect,<unused>;miopenConvolutionBwdDataAlgoImplicitGEMM:ConvHipImplicitGemmV4R4Xdlops_1x1,0.189376,0,miopenConvolutionBwdDataAlgoImplicitGEMM,<unused>;miopenConvolutionBwdDataAlgoWinograd:ConvBinWinogradRxSf3x2,0.558186,0,miopenConvolutionBwdDataAlgoWinograd,<unused>
128-28-28-1x1-512-28-28-32-0x0-1x1-1x1-0-NCHW-FP32-B=miopenConvolutionBwdDataAlgoImplicitGEMM:ConvHipImplicitGemmV4R4Xdlops_1x1,0.152668,0,miopenConvolutionBwdDataAlgoImplicitGEMM,<unused>;miopenConvolutionBwdDataAlgoDirect:ConvAsm1x1U,0.184749,0,miopenConvolutionBwdDataAlgoDirect,<unused>;miopenConvolutionBwdDataAlgoWinograd:ConvBinWinogradRxSf3x2,0.564762,0,miopenConvolutionBwdDataAlgoWinograd,<unused>
2048-28-28-1x1-512-28-28-32-0x0-1x1-1x1-0-NCHW-FP32-B=miopenConvolutionBwdDataAlgoImplicitGEMM:ConvHipImplicitGemmV4R4Xdlops_1x1,1.76114,0,miopenConvolutionBwdDataAlgoImplicitGEMM,<unused>;miopenConvolutionBwdDataAlgoDirect:ConvAsm1x1U,2.6606,0,miopenConvolutionBwdDataAlgoDirect,<unused>;miopenConvolutionBwdDataAlgoWinograd:ConvBinWinogradRxSf3x2,7.59186,0,miopenConvolutionBwdDataAlgoWinograd,<unused>
512-28-28-3x3-512-28-28-32-2x2-1x1-2x2-0-NCHW-FP32-B=miopenConvolutionBwdDataAlgoImplicitGEMM:ConvHipImplicitGemmBwdDataV1R1Xdlops,3.35482,0,miopenConvolutionBwdDataAlgoImplicitGEMM,<unused>
512-28-28-3x3-512-28-28-32-4x4-1x1-4x4-0-NCHW-FP32-B=miopenConvolutionBwdDataAlgoImplicitGEMM:ConvHipImplicitGemmBwdDataV1R1Xdlops,2.99923,0,miopenConvolutionBwdDataAlgoImplicitGEMM,<unused>
64-56-56-1x1-64-56-56-32-0x0-1x1-1x1-0-NCHW-FP32-B=miopenConvolutionBwdDataAlgoDirect:ConvAsm1x1U,0.059594,0,miopenConvolutionBwdDataAlgoDirect,<unused>;miopenConvolutionBwdDataAlgoImplicitGEMM:ConvHipImplicitGemmV4R4Xdlops_1x1,0.075352,0,miopenConvolutionBwdDataAlgoImplicitGEMM,<unused>;miopenConvolutionBwdDataAlgoWinograd:ConvBinWinogradRxSf3x2,0.178487,0,miopenConvolutionBwdDataAlgoWinograd,<unused>
64-56-56-3x3-64-56-56-32-1x1-1x1-1x1-0-NCHW-FP32-B=miopenConvolutionBwdDataAlgoWinograd:ConvBinWinogradRxSf2x3,0.264629,0,miopenConvolutionBwdDataAlgoWinograd,<unused>
2048-7-7-1x1-1024-14-14-128-0x0-2x2-1x1-0-NCHW-FP16-B=miopenConvolutionBwdDataAlgoImplicitGEMM:ConvHipImplicitGemmBwdDataV1R1Xdlops,1.07979,102760448,miopenConvolutionBwdDataAlgoImplicitGEMM,<unused>;miopenConvolutionBwdDataAlgoDirect:ConvAsm1x1U,1.61325,12845056,miopenConvolutionBwdDataAlgoDirect,<unused>;miopenConvolutionBwdDataAlgoWinograd:ConvBinWinogradRxS,12.882,0,miopenConvolutionBwdDataAlgoWinograd,<unused>
256-14-14-1x1-1024-14-14-128-0x0-1x1-1x1-0-NCHW-FP16-B=miopenConvolutionBwdDataAlgoDirect:ConvAsm1x1U,0.549392,0,miopenConvolutionBwdDataAlgoDirect,<unused>;miopenConvolutionBwdDataAlgoImplicitGEMM:ConvHipImplicitGemmBwdDataV1R1Xdlops,0.633708,102760448,miopenConvolutionBwdDataAlgoImplicitGEMM,<unused>;miopenConvolutionBwdDataAlgoWinograd:ConvBinWinogradRxS,2.28479,0,miopenConvolutionBwdDataAlgoWinograd,<unused>
512-7-7-1x1-1024-14-14-128-0x0-2x2-1x1-0-NCHW-FP16-B=miopenConvolutionBwdDataAlgoDirect:ConvAsm1x1U,0.586476,12845056,miopenConvolutionBwdDataAlgoDirect,<unused>;miopenConvolutionBwdDataAlgoImplicitGEMM:ConvHipImplicitGemmBwdDataV1R1Xdlops,0.733419,102760448,miopenConvolutionBwdDataAlgoImplicitGEMM,<unused>;miopenConvolutionBwdDataAlgoWinograd:ConvBinWinogradRxS,3.18757,0,miopenConvolutionBwdDataAlgoWinograd,<unused>
128-28-28-3x3-128-28-28-128-1x1-1x1-1x1-0-NCHW-FP16-B=miopenConvolutionBwdDataAlgoWinograd:ConvBinWinogradRxS,0.574337,0,miopenConvolutionBwdDataAlgoWinograd,<unused>;miopenConvolutionBwdDataAlgoDirect:ConvOclDirectFwd,2.2689,0,miopenConvolutionBwdDataAlgoDirect,<unused>;miopenConvolutionBwdDataAlgoImplicitGEMM:ConvHipImplicitGemmBwdDataV1R1Xdlops,2.42118,51380224,miopenConvolutionBwdDataAlgoImplicitGEMM,<unused>
512-28-28-1x1-128-28-28-128-0x0-1x1-1x1-0-NCHW-FP16-B=miopenConvolutionBwdDataAlgoImplicitGEMM:ConvHipImplicitGemmBwdDataV1R1Xdlops,0.379702,51380224,miopenConvolutionBwdDataAlgoImplicitGEMM,<unused>;miopenConvolutionBwdDataAlgoDirect:ConvAsm1x1U,0.494882,0,miopenConvolutionBwdDataAlgoDirect,<unused>;miopenConvolutionBwdDataAlgoWinograd:ConvBinWinogradRxS,2.07087,0,miopenConvolutionBwdDataAlgoWinograd,<unused>
512-7-7-1x1-2048-7-7-128-0x0-1x1-1x1-0-NCHW-FP16-B=miopenConvolutionBwdDataAlgoImplicitGEMM:ConvHipImplicitGemmBwdDataV1R1Xdlops,0.520695,51380224,miopenConvolutionBwdDataAlgoImplicitGEMM,<unused>;miopenConvolutionBwdDataAlgoDirect:ConvAsm1x1U,0.709067,0,miopenConvolutionBwdDataAlgoDirect,<unused>;miopenConvolutionBwdDataAlgoWinograd:ConvBinWinogradRxS,3.1985,0,miopenConvolutionBwdDataAlgoWinograd,<unused>
1024-14-14-1x1-256-14-14-128-0x0-1x1-1x1-0-NCHW-FP16-B=miopenConvolutionBwdDataAlgoImplicitGEMM:ConvHipImplicitGemmBwdDataV1R1Xdlops,0.295273,25690112,miopenConvolutionBwdDataAlgoImplicitGEMM,<unused>;miopenConvolutionBwdDataAlgoDirect:ConvAsm1x1U,0.628714,0,miopenConvolutionBwdDataAlgoDirect,<unused>;miopenConvolutionBwdDataAlgoWinograd:ConvBinWinogradRxS,2.40833,0,miopenConvolutionBwdDataAlgoWinograd,<unused>
256-14-14-3x3-256-14-14-128-1x1-1x1-1x1-0-NCHW-FP16-B=miopenConvolutionBwdDataAlgoWinograd:ConvBinWinogradRxS,0.589988,0,miopenConvolutionBwdDataAlgoWinograd,<unused>;miopenConvolutionBwdDataAlgoImplicitGEMM:ConvHipImplicitGemmBwdDataV1R1Xdlops,1.39588,25690112,miopenConvolutionBwdDataAlgoImplicitGEMM,<unused>;miopenConvolutionBwdDataAlgoDirect:ConvOclDirectFwd,2.7173,0,miopenConvolutionBwdDataAlgoDirect,<unused>
128-28-28-1x1-256-56-56-128-0x0-2x2-1x1-0-NCHW-FP16-B=miopenConvolutionBwdDataAlgoDirect:ConvAsm1x1U,0.947314,51380224,miopenConvolutionBwdDataAlgoDirect,<unused>;miopenConvolutionBwdDataAlgoImplicitGEMM:ConvHipImplicitGemmBwdDataV1R1Xdlops,2.13058,411041792,miopenConvolutionBwdDataAlgoImplicitGEMM,<unused>;miopenConvolutionBwdDataAlgoWinograd:ConvBinWinogradRxS,2.40688,0,miopenConvolutionBwdDataAlgoWinograd,<unused>
512-28-28-1x1-256-56-56-128-0x0-2x2-1x1-0-NCHW-FP16-B=miopenConvolutionBwdDataAlgoDirect:ConvAsm1x1U,1.62032,51380224,miopenConvolutionBwdDataAlgoDirect,<unused>;miopenConvolutionBwdDataAlgoImplicitGEMM:ConvHipImplicitGemmBwdDataV1R1Xdlops,2.31912,411041792,miopenConvolutionBwdDataAlgoImplicitGEMM,<unused>;miopenConvolutionBwdDataAlgoWinograd:ConvBinWinogradRxS,9.38077,0,miopenConvolutionBwdDataAlgoWinograd,<unused>
64-56-56-1x1-256-56-56-128-0x0-1x1-1x1-0-NCHW-FP16-B=miopenConvolutionBwdDataAlgoDirect:ConvAsm1x1U,0.596484,0,miopenConvolutionBwdDataAlgoDirect,<unused>;miopenConvolutionBwdDataAlgoImplicitGEMM:ConvHipImplicitGemmBwdDataV1R1Xdlops,2.02353,411041792,miopenConvolutionBwdDataAlgoImplicitGEMM,<unused>;miopenConvolutionBwdDataAlgoWinograd:ConvBinWinogradRxS,2.23214,0,miopenConvolutionBwdDataAlgoWinograd,<unused>
64-112-112-7x7-3-230-230-128-0x0-2x2-1x1-0-NCHW-FP16-B=miopenConvolutionBwdDataAlgoDirect:ConvOclDirectFwd,6.34604,0,miopenConvolutionBwdDataAlgoDirect,<unused>;miopenConvolutionBwdDataAlgoWinograd:ConvBinWinogradRxS,6.83443,0,miopenConvolutionBwdDataAlgoWinograd,<unused>
1024-14-14-1x1-512-28-28-128-0x0-2x2-1x1-0-NCHW-FP16-B=miopenConvolutionBwdDataAlgoImplicitGEMM:ConvHipImplicitGemmBwdDataV1R1Xdlops,1.40669,205520896,miopenConvolutionBwdDataAlgoImplicitGEMM,<unused>;miopenConvolutionBwdDataAlgoDirect:ConvAsm1x1U,1.50136,25690112,miopenConvolutionBwdDataAlgoDirect,<unused>;miopenConvolutionBwdDataAlgoWinograd:ConvBinWinogradRxS,10.2481,0,miopenConvolutionBwdDataAlgoWinograd,<unused>
128-28-28-1x1-512-28-28-128-0x0-1x1-1x1-0-NCHW-FP16-B=miopenConvolutionBwdDataAlgoDirect:ConvAsm1x1U,0.523524,0,miopenConvolutionBwdDataAlgoDirect,<unused>;miopenConvolutionBwdDataAlgoImplicitGEMM:ConvHipImplicitGemmBwdDataV1R1Xdlops,1.0976,205520896,miopenConvolutionBwdDataAlgoImplicitGEMM,<unused>;miopenConvolutionBwdDataAlgoWinograd:ConvBinWinogradRxS,2.0715,0,miopenConvolutionBwdDataAlgoWinograd,<unused>
256-14-14-1x1-512-28-28-128-0x0-2x2-1x1-0-NCHW-FP16-B=miopenConvolutionBwdDataAlgoDirect:ConvAsm1x1U,0.659532,25690112,miopenConvolutionBwdDataAlgoDirect,<unused>;miopenConvolutionBwdDataAlgoImplicitGEMM:ConvHipImplicitGemmBwdDataV1R1Xdlops,1.18632,205520896,miopenConvolutionBwdDataAlgoImplicitGEMM,<unused>;miopenConvolutionBwdDataAlgoWinograd:ConvBinWinogradRxS,2.55788,0,miopenConvolutionBwdDataAlgoWinograd,<unused>
2048-7-7-1x1-512-7-7-128-0x0-1x1-1x1-0-NCHW-FP16-B=miopenConvolutionBwdDataAlgoImplicitGEMM:ConvHipImplicitGemmBwdDataV1R1Xdlops,0.394656,12845056,miopenConvolutionBwdDataAlgoImplicitGEMM,<unused>;miopenConvolutionBwdDataAlgoDirect:ConvAsm1x1U,0.77861,0,miopenConvolutionBwdDataAlgoDirect,<unused>;miopenConvolutionBwdDataAlgoWinograd:ConvBinWinogradRxS,3.26589,0,miopenConvolutionBwdDataAlgoWinograd,<unused>
512-7-7-3x3-512-7-7-128-1x1-1x1-1x1-0-NCHW-FP16-B=miopenConvolutionBwdDataAlgoWinograd:ConvBinWinogradRxS,0.741124,0,miopenConvolutionBwdDataAlgoWinograd,<unused>;miopenConvolutionBwdDataAlgoImplicitGEMM:ConvHipImplicitGemmBwdDataV1R1Xdlops,1.00106,12845056,miopenConvolutionBwdDataAlgoImplicitGEMM,<unused>;miopenConvolutionBwdDataAlgoDirect:ConvOclDirectFwd,5.72574,0,miopenConvolutionBwdDataAlgoDirect,<unused>
256-56-56-1x1-64-56-56-128-0x0-1x1-1x1-0-NCHW-FP16-B=miopenConvolutionBwdDataAlgoDirect:ConvAsm1x1U,0.507877,0,miopenConvolutionBwdDataAlgoDirect,<unused>;miopenConvolutionBwdDataAlgoImplicitGEMM:ConvHipImplicitGemmBwdDataV1R1Xdlops,0.722573,102760448,miopenConvolutionBwdDataAlgoImplicitGEMM,<unused>;miopenConvolutionBwdDataAlgoWinograd:ConvBinWinogradRxS,2.0004,0,miopenConvolutionBwdDataAlgoWinograd,<unused>
64-56-56-1x1-64-56-56-128-0x0-1x1-1x1-0-NCHW-FP16-B=miopenConvolutionBwdDataAlgoDirect:ConvAsm1x1U,0.159464,0,miopenConvolutionBwdDataAlgoDirect,<unused>;miopenConvolutionBwdDataAlgoImplicitGEMM:ConvHipImplicitGemmBwdDataV1R1Xdlops,0.531901,102760448,miopenConvolutionBwdDataAlgoImplicitGEMM,<unused>;miopenConvolutionBwdDataAlgoWinograd:ConvBinWinogradRxS,0.616785,0,miopenConvolutionBwdDataAlgoWinograd,<unused>
64-56-56-3x3-64-56-56-128-1x1-1x1-1x1-0-NCHW-FP16-B=miopenConvolutionBwdDataAlgoWinograd:ConvBinWinogradRxS,0.612058,0,miopenConvolutionBwdDataAlgoWinograd,<unused>;miopenConvolutionBwdDataAlgoDirect:ConvOclDirectFwd,2.56885,0,miopenConvolutionBwdDataAlgoDirect,<unused>;miopenConvolutionBwdDataAlgoImplicitGEMM:ConvHipImplicitGemmBwdDataV1R1Xdlops,4.35069,102760448,miopenConvolutionBwdDataAlgoImplicitGEMM,<unused>
2048-28-28-1x1-1024-28-28-64-0x0-1x1-1x1-0-NCHW-FP16-B=miopenConvolutionBwdDataAlgoImplicitGEMM:ConvHipImplicitGemmBwdDataV1R1Xdlops,3.12449,205520896,miopenConvolutionBwdDataAlgoImplicitGEMM,<unused>;miopenConvolutionBwdDataAlgoDirect:ConvAsm1x1U,7.45564,0,miopenConvolutionBwdDataAlgoDirect,<unused>;miopenConvolutionBwdDataAlgoWinograd:ConvBinWinogradRxS,35.4841,0,miopenConvolutionBwdDataAlgoWinograd,<unused>
256-28-28-1x1-1024-28-28-64-0x0-1x1-1x1-0-NCHW-FP16-B=miopenConvolutionBwdDataAlgoDirect:ConvAsm1x1U,0.917816,0,miopenConvolutionBwdDataAlgoDirect,<unused>;miopenConvolutionBwdDataAlgoImplicitGEMM:ConvHipImplicitGemmBwdDataV1R1Xdlops,1.2128,205520896,miopenConvolutionBwdDataAlgoImplicitGEMM,<unused>;miopenConvolutionBwdDataAlgoWinograd:ConvBinWinogradRxS,4.1807,0,miopenConvolutionBwdDataAlgoWinograd,<unused>
512-28-28-1x1-1024-28-28-64-0x0-1x1-1x1-0-NCHW-FP16-B=miopenConvolutionBwdDataAlgoImplicitGEMM:ConvHipImplicitGemmBwdDataV1R1Xdlops,1.49692,205520896,miopenConvolutionBwdDataAlgoImplicitGEMM,<unused>;miopenConvolutionBwdDataAlgoDirect:ConvAsm1x1U,1.78162,0,miopenConvolutionBwdDataAlgoDirect,<unused>;miopenConvolutionBwdDataAlgoWinograd:ConvBinWinogradRxS,8.6433,0,miopenConvolutionBwdDataAlgoWinograd,<unused>
128-28-28-3x3-128-28-28-64-1x1-1x1-1x1-0-NCHW-FP16-B=miopenConvolutionBwdDataAlgoWinograd:ConvBinWinogradRxS,0.316844,0,miopenConvolutionBwdDataAlgoWinograd,<unused>;miopenConvolutionBwdDataAlgoImplicitGEMM:ConvHipImplicitGemmBwdDataV1R1Xdlops,1.22336,25690112,miopenConvolutionBwdDataAlgoImplicitGEMM,<unused>;miopenConvolutionBwdDataAlgoDirect:ConvOclDirectFwd,1.22799,0,miopenConvolutionBwdDataAlgoDirect,<unused>
512-28-28-1x1-128-28-28-64-0x0-1x1-1x1-0-NCHW-FP16-B=miopenConvolutionBwdDataAlgoImplicitGEMM:ConvHipImplicitGemmBwdDataV1R1Xdlops,0.20415,25690112,miopenConvolutionBwdDataAlgoImplicitGEMM,<unused>;miopenConvolutionBwdDataAlgoDirect:ConvAsm1x1U,0.270976,0,miopenConvolutionBwdDataAlgoDirect,<unused>;miopenConvolutionBwdDataAlgoWinograd:ConvBinWinogradRxS,1.16427,0,miopenConvolutionBwdDataAlgoWinograd,<unused>
128-28-28-3x3-128-56-56-64-1x1-2x2-1x1-0-NCHW-FP16-B=miopenConvolutionBwdDataAlgoWinograd:ConvBinWinogradRxS,1.21327,0,miopenConvolutionBwdDataAlgoWinograd,<unused>;miopenConvolutionBwdDataAlgoImplicitGEMM:ConvHipImplicitGemmBwdDataV1R1Xdlops,1.57598,102760448,miopenConvolutionBwdDataAlgoImplicitGEMM,<unused>;miopenConvolutionBwdDataAlgoDirect:ConvOclDirectFwd,3.74711,0,miopenConvolutionBwdDataAlgoDirect,<unused>
256-28-28-1x1-1280-28-28-64-0x0-1x1-1x1-0-NCHW-FP16-B=miopenConvolutionBwdDataAlgoDirect:ConvAsm1x1U,1.12642,0,miopenConvolutionBwdDataAlgoDirect,<unused>;miopenConvolutionBwdDataAlgoImplicitGEMM:ConvHipImplicitGemmBwdDataV1R1Xdlops,1.49933,256901120,miopenConvolutionBwdDataAlgoImplicitGEMM,<unused>;miopenConvolutionBwdDataAlgoWinograd:ConvBinWinogradRxS,5.26722,0,miopenConvolutionBwdDataAlgoWinograd,<unused>
256-1-1-1x1-2048-1-1-64-0x0-1x1-1x1-0-NCHW-FP16-B=miopenConvolutionBwdDataAlgoImplicitGEMM:ConvHipImplicitGemmBwdDataV1R1Xdlops,0.05493,524288,miopenConvolutionBwdDataAlgoImplicitGEMM,<unused>;miopenConvolutionBwdDataAlgoWinograd:ConvBinWinogradRxS,0.136668,0,miopenConvolutionBwdDataAlgoWinograd,<unused>
256-28-28-1x1-2048-28-28-64-0x0-1x1-1x1-0-NCHW-FP16-B=miopenConvolutionBwdDataAlgoDirect:ConvAsm1x1U,1.76371,0,miopenConvolutionBwdDataAlgoDirect,<unused>;miopenConvolutionBwdDataAlgoImplicitGEMM:ConvHipImplicitGemmBwdDataV1R1Xdlops,2.41002,411041792,miopenConvolutionBwdDataAlgoImplicitGEMM,<unused>;miopenConvolutionBwdDataAlgoWinograd:ConvBinWinogradRxS,8.63137,0,miopenConvolutionBwdDataAlgoWinograd,<unused>
256-28-28-3x3-2048-28-28-64-12x12-1x1-12x12-0-NCHW-FP16-B=miopenConvolutionBwdDataAlgoImplicitGEMM:ConvHipImplicitGemmBwdDataV1R1Xdlops,17.9783,411041792,miopenConvolutionBwdDataAlgoImplicitGEMM,<unused>
256-28-28-3x3-2048-28-28-64-24x24-1x1-24x24-0-NCHW-FP16-B=miopenConvolutionBwdDataAlgoImplicitGEMM:ConvHipImplicitGemmBwdDataV1R1Xdlops,14.7064,411041792,miopenConvolutionBwdDataAlgoImplicitGEMM,<unused>
256-28-28-3x3-2048-28-28-64-36x36-1x1-36x36-0-NCHW-FP16-B=miopenConvolutionBwdDataAlgoImplicitGEMM:ConvHipImplicitGemmBwdDataV1R1Xdlops,9.65774,411041792,miopenConvolutionBwdDataAlgoImplicitGEMM,<unused>
512-28-28-1x1-2048-28-28-64-0x0-1x1-1x1-0-NCHW-FP16-B=miopenConvolutionBwdDataAlgoImplicitGEMM:ConvHipImplicitGemmBwdDataV1R1Xdlops,3.00222,411041792,miopenConvolutionBwdDataAlgoImplicitGEMM,<unused>;miopenConvolutionBwdDataAlgoDirect:ConvAsm1x1U,3.48312,0,miopenConvolutionBwdDataAlgoDirect,<unused>;miopenConvolutionBwdDataAlgoWinograd:ConvBinWinogradRxS,17.6365,0,miopenConvolutionBwdDataAlgoWinograd,<unused>
1024-28-28-1x1-256-28-28-64-0x0-1x1-1x1-0-NCHW-FP16-B=miopenConvolutionBwdDataAlgoImplicitGEMM:ConvHipImplicitGemmBwdDataV1R1Xdlops,0.510512,51380224,miopenConvolutionBwdDataAlgoImplicitGEMM,<unused>;miopenConvolutionBwdDataAlgoDirect:ConvAsm1x1U,0.955981,0,miopenConvolutionBwdDataAlgoDirect,<unused>;miopenConvolutionBwdDataAlgoWinograd:ConvBinWinogradRxS,4.37806,0,miopenConvolutionBwdDataAlgoWinograd,<unused>
256-28-28-3x3-256-28-28-64-1x1-1x1-1x1-0-NCHW-FP16-B=miopenConvolutionBwdDataAlgoWinograd:ConvBinWinogradRxS,1.08271,0,miopenConvolutionBwdDataAlgoWinograd,<unused>;miopenConvolutionBwdDataAlgoImplicitGEMM:ConvHipImplicitGemmBwdDataV1R1Xdlops,2.68001,51380224,miopenConvolutionBwdDataAlgoImplicitGEMM,<unused>;miopenConvolutionBwdDataAlgoDirect:ConvOclDirectFwd,4.52627,0,miopenConvolutionBwdDataAlgoDirect,<unused>
256-28-28-3x3-256-28-28-64-2x2-1x1-2x2-0-NCHW-FP16-B=miopenConvolutionBwdDataAlgoImplicitGEMM:ConvHipImplicitGemmBwdDataV1R1Xdlops,2.62654,51380224,miopenConvolutionBwdDataAlgoImplicitGEMM,<unused>
128-56-56-1x1-256-56-56-64-0x0-1x1-1x1-0-NCHW-FP16-B=miopenConvolutionBwdDataAlgoDirect:ConvAsm1x1U,0.511566,0,miopenConvolutionBwdDataAlgoDirect,<unused>;miopenConvolutionBwdDataAlgoImplicitGEMM:ConvHipImplicitGemmBwdDataV1R1Xdlops,1.0757,205520896,miopenConvolutionBwdDataAlgoImplicitGEMM,<unused>;miopenConvolutionBwdDataAlgoWinograd:ConvBinWinogradRxS,2.0107,0,miopenConvolutionBwdDataAlgoWinograd,<unused>
512-28-28-1x1-256-56-56-64-0x0-2x2-1x1-0-NCHW-FP16-B=miopenConvolutionBwdDataAlgoDirect:ConvAsm1x1U,0.820196,25690112,miopenConvolutionBwdDataAlgoDirect,<unused>;miopenConvolutionBwdDataAlgoImplicitGEMM:ConvHipImplicitGemmBwdDataV1R1Xdlops,1.16827,205520896,miopenConvolutionBwdDataAlgoImplicitGEMM,<unused>;miopenConvolutionBwdDataAlgoWinograd:ConvBinWinogradRxS,4.56795,0,miopenConvolutionBwdDataAlgoWinograd,<unused>
64-56-56-1x1-256-56-56-64-0x0-1x1-1x1-0-NCHW-FP16-B=miopenConvolutionBwdDataAlgoDirect:ConvAsm1x1U,0.304966,0,miopenConvolutionBwdDataAlgoDirect,<unused>;miopenConvolutionBwdDataAlgoImplicitGEMM:ConvHipImplicitGemmBwdDataV1R1Xdlops,1.00783,205520896,miopenConvolutionBwdDataAlgoImplicitGEMM,<unused>;miopenConvolutionBwdDataAlgoWinograd:ConvBinWinogradRxS,1.1557,0,miopenConvolutionBwdDataAlgoWinograd,<unused>
64-112-112-7x7-3-224-224-64-3x3-2x2-1x1-0-NCHW-FP16-B=miopenConvolutionBwdDataAlgoDirect:ConvOclDirectFwd,2.84427,0,miopenConvolutionBwdDataAlgoDirect,<unused>;miopenConvolutionBwdDataAlgoWinograd:ConvBinWinogradRxS,3.19883,0,miopenConvolutionBwdDataAlgoWinograd,<unused>
1024-28-28-1x1-512-28-28-64-0x0-1x1-1x1-0-NCHW-FP16-B=miopenConvolutionBwdDataAlgoImplicitGEMM:ConvHipImplicitGemmBwdDataV1R1Xdlops,1.01991,102760448,miopenConvolutionBwdDataAlgoImplicitGEMM,<unused>;miopenConvolutionBwdDataAlgoDirect:ConvAsm1x1U,1.85559,0,miopenConvolutionBwdDataAlgoDirect,<unused>;miopenConvolutionBwdDataAlgoWinograd:ConvBinWinogradRxS,8.65961,0,miopenConvolutionBwdDataAlgoWinograd,<unused>
128-28-28-1x1-512-28-28-64-0x0-1x1-1x1-0-NCHW-FP16-B=miopenConvolutionBwdDataAlgoDirect:ConvAsm1x1U,0.271911,0,miopenConvolutionBwdDataAlgoDirect,<unused>;miopenConvolutionBwdDataAlgoImplicitGEMM:ConvHipImplicitGemmBwdDataV1R1Xdlops,0.556568,102760448,miopenConvolutionBwdDataAlgoImplicitGEMM,<unused>;miopenConvolutionBwdDataAlgoWinograd:ConvBinWinogradRxS,1.10146,0,miopenConvolutionBwdDataAlgoWinograd,<unused>
2048-28-28-1x1-512-28-28-64-0x0-1x1-1x1-0-NCHW-FP16-B=miopenConvolutionBwdDataAlgoImplicitGEMM:ConvHipImplicitGemmBwdDataV1R1Xdlops,1.54961,102760448,miopenConvolutionBwdDataAlgoImplicitGEMM,<unused>;miopenConvolutionBwdDataAlgoDirect:ConvAsm1x1U,3.78904,0,miopenConvolutionBwdDataAlgoDirect,<unused>;miopenConvolutionBwdDataAlgoWinograd:ConvBinWinogradRxS,17.7306,0,miopenConvolutionBwdDataAlgoWinograd,<unused>
256-28-28-1x1-512-28-28-64-0x0-1x1-1x1-0-NCHW-FP16-B=miopenConvolutionBwdDataAlgoDirect:ConvAsm1x1U,0.486241,0,miopenConvolutionBwdDataAlgoDirect,<unused>;miopenConvolutionBwdDataAlgoImplicitGEMM:ConvHipImplicitGemmBwdDataV1R1Xdlops,0.613527,102760448,miopenConvolutionBwdDataAlgoImplicitGEMM,<unused>;miopenConvolutionBwdDataAlgoWinograd:ConvBinWinogradRxS,2.09026,0,miopenConvolutionBwdDataAlgoWinograd,<unused>
512-28-28-3x3-512-28-28-64-2x2-1x1-2x2-0-NCHW-FP16-B=miopenConvolutionBwdDataAlgoImplicitGEMM:ConvHipImplicitGemmBwdDataV1R1Xdlops,6.26972,102760448,miopenConvolutionBwdDataAlgoImplicitGEMM,<unused>
512-28-28-3x3-512-28-28-64-4x4-1x1-4x4-0-NCHW-FP16-B=miopenConvolutionBwdDataAlgoImplicitGEMM:ConvHipImplicitGemmBwdDataV1R1Xdlops,5.98889,102760448,miopenConvolutionBwdDataAlgoImplicitGEMM,<unused>
256-56-56-1x1-64-56-56-64-0x0-1x1-1x1-0-NCHW-FP16-B=miopenConvolutionBwdDataAlgoDirect:ConvAsm1x1U,0.263508,0,miopenConvolutionBwdDataAlgoDirect,<unused>;miopenConvolutionBwdDataAlgoImplicitGEMM:ConvHipImplicitGemmBwdDataV1R1Xdlops,0.364573,51380224,miopenConvolutionBwdDataAlgoImplicitGEMM,<unused>;miopenConvolutionBwdDataAlgoWinograd:ConvBinWinogradRxS,1.07965,0,miopenConvolutionBwdDataAlgoWinograd,<unused>
64-56-56-1x1-64-56-56-64-0x0-1x1-1x1-0-NCHW-FP16-B=miopenConvolutionBwdDataAlgoDirect:ConvAsm1x1U,0.085559,0,miopenConvolutionBwdDataAlgoDirect,<unused>;miopenConvolutionBwdDataAlgoImplicitGEMM:ConvHipImplicitGemmBwdDataV1R1Xdlops,0.27527,51380224,miopenConvolutionBwdDataAlgoImplicitGEMM,<unused>;miopenConvolutionBwdDataAlgoWinograd:ConvBinWinogradRxS,0.326368,0,miopenConvolutionBwdDataAlgoWinograd,<unused>
64-56-56-3x3-64-56-56-64-1x1-1x1-1x1-0-NCHW-FP16-B=miopenConvolutionBwdDataAlgoWinograd:ConvBinWinogradRxS,0.322339,0,miopenConvolutionBwdDataAlgoWinograd,<unused>;miopenConvolutionBwdDataAlgoDirect:ConvOclDirectFwd,1.34957,0,miopenConvolutionBwdDataAlgoDirect,<unused>;miopenConvolutionBwdDataAlgoImplicitGEMM:ConvHipImplicitGemmBwdDataV1R1Xdlops,2.28244,51380224,miopenConvolutionBwdDataAlgoImplicitGEMM,<unused>
2048-28-28-1x1-1024-28-28-32-0x0-1x1-1x1-0-NCHW-FP16-B=miopenConvolutionBwdDataAlgoImplicitGEMM:ConvHipImplicitGemmBwdDataV1R1Xdlops,1.6109,102760448,miopenConvolutionBwdDataAlgoImplicitGEMM,<unused>;miopenConvolutionBwdDataAlgoDirect:ConvAsm1x1U,3.77968,0,miopenConvolutionBwdDataAlgoDirect,<unused>;miopenConvolutionBwdDataAlgoWinograd:ConvBinWinogradRxS,18.409,0,miopenConvolutionBwdDataAlgoWinograd,<unused>
256-28-28-1x1-1024-28-28-32-0x0-1x1-1x1-0-NCHW-FP16-B=miopenConvolutionBwdDataAlgoDirect:ConvAsm1x1U,0.480932,0,miopenConvolutionBwdDataAlgoDirect,<unused>;miopenConvolutionBwdDataAlgoImplicitGEMM:ConvHipImplicitGemmBwdDataV1R1Xdlops,0.617587,102760448,miopenConvolutionBwdDataAlgoImplicitGEMM,<unused>;miopenConvolutionBwdDataAlgoWinograd:ConvBinWinogradRxS,2.18071,0,miopenConvolutionBwdDataAlgoWinograd,<unused>
512-28-28-1x1-1024-28-28-32-0x0-1x1-1x1-0-NCHW-FP16-B=miopenConvolutionBwdDataAlgoImplicitGEMM:ConvHipImplicitGemmBwdDataV1R1Xdlops,0.769253,102760448,miopenConvolutionBwdDataAlgoImplicitGEMM,<unused>;miopenConvolutionBwdDataAlgoDirect:ConvAsm1x1U,0.921307,0,miopenConvolutionBwdDataAlgoDirect,<unused>;miopenConvolutionBwdDataAlgoWinograd:ConvBinWinogradRxS,4.42184,0,miopenConvolutionBwdDataAlgoWinograd,<unused>
128-28-28-3x3-128-28-28-32-1x1-1x1-1x1-0-NCHW-FP16-B=miopenConvolutionBwdDataAlgoWinograd:ConvBinWinogradRxS,0.175046,0,miopenConvolutionBwdDataAlgoWinograd,<unused>;miopenConvolutionBwdDataAlgoImplicitGEMM:ConvHipImplicitGemmBwdDataV1R1Xdlops,0.651196,12845056,miopenConvolutionBwdDataAlgoImplicitGEMM,<unused>;miopenConvolutionBwdDataAlgoDirect:ConvOclDirectFwd,0.704543,0,miopenConvolutionBwdDataAlgoDirect,<unused>
512-28-28-1x1-128-28-28-32-0x0-1x1-1x1-0-NCHW-FP16-B=miopenConvolutionBwdDataAlgoImplicitGEMM:ConvHipImplicitGemmBwdDataV1R1Xdlops,0.115543,12845056,miopenConvolutionBwdDataAlgoImplicitGEMM,<unused>;miopenConvolutionBwdDataAlgoDirect:ConvAsm1x1U,0.156918,0,miopenConvolutionBwdDataAlgoDirect,<unused>;miopenConvolutionBwdDataAlgoWinograd:ConvBinWinogradRxS,0.641155,0,miopenConvolutionBwdDataAlgoWinograd,<unused>
128-28-28-3x3-128-56-56-32-1x1-2x2-1x1-0-NCHW-FP16-B=miopenConvolutionBwdDataAlgoWinograd:ConvBinWinogradRxS,0.624026,0,miopenConvolutionBwdDataAlgoWinograd,<unused>;miopenConvolutionBwdDataAlgoImplicitGEMM:ConvHipImplicitGemmBwdDataV1R1Xdlops,0.797919,51380224,miopenConvolutionBwdDataAlgoImplicitGEMM,<unused>;miopenConvolutionBwdDataAlgoDirect:ConvOclDirectFwd,1.9845,0,miopenConvolutionBwdDataAlgoDirect,<unused>
256-28-28-1x1-1280-28-28-32-0x0-1x1-1x1-0-NCHW-FP16-B=miopenConvolutionBwdDataAlgoDirect:ConvAsm1x1U,0.584018,0,miopenConvolutionBwdDataAlgoDirect,<unused>;miopenConvolutionBwdDataAlgoImplicitGEMM:ConvHipImplicitGemmBwdDataV1R1Xdlops,0.76114,128450560,miopenConvolutionBwdDataAlgoImplicitGEMM,<unused>;miopenConvolutionBwdDataAlgoWinograd:ConvBinWinogradRxS,2.67612,0,miopenConvolutionBwdDataAlgoWinograd,<unused>
256-1-1-1x1-2048-1-1-32-0x0-1x1-1x1-0-NCHW-FP16-B=miopenConvolutionBwdDataAlgoImplicitGEMM:ConvHipImplicitGemmBwdDataV1R1Xdlops,0.03633,262144,miopenConvolutionBwdDataAlgoImplicitGEMM,<unused>;miopenConvolutionBwdDataAlgoWinograd:ConvBinWinogradRxS,0.090199,0,miopenConvolutionBwdDataAlgoWinograd,<unused>
256-28-28-1x1-2048-28-28-32-0x0-1x1-1x1-0-NCHW-FP16-B=miopenConvolutionBwdDataAlgoDirect:ConvAsm1x1U,0.901886,0,miopenConvolutionBwdDataAlgoDirect,<unused>;miopenConvolutionBwdDataAlgoImplicitGEMM:ConvHipImplicitGemmBwdDataV1R1Xdlops,1.21232,205520896,miopenConvolutionBwdDataAlgoImplicitGEMM,<unused>;miopenConvolutionBwdDataAlgoWinograd:ConvBinWinogradRxS,4.33136,0,miopenConvolutionBwdDataAlgoWinograd,<unused>
256-28-28-3x3-2048-28-28-32-12x12-1x1-12x12-0-NCHW-FP16-B=miopenConvolutionBwdDataAlgoImplicitGEMM:ConvHipImplicitGemmBwdDataV1R1Xdlops,8.95411,205520896,miopenConvolutionBwdDataAlgoImplicitGEMM,<unused>
256-28-28-3x3-2048-28-28-32-24x24-1x1-24x24-0-NCHW-FP16-B=miopenConvolutionBwdDataAlgoImplicitGEMM:ConvHipImplicitGemmBwdDataV1R1Xdlops,7.31076,205520896,miopenConvolutionBwdDataAlgoImplicitGEMM,<unused>
256-28-28-3x3-2048-28-28-32-36x36-1x1-36x36-0-NCHW-FP16-B=miopenConvolutionBwdDataAlgoImplicitGEMM:ConvHipImplicitGemmBwdDataV1R1Xdlops,4.74804,205520896,miopenConvolutionBwdDataAlgoImplicitGEMM,<unused>
512-28-28-1x1-2048-28-28-32-0x0-1x1-1x1-0-NCHW-FP16-B=miopenConvolutionBwdDataAlgoImplicitGEMM:ConvHipImplicitGemmBwdDataV1R1Xdlops,1.51116,205520896,miopenConvolutionBwdDataAlgoImplicitGEMM,<unused>;miopenConvolutionBwdDataAlgoDirect:ConvAsm1x1U,1.76002,0,miopenConvolutionBwdDataAlgoDirect,<unused>;miopenConvolutionBwdDataAlgoWinograd:ConvBinWinogradRxS,8.97799,0,miopenConvolutionBwdDataAlgoWinograd,<unused>
1024-28-28-1x1-256-28-28-32-0x0-1x1-1x1-0-NCHW-FP16-B=miopenConvolutionBwdDataAlgoImplicitGEMM:ConvHipImplicitGemmBwdDataV1R1Xdlops,0.293367,25690112,miopenConvolutionBwdDataAlgoImplicitGEMM,<unused>;miopenConvolutionBwdDataAlgoDirect:ConvAsm1x1U,0.514889,0,miopenConvolutionBwdDataAlgoDirect,<unused>;miopenConvolutionBwdDataAlgoWinograd:ConvBinWinogradRxS,2.3626,0,miopenConvolutionBwdDataAlgoWinograd,<unused>
256-28-28-3x3-256-28-28-32-1x1-1x1-1x1-0-NCHW-FP16-B=miopenConvolutionBwdDataAlgoWinograd:ConvBinWinogradRxS,0.585449,0,miopenConvolutionBwdDataAlgoWinograd,<unused>;miopenConvolutionBwdDataAlgoImplicitGEMM:ConvHipImplicitGemmBwdDataV1R1Xdlops,1.36246,25690112,miopenConvolutionBwdDataAlgoImplicitGEMM,<unused>;miopenConvolutionBwdDataAlgoDirect:ConvOclDirectFwd,2.45017,0,miopenConvolutionBwdDataAlgoDirect,<unused>
256-28-28-3x3-256-28-28-32-2x2-1x1-2x2-0-NCHW-FP16-B=miopenConvolutionBwdDataAlgoImplicitGEMM:ConvHipImplicitGemmBwdDataV1R1Xdlops,1.34179,25690112,miopenConvolutionBwdDataAlgoImplicitGEMM,<unused>
128-56-56-1x1-256-56-56-32-0x0-1x1-1x1-0-NCHW-FP16-B=miopenConvolutionBwdDataAlgoDirect:ConvAsm1x1U,0.26713,0,miopenConvolutionBwdDataAlgoDirect,<unused>;miopenConvolutionBwdDataAlgoImplicitGEMM:ConvHipImplicitGemmBwdDataV1R1Xdlops,0.542977,102760448,miopenConvolutionBwdDataAlgoImplicitGEMM,<unused>;miopenConvolutionBwdDataAlgoWinograd:ConvBinWinogradRxS,1.07469,0,miopenConvolutionBwdDataAlgoWinograd,<unused>
64-56-56-1x1-256-56-56-32-0x0-1x1-1x1-0-NCHW-FP16-B=miopenConvolutionBwdDataAlgoDirect:ConvAsm1x1U,0.151726,0,miopenConvolutionBwdDataAlgoDirect,<unused>;miopenConvolutionBwdDataAlgoImplicitGEMM:ConvHipImplicitGemmBwdDataV1R1Xdlops,0.511973,102760448,miopenConvolutionBwdDataAlgoImplicitGEMM,<unused>;miopenConvolutionBwdDataAlgoWinograd:ConvBinWinogradRxS,0.598176,0,miopenConvolutionBwdDataAlgoWinograd,<unused>
128-28-28-1x1-512-28-28-32-0x0-1x1-1x1-0-NCHW-FP16-B=miopenConvolutionBwdDataAlgoDirect:ConvAsm1x1U,0.145292,0,miopenConvolutionBwdDataAlgoDirect,<unused>;miopenConvolutionBwdDataAlgoImplicitGEMM:ConvHipImplicitGemmBwdDataV1R1Xdlops,0.286149,51380224,miopenConvolutionBwdDataAlgoImplicitGEMM,<unused>;miopenConvolutionBwdDataAlgoWinograd:ConvBinWinogradRxS,0.618118,0,miopenConvolutionBwdDataAlgoWinograd,<unused>
2048-28-28-1x1-512-28-28-32-0x0-1x1-1x1-0-NCHW-FP16-B=miopenConvolutionBwdDataAlgoImplicitGEMM:ConvHipImplicitGemmBwdDataV1R1Xdlops,0.80289,51380224,miopenConvolutionBwdDataAlgoImplicitGEMM,<unused>;miopenConvolutionBwdDataAlgoDirect:ConvAsm1x1U,1.91616,0,miopenConvolutionBwdDataAlgoDirect,<unused>;miopenConvolutionBwdDataAlgoWinograd:ConvBinWinogradRxS,9.39819,0,miopenConvolutionBwdDataAlgoWinograd,<unused>
256-28-28-1x1-512-28-28-32-0x0-1x1-1x1-0-NCHW-FP16-B=miopenConvolutionBwdDataAlgoDirect:ConvAsm1x1U,0.265163,0,miopenConvolutionBwdDataAlgoDirect,<unused>;miopenConvolutionBwdDataAlgoImplicitGEMM:ConvHipImplicitGemmBwdDataV1R1Xdlops,0.320375,51380224,miopenConvolutionBwdDataAlgoImplicitGEMM,<unused>;miopenConvolutionBwdDataAlgoWinograd:ConvBinWinogradRxS,1.17731,0,miopenConvolutionBwdDataAlgoWinograd,<unused>
512-28-28-3x3-512-28-28-32-2x2-1x1-2x2-0-NCHW-FP16-B=miopenConvolutionBwdDataAlgoImplicitGEMM:ConvHipImplicitGemmBwdDataV1R1Xdlops,3.15945,51380224,miopenConvolutionBwdDataAlgoImplicitGEMM,<unused>
512-28-28-3x3-512-28-28-32-4x4-1x1-4x4-0-NCHW-FP16-B=miopenConvolutionBwdDataAlgoImplicitGEMM:ConvHipImplicitGemmBwdDataV1R1Xdlops,3.02064,51380224,miopenConvolutionBwdDataAlgoImplicitGEMM,<unused>
64-56-56-1x1-64-56-56-32-0x0-1x1-1x1-0-NCHW-FP16-B=miopenConvolutionBwdDataAlgoDirect:ConvAsm1x1U,0.049316,0,miopenConvolutionBwdDataAlgoDirect,<unused>;miopenConvolutionBwdDataAlgoImplicitGEMM:ConvHipImplicitGemmBwdDataV1R1Xdlops,0.146804,25690112,miopenConvolutionBwdDataAlgoImplicitGEMM,<unused>;miopenConvolutionBwdDataAlgoWinograd:ConvBinWinogradRxS,0.189385,0,miopenConvolutionBwdDataAlgoWinograd,<unused>
64-56-56-3x3-64-56-56-32-1x1-1x1-1x1-0-NCHW-FP16-B=miopenConvolutionBwdDataAlgoWinograd:ConvBinWinogradRxS,0.185173,0,miopenConvolutionBwdDataAlgoWinograd,<unused>;miopenConvolutionBwdDataAlgoDirect:ConvOclDirectFwd,0.737335,0,miopenConvolutionBwdDataAlgoDirect,<unused>;miopenConvolutionBwdDataAlgoImplicitGEMM:ConvHipImplicitGemmBwdDataV1R1Xdlops,1.14291,25690112,miopenConvolutionBwdDataAlgoImplicitGEMM,<unused>
64-112-112-7x7-3-230-230-128-0x0-2x2-1x1-0-NCHW-BF16-B=miopenConvolutionBwdDataAlgoDirect:ConvOclDirectFwd,7.94599,0,miopenConvolutionBwdDataAlgoDirect,<unused>
64-56-56-1x1-256-56-56-32-0x0-1x1-1x1-0-NCHW-BF16-B=miopenConvolutionBwdDataAlgoImplicitGEMM:ConvHipImplicitGemmBwdDataV1R1Xdlops,0.526892,102760448,miopenConvolutionBwdDataAlgoImplicitGEMM,<unused>
128-28-28-1x1-512-28-28-128-0x0-1x1-1x1-0-NCHW-BF16-B=miopenConvolutionBwdDataAlgoImplicitGEMM:ConvHipImplicitGemmBwdDataV1R1Xdlops,1.13432,205520896,miopenConvolutionBwdDataAlgoImplicitGEMM,<unused>
64-56-56-1x1-64-56-56-128-0x0-1x1-1x1-0-NCHW-BF16-B=miopenConvolutionBwdDataAlgoImplicitGEMM:ConvHipImplicitGemmBwdDataV1R1Xdlops,0.548951,102760448,miopenConvolutionBwdDataAlgoImplicitGEMM,<unused>
512-28-28-1x1-256-56-56-64-0x0-2x2-1x1-0-NCHW-BF16-B=miopenConvolutionBwdDataAlgoImplicitGEMM:ConvHipImplicitGemmBwdDataV1R1Xdlops,1.2264,205520896,miopenConvolutionBwdDataAlgoImplicitGEMM,<unused>
64-112-112-7x7-3-224-224-64-3x3-2x2-1x1-0-NCHW-BF16-B=miopenConvolutionBwdDataAlgoDirect:ConvOclDirectFwd,2.74368,0,miopenConvolutionBwdDataAlgoDirect,<unused>
1024-14-14-1x1-512-28-28-128-0x0-2x2-1x1-0-NCHW-BF16-B=miopenConvolutionBwdDataAlgoImplicitGEMM:ConvHipImplicitGemmBwdDataV1R1Xdlops,1.49537,205520896,miopenConvolutionBwdDataAlgoImplicitGEMM,<unused>
64-56-56-1x1-256-56-56-128-0x0-1x1-1x1-0-NCHW-BF16-B=miopenConvolutionBwdDataAlgoImplicitGEMM:ConvHipImplicitGemmBwdDataV1R1Xdlops,2.08332,411041792,miopenConvolutionBwdDataAlgoImplicitGEMM,<unused>
2048-7-7-1x1-1024-14-14-128-0x0-2x2-1x1-0-NCHW-BF16-B=miopenConvolutionBwdDataAlgoImplicitGEMM:ConvHipImplicitGemmBwdDataV1R1Xdlops,1.14482,102760448,miopenConvolutionBwdDataAlgoImplicitGEMM,<unused>
512-28-28-1x1-256-56-56-128-0x0-2x2-1x1-0-NCHW-BF16-B=miopenConvolutionBwdDataAlgoImplicitGEMM:ConvHipImplicitGemmBwdDataV1R1Xdlops,2.42138,411041792,miopenConvolutionBwdDataAlgoImplicitGEMM,<unused>
128-56-56-1x1-256-56-56-64-0x0-1x1-1x1-0-NCHW-BF16-B=miopenConvolutionBwdDataAlgoImplicitGEMM:ConvHipImplicitGemmBwdDataV1R1Xdlops,1.11191,205520896,miopenConvolutionBwdDataAlgoImplicitGEMM,<unused>
2048-7-7-1x1-512-7-7-128-0x0-1x1-1x1-0-NCHW-BF16-B=miopenConvolutionBwdDataAlgoImplicitGEMM:ConvHipImplicitGemmBwdDataV1R1Xdlops,0.411348,12845056,miopenConvolutionBwdDataAlgoImplicitGEMM,<unused>
512-7-7-1x1-1024-14-14-128-0x0-2x2-1x1-0-NCHW-BF16-B=miopenConvolutionBwdDataAlgoImplicitGEMM:ConvHipImplicitGemmBwdDataV1R1Xdlops,0.755567,102760448,miopenConvolutionBwdDataAlgoImplicitGEMM,<unused>
512-28-28-1x1-128-28-28-128-0x0-1x1-1x1-0-NCHW-BF16-B=miopenConvolutionBwdDataAlgoImplicitGEMM:ConvHipImplicitGemmBwdDataV1R1Xdlops,0.418842,51380224,miopenConvolutionBwdDataAlgoImplicitGEMM,<unused>
64-56-56-1x1-64-56-56-64-0x0-1x1-1x1-0-NCHW-BF16-B=miopenConvolutionBwdDataAlgoImplicitGEMM:ConvHipImplicitGemmBwdDataV1R1Xdlops,0.282962,51380224,miopenConvolutionBwdDataAlgoImplicitGEMM,<unused>
256-14-14-1x1-1024-14-14-128-0x0-1x1-1x1-0-NCHW-BF16-B=miopenConvolutionBwdDataAlgoImplicitGEMM:ConvHipImplicitGemmBwdDataV1R1Xdlops,0.661354,102760448,miopenConvolutionBwdDataAlgoImplicitGEMM,<unused>
256-28-28-1x1-512-28-28-64-0x0-1x1-1x1-0-NCHW-BF16-B=miopenConvolutionBwdDataAlgoImplicitGEMM:ConvHipImplicitGemmBwdDataV1R1Xdlops,0.632885,102760448,miopenConvolutionBwdDataAlgoImplicitGEMM,<unused>
256-28-28-1x1-512-28-28-32-0x0-1x1-1x1-0-NCHW-BF16-B=miopenConvolutionBwdDataAlgoImplicitGEMM:ConvHipImplicitGemmBwdDataV1R1Xdlops,0.334887,51380224,miopenConvolutionBwdDataAlgoImplicitGEMM,<unused>
128-28-28-1x1-512-28-28-32-0x0-1x1-1x1-0-NCHW-BF16-B=miopenConvolutionBwdDataAlgoImplicitGEMM:ConvHipImplicitGemmBwdDataV1R1Xdlops,0.292762,51380224,miopenConvolutionBwdDataAlgoImplicitGEMM,<unused>
256-56-56-1x1-64-56-56-64-0x0-1x1-1x1-0-NCHW-BF16-B=miopenConvolutionBwdDataAlgoImplicitGEMM:ConvHipImplicitGemmBwdDataV1R1Xdlops,0.370137,51380224,miopenConvolutionBwdDataAlgoImplicitGEMM,<unused>
64-56-56-1x1-256-56-56-64-0x0-1x1-1x1-0-NCHW-BF16-B=miopenConvolutionBwdDataAlgoImplicitGEMM:ConvHipImplicitGemmBwdDataV1R1Xdlops,1.04584,205520896,miopenConvolutionBwdDataAlgoImplicitGEMM,<unused>
512-28-28-1x1-128-28-28-64-0x0-1x1-1x1-0-NCHW-BF16-B=miopenConvolutionBwdDataAlgoImplicitGEMM:ConvHipImplicitGemmBwdDataV1R1Xdlops,0.231264,25690112,miopenConvolutionBwdDataAlgoImplicitGEMM,<unused>
512-7-7-1x1-2048-7-7-128-0x0-1x1-1x1-0-NCHW-BF16-B=miopenConvolutionBwdDataAlgoImplicitGEMM:ConvHipImplicitGemmBwdDataV1R1Xdlops,0.521247,51380224,miopenConvolutionBwdDataAlgoImplicitGEMM,<unused>
128-28-28-1x1-256-56-56-128-0x0-2x2-1x1-0-NCHW-BF16-B=miopenConvolutionBwdDataAlgoImplicitGEMM:ConvHipImplicitGemmBwdDataV1R1Xdlops,2.18735,411041792,miopenConvolutionBwdDataAlgoImplicitGEMM,<unused>
512-28-28-1x1-128-28-28-32-0x0-1x1-1x1-0-NCHW-BF16-B=miopenConvolutionBwdDataAlgoImplicitGEMM:ConvHipImplicitGemmBwdDataV1R1Xdlops,0.129417,12845056,miopenConvolutionBwdDataAlgoImplicitGEMM,<unused>
128-28-28-1x1-512-28-28-64-0x0-1x1-1x1-0-NCHW-BF16-B=miopenConvolutionBwdDataAlgoImplicitGEMM:ConvHipImplicitGemmBwdDataV1R1Xdlops,0.570838,102760448,miopenConvolutionBwdDataAlgoImplicitGEMM,<unused>
128-28-28-3x3-128-56-56-64-1x1-2x2-1x1-0-NCHW-BF16-B=miopenConvolutionBwdDataAlgoImplicitGEMM:ConvHipImplicitGemmBwdDataV1R1Xdlops,1.62004,102760448,miopenConvolutionBwdDataAlgoImplicitGEMM,<unused>;miopenConvolutionBwdDataAlgoDirect:ConvOclDirectFwd,3.37147,0,miopenConvolutionBwdDataAlgoDirect,<unused>
256-14-14-1x1-512-28-28-128-0x0-2x2-1x1-0-NCHW-BF16-B=miopenConvolutionBwdDataAlgoImplicitGEMM:ConvHipImplicitGemmBwdDataV1R1Xdlops,1.23321,205520896,miopenConvolutionBwdDataAlgoImplicitGEMM,<unused>
1024-14-14-1x1-256-14-14-128-0x0-1x1-1x1-0-NCHW-BF16-B=miopenConvolutionBwdDataAlgoImplicitGEMM:ConvHipImplicitGemmBwdDataV1R1Xdlops,0.342424,25690112,miopenConvolutionBwdDataAlgoImplicitGEMM,<unused>
256-56-56-1x1-64-56-56-128-0x0-1x1-1x1-0-NCHW-BF16-B=miopenConvolutionBwdDataAlgoImplicitGEMM:ConvHipImplicitGemmBwdDataV1R1Xdlops,0.72938,102760448,miopenConvolutionBwdDataAlgoImplicitGEMM,<unused>
128-56-56-1x1-256-56-56-32-0x0-1x1-1x1-0-NCHW-BF16-B=miopenConvolutionBwdDataAlgoImplicitGEMM:ConvHipImplicitGemmBwdDataV1R1Xdlops,0.558317,102760448,miopenConvolutionBwdDataAlgoImplicitGEMM,<unused>
64-56-56-1x1-64-56-56-32-0x0-1x1-1x1-0-NCHW-BF16-B=miopenConvolutionBwdDataAlgoImplicitGEMM:ConvHipImplicitGemmBwdDataV1R1Xdlops,0.150618,25690112,miopenConvolutionBwdDataAlgoImplicitGEMM,<unused>
128-28-28-3x3-128-56-56-32-1x1-2x2-1x1-0-NCHW-BF16-B=miopenConvolutionBwdDataAlgoImplicitGEMM:ConvHipImplicitGemmBwdDataV1R1Xdlops,0.812861,51380224,miopenConvolutionBwdDataAlgoImplicitGEMM,<unused>;miopenConvolutionBwdDataAlgoDirect:ConvOclDirectFwd,1.79169,0,miopenConvolutionBwdDataAlgoDirect,<unused>
32-30-30-3x3-3-32-32-32-0x0-1x1-1x1-0-NCHW-FP16-B=miopenConvolutionBwdDataAlgoDirect:ConvOclDirectFwd,0.05317,0,miopenConvolutionBwdDataAlgoDirect,<unused>
128-28-28-3x3-128-28-28-32-1x1-1x1-1x1-0-NCHW-BF16-F=miopenConvolutionFwdAlgoImplicitGEMM:ConvHipImplicitGemmV4R4GenFwdXdlops,0.189008,0,miopenConvolutionFwdAlgoImplicitGEMM,<unused>;miopenConvolutionFwdAlgoDirect:ConvOclDirectFwd,1.27404,0,miopenConvolutionFwdAlgoDirect,<unused>
128-28-28-3x3-128-28-28-64-1x1-1x1-1x1-0-NCHW-BF16-F=miopenConvolutionFwdAlgoImplicitGEMM:ConvHipImplicitGemmV4R4GenFwdXdlops,0.365867,0,miopenConvolutionFwdAlgoImplicitGEMM,<unused>;miopenConvolutionFwdAlgoDirect:ConvOclDirectFwd,2.30923,0,miopenConvolutionFwdAlgoDirect,<unused>
128-28-28-3x3-128-28-28-128-1x1-1x1-1x1-0-NCHW-BF16-F=miopenConvolutionFwdAlgoImplicitGEMM:ConvHipImplicitGemmV4R4GenFwdXdlops,0.611186,0,miopenConvolutionFwdAlgoImplicitGEMM,<unused>;miopenConvolutionFwdAlgoDirect:ConvOclDirectFwd,3.97825,0,miopenConvolutionFwdAlgoDirect,<unused>
256-14-14-3x3-256-14-14-128-1x1-1x1-1x1-0-NCHW-BF16-F=miopenConvolutionFwdAlgoImplicitGEMM:ConvHipImplicitGemmV4R4GenFwdXdlops,0.683569,0,miopenConvolutionFwdAlgoImplicitGEMM,<unused>;miopenConvolutionFwdAlgoDirect:ConvOclDirectFwd,4.37163,0,miopenConvolutionFwdAlgoDirect,<unused>
512-7-7-3x3-512-7-7-128-1x1-1x1-1x1-0-NCHW-BF16-F=miopenConvolutionFwdAlgoImplicitGEMM:ConvHipImplicitGemmV4R4GenFwdXdlops,0.707183,0,miopenConvolutionFwdAlgoImplicitGEMM,<unused>;miopenConvolutionFwdAlgoDirect:ConvOclDirectFwd,6.16779,0,miopenConvolutionFwdAlgoDirect,<unused>
64-56-56-3x3-64-56-56-32-1x1-1x1-1x1-0-NCHW-BF16-F=miopenConvolutionFwdAlgoImplicitGEMM:ConvHipImplicitGemmV4R4GenFwdXdlops,0.271614,0,miopenConvolutionFwdAlgoImplicitGEMM,<unused>;miopenConvolutionFwdAlgoDirect:ConvOclDirectFwd,1.21066,0,miopenConvolutionFwdAlgoDirect,<unused>
64-56-56-3x3-64-56-56-64-1x1-1x1-1x1-0-NCHW-BF16-F=miopenConvolutionFwdAlgoImplicitGEMM:ConvHipImplicitGemmV4R4GenFwdXdlops,0.461227,0,miopenConvolutionFwdAlgoImplicitGEMM,<unused>;miopenConvolutionFwdAlgoDirect:ConvOclDirectFwd,2.24291,0,miopenConvolutionFwdAlgoDirect,<unused>
64-56-56-3x3-64-56-56-128-1x1-1x1-1x1-0-NCHW-BF16-F=miopenConvolutionFwdAlgoImplicitGEMM:ConvHipImplicitGemmV4R4GenFwdXdlops,0.887498,0,miopenConvolutionFwdAlgoImplicitGEMM,<unused>;miopenConvolutionFwdAlgoDirect:ConvOclDirectFwd,4.27961,0,miopenConvolutionFwdAlgoDirect,<unused>
3-32-32-3x3-32-30-30-32-0x0-1x1-1x1-0-NCHW-BF16-F=miopenConvolutionFwdAlgoDirect:ConvOclDirectFwd,0.020557,0,miopenConvolutionFwdAlgoDirect,<unused>
1024-28-28-1x1-2048-28-28-32-0x0-1x1-1x1-0-NCHW-BF16-F=miopenConvolutionFwdAlgoImplicitGEMM:ConvHipImplicitGemmV4R4GenFwdXdlops,1.55645,0,miopenConvolutionFwdAlgoImplicitGEMM,<unused>
1024-28-28-1x1-2048-28-28-64-0x0-1x1-1x1-0-NCHW-BF16-F=miopenConvolutionFwdAlgoImplicitGEMM:ConvHipImplicitGemmV4R4GenFwdXdlops,3.05922,0,miopenConvolutionFwdAlgoImplicitGEMM,<unused>
1024-28-28-1x1-256-28-28-32-0x0-1x1-1x1-0-NCHW-BF16-F=miopenConvolutionFwdAlgoImplicitGEMM:ConvHipImplicitGemmV4R4GenFwdXdlops,0.235737,0,miopenConvolutionFwdAlgoImplicitGEMM,<unused>
1024-28-28-1x1-256-28-28-64-0x0-1x1-1x1-0-NCHW-BF16-F=miopenConvolutionFwdAlgoImplicitGEMM:ConvHipImplicitGemmV4R4GenFwdXdlops,0.407123,0,miopenConvolutionFwdAlgoImplicitGEMM,<unused>
1024-28-28-1x1-512-28-28-32-0x0-1x1-1x1-0-NCHW-BF16-F=miopenConvolutionFwdAlgoImplicitGEMM:ConvHipImplicitGemmV4R4GenFwdXdlops,0.411377,0,miopenConvolutionFwdAlgoImplicitGEMM,<unused>
1024-28-28-1x1-512-28-28-64-0x0-1x1-1x1-0-NCHW-BF16-F=miopenConvolutionFwdAlgoImplicitGEMM:ConvHipImplicitGemmV4R4GenFwdXdlops,0.798045,0,miopenConvolutionFwdAlgoImplicitGEMM,<unused>
1280-28-28-1x1-256-28-28-32-0x0-1x1-1x1-0-NCHW-BF16-F=miopenConvolutionFwdAlgoImplicitGEMM:ConvHipImplicitGemmV4R4GenFwdXdlops,0.296387,0,miopenConvolutionFwdAlgoImplicitGEMM,<unused>
1280-28-28-1x1-256-28-28-64-0x0-1x1-1x1-0-NCHW-BF16-F=miopenConvolutionFwdAlgoImplicitGEMM:ConvHipImplicitGemmV4R4GenFwdXdlops,0.481798,0,miopenConvolutionFwdAlgoImplicitGEMM,<unused>
2048-1-1-1x1-256-1-1-32-0x0-1x1-1x1-0-NCHW-BF16-F=miopenConvolutionFwdAlgoImplicitGEMM:ConvHipImplicitGemmV4R4GenFwdXdlops,0.037211,0,miopenConvolutionFwdAlgoImplicitGEMM,<unused>
2048-1-1-1x1-256-1-1-64-0x0-1x1-1x1-0-NCHW-BF16-F=miopenConvolutionFwdAlgoImplicitGEMM:ConvHipImplicitGemmV4R4GenFwdXdlops,0.177974,0,miopenConvolutionFwdAlgoImplicitGEMM,<unused>
2048-28-28-1x1-256-28-28-32-0x0-1x1-1x1-0-NCHW-BF16-F=miopenConvolutionFwdAlgoImplicitGEMM:ConvHipImplicitGemmV4R4GenFwdXdlops,0.469935,0,miopenConvolutionFwdAlgoImplicitGEMM,<unused>
2048-28-28-1x1-256-28-28-64-0x0-1x1-1x1-0-NCHW-BF16-F=miopenConvolutionFwdAlgoImplicitGEMM:ConvHipImplicitGemmV4R4GenFwdXdlops,0.802951,0,miopenConvolutionFwdAlgoImplicitGEMM,<unused>
2048-28-28-3x3-256-28-28-32-12x12-1x1-12x12-0-NCHW-BF16-F=miopenConvolutionFwdAlgoImplicitGEMM:ConvHipImplicitGemmV4R4GenFwdXdlops,5.24448,0,miopenConvolutionFwdAlgoImplicitGEMM,<unused>
2048-28-28-3x3-256-28-28-64-12x12-1x1-12x12-0-NCHW-BF16-F=miopenConvolutionFwdAlgoImplicitGEMM:ConvHipImplicitGemmV4R4GenFwdXdlops,8.35682,0,miopenConvolutionFwdAlgoImplicitGEMM,<unused>
2048-28-28-3x3-256-28-28-32-24x24-1x1-24x24-0-NCHW-BF16-F=miopenConvolutionFwdAlgoImplicitGEMM:ConvHipImplicitGemmV4R4GenFwdXdlops,5.088,0,miopenConvolutionFwdAlgoImplicitGEMM,<unused>
2048-28-28-3x3-256-28-28-64-24x24-1x1-24x24-0-NCHW-BF16-F=miopenConvolutionFwdAlgoImplicitGEMM:ConvHipImplicitGemmV4R4GenFwdXdlops,8.24497,0,miopenConvolutionFwdAlgoImplicitGEMM,<unused>
2048-28-28-3x3-256-28-28-32-36x36-1x1-36x36-0-NCHW-BF16-F=miopenConvolutionFwdAlgoImplicitGEMM:ConvHipImplicitGemmV4R4GenFwdXdlops,4.48318,0,miopenConvolutionFwdAlgoImplicitGEMM,<unused>
2048-28-28-3x3-256-28-28-64-36x36-1x1-36x36-0-NCHW-BF16-F=miopenConvolutionFwdAlgoImplicitGEMM:ConvHipImplicitGemmV4R4GenFwdXdlops,7.46225,0,miopenConvolutionFwdAlgoImplicitGEMM,<unused>
2048-28-28-1x1-512-28-28-32-0x0-1x1-1x1-0-NCHW-BF16-F=miopenConvolutionFwdAlgoImplicitGEMM:ConvHipImplicitGemmV4R4GenFwdXdlops,0.806592,0,miopenConvolutionFwdAlgoImplicitGEMM,<unused>
2048-28-28-1x1-512-28-28-64-0x0-1x1-1x1-0-NCHW-BF16-F=miopenConvolutionFwdAlgoImplicitGEMM:ConvHipImplicitGemmV4R4GenFwdXdlops,1.58112,0,miopenConvolutionFwdAlgoImplicitGEMM,<unused>
256-28-28-1x1-1024-28-28-32-0x0-1x1-1x1-0-NCHW-BF16-F=miopenConvolutionFwdAlgoImplicitGEMM:ConvHipImplicitGemmV4R4GenFwdXdlops,0.243628,0,miopenConvolutionFwdAlgoImplicitGEMM,<unused>
256-28-28-1x1-1024-28-28-64-0x0-1x1-1x1-0-NCHW-BF16-F=miopenConvolutionFwdAlgoImplicitGEMM:ConvHipImplicitGemmV4R4GenFwdXdlops,0.46156,0,miopenConvolutionFwdAlgoImplicitGEMM,<unused>
256-28-28-3x3-256-28-28-32-1x1-1x1-1x1-0-NCHW-BF16-F=miopenConvolutionFwdAlgoImplicitGEMM:ConvHipImplicitGemmV4R4GenFwdXdlops,0.693142,0,miopenConvolutionFwdAlgoImplicitGEMM,<unused>;miopenConvolutionFwdAlgoDirect:ConvOclDirectFwd,4.22596,0,miopenConvolutionFwdAlgoDirect,<unused>
256-28-28-3x3-256-28-28-64-1x1-1x1-1x1-0-NCHW-BF16-F=miopenConvolutionFwdAlgoImplicitGEMM:ConvHipImplicitGemmV4R4GenFwdXdlops,1.18096,0,miopenConvolutionFwdAlgoImplicitGEMM,<unused>;miopenConvolutionFwdAlgoDirect:ConvOclDirectFwd,7.91936,0,miopenConvolutionFwdAlgoDirect,<unused>
256-28-28-3x3-256-28-28-64-2x2-1x1-2x2-0-NCHW-BF16-F=miopenConvolutionFwdAlgoImplicitGEMM:ConvHipImplicitGemmV4R4GenFwdXdlops,1.24016,0,miopenConvolutionFwdAlgoImplicitGEMM,<unused>
256-28-28-3x3-256-28-28-32-2x2-1x1-2x2-0-NCHW-BF16-F=miopenConvolutionFwdAlgoImplicitGEMM:ConvHipImplicitGemmV4R4GenFwdXdlops,0.763376,0,miopenConvolutionFwdAlgoImplicitGEMM,<unused>
512-28-28-1x1-1024-28-28-64-0x0-1x1-1x1-0-NCHW-BF16-F=miopenConvolutionFwdAlgoImplicitGEMM:ConvHipImplicitGemmV4R4GenFwdXdlops,0.825628,0,miopenConvolutionFwdAlgoImplicitGEMM,<unused>
512-28-28-1x1-2048-28-28-32-0x0-1x1-1x1-0-NCHW-BF16-F=miopenConvolutionFwdAlgoImplicitGEMM:ConvHipImplicitGemmV4R4GenFwdXdlops,0.868246,0,miopenConvolutionFwdAlgoImplicitGEMM,<unused>
512-28-28-1x1-2048-28-28-64-0x0-1x1-1x1-0-NCHW-BF16-F=miopenConvolutionFwdAlgoImplicitGEMM:ConvHipImplicitGemmV4R4GenFwdXdlops,1.62561,0,miopenConvolutionFwdAlgoImplicitGEMM,<unused>
512-28-28-3x3-512-28-28-32-2x2-1x1-2x2-0-NCHW-BF16-F=miopenConvolutionFwdAlgoImplicitGEMM:ConvHipImplicitGemmV4R4GenFwdXdlops,2.4412,0,miopenConvolutionFwdAlgoImplicitGEMM,<unused>
512-28-28-3x3-512-28-28-64-2x2-1x1-2x2-0-NCHW-BF16-F=miopenConvolutionFwdAlgoImplicitGEMM:ConvHipImplicitGemmV4R4GenFwdXdlops,4.73038,0,miopenConvolutionFwdAlgoImplicitGEMM,<unused>
512-28-28-3x3-512-28-28-32-4x4-1x1-4x4-0-NCHW-BF16-F=miopenConvolutionFwdAlgoImplicitGEMM:ConvHipImplicitGemmV4R4GenFwdXdlops,2.03392,0,miopenConvolutionFwdAlgoImplicitGEMM,<unused>
512-28-28-3x3-512-28-28-64-4x4-1x1-4x4-0-NCHW-BF16-F=miopenConvolutionFwdAlgoImplicitGEMM:ConvHipImplicitGemmV4R4GenFwdXdlops,3.96446,0,miopenConvolutionFwdAlgoImplicitGEMM,<unused>
1024-14-14-1x1-2048-7-7-128-0x0-2x2-1x1-0-NCHW-FP32-F=miopenConvolutionFwdAlgoImplicitGEMM:ConvHipImplicitGemmV4R4GenXdlopsFwdFp32,1.57891,0,miopenConvolutionFwdAlgoImplicitGEMM,<unused>;miopenConvolutionFwdAlgoDirect:ConvAsm1x1U,2.17175,25690112,miopenConvolutionFwdAlgoDirect,<unused>;miopenConvolutionFwdAlgoWinograd:ConvBinWinogradRxSf2x3,18.6366,0,miopenConvolutionFwdAlgoWinograd,<unused>
1024-14-14-1x1-256-14-14-128-0x0-1x1-1x1-0-NCHW-FP32-F=miopenConvolutionFwdAlgoImplicitGEMM:ConvHipImplicitGemmV4R4GenXdlopsFwdFp32,0.459817,0,miopenConvolutionFwdAlgoImplicitGEMM,<unused>;miopenConvolutionFwdAlgoDirect:ConvAsm1x1U,0.911922,0,miopenConvolutionFwdAlgoDirect,<unused>;miopenConvolutionFwdAlgoWinograd:ConvBinWinogradRxSf3x2,1.81486,0,miopenConvolutionFwdAlgoWinograd,<unused>
1024-14-14-1x1-512-7-7-128-0x0-2x2-1x1-0-NCHW-FP32-F=miopenConvolutionFwdAlgoImplicitGEMM:ConvHipImplicitGemmV4R4GenXdlopsFwdFp32,0.343723,0,miopenConvolutionFwdAlgoImplicitGEMM,<unused>;miopenConvolutionFwdAlgoDirect:ConvAsm1x1U,0.670323,25690112,miopenConvolutionFwdAlgoDirect,<unused>;miopenConvolutionFwdAlgoWinograd:ConvBinWinogradRxSf2x3,4.41002,0,miopenConvolutionFwdAlgoWinograd,<unused>
128-28-28-3x3-128-28-28-128-1x1-1x1-1x1-0-NCHW-FP32-F=miopenConvolutionFwdAlgoWinograd:ConvBinWinograd3x3U,0.901209,0,miopenConvolutionFwdAlgoWinograd,<unused>
128-28-28-1x1-512-28-28-128-0x0-1x1-1x1-0-NCHW-FP32-F=miopenConvolutionFwdAlgoImplicitGEMM:ConvHipImplicitGemmV4R4GenXdlopsFwdFp32,0.499634,0,miopenConvolutionFwdAlgoImplicitGEMM,<unused>;miopenConvolutionFwdAlgoDirect:ConvAsm1x1U,0.773186,0,miopenConvolutionFwdAlgoDirect,<unused>;miopenConvolutionFwdAlgoWinograd:ConvBinWinogradRxSf3x2,1.94333,0,miopenConvolutionFwdAlgoWinograd,<unused>
2048-7-7-1x1-512-7-7-128-0x0-1x1-1x1-0-NCHW-FP32-F=miopenConvolutionFwdAlgoImplicitGEMM:ConvHipImplicitGemmV4R4GenXdlopsFwdFp32,0.448241,0,miopenConvolutionFwdAlgoImplicitGEMM,<unused>;miopenConvolutionFwdAlgoDirect:ConvAsm1x1U,1.06593,0,miopenConvolutionFwdAlgoDirect,<unused>;miopenConvolutionFwdAlgoWinograd:ConvBinWinogradRxSf3x2,2.52761,0,miopenConvolutionFwdAlgoWinograd,<unused>
256-14-14-1x1-1024-14-14-128-0x0-1x1-1x1-0-NCHW-FP32-F=miopenConvolutionFwdAlgoImplicitGEMM:ConvHipImplicitGemmV4R4GenXdlopsFwdFp32,0.481584,0,miopenConvolutionFwdAlgoImplicitGEMM,<unused>;miopenConvolutionFwdAlgoDirect:ConvAsm1x1U,1.01889,0,miopenConvolutionFwdAlgoDirect,<unused>;miopenConvolutionFwdAlgoWinograd:ConvBinWinogradRxSf3x2,1.88066,0,miopenConvolutionFwdAlgoWinograd,<unused>
256-14-14-3x3-256-14-14-128-1x1-1x1-1x1-0-NCHW-FP32-F=miopenConvolutionFwdAlgoWinograd:ConvBinWinograd3x3U,0.916544,0,miopenConvolutionFwdAlgoWinograd,<unused>
256-56-56-1x1-128-28-28-128-0x0-2x2-1x1-0-NCHW-FP32-F=miopenConvolutionFwdAlgoImplicitGEMM:ConvHipImplicitGemmV4R4GenXdlopsFwdFp32,0.345996,0,miopenConvolutionFwdAlgoImplicitGEMM,<unused>;miopenConvolutionFwdAlgoDirect:ConvAsm1x1UV2,0.530956,0,miopenConvolutionFwdAlgoDirect,<unused>;miopenConvolutionFwdAlgoWinograd:ConvBinWinogradRxSf2x3,3.36896,0,miopenConvolutionFwdAlgoWinograd,<unused>
256-56-56-1x1-512-28-28-128-0x0-2x2-1x1-0-NCHW-FP32-F=miopenConvolutionFwdAlgoImplicitGEMM:ConvHipImplicitGemmV4R4GenXdlopsFwdFp32,1.36175,0,miopenConvolutionFwdAlgoImplicitGEMM,<unused>;miopenConvolutionFwdAlgoDirect:ConvAsm1x1U,1.86406,102760448,miopenConvolutionFwdAlgoDirect,<unused>;miopenConvolutionFwdAlgoWinograd:ConvBinWinogradRxSf2x3,13.8826,0,miopenConvolutionFwdAlgoWinograd,<unused>
256-56-56-1x1-64-56-56-128-0x0-1x1-1x1-0-NCHW-FP32-F=miopenConvolutionFwdAlgoImplicitGEMM:ConvHipImplicitGemmV4R4GenXdlopsFwdFp32,0.648991,0,miopenConvolutionFwdAlgoImplicitGEMM,<unused>;miopenConvolutionFwdAlgoDirect:ConvAsm1x1U,0.764912,0,miopenConvolutionFwdAlgoDirect,<unused>;miopenConvolutionFwdAlgoWinograd:ConvBinWinogradRxSf3x2,1.71382,0,miopenConvolutionFwdAlgoWinograd,<unused>
3-230-230-7x7-64-112-112-128-0x0-2x2-1x1-0-NCHW-FP32-F=miopenConvolutionFwdAlgoWinograd:ConvBinWinogradRxS,2.70922,0,miopenConvolutionFwdAlgoWinograd,<unused>;miopenConvolutionFwdAlgoDirect:ConvOclDirectFwd,2.99197,0,miopenConvolutionFwdAlgoDirect,<unused>
512-28-28-1x1-1024-14-14-128-0x0-2x2-1x1-0-NCHW-FP32-F=miopenConvolutionFwdAlgoImplicitGEMM:ConvHipImplicitGemmV4R4GenXdlopsFwdFp32,1.48365,0,miopenConvolutionFwdAlgoImplicitGEMM,<unused>;miopenConvolutionFwdAlgoDirect:ConvAsm1x1U,2.11824,51380224,miopenConvolutionFwdAlgoDirect,<unused>;miopenConvolutionFwdAlgoWinograd:ConvBinWinogradRxSf2x3,13.9999,0,miopenConvolutionFwdAlgoWinograd,<unused>
512-28-28-1x1-128-28-28-128-0x0-1x1-1x1-0-NCHW-FP32-F=miopenConvolutionFwdAlgoImplicitGEMM:ConvHipImplicitGemmV4R4GenXdlopsFwdFp32,0.413697,0,miopenConvolutionFwdAlgoImplicitGEMM,<unused>;miopenConvolutionFwdAlgoDirect:ConvAsm1x1U,0.784852,0,miopenConvolutionFwdAlgoDirect,<unused>;miopenConvolutionFwdAlgoWinograd:ConvBinWinogradRxSf3x2,1.81425,0,miopenConvolutionFwdAlgoWinograd,<unused>
512-28-28-1x1-256-14-14-128-0x0-2x2-1x1-0-NCHW-FP32-F=miopenConvolutionFwdAlgoImplicitGEMM:ConvHipImplicitGemmV4R4GenXdlopsFwdFp32,0.385278,0,miopenConvolutionFwdAlgoImplicitGEMM,<unused>;miopenConvolutionFwdAlgoDirect:ConvAsm1x1UV2,0.582371,0,miopenConvolutionFwdAlgoDirect,<unused>;miopenConvolutionFwdAlgoWinograd:ConvBinWinogradRxSf2x3,3.45825,0,miopenConvolutionFwdAlgoWinograd,<unused>
512-7-7-1x1-2048-7-7-128-0x0-1x1-1x1-0-NCHW-FP32-F=miopenConvolutionFwdAlgoImplicitGEMM:ConvHipImplicitGemmV4R4GenXdlopsFwdFp32,0.417773,0,miopenConvolutionFwdAlgoImplicitGEMM,<unused>;miopenConvolutionFwdAlgoDirect:ConvAsm1x1U,1.04479,0,miopenConvolutionFwdAlgoDirect,<unused>;miopenConvolutionFwdAlgoWinograd:ConvBinWinogradRxSf3x2,2.604,0,miopenConvolutionFwdAlgoWinograd,<unused>
512-7-7-3x3-512-7-7-128-1x1-1x1-1x1-0-NCHW-FP32-F=miopenConvolutionFwdAlgoWinograd:ConvBinWinograd3x3U,1.12861,0,miopenConvolutionFwdAlgoWinograd,<unused>
64-56-56-1x1-256-56-56-128-0x0-1x1-1x1-0-NCHW-FP32-F=miopenConvolutionFwdAlgoImplicitGEMM:ConvHipImplicitGemmV4R4GenXdlopsFwdFp32,0.719708,0,miopenConvolutionFwdAlgoImplicitGEMM,<unused>;miopenConvolutionFwdAlgoDirect:ConvAsm1x1U,0.792151,0,miopenConvolutionFwdAlgoDirect,<unused>;miopenConvolutionFwdAlgoWinograd:ConvBinWinogradRxSf3x2,1.96593,0,miopenConvolutionFwdAlgoWinograd,<unused>
64-56-56-1x1-64-56-56-128-0x0-1x1-1x1-0-NCHW-FP32-F=miopenConvolutionFwdAlgoDirect:ConvAsm1x1U,0.22581,0,miopenConvolutionFwdAlgoDirect,<unused>;miopenConvolutionFwdAlgoImplicitGEMM:ConvHipImplicitGemmV4R4GenXdlopsFwdFp32,0.243478,0,miopenConvolutionFwdAlgoImplicitGEMM,<unused>;miopenConvolutionFwdAlgoWinograd:ConvBinWinogradRxSf3x2,0.559376,0,miopenConvolutionFwdAlgoWinograd,<unused>
64-56-56-3x3-64-56-56-128-1x1-1x1-1x1-0-NCHW-FP32-F=miopenConvolutionFwdAlgoWinograd:ConvBinWinograd3x3U,0.943474,0,miopenConvolutionFwdAlgoWinograd,<unused>
256-56-56-1x1-128-56-56-32-0x0-1x1-1x1-0-NCHW-FP32-F=miopenConvolutionFwdAlgoImplicitGEMM:ConvHipImplicitGemmV4R4GenXdlopsFwdFp32,0.229143,0,miopenConvolutionFwdAlgoImplicitGEMM,<unused>;miopenConvolutionFwdAlgoDirect:ConvAsm1x1U,0.396858,0,miopenConvolutionFwdAlgoDirect,<unused>;miopenConvolutionFwdAlgoWinograd:ConvBinWinogradRxSf3x2,0.941991,0,miopenConvolutionFwdAlgoWinograd,<unused>
512-28-28-1x1-256-28-28-32-0x0-1x1-1x1-0-NCHW-FP32-F=miopenConvolutionFwdAlgoImplicitGEMM:ConvHipImplicitGemmV4R4GenXdlopsFwdFp32,0.239594,0,miopenConvolutionFwdAlgoImplicitGEMM,<unused>;miopenConvolutionFwdAlgoDirect:ConvAsm1x1U,0.418647,0,miopenConvolutionFwdAlgoDirect,<unused>;miopenConvolutionFwdAlgoWinograd:ConvBinWinogradRxSf3x2,0.968108,0,miopenConvolutionFwdAlgoWinograd,<unused>
1024-28-28-1x1-2048-28-28-64-0x0-1x1-1x1-0-NCHW-FP32-F=miopenConvolutionFwdAlgoImplicitGEMM:ConvHipImplicitGemmV4R4GenXdlopsFwdFp32,5.90869,0,miopenConvolutionFwdAlgoImplicitGEMM,<unused>;miopenConvolutionFwdAlgoDirect:ConvAsm1x1U,13.0839,0,miopenConvolutionFwdAlgoDirect,<unused>;miopenConvolutionFwdAlgoWinograd:ConvBinWinogradRxSf3x2,30.6757,0,miopenConvolutionFwdAlgoWinograd,<unused>
1024-28-28-1x1-256-28-28-64-0x0-1x1-1x1-0-NCHW-FP32-F=miopenConvolutionFwdAlgoImplicitGEMM:ConvHipImplicitGemmV4R4GenXdlopsFwdFp32,0.768265,0,miopenConvolutionFwdAlgoImplicitGEMM,<unused>;miopenConvolutionFwdAlgoDirect:ConvAsm1x1U,1.63552,0,miopenConvolutionFwdAlgoDirect,<unused>;miopenConvolutionFwdAlgoWinograd:ConvBinWinogradRxSf3x2,3.71008,0,miopenConvolutionFwdAlgoWinograd,<unused>
1024-28-28-1x1-512-28-28-64-0x0-1x1-1x1-0-NCHW-FP32-F=miopenConvolutionFwdAlgoImplicitGEMM:ConvHipImplicitGemmV4R4GenXdlopsFwdFp32,1.51365,0,miopenConvolutionFwdAlgoImplicitGEMM,<unused>;miopenConvolutionFwdAlgoDirect:ConvAsm1x1U,3.18555,0,miopenConvolutionFwdAlgoDirect,<unused>;miopenConvolutionFwdAlgoWinograd:ConvBinWinogradRxSf3x2,7.42965,0,miopenConvolutionFwdAlgoWinograd,<unused>
128-28-28-3x3-128-28-28-64-1x1-1x1-1x1-0-NCHW-FP32-F=miopenConvolutionFwdAlgoWinograd:ConvBinWinogradRxSf2x3,0.482191,0,miopenConvolutionFwdAlgoWinograd,<unused>
128-28-28-1x1-512-28-28-64-0x0-1x1-1x1-0-NCHW-FP32-F=miopenConvolutionFwdAlgoImplicitGEMM:ConvHipImplicitGemmV4R4GenXdlopsFwdFp32,0.276585,0,miopenConvolutionFwdAlgoImplicitGEMM,<unused>;miopenConvolutionFwdAlgoDirect:ConvAsm1x1U,0.414925,0,miopenConvolutionFwdAlgoDirect,<unused>;miopenConvolutionFwdAlgoWinograd:ConvBinWinogradRxSf3x2,1.04174,0,miopenConvolutionFwdAlgoWinograd,<unused>
128-56-56-3x3-128-28-28-64-1x1-2x2-1x1-0-NCHW-FP32-F=miopenConvolutionFwdAlgoImplicitGEMM:ConvHipImplicitGemmV4R4GenXdlopsFwdFp32,0.580668,0,miopenConvolutionFwdAlgoImplicitGEMM,<unused>;miopenConvolutionFwdAlgoWinograd:ConvBinWinogradRxS,1.79483,0,miopenConvolutionFwdAlgoWinograd,<unused>;miopenConvolutionFwdAlgoDirect:ConvOclDirectFwd,4.28131,0,miopenConvolutionFwdAlgoDirect,<unused>
1280-28-28-1x1-256-28-28-64-0x0-1x1-1x1-0-NCHW-FP32-F=miopenConvolutionFwdAlgoImplicitGEMM:ConvHipImplicitGemmV4R4GenXdlopsFwdFp32,0.920904,0,miopenConvolutionFwdAlgoImplicitGEMM,<unused>;miopenConvolutionFwdAlgoDirect:ConvAsm1x1U,2.02187,0,miopenConvolutionFwdAlgoDirect,<unused>;miopenConvolutionFwdAlgoWinograd:ConvBinWinogradRxSf3x2,4.66702,0,miopenConvolutionFwdAlgoWinograd,<unused>
2048-1-1-1x1-256-1-1-64-0x0-1x1-1x1-0-NCHW-FP32-F=miopenConvolutionFwdAlgoImplicitGEMM:ConvHipImplicitGemmV4R4GenXdlopsFwdFp32,0.083534,0,miopenConvolutionFwdAlgoImplicitGEMM,<unused>;miopenConvolutionFwdAlgoDirect:ConvAsm1x1U,0.10704,0,miopenConvolutionFwdAlgoDirect,<unused>;miopenConvolutionFwdAlgoWinograd:ConvBinWinogradRxSf2x3,0.443726,0,miopenConvolutionFwdAlgoWinograd,<unused>
2048-28-28-1x1-256-28-28-64-0x0-1x1-1x1-0-NCHW-FP32-F=miopenConvolutionFwdAlgoImplicitGEMM:ConvHipImplicitGemmV4R4GenXdlopsFwdFp32,1.48944,0,miopenConvolutionFwdAlgoImplicitGEMM,<unused>;miopenConvolutionFwdAlgoDirect:ConvAsm1x1U,3.28497,0,miopenConvolutionFwdAlgoDirect,<unused>;miopenConvolutionFwdAlgoWinograd:ConvBinWinogradRxSf3x2,7.56418,0,miopenConvolutionFwdAlgoWinograd,<unused>
2048-28-28-3x3-256-28-28-64-12x12-1x1-12x12-0-NCHW-FP32-F=miopenConvolutionFwdAlgoImplicitGEMM:ConvHipImplicitGemmV4R4GenXdlopsFwdFp32,15.0838,0,miopenConvolutionFwdAlgoImplicitGEMM,<unused>
2048-28-28-3x3-256-28-28-64-24x24-1x1-24x24-0-NCHW-FP32-F=miopenConvolutionFwdAlgoImplicitGEMM:ConvHipImplicitGemmV4R4GenXdlopsFwdFp32,17.9725,0,miopenConvolutionFwdAlgoImplicitGEMM,<unused>
2048-28-28-1x1-512-28-28-64-0x0-1x1-1x1-0-NCHW-FP32-F=miopenConvolutionFwdAlgoImplicitGEMM:ConvHipImplicitGemmV4R4GenXdlopsFwdFp32,2.95368,0,miopenConvolutionFwdAlgoImplicitGEMM,<unused>;miopenConvolutionFwdAlgoDirect:ConvAsm1x1U,6.76084,0,miopenConvolutionFwdAlgoDirect,<unused>;miopenConvolutionFwdAlgoWinograd:ConvBinWinogradRxSf3x2,14.9934,0,miopenConvolutionFwdAlgoWinograd,<unused>
2048-28-28-3x3-256-28-28-64-36x36-1x1-36x36-0-NCHW-FP32-F=miopenConvolutionFwdAlgoImplicitGEMM:ConvHipImplicitGemmV4R4GenXdlopsFwdFp32,14.6464,0,miopenConvolutionFwdAlgoImplicitGEMM,<unused>
256-28-28-1x1-1024-28-28-64-0x0-1x1-1x1-0-NCHW-FP32-F=miopenConvolutionFwdAlgoImplicitGEMM:ConvHipImplicitGemmV4R4GenXdlopsFwdFp32,0.870247,0,miopenConvolutionFwdAlgoImplicitGEMM,<unused>;miopenConvolutionFwdAlgoDirect:ConvAsm1x1U,1.47276,0,miopenConvolutionFwdAlgoDirect,<unused>;miopenConvolutionFwdAlgoWinograd:ConvBinWinogradRxSf3x2,3.84813,0,miopenConvolutionFwdAlgoWinograd,<unused>
256-28-28-1x1-21-28-28-64-0x0-1x1-1x1-0-NCHW-FP32-F=miopenConvolutionFwdAlgoDirect:ConvAsm1x1U,0.069822,0,miopenConvolutionFwdAlgoDirect,<unused>;miopenConvolutionFwdAlgoWinograd:ConvBinWinogradRxSf3x2,0.166048,0,miopenConvolutionFwdAlgoWinograd,<unused>
256-28-28-3x3-256-28-28-64-1x1-1x1-1x1-0-NCHW-FP32-F=miopenConvolutionFwdAlgoWinograd:ConvBinWinograd3x3U,1.6681,0,miopenConvolutionFwdAlgoWinograd,<unused>
256-28-28-3x3-256-28-28-64-2x2-1x1-2x2-0-NCHW-FP32-F=miopenConvolutionFwdAlgoImplicitGEMM:ConvHipImplicitGemmV4R4GenXdlopsFwdFp32,1.74205,0,miopenConvolutionFwdAlgoImplicitGEMM,<unused>
256-56-56-1x1-128-56-56-64-0x0-1x1-1x1-0-NCHW-FP32-F=miopenConvolutionFwdAlgoImplicitGEMM:ConvHipImplicitGemmV4R4GenXdlopsFwdFp32,0.443707,0,miopenConvolutionFwdAlgoImplicitGEMM,<unused>;miopenConvolutionFwdAlgoDirect:ConvAsm1x1U,0.758882,0,miopenConvolutionFwdAlgoDirect,<unused>;miopenConvolutionFwdAlgoWinograd:ConvBinWinogradRxSf3x2,1.67943,0,miopenConvolutionFwdAlgoWinograd,<unused>
256-56-56-1x1-512-28-28-64-0x0-2x2-1x1-0-NCHW-FP32-F=miopenConvolutionFwdAlgoImplicitGEMM:ConvHipImplicitGemmV4R4GenXdlopsFwdFp32,0.699462,0,miopenConvolutionFwdAlgoImplicitGEMM,<unused>;miopenConvolutionFwdAlgoDirect:ConvAsm1x1U,0.962646,51380224,miopenConvolutionFwdAlgoDirect,<unused>;miopenConvolutionFwdAlgoWinograd:ConvBinWinogradRxSf2x3,6.70004,0,miopenConvolutionFwdAlgoWinograd,<unused>
256-56-56-1x1-64-56-56-64-0x0-1x1-1x1-0-NCHW-FP32-F=miopenConvolutionFwdAlgoImplicitGEMM:ConvHipImplicitGemmV4R4GenXdlopsFwdFp32,0.344555,0,miopenConvolutionFwdAlgoImplicitGEMM,<unused>;miopenConvolutionFwdAlgoDirect:ConvAsm1x1U,0.396107,0,miopenConvolutionFwdAlgoDirect,<unused>;miopenConvolutionFwdAlgoWinograd:ConvBinWinogradRxSf3x2,0.943638,0,miopenConvolutionFwdAlgoWinograd,<unused>
3-224-224-7x7-64-112-112-64-3x3-2x2-1x1-0-NCHW-FP32-F=miopenConvolutionFwdAlgoDirect:ConvAsm7x7c3h224w224k64u2v2p3q3f1,0.963452,0,miopenConvolutionFwdAlgoDirect,<unused>;miopenConvolutionFwdAlgoWinograd:ConvBinWinogradRxS,1.344,0,miopenConvolutionFwdAlgoWinograd,<unused>
512-28-28-1x1-1024-28-28-64-0x0-1x1-1x1-0-NCHW-FP32-F=miopenConvolutionFwdAlgoImplicitGEMM:ConvHipImplicitGemmV4R4GenXdlopsFwdFp32,1.55022,0,miopenConvolutionFwdAlgoImplicitGEMM,<unused>;miopenConvolutionFwdAlgoDirect:ConvAsm1x1U,3.26115,0,miopenConvolutionFwdAlgoDirect,<unused>;miopenConvolutionFwdAlgoWinograd:ConvBinWinogradRxSf3x2,7.58873,0,miopenConvolutionFwdAlgoWinograd,<unused>
512-28-28-1x1-128-28-28-64-0x0-1x1-1x1-0-NCHW-FP32-F=miopenConvolutionFwdAlgoImplicitGEMM:ConvHipImplicitGemmV4R4GenXdlopsFwdFp32,0.238426,0,miopenConvolutionFwdAlgoImplicitGEMM,<unused>;miopenConvolutionFwdAlgoDirect:ConvAsm1x1U,0.421565,0,miopenConvolutionFwdAlgoDirect,<unused>;miopenConvolutionFwdAlgoWinograd:ConvBinWinogradRxSf3x2,0.981857,0,miopenConvolutionFwdAlgoWinograd,<unused>
512-28-28-1x1-2048-28-28-64-0x0-1x1-1x1-0-NCHW-FP32-F=miopenConvolutionFwdAlgoImplicitGEMM:ConvHipImplicitGemmV4R4GenXdlopsFwdFp32,3.07276,0,miopenConvolutionFwdAlgoImplicitGEMM,<unused>;miopenConvolutionFwdAlgoDirect:ConvAsm1x1U,6.3583,0,miopenConvolutionFwdAlgoDirect,<unused>;miopenConvolutionFwdAlgoWinograd:ConvBinWinogradRxSf3x2,15.4174,0,miopenConvolutionFwdAlgoWinograd,<unused>
512-28-28-1x1-256-28-28-64-0x0-1x1-1x1-0-NCHW-FP32-F=miopenConvolutionFwdAlgoImplicitGEMM:ConvHipImplicitGemmV4R4GenXdlopsFwdFp32,0.413751,0,miopenConvolutionFwdAlgoImplicitGEMM,<unused>;miopenConvolutionFwdAlgoDirect:ConvAsm1x1U,0.793997,0,miopenConvolutionFwdAlgoDirect,<unused>;miopenConvolutionFwdAlgoWinograd:ConvBinWinogradRxSf3x2,1.85224,0,miopenConvolutionFwdAlgoWinograd,<unused>
512-28-28-3x3-512-28-28-64-4x4-1x1-4x4-0-NCHW-FP32-F=miopenConvolutionFwdAlgoImplicitGEMM:ConvHipImplicitGemmV4R4GenXdlopsFwdFp32,6.50687,0,miopenConvolutionFwdAlgoImplicitGEMM,<unused>
512-28-28-3x3-512-28-28-64-2x2-1x1-2x2-0-NCHW-FP32-F=miopenConvolutionFwdAlgoImplicitGEMM:ConvHipImplicitGemmV4R4GenXdlopsFwdFp32,6.84852,0,miopenConvolutionFwdAlgoImplicitGEMM,<unused>
64-56-56-1x1-256-56-56-64-0x0-1x1-1x1-0-NCHW-FP32-F=miopenConvolutionFwdAlgoImplicitGEMM:ConvHipImplicitGemmV4R4GenXdlopsFwdFp32,0.362164,0,miopenConvolutionFwdAlgoImplicitGEMM,<unused>;miopenConvolutionFwdAlgoDirect:ConvAsm1x1U,0.414245,0,miopenConvolutionFwdAlgoDirect,<unused>;miopenConvolutionFwdAlgoWinograd:ConvBinWinogradRxSf3x2,1.04714,0,miopenConvolutionFwdAlgoWinograd,<unused>
64-56-56-1x1-64-56-56-64-0x0-1x1-1x1-0-NCHW-FP32-F=miopenConvolutionFwdAlgoDirect:ConvAsm1x1U,0.120326,0,miopenConvolutionFwdAlgoDirect,<unused>;miopenConvolutionFwdAlgoImplicitGEMM:ConvHipImplicitGemmV4R4GenXdlopsFwdFp32,0.126361,0,miopenConvolutionFwdAlgoImplicitGEMM,<unused>;miopenConvolutionFwdAlgoWinograd:ConvBinWinogradRxSf3x2,0.306701,0,miopenConvolutionFwdAlgoWinograd,<unused>
64-56-56-3x3-64-56-56-64-1x1-1x1-1x1-0-NCHW-FP32-F=miopenConvolutionFwdAlgoWinograd:ConvBinWinogradRxSf2x3,0.50056,0,miopenConvolutionFwdAlgoWinograd,<unused>
1024-28-28-1x1-2048-28-28-32-0x0-1x1-1x1-0-NCHW-FP32-F=miopenConvolutionFwdAlgoImplicitGEMM:ConvHipImplicitGemmV4R4GenXdlopsFwdFp32,2.92395,0,miopenConvolutionFwdAlgoImplicitGEMM,<unused>;miopenConvolutionFwdAlgoDirect:ConvAsm1x1U,6.47421,0,miopenConvolutionFwdAlgoDirect,<unused>;miopenConvolutionFwdAlgoWinograd:ConvBinWinogradRxSf3x2,15.1878,0,miopenConvolutionFwdAlgoWinograd,<unused>
1024-28-28-1x1-256-28-28-32-0x0-1x1-1x1-0-NCHW-FP32-F=miopenConvolutionFwdAlgoImplicitGEMM:ConvHipImplicitGemmV4R4GenXdlopsFwdFp32,0.44515,0,miopenConvolutionFwdAlgoImplicitGEMM,<unused>;miopenConvolutionFwdAlgoDirect:ConvAsm1x1U,0.833598,0,miopenConvolutionFwdAlgoDirect,<unused>;miopenConvolutionFwdAlgoWinograd:ConvBinWinogradRxSf3x2,1.81482,0,miopenConvolutionFwdAlgoWinograd,<unused>
1024-28-28-1x1-512-28-28-32-0x0-1x1-1x1-0-NCHW-FP32-F=miopenConvolutionFwdAlgoImplicitGEMM:ConvHipImplicitGemmV4R4GenXdlopsFwdFp32,0.767964,0,miopenConvolutionFwdAlgoImplicitGEMM,<unused>;miopenConvolutionFwdAlgoDirect:ConvAsm1x1U,1.60893,0,miopenConvolutionFwdAlgoDirect,<unused>;miopenConvolutionFwdAlgoWinograd:ConvBinWinogradRxSf3x2,3.68639,0,miopenConvolutionFwdAlgoWinograd,<unused>
128-28-28-3x3-128-28-28-32-1x1-1x1-1x1-0-NCHW-FP32-F=miopenConvolutionFwdAlgoWinograd:ConvBinWinogradRxSf2x3,0.253042,0,miopenConvolutionFwdAlgoWinograd,<unused>
128-28-28-1x1-512-28-28-32-0x0-1x1-1x1-0-NCHW-FP32-F=miopenConvolutionFwdAlgoImplicitGEMM:ConvHipImplicitGemmV4R4GenXdlopsFwdFp32,0.142855,0,miopenConvolutionFwdAlgoImplicitGEMM,<unused>;miopenConvolutionFwdAlgoDirect:ConvAsm1x1U,0.2186,0,miopenConvolutionFwdAlgoDirect,<unused>;miopenConvolutionFwdAlgoWinograd:ConvBinWinogradRxSf3x2,0.56003,0,miopenConvolutionFwdAlgoWinograd,<unused>
128-56-56-3x3-128-28-28-32-1x1-2x2-1x1-0-NCHW-FP32-F=miopenConvolutionFwdAlgoImplicitGEMM:ConvHipImplicitGemmV4R4GenXdlopsFwdFp32,0.298333,0,miopenConvolutionFwdAlgoImplicitGEMM,<unused>;miopenConvolutionFwdAlgoWinograd:ConvBinWinogradRxSf2x3,0.922172,0,miopenConvolutionFwdAlgoWinograd,<unused>;miopenConvolutionFwdAlgoDirect:ConvOclDirectFwd,2.50341,0,miopenConvolutionFwdAlgoDirect,<unused>
1280-28-28-1x1-256-28-28-32-0x0-1x1-1x1-0-NCHW-FP32-F=miopenConvolutionFwdAlgoImplicitGEMM:ConvHipImplicitGemmV4R4GenXdlopsFwdFp32,0.538624,0,miopenConvolutionFwdAlgoImplicitGEMM,<unused>;miopenConvolutionFwdAlgoDirect:ConvAsm1x1U,1.02429,0,miopenConvolutionFwdAlgoDirect,<unused>;miopenConvolutionFwdAlgoWinograd:ConvBinWinogradRxSf3x2,2.22911,0,miopenConvolutionFwdAlgoWinograd,<unused>
2048-1-1-1x1-256-1-1-32-0x0-1x1-1x1-0-NCHW-FP32-F=miopenConvolutionFwdAlgoDirect:ConvAsm1x1U,0.075345,0,miopenConvolutionFwdAlgoDirect,<unused>;miopenConvolutionFwdAlgoImplicitGEMM:ConvHipImplicitGemmV4R4GenXdlopsFwdFp32,0.083692,0,miopenConvolutionFwdAlgoImplicitGEMM,<unused>;miopenConvolutionFwdAlgoWinograd:ConvBinWinogradRxSf2x3,0.442041,0,miopenConvolutionFwdAlgoWinograd,<unused>
2048-28-28-1x1-256-28-28-32-0x0-1x1-1x1-0-NCHW-FP32-F=miopenConvolutionFwdAlgoImplicitGEMM:ConvHipImplicitGemmV4R4GenXdlopsFwdFp32,0.842795,0,miopenConvolutionFwdAlgoImplicitGEMM,<unused>;miopenConvolutionFwdAlgoDirect:ConvAsm1x1U,1.69774,0,miopenConvolutionFwdAlgoDirect,<unused>;miopenConvolutionFwdAlgoWinograd:ConvBinWinogradRxSf3x2,3.68758,0,miopenConvolutionFwdAlgoWinograd,<unused>
2048-28-28-3x3-256-28-28-32-12x12-1x1-12x12-0-NCHW-FP32-F=miopenConvolutionFwdAlgoImplicitGEMM:ConvHipImplicitGemmV4R4GenXdlopsFwdFp32,7.78586,0,miopenConvolutionFwdAlgoImplicitGEMM,<unused>
2048-28-28-3x3-256-28-28-32-24x24-1x1-24x24-0-NCHW-FP32-F=miopenConvolutionFwdAlgoImplicitGEMM:ConvHipImplicitGemmV4R4GenXdlopsFwdFp32,7.67113,0,miopenConvolutionFwdAlgoImplicitGEMM,<unused>
2048-28-28-3x3-256-28-28-32-36x36-1x1-36x36-0-NCHW-FP32-F=miopenConvolutionFwdAlgoImplicitGEMM:ConvHipImplicitGemmV4R4GenXdlopsFwdFp32,7.59444,0,miopenConvolutionFwdAlgoImplicitGEMM,<unused>
2048-28-28-1x1-512-28-28-32-0x0-1x1-1x1-0-NCHW-FP32-F=miopenConvolutionFwdAlgoImplicitGEMM:ConvHipImplicitGemmV4R4GenXdlopsFwdFp32,1.48848,0,miopenConvolutionFwdAlgoImplicitGEMM,<unused>;miopenConvolutionFwdAlgoDirect:ConvAsm1x1U,3.26102,0,miopenConvolutionFwdAlgoDirect,<unused>;miopenConvolutionFwdAlgoWinograd:ConvBinWinogradRxSf3x2,7.54672,0,miopenConvolutionFwdAlgoWinograd,<unused>
256-28-28-1x1-1024-28-28-32-0x0-1x1-1x1-0-NCHW-FP32-F=miopenConvolutionFwdAlgoImplicitGEMM:ConvHipImplicitGemmV4R4GenXdlopsFwdFp32,0.45604,0,miopenConvolutionFwdAlgoImplicitGEMM,<unused>;miopenConvolutionFwdAlgoDirect:ConvAsm1x1U,0.772465,0,miopenConvolutionFwdAlgoDirect,<unused>;miopenConvolutionFwdAlgoWinograd:ConvBinWinogradRxSf3x2,1.8198,0,miopenConvolutionFwdAlgoWinograd,<unused>
256-28-28-1x1-21-28-28-32-0x0-1x1-1x1-0-NCHW-FP32-F=miopenConvolutionFwdAlgoDirect:ConvAsm1x1U,0.039419,0,miopenConvolutionFwdAlgoDirect,<unused>;miopenConvolutionFwdAlgoWinograd:ConvBinWinogradRxSf3x2,0.100698,0,miopenConvolutionFwdAlgoWinograd,<unused>
256-28-28-3x3-256-28-28-32-1x1-1x1-1x1-0-NCHW-FP32-F=miopenConvolutionFwdAlgoWinograd:ConvBinWinogradRxSf2x3,0.903186,0,miopenConvolutionFwdAlgoWinograd,<unused>
256-28-28-3x3-256-28-28-32-2x2-1x1-2x2-0-NCHW-FP32-F=miopenConvolutionFwdAlgoImplicitGEMM:ConvHipImplicitGemmV4R4GenXdlopsFwdFp32,0.982021,0,miopenConvolutionFwdAlgoImplicitGEMM,<unused>
256-56-56-1x1-64-56-56-32-0x0-1x1-1x1-0-NCHW-FP32-F=miopenConvolutionFwdAlgoImplicitGEMM:ConvHipImplicitGemmV4R4GenXdlopsFwdFp32,0.184497,0,miopenConvolutionFwdAlgoImplicitGEMM,<unused>;miopenConvolutionFwdAlgoDirect:ConvAsm1x1U,0.221952,0,miopenConvolutionFwdAlgoDirect,<unused>;miopenConvolutionFwdAlgoWinograd:ConvBinWinogradRxSf3x2,0.523872,0,miopenConvolutionFwdAlgoWinograd,<unused>
512-28-28-1x1-128-28-28-32-0x0-1x1-1x1-0-NCHW-FP32-F=miopenConvolutionFwdAlgoImplicitGEMM:ConvHipImplicitGemmV4R4GenXdlopsFwdFp32,0.122201,0,miopenConvolutionFwdAlgoImplicitGEMM,<unused>;miopenConvolutionFwdAlgoDirect:ConvAsm1x1U,0.249629,0,miopenConvolutionFwdAlgoDirect,<unused>;miopenConvolutionFwdAlgoWinograd:ConvBinWinogradRxSf3x2,0.572767,0,miopenConvolutionFwdAlgoWinograd,<unused>
512-28-28-1x1-2048-28-28-32-0x0-1x1-1x1-0-NCHW-FP32-F=miopenConvolutionFwdAlgoImplicitGEMM:ConvHipImplicitGemmV4R4GenXdlopsFwdFp32,1.5514,0,miopenConvolutionFwdAlgoImplicitGEMM,<unused>;miopenConvolutionFwdAlgoDirect:ConvAsm1x1U,3.09256,0,miopenConvolutionFwdAlgoDirect,<unused>;miopenConvolutionFwdAlgoWinograd:ConvBinWinogradRxSf3x2,7.5312,0,miopenConvolutionFwdAlgoWinograd,<unused>
512-28-28-3x3-512-28-28-32-2x2-1x1-2x2-0-NCHW-FP32-F=miopenConvolutionFwdAlgoImplicitGEMM:ConvHipImplicitGemmV4R4GenXdlopsFwdFp32,3.394,0,miopenConvolutionFwdAlgoImplicitGEMM,<unused>
512-28-28-3x3-512-28-28-32-4x4-1x1-4x4-0-NCHW-FP32-F=miopenConvolutionFwdAlgoImplicitGEMM:ConvHipImplicitGemmV4R4GenXdlopsFwdFp32,3.25134,0,miopenConvolutionFwdAlgoImplicitGEMM,<unused>
64-56-56-1x1-64-56-56-32-0x0-1x1-1x1-0-NCHW-FP32-F=miopenConvolutionFwdAlgoDirect:ConvAsm1x1U,0.064555,0,miopenConvolutionFwdAlgoDirect,<unused>;miopenConvolutionFwdAlgoImplicitGEMM:ConvHipImplicitGemmV4R4GenXdlopsFwdFp32,0.067287,0,miopenConvolutionFwdAlgoImplicitGEMM,<unused>;miopenConvolutionFwdAlgoWinograd:ConvBinWinogradRxSf3x2,0.179828,0,miopenConvolutionFwdAlgoWinograd,<unused>
64-56-56-3x3-64-56-56-32-1x1-1x1-1x1-0-NCHW-FP32-F=miopenConvolutionFwdAlgoWinograd:ConvBinWinogradRxSf2x3,0.261331,0,miopenConvolutionFwdAlgoWinograd,<unused>
1024-14-14-1x1-2048-7-7-128-0x0-2x2-1x1-0-NCHW-FP16-F=miopenConvolutionFwdAlgoImplicitGEMM:ConvHipImplicitGemmV4R4GenFwdXdlops,0.689459,0,miopenConvolutionFwdAlgoImplicitGEMM,<unused>;miopenConvolutionFwdAlgoDirect:ConvAsm1x1U,1.67389,12845056,miopenConvolutionFwdAlgoDirect,<unused>;miopenConvolutionFwdAlgoWinograd:ConvBinWinogradRxS,13.3583,0,miopenConvolutionFwdAlgoWinograd,<unused>
1024-14-14-1x1-256-14-14-128-0x0-1x1-1x1-0-NCHW-FP16-F=miopenConvolutionFwdAlgoImplicitGEMM:ConvHipImplicitGemmV4R4GenFwdXdlops,0.151873,0,miopenConvolutionFwdAlgoImplicitGEMM,<unused>;miopenConvolutionFwdAlgoDirect:ConvAsm1x1U,0.618677,0,miopenConvolutionFwdAlgoDirect,<unused>;miopenConvolutionFwdAlgoWinograd:ConvBinWinogradRxS,2.43151,0,miopenConvolutionFwdAlgoWinograd,<unused>
1024-14-14-1x1-512-7-7-128-0x0-2x2-1x1-0-NCHW-FP16-F=miopenConvolutionFwdAlgoImplicitGEMM:ConvHipImplicitGemmV4R4GenFwdXdlops,0.194935,0,miopenConvolutionFwdAlgoImplicitGEMM,<unused>;miopenConvolutionFwdAlgoDirect:ConvAsm1x1U,0.53966,12845056,miopenConvolutionFwdAlgoDirect,<unused>;miopenConvolutionFwdAlgoWinograd:ConvBinWinogradRxS,3.25041,0,miopenConvolutionFwdAlgoWinograd,<unused>
128-28-28-3x3-128-28-28-128-1x1-1x1-1x1-0-NCHW-FP16-F=miopenConvolutionFwdAlgoImplicitGEMM:ConvHipImplicitGemmV4R4GenFwdXdlops,0.520036,0,miopenConvolutionFwdAlgoImplicitGEMM,<unused>;miopenConvolutionFwdAlgoWinograd:ConvBinWinogradRxS,0.576275,0,miopenConvolutionFwdAlgoWinograd,<unused>;miopenConvolutionFwdAlgoDirect:ConvOclDirectFwd,2.39675,0,miopenConvolutionFwdAlgoDirect,<unused>
128-28-28-1x1-512-28-28-128-0x0-1x1-1x1-0-NCHW-FP16-F=miopenConvolutionFwdAlgoImplicitGEMM:ConvHipImplicitGemmV4R4GenFwdXdlops,0.188321,0,miopenConvolutionFwdAlgoImplicitGEMM,<unused>;miopenConvolutionFwdAlgoDirect:ConvAsm1x1U,0.517633,0,miopenConvolutionFwdAlgoDirect,<unused>;miopenConvolutionFwdAlgoWinograd:ConvBinWinogradRxS,2.12663,0,miopenConvolutionFwdAlgoWinograd,<unused>
2048-7-7-1x1-512-7-7-128-0x0-1x1-1x1-0-NCHW-FP16-F=miopenConvolutionFwdAlgoImplicitGEMM:ConvHipImplicitGemmV4R4GenFwdXdlops,0.293339,0,miopenConvolutionFwdAlgoImplicitGEMM,<unused>;miopenConvolutionFwdAlgoDirect:ConvAsm1x1U,0.940512,0,miopenConvolutionFwdAlgoDirect,<unused>;miopenConvolutionFwdAlgoWinograd:ConvBinWinogradRxS,3.35985,0,miopenConvolutionFwdAlgoWinograd,<unused>
256-14-14-1x1-1024-14-14-128-0x0-1x1-1x1-0-NCHW-FP16-F=miopenConvolutionFwdAlgoImplicitGEMM:ConvHipImplicitGemmV4R4GenFwdXdlops,0.160281,0,miopenConvolutionFwdAlgoImplicitGEMM,<unused>;miopenConvolutionFwdAlgoDirect:ConvAsm1x1U,0.59556,0,miopenConvolutionFwdAlgoDirect,<unused>;miopenConvolutionFwdAlgoWinograd:ConvBinWinogradRxS,2.30926,0,miopenConvolutionFwdAlgoWinograd,<unused>
256-14-14-3x3-256-14-14-128-1x1-1x1-1x1-0-NCHW-FP16-F=miopenConvolutionFwdAlgoImplicitGEMM:ConvHipImplicitGemmV4R4GenFwdXdlops,0.57784,0,miopenConvolutionFwdAlgoImplicitGEMM,<unused>;miopenConvolutionFwdAlgoWinograd:ConvBinWinogradRxS,0.590338,0,miopenConvolutionFwdAlgoWinograd,<unused>;miopenConvolutionFwdAlgoDirect:ConvOclDirectFwd,2.9201,0,miopenConvolutionFwdAlgoDirect,<unused>
256-56-56-1x1-128-28-28-128-0x0-2x2-1x1-0-NCHW-FP16-F=miopenConvolutionFwdAlgoImplicitGEMM:ConvHipImplicitGemmV4R4GenFwdXdlops,0.209055,0,miopenConvolutionFwdAlgoImplicitGEMM,<unused>;miopenConvolutionFwdAlgoDirect:ConvAsm1x1U,0.499598,51380224,miopenConvolutionFwdAlgoDirect,<unused>;miopenConvolutionFwdAlgoWinograd:ConvBinWinogradRxS,2.14722,0,miopenConvolutionFwdAlgoWinograd,<unused>
256-56-56-1x1-512-28-28-128-0x0-2x2-1x1-0-NCHW-FP16-F=miopenConvolutionFwdAlgoImplicitGEMM:ConvHipImplicitGemmV4R4GenFwdXdlops,0.537992,0,miopenConvolutionFwdAlgoImplicitGEMM,<unused>;miopenConvolutionFwdAlgoDirect:ConvAsm1x1U,1.30571,51380224,miopenConvolutionFwdAlgoDirect,<unused>;miopenConvolutionFwdAlgoWinograd:ConvBinWinogradRxS,8.76064,0,miopenConvolutionFwdAlgoWinograd,<unused>
256-56-56-1x1-64-56-56-128-0x0-1x1-1x1-0-NCHW-FP16-F=miopenConvolutionFwdAlgoImplicitGEMM:ConvHipImplicitGemmV4R4GenFwdXdlops,0.310291,0,miopenConvolutionFwdAlgoImplicitGEMM,<unused>;miopenConvolutionFwdAlgoDirect:ConvAsm1x1U,0.48834,0,miopenConvolutionFwdAlgoDirect,<unused>;miopenConvolutionFwdAlgoWinograd:ConvBinWinogradRxS,2.0425,0,miopenConvolutionFwdAlgoWinograd,<unused>
3-230-230-7x7-64-112-112-128-0x0-2x2-1x1-0-NCHW-FP16-F=miopenConvolutionFwdAlgoDirect:ConvOclDirectFwdGen,3.28821,0,miopenConvolutionFwdAlgoDirect,<unused>
512-28-28-1x1-1024-14-14-128-0x0-2x2-1x1-0-NCHW-FP16-F=miopenConvolutionFwdAlgoImplicitGEMM:ConvHipImplicitGemmV4R4GenFwdXdlops,0.619514,0,miopenConvolutionFwdAlgoImplicitGEMM,<unused>;miopenConvolutionFwdAlgoDirect:ConvAsm1x1U,1.3047,25690112,miopenConvolutionFwdAlgoDirect,<unused>;miopenConvolutionFwdAlgoWinograd:ConvBinWinogradRxS,9.40921,0,miopenConvolutionFwdAlgoWinograd,<unused>
512-28-28-1x1-128-28-28-128-0x0-1x1-1x1-0-NCHW-FP16-F=miopenConvolutionFwdAlgoImplicitGEMM:ConvHipImplicitGemmV4R4GenFwdXdlops,0.173874,0,miopenConvolutionFwdAlgoImplicitGEMM,<unused>;miopenConvolutionFwdAlgoDirect:ConvAsm1x1U,0.56758,0,miopenConvolutionFwdAlgoDirect,<unused>;miopenConvolutionFwdAlgoWinograd:ConvBinWinogradRxS,2.13641,0,miopenConvolutionFwdAlgoWinograd,<unused>
512-28-28-1x1-256-14-14-128-0x0-2x2-1x1-0-NCHW-FP16-F=miopenConvolutionFwdAlgoImplicitGEMM:ConvHipImplicitGemmV4R4GenFwdXdlops,0.18557,0,miopenConvolutionFwdAlgoImplicitGEMM,<unused>;miopenConvolutionFwdAlgoDirect:ConvAsm1x1U,0.45775,25690112,miopenConvolutionFwdAlgoDirect,<unused>;miopenConvolutionFwdAlgoWinograd:ConvBinWinogradRxS,2.37591,0,miopenConvolutionFwdAlgoWinograd,<unused>
512-7-7-1x1-2048-7-7-128-0x0-1x1-1x1-0-NCHW-FP16-F=miopenConvolutionFwdAlgoImplicitGEMM:ConvHipImplicitGemmV4R4GenFwdXdlops,0.251463,0,miopenConvolutionFwdAlgoImplicitGEMM,<unused>;miopenConvolutionFwdAlgoDirect:ConvAsm1x1U,0.834594,0,miopenConvolutionFwdAlgoDirect,<unused>;miopenConvolutionFwdAlgoWinograd:ConvBinWinogradRxS,3.28542,0,miopenConvolutionFwdAlgoWinograd,<unused>
512-7-7-3x3-512-7-7-128-1x1-1x1-1x1-0-NCHW-FP16-F=miopenConvolutionFwdAlgoImplicitGEMM:ConvHipImplicitGemmV4R4GenFwdXdlops,0.589565,0,miopenConvolutionFwdAlgoImplicitGEMM,<unused>;miopenConvolutionFwdAlgoWinograd:ConvBinWinogradRxS,0.750482,0,miopenConvolutionFwdAlgoWinograd,<unused>;miopenConvolutionFwdAlgoDirect:ConvOclDirectFwd,5.01278,0,miopenConvolutionFwdAlgoDirect,<unused>
64-56-56-1x1-256-56-56-128-0x0-1x1-1x1-0-NCHW-FP16-F=miopenConvolutionFwdAlgoImplicitGEMM:ConvHipImplicitGemmV4R4GenFwdXdlops,0.291779,0,miopenConvolutionFwdAlgoImplicitGEMM,<unused>;miopenConvolutionFwdAlgoDirect:ConvAsm1x1U,0.564706,0,miopenConvolutionFwdAlgoDirect,<unused>;miopenConvolutionFwdAlgoWinograd:ConvBinWinogradRxS,2.20553,0,miopenConvolutionFwdAlgoWinograd,<unused>
64-56-56-1x1-64-56-56-128-0x0-1x1-1x1-0-NCHW-FP16-F=miopenConvolutionFwdAlgoImplicitGEMM:ConvHipImplicitGemmV4R4GenFwdXdlops,0.116011,0,miopenConvolutionFwdAlgoImplicitGEMM,<unused>;miopenConvolutionFwdAlgoDirect:ConvAsm1x1U,0.146824,0,miopenConvolutionFwdAlgoDirect,<unused>;miopenConvolutionFwdAlgoWinograd:ConvBinWinogradRxS,0.607562,0,miopenConvolutionFwdAlgoWinograd,<unused>
64-56-56-3x3-64-56-56-128-1x1-1x1-1x1-0-NCHW-FP16-F=miopenConvolutionFwdAlgoWinograd:ConvBinWinogradRxS,0.601731,0,miopenConvolutionFwdAlgoWinograd,<unused>;miopenConvolutionFwdAlgoImplicitGEMM:ConvHipImplicitGemmV4R4GenFwdXdlops,0.78152,0,miopenConvolutionFwdAlgoImplicitGEMM,<unused>;miopenConvolutionFwdAlgoDirect:ConvOclDirectFwd,2.6983,0,miopenConvolutionFwdAlgoDirect,<unused>
1024-28-28-1x1-2048-28-28-64-0x0-1x1-1x1-0-NCHW-FP16-F=miopenConvolutionFwdAlgoImplicitGEMM:ConvHipImplicitGemmV4R4GenFwdXdlops,1.83719,0,miopenConvolutionFwdAlgoImplicitGEMM,<unused>;miopenConvolutionFwdAlgoDirect:ConvAsm1x1U,8.24741,0,miopenConvolutionFwdAlgoDirect,<unused>;miopenConvolutionFwdAlgoWinograd:ConvBinWinogradRxS,35.93,0,miopenConvolutionFwdAlgoWinograd,<unused>
1024-28-28-1x1-256-28-28-64-0x0-1x1-1x1-0-NCHW-FP16-F=miopenConvolutionFwdAlgoImplicitGEMM:ConvHipImplicitGemmV4R4GenFwdXdlops,0.251693,0,miopenConvolutionFwdAlgoImplicitGEMM,<unused>;miopenConvolutionFwdAlgoDirect:ConvAsm1x1U,1.12108,0,miopenConvolutionFwdAlgoDirect,<unused>;miopenConvolutionFwdAlgoWinograd:ConvBinWinogradRxS,4.4644,0,miopenConvolutionFwdAlgoWinograd,<unused>
1024-28-28-1x1-512-28-28-64-0x0-1x1-1x1-0-NCHW-FP16-F=miopenConvolutionFwdAlgoImplicitGEMM:ConvHipImplicitGemmV4R4GenFwdXdlops,0.465321,0,miopenConvolutionFwdAlgoImplicitGEMM,<unused>;miopenConvolutionFwdAlgoDirect:ConvAsm1x1U,2.09118,0,miopenConvolutionFwdAlgoDirect,<unused>;miopenConvolutionFwdAlgoWinograd:ConvBinWinogradRxS,8.88754,0,miopenConvolutionFwdAlgoWinograd,<unused>
128-28-28-3x3-128-28-28-64-1x1-1x1-1x1-0-NCHW-FP16-F=miopenConvolutionFwdAlgoImplicitGEMM:ConvHipImplicitGemmV4R4GenFwdXdlops,0.299572,0,miopenConvolutionFwdAlgoImplicitGEMM,<unused>;miopenConvolutionFwdAlgoWinograd:ConvBinWinogradRxS,0.317499,0,miopenConvolutionFwdAlgoWinograd,<unused>;miopenConvolutionFwdAlgoDirect:ConvOclDirectFwd,1.29728,0,miopenConvolutionFwdAlgoDirect,<unused>
128-28-28-1x1-512-28-28-64-0x0-1x1-1x1-0-NCHW-FP16-F=miopenConvolutionFwdAlgoImplicitGEMM:ConvHipImplicitGemmV4R4GenFwdXdlops,0.100792,0,miopenConvolutionFwdAlgoImplicitGEMM,<unused>;miopenConvolutionFwdAlgoDirect:ConvAsm1x1U,0.26635,0,miopenConvolutionFwdAlgoDirect,<unused>;miopenConvolutionFwdAlgoWinograd:ConvBinWinogradRxS,1.13164,0,miopenConvolutionFwdAlgoWinograd,<unused>
128-56-56-3x3-128-28-28-64-1x1-2x2-1x1-0-NCHW-FP16-F=miopenConvolutionFwdAlgoImplicitGEMM:ConvHipImplicitGemmV4R4GenFwdXdlops,0.319518,0,miopenConvolutionFwdAlgoImplicitGEMM,<unused>;miopenConvolutionFwdAlgoWinograd:ConvBinWinogradRxS,1.26353,0,miopenConvolutionFwdAlgoWinograd,<unused>;miopenConvolutionFwdAlgoDirect:ConvOclDirectFwdGen,3.13102,0,miopenConvolutionFwdAlgoDirect,<unused>
1280-28-28-1x1-256-28-28-64-0x0-1x1-1x1-0-NCHW-FP16-F=miopenConvolutionFwdAlgoImplicitGEMM:ConvHipImplicitGemmV4R4GenFwdXdlops,0.296108,0,miopenConvolutionFwdAlgoImplicitGEMM,<unused>;miopenConvolutionFwdAlgoDirect:ConvAsm1x1U,1.54852,0,miopenConvolutionFwdAlgoDirect,<unused>;miopenConvolutionFwdAlgoWinograd:ConvBinWinogradRxS,5.59481,0,miopenConvolutionFwdAlgoWinograd,<unused>
2048-1-1-1x1-256-1-1-64-0x0-1x1-1x1-0-NCHW-FP16-F=miopenConvolutionFwdAlgoImplicitGEMM:ConvHipImplicitGemmV4R4GenFwdXdlops,0.178585,0,miopenConvolutionFwdAlgoImplicitGEMM,<unused>;miopenConvolutionFwdAlgoWinograd:ConvBinWinogradRxS,0.421767,0,miopenConvolutionFwdAlgoWinograd,<unused>
2048-28-28-1x1-256-28-28-64-0x0-1x1-1x1-0-NCHW-FP16-F=miopenConvolutionFwdAlgoImplicitGEMM:ConvHipImplicitGemmV4R4GenFwdXdlops,0.515986,0,miopenConvolutionFwdAlgoImplicitGEMM,<unused>;miopenConvolutionFwdAlgoDirect:ConvAsm1x1U,2.25121,0,miopenConvolutionFwdAlgoDirect,<unused>;miopenConvolutionFwdAlgoWinograd:ConvBinWinogradRxS,9.01258,0,miopenConvolutionFwdAlgoWinograd,<unused>
2048-28-28-3x3-256-28-28-64-12x12-1x1-12x12-0-NCHW-FP16-F=miopenConvolutionFwdAlgoImplicitGEMM:ConvHipImplicitGemmV4R4GenFwdXdlops,6.71184,0,miopenConvolutionFwdAlgoImplicitGEMM,<unused>
2048-28-28-3x3-256-28-28-64-24x24-1x1-24x24-0-NCHW-FP16-F=miopenConvolutionFwdAlgoImplicitGEMM:ConvHipImplicitGemmV4R4GenFwdXdlops,6.45436,0,miopenConvolutionFwdAlgoImplicitGEMM,<unused>
2048-28-28-3x3-256-28-28-64-36x36-1x1-36x36-0-NCHW-FP16-F=miopenConvolutionFwdAlgoImplicitGEMM:ConvHipImplicitGemmV4R4GenFwdXdlops,5.11796,0,miopenConvolutionFwdAlgoImplicitGEMM,<unused>
2048-28-28-1x1-512-28-28-64-0x0-1x1-1x1-0-NCHW-FP16-F=miopenConvolutionFwdAlgoImplicitGEMM:ConvHipImplicitGemmV4R4GenFwdXdlops,0.954685,0,miopenConvolutionFwdAlgoImplicitGEMM,<unused>;miopenConvolutionFwdAlgoDirect:ConvAsm1x1U,4.35387,0,miopenConvolutionFwdAlgoDirect,<unused>;miopenConvolutionFwdAlgoWinograd:ConvBinWinogradRxS,17.935,0,miopenConvolutionFwdAlgoWinograd,<unused>
256-28-28-1x1-1024-28-28-64-0x0-1x1-1x1-0-NCHW-FP16-F=miopenConvolutionFwdAlgoImplicitGEMM:ConvHipImplicitGemmV4R4GenFwdXdlops,0.296098,0,miopenConvolutionFwdAlgoImplicitGEMM,<unused>;miopenConvolutionFwdAlgoDirect:ConvAsm1x1U,1.09375,0,miopenConvolutionFwdAlgoDirect,<unused>;miopenConvolutionFwdAlgoWinograd:ConvBinWinogradRxS,4.29967,0,miopenConvolutionFwdAlgoWinograd,<unused>
256-28-28-1x1-21-28-28-64-0x0-1x1-1x1-0-NCHW-FP16-F=miopenConvolutionFwdAlgoWinograd:ConvBinWinogradRxS,0.198574,0,miopenConvolutionFwdAlgoWinograd,<unused>
256-28-28-3x3-256-28-28-64-1x1-1x1-1x1-0-NCHW-FP16-F=miopenConvolutionFwdAlgoImplicitGEMM:ConvHipImplicitGemmV4R4GenFwdXdlops,1.03825,0,miopenConvolutionFwdAlgoImplicitGEMM,<unused>;miopenConvolutionFwdAlgoWinograd:ConvBinWinogradRxS,1.08346,0,miopenConvolutionFwdAlgoWinograd,<unused>;miopenConvolutionFwdAlgoDirect:ConvOclDirectFwd,4.80862,0,miopenConvolutionFwdAlgoDirect,<unused>
256-28-28-3x3-256-28-28-64-2x2-1x1-2x2-0-NCHW-FP16-F=miopenConvolutionFwdAlgoImplicitGEMM:ConvHipImplicitGemmV4R4GenFwdXdlops,1.07071,0,miopenConvolutionFwdAlgoImplicitGEMM,<unused>
256-56-56-1x1-128-56-56-64-0x0-1x1-1x1-0-NCHW-FP16-F=miopenConvolutionFwdAlgoImplicitGEMM:ConvHipImplicitGemmV4R4GenFwdXdlops,0.192656,0,miopenConvolutionFwdAlgoImplicitGEMM,<unused>;miopenConvolutionFwdAlgoDirect:ConvAsm1x1U,0.476281,0,miopenConvolutionFwdAlgoDirect,<unused>;miopenConvolutionFwdAlgoWinograd:ConvBinWinogradRxS,2.01282,0,miopenConvolutionFwdAlgoWinograd,<unused>
256-56-56-1x1-512-28-28-64-0x0-2x2-1x1-0-NCHW-FP16-F=miopenConvolutionFwdAlgoImplicitGEMM:ConvHipImplicitGemmV4R4GenFwdXdlops,0.275861,0,miopenConvolutionFwdAlgoImplicitGEMM,<unused>;miopenConvolutionFwdAlgoDirect:ConvAsm1x1U,0.658884,25690112,miopenConvolutionFwdAlgoDirect,<unused>;miopenConvolutionFwdAlgoWinograd:ConvBinWinogradRxS,4.26503,0,miopenConvolutionFwdAlgoWinograd,<unused>
256-56-56-1x1-64-56-56-64-0x0-1x1-1x1-0-NCHW-FP16-F=miopenConvolutionFwdAlgoImplicitGEMM:ConvHipImplicitGemmV4R4GenFwdXdlops,0.159979,0,miopenConvolutionFwdAlgoImplicitGEMM,<unused>;miopenConvolutionFwdAlgoDirect:ConvAsm1x1U,0.255341,0,miopenConvolutionFwdAlgoDirect,<unused>;miopenConvolutionFwdAlgoWinograd:ConvBinWinogradRxS,1.08315,0,miopenConvolutionFwdAlgoWinograd,<unused>
3-224-224-7x7-64-112-112-64-3x3-2x2-1x1-0-NCHW-FP16-F=miopenConvolutionFwdAlgoDirect:ConvOclDirectFwdGen,1.66376,0,miopenConvolutionFwdAlgoDirect,<unused>
512-28-28-1x1-1024-28-28-64-0x0-1x1-1x1-0-NCHW-FP16-F=miopenConvolutionFwdAlgoImplicitGEMM:ConvHipImplicitGemmV4R4GenFwdXdlops,0.488361,0,miopenConvolutionFwdAlgoImplicitGEMM,<unused>;miopenConvolutionFwdAlgoDirect:ConvAsm1x1U,2.05601,0,miopenConvolutionFwdAlgoDirect,<unused>;miopenConvolutionFwdAlgoWinograd:ConvBinWinogradRxS,8.69327,0,miopenConvolutionFwdAlgoWinograd,<unused>
512-28-28-1x1-128-28-28-64-0x0-1x1-1x1-0-NCHW-FP16-F=miopenConvolutionFwdAlgoImplicitGEMM:ConvHipImplicitGemmV4R4GenFwdXdlops,0.096172,0,miopenConvolutionFwdAlgoImplicitGEMM,<unused>;miopenConvolutionFwdAlgoDirect:ConvAsm1x1U,0.288844,0,miopenConvolutionFwdAlgoDirect,<unused>;miopenConvolutionFwdAlgoWinograd:ConvBinWinogradRxS,1.18676,0,miopenConvolutionFwdAlgoWinograd,<unused>
512-28-28-1x1-2048-28-28-64-0x0-1x1-1x1-0-NCHW-FP16-F=miopenConvolutionFwdAlgoImplicitGEMM:ConvHipImplicitGemmV4R4GenFwdXdlops,0.990668,0,miopenConvolutionFwdAlgoImplicitGEMM,<unused>;miopenConvolutionFwdAlgoDirect:ConvAsm1x1U,4.10926,0,miopenConvolutionFwdAlgoDirect,<unused>;miopenConvolutionFwdAlgoWinograd:ConvBinWinogradRxS,17.8786,0,miopenConvolutionFwdAlgoWinograd,<unused>
512-28-28-1x1-256-28-28-64-0x0-1x1-1x1-0-NCHW-FP16-F=miopenConvolutionFwdAlgoImplicitGEMM:ConvHipImplicitGemmV4R4GenFwdXdlops,0.138665,0,miopenConvolutionFwdAlgoImplicitGEMM,<unused>;miopenConvolutionFwdAlgoDirect:ConvAsm1x1U,0.569484,0,miopenConvolutionFwdAlgoDirect,<unused>;miopenConvolutionFwdAlgoWinograd:ConvBinWinogradRxS,2.17707,0,miopenConvolutionFwdAlgoWinograd,<unused>
512-28-28-3x3-512-28-28-64-2x2-1x1-2x2-0-NCHW-FP16-F=miopenConvolutionFwdAlgoImplicitGEMM:ConvHipImplicitGemmV4R4GenFwdXdlops,3.94463,0,miopenConvolutionFwdAlgoImplicitGEMM,<unused>
512-28-28-3x3-512-28-28-64-4x4-1x1-4x4-0-NCHW-FP16-F=miopenConvolutionFwdAlgoImplicitGEMM:ConvHipImplicitGemmV4R4GenFwdXdlops,3.1414,0,miopenConvolutionFwdAlgoImplicitGEMM,<unused>
64-56-56-1x1-256-56-56-64-0x0-1x1-1x1-0-NCHW-FP16-F=miopenConvolutionFwdAlgoImplicitGEMM:ConvHipImplicitGemmV4R4GenFwdXdlops,0.153197,0,miopenConvolutionFwdAlgoImplicitGEMM,<unused>;miopenConvolutionFwdAlgoDirect:ConvAsm1x1U,0.285529,0,miopenConvolutionFwdAlgoDirect,<unused>;miopenConvolutionFwdAlgoWinograd:ConvBinWinogradRxS,1.15115,0,miopenConvolutionFwdAlgoWinograd,<unused>
64-56-56-1x1-64-56-56-64-0x0-1x1-1x1-0-NCHW-FP16-F=miopenConvolutionFwdAlgoImplicitGEMM:ConvHipImplicitGemmV4R4GenFwdXdlops,0.063571,0,miopenConvolutionFwdAlgoImplicitGEMM,<unused>;miopenConvolutionFwdAlgoDirect:ConvAsm1x1U,0.078818,0,miopenConvolutionFwdAlgoDirect,<unused>;miopenConvolutionFwdAlgoWinograd:ConvBinWinogradRxS,0.331465,0,miopenConvolutionFwdAlgoWinograd,<unused>
64-56-56-3x3-64-56-56-64-1x1-1x1-1x1-0-NCHW-FP16-F=miopenConvolutionFwdAlgoWinograd:ConvBinWinogradRxS,0.326876,0,miopenConvolutionFwdAlgoWinograd,<unused>;miopenConvolutionFwdAlgoImplicitGEMM:ConvHipImplicitGemmV4R4GenFwdXdlops,0.414866,0,miopenConvolutionFwdAlgoImplicitGEMM,<unused>;miopenConvolutionFwdAlgoDirect:ConvOclDirectFwd,1.42647,0,miopenConvolutionFwdAlgoDirect,<unused>
1024-28-28-1x1-2048-28-28-32-0x0-1x1-1x1-0-NCHW-FP16-F=miopenConvolutionFwdAlgoImplicitGEMM:ConvHipImplicitGemmV4R4GenFwdXdlops,0.938891,0,miopenConvolutionFwdAlgoImplicitGEMM,<unused>;miopenConvolutionFwdAlgoDirect:ConvAsm1x1U,4.11672,0,miopenConvolutionFwdAlgoDirect,<unused>;miopenConvolutionFwdAlgoWinograd:ConvBinWinogradRxS,18.8182,0,miopenConvolutionFwdAlgoWinograd,<unused>
1024-28-28-1x1-256-28-28-32-0x0-1x1-1x1-0-NCHW-FP16-F=miopenConvolutionFwdAlgoImplicitGEMM:ConvHipImplicitGemmV4R4GenFwdXdlops,0.144671,0,miopenConvolutionFwdAlgoImplicitGEMM,<unused>;miopenConvolutionFwdAlgoDirect:ConvAsm1x1U,0.576378,0,miopenConvolutionFwdAlgoDirect,<unused>;miopenConvolutionFwdAlgoWinograd:ConvBinWinogradRxS,2.43681,0,miopenConvolutionFwdAlgoWinograd,<unused>
1024-28-28-1x1-512-28-28-32-0x0-1x1-1x1-0-NCHW-FP16-F=miopenConvolutionFwdAlgoImplicitGEMM:ConvHipImplicitGemmV4R4GenFwdXdlops,0.245517,0,miopenConvolutionFwdAlgoImplicitGEMM,<unused>;miopenConvolutionFwdAlgoDirect:ConvAsm1x1U,1.10536,0,miopenConvolutionFwdAlgoDirect,<unused>;miopenConvolutionFwdAlgoWinograd:ConvBinWinogradRxS,4.66784,0,miopenConvolutionFwdAlgoWinograd,<unused>
128-28-28-3x3-128-28-28-32-1x1-1x1-1x1-0-NCHW-FP16-F=miopenConvolutionFwdAlgoImplicitGEMM:ConvHipImplicitGemmV4R4GenFwdXdlops,0.155958,0,miopenConvolutionFwdAlgoImplicitGEMM,<unused>;miopenConvolutionFwdAlgoWinograd:ConvBinWinogradRxS,0.172709,0,miopenConvolutionFwdAlgoWinograd,<unused>;miopenConvolutionFwdAlgoDirect:ConvOclDirectFwd,0.758427,0,miopenConvolutionFwdAlgoDirect,<unused>
128-28-28-1x1-512-28-28-32-0x0-1x1-1x1-0-NCHW-FP16-F=miopenConvolutionFwdAlgoImplicitGEMM:ConvHipImplicitGemmV4R4GenFwdXdlops,0.05815,0,miopenConvolutionFwdAlgoImplicitGEMM,<unused>;miopenConvolutionFwdAlgoDirect:ConvAsm1x1U,0.139813,0,miopenConvolutionFwdAlgoDirect,<unused>;miopenConvolutionFwdAlgoWinograd:ConvBinWinogradRxS,0.624085,0,miopenConvolutionFwdAlgoWinograd,<unused>
128-56-56-3x3-128-28-28-32-1x1-2x2-1x1-0-NCHW-FP16-F=miopenConvolutionFwdAlgoImplicitGEMM:ConvHipImplicitGemmV4R4GenFwdXdlops,0.167348,0,miopenConvolutionFwdAlgoImplicitGEMM,<unused>;miopenConvolutionFwdAlgoWinograd:ConvBinWinogradRxS,0.686165,0,miopenConvolutionFwdAlgoWinograd,<unused>;miopenConvolutionFwdAlgoDirect:ConvOclDirectFwdGen,1.58083,0,miopenConvolutionFwdAlgoDirect,<unused>
64-56-56-1x1-64-56-56-128-0x0-1x1-1x1-0-NCHW-BF16-F=miopenConvolutionFwdAlgoImplicitGEMM:ConvHipImplicitGemmV4R4GenFwdXdlops,0.135821,0,miopenConvolutionFwdAlgoImplicitGEMM,<unused>
128-28-28-1x1-512-28-28-128-0x0-1x1-1x1-0-NCHW-BF16-F=miopenConvolutionFwdAlgoImplicitGEMM:ConvHipImplicitGemmV4R4GenFwdXdlops,0.287868,0,miopenConvolutionFwdAlgoImplicitGEMM,<unused>
256-56-56-1x1-64-56-56-32-0x0-1x1-1x1-0-NCHW-BF16-F=miopenConvolutionFwdAlgoImplicitGEMM:ConvHipImplicitGemmV4R4GenFwdXdlops,0.094975,0,miopenConvolutionFwdAlgoImplicitGEMM,<unused>
512-28-28-1x1-256-28-28-64-0x0-1x1-1x1-0-NCHW-BF16-F=miopenConvolutionFwdAlgoImplicitGEMM:ConvHipImplicitGemmV4R4GenFwdXdlops,0.222768,0,miopenConvolutionFwdAlgoImplicitGEMM,<unused>
512-28-28-1x1-128-28-28-128-0x0-1x1-1x1-0-NCHW-BF16-F=miopenConvolutionFwdAlgoImplicitGEMM:ConvHipImplicitGemmV4R4GenFwdXdlops,0.230381,0,miopenConvolutionFwdAlgoImplicitGEMM,<unused>
64-56-56-1x1-64-56-56-64-0x0-1x1-1x1-0-NCHW-BF16-F=miopenConvolutionFwdAlgoImplicitGEMM:ConvHipImplicitGemmV4R4GenFwdXdlops,0.077768,0,miopenConvolutionFwdAlgoImplicitGEMM,<unused>
1024-14-14-1x1-256-14-14-128-0x0-1x1-1x1-0-NCHW-BF16-F=miopenConvolutionFwdAlgoImplicitGEMM:ConvHipImplicitGemmV4R4GenFwdXdlops,0.24017,0,miopenConvolutionFwdAlgoImplicitGEMM,<unused>
3-230-230-7x7-64-112-112-128-0x0-2x2-1x1-0-NCHW-BF16-F=miopenConvolutionFwdAlgoDirect:ConvOclDirectFwd,3.59607,0,miopenConvolutionFwdAlgoDirect,<unused>
512-7-7-1x1-2048-7-7-128-0x0-1x1-1x1-0-NCHW-BF16-F=miopenConvolutionFwdAlgoImplicitGEMM:ConvHipImplicitGemmV4R4GenFwdXdlops,0.307958,0,miopenConvolutionFwdAlgoImplicitGEMM,<unused>
64-56-56-3x3-64-56-56-32-1x1-1x1-1x1-0-NCHW-FP16-F=miopenConvolutionFwdAlgoWinograd:ConvBinWinogradRxS,0.184881,0,miopenConvolutionFwdAlgoWinograd,<unused>;miopenConvolutionFwdAlgoImplicitGEMM:ConvHipImplicitGemmV4R4GenFwdXdlops,0.250069,0,miopenConvolutionFwdAlgoImplicitGEMM,<unused>;miopenConvolutionFwdAlgoDirect:ConvOclDirectFwd,0.777567,0,miopenConvolutionFwdAlgoDirect,<unused>
512-28-28-1x1-256-28-28-32-0x0-1x1-1x1-0-NCHW-BF16-F=miopenConvolutionFwdAlgoImplicitGEMM:ConvHipImplicitGemmV4R4GenFwdXdlops,0.1273,0,miopenConvolutionFwdAlgoImplicitGEMM,<unused>
1024-14-14-1x1-512-7-7-128-0x0-2x2-1x1-0-NCHW-BF16-F=miopenConvolutionFwdAlgoImplicitGEMM:ConvHipImplicitGemmV4R4GenFwdXdlops,0.220034,0,miopenConvolutionFwdAlgoImplicitGEMM,<unused>
64-56-56-1x1-64-56-56-32-0x0-1x1-1x1-0-NCHW-FP16-F=miopenConvolutionFwdAlgoImplicitGEMM:ConvHipImplicitGemmV4R4GenFwdXdlops,0.033551,0,miopenConvolutionFwdAlgoImplicitGEMM,<unused>;miopenConvolutionFwdAlgoDirect:ConvAsm1x1U,0.045499,0,miopenConvolutionFwdAlgoDirect,<unused>;miopenConvolutionFwdAlgoWinograd:ConvBinWinogradRxS,0.189016,0,miopenConvolutionFwdAlgoWinograd,<unused>
512-28-28-1x1-128-28-28-32-0x0-1x1-1x1-0-NCHW-BF16-F=miopenConvolutionFwdAlgoImplicitGEMM:ConvHipImplicitGemmV4R4GenFwdXdlops,0.071354,0,miopenConvolutionFwdAlgoImplicitGEMM,<unused>
256-56-56-1x1-128-56-56-64-0x0-1x1-1x1-0-NCHW-BF16-F=miopenConvolutionFwdAlgoImplicitGEMM:ConvHipImplicitGemmV4R4GenFwdXdlops,0.234267,0,miopenConvolutionFwdAlgoImplicitGEMM,<unused>
256-56-56-1x1-64-56-56-64-0x0-1x1-1x1-0-NCHW-BF16-F=miopenConvolutionFwdAlgoImplicitGEMM:ConvHipImplicitGemmV4R4GenFwdXdlops,0.169427,0,miopenConvolutionFwdAlgoImplicitGEMM,<unused>
256-56-56-1x1-512-28-28-128-0x0-2x2-1x1-0-NCHW-BF16-F=miopenConvolutionFwdAlgoImplicitGEMM:ConvHipImplicitGemmV4R4GenFwdXdlops,0.877542,0,miopenConvolutionFwdAlgoImplicitGEMM,<unused>
64-56-56-1x1-256-56-56-64-0x0-1x1-1x1-0-NCHW-BF16-F=miopenConvolutionFwdAlgoImplicitGEMM:ConvHipImplicitGemmV4R4GenFwdXdlops,0.195434,0,miopenConvolutionFwdAlgoImplicitGEMM,<unused>
1024-14-14-1x1-2048-7-7-128-0x0-2x2-1x1-0-NCHW-BF16-F=miopenConvolutionFwdAlgoImplicitGEMM:ConvHipImplicitGemmV4R4GenFwdXdlops,0.776653,0,miopenConvolutionFwdAlgoImplicitGEMM,<unused>
512-28-28-3x3-512-28-28-32-4x4-1x1-4x4-0-NCHW-FP16-F=miopenConvolutionFwdAlgoImplicitGEMM:ConvHipImplicitGemmV4R4GenFwdXdlops,1.64332,0,miopenConvolutionFwdAlgoImplicitGEMM,<unused>
128-28-28-1x1-512-28-28-64-0x0-1x1-1x1-0-NCHW-BF16-F=miopenConvolutionFwdAlgoImplicitGEMM:ConvHipImplicitGemmV4R4GenFwdXdlops,0.156847,0,miopenConvolutionFwdAlgoImplicitGEMM,<unused>
512-28-28-3x3-512-28-28-32-2x2-1x1-2x2-0-NCHW-FP16-F=miopenConvolutionFwdAlgoImplicitGEMM:ConvHipImplicitGemmV4R4GenFwdXdlops,2.08788,0,miopenConvolutionFwdAlgoImplicitGEMM,<unused>
256-56-56-1x1-64-56-56-128-0x0-1x1-1x1-0-NCHW-BF16-F=miopenConvolutionFwdAlgoImplicitGEMM:ConvHipImplicitGemmV4R4GenFwdXdlops,0.321283,0,miopenConvolutionFwdAlgoImplicitGEMM,<unused>
512-28-28-1x1-256-28-28-32-0x0-1x1-1x1-0-NCHW-FP16-F=miopenConvolutionFwdAlgoImplicitGEMM:ConvHipImplicitGemmV4R4GenFwdXdlops,0.081112,0,miopenConvolutionFwdAlgoImplicitGEMM,<unused>;miopenConvolutionFwdAlgoDirect:ConvAsm1x1U,0.289252,0,miopenConvolutionFwdAlgoDirect,<unused>;miopenConvolutionFwdAlgoWinograd:ConvBinWinogradRxS,1.29119,0,miopenConvolutionFwdAlgoWinograd,<unused>
3-224-224-7x7-64-112-112-64-3x3-2x2-1x1-0-NCHW-BF16-F=miopenConvolutionFwdAlgoDirect:ConvOclDirectFwd,1.80438,0,miopenConvolutionFwdAlgoDirect,<unused>
512-28-28-1x1-2048-28-28-32-0x0-1x1-1x1-0-NCHW-FP16-F=miopenConvolutionFwdAlgoImplicitGEMM:ConvHipImplicitGemmV4R4GenFwdXdlops,0.504963,0,miopenConvolutionFwdAlgoImplicitGEMM,<unused>;miopenConvolutionFwdAlgoDirect:ConvAsm1x1U,2.0807,0,miopenConvolutionFwdAlgoDirect,<unused>;miopenConvolutionFwdAlgoWinograd:ConvBinWinogradRxS,9.22015,0,miopenConvolutionFwdAlgoWinograd,<unused>
2048-7-7-1x1-512-7-7-128-0x0-1x1-1x1-0-NCHW-BF16-F=miopenConvolutionFwdAlgoImplicitGEMM:ConvHipImplicitGemmV4R4GenFwdXdlops,0.348013,0,miopenConvolutionFwdAlgoImplicitGEMM,<unused>
256-56-56-1x1-128-28-28-128-0x0-2x2-1x1-0-NCHW-BF16-F=miopenConvolutionFwdAlgoImplicitGEMM:ConvHipImplicitGemmV4R4GenFwdXdlops,0.228043,0,miopenConvolutionFwdAlgoImplicitGEMM,<unused>
256-56-56-1x1-64-56-56-32-0x0-1x1-1x1-0-NCHW-FP16-F=miopenConvolutionFwdAlgoImplicitGEMM:ConvHipImplicitGemmV4R4GenFwdXdlops,0.086464,0,miopenConvolutionFwdAlgoImplicitGEMM,<unused>;miopenConvolutionFwdAlgoDirect:ConvAsm1x1U,0.136763,0,miopenConvolutionFwdAlgoDirect,<unused>;miopenConvolutionFwdAlgoWinograd:ConvBinWinogradRxS,0.594509,0,miopenConvolutionFwdAlgoWinograd,<unused>
128-28-28-1x1-512-28-28-32-0x0-1x1-1x1-0-NCHW-BF16-F=miopenConvolutionFwdAlgoImplicitGEMM:ConvHipImplicitGemmV4R4GenFwdXdlops,0.086023,0,miopenConvolutionFwdAlgoImplicitGEMM,<unused>
512-28-28-1x1-1024-14-14-128-0x0-2x2-1x1-0-NCHW-BF16-F=miopenConvolutionFwdAlgoImplicitGEMM:ConvHipImplicitGemmV4R4GenFwdXdlops,1.02988,0,miopenConvolutionFwdAlgoImplicitGEMM,<unused>
512-28-28-1x1-128-28-28-64-0x0-1x1-1x1-0-NCHW-BF16-F=miopenConvolutionFwdAlgoImplicitGEMM:ConvHipImplicitGemmV4R4GenFwdXdlops,0.131193,0,miopenConvolutionFwdAlgoImplicitGEMM,<unused>
256-56-56-1x1-512-28-28-64-0x0-2x2-1x1-0-NCHW-BF16-F=miopenConvolutionFwdAlgoImplicitGEMM:ConvHipImplicitGemmV4R4GenFwdXdlops,0.451194,0,miopenConvolutionFwdAlgoImplicitGEMM,<unused>
